number,value,datetime_start,datetime_complete,duration,params_alpha,params_booster,params_colsample_bytree,params_gamma,params_grow_policy,params_lambda,params_learning_rate,params_max_delta_step,params_max_depth,params_min_child_weight,params_n_estimators,params_normalize_type,params_params_decision_threshold,params_params_feature_fraction,params_params_resampling,params_params_sample_rows,params_params_scale_pos_weight,params_rate_drop,params_sample_type,params_skip_drop,params_subsample,user_attrs_acc_test,user_attrs_acc_val,user_attrs_decision_threshold,user_attrs_f1_test,user_attrs_f1_val,user_attrs_feature_fraction,user_attrs_pr_auc_test,user_attrs_pr_auc_val,user_attrs_prec_test,user_attrs_prec_val,user_attrs_rec_test,user_attrs_rec_val,user_attrs_resampling_strategy,user_attrs_roc_auc_test,user_attrs_roc_auc_val,user_attrs_sample_rows,state
1987,0.6840518006031577,2025-09-23 23:13:22.546552,2025-09-23 23:14:44.384623,0 days 00:01:21.838071,0.013468569325248812,dart,0.25703376540479544,0.6640054943276081,lossguide,0.0002572012129858441,0.016455633184683165,9,10,0.3492227138769421,1000,forest,0.5367115220454295,0.9276795683401008,none,0.9118446316593872,4.051727611193158,0.0650818153057653,weighted,0.8068244635097546,0.43856599305724264,0.8110349063363701,0.8176699426699426,0.5367115220454295,0.6737363025804171,0.6840518006031577,0.9276795683401008,0.7521693875445972,0.7492420255800781,0.5740963855421687,0.5842424242424242,0.8152266894781864,0.8249893025246042,none,0.8989362528763339,0.9021060508928613,0.9118446316593872,COMPLETE
1988,0.7206132879045997,2025-09-23 23:14:44.526947,2025-09-23 23:15:33.766490,0 days 00:00:49.239543,0.002478338039088721,dart,0.7210679404573538,7.674873453351432,lossguide,0.001277697493326174,0.008086942792644868,3,12,2.2930443933925813,800,forest,0.6545560390178925,0.989375181744917,none,0.9081189059174188,2.84522937296464,0.08679763341784105,weighted,0.7219636491555199,0.5514417922177833,0.8656976149042891,0.8656838656838657,0.6545560390178925,0.7215619694397284,0.7206132879045997,0.989375181744917,0.8266730157579539,0.8196042183892989,0.7160909856781803,0.7172530733361594,0.7271171941830624,0.72400513478819,none,0.9274316583972605,0.9251740747439559,0.9081189059174188,COMPLETE
1989,0.72248508537338,2025-09-23 23:15:33.906381,2025-09-23 23:15:35.481612,0 days 00:00:01.575231,0.0003623632595845287,gbtree,0.46471771411739776,1.7080920585939139,lossguide,0.3125817880336831,0.14497899547182977,0,9,1.7797694403685933,500,,0.6101830983354655,0.9722705465875311,none,0.956420239920269,3.0713941753304352,,,,0.8146738026374122,0.8579179035725253,0.8618959868959869,0.6101830983354655,0.7167346938775511,0.72248508537338,0.9722705465875311,0.8210860871106813,0.8148068613900925,0.6854020296643247,0.6957210776545166,0.7510692899914457,0.7513906718014548,none,0.9236072235251511,0.9211001375253962,0.956420239920269,COMPLETE
1990,0.6968732447107283,2025-09-23 23:15:35.623702,2025-09-23 23:15:37.517940,0 days 00:00:01.894238,0.0033925637737685834,gbtree,0.2689140137112555,0.10790192738818316,lossguide,0.16117023285698528,0.3537952836139488,3,8,8.903839648265294,500,,0.5381427207517998,0.9781104263733775,none,0.9301354303579745,4.75460188637466,,,,0.509612570399735,0.8286416214556249,0.8342547092547092,0.5381427207517998,0.6891942072038618,0.6968732447107283,0.9781104263733775,0.7842189636143406,0.7862534638461287,0.6089238845144357,0.6195073235685752,0.7938408896492729,0.7963200684638425,none,0.9081848702387602,0.9083854732689223,0.9301354303579745,COMPLETE
1991,0.6887643187911284,2025-09-23 23:15:37.660641,2025-09-23 23:15:38.658129,0 days 00:00:00.997488,0.0002808392960024432,gbtree,0.2884602796077864,3.6663364886686756,lossguide,0.4871760133980003,0.05911370867509938,2,11,4.709199837029973,500,,0.5876660721094644,0.9705069418904106,none,0.8521881300533672,1.2774499817617395,,,,0.9956055109023271,0.8711229399119664,0.8692669942669943,0.5876660721094644,0.6966995904601301,0.6887643187911284,0.9705069418904106,0.8274949744521045,0.8200554326267082,0.797573083287369,0.8001132502831257,0.6184773310521814,0.6046213093709885,none,0.9275839001966077,0.9257361420691528,0.8521881300533672,COMPLETE
1992,0.6959607909413554,2025-09-23 23:15:38.799243,2025-09-23 23:16:23.967836,0 days 00:00:45.168593,0.0016201924516547764,dart,0.3898927594316353,2.9107132700883733,depthwise,0.0006891140377662477,0.2367191401627026,1,6,0.25073452915637384,800,forest,0.3351860053175525,0.898294069458244,oversample,0.9866201279729283,0.610834125685538,0.08936301327958389,weighted,0.7458821209211615,0.9190269338880349,0.8103183539768656,0.8158271908271908,0.3351860053175525,0.6895627408276093,0.6959607909413554,0.898294069458244,0.8249731739638515,0.8186482357880717,0.5667860093638116,0.5751396648044693,0.8802395209580839,0.8810440735986307,oversample,0.9245645913317836,0.9224859003790513,0.9866201279729283,COMPLETE
1993,0.7080426000734484,2025-09-23 23:16:24.108812,2025-09-23 23:16:55.807272,0 days 00:00:31.698460,0.0433564928426421,dart,0.6434893257424749,1.451425426666036,lossguide,0.006818392159070851,0.08542159513827854,3,11,2.319694513901719,600,forest,0.6795768379669922,0.9411276417444917,oversample,0.9193353125141661,4.695158676405134,0.09864012970907156,weighted,0.648796007833102,0.823829219766078,0.8346811342000204,0.8372235872235873,0.6795768379669922,0.702851885924563,0.7080426000734484,0.9411276417444917,0.8179711804214947,0.814208582855117,0.6167258637391023,0.6201350916693471,0.8169375534644996,0.8249893025246042,oversample,0.9217272531469732,0.9207931915283711,0.9193353125141661,COMPLETE
1994,0.7170131523122614,2025-09-23 23:16:55.952469,2025-09-23 23:17:34.854143,0 days 00:00:38.901674,0.009033067812904402,dart,0.20603159463436418,0.4392071910592377,lossguide,0.0018310688944996475,0.015000009634651184,5,8,0.1467954742115316,700,forest,0.5647583852841802,0.953039700269793,none,0.7960746562994492,2.079138914884244,0.08378674094633023,weighted,0.7290707685508511,0.4291892465827295,0.8650834271675709,0.8634316134316135,0.5647583852841802,0.721588508660752,0.7170131523122614,0.953039700269793,0.8226927509679868,0.8146892311567168,0.7128547579298832,0.710980227177114,0.7305389221556886,0.7231493367565255,none,0.9259511140934003,0.9241835613647554,0.7960746562994492,COMPLETE
1995,0.6743011114853485,2025-09-23 23:17:34.997662,2025-09-23 23:17:37.613581,0 days 00:00:02.615919,0.00038055421012682833,gbtree,0.3944505004580771,3.6385764492489825,lossguide,0.19619259348314305,0.021100396638190376,2,8,1.7404010718572853,600,,0.5551233767154105,0.6894584447540795,none,0.907532455502031,4.797573373691642,,,,0.7919253932066432,0.7950660251816972,0.802006552006552,0.5551233767154105,0.6665556295802798,0.6743011114853485,0.6894584447540795,0.7511376871118584,0.7488127227634966,0.5458265139116203,0.555956678700361,0.8558597091531224,0.8566538296961917,none,0.8999737418870086,0.9016865301984938,0.907532455502031,COMPLETE
1996,0.670497127154634,2025-09-23 23:17:37.756173,2025-09-23 23:17:38.950225,0 days 00:00:01.194052,0.00012882092433117288,gbtree,0.6036193975400621,1.8140671191029645,lossguide,20.09421892669408,0.26090941778791454,2,8,0.7263960807286622,700,,0.6463269994025425,0.9732963163993923,none,0.899328101378625,1.2994822467166478,,,,0.6364714839557705,0.8666188965093664,0.86496723996724,0.6463269994025425,0.6785097458672589,0.670497127154634,0.9732963163993923,0.8132266986435859,0.8096016452165566,0.8017492711370262,0.8055222088835534,0.588109495295124,0.5742404792468977,none,0.9215265184493462,0.9197993671286605,0.899328101378625,COMPLETE
1997,0.7112086158755485,2025-09-23 23:17:39.092761,2025-09-23 23:17:47.025911,0 days 00:00:07.933150,0.0003879459751415485,gbtree,0.5115347663384975,0.3030853605817847,lossguide,0.09051661769744637,0.008135428319948646,0,10,1.5680149510786074,700,,0.57682062649103,0.9582530702810963,none,0.9910245406604399,2.8149854887645085,,,,0.8492112331349031,0.852492578564848,0.8517608517608518,0.57682062649103,0.7158351409978309,0.7112086158755485,0.9582530702810963,0.818801293539303,0.8139859955560433,0.6641053787047201,0.6660440791931266,0.7763045337895638,0.762943945228926,none,0.9211607640017272,0.9212818405726926,0.9910245406604399,COMPLETE
1998,0.6805732484076433,2025-09-23 23:17:47.168049,2025-09-23 23:17:49.697132,0 days 00:00:02.529083,0.002743612168909223,gbtree,0.4880380501879688,3.2533493026103844,lossguide,0.3833835114724746,0.022394277367606928,0,11,1.4202746882748398,600,,0.6519324824231115,0.9443666865326724,undersample,0.9281793389097103,4.122576028218448,,,,0.7962370074364018,0.7927116388576108,0.7946355446355446,0.6519324824231115,0.6794364413487415,0.6805732484076433,0.9443666865326724,0.824138967102353,0.8158807034027264,0.539331490324202,0.5419731169160538,0.9178785286569717,0.9144201968335472,undersample,0.9268388650923539,0.9233237037340307,0.9281793389097103,COMPLETE
1999,0.72103974383123,2025-09-23 23:17:49.841275,2025-09-23 23:17:51.781218,0 days 00:00:01.939943,0.00016341418345792636,gbtree,0.2040919044944361,2.462085797998721,lossguide,0.04632275875739121,0.06784278133014027,2,12,1.4723595540472634,600,,0.6142231722219471,0.9969003268086827,none,0.9060906910314939,4.4501967337357815,,,,0.8980911295152946,0.8479885351622479,0.8483824733824734,0.6142231722219471,0.7203916399924685,0.72103974383123,0.9969003268086827,0.8293255494639267,0.8228866277682667,0.6434577867473932,0.6440107671601615,0.8182207014542344,0.8189987163029525,none,0.9283832415911011,0.9266539281630625,0.9060906910314939,COMPLETE
2000,0.6953080836630865,2025-09-23 23:17:51.923940,2025-09-23 23:17:53.029424,0 days 00:00:01.105484,0.002578064595781622,gbtree,0.5659323432802049,1.6321263056288835,lossguide,0.3440579557014789,0.18887289886859018,4,9,6.312489161304012,600,,0.5502702320978735,0.8067994527709527,none,0.9637288766203911,3.0467702847728377,,,,0.9409909277195244,0.8353976865595251,0.8344594594594594,0.5502702320978735,0.7010040907400521,0.6953080836630865,0.8067994527709527,0.7988290032338272,0.7880105614791924,0.6200657894736842,0.6212121212121212,0.8062446535500428,0.7894736842105263,none,0.9166121589222502,0.9113829257409503,0.9637288766203911,COMPLETE
2001,0.7178510192417603,2025-09-23 23:17:53.170764,2025-09-23 23:17:57.414550,0 days 00:00:04.243786,0.16085683432709488,dart,0.9568601788837444,6.361623668690926,lossguide,0.13135406161419488,0.06542506028298599,3,10,0.19829060588588832,200,forest,0.6542456472587176,0.959958957035828,none,0.9991000159632504,4.525095664473623,0.06829110689967885,weighted,0.8056464399387641,0.7620170682769628,0.8449175964786569,0.8483824733824734,0.6542456472587176,0.7135564378899603,0.7178510192417603,0.959958957035828,0.8249269802981849,0.8219085952585906,0.6394442561843443,0.646978021978022,0.8071000855431993,0.8061617458279846,none,0.9268460311052157,0.9256559002068785,0.9991000159632504,COMPLETE
2002,0.7276498651732006,2025-09-23 23:17:57.554338,2025-09-23 23:17:59.026173,0 days 00:00:01.471835,0.00011900614737060964,gbtree,0.5848532642356213,2.9057051671843843,lossguide,0.28197373125688224,0.05015470256636798,2,7,0.47267944966913744,400,,0.6534403825304519,0.9757683776385667,none,0.918476064742062,3.2234436471574512,,,,0.8139932834961898,0.8650834271675709,0.8655814905814906,0.6534403825304519,0.7283594394064303,0.7276498651732006,0.9757683776385667,0.8293458156723484,0.8241117401838715,0.7028639618138425,0.7061191626409018,0.7557741659538066,0.7505348737697903,none,0.9281554544754427,0.9265731392626166,0.918476064742062,COMPLETE
2003,0.7152806226956165,2025-09-23 23:17:59.168189,2025-09-23 23:17:59.945033,0 days 00:00:00.776844,0.00012034409484257989,gbtree,0.5294134533055509,4.614016242367779,lossguide,0.3908017305418571,0.04942514918638589,1,5,0.6505217214205696,200,,0.6411648306380552,0.9607741295875798,none,0.9549075851736538,3.1352359359541806,,,,0.7384312484048272,0.8587368205548163,0.8576986076986077,0.6411648306380552,0.7181372549019608,0.7152806226956165,0.9607741295875798,0.8237590581208798,0.8158279142634145,0.6872556684910086,0.6860510805500982,0.7519247219846023,0.7471116816431322,none,0.925745486937193,0.9238621908348995,0.9549075851736538,COMPLETE
2004,0.7177510768533213,2025-09-23 23:18:00.088089,2025-09-23 23:18:01.746514,0 days 00:00:01.658425,0.00027525530919147697,gbtree,0.5658708390203411,1.319769620980711,lossguide,1.9880131129088043,0.03401713541912211,4,7,1.2869965148819515,400,,0.6316248516291377,0.9106474585158787,none,0.9550730280900487,2.031829239033468,,,,0.7835821813193837,0.8732725969904801,0.8725429975429976,0.6316248516291377,0.7216726618705036,0.7177510768533213,0.9106474585158787,0.8290014244335202,0.8237366447463151,0.7606635071090048,0.7632594021215043,0.6864841745081266,0.6773641420624733,none,0.9274748847077746,0.9264554396813545,0.9550730280900487,COMPLETE
2005,0.709105242412298,2025-09-23 23:18:01.887887,2025-09-23 23:18:53.634260,0 days 00:00:51.746373,0.3038711945455503,dart,0.3748529532830705,0.9776526603735072,lossguide,0.00038800013218098827,0.004004783024927807,9,9,0.10497708147969846,800,forest,0.5108865592168175,0.9620308074882918,none,0.8690785059781888,2.182232961197306,0.13079736014700116,weighted,0.7714007723104032,0.2246944386883396,0.8522878493192753,0.8488943488943489,0.5108865592168175,0.7172251616696061,0.709105242412298,0.9620308074882918,0.8120903661464387,0.8039224962830904,0.6618444846292948,0.6572890025575447,0.7827202737382378,0.7697903294822422,none,0.9219440753995787,0.9200446993527156,0.8690785059781888,COMPLETE
2006,0.6659452774771989,2025-09-23 23:18:53.776861,2025-09-23 23:19:44.175086,0 days 00:00:50.398225,0.43386887554900977,dart,0.2892078817996778,3.8683661681903994,lossguide,0.00018989018685670636,0.0047234818281488376,7,12,0.6176360274378695,800,tree,0.4174755247920667,0.9824201105900003,oversample,0.9045314619532437,1.1086070120222586,0.12108862386847774,weighted,0.816491815181311,0.2955640636669068,0.7726481727914832,0.7787674037674037,0.4174755247920667,0.6604494725577129,0.6659452774771989,0.9824201105900003,0.8012512993013039,0.7929102181072718,0.5139186295503212,0.521297192642788,0.9238665526090676,0.9216944801026957,oversample,0.9185163325808156,0.9166098754670482,0.9045314619532437,COMPLETE
2007,0.6885138456496804,2025-09-23 23:19:44.316963,2025-09-23 23:19:45.250905,0 days 00:00:00.933942,0.0003357378676709112,gbtree,0.31713187011791233,1.450780179748044,lossguide,0.12201672131061504,0.2663730028954246,0,11,25.61178351690433,400,,0.655113614038591,0.9503112365913843,oversample,0.985871500133538,3.4735102003220066,,,,0.9160775142043766,0.8015149964172382,0.8053849303849304,0.655113614038591,0.6851761649618444,0.6885138456496804,0.9503112365913843,0.8158419893689512,0.811930794546424,0.5522114629678094,0.557886351566649,0.9024807527801539,0.8990158322635858,oversample,0.9232648377620443,0.9221169375282985,0.985871500133538,COMPLETE
2008,0.669389037223182,2025-09-23 23:19:45.397094,2025-09-23 23:20:39.609569,0 days 00:00:54.212475,0.061931096523955835,dart,0.34861141018631364,0.4622534887644011,lossguide,0.0001589832182846894,0.006567829605796245,7,11,0.12292400610052588,800,forest,0.5298711750219187,0.8905831672609368,undersample,0.8419835774986189,2.221955210483854,0.14726314401991936,weighted,0.6599060661543514,0.4002449999590665,0.7838059166751971,0.7845004095004094,0.5298711750219187,0.6712328767123288,0.669389037223182,0.8905831672609368,0.8010808610102174,0.7910426627913407,0.5276554087126775,0.5287841191066998,0.9221556886227545,0.9118528027385537,undersample,0.9199322676522494,0.9167172676975054,0.8419835774986189,COMPLETE
2009,0.7081870264276474,2025-09-23 23:20:39.753232,2025-09-23 23:20:41.553643,0 days 00:00:01.800411,0.00011884444681944614,gbtree,0.6378415463867616,3.7958576547102196,lossguide,1.0966026418879191,0.03422969005346118,1,8,0.7727456654719329,400,,0.6147056576202039,0.927699136954287,none,0.9177758850931915,4.401294370737912,,,,0.8919389992894236,0.8392875422254069,0.8383497133497133,0.6147056576202039,0.7115031238515251,0.7081870264276474,0.927699136954287,0.8241206831318975,0.815852128423333,0.6237113402061856,0.623292127521145,0.8280581693755347,0.819854514334617,none,0.9249533691138976,0.9219764063012579,0.9177758850931915,COMPLETE
2010,0.6968325791855203,2025-09-23 23:20:41.697214,2025-09-23 23:20:43.986263,0 days 00:00:02.289049,0.0024285039548578324,gbtree,0.47327384940579326,2.2130900194088152,lossguide,1.6374936740744146,0.03995542194311101,3,10,1.303743612320168,300,,0.40268482983134574,0.9954161726094024,none,0.9770034844466813,3.491586218728575,,,,0.8588197871104666,0.8106254478452247,0.8148034398034398,0.40268482983134574,0.6940125702944095,0.6968325791855203,0.9954161726094024,0.8293086212779586,0.8242480646815546,0.5658036677454154,0.5727272727272728,0.8973481608212147,0.889602053915276,none,0.9282100485573637,0.9269085600360284,0.9770034844466813,COMPLETE
2011,0.6537139441040203,2025-09-23 23:20:44.128263,2025-09-23 23:21:19.781119,0 days 00:00:35.652856,0.002000759184254802,dart,0.5204679471974012,3.9922293008124945,depthwise,0.0019250785316697464,0.2188846181894923,2,12,8.568473049955722,700,forest,0.49607468391124643,0.9713914019424824,oversample,0.9002419883258747,2.9472236946332373,0.09626536899597274,weighted,0.6225884456056285,0.4139550063681976,0.7513563312519194,0.7627968877968878,0.49607468391124643,0.6413701461686107,0.6537139441040203,0.9713914019424824,0.813617182095197,0.8059976033256671,0.48974069898534384,0.5022967386311438,0.9289991445680068,0.9358151476251605,oversample,0.9187384214211867,0.9180102643939133,0.9002419883258747,COMPLETE
2012,0.7224859732412603,2025-09-23 23:21:19.921280,2025-09-23 23:21:20.685935,0 days 00:00:00.764655,0.0007661362302486445,gbtree,0.5666518374122514,3.100466370100507,lossguide,0.008295702465109947,0.22956505597610438,4,6,0.31547128572281696,400,,0.6451347803864514,0.9992559898527444,none,0.8006947977659109,2.5323770339189595,,,,0.944349282850764,0.8667212611321528,0.8683456183456183,0.6451347803864514,0.7216759298845661,0.7224859732412603,0.9992559898527444,0.8259267405986569,0.8185604291892705,0.7213675213675214,0.7287766652154984,0.7219846022241232,0.7163029525032092,none,0.9271803011429129,0.9247261656476498,0.8006947977659109,COMPLETE
2013,0.6965418457131164,2025-09-23 23:21:20.827092,2025-09-23 23:21:22.265021,0 days 00:00:01.437929,0.002966789665914103,gbtree,0.7912985310887403,0.9312159069476595,lossguide,0.006386945304097836,0.3718589429920992,5,6,2.5844196474848196,500,,0.5981532571382308,0.9788579642034042,none,0.8482822924816207,4.306282249117171,,,,0.8503471407853432,0.8415395639267069,0.8481777231777232,0.5981532571382308,0.6834355828220859,0.6965418457131164,0.9788579642034042,0.786401852775885,0.7898617283200848,0.6547805642633229,0.6674509803921569,0.7147134302822925,0.7282841249465126,none,0.9063975687819239,0.9081130770511325,0.8482822924816207,COMPLETE
2014,0.6726124117428465,2025-09-23 23:21:22.408905,2025-09-23 23:21:23.247609,0 days 00:00:00.838704,0.00044594951509432056,gbtree,0.43895012067212597,3.13755106973217,lossguide,0.0009854143506225497,0.1854854985183664,4,8,0.3177584018925332,400,,0.645176807150344,0.8681052100487248,none,0.8784764771424148,4.267934599233102,,,,0.9939292958259787,0.8120585525642338,0.8196150696150696,0.645176807150344,0.6629955947136564,0.6726124117428465,0.8681052100487248,0.7419290215667897,0.7384112126848539,0.5807073954983922,0.5944170771756979,0.7724550898203593,0.7744972186563971,none,0.8915119469809443,0.8953025083657972,0.8784764771424148,COMPLETE
2015,0.7093345656192237,2025-09-23 23:21:23.392007,2025-09-23 23:21:24.560780,0 days 00:00:01.168773,0.0001926547481409147,gbtree,0.31604771243414703,2.775331420986911,lossguide,0.0036874666344880254,0.03195384351482512,5,5,0.15550450018872283,500,,0.6601949241007111,0.9832552915039808,none,0.8777443097309674,2.1937600124981524,,,,0.8246138503548771,0.8733749616132664,0.8712121212121212,0.6601949241007111,0.7137236750752141,0.7093345656192237,0.9832552915039808,0.8302823700053199,0.8234801969084568,0.7776096822995462,0.7709693621295831,0.6595380667236954,0.6568249893025246,none,0.9285319723319378,0.92703052075673,0.8777443097309674,COMPLETE
2016,0.6320677410543567,2025-09-23 23:21:24.706160,2025-09-23 23:21:25.466376,0 days 00:00:00.760216,0.05019091666403541,gbtree,0.47844425235975585,3.7064359185930034,lossguide,0.01027155529150004,0.08532231272471182,4,7,0.7804698466534203,200,,0.6907975883630765,0.955080247456705,none,0.7450710736863122,1.2065107336406873,,,,0.8030588184329969,0.8657999795270754,0.8621007371007371,0.6907975883630765,0.6446191379777717,0.6320677410543567,0.955080247456705,0.8270886596019624,0.819872523198262,0.8800888230940045,0.8738670694864048,0.5085543199315654,0.49507916131792895,none,0.9269360523430905,0.9249100856391137,0.7450710736863122,COMPLETE
2017,0.714448669201521,2025-09-23 23:21:25.608312,2025-09-23 23:21:26.345024,0 days 00:00:00.736712,0.00010926608868247387,gbtree,0.5160035257895826,2.8662940125389684,lossguide,0.00031603930426080703,0.2833393457198662,3,4,0.1428256021918185,500,,0.578333931992789,0.8990772267384444,none,0.6867521990209925,3.329736026034389,,,,0.8933224604329393,0.8456341488381616,0.8462325962325963,0.578333931992789,0.7167543200601052,0.714448669201521,0.8990772267384444,0.8213465343316546,0.8179545804088437,0.6389819156061621,0.6428327061238454,0.8160821214713431,0.8040222507488233,none,0.9249587508183355,0.9234746862692901,0.6867521990209925,COMPLETE
