number,value,datetime_start,datetime_complete,duration,params_alpha,params_booster,params_colsample_bytree,params_gamma,params_grow_policy,params_lambda,params_learning_rate,params_max_delta_step,params_max_depth,params_min_child_weight,params_n_estimators,params_normalize_type,params_params_decision_threshold,params_params_feature_fraction,params_params_resampling,params_params_sample_rows,params_params_scale_pos_weight,params_rate_drop,params_sample_type,params_skip_drop,params_subsample,user_attrs_acc_test,user_attrs_acc_val,user_attrs_decision_threshold,user_attrs_f1_test,user_attrs_f1_val,user_attrs_feature_fraction,user_attrs_pr_auc_test,user_attrs_pr_auc_val,user_attrs_prec_test,user_attrs_prec_val,user_attrs_rec_test,user_attrs_rec_val,user_attrs_resampling_strategy,user_attrs_roc_auc_test,user_attrs_roc_auc_val,user_attrs_sample_rows,state
1373,0.7192118226600985,2025-09-23 18:07:48.082457,2025-09-23 18:08:57.021165,0 days 00:01:08.938708,0.000807583020148893,dart,0.5736860216529047,9.496872233294402,depthwise,0.04344338691689744,0.23279752641010173,2,10,1.1553924148565426,900,forest,0.6089734138824104,0.9535614227353542,none,0.7236961161997428,2.322252395908093,0.2601988165820327,uniform,0.8705001003738019,0.9592472634735171,0.8656976149042891,0.8657862407862408,0.6089734138824104,0.7201365187713311,0.7192118226600985,0.9535614227353542,0.8245797269545743,0.8184592480474739,0.7182978723404255,0.7199828473413379,0.7219846022241232,0.7184424475823705,none,0.9263011551152265,0.924722710669726,0.7236961161997428,COMPLETE
1374,0.6157994068482071,2025-09-23 18:08:57.170147,2025-09-23 18:09:11.239054,0 days 00:00:14.068907,0.0002715993976880076,dart,0.9841055248924977,8.773159330813952,depthwise,0.00144299877122137,0.0864880455699435,0,12,3.783264705182452,400,forest,0.6849437189377542,0.8656838165244038,none,0.9995262288323592,1.3231817045467273,0.16524564245140438,uniform,0.5173535241016184,0.5660831444867223,0.8594533729143208,0.8541154791154791,0.6849437189377542,0.6337690050680181,0.6157994068482071,0.8656838165244038,0.8048864668704996,0.7922098344921209,0.8419560595322466,0.8323615160349854,0.5081266039349872,0.488660676080445,none,0.919442100860854,0.9143976531025961,0.9995262288323592,COMPLETE
1375,0.7096660187312246,2025-09-23 18:09:11.472615,2025-09-23 18:09:20.165962,0 days 00:00:08.693347,0.000938047836415391,dart,0.5059800744605787,2.8528453404150853,depthwise,0.0008128071172355738,0.1315303933158404,5,3,0.18876898923208846,300,forest,0.30839266179623065,0.9860867062544696,none,0.6494405849383721,1.3613799436620049,0.1191682906120087,uniform,0.8941135527490142,0.8419989997816415,0.8316101955164296,0.8317977067977068,0.30839266179623065,0.7105402076368116,0.7096660187312246,0.9860867062544696,0.8266847920882334,0.8206664190118735,0.6035874439461884,0.6044551475015051,0.8635585970915313,0.8592212237911853,none,0.9268603343517707,0.9258932283987438,0.6494405849383721,COMPLETE
1376,0.6712435637384927,2025-09-23 18:09:20.418954,2025-09-23 18:10:06.233250,0 days 00:00:45.814296,0.011967497209489692,dart,0.7106722341008012,9.336322114247393,depthwise,0.004038792599048787,0.014068095520470648,8,11,0.1505883143562304,800,forest,0.6998779671499462,0.8411831640580313,undersample,0.6884044257537427,4.723293875236311,0.06838089216006189,uniform,0.7458101891116288,0.7512672038641176,0.7833964581840516,0.7842956592956593,0.6998779671499462,0.6719379844961241,0.6712435637384927,0.8411831640580313,0.8167631076985309,0.8093251648584343,0.5269941634241245,0.5282416502946955,0.9268605645851155,0.920410783055199,undersample,0.9239357089500564,0.9216303326792485,0.6884044257537427,COMPLETE
1377,0.7182804674457429,2025-09-23 18:10:06.368382,2025-09-23 18:10:18.628460,0 days 00:00:12.260078,0.00017603137973812592,dart,0.9315552059594321,5.750569158651089,depthwise,0.005893098537165153,0.24277553698472543,3,12,2.4777273399768034,400,forest,0.665840980960308,0.9845583765923398,none,0.9174454062714587,3.2754975874538017,0.09775288118136863,uniform,0.6135254128148273,0.35347167804116947,0.8561777049851571,0.8617936117936118,0.665840980960308,0.7080822771660087,0.7182804674457429,0.9845583765923398,0.8112718027469907,0.8052611657701805,0.6884848484848485,0.7010183299389002,0.7288280581693756,0.7364142062473257,none,0.9201790490188664,0.9176702081917872,0.9174454062714587,COMPLETE
1378,0.6699151210311223,2025-09-23 18:10:18.764062,2025-09-23 18:10:35.952371,0 days 00:00:17.188309,0.020269852252881863,dart,0.5922608501829578,6.296535428929724,depthwise,0.023664811353124992,0.4327449770485947,3,12,0.23547225494458685,500,forest,0.6899179134966222,0.9304853946365083,undersample,0.7629485480645828,4.880444330366784,0.17872399952939794,uniform,0.6554035162401755,0.7245930558063959,0.7849319275258471,0.785012285012285,0.6899179134966222,0.6719750195160031,0.6699151210311223,0.9304853946365083,0.818427669227773,0.809651677586597,0.5291369559872141,0.5294409937888199,0.9204448246364414,0.9118528027385537,undersample,0.9238074689769202,0.9210183985060215,0.7629485480645828,COMPLETE
1379,0.7126613991135093,2025-09-23 18:10:36.086874,2025-09-23 18:11:01.789049,0 days 00:00:25.702175,0.0003016828200230808,dart,0.8857599229922092,4.659685546454724,lossguide,0.0002493302067480084,0.006805288523776442,0,11,0.16254929141641727,500,forest,0.6664651533399586,0.9548898963338005,none,0.9960667709235654,4.618844511387009,0.08994877280459987,uniform,0.682035550507983,0.744243340687372,0.8468625243115979,0.8473587223587223,0.6664651533399586,0.7128598848368523,0.7126613991135093,0.9548898963338005,0.8228619029251486,0.8165918125709936,0.6465877437325905,0.6483169705469846,0.7942686056458511,0.7911852802738554,none,0.9246200775679162,0.922908472970585,0.9960667709235654,COMPLETE
1380,0.7136019146390108,2025-09-23 18:11:01.924378,2025-09-23 18:11:08.848599,0 days 00:00:06.924221,0.0031370137924598613,dart,0.9568839007304862,7.540247975015859,lossguide,0.04652236890066541,0.4818693697096005,1,12,7.655354374087443,300,forest,0.6984291896232576,0.8741269111718947,none,0.7675951899995606,4.411650742913967,0.18309908172836586,uniform,0.7660123306177913,0.578605563945888,0.8510594738458389,0.852989352989353,0.6984291896232576,0.7137517214243557,0.7136019146390108,0.8741269111718947,0.8176032836261038,0.8139845366091335,0.6608378870673952,0.6682853940978708,0.7758768177929855,0.7655113393239196,none,0.9241858862585114,0.9212486439931438,0.7675951899995606,COMPLETE
1381,0.6627930274494089,2025-09-23 18:11:08.984773,2025-09-23 18:11:41.972415,0 days 00:00:32.987642,0.031505442042708096,dart,0.47013155348635044,6.745655538609841,lossguide,0.003325153063267661,0.4466042588512683,1,10,0.14866960749604935,700,forest,0.6925057828249098,0.8773470226277827,none,0.7547955441497504,3.7686159817774088,0.11603908219748925,uniform,0.8976373248137531,0.8816871712091567,0.8285392568328386,0.8277027027027027,0.6925057828249098,0.6689068985965606,0.6627930274494089,0.8773470226277827,0.7166475442981806,0.709302030869783,0.6218302094818081,0.6232102486812359,0.7236954662104362,0.707744972186564,none,0.8916260276033664,0.8902135850077452,0.7547955441497504,COMPLETE
1382,0.7070435172723194,2025-09-23 18:11:42.105343,2025-09-23 18:11:43.341288,0 days 00:00:01.235945,0.0007099352773110477,gbtree,0.9079580943898986,1.8332349071186624,depthwise,0.004248573844778232,0.0042329372645056535,1,11,0.27886443770524444,300,,0.5421737853750458,0.9760413655383066,none,0.7224992926626004,2.074443471335808,,,,0.2577017540777904,0.8646739686764254,0.8662981162981163,0.5421737853750458,0.7051739518287243,0.7070435172723194,0.9760413655383066,0.7884128218224993,0.7785371300886202,0.7367194780987885,0.7430457331447431,0.676218990590248,0.6743688489516474,none,0.9151624371074448,0.9129726474580259,0.7224992926626004,COMPLETE
1383,0.7132237871674492,2025-09-23 18:11:43.477757,2025-09-23 18:11:50.480848,0 days 00:00:07.003091,0.0005337994908241174,dart,0.9400412383810282,5.946292216199411,depthwise,16.392919587434672,0.08676983403541899,0,10,17.538909423580485,300,forest,0.5861718542762177,0.9621818813091717,none,0.9913474520124806,2.866273790474332,0.06305911588271622,uniform,0.749723510126825,0.6983362006936283,0.8516736615825571,0.8499180999181,0.5861718542762177,0.7183673469387755,0.7132237871674492,0.9621818813091717,0.8220768502829298,0.8126546616424397,0.6583541147132169,0.6569369369369369,0.7904191616766467,0.7800599058622165,none,0.9250987902504008,0.9223885275845726,0.9913474520124806,COMPLETE
1384,0.7141989062183512,2025-09-23 18:11:50.618515,2025-09-23 18:11:52.209608,0 days 00:00:01.591093,0.00016056434595453314,gbtree,0.7948102688220822,7.307469275814647,lossguide,0.0006692947746191948,0.03942478499581552,0,11,1.2543109464253133,600,,0.6983621385196156,0.8574444674304171,none,0.8997003067575396,4.215126838194434,,,,0.8148908012416061,0.8590439144231754,0.8555487305487306,0.6983621385196156,0.7237713139418255,0.7141989062183512,0.8574444674304171,0.8203993581949083,0.8162554494395982,0.6815262561390253,0.678076923076923,0.7715996578272027,0.7543859649122807,none,0.9252283540652704,0.9227870017050892,0.8997003067575396,COMPLETE
1385,0.7162267080745341,2025-09-23 18:11:52.345136,2025-09-23 18:12:01.368654,0 days 00:00:09.023518,0.007226219302744948,dart,0.7538101166465833,1.3323803272175603,lossguide,0.0017983113847325496,0.10372362799963086,6,12,8.498403646668248,300,forest,0.6211389478347626,0.961029783514855,none,0.9140765753275193,4.481445969801861,0.1020755939878018,uniform,0.5408187227403721,0.5498625752260724,0.8507523799774798,0.8503276003276004,0.6211389478347626,0.7185328185328186,0.7162267080745341,0.961029783514855,0.8188292395009859,0.8107997620503351,0.6548205489092188,0.655417406749556,0.7959794696321643,0.7894736842105263,none,0.9240556029644384,0.9202984098982353,0.9140765753275193,COMPLETE
1386,0.6259134345137718,2025-09-23 18:12:01.501661,2025-09-23 18:12:50.421176,0 days 00:00:48.919515,0.0004449089677362136,dart,0.5088678003374525,2.549816648894647,lossguide,0.0001878248345183916,0.0046239005054073586,6,9,0.5273212240650964,800,forest,0.3106603141429399,0.9010234139823976,oversample,0.7759844201039483,1.4728621676994746,0.12643710695264845,uniform,0.6578304512998624,0.22492462755114434,0.7216705906438735,0.7274774774774775,0.3106603141429399,0.6210452961672474,0.6259134345137718,0.9010234139823976,0.7960784459233173,0.7848011865478295,0.4606160843498036,0.4659970705168445,0.9529512403763901,0.952931108258451,oversample,0.917559914486731,0.9141649027564793,0.7759844201039483,COMPLETE
1387,0.6803262383131092,2025-09-23 18:12:50.555902,2025-09-23 18:12:52.141594,0 days 00:00:01.585692,0.007960278734151909,gbtree,0.6426306549119796,1.1335953792155695,lossguide,0.00016884961940938454,0.4041343477889765,8,8,0.1683982781602635,400,,0.3886532745386324,0.8565979421119064,none,0.6907094352162664,3.3538660080449754,,,,0.5735351023919082,0.8303818200429931,0.8354832104832105,0.3886532745386324,0.6727236816116927,0.6803262383131092,0.8565979421119064,0.7658773206153072,0.7739597255510979,0.624954128440367,0.6356877323420075,0.7284003421727973,0.7317073170731707,none,0.8966799373166695,0.9004577960914641,0.6907094352162664,COMPLETE
1388,0.720355349555813,2025-09-23 18:12:52.279595,2025-09-23 18:13:26.980195,0 days 00:00:34.700600,0.0005552245751661876,dart,0.5507452740440395,9.254851758107643,depthwise,0.011075545979370521,0.043105152515830886,2,11,0.16787494358123572,700,forest,0.6544457091130169,0.9148745219723562,none,0.8414264093429604,4.200742925914938,0.12532056560665422,uniform,0.7263574428451796,0.9139014369530999,0.8496263691268298,0.8517608517608518,0.6544457091130169,0.7184205482077822,0.720355349555813,0.9148745219723562,0.8279232853226484,0.8216450373952212,0.6509204584925321,0.656458993312214,0.8015397775876818,0.7980316645271716,none,0.9281906513980518,0.9263072787113993,0.8414264093429604,COMPLETE
1389,0.6823258869908015,2025-09-23 18:13:27.114625,2025-09-23 18:14:23.818755,0 days 00:00:56.704130,0.0013688989022711117,dart,0.2959546205346725,1.4266859799310052,lossguide,0.008604696315428137,0.006316382432031193,7,12,0.36165275122905155,800,forest,0.4430694041497847,0.9624400597522246,oversample,0.9137820726851127,1.1992322964572621,0.10058099031340728,uniform,0.6778900459158428,0.7012215142110677,0.7971133176374245,0.802006552006552,0.4430694041497847,0.6771986970684039,0.6823258869908015,0.9624400597522246,0.8050504256182922,0.7980057318562807,0.5468174644923725,0.5537190082644629,0.8892215568862275,0.8887462558836114,oversample,0.917658943604227,0.9169860361884752,0.9137820726851127,COMPLETE
1390,0.7173377156943304,2025-09-23 18:14:23.953852,2025-09-23 18:14:36.856524,0 days 00:00:12.902672,0.0002850491160044732,dart,0.981304394475849,0.9880674878756279,depthwise,0.000785550461812775,0.05719055158970248,0,12,0.32212544178568286,400,forest,0.6480469076107055,0.9869356528313167,none,0.9375576148491118,4.5704965765493295,0.18599151612374615,uniform,0.5886474132540728,0.9159720360396951,0.8575084450813799,0.8591318591318591,0.6480469076107055,0.7138157894736842,0.7173377156943304,0.9869356528313167,0.8202660410291842,0.8139107311549507,0.6872525732383215,0.6898459107072303,0.7425149700598802,0.7471116816431322,none,0.9230990409745133,0.9210897725916256,0.9375576148491118,COMPLETE
1391,0.7153707052441229,2025-09-23 18:14:36.991258,2025-09-23 18:14:47.788841,0 days 00:00:10.797583,0.00013925773908666757,dart,0.8627763509704387,0.7816179312366596,depthwise,0.2262875325369372,0.2133442649403125,4,3,1.0340899322452441,400,tree,0.3258978634829472,0.9780037088569693,none,0.9673453036351944,1.4380282374380715,0.09293305818532938,uniform,0.6073332457320169,0.7370501204440674,0.8365236974101751,0.8388615888615889,0.3258978634829472,0.7145665773011618,0.7153707052441229,0.9780037088569693,0.8292063149575422,0.8225801033614044,0.6137549892539147,0.6194801127466333,0.8550042771599657,0.8463842533162174,none,0.9282815647901383,0.9265945601257427,0.9673453036351944,COMPLETE
1392,0.7101501072194425,2025-09-23 18:14:47.926914,2025-09-23 18:15:23.463607,0 days 00:00:35.536693,0.00468836992879795,dart,0.49635308228948033,9.92872845904161,depthwise,0.04058072748062603,0.011068006105380394,6,8,0.4039735040990698,700,forest,0.5837590874348706,0.9598539564947056,none,0.9764581906810407,4.1765719213269,0.06208073355955728,uniform,0.6144343984054711,0.7373885715170201,0.8309960077797113,0.833947583947584,0.5837590874348706,0.7074251284777601,0.7101501072194425,0.9598539564947056,0.8267410808840161,0.8193634778158919,0.6039334341906203,0.609696225836146,0.853721129170231,0.8502353444587077,none,0.927492958025353,0.9255164630561802,0.9764581906810407,COMPLETE
1393,0.6992955135335558,2025-09-23 18:15:23.597680,2025-09-23 18:16:09.311104,0 days 00:00:45.713424,0.0010565644291355325,dart,0.5330226137247238,7.68778814379949,depthwise,0.0016372694180780347,0.0368680296364425,1,11,0.5368466967390148,800,forest,0.651770401649676,0.808534381064282,none,0.7914774354485016,4.61049663019477,0.05956761246855716,uniform,0.717442231590854,0.8567141087226509,0.8373426143924659,0.833947583947584,0.651770401649676,0.7075280692066998,0.6992955135335558,0.808534381064282,0.8081685795663391,0.7961863387042281,0.6210016155088853,0.6169447170428525,0.8220701454234388,0.8070175438596491,none,0.9210588857465873,0.9167865687963554,0.7914774354485016,COMPLETE
1394,0.7202173069460613,2025-09-23 18:16:09.449576,2025-09-23 18:16:28.509639,0 days 00:00:19.060063,0.08568085402687814,dart,0.6821943272774779,0.8240742579463534,lossguide,0.0004992734701749223,0.050477509436632095,2,7,0.13938354496145763,500,forest,0.37653390787761754,0.9966581226435066,none,0.7231471809430949,1.2541122432637801,0.12207035393692146,uniform,0.5603362459821721,0.6061957976037785,0.8530044016787798,0.8523751023751024,0.37653390787761754,0.7219209914794733,0.7202173069460613,0.9966581226435066,0.8293554519898854,0.8240395815660222,0.659589525831564,0.6588569400070997,0.7972626176218991,0.7941805733846812,none,0.9278443516680808,0.9261382151250065,0.7231471809430949,COMPLETE
1395,0.7135135135135136,2025-09-23 18:16:28.645627,2025-09-23 18:16:46.628639,0 days 00:00:17.983012,0.018223878254400708,dart,0.7022118328288783,0.5663535181248123,lossguide,0.0005088179407211029,0.08315947520502265,3,6,0.29437024721724725,500,forest,0.37126930943722863,0.8679449171586507,none,0.6395105149587357,1.1917770211113934,0.14324171200450184,uniform,0.5379262277439781,0.5991892233434468,0.8514689323369843,0.8535012285012284,0.37126930943722863,0.7131844237991698,0.7135135135135136,0.8679449171586507,0.8156688486220138,0.8123005247163648,0.6629915472252849,0.6704288939051919,0.7715996578272027,0.7625160462130937,none,0.9198322312638695,0.9200289792031635,0.6395105149587357,COMPLETE
1396,0.5995336018655926,2025-09-23 18:16:46.764187,2025-09-23 18:16:47.628460,0 days 00:00:00.864273,0.0010947952455264253,gbtree,0.5899738863192441,0.21698687488863339,lossguide,0.00033101983050079747,0.32730953149801784,10,5,0.14283707600854542,300,,0.3567704534525841,0.8167048810755495,none,0.6465743299614445,0.7035231330721982,,,,0.22569541692823303,0.8023339133995291,0.8066134316134316,0.3567704534525841,0.5952630475791238,0.5995336018655926,0.8167048810755495,0.6127113803664426,0.6283443532825954,0.5836415947390053,0.5941176470588235,0.6073567151411463,0.6050492083868207,none,0.8499843268650427,0.8519113542494242,0.6465743299614445,COMPLETE
1397,0.7218804920913884,2025-09-23 18:16:47.764522,2025-09-23 18:16:48.669279,0 days 00:00:00.904757,0.10728624113406018,gbtree,0.8314802163875689,3.0817157917363263,lossguide,0.00037285569469033277,0.03672066535231381,9,7,0.3311293434790652,200,,0.3439222095077322,0.977662651987256,none,0.9466911124246636,0.6814849329952005,,,,0.6724055510848268,0.8686661889650936,0.8703931203931204,0.3439222095077322,0.7182077750933451,0.7218804920913884,0.977662651987256,0.8273422435893403,0.8216122163064099,0.7381489841986456,0.7417607223476298,0.6993156544054747,0.7030380830124091,none,0.9267196617780069,0.9246729014046615,0.9466911124246636,COMPLETE
1398,0.6885690093141406,2025-09-23 18:16:48.804682,2025-09-23 18:17:14.269701,0 days 00:00:25.465019,0.009285325435224904,dart,0.6001820219251892,0.41806578423886787,depthwise,0.0020980196930904566,0.04108520210964712,6,8,0.16178901549476743,600,forest,0.3175745544944384,0.9021943526894315,oversample,0.536428367041718,0.6188579257876571,0.1408930671374209,uniform,0.4351756107155574,0.6656928917248603,0.8123656464325929,0.8117321867321867,0.3175745544944384,0.692501258178158,0.6885690093141406,0.9021943526894315,0.818181728906596,0.8134058475429142,0.5696936240684516,0.5697869955156951,0.8828058169375534,0.8699186991869918,oversample,0.9228034501387674,0.9201284249843964,0.536428367041718,COMPLETE
1399,0.6556762832521543,2025-09-23 18:17:14.405624,2025-09-23 18:17:15.337626,0 days 00:00:00.932002,7.245869461666634,gbtree,0.7191819242042404,2.924285098775256,lossguide,0.0005148437020058269,0.010983147047909883,9,6,0.30498448918880616,200,,0.34132417847607677,0.9283402702115162,none,0.8753171874657998,1.1977487061293879,,,,0.8887935864494676,0.8100112601085065,0.8118345618345618,0.34132417847607677,0.658195211786372,0.6556762832521543,0.9283402702115162,0.726459911729078,0.7195505814616633,0.5779430789133247,0.583138953682106,0.7643284858853722,0.7488232777064613,none,0.8849749603969866,0.8860759610294613,0.8753171874657998,COMPLETE
1400,0.7087045921864291,2025-09-23 18:17:15.476869,2025-09-23 18:17:16.652393,0 days 00:00:01.175524,0.3517210622814859,gbtree,0.8642459836677525,0.7237826956597759,lossguide,0.00012002211695260739,0.08180198938669285,9,8,0.30732703629134117,200,,0.3497265369847615,0.9166231427522008,none,0.8199851718301695,0.5497427055435695,,,,0.7269973389853861,0.8692803767018119,0.8694717444717445,0.3497265369847615,0.7071772529236414,0.7087045921864291,0.9166231427522008,0.8187526159983534,0.8180301774105097,0.7622343054869006,0.7602941176470588,0.6595380667236954,0.6636713735558408,none,0.9221210960626759,0.9215477874983582,0.8199851718301695,COMPLETE
1401,0.7051029543419874,2025-09-23 18:17:16.788645,2025-09-23 18:17:50.648789,0 days 00:00:33.860144,0.0003025747937669361,dart,0.4191115435084618,7.363063753609336,depthwise,0.048474497916392446,0.01284102081535081,4,10,0.6594394340401942,700,forest,0.6874717748085898,0.9361651377056303,undersample,0.8131772404835333,1.9042175494667093,0.13912162539971218,uniform,0.49032119539649904,0.969835295885993,0.8305865492885659,0.8313882063882064,0.6874717748085898,0.7065082461429332,0.7051029543419874,0.9361651377056303,0.8165900739191432,0.810176963320413,0.6034534989397152,0.6062192118226601,0.8520102651839179,0.842533162173727,undersample,0.9234965388445671,0.9216889809295008,0.8131772404835333,COMPLETE
1402,0.6752674638137193,2025-09-23 18:17:50.785201,2025-09-23 18:18:25.356419,0 days 00:00:34.571218,0.012591379641459101,dart,0.8177931741790425,1.6324442881607344,lossguide,0.0039014196618208457,0.05250231793530901,4,7,0.1507426562363032,700,forest,0.3643312536146495,0.9050277090014764,undersample,0.7985625752882368,1.0530542506879554,0.16154406998172768,uniform,0.5375054223846301,0.31417038812125975,0.7838059166751971,0.7886977886977887,0.3643312536146495,0.6710280373831776,0.6752674638137193,0.9050277090014764,0.8124083809169336,0.8087342560468684,0.5276825085742283,0.533963672555362,0.9213002566295979,0.9182712879760376,undersample,0.9219350675199576,0.9215709358504459,0.7985625752882368,COMPLETE
