number,value,datetime_start,datetime_complete,duration,params_alpha,params_booster,params_colsample_bytree,params_gamma,params_grow_policy,params_lambda,params_learning_rate,params_max_delta_step,params_max_depth,params_min_child_weight,params_n_estimators,params_normalize_type,params_params_decision_threshold,params_params_feature_fraction,params_params_resampling,params_params_sample_rows,params_params_scale_pos_weight,params_rate_drop,params_sample_type,params_skip_drop,params_subsample,user_attrs_acc_test,user_attrs_acc_val,user_attrs_decision_threshold,user_attrs_f1_test,user_attrs_f1_val,user_attrs_feature_fraction,user_attrs_pr_auc_test,user_attrs_pr_auc_val,user_attrs_prec_test,user_attrs_prec_val,user_attrs_rec_test,user_attrs_rec_val,user_attrs_resampling_strategy,user_attrs_roc_auc_test,user_attrs_roc_auc_val,user_attrs_sample_rows,state
1010,0.6934097421203438,2025-09-23 16:17:10.634291,2025-09-23 16:17:28.092319,0 days 00:00:17.458028,3.1404366754241964,dart,0.4350655590024083,1.7555347855571988,lossguide,1.6845597228068425,0.48861271647153637,0,9,0.1492198288102779,500,forest,0.3302175713036576,0.9276851628790787,none,0.7510198293882109,0.6221433922148106,0.13307635402719797,weighted,0.8390854831307386,0.7292554333439156,0.8634455932029891,0.8575962325962326,0.3302175713036576,0.7070707070707071,0.6934097421203438,0.9276851628790787,0.8023710555795519,0.7889701727643859,0.7265342960288809,0.715,0.688622754491018,0.6730851519041506,none,0.918191386993589,0.9130808746414814,0.7510198293882109,COMPLETE
1011,0.6796501072784288,2025-09-23 16:17:28.224182,2025-09-23 16:17:37.809682,0 days 00:00:09.585500,0.024819655683073486,dart,0.38306919643815535,2.619489177892424,lossguide,0.19538521316513077,0.013093886175238496,8,11,0.12087441589070957,300,forest,0.6050304359081288,0.7523124309817528,oversample,0.9354103329106608,1.986768719460854,0.3562782369762123,uniform,0.7885801871636503,0.9923401322694161,0.7972156822602109,0.8012899262899262,0.6050304359081288,0.677519127462152,0.6796501072784288,0.7523124309817528,0.7982384559704162,0.789762037251188,0.5469119579500658,0.5531972058033315,0.8900769888793841,0.8810440735986307,oversample,0.91609468070031,0.914254991305836,0.9354103329106608,COMPLETE
1012,0.7125489388007418,2025-09-23 16:17:37.940971,2025-09-23 16:17:50.450195,0 days 00:00:12.509224,0.041651886102288954,dart,0.812303263871217,2.637983637852086,depthwise,0.0009884090874014157,0.048803352565768496,2,11,38.03717047614852,400,forest,0.6472103157511276,0.9007636024946919,none,0.7773135457906903,3.0711340451316747,0.16034950606767995,weighted,0.865884324628957,0.6460991840173568,0.8582249974408844,0.8571867321867321,0.6472103157511276,0.7150792018103271,0.7125489388007418,0.9007636024946919,0.8114079378406942,0.8048544463982514,0.6888624653190646,0.6872019077901431,0.7433704020530368,0.7398373983739838,none,0.9208931465173925,0.9181265819840061,0.7773135457906903,COMPLETE
1013,0.6964525407478428,2025-09-23 16:17:50.582965,2025-09-23 16:17:51.392485,0 days 00:00:00.809520,7.133483483544402,gbtree,0.35362004275252606,8.625438661623702,depthwise,0.0026077396772205747,0.07954733970248479,6,11,10.14488327069501,1000,,0.6606799301554903,0.8894042238787649,oversample,0.5504866371233118,1.4132057729344956,,,,0.5476587842873435,0.8393899068481933,0.8379402129402129,0.6606799301554903,0.7010859211278339,0.6964525407478428,0.8894042238787649,0.8023022630397473,0.7943006133924899,0.6320851940913775,0.6309937456567061,0.7869974337040205,0.7770646127513907,oversample,0.9144206540491887,0.9133909301186376,0.5504866371233118,COMPLETE
1014,0.7065801668211307,2025-09-23 16:17:51.528166,2025-09-23 16:17:53.334285,0 days 00:00:01.806119,0.03655368543780409,gbtree,0.9940770795126737,1.680471768422811,lossguide,0.0009054271388098332,0.010824125775066213,0,5,1.840548316985466,1000,,0.6496219833569987,0.7267426448996887,oversample,0.8702621318378447,1.3845278155862866,,,,0.611090717411901,0.8356024158050978,0.8379402129402129,0.6496219833569987,0.7023721275018532,0.7065801668211307,0.7267426448996887,0.8163907641283144,0.8104955446447516,0.6196860693263571,0.6232831916285154,0.8105218135158255,0.8155755241762944,oversample,0.920833055614361,0.9196626651688187,0.8702621318378447,COMPLETE
1015,0.704225352112676,2025-09-23 16:17:53.467285,2025-09-23 16:17:57.048616,0 days 00:00:03.581331,0.0012979128648138026,dart,0.9810108328810248,3.5353691443888073,depthwise,0.0025712259629632494,0.040990622547175025,1,10,27.673863537616242,200,forest,0.675748194457898,0.878234689144039,none,0.8048837866122452,4.548703568959085,0.17473269718326653,weighted,0.8648760029542657,0.7483958602406316,0.8477838059166752,0.8430589680589681,0.675748194457898,0.7131005209338221,0.704225352112676,0.878234689144039,0.814036576825983,0.8053425944143924,0.6495606326889279,0.6412508784258608,0.7904191616766467,0.7809157038938811,none,0.9222475805065571,0.9185501046944685,0.8048837866122452,COMPLETE
1016,0.6968224299065421,2025-09-23 16:17:57.178735,2025-09-23 16:17:58.782086,0 days 00:00:01.603351,0.06711046995233005,gbtree,0.9829643217682084,8.342591594754225,depthwise,0.001137224325843711,0.003884083438179912,3,11,4.13016207397576,600,,0.43132827795881484,0.9800881946043197,none,0.9370786857571358,1.8890926884602846,,,,0.6058387204955841,0.8333503941037977,0.833947583947584,0.43132827795881484,0.6991869918699187,0.6968224299065421,0.9800881946043197,0.8094762830795184,0.8008061097914808,0.6154847104749512,0.6186525058081647,0.8092386655260907,0.7976037655113393,none,0.9161932205719479,0.9139620379694012,0.9370786857571358,COMPLETE
1017,0.7060998151571165,2025-09-23 16:17:58.913001,2025-09-23 16:18:03.473743,0 days 00:00:04.560742,0.003346287034827322,gbtree,0.37748397748237733,5.351826884844249,lossguide,3.322366606327237,0.0040627772905179015,3,12,2.198278805853067,1000,,0.6649673542635064,0.9035299745125024,none,0.5394418882553673,3.457230366243167,,,,0.9671597562742222,0.8569966219674481,0.8535012285012284,0.6649673542635064,0.714256494170587,0.7060998151571165,0.9035299745125024,0.8104570644746885,0.8027860892014425,0.684437475499804,0.6789099526066351,0.7467921300256629,0.7355584082156611,none,0.9207994415459984,0.9191191683499608,0.5394418882553673,COMPLETE
1018,0.6948308432079684,2025-09-23 16:18:03.606296,2025-09-23 16:18:21.312621,0 days 00:00:17.706325,0.007511346975825888,dart,0.34557891186690903,4.14541413950999,lossguide,1.2524618076840448,0.24454250427490462,5,10,3.85033228106161,500,forest,0.3810425016617329,0.8219131526041314,none,0.8817014087743871,2.119459907516188,0.19182545974211213,weighted,0.7772610860643747,0.7749401082567204,0.8162555020984748,0.818079443079443,0.3810425016617329,0.6943640388217266,0.6948308432079684,0.8219131526041314,0.8150822490815495,0.8124521673204373,0.5768033946251768,0.5803212851405622,0.8721129170230967,0.8656397090286693,none,0.9212440509142625,0.9203036211566032,0.8817014087743871,COMPLETE
1019,0.7162714636140638,2025-09-23 16:18:21.443883,2025-09-23 16:18:34.581236,0 days 00:00:13.137353,0.0004084137754551025,dart,0.22305275472438882,1.84496110720174,lossguide,0.0002342619037085097,0.060437334513788896,4,9,0.22093333140626803,400,forest,0.5669741805248427,0.8017983867972891,none,0.8538697784225121,2.455535010644208,0.12687670320191788,weighted,0.8875696283343112,0.2902413143424606,0.8548469648889344,0.8579033579033579,0.5669741805248427,0.7157177225340818,0.7162714636140638,0.8017983867972891,0.8163912842464193,0.8115666857728423,0.6735849056603773,0.6857142857142857,0.7634730538922155,0.7496790757381258,none,0.9231312736428061,0.9212877716181279,0.8538697784225121,COMPLETE
1020,0.7137577002053388,2025-09-23 16:18:34.712774,2025-09-23 16:18:54.146770,0 days 00:00:19.433996,0.0004249769780731725,dart,0.35238035635021053,2.944860783050198,lossguide,0.0004264507922510192,0.029551289761493918,4,9,0.1027751625959092,500,forest,0.4667220994446637,0.8475454325756013,none,0.8923876500094272,1.598006386120995,0.03502727889753775,weighted,0.8899682849707227,0.21998196914681695,0.8593510082915344,0.8572891072891073,0.4667220994446637,0.7209585702680747,0.7137577002053388,0.8475454325756013,0.8150196863345649,0.8089513967154789,0.6863882443928848,0.6861429135412555,0.7591958939264328,0.7436884895164741,none,0.9201189581158348,0.9195039953076795,0.8923876500094272,COMPLETE
1021,0.692801467216873,2025-09-23 16:18:54.276198,2025-09-23 16:19:06.337759,0 days 00:00:12.061561,0.00015523445297543713,dart,0.34346405360302434,4.938948896962797,lossguide,0.01699726951607134,0.020299909894151816,5,9,0.19986256797781934,400,forest,0.5123112422145291,0.824215279303639,none,0.882616973668351,1.374903497063914,0.06884003684028331,weighted,0.8584962721365035,0.20107791253929969,0.8643668748080663,0.8628173628173628,0.5123112422145291,0.6990688167158755,0.692801467216873,0.824215279303639,0.8097201420526932,0.8039371224232945,0.7452784503631962,0.7461728395061729,0.6582549187339607,0.6465554129225503,none,0.9157743110008139,0.9156362338967079,0.882616973668351,COMPLETE
1022,0.6958128078817734,2025-09-23 16:19:06.470380,2025-09-23 16:19:24.454963,0 days 00:00:17.984583,0.002090862626314769,dart,0.874561963461933,6.027823723933267,lossguide,1.9024019098872633,0.05620896530442951,10,6,0.8626772684603532,500,forest,0.6778354723438516,0.8949247351934999,none,0.6028425755473397,3.343819434531042,0.005149871031888506,weighted,0.8905898631235684,0.524981296629275,0.8514689323369843,0.8482800982800983,0.6778354723438516,0.7055003044448954,0.6958128078817734,0.8949247351934999,0.795891905635898,0.7839690777823933,0.6713016608729239,0.6686390532544378,0.7433704020530368,0.7252888318356868,none,0.9143882487058872,0.9101932328844567,0.6028425755473397,COMPLETE
1023,0.7114890251137038,2025-09-23 16:19:24.584776,2025-09-23 16:19:41.885678,0 days 00:00:17.300902,0.005931994219294025,dart,0.580725525986379,6.671519129425731,lossguide,1.2324074765903124,0.06739054513272755,4,4,5.499958312319858,500,forest,0.6398066977905917,0.9974884288960303,oversample,0.5558781387663896,1.1484644910360793,0.14121675634218794,weighted,0.8962449605161692,0.6192402840215645,0.8494216398812571,0.8506347256347256,0.6398066977905917,0.7121893954216396,0.7114890251137038,0.9974884288960303,0.8194400427320081,0.8113328806794335,0.6563288856833754,0.6613970588235294,0.7784431137724551,0.7697903294822422,oversample,0.9240107650205097,0.9223971074464161,0.5558781387663896,COMPLETE
1024,0.6753029669870455,2025-09-23 16:19:42.018290,2025-09-23 16:20:03.821644,0 days 00:00:21.803354,0.00029147194523870145,dart,0.2725851927989281,0.05398417023227209,lossguide,0.001394814747581875,0.4520346107461745,6,9,0.33400302549713473,500,forest,0.6317447218137706,0.9428872627125058,none,0.9640592364751621,3.622829882783599,0.10080424306672382,weighted,0.8777018878461623,0.32775374474608615,0.8428703040229297,0.8409090909090909,0.6317447218137706,0.6813369317002284,0.6753029669870455,0.9428872627125058,0.7653329137482454,0.7662252393009187,0.6619604679306171,0.6598611678236015,0.7018819503849444,0.691484809584938,none,0.8974500966346908,0.8956251745123744,0.9640592364751621,COMPLETE
1025,0.7104,2025-09-23 16:20:03.954017,2025-09-23 16:20:10.500691,0 days 00:00:06.546674,0.0015187417010012504,dart,0.5246590971589273,7.718990670440621,lossguide,0.12685384555045076,0.06773063051175585,1,3,2.337716236858731,300,forest,0.6739442196176001,0.9864952686076646,oversample,0.6687257939168011,1.2980890437837116,0.1570399285727632,weighted,0.8684449170325887,0.5152731617729729,0.8522878493192753,0.8517608517608518,0.6739442196176001,0.7142008318478906,0.7104,0.9864952686076646,0.8166767589907951,0.8082201720900337,0.6650682405016599,0.6669170108899737,0.7711719418306244,0.7599486521181001,oversample,0.9226128744874862,0.9210101065590048,0.6687257939168011,COMPLETE
1026,0.6912222833058457,2025-09-23 16:20:10.633319,2025-09-23 16:20:35.176996,0 days 00:00:24.543677,0.01103939788951832,dart,0.6033686796838943,4.615337725128761,lossguide,0.7059645784943264,0.010692168726955723,2,3,0.4848616706612838,600,forest,0.6534148490285614,0.8882863347085599,oversample,0.5139389227265113,1.4484028535077909,0.16554808747580882,weighted,0.8666932146563892,0.38454384876794667,0.8243423072985976,0.8274979524979525,0.6534148490285614,0.6898047722342733,0.6912222833058457,0.8882863347085599,0.7963549400133817,0.7856809859691471,0.5973700688791485,0.6044871794871794,0.8160821214713431,0.8070175438596491,oversample,0.9135430045382446,0.9106697031315979,0.5139389227265113,COMPLETE
1027,0.6978649989217166,2025-09-23 16:20:35.311228,2025-09-23 16:21:24.744787,0 days 00:00:49.433559,0.2934175507222016,dart,0.5278152369994749,0.8271908604430376,depthwise,0.000615104528995531,0.007463397675968037,5,12,4.2492694544888385,800,forest,0.45108435424373416,0.8408508053044262,none,0.6085256353485469,1.124307344031277,0.14650702791930204,weighted,0.8760592233064947,0.8373371329921785,0.8592486436687481,0.8565724815724816,0.45108435424373416,0.7060081248663673,0.6978649989217166,0.8408508053044262,0.8002729372754127,0.7935754424672272,0.7058572039333049,0.7034782608695652,0.7061591103507271,0.6923406076166024,none,0.9172894190855846,0.9145714960751162,0.6085256353485469,COMPLETE
1028,0.6944683784249526,2025-09-23 16:21:24.877305,2025-09-23 16:21:36.262527,0 days 00:00:11.385222,0.00034676026841074095,dart,0.6851418774491994,9.135061601123006,lossguide,16.16514634450741,0.16963237138014794,5,5,2.4841196581857123,400,forest,0.5969516548688489,0.8999954935183235,oversample,0.5163478785598434,1.5771456482671868,0.22666882113675238,weighted,0.8924985682617643,0.7689002652035491,0.8109325417135838,0.8184889434889435,0.5969516548688489,0.6848660638116363,0.6944683784249526,0.8999954935183235,0.8129400392321291,0.8062083002349525,0.569684927618507,0.5813618003462204,0.8584260051325919,0.8622165169020112,oversample,0.9209988236227239,0.9189136547464747,0.5163478785598434,COMPLETE
1029,0.6938852304797742,2025-09-23 16:21:36.393601,2025-09-23 16:21:39.665867,0 days 00:00:03.272266,0.0015233541333629105,dart,0.24141063403861052,9.707525627476858,lossguide,0.1447889487351364,0.14009535484248153,2,4,1.6512462912764527,200,forest,0.6386481250189054,0.9604354644150882,oversample,0.7277472427388533,1.391290500981447,0.09652363601627462,weighted,0.8983340188321451,0.3514729860981812,0.8356024158050978,0.8334357084357085,0.6386481250189054,0.7022617723396366,0.6938852304797742,0.9604354644150882,0.8083508721315473,0.8011172165735487,0.6197643979057592,0.6192075218267293,0.8100940975192472,0.789045785194694,oversample,0.917695349251897,0.9164550636645904,0.7277472427388533,COMPLETE
1030,0.6741429029157321,2025-09-23 16:21:39.798937,2025-09-23 16:21:45.563315,0 days 00:00:05.764378,1.0941803113706294,gbtree,0.6361333390654593,1.062758453537396,lossguide,0.13246166603886164,0.006245188371220593,8,11,0.21217308605475188,500,,0.31570537456084813,0.8125396491515576,none,0.9832724174378337,1.987802261415231,,,,0.45247110022445214,0.785750844508138,0.7917690417690417,0.31570537456084813,0.6664541832669323,0.6741429029157321,0.8125396491515576,0.805120829515805,0.7981112017252925,0.5311150622301245,0.5387964148527529,0.8943541488451668,0.9002995293110826,none,0.9164897611202418,0.913541336824243,0.9832724174378337,COMPLETE
1031,0.6545454545454545,2025-09-23 16:21:45.695676,2025-09-23 16:21:53.237332,0 days 00:00:07.541656,0.5058541307497375,dart,0.43945943439258084,0.7503046024888106,lossguide,0.5957519813897966,0.28536772145031647,3,8,0.4846068231923177,300,forest,0.40755174291677077,0.7692989080425942,none,0.711694997689374,0.8366263152837587,0.1434181978960748,weighted,0.7186728283064551,0.2528865582040417,0.8361142389190296,0.8385544635544635,0.40755174291677077,0.6556248655624866,0.6545454545454545,0.7692989080425942,0.7286072493403732,0.7237755452995187,0.6594547814798788,0.670556552962298,0.6518391787852865,0.6392811296534018,none,0.8863562453500059,0.8900644163358957,0.711694997689374,COMPLETE
1032,0.7046979865771812,2025-09-23 16:21:53.370195,2025-09-23 16:23:09.517910,0 days 00:01:16.147715,0.0002140582023144422,dart,0.7717403597871508,3.052709880445218,lossguide,0.01533839410910554,0.043970447071574596,6,12,18.89192166676228,1000,forest,0.6085138065875473,0.9197692242703417,oversample,0.9037642661103839,2.172070645270949,0.09856371700956117,weighted,0.732741861560357,0.9192483954197799,0.8233186610707339,0.8288288288288288,0.6085138065875473,0.6979348967448372,0.7046979865771812,0.9197692242703417,0.8196875194229242,0.8144795067774373,0.5906398104265402,0.6,0.8528656971770744,0.8536585365853658,oversample,0.9236155407047373,0.9223229981699558,0.9037642661103839,COMPLETE
1033,0.6153037075992638,2025-09-23 16:23:09.650941,2025-09-23 16:23:15.178625,0 days 00:00:05.527684,0.048070603627933146,gbtree,0.8086788823918474,7.991802639412219,lossguide,11.485179738313525,0.0006161168969124966,2,12,0.3701786803933167,900,,0.6486541013911921,0.9690350916231946,none,0.605956105338665,3.5549999665948113,,,,0.7919797796201851,0.8587368205548163,0.8502252252252253,0.6486541013911921,0.6413721413721414,0.6153037075992638,0.9690350916231946,0.7881293369751659,0.7782709103323281,0.8172185430463577,0.7980900409276944,0.5278015397775877,0.5006418485237484,none,0.9115204333820391,0.908894074810752,0.605956105338665,COMPLETE
1034,0.6993521274732971,2025-09-23 16:23:15.309737,2025-09-23 16:23:18.845178,0 days 00:00:03.535441,0.45996299426930376,dart,0.7675246522724671,3.7267741874780773,depthwise,0.18397743453770848,0.09349540745122446,0,8,15.904595203438916,200,forest,0.5684219275613906,0.9235483932718221,none,0.8610194160945667,4.727416801373983,0.14312333305367247,weighted,0.8899749866053291,0.40202684501585306,0.8203500870099294,0.8242219492219492,0.5684219275613906,0.6961038961038961,0.6993521274732971,0.9235483932718221,0.813638800990224,0.8079965152893701,0.5848123363398312,0.5918790752815649,0.8597091531223268,0.8545143346170304,none,0.921950723387414,0.9194341759621407,0.8610194160945667,COMPLETE
1035,0.7034361233480176,2025-09-23 16:23:18.977798,2025-09-23 16:23:36.089049,0 days 00:00:17.111251,0.0018812857023204183,dart,0.7789871072265855,9.499353152837843,lossguide,0.0011752162586163182,0.11959944032143409,1,4,1.96200986608717,500,forest,0.6248393024347441,0.9609870244988713,oversample,0.6872190288087348,1.7239859062821872,0.1585717994625129,weighted,0.7345094943024272,0.4737846777382756,0.826696693622684,0.8277027027027027,0.6248393024347441,0.7057187554319485,0.7034361233480176,0.9609870244988713,0.8214815118434303,0.8129073013150047,0.5944363103953147,0.5979628520071899,0.8682634730538922,0.8540864356011981,oversample,0.9253132238320522,0.9226483131329412,0.6872190288087348,COMPLETE
1036,0.7075910147172735,2025-09-23 16:23:36.223374,2025-09-23 16:23:43.746373,0 days 00:00:07.522999,0.23011212984010068,dart,0.7478547112302507,5.791421985754907,lossguide,20.39058468076246,0.06195257023575944,5,10,0.33158713771707027,300,tree,0.6842595245952288,0.6409801773245276,oversample,0.9233227581391141,1.4438398052786303,0.10954890484785665,weighted,0.8676276264071037,0.9656501680074838,0.8457365134609479,0.8454135954135954,0.6842595245952288,0.7114685046907907,0.7075910147172735,0.6409801773245276,0.8143858709285996,0.8107673738311627,0.6440207972270364,0.6462681287584011,0.7946963216424294,0.7817715019255456,oversample,0.920016590614837,0.9188041607377806,0.9233227581391141,COMPLETE
1037,0.7039678186140063,2025-09-23 16:23:43.889223,2025-09-23 16:24:47.485922,0 days 00:01:03.596699,0.00022724392024502397,dart,0.9781487493885348,0.6067762630789005,lossguide,0.002500270868193464,0.0014355307754860738,0,11,1.3432104636421132,800,forest,0.6028465311670925,0.931045574378357,oversample,0.7823970018822581,1.3547284437640168,0.06654982143131113,weighted,0.8853537833691234,0.6378161936752947,0.8329409356126523,0.8342547092547092,0.6028465311670925,0.7032727272727273,0.7039678186140063,0.931045574378357,0.8118478061735008,0.8033270195796253,0.6116382036685643,0.6146232439335888,0.8272027373823782,0.8237056054771074,oversample,0.918716405357576,0.9151460876952862,0.7823970018822581,COMPLETE
1038,0.6992084432717678,2025-09-23 16:24:47.618832,2025-09-23 16:25:11.889695,0 days 00:00:24.270863,0.0022486418129432093,dart,0.7278438325253482,6.356772802147127,lossguide,0.488696152491323,0.15736362419459118,5,3,21.605794197442673,600,forest,0.6952179430723865,0.9878563668171353,oversample,0.549451388888363,0.9932984472920631,0.1657505154014321,weighted,0.8960954273723315,0.4508974007188418,0.860067560651039,0.85995085995086,0.6952179430723865,0.7039202945635694,0.6992084432717678,0.9878563668171353,0.80505532442639,0.7962568747355965,0.7130320315928038,0.7191316146540027,0.695038494439692,0.6803594351732991,oversample,0.9175461580443702,0.9151953499221794,0.549451388888363,COMPLETE
1039,0.6869619987402897,2025-09-23 16:25:12.025259,2025-09-23 16:25:15.402407,0 days 00:00:03.377148,0.060626416344449915,dart,0.9488339403635973,4.796300113172983,lossguide,0.0012094301471942412,0.07829117570708605,0,7,20.750372599191962,200,forest,0.5273332425617179,0.904322659555818,none,0.7510688820187184,1.6703586032196664,0.3557245461459071,uniform,0.7442407899213902,0.862408027449821,0.8521854846964889,0.8473587223587223,0.5273332425617179,0.703125,0.6869619987402897,0.904322659555818,0.7955606906476385,0.7795432073501758,0.6769596199524941,0.674361088211047,0.7313943541488451,0.7000427899015832,none,0.9151388669687558,0.9096353691157335,0.7510688820187184,COMPLETE
