number,value,datetime_start,datetime_complete,duration,params_alpha,params_booster,params_colsample_bytree,params_gamma,params_grow_policy,params_lambda,params_learning_rate,params_max_delta_step,params_max_depth,params_min_child_weight,params_n_estimators,params_normalize_type,params_params_decision_threshold,params_params_feature_fraction,params_params_resampling,params_params_sample_rows,params_params_scale_pos_weight,params_rate_drop,params_sample_type,params_skip_drop,params_subsample,user_attrs_acc_test,user_attrs_acc_val,user_attrs_decision_threshold,user_attrs_f1_test,user_attrs_f1_val,user_attrs_feature_fraction,user_attrs_pr_auc_test,user_attrs_pr_auc_val,user_attrs_prec_test,user_attrs_prec_val,user_attrs_rec_test,user_attrs_rec_val,user_attrs_resampling_strategy,user_attrs_roc_auc_test,user_attrs_roc_auc_val,user_attrs_sample_rows,state
188,0.38612143742255267,2025-09-23 12:31:11.850645,2025-09-23 12:31:12.365508,0 days 00:00:00.514863,39.52183447251577,gbtree,0.43411363979234907,4.348736293666029,depthwise,9.55031468150847,0.0002776648788201045,3,7,1.1192268013499518,300,,0.32128655166476294,0.59756933112972,oversample,0.5570756728615552,1.1968456567606423,,,,0.4466707475729861,0.23932848807452145,0.23925061425061425,0.32128655166476294,0.3862228462872718,0.38612143742255267,0.59756933112972,0.6758929562480109,0.6646389869869109,0.23932848807452145,0.23925061425061425,1.0,1.0,oversample,0.870453625306052,0.8697678894006287,0.5570756728615552,COMPLETE
189,0.6699266503667481,2025-09-23 12:31:12.484840,2025-09-23 12:32:04.810434,0 days 00:00:52.325594,0.0030808708343336238,dart,0.9438194111128035,8.740288228634359,depthwise,15.989874608345216,0.1295209825027881,6,9,0.425673323415199,900,tree,0.43689652328184503,0.6174242053764231,undersample,0.6072533425812662,1.0063790680642053,0.1344157823466251,uniform,0.880573834360133,0.6066986514079038,0.7870815846043607,0.7926904176904177,0.43689652328184503,0.6679438058748404,0.6699266503667481,0.6174242053764231,0.7925120527922791,0.7859018757039513,0.5328578706062149,0.5410742496050553,0.894781864841745,0.8793324775353016,undersample,0.9126469075805363,0.9103803775219828,0.6072533425812662,COMPLETE
190,0.6215348701488183,2025-09-23 12:32:04.928431,2025-09-23 12:32:05.988772,0 days 00:00:01.060341,0.002833772676382856,gbtree,0.3314774707201112,1.5063905483217888,lossguide,17.647138955037335,0.0009689620098363641,4,4,0.11023933413131952,800,,0.4071315756774423,0.8993093733122473,none,0.5256142019911199,2.4648118148014575,,,,0.9631665587864577,0.7309857713174327,0.7344389844389845,0.4071315756774423,0.6213256484149856,0.6215348701488183,0.8993093733122473,0.7426685258380682,0.7337491250399724,0.46849196001738375,0.4715519149878238,0.9221556886227545,0.9114249037227214,none,0.8954640750219959,0.8919895588263832,0.5256142019911199,COMPLETE
191,0.5667970933482392,2025-09-23 12:32:06.106987,2025-09-23 12:32:07.414807,0 days 00:00:01.307820,26.110149442071872,gbtree,0.9476861025629018,4.7486750010294205,depthwise,0.027117573608072248,0.0009696499118321689,6,9,8.89167902443251,700,,0.5790547526061883,0.7802559503095919,none,0.6359782173791754,2.31114652365745,,,,0.8383224879587872,0.8445081379875116,0.8413185913185913,0.5790547526061883,0.5786407766990291,0.5667970933482392,0.7802559503095919,0.764635555520602,0.7571701830898769,0.8232044198895028,0.8170829975825947,0.44610778443113774,0.4338896020539153,none,0.8959548461759219,0.8926511295157785,0.6359782173791754,COMPLETE
192,0.0,2025-09-23 12:32:07.534334,2025-09-23 12:32:08.322370,0 days 00:00:00.788036,0.7986389509233759,gbtree,0.8571522376792853,6.243000572826787,depthwise,90.55671227943795,0.0001101372935177657,6,7,0.26764698155966316,600,,0.39121843926596755,0.6078377830660271,none,0.6591471249371756,1.3054244774835848,,,,0.296173333750288,0.7606715119254785,0.7607493857493858,0.39121843926596755,0.0,0.0,0.6078377830660271,0.6713662698421703,0.658521026808842,0.0,0.0,0.0,0.0,none,0.8789023544697905,0.8771506589765767,0.6591471249371756,COMPLETE
193,0.0,2025-09-23 12:32:08.441461,2025-09-23 12:32:11.650051,0 days 00:00:03.208590,0.09399148579161122,dart,0.3404619834036965,8.36807635478249,lossguide,0.002349079954288427,0.0002683138861073064,7,9,6.488559198823252,200,forest,0.4563749220609046,0.9718407642105016,none,0.5677984422914424,0.6224984165489106,0.3682866815211108,uniform,0.7595717648508362,0.8192423406756282,0.7606715119254785,0.7607493857493858,0.4563749220609046,0.0,0.0,0.9718407642105016,0.778942919610868,0.7717770456254063,0.0,0.0,0.0,0.0,none,0.9049251114243053,0.9025440269276372,0.5677984422914424,COMPLETE
194,0.6922898819171105,2025-09-23 12:32:11.771211,2025-09-23 12:32:23.081665,0 days 00:00:11.310454,0.0011366475129372098,dart,0.9049919103005652,3.4705050939238014,lossguide,0.625007487636432,0.14250347430880536,9,5,53.46395403766904,400,forest,0.5888518198200119,0.839319059347716,none,0.7438261629687111,1.5857504927417894,0.00768745312487823,uniform,0.7701617358717795,0.8318075491410022,0.8669259903777254,0.8639434889434889,0.5888518198200119,0.7029250457038391,0.6922898819171105,0.839319059347716,0.812001412218214,0.8045252537738583,0.7546614327772326,0.7542885973763875,0.6578272027373824,0.6397090286692341,none,0.920403468971855,0.9178376018721834,0.7438261629687111,COMPLETE
195,0.6200967221923697,2025-09-23 12:32:23.201071,2025-09-23 12:32:23.741543,0 days 00:00:00.540472,0.1155125195641311,gbtree,0.35844838265222656,4.996212124009408,depthwise,0.009827568945576293,0.019161274606475275,2,5,0.658984238083113,400,,0.6433681605928641,0.8118465201310796,none,0.5579350826302738,1.2608704912844895,,,,0.3834911197515476,0.8563824342307299,0.8552416052416052,0.6433681605928641,0.6263648468708389,0.6200967221923697,0.8118465201310796,0.792754757062876,0.7844483742373679,0.8299223712067749,0.8332129963898917,0.5029940119760479,0.4937954642704322,none,0.9144308994330388,0.9104379604873752,0.5579350826302738,COMPLETE
196,0.660541887262535,2025-09-23 12:32:23.860941,2025-09-23 12:32:24.334250,0 days 00:00:00.473309,0.02886085070666026,gbtree,0.6176385972742262,7.347733972292893,lossguide,0.03022113279887444,0.04538829979678196,4,12,2.228399184867606,400,,0.6414884130917193,0.5569736409954145,undersample,0.5739666165967796,2.953470215004409,,,,0.3251334033792911,0.7687583171256014,0.7768222768222768,0.6414884130917193,0.6533681141629584,0.660541887262535,0.5569736409954145,0.8016260558956222,0.7948415515451829,0.5094520220148361,0.5192166462668298,0.9106073567151411,0.9075738125802311,undersample,0.913990664498329,0.9125870719217573,0.5739666165967796,COMPLETE
197,0.6463812214735927,2025-09-23 12:32:24.452849,2025-09-23 12:32:25.123083,0 days 00:00:00.670234,6.787807737883591,gbtree,0.5529909731625274,7.359012753843811,depthwise,0.0019064531109042355,0.0015910836573805145,8,8,0.5089440729300915,400,,0.6849868634134935,0.748501865441533,undersample,0.6278599021039697,1.64434672812947,,,,0.983328804974704,0.8322243832531477,0.8334357084357085,0.6849868634134935,0.654438119333755,0.6463812214735927,0.748501865441533,0.736825750904002,0.7337549851579928,0.6453222453222454,0.6568021201413428,0.6638152266894782,0.636285836542576,undersample,0.8909653730200364,0.8903113896744645,0.6278599021039697,COMPLETE
198,0.6080881365040978,2025-09-23 12:32:25.240667,2025-09-23 12:33:13.402770,0 days 00:00:48.162103,1.2973044633455095,dart,0.8046779608797638,1.9044466860803377,lossguide,0.2418931999670799,0.0226678552437872,1,12,74.37289164481628,800,tree,0.3401349336462739,0.9008104594006906,oversample,0.9827269478753939,3.2962623512189433,0.13926785717450607,uniform,0.42184260051896266,0.7719810637009255,0.6956699764561367,0.7013718263718264,0.3401349336462739,0.6049169435215946,0.6080881365040978,0.9008104594006906,0.8142373412154815,0.8057954393145019,0.43878928089454405,0.4432040736388562,0.9734816082121471,0.9683354728284125,oversample,0.9224947360023593,0.9192258120018678,0.9827269478753939,COMPLETE
199,0.6862575626620571,2025-09-23 12:33:13.521402,2025-09-23 12:33:50.793273,0 days 00:00:37.271871,0.644582089252592,dart,0.4376456150886271,4.964399473360398,depthwise,0.39489233763509,0.012502654026316045,7,3,0.12136719124020288,800,forest,0.6617675366206326,0.6152380350797565,undersample,0.9859864136776273,1.0637956836537092,0.40397171146131655,uniform,0.6516370493179309,0.9415029349501689,0.8491145460128979,0.8513513513513513,0.6617675366206326,0.6881083368599238,0.6862575626620571,0.6152380350797565,0.7937875395686117,0.786054743941102,0.6809045226130653,0.6931470973374072,0.6954662104362703,0.6795036371416345,undersample,0.9119025056179814,0.9104113571573639,0.9859864136776273,COMPLETE
200,0.38612143742255267,2025-09-23 12:33:50.913044,2025-09-23 12:33:52.189825,0 days 00:00:01.276781,0.030904246762870884,gbtree,0.5861359164831688,6.311232710517998,depthwise,0.014315537934137885,0.0003322406176758832,2,11,0.9463604023276665,600,,0.33169863600930505,0.9356905107973685,undersample,0.9227019672543669,1.4676654545181185,,,,0.47076071852801626,0.23932848807452145,0.23925061425061425,0.33169863600930505,0.3862228462872718,0.38612143742255267,0.9356905107973685,0.7657364993497009,0.7619196071781072,0.23932848807452145,0.23925061425061425,1.0,1.0,undersample,0.903790866850416,0.9024042730706295,0.9227019672543669,COMPLETE
201,0.6662636033857315,2025-09-23 12:33:52.309970,2025-09-23 12:34:09.605570,0 days 00:00:17.295600,0.0006217443599160941,dart,0.7983604962025679,1.3488744756620685,depthwise,0.14947975081896606,0.07353611514200935,0,8,80.08870112442112,500,tree,0.6982830728322068,0.5651024811053513,none,0.7503881539059274,3.829278377310093,0.030863989455828522,uniform,0.2830926273010284,0.22440297611390303,0.8263895997543249,0.8304668304668305,0.6982830728322068,0.6652191077773392,0.6662636033857315,0.5651024811053513,0.7423986709159415,0.7431496976873625,0.6176686217008798,0.6297142857142857,0.7207014542343884,0.7073170731707317,none,0.8942878992001579,0.8936762790486626,0.7503881539059274,COMPLETE
202,0.4232908079816814,2025-09-23 12:34:09.728142,2025-09-23 12:34:10.171948,0 days 00:00:00.443806,38.30711495666737,gbtree,0.29619328178069176,9.014953018499316,depthwise,0.001371458215948133,0.08397675622364374,8,6,1.394237762699702,600,,0.5605237755245183,0.5566912856157762,none,0.7087731099341454,0.5777055178597618,,,,0.6746293156832444,0.8199406285187839,0.8195126945126945,0.5605237755245183,0.42271086314407613,0.4232908079816814,0.5566912856157762,0.7337596024063114,0.7308013994387365,0.9083215796897038,0.8986111111111111,0.2754491017964072,0.2768506632434745,none,0.8796410869362261,0.8787319447892226,0.7087731099341454,COMPLETE
203,0.11941478845393436,2025-09-23 12:34:10.290559,2025-09-23 12:34:10.851389,0 days 00:00:00.560830,0.01585801548724514,gbtree,0.5460365673263841,7.293470099299623,lossguide,0.2908305456865238,0.07003945068691439,2,8,82.47867733160267,1000,,0.5970579407815394,0.5922005200476722,none,0.9431826640470997,0.5451720939305995,,,,0.23402007002072694,0.773978912887706,0.772010647010647,0.5970579407815394,0.13275726630007856,0.11941478845393436,0.5922005200476722,0.5981909415649475,0.5969316572165151,0.8125,0.7864583333333334,0.07228400342172797,0.0646127513906718,none,0.8338164204493718,0.8328492909262433,0.9431826640470997,COMPLETE
204,0.15805946791862285,2025-09-23 12:34:10.972661,2025-09-23 12:34:12.074674,0 days 00:00:01.102013,0.4927152881296879,gbtree,0.21098083626110384,4.227221924900907,depthwise,0.0001804820262592698,0.0012405269413790978,6,12,8.906376940089133,800,,0.5105985461637197,0.6261846568512482,none,0.9684396042446506,1.5824090115703424,,,,0.4909620526615224,0.7822704473334016,0.7796887796887797,0.5105985461637197,0.17269544924154026,0.15805946791862285,0.6261846568512482,0.6830266576060997,0.679412739346893,0.9527896995708155,0.9223744292237442,0.0949529512403764,0.08643560119811725,none,0.8648215421052469,0.8666607989624932,0.9684396042446506,COMPLETE
205,0.2939460247994165,2025-09-23 12:34:12.195103,2025-09-23 12:34:21.042524,0 days 00:00:08.847421,2.4374901822041775,dart,0.6021401979548024,3.8979144494079296,lossguide,6.35721871417134,0.012835921182796169,5,4,4.0257745727719225,400,forest,0.6682189530644889,0.5515343753372011,none,0.5068707965357216,0.5350696129175426,0.22392379816825259,uniform,0.0040271640405597385,0.7503062927391209,0.7989558808475791,0.8018018018018018,0.6682189530644889,0.27794117647058825,0.2939460247994165,0.5515343753372011,0.7529886673255073,0.7466073375743045,0.9895287958115183,0.9950617283950617,0.16167664670658682,0.17244330338040223,none,0.8934967598685782,0.892040663708169,0.5068707965357216,COMPLETE
206,0.5916216216216216,2025-09-23 12:34:21.161827,2025-09-23 12:34:21.689121,0 days 00:00:00.527294,0.00015635708180686798,gbtree,0.3270145987932781,0.25705232049547777,lossguide,0.6548034776967777,0.01826561756559169,1,4,0.968273362264559,300,,0.35945663653101656,0.5190579376189737,oversample,0.5700418454395743,1.3995408309338973,,,,0.2882239587943112,0.6813389292660457,0.6906224406224406,0.35945663653101656,0.582539895400295,0.5916216216216216,0.5190579376189737,0.7014463651909802,0.6915797481825946,0.4243016214104317,0.432352360260715,0.9289991445680068,0.936670945656825,oversample,0.873883785574937,0.8751138055332277,0.5700418454395743,COMPLETE
207,0.6438267614738203,2025-09-23 12:34:21.808063,2025-09-23 12:34:22.939303,0 days 00:00:01.131240,31.600973016427123,gbtree,0.42689531642477735,7.291389103622584,depthwise,0.0019170247174190992,0.007751239160076126,8,6,0.1177828962070391,1000,,0.4753906995978546,0.5600633719787838,oversample,0.9764097560600322,0.9460533235889595,,,,0.7294296365678441,0.7663015661787286,0.7743652743652744,0.4753906995978546,0.6333708045607837,0.6438267614738203,0.5600633719787838,0.7106562737708381,0.7074468042877956,0.5070712265363847,0.517268242015061,0.8434559452523525,0.8523748395378691,oversample,0.8756161763790029,0.8813116904302928,0.9764097560600322,COMPLETE
208,0.6848558107408047,2025-09-23 12:34:23.061573,2025-09-23 12:34:23.661985,0 days 00:00:00.600412,0.004782677223474853,gbtree,0.7417624362074988,7.4553320822007425,lossguide,0.06456393647035999,0.07700638186899549,7,12,4.973664789591839,800,,0.656517602387624,0.8660858978152879,undersample,0.6088623396915412,2.0339189450249497,,,,0.23250723197736012,0.8113420002047292,0.8131654381654382,0.656517602387624,0.6849034022909899,0.6848558107408047,0.8660858978152879,0.7949924872105003,0.7913845598975012,0.5704927371119339,0.574116965836711,0.8567151411462789,0.8485237483953787,undersample,0.9145947104579699,0.9130012374003433,0.6088623396915412,COMPLETE
209,0.613408609738885,2025-09-23 12:34:23.782592,2025-09-23 12:34:24.642218,0 days 00:00:00.859626,0.0021505925346357035,gbtree,0.4592341723774099,7.041515108727725,depthwise,6.9381850912929846,0.009751577103715395,6,5,48.13849975537512,900,,0.5470680097349253,0.5850485060929953,undersample,0.899441143391783,2.7252467166622587,,,,0.6582244650214903,0.706418261848705,0.7195945945945946,0.5470680097349253,0.6011126564673157,0.613408609738885,0.5850485060929953,0.713990105778149,0.7080667765227504,0.4453833470733718,0.4576663858466723,0.9242942686056459,0.9298245614035088,undersample,0.8848466916446823,0.8873844187520769,0.899441143391783,COMPLETE
210,0.5414492753623188,2025-09-23 12:34:24.763500,2025-09-23 12:34:26.503016,0 days 00:00:01.739516,0.038934802206611024,gbtree,0.8320635425912846,4.009399651127772,lossguide,3.343818040187346,0.00068658906949639,5,8,1.7353655957539358,500,,0.30140427841781003,0.510367676579088,none,0.923568573604125,0.7834747500551696,,,,0.8038970308095654,0.8452246903470161,0.838042588042588,0.30140427841781003,0.5689851767388826,0.5414492753623188,0.510367676579088,0.7314908232697039,0.7272188584314079,0.852991452991453,0.839173405211141,0.4268605645851155,0.3996576807873342,none,0.8607853501141209,0.8631617700704131,0.923568573604125,COMPLETE
211,0.0,2025-09-23 12:34:26.628369,2025-09-23 12:34:29.185639,0 days 00:00:02.557270,0.0004911496580725313,gbtree,0.6885621443668809,8.921982110925352,lossguide,2.5248664607930906,0.00017245209260228844,3,9,8.389992680082441,900,,0.4421874109383805,0.5599637915247979,none,0.7285880415395325,0.7957673968040522,,,,0.7320746112761618,0.7606715119254785,0.7607493857493858,0.4421874109383805,0.0,0.0,0.5599637915247979,0.7919582313734543,0.7845612857116034,0.0,0.0,0.0,0.0,none,0.9088610943520422,0.9070185400449504,0.7285880415395325,COMPLETE
212,0.6426172046151599,2025-09-23 12:34:29.307816,2025-09-23 12:34:30.322635,0 days 00:00:01.014819,20.037637131794483,gbtree,0.5242683853056646,9.443627442890115,lossguide,0.04208316013614439,0.013039265033499526,6,11,3.6203443201136194,400,,0.4006854257619821,0.8905218038623173,oversample,0.6248854467623692,1.6536319900635499,,,,0.6622832040936077,0.7424506090695056,0.7494881244881245,0.4006854257619821,0.6370455856895557,0.6426172046151599,0.8905218038623173,0.8048371775387045,0.7981564912567964,0.48062690465824986,0.4878048780487805,0.9443969204448246,0.9413778348309799,oversample,0.9181473548663674,0.9165549413180637,0.6248854467623692,COMPLETE
213,0.38612143742255267,2025-09-23 12:34:30.442739,2025-09-23 12:35:19.842730,0 days 00:00:49.399991,0.00017502513321265297,dart,0.6457022446412937,5.434516951075146,lossguide,23.399977407233823,0.0017026748412272436,1,3,0.8371111996327939,900,tree,0.4704517680665238,0.8676984445930164,none,0.7312963871049434,4.199952115527794,0.1383217824884741,weighted,0.2070466287254578,0.8742170842764214,0.23932848807452145,0.23925061425061425,0.4704517680665238,0.3862228462872718,0.38612143742255267,0.8676984445930164,0.6957070903855135,0.6885308180564474,0.23932848807452145,0.23925061425061425,1.0,1.0,none,0.8742329056633834,0.8689120625774814,0.7312963871049434,COMPLETE
214,0.4151497357604228,2025-09-23 12:35:19.961377,2025-09-23 12:35:20.467332,0 days 00:00:00.505955,36.500531556643594,gbtree,0.528418392554786,6.426096986453004,depthwise,0.019442928590462618,0.20886121215357586,3,10,2.0944275245561412,800,,0.6352822278163173,0.632986652522281,none,0.674193192672115,1.4138988902684446,,,,0.5845469542286799,0.8022315487767427,0.7960687960687961,0.6352822278163173,0.4297520661157025,0.4151497357604228,0.632986652522281,0.6132911171517864,0.6032539588226671,0.6933333333333334,0.6613657623947614,0.31137724550898205,0.3025246041934104,none,0.8515529929816819,0.8461702174338531,0.674193192672115,COMPLETE
215,0.649034175334324,2025-09-23 12:35:20.586531,2025-09-23 12:36:22.561552,0 days 00:01:01.975021,0.004372436325619057,dart,0.59664546318973,6.309686654041579,lossguide,0.00015742006022925403,0.05251385413400864,9,3,9.403468257553294,1000,forest,0.6199428701287311,0.9582883827503459,oversample,0.6129724828463072,3.6521185661799973,0.43921012694037925,uniform,0.8087633594261169,0.7968822960741027,0.7530965298392875,0.7581900081900081,0.6199428701287311,0.6443526983190799,0.649034175334324,0.9582883827503459,0.810679114225974,0.8007346793568293,0.4916741674167417,0.49715456407921693,0.9345594525235243,0.9345314505776636,oversample,0.9199230583184517,0.9175285828884042,0.6129724828463072,COMPLETE
216,0.4727921498661909,2025-09-23 12:36:22.682094,2025-09-23 12:36:29.170141,0 days 00:00:06.488047,0.00021538656603941526,dart,0.5939417782058644,4.84139728190661,lossguide,0.35995603924886177,0.009752697091084438,5,5,43.8840456048829,300,forest,0.554233736681164,0.6419682177552337,none,0.50104193938179,0.9093344656759229,0.06925715452833064,uniform,0.17698214207209936,0.9717231942680575,0.8245470365441704,0.8184889434889435,0.554233736681164,0.5,0.4727921498661909,0.6419682177552337,0.695309398673563,0.6925745956319043,0.7862385321100918,0.7748538011695907,0.36655260906757914,0.34017971758664955,none,0.8715384848274499,0.8767696612860568,0.50104193938179,COMPLETE
217,0.5951111111111111,2025-09-23 12:36:29.288072,2025-09-23 12:36:29.705408,0 days 00:00:00.417336,0.0009628554675762375,gbtree,0.5947188083299739,5.715399303238873,depthwise,0.009683950368627637,0.04882020683154519,2,12,66.10375575859536,300,,0.6256762811137628,0.5693542540532672,oversample,0.7644570054006257,0.7028878210991875,,,,0.5866850363662675,0.8116490940730884,0.8134725634725635,0.6256762811137628,0.6017316017316018,0.5951111111111111,0.5693542540532672,0.6506580196776237,0.6488594541969546,0.6091148115687993,0.6190476190476191,0.5945252352437981,0.5729567821994009,oversample,0.8637304087251991,0.8632129901181298,0.7644570054006257,COMPLETE
218,0.0,2025-09-23 12:36:29.826264,2025-09-23 12:37:26.610262,0 days 00:00:56.783998,0.003393516548753896,dart,0.2627053517615511,2.756086401299193,lossguide,6.219050814503266,0.0001949025721793658,1,7,0.2740386893471344,1000,tree,0.5680790551568762,0.9710832410225787,undersample,0.9601294562818461,0.7894947401005487,0.3577712950877341,weighted,0.4041901823145767,0.6875434334249615,0.7606715119254785,0.7607493857493858,0.5680790551568762,0.0,0.0,0.9710832410225787,0.7304005803156366,0.7249568615220343,0.0,0.0,0.0,0.0,undersample,0.8929469338616727,0.8930034220980503,0.9601294562818461,COMPLETE
219,0.6124445803393976,2025-09-23 12:37:26.728513,2025-09-23 12:37:33.188318,0 days 00:00:06.459805,14.272137738764524,dart,0.4721335471444225,5.570674938278416,lossguide,1.6656859115630243,0.01786763908205063,10,7,20.51580522698423,300,forest,0.557445549086981,0.7242024722931638,undersample,0.5148610920609638,1.4102043902168817,0.36805134965043335,weighted,0.8933269684475643,0.4388453959182166,0.7362063670795373,0.7404791154791155,0.557445549086981,0.6107838695061168,0.6124445803393976,0.7242024722931638,0.6567628935311268,0.6484570250936805,0.4720989960308195,0.4764509990485252,0.864841745081266,0.8570817287120239,undersample,0.8639506269196425,0.8623338709854812,0.5148610920609638,COMPLETE
