number,value,datetime_start,datetime_complete,duration,params_alpha,params_booster,params_colsample_bytree,params_gamma,params_grow_policy,params_lambda,params_learning_rate,params_max_delta_step,params_max_depth,params_min_child_weight,params_n_estimators,params_normalize_type,params_params_decision_threshold,params_params_feature_fraction,params_params_resampling,params_params_sample_rows,params_params_scale_pos_weight,params_rate_drop,params_sample_type,params_skip_drop,params_subsample,user_attrs_acc_test,user_attrs_acc_val,user_attrs_decision_threshold,user_attrs_f1_test,user_attrs_f1_val,user_attrs_feature_fraction,user_attrs_pr_auc_test,user_attrs_pr_auc_val,user_attrs_prec_test,user_attrs_prec_val,user_attrs_rec_test,user_attrs_rec_val,user_attrs_resampling_strategy,user_attrs_roc_auc_test,user_attrs_roc_auc_val,user_attrs_sample_rows,state
1682,0.6790848349868395,2025-09-23 21:46:17.053395,2025-09-23 21:47:00.265003,0 days 00:00:43.211608,0.005552534500773061,dart,0.5850939984320681,4.032745705093758,lossguide,0.0015587344684531391,0.07150563200826661,8,6,17.741570057217476,800,forest,0.44397696048727636,0.8331242255733713,none,0.8816727169229461,1.282625161871168,0.0021883157415738402,uniform,0.8347284344335765,0.4887033516463199,0.8347834988228069,0.8377354627354627,0.44397696048727636,0.675251509054326,0.6790848349868395,0.8331242255733713,0.7506577148578104,0.7418160200014536,0.6375379939209727,0.6445042275172944,0.7177074422583405,0.7175866495507061,none,0.8995716969083921,0.899088617131842,0.8816727169229461,COMPLETE
1683,0.7009428927237147,2025-09-23 21:47:00.399494,2025-09-23 21:47:17.885339,0 days 00:00:17.485845,0.010168287889299845,dart,0.8020130539752877,6.089113575532422,lossguide,0.0013230130062859768,0.03712681106073728,7,8,0.8134559789262463,500,forest,0.4892672599497637,0.9519976236020007,undersample,0.9482712188023136,0.8457777346312031,0.04273764640971521,uniform,0.8562767179320367,0.3099716003915439,0.8271061521138294,0.8279074529074529,0.4892672599497637,0.7021689296420385,0.7009428927237147,0.9519976236020007,0.8155328171174747,0.8097640249842247,0.5973597359735974,0.5998781973203411,0.8515825491873396,0.8429610611895593,undersample,0.9227416900439849,0.9211072202301395,0.9482712188023136,COMPLETE
1684,0.7144203581526861,2025-09-23 21:47:18.019188,2025-09-23 21:47:35.513613,0 days 00:00:17.494425,0.04353618270404117,dart,0.8928055444981633,7.067965437050109,depthwise,0.0009156206404548643,0.17601504818356495,1,11,6.768432974305282,500,forest,0.6620430548782458,0.9747286094798927,none,0.953337989450169,4.604565481058234,0.008220435018598248,uniform,0.7918271532790443,0.8594079817396587,0.8439963148735797,0.8449017199017199,0.6620430548782458,0.714499812663919,0.7144203581526861,0.9747286094798927,0.82301681893902,0.818703761565057,0.6356666666666667,0.6384770889487871,0.8156544054747648,0.8108686350021395,none,0.9256360109816701,0.9250385820263872,0.953337989450169,COMPLETE
1685,0.5732558139534883,2025-09-23 21:47:35.648775,2025-09-23 21:48:10.403265,0 days 00:00:34.754490,0.0002188697808796675,dart,0.3337376921928124,4.495111516852823,lossguide,0.001170019675099291,0.019795104047690464,10,5,0.8514913334633563,700,forest,0.6430303061244911,0.9933024746875271,none,0.9880776264706215,0.7986098234939837,0.00622812671278419,uniform,0.8690301891117579,0.2206198332429315,0.8568942573446617,0.8497133497133497,0.6430303061244911,0.6005714285714285,0.5732558139534883,0.9933024746875271,0.819988932278275,0.813016980602563,0.9044750430292599,0.8939256572982774,0.4495295124037639,0.42190842961061187,none,0.9234764222060522,0.9219769821309118,0.9880776264706215,COMPLETE
1686,0.7063263041065483,2025-09-23 21:48:10.542941,2025-09-23 21:49:17.110021,0 days 00:01:06.567080,0.0024174988697778163,dart,0.3615785976534779,3.896469575337316,lossguide,0.0001677173174153657,0.4614870203539084,8,5,12.054550869961924,1000,forest,0.5722222483131768,0.9305177653273038,none,0.8945814432329736,1.7987380933511699,0.018452780246258002,uniform,0.8024658898369077,0.6181028348496957,0.8626266762206981,0.8645577395577395,0.5722222483131768,0.7023070097604259,0.7063263041065483,0.9305177653273038,0.8136098641382405,0.8092428198907881,0.7294930875576037,0.7338560885608856,0.6770744225834047,0.6807873341891314,none,0.9195384247365468,0.9202191181548897,0.8945814432329736,COMPLETE
1687,0.7102240632649218,2025-09-23 21:49:17.244271,2025-09-23 21:49:51.885893,0 days 00:00:34.641622,0.00019473035899776029,dart,0.24648101506640863,5.421224044529916,lossguide,0.03404390371410467,0.046641375995922496,9,8,14.132699226360652,700,forest,0.4459629480935846,0.9657271492520618,none,0.9760624813107124,1.92509079096319,0.03967223267271571,uniform,0.7772466928305148,0.7027453041292208,0.846043607329307,0.8424447174447175,0.4459629480935846,0.71898355754858,0.7102240632649218,0.9657271492520618,0.823128487500095,0.8157316859569373,0.6383543463835435,0.6341627437794216,0.8229255774165953,0.8070175438596491,none,0.9254796249821138,0.923819003610855,0.9760624813107124,COMPLETE
1688,0.6617320503330866,2025-09-23 21:49:52.020251,2025-09-23 21:50:58.765841,0 days 00:01:06.745590,0.011012911420465128,dart,0.22172202593764256,8.030976626343897,lossguide,0.002727932255857315,0.06975770895963303,5,5,2.942890566411146,1000,forest,0.4818498654413552,0.977323312289291,none,0.8398544239938184,0.8501156245043662,0.03240868290639204,uniform,0.7723372730246402,0.6755261111776891,0.86539052103593,0.8596437346437347,0.4818498654413552,0.6813666101284226,0.6617320503330866,0.977323312289291,0.8036442074630805,0.7913199568814835,0.7859139183901621,0.7814685314685315,0.6013686911890505,0.5738125802310655,none,0.919035796565356,0.9146011513022935,0.8398544239938184,COMPLETE
1689,0.6682515668899935,2025-09-23 21:50:58.902633,2025-09-23 21:51:55.198598,0 days 00:00:56.295965,0.000550720563763279,dart,0.8566163970079536,5.145068143539444,depthwise,0.7189407739026651,0.05964035198030475,1,12,0.11144859064787951,900,forest,0.6498962406456714,0.8072420835264276,none,0.8240041999750363,2.334088476237056,0.003883880572625851,uniform,0.6857526677158161,0.4547955362919644,0.8433821271368614,0.8428542178542179,0.6498962406456714,0.6723768736616702,0.6682515668899935,0.8072420835264276,0.7482817633129611,0.7443676367034302,0.6732418524871355,0.6751091703056769,0.6715141146278871,0.6615318784766795,none,0.8999373362393386,0.9002517354498067,0.8240041999750363,COMPLETE
1690,0.6722742421837804,2025-09-23 21:51:55.337100,2025-09-23 21:51:58.862221,0 days 00:00:03.525121,0.00010076290313024649,dart,0.93542954254204,8.827029406355965,depthwise,0.005989981970608155,0.04950777497909487,1,12,11.036724021195528,200,forest,0.6718985893320429,0.9805985788833338,undersample,0.8705745400305056,3.589886789389443,0.012903121652601032,uniform,0.6988253259831598,0.8054777474774648,0.7838059166751971,0.7885954135954136,0.6718985893320429,0.6694835680751173,0.6722742421837804,0.9805985788833338,0.8146238016681202,0.8053562783949266,0.5278874629812438,0.5343087790110999,0.9148845166809239,0.9062901155327343,undersample,0.9230434971800445,0.9196127119463405,0.8705745400305056,COMPLETE
1691,0.7056603773584905,2025-09-23 21:51:58.996774,2025-09-23 21:52:02.504293,0 days 00:00:03.507519,0.0001762698963990556,dart,0.7077562284045739,5.556599454698409,depthwise,0.2823532060083824,0.08100603631880629,0,6,39.7451123130658,200,forest,0.6326672381716744,0.9869373606907489,none,0.9577433996668967,3.902621749362724,0.0010949071224950575,uniform,0.7557878094192627,0.8272763790528997,0.8420513870406388,0.8402948402948403,0.6326672381716744,0.7117504203250514,0.7056603773584905,0.9869373606907489,0.8157849376487101,0.80730040512038,0.6318407960199005,0.631117111036112,0.8147989734816082,0.8001711596063329,none,0.9222870079668795,0.9200206872561469,0.9577433996668967,COMPLETE
1692,0.6781376518218624,2025-09-23 21:52:02.640313,2025-09-23 21:52:48.460443,0 days 00:00:45.820130,0.0016424082890722452,dart,0.5392957972277683,8.119319502038122,depthwise,0.00266169538088128,0.023016679153053828,3,11,0.21263308827269414,800,forest,0.6263140512009592,0.9920809119717572,none,0.9628379685797935,2.684746334196645,0.001301400782858439,uniform,0.6367842909608354,0.5634084292641305,0.8381615313747569,0.8372235872235873,0.6263140512009592,0.6829757369159816,0.6781376518218624,0.9920809119717572,0.7561240055970906,0.7503360773297136,0.642884107210268,0.6434882827506723,0.7284003421727973,0.7167308515190415,none,0.9022379429387376,0.9029888553352949,0.9628379685797935,COMPLETE
1693,0.6806950422445401,2025-09-23 21:52:48.594762,2025-09-23 21:52:56.020414,0 days 00:00:07.425652,0.004435220543596988,dart,0.5657951646933694,6.07741199245983,depthwise,0.0001263671478196813,0.10799632800365279,0,9,0.8627459867911854,300,forest,0.5718066629225743,0.9599458512656495,oversample,0.9629117538307923,4.2259466658200076,0.07895308583500406,uniform,0.6805038414795844,0.9572010330196741,0.789128877060088,0.7949426699426699,0.5718066629225743,0.6757947749449166,0.6806950422445401,0.9599458512656495,0.8226836096072183,0.8180206258527036,0.5346115537848606,0.5424288617886179,0.91830624465355,0.9135643988018828,oversample,0.9246145519676376,0.9232795088080918,0.9629117538307923,COMPLETE
1694,0.6993511175198269,2025-09-23 21:52:56.156422,2025-09-23 21:54:09.538086,0 days 00:01:13.381664,0.00026500070057390807,dart,0.3411809023672403,3.578335665090473,lossguide,0.00014097966017235264,0.008484684678702928,5,7,1.0077538705465097,1000,forest,0.47846643011782813,0.875159826612774,none,0.970085401957333,2.46793050863459,0.0007979555646838166,uniform,0.7576450862997495,0.4855382741320874,0.8313031016480704,0.8292383292383292,0.47846643011782813,0.7043415859346968,0.6993511175198269,0.875159826612774,0.8171045283228995,0.8108502288012314,0.6066131025957973,0.6041731547804422,0.839606501283148,0.8301240907145914,none,0.9212379785097893,0.9203455703468919,0.970085401957333,COMPLETE
1695,0.690643985419198,2025-09-23 21:54:09.675129,2025-09-23 21:54:43.453058,0 days 00:00:33.777929,0.00030290713755012693,dart,0.3950970595801168,4.842299001999954,lossguide,0.002335779787782308,0.04639614810842469,8,3,1.9780377062588237,700,forest,0.5253165035350186,0.8697573932034875,none,0.9594246597474041,1.0774805064453714,0.07997617727878137,uniform,0.7450000633693604,0.6441390371518325,0.8706111167980346,0.8696764946764947,0.5253165035350186,0.6940948693126815,0.690643985419198,0.8697573932034875,0.8252632325291847,0.8177148188867436,0.7993311036789298,0.7992125984251969,0.613344739093242,0.6080445014976466,none,0.9258441994838399,0.9239337664608823,0.9594246597474041,COMPLETE
1696,0.6935070979753316,2025-09-23 21:54:43.588489,2025-09-23 21:55:16.857957,0 days 00:00:33.269468,0.0004803550084179174,dart,0.511618367538003,3.8515017886228144,depthwise,0.00027924234638224046,0.25379508859734157,9,5,36.83813404962041,700,forest,0.4853212660867454,0.938621458346531,none,0.9768375516883224,1.026922838142422,0.06993900507359568,weighted,0.8357249416405663,0.4765614473767882,0.8636503224485618,0.8651719901719902,0.4853212660867454,0.6928044280442804,0.6935070979753316,0.938621458346531,0.8064600602022186,0.8026702886549362,0.7517517517517518,0.7602040816326531,0.6424294268605646,0.6375695335900727,none,0.9175583604116527,0.9173867272531596,0.9768375516883224,COMPLETE
1697,0.707756960252145,2025-09-23 21:55:16.992473,2025-09-23 21:56:12.366008,0 days 00:00:55.373535,0.00014413694993322223,dart,0.3559224464566412,2.5668571269314233,lossguide,0.00019060369634606172,0.07818156826807038,4,3,10.611215327390203,900,forest,0.5577504078127852,0.8335767087973271,oversample,0.9873826257679417,1.38214038195733,0.016520047532423143,uniform,0.8978410301189239,0.7064593655298775,0.8249564950353158,0.8291359541359541,0.5577504078127852,0.7035367545076283,0.707756960252145,0.8335767087973271,0.8209873601153348,0.81304838423331,0.5915451895043732,0.5989922940130409,0.867835757057314,0.8647839109970047,oversample,0.9250225254548863,0.9233975826786293,0.9873826257679417,COMPLETE
1698,0.669710806697108,2025-09-23 21:56:12.501057,2025-09-23 21:57:19.297104,0 days 00:01:06.796047,0.00010806554079147135,dart,0.4087701572499532,6.477108214840075,lossguide,0.00010687471384954697,0.011504170537933681,6,4,2.630076016310852,1000,forest,0.5539008514458721,0.9747488841093157,none,0.9031918242236485,1.0537367457889681,0.12672578229346498,uniform,0.6766807271696553,0.4955407121247195,0.8680520012283754,0.8667076167076168,0.5539008514458721,0.6750693219057222,0.669710806697108,0.9747488841093157,0.8195947810419795,0.8126399057558565,0.8219766728054021,0.822429906542056,0.5727117194183062,0.5648267008985879,none,0.9229248694490596,0.9214486584234349,0.9031918242236485,COMPLETE
1699,0.5893719806763285,2025-09-23 21:57:19.433323,2025-09-23 21:58:12.330823,0 days 00:00:52.897500,0.00019229448069544065,dart,0.5093894900467824,5.0447601008371254,lossguide,0.0017122295163383527,0.06646196226540585,5,7,51.418611581140006,900,forest,0.4353425241501423,0.9340814695037102,undersample,0.9469241834204041,2.9525144523513065,0.1425714382719593,uniform,0.6442912193360272,0.37209778330444243,0.6800081891698229,0.678030303030303,0.4353425241501423,0.591692789968652,0.5893719806763285,0.9340814695037102,0.7576582022478121,0.7567940482621698,0.42591199699135013,0.42408868846298386,0.9687767322497861,0.965768078733419,undersample,0.9041977755084443,0.9009964271497463,0.9469241834204041,COMPLETE
1700,0.6622369878183831,2025-09-23 21:58:12.466120,2025-09-23 21:59:06.209747,0 days 00:00:53.743627,0.0012757022206671715,dart,0.2027113093026516,1.9686974083291404,lossguide,0.0003704175377700812,0.07406269081162323,7,7,10.68210927608087,900,forest,0.4415646364104178,0.8416813499767499,none,0.9215552435304398,1.0275878807571421,0.13788126267433035,uniform,0.4393352451099123,0.4872427162269633,0.8463507011976661,0.8438779688779688,0.4415646364104178,0.6724852716561205,0.6622369878183831,0.8416813499767499,0.7492743252839431,0.7404784332605108,0.6864142538975501,0.6864095500459136,0.6591103507271172,0.6397090286692341,none,0.8980964479714658,0.8984960596264697,0.9215552435304398,COMPLETE
1701,0.6789926681542875,2025-09-23 21:59:06.345887,2025-09-23 21:59:07.113987,0 days 00:00:00.768100,0.0007028393836954328,gbtree,0.7464365710246744,6.058104020858785,depthwise,42.6215487068524,0.06299174954268955,2,12,18.453636195666032,200,,0.6446163109322328,0.8517460164512658,oversample,0.9509349071297691,3.606723928351646,,,,0.9798507630770859,0.7924045449892517,0.7938165438165438,0.6446163109322328,0.6790123456790124,0.6789926681542875,0.8517460164512658,0.8228507093873068,0.8155602129496431,0.5389447236180904,0.541021082042164,0.9174508126603935,0.9114249037227214,oversample,0.9262779303265549,0.9242882471958391,0.9509349071297691,COMPLETE
1702,0.6936098180279306,2025-09-23 21:59:07.250497,2025-09-23 21:59:32.866162,0 days 00:00:25.615665,0.00013425586659589222,dart,0.25517670389720937,3.195188512140584,depthwise,0.002560366885747936,0.08248278926106584,5,11,0.4826275158848619,600,forest,0.36528973652938,0.8579441432474916,none,0.9632595591650007,0.9210135816469477,0.07344049800427645,uniform,0.6701366904532242,0.9546131665945591,0.8567918927218753,0.8517608517608518,0.36528973652938,0.7090871283011021,0.6936098180279306,0.8579441432474916,0.8017740103216822,0.7899460646370922,0.6900040469445569,0.6860611134365844,0.7292557741659538,0.7013264869490801,none,0.915382137276862,0.9119464902232474,0.9632595591650007,COMPLETE
1703,0.7164758393169027,2025-09-23 21:59:33.001078,2025-09-23 21:59:33.628815,0 days 00:00:00.627737,1.6721752293635563,gbtree,0.33629398967967283,2.3394611166905603,lossguide,0.0001300831165166469,0.3852950659576188,10,10,3.083165081521018,200,,0.3552423890329093,0.8504047745374024,none,0.9429514232602637,1.2301668068336444,,,,0.8857391728424712,0.8507523799774798,0.8504299754299754,0.3552423890329093,0.7206896551724138,0.7164758393169027,0.8504047745374024,0.8292716396987709,0.8186394139434892,0.6526717557251909,0.6555397727272727,0.8045337895637297,0.7899015832263586,none,0.9277784473730892,0.9247536327221421,0.9429514232602637,COMPLETE
1704,0.7111761477958661,2025-09-23 21:59:33.765211,2025-09-23 22:00:34.518145,0 days 00:01:00.752934,0.8103175985122112,dart,0.8736480131373567,7.827525028786826,lossguide,0.04167649812497095,0.010088034866152364,3,12,0.41399342225563984,900,forest,0.6244932655146587,0.818428863610953,none,0.9878839482678988,4.747355539190883,0.21846094501738123,uniform,0.49491150444288967,0.5784951219865775,0.8382638959975433,0.8383497133497133,0.6244932655146587,0.7123088128186453,0.7111761477958661,0.818428863610953,0.8242747532224807,0.8168787247439483,0.6201648700063411,0.6210862619808307,0.8366124893071001,0.8318356867779204,none,0.9260538557235836,0.9239447360157895,0.9878839482678988,COMPLETE
1705,0.6865234375,2025-09-23 22:00:34.653125,2025-09-23 22:00:35.567406,0 days 00:00:00.914281,0.0037896514381627767,gbtree,0.7080923670996796,8.482596409212162,depthwise,0.5194185878825901,0.04092385824863632,0,12,0.10237279358305715,800,,0.6287280807542254,0.8110989026710734,none,0.8698516262318251,1.492061569541395,,,,0.8037541010460836,0.8703040229296755,0.8685503685503686,0.6287280807542254,0.6921020656136088,0.6865234375,0.8110989026710734,0.8199316467320634,0.8148067569194806,0.8013505908835116,0.7993177942012507,0.6090675791274593,0.6016260162601627,none,0.9224821019475553,0.9210699352600478,0.8698516262318251,COMPLETE
1706,0.702061855670103,2025-09-23 22:00:35.704360,2025-09-23 22:01:02.258012,0 days 00:00:26.553652,0.0015665795851468928,dart,0.9198434542083718,3.650238689295365,lossguide,0.0003335482406347026,0.017538330256659494,1,8,0.13342808457376923,600,forest,0.6956673297487379,0.9989728497615051,undersample,0.8757114787728278,2.669766762470748,0.1828276422407189,uniform,0.6572468125234225,0.81089758182782,0.8179957006858429,0.8224815724815725,0.6956673297487379,0.69669054930058,0.702061855670103,0.9989728497615051,0.8199467367010844,0.8105946018270609,0.5794551645856981,0.58656330749354,0.8733960650128315,0.8741976893453145,undersample,0.9244921541656291,0.9221240778160071,0.8757114787728278,COMPLETE
1707,0.716039603960396,2025-09-23 22:01:02.395397,2025-09-23 22:01:47.581092,0 days 00:00:45.185695,0.015928955561449236,dart,0.8920484530131695,8.966020952858713,depthwise,0.0001343501736582221,0.03924821409261668,3,12,0.16973092542628243,800,forest,0.6184521780011152,0.996757476422871,none,0.9769012454325096,3.179354802412231,0.07172495509375602,uniform,0.5087888842875389,0.37673938211126695,0.8547446002661481,0.8531941031941032,0.6184521780011152,0.7207242668765991,0.716039603960396,0.996757476422871,0.8263386349678772,0.8190463432007347,0.6675173168064163,0.6664209362329524,0.783147989734816,0.7736414206247325,none,0.9273311327630223,0.9250404822642451,0.9769012454325096,COMPLETE
1708,0.721699058304949,2025-09-23 22:01:47.716641,2025-09-23 22:01:48.486033,0 days 00:00:00.769392,0.0009296424578838096,gbtree,0.5508545338125336,6.571157740479556,depthwise,0.7756876235081038,0.23106807645784513,0,11,0.15285220594953766,600,,0.6764971736416255,0.945736972681083,none,0.8547848841741279,3.9656036427584764,,,,0.6558321910613488,0.8556658818712253,0.8578009828009828,0.6764971736416255,0.7194588141663351,0.721699058304949,0.945736972681083,0.821234838016124,0.8173810934977823,0.6726190476190477,0.6785983421250942,0.7733105218135158,0.7706461275139067,none,0.9246903562964619,0.9238668550550962,0.8547848841741279,COMPLETE
1709,0.7124063954665047,2025-09-23 22:01:48.620940,2025-09-23 22:01:50.242964,0 days 00:00:01.622024,0.0025848490466927874,gbtree,0.4172211904111963,6.256172207558856,depthwise,0.5202783035200377,0.006903425118550356,0,9,0.1790411983260545,700,,0.69419529134573,0.9671293368957755,none,0.977779448728593,4.223995003145658,,,,0.46728570056002366,0.8582249974408844,0.8545249795249795,0.69419529134573,0.7205971353641315,0.7124063954665047,0.9671293368957755,0.8194586989329335,0.8127304176339083,0.6819396716303933,0.6758832565284179,0.7639007698887939,0.753102267864784,none,0.9248577359382394,0.9231387760406723,0.977779448728593,COMPLETE
1710,0.6877147063634876,2025-09-23 22:01:50.378486,2025-09-23 22:02:57.134167,0 days 00:01:06.755681,0.0017041405439925954,dart,0.4784664913636189,8.327573881013919,lossguide,0.00017397254289939536,0.0908582749773202,8,5,27.206104035070016,1000,forest,0.4596243465180622,0.9118832278362513,oversample,0.9973850021057197,1.2867252973055603,0.0018247356154282184,uniform,0.6746852995033784,0.7078695068035492,0.7987511516020064,0.8045659295659295,0.4596243465180622,0.6834138486312399,0.6877147063634876,0.9118832278362513,0.8193747582285684,0.8106427550501327,0.5480371900826446,0.5566737288135594,0.9076133447390933,0.899443731279418,oversample,0.9247239991439924,0.9224926951689676,0.9973850021057197,COMPLETE
1711,0.717382735514387,2025-09-23 22:02:57.270007,2025-09-23 22:03:41.133504,0 days 00:00:43.863497,0.0031410521066668035,dart,0.2117856100124832,6.029661754549046,lossguide,0.0005354722499595741,0.06750638100895674,5,5,5.879147670590613,800,forest,0.49776592889206644,0.9761904522946192,none,0.9996455521389724,1.9608345198920183,0.0960339080603432,weighted,0.788710229662097,0.7160928737263332,0.8546422356433616,0.8531941031941032,0.49776592889206644,0.7228727556596409,0.717382735514387,0.9761904522946192,0.825442045065041,0.819002266043718,0.6647523330940417,0.6649616368286445,0.7921300256629598,0.7787762088147198,none,0.9270081729383955,0.9254327374244995,0.9996455521389724,COMPLETE
