number,value,datetime_start,datetime_complete,duration,params_alpha,params_booster,params_colsample_bytree,params_gamma,params_grow_policy,params_lambda,params_learning_rate,params_max_delta_step,params_max_depth,params_min_child_weight,params_n_estimators,params_normalize_type,params_params_decision_threshold,params_params_feature_fraction,params_params_resampling,params_params_sample_rows,params_params_scale_pos_weight,params_rate_drop,params_sample_type,params_skip_drop,params_subsample,user_attrs_acc_test,user_attrs_acc_val,user_attrs_decision_threshold,user_attrs_f1_test,user_attrs_f1_val,user_attrs_feature_fraction,user_attrs_pr_auc_test,user_attrs_pr_auc_val,user_attrs_prec_test,user_attrs_prec_val,user_attrs_rec_test,user_attrs_rec_val,user_attrs_resampling_strategy,user_attrs_roc_auc_test,user_attrs_roc_auc_val,user_attrs_sample_rows,state
0,0.3660897623936638,2025-09-23 10:49:17.694630,2025-09-23 10:49:52.201781,0 days 00:00:34.507151,60.53082080079022,dart,0.8333800304661316,4.375872112626925,lossguide,22.420123713724433,0.0036905100721932025,10,8,8.663279761354557,700,forest,0.6914473368931056,0.5716766437045232,none,0.7307396811264659,3.1486803115634836,0.03551802909894347,weighted,0.07841636973138665,0.5067532150606222,0.7765380284573651,0.7787674037674037,0.6914473368931056,0.35318518518518516,0.3660897623936638,0.5716766437045232,0.5307579450236353,0.5284721832096132,0.5747348119575699,0.582089552238806,0.2549187339606501,0.26700898587933247,none,0.8028998522937976,0.7999560296476262,0.7307396811264659,COMPLETE
1,0.6196702671972711,2025-09-23 10:49:52.302720,2025-09-23 10:49:52.728582,0 days 00:00:00.425862,0.5079406641139773,gbtree,0.6935471974998055,5.684339488686485,depthwise,0.00012963993440545028,0.0730915536707506,3,5,2.3358825194833552,500,,0.47481278151973655,0.5644631488274267,undersample,0.5301127358146349,2.492305066047412,,,,0.6896765781779371,0.7253557170641827,0.726044226044226,0.47481278151973655,0.6206701541071681,0.6196702671972711,0.5644631488274267,0.7761794151806265,0.7671552122553538,0.4635691657866948,0.46392849542455844,0.938836612489307,0.9328198545143346,undersample,0.9057715355378405,0.9014037690469334,0.5301127358146349,COMPLETE
2,,2025-09-23 10:49:52.831814,2025-09-23 10:50:07.822280,0 days 00:00:14.990466,0.8291821660947629,dart,0.573048618285045,2.088767560948347,depthwise,0.0009286607861420475,0.4528612698907591,1,7,0.202364548436489,700,tree,0.6351779629995216,0.8696317896991508,undersample,0.9882297325066979,0.6238330970396088,0.3281647947326367,weighted,0.12436465621375242,0.4026332820318257,,,,,,,,,,,,,,,,,FAIL
3,0.6425491135601341,2025-09-23 10:50:38.666877,2025-09-23 10:51:13.394300,0 days 00:00:34.727423,60.53082080079022,dart,0.8333800304661316,4.375872112626925,lossguide,22.420123713724433,0.0036905100721932025,10,8,8.663279761354557,700,forest,0.6914473368931056,0.5716766437045232,none,0.7307396811264659,3.1486803115634836,0.03551802909894347,weighted,0.07841636973138665,0.5067532150606222,0.8486027228989661,0.8472563472563472,0.6914473368931056,0.6527353838929326,0.6425491135601341,0.5716766437045232,0.751059179851206,0.7466101299317776,0.7235814679854242,0.7299945563418617,0.5945252352437981,0.5738125802310655,none,0.8957259942310429,0.8928850603126859,0.7307396811264659,COMPLETE
4,0.5942857142857143,2025-09-23 10:51:13.518457,2025-09-23 10:51:13.940724,0 days 00:00:00.422267,0.5079406641139773,gbtree,0.6935471974998055,5.684339488686485,depthwise,0.00012963993440545028,0.0730915536707506,3,5,2.3358825194833552,500,,0.47481278151973655,0.5644631488274267,undersample,0.5301127358146349,2.492305066047412,,,,0.6896765781779371,0.6840004094584912,0.6947174447174447,0.47481278151973655,0.5839061868176304,0.5942857142857143,0.5644631488274267,0.672695376392212,0.673019117913066,0.42629403660696713,0.43566726511071213,0.9264328485885372,0.9345314505776636,undersample,0.8713969200994746,0.874226653576907,0.5301127358146349,COMPLETE
5,0.7027995520716686,2025-09-23 10:51:14.056072,2025-09-23 10:51:44.136658,0 days 00:00:30.080586,0.8291821660947629,dart,0.573048618285045,2.088767560948347,depthwise,0.0009286607861420475,0.4528612698907591,1,7,0.202364548436489,700,tree,0.6351779629995216,0.8696317896991508,undersample,0.9882297325066979,0.6238330970396088,0.3281647947326367,weighted,0.12436465621375242,0.4026332820318257,0.8625243115979118,0.8641482391482391,0.6351779629995216,0.7024152448482163,0.7027995520716686,0.8696317896991508,0.815086519686568,0.810844548691062,0.728735632183908,0.737312030075188,0.6779298545765612,0.6713735558408216,undersample,0.9215217698866067,0.920864104950252,0.9882297325066979,COMPLETE
6,0.4269519107697934,2025-09-23 10:51:44.256588,2025-09-23 10:51:49.148416,0 days 00:00:04.891828,1.4283436757818848,dart,0.4123115927515564,4.1426299451467,depthwise,0.00024259674980082617,0.0002748971713832693,6,5,0.8993930726120073,300,tree,0.3732765448028467,0.6350039865960824,none,0.5100537730937468,1.9296695294319153,0.46464809878810703,uniform,0.2867120572061913,0.6532811633652602,0.3527484901218139,0.3583128583128583,0.3732765448028467,0.4248157918675521,0.4269519107697934,0.6350039865960824,0.6873385594507005,0.6833001814545833,0.2697862507221259,0.27148006045808626,0.9987168520102652,0.9991442019683354,none,0.8685404437678654,0.8731498521240657,0.5100537730937468,COMPLETE
7,0.6541164658634538,2025-09-23 10:51:49.264659,2025-09-23 10:52:00.044213,0 days 00:00:10.779554,0.04816729655337448,dart,0.7595834202540035,2.230816326406183,lossguide,52.058789939770044,0.015486217163293382,4,8,5.209016311370383,400,tree,0.6824334538892896,0.8300867687463425,none,0.7119275242790899,2.2027246078483267,0.4405515985555808,uniform,0.5231455853722728,0.8771269379769022,0.8598628314054663,0.8589271089271089,0.6824334538892896,0.6564617314930992,0.6541164658634538,0.8300867687463425,0.7992407036379567,0.7905231969567792,0.7941712204007286,0.7911353976927747,0.5594525235243798,0.5575524176294394,none,0.9109247621603209,0.9088023451468816,0.7119275242790899,COMPLETE
8,0.0,2025-09-23 10:52:00.162444,2025-09-23 10:52:15.856974,0 days 00:00:15.694530,0.8302424198157791,dart,0.5451347483471791,5.908727612481732,depthwise,0.27922319558850817,0.0012686370088250765,4,4,5.127370874628437,500,tree,0.6995388026271465,0.9240041146611172,undersample,0.9340630286841072,0.7053721507221737,0.44596167750783605,uniform,0.7255745901414772,0.7216826160013512,0.7606715119254785,0.7607493857493858,0.6995388026271465,0.0,0.0,0.9240041146611172,0.7711540986732218,0.7622582194350562,0.0,0.0,0.0,0.0,undersample,0.9028186777722023,0.9000195033503784,0.9340630286841072,COMPLETE
9,0.6554621848739496,2025-09-23 10:52:15.976721,2025-09-23 10:52:16.396982,0 days 00:00:00.420261,71.30648520760764,gbtree,0.2093712673480016,7.22055599470348,lossguide,15.786794495246708,0.037998645149514045,1,3,2.2941829510695264,500,,0.5084146424816517,0.6726758403484514,undersample,0.5999982624482001,0.566640996669681,,,,0.8846426739140889,0.8330433002354386,0.8363022113022113,0.5084146424816517,0.6577124868835257,0.6554621848739496,0.6726758403484514,0.7299011081576948,0.7256415459833162,0.6456530696332922,0.66015625,0.6702309666381523,0.6508344030808729,undersample,0.8892802376100213,0.8865325075705763,0.5999982624482001,COMPLETE
10,0.6037151702786377,2025-09-23 11:09:02.718595,2025-09-23 11:09:43.452386,0 days 00:00:40.733791,60.53082080079022,dart,0.8333800304661316,4.375872112626925,lossguide,22.420123713724433,0.0036905100721932025,10,8,8.663279761354557,700,forest,0.6914473368931056,0.5716766437045232,none,0.7307396811264659,3.1486803115634836,0.03551802909894347,weighted,0.07841636973138665,0.5067532150606222,0.8454294195925888,0.8427518427518428,0.6914473368931056,0.6157760814249363,0.6037151702786377,0.5716766437045232,0.7524313270015317,0.7454172435705362,0.7600502512562815,0.7602339181286549,0.5175363558597091,0.5006418485237484,none,0.8897862905022184,0.8885492069760381,0.7307396811264659,COMPLETE
11,0.6111497289031003,2025-09-23 11:09:43.676927,2025-09-23 11:09:44.181305,0 days 00:00:00.504378,0.5079406641139773,gbtree,0.6935471974998055,5.684339488686485,depthwise,0.00012963993440545028,0.0730915536707506,3,5,2.3358825194833552,500,,0.47481278151973655,0.5644631488274267,undersample,0.5301127358146349,2.492305066047412,,,,0.6896765781779371,0.7126625038386734,0.7136568386568387,0.47481278151973655,0.6096509525796134,0.6111497289031003,0.5644631488274267,0.7350684357534588,0.7232976987544661,0.45167937358335053,0.45263591433278416,0.9375534644995723,0.9405220367993153,undersample,0.8937462752561663,0.8918838652934051,0.5301127358146349,COMPLETE
12,0.7069232470692325,2025-09-23 11:09:44.394329,2025-09-23 11:10:20.941153,0 days 00:00:36.546824,0.8291821660947629,dart,0.573048618285045,2.088767560948347,depthwise,0.0009286607861420475,0.4528612698907591,1,7,0.202364548436489,700,tree,0.6351779629995216,0.8696317896991508,undersample,0.9882297325066979,0.6238330970396088,0.3281647947326367,weighted,0.12436465621375242,0.4026332820318257,0.8618077592384072,0.8643529893529893,0.6351779629995216,0.7051114023591087,0.7069232470692325,0.8696317896991508,0.8124312926286512,0.8055361546473382,0.7205357142857143,0.7316849816849816,0.6903336184773311,0.6837826272999572,undersample,0.9206853321444083,0.9193778598219868,0.9882297325066979,COMPLETE
13,0.47821159987637785,2025-09-23 11:10:21.064057,2025-09-23 11:10:26.393014,0 days 00:00:05.328957,1.4283436757818848,dart,0.4123115927515564,4.1426299451467,depthwise,0.00024259674980082617,0.0002748971713832693,6,5,0.8993930726120073,300,tree,0.3732765448028467,0.6350039865960824,none,0.5100537730937468,1.9296695294319153,0.46464809878810703,uniform,0.2867120572061913,0.6532811633652602,0.47916879926297473,0.48147010647010646,0.3732765448028467,0.4774034511092851,0.47821159987637785,0.6350039865960824,0.7664661565283993,0.7619025668603281,0.3141389564747229,0.31492537313432833,0.9940119760479041,0.9931536157466838,none,0.9003143145625239,0.8996285725983282,0.5100537730937468,COMPLETE
14,0.6565228236467947,2025-09-23 11:10:26.516750,2025-09-23 11:10:38.508394,0 days 00:00:11.991644,0.04816729655337448,dart,0.7595834202540035,2.230816326406183,lossguide,52.058789939770044,0.015486217163293382,4,8,5.209016311370383,400,tree,0.6824334538892896,0.8300867687463425,none,0.7119275242790899,2.2027246078483267,0.4405515985555808,uniform,0.5231455853722728,0.8771269379769022,0.8640597809397073,0.859029484029484,0.6824334538892896,0.6707982151710461,0.6565228236467947,0.8300867687463425,0.8039568329641074,0.7968202686800587,0.7977594339622641,0.7870813397129187,0.5786997433704021,0.5631151048352588,none,0.9155151258127382,0.9141926577457986,0.7119275242790899,COMPLETE
15,0.0,2025-09-23 11:10:38.631747,2025-09-23 11:10:57.956096,0 days 00:00:19.324349,0.8302424198157791,dart,0.5451347483471791,5.908727612481732,depthwise,0.27922319558850817,0.0012686370088250765,4,4,5.127370874628437,500,tree,0.6995388026271465,0.9240041146611172,undersample,0.9340630286841072,0.7053721507221737,0.44596167750783605,uniform,0.7255745901414772,0.7216826160013512,0.7606715119254785,0.7607493857493858,0.6995388026271465,0.0,0.0,0.9240041146611172,0.7694520717856609,0.7612181854114235,0.0,0.0,0.0,0.0,undersample,0.9018753829787797,0.8989498421852458,0.9340630286841072,COMPLETE
16,0.6314080259800511,2025-09-23 11:10:58.168913,2025-09-23 11:10:58.672455,0 days 00:00:00.503542,71.30648520760764,gbtree,0.2093712673480016,7.22055599470348,lossguide,15.786794495246708,0.037998645149514045,1,3,2.2941829510695264,500,,0.5084146424816517,0.6726758403484514,undersample,0.5999982624482001,0.566640996669681,,,,0.8846426739140889,0.8346811342000204,0.8373259623259623,0.5084146424816517,0.6323696790348281,0.6314080259800511,0.6726758403484514,0.7279969335187546,0.7237414170650196,0.6759124087591241,0.6894630192502533,0.5940975192472199,0.5823705605477107,undersample,0.8809208677632911,0.8773213636774833,0.5999982624482001,COMPLETE
17,0.6280825364871666,2025-09-23 11:10:58.886062,2025-09-23 11:10:59.307245,0 days 00:00:00.421183,0.4828316556556039,gbtree,0.6719279810836568,2.3789282137450862,depthwise,40.298045932583044,0.019898941052492777,4,4,5.391204002783814,200,,0.38393749959004886,0.6271782408851965,none,0.9721861949919668,0.7676495686400058,,,,0.6285062424199667,0.8521854846964889,0.8486895986895987,0.38393749959004886,0.6427511133102425,0.6280825364871666,0.6271782408851965,0.7628378125436734,0.7568125724812114,0.7623239436619719,0.7623701893708003,0.5556030795551754,0.5340179717586649,none,0.8922149357205769,0.8921982970759313,0.9721861949919668,COMPLETE
18,0.6656540084388186,2025-09-23 11:10:59.520421,2025-09-23 11:11:13.296598,0 days 00:00:13.776177,1.1922206532486979,dart,0.6292633688869778,0.24678728391331228,lossguide,0.00025321987424989096,0.0024962766973491597,2,9,0.3457888877316665,400,forest,0.5353268454214423,0.592817972152976,none,0.8144909217955744,3.38858558926625,0.3315391015500504,weighted,0.23699013906343558,0.5629574756448363,0.7981369638652882,0.7971949221949222,0.5353268454214423,0.6701237872198059,0.6656540084388186,0.592817972152976,0.7512131858024897,0.7413245308220983,0.5502747252747253,0.5496098104793757,0.8567151411462789,0.8438168592212237,none,0.8996200746899994,0.8952478045486743,0.8144909217955744,COMPLETE
19,,2025-09-23 11:11:13.424035,2025-09-23 11:11:13.509882,0 days 00:00:00.085847,0.000142552982584589,gbtree,0.5397483750012051,2.13311977367482,lossguide,0.1285891375725624,0.05051422644225127,3,12,0.5778630530599798,300,,0.5347137385832674,0.6980298514036469,oversample,0.5587659279810165,3.654480175121868,,,,0.36597606035288754,,,,,,,,,,,,,,,,,FAIL
20,0.6265713581464136,2025-09-23 11:57:48.486559,2025-09-23 11:58:22.659535,0 days 00:00:34.172976,60.53082080079022,dart,0.8333800304661316,4.375872112626925,lossguide,22.420123713724433,0.0036905100721932025,10,8,8.663279761354557,700,forest,0.6914473368931056,0.5716766437045232,none,0.7307396811264659,3.1486803115634836,0.03551802909894347,weighted,0.07841636973138665,0.5067532150606222,0.8479885351622479,0.8449017199017199,0.6914473368931056,0.6394756008739986,0.6265713581464136,0.5716766437045232,0.7457215113913082,0.7409204497336,0.7394722066254913,0.7389534883720931,0.5633019674935843,0.543859649122807,none,0.890586667946764,0.8885900332985014,0.7307396811264659,COMPLETE
21,0.6101361785764425,2025-09-23 11:58:22.786720,2025-09-23 11:58:23.214410,0 days 00:00:00.427690,0.5079406641139773,gbtree,0.6935471974998055,5.684339488686485,depthwise,0.00012963993440545028,0.0730915536707506,3,5,2.3358825194833552,500,,0.47481278151973655,0.5644631488274267,undersample,0.5301127358146349,2.492305066047412,,,,0.6896765781779371,0.7108199406285188,0.7157043407043407,0.47481278151973655,0.6075843867203778,0.6101361785764425,0.5644631488274267,0.7031527732001664,0.6881782743215737,0.44990742645546183,0.4540325950689511,0.935414884516681,0.9298245614035088,undersample,0.8877286087609084,0.8862064728205237,0.5301127358146349,COMPLETE
22,0.7092893740253954,2025-09-23 11:58:23.331912,2025-09-23 11:58:53.209913,0 days 00:00:29.878001,0.8291821660947629,dart,0.573048618285045,2.088767560948347,depthwise,0.0009286607861420475,0.4528612698907591,1,7,0.202364548436489,700,tree,0.6351779629995216,0.8696317896991508,undersample,0.9882297325066979,0.6238330970396088,0.3281647947326367,weighted,0.12436465621375242,0.4026332820318257,0.8638550516941345,0.8664004914004914,0.6351779629995216,0.7062720848056537,0.7092893740253954,0.8696317896991508,0.8144049084689453,0.8106567416950223,0.7301369863013699,0.7397769516728625,0.6839178785286569,0.6812152332049636,undersample,0.9229024504770953,0.9211227676307954,0.9882297325066979,COMPLETE
23,0.5133928571428571,2025-09-23 11:58:53.326814,2025-09-23 11:58:58.145288,0 days 00:00:04.818474,1.4283436757818848,dart,0.4123115927515564,4.1426299451467,depthwise,0.00024259674980082617,0.0002748971713832693,6,5,0.8993930726120073,300,tree,0.3732765448028467,0.6350039865960824,none,0.5100537730937468,1.9296695294319153,0.46464809878810703,uniform,0.2867120572061913,0.6532811633652602,0.5484696488893438,0.5536445536445537,0.3732765448028467,0.5104871823327045,0.5133928571428571,0.6350039865960824,0.7622159306085395,0.7590367730784083,0.34467256106698635,0.3472746489506266,0.9837467921300257,0.9841677364142063,none,0.8933703905413695,0.8921363665966515,0.5100537730937468,COMPLETE
24,0.6551896207584831,2025-09-23 11:58:58.263990,2025-09-23 11:59:09.056311,0 days 00:00:10.792321,0.04816729655337448,dart,0.7595834202540035,2.230816326406183,lossguide,52.058789939770044,0.015486217163293382,4,8,5.209016311370383,400,tree,0.6824334538892896,0.8300867687463425,none,0.7119275242790899,2.2027246078483267,0.4405515985555808,uniform,0.5231455853722728,0.8771269379769022,0.8631384993346299,0.8585176085176085,0.6824334538892896,0.6693049715557754,0.6551896207584831,0.8300867687463425,0.802390618630874,0.793550490126282,0.7935483870967742,0.7857570317175344,0.5786997433704021,0.5618314077877621,none,0.9146381094434927,0.9127656079059568,0.7119275242790899,COMPLETE
25,0.0,2025-09-23 11:59:09.174148,2025-09-23 11:59:24.840757,0 days 00:00:15.666609,0.8302424198157791,dart,0.5451347483471791,5.908727612481732,depthwise,0.27922319558850817,0.0012686370088250765,4,4,5.127370874628437,500,tree,0.6995388026271465,0.9240041146611172,undersample,0.9340630286841072,0.7053721507221737,0.44596167750783605,uniform,0.7255745901414772,0.7216826160013512,0.7606715119254785,0.7607493857493858,0.6995388026271465,0.0,0.0,0.9240041146611172,0.752443494188292,0.7458266367208309,0.0,0.0,0.0,0.0,undersample,0.8894975491084848,0.8861912421261773,0.9340630286841072,COMPLETE
26,0.6373320981936081,2025-09-23 11:59:24.959017,2025-09-23 11:59:25.374966,0 days 00:00:00.415949,71.30648520760764,gbtree,0.2093712673480016,7.22055599470348,lossguide,15.786794495246708,0.037998645149514045,1,3,2.2941829510695264,500,,0.5084146424816517,0.6726758403484514,undersample,0.5999982624482001,0.566640996669681,,,,0.8846426739140889,0.8393899068481933,0.8396805896805897,0.5084146424816517,0.6439754935330156,0.6373320981936081,0.6726758403484514,0.71607533988623,0.715435882709148,0.6858385693571774,0.6945986875315497,0.606928999144568,0.5887890457851946,undersample,0.8832294750714269,0.8832160166787908,0.5999982624482001,COMPLETE
27,0.6581608088589311,2025-09-23 11:59:25.495358,2025-09-23 11:59:25.873905,0 days 00:00:00.378547,0.4828316556556039,gbtree,0.6719279810836568,2.3789282137450862,depthwise,40.298045932583044,0.019898941052492777,4,4,5.391204002783814,200,,0.38393749959004886,0.6271782408851965,none,0.9721861949919668,0.7676495686400058,,,,0.6285062424199667,0.8558706111167981,0.8546273546273546,0.38393749959004886,0.6652401331431289,0.6581608088589311,0.6271782408851965,0.7795984042773229,0.7710310827636742,0.7489293361884368,0.7523390203632361,0.5983746792130026,0.5849379546427044,none,0.9066233413558143,0.9039983998845575,0.9721861949919668,COMPLETE
28,0.6595044186449489,2025-09-23 11:59:25.990900,2025-09-23 11:59:39.695063,0 days 00:00:13.704163,1.1922206532486979,dart,0.6292633688869778,0.24678728391331228,lossguide,0.00025321987424989096,0.0024962766973491597,2,9,0.3457888877316665,400,forest,0.5353268454214423,0.592817972152976,none,0.8144909217955744,3.38858558926625,0.3315391015500504,weighted,0.23699013906343558,0.5629574756448363,0.7929163681031836,0.7988329238329238,0.5353268454214423,0.65318018172467,0.6595044186449489,0.592817972152976,0.7268567215169521,0.7224245867131811,0.5450643776824035,0.5541642399534071,0.8147989734816082,0.8142918271287976,none,0.8872368878944343,0.8900369780528862,0.8144909217955744,COMPLETE
29,0.6829514824797843,2025-09-23 11:59:39.815101,2025-09-23 11:59:41.881866,0 days 00:00:02.066765,0.000142552982584589,gbtree,0.5397483750012051,2.13311977367482,lossguide,0.1285891375725624,0.05051422644225127,3,12,0.5778630530599798,300,,0.5347137385832674,0.6980298514036469,oversample,0.5587659279810165,3.654480175121868,,,,0.36597606035288754,0.8043812058552564,0.8073300573300574,0.5347137385832674,0.6804882126734659,0.6829514824797843,0.6980298514036469,0.8044365281734731,0.7981773896823185,0.5586055448805929,0.5632120033342595,0.8704020530367835,0.8673513050919983,oversample,0.9138321776195001,0.9123263650459422,0.5587659279810165,COMPLETE
30,0.0,2025-09-23 11:59:42.000434,2025-09-23 11:59:42.374717,0 days 00:00:00.374283,26.44346965643744,gbtree,0.6417539759379253,7.653252538069653,lossguide,3.1044289096576936,0.002067287365844946,3,7,66.26677506544725,300,,0.3963315119661787,0.6408650528769746,none,0.508214814795737,0.6298888875108483,,,,0.26673794835361486,0.7606715119254785,0.7607493857493858,0.3963315119661787,0.0,0.0,0.6408650528769746,0.6218909848625302,0.61001566970232,0.0,0.0,0.0,0.0,none,0.8571472603555793,0.8555778631963487,0.508214814795737,COMPLETE
