number,value,datetime_start,datetime_complete,duration,params_alpha,params_booster,params_colsample_bytree,params_gamma,params_grow_policy,params_lambda,params_learning_rate,params_max_delta_step,params_max_depth,params_min_child_weight,params_n_estimators,params_normalize_type,params_params_decision_threshold,params_params_feature_fraction,params_params_resampling,params_params_sample_rows,params_params_scale_pos_weight,params_rate_drop,params_sample_type,params_skip_drop,params_subsample,user_attrs_acc_test,user_attrs_acc_val,user_attrs_decision_threshold,user_attrs_f1_test,user_attrs_f1_val,user_attrs_feature_fraction,user_attrs_pr_auc_test,user_attrs_pr_auc_val,user_attrs_prec_test,user_attrs_prec_val,user_attrs_rec_test,user_attrs_rec_val,user_attrs_resampling_strategy,user_attrs_roc_auc_test,user_attrs_roc_auc_val,user_attrs_sample_rows,state
1071,0.6453934740882917,2025-09-23 16:36:43.622907,2025-09-23 16:37:30.083811,0 days 00:00:46.460904,0.008921514039800361,dart,0.5740841716797328,6.731199061675403,lossguide,0.0014623348166054417,0.01644657003265712,6,10,0.9059583229016986,800,forest,0.6884081659825557,0.9013664322765033,none,0.7376267581910159,2.2766493470698084,0.13304733371324573,weighted,0.706457675238339,0.43341264754143344,0.846043607329307,0.8486895986895987,0.6884081659825557,0.6425855513307985,0.6453934740882917,0.9013664322765033,0.7506537813175449,0.7443664615863579,0.7229946524064171,0.7345712725286728,0.5782720273738238,0.5755241762943946,none,0.8992085038067356,0.9003058922287586,0.7376267581910159,COMPLETE
1072,0.6656829679595279,2025-09-23 16:37:30.217494,2025-09-23 16:37:47.914233,0 days 00:00:17.696739,0.00044151503137400503,dart,0.9086387669067395,0.032229259941613186,lossguide,0.00022970365773827326,0.03746490876175512,8,10,0.17067888986747562,400,forest,0.33411706213791864,0.9125587034488974,none,0.9406202084169378,0.6618144910235139,0.18807117134216206,weighted,0.7026660065873715,0.6558130794604357,0.8366260620329614,0.8376330876330876,0.33411706213791864,0.6672226855713094,0.6656829679595279,0.9125587034488974,0.7385200648986308,0.7333136774476894,0.6509357200976403,0.6560033236393851,0.6843455945252352,0.6756525459991441,none,0.8957523271698716,0.8950408801625358,0.9406202084169378,COMPLETE
1073,0.69695109474115,2025-09-23 16:37:48.046643,2025-09-23 16:37:51.366266,0 days 00:00:03.319623,0.0145808046685067,gbtree,0.9824411341318635,3.2278914978280935,lossguide,0.0003109500470725288,0.0014577775552050637,8,12,1.5916179899868774,300,,0.30660276373265877,0.9727904318243098,none,0.8606309280747828,1.093156840205731,,,,0.6424536145346188,0.8470672535571706,0.8483824733824734,0.30660276373265877,0.6980598221503638,0.69695109474115,0.9727904318243098,0.8000378093339227,0.794941204211282,0.6616858237547892,0.667843137254902,0.7386655260906758,0.7287120239623449,none,0.9106136881321274,0.9095947443336492,0.8606309280747828,COMPLETE
1074,0.6952642415923129,2025-09-23 16:37:51.499384,2025-09-23 16:37:52.524942,0 days 00:00:01.025558,0.0064169689422737255,gbtree,0.6146355505584459,3.6284161095545584,depthwise,40.061915525260304,0.025171944938129593,3,9,1.1002309028613868,900,,0.6384331204306626,0.9049371390559546,undersample,0.9367056774713327,2.010584774954336,,,,0.9979251658202265,0.8128774695465247,0.8181818181818182,0.6384331204306626,0.6898540889039702,0.6952642415923129,0.9049371390559546,0.8121181515490288,0.8049581041807805,0.5717097862767154,0.5803494700658837,0.869546621043627,0.866923406076166,undersample,0.9211382874714267,0.919479292215526,0.9367056774713327,COMPLETE
1075,0.6683947417144973,2025-09-23 16:37:52.657243,2025-09-23 16:38:12.765657,0 days 00:00:20.108414,0.0021012104927588277,dart,0.24606455219700804,3.5605203417776767,lossguide,0.0001875517233455227,0.007060850644783958,5,10,0.12060446327052396,500,forest,0.6388814952654314,0.6948384727167998,none,0.9267075269543137,4.17743002428013,0.005062863386640165,weighted,0.7570839978789005,0.4147521344241384,0.8172791483263384,0.8166461916461917,0.6388814952654314,0.6744482947291629,0.6683947417144973,0.6948384727167998,0.768850324576506,0.7652863937258961,0.5879173290937997,0.5890992167101827,0.7908468776732249,0.7723577235772358,none,0.9034905562310984,0.9018964201073496,0.9267075269543137,COMPLETE
1076,0.6775328764586035,2025-09-23 16:38:12.895673,2025-09-23 16:38:13.995542,0 days 00:00:01.099869,0.00830772059463509,gbtree,0.73972309319414,2.33422612479495,depthwise,0.001940278836605843,0.011239187694887173,8,9,0.19464273224631382,300,,0.3475637612590826,0.8928413121844713,none,0.9446714541602577,1.1717551024019015,,,,0.5558373678791436,0.8176886068174839,0.8217649467649467,0.3475637612590826,0.6733907940583165,0.6775328764586035,0.8928413121844713,0.7514665931297768,0.7421044015692011,0.589406099518459,0.5973220117570216,0.7852865697177075,0.7826272999572101,none,0.8994740491909656,0.8993919354020475,0.9446714541602577,COMPLETE
1077,0.7069533217121828,2025-09-23 16:38:14.124607,2025-09-23 16:38:14.974406,0 days 00:00:00.849799,0.0004560169697483579,gbtree,0.6523785863946406,1.8430394406905368,depthwise,30.491761245596972,0.1708465895890651,10,12,3.4720359690028646,1000,,0.6218527515136437,0.900495077896532,undersample,0.9071626131396352,0.9985769752016874,,,,0.7425440623686883,0.8454294195925888,0.8451064701064701,0.6218527515136437,0.710172744721689,0.7069533217121828,0.900495077896532,0.8110159504805602,0.8070487439488386,0.6441504178272981,0.645789101203114,0.7912745936698032,0.7809157038938811,undersample,0.9213393675190713,0.9196833662448772,0.9071626131396352,COMPLETE
1078,0.6858084255118851,2025-09-23 16:38:15.105892,2025-09-23 16:38:21.866242,0 days 00:00:06.760350,0.9510512577813046,dart,0.6901460276274287,4.681674933243253,depthwise,0.00012624893012353605,0.2349923522151477,4,11,53.39847497463077,300,forest,0.6436780391736635,0.9215816466088564,none,0.8294507774917309,1.8388487173342343,0.13848186181956357,weighted,0.7315554835635718,0.6651353103250058,0.8655952502815027,0.8633292383292384,0.6436780391736635,0.6937252157686028,0.6858084255118851,0.9215816466088564,0.8089510319697745,0.8005376937216542,0.7629553617239611,0.7620292887029289,0.6360136869118905,0.6234488660676081,none,0.9196048470565645,0.9169552005105076,0.8294507774917309,COMPLETE
1079,0.6877718704688255,2025-09-23 16:38:21.994604,2025-09-23 16:38:23.813673,0 days 00:00:01.819069,0.00018190438953757707,gbtree,0.5832646625546963,0.5922926936519671,lossguide,0.13575109421667364,0.034546059518418465,10,11,1.0737053651364294,200,,0.3964113154625026,0.9316436161340903,none,0.7457258127486381,0.5288251585810732,,,,0.6112073144174387,0.8685638243423073,0.8677313677313677,0.3964113154625026,0.6906024096385542,0.6877718704688255,0.9316436161340903,0.8214415593683513,0.8173227263058462,0.7908388520971302,0.79011660188784,0.6129170230966638,0.6089002995293111,none,0.9249333388128869,0.9230902336008465,0.7457258127486381,COMPLETE
1080,0.7133658536585366,2025-09-23 16:38:23.944035,2025-09-23 16:38:42.501790,0 days 00:00:18.557755,0.004571375898454965,dart,0.20282441621692598,6.217318168300288,lossguide,0.19882596903482566,0.04583642604726304,6,8,0.18137810095332416,500,forest,0.6616520433991354,0.9151024010006287,none,0.8312408832107002,4.294594185950838,0.09358972476691377,weighted,0.7647414046647631,0.49543757757257684,0.852492578564848,0.8496109746109746,0.6616520433991354,0.7217609577138444,0.7133658536585366,0.9151024010006287,0.824505905805544,0.8172819583999771,0.6578669482576558,0.6556671449067432,0.7994011976047904,0.7821994009413779,none,0.9267096466275018,0.9246002604938188,0.8312408832107002,COMPLETE
1081,0.7080864079525904,2025-09-23 16:38:42.630293,2025-09-23 16:39:08.753957,0 days 00:00:26.123664,0.07859285379847518,dart,0.45818312928570787,7.0028152940118895,lossguide,5.817507470664058,0.013630685585319137,6,7,0.10273771453493487,600,forest,0.6693813148299844,0.893555546686236,none,0.9391804443952281,4.432102932417851,0.08207058081525537,weighted,0.643286138861771,0.37227051109205167,0.8442010441191524,0.8436732186732187,0.6693813148299844,0.7128301886792453,0.7080864079525904,0.893555546686236,0.815712342453543,0.8062241569901207,0.6377447670492911,0.6399447131997236,0.8079555175363559,0.7924689773213521,none,0.9231627292735598,0.9203524227197736,0.9391804443952281,COMPLETE
1082,0.7140746213520502,2025-09-23 16:39:08.886146,2025-09-23 16:39:53.750153,0 days 00:00:44.864007,0.05462952215278807,dart,0.3165760108570746,2.5910774025571444,depthwise,0.00047893360705812086,0.08630923472270097,4,10,0.19648977386292166,800,forest,0.30769563933727584,0.9576564554981376,none,0.6907465327970197,1.1543450817746015,0.06946713662217249,weighted,0.7435424152769198,0.35249049150778,0.8402088238304842,0.8415233415233415,0.30769563933727584,0.7147816553992326,0.7140746213520502,0.9576564554981376,0.8237007746704952,0.8173463154119531,0.6239234449760765,0.6282092947676308,0.8366124893071001,0.8271287976037656,none,0.9258441131463355,0.9248402375020923,0.6907465327970197,COMPLETE
1083,0.7164347499059797,2025-09-23 16:39:53.878047,2025-09-23 16:40:40.233515,0 days 00:00:46.355468,0.002207346179029565,dart,0.2797880988792823,1.84352731752776,depthwise,0.0008223328004820025,0.07759862411051949,4,10,0.2551721719949067,800,forest,0.30638651822742163,0.9855172001433368,none,0.7593704675588182,1.0943636273464803,0.06520051652495441,weighted,0.7479304659016707,0.4999771061411798,0.8434844917596479,0.8456183456183456,0.30638651822742163,0.7136167821689455,0.7164347499059797,0.9855172001433368,0.824588822680375,0.8189249401070462,0.6347884038653782,0.6390472995639047,0.8147989734816082,0.8151476251604621,none,0.9265700964412946,0.9240685105999009,0.7593704675588182,COMPLETE
1084,0.7110711071107111,2025-09-23 16:40:40.365046,2025-09-23 16:41:52.637751,0 days 00:01:12.272705,0.17924567012756645,dart,0.27467588568277546,1.2123465326199065,depthwise,0.00019355625930020937,0.08148509672955584,3,11,0.24971865112193778,1000,forest,0.41032534674295174,0.9678726596049394,none,0.6999772870607353,0.793645537559987,0.07260051345730732,weighted,0.7448723996088011,0.2975794321970936,0.8666188965093664,0.8685503685503686,0.41032534674295174,0.708305350346989,0.7110711071107111,0.9678726596049394,0.8178921297382562,0.8142290240011911,0.7430718647252231,0.7498813478879924,0.6766467065868264,0.6760804450149764,none,0.9231079337374619,0.9219824813041066,0.6999772870607353,COMPLETE
1085,0.7192546583850932,2025-09-23 16:41:52.768822,2025-09-23 16:42:26.842607,0 days 00:00:34.073785,0.0028499608467742075,dart,0.25459112315306687,2.4558450296537346,depthwise,0.11811075988414557,0.37220812648050683,5,12,0.10955409040320462,700,forest,0.3269115823316902,0.9259348378511362,none,0.6683646917961028,0.8006224541631228,0.05684221313529352,weighted,0.6794931683084837,0.5672283276180884,0.8619101238611936,0.8611793611793612,0.3269115823316902,0.7217983089296762,0.7192546583850932,0.9259348378511362,0.8226615806168036,0.8163489771965784,0.6969334926324173,0.6967509025270758,0.7485029940119761,0.7432605905006419,none,0.9256621424663217,0.9229488098378423,0.6683646917961028,COMPLETE
1086,0.7158074137196421,2025-09-23 16:42:26.971932,2025-09-23 16:43:12.073903,0 days 00:00:45.101971,0.00010505678461282914,dart,0.3468509514815403,1.809519223276014,depthwise,0.6375636991836743,0.3657357622329107,4,9,0.18784995807516672,800,forest,0.3402208507933077,0.9857823925835913,none,0.6688320750369968,0.738196687312236,0.040439104056481955,weighted,0.6102053104822419,0.44950735683091897,0.8608864776333299,0.8634316134316135,0.3402208507933077,0.7135932560590095,0.7158074137196421,0.9857823925835913,0.8217631374225276,0.8168051802317817,0.7033651848774408,0.7127704709376326,0.7241231822070145,0.7188703465982028,none,0.9240096138537848,0.9231754275981449,0.6688320750369968,COMPLETE
1087,0.6956134491204632,2025-09-23 16:43:12.205996,2025-09-23 16:43:29.373893,0 days 00:00:17.167897,0.0008833074584713936,dart,0.47911676101182404,3.5997383154070812,depthwise,0.021050990606822865,0.2816262876240009,5,12,0.16440219413237084,500,forest,0.37070781261555547,0.7404230073102666,none,0.5926237045390957,0.7573517276127524,0.039999646955297244,weighted,0.5981747940622597,0.467675319174035,0.8601699252738254,0.860053235053235,0.37070781261555547,0.7018769096464426,0.6956134491204632,0.7404230073102666,0.7972849488232643,0.7897121602501265,0.7165775401069518,0.7251624883936861,0.6877673224978614,0.6683782627299957,none,0.9155559058939622,0.9128034974971853,0.5926237045390957,COMPLETE
1088,0.6904259805989034,2025-09-23 16:43:29.507451,2025-09-23 16:44:15.977609,0 days 00:00:46.470158,0.0001590036110374035,dart,0.5245638431442023,0.4326520410427732,depthwise,0.23806527416400422,0.2771032008142602,4,11,0.23413636850661948,800,forest,0.3516279316235625,0.9943981808493442,none,0.5392660328039635,0.9675869287550818,0.013750285389278964,weighted,0.6594542383420763,0.7684832902499972,0.8508547446002661,0.8497133497133497,0.3516279316235625,0.6941003569179088,0.6904259805989034,0.9943981808493442,0.798344868828313,0.7922774654588151,0.6816494845360824,0.6806652806652806,0.7070145423438836,0.7004706889174155,none,0.9130988268575024,0.9117253140531745,0.5392660328039635,COMPLETE
1089,0.7161114602975068,2025-09-23 16:44:16.110269,2025-09-23 16:44:59.897580,0 days 00:00:43.787311,0.0003586815256795649,dart,0.46193022936508304,4.268860452704816,depthwise,0.4677434160078269,0.0580325606017312,2,7,0.15173041008486163,800,forest,0.3072896616794999,0.9228586562022882,none,0.7634158030072303,0.6969811111749389,0.05510376439343051,weighted,0.6998424865230221,0.3661977171636698,0.8622172177295526,0.8612817362817363,0.3072896616794999,0.7201663201663202,0.7161114602975068,0.9228586562022882,0.8198826919297981,0.814724478888794,0.7006472491909385,0.701559934318555,0.7408041060735672,0.7312794180573384,none,0.9239996850407841,0.9227403307116385,0.7634158030072303,COMPLETE
1090,0.6985517009093971,2025-09-23 16:45:00.029101,2025-09-23 16:45:58.001504,0 days 00:00:57.972403,0.0003900947479185541,dart,0.24808576954538314,2.496313116975255,depthwise,0.022192281948743203,0.24034243661443364,2,9,0.23730129547495712,900,forest,0.3178710048475142,0.995532976015377,none,0.7231723703215742,2.301821026846101,0.047376729637189766,weighted,0.668697534201511,0.4364027827419791,0.8089876138806429,0.8167485667485668,0.3178710048475142,0.6902390438247012,0.6985517009093971,0.995532976015377,0.8182543455833532,0.8115078952576155,0.564026044492675,0.5759511246875868,0.8892215568862275,0.8874625588361147,none,0.9233517220705945,0.9211635939532588,0.7231723703215742,COMPLETE
1091,0.716348195329087,2025-09-23 16:45:58.134249,2025-09-23 16:46:25.465901,0 days 00:00:27.331652,0.009567822757333018,dart,0.3442187321703291,0.14632623766494657,depthwise,0.000866372008472491,0.14805921025425195,5,9,0.3492606545860012,600,forest,0.3029081016904913,0.9836202972541458,none,0.8399462127651401,0.6052529951723878,0.07185083439205904,weighted,0.6556288538940046,0.7869853254668351,0.8625243115979118,0.8632268632268633,0.3029081016904913,0.7146802634374336,0.716348195329087,0.9836202972541458,0.8189663856510206,0.8160230662763148,0.7100042211903757,0.7109144542772862,0.7194183062446535,0.7218656397090286,none,0.9228684335003792,0.9227575768097735,0.8399462127651401,COMPLETE
1092,0.7181723779854621,2025-09-23 16:46:25.598578,2025-09-23 16:46:38.073425,0 days 00:00:12.474847,0.0027091711397249094,dart,0.4427587684320593,0.8686690352582433,depthwise,0.0001564314592140611,0.17170713877090726,6,9,0.30147420474310216,400,forest,0.33355549244681815,0.9402139675735388,none,0.8320588758161398,0.7871823090103508,0.04915179941739774,weighted,0.6149631845098489,0.7791101192101686,0.8560753403623708,0.8610769860769861,0.33355549244681815,0.7103419859909353,0.7181723779854621,0.9402139675735388,0.8179771998870076,0.8146064180412701,0.685214626391097,0.6977401129943502,0.737382378100941,0.7398373983739838,none,0.9235988775663967,0.9211789110220534,0.8320588758161398,COMPLETE
1093,0.6991525423728814,2025-09-23 16:46:38.206470,2025-09-23 16:47:32.193767,0 days 00:00:53.987297,0.00681063385284883,dart,0.3645333887982538,6.155129810783925,depthwise,9.710860229422972,0.08162077291382376,2,6,0.6263610993022843,900,forest,0.3029198918036509,0.8976590424374206,none,0.7613407006952145,0.6756919538335051,0.011254451987366965,weighted,0.5261909352292375,0.35684163873708274,0.852492578564848,0.8546273546273546,0.3029198918036509,0.6984724837832182,0.6991525423728814,0.8976590424374206,0.8012135228192886,0.7949132836207673,0.6837361736993036,0.692404532102392,0.713857998289136,0.7060333761232349,none,0.9152288594274626,0.9143429492854731,0.7613407006952145,COMPLETE
1094,0.7224571555753394,2025-09-23 16:47:32.326900,2025-09-23 16:47:58.121375,0 days 00:00:25.794475,0.000521707565492885,dart,0.47378083736706367,1.4053327163831197,depthwise,0.0001523535292609022,0.17190235530300968,4,7,0.16804760948860764,600,forest,0.32497145251644566,0.9124410753937136,none,0.9973119322237063,0.5931979552391686,0.04640356519555246,weighted,0.6469583911301786,0.8323891330845202,0.8703040229296755,0.8723382473382474,0.32497145251644566,0.7202472952086554,0.7224571555753394,0.9124410753937136,0.8280037398874406,0.8278051347385411,0.744408945686901,0.7527829313543599,0.6976047904191617,0.6944801026957638,none,0.9275486457156626,0.9280031258336933,0.9973119322237063,COMPLETE
1095,0.6993810786914235,2025-09-23 16:47:58.254419,2025-09-23 16:48:42.365301,0 days 00:00:44.110882,0.0006886752060363328,dart,0.4430779823438971,1.0975225825141603,depthwise,0.00010864857533201577,0.25383315695490494,7,5,0.1367877198221677,800,forest,0.3193185736031242,0.9060265644036771,none,0.9685180621792611,0.5660846041005253,0.06654929272125376,weighted,0.6031301398257161,0.7407304974284067,0.8651857917903573,0.8607698607698607,0.3193185736031242,0.7107401713156161,0.6993810786914235,0.9060265644036771,0.8094471396791364,0.7980305458362332,0.7304740406320541,0.7233653406492913,0.6920444824636441,0.676936243046641,none,0.9215622333969813,0.917125214215829,0.9685180621792611,COMPLETE
1096,0.7071461933675852,2025-09-23 16:48:42.498291,2025-09-23 16:49:01.037369,0 days 00:00:18.539078,0.025970903533090214,dart,0.5043408562047673,0.9400478191385463,depthwise,0.0004208659273330434,0.08782343878632902,5,10,1.3358684618277157,500,forest,0.3913488470145698,0.9286773732371225,none,0.8571957145317791,0.5990619604200239,0.0010889175620228536,weighted,0.7462694943650588,0.7908462978503358,0.8706111167980346,0.8716216216216216,0.3913488470145698,0.704119850187266,0.7071461933675852,0.9286773732371225,0.8231548709791616,0.8174770576532457,0.7776628748707343,0.7784061696658098,0.6432848588537211,0.6478391099700471,none,0.9257612003629858,0.9232086817606591,0.8571957145317791,COMPLETE
1097,0.7084581700852731,2025-09-23 16:49:01.175164,2025-09-23 16:49:35.190560,0 days 00:00:34.015396,0.00047291402970441656,dart,0.3303273734275399,2.775481554529308,depthwise,0.24131188523127423,0.3100783370676938,7,8,0.18597458795097507,700,forest,0.4255467556000223,0.9566985503915745,none,0.7247558465872044,0.8228556340684567,0.04872737052828218,weighted,0.6183557903359258,0.46285877342590465,0.8682567304739482,0.8704954954954955,0.4255467556000223,0.7079646017699115,0.7084581700852731,0.9566985503915745,0.8218738260461942,0.8189632622268284,0.7539874335427743,0.7677322677322678,0.6672369546621043,0.6576807873341891,none,0.9250052291748472,0.9240155054802571,0.7247558465872044,COMPLETE
1098,0.7069063386944182,2025-09-23 16:49:35.322187,2025-09-23 16:50:03.967184,0 days 00:00:28.644997,0.01552094361876933,dart,0.24523739610971584,0.23743750363575455,depthwise,0.0001272123028105259,0.008131175907293361,5,11,0.11870937739114899,600,forest,0.45874585989651534,0.951937564602925,none,0.9104747260658963,2.0669491499240404,0.07311886125389032,weighted,0.6326636195287495,0.2749115526437996,0.8432797625140751,0.8414209664209664,0.45874585989651534,0.7135640785781104,0.7069063386944182,0.951937564602925,0.8093064448515455,0.7989736135055892,0.6341868972397738,0.6336499321573948,0.8156544054747648,0.7993153615746684,none,0.9220276213246268,0.9197386746831367,0.9104747260658963,COMPLETE
1099,0.6981847197287053,2025-09-23 16:50:04.101307,2025-09-23 16:50:17.045564,0 days 00:00:12.944257,0.0005934031437788883,dart,0.30800572721219255,0.03424224711862445,depthwise,0.0007231024077243342,0.2077876091661097,10,9,0.16425900491032516,400,forest,0.3195230454016899,0.9112560045638913,none,0.7455069172395934,1.0516428814140901,0.03942293940099593,weighted,0.7218706399881843,0.8524844776414535,0.8419490224178524,0.8451064701064701,0.3195230454016899,0.694620253164557,0.6981847197287053,0.9112560045638913,0.7974228765377338,0.7930846915989245,0.6460632818248713,0.6539611360239163,0.7510692899914457,0.7488232777064613,none,0.9107786215446148,0.9100685945558646,0.7455069172395934,COMPLETE
1100,0.6817842013456267,2025-09-23 16:50:17.176911,2025-09-23 16:50:35.362435,0 days 00:00:18.185524,0.0002566881020274474,dart,0.32181965062465445,1.8001588294160595,depthwise,0.00011667576806640162,0.1902103463765727,1,8,0.10015873217945685,500,forest,0.4922273536857984,0.9002440842739843,none,0.9490348876022598,0.7350884964301183,0.05673199458048653,weighted,0.7097117077017843,0.7879063488905174,0.8714300337803256,0.8692669942669943,0.4922273536857984,0.6880278191753602,0.6817842013456267,0.9002440842739843,0.8296908984470648,0.8257359014455841,0.8204976303317536,0.8162291169451074,0.5923866552609067,0.5853658536585366,none,0.9285702774047039,0.9274077467630168,0.9490348876022598,COMPLETE
