number,value,datetime_start,datetime_complete,duration,params_alpha,params_booster,params_colsample_bytree,params_gamma,params_grow_policy,params_lambda,params_learning_rate,params_max_delta_step,params_max_depth,params_min_child_weight,params_n_estimators,params_normalize_type,params_params_decision_threshold,params_params_feature_fraction,params_params_resampling,params_params_sample_rows,params_params_scale_pos_weight,params_rate_drop,params_sample_type,params_skip_drop,params_subsample,user_attrs_acc_test,user_attrs_acc_val,user_attrs_decision_threshold,user_attrs_f1_test,user_attrs_f1_val,user_attrs_feature_fraction,user_attrs_pr_auc_test,user_attrs_pr_auc_val,user_attrs_prec_test,user_attrs_prec_val,user_attrs_rec_test,user_attrs_rec_val,user_attrs_resampling_strategy,user_attrs_roc_auc_test,user_attrs_roc_auc_val,user_attrs_sample_rows,state
1222,0.721011673151751,2025-09-23 17:28:26.567640,2025-09-23 17:28:38.871191,0 days 00:00:12.303551,0.00011882124253548592,dart,0.7308999522275593,2.457306181794768,depthwise,0.002245909366000378,0.03051912221344019,6,6,0.45831090414091724,400,forest,0.3495446019577224,0.9990152658920933,none,0.9576941343934466,1.0834881787086796,0.005528043120258133,weighted,0.5446664375412876,0.9076970759819833,0.8531067663015662,0.8531941031941032,0.3495446019577224,0.7236664740997497,0.721011673151751,0.9990152658920933,0.8310770939611476,0.8246034321162286,0.6581436077057793,0.6610774170531574,0.8036783575705732,0.7928968763371844,none,0.9289126631678106,0.9268956038688153,0.9576941343934466,COMPLETE
1223,0.5512672811059908,2025-09-23 17:28:39.003321,2025-09-23 17:28:45.874997,0 days 00:00:06.871676,0.0001264224553699452,dart,0.7604755848854269,3.3501760535519627,depthwise,0.0007925212553015712,0.0046580068952818965,7,4,0.6428199746675768,300,forest,0.42812554475173,0.8812151246584579,none,0.8535229698229814,0.5892380339620356,0.005633345250778118,weighted,0.44378112626412075,0.9663270361294984,0.8480908997850343,0.8404995904995906,0.42812554475173,0.5784090909090909,0.5512672811059908,0.8812151246584579,0.7766809402129221,0.7653064971948956,0.8612521150592216,0.8431718061674008,0.4354148845166809,0.40949935815147626,none,0.9030845685064498,0.8997612437505927,0.8535229698229814,COMPLETE
1224,0.7038369304556354,2025-09-23 17:28:46.012644,2025-09-23 17:29:04.186356,0 days 00:00:18.173712,0.0010804006599900641,dart,0.5771772935864673,0.6578955875851551,depthwise,0.005104450153670522,0.006942248830010869,3,5,0.18269118207889745,500,forest,0.33115914205824615,0.8018958434497171,none,0.7539286359256219,1.036660962224799,0.008323641200187368,weighted,0.652972637670921,0.5615045115138402,0.8428703040229297,0.8482800982800983,0.33115914205824615,0.6972983632419641,0.7038369304556354,0.8018958434497171,0.8039561983672879,0.800045742178884,0.6469081595316502,0.6602924634420697,0.756201881950385,0.7535301668806161,none,0.9145781336571335,0.9147102422302296,0.7539286359256219,COMPLETE
1225,0.7084581700852731,2025-09-23 17:29:04.321663,2025-09-23 17:30:02.729994,0 days 00:00:58.408331,3.120639120442711,dart,0.5831008320697895,0.7189487074996581,depthwise,0.0003202276353199775,0.024692433657267667,0,8,0.5615439307999145,900,forest,0.4190657259122758,0.9052628153266243,none,0.922335069914511,0.7789869674224702,0.003537626328993064,weighted,0.6239140878847448,0.9899869554241181,0.8732725969904801,0.8704954954954955,0.4190657259122758,0.7169638774577046,0.7084581700852731,0.9052628153266243,0.8285770813880888,0.8210792207693214,0.7701375245579568,0.7677322677322678,0.6706586826347305,0.6576807873341891,none,0.9274128656004792,0.9250445994462707,0.922335069914511,COMPLETE
1226,0.6649629440327115,2025-09-23 17:30:02.861879,2025-09-23 17:30:06.205077,0 days 00:00:03.343198,0.3674650192239705,dart,0.8109381899075997,4.081538585233696,depthwise,0.013153120131536035,0.1316866635765691,7,9,0.17309082035536436,200,forest,0.4868042004810747,0.9952329240566246,none,0.9953591772911271,0.6503628783585205,0.015034875551405232,weighted,0.5871797720831,0.8682449095041096,0.8684614597195209,0.8657862407862408,0.4868042004810747,0.6736093472186945,0.6649629440327115,0.9952329240566246,0.828022340681711,0.8219242107808697,0.8292682926829268,0.825507614213198,0.5671514114627887,0.5566966195977749,none,0.9275929944137331,0.9259305997432835,0.9953591772911271,COMPLETE
1227,0.7039864291772688,2025-09-23 17:30:06.340675,2025-09-23 17:30:07.145647,0 days 00:00:00.804972,0.01848402245223934,gbtree,0.584925638318156,5.776891947706552,depthwise,0.00012598226859913687,0.033148268406068465,6,8,0.3088206929524276,600,,0.3650035284136327,0.7576624908477816,none,0.9747087131097766,0.8609592747802278,,,,0.9679078692801277,0.8603746545193981,0.857084357084357,0.3650035284136327,0.7129629629629629,0.7039864291772688,0.7576624908477816,0.8081597831604301,0.7974139606609608,0.7017398508699254,0.6977721731820092,0.7245508982035929,0.7103123662815576,none,0.9205564878087416,0.9161620815366729,0.9747087131097766,COMPLETE
1228,0.7065368567454798,2025-09-23 17:30:07.279484,2025-09-23 17:30:33.900498,0 days 00:00:26.621014,0.00022013070455561052,dart,0.4483790308431879,0.039999100360831985,depthwise,0.0004820088143454906,0.023446322933221696,5,6,0.21834142135884954,600,forest,0.4116599775702265,0.955021283859658,none,0.964349594413732,2.6306095633460793,0.0005973656973856517,weighted,0.6299108573532453,0.9888197465670971,0.8238304841846658,0.8271908271908271,0.4116599775702265,0.7044478791001202,0.7065368567454798,0.955021283859658,0.8335190014948357,0.8264354861322252,0.5885222381635581,0.5950219619326501,0.8772455089820359,0.8694908001711597,none,0.9295339478491544,0.9279026147676007,0.964349594413732,COMPLETE
1229,0.7122884473877852,2025-09-23 17:30:34.034154,2025-09-23 17:31:10.005286,0 days 00:00:35.971132,0.08350569701642277,dart,0.7214927130283444,1.9945127447541788,depthwise,0.00018459816164816576,0.04918534087645224,6,8,0.2700751826548647,700,forest,0.35583224940238034,0.9153357921880586,none,0.6577025714719117,1.7551983775354607,0.04486320408840691,weighted,0.761220160323524,0.7232339378375776,0.8343740403316614,0.8398853398853399,0.35583224940238034,0.7051749271137027,0.7122884473877852,0.9153357921880586,0.8211192495127015,0.8179162734522064,0.6142857142857143,0.6247176508551145,0.8276304533789564,0.8284124946512623,none,0.9242206514935984,0.9237055363775492,0.6577025714719117,COMPLETE
1230,0.675125313283208,2025-09-23 17:31:10.143956,2025-09-23 17:31:13.919079,0 days 00:00:03.775123,0.006994620632894151,dart,0.9106568347705521,3.7617234186714414,depthwise,8.524567488116285,0.1317697021463225,6,11,5.944216558073587,200,forest,0.5006767060445415,0.9782037296900229,oversample,0.925910997932527,3.4618821540974913,0.00877957568530055,weighted,0.358102101668175,0.8167263377712117,0.7821680827106152,0.7876740376740377,0.5006767060445415,0.6701797892126472,0.675125313283208,0.9782037296900229,0.8220992845128037,0.8168948753977356,0.5255226057365094,0.5324932048430937,0.9247219846022241,0.922122379118528,oversample,0.9249845081738017,0.9233759890666071,0.925910997932527,COMPLETE
1231,0.6945500633713562,2025-09-23 17:31:14.051585,2025-09-23 17:31:14.750490,0 days 00:00:00.698905,3.7760639159604743,gbtree,0.32773131753625073,1.8833572927142406,depthwise,0.000531953449542473,0.14639703697284107,3,8,1.883332889225127,600,,0.3764323184275841,0.884296843678695,none,0.9426849486446817,0.9525904020731222,,,,0.9109381854501345,0.8563824342307299,0.851965601965602,0.3764323184275841,0.7077692147469278,0.6945500633713562,0.884296843678695,0.7963671839239326,0.786003287847826,0.6898091758018676,0.685857321652065,0.7266894781864842,0.7034659820282413,none,0.9138807856344522,0.9113260625626252,0.9426849486446817,COMPLETE
1232,0.6762426762426762,2025-09-23 17:31:14.885353,2025-09-23 17:31:32.046243,0 days 00:00:17.160890,0.6774287538970651,dart,0.6416673936457115,4.985359981275398,depthwise,0.00024798917830592585,0.4367327884227287,2,8,0.1361363564646477,500,forest,0.3544647832199072,0.8504514579259405,none,0.9580302673346927,1.1241540042160283,0.005455373830814202,weighted,0.5368986736547653,0.9333851008740669,0.8237281195618794,0.8246314496314496,0.3544647832199072,0.6789709172259508,0.6762426762426762,0.8504514579259405,0.7516387148506024,0.7449966214559164,0.6017845340383344,0.6056194989844279,0.7788708297690333,0.7655113393239196,none,0.9004040480087175,0.9008421048024943,0.9580302673346927,COMPLETE
1233,0.6789980732177264,2025-09-23 17:31:32.177539,2025-09-23 17:31:39.294454,0 days 00:00:07.116915,0.006633311425296968,dart,0.6008872122628945,1.8059669380317125,depthwise,0.0001301467160813567,0.13124002446248104,4,9,0.11726722944653677,300,forest,0.30829151968821505,0.906592884287608,none,0.7204665425233293,0.8878700789301988,0.04554581675445797,uniform,0.6264924537667524,0.630190788914413,0.8219879209745112,0.8294430794430795,0.30829151968821505,0.6670495883591806,0.6789980732177264,0.906592884287608,0.7375345402813955,0.7359656167441617,0.6038128249566724,0.6175955134945671,0.7450812660393499,0.7539580658964484,none,0.895250562373724,0.8967818723296981,0.7204665425233293,COMPLETE
1234,0.7144472077775266,2025-09-23 17:31:39.428966,2025-09-23 17:31:58.047177,0 days 00:00:18.618211,0.00084854364967922,dart,0.6822908666693758,2.80052516491455,depthwise,0.0005894938306227905,0.016964401186755955,2,7,0.4233132521438702,500,forest,0.34285753570275135,0.8713780217241607,none,0.9797475240429333,0.6280621904276623,0.0551204134657699,weighted,0.7282349981467648,0.9386509745436838,0.8739891493499846,0.8707002457002457,0.34285753570275135,0.7226852894796125,0.7144472077775266,0.8713780217241607,0.8292561934833771,0.8231832777312567,0.763445978105664,0.7574304889741131,0.6860564585115483,0.6760804450149764,none,0.9276447393580104,0.9258207602367973,0.9797475240429333,COMPLETE
1235,0.7189620758483034,2025-09-23 17:31:58.180463,2025-09-23 17:31:59.000265,0 days 00:00:00.819802,0.0001403296112388002,gbtree,0.9454714453610589,6.961110785132264,lossguide,0.04253619773426016,0.06840891828711557,3,7,7.58630477338088,300,,0.6737642284456021,0.8665553457240587,none,0.8809306682040101,3.899285074553389,,,,0.7230466328067482,0.8542327771522162,0.8558558558558559,0.6737642284456021,0.7176843774781919,0.7189620758483034,0.8665553457240587,0.8234094927952667,0.8163364299776117,0.6688839615668883,0.673774784885896,0.7741659538066724,0.7706461275139067,none,0.9258467320506344,0.9240144114039146,0.8809306682040101,COMPLETE
1236,0.6726768377253814,2025-09-23 17:31:59.136218,2025-09-23 17:32:00.554047,0 days 00:00:01.417829,0.00012880159058358288,gbtree,0.407871003056653,0.5131344963859036,lossguide,0.15576432237070575,0.013796580893971419,4,9,11.804555148928886,400,,0.4909967549612286,0.7642671224730611,none,0.7484556879186459,1.1576016684446908,,,,0.23860259030133923,0.858941549800389,0.855036855036855,0.4909967549612286,0.6855317206754906,0.6726768377253814,0.7642671224730611,0.7961849544985231,0.7871635477215182,0.7348336594911937,0.7315233785822021,0.6424294268605646,0.6225930680359435,none,0.9135880151571821,0.9115362979692733,0.7484556879186459,COMPLETE
1237,0.7115804806991989,2025-09-23 17:32:00.689817,2025-09-23 17:32:01.655677,0 days 00:00:00.965860,0.0002327902228992086,gbtree,0.7447141350033669,8.576258402772417,lossguide,0.006866551712303883,0.03889557783668906,3,7,6.551329911280321,400,,0.6059739954580623,0.9035633989193373,none,0.8486724537232893,4.188779972598873,,,,0.7748230056343135,0.8328385709898659,0.8378378378378378,0.6059739954580623,0.7058187713925419,0.7115804806991989,0.9035633989193373,0.8241593001056353,0.81698348381199,0.6097105508870215,0.6193343898573692,0.8378956372968349,0.8361146769362431,none,0.9260212201469372,0.9239390928851812,0.8486724537232893,COMPLETE
1238,0.6276625958534507,2025-09-23 17:32:01.789960,2025-09-23 17:32:09.040686,0 days 00:00:07.250726,0.00028125032259589426,dart,0.8429872930765662,0.47412092789404237,depthwise,0.015115797387813565,0.007005344811528171,7,6,0.5285199780395523,300,forest,0.3331959715395001,0.9302042963688324,oversample,0.9846834520088272,1.1006376569581613,0.005546140635220275,weighted,0.7592546487077315,0.9151829636444391,0.7278124680110554,0.7315724815724816,0.3331959715395001,0.6252290345313601,0.6276625958534507,0.9302042963688324,0.8083763079039376,0.8009166313771744,0.46626024805549715,0.46971307120085015,0.9486740804106074,0.9456568249893025,oversample,0.9170934617298652,0.9152381340654663,0.9846834520088272,COMPLETE
1239,0.7144221585482331,2025-09-23 17:32:09.174407,2025-09-23 17:32:27.314186,0 days 00:00:18.139779,0.0002455692311562498,dart,0.8320425183306883,2.860769695194334,depthwise,0.0004901648158381897,0.08709441034432915,6,7,0.2911428361723219,500,forest,0.4806366840747455,0.9662515664312158,oversample,0.7593318567923603,0.687410282308183,0.06682733171862065,weighted,0.7379790178750821,0.9578913876431403,0.8476814412938888,0.846949221949222,0.4806366840747455,0.7173252279635258,0.7144221585482331,0.9662515664312158,0.8260841780943184,0.8229196511935422,0.6452494873547505,0.6452726017943409,0.8075278015397775,0.8001711596063329,oversample,0.9269183243755295,0.9254232074437269,0.7593318567923603,COMPLETE
1240,0.6994809378915339,2025-09-23 17:32:27.453162,2025-09-23 17:32:28.386750,0 days 00:00:00.933588,0.005706951806166651,gbtree,0.4155818083780796,2.6977286045110764,depthwise,0.08375171413011225,0.008277524618686426,7,6,2.8772637597484434,500,,0.35456094044802283,0.8731884091077596,none,0.7503923822793375,1.4758166780763704,,,,0.24598639667844868,0.8240352134302386,0.8281122031122031,0.35456094044802283,0.6966649020645844,0.6994809378915339,0.8731884091077596,0.8111809641577854,0.8043748274750646,0.592970862120757,0.6012307692307692,0.844311377245509,0.8361146769362431,none,0.9193212859130921,0.918127244188108,0.7503923822793375,COMPLETE
1241,0.6831489915419648,2025-09-23 17:32:28.519981,2025-09-23 17:32:31.840600,0 days 00:00:03.320619,0.001300523679881228,dart,0.6343355143114343,9.372705521293057,depthwise,1.6106406049457602,0.18318789361061721,4,9,11.457484832074508,200,forest,0.666446109927774,0.9996063842052131,oversample,0.8212043576824003,3.822631614339546,0.010728872442543828,weighted,0.6351163999290849,0.6792787583795521,0.79977479782987,0.8005733005733006,0.666446109927774,0.6850241545893719,0.6831489915419648,0.9996063842052131,0.821067680519999,0.8138139635186941,0.5493285123966942,0.5510364733665705,0.9097519247219846,0.8985879332477535,oversample,0.9252761850426836,0.9228392294547002,0.8212043576824003,COMPLETE
1242,0.7123690498070208,2025-09-23 17:32:31.974133,2025-09-23 17:32:33.021691,0 days 00:00:01.047558,0.00031508949945447073,gbtree,0.9466992896317749,3.2898368647816443,lossguide,0.03423689745510561,0.0628741274435962,5,9,5.677335459438368,200,,0.5577992590668996,0.8893283491433461,none,0.8589200404415688,3.4109814688308493,,,,0.5152316169276094,0.8389804483570478,0.8397829647829648,0.5577992590668996,0.711640696608616,0.7123690498070208,0.8893283491433461,0.8212847909514734,0.8148288071596721,0.6227141482194418,0.6243556701030928,0.830196749358426,0.8292682926829268,none,0.9249662909603826,0.9225602399873731,0.8589200404415688,COMPLETE
1243,0.7155854430379747,2025-09-23 17:32:33.160238,2025-09-23 17:32:35.120909,0 days 00:00:01.960671,0.08461786783627487,gbtree,0.6684346816242048,1.5030824840271753,lossguide,4.737081837799359,0.05288187749116886,7,7,1.3621809135979357,600,,0.46108508096185497,0.8314317962551654,none,0.8672972257475446,1.7688684063224935,,,,0.24578065638996882,0.8507523799774798,0.8527846027846028,0.46108508096185497,0.7150117279124316,0.7155854430379747,0.8314317962551654,0.8160607415672145,0.8064802375214422,0.6583873290136789,0.6653181316660537,0.7822925577416595,0.7740693196405648,none,0.9222048146627329,0.9188560429895993,0.8672972257475446,COMPLETE
1244,0.7120940426379757,2025-09-23 17:32:35.255382,2025-09-23 17:32:54.220666,0 days 00:00:18.965284,0.0010191369265955498,dart,0.6284227419756852,3.3387652693125602,depthwise,0.0002814884584920231,0.0079529140029953,1,8,0.10180749604352314,500,forest,0.37804862307874654,0.9784341880752864,none,0.6640809212356537,1.0960572937091404,0.007836546445332366,weighted,0.45626658778661655,0.918958986489429,0.8522878493192753,0.8520679770679771,0.37804862307874654,0.713974231912785,0.7120940426379757,0.9784341880752864,0.8189293951618366,0.8120453636592065,0.6653121536756557,0.6662938105891126,0.7703165098374679,0.764655541292255,none,0.9235164828080732,0.9211403592267229,0.6640809212356537,COMPLETE
1245,0.6487341772151899,2025-09-23 17:32:54.353675,2025-09-23 17:33:05.800618,0 days 00:00:11.446943,0.0003793718042969172,dart,0.9110438407248851,9.13318110343614,lossguide,3.6993496028796233,0.08625926700101803,2,9,3.7219041712796495,400,forest,0.6939617037887817,0.9737477978396395,none,0.9062686972146239,1.4010190626128562,0.0031153781696029695,weighted,0.6409447840801877,0.6551711492313572,0.8677449073600164,0.8636363636363636,0.6939617037887817,0.6608923884514436,0.6487341772151899,0.9737477978396395,0.822485433391104,0.8148540664560115,0.8552989130434783,0.845360824742268,0.5384944396920445,0.5263157894736842,none,0.924739914023962,0.9231816465584073,0.9062686972146239,COMPLETE
1246,0.7036228721082497,2025-09-23 17:33:05.934958,2025-09-23 17:33:59.863734,0 days 00:00:53.928776,0.000970536949092063,dart,0.5506607449765827,4.981549087986355,depthwise,0.0218887642810276,0.05023541596146115,2,7,0.32112469510473246,900,forest,0.30016389613678446,0.880529660043955,none,0.8678673482579039,0.6112340228621088,0.06808872794911222,weighted,0.7463992646635385,0.21456200307802537,0.8630361347118436,0.8609746109746109,0.30016389613678446,0.7133676092544987,0.7036228721082497,0.880529660043955,0.8123662664922026,0.8057207008905389,0.7145922746781116,0.7180400890868597,0.712147134302823,0.6897732135216089,none,0.9179084589918151,0.9167115381924488,0.8678673482579039,COMPLETE
1247,0.6686656671664168,2025-09-23 17:33:59.996908,2025-09-23 17:34:26.665858,0 days 00:00:26.668950,6.409597623352834,dart,0.20765941670507515,0.02254609291453638,depthwise,0.0011017434296549415,0.35954808328585164,5,8,0.391418288774319,600,forest,0.4511239489563187,0.9169388590061602,oversample,0.8654186207816729,0.5685751555212777,0.05812709356008763,weighted,0.6872428575122483,0.6197473598943253,0.8197358992732112,0.819000819000819,0.4511239489563187,0.673949268653953,0.6686656671664168,0.9169388590061602,0.7255180013872332,0.7126227841702211,0.5941887038850799,0.594864954984995,0.7784431137724551,0.7633718442447582,oversample,0.8944833673100192,0.8919918621449988,0.8654186207816729,COMPLETE
1248,0.6707127295362589,2025-09-23 17:34:26.798906,2025-09-23 17:34:38.677763,0 days 00:00:11.878857,0.009790100598795919,dart,0.8502985712335888,2.982410645014265,lossguide,19.878549150081938,0.21802202043950902,4,11,4.4588311098414515,400,forest,0.6498302497459555,0.8452954929284595,undersample,0.986087672860673,4.372003635394148,0.002846649916862471,weighted,0.5297427715387566,0.7498366712338287,0.777356945439656,0.7833742833742834,0.6498302497459555,0.6654360867558837,0.6707127295362589,0.8452954929284595,0.8069748875436185,0.8044752347780293,0.5195772279606053,0.5270237221814624,0.9251497005988024,0.922122379118528,undersample,0.9208322785768218,0.9196188733236375,0.986087672860673,COMPLETE
1249,0.697214372224465,2025-09-23 17:34:38.811142,2025-09-23 17:34:40.157386,0 days 00:00:01.346244,0.002535631018395589,gbtree,0.3119046892850595,0.41985291507947065,depthwise,0.0022830902008445873,0.21776349715824217,6,10,0.10716744918826594,900,,0.3809473264683774,0.9845165256288934,none,0.7281704487217859,2.6998832410390814,,,,0.7762717473534708,0.8438939502507933,0.8464373464373465,0.3809473264683774,0.691358024691358,0.697214372224465,0.9845165256288934,0.7926244115864866,0.7921353145347719,0.6561659623511333,0.6599159342758885,0.7305389221556886,0.7389816003423192,none,0.9100449542117679,0.9105419265313917,0.7281704487217859,COMPLETE
1250,0.695234830305108,2025-09-23 17:34:40.294868,2025-09-23 17:35:25.820535,0 days 00:00:45.525667,0.015911709299901728,dart,0.3125260289377563,5.429612148968875,lossguide,0.00029658978067086074,0.3958669902667918,4,7,0.6392535951034984,800,forest,0.592338789426564,0.8999124541775821,oversample,0.9987748425128932,1.779549746125173,0.061739051663107954,weighted,0.7105529587715324,0.39020420112451004,0.8167673252124066,0.8179770679770679,0.592338789426564,0.6953710006807352,0.695234830305108,0.8999124541775821,0.8232840068787064,0.8138315987693072,0.5774448841153194,0.5799256505576208,0.8738237810094097,0.8677792041078306,oversample,0.9239913103028616,0.9211396394396557,0.9987748425128932,COMPLETE
1251,0.6216348507097406,2025-09-23 17:35:25.954496,2025-09-23 17:35:37.141813,0 days 00:00:11.187317,0.0005601442359496669,dart,0.7381592088775412,4.233503602294975,lossguide,1.9947566992156112,0.4157271114622717,4,11,7.491131614478202,400,forest,0.6908879843270451,0.9133681130832914,none,0.8266366586772569,1.9334705299076274,0.005859937339448937,weighted,0.7833178864402407,0.9808381541639968,0.8455317842153751,0.8417280917280917,0.6908879843270451,0.6350665054413543,0.6216348507097406,0.9133681130832914,0.7450265480730323,0.7342117862210921,0.7306622148024485,0.7261292166952544,0.5615911035072711,0.5434317501069748,none,0.8978846908524493,0.8972441483758696,0.8266366586772569,COMPLETE
