number,value,datetime_start,datetime_complete,duration,params_alpha,params_booster,params_colsample_bytree,params_gamma,params_grow_policy,params_lambda,params_learning_rate,params_max_delta_step,params_max_depth,params_min_child_weight,params_n_estimators,params_normalize_type,params_params_decision_threshold,params_params_feature_fraction,params_params_resampling,params_params_sample_rows,params_params_scale_pos_weight,params_rate_drop,params_sample_type,params_skip_drop,params_subsample,user_attrs_acc_test,user_attrs_acc_val,user_attrs_decision_threshold,user_attrs_f1_test,user_attrs_f1_val,user_attrs_feature_fraction,user_attrs_pr_auc_test,user_attrs_pr_auc_val,user_attrs_prec_test,user_attrs_prec_val,user_attrs_rec_test,user_attrs_rec_val,user_attrs_resampling_strategy,user_attrs_roc_auc_test,user_attrs_roc_auc_val,user_attrs_sample_rows,state
1343,0.7021164946650341,2025-09-23 18:00:04.909646,2025-09-23 18:00:20.096500,0 days 00:00:15.186854,0.05652675089057378,dart,0.6084878158370736,8.312176485639544,lossguide,0.0009797415013757238,0.2751856016506868,1,9,0.8206061609379136,400,forest,0.4744490220607573,0.9421230257120267,none,0.9491139361795851,2.855865595593801,0.2237796376202315,uniform,0.551870099151841,0.36435593942903,0.8221926502200839,0.8256552006552007,0.4744490220607573,0.6996368666781947,0.7021164946650341,0.9421230257120267,0.8195444183308165,0.8116954862496845,0.5872278664731495,0.5937869822485207,0.8652694610778443,0.858793324775353,none,0.9243702168303108,0.922099806596094,0.9491139361795851,COMPLETE
1344,0.686757073497405,2025-09-23 18:00:20.351195,2025-09-23 18:00:21.557704,0 days 00:00:01.206509,0.0004926422830941167,gbtree,0.9776823972349319,2.5875471144315556,depthwise,0.00029674936846186097,0.03285652559461227,0,11,0.524133342310239,300,,0.5932665708801015,0.9137813235514991,undersample,0.8440828277016009,2.287107622472786,,,,0.6156284737762001,0.8028457365134609,0.8084561834561834,0.5932665708801015,0.6800664451827243,0.686757073497405,0.9137813235514991,0.8101518441802766,0.8062097993633058,0.5559478544269418,0.5640814081408141,0.8755346449957229,0.8776208814719726,undersample,0.9181779471220775,0.9184584614050462,0.8440828277016009,COMPLETE
1345,0.6730738931778794,2025-09-23 18:00:21.788110,2025-09-23 18:00:30.031944,0 days 00:00:08.243834,0.00014570887166222765,dart,0.949277420684838,2.8147539176800462,depthwise,0.0009560895365009043,0.1412231171618843,2,10,0.29531145890594385,300,forest,0.610679876273939,0.9870727583642018,undersample,0.8372583595295706,4.820906353144382,0.15931566243786985,uniform,0.6250902560804109,0.8510889722162199,0.7864673968676426,0.7875716625716626,0.610679876273939,0.6725274725274726,0.6730738931778794,0.9870727583642018,0.820111280865323,0.809972106851899,0.53125,0.5326683291770573,0.9161676646706587,0.9139922978177151,undersample,0.9240480052640554,0.9203568278166262,0.8372583595295706,COMPLETE
1346,0.7164959686206145,2025-09-23 18:00:30.180533,2025-09-23 18:00:48.288755,0 days 00:00:18.108222,0.0003077130950119957,dart,0.9885814412137404,6.842877263679698,depthwise,0.00018015947614584638,0.031077938293111,0,10,0.2637162498423519,400,forest,0.6494424230111647,0.975749645170948,none,0.8950449973995488,2.6976753170039234,0.18782699996242644,uniform,0.5332165524226691,0.9180377851474683,0.8689732828334528,0.8668099918099919,0.6494424230111647,0.7208896641953773,0.7164959686206145,0.975749645170948,0.8275623780084311,0.8201160461517993,0.7353202846975089,0.7300177619893428,0.7070145423438836,0.7034659820282413,none,0.9272249376326648,0.9252025783118253,0.8950449973995488,COMPLETE
1347,0.7235023041474654,2025-09-23 18:00:48.431297,2025-09-23 18:00:56.664355,0 days 00:00:08.233058,0.002692573341276245,dart,0.8496339330514184,5.255783074214106,depthwise,0.006211494350968472,0.21452312871817328,4,12,1.0829161552494058,300,forest,0.6976567431001125,0.9967085844537931,none,0.9409680543406935,3.9786198256738072,0.15175915097218623,uniform,0.6319000295334352,0.757899817643766,0.8619101238611936,0.8648648648648649,0.6976567431001125,0.7190168714851073,0.7235023041474654,0.9967085844537931,0.8262047925552518,0.8186374610149189,0.7007714169711734,0.7086581862946245,0.7382378100940975,0.7389816003423192,none,0.9264270927549135,0.9238895715349437,0.9409680543406935,COMPLETE
1348,0.6707014276846679,2025-09-23 18:00:56.813712,2025-09-23 18:01:19.073264,0 days 00:00:22.259552,0.00045515036967543884,dart,0.39074771278502096,5.109861442469517,lossguide,0.001865333591891742,0.01969415725030529,2,12,1.0207548154448258,500,forest,0.6748247055095551,0.9288569715139835,undersample,0.994385905237294,4.619220402373398,0.19705764245928659,uniform,0.582247442173888,0.7432051175573257,0.7795066025181697,0.7827600327600328,0.6748247055095551,0.6681047765793529,0.6707014276846679,0.9288569715139835,0.8207752637423454,0.8120600309186219,0.5221579961464354,0.5261748234721207,0.9272882805816938,0.9246897732135216,undersample,0.9250771483159752,0.9221999721643944,0.994385905237294,COMPLETE
1349,0.705937794533459,2025-09-23 18:01:19.247383,2025-09-23 18:01:20.361468,0 days 00:00:01.114085,0.00027584958507480197,gbtree,0.49206354088365883,3.057126801361518,depthwise,0.00024286867667204102,0.022270323657410215,1,12,0.2527199735324543,300,,0.6284351886463825,0.9762385540760491,none,0.8071203117202922,1.7302082650721902,,,,0.612951369617617,0.8723513153854028,0.8722358722358723,0.6284351886463825,0.7096623981373691,0.705937794533459,0.9762385540760491,0.8270551487931976,0.8222522140135791,0.7787429739397036,0.7855270057682223,0.6518391787852865,0.6409927257167308,none,0.9272133108487448,0.9258753200965066,0.8071203117202922,COMPLETE
1350,0.6866475837683111,2025-09-23 18:01:20.553721,2025-09-23 18:01:38.610012,0 days 00:00:18.056291,0.0007434429692720913,dart,0.7444500667521399,4.92355090681721,lossguide,0.0005813925980759177,0.021182369228397856,0,9,2.2375972686526677,400,forest,0.6922611876209664,0.8947843094534622,oversample,0.9712668812404733,3.636878271671103,0.16088185578488734,uniform,0.6380614726305924,0.7919146069191811,0.8052001228375474,0.8094799344799345,0.6922611876209664,0.6842541894806703,0.6866475837683111,0.8947843094534622,0.8205878150757879,0.8132043764481538,0.558959067497967,0.5660744031093837,0.8819503849443969,0.8724860932819855,oversample,0.9225123776324161,0.9203967616031259,0.9712668812404733,COMPLETE
1351,0.6601412066752247,2025-09-23 18:01:38.857106,2025-09-23 18:01:55.692855,0 days 00:00:16.835749,0.0770108967711278,dart,0.6908569977611625,7.64542225173605,depthwise,0.022488727505285924,0.01528854014926998,4,12,0.17812364008523576,400,forest,0.669857315640025,0.9116064337298698,oversample,0.7601946198421233,3.689155531035958,0.15114693746556038,uniform,0.6581698148103035,0.46759587740601183,0.7780734977991606,0.7831695331695332,0.669857315640025,0.6552162849872774,0.6601412066752247,0.9116064337298698,0.7489258210451013,0.7399226847017579,0.5215189873417722,0.5281129653401797,0.8810949529512404,0.8801882755669662,oversample,0.8995604154744896,0.8986476755743482,0.7601946198421233,COMPLETE
1352,0.709838107098381,2025-09-23 18:01:55.846174,2025-09-23 18:01:57.028729,0 days 00:00:01.182555,0.00016334793213563332,gbtree,0.5977054611489615,2.7664118446452264,depthwise,0.027446073483023987,0.0386446145173585,2,12,0.29226723823951245,800,,0.632932224090283,0.9539084501606487,undersample,0.8891382098192436,1.674258781657139,,,,0.6429373045051372,0.8286416214556249,0.8330262080262081,0.632932224090283,0.7034018426647768,0.709838107098381,0.9539084501606487,0.8187035044997127,0.8131160596972776,0.6004234724742892,0.6074908647990256,0.84901625320787,0.8536585365853658,undersample,0.9241504878817254,0.9230368541919276,0.8891382098192436,COMPLETE
1353,0.6635745207173779,2025-09-23 18:01:57.183514,2025-09-23 18:02:11.313185,0 days 00:00:14.129671,0.0018864359511443687,dart,0.5798277703858573,7.502970139104651,depthwise,0.00013202658909597525,0.007523672733723737,2,12,0.11604079213336747,300,forest,0.6546568835624713,0.8354976929299901,undersample,0.8048774483039101,3.365696279324878,0.1601378071290856,uniform,0.7270741321839475,0.8665253664576892,0.7699866925990377,0.7772317772317773,0.6546568835624713,0.656159143075746,0.6635745207173779,0.8354976929299901,0.7926955824897505,0.7857989832703798,0.5108410769597331,0.5194868070685064,0.9170230966638152,0.9182712879760376,undersample,0.9128601324371269,0.9112035260122696,0.8048774483039101,COMPLETE
1354,0.7040855288277968,2025-09-23 18:02:11.454766,2025-09-23 18:02:15.681941,0 days 00:00:04.227175,0.0007351716521712455,dart,0.7970943885016575,6.280005955954611,depthwise,0.016770094796225272,0.06240854001718199,7,12,2.434636967704379,200,forest,0.6399281186783897,0.9491789384346168,none,0.8798436271821476,4.006497396190143,0.09099059150273472,uniform,0.5298256197981329,0.7353399203280452,0.8415395639267069,0.8413185913185913,0.6399281186783897,0.7074829931972789,0.7040855288277968,0.9491789384346168,0.8081518546289144,0.7960183698659418,0.6337169939065673,0.6356428817649087,0.8006843455945253,0.789045785194694,none,0.9201601411054126,0.9163953789209609,0.8798436271821476,COMPLETE
1355,0.7005058433629863,2025-09-23 18:02:15.822068,2025-09-23 18:02:20.066407,0 days 00:00:04.244339,0.00030341843700612444,dart,0.8526073295289897,5.39847524395457,depthwise,0.003875114096510694,0.36577978416601453,2,11,1.5925509391052137,200,forest,0.687309758042339,0.9381522541681806,oversample,0.945255143014209,3.8411213427194957,0.11520451300078072,uniform,0.707101811037721,0.5094695573887135,0.8190193469137066,0.8242219492219492,0.687309758042339,0.6944348427238161,0.7005058433629863,0.9381522541681806,0.8173871693428054,0.8109242884416847,0.5826566125290024,0.591283863368669,0.8592814371257484,0.8592212237911853,oversample,0.9222662006283298,0.9201065146660646,0.945255143014209,COMPLETE
1356,0.7196467991169978,2025-09-23 18:02:20.206777,2025-09-23 18:02:49.493728,0 days 00:00:29.286951,0.006051331920914701,dart,0.6562683355882275,9.44517628913157,depthwise,0.0035688801338664977,0.06291144460440332,4,12,0.103619818296002,600,forest,0.6294023528827445,0.9503944593340629,none,0.7316280450795551,3.25670608604157,0.14856116697802846,uniform,0.8905191423150738,0.7622524813637923,0.8559729757395844,0.8569819819819819,0.6294023528827445,0.7216617210682492,0.7196467991169978,0.9503944593340629,0.8248859105551118,0.8194184459415579,0.6713286713286714,0.6776266061980347,0.7801539777587682,0.7672229353872486,none,0.9265227547097395,0.9246905793750371,0.7316280450795551,COMPLETE
1357,0.7206094296891085,2025-09-23 18:02:49.638373,2025-09-23 18:03:20.481129,0 days 00:00:30.842756,0.0012512207305807029,dart,0.5479030734595801,8.893481561443195,depthwise,0.014793459526557102,0.10426030425556271,3,12,0.13872304656676138,600,forest,0.6733596995553897,0.9667843814374203,none,0.7970928270437135,3.5767520950012446,0.18671061047124374,uniform,0.8858319527862093,0.789726588255399,0.8618077592384072,0.8610769860769861,0.6733596995553897,0.7227926078028748,0.7206094296891085,0.9667843814374203,0.8260766708049544,0.817258792759264,0.6951026856240127,0.6944444444444444,0.7527801539777588,0.7488232777064613,none,0.9272406222792892,0.9243546403549368,0.7970928270437135,COMPLETE
1358,0.7135636057287279,2025-09-23 18:03:20.737457,2025-09-23 18:04:03.942139,0 days 00:00:43.204682,0.19613679784917382,dart,0.70713114835718,8.472411213734198,depthwise,0.006460842464681436,0.08729827888204023,3,11,0.15552820873864875,700,forest,0.49857859064368193,0.8663288784914649,none,0.5394110287267029,1.621839208102742,0.21668197405604347,uniform,0.8999226449673469,0.7316103696114757,0.8616030299928344,0.8607698607698607,0.49857859064368193,0.717391304347826,0.7135636057287279,0.8663288784914649,0.817533354025247,0.8123767995024935,0.7015535568274734,0.7026130236416425,0.7339606501283148,0.7248609328198545,none,0.9230671824354061,0.9220261004003917,0.5394110287267029,COMPLETE
1359,0.6997359486986043,2025-09-23 18:04:04.081546,2025-09-23 18:04:32.349592,0 days 00:00:28.268046,0.01112790620736061,dart,0.5293583055353889,8.811703719440805,depthwise,0.0012549893157771102,0.10849890201876364,5,12,0.338527693915852,600,forest,0.6133512118840251,0.8491888707147552,none,0.7406283003758909,3.7120653695525125,0.180625702971338,uniform,0.8858920874721865,0.6019806664710099,0.8420513870406388,0.8370188370188371,0.6133512118840251,0.7107778819119025,0.6997359486986043,0.8491888707147552,0.8053794299044181,0.7943773515948731,0.6326326326326326,0.6256323777403036,0.8109495295124037,0.793752674368849,none,0.9201463558838836,0.9154150289351521,0.7406283003758909,COMPLETE
1360,0.7019644527595884,2025-09-23 18:04:32.500220,2025-09-23 18:04:33.557676,0 days 00:00:01.057456,0.0016570993892485366,gbtree,0.6797622904417207,9.742453000260786,depthwise,0.0017472415637278752,0.02132852689019373,4,12,0.1895321561225483,500,,0.5861572690190441,0.9471475599484649,none,0.7779872572282197,3.145477903160665,,,,0.830882283176342,0.8397993653393387,0.836916461916462,0.5861572690190441,0.7099165894346617,0.7019644527595884,0.9471475599484649,0.8083271676542053,0.7958292337386856,0.6264311416421328,0.6236702127659575,0.8190761334473909,0.8027385537013265,none,0.9216340086422692,0.9162075432878503,0.7779872572282197,COMPLETE
1361,0.711395101171459,2025-09-23 18:04:33.715490,2025-09-23 18:04:43.962854,0 days 00:00:10.247364,0.019662817384115745,dart,0.8102865077599278,5.372049446762717,depthwise,0.0020090168132605164,0.2623797099027517,3,10,0.5329366079759726,300,forest,0.6860636278471763,0.91413264092498,none,0.9795665155911636,3.4396590044224857,0.14682127922701504,uniform,0.8708284508133853,0.6686673286546378,0.8631384993346299,0.8612817362817363,0.6860636278471763,0.7165571337714649,0.711395101171459,0.91413264092498,0.8132645154183865,0.8110615368881385,0.7103825136612022,0.7082273112807463,0.7228400342172797,0.7145913564398801,none,0.9188402708971584,0.919334154351254,0.9795665155911636,COMPLETE
1362,0.7125506072874493,2025-09-23 18:04:44.192113,2025-09-23 18:04:53.389764,0 days 00:00:09.197651,0.005140292183786104,dart,0.4243197242270996,9.707556538779619,depthwise,0.004771947348085595,0.15371966350351524,3,12,0.31720973277345405,300,forest,0.679686898000139,0.9763662940466546,none,0.7712623661754202,4.70720980537156,0.16702148771051534,uniform,0.8852440780974064,0.7999439548058002,0.8502405568635479,0.8473587223587223,0.679686898000139,0.7203211623016632,0.7125506072874493,0.9763662940466546,0.8265371008402109,0.8182801481129441,0.6512270998963015,0.6484210526315789,0.8058169375534645,0.7907573812580231,none,0.9277577263720439,0.9248794227100421,0.7712623661754202,COMPLETE
1363,0.7132449093966,2025-09-23 18:04:53.653633,2025-09-23 18:04:54.603219,0 days 00:00:00.949586,0.00020862619948120337,gbtree,0.7760920956338963,4.4076822859417,depthwise,0.01509747840786733,0.04130544047128866,6,9,0.17084086771654783,200,,0.36951876451753235,0.9280971123892404,none,0.9057055810973454,1.3621051645232962,,,,0.9526453954325341,0.8443034087419388,0.8428542178542179,0.36951876451753235,0.7173387846125255,0.7132449093966,0.9280971123892404,0.8283874556162806,0.8219050477050567,0.6342425238251725,0.6329575596816976,0.825491873396065,0.8168592212237912,none,0.9277396242752973,0.9253015634293351,0.9057055810973454,COMPLETE
1364,0.6390029325513197,2025-09-23 18:04:54.851037,2025-09-23 18:05:08.589645,0 days 00:00:13.738608,0.00021405652727137572,dart,0.8972064641118005,7.526986439940004,depthwise,0.011313133761709922,0.03926494679091814,0,12,0.250987992526784,400,forest,0.6094495112655989,0.8676099141854151,undersample,0.9174487945144248,3.9705401689146056,0.1368616649195347,uniform,0.8423932792468385,0.5978494591891823,0.7395843996314874,0.747952497952498,0.6094495112655989,0.6311974485358075,0.6390029325513197,0.8676099141854151,0.7930668778873011,0.7860074071871931,0.4774122807017544,0.48605844300691503,0.9311377245508982,0.9323919554985024,undersample,0.909535764390246,0.9078243560626542,0.9174487945144248,COMPLETE
1365,0.7062136286840623,2025-09-23 18:05:08.734929,2025-09-23 18:05:09.895485,0 days 00:00:01.160556,0.0014435322246065842,gbtree,0.6068728216034183,2.349088256304549,depthwise,0.003979232344980351,0.11352094905315575,2,11,0.11774836423014479,500,,0.5925142462690042,0.8881613789791128,oversample,0.8626534201007019,2.309640448185615,,,,0.43013054691033653,0.8357047804278841,0.8397829647829648,0.5925142462690042,0.699606962380685,0.7062136286840623,0.8881613789791128,0.8102716858144167,0.8073961629050569,0.621963394342762,0.6290969899665552,0.7994011976047904,0.8048780487804879,oversample,0.9188076065413436,0.9166540703929871,0.8626534201007019,COMPLETE
1366,0.6571209409358221,2025-09-23 18:05:10.030709,2025-09-23 18:05:15.166263,0 days 00:00:05.135554,0.0005745091908388962,dart,0.9624469159675416,4.704045290590797,lossguide,0.00018789280522121427,0.010085903503097323,1,10,0.15470595662037118,200,forest,0.610992436512079,0.9767837981314014,none,0.8537023786678394,1.602017333333503,0.2010295206626152,uniform,0.6851631076018961,0.5940553203556868,0.8646739686764254,0.8627149877149877,0.610992436512079,0.6642965972574911,0.6571209409358221,0.9767837981314014,0.813478874109303,0.8043084943341338,0.8175,0.8163913595933926,0.5594525235243798,0.5498502353444588,none,0.9194770387709499,0.9174657022901954,0.8537023786678394,COMPLETE
1367,0.6748911465892597,2025-09-23 18:05:15.320964,2025-09-23 18:05:24.995254,0 days 00:00:09.674290,0.00046907743218909,dart,0.330812612407991,1.1772939901303903,lossguide,0.0016077288865664736,0.008686357909778054,10,8,1.2181447684252273,300,forest,0.41459530006760287,0.9841302659884159,none,0.6535327510216213,0.8103433881562063,0.09980498989421634,uniform,0.8941746956457641,0.2526943422384035,0.8651857917903573,0.8624078624078624,0.41459530006760287,0.6837935174069628,0.6748911465892597,0.9841302659884159,0.8070336733393804,0.7983011233195242,0.7794198139025725,0.7762938230383973,0.6090675791274593,0.5969191270860077,none,0.9177321865870888,0.9158641472737314,0.6535327510216213,COMPLETE
1368,0.6896084082047804,2025-09-23 18:05:25.141603,2025-09-23 18:06:05.554738,0 days 00:00:40.413135,0.012329496360603735,dart,0.913756472178747,8.928641240690961,depthwise,0.0022333526150268013,0.10466715738160608,4,12,0.1526934512255031,700,forest,0.5375455747223806,0.9444022957373275,none,0.7488622107386129,4.952568934460331,0.18513727959781012,uniform,0.8696335345466091,0.8455971272308721,0.8102159893540792,0.8125511875511876,0.5375455747223806,0.6880888290713324,0.6896084082047804,0.9444022957373275,0.8183893720032247,0.8096935015056614,0.5671103716028841,0.571027512633352,0.8746792130025663,0.8703465982028241,none,0.9221567534519749,0.9199709931570131,0.7488622107386129,COMPLETE
1369,0.6296002118083135,2025-09-23 18:06:05.693001,2025-09-23 18:06:46.531149,0 days 00:00:40.838148,0.05204081755348062,dart,0.26676555594446205,6.940346129624433,depthwise,0.07176422945109757,0.05472591992162871,4,12,0.11931842159744531,700,forest,0.6886392099502783,0.8872160002583551,none,0.8502952917513926,1.5825918205401872,0.1426175836165883,uniform,0.7691458543192141,0.9363671490647925,0.8594533729143208,0.8567772317772318,0.6886392099502783,0.6395379364662641,0.6296002118083135,0.8872160002583551,0.807347745103489,0.7951751686191132,0.8280081577158396,0.8256944444444444,0.5209580838323353,0.5087719298245614,none,0.9204332554108577,0.9154784565715322,0.8502952917513926,COMPLETE
1370,0.663706473475111,2025-09-23 18:06:46.678859,2025-09-23 18:06:47.362064,0 days 00:00:00.683205,0.0008347018420755459,gbtree,0.30158318737420065,2.2050559451277794,depthwise,0.0002476146581730839,0.20513400466775608,5,5,0.21919060786270017,500,,0.35598171959834063,0.8293763262365202,none,0.9835273010756435,0.6223136671818764,,,,0.7983311867776252,0.8577131743269526,0.8526822276822277,0.35598171959834063,0.6774941995359629,0.663706473475111,0.8293763262365202,0.784726529806308,0.7744653321540675,0.7403651115618661,0.7312049433573635,0.6244653550042771,0.6076166024818143,none,0.906784188126429,0.903471573334181,0.9835273010756435,COMPLETE
1371,0.7009907997169144,2025-09-23 18:06:47.507371,2025-09-23 18:07:13.682113,0 days 00:00:26.174742,0.0001859338968922036,dart,0.8643370441271734,8.767089981075507,depthwise,0.00011842808769915569,0.021182586875717564,2,12,0.558076048261167,500,forest,0.6854710886318016,0.9659942540879186,oversample,0.9458426773266218,2.7680992352049145,0.11158628035826386,uniform,0.7713198469851218,0.959845851810505,0.8243423072985976,0.826986076986077,0.6854710886318016,0.7,0.7009907997169144,0.9659942540879186,0.8257939546354742,0.8167496817272293,0.5919574216439977,0.5975867269984917,0.8562874251497006,0.8476679503637141,oversample,0.925965100769106,0.9231135834933131,0.9458426773266218,COMPLETE
1372,0.7001090512540894,2025-09-23 18:07:13.820853,2025-09-23 18:07:47.824161,0 days 00:00:34.003308,0.0008378554788587048,dart,0.8048882712344333,4.380155113457024,lossguide,0.01196841667763832,0.0024910155044932684,1,11,14.293792565391469,600,forest,0.6184193004194006,0.9375156568652986,none,0.9814588179404196,4.379003073653353,0.20085127130618435,uniform,0.7356391085120894,0.7406743213407728,0.8262872351315386,0.831081081081081,0.6184193004194006,0.694839057723431,0.7001090512540894,0.9375156568652986,0.7976397426864575,0.7879416535887702,0.5994415141172821,0.6085308056872037,0.8263473053892215,0.8241335044929397,none,0.9158158393404091,0.9134512194834037,0.9814588179404196,COMPLETE
