number,value,datetime_start,datetime_complete,duration,params_alpha,params_booster,params_colsample_bytree,params_gamma,params_grow_policy,params_lambda,params_learning_rate,params_max_delta_step,params_max_depth,params_min_child_weight,params_n_estimators,params_normalize_type,params_params_decision_threshold,params_params_feature_fraction,params_params_resampling,params_params_sample_rows,params_params_scale_pos_weight,params_rate_drop,params_sample_type,params_skip_drop,params_subsample,user_attrs_acc_test,user_attrs_acc_val,user_attrs_decision_threshold,user_attrs_f1_test,user_attrs_f1_val,user_attrs_feature_fraction,user_attrs_pr_auc_test,user_attrs_pr_auc_val,user_attrs_prec_test,user_attrs_prec_val,user_attrs_rec_test,user_attrs_rec_val,user_attrs_resampling_strategy,user_attrs_roc_auc_test,user_attrs_roc_auc_val,user_attrs_sample_rows,state
1252,0.7046692607003892,2025-09-23 17:35:37.274579,2025-09-23 17:35:56.205720,0 days 00:00:18.931141,20.119310607868695,dart,0.5028515768685851,0.3674073310735553,depthwise,0.0012088103164358982,0.47179703694589376,0,11,0.8751517411347153,500,forest,0.336533972507063,0.9970757560879377,none,0.9044793768617749,1.0690840905847565,0.05916876887084692,weighted,0.6040447139953931,0.7967038029744771,0.8462483365748797,0.8445945945945946,0.336533972507063,0.7111538461538461,0.7046692607003892,0.9970757560879377,0.8150041366134976,0.8079933557047492,0.6460517120894479,0.6460934712807705,0.7908468776732249,0.7749251176722294,none,0.9209627345459033,0.9191901681462898,0.9044793768617749,COMPLETE
1253,0.6554545454545454,2025-09-23 17:35:56.340118,2025-09-23 17:35:56.926146,0 days 00:00:00.586028,0.0012421241164784931,gbtree,0.8891337148441738,6.05622699487052,lossguide,0.011837600905601032,0.13109893207954781,3,7,10.121869537407523,300,,0.6777123387158731,0.8153265561173954,undersample,0.7366270195917031,4.7884121169286,,,,0.6996990283401268,0.7604667826799059,0.7671990171990172,0.6777123387158731,0.6503287507471608,0.6554545454545454,0.8153265561173954,0.8064011910633936,0.7988584836891237,0.4997703261368856,0.5073891625615764,0.93071000855432,0.9255455712451861,undersample,0.9182171155698868,0.9156665513279869,0.7366270195917031,COMPLETE
1254,0.6465753424657534,2025-09-23 17:35:57.057820,2025-09-23 17:35:57.757089,0 days 00:00:00.699269,0.0003909234521031721,gbtree,0.85034180588645,5.063947578584119,lossguide,0.5073909961845218,0.08930743091388818,5,5,8.018925766036402,400,,0.6801630515028051,0.8297009745029362,none,0.8462568850418026,2.468793937988535,,,,0.7909174687707355,0.8430750332685024,0.8415233415233415,0.6801630515028051,0.6549628629304524,0.6465753424657534,0.8297009745029362,0.7336542934641218,0.7285064754726103,0.6912114014251781,0.6930983847283406,0.6223267750213858,0.6059050064184852,none,0.8916626059260451,0.8927219277717287,0.8462568850418026,COMPLETE
1255,0.6118924940816043,2025-09-23 17:35:57.890391,2025-09-23 17:35:59.153551,0 days 00:00:01.263160,0.12603955727512214,gbtree,0.3979995335334582,1.1577737614979933,lossguide,2.05030579438819,0.0008739844699063607,6,7,1.550613677156148,400,,0.4923416530467196,0.8553869560254993,undersample,0.7465882394798201,1.1365764303441297,,,,0.22466098835898585,0.7067253557170642,0.7146805896805897,0.4923416530467196,0.6057520297234071,0.6118924940816043,0.8553869560254993,0.737131622180759,0.7326852940102629,0.44654088050314467,0.45355078447563996,0.9414029084687767,0.940094137783483,undersample,0.8925063247977774,0.8917006362975258,0.7465882394798201,COMPLETE
1256,0.6931839402427638,2025-09-23 17:35:59.286417,2025-09-23 17:36:02.757973,0 days 00:00:03.471556,0.0005307337891453747,dart,0.5264709149239196,5.705949423817951,depthwise,0.07051249684715369,0.0051885223198299925,7,7,0.43476657661000445,200,forest,0.30496446556018103,0.9901144809803307,none,0.9477835398981049,1.0411122336889043,0.08264456240494616,weighted,0.7634863992093138,0.6069574174179725,0.8305865492885659,0.8317977067977068,0.30496446556018103,0.6947057738424645,0.6931839402427638,0.9901144809803307,0.8030595163483408,0.7925358262898252,0.6107687317547843,0.6149768058316766,0.8053892215568862,0.7941805733846812,none,0.9137068443423436,0.9110149418006089,0.9477835398981049,COMPLETE
1257,0.7005597014925373,2025-09-23 17:36:02.892611,2025-09-23 17:36:19.993096,0 days 00:00:17.100485,0.0001905960796969941,dart,0.781495626992452,9.218511639664822,depthwise,0.33002424126734325,0.13110251354775931,3,11,1.0766726597753113,500,forest,0.5736178497462495,0.9613469519076939,none,0.8784729198856129,1.389240446748012,0.00021469889611350906,weighted,0.5487015479674587,0.6684489007579525,0.8724536800081891,0.8685503685503686,0.5736178497462495,0.7131675874769797,0.7005597014925373,0.9613469519076939,0.8240985493324693,0.8167142878340385,0.7721834496510469,0.769861609431061,0.6625320786997434,0.6427043217800599,none,0.9258595387804471,0.9236345077897372,0.8784729198856129,COMPLETE
1258,0.7032723239046035,2025-09-23 17:36:20.128700,2025-09-23 17:36:58.873254,0 days 00:00:38.744554,0.0009367619389349573,dart,0.2607352005799227,1.5490347619444695,lossguide,0.0036771711742649175,0.2133542046979767,6,9,0.20134268795043875,700,forest,0.699435739216115,0.9136055508867599,oversample,0.7876145272080097,4.586776369330453,0.06717191055580157,weighted,0.6616703121696125,0.7161866112665642,0.8372402497696796,0.8356879606879607,0.699435739216115,0.7094298245614035,0.7032723239046035,0.9136055508867599,0.8178829805227597,0.8114245823865694,0.6193363114231014,0.619140625,0.830196749358426,0.8138639281129654,oversample,0.9221618761439001,0.918396300593905,0.7876145272080097,COMPLETE
1259,0.6900584795321637,2025-09-23 17:36:59.005208,2025-09-23 17:37:24.100725,0 days 00:00:25.095517,1.1848961403899159,dart,0.23042427910627195,1.672209681657479,depthwise,0.09950790093616407,0.07287863880211008,3,8,0.12231164214058078,600,forest,0.357638912974751,0.9964341129336439,none,0.8710220390311585,0.5316838992456442,0.093721348443236,weighted,0.26581602139125504,0.9486603301567113,0.8692803767018119,0.8697788697788698,0.357638912974751,0.6908738804163641,0.6900584795321637,0.9964341129336439,0.8249874942105058,0.8183692671137772,0.795872838817624,0.801358234295416,0.6103507271171942,0.6059050064184852,none,0.9256889358718402,0.9239346877883287,0.8710220390311585,COMPLETE
1260,0.686027750887383,2025-09-23 17:37:24.234913,2025-09-23 17:37:25.232074,0 days 00:00:00.997161,0.0019430274308562152,gbtree,0.5419088475513729,1.0874615012764925,lossguide,0.00015735474587785523,0.0694673475698955,8,7,0.9468114328943943,200,,0.39553095102661795,0.9333684042064899,oversample,0.5786678012345982,1.387280431032759,,,,0.4649297872379985,0.7964991299007064,0.8007780507780508,0.39553095102661795,0.6808988764044944,0.686027750887383,0.9333684042064899,0.8228852645739982,0.8136489320680975,0.5449640287769785,0.5506345506345506,0.907185628742515,0.9097133076593924,oversample,0.9246334598810915,0.9229429939583377,0.5786678012345982,COMPLETE
1261,0.7276878372768784,2025-09-23 17:37:25.394671,2025-09-23 17:37:32.496970,0 days 00:00:07.102299,0.00010249888082093119,dart,0.9770061761248228,7.160093669092631,depthwise,0.001546063968267821,0.1987748788770164,2,12,1.2870569525849747,300,forest,0.6636234622245967,0.9797675382025393,none,0.9910913303573655,3.2098330295933786,0.08274470639107036,weighted,0.7048856790298051,0.5078801081643994,0.8611935715016891,0.8656838656838657,0.6636234622245967,0.7211024269847799,0.7276878372768784,0.9797675382025393,0.8234684020045013,0.8204994352831169,0.6945324881141046,0.7065699314792422,0.7497861420017109,0.750106974753958,none,0.9261177166976386,0.9255029886422781,0.9910913303573655,COMPLETE
1262,0.7033088235294118,2025-09-23 17:37:32.632166,2025-09-23 17:37:50.939254,0 days 00:00:18.307088,0.005706746185868088,dart,0.615232739794408,7.09660532495538,depthwise,0.00047394652483110164,0.007919797998331144,5,6,0.10012908638691097,500,forest,0.42097488765239227,0.7915955800832798,none,0.9839772542307559,1.6930635276145283,0.08313550338204134,weighted,0.7269035442428975,0.7801880757163899,0.8336574879721568,0.8347665847665847,0.42097488765239227,0.7029793456406507,0.7033088235294118,0.7915955800832798,0.8170700236891174,0.8101896497445022,0.6137887009256304,0.6165001611343861,0.8224978614200171,0.8185708172871202,none,0.9214001779013056,0.9194792634240432,0.9839772542307559,COMPLETE
1263,0.7276831520623845,2025-09-23 17:37:51.071096,2025-09-23 17:38:02.617638,0 days 00:00:11.546542,0.00030581735105841986,dart,0.959625223115091,8.279980418648433,depthwise,0.0048151205050556475,0.25722407582515666,1,12,3.4231153166785293,400,forest,0.6673696452108334,0.9032760993693616,none,0.8886957275762005,3.5661072404940004,0.07851250205884726,weighted,0.7663284450378907,0.7972115542565541,0.8617053946156208,0.8641482391482391,0.6673696452108334,0.724679029957204,0.7276831520623845,0.9032760993693616,0.8251464283648633,0.8200512047122275,0.6920980926430518,0.6991324921135647,0.7604790419161677,0.7586649550706034,none,0.9257527105083909,0.9247821074985287,0.8886957275762005,COMPLETE
1264,0.7067082683307332,2025-09-23 17:38:02.751706,2025-09-23 17:38:22.955234,0 days 00:00:20.203528,0.0007141321133336525,dart,0.9458617881131719,0.20267863114389684,depthwise,0.0020934546343582367,0.18098403557168924,4,12,0.10984427401654154,500,forest,0.33524414347291515,0.9895641841897567,none,0.9943060359664546,2.310322419450341,0.07859813205514325,weighted,0.7911843300039978,0.9634122999704335,0.8440986794963661,0.846027846027846,0.33524414347291515,0.7016650342801175,0.7067082683307332,0.9895641841897567,0.8111817887583284,0.80695215976033,0.6472714130827611,0.6492296667860982,0.7660393498716852,0.7753530166880617,none,0.919040890478113,0.9175522782786633,0.9943060359664546,COMPLETE
1265,0.7262005054759899,2025-09-23 17:38:23.087652,2025-09-23 17:38:49.162549,0 days 00:00:26.074897,0.00025188112557617605,dart,0.8626448152133008,7.380750052324588,depthwise,0.0003590662156173547,0.08085172112463242,4,12,0.27506989131588466,600,forest,0.6599238561533304,0.9819804406057504,none,0.9790710996898784,3.103003041859839,0.091368737256678,weighted,0.7477422973090838,0.4905048939383726,0.8644692394308527,0.866912366912367,0.6599238561533304,0.7230125523012553,0.7262005054759899,0.9819804406057504,0.8267724929580551,0.8206101945904251,0.7076167076167076,0.7150559933637495,0.739093242087254,0.7376979032948224,none,0.9273322839297471,0.9252545757295747,0.9790710996898784,COMPLETE
1266,0.6858269009689604,2025-09-23 17:38:49.294571,2025-09-23 17:39:13.809168,0 days 00:00:24.514597,0.0001322942227972976,dart,0.8310751119374535,7.412164120065304,depthwise,0.00010556862858160796,0.08337359215171199,6,11,0.9797694406192201,600,forest,0.5706273425233154,0.923324644579541,undersample,0.9655854566297555,1.9076598251336645,0.0688209882162677,weighted,0.6676481727797354,0.24557775547734095,0.7980345992425018,0.8041564291564292,0.5706273425233154,0.681928099306787,0.6858269009689604,0.923324644579541,0.8127891387455268,0.8034765632169457,0.5472186287192755,0.5565031982942431,0.9046193327630453,0.8934531450577664,undersample,0.9225453297799118,0.9196404381441772,0.9655854566297555,COMPLETE
1267,0.7053706505295008,2025-09-23 17:39:13.945567,2025-09-23 17:39:25.353310,0 days 00:00:11.407743,0.0001557219789420076,dart,0.9018494851813499,9.890679020545898,depthwise,0.0006446390045128476,0.43832743543721353,2,12,8.783724638252243,400,forest,0.6199816307651029,0.8514373271342601,none,0.900865320260982,3.977022467472666,0.0786166287083592,weighted,0.785841636490175,0.7866009756049357,0.8389804483570478,0.8404995904995906,0.6199816307651029,0.7030394562960166,0.7053706505295008,0.8514373271342601,0.8106046544941352,0.8046481146497919,0.6292666441365327,0.6319891562182312,0.7964071856287425,0.7980316645271716,none,0.917874470794267,0.9178980639858456,0.900865320260982,COMPLETE
1268,0.7082374597330879,2025-09-23 17:39:25.486477,2025-09-23 17:39:28.977277,0 days 00:00:03.490800,0.000591084452741299,dart,0.9070816543669651,6.085370728906142,depthwise,0.00012956570455416956,0.17629161705712315,1,12,0.25916081417260006,200,forest,0.6599974081662607,0.9770998783160932,none,0.9774092348341932,2.0804514430068908,0.08431769495446405,weighted,0.7234264682134832,0.34173262534639526,0.86764254273723,0.8701883701883701,0.6599974081662607,0.7021423635107118,0.7082374597330879,0.9770998783160932,0.819742656385515,0.8174565708817266,0.7608587119321019,0.766052762568442,0.6518391787852865,0.6585365853658537,none,0.9245989824376852,0.9240243156739621,0.9774092348341932,COMPLETE
1269,0.7123552123552124,2025-09-23 17:39:29.111530,2025-09-23 17:40:03.897492,0 days 00:00:34.785962,0.00442483941529041,dart,0.9980606671866465,6.345562134138003,depthwise,0.00013952557420486553,0.14682466960826454,5,12,2.023411166084101,700,forest,0.628957865692256,0.9860295003690978,none,0.9683522483234427,4.41024006901952,0.0016808237149018856,weighted,0.7445573450208658,0.4769889710383563,0.8459412427065206,0.8474610974610974,0.628957865692256,0.7104098518375986,0.7123552123552124,0.9860295003690978,0.8094952952776473,0.8113289049993093,0.64568030779993,0.6489623637003166,0.7895637296834902,0.7894736842105263,none,0.919087052263775,0.919363147374329,0.9683522483234427,COMPLETE
1270,0.672920892494929,2025-09-23 17:40:04.030954,2025-09-23 17:40:04.650495,0 days 00:00:00.619541,0.018787330807431633,gbtree,0.9820376211415043,9.41609613908054,depthwise,0.05916409269910685,0.0663935675281415,1,12,4.075073050389991,200,,0.6913688552241845,0.9281044512888688,none,0.9497514480809851,1.5722504997806555,,,,0.5504612645788151,0.8660047087726481,0.8679361179361179,0.6913688552241845,0.6680192746639615,0.672920892494929,0.9281044512888688,0.8181103937407026,0.8120882089304665,0.8205607476635514,0.8257622899813317,0.5633019674935843,0.5678219940094138,none,0.9240165784124698,0.9210450018360329,0.9497514480809851,COMPLETE
1271,0.7177835051546392,2025-09-23 17:40:04.783179,2025-09-23 17:40:23.837431,0 days 00:00:19.054252,0.0005768831363629008,dart,0.9233671917831591,8.90989984984115,lossguide,0.0006878492186850559,0.015195406041045053,3,12,2.6860144476821843,500,forest,0.5347032037031463,0.9227784188011268,none,0.9629618746666692,1.6510352770886614,0.06411266763524939,weighted,0.5633489753097188,0.33952892768775056,0.8649810625447846,0.8654791154791155,0.5347032037031463,0.7173773301907007,0.7177835051546392,0.9227784188011268,0.8213192258583464,0.813990141728519,0.7187634177758695,0.720569210866753,0.7159965782720273,0.7150192554557124,none,0.924526084804841,0.9220591242310443,0.9629618746666692,COMPLETE
1272,0.6896247240618102,2025-09-23 17:40:23.970662,2025-09-23 17:40:36.101401,0 days 00:00:12.130739,0.023677322619554127,dart,0.9746279012120264,9.7910569757265,lossguide,0.0002387608848598955,0.008912167098752396,1,11,3.3139879949117237,400,forest,0.4827110224260405,0.8103547550062513,none,0.8037306468939232,1.322317613244376,0.07161905853723223,weighted,0.5523788219506331,0.21266817521105802,0.8570989865902344,0.8560606060606061,0.4827110224260405,0.6977046340407103,0.6896247240618102,0.8103547550062513,0.7976711139262389,0.7907340987400386,0.7065789473684211,0.7122663018695851,0.6890504704875963,0.6683782627299957,none,0.9105095938810422,0.9089516001931793,0.8037306468939232,COMPLETE
1273,0.7045885475919605,2025-09-23 17:40:36.234919,2025-09-23 17:40:55.806004,0 days 00:00:19.571085,0.0011909852080123375,dart,0.7542192606085079,9.331928912486163,lossguide,0.0007748596594073271,0.007805377380090305,4,10,17.09340054969599,500,forest,0.6041133203871886,0.9755758986859482,none,0.878513056859957,3.3818571388217795,0.043197607701375214,weighted,0.475659481906555,0.5432145891513795,0.8416419285494933,0.8404995904995906,0.6041133203871886,0.7076167076167076,0.7045885475919605,0.9755758986859482,0.8149716956552169,0.8061445111929086,0.6339315949881477,0.6326183180115764,0.8006843455945253,0.7950363714163458,none,0.9214765865926605,0.9186408554479273,0.878513056859957,COMPLETE
1274,0.7195830827821207,2025-09-23 17:40:55.940117,2025-09-23 17:41:13.136786,0 days 00:00:17.196669,0.0025813288303478932,dart,0.7934020561281423,9.695643085577005,lossguide,0.009102535524012318,0.2776343968510067,3,12,4.709782084057554,500,forest,0.5419808800922863,0.9518168862749475,none,0.9194141250905847,2.2042722198972546,0.001592769188996871,weighted,0.5515324602935351,0.3385244335936333,0.8542327771522162,0.8567772317772318,0.5419808800922863,0.7176843774781919,0.7195830827821207,0.9518168862749475,0.8170569667826066,0.8103948838246872,0.6688839615668883,0.6768476621417798,0.7741659538066724,0.7680787334189131,none,0.9228903632264855,0.9206663938385765,0.9194141250905847,COMPLETE
1275,0.7126023567006191,2025-09-23 17:41:13.270224,2025-09-23 17:41:37.608781,0 days 00:00:24.338557,0.015838252922051165,dart,0.8610697661298414,9.208013729443293,lossguide,0.4367318606339259,0.42126448629043434,3,12,3.2769263341915322,600,forest,0.503277394525326,0.9604482093044407,none,0.8464782691739022,1.8947978335879485,0.013718000082096385,weighted,0.45329961761156784,0.3855412311153707,0.8525949431876344,0.8526822276822277,0.503277394525326,0.7145122918318795,0.7126023567006191,0.9604482093044407,0.8190659578776955,0.8122573996982582,0.6659275683665927,0.6681647940074906,0.7707442258340462,0.7633718442447582,none,0.9239083111820073,0.922444037563211,0.8464782691739022,COMPLETE
1276,0.7106423777564718,2025-09-23 17:41:37.742538,2025-09-23 17:41:44.717790,0 days 00:00:06.975252,0.0006889801687121602,dart,0.6908100411755269,7.761978768028996,lossguide,0.11357073566239692,0.33571217288395194,4,10,11.64342045097653,300,forest,0.588365881084422,0.9853723088722381,none,0.977551983802042,3.290361602741452,0.011090843338940226,weighted,0.5538919732148162,0.3076491359867755,0.8413348346811342,0.8455159705159705,0.588365881084422,0.7078778741047871,0.7106423777564718,0.9853723088722381,0.8064173741608316,0.8007258053987544,0.6327493261455526,0.6438498957609451,0.8032506415739948,0.7928968763371844,none,0.9192652240935972,0.9173865832957461,0.977551983802042,COMPLETE
1277,0.7108159392789374,2025-09-23 17:41:44.850586,2025-09-23 17:42:04.586023,0 days 00:00:19.735437,0.0001577738771913285,dart,0.9262973643356522,8.795963261391819,lossguide,0.002154212477964681,0.01071630679487656,3,10,0.30838900509694217,500,forest,0.5139278968074805,0.9907306820788938,none,0.9052613029474224,2.395350718794871,0.001857895267846743,weighted,0.6133835998722559,0.20078628727640313,0.8419490224178524,0.8439803439803439,0.5139278968074805,0.7097744360902256,0.7108159392789374,0.9907306820788938,0.8183975942789027,0.8112456909104692,0.6331321260898726,0.6385952949198772,0.8075278015397775,0.8014548566538297,none,0.923341217674231,0.9211266544809594,0.9052613029474224,COMPLETE
1278,0.7001189060642092,2025-09-23 17:42:04.722947,2025-09-23 17:42:05.769921,0 days 00:00:01.046974,0.0003226437104800669,gbtree,0.8919702307447938,8.012958100063067,depthwise,0.008870481934077482,0.02623544423830042,1,11,2.319904302902715,700,,0.6752593909708718,0.8670905949061741,none,0.8603334233407671,2.1008643873324253,,,,0.8041382092959677,0.870713481420821,0.8709049959049959,0.6752593909708718,0.7024734982332156,0.7001189060642092,0.8670905949061741,0.8232802129936658,0.8178822349825323,0.7818563188253802,0.7880085653104925,0.6377245508982036,0.629867351305092,none,0.9259347387467409,0.923849724122892,0.8603334233407671,COMPLETE
1279,0.6189174412247129,2025-09-23 17:42:05.907322,2025-09-23 17:42:24.036858,0 days 00:00:18.129536,0.00019837532724648667,dart,0.9578162460347294,7.660395778996422,lossguide,0.0019580230831047663,0.0189938328710066,6,10,6.032925074749711,500,forest,0.5992946312528139,0.9074230645726569,none,0.8512357771192989,0.9400649651787629,0.06156122834073929,weighted,0.48302013029818114,0.30874409160578836,0.8615006653700481,0.8572891072891073,0.5992946312528139,0.6328358208955224,0.6189174412247129,0.9074230645726569,0.8096214776380599,0.8039968662655612,0.8656273199703044,0.8569265707797123,0.49871685201026517,0.4843816859221224,none,0.918724175732968,0.9179287269149171,0.8512357771192989,COMPLETE
1280,0.6765279583875162,2025-09-23 17:42:24.169590,2025-09-23 17:42:36.897495,0 days 00:00:12.727905,0.00874636079699855,dart,0.8846760118932653,9.232058909080541,lossguide,0.0007204959227051224,0.02435653810781341,2,9,0.919771437329379,400,forest,0.6142688081788149,0.7272714731848182,oversample,0.9841616797153968,2.2463740259406464,0.0011686703053927798,weighted,0.5303313755647162,0.20911554875420046,0.7939400143310472,0.7962735462735463,0.6142688081788149,0.6750605326876513,0.6765279583875162,0.7272714731848182,0.8096432935201439,0.804493443821038,0.5421311900440757,0.545478374836173,0.8943541488451668,0.8904578519469405,oversample,0.9192287608875908,0.9168091125273065,0.9841616797153968,COMPLETE
1281,0.7168516649848637,2025-09-23 17:42:37.032939,2025-09-23 17:42:44.409928,0 days 00:00:07.376989,0.00025825979480471515,dart,0.5729240265400039,1.5553467062359274,depthwise,0.14357225679411045,0.1804568596812473,4,10,2.707036318089709,300,tree,0.6400425987463112,0.9186400742267273,none,0.9965529288770192,3.8318152734193593,0.07528559574160823,weighted,0.7006750108356092,0.9297403321625414,0.8555635172484389,0.8563677313677314,0.6400425987463112,0.7178564287142571,0.7168516649848637,0.9186400742267273,0.8228032784356736,0.8192130151025846,0.6740518212542246,0.6783804430863254,0.7677502138579982,0.7599486521181001,none,0.9243188460152191,0.9224987125888513,0.9965529288770192,COMPLETE
