number,value,datetime_start,datetime_complete,duration,params_alpha,params_booster,params_colsample_bytree,params_gamma,params_grow_policy,params_lambda,params_learning_rate,params_max_delta_step,params_max_depth,params_min_child_weight,params_n_estimators,params_normalize_type,params_params_decision_threshold,params_params_feature_fraction,params_params_resampling,params_params_sample_rows,params_params_scale_pos_weight,params_rate_drop,params_sample_type,params_skip_drop,params_subsample,user_attrs_acc_test,user_attrs_acc_val,user_attrs_decision_threshold,user_attrs_f1_test,user_attrs_f1_val,user_attrs_feature_fraction,user_attrs_pr_auc_test,user_attrs_pr_auc_val,user_attrs_prec_test,user_attrs_prec_val,user_attrs_rec_test,user_attrs_rec_val,user_attrs_resampling_strategy,user_attrs_roc_auc_test,user_attrs_roc_auc_val,user_attrs_sample_rows,state
851,0.6249649368863955,2025-09-23 15:08:57.784920,2025-09-23 15:09:05.029736,0 days 00:00:07.244816,0.014461015867409421,dart,0.6031169179576199,4.009228029281598,lossguide,0.0006649685381648957,0.04723312190429993,3,11,39.90262929630425,300,tree,0.5129832326889999,0.9933029113574934,oversample,0.6934220516636578,4.628704779205778,0.10582904775014823,weighted,0.667111552091665,0.30245033088297363,0.7195209335653598,0.7262489762489762,0.5129832326889999,0.6198668146503885,0.6249649368863955,0.9933029113574934,0.8018880258124251,0.792817026129556,0.4587268993839836,0.46484456499061133,0.9555175363558597,0.9533590072742832,oversample,0.9174019744120964,0.9138980920863328,0.6934220516636578,COMPLETE
852,0.7117117117117117,2025-09-23 15:09:05.156153,2025-09-23 15:09:06.101096,0 days 00:00:00.944943,0.00019621660813220668,gbtree,0.5868833347810423,0.6507816600441485,depthwise,36.37602525797364,0.1039743933230604,4,11,15.431896172893603,1000,,0.6500563372840455,0.8519077845893339,undersample,0.9712096631335432,1.1384209243209615,,,,0.9354604986623853,0.8478861705394616,0.8493038493038493,0.6500563372840455,0.7106697819314641,0.7117117117117117,0.8519077845893339,0.8114283181697177,0.8020390057475822,0.6522516082916369,0.6561935716865295,0.7805816937553465,0.7774925117672229,undersample,0.921293752537603,0.9180562731832618,0.9712096631335432,COMPLETE
853,0.6816089653792275,2025-09-23 15:09:06.230985,2025-09-23 15:09:06.730956,0 days 00:00:00.499971,15.62866468875709,gbtree,0.41439552243895605,8.218445976225144,depthwise,6.040718470112656,0.09483334013153132,1,8,1.1333830776900737,600,,0.5082248755730508,0.5996749797557694,oversample,0.8489505033617976,0.5826283233871549,,,,0.7271660271146556,0.8403111884532706,0.8371212121212122,0.5082248755730508,0.6919431279620853,0.6816089653792275,0.5996749797557694,0.7813540964373648,0.767289512674345,0.6426999266324285,0.6402255639097745,0.7493584260051326,0.7287120239623449,oversample,0.9067631793337023,0.9015426591594603,0.8489505033617976,COMPLETE
854,0.6259046668330421,2025-09-23 15:09:06.856976,2025-09-23 15:09:59.467157,0 days 00:00:52.610181,66.7754653349564,dart,0.869306131917857,6.127511482274156,depthwise,2.5848377218529115,0.2333038101983787,4,6,1.05842939447812,900,forest,0.4623522338823584,0.8611965871923213,none,0.6314867940945481,0.9620018569566908,0.25988878150975037,weighted,0.2708733148252596,0.8694324787703529,0.8496263691268298,0.8465397215397216,0.4623522338823584,0.6379097855558294,0.6259046668330421,0.8611965871923213,0.7501090370675247,0.7414121062952257,0.7527632344386271,0.7508982035928143,0.553464499572284,0.5365853658536586,none,0.8970017171954033,0.8945200134490774,0.6314867940945481,COMPLETE
855,0.6563786008230452,2025-09-23 15:09:59.593606,2025-09-23 15:10:00.175081,0 days 00:00:00.581475,5.690174245026928,gbtree,0.6523781156584323,3.871757941149591,depthwise,0.0002197900892492288,0.04394978922493549,4,12,3.744391033040411,400,,0.4894260668271775,0.8135992838231318,none,0.8400722147562669,0.7210130747152456,,,,0.9580684434408779,0.8663118026410073,0.8632268632268633,0.4894260668271775,0.6654713114754098,0.6563786008230452,0.8135992838231318,0.813338422614042,0.8051439712664942,0.8295019157088123,0.8226950354609929,0.5556030795551754,0.5459991442019684,none,0.9185404207445309,0.9160688547157022,0.8400722147562669,COMPLETE
856,0.11830985915492957,2025-09-23 15:10:00.303778,2025-09-23 15:10:31.945348,0 days 00:00:31.641570,0.0015217762443988047,dart,0.6757847414122122,6.889423265362856,depthwise,0.002054197501992953,0.0017482780548834344,5,3,10.595157093743826,800,tree,0.6263351397850165,0.5321551407712701,undersample,0.8624340306859504,0.9614499813970839,0.36399464731069564,uniform,0.2719869340129389,0.8622539481674234,0.7752072883611424,0.7756961506961507,0.6263351397850165,0.11522965350523771,0.11830985915492957,0.5321551407712701,0.6894862292684827,0.6888346255561085,0.9930555555555556,0.9932432432432432,0.0611633875106929,0.06290115532734275,undersample,0.8735893171267478,0.8707747563420005,0.8624340306859504,COMPLETE
857,0.0,2025-09-23 15:10:32.073327,2025-09-23 15:10:41.640726,0 days 00:00:09.567399,0.060224533768166895,dart,0.5770428409332904,9.341433484411608,depthwise,90.33730715232602,0.0002679837026000606,7,8,0.9379149792332981,400,tree,0.6570107619424106,0.7643570871341245,undersample,0.8281248026605776,0.6222999079900233,0.35825299521115106,weighted,0.11137965642594615,0.5403532178303798,0.7606715119254785,0.7607493857493858,0.6570107619424106,0.0,0.0,0.7643570871341245,0.6652934457771927,0.6592359093382398,0.0,0.0,0.0,0.0,undersample,0.8673680092378827,0.8639633537401605,0.8281248026605776,COMPLETE
858,0.5191956124314442,2025-09-23 15:10:41.768405,2025-09-23 15:11:50.306256,0 days 00:01:08.537851,0.0225443525895787,dart,0.9386404548410472,3.6012661384309896,lossguide,0.56927206902686,0.0012684672435755052,7,10,2.1845766180557766,1000,tree,0.6831966057924928,0.8518861089836255,oversample,0.5438867689202369,0.6937331895087506,0.45915997611929854,uniform,0.7409407848089089,0.2329252689314333,0.8446105026102979,0.8384520884520884,0.6831966057924928,0.54,0.5191956124314442,0.8518861089836255,0.8006303705912851,0.7887411459001948,0.9261954261954262,0.9015873015873016,0.38109495295124035,0.3645699614890886,oversample,0.913501850327835,0.910430301952978,0.5438867689202369,COMPLETE
859,0.0,2025-09-23 15:11:50.433699,2025-09-23 15:11:52.210071,0 days 00:00:01.776372,0.035013050803804416,gbtree,0.29011699728336915,2.4537169675974813,lossguide,0.019325405494805912,0.00010809809466946928,10,7,0.5910799551685405,500,,0.43794174505313405,0.6924636627613476,oversample,0.630028901260245,0.6946345738462331,,,,0.41402444519637904,0.7606715119254785,0.7607493857493858,0.43794174505313405,0.0,0.0,0.6924636627613476,0.7690838135042968,0.7622674295671295,0.0,0.0,0.0,0.0,oversample,0.9055624836606273,0.9043542050277183,0.630028901260245,COMPLETE
860,0.6487382575059863,2025-09-23 15:11:52.337903,2025-09-23 15:12:57.850212,0 days 00:01:05.512309,0.0010498398883105786,dart,0.8722347887744761,4.331690739894871,lossguide,33.274419374644204,0.0161155393806676,10,3,10.374996924491647,1000,forest,0.3990568144154887,0.7828764554456693,undersample,0.8638864823648249,0.5377993039535288,0.05754336582463282,weighted,0.7492912190411872,0.2092686482287882,0.7951683898044836,0.8047706797706797,0.3990568144154887,0.6403019953262629,0.6487382575059863,0.7828764554456693,0.7012250884418001,0.6911776152529322,0.5522480620155039,0.5695342820181113,0.7617621899059025,0.7535301668806161,undersample,0.8762508145943536,0.8796444908332813,0.8638864823648249,COMPLETE
861,0.6396582203889216,2025-09-23 15:12:57.979965,2025-09-23 15:12:58.702246,0 days 00:00:00.722281,0.002721428705118548,gbtree,0.8247883661969377,2.510093725692238,depthwise,0.6151600116402164,0.07335324168519738,4,11,0.43759937330151183,500,,0.37918507640284344,0.7304419087218887,undersample,0.9744414894254683,1.7556606518152786,,,,0.4745089644150798,0.7547343638038694,0.7495904995904996,0.37918507640284344,0.6470241602828521,0.6396582203889216,0.7304419087218887,0.7882177993831725,0.7768910586305144,0.4934831460674157,0.4877555605481914,0.9392643284858854,0.9289687633718442,undersample,0.9145985093081614,0.9087104427341152,0.9744414894254683,COMPLETE
862,0.6745425063701644,2025-09-23 15:12:58.830619,2025-09-23 15:14:03.603346,0 days 00:01:04.772727,0.10093191759548,dart,0.5945997403719316,1.9398534844390958,lossguide,17.08550934817899,0.054829485996640406,2,11,56.401256560882075,1000,tree,0.6667369041786233,0.8638166056493781,oversample,0.6301325010567933,0.6778640565976486,0.13348974138297504,weighted,0.39934713526232385,0.31626176221771857,0.8553587880028662,0.8561629811629812,0.6667369041786233,0.680966358094378,0.6745425063701644,0.8638166056493781,0.7784787814948742,0.775106003333832,0.7211860353897657,0.7353535353535353,0.6449957228400343,0.6230209670517758,oversample,0.909565867400098,0.9072564440664699,0.6301325010567933,COMPLETE
863,0.6803774497943382,2025-09-23 15:14:03.732030,2025-09-23 15:15:00.401652,0 days 00:00:56.669622,0.06307087087541535,dart,0.9722139652398933,2.449587557417235,lossguide,0.4160432942596942,0.16779007933563053,6,11,0.38201756767401795,900,tree,0.6624871420865154,0.9910416712249325,none,0.9642440593440491,1.5204814974970688,0.347698762722661,weighted,0.6964852286187011,0.4877771081513064,0.8638550516941345,0.8647624897624898,0.6624871420865154,0.6774975751697381,0.6803774497943382,0.9910416712249325,0.807068203245477,0.8051812652745924,0.7821948488241881,0.7828507795100222,0.5975192472198461,0.6016260162601627,none,0.9175902765090961,0.9165203627473455,0.9642440593440491,COMPLETE
864,0.461690754306078,2025-09-23 15:15:00.531698,2025-09-23 15:15:11.290237,0 days 00:00:10.758539,0.09130813588745114,dart,0.5532016309652008,9.586017122210208,lossguide,0.031546310838695565,0.0007196136950109134,5,10,31.278130916011605,400,tree,0.4961922505553281,0.9564839027504508,undersample,0.8909344221668485,1.163280620945617,0.2096142665001341,weighted,0.26054275925556,0.8294098834469836,0.43893950250793323,0.4432841932841933,0.4961922505553281,0.45984034690056175,0.461690754306078,0.9564839027504508,0.755086548032427,0.7509184137472134,0.29875784351389423,0.3003219575016098,0.9978614200171086,0.9978605049208387,undersample,0.9006998115194722,0.899191201184689,0.8909344221668485,COMPLETE
865,0.3980006248047485,2025-09-23 15:15:11.420249,2025-09-23 15:15:18.222707,0 days 00:00:06.802458,0.00014266004372819047,dart,0.9152851160705047,6.560552593464683,lossguide,0.00044334242589191586,0.0035749571938097917,0,10,36.050665601627706,300,forest,0.6361202045016234,0.5993486144783571,none,0.6466299446952137,1.7680230851406007,0.24160814423893162,uniform,0.719693874703481,0.6718218529853687,0.8078616030299929,0.8027231777231777,0.6361202045016234,0.42228377962449987,0.3980006248047485,0.5993486144783571,0.6511670688868901,0.6454403513452872,0.7530186608122942,0.7372685185185185,0.2934131736526946,0.2725716730851519,none,0.8571450155804661,0.8597765827009141,0.6466299446952137,COMPLETE
866,0.44133497210929373,2025-09-23 15:15:18.350499,2025-09-23 15:15:19.414446,0 days 00:00:01.063947,34.841551089217816,gbtree,0.2709408088157713,2.438034121346846,depthwise,8.505358966823481,0.001496144828498533,5,11,17.97262481998956,800,,0.4992431454219295,0.5774120630433677,oversample,0.8097141183923124,3.7490244396479158,,,,0.5199212111482188,0.3905210359299826,0.3950655200655201,0.4992431454219295,0.4395707831325301,0.44133497210929373,0.5774120630433677,0.6632604897683817,0.6531930775342603,0.28180062756456675,0.283252427184466,0.9987168520102652,0.9987163029525032,oversample,0.8672115369008221,0.8645513333997841,0.8097141183923124,COMPLETE
867,0.5978277497322931,2025-09-23 15:15:19.544094,2025-09-23 15:16:23.156727,0 days 00:01:03.612633,0.0014574965262122248,dart,0.28912720144731896,4.6685725965057046,depthwise,9.5346044689952,0.2678346227358157,1,3,99.55961591312331,1000,forest,0.6822375534100675,0.8135273712236766,undersample,0.6214121395957305,2.484756510483205,0.11096098888564837,weighted,0.11808085074752471,0.5826938823748129,0.7317023236769372,0.7308558558558559,0.6822375534100675,0.6016111871105031,0.5978277497322931,0.8135273712236766,0.6576597962306061,0.6565377805581827,0.4666352275406744,0.46523809523809523,0.8464499572284003,0.8361146769362431,undersample,0.8547585894017375,0.854808238072394,0.6214121395957305,COMPLETE
868,0.5885051268213708,2025-09-23 15:16:23.287338,2025-09-23 15:16:24.109400,0 days 00:00:00.822062,86.73456694217437,gbtree,0.9840749334952705,6.198744286436156,lossguide,16.435785255976814,0.006404575578991343,4,6,10.739191377319374,600,,0.5848641371514086,0.708493035140348,undersample,0.8006373815055421,3.3967245570132607,,,,0.5354039428213857,0.678063261336882,0.6877559377559378,0.5848641371514086,0.5813922534273925,0.5885051268213708,0.708493035140348,0.6689767546698866,0.6598400240352763,0.4220289855072464,0.42975369458128077,0.9341317365269461,0.9332477535301669,undersample,0.8689427189798267,0.8717022163740963,0.8006373815055421,COMPLETE
869,0.0,2025-09-23 15:16:24.239409,2025-09-23 15:16:37.397597,0 days 00:00:13.158188,0.9782906240260966,dart,0.20615239440976174,0.6233553969352157,lossguide,0.007511313047591742,0.00027086240718570873,9,8,11.122862081183738,500,forest,0.37002147939487307,0.8103896022701325,none,0.7774098843161765,0.934145615226809,0.44475019257528103,uniform,0.2207066861582194,0.4409963851391776,0.7606715119254785,0.7607493857493858,0.37002147939487307,0.0,0.0,0.8103896022701325,0.6933618417059548,0.6847918894909915,0.0,0.0,0.0,0.0,none,0.8803060008364378,0.8803022610469609,0.7774098843161765,COMPLETE
870,0.0,2025-09-23 15:16:37.527022,2025-09-23 15:17:37.569728,0 days 00:01:00.042706,42.400590380358665,dart,0.9931008719847163,1.009409932318871,lossguide,0.0061292177893464495,0.0013054249715180168,10,10,2.7776851684370416,1000,tree,0.6187967734780838,0.7340261782518798,none,0.7963497605352907,0.8970260584119095,0.3107113933061537,uniform,0.41240994368512657,0.7547800073086726,0.7606715119254785,0.7607493857493858,0.6187967734780838,0.0,0.0,0.7340261782518798,0.7700742137630717,0.7606850455346137,0.0,0.0,0.0,0.0,none,0.8952736432665553,0.8926738172041431,0.7963497605352907,COMPLETE
871,0.6571966455587883,2025-09-23 15:17:37.698263,2025-09-23 15:17:38.122278,0 days 00:00:00.424015,0.6667774847825201,gbtree,0.34827279233179465,8.3801593874931,lossguide,0.23246653940046436,0.05853652672789825,1,3,0.4030964386565891,500,,0.5093467542657979,0.7292126089568532,undersample,0.8649824513074545,0.8876924435566528,,,,0.34339420188502845,0.7905619817790971,0.7949426699426699,0.5093467542657979,0.654275092936803,0.6571966455587883,0.7292126089568532,0.7089909883859329,0.6983476462589095,0.5407821229050279,0.5476326297775242,0.8280581693755347,0.8215661103979461,undersample,0.8866399216101507,0.8866858222159342,0.8649824513074545,COMPLETE
872,0.5074795371154389,2025-09-23 15:17:38.249446,2025-09-23 15:17:39.350950,0 days 00:00:01.101504,77.97173050496801,gbtree,0.48192864474280894,7.026068017053458,depthwise,0.011703239922510301,0.0015311631474296335,6,12,41.9904409073655,900,,0.41002532453999563,0.6260165246984397,none,0.6764837447276693,0.9937102924789747,,,,0.9189955036324355,0.8205548162555021,0.8213554463554463,0.41002532453999563,0.5107451855986603,0.5074795371154389,0.6260165246984397,0.6549818763013893,0.6493487118660278,0.7349397590361446,0.7454394693200663,0.3913601368691189,0.384681215233205,none,0.8616057003013409,0.8614002495760886,0.6764837447276693,COMPLETE
873,0.0,2025-09-23 15:17:39.481205,2025-09-23 15:17:40.581521,0 days 00:00:01.100316,0.0005100431810945446,gbtree,0.5990857219905059,8.262606229520417,depthwise,0.00014637937139446756,0.0008709967889361883,0,11,2.4681364864548287,600,,0.6946808837472706,0.5708341340643537,undersample,0.7345830571536074,0.5133563684211839,,,,0.6928938055595464,0.7606715119254785,0.7607493857493858,0.6946808837472706,0.0,0.0,0.5708341340643537,0.6944581025951372,0.6949103743442893,0.0,0.0,0.0,0.0,undersample,0.8729150787760658,0.8764714678997713,0.7345830571536074,COMPLETE
874,0.673992673992674,2025-09-23 15:17:40.710549,2025-09-23 15:17:42.343152,0 days 00:00:01.632603,20.745825211491212,gbtree,0.4716210336431151,0.8500644177334638,lossguide,0.007425285530005887,0.012835345651580779,10,7,0.47601667167375344,1000,,0.6835815491395735,0.7571157031507572,undersample,0.9230601577205186,2.551743144444085,,,,0.6945189665656972,0.7930187327259699,0.7995495495495496,0.6835815491395735,0.6687418086500655,0.673992673992674,0.7571157031507572,0.7918607217095652,0.7866518311811252,0.5419543281996814,0.5516489506677569,0.8729683490162532,0.8660676080445014,undersample,0.9100097285099908,0.9092005313525714,0.9230601577205186,COMPLETE
875,0.5566809029896278,2025-09-23 15:17:42.471756,2025-09-23 15:18:44.481833,0 days 00:01:02.010077,0.21747016966795013,dart,0.9559434353163843,2.895881375739293,lossguide,34.02044808140082,0.13826301177081177,2,10,3.375237085520639,1000,forest,0.4058823163807298,0.8625425541849974,undersample,0.8500605892330528,4.98152230233743,0.40450011817604065,uniform,0.547503046662653,0.41789520595821,0.6236052820145358,0.6280712530712531,0.4058823163807298,0.5533827280456699,0.5566809029896278,0.8625425541849974,0.7847366942477578,0.7766668164715568,0.38642917726887194,0.3893820416524411,0.9743370402053037,0.9760376551133932,undersample,0.9058427927581023,0.9040008759520696,0.8500605892330528,COMPLETE
876,0.0,2025-09-23 15:18:44.609179,2025-09-23 15:18:47.469290,0 days 00:00:02.860111,0.0003602428558170915,dart,0.2688227032065733,2.3156576189390297,lossguide,0.00016236847433440772,0.012044464149064934,0,7,0.30127702618140695,200,tree,0.6701896963684042,0.773634143700604,none,0.5207515110958891,2.9214855099840227,0.27207780301888107,uniform,0.05726639153426797,0.3336690244730878,0.7606715119254785,0.7607493857493858,0.6701896963684042,0.0,0.0,0.773634143700604,0.7471382532001087,0.7376821190086043,0.0,0.0,0.0,0.0,none,0.8940812647730665,0.8938346034120095,0.5207515110958891,COMPLETE
877,0.6005973391257128,2025-09-23 15:18:47.597712,2025-09-23 15:18:49.660989,0 days 00:00:02.063277,2.0553449319467965,gbtree,0.6406296940869232,3.566064283426095,lossguide,0.02289737226863745,0.0006373311722486254,6,8,2.7726885181402134,400,,0.5329430846327308,0.6761856760277645,oversample,0.9646636286905095,1.3736716544865981,,,,0.2855222118940902,0.693213225509264,0.6988124488124489,0.5329430846327308,0.596906523201076,0.6005973391257128,0.6761856760277645,0.7116622732247617,0.704850659315579,0.43535412988032174,0.439848876516206,0.9491017964071856,0.9465126230209671,oversample,0.8873892160312861,0.8877060196137945,0.9646636286905095,COMPLETE
878,0.6292825768667643,2025-09-23 15:18:49.790465,2025-09-23 15:19:42.337830,0 days 00:00:52.547365,0.0009616088329073463,dart,0.7186558412048245,2.8698435324308367,depthwise,3.5798935065675304,0.3168866414030125,9,3,33.263904476490794,900,forest,0.3429392547601136,0.9235753505609474,undersample,0.8660381990574106,0.8719259288072148,0.24770476727764762,weighted,0.6770398612244781,0.9138389056923073,0.7346708977377419,0.7407862407862408,0.3429392547601136,0.625974025974026,0.6292825768667643,0.9235753505609474,0.7767137598524673,0.7697050833806444,0.4723432055749129,0.4782995771199644,0.927715996578272,0.9195549850235345,undersample,0.9043766955966376,0.9032191008224172,0.8660381990574106,COMPLETE
879,0.38612143742255267,2025-09-23 15:19:42.469488,2025-09-23 15:19:43.089848,0 days 00:00:00.620360,38.973166889582224,gbtree,0.7078344892590012,3.7082496472437274,depthwise,0.03597426105720277,0.00021960477508873067,7,5,24.621695036018988,400,,0.3243777092087988,0.7539928681016621,oversample,0.7283891708390581,2.3413021428086185,,,,0.3642111752424502,0.23932848807452145,0.23925061425061425,0.3243777092087988,0.3862228462872718,0.38612143742255267,0.7539928681016621,0.7048339144118467,0.7022793988473701,0.23932848807452145,0.23925061425061425,1.0,1.0,oversample,0.8849114735521172,0.8840816613975373,0.7283891708390581,COMPLETE
880,0.6369559551733125,2025-09-23 15:19:43.218771,2025-09-23 15:20:18.913293,0 days 00:00:35.694522,0.06038832177536373,dart,0.8085629364277556,2.868003227671948,depthwise,0.00021171548785493412,0.03326040984804427,0,12,22.24560195581954,800,tree,0.5082721675414901,0.9522030878183914,none,0.9796999927505924,0.6934593721381793,0.4805485036824761,weighted,0.45332310991769464,0.20494547499957827,0.8588391851776026,0.8573914823914824,0.5082721675414901,0.6424682395644283,0.6369559551733125,0.9522030878183914,0.7931900202110524,0.789599201474438,0.815668202764977,0.8146666666666667,0.5299401197604791,0.5228925973470261,none,0.9132179726135135,0.9123734679116334,0.9796999927505924,COMPLETE
881,0.0,2025-09-23 15:20:19.041801,2025-09-23 15:20:20.433611,0 days 00:00:01.391810,0.005183562129582619,gbtree,0.7234569735035652,5.905696149167763,depthwise,0.00037169626949914373,0.00011239402177593275,5,11,11.735868155616394,600,,0.5616509866176618,0.8350157348810501,oversample,0.6068257957372243,0.5842588074987933,,,,0.8670291222709412,0.7606715119254785,0.7607493857493858,0.5616509866176618,0.0,0.0,0.8350157348810501,0.7801846765057012,0.7745535001030929,0.0,0.0,0.0,0.0,oversample,0.9032830008706274,0.9003093184151992,0.6068257957372243,COMPLETE
882,0.0,2025-09-23 15:20:20.562664,2025-09-23 15:20:22.781253,0 days 00:00:02.218589,0.5625929055186694,dart,0.20286925481088336,5.823359893495901,lossguide,0.013911904071102245,0.003722081287406505,4,11,51.637662481627146,200,tree,0.3602718069616702,0.8083579607791841,none,0.5085093059592896,0.7782537771355149,0.4157906577204433,uniform,0.2640033818651538,0.26989668442904313,0.7606715119254785,0.7607493857493858,0.3602718069616702,0.0,0.0,0.8083579607791841,0.6000192916971209,0.5953504305948225,0.0,0.0,0.0,0.0,none,0.8359753760832911,0.8338393724332034,0.5085093059592896,COMPLETE
