number,value,datetime_start,datetime_complete,duration,params_alpha,params_booster,params_colsample_bytree,params_gamma,params_grow_policy,params_lambda,params_learning_rate,params_max_delta_step,params_max_depth,params_min_child_weight,params_n_estimators,params_normalize_type,params_params_decision_threshold,params_params_feature_fraction,params_params_resampling,params_params_sample_rows,params_params_scale_pos_weight,params_rate_drop,params_sample_type,params_skip_drop,params_subsample,user_attrs_acc_test,user_attrs_acc_val,user_attrs_decision_threshold,user_attrs_f1_test,user_attrs_f1_val,user_attrs_feature_fraction,user_attrs_pr_auc_test,user_attrs_pr_auc_val,user_attrs_prec_test,user_attrs_prec_val,user_attrs_rec_test,user_attrs_rec_val,user_attrs_resampling_strategy,user_attrs_roc_auc_test,user_attrs_roc_auc_val,user_attrs_sample_rows,state
1620,0.7134581105169341,2025-09-23 21:28:37.039688,2025-09-23 21:29:01.806712,0 days 00:00:24.767024,0.00020109908468737055,dart,0.6739876629615533,6.279505521778668,lossguide,0.0007149597584203737,0.18755023922467365,4,11,0.1663131290075682,600,tree,0.6860005275188522,0.8821459600263039,none,0.9997183126771019,2.7056129166147134,0.20921783956630746,uniform,0.46811409632766926,0.5371897305150799,0.8677449073600164,0.8683456183456183,0.6860005275188522,0.7126334519572953,0.7134581105169341,0.8821459600263039,0.8229296301025066,0.8188126890746599,0.742354031510658,0.7443049744304975,0.6852010265183918,0.685066324347454,none,0.9258777272146981,0.9241822081650687,0.9997183126771019,COMPLETE
1621,0.6923716137610104,2025-09-23 21:29:01.941012,2025-09-23 21:29:38.678728,0 days 00:00:36.737716,0.016941737725366345,dart,0.7189997868629016,7.975625856011708,depthwise,0.024743991398195945,0.011324889293311706,4,12,1.5729230346497929,700,forest,0.5946563127771454,0.9573035135393944,oversample,0.9986581346711675,2.4832541680441516,0.18564445346459035,uniform,0.5726880914125184,0.5327297976480353,0.8063261336881974,0.8105036855036855,0.5946563127771454,0.6893267651888342,0.6923716137610104,0.9573035135393944,0.8246830880731035,0.8186899948375896,0.5594349680170576,0.5660326086956522,0.897775876817793,0.8913136499786051,oversample,0.9264590664106932,0.9249929763177962,0.9986581346711675,COMPLETE
1622,0.6459515984463698,2025-09-23 21:29:38.815950,2025-09-23 21:29:42.885450,0 days 00:00:04.069500,18.05423048261539,dart,0.7690756680266587,5.511567112321607,lossguide,0.030536785992079585,0.01071395290034292,4,12,0.9647514133360693,200,forest,0.6352061308171237,0.8379714764820861,oversample,0.9060095755587607,3.411184216089274,0.23610775550434374,uniform,0.4422534318098925,0.628999743874787,0.7525847067253557,0.7573710073710074,0.6352061308171237,0.6430364791020529,0.6459515984463698,0.8379714764820861,0.7940487781702634,0.7869354611226029,0.4910895556056846,0.4962129905898554,0.9311377245508982,0.9251176722293539,oversample,0.9156680295329521,0.9121841639129054,0.9060095755587607,COMPLETE
1623,0.6783205358601536,2025-09-23 21:29:43.022891,2025-09-23 21:29:49.859199,0 days 00:00:06.836308,0.0888402167244044,dart,0.8609813837182065,4.911685768844614,lossguide,0.1263359695007448,0.44461450000978364,9,6,0.17567002121164874,300,forest,0.48514878226865543,0.9857716264218793,oversample,0.8667282820323752,1.3420159427279699,0.17167157945810502,uniform,0.5576631394083468,0.3553777603214307,0.7915856280069608,0.7984234234234234,0.48514878226865543,0.6715069377218458,0.6783205358601536,0.9857716264218793,0.8085982618680754,0.8017038552165745,0.5391191709844559,0.5486257928118393,0.8900769888793841,0.8883183568677792,oversample,0.9163966317322102,0.9153487221505026,0.8667282820323752,COMPLETE
1624,0.6898016997167139,2025-09-23 21:29:49.994825,2025-09-23 21:29:50.617820,0 days 00:00:00.622995,0.000927907714588819,gbtree,0.8255814960134863,6.792403940772967,depthwise,68.41099405623066,0.3021638284568221,1,4,1.4752028542990274,400,,0.6170009650109847,0.9774673575917294,none,0.9740587766906689,1.6281795980999458,,,,0.8207514437916523,0.8662094380182209,0.8654791154791155,0.6170009650109847,0.6954089955721278,0.6898016997167139,0.9774673575917294,0.8116427232996022,0.8058193705516457,0.763952892985151,0.7693522906793049,0.6381522668947819,0.6251604621309371,none,0.9199084385010474,0.9192833949672603,0.9740587766906689,COMPLETE
1625,0.6800778715120052,2025-09-23 21:29:50.755070,2025-09-23 21:29:57.426684,0 days 00:00:06.671614,0.055864014560854325,dart,0.482557986146792,6.404027326495243,depthwise,0.016131249680989213,0.05729622549509912,3,12,19.91165043908357,300,forest,0.6848655577938255,0.9623052129959598,undersample,0.9302835665600914,3.0784458230450142,0.1363648922234611,uniform,0.4685767720638915,0.7989379421232038,0.7875934077182926,0.7981162981162981,0.6848655577938255,0.6701637259577173,0.6800778715120052,0.9623052129959598,0.8087976927535657,0.7996325936510853,0.5332658740197318,0.5476874836686699,0.9016253207869974,0.8968763371844245,undersample,0.9199067117509603,0.9171333622054322,0.9302835665600914,COMPLETE
1626,0.6701658618517741,2025-09-23 21:29:57.564503,2025-09-23 21:30:23.201484,0 days 00:00:25.636981,0.007275177958506271,dart,0.808979200168479,6.526854758756387,depthwise,0.003191525138055812,0.016287792455184108,1,11,0.41540419416988617,600,forest,0.67313304406079,0.8653007051345447,none,0.9647108297531439,3.069423517120392,0.25107786544981536,uniform,0.6329286953244349,0.5693342999115972,0.8373426143924659,0.8391687141687142,0.67313304406079,0.6683364642037153,0.6701658618517741,0.8653007051345447,0.7404194956987805,0.7415055779988503,0.6526701997554015,0.6578730420445177,0.6847733105218136,0.6829268292682927,none,0.8936430443801249,0.8966673686030147,0.9647108297531439,COMPLETE
1627,0.7060708563290012,2025-09-23 21:30:23.339047,2025-09-23 21:31:23.114411,0 days 00:00:59.775364,0.04317519349552911,dart,0.8449781552454126,7.844561975503417,depthwise,0.03083099916353486,0.009450027140013355,2,12,0.8830329931438416,900,forest,0.5733414849860355,0.989507612500185,none,0.8786458291247554,4.7492967653812075,0.1342203039063407,weighted,0.7682596399911635,0.30824155306868983,0.8276179752277613,0.8309787059787059,0.5733414849860355,0.7041461700632466,0.7060708563290012,0.989507612500185,0.8237288668351592,0.8173939381396877,0.5974955277280859,0.6045731707317074,0.8571428571428571,0.8485237483953787,none,0.9260977439549644,0.9238940054232789,0.8786458291247554,COMPLETE
1628,0.7069320521619766,2025-09-23 21:31:23.254332,2025-09-23 21:31:34.740657,0 days 00:00:11.486325,0.0017583472965506254,dart,0.986053050747113,8.563397626620102,lossguide,0.0003496253828223241,0.031206237371956894,7,4,0.3853544656385424,400,forest,0.6068966730606065,0.9052474300908367,none,0.998256778408936,1.8813329529220124,0.21851405553097725,weighted,0.8692082986091828,0.421493529056504,0.8694851059473846,0.8688574938574939,0.6068966730606065,0.711864406779661,0.7069320521619766,0.9052474300908367,0.8205711872134982,0.8136985800095353,0.7546717776712986,0.7595870206489675,0.6736526946107785,0.6611039794608472,none,0.923874438101132,0.9228652569550578,0.998256778408936,COMPLETE
1629,0.6575406032482599,2025-09-23 21:31:34.877525,2025-09-23 21:31:38.225810,0 days 00:00:03.348285,0.04626823481162312,dart,0.9467732925060391,5.875812370731815,lossguide,0.33219654712523355,0.28011464476634274,6,8,0.11060646782174555,200,forest,0.5011201244968648,0.9302873431151006,none,0.9902453838473171,1.048652974042228,0.14027322033322748,uniform,0.5784459885570089,0.42653271536640364,0.8479885351622479,0.8488943488943489,0.5011201244968648,0.660726525017135,0.6575406032482599,0.9302873431151006,0.7516548766413047,0.7487071326749373,0.7091711623344776,0.7181956411556006,0.6184773310521814,0.6063329054343175,none,0.900492716625691,0.9012497634059908,0.9902453838473171,COMPLETE
1630,0.7119418483904465,2025-09-23 21:31:38.362341,2025-09-23 21:31:39.269807,0 days 00:00:00.907466,0.0027511832609396145,gbtree,0.408579494901966,2.5053784022056638,lossguide,0.00010787633842092406,0.2591575217192353,8,9,1.393490541820891,600,,0.42699865370016227,0.9204556077043323,none,0.6399299236400693,1.1990693537424753,,,,0.6397666539087605,0.8563824342307299,0.858005733005733,0.42699865370016227,0.7104231166150671,0.7119418483904465,0.9204556077043323,0.8108193611548361,0.8138165825063204,0.686477861986438,0.6916868442292171,0.7360992301112061,0.7334189131364998,none,0.9205133190565636,0.9204887215988578,0.6399299236400693,COMPLETE
1631,0.6888994759409243,2025-09-23 21:31:39.407411,2025-09-23 21:31:40.845188,0 days 00:00:01.437777,0.014466066224456977,gbtree,0.8316047551688394,4.831302188461107,lossguide,0.004731757027166155,0.007213095624372748,8,8,0.10341457600239137,300,,0.35567749263014986,0.9726380463406027,none,0.9516296800177497,0.6627685675458905,,,,0.4663693788574913,0.8662094380182209,0.8662981162981163,0.35567749263014986,0.6907972557369293,0.6888994759409243,0.9726380463406027,0.813885039262047,0.8072670197483665,0.7728957120169402,0.7770016120365395,0.6244653550042771,0.6187419768934531,none,0.9187958646407514,0.9169831858316884,0.9516296800177497,COMPLETE
1632,0.7076923076923077,2025-09-23 21:31:40.981511,2025-09-23 21:31:41.769050,0 days 00:00:00.787539,0.0001341959233298887,gbtree,0.6804375070540729,7.594610908480169,depthwise,0.0077616387716949705,0.3202273930474766,2,11,0.1358067218283877,700,,0.6385578416223769,0.8979596365395437,none,0.7813899131176741,2.3515312297021356,,,,0.4281705387787244,0.8590439144231754,0.85995085995086,0.6385578416223769,0.7058320871608631,0.7076923076923077,0.8979596365395437,0.8103895430600434,0.80245922027677,0.7050789586000854,0.706786171574904,0.7065868263473054,0.7086007702182285,none,0.9186233623070483,0.9165197005432434,0.7813899131176741,COMPLETE
1633,0.6944444444444444,2025-09-23 21:31:41.907662,2025-09-23 21:31:49.646779,0 days 00:00:07.739117,0.00045078439397970734,gbtree,0.8713453872442519,0.04672401658901704,lossguide,0.0009780167923159268,0.030239878163318315,1,12,0.39273955233045577,500,,0.6617405371560638,0.7896981569323827,oversample,0.8882977623990624,4.170318965493508,,,,0.6361980089219004,0.8185075237997748,0.8198198198198198,0.6617405371560638,0.694152147662584,0.6944444444444444,0.7896981569323827,0.8152688115551462,0.8103778181412244,0.5816710031801099,0.5842827928717499,0.8605645851154833,0.8557980316645272,oversample,0.9199285551395623,0.9181904127011439,0.8882977623990624,COMPLETE
1634,0.7162135732446705,2025-09-23 21:31:49.783357,2025-09-23 21:31:50.545576,0 days 00:00:00.762219,0.0005198156422350222,gbtree,0.8864265719507709,4.9619407536611195,depthwise,0.005256610641343493,0.03619612583349114,1,8,6.14919018476976,200,,0.6948543399999703,0.9995031608746203,none,0.9433280552598536,4.650411282473716,,,,0.8353843128432397,0.8532091309243526,0.8514537264537264,0.6948543399999703,0.7216614906832298,0.7162135732446705,0.9995031608746203,0.8258094274790834,0.8179465999290254,0.6606254442075338,0.6595821325648416,0.7951240376390077,0.7834830979888746,none,0.9265089407090429,0.9243434692596507,0.9433280552598536,COMPLETE
1635,0.7081232492997199,2025-09-23 21:31:50.681779,2025-09-23 21:31:51.597600,0 days 00:00:00.915821,0.00028970969895700005,gbtree,0.6538633886855265,7.551435218463373,depthwise,5.505922712172347,0.09812341269305618,0,12,1.2817238289688822,1000,,0.5711844418275697,0.7597822871728563,none,0.7992659180802935,3.3758016111126903,,,,0.6659046595913457,0.8382638959975433,0.839987714987715,0.5711844418275697,0.7079482439926063,0.7081232492997199,0.7597822871728563,0.8177988173682859,0.8143426947782729,0.6233723958333334,0.6282306163021869,0.8190761334473909,0.8112965340179717,none,0.9225224791204256,0.9220949120440357,0.7992659180802935,COMPLETE
1636,0.7074235807860262,2025-09-23 21:31:51.735594,2025-09-23 21:31:55.866468,0 days 00:00:04.130874,0.0001093184834229891,dart,0.9750688362568313,6.156884995839661,lossguide,0.0013505323983943863,0.1639444363891859,3,11,0.1833432585957397,200,forest,0.6194414767169817,0.8605683524675863,none,0.9961217241735882,4.057968291784937,0.20219961248273258,uniform,0.6140445728869482,0.3734161786219302,0.8418466577950661,0.8422399672399672,0.6194414767169817,0.7075525269733106,0.7074235807860262,0.8605683524675863,0.8149793250010431,0.8103917496083091,0.6346349745331069,0.6358361774744027,0.7994011976047904,0.7971758664955071,none,0.9204166786100215,0.9189392791660742,0.9961217241735882,COMPLETE
1637,0.7162489894907034,2025-09-23 21:31:56.000969,2025-09-23 21:32:54.861306,0 days 00:00:58.860337,0.001216339691880827,dart,0.22729949484098572,1.5002344553120208,lossguide,0.0009462498353737387,0.013190745716243147,6,10,1.4250897146285566,900,tree,0.3838822714483779,0.9446419050693574,none,0.9145479177766047,1.14454055064127,0.48446039952431236,weighted,0.8870142830793737,0.23793861841984223,0.8572013512130208,0.8562653562653563,0.3838822714483779,0.7203848466626579,0.7162489894907034,0.9446419050693574,0.8219861196049776,0.8180721933633566,0.6778574122972463,0.6786671773266948,0.7686056458511549,0.7582370560547711,none,0.925245938136991,0.9243861382370064,0.9145479177766047,COMPLETE
1638,0.6666666666666666,2025-09-23 21:32:54.997545,2025-09-23 21:33:27.440936,0 days 00:00:32.443391,0.0002818961576845999,dart,0.9104696617609443,9.430433573729394,depthwise,0.23331420092301264,0.22516171112008385,2,12,3.359753941612232,700,forest,0.6996247564772643,0.8398280934686281,undersample,0.9081064556953774,4.966215437647949,0.07694002056973737,weighted,0.8963293214094149,0.9469775428651525,0.7782782270447334,0.7785626535626535,0.6996247564772643,0.6672811059907834,0.6666666666666666,0.8398280934686281,0.8156690456227537,0.8093788458796218,0.5206136145733461,0.5209537572254336,0.9289991445680068,0.9255455712451861,undersample,0.9231971491586296,0.9218083216252768,0.9081064556953774,COMPLETE
1639,0.7014595311808934,2025-09-23 21:33:27.577168,2025-09-23 21:34:12.818124,0 days 00:00:45.240956,0.0004581437520731366,dart,0.830813150626078,5.223043720090203,depthwise,0.00011794821352177337,0.04403359243899045,0,12,0.1175552469369125,800,tree,0.6802052039463999,0.905175934353493,none,0.9944802174952414,2.8267520818360548,0.13357194358240015,uniform,0.5648533446367837,0.9659864501023411,0.8647763332992118,0.8617936117936118,0.6802052039463999,0.7087100330760749,0.7014595311808934,0.905175934353493,0.8073010240382483,0.7962428148627658,0.7314519799726901,0.7258581235697941,0.6873396065012831,0.6786478391099701,none,0.9205335220325828,0.9161004677637027,0.9944802174952414,COMPLETE
1640,0.7003281079110463,2025-09-23 21:34:12.953237,2025-09-23 21:34:13.561145,0 days 00:00:00.607908,0.00010732528114917762,gbtree,0.8256704728454578,3.998031060534969,depthwise,0.0047662457435617474,0.2451523161117036,7,12,1.5224583456613678,200,,0.6484961761570408,0.8762500576336829,oversample,0.7027451978826345,2.7618429902804156,,,,0.904527373230159,0.8285392568328386,0.8316953316953317,0.6484961761570408,0.6951774340309372,0.7003281079110463,0.8762500576336829,0.8111001652943076,0.8076468525100284,0.6050047513462148,0.610034931724357,0.8169375534644996,0.8219940094137783,oversample,0.917960865856959,0.9177904990064923,0.7027451978826345,COMPLETE
1641,0.7147618114095275,2025-09-23 21:34:13.700003,2025-09-23 21:34:31.998361,0 days 00:00:18.298358,0.00019578311795028755,dart,0.8118362662016592,7.778694439818392,depthwise,0.0001204851252976146,0.02124997658923496,3,8,0.232986639038622,500,tree,0.6356447699600253,0.9863376335673699,none,0.8908535865906286,3.4939544710089785,0.16259769086728873,uniform,0.711763960456203,0.5929460104886207,0.8526973078104207,0.851044226044226,0.6356447699600253,0.7197663096397273,0.7147618114095275,0.9863376335673699,0.8273549490266738,0.8192197405700015,0.660707901322846,0.6595513748191028,0.7904191616766467,0.7800599058622165,none,0.9276805406431499,0.9247941999212611,0.8908535865906286,COMPLETE
1642,0.5999731795628269,2025-09-23 21:34:32.135883,2025-09-23 21:34:35.460782,0 days 00:00:03.324899,0.0008077483979148303,dart,0.879365713852003,9.555961128520057,depthwise,0.005620546115715551,0.004268617852613956,1,7,0.42288532447041793,200,forest,0.6669197181483478,0.9980126890872533,undersample,0.814319559213827,4.980666804737169,0.14579730003392616,uniform,0.4211338966188227,0.8316162486418204,0.6866618896509367,0.6946150696150696,0.6669197181483478,0.5939779811646106,0.5999731795628269,0.9980126890872533,0.7608810571574443,0.754663970843518,0.43049413574312634,0.4369140625,0.957656116338751,0.9572100984167736,undersample,0.903264697319704,0.902869687388415,0.814319559213827,COMPLETE
1643,0.6701414743112435,2025-09-23 21:34:35.597129,2025-09-23 21:34:36.377751,0 days 00:00:00.780622,0.01966251528223376,gbtree,0.5172529232213431,2.3639718617224097,depthwise,0.04675957057305233,0.1683188023588345,1,11,0.29374919483481193,400,,0.5934258201096579,0.8778568350710645,none,0.9809532451628385,1.1347380579784667,,,,0.6557828511207541,0.8661070733954346,0.8639434889434889,0.5934258201096579,0.6773556980759744,0.6701414743112435,0.8778568350710645,0.8118644377317698,0.8080308605810851,0.8001165501165501,0.7978723404255319,0.5872540633019675,0.5776636713735558,none,0.9192620871642723,0.9179647162682877,0.9809532451628385,COMPLETE
1644,0.6969478490747416,2025-09-23 21:34:36.514173,2025-09-23 21:34:48.367174,0 days 00:00:11.853001,0.04699893682393345,dart,0.8713540683873949,6.151738829494777,depthwise,0.00012244938137402023,0.04061188272729279,6,12,0.19365533741982205,400,forest,0.6956580566024758,0.9801258848008922,none,0.9682737722385661,2.148498575898012,0.17287287805054816,uniform,0.6129751440136636,0.4390617500464832,0.8710205752891801,0.8709049959049959,0.6956580566024758,0.6988527724665392,0.6969478490747416,0.9801258848008922,0.8270683470280162,0.8211872452711548,0.7919826652221018,0.7949561403508771,0.6253207869974337,0.6204535729567822,none,0.9273552209267375,0.9259323560237281,0.9682737722385661,COMPLETE
1645,0.698576512455516,2025-09-23 21:34:48.501596,2025-09-23 21:34:55.770925,0 days 00:00:07.269329,0.0002800792637167245,dart,0.9648620047406559,4.544249898721249,depthwise,0.00011779811262191147,0.0056780147034536255,2,9,0.18093296439811152,300,forest,0.6631837612371707,0.9558356298397397,oversample,0.8899866316076632,1.866298495308369,0.19487016983372557,weighted,0.7056011178248659,0.7051447255592392,0.8245470365441704,0.8265765765765766,0.6631837612371707,0.7000350017500875,0.698576512455516,0.9558356298397397,0.8123543802009567,0.8014805285257702,0.5924170616113744,0.5979287237282973,0.8554319931565441,0.8399657680787335,oversample,0.9202169799624467,0.916201497076484,0.8899866316076632,COMPLETE
1646,0.6664951106536284,2025-09-23 21:34:55.906517,2025-09-23 21:34:56.693889,0 days 00:00:00.787372,0.0014157940277396766,gbtree,0.6009372148499433,1.6769507396257404,lossguide,0.00016048203593879275,0.06785003151624472,9,8,7.44113190342419,200,,0.43751419416751863,0.9706226246998713,none,0.90438505110158,0.5145805903012486,,,,0.9613892770893421,0.8684614597195209,0.8673218673218673,0.43751419416751863,0.670428314952552,0.6664951106536284,0.9706226246998713,0.8247775301910918,0.8174081805065968,0.8372837924407431,0.8360232408005165,0.5590248075278016,0.5541292255027813,none,0.9252777966760981,0.9229143752245375,0.90438505110158,COMPLETE
1647,0.6649274417087885,2025-09-23 21:34:56.829085,2025-09-23 21:34:57.878023,0 days 00:00:01.048938,0.00035377232767344857,gbtree,0.7823568665166507,3.5357969591016616,depthwise,0.0010729735820083754,0.06069198471338794,4,11,0.16197160564909346,500,,0.6955722020614933,0.9058761237731864,undersample,0.8278673382863616,4.536194977219884,,,,0.43925163465219236,0.792199815743679,0.7896191646191646,0.6955722020614933,0.6714146973130463,0.6649274417087885,0.9058761237731864,0.8002171392434059,0.7878146315138328,0.5401041666666667,0.5371443624868283,0.8870829769033362,0.8724860932819855,undersample,0.914121983842454,0.9081534427098729,0.8278673382863616,COMPLETE
1648,0.6910032972209138,2025-09-23 21:34:58.013249,2025-09-23 21:34:58.739131,0 days 00:00:00.725882,0.0025893643371832395,gbtree,0.944356484286791,5.6377441302096765,depthwise,10.669014289789672,0.023395081284075324,0,7,1.9527895719372543,200,,0.6389947817409758,0.9090565628406522,none,0.8233753826038356,2.092187855085849,,,,0.8492582891682976,0.8687685535878801,0.8656838656838657,0.6389947817409758,0.7010261194029851,0.6910032972209138,0.9090565628406522,0.814617177575383,0.8082255185682743,0.7707692307692308,0.7684651650078576,0.6428571428571429,0.6277278562259306,none,0.920905636676356,0.9197226954102402,0.8233753826038356,COMPLETE
1649,0.7176420333190944,2025-09-23 21:34:58.873332,2025-09-23 21:35:49.309345,0 days 00:00:50.436013,0.0022532158001960056,dart,0.30782680675170127,4.915604169742203,depthwise,0.0002498676124980561,0.050648387024009596,9,8,0.41865867935025697,900,forest,0.5064520889574151,0.938525428769374,none,0.9379411578039312,1.5829431810500871,0.25177756664978523,uniform,0.40862262482398504,0.6259276047454271,0.8670283550005118,0.8646601146601146,0.5064520889574151,0.7226137091607944,0.7176420333190944,0.938525428769374,0.8215529275801932,0.8140265149929417,0.7215351812366738,0.7164179104477612,0.7236954662104362,0.7188703465982028,none,0.9246718800705298,0.9229413240523411,0.9379411578039312,COMPLETE
1650,0.6868592730661697,2025-09-23 21:35:49.446475,2025-09-23 21:35:50.473951,0 days 00:00:01.027476,0.019483818544283917,gbtree,0.7327496061291049,2.3532777648331398,depthwise,0.00016607173756335908,0.02882830251688047,0,12,1.149659232204842,400,,0.6133398542383365,0.7380181466216924,none,0.8813258973541573,1.8254927568867014,,,,0.6280120773767295,0.8626266762206981,0.8624078624078624,0.6133398542383365,0.6900692840646652,0.6868592730661697,0.7380181466216924,0.8033939619916277,0.8009195252720196,0.75,0.7539641943734016,0.6390076988879384,0.6307231493367566,none,0.9137346737979142,0.9142015831054344,0.8813258973541573,COMPLETE
