number,value,datetime_start,datetime_complete,duration,params_alpha,params_booster,params_colsample_bytree,params_gamma,params_grow_policy,params_lambda,params_learning_rate,params_max_delta_step,params_max_depth,params_min_child_weight,params_n_estimators,params_normalize_type,params_params_decision_threshold,params_params_feature_fraction,params_params_resampling,params_params_sample_rows,params_params_scale_pos_weight,params_rate_drop,params_sample_type,params_skip_drop,params_subsample,user_attrs_acc_test,user_attrs_acc_val,user_attrs_decision_threshold,user_attrs_f1_test,user_attrs_f1_val,user_attrs_feature_fraction,user_attrs_pr_auc_test,user_attrs_pr_auc_val,user_attrs_prec_test,user_attrs_prec_val,user_attrs_rec_test,user_attrs_rec_val,user_attrs_resampling_strategy,user_attrs_roc_auc_test,user_attrs_roc_auc_val,user_attrs_sample_rows,state
2637,0.5659076923076923,2025-09-24 02:03:32.102195,2025-09-24 02:03:34.425054,0 days 00:00:02.322859,7.071052843958723,gbtree,0.3626952528348153,6.703581246772146,lossguide,75.34816815400742,0.01709648036389942,9,12,0.10829667522285033,800,,0.3417435662853502,0.8385585298109581,oversample,0.7063786114825015,4.999224849258087,,,,0.803600343569512,0.6355819428805405,0.6389230139230139,0.3417435662853502,0.5644727183753364,0.5659076923076923,0.8385585298109581,0.8123282668975862,0.8040560625040972,0.3953050034270048,0.39720110573600553,0.9867408041060736,0.983739837398374,oversample,0.922104375365999,0.9192068959977362,0.7063786114825015,COMPLETE
2638,0.6790153546185718,2025-09-24 02:03:34.575971,2025-09-24 02:04:28.805765,0 days 00:00:54.229794,0.0003306872417455427,dart,0.6590577117040919,5.421902705964569,depthwise,0.00037546010581589385,0.1799236760031368,3,12,4.188162027655486,900,forest,0.6839439254550401,0.7879518306249876,none,0.9551286308447643,1.870163805321902,0.003953988883785592,weighted,0.7239172366460094,0.5006302020412288,0.8680520012283754,0.8651719901719902,0.6839439254550401,0.6878178735771373,0.6790153546185718,0.7879518306249876,0.8139627440483017,0.8101322442431723,0.7928531546621999,0.788788221970555,0.6073567151411463,0.5960633290543432,none,0.9203711211868897,0.9194533798810991,0.9551286308447643,COMPLETE
2639,0.6240659623808297,2025-09-24 02:04:28.953957,2025-09-24 02:04:48.172588,0 days 00:00:19.218631,0.010272047233106209,dart,0.48819556201008335,1.306246293206716,depthwise,0.0004600615820316456,0.001991582029021274,8,8,3.312776876048893,500,forest,0.6906964651658367,0.9248530695616383,none,0.9327040051259362,3.8799552378200723,0.07225260891701446,weighted,0.5592018641129978,0.407398950225418,0.8518783908281298,0.8506347256347256,0.6906964651658367,0.6292595439405585,0.6240659623808297,0.9248530695616383,0.7769457487242426,0.7651210122718093,0.7846645367412141,0.7843264248704663,0.525235243798118,0.5181857081728712,none,0.9099861583713018,0.9062110829127329,0.9327040051259362,COMPLETE
2640,0.6271554847123605,2025-09-24 02:04:48.321743,2025-09-24 02:04:49.104282,0 days 00:00:00.782539,11.787814446213288,gbtree,0.7860031344217423,4.012679866558756,depthwise,93.80264735955882,0.011901002626848668,8,9,72.61030437308085,200,,0.4022843595295687,0.9431460726096341,oversample,0.5230876696256679,1.1057412368334723,,,,0.5211470727756067,0.7289384788617054,0.7365888615888616,0.4022843595295687,0.6222539229671897,0.6271554847123605,0.9431460726096341,0.752830837404209,0.7425564473422342,0.4668236301369863,0.4741454864154251,0.9328485885372113,0.9259734702610184,oversample,0.9002107383364651,0.8979271399283909,0.5230876696256679,COMPLETE
2641,0.38612143742255267,2025-09-24 02:04:49.260215,2025-09-24 02:05:06.246619,0 days 00:00:16.986404,32.59623610875807,dart,0.20711805474979184,4.304615918982877,lossguide,0.03644082476307103,0.0004061639864336226,7,10,0.15674866477004384,500,forest,0.45884521103878845,0.5104511065801149,undersample,0.630287604081669,4.20838109971716,0.053574687667169635,weighted,0.6815374225342011,0.23355318459278346,0.23932848807452145,0.23925061425061425,0.45884521103878845,0.3862228462872718,0.38612143742255267,0.5104511065801149,0.6680167719181948,0.6664656494533262,0.23932848807452145,0.23925061425061425,1.0,1.0,undersample,0.8523096260906873,0.8521063013787608,0.630287604081669,COMPLETE
2642,0.6921872281190187,2025-09-24 02:05:06.397007,2025-09-24 02:05:08.362184,0 days 00:00:01.965177,0.0002491499397748906,gbtree,0.40457726594034027,2.540745380064756,lossguide,0.0010531871197934526,0.02389941486594339,5,7,0.18148016204799933,600,,0.42436372299070263,0.9096867647334979,none,0.9502936248813819,2.501297842843644,,,,0.23461350472394085,0.8227044733340158,0.8188984438984439,0.42436372299070263,0.7013793103448276,0.6921872281190187,0.9096867647334979,0.8073218189856414,0.7951437734107143,0.587521663778163,0.5832844574780058,0.8699743370402053,0.8510911424903723,none,0.9211526194971495,0.9161579067716819,0.9502936248813819,COMPLETE
2643,0.38612143742255267,2025-09-24 02:05:08.515645,2025-09-24 02:05:28.220635,0 days 00:00:19.704990,0.0006196909589208637,dart,0.49829683107305867,8.721254837177122,lossguide,0.5583009670980765,0.0002040328218914823,1,10,3.2862344216587585,500,forest,0.4585314392386007,0.7802990371679835,oversample,0.9639119956524158,2.618809021482151,0.06943696717302267,weighted,0.5959265676243952,0.2788009064997208,0.23932848807452145,0.23925061425061425,0.4585314392386007,0.3862228462872718,0.38612143742255267,0.7802990371679835,0.7319065555169878,0.724818228128076,0.23932848807452145,0.23925061425061425,1.0,1.0,oversample,0.8929749647714202,0.8938344882460787,0.9639119956524158,COMPLETE
2644,0.7121130792628377,2025-09-24 02:05:28.372841,2025-09-24 02:05:29.610443,0 days 00:00:01.237602,0.014582888959576087,gbtree,0.905142558899877,3.7788191745894837,lossguide,0.041448022991315336,0.07116573007387575,8,7,0.13822496095839562,500,,0.3667675842008921,0.996425793321519,none,0.9585321576149282,1.8000957080115814,,,,0.7358937191645574,0.8320196540075749,0.8352784602784603,0.3667675842008921,0.7089909558432346,0.7121130792628377,0.996425793321519,0.8269374644388809,0.8219980036485834,0.6055740684641018,0.6119311193111932,0.8550042771599657,0.8515190415062045,none,0.9277358254251058,0.925399598427916,0.9585321576149282,COMPLETE
2645,0.6820612542537676,2025-09-24 02:05:29.758849,2025-09-24 02:05:51.089724,0 days 00:00:21.330875,0.00015459971708819766,dart,0.2504769938107773,0.3113841688325859,lossguide,0.0007350861659623252,0.046784923137272214,6,9,0.11928414040932198,500,forest,0.5314474290871225,0.9374049338414445,none,0.9053430372468176,1.0506634722507422,0.08008518635816728,weighted,0.6572702300799782,0.5072316419949725,0.8672330842460846,0.8660933660933661,0.5314474290871225,0.6849647801797425,0.6820612542537676,0.9374049338414445,0.8160669790774087,0.8140883602861863,0.7925801011804384,0.7895329206527856,0.6030795551753636,0.6003423192126658,none,0.9203270602805,0.9211719722747236,0.9053430372468176,COMPLETE
2646,0.7235367372353674,2025-09-24 02:05:51.237866,2025-09-24 02:06:12.164492,0 days 00:00:20.926626,3.2681509086056306,dart,0.5227233920871714,1.3020696089827297,lossguide,0.0009066007931149075,0.03663534293150169,3,12,5.62354593584553,500,forest,0.672870937003489,0.9925914058896325,none,0.8821821654038585,3.5987861613085554,0.10163420352609916,weighted,0.46037031807320455,0.5359289152428842,0.8628314054662709,0.8636363636363636,0.672870937003489,0.722682119205298,0.7235367372353674,0.9925914058896325,0.826199412051664,0.8171887837446865,0.7000801924619086,0.7025392986698912,0.7467921300256629,0.7458279845956355,none,0.9267979411152893,0.9236571666866192,0.8821821654038585,COMPLETE
2647,0.4762890867674467,2025-09-24 02:06:12.314894,2025-09-24 02:06:15.605338,0 days 00:00:03.290444,10.773685444000241,dart,0.33625441122297167,9.246491515102893,lossguide,0.06292347428372323,0.00967128031565539,1,3,80.07978711865782,200,forest,0.4225869459663562,0.5485582267730187,undersample,0.5486531520483634,1.9714477630067944,0.06072785309866333,weighted,0.7117717036184177,0.502298197436588,0.4780427884123247,0.4821867321867322,0.4225869459663562,0.4742756985256212,0.4762890867674467,0.5485582267730187,0.5820702031816217,0.5817423854933439,0.3124575465290042,0.3141647315940445,0.9837467921300257,0.9841677364142063,undersample,0.8346285397945099,0.8353282951693592,0.5486531520483634,COMPLETE
2648,0.7088201603665522,2025-09-24 02:06:15.754621,2025-09-24 02:06:40.926963,0 days 00:00:25.172342,0.0005262573222512355,dart,0.7093971614095559,9.202429677113587,depthwise,0.008198945822483986,0.09243464179177452,0,12,1.793845315841531,600,forest,0.6873933484470806,0.9802492168851044,none,0.9444148003405831,2.501597071330084,0.05461998318154261,weighted,0.747384500269829,0.4613881524113178,0.8706111167980346,0.8698812448812449,0.6873933484470806,0.7115472387037882,0.7088201603665522,0.9802492168851044,0.8259289796045257,0.8178637397904094,0.762720156555773,0.7628205128205128,0.6668092386655261,0.6619597774925118,none,0.9273384426717244,0.9244621765428073,0.9444148003405831,COMPLETE
2649,0.6915887850467289,2025-09-24 02:06:41.079210,2025-09-24 02:06:41.857617,0 days 00:00:00.778407,0.0003418205773281661,gbtree,0.42797148783860417,0.4560936951446745,depthwise,0.00010664000065064602,0.15726590086638695,0,4,0.43472560467773735,300,,0.5811480853246525,0.8643171240246827,none,0.9902327879565095,4.560879059878456,,,,0.5254048869664834,0.8224997440884431,0.8209459459459459,0.5811480853246525,0.6984347826086956,0.6915887850467289,0.8643171240246827,0.8040827802432114,0.7902067560379078,0.5885111371629543,0.5881823635272946,0.8588537211291702,0.8391099700470689,none,0.9188697119861436,0.9135334479579842,0.9902327879565095,COMPLETE
2650,0.0,2025-09-24 02:06:42.007718,2025-09-24 02:06:42.845546,0 days 00:00:00.837828,31.95791309812754,gbtree,0.8192094380052332,0.5773756519586346,depthwise,0.11646355872078912,0.0005066493195592995,10,3,0.5042380286298136,500,,0.48667475978285235,0.7602559614452705,none,0.9585279487828586,1.6598586079389153,,,,0.5273493286454382,0.7606715119254785,0.7607493857493858,0.48667475978285235,0.0,0.0,0.7602559614452705,0.6490834030065518,0.6439150328074685,0.0,0.0,0.0,0.0,none,0.8676124019335458,0.8691713874621271,0.9585279487828586,COMPLETE
2651,0.5616726462946926,2025-09-24 02:06:42.998662,2025-09-24 02:07:26.809176,0 days 00:00:43.810514,42.56294789136518,dart,0.9071658869545953,7.389360242319443,depthwise,0.002053072883894721,0.0038844953930582864,8,12,57.638699133370714,800,tree,0.454520480501325,0.8244776228327693,undersample,0.9693394154761106,4.235723901000593,0.0006395031713462562,weighted,0.6762931208138583,0.2721642113486934,0.6315897225918723,0.6372850122850123,0.454520480501325,0.5599706565594816,0.5616726462946926,0.8244776228327693,0.7433653897583107,0.7344789802123947,0.3920561547680192,0.39505743125652626,0.979469632164243,0.9713307659392384,undersample,0.896434220779273,0.8932887169000879,0.9693394154761106,COMPLETE
2652,0.38612143742255267,2025-09-24 02:07:26.962144,2025-09-24 02:07:27.881262,0 days 00:00:00.919118,0.35304354733406984,gbtree,0.9132785127454233,1.2101619320548593,depthwise,63.47267132221496,0.00012075287031951212,5,9,0.2134089607130121,200,,0.3995416162415165,0.8468069272938507,none,0.5267020150236301,4.646301302793754,,,,0.8559664024172278,0.23932848807452145,0.23925061425061425,0.3995416162415165,0.3862228462872718,0.38612143742255267,0.8468069272938507,0.7017785084422683,0.6969703892133576,0.23932848807452145,0.23925061425061425,1.0,1.0,none,0.8838796540375619,0.8841075161489986,0.5267020150236301,COMPLETE
2653,0.5721449166353265,2025-09-24 02:07:28.031476,2025-09-24 02:08:02.018962,0 days 00:00:33.987486,2.1065534526364167,dart,0.8807466575193397,7.99458480764148,lossguide,0.0004865648956810329,0.4518827256990629,8,10,0.1563394543869468,700,forest,0.33104850749197456,0.7309656985937493,undersample,0.9113156677001477,4.023683557421886,0.07836149483367343,weighted,0.5503511919017281,0.6638034273115259,0.646637322141468,0.6505937755937756,0.33104850749197456,0.5681761320990744,0.5721449166353265,0.7309656985937493,0.7999839258294135,0.7923412647913644,0.4015205091937765,0.4046099290780142,0.9713430282292558,0.9764655541292255,undersample,0.9134614731549646,0.9124643914139883,0.9113156677001477,COMPLETE
2654,0.699128651973347,2025-09-24 02:08:02.169202,2025-09-24 02:08:03.201067,0 days 00:00:01.031865,0.00011295491882240506,gbtree,0.9817436989259872,2.795215082805034,lossguide,0.009494214155671213,0.04633071726672006,10,5,0.2177735287341007,300,,0.43010161745887643,0.8510813651053148,oversample,0.9104087190746439,0.8697035507021293,,,,0.5670463930502431,0.8122632818098066,0.8197174447174447,0.43010161745887643,0.6905163685453932,0.699128651973347,0.8510813651053148,0.8231443228874222,0.8184854834125889,0.5702341137123745,0.5819112627986348,0.8751069289991446,0.8754813863928113,oversample,0.9252189144981277,0.9238862029314683,0.9104087190746439,COMPLETE
2655,0.7203193948308468,2025-09-24 02:08:03.358737,2025-09-24 02:08:10.700963,0 days 00:00:07.342226,0.001385536978077936,dart,0.9834184422845911,6.971505237351693,depthwise,0.00972460887949803,0.04038232563690101,2,12,1.0075184011907816,300,forest,0.535992736752043,0.8939147847073536,none,0.9890290112227736,1.7998582018560423,0.0852151544224552,weighted,0.6792615615303638,0.6580826294680465,0.8666188965093664,0.8637387387387387,0.535992736752043,0.7266624711558632,0.7203193948308468,0.8939147847073536,0.8275906840414539,0.821003937584571,0.7130506381226842,0.7076796036333609,0.7408041060735672,0.7334189131364998,none,0.9275869220092603,0.9251973382619745,0.9890290112227736,COMPLETE
2656,0.6978889480219975,2025-09-24 02:08:10.856588,2025-09-24 02:08:18.503650,0 days 00:00:07.647062,0.16003972969616587,dart,0.8004797521849234,0.7954228942936068,lossguide,0.4836219608581498,0.07184647965721977,3,9,20.51430416883231,300,forest,0.5416960401981921,0.9778806892466818,none,0.9360332658477296,3.9768334915755372,0.12806609526798798,weighted,0.582681346441597,0.314819594697009,0.8218855563517249,0.8256552006552007,0.5416960401981921,0.6961229479566888,0.6978889480219975,0.9778806892466818,0.8133077376490115,0.8039045365827893,0.5882526564344747,0.5960606060606061,0.8524379811804962,0.8416773641420625,none,0.9210848733353987,0.9182414887914467,0.9360332658477296,COMPLETE
2657,0.6928838951310862,2025-09-24 02:08:18.657565,2025-09-24 02:08:20.782382,0 days 00:00:02.124817,0.0063761190834890555,gbtree,0.7715637211388612,6.211193381563256,lossguide,0.00792509557547884,0.007167390457709992,2,7,0.10526471965330185,400,,0.689036794223843,0.8544480114632892,none,0.9584405996318841,2.884972008828067,,,,0.8584588978615059,0.8695874705701709,0.8656838656838657,0.689036794223843,0.7041337668369717,0.6928838951310862,0.8544480114632892,0.8148972682639833,0.8052832663194811,0.7703252032520326,0.7648578811369509,0.6484174508126604,0.6332905434317501,none,0.9211624044143099,0.9184279424333882,0.9584405996318841,COMPLETE
2658,0.6409540725704136,2025-09-24 02:08:20.932739,2025-09-24 02:08:21.654489,0 days 00:00:00.721750,23.829208968407613,gbtree,0.7732119864462089,5.155759762008991,depthwise,0.5502447510124934,0.04896777527706536,10,3,2.585870498829401,300,,0.637737993103541,0.6511124305408277,none,0.5251940991583421,1.5593451106577358,,,,0.370917101357616,0.8563824342307299,0.8551392301392301,0.637737993103541,0.6507343788897187,0.6409540725704136,0.6511124305408277,0.781503949818551,0.7781464021805963,0.7784395473496128,0.7874064837905237,0.5590248075278016,0.540436456996149,none,0.9044355489954401,0.9044322587373081,0.5251940991583421,COMPLETE
2659,0.6495828367103695,2025-09-24 02:08:21.807877,2025-09-24 02:08:25.073947,0 days 00:00:03.266070,0.00012337180549354033,dart,0.8835914280617561,8.453021466518088,depthwise,4.742507125011623,0.35871355396486465,0,8,17.510730740896214,200,forest,0.6615023744789882,0.963666206773188,undersample,0.9057453866219869,4.550897535918145,0.052438171374046307,weighted,0.7781112834086641,0.9378417764850577,0.7549390930494421,0.7592137592137592,0.6615023744789882,0.6461720366538575,0.6495828367103695,0.963666206773188,0.8050245195651378,0.7973491986613048,0.493676603432701,0.4982857142857143,0.9349871685201027,0.9328198545143346,undersample,0.91824459967544,0.9162969696331049,0.9057453866219869,COMPLETE
2660,0.7085508550855085,2025-09-24 02:08:25.226306,2025-09-24 02:08:38.522124,0 days 00:00:13.295818,0.02381792375573139,dart,0.5594749255042568,1.5721129422707119,lossguide,0.0052610472876603075,0.016584358894926723,7,8,10.366335345011441,400,forest,0.604284702636516,0.9894033121279209,none,0.9834526509159601,4.521937654224095,0.07449284789915869,weighted,0.671324486173332,0.5122566041574902,0.8289487153239841,0.8342547092547092,0.604284702636516,0.7036708636283029,0.7085508550855085,0.9894033121279209,0.8240609416241992,0.8158264067210252,0.601029990911845,0.6115599751398384,0.8485885372112917,0.8421052631578947,none,0.9258012034066707,0.9234835252544779,0.9834526509159601,COMPLETE
2661,0.6604002425712553,2025-09-24 02:08:38.671747,2025-09-24 02:08:39.554150,0 days 00:00:00.882403,0.0998649104885969,gbtree,0.882014257572205,2.135378981941556,depthwise,13.418869126468309,0.07695538749278624,10,3,59.953092873405325,500,,0.4891663410751336,0.9910945891488081,oversample,0.9919794431423163,2.2790357737816684,,,,0.9953656389420918,0.7651755553280786,0.7706797706797707,0.4891663410751336,0.6554520877140282,0.6604002425712553,0.9910945891488081,0.8200896619167278,0.8108928322531519,0.5050925925925925,0.5113876496830242,0.9332763045337895,0.9319640564826701,oversample,0.9249214530164539,0.922346779934663,0.9919794431423163,COMPLETE
2662,0.7162790697674418,2025-09-24 02:08:39.704703,2025-09-24 02:08:42.233676,0 days 00:00:02.528973,0.06785734946333337,gbtree,0.22615683066038683,2.085236092248605,lossguide,0.02059604618842507,0.07303687768502252,1,12,0.1021991622892879,400,,0.690761264225839,0.923210254789521,none,0.891591374327681,4.858466318614214,,,,0.6849062869361496,0.8569966219674481,0.8563677313677314,0.690761264225839,0.7199839647223892,0.7162790697674418,0.923210254789521,0.8252316371438264,0.8198946178391946,0.6774801961523953,0.6790644171779141,0.7681779298545766,0.7578091570389388,none,0.926497112470946,0.9249523803271946,0.891591374327681,COMPLETE
2663,0.7210766225309312,2025-09-24 02:08:42.388448,2025-09-24 02:08:43.270309,0 days 00:00:00.881861,0.00012446176173272833,gbtree,0.262325637881571,6.019878973901178,lossguide,0.000738863597740445,0.15481629817439688,2,5,1.6881708376688622,800,,0.5811147531307478,0.9579828330813491,none,0.9960207900608786,1.95193926688534,,,,0.9744890435398299,0.8688709182106664,0.8684479934479934,0.5811147531307478,0.723743799870606,0.7210766225309312,0.9579828330813491,0.8279040938588151,0.8225561669980136,0.7298825576337538,0.7317180616740088,0.7177074422583405,0.7107402652973898,none,0.9276122764563727,0.9265808553799793,0.9960207900608786,COMPLETE
2664,0.6108752225722504,2025-09-24 02:08:43.424033,2025-09-24 02:08:55.102665,0 days 00:00:11.678632,0.0003091923419348033,dart,0.48042191196408235,3.2284283193713037,lossguide,0.016835338192320123,0.48031357324937046,2,9,75.14724525017476,400,forest,0.525776915549093,0.8470672991160182,undersample,0.9289103788445422,4.247456958190452,0.11127129303115404,weighted,0.5868490549749711,0.591921089270808,0.7023236769372505,0.7091523341523341,0.525776915549093,0.607027027027027,0.6108752225722504,0.8470672991160182,0.7821087580557142,0.7755867519038528,0.44369814302647176,0.4492344883158743,0.960650128314799,0.9542148053059478,undersample,0.9106306102829809,0.9088679321444639,0.9289103788445422,COMPLETE
2665,0.6045042570722329,2025-09-24 02:08:55.250285,2025-09-24 02:08:56.485912,0 days 00:00:01.235627,0.0017253175460682077,gbtree,0.43860944876175134,1.2101229990542404,lossguide,62.7735082729431,0.013563420313629901,10,7,3.687895356480972,700,,0.30939989559185166,0.6528950346030378,undersample,0.7519948363545285,1.225172263499157,,,,0.26671559671764045,0.6998669259903777,0.7051597051597052,0.30939989559185166,0.6015221527589019,0.6045042570722329,0.6528950346030378,0.7491953024118256,0.7438657692219979,0.44083665338645417,0.44509605662285134,0.946535500427716,0.9418057338468121,undersample,0.8956865092123844,0.8946658711004168,0.7519948363545285,COMPLETE
2666,0.7072147651006712,2025-09-24 02:08:56.640909,2025-09-24 02:08:57.906980,0 days 00:00:01.266071,0.031151792790017098,gbtree,0.9119679302598578,4.884577815599804,lossguide,0.015175190321926353,0.0080035830921691,7,4,0.4868493658451414,700,,0.38776776986173445,0.9457929258400081,none,0.8043844410535662,1.0516724266038393,,,,0.3847651037625674,0.8527996724332071,0.857084357084357,0.38776776986173445,0.7022774327122153,0.7072147651006712,0.9457929258400081,0.8113440555773946,0.805323904482635,0.680577849117175,0.6935417523652818,0.7254063301967494,0.7214377406931964,none,0.9191488123585575,0.9185381850206322,0.8043844410535662,COMPLETE
2667,0.6985324947589099,2025-09-24 02:08:58.062407,2025-09-24 02:08:59.404663,0 days 00:00:01.342256,0.005370562690059235,gbtree,0.8343027927183806,0.045104967540726015,lossguide,0.001315625468097318,0.00845889444137525,8,5,0.14804920954663725,400,,0.324727724677604,0.8673760745597113,none,0.9461317681012593,0.8344539814698728,,,,0.7707783696957158,0.8526973078104207,0.8527846027846028,0.324727724677604,0.7020086974528887,0.6985324947589099,0.8673760745597113,0.8085649156777296,0.8022976466395448,0.6804496186270574,0.6847513357994246,0.7249786142001711,0.7128797603765511,none,0.9170062896296339,0.915595436365727,0.9461317681012593,COMPLETE
