number,value,datetime_start,datetime_complete,duration,params_alpha,params_booster,params_colsample_bytree,params_gamma,params_grow_policy,params_lambda,params_learning_rate,params_max_delta_step,params_max_depth,params_min_child_weight,params_n_estimators,params_normalize_type,params_params_decision_threshold,params_params_feature_fraction,params_params_resampling,params_params_sample_rows,params_params_scale_pos_weight,params_rate_drop,params_sample_type,params_skip_drop,params_subsample,user_attrs_acc_test,user_attrs_acc_val,user_attrs_decision_threshold,user_attrs_f1_test,user_attrs_f1_val,user_attrs_feature_fraction,user_attrs_pr_auc_test,user_attrs_pr_auc_val,user_attrs_prec_test,user_attrs_prec_val,user_attrs_rec_test,user_attrs_rec_val,user_attrs_resampling_strategy,user_attrs_roc_auc_test,user_attrs_roc_auc_val,user_attrs_sample_rows,state
535,0.531534647757408,2025-09-23 13:53:30.987750,2025-09-23 13:53:32.284965,0 days 00:00:01.297215,3.126071986695487,gbtree,0.42360279407097484,0.3045403051828721,depthwise,1.3171007667945185,0.000722221024851102,6,7,16.99837807846382,700,,0.6095338213310154,0.9721208761509221,oversample,0.5514981525000064,3.5832899209503517,,,,0.26681176781459515,0.581328692803767,0.584049959049959,0.6095338213310154,0.5309633027522935,0.531534647757408,0.9721208761509221,0.7494793220246662,0.7419005207150414,0.3627389533061736,0.36379419191919193,0.9901625320786998,0.9863072314933675,oversample,0.8984131051582744,0.8963130606169541,0.5514981525000064,COMPLETE
536,0.6110432777099444,2025-09-23 13:53:32.490707,2025-09-23 13:54:17.953611,0 days 00:00:45.462904,8.900105707464608,dart,0.7929641221082104,9.869979978146414,lossguide,0.07572326176523883,0.020882834573016908,1,7,1.4778039413036597,700,forest,0.3215999017254507,0.9263645928512287,oversample,0.6827697287755548,2.147711881761181,0.13609358510147007,uniform,0.4117103320349039,0.9437655551053186,0.7062135326031324,0.7064905814905815,0.3215999017254507,0.6118474438734108,0.6110432777099444,0.9263645928512287,0.8152440543966528,0.8045686428828898,0.4473892405063291,0.4473579658323401,0.9674935842600513,0.9636285836542576,oversample,0.9221094692787559,0.9186642053403938,0.6827697287755548,COMPLETE
537,0.5819468099043626,2025-09-23 13:54:18.081116,2025-09-23 13:54:27.637108,0 days 00:00:09.555992,65.34327190943993,dart,0.8670300757171752,5.108801923753742,depthwise,0.00020535959793417972,0.00402579207808337,6,7,0.3087770631427898,400,forest,0.41294330574416704,0.9158942039012998,undersample,0.6499435593428686,1.6613327257019457,0.38604530199011766,uniform,0.2955807366783459,0.5373236868811025,0.6657795066025182,0.6733210483210483,0.41294330574416704,0.5776742982796533,0.5819468099043626,0.9158942039012998,0.711827340059345,0.7063247204148022,0.41405525681438904,0.4193731117824773,0.9550898203592815,0.9503637141634574,undersample,0.8800749616747818,0.8795227892359241,0.6499435593428686,COMPLETE
538,0.6492648273583347,2025-09-23 13:54:27.768050,2025-09-23 13:54:28.989947,0 days 00:00:01.221897,18.555663217838674,gbtree,0.2211533427844742,7.487302249418331,depthwise,0.09115242515675534,0.0007247596137129822,3,5,40.03170362882212,1000,,0.6719137429694858,0.9731425384370624,oversample,0.8819054937499147,2.093541859085071,,,,0.5706317074493199,0.7770498515712969,0.7826576576576577,0.6719137429694858,0.646887159533074,0.6492648273583347,0.9731425384370624,0.7395821490581661,0.7315006324644668,0.52088772845953,0.528794402583423,0.8532934131736527,0.8408215661103979,oversample,0.8931697134020786,0.8914364456523047,0.8819054937499147,COMPLETE
539,0.5905247617769427,2025-09-23 13:54:29.120629,2025-09-23 13:54:29.842163,0 days 00:00:00.721534,0.04153020153704778,gbtree,0.2564156902770736,6.725634140828794,depthwise,0.002647800934367551,0.00013287552718146655,1,10,43.639054955200095,500,,0.6785642131979164,0.6531207672370528,oversample,0.5216427968863474,2.248590762459284,,,,0.22325640888767967,0.6830791278534138,0.6876535626535627,0.6785642131979164,0.586759209823812,0.5905247617769427,0.6531207672370528,0.7032364268348387,0.6914928916563441,0.42646488164532403,0.4301916308173641,0.9401197604790419,0.9413778348309799,oversample,0.8767135260593641,0.8755345354698687,0.5216427968863474,COMPLETE
540,0.5652554015236668,2025-09-23 13:54:29.973090,2025-09-23 13:54:30.829700,0 days 00:00:00.856610,10.517975234522435,gbtree,0.9600052534733521,7.817700436347414,depthwise,0.021595385456519952,0.0016062932048589483,8,3,0.3335374745265078,1000,,0.37333180197120663,0.9417427629329909,undersample,0.5297764227325137,2.1860236709763123,,,,0.6225380682842898,0.6387552461869178,0.6436322686322686,0.37333180197120663,0.5638363613891979,0.5652554015236668,0.9417427629329909,0.7475995068712172,0.7381904924285417,0.39648878845819574,0.39911816578483245,0.9756201881950385,0.9683354728284125,undersample,0.8972830335637624,0.892911202978974,0.5297764227325137,COMPLETE
541,0.6018043025676614,2025-09-23 13:54:30.960588,2025-09-23 13:55:48.621757,0 days 00:01:17.661169,10.025450568095948,dart,0.6698712602082512,2.2158279925018265,depthwise,0.006476437508769526,0.012526603522143185,1,9,14.43990002535038,1000,forest,0.5306938090528682,0.5209813916501331,undersample,0.6792937756304089,2.4976062507271606,0.051748365484192704,uniform,0.0958822253946317,0.2723968034229587,0.695465247210564,0.7062858312858313,0.5306938090528682,0.590840324577087,0.6018043025676614,0.5209813916501331,0.6694688278385803,0.6686047775436994,0.4354348266774782,0.44535743631881675,0.9187339606501284,0.9276850663243474,undersample,0.8689695987228496,0.8739041889707085,0.6792937756304089,COMPLETE
542,0.38612143742255267,2025-09-23 13:55:48.864765,2025-09-23 13:55:49.849498,0 days 00:00:00.984733,0.09766344276846566,gbtree,0.5558257550863976,6.178588062408932,lossguide,38.622950937000425,0.0002244119545112876,10,7,1.4388190428849912,400,,0.3209471825691111,0.512767465509343,none,0.719605534054591,2.795005821638547,,,,0.3964413137691578,0.23932848807452145,0.23925061425061425,0.3209471825691111,0.3862228462872718,0.38612143742255267,0.512767465509343,0.6194423102034021,0.6093567179822658,0.23932848807452145,0.23925061425061425,1.0,1.0,none,0.8442745399103172,0.8434570232704857,0.719605534054591,COMPLETE
543,0.5207694452188458,2025-09-23 13:55:50.079570,2025-09-23 13:55:50.657712,0 days 00:00:00.578142,21.98122614859734,gbtree,0.25776431131791305,6.210951088925183,depthwise,0.0001256763314394945,0.011293625104042094,4,4,12.698550521245258,400,,0.5208095735646363,0.6451601037226737,none,0.6191576440232727,1.0610496278552664,,,,0.5481039319815425,0.8258777766403931,0.824017199017199,0.5208095735646363,0.5315340126686863,0.5207694452188458,0.6451601037226737,0.6799938831290034,0.6759887381731132,0.7463263727764888,0.7472,0.4127459366980325,0.3996576807873342,none,0.8707668002135185,0.8713654424009977,0.6191576440232727,COMPLETE
544,0.5665342601787487,2025-09-23 13:55:50.885452,2025-09-23 13:55:53.628692,0 days 00:00:02.743240,37.54153512786553,dart,0.33435613615007975,6.207134747882134,depthwise,0.008408354240586634,0.004503080491062916,3,11,0.1950950314985492,200,forest,0.33564174660311624,0.8250316120579421,none,0.5001704312361804,2.60515172824718,0.4919150964834378,weighted,0.1034502805561232,0.8430364833712103,0.6402907155287133,0.6425061425061425,0.33564174660311624,0.5652066320217768,0.5665342601787487,0.8250316120579421,0.737736431887005,0.7314595229395411,0.39763231197771587,0.3990208078335373,0.9769033361847733,0.9764655541292255,none,0.8879511580679692,0.8859004481509447,0.5001704312361804,COMPLETE
545,0.6318307267709291,2025-09-23 13:55:53.875588,2025-09-23 13:55:54.284972,0 days 00:00:00.409384,48.025153115554325,gbtree,0.3647326442530047,3.3650376149451597,lossguide,85.253419349288,0.17165801588512292,0,6,32.10326163324603,300,,0.659228687122265,0.6282386899042672,undersample,0.6785204324159251,1.2799520399089446,,,,0.7698011391843991,0.7925069096120381,0.7951474201474201,0.659228687122265,0.6315215415379022,0.6318307267709291,0.6282386899042672,0.6654544587972221,0.6576070598709138,0.5491621877963958,0.5542285345384119,0.7429426860564585,0.7347026101839966,undersample,0.8725079398846922,0.8713832067458214,0.6785204324159251,COMPLETE
546,0.5925043040656867,2025-09-23 13:55:54.509617,2025-09-23 13:55:54.878776,0 days 00:00:00.369159,0.00027494812072269953,gbtree,0.20793195035517897,7.339528456533434,depthwise,0.0016613765373515586,0.06904997305704544,4,8,20.820747302502657,200,,0.3370445211118782,0.8348362167359962,undersample,0.7042211508754117,1.7272055422061552,,,,0.3352382991096546,0.6775514382229502,0.68499180999181,0.3370445211118782,0.5866141732283464,0.5925043040656867,0.8348362167359962,0.7739834637812433,0.7717484869819249,0.4231351760696706,0.42903720751822016,0.955945252352438,0.9572100984167736,undersample,0.9023790759791911,0.9039328416784582,0.7042211508754117,COMPLETE
547,0.6921627731725697,2025-09-23 13:55:55.112390,2025-09-23 13:55:56.021806,0 days 00:00:00.909416,0.7488329936446092,gbtree,0.5007900577935344,2.339895934695555,lossguide,54.96039022759504,0.02535712030168634,2,10,1.6883607309522701,800,,0.5156428597860574,0.9162764734560208,undersample,0.8191881536143237,0.7935943910113208,,,,0.20557837239512677,0.8298699969290613,0.8327190827190827,0.5156428597860574,0.6910780669144981,0.6921627731725697,0.9162764734560208,0.7854574597924806,0.7803028555375437,0.6111111111111112,0.6183103332211377,0.7951240376390077,0.7860504920838682,undersample,0.9107586200227724,0.9101217148414391,0.8191881536143237,COMPLETE
548,0.28530973451327435,2025-09-23 13:55:56.238319,2025-09-23 13:55:57.350222,0 days 00:00:01.111903,0.6824555979300403,gbtree,0.5485214460602192,1.3078745671746073,depthwise,0.6082833032863338,0.00033019288231950054,6,4,93.24953504442699,900,,0.32540889932386396,0.604775744333796,none,0.7834366801926359,0.8482560687688281,,,,0.5096620447707385,0.7979322346197154,0.7933046683046683,0.32540889932386396,0.30736842105263157,0.28530973451327435,0.604775744333796,0.6885368242170257,0.6791491427847486,0.85546875,0.8258196721311475,0.18733960650128315,0.17244330338040223,none,0.8756902251785719,0.8769006625323249,0.7834366801926359,COMPLETE
549,0.0,2025-09-23 13:55:57.578349,2025-09-23 13:55:58.109424,0 days 00:00:00.531075,0.00298039329785667,gbtree,0.2240440134324226,5.497949827159107,lossguide,39.84417148913255,0.00015656661708886456,2,3,27.416819701386373,400,,0.46344161966849085,0.8000356399972243,none,0.5737342138697379,0.6587236674567755,,,,0.3110707040057924,0.7606715119254785,0.7607493857493858,0.46344161966849085,0.0,0.0,0.8000356399972243,0.6817955488450217,0.6799149531893534,0.0,0.0,0.0,0.0,none,0.8657784782243575,0.8636247659036521,0.5737342138697379,COMPLETE
550,0.6654267410622029,2025-09-23 13:55:58.339079,2025-09-23 13:55:58.869420,0 days 00:00:00.530341,0.08978991778603845,gbtree,0.7149581771869784,1.9327827462438163,depthwise,1.044896252368636,0.17350694622678245,8,11,57.00720550061447,400,,0.6642564944663079,0.8819610615555532,undersample,0.5495855912954963,1.018494272047182,,,,0.41053491823956634,0.8277203398505476,0.8342547092547092,0.6642564944663079,0.6575788402848424,0.6654267410622029,0.8819610615555532,0.7308372695473875,0.7305196781507752,0.6270857586340707,0.6434852118305355,0.6911890504704876,0.6889174154899443,undersample,0.8928210537803222,0.8922099000434579,0.5495855912954963,COMPLETE
551,0.4305691056910569,2025-09-23 13:55:59.090588,2025-09-23 13:56:32.796610,0 days 00:00:33.706022,0.20805183762216536,dart,0.22862209769767639,2.702796113824345,depthwise,0.003326114427106144,0.0026485881404758617,5,10,2.2247644330192866,700,forest,0.6403750283059471,0.9449728093077681,none,0.8057798855002836,1.583974073112266,0.29161187817719897,weighted,0.49420809417731293,0.7369656362761525,0.8274132459821886,0.8207411957411958,0.6403750283059471,0.4596153846153846,0.4305691056910569,0.9449728093077681,0.7825835904030682,0.7743339139190074,0.9168797953964194,0.8970189701897019,0.306672369546621,0.2832691484809585,none,0.912069827701423,0.910871876923091,0.8057798855002836,COMPLETE
552,0.0,2025-09-23 13:56:32.917251,2025-09-23 13:57:07.285050,0 days 00:00:34.367799,24.975300584416733,dart,0.757266544257647,7.939538174686197,depthwise,0.00022432876549111232,0.00047392904639730716,3,10,46.04214927954959,800,tree,0.6697386760285154,0.5627934231686476,none,0.7142966288994157,0.9927067241476225,0.4033710196901428,weighted,0.33409381275793765,0.6363159524372408,0.7606715119254785,0.7607493857493858,0.6697386760285154,0.0,0.0,0.5627934231686476,0.6529965936714874,0.6501486196133968,0.0,0.0,0.0,0.0,none,0.8701183767766387,0.8720780891806963,0.7142966288994157,COMPLETE
553,0.0,2025-09-23 13:57:07.408005,2025-09-23 13:57:18.272451,0 days 00:00:10.864446,20.18849020608622,dart,0.7185958117123377,0.5214644549144754,lossguide,35.53469880390937,0.00011340288584025745,0,3,6.4611536391069615,400,forest,0.6132964953791473,0.7489808724679052,oversample,0.7223160693342621,0.9935524542261489,0.04107047944340414,weighted,0.05011903925324146,0.9209670627572704,0.7606715119254785,0.7607493857493858,0.6132964953791473,0.0,0.0,0.7489808724679052,0.7158541763391624,0.7091874120820636,0.0,0.0,0.0,0.0,oversample,0.8872306140357844,0.8838994113120698,0.7223160693342621,COMPLETE
554,0.6815387317758651,2025-09-23 13:57:18.394060,2025-09-23 13:57:18.957649,0 days 00:00:00.563589,11.526379526695443,gbtree,0.48006901986305683,8.44288380755107,depthwise,0.15490634991320484,0.03398780574358866,1,6,3.527270724504862,800,,0.4235918336065997,0.7235599852243848,undersample,0.616632411006651,0.6724643840950166,,,,0.4638228766322315,0.8081686968983519,0.8143939393939394,0.4235918336065997,0.677007928300586,0.6815387317758651,0.7235599852243848,0.7828861091044166,0.7745850077619343,0.5669745958429562,0.5780691299165673,0.8400342172797263,0.8301240907145914,undersample,0.9080412334106801,0.9066840981819503,0.616632411006651,COMPLETE
555,0.0,2025-09-23 13:57:19.085297,2025-09-23 13:57:25.808662,0 days 00:00:06.723365,0.0026039622849671337,dart,0.5588043800171396,0.7767499370541742,depthwise,1.505014447970312,0.0002744333123377764,8,6,9.347567044556213,400,forest,0.6763194905728467,0.6503671109301525,undersample,0.9795683136317374,0.5766266044972727,0.4695861994048117,uniform,0.03360739972716931,0.7574624965020702,0.7606715119254785,0.7607493857493858,0.6763194905728467,0.0,0.0,0.6503671109301525,0.7388290436493478,0.7237559210929729,0.0,0.0,0.0,0.0,undersample,0.8912577693681211,0.883358764849999,0.9795683136317374,COMPLETE
556,0.6713164777680907,2025-09-23 13:57:25.930406,2025-09-23 13:57:31.016699,0 days 00:00:05.086293,0.012225325461317,dart,0.26477569669423195,8.819540269889794,lossguide,0.0008634626929897056,0.024723597369608025,5,3,3.999325642824805,300,forest,0.35411148977880114,0.5239245358824784,none,0.8478259485686733,1.3778459559071814,0.41395552130076946,weighted,0.44251562488125096,0.6661797650258011,0.8011055379260927,0.8070229320229321,0.35411148977880114,0.6659790269898573,0.6713164777680907,0.5239245358824784,0.7770877132431452,0.7690977276836587,0.5567691865478586,0.5665097115950559,0.8284858853721129,0.8237056054771074,none,0.9018620870031089,0.8997665125919261,0.8478259485686733,COMPLETE
557,0.6403743315508021,2025-09-23 13:57:31.137964,2025-09-23 13:57:45.912668,0 days 00:00:14.774704,0.000627069700110983,dart,0.5650243792438367,4.999643716654438,lossguide,0.007190100555858824,0.11061407732697723,8,8,21.53297027990698,500,tree,0.6263781173926095,0.6753868606379215,none,0.7295527971778389,2.249832838217495,0.411705237287815,weighted,0.44151211527947104,0.9066987874533343,0.8383662606203296,0.8347665847665847,0.6263781173926095,0.6493448811903175,0.6403743315508021,0.6753868606379215,0.7227533241744709,0.7139099289794925,0.6752886836027714,0.6680613668061367,0.6253207869974337,0.6148908857509627,none,0.886696818025521,0.8873604930299563,0.7295527971778389,COMPLETE
558,0.38612143742255267,2025-09-23 13:57:46.038808,2025-09-23 13:58:46.873825,0 days 00:01:00.835017,0.0008341185922003491,dart,0.2378273450424584,3.380559827196948,depthwise,19.103392638918095,0.00019314036816121837,10,8,1.333152454733243,900,forest,0.5662100693211927,0.5651555767632717,undersample,0.8581460991320728,4.988728467201259,0.21571637596074894,weighted,0.8153176930559954,0.4108223171976564,0.23932848807452145,0.23925061425061425,0.5662100693211927,0.3862228462872718,0.38612143742255267,0.5651555767632717,0.6495611152965928,0.6449359179749459,0.23932848807452145,0.23925061425061425,1.0,1.0,undersample,0.855466700833295,0.8576211659318218,0.8581460991320728,COMPLETE
559,0.6,2025-09-23 13:58:47.002476,2025-09-23 13:58:47.380568,0 days 00:00:00.378092,0.000366659673703243,gbtree,0.878601133630128,3.4604956190112635,depthwise,6.394242625106428,0.057752508941905374,5,5,5.661542435964414,300,,0.6634325514179739,0.5090393293705764,undersample,0.5396393074171543,4.582046824921121,,,,0.4377912102256863,0.6916777561674685,0.7051597051597052,0.6634325514179739,0.587171052631579,0.6,0.5090393293705764,0.6638849370616101,0.6601311386700724,0.4320290439693425,0.44417026526835285,0.9161676646706587,0.9242618741976893,undersample,0.8649015194134484,0.8706144453663478,0.5396393074171543,COMPLETE
560,0.6360846885547714,2025-09-23 13:58:47.505345,2025-09-23 13:58:54.685346,0 days 00:00:07.180001,18.209356403886716,dart,0.7440373813265222,8.37650629196182,lossguide,0.3809931457766906,0.00027696281216335676,5,5,0.12661703646922473,300,tree,0.5283218975724386,0.8843360736449724,oversample,0.7788899772142605,1.1328561522372853,0.14374007456464805,weighted,0.45736419574182363,0.298701105238835,0.751253966629133,0.7571662571662572,0.5283218975724386,0.6334841628959276,0.6360846885547714,0.8843360736449724,0.7386616098134976,0.7349123448273316,0.48928238583411,0.4958143984692657,0.8982035928143712,0.8870346598202824,oversample,0.8937572976775556,0.8912847145384952,0.7788899772142605,COMPLETE
561,0.5831055221432476,2025-09-23 13:58:54.845473,2025-09-23 13:59:22.668746,0 days 00:00:27.823273,0.02932667561708887,dart,0.5668084345353221,2.832216929904694,lossguide,0.14644086721459404,0.45796663895756096,9,5,0.707643850035158,600,tree,0.4462517130822527,0.5226307965924797,oversample,0.6825239970771486,3.4823722443357124,0.30281638200100214,uniform,0.6414436732367352,0.26947088957397114,0.6857406080458593,0.6877559377559378,0.4462517130822527,0.5807156514613494,0.5831055221432476,0.5226307965924797,0.6625767268771376,0.6652042293483099,0.4265650080256822,0.42839927696324565,0.9093242087254063,0.9127086007702182,oversample,0.8542373123296058,0.8623972122474131,0.6825239970771486,COMPLETE
562,0.5979519145146928,2025-09-23 13:59:22.792563,2025-09-23 13:59:23.208705,0 days 00:00:00.416142,48.57387244186372,gbtree,0.6422271339081358,9.400425770439323,depthwise,0.00201120391801047,0.09711225638651685,4,5,15.517031083663081,500,,0.6537466351725554,0.6291590661225004,none,0.932107459723891,2.276623998309882,,,,0.6788658147995188,0.8134916572832429,0.8151105651105651,0.6537466351725554,0.6016615653694797,0.5979519145146928,0.6291590661225004,0.6256719904742645,0.621813785345966,0.6153846153846154,0.6232018561484919,0.5885372112917023,0.57466837826273,none,0.8613506305343059,0.8592069144242852,0.932107459723891,COMPLETE
563,0.6450191007934176,2025-09-23 13:59:23.333039,2025-09-23 13:59:24.128789,0 days 00:00:00.795750,20.354973925579504,gbtree,0.9547134725238535,5.701852405140642,lossguide,2.929788968022711,0.04341540188917203,5,10,15.25819100384128,800,,0.520400930379529,0.9647255875964744,undersample,0.9991698133307841,2.8411528937988995,,,,0.7112323517218688,0.745931006244242,0.7526617526617526,0.520400930379529,0.6391392846757779,0.6450191007934176,0.9647255875964744,0.8020373801541625,0.7947332147234187,0.4841409691629956,0.49116133363168496,0.9401197604790419,0.9392383397518186,undersample,0.917271576001351,0.9154047215843468,0.9991698133307841,COMPLETE
564,0.6742986133505321,2025-09-23 13:59:24.252654,2025-09-23 13:59:30.789219,0 days 00:00:06.536565,0.004850449310279153,dart,0.7997795806557395,9.494453836226475,depthwise,0.3998402871320206,0.20056206970955054,9,10,17.3592737919661,300,forest,0.6806437388316311,0.7666999160694696,oversample,0.7743681070225004,4.316202230374585,0.05758747755585336,weighted,0.8276725205537024,0.8939395021013077,0.7915856280069608,0.7932022932022932,0.6806437388316311,0.6764144945963128,0.6742986133505321,0.7666999160694696,0.8197956766295782,0.808528554970216,0.5381891755184623,0.5410090556274256,0.9101796407185628,0.8947368421052632,oversample,0.9237739124668938,0.9194643494360066,0.7743681070225004,COMPLETE
565,0.5861978483337706,2025-09-23 13:59:30.913324,2025-09-23 13:59:31.428759,0 days 00:00:00.515435,79.28517899602237,gbtree,0.8524826666124528,6.163405665944589,depthwise,0.07525457705902451,0.1715892066808331,4,10,1.4809199551085321,900,,0.4409332275100159,0.6632599025934423,undersample,0.8332550613243057,2.9102942807607897,,,,0.5119856581752575,0.6740710410482137,0.6771089271089271,0.4409332275100159,0.584008361640972,0.5861978483337706,0.6632599025934423,0.7485192449844023,0.7470520008202839,0.4204288939051919,0.4227057710501419,0.955945252352438,0.9559264013692769,undersample,0.8970154448585959,0.8964405493023334,0.8332550613243057,COMPLETE
566,0.6414850686037127,2025-09-23 13:59:31.552386,2025-09-23 13:59:32.128779,0 days 00:00:00.576393,0.14906076014827277,gbtree,0.3272055268928675,9.900196236907217,lossguide,4.105660266612227,0.004928021075544905,1,4,3.8347604350744597,400,,0.6599656201739075,0.5094615471993298,oversample,0.7025165896072343,2.178146857104833,,,,0.4994626022169058,0.7654826491964377,0.7726248976248976,0.6599656201739075,0.6338500879015503,0.6414850686037127,0.5094615471993298,0.7021593223767542,0.696613860449204,0.5059964276601174,0.5150336962156558,0.8481608212147135,0.8502353444587077,oversample,0.8788367667456483,0.8804139719998224,0.7025165896072343,COMPLETE
