number,value,datetime_start,datetime_complete,duration,params_alpha,params_booster,params_colsample_bytree,params_gamma,params_grow_policy,params_lambda,params_learning_rate,params_max_delta_step,params_max_depth,params_min_child_weight,params_n_estimators,params_normalize_type,params_params_decision_threshold,params_params_feature_fraction,params_params_resampling,params_params_sample_rows,params_params_scale_pos_weight,params_rate_drop,params_sample_type,params_skip_drop,params_subsample,user_attrs_acc_test,user_attrs_acc_val,user_attrs_decision_threshold,user_attrs_f1_test,user_attrs_f1_val,user_attrs_feature_fraction,user_attrs_pr_auc_test,user_attrs_pr_auc_val,user_attrs_prec_test,user_attrs_prec_val,user_attrs_rec_test,user_attrs_rec_val,user_attrs_resampling_strategy,user_attrs_roc_auc_test,user_attrs_roc_auc_val,user_attrs_sample_rows,state
1589,0.6936254980079681,2025-09-23 21:22:02.058464,2025-09-23 21:22:05.314235,0 days 00:00:03.255771,0.0258964216530228,dart,0.9550011197165694,7.782049295082061,lossguide,0.004239486188527196,0.016699414955776464,5,6,0.1454238509023765,200,forest,0.3562689133565211,0.8933354869481088,none,0.9843969959093252,1.1249183052135903,0.19911618186172564,uniform,0.396698969966997,0.4066221695999743,0.8416419285494933,0.8425470925470926,0.3562689133565211,0.6975562072336265,0.6936254980079681,0.8933354869481088,0.8005836745257667,0.7933096484036685,0.6424198775657184,0.64890048453224,0.7630453378956373,0.7449721865639709,none,0.9116417375756589,0.9098197497709206,0.9843969959093252,COMPLETE
1590,0.6771488469601677,2025-09-23 21:22:05.449669,2025-09-23 21:22:06.343809,0 days 00:00:00.894140,0.004880527494616682,gbtree,0.4799495058713231,8.218346379572544,depthwise,0.9121160403902205,0.056792910189470545,2,12,0.2684720204423195,800,,0.6224254857103171,0.795562519745516,none,0.7819196842612268,4.762901317565173,,,,0.33006919638037513,0.8092947077490019,0.8108108108108109,0.6224254857103171,0.6785159620362381,0.6771488469601677,0.795562519745516,0.7828380445320976,0.7735353556333804,0.5687011859994214,0.5721877767936226,0.8408896492728828,0.8292682926829268,none,0.9075399003020546,0.9049619932274371,0.7819196842612268,COMPLETE
1591,0.6792760476112832,2025-09-23 21:22:06.480268,2025-09-23 21:22:13.299645,0 days 00:00:06.819377,0.002636786429732541,dart,0.9781017479231204,4.590212085600436,depthwise,0.0014773242134774422,0.055528332513165427,3,11,1.7746277427845225,300,forest,0.6981829383217008,0.9710035324250647,undersample,0.9728034950693303,3.572952274799972,0.19334764359259102,uniform,0.4152025391248395,0.4989151313454521,0.7897430647968062,0.7986281736281736,0.6981829383217008,0.6694560669456067,0.6792760476112832,0.9710035324250647,0.8085437805649642,0.8005458197900257,0.5366357069143447,0.5487355110642782,0.8896492728828058,0.8913136499786051,undersample,0.9174996796878588,0.9169418412625364,0.9728034950693303,COMPLETE
1592,0.7167194928684627,2025-09-23 21:22:13.438175,2025-09-23 21:22:17.082053,0 days 00:00:03.643878,0.011368074343405298,dart,0.9466184021292542,4.932085137677322,lossguide,0.0002706604925036695,0.10899792242824209,8,8,0.20279715019483635,200,forest,0.44099372813216825,0.9152557329750557,none,0.9372139243880403,1.5168636366322052,0.21330836942308523,uniform,0.4717884328644525,0.5012353782061562,0.8559729757395844,0.8536036036036037,0.44099372813216825,0.7229769639692853,0.7167194928684627,0.9152557329750557,0.8253395109248685,0.8201784764898743,0.6698285297336738,0.6672814459609,0.7852865697177075,0.7740693196405648,none,0.9259925848746593,0.9244349110086941,0.9372139243880403,COMPLETE
1593,0.6934247680516338,2025-09-23 21:22:17.217690,2025-09-23 21:22:18.193909,0 days 00:00:00.976219,0.04123172656680517,gbtree,0.39159526999748473,1.3157014884483256,lossguide,0.0002909821587856996,0.293779225188026,9,6,1.7699478451392365,300,,0.4251088892018675,0.9806888451312802,none,0.7290976869226459,1.5103812982908902,,,,0.30109348367354494,0.8422561162862114,0.8443898443898444,0.4251088892018675,0.6936990657920891,0.6934247680516338,0.9806888451312802,0.7840630187586168,0.7829051480407911,0.6479762346825102,0.6558565433040824,0.7463644140290847,0.7355584082156611,none,0.9068697198140774,0.907241645244364,0.7290976869226459,COMPLETE
1594,0.6890674458242025,2025-09-23 21:22:18.328974,2025-09-23 21:22:35.753619,0 days 00:00:17.424645,0.00034764069354989744,dart,0.6969695991651386,7.597761815545682,depthwise,0.00043022452541315845,0.15498580121694316,8,11,2.1885657030618852,500,forest,0.6922783928127545,0.9331366551294481,none,0.9442718933764043,2.1361911048404867,0.172068832305543,uniform,0.42578866298505574,0.5853642374732282,0.8710205752891801,0.8692669942669943,0.6922783928127545,0.6944713870029098,0.6890674458242025,0.9331366551294481,0.822455174569936,0.8178940717958871,0.8017917133258678,0.7994350282485876,0.6124893071000855,0.6054771074026529,none,0.9250954230877307,0.9239934799959945,0.9442718933764043,COMPLETE
1595,0.6926492353231376,2025-09-23 21:22:35.888310,2025-09-23 21:22:36.886767,0 days 00:00:00.998457,0.0012624599110087772,gbtree,0.9853086396224003,4.299309472627282,lossguide,0.000285720668949064,0.14500732271965927,7,8,0.17283209249614412,600,,0.35160050763480766,0.9901414117353272,oversample,0.9863287351087933,1.0108759077344407,,,,0.7926874434298408,0.8059166751970519,0.8086609336609336,0.35160050763480766,0.6916070266753416,0.6926492353231376,0.9901414117353272,0.8267306635983159,0.8212822233502458,0.558005249343832,0.5625,0.9093242087254063,0.9011553273427471,oversample,0.9272698331349297,0.9255442180454995,0.9863287351087933,COMPLETE
1596,0.7008976660682226,2025-09-23 21:22:37.025344,2025-09-23 21:22:37.654453,0 days 00:00:00.629109,0.0223050776042986,gbtree,0.8338291631479378,6.754993109377672,depthwise,49.91511177998194,0.08596684365227784,1,8,8.123020386980405,200,,0.5300745611915527,0.9808575589389771,none,0.7557900284766093,3.279909180176129,,,,0.6070221012439067,0.8279250690961204,0.8294430794430795,0.5300745611915527,0.7009428927237147,0.7008976660682226,0.9808575589389771,0.8126660481324389,0.8067539910190747,0.6000609198903442,0.6037735849056604,0.8426005132591959,0.8352588789045785,none,0.9214331012696333,0.9197142595058103,0.7557900284766093,COMPLETE
1597,0.6716661232474731,2025-09-23 21:22:37.788556,2025-09-23 21:22:47.898763,0 days 00:00:10.110207,0.00016593374235363565,dart,0.8175132785333276,3.5617090484395098,depthwise,0.0029535033501051056,0.020938021679789243,7,3,0.20118741160388548,400,forest,0.4029333816273924,0.9809343220186325,undersample,0.921131275810263,0.8044904915581583,0.2735930440736731,uniform,0.5258392579879884,0.9706650211877248,0.7854437506397789,0.7938165438165438,0.4029333816273924,0.6667726550079491,0.6716661232474731,0.9809343220186325,0.7965329967261633,0.7882845876053176,0.5306174089068826,0.5425335791414274,0.8969204448246364,0.881471972614463,undersample,0.912741965172832,0.9111742738658503,0.921131275810263,COMPLETE
1598,0.7016011644832606,2025-09-23 21:22:48.034249,2025-09-23 21:22:51.762357,0 days 00:00:03.728108,0.000493777024622427,dart,0.9787007965311069,7.3609153016987,depthwise,0.0023568621501839073,0.017351209776435117,2,12,3.031515274533229,200,forest,0.686480073807987,0.8657610927554938,none,0.9643991548305786,3.972849493427663,0.10593602378616164,uniform,0.24458742148626042,0.5553859130259069,0.8534138601699253,0.8530917280917281,0.686480073807987,0.7042544403139198,0.7016011644832606,0.8657610927554938,0.8047131275907481,0.7972933410284412,0.6809105431309904,0.6824433656957929,0.7292557741659538,0.7218656397090286,none,0.915242817324,0.9138538395774285,0.9643991548305786,COMPLETE
1599,0.6953417205032302,2025-09-23 21:22:51.897155,2025-09-23 21:22:52.561666,0 days 00:00:00.664511,0.0002015962624593298,gbtree,0.9297730853150188,9.580708734806471,depthwise,0.008626173941184352,0.37430583216427826,1,12,6.942125785377522,500,,0.6967282043181106,0.8795303848391872,oversample,0.8058813933233022,3.885687236408846,,,,0.7434317889425365,0.8104207185996519,0.8165438165438166,0.6967282043181106,0.6886348352387357,0.6953417205032302,0.8795303848391872,0.8127221853089682,0.8090783605862196,0.5673130193905818,0.5768688293370945,0.8759623609923011,0.8750534873769791,oversample,0.9219429530120219,0.9204023183592862,0.8058813933233022,COMPLETE
1600,0.6505279423126449,2025-09-23 21:22:52.698736,2025-09-23 21:23:03.996365,0 days 00:00:11.297629,0.0007280626166897065,dart,0.5673142688328978,0.31973440978324863,depthwise,1.1558938708375834,0.019041634994025725,6,5,2.0079891226329223,400,tree,0.4783211556658097,0.8965642994249245,none,0.9966486988471304,0.8086840115212052,0.08310617748315907,uniform,0.45958413086137495,0.9197034667457351,0.8632408639574163,0.8610769860769861,0.4783211556658097,0.6603965429588206,0.6505279423126449,0.8965642994249245,0.8122050266913546,0.8055764723890604,0.8139097744360902,0.8169469598965071,0.5556030795551754,0.540436456996149,none,0.918540449523699,0.9169586554884311,0.9966486988471304,COMPLETE
1601,0.7062043795620438,2025-09-23 21:23:04.133373,2025-09-23 21:23:04.781860,0 days 00:00:00.648487,0.0019254553762678,gbtree,0.7111624733074735,6.309863762543836,depthwise,0.09260697001665714,0.46032660485897026,1,12,0.25123971147331625,500,,0.5429418325594237,0.8833456218664967,none,0.7338076619124996,1.2393961132994509,,,,0.5697336463733689,0.8663118026410073,0.8681408681408681,0.5429418325594237,0.7049254405784003,0.7062043795620438,0.8833456218664967,0.8169771861036605,0.814701344847484,0.7471264367816092,0.756228627259404,0.6672369546621043,0.6623876765083441,none,0.9222567035028506,0.9219844391249302,0.7338076619124996,COMPLETE
1602,0.7036455607884179,2025-09-23 21:23:04.919615,2025-09-23 21:23:30.518013,0 days 00:00:25.598398,0.00041505235617558426,dart,0.5991509184172948,7.8495126331610905,depthwise,0.00025451415275412425,0.038284466551934127,2,11,0.21935615387605728,600,forest,0.612493244627144,0.9838426153108154,oversample,0.9486054321747781,1.7612949853569513,0.15996993680017646,uniform,0.4963364521627371,0.2732901027370386,0.8216808271061521,0.8260647010647011,0.612493244627144,0.7005843932622895,0.7036455607884179,0.9838426153108154,0.8252557196274148,0.816523633851195,0.585632183908046,0.5939340400471143,0.8716852010265184,0.8630723149336756,oversample,0.9269421247475635,0.9240420800187858,0.9486054321747781,COMPLETE
1603,0.6587706759240352,2025-09-23 21:23:30.652751,2025-09-23 21:23:47.653131,0 days 00:00:17.000380,0.0001871246587371504,dart,0.9184391286825376,7.547294799532812,depthwise,0.00151551312974909,0.39586795350192044,5,11,0.28942355843284384,500,forest,0.6543980323934158,0.6995225552247557,none,0.9892201959766574,3.0135014838081924,0.08534065733847043,weighted,0.8744228049635128,0.7835279357696945,0.8306889139113522,0.8289312039312039,0.6543980323934158,0.6682711592458885,0.6587706759240352,0.6995225552247557,0.7162940231743526,0.7052371675973291,0.629154078549849,0.630078125,0.7125748502994012,0.6902011125374412,none,0.8910948504974019,0.8894229421014224,0.9892201959766574,COMPLETE
1604,0.6976521322472449,2025-09-23 21:23:47.790703,2025-09-23 21:23:54.522082,0 days 00:00:06.731379,0.0018378959987586207,dart,0.7518259722144025,3.6599021179537656,lossguide,0.00019480559976620726,0.30717438476943976,9,10,3.029544325118986,300,forest,0.39624203155907733,0.8781183882544799,none,0.8396919430199201,0.6063654678874281,0.1668333763807447,weighted,0.7605413953587579,0.5874978965604221,0.8728631384993346,0.8708026208026208,0.39624203155907733,0.7042857142857143,0.6976521322472449,0.8781183882544799,0.8258143560790292,0.8185834679276993,0.7943071965628357,0.7925966249319543,0.6325919589392643,0.6230209670517758,none,0.9258442282630079,0.9242111723966612,0.8396919430199201,COMPLETE
1605,0.7076742823667252,2025-09-23 21:23:54.658799,2025-09-23 21:24:36.866155,0 days 00:00:42.207356,0.0001709885485484454,dart,0.9630770980843678,4.705373662998815,lossguide,0.00018802626602087175,0.00277313096684887,0,10,1.0549015201510576,700,forest,0.6285929390340559,0.7563735335705953,none,0.9471141420725805,3.3252731960177013,0.1821942938588109,uniform,0.5488439600339828,0.9828003180408088,0.8470672535571706,0.8467444717444718,0.6285929390340559,0.7088854247856586,0.7076742823667252,0.7563735335705953,0.8117584611092112,0.8054048716772255,0.6510379384395133,0.6508620689655172,0.7780153977758768,0.7753530166880617,none,0.9196887095524621,0.9175100699650305,0.9471141420725805,COMPLETE
1606,0.7241238793806031,2025-09-23 21:24:37.001788,2025-09-23 21:25:22.229869,0 days 00:00:45.228081,0.0026544944273017438,dart,0.7945951785933351,7.947778352115868,depthwise,0.003964686349863304,0.03321209818897154,3,12,0.4299292226547254,800,forest,0.6743678194366108,0.9091246553949079,none,0.9835442385378546,3.7010780339836638,0.18348235802948307,uniform,0.5522171670129215,0.540848185270485,0.8604770191421844,0.8613841113841114,0.6743678194366108,0.723361071646032,0.7241238793806031,0.9091246553949079,0.8266618384891068,0.8200109437245972,0.6882966396292005,0.691170750680669,0.7621899059024807,0.7603765511339324,none,0.9275523294491818,0.9253619967515145,0.9835442385378546,COMPLETE
1607,0.6519421172886519,2025-09-23 21:25:22.367133,2025-09-23 21:25:46.366165,0 days 00:00:23.999032,0.2191274422817385,dart,0.46925059941381275,1.3540446547837082,lossguide,0.00013216695411053152,0.02540840367175754,10,6,1.3788118098155162,600,forest,0.490881748907215,0.8051363648636632,none,0.7834331091364456,0.7875543958844927,0.23733510781838918,uniform,0.5296101420393398,0.40172857937681783,0.8616030299928344,0.8596437346437347,0.490881748907215,0.6609829488465396,0.6519421172886519,0.8051363648636632,0.8038852492906272,0.7931577873303778,0.7987878787878788,0.8014981273408239,0.5637296834901625,0.5494223363286265,none,0.9188370764094972,0.9147171809775596,0.7834331091364456,COMPLETE
1608,0.7175303197353914,2025-09-23 21:25:46.507351,2025-09-23 21:26:55.494445,0 days 00:01:08.987094,0.002563829078352083,dart,0.8769629553681758,7.724301802278756,depthwise,0.0032203811064062055,0.010026842826443241,5,10,0.2712059309237408,1000,forest,0.6991456145008539,0.9409085789057006,none,0.9351845023533539,3.2638691382321556,0.21534530832862125,uniform,0.5608415238524691,0.6689779797576832,0.8706111167980346,0.8688574938574939,0.6991456145008539,0.7221978021978022,0.7175303197353914,0.9409085789057006,0.8252297877757958,0.8181812045459923,0.7427667269439421,0.7402183803457689,0.7027373823781009,0.6961916987590928,none,0.9264994723627316,0.9243312616709874,0.9351845023533539,COMPLETE
1609,0.7182746004236472,2025-09-23 21:26:55.629866,2025-09-23 21:26:57.442210,0 days 00:00:01.812344,0.1040923052326976,gbtree,0.7632420679441106,8.423936744466088,depthwise,0.022430127827379683,0.010072019750749913,5,10,0.19407841127405742,1000,,0.63371835622572,0.8265941381421639,none,0.9680229975978382,3.7078765134827005,,,,0.3077712712980303,0.8489098167673252,0.8502252252252253,0.63371835622572,0.7183206106870229,0.7182746004236472,0.8265941381421639,0.826055731048178,0.8183794388697672,0.6485182632667126,0.6530112044817927,0.804961505560308,0.7980316645271716,none,0.9273894393576305,0.9247062419416239,0.9680229975978382,COMPLETE
1610,0.6990997229916898,2025-09-23 21:26:57.579193,2025-09-23 21:26:58.231023,0 days 00:00:00.651830,0.00021640788759961935,gbtree,0.6833931599028759,9.782666787992685,depthwise,0.2417726616478668,0.34403116609041773,2,12,0.18607129531666708,600,,0.6280300126660288,0.8543397494646087,undersample,0.8831467036030418,1.9376798397923338,,,,0.5822037668582939,0.8200429931415703,0.8220720720720721,0.6280300126660288,0.6983527796842828,0.6990997229916898,0.8543397494646087,0.8111783189724702,0.8054864414889793,0.5830945558739254,0.5870892701366677,0.8704020530367835,0.8639281129653402,undersample,0.9216846024198216,0.9200182975630832,0.8831467036030418,COMPLETE
1611,0.6761764223643221,2025-09-23 21:26:58.366508,2025-09-23 21:27:05.053980,0 days 00:00:06.687472,0.019915861074843107,dart,0.9770771160284929,5.604685987186647,lossguide,0.005399816196819345,0.015002509571464229,6,7,0.33596913211050194,300,forest,0.3934396895432762,0.819488713297532,undersample,0.9346984239375851,0.8166874706752415,0.18215138842000334,uniform,0.45681965043171396,0.6742936854607705,0.7926092742348244,0.7978091728091729,0.3934396895432762,0.674066924066924,0.6761764223643221,0.819488713297532,0.7959996081300428,0.783283834740516,0.5402269210933471,0.5481127060074429,0.8960650128314799,0.8823277706461276,undersample,0.915799061085396,0.9110944350843334,0.9346984239375851,COMPLETE
1612,0.6632098765432098,2025-09-23 21:27:05.189547,2025-09-23 21:27:29.677900,0 days 00:00:24.488353,0.0001442220635003385,dart,0.6084224761393062,6.669329692849342,depthwise,0.00011310402973584406,0.01675823218161438,1,11,0.11638858102369427,600,forest,0.6914167617924253,0.8640760901313189,none,0.995194142016877,1.9761051440128665,0.27691547868547095,uniform,0.5983122355680931,0.4474889965061714,0.8649810625447846,0.8603603603603603,0.6914167617924253,0.6786845310596833,0.6632098765432098,0.8640760901313189,0.8069440668550005,0.7944553060842265,0.7883418222976797,0.7840046701692936,0.5958083832335329,0.57466837826273,none,0.920500541105919,0.9157216294343848,0.995194142016877,COMPLETE
1613,0.7182165093392248,2025-09-23 21:27:29.815962,2025-09-23 21:27:33.546749,0 days 00:00:03.730787,0.04791845192852052,dart,0.6209630457632465,7.095672190489989,lossguide,0.0001960357956921919,0.23012432218108414,6,12,5.402661739583437,200,forest,0.6613936259591328,0.9472382721242932,none,0.9351892985501566,3.621549380242321,0.16700818542855622,uniform,0.5012574419588112,0.5174753921156396,0.8574060804585935,0.8563677313677314,0.6613936259591328,0.7196619038035822,0.7182165093392248,0.9472382721242932,0.8215070367571392,0.8160177044584709,0.6795895096921323,0.6767600302800908,0.7647562018819504,0.7650834403080873,none,0.9252416500409413,0.9233071198399977,0.9351892985501566,COMPLETE
1614,0.704955820207453,2025-09-23 21:27:33.683158,2025-09-23 21:27:42.296851,0 days 00:00:08.613693,0.0009565694197610556,dart,0.8511334529460333,5.4916785324589,lossguide,0.03723505586096218,0.031925770791958595,0,10,0.4563153828914158,300,forest,0.6687783443695757,0.9154622759472058,none,0.9015656398895611,4.99501313451057,0.17665299917457084,uniform,0.5594733099015194,0.9817090865237698,0.8432797625140751,0.8427518427518428,0.6687783443695757,0.711077561804114,0.704955820207453,0.9154622759472058,0.8156658631296443,0.809497567863755,0.6362715298885512,0.6395956779365632,0.8058169375534645,0.7851946940522037,none,0.9192608496600433,0.9183629600569426,0.9015656398895611,COMPLETE
1615,0.710226174366905,2025-09-23 21:27:42.433676,2025-09-23 21:27:46.145928,0 days 00:00:03.712252,1.1383036341317434,dart,0.7419189490044633,7.1931959142963215,lossguide,0.014900953603991678,0.03648815438179393,6,9,0.22111072039217036,200,forest,0.4737030751720554,0.8958376892531811,none,0.993472474798705,1.871445512749827,0.19021177794378716,uniform,0.6036662452168231,0.49654705529191484,0.8508547446002661,0.8465397215397216,0.4737030751720554,0.7192137213335903,0.710226174366905,0.8958376892531811,0.8241682160020443,0.8165609369202216,0.6545071904594879,0.6477433004231312,0.7981180496150556,0.7860504920838682,none,0.9256055914009688,0.9237432820113639,0.993472474798705,COMPLETE
1616,0.6775615130370914,2025-09-23 21:27:46.288172,2025-09-23 21:27:47.106347,0 days 00:00:00.818175,0.000470498407950303,gbtree,0.873004715938972,8.089180147825452,depthwise,0.0004199737879618424,0.17029935676572808,4,11,1.3299169500752863,800,,0.6450626884569005,0.9888991007668222,none,0.9708536167688143,4.471422291427687,,,,0.8359693595643887,0.8196335346504248,0.8202293202293203,0.6450626884569005,0.6785844582269245,0.6775615130370914,0.9888991007668222,0.7503808378200991,0.7447645533324966,0.5916030534351145,0.5934384046317144,0.795551753635586,0.7894736842105263,none,0.8996661789173254,0.899045199575936,0.9708536167688143,COMPLETE
1617,0.7053830690194327,2025-09-23 21:27:47.245919,2025-09-23 21:27:49.881494,0 days 00:00:02.635575,2.7762381781596006,gbtree,0.9615748689341058,0.545845284965234,lossguide,0.003979983566436498,0.09173002559400688,6,8,0.14238334621110713,700,,0.3603888655726911,0.9532957749013288,none,0.9808458325190987,0.6153238800525571,,,,0.750546079335863,0.8655952502815027,0.86496723996724,0.3603888655726911,0.7081573683040676,0.7053830690194327,0.9532957749013288,0.8170852684800696,0.8099512577091077,0.7371587228135122,0.7378504672897196,0.6813515825491874,0.6756525459991441,none,0.9227741241664545,0.9200017712520154,0.9808458325190987,COMPLETE
1618,0.7180819180819181,2025-09-23 21:27:50.021645,2025-09-23 21:27:50.815478,0 days 00:00:00.793833,0.00012415848162227648,gbtree,0.8575184319649354,8.910740812215868,depthwise,0.0031058702275774367,0.16057133730269477,8,12,0.7236279345906731,700,,0.5708216330290511,0.976741571324266,none,0.8839409919671446,2.458518987186902,,,,0.43429756582174583,0.8537209540382844,0.8555487305487306,0.5708216330290511,0.71652449910732,0.7180819180819181,0.976741571324266,0.8203296287476999,0.8151092236114001,0.6681465038845728,0.6735382308845578,0.7724550898203593,0.7689345314505777,none,0.9242570283621004,0.922997755358426,0.8839409919671446,COMPLETE
1619,0.6,2025-09-23 21:27:50.952222,2025-09-23 21:28:36.901624,0 days 00:00:45.949402,0.0028465284211417943,dart,0.20000487731531957,6.502035652154929,lossguide,0.004816979002507811,0.0007946394077027303,7,10,0.80910918627115,800,forest,0.4266420440049134,0.88330777523407,none,0.9974975893816637,3.20632406850392,0.1442193064593201,uniform,0.367011311723311,0.6936684809989748,0.6835909509673457,0.6904176904176904,0.4266420440049134,0.5934499539655399,0.6,0.88330777523407,0.7664817708749555,0.7575880717787036,0.4284900284900285,0.43423319931074095,0.9649272882805817,0.9704749679075738,none,0.9041973438209228,0.9039891290271295,0.9974975893816637,COMPLETE
