number,value,datetime_start,datetime_complete,duration,params_alpha,params_booster,params_colsample_bytree,params_gamma,params_grow_policy,params_lambda,params_learning_rate,params_max_delta_step,params_max_depth,params_min_child_weight,params_n_estimators,params_normalize_type,params_params_decision_threshold,params_params_feature_fraction,params_params_resampling,params_params_sample_rows,params_params_scale_pos_weight,params_rate_drop,params_sample_type,params_skip_drop,params_subsample,user_attrs_acc_test,user_attrs_acc_val,user_attrs_decision_threshold,user_attrs_f1_test,user_attrs_f1_val,user_attrs_feature_fraction,user_attrs_pr_auc_test,user_attrs_pr_auc_val,user_attrs_prec_test,user_attrs_prec_val,user_attrs_rec_test,user_attrs_rec_val,user_attrs_resampling_strategy,user_attrs_roc_auc_test,user_attrs_roc_auc_val,user_attrs_sample_rows,state
2885,0.683049147442327,2025-09-24 02:56:13.486199,2025-09-24 02:56:14.502869,0 days 00:00:01.016670,0.00016436369872546502,gbtree,0.34021158754172687,2.583151336560186,depthwise,0.14916669862957482,0.06489347959253641,4,10,0.8106466080578304,600,,0.5765574522538552,0.9886494483118285,none,0.9356475644909477,1.0096759896774812,,,,0.7742866948602204,0.8712253045347528,0.8705978705978706,0.5765574522538552,0.685027541311968,0.683049147442327,0.9886494483118285,0.829715797108844,0.8255780797484262,0.8260869565217391,0.824954572986069,0.5851154833190761,0.582798459563543,none,0.9286721268806756,0.927394445098011,0.9356475644909477,COMPLETE
2886,0.7159401979364076,2025-09-24 02:56:14.656659,2025-09-24 02:56:15.383926,0 days 00:00:00.727267,0.00021204020331759394,gbtree,0.3173681664321176,3.3721416263344914,depthwise,0.055209141749169154,0.22228797883821436,8,8,0.23601664251081964,300,,0.4184273868333188,0.9519940981710999,none,0.9880502236793003,1.1943953882028746,,,,0.7900799029269787,0.8596581021598936,0.8618959868959869,0.4184273868333188,0.7152647975077882,0.7159401979364076,0.9519940981710999,0.818592458080621,0.8140099404314447,0.6951958013726282,0.7048092868988391,0.7365269461077845,0.727428326914848,none,0.9221928425287955,0.9207135254957505,0.9880502236793003,COMPLETE
2887,0.713273931916838,2025-09-24 02:56:15.537170,2025-09-24 02:56:16.268736,0 days 00:00:00.731566,0.00013771284110211714,gbtree,0.2343634364809541,3.6858775016420102,depthwise,0.19479105985104522,0.26386849572809806,2,3,0.13697380320654418,400,,0.5581200243910702,0.9325249453964383,none,0.9967193567946198,1.4106358231723717,,,,0.826208474252818,0.8721465861398301,0.8715192465192465,0.5581200243910702,0.7165872475606989,0.713273931916838,0.9325249453964383,0.8267469309410208,0.8217901047971957,0.7631706138231029,0.7651960784313725,0.6753635585970915,0.6679503637141635,none,0.9267198632321838,0.9261706631260054,0.9967193567946198,COMPLETE
2888,0.7194066749072929,2025-09-24 02:56:16.421111,2025-09-24 02:56:17.202528,0 days 00:00:00.781417,0.0002206526997744253,gbtree,0.3961997955475256,5.967601535041986,lossguide,0.7934124957339638,0.2603037556147783,6,6,0.1893378199600841,300,,0.6002464161694171,0.9408025828763741,none,0.9806404400254225,2.3717831698581042,,,,0.3412245185648685,0.8555635172484389,0.8605651105651105,0.6002464161694171,0.7113929228881162,0.7194066749072929,0.9408025828763741,0.8123471380994829,0.8110444228415148,0.6816934535476283,0.6936829558998808,0.743798118049615,0.7471116816431322,none,0.9197846592989695,0.91951948512537,0.9806404400254225,COMPLETE
2889,0.6933171815061578,2025-09-24 02:56:17.358645,2025-09-24 02:56:18.278585,0 days 00:00:00.919940,0.00015868657269928516,gbtree,0.4575248089087552,4.3506800008727025,depthwise,0.08852557678575239,0.31038844431685936,6,9,0.10705522143165323,600,,0.5609239471120966,0.8760596222089754,none,0.9759471272484103,2.199039360987767,,,,0.5693957006394956,0.8481932644078206,0.8444922194922195,0.5609239471120966,0.7028651572831096,0.6933171815061578,0.8760596222089754,0.7909815760510084,0.7801509744635612,0.661138333961553,0.6563455657492355,0.7502138579982891,0.7347026101839966,none,0.912556224421795,0.9081682991149442,0.9759471272484103,COMPLETE
2890,0.706283280085197,2025-09-24 02:56:18.436108,2025-09-24 02:56:19.905469,0 days 00:00:01.469361,0.0035716458492029536,gbtree,0.40384251105399105,0.47171613006727986,lossguide,2.013472487524778,0.34667071880311306,6,6,0.2413650995571987,400,,0.6681182247802196,0.9269263267443117,none,0.9405730956573449,3.640735970294808,,,,0.8915091571251641,0.8566895280990889,0.8588247338247338,0.6681182247802196,0.7016197783461211,0.706283280085197,0.9269263267443117,0.8069768573932481,0.8055209640346819,0.6992353440951572,0.7031382527565734,0.7040205303678357,0.709456568249893,none,0.9167216636569412,0.9155356652476496,0.9405730956573449,COMPLETE
2891,0.7005006041774555,2025-09-24 02:56:20.059225,2025-09-24 02:56:20.794625,0 days 00:00:00.735400,0.00016949774434951609,gbtree,0.27816114676888154,6.365602965518553,depthwise,0.8026553692668802,0.11479116858136813,3,6,5.696239468048884,400,,0.5743009280479074,0.9334204372029006,undersample,0.9149291961151912,1.412886680147773,,,,0.783217018633808,0.8183027945542021,0.8223791973791974,0.5743009280479074,0.6975634690747998,0.7005006041774555,0.9334204372029006,0.8160440280501418,0.8093784306595486,0.5797224582271311,0.5870949074074074,0.8755346449957229,0.8682071031236628,undersample,0.9226722171321466,0.9215700721059651,0.9149291961151912,COMPLETE
2892,0.722652372443915,2025-09-24 02:56:20.951050,2025-09-24 02:56:22.570644,0 days 00:00:01.619594,0.00018577723754356436,gbtree,0.34026871522880536,0.42119117653946736,lossguide,1.6435115496550632,0.13083635191585385,2,7,0.278707657902822,300,,0.6063243770169483,0.9860060477583554,none,0.997375059971511,3.448519867735129,,,,0.633976599432213,0.8532091309243526,0.8569819819819819,0.6063243770169483,0.7159270998415214,0.722652372443915,0.9860060477583554,0.8208416847776437,0.8200571742777296,0.6667896678966789,0.674074074074074,0.7728828058169376,0.7787762088147198,none,0.9244072556196794,0.9242377181437073,0.997375059971511,COMPLETE
2893,0.7285251215559158,2025-09-24 02:56:22.726494,2025-09-24 02:56:23.537593,0 days 00:00:00.811099,0.0012714419731902067,gbtree,0.42107936545157804,3.6572718627171024,depthwise,0.2393604889095781,0.12326531896330566,4,6,0.3492490827423373,300,,0.5247331524508378,0.9171802209630325,none,0.9974889311282865,1.9804453036482694,,,,0.6208108445131326,0.8603746545193981,0.8628173628173628,0.5247331524508378,0.725332259363673,0.7285251215559158,0.9171802209630325,0.827801372719579,0.8220719281771878,0.6853120243531202,0.6918045402077723,0.7703165098374679,0.76936243046641,none,0.9278202635043656,0.9260368115229503,0.9974889311282865,COMPLETE
2894,0.7175776042658542,2025-09-24 02:56:23.694049,2025-09-24 02:56:24.652924,0 days 00:00:00.958875,0.00016697806879106792,gbtree,0.44009327621057426,2.6356586454128847,depthwise,0.022341752468529593,0.15141580519520992,4,6,2.168752944773967,600,,0.5713781394096217,0.958375967308953,oversample,0.8805939434501999,1.0996821955489453,,,,0.6002687548180917,0.8430750332685024,0.8481777231777232,0.5713781394096217,0.7097140693050559,0.7175776042658542,0.958375967308953,0.8204584189247677,0.8159390649306308,0.636765205572545,0.6465339739190117,0.8015397775876818,0.8061617458279846,oversample,0.9240791443239594,0.9226307215370138,0.8805939434501999,COMPLETE
2895,0.6953582694907616,2025-09-24 02:56:24.806976,2025-09-24 02:56:25.636848,0 days 00:00:00.829872,0.0018906319667050383,gbtree,0.34675445246545056,4.68558069496406,depthwise,0.35323210988879566,0.008508737885698473,5,7,0.20869720836091263,200,,0.5190817602748969,0.9737002603639693,none,0.9540535619591273,1.8739787056818433,,,,0.729542484387985,0.8634455932029891,0.8615888615888616,0.5190817602748969,0.7008968609865471,0.6953582694907616,0.9737002603639693,0.7970366359582255,0.7907182266322546,0.736569274269557,0.7344121846739647,0.6685201026518391,0.6602481814291827,none,0.9151156134009162,0.9140808316270062,0.9540535619591273,COMPLETE
2896,0.7060164083865087,2025-09-24 02:56:25.789979,2025-09-24 02:56:26.596712,0 days 00:00:00.806733,0.02748968085514052,gbtree,0.46200752124014893,3.023094664210097,depthwise,0.19901105142784198,0.1959998030787027,7,7,0.4440071769990886,300,,0.6108839867711502,0.9638601345970172,none,0.7953656271371301,1.7079831797198664,,,,0.5515260718302257,0.8671307196232982,0.8679361179361179,0.6108839867711502,0.7054017249205629,0.7060164083865087,0.9638601345970172,0.8180774631585431,0.8168081100273852,0.7514506769825918,0.7552413456850317,0.6646706586826348,0.6628155755241762,none,0.9233009556180334,0.9232166857928488,0.7953656271371301,COMPLETE
2897,0.6914723161830159,2025-09-24 02:56:26.750888,2025-09-24 02:56:27.521974,0 days 00:00:00.771086,0.00015556801764505377,gbtree,0.42412809678584773,2.899908700938936,depthwise,34.59581130192465,0.0925772258937853,7,3,0.3699540680204794,400,,0.5321247389681419,0.7640822094385431,none,0.8164676180173046,3.339130673722213,,,,0.4617097885459915,0.8237281195618794,0.8225839475839476,0.5321247389681419,0.6965103983080719,0.6914723161830159,0.7640822094385431,0.805343489184908,0.8009038480161355,0.592326139088729,0.5920731707317073,0.8451668092386655,0.8309798887462558,none,0.9169328451925953,0.9148542860181592,0.8164676180173046,COMPLETE
2898,0.6686889113582744,2025-09-24 02:56:27.679022,2025-09-24 02:56:28.454074,0 days 00:00:00.775052,0.0001106054044936006,gbtree,0.4550709782965743,0.3657545229401171,lossguide,2.8409748966952244,0.43653405703264736,3,3,0.12815225734552832,300,,0.5527283718717731,0.9675550102918516,none,0.8887809418428787,4.691446792853244,,,,0.7241421070031121,0.7910738048930289,0.7987305487305487,0.5527283718717731,0.6598900183302783,0.6686889113582744,0.9675550102918516,0.740225014940454,0.7416397187181163,0.5405405405405406,0.5515707534056158,0.8468776732249786,0.848951647411211,none,0.8958125907479119,0.896264921257886,0.8887809418428787,COMPLETE
2899,0.7206963249516442,2025-09-24 02:56:28.609803,2025-09-24 02:56:29.602076,0 days 00:00:00.992273,0.0016463824512022902,gbtree,0.3751414161626421,1.7129719056935193,depthwise,0.005576797064322909,0.1405080731848112,6,6,5.005845947799942,700,,0.5303299525849259,0.8958090334485049,none,0.9426446515624155,2.5203245460020307,,,,0.8894908216448068,0.8486027228989661,0.8521703521703522,0.5303299525849259,0.7156316093059027,0.7206963249516442,0.8958090334485049,0.8234607152413085,0.8198102665299412,0.6500174641983933,0.6576067772679138,0.7959794696321643,0.7971758664955071,none,0.9253893159525576,0.9247142171823309,0.9426446515624155,COMPLETE
2900,0.7048118985126859,2025-09-24 02:56:29.755236,2025-09-24 02:56:30.578622,0 days 00:00:00.823386,0.007288042549801493,gbtree,0.28139231111222324,4.695720531027091,depthwise,0.5160742005937803,0.11044910182709258,3,6,3.0585863006835643,400,,0.46462941036162003,0.7763808525119283,none,0.851059713743914,3.177528791073736,,,,0.6344298948539349,0.8261848705087522,0.8272932022932022,0.46462941036162003,0.7065330107155202,0.7048118985126859,0.7763808525119283,0.8248039947623631,0.8208972762662636,0.5928074245939675,0.596210775606868,0.874251497005988,0.8617886178861789,none,0.9268698026980814,0.9258732471097526,0.851059713743914,COMPLETE
2901,0.7178387650085764,2025-09-24 02:56:30.730552,2025-09-24 02:56:31.439668,0 days 00:00:00.709116,0.0003296827455617159,gbtree,0.2964432446232529,4.5786905313136845,depthwise,0.08192756971256847,0.23024873509663268,2,9,0.4617997332917489,300,,0.5294816055044839,0.9675823237695915,none,0.8556565743510708,1.6361939124202258,,,,0.9299033326119277,0.8670283550005118,0.8652743652743653,0.5294816055044839,0.7223765761914939,0.7178387650085764,0.9675823237695915,0.8253387928890987,0.8206949927459364,0.7219137120888509,0.7193811774817361,0.7228400342172797,0.7163029525032092,none,0.9264809097992952,0.9253031757523661,0.8556565743510708,COMPLETE
2902,0.7096890167175984,2025-09-24 02:56:31.590747,2025-09-24 02:56:32.562311,0 days 00:00:00.971564,0.0010955194786241745,gbtree,0.2237594128112163,5.014998649200532,depthwise,0.027068430113942953,0.03459432061338249,5,8,1.3639194443451048,400,,0.4873898123948442,0.8921694328626083,none,0.9712698827385325,2.793650981045737,,,,0.44016705582023097,0.8309960077797113,0.8346642096642096,0.4873898123948442,0.7058613931943702,0.7096890167175984,0.8921694328626083,0.8234369996051267,0.8179288315813678,0.6048854961832061,0.6119032858028518,0.8473053892215568,0.8446726572528883,none,0.9255838631290392,0.9244413890923008,0.9712698827385325,COMPLETE
2903,0.6955941255006676,2025-09-24 02:56:32.715666,2025-09-24 02:56:33.458974,0 days 00:00:00.743308,0.00022825620216082465,gbtree,0.4796571074335143,1.7551761699481547,depthwise,0.008133814656463187,0.059410361846791736,3,5,0.5196236330403197,200,,0.4036812169740734,0.9214522134059973,none,0.9462620541591672,2.9263380494562425,,,,0.6567311766156282,0.808475790766711,0.8132678132678133,0.4036812169740734,0.6930270713699754,0.6955941255006676,0.9214522134059973,0.8264577701331899,0.8211856396685018,0.5621506521160501,0.5701778385772914,0.9033361847733106,0.8917415489944374,none,0.9274653875822956,0.9254938329507809,0.9462620541591672,COMPLETE
2904,0.7200647249190939,2025-09-24 02:56:33.610470,2025-09-24 02:56:34.345721,0 days 00:00:00.735251,0.003601671744400871,gbtree,0.24519242504415467,2.2331442272847704,depthwise,0.10512777079516095,0.22624482774989718,5,6,0.526660535705262,200,,0.5307263155810846,0.8709008361593735,none,0.9552358453334319,2.1337969427322023,,,,0.7770435768520059,0.8548469648889344,0.8583128583128583,0.5307263155810846,0.7161729383506805,0.7200647249190939,0.8709008361593735,0.8251377105853845,0.8214505258141801,0.6730624529721595,0.682777138473341,0.7651839178785287,0.7616602481814292,none,0.9256167001598625,0.9252658044078264,0.9552358453334319,COMPLETE
2905,0.6226978596316576,2025-09-24 02:56:34.502753,2025-09-24 02:57:14.904713,0 days 00:00:40.401960,0.03360269323000047,dart,0.7333592287171827,0.39577718562798037,depthwise,37.30757618958425,0.0019807063100852657,3,3,11.158671576863613,800,forest,0.48245186438207277,0.6248596192798571,none,0.5834396622510014,1.4162227721252312,0.29178509185949414,weighted,0.7272946799439323,0.9335389978484683,0.8498310983724024,0.8447993447993448,0.48245186438207277,0.6396462785556374,0.6226978596316576,0.6248596192798571,0.7539499794571167,0.7443752229703592,0.7512983266012695,0.7441998810232004,0.5568862275449101,0.5353016688061617,none,0.8929678850960631,0.889520055772557,0.5834396622510014,COMPLETE
2906,0.6390275667462557,2025-09-24 02:57:15.062682,2025-09-24 02:57:16.102750,0 days 00:00:01.040068,0.00014179103261094362,gbtree,0.5595883822143141,0.14492412148660128,depthwise,14.674701435975651,0.3983837047456186,5,7,0.19904533738373612,300,,0.5684691693825813,0.9394569347300175,none,0.867588615840666,1.9575345324799664,,,,0.7619986600387821,0.8325314771215068,0.8297502047502048,0.5684691693825813,0.645273200346921,0.6390275667462557,0.9394569347300175,0.7185286998092093,0.709360593189231,0.6543535620052771,0.6484581497797357,0.6364414029084687,0.629867351305092,none,0.8846674262064717,0.8832793579407225,0.867588615840666,COMPLETE
2907,0.712563915266618,2025-09-24 02:57:16.256404,2025-09-24 02:57:17.045726,0 days 00:00:00.789322,0.05992274006717032,gbtree,0.3787278725632804,3.548067904571908,depthwise,3.721702989472129,0.20660346072764715,2,5,0.17460138166863384,400,,0.4368064249379935,0.8933073663723381,none,0.9977732761556336,2.1821528700778297,,,,0.7194184315743191,0.8362166035418159,0.8388615888615889,0.4368064249379935,0.711087035030697,0.712563915266618,0.8933073663723381,0.8264746112619291,0.818825528401691,0.6153125,0.621535520866518,0.8421727972626176,0.8348309798887462,none,0.9273828201489632,0.9246860879037365,0.9977732761556336,COMPLETE
2908,0.719650307967415,2025-09-24 02:57:17.201590,2025-09-24 02:57:17.901524,0 days 00:00:00.699934,0.0009737187311222326,gbtree,0.3658494775191121,6.685211620445922,depthwise,0.3534472513487197,0.3437892829194712,6,8,1.1168787435276215,300,,0.5412524298995399,0.9502107976878155,none,0.9425667054797319,2.26101123240692,,,,0.8159034727109041,0.8541304125294298,0.8555487305487306,0.5412524298995399,0.7200942840306424,0.719650307967415,0.9502107976878155,0.8249560448462243,0.8186712074992034,0.6658191064293498,0.6717359050445104,0.7840034217279727,0.7749251176722294,none,0.9261097736472381,0.9244893269109901,0.9425667054797319,COMPLETE
2909,0.7029411764705882,2025-09-24 02:57:18.056581,2025-09-24 02:57:18.994155,0 days 00:00:00.937574,0.00033286289002084924,gbtree,0.3848784731018208,3.1084643808879124,lossguide,11.455721812192504,0.030537164528099944,6,3,0.20254390194574595,600,,0.5527114845122962,0.8445198018287308,none,0.9530889068942938,3.21306002587704,,,,0.6039188121640089,0.8330433002354386,0.8345618345618345,0.5527114845122962,0.7047963800904977,0.7029411764705882,0.8445198018287308,0.812995760576129,0.8072456556727292,0.6109193598995921,0.6161778923622301,0.8327630453378957,0.8181429182712879,none,0.9213298703935919,0.9200375878564897,0.9530889068942938,COMPLETE
2910,0.609322974472808,2025-09-24 02:57:19.148230,2025-09-24 02:57:19.870667,0 days 00:00:00.722437,0.00033188624497012533,gbtree,0.2470800153108666,4.104623155752473,depthwise,0.1437307583860838,0.40471271422732985,6,7,0.2240368807751559,400,,0.646591440137953,0.8618673305635404,none,0.8586521795459022,0.8752378338243565,,,,0.6049639021728493,0.8619101238611936,0.8558558558558559,0.646591440137953,0.6313200327958458,0.609322974472808,0.8618673305635404,0.8196158868049055,0.8156043957126897,0.874337623012869,0.8666140489344909,0.4940119760479042,0.46983311938382544,none,0.9237138215638622,0.9230602616673597,0.8586521795459022,COMPLETE
2911,0.6961538461538461,2025-09-24 02:57:20.024341,2025-09-24 02:57:20.770571,0 days 00:00:00.746230,0.00020999001165900318,gbtree,0.41379563966502814,4.083026746525329,depthwise,0.002065292121429251,0.06654592082203512,3,5,2.6049183726333545,200,,0.5479240884853873,0.8571095207719176,none,0.9090396548284126,1.1575142250189498,,,,0.7170684724192782,0.8741938785955574,0.8705978705978706,0.5479240884853873,0.7067525650202816,0.6961538461538461,0.8571095207719176,0.8259737434641276,0.8201566034470311,0.7992444684295736,0.7942951179374658,0.6334473909324209,0.6195977749251177,none,0.9265181500428407,0.9252572821289482,0.9090396548284126,COMPLETE
2912,0.6355113636363636,2025-09-24 02:57:20.925798,2025-09-24 02:57:21.836828,0 days 00:00:00.911030,0.021875808428974013,gbtree,0.45914834223963163,4.631528464336624,depthwise,25.208801683808275,0.11177178829947008,5,6,0.1307879482227753,400,,0.4146223353465007,0.9597359523096798,oversample,0.9877059841664003,3.3336122996693502,,,,0.41330970749362594,0.7313952298085782,0.7373054873054873,0.4146223353465007,0.6309423347398031,0.6355113636363636,0.9597359523096798,0.8197633399522244,0.8126100381512137,0.4700335289186924,0.47565383797576016,0.9593669803250642,0.9572100984167736,oversample,0.9254344992465037,0.9233482052858054,0.9877059841664003,COMPLETE
2913,0.7179095937440396,2025-09-24 02:57:21.989651,2025-09-24 02:57:22.818269,0 days 00:00:00.828618,0.0016005997170206543,gbtree,0.3384924050610827,4.131845776851363,lossguide,1.0382421867229021,0.13544673043015937,6,6,0.10823564670790616,200,,0.5778305503653253,0.9685787987567245,none,0.9616750153381233,3.1969536179381413,,,,0.8350823400866249,0.8487050875217524,0.8485872235872236,0.5778305503653253,0.7207105064247922,0.7179095937440396,0.9685787987567245,0.8285572087388748,0.8225843100517353,0.6455653351387949,0.64762560220234,0.8156544054747648,0.80530594779632,none,0.927946316260725,0.9263267129622191,0.9616750153381233,COMPLETE
2914,0.6786843769765971,2025-09-24 02:57:22.972644,2025-09-24 02:57:29.664775,0 days 00:00:06.692131,0.013215062966854502,dart,0.3682556571498837,3.4320592229994498,depthwise,0.4715344224552634,0.11997795290847806,2,7,0.27359430521578254,300,tree,0.3968953966314921,0.8713710373476314,undersample,0.9441680177879422,1.1625806533586138,0.23521441793995873,weighted,0.7894786936182329,0.6909331094883769,0.7847271982802744,0.7919737919737919,0.3968953966314921,0.6725829051844933,0.6786843769765971,0.8713710373476314,0.8199901534653591,0.814826133168733,0.5287637698898409,0.5382493102583396,0.9238665526090676,0.9182712879760376,undersample,0.9256957565346842,0.9235638246997178,0.9441680177879422,COMPLETE
2915,0.6845767298028604,2025-09-24 02:57:29.816134,2025-09-24 02:57:31.174572,0 days 00:00:01.358438,0.0003918834250730189,gbtree,0.3762232541944331,4.129812568528513,lossguide,0.1707132649989556,0.04637099118728975,4,7,0.11621345754388084,500,,0.5424925256226039,0.8461764075007567,none,0.9006614678169438,2.2575025712876564,,,,0.6505501212049368,0.8315078308936431,0.8329238329238329,0.5424925256226039,0.6835832372164552,0.6845767298028604,0.8461764075007567,0.7569145386545917,0.7522191653345167,0.6208100558659218,0.6242509693338033,0.7604790419161677,0.7578091570389388,none,0.9022717296821088,0.9037741430258363,0.9006614678169438,COMPLETE
2916,0.6735132553140674,2025-09-24 02:57:31.332377,2025-09-24 02:57:32.083480,0 days 00:00:00.751103,0.0010133741167872158,gbtree,0.42448795057832756,0.5915197287483025,depthwise,2.0963279350521122,0.021861545537326003,1,5,0.4509061942618038,200,,0.541745279400396,0.9403824421659372,none,0.9606535677841187,1.3356169946797383,,,,0.4938998450117209,0.8623195823523391,0.860053235053235,0.541745279400396,0.6807500593401377,0.6735132553140674,0.9403824421659372,0.7999631485294001,0.794303365952747,0.7648,0.7621621621621621,0.613344739093242,0.6033376123234917,none,0.916504870183504,0.9156520980036734,0.9606535677841187,COMPLETE
