number,value,datetime_start,datetime_complete,duration,params_alpha,params_booster,params_colsample_bytree,params_gamma,params_grow_policy,params_lambda,params_learning_rate,params_max_delta_step,params_max_depth,params_min_child_weight,params_n_estimators,params_normalize_type,params_params_decision_threshold,params_params_feature_fraction,params_params_resampling,params_params_sample_rows,params_params_scale_pos_weight,params_rate_drop,params_sample_type,params_skip_drop,params_subsample,user_attrs_acc_test,user_attrs_acc_val,user_attrs_decision_threshold,user_attrs_f1_test,user_attrs_f1_val,user_attrs_feature_fraction,user_attrs_pr_auc_test,user_attrs_pr_auc_val,user_attrs_prec_test,user_attrs_prec_val,user_attrs_rec_test,user_attrs_rec_val,user_attrs_resampling_strategy,user_attrs_roc_auc_test,user_attrs_roc_auc_val,user_attrs_sample_rows,state
62,0.0,2025-09-23 12:06:11.709386,2025-09-23 12:06:44.761250,0 days 00:00:33.051864,0.0864473754534157,dart,0.6709112002335893,0.20950069267730465,depthwise,0.029491243275404203,0.0011577598613864803,6,4,2.344827385218518,700,tree,0.698326117183854,0.8596945310019868,oversample,0.7357286596771326,0.6734816471274722,0.3198111214818708,weighted,0.853686271015957,0.3949423002249858,0.7606715119254785,0.7607493857493858,0.698326117183854,0.0,0.0,0.8596945310019868,0.7759295583702114,0.766294224938734,0.0,0.0,0.0,0.0,oversample,0.9032156000588938,0.8997931447134203,0.7357286596771326,COMPLETE
63,0.5875564475664827,2025-09-23 12:06:44.881119,2025-09-23 12:06:45.497034,0 days 00:00:00.615915,2.318791274884052,gbtree,0.5440927875013919,3.1673066655345625,lossguide,0.5757565081206152,0.008809505792143955,5,4,0.2663494639719181,400,,0.687682348687074,0.616386336090556,oversample,0.5067543533133594,0.9217275146355038,,,,0.219418163697649,0.8332480294810114,0.8316953316953317,0.687682348687074,0.597479614529281,0.5875564475664827,0.616386336090556,0.6946720570108854,0.6819689859204063,0.7074312463428906,0.7101273499090358,0.5171086398631308,0.5010697475395807,oversample,0.8782368074278804,0.8782862814285666,0.5067543533133594,COMPLETE
64,0.6199862164024811,2025-09-23 12:06:45.616178,2025-09-23 12:07:32.958711,0 days 00:00:47.342533,0.11676985083856073,dart,0.24086038413540545,0.05310047614667801,depthwise,0.0001169851593786895,0.04051181825526435,1,8,1.802646587299523,800,tree,0.4058598392011201,0.5704787382618468,oversample,0.8197313872370051,4.721333563604857,0.0003321092951022453,uniform,0.8475010158507807,0.2666327837751994,0.7152216194083325,0.7177518427518428,0.4058598392011201,0.6182766190998902,0.6199862164024811,0.5704787382618468,0.8206595201319401,0.8102717933797624,0.45515151515151514,0.45729971533143554,0.9636441402908469,0.9623448866067608,oversample,0.9243001683351101,0.9204784142480524,0.8197313872370051,COMPLETE
65,0.6867343367168358,2025-09-23 12:07:33.076492,2025-09-23 12:07:33.645898,0 days 00:00:00.569406,0.0005268222027524295,gbtree,0.908017480969445,5.24577067478626,lossguide,0.013345932714603697,0.039124069766745234,0,3,54.93549253933805,700,,0.6868219672308877,0.9140733066083475,undersample,0.7762195294958165,2.060762889762946,,,,0.8039208833100546,0.8119561879414474,0.8167485667485668,0.6868219672308877,0.6839841734044383,0.6867343367168358,0.9140733066083475,0.7931598579453807,0.7861939971256282,0.5720863309352519,0.5809890435297601,0.8502994011976048,0.8395378690629012,undersample,0.9138361779238686,0.9118411421880618,0.7762195294958165,COMPLETE
66,0.6442669880970318,2025-09-23 12:07:33.767444,2025-09-23 12:07:34.382643,0 days 00:00:00.615199,0.01401352215547446,gbtree,0.5530993146659889,2.0279604118699526,lossguide,0.03479571942742212,0.005590419984079762,0,3,2.064276368752705,600,,0.6624925679149136,0.8154159042049018,undersample,0.7762906662552522,3.275927711899137,,,,0.3309474089213188,0.753505988330433,0.7582923832923832,0.6624925679149136,0.6421991084695394,0.6442669880970318,0.8154159042049018,0.7675419355725476,0.7581498939397915,0.4920309653916211,0.4972093023255814,0.9242942686056459,0.9148480958493795,undersample,0.905827913928185,0.9018519948495491,0.7762906662552522,COMPLETE
67,0.6572902015939991,2025-09-23 12:07:34.503782,2025-09-23 12:07:35.179306,0 days 00:00:00.675524,0.00960823099641637,gbtree,0.4246875957057942,1.9891133466685962,depthwise,54.542991940364736,0.01436192943554713,3,4,0.10143641847930975,700,,0.6167045684721484,0.698512916141337,undersample,0.6961594700327297,0.6414097079178942,,,,0.7107120846215589,0.8530044016787798,0.8503276003276004,0.6167045684721484,0.667900092506938,0.6572902015939991,0.698512916141337,0.7751088780397548,0.7681239117552598,0.7270896273917422,0.7268014515292898,0.6176218990590248,0.5999144201968335,undersample,0.9003637571733516,0.90127933225872,0.6961594700327297,COMPLETE
68,0.0,2025-09-23 12:07:35.298052,2025-09-23 12:07:51.014163,0 days 00:00:15.716111,6.331893790349787,dart,0.45324016802166933,2.3057128969382,depthwise,0.004095002512330361,0.00012328483995300643,6,10,7.979225961588247,500,tree,0.5362341516191734,0.7431360431646574,none,0.8993446244419514,1.3630178547094354,0.3755161497674594,weighted,0.1403801352310109,0.9644547151843368,0.7606715119254785,0.7607493857493858,0.5362341516191734,0.0,0.0,0.7431360431646574,0.7826451294988497,0.7730869458158468,0.0,0.0,0.0,0.0,none,0.909369996381883,0.9073757847622461,0.8993446244419514,COMPLETE
69,0.491566265060241,2025-09-23 12:07:51.136334,2025-09-23 12:08:33.822410,0 days 00:00:42.686076,35.67550683391042,dart,0.538443552132897,1.355484331085064,lossguide,2.096983991405113,0.0009455157342352468,7,6,68.21457148043503,800,tree,0.4478094160558598,0.6996111918289547,none,0.7802252943548902,1.1991234831810744,0.3247671120876484,uniform,0.8351785499385221,0.7317324692275509,0.8285392568328386,0.8271908271908271,0.4478094160558598,0.4995518374663878,0.491566265060241,0.6996111918289547,0.749329513126763,0.744885651616672,0.8285431119920713,0.8301119023397762,0.3575705731394354,0.3491655969191271,none,0.8975191954173434,0.8959316310541938,0.7802252943548902,COMPLETE
70,0.6547546941247728,2025-09-23 12:08:33.939436,2025-09-23 12:09:22.665853,0 days 00:00:48.726417,0.00039053702385850094,dart,0.23294383306249733,5.488492673993047,depthwise,7.786642651578749,0.02602714481966573,0,11,1.0786175791988533,900,tree,0.693199653966613,0.729106129879306,undersample,0.9963334967321331,4.799740764457623,0.31358035573092913,uniform,0.4522077668816075,0.8408599042042437,0.7591360425836831,0.7665847665847666,0.693199653966613,0.648438667264306,0.6547546941247728,0.729106129879306,0.7979446038771785,0.7915751266220722,0.49827784156142363,0.5066791656901805,0.9281437125748503,0.9251176722293539,undersample,0.9139611370718395,0.9139423733867197,0.9963334967321331,COMPLETE
71,0.38612143742255267,2025-09-23 12:09:22.783080,2025-09-23 12:09:23.529130,0 days 00:00:00.746050,0.03540980435450469,gbtree,0.521350548003191,3.576390348482188,depthwise,0.00010664218161943019,0.0002440145465951604,3,4,0.22370507532143133,700,,0.36772507621744027,0.7560403579618923,none,0.5756151124870426,4.613866003743471,,,,0.7313576840649192,0.23932848807452145,0.23925061425061425,0.36772507621744027,0.3862228462872718,0.38612143742255267,0.7560403579618923,0.6345050911418174,0.6309326536597386,0.23932848807452145,0.23925061425061425,1.0,1.0,none,0.8549409054317687,0.8543938134704637,0.5756151124870426,COMPLETE
72,0.6918481402967817,2025-09-23 12:09:23.648361,2025-09-23 12:09:25.230188,0 days 00:00:01.581827,0.03200628042237984,gbtree,0.7549976185913712,5.983159693646871,depthwise,0.0005170132256592522,0.0029069467024636217,8,8,73.5186967694993,900,,0.48395008295780834,0.94385041786366,none,0.9775233405031415,1.8731810314634527,,,,0.8252653821452862,0.8358071450506704,0.8363022113022113,0.48395008295780834,0.6944761904761905,0.6918481402967817,0.94385041786366,0.7966603529236385,0.7853250266120182,0.6260302197802198,0.629382889200561,0.77972626176219,0.7680787334189131,none,0.9128197264850886,0.9095728915982826,0.9775233405031415,COMPLETE
73,0.6,2025-09-23 12:09:25.349643,2025-09-23 12:09:25.897858,0 days 00:00:00.548215,0.006366591017496882,gbtree,0.6390770627729339,7.480227993432699,lossguide,5.773035236611467,0.007199021690866607,0,10,22.83313258036857,200,,0.3409267263550377,0.6656344401463632,undersample,0.9914950549789199,0.9798224129488685,,,,0.8406388792541049,0.6968983519295732,0.7014742014742015,0.3409267263550377,0.5978541355425777,0.6,0.6656344401463632,0.7436225116390054,0.7354242338470363,0.4380099502487562,0.4415505754088431,0.9414029084687767,0.9358151476251605,undersample,0.8921220653450581,0.8881941504114275,0.9914950549789199,COMPLETE
74,0.0,2025-09-23 12:09:26.016018,2025-09-23 12:10:17.193499,0 days 00:00:51.177481,94.71693282797135,dart,0.8936916332749303,6.605361771445402,lossguide,0.0008207046647865986,0.00012348664819939852,8,6,31.12385203533843,900,tree,0.5847481803573288,0.9415387986595676,undersample,0.6981113723308721,0.5658529074243516,0.33875417799700513,uniform,0.8440779369996353,0.2801867499392985,0.7606715119254785,0.7607493857493858,0.5847481803573288,0.0,0.0,0.9415387986595676,0.616558857907974,0.6064097575828543,0.0,0.0,0.0,0.0,undersample,0.8414204234704937,0.8403115249944333,0.6981113723308721,COMPLETE
75,0.38612143742255267,2025-09-23 12:10:17.311800,2025-09-23 12:10:20.229527,0 days 00:00:02.917727,15.732880281987725,gbtree,0.25209717483905475,3.4210387520378873,lossguide,8.72630351549692,0.00013719594993780352,3,9,0.11034547930671884,1000,,0.523194960243853,0.7638573627864329,oversample,0.7002242673679617,4.801919634048552,,,,0.9686500230581423,0.23932848807452145,0.23925061425061425,0.523194960243853,0.3862228462872718,0.38612143742255267,0.7638573627864329,0.6962740938620935,0.6891150040069752,0.23932848807452145,0.23925061425061425,1.0,1.0,oversample,0.874778645028416,0.8720108610686006,0.7002242673679617,COMPLETE
76,0.6812189323535768,2025-09-23 12:10:20.348795,2025-09-23 12:10:31.540920,0 days 00:00:11.192125,0.0010317077554465634,dart,0.5310241758866129,6.940873750829799,depthwise,4.865831479864381,0.03990938888011445,3,8,70.44330118685329,400,forest,0.6066364202424632,0.7716763201583847,none,0.8539911773255933,2.4414814605947,0.17794457732043406,uniform,0.7292718733889091,0.49925010000586056,0.8506500153546934,0.848996723996724,0.6066364202424632,0.6900361164223497,0.6812189323535768,0.7716763201583847,0.7772308370370208,0.768477714137485,0.6855213170113972,0.6882096069868996,0.6946107784431138,0.6743688489516474,none,0.9059367855211776,0.9028448691303308,0.8539911773255933,COMPLETE
77,0.6278634202564471,2025-09-23 12:10:31.660836,2025-09-23 12:10:42.537120,0 days 00:00:10.876284,0.00016601545010540378,dart,0.8050297852008927,7.7487977934740195,lossguide,46.152454048733524,0.027619210671517482,2,10,5.504445962589052,400,forest,0.5160191854774767,0.778066589725237,undersample,0.6724282933113741,2.2106210386266545,0.13714785192137574,weighted,0.6316564346499747,0.31792008201057653,0.7258675401781144,0.7355651105651105,0.5160191854774767,0.6201418439716312,0.6278634202564471,0.778066589725237,0.7760819541761274,0.7717810435594363,0.4639219015280136,0.4732841007819288,0.9349871685201027,0.9323919554985024,undersample,0.9038254018521581,0.9033589986368384,0.6724282933113741,COMPLETE
78,0.570185482024273,2025-09-23 12:10:42.657281,2025-09-23 12:11:44.738116,0 days 00:01:02.080835,0.007612786854907503,dart,0.36101341260869235,8.87283151235186,lossguide,3.894212934606418,0.01923551732642716,10,9,90.3931859764261,1000,forest,0.5576892711719279,0.596618146237278,undersample,0.6298001167488098,0.6623013055946275,0.059174717009734534,uniform,0.022671260361455538,0.49243122249446114,0.8083734261439247,0.8078419328419328,0.5576892711719279,0.5810205908683975,0.570185482024273,0.596618146237278,0.6258420320307181,0.6186662856565985,0.6093896713615023,0.6133004926108374,0.5551753635585971,0.5327342747111682,undersample,0.833851185684459,0.8324605195353952,0.6298001167488098,COMPLETE
79,0.38612143742255267,2025-09-23 12:11:44.856485,2025-09-23 12:11:45.233762,0 days 00:00:00.377277,97.30535166593278,gbtree,0.9553621743311538,2.5506378531663945,depthwise,3.185810362723817,0.0014820952369133816,4,4,0.7875006710868011,200,,0.4184511093658773,0.8509887975830985,undersample,0.8285218384582116,1.5573167925614548,,,,0.6271823389030367,0.23932848807452145,0.23925061425061425,0.4184511093658773,0.3862228462872718,0.38612143742255267,0.8509887975830985,0.655250555683906,0.6502989715235639,0.23932848807452145,0.23925061425061425,1.0,1.0,undersample,0.8674625488051522,0.8673097013995021,0.8285218384582116,COMPLETE
80,0.46782451561088245,2025-09-23 12:11:45.353703,2025-09-23 12:11:47.815142,0 days 00:00:02.461439,0.49165284863990905,gbtree,0.8685168300667805,9.078984575106281,lossguide,1.7959939066916542,0.0011318346757967404,10,10,0.2050993257372217,500,,0.40862043816991256,0.9917169891172881,undersample,0.7632920144102346,2.0254212593094776,,,,0.8339991244871332,0.4503019756372198,0.4573095823095823,0.40862043816991256,0.4647129186602871,0.46782451561088245,0.9917169891172881,0.7837032591616924,0.7757315320650661,0.30296334806342606,0.30561385099685207,0.9970059880239521,0.9970047068891742,undersample,0.9093604129188995,0.9073754680559363,0.7632920144102346,COMPLETE
81,0.6325917017438364,2025-09-23 12:11:47.933555,2025-09-23 12:11:48.749219,0 days 00:00:00.815664,11.424567774773239,gbtree,0.7142427002468097,1.9645099182095394,lossguide,1.0694640259578687,0.032174600171930134,3,10,0.9109649513266641,900,,0.4896739249054487,0.6456944102684514,undersample,0.5702197606855265,1.6358260065419186,,,,0.21300223094189574,0.7420411505783601,0.7497952497952498,0.4896739249054487,0.6286472148541115,0.6325917017438364,0.6456944102684514,0.7599236581562747,0.7518110989307782,0.4795413669064748,0.4876013904982619,0.9123182207014542,0.9002995293110826,undersample,0.8977823233514515,0.8949723852252014,0.5702197606855265,COMPLETE
82,0.6365353872983578,2025-09-23 12:11:48.872077,2025-09-23 12:12:32.159357,0 days 00:00:43.287280,0.018604024494008362,dart,0.48756252081732177,3.7441398387974,lossguide,0.013271322272455983,0.009246585568831603,0,12,25.48036070628308,800,forest,0.38872961220399843,0.990233229420315,undersample,0.9648093697233773,1.5592482309677576,0.09681164520124824,weighted,0.1010249933286474,0.7262897069811427,0.7396867642542737,0.743959868959869,0.38872961220399843,0.6343637670740474,0.6365353872983578,0.990233229420315,0.8009647538666785,0.7920002416904173,0.47779943686376436,0.4819542253521127,0.9435414884516681,0.9370988446726572,undersample,0.9162573693376844,0.913460749464176,0.9648093697233773,COMPLETE
83,0.6539104024297646,2025-09-23 12:12:32.277082,2025-09-23 12:12:33.039514,0 days 00:00:00.762432,5.485510095339835,gbtree,0.9834161920286548,4.130861259038863,lossguide,1.8211672428433314,0.016753526064084805,6,7,20.691529866923666,300,,0.5966412428609295,0.9615795105868701,undersample,0.9541241896172895,2.9479089520896316,,,,0.45380815779998623,0.7615927935305559,0.7666871416871417,0.5966412428609295,0.6506674666266686,0.6539104024297646,0.9615795105868701,0.7983315804383597,0.7886445166461298,0.501039501039501,0.5068267419962336,0.927715996578272,0.9212665810868635,undersample,0.9154322130293885,0.9124136608214775,0.9541241896172895,COMPLETE
84,0.5676956577430511,2025-09-23 12:12:33.156414,2025-09-23 12:13:18.901042,0 days 00:00:45.744628,6.297854364106206,dart,0.5987478286899619,7.381515456910565,depthwise,27.47671135266201,0.006547415968259827,2,3,14.212762557131462,900,forest,0.6219513794216955,0.529878958980197,oversample,0.9236538441668674,4.981095650441685,0.2405212240549363,uniform,0.26842121883496145,0.4487443042752716,0.6541099396048725,0.6544840294840295,0.6219513794216955,0.566961425092913,0.5676956577430511,0.529878958980197,0.6427894542289379,0.6457093798389394,0.4047575480329369,0.40511882998171844,0.9461077844311377,0.9482242190842961,oversample,0.8631814748725054,0.8636277890093351,0.9236538441668674,COMPLETE
85,0.6483294483294483,2025-09-23 12:13:19.017858,2025-09-23 12:14:14.281094,0 days 00:00:55.263236,0.010980054019248713,dart,0.38312607977951524,5.144803410895479,lossguide,0.19107728985474542,0.035260581326897744,6,9,0.13407983479537852,1000,forest,0.5960979990699826,0.9895054595004114,undersample,0.8848945103389174,2.1246325695544233,0.3611957593491182,uniform,0.28586868594655157,0.2548774678031075,0.7609786057938377,0.7683251433251433,0.5960979990699826,0.6417063065827835,0.6483294483294483,0.9895054595004114,0.7389430990748863,0.7301367381523901,0.5003589375448672,0.509028794533919,0.8943541488451668,0.8925973470261018,undersample,0.8950966226034579,0.8954504965868562,0.8848945103389174,COMPLETE
86,0.7038901601830664,2025-09-23 12:14:14.399650,2025-09-23 12:14:14.885142,0 days 00:00:00.485492,0.017311200076912756,gbtree,0.279007909432444,7.403471966315919,depthwise,8.4351181626506,0.4937644966616443,7,3,0.2481578352981397,700,,0.6661630595407202,0.9953258463031998,oversample,0.9595855003618998,0.7007348878684021,,,,0.357481643732251,0.86651653188658,0.8675266175266175,0.6661630595407202,0.7028258887876025,0.7038901601830664,0.9953258463031998,0.8117236886261723,0.8062699750810318,0.7521951219512195,0.7565174618789966,0.6595380667236954,0.6581086863500214,oversample,0.9207327026551314,0.9209190966822018,0.9595855003618998,COMPLETE
87,0.7160775370581528,2025-09-23 12:14:15.006027,2025-09-23 12:14:18.357408,0 days 00:00:03.351381,0.022842019152318614,dart,0.9052538160579966,4.173331420625957,depthwise,0.0198791658672466,0.11487005095975487,1,9,11.310860328833167,200,forest,0.6560446165543228,0.9378461351174615,none,0.8314282392785599,4.875940996071763,0.056112157914144256,weighted,0.17400117669022258,0.6717694543943385,0.8481932644078206,0.847051597051597,0.6560446165543228,0.7193945127719962,0.7160775370581528,0.9378461351174615,0.8215086361826156,0.8142702710356823,0.6450627757041059,0.6441025641025641,0.8130881094952951,0.8061617458279846,none,0.9252021938014507,0.9221507099375013,0.8314282392785599,COMPLETE
88,0.6691109074243813,2025-09-23 12:14:18.481361,2025-09-23 12:14:19.023118,0 days 00:00:00.541757,0.0012938308954772585,gbtree,0.6159879919626479,6.730101338348399,lossguide,6.4698647552347595,0.022976570204596536,10,7,0.2019811309611274,400,,0.619581265603272,0.5987595534230428,undersample,0.9024677860795636,0.5983603702158609,,,,0.5321002038654351,0.8544375063977889,0.8521703521703522,0.619581265603272,0.680161943319838,0.6691109074243813,0.5987595534230428,0.7822270504818781,0.7696168399121258,0.7172675521821632,0.7202762703502713,0.6467065868263473,0.6247325631151048,undersample,0.9093050993577757,0.9055193387494718,0.9024677860795636,COMPLETE
89,0.38612143742255267,2025-09-23 12:14:19.139841,2025-09-23 12:14:42.420989,0 days 00:00:23.281148,0.05461790173605056,dart,0.5430478161282744,8.701821785071486,depthwise,0.2357201259786976,0.0007741659823646054,4,12,19.472454187885496,600,tree,0.4509075730663041,0.7156289234209491,none,0.9090386125869306,4.2169311561634375,0.3476732340697649,weighted,0.08356609176117116,0.676947557423395,0.23932848807452145,0.23925061425061425,0.4509075730663041,0.3862228462872718,0.38612143742255267,0.7156289234209491,0.743658566470849,0.7353000813397381,0.23932848807452145,0.23925061425061425,1.0,1.0,none,0.8936742985567018,0.8891625231404344,0.9090386125869306,COMPLETE
90,0.605568445475638,2025-09-23 12:14:42.539436,2025-09-23 12:15:36.753848,0 days 00:00:54.214412,4.025265940251159,dart,0.9863411823966846,1.8873221095938586,lossguide,6.574341661977047,0.0008000728709602731,1,3,1.0405998655138475,900,forest,0.660270095523546,0.7079766573148898,oversample,0.9248449382105941,2.9433473633243654,0.08159085275706035,weighted,0.6265972802255569,0.6134664323047767,0.7198280274337189,0.7215397215397216,0.660270095523546,0.6073734041027112,0.605568445475638,0.7079766573148898,0.7142149800909718,0.7067344069093779,0.4569393481545435,0.4579951743803466,0.9054747647562019,0.8934531450577664,oversample,0.8833455126772811,0.878867379923826,0.9248449382105941,COMPLETE
91,0.6006380912747954,2025-09-23 12:15:36.871224,2025-09-23 12:16:18.723200,0 days 00:00:41.851976,0.0016782847684591073,dart,0.9076976454758741,8.450776272778745,lossguide,0.0008492669440606552,0.0020374205767633084,8,5,0.10259573833659251,1000,forest,0.36669663204454506,0.5122740582619888,oversample,0.7407766773141029,0.7441606311197535,0.4635102843931979,weighted,0.10400518224028257,0.40421161367362046,0.6984338212713687,0.7052620802620803,0.36669663204454506,0.5947730398899588,0.6006380912747954,0.5122740582619888,0.7482816874167034,0.7420174613112909,0.4383617193836172,0.444376026272578,0.9247219846022241,0.9264013692768507,oversample,0.8887818399765439,0.8873718656656214,0.7407766773141029,COMPLETE
92,0.6498984533666614,2025-09-23 12:16:18.840207,2025-09-23 12:16:19.319574,0 days 00:00:00.479367,0.0026781522195858383,gbtree,0.9126114771600746,6.012277576745202,depthwise,10.174622192495754,0.10649250152394416,0,11,0.1743193294343449,600,,0.3766896439687382,0.5772127123273001,undersample,0.8080914953079797,0.9320674577986086,,,,0.8095412091596794,0.7627188043812059,0.7705773955773956,0.3766896439687382,0.6416202844774274,0.6498984533666614,0.5772127123273001,0.733904703635648,0.7252941708045203,0.5024213075060533,0.5118110236220472,0.8875106928999145,0.8900299529311082,undersample,0.8930230547613465,0.893659004159045,0.8080914953079797,COMPLETE
