number,value,datetime_start,datetime_complete,duration,params_alpha,params_booster,params_colsample_bytree,params_gamma,params_grow_policy,params_lambda,params_learning_rate,params_max_delta_step,params_max_depth,params_min_child_weight,params_n_estimators,params_normalize_type,params_params_decision_threshold,params_params_feature_fraction,params_params_resampling,params_params_sample_rows,params_params_scale_pos_weight,params_rate_drop,params_sample_type,params_skip_drop,params_subsample,user_attrs_acc_test,user_attrs_acc_val,user_attrs_decision_threshold,user_attrs_f1_test,user_attrs_f1_val,user_attrs_feature_fraction,user_attrs_pr_auc_test,user_attrs_pr_auc_val,user_attrs_prec_test,user_attrs_prec_val,user_attrs_rec_test,user_attrs_rec_val,user_attrs_resampling_strategy,user_attrs_roc_auc_test,user_attrs_roc_auc_val,user_attrs_sample_rows,state
2205,0.7044470680834317,2025-09-24 00:02:09.199420,2025-09-24 00:02:14.103138,0 days 00:00:04.903718,0.000133244648153541,gbtree,0.36991538227238674,0.03281801754045954,lossguide,0.006500836826755107,0.008930460178469837,2,10,0.5934374594789816,300,,0.6487463634149299,0.8817959943933181,none,0.97271190676314,4.055194779466965,,,,0.45148527096939245,0.8472719828027434,0.8462325962325963,0.6487463634149299,0.7071063996859049,0.7044470680834317,0.8817959943933181,0.8016290756689257,0.7941564656197098,0.6534833091436865,0.6520947176684881,0.7703165098374679,0.7659392383397519,none,0.9184578820903667,0.9175166056316025,0.97271190676314,COMPLETE
2206,0.7093980077955825,2025-09-24 00:02:14.250603,2025-09-24 00:02:15.142035,0 days 00:00:00.891432,0.019346708965861516,gbtree,0.9242998429925773,0.22205831565106177,lossguide,0.0002950538459008728,0.02849691299721401,2,5,0.19181425051512566,200,,0.6552061706007426,0.9889138829608344,none,0.9297422975344062,2.9162442019412405,,,,0.7062091783464738,0.8618077592384072,0.8626126126126126,0.6552061706007426,0.7101760412194075,0.7093980077955825,0.9889138829608344,0.8194605640731468,0.8123073878196934,0.7129310344827586,0.7181060938185007,0.7074422583404619,0.7008985879332478,none,0.9234169356655509,0.9216237106382283,0.9297422975344062,COMPLETE
2207,0.7174851037600164,2025-09-24 00:02:15.286887,2025-09-24 00:02:16.990411,0 days 00:00:01.703524,0.00020278840699473527,gbtree,0.5188269157494205,0.5006169500038953,lossguide,0.013900430996945597,0.01565181008794227,0,5,1.486125423184361,700,,0.6491171815630005,0.9664404731463763,none,0.9818810916862936,3.2240010976418625,,,,0.9310200482004081,0.8602722898966118,0.8592342342342343,0.6491171815630005,0.7227300426569165,0.7174851037600164,0.9664404731463763,0.8271946881883228,0.8200542496209486,0.6882011605415861,0.6901185770750988,0.760906757912746,0.7471116816431322,none,0.9273636532229963,0.9257632924373354,0.9818810916862936,COMPLETE
2208,0.7262318544264976,2025-09-24 00:02:17.137727,2025-09-24 00:02:18.909986,0 days 00:00:01.772259,0.000295029048352347,gbtree,0.3163048559146416,1.815640460949846,lossguide,0.00166233592076643,0.041240161404722545,1,8,0.15508789820745564,300,,0.6950517221055772,0.9641911253366221,none,0.9346325923231453,4.166713055569328,,,,0.8308764113898502,0.8636503224485618,0.862919737919738,0.6950517221055772,0.7291581943879626,0.7262318544264976,0.9641911253366221,0.8295985341992995,0.8234183982169662,0.6949612403100776,0.6953797963978073,0.7668947818648417,0.7599486521181001,none,0.9286023086188198,0.9273368909241012,0.9346325923231453,COMPLETE
2209,0.6847426470588235,2025-09-24 00:02:19.057046,2025-09-24 00:03:04.758566,0 days 00:00:45.701520,0.0035809149535151663,dart,0.8520894701321691,3.667888456906323,lossguide,0.00011210845961987766,0.20612604813434832,0,11,18.58460647702267,800,forest,0.6097734418590879,0.9899794030853053,none,0.8891442267471076,1.676655027882979,0.14086298619813997,weighted,0.8002822787112125,0.3709242003620361,0.8652881564131436,0.8595413595413596,0.6097734418590879,0.6988558352402746,0.6847426470588235,0.9899794030853053,0.807481480184657,0.7977756403251822,0.7514763779527559,0.739454094292804,0.6531223267750214,0.6375695335900727,none,0.9181875305850609,0.9153441443047539,0.8891442267471076,COMPLETE
2210,0.6781317178034004,2025-09-24 00:03:04.901424,2025-09-24 00:03:06.760963,0 days 00:00:01.859539,0.0005176456228842013,gbtree,0.326324499218806,1.5219851789409649,lossguide,0.00033567387093248567,0.01790859753082281,1,6,0.23979354350489263,500,,0.6746744386148604,0.901788968004813,none,0.9718421048177518,3.908191107704145,,,,0.8919634956672469,0.8324291124987204,0.8313882063882064,0.6746744386148604,0.6818270165208941,0.6781317178034004,0.901788968004813,0.7570448687080018,0.7499587491990503,0.6248664054150338,0.6241007194244604,0.7502138579982891,0.7424047924689773,none,0.9019153572432965,0.9031404424916909,0.9718421048177518,COMPLETE
2211,0.6981744421906694,2025-09-24 00:03:06.911987,2025-09-24 00:03:08.450013,0 days 00:00:01.538026,0.00013554187503515765,gbtree,0.3381271142456837,3.4859684824552364,lossguide,0.006281491714742521,0.014328927277389979,2,8,0.11485543540923834,200,,0.66372040390598,0.9374716498344456,none,0.7711154877665014,3.9119997185566904,,,,0.9209462069561254,0.8505476507319071,0.8476658476658476,0.66372040390598,0.7045730473492513,0.6981744421906694,0.9374716498344456,0.7951845187597497,0.7880273482618008,0.6685867895545314,0.6637099884303895,0.7446535500427716,0.7364142062473257,none,0.9158217966282096,0.9140074709290961,0.7711154877665014,COMPLETE
2212,0.6706548100242522,2025-09-24 00:03:08.600717,2025-09-24 00:03:41.727265,0 days 00:00:33.126548,0.011960149164287686,dart,0.8325171722522815,5.838403193631267,depthwise,0.0002259257862675932,0.16719713274225115,0,12,23.00979258503074,700,forest,0.681270147316059,0.9621885272310073,undersample,0.8012736939002836,3.073114327267962,0.07454564264300106,weighted,0.6883702273190436,0.4686166563532314,0.7879005015866517,0.7914619164619164,0.681270147316059,0.6700636942675159,0.6706548100242522,0.9621885272310073,0.7972072637630121,0.7893462861750857,0.5337392186707255,0.5389812889812889,0.8999144568006844,0.8874625588361147,undersample,0.9159564255766682,0.9136791904433929,0.8012736939002836,COMPLETE
2213,0.7192704203013481,2025-09-24 00:03:41.871084,2025-09-24 00:03:43.088727,0 days 00:00:01.217643,0.04919649715094497,gbtree,0.22514541522555354,3.264763918803446,depthwise,0.0033021468937039673,0.02761996359804432,1,8,2.248926614466844,600,,0.689066165269641,0.8958058470788751,none,0.8249773078533156,4.52534626570879,,,,0.8862569186450159,0.8538233186610708,0.855036855036855,0.689066165269641,0.7203290246768508,0.7192704203013481,0.8958058470788751,0.8271113661918594,0.822316473245867,0.664378612716763,0.6701145179165128,0.7865697177074422,0.7762088147197261,none,0.9281901621521936,0.9264755937192416,0.8249773078533156,COMPLETE
2214,0.7080613864879167,2025-09-24 00:03:43.235168,2025-09-24 00:04:10.032983,0 days 00:00:26.797815,0.00011614188688368193,dart,0.7938537989885481,8.041789480080899,depthwise,0.00047019488204679276,0.02424980133685625,4,12,1.737652551950469,600,forest,0.5664041593146627,0.9584365294108077,none,0.9973044775969349,4.625967785783501,0.10318853325791139,weighted,0.5134560729151272,0.40726637048289116,0.8283345275872659,0.8305692055692055,0.5664041593146627,0.7066643344411404,0.7080613864879167,0.9584365294108077,0.8263852581001474,0.8198480751290955,0.5978100029594554,0.6023409363745498,0.8639863130881095,0.858793324775353,none,0.9274082897127482,0.9255808983944545,0.9973044775969349,COMPLETE
2215,0.7004199720018666,2025-09-24 00:04:10.176913,2025-09-24 00:04:11.230862,0 days 00:00:01.053949,0.000134860685820543,gbtree,0.29024691842744077,2.6993912871368435,depthwise,0.006693017939951281,0.04599121425927752,3,6,0.12811605954458435,800,,0.6882829159066209,0.9633968113323663,none,0.8270078547055938,2.5136559875580375,,,,0.9272812816232527,0.8688709182106664,0.8685503685503686,0.6882829159066209,0.701885036071678,0.7004199720018666,0.9633968113323663,0.8202682166691657,0.81481093713317,0.7697805002552323,0.7701385325808107,0.6449957228400343,0.6422764227642277,none,0.9228434819616202,0.9217684454217425,0.8270078547055938,COMPLETE
2216,0.7184236453201971,2025-09-24 00:04:11.376475,2025-09-24 00:04:13.282054,0 days 00:00:01.905579,0.005921318663548639,gbtree,0.3569550567955823,2.637435101539005,lossguide,0.08069788050687174,0.02803164682219037,4,7,1.4124425145406365,500,,0.696503642666041,0.9980666827701337,none,0.9281971998976304,4.888887631811262,,,,0.7438930838472325,0.8537209540382844,0.8537059787059788,0.696503642666041,0.7204069653688123,0.7184236453201971,0.9980666827701337,0.8297519995392947,0.8230799104322184,0.6639019112874144,0.6658144631117604,0.7874251497005988,0.7800599058622165,none,0.9289193399348141,0.927023121345677,0.9281971998976304,COMPLETE
2217,0.7181895815542272,2025-09-24 00:04:13.428925,2025-09-24 00:04:14.382878,0 days 00:00:00.953953,0.0010099834552374089,gbtree,0.8490085231402402,9.941659340575075,depthwise,0.0004231395580829341,0.07760529062156855,1,11,2.7078243799952655,1000,,0.6173884884228489,0.8786750940656503,none,0.9397379157506369,2.2881424033499798,,,,0.328388562923251,0.8621148531067663,0.8648648648648649,0.6173884884228489,0.7141947803946531,0.7181895815542272,0.8786750940656503,0.8178186005219894,0.8136919499483839,0.7086315789473684,0.7166595654026416,0.7198460222412318,0.7197261446298674,none,0.923377134076043,0.9227344572491685,0.9397379157506369,COMPLETE
2218,0.7151584574264986,2025-09-24 00:04:14.527881,2025-09-24 00:04:20.313367,0 days 00:00:05.785486,0.0002584294710361637,gbtree,0.6152878857185088,2.127404518921727,lossguide,0.0004299077158317461,0.005866787536969797,3,8,0.12321431882272643,900,,0.6727313774827911,0.9783278869207084,none,0.9024087986506002,4.68181466254189,,,,0.6450350022975575,0.8472719828027434,0.8472563472563472,0.6727313774827911,0.7165653495440729,0.7151584574264986,0.9783278869207084,0.8262957383614996,0.8200137826716037,0.644565960355434,0.6456394346776974,0.806672369546621,0.8014548566538297,none,0.9267815945477981,0.9250778824002677,0.9024087986506002,COMPLETE
2219,0.6632390745501285,2025-09-24 00:04:20.460180,2025-09-24 00:04:22.767041,0 days 00:00:02.306861,0.001665038893838733,gbtree,0.2278988289965284,2.569738328491354,lossguide,0.0018217716624247193,0.013904688997689164,0,7,0.11897127554838922,800,,0.600014334925657,0.9032048256880743,undersample,0.9304002771379567,3.4295029781066426,,,,0.6009354631971021,0.7679394001433105,0.772010647010647,0.600014334925657,0.6580178005732388,0.6632390745501285,0.9032048256880743,0.818049851648667,0.8112040746385314,0.5082731298065719,0.5128624883068288,0.9328485885372113,0.938382541720154,undersample,0.9245893701955337,0.9229244234519985,0.9304002771379567,COMPLETE
2220,0.685340489768534,2025-09-24 00:04:22.916144,2025-09-24 00:04:37.966063,0 days 00:00:15.049919,0.0009576116562428759,dart,0.7178614737940041,0.8058097668763318,lossguide,0.00026199578936856026,0.004135670842442523,3,12,3.1369258309060686,300,tree,0.6804007613263231,0.9875302289912913,oversample,0.9373870164036576,2.8291371937637426,0.06086501179980884,uniform,0.5390311610325748,0.7582448042222094,0.8059166751970519,0.8079443079443079,0.6804007613263231,0.6847356168939142,0.685340489768534,0.9875302289912913,0.8028154329190009,0.7946672435103974,0.5601196953210011,0.5635862068965517,0.8806672369546621,0.8741976893453145,oversample,0.9177309778620278,0.9152919165551429,0.9373870164036576,COMPLETE
2221,0.7193791946308725,2025-09-24 00:04:38.111407,2025-09-24 00:04:50.778258,0 days 00:00:12.666851,0.5185235052657589,dart,0.52639488690395,1.9698330691383585,depthwise,0.039162798233229365,0.015268120727942898,8,9,5.26210179436521,400,forest,0.5089421581593514,0.9420947950306073,none,0.9510900052492006,1.6556886807109976,0.11078202530122887,weighted,0.8240755866659495,0.41407778445928156,0.8643668748080663,0.8630221130221131,0.5089421581593514,0.7226292652292233,0.7193791946308725,0.9420947950306073,0.8249624142182792,0.8169590233463975,0.7076670766707667,0.7054709995886467,0.7382378100940975,0.733846812152332,none,0.925629909798029,0.923471288874332,0.9510900052492006,COMPLETE
2222,0.7150837988826816,2025-09-24 00:04:50.924165,2025-09-24 00:04:51.733550,0 days 00:00:00.809385,0.0001303266687572328,gbtree,0.32676757814051804,3.418758710179193,lossguide,0.020501265570805872,0.3621429564948917,0,10,0.1771301580498489,300,,0.6656140879247038,0.8962846387407877,none,0.993663208148701,3.326535490772263,,,,0.9224631576853746,0.8590439144231754,0.859029484029484,0.6656140879247038,0.7173065079039211,0.7150837988826816,0.8962846387407877,0.8168650089718064,0.8139164748095641,0.6896960126332412,0.6923076923076923,0.7472198460222412,0.7394094993581515,none,0.9230070915323745,0.9212510912691729,0.993663208148701,COMPLETE
2223,0.658052607291186,2025-09-24 00:04:51.876897,2025-09-24 00:05:23.005352,0 days 00:00:31.128455,0.0006154938143782308,dart,0.3221112628743036,0.4429802991183982,lossguide,0.002377040087489537,0.055741954631374026,2,4,0.6912172569292268,700,tree,0.6472900858125018,0.9524047712865882,none,0.9383193345311943,2.007661565296855,0.17405641822343665,uniform,0.48595312521678735,0.9634545333911964,0.8489098167673252,0.8482800982800983,0.6472900858125018,0.6617781851512374,0.658052607291186,0.9524047712865882,0.7473321169583773,0.7433840911448164,0.7127344521224087,0.71407110665999,0.6176218990590248,0.6101839965768079,none,0.896524011783803,0.8989193520050704,0.9383193345311943,COMPLETE
2224,0.7112540192926045,2025-09-24 00:05:23.148084,2025-09-24 00:05:58.978179,0 days 00:00:35.830095,0.00026896002188965084,dart,0.4779748239146903,4.971641145662875,depthwise,0.00034099750485557705,0.01759349404054498,1,12,1.0204547472941015,700,forest,0.5826312135898944,0.8267199371551721,none,0.9228730280203444,2.335692958850483,0.09013588756811816,weighted,0.5974447798802909,0.6751122226129584,0.8645716040536391,0.8621007371007371,0.5826312135898944,0.7183308494783904,0.7112540192926045,0.8267199371551721,0.8162965735435149,0.8122097378347973,0.7151335311572701,0.7126288659793815,0.7215568862275449,0.7098844672657253,none,0.920083099272359,0.9207329309550878,0.9228730280203444,COMPLETE
2225,0.6945829179129279,2025-09-24 00:05:59.122448,2025-09-24 00:06:01.045948,0 days 00:00:01.923500,0.1307773079749767,gbtree,0.47789642685700817,0.3028413852713099,lossguide,0.0012806694576303073,0.04067909252076425,3,6,1.0407278451870035,700,,0.6830446663069901,0.9173614967222637,undersample,0.8894719987864721,3.5470521584044055,,,,0.9825992357781477,0.8061214044426246,0.8118345618345618,0.6830446663069901,0.6887939533355242,0.6945829179129279,0.9173614967222637,0.821253809607726,0.816091361771735,0.5592315901814301,0.5677804944308612,0.8964927288280582,0.8943089430894309,undersample,0.9251350520022299,0.9247185934877006,0.8894719987864721,COMPLETE
2226,0.7060118916538207,2025-09-24 00:06:01.196128,2025-09-24 00:06:26.174846,0 days 00:00:24.978718,0.0001992816936462056,dart,0.4182206540876782,0.2451914140131879,lossguide,0.1409459602009575,0.007281617055186697,1,10,0.1304579417082934,500,forest,0.6815573583197789,0.9272841498105677,none,0.8278389203064547,3.3923154194941616,0.1490543524364521,weighted,0.7770369702048879,0.8305823450731209,0.8661070733954346,0.8633292383292384,0.6815573583197789,0.7120211360634082,0.7060118916538207,0.9272841498105677,0.806201466795699,0.7978087762717067,0.7336660617059891,0.7273139745916516,0.6916167664670658,0.6859221223791185,none,0.9203015907167154,0.9185233861985264,0.8278389203064547,COMPLETE
2227,0.7124335812964931,2025-09-24 00:06:26.317310,2025-09-24 00:06:29.037715,0 days 00:00:02.720405,0.01760121425117055,gbtree,0.34739370018720866,0.08625495337198963,lossguide,0.0013876933466589474,0.045716545354679276,3,10,0.1922202038562066,200,,0.633915683662604,0.9800082698347466,none,0.8565744889730628,3.080316629624329,,,,0.706393343534463,0.8632408639574163,0.8614864864864865,0.633915683662604,0.7200335289186923,0.7124335812964931,0.9800082698347466,0.8191336943313179,0.8126996776092777,0.7058340180772391,0.7077702702702703,0.7348160821214713,0.7171587505348738,none,0.9215899477358795,0.9205406326421592,0.8565744889730628,COMPLETE
2228,0.7123595505617978,2025-09-24 00:06:29.185423,2025-09-24 00:06:30.882227,0 days 00:00:01.696804,0.0002010602412890269,gbtree,0.23916349450958385,0.9951073620510513,lossguide,0.002707560051103015,0.0282978396662682,0,8,0.13486817800194428,200,,0.6539403157645225,0.9497889844430947,none,0.9838575128168221,4.677641957179026,,,,0.7451330507408854,0.8418466577950661,0.8427518427518428,0.6539403157645225,0.7133048803117461,0.7123595505617978,0.9497889844430947,0.8126030937216584,0.8054285624732764,0.6299573910193379,0.6333666333666333,0.8220701454234388,0.8138639281129654,none,0.9225986863576038,0.9213751249766287,0.9838575128168221,COMPLETE
2229,0.6245940985458139,2025-09-24 00:06:31.027992,2025-09-24 00:07:34.135020,0 days 00:01:03.107028,0.015509901766453919,dart,0.49778482270639113,0.3517675510428785,lossguide,0.026169469898485054,0.0012085079306603126,8,8,1.5173369974873891,900,forest,0.549808500364123,0.9650207094290071,undersample,0.7831816962245565,2.308732423982015,0.07518495036315853,weighted,0.716719576511407,0.6583487425456729,0.7255604463097554,0.7277846027846028,0.549808500364123,0.6230844931814986,0.6245940985458139,0.9650207094290071,0.7875814619546744,0.7796170943567398,0.46408376963350784,0.46607669616519176,0.9478186484174508,0.9465126230209671,undersample,0.9122758002076474,0.9109465044462398,0.7831816962245565,COMPLETE
2230,0.6580326857847671,2025-09-24 00:07:34.282062,2025-09-24 00:07:35.194026,0 days 00:00:00.911964,0.00011424135718763161,gbtree,0.4017190024317705,2.6302428578174686,lossguide,37.175110624102544,0.10223342972777764,4,7,0.8034907566519054,600,,0.6175829396021946,0.897554970344489,undersample,0.9856309884520925,3.023737743368432,,,,0.7761825320215836,0.7625140751356331,0.7729320229320229,0.6175829396021946,0.6472019464720195,0.6580326857847671,0.897554970344489,0.8008320487194887,0.7929617324250818,0.5021236432279377,0.5143408050132562,0.9101796407185628,0.9131364997860505,undersample,0.9134415004122903,0.91187572075878,0.9856309884520925,COMPLETE
2231,0.7165384615384616,2025-09-24 00:07:35.340185,2025-09-24 00:08:17.654869,0 days 00:00:42.314684,0.00010129494675920246,dart,0.8590906760034157,9.061879711074289,depthwise,0.0007966395323757063,0.23764679650930964,1,12,4.039748198432373,800,tree,0.6657344884922024,0.9766189284468161,none,0.9836415732496763,4.458176833379059,0.2272115622175549,uniform,0.6209506513104742,0.46744835940418283,0.847169618179957,0.8490990990990991,0.6657344884922024,0.7156732051037897,0.7165384615384616,0.9766189284468161,0.8186393325546943,0.8116450457043167,0.6450394782011671,0.650716032134125,0.8036783575705732,0.7971758664955071,none,0.9237845607590979,0.9219472693207692,0.9836415732496763,COMPLETE
2232,0.7203867848509267,2025-09-24 00:08:17.800181,2025-09-24 00:09:09.300388,0 days 00:00:51.500207,0.0003897736505539928,dart,0.5283512144256366,1.6512501889734672,lossguide,0.0001459702406776835,0.03387133857329084,8,10,1.751557965948881,800,forest,0.5308545995305705,0.9008946284315822,none,0.8829421143025376,2.4392781614786996,0.06299286164567702,weighted,0.8985670167729539,0.6367520692234546,0.8550516941345071,0.8579033579033579,0.5308545995305705,0.7137080469065912,0.7203867848509267,0.9008946284315822,0.8211314504226969,0.8145172077551626,0.6767638036809815,0.6806242862580891,0.7549187339606501,0.7650834403080873,none,0.9245938309665919,0.9223190249453436,0.8829421143025376,COMPLETE
2233,0.6976586359009161,2025-09-24 00:09:09.443415,2025-09-24 00:09:12.507535,0 days 00:00:03.064120,0.0030444556636147033,gbtree,0.3254882861982329,0.23931200345505443,lossguide,0.0034108369730287812,0.03787536456418771,0,11,0.4536844552991249,200,,0.6596967120822459,0.961402929824795,undersample,0.959779702789278,2.794894597500166,,,,0.8383680686720334,0.8157436789845429,0.8175675675675675,0.6596967120822459,0.6970716930326489,0.6976586359009161,0.961402929824795,0.8125439121069907,0.8070402846319926,0.5746392896781354,0.5780151813325837,0.8857998289136013,0.8797603765511339,undersample,0.9230870688405758,0.9222607509843663,0.959779702789278,COMPLETE
2234,0.7087706813734211,2025-09-24 00:09:12.653158,2025-09-24 00:09:17.766023,0 days 00:00:05.112865,0.0006969301759101266,gbtree,0.3057422020690518,1.3567715480181013,lossguide,0.01709343299596003,0.009749616089935466,3,9,0.531217163724948,700,,0.5688579841351671,0.9809809974983114,none,0.7704160575445554,4.476647322255034,,,,0.7550984719709241,0.8306889139113522,0.8324119574119574,0.5688579841351671,0.7079802259887006,0.7087706813734211,0.9809809974983114,0.823448136830474,0.8163716572341602,0.6028262176788936,0.6065773447015834,0.8575705731394354,0.8523748395378691,none,0.9262190193694163,0.9245524378410601,0.7704160575445554,COMPLETE
2235,0.7171010807374444,2025-09-24 00:09:17.910237,2025-09-24 00:09:39.766993,0 days 00:00:21.856756,0.09822516619293514,dart,0.42774614768428215,0.9520101264753917,lossguide,0.01450241604660613,0.2470831914032299,2,12,3.5974258981743956,500,forest,0.6133694994451667,0.9857076662704882,none,0.9943680251484521,2.778396402744739,0.13573460375135946,weighted,0.7723298804673067,0.7268885338247697,0.8623195823523391,0.8633292383292384,0.6133694994451667,0.7146191385529387,0.7171010807374444,0.9857076662704882,0.8207311238504855,0.8144405739866375,0.7090526315789474,0.7103274559193955,0.72027373823781,0.72400513478819,none,0.9238015692474558,0.9216877141042621,0.9943680251484521,COMPLETE
