number,value,datetime_start,datetime_complete,duration,params_alpha,params_booster,params_colsample_bytree,params_gamma,params_grow_policy,params_lambda,params_learning_rate,params_max_delta_step,params_max_depth,params_min_child_weight,params_n_estimators,params_normalize_type,params_params_decision_threshold,params_params_feature_fraction,params_params_resampling,params_params_sample_rows,params_params_scale_pos_weight,params_rate_drop,params_sample_type,params_skip_drop,params_subsample,user_attrs_acc_test,user_attrs_acc_val,user_attrs_decision_threshold,user_attrs_f1_test,user_attrs_f1_val,user_attrs_feature_fraction,user_attrs_pr_auc_test,user_attrs_pr_auc_val,user_attrs_prec_test,user_attrs_prec_val,user_attrs_rec_test,user_attrs_rec_val,user_attrs_resampling_strategy,user_attrs_roc_auc_test,user_attrs_roc_auc_val,user_attrs_sample_rows,state
1434,0.7028559854162447,2025-09-23 18:23:41.141444,2025-09-23 18:24:15.813752,0 days 00:00:34.672308,7.483417620003216,dart,0.46525918092554464,0.5650558097288476,lossguide,0.0005223291130430298,0.052755198410561116,8,7,0.13138188414541427,700,forest,0.3213961530696306,0.9991398173069145,none,0.8039353489297181,0.7953361887739341,0.1573897867573594,uniform,0.6839546149836373,0.878641866425635,0.8550516941345071,0.8498157248157249,0.3213961530696306,0.7152051488334674,0.7028559854162447,0.9991398173069145,0.8047632212578575,0.7933261030920749,0.6750189825360668,0.6673076923076923,0.7604790419161677,0.7424047924689773,none,0.9191688138804001,0.9147073630819601,0.8039353489297181,COMPLETE
1435,0.6519916142557652,2025-09-23 18:24:15.951429,2025-09-23 18:24:16.958621,0 days 00:00:01.007192,0.014531509414694775,gbtree,0.9645780073624031,3.8350997972869956,lossguide,0.013522425594356737,0.019275678228121918,9,7,0.22520862372113895,200,,0.45325317994986036,0.9940425946438349,none,0.9418898140379656,0.6002406207053328,,,,0.8090422398302727,0.8654928856587163,0.864045864045864,0.45325317994986036,0.6588785046728972,0.6519916142557652,0.9940425946438349,0.8198341728002978,0.8139150507110653,0.8381770145310435,0.8411088573360379,0.5427715996578272,0.5323063756953359,none,0.922562367047438,0.9204120210889548,0.9418898140379656,COMPLETE
1436,0.6836469824789098,2025-09-23 18:24:17.110530,2025-09-23 18:24:20.548889,0 days 00:00:03.438359,0.17266782693862454,dart,0.9478523665436037,7.281926989225193,lossguide,0.10597748852389174,0.06745661467080641,5,8,7.692559657406821,200,forest,0.6256460108354813,0.9402619335071419,undersample,0.8617186819654783,2.550670586977438,0.15268782965877856,uniform,0.6615339487377624,0.7606746125272311,0.7943494728221927,0.8003685503685504,0.6256460108354813,0.678302642113691,0.6836469824789098,0.9402619335071419,0.8148304519865228,0.8092700286631432,0.5421039160481188,0.550561797752809,0.9059024807527801,0.9015832263585793,undersample,0.9227089969090021,0.9207689490999409,0.8617186819654783,COMPLETE
1437,0.6827676240208878,2025-09-23 18:24:20.686221,2025-09-23 18:24:27.371156,0 days 00:00:06.684935,0.0006654198010911785,dart,0.6504978321355526,3.000839185727822,depthwise,0.0005507396144358795,0.02247779774700249,6,5,1.5900456196211579,300,forest,0.3708011221287859,0.908093018728711,undersample,0.9351583955184267,0.7804045943253037,0.06493596617092642,uniform,0.4872447519571467,0.5939359928625552,0.7953731190500563,0.800982800982801,0.3708011221287859,0.6792876624418418,0.6827676240208878,0.908093018728711,0.8163198266388805,0.8056038693436438,0.5435173299101412,0.5518332893695594,0.9054747647562019,0.8951647411210955,undersample,0.9220842587274842,0.9195590158311118,0.9351583955184267,COMPLETE
1438,0.6910702560735391,2025-09-23 18:24:27.507718,2025-09-23 18:24:54.896576,0 days 00:00:27.388858,0.0001668841863024918,dart,0.4019379666368646,9.171732326170519,depthwise,0.052257285656074466,0.02102351195422343,1,11,0.18754657587389242,600,forest,0.689610773435454,0.9436266415619531,oversample,0.7627484979612563,4.246277823203901,0.01885328696919379,uniform,0.5630745304215703,0.7635325963142132,0.8022315487767427,0.8073300573300574,0.689610773435454,0.6864654333008764,0.6910702560735391,0.9436266415619531,0.824745526248517,0.8176059630218884,0.5530857740585774,0.5605858854860186,0.9046193327630453,0.9007274283269149,oversample,0.9268826669862307,0.9246585344547962,0.7627484979612563,COMPLETE
1439,0.7096774193548387,2025-09-23 18:24:55.036143,2025-09-23 18:24:55.769767,0 days 00:00:00.733624,0.3621168418123195,gbtree,0.792701727839636,5.21597650050346,lossguide,0.24450833318208823,0.30282489737477897,4,11,0.30154406578926396,200,,0.6696827748361044,0.9192017602720357,none,0.9660749498206535,4.099903921386206,,,,0.7172693050349015,0.8470672535571706,0.8516584766584766,0.6696827748361044,0.7057896809767625,0.7096774193548387,0.9192017602720357,0.8102064717799528,0.8085034045588388,0.654014598540146,0.6672946495855313,0.7664670658682635,0.7578091570389388,none,0.9171584738706451,0.9185003530123694,0.9660749498206535,COMPLETE
1440,0.7061233781015251,2025-09-23 18:24:55.909900,2025-09-23 18:24:56.481095,0 days 00:00:00.571195,0.011762736075620858,gbtree,0.8086514655595136,6.620599050683454,lossguide,0.00042745061135179586,0.3326973504637689,7,11,2.8391449566414493,200,,0.6517477688788332,0.9656427538564782,none,0.9665115310540956,2.0139301323200853,,,,0.8193855660986543,0.8723513153854028,0.8678337428337428,0.6517477688788332,0.7169125993189557,0.7061233781015251,0.9656427538564782,0.8244433040894499,0.814488359263964,0.7639090469279148,0.7543774319066148,0.6753635585970915,0.6636713735558408,none,0.9258939298863488,0.9226720948976483,0.9665115310540956,COMPLETE
1441,0.7082994304312449,2025-09-23 18:24:56.618512,2025-09-23 18:24:57.854708,0 days 00:00:01.236196,0.0005806651201782971,gbtree,0.7022933546272846,1.8020658651854102,depthwise,0.0011156668750238517,0.055011061349352186,2,10,0.13644016280809307,600,,0.529427639023142,0.7462045695194175,none,0.7358124912732749,2.519653956205768,,,,0.6880951699009734,0.8521854846964889,0.8531941031941032,0.529427639023142,0.7070993914807302,0.7082994304312449,0.7462045695194175,0.8141927196399762,0.8070518961515736,0.6724537037037037,0.6750678557580457,0.7455089820359282,0.7449721865639709,none,0.9187507676843096,0.9164960915274324,0.7358124912732749,COMPLETE
1442,0.7214026085097285,2025-09-23 18:24:57.992693,2025-09-23 18:24:58.553375,0 days 00:00:00.560682,0.010059254460700714,gbtree,0.5499496971171058,4.069383159878101,lossguide,0.00017834898173265884,0.3128165678200851,10,9,1.0159056306698424,200,,0.31465011294654516,0.9387180906218606,none,0.9511617315967167,0.6811031460899359,,,,0.7311501135246992,0.8672330842460846,0.8666052416052417,0.31465011294654516,0.7242185838826282,0.7214026085097285,0.9387180906218606,0.8272945701862598,0.8183651124080963,0.7200845665961945,0.7209401709401709,0.7284003421727973,0.7218656397090286,none,0.9269757100367579,0.9242013832925444,0.9511617315967167,COMPLETE
1443,0.7158808933002482,2025-09-23 18:24:58.691333,2025-09-23 18:24:59.246943,0 days 00:00:00.555610,0.006446215924922839,gbtree,0.570350613467746,5.335848352465234,lossguide,0.0010582019606836506,0.2542397228767274,8,9,0.9354944886506865,200,,0.4002576319821958,0.8592904304761316,none,0.786937831898281,1.0283507836699115,,,,0.6879505269949746,0.8607841130105436,0.8593366093366094,0.4002576319821958,0.7187758478081059,0.7158808933002482,0.8592904304761316,0.8184504851453044,0.8144862705966447,0.6957566052842273,0.6926770708283313,0.7433704020530368,0.7406931964056482,none,0.9234446500044492,0.9225630327611948,0.786937831898281,COMPLETE
1444,0.7099906629318394,2025-09-23 18:24:59.381808,2025-09-23 18:25:00.058263,0 days 00:00:00.676455,0.002807500518282231,gbtree,0.9647758892289763,8.165402873145286,depthwise,0.009166848210627774,0.07480461641304942,9,6,0.3227728648157866,400,,0.4034946333818977,0.9717794917288274,none,0.9782483953688904,1.6155066958930115,,,,0.6563350919110006,0.8421537516634251,0.841011466011466,0.4034946333818977,0.7145501666049612,0.7099906629318394,0.9717794917288274,0.8250103284061336,0.8196912106001498,0.6298955613577023,0.6298873426110007,0.825491873396065,0.8134360290971331,none,0.9263903993155622,0.9245989936685803,0.9782483953688904,COMPLETE
1445,0.6590563165905632,2025-09-23 18:25:00.198250,2025-09-23 18:25:47.022062,0 days 00:00:46.823812,0.00011037493683585932,dart,0.9785183502149515,9.63904337131979,depthwise,0.0002524463503630149,0.003597182246563747,1,12,0.13781211903128085,800,forest,0.670068524128985,0.921862690922417,undersample,0.9487446819064287,4.4918301026067695,0.21248625102361646,uniform,0.7947816367296395,0.9514019392065399,0.7642542737230014,0.7706797706797707,0.670068524128985,0.654256117700045,0.6590563165905632,0.921862690922417,0.8111887064520091,0.8021496774328992,0.5040481147351377,0.5114575950862272,0.9319931565440548,0.9264013692768507,undersample,0.9205515090126569,0.9177581373799417,0.9487446819064287,COMPLETE
1446,0.7180145485665383,2025-09-23 18:25:47.157464,2025-09-23 18:25:47.790131,0 days 00:00:00.632667,0.013536678108349806,gbtree,0.24055661216827673,5.240818888840717,lossguide,0.00010757688182490952,0.18866166104396753,8,9,0.28596788823894215,400,,0.3390743812930543,0.9304611622254838,none,0.9731384241574618,0.7475643609594997,,,,0.8885332732941862,0.8677449073600164,0.8650696150696151,0.3390743812930543,0.7241673783091375,0.7180145485665383,0.9304611622254838,0.8263960801851659,0.8201622056797804,0.7229326513213982,0.7180145485665383,0.7254063301967494,0.7180145485665383,none,0.9266394254572925,0.9249444050864876,0.9731384241574618,COMPLETE
1447,0.6707508639648131,2025-09-23 18:25:47.925418,2025-09-23 18:25:49.329436,0 days 00:00:01.404018,0.6060737655443496,gbtree,0.42469938710119026,0.39005729875429895,depthwise,0.0738647160521819,0.10673291159911795,5,10,0.19054042601830287,800,,0.3051354130571149,0.9080842861277227,undersample,0.8726537391180985,1.1755984338761378,,,,0.8111162500807921,0.7802231548776742,0.7854217854217854,0.3051354130571149,0.6654199781829515,0.6707508639648131,0.9080842861277227,0.8070141236759356,0.8043674980991642,0.5234126011277274,0.5299081657979647,0.9131736526946108,0.9135643988018828,undersample,0.9184073458711506,0.917748348275825,0.8726537391180985,COMPLETE
1448,0.5074285714285715,2025-09-23 18:25:49.464732,2025-09-23 18:25:50.160723,0 days 00:00:00.695991,0.000645185376517575,gbtree,0.7765905413720311,5.301318532460255,lossguide,0.0065417383998546555,0.4124975903219046,2,10,0.4602000982945508,700,,0.6539017566606761,0.822391290150256,none,0.9502461394207754,0.9201849014314313,,,,0.6975907985166657,0.8279250690961204,0.8235053235053235,0.6539017566606761,0.5255433248659328,0.5074285714285715,0.822391290150256,0.6930309419135521,0.6887611300438318,0.7726141078838175,0.763542562338779,0.39820359281437123,0.37997432605905007,none,0.8812752832186714,0.8819481837382597,0.9502461394207754,COMPLETE
1449,0.7180931744312026,2025-09-23 18:25:50.297007,2025-09-23 18:25:50.877916,0 days 00:00:00.580909,0.0019572100346584827,gbtree,0.8946910777840907,3.806423877915307,lossguide,0.0010255308773114745,0.15551549722578878,9,3,0.8526603433590051,300,,0.31725688273238606,0.9687281932739539,none,0.9255530601261389,0.6407504566423676,,,,0.5460333562460167,0.8654928856587163,0.8668099918099919,0.31725688273238606,0.7177835051546392,0.7180931744312026,0.9687281932739539,0.8235988263561442,0.8161678396482536,0.7208800690250216,0.7273924495171202,0.7147134302822925,0.7090286692340607,none,0.9255281178803936,0.9232892403292432,0.9255530601261389,COMPLETE
1450,0.661378889566809,2025-09-23 18:25:51.012710,2025-09-23 18:25:51.594808,0 days 00:00:00.582098,0.0009148920238652267,gbtree,0.8002922740031949,8.39276801406906,depthwise,0.00016111694540539378,0.3549498251292028,3,11,0.4805105121750366,400,,0.5973034521354045,0.9803881538617507,undersample,0.9215619904261736,3.908008564639858,,,,0.8480606594350898,0.7700890572218242,0.7727272727272727,0.5973034521354045,0.6581430745814307,0.661378889566809,0.9803881538617507,0.812471015446194,0.8075098367027163,0.5108695652173914,0.5138658449869637,0.9247219846022241,0.9276850663243474,undersample,0.9202027342742279,0.9204896717177868,0.9215619904261736,COMPLETE
1451,0.7135245901639344,2025-09-23 18:25:51.733389,2025-09-23 18:26:49.693238,0 days 00:00:57.959849,0.0002285982626552131,dart,0.32304396172732197,9.37080857471679,lossguide,0.07174160684527495,0.014294939781524239,4,12,0.4522401529243314,900,forest,0.628697283308277,0.8878710115703512,none,0.780736348607062,3.0872822312613484,0.15313967953931176,uniform,0.7040192713981175,0.8675408359714327,0.8609888422561163,0.8568796068796068,0.628697283308277,0.7234215885947047,0.7135245901639344,0.8878710115703512,0.8255498132446364,0.8177492032491713,0.6905132192846034,0.6846244593000393,0.7596236099230111,0.7449721865639709,none,0.9266444905908813,0.9247821074985285,0.780736348607062,COMPLETE
1452,0.7162938032072856,2025-09-23 18:26:49.828188,2025-09-23 18:26:50.461777,0 days 00:00:00.633589,0.011286582400951137,gbtree,0.6190286997688137,5.227324222621922,depthwise,0.00010965888973020383,0.0632597322925204,6,9,4.637920399170711,200,,0.34251402089249766,0.9580294346751963,none,0.9625574602225558,0.9999039518569693,,,,0.7088623997121569,0.8534138601699253,0.8532964782964783,0.34251402089249766,0.7193257546060369,0.7162938032072856,0.9580294346751963,0.8258411976235218,0.8178378859253077,0.6638929088277858,0.6665438467207074,0.7848588537211292,0.7740693196405648,none,0.9268983228536871,0.9244601899305014,0.9625574602225558,COMPLETE
1453,0.7060708563290012,2025-09-23 18:26:50.597188,2025-09-23 18:26:57.474036,0 days 00:00:06.876848,0.0004482090399713095,dart,0.9829225651328197,6.718717998119441,depthwise,0.0009301876365525104,0.3366975685097587,5,11,0.14251209477269797,300,forest,0.5094801838311757,0.9836090777857018,none,0.9558656032954803,3.616885672980098,0.198940494700211,uniform,0.7768258671086921,0.8117648842703846,0.8271061521138294,0.8309787059787059,0.5094801838311757,0.7030068577457359,0.7060708563290012,0.9836090777857018,0.8268842749360528,0.8204975351918746,0.5968945954016124,0.6045731707317074,0.8550042771599657,0.8485237483953787,none,0.9268886242740312,0.9243455422464046,0.9558656032954803,COMPLETE
1454,0.7135614702154626,2025-09-23 18:26:57.607656,2025-09-23 18:26:58.173070,0 days 00:00:00.565414,0.31929331043279374,gbtree,0.6618392295826031,6.573558891731054,lossguide,0.0018139198253125017,0.30411753241023814,10,8,2.954300739041979,300,,0.32309651229975156,0.9647568116086012,none,0.9327122299329036,0.7175914017001855,,,,0.6152677214395388,0.8643668748080663,0.8611793611793612,0.32309651229975156,0.721580163899979,0.7135614702154626,0.9647568116086012,0.8209955905095287,0.813222039438594,0.7092110698058653,0.704630788485607,0.7343883661248931,0.7227214377406932,none,0.9239826189940898,0.9217904133230399,0.9327122299329036,COMPLETE
1455,0.7109216402760861,2025-09-23 18:26:58.309183,2025-09-23 18:27:16.352258,0 days 00:00:18.043075,0.0005773118203404332,dart,0.8489068555175046,7.296078017200866,depthwise,0.0014106371546414658,0.49733719263524306,5,9,0.1314781993284197,500,forest,0.6536587912833686,0.9861329653758159,none,0.9701885761317215,3.5252950842336195,0.12573707379078644,uniform,0.6923145425801721,0.4027684846159074,0.8532091309243526,0.8542178542178542,0.6536587912833686,0.7118167202572347,0.7109216402760861,0.9861329653758159,0.8083478825763937,0.8040995596080703,0.6713419257012888,0.6763229045963692,0.7574850299401198,0.7492511767222936,none,0.9182219792492987,0.9169568704165039,0.9701885761317215,COMPLETE
1456,0.6624673528959901,2025-09-23 18:27:16.487783,2025-09-23 18:27:20.037732,0 days 00:00:03.549949,0.0024372032455796085,dart,0.7284108089450156,4.43082714618854,depthwise,3.4781516630429854,0.15834954980311333,1,7,19.407521802521572,200,forest,0.6215712808777921,0.8666597286512814,oversample,0.9963631656833234,4.1326193744564375,0.27789504536186777,uniform,0.8997145599665874,0.8695099881389357,0.769781963353465,0.7750819000819,0.6215712808777921,0.6575300746155017,0.6624673528959901,0.8666597286512814,0.8131209361478676,0.8064130170803644,0.510522582170726,0.5167785234899329,0.9234388366124893,0.9225502781343603,oversample,0.9193489714728222,0.9185936949992707,0.9963631656833234,COMPLETE
1457,0.6994311717861206,2025-09-23 18:27:20.174023,2025-09-23 18:27:55.558634,0 days 00:00:35.384611,0.0007832335527218968,dart,0.5834770659065325,6.345258775567048,lossguide,0.0038370414286719398,0.020676963007570603,1,11,0.8390645555595359,700,tree,0.6974397755958407,0.7949245083901784,none,0.9974656896230363,3.1325001787098965,0.2028111070476886,uniform,0.5751911787610173,0.9187042873569665,0.8663118026410073,0.8647624897624898,0.6974397755958407,0.7057232987832357,0.6994311717861206,0.7949245083901784,0.8077417368483121,0.8037057866074644,0.7457142857142857,0.7468415937803693,0.669803250641574,0.6576807873341891,none,0.9157064209432223,0.9158658747626933,0.9974656896230363,COMPLETE
1458,0.7188849627012172,2025-09-23 18:27:55.694243,2025-09-23 18:28:07.322153,0 days 00:00:11.627910,0.0029235132866523928,dart,0.8127712439250948,2.2405189801373897,lossguide,0.0059891936370231585,0.09603538458782959,9,4,0.2503526702068505,400,forest,0.4115838342109523,0.9674092916034869,none,0.9682151852391927,1.4028156452136276,0.005514616848390913,uniform,0.7086545656213423,0.42263018382998463,0.853618589415498,0.8533988533988534,0.4115838342109523,0.7212475633528265,0.7188849627012172,0.9674092916034869,0.8251598582763018,0.818936759896373,0.6626074498567335,0.6641276750090678,0.7912745936698032,0.7834830979888746,none,0.9268675867021365,0.9238678915484735,0.9682151852391927,COMPLETE
1459,0.6971940092959201,2025-09-23 18:28:07.457853,2025-09-23 18:28:08.302398,0 days 00:00:00.844545,0.00023736897484350286,gbtree,0.8705984319301847,8.006714732650156,depthwise,0.00041133953971043475,0.2201168056292995,4,9,0.29358928001939716,900,,0.6950079327119049,0.9864373936541354,oversample,0.8073254510137454,3.9395497468890333,,,,0.5835833940267784,0.8167673252124066,0.8199221949221949,0.6950079327119049,0.6958885490995583,0.6971940092959201,0.9864373936541354,0.8136101616900793,0.8114450800692347,0.5772266065388951,0.5832373271889401,0.8759623609923011,0.8664955070603337,oversample,0.9212867304205823,0.9195468946168969,0.8073254510137454,COMPLETE
1460,0.6646266829865362,2025-09-23 18:28:08.439069,2025-09-23 18:28:12.314010,0 days 00:00:03.874941,0.0028772000794181733,dart,0.8994748893344819,5.102206969874807,lossguide,0.0041206677446886456,0.028462245129647526,10,7,0.10699027903720094,200,forest,0.374796517720312,0.9113088420420263,oversample,0.9646232958995179,1.3048389729207828,0.22916606503445222,uniform,0.7094788915013308,0.7934457812302805,0.7707032449585424,0.7755937755937756,0.374796517720312,0.6605031827826614,0.6646266829865362,0.9113088420420263,0.820912107618863,0.8149578676131934,0.5115023474178404,0.5172660157180281,0.9319931565440548,0.9293966623876765,oversample,0.924280684838294,0.9224844320134339,0.9646232958995179,COMPLETE
1461,0.6675020885547202,2025-09-23 18:28:12.452363,2025-09-23 18:28:13.425528,0 days 00:00:00.973165,0.0018346064885336828,gbtree,0.4999426993428488,1.837587973224652,lossguide,0.00017086144229615957,0.44217977191045615,7,11,0.38099024642253365,300,,0.30675405748183276,0.8291867481849642,none,0.9159740098332345,0.7651006562110839,,,,0.5221869594980764,0.8320196540075749,0.8370188370188371,0.30675405748183276,0.6598963730569948,0.6675020885547202,0.8291867481849642,0.7587155998797601,0.7629983508067766,0.640128669079212,0.6519787841697267,0.6809238665526091,0.6837826272999572,none,0.8903505060931831,0.8942582700798855,0.9159740098332345,COMPLETE
1462,0.6185064935064936,2025-09-23 18:28:13.563083,2025-09-23 18:28:15.330329,0 days 00:00:01.767246,0.00020449918645651228,gbtree,0.6202015856461703,6.228422916427265,depthwise,0.01870152190198757,0.0036966177402339324,1,12,0.10886143418389972,700,,0.6974336605890384,0.940510815737973,none,0.8448902447444481,1.8619810404460946,,,,0.4583300900324595,0.8555635172484389,0.8556511056511057,0.6974336605890384,0.6193687618019962,0.6185064935064936,0.940510815737973,0.7995552305360166,0.7938263358254564,0.8385682980277575,0.8410596026490066,0.49101796407185627,0.4890885750962773,none,0.9157741095466372,0.9145329154883033,0.8448902447444481,COMPLETE
1463,0.7198975234842016,2025-09-23 18:28:15.465480,2025-09-23 18:28:19.262331,0 days 00:00:03.796851,0.9581811705632465,dart,0.9119004116374125,7.4947611202207325,lossguide,0.040561772691015255,0.12979628292198112,2,12,4.280170939514992,200,forest,0.6668229389458387,0.9155943205779422,none,0.9597183538606098,3.0373404232325405,0.1053883533029088,uniform,0.6781064347085075,0.7319243523393038,0.8669259903777254,0.8656838656838657,0.6668229389458387,0.7229326513213982,0.7198975234842016,0.9155943205779422,0.8273030253456275,0.8193535950339854,0.7204757858963466,0.7183638687686408,0.7254063301967494,0.7214377406931964,none,0.9277512510592172,0.9248480399939032,0.9597183538606098,COMPLETE
1464,0.6768044549153994,2025-09-23 18:28:19.399564,2025-09-23 18:28:20.330949,0 days 00:00:00.931385,0.015555581363751198,gbtree,0.5416498010016537,1.762126394070651,lossguide,0.00926445369120755,0.08624378145646588,9,10,2.3909488341019047,200,,0.30679470716445034,0.9762715576352803,none,0.9631775515979177,0.5955896192020667,,,,0.6185836872976427,0.8397993653393387,0.8455159705159705,0.30679470716445034,0.6717012796307951,0.6768044549153994,0.9762715576352803,0.7528546730691903,0.7466792030753948,0.6591189790037052,0.6775300171526587,0.6847733105218136,0.6760804450149764,none,0.9016159387781908,0.901097514045493,0.9631775515979177,COMPLETE
