number,value,datetime_start,datetime_complete,duration,params_alpha,params_booster,params_colsample_bytree,params_gamma,params_grow_policy,params_lambda,params_learning_rate,params_max_delta_step,params_max_depth,params_min_child_weight,params_n_estimators,params_normalize_type,params_params_decision_threshold,params_params_feature_fraction,params_params_resampling,params_params_sample_rows,params_params_scale_pos_weight,params_rate_drop,params_sample_type,params_skip_drop,params_subsample,user_attrs_acc_test,user_attrs_acc_val,user_attrs_decision_threshold,user_attrs_f1_test,user_attrs_f1_val,user_attrs_feature_fraction,user_attrs_pr_auc_test,user_attrs_pr_auc_val,user_attrs_prec_test,user_attrs_prec_val,user_attrs_rec_test,user_attrs_rec_val,user_attrs_resampling_strategy,user_attrs_roc_auc_test,user_attrs_roc_auc_val,user_attrs_sample_rows,state
346,0.6590750639089008,2025-09-23 13:08:43.350633,2025-09-23 13:09:48.837944,0 days 00:01:05.487311,0.6748481531851114,dart,0.902270304686877,1.7518639955310866,lossguide,72.071858206589,0.06483464038376548,7,7,0.5041124552267475,1000,tree,0.6035053978811653,0.5154764120745821,undersample,0.7316075232724768,0.5096918186687094,0.22731159531432926,uniform,0.8485820635981609,0.725829970153762,0.8544375063977889,0.8498157248157249,0.6035053978811653,0.6725011515430677,0.6590750639089008,0.5154764120745821,0.7737813091142507,0.761021183534691,0.7285429141716567,0.7212614445574771,0.6244653550042771,0.6067608044501498,undersample,0.9040361229211225,0.8995872856121417,0.7316075232724768,COMPLETE
347,0.6061597165440175,2025-09-23 13:09:48.960455,2025-09-23 13:09:50.044684,0 days 00:00:01.084229,0.00017286416721283424,gbtree,0.597536626898278,7.883326084240688,depthwise,0.06057911728617983,0.004188422381821984,6,7,0.6185706760750866,700,,0.4606170423380341,0.8127013990133753,undersample,0.9382912868345763,2.8083378521214697,,,,0.9558137356625804,0.7016071245777459,0.7041359541359541,0.4606170423380341,0.6059213194538327,0.6061597165440175,0.8127013990133753,0.7812109497386345,0.7726449330907077,0.44297291954931806,0.44471105778844233,0.9585115483319077,0.9516474112109542,undersample,0.9100566961123604,0.9064245141739606,0.9382912868345763,COMPLETE
348,0.3897598398932622,2025-09-23 13:09:50.167337,2025-09-23 13:09:50.828562,0 days 00:00:00.661225,0.00031334688575001185,gbtree,0.2695360915267708,8.515438522483644,depthwise,1.2210974506498,0.0015220466129832481,8,10,1.4609803380076334,300,,0.6120715273665245,0.6672720755391247,oversample,0.6495851363763541,4.9966437135419595,,,,0.6523032707979386,0.25028150271266253,0.2508190008190008,0.6120715273665245,0.38966666666666666,0.3897598398932622,0.6672720755391247,0.684143517150335,0.6842449504735402,0.2419788863589319,0.24205075090626618,1.0,1.0,oversample,0.8677636076828408,0.8718723452453486,0.6495851363763541,COMPLETE
349,0.5349048050770625,2025-09-23 13:09:50.949255,2025-09-23 13:09:51.649867,0 days 00:00:00.700612,0.1880347134977489,gbtree,0.6413420687179501,5.3025860392415405,depthwise,1.5491166786077593,0.022795396967316018,9,7,5.800597534341901,800,,0.6589149896770633,0.5523742741388361,none,0.6712773089535199,0.7971249948344481,,,,0.937977358138093,0.8469648889343843,0.8424447174447175,0.6589149896770633,0.5525291828793775,0.5349048050770625,0.5523742741388361,0.8130192301641582,0.8076058412062834,0.9202392821535393,0.9104938271604939,0.3947818648417451,0.37869062901155326,none,0.919968040158221,0.9191296196581795,0.6712773089535199,COMPLETE
350,0.6548942000304461,2025-09-23 13:09:51.770686,2025-09-23 13:10:09.782010,0 days 00:00:18.011324,0.0014349965215398764,dart,0.5004424227635247,4.993294744204783,depthwise,0.011236584805185343,0.007578146526812385,6,7,9.59806608855511,500,tree,0.3963123113853015,0.8249538145684034,none,0.9866281209659229,3.5188875861916524,0.30922963249207935,uniform,0.889106889670999,0.5715785099566442,0.7612856996621967,0.767915642915643,0.3963123113853015,0.6502699460107978,0.6548942000304461,0.8249538145684034,0.7910358992403932,0.7818553596418177,0.5006928406466513,0.5082703213610587,0.9272882805816938,0.920410783055199,none,0.9147584639245646,0.9115698976295799,0.9866281209659229,COMPLETE
351,0.38612143742255267,2025-09-23 13:10:09.901176,2025-09-23 13:10:20.322506,0 days 00:00:10.421330,0.014645937104210317,dart,0.22988797080491247,4.05286911723989,depthwise,0.0002446595920267144,0.00010062086301530003,0,12,16.18207281052789,400,forest,0.5598888745194301,0.7330077640208308,oversample,0.9323150050306934,2.2062153794694845,0.21299201225807896,uniform,0.11750881491053879,0.3022790481352335,0.23932848807452145,0.23925061425061425,0.5598888745194301,0.3862228462872718,0.38612143742255267,0.7330077640208308,0.7209957136356645,0.7107738237837139,0.23932848807452145,0.23925061425061425,1.0,1.0,oversample,0.8806402996533031,0.8778422591824243,0.9323150050306934,COMPLETE
352,0.7138643067846607,2025-09-23 13:10:20.445241,2025-09-23 13:10:27.615451,0 days 00:00:07.170210,0.024023379998707694,gbtree,0.7024497476616236,0.5765929484178456,lossguide,0.14835794804524755,0.020174337303204722,9,11,0.16338995869928324,500,,0.3658340720495248,0.9525293751476575,none,0.9702484048814497,1.8559467947767887,,,,0.7883450650801354,0.8388780837342614,0.8411138411138411,0.3658340720495248,0.7110866372980911,0.7138643067846607,0.9525293751476575,0.828564724891568,0.8232407935209383,0.6228295819935691,0.6271460965338517,0.8284858853721129,0.8284124946512623,none,0.927508700230314,0.9259075089741613,0.9702484048814497,COMPLETE
353,0.6866260308354248,2025-09-23 13:10:27.737523,2025-09-23 13:10:44.563100,0 days 00:00:16.825577,0.007737736113542237,dart,0.4524726747653426,0.7911447068794097,depthwise,0.06389588822122479,0.00937959111442818,10,3,0.22392992603817108,500,forest,0.5655361193657155,0.9101426690664031,undersample,0.5037433702878116,1.0495081149190089,0.02716451230960598,weighted,0.2365950191427438,0.9050541444750819,0.8173815129491248,0.821048321048321,0.5655361193657155,0.6844711708524938,0.6866260308354248,0.9101426690664031,0.7934086406770772,0.787456247794326,0.5835343787696019,0.5908670163529774,0.8276304533789564,0.8194266153187848,undersample,0.9116399820464038,0.9103747631828569,0.5037433702878116,COMPLETE
354,0.6897952276188865,2025-09-23 13:10:44.683607,2025-09-23 13:10:45.244734,0 days 00:00:00.561127,0.06383031535621803,gbtree,0.286432094539796,6.02134638525865,depthwise,1.740519597566171,0.008432440388983647,8,12,0.6033062919858401,200,,0.3454940241102868,0.8080081178280517,none,0.8462973902704853,1.652999365745646,,,,0.7134647863242396,0.8048930289691882,0.8123464373464373,0.3454940241102868,0.6843325604504803,0.6897952276188865,0.8080081178280517,0.791737496679229,0.7839257797531318,0.5583783783783783,0.5705487122060471,0.88366124893071,0.8720581942661532,none,0.9150030580744043,0.9140071254313036,0.8462973902704853,COMPLETE
355,0.0,2025-09-23 13:10:45.368992,2025-09-23 13:11:10.190181,0 days 00:00:24.821189,0.021938062597263736,dart,0.3327291366368324,4.138706689763509,lossguide,10.990151511065118,0.003150402613626992,2,5,0.20889062503396655,700,tree,0.6047227691277555,0.5945588947744195,none,0.8201351168419726,1.5219349872077028,0.4050707710887535,uniform,0.2527700686985821,0.24138686064750106,0.7606715119254785,0.7607493857493858,0.6047227691277555,0.0,0.0,0.5945588947744195,0.729936854800584,0.7201021501450537,0.0,0.0,0.0,0.0,none,0.8862686703414211,0.8846032191065808,0.8201351168419726,COMPLETE
356,0.6291103747132297,2025-09-23 13:11:10.310234,2025-09-23 13:11:10.799555,0 days 00:00:00.489321,0.05579023608267322,gbtree,0.7618681035646051,5.391445965928688,depthwise,10.55142637702833,0.30327998813631146,4,12,25.43809332564684,800,,0.436254137888787,0.5769015934750858,none,0.9272811479231914,0.6599242802312266,,,,0.501534161385959,0.8538233186610708,0.851044226044226,0.436254137888787,0.6422845691382766,0.6291103747132297,0.5769015934750858,0.7793774474999123,0.7762369139415953,0.7750906892382105,0.7780580075662042,0.5483319076133447,0.5280273855370132,none,0.9049504658714177,0.9033001776376899,0.9272811479231914,COMPLETE
357,0.6244725738396625,2025-09-23 13:11:10.922453,2025-09-23 13:11:25.305959,0 days 00:00:14.383506,0.002816343460645309,dart,0.790565189887757,4.781171345106578,depthwise,0.0010050595374753244,0.010501738691416393,3,8,5.405272326052342,500,forest,0.3233250393907631,0.9895339997787589,oversample,0.7763188921090661,1.725571248086097,0.4796438452652658,uniform,0.3954409298160041,0.9152394772935597,0.7252533524413962,0.7266584766584766,0.3233250393907631,0.6244052616848587,0.6244725738396625,0.9895339997787589,0.8148467029683473,0.8059887612492695,0.46401830282861894,0.46511627906976744,0.9542343883661248,0.9499358151476252,oversample,0.9204079585220813,0.9180617147734913,0.7763188921090661,COMPLETE
358,0.6061370323665406,2025-09-23 13:11:25.426708,2025-09-23 13:12:21.472612,0 days 00:00:56.045904,0.006339647736051385,dart,0.554449643462956,7.4019713937457645,lossguide,0.0023352776524630755,0.001014408854728268,8,3,3.982590587580229,1000,tree,0.39115891151186816,0.6013687072875824,oversample,0.7152733407729723,0.8428395091667162,0.3576725253019808,uniform,0.5154027823415701,0.35563074338311573,0.7053946156208415,0.7122235872235873,0.39115891151186816,0.6000555864369094,0.6061370323665406,0.6013687072875824,0.7250322251320744,0.7228536711636461,0.44442157266364757,0.450625,0.9234388366124893,0.9255455712451861,oversample,0.8848822339173087,0.8831204577477217,0.7152733407729723,COMPLETE
359,0.6514399205561072,2025-09-23 13:12:21.594720,2025-09-23 13:12:22.638703,0 days 00:00:01.043983,10.976456956039229,gbtree,0.4617925692315087,5.552997507340152,lossguide,0.7168000588701274,0.013085855224070918,1,4,1.32176259666189,1000,,0.6423228609226516,0.8920834194476452,oversample,0.9226499211642858,0.5330396220387764,,,,0.6058104263644586,0.8619101238611936,0.8562653562653563,0.6423228609226516,0.6707346839150597,0.6514399205561072,0.8920834194476452,0.7963261016396345,0.7864763973230926,0.7811256395679363,0.7758722649319929,0.5876817792985458,0.5614035087719298,oversample,0.9156243427557481,0.9129196999213475,0.9226499211642858,COMPLETE
360,0.38612143742255267,2025-09-23 13:12:22.760318,2025-09-23 13:12:25.565178,0 days 00:00:02.804860,44.70765700515129,dart,0.7102421696346548,3.008933703196306,depthwise,0.0009087382781052323,0.0009280520020881836,1,6,1.4798143087732598,200,tree,0.6051686843230717,0.632862295276118,undersample,0.8235279459570297,2.7759077579832456,0.3942906784287842,weighted,0.6971976647765668,0.5434230674814575,0.23932848807452145,0.23925061425061425,0.6051686843230717,0.3862228462872718,0.38612143742255267,0.632862295276118,0.7048822258710974,0.6957622047982314,0.23932848807452145,0.23925061425061425,1.0,1.0,undersample,0.8838713080788074,0.8832657395694072,0.8235279459570297,COMPLETE
361,0.38612143742255267,2025-09-23 13:12:25.686614,2025-09-23 13:12:28.474472,0 days 00:00:02.787858,3.0480112595465005,dart,0.766431237452448,2.4212015317306532,depthwise,0.010290081969200747,0.0016610090638869508,7,10,57.28514689624742,200,tree,0.4631510117003804,0.8811394276019103,undersample,0.60677381284378,1.764912515828572,0.45146235211843816,uniform,0.7235470986800395,0.25927948805501205,0.23932848807452145,0.23925061425061425,0.4631510117003804,0.3862228462872718,0.38612143742255267,0.8811394276019103,0.692213339070641,0.684378263676526,0.23932848807452145,0.23925061425061425,1.0,1.0,undersample,0.8685375946302217,0.8677659600257901,0.60677381284378,COMPLETE
362,0.6611836800516045,2025-09-23 13:12:28.597078,2025-09-23 13:12:29.610978,0 days 00:00:01.013900,0.00011957535078228213,gbtree,0.33768424978751976,8.350537825118439,lossguide,0.002081090889134286,0.005972706026345128,1,9,0.1535581449379636,300,,0.5080197326556976,0.8533672872503016,oversample,0.5223702989161685,1.1648481005645497,,,,0.7147495091655693,0.7795066025181697,0.7849099099099099,0.5080197326556976,0.6573337575564747,0.6611836800516045,0.8533672872503016,0.7529135392758434,0.7446924838586816,0.5233029381965553,0.5305383022774327,0.88366124893071,0.8771929824561403,oversample,0.9009170654595994,0.9005808220970253,0.5223702989161685,COMPLETE
363,0.638835807731883,2025-09-23 13:12:29.735353,2025-09-23 13:12:30.583754,0 days 00:00:00.848401,0.004408497113325227,gbtree,0.7229906143152645,5.708257973971729,depthwise,0.0036590816938417386,0.015704101184528866,0,8,0.26133711199042875,1000,,0.3976186320494705,0.7215837180004699,undersample,0.9547577134961341,1.4184076083987927,,,,0.5471021249324823,0.7418364213327874,0.7484643734643734,0.3976186320494705,0.6311787072243346,0.638835807731883,0.7215837180004699,0.7363196279511413,0.7314672149017668,0.47955555555555557,0.4865651589789521,0.9230111206159111,0.9298245614035088,undersample,0.8949682962928173,0.8964736882989168,0.9547577134961341,COMPLETE
364,0.6294270083501295,2025-09-23 13:12:30.704764,2025-09-23 13:12:56.148881,0 days 00:00:25.444117,0.09640592163246418,dart,0.7499977717326791,5.887394715110805,depthwise,0.24910669872077218,0.22785542614482762,7,6,27.264219989819907,600,tree,0.4756149399687859,0.5012565531525325,oversample,0.9859898602947463,3.2961553487883593,0.06465350623686345,weighted,0.7181249767862543,0.2770541217966711,0.7337496161326645,0.7364864864864865,0.4756149399687859,0.6292230933713471,0.6294270083501295,0.5012565531525325,0.7785622801841743,0.7683058002202724,0.4718836861235835,0.47428943371664134,0.9439692044482464,0.9353872486093282,oversample,0.9098199298962488,0.9050465250206334,0.9859898602947463,COMPLETE
365,0.6864673485444532,2025-09-23 13:12:56.271730,2025-09-23 13:13:00.049968,0 days 00:00:03.778238,0.01014712419415618,gbtree,0.7402184011467698,2.352247481879938,lossguide,0.0607441772443612,0.016433650298990254,7,9,0.2028790382929527,800,,0.6386500668623769,0.793733120238636,none,0.5988166281896348,4.013795966597362,,,,0.8264484215941406,0.8401064592076978,0.8368140868140869,0.6386500668623769,0.6983391270760911,0.6864673485444532,0.793733120238636,0.7934137371635991,0.7791606093797881,0.6366197183098592,0.6352384419366581,0.7733105218135158,0.7466837826273,none,0.9103126292544386,0.9065900076164988,0.5988166281896348,COMPLETE
366,0.518840579710145,2025-09-23 13:13:00.172475,2025-09-23 13:13:01.021770,0 days 00:00:00.849295,2.9715497916177234,gbtree,0.544647563132975,5.670903363551346,lossguide,1.226312046428812,0.003412144241003307,3,5,65.26026186734927,800,,0.6541128254492118,0.6085798818374615,undersample,0.6264175799377188,0.5493976997243509,,,,0.5573714748632983,0.8294605384379159,0.8300573300573301,0.6541128254492118,0.51905311778291,0.518840579710145,0.6085798818374615,0.7209274226123459,0.7193538511932488,0.7984014209591475,0.8041329739442947,0.38451668092386654,0.38296961916987593,undersample,0.8840790936726236,0.8824571595693647,0.6264175799377188,COMPLETE
367,0.0,2025-09-23 13:13:01.144219,2025-09-23 13:13:01.622523,0 days 00:00:00.478304,0.01695182525092501,gbtree,0.2608813632709761,4.563776588479357,depthwise,0.0005788041981760022,0.0013340387579387492,4,5,31.54741924645396,300,,0.580617142473233,0.6800653969767398,none,0.9679180071498807,1.090634955697774,,,,0.45853423433824275,0.7606715119254785,0.7607493857493858,0.580617142473233,0.0,0.0,0.6800653969767398,0.7605165326462967,0.7531034607800001,0.0,0.0,0.0,0.0,none,0.902177132556503,0.9007400102048531,0.9679180071498807,COMPLETE
368,0.5649227432908648,2025-09-23 13:13:01.742585,2025-09-23 13:13:45.170503,0 days 00:00:43.427918,0.00012237376533080457,dart,0.9758604029848494,1.693204844998507,lossguide,0.00601098744629622,0.047650178546553956,9,5,0.29001438286565123,1000,forest,0.4472958346559054,0.8140778354407905,none,0.8716225056874718,0.5694893797189079,0.46972800895620975,uniform,0.022793698984106738,0.5869162913295045,0.8374449790152523,0.8356879606879607,0.4472958346559054,0.5758547008547008,0.5649227432908648,0.8140778354407905,0.7357303179552541,0.7308981089733169,0.7667140825035562,0.7707100591715976,0.46107784431137727,0.4458707744972187,none,0.8903106469453388,0.8922128655661756,0.8716225056874718,COMPLETE
369,0.531855309218203,2025-09-23 13:13:45.298484,2025-09-23 13:13:46.091432,0 days 00:00:00.792948,4.875828043465182,gbtree,0.6028112847391238,2.3016157765452103,depthwise,0.21206525193669795,0.0005455071900686421,9,6,31.498479752444577,500,,0.46119449852229283,0.6806179056706443,oversample,0.8367084212775184,1.1794314723891093,,,,0.22063558479924802,0.5858327362063671,0.5892710892710893,0.46119449852229283,0.5304085422469823,0.531855309218203,0.6806179056706443,0.740260086790462,0.7351294769691501,0.3639694170117872,0.3656345259104765,0.9773310521813516,0.9751818570817287,oversample,0.8858897350348037,0.8814458587396574,0.8367084212775184,COMPLETE
370,0.6159061277705346,2025-09-23 13:13:46.220143,2025-09-23 13:14:36.466870,0 days 00:00:50.246727,0.025835568970996165,dart,0.3329961258528963,2.6848357559923564,lossguide,30.64537675948331,0.010239734205590727,0,10,28.853802005386118,800,forest,0.5484264430352053,0.6007575656218436,none,0.928144558653216,1.1254760033474174,0.38531290588354544,weighted,0.6836690001621949,0.6241726143047097,0.8532091309243526,0.8492014742014742,0.5484264430352053,0.6269510926118627,0.6159061277705346,0.6007575656218436,0.772640578243937,0.7643856190783795,0.800132802124834,0.7883845126835781,0.5153977758768178,0.5053487376979033,none,0.9012023821323268,0.8993188338274817,0.928144558653216,COMPLETE
371,0.38612143742255267,2025-09-23 13:14:36.599916,2025-09-23 13:14:55.161360,0 days 00:00:18.561444,0.0012731996590265538,dart,0.8549060490805178,8.020842826887446,depthwise,0.0740110936779646,0.0014035631843439616,4,3,0.2518942408801104,500,forest,0.332669201356196,0.5069156862308404,oversample,0.9604295963886436,1.7256804401894792,0.37225114540502474,uniform,0.495286234475514,0.3291451743947268,0.23932848807452145,0.23925061425061425,0.332669201356196,0.3862228462872718,0.38612143742255267,0.5069156862308404,0.6679724901452383,0.65570326400196,0.23932848807452145,0.23925061425061425,1.0,1.0,oversample,0.8710078833048476,0.8719823862922139,0.9604295963886436,COMPLETE
372,0.6566294317629917,2025-09-23 13:14:55.285838,2025-09-23 13:14:55.746220,0 days 00:00:00.460382,0.04554932926674072,gbtree,0.41548219724720026,4.790749157929634,lossguide,0.1627869015950827,0.01809869838333174,5,4,66.55661755788147,200,,0.643803354750007,0.9013040533822403,none,0.7467477544711237,2.289637827355188,,,,0.6290778626984617,0.8577131743269526,0.8552416052416052,0.643803354750007,0.6658653846153846,0.6566294317629917,0.9013040533822403,0.7829522227551898,0.7765544832381056,0.7601536772777168,0.7591240875912408,0.5923866552609067,0.5785194694052204,none,0.9095112445390089,0.9081199870069797,0.7467477544711237,COMPLETE
373,0.6825422365245374,2025-09-23 13:14:55.873971,2025-09-23 13:14:56.610509,0 days 00:00:00.736538,0.8840554511915455,gbtree,0.7297819259431528,7.177293639412117,depthwise,0.005662983839154278,0.08411976425375937,4,12,1.5618465722239838,800,,0.49096364738873144,0.8610557997272354,oversample,0.6422568477842912,2.3813967463567716,,,,0.614016758924986,0.7942471081994062,0.798013923013923,0.49096364738873144,0.6802418071905822,0.6825422365245374,0.8610557997272354,0.8225073017358464,0.8149145340707568,0.5415400202634245,0.5469314079422383,0.9144568006843456,0.9075738125802311,oversample,0.9258191616075768,0.9234020453584473,0.6422568477842912,COMPLETE
374,0.38612143742255267,2025-09-23 13:14:56.741041,2025-09-23 13:15:00.195105,0 days 00:00:03.454064,0.8047423793711159,dart,0.8874127786502706,5.036150487320212,depthwise,0.0005384879777854038,0.0017981967531286757,3,12,0.11502267115668052,200,forest,0.49417038962166493,0.6310105942214043,oversample,0.7177067512334196,2.7637468654811936,0.4872364476703173,weighted,0.3905296400867228,0.784804868751501,0.23932848807452145,0.23925061425061425,0.49417038962166493,0.3862228462872718,0.38612143742255267,0.6310105942214043,0.7356263223047613,0.7344856451538644,0.23932848807452145,0.23925061425061425,1.0,1.0,oversample,0.8947848003168932,0.8903107850533278,0.7177067512334196,COMPLETE
375,0.6171298922291548,2025-09-23 13:15:00.322571,2025-09-23 13:15:02.038366,0 days 00:00:01.715795,0.511500131412401,gbtree,0.4708829400209834,9.687024546738257,lossguide,0.0012870736971807109,0.0031914511018406155,6,11,12.59045744067637,900,,0.6957623072120497,0.6004656259151251,undersample,0.9413306703461293,4.632042007999487,,,,0.23794442460628337,0.7203398505476507,0.7235872235872236,0.6957623072120497,0.6147772137619854,0.6171298922291548,0.6004656259151251,0.7065918931524385,0.6975176244613079,0.4585612116112747,0.46150583244962884,0.932420872540633,0.9311082584510055,undersample,0.886739468752673,0.88705887345723,0.9413306703461293,COMPLETE
376,0.688763431069022,2025-09-23 13:15:02.166845,2025-09-23 13:16:07.446930,0 days 00:01:05.280085,0.01576001790332683,dart,0.4957757313037907,9.396444968033004,depthwise,2.9600264550591304,0.1461030091970232,6,3,6.678923830590002,1000,forest,0.6085582752108862,0.8974364888686863,oversample,0.595694679074432,1.239715209101644,0.2536656955766675,uniform,0.17112560681210784,0.707839325413882,0.8194288054048521,0.82504095004095,0.6085582752108862,0.684887459807074,0.688763431069022,0.8974364888686863,0.7910506659991103,0.78374836306751,0.588036809815951,0.5995561192136969,0.8199315654405475,0.8091570389388104,oversample,0.9107833701073544,0.9088964357123331,0.595694679074432,COMPLETE
