number,value,datetime_start,datetime_complete,duration,params_alpha,params_booster,params_colsample_bytree,params_gamma,params_grow_policy,params_lambda,params_learning_rate,params_max_delta_step,params_max_depth,params_min_child_weight,params_n_estimators,params_normalize_type,params_params_decision_threshold,params_params_feature_fraction,params_params_resampling,params_params_sample_rows,params_params_scale_pos_weight,params_rate_drop,params_sample_type,params_skip_drop,params_subsample,user_attrs_acc_test,user_attrs_acc_val,user_attrs_decision_threshold,user_attrs_f1_test,user_attrs_f1_val,user_attrs_feature_fraction,user_attrs_pr_auc_test,user_attrs_pr_auc_val,user_attrs_prec_test,user_attrs_prec_val,user_attrs_rec_test,user_attrs_rec_val,user_attrs_resampling_strategy,user_attrs_roc_auc_test,user_attrs_roc_auc_val,user_attrs_sample_rows,state
2854,0.7077702702702703,2025-09-24 02:52:35.746322,2025-09-24 02:52:37.038713,0 days 00:00:01.292391,0.0032359508152359664,gbtree,0.27166474465709933,1.8350352279066031,lossguide,0.025507725526755766,0.22875194835439358,2,6,0.20300487872553655,400,,0.6882272766330132,0.8837598538059137,none,0.9257257030297966,3.796505572951764,,,,0.5118596946835795,0.8580202681953117,0.8583128583128583,0.6882272766330132,0.7103779494675297,0.7077702702702703,0.8837598538059137,0.8087422286837856,0.8046939859973687,0.6940024479804161,0.6986244268445185,0.7275449101796407,0.7171587505348738,none,0.9166830995716623,0.9163755415893832,0.9257257030297966,COMPLETE
2855,0.6906235126130414,2025-09-24 02:52:37.191435,2025-09-24 02:52:38.521513,0 days 00:00:01.330078,0.0005196939332249027,gbtree,0.9224692996097783,4.300323252325763,lossguide,0.0002712661678214043,0.014107953407470047,10,8,1.8507585147836818,200,,0.4736068584450854,0.931232194204693,none,0.9564699662501875,1.0344562762037528,,,,0.5440785105519633,0.8702016583068891,0.866912366912367,0.4736068584450854,0.6999526739233317,0.6906235126130414,0.931232194204693,0.8186994124383663,0.8109642295979089,0.7833686440677966,0.7780160857908848,0.6325919589392643,0.6208814719726145,none,0.921806050509282,0.9194385810589933,0.9564699662501875,COMPLETE
2856,0.6486068111455109,2025-09-24 02:52:38.673305,2025-09-24 02:52:41.777164,0 days 00:00:03.103859,0.003031310452834454,dart,0.4140929391481314,6.847565908195101,lossguide,1.1256342016658434,0.0722825403416374,3,11,0.2660729689917658,200,forest,0.6391895232092697,0.9740103838272769,oversample,0.9374581658232654,0.5176502676491078,0.47561785937014617,weighted,0.26121480373884026,0.28772886294655176,0.8620124884839799,0.8605651105651105,0.6391895232092697,0.6550665301944729,0.6486068111455109,0.9740103838272769,0.804927263707629,0.7963252094467935,0.8152866242038217,0.8167641325536062,0.5474764756201882,0.5378690629011553,oversample,0.9172132694067427,0.9147430069375381,0.9374581658232654,COMPLETE
2857,0.6771271433193141,2025-09-24 02:52:41.939878,2025-09-24 02:52:43.056782,0 days 00:00:01.116904,0.034142267148566274,gbtree,0.8477950131512264,5.968555475716265,lossguide,0.07799139763891316,0.01681691079220726,6,8,0.1689457999060858,200,,0.4387302388589004,0.9400851898874261,undersample,0.9950883601652162,1.060506316025675,,,,0.6608764526388937,0.7896407001740199,0.7956592956592956,0.4387302388589004,0.6719872306464485,0.6771271433193141,0.9400851898874261,0.8100349314606559,0.8045622427988284,0.5360325948561243,0.5443433029908973,0.9003421727972626,0.8955926401369276,undersample,0.9183470535139423,0.9165549989010291,0.9950883601652162,COMPLETE
2858,0.7003731343283582,2025-09-24 02:52:43.209699,2025-09-24 02:52:47.054042,0 days 00:00:03.844343,0.020399920204472045,dart,0.597187969658985,0.37120046981869703,lossguide,0.0010138946125313056,0.05901508167092543,2,8,40.5963806509707,200,forest,0.6591431564994437,0.979550385843342,none,0.8632317525737832,4.808554250271135,0.04595222918234945,weighted,0.8457614274176963,0.48079016160173893,0.8369331559013206,0.8355855855855856,0.6591431564994437,0.7054908485856906,0.7003731343283582,0.979550385843342,0.8090343315477164,0.8006925831300316,0.6212959947899707,0.6209063843863711,0.8160821214713431,0.8031664527171587,none,0.9199259362352634,0.9169576477865365,0.8632317525737832,COMPLETE
2859,0.7047474938528466,2025-09-24 02:52:47.215031,2025-09-24 02:52:52.088719,0 days 00:00:04.873688,0.2395984067329468,dart,0.4593021930634358,2.2669579276743925,lossguide,0.039837899521238646,0.009773281667597439,2,9,4.299690327898593,200,forest,0.6697730697561721,0.9920169367206875,none,0.9790351961582263,4.743275865261209,0.16059680544148022,weighted,0.6894514002944678,0.5221309161632308,0.8388780837342614,0.8401924651924652,0.6697730697561721,0.7041353383458646,0.7047474938528466,0.9920169367206875,0.7980904827070914,0.7901726915415677,0.6281019450033535,0.6315254237288136,0.8011120615911035,0.7971758664955071,none,0.9168402338295899,0.9150612104042977,0.9790351961582263,COMPLETE
2860,0.7117558402411455,2025-09-24 02:52:52.247032,2025-09-24 02:52:53.254802,0 days 00:00:01.007770,0.006368476887562967,gbtree,0.2015385361876218,0.0831941342427064,lossguide,0.8678026163352562,0.04232513834639746,1,5,2.4121932460073205,300,,0.6466546419611456,0.9941871600506886,none,0.9295630443169607,4.36389608211961,,,,0.5919121034276946,0.8469648889343843,0.8433660933660934,0.6466546419611456,0.7191433402216795,0.7117558402411455,0.9941871600506886,0.8196867481791883,0.8135506045963161,0.6412060301507537,0.6358128576236958,0.8186484174508126,0.808301240907146,none,0.9245126161541614,0.9235919827697948,0.9295630443169607,COMPLETE
2861,0.4081739586062353,2025-09-24 02:52:53.406447,2025-09-24 02:52:54.758112,0 days 00:00:01.351665,0.7878953644759709,gbtree,0.2851005548171798,4.018761227258846,depthwise,7.887268489700235,0.0001244648970192864,5,6,63.90929855796329,1000,,0.45523392497794474,0.92494079922977,undersample,0.5339974246278749,0.9880245538185617,,,,0.7325437786894644,0.30136144948305865,0.3062039312039312,0.45523392497794474,0.4064701278372032,0.4081739586062353,0.92494079922977,0.711766136271526,0.7041679587217134,0.25510315467743694,0.2564186965108624,0.9995722840034217,1.0,undersample,0.8786713440873027,0.8766459442849107,0.5339974246278749,COMPLETE
2862,0.7268702965914121,2025-09-24 02:52:54.920195,2025-09-24 02:52:56.090315,0 days 00:00:01.170120,0.001835535358503515,gbtree,0.2501963199088664,0.09206232436920761,lossguide,0.0023193326135221627,0.07239901331361091,2,5,0.5339898830832298,400,,0.6652911201385465,0.985667265061784,none,0.8932486078965951,2.629195436972169,,,,0.6999183923245662,0.870713481420821,0.8736691236691236,0.6652911201385465,0.7206370272063702,0.7268702965914121,0.985667265061784,0.8313408725046827,0.8248333071193178,0.7462207970682547,0.7528656579550664,0.6967493584260052,0.7026101839965768,none,0.9292985918122806,0.9275679713642216,0.8932486078965951,COMPLETE
2863,0.6903553299492385,2025-09-24 02:52:56.242714,2025-09-24 02:53:14.825570,0 days 00:00:18.582856,0.15178869679574183,dart,0.497957908160904,7.510506122954796,lossguide,0.013003447626540019,0.005477553515846913,1,12,12.961570149871012,500,forest,0.6740224806103957,0.938981523736536,none,0.986511132389459,4.949909377910973,0.256087258669789,weighted,0.7092141257264373,0.22320277445290532,0.8319172893847886,0.8313882063882064,0.6740224806103957,0.6945684523809523,0.6903553299492385,0.938981523736536,0.7841625093688644,0.7732209889919543,0.6145490454246214,0.6156941649899397,0.7985457656116339,0.785622593068036,none,0.9119200896897017,0.909027753664911,0.986511132389459,COMPLETE
2864,0.7216148023549201,2025-09-24 02:53:14.976659,2025-09-24 02:53:15.985656,0 days 00:00:01.008997,0.000490717889421967,gbtree,0.26398144068751506,0.04872704591570694,lossguide,0.018880440340981564,0.19580048174953463,1,5,0.6134884080187228,300,,0.684313375770457,0.968595722632826,none,0.9033306640490845,3.473236341068761,,,,0.5373598875568034,0.8629337700890573,0.8644553644553644,0.684313375770457,0.7204009187721863,0.7216148023549201,0.968595722632826,0.8272578582609798,0.8205413392195312,0.7037943696450428,0.7093840429929723,0.7378100940975193,0.7342747111681643,none,0.9270921505509657,0.9249384452495695,0.9033306640490845,COMPLETE
2865,0.6124794745484401,2025-09-24 02:53:16.138707,2025-09-24 02:53:17.121291,0 days 00:00:00.982584,0.030402120211382028,gbtree,0.2827239990851861,0.8525227596660887,depthwise,0.008180355093367554,0.06587347192114296,7,8,0.21241288930854343,400,,0.4233195843746763,0.7129391745623029,undersample,0.7867995597515929,4.943241854589519,,,,0.8532831287346958,0.7122530453475279,0.7100737100737101,0.4233195843746763,0.6145619086795557,0.6124794745484401,0.7129391745623029,0.7958631966714952,0.7874685512156174,0.4522704339051463,0.45021122510561257,0.9585115483319077,0.9576379974326059,undersample,0.9139642164428281,0.9109785205749983,0.7867995597515929,COMPLETE
2866,0.6806023029229407,2025-09-24 02:53:17.278585,2025-09-24 02:53:48.722811,0 days 00:00:31.444226,12.298441655332436,dart,0.6435861213356107,6.283687356908864,depthwise,1.8672161410505506,0.10268415806957525,7,12,2.8821803059895066,700,forest,0.5714590528705559,0.9847731375169873,undersample,0.853340516415344,1.1231661847506105,0.23976244759810986,weighted,0.5420245427431817,0.6568933926006011,0.8110349063363701,0.8154176904176904,0.5714590528705559,0.6805122879889235,0.6806023029229407,0.9847731375169873,0.7855002135851582,0.7789634604260165,0.5715116279069767,0.5807134220072552,0.8408896492728828,0.8219940094137783,undersample,0.9091434755496217,0.9077096220041094,0.853340516415344,COMPLETE
2867,0.38612143742255267,2025-09-24 02:53:48.879796,2025-09-24 02:53:49.798335,0 days 00:00:00.918539,71.92441666643768,gbtree,0.8473995292447134,9.938119648212044,lossguide,0.03138658806803554,0.00245228327713069,0,8,0.16974192800978988,200,,0.33647097666024633,0.8610162484346976,undersample,0.6976469692946625,2.77131704457607,,,,0.6882636338270499,0.23932848807452145,0.23925061425061425,0.33647097666024633,0.3862228462872718,0.38612143742255267,0.8610162484346976,0.6820823703330833,0.676257786585343,0.23932848807452145,0.23925061425061425,1.0,1.0,undersample,0.8783820846685428,0.8782008858908894,0.6976469692946625,COMPLETE
2868,0.38612143742255267,2025-09-24 02:53:49.949085,2025-09-24 02:54:22.533456,0 days 00:00:32.584371,0.0041189750990440034,dart,0.5830192331220234,0.23440285326395482,depthwise,0.0016865862422562631,0.0005022362516431973,3,5,0.6371856647549234,700,forest,0.4581874033569351,0.6315989670488672,undersample,0.505806237549434,2.2435669990532614,0.25053382440161287,weighted,0.799190956892787,0.24598610338054028,0.23932848807452145,0.23925061425061425,0.4581874033569351,0.3862228462872718,0.38612143742255267,0.6315989670488672,0.7263682548204515,0.7257284492485365,0.23932848807452145,0.23925061425061425,1.0,1.0,undersample,0.8819578963072758,0.8780007275031848,0.505806237549434,COMPLETE
2869,0.6593037214885954,2025-09-24 02:54:22.685647,2025-09-24 02:54:39.834947,0 days 00:00:17.149300,0.00011510338622185852,dart,0.4065592451741902,6.558651282772541,lossguide,0.0003336369523081134,0.0020684296943641535,3,6,1.570742833592125,500,forest,0.6215627394311125,0.9789040443166311,oversample,0.5163738048995963,1.0098858073377437,0.3414673389583955,weighted,0.6449636427482001,0.7701762935173979,0.8566895280990889,0.8547297297297297,0.6215627394311125,0.6680891417733523,0.6593037214885954,0.9789040443166311,0.7782711065305006,0.7718089172129712,0.749468085106383,0.7510940919037199,0.6026518391787853,0.5875053487376979,oversample,0.9079777465658107,0.906416798056598,0.5163738048995963,COMPLETE
2870,0.7136363636363636,2025-09-24 02:54:39.991014,2025-09-24 02:54:40.902733,0 days 00:00:00.911719,0.0989223446479715,gbtree,0.27505386321452346,0.5039204234896539,lossguide,0.00022050343498632727,0.04058063111710055,5,5,2.558371853004923,200,,0.6752995096003608,0.9485959172529943,none,0.7939243485629974,3.7273751443755003,,,,0.9512501029674585,0.8599651960282526,0.8581081081081081,0.6752995096003608,0.7182866556836903,0.7136363636363636,0.9485959172529943,0.8206675643567993,0.8142215551883737,0.6926131850675139,0.6899720335597284,0.7459366980325064,0.7389816003423192,none,0.9245803047575762,0.9232220410086301,0.7939243485629974,COMPLETE
2871,0.3954471544715447,2025-09-24 02:54:41.054725,2025-09-24 02:54:44.850434,0 days 00:00:03.795709,0.0002722931900741116,dart,0.5684626754489502,9.107133036233229,lossguide,11.3585053259163,0.0002762417944916856,5,8,0.12849763452165072,200,tree,0.5119244189102014,0.5188452579648504,oversample,0.8009031168691457,0.9977530982612203,0.1310376343342389,uniform,0.5644015785149024,0.41051885102054053,0.8111372709591566,0.8096846846846847,0.5119244189102014,0.4050306352789423,0.3954471544715447,0.5188452579648504,0.7052084332339773,0.6979540844777817,0.8230668414154653,0.8238482384823849,0.2686056458511548,0.2601626016260163,oversample,0.8826574603259022,0.8844708358691431,0.8009031168691457,COMPLETE
2872,0.7238594193407553,2025-09-24 02:54:45.004524,2025-09-24 02:54:56.596346,0 days 00:00:11.591822,0.0002376669417656451,dart,0.9813251762528599,7.830291950350718,depthwise,0.0003148076922735841,0.13068274377369668,2,10,0.493729603792517,400,tree,0.6204051497591934,0.9053374950732853,none,0.9998195614151422,2.1056091666329553,0.14446490122212827,weighted,0.7613425125505591,0.536484352832287,0.8675401781144436,0.8704954954954955,0.6204051497591934,0.7179598953792502,0.7238594193407553,0.9053374950732853,0.8233613715294167,0.818086086033395,0.732,0.7388591800356507,0.704448246364414,0.709456568249893,none,0.9256432921112042,0.9239007138387471,0.9998195614151422,COMPLETE
2873,0.7046894803548795,2025-09-24 02:54:56.748574,2025-09-24 02:54:58.374065,0 days 00:00:01.625491,0.00045168765721690334,gbtree,0.30299527868153586,0.11906537773415898,lossguide,0.0003625855746176201,0.010482137660208609,3,5,0.24704896058789824,600,,0.6899770486578711,0.9726918343490704,none,0.9139378479014397,3.737918276109509,,,,0.5889664949400194,0.8624219469751254,0.8568796068796068,0.6899770486578711,0.7182389937106918,0.7046894803548795,0.9726918343490704,0.8162708792153315,0.8055354823638229,0.704358552631579,0.6958698372966208,0.73267750213858,0.7137355584082157,none,0.9226718430029613,0.9202636585786208,0.9139378479014397,COMPLETE
2874,0.659729448491155,2025-09-24 02:54:58.529232,2025-09-24 02:55:51.540870,0 days 00:00:53.011638,13.204548225593493,dart,0.5336598652333502,6.710846494806415,lossguide,0.0002678822744712145,0.03702695978079212,7,11,62.81903321532448,900,tree,0.6080551691504835,0.6216327265345817,undersample,0.5892598532667241,0.7860041823124021,0.13975625451883517,weighted,0.8837026461720154,0.46287723532724434,0.8289487153239841,0.8326167076167076,0.6080551691504835,0.6589099816289039,0.659729448491155,0.6216327265345817,0.7238044983875817,0.7146110554503674,0.6302225693088638,0.6422204213938412,0.6903336184773311,0.6782199400941378,undersample,0.8905655152581968,0.8884353654534569,0.5892598532667241,COMPLETE
2875,0.6483682008368201,2025-09-24 02:55:51.693480,2025-09-24 02:55:52.639253,0 days 00:00:00.945773,0.0003365613595204895,gbtree,0.6955251825743825,1.6179682128411004,depthwise,0.002391076497747156,0.07051104002357544,10,6,0.27381235186200314,400,,0.3792908823696378,0.8540385745265515,none,0.947680303317849,2.1098604029759955,,,,0.8926287513109256,0.7837035520524107,0.7849099099099099,0.3792908823696378,0.6499917177405996,0.6483682008368201,0.8540385745265515,0.7055214928001483,0.6988456185734934,0.5304136253041363,0.5324354040681694,0.8391787852865698,0.8288403936670946,none,0.8863877009807595,0.8848482058328433,0.947680303317849,COMPLETE
2876,0.6869215291750503,2025-09-24 02:55:52.792734,2025-09-24 02:55:53.513034,0 days 00:00:00.720300,0.003322910519291568,gbtree,0.2879455583060859,0.1844592575791847,lossguide,0.07247610013962756,0.020066767387604777,3,3,0.20951791972077277,200,,0.693538895194978,0.9490448608644976,none,0.9258632555579853,4.6282413063286665,,,,0.7817610296454723,0.8407206469444161,0.8407043407043407,0.693538895194978,0.6906560636182902,0.6869215291750503,0.9490448608644976,0.7872895235573476,0.7804630705413086,0.6452451708766717,0.6483099126471705,0.7429426860564585,0.730423620025674,none,0.9103374944556932,0.9080955430381705,0.9258632555579853,COMPLETE
2877,0.6225660176046945,2025-09-24 02:55:53.665619,2025-09-24 02:55:54.561709,0 days 00:00:00.896090,0.019807750492608384,gbtree,0.22208640088165488,0.4456871150612822,lossguide,0.014028915432602174,0.012758978574445889,2,3,0.2899967191098899,500,,0.6914999983407746,0.9213600196386238,none,0.8532408620977734,1.9445399186125603,,,,0.7087236455428284,0.8602722898966118,0.8551392301392301,0.6914999983407746,0.6387933315691982,0.6225660176046945,0.9213600196386238,0.7969070722338798,0.7922429538585014,0.8376127689104789,0.8264872521246459,0.5162532078699743,0.4993581514762516,none,0.9139863764022793,0.9135913476296865,0.8532408620977734,COMPLETE
2878,0.7073114829245931,2025-09-24 02:55:54.715563,2025-09-24 02:56:06.271196,0 days 00:00:11.555633,0.0001161853911186079,dart,0.9203180267777396,8.891251813142587,depthwise,0.0008346398044072704,0.29842331904233044,3,12,0.9008107518539441,400,forest,0.6994835188902763,0.9346716662832578,none,0.7291606911602875,2.782917418497866,0.1858694576800354,weighted,0.7968153803252713,0.8370220278648228,0.8705087521752483,0.8692669942669943,0.6994835188902763,0.7126958891664774,0.7073114829245931,0.9346716662832578,0.8181616631526787,0.8123745052585993,0.7598062953995157,0.7615992102665351,0.6710863986313088,0.6602481814291827,none,0.9222832091166879,0.920414295616088,0.7291606911602875,COMPLETE
2879,0.726420859645549,2025-09-24 02:56:06.422374,2025-09-24 02:56:07.462919,0 days 00:00:01.040545,0.00018622998609849463,gbtree,0.34529915446649295,1.9151413172380447,lossguide,2.1079154157678253,0.23422528719234362,4,6,0.13137907985999767,300,,0.6194546504726153,0.9711311410254818,none,0.9978583846579722,3.1354632439879278,,,,0.7364818558822896,0.8567918927218753,0.8625102375102375,0.6194546504726153,0.7186808767343655,0.726420859645549,0.9711311410254818,0.822782089104815,0.819052875741906,0.6781783681214422,0.6932348367029549,0.7643284858853722,0.762943945228926,none,0.9251550247449043,0.9236949986948823,0.9978583846579722,COMPLETE
2880,0.7262284620293554,2025-09-24 02:56:07.620251,2025-09-24 02:56:08.417532,0 days 00:00:00.797281,0.00010763114813466924,gbtree,0.41187940400135875,3.7971565756873398,depthwise,0.08163115087276449,0.1883744367402107,4,7,0.42769663445712797,400,,0.5411276182369813,0.9956205944953096,none,0.9580708899007775,1.7529560934767632,,,,0.707220460628519,0.8692803767018119,0.8682432432432432,0.5411276182369813,0.7305338679046213,0.7262284620293554,0.9956205944953096,0.8284629454651375,0.8217590833140216,0.7209496043315285,0.7220812182741116,0.7403763900769889,0.730423620025674,none,0.9282213875496022,0.9263861673739869,0.9580708899007775,COMPLETE
2881,0.7118954847581939,2025-09-24 02:56:08.574879,2025-09-24 02:56:09.359180,0 days 00:00:00.784301,0.01182406372846512,gbtree,0.25057443639967225,6.944068114860206,depthwise,0.006412009163525317,0.08399808492054736,5,6,0.7333265951446026,400,,0.5524607213116092,0.9899559589214094,none,0.9358967877098825,1.4645160506242734,,,,0.7008516579817112,0.8703040229296755,0.8713144963144963,0.5524607213116092,0.7130237825594564,0.7118954847581939,0.9899559589214094,0.8260134280391376,0.8200312134744511,0.757823784304285,0.7665350444225074,0.6732249786142002,0.6645271715875053,none,0.9268401025965831,0.9258303765920178,0.9358967877098825,COMPLETE
2882,0.711701734957549,2025-09-24 02:56:09.510862,2025-09-24 02:56:11.233234,0 days 00:00:01.722372,0.0003175705337311856,gbtree,0.35284822689545114,0.5560289809526637,lossguide,26.24855957659283,0.08956925095126797,2,7,0.18426267220312098,400,,0.5803080718592318,0.862534450426305,none,0.9737697292206362,3.847846907309602,,,,0.7578784802140853,0.8420513870406388,0.8400900900900901,0.5803080718592318,0.7152611182875069,0.711701734957549,0.862534450426305,0.8241606140399309,0.8142356498870934,0.629016553067186,0.6257708536189549,0.8289136013686912,0.8249893025246042,none,0.9267961855860343,0.9233903272249899,0.9737697292206362,COMPLETE
2883,0.6915123827843231,2025-09-24 02:56:11.390821,2025-09-24 02:56:12.386064,0 days 00:00:00.995243,0.001084936118220636,gbtree,0.3756189555349697,2.225221894039761,depthwise,0.6136974935126397,0.013925558985477123,5,6,0.40558920122009856,400,,0.47735170622750295,0.9661217897626989,none,0.7793858618495783,0.9847782901045561,,,,0.8462232754051039,0.8699969290613164,0.8686527436527437,0.47735170622750295,0.6963175514108082,0.6915123827843231,0.9661217897626989,0.820876940845602,0.8142179594850019,0.789587852494577,0.7892425905598244,0.6227544910179641,0.615318784766795,none,0.9229204950155055,0.921924725589818,0.7793858618495783,COMPLETE
2884,0.714725105728566,2025-09-24 02:56:12.543829,2025-09-24 02:56:13.329718,0 days 00:00:00.785889,0.000317117036455255,gbtree,0.4171802542906211,2.9039456950182485,depthwise,0.2607598392831623,0.4627716543233337,0,7,0.306261870203177,500,,0.3660206603188876,0.9639053695383182,none,0.9077433032079101,1.2913703014901794,,,,0.8368631625590345,0.8456341488381616,0.8480753480753481,0.3660206603188876,0.7116634799235182,0.714725105728566,0.9639053695383182,0.8158324819121516,0.8140529507035301,0.6434993084370678,0.6488656195462478,0.7959794696321643,0.795464270432178,none,0.921596854736228,0.9196581449060353,0.9077433032079101,COMPLETE
