number,value,datetime_start,datetime_complete,duration,params_alpha,params_booster,params_colsample_bytree,params_gamma,params_grow_policy,params_lambda,params_learning_rate,params_max_delta_step,params_max_depth,params_min_child_weight,params_n_estimators,params_normalize_type,params_params_decision_threshold,params_params_feature_fraction,params_params_resampling,params_params_sample_rows,params_params_scale_pos_weight,params_rate_drop,params_sample_type,params_skip_drop,params_subsample,user_attrs_acc_test,user_attrs_acc_val,user_attrs_decision_threshold,user_attrs_f1_test,user_attrs_f1_val,user_attrs_feature_fraction,user_attrs_pr_auc_test,user_attrs_pr_auc_val,user_attrs_prec_test,user_attrs_prec_val,user_attrs_rec_test,user_attrs_rec_val,user_attrs_resampling_strategy,user_attrs_roc_auc_test,user_attrs_roc_auc_val,user_attrs_sample_rows,state
1836,0.6531483457844184,2025-09-23 22:24:53.319658,2025-09-23 22:24:58.585975,0 days 00:00:05.266317,0.022224521730861875,dart,0.9852816101193619,4.072157638258146,lossguide,0.4545324537404589,0.03008545382806234,4,11,8.762670183559656,200,forest,0.595496744918254,0.9444086186850755,oversample,0.8977255031638319,4.897018645059601,0.1380071443125146,uniform,0.44025313329318705,0.7913679547502763,0.7670181185382332,0.7670966420966421,0.595496744918254,0.6564009661835749,0.6531483457844184,0.9444086186850755,0.8146214257086852,0.8076459241353311,0.5072328511432571,0.50734249171009,0.9298545765611634,0.9165596919127086,oversample,0.9196572827008765,0.9174243001380782,0.8977255031638319,COMPLETE
1837,0.7225445089017803,2025-09-23 22:24:58.723424,2025-09-23 22:25:12.253093,0 days 00:00:13.529669,0.00011062348668417827,dart,0.6657729258178664,6.363355935364059,lossguide,0.00054437674946075,0.025421351785960205,1,10,1.9337469527067808,400,forest,0.6516156855414074,0.9591361792987377,none,0.9984363212837838,3.505507703467358,0.20711635566332198,weighted,0.890551646609014,0.9105413968257479,0.8577131743269526,0.858005733005733,0.6516156855414074,0.724534284581847,0.7225445089017803,0.9591361792987377,0.82778113470018,0.8215875845513725,0.6750369276218612,0.6784372652141247,0.7818648417450813,0.772785622593068,none,0.9279867797710997,0.9261365740104931,0.9984363212837838,COMPLETE
1838,0.6611596505162828,2025-09-23 22:25:12.394418,2025-09-23 22:25:13.957565,0 days 00:00:01.563147,0.0006254147200490398,gbtree,0.6319673806466719,1.9207692527276932,depthwise,0.00010844458751264295,0.008257553809072452,0,10,0.1831534181699318,400,,0.6266986000118834,0.7957812056665348,oversample,0.8927488707635065,2.73093716640351,,,,0.7123823854935378,0.7767427577029379,0.7816339066339066,0.6266986000118834,0.6564813356434084,0.6611596505162828,0.7957812056665348,0.7938972717090886,0.7920142767068594,0.5195711792570431,0.5257705912076807,0.8913601368691189,0.8904578519469405,oversample,0.9097630622600466,0.9089780307742946,0.8927488707635065,COMPLETE
1839,0.7139874739039666,2025-09-23 22:25:14.097879,2025-09-23 22:25:21.842986,0 days 00:00:07.745107,0.0004242905018696141,dart,0.7216446965947101,8.189492640882666,lossguide,0.00018676500728747556,0.05131736655506297,3,12,0.5539189997294073,300,forest,0.603804459244305,0.9396211337162801,none,0.8981004359618177,3.448438889361351,0.30699763399347196,weighted,0.8697934745363819,0.7508689208527547,0.8486027228989661,0.8457207207207207,0.603804459244305,0.720045428733674,0.7139874739039666,0.9396211337162801,0.8267862018123011,0.8200196019626209,0.6458404074702886,0.6415416098226466,0.8135158254918734,0.8048780487804879,none,0.9275824036798657,0.9257807976588148,0.8981004359618177,COMPLETE
1840,0.7142046529222622,2025-09-23 22:25:21.981712,2025-09-23 22:25:30.575518,0 days 00:00:08.593806,0.0002355070567988739,dart,0.62020546903155,5.609416362475591,lossguide,0.0005581090975961877,0.018857372100543814,1,11,2.1532734113274103,300,forest,0.5870107270137928,0.7359732879495009,none,0.9571091717185253,3.2073155196000593,0.2175449101861613,weighted,0.8663245181352188,0.7787625986053526,0.8413348346811342,0.8453112203112203,0.5870107270137928,0.7106049290515309,0.7142046529222622,0.7359732879495009,0.8217020428831855,0.815427735646953,0.6305500331345262,0.64,0.8139435414884517,0.8078733418913137,none,0.9249115817617892,0.9234773638771808,0.9571091717185253,COMPLETE
1841,0.7067767158992181,2025-09-23 22:25:30.711762,2025-09-23 22:25:37.490155,0 days 00:00:06.778393,0.08923649679013265,dart,0.7946183814309902,8.769109666704974,lossguide,0.022213601677757905,0.3108479017037728,10,7,0.33208434188806596,300,forest,0.5052131632172787,0.8369315268205451,none,0.9614138911115401,1.5292706952861423,0.2105176583678681,weighted,0.8953486378500116,0.8013409546007215,0.8643668748080663,0.8617936117936118,0.5052131632172787,0.7137610715057248,0.7067767158992181,0.8369315268205451,0.8152468743443637,0.8062248355936779,0.7210824967263204,0.717688575209528,0.7065868263473054,0.6961916987590928,none,0.9204081311970903,0.9184618875914872,0.9614138911115401,COMPLETE
1842,0.0,2025-09-23 22:25:37.630023,2025-09-23 22:25:46.418532,0 days 00:00:08.788509,0.00013123003319144019,dart,0.7587960317041037,6.396635615524345,lossguide,0.00021540539240459447,0.0006550367729831915,3,9,4.79271028264396,300,forest,0.6246173808541187,0.9787852509696274,none,0.9862985674578941,2.5169367430881597,0.2631628539805064,weighted,0.8041615157405656,0.8544008918103057,0.7606715119254785,0.7607493857493858,0.6246173808541187,0.0,0.0,0.9787852509696274,0.7981083822610471,0.7904498471304102,0.0,0.0,0.0,0.0,none,0.9135002386944204,0.911840739107304,0.9862985674578941,COMPLETE
1843,0.6941630487216595,2025-09-23 22:25:46.557604,2025-09-23 22:25:48.153146,0 days 00:00:01.595542,0.00020092889185812512,gbtree,0.7572246831023198,6.142556424518629,lossguide,0.0001165791021755049,0.01805809412849338,1,8,5.661525387958167,500,,0.6347052160824824,0.9977896237808411,none,0.9578920762801014,1.6175776841807783,,,,0.9049832811307454,0.8705087521752483,0.8701883701883701,0.6347052160824824,0.6965699208443272,0.6941630487216595,0.9977896237808411,0.8256119764074707,0.8189922796040089,0.793009284543965,0.7954671088999448,0.621043627031651,0.6157466837826273,none,0.926976918761819,0.9248924652517033,0.9578920762801014,COMPLETE
1844,0.7121742512640996,2025-09-23 22:25:48.292359,2025-09-23 22:25:51.733548,0 days 00:00:03.441189,0.00010396818383236604,dart,0.9594833405651727,6.438671052616357,depthwise,77.41835772269044,0.3506667644718553,0,7,15.392057985594635,200,forest,0.6382761447428082,0.9749193825274917,none,0.9595637587717606,3.54553672750541,0.23860031575681276,weighted,0.8816038695747963,0.9195231438618088,0.8487050875217524,0.8484848484848485,0.6382761447428082,0.714891975308642,0.7121742512640996,0.9749193825274917,0.8198923861311358,0.8115073768772552,0.6510892480674632,0.6527629233511586,0.7925577416595381,0.7834830979888746,none,0.924329465528255,0.9221712382646637,0.9595637587717606,COMPLETE
1845,0.7201725997842503,2025-09-23 22:25:51.871767,2025-09-23 22:25:56.513622,0 days 00:00:04.641855,0.03127286408185899,dart,0.9852396881026992,3.96551625877777,lossguide,0.005759147773258451,0.018984218965632335,4,11,0.12643383284412643,200,forest,0.41359667388873667,0.9331105204090033,none,0.9661282541346927,1.0007833938956456,0.19154544315090627,weighted,0.8185585474658913,0.4866735804912894,0.86651653188658,0.8672194922194922,0.41359667388873667,0.7182368193604148,0.7201725997842503,0.9331105204090033,0.8231453665712256,0.8175864058260462,0.725764192139738,0.7262837249782419,0.7108639863130881,0.714163457424048,none,0.9248136462526818,0.9226404818496478,0.9661282541346927,COMPLETE
1846,0.46115130544196287,2025-09-23 22:25:56.652571,2025-09-23 22:25:59.058288,0 days 00:00:02.405717,0.0010273994764915268,gbtree,0.6265602787245964,2.0188796704254672,depthwise,0.0013054770458937634,0.0011604047025020891,3,10,0.1431286980784664,600,,0.6820820112331416,0.9337463875166397,none,0.7907764878582358,3.189355156644485,,,,0.6876104042855329,0.8286416214556249,0.8246314496314496,0.6820820112331416,0.4772017489069332,0.46115130544196287,0.9337463875166397,0.7800089703449316,0.7710348116335788,0.8842592592592593,0.8705463182897862,0.32677502138579984,0.31364997860504923,none,0.9115552273962945,0.9083998402187877,0.7907764878582358,COMPLETE
1847,0.712476645214864,2025-09-23 22:25:59.198174,2025-09-23 22:26:02.540432,0 days 00:00:03.342258,0.00012223066833531152,dart,0.8367419517830386,8.239133605038239,lossguide,0.00023829976851375272,0.20264465703803242,0,7,3.710341598380206,200,forest,0.6375661542345551,0.8752824717240986,none,0.9335663328583446,3.1187348795985623,0.14973209995161127,weighted,0.8983631986778591,0.9422664936420335,0.8581226328180981,0.8582104832104832,0.6375661542345551,0.7145799011532126,0.712476645214864,0.8752824717240986,0.8166030360715094,0.8096153730731446,0.6890389197776012,0.6919354838709677,0.742087254063302,0.7342747111681643,none,0.9207507471935418,0.9197486365361497,0.9335663328583446,COMPLETE
1848,0.7152677279305355,2025-09-23 22:26:02.678896,2025-09-23 22:26:03.366045,0 days 00:00:00.687149,0.005191067430425934,gbtree,0.846647104541399,1.574553049075784,depthwise,0.0002478470052279667,0.3269281835916135,8,3,0.13980831725055437,400,,0.3452363957497671,0.9207570759698552,oversample,0.9286001427273735,0.5221179391572285,,,,0.8543180279214666,0.8336574879721568,0.8388615888615889,0.3452363957497671,0.7093543194419603,0.7152677279305355,0.9207570759698552,0.8271638681658589,0.8202845163089809,0.6095911466338764,0.619554998433093,0.8481608212147135,0.8459563543003851,oversample,0.9267943437192747,0.9246496954696083,0.9286001427273735,COMPLETE
1849,0.6680451725783363,2025-09-23 22:26:03.505566,2025-09-23 22:26:35.954636,0 days 00:00:32.449070,0.0001948201391096431,dart,0.4557791463251805,4.279006546245873,depthwise,0.0006250748098519028,0.41039339738890457,4,4,0.11836529087036027,700,forest,0.31763259214597944,0.8468933775122125,undersample,0.9586412809824909,0.5834120911280898,0.26927485741404383,weighted,0.8042883199214789,0.6076569607131651,0.7789947794042379,0.7863431613431613,0.31763259214597944,0.6617577941406863,0.6680451725783363,0.8468933775122125,0.8121313445634255,0.8015302923525838,0.5221260815822002,0.5316455696202531,0.9033361847733106,0.8985879332477535,undersample,0.9179560309567151,0.9148324332827927,0.9586412809824909,COMPLETE
1850,0.7155963302752294,2025-09-23 22:26:36.092042,2025-09-23 22:27:35.270141,0 days 00:00:59.178099,0.07495814285421719,dart,0.3932311660140188,1.0530249244002854,lossguide,0.00011146566427852793,0.020334072489079903,6,8,0.17094699055368687,900,forest,0.4803773272789831,0.758380446104189,none,0.5635397967820013,1.9182323857805317,0.24169622957584094,weighted,0.7967708092406561,0.28106944698682357,0.8566895280990889,0.854013104013104,0.4803773272789831,0.7214484679665738,0.7155963302752294,0.758380446104189,0.8236178111295006,0.8156969912385079,0.6744791666666666,0.6701531565184908,0.7754491017964071,0.7676508344030809,none,0.925758351225342,0.9230511635588277,0.5635397967820013,COMPLETE
1851,0.7019667170953101,2025-09-23 22:27:35.407234,2025-09-23 22:27:36.082411,0 days 00:00:00.675177,0.025221867505932426,gbtree,0.9847604197398242,0.25371035037242945,depthwise,0.001447496831091352,0.4993508836824991,6,3,1.1996101160577104,300,,0.38929203987970795,0.9650369865972399,oversample,0.754625064786456,0.5200605327114969,,,,0.8550172377180452,0.8388780837342614,0.8386568386568387,0.38929203987970795,0.7021196063588191,0.7019667170953101,0.9650369865972399,0.81223857302492,0.8078018253865584,0.6296673455532926,0.6289393425957303,0.7934131736526946,0.7941805733846812,oversample,0.9201477085047853,0.9185377819398746,0.754625064786456,COMPLETE
1852,0.705087440381558,2025-09-23 22:27:36.221468,2025-09-23 22:27:39.902614,0 days 00:00:03.681146,0.06325983241625849,dart,0.9757884384460984,5.432467868248235,lossguide,0.00017518794013435712,0.48144835214023296,2,12,7.3020936207226,200,forest,0.637720709975973,0.8991540339129916,none,0.8791803031550433,3.339125618313451,0.19132656878100446,weighted,0.8035508983411734,0.8659423387586761,0.8473743474255298,0.8480753480753481,0.637720709975973,0.7063226314752806,0.705087440381558,0.8991540339129916,0.8037994573685874,0.792007661990664,0.6546184738955824,0.6582560296846011,0.7668947818648417,0.7590928540864356,none,0.918829967954972,0.914369322283623,0.8791803031550433,COMPLETE
1853,0.7016037948949627,2025-09-23 22:27:40.040645,2025-09-23 22:28:00.830037,0 days 00:00:20.789392,0.00017909417530667277,dart,0.5968836123624472,7.374686658426024,lossguide,0.0013823841026831408,0.004071805032202546,1,10,1.8584638603362695,500,forest,0.6642081858654091,0.9492880204663001,none,0.8812249482251578,2.9665061981686414,0.20885728669069764,weighted,0.8389866386437161,0.8934399881195754,0.8631384993346299,0.8647624897624898,0.6642081858654091,0.6994830298943583,0.7016037948949627,0.9492880204663001,0.7955059112882468,0.7876664290673081,0.7370914258645191,0.7430622009569378,0.6655260906757913,0.6645271715875053,none,0.9171528907120299,0.9155341105075842,0.8812249482251578,COMPLETE
1854,0.6997929606625258,2025-09-23 22:28:00.969447,2025-09-23 22:28:01.725258,0 days 00:00:00.755811,0.24683733495993693,gbtree,0.8390102042314481,0.8393090954512716,depthwise,0.00921664582851012,0.1780707874939494,9,9,0.6473241793633702,200,,0.4325161703561883,0.9232794742856851,none,0.991557007701696,1.2261414494180332,,,,0.9223092468369234,0.8540280479066434,0.8515561015561015,0.4325161703561883,0.7061005770816158,0.6997929606625258,0.9232794742856851,0.8000200077570712,0.7877712106434263,0.6813842482100239,0.6778981147212194,0.73267750213858,0.7231493367565255,none,0.9170367092103353,0.9128133729757502,0.991557007701696,COMPLETE
1855,0.7154133776485251,2025-09-23 22:28:01.864608,2025-09-23 22:28:05.451033,0 days 00:00:03.586425,22.234300895607284,dart,0.9702119018732004,3.2411693896562777,lossguide,0.07274557629468899,0.31233329670011095,4,12,2.0308069943460643,200,forest,0.6593375257832669,0.8325532752440226,none,0.9996587753418575,3.175302355868123,0.1746000378599234,weighted,0.8954099009427874,0.5874071613653362,0.8569966219674481,0.8597461097461098,0.6593375257832669,0.7124922823626261,0.7154133776485251,0.8325532752440226,0.8155191144367939,0.8100555546699584,0.6866322887742959,0.6951958013726282,0.7403763900769889,0.7368421052631579,none,0.9229180775653836,0.920442626435061,0.9996587753418575,COMPLETE
1856,0.7037378015098509,2025-09-23 22:28:05.588063,2025-09-23 22:28:09.538182,0 days 00:00:03.950119,5.586626177457095,dart,0.974567641015163,5.402514930467923,lossguide,0.0006253118157909153,0.1622035988067318,5,11,6.724576225851988,200,forest,0.6353544101716502,0.9271877127761424,none,0.9920841403687707,4.757247707349688,0.24626119463766752,weighted,0.8905505666982249,0.5111597787395306,0.8333503941037977,0.8352784602784603,0.6353544101716502,0.7028112449799196,0.7037378015098509,0.9271877127761424,0.8160805293106546,0.8096898804517454,0.6130573248407644,0.6176470588235294,0.8233532934131736,0.8177150192554558,none,0.9202613862188536,0.9191322108916221,0.9920841403687707,COMPLETE
1857,0.7240431380841615,2025-09-23 22:28:09.675697,2025-09-23 22:28:18.674747,0 days 00:00:08.999050,0.00054672089582224,dart,0.400829634749862,3.160486813993619,lossguide,0.0004846748962578983,0.04614727769615431,2,12,2.2417259910316596,300,forest,0.6839072037076538,0.9703826843661592,none,0.8934555780506453,3.7372056445369712,0.17484776889906084,weighted,0.7870681343130469,0.8472378830831988,0.8663118026410073,0.8664004914004914,0.6839072037076538,0.7242398648648649,0.7240431380841615,0.9703826843661592,0.8283206399022227,0.8233654795314986,0.7151793160967473,0.7157190635451505,0.7335329341317365,0.7325631151048353,none,0.92741407432554,0.9265972665251161,0.8934555780506453,COMPLETE
1858,0.6626380495936653,2025-09-23 22:28:18.811164,2025-09-23 22:29:05.385071,0 days 00:00:46.573907,0.00013048397478031363,dart,0.9595844838735775,5.848613403355516,lossguide,0.1773487273784732,0.04599608410710713,0,10,0.3889677948566823,800,forest,0.6988684613599478,0.8725812677284923,none,0.9707715055051575,3.438546187083759,0.17755248640729931,weighted,0.7928620559056574,0.8185580063745388,0.8346811342000204,0.8342547092547092,0.6988684613599478,0.6655622282045972,0.6626380495936653,0.8725812677284923,0.7219183642753464,0.7076951284496815,0.6451224407868326,0.6458164094232332,0.6873396065012831,0.6803594351732991,none,0.8932923414374321,0.8913565780793051,0.9707715055051575,COMPLETE
1859,0.7250830564784053,2025-09-23 22:29:05.524433,2025-09-23 22:29:28.514801,0 days 00:00:22.990368,0.004390344219385629,dart,0.589007808206855,0.9963424625585717,lossguide,0.002072695664548609,0.0537264659524749,2,11,2.4425880499623585,500,forest,0.687677217295437,0.9824481626675856,none,0.9696683327164618,4.424015796556317,0.20425002012579818,weighted,0.7308628697242802,0.73936547679612,0.8606817483877572,0.8644553644553644,0.687677217295437,0.7178104913953971,0.7250830564784053,0.9824481626675856,0.8237198515139399,0.8190722991724075,0.6965794768611671,0.7043162565550625,0.7403763900769889,0.7471116816431322,none,0.9251367787523173,0.9242676324942285,0.9696683327164618,COMPLETE
1860,0.7012893982808023,2025-09-23 22:29:28.653791,2025-09-23 22:29:32.185506,0 days 00:00:03.531715,0.0008684925582325603,dart,0.2290348607498021,5.879955048051125,lossguide,0.004190217445098849,0.0339296063586523,4,7,5.601058753636475,200,forest,0.6410755361292348,0.8580469474821781,none,0.8435672438073899,4.9996700848239035,0.2537171755387062,weighted,0.6424873922857904,0.9869019536520036,0.8256730473948204,0.8292383292383292,0.6410755361292348,0.6971367597367953,0.7012893982808023,0.8580469474821781,0.7972732555764337,0.7914350530334675,0.5966514459665144,0.603018170619033,0.8383233532934131,0.8378262729995721,none,0.9172002612227531,0.9166204707326805,0.8435672438073899,COMPLETE
1861,0.7047010497489731,2025-09-23 22:29:32.323826,2025-09-23 22:29:39.397285,0 days 00:00:07.073459,0.0013297621470067772,dart,0.5070307585502694,7.0971503138612375,lossguide,0.00018678002192590635,0.10671669558153274,1,12,12.185261502052724,300,forest,0.6162611803367631,0.9402699831133373,none,0.9464980776516823,1.946848002944706,0.2975702698411028,weighted,0.7217479785464715,0.9014078561704671,0.870713481420821,0.8675266175266175,0.6162611803367631,0.7118412046543463,0.7047010497489731,0.9402699831133373,0.8242002766281417,0.8158579355810273,0.7628361858190709,0.7550122249388753,0.6672369546621043,0.660676080445015,none,0.9258688344517495,0.9234639470462442,0.9464980776516823,COMPLETE
1862,0.6901180282342051,2025-09-23 22:29:39.535915,2025-09-23 22:29:47.201438,0 days 00:00:07.665523,0.00019201675107229636,dart,0.3283908907981862,3.073461525447527,lossguide,0.011495244654228132,0.015563039114125697,2,11,20.0647857558891,300,forest,0.6841500431850192,0.9322372116678995,none,0.7256933803090797,2.8036607439997265,0.2324416632037587,weighted,0.6409122323079542,0.8013501657426835,0.8655952502815027,0.862919737919738,0.6841500431850192,0.6987841247992659,0.6901180282342051,0.9322372116678995,0.8043322670060052,0.7949543269443875,0.7535873330034636,0.7515120967741935,0.6514114627887083,0.637997432605905,none,0.9183945391413378,0.9159650902120647,0.7256933803090797,COMPLETE
1863,0.7208317289179823,2025-09-23 22:29:47.339247,2025-09-23 22:30:15.945162,0 days 00:00:28.605915,0.0018420760479421021,dart,0.432814964927144,0.5846317844886929,lossguide,0.007868781902842606,0.1357073488315043,6,8,0.9213153165252476,600,forest,0.6448520054793893,0.9322076319817822,none,0.9563180064797648,4.423495114270168,0.1847117420616315,weighted,0.7077987079923707,0.8004241696813148,0.8527996724332071,0.8515561015561015,0.6448520054793893,0.7240982348426708,0.7208317289179823,0.9322076319817822,0.8286364914188507,0.8230881026108054,0.6565762004175365,0.6552327616380819,0.8071000855431993,0.8010269576379975,none,0.9272595877510794,0.9257744923241042,0.9563180064797648,COMPLETE
1864,0.7012571428571429,2025-09-23 22:30:16.083763,2025-09-23 22:30:59.605406,0 days 00:00:43.521643,0.001862922394521845,dart,0.45845166628122025,0.08468254163807631,lossguide,0.019455102516981643,0.31271648337213565,1,12,2.144067042097457,700,forest,0.6976784968247035,0.8645530653683099,none,0.7984356540052301,3.3198341352770044,0.19708774472914747,weighted,0.7701359142012904,0.5963324862392345,0.8705087521752483,0.8661957411957412,0.6976784968247035,0.7124346442373267,0.7012571428571429,0.8645530653683099,0.8176329396377461,0.811048740412774,0.7603105288694808,0.7526987242394504,0.6702309666381523,0.6563970902866924,none,0.9231307556177799,0.9207025559408433,0.7984356540052301,COMPLETE
1865,0.7174753112924002,2025-09-23 22:30:59.744729,2025-09-23 22:31:07.758447,0 days 00:00:08.013718,0.00012876861100746177,dart,0.5926192448534001,2.867550156136135,lossguide,0.00020681090885723598,0.33512958806890786,1,11,2.600317342890223,300,forest,0.6942062020951545,0.9492701312271755,none,0.8754207781182698,3.3512455765484455,0.2066778424439835,weighted,0.7499219092619687,0.6683476907206816,0.86539052103593,0.8652743652743653,0.6942062020951545,0.7182344118277266,0.7174753112924002,0.9492701312271755,0.8242979276976263,0.8199522605641927,0.7196221554315156,0.7199482981473503,0.716852010265184,0.7150192554557124,none,0.925609534147001,0.9245514013476832,0.8754207781182698,COMPLETE
