number,value,datetime_start,datetime_complete,duration,params_alpha,params_booster,params_colsample_bytree,params_gamma,params_grow_policy,params_lambda,params_learning_rate,params_max_delta_step,params_max_depth,params_min_child_weight,params_n_estimators,params_normalize_type,params_params_decision_threshold,params_params_feature_fraction,params_params_resampling,params_params_sample_rows,params_params_scale_pos_weight,params_rate_drop,params_sample_type,params_skip_drop,params_subsample,user_attrs_acc_test,user_attrs_acc_val,user_attrs_decision_threshold,user_attrs_f1_test,user_attrs_f1_val,user_attrs_feature_fraction,user_attrs_pr_auc_test,user_attrs_pr_auc_val,user_attrs_prec_test,user_attrs_prec_val,user_attrs_rec_test,user_attrs_rec_val,user_attrs_resampling_strategy,user_attrs_roc_auc_test,user_attrs_roc_auc_val,user_attrs_sample_rows,state
757,0.5587761674718197,2025-09-23 14:44:02.127284,2025-09-23 14:44:02.426411,0 days 00:00:00.299127,0.24598066526018877,gbtree,0.9697761844227957,5.787145814995474,lossguide,0.002219008596454842,0.24100701320942292,2,9,1.1743433986405933,200,,0.4549883066942088,0.5090479541758954,undersample,0.7106249168426397,1.6832721272588838,,,,0.40990453993864195,0.6479680622376907,0.6633906633906634,0.4549883066942088,0.546605141727093,0.5587761674718197,0.5090479541758954,0.6208876692322955,0.617425939983797,0.3950829045168668,0.40703812316715543,0.886655260906758,0.8908857509627728,undersample,0.8327546130416368,0.8357162316072091,0.7106249168426397,COMPLETE
758,0.6095143706640238,2025-09-23 14:44:02.552905,2025-09-23 14:44:03.069985,0 days 00:00:00.517080,5.953766605733492,gbtree,0.6903752426180263,6.6954956075329255,depthwise,0.3011151056341412,0.07120677969964782,6,4,1.9533939849119457,700,,0.6840001382425528,0.8413359905210117,oversample,0.5216516620690131,0.6403852582501262,,,,0.30462478612455374,0.8388780837342614,0.8386568386568387,0.6840001382425528,0.6125061546036435,0.6095143706640238,0.8413359905210117,0.7269513366771011,0.7193195066499538,0.7215777262180975,0.723955267804591,0.5320786997433704,0.5263157894736842,oversample,0.8872186994601834,0.8891221862731769,0.5216516620690131,COMPLETE
759,0.7081218274111675,2025-09-23 14:44:03.198900,2025-09-23 14:44:21.694336,0 days 00:00:18.495436,0.00011455129148305356,dart,0.9481669743493557,0.016851442737049194,depthwise,0.0013454310129201034,0.07881474358906676,6,10,16.14059282979226,500,forest,0.5201425829580353,0.961584895132471,none,0.7203089585682607,3.4897348041430365,0.11949419930980132,uniform,0.3828654618835882,0.9922020703177608,0.8302794554202068,0.8351760851760852,0.5201425829580353,0.7007220216606498,0.7081218274111675,0.961584895132471,0.8155664150913557,0.8111564112281926,0.6061836352279825,0.6143441333752753,0.830196749358426,0.8356867779204108,none,0.9211693114146585,0.9210246750492493,0.7203089585682607,COMPLETE
760,0.0,2025-09-23 14:44:21.819488,2025-09-23 14:44:40.061912,0 days 00:00:18.242424,0.002456438705997662,dart,0.3870126728337071,0.9453741577766095,depthwise,0.16342884256799373,0.0014026973056063179,1,10,2.9172016910277363,500,forest,0.6008568549202185,0.6570572968411409,none,0.551542531907262,1.7223109776862089,0.2397882942234481,uniform,0.8413407710991047,0.3516278374441661,0.7606715119254785,0.7607493857493858,0.6008568549202185,0.0,0.0,0.6570572968411409,0.7360163438892287,0.7229189830922194,0.0,0.0,0.0,0.0,none,0.896880528118456,0.894891193243998,0.551542531907262,COMPLETE
761,0.7009389671361502,2025-09-23 14:44:40.188726,2025-09-23 14:44:43.309762,0 days 00:00:03.121036,0.0001801625621202044,dart,0.6974814677240918,2.3918276591361574,depthwise,0.18854661088445532,0.1695679640554744,7,3,2.337215392193963,200,tree,0.6074971932569844,0.8564807624358022,oversample,0.5724898311834015,0.5447623744117193,0.004909379724961971,weighted,0.1206686611271217,0.6827327288429866,0.8690756474562391,0.8695741195741196,0.6074971932569844,0.7017952902774539,0.7009389671361502,0.8564807624358022,0.8197624664078148,0.8137111757597251,0.7713992824192721,0.7763910556422257,0.6437125748502994,0.6388532306375695,oversample,0.9239948501405401,0.9221976112628134,0.5724898311834015,COMPLETE
762,0.38612143742255267,2025-09-23 14:44:43.436817,2025-09-23 14:44:49.533210,0 days 00:00:06.096393,38.99947578396806,dart,0.3738830812300762,7.305071937046401,lossguide,0.0003483034878991571,0.00016299223271921414,1,9,1.9791634628815018,300,forest,0.345675953052541,0.9870156591615268,oversample,0.7499544438826342,0.8257857666210104,0.4272230081482851,weighted,0.6493589941080828,0.4471702977101827,0.23932848807452145,0.23925061425061425,0.345675953052541,0.3862228462872718,0.38612143742255267,0.9870156591615268,0.7128220419575112,0.7042761235388694,0.23932848807452145,0.23925061425061425,1.0,1.0,oversample,0.8843207811264834,0.8835778680333177,0.7499544438826342,COMPLETE
763,0.6679027606098064,2025-09-23 14:44:49.660469,2025-09-23 14:44:59.728845,0 days 00:00:10.068376,0.0002857557939322486,dart,0.7279972703919713,8.719982382920666,depthwise,77.10226537398195,0.005076674842692955,7,8,2.68329560963983,400,forest,0.6584870330139695,0.6530976463609767,oversample,0.6154274289538987,1.3702696519678024,0.4021853962990149,uniform,0.531084156865887,0.22276545155049307,0.8340669464633023,0.834971334971335,0.6584870330139695,0.6735146022155085,0.6679027606098064,0.6530976463609767,0.7318139893300439,0.7272124999024612,0.6364674533688618,0.644020659515296,0.7151411462788708,0.6936243046640993,oversample,0.890411402812922,0.890550157440465,0.6154274289538987,COMPLETE
764,0.6039349871685201,2025-09-23 14:44:59.854490,2025-09-23 14:45:02.637509,0 days 00:00:02.783019,0.07779390394099445,dart,0.5932760258758936,2.9949411157756725,lossguide,35.26480400347798,0.038270700764473,0,5,99.87160729197007,200,tree,0.5647419118715358,0.7978581012198118,undersample,0.8889389234401234,1.9173960597789375,0.36244930840894035,weighted,0.7141120187364678,0.29076639605590515,0.7112293991196642,0.7156019656019657,0.5647419118715358,0.6021717670286278,0.6039349871685201,0.7978581012198118,0.7038654481779996,0.700143165144045,0.4491899852724595,0.45285439384220655,0.9131736526946108,0.9062901155327343,undersample,0.8774053197025983,0.8753637156030315,0.8889389234401234,COMPLETE
765,0.38612143742255267,2025-09-23 14:45:02.762643,2025-09-23 14:45:03.518049,0 days 00:00:00.755406,66.60661723477996,gbtree,0.4133052781114202,4.272804320353899,depthwise,4.206476771968887,0.00013681324741599357,5,11,3.9738602158436196,700,,0.32473778197707925,0.650541397841133,undersample,0.7874571095845204,1.2428102885213526,,,,0.5395223212359856,0.23932848807452145,0.23925061425061425,0.32473778197707925,0.3862228462872718,0.38612143742255267,0.650541397841133,0.6588776522913299,0.6528176632979132,0.23932848807452145,0.23925061425061425,1.0,1.0,undersample,0.8599427536299452,0.8570958941215104,0.7874571095845204,COMPLETE
766,0.6534976979058369,2025-09-23 14:45:03.649302,2025-09-23 14:45:05.049298,0 days 00:00:01.399996,0.006141062784331668,gbtree,0.5465322971491544,4.462765799784566,depthwise,0.0002861456880520361,0.017966818527482827,9,11,8.039613083659225,700,,0.43554662335185906,0.8903647203711125,oversample,0.7990809362081994,3.396584549067622,,,,0.5790930878220207,0.7582147609786057,0.7611588861588862,0.43554662335185906,0.650074074074074,0.6534976979058369,0.8903647203711125,0.8227615247823021,0.8163886374531782,0.4972801450589302,0.5004549590536852,0.9384088964927289,0.9413778348309799,oversample,0.9248804427018849,0.9236180390616346,0.7990809362081994,COMPLETE
767,0.5489724792693186,2025-09-23 14:45:05.177757,2025-09-23 14:45:07.781879,0 days 00:00:02.604122,4.721150556998258,gbtree,0.9198985188758821,7.680521671633489,lossguide,0.015099893371096493,0.004704507498903589,4,9,4.67522773932165,800,,0.3311923807896334,0.8225490015128423,oversample,0.5649459396730655,3.3691052076075665,,,,0.2963173941594227,0.6133688197358993,0.6157862407862408,0.3311923807896334,0.5470679937642403,0.5489724792693186,0.8225490015128423,0.7188807093685623,0.7103397676454365,0.380103316113981,0.38168449197860965,0.9756201881950385,0.97732135216089,oversample,0.8859049879939066,0.8868776598651396,0.5649459396730655,COMPLETE
768,0.6641434918545335,2025-09-23 14:45:07.909298,2025-09-23 14:45:11.197934,0 days 00:00:03.288636,0.17992757132843282,dart,0.9074111827570466,7.962187955222511,lossguide,16.51775642397696,0.013826048416832423,10,6,0.5214817621790337,200,tree,0.6215005579525399,0.7606350987823474,undersample,0.8085582362388318,1.8839713580087922,0.0239370571631084,weighted,0.7273755445663687,0.833810526772693,0.7849319275258471,0.791052416052416,0.6215005579525399,0.6633552315334081,0.6641434918545335,0.7606350987823474,0.7795414057969151,0.7691779039026426,0.5303612605687933,0.539572192513369,0.8853721129170231,0.8635002139495079,undersample,0.9074215315835829,0.904002257943239,0.8085582362388318,COMPLETE
769,0.5223925458370905,2025-09-23 14:45:11.323134,2025-09-23 14:45:11.882040,0 days 00:00:00.558906,0.021521916292936115,gbtree,0.2561447447030065,7.157890319241993,lossguide,0.00013996738826013632,0.010103420887006604,4,7,1.6572522392889106,200,,0.663264606294336,0.7072616387125898,oversample,0.9336597962853934,0.6542268126896299,,,,0.32456112952797106,0.8422561162862114,0.8373259623259623,0.663264606294336,0.5444871415903044,0.5223925458370905,0.7072616387125898,0.7798239163011352,0.7745814942244948,0.8813397129186603,0.8777777777777778,0.3939264328485885,0.3718442447582371,oversample,0.905451971655052,0.9049589413302712,0.9336597962853934,COMPLETE
770,0.6556029232643118,2025-09-23 14:45:12.007242,2025-09-23 14:45:50.444635,0 days 00:00:38.437393,3.066238263687646,dart,0.5038952658758853,1.2180046709593817,depthwise,0.00214305720433089,0.001621829827634712,10,10,12.891533315050662,700,tree,0.6760361598295913,0.9321028883700084,oversample,0.8005051034528867,3.2133009366832805,0.04850345117030036,uniform,0.8014121077695192,0.7664398367990617,0.7608762411710512,0.7684275184275184,0.6760361598295913,0.6491438870531692,0.6556029232643118,0.9321028883700084,0.7853064763229396,0.7746163415716151,0.5002314814814814,0.5088631529189317,0.9242942686056459,0.9212665810868635,oversample,0.9116361831962122,0.9095522193137066,0.8005051034528867,COMPLETE
771,0.6512055109070034,2025-09-23 14:45:50.571456,2025-09-23 14:46:06.757773,0 days 00:00:16.186317,51.64753476688912,dart,0.648982119433906,4.929229490557436,depthwise,0.0408610704136089,0.0014487232536047284,2,4,0.18425780845578835,500,forest,0.561174020116495,0.7181019234818764,oversample,0.7849335147114264,0.9716518119018336,0.27744985741299516,weighted,0.6975166006994054,0.4981965930743695,0.8444057733647251,0.8444922194922195,0.561174020116495,0.6559529198732458,0.6512055109070034,0.7181019234818764,0.7390108134075245,0.7342658043855297,0.6966346153846154,0.7026759167492567,0.6197604790419161,0.6067608044501498,oversample,0.8897825492103629,0.8880284266370275,0.7849335147114264,COMPLETE
772,0.14726840855106887,2025-09-23 14:46:06.883464,2025-09-23 14:46:07.737258,0 days 00:00:00.853794,0.0008026558298669779,gbtree,0.6889957747783126,8.71426100715099,lossguide,0.05530166407471649,0.0010790982574231747,6,8,48.929885044027294,600,,0.5864298801925567,0.9434614368332959,undersample,0.512335265613584,0.5821407411495338,,,,0.64095248483184,0.7800184256321016,0.7794840294840295,0.5864298801925567,0.15092848676412485,0.14726840855106887,0.9434614368332959,0.7126562724071757,0.7044767141099856,0.9896373056994818,0.9841269841269841,0.08169375534644996,0.07958921694480103,undersample,0.876987992985711,0.8753862881254655,0.512335265613584,COMPLETE
773,0.5624171746620726,2025-09-23 14:46:07.864822,2025-09-23 14:47:06.170303,0 days 00:00:58.305481,4.867392394045927,dart,0.8648861668972936,8.29617453761959,depthwise,0.0002379674459469259,0.006653120626001571,0,8,0.3451639235745512,1000,forest,0.43410956756772323,0.7628116481581022,none,0.7205672726355068,0.7222371750071864,0.48912367841634,uniform,0.6085121431389281,0.8633194349784072,0.8355000511823114,0.8309787059787059,0.43410956756772323,0.5761012925349512,0.5624171746620726,0.7628116481581022,0.7149920648686805,0.7051132213168628,0.7515485203028217,0.7388579387186629,0.46706586826347307,0.4540008557980317,none,0.8814889397627836,0.8813548200713717,0.7205672726355068,COMPLETE
774,0.573309241094476,2025-09-23 14:47:06.297997,2025-09-23 14:47:29.856748,0 days 00:00:23.558751,0.10472719259092476,dart,0.22069964873262737,8.813188345704772,lossguide,12.389474466009027,0.30764457795958333,0,7,34.35223221749186,600,tree,0.52062163667849,0.5167285796667531,undersample,0.5657630814446695,4.968201010447461,0.032330300453801475,weighted,0.04867564987321158,0.6977949839539261,0.659023441498618,0.6615479115479116,0.52062163667849,0.5720159321598356,0.573309241094476,0.5167285796667531,0.7228282356994897,0.717703237455096,0.40881542699724516,0.4104601737201996,0.9520958083832335,0.9503637141634574,undersample,0.8758520792200708,0.8721585037918671,0.5657630814446695,COMPLETE
775,0.546655182314097,2025-09-23 14:47:29.983548,2025-09-23 14:47:33.522146,0 days 00:00:03.538598,0.1722960410471908,gbtree,0.39376207319117623,4.493026954400483,lossguide,0.013615146249459292,0.000281036179038932,8,9,8.543177936465003,700,,0.4584275768095729,0.9678904936531372,none,0.700725563844923,2.1433389156643377,,,,0.8813983531197069,0.8430750332685024,0.8383497133497133,0.4584275768095729,0.561122244488978,0.546655182314097,0.9678904936531372,0.7752829627993292,0.7660058647155263,0.8484848484848485,0.8307155322862129,0.41916167664670656,0.4073598630723149,none,0.9080592779490905,0.9065232401681261,0.700725563844923,COMPLETE
776,0.0,2025-09-23 14:47:33.648678,2025-09-23 14:47:47.489333,0 days 00:00:13.840655,0.010594028789993389,dart,0.693975936934389,0.6006276989926962,depthwise,0.3808580846344674,0.0057962423952406476,10,6,54.174395464993076,500,tree,0.5801339574354596,0.662406155393898,none,0.5888948370639138,0.5309119145088114,0.3610285754642951,weighted,0.39846514002096384,0.42546165220188703,0.7606715119254785,0.7607493857493858,0.5801339574354596,0.0,0.0,0.662406155393898,0.6892846599990126,0.677522456999409,0.0,0.0,0.0,0.0,none,0.8748926105341656,0.8762123445555048,0.5888948370639138,COMPLETE
777,0.43722304283604135,2025-09-23 14:47:47.614512,2025-09-23 14:47:50.262543,0 days 00:00:02.648031,0.027265412151268115,dart,0.9922926274595838,7.943851447680824,lossguide,0.023406363909051806,0.015453753230594483,2,12,5.696472509975839,200,tree,0.34302321738796104,0.5140616230344188,none,0.5620325189705497,0.5088554983597009,0.48964951403301604,uniform,0.49222914021442626,0.21848357813584818,0.8069403214249156,0.8049754299754299,0.34302321738796104,0.44950379451255107,0.43722304283604135,0.5140616230344188,0.6312630181848582,0.6149896481560235,0.7077205882352942,0.7061068702290076,0.32934131736526945,0.31664527171587503,none,0.8466333380876518,0.8409517036121852,0.5620325189705497,COMPLETE
778,0.38612143742255267,2025-09-23 14:47:50.388913,2025-09-23 14:47:53.334914,0 days 00:00:02.946001,5.81917652315401,dart,0.806944669309215,4.938078487324179,lossguide,0.23280593229982155,0.0002172990595744034,0,8,15.969383570854749,200,forest,0.4269614765259464,0.637893929280223,undersample,0.5318128333210317,1.4472221747970295,0.26276338440863956,weighted,0.45956534869558624,0.5818113779156286,0.23932848807452145,0.23925061425061425,0.4269614765259464,0.3862228462872718,0.38612143742255267,0.637893929280223,0.6149351185936788,0.6168162429966306,0.23932848807452145,0.23925061425061425,1.0,1.0,undersample,0.839175677136413,0.846027469262645,0.5318128333210317,COMPLETE
779,0.6564605021432945,2025-09-23 14:47:53.460731,2025-09-23 14:48:14.290198,0 days 00:00:20.829467,0.00027463224424802634,dart,0.9183139017432127,8.53072561434687,lossguide,0.4217739017570462,0.005899368770782089,3,11,0.357385612442244,500,forest,0.41338338597567315,0.9076197692426617,oversample,0.5510426190697109,1.7195698261344874,0.37730452885735705,weighted,0.8259207310001505,0.7646254488797244,0.7685535878800287,0.7702702702702703,0.41338338597567315,0.6576835730507191,0.6564605021432945,0.9076197692426617,0.8137678612626222,0.8041305204524386,0.5090227325990156,0.5110846245530394,0.9289991445680068,0.9174154899443732,oversample,0.9206758637980974,0.917396257233932,0.5510426190697109,COMPLETE
780,0.38612143742255267,2025-09-23 14:48:14.417286,2025-09-23 14:48:30.265582,0 days 00:00:15.848296,1.0526568045685718,dart,0.7224769207470032,3.9717530397570053,lossguide,0.0016251211430238486,0.00016466631058962878,1,5,0.11443854803453159,500,tree,0.6150737503143782,0.9114662751092766,undersample,0.5244965039017331,1.9238205213442163,0.16551071605521206,weighted,0.0746763241379487,0.6685342014813147,0.23932848807452145,0.23925061425061425,0.6150737503143782,0.3862228462872718,0.38612143742255267,0.9114662751092766,0.7188971957806531,0.7120295340637572,0.23932848807452145,0.23925061425061425,1.0,1.0,undersample,0.891843396660166,0.8900819503488577,0.5244965039017331,COMPLETE
781,0.38612143742255267,2025-09-23 14:48:30.395527,2025-09-23 14:49:16.470586,0 days 00:00:46.075059,0.4335502687869816,dart,0.42797179019851195,9.251603504738773,depthwise,4.600201077802711,0.00010259405120748453,1,6,7.1812657951592165,900,forest,0.5309545686111535,0.6371405366574634,undersample,0.7575569207351849,3.9528321710370986,0.31074095975011073,uniform,0.4125792605192714,0.42573657232720585,0.23932848807452145,0.23925061425061425,0.5309545686111535,0.3862228462872718,0.38612143742255267,0.6371405366574634,0.718534181424214,0.7121506421647054,0.23932848807452145,0.23925061425061425,1.0,1.0,undersample,0.8836737103105053,0.8832905290360089,0.7575569207351849,COMPLETE
782,0.6728501807891841,2025-09-23 14:49:16.624189,2025-09-23 14:49:17.263151,0 days 00:00:00.638962,0.00041098563676921114,gbtree,0.4625042484305832,5.996247450863539,depthwise,0.0005148617377861289,0.0248255161294964,7,3,0.650660050856369,700,,0.5170014940133346,0.8637513335459632,oversample,0.6230232854443187,1.9813887719402445,,,,0.6521143503113411,0.7814515303511107,0.786957411957412,0.5170014940133346,0.6681175190424374,0.6728501807891841,0.8637513335459632,0.8163552509086192,0.8071540243173583,0.5247863247863248,0.5318091451292246,0.9191616766467066,0.9157038938810441,oversample,0.9227869884546035,0.9209676679135106,0.6230232854443187,COMPLETE
783,0.5826403326403327,2025-09-23 14:49:17.391594,2025-09-23 14:49:28.833300,0 days 00:00:11.441706,71.10880661460752,dart,0.786747241234498,1.3999704124155954,depthwise,0.0010836683723949043,0.0004921545776547251,0,9,3.1883593909956645,400,forest,0.5089999853830363,0.8548637224102789,none,0.8244452597803014,4.215013797166076,0.3438407102806475,weighted,0.7200920316171715,0.8953059371632246,0.6659842358480909,0.6711711711711712,0.5089999853830363,0.580105520525029,0.5826403326403327,0.8548637224102789,0.7247378434806472,0.715022810066837,0.41487207804159765,0.4183616346333271,0.9640718562874252,0.959349593495935,none,0.8983908588613188,0.8954331353227902,0.8244452597803014,COMPLETE
784,0.0,2025-09-23 14:49:28.960550,2025-09-23 14:49:29.593837,0 days 00:00:00.633287,10.192467302332402,gbtree,0.3040071433012823,7.52409482944432,depthwise,7.004877392893597,0.000612242948919189,2,9,0.8596730138729366,300,,0.6169932895982895,0.8448884053370458,none,0.8991330812861593,1.0682473938817894,,,,0.8410385368884123,0.7606715119254785,0.7607493857493858,0.6169932895982895,0.0,0.0,0.8448884053370458,0.7508603307566019,0.7431945579105643,0.0,0.0,0.0,0.0,none,0.9016468476047501,0.8998206117879125,0.8991330812861593,COMPLETE
785,0.6091086895780944,2025-09-23 14:49:29.720828,2025-09-23 14:49:30.101354,0 days 00:00:00.380526,0.04083572976877962,gbtree,0.7798407760470873,9.689112715985075,lossguide,4.196036850250822,0.19996264114824502,7,10,64.46914860355619,300,,0.3819706928791901,0.5046208863336863,oversample,0.9239845217928039,1.7510379933265747,,,,0.757923991662202,0.7051898863752687,0.7135544635544635,0.3819706928791901,0.6046128500823723,0.6091086895780944,0.5046208863336863,0.7900401651704441,0.7831996736138287,0.44520824909017387,0.45218834266749636,0.941830624465355,0.9328198545143346,oversample,0.9060852284703331,0.9040027186069621,0.9239845217928039,COMPLETE
786,0.6944500914820085,2025-09-23 14:49:30.229161,2025-09-23 14:49:32.466558,0 days 00:00:02.237397,19.10228903981782,gbtree,0.6881713307184183,3.013167426510237,lossguide,0.031222835917109247,0.011185656044864517,3,11,0.294143182659376,800,,0.6156149794711898,0.7857796189998933,oversample,0.8944495895891494,0.9246848546551103,,,,0.6828467785763614,0.8525949431876344,0.8461302211302212,0.6156149794711898,0.7099113618049959,0.6944500914820085,0.7857796189998933,0.7980011327153552,0.7840613033063355,0.670982482863671,0.6615027110766848,0.7536355859709153,0.7308515190415062,oversample,0.9156589928741629,0.9108282578268061,0.8944495895891494,COMPLETE
787,0.6971027216856892,2025-09-23 14:49:32.594717,2025-09-23 14:49:35.158852,0 days 00:00:02.564135,0.00032543573363915106,gbtree,0.9094822901722539,0.12743719801931674,depthwise,0.0003169725126444224,0.0013463273538760374,4,9,0.3320170956628486,1000,,0.3475713516214167,0.8693010713486733,none,0.5982287591305371,1.621717593599442,,,,0.3710397555126382,0.8168696898351929,0.8234029484029484,0.3475713516214167,0.6893557909359264,0.6971027216856892,0.8693010713486733,0.8103454357195208,0.8002553124313773,0.580239695995323,0.5911256700416915,0.84901625320787,0.8493795464270432,none,0.9181490528372863,0.9151061827002691,0.5982287591305371,COMPLETE
