number,value,datetime_start,datetime_complete,duration,params_alpha,params_booster,params_colsample_bytree,params_gamma,params_grow_policy,params_lambda,params_learning_rate,params_max_delta_step,params_max_depth,params_min_child_weight,params_n_estimators,params_normalize_type,params_params_decision_threshold,params_params_feature_fraction,params_params_resampling,params_params_sample_rows,params_params_scale_pos_weight,params_rate_drop,params_sample_type,params_skip_drop,params_subsample,user_attrs_acc_test,user_attrs_acc_val,user_attrs_decision_threshold,user_attrs_f1_test,user_attrs_f1_val,user_attrs_feature_fraction,user_attrs_pr_auc_test,user_attrs_pr_auc_val,user_attrs_prec_test,user_attrs_prec_val,user_attrs_rec_test,user_attrs_rec_val,user_attrs_resampling_strategy,user_attrs_roc_auc_test,user_attrs_roc_auc_val,user_attrs_sample_rows,state
2484,0.6806136680613668,2025-09-24 01:16:55.985307,2025-09-24 01:17:28.546425,0 days 00:00:32.561118,0.023068837386419568,dart,0.5376861525028042,4.418443561985719,depthwise,0.0005099062624962225,0.3976823699960816,3,10,18.422638119297698,700,tree,0.6228571338405958,0.90594224137649,none,0.9694198048858222,1.6663511393952388,0.04501963591061493,weighted,0.7693322496615126,0.689690185698844,0.86539052103593,0.8593366093366094,0.6228571338405958,0.6992911045049165,0.6806136680613668,0.90594224137649,0.8008765259765951,0.7916930912454447,0.7513513513513513,0.7450381679389313,0.6539777587681779,0.6264441591784339,none,0.9179776441119721,0.9144256960067423,0.9694198048858222,COMPLETE
2485,0.7002240992932253,2025-09-24 01:17:28.697875,2025-09-24 01:17:29.599001,0 days 00:00:00.901126,0.0004763030033473173,gbtree,0.4353697811460652,3.602917787483432,lossguide,0.0003249422027951423,0.14387437680888437,3,6,0.9480678647705469,200,,0.6964982150631541,0.9583626477089204,oversample,0.9409873582549868,3.437821945241331,,,,0.6623627721773518,0.8182004299314157,0.821969696969697,0.6964982150631541,0.6975476839237057,0.7002240992932253,0.9583626477089204,0.8245172660713023,0.8170904712948213,0.579513299377476,0.5863163972286374,0.8759623609923011,0.8690629011553274,oversample,0.9263643829475832,0.9240920044497811,0.9409873582549868,COMPLETE
2486,0.7196827384679607,2025-09-24 01:17:29.744747,2025-09-24 01:17:49.525718,0 days 00:00:19.780971,0.5555185675483567,dart,0.29412230670003714,2.649892414794614,lossguide,0.00011257832617148326,0.04135051546190229,1,9,0.36871557734690535,500,forest,0.5988162228699145,0.8244678679316964,none,0.7427959808285276,2.5121597894758407,0.03886300646779168,weighted,0.7334719067743901,0.7691916086030712,0.8610912068789026,0.8625102375102375,0.5988162228699145,0.7195701591237859,0.7196827384679607,0.8244678679316964,0.8234443622859047,0.8169649106471306,0.6961215513794482,0.7025264873675632,0.7446535500427716,0.7376979032948224,none,0.925427707362828,0.9238927385980403,0.7427959808285276,COMPLETE
2487,0.7148807269973495,2025-09-24 01:17:49.673892,2025-09-24 01:17:58.987741,0 days 00:00:09.313849,0.00013572808630562874,dart,0.24126596861389482,2.51480953014939,lossguide,0.0038959387444086543,0.03076671505803508,2,11,1.0458842781588915,300,forest,0.6418641703683103,0.9459635930680005,none,0.7865988556304879,4.742022636482829,0.11222409317155897,weighted,0.706885440316628,0.991552852162084,0.8455317842153751,0.8458230958230958,0.6418641703683103,0.7160865475070555,0.7148807269973495,0.9459635930680005,0.8159218815758987,0.8098485131648996,0.6392341283170977,0.6410865874363327,0.8139435414884517,0.8078733418913137,none,0.9238521630250083,0.922635241799797,0.7865988556304879,COMPLETE
2488,0.7149220489977728,2025-09-24 01:17:59.137267,2025-09-24 01:18:59.446178,0 days 00:01:00.308911,0.004010003498864386,dart,0.46635423375984036,3.0025689031914427,lossguide,0.007577208489663923,0.03825042796947244,1,8,0.5230866377338451,900,forest,0.5855890775172579,0.9525508852059603,none,0.7883887026102703,4.055593156501437,0.26608375957319347,weighted,0.8955612530190418,0.9116099025849654,0.8413348346811342,0.8427518427518428,0.5855890775172579,0.7143383708072245,0.7149220489977728,0.9525508852059603,0.8284590652622921,0.822506092782864,0.6275906735751295,0.6312684365781711,0.8289136013686912,0.8241335044929397,none,0.9276959950564294,0.9256990010564747,0.7883887026102703,COMPLETE
2489,0.6870095902353966,2025-09-24 01:18:59.597352,2025-09-24 01:19:00.429631,0 days 00:00:00.832279,0.003944337970316771,gbtree,0.39671725735329233,7.488684980293733,depthwise,0.10741270558028825,0.11254673378145578,8,7,0.5907914349925698,800,,0.6579004177097891,0.7847169953742203,undersample,0.5636250757723418,1.8353874010750282,,,,0.7381422555626883,0.8151294912478247,0.8162366912366913,0.6579004177097891,0.6914929962418859,0.6870095902353966,0.7847169953742203,0.795403806295702,0.7821816130406172,0.5756541524459613,0.5797527957622131,0.8656971770744226,0.8429610611895593,undersample,0.91692910390074,0.9123826811860962,0.5636250757723418,COMPLETE
2490,0.6001739634676718,2025-09-24 01:19:00.585859,2025-09-24 01:19:01.862287,0 days 00:00:01.276428,0.047238653122238454,gbtree,0.9932076892548933,7.814468042795326,lossguide,84.78986297213677,0.00815449228371257,0,8,33.460088672842616,1000,,0.4007447277043313,0.5546238802050293,undersample,0.8624533001572017,1.0805002094011165,,,,0.5853079335414176,0.7113317637424507,0.7176494676494677,0.4007447277043313,0.596451058958214,0.6001739634676718,0.5546238802050293,0.6786125540031293,0.6665118373512101,0.4481720430107527,0.4538478403858803,0.8913601368691189,0.8857509627727856,undersample,0.868013669874623,0.8680368878779623,0.8624533001572017,COMPLETE
2491,0.6779166666666666,2025-09-24 01:19:02.013390,2025-09-24 01:19:28.923348,0 days 00:00:26.909958,0.004197183434741388,dart,0.869043269718675,8.029130739388561,lossguide,0.29559463141671044,0.00046361538105499107,4,11,0.22735927188065444,600,forest,0.616754855025929,0.7462715393227588,undersample,0.6155763297700283,1.3709013268503285,0.21934159901303407,weighted,0.6510740650472702,0.9400207393947144,0.8421537516634251,0.8417280917280917,0.616754855025929,0.6831072749691739,0.6779166666666666,0.7462715393227588,0.7728843162557448,0.7696259425047444,0.6574367088607594,0.6605765326837191,0.7108639863130881,0.6961916987590928,undersample,0.9037511515984122,0.9018877826625408,0.6155763297700283,COMPLETE
2492,0.7238627294493216,2025-09-24 01:19:29.070111,2025-09-24 01:19:37.938696,0 days 00:00:08.868585,0.00020284169143447922,dart,0.589936058828235,3.59254089859461,lossguide,0.02397280602996298,0.04967702168555176,6,10,0.33303246901829237,300,forest,0.6894878377580174,0.9504417511169955,none,0.9338355900448662,4.972854443172456,0.17387823340962982,weighted,0.7682672028310733,0.5300441010857329,0.8545398710205753,0.8583128583128583,0.6894878377580174,0.7175511826674618,0.7238627294493216,0.9504417511169955,0.8253055857607721,0.8211013239671522,0.6702562198291868,0.6781308411214954,0.7720273738237811,0.7762088147197261,none,0.9263267110165159,0.9256398345595337,0.9338355900448662,COMPLETE
2493,0.7137546468401487,2025-09-24 01:19:38.086241,2025-09-24 01:19:41.334138,0 days 00:00:03.247897,0.001053944634973886,gbtree,0.5112511286058028,0.8060539810237072,lossguide,0.04659484876042194,0.03628638630603431,0,7,0.7037708437604727,800,,0.6451469941189882,0.9574245476073262,none,0.7050439065301581,4.985722536521467,,,,0.5846260282640295,0.8499334629951889,0.8502252252252253,0.6451469941189882,0.7177512514439738,0.7137546468401487,0.9574245476073262,0.8205464938725465,0.814547087110526,0.6526610644257703,0.6575342465753424,0.7972626176218991,0.7804878048780488,none,0.9240448971138984,0.9212497380694861,0.7050439065301581,COMPLETE
2494,0.7111366685834771,2025-09-24 01:19:41.487628,2025-09-24 01:19:51.485393,0 days 00:00:09.997765,0.0002728711380962265,dart,0.42258482181724527,2.483014140809963,lossguide,0.0006091662145746955,0.01966949611673846,2,10,1.1290163921243466,300,forest,0.6768563772300338,0.905487778819411,oversample,0.898092586729796,1.6295319421183017,0.074288249254315,weighted,0.594982429063447,0.9576915536652302,0.8465554304432388,0.8457207207207207,0.6768563772300338,0.7149648222095455,0.7111366685834771,0.905487778819411,0.8194731083022568,0.8132783039336957,0.6436152002738789,0.6440972222222222,0.8041060735671514,0.793752674368849,oversample,0.9250473618769728,0.922677824402705,0.898092586729796,COMPLETE
2495,0.7138964577656676,2025-09-24 01:19:51.637204,2025-09-24 01:20:16.710628,0 days 00:00:25.073424,0.0004512553731830241,dart,0.8044404541506328,9.222797627939736,depthwise,0.006615122178020133,0.05118507707283321,2,9,5.2689552732481095,600,tree,0.579204571480084,0.9951803469477306,none,0.8416627974464851,2.822039906330285,0.0849597544448951,uniform,0.5407060340220952,0.4079884438238522,0.8507523799774798,0.8495085995085995,0.579204571480084,0.7190751445086705,0.7138964577656676,0.9951803469477306,0.8219542097302973,0.8150793695812237,0.6542776998597476,0.6547661549446626,0.7981180496150556,0.7847667950363714,none,0.925206165326651,0.9230672292061722,0.8416627974464851,COMPLETE
2496,0.6108786610878661,2025-09-24 01:20:16.855845,2025-09-24 01:21:21.001810,0 days 00:01:04.145965,7.748556977573026,dart,0.8105799917947271,2.3111032267174645,lossguide,0.8444745300655786,0.007011221540490801,5,3,46.53268872461804,1000,tree,0.4535109321660904,0.8866254177489705,undersample,0.9003653755637173,1.5704186562405398,0.07926031237564267,weighted,0.39948388837515003,0.320135737084775,0.7089773774183642,0.7143734643734644,0.4535109321660904,0.6073746720066289,0.6108786610878661,0.8866254177489705,0.7644435983701634,0.758816104272838,0.4485009178054252,0.45313469894475483,0.9405474764756202,0.9370988446726572,undersample,0.9013183909590128,0.8993487481780031,0.9003653755637173,COMPLETE
2497,0.7189926547743967,2025-09-24 01:21:21.150202,2025-09-24 01:21:21.966038,0 days 00:00:00.815836,0.014698049759887043,gbtree,0.9692839518233207,6.6282638084877155,depthwise,0.00042606352686401164,0.0706642090229317,0,12,1.510753191113422,300,,0.6465337064271175,0.7858664660159215,none,0.8164092275231076,2.870543618928901,,,,0.9617208785119831,0.8656976149042891,0.862919737919738,0.6465337064271175,0.7247167436005035,0.7189926547743967,0.7858664660159215,0.8246603605208991,0.8187414106718118,0.7112850082372323,0.7055189456342669,0.7386655260906758,0.7329910141206675,none,0.9262346464577044,0.9240557271815838,0.8164092275231076,COMPLETE
2498,0.7009194159004868,2025-09-24 01:21:22.117966,2025-09-24 01:22:14.903116,0 days 00:00:52.785150,0.06770063291985086,dart,0.6497000409461007,0.6114839845865391,lossguide,0.006615556409245878,0.0021372950411228807,6,9,1.4809903063250007,800,forest,0.39279311968957975,0.9358875899527146,none,0.8381742728945748,1.7483059816209543,0.16089751038357802,weighted,0.8877993555778338,0.3327691585454048,0.8251612242808886,0.8301597051597052,0.39279311968957975,0.6974849450938718,0.7009194159004868,0.9358875899527146,0.8113115132967137,0.8042485880305921,0.595223700120919,0.6056074766355141,0.8421727972626176,0.8318356867779204,none,0.9192606769850346,0.9173184050647213,0.8381742728945748,COMPLETE
2499,0.6516329704510109,2025-09-24 01:22:15.052382,2025-09-24 01:22:15.914155,0 days 00:00:00.861773,0.00011491339079310633,gbtree,0.889973792344861,4.22091156548006,depthwise,0.0005032654508906217,0.014134961220955304,5,3,44.18169741052938,600,,0.3555653769960191,0.5193732438699887,undersample,0.6329776096054336,0.7182271058349985,,,,0.9348788702323296,0.7602620534343331,0.7706797706797707,0.3555653769960191,0.6414574402939376,0.6516329704510109,0.5193732438699887,0.7675497158865046,0.7619761237764985,0.4995231282784931,0.5118494991448815,0.8960650128314799,0.8964484381685922,undersample,0.8985334020810102,0.8986193447553752,0.6329776096054336,COMPLETE
2500,0.5766806722689075,2025-09-24 01:22:16.061790,2025-09-24 01:22:55.822951,0 days 00:00:39.761161,71.7230976413984,dart,0.4885644155120491,5.745924197844428,depthwise,0.29321208294666895,0.029825715506072683,5,5,76.83192145607512,800,forest,0.35545222522611963,0.9943438479252757,undersample,0.6521658069515467,1.205303703573271,0.17083597047230742,weighted,0.599089535187493,0.25209795282250747,0.6649605896202273,0.6699426699426699,0.35545222522611963,0.5737726266440942,0.5766806722689075,0.9943438479252757,0.6759304559051863,0.6589763275730222,0.4124695749859577,0.4159878764917598,0.9422583404619332,0.9396662387676509,undersample,0.8674219413989369,0.8638386578286028,0.6521658069515467,COMPLETE
2501,0.38612143742255267,2025-09-24 01:22:55.972929,2025-09-24 01:23:03.202202,0 days 00:00:07.229273,0.00010477838433647926,dart,0.8292002736135227,9.916217402859708,depthwise,0.143475072915116,0.00023868324422982078,2,10,0.11060736442338044,300,forest,0.5260765639839252,0.5948833823034191,undersample,0.7926297130818823,2.64116600589569,0.10803712167681923,weighted,0.7511414121738634,0.6280629982729877,0.23932848807452145,0.23925061425061425,0.5260765639839252,0.3862228462872718,0.38612143742255267,0.5948833823034191,0.6367937013475481,0.6315247742666541,0.23932848807452145,0.23925061425061425,1.0,1.0,undersample,0.8635043771387958,0.8619499941466916,0.7926297130818823,COMPLETE
2502,0.6833484986351228,2025-09-24 01:23:03.351621,2025-09-24 01:23:04.346508,0 days 00:00:00.994887,0.2289179933151998,gbtree,0.32556717833452414,9.168612467772917,depthwise,25.360908205291487,0.026814903057429965,0,8,0.12492938287096654,900,,0.5938429169718064,0.8597812108145944,oversample,0.5719578895223445,0.5923791272843602,,,,0.44033000508111453,0.8559729757395844,0.8574938574938575,0.5938429169718064,0.6878189483026403,0.6833484986351228,0.8597812108145944,0.7872801073842557,0.7786414594429093,0.7146150299677271,0.7294803302574066,0.6629597946963216,0.6427043217800599,oversample,0.9113665511701092,0.9088713583309047,0.5719578895223445,COMPLETE
2503,0.6711677152063833,2025-09-24 01:23:04.497526,2025-09-24 01:23:05.493769,0 days 00:00:00.996243,0.009673964214154418,gbtree,0.2599021076926696,2.5049130851211134,lossguide,0.005598905832209551,0.07787272723880877,3,3,1.1506308856143073,700,,0.5635503339861995,0.9812351065015863,oversample,0.9617558309325039,3.1945559901873857,,,,0.9065086065786365,0.7770498515712969,0.7806101556101556,0.5635503339861995,0.6658484197606628,0.6711677152063833,0.9812351065015863,0.8274106342265707,0.8188646207403814,0.5191387559808612,0.5232057416267942,0.9281437125748503,0.9358151476251605,oversample,0.9281334959701683,0.9257668625811898,0.9617558309325039,COMPLETE
2504,0.7026332691072575,2025-09-24 01:23:05.647486,2025-09-24 01:23:09.974857,0 days 00:00:04.327371,0.0001151549835288872,gbtree,0.26721214165469565,0.16154856040152055,lossguide,2.17841742054558,0.1357825542681235,1,9,2.3459736686133517,1000,,0.6636388937967874,0.7739536419923307,none,0.8023344490237612,4.104426274996013,,,,0.9003158794284158,0.8502405568635479,0.8578009828009828,0.6636388937967874,0.6889219647033809,0.7026332691072575,0.7739536419923307,0.7999850950217664,0.8032401396656503,0.6849894291754757,0.7030848329048843,0.6928999144568007,0.7021822849807445,none,0.9129601400463391,0.9151100983419158,0.8023344490237612,COMPLETE
2505,0.632240682532555,2025-09-24 01:23:10.126702,2025-09-24 01:24:20.206166,0 days 00:01:10.079464,0.1364231851931784,dart,0.45370042792322207,3.3197202651581432,lossguide,0.016755225775581258,0.04038056538325999,9,12,0.7185511640507024,1000,forest,0.5978168822069972,0.5530419528317159,undersample,0.5240219408094691,3.177859535180699,0.06347377781513765,weighted,0.6160357937830276,0.2734413292626001,0.7401985873682055,0.7484643734643734,0.5978168822069972,0.6256637168141593,0.632240682532555,0.5530419528317159,0.7536282820482475,0.7513984636086841,0.4774876181900045,0.4861878453038674,0.907185628742515,0.9037227214377407,undersample,0.8941459891221651,0.8926472426656146,0.5240219408094691,COMPLETE
2506,0.7230864965774736,2025-09-24 01:24:20.354520,2025-09-24 01:24:23.311496,0 days 00:00:02.956976,0.008770285374780504,gbtree,0.2673068798080458,1.482633026330714,lossguide,0.0014169090414680638,0.05027349336906974,1,9,0.3326757928097839,600,,0.695129973258702,0.8127595256030232,none,0.8302589974065583,4.490983781031673,,,,0.8304430710419122,0.8613983007472618,0.8633292383292384,0.695129973258702,0.7224272242722427,0.7230864965774736,0.8127595256030232,0.8267239694333424,0.8213812458324228,0.6937007874015748,0.7016908212560387,0.7536355859709153,0.7458279845956355,none,0.9261551008370249,0.9250629972037135,0.8302589974065583,COMPLETE
2507,0.6203172460344246,2025-09-24 01:24:23.458275,2025-09-24 01:24:55.926204,0 days 00:00:32.467929,0.0011066551563020182,dart,0.7036382764448587,8.84488621364226,depthwise,76.06526352584966,0.46143602976173625,10,5,0.2625229383962163,700,forest,0.6270465022502396,0.6846032606482251,undersample,0.8050325408864414,1.2506082499134534,0.243251309135916,weighted,0.6955884944893312,0.5177741741772519,0.7690654109939605,0.7696560196560197,0.6270465022502396,0.6223635754938065,0.6203172460344246,0.6846032606482251,0.6626237311788813,0.6458805334702434,0.5112761276127613,0.5121203677904709,0.7951240376390077,0.7864783910997005,undersample,0.8689521873261379,0.8665104210483703,0.8050325408864414,COMPLETE
2508,0.6801856828731981,2025-09-24 01:24:56.075373,2025-09-24 01:26:09.811224,0 days 00:01:13.735851,0.367551804305236,dart,0.48943786247324106,1.431430980085101,lossguide,0.00016291618353206046,0.04928145349575738,10,12,0.10749980434824466,1000,forest,0.4508529783507195,0.8897825851257868,none,0.8515511901772388,0.6945909446190506,0.03271522576038817,weighted,0.7447586917899186,0.5280833203263514,0.8670283550005118,0.865990990990991,0.4508529783507195,0.6827838827838828,0.6801856828731981,0.8897825851257868,0.8128010643416961,0.8101799714121991,0.7956744450768355,0.7927107061503417,0.5979469632164243,0.5956354300385109,none,0.9189467825983653,0.9189610167355101,0.8515511901772388,COMPLETE
2509,0.6236224922294433,2025-09-24 01:26:09.961986,2025-09-24 01:26:45.018288,0 days 00:00:35.056302,0.00031239275299256824,dart,0.2771536549573842,1.5539416994508723,lossguide,0.4504587326517445,0.0031214742154465425,3,6,0.48177123469806193,700,forest,0.6512254078993973,0.8696486081532583,undersample,0.8886369397269289,4.075214851165907,0.12154732877195185,weighted,0.6997629243319836,0.5357580624883392,0.7236155184768144,0.7272727272727273,0.6512254078993973,0.6216367713004485,0.6236224922294433,0.8696486081532583,0.7683803059185356,0.7623303777558741,0.4622759483117966,0.4655136047247416,0.9486740804106074,0.9443731279418057,undersample,0.9060596150107076,0.9049585670409963,0.8886369397269289,COMPLETE
2510,0.5425314235603624,2025-09-24 01:26:45.169190,2025-09-24 01:26:46.891722,0 days 00:00:01.722532,0.00011232304506822518,gbtree,0.42729081707075944,4.776252791935466,lossguide,9.905564240408987,0.0018389173436489197,8,10,6.542173034870517,600,,0.3860420866017951,0.9474282636672136,none,0.6188895798173728,0.6032563242285383,,,,0.6492693086230509,0.8424608455317842,0.8397829647829648,0.3860420866017951,0.5501315404852383,0.5425314235603624,0.9474282636672136,0.7825604280706989,0.7755580635345644,0.8688827331486612,0.8560885608856088,0.402480752780154,0.3970902866923406,none,0.9080248868431888,0.9063133790507527,0.6188895798173728,COMPLETE
2511,0.7156388942586507,2025-09-24 01:26:47.039059,2025-09-24 01:27:05.449896,0 days 00:00:18.410837,0.00011831077517584726,dart,0.3836456612027577,4.188703373624486,lossguide,0.0006510178739697213,0.09614250678208085,0,12,14.035161130689204,500,forest,0.6443577699519983,0.8949084495791945,none,0.9272048466197826,4.224017338593511,0.006052566452366848,uniform,0.14039064019528896,0.9746168188404882,0.8467601596888116,0.8494062244062244,0.6443577699519983,0.7137119908204246,0.7156388942586507,0.8949084495791945,0.8223768017285676,0.8154203320388484,0.6454514008993428,0.6526798307475318,0.7981180496150556,0.79204107830552,none,0.9255356580224406,0.9229247977412737,0.9272048466197826,COMPLETE
2512,0.6838860189968339,2025-09-24 01:27:05.599842,2025-09-24 01:27:42.240729,0 days 00:00:36.640887,0.0025264117794083396,dart,0.21024891151030117,3.701813493625645,lossguide,0.0024848546416998446,0.004622563656587997,2,10,0.7307957717420105,700,forest,0.3508974128805271,0.9870547753826953,none,0.7855762671101951,1.8295289625628162,0.17925226925459892,weighted,0.8173646321466984,0.29161850564225256,0.7991606100931518,0.8057944307944308,0.3508974128805271,0.6792020928711576,0.6838860189968339,0.9870547753826953,0.7950507546677466,0.7866425968037185,0.5497617787188989,0.5600436681222707,0.888366124893071,0.8780487804878049,none,0.9159260059959671,0.9143860213435869,0.7855762671101951,COMPLETE
2513,0.6883404255319149,2025-09-24 01:27:42.389057,2025-09-24 01:27:43.161108,0 days 00:00:00.772051,0.0010458306873139115,gbtree,0.21388792199036422,2.924341557330119,depthwise,0.0002577458676381962,0.2440560616015953,0,8,0.11843091967870518,300,,0.6521359946223023,0.8929342342201341,oversample,0.7625891041824021,3.5275951988676284,,,,0.7443628887017879,0.8075545091616337,0.8125511875511876,0.6521359946223023,0.6835016835016835,0.6883404255319149,0.8929342342201341,0.8140144439114482,0.8091559430332392,0.5635757912270961,0.5715093273035613,0.8682634730538922,0.865211810012837,oversample,0.9183994603790862,0.9169256604492612,0.7625891041824021,COMPLETE
2514,0.7131165671311657,2025-09-24 01:27:43.311444,2025-09-24 01:27:44.570624,0 days 00:00:01.259180,0.0001656773606172086,gbtree,0.6303521362625016,1.7624131648594972,lossguide,0.43612996967967516,0.14408544448397428,0,6,0.34644596801741434,400,,0.6835936358923765,0.934829243831325,none,0.9085398626644798,3.0602532029574907,,,,0.8295946558102942,0.8664141672637936,0.8672194922194922,0.6835936358923765,0.7151277013752456,0.7131165671311657,0.934829243831325,0.8215482443097747,0.8197124102505019,0.7302719572001783,0.7380952380952381,0.7005988023952096,0.6897732135216089,none,0.9246233296139137,0.9234871817727802,0.9085398626644798,COMPLETE
