number,value,datetime_start,datetime_complete,duration,params_alpha,params_booster,params_colsample_bytree,params_gamma,params_grow_policy,params_lambda,params_learning_rate,params_max_delta_step,params_max_depth,params_min_child_weight,params_n_estimators,params_normalize_type,params_params_decision_threshold,params_params_feature_fraction,params_params_resampling,params_params_sample_rows,params_params_scale_pos_weight,params_rate_drop,params_sample_type,params_skip_drop,params_subsample,user_attrs_acc_test,user_attrs_acc_val,user_attrs_decision_threshold,user_attrs_f1_test,user_attrs_f1_val,user_attrs_feature_fraction,user_attrs_pr_auc_test,user_attrs_pr_auc_val,user_attrs_prec_test,user_attrs_prec_val,user_attrs_rec_test,user_attrs_rec_val,user_attrs_resampling_strategy,user_attrs_roc_auc_test,user_attrs_roc_auc_val,user_attrs_sample_rows,state
599,0.5948034643570953,2025-09-23 14:05:17.702551,2025-09-23 14:05:20.792761,0 days 00:00:03.090210,47.950188329921744,gbtree,0.8103174480595914,5.775115130627325,lossguide,0.0015982798899777714,0.0013609051942045831,9,12,4.253829782084555,1000,,0.327446747999351,0.7773313657420073,none,0.9251012586677532,3.4874398431909897,,,,0.757770983810186,0.680315283038182,0.6886773136773137,0.327446747999351,0.5890248716936439,0.5948034643570953,0.7773313657420073,0.7851701515683897,0.7775494306083008,0.4253944117088006,0.43188854489164086,0.9572284003421728,0.9550706033376123,none,0.9079390385846912,0.9061115507570517,0.9251012586677532,COMPLETE
600,0.0,2025-09-23 14:05:20.917826,2025-09-23 14:05:23.745976,0 days 00:00:02.828150,16.451550448749803,dart,0.2826839127919065,5.933174180430605,depthwise,0.001722109152956762,0.003511924463161653,8,10,1.3351804870222777,200,forest,0.6441264192370353,0.6390077060992337,undersample,0.6936520627586547,0.5011729744360409,0.19015249271022266,weighted,0.6417701894564909,0.24218583580698427,0.7606715119254785,0.7607493857493858,0.6441264192370353,0.0,0.0,0.6390077060992337,0.6290199941123539,0.6190623328198677,0.0,0.0,0.0,0.0,undersample,0.8485711833729161,0.8468699944207865,0.6936520627586547,COMPLETE
601,0.548689588843472,2025-09-23 14:05:23.870042,2025-09-23 14:05:29.790046,0 days 00:00:05.920004,0.26229552350625285,dart,0.9474536922240373,2.659358427327181,depthwise,0.0018310555910319487,0.09659834016181398,5,12,65.74061509647694,300,tree,0.3871917406061345,0.8747165762245686,undersample,0.5951134537488227,4.376303220817908,0.19094335500827564,weighted,0.09671020801960711,0.7091243559235727,0.612447538130822,0.6156838656838657,0.3871917406061345,0.5466954022988506,0.548689588843472,0.8747165762245686,0.7677898814979564,0.7626740438641817,0.379614233455271,0.38154154823608094,0.976475620188195,0.9764655541292255,undersample,0.8984708361695203,0.8962820233986077,0.5951134537488227,COMPLETE
602,0.0,2025-09-23 14:05:29.914204,2025-09-23 14:06:25.121639,0 days 00:00:55.207435,82.12420097940162,dart,0.2415357726904621,9.278406588394517,lossguide,88.8340242889434,0.00048585585748697773,7,7,0.4603607291463043,1000,tree,0.6087740557815543,0.5815021182074375,none,0.9453286240592086,1.2548680451918968,0.27105980401626456,weighted,0.23764270147066374,0.4374286180020197,0.7606715119254785,0.7607493857493858,0.6087740557815543,0.0,0.0,0.5815021182074375,0.6993860105001876,0.6916844794782752,0.0,0.0,0.0,0.0,none,0.870098288917292,0.8684187781044459,0.9453286240592086,COMPLETE
603,0.0,2025-09-23 14:06:25.244903,2025-09-23 14:06:37.228878,0 days 00:00:11.983975,0.0006415074137580946,dart,0.5002078199594158,8.024721910838062,depthwise,1.0440052724305926,0.0002941660825978978,8,9,28.003303502823,400,forest,0.38150199318298583,0.7791797971204458,none,0.8481312654752271,0.5940792817016346,0.020206483890992555,weighted,0.1477829840619201,0.7281651024629596,0.7606715119254785,0.7607493857493858,0.38150199318298583,0.0,0.0,0.7791797971204458,0.7624120880408012,0.7547824681212617,0.0,0.0,0.0,0.0,none,0.9019033275510229,0.898850108489186,0.8481312654752271,COMPLETE
604,0.5706740442655935,2025-09-23 14:06:37.351947,2025-09-23 14:07:08.600806,0 days 00:00:31.248859,4.805339257337816,dart,0.40149842779527634,4.461191855806888,depthwise,18.458569170849877,0.0032181423217226327,7,10,1.6370495201279236,700,forest,0.48337958802050396,0.652927431272371,oversample,0.5950706669730423,3.233706923199962,0.49512433640187187,uniform,0.6712298379467534,0.8048050119326196,0.6459207697819633,0.6504914004914005,0.48337958802050396,0.5689719626168225,0.5706740442655935,0.652927431272371,0.7559426662587226,0.7494440617797349,0.4014418850008792,0.4040961709706144,0.976475620188195,0.9709028669234061,oversample,0.902668882202145,0.8999009400246352,0.5950706669730423,COMPLETE
605,0.38612143742255267,2025-09-23 14:07:08.724045,2025-09-23 14:07:09.400791,0 days 00:00:00.676746,41.58964242422343,gbtree,0.5040535524318619,3.6619738220988216,depthwise,0.0001230204348059408,0.00024100014825068156,3,5,0.23372326862769577,600,,0.5376125253850944,0.5561374013901317,undersample,0.7046440535638823,1.7957458915337077,,,,0.6198143097215847,0.23932848807452145,0.23925061425061425,0.5376125253850944,0.3862228462872718,0.38612143742255267,0.5561374013901317,0.7104999313645206,0.7042460426508966,0.23932848807452145,0.23925061425061425,1.0,1.0,undersample,0.8828037160582809,0.881100735236577,0.7046440535638823,COMPLETE
606,0.0,2025-09-23 14:07:09.524502,2025-09-23 14:07:20.281827,0 days 00:00:10.757325,1.836598921828117,dart,0.3504831431065621,5.697309254334905,lossguide,0.1976442204960459,0.00010083220441714894,0,5,0.15031316522671573,400,forest,0.6300961992709657,0.6198746945145834,none,0.5809997810106338,3.445623761662459,0.2865775500758552,weighted,0.6147403831299945,0.6826208724045527,0.7606715119254785,0.7607493857493858,0.6300961992709657,0.0,0.0,0.6198746945145834,0.7539050222764898,0.7462726733841398,0.0,0.0,0.0,0.0,none,0.8944810937557379,0.8938504387274926,0.5809997810106338,COMPLETE
607,0.0,2025-09-23 14:07:20.408290,2025-09-23 14:07:21.753661,0 days 00:00:01.345371,0.17984668125462933,gbtree,0.8318711203119429,7.349642762766467,lossguide,0.39125605650284095,0.0001829048955262792,0,9,85.19243044662106,400,,0.5912803108037827,0.6901050178065395,none,0.8280218670983155,1.9294688354720813,,,,0.7078852891160592,0.7606715119254785,0.7607493857493858,0.5912803108037827,0.0,0.0,0.6901050178065395,0.7675162325789767,0.7616877531715818,0.0,0.0,0.0,0.0,none,0.9012764021527278,0.8991488777051253,0.8280218670983155,COMPLETE
608,0.5761178599121219,2025-09-23 14:07:21.877166,2025-09-23 14:07:22.805673,0 days 00:00:00.928507,1.9939160099384257,gbtree,0.2720351492526305,9.027086055538069,depthwise,0.047842165238274434,0.016313874235412692,5,12,1.2341680641230963,1000,,0.5511861058274534,0.5056232294452606,oversample,0.584877080367946,4.522100474377534,,,,0.5779081035614424,0.6688504452861092,0.6642096642096642,0.5511861058274534,0.5781718607380363,0.5761178599121219,0.5056232294452606,0.6961792820831736,0.6980958594395194,0.41586944288126054,0.41270135160155524,0.9482463644140291,0.9537869062901155,oversample,0.8780047897745082,0.8789080910803584,0.584877080367946,COMPLETE
609,0.6319361954861701,2025-09-23 14:07:22.929941,2025-09-23 14:07:23.476928,0 days 00:00:00.546987,0.06878299211893847,gbtree,0.7067732408135681,7.801508334641118,lossguide,49.823406580259054,0.14246273610829918,3,4,25.01290126938855,900,,0.4685636356572682,0.7166371697759018,oversample,0.9386594129823718,0.8253608503731067,,,,0.5053226452323264,0.7714197973180469,0.777948402948403,0.4685636356572682,0.6246427971087578,0.6319361954861701,0.7166371697759018,0.6961359539860299,0.6891916976624498,0.5145389088895043,0.5236220472440944,0.7946963216424294,0.7967479674796748,oversample,0.8671747283447985,0.8690296757842959,0.9386594129823718,COMPLETE
610,0.0,2025-09-23 14:07:23.601348,2025-09-23 14:07:44.856895,0 days 00:00:21.255547,0.008386298878684972,dart,0.22485823009168887,7.531838814305755,depthwise,0.00041184768135980925,0.10398882584847452,1,9,65.99833143542153,600,forest,0.6164332211597843,0.704849543862433,none,0.7133151638010616,0.7839326282514938,0.4597269944137443,weighted,0.4154400753591006,0.3998934969103798,0.7606715119254785,0.7607493857493858,0.6164332211597843,0.0,0.0,0.704849543862433,0.7029215691295922,0.6958475994882319,0.0,0.0,0.0,0.0,none,0.874641512292331,0.8728399118128402,0.7133151638010616,COMPLETE
611,0.0,2025-09-23 14:07:44.979857,2025-09-23 14:07:45.869287,0 days 00:00:00.889430,62.15931485166814,gbtree,0.4560437236335173,0.9327576427075845,lossguide,0.029267656662952467,0.00227635707965521,5,12,1.1872203120620815,900,,0.47679240871429834,0.5535151208148034,none,0.6302434465292923,0.5322398430365092,,,,0.46550728965882604,0.7606715119254785,0.7607493857493858,0.47679240871429834,0.0,0.0,0.5535151208148034,0.6646973120431733,0.6506528745715324,0.0,0.0,0.0,0.0,none,0.8640181428480487,0.8623311933775905,0.6302434465292923,COMPLETE
612,0.6953199617956065,2025-09-23 14:07:45.993571,2025-09-23 14:08:42.736137,0 days 00:00:56.742566,0.14165493215063008,dart,0.427372254002923,1.0727009244393582,depthwise,1.4289284808967642,0.08761849972060322,3,11,0.11898542658574317,1000,tree,0.6364158692295006,0.9713434857360861,none,0.5259025525782601,1.6904840349826937,0.3546298912811059,uniform,0.1825737369813252,0.801494625578322,0.8704063875524619,0.8693693693693694,0.6364158692295006,0.6997153700189753,0.6953199617956065,0.9713434857360861,0.822525557442932,0.8193382586446475,0.7854100106496272,0.7866018368449487,0.6308810949529512,0.6230209670517758,none,0.9251250368517248,0.9234678338964084,0.5259025525782601,COMPLETE
613,0.5687100720402338,2025-09-23 14:08:42.862553,2025-09-23 14:08:43.445900,0 days 00:00:00.583347,0.0040371614405120045,gbtree,0.5527158666896956,7.1224544293996885,depthwise,0.0013635067514326923,0.017822631725808415,0,12,56.26831769753825,300,,0.37973039613985216,0.6129121737690757,oversample,0.8711295936621207,1.1838213781809572,,,,0.4478263236985659,0.66629132971645,0.6751638001638002,0.37973039613985216,0.5600539811066126,0.5687100720402338,0.6129121737690757,0.7194858094434923,0.7160952422780564,0.409108832807571,0.41673306772908364,0.8875106928999145,0.8951647411210955,oversample,0.8564420556200016,0.8598274572508384,0.8711295936621207,COMPLETE
614,0.38612143742255267,2025-09-23 14:08:43.583196,2025-09-23 14:09:12.033240,0 days 00:00:28.450044,17.500152754648937,dart,0.6404170270018535,8.157216180642227,depthwise,0.02512219523250932,0.0006964305184623803,7,10,39.16454828474985,600,forest,0.34153936968366916,0.7175201157180306,undersample,0.9895406464328246,1.8724925100195557,0.2173577405806451,weighted,0.40831355061477476,0.7084121969549528,0.23932848807452145,0.23925061425061425,0.34153936968366916,0.3862228462872718,0.38612143742255267,0.7175201157180306,0.7155309968242531,0.7178016366722018,0.23932848807452145,0.23925061425061425,1.0,1.0,undersample,0.8826265227201748,0.8781670558987212,0.9895406464328246,COMPLETE
615,0.6923352435530086,2025-09-23 14:09:12.163926,2025-09-23 14:09:12.960646,0 days 00:00:00.796720,0.00010854513114969962,gbtree,0.8792989531760296,0.9030753613737741,depthwise,3.1228076541273104,0.32562279212616835,9,9,7.6720311787985995,300,,0.3618472328965103,0.7078590411599073,oversample,0.7302527789906664,1.2504219285793592,,,,0.6334904293354335,0.8226021087112294,0.8241195741195741,0.3618472328965103,0.6901483997854461,0.6923352435530086,0.7078590411599073,0.7918896739042989,0.7830292568678355,0.5929339477726574,0.5953187557745612,0.825491873396065,0.8271287976037656,oversample,0.9093046388910856,0.9060438907727156,0.7302527789906664,COMPLETE
616,0.712693135145707,2025-09-23 14:09:13.091957,2025-09-23 14:09:32.650585,0 days 00:00:19.558628,0.00017012573250509174,dart,0.7380364797802685,7.2446151549641975,lossguide,0.4922510421286359,0.23912371009266145,10,7,1.3105100756354409,500,tree,0.6616109956456474,0.9398600772001329,none,0.6695057545613124,4.364617113352972,0.13522428279674437,weighted,0.5289156589338126,0.5681188572248401,0.8447128672330843,0.8496109746109746,0.6616109956456474,0.7056083834659421,0.712693135145707,0.9398600772001329,0.8157784470573473,0.8117081485156792,0.6458259325044405,0.6563400576368876,0.7775876817792986,0.7796320068463842,none,0.9223209673852594,0.9214790334376795,0.6695057545613124,COMPLETE
617,0.5117905900936478,2025-09-23 14:09:32.899565,2025-09-23 14:09:33.609369,0 days 00:00:00.709804,25.66625234164971,gbtree,0.9841493389626375,8.749212155476991,depthwise,0.009886644537757937,0.0011508621677829417,10,4,59.89049714760452,500,,0.6526936918211461,0.5263697888584651,undersample,0.6738529892759481,4.524352322524688,,,,0.8721828408060457,0.5568635479578258,0.5570229320229321,0.6526936918211461,0.5117852712304048,0.5117905900936478,0.5263697888584651,0.6050299975705532,0.6072384653484572,0.34752642058508193,0.3475329451425069,0.9704875962360993,0.9704749679075738,undersample,0.8536309064781793,0.8571487264922582,0.6738529892759481,COMPLETE
618,0.38612143742255267,2025-09-23 14:09:33.802800,2025-09-23 14:09:40.289500,0 days 00:00:06.486700,4.999345191322965,gbtree,0.704865966939827,5.655310878117835,lossguide,0.005734914728662059,0.00023950157448383036,5,10,2.7750147717566245,500,,0.35112575132402046,0.6495588145252081,oversample,0.9720198019479421,3.4805851248097803,,,,0.9503664229855329,0.23932848807452145,0.23925061425061425,0.35112575132402046,0.3862228462872718,0.38612143742255267,0.6495588145252081,0.7166353264567971,0.709248900615118,0.23932848807452145,0.23925061425061425,1.0,1.0,oversample,0.8844361280323026,0.8855494511853943,0.9720198019479421,COMPLETE
619,0.6094003241491086,2025-09-23 14:09:40.539572,2025-09-23 14:09:41.126035,0 days 00:00:00.586463,0.0006458402399252585,gbtree,0.7486182071284337,8.820848956863571,lossguide,0.01668123984092969,0.0002403015288858418,9,3,1.1808565046761816,400,,0.3707759594042587,0.5687572657023363,none,0.8706792161341652,1.7967234876515417,,,,0.9549421908272191,0.7269935510287645,0.7286036036036037,0.3707759594042587,0.6108273748723186,0.6094003241491086,0.5687572657023363,0.7256828870135015,0.7162805649510845,0.4635658914728682,0.4647191011235955,0.8952095808383234,0.8848951647411211,none,0.8857331188019025,0.8787191037879398,0.8706792161341652,COMPLETE
620,0.0,2025-09-23 14:09:41.337225,2025-09-23 14:09:45.033808,0 days 00:00:03.696583,0.008384877487811254,gbtree,0.5880813223048819,1.7147483589674095,lossguide,0.0018488465528886874,0.0006927724394493018,1,8,2.130639715868693,800,,0.654173006291762,0.5171945300733243,none,0.8113326318293465,1.802411743542605,,,,0.881140193720557,0.7606715119254785,0.7607493857493858,0.654173006291762,0.0,0.0,0.5171945300733243,0.736656355556619,0.7289640809580143,0.0,0.0,0.0,0.0,none,0.892186329227467,0.8928707221543031,0.8113326318293465,COMPLETE
621,0.6113445378151261,2025-09-23 14:09:45.251039,2025-09-23 14:09:46.377024,0 days 00:00:01.125985,0.00013349124393201205,gbtree,0.7445386573517234,0.8356759799935554,depthwise,43.29657058631445,0.0017525910021397085,4,8,0.36571576921478266,600,,0.31883934904573236,0.6696783479705926,none,0.8821744014991451,0.5671323694712603,,,,0.6098369515691555,0.8548469648889344,0.8484848484848485,0.31883934904573236,0.6326424870466322,0.6113445378151261,0.6696783479705926,0.7724141684924435,0.7672398515301742,0.8022339027595269,0.7912984364377974,0.5222412318220702,0.4980744544287548,none,0.9019806283965894,0.9019062092114665,0.8821744014991451,COMPLETE
622,0.7180214879383742,2025-09-23 14:09:46.590350,2025-09-23 14:10:07.257277,0 days 00:00:20.666927,0.0023789597039016994,dart,0.2476550129495057,2.482748895422878,lossguide,0.00044131037100320357,0.11698407440284483,5,9,0.18452430353217592,500,forest,0.6735453071546984,0.9285773701639805,none,0.9252533819970505,4.255049202170231,0.14295235372411513,weighted,0.7864791137850127,0.3585580935654433,0.8588391851776026,0.8575962325962326,0.6735453071546984,0.7220318484176578,0.7180214879383742,0.9285773701639805,0.8207600941904654,0.8171257890200614,0.6828059473884864,0.6822033898305084,0.7660393498716852,0.7578091570389388,none,0.9249236977915672,0.9230489466146601,0.9252533819970505,COMPLETE
623,0.564595660749507,2025-09-23 14:10:07.381733,2025-09-23 14:10:09.034461,0 days 00:00:01.652728,0.08433973183668342,gbtree,0.3298537366681672,5.554356489739933,lossguide,22.685373027719617,0.0037048396717794074,8,11,94.66719826912973,800,,0.34204954742283944,0.9397293455129945,oversample,0.8910803005469468,2.1438372931421235,,,,0.472921855666703,0.6344559320298905,0.6384111384111384,0.34204954742283944,0.562431074623208,0.564595660749507,0.9397293455129945,0.7708693580910746,0.7637994527187354,0.3941267387944359,0.3965367965367965,0.9816082121471343,0.9798887462558836,oversample,0.906271314571388,0.9044919146894547,0.8910803005469468,COMPLETE
624,0.0,2025-09-23 14:10:09.160308,2025-09-23 14:10:15.968768,0 days 00:00:06.808460,0.0002744077140917911,dart,0.9240872702044534,0.4831407930409404,lossguide,0.022403823106211328,0.00015271233442788992,4,5,0.13265721130975405,300,forest,0.6356731786421943,0.8411894169032543,none,0.7422807881594815,1.0264032771239882,0.22237159577297577,uniform,0.8653867929692481,0.856351298541236,0.7606715119254785,0.7607493857493858,0.6356731786421943,0.0,0.0,0.8411894169032543,0.7333735557178417,0.7302661097653105,0.0,0.0,0.0,0.0,none,0.8659402459283521,0.8706815871039955,0.7422807881594815,COMPLETE
625,0.38612143742255267,2025-09-23 14:10:16.094050,2025-09-23 14:10:16.958251,0 days 00:00:00.864201,0.0038343946347653814,gbtree,0.2430512878867157,8.16885344399314,depthwise,0.1214807161105262,0.0006781593667288548,1,10,0.186581506128255,800,,0.4776818396817253,0.6207576381249521,undersample,0.5291978661397142,1.8698400441714216,,,,0.3573946671053211,0.23932848807452145,0.23925061425061425,0.4776818396817253,0.3862228462872718,0.38612143742255267,0.6207576381249521,0.6713212635998604,0.6581273004827095,0.23932848807452145,0.23925061425061425,1.0,1.0,undersample,0.869567485940513,0.8677604608525953,0.5291978661397142,COMPLETE
626,0.5185185185185185,2025-09-23 14:10:17.082740,2025-09-23 14:10:53.393430,0 days 00:00:36.310690,0.02647766941329003,dart,0.3132242577064342,3.877990746241682,depthwise,0.0011184557309420402,0.07876753389270512,0,4,10.753517550750251,800,forest,0.34070831203465923,0.6236370456228033,undersample,0.7756604316763199,2.6475935465815352,0.34662071925181837,uniform,0.5189841530518202,0.5929277835378717,0.5576824649401168,0.5621416871416871,0.34070831203465923,0.5159628094544639,0.5185185185185185,0.6236370456228033,0.7071986200189931,0.6914763843228341,0.34952193049021096,0.35181790406355024,0.9850299401197605,0.985451433461703,undersample,0.8814625780447871,0.8791025775459718,0.7756604316763199,COMPLETE
627,0.5888022678951098,2025-09-23 14:10:53.516877,2025-09-23 14:11:41.245809,0 days 00:00:47.728932,0.04925270363947972,dart,0.9391905492612236,4.341480268178897,lossguide,0.548458561153073,0.07891318191563418,4,3,0.6046360323030184,900,forest,0.37713150233632253,0.5223150565489061,oversample,0.7474575018017555,1.0856143215423706,0.46988150517615684,weighted,0.4323433247020734,0.2324922340776331,0.6984338212713687,0.703009828009828,0.37713150233632253,0.5854207711792851,0.5888022678951098,0.5223150565489061,0.6114752872304253,0.6041476327425187,0.436241610738255,0.44022891055532004,0.8896492728828058,0.8887462558836114,oversample,0.8537494190924915,0.8507719025302358,0.7474575018017555,COMPLETE
628,0.612427930813581,2025-09-23 14:11:41.371696,2025-09-23 14:11:42.602896,0 days 00:00:01.231200,91.45328276905194,gbtree,0.7280605629683077,0.755413642146836,lossguide,0.0005826853123815306,0.0001240616150862135,4,7,8.751910923061045,1000,,0.47824107934179516,0.9029215056788731,undersample,0.7487727014982906,0.8463677689020365,,,,0.7434696924779669,0.8097041662401474,0.8141891891891891,0.47824107934179516,0.6163054695562435,0.612427930813581,0.9029215056788731,0.6960868280329873,0.6944504861841974,0.5955325089748703,0.6112531969309463,0.6385799828913601,0.613607188703466,undersample,0.8721391060660845,0.8723125958072576,0.7487727014982906,COMPLETE
629,0.573220686123912,2025-09-23 14:11:42.729926,2025-09-23 14:11:53.685847,0 days 00:00:10.955921,0.0004615386731765264,dart,0.6778704354598021,3.1745747575056162,lossguide,0.013692716689397524,0.0008742223709974873,2,4,1.4419182447678083,400,forest,0.4339910693006798,0.8385956016097347,undersample,0.860868775716218,1.0930991970447475,0.08080105346051525,weighted,0.45014170137685555,0.9675295642774002,0.6509366362984952,0.6586814086814087,0.4339910693006798,0.5680263491259184,0.573220686123912,0.8385956016097347,0.7472797701886911,0.7412156828087918,0.4035277177825774,0.4089497716894977,0.9589392643284859,0.9580658964484382,undersample,0.895284493012936,0.8929069994225005,0.860868775716218,COMPLETE
630,0.6269258459323254,2025-09-23 14:11:53.813612,2025-09-23 14:11:54.722693,0 days 00:00:00.909081,0.49850067444867674,gbtree,0.5953402165352959,6.618529290655538,depthwise,0.3627595321621117,0.015784686720004985,3,6,0.11252591964998336,800,,0.31273384099962787,0.7402292666134813,none,0.5630509948539685,2.982581566549235,,,,0.8615551715560901,0.7348756269833145,0.7347461097461098,0.31273384099962787,0.6249637995945555,0.6269258459323254,0.7402292666134813,0.7474599961047863,0.738396546393908,0.4724168126094571,0.4724392361111111,0.9230111206159111,0.9315361574668378,none,0.8972834076929479,0.8973350142952593,0.5630509948539685,COMPLETE
