number,value,datetime_start,datetime_complete,duration,params_alpha,params_booster,params_colsample_bytree,params_gamma,params_grow_policy,params_lambda,params_learning_rate,params_max_delta_step,params_max_depth,params_min_child_weight,params_n_estimators,params_normalize_type,params_params_decision_threshold,params_params_feature_fraction,params_params_resampling,params_params_sample_rows,params_params_scale_pos_weight,params_rate_drop,params_sample_type,params_skip_drop,params_subsample,user_attrs_acc_test,user_attrs_acc_val,user_attrs_decision_threshold,user_attrs_f1_test,user_attrs_f1_val,user_attrs_feature_fraction,user_attrs_pr_auc_test,user_attrs_pr_auc_val,user_attrs_prec_test,user_attrs_prec_val,user_attrs_rec_test,user_attrs_rec_val,user_attrs_resampling_strategy,user_attrs_roc_auc_test,user_attrs_roc_auc_val,user_attrs_sample_rows,state
915,0.6657620985979195,2025-09-23 15:32:55.846066,2025-09-23 15:32:56.274701,0 days 00:00:00.428635,0.30791130873330785,gbtree,0.5563201630985932,2.3197152871593096,depthwise,17.310157461943184,0.009080394594282039,8,3,50.894927801700426,300,,0.5140339837350948,0.9797976819715084,oversample,0.974027331516358,0.5757841150125986,,,,0.3619541300313278,0.8505476507319071,0.8486895986895987,0.5140339837350948,0.6751223854027593,0.6657620985979195,0.9797976819715084,0.7732535979438987,0.7646080113076518,0.7036178107606679,0.7059952038369305,0.6488451668092386,0.629867351305092,oversample,0.9033829509215032,0.9003422846628866,0.974027331516358,COMPLETE
916,0.6763333333333333,2025-09-23 15:32:56.403346,2025-09-23 15:32:59.285971,0 days 00:00:02.882625,12.60940427886712,dart,0.36599766881562434,5.833327776320305,lossguide,9.975389933122708,0.15043297012318113,2,9,0.85056655966448,200,tree,0.6567256886449041,0.9563618215621784,undersample,0.8979575301466454,2.2057161781483754,0.11827431120225751,uniform,0.2496038529952908,0.32037152930133933,0.7924045449892517,0.8011875511875511,0.6567256886449041,0.6692759295499021,0.6763333333333333,0.9563618215621784,0.7791104623195133,0.7751496728161476,0.5408539799683711,0.5539175539175539,0.8776732249786142,0.8682071031236628,undersample,0.909166642779957,0.9089695084954164,0.8979575301466454,COMPLETE
917,0.5421254188606989,2025-09-23 15:32:59.414563,2025-09-23 15:33:00.130354,0 days 00:00:00.715791,0.0010155563087077069,gbtree,0.8146346524755028,9.55179163308515,depthwise,15.595713529717944,0.003362476417570007,7,4,0.43048404405625057,600,,0.46110726236011734,0.6512423527684965,oversample,0.9866121907548684,3.034015206674434,,,,0.4242317386358412,0.6086600470877265,0.6083128583128583,0.46110726236011734,0.5415517448135267,0.5421254188606989,0.6512423527684965,0.6438344552551322,0.6370138820074719,0.37627062156307284,0.37630835686991193,0.9657827202737382,0.9691912708600771,oversample,0.8665238874577968,0.8654623247037775,0.9866121907548684,COMPLETE
918,0.4182058047493404,2025-09-23 15:33:00.259446,2025-09-23 15:33:00.833255,0 days 00:00:00.573809,1.1069725434526936,gbtree,0.2735340835029181,5.904912457443526,lossguide,0.0003766888248980841,0.004040633955698435,2,4,2.450812468152152,400,,0.4847201079810275,0.6693672645119544,none,0.5819922365031076,0.9661269727943487,,,,0.654855220668067,0.8200429931415703,0.8194103194103194,0.4847201079810275,0.419035029742234,0.4182058047493404,0.6693672645119544,0.7741984796823321,0.7685199055304403,0.9215116279069767,0.9122302158273381,0.2711719418306245,0.2712879760376551,none,0.9047832301254806,0.9014889054612664,0.5819922365031076,COMPLETE
919,0.6368599675372584,2025-09-23 15:33:00.961866,2025-09-23 15:33:05.882374,0 days 00:00:04.920508,0.05841984593228486,gbtree,0.8564842010474578,5.911955652461218,lossguide,0.00011992615184313613,0.0005197121031774183,10,9,5.766357070397023,900,,0.36015274967322397,0.6243730730014738,oversample,0.8812997646956704,0.7248070066032113,,,,0.7369593323203272,0.7431671614290102,0.7480548730548731,0.36015274967322397,0.6343098673662732,0.6368599675372584,0.6243730730014738,0.7857641309209104,0.7689137912339719,0.48109661728940967,0.486036036036036,0.93071000855432,0.9234060761660248,oversample,0.9095747889422148,0.9035169199194276,0.8812997646956704,COMPLETE
920,0.0,2025-09-23 15:33:06.011451,2025-09-23 15:33:16.033460,0 days 00:00:10.022009,0.00014434182551521205,dart,0.9776487650145733,8.310053251558246,depthwise,0.0013509325903330108,0.00015069632209174956,10,11,6.456851559239831,400,forest,0.5364457567816584,0.9499099156636184,none,0.9399468413337813,0.5343886624620844,0.24448801355597233,uniform,0.18536834478474132,0.4505912995769438,0.7606715119254785,0.7607493857493858,0.5364457567816584,0.0,0.0,0.9499099156636184,0.7889988856534433,0.7843398286809193,0.0,0.0,0.0,0.0,none,0.9046139510586071,0.9044132275672458,0.9399468413337813,COMPLETE
921,0.6276595744680851,2025-09-23 15:33:16.162980,2025-09-23 15:34:21.645520,0 days 00:01:05.482540,8.869114080913485,dart,0.6000396333582354,3.748847822193798,lossguide,0.0018445850056264521,0.006604139337385882,2,12,0.9752870211038944,1000,tree,0.416684331891515,0.6412565753753225,none,0.5885496424853722,2.539596130439887,0.1890305003470958,uniform,0.3275111138403992,0.5675639981816127,0.7519705189886375,0.7563472563472563,0.416684331891515,0.6272881095216121,0.6276595744680851,0.6412565753753225,0.6855416158094628,0.6757594799453271,0.48979101609416287,0.49469790382244144,0.8721129170230967,0.8583654257595208,none,0.8755903902443686,0.8744202762980394,0.5885496424853722,COMPLETE
922,0.7001721170395869,2025-09-23 15:34:21.775174,2025-09-23 15:34:22.554367,0 days 00:00:00.779193,0.000663722248001677,gbtree,0.7984849293721767,8.370992162427447,depthwise,0.8825349025447145,0.02728779136916985,4,6,1.37028388208392,900,,0.4547568732247239,0.955037825425482,oversample,0.9477699940732094,0.9353983180993748,,,,0.2748750003162302,0.8154365851161839,0.8216625716625716,0.4547568732247239,0.6942513142275734,0.7001721170395869,0.955037825425482,0.819997804344189,0.8133711757063483,0.5751615622365833,0.5856608119781169,0.8755346449957229,0.8703465982028241,oversample,0.9237462844655,0.9228903055450035,0.9477699940732094,COMPLETE
923,0.6783495300302692,2025-09-23 15:34:22.684041,2025-09-23 15:34:29.324355,0 days 00:00:06.640314,0.004227359012684921,dart,0.8380333131308131,6.634683584340469,depthwise,0.004705401166737903,0.06462180933712834,4,5,17.496102909440737,300,tree,0.6127882655524888,0.9678695023506789,oversample,0.7943444963550579,2.980880857935492,0.14585472577995057,uniform,0.8696083268752679,0.9874102243935579,0.7873886784727199,0.7933046683046683,0.6127882655524888,0.672964887419304,0.6783495300302692,0.9678695023506789,0.8207888977184239,0.8137645886832389,0.5325193122352355,0.5403553299492386,0.9140290846877673,0.9109970047068892,oversample,0.9246813196376725,0.9229547120917952,0.7943444963550579,COMPLETE
924,0.6332035193999711,2025-09-23 15:34:29.455362,2025-09-23 15:34:32.702827,0 days 00:00:03.247465,0.31372460931698515,dart,0.5818749212606811,0.39069668489960296,depthwise,0.00777607064603805,0.006309494844248806,9,6,0.758048891144583,200,tree,0.4393314486684147,0.9985276808100296,oversample,0.8426669294900266,1.3609195687211908,0.20742607801846064,weighted,0.8291874895031633,0.683604458033368,0.73190705292251,0.7396601146601146,0.4393314486684147,0.6266571632216679,0.6332035193999711,0.9985276808100296,0.7900132111515382,0.782653991267084,0.46995937566816337,0.4775892080069626,0.9401197604790419,0.9392383397518186,oversample,0.9126454110637944,0.9104588055208473,0.8426669294900266,COMPLETE
925,0.503854455750848,2025-09-23 15:34:32.831192,2025-09-23 15:34:33.282304,0 days 00:00:00.451112,0.0005243121113713877,gbtree,0.4658777458134782,8.441962278442082,depthwise,0.024455069244234393,0.03709573573667957,10,10,2.745703733063207,400,,0.6504967275655623,0.5807108455707792,none,0.7856833249714381,0.8634653983329015,,,,0.22613030159636374,0.8370355205241069,0.8352784602784603,0.6504967275655623,0.5095502156500308,0.503854455750848,0.5807108455707792,0.7891476159484506,0.7800057124340186,0.9107929515418502,0.9017660044150111,0.35372112917023096,0.34959349593495936,none,0.9082353201204719,0.9037063678755692,0.7856833249714381,COMPLETE
926,0.6839622641509434,2025-09-23 15:34:33.409516,2025-09-23 15:34:34.394433,0 days 00:00:00.984917,0.30774995664602434,gbtree,0.40023092073688127,2.1105325517110254,depthwise,0.12767805926516448,0.11375381459107668,6,8,2.0655918977860477,800,,0.47040090711784616,0.7263783919593372,none,0.5075177197955498,1.2899723617461507,,,,0.263915479580305,0.8495240045040434,0.8490990990990991,0.47040090711784616,0.6854942233632862,0.6839622641509434,0.7263783919593372,0.7894985984148288,0.7836771982338766,0.6857876712328768,0.685431886549205,0.6852010265183918,0.6824989302524604,none,0.911094185123035,0.9073737405669746,0.5075177197955498,COMPLETE
927,0.6358312058867698,2025-09-23 15:34:34.525350,2025-09-23 15:34:35.278177,0 days 00:00:00.752827,0.2563307488069832,gbtree,0.2645342405875517,2.6221940105854236,lossguide,6.363356304193655,0.04556535885964242,1,11,5.6713041688452845,800,,0.4750798185541712,0.7809606470749648,undersample,0.8501982669995569,1.5602241338424057,,,,0.499872220748265,0.7520728836114239,0.7517403767403767,0.4750798185541712,0.6368815592203898,0.6358312058867698,0.7809606470749648,0.7276593138946503,0.7241119930863219,0.4903047091412742,0.489819527996298,0.9084687767322498,0.905862216516902,undersample,0.8922574137727197,0.8924354525189007,0.8501982669995569,COMPLETE
928,0.0,2025-09-23 15:34:35.406554,2025-09-23 15:35:27.213779,0 days 00:00:51.807225,1.677039504163179,dart,0.3425477837022045,4.29118936625822,depthwise,0.00013315432701414658,0.00015959682057791778,7,10,9.72426854544369,900,tree,0.6621886587878004,0.8510878690118628,oversample,0.5838278313399085,1.5443098749071968,0.306851787315882,weighted,0.1503405518178652,0.7245397572274579,0.7606715119254785,0.7607493857493858,0.6621886587878004,0.0,0.0,0.8510878690118628,0.7514610811457619,0.7441967998604573,0.0,0.0,0.0,0.0,oversample,0.8989803713410597,0.8987890705458698,0.5838278313399085,COMPLETE
929,0.5338862559241706,2025-09-23 15:35:27.343194,2025-09-23 15:35:28.262365,0 days 00:00:00.919171,0.0383248615857844,gbtree,0.5965632724134584,6.549017170604606,lossguide,2.4655339804727197,0.0033514491290609176,10,5,29.12105245129258,500,,0.37770214301764493,0.6133755236667853,none,0.5422157558083913,3.8647556745219225,,,,0.6171879019443212,0.6027228989661173,0.5972563472563472,0.37770214301764493,0.5379211810929873,0.5338862559241706,0.6133755236667853,0.6401515279634904,0.6290766755843615,0.372710773799703,0.369162706865476,0.9662104362703166,0.9640564826700898,none,0.859171846053553,0.8543492730467326,0.5422157558083913,COMPLETE
930,0.6380602498163115,2025-09-23 15:35:28.390637,2025-09-23 15:35:53.038699,0 days 00:00:24.648062,2.3535090483161873,dart,0.2713416240991142,5.776933861260529,depthwise,0.0005783639558809344,0.003735720575864547,5,8,0.43434594754154615,600,tree,0.5675044464767653,0.5202504778688344,oversample,0.5523502127087698,1.9611242387240004,0.33823918059730185,uniform,0.7761114508229311,0.9261957305094555,0.7431671614290102,0.7478501228501229,0.5675044464767653,0.6353727655863973,0.6380602498163115,0.5202504778688344,0.759920497704388,0.7495682903316827,0.4811798371120405,0.48589973142345566,0.9349871685201027,0.9289687633718442,oversample,0.9040433177131522,0.9026383478249502,0.5523502127087698,COMPLETE
931,0.7024446142093201,2025-09-23 15:35:53.168233,2025-09-23 15:35:53.841529,0 days 00:00:00.673296,0.3495110434417349,gbtree,0.5188019857075468,1.6640500110735146,depthwise,15.496753485713116,0.05107400174189353,6,11,5.0939190758055695,800,,0.44526655078162686,0.8028211150822697,undersample,0.896740899848123,0.5562957454867566,,,,0.7890809518179809,0.8355000511823114,0.8404995904995906,0.44526655078162686,0.6960469075089843,0.7024446142093201,0.8028211150822697,0.8078649572868865,0.8041054120445824,0.6239403187521194,0.6343566747154191,0.7869974337040205,0.7869062901155327,undersample,0.9168746537146597,0.9167691499493241,0.896740899848123,COMPLETE
932,0.6456531300395837,2025-09-23 15:35:53.975505,2025-09-23 15:37:00.782721,0 days 00:01:06.807216,0.038865126596377655,dart,0.9206645503831319,8.433491973256517,depthwise,0.00011057284859700298,0.011824825697600827,8,5,1.7424157971251057,1000,forest,0.42681272043473206,0.5932143466463544,oversample,0.7544117929263409,1.907284936005281,0.11016770437848772,weighted,0.5454104530671974,0.7478110457108043,0.7503326850240557,0.7525593775593775,0.42681272043473206,0.643785599532642,0.6456531300395837,0.5932143466463544,0.8121090936218691,0.806823078994048,0.4888001774229319,0.4910793933987511,0.9426860564585116,0.9422336328626444,oversample,0.9202703365401383,0.9191462323436952,0.7544117929263409,COMPLETE
933,0.6271416915964101,2025-09-23 15:37:00.912950,2025-09-23 15:37:02.727228,0 days 00:00:01.814278,0.0356471068373764,gbtree,0.9523013295300835,0.726775604524037,depthwise,0.003560110282149419,0.004335079236737094,6,10,6.1168748459150395,700,,0.4767744430222519,0.8480577269832867,none,0.94198320362413,0.5718707247198431,,,,0.8879520105423528,0.8646739686764254,0.8596437346437347,0.4767744430222519,0.6442411194833154,0.6271416915964101,0.8480577269832867,0.8170945964891239,0.8112323550631044,0.8686502177068215,0.8604477611940299,0.5119760479041916,0.4933675652545999,none,0.9215416562917765,0.9196101782958631,0.94198320362413,COMPLETE
934,0.4851736797514826,2025-09-23 15:37:02.858095,2025-09-23 15:37:03.674606,0 days 00:00:00.816511,0.0013578924113056329,gbtree,0.6404521930410758,5.72912944844223,depthwise,2.0144200689947094,0.0003574307929738952,9,4,26.93428624448009,800,,0.43685392883158225,0.7436633680380846,none,0.678770087758639,1.8782137425113854,,,,0.21750456036543203,0.8163578667212611,0.8133701883701884,0.43685392883158225,0.4977603583426652,0.4851736797514826,0.7436633680380846,0.6732664853085771,0.6619013626816542,0.720421393841167,0.7134551495016611,0.38023952095808383,0.3675652545999144,none,0.8659529087623241,0.8678022372939875,0.678770087758639,COMPLETE
935,0.6357443107696767,2025-09-23 15:37:03.803493,2025-09-23 15:37:04.522184,0 days 00:00:00.718691,0.0015767531966394443,gbtree,0.2268706161003621,6.855651053311909,lossguide,0.4095689095708154,0.009562411677678488,10,3,2.669072967238165,900,,0.4532672749605184,0.8120100716913732,undersample,0.6590910413071853,1.760738841238615,,,,0.3057865224894067,0.7378442010441192,0.7427313677313677,0.4532672749605184,0.6326208578396213,0.6357443107696767,0.8120100716913732,0.7896717121907713,0.7861991953520938,0.47593352039715087,0.48071021481806225,0.9431137724550899,0.938382541720154,undersample,0.9129272166780114,0.9129711790924084,0.6590910413071853,COMPLETE
936,0.0,2025-09-23 15:37:04.651965,2025-09-23 15:37:07.664143,0 days 00:00:03.012178,23.166775820682357,dart,0.3056786903235065,6.200200497467062,depthwise,0.0019026694950199316,0.0010639839321832452,5,12,65.56321600102399,200,forest,0.6926545580355077,0.892644979559955,oversample,0.5632247198621017,0.7613816308382763,0.22250622005178927,uniform,0.8400512425278105,0.315983614363989,0.7606715119254785,0.7607493857493858,0.6926545580355077,0.0,0.0,0.892644979559955,0.6989280769636637,0.6955510534562799,0.0,0.0,0.0,0.0,oversample,0.8686654316950043,0.8655366355206165,0.5632247198621017,COMPLETE
937,0.47546691991136436,2025-09-23 15:37:07.793687,2025-09-23 15:38:11.526001,0 days 00:01:03.732314,49.98797545814534,dart,0.2342716126355657,2.345015226250573,depthwise,2.4851724856457835,0.0492968495970812,10,4,0.4355189168756011,1000,forest,0.5842778629550516,0.9123198435723413,none,0.948537544746277,0.6570512561392602,0.2175148265422226,uniform,0.7044055136081763,0.9984477010549897,0.8349882280683796,0.8303644553644554,0.5842778629550516,0.49403640929064657,0.47546691991136436,0.9123198435723413,0.7920151824742137,0.7869205527857128,0.9280660377358491,0.9136253041362531,0.3366124893071001,0.32135216089002994,none,0.9105861464682378,0.9096339295415987,0.948537544746277,COMPLETE
938,0.0,2025-09-23 15:38:11.654234,2025-09-23 15:38:14.342253,0 days 00:00:02.688019,0.21238408684568838,gbtree,0.6634395908405548,4.9914633902910275,lossguide,0.0020497532869639713,0.0002582725085015292,1,9,2.043645145539758,800,,0.45387814272512045,0.7891282004634697,none,0.9722236263762776,0.8939571236592156,,,,0.63913661255783,0.7606715119254785,0.7607493857493858,0.45387814272512045,0.0,0.0,0.7891282004634697,0.732309035959081,0.7272179988883758,0.0,0.0,0.0,0.0,none,0.8954904942983286,0.8957112610456364,0.9722236263762776,COMPLETE
939,0.6206797235023042,2025-09-23 15:38:14.471818,2025-09-23 15:38:16.071920,0 days 00:00:01.600102,0.00046522869286812625,gbtree,0.8572632508566158,8.13755983189818,lossguide,20.523719095367326,0.004111922096640908,8,9,10.864960029861052,900,,0.38163778689095573,0.7804721418115068,undersample,0.660143945313098,1.3533459295386476,,,,0.8245311923046885,0.7256628109325417,0.7303439803439803,0.38163778689095573,0.6174707393662575,0.6206797235023042,0.7804721418115068,0.7238023755436632,0.7163387870955986,0.4633676092544987,0.46776644237030607,0.9251497005988024,0.922122379118528,undersample,0.8895333216144562,0.8907409010133278,0.660143945313098,COMPLETE
940,0.6761381982563771,2025-09-23 15:38:16.201226,2025-09-23 15:38:22.213837,0 days 00:00:06.012611,0.19272822484368496,gbtree,0.40804324606726783,0.7535418186212173,lossguide,0.42091414064714594,0.014957829684983066,4,11,0.11327683092953804,900,,0.3998132824853553,0.7206405953028413,undersample,0.942693047250367,1.048255576831778,,,,0.4664441940611628,0.7897430647968062,0.7946355446355446,0.3998132824853553,0.6725127551020408,0.6761381982563771,0.7206405953028413,0.8000876743616959,0.7888273731520956,0.5360955770208439,0.5429089966295048,0.9020530367835757,0.8960205391527599,undersample,0.9169547461395338,0.9134513058578517,0.942693047250367,COMPLETE
941,0.5820928682514996,2025-09-23 15:38:22.343348,2025-09-23 15:38:50.390807,0 days 00:00:28.047459,0.01717767007653583,dart,0.6366610363532785,1.0047165113179812,lossguide,0.026406511643638646,0.01747871316200077,0,9,0.10521281545280048,600,forest,0.4118493354027676,0.5161516285199761,none,0.9158331071476353,1.0321025870686706,0.3224944974730251,uniform,0.571262113016575,0.6789388171464663,0.8072474152932746,0.8074324324324325,0.4118493354027676,0.5847850055126792,0.5820928682514996,0.5161516285199761,0.6532442217604074,0.6528572914704636,0.6035502958579881,0.6053604436229205,0.5671514114627887,0.5605477107402653,none,0.8493158731271524,0.8480021618948527,0.9158331071476353,COMPLETE
942,0.682347670250896,2025-09-23 15:38:50.520159,2025-09-23 15:38:51.101451,0 days 00:00:00.581292,0.002111458580099678,gbtree,0.4259961082826975,5.78376046413368,depthwise,0.0008108324936836281,0.1320931476516158,6,3,76.5787312470807,1000,,0.5859924546057775,0.5078065049706727,oversample,0.7961528859392968,0.5706531523217857,,,,0.47100928927101493,0.8538233186610708,0.8548321048321048,0.5859924546057775,0.6861538461538461,0.682347670250896,0.5078065049706727,0.7826969010359938,0.7787041157994425,0.7056962025316456,0.7160319699106723,0.6676646706586826,0.6516902011125374,oversample,0.9104168961805325,0.9088815505157792,0.7961528859392968,COMPLETE
943,0.38612143742255267,2025-09-23 15:38:51.232649,2025-09-23 15:38:52.162950,0 days 00:00:00.930301,39.07714897904663,gbtree,0.9942134084322491,5.5569274175497085,lossguide,0.5303076526782852,0.0006755798837597257,4,11,1.5304474499652452,400,,0.44173963155336055,0.5297075587671,oversample,0.706624467967079,2.031428774858777,,,,0.5603125143057719,0.23932848807452145,0.23925061425061425,0.44173963155336055,0.3862228462872718,0.38612143742255267,0.5297075587671,0.6498978971524938,0.6500870724255096,0.23932848807452145,0.23925061425061425,1.0,1.0,oversample,0.869330115361871,0.8715234212665522,0.706624467967079,COMPLETE
944,0.3928721526435236,2025-09-23 15:38:52.291461,2025-09-23 15:39:04.242241,0 days 00:00:11.950780,0.007625092444094526,dart,0.738909633515259,3.733607480293988,lossguide,0.11136859423139743,0.0010272302736723164,2,8,1.4134925878667939,400,forest,0.375206832864594,0.502873697124044,undersample,0.9330827106619148,1.2201318623192372,0.17983498314696034,uniform,0.3097825457464609,0.6702175085831683,0.26010850650015355,0.26054463554463553,0.375206832864594,0.39280913978494625,0.3928721526435236,0.502873697124044,0.6977354306034623,0.6932258496280721,0.24440727576834623,0.2444560669456067,1.0,1.0,undersample,0.8768157496645212,0.8774479310354161,0.9330827106619148,COMPLETE
945,0.5249857712009106,2025-09-23 15:39:04.373591,2025-09-23 15:40:09.706134,0 days 00:01:05.332543,0.0006823122685084349,dart,0.45707019124687326,9.925719774482015,depthwise,0.002167047961606304,0.0013344410381199209,8,7,0.5374146298106505,1000,tree,0.5555971588915418,0.5828860578367326,oversample,0.5808978416070477,4.342271323611843,0.29385851198892016,uniform,0.6353415975741931,0.6180610698953766,0.5636196130617259,0.5727886977886978,0.5555971588915418,0.5197701926326461,0.5249857712009106,0.5828860578367326,0.7431098742075846,0.7345102159179508,0.35280623948615997,0.3576302729528536,0.9867408041060736,0.9867351305091998,oversample,0.8957476937238046,0.8931057470275529,0.5808978416070477,COMPLETE
946,0.6420849992595883,2025-09-23 15:40:09.834063,2025-09-23 15:40:10.445865,0 days 00:00:00.611802,0.005772211428523425,gbtree,0.5341981760892912,7.420140579783149,depthwise,85.39498632654447,0.023301699181058764,4,6,0.6881998432686276,400,,0.3576391059306604,0.5464917754629142,oversample,0.9041079126049334,1.158969768731446,,,,0.470267483923137,0.7469546524721057,0.7525593775593775,0.3576391059306604,0.6387021338789828,0.6420849992595883,0.5464917754629142,0.7850747292866103,0.7777070963384874,0.48512433392539966,0.49094202898550726,0.9345594525235243,0.9276850663243474,oversample,0.9105374808949492,0.9083832851162373,0.9041079126049334,COMPLETE
