number,value,datetime_start,datetime_complete,duration,params_alpha,params_booster,params_colsample_bytree,params_gamma,params_grow_policy,params_lambda,params_learning_rate,params_max_delta_step,params_max_depth,params_min_child_weight,params_n_estimators,params_normalize_type,params_params_decision_threshold,params_params_feature_fraction,params_params_resampling,params_params_sample_rows,params_params_scale_pos_weight,params_rate_drop,params_sample_type,params_skip_drop,params_subsample,user_attrs_acc_test,user_attrs_acc_val,user_attrs_decision_threshold,user_attrs_f1_test,user_attrs_f1_val,user_attrs_feature_fraction,user_attrs_pr_auc_test,user_attrs_pr_auc_val,user_attrs_prec_test,user_attrs_prec_val,user_attrs_rec_test,user_attrs_rec_val,user_attrs_resampling_strategy,user_attrs_roc_auc_test,user_attrs_roc_auc_val,user_attrs_sample_rows,state
1957,0.7208080808080808,2025-09-23 23:02:13.206407,2025-09-23 23:02:23.041859,0 days 00:00:09.835452,0.00017696001241327688,dart,0.6202326127167939,0.5314689953013003,lossguide,0.004666370731858986,0.0928865127949264,0,10,1.3311404340411488,300,forest,0.6505647303173256,0.9957888725866473,none,0.9103896166365972,4.264118930628308,0.12776508608412898,weighted,0.5767804846094071,0.987537947153121,0.8570989865902344,0.8585176085176085,0.6505647303173256,0.7188884414015304,0.7208080808080808,0.9957888725866473,0.8228038175758989,0.8181710267737776,0.6792237442922374,0.6827401454267126,0.7634730538922155,0.7633718442447582,none,0.923940658966973,0.9228101788486596,0.9103896166365972,COMPLETE
1958,0.6603737237526488,2025-09-23 23:02:23.184012,2025-09-23 23:03:17.937400,0 days 00:00:54.753388,0.012117222631160616,dart,0.3900730577784455,0.7360833497381579,lossguide,0.0006711346951522112,0.20978957739489695,6,5,0.37466982434755913,900,forest,0.4941080392912105,0.9527153139495862,none,0.9110383148237923,2.1077805664031266,0.11808431507851257,weighted,0.5937890267647895,0.21055967490757982,0.8157436789845429,0.8195126945126945,0.4941080392912105,0.6580547112462006,0.6603737237526488,0.9527153139495862,0.7264751721627918,0.7195219251625619,0.5919343814080656,0.6005606166783461,0.7408041060735672,0.7334189131364998,none,0.8868868180934399,0.8898982894807381,0.9110383148237923,COMPLETE
1959,0.7187563093074905,2025-09-23 23:03:18.079359,2025-09-23 23:03:18.981795,0 days 00:00:00.902436,0.029794200901773756,gbtree,0.7629047348538165,4.389843685848268,lossguide,0.05471583311616839,0.07010336871440177,9,8,0.31836472950855405,200,,0.45580563584152645,0.9688562981353486,none,0.8955581205137572,1.480783810497473,,,,0.6274089231350907,0.8604770191421844,0.8573914823914824,0.45580563584152645,0.727998403512273,0.7187563093074905,0.9688562981353486,0.8280103933416547,0.8223656829569744,0.6823793490460157,0.6804281345565749,0.7801539777587682,0.7616602481814292,none,0.9280010542384866,0.9255065299946499,0.8955581205137572,COMPLETE
1960,0.700712176480806,2025-09-23 23:03:19.121261,2025-09-23 23:03:35.521415,0 days 00:00:16.400154,0.00025172878914171687,dart,0.6923975414700851,3.3057725371135924,lossguide,0.015671781966214243,0.03984301812360019,5,11,0.21456831891048683,400,forest,0.6553678040564708,0.9137812726549955,oversample,0.971282150772234,4.800597971910402,0.12975484970584492,weighted,0.6747915805376313,0.8521741380685132,0.8185075237997748,0.8236076986076986,0.6553678040564708,0.6944683784249526,0.700712176480806,0.9137812726549955,0.8229245155462689,0.817455479090925,0.5815295815295816,0.589766081871345,0.8618477331052181,0.8630723149336756,oversample,0.9237425719528127,0.9225490976835697,0.971282150772234,COMPLETE
1961,0.6730678419644263,2025-09-23 23:03:35.664210,2025-09-23 23:03:53.622880,0 days 00:00:17.958670,0.00038087630427784325,dart,0.6938942763226581,2.128608252275015,depthwise,0.00038777278332577495,0.11427067963799936,5,12,5.922995371884155,500,forest,0.5200105541499036,0.911290936438762,undersample,0.9477096990795177,1.8026027059803231,0.1491181818285247,weighted,0.5704899414489772,0.6223337909470626,0.7771522161940834,0.7873669123669124,0.5200105541499036,0.6622187742435997,0.6730678419644263,0.911290936438762,0.8099894467420965,0.8034266240434031,0.5196006817628439,0.5323705179282868,0.9127459366980325,0.9148480958493795,undersample,0.9185323625774577,0.918062117854249,0.9477096990795177,COMPLETE
1962,0.7044179523141655,2025-09-23 23:03:53.761772,2025-09-23 23:04:01.402323,0 days 00:00:07.640551,0.0829845037238651,dart,0.9881466028952394,8.469141653796438,lossguide,2.949702531364839,0.2822926954475753,10,11,1.6130944946596113,300,forest,0.6461871582723113,0.9816654493329379,oversample,0.9559270319237576,2.0547685767528,0.16505329163784502,weighted,0.6526049029104224,0.7089632783254364,0.8248541304125294,0.8273955773955773,0.6461871582723113,0.703414803258797,0.7044179523141655,0.9816654493329379,0.8233065034419786,0.8149712995871381,0.5913727776158554,0.5966735966735967,0.867835757057314,0.8596491228070176,oversample,0.9257098007687261,0.9234438217998395,0.9559270319237576,COMPLETE
1963,0.6953824948311509,2025-09-23 23:04:01.542966,2025-09-23 23:04:21.190505,0 days 00:00:19.647539,0.0001698691730998697,dart,0.6042725565367293,6.349863111769541,lossguide,0.0005460143267893026,0.4126887430586017,0,12,3.955286437822882,500,forest,0.6563655952885877,0.9469275344260358,oversample,0.7864451936049018,2.8573177949380266,0.10755477814000819,weighted,0.671194457134949,0.9308051292032145,0.8148223973794656,0.819000819000819,0.6563655952885877,0.6911388082636162,0.6953824948311509,0.9469275344260358,0.8203700428942657,0.8117294788515762,0.5751633986928104,0.582059417363715,0.8656971770744226,0.8635002139495079,oversample,0.9240393139552835,0.9203566262762474,0.7864451936049018,COMPLETE
1964,0.7199828473413379,2025-09-23 23:04:21.334647,2025-09-23 23:05:09.138296,0 days 00:00:47.803649,0.000879598371141776,dart,0.5746236016914135,3.35882027235198,depthwise,0.015585426567095684,0.011838154842632696,0,10,3.918979203477306,800,forest,0.6408311337188601,0.9259075670856151,none,0.8708515302602949,2.6645242082388174,0.13164221146181068,weighted,0.759103322674428,0.599079304362294,0.8679496366055891,0.8662981162981163,0.6408311337188601,0.7232947232947233,0.7199828473413379,0.9259075670856151,0.8259466429866051,0.819931710950867,0.725473321858864,0.7215298667812634,0.7211291702309667,0.7184424475823705,none,0.9269331456471104,0.9253712964004255,0.8708515302602949,COMPLETE
1965,0.6857142857142857,2025-09-23 23:05:09.277896,2025-09-23 23:05:43.805746,0 days 00:00:34.527850,0.0020885911351796516,dart,0.6412170141331611,3.8116248477325905,depthwise,0.0009244530310345494,0.3382868746242608,2,7,2.171153640612711,700,forest,0.5386552328481233,0.7570878608077788,none,0.9428999970891264,2.221210151864901,0.20406199157373345,weighted,0.5975790092368809,0.8509452969946218,0.8353976865595251,0.8344594594594594,0.5386552328481233,0.6902927580893683,0.6857142857142857,0.7570878608077788,0.7830331000886306,0.7710704147184222,0.6278906797477225,0.6282051282051282,0.7664670658682635,0.754813863928113,none,0.9084661002696148,0.9049963414662938,0.9428999970891264,COMPLETE
1966,0.6812858210814852,2025-09-23 23:05:43.949286,2025-09-23 23:06:02.368928,0 days 00:00:18.419642,0.00035577915680711235,dart,0.9581441208356227,9.163884163111025,depthwise,0.0010596809895225651,0.02309082992719978,1,11,0.14305571517689852,500,forest,0.6982939069326544,0.8631501469309869,none,0.928936574455029,1.8933332872955995,0.10141864794705074,weighted,0.6835899029594813,0.6170445669495106,0.8693827413245983,0.8690622440622441,0.6982939069326544,0.6846267918932278,0.6812858210814852,0.8631501469309869,0.8244030938847544,0.8179008135042152,0.8108899297423887,0.8156324582338902,0.5923866552609067,0.5849379546427044,none,0.9262315095283797,0.9244177800764897,0.928936574455029,COMPLETE
1967,0.6971535230984601,2025-09-23 23:06:02.513235,2025-09-23 23:06:22.082541,0 days 00:00:19.569306,0.005204032264594864,dart,0.5707021532446739,4.01220561298967,depthwise,0.0003428732001092795,0.006424676839655505,3,12,9.266123885728199,500,forest,0.6560878738842744,0.9028684014087334,none,0.9390161548344779,2.3714194141692873,0.174761204611111,weighted,0.7660185968930041,0.5729363929655866,0.8695874705701709,0.8671171171171171,0.6560878738842744,0.7064516129032258,0.6971535230984601,0.9028684014087334,0.8176726891083996,0.8093966616784063,0.7657342657342657,0.7665469471523858,0.655688622754491,0.6392811296534018,none,0.922504578477856,0.9196426550883446,0.9390161548344779,COMPLETE
1968,0.718925421010425,2025-09-23 23:06:22.223248,2025-09-23 23:06:58.568809,0 days 00:00:36.345561,0.00012196306256722419,dart,0.7559540420353702,4.136091961595,depthwise,0.0006828426825330555,0.025177278876165287,1,11,2.462227903314657,700,forest,0.5991123721225079,0.9759980977171311,none,0.819797704395604,2.7796047356229376,0.11311108459628894,weighted,0.6989298393782442,0.5408647443073515,0.8567918927218753,0.8564701064701065,0.5991123721225079,0.7214811865419072,0.718925421010425,0.9759980977171311,0.8245937038437293,0.8208865225758364,0.6748603351955307,0.6763485477178424,0.7750213857998289,0.7672229353872486,none,0.926654361845546,0.9258106832178535,0.819797704395604,COMPLETE
1969,0.6833834837846874,2025-09-23 23:06:58.709746,2025-09-23 23:07:00.849788,0 days 00:00:02.140042,0.0020036582789234323,gbtree,0.5725827793049896,1.5049702397047895,lossguide,0.00021019885566442558,0.09305347321096728,6,7,0.38270697113734176,900,,0.5251261663627342,0.865894065976844,undersample,0.8282287838722349,2.19898998686923,,,,0.47533138306541495,0.8023339133995291,0.8061015561015561,0.5251261663627342,0.6809846357178259,0.6833834837846874,0.865894065976844,0.789759240945668,0.7854136958703257,0.5547779273216689,0.5607681755829904,0.8815226689478186,0.8746255883611468,undersample,0.9137020957796042,0.9118145388580504,0.8282287838722349,COMPLETE
1970,0.6757164404223228,2025-09-23 23:07:00.991922,2025-09-23 23:07:05.349644,0 days 00:00:04.357722,0.00011809335846390642,dart,0.4225951435239431,2.680355206516669,lossguide,0.29058855688130353,0.08214103174738761,1,12,1.4612390401694997,200,forest,0.6662011303767504,0.971367977637759,none,0.9254162890966323,1.6973547978655723,0.49738126635799945,weighted,0.7990887535511069,0.7394924027957418,0.8699969290613164,0.8679361179361179,0.6662011303767504,0.6823411705852926,0.6757164404223228,0.971367977637759,0.824757106302489,0.8180813849710129,0.8216867469879519,0.8190127970749543,0.583404619332763,0.5750962772785623,none,0.9267378789914258,0.92448601589048,0.9254162890966323,COMPLETE
1971,0.6963797814207651,2025-09-23 23:07:05.490548,2025-09-23 23:07:13.429204,0 days 00:00:07.938656,0.03936588777792657,dart,0.38764646675254566,3.096835721943181,lossguide,0.00031716750794630853,0.034982785472918505,2,10,0.5383293554652068,300,forest,0.6209416927745164,0.9330070144437888,undersample,0.9347676657376258,1.9946897602082814,0.2916814929240701,weighted,0.7612800479395199,0.9919340319837969,0.8155389497389702,0.8179770679770679,0.6209416927745164,0.696223870532704,0.6963797814207651,0.9330070144437888,0.8256196666809774,0.8177840608415364,0.5745687256538675,0.5794259732878658,0.8832335329341318,0.8724860932819855,undersample,0.9272727398309097,0.9245742617849441,0.9347676657376258,COMPLETE
1972,0.6620830150241915,2025-09-23 23:07:13.570007,2025-09-23 23:07:27.380548,0 days 00:00:13.810541,0.004550486458031736,dart,0.4563551960895497,2.76653478752252,lossguide,0.0011455808104022232,0.033950875149129235,4,12,2.2460455073816954,400,forest,0.6890116812414663,0.8308042801314495,none,0.926543054163185,1.851833270269484,0.22134708199925537,weighted,0.7719720007492278,0.7114658927104771,0.8642645101852799,0.8641482391482391,0.6890116812414663,0.6622516556291391,0.6620830150241915,0.8308042801314495,0.8173756539194722,0.8133709717489761,0.818639798488665,0.8176100628930818,0.5560307955517536,0.5562687205819427,none,0.9236785383037489,0.9206670560426786,0.926543054163185,COMPLETE
1973,0.7206766080569775,2025-09-23 23:07:27.521504,2025-09-23 23:07:53.482574,0 days 00:00:25.961070,0.00011370090513175064,dart,0.701928601873933,4.510317098982254,depthwise,0.00042824290355793,0.10131386823003123,2,12,2.3857240371581923,600,forest,0.5450828572647137,0.9948074697119292,none,0.9907270159959751,1.4951991909141609,0.21270823319167487,weighted,0.6322671225431689,0.5726686096271157,0.8711229399119664,0.8715192465192465,0.5450828572647137,0.7210281409262131,0.7206766080569775,0.9948074697119292,0.8272178195231188,0.8210995520657667,0.7480459770114942,0.7509276437847866,0.6958939264328486,0.6927685066324347,none,0.927420866209216,0.9252766587968029,0.9907270159959751,COMPLETE
1974,0.6904221516114389,2025-09-23 23:07:53.624866,2025-09-23 23:08:10.937877,0 days 00:00:17.313011,0.29111322987257976,dart,0.9920753482181388,9.175625667787871,depthwise,0.013803078884865335,0.405970267067438,4,12,20.412567809810387,500,forest,0.6981311824714265,0.7924339785107128,none,0.7547811945692706,3.0249985184450803,0.13545626521245874,weighted,0.7866501484580729,0.5755547527730255,0.8618077592384072,0.8603603603603603,0.6981311824714265,0.6973094170403588,0.6904221516114389,0.7924339785107128,0.8005025553038888,0.7911347124313388,0.732799245994345,0.7351377477042049,0.665098374679213,0.6508344030808729,none,0.9111173811325386,0.9097743168112258,0.7547811945692706,COMPLETE
1975,0.7166903265057798,2025-09-23 23:08:11.078496,2025-09-23 23:08:14.519768,0 days 00:00:03.441272,0.3959073339372926,dart,0.958276689423957,5.285838208090506,depthwise,0.012926369708000339,0.21386680973875197,4,7,0.15741896301106229,200,forest,0.4020137127542578,0.7817435510055096,none,0.8968081066186612,1.1847836862356564,0.10503981593690206,weighted,0.6598006160917069,0.6120130237094143,0.8557682464940116,0.8569819819819819,0.4020137127542578,0.7163277632373666,0.7166903265057798,0.7817435510055096,0.8241008437811757,0.8193515521122328,0.6766831494864968,0.6811873554356207,0.760906757912746,0.7560975609756098,none,0.9263542239012372,0.9243584984136181,0.8968081066186612,COMPLETE
1976,0.6675027433767048,2025-09-23 23:08:14.658524,2025-09-23 23:08:41.962593,0 days 00:00:27.304069,0.0007164955025876995,dart,0.6958909354938134,0.9548565543009175,depthwise,0.0016567801025994912,0.118340338576842,1,11,18.58631482218357,600,forest,0.6367792217975455,0.962564011563177,undersample,0.9841814204177197,4.813502270530158,0.14347905131051147,weighted,0.8866202553426666,0.7492491939401132,0.7808373426143924,0.7828624078624079,0.6367792217975455,0.6668741247860588,0.6675027433767048,0.962564011563177,0.8004332638196473,0.7929485452260078,0.5240890193201272,0.5267194458189015,0.916595380667237,0.9109970047068892,undersample,0.9176594904084212,0.914632476435467,0.9841814204177197,COMPLETE
1977,0.7105606258148631,2025-09-23 23:08:42.103800,2025-09-23 23:08:45.549416,0 days 00:00:03.445616,5.370508191456334,dart,0.9477678841034788,5.592099389409777,lossguide,0.010508044604748044,0.05875403678247844,7,8,1.9177657714360608,200,forest,0.3572140794880444,0.9482063946126529,none,0.9729324653019245,0.7834878250051349,0.17453268153593648,weighted,0.5070966767416684,0.5320970236109938,0.8628314054662709,0.8636363636363636,0.3572140794880444,0.7103329009943796,0.7105606258148631,0.9482063946126529,0.8172761157399964,0.8097894951395499,0.7180944055944056,0.7218543046357616,0.7027373823781009,0.699614890885751,none,0.9215768532143855,0.919908717179941,0.9729324653019245,COMPLETE
1978,0.7195121951219512,2025-09-23 23:08:45.694427,2025-09-23 23:09:12.666707,0 days 00:00:26.972280,0.00045350011681459523,dart,0.7579699700268286,3.0694405864315764,depthwise,0.0003281244319202794,0.10785646472525072,4,11,0.8830172498040635,600,forest,0.6502476485255655,0.9368331252198715,none,0.991644316326912,4.400401552581345,0.17034474593606988,weighted,0.6444865282342211,0.6506969035823664,0.853618589415498,0.854013104013104,0.6502476485255655,0.7201565557729941,0.7195121951219512,0.9368331252198715,0.8264507351846915,0.8187370137206171,0.6637806637806638,0.6658172551874773,0.7869974337040205,0.7826272999572101,none,0.9261842253551609,0.9234769320049404,0.991644316326912,COMPLETE
1979,0.68168024277272,2025-09-23 23:09:12.805526,2025-09-23 23:10:00.121262,0 days 00:00:47.315736,0.0001997134428794873,dart,0.32721002597075355,3.0167767045271865,lossguide,0.00034291976276671217,0.013572131872230542,6,9,0.12367860729753047,800,forest,0.4156665302415622,0.9212276163687485,undersample,0.9970373062623672,1.1708121051300682,0.0882083617316311,weighted,0.7740719326510034,0.5506042319901128,0.7907667110246699,0.795966420966421,0.4156665302415622,0.677602523659306,0.68168024277272,0.9212276163687485,0.823151175184409,0.8179690169881793,0.5367316341829086,0.5438328236493374,0.9187339606501284,0.9131364997860505,undersample,0.9263220775704488,0.924938589206983,0.9970373062623672,COMPLETE
1980,0.7193297426690605,2025-09-23 23:10:00.269794,2025-09-23 23:10:34.210609,0 days 00:00:33.940815,0.00026265930500662547,dart,0.24610526864161736,3.8811778040342926,lossguide,0.0001839213085838851,0.030165168294412608,8,7,0.1587248281022248,700,forest,0.3049698452019955,0.9316193780150398,none,0.9877993445187421,0.8088740838192362,0.2495749594411679,weighted,0.7323591370378633,0.8806614622160301,0.8594533729143208,0.855958230958231,0.3049698452019955,0.7264395297868101,0.7193297426690605,0.9316193780150398,0.8266863573396569,0.8223860233369399,0.6799701603879149,0.6737668161434978,0.77972626176219,0.7715019255455713,none,0.9266730395256548,0.9256798835119644,0.9877993445187421,COMPLETE
1981,0.6961394769613948,2025-09-23 23:10:34.351695,2025-09-23 23:10:35.082623,0 days 00:00:00.730928,0.00028161817592242206,gbtree,0.8294852334684588,9.53831759138155,lossguide,68.8619919234152,0.13762316436313124,0,12,0.14635712775891313,500,,0.6591173283113368,0.9032325139899983,none,0.8049930276671146,3.1426891949933764,,,,0.2057954401740757,0.8486027228989661,0.8501228501228502,0.6591173283113368,0.6967397990567972,0.6961394769613948,0.9032325139899983,0.7950355244143694,0.7918040129488928,0.6691610870421426,0.6759371221281741,0.7266894781864842,0.7175866495507061,none,0.9133581271622507,0.9139072765693128,0.8049930276671146,COMPLETE
1982,0.7206375838926175,2025-09-23 23:10:35.223880,2025-09-23 23:10:53.394375,0 days 00:00:18.170495,0.004214536174819319,dart,0.631104579292878,6.426727870651078,depthwise,0.00805077050805704,0.12321412399319949,3,12,0.401410866394468,500,forest,0.6521996593238156,0.9729322336339709,none,0.9924798439140446,2.9572422611810754,0.21011387346123028,weighted,0.8953563534938402,0.42989459086146176,0.8659023441498618,0.8636363636363636,0.6521996593238156,0.7253668763102725,0.7206375838926175,0.9729322336339709,0.8263731653233548,0.8185416733860946,0.7113486842105263,0.7067050596462361,0.7399486740804107,0.7351305091998288,none,0.9272220597158529,0.9243448512508201,0.9924798439140446,COMPLETE
1983,0.6597543467857713,2025-09-23 23:10:53.536222,2025-09-23 23:10:54.265734,0 days 00:00:00.729512,0.002944144113716279,gbtree,0.5840357727287282,3.675004635829536,depthwise,0.000945874542563737,0.4904913887803012,1,6,0.1453956544987373,600,,0.3585113495980533,0.9322548453879522,oversample,0.9524943957099683,0.9086140050827223,,,,0.9077461583053932,0.7755143822295015,0.7816339066339066,0.3585113495980533,0.6540463795551349,0.6597543467857713,0.9322548453879522,0.740466609863027,0.7427130523638233,0.5181204698825294,0.525940996948118,0.886655260906758,0.8848951647411211,oversample,0.8992357001206077,0.8998678874024997,0.9524943957099683,COMPLETE
1984,0.0,2025-09-23 23:10:54.413527,2025-09-23 23:11:22.214193,0 days 00:00:27.800666,0.039005625024758184,dart,0.8928802698670711,7.063545329492538,depthwise,0.0048777009066257706,0.00014173565742632801,5,12,0.32852543850263544,600,forest,0.6715901767540667,0.8877359614707099,none,0.8971847480727103,2.707932097204938,0.1109312603932011,weighted,0.6118705848932363,0.5148303388928992,0.7606715119254785,0.7607493857493858,0.6715901767540667,0.0,0.0,0.8877359614707099,0.807381713942367,0.7982425262215744,0.0,0.0,0.0,0.0,none,0.9171811230759543,0.9148461956115216,0.8971847480727103,COMPLETE
1985,0.6819446717957113,2025-09-23 23:11:22.354782,2025-09-23 23:12:30.159133,0 days 00:01:07.804351,0.00037912714037434224,dart,0.849736379464117,8.263139688756322,depthwise,0.0011107312065696858,0.2174912638048744,6,11,1.290035134480711,1000,forest,0.6854669091462519,0.8083485123876784,undersample,0.9298685804193912,3.078778515838702,0.20357098256867961,weighted,0.77515722204456,0.5174706357521875,0.7964991299007064,0.801085176085176,0.6854669091462519,0.6797680412371134,0.6819446717957113,0.8083485123876784,0.8103449540820444,0.8035103873458529,0.5452196382428941,0.5522269353128314,0.9024807527801539,0.8913136499786051,undersample,0.9210840962978593,0.9193853743989706,0.9298685804193912,COMPLETE
1986,0.7262502510544286,2025-09-23 23:12:30.300356,2025-09-23 23:13:22.406470,0 days 00:00:52.106114,0.006963747813038317,dart,0.2678376863168601,0.34020937852694977,lossguide,0.0004048572112499554,0.01749257223786083,7,9,0.2004427219796122,800,forest,0.4853621730669186,0.9642446082099634,none,0.9326574955929984,1.8345651936676872,0.0951215582745538,weighted,0.7218254110188831,0.3851072860154073,0.8576108097041663,0.8604627354627354,0.4853621730669186,0.723404255319149,0.7262502510544286,0.9642446082099634,0.8288057447139059,0.8239947100209148,0.6759568933481978,0.6843300529901589,0.7780153977758768,0.7736414206247325,none,0.9279288760848451,0.9265835329878702,0.9326574955929984,COMPLETE
