number,value,datetime_start,datetime_complete,duration,params_alpha,params_booster,params_colsample_bytree,params_gamma,params_grow_policy,params_lambda,params_learning_rate,params_max_delta_step,params_max_depth,params_min_child_weight,params_n_estimators,params_normalize_type,params_params_decision_threshold,params_params_feature_fraction,params_params_resampling,params_params_sample_rows,params_params_scale_pos_weight,params_rate_drop,params_sample_type,params_skip_drop,params_subsample,user_attrs_acc_test,user_attrs_acc_val,user_attrs_decision_threshold,user_attrs_f1_test,user_attrs_f1_val,user_attrs_feature_fraction,user_attrs_pr_auc_test,user_attrs_pr_auc_val,user_attrs_prec_test,user_attrs_prec_val,user_attrs_rec_test,user_attrs_rec_val,user_attrs_resampling_strategy,user_attrs_roc_auc_test,user_attrs_roc_auc_val,user_attrs_sample_rows,state
125,0.6800772449308015,2025-09-23 12:22:38.885518,2025-09-23 12:22:40.384839,0 days 00:00:01.499321,0.005210574670683218,gbtree,0.3526800033313232,5.0069209902056215,depthwise,0.005027432989570434,0.00925537405294365,5,12,8.873974816346273,900,,0.44690056502406816,0.8020134666797549,none,0.611186734616405,4.345586117727313,,,,0.45073641818793053,0.7869792199815744,0.7964782964782965,0.44690056502406816,0.6719218035629828,0.6800772449308015,0.8020134666797549,0.8137348940373476,0.807713572424519,0.5320848938826467,0.5450090275986588,0.9114627887082977,0.904150620453573,none,0.9213830542962751,0.9207943143961963,0.611186734616405,COMPLETE
126,0.7094879794457699,2025-09-23 12:22:40.506474,2025-09-23 12:22:41.173736,0 days 00:00:00.667262,1.257836458607131,gbtree,0.3424527090045747,8.339346694541026,depthwise,0.0005276237848977138,0.06691169654989497,6,12,2.484707966511283,900,,0.6514376950099807,0.941912723222279,oversample,0.5575689250882159,1.6056794466114859,,,,0.6146702299627471,0.8356024158050978,0.8379402129402129,0.6514376950099807,0.708106143220647,0.7094879794457699,0.941912723222279,0.8200277874519457,0.8158149782644883,0.6156763590391909,0.6211439588688946,0.8331907613344739,0.8271287976037656,oversample,0.9245927949165398,0.9236779829286085,0.5575689250882159,COMPLETE
127,0.64241836404785,2025-09-23 12:22:41.294199,2025-09-23 12:22:42.328639,0 days 00:00:01.034440,14.153550917188786,gbtree,0.45201966169172547,0.1466582097207081,depthwise,1.5893612209945556,0.008848055849044899,0,12,2.583428610199498,800,,0.46844430355523226,0.5698650757698831,undersample,0.7030186512663843,0.9124077321796782,,,,0.397965748865464,0.7623093458900604,0.7735462735462736,0.46844430355523226,0.6311944091486659,0.64241836404785,0.5698650757698831,0.6847297223619251,0.672879005185415,0.5020212228398181,0.51623798389192,0.8498716852010265,0.8502353444587077,undersample,0.8762372020478334,0.8769513643333531,0.7030186512663843,COMPLETE
128,0.6099472709134958,2025-09-23 12:22:42.448298,2025-09-23 12:22:43.081156,0 days 00:00:00.632858,2.0553901277006013,gbtree,0.6273248164687019,4.2450547935684995,depthwise,6.945567325649432,0.0022564414580056097,3,4,16.983245084930104,600,,0.46020418543260216,0.5309223916116466,oversample,0.5516266103329872,1.287910662304279,,,,0.9542715569688129,0.7155287132766915,0.7197993447993448,0.46020418543260216,0.6098553980064579,0.6099472709134958,0.5309223916116466,0.75647365310974,0.7478548241713425,0.45391849529780565,0.45726495726495725,0.9289991445680068,0.9157038938810441,oversample,0.8965529060685942,0.8929546205348801,0.5516266103329872,COMPLETE
129,0.6172499311104988,2025-09-23 12:22:43.201097,2025-09-23 12:22:44.001338,0 days 00:00:00.800241,4.3650912035525495,gbtree,0.748410175236621,6.327656411063102,lossguide,5.692866558086816,0.04410760724249419,5,10,0.27405874873470293,300,,0.4844376001213429,0.7277181947322023,oversample,0.8982561278693768,4.61409284593349,,,,0.2738236781306893,0.7121506807247415,0.7156019656019657,0.4844376001213429,0.615216201423098,0.6172499311104988,0.7277181947322023,0.8137619315031122,0.807174011102242,0.45231388329979877,0.45519203413940257,0.9615055603079555,0.9584937954642704,oversample,0.9209341280527935,0.9188829630259203,0.8982561278693768,COMPLETE
130,0.0,2025-09-23 12:22:44.120997,2025-09-23 12:23:21.142315,0 days 00:00:37.021318,0.5051585171086325,dart,0.8508653453208497,9.958300034113988,lossguide,8.007399641155509,0.00011299964187107858,8,7,6.830554671299298,900,forest,0.5158007700109792,0.8976264061120935,oversample,0.704763415759133,0.7202526335428748,0.42321308198943236,uniform,0.05235876213904026,0.931519109438308,0.7606715119254785,0.7607493857493858,0.5158007700109792,0.0,0.0,0.8976264061120935,0.6816622763192707,0.6729029580454314,0.0,0.0,0.0,0.0,oversample,0.8820580478123284,0.8829610968909979,0.704763415759133,COMPLETE
131,0.6037057522123894,2025-09-23 12:23:21.259558,2025-09-23 12:23:32.725583,0 days 00:00:11.466025,0.936898175129788,dart,0.20862221080455454,2.5934150798702547,depthwise,60.83063396282784,0.0012953281509008189,3,8,16.404925799888378,400,tree,0.5456700009455365,0.7076974787547635,oversample,0.5996140732120896,1.313924370023576,0.10420700710105418,uniform,0.835291595224064,0.255022278147075,0.700788207595455,0.7065929565929566,0.5456700009455365,0.5985441560225244,0.6037057522123894,0.7076974787547635,0.7035198125684747,0.696820291637992,0.44082540967024075,0.4459652706843718,0.9319931565440548,0.9341035515618314,oversample,0.8842995133212438,0.8833002317656774,0.5996140732120896,COMPLETE
132,0.6546681664791901,2025-09-23 12:23:32.848485,2025-09-23 12:23:54.980768,0 days 00:00:22.132283,0.30233023740578946,dart,0.7387667868325047,9.539204667037277,depthwise,0.02153296195414816,0.08578063415238062,3,12,30.150270713803643,600,tree,0.473752900488556,0.6687906876644358,none,0.7335542787741053,1.8809039392013756,0.45900220101957334,weighted,0.7193750775539036,0.7548733926364828,0.812672740300952,0.8114250614250614,0.473752900488556,0.6631075110456554,0.6546681664791901,0.6687906876644358,0.7227507825208859,0.7228331785733875,0.5820943762120233,0.5825825825825826,0.7703165098374679,0.7471116816431322,none,0.8900234020683474,0.889822366340868,0.7335542787741053,COMPLETE
133,0.6306896551724138,2025-09-23 12:23:55.129127,2025-09-23 12:23:57.139302,0 days 00:00:02.010175,0.0992587803894604,dart,0.749032848296864,5.882017770788353,depthwise,78.85334005295756,0.028848084277350326,6,4,16.41373143199552,200,forest,0.5449700996386937,0.7358465349378159,oversample,0.7446127496554688,0.854224221739585,0.46954785477476946,weighted,0.1162407571439022,0.3090338680781149,0.7825775412017607,0.7807125307125307,0.5449700996386937,0.6377899045020464,0.6306896551724138,0.7358465349378159,0.7025341962017131,0.6930919456750939,0.53034600113443,0.5281547790932717,0.7998289136013687,0.7826272999572101,oversample,0.8772563011700805,0.8699775201861404,0.7446127496554688,COMPLETE
134,0.38612143742255267,2025-09-23 12:23:57.257494,2025-09-23 12:23:58.163104,0 days 00:00:00.905610,3.4721112779906957,gbtree,0.9571324071261751,6.090793160357167,depthwise,0.0012842437150867411,0.00045432675531259314,1,11,2.481798433450295,600,,0.4730386572271459,0.603186505928812,undersample,0.547243639571192,2.2844099006203753,,,,0.26319699823705395,0.23932848807452145,0.23925061425061425,0.4730386572271459,0.3862228462872718,0.38612143742255267,0.603186505928812,0.6990436246707608,0.6899222767287319,0.23932848807452145,0.23925061425061425,1.0,1.0,undersample,0.8850903936403105,0.8835176938344826,0.547243639571192,COMPLETE
135,0.6676199555131872,2025-09-23 12:23:58.282412,2025-09-23 12:24:07.727731,0 days 00:00:09.445319,0.04037110727903944,dart,0.3073639579810438,1.247401878093637,lossguide,0.058958412122293476,0.4998467929652094,9,4,0.8463996660402684,400,forest,0.4360924937267782,0.5778812882867086,oversample,0.755200305449514,0.8656468879763178,0.22468458898053856,uniform,0.1355458753397031,0.9414419806642649,0.7786876855358787,0.7858312858312858,0.4360924937267782,0.6590980763166193,0.6676199555131872,0.5778812882867086,0.7853134892777578,0.7774143561119696,0.521978021978022,0.5309577963103361,0.8939264328485885,0.8990158322635858,oversample,0.909273154481164,0.90799206644936,0.755200305449514,COMPLETE
136,0.6991048886848749,2025-09-23 12:24:07.851374,2025-09-23 12:24:19.540822,0 days 00:00:11.689448,0.0005661493113925934,dart,0.9054614098178271,1.1251295769933845,lossguide,0.17594258754286862,0.0711944733863116,5,5,0.9706183021072543,400,tree,0.6466642299988583,0.9289892895005605,oversample,0.6528476896983394,0.6354215453929895,0.0688624228889878,uniform,0.5841626380117517,0.48601568595274236,0.8710205752891801,0.8657862407862408,0.6466642299988583,0.713506139154161,0.6991048886848749,0.9289892895005605,0.8229457621409074,0.8136355924005733,0.7616504854368932,0.753960396039604,0.6710863986313088,0.6516902011125374,oversample,0.9256169303932075,0.9224332119657171,0.6528476896983394,COMPLETE
137,0.38612143742255267,2025-09-23 12:24:19.659669,2025-09-23 12:24:20.123963,0 days 00:00:00.464294,60.60286315889575,gbtree,0.4380682998009441,8.672860771213566,lossguide,0.0039721700497470725,0.0004887999129047908,10,3,87.01464551354442,400,,0.43096456162107294,0.5615083795882472,oversample,0.6676517049047773,2.5258085422541985,,,,0.4941700927626287,0.23932848807452145,0.23925061425061425,0.43096456162107294,0.3862228462872718,0.38612143742255267,0.5615083795882472,0.5855503909242213,0.5803962178998764,0.23932848807452145,0.23925061425061425,1.0,1.0,oversample,0.8360479859244543,0.8340592817780377,0.6676517049047773,COMPLETE
138,0.5499283325370282,2025-09-23 12:24:20.241547,2025-09-23 12:24:20.682501,0 days 00:00:00.440954,60.85650583309789,gbtree,0.48508072201761676,7.014763244005944,lossguide,0.03691093783260579,0.08594930687889303,2,8,0.9613312212269421,400,,0.3487516702596531,0.7288423879648118,undersample,0.9999744851074583,4.2731334468794815,,,,0.8167520692821852,0.6108097041662401,0.6142506142506142,0.3487516702596531,0.5479191438763377,0.5499283325370282,0.7288423879648118,0.786711473637799,0.7809585643217711,0.3794466403162055,0.38144159072079536,0.9854576561163387,0.9850235344458708,undersample,0.91069349276532,0.9100096008078199,0.9999744851074583,COMPLETE
139,0.6240409207161125,2025-09-23 12:24:20.801111,2025-09-23 12:24:21.741617,0 days 00:00:00.940506,0.025348045040204333,gbtree,0.9756987750034796,2.814161142143904,depthwise,1.3929042437429526,0.05034253524961529,4,5,56.961299049744056,900,,0.4790713163839929,0.8596582841182171,undersample,0.9749571334735014,2.826056432282052,,,,0.4321813161271381,0.7173712764868462,0.7291154791154791,0.4790713163839929,0.6150843440680329,0.6240409207161125,0.8596582841182171,0.783357693851503,0.7784247399939854,0.4562564632885212,0.46713465220165923,0.9435414884516681,0.9396662387676509,undersample,0.9083521347638651,0.9060198210931815,0.9749571334735014,COMPLETE
140,0.5933155080213903,2025-09-23 12:24:21.866442,2025-09-23 12:24:22.788466,0 days 00:00:00.922024,0.009660966472765702,gbtree,0.39515023160903956,7.907728499829019,lossguide,0.0014596720598661487,0.0010370959739953646,8,9,38.38996241456913,500,,0.3148121062420067,0.9547913387407804,undersample,0.7892257740814688,0.5925936418361729,,,,0.8602420940392734,0.6834885863445593,0.6885749385749386,0.3148121062420067,0.590897062715004,0.5933155080213903,0.9547913387407804,0.7431604963462003,0.7367859391681832,0.42777777777777776,0.4314602372156329,0.9550898203592815,0.9495079161317929,undersample,0.8948955137766454,0.8928351358816906,0.7892257740814688,COMPLETE
141,0.6333333333333333,2025-09-23 12:24:22.908286,2025-09-23 12:24:23.873712,0 days 00:00:00.965426,0.005074536411261463,gbtree,0.7739885802892876,1.235937534812156,lossguide,0.28606227951993046,0.3062253160696739,4,12,16.08612333087277,900,,0.44909470057504264,0.8242341790244597,oversample,0.6659635673963433,4.312901938257797,,,,0.9761703549089977,0.7431671614290102,0.7522522522522522,0.44909470057504264,0.6258016405667413,0.6333333333333333,0.8242341790244597,0.727171077104137,0.7202918142944994,0.48042134188229907,0.49026507154585974,0.8973481608212147,0.8943089430894309,oversample,0.8865812408863568,0.8873023918178753,0.6659635673963433,COMPLETE
142,0.6566791510611736,2025-09-23 12:24:23.994389,2025-09-23 12:24:26.073416,0 days 00:00:02.079027,2.842034956587079,gbtree,0.3071102195090196,1.1645228109244143,lossguide,0.0030674587721583346,0.005666584188293544,6,6,1.9295074664714489,1000,,0.3679714648474235,0.7945067444926392,none,0.9834002987257768,2.9359065468435466,,,,0.21840603347655618,0.7695772341078924,0.7747747747747747,0.3679714648474235,0.6542773767470434,0.6566791510611736,0.7945067444926392,0.7987816776995726,0.794241435791315,0.5104241552839683,0.5168263325964136,0.9110350727117195,0.9002995293110826,none,0.9120533660172591,0.9119946583737983,0.9834002987257768,COMPLETE
143,0.58167694768106,2025-09-23 12:24:26.192364,2025-09-23 12:24:35.449705,0 days 00:00:09.257341,0.006411079958182826,dart,0.7277563985008342,9.897655068476245,depthwise,0.00017960867326686906,0.004407262820872856,8,4,3.0569545481114573,400,forest,0.6834343641450312,0.5679963449958039,oversample,0.6467561260432217,1.1095167856381265,0.24646087499852865,uniform,0.18438992360783776,0.8815150760706583,0.8178933360630566,0.8125511875511876,0.6834343641450312,0.6024581005586592,0.58167694768106,0.5679963449958039,0.6685470580181125,0.6541653359300739,0.6307908282639214,0.6240196078431373,0.5765611633875107,0.5447154471544715,oversample,0.8688302499908194,0.8640851129204832,0.6467561260432217,COMPLETE
144,0.6388155965992378,2025-09-23 12:24:35.569355,2025-09-23 12:24:35.892908,0 days 00:00:00.323553,0.002677713397428361,gbtree,0.6068079149525363,8.757651744100993,depthwise,0.0005038701082612795,0.16201261606114498,1,9,1.0297021235306685,200,,0.32231632500034124,0.6825217737283737,none,0.5673974819354735,4.0176374561612125,,,,0.9212853815253748,0.7463404647353874,0.7477477477477478,0.32231632500034124,0.6378251973107278,0.6388155965992378,0.6825217737283737,0.7948019815551999,0.7839940784404538,0.4844582593250444,0.4858416945373467,0.9332763045337895,0.9323919554985024,none,0.9139559856007462,0.9096717615498616,0.5673974819354735,COMPLETE
145,0.5884640311082308,2025-09-23 12:24:36.010240,2025-09-23 12:24:36.429425,0 days 00:00:00.419185,0.00014114769127401616,gbtree,0.7511192859092111,9.714355749376175,lossguide,0.17774527517084618,0.10566727929032564,5,7,2.2779535511487343,400,,0.31029511023324613,0.9398407712939665,undersample,0.7801868519070376,2.973876669561482,,,,0.532293840153018,0.6692599037772545,0.67495904995905,0.31029511023324613,0.5850776935918839,0.5884640311082308,0.9398407712939665,0.8055178825649223,0.7992557047707456,0.41805835933198754,0.4220899962811454,0.9743370402053037,0.9713307659392384,undersample,0.9173152339993867,0.9151253290362621,0.7801868519070376,COMPLETE
146,0.644593895499224,2025-09-23 12:24:36.546801,2025-09-23 12:25:00.742262,0 days 00:00:24.195461,4.693594693145992,dart,0.8531301709712509,4.139624956958795,lossguide,0.5993904460320755,0.1021594665771682,0,6,12.365199711854078,600,forest,0.4260606013781912,0.9780749170620096,none,0.7503793764609805,0.5876836011017852,0.1000853407752843,weighted,0.5606340480593902,0.8812462354267916,0.8620124884839799,0.8593366093366094,0.4260606013781912,0.6525773195876289,0.644593895499224,0.9780749170620096,0.8008406681895222,0.7935833282591,0.8210116731517509,0.8149117069980379,0.5414884516680923,0.5331621737270005,none,0.9120030888105558,0.9114221109488999,0.7503793764609805,COMPLETE
147,0.60018589828708,2025-09-23 12:25:00.859983,2025-09-23 12:25:30.598342,0 days 00:00:29.738359,26.8942402258788,dart,0.75260901906702,0.8568587472942246,lossguide,7.208650447531532,0.2415949949086405,1,12,0.2779791157176099,700,tree,0.4322899861978543,0.7229863303001803,undersample,0.6381345540060448,3.4076021232622495,0.300580291775017,weighted,0.17778590438949643,0.5943788831383197,0.6869689835192957,0.6917485667485668,0.4322899861978543,0.5962503300765778,0.60018589828708,0.7229863303001803,0.7903996753566467,0.7842793051491825,0.4312452253628724,0.43511744320369655,0.9657827202737382,0.9670517757809157,undersample,0.9127753202286817,0.9114488582363248,0.6381345540060448,COMPLETE
148,0.6474456246838645,2025-09-23 12:25:30.716956,2025-09-23 12:25:39.315011,0 days 00:00:08.598055,0.3615753672394016,dart,0.5313768400767132,7.738629651893243,depthwise,0.02715209645357722,0.051695778754417235,8,6,64.65296948975022,400,tree,0.5990305454598426,0.9460566674833846,none,0.5443789927097265,1.2807935216824757,0.4192542954038124,uniform,0.28492596992695757,0.7971982527005632,0.8601699252738254,0.8572891072891073,0.5990305454598426,0.65678391959799,0.6474456246838645,0.9460566674833846,0.7935447682807206,0.788240667684091,0.7959805115712546,0.7915893630179345,0.5590248075278016,0.5477107402652974,none,0.9119408682490835,0.9116207721795042,0.5443789927097265,COMPLETE
149,0.6049890350877193,2025-09-23 12:25:39.436849,2025-09-23 12:25:40.090353,0 days 00:00:00.653504,0.0030730057262425624,gbtree,0.26145476318199307,1.9996658590792427,lossguide,10.818706917192248,0.1538764267291552,10,7,24.9775377670679,500,,0.49720674169513146,0.6374221971071308,undersample,0.8968756248463267,3.491915423766463,,,,0.47354731853143445,0.6941345071143413,0.704954954954955,0.49720674169513146,0.5965433432352147,0.6049890350877193,0.6374221971071308,0.7037195811439352,0.6935595713396459,0.43587213891081295,0.4450494051220004,0.9448246364414029,0.9443731279418057,undersample,0.8889136197873588,0.8864177447205489,0.8968756248463267,COMPLETE
150,0.4939279957012359,2025-09-23 12:25:40.211080,2025-09-23 12:25:40.721607,0 days 00:00:00.510527,1.4585752500573277,gbtree,0.6563493521695417,2.484852881360492,lossguide,97.08405288077661,0.0006207396259750549,1,3,24.64414043318934,500,,0.4089583210643018,0.5238103804249092,none,0.6199289915717827,2.5618933849627603,,,,0.5817779845740862,0.5177602620534343,0.517915642915643,0.4089583210643018,0.49305929194017,0.4939279957012359,0.5238103804249092,0.6468433011443004,0.6499994616456396,0.3294033069734004,0.32979334098737084,0.9798973481608212,0.9833119383825417,none,0.8447032919569477,0.8422330109666181,0.6199289915717827,COMPLETE
151,0.6217957897751683,2025-09-23 12:25:40.840942,2025-09-23 12:25:51.762557,0 days 00:00:10.921615,0.0016376980413363264,dart,0.5666231148670098,5.726329966747499,lossguide,0.2538900271004016,0.06350915529358665,1,12,0.15272215637684425,400,tree,0.6562749567655513,0.5972872621286034,undersample,0.5622303044049706,4.6533022041781695,0.18961787722819545,uniform,0.6726217128089224,0.4676355029325772,0.722387143003378,0.7296273546273546,0.6562749567655513,0.6126820908311911,0.6217957897751683,0.5972872621286034,0.7181267172402633,0.7172092280417349,0.45990566037735847,0.46728368489022815,0.9174508126603935,0.9289687633718442,undersample,0.8848381730109192,0.8879044505125374,0.5622303044049706,COMPLETE
152,0.7069454287739192,2025-09-23 12:25:51.878759,2025-09-23 12:26:03.049635,0 days 00:00:11.170876,0.006422958646346551,dart,0.3948642168868561,5.6608844806314496,lossguide,0.28512182059326446,0.1502747265924756,7,11,6.548946483778356,400,tree,0.3764695059988052,0.9045997960754066,none,0.9191432375074077,1.981166177151607,0.3107138436757321,uniform,0.8683938714057322,0.6950936311511926,0.8252635889036749,0.8306715806715806,0.3764695059988052,0.7014168270071716,0.7069454287739192,0.9045997960754066,0.8234798650396362,0.8141260285116845,0.5933708197691625,0.6032657998185667,0.8575705731394354,0.8536585365853658,none,0.9260640723282658,0.9238372574108844,0.9191432375074077,COMPLETE
153,0.38612143742255267,2025-09-23 12:26:03.167781,2025-09-23 12:26:09.262178,0 days 00:00:06.094397,0.0028991678278112135,dart,0.4205322623359085,3.9681969176757956,lossguide,0.039773054105352805,0.00043670594050864044,7,7,2.4393783828856117,300,forest,0.3962179676255597,0.8170455404482838,oversample,0.9643212440348068,1.9661546999434674,0.2922414968821362,uniform,0.08220041835189766,0.30883467390280495,0.23932848807452145,0.23925061425061425,0.3962179676255597,0.3862228462872718,0.38612143742255267,0.8170455404482838,0.7605760632212901,0.7582303089928006,0.23932848807452145,0.23925061425061425,1.0,1.0,oversample,0.8996183191607442,0.8976308179884809,0.9643212440348068,COMPLETE
154,0.6745261211280629,2025-09-23 12:26:09.378808,2025-09-23 12:27:02.898708,0 days 00:00:53.519900,0.00181769051298065,dart,0.6637522477961879,3.045715507819634,lossguide,0.00012081767275736546,0.08748323637885898,7,6,9.05254734641418,900,tree,0.6050934515250185,0.5861546623488265,undersample,0.5177692362671731,0.5837125680791598,0.06354307024494849,weighted,0.3890516227660948,0.759991011701489,0.8509571092230526,0.8558558558558559,0.6050934515250185,0.6704391127206881,0.6745261211280629,0.5861546623488265,0.7845825576331498,0.7826312044803696,0.7120192307692308,0.7335344394167923,0.6334473909324209,0.6243046640992725,undersample,0.9065910799083533,0.9079692923865472,0.5177692362671731,COMPLETE
155,0.0,2025-09-23 12:27:03.017899,2025-09-23 12:27:03.533797,0 days 00:00:00.515898,29.234799452753457,gbtree,0.3320865018975362,3.976672339315541,depthwise,5.298938603731774,0.0009228902987098681,6,10,0.4892699954201925,500,,0.6254174717135979,0.5778503850724334,none,0.5069181255864874,0.5479656088538052,,,,0.22503402232781902,0.7606715119254785,0.7607493857493858,0.6254174717135979,0.0,0.0,0.5778503850724334,0.7170463794623919,0.7141950946169819,0.0,0.0,0.0,0.0,none,0.871797698794694,0.8698214703499265,0.5069181255864874,COMPLETE
