number,value,datetime_start,datetime_complete,duration,params_alpha,params_booster,params_colsample_bytree,params_gamma,params_grow_policy,params_lambda,params_learning_rate,params_max_delta_step,params_max_depth,params_min_child_weight,params_n_estimators,params_normalize_type,params_params_decision_threshold,params_params_feature_fraction,params_params_resampling,params_params_sample_rows,params_params_scale_pos_weight,params_rate_drop,params_sample_type,params_skip_drop,params_subsample,user_attrs_acc_test,user_attrs_acc_val,user_attrs_decision_threshold,user_attrs_f1_test,user_attrs_f1_val,user_attrs_feature_fraction,user_attrs_pr_auc_test,user_attrs_pr_auc_val,user_attrs_prec_test,user_attrs_prec_val,user_attrs_rec_test,user_attrs_rec_val,user_attrs_resampling_strategy,user_attrs_roc_auc_test,user_attrs_roc_auc_val,user_attrs_sample_rows,state
2298,0.6714261995683214,2025-09-24 00:29:33.837923,2025-09-24 00:29:34.612837,0 days 00:00:00.774914,0.0012947808571693478,gbtree,0.2121705978696781,6.092466282189953,lossguide,0.08533221824450393,0.059182076596018554,2,6,0.11913369285227232,400,,0.6994636930155871,0.9325508773660084,undersample,0.9852486897705197,2.5623346693855082,,,,0.6443061869401244,0.7906643464018835,0.7973996723996724,0.6994636930155871,0.6645891422010825,0.6714261995683214,0.9325508773660084,0.7482688555115422,0.7420529099238473,0.5389731311519022,0.5485621269669018,0.8665526090675791,0.865211810012837,undersample,0.8994395141892234,0.9011227353843348,0.9852486897705197,COMPLETE
2299,0.6884045915820994,2025-09-24 00:29:34.756350,2025-09-24 00:30:24.641834,0 days 00:00:49.885484,0.013561412372167209,dart,0.7110713442123904,0.3976192886566437,lossguide,0.0028501953664152617,0.26427869905009793,6,9,2.9243306602356696,800,forest,0.40916033953838443,0.9823683127416436,none,0.9699121988543021,2.7460085458654286,0.17710866537867498,weighted,0.5487813788895901,0.5028508190899783,0.8037670181185382,0.8082514332514332,0.40916033953838443,0.6855830736427752,0.6884045915820994,0.9823683127416436,0.8153689050090431,0.8081682865231514,0.5559989358872041,0.5631464344039194,0.8939264328485885,0.8853230637569534,none,0.9220147570364778,0.9198315847977978,0.9699121988543021,COMPLETE
2300,0.7201550387596899,2025-09-24 00:30:24.785934,2025-09-24 00:30:26.665213,0 days 00:00:01.879279,0.00028515357445412816,gbtree,0.28263548543655237,4.971393046384245,lossguide,0.00011241694348432633,0.02698111515340609,1,11,1.1792683203117313,900,,0.5551659971486251,0.9041888906690845,none,0.8653244012302476,2.6984474815499966,,,,0.5181430758648328,0.8519807554509161,0.8521703521703522,0.5551659971486251,0.7216018482864844,0.7201550387596899,0.9041888906690845,0.8278364848880918,0.8201719571418202,0.6561624649859944,0.6581650726177825,0.8015397775876818,0.7950363714163458,none,0.9277886927569396,0.9261735422742748,0.8653244012302476,COMPLETE
2301,0.6828941491737383,2025-09-24 00:30:26.814301,2025-09-24 00:30:28.249105,0 days 00:00:01.434804,0.0008888603193448431,gbtree,0.3186715771102783,0.9049833220349737,lossguide,0.03542230220036163,0.4668005193833569,2,9,0.13189975238047935,700,,0.6705845172131177,0.9775262159233198,none,0.7494316098798737,3.3245774210685477,,,,0.8630239843833489,0.8523902139420616,0.8546273546273546,0.6705845172131177,0.6740506329113924,0.6828941491737383,0.9775262159233198,0.7896969360609171,0.7864274760920524,0.714765100671141,0.7141522652965904,0.6377245508982036,0.654257595207531,none,0.9082177936070875,0.907246309464561,0.7494316098798737,COMPLETE
2302,0.6958916685792976,2025-09-24 00:30:28.403536,2025-09-24 00:30:30.228881,0 days 00:00:01.825345,0.0012985190430007947,gbtree,0.2761083160597186,1.3210824175113973,lossguide,0.0038475986908103753,0.10728326139288148,2,8,0.11397343957547333,400,,0.6390951914378608,0.9429409177584115,none,0.9309582082856671,1.9658073153651172,,,,0.35350486711162005,0.8651857917903573,0.8643529893529893,0.6390951914378608,0.7007498295841854,0.6958916685792976,0.9429409177584115,0.8131552288639592,0.8119148661775721,0.7474551623848764,0.7504950495049505,0.6595380667236954,0.6486949080017116,none,0.9209520286953631,0.9212628094026303,0.9309582082856671,COMPLETE
2303,0.7032840407144229,2025-09-24 00:30:30.375025,2025-09-24 00:30:31.180441,0 days 00:00:00.805416,0.0002519331338294047,gbtree,0.42843927421057454,0.5795708812179321,depthwise,0.0022769737262450145,0.012518642111729785,0,7,0.38778969314869827,200,,0.6904314189292514,0.995835298390829,none,0.7886725108820095,4.87626263190504,,,,0.8242461283913128,0.8437915856280069,0.8418304668304668,0.6904314189292514,0.7075507857416635,0.7032840407144229,0.995835298390829,0.8002325773916664,0.7929051012663481,0.6409722222222223,0.6379790940766551,0.7895637296834902,0.7834830979888746,none,0.9176115730935039,0.915876815526118,0.7886725108820095,COMPLETE
2304,0.6283590623213264,2025-09-24 00:30:31.324362,2025-09-24 00:30:34.152859,0 days 00:00:02.828497,0.0010617438451094143,gbtree,0.24530009536004588,3.9693499774219503,lossguide,0.00011067323539485046,0.006679911139134261,1,10,0.17308075268661377,300,,0.6376685075636344,0.9981959203599872,oversample,0.9237747422431482,3.619267655235105,,,,0.8625628226224348,0.7292455727300645,0.7338247338247338,0.6376685075636344,0.6251948420008502,0.6283590623213264,0.9981959203599872,0.7659630171735852,0.7571481827865286,0.4674719220173766,0.47177505902554195,0.9435414884516681,0.9405220367993153,oversample,0.9066123764927612,0.9054814203667609,0.9237747422431482,COMPLETE
2305,0.6659296926818483,2025-09-24 00:30:34.296387,2025-09-24 00:31:12.368634,0 days 00:00:38.072247,0.0018830837680017184,dart,0.41477074098006383,2.1818789177805287,lossguide,0.09441874323405873,0.03248408737049916,9,9,0.16464541825261295,700,forest,0.5740698363256134,0.9383619105372066,none,0.8617562407334451,1.7066474883601805,0.0995243049196392,weighted,0.8906436125895046,0.2904486035564573,0.8448152318558706,0.8453112203112203,0.5740698363256134,0.6675438596491228,0.6659296926818483,0.9383619105372066,0.7473433719936926,0.7457192454930892,0.684968496849685,0.6889295516925892,0.65098374679213,0.6444159178433889,none,0.8988314967043824,0.8998856229558408,0.8617562407334451,COMPLETE
2306,0.6657351342959168,2025-09-24 00:31:12.514784,2025-09-24 00:31:13.653475,0 days 00:00:01.138691,0.06217028019491085,gbtree,0.7834476047098915,1.2685931689425323,lossguide,0.11421943266313969,0.013824806964009794,6,6,0.3258346218909152,200,,0.41557436103787,0.9810115800966874,oversample,0.9991292979637239,1.1057886174419005,,,,0.9011694381869689,0.7722387143003379,0.7795864045864046,0.41557436103787,0.6595256312165264,0.6657351342959168,0.9810115800966874,0.811438496850112,0.8038427320309164,0.513461996664284,0.5224171539961013,0.9217279726261762,0.9174154899443732,oversample,0.9195411299783499,0.9170978623072678,0.9991292979637239,COMPLETE
2307,0.7069368667186282,2025-09-24 00:31:13.799631,2025-09-24 00:31:19.176808,0 days 00:00:05.377177,0.000673614136525925,dart,0.5807228304487547,3.181401874500331,lossguide,0.02183751260636471,0.011628608185368833,5,11,11.491185687189956,200,forest,0.6918566412351699,0.9949429041878022,none,0.8721555924363851,4.850200557407051,0.14391419817921677,weighted,0.7383202766902031,0.8181373529017218,0.8491145460128979,0.846027846027846,0.6918566412351699,0.7133411124076235,0.7069368667186282,0.9949429041878022,0.8090880064826429,0.8002864063108489,0.6540656205420827,0.6490161001788909,0.7844311377245509,0.7762088147197261,none,0.9199776811795407,0.9173947888683145,0.8721555924363851,COMPLETE
2308,0.6849247471009129,2025-09-24 00:31:19.324699,2025-09-24 00:31:22.888825,0 days 00:00:03.564126,0.5670586952804872,dart,0.7789134480997711,0.1756904945534734,depthwise,0.00035615829053572783,0.035514698888582094,10,6,0.1640205620157913,200,forest,0.4361317852874621,0.9540482343765617,none,0.8010869873653053,0.6609458557883482,0.06106495370930598,weighted,0.7151480676432045,0.9914048419063488,0.8702016583068891,0.8692669942669943,0.4361317852874621,0.6892156862745098,0.6849247471009129,0.9540482343765617,0.8249505475835814,0.8193538127020017,0.8071182548794489,0.8088578088578089,0.6013686911890505,0.5939238339751819,none,0.9257625529838875,0.9236665239184955,0.8010869873653053,COMPLETE
2309,0.7106446776611695,2025-09-24 00:31:23.032583,2025-09-24 00:31:24.938083,0 days 00:00:01.905500,0.00010468964023376066,gbtree,0.2863029175118553,2.9518309200783426,lossguide,0.15446745934937686,0.07488542644267616,2,8,0.36805029145522283,1000,,0.6585053268296603,0.9982332496516145,none,0.6781642941645566,3.0265688004601947,,,,0.47075163079840987,0.8619101238611936,0.8616912366912367,0.6585053268296603,0.7123053956067392,0.7106446776611695,0.9982332496516145,0.8199256909594713,0.8099573108568601,0.7103360272224585,0.7114065180102916,0.7142857142857143,0.7098844672657253,none,0.9242409983654584,0.9204147274883283,0.6781642941645566,COMPLETE
2310,0.668227215980025,2025-09-24 00:31:25.087958,2025-09-24 00:31:42.908612,0 days 00:00:17.820654,0.00249702524994694,dart,0.9245048777157537,8.002882807014043,depthwise,0.0013209062956270094,0.19170598999990554,6,12,0.23829546816672242,500,forest,0.6794387561161916,0.9872807086058388,undersample,0.9957588696297344,4.713523919246413,0.24052072669424407,weighted,0.7566902085852246,0.41154150634642545,0.7794042378953834,0.7823505323505323,0.6794387561161916,0.6664603002631172,0.668227215980025,0.9872807086058388,0.8133010311973113,0.8048265981173277,0.5221925782197429,0.5259150085973963,0.9208725406330197,0.9161317928968763,undersample,0.9217771274453228,0.9191441017739757,0.9957588696297344,COMPLETE
2311,0.7103946637020567,2025-09-24 00:31:43.052995,2025-09-24 00:31:50.536923,0 days 00:00:07.483928,0.00616687201301854,dart,0.8437168978922087,6.746971492137354,depthwise,0.2762185495389438,0.04148728976079567,0,11,1.7782639071177095,300,forest,0.6933399328318031,0.8577864151614478,oversample,0.82731385584122,2.086561451807206,0.15718301593492823,weighted,0.6308043064109345,0.9557027230992441,0.8374449790152523,0.839987714987715,0.6933399328318031,0.7066863686738086,0.7103946637020567,0.8577864151614478,0.8198659985654941,0.8169744737959261,0.6219115734720416,0.6264705882352941,0.8182207014542344,0.8202824133504493,oversample,0.9241080673879186,0.9233235885680999,0.82731385584122,COMPLETE
2312,0.6769485903814262,2025-09-24 00:31:50.682264,2025-09-24 00:32:01.961035,0 days 00:00:11.278771,0.003571490803487718,dart,0.8770896470478646,8.340448902279105,depthwise,0.006351047558619895,0.0980945958951886,2,12,2.990633743764615,400,forest,0.6870611443125992,0.7361032805568454,undersample,0.7861481400835091,2.567539704517091,9.915133883070526e-05,weighted,0.8386773117851307,0.7469961521544497,0.8005937148121609,0.8005733005733006,0.6870611443125992,0.6813869807000327,0.6769485903814262,0.7361032805568454,0.7946563445370716,0.7781582655366301,0.5516419491525424,0.5526672082317898,0.8909324208725407,0.87334189131365,undersample,0.9166175406266882,0.9099050877256324,0.7861481400835091,COMPLETE
2313,0.5980962453728186,2025-09-24 00:32:02.105681,2025-09-24 00:32:25.872921,0 days 00:00:23.767240,0.0022271986701364885,dart,0.48163150051837234,4.673259903574742,lossguide,9.541895341442615,0.1529522943467209,2,6,0.7310720892404992,600,tree,0.6716510989673687,0.8958478242855206,none,0.8772358292969991,1.3582888712651398,0.13348996298235258,uniform,0.49289547781907633,0.8702136804511804,0.8433821271368614,0.8443898443898444,0.6716510989673687,0.5975802209363493,0.5980962453728186,0.8958478242855206,0.7544908680364252,0.7470105380807888,0.7759562841530054,0.7826989619377163,0.48588537211291705,0.4839537869062901,none,0.9007420881174383,0.9015807502910675,0.8772358292969991,COMPLETE
2314,0.6542393265183404,2025-09-24 00:32:26.015961,2025-09-24 00:32:26.729299,0 days 00:00:00.713338,0.00018945412113841818,gbtree,0.4468933745264814,0.9371415692951595,lossguide,0.020241594631389328,0.4544386100094041,3,3,0.4764815165823702,300,,0.5110268912174196,0.9318138848574752,oversample,0.8555243627476524,4.895352405029118,,,,0.8461343768876344,0.7585218548469649,0.7645372645372646,0.5110268912174196,0.6500519210799585,0.6542393265183404,0.9318138848574752,0.8167734619019315,0.8154482972705595,0.49761526232114467,0.5042873696407879,0.937125748502994,0.9311082584510055,oversample,0.9217438011686414,0.9212918600086708,0.8555243627476524,COMPLETE
2315,0.6777003484320557,2025-09-24 00:32:26.873916,2025-09-24 00:32:27.641025,0 days 00:00:00.767109,0.004031637746007927,gbtree,0.42341285275846485,2.2859937921062676,lossguide,0.002290337514900032,0.00951602107911704,2,3,3.0656497948234516,400,,0.5896618986511009,0.9399921770155037,none,0.8095043118851348,3.9853454504454837,,,,0.806588317836308,0.807349779916061,0.8106060606060606,0.5896618986511009,0.679714091218516,0.6777003484320557,0.9399921770155037,0.7741313253709788,0.765784795489309,0.5644431882419446,0.5715545107258302,0.8541488451668092,0.8322635857937527,none,0.9071061406801715,0.9036611076647705,0.8095043118851348,COMPLETE
2316,0.6530428249436514,2025-09-24 00:32:27.786287,2025-09-24 00:33:02.729354,0 days 00:00:34.943067,0.001444814255377554,dart,0.9541465101633237,7.1366943355038694,depthwise,0.0016705159930296737,0.011179721097367866,2,12,5.717711816978093,700,forest,0.5956280873778795,0.9897676313818549,undersample,0.9358246698421169,3.5772319752257773,0.1446745355827352,weighted,0.7785811160497023,0.30320904333395515,0.7585218548469649,0.7636158886158886,0.5956280873778795,0.6493236212278877,0.6530428249436514,0.9897676313818549,0.808367663620666,0.8012259566192019,0.49760765550239233,0.5032422417786012,0.9341317365269461,0.9298245614035088,undersample,0.9205627328882232,0.918146966353755,0.9358246698421169,COMPLETE
2317,0.7154835103409726,2025-09-24 00:33:02.873492,2025-09-24 00:33:03.788987,0 days 00:00:00.915495,0.00011632886507093759,gbtree,0.3383225756419913,3.719109037201592,depthwise,0.0011071107436468784,0.15204317617957414,0,5,2.9396018706955145,700,,0.6087946119619385,0.9643424363509143,none,0.8398851790796591,4.037893433550175,,,,0.6808538268498971,0.8429726686457161,0.8436732186732187,0.6087946119619385,0.7181183388460125,0.7154835103409726,0.9643424363509143,0.8251909936878521,0.81859155715223,0.6295103092783505,0.6336633663366337,0.8357570573139436,0.8215661103979461,none,0.9266033076013034,0.9248233656932323,0.8398851790796591,COMPLETE
2318,0.657754871960058,2025-09-24 00:33:03.938131,2025-09-24 00:33:06.504840,0 days 00:00:02.566709,0.2367415821620528,gbtree,0.4352674426081692,1.3524162792885188,lossguide,0.016005160090143817,0.053176005417486405,0,12,0.14302300745405916,300,,0.6888821904830732,0.9200561813179285,undersample,0.7389192604472687,4.950206396119259,,,,0.7753467078605987,0.7782782270447334,0.7824529074529074,0.6888821904830732,0.65344,0.657754871960058,0.9200561813179285,0.7363010451074594,0.733334836774717,0.5219836400817995,0.5273760330578512,0.8733960650128315,0.8737697903294822,undersample,0.8940393623042859,0.8954430683843205,0.7389192604472687,COMPLETE
2319,0.6693151120292389,2025-09-24 00:33:06.651690,2025-09-24 00:33:13.556967,0 days 00:00:06.905277,0.0012623166412842213,dart,0.9225735316962476,7.960099548895655,depthwise,0.0009952411398426184,0.39761044410899116,1,11,7.411562407887817,300,forest,0.6794424566578783,0.8993208662515677,oversample,0.9111331475799529,3.4083452152811806,0.09185219670005254,weighted,0.6133671303019375,0.874934921701337,0.7787900501586652,0.786957411957412,0.6794424566578783,0.6600597766241938,0.6693151120292389,0.8993208662515677,0.8057752539341914,0.7996418917441657,0.5220204030853446,0.532355915065723,0.8973481608212147,0.9011553273427471,oversample,0.9146010130957878,0.9148418768891171,0.9111331475799529,COMPLETE
2320,0.6521867612293144,2025-09-24 00:33:13.704093,2025-09-24 00:33:58.080856,0 days 00:00:44.376763,0.04036202983531955,dart,0.4872297054048982,0.381875633176206,lossguide,0.0011381073881938512,0.015534172880397176,6,8,2.245182610914009,800,tree,0.49029169360680647,0.9603565493651613,undersample,0.9545439083295084,2.750334341460612,0.23200177906877123,uniform,0.4272730959033009,0.5136209480538366,0.7563721977684512,0.759009009009009,0.49029169360680647,0.6508215962441315,0.6521867612293144,0.9603565493651613,0.8205130008577916,0.813331546428798,0.4953104064314426,0.4980816971338298,0.9486740804106074,0.9443731279418057,undersample,0.9254667031356285,0.9234020453584473,0.9545439083295084,COMPLETE
2321,0.7139067828723001,2025-09-24 00:33:58.228963,2025-09-24 00:34:27.412983,0 days 00:00:29.184020,0.015095029109399215,dart,0.27149277269702055,0.9612373399439597,lossguide,0.0111956295326374,0.0269231488274108,6,10,0.38459514754604673,600,forest,0.6613383693642481,0.9906384405301957,undersample,0.9800868531358764,1.4547975786266414,0.15192246681211957,weighted,0.7626320176171827,0.3776613185832782,0.8439963148735797,0.8454135954135954,0.6613383693642481,0.7140712945590995,0.7139067828723001,0.9906384405301957,0.8211742118708607,0.8174664773878595,0.6360294117647058,0.6405984359061544,0.8139435414884517,0.8061617458279846,undersample,0.9253471832504321,0.9244647389847673,0.9800868531358764,COMPLETE
2322,0.6654515998379911,2025-09-24 00:34:27.557524,2025-09-24 00:34:34.400375,0 days 00:00:06.842851,0.0006059359457569475,dart,0.9779820671773346,7.982420562780965,depthwise,0.002560450015187607,0.09764158986468062,0,10,2.180165481963372,300,forest,0.6884186829656737,0.785558651038504,none,0.758697539468638,3.8299718736317825,0.061206930378653435,weighted,0.7015023274241569,0.815275999508912,0.8297676323062749,0.8308763308763308,0.6884186829656737,0.6654596660631663,0.6654515998379911,0.785558651038504,0.7375475917826003,0.7357445936282508,0.6281807823775162,0.631680123029604,0.7074422583404619,0.7030380830124091,none,0.8928277305473256,0.8943599615967687,0.758697539468638,COMPLETE
2323,0.7114642451759364,2025-09-24 00:34:34.544656,2025-09-24 00:34:35.520992,0 days 00:00:00.976336,0.0003200729568419923,gbtree,0.8868039101916682,4.096959351630231,lossguide,0.039780463008176635,0.12824469039109224,3,9,1.5082878563696764,400,,0.6746074775669049,0.99203569873125,none,0.926083984125896,2.4702992976262177,,,,0.9033535108558847,0.8728631384993346,0.8698812448812449,0.6746074775669049,0.7198917456021651,0.7114642451759364,0.99203569873125,0.8265031125233528,0.8224717420710733,0.7614503816793893,0.7577369439071566,0.6826347305389222,0.670517757809157,none,0.9276706693884852,0.9253242799091825,0.926083984125896,COMPLETE
2324,0.6708190594830271,2025-09-24 00:34:35.667301,2025-09-24 00:34:36.853510,0 days 00:00:01.186209,0.00022852943299988597,gbtree,0.34067632056411107,1.1132725360294813,lossguide,0.0019545993981047614,0.17592864297280295,1,4,5.734932921929952,800,,0.6086259995745401,0.9807152357919423,undersample,0.9571548051668969,4.477862317914906,,,,0.6482687707776983,0.7766403930801515,0.7835790335790336,0.6086259995745401,0.6646172763602828,0.6708190594830271,0.9807152357919423,0.8080922652145796,0.803268101549006,0.5187140115163148,0.5272949816401469,0.9247219846022241,0.9216944801026957,undersample,0.9203553214235924,0.9185020805013309,0.9571548051668969,COMPLETE
2325,0.641395908543923,2025-09-24 00:34:37.002947,2025-09-24 00:35:09.664477,0 days 00:00:32.661530,0.00020729489569401208,dart,0.6985967857350674,9.7349728974761,depthwise,0.0017881440900453629,0.053914133594599414,2,11,0.14096475309769368,700,forest,0.6331962928704182,0.900313905542638,undersample,0.9537556774813272,3.1708371855129505,0.23929268556219127,weighted,0.7631126518306143,0.4471090703172267,0.7458286416214557,0.7559377559377559,0.6331962928704182,0.6310001486104919,0.641395908543923,0.900313905542638,0.7343544134683146,0.7292978181098477,0.48348895468002734,0.49454882857805615,0.9080410607356715,0.9122807017543859,undersample,0.892380962741453,0.8949947274157739,0.9537556774813272,COMPLETE
2326,0.6976307764485105,2025-09-24 00:35:09.808368,2025-09-24 00:35:20.932945,0 days 00:00:11.124577,0.0002077151367130988,dart,0.8440509813707948,1.3817399947990514,depthwise,0.0004462695935318634,0.21518788394488741,10,4,0.21130775521168155,400,forest,0.3133576239442032,0.9516877630553404,none,0.9934494685801649,0.5113269275667504,0.14957248357426703,weighted,0.6363842189498288,0.9026081420998557,0.8706111167980346,0.868038493038493,0.3133576239442032,0.7054986020503262,0.6976307764485105,0.9516877630553404,0.8212400978496722,0.8150829110917502,0.77482088024565,0.7720664589823468,0.6475620188195038,0.636285836542576,none,0.9236352544348985,0.9220651992338933,0.9934494685801649,COMPLETE
2327,0.6687085247575294,2025-09-24 00:35:21.080018,2025-09-24 00:35:22.220358,0 days 00:00:01.140340,0.002056415850560785,gbtree,0.7090019438845903,2.9122992195212083,lossguide,0.03362216806431901,0.0203591618467614,8,6,0.16162040904510988,200,,0.36089628953504077,0.8840069188529347,none,0.9460556609910485,1.7382419811479213,,,,0.7789646031782612,0.7945542020677654,0.8006756756756757,0.36089628953504077,0.6629722921914357,0.6687085247575294,0.8840069188529347,0.7477098824233444,0.7372416377567165,0.5457561515067736,0.5550847457627118,0.844311377245509,0.8408215661103979,none,0.8984726492571118,0.898090761924554,0.9460556609910485,COMPLETE
2328,0.6940391829929137,2025-09-24 00:35:22.363321,2025-09-24 00:35:40.924143,0 days 00:00:18.560822,0.00019639903986209617,dart,0.9653958929623054,6.919199904105795,depthwise,0.003758450766891039,0.2563570665836535,2,12,2.7353801889432505,500,forest,0.6434175411839009,0.8995467237069935,none,0.9304060015904452,2.8739523966089093,0.21539465817055498,weighted,0.47250556693846674,0.9408693108922724,0.8538233186610708,0.8497133497133497,0.6434175411839009,0.7072570725707257,0.6940391829929137,0.8995467237069935,0.795141305297633,0.7865881428215444,0.6791338582677166,0.6765542462413653,0.7378100940975193,0.7124518613607189,none,0.9151747545913997,0.9108910232590841,0.9304060015904452,COMPLETE
