number,value,datetime_start,datetime_complete,duration,params_alpha,params_booster,params_colsample_bytree,params_gamma,params_grow_policy,params_lambda,params_learning_rate,params_max_delta_step,params_max_depth,params_min_child_weight,params_n_estimators,params_normalize_type,params_params_decision_threshold,params_params_feature_fraction,params_params_resampling,params_params_sample_rows,params_params_scale_pos_weight,params_rate_drop,params_sample_type,params_skip_drop,params_subsample,user_attrs_acc_test,user_attrs_acc_val,user_attrs_decision_threshold,user_attrs_f1_test,user_attrs_f1_val,user_attrs_feature_fraction,user_attrs_pr_auc_test,user_attrs_pr_auc_val,user_attrs_prec_test,user_attrs_prec_val,user_attrs_rec_test,user_attrs_rec_val,user_attrs_resampling_strategy,user_attrs_roc_auc_test,user_attrs_roc_auc_val,user_attrs_sample_rows,state
631,0.0,2025-09-23 14:11:54.848645,2025-09-23 14:12:33.079078,0 days 00:00:38.230433,0.00015651015563206247,dart,0.44812641849473533,1.490348591363384,lossguide,0.0031517469819257403,0.0007540595922478061,5,11,0.17961013394291814,700,forest,0.6395289067330301,0.893259972863441,undersample,0.9695749529926476,0.5943438991626789,0.16651570098828056,uniform,0.35347433911713094,0.40320860857114316,0.7606715119254785,0.7607493857493858,0.6395289067330301,0.0,0.0,0.893259972863441,0.7883899956136282,0.7774912363934734,0.0,0.0,0.0,0.0,undersample,0.9134712868512931,0.9108254650529847,0.9695749529926476,COMPLETE
632,0.6544573936733767,2025-09-23 14:12:33.208522,2025-09-23 14:12:57.937126,0 days 00:00:24.728604,0.0473184225944464,dart,0.6918053836384492,9.134925486010285,lossguide,0.005623300219176157,0.11071349372016488,0,12,1.757620968201215,700,forest,0.3527298706821582,0.8346347085454352,undersample,0.7918736533823103,1.001207185873205,0.4255447913644517,uniform,0.22451393462669986,0.8583034630042548,0.7587265840925376,0.7662776412776413,0.3527298706821582,0.647735764459722,0.6544573936733767,0.8346347085454352,0.8043544774868335,0.7941882058087053,0.4978175970594992,0.5063231850117096,0.9268605645851155,0.9251176722293539,undersample,0.9166399020403163,0.913924896956723,0.7918736533823103,COMPLETE
633,0.6310664841016279,2025-09-23 14:12:58.062779,2025-09-23 14:13:05.085744,0 days 00:00:07.022965,0.0007963012613857724,dart,0.35284960106740054,2.324472481464924,depthwise,0.002367306188653332,0.046968900659611665,6,11,0.4710552709156576,300,forest,0.50886515269007,0.551670425464508,undersample,0.8692763508323464,2.076050223628814,0.03191201152516426,uniform,0.7390526053405634,0.6423788369974811,0.7530965298392875,0.7517403767403767,0.50886515269007,0.6326530612244898,0.6310664841016279,0.551670425464508,0.7848259227197376,0.780344223303886,0.49124881740775783,0.48961284230406044,0.888366124893071,0.8874625588361147,undersample,0.8958173393106514,0.8936742636448738,0.8692763508323464,COMPLETE
634,0.6754275427542754,2025-09-23 14:13:05.209718,2025-09-23 14:13:19.263093,0 days 00:00:14.053375,0.008414155733961528,dart,0.4546436624767717,9.70880472845242,depthwise,0.02257589242245111,0.2427326931863461,3,3,75.7384918056968,600,tree,0.6848603379603866,0.7933033219603524,oversample,0.6452136075058834,1.6508854714749297,0.4559162773612755,uniform,0.018505241498627024,0.732888295740308,0.8147200327566793,0.8154176904176904,0.6848603379603866,0.6782794169925347,0.6754275427542754,0.7933033219603524,0.7672230345408996,0.7596256763214333,0.5802919708029197,0.5829707893101305,0.8160821214713431,0.8027385537013265,oversample,0.9047259595809247,0.902102480749007,0.6452136075058834,COMPLETE
635,0.6358262657414546,2025-09-23 14:13:19.386181,2025-09-23 14:13:37.205927,0 days 00:00:17.819746,6.532902746593,dart,0.8140533498543896,5.0109750746549855,lossguide,0.004037462587952637,0.015958643141231573,7,6,3.7209462106826576,500,forest,0.6774402766159493,0.9138498147618956,undersample,0.7264144908129146,0.5617700483450628,0.04198168978185163,uniform,0.8721607863327439,0.9823684826453112,0.8601699252738254,0.8549344799344799,0.6774402766159493,0.6511746680286006,0.6358262657414546,0.9138498147618956,0.7955073587223537,0.7859761573134245,0.8079847908745247,0.796010296010296,0.5453378956372968,0.5293110825845101,undersample,0.9113070070712719,0.9091088592716665,0.7264144908129146,COMPLETE
636,0.6993710691823899,2025-09-23 14:13:37.331546,2025-09-23 14:13:43.909580,0 days 00:00:06.578034,0.0028607569133744133,dart,0.7063519386578545,8.02164632912781,depthwise,0.2911478847396935,0.011870491982183902,7,12,0.5139985210307387,300,forest,0.3765147004075646,0.9316399453406823,undersample,0.7914289547662742,0.5001916593984208,0.15591458334943853,weighted,0.6986457878880415,0.7289473808526841,0.8234210256935203,0.8287264537264537,0.3765147004075646,0.6947442930454787,0.6993710691823899,0.9316399453406823,0.8082980015159779,0.8007825468952209,0.5925143374584968,0.6028500619578686,0.839606501283148,0.832691484809585,undersample,0.916914771875017,0.9156532496629813,0.7914289547662742,COMPLETE
637,0.6869651741293532,2025-09-23 14:13:44.034774,2025-09-23 14:14:06.033621,0 days 00:00:21.998847,5.758975879397239,dart,0.4244554498101456,2.5158537383162773,lossguide,1.0951490343944805,0.012746687113391383,1,9,75.13790410834093,600,forest,0.3793490551976543,0.9939868343352336,none,0.565927715388259,1.2014753784258239,0.1593766690669413,uniform,0.06273757481220407,0.6197992335357339,0.8364213327873887,0.838963963963964,0.3793490551976543,0.6867894943159545,0.6869651741293532,0.9939868343352336,0.778343149913927,0.7733690913492006,0.6338639652677279,0.6421130952380952,0.7493584260051326,0.7385537013264869,none,0.9078016180569249,0.9071994945136966,0.565927715388259,COMPLETE
638,0.4709615994922247,2025-09-23 14:14:06.157245,2025-09-23 14:14:32.476528,0 days 00:00:26.319283,0.0005008190783915031,dart,0.48312386625187537,4.500734498135744,depthwise,1.0272432294896516,0.04485573122087547,1,4,0.241638771280364,700,tree,0.6500388354543333,0.8757875357300231,none,0.9409116581340142,0.6999350992956658,0.4631225201459966,weighted,0.2836906472212607,0.9347103674893762,0.8351929573139523,0.8293407043407044,0.6500388354543333,0.4971892567145534,0.4709615994922247,0.8757875357300231,0.8019369586028513,0.7906000333750316,0.9212962962962963,0.9115479115479116,0.34046193327630453,0.31750106974753955,none,0.9177245601075373,0.9139581511192373,0.9409116581340142,COMPLETE
639,0.5058874836458788,2025-09-23 14:14:32.601474,2025-09-23 14:15:13.001246,0 days 00:00:40.399772,29.616117429522962,dart,0.9022931894674635,5.184948291048345,lossguide,0.0001459171086777431,0.001107051959617781,10,8,8.511138944025914,700,forest,0.4344012187400001,0.9867667506205741,oversample,0.941687702263917,2.9379840731425113,0.16884176390503808,weighted,0.5441001362928529,0.5908191131985047,0.5336267785853209,0.536036036036036,0.4344012187400001,0.5046749293324636,0.5058874836458788,0.9867667506205741,0.7706513962697876,0.7635303532140516,0.33833819241982505,0.3394294074615947,0.9927288280581694,0.9927257167308515,oversample,0.9057248269479842,0.9034787712048551,0.941687702263917,COMPLETE
640,0.6165371024734982,2025-09-23 14:15:13.133034,2025-09-23 14:15:16.737828,0 days 00:00:03.604794,0.6813996031626337,dart,0.4387535883716213,3.2573523714894224,lossguide,0.0035440949587829374,0.0026606043641049164,6,7,0.39612261104618346,200,forest,0.554275051270476,0.6011197724424535,oversample,0.5613503402236728,1.6767567573498456,0.3167373470224748,uniform,0.38075923482403534,0.4497040427113872,0.7172689118640598,0.7222563472563472,0.554275051270476,0.61175147596289,0.6165371024734982,0.6011197724424535,0.7412995503527731,0.7348949580572587,0.4556113902847571,0.4603208104685521,0.93071000855432,0.9332477535301669,oversample,0.8891591348705783,0.8876525250389448,0.5613503402236728,COMPLETE
641,0.6680858612737272,2025-09-23 14:15:16.872556,2025-09-23 14:15:17.355389,0 days 00:00:00.482833,0.004003668839196657,gbtree,0.5960871428243502,8.016851123672303,lossguide,0.750782396103687,0.0066338945276463454,5,3,13.384851479234525,300,,0.6177922069141535,0.9389546445587496,none,0.6911332659560833,3.9893571594101287,,,,0.5122433386486454,0.8075545091616337,0.8084561834561834,0.6177922069141535,0.6727019498607242,0.6680858612737272,0.9389546445587496,0.7701808003916945,0.7604168688795129,0.5672342924251321,0.5706060606060606,0.8263473053892215,0.8057338468121523,none,0.9025544562297056,0.8986573495125343,0.6911332659560833,COMPLETE
642,0.0,2025-09-23 14:15:17.489180,2025-09-23 14:15:19.313516,0 days 00:00:01.824336,0.0016569539435399149,gbtree,0.7714347946928053,0.35600084826907796,lossguide,8.760664343983136,0.0003785091090396811,0,8,65.11554471670698,600,,0.6314359000616819,0.7340393516182158,none,0.9590173572463929,1.5881706084881209,,,,0.4507721375801991,0.7606715119254785,0.7607493857493858,0.6314359000616819,0.0,0.0,0.7340393516182158,0.6767491260687923,0.665110030574855,0.0,0.0,0.0,0.0,none,0.8678401027116999,0.8689760372520327,0.9590173572463929,COMPLETE
643,0.6846124474990455,2025-09-23 14:15:19.454445,2025-09-23 14:15:21.056943,0 days 00:00:01.602498,0.0010400731224760134,gbtree,0.8575344165847825,0.18093780240722945,depthwise,0.0003841564994975807,0.2960461586003138,6,8,17.838488721788853,900,,0.3917661082485597,0.9322120822867758,oversample,0.5347010267127533,0.6009804792530464,,,,0.5907897016650507,0.8335551233493704,0.8308763308763308,0.3917661082485597,0.6895761741122566,0.6846124474990455,0.9322120822867758,0.7818038358388507,0.7765369328033214,0.6227586206896552,0.6180627369872458,0.7724550898203593,0.7672229353872486,oversample,0.9062749119674027,0.90338966156591,0.5347010267127533,COMPLETE
644,0.6354235423542354,2025-09-23 14:15:21.188332,2025-09-23 14:15:22.713233,0 days 00:00:01.524901,0.011106896645182144,gbtree,0.21630583460068709,0.8851485840118567,lossguide,0.0009445259821818166,0.012208814918289457,0,8,3.896398090003798,800,,0.6730691280892809,0.6998829506152289,undersample,0.9803037621723263,0.8281754670107121,,,,0.5285985323551587,0.8330433002354386,0.8303644553644554,0.6730691280892809,0.6471987886653688,0.6354235423542354,0.6998829506152289,0.7021994801306909,0.6956326883444177,0.6547045951859957,0.6539855072463768,0.6398631308810949,0.6178861788617886,undersample,0.8838133180550486,0.8854286709154833,0.9803037621723263,COMPLETE
645,0.7062747550552428,2025-09-23 14:15:22.847378,2025-09-23 14:15:30.133593,0 days 00:00:07.286215,0.0008188860957237808,dart,0.705040920944142,9.904741061546156,lossguide,0.00047643830132576385,0.4588673473955702,0,7,8.562641591718185,300,tree,0.6613675146101098,0.7834705932303586,none,0.7114712249225512,3.2008912535120584,0.11138302371196929,uniform,0.39801136925035785,0.4276889350220079,0.8570989865902344,0.8557534807534808,0.6613675146101098,0.7141687141687142,0.7062747550552428,0.7834705932303586,0.8121238916626304,0.8093558401061076,0.6849960722702279,0.6886178861788618,0.7459366980325064,0.7248609328198545,none,0.9214413321117153,0.9205592607314638,0.7114712249225512,COMPLETE
646,0.0,2025-09-23 14:15:30.264462,2025-09-23 14:15:55.552190,0 days 00:00:25.287728,11.037582759959733,dart,0.726301164652895,9.726357397489355,lossguide,0.0002798609712642799,0.0018016417629665253,3,5,83.77854723869135,600,tree,0.5655955054415474,0.9399227755540434,none,0.829427462523237,1.2615479118478796,0.4666114704175872,weighted,0.34845308305866235,0.8757916140104365,0.7606715119254785,0.7607493857493858,0.5655955054415474,0.0,0.0,0.9399227755540434,0.7608698614844797,0.7550291418283148,0.0,0.0,0.0,0.0,none,0.89889210563244,0.8968032644013413,0.829427462523237,COMPLETE
647,0.0,2025-09-23 14:15:55.771085,2025-09-23 14:16:36.008543,0 days 00:00:40.237458,0.10287884135351502,dart,0.7756356017266792,4.520222540036803,depthwise,0.001191988047345112,0.0001543701974439301,2,11,0.23054882512991567,700,forest,0.6836420711441966,0.6008929021845288,oversample,0.8740194843119145,0.6046603365542892,0.15093894451170625,uniform,0.040209751038981736,0.45835858918813355,0.7606715119254785,0.7607493857493858,0.6836420711441966,0.0,0.0,0.6008929021845288,0.6572454756297917,0.6609749986811345,0.0,0.0,0.0,0.0,oversample,0.8587391512608902,0.8633437322410535,0.8740194843119145,COMPLETE
648,0.5036908380373426,2025-09-23 14:16:36.140701,2025-09-23 14:17:53.276581,0 days 00:01:17.135880,0.00011589993709993431,dart,0.48954692840594705,6.0127988034225055,lossguide,0.0017476200833616033,0.0013012661481673566,7,3,0.5535356768501949,1000,forest,0.4032443439258411,0.7559368205158247,oversample,0.9267695202478169,2.1797699874921848,0.20692465200272875,weighted,0.5864002470559769,0.32308312406997414,0.5260517964991299,0.5319410319410319,0.4032443439258411,0.5004315925766076,0.5036908380373426,0.7559368205158247,0.7316875019811062,0.7240488600115975,0.3346320346320346,0.33745454545454545,0.9918733960650128,0.9927257167308515,oversample,0.8883523684507102,0.8833081782149017,0.9267695202478169,COMPLETE
649,0.6329319882850635,2025-09-23 14:17:53.404463,2025-09-23 14:18:45.676069,0 days 00:00:52.271606,64.65168846344855,dart,0.46764113878902924,4.138709137131185,lossguide,0.0008072908201581674,0.43335183763262164,1,8,4.9940294619947085,800,forest,0.6392117686436052,0.6178526482813107,oversample,0.9146055687337566,1.681286213800016,0.043667765802462066,weighted,0.07972047152049064,0.560803341746434,0.761080970416624,0.769041769041769,0.6392117686436052,0.6257216164207825,0.6329319882850635,0.6178526482813107,0.6778866928837406,0.6695585219387344,0.5005130836326321,0.5106327119978997,0.8344739093242087,0.8322635857937527,oversample,0.8708740601730963,0.87107683657845,0.9146055687337566,COMPLETE
650,0.6576377952755905,2025-09-23 14:18:45.807871,2025-09-23 14:18:46.117380,0 days 00:00:00.309509,0.005153693001465702,gbtree,0.21884355172179204,4.407915905708109,lossguide,0.17284252536704026,0.12388145881930378,2,4,6.8105360688973455,200,,0.44290148254169237,0.5977492341649213,undersample,0.6239203717924524,1.0650551640468544,,,,0.6603379476164641,0.7713174326952605,0.7774365274365275,0.44290148254169237,0.6525660964230171,0.6576377952755905,0.5977492341649213,0.7654928414248048,0.7605906631268647,0.5127077223851417,0.5203089957637678,0.8973481608212147,0.8934531450577664,undersample,0.9010715808132279,0.9009527216790133,0.6239203717924524,COMPLETE
651,0.7013251783893986,2025-09-23 14:18:46.252916,2025-09-23 14:18:46.829457,0 days 00:00:00.576541,2.846941048916696,gbtree,0.8420848708436353,4.631377396742021,lossguide,45.90666660434324,0.043194608656715115,0,6,5.532940758839933,200,,0.4587017839476897,0.7573405223121986,none,0.9948803382576681,1.5592221521760705,,,,0.9555733202243422,0.8498310983724024,0.8500204750204751,0.4587017839476897,0.7035764800969893,0.7013251783893986,0.7573405223121986,0.8057057525049668,0.7972894903668288,0.6667943316736883,0.6697819314641744,0.7446535500427716,0.7359863072314934,none,0.9149746530354713,0.9135739863656207,0.9948803382576681,COMPLETE
652,0.6650375939849624,2025-09-23 14:18:46.957965,2025-09-23 14:18:48.140383,0 days 00:00:01.182418,0.1682284070624497,gbtree,0.9477721291366721,2.9835303896341845,lossguide,0.0018303164130828939,0.001774454895104283,7,9,14.426580630323745,400,,0.5417430219194859,0.6311478875162141,undersample,0.9679411797283135,0.9778313100211732,,,,0.2848039059749896,0.8123656464325929,0.8175675675675675,0.5417430219194859,0.6648381788261108,0.6650375939849624,0.6311478875162141,0.7693770197620554,0.759741148161913,0.5806451612903226,0.593027153871941,0.7775876817792986,0.7569533590072742,undersample,0.8981428975488093,0.8952826134512542,0.9679411797283135,COMPLETE
653,0.38612143742255267,2025-09-23 14:18:48.275968,2025-09-23 14:18:51.666529,0 days 00:00:03.390561,0.1276024714760829,dart,0.7662549472656561,1.8156717180405568,depthwise,0.009324343349357585,0.0032340795346406702,4,7,0.35254239129172193,200,tree,0.30117235274400606,0.8876119082230924,undersample,0.5776060185966639,2.817423491793786,0.2784942210628522,uniform,0.719140247587572,0.6904843046211457,0.23932848807452145,0.23925061425061425,0.30117235274400606,0.3862228462872718,0.38612143742255267,0.8876119082230924,0.7674638305981192,0.7565806265939791,0.23932848807452145,0.23925061425061425,1.0,1.0,undersample,0.9068684247515122,0.9033428754065284,0.5776060185966639,COMPLETE
654,0.5155433287482806,2025-09-23 14:18:51.803529,2025-09-23 14:18:52.690451,0 days 00:00:00.886922,0.00022955443158792282,gbtree,0.9114813659123466,9.633018522916808,depthwise,0.00012018673874670493,0.00015147262063539504,10,3,0.9846361100824791,1000,,0.5598656424002504,0.6842874610854619,undersample,0.9619587953618169,1.0698697209609775,,,,0.92084709234307,0.8236257549390931,0.8197174447174447,0.5598656424002504,0.5336941813261163,0.5155433287482806,0.6842874610854619,0.6337771283916682,0.640122712894285,0.7266028002947679,0.7218798151001541,0.42172797262617623,0.40094137783483097,undersample,0.8581591646857964,0.8652058789674015,0.9619587953618169,COMPLETE
655,0.0,2025-09-23 14:18:52.825486,2025-09-23 14:18:53.757188,0 days 00:00:00.931702,16.552113254206972,gbtree,0.89615345794654,7.838384846614575,depthwise,0.0010180584351392407,0.0008341104217641997,9,11,0.39605275780163235,700,,0.5754775670448138,0.8310437150688506,undersample,0.5312315918909618,0.5623183081436175,,,,0.7147677677299167,0.7606715119254785,0.7607493857493858,0.5754775670448138,0.0,0.0,0.8310437150688506,0.7321125272836528,0.7277376670023006,0.0,0.0,0.0,0.0,undersample,0.888801294694192,0.8870708795055142,0.5312315918909618,COMPLETE
656,0.49600690697172456,2025-09-23 14:18:53.889359,2025-09-23 14:18:54.816956,0 days 00:00:00.927597,0.005248871997388821,gbtree,0.9441209884402235,9.383937768780017,lossguide,0.007150736142809264,0.0019614657046706854,7,5,70.07674374228766,500,,0.5958142922668976,0.6729713938211885,oversample,0.5681263245848375,4.916464837558738,,,,0.34591754888848825,0.5183744497901526,0.5219082719082719,0.5958142922668976,0.49565869868153073,0.49600690697172456,0.6729713938211885,0.6497539666868316,0.6399507324197581,0.3307109140323273,0.331649588685236,0.9888793840889649,0.9833119383825417,oversample,0.8615861016878521,0.8580074324636751,0.5681263245848375,COMPLETE
657,0.5503894839337877,2025-09-23 14:18:54.951450,2025-09-23 14:20:17.004222,0 days 00:01:22.052772,4.298416282329533,dart,0.7755748977956554,4.1965885486536925,lossguide,96.74232041336396,0.00040530361580848074,0,4,0.897355417656179,1000,forest,0.49863051936080305,0.6832823159074869,none,0.9622850658209834,4.9794414809684,0.13793222976933694,weighted,0.8853589048063009,0.7184237778608391,0.623093458900604,0.6218263718263718,0.49863051936080305,0.5509756097560976,0.5503894839337877,0.6832823159074869,0.640162470847902,0.6406749139848503,0.38536335721596726,0.38458921585303624,0.9662104362703166,0.967479674796748,none,0.8612615014506427,0.8589537797084195,0.9622850658209834,COMPLETE
658,0.6133056133056133,2025-09-23 14:20:17.229353,2025-09-23 14:20:18.176929,0 days 00:00:00.947576,0.12122847204776284,gbtree,0.6512753416965507,3.6781290735183623,depthwise,88.80401045043732,0.003305005567274615,0,5,14.650217557519237,800,,0.6115531753912637,0.6495223332516817,undersample,0.6527560565173034,0.8546286930348564,,,,0.8408059633501503,0.8117514586958747,0.8095823095823096,0.6115531753912637,0.6202766880033037,0.6133056133056133,0.6495223332516817,0.6359717588382183,0.6214820795185007,0.5996007984031936,0.5964415689446017,0.6424294268605646,0.6311510483525888,undersample,0.8574840054017348,0.8558659507722076,0.6527560565173034,COMPLETE
659,0.5955295369877595,2025-09-23 14:20:18.392691,2025-09-23 14:20:19.481267,0 days 00:00:01.088576,0.0001308959141195542,gbtree,0.679696123769715,8.748970844060572,lossguide,2.250650599909858,0.0017645227125056033,8,10,9.3172208899824,200,,0.5004556091365697,0.5447934830279568,oversample,0.8928278593998031,0.7053210824188201,,,,0.9096459920029265,0.8465554304432388,0.8443898443898444,0.5004556091365697,0.6056300973428045,0.5955295369877595,0.5447934830279568,0.7402373853916002,0.7324956768624096,0.7867395762132604,0.7874736101337086,0.4923011120615911,0.47881899871630296,oversample,0.8879218320956564,0.8857605215450408,0.8928278593998031,COMPLETE
660,0.6092639954532537,2025-09-23 14:20:19.696464,2025-09-23 14:20:20.578687,0 days 00:00:00.882223,1.4768638119750335,gbtree,0.3449120375077429,9.322400205538223,lossguide,48.79892756960477,0.0013106697686258483,3,5,6.54140576831078,600,,0.39841246641097855,0.9930842275365076,none,0.5374860426802817,2.5880627325244263,,,,0.2016239272732685,0.7129695977070325,0.7184684684684685,0.39841246641097855,0.6058476244025864,0.6092639954532537,0.9930842275365076,0.711305576118075,0.7029123582162243,0.451214405360134,0.456073175920017,0.9217279726261762,0.9174154899443732,none,0.8833675287408917,0.8818103013276269,0.5374860426802817,COMPLETE
661,0.6663598711458812,2025-09-23 14:20:20.831105,2025-09-23 14:21:55.852795,0 days 00:01:35.021690,0.1805107943086693,dart,0.658153454491357,4.676661463991767,lossguide,43.44798350472459,0.09860518149472766,3,8,0.4817069999244342,1000,tree,0.3440773423583139,0.9823401317680858,oversample,0.9587173484565468,1.2183087093158853,0.14439018780641133,uniform,0.5774856697550538,0.9916692168282486,0.7729552666598424,0.7773341523341524,0.3440773423583139,0.6635315533980582,0.6663598711458812,0.9823401317680858,0.8261413687859824,0.8173649904071287,0.5141043723554302,0.5193687230989957,0.935414884516681,0.9293966623876765,oversample,0.9268852571113614,0.9244280298443296,0.9587173484565468,COMPLETE
