number,value,datetime_start,datetime_complete,duration,params_alpha,params_booster,params_colsample_bytree,params_gamma,params_grow_policy,params_lambda,params_learning_rate,params_max_delta_step,params_max_depth,params_min_child_weight,params_n_estimators,params_normalize_type,params_params_decision_threshold,params_params_feature_fraction,params_params_resampling,params_params_sample_rows,params_params_scale_pos_weight,params_rate_drop,params_sample_type,params_skip_drop,params_subsample,user_attrs_acc_test,user_attrs_acc_val,user_attrs_decision_threshold,user_attrs_f1_test,user_attrs_f1_val,user_attrs_feature_fraction,user_attrs_pr_auc_test,user_attrs_pr_auc_val,user_attrs_prec_test,user_attrs_prec_val,user_attrs_rec_test,user_attrs_rec_val,user_attrs_resampling_strategy,user_attrs_roc_auc_test,user_attrs_roc_auc_val,user_attrs_sample_rows,state
2515,0.6927145538304044,2025-09-24 01:27:44.719600,2025-09-24 01:28:20.140195,0 days 00:00:35.420595,0.000195755129711091,dart,0.6239037595441804,4.978034446201864,depthwise,0.0003972527369835987,0.009136946785032359,3,12,18.09316472500555,700,forest,0.5360107518159248,0.9309483599563741,none,0.9596027414421159,4.489133667452115,0.18176511834326686,weighted,0.5238026219171241,0.7131548634440348,0.8120585525642338,0.8156224406224406,0.5360107518159248,0.692049647769205,0.6927145538304044,0.9309483599563741,0.8212021947300174,0.8123001545837654,0.5692604856512141,0.576049943246311,0.8823781009409752,0.8686350021394951,none,0.9239476235256575,0.9214170741669171,0.9596027414421159,COMPLETE
2516,0.6832389859709574,2025-09-24 01:28:20.292936,2025-09-24 01:29:37.022535,0 days 00:01:16.729599,0.000601904114859887,dart,0.7476777063003387,1.7474619505834346,depthwise,0.00018817356931383352,0.00848786112730256,3,11,1.3838441290310388,1000,forest,0.6359337441482159,0.848033513420892,none,0.9913006110710347,1.6195231747981431,0.09327786805629956,weighted,0.8187703451560688,0.7047184762133493,0.8716347630258983,0.8682432432432432,0.6359337441482159,0.6932485322896281,0.6832389859709574,0.848033513420892,0.8226105941908877,0.8183994282696546,0.8097142857142857,0.8041714947856315,0.6060735671514115,0.5939238339751819,none,0.9252474346537329,0.9237034058078294,0.9913006110710347,COMPLETE
2517,0.7151561309977151,2025-09-24 01:29:37.169669,2025-09-24 01:29:48.784390,0 days 00:00:11.614721,0.0017668150991917233,dart,0.7424601533721633,4.569470408599405,lossguide,0.01350197183113264,0.0632849469128628,9,6,0.17788466969083894,400,tree,0.32904714568840926,0.9910368346068651,none,0.9071629755301025,1.0582819838557602,0.1569305638830993,uniform,0.5692968382779836,0.7881324139470711,0.8488074521445389,0.8468468468468469,0.32904714568840926,0.7211629224089107,0.7151561309977151,0.9910368346068651,0.8288371795819367,0.8219297515571582,0.6454883406556269,0.644253859348199,0.8169375534644996,0.803594351732991,none,0.9280092563014003,0.9257430232335172,0.9071629755301025,COMPLETE
2518,0.7166591827570723,2025-09-24 01:29:48.933086,2025-09-24 01:29:49.774599,0 days 00:00:00.841513,0.004281054166002138,gbtree,0.831431137129479,1.9524478570201098,depthwise,0.006472630193086898,0.09614182455455782,10,5,0.3410565790662573,400,,0.3286618022302647,0.9368720464640358,none,0.9936491514338179,0.5650304243033574,,,,0.6321468669451612,0.8694851059473846,0.8708026208026208,0.3286618022302647,0.7153382451440053,0.7166591827570723,0.9368720464640358,0.8239773632297914,0.8228231947149152,0.7482484820177487,0.7538970240906944,0.6852010265183918,0.6829268292682927,none,0.9257106065854334,0.9251894493957157,0.9936491514338179,COMPLETE
2519,0.7164179104477612,2025-09-24 01:29:49.924179,2025-09-24 01:30:46.834328,0 days 00:00:56.910149,0.002558442092441903,dart,0.41530922475676724,0.08003326967670027,lossguide,0.0005379638009164757,0.021017564856183064,5,12,0.1398120696358172,800,forest,0.48985572672875854,0.9327825526217595,none,0.8675068991855843,1.354261097267067,0.35980266077969114,weighted,0.5359465681342538,0.37976274038736796,0.8698945644385301,0.8696764946764947,0.48985572672875854,0.7184939091915836,0.7164179104477612,0.9327825526217595,0.8258646315101483,0.8172138361786215,0.7450620119430409,0.7472118959107806,0.6937553464499572,0.6880616174582799,none,0.9260461429065279,0.9237769968376012,0.8675068991855843,COMPLETE
2520,0.7028349989802162,2025-09-24 01:30:46.983548,2025-09-24 01:30:48.014781,0 days 00:00:01.031233,0.0002722925715093491,gbtree,0.8290019240718096,7.961243735358741,depthwise,0.00011627322807917405,0.03906571792617106,5,12,0.24234653414595694,600,,0.5965957105035874,0.8165574937362856,none,0.9724657762811919,2.3914237288061013,,,,0.4708303171359138,0.8559729757395844,0.8508394758394758,0.5965957105035874,0.7154701718907988,0.7028349989802162,0.8165574937362856,0.8072618674058947,0.7942742287343587,0.6785577291906406,0.671473109898675,0.7566295979469632,0.7372700042789901,none,0.9212167107045497,0.9159813286083054,0.9724657762811919,COMPLETE
2521,0.7054518843761435,2025-09-24 01:30:48.164715,2025-09-24 01:30:51.006779,0 days 00:00:02.842064,0.012536305262103191,gbtree,0.21457701329341577,1.5297659586421168,lossguide,0.0014900698799478597,0.09827274851892077,1,12,0.2966520602823422,400,,0.6783224645239501,0.9612602064697411,oversample,0.8572288161868739,3.807450608052136,,,,0.615695068711038,0.8343740403316614,0.8351760851760852,0.6783224645239501,0.7076255872786411,0.7054518843761435,0.9612602064697411,0.821629592195849,0.8116514791750493,0.6126408010012515,0.6161713007350591,0.8374679213002566,0.8249893025246042,oversample,0.9243023843310553,0.9206480536640991,0.8572288161868739,COMPLETE
2522,0.6787901990811639,2025-09-24 01:30:51.157652,2025-09-24 01:31:37.386486,0 days 00:00:46.228834,0.005193454340151218,dart,0.3040430439004,4.138545373349247,lossguide,0.004438025050823429,0.018385935415338752,6,11,0.10745840903774485,800,forest,0.33494146902593364,0.8885992444338944,none,0.8007465665964831,0.997038183010738,0.21442345882391783,weighted,0.8998644606125076,0.3709781726550953,0.8290510799467704,0.8282145782145782,0.33494146902593364,0.6811760213822069,0.6787901990811639,0.8885992444338944,0.7531392071944366,0.7471656088846923,0.6151724137931035,0.6141323172843782,0.7630453378956373,0.7586649550706034,none,0.8995825466547729,0.9014139900232906,0.8007465665964831,COMPLETE
2523,0.0,2025-09-24 01:31:37.533879,2025-09-24 01:31:38.943402,0 days 00:00:01.409523,0.002113046064734722,gbtree,0.28092008949713043,6.511689192341601,depthwise,3.2193588165793416,0.00017210894240016935,9,9,0.1880160011539384,700,,0.6985835242593288,0.8285804732761468,undersample,0.8535135323628026,0.5712367933564229,,,,0.8951694399170123,0.7606715119254785,0.7607493857493858,0.6985835242593288,0.0,0.0,0.8285804732761468,0.7710227181963138,0.7656430432277676,0.0,0.0,0.0,0.0,undersample,0.9055615915064156,0.905635253258807,0.8535135323628026,COMPLETE
2524,0.6923076923076923,2025-09-24 01:31:39.096872,2025-09-24 01:31:48.083311,0 days 00:00:08.986439,0.08040931132708005,dart,0.2754870543151654,3.494234110178542,lossguide,0.30351770299077513,0.017857121511390864,5,10,1.3679941417600217,300,forest,0.6190840188375035,0.8511983761959308,none,0.9966273995561471,4.924762641477702,0.1271275988514757,weighted,0.6934991708286571,0.8386204478231644,0.8232162964479476,0.8230958230958231,0.6190840188375035,0.6950379657425393,0.6923076923076923,0.8511983761959308,0.7871248855564824,0.7734008792287708,0.5918796992481203,0.5928636779505947,0.8417450812660393,0.8318356867779204,none,0.9151334277059814,0.911116086279321,0.9966273995561471,COMPLETE
2525,0.6990713297767239,2025-09-24 01:31:48.230559,2025-09-24 01:31:48.916650,0 days 00:00:00.686091,0.003324034015728665,gbtree,0.7758645802362872,8.826371938830409,depthwise,0.00034506072581073254,0.18632450070474155,0,11,97.65034899156257,300,,0.6965364545416415,0.9061984533600601,none,0.8264537255938675,4.322654845533518,,,,0.8861730148336576,0.8440986794963661,0.844082719082719,0.6965364545416415,0.7023646667969513,0.6990713297767239,0.9061984533600601,0.7992414002966137,0.7870664015126749,0.6466354803886291,0.6494126284875184,0.7686056458511549,0.7569533590072742,none,0.9159702971357015,0.9126278694527378,0.8264537255938675,COMPLETE
2526,0.0,2025-09-24 01:31:49.065597,2025-09-24 01:31:49.829238,0 days 00:00:00.763641,37.944407261927395,gbtree,0.899315591573551,8.238151406981267,depthwise,2.2515388496073125,0.0007747353837814526,4,5,20.90556949372421,200,,0.557533060156725,0.710012059802229,oversample,0.8790313937147407,0.9962608739976299,,,,0.6730335108825802,0.7606715119254785,0.7607493857493858,0.557533060156725,0.0,0.0,0.710012059802229,0.728130000984656,0.7219938461032339,0.0,0.0,0.0,0.0,oversample,0.8831377846418014,0.8799210042330965,0.8790313937147407,COMPLETE
2527,0.6983715766099186,2025-09-24 01:31:49.978562,2025-09-24 01:32:51.156619,0 days 00:01:01.178057,0.0009626849312490474,dart,0.2220262310617726,0.15728873820555017,lossguide,0.010881679047826791,0.04581811735361384,7,9,2.5493462843161376,900,forest,0.4818190624787953,0.9674604541844312,none,0.9185894360198823,2.353738622158219,0.10458437698424904,weighted,0.3988436229557646,0.5126635166551629,0.8394922714709796,0.8331285831285832,0.4818190624787953,0.711658698050754,0.6983715766099186,0.9674604541844312,0.804299336086782,0.7943728695368717,0.6241935483870967,0.615259210955331,0.8276304533789564,0.8074454428754814,none,0.9198851849332075,0.9161826674468008,0.9185894360198823,COMPLETE
2528,0.7002341920374707,2025-09-24 01:32:51.311050,2025-09-24 01:32:52.154318,0 days 00:00:00.843268,0.03625734662486462,gbtree,0.755543208827606,0.9652807560266118,depthwise,0.0014038877074945917,0.02413705007444263,10,7,0.1257767872112058,200,,0.4410185052754007,0.9565730865019213,none,0.8672723278086799,0.9015136308755087,,,,0.7491037492601771,0.8711229399119664,0.868959868959869,0.4410185052754007,0.7074134324889612,0.7002341920374707,0.9565730865019213,0.8235197640206096,0.8165908254620428,0.7745547073791349,0.7734092084842215,0.65098374679213,0.6397090286692341,none,0.9251633994828268,0.9224846623452954,0.8672723278086799,COMPLETE
2529,0.7115207373271889,2025-09-24 01:32:52.305195,2025-09-24 01:33:27.925430,0 days 00:00:35.620235,0.00011490356670454806,dart,0.8887429097517674,7.331285578166287,depthwise,0.0011778605984830285,0.007112987289231802,3,12,0.41013554657497264,700,forest,0.6354251696840714,0.9836346977853031,none,0.927882359020947,2.038290743912464,0.19378822178752497,weighted,0.643840846552998,0.4827813915139032,0.8724536800081891,0.8718263718263718,0.6354251696840714,0.7159142726858185,0.7115207373271889,0.9836346977853031,0.8248602312194122,0.8168213766402119,0.7666015625,0.7708437343984024,0.6715141146278871,0.660676080445015,none,0.9259825409449859,0.9235065872321174,0.927882359020947,COMPLETE
2530,0.7151597552685248,2025-09-24 01:33:28.081810,2025-09-24 01:33:29.994046,0 days 00:00:01.912236,0.0014484815398194207,gbtree,0.3587355050636537,0.7013604377084934,lossguide,0.005332192955874701,0.052513723989288295,2,8,0.5875084287778918,300,,0.6633324733638556,0.9666355590797898,none,0.9572486432522466,2.4276587628740844,,,,0.9536494456345107,0.8730678677449074,0.8713144963144963,0.6633324733638556,0.720972097209721,0.7151597552685248,0.9666355590797898,0.8329993625262542,0.8282096493846913,0.7606837606837606,0.7601156069364162,0.6852010265183918,0.675224646983312,none,0.9297820818366725,0.9283911486459911,0.9572486432522466,COMPLETE
2531,0.38612143742255267,2025-09-24 01:33:30.141891,2025-09-24 01:33:30.978729,0 days 00:00:00.836838,0.1439212821084389,gbtree,0.9398363145894624,3.2588351596945735,depthwise,9.132235048156573,0.0007231428198791601,2,6,18.87327537553847,300,,0.4561542166582726,0.5882348181856292,undersample,0.8319392794867135,4.679110456275784,,,,0.6493772829058654,0.23932848807452145,0.23925061425061425,0.4561542166582726,0.3862228462872718,0.38612143742255267,0.5882348181856292,0.7393851855647806,0.7304840089097557,0.23932848807452145,0.23925061425061425,1.0,1.0,undersample,0.8913739796489839,0.8849987564958623,0.8319392794867135,COMPLETE
2532,0.5859030837004405,2025-09-24 01:33:31.128336,2025-09-24 01:33:31.829759,0 days 00:00:00.701423,0.0020118716832749225,gbtree,0.8922242062366075,4.296109972129341,depthwise,0.6006304629541813,0.046393941458306207,0,12,68.15785175797626,300,,0.45273957487936406,0.6871536519854112,undersample,0.5794114095240697,3.7611260846373087,,,,0.3861500774333321,0.6663936943392363,0.6728091728091729,0.45273957487936406,0.5814819571080005,0.5859030837004405,0.6871536519854112,0.7491565419518962,0.7508796131349363,0.4154890805652413,0.4201821222821037,0.9683490162532079,0.967479674796748,undersample,0.8999051611293821,0.9000521241002734,0.5794114095240697,COMPLETE
2533,0.569811320754717,2025-09-24 01:33:31.977876,2025-09-24 01:33:50.620668,0 days 00:00:18.642792,1.2582170649378543,dart,0.8834464537845139,7.946449530221875,depthwise,1.4847581882573246,0.0013492238301136337,9,12,56.343083501422186,500,forest,0.5278259797936758,0.8595499381432188,oversample,0.5021359427663699,2.695628134530781,0.04519121863320174,weighted,0.6880879261891493,0.49561145651995686,0.6484798853516225,0.6498771498771498,0.5278259797936758,0.5706426606651663,0.569811320754717,0.8595499381432188,0.769305026570931,0.764119829363429,0.4031802120141343,0.4035275253874933,0.9760479041916168,0.9691912708600771,oversample,0.9035941612363254,0.9015567094030161,0.5021359427663699,COMPLETE
2534,0.7184838160136287,2025-09-24 01:33:50.766544,2025-09-24 01:33:51.550860,0 days 00:00:00.784316,0.001311052680580385,gbtree,0.9373543631245583,4.950352794738478,lossguide,0.002394182379051445,0.28292145628393967,10,5,0.10641449583643747,500,,0.40876530143184314,0.9639335029215966,none,0.9815706610521696,1.0115583257831366,,,,0.8684331574064599,0.8654928856587163,0.8646601146601146,0.40876530143184314,0.7205444491705657,0.7184838160136287,0.9639335029215966,0.8223983532516407,0.8175715155949734,0.7165820642978004,0.7151335311572701,0.7245508982035929,0.7218656397090286,none,0.9259880089869283,0.9240883767229615,0.9815706610521696,COMPLETE
2535,0.38612143742255267,2025-09-24 01:33:51.717940,2025-09-24 01:35:00.334992,0 days 00:01:08.617052,0.033236183166738625,dart,0.6966224792494992,3.1535194633169072,depthwise,0.10875076227074881,0.00011574926558956117,6,6,30.67118460711466,1000,tree,0.39595447074982115,0.6220189166987373,oversample,0.9034249624863453,2.700960338419083,0.20264642041221537,weighted,0.7872071175174195,0.2909944776652046,0.23932848807452145,0.23925061425061425,0.39595447074982115,0.3862228462872718,0.38612143742255267,0.6220189166987373,0.744168052768623,0.7388832879845058,0.23932848807452145,0.23925061425061425,1.0,1.0,oversample,0.8926058143819633,0.8903103531810874,0.9034249624863453,COMPLETE
2536,0.7077199281867146,2025-09-24 01:35:00.484964,2025-09-24 01:35:20.379011,0 days 00:00:19.894047,0.028938576824125328,dart,0.3213155314166761,0.6738545048224391,lossguide,0.00010568165357182885,0.16623481422443534,5,8,1.3801505396323088,500,forest,0.44344838287482174,0.9529955650821696,none,0.9653884882973929,2.538642053975284,0.11225919863136202,weighted,0.5349782481273545,0.5500160964535031,0.8281297983416931,0.8333333333333334,0.44344838287482174,0.7014049439800818,0.7077199281867146,0.9529955650821696,0.824520097678671,0.8180735584747215,0.6003044140030441,0.6096504794308691,0.8434559452523525,0.8433889602053916,none,0.9259467684390145,0.9243144762365756,0.9653884882973929,COMPLETE
2537,0.7016931401640775,2025-09-24 01:35:20.527258,2025-09-24 01:35:22.162061,0 days 00:00:01.634803,0.001012210905028444,gbtree,0.4863549254017737,0.7465594135786761,depthwise,0.005477598048215031,0.05454597767523711,1,7,0.9570571948635465,800,,0.697378332058604,0.9413023763749362,oversample,0.9629203183207202,4.5928033090857845,,,,0.5560049599167025,0.8227044733340158,0.82504095004095,0.697378332058604,0.6987826086956521,0.7016931401640775,0.9413023763749362,0.8233724035290121,0.8199144413819557,0.5888042203985931,0.5925707547169812,0.8592814371257484,0.8600770218228498,oversample,0.9246240203139485,0.9244823593721775,0.9629203183207202,COMPLETE
2538,0.6995422388680815,2025-09-24 01:35:22.316060,2025-09-24 01:35:23.358231,0 days 00:00:01.042171,0.27357478032520116,gbtree,0.376613242219057,1.7350219754155245,depthwise,0.0009194643804469089,0.21292774780875587,1,12,0.1866380940794333,700,,0.6779319828040118,0.9020857608578687,none,0.81367595021076,4.068278297275164,,,,0.854843509616888,0.8533114955471389,0.8521703521703522,0.6779319828040118,0.7053259304955789,0.6995422388680815,0.9020857608578687,0.7996236952108161,0.7863078585337189,0.6792079207920793,0.6808424463345484,0.7335329341317365,0.7192982456140351,none,0.9165193461050678,0.9109478864374093,0.81367595021076,COMPLETE
2539,0.6691410392364793,2025-09-24 01:35:23.507933,2025-09-24 01:35:41.696482,0 days 00:00:18.188549,0.12363462855210924,dart,0.20261426708055075,1.6420743059248772,lossguide,0.02790242993057062,0.011212993659073535,5,10,0.2546127242867801,500,tree,0.38207357301722383,0.8359022871112848,none,0.8540769843084298,1.6324899487712299,0.24193207285764243,weighted,0.5062535116459115,0.22653263229902645,0.8006960794349472,0.8083538083538083,0.38207357301722383,0.6594367675354207,0.6691410392364793,0.8359022871112848,0.7321780102394219,0.7217711240663625,0.5578573542468186,0.5700090334236676,0.8062446535500428,0.810012836970475,none,0.8920826091055676,0.8930515614571185,0.8540769843084298,COMPLETE
2540,0.6754161331626121,2025-09-24 01:35:41.850788,2025-09-24 01:36:52.114321,0 days 00:01:10.263533,0.07140069211932287,dart,0.2451561630611245,1.2980875049911735,lossguide,0.0257305370236056,0.07858183817508516,7,9,0.28468508654405555,1000,forest,0.4386747726286608,0.8699390587788489,undersample,0.8726702820789976,1.2180219577991018,0.1920890747272198,weighted,0.7675978637833876,0.4821004295993786,0.7850342921486334,0.7923832923832924,0.4386747726286608,0.6686651940675292,0.6754161331626121,0.8699390587788489,0.8111711131502866,0.8071389628959789,0.52975,0.5395039631807722,0.9063301967493584,0.9028669234060762,undersample,0.9188866341369974,0.918522752785907,0.8726702820789976,COMPLETE
2541,0.6795933734939759,2025-09-24 01:36:52.260607,2025-09-24 01:37:26.374843,0 days 00:00:34.114236,0.001586576900640543,dart,0.683216048673796,3.9900086431418638,depthwise,0.00013365762872152574,0.2502572139237954,5,12,0.11628613197082631,700,tree,0.628740918350287,0.9623322555904874,oversample,0.9485371443502127,1.4993978888884625,0.20098544967485926,uniform,0.48098257801686867,0.5750499113725431,0.8238304841846658,0.8257575757575758,0.628740918350287,0.6768075117370892,0.6795933734939759,0.9623322555904874,0.7497338355170229,0.7402458727579384,0.6032808838299297,0.6067226890756302,0.7707442258340462,0.7723577235772358,oversample,0.8981532004909957,0.8985719539748571,0.9485371443502127,COMPLETE
2542,0.6820856157435585,2025-09-24 01:37:26.524882,2025-09-24 01:38:22.842110,0 days 00:00:56.317228,0.02272840187087475,dart,0.42736653383729745,1.305954796431583,lossguide,0.00010674204761894576,0.0011682898444372969,10,5,5.2084837958178145,900,forest,0.624682448195834,0.9883496219783459,none,0.8350958141072949,3.881732564875555,0.12227757450371969,weighted,0.8140572627862998,0.4214894920079049,0.8401064592076978,0.8395782145782146,0.624682448195834,0.6879744306831802,0.6820856157435585,0.9883496219783459,0.7759853545931441,0.767711854581171,0.6454272863568216,0.6485339506172839,0.7365269461077845,0.7192982456140351,none,0.9069120251912116,0.9040951680578999,0.8350958141072949,COMPLETE
2543,0.6332461493751816,2025-09-24 01:38:22.992475,2025-09-24 01:38:23.678279,0 days 00:00:00.685804,0.006937993120774814,gbtree,0.7383950982323736,3.6842737351547328,depthwise,0.0015589734792556267,0.317180496457199,9,5,0.31318568642915307,400,,0.33969446651979723,0.8158725406211292,undersample,0.8125645286957104,1.2261630684111393,,,,0.8904217866089394,0.7350803562288873,0.7416052416052417,0.33969446651979723,0.6260115606936416,0.6332461493751816,0.8158725406211292,0.7406539974967199,0.7421699744031626,0.4727193365342645,0.4794279427942794,0.9264328485885372,0.9323919554985024,undersample,0.89647908750237,0.9004810596094827,0.8125645286957104,COMPLETE
2544,0.0,2025-09-24 01:38:23.831416,2025-09-24 01:38:24.509629,0 days 00:00:00.678213,0.4319389905046806,gbtree,0.5662015840677976,6.370393336687249,lossguide,25.723043473705772,0.00027282773306095467,9,3,3.8393340183394913,200,,0.6119509655818122,0.7768907428285948,none,0.8551594528224685,1.6465865278525096,,,,0.8127942568170414,0.7606715119254785,0.7607493857493858,0.6119509655818122,0.0,0.0,0.7768907428285948,0.6349862056845764,0.6329222554118811,0.0,0.0,0.0,0.0,none,0.8659163304396456,0.8679066927932098,0.8551594528224685,COMPLETE
2545,0.6841343835396239,2025-09-24 01:38:24.657626,2025-09-24 01:38:25.818184,0 days 00:00:01.160558,0.005921183684086274,gbtree,0.7258458731135212,3.7526976733831967,depthwise,0.0006444805243056327,0.0627098331307837,5,9,1.9725097731748367,800,,0.5651232162477465,0.9432677159281563,undersample,0.9851049532802831,2.5197024063652798,,,,0.5468641487196965,0.7923021803664654,0.7988329238329238,0.5651232162477465,0.6758268093944719,0.6841343835396239,0.9432677159281563,0.8128120190443295,0.8115531517295473,0.5394032134659525,0.5478887744593203,0.9046193327630453,0.9105691056910569,undersample,0.9216624424603703,0.9217345866380917,0.9851049532802831,COMPLETE
