number,value,datetime_start,datetime_complete,duration,params_alpha,params_booster,params_colsample_bytree,params_gamma,params_grow_policy,params_lambda,params_learning_rate,params_max_delta_step,params_max_depth,params_min_child_weight,params_n_estimators,params_normalize_type,params_params_decision_threshold,params_params_feature_fraction,params_params_resampling,params_params_sample_rows,params_params_scale_pos_weight,params_rate_drop,params_sample_type,params_skip_drop,params_subsample,user_attrs_acc_test,user_attrs_acc_val,user_attrs_decision_threshold,user_attrs_f1_test,user_attrs_f1_val,user_attrs_feature_fraction,user_attrs_pr_auc_test,user_attrs_pr_auc_val,user_attrs_prec_test,user_attrs_prec_val,user_attrs_rec_test,user_attrs_rec_val,user_attrs_resampling_strategy,user_attrs_roc_auc_test,user_attrs_roc_auc_val,user_attrs_sample_rows,state
1465,0.7108695652173913,2025-09-23 18:28:20.465688,2025-09-23 18:28:21.034644,0 days 00:00:00.568956,0.04530648987983016,gbtree,0.52040627690665,3.498053670673176,lossguide,0.0007528633776845319,0.45576138971579855,9,5,0.9394267447765087,400,,0.3167069425621194,0.7640776551312269,none,0.9364985677536913,0.631169213856864,,,,0.9468173396909674,0.8652881564131436,0.8638411138411138,0.3167069425621194,0.7152747728256166,0.7108695652173913,0.7640776551312269,0.8197622191952971,0.8153216543965655,0.7237302977232924,0.722492266902342,0.7070145423438836,0.699614890885751,none,0.9243103561606241,0.9217004687310966,0.9364985677536913,COMPLETE
1466,0.6810733792448349,2025-09-23 18:28:21.169641,2025-09-23 18:29:05.110562,0 days 00:00:43.940921,11.656704226369447,dart,0.3968367105540496,1.7503412830707152,depthwise,0.002703025411642665,0.4955633933117627,6,10,0.9429895843208566,800,forest,0.5125686978287047,0.9853932285175866,none,0.8261282543079027,1.1358310106447533,0.18936132800632133,uniform,0.6989883416961219,0.7434391625217341,0.8679496366055891,0.8625102375102375,0.5125686978287047,0.6961846443711729,0.6810733792448349,0.9853932285175866,0.8142626472496717,0.8032725130628202,0.7746331236897275,0.7652081109925294,0.632164242942686,0.613607188703466,none,0.9211903489865532,0.9181332040250262,0.8261282543079027,COMPLETE
1467,0.7142857142857143,2025-09-23 18:29:05.245222,2025-09-23 18:29:19.113421,0 days 00:00:13.868199,0.0008477426865743635,dart,0.9349239514113595,6.807132232636104,lossguide,0.0008396411211803019,0.009481295291983785,1,10,8.982337405222424,400,forest,0.69602139097525,0.8757004561091015,none,0.8909017598119424,3.548856432063963,0.09007897526348937,uniform,0.7006982654808909,0.9108284927918493,0.8643668748080663,0.8652743652743653,0.69602139097525,0.7143780987281741,0.7142857142857143,0.8757004561091015,0.818446271841535,0.8117446986825445,0.7201216862233811,0.7249889819303658,0.7087254063301968,0.7038938810440736,none,0.9228893559556013,0.9208618880060843,0.8909017598119424,COMPLETE
1468,0.7132399079690441,2025-09-23 18:29:19.249145,2025-09-23 18:29:21.225491,0 days 00:00:01.976346,0.000744270366471802,gbtree,0.6837973381262494,4.5886588010503955,depthwise,2.0963923290800013,0.0051779091381296185,1,12,0.32094485857180294,600,,0.6172998737446928,0.8908729181564242,none,0.9771031986454649,2.6568104649477533,,,,0.8524547402895531,0.8611935715016891,0.8596437346437347,0.6172998737446928,0.7187888842803816,0.7132399079690441,0.8908729181564242,0.8170786958244358,0.8078066101697401,0.6976650563607085,0.6976268412438625,0.7412318220701454,0.7295678219940094,none,0.9237108573095463,0.9208537400164813,0.9771031986454649,COMPLETE
1469,0.7078026905829596,2025-09-23 18:29:21.364235,2025-09-23 18:29:22.077324,0 days 00:00:00.713089,0.10376795133038402,gbtree,0.2903265678621826,3.2099719796827832,lossguide,0.00021824240526978472,0.06821742072146052,6,6,6.884067843322953,200,,0.4445574010144518,0.8906105960457094,none,0.7057458394146698,2.3903436639536637,,,,0.6226152232477324,0.8303818200429931,0.8332309582309583,0.4445574010144518,0.7075022065313328,0.7078026905829596,0.8906105960457094,0.8225890549366291,0.8157128084207808,0.6023444544634806,0.6093267449042619,0.8571428571428571,0.844244758237056,none,0.924846224270992,0.9235457436485845,0.7057458394146698,COMPLETE
1470,0.6817008090893442,2025-09-23 18:29:22.211288,2025-09-23 18:29:25.294330,0 days 00:00:03.083042,0.0004245237324536545,dart,0.7333313249973419,3.3532548975466328,depthwise,0.0007409056260391895,0.022521287510535195,8,3,2.2497953767170764,200,forest,0.3609071910490241,0.968760790451259,none,0.994929299001376,1.5626666269083602,0.16676440448228613,uniform,0.6880450140873979,0.6830078674960746,0.8053024874603337,0.8107084357084358,0.3609071910490241,0.6781725888324873,0.6817008090893442,0.968760790451259,0.7901534753994356,0.7820695057905303,0.561030235162374,0.5702764976958525,0.8571428571428571,0.8472400513478819,none,0.9101620278676743,0.9085907853320294,0.994929299001376,COMPLETE
1471,0.6713798147245246,2025-09-23 18:29:25.430471,2025-09-23 18:29:26.427591,0 days 00:00:00.997120,10.525800841022162,gbtree,0.9857788190782147,4.573662426164244,lossguide,0.00016432713913957898,0.014418709799614767,8,6,2.0348102031779653,400,,0.370726982493706,0.9878927035552559,none,0.9506465171885996,0.6409703368612335,,,,0.6635513669781443,0.8627290408434845,0.861998361998362,0.370726982493706,0.6756952841596131,0.6713798147245246,0.9878927035552559,0.8051394896783429,0.7979316311463291,0.7774067890929327,0.7801699716713881,0.5975192472198461,0.5892169448010269,none,0.9157547699456615,0.9130255662032217,0.9506465171885996,COMPLETE
1472,0.6595647542231015,2025-09-23 18:29:26.561811,2025-09-23 18:29:27.084928,0 days 00:00:00.523117,0.01088100196316852,gbtree,0.36585457746763694,4.463224875471102,lossguide,0.0005906043652255895,0.34327154858256453,9,8,1.7559415830228804,200,,0.3173980909373024,0.8773184827429793,undersample,0.9543068177295533,1.008990539513368,,,,0.7591158481069366,0.7657897430647969,0.770986895986896,0.3173980909373024,0.6556291390728477,0.6595647542231015,0.8773184827429793,0.8168446974412293,0.8084213963137039,0.5058058522991176,0.5118091639111951,0.9315654405474765,0.9272571673085152,undersample,0.9213828816212664,0.9196892972903127,0.9543068177295533,COMPLETE
1473,0.7158469945355191,2025-09-23 18:29:27.221796,2025-09-23 18:29:28.086880,0 days 00:00:00.865084,0.13123290936794255,gbtree,0.5505936103904543,2.165193402657149,depthwise,0.00018476386956155162,0.02134712505438876,7,9,3.5226965389503735,300,,0.3996426156213851,0.9951628814065505,none,0.5954815980546524,1.0296756149805701,,,,0.4588062096055933,0.8634455932029891,0.8615888615888616,0.3996426156213851,0.7226611226611227,0.7158469945355191,0.9951628814065505,0.8225325442883056,0.8146763820553485,0.7030744336569579,0.7034283353985956,0.7433704020530368,0.7287120239623449,none,0.9245901760122411,0.9223665021003098,0.5954815980546524,COMPLETE
1474,0.7094217258151685,2025-09-23 18:29:28.222238,2025-09-23 18:29:28.838628,0 days 00:00:00.616390,0.00015795895012409567,gbtree,0.6642783029067393,4.572480074622153,lossguide,0.001025756220000633,0.4605889886033168,5,5,0.3853811304993188,500,,0.36230445221624746,0.9753547009221881,none,0.9827084304062945,1.5985313647494417,,,,0.9896644747887213,0.8327362063670796,0.8348689598689598,0.36230445221624746,0.7087344028520499,0.7094217258151685,0.9753547009221881,0.8261257553333609,0.8178213351996059,0.6075794621026895,0.6126322339763535,0.8502994011976048,0.842533162173727,none,0.9268148920453114,0.9236466865869178,0.9827084304062945,COMPLETE
1475,0.7090544725815267,2025-09-23 18:29:28.975134,2025-09-23 18:29:36.009922,0 days 00:00:07.034788,15.15584015666442,dart,0.7147383840266315,5.4905945759582115,lossguide,0.00627891716600807,0.33101940068806135,8,12,21.16287360975132,300,forest,0.5616220091897898,0.9173925571063639,none,0.91809776577783,3.503642370891895,0.26186226127084417,weighted,0.8932748274738151,0.8314563564684296,0.8346811342000204,0.8365069615069615,0.5616220091897898,0.7091662164595715,0.7090544725815267,0.9173925571063639,0.8184717038331217,0.8120440132682314,0.6124416796267496,0.6173857868020305,0.8421727972626176,0.832691484809585,none,0.9242141474016037,0.9217943001732039,0.91809776577783,COMPLETE
1476,0.6665638970248189,2025-09-23 18:29:36.143980,2025-09-23 18:29:36.938058,0 days 00:00:00.794078,0.011995657951399364,gbtree,0.9021192754939596,2.265388971475349,depthwise,0.0005847201701347252,0.08814120834784374,7,8,2.7900311925057943,400,,0.3538506204263628,0.9611263741734708,undersample,0.9800491032689924,1.3220988732728314,,,,0.6861430924460394,0.7741836421332787,0.7785626535626535,0.3538506204263628,0.6636169563891431,0.6665638970248189,0.9611263741734708,0.8170512051479992,0.8091885068959819,0.5156398104265403,0.5209638554216868,0.93071000855432,0.9251176722293539,undersample,0.9236823083747725,0.9206575260619061,0.9800491032689924,COMPLETE
1477,0.7208242520309095,2025-09-23 18:29:37.074203,2025-09-23 18:30:03.042080,0 days 00:00:25.967877,0.0031995250154272267,dart,0.9894177847583601,5.591564021887034,depthwise,0.042389295340483246,0.17921076585975956,0,11,2.7924725196273203,600,forest,0.6220090922562796,0.8663614858262724,none,0.8694170866689843,3.3688599941825137,0.07539484559888826,uniform,0.6019391834057835,0.8714264761932887,0.8527996724332071,0.8557534807534808,0.6220090922562796,0.7184808144087705,0.7208242520309095,0.8663614858262724,0.8253570049689243,0.8148053233566256,0.6624548736462094,0.6712177121771218,0.7848588537211292,0.7783483097988875,none,0.9265304099684593,0.9234437930083569,0.8694170866689843,COMPLETE
1478,0.7116225546605294,2025-09-23 18:30:03.177004,2025-09-23 18:30:14.501925,0 days 00:00:11.324921,0.0007943067096393341,dart,0.904222744409798,5.5944997326890284,depthwise,0.031086164065872703,0.15529190960028932,0,11,4.924113808419451,400,forest,0.6578723557277731,0.7604688237090146,none,0.8880466311873362,2.0798013919950082,0.001272380757051994,uniform,0.4975025821041452,0.9052289219965293,0.86764254273723,0.8717239967239967,0.6578723557277731,0.7036442814577126,0.7116225546605294,0.7604688237090146,0.8220329708384272,0.8182021202201464,0.7580246913580246,0.7699203187250996,0.6565440547476475,0.6615318784766795,none,0.9249821770611842,0.9243334498236724,0.8880466311873362,COMPLETE
1479,0.7131818181818181,2025-09-23 18:30:14.636579,2025-09-23 18:30:26.138323,0 days 00:00:11.501744,0.00010295163190866011,dart,0.3937620245081135,0.4478762916743573,depthwise,0.00019290883623355863,0.17041373459084413,5,5,3.4815118085708057,400,forest,0.34975490608359244,0.8397216866094903,none,0.9662273214443687,0.6187063187272477,0.0689753211171047,uniform,0.5809864604305259,0.9557343554534313,0.8708158460436073,0.8708026208026208,0.34975490608359244,0.7140915269596738,0.7131818181818181,0.8397216866094903,0.8256160802722614,0.8234217358272264,0.7591522157996147,0.7605428986912264,0.6740804106073567,0.6713735558408216,none,0.9264576274522873,0.9257084734542818,0.9662273214443687,COMPLETE
1480,0.7087218869994515,2025-09-23 18:30:26.273988,2025-09-23 18:31:11.284015,0 days 00:00:45.010027,0.08201571396153845,dart,0.9398688068465051,4.749319328701905,depthwise,0.023616599238759535,0.11510954681983863,3,10,7.080984644353641,800,forest,0.6054040163033165,0.9017275021086829,none,0.8398888455983,4.748743768043139,0.0993450745310589,uniform,0.6305718265289799,0.9438750862637567,0.8371378851468932,0.836916461916462,0.6054040163033165,0.7097245028279511,0.7087218869994515,0.9017275021086829,0.824816838705382,0.8177546950724264,0.6188355074769328,0.6187739463601533,0.8319076133447391,0.8292682926829268,none,0.9258408611003381,0.9234910974144269,0.8398888455983,COMPLETE
1481,0.6999140154772141,2025-09-23 18:31:11.418451,2025-09-23 18:31:36.724221,0 days 00:00:25.305770,0.9615731159778707,dart,0.8125368638331043,6.403729476278514,depthwise,0.05500492674072378,0.18679764050334613,2,10,13.953076624726188,600,forest,0.6131465453751206,0.8177950231522609,oversample,0.7742539676661212,2.1039577577403197,0.0639078378014869,uniform,0.6293341250352472,0.8862452920093781,0.8165625959668339,0.8213554463554463,0.6131465453751206,0.6955487597689433,0.6999140154772141,0.8177950231522609,0.8208702614162997,0.8161741475829132,0.576944757609921,0.5851063829787234,0.8755346449957229,0.8707744972186564,oversample,0.923985784702583,0.923342648529645,0.7742539676661212,COMPLETE
1482,0.7044343891402715,2025-09-23 18:31:36.859857,2025-09-23 18:31:37.561907,0 days 00:00:00.702050,1.9323129991637904,gbtree,0.880763471373252,1.5099771443728467,lossguide,0.002570551400080863,0.027311402164665134,9,4,0.19743947614189034,300,,0.45433178211428493,0.9826000020066402,undersample,0.9694410227026903,0.6389984786409736,,,,0.657921647921834,0.8301770907974204,0.8328214578214578,0.45433178211428493,0.7016723610861356,0.7044343891402715,0.9826000020066402,0.813036220047101,0.8053129118187636,0.605336642879305,0.6104140526976161,0.8344739093242087,0.832691484809585,undersample,0.9210238614989872,0.9194583608076057,0.9694410227026903,COMPLETE
1483,0.7164066904717158,2025-09-23 18:31:37.699574,2025-09-23 18:31:38.330112,0 days 00:00:00.630538,0.0008043657894599144,gbtree,0.5320009462647882,3.670411795794033,lossguide,0.0001113277472475591,0.29614223615962026,10,10,0.4511560612582305,200,,0.32021239501877957,0.976322021478082,none,0.9287934711284924,1.208099321615959,,,,0.6980286361415605,0.8445081379875116,0.8455159705159705,0.32021239501877957,0.7173953488372093,0.7164066904717158,0.976322021478082,0.8232716815991026,0.8172809164499999,0.6348370102074415,0.6387399463806971,0.8246364414029085,0.8155755241762944,none,0.9253237282284155,0.9231420582696999,0.9287934711284924,COMPLETE
1484,0.6896430455424652,2025-09-23 18:31:38.464923,2025-09-23 18:31:42.369915,0 days 00:00:03.904992,0.0003078303580539134,gbtree,0.6629763381245692,2.4374052028697673,lossguide,0.00019597237090501063,0.0034357795767686818,2,8,0.21993404868301042,500,,0.48992383350577695,0.9119013672241967,none,0.9909374437286703,2.693604722364252,,,,0.8705054553261847,0.8187122530453476,0.8193079443079443,0.48992383350577695,0.692267593397046,0.6896430455424652,0.9119013672241967,0.8089097029762335,0.8020804322916713,0.5829675153643546,0.5853731343283582,0.8520102651839179,0.8391099700470689,none,0.91856108418724,0.9153668319931186,0.9909374437286703,COMPLETE
1485,0.7090586145648312,2025-09-23 18:31:42.506412,2025-09-23 18:32:10.253522,0 days 00:00:27.747110,0.00010230609010939766,dart,0.9594813176295787,5.450969408182645,depthwise,0.5033565326794737,0.018532091561563532,1,11,1.7313599928637702,600,forest,0.48544197999508354,0.8613157218214743,none,0.9115162209722889,3.0046168128487056,0.008378969173095469,uniform,0.5894917656414919,0.7876247336821471,0.8281297983416931,0.8323095823095823,0.48544197999508354,0.7020408163265306,0.7090586145648312,0.8613157218214743,0.8248558395477068,0.8200424185199912,0.599939338792842,0.6061342241117522,0.8460222412318221,0.8540864356011981,none,0.9263481514967643,0.9246529489071531,0.9115162209722889,COMPLETE
1486,0.7102925243770314,2025-09-23 18:32:10.389237,2025-09-23 18:32:45.529670,0 days 00:00:35.140433,0.00010223997924926486,dart,0.3700934026647291,0.38425929502301615,depthwise,0.0026997560819252255,0.2880378996037236,2,6,0.10207594525196802,700,forest,0.3206551652598676,0.9321453346889901,none,0.9761707524007883,0.6472964311476026,0.06919033125662057,uniform,0.7508666951131366,0.7778667304211032,0.8622172177295526,0.8631244881244882,0.3206551652598676,0.7075184702303347,0.7102925243770314,0.9321453346889901,0.8094541190998021,0.8075338634833291,0.7190812720848057,0.7194907813871817,0.6963216424294268,0.7013264869490801,none,0.9173633239893131,0.9171084863643826,0.9761707524007883,COMPLETE
1487,0.7131689717378232,2025-09-23 18:32:45.664093,2025-09-23 18:32:49.864848,0 days 00:00:04.200755,0.014590184650760321,dart,0.8857043170660507,6.823796714662321,lossguide,11.794995973189977,0.026223314929180692,0,9,11.13362661546934,200,forest,0.6993604343730695,0.9752958742266344,none,0.9912470766167187,4.3265026303952,0.0833684574295181,uniform,0.5416458175802603,0.9751669366244032,0.8556658818712253,0.8535012285012284,0.6993604343730695,0.718337994406712,0.7131689717378232,0.9752958742266344,0.8202313319352506,0.812340222052873,0.6739130434782609,0.670814479638009,0.7690333618477331,0.7612323491655969,none,0.9240058150035934,0.9216533370739228,0.9912470766167187,COMPLETE
1488,0.6149154421957306,2025-09-23 18:32:50.002103,2025-09-23 18:33:56.550168,0 days 00:01:06.548065,0.006166691758886998,dart,0.8302222240370478,7.702352853648184,depthwise,0.0009325814329677813,0.0738862195163945,5,11,0.6189770115615283,1000,forest,0.6813268121037003,0.9918635723578569,none,0.9935838572758678,1.1967888258046782,0.12377535159387057,uniform,0.6437531594256093,0.464248600390679,0.8641621455624936,0.8578009828009828,0.6813268121037003,0.6349381017881706,0.6149154421957306,0.9918635723578569,0.8251095593084077,0.8175595193863856,0.889745566692367,0.8732283464566929,0.49358426005132594,0.47454000855798034,none,0.9262546767587151,0.9241292606283902,0.9935838572758678,COMPLETE
1489,0.6708891595615104,2025-09-23 18:33:56.689449,2025-09-23 18:34:00.311435,0 days 00:00:03.621986,0.31198375061071865,dart,0.8314781094467715,3.67754427349034,lossguide,0.0011884043579705574,0.010442281032125869,10,6,1.1405795946473032,200,forest,0.3505450657583391,0.8793923712046923,none,0.9953111810750743,0.6815595524383206,0.13164215673178434,uniform,0.5897124796815251,0.7495607768672833,0.8628314054662709,0.8616912366912367,0.3505450657583391,0.675701839303001,0.6708891595615104,0.8793923712046923,0.8047236646082582,0.7970172845851158,0.778149386845039,0.7788461538461539,0.5970915312232677,0.5892169448010269,none,0.9137260688266469,0.9126636572657294,0.9953111810750743,COMPLETE
1490,0.7021439509954058,2025-09-23 18:34:00.447071,2025-09-23 18:35:09.771300,0 days 00:01:09.324229,0.0038336330434581545,dart,0.8667014690003307,5.549280861220114,depthwise,7.311753908106734,0.04640486012335008,2,11,6.540093817105348,1000,forest,0.656314182971711,0.7534554011312451,none,0.8745850033637944,4.095241800050387,0.06864382611650573,uniform,0.7250085191842868,0.59283641016212,0.8369331559013206,0.8407043407043407,0.656314182971711,0.7009573868969401,0.7021439509954058,0.7534554011312451,0.8042154910029082,0.7987604112622791,0.6246236199397792,0.6352615171458261,0.7985457656116339,0.7847667950363714,none,0.9158712680182055,0.9140863308002012,0.8745850033637944,COMPLETE
1491,0.719652036378015,2025-09-23 18:35:09.909957,2025-09-23 18:35:11.038238,0 days 00:00:01.128281,0.00337755656956608,gbtree,0.5606759421919285,4.423349848267095,depthwise,0.00020298336114643917,0.06240509887177037,2,12,0.23883773947845804,800,,0.5908278037180537,0.9501774263713829,none,0.719926527698224,3.097113072437482,,,,0.5369072675786081,0.8520831200737026,0.8548321048321048,0.5908278037180537,0.7173870526109916,0.719652036378015,0.9501774263713829,0.8197944569439535,0.8169179755096948,0.6609009009009009,0.6688717383314958,0.7844311377245509,0.7787762088147198,none,0.9243641732050059,0.9229465641021921,0.719926527698224,COMPLETE
1492,0.7101449275362319,2025-09-23 18:35:11.177586,2025-09-23 18:35:46.489706,0 days 00:00:35.312120,0.00034726185374715974,dart,0.9354882773467349,5.128423407676202,depthwise,0.00013025834329643925,0.04746406784635375,5,11,0.17553276462977926,700,forest,0.624932503868284,0.8803171577380974,none,0.9475467051112587,1.9715071995014588,0.11410515625123119,uniform,0.5867478531062561,0.5811313725867405,0.8695874705701709,0.868959868959869,0.624932503868284,0.7121554450971532,0.7101449275362319,0.8803171577380974,0.8266539094867198,0.8220192088266332,0.7547892720306514,0.7542087542087542,0.6740804106073567,0.6709456568249893,none,0.9275789789588594,0.9259594776004281,0.9475467051112587,COMPLETE
1493,0.7114503816793893,2025-09-23 18:35:46.626400,2025-09-23 18:36:23.873691,0 days 00:00:37.247291,0.00366760697238348,dart,0.5651994935273501,9.106119211437305,depthwise,0.3615488249597215,0.0028992867788008156,1,12,0.30665645843247524,700,forest,0.6890990679764802,0.9826799869218688,none,0.8604172968480581,3.74563603852569,0.13832936746096644,weighted,0.7818122217329441,0.957069727587758,0.8638550516941345,0.8645577395577395,0.6890990679764802,0.710239651416122,0.7114503816793893,0.9826799869218688,0.7955459880644709,0.7854838193180169,0.7238010657193605,0.7255338078291815,0.6971770744225834,0.6979032948224219,none,0.9176649296711958,0.9156577123427991,0.8604172968480581,COMPLETE
1494,0.6993006993006993,2025-09-23 18:36:24.009930,2025-09-23 18:36:36.804915,0 days 00:00:12.794985,0.01819848789984679,dart,0.8943153801047151,2.667282651519324,depthwise,0.0009491995009119602,0.10957914710546252,6,12,1.316900784724239,400,forest,0.6999461811225913,0.9999159041546571,none,0.9003508769944318,2.6754067741767757,0.14867040633905237,uniform,0.7212418080450171,0.699202910392639,0.8685638243423073,0.8679361179361179,0.6999461811225913,0.701534170153417,0.6993006993006993,0.9999159041546571,0.8226120738132903,0.8182235973819237,0.7683299389002036,0.7680491551459293,0.6454234388366125,0.6418485237483954,none,0.9253106912652578,0.9238659049361673,0.9003508769944318,COMPLETE
1495,0.6630998702983139,2025-09-23 18:36:36.943200,2025-09-23 18:36:40.117889,0 days 00:00:03.174689,0.00010370591183882147,gbtree,0.8291416947298328,3.5557254156943987,depthwise,0.00013992731063440522,0.002373127247407385,3,12,0.14324715048570116,700,,0.618880419581875,0.8874367485324658,oversample,0.7248757086707367,3.0010724189035805,,,,0.40729190865442294,0.785750844508138,0.7872645372645373,0.618880419581875,0.6648518815052041,0.6630998702983139,0.8874367485324658,0.7849817956062712,0.7754690813064076,0.5313539800358331,0.5338031845471156,0.8879384088964928,0.8750534873769791,oversample,0.9096218716612569,0.9057339792529726,0.7248757086707367,COMPLETE
