number,value,datetime_start,datetime_complete,duration,params_alpha,params_booster,params_colsample_bytree,params_gamma,params_grow_policy,params_lambda,params_learning_rate,params_max_delta_step,params_max_depth,params_min_child_weight,params_n_estimators,params_normalize_type,params_params_decision_threshold,params_params_feature_fraction,params_params_resampling,params_params_sample_rows,params_params_scale_pos_weight,params_rate_drop,params_sample_type,params_skip_drop,params_subsample,user_attrs_acc_test,user_attrs_acc_val,user_attrs_decision_threshold,user_attrs_f1_test,user_attrs_f1_val,user_attrs_feature_fraction,user_attrs_pr_auc_test,user_attrs_pr_auc_val,user_attrs_prec_test,user_attrs_prec_val,user_attrs_rec_test,user_attrs_rec_val,user_attrs_resampling_strategy,user_attrs_roc_auc_test,user_attrs_roc_auc_val,user_attrs_sample_rows,state
1282,0.7162110127069696,2025-09-23 17:42:44.542210,2025-09-23 17:42:48.374504,0 days 00:00:03.832294,0.0001611255630388207,dart,0.621664902884401,2.2944219322513035,depthwise,0.08272245506917056,0.07330043112825281,4,11,3.081090600269344,200,tree,0.609666674121235,0.9069916775975843,none,0.9174810934454385,3.8729796810795705,0.008928787467585714,weighted,0.738602560999556,0.8824774735148125,0.8489098167673252,0.8490990990990991,0.609666674121235,0.7174578866768759,0.7162110127069696,0.9069916775975843,0.8236469640700756,0.8182601455589367,0.6493416493416494,0.6510325516275813,0.8015397775876818,0.7958921694480102,none,0.9253642492971264,0.9225186075033943,0.9174810934454385,COMPLETE
1283,0.7045088566827697,2025-09-23 17:42:48.507470,2025-09-23 17:43:26.033552,0 days 00:00:37.526082,0.00014125379028465077,dart,0.6420277751769429,9.790468304894482,depthwise,0.0006207235913691155,0.00268820509243661,2,12,0.6730920219904574,700,tree,0.6842135239906842,0.9309451762770969,none,0.9538451532075127,4.912742994194537,0.10838256909939187,weighted,0.5909687086561981,0.36825681135596744,0.8540280479066434,0.8497133497133497,0.6842135239906842,0.7151418298042349,0.7045088566827697,0.9309451762770969,0.8054628031422963,0.7971860952384917,0.6709145427286357,0.6651463321930825,0.7656116338751069,0.7488232777064613,none,0.9197497213888735,0.9168739509463387,0.9538451532075127,COMPLETE
1284,0.6415960958805799,2025-09-23 17:43:26.167263,2025-09-23 17:43:51.518643,0 days 00:00:25.351380,0.017107355413709672,dart,0.4818031429312509,0.42022891422673514,depthwise,0.00026313412715839985,0.0362154165614929,3,5,0.19118146453867912,600,tree,0.3087840662364459,0.9949799862250961,oversample,0.7882466922383967,1.9010411562563736,0.08126911933349318,weighted,0.7812472430596743,0.5009931083967325,0.746238100112601,0.7443693693693694,0.3087840662364459,0.6433606675298518,0.6415960958805799,0.9949799862250961,0.830233196909927,0.8207482915037443,0.48471710383698247,0.48272138228941686,0.9563729683490163,0.9563543003851092,oversample,0.9284697805496338,0.9263951791080708,0.7882466922383967,COMPLETE
1285,0.719984279819218,2025-09-23 17:43:51.651071,2025-09-23 17:44:03.584671,0 days 00:00:11.933600,0.00036216585261848576,dart,0.6827826391136227,7.334819063414769,depthwise,0.005175172898443087,0.09503689637800318,2,12,0.14241063695526654,400,tree,0.6751119725362288,0.9135645791096849,none,0.8436301453078594,4.339514786213057,0.08681386638341922,weighted,0.6636144445296683,0.8768588911172535,0.8533114955471389,0.8541154791154791,0.6751119725362288,0.719514582110002,0.719984279819218,0.9135645791096849,0.8256355307538529,0.8194796771942081,0.6632984482136413,0.6656976744186046,0.786142001710864,0.7839109970047069,none,0.9269473049978247,0.9249598085297299,0.8436301453078594,COMPLETE
1286,0.7100525131282821,2025-09-23 17:44:03.716233,2025-09-23 17:44:16.828825,0 days 00:00:13.112592,0.0014398051152140713,dart,0.8503405502825377,6.130006050771859,depthwise,0.11487375473674107,0.01659138977438837,4,10,0.10730205263051376,400,tree,0.6673242512966813,0.7902709460801498,none,0.8061597139657114,4.892180137834683,0.05990811839741645,weighted,0.7030913087392674,0.9908800657573156,0.8416419285494933,0.8417280917280917,0.6673242512966813,0.7092651757188498,0.7100525131282821,0.7902709460801498,0.8216255370538135,0.8165496767609965,0.6325846463291988,0.6320534223706177,0.8071000855431993,0.810012836970475,none,0.9244431144631553,0.9223346011374824,0.8061597139657114,COMPLETE
1287,0.7236653712415627,2025-09-23 17:44:16.963570,2025-09-23 17:44:18.677760,0 days 00:00:01.714190,0.00012599742786393586,gbtree,0.7548807035693865,2.702219613108694,depthwise,0.00017504937282176704,0.022418545038277293,1,12,0.14094660885967913,500,,0.6314972838526149,0.9059591931554374,none,0.8860839349545875,3.273180995844837,,,,0.5942136409709387,0.8611935715016891,0.8616912366912367,0.6314972838526149,0.7238289205702647,0.7236653712415627,0.9059591931554374,0.8262830298489867,0.8204585958922567,0.6909020217729394,0.6931818181818182,0.7600513259195893,0.7569533590072742,none,0.9268193815955377,0.9246954451356129,0.8860839349545875,COMPLETE
1288,0.7212013436079826,2025-09-23 17:44:18.813248,2025-09-23 17:44:20.456231,0 days 00:00:01.642983,0.0005955727248567551,gbtree,0.8449019768582848,2.761429169408854,depthwise,0.0004660830714185433,0.024553886217815752,0,12,0.1577934926569806,500,,0.5850117696829131,0.9425946308901942,none,0.8256348429827383,3.4420170490054627,,,,0.5882861270114391,0.853618589415498,0.8555487305487306,0.5850117696829131,0.7205939820242282,0.7212013436079826,0.9425946308901942,0.8245563258411569,0.8160767965248521,0.6633093525179856,0.669970631424376,0.7887082976903336,0.7809157038938811,none,0.9258987360074244,0.9230264028837089,0.8256348429827383,COMPLETE
1289,0.6350962602345652,2025-09-23 17:44:20.590436,2025-09-23 17:44:21.805643,0 days 00:00:01.215207,0.0004691823876632972,gbtree,0.8073859229623036,1.0626436900672847,depthwise,0.0009464562031666908,0.15357504034316935,2,12,0.8740888172016387,400,,0.6718176532061014,0.9357868097884893,none,0.8415702988905529,4.478290107837762,,,,0.6813471890126761,0.8258777766403931,0.8311834561834562,0.6718176532061014,0.6268918622504935,0.6350962602345652,0.9357868097884893,0.7011929930536964,0.7062422725735396,0.6434038721296713,0.657653528872594,0.6112061591103507,0.6140350877192983,none,0.8774757423269846,0.8819829638493568,0.8415702988905529,COMPLETE
1290,0.6849548475038337,2025-09-23 17:44:21.942827,2025-09-23 17:44:23.002919,0 days 00:00:01.060092,0.0003842076588013465,gbtree,0.9355212677540894,6.377853994676,depthwise,0.0006085670303179341,0.03364316478964786,1,12,0.12503539802315633,400,,0.516109364908405,0.8071528249896179,none,0.7420837127207239,4.4340701281006085,,,,0.47059323687633503,0.8112396355819429,0.8107084357084358,0.516109364908405,0.6894577298753789,0.6849548475038337,0.8071528249896179,0.8016132140184389,0.7884266824699271,0.5686111111111111,0.5690826727066818,0.8755346449957229,0.8600770218228498,none,0.9188792666699589,0.9136145535647399,0.7420837127207239,COMPLETE
1291,0.7,2025-09-23 17:44:23.136980,2025-09-23 17:44:24.477865,0 days 00:00:01.340885,0.000300684212389914,gbtree,0.6654326860549195,3.667010404603958,depthwise,0.0001294140684231616,0.012954939705772281,1,9,0.26492717829362034,500,,0.6566502186428788,0.8272729525242071,none,0.9733920344180488,4.202026421692261,,,,0.3916751119795346,0.8440986794963661,0.8390663390663391,0.6566502186428788,0.7116076500662754,0.7,0.8272729525242071,0.8073818335202041,0.7953445353661066,0.6384641522256201,0.6317602480192904,0.8036783575705732,0.7847667950363714,none,0.9210735055639916,0.9163693514206035,0.9733920344180488,COMPLETE
1292,0.6932618169627891,2025-09-23 17:44:24.613598,2025-09-23 17:44:35.867209,0 days 00:00:11.253611,0.00040109433029464944,dart,0.9253727008798549,6.499367594550698,depthwise,2.3485226483050856,0.13063237577029516,0,9,5.087213901973728,400,tree,0.6709256133737177,0.9370198347194686,undersample,0.9692036922408742,2.646742684502783,0.021716681779589325,weighted,0.6153192385735516,0.7879914664376831,0.8057119459514792,0.8126535626535627,0.6709256133737177,0.6869020125371165,0.6932618169627891,0.9370198347194686,0.8189091021537218,0.8126806463657785,0.5590762620837809,0.5698539542573712,0.8905047048759623,0.8848951647411211,undersample,0.9245541444937565,0.9221906149325181,0.9692036922408742,COMPLETE
1293,0.39726495726495725,2025-09-23 17:44:36.003362,2025-09-23 17:44:37.870064,0 days 00:00:01.866702,0.0001793319673042767,gbtree,0.9008982488361946,3.478772227314764,depthwise,0.0003233228865570417,0.0008326064217880453,0,12,0.1428939799635359,300,,0.576469528349152,0.917903133965369,none,0.8860653801232187,2.9824440614132675,,,,0.7075123145108331,0.8193264407820657,0.8195126945126945,0.576469528349152,0.3969935087119918,0.39726495726495725,0.917903133965369,0.8096673473988235,0.8020030719754848,0.9864176570458404,0.9880952380952381,0.24850299401197604,0.24860932819854514,none,0.9179973578421333,0.9158475633796984,0.8860653801232187,COMPLETE
1294,0.6814342629482072,2025-09-23 17:44:38.003678,2025-09-23 17:44:39.281226,0 days 00:00:01.277548,0.00016717274573314322,gbtree,0.9817024441562694,3.969549843200319,depthwise,0.00014977289587985717,0.03498988064726611,1,9,0.10783065271786456,600,,0.47633178478119365,0.9635411955355557,oversample,0.9880699885589287,2.7360456384063276,,,,0.7771273368919276,0.7932234619715426,0.7953521703521703,0.47633178478119365,0.6797717184527584,0.6814342629482072,0.9635411955355557,0.8276105191522773,0.8213206289114587,0.5400503778337532,0.542915185373286,0.9170230966638152,0.9148480958493795,oversample,0.9269876533915271,0.9246964816289899,0.9880699885589287,COMPLETE
1295,0.6747530757234448,2025-09-23 17:44:39.417515,2025-09-23 17:44:50.844437,0 days 00:00:11.426922,0.00047984417537346905,dart,0.6358240350737394,7.99186164757927,depthwise,0.001827834216909713,0.10967112227941779,1,10,0.1369689441836666,400,tree,0.556203662701663,0.9510346107678321,none,0.6088449976702771,4.044667028850684,0.09870867412276217,weighted,0.6012475785743466,0.9767234385904571,0.7983416931108609,0.8078419328419328,0.556203662701663,0.6653075093442066,0.6747530757234448,0.9510346107678321,0.7506704173864297,0.7460657269803312,0.5518602029312288,0.5669772859638905,0.8374679213002566,0.8331193838254172,none,0.8995716681292238,0.9011483022209692,0.6088449976702771,COMPLETE
1296,0.7174383383816529,2025-09-23 17:44:50.977828,2025-09-23 17:44:54.794650,0 days 00:00:03.816822,0.00012495923626944412,gbtree,0.7934896230412455,3.0648005722779685,lossguide,0.0008631179729538576,0.01772428213796694,1,12,0.5407849178989707,600,,0.5510437098477543,0.9026401188284616,none,0.828603304298833,1.6948992430337408,,,,0.4765838141406885,0.8650834271675709,0.8662981162981163,0.5510437098477543,0.7170459424645771,0.7174383383816529,0.9026401188284616,0.8242655171609274,0.8172036827977631,0.7198275862068966,0.7256017505470459,0.7142857142857143,0.709456568249893,none,0.9263277758457363,0.9232983960207407,0.828603304298833,COMPLETE
1297,0.7216233354470514,2025-09-23 17:44:54.927272,2025-09-23 17:45:14.229602,0 days 00:00:19.302330,0.00011235214804920766,dart,0.8714306683502044,6.54763313161278,depthwise,0.00011233002067554914,0.02944013613512302,1,12,0.15033110508809908,500,forest,0.6807879055661491,0.9476236797954765,none,0.9987006780104761,3.478387897966752,0.07696071880211829,uniform,0.6263940034058938,0.9060550127681466,0.8646739686764254,0.8651719901719902,0.6807879055661491,0.7226185480486781,0.7216233354470514,0.9476236797954765,0.8273312164535129,0.8222273679816849,0.7092257001647446,0.7130325814536341,0.7365269461077845,0.730423620025674,none,0.9275985487931802,0.9257910474266546,0.9987006780104761,COMPLETE
1298,0.711864406779661,2025-09-23 17:45:14.364055,2025-09-23 17:45:34.969281,0 days 00:00:20.605226,0.00457271465737144,dart,0.7712952952778146,8.217190346490138,depthwise,0.00036242149469387726,0.004853633069301924,0,12,0.17151424758050618,500,forest,0.6478180511742119,0.8677850479294931,none,0.9791109300021645,3.6575616047708475,0.008474198375452841,weighted,0.5997461146145846,0.923525723530091,0.8508547446002661,0.8503276003276004,0.6478180511742119,0.7134709931170108,0.711864406779661,0.8677850479294931,0.8178399003616075,0.8110151130219316,0.6603567528212596,0.659846547314578,0.7758768177929855,0.772785622593068,none,0.9229866871021785,0.9207384877112481,0.9791109300021645,COMPLETE
1299,0.6927731092436975,2025-09-23 17:45:35.103807,2025-09-23 17:46:33.171523,0 days 00:00:58.067716,0.001281951194356862,dart,0.8291727462372859,2.0546638594349904,depthwise,0.0001533150305271294,0.35773204515235296,4,8,0.11185002065032615,900,forest,0.3197787055951774,0.9558916325573219,oversample,0.8984681613594843,1.0297833251539155,0.09327003810017276,uniform,0.6821705696366964,0.7823051463986466,0.8063261336881974,0.8128583128583129,0.3197787055951774,0.6870658286470394,0.6927731092436975,0.9558916325573219,0.8202694559023203,0.8161837063806696,0.5601402373247033,0.5704400774979241,0.888366124893071,0.8818998716302953,oversample,0.9236010935623418,0.9220934724699011,0.8984681613594843,COMPLETE
1300,0.7051587301587302,2025-09-23 17:46:33.306821,2025-09-23 17:46:36.725781,0 days 00:00:03.418960,0.0002181215030587631,dart,0.49861122784281975,5.5789850329708575,depthwise,0.033216886581385364,0.3862420047271731,1,12,0.11203587116008974,200,forest,0.6367053788059521,0.8697687974696356,none,0.8456735319579116,3.592138276557814,0.06353066416084793,uniform,0.6313059905230858,0.7957909094037127,0.8465554304432388,0.8478705978705978,0.6367053788059521,0.707626292178662,0.7051587301587302,0.8697687974696356,0.8123280391805487,0.8056437854617773,0.6504123341699534,0.657417684054754,0.7758768177929855,0.7603765511339324,none,0.9188549194937305,0.9174037718109158,0.8456735319579116,COMPLETE
1301,0.7173160173160174,2025-09-23 17:46:36.860753,2025-09-23 17:46:40.306067,0 days 00:00:03.445314,0.0007660872002233836,dart,0.8543117872339125,4.235365033660128,depthwise,1.459213363750017,0.4041841902200725,1,10,6.398293838265829,200,forest,0.6804191806757487,0.9854872358809309,none,0.845173145548963,3.060357825226897,0.03495185280026167,uniform,0.6093730868358436,0.9682040929935887,0.8656976149042891,0.8662981162981163,0.6804191806757487,0.7161401990480312,0.7173160173160174,0.9854872358809309,0.8210072635854001,0.8181263905380437,0.7246059544658494,0.7257993867717915,0.7078699743370402,0.7090286692340607,none,0.9245089899789785,0.9232791057273343,0.845173145548963,COMPLETE
1302,0.6859288279464577,2025-09-23 17:46:40.439538,2025-09-23 17:47:06.766857,0 days 00:00:26.327319,0.000783743425065809,dart,0.7161571108908699,6.421063885554291,depthwise,0.0018566842692844783,0.20966975670319232,5,12,0.922763714967604,600,forest,0.633520250571769,0.9160702220578247,oversample,0.8774348309419758,3.736398830819703,0.1366676003451553,uniform,0.6150216852960737,0.7521344837477673,0.8007984440577336,0.803030303030303,0.633520250571769,0.6837829054273643,0.6859288279464577,0.9160702220578247,0.8209886455087523,0.8131546299882917,0.5513626834381551,0.5544998680390605,0.8999144568006844,0.8990158322635858,oversample,0.9237155483139494,0.9216953726386593,0.8774348309419758,COMPLETE
1303,0.7101207056638812,2025-09-23 17:47:06.898821,2025-09-23 17:47:09.809675,0 days 00:00:02.910854,0.04159517494649988,gbtree,0.8653296429521722,2.7519453809766934,depthwise,0.0007130042963070428,0.002639720867708888,0,11,0.265040349007085,700,,0.5687692654439565,0.9458978663856333,none,0.7036554107789172,3.755073717138512,,,,0.5927736599991162,0.8362166035418159,0.8401924651924652,0.5687692654439565,0.7045790251107829,0.7101207056638812,0.9458978663856333,0.816954697006598,0.8085892475873168,0.6198830409356725,0.6272965879265092,0.8160821214713431,0.8181429182712879,none,0.9216287132753352,0.9192139211195143,0.7036554107789172,COMPLETE
1304,0.7132367533240722,2025-09-23 17:47:09.949820,2025-09-23 17:47:13.257940,0 days 00:00:03.308120,0.000861336407509552,gbtree,0.8417134018458412,0.773495013294053,depthwise,0.04669680565851029,0.014966671669449578,5,12,0.3172023809903226,800,,0.6409479946211775,0.9875286855178335,oversample,0.8191380156246545,2.0907349536899855,,,,0.6421676514854078,0.8506500153546934,0.8520679770679771,0.6409479946211775,0.711830930278491,0.7132367533240722,0.9875286855178335,0.8214161361847614,0.81457678144195,0.6612844036697247,0.6650629163582531,0.7707442258340462,0.7689345314505777,oversample,0.9242071252845828,0.9210589081221752,0.8191380156246545,COMPLETE
1305,0.7148014440433214,2025-09-23 17:47:13.392432,2025-09-23 17:48:29.977470,0 days 00:01:16.585038,0.0006278671103426927,dart,0.7340497422660515,5.075599216280229,depthwise,0.0001495784786192141,0.034155781626386585,1,12,1.7415009839737632,1000,forest,0.5868452800006136,0.993079327239975,none,0.9634783350801639,4.319890748964719,0.02655408208159153,uniform,0.5251814767511264,0.8622613853885733,0.8346811342000204,0.8382473382473382,0.5868452800006136,0.7116586323870737,0.7148014440433214,0.993079327239975,0.8288890100219715,0.8235792387103363,0.6107876187557463,0.6181704651888854,0.8524379811804962,0.8472400513478819,none,0.928172261509624,0.9263640267237935,0.9634783350801639,COMPLETE
1306,0.7198697068403909,2025-09-23 17:48:30.121375,2025-09-23 17:48:38.559439,0 days 00:00:08.438064,0.0014959353837109618,dart,0.6423710546026924,8.576341231163692,depthwise,0.0010839170583492686,0.036172624336545785,3,12,0.27167652955800237,300,forest,0.6985141566173794,0.967449783330138,none,0.7695254956246672,4.074158577469161,0.08395883687561907,uniform,0.6498455895845239,0.6857817100001449,0.8575084450813799,0.8591318591318591,0.6985141566173794,0.7168429617575265,0.7198697068403909,0.967449783330138,0.8208195033523946,0.8162831803224244,0.6834755624515128,0.6866019417475728,0.7536355859709153,0.756525459991442,none,0.9231188410421788,0.9227001378017944,0.7695254956246672,COMPLETE
1307,0.7112986763859582,2025-09-23 17:48:38.700084,2025-09-23 17:48:46.668452,0 days 00:00:07.968368,0.00021492728174439857,dart,0.8615151108809365,2.0056539443706205,depthwise,0.010298623154137236,0.016090920101430324,6,7,0.13935604296657564,300,forest,0.3904474678364435,0.85556764688669,none,0.9857393289274073,1.292285350529392,0.11170502326994114,uniform,0.620844252629089,0.8538322550438987,0.8482956290306071,0.8459254709254709,0.3904474678364435,0.7172834795879436,0.7112986763859582,0.85556764688669,0.8237269726652426,0.8182848428459679,0.6473829201101928,0.6446453407510431,0.8041060735671514,0.7933247753530167,none,0.9251085176092246,0.9232033553363602,0.9857393289274073,COMPLETE
1308,0.7100742311770943,2025-09-23 17:48:46.805906,2025-09-23 17:48:50.950775,0 days 00:00:04.144869,0.0012409374320749274,dart,0.44115652913423636,9.268852491831709,depthwise,0.00016698099992750931,0.020167468224692883,4,10,0.17849144873964656,200,forest,0.5977664123500569,0.9463864711248122,none,0.79441624421777,2.3154983852999234,0.08036124732918289,uniform,0.6499318987284689,0.5851612441916152,0.8633432285802027,0.860053235053235,0.5977664123500569,0.7175798603765602,0.7100742311770943,0.9463864711248122,0.8141692247098262,0.8049585649951848,0.7099204688154039,0.7039529015979815,0.7254063301967494,0.7163029525032092,none,0.922015534074017,0.9194492626990737,0.79441624421777,COMPLETE
1309,0.6768694304533127,2025-09-23 17:48:51.093927,2025-09-23 17:49:51.285317,0 days 00:01:00.191390,0.00011597700760945262,dart,0.8582566317513082,1.0413583131413262,depthwise,0.005866516028304339,0.026010234642860185,2,9,0.21788950514076147,800,forest,0.5587092780680855,0.9467887241195624,none,0.8739017964200053,3.490370973137144,0.04310948019119,uniform,0.6677663413256931,0.49152759602839413,0.8237281195618794,0.8292383292383292,0.5587092780680855,0.6691006917755573,0.6768694304533127,0.9467887241195624,0.7429560761171008,0.7391354939980015,0.607466852756455,0.6184070796460177,0.7446535500427716,0.7475395806589645,none,0.8950505759344682,0.8966834630418421,0.8739017964200053,COMPLETE
1310,0.7223085460599334,2025-09-23 17:49:51.424911,2025-09-23 17:49:52.352906,0 days 00:00:00.927995,0.00018493119679785267,gbtree,0.6951697745116376,4.645662208513662,depthwise,0.0087329692677409,0.07680209814001239,1,12,0.12663721611539291,600,,0.6288752205849726,0.8898107087719833,none,0.9304254806251887,2.0477137966640133,,,,0.6954683544969115,0.8702016583068891,0.8719287469287469,0.6288752205849726,0.7193448428508189,0.7223085460599334,0.8898107087719833,0.825999953915971,0.8227967700348997,0.7454128440366973,0.7504612546125461,0.695038494439692,0.6961916987590928,none,0.927495835942165,0.9259717427720567,0.9304254806251887,COMPLETE
1311,0.7227502527805865,2025-09-23 17:49:52.493428,2025-09-23 17:50:15.401022,0 days 00:00:22.907594,0.00014076336079194742,dart,0.8716583943022687,6.062742297626295,lossguide,0.0004773180464178329,0.024480515312316525,0,10,0.7322085357762973,500,forest,0.6894549755287852,0.9419698451334998,none,0.9748571179807921,4.256899109339672,0.09401135641451858,uniform,0.7172798109679591,0.8722669204931809,0.8607841130105436,0.8596437346437347,0.6894549755287852,0.7254743641501816,0.7227502527805865,0.9419698451334998,0.8261599558315397,0.8216051014702882,0.6869266055045872,0.6851993865030674,0.7686056458511549,0.764655541292255,none,0.9272069794317589,0.9250317872364707,0.9748571179807921,COMPLETE
1312,0.7077772664519097,2025-09-23 17:50:15.540138,2025-09-23 17:50:16.504620,0 days 00:00:00.964482,0.00022487271985648398,gbtree,0.4136141397628539,4.199471056179943,depthwise,0.0013969314322250209,0.06309366418070754,1,12,0.17002981639441492,800,,0.6087296523497865,0.8240003986240596,none,0.9300195208328554,1.7063862591336438,,,,0.7771428695781311,0.8715323984031119,0.86998361998362,0.6087296523497865,0.7130116624742739,0.7077772664519097,0.8240003986240596,0.8264170332090266,0.8215674720354869,0.7660933660933661,0.7655550024888004,0.6668092386655261,0.6581086863500214,none,0.9271599254918849,0.925365739644265,0.9300195208328554,COMPLETE
