number,value,datetime_start,datetime_complete,duration,params_alpha,params_booster,params_colsample_bytree,params_gamma,params_grow_policy,params_lambda,params_learning_rate,params_max_delta_step,params_max_depth,params_min_child_weight,params_n_estimators,params_normalize_type,params_params_decision_threshold,params_params_feature_fraction,params_params_resampling,params_params_sample_rows,params_params_scale_pos_weight,params_rate_drop,params_sample_type,params_skip_drop,params_subsample,user_attrs_acc_test,user_attrs_acc_val,user_attrs_decision_threshold,user_attrs_f1_test,user_attrs_f1_val,user_attrs_feature_fraction,user_attrs_pr_auc_test,user_attrs_pr_auc_val,user_attrs_prec_test,user_attrs_prec_val,user_attrs_rec_test,user_attrs_rec_val,user_attrs_resampling_strategy,user_attrs_roc_auc_test,user_attrs_roc_auc_val,user_attrs_sample_rows,state
1774,0.7072981366459627,2025-09-23 22:12:08.227616,2025-09-23 22:12:09.167098,0 days 00:00:00.939482,0.0040117122316699755,gbtree,0.6717598439399732,0.18538595907948613,lossguide,0.0001140832474095051,0.39393466503345326,5,4,1.7990059766669657,500,,0.4629035002706764,0.8659673667424155,oversample,0.7555807205875947,0.707685357044208,,,,0.9432401886322348,0.8383662606203296,0.8456183456183456,0.4629035002706764,0.692622153007592,0.7072981366459627,0.8659673667424155,0.8018065972550579,0.803119530031617,0.6355841371918542,0.647246891651865,0.760906757912746,0.7796320068463842,oversample,0.9139584030508681,0.9159889583512201,0.7555807205875947,COMPLETE
1775,0.7041755130927105,2025-09-23 22:12:09.303726,2025-09-23 22:12:25.326229,0 days 00:00:16.022503,0.02739265457268987,dart,0.9122083472418687,1.7704750601041246,depthwise,0.079827698967656,0.4289301437391874,8,4,0.35558677322756344,500,forest,0.3876635868873079,0.9605341546280607,oversample,0.7888320939421242,0.6047111438808114,0.2949201569658936,uniform,0.6341750833008807,0.8185656716445463,0.8267990582454704,0.8288288288288288,0.3876635868873079,0.7029494382022472,0.7041755130927105,0.9605341546280607,0.8227500338799743,0.8140980392947619,0.5961882072662299,0.6003016591251885,0.8562874251497006,0.8515190415062045,oversample,0.9239270751996209,0.9222526317862462,0.7888320939421242,COMPLETE
1776,0.7106463878326996,2025-09-23 22:12:25.462055,2025-09-23 22:12:26.211127,0 days 00:00:00.749072,0.00744515176403791,gbtree,0.7069371658690007,4.501143630920792,depthwise,6.653554858927719,0.16133317846171738,0,9,1.4661505210731252,300,,0.6623542111959357,0.9756468032307917,none,0.9807500079734323,4.765681441540122,,,,0.7214207204568321,0.8433821271368614,0.8441850941850941,0.6623542111959357,0.7107750472589792,0.7106463878326996,0.9756468032307917,0.8178291034879382,0.812903329790297,0.6368563685636857,0.6394115634621964,0.8041060735671514,0.7997432605905006,none,0.9221193693125888,0.9205153825118345,0.9807500079734323,COMPLETE
1777,0.6944397211358613,2025-09-23 22:12:26.346911,2025-09-23 22:12:27.097930,0 days 00:00:00.751019,0.007402895950071186,gbtree,0.9673282244019115,0.44846219536887055,depthwise,0.000148665680833162,0.15069368133522232,9,7,0.18791013287474873,200,,0.3271622387562893,0.9853457590288397,none,0.9232519897887488,3.0341113909404918,,,,0.7825094232572768,0.8110349063363701,0.816031941031941,0.3271622387562893,0.6897478991596638,0.6944397211358613,0.9853457590288397,0.8190424975220187,0.8114997129196388,0.5681063122923588,0.5761851015801355,0.8776732249786142,0.8737697903294822,none,0.9232945090843746,0.9196485285508148,0.9232519897887488,COMPLETE
1778,0.710727969348659,2025-09-23 22:12:27.233447,2025-09-23 22:13:03.517705,0 days 00:00:36.284258,0.0032035299165468103,dart,0.558143667023681,0.8231923426128298,lossguide,0.00011141605170036332,0.00806253577652178,6,6,0.5186276592606295,700,forest,0.437963991791029,0.8760554574474338,none,0.9034057734637683,1.6890330962427158,0.1492699659928835,weighted,0.8994794928739821,0.7660002216110215,0.8489098167673252,0.8454135954135954,0.437963991791029,0.7173496744542321,0.710727969348659,0.8760554574474338,0.8236390462689775,0.815315645012989,0.6494452149791956,0.6434269857787027,0.8011120615911035,0.793752674368849,none,0.9241427175063335,0.9224144399189993,0.9034057734637683,COMPLETE
1779,0.703472840605521,2025-09-23 22:13:03.657060,2025-09-23 22:13:04.457690,0 days 00:00:00.800630,0.0005673980670032354,gbtree,0.44869340389249013,6.085679653391279,depthwise,13.208893294390624,0.2913227581071782,0,10,0.20891382085433127,600,,0.5298640055466683,0.8691140456496861,none,0.9690114416790169,3.754418340158206,,,,0.5296862267536917,0.8271061521138294,0.8295454545454546,0.5298640055466683,0.7027978180538448,0.703472840605521,0.8691140456496861,0.8150675099312759,0.8066968569994896,0.5970104633781764,0.6025015253203173,0.8541488451668092,0.8451005562687206,none,0.9227100617382228,0.9205202770638929,0.9690114416790169,COMPLETE
1780,0.665821715251373,2025-09-23 22:13:04.597733,2025-09-23 22:13:05.255995,0 days 00:00:00.658262,0.0017641498914043032,gbtree,0.4812888860874963,9.18580354562237,lossguide,0.2788252787110151,0.28422458048255234,1,12,0.5958650521630164,400,,0.6242870030937411,0.6702015588953757,none,0.9743371032862955,2.467270208443816,,,,0.4729928939046172,0.8365236974101751,0.838042588042588,0.6242870030937411,0.6681903178890505,0.665821715251373,0.6702015588953757,0.7378599202158321,0.7325854647140871,0.6496969696969697,0.657488527325824,0.6877673224978614,0.6743688489516474,none,0.8916386616581705,0.8934727520574826,0.9743371032862955,COMPLETE
1781,0.7218344965104686,2025-09-23 22:13:05.392440,2025-09-23 22:13:09.304480,0 days 00:00:03.912040,3.957679660155177,dart,0.9131139138447486,5.86295762772234,lossguide,0.0003480253485846002,0.34563486947255206,6,12,5.23103370538452,200,forest,0.6481473779938172,0.9274704838352177,none,0.9690606621786549,3.4602341793024753,0.24457442782356473,uniform,0.5437393784587615,0.7287851179898075,0.8550516941345071,0.8571867321867321,0.6481473779938172,0.7201581027667984,0.7218344965104686,0.9274704838352177,0.8243293228265354,0.8189959060430063,0.6693607641440118,0.6758775205377147,0.7792985457656116,0.7744972186563971,none,0.9262951402690899,0.924433788140869,0.9690606621786549,COMPLETE
1782,0.6848691695108078,2025-09-23 22:13:09.443425,2025-09-23 22:14:13.466468,0 days 00:01:04.023043,0.0017177234454115444,dart,0.7015725628628253,9.1420601005593,depthwise,0.03542422464890382,0.03474341937530451,3,12,8.660855215670876,1000,forest,0.6201026342813295,0.7549259985117954,none,0.9737537650425838,2.078136049777879,0.3013644821076539,uniform,0.5414380555960766,0.5593681547670218,0.8633432285802027,0.8582104832104832,0.6201026342813295,0.6976217440543602,0.6848691695108078,0.7549259985117954,0.8012845120420148,0.7904557794574405,0.7414540202214733,0.7312925170068028,0.6586826347305389,0.6439880188275567,none,0.9175667063704069,0.9132882021083772,0.9737537650425838,COMPLETE
1783,0.6962716694371883,2025-09-23 22:14:13.601675,2025-09-23 22:14:17.287203,0 days 00:00:03.685528,3.423619921382536,dart,0.9050178384996115,3.8146151145953255,lossguide,0.0006148732711120858,0.0872873197757036,6,9,17.01020113225297,200,forest,0.6935735407902545,0.8879858169491143,none,0.9047571786437403,2.3727991543845084,0.3246894201808736,uniform,0.6358774470600234,0.699149451462934,0.8699969290613164,0.8690622440622441,0.6935735407902545,0.6996215704824976,0.6962716694371883,0.8879858169491143,0.8200396138178259,0.8124435117377611,0.7825396825396825,0.7822838847385272,0.6325919589392643,0.6272999572100985,none,0.9239705029643119,0.9215087750393047,0.9047571786437403,COMPLETE
1784,0.7162055335968379,2025-09-23 22:14:17.423020,2025-09-23 22:14:18.241254,0 days 00:00:00.818234,0.0032515666355611324,gbtree,0.8989715147338465,1.2405465349460512,lossguide,0.0016916773032991208,0.3134990923518432,6,5,0.11085051029467728,400,,0.49141772992095867,0.9673543327919162,oversample,0.8686435350526879,0.6651684112647432,,,,0.8992951994036634,0.8518783908281298,0.852989352989353,0.49141772992095867,0.7145393568751233,0.7162055335968379,0.9673543327919162,0.8169170832735979,0.8088289023957567,0.663127059685097,0.6654425266250459,0.7745936698032506,0.7753530166880617,oversample,0.922110678003817,0.919600821063987,0.8686435350526879,COMPLETE
1785,0.7087360933795368,2025-09-23 22:14:18.379355,2025-09-23 22:14:19.028673,0 days 00:00:00.649318,0.015550944332616,gbtree,0.9972119385219449,0.30066608763374547,depthwise,0.00010006427868363498,0.0755038565407911,4,5,0.27235431646264663,200,,0.3039786244116244,0.8530795409710409,none,0.9985824773187304,1.1636102573454192,,,,0.8907266260436367,0.8379568021291841,0.8365069615069615,0.3039786244116244,0.7127563055706768,0.7087360933795368,0.8530795409710409,0.8290932115584881,0.822240633483599,0.6189725811534825,0.6176096630642085,0.8400342172797263,0.8314077877620881,none,0.9278149393582636,0.9256074153500176,0.9985824773187304,COMPLETE
1786,0.6608587429993777,2025-09-23 22:14:19.163725,2025-09-23 22:14:19.824992,0 days 00:00:00.661267,0.011316291608154684,gbtree,0.8623533205024648,4.638645954085559,depthwise,0.0006099793340423804,0.35595920263247377,10,5,0.14859090287338925,400,,0.44487260191385747,0.7221984736848381,none,0.9826336235451988,1.2137413548368554,,,,0.5779909334733234,0.8295629030607022,0.8326167076167076,0.44487260191385747,0.6584615384615384,0.6608587429993777,0.7221984736848381,0.7260218740066161,0.7131800344244075,0.6326369728025226,0.6413043478260869,0.6864841745081266,0.6816431322207959,none,0.8877081179932078,0.8865344078084344,0.9826336235451988,COMPLETE
1787,0.7034608378870674,2025-09-23 22:14:19.964940,2025-09-23 22:14:51.077280,0 days 00:00:31.112340,0.009638601452986149,dart,0.2984410421773422,2.701329776332732,lossguide,0.00011260358171920118,0.01265078084860402,7,8,0.4194287827691017,700,forest,0.5569398070827164,0.9968836994649397,undersample,0.8883458108970286,0.9952786608989703,0.3086960571648377,uniform,0.44602316958641264,0.8282682665632048,0.8333503941037977,0.8333333333333334,0.5569398070827164,0.7077199281867146,0.7034608378870674,0.9968836994649397,0.8122574669748275,0.8047022751413091,0.6098391089108911,0.6124326038693308,0.8430282292557741,0.826272999572101,undersample,0.9217171516589635,0.9196004179832293,0.8883458108970286,COMPLETE
1788,0.6984536082474226,2025-09-23 22:14:51.215837,2025-09-23 22:14:59.622832,0 days 00:00:08.406995,5.150174855904921,dart,0.9360422843045306,4.196631510990277,lossguide,0.00011153720757174863,0.23201768448551638,7,12,5.545473975874877,300,forest,0.6308089689053282,0.8679736507692573,none,0.9879569535487613,4.528301803841694,0.2682218517938295,uniform,0.5187013196925316,0.8559006535344967,0.8317125601392159,0.8323095823095823,0.6308089689053282,0.7017416545718432,0.6984536082474226,0.8679736507692573,0.8038662566498014,0.79476798116633,0.6093257718966604,0.612924071082391,0.8272027373823782,0.811724433033804,none,0.9189711873329298,0.9152542860872589,0.9879569535487613,COMPLETE
1789,0.6934639419017058,2025-09-23 22:14:59.759640,2025-09-23 22:15:03.694569,0 days 00:00:03.934929,0.9334007372376668,dart,0.6071134933224411,5.025651117302743,lossguide,0.004527761505944706,0.3364961945355157,6,8,8.246613806206806,200,forest,0.6993658910674139,0.8484523857639841,oversample,0.9668589087829006,3.3108017855925196,0.2586860217722912,uniform,0.4816917336114846,0.7939489737502481,0.8101136247312929,0.8141891891891891,0.6993658910674139,0.6905754795663053,0.6934639419017058,0.8484523857639841,0.8198789849811194,0.8103324936850278,0.5660377358490566,0.5728236607142857,0.8853721129170231,0.8784766795036372,oversample,0.9239599410096124,0.920289052666359,0.9668589087829006,COMPLETE
1790,0.6893814091961628,2025-09-23 22:15:03.829586,2025-09-23 22:16:15.682156,0 days 00:01:11.852570,0.008768022987997958,dart,0.22851888983428614,0.13705289719821878,lossguide,0.00034941793861994645,0.01561823601504847,5,9,0.4483259805662909,1000,forest,0.5413553820658928,0.8932932735181132,oversample,0.8028492739898142,1.77075573063882,0.24824310687258916,uniform,0.49708256443965126,0.21071398753722806,0.8038693827413246,0.8077395577395577,0.5413553820658928,0.6867233485938522,0.6893814091961628,0.8932932735181132,0.8076236356721664,0.8029755321915437,0.5558496559025939,0.5618765165812888,0.8982035928143712,0.8917415489944374,oversample,0.9210722392805946,0.9194216804586506,0.8028492739898142,COMPLETE
1791,0.645659748522951,2025-09-23 22:16:15.819452,2025-09-23 22:16:19.108907,0 days 00:00:03.289455,8.633560357422029,dart,0.8661564040798427,5.736231397358649,lossguide,0.00044357843160302256,0.21330379286935466,6,12,41.13718668917109,200,forest,0.6279704946434843,0.7655746253953495,undersample,0.9457084275734968,2.9042566441130413,0.24804234472884537,uniform,0.6620108896186053,0.7987036858513491,0.7496161326645512,0.7605446355446356,0.6279704946434843,0.6356866249627644,0.645659748522951,0.7655746253953495,0.7821873377585473,0.7750471703288649,0.4876599634369287,0.49976547842401503,0.9127459366980325,0.9118528027385537,undersample,0.9059106540365258,0.9048111258581085,0.9457084275734968,COMPLETE
1792,0.6839291680588039,2025-09-23 22:16:19.246437,2025-09-23 22:16:58.496803,0 days 00:00:39.250366,0.007365760746194993,dart,0.6637221860719064,8.30317251673686,lossguide,0.0008225354740179535,0.0068524456474953945,0,11,0.4783594937155398,700,forest,0.6549752379404221,0.9667308179026524,oversample,0.9990602508684723,2.794746640721507,0.20706134093746434,uniform,0.516816661532728,0.48129034547855404,0.8032551950046064,0.8063063063063063,0.6549752379404221,0.6840894148586456,0.6839291680588039,0.9667308179026524,0.8028197206444379,0.7899067592157957,0.5555258942872398,0.5609756097560976,0.8900769888793841,0.8759092854086435,oversample,0.919378038432622,0.9146727845112419,0.9990602508684723,COMPLETE
1793,0.7160255171080611,2025-09-23 22:16:58.634888,2025-09-23 22:17:55.261656,0 days 00:00:56.626768,0.0011850922187296065,dart,0.29018393919878127,1.6378917343139694,lossguide,0.037498252036750813,0.13900044465496195,8,7,0.10038021692209742,900,forest,0.6051055472060752,0.965474538903001,oversample,0.9990955746714476,1.0415189198051067,0.2580158972264151,uniform,0.5733481768484845,0.6426366492163131,0.8514689323369843,0.8496109746109746,0.6051055472060752,0.7192880634552138,0.7160255171080611,0.965474538903001,0.8251156780143012,0.8203865474085856,0.6566584245849523,0.6530324400564175,0.7951240376390077,0.7924689773213521,oversample,0.926461973106673,0.924974607351836,0.9990955746714476,COMPLETE
1794,0.6801476488525117,2025-09-23 22:17:55.398922,2025-09-23 22:18:03.616954,0 days 00:00:08.218032,0.14798721251323213,dart,0.9895004936365515,6.965789329724174,lossguide,0.00014333300617122872,0.20825125261910762,7,9,0.6281314621731697,300,forest,0.5325466861052162,0.9578805388323371,oversample,0.9987863830016698,2.7467731305132532,0.22018820789068894,uniform,0.49946631562232474,0.9004965048771079,0.7946565666905517,0.795966420966421,0.5325466861052162,0.6786286446651714,0.6801476488525117,0.9578805388323371,0.8209535951082604,0.8157681222055013,0.5425204918032787,0.5441705187467899,0.9059024807527801,0.9067180145485665,oversample,0.9237943456762581,0.9218346946234266,0.9987863830016698,COMPLETE
1795,0.6841420338352854,2025-09-23 22:18:03.754434,2025-09-23 22:18:10.326824,0 days 00:00:06.572390,89.32996690626253,dart,0.8831241675574014,8.212099035036422,lossguide,0.0018560285349016837,0.2385797747459209,4,12,11.476562141481848,300,forest,0.5793174461399451,0.9236012573153446,none,0.8901189444058057,3.3178214613605066,0.21843213912438436,uniform,0.610839475641592,0.8234835713436927,0.8270037874910431,0.8260647010647011,0.5793174461399451,0.689908256880734,0.6841420338352854,0.9236012573153446,0.7907747322439433,0.7855135774771091,0.6041131105398457,0.6048652202498357,0.8041060735671514,0.787334189131365,none,0.9102802526903054,0.9082314676279797,0.8901189444058057,COMPLETE
1796,0.6340148281285104,2025-09-23 22:18:10.462561,2025-09-23 22:18:13.586945,0 days 00:00:03.124384,90.06650902018515,dart,0.835066034107627,5.770176805477583,lossguide,0.00011256047082932303,0.20749529877597944,8,9,0.7957801422876775,200,forest,0.5939160984294742,0.8501113650493408,none,0.9345574991658036,1.9459153273759633,0.2855653690924315,uniform,0.698927461169341,0.7081303861713724,0.8320196540075749,0.8332309582309583,0.5939160984294742,0.6362225670583019,0.6340148281285104,0.8501113650493408,0.7129972749566533,0.7085996851962505,0.660377358490566,0.6674550614947966,0.6137724550898204,0.6037655113393239,none,0.8826511864672524,0.8852894928881295,0.9345574991658036,COMPLETE
1797,0.6960013968919155,2025-09-23 22:18:13.757854,2025-09-23 22:18:15.024643,0 days 00:00:01.266789,0.0012703855932158607,gbtree,0.8765088299174686,5.682023450234208,lossguide,0.0036984753672923303,0.02935718823932561,6,8,0.4346518291142992,300,,0.4013275298745158,0.9278331145194629,none,0.9802680556145627,2.1890404263311156,,,,0.2819719745277122,0.8182004299314157,0.8217649467649467,0.4013275298745158,0.6926272066458983,0.6960013968919155,0.9278331145194629,0.8146183065309434,0.8089110102548236,0.5816860465116279,0.587905604719764,0.8558597091531224,0.8528027385537014,none,0.9204498897700303,0.9192525304978101,0.9802680556145627,COMPLETE
1798,0.7114118507681053,2025-09-23 22:18:15.162462,2025-09-23 22:18:15.813444,0 days 00:00:00.650982,0.00015608077252246344,gbtree,0.9722692527783161,1.4090109471652914,depthwise,0.00015922732761112813,0.06157755541893672,10,5,0.2800094088592194,200,,0.3281904021279921,0.9457625438361186,none,0.9524287647739985,1.2755622910378575,,,,0.660843085428302,0.8375473436380387,0.8384520884520884,0.3281904021279921,0.7122393472348142,0.7114118507681053,0.9457625438361186,0.826805002505661,0.8201721378869636,0.6181932640856154,0.6212072820185245,0.8400342172797263,0.8322635857937527,none,0.9266892421973055,0.9246466147809599,0.9524287647739985,COMPLETE
1799,0.6892430278884463,2025-09-23 22:18:15.950919,2025-09-23 22:18:50.960231,0 days 00:00:35.009312,0.0003648517529127907,dart,0.8900645753943092,5.732462157283411,depthwise,0.00011964238377843437,0.13661033418420507,0,9,0.11296253281307435,700,forest,0.5920289072465673,0.9828275724050635,oversample,0.9337765821382641,2.9496835173726446,0.17589928386485992,uniform,0.45646861501189784,0.6578606819950212,0.8025386426451019,0.8083538083538083,0.5920289072465673,0.683822324209146,0.6892430278884463,0.9828275724050635,0.8218130489839842,0.8158422012225326,0.5543449375498273,0.5630593978844589,0.8922155688622755,0.8883183568677792,oversample,0.9239893533194296,0.9221482914529546,0.9337765821382641,COMPLETE
1800,0.5941601928743638,2025-09-23 22:18:51.101149,2025-09-23 22:18:55.454192,0 days 00:00:04.353043,0.2277746549055877,dart,0.9659270680059254,6.303902543763159,lossguide,0.001206213669326753,0.0014609605357369096,10,8,0.11420794424470032,200,forest,0.5299772796051818,0.7700262948321679,none,0.9823859428731574,2.473526502989197,0.22376811030257407,uniform,0.6424122418791787,0.5316590867785711,0.8526973078104207,0.8449017199017199,0.5299772796051818,0.6188079470198675,0.5941601928743638,0.7700262948321679,0.7883310385097342,0.7751626552769552,0.8128044537230341,0.7944126074498568,0.49957228400342174,0.47454000855798034,none,0.9105740592176279,0.9061001781213869,0.9823859428731574,COMPLETE
1801,0.7113050075872535,2025-09-23 22:18:55.598425,2025-09-23 22:18:56.189212,0 days 00:00:00.590787,0.0016574490962609737,gbtree,0.9954574016385022,8.690943953758001,depthwise,3.288621043653945,0.20745370609953878,0,10,4.188163739345296,200,,0.6622621706712568,0.9960484139401147,none,0.9512903986570662,4.479774421086699,,,,0.8459147797189448,0.8446105026102979,0.8441850941850941,0.6622621706712568,0.7158367652564582,0.7113050075872535,0.9960484139401147,0.824126112501367,0.8144681552408949,0.6364846870838882,0.6388415672913118,0.8177929854576561,0.8023106546854942,none,0.9260808793624471,0.9232763417449953,0.9512903986570662,COMPLETE
1802,0.720373118507526,2025-09-23 22:18:56.329146,2025-09-23 22:19:16.161890,0 days 00:00:19.832744,0.011934265144038078,dart,0.9487645249419169,3.9246649504218754,lossguide,0.0017927117662689467,0.08677453473353049,0,10,3.4149760877729096,500,forest,0.6793458429427631,0.9533336172710946,none,0.9601601186252883,3.3815614343450213,0.18749821520528978,uniform,0.5063922136108397,0.758329296499027,0.8635479578257754,0.86496723996724,0.6793458429427631,0.7188356886732756,0.720373118507526,0.9533336172710946,0.820193021756587,0.8157484288109501,0.7091136079900124,0.7138655462184874,0.7288280581693756,0.7270004278990159,none,0.9226660871693376,0.921531203604325,0.9601601186252883,COMPLETE
1803,0.7048315062931384,2025-09-23 22:19:16.305427,2025-09-23 22:19:20.019719,0 days 00:00:03.714292,7.952842034132339,dart,0.7954657084617586,4.44905776445203,lossguide,0.004660564338817023,0.021199788629095207,7,10,0.8426432999814271,200,forest,0.5010454469128954,0.8956685672767902,oversample,0.9199572535336581,0.5613353774958686,0.24963305996475574,uniform,0.4219945458831404,0.6175214696484703,0.8527996724332071,0.8511466011466011,0.5010454469128954,0.7091423948220065,0.7048315062931384,0.8956685672767902,0.8116864410365965,0.8035767789722824,0.672678434382195,0.6705291618385477,0.7497861420017109,0.7428326914848096,oversample,0.9185327367066431,0.9161447778555724,0.9199572535336581,COMPLETE
1804,0.38612143742255267,2025-09-23 22:19:20.156893,2025-09-23 22:19:24.146705,0 days 00:00:03.989812,0.04161998843604787,gbtree,0.7445116608651383,4.807191305168238,lossguide,0.005287773768800054,0.0009815333982997362,10,9,0.4112603047341033,300,,0.4452328952891105,0.9010871633608484,oversample,0.9943628241949637,2.0262740065676774,,,,0.6480928776428004,0.23932848807452145,0.23925061425061425,0.4452328952891105,0.3862228462872718,0.38612143742255267,0.9010871633608484,0.7906141644520096,0.7842121901870157,0.23932848807452145,0.23925061425061425,1.0,1.0,oversample,0.9141851828956427,0.9122569199896788,0.9943628241949637,COMPLETE
