number,value,datetime_start,datetime_complete,duration,params_alpha,params_booster,params_colsample_bytree,params_gamma,params_grow_policy,params_lambda,params_learning_rate,params_max_delta_step,params_max_depth,params_min_child_weight,params_n_estimators,params_normalize_type,params_params_decision_threshold,params_params_feature_fraction,params_params_resampling,params_params_sample_rows,params_params_scale_pos_weight,params_rate_drop,params_sample_type,params_skip_drop,params_subsample,user_attrs_acc_test,user_attrs_acc_val,user_attrs_decision_threshold,user_attrs_f1_test,user_attrs_f1_val,user_attrs_feature_fraction,user_attrs_pr_auc_test,user_attrs_pr_auc_val,user_attrs_prec_test,user_attrs_prec_val,user_attrs_rec_test,user_attrs_rec_val,user_attrs_resampling_strategy,user_attrs_roc_auc_test,user_attrs_roc_auc_val,user_attrs_sample_rows,state
284,0.38612143742255267,2025-09-23 12:52:33.471359,2025-09-23 12:52:34.369963,0 days 00:00:00.898604,0.00337050992720082,gbtree,0.8204294978407751,3.900580373018665,depthwise,0.006582876921020089,0.0010114424908752048,9,4,8.301969455502071,900,,0.3202967322557686,0.9648617761919092,undersample,0.7132307458942986,4.799399083581407,,,,0.5885846293303021,0.23932848807452145,0.23925061425061425,0.3202967322557686,0.3862228462872718,0.38612143742255267,0.9648617761919092,0.7475202709982602,0.7333222786884115,0.23932848807452145,0.23925061425061425,1.0,1.0,undersample,0.8993391036716578,0.8950072805022294,0.7132307458942986,COMPLETE
285,0.611504907306434,2025-09-23 12:52:34.491031,2025-09-23 12:52:58.885100,0 days 00:00:24.394069,0.0009682016795624291,dart,0.43973291642929757,5.667778068474927,depthwise,0.02272017052333076,0.3308061130850107,1,8,16.40857819140075,600,forest,0.5345039028939211,0.883739159613981,undersample,0.8409860651907737,4.193994061761089,0.038878688486569946,uniform,0.7616244420361439,0.2925842996603337,0.706418261848705,0.7082309582309583,0.5345039028939211,0.6100081588251292,0.611504907306434,0.883739159613981,0.7860394879209082,0.7871366464151036,0.44716905901116427,0.44868973794758954,0.9593669803250642,0.9597774925117672,undersample,0.9113639322658104,0.9122339731779698,0.8409860651907737,COMPLETE
286,0.6079647237150337,2025-09-23 12:52:59.006012,2025-09-23 12:54:09.753916,0 days 00:01:10.747904,0.0001391436473011998,dart,0.3774995894622004,6.371856652119066,lossguide,0.6145749148426575,0.0021029315070677456,7,9,0.6917269667042113,1000,tree,0.5947622462688225,0.8826224730124006,undersample,0.5540007922411913,2.756152807887819,0.2615273440493797,weighted,0.7622439674668986,0.7976875117022368,0.7000716552359505,0.7087428337428338,0.5947622462688225,0.6000546000546001,0.6079647237150337,0.8826224730124006,0.7197920346416797,0.7112898904926962,0.44065757818765033,0.4483739837398374,0.9401197604790419,0.9439452289259734,undersample,0.8900646713954294,0.8905069126334549,0.5540007922411913,COMPLETE
287,0.5453237410071943,2025-09-23 12:54:09.874952,2025-09-23 12:54:13.348837,0 days 00:00:03.473885,0.0013766479498283275,dart,0.3911902759939976,2.8404556212217456,lossguide,0.004115086059286629,0.005232259944681544,4,10,3.61553747603144,200,forest,0.5655636823005256,0.6122012932146619,oversample,0.5731522039561264,2.8911684300299094,0.33906116630656097,uniform,0.33673334265691124,0.4986765460470194,0.6123451735080356,0.6117936117936118,0.5655636823005256,0.5454327211619253,0.5453237410071943,0.6122012932146619,0.7251383971743285,0.713421736668436,0.37910896045386283,0.37881059470264866,0.9717707442258341,0.9730423620025674,oversample,0.8854022447060432,0.8817453189511817,0.5731522039561264,COMPLETE
288,0.5811965811965812,2025-09-23 12:54:13.469393,2025-09-23 12:54:15.338906,0 days 00:00:01.869513,0.4089860870953208,gbtree,0.6246850605447004,4.120593377116154,depthwise,0.0036115086785606237,0.00024907338147671674,0,10,9.885177488932392,1000,,0.4394955656667996,0.5998767353326434,none,0.67344782207307,3.0862582837357317,,,,0.4417521338714616,0.6615825570682772,0.668918918918919,0.4394955656667996,0.5745173745173745,0.5811965811965812,0.5998767353326434,0.7196894411806071,0.708464946876757,0.4108983799705449,0.41671309192200556,0.9546621043627032,0.9602053915275995,none,0.8885943149170832,0.8883707285748037,0.67344782207307,COMPLETE
289,0.6731371321227301,2025-09-23 12:54:15.461478,2025-09-23 12:54:16.486501,0 days 00:00:01.025023,0.053188343211632544,gbtree,0.6964058057181115,4.739378728690619,depthwise,13.320614305252409,0.02262784515556897,10,7,2.5445953400787653,1000,,0.4597437544179126,0.8026689056147778,oversample,0.7157930348350962,1.9338769461556617,,,,0.942533440505027,0.7812468011055379,0.7862407862407862,0.4597437544179126,0.6691438303142901,0.6731371321227301,0.8026689056147778,0.8223407364986205,0.8126939744122552,0.5243872846396506,0.530733152308072,0.9242942686056459,0.9199828840393667,oversample,0.925233304082187,0.9228464849083396,0.7157930348350962,COMPLETE
290,0.5456269258118037,2025-09-23 12:54:16.607833,2025-09-23 12:54:17.073925,0 days 00:00:00.466092,0.0023229705927894505,gbtree,0.7214210779162318,7.374839894934233,depthwise,0.0021303383189971484,0.002973801983690823,3,6,18.5896558090212,200,,0.31268128458442923,0.9592126115135928,none,0.9032517136822427,2.887780316149755,,,,0.7023062619102156,0.603746545193981,0.6074938574938575,0.31268128458442923,0.5441055234954658,0.5456269258118037,0.9592126115135928,0.7864393269018444,0.7776359191572859,0.37542662116040953,0.377315194230454,0.9880239520958084,0.9850235344458708,none,0.9092490663174486,0.9063969319335375,0.9032517136822427,COMPLETE
291,0.6045042570722329,2025-09-23 12:54:17.192924,2025-09-23 12:54:17.666284,0 days 00:00:00.473360,0.13145698569031772,gbtree,0.677432572333055,6.603292005954709,depthwise,0.013143929149891419,0.03513124874505889,4,5,10.944551898157567,400,,0.5098913604225204,0.5117363739660084,oversample,0.6164264545766807,2.9606597600284545,,,,0.4411979833070394,0.7035520524106869,0.7051597051597052,0.5098913604225204,0.6020884858477604,0.6045042570722329,0.5117363739660084,0.7230569366197801,0.7178405877542021,0.44352226720647775,0.44509605662285134,0.937125748502994,0.9418057338468121,oversample,0.8871765955372259,0.8894430673478271,0.6164264545766807,COMPLETE
292,0.6266310328564692,2025-09-23 12:54:17.787599,2025-09-23 12:54:19.806058,0 days 00:00:02.018459,15.164237432130854,gbtree,0.9960656532009393,2.0651868878957647,depthwise,0.0069059327913540336,0.0017068438712527908,3,12,0.21062384309244053,700,,0.6970379729791909,0.6145782261873959,oversample,0.9575306748248927,2.7673823648806493,,,,0.6392594336909843,0.7541201760671512,0.7568591318591319,0.6970379729791909,0.6271344303011487,0.6266310328564692,0.6145782261873959,0.6791682804661078,0.6707672404110581,0.4922027290448343,0.4952783300198807,0.8639863130881095,0.8528027385537014,oversample,0.8762491741817708,0.8749256819852902,0.9575306748248927,COMPLETE
293,0.6740594059405941,2025-09-23 12:54:19.927583,2025-09-23 12:54:20.696772,0 days 00:00:00.769189,6.137282169991642,gbtree,0.4902287850827114,0.9691401801436517,lossguide,37.15339931126258,0.3469880781938228,9,7,79.84730016650428,700,,0.6223102474012214,0.5223349932618615,oversample,0.5925064960121671,1.0447048102870364,,,,0.7698699489069412,0.8342716757088751,0.8314905814905815,0.6223102474012214,0.6834799608993157,0.6740594059405941,0.5223349932618615,0.7638678773137841,0.7577259923265969,0.6294562477493698,0.6273497972723922,0.7476475620188195,0.7282841249465126,oversample,0.9041708382070854,0.8988962612359481,0.5925064960121671,COMPLETE
294,0.5937068727573834,2025-09-23 12:54:20.818367,2025-09-23 12:54:24.694549,0 days 00:00:03.876182,0.602746897633121,dart,0.9949689595691187,3.0788685458383913,lossguide,0.00013062234854631895,0.0007156423857987244,5,9,0.24109137752437407,200,forest,0.5292079692261744,0.5629059139609549,none,0.642256880243806,4.155712206308529,0.05885035954650564,weighted,0.7705056070338271,0.46632710631207586,0.6966936226840004,0.6986076986076986,0.5292079692261744,0.5954948805460751,0.5937068727573834,0.5629059139609549,0.7088637951473121,0.7061063653313172,0.43733707639863645,0.4381747810144632,0.9328485885372113,0.920410783055199,none,0.8838123971216687,0.880351724814233,0.642256880243806,COMPLETE
295,0.6369406537607109,2025-09-23 12:54:24.814094,2025-09-23 12:54:53.949037,0 days 00:00:29.134943,0.0860711700995133,dart,0.8069387720116976,0.4025668760753387,lossguide,0.007190799016110129,0.003974391003751823,8,5,0.13313347330201544,700,tree,0.68682649857507,0.5241735970006839,oversample,0.6565278185523464,2.314038466904799,0.31623708526923683,weighted,0.12746678503383316,0.7543792145298509,0.757702937864674,0.7657657657657657,0.68682649857507,0.6288223302493335,0.6369406537607109,0.5241735970006839,0.6821362253243392,0.6748144260686406,0.49641000247586037,0.5061790668348045,0.8575705731394354,0.858793324775353,oversample,0.8739595035662571,0.8767508028648907,0.6565278185523464,COMPLETE
296,0.6275591694496878,2025-09-23 12:54:54.069988,2025-09-23 12:54:54.708761,0 days 00:00:00.638773,0.0008422106314581281,gbtree,0.7089724267101911,8.302159852368929,lossguide,93.25942987565732,0.05594614673366111,4,4,4.839377292592451,900,,0.4595738891704879,0.884306280418973,oversample,0.6710476953835378,1.8664476663233018,,,,0.320333865174631,0.7311905005630054,0.7374078624078624,0.4595738891704879,0.6225926990514515,0.6275591694496878,0.884306280418973,0.7313731066581135,0.7158921108609941,0.4688311688311688,0.47494505494505496,0.9264328485885372,0.9246897732135216,oversample,0.8936812631153864,0.8936201932403702,0.6710476953835378,COMPLETE
297,0.6180185237159697,2025-09-23 12:54:54.830650,2025-09-23 12:54:55.304831,0 days 00:00:00.474181,0.49324958303586913,gbtree,0.6712803880336833,4.758612739283277,depthwise,0.0016783755440406935,0.17731296057576826,3,4,2.1826202255226272,800,,0.37854223602821346,0.5353604248066304,oversample,0.5739872883307997,1.6352030040532695,,,,0.9880391078739583,0.7188043812058552,0.7213349713349714,0.37854223602821346,0.6153199831956309,0.6180185237159697,0.5353604248066304,0.766199314915532,0.7574476891263384,0.45742244430564233,0.45980371685111715,0.9396920444824637,0.9422336328626444,oversample,0.9011702933598746,0.8985540168811373,0.5739872883307997,COMPLETE
298,0.5908452681830947,2025-09-23 12:54:55.427774,2025-09-23 12:54:55.877707,0 days 00:00:00.449933,0.9283662468148746,gbtree,0.49232814597934527,3.4008672023369924,lossguide,0.006653670408026277,0.2750297070286811,3,8,12.102035992476427,300,,0.6168607314233008,0.5138181607770963,undersample,0.5097316052094363,3.0314994582818873,,,,0.27104372520550996,0.6946463302282732,0.7016789516789517,0.6168607314233008,0.583554376657825,0.5908452681830947,0.5138181607770963,0.6637388705431516,0.6560464727774147,0.43316062176165804,0.43970741901776383,0.8939264328485885,0.9002995293110826,undersample,0.8606758166002617,0.8601587896337073,0.5097316052094363,COMPLETE
299,0.38612143742255267,2025-09-23 12:54:55.997982,2025-09-23 12:55:55.904558,0 days 00:00:59.906576,0.014618019674415544,dart,0.20417954432644336,5.5091262918773065,depthwise,0.9705008234240283,0.00036720029775577894,2,5,1.2390972294958718,1000,tree,0.5558608262909037,0.729455503385736,undersample,0.542351497409971,2.9862378218984635,0.161287236309742,uniform,0.07086456126851907,0.38275331063458157,0.23932848807452145,0.23925061425061425,0.5558608262909037,0.3862228462872718,0.38612143742255267,0.729455503385736,0.6811363580025392,0.673879445032975,0.23932848807452145,0.23925061425061425,1.0,1.0,undersample,0.8695015240871853,0.8708610444156415,0.542351497409971,COMPLETE
300,0.38612143742255267,2025-09-23 12:55:56.024503,2025-09-23 12:56:05.737760,0 days 00:00:09.713257,0.026162766955463258,dart,0.7667095719712946,3.193204882982678,lossguide,7.062088864806436,0.00010189164111857964,5,10,2.966538939023337,400,forest,0.3425990156592067,0.5847339932835448,oversample,0.5831144321709482,0.667837741804403,0.3708712055547894,weighted,0.28175752162885853,0.2559027356898847,0.23932848807452145,0.23925061425061425,0.3425990156592067,0.3862228462872718,0.38612143742255267,0.5847339932835448,0.6816337073000183,0.6683516481080363,0.23932848807452145,0.23925061425061425,1.0,1.0,oversample,0.8714252963592396,0.8711747852025828,0.5831144321709482,COMPLETE
301,0.0,2025-09-23 12:56:05.858079,2025-09-23 12:56:46.473651,0 days 00:00:40.615572,0.0017509726957161637,dart,0.9978275384243334,7.141902159345912,lossguide,2.0116732973680955,0.00012659716653910233,1,8,19.873060629459292,800,tree,0.5926683199478224,0.7670740381713281,none,0.6551427994626084,3.777972531461579,0.2524661319462455,weighted,0.45368699265902085,0.2562261661509313,0.7606715119254785,0.7607493857493858,0.5926683199478224,0.0,0.0,0.7670740381713281,0.7025181330040275,0.6897195342528404,0.0,0.0,0.0,0.0,none,0.8862749154209029,0.8837688131465596,0.6551427994626084,COMPLETE
302,0.5977799095518707,2025-09-23 12:56:46.592645,2025-09-23 12:56:47.065451,0 days 00:00:00.472806,0.0001843162843710013,gbtree,0.7748302237337341,9.67588680957023,lossguide,5.14933912158274,0.05044868644736247,5,11,2.098020360431611,500,,0.39565099918102753,0.5446785420899865,undersample,0.9168902333950053,1.4034462852458887,,,,0.8005892188599837,0.687890265124373,0.6995290745290745,0.39565099918102753,0.5862396525987243,0.5977799095518707,0.5446785420899865,0.7060067519786609,0.7084411845202092,0.4293381037567084,0.43971774193548385,0.9238665526090676,0.9332477535301669,undersample,0.8753888785092023,0.8809510771095217,0.9168902333950053,COMPLETE
303,0.4757881722645786,2025-09-23 12:56:47.186610,2025-09-23 12:56:47.897773,0 days 00:00:00.711163,8.292047427764036,gbtree,0.7959927508766178,3.4440156832593227,lossguide,0.0067286515438223825,0.0009175478384375649,0,3,12.865718478286176,800,,0.36105723984537785,0.5129489362696771,undersample,0.6403449217281465,1.4416448433823486,,,,0.8368504494717524,0.4740505681236565,0.47911547911547914,0.36105723984537785,0.47410440122824976,0.4757881722645786,0.5129489362696771,0.6432941761763941,0.6364360936049857,0.3116254036598493,0.3133396661690867,0.9905902480752781,0.9880188275566966,undersample,0.8656014287820921,0.8654258746866839,0.6403449217281465,COMPLETE
304,0.660217083529967,2025-09-23 12:56:48.020416,2025-09-23 12:56:48.308984,0 days 00:00:00.288568,0.004814013422690169,gbtree,0.9389904535502565,9.32251450509713,depthwise,15.547369477550866,0.18284654852295143,2,7,0.8283124944620411,200,,0.3902485093413972,0.5601941791846867,none,0.515856033499597,0.7557166963660754,,,,0.5483513538324518,0.8526973078104207,0.8525798525798526,0.3902485093413972,0.6655821519869858,0.660217083529967,0.5601941791846867,0.7732785709898361,0.7685710448149592,0.7287531806615776,0.7359284587059443,0.6124893071000855,0.5986307231493367,none,0.8967529788453543,0.8979380806918156,0.515856033499597,COMPLETE
305,0.6839551614522336,2025-09-23 12:56:48.427361,2025-09-23 12:57:58.901733,0 days 00:01:10.474372,0.3648135226020062,dart,0.9170443936046586,1.6934164939439944,depthwise,0.02869455291049029,0.2247981432169148,10,10,2.932844212317178,1000,forest,0.47511739987634094,0.9803462531781645,undersample,0.8139190201886913,1.2467399806236752,0.08696308412304965,uniform,0.4287944381111213,0.6329961317961673,0.8054048520831201,0.8066134316134316,0.47511739987634094,0.6845860295337647,0.6839551614522336,0.9803462531781645,0.8080322577298291,0.8002259563004879,0.5592301436703714,0.5615384615384615,0.8823781009409752,0.8746255883611468,undersample,0.920409311142983,0.9162156624859706,0.8139190201886913,COMPLETE
306,0.4870368426577097,2025-09-23 12:57:59.022678,2025-09-23 12:58:03.783978,0 days 00:00:04.761300,0.022696034761343818,dart,0.6875634778007541,9.738222583623035,depthwise,4.2280694718740905,0.026885761922571687,4,3,10.482427405955193,300,tree,0.4195187256981799,0.5340901363361508,undersample,0.7797048423012527,4.213111149719831,0.3407290507023619,uniform,0.21609135509708802,0.68008433068462,0.4960589620227249,0.4996928746928747,0.4195187256981799,0.4840163504873703,0.4870368426577097,0.5340901363361508,0.7025619994765444,0.697005675391793,0.32056087741218936,0.3226703755215577,0.9875962360992301,0.9927257167308515,undersample,0.8779391157128618,0.8752993666392054,0.7797048423012527,COMPLETE
307,0.0,2025-09-23 12:58:03.904513,2025-09-23 12:58:10.113279,0 days 00:00:06.208766,0.0006351549181777895,dart,0.44937911170791633,5.312361169926768,depthwise,65.55313431564691,0.00041068985869246663,10,8,10.425971336479204,300,forest,0.35757638539701286,0.9876136185810225,none,0.846495156850199,0.8940856316134411,0.21896090857523098,weighted,0.3885942427716219,0.6245769993264974,0.7606715119254785,0.7607493857493858,0.35757638539701286,0.0,0.0,0.9876136185810225,0.7394092896386528,0.729894133931306,0.0,0.0,0.0,0.0,none,0.8948678282169152,0.8929676918680242,0.846495156850199,COMPLETE
308,0.38612143742255267,2025-09-23 12:58:10.233772,2025-09-23 12:58:11.213430,0 days 00:00:00.979658,0.00234059454768334,gbtree,0.9001782154380957,3.512464366663688,lossguide,94.17275764426381,0.0012615711427401523,3,5,7.139718353674971,600,,0.3364254948921652,0.60199618451689,undersample,0.5037358873236373,1.845716432771329,,,,0.8922203241246545,0.23932848807452145,0.23925061425061425,0.3364254948921652,0.3862228462872718,0.38612143742255267,0.60199618451689,0.6811176223544992,0.6781567729525279,0.23932848807452145,0.23925061425061425,1.0,1.0,undersample,0.8622687147764566,0.8575403194484105,0.5037358873236373,COMPLETE
309,0.3118279569892473,2025-09-23 12:58:11.334987,2025-09-23 12:58:38.964985,0 days 00:00:27.629998,0.00010908240797306249,dart,0.6596725696632482,5.0514041076547525,depthwise,5.134914617358307,0.005168192928812632,1,4,6.978810085725706,700,tree,0.5093001174561266,0.9435362117685318,none,0.6360386162497387,0.6750900386857543,0.37647936153178363,weighted,0.48130693652033985,0.42485147993805006,0.8037670181185382,0.8034398034398035,0.5093001174561266,0.3106796116504854,0.3118279569892473,0.9435362117685318,0.7660276792633441,0.7598369980762464,0.9751693002257337,0.9602649006622517,0.1847733105218135,0.18613607188703465,none,0.8996820074597908,0.8984106640887926,0.6360386162497387,COMPLETE
310,0.5833979829325058,2025-09-23 12:58:39.084993,2025-09-23 12:58:40.864474,0 days 00:00:01.779481,2.147163139520924,gbtree,0.9936937079621235,7.949861451032598,lossguide,7.063965021617661,0.0048804676934694246,7,10,0.16324188578425772,300,,0.5905871746733244,0.8531167885756059,undersample,0.9183096251302785,4.8963280364576205,,,,0.9972405999388896,0.6768348858634456,0.6701474201474201,0.5905871746733244,0.5899467463306923,0.5833979829325058,0.8531167885756059,0.7882491596920675,0.7843394127044753,0.42361499720201456,0.4180100055586437,0.9713430282292558,0.9653401797175867,undersample,0.9113418010855272,0.9090816513205184,0.9183096251302785,COMPLETE
311,0.6140963014654571,2025-09-23 12:58:40.985542,2025-09-23 12:58:41.644356,0 days 00:00:00.658814,0.08135923264952655,gbtree,0.63955602069573,3.8301188249873244,depthwise,16.125368389977258,0.01268131723463641,10,3,14.827474926560178,800,,0.47904771036033,0.7875620893212969,undersample,0.814196810299809,2.277453383891567,,,,0.42604108467117396,0.7145050670488279,0.7169328419328419,0.47904771036033,0.6139792387543253,0.6140963014654571,0.7875620893212969,0.7789140775970617,0.7720404779577835,0.4538571720892163,0.45567522783761394,0.9486740804106074,0.9413778348309799,undersample,0.9057192437893691,0.902790539602483,0.814196810299809,COMPLETE
312,0.6554744525547446,2025-09-23 12:58:41.768286,2025-09-23 12:59:50.159036,0 days 00:01:08.390750,0.0001432786061872979,dart,0.4595147980154054,4.982909198633231,depthwise,2.265993367859515,0.008356551951130978,0,6,9.893304108449925,1000,forest,0.6320966485482007,0.6093779057893567,undersample,0.8938064084195473,0.5554067624376691,0.030475547242574508,weighted,0.4699666476893526,0.7413612372558445,0.8579179035725253,0.855036855036855,0.6320966485482007,0.6658642272508426,0.6554744525547446,0.6093779057893567,0.7814294468450149,0.7746711208206964,0.7615638766519823,0.7597292724196277,0.5915312232677502,0.576379974326059,undersample,0.9075456561356783,0.9050211885158607,0.8938064084195473,COMPLETE
313,0.009369676320272573,2025-09-23 12:59:50.280091,2025-09-23 13:00:05.129555,0 days 00:00:14.849464,0.000238866335922359,dart,0.23024684025739994,1.5155712524575693,depthwise,0.004919483957445852,0.0006863587549435371,4,5,11.805587314463269,500,forest,0.5299690605116864,0.6156608938586539,oversample,0.6534849686085817,0.6871697000582426,0.24281911804114126,weighted,0.23516515311989472,0.37448666866808145,0.761080970416624,0.7618755118755118,0.5299690605116864,0.0034158838599487617,0.009369676320272573,0.6156608938586539,0.7332258651791865,0.7231914435559627,1.0,1.0,0.001710863986313088,0.004706889174154899,oversample,0.8853745015879768,0.8818864835908414,0.6534849686085817,COMPLETE
314,0.39099882884390164,2025-09-23 13:00:05.251885,2025-09-23 13:00:12.181690,0 days 00:00:06.929805,8.699630333489543,dart,0.3039237071864171,6.359084062356114,lossguide,0.1782384627861491,0.00451179245123361,1,11,2.751191891393688,300,tree,0.3963147363928534,0.9145574441913913,oversample,0.8680160913057764,1.655260867409073,0.2652259046677443,weighted,0.6960426617486534,0.34931207701881783,0.25212406592281705,0.2547092547092547,0.3963147363928534,0.39025204473376734,0.39099882884390164,0.9145574441913913,0.7429237561425828,0.7360556747429003,0.2424305267523849,0.2430071747946345,1.0,1.0,oversample,0.8971394830731869,0.8976554634976688,0.8680160913057764,COMPLETE
