number,value,datetime_start,datetime_complete,duration,params_alpha,params_booster,params_colsample_bytree,params_gamma,params_grow_policy,params_lambda,params_learning_rate,params_max_delta_step,params_max_depth,params_min_child_weight,params_n_estimators,params_normalize_type,params_params_decision_threshold,params_params_feature_fraction,params_params_resampling,params_params_sample_rows,params_params_scale_pos_weight,params_rate_drop,params_sample_type,params_skip_drop,params_subsample,user_attrs_acc_test,user_attrs_acc_val,user_attrs_decision_threshold,user_attrs_f1_test,user_attrs_f1_val,user_attrs_feature_fraction,user_attrs_pr_auc_test,user_attrs_pr_auc_val,user_attrs_prec_test,user_attrs_prec_val,user_attrs_rec_test,user_attrs_rec_val,user_attrs_resampling_strategy,user_attrs_roc_auc_test,user_attrs_roc_auc_val,user_attrs_sample_rows,state
2143,0.7166175024582104,2025-09-23 23:49:03.693051,2025-09-23 23:49:39.681992,0 days 00:00:35.988941,0.00888929486661668,dart,0.2766749265005912,1.9278587615386997,lossguide,0.00014093500227554273,0.035852498766415115,7,8,0.18761387259203846,700,forest,0.524599040714729,0.8913644476644054,none,0.9356822850380022,2.3685357833571694,0.20725466765171563,weighted,0.6429346547298883,0.3576310988793685,0.8555635172484389,0.8524774774774775,0.524599040714729,0.7251120202610559,0.7166175024582104,0.8913644476644054,0.825339844307059,0.8190857573297705,0.6658318425760287,0.6630276564774381,0.7959794696321643,0.7796320068463842,none,0.9272175701656263,0.9248131159253924,0.9356822850380022,COMPLETE
2144,0.7155044510385756,2025-09-23 23:49:39.828811,2025-09-23 23:49:41.165981,0 days 00:00:01.337170,0.0025682749878240597,gbtree,0.2747873986097087,3.4039468405783633,lossguide,0.0014733393034883004,0.10056629905167425,2,8,0.1364613024317497,800,,0.6558179265172781,0.9330257253324733,oversample,0.8685617804918003,1.8147005349341974,,,,0.7695251196140931,0.8399017299621251,0.842956592956593,0.6558179265172781,0.7098330241187384,0.7155044510385756,0.9330257253324733,0.8272495632181038,0.8210245196176289,0.6268020969855832,0.6314238952536825,0.8182207014542344,0.8254172015404364,oversample,0.9271537091915713,0.9253917959361053,0.8685617804918003,COMPLETE
2145,0.7001638448935008,2025-09-23 23:49:41.312402,2025-09-23 23:49:42.949149,0 days 00:00:01.636747,0.00011201739236241759,gbtree,0.21685629988791516,4.737104433572211,lossguide,0.0014187225419812985,0.0480276678136484,3,9,0.1407644673489766,800,,0.6302748191301107,0.9223245489818986,none,0.8871894981310259,4.909266641777544,,,,0.8815432998460289,0.8338622172177296,0.8313882063882064,0.6302748191301107,0.7067750677506776,0.7001638448935008,0.9223245489818986,0.810214535885889,0.7957961453788905,0.6118235846105724,0.6093155893536122,0.8366124893071001,0.8228498074454429,none,0.9216288571711758,0.9164623767011951,0.8871894981310259,COMPLETE
2146,0.7119197574061115,2025-09-23 23:49:43.095035,2025-09-23 23:49:44.101800,0 days 00:00:01.006765,0.00047278984771749314,gbtree,0.23706144705161503,5.755637773755042,lossguide,0.03383498171979383,0.0725480691788781,1,7,0.46761928613679726,700,,0.6913316659703135,0.9483153927263643,none,0.9630082859526905,2.330461228709873,,,,0.5537184529303312,0.8714300337803256,0.8735667485667485,0.6913316659703135,0.7096625057790107,0.7119197574061115,0.9483153927263643,0.8273245716287283,0.8207814969872036,0.7721327967806841,0.7825641025641026,0.6565440547476475,0.6529738981600343,none,0.9276775763888337,0.9260622631936538,0.9630082859526905,COMPLETE
2147,0.7042889390519187,2025-09-23 23:49:44.245931,2025-09-23 23:49:46.446289,0 days 00:00:02.200358,0.0002607033349150606,gbtree,0.2577217327627649,0.6926325249650755,lossguide,0.0011522822932674502,0.023181463924581674,2,7,0.4075979295780137,500,,0.654106103283583,0.9913171851422978,oversample,0.7440829846097841,2.5112679687534465,,,,0.607356348511552,0.8230115672023749,0.8256552006552007,0.654106103283583,0.7033796534568537,0.7042889390519187,0.9913171851422978,0.8262581403928146,0.8186854096479101,0.5872242910340877,0.592635885447107,0.8768177929854577,0.8677792041078306,oversample,0.9270943377677426,0.9252885208876737,0.7440829846097841,COMPLETE
2148,0.7252148396562565,2025-09-23 23:49:46.599706,2025-09-23 23:49:49.362640,0 days 00:00:02.762934,0.00048634318587939524,gbtree,0.3470526719010518,2.433631943005768,lossguide,0.011725851159969037,0.022451655356648368,2,8,0.26947190179817154,600,,0.6850946246478812,0.992827500949637,none,0.844964928464033,3.714094256546441,,,,0.7816871150509541,0.86651653188658,0.8657862407862408,0.6850946246478812,0.727538654408692,0.7252148396562565,0.992827500949637,0.8303550673331358,0.822947909142532,0.7111928104575164,0.7107641741988496,0.7446535500427716,0.7402652973898161,none,0.9287292823085589,0.9268714766063156,0.844964928464033,COMPLETE
2149,0.7032923443078144,2025-09-23 23:49:49.510302,2025-09-23 23:49:52.078563,0 days 00:00:02.568261,0.0001295269618674584,gbtree,0.3630540465794919,0.874170537807059,lossguide,0.10045471317952927,0.015700895959532567,5,7,0.10176049257290384,600,,0.6882342381279876,0.8879672251896102,none,0.9094781019609465,4.951702565673062,,,,0.8931434447717069,0.8455317842153751,0.8468468468468469,0.6882342381279876,0.7065914835699009,0.7032923443078144,0.8879672251896102,0.8139938784843528,0.8066344873114266,0.6477718360071302,0.655452865064695,0.7771599657827203,0.7586649550706034,none,0.9178456052886441,0.9167312603580959,0.9094781019609465,COMPLETE
2150,0.524198250728863,2025-09-23 23:49:52.223629,2025-09-23 23:49:53.446113,0 days 00:00:01.222484,0.00027249101812335284,gbtree,0.21420214432249782,2.4500146725978063,lossguide,0.025731372001461843,0.002242726010457999,0,6,0.15289354717701337,300,,0.6171299632950955,0.9199869226694468,none,0.8808775793452632,3.3530979939044774,,,,0.6462720211022198,0.8368307912785341,0.8329238329238329,0.6171299632950955,0.5387731481481481,0.524198250728863,0.9199869226694468,0.7529088281139363,0.7497561272112998,0.832737030411449,0.8225068618481244,0.39820359281437123,0.384681215233205,none,0.8976204405307846,0.8979495397019286,0.8808775793452632,COMPLETE
2151,0.7029702970297029,2025-09-23 23:49:53.589869,2025-09-23 23:49:55.930193,0 days 00:00:02.340324,0.0006748347529569812,gbtree,0.5875996585490052,5.1331372815566585,lossguide,0.0032406659090622324,0.003752522478160693,2,6,2.8034926610268687,800,,0.5762750702629862,0.962590005235155,none,0.787745266058264,2.5360791123005315,,,,0.7079590557782675,0.8520831200737026,0.8525798525798526,0.5762750702629862,0.7041965199590583,0.7029702970297029,0.962590005235155,0.8111087782876767,0.8043714308601577,0.6753042795445622,0.6786140979689367,0.7356715141146278,0.7291399229781772,none,0.9183783364696871,0.9171223350675595,0.787745266058264,COMPLETE
2152,0.6936243046640993,2025-09-23 23:49:56.073376,2025-09-23 23:49:58.645400,0 days 00:00:02.572024,0.0014098952855150395,gbtree,0.43870291055716876,3.4172842742460854,lossguide,0.0134685030805605,0.004194192789121775,6,8,0.1428503394408122,400,,0.6624696656213414,0.9624924590205537,none,0.7152225343150317,3.8181849511070234,,,,0.6029354244659189,0.8543351417750026,0.8533988533988534,0.6624696656213414,0.6980691703798005,0.6936243046640993,0.9624924590205537,0.794987639457662,0.7862186048845639,0.6926315789473684,0.6936243046640993,0.7035928143712575,0.6936243046640993,none,0.9164031070450368,0.9136307055865323,0.7152225343150317,COMPLETE
2153,0.6838510685172946,2025-09-23 23:49:58.789680,2025-09-23 23:50:08.789487,0 days 00:00:09.999807,0.0010398627402611234,dart,0.8763806023749829,0.20551657813323132,lossguide,0.012019524231317842,0.22267435429307636,9,12,0.459074830389344,300,forest,0.5697145345051389,0.8129810615319463,none,0.87345155040365,2.929263752821105,0.021965919574761503,weighted,0.8415955296300124,0.9846197370821258,0.8557682464940116,0.8530917280917281,0.5697145345051389,0.6912119219811528,0.6838510685172946,0.8129810615319463,0.8006664691237952,0.7973474808566016,0.7087640449438202,0.7048138056312443,0.674508126603935,0.6640992725716731,none,0.9136578909773739,0.9115862511917515,0.87345155040365,COMPLETE
2154,0.669295219319862,2025-09-23 23:50:08.933200,2025-09-23 23:50:11.746801,0 days 00:00:02.813601,0.00022587561025690282,gbtree,0.29943256514028443,3.571156777740639,lossguide,0.1892380613655771,0.006869354919484092,1,8,0.25405660746750613,700,,0.627446473627882,0.9805388816992672,none,0.9221951557025305,1.669335607503815,,,,0.811588857867303,0.8655952502815027,0.8626126126126126,0.627446473627882,0.6779494726514594,0.669295219319862,0.9805388816992672,0.8074734686164259,0.79935371715532,0.7947096032202415,0.789076118535735,0.5911035072711719,0.581086863500214,none,0.9205033039060584,0.9189865835721444,0.9221951557025305,COMPLETE
2155,0.6819607195906915,2025-09-23 23:50:11.891492,2025-09-23 23:50:33.189846,0 days 00:00:21.298354,0.00011376356839545828,dart,0.7851178457951401,1.56775947909998,lossguide,0.004190995592721886,0.030862666903114153,8,12,2.1551303644119355,500,forest,0.604442769660054,0.9858891982741481,undersample,0.9488995970746196,2.638642945645378,0.08137873694931665,weighted,0.7716606572796322,0.9380070856183865,0.7974204115057836,0.8027231777231777,0.604442769660054,0.6775297376568356,0.6819607195906915,0.9858891982741481,0.8161053797126434,0.809213646796872,0.5472492761252962,0.555077915099409,0.8892215568862275,0.8840393667094566,undersample,0.9208400777313819,0.9191067880124014,0.9488995970746196,COMPLETE
2156,0.6948982994331444,2025-09-23 23:50:33.332006,2025-09-23 23:50:35.153418,0 days 00:00:01.821412,0.00011182536034940434,gbtree,0.6449975304635446,0.19894078902310053,lossguide,4.350532873337142,0.020623752863508146,1,6,0.145514593069117,500,,0.6980566210889302,0.9218493294747236,oversample,0.7989744507400074,3.5840177574169694,,,,0.9468524779118388,0.8105230832224384,0.8126535626535627,0.6980566210889302,0.6952082990284868,0.6948982994331444,0.9218493294747236,0.8242713570541568,0.816344867541809,0.565194109772423,0.5692433761267414,0.9029084687767323,0.8917415489944374,oversample,0.9262890678646168,0.9242776231387241,0.7989744507400074,COMPLETE
2157,0.6950680572741736,2025-09-23 23:50:35.301500,2025-09-23 23:50:36.900667,0 days 00:00:01.599167,0.00013610209357163317,gbtree,0.522597641207472,2.3409869638794367,lossguide,0.027410160619606213,0.04796763368955878,1,8,1.5655770788257397,900,,0.6907397118973864,0.9004033161462024,undersample,0.8936841931525035,2.186116922383593,,,,0.7801953440853445,0.8217831917289384,0.8234029484029484,0.6907397118973864,0.69748045178106,0.6950680572741736,0.9004033161462024,0.7999527451496974,0.792333304111551,0.5873573309920983,0.5921686746987952,0.8584260051325919,0.8412494651262302,undersample,0.9185202465476796,0.9152267326383184,0.8936841931525035,COMPLETE
2158,0.6987376322074378,2025-09-23 23:50:37.043856,2025-09-23 23:51:16.410914,0 days 00:00:39.367058,0.027778489343361565,dart,0.5746652478513254,1.223761849511973,lossguide,0.0012325949046971855,0.015200180503381186,7,10,2.866378068454592,700,tree,0.46247891203608193,0.9434830738466935,oversample,0.7880849441395741,1.1740255228588075,0.12312623309239573,weighted,0.6547214690724605,0.45704420611569874,0.8168696898351929,0.8192055692055692,0.46247891203608193,0.6978550920452626,0.6987376322074378,0.9434830738466935,0.8240199384720817,0.8182971822498222,0.576611777839799,0.5809929078014184,0.88366124893071,0.8763371844244758,oversample,0.9257064911643925,0.9241330035211407,0.7880849441395741,COMPLETE
2159,0.6829461981338099,2025-09-23 23:51:16.553157,2025-09-23 23:51:29.046264,0 days 00:00:12.493107,0.00025252218458432393,dart,0.2215164527189809,3.053720239614565,lossguide,0.006088405086816713,0.006461325285036851,3,6,0.11489011200665983,400,forest,0.6707395599411395,0.9488823043913774,none,0.9121624716013047,4.549213661656357,0.08744391816888335,weighted,0.8100306500580757,0.7400786317748969,0.8383662606203296,0.8365069615069615,0.6707395599411395,0.6900883218842002,0.6829461981338099,0.9488823043913774,0.7748326828815442,0.7679472321465127,0.6376496191512514,0.6370370370370371,0.7519247219846023,0.7359863072314934,none,0.9087814048355218,0.9077089885914902,0.9121624716013047,COMPLETE
2160,0.6705882352941176,2025-09-23 23:51:29.189730,2025-09-23 23:51:35.913816,0 days 00:00:06.724086,0.0017107149823155467,gbtree,0.42262766389747863,3.484909956134363,lossguide,0.0008230980089817434,0.006499267904605223,0,12,0.16840423107840866,500,,0.644823679436815,0.8352010910321803,none,0.8222695842617354,4.782536154398444,,,,0.5175558404822432,0.8093970723717883,0.8165438165438166,0.644823679436815,0.6608378870673952,0.6705882352941176,0.8352010910321803,0.7323465987385933,0.7304333335287595,0.575507614213198,0.5878182404125041,0.7758768177929855,0.7804878048780488,none,0.8890065189420455,0.8932461055056974,0.8222695842617354,COMPLETE
2161,0.6987092391304348,2025-09-23 23:51:36.062538,2025-09-23 23:51:54.124475,0 days 00:00:18.061937,0.000237362312042683,dart,0.8685578079827478,6.950891447229462,depthwise,0.00024474503612713854,0.2738178982618158,4,12,3.0478102935116813,500,forest,0.5758072431502502,0.9522352131658202,oversample,0.9997719772737651,1.8988867663011937,0.10893380715744012,weighted,0.7709052028084806,0.3408791247924834,0.8131845634148838,0.8183865683865684,0.5758072431502502,0.6947650108713832,0.6987092391304348,0.9522352131658202,0.823037034920841,0.8194923474350841,0.5704476792090085,0.5792734441002535,0.888366124893071,0.8801882755669662,oversample,0.9260181119967804,0.924801512957866,0.9997719772737651,COMPLETE
2162,0.7215592680986476,2025-09-23 23:51:54.269507,2025-09-23 23:51:56.201608,0 days 00:00:01.932101,0.00019919945579452842,gbtree,0.37017486817453343,4.0838897810970405,lossguide,0.0722360696659762,0.0406201227771418,2,8,0.1042490458927058,600,,0.6925978819708097,0.9551030396078823,none,0.9400962121679199,4.774089682169288,,,,0.6647690285394405,0.8544375063977889,0.8566748566748567,0.6925978819708097,0.720738413197172,0.7215592680986476,0.9551030396078823,0.8266578393458641,0.8222950580816109,0.6663035584604212,0.6740988480118915,0.7848588537211292,0.7762088147197261,none,0.9269749617783869,0.9259140734322159,0.9400962121679199,COMPLETE
2163,0.7212408444635933,2025-09-23 23:51:56.347352,2025-09-23 23:52:11.066093,0 days 00:00:14.718741,0.00018904713224129929,dart,0.4440701944651926,1.811948547158982,lossguide,0.00014347870233900878,0.040466152093271895,5,10,0.4439749134929129,400,forest,0.6964957172485765,0.9683641666876476,none,0.8112234183617427,3.8146308436305594,0.127700420843944,weighted,0.5099041561368542,0.7729947832322189,0.8672330842460846,0.8675266175266175,0.6964957172485765,0.7244529424261738,0.7212408444635933,0.9683641666876476,0.8266824634916268,0.8203338301280443,0.7197129590544533,0.7262472885032538,0.7292557741659538,0.7163029525032092,none,0.9268421171383514,0.9250923069330985,0.8112234183617427,COMPLETE
2164,0.6973684210526315,2025-09-23 23:52:11.211753,2025-09-23 23:52:15.181949,0 days 00:00:03.970196,0.000175970030040288,dart,0.6329304226724435,2.441854624719858,lossguide,0.02630459402575937,0.1738921365143722,1,9,0.3721688740423135,200,forest,0.6953371087738328,0.9593816921245144,undersample,0.9794660537332073,2.929376346377132,0.09615624442387348,weighted,0.7290071153329019,0.7204297074167972,0.8204524516327157,0.821048321048321,0.6953371087738328,0.6976904515684247,0.6973684210526315,0.9593816921245144,0.8191460921108332,0.814023896430504,0.5842956120092379,0.585635359116022,0.8656971770744226,0.8617886178861789,undersample,0.9249555851098427,0.922648140384045,0.9794660537332073,COMPLETE
2165,0.7127680897975546,2025-09-23 23:52:15.325299,2025-09-23 23:52:20.417762,0 days 00:00:05.092463,0.00015030781619005274,dart,0.5494445529526584,0.4693040255551526,lossguide,0.013858834496938453,0.14489342681530998,7,11,2.4236342376881534,200,forest,0.543988499484791,0.8026191159326541,none,0.9955588152266404,2.6809288376471634,0.06939110590699306,weighted,0.8982846759909023,0.905575671940314,0.8470672535571706,0.8532964782964783,0.543988499484791,0.7004811547714515,0.7127680897975546,0.8026191159326541,0.8088936933405844,0.8082266617996133,0.659245283018868,0.6704374057315233,0.7472198460222412,0.7608044501497646,none,0.9163732630476977,0.9169789822752146,0.9955588152266404,COMPLETE
2166,0.7186507936507937,2025-09-23 23:52:20.562143,2025-09-23 23:52:27.616737,0 days 00:00:07.054594,0.0003428714457642231,dart,0.8082551578032752,5.171087389269325,depthwise,9.306614804833488,0.13578879418288617,0,8,7.7443718269415704,300,tree,0.6982169895628131,0.9907555596810097,none,0.9687257048126694,4.7296299184775545,0.07831140633095647,weighted,0.8706024181109677,0.6585536472414345,0.8510594738458389,0.8548321048321048,0.6982169895628131,0.7147618114095275,0.7186507936507937,0.9907555596810097,0.8219438111923392,0.8153666057424384,0.6597900832428519,0.6699963004069552,0.77972626176219,0.7749251176722294,none,0.9259298462881607,0.923096452561109,0.9687257048126694,COMPLETE
2167,0.09224489795918367,2025-09-23 23:52:27.760828,2025-09-23 23:52:32.274129,0 days 00:00:04.513301,0.000672535787829323,dart,0.2864018871332553,5.242683566993342,lossguide,0.12165376001967944,0.0024440130064622345,0,10,4.232298799623992,200,forest,0.66262426988227,0.9437838082429683,none,0.9546168835156666,3.4573225524773212,0.12532394470858627,weighted,0.7800495613180863,0.7390670816638913,0.7725458081686969,0.7723177723177723,0.66262426988227,0.0945395273023635,0.09224489795918367,0.9437838082429683,0.7633793490338548,0.7538008861883627,1.0,1.0,0.04961505560307956,0.04835258878904578,none,0.9053835060140979,0.9038840976982534,0.9546168835156666,COMPLETE
2168,0.6889763779527559,2025-09-23 23:52:32.420474,2025-09-23 23:52:34.539532,0 days 00:00:02.119058,0.00028739489386348454,gbtree,0.43327910339922193,2.8910582376866865,lossguide,0.0035020427506408315,0.024934397181258967,2,8,0.5132865933566608,500,,0.6981208258509152,0.9184607701071092,none,0.9106759613891782,2.05582330760157,,,,0.8448734507703968,0.8703040229296755,0.8705978705978706,0.6981208258509152,0.6902957712050843,0.6889763779527559,0.9184607701071092,0.8292465033554635,0.8241647420236408,0.8054763262977752,0.8106543138390272,0.6039349871685201,0.599058622165169,none,0.9282869177154083,0.9268122237349266,0.9106759613891782,COMPLETE
2169,0.7110362257792755,2025-09-23 23:52:34.681590,2025-09-23 23:52:39.271073,0 days 00:00:04.589483,0.33810893612276005,gbtree,0.2718567988174988,0.4505628382004435,lossguide,0.0005090810928404561,0.00958525495176397,6,10,2.782865417600451,800,,0.5917718263585727,0.932392039342051,none,0.8170059672653969,2.427749777833122,,,,0.3525638037997326,0.8617053946156208,0.8595413595413596,0.5917718263585727,0.7174231332357247,0.7110362257792755,0.932392039342051,0.8197644497165038,0.8143630627091082,0.7020057306590258,0.7001244296972211,0.7335329341317365,0.7222935387248609,none,0.9250132585627522,0.9230361919878255,0.8170059672653969,COMPLETE
2170,0.6348250143430866,2025-09-23 23:52:39.413451,2025-09-23 23:53:07.902152,0 days 00:00:28.488701,0.00015349827336553804,dart,0.4328317405393918,6.325478138864316,depthwise,0.00018089821954153567,0.0036648224305321376,2,11,3.229063006791309,600,forest,0.5696557785586587,0.9147690763385921,oversample,0.9659210637026463,3.8394693945402447,0.10760092460874329,weighted,0.6268439788420839,0.5737074116591959,0.739482035008701,0.7393529893529893,0.5696557785586587,0.6358563456860781,0.6348250143430866,0.9147690763385921,0.7904265679936756,0.7833518182935039,0.47774672113523975,0.47745415318230855,0.9503849443969205,0.9469405220367993,oversample,0.9157029098847118,0.9137628297006254,0.9659210637026463,COMPLETE
2171,0.37879293097699235,2025-09-23 23:53:08.046379,2025-09-23 23:53:12.814790,0 days 00:00:04.768411,1.4171657726165776,gbtree,0.24369347602888167,1.1104110583475848,lossguide,0.008089169894786459,0.0027049025058377635,2,11,0.1968798838764256,400,,0.6796893086024484,0.9070688549277257,none,0.9532959794122322,2.8737975247496372,,,,0.6765425725098576,0.8154365851161839,0.8092751842751843,0.6796893086024484,0.4098199672667758,0.37879293097699235,0.9070688549277257,0.7339590498058373,0.7256822424170235,0.8730822873082287,0.8580060422960725,0.2677502138579983,0.24304664099272572,none,0.8921984164780769,0.8935166878600771,0.9532959794122322,COMPLETE
2172,0.7230614300100705,2025-09-23 23:53:12.962825,2025-09-23 23:53:35.226913,0 days 00:00:22.264088,0.24297490830121005,dart,0.7541033790142095,1.8719188429912301,lossguide,0.044251865654647206,0.0272362168234406,3,10,1.2647392378987927,500,forest,0.6897054221371118,0.9824917965130525,none,0.9001193971812969,4.781092204663832,0.19591705976334123,weighted,0.7236514039212547,0.75230166958268,0.8573037158358071,0.8592342342342343,0.6897054221371118,0.7216453674121406,0.7230614300100705,0.9824917965130525,0.8279279959614614,0.822219162343047,0.6767790262172285,0.6830289193302892,0.7728828058169376,0.7680787334189131,none,0.9273524581265982,0.9255670784827602,0.9001193971812969,COMPLETE
2173,0.7244660604779023,2025-09-23 23:53:35.370452,2025-09-23 23:54:10.202029,0 days 00:00:34.831577,0.0002066124588819036,dart,0.8515536785887596,8.118651293195,depthwise,0.0005592070165210965,0.07655116106235484,0,12,3.346052747427838,700,forest,0.6725994661567629,0.9968081640016798,none,0.9457129592036804,3.218952745535288,0.08972714176482498,weighted,0.6688512733716927,0.49940179940822005,0.8642645101852799,0.8666052416052417,0.6725994661567629,0.7221290863369656,0.7244660604779023,0.9968081640016798,0.8268275212624658,0.8199451479052245,0.7078882497945769,0.7161371237458194,0.7369546621043627,0.7329910141206675,none,0.9271505147039101,0.9256698064930206,0.9457129592036804,COMPLETE
