number,value,datetime_start,datetime_complete,duration,params_alpha,params_booster,params_colsample_bytree,params_gamma,params_grow_policy,params_lambda,params_learning_rate,params_max_delta_step,params_max_depth,params_min_child_weight,params_n_estimators,params_normalize_type,params_params_decision_threshold,params_params_feature_fraction,params_params_resampling,params_params_sample_rows,params_params_scale_pos_weight,params_rate_drop,params_sample_type,params_skip_drop,params_subsample,user_attrs_acc_test,user_attrs_acc_val,user_attrs_decision_threshold,user_attrs_f1_test,user_attrs_f1_val,user_attrs_feature_fraction,user_attrs_pr_auc_test,user_attrs_pr_auc_val,user_attrs_prec_test,user_attrs_prec_val,user_attrs_rec_test,user_attrs_rec_val,user_attrs_resampling_strategy,user_attrs_roc_auc_test,user_attrs_roc_auc_val,user_attrs_sample_rows,state
1558,0.6861419604056012,2025-09-23 21:17:29.171349,2025-09-23 21:18:22.762875,0 days 00:00:53.591526,0.0004966044616797521,dart,0.3032891226158597,4.380265613169358,lossguide,0.00011425151075703897,0.07756031417505563,7,10,0.8292467840269193,900,tree,0.4965721042486085,0.829509436099071,none,0.8527275547955819,0.9551517146408837,0.17319886972806228,uniform,0.624944285459002,0.7427559950974368,0.8717371276486846,0.866912366912367,0.4965721042486085,0.701311084624553,0.6861419604056012,0.829509436099071,0.8246830114934227,0.814702819707309,0.7921378567582121,0.7872576177285319,0.6291702309666382,0.6080445014976466,none,0.926288636177095,0.9231716847053943,0.8527275547955819,COMPLETE
1559,0.7164794007490637,2025-09-23 21:18:22.899330,2025-09-23 21:18:23.543130,0 days 00:00:00.643800,0.25951130304446623,gbtree,0.6725416372673574,5.153819838616947,lossguide,0.0002184841279203291,0.3179155319772411,9,5,0.236796784454107,300,,0.4100907720745568,0.983403160408125,none,0.9571198203285008,1.6895538961778969,,,,0.5979556150529585,0.8432797625140751,0.845004095004095,0.4100907720745568,0.7152687372140599,0.7164794007490637,0.983403160408125,0.8188236406615335,0.8176043599255756,0.6327739387956565,0.637029637029637,0.8224978614200171,0.8185708172871202,none,0.9234910132442883,0.9236649115954645,0.9571198203285008,COMPLETE
1560,0.6759449628340978,2025-09-23 21:18:23.681559,2025-09-23 21:18:57.658584,0 days 00:00:33.977025,0.00016165523594459277,dart,0.7600780466545352,4.288321672046994,lossguide,0.008601895593401385,0.18620762292518145,0,11,0.5539505622630915,700,tree,0.6301478877705649,0.8718437442234221,undersample,0.8870689351763038,4.276547318014397,0.16995042744161667,uniform,0.409253036640291,0.9418613722562008,0.7866721261132152,0.7902334152334153,0.6301478877705649,0.6726358781024191,0.6759449628340978,0.8718437442234221,0.8162686835877329,0.8154740470543669,0.5315292949354519,0.5361264425489213,0.9157399486740804,0.9144201968335472,undersample,0.9227084213256397,0.9232004473966078,0.8870689351763038,COMPLETE
1561,0.6660175267770204,2025-09-23 21:18:57.793575,2025-09-23 21:18:58.718002,0 days 00:00:00.924427,0.07601488599594569,gbtree,0.393097048569787,1.4912505945369579,lossguide,0.0010114307621718035,0.2556310481221197,10,9,0.20078722262142412,300,,0.5248930777078328,0.8524212234811295,none,0.7460802703172698,0.7350265559762382,,,,0.5692935816804693,0.8622172177295526,0.8595413595413596,0.5248930777078328,0.6726653696498055,0.6660175267770204,0.8524212234811295,0.8034692349575776,0.8003961655114165,0.7795941375422774,0.7724449463579899,0.5915312232677502,0.5853658536585366,none,0.9169769924364892,0.9152158206663766,0.7460802703172698,COMPLETE
1562,0.6152991808968485,2025-09-23 21:18:58.853614,2025-09-23 21:18:59.561482,0 days 00:00:00.707868,0.00033592849698408587,gbtree,0.7256028704252974,8.02877164394046,depthwise,12.608130236950366,0.013126919999379745,0,5,52.84566830716522,300,,0.5733971530695761,0.9685931296211612,undersample,0.7446320034660341,3.9265207186787308,,,,0.963795079384936,0.7127648684614597,0.7163185913185913,0.5733971530695761,0.6138177814478393,0.6152991808968485,0.9685931296211612,0.7902675090400845,0.7832912357021804,0.4525162337662338,0.45540484997944924,0.9538066723695466,0.9482242190842961,undersample,0.9115790853266649,0.9094982064921685,0.7446320034660341,COMPLETE
1563,0.6830845771144278,2025-09-23 21:18:59.701236,2025-09-23 21:19:02.706605,0 days 00:00:03.005369,0.0002411898607731125,gbtree,0.5022785438832562,5.036693829329698,lossguide,0.01569438670599935,0.009953292480689869,0,12,0.15330116614970926,500,,0.6546571584894433,0.8123817162995933,none,0.9615128922785339,1.6830343233422058,,,,0.7465432528266907,0.8687685535878801,0.8695741195741196,0.6546571584894433,0.6831438457736035,0.6830845771144278,0.8123817162995933,0.8229133435425506,0.8169608849490274,0.8091334894613583,0.815805109922757,0.5911035072711719,0.5875053487376979,none,0.9256667471332207,0.9231407338614956,0.9615128922785339,COMPLETE
1564,0.6477564102564103,2025-09-23 21:19:02.843479,2025-09-23 21:19:03.911059,0 days 00:00:01.067580,0.00022923865058495195,gbtree,0.8839031688631065,1.183080465280914,depthwise,0.00011610276315703273,0.13764008510801665,1,11,0.17912427428309685,800,,0.6244722992293068,0.8503750224054151,undersample,0.8614652593972049,4.536908515957784,,,,0.8671358707060457,0.7682464940116696,0.7749795249795249,0.6244722992293068,0.643801132787917,0.6477564102564103,0.8503750224054151,0.7259210181425917,0.7126494592704183,0.5092085614733698,0.5178068152703049,0.8751069289991446,0.8647839109970047,undersample,0.8896692168463121,0.8888641282137701,0.8614652593972049,COMPLETE
1565,0.6738784600699969,2025-09-23 21:19:04.047749,2025-09-23 21:19:22.677510,0 days 00:00:18.629761,0.0006190998208478392,dart,0.9904870281863085,8.76586044861777,lossguide,0.002593833758420659,0.03843354949823416,8,12,0.12903686763831354,500,tree,0.642984982340717,0.9142088172714047,oversample,0.9697796784116129,2.9879215070169485,0.237751904055189,uniform,0.48309009446517004,0.3511851536487056,0.7867744907360016,0.7901310401310402,0.642984982340717,0.6699413722072571,0.6738784600699969,0.9142088172714047,0.8122755895631304,0.8066942455563666,0.5320916184243645,0.5363383134970878,0.9041916167664671,0.9062901155327343,oversample,0.9198759755994097,0.9188894123180443,0.9697796784116129,COMPLETE
1566,0.6789594995060916,2025-09-23 21:19:22.814539,2025-09-23 21:19:26.834275,0 days 00:00:04.019736,0.0009616204753898464,dart,0.8141849479398071,0.6897173753001851,depthwise,0.0038791820753470794,0.004083740452834561,0,10,0.27607742346956654,200,forest,0.48820520406365314,0.9736188786357353,none,0.8830585306290917,3.790423452935345,0.28959468417270295,weighted,0.8939945698898529,0.48339525792308197,0.7961920360323472,0.8003685503685504,0.48820520406365314,0.6767332359149213,0.6789594995060916,0.9736188786357353,0.8072483000635995,0.8008461539546594,0.5454069615283957,0.5517795022745517,0.8913601368691189,0.8823277706461276,none,0.9189703527370544,0.9169181458722774,0.8830585306290917,COMPLETE
1567,0.6753409625333124,2025-09-23 21:19:26.969566,2025-09-23 21:19:27.666036,0 days 00:00:00.696470,0.00039913701030246817,gbtree,0.7490234374773052,3.1761775776495447,depthwise,0.6773292679420532,0.025231543308007063,4,6,5.936755037948404,200,,0.6087752410896371,0.9846031004623873,oversample,0.9923695122731185,3.0347689688607042,,,,0.8474953324825258,0.7842153751663425,0.7879811629811629,0.6087752410896371,0.6726708074534161,0.6753409625333124,0.9846031004623873,0.8196666161176057,0.8113829580396645,0.5280351048269137,0.5329045027214251,0.9264328485885372,0.9216944801026957,oversample,0.9244893625863215,0.9222168151817719,0.9923695122731185,COMPLETE
1568,0.6963673749143249,2025-09-23 21:19:27.799374,2025-09-23 21:19:28.625766,0 days 00:00:00.826392,0.0005124636300799519,gbtree,0.7468402786600901,4.049488055714557,depthwise,1.9865119210514235,0.014188709721037444,2,9,3.6027337934130523,200,,0.6331320393716994,0.9564659114979562,none,0.9797568035730663,2.480444795827233,,,,0.9840132959150626,0.8650834271675709,0.8639434889434889,0.6331320393716994,0.6983981693363844,0.6963673749143249,0.9564659114979562,0.8119871733052886,0.8048518292108613,0.7509842519685039,0.7470588235294118,0.6526946107784432,0.6521181001283697,none,0.9175369487105725,0.9158286185840843,0.9797568035730663,COMPLETE
1569,0.7137476459510358,2025-09-23 21:19:28.762230,2025-09-23 21:19:56.894395,0 days 00:00:28.132165,0.00014661817880444504,dart,0.9422284719476711,5.215464013480701,depthwise,0.00014335365009300718,0.012007222434500883,0,12,0.14001757559259365,600,tree,0.6068454387647625,0.9266097739349894,none,0.8163144600981638,3.983236943778258,0.11332607656599811,uniform,0.635809034231561,0.5102699942975166,0.8437915856280069,0.8443898443898444,0.6068454387647625,0.7131578947368421,0.7137476459510358,0.9266097739349894,0.8226662674605243,0.8139097887970064,0.636150234741784,0.6374032963336697,0.811377245508982,0.8108686350021395,none,0.9251111940718597,0.9224606502487267,0.8163144600981638,COMPLETE
1570,0.7223577235772358,2025-09-23 21:19:57.028158,2025-09-23 21:19:57.754096,0 days 00:00:00.725938,0.0002746150713701046,gbtree,0.694886786596657,7.584583501371046,depthwise,0.20934935989138762,0.29746394638531437,0,12,0.14273274062643745,700,,0.6078107319928115,0.8382158369787643,none,0.8443796556463388,2.519576774543068,,,,0.5749901327411528,0.8580202681953117,0.8601556101556102,0.6078107319928115,0.72086939021936,0.7223577235772358,0.8382158369787643,0.8219711935039853,0.8155782522576198,0.6807297605473204,0.6879597367402246,0.7660393498716852,0.7603765511339324,none,0.9254035616407763,0.9222848782468659,0.8443796556463388,COMPLETE
1571,0.6795833333333333,2025-09-23 21:19:57.890952,2025-09-23 21:19:58.625941,0 days 00:00:00.734989,0.0038343655302783535,gbtree,0.7131624436927214,5.8617126877231644,depthwise,0.01765768164115427,0.28881656161593383,0,10,0.15848473978858826,700,,0.5999548598453298,0.7238423641263851,none,0.9554771066620108,2.2038009575472475,,,,0.5603571129852449,0.8462483365748797,0.8425470925470926,0.5999548598453298,0.6920869208692086,0.6795833333333333,0.7238423641263851,0.7795896370383464,0.766280257983547,0.6645669291338583,0.6622005684125051,0.7219846022241232,0.6979032948224219,none,0.9085556610407998,0.9025727896188509,0.9554771066620108,COMPLETE
1572,0.6861963909069604,2025-09-23 21:19:58.761237,2025-09-23 21:20:00.266714,0 days 00:00:01.505477,0.0009996155981301126,gbtree,0.340853519368318,3.100622249292427,lossguide,0.00025678852377646397,0.030266174377854706,5,7,0.2217741391301822,800,,0.5425488116243271,0.8380902353321772,none,0.8542879899421623,1.2157660568077733,,,,0.7109641918588742,0.8664141672637936,0.862919737919738,0.5425488116243271,0.697286012526096,0.6861963909069604,0.8380902353321772,0.8096760363553509,0.7994627672360506,0.7617840851495185,0.7585492227979275,0.6428571428571429,0.6264441591784339,none,0.9215015093522512,0.9174076874525625,0.8542879899421623,COMPLETE
1573,0.6977911646586346,2025-09-23 21:20:00.404886,2025-09-23 21:20:01.783403,0 days 00:00:01.378517,0.00022601452708873992,gbtree,0.6349591914997095,6.606502497604284,depthwise,0.2538444978071082,0.01920352400484848,3,11,0.18033390279476966,800,,0.37629450499003647,0.9423871426175158,none,0.9377043151495088,2.781163316771625,,,,0.5909257916492532,0.8087828846350701,0.8151105651105651,0.37629450499003647,0.6913417052214144,0.6977911646586346,0.9423871426175158,0.82819847590124,0.821239478796066,0.563274098007539,0.572959604286892,0.894781864841745,0.8921694480102695,none,0.9282798668192191,0.926132197705123,0.9377043151495088,COMPLETE
1574,0.7025901942645698,2025-09-23 21:20:01.917975,2025-09-23 21:20:02.703341,0 days 00:00:00.785366,0.0006130530604533186,gbtree,0.7915537022123351,8.538271935903996,depthwise,0.04098495143008609,0.4719873707412012,1,9,0.13492535241294948,1000,,0.6015279398511801,0.9077069402141088,none,0.827916243838319,1.5418818119117996,,,,0.6757524261785607,0.8699969290613164,0.8683456183456183,0.6015279398511801,0.7080459770114943,0.7025901942645698,0.9077069402141088,0.8154097235836624,0.8133518907444088,0.7654075546719682,0.7644690488173125,0.6586826347305389,0.6499786050492083,none,0.9225364945752995,0.9217558635438043,0.827916243838319,COMPLETE
1575,0.7011788826242953,2025-09-23 21:20:02.838070,2025-09-23 21:20:03.418677,0 days 00:00:00.580607,0.010187149979540839,gbtree,0.5409110314369863,6.337221569739355,lossguide,0.0004688362324050155,0.24888364697691548,10,8,8.640435009629504,200,,0.39097807653335914,0.8969324063690423,oversample,0.8442022527854818,0.7926609693274981,,,,0.846318631070889,0.8161531374756884,0.8209459459459459,0.39097807653335914,0.696313831586067,0.7011788826242953,0.8969324063690423,0.8222661706661236,0.8135966416987575,0.5757829977628636,0.5836177474402731,0.8806672369546621,0.8780487804878049,oversample,0.9258909080736963,0.9223636805350057,0.8442022527854818,COMPLETE
1576,0.6651989306494732,2025-09-23 21:20:03.552849,2025-09-23 21:20:04.382821,0 days 00:00:00.829972,0.001735635748369554,gbtree,0.7817812597746902,5.993264245527791,depthwise,0.7040045055886295,0.36235420555417297,0,12,2.499451475359343,900,,0.6340882778850363,0.7540216635780201,undersample,0.9428859692364162,3.092997331687942,,,,0.5090476951273161,0.7724434435459105,0.782043407043407,0.6340882778850363,0.6556158017041054,0.6651989306494732,0.7540216635780201,0.7986612485797453,0.7937368630350521,0.5139664804469274,0.5258577821979115,0.9050470487596236,0.9050064184852374,undersample,0.9130541615885825,0.9131854453066343,0.9428859692364162,COMPLETE
1577,0.7089430894308943,2025-09-23 21:20:04.517825,2025-09-23 21:20:05.394709,0 days 00:00:00.876884,0.00010904101882141463,gbtree,0.9124426100745741,9.435231265740683,depthwise,0.15267303730805995,0.05411842062301044,0,10,0.5437498308517358,700,,0.5830220603650577,0.742916002172341,none,0.9082253486951929,2.4274329168125486,,,,0.4687737376639155,0.8565871634763026,0.8533988533988534,0.5830220603650577,0.7162244277901559,0.7089430894308943,0.742916002172341,0.8125566665876018,0.8075559059877453,0.6802616390919585,0.6751838946960899,0.756201881950385,0.7462558836114677,none,0.9217394267350874,0.9198743113581189,0.9082253486951929,COMPLETE
1578,0.7134776672518042,2025-09-23 21:20:05.530284,2025-09-23 21:20:06.319493,0 days 00:00:00.789209,0.00016056953061066657,gbtree,0.9167219441567347,5.015505419060684,depthwise,1.1925334222359854,0.4785765987749178,1,12,0.15766658963117003,800,,0.6667631481935473,0.8566140043682583,none,0.8003116178009704,4.395086480883422,,,,0.7796003716188756,0.8452246903470161,0.8496109746109746,0.6667631481935473,0.7066356228172294,0.7134776672518042,0.8566140043682583,0.8102054900210636,0.8097636313026467,0.6466619318181818,0.6555555555555556,0.7788708297690333,0.7826272999572101,none,0.9198075962959599,0.9199057516572233,0.8003116178009704,COMPLETE
1579,0.7209775967413442,2025-09-23 21:20:06.457109,2025-09-23 21:20:10.518442,0 days 00:00:04.061333,0.03250405321939708,dart,0.968620538721157,3.0420556838527446,lossguide,0.00979822843415059,0.05460228535956506,6,8,0.4214095544322058,200,forest,0.5501877086883462,0.9882921766865982,none,0.9809787364556407,1.475575628154504,0.10568841657486638,uniform,0.4633488957801031,0.6698534849161958,0.8711229399119664,0.8737714987714987,0.5501877086883462,0.7159936837356192,0.7209775967413442,0.9882921766865982,0.8288517394413639,0.8233885264596814,0.7575178997613365,0.7651296829971181,0.6787852865697177,0.6816431322207959,none,0.9282032566736875,0.9260516679280215,0.9809787364556407,COMPLETE
1580,0.6553701772679875,2025-09-23 21:20:10.653463,2025-09-23 21:20:18.482064,0 days 00:00:07.828601,0.00654116635140294,dart,0.9017066497182827,1.3372352904944496,lossguide,0.021530986036793247,0.05235924906731322,6,8,1.329925141815648,300,forest,0.6018159627025026,0.8407914444931492,none,0.9421433799669745,0.9363342433115857,0.07186347345248895,uniform,0.34532329669961453,0.5804603535278312,0.8677449073600164,0.8646601146601146,0.6018159627025026,0.6645898234683282,0.6553701772679875,0.8407914444931492,0.8236274486375464,0.82072274549354,0.845442536327609,0.8385590393595731,0.5474764756201882,0.5378690629011553,none,0.9250282525093421,0.9244101791250581,0.9421433799669745,COMPLETE
1581,0.6632280249301525,2025-09-23 21:20:18.616579,2025-09-23 21:20:31.158884,0 days 00:00:12.542305,0.5206559785903407,dart,0.9872277836228698,3.9309213879507325,lossguide,0.3165700412762363,0.015989293794609845,6,7,0.10640888564343667,400,forest,0.5974137117586954,0.9343824079022687,none,0.9895479986296771,2.1122749142179487,0.1245230084965122,uniform,0.4042688326440063,0.5392481237455345,0.8391851776026206,0.8395782145782146,0.5974137117586954,0.6663835209173923,0.6632280249301525,0.9343824079022687,0.7423684219722579,0.7395751549515668,0.6617460986925348,0.6662348877374784,0.6710863986313088,0.6602481814291827,none,0.8941393123551618,0.8963954906319137,0.9895479986296771,COMPLETE
1582,0.6141078838174274,2025-09-23 21:20:31.292950,2025-09-23 21:21:26.581925,0 days 00:00:55.288975,0.00013073055444912002,dart,0.3465011875220357,5.6311600709845155,lossguide,0.0016671903393568905,0.053899676206888375,5,9,0.32478854278472796,900,forest,0.5064874240518816,0.934558425386789,undersample,0.9428956017191767,3.12332345870942,0.08438598392851397,uniform,0.3604642354191938,0.7346073329573488,0.7111270344968779,0.7143734643734644,0.5064874240518816,0.6098977052806193,0.6141078838174274,0.934558425386789,0.7479865929769178,0.7440979320826122,0.4505718954248366,0.4537093807480074,0.9435414884516681,0.9499358151476252,undersample,0.9001792251473753,0.9008052229131603,0.9428956017191767,COMPLETE
1583,0.6896672504378284,2025-09-23 21:21:26.717761,2025-09-23 21:21:27.526442,0 days 00:00:00.808681,0.0007377596597751802,gbtree,0.7538296016837958,9.712477093134742,depthwise,3.447295837042584,0.05800176156968697,0,12,0.1291935574507624,500,,0.5716073069074903,0.8303303040058702,none,0.8429044534681928,4.312319019955265,,,,0.6962421315427858,0.8207595455010749,0.8185913185913186,0.5716073069074903,0.696165191740413,0.6896672504378284,0.8303303040058702,0.7987180124870492,0.7877552157477758,0.5856934306569344,0.5837533353098132,0.8579982891360137,0.842533162173727,none,0.9184729048161246,0.9132656295859434,0.8429044534681928,COMPLETE
1584,0.7122923588039867,2025-09-23 21:21:27.661302,2025-09-23 21:21:40.223149,0 days 00:00:12.561847,0.03169333468936828,dart,0.9421706401329728,2.7635875298820745,lossguide,0.006276490252036044,0.03172833246077514,7,7,0.39367780041660577,400,forest,0.6059684487308351,0.8816292212424026,none,0.9634982091234037,2.155607492136854,0.11048612630387573,uniform,0.36510433598242387,0.9768698585469782,0.8692803767018119,0.867014742014742,0.6059684487308351,0.719525587524709,0.7122923588039867,0.8816292212424026,0.8208181451674371,0.8164784250563168,0.7395033860045147,0.7382920110192838,0.7005988023952096,0.6880616174582799,none,0.9237787473671379,0.9223101283771904,0.9634982091234037,COMPLETE
1585,0.6274797942689199,2025-09-23 21:21:40.359697,2025-09-23 21:21:41.126092,0 days 00:00:00.766395,0.0009247179472872348,gbtree,0.543654294178767,6.013163462570306,depthwise,1.5120180156272023,0.08859714478428338,0,10,0.5193655055056474,700,,0.578548131322532,0.8007006766586203,none,0.8023972237691869,1.1288009301063744,,,,0.3457871466598933,0.8458388780837343,0.8442874692874693,0.578548131322532,0.6351744186046512,0.6274797942689199,0.8007006766586203,0.7457766239901339,0.7396360360041362,0.7324022346368715,0.7336769759450171,0.5607356715141146,0.5481386392811296,none,0.8981677627500636,0.8993977800730348,0.8023972237691869,COMPLETE
1586,0.6768979591836735,2025-09-23 21:21:41.263297,2025-09-23 21:21:42.054126,0 days 00:00:00.790829,0.0052286666521776,gbtree,0.7882309224175921,9.04695491506795,depthwise,0.3776667879156896,0.34815719630189096,1,9,0.34061845709204597,900,,0.6061114689292515,0.7469676118347938,oversample,0.7559278044127863,3.0039326729663163,,,,0.5805823963454962,0.7923021803664654,0.7973996723996724,0.6061114689292515,0.6724778046811946,0.6768979591836735,0.7469676118347938,0.7900994124429341,0.7832867772752783,0.5400570391495981,0.5472544878563886,0.8909324208725407,0.8870346598202824,oversample,0.9139489634837252,0.9103551273916581,0.7559278044127863,COMPLETE
1587,0.7223276407337128,2025-09-23 21:21:42.191057,2025-09-23 21:21:45.800802,0 days 00:00:03.609745,0.04491149081979582,dart,0.9807824815132121,5.511039494588715,lossguide,0.00466044990193728,0.07074065619177436,7,8,0.15990433986329958,200,forest,0.46348333856957435,0.9335543217632918,none,0.9950510532886414,1.3258395207752234,0.15234488381495048,uniform,0.4080556840019639,0.49595361618855577,0.8650834271675709,0.8651719901719902,0.46348333856957435,0.7238055322715843,0.7223276407337128,0.9335543217632918,0.8276823784675669,0.820090706818142,0.709531635168447,0.7119700748129676,0.7386655260906758,0.7329910141206675,none,0.9271636092254042,0.9248845763854449,0.9950510532886414,COMPLETE
1588,0.6597938144329897,2025-09-23 21:21:45.941199,2025-09-23 21:22:01.922925,0 days 00:00:15.981726,20.917730458104497,dart,0.8493861279582877,6.8660539161332075,lossguide,0.0016618033111908872,0.07270438755347294,8,9,0.19876245412714819,500,forest,0.48707849614481263,0.9192902144809478,none,0.8909035056550074,0.9836042656893426,0.20433475204101686,uniform,0.37985648272388695,0.5109503219545144,0.8604770191421844,0.8581081081081081,0.48707849614481263,0.6679658952496955,0.6597938144329897,0.9192902144809478,0.797786070496099,0.7914843601240185,0.7758913412563667,0.7737478411053541,0.586398631308811,0.5750962772785623,none,0.912805768588551,0.9113652477705747,0.8909035056550074,COMPLETE
