number,value,datetime_start,datetime_complete,duration,params_alpha,params_booster,params_colsample_bytree,params_gamma,params_grow_policy,params_lambda,params_learning_rate,params_max_delta_step,params_max_depth,params_min_child_weight,params_n_estimators,params_normalize_type,params_params_decision_threshold,params_params_feature_fraction,params_params_resampling,params_params_sample_rows,params_params_scale_pos_weight,params_rate_drop,params_sample_type,params_skip_drop,params_subsample,user_attrs_acc_test,user_attrs_acc_val,user_attrs_decision_threshold,user_attrs_f1_test,user_attrs_f1_val,user_attrs_feature_fraction,user_attrs_pr_auc_test,user_attrs_pr_auc_val,user_attrs_prec_test,user_attrs_prec_val,user_attrs_rec_test,user_attrs_rec_val,user_attrs_resampling_strategy,user_attrs_roc_auc_test,user_attrs_roc_auc_val,user_attrs_sample_rows,state
2546,0.38612143742255267,2025-09-24 01:38:25.967919,2025-09-24 01:38:29.769660,0 days 00:00:03.801741,0.00026436116457160413,dart,0.657960266066459,2.7635045587867335,depthwise,0.3622387849484157,0.0009784141807184055,8,12,6.462709834571793,200,forest,0.46694310339606016,0.8636263954847452,undersample,0.9962123676121736,2.01469109445568,0.14652351911333383,weighted,0.6387391164679816,0.8887761831165542,0.23932848807452145,0.23925061425061425,0.46694310339606016,0.3862228462872718,0.38612143742255267,0.8636263954847452,0.7667345633500604,0.7578451945627578,0.23932848807452145,0.23925061425061425,1.0,1.0,undersample,0.9069313935713555,0.9040055977552318,0.9962123676121736,COMPLETE
2547,0.6497737556561086,2025-09-24 01:38:29.921196,2025-09-24 01:38:30.973387,0 days 00:00:01.052191,0.00037820216361816384,gbtree,0.8430323127340517,0.15724897564188733,lossguide,0.0017858442865486205,0.0779301710613581,8,4,0.10738316331631155,500,,0.3167854564724501,0.8684713519998297,undersample,0.9175036501970328,0.9637624611531284,,,,0.6525660474625211,0.7517657897430648,0.7622850122850123,0.3167854564724501,0.6396195571407342,0.6497737556561086,0.8684713519998297,0.7958014629178092,0.7923872798564588,0.4900933728080164,0.5017470300489169,0.9204448246364414,0.9216944801026957,undersample,0.9112503696684144,0.9100098599311641,0.9175036501970328,COMPLETE
2548,0.0,2025-09-24 01:38:31.121282,2025-09-24 01:38:42.831702,0 days 00:00:11.710420,17.588090717449482,dart,0.20967528804418384,1.3476017593630205,depthwise,6.997967564474253,0.0005135169886575659,8,11,0.33397410318573617,400,forest,0.6174342678610916,0.5615933543457838,none,0.5007798468632382,3.153820375455674,0.051688139527194615,weighted,0.6807703377639307,0.45679932441791415,0.7606715119254785,0.7607493857493858,0.6174342678610916,0.0,0.0,0.5615933543457838,0.6596248124913766,0.6597436387184458,0.0,0.0,0.0,0.0,none,0.8636885925939228,0.8638219011856736,0.5007798468632382,COMPLETE
2549,0.6058343702474769,2025-09-24 01:38:42.980256,2025-09-24 01:38:44.451278,0 days 00:00:01.471022,0.004642767981506135,gbtree,0.21617021238433237,3.030626369079061,lossguide,26.98263351908897,0.0019496951025905775,2,4,0.20968521839239276,1000,,0.5480468548474243,0.8118034434004531,oversample,0.5944525875110382,2.0150134551114096,,,,0.430273169825944,0.7013000307093868,0.7081285831285832,0.5480468548474243,0.6008207934336526,0.6058343702474769,0.8118034434004531,0.7374845513461333,0.7308417395627396,0.4416733708769107,0.44750816993464054,0.9392643284858854,0.9375267436884895,oversample,0.8937661041029998,0.8926464652955818,0.5944525875110382,COMPLETE
2550,0.6803358088472715,2025-09-24 01:38:44.598925,2025-09-24 01:39:11.797557,0 days 00:00:27.198632,0.00033901459394969683,dart,0.9841996817069575,8.02822941850211,depthwise,0.00036663592178097314,0.2179967703253927,7,12,0.2403449541543888,600,forest,0.5561509029692078,0.9681399015870723,oversample,0.9920922024214404,3.121147381082363,0.25162902996472936,weighted,0.7251546735374949,0.5479705405846131,0.7934281912171154,0.7972972972972973,0.5561509029692078,0.6762913057427014,0.6803358088472715,0.9681399015870723,0.820243599073814,0.8134645917884349,0.5410677618069816,0.5462794918330308,0.9016253207869974,0.9015832263585793,oversample,0.9234381746916226,0.9212512928095518,0.9920922024214404,COMPLETE
2551,0.7141881120473696,2025-09-24 01:39:11.950541,2025-09-24 01:39:40.561870,0 days 00:00:28.611329,0.289893716069917,dart,0.44444305154395247,2.4024472880368153,lossguide,0.0012532525837106354,0.016132744667949277,5,10,1.2154082265794062,600,forest,0.525147021339937,0.9901865464647163,none,0.825072133758186,1.3490098033447198,0.13262108630602165,weighted,0.666417866758986,0.7262217232405872,0.8715323984031119,0.8715192465192465,0.525147021339937,0.7168960072185878,0.7141881120473696,0.9901865464647163,0.8285496569256362,0.8221931192176022,0.758472553699284,0.7633885102239533,0.6796407185628742,0.6709456568249893,none,0.9279018524459818,0.9254323919267071,0.825072133758186,COMPLETE
2552,0.7012448132780082,2025-09-24 01:39:40.715202,2025-09-24 01:39:44.405532,0 days 00:00:03.690330,0.00011720898820641749,dart,0.7525150693700732,5.891979280442878,depthwise,0.5390283009524887,0.14177274601079273,0,9,1.9451521293514316,200,forest,0.6839414202600761,0.9972874845557281,oversample,0.9485081726024978,3.1715838013654882,0.09008808188600084,weighted,0.889164127795387,0.941973557201079,0.8200429931415703,0.8230958230958231,0.6839414202600761,0.6989726027397261,0.7012448132780082,0.9972874845557281,0.823095800173115,0.8173119297439602,0.5828098229583095,0.5883376849434291,0.8729683490162532,0.8677792041078306,oversample,0.9256909504136085,0.9239415401612107,0.9485081726024978,COMPLETE
2553,0.7116742081447964,2025-09-24 01:39:44.558577,2025-09-24 01:39:48.681440,0 days 00:00:04.122863,0.05442756834303516,gbtree,0.2607947379709985,0.7438506055877099,lossguide,0.008745720598070507,0.03537595958235078,1,9,0.2258368382612458,600,,0.5735478403074489,0.9690986325838373,none,0.9995576200781698,4.765531913235807,,,,0.8377804607211172,0.8367284266557478,0.836916461916462,0.5735478403074489,0.7135931046866583,0.7116742081447964,0.9690986325838373,0.8289008214967464,0.8238487598154136,0.6149798823893532,0.6166875784190715,0.8498716852010265,0.8412494651262302,none,0.928332216126027,0.9267075954868085,0.9995576200781698,COMPLETE
2554,0.671063829787234,2025-09-24 01:39:48.830392,2025-09-24 01:39:52.245734,0 days 00:00:03.415342,0.00012080911144436165,gbtree,0.27820168211236757,0.573285041385287,lossguide,0.0035516883834172336,0.016343475997989458,0,8,0.13852100943526618,500,,0.6700243296374948,0.9661498230152484,none,0.6511884558898553,3.1984524839187976,,,,0.6722352491358877,0.8427679394001433,0.8417280917280917,0.6700243296374948,0.6769036600757257,0.671063829787234,0.9661498230152484,0.751480443875569,0.7476043663388922,0.6659768211920529,0.667371984765129,0.6881950384944396,0.6747967479674797,none,0.8997185857824694,0.9021602076718132,0.6511884558898553,COMPLETE
2555,0.6790936847179817,2025-09-24 01:39:52.396544,2025-09-24 01:40:09.704310,0 days 00:00:17.307766,0.0012474698555445158,dart,0.7999545064526301,8.27957567911104,depthwise,0.008147175482784185,0.13463006655664067,0,12,4.887432071043015,500,tree,0.6972389829315486,0.8778142853720861,undersample,0.9986831490091072,3.8129915577467304,0.10929356955587652,weighted,0.7619835731015521,0.4284360576949998,0.7881052308322244,0.7955569205569205,0.6972389829315486,0.670906200317965,0.6790936847179817,0.8778142853720861,0.806815003566157,0.805438718796833,0.5339068825910931,0.5437467833247556,0.9024807527801539,0.904150620453573,undersample,0.9195317767487114,0.9196239694160748,0.9986831490091072,COMPLETE
2556,0.680066307501036,2025-09-24 01:40:09.855874,2025-09-24 01:40:21.944828,0 days 00:00:12.088954,0.00014731221788981714,dart,0.9864305943833868,8.057723590493676,lossguide,0.00015064029525395,0.09714250382530086,3,12,1.628963466332069,400,forest,0.6452915786014592,0.9720973742117164,none,0.9816799604247703,2.762454908906094,0.18465460946342166,weighted,0.7880794828092931,0.5245458110879782,0.8390828129798341,0.8419328419328419,0.6452915786014592,0.6783960720130933,0.680066307501036,0.9720973742117164,0.7541966854006872,0.7503465898303514,0.6501960784313725,0.6593009240658899,0.7091531223267751,0.7021822849807445,none,0.9018656556199557,0.9023986587315036,0.9816799604247703,COMPLETE
2557,0.7120584172093941,2025-09-24 01:40:22.097884,2025-09-24 01:40:25.825522,0 days 00:00:03.727638,0.03431099907375051,dart,0.32602442644503876,4.121065008889907,lossguide,0.0060074633232484005,0.24513670881262734,1,12,15.48539147839571,200,forest,0.6872688544488483,0.8767820213421242,none,0.8645876817601474,4.5656770198210435,0.07893710098523203,weighted,0.6084373877888503,0.8352500847039954,0.8520831200737026,0.8506347256347256,0.6872688544488483,0.7166111002157286,0.7120584172093941,0.8767820213421242,0.8166442005604293,0.8134972399404707,0.6617167692864904,0.6608058608058608,0.781437125748503,0.7719298245614035,none,0.9215661185846774,0.9207977693741197,0.8645876817601474,COMPLETE
2558,0.7095143527712584,2025-09-24 01:40:25.974809,2025-09-24 01:40:27.282196,0 days 00:00:01.307387,0.00019924723510000378,gbtree,0.32366030668627516,6.744682332724725,depthwise,0.0022472769266007804,0.010862740212119831,5,7,0.13325113391447407,600,,0.6167255347496224,0.959519843605371,none,0.9918776477277939,4.477938167656605,,,,0.8275769762933807,0.8326338417442932,0.8352784602784603,0.6167255347496224,0.7086080912493317,0.7095143527712584,0.959519843605371,0.8199557640246447,0.8134475813614976,0.6073938282920868,0.6136789506558401,0.8502994011976048,0.8408215661103979,none,0.9251431965068078,0.923621177333249,0.9918776477277939,COMPLETE
2559,0.6797307996832938,2025-09-24 01:40:27.436668,2025-09-24 01:40:28.476926,0 days 00:00:01.040258,0.034362002618671915,gbtree,0.3474378037953342,2.1261353311768643,lossguide,0.00011588743113561229,0.21372932834185837,4,11,1.0883387016195316,300,,0.6117784404306283,0.757847293556566,none,0.6962623421811742,3.1826846155746003,,,,0.5794723540163036,0.8370355205241069,0.8343570843570843,0.6117784404306283,0.6893052302888368,0.6797307996832938,0.757847293556566,0.7822558814338584,0.770945659856134,0.633883704235463,0.6324125230202579,0.7553464499572284,0.7347026101839966,none,0.9067118660769471,0.9029723290242273,0.6962623421811742,COMPLETE
2560,0.6032608695652174,2025-09-24 01:40:28.629761,2025-09-24 01:40:52.318532,0 days 00:00:23.688771,0.3120717970779748,dart,0.362939926546085,5.188490367709527,depthwise,5.267369264325709,0.1674627497452131,9,9,1.2717178714061608,600,forest,0.48244680684927965,0.5243378669674614,none,0.5029333001527203,0.9546346142274661,0.2427509571967719,weighted,0.5838737456606263,0.8706922767941927,0.8376497082608251,0.8355855855855856,0.48244680684927965,0.6139240506329114,0.6032608695652174,0.5243378669674614,0.7005999695779274,0.6971193694043223,0.7124293785310735,0.7136177673874927,0.539349871685201,0.5224646983311938,none,0.8814748379704056,0.8838643432861458,0.5029333001527203,COMPLETE
2561,0.696124763705104,2025-09-24 01:40:52.465989,2025-09-24 01:40:53.399333,0 days 00:00:00.933344,0.0005829732137002899,gbtree,0.9422362734225481,7.548639219331583,depthwise,0.009206633387042187,0.05889431841675626,2,11,4.4489647176595675,500,,0.6759419989799595,0.9176969224078448,none,0.9938286492017271,1.9441846292278175,,,,0.2016821275505033,0.8687685535878801,0.8683456183456183,0.6759419989799595,0.7001870907390084,0.696124763705104,0.9176969224078448,0.8177860404413253,0.8116874466913829,0.7724458204334366,0.7773087071240106,0.6402908468776732,0.6302952503209243,none,0.9235450029636787,0.9216434903868406,0.9938286492017271,COMPLETE
2562,0.685404339250493,2025-09-24 01:40:53.549651,2025-09-24 01:40:54.339280,0 days 00:00:00.789629,0.00012411843485951823,gbtree,0.3621472413642194,3.9802892264482264,depthwise,0.0015697261849626797,0.03505940032105383,1,5,0.6476092655316186,300,,0.6772482098386439,0.9057918051053517,none,0.998847536324033,1.9951144430026,,,,0.9620357649534115,0.8697921998157436,0.8693693693693694,0.6772482098386439,0.6885406464250735,0.685404339250493,0.9057918051053517,0.8196476117425434,0.8133248462145227,0.8052691867124857,0.8086096567771961,0.6013686911890505,0.5947796320068464,none,0.9221347373883642,0.9207356949374266,0.998847536324033,COMPLETE
2563,0.7133661491859145,2025-09-24 01:40:54.491588,2025-09-24 01:40:55.677133,0 days 00:00:01.185545,0.0017650883686259314,gbtree,0.45463167671770205,2.350648308572741,lossguide,0.0004373762159581028,0.01796945182611435,0,5,0.6419625218347141,400,,0.5625654469158652,0.9903279035689101,none,0.9521646354159501,2.908177944457779,,,,0.6989795125491644,0.846043607329307,0.845004095004095,0.5625654469158652,0.7164404223227753,0.7133661491859145,0.9903279035689101,0.8239045434098556,0.8170581106386543,0.6405933917734322,0.6397283531409168,0.8126603934987169,0.8061617458279846,none,0.9256030876133423,0.9240556983901012,0.9521646354159501,COMPLETE
2564,0.7109758951556283,2025-09-24 01:40:55.829168,2025-09-24 01:41:30.596942,0 days 00:00:34.767774,0.07550404209066847,dart,0.9521946293399395,6.18669092389106,depthwise,0.0003077494166503251,0.06283018353359893,3,12,0.6654415116579274,700,forest,0.6868358267790146,0.9755415208448894,none,0.9365057227305232,2.361817951528076,0.11139581558256126,weighted,0.7850768492933127,0.7980337115200038,0.872965503122121,0.8735667485667485,0.6868358267790146,0.7113282158641544,0.7109758951556283,0.9755415208448894,0.8280726090514934,0.8244591922697028,0.7797042325344212,0.7846074380165289,0.6539777587681779,0.6499786050492083,none,0.9280280490981818,0.9265699434080374,0.9365057227305232,COMPLETE
2565,0.38612143742255267,2025-09-24 01:41:30.745870,2025-09-24 01:41:31.918589,0 days 00:00:01.172719,0.34301805876809316,gbtree,0.4899307852915464,0.7987404165264325,depthwise,2.154990289293533,0.0005878126852551552,0,12,0.12262731788435406,400,,0.36216559873023263,0.5643997730471544,undersample,0.559510389228294,2.0498464891733286,,,,0.4602859765340541,0.23932848807452145,0.23925061425061425,0.36216559873023263,0.3862228462872718,0.38612143742255267,0.5643997730471544,0.7445363263769726,0.7409495785060193,0.23932848807452145,0.23925061425061425,1.0,1.0,undersample,0.8938256482018373,0.8929657916301663,0.559510389228294,COMPLETE
2566,0.6997180451127819,2025-09-24 01:41:32.069389,2025-09-24 01:41:35.230924,0 days 00:00:03.161535,0.03207204044424416,gbtree,0.25936941292790117,0.49353362212002483,lossguide,0.00026233144354995494,0.030960869340372565,1,12,0.4999424552980328,400,,0.6296009839156331,0.8447961839242597,none,0.9109376402512804,1.8195687719125604,,,,0.5441812696043605,0.8708158460436073,0.8691646191646192,0.6296009839156331,0.705002337540907,0.6997180451127819,0.8447961839242597,0.8186403733479608,0.8141292149994417,0.777319587628866,0.7759249609171444,0.6449957228400343,0.6371416345742404,none,0.9237537094908747,0.9237810276451786,0.9109376402512804,COMPLETE
2567,0.676056338028169,2025-09-24 01:41:35.385163,2025-09-24 01:41:36.257682,0 days 00:00:00.872519,0.14455818623052846,gbtree,0.4077788164458277,4.361262560670622,depthwise,0.4302244170562536,0.34387232753333086,3,8,0.7517688178596845,900,,0.37281401280107557,0.5261043257141582,none,0.9782744278513644,0.9043053600529442,,,,0.5354514788239078,0.8366260620329614,0.8398853398853399,0.37281401280107557,0.6722792607802874,0.676056338028169,0.5261043257141582,0.7446085865605532,0.7382904542251225,0.6465244865718799,0.6551585708550783,0.7001710863986313,0.6983311938382541,none,0.8965676697818389,0.8980214320342214,0.9782744278513644,COMPLETE
2568,0.7089256583546959,2025-09-24 01:41:36.411850,2025-09-24 01:41:37.700843,0 days 00:00:01.288993,0.00021562587032413424,gbtree,0.49051306748035156,0.08861147836477673,lossguide,0.022328364444247985,0.04242851596457577,2,6,0.40162302717116494,300,,0.6949158989305664,0.9935397774308079,none,0.9071855532036924,2.382680458575881,,,,0.390272226607112,0.8720442215170437,0.8721334971334971,0.6949158989305664,0.7102457116365323,0.7089256583546959,0.9935397774308079,0.8299980219135794,0.8229873901703086,0.7753036437246964,0.778403275332651,0.6552609067579127,0.6508344030808729,none,0.9282925584323596,0.9265651928133926,0.9071855532036924,COMPLETE
2569,0.6876876876876877,2025-09-24 01:41:37.849849,2025-09-24 01:42:25.338209,0 days 00:00:47.488360,8.959872188229633,dart,0.8297152686395401,0.6342346168715469,depthwise,77.04175077838748,0.00425035194912652,10,7,8.533320977980022,800,forest,0.667503430285183,0.8612662202488925,oversample,0.9371010757561045,1.0396130957537486,0.0027172894986026708,weighted,0.7432692910166779,0.45536405944454256,0.8474767120483161,0.8509418509418509,0.667503430285183,0.6863157894736842,0.6876876876876877,0.8612662202488925,0.7882626797417356,0.7794369836859518,0.675787728026534,0.6894623655913978,0.6971770744225834,0.6859221223791185,oversample,0.9083478178886475,0.907132525524945,0.9371010757561045,COMPLETE
2570,0.7071032385042046,2025-09-24 01:42:25.491525,2025-09-24 01:42:26.736018,0 days 00:00:01.244493,0.00018588408120680515,gbtree,0.6743575538044178,4.5442728022602195,depthwise,0.00018768141972834624,0.03491461442220686,1,10,10.820280227799175,700,,0.5075457132187662,0.8440578584405123,none,0.976042999136521,3.2627777287148163,,,,0.7865035424893139,0.8304841846657796,0.8324119574119574,0.5075457132187662,0.7062788222774034,0.7071032385042046,0.8440578584405123,0.8242963012602353,0.8182883266118336,0.6033333333333334,0.6076260762607626,0.8515825491873396,0.8455284552845529,none,0.9265348707395176,0.9242005483395461,0.976042999136521,COMPLETE
2571,0.6455053326561706,2025-09-24 01:42:26.884232,2025-09-24 01:42:27.902291,0 days 00:00:01.018059,0.07816511146865227,gbtree,0.6592085624343721,0.6157584780683658,lossguide,6.177320486747806,0.01523258861347019,1,3,0.12320844650838646,800,,0.5431161676133256,0.5206411924890351,none,0.8541431451344355,1.1572784296655783,,,,0.4276393673087213,0.8601699252738254,0.857084357084357,0.5431161676133256,0.6536511156186613,0.6455053326561706,0.5206411924890351,0.7893089008572596,0.7786370568785819,0.8026151930261519,0.7938788257339163,0.5513259195893926,0.543859649122807,none,0.9083770287442878,0.9054331370502792,0.8541431451344355,COMPLETE
2572,0.6639042357274402,2025-09-24 01:42:28.056136,2025-09-24 01:42:28.914495,0 days 00:00:00.858359,0.0012795693770832586,gbtree,0.4584607703495435,1.7779363578910174,depthwise,0.0020289365965290265,0.018802923546451918,2,7,0.2750108412676534,200,,0.6842303325478609,0.9021262158095517,oversample,0.9807408475734826,4.603622270841068,,,,0.5078503862805258,0.7734670897737742,0.7757985257985258,0.6842303325478609,0.6622920799633756,0.6639042357274402,0.9021262158095517,0.8043262732083674,0.7965787472750221,0.5148279952550415,0.5175879396984925,0.9281437125748503,0.9255455712451861,oversample,0.9196094229442955,0.9176968115217986,0.9807408475734826,COMPLETE
2573,0.5649801587301587,2025-09-24 01:42:29.068347,2025-09-24 01:42:30.391675,0 days 00:00:01.323328,0.04614826614214066,gbtree,0.9261582248101372,8.30686180959054,depthwise,81.25965304143348,0.0023528117396130624,2,4,0.43286277037346044,1000,,0.3436690418308771,0.8490828358939423,oversample,0.6303725074251623,2.325184191643465,,,,0.47421225850266646,0.6368103183539768,0.6408681408681409,0.3436690418308771,0.5631617828121153,0.5649801587301587,0.8490828358939423,0.7619380683177351,0.7526043823318278,0.39540110650069155,0.3977649729352191,0.9781864841745082,0.9747539580658965,oversample,0.903283403778981,0.9000518937684118,0.6303725074251623,COMPLETE
2574,0.5902380635722836,2025-09-24 01:42:30.540591,2025-09-24 01:42:32.258689,0 days 00:00:01.718098,0.015390604240332714,gbtree,0.9750994333898715,3.3138081004021815,lossguide,0.0016760078121124135,0.010612603298807267,1,6,38.48796978703095,600,,0.46792416413460935,0.6092626368269662,oversample,0.9529703307064061,3.134506277885569,,,,0.6267825998785297,0.676937250486232,0.6845823095823096,0.46792416413460935,0.5838607594936709,0.5902380635722836,0.6092626368269662,0.7054456189993572,0.7013796068724318,0.42203583682805945,0.4282130451563103,0.9469632164242943,0.9495079161317929,oversample,0.8858999516394858,0.8861792648693756,0.9529703307064061,COMPLETE
2575,0.6316571711667079,2025-09-24 01:42:32.410605,2025-09-24 01:42:33.632022,0 days 00:00:01.221417,0.025132027326229916,gbtree,0.2328859515088802,9.41375514179369,lossguide,3.159762223156877,0.0038876270352844735,5,10,51.49280053081319,500,,0.6653977352550217,0.7495748966953294,oversample,0.7493857482686787,1.0839138934561567,,,,0.6216075696063507,0.8492169106356843,0.8477682227682227,0.6653977352550217,0.641693018730236,0.6316571711667079,0.7495748966953294,0.7588641511233735,0.7520117717995811,0.7439368302312465,0.75,0.5641573994867408,0.5455712451861361,oversample,0.8988201577121437,0.8981966282064282,0.7493857482686787,COMPLETE
2576,0.6104319478402608,2025-09-24 01:42:33.779848,2025-09-24 01:43:34.175546,0 days 00:01:00.395698,0.01307528182901581,dart,0.2666221159627366,1.783316207012385,lossguide,0.10547922638454567,0.003971871453680543,8,12,0.9409800434752793,900,forest,0.4197820048451098,0.9759106403924609,undersample,0.799319100790281,2.233077697607013,0.16045260311409715,weighted,0.6640535805355045,0.22481470205892112,0.7037567816562595,0.7063882063882064,0.4197820048451098,0.6082837033026529,0.6104319478402608,0.9759106403924609,0.7868328052652459,0.7787891558849465,0.44495049504950496,0.4471641791044776,0.9610778443113772,0.9614890885750963,undersample,0.9128799325047927,0.9120427689413838,0.799319100790281,COMPLETE
