number,value,datetime_start,datetime_complete,duration,params_alpha,params_booster,params_colsample_bytree,params_gamma,params_grow_policy,params_lambda,params_learning_rate,params_max_delta_step,params_max_depth,params_min_child_weight,params_n_estimators,params_normalize_type,params_params_decision_threshold,params_params_feature_fraction,params_params_resampling,params_params_sample_rows,params_params_scale_pos_weight,params_rate_drop,params_sample_type,params_skip_drop,params_subsample,user_attrs_acc_test,user_attrs_acc_val,user_attrs_decision_threshold,user_attrs_f1_test,user_attrs_f1_val,user_attrs_feature_fraction,user_attrs_pr_auc_test,user_attrs_pr_auc_val,user_attrs_prec_test,user_attrs_prec_val,user_attrs_rec_test,user_attrs_rec_val,user_attrs_resampling_strategy,user_attrs_roc_auc_test,user_attrs_roc_auc_val,user_attrs_sample_rows,state
409,0.38612143742255267,2025-09-23 13:27:05.066648,2025-09-23 13:27:17.465971,0 days 00:00:12.399323,64.97075399830273,dart,0.24394383589510396,4.36388290533235,depthwise,14.932243550275206,0.00019552228306837508,2,11,2.6779352498114832,400,tree,0.45753858188712027,0.5555041864214791,undersample,0.8363574056651776,1.1068928797183841,0.18852196851040115,uniform,0.7998278864750575,0.9629009901987937,0.23932848807452145,0.23925061425061425,0.45753858188712027,0.3862228462872718,0.38612143742255267,0.5555041864214791,0.6056578548164476,0.6057914706468526,0.23932848807452145,0.23925061425061425,1.0,1.0,undersample,0.8444365954059929,0.8457020391337288,0.8363574056651776,COMPLETE
410,0.6764436296975253,2025-09-23 13:27:17.594291,2025-09-23 13:27:18.541313,0 days 00:00:00.947022,6.215416356516573,gbtree,0.9110943662044471,7.597988896787502,depthwise,1.4577036034626096,0.018104012720074773,8,7,0.39203509049688157,800,,0.6878314695179777,0.7210800230839735,oversample,0.8826010347338565,0.9226761074089002,,,,0.9503169314878117,0.8622172177295526,0.8554463554463555,0.6878314695179777,0.6939517962710323,0.6764436296975253,0.7210800230839735,0.7913789624137968,0.7790468245614106,0.7407766990291262,0.7281697089294524,0.6526946107784432,0.631578947368421,oversample,0.9118927494799892,0.9076587186627025,0.8826010347338565,COMPLETE
411,0.0,2025-09-23 13:27:18.667396,2025-09-23 13:27:19.861934,0 days 00:00:01.194538,12.639467850240528,gbtree,0.7671193712765456,7.750602624758775,lossguide,0.012318051311278526,0.00012433887320113882,1,4,1.620269099384215,900,,0.6549995576851885,0.7206738924685809,undersample,0.7194471212748667,1.3326907906498382,,,,0.7306960278151984,0.7606715119254785,0.7607493857493858,0.6549995576851885,0.0,0.0,0.7206738924685809,0.699431878401534,0.6923742114187192,0.0,0.0,0.0,0.0,undersample,0.8783557229505462,0.8769279280664382,0.7194471212748667,COMPLETE
412,0.38612143742255267,2025-09-23 13:27:19.995282,2025-09-23 13:27:20.572681,0 days 00:00:00.577399,13.134660056561065,gbtree,0.23712279202121894,9.474484882606939,depthwise,0.2928532295529745,0.0002336155128653698,5,12,0.6480037450700054,200,,0.6265638504025082,0.9580621108447129,oversample,0.6035695750223801,2.6130900440685827,,,,0.7560998804383527,0.23932848807452145,0.23925061425061425,0.6265638504025082,0.3862228462872718,0.38612143742255267,0.9580621108447129,0.7447670635439204,0.7378578903186981,0.23932848807452145,0.23925061425061425,1.0,1.0,oversample,0.8963557687669818,0.8955133771850647,0.6035695750223801,COMPLETE
413,0.5916544460738569,2025-09-23 13:27:20.702843,2025-09-23 13:27:21.257002,0 days 00:00:00.554159,2.0064101029884305,gbtree,0.228529808750105,5.376142964320749,depthwise,0.05689645898955301,0.39823642428302747,8,9,3.1200698036191548,700,,0.3687057104971426,0.6708481401652788,oversample,0.8804548641753038,3.500054973301576,,,,0.4681891385208946,0.6828743986078412,0.6864250614250614,0.3687057104971426,0.5893425238600212,0.5916544460738569,0.6708481401652788,0.7671622739571938,0.7574482065738463,0.42700729927007297,0.42970565453137105,0.9508126603934988,0.9495079161317929,oversample,0.8985006513876912,0.8955096630837969,0.8804548641753038,COMPLETE
414,0.40778563323732214,2025-09-23 13:27:21.388260,2025-09-23 13:27:24.708467,0 days 00:00:03.320207,0.00044572139832199377,dart,0.43895827614698546,3.2823640556413847,lossguide,2.228716374233053,0.0003088638663749171,5,4,3.1396389820500508,200,tree,0.3843677385870419,0.5130946154387165,none,0.7744434831643328,2.082266760989708,0.28083857635944814,uniform,0.7172078123514312,0.44452955352439383,0.30166854335141774,0.30538493038493036,0.3843677385870419,0.4064729424047329,0.40778563323732214,0.5130946154387165,0.6537976132130616,0.6519335647919025,0.25513324595893405,0.256140350877193,0.9991445680068435,0.9995721009841677,none,0.8539937254506501,0.8559498779442674,0.7744434831643328,COMPLETE
415,0.5969257045260461,2025-09-23 13:27:24.834720,2025-09-23 13:27:26.194199,0 days 00:00:01.359479,7.843770227365643,gbtree,0.4881514345537461,9.117775052127016,depthwise,17.976673730105748,0.0001586309657455468,0,8,0.261602172071778,800,,0.3484264470346426,0.6026808792133509,none,0.8452626406482736,1.7458995204464707,,,,0.6569221616064952,0.705292250998055,0.7100737100737101,0.3484264470346426,0.5945641458949443,0.5969257045260461,0.6026808792133509,0.672679323125377,0.6694000386270181,0.44320806214570646,0.4472168905950096,0.9029084687767323,0.8973042362002568,none,0.8716050798224764,0.8705448275611881,0.8452626406482736,COMPLETE
416,0.6512191428138725,2025-09-23 13:27:26.325938,2025-09-23 13:27:27.106254,0 days 00:00:00.780316,0.00017822414583130655,gbtree,0.4976301380212578,6.5310474025734155,lossguide,1.711315637801583,0.00799633823537854,0,4,5.002314951127345,500,,0.4848572945117019,0.8744377696915722,oversample,0.7446014831523019,1.6322593938938554,,,,0.5022377498339582,0.758828948715324,0.7642301392301393,0.4848572945117019,0.6476218965001496,0.6512191428138725,0.8744377696915722,0.7967968017651834,0.7870740850007898,0.49793008279668816,0.5039849976558838,0.9260051325919589,0.9199828840393667,oversample,0.9142106812385955,0.9119107312017387,0.7446014831523019,COMPLETE
417,0.6967300705278906,2025-09-23 13:27:27.235794,2025-09-23 13:28:53.252867,0 days 00:01:26.017073,0.05561831768870662,dart,0.8146831486344679,0.5122786488890974,lossguide,0.10528584737079225,0.0012380677784485342,2,11,0.2510101551518013,1000,forest,0.39869535500271147,0.9219606718236257,none,0.6121625617361915,1.2950235815617452,0.18705116246522413,weighted,0.5186583284015337,0.8009106809277851,0.8567918927218753,0.8547297297297297,0.39869535500271147,0.7065240192993497,0.6967300705278906,0.9219606718236257,0.8046392959920605,0.7984705026542029,0.6932894195142034,0.6959863364645602,0.72027373823781,0.6974753958065897,none,0.9146210146176301,0.9126210458713387,0.6121625617361915,COMPLETE
418,0.4213184236630895,2025-09-23 13:28:53.376678,2025-09-23 13:28:55.517574,0 days 00:00:02.140896,0.19926473240268944,gbtree,0.535053783836706,1.9199301758067777,lossguide,10.081440036882624,0.003558673568069639,0,11,2.4899475416554417,400,,0.31197141513766224,0.6243761500961091,undersample,0.5473733540406169,4.831683044903637,,,,0.7255181964860151,0.3378032551950046,0.3430589680589681,0.31197141513766224,0.4193519432725967,0.4213184236630895,0.6243761500961091,0.7458268338899208,0.7364755059519453,0.2653640804271271,0.26691042047531993,0.9991445680068435,0.9995721009841677,undersample,0.9008380090847776,0.8993527214026149,0.5473733540406169,COMPLETE
419,0.38612143742255267,2025-09-23 13:28:55.642503,2025-09-23 13:28:58.552859,0 days 00:00:02.910356,0.03088500526532752,dart,0.33830698618107335,7.8555447755451375,depthwise,0.00012215045809863513,0.0005197240069822157,2,7,0.15163797923982963,200,tree,0.359970236482421,0.8059199249344697,undersample,0.7521207043882763,3.310603307860457,0.30558978720561253,uniform,0.5755038223731243,0.6364022219844668,0.23932848807452145,0.23925061425061425,0.359970236482421,0.3862228462872718,0.38612143742255267,0.8059199249344697,0.7401371562001788,0.7336803673916119,0.23932848807452145,0.23925061425061425,1.0,1.0,undersample,0.8927980016666592,0.8928214023444443,0.7521207043882763,COMPLETE
420,0.6852861035422343,2025-09-23 13:28:58.676689,2025-09-23 13:29:29.664906,0 days 00:00:30.988217,0.0021503499295069967,dart,0.8877887369627155,5.480512878507985,depthwise,0.842010620952322,0.21122417229746757,2,12,18.86740595302637,700,forest,0.4491821295014153,0.7387838664264823,none,0.6504311565874794,0.9950400984639092,0.4583487074562732,uniform,0.7281485354987498,0.9353018862396127,0.8598628314054663,0.8581081081081081,0.4491821295014153,0.6950323011806638,0.6852861035422343,0.7387838664264823,0.7911462473974264,0.7809014716155009,0.7252440725244073,0.7300435413642961,0.6672369546621043,0.6456996148908858,none,0.9135614232058403,0.9094792041135888,0.6504311565874794,COMPLETE
421,0.6026552232801394,2025-09-23 13:29:29.788928,2025-09-23 13:29:39.394182,0 days 00:00:09.605254,0.0021078369614771298,dart,0.5217421854661985,8.1623726912984,lossguide,0.5159419164483253,0.018619519041719244,0,8,5.61140322342907,400,tree,0.5310497168115258,0.9575955227561852,undersample,0.7363153090182455,4.271114040339471,0.4967090740559926,weighted,0.4423158216633252,0.43591450541383187,0.6925990377725458,0.6966625716625716,0.5310497168115258,0.6009302325581395,0.6026552232801394,0.9575955227561852,0.7855115245894015,0.7794395533880971,0.4358974358974359,0.4388671875,0.9670658682634731,0.9614890885750963,undersample,0.9117804819451587,0.9103809533516367,0.7363153090182455,COMPLETE
422,0.5473063521844009,2025-09-23 13:29:39.516942,2025-09-23 13:29:42.681031,0 days 00:00:03.164089,0.0058649501973597985,dart,0.9280084544387686,8.613083900711784,lossguide,0.0005540524273058285,0.0003526624543953449,2,10,0.449938980302801,200,forest,0.4634141101587337,0.6658954173949243,undersample,0.6669636381815649,0.7937617087039698,0.14440447327524897,uniform,0.40055403369044323,0.4959257866863797,0.8321220186303614,0.827088452088452,0.4634141101587337,0.5677385345282024,0.5473063521844009,0.6658954173949243,0.6743833876912738,0.6684887639828041,0.7396978021978022,0.7324246771879483,0.46065012831479896,0.4368848951647411,undersample,0.8687840882051572,0.8722707041999346,0.6669636381815649,COMPLETE
423,0.6435808256464539,2025-09-23 13:29:42.806160,2025-09-23 13:29:43.452137,0 days 00:00:00.645977,0.25357910789201393,gbtree,0.3075097164642195,3.1262547485827916,lossguide,3.2484422162978897,0.32596039881422756,10,4,28.955989927806357,600,,0.6107501182567465,0.570607827029091,oversample,0.5970392286636176,4.00341742257807,,,,0.3773218237074343,0.7527894359709284,0.7587018837018837,0.6107501182567465,0.639821029082774,0.6435808256464539,0.570607827029091,0.7807882195531992,0.7757589383300247,0.491183879093199,0.4976613657623948,0.9174508126603935,0.9105691056910569,oversample,0.9073663043599635,0.9051786491347267,0.5970392286636176,COMPLETE
424,0.3901639344262295,2025-09-23 13:29:43.600201,2025-09-23 13:29:43.969030,0 days 00:00:00.368829,26.299679379158206,gbtree,0.5290498009727171,5.460750485695911,depthwise,0.003696984919006432,0.12740359678474059,1,10,5.145411794306796,400,,0.6709141166446906,0.6827145675199844,none,0.6351405725938111,0.8270385301382206,,,,0.6518218716521684,0.8162555020984748,0.8095823095823096,0.6709141166446906,0.424863825696892,0.3901639344262295,0.6827145675199844,0.6991952067268746,0.6985332328493354,0.8467432950191571,0.8345021037868162,0.28357570573139435,0.25459991442019686,none,0.8725516266618962,0.8787144971507085,0.6351405725938111,COMPLETE
425,0.6963423050379572,2025-09-23 13:29:44.093578,2025-09-23 13:29:44.586054,0 days 00:00:00.492476,0.0003870531837549196,gbtree,0.8924128286100057,6.157404304327131,lossguide,62.97327646891493,0.30015223239802385,0,7,0.24511037421255158,600,,0.4348226593749125,0.9656273148308065,oversample,0.842684013943648,0.8867505220980398,,,,0.7768948231360393,0.8147200327566793,0.8198198198198198,0.4348226593749125,0.6921768707482994,0.6963423050379572,0.9656273148308065,0.8170114314297338,0.8100155610542445,0.5745341614906833,0.5834056085573865,0.8704020530367835,0.8635002139495079,oversample,0.9230113508492559,0.9206810487032691,0.842684013943648,COMPLETE
426,0.5799180327868853,2025-09-23 13:29:44.711900,2025-09-23 13:29:45.445456,0 days 00:00:00.733556,33.351629062437326,gbtree,0.8042742721053953,2.7437673346499016,depthwise,3.688964686263161,0.009629313302772766,8,6,8.887921034917687,700,,0.6090920463980645,0.5717883821213523,undersample,0.5189139226122609,0.5141494828649025,,,,0.911028861250087,0.8305865492885659,0.8321048321048321,0.6090920463980645,0.5834382079033475,0.5799180327868853,0.5717883821213523,0.6918909769156308,0.681418803713446,0.708868501529052,0.7223994894703255,0.4957228400342173,0.4843816859221224,undersample,0.8783017332311558,0.879714108638441,0.5189139226122609,COMPLETE
427,0.6686478454680534,2025-09-23 13:29:45.570334,2025-09-23 13:29:46.406668,0 days 00:00:00.836334,0.00021972634084719121,gbtree,0.7353262439114285,1.6337437035372215,depthwise,24.230464272382743,0.06311866213020548,1,11,96.8663924866547,400,,0.5054045593399736,0.842052853396233,none,0.639433009744486,4.482721379436803,,,,0.7384517171858003,0.7924045449892517,0.7945331695331695,0.5054045593399736,0.6705653021442495,0.6686478454680534,0.842052853396233,0.791443708409358,0.783028309750637,0.5405971712938711,0.5443548387096774,0.8828058169375534,0.8664955070603337,none,0.9120953836027121,0.9085401123224839,0.639433009744486,COMPLETE
428,0.6848453067645517,2025-09-23 13:29:46.531283,2025-09-23 13:29:48.270307,0 days 00:00:01.739024,0.03691045069666533,gbtree,0.5884940415257356,3.559207293419151,lossguide,0.18372513006545657,0.002747428068293848,3,8,22.696202126210945,700,,0.5065183196496038,0.9434768189287925,undersample,0.9296416755548234,0.9376446583356995,,,,0.5584413599944889,0.8115467294503019,0.8154176904176904,0.5065183196496038,0.6837313176430166,0.6848453067645517,0.9434768189287925,0.7884027200312148,0.7806578949360581,0.5713465403387884,0.5789007092198581,0.8511548331907614,0.8382541720154044,undersample,0.9114346426818778,0.9089015030132878,0.9296416755548234,COMPLETE
429,0.690297171500179,2025-09-23 13:29:48.397538,2025-09-23 13:29:48.903035,0 days 00:00:00.505497,0.05805177149702526,gbtree,0.7778902355294601,0.7653106062938275,depthwise,0.0001365025602497214,0.3124222465868118,9,10,28.70220457235478,300,,0.6248100156202552,0.8013204836493961,undersample,0.5452252726378952,1.7281399686882288,,,,0.9304069811146896,0.8178933360630566,0.8228910728910729,0.6248100156202552,0.6870712401055409,0.690297171500179,0.8013204836493961,0.7817188297479443,0.7773394113788119,0.5835076187630714,0.5934133579562942,0.8353293413173652,0.8249893025246042,undersample,0.909205696111094,0.9074514487787719,0.5452252726378952,COMPLETE
430,0.6385629436476894,2025-09-23 13:29:49.025629,2025-09-23 13:30:56.649318,0 days 00:01:07.623689,0.017211057006169074,dart,0.5517746256235136,6.018798981389091,lossguide,59.35894243315385,0.2722698183560453,6,12,4.920974022748158,1000,tree,0.5500766412339532,0.7637448473864086,oversample,0.959198553382932,3.553550021307655,0.2325530564498956,weighted,0.048715962391577126,0.7046695869329938,0.740608045859351,0.7445741195741196,0.5500766412339532,0.6359195402298851,0.6385629436476894,0.7637448473864086,0.8116627178013438,0.8033617777569002,0.4787970575508438,0.4826982041173894,0.946535500427716,0.943089430894309,oversample,0.9214460518952866,0.917420816368672,0.959198553382932,COMPLETE
431,0.5576316428051444,2025-09-23 13:30:56.776362,2025-09-23 13:30:57.376346,0 days 00:00:00.599984,0.27674361301092126,gbtree,0.3801587492229496,9.835385428494224,lossguide,0.028382857310839046,0.003474205112313741,8,11,2.097648466844586,200,,0.38023858372686753,0.8795074599703014,undersample,0.5043606487057843,1.0179093829838073,,,,0.7898329133874242,0.6213532603132358,0.6267403767403767,0.38023858372686753,0.5542836486323653,0.5576316428051444,0.8795074599703014,0.7555555774194999,0.74872389594107,0.3858413017950008,0.38916172734970367,0.9837467921300257,0.9833119383825417,undersample,0.9009161157470513,0.9005501015849884,0.5043606487057843,COMPLETE
432,0.707499018453082,2025-09-23 13:30:57.501705,2025-09-23 13:31:55.737773,0 days 00:00:58.236068,0.0001406329530945466,dart,0.7755986668835351,8.39895642974697,lossguide,2.560301517807232,0.01378791543347402,6,12,0.11039688982837177,1000,forest,0.6786517278288925,0.7665621392436022,none,0.5982258217764732,4.110474827701428,0.4474274823048971,uniform,0.3988100154911052,0.8053295093333943,0.8498310983724024,0.8474610974610974,0.6786517278288925,0.7128596594245449,0.707499018453082,0.7665621392436022,0.8166098013679344,0.8050713458446105,0.6571634788884879,0.6536089952847298,0.7788708297690333,0.771074026529739,none,0.9221199161167831,0.9191960128172771,0.5982258217764732,COMPLETE
433,0.6361338289962826,2025-09-23 13:31:55.859692,2025-09-23 13:32:33.302182,0 days 00:00:37.442490,0.012514642932819967,dart,0.35355823387731156,0.5713014855543663,lossguide,0.49400188983498206,0.0015634247236820044,8,11,32.84063732026599,800,tree,0.6679227022995019,0.9215205429909925,undersample,0.8909158990945587,2.4892785226636853,0.42716344381939275,uniform,0.430549172550914,0.6390016348818564,0.7438837137885147,0.7494881244881245,0.6679227022995019,0.6331378299120235,0.6361338289962826,0.9215205429909925,0.7562385081784784,0.7439692983828843,0.4817045961624275,0.4874658158614403,0.9234388366124893,0.9152759948652118,undersample,0.9003899174371713,0.8980031494427092,0.8909158990945587,COMPLETE
434,0.7018698060941828,2025-09-23 13:32:33.425697,2025-09-23 13:32:34.333442,0 days 00:00:00.907745,0.04341421842826612,gbtree,0.8363418652603116,8.596174545193339,lossguide,0.0015930313554738552,0.02711121529264906,5,5,0.21172445387208308,800,,0.6341132811390482,0.6920421507424102,oversample,0.5329622268476609,1.9766747601619739,,,,0.9248355987301167,0.8125703756781656,0.8237100737100738,0.6341132811390482,0.6891868952639619,0.7018698060941828,0.6920421507424102,0.8151158302691535,0.8118163893442154,0.5713481564874754,0.5894155277697005,0.8682634730538922,0.8673513050919983,oversample,0.9215676726597558,0.9212235090287498,0.5329622268476609,COMPLETE
435,0.5439390331031198,2025-09-23 13:32:34.456624,2025-09-23 13:32:35.334127,0 days 00:00:00.877503,0.09269365677717549,gbtree,0.6050386909350824,3.8347559358279684,lossguide,73.96290750824325,0.013898223357002007,9,7,1.9302323772415018,600,,0.35677335806740684,0.6058142535219938,undersample,0.5985069855832228,3.8366512344283605,,,,0.8241509271113285,0.5981164909407309,0.6079033579033579,0.35677335806740684,0.5372465818010372,0.5439390331031198,0.6058142535219938,0.7581958895380755,0.7559373746099913,0.3708102831109665,0.37683550569213004,0.974764756201882,0.97732135216089,undersample,0.8950131054575778,0.8955267364330359,0.5985069855832228,COMPLETE
436,0.5986091794158553,2025-09-23 13:32:35.467880,2025-09-23 13:33:21.866657,0 days 00:00:46.398777,0.0009477063182768608,dart,0.7910756607054463,6.546466232037855,lossguide,0.0023767720019300304,0.0010989692303252888,2,8,0.36333932752668596,800,tree,0.5046344598221886,0.7862765128037819,none,0.972413430650084,1.4048788506376422,0.2947272917828581,weighted,0.8276546665180633,0.3049130206402098,0.8565871634763026,0.8522727272727273,0.5046344598221886,0.6130903065451533,0.5986091794158553,0.7862765128037819,0.7980712913700712,0.7919187589312328,0.8651597817614964,0.8553259141494436,0.47476475620188197,0.46041934103551563,none,0.9105239546859335,0.9098000563967563,0.972413430650084,COMPLETE
437,0.38612143742255267,2025-09-23 13:33:21.987571,2025-09-23 13:33:22.642057,0 days 00:00:00.654486,14.00848269623349,gbtree,0.29805088979725264,1.4924816818462905,depthwise,0.0001723705362506454,0.00026031434174002976,1,11,0.262062254755451,300,,0.6457570644042427,0.9162342781192014,undersample,0.8704091818609422,3.6562633795262287,,,,0.9133667127964245,0.23932848807452145,0.23925061425061425,0.6457570644042427,0.3862228462872718,0.38612143742255267,0.9162342781192014,0.7233949912300693,0.7188509702825656,0.23932848807452145,0.23925061425061425,1.0,1.0,undersample,0.8887582698378548,0.8864122167558713,0.8704091818609422,COMPLETE
438,0.6851918250268914,2025-09-23 13:33:22.762317,2025-09-23 13:33:23.094060,0 days 00:00:00.331743,1.0730537792231758,gbtree,0.5643987422402044,9.114515269999425,lossguide,0.0002226601618286147,0.4011249905335408,3,5,0.12447226617188928,200,,0.583560109830066,0.762976904479996,none,0.7046582916643742,3.7172655410547346,,,,0.47975754400174186,0.8222950148428703,0.8202293202293203,0.583560109830066,0.6938271604938272,0.6851918250268914,0.762976904479996,0.791016084500156,0.7823375827319593,0.5903361344537815,0.5896328293736501,0.8413173652694611,0.8177150192554558,none,0.9139793255060903,0.9093699980197218,0.7046582916643742,COMPLETE
439,0.6702182505585152,2025-09-23 13:33:23.214439,2025-09-23 13:33:23.665874,0 days 00:00:00.451435,88.76181137518725,gbtree,0.5085023259337413,8.463600388835598,depthwise,0.19494676250370413,0.13749331445286217,5,9,2.722386123260866,500,,0.6964172810383152,0.7752234099776877,oversample,0.597303446244996,2.4771558615173683,,,,0.9237689389337242,0.7976251407513564,0.8035421785421786,0.6964172810383152,0.6663291139240506,0.6702182505585152,0.7752234099776877,0.7775428566055466,0.7734594714507542,0.5503206021745191,0.5600229753015509,0.844311377245509,0.834403080872914,oversample,0.9017724686735876,0.9015556153266735,0.597303446244996,COMPLETE
