number,value,datetime_start,datetime_complete,duration,params_alpha,params_booster,params_colsample_bytree,params_gamma,params_grow_policy,params_lambda,params_learning_rate,params_max_delta_step,params_max_depth,params_min_child_weight,params_n_estimators,params_normalize_type,params_params_decision_threshold,params_params_feature_fraction,params_params_resampling,params_params_sample_rows,params_params_scale_pos_weight,params_rate_drop,params_sample_type,params_skip_drop,params_subsample,user_attrs_acc_test,user_attrs_acc_val,user_attrs_decision_threshold,user_attrs_f1_test,user_attrs_f1_val,user_attrs_feature_fraction,user_attrs_pr_auc_test,user_attrs_pr_auc_val,user_attrs_prec_test,user_attrs_prec_val,user_attrs_rec_test,user_attrs_rec_val,user_attrs_resampling_strategy,user_attrs_roc_auc_test,user_attrs_roc_auc_val,user_attrs_sample_rows,state
156,0.5417789757412399,2025-09-23 12:27:03.651208,2025-09-23 12:28:02.366725,0 days 00:00:58.715517,69.36055313446295,dart,0.43454983245873713,9.843017276705567,lossguide,0.031754348878257115,0.06073557542070286,2,3,0.1044030771978567,1000,forest,0.3186153945516735,0.7470462639940912,none,0.971932288664276,0.5331307449739104,0.43202884589632534,weighted,0.5315154242640682,0.49419744722451003,0.8265943289998976,0.825962325962326,0.3186153945516735,0.5504246284501062,0.5417789757412399,0.7470462639940912,0.6716611731566865,0.6625776027514443,0.7251748251748251,0.7319737800437,0.4435414884516681,0.4300385109114249,none,0.8640780898552396,0.8635575377915563,0.971932288664276,COMPLETE
157,0.7056596630702252,2025-09-23 12:28:02.486004,2025-09-23 12:28:03.349822,0 days 00:00:00.863818,0.00039760189204342326,gbtree,0.24895795768283346,7.378812839173014,lossguide,0.00010242994999688229,0.025030114425341234,10,7,16.077853980776514,800,,0.5268287419578763,0.9070793500187435,none,0.9435993410431143,2.5428531764389013,,,,0.4909283528835328,0.8447128672330843,0.8408067158067158,0.5268287419578763,0.7149032136816388,0.7056596630702252,0.9070793500187435,0.8161540839462307,0.8104329899948907,0.6376131411330875,0.6327223353699932,0.8135158254918734,0.7976037655113393,none,0.9226928805748559,0.9217226669642554,0.9435993410431143,COMPLETE
158,0.5778340721975934,2025-09-23 12:28:03.468893,2025-09-23 12:28:06.647266,0 days 00:00:03.178373,0.10172269805368206,gbtree,0.694912603141844,2.8030923505056338,lossguide,0.0003868234488847699,0.001988892081640983,8,12,9.051812809851407,400,,0.4283042247659835,0.9898321952360332,undersample,0.8409765657336612,1.8120885064321581,,,,0.9385854696945342,0.6558501381922408,0.6587837837837838,0.4283042247659835,0.5766809367917402,0.5778340721975934,0.9898321952360332,0.7888379693158629,0.7806659691310021,0.4086366880799429,0.41039942425332854,0.979469632164243,0.9760376551133932,undersample,0.9126282586795956,0.9100029211838344,0.8409765657336612,COMPLETE
159,0.38612143742255267,2025-09-23 12:28:06.765437,2025-09-23 12:28:12.896401,0 days 00:00:06.130964,0.6517238033022593,dart,0.9903981596878502,4.311307377242358,depthwise,20.846393466513753,0.0007583909260347217,7,3,1.6201753158618213,300,tree,0.5506547006970199,0.6947923893388601,oversample,0.916294258911092,4.912662924584582,0.24784996134150256,uniform,0.793050924661355,0.5475533241748242,0.23932848807452145,0.23925061425061425,0.5506547006970199,0.3862228462872718,0.38612143742255267,0.6947923893388601,0.6106955554060497,0.6039305313666201,0.23932848807452145,0.23925061425061425,1.0,1.0,oversample,0.857757839186383,0.8569680311468564,0.916294258911092,COMPLETE
160,0.599421965317919,2025-09-23 12:28:13.014947,2025-09-23 12:28:37.609325,0 days 00:00:24.594378,0.00011197568600573541,dart,0.9488472164038451,3.514687077474851,lossguide,0.11771704736849657,0.4461556243900424,4,12,0.7733572870176296,600,tree,0.5249607304052761,0.6867689035762922,oversample,0.864232747446509,4.9992073635934755,0.365725124579506,uniform,0.2419904073513137,0.3398692505952873,0.7140956085576825,0.7162162162162162,0.5249607304052761,0.598302890838487,0.599421965317919,0.6867689035762922,0.7652168956957299,0.7650890608984683,0.4507042253521127,0.4525420030547676,0.8896492728828058,0.8874625588361147,oversample,0.885203150420999,0.8873136492876095,0.864232747446509,COMPLETE
161,0.6197901049475263,2025-09-23 12:28:37.731192,2025-09-23 12:28:38.644983,0 days 00:00:00.913791,0.21211548012425901,gbtree,0.48331149209772867,2.635776424502189,lossguide,0.7863501173292637,0.0023957348195021272,8,3,4.241481026330805,1000,,0.5856959899407526,0.8036824108633212,oversample,0.8366305503872477,1.7414294870512426,,,,0.7737481922384848,0.7376394717985464,0.7403767403767404,0.5856959899407526,0.6212501847199645,0.6197901049475263,0.8036824108633212,0.7437097113911767,0.7345116103697859,0.47459923233235496,0.47703669513039465,0.8990590248075278,0.8844672657252889,oversample,0.8895606042658325,0.884515894539563,0.8366305503872477,COMPLETE
162,0.38612143742255267,2025-09-23 12:28:38.763171,2025-09-23 12:28:39.311175,0 days 00:00:00.548004,7.383499364050744,gbtree,0.596780021663367,2.5674240814905724,depthwise,0.17080915753422501,0.00021693632913841415,3,9,22.20271530821252,200,,0.4209724978206747,0.9301915399208034,none,0.7185535194452968,2.770848164644922,,,,0.83042829496024,0.23932848807452145,0.23925061425061425,0.4209724978206747,0.3862228462872718,0.38612143742255267,0.9301915399208034,0.7666604464461979,0.7556215448640067,0.23932848807452145,0.23925061425061425,1.0,1.0,none,0.9025339942411734,0.8980522389207064,0.7185535194452968,COMPLETE
163,0.6058823529411764,2025-09-23 12:28:39.427428,2025-09-23 12:28:39.798348,0 days 00:00:00.370920,0.005384557477195764,gbtree,0.9317554396397556,9.097412679862698,lossguide,0.02031322579582437,0.0014193828131373,2,3,2.65069535264125,200,,0.35026577812551696,0.7579271489507924,none,0.848685412858625,1.750012448608109,,,,0.6569223746437701,0.7244344354591054,0.7256347256347256,0.35026577812551696,0.6084933100639907,0.6058823529411764,0.7579271489507924,0.7261165488768287,0.7169239349825267,0.4609960334949317,0.46157293300470537,0.894781864841745,0.881471972614463,none,0.8866828313498155,0.8837437069736485,0.848685412858625,COMPLETE
164,0.674791086350975,2025-09-23 12:28:39.919329,2025-09-23 12:28:40.453476,0 days 00:00:00.534147,0.010328411293209591,gbtree,0.4302380874183686,3.15904642828328,lossguide,4.385973290692548,0.15461199067228765,9,6,0.35393766444596836,800,,0.48435325147668473,0.7989605201352512,undersample,0.660719294582522,0.840204799588586,,,,0.7345236818960121,0.8004913501893746,0.8087633087633087,0.48435325147668473,0.6625108225108225,0.674791086350975,0.7989605201352512,0.7405811267830568,0.7348774865608638,0.5565900494617398,0.5688288817141179,0.8182207014542344,0.8292682926829268,undersample,0.8959352763416013,0.8968258945067406,0.660719294582522,COMPLETE
165,0.0,2025-09-23 12:28:40.573516,2025-09-23 12:28:45.474154,0 days 00:00:04.900638,0.027757418040597504,dart,0.9418828628812568,2.626142180446358,depthwise,0.10492356269639931,0.0013004230801018381,5,3,57.737949524703616,300,forest,0.40350026995141963,0.5068909523122913,none,0.6218758966657927,0.78909538653321,0.4124308368649186,weighted,0.4125857923901283,0.4353994066656694,0.7606715119254785,0.7607493857493858,0.40350026995141963,0.0,0.0,0.5068909523122913,0.5686730257412812,0.5607633155860553,0.0,0.0,0.0,0.0,none,0.8340178458470338,0.8315771968462731,0.6218758966657927,COMPLETE
166,0.6516992157465785,2025-09-23 12:28:45.592156,2025-09-23 12:28:46.677699,0 days 00:00:01.085543,0.018456311966351995,gbtree,0.7756597981959608,3.313715908270286,depthwise,0.0024631125695446093,0.29506260909169346,2,10,20.902374148252296,900,,0.3149538844114583,0.8164585561382898,oversample,0.7313365525398068,1.9027041752809792,,,,0.3624697364133397,0.7658921076875832,0.7681203931203932,0.3149538844114583,0.6517435663164306,0.6516992157465785,0.8164585561382898,0.7874774720423675,0.7751348922286202,0.506029794277607,0.5086413826212194,0.9153122326775022,0.9067180145485665,oversample,0.9097797253983871,0.9053802183050834,0.7313365525398068,COMPLETE
167,0.6156798245614035,2025-09-23 12:28:46.798535,2025-09-23 12:28:49.544953,0 days 00:00:02.746418,0.08284051013497955,dart,0.6712988963933697,2.137071880691377,depthwise,3.7445259521668444,0.23143412488782072,1,9,0.5124985409715428,200,tree,0.3479614269314491,0.7294248910228878,undersample,0.853185900673849,2.611687503568952,0.34220952237579483,uniform,0.37481973290770143,0.9937420053583057,0.7113317637424507,0.7129402129402129,0.3479614269314491,0.615174672489083,0.6156798245614035,0.7294248910228878,0.8134879395834302,0.8063576549200645,0.45170340681362725,0.45291389393022785,0.9640718562874252,0.961061189559264,undersample,0.9216993661330664,0.9187891603752958,0.853185900673849,COMPLETE
168,0.38612143742255267,2025-09-23 12:28:49.664067,2025-09-23 12:28:50.055402,0 days 00:00:00.391335,6.391728690575583,gbtree,0.3821708721271717,0.24522649262932905,depthwise,0.038877962964974894,0.0005150575180488061,6,3,36.0855359149518,300,,0.3686563266512723,0.6563085579616734,undersample,0.570707055940648,3.115308186165108,,,,0.2802065636219121,0.23932848807452145,0.23925061425061425,0.3686563266512723,0.3862228462872718,0.38612143742255267,0.6563085579616734,0.7063653421895014,0.6972401465498116,0.23932848807452145,0.23925061425061425,1.0,1.0,undersample,0.8695747095117107,0.8674474110612385,0.570707055940648,COMPLETE
169,0.0,2025-09-23 12:28:50.173726,2025-09-23 12:29:05.413495,0 days 00:00:15.239769,0.4753525427452659,dart,0.6332677285668984,7.762115084700661,depthwise,30.123361932583617,0.0007739674123438006,9,9,0.9461921930949182,500,tree,0.6834743582736033,0.9120743348103427,none,0.6501607873895562,2.9530608863812824,0.39103940537858906,weighted,0.517776036048261,0.28409458357024564,0.7606715119254785,0.7607493857493858,0.6834743582736033,0.0,0.0,0.9120743348103427,0.7319615389845098,0.7224742170294515,0.0,0.0,0.0,0.0,none,0.8955665864188344,0.8937665691383982,0.6501607873895562,COMPLETE
170,0.6763990267639902,2025-09-23 12:29:05.533735,2025-09-23 12:29:06.050974,0 days 00:00:00.517239,0.0031701516869646396,gbtree,0.7185131769514652,0.4790288699711853,depthwise,0.0014025193486558985,0.17484393201721243,6,6,0.30896791513780897,300,,0.5533169769513155,0.5580973981171398,oversample,0.8052310760417796,0.6674087332773573,,,,0.8269140190127067,0.8382638959975433,0.8366093366093366,0.5533169769513155,0.6827309236947792,0.6763990267639902,0.5580973981171398,0.778294715949228,0.768310416703055,0.6434519303557911,0.6427745664739885,0.7271171941830624,0.7137355584082157,oversample,0.9072919677687131,0.9020825570429811,0.8052310760417796,COMPLETE
171,0.5283365904126911,2025-09-23 12:29:06.169167,2025-09-23 12:29:30.314068,0 days 00:00:24.144901,0.02907181917237104,dart,0.6156909422117014,7.24228605558232,depthwise,0.0590025421303467,0.3514083720387823,7,5,28.455891066913942,600,forest,0.30759719540396746,0.553383796294215,undersample,0.7594819132047856,4.6019045478740095,0.04705250203920047,weighted,0.33985898337220816,0.8234794178214815,0.5754939093049443,0.579954954954955,0.30759719540396746,0.5254605790136171,0.5283365904126911,0.553383796294215,0.783712107577341,0.7768407280440052,0.35869395406967663,0.3612071675573719,0.9820359281437125,0.9833119383825417,undersample,0.9045435572133893,0.9034452579189964,0.7594819132047856,COMPLETE
172,0.617812542884589,2025-09-23 12:29:30.431261,2025-09-23 12:29:30.789124,0 days 00:00:00.357863,1.6907997957758594,gbtree,0.6614006265009317,0.08199140586074072,lossguide,0.0021324715346617957,0.04953512232008415,9,3,9.243016790686136,200,,0.4210385709203944,0.9865231211341141,oversample,0.7191406163914006,2.426288245732216,,,,0.32171268376316187,0.7105128467601597,0.7148853398853399,0.4210385709203944,0.6130268199233716,0.617812542884589,0.9865231211341141,0.8017245298176138,0.7973199310446883,0.4507042253521127,0.45474747474747473,0.9580838323353293,0.9632006846384253,oversample,0.9170855186794643,0.9154725543175793,0.7191406163914006,COMPLETE
173,0.6115512026501513,2025-09-23 12:29:30.909221,2025-09-23 12:29:32.014796,0 days 00:00:01.105575,0.011335466390705276,gbtree,0.9561797772643104,7.777832666167901,depthwise,0.00026700992438400897,0.0111903700132124,1,11,21.308721403910393,500,,0.4618169147521527,0.7525957775356895,oversample,0.9521985956995156,1.7174074281307732,,,,0.5832172043623738,0.7194185689425735,0.7238943488943489,0.4618169147521527,0.6075876879026485,0.6115512026501513,0.7525957775356895,0.6767864741988469,0.6706781795700034,0.45663869162900794,0.46092053842813724,0.9076133447390933,0.9084296106118956,oversample,0.8762060342087612,0.8749676311755786,0.9521985956995156,COMPLETE
174,0.6420905272981802,2025-09-23 12:29:32.134555,2025-09-23 12:29:32.710038,0 days 00:00:00.575483,0.00010254558540164128,gbtree,0.7173027552544406,3.8271819815799466,depthwise,0.02248722994666537,0.07601047350194365,10,10,84.60792846869018,600,,0.31164551913308575,0.6080610097849588,oversample,0.6880086674857515,0.6520053916518738,,,,0.8639338921563915,0.7656873784420104,0.7644348894348895,0.31164551913308575,0.6470316114109483,0.6420905272981802,0.6080610097849588,0.784479156434459,0.7760943488212555,0.50590788521823,0.5043988269794721,0.8973481608212147,0.883183568677792,oversample,0.9053006795682528,0.902030905123024,0.6880086674857515,COMPLETE
175,0.38612143742255267,2025-09-23 12:29:32.830643,2025-09-23 12:30:27.757802,0 days 00:00:54.927159,0.05808494291232625,dart,0.7681446342221452,9.944959313733248,lossguide,0.017659133785795738,0.0002146151984220327,6,5,70.88876407953802,900,forest,0.5420147502494392,0.7376191693202507,undersample,0.8102105523204355,2.1882368682768374,0.021391904583316856,uniform,0.30145908645323766,0.31626692906405324,0.23932848807452145,0.23925061425061425,0.5420147502494392,0.3862228462872718,0.38612143742255267,0.7376191693202507,0.7067325519692734,0.705347523052801,0.23932848807452145,0.23925061425061425,1.0,1.0,undersample,0.8691896730214524,0.8657165534959858,0.8102105523204355,COMPLETE
176,0.38612143742255267,2025-09-23 12:30:27.876950,2025-09-23 12:30:28.377963,0 days 00:00:00.501013,0.0031423205431497713,gbtree,0.48017736121915944,0.9338409764882383,lossguide,0.0021024746991630964,0.0015999888400768682,3,3,1.4850780489602928,400,,0.3489460936086792,0.8467544859637179,oversample,0.5898240875587113,1.9614163250973828,,,,0.38197616656695105,0.23932848807452145,0.23925061425061425,0.3489460936086792,0.3862228462872718,0.38612143742255267,0.8467544859637179,0.730159902784069,0.7197834311121488,0.23932848807452145,0.23925061425061425,1.0,1.0,oversample,0.8918370364640118,0.8879626956820319,0.5898240875587113,COMPLETE
177,0.6349388928828181,2025-09-23 12:30:28.505917,2025-09-23 12:30:29.482688,0 days 00:00:00.976771,7.908119272991421,gbtree,0.7396383260152735,3.9378824337231078,depthwise,0.00013111820885711886,0.03267743446318105,10,6,0.12531974863887954,900,,0.5380098463146488,0.9520655255992234,undersample,0.6532997008253196,3.8868792733576645,,,,0.3495737444129315,0.7350803562288873,0.7400696150696151,0.5380098463146488,0.6316538571021919,0.6349388928828181,0.9520655255992234,0.8023397561428809,0.7969268916120076,0.4733361774744027,0.47812906019922047,0.9491017964071856,0.944801026957638,undersample,0.9178451160427861,0.9158500106557277,0.6532997008253196,COMPLETE
178,0.6288061865635572,2025-09-23 12:30:29.606588,2025-09-23 12:30:31.407445,0 days 00:00:01.800857,12.557574765826711,gbtree,0.6589388091916468,3.424578776409021,depthwise,75.06893314643938,0.0007008941000048646,5,12,32.47925665670331,1000,,0.568606290093193,0.776481158679412,none,0.5851916062814815,2.759044082531633,,,,0.9239354410500307,0.8452246903470161,0.8427518427518428,0.568606290093193,0.638623326959847,0.6288061865635572,0.776481158679412,0.74457369888419,0.7408507362663527,0.723726977248104,0.722376457523598,0.5714285714285714,0.5566966195977749,none,0.8926090088696245,0.8905649850540535,0.5851916062814815,COMPLETE
179,0.07575133799917662,2025-09-23 12:30:31.529115,2025-09-23 12:30:36.574055,0 days 00:00:05.044940,0.004287874204403715,dart,0.5153234128330647,1.2193298741989589,depthwise,0.6027027251702656,0.001780869958090768,9,11,6.776474493212933,300,tree,0.6341837577907856,0.5801526085127164,undersample,0.5327910478352015,1.4603466938270822,0.40216645906023313,uniform,0.22107178104819436,0.9652252722969339,0.7702937864673969,0.7701678951678952,0.6341837577907856,0.07730263157894737,0.07575133799917662,0.5801526085127164,0.7465999750316549,0.7385761138551961,1.0,1.0,0.04020530367835757,0.03936670945656825,undersample,0.8953470589244258,0.8945492368040141,0.5327910478352015,COMPLETE
180,0.0,2025-09-23 12:30:36.692802,2025-09-23 12:30:37.081426,0 days 00:00:00.388624,6.77638917062961,gbtree,0.33861196294071566,6.911288860821325,lossguide,0.13107463141594783,0.00014973894996939843,3,5,97.08185178508108,200,,0.4790561370499513,0.6391156948335717,none,0.5260149060025212,1.230568280695325,,,,0.7299894404895471,0.7606715119254785,0.7607493857493858,0.4790561370499513,0.0,0.0,0.6391156948335717,0.7208944385969186,0.715778402458095,0.0,0.0,0.0,0.0,none,0.8802566733422825,0.8787347087715612,0.5260149060025212,COMPLETE
181,0.6365230949132723,2025-09-23 12:30:37.199355,2025-09-23 12:30:37.595218,0 days 00:00:00.395863,0.0004298313675518901,gbtree,0.324086474528515,5.251597299929988,lossguide,0.03149222422690377,0.3121594121456991,10,9,9.780737418777482,500,,0.4187411470751866,0.5286450192749507,none,0.5914759697626661,1.2470260994993156,,,,0.5816594375455924,0.8063261336881974,0.8090704340704341,0.4187411470751866,0.6369915579432079,0.6365230949132723,0.5286450192749507,0.6651735341496152,0.6579653378286923,0.5775922059846903,0.5844667143879743,0.7100085543199316,0.6987590928540864,none,0.8709968896626263,0.8701066787775159,0.5914759697626661,COMPLETE
182,0.38612143742255267,2025-09-23 12:30:37.722607,2025-09-23 12:30:38.361826,0 days 00:00:00.639219,0.08986012076892168,gbtree,0.20005795971079376,5.260963484005408,depthwise,0.0019041099577678494,0.0006062240477411285,9,10,3.1800583934776165,300,,0.4985229438913038,0.8813931736114946,oversample,0.6479560703293037,1.3492061089478864,,,,0.24225591807999758,0.23932848807452145,0.23925061425061425,0.4985229438913038,0.3862228462872718,0.38612143742255267,0.8813931736114946,0.7442849786542353,0.7364157825367019,0.23932848807452145,0.23925061425061425,1.0,1.0,oversample,0.8935162433653945,0.891715233579253,0.6479560703293037,COMPLETE
183,0.7072771872444807,2025-09-23 12:30:38.483641,2025-09-23 12:30:45.010479,0 days 00:00:06.526838,7.45316454072329,dart,0.4652558433502223,2.276689383929903,depthwise,3.094532715356673,0.18395977194117863,6,8,0.45069280293295655,300,forest,0.47985875952776225,0.7984010088524106,oversample,0.6495901097316312,0.532824332192018,0.24821501604836255,weighted,0.6962861781708526,0.39843706375527943,0.8537209540382844,0.8533988533988534,0.47985875952776225,0.7116044399596367,0.7072771872444807,0.7984010088524106,0.8082575788267994,0.8024730256617443,0.6736721436759648,0.6771037181996086,0.7540633019674936,0.7402652973898161,oversample,0.9184685303825706,0.9171089182366231,0.6495901097316312,COMPLETE
184,0.5309948593891745,2025-09-23 12:30:45.128922,2025-09-23 12:30:45.526199,0 days 00:00:00.397277,0.0005545407302217737,gbtree,0.4642825264480139,5.623263097012292,lossguide,0.0007027027904166334,0.1309424476058005,3,4,0.6933284780705208,400,,0.6074943475899085,0.7197367465674187,none,0.6623929288688143,0.6160851951326646,,,,0.478066690572814,0.8457365134609479,0.8412162162162162,0.6074943475899085,0.547039374812143,0.5309948593891745,0.7197367465674187,0.800321208503476,0.7953703099006971,0.9201213346814965,0.9051546391752577,0.38922155688622756,0.3756953359007274,none,0.9123777935794597,0.9120739789086265,0.6623929288688143,COMPLETE
185,0.6892568348093955,2025-09-23 12:30:45.644002,2025-09-23 12:30:52.658964,0 days 00:00:07.014962,0.0008192710926408377,dart,0.8890402850501615,7.474439936640761,lossguide,0.0013410937294292167,0.005196400551623488,1,9,0.667836211546656,300,forest,0.4509569326987956,0.9286771285605216,oversample,0.7130761375130563,0.5334061225290527,0.053888068023813684,weighted,0.3004050644052326,0.21228474925163665,0.8347834988228069,0.8347665847665847,0.4509569326987956,0.6922196796338673,0.6892568348093955,0.9286771285605216,0.7763558106122104,0.7649167971778974,0.6245698554714384,0.6265313265663283,0.7763045337895638,0.7659392383397519,oversample,0.9079429237723873,0.9042510163537348,0.7130761375130563,COMPLETE
186,0.38612143742255267,2025-09-23 12:30:52.778264,2025-09-23 12:31:10.574059,0 days 00:00:17.795795,0.030709992011171066,dart,0.4272463121822698,1.1711786752871545,lossguide,0.5887757244696243,0.00013297099307647562,5,10,0.13057748815839063,500,tree,0.36996612194277045,0.5186055181544007,none,0.551773597159886,2.6279224875625955,0.15839998887847967,uniform,0.13728849175201574,0.8791405030098671,0.23932848807452145,0.23925061425061425,0.36996612194277045,0.3862228462872718,0.38612143742255267,0.5186055181544007,0.6362020459377947,0.6381488317914876,0.23932848807452145,0.23925061425061425,1.0,1.0,none,0.8300526520636563,0.8268022158155415,0.551773597159886,COMPLETE
187,0.683375104427736,2025-09-23 12:31:10.694575,2025-09-23 12:31:11.728440,0 days 00:00:01.033865,0.129529004859424,gbtree,0.3405412555906284,9.50705818837975,depthwise,2.496750740193578,0.007255023388833951,6,8,0.1875897718121542,1000,,0.3305375899028835,0.530889534867401,oversample,0.755551543345027,0.5486760755562174,,,,0.29620571125910883,0.7998771624526564,0.805999180999181,0.3305375899028835,0.6789292166201347,0.683375104427736,0.530889534867401,0.8028722777355488,0.7940305209018768,0.5510530525193281,0.5605811403508771,0.8840889649272883,0.8750534873769791,oversample,0.9161916089385334,0.9140752172878802,0.755551543345027,COMPLETE
