number,value,datetime_start,datetime_complete,duration,params_alpha,params_booster,params_colsample_bytree,params_gamma,params_grow_policy,params_lambda,params_learning_rate,params_max_delta_step,params_max_depth,params_min_child_weight,params_n_estimators,params_normalize_type,params_params_decision_threshold,params_params_feature_fraction,params_params_resampling,params_params_sample_rows,params_params_scale_pos_weight,params_rate_drop,params_sample_type,params_skip_drop,params_subsample,user_attrs_acc_test,user_attrs_acc_val,user_attrs_decision_threshold,user_attrs_f1_test,user_attrs_f1_val,user_attrs_feature_fraction,user_attrs_pr_auc_test,user_attrs_pr_auc_val,user_attrs_prec_test,user_attrs_prec_val,user_attrs_rec_test,user_attrs_rec_val,user_attrs_resampling_strategy,user_attrs_roc_auc_test,user_attrs_roc_auc_val,user_attrs_sample_rows,state
2981,0.7147301006404392,2025-09-24 03:01:00.782063,2025-09-24 03:01:01.760598,0 days 00:00:00.978535,0.0006855584514901188,gbtree,0.5957824532512342,4.4235204912165145,depthwise,0.8927877574695723,0.02177665448740089,5,8,0.49376449031234787,300,,0.4765437942329422,0.9917638337676115,none,0.8316564308487134,2.338063536811301,,,,0.5836699547250989,0.8392875422254069,0.8403972153972153,0.4765437942329422,0.7144416151327756,0.7147301006404392,0.9917638337676115,0.826757996117172,0.8184835786670366,0.6215189873417721,0.6243606138107417,0.8400342172797263,0.8356867779204108,none,0.9273518825432356,0.9248899891841915,0.8316564308487134,COMPLETE
2982,0.7097116575269768,2025-09-24 03:01:01.918059,2025-09-24 03:01:05.223282,0 days 00:00:03.305223,0.0003619716736875151,dart,0.8647033216033178,9.776447351789493,depthwise,0.00264930111210963,0.46521924975680934,0,12,1.0370754731446727,200,tree,0.522819739119985,0.8618821880807325,none,0.9409788633175019,3.7162505467705635,0.2397885039433651,uniform,0.7052603181502,0.7240136562115721,0.8269014228682567,0.832002457002457,0.522819739119985,0.7067799549159008,0.7097116575269768,0.8618821880807325,0.8230133726648766,0.8180011388815974,0.5943423738699329,0.6049457177322075,0.8716852010265184,0.8583654257595208,none,0.9262113065523605,0.9241532151419936,0.9409788633175019,COMPLETE
2983,0.6862420080511484,2025-09-24 03:01:05.376443,2025-09-24 03:01:06.153653,0 days 00:00:00.777210,0.0003161975964388778,gbtree,0.3206891983263681,1.3570679854352203,lossguide,11.082490123311683,0.043689042445516364,4,4,0.6570563235095972,200,,0.6206140042007854,0.8978707295802588,none,0.899331569676157,1.8845009810723612,,,,0.8092729168889632,0.8662094380182209,0.8643529893529893,0.6206140042007854,0.6942690058479533,0.6862420080511484,0.8978707295802588,0.8163053649239944,0.8086230336270386,0.766133195663397,0.7682926829268293,0.6347305389221557,0.62002567394095,none,0.9216736663359364,0.9200273956716151,0.899331569676157,COMPLETE
2984,0.6748791517230626,2025-09-24 03:01:06.306439,2025-09-24 03:01:07.168437,0 days 00:00:00.861998,0.001999800285064489,gbtree,0.6146991560233177,5.040513713949634,depthwise,0.024587183774864466,0.08200643872783127,2,6,0.96977135420553,500,,0.5305427182736762,0.9429786504746073,undersample,0.9743210419688644,2.3679253958112834,,,,0.6637051903082156,0.7809397072371789,0.7865479115479116,0.5305427182736762,0.6694470188446092,0.6748791517230626,0.9429786504746073,0.8199551780058123,0.8151110202643692,0.523936170212766,0.5309126594700687,0.9268605645851155,0.9259734702610184,undersample,0.9258155354323937,0.9240749886835075,0.9743210419688644,COMPLETE
2985,0.6793454223794781,2025-09-24 03:01:07.327643,2025-09-24 03:01:11.861503,0 days 00:00:04.533860,0.00010178117316951995,gbtree,0.6135818334394598,0.13023416023723433,lossguide,0.003413528714406516,0.3636696283954701,3,12,0.16484188655351292,300,,0.6560189953708733,0.9685044305531177,none,0.9288926624626951,4.854882656725243,,,,0.6287183490281015,0.8462483365748797,0.8515561015561015,0.6560189953708733,0.6681396376491383,0.6793454223794781,0.9685044305531177,0.7744504740971654,0.775113265120256,0.6910420475319927,0.702974828375286,0.6467065868263473,0.6572528883183568,none,0.8990056682298359,0.8999203454839725,0.9288926624626951,COMPLETE
