number,value,datetime_start,datetime_complete,duration,params_alpha,params_booster,params_colsample_bytree,params_gamma,params_grow_policy,params_lambda,params_learning_rate,params_max_delta_step,params_max_depth,params_min_child_weight,params_n_estimators,params_normalize_type,params_params_decision_threshold,params_params_feature_fraction,params_params_resampling,params_params_sample_rows,params_params_scale_pos_weight,params_rate_drop,params_sample_type,params_skip_drop,params_subsample,user_attrs_acc_test,user_attrs_acc_val,user_attrs_decision_threshold,user_attrs_f1_test,user_attrs_f1_val,user_attrs_feature_fraction,user_attrs_pr_auc_test,user_attrs_pr_auc_val,user_attrs_prec_test,user_attrs_prec_val,user_attrs_rec_test,user_attrs_rec_val,user_attrs_resampling_strategy,user_attrs_roc_auc_test,user_attrs_roc_auc_val,user_attrs_sample_rows,state
2391,0.7178830559112249,2025-09-24 00:53:32.683461,2025-09-24 00:53:56.878435,0 days 00:00:24.194974,0.047176213367631,dart,0.6411560490484944,7.322973172651903,depthwise,0.003776314300166069,0.1532151429143867,0,12,5.353553487738809,600,tree,0.6014713989941238,0.9656468040772314,none,0.8696133484547693,2.1541347027216453,0.18427465861566367,weighted,0.6619228779686165,0.4747774472213177,0.8672330842460846,0.8646601146601146,0.6014713989941238,0.7242185838826282,0.7178830559112249,0.9656468040772314,0.8229558116605344,0.8160533490184633,0.7200845665961945,0.7160493827160493,0.7284003421727973,0.7197261446298674,none,0.9258307883914966,0.9233228975725154,0.8696133484547693,COMPLETE
2392,0.7089219330855019,2025-09-24 00:53:57.021908,2025-09-24 00:54:19.910817,0 days 00:00:22.888909,0.03555863800866468,dart,0.6116382354316906,1.7670193078922374,lossguide,0.001405907030303783,0.004652239728667519,3,9,3.7399933207769887,500,forest,0.6585422852745259,0.8351061310108644,none,0.9927191673806914,4.642567548675537,0.05004759710108606,weighted,0.7499738104481226,0.8675046087252869,0.8376497082608251,0.8396805896805897,0.6585422852745259,0.7062962962962963,0.7089219330855019,0.8351061310108644,0.8110084209023982,0.8040908558356004,0.6227955584585239,0.6266841932303647,0.8156544054747648,0.8160034231921267,none,0.9209844628178326,0.9187419711351565,0.9927191673806914,COMPLETE
2393,0.7202652300041442,2025-09-24 00:54:20.058595,2025-09-24 00:54:21.066751,0 days 00:00:01.008156,0.0010753578671683177,gbtree,0.3670039549021169,1.9921173352202977,lossguide,0.009942854290719807,0.1390960562364429,0,3,0.2923531767309136,800,,0.6936737852028527,0.9788801497185042,none,0.8908201722152786,3.8177373401919636,,,,0.7533072244328761,0.8627290408434845,0.8617936117936118,0.6936737852028527,0.7232198142414861,0.7202652300041442,0.9788801497185042,0.8270951238462867,0.8237641686972736,0.6988432389309932,0.698272398553636,0.7493584260051326,0.7436884895164741,none,0.9281639731092058,0.9265401154319641,0.8908201722152786,COMPLETE
2394,0.604126010593811,2025-09-24 00:54:21.212636,2025-09-24 00:54:24.517957,0 days 00:00:03.305321,50.88838742797371,dart,0.9733826628046279,2.33084579455256,depthwise,0.03016126059854208,0.00031445876078247504,0,8,0.8173378306368705,200,forest,0.5583124102254277,0.9657857306658635,undersample,0.8432109481385025,1.2810569766836089,0.3210995556086167,weighted,0.7063025393862198,0.4073698581877433,0.7034496877879005,0.7092547092547092,0.5583124102254277,0.599142105991421,0.604126010593811,0.9657857306658635,0.6488446319973439,0.6462348759691945,0.44283084475352835,0.4480049617531528,0.9260051325919589,0.9272571673085152,undersample,0.8750721062057211,0.8750136399649272,0.8432109481385025,COMPLETE
2395,0.7046673286991063,2025-09-24 00:54:24.663347,2025-09-24 00:54:25.430769,0 days 00:00:00.767422,0.019898773286252912,gbtree,0.6772257622170789,1.069381366812241,depthwise,0.0030073324810728657,0.43230306779950617,9,5,0.21712733171157467,400,,0.33972152510534676,0.9557237427866385,none,0.8778927270613472,1.0296779192825174,,,,0.8942078124684264,0.8474767120483161,0.8477682227682227,0.33972152510534676,0.7059984214680347,0.7046673286991063,0.9557237427866385,0.8105043253158336,0.8020596051576119,0.6553113553113553,0.6575240919199407,0.7651839178785287,0.7590928540864356,none,0.9198126902087169,0.9154344919774549,0.8778927270613472,COMPLETE
2396,0.7027677496991577,2025-09-24 00:54:25.577640,2025-09-24 00:54:27.693598,0 days 00:00:02.115958,0.0012359128088247334,gbtree,0.2799020202841062,2.3868156480836187,lossguide,0.011346882508226281,0.02370775913718771,2,8,0.10600408889655796,600,,0.6957705417776906,0.9708630673017217,undersample,0.9190387750310692,2.8149379678588717,,,,0.8339468555361361,0.8211690039922203,0.822993447993448,0.6957705417776906,0.7025370338838753,0.7027677496991577,0.9708630673017217,0.8267207666362417,0.8189807139226205,0.5835926449787836,0.5873563218390805,0.8823781009409752,0.8746255883611468,undersample,0.9279732823412521,0.9256353142967504,0.9190387750310692,COMPLETE
2397,0.6485599164303836,2025-09-24 00:54:27.839992,2025-09-24 00:55:20.090521,0 days 00:00:52.250529,0.0001242478069847832,dart,0.7279422177555825,8.348924717574898,depthwise,0.03948196471573822,0.05612508198630133,0,12,10.10512279905138,900,tree,0.6698487387530757,0.8897173957453474,undersample,0.8411367957577076,4.9339002394844975,0.19536009071901922,uniform,0.5394291662320745,0.47147042355555246,0.7570887501279557,0.7589066339066339,0.6698487387530757,0.6482881280569142,0.6485599164303836,0.8897173957453474,0.8053519541502003,0.8024307965855284,0.4960308459968247,0.4979376718606783,0.935414884516681,0.9298245614035088,undersample,0.918564249895733,0.9173785216805908,0.8411367957577076,COMPLETE
2398,0.7031520609629373,2025-09-24 00:55:20.235161,2025-09-24 00:55:21.025476,0 days 00:00:00.790315,0.0001593641239163135,gbtree,0.5735095112414619,4.85022162891832,lossguide,0.4331193056669158,0.2687401231606846,1,6,0.6281476104678517,400,,0.6361523863559259,0.9454913981039476,oversample,0.9434646628693107,2.3213405867048276,,,,0.8934845220162262,0.8242399426758112,0.8245290745290745,0.6361523863559259,0.7057412167952014,0.7031520609629373,0.9454913981039476,0.8254133348509557,0.8182406945000172,0.5887903917643694,0.5906313645621182,0.8806672369546621,0.8686350021394951,oversample,0.9272471551504523,0.9245301244419707,0.9434646628693107,COMPLETE
2399,0.6060854141083367,2025-09-24 00:55:21.173646,2025-09-24 00:55:53.521775,0 days 00:00:32.348129,0.22249609695307385,dart,0.4149688335267496,0.5154962048436929,depthwise,0.0002798058804735905,0.004776365334821332,7,4,6.726915433719326,700,forest,0.306501684128685,0.9810280183251128,oversample,0.6725079790375434,1.1163504224937768,0.15380159337288898,weighted,0.6167369146841323,0.9172296761845354,0.7002763844815232,0.7044430794430795,0.306501684128685,0.6034669555796316,0.6060854141083367,0.9810280183251128,0.777344164357214,0.768865127397499,0.4415378517637733,0.444911858974359,0.9529512403763901,0.9503637141634574,oversample,0.9079628101775571,0.9045199288021183,0.6725079790375434,COMPLETE
2400,0.5587524708983088,2025-09-24 00:55:53.667249,2025-09-24 00:55:56.198221,0 days 00:00:02.530972,0.0009025522061958934,gbtree,0.24525218201293414,0.7281438900482968,lossguide,0.0075594450017748265,0.07930285651814345,0,10,1.9294407288078699,600,,0.6859723983806502,0.6681809953810933,none,0.8043530824915446,3.1221152282460882,,,,0.47165698783866883,0.7937352850854744,0.7943284193284194,0.6859723983806502,0.5572401669962646,0.5587524708983088,0.6681809953810933,0.6047556561198899,0.5953765854018047,0.5729778581111613,0.5740072202166066,0.542343883661249,0.5442875481386393,none,0.8363840978289111,0.8333552148601825,0.8043530824915446,COMPLETE
2401,0.6279353461421165,2025-09-24 00:55:56.347731,2025-09-24 00:55:57.297557,0 days 00:00:00.949826,0.4081754106685521,gbtree,0.8344165651492413,3.0319771487073495,depthwise,0.548915351250374,0.09201743728702774,10,8,0.657360581212808,700,,0.3588702883897308,0.5892960245416485,none,0.6991244997546241,3.951684459501203,,,,0.8747814333085601,0.7443955369024465,0.7502047502047502,0.3588702883897308,0.622410403750189,0.6279353461421165,0.5892960245416485,0.7018995055636102,0.6958867676997693,0.48140350877192983,0.4877990997393982,0.8802395209580839,0.8810440735986307,none,0.881302421974207,0.8819512644269082,0.6991244997546241,COMPLETE
2402,0.6780200541142766,2025-09-24 00:55:57.444450,2025-09-24 00:55:58.681810,0 days 00:00:01.237360,0.059730277532086255,gbtree,0.9336942706907148,7.640420188877871,depthwise,0.00010861895394154993,0.016975304686608114,2,12,1.097361528478851,500,,0.6993772228805694,0.9581448904241333,undersample,0.9791211163734516,4.326362915375353,,,,0.47541208227890963,0.7893336063056607,0.7928951678951679,0.6993772228805694,0.6754966887417219,0.6780200541142766,0.9581448904241333,0.8217361899472153,0.8121073866280264,0.534965034965035,0.5397871262037507,0.9161676646706587,0.9114249037227214,undersample,0.9257477892706427,0.9227730666274642,0.9791211163734516,COMPLETE
2403,0.6423508564678087,2025-09-24 00:55:58.827930,2025-09-24 00:56:15.786175,0 days 00:00:16.958245,0.037042141026720314,dart,0.5276004425236773,4.017814002534237,lossguide,0.06633347264488858,0.04854440368179316,6,3,6.8385181445586545,500,forest,0.47696792661986237,0.9342607242723293,undersample,0.6543470753677574,1.8446241626248963,0.1335166171726918,weighted,0.7649890574264322,0.8209403841816678,0.7508445081379875,0.752047502047502,0.47696792661986237,0.6434222092001172,0.6423508564678087,0.9342607242723293,0.7959848012180302,0.7861678525302584,0.4893048128342246,0.4904171364148816,0.9392643284858854,0.9306803594351734,undersample,0.9162275541195134,0.9125314755686706,0.6543470753677574,COMPLETE
2404,0.703187250996016,2025-09-24 00:56:15.930658,2025-09-24 00:57:23.009086,0 days 00:01:07.078428,0.00011881456641939589,dart,0.3863404385253197,0.19446312270439758,lossguide,0.00033365209250640535,0.17468207343359732,3,10,0.25041157234020117,900,forest,0.41797161274281597,0.9216989230256345,none,0.8519103834207714,2.2027503238121686,0.08315191660025333,weighted,0.7995572558467191,0.40633487234082444,0.8437915856280069,0.8474610974610974,0.41797161274281597,0.6943108974358975,0.703187250996016,0.9216989230256345,0.7987463085637461,0.7968471872001346,0.6529766390354182,0.6578456951174059,0.7412318220701454,0.7552417629439452,none,0.9126940190787466,0.9129158994456316,0.8519103834207714,COMPLETE
2405,0.6240051973363651,2025-09-24 00:57:23.156267,2025-09-24 00:57:24.039134,0 days 00:00:00.882867,0.8742084870589891,gbtree,0.5910360577179155,8.81673161126744,depthwise,0.5545717261919391,0.001901436568694689,1,8,63.28734381017287,400,,0.469040740238012,0.9871397264831732,undersample,0.6858064282919342,0.8339253628439675,,,,0.6797088514941655,0.7549390930494421,0.763001638001638,0.469040740238012,0.6191536748329621,0.6240051973363651,0.9871397264831732,0.702073243254115,0.6927033513316742,0.4929078014184397,0.5028795811518325,0.8323353293413174,0.8219940094137783,undersample,0.8769524507130845,0.8763998634823056,0.6858064282919342,COMPLETE
2406,0.604448452058912,2025-09-24 00:57:24.183755,2025-09-24 00:57:24.901690,0 days 00:00:00.717935,2.9364908976053727,gbtree,0.32236061276050837,0.790664639085704,lossguide,0.0001311700315302301,0.0020216480414039805,2,3,0.12987364908493793,300,,0.6154348585873687,0.5645838018275302,oversample,0.692285011119908,1.6668797909139992,,,,0.7867402235781351,0.7263793632920462,0.7305487305487306,0.6154348585873687,0.6005081452697654,0.604448452058912,0.5645838018275302,0.6131377656995521,0.5978458095261182,0.4615207902595911,0.4658327542274728,0.8592814371257484,0.860504920838682,oversample,0.8412602098415777,0.8387036934347416,0.692285011119908,COMPLETE
2407,0.6655225673588467,2025-09-24 00:57:25.050854,2025-09-24 00:57:26.414375,0 days 00:00:01.363521,0.00013471098549179628,gbtree,0.5317003452200416,0.990917155454717,lossguide,0.0025905716397333473,0.34668474437894864,3,7,0.14165768080166513,500,,0.693689273504675,0.8568034120273579,undersample,0.8149620824294636,3.436220249570455,,,,0.6984210651796172,0.7993653393387246,0.8004709254709255,0.693689273504675,0.6656431252132378,0.6655225673588467,0.8568034120273579,0.7694075311283425,0.7603375110832288,0.5536322360953462,0.5555873925501432,0.8344739093242087,0.8296961916987591,undersample,0.9001230769903759,0.8963288095579891,0.8149620824294636,COMPLETE
2408,0.719783407464707,2025-09-24 00:57:26.559749,2025-09-24 00:57:44.650163,0 days 00:00:18.090414,0.00045618861685290703,dart,0.25317215748246225,3.247138495912992,lossguide,0.03346740121467914,0.19359793627184144,1,5,1.7205352276812966,500,forest,0.6745760299339857,0.9756751891475193,none,0.8070251188347335,4.675547349773952,0.07415385357795977,weighted,0.6330052871557874,0.9157626269622043,0.8510594738458389,0.8516584766584766,0.6745760299339857,0.7206757535035515,0.719783407464707,0.9756751891475193,0.8275513682442637,0.82189747767465,0.6537791710205503,0.6566690190543402,0.8028229255774166,0.7963200684638425,none,0.9277494379716258,0.9263919832534916,0.8070251188347335,COMPLETE
2409,0.6728941858592365,2025-09-24 00:57:44.794123,2025-09-24 00:57:45.689685,0 days 00:00:00.895562,0.024040437530533323,gbtree,0.8392846666348248,8.763883245218214,lossguide,1.3518992492133879,0.11575182285731167,6,7,31.407951039339874,900,,0.5548772920366412,0.5922522356952924,undersample,0.9920286152136698,1.8237504610443729,,,,0.9293752743775742,0.7853413860169925,0.7920761670761671,0.5548772920366412,0.6663484486873509,0.6728941858592365,0.5922522356952924,0.7966218779351472,0.7920065986898052,0.5305295160881682,0.5395144628099173,0.8956372968349017,0.8938810440735986,undersample,0.9144033577691494,0.9137600657182867,0.9920286152136698,COMPLETE
2410,0.6867627785058977,2025-09-24 00:57:45.839197,2025-09-24 00:58:43.188980,0 days 00:00:57.349783,0.023333586161550488,dart,0.47503050578209827,0.5964953818390851,depthwise,0.0016130424943725965,0.019158123284600856,5,9,8.794335704215287,900,forest,0.5102894988071731,0.9345320965683862,oversample,0.8641107786083734,1.8263654626570838,0.21305026056234538,weighted,0.6722921247617398,0.4546852802335408,0.8007984440577336,0.8042588042588042,0.5102894988071731,0.6856219709208401,0.6867627785058977,0.9345320965683862,0.8236515190886267,0.8162046001623204,0.5508826583592938,0.5564109370852137,0.9076133447390933,0.8968763371844245,oversample,0.9255196280257985,0.9227537187510922,0.8641107786083734,COMPLETE
2411,0.7174940898345153,2025-09-24 00:58:43.337025,2025-09-24 00:58:55.474446,0 days 00:00:12.137421,0.00086501273093987,dart,0.9959224725482794,5.642973405386501,depthwise,0.00040028790851778556,0.44599876262330923,0,12,6.885719969760799,400,forest,0.589983422221877,0.9117871430727134,none,0.9244944882334407,2.949841256050859,0.19864661684679408,weighted,0.8088856050800775,0.621175741067588,0.8514689323369843,0.8531941031941032,0.589983422221877,0.7166569029486428,0.7174940898345153,0.9117871430727134,0.8155040167523582,0.81066269584731,0.6593604024434064,0.664841182913472,0.7848588537211292,0.7792041078305519,none,0.9227876791546386,0.921402851174465,0.9244944882334407,COMPLETE
2412,0.6197342380548487,2025-09-24 00:58:55.618881,2025-09-24 00:58:56.456857,0 days 00:00:00.837976,0.2932642469680083,gbtree,0.9023083328691296,1.1915073461815684,depthwise,0.05069720774318119,0.009234221316516958,3,3,0.15331352705692147,500,,0.30240687058877713,0.7302317852395573,none,0.7065553232767037,3.037145877271136,,,,0.5688919675955231,0.7184972873374962,0.7246109746109746,0.30240687058877713,0.6163504464285714,0.6197342380548487,0.7302317852395573,0.7765950351893005,0.7646578443488743,0.45734989648033125,0.4627401308845261,0.9448246364414029,0.9379546427043218,none,0.9066365797731487,0.903129156230474,0.7065553232767037,COMPLETE
2413,0.0,2025-09-24 00:58:56.605116,2025-09-24 00:59:00.601662,0 days 00:00:03.996546,0.006775265286882866,gbtree,0.22453272972612298,4.274033104195288,lossguide,0.008127009574524818,0.0002574867258465206,3,9,0.3216522951612032,600,,0.6759384706990484,0.9822738846150971,none,0.9712776545620554,2.934448166583396,,,,0.7984261970414677,0.7606715119254785,0.7607493857493858,0.6759384706990484,0.0,0.0,0.9822738846150971,0.7630343382769988,0.7564649479022034,0.0,0.0,0.0,0.0,none,0.9044468304293426,0.9040849758730256,0.9712776545620554,COMPLETE
2414,0.7034822370735139,2025-09-24 00:59:00.747678,2025-09-24 00:59:53.505496,0 days 00:00:52.757818,0.0023465543080350678,dart,0.38609062675075617,1.3645581894578502,lossguide,0.0001305180066569279,0.03169367081737983,8,12,1.3391782069771194,800,tree,0.3917415689381799,0.9902742431740215,none,0.8135274598908685,3.2441152825874253,0.07071461443075386,weighted,0.6432900458689743,0.24435665695670467,0.8227044733340158,0.8273955773955773,0.3917415689381799,0.6987826086956521,0.7034822370735139,0.9902742431740215,0.8161106915077454,0.8128924552048699,0.5888042203985931,0.5971931919976112,0.8592814371257484,0.8557980316645272,none,0.9222166716799977,0.9211849572334195,0.8135274598908685,COMPLETE
2415,0.6815606281366359,2025-09-24 00:59:53.655803,2025-09-24 00:59:54.333203,0 days 00:00:00.677400,0.8298323391229446,gbtree,0.66622520487573,1.6523980382736392,depthwise,0.004827123141564582,0.0381311866379824,10,4,0.11444259719329807,200,,0.33187588735384704,0.7639648823228771,none,0.9780575031639925,2.197328186312268,,,,0.8103607402905414,0.7906643464018835,0.7986281736281736,0.33187588735384704,0.6749324431727866,0.6815606281366359,0.7639648823228771,0.8174285187213249,0.8122312085945153,0.5370604604098154,0.5481770833333334,0.9080410607356715,0.9007274283269149,none,0.922356020412028,0.9213487519784788,0.9780575031639925,COMPLETE
2416,0.6261479378861246,2025-09-24 00:59:54.482431,2025-09-24 01:00:05.669473,0 days 00:00:11.187042,0.02063059774581033,dart,0.8646520322458944,4.7223989148338985,lossguide,0.0001939791716601919,0.2599282327459354,0,11,55.912034327352536,400,forest,0.35354346914264645,0.5352423987876384,oversample,0.7531298214131237,0.5520280301508731,0.04966657789907024,weighted,0.8961384197045974,0.7960112441068955,0.7732623605282014,0.7707821457821458,0.35354346914264645,0.6307717952992166,0.6261479378861246,0.5352423987876384,0.7358729505998617,0.7277669159149771,0.5167986888828189,0.5134173055859803,0.8092386655260907,0.8023106546854942,oversample,0.879219932589979,0.8745944935598349,0.7531298214131237,COMPLETE
2417,0.7155046826222685,2025-09-24 01:00:05.814298,2025-09-24 01:00:06.598534,0 days 00:00:00.784236,0.019353060009900194,gbtree,0.6532346946860048,4.120628671479759,lossguide,23.30399482863706,0.1251799414460662,0,6,0.1152715270785958,300,,0.6505640132396654,0.9433849651585992,none,0.886595316134541,3.003090048319314,,,,0.9914342973318795,0.8601699252738254,0.860053235053235,0.6505640132396654,0.7186985172981878,0.7155046826222685,0.9433849651585992,0.8226687241049341,0.8130777973570968,0.693010325655282,0.696515397082658,0.7463644140290847,0.7355584082156611,none,0.9255930149045011,0.9236516675134242,0.886595316134541,COMPLETE
2418,0.7188612099644128,2025-09-24 01:00:06.742754,2025-09-24 01:00:08.894001,0 days 00:00:02.151247,0.002056040317333314,gbtree,0.928563745261237,2.2062711935736585,lossguide,0.0202421563319979,0.013882405426276117,6,8,0.1321629070750866,300,,0.39717311802337907,0.9986133724982243,none,0.9810890135212641,1.0601360271208031,,,,0.6562513342954027,0.8638550516941345,0.8625102375102375,0.39717311802337907,0.7217573221757322,0.7188612099644128,0.9986133724982243,0.8246996249959049,0.8191078082766508,0.7063882063882064,0.703688524590164,0.7378100940975193,0.7347026101839966,none,0.9254766031694612,0.9236198529250448,0.9810890135212641,COMPLETE
2419,0.5691442848219863,2025-09-24 01:00:09.039475,2025-09-24 01:00:10.290521,0 days 00:00:01.251046,3.1767265548251107,gbtree,0.36727393964404687,5.04430616999668,depthwise,24.91732712188284,0.0009058964560587411,8,12,0.37990795549084033,500,,0.3020318083816035,0.9283916413049026,none,0.5262129867219933,1.6950919829303805,,,,0.49366246128889996,0.640495444774286,0.6469082719082719,0.3020318083816035,0.5641598411516505,0.5691442848219863,0.9283916413049026,0.7492990023402343,0.7424750466380339,0.39737762237762236,0.40190543401552575,0.9721984602224123,0.9747539580658965,none,0.899536960452473,0.8984471141058861,0.5262129867219933,COMPLETE
2420,0.6669820245979187,2025-09-24 01:00:10.437737,2025-09-24 01:00:14.459974,0 days 00:00:04.022237,0.000351839163508099,dart,0.2634152099981317,5.850201412150415,lossguide,0.0002659541668103486,0.013513864987137868,4,10,1.4016491649223952,200,tree,0.6169470085215052,0.9314621933592127,none,0.8156608096045479,2.735248107040112,0.12014247355830099,uniform,0.4890126389179363,0.6034563091441757,0.8588391851776026,0.8558558558558559,0.6169470085215052,0.6759106933019976,0.6669820245979187,0.9314621933592127,0.783970295590632,0.7745651888959312,0.7501304121022431,0.745637228979376,0.6150556030795552,0.6033376123234917,none,0.9127120636171568,0.910898998499791,0.8156608096045479,COMPLETE
2421,0.6712389380530973,2025-09-24 01:00:14.608000,2025-09-24 01:00:15.591001,0 days 00:00:00.983001,0.0006041879548304342,gbtree,0.903619978486335,3.8109995123598086,lossguide,1.7433632793042406,0.05183482776900037,1,4,0.4803549493546828,600,,0.6038379363557304,0.8858491828854966,none,0.9805244350622322,1.8672695955038208,,,,0.883898514640917,0.8459412427065206,0.8478705978705978,0.6038379363557304,0.6714691115476971,0.6712389380530973,0.8858491828854966,0.7556919908901454,0.7496037583947895,0.6856888096299599,0.6949152542372882,0.6578272027373824,0.6491228070175439,none,0.9016140105739268,0.9026829458316468,0.9805244350622322,COMPLETE
