number,value,datetime_start,datetime_complete,duration,params_alpha,params_booster,params_colsample_bytree,params_gamma,params_grow_policy,params_lambda,params_learning_rate,params_max_delta_step,params_max_depth,params_min_child_weight,params_n_estimators,params_normalize_type,params_params_decision_threshold,params_params_feature_fraction,params_params_resampling,params_params_sample_rows,params_params_scale_pos_weight,params_rate_drop,params_sample_type,params_skip_drop,params_subsample,user_attrs_acc_test,user_attrs_acc_val,user_attrs_decision_threshold,user_attrs_f1_test,user_attrs_f1_val,user_attrs_feature_fraction,user_attrs_pr_auc_test,user_attrs_pr_auc_val,user_attrs_prec_test,user_attrs_prec_val,user_attrs_rec_test,user_attrs_rec_val,user_attrs_resampling_strategy,user_attrs_roc_auc_test,user_attrs_roc_auc_val,user_attrs_sample_rows,state
2793,0.7021901106344547,2025-09-24 02:35:58.585224,2025-09-24 02:36:28.065397,0 days 00:00:29.480173,0.09127006938543214,dart,0.7057069354761089,0.7705871788160508,lossguide,0.00037199785625599113,0.04067071987891341,2,10,4.2889429711613465,600,forest,0.6915817898781477,0.9921269011363694,none,0.98550360164579,2.874357712474819,0.05689044968397895,weighted,0.5587137574834464,0.24584717755990526,0.8660047087726481,0.86496723996724,0.6915817898781477,0.7060408713227038,0.7021901106344547,0.9921269011363694,0.8174816750452909,0.8100665746437212,0.7432624113475177,0.7433078393881453,0.6723695466210436,0.6653829696191699,none,0.9231151573086597,0.9196157638435063,0.98550360164579,COMPLETE
2794,0.7198941332157036,2025-09-24 02:36:28.217083,2025-09-24 02:37:18.358183,0 days 00:00:50.141100,0.07303295418919081,dart,0.5292424176706856,0.15674445188500336,lossguide,0.00013506381964184896,0.026889665150493243,10,8,0.575128915221462,800,forest,0.48354706504012573,0.9556800518272962,none,0.8203519994526662,1.2577146523819869,0.08274308621688171,weighted,0.746624693973733,0.6101797036806497,0.8696898351929573,0.86998361998362,0.48354706504012573,0.7201582765442954,0.7198941332157036,0.9556800518272962,0.8279668944230733,0.8232179435986517,0.7408412483039348,0.7428311333636778,0.7005988023952096,0.6983311938382541,none,0.9271380533241149,0.9256069546862946,0.8203519994526662,COMPLETE
2795,0.38612143742255267,2025-09-24 02:37:18.509883,2025-09-24 02:37:43.420431,0 days 00:00:24.910548,0.000105579146902337,dart,0.6960305499760647,2.804168724741455,depthwise,0.011330899583756958,0.0011084369406119845,10,3,5.378922108938016,600,tree,0.4202330103966516,0.8576770247764863,oversample,0.6982382813591816,2.1050415588139892,0.017069353666253933,weighted,0.5773946293702126,0.48559745276568417,0.23932848807452145,0.23925061425061425,0.4202330103966516,0.3862228462872718,0.38612143742255267,0.8576770247764863,0.7178180243314718,0.7038003436799661,0.23932848807452145,0.23925061425061425,1.0,1.0,oversample,0.8870717242486019,0.8826698422520423,0.6982382813591816,COMPLETE
2796,0.5261996690568119,2025-09-24 02:37:43.577063,2025-09-24 02:37:44.872971,0 days 00:00:01.295908,10.705442960342268,gbtree,0.729914741010545,4.327534020749274,depthwise,2.4566134191267515,0.001409858897089919,9,12,0.19781896776145763,500,,0.6247834638555121,0.6068918957253988,oversample,0.686530922855923,0.9165927402601748,,,,0.5013592056385053,0.8314054662708568,0.8241195741195741,0.6247834638555121,0.553537544049878,0.5261996690568119,0.6068918957253988,0.7021478836193878,0.6951818964711624,0.7557364914877869,0.7401086113266098,0.43669803250641576,0.40821566110397944,oversample,0.8803380896088899,0.881639193545963,0.686530922855923,COMPLETE
2797,0.6490627546862265,2025-09-24 02:37:45.029359,2025-09-24 02:37:46.120838,0 days 00:00:01.091479,0.011102165483598386,gbtree,0.8541003367722788,5.352052216390034,depthwise,0.0008279622989222947,0.001992274425636394,1,7,8.225701126279716,600,,0.6093453149199511,0.5520664651120246,undersample,0.596819046497086,1.5012240894820663,,,,0.6788999032944145,0.7721363496775514,0.7795864045864046,0.6093453149199511,0.6449760765550239,0.6490627546862265,0.5520664651120246,0.7361612735869411,0.7290393961024323,0.5142421159715158,0.5242232754081095,0.864841745081266,0.8519469405220368,undersample,0.8907330963541513,0.8873743993160987,0.596819046497086,COMPLETE
2798,0.6983097148710944,2025-09-24 02:37:46.276629,2025-09-24 02:37:58.874706,0 days 00:00:12.598077,0.05299708298017165,dart,0.6793455108302153,0.23749288148784253,depthwise,0.02749881143744937,0.04147835150654076,2,9,9.174755101690387,400,forest,0.5108160546048289,0.973559571507419,none,0.9835481035183552,4.799997710435111,0.12277260123856179,weighted,0.7334430517491725,0.6189575768993253,0.8165625959668339,0.8191031941031941,0.5108160546048289,0.6967851099830795,0.6983097148710944,0.973559571507419,0.8245106262060535,0.8190048245869648,0.576427771556551,0.5809659090909091,0.8806672369546621,0.8750534873769791,none,0.926106607938745,0.924232218970512,0.9835481035183552,COMPLETE
2799,0.6886838271005342,2025-09-24 02:37:59.025645,2025-09-24 02:39:15.644106,0 days 00:01:16.618461,0.023028713183947006,dart,0.4237772097788543,2.0419786008546486,lossguide,0.010485769842768423,0.011597228289786458,10,9,1.7502463130849988,1000,tree,0.5574938181883512,0.9741136019689712,oversample,0.8851220034806042,2.465564418213078,0.08822013228673364,uniform,0.5950584666736224,0.40003976511143247,0.8000818916982291,0.8031326781326781,0.5574938181883512,0.6859623733719248,0.6886838271005342,0.9741136019689712,0.8251293663927917,0.8186323083316543,0.5496006183973203,0.55390625,0.9123182207014542,0.9101412066752247,oversample,0.9267622837259907,0.9252835687526499,0.8851220034806042,COMPLETE
2800,0.6165007112375533,2025-09-24 02:39:15.800641,2025-09-24 02:39:42.093477,0 days 00:00:26.292836,0.002515217815410303,dart,0.7985472869183873,2.5124467478211576,lossguide,0.018769003130604704,0.0025550468617113204,2,8,6.102626277771202,600,forest,0.5701297571300167,0.8969643817808695,undersample,0.9655755113602482,2.4590744338239348,0.13500142495233441,weighted,0.6340087920979579,0.20464994958989238,0.7153239840311189,0.723996723996724,0.5701297571300167,0.6070368800339127,0.6165007112375533,0.8969643817808695,0.7035627336229446,0.6933251043001505,0.45326018147288455,0.4617515448540379,0.9187339606501284,0.9272571673085152,undersample,0.880306835432313,0.8816801350343572,0.9655755113602482,COMPLETE
2801,0.6588597842835131,2025-09-24 02:39:42.248471,2025-09-24 02:40:06.661930,0 days 00:00:24.413459,0.009237431455880709,dart,0.7685101542501493,9.256426549550252,lossguide,0.016085366082657947,0.013330057370705268,5,3,0.9976652064737929,600,forest,0.48750365936340817,0.6982274911443542,undersample,0.6000059588705609,1.5564312137989353,0.07906390765499072,weighted,0.7775352185712465,0.7645861037384682,0.7647660968369332,0.7733415233415234,0.48750365936340817,0.6521344232515894,0.6588597842835131,0.6982274911443542,0.7989357986140032,0.7946764262173557,0.5046860356138707,0.5148085721165423,0.9213002566295979,0.9148480958493795,undersample,0.9147644787707014,0.9138492617316798,0.6000059588705609,COMPLETE
2802,0.7054545454545454,2025-09-24 02:40:06.816432,2025-09-24 02:40:41.786487,0 days 00:00:34.970055,0.0018272651411019982,dart,0.6172738073529188,6.330188211883685,depthwise,0.00011885393796061481,0.25109116171638957,1,9,2.5241210713224445,700,forest,0.5144043685305764,0.9910821738866117,none,0.9921695705867808,4.142669849642095,0.07259905040127787,weighted,0.6048467080039487,0.6419934111556356,0.8209642747466476,0.8258599508599509,0.5144043685305764,0.7001542945311161,0.7054545454545454,0.9910821738866117,0.8268471557793868,0.8201590495988572,0.5842632331902718,0.5924956369982548,0.8733960650128315,0.8716302952503209,none,0.9276080171394911,0.9250048672001498,0.9921695705867808,COMPLETE
2803,0.694562087074369,2025-09-24 02:40:41.936092,2025-09-24 02:41:47.755008,0 days 00:01:05.818916,0.0026173280752903967,dart,0.5910702207462933,2.2072594442322697,lossguide,0.6336054052198042,0.021270432174920435,1,5,1.116826365606167,1000,forest,0.6860270080357205,0.9794419633711171,undersample,0.7515562669288245,2.826769784533605,0.19368287184513772,weighted,0.6128655955403339,0.8530020151200075,0.8119561879414474,0.8154176904176904,0.6860270080357205,0.6924493554327809,0.694562087074369,0.9794419633711171,0.8189728501840756,0.8113307071920177,0.5689133425034388,0.5748738081884465,0.8845166809238666,0.8771929824561403,undersample,0.9247026737804165,0.9223903414479824,0.7515562669288245,COMPLETE
2804,0.5653985004165509,2025-09-24 02:41:47.909435,2025-09-24 02:42:01.198568,0 days 00:00:13.289133,0.2180187593563344,dart,0.6757659097278849,4.267143832882969,lossguide,1.7670118037646225,0.001375370900617029,0,9,22.8094554863276,400,forest,0.6788615410102457,0.9358660192602237,none,0.8622443810043016,4.084126900467877,0.006184667645718067,weighted,0.7264484259369152,0.3274480085161737,0.8428703040229297,0.8397829647829648,0.6788615410102457,0.5767852219465123,0.5653985004165509,0.9358660192602237,0.7674888329830638,0.7601471669343547,0.8114817688130334,0.805379746835443,0.4473909324208725,0.43560119811724435,none,0.9024157406393741,0.9006112259027526,0.8622443810043016,COMPLETE
2805,0.6790551181102362,2025-09-24 02:42:01.352045,2025-09-24 02:42:03.352908,0 days 00:00:02.000863,0.002165976527332356,gbtree,0.596444903856039,4.840321429809692,lossguide,0.3585831619817327,0.02062061819781872,2,10,0.8865604201638617,1000,,0.6708272751200115,0.9800976779702467,undersample,0.7661229785697256,4.0098339752138115,,,,0.9982114206683634,0.7893336063056607,0.7913595413595413,0.6708272751200115,0.676109537299339,0.6790551181102362,0.9800976779702467,0.8223440017849684,0.8140973721953225,0.5348605577689243,0.5372539247445801,0.9187339606501284,0.9225502781343603,undersample,0.9252834373930493,0.9231116544639725,0.7661229785697256,COMPLETE
2806,0.5127402771569066,2025-09-24 02:42:03.512566,2025-09-24 02:43:14.993585,0 days 00:01:11.481019,0.0006565332549490435,dart,0.8994048410319997,5.641482701675957,lossguide,34.94236956393679,0.050928783660410856,5,10,30.49991689524895,1000,forest,0.31495508454065824,0.5915401709579045,oversample,0.8814587606562011,4.37285356680323,0.12990985092234686,weighted,0.7143886301166826,0.563687593994039,0.5513358583273621,0.5536445536445537,0.31495508454065824,0.512186978297162,0.5127402771569066,0.5915401709579045,0.7109819917428621,0.7049731287710507,0.346171205054912,0.3469974285282106,0.9841745081266039,0.9816003423192127,oversample,0.87703098906288,0.8783214070374561,0.8814587606562011,COMPLETE
2807,0.4070107108081792,2025-09-24 02:43:15.155204,2025-09-24 02:43:16.010958,0 days 00:00:00.855754,1.0590080517086067,gbtree,0.8989833026810921,4.643376656596141,depthwise,0.0005208280371133013,0.08338597377817175,5,4,0.476007538583838,700,,0.6071969028858661,0.7558774481618951,none,0.6084668903588273,0.5366356307830634,,,,0.8587483362667796,0.8185075237997748,0.812960687960688,0.6071969028858661,0.43008678881388623,0.4070107108081792,0.7558774481618951,0.735464232166682,0.7307241673550673,0.8654592496765847,0.842741935483871,0.286142001710864,0.2682926829268293,none,0.8934023354179812,0.8951732346084909,0.6084668903588273,COMPLETE
2808,0.7057765790065184,2025-09-24 02:43:16.166525,2025-09-24 02:43:17.018063,0 days 00:00:00.851538,0.3228907242423262,gbtree,0.4294851711820433,8.239689047519306,lossguide,0.0005100869569477107,0.06360308948270359,9,10,4.030079257297982,500,,0.6112642848678221,0.8266602656939177,oversample,0.5434934368741727,0.6364072819989199,,,,0.7809001992770883,0.8699969290613164,0.865990990990991,0.6112642848678221,0.7177777777777777,0.7057765790065184,0.8266602656939177,0.8198120500283537,0.813630921645702,0.7469935245143385,0.7433712121212122,0.6907613344739093,0.6718014548566539,oversample,0.9237309739480609,0.921633586116793,0.5434934368741727,COMPLETE
2809,0.714960058097313,2025-09-24 02:43:17.170389,2025-09-24 02:43:36.165539,0 days 00:00:18.995150,0.00021311388407121155,dart,0.9749201998666236,7.7169050654759275,depthwise,0.0013898490404709884,0.04729841500688973,0,11,2.203264273666363,500,forest,0.609886709191999,0.9065525359717738,none,0.9902116261952442,4.745325405686183,0.059463889608521156,weighted,0.5491563252165411,0.5448339141966971,0.8355000511823114,0.8392710892710893,0.609886709191999,0.7101893597835888,0.714960058097313,0.9065525359717738,0.8251388033273688,0.8210606382332506,0.6139694418459619,0.6209397666351308,0.8421727972626176,0.842533162173727,none,0.9269027548455773,0.9258188024159739,0.9902116261952442,COMPLETE
2810,0.701748312272806,2025-09-24 02:43:36.319766,2025-09-24 02:43:55.889630,0 days 00:00:19.569864,0.0024905187961781726,dart,0.603115791342434,2.5939316543548827,depthwise,0.0005252438018314348,0.11605351642123218,1,9,3.229397088368114,500,forest,0.6753626783852533,0.9201835126282221,oversample,0.9525511047497791,4.375365904778451,0.10256028399041048,weighted,0.7707213666861595,0.4835449730673855,0.8214760978605794,0.8236076986076986,0.6753626783852533,0.7015742642026009,0.701748312272806,0.9201835126282221,0.8234624126311747,0.8172427872632457,0.5847119224187107,0.5892441860465116,0.8768177929854577,0.8673513050919983,oversample,0.9252421392867992,0.9231119135873167,0.9525511047497791,COMPLETE
2811,0.6623616236162362,2025-09-24 02:43:56.042306,2025-09-24 02:44:32.694732,0 days 00:00:36.652426,0.00018976151831752918,dart,0.8116660814051284,3.527752241980554,depthwise,0.00044102522955473655,0.008455489330747277,5,9,3.389359992894743,700,forest,0.673988822085826,0.928127692079369,undersample,0.9350305702420929,4.542352614453345,0.0027175797258509053,weighted,0.5426383654670729,0.7081121193128462,0.7643566383457877,0.7751842751842751,0.673988822085826,0.6504706954145156,0.6623616236162362,0.928127692079369,0.8096271232822683,0.801786762477323,0.5042372881355932,0.5169186465082793,0.9161676646706587,0.9216944801026957,undersample,0.9174423803641347,0.9168220111115544,0.9350305702420929,COMPLETE
2812,0.6987625021190033,2025-09-24 02:44:32.850573,2025-09-24 02:44:33.889540,0 days 00:00:01.038967,0.008336099688887242,gbtree,0.669181155872019,8.367841879868333,depthwise,0.0006506370070049999,0.05865345464516423,4,12,0.7245464993663617,500,,0.686312658264735,0.9881795904907309,oversample,0.9708483036613527,3.8352508173719317,,,,0.6781448411613265,0.8133892926604566,0.818079443079443,0.686312658264735,0.6935619431837283,0.6987625021190033,0.9881795904907309,0.8250739811734522,0.8193096038496328,0.5713098864580448,0.5786075238629983,0.8823781009409752,0.8818998716302953,oversample,0.9262672244760147,0.9246600316118965,0.9708483036613527,COMPLETE
2813,0.6704862186435429,2025-09-24 02:44:34.043995,2025-09-24 02:44:35.001710,0 days 00:00:00.957715,0.042499929437725945,gbtree,0.5708637600283124,3.2005664644156964,depthwise,0.0006085952151150262,0.04299212950862339,0,3,1.8964843451539732,700,,0.6342531175883904,0.8899254713643466,undersample,0.9644636217891318,3.5878946661897784,,,,0.7698855255502153,0.7787900501586652,0.7821457821457821,0.6342531175883904,0.6674873057393446,0.6704862186435429,0.8899254713643466,0.8207090961600498,0.8122247506850425,0.5212689257390051,0.5253579228342635,0.927715996578272,0.9264013692768507,undersample,0.9254040508866342,0.9235263669807298,0.9644636217891318,COMPLETE
2814,0.713413506012951,2025-09-24 02:44:35.158236,2025-09-24 02:44:53.214954,0 days 00:00:18.056718,0.5803410372913965,dart,0.6183210150786944,3.6457398859631827,lossguide,0.0003731874288983,0.23494611717161645,4,8,12.237553282151985,500,tree,0.5803736484054568,0.9275022291181579,none,0.9766665614652202,4.0646697043126885,0.21771693654464652,weighted,0.643808627997368,0.7424718756556811,0.8363189681646023,0.8414209664209664,0.5803736484054568,0.7057957681692733,0.713413506012951,0.9275022291181579,0.8174244466422836,0.8123693221518815,0.6193090087181143,0.6284224250325945,0.8203592814371258,0.8249893025246042,none,0.9226585470272904,0.9218756649033034,0.9766665614652202,COMPLETE
2815,0.672566371681416,2025-09-24 02:44:53.367494,2025-09-24 02:44:54.010318,0 days 00:00:00.642824,0.012254577378467591,gbtree,0.37910989763899805,7.635302971040944,depthwise,0.6764083573026135,0.4086462489152743,0,5,12.98031511841697,200,,0.4791128243571154,0.7063042447884943,undersample,0.9916140575122617,1.3317936574058216,,,,0.8922023739513776,0.7875934077182926,0.7916666666666666,0.4791128243571154,0.6711047709621176,0.672566371681416,0.7063042447884943,0.8042884873153268,0.7974811207756777,0.5331150843616218,0.5389375966993295,0.9054747647562019,0.8943089430894309,undersample,0.9183287499630187,0.9169275606871191,0.9916140575122617,COMPLETE
2816,0.6982859826250294,2025-09-24 02:44:54.164875,2025-09-24 02:44:55.861752,0 days 00:00:01.696877,0.00021270407903869424,gbtree,0.2993544075127966,1.6299085847002701,lossguide,0.00012792654197097458,0.08031636222092343,1,10,0.6171040378508702,300,,0.6847021135794711,0.9946107106215023,none,0.8587501755152865,2.3572221614999456,,,,0.7114114772684323,0.8670283550005118,0.8684479934479934,0.6847021135794711,0.696140350877193,0.6982859826250294,0.9946107106215023,0.8161660409748271,0.8123808022917504,0.7681982447083118,0.7736732570239334,0.6364414029084687,0.636285836542576,none,0.9201376357959437,0.9202899452023225,0.8587501755152865,COMPLETE
2817,0.6511865271752998,2025-09-24 02:44:56.016784,2025-09-24 02:45:39.384998,0 days 00:00:43.368214,0.13721532978015796,dart,0.9547253375820263,9.260919476618845,depthwise,0.005773008205234283,0.21742740198252075,0,11,4.403208720109632,800,forest,0.6953946506463194,0.9222629299774951,none,0.9780433808157049,1.9004199555958248,0.13960538360201033,weighted,0.558585018886455,0.4339416730550025,0.8633432285802027,0.860053235053235,0.6953946506463194,0.6621108580106302,0.6511865271752998,0.9222629299774951,0.8066986063343895,0.7991776980151479,0.8109113453192809,0.8065739570164349,0.5594525235243798,0.5459991442019684,none,0.9155413724140622,0.9136898145005078,0.9780433808157049,COMPLETE
2818,0.38612143742255267,2025-09-24 02:45:39.537582,2025-09-24 02:45:42.762513,0 days 00:00:03.224931,2.871971517232061,dart,0.5759385696529564,3.582751671373821,lossguide,0.0001950362770117834,0.000481619350675797,8,5,60.97075906359794,200,forest,0.3983925503210156,0.7164020740809155,undersample,0.5960376095848301,1.8345741476333297,0.28070078938806214,weighted,0.5894073977788404,0.42650410551141216,0.23932848807452145,0.23925061425061425,0.3983925503210156,0.3862228462872718,0.38612143742255267,0.7164020740809155,0.6881645238285514,0.6810198994284917,0.23932848807452145,0.23925061425061425,1.0,1.0,undersample,0.8693036097480338,0.8670696668082633,0.5960376095848301,COMPLETE
2819,0.6049435633661951,2025-09-24 02:45:42.915396,2025-09-24 02:45:46.366049,0 days 00:00:03.450653,0.000652988060932649,dart,0.7896230991187989,8.416060090683203,lossguide,0.0031327414902251006,0.005891192476537592,7,5,21.988451873202393,200,tree,0.6470793295431525,0.6668352651922588,oversample,0.9059965169545661,2.198244257096047,0.17065928539401787,uniform,0.6004626516929563,0.7692734917842516,0.7187020165830689,0.7169328419328419,0.6470793295431525,0.6120835686053078,0.6049435633661951,0.6668352651922588,0.7295379387006722,0.720545209501405,0.45680573114201434,0.4540969540969541,0.9272882805816938,0.905862216516902,oversample,0.8880181271921811,0.8796530706951249,0.9059965169545661,COMPLETE
2820,0.7106254709871892,2025-09-24 02:45:46.519072,2025-09-24 02:46:23.099075,0 days 00:00:36.580003,0.30294268684681896,dart,0.3559737930562855,2.043438779812711,lossguide,0.0033204578288684263,0.016234723991478465,7,8,3.3364565055593904,700,forest,0.5024967015473066,0.9804996641094196,none,0.8004167988540621,2.533006746461583,0.15898870105196083,weighted,0.6705036047767402,0.311585244143759,0.8444057733647251,0.8427518427518428,0.5024967015473066,0.7169459962756052,0.7106254709871892,0.9804996641094196,0.822138664613602,0.8160982500236608,0.6348944591029023,0.6348030966004712,0.8233532934131736,0.8070175438596491,none,0.9253336570414162,0.9233353930760053,0.8004167988540621,COMPLETE
2821,0.718791312559018,2025-09-24 02:46:23.249441,2025-09-24 02:47:11.472448,0 days 00:00:48.223007,0.0004145012835074921,dart,0.5628933949133343,2.0855303382963153,depthwise,0.0028511267775330374,0.03965581665408132,8,11,0.21949355059095704,800,forest,0.3784003920088622,0.8928020986196893,none,0.8736815103775168,1.6111120964076466,0.06767074179070698,weighted,0.6918543570373245,0.37085192849588955,0.8438939502507933,0.8475634725634725,0.3784003920088622,0.7137225455228083,0.718791312559018,0.8928020986196893,0.8196704011496732,0.8172183287848538,0.6359986617597859,0.6433400946585531,0.8130881094952951,0.8142918271287976,none,0.9237896546718547,0.9231475574428949,0.8736815103775168,COMPLETE
2822,0.629321292507408,2025-09-24 02:47:11.627685,2025-09-24 02:47:12.623509,0 days 00:00:00.995824,0.001186078384990099,gbtree,0.4102045847181731,0.2909857565666618,lossguide,0.10906206806634462,0.01673535512319585,0,3,7.089668703801994,600,,0.5840994642253744,0.9960700244205392,oversample,0.7908669714777989,4.508822091581846,,,,0.7892710306222603,0.727710103388269,0.7310606060606061,0.5840994642253744,0.6267190569744597,0.629321292507408,0.9960700244205392,0.809731908069866,0.8025588489091788,0.46637426900584794,0.4694736842105263,0.9550898203592815,0.9542148053059478,oversample,0.920343752198009,0.9188311383570671,0.7908669714777989,COMPLETE
