number,value,datetime_start,datetime_complete,duration,params_alpha,params_booster,params_colsample_bytree,params_gamma,params_grow_policy,params_lambda,params_learning_rate,params_max_delta_step,params_max_depth,params_min_child_weight,params_n_estimators,params_normalize_type,params_params_decision_threshold,params_params_feature_fraction,params_params_resampling,params_params_sample_rows,params_params_scale_pos_weight,params_rate_drop,params_sample_type,params_skip_drop,params_subsample,user_attrs_acc_test,user_attrs_acc_val,user_attrs_decision_threshold,user_attrs_f1_test,user_attrs_f1_val,user_attrs_feature_fraction,user_attrs_pr_auc_test,user_attrs_pr_auc_val,user_attrs_prec_test,user_attrs_prec_val,user_attrs_rec_test,user_attrs_rec_val,user_attrs_resampling_strategy,user_attrs_roc_auc_test,user_attrs_roc_auc_val,user_attrs_sample_rows,state
2453,0.6905273204485803,2025-09-24 01:06:48.120720,2025-09-24 01:08:03.102158,0 days 00:01:14.981438,0.003403190739997678,dart,0.4992231543600437,0.257444725497174,lossguide,0.005302213467267475,0.018426792242646543,9,9,3.421334875624471,1000,forest,0.5332889409513237,0.9076993408578672,none,0.839740954777032,1.075122875113918,0.08551845126567376,weighted,0.6051058497739051,0.40216292470238857,0.8706111167980346,0.8672194922194922,0.5332889409513237,0.7013232514177694,0.6905273204485803,0.9076993408578672,0.8249182524111378,0.8165156450599038,0.7835269271383316,0.7804746494066882,0.6347305389221557,0.6191698759092854,none,0.9257351552158386,0.9231754563896275,0.839740954777032,COMPLETE
2454,0.6977702829304853,2025-09-24 01:08:03.252852,2025-09-24 01:08:39.230920,0 days 00:00:35.978068,0.023649836323774515,dart,0.9577977275351521,9.097223794552525,depthwise,0.0017077299558012362,0.004803036586997875,1,12,10.554167382796132,700,forest,0.6710739704064257,0.9752040197358893,none,0.8052171351417614,4.861270178489153,0.18175919471927862,weighted,0.7231068596871393,0.39595103378421853,0.8359095096734569,0.8348689598689598,0.6710739704064257,0.702873030583874,0.6977702829304853,0.9752040197358893,0.8112300964744619,0.8025744071518601,0.620215897939156,0.6206666666666667,0.8109495295124037,0.7967479674796748,none,0.9199253030935648,0.916661642552936,0.8052171351417614,COMPLETE
2455,0.7231422505307855,2025-09-24 01:08:39.385435,2025-09-24 01:08:59.142177,0 days 00:00:19.756742,0.0025989064519380445,dart,0.6855656482491783,1.706975527965506,depthwise,0.008280938652879882,0.02315912824449567,0,10,11.291336695509923,500,forest,0.6771920234768259,0.9527991294123968,none,0.9416129614031087,3.281551405323039,0.06330468424829919,weighted,0.6986913838722378,0.9341322906397729,0.8635479578257754,0.8665028665028665,0.6771920234768259,0.7172852598091198,0.7231422505307855,0.9527991294123968,0.8232069570203766,0.8184023477964265,0.7114009255363904,0.7176569742941424,0.723267750213858,0.7287120239623449,none,0.9256688480124933,0.9242239270234958,0.9416129614031087,COMPLETE
2456,0.6425765907305577,2025-09-24 01:08:59.287706,2025-09-24 01:10:05.698248,0 days 00:01:06.410542,7.270501484891785,dart,0.3164617567460765,4.026707789023664,lossguide,2.2690883175144454,0.12720122914954754,1,4,6.566312845476412,1000,forest,0.4235408376263567,0.6376792822500272,none,0.8157101288581914,2.980783536275881,0.16021815900981967,weighted,0.7754342635478677,0.5261661613147735,0.7656873784420104,0.7670966420966421,0.4235408376263567,0.6450612498061715,0.6425765907305577,0.6376792822500272,0.7671485135591549,0.7579878942591088,0.5059596205302846,0.5076961271102284,0.8896492728828058,0.8750534873769791,none,0.8998918363745432,0.8949261748954739,0.8157101288581914,COMPLETE
2457,0.6545128511655708,2025-09-24 01:10:05.848364,2025-09-24 01:10:07.448948,0 days 00:00:01.600584,0.0004450660865490224,gbtree,0.5735127807918965,4.460245493628246,lossguide,0.0010265213512341733,0.011664229154915978,1,6,1.5066850304812758,500,,0.6600841037510988,0.9988949068995906,undersample,0.9314571000671007,4.777072385266078,,,,0.9637716786738422,0.7611833350394104,0.7633087633087633,0.6600841037510988,0.6531886427828155,0.6545128511655708,0.9988949068995906,0.8136985764767724,0.8079050457905126,0.5005696058327638,0.5028702640642939,0.9396920444824637,0.9370988446726572,undersample,0.92189051736771,0.9200694600278343,0.9314571000671007,COMPLETE
2458,0.6635778635778635,2025-09-24 01:10:07.597147,2025-09-24 01:11:01.343745,0 days 00:00:53.746598,0.00042102139688524856,dart,0.9004715221760057,9.699959635658978,depthwise,0.011905189460423465,0.01508525825914623,1,11,6.571394244371543,900,tree,0.6608746968887503,0.9920548582821713,none,0.9224371569895651,1.3813129874183478,0.16888773376705327,uniform,0.33160224921577774,0.8283646485547607,0.8673354488688709,0.8661957411957412,0.6608746968887503,0.6688809402146142,0.6635778635778635,0.9920548582821713,0.8220239098292699,0.8144207517410929,0.8305837563451777,0.832687338501292,0.5598802395209581,0.5515618314077878,none,0.9249016529487883,0.9226521711916225,0.9224371569895651,COMPLETE
2459,0.6448392306562913,2025-09-24 01:11:01.493871,2025-09-24 01:11:04.958302,0 days 00:00:03.464431,0.0001244387938824353,dart,0.3690219121806281,5.317527849421515,depthwise,0.0008918391425631587,0.016693164561064004,2,7,1.6247315045042483,200,forest,0.6041634658371258,0.8947532534466196,undersample,0.8646319971808856,3.275192418956976,0.15855125634626738,weighted,0.6704870305760363,0.8950919350703592,0.7469546524721057,0.7523546273546273,0.6041634658371258,0.6400698893418754,0.6448392306562913,0.8947532534466196,0.7868220712128327,0.780248496811488,0.48520971302428256,0.4908359409924005,0.9401197604790419,0.9396662387676509,undersample,0.9136871593913506,0.9127445613321058,0.8646319971808856,COMPLETE
2460,0.7112542629784009,2025-09-24 01:11:05.104359,2025-09-24 01:11:05.818853,0 days 00:00:00.714494,0.00021780081024203032,gbtree,0.9285161599504625,3.599761056401622,depthwise,0.010173477859512897,0.30582743128565,6,3,0.25693942825247895,400,,0.34439716420249944,0.9896298301948121,none,0.9618169050957802,1.2576199000255694,,,,0.7962479567589027,0.8466577950660252,0.8439803439803439,0.34439716420249944,0.7187382651145325,0.7112542629784009,0.9896298301948121,0.8260579235741246,0.820148117360158,0.6405622489959839,0.6382182930975858,0.8186484174508126,0.8031664527171587,none,0.9268753858566965,0.9248535103756154,0.9618169050957802,COMPLETE
2461,0.38612143742255267,2025-09-24 01:11:05.970122,2025-09-24 01:11:22.077727,0 days 00:00:16.107605,0.10432069701679014,dart,0.5160700592147228,0.5090516891912955,lossguide,0.00018355173491473484,0.0006900044894797083,6,12,0.10937944662698805,400,tree,0.5124114045646558,0.5155271890350093,oversample,0.7264493929651088,3.2176741329807457,0.19332912091075533,uniform,0.7234849859614785,0.6956157619729569,0.23932848807452145,0.23925061425061425,0.5124114045646558,0.3862228462872718,0.38612143742255267,0.5155271890350093,0.6102961053486293,0.6055461952029918,0.23932848807452145,0.23925061425061425,1.0,1.0,oversample,0.8146785326630319,0.8153071299745995,0.7264493929651088,COMPLETE
2462,0.7199488491048593,2025-09-24 01:11:22.226065,2025-09-24 01:12:08.401074,0 days 00:00:46.175009,0.0021270031005984993,dart,0.9256334315141923,6.062792041152585,depthwise,0.00018712307291964762,0.03249276256698914,0,9,3.5225652518589916,800,forest,0.6672624269735904,0.9887602505321116,none,0.9154523645806091,3.0290562944741337,0.09437415951042484,weighted,0.8105544255819499,0.28924906533730765,0.8652881564131436,0.8654791154791155,0.6672624269735904,0.7221283783783784,0.7199488491048593,0.9887602505321116,0.8225789721520023,0.8156241844582013,0.713094245204337,0.7171974522292993,0.7313943541488451,0.7227214377406932,none,0.9253151232571479,0.9231005985346171,0.9154523645806091,COMPLETE
2463,0.6897363465160076,2025-09-24 01:12:08.549879,2025-09-24 01:12:29.362050,0 days 00:00:20.812171,0.0006571317955202018,dart,0.25915987827735415,1.9033365779850224,lossguide,0.00011141178605199085,0.010518694787965955,3,12,11.99880507433401,500,forest,0.6899170492903243,0.9061703110361661,none,0.8753109283319077,2.953974910217683,0.08535443821163788,weighted,0.6076526777423151,0.673987942583544,0.8651857917903573,0.8650696150696151,0.6899170492903243,0.6922178078990419,0.6897363465160076,0.9061703110361661,0.8074033956570151,0.7991872378233817,0.7630087583719732,0.7666143380429095,0.6334473909324209,0.6268720581942662,none,0.9192991547328089,0.9181075796054265,0.8753109283319077,COMPLETE
2464,0.6987495263357333,2025-09-24 01:12:29.511885,2025-09-24 01:12:40.562056,0 days 00:00:11.050171,0.00031771390084792144,dart,0.5429570668861327,4.5383963962284035,depthwise,0.0007071508286970415,0.42071553555922786,4,12,12.178195550701423,400,tree,0.5529463315664405,0.9421715603845318,none,0.8310115945453516,3.1504854605631074,0.288828283620146,uniform,0.5463152421912169,0.614900893622854,0.8370355205241069,0.8372235872235873,0.5529463315664405,0.7027632561613144,0.6987495263357333,0.9421715603845318,0.7894188548442627,0.7815835412289469,0.6235917826375083,0.6269976198571914,0.804961505560308,0.789045785194694,none,0.9134776470474474,0.9098892524101494,0.8310115945453516,COMPLETE
2465,0.6206308610400681,2025-09-24 01:12:40.708960,2025-09-24 01:12:58.473008,0 days 00:00:17.764048,0.0001332584911252189,dart,0.4689870078826737,0.07794574917557268,lossguide,0.0007057342680181183,0.11770054493786758,1,7,0.8514060170330503,500,forest,0.643932555349357,0.7840696947307092,undersample,0.9722122474308997,4.232974207618802,0.25091305191122903,weighted,0.5199056777897425,0.30406058010514814,0.7184972873374962,0.7266584766584766,0.643932555349357,0.6132208157524613,0.6206308610400681,0.7840696947307092,0.7787430873375842,0.774070670379094,0.45683151718357085,0.4645820038289726,0.932420872540633,0.9345314505776636,undersample,0.9028091806467231,0.9009182006912606,0.9722122474308997,COMPLETE
2466,0.38612143742255267,2025-09-24 01:12:58.621252,2025-09-24 01:12:59.758325,0 days 00:00:01.137073,0.0011730693043148933,gbtree,0.43212124790525175,9.733638190644685,lossguide,13.758382550679576,0.0006096785624674193,7,12,21.260810606514738,400,,0.38267700917701775,0.7146374885622448,undersample,0.8576542960601433,2.7033157370674563,,,,0.4527399487984439,0.23932848807452145,0.23925061425061425,0.38267700917701775,0.3862228462872718,0.38612143742255267,0.7146374885622448,0.7285697850350157,0.7215372823176917,0.23932848807452145,0.23925061425061425,1.0,1.0,undersample,0.8919527574990166,0.8908458459677557,0.8576542960601433,COMPLETE
2467,0.4914712153518124,2025-09-24 01:12:59.909333,2025-09-24 01:13:06.485661,0 days 00:00:06.576328,0.0018491731225943782,dart,0.22024580947086114,5.572439675151854,depthwise,1.287937283570851,0.005380972576049107,3,5,0.18306742376984822,300,forest,0.33421578229117177,0.5256140911321765,undersample,0.6626033737428905,0.9118992725556105,0.2840724538146582,weighted,0.7956085501046863,0.7962437371076108,0.5049646842051387,0.5116707616707616,0.33421578229117177,0.48782037703876296,0.4914712153518124,0.5256140911321765,0.665022360703152,0.6631900634190052,0.32418355855855857,0.32727530881726535,0.9850299401197605,0.9863072314933675,undersample,0.8637268688875206,0.8650871428927621,0.6626033737428905,COMPLETE
2468,0.7093651089182648,2025-09-24 01:13:06.632978,2025-09-24 01:13:09.054084,0 days 00:00:02.421106,0.00011125681595996738,gbtree,0.72642687932126,3.3256815555159025,lossguide,4.143378941305057,0.0098119724622594,6,7,0.27263539816985943,500,,0.6660667484843024,0.9979893851995434,none,0.9036300145734099,4.671441156870469,,,,0.9059995212396511,0.8414371993039206,0.8401924651924652,0.6660667484843024,0.7128822984244672,0.7093651089182648,0.9979893851995434,0.8221730220695087,0.8135855744832682,0.6290480863591756,0.6278839815425181,0.8224978614200171,0.8151476251604621,none,0.9250038477747775,0.9224472910007556,0.9036300145734099,COMPLETE
2469,0.7213813685781283,2025-09-24 01:13:09.204009,2025-09-24 01:13:13.166429,0 days 00:00:03.962420,0.00033379553466217923,gbtree,0.25064660138494965,3.4069878770120057,lossguide,0.0006576686502181535,0.010286353986111338,2,9,0.3086827936414695,900,,0.6630269386889376,0.9805077046880494,none,0.9741918142872026,3.0798785905677093,,,,0.5153469408013436,0.8671307196232982,0.8661957411957412,0.6630269386889376,0.7253491324587389,0.7213813685781283,0.9805077046880494,0.8266181136136896,0.8182917839096115,0.7177554438860971,0.7187765505522515,0.7331052181351583,0.72400513478819,none,0.9274997499090291,0.9256774074444525,0.9741918142872026,COMPLETE
2470,0.706786171574904,2025-09-24 01:13:13.314138,2025-09-24 01:13:15.422557,0 days 00:00:02.108419,0.00025878592204029767,gbtree,0.30122838709255756,8.57341063681426,lossguide,0.012882405675106724,0.00829798248896723,1,8,0.39919536884811024,700,,0.6818410278336545,0.9977358482346002,none,0.7606399748584383,3.46153744163283,,,,0.8133133963237442,0.8622172177295526,0.8593366093366094,0.6818410278336545,0.7122702009405729,0.706786171574904,0.9977358482346002,0.8094186769115213,0.8025029565589937,0.711965811965812,0.7049808429118773,0.7125748502994012,0.7086007702182285,none,0.9212241932882604,0.919483639729413,0.7606399748584383,COMPLETE
2471,0.6963420008814456,2025-09-24 01:13:15.571418,2025-09-24 01:14:00.414061,0 days 00:00:44.842643,0.012319634856891064,dart,0.5105840490272224,1.1451414719564867,depthwise,0.0002527925794547254,0.05948795740799163,6,8,3.7565638433719983,800,forest,0.48994660526052086,0.8769906680513887,none,0.8745775982328818,1.2332542003186748,0.17395098700012412,weighted,0.6410300631918265,0.5524084766687134,0.8605793837649708,0.8589271089271089,0.48994660526052086,0.7026200873362446,0.6963420008814456,0.8769906680513887,0.8051086865136334,0.7945927824937755,0.7176628010704728,0.7178555202180827,0.6881950384944396,0.6760804450149764,none,0.9197762557818787,0.9157469947306405,0.8745775982328818,COMPLETE
2472,0.6494170260341798,2025-09-24 01:14:00.562477,2025-09-24 01:14:48.643661,0 days 00:00:48.081184,0.000431912123222513,dart,0.31738305061857464,1.6894592815963294,lossguide,0.0013219981052860626,0.1384350366805421,8,7,0.13849909603269042,800,forest,0.432950316957512,0.8840156271298977,oversample,0.9666811335319125,1.8768073293442746,0.05111406584361798,weighted,0.7654206570688991,0.28204033339810625,0.7690654109939605,0.7752866502866503,0.432950316957512,0.6443883984867591,0.6494170260341798,0.8840156271298977,0.7283899537743195,0.7283373831180096,0.510234648027958,0.5180937818552498,0.874251497005988,0.8699186991869918,oversample,0.8915845856012756,0.8920469114599142,0.9666811335319125,COMPLETE
2473,0.0,2025-09-24 01:14:48.791715,2025-09-24 01:14:49.893984,0 days 00:00:01.102269,0.009309304334753578,gbtree,0.22626552468338085,3.005246954099405,lossguide,0.013464835779817035,0.0008625387569174143,4,6,89.14135070848121,700,,0.5851798780319108,0.739270013341767,oversample,0.6665703557655179,0.5072139765507349,,,,0.24037867514202937,0.7606715119254785,0.7607493857493858,0.5851798780319108,0.0,0.0,0.739270013341767,0.7195110975321073,0.7150137936730445,0.0,0.0,0.0,0.0,oversample,0.8855221962787615,0.8841369122528316,0.6665703557655179,COMPLETE
2474,0.5796875,2025-09-24 01:14:50.040742,2025-09-24 01:14:50.701995,0 days 00:00:00.661253,2.3563204515299887,gbtree,0.8299110295789691,7.633683991007716,depthwise,0.4971231148002711,0.20093035063593495,3,3,94.6232301488999,400,,0.32999600281678887,0.6591420822450249,undersample,0.7855708788884552,1.4959351414823383,,,,0.5008553284331355,0.6646534957518682,0.6695331695331695,0.32999600281678887,0.5770720371804803,0.5796875,0.6591420822450249,0.7276564508588965,0.7298706668618925,0.41327662721893493,0.4166198764738911,0.955945252352438,0.9525032092426188,undersample,0.8860467253968907,0.8875772641031767,0.7855708788884552,COMPLETE
2475,0.38612143742255267,2025-09-24 01:14:50.847916,2025-09-24 01:14:51.982111,0 days 00:00:01.134195,4.256467318519493,gbtree,0.24392072787664243,2.6315707985646624,lossguide,4.726059464933851,0.00014182406319682378,1,12,9.776286593817854,300,,0.5855954995919288,0.8145719856782511,undersample,0.9404838926025303,1.5806542359176468,,,,0.787808150329913,0.23932848807452145,0.23925061425061425,0.5855954995919288,0.3862228462872718,0.38612143742255267,0.8145719856782511,0.7238437134471697,0.7193825309383849,0.23932848807452145,0.23925061425061425,1.0,1.0,undersample,0.8888162886407817,0.889564797736667,0.9404838926025303,COMPLETE
2476,0.0,2025-09-24 01:14:52.127380,2025-09-24 01:14:55.618733,0 days 00:00:03.491353,0.08664238997604982,dart,0.8356768766519773,1.8136339726282804,lossguide,14.529664614530065,0.0015432965882320876,9,11,5.477852541700603,200,forest,0.5856323123292092,0.8339185427734576,undersample,0.8419938968062568,0.5699376276361494,0.16569601543618434,weighted,0.7761196144330308,0.24686575087734047,0.7606715119254785,0.7607493857493858,0.5856323123292092,0.0,0.0,0.8339185427734576,0.6610980782575925,0.6532109512487144,0.0,0.0,0.0,0.0,undersample,0.8643608164028366,0.8659397450698474,0.8419938968062568,COMPLETE
2477,0.658290219265829,2025-09-24 01:14:55.763876,2025-09-24 01:14:56.822162,0 days 00:00:01.058286,0.13385848337134718,gbtree,0.7995875194030307,7.952067398501611,lossguide,0.0003383770807102666,0.04729638847128435,6,12,8.485458900635923,900,,0.6908143373590023,0.7258533765157936,oversample,0.8722463531134933,0.7015494863859288,,,,0.33851367280349404,0.8605793837649708,0.858005733005733,0.6908143373590023,0.6671554252199413,0.658290219265829,0.7258533765157936,0.7956912076465068,0.7863312989841728,0.7782212086659065,0.775842044134727,0.5838323353293413,0.5716730851519042,oversample,0.9109439866446241,0.9089213979278309,0.8722463531134933,COMPLETE
2478,0.7226505521983747,2025-09-24 01:14:56.969808,2025-09-24 01:14:57.957971,0 days 00:00:00.988163,0.07593853026204496,gbtree,0.29532022037311856,2.9659307438115348,lossguide,0.00035522469920434027,0.20629045365346757,1,11,0.15822317364045713,300,,0.6927772715958248,0.9813207352523441,none,0.7380326613757435,4.063192115390603,,,,0.8877585394666101,0.8611935715016891,0.8637387387387387,0.6927772715958248,0.7208727871552079,0.7226505521983747,0.9813207352523441,0.8236616774852807,0.8178994017691075,0.6948412698412698,0.7043054427294883,0.7489307100085543,0.7419768934531451,none,0.9261301780774343,0.9247837198215596,0.7380326613757435,COMPLETE
2479,0.0,2025-09-24 01:14:58.107974,2025-09-24 01:15:26.069727,0 days 00:00:27.961753,1.734137726165544,dart,0.23118647089215522,2.0821443636890056,lossguide,25.254274480981934,0.0005460374547025174,10,12,0.19361976650380247,600,forest,0.5875173785239962,0.9931112842383218,none,0.8310532402917911,2.958716215712299,0.22242571990243448,weighted,0.7780339979172384,0.8957455322715788,0.7606715119254785,0.7607493857493858,0.5875173785239962,0.0,0.0,0.9931112842383218,0.7535887001848929,0.7466369061236995,0.0,0.0,0.0,0.0,none,0.9004328559560042,0.899534366866946,0.8310532402917911,COMPLETE
2480,0.5985643290999448,2025-09-24 01:15:26.221870,2025-09-24 01:16:19.954001,0 days 00:00:53.732131,0.001289077310190335,dart,0.798994100930034,0.383636912587467,lossguide,27.59717386449133,0.0012788420734795955,0,11,0.23977806606816032,800,forest,0.3298477481862841,0.6018704335368232,oversample,0.9280519023419379,0.7980055206892638,0.12652346617325064,weighted,0.6604009542220448,0.5379994576511353,0.6942368717371277,0.7022932022932022,0.3298477481862841,0.59188413717721,0.5985643290999448,0.6018704335368232,0.6813858629115326,0.67497294881768,0.43485243926922307,0.44181781128999387,0.9264328485885372,0.9276850663243474,oversample,0.8770480838887424,0.8789942351965856,0.9280519023419379,COMPLETE
2481,0.7140842232520653,2025-09-24 01:16:20.102465,2025-09-24 01:16:47.478726,0 days 00:00:27.376261,0.00039748572949059634,dart,0.2725636805750505,2.030377992683041,depthwise,0.0024516241934316218,0.1684986817277913,2,12,1.3014056600921073,600,forest,0.6555152620695355,0.9602153416466725,none,0.9110199683429749,4.739103302613735,0.09961120443791534,weighted,0.8764116689806902,0.6090448289397682,0.8501381922407616,0.8547297297297297,0.6555152620695355,0.7055510860820595,0.7140842232520653,0.9602153416466725,0.8155661540985919,0.8124254764443486,0.665907365223994,0.6747905559786748,0.7502138579982891,0.7582370560547711,none,0.9209432798282552,0.9209452681399728,0.9110199683429749,COMPLETE
2482,0.7160048134777377,2025-09-24 01:16:47.626998,2025-09-24 01:16:48.426536,0 days 00:00:00.799538,0.1980806351886954,gbtree,0.9307030041920062,1.2440213584294078,depthwise,0.00028971244248664777,0.30019127280312363,10,5,0.251939500328705,300,,0.3922027548462814,0.9610293965253931,none,0.9604252341491487,1.2963770670422707,,,,0.7937586397550205,0.8467601596888116,0.855036855036855,0.3922027548462814,0.7033881513770557,0.7160048134777377,0.9610293965253931,0.8081710765293713,0.8086509567542013,0.6552233296419343,0.6738391845979615,0.7591958939264328,0.7637997432605905,none,0.9186589621380113,0.9175971929916694,0.9604252341491487,COMPLETE
2483,0.0,2025-09-24 01:16:48.575193,2025-09-24 01:16:55.837440,0 days 00:00:07.262247,0.004783866110463815,dart,0.6093613225807418,8.13924774561757,depthwise,0.0003423029992735037,0.0018080079389526053,3,11,0.6335461459950549,300,forest,0.6617660705395604,0.9991205865912348,none,0.9747457188955292,1.9873575203249216,0.13273927864674898,weighted,0.5191618083738198,0.47544928420661386,0.7606715119254785,0.7607493857493858,0.6617660705395604,0.0,0.0,0.9991205865912348,0.7978058398060736,0.7876617876785184,0.0,0.0,0.0,0.0,none,0.9152863026470274,0.9125124731900911,0.9747457188955292,COMPLETE
