number,value,datetime_start,datetime_complete,duration,params_alpha,params_booster,params_colsample_bytree,params_gamma,params_grow_policy,params_lambda,params_learning_rate,params_max_delta_step,params_max_depth,params_min_child_weight,params_n_estimators,params_normalize_type,params_params_decision_threshold,params_params_feature_fraction,params_params_resampling,params_params_sample_rows,params_params_scale_pos_weight,params_rate_drop,params_sample_type,params_skip_drop,params_subsample,user_attrs_acc_test,user_attrs_acc_val,user_attrs_decision_threshold,user_attrs_f1_test,user_attrs_f1_val,user_attrs_feature_fraction,user_attrs_pr_auc_test,user_attrs_pr_auc_val,user_attrs_prec_test,user_attrs_prec_val,user_attrs_rec_test,user_attrs_rec_val,user_attrs_resampling_strategy,user_attrs_roc_auc_test,user_attrs_roc_auc_val,user_attrs_sample_rows,state
788,0.0,2025-09-23 14:49:35.285128,2025-09-23 14:49:46.238865,0 days 00:00:10.953737,0.06767317815901013,dart,0.4478714815545859,8.795633146572058,depthwise,0.05570434887891706,0.0004641852425640716,10,4,5.606343533128292,400,tree,0.6503124984687801,0.8463559839155795,none,0.7063284340494013,2.1090797305092055,0.1612174715075127,weighted,0.651791123175054,0.4230450995789314,0.7606715119254785,0.7607493857493858,0.6503124984687801,0.0,0.0,0.8463559839155795,0.7554761661234217,0.749529571522835,0.0,0.0,0.0,0.0,none,0.8992270663701722,0.8971193085068985,0.7063284340494013,COMPLETE
789,0.6893222629851322,2025-09-23 14:49:46.365220,2025-09-23 14:49:47.270485,0 days 00:00:00.905265,0.03272285024165761,gbtree,0.9235987411061564,2.624076629568469,lossguide,24.556056912248916,0.018911776765895692,4,5,98.08082851968314,900,,0.6371425179654633,0.9840056026092822,undersample,0.933330012782431,1.142066720216309,,,,0.809086844718941,0.8332480294810114,0.8352784602784603,0.6371425179654633,0.6913018760659465,0.6893222629851322,0.9840056026092822,0.7802600304178854,0.7803369358331527,0.6206192582511059,0.6280788177339901,0.7801539777587682,0.7637997432605905,undersample,0.9096906538730601,0.9097055915420298,0.933330012782431,COMPLETE
790,0.6001348617666892,2025-09-23 14:49:47.397976,2025-09-23 14:49:56.736416,0 days 00:00:09.338440,21.727798749711667,dart,0.3395180923301718,1.7727158268687782,depthwise,0.00018196999104781917,0.20041063544881021,1,7,1.1142157135568909,400,tree,0.4225051490473831,0.9036432305451871,undersample,0.8612707183645586,2.3778958652023783,0.44346069963966817,uniform,0.5919528535685982,0.8689340223068491,0.6888115467294503,0.6964578214578214,0.4225051490473831,0.5934741909601498,0.6001348617666892,0.9036432305451871,0.7311427327540266,0.7214918824381737,0.43171206225680936,0.43816463174478143,0.9491017964071856,0.9520753102267865,undersample,0.8938202377182309,0.8938463503369497,0.8612707183645586,COMPLETE
791,0.6922895543503891,2025-09-23 14:49:56.863180,2025-09-23 14:50:14.718104,0 days 00:00:17.854924,0.00040363542950527993,dart,0.3491398130189463,0.38490392642695603,depthwise,20.223964021646694,0.36697417563838775,0,6,0.3040349121997548,600,tree,0.34724559883639783,0.6100641800921014,none,0.9590274233743628,0.616065380441046,0.4324986377053916,uniform,0.26978237191019944,0.8227159985172354,0.8670283550005118,0.8664004914004914,0.34724559883639783,0.6959981277790779,0.6922895543503891,0.6100641800921014,0.8061754003263963,0.8052675955354945,0.7684754521963825,0.7710084033613446,0.6360136869118905,0.6281557552417629,none,0.9158327039329266,0.9156467715793746,0.9590274233743628,COMPLETE
792,0.6984718598583675,2025-09-23 14:50:14.843759,2025-09-23 14:50:16.487424,0 days 00:00:01.643665,2.013319520174703,gbtree,0.2340871528867563,0.14739468191611538,lossguide,0.0016200541805668216,0.07798532767420452,4,8,47.33573804555708,1000,,0.3334072299879297,0.8791495499029303,none,0.7665192959782787,1.237834865719708,,,,0.9185511337071606,0.8360118742962432,0.8343570843570843,0.3334072299879297,0.7051895472948104,0.6984718598583675,0.8791495499029303,0.8064947797585189,0.797337948061995,0.6188630490956072,0.6186860349950478,0.8195038494439693,0.8018827556696619,none,0.919112262815047,0.9147394655851664,0.7665192959782787,COMPLETE
793,0.6533567354102676,2025-09-23 14:50:16.614500,2025-09-23 14:51:20.813542,0 days 00:01:04.199042,0.029435640582770844,dart,0.7398597507708151,1.6208821988986277,depthwise,0.00307847089473296,0.011491144285086958,2,4,3.2486349804294914,1000,forest,0.36697433725619394,0.7586024300701152,none,0.5207988450607732,0.7788803536558278,0.1538979246415767,uniform,0.5451142633402798,0.662354026484141,0.8349882280683796,0.8382473382473382,0.36697433725619394,0.6500217108119843,0.6533567354102676,0.7586024300701152,0.7284862778792163,0.725493565790035,0.66005291005291,0.6704187303016659,0.6402908468776732,0.6371416345742404,none,0.8879959960118979,0.8907623506679365,0.5207988450607732,COMPLETE
794,0.5595826468973092,2025-09-23 14:51:20.939622,2025-09-23 14:52:20.925753,0 days 00:00:59.986131,75.22248317297307,dart,0.4915664521540901,8.759837484457375,depthwise,34.498415448801104,0.13342179134707605,10,3,19.425447534242906,1000,forest,0.6890394635361733,0.8211074647907659,oversample,0.7426569669854225,0.6827251028729193,0.1430507935619742,uniform,0.21826335196477886,0.26938284255300815,0.8397993653393387,0.8357903357903358,0.6890394635361733,0.5743812890943704,0.5595826468973092,0.8211074647907659,0.7429051431063941,0.7342326283699948,0.7886482449589246,0.7808429118773946,0.4516680923866553,0.4360290971330766,oversample,0.8943854318009117,0.8905136498404059,0.7426569669854225,COMPLETE
795,0.5254508103172791,2025-09-23 14:52:21.052972,2025-09-23 14:52:22.362364,0 days 00:00:01.309392,0.05143929699272183,gbtree,0.5791264406939725,0.902630741469308,depthwise,8.201854890221583,0.00011690327423787042,7,6,4.833816933795576,900,,0.6620776287704808,0.710417252991707,oversample,0.6133951457500367,2.3832925570894288,,,,0.2600744570065029,0.5704780427884123,0.5743243243243243,0.6620776287704808,0.5239391876560018,0.5254508103172791,0.710417252991707,0.728043790020866,0.7198231118406018,0.35654725138974674,0.3582879377431907,0.9875962360992301,0.9850235344458708,oversample,0.8888763219854772,0.8865383522415637,0.6133951457500367,COMPLETE
796,0.5824964131994261,2025-09-23 14:52:22.491825,2025-09-23 14:52:25.573224,0 days 00:00:03.081399,0.00012937013667899802,dart,0.9728357411486752,1.6011534498338476,depthwise,0.044373980497615186,0.004405141773369006,8,9,90.19783399275573,200,forest,0.4104528427925076,0.9238599236092473,none,0.6643673301535181,4.079534589425297,0.21732636058789384,weighted,0.7243050621869098,0.3371376149709797,0.6668031528303818,0.6722972972972973,0.4104528427925076,0.5796203022084463,0.5824964131994261,0.9238599236092473,0.7406819410263585,0.7378872097720559,0.41517113783533766,0.4189493433395872,0.9597946963216424,0.9554985023534446,none,0.8902851198232176,0.8904856069362599,0.6643673301535181,COMPLETE
797,0.6136834830684175,2025-09-23 14:52:25.700937,2025-09-23 14:53:29.321537,0 days 00:01:03.620600,0.022640992270250414,dart,0.9707736425268871,5.275355624003343,depthwise,0.01572298945437188,0.05351221517297985,1,4,48.66049854639925,1000,forest,0.6583404860647232,0.6092063384329303,undersample,0.8297257173018551,0.804044586427984,0.06828441444091427,weighted,0.2071039923167959,0.3988437551689547,0.8301770907974204,0.8283169533169533,0.6583404860647232,0.6259301014656145,0.6136834830684175,0.6092063384329303,0.6867382664013731,0.6719836928657433,0.6618979494515975,0.6646706586826348,0.5936698032506416,0.5699614890885751,undersample,0.8761432380639265,0.875780126817268,0.8297257173018551,COMPLETE
798,0.38612143742255267,2025-09-23 14:53:29.453005,2025-09-23 14:53:33.605401,0 days 00:00:04.152396,0.0003025664182041147,gbtree,0.30071789220310335,8.022863278686783,lossguide,0.14142734657293768,0.00037596092437894307,10,10,0.22206026099935514,1000,,0.3290339651296162,0.9290750616688945,undersample,0.7991554991152348,4.461205848528087,,,,0.4190113945372851,0.23932848807452145,0.23925061425061425,0.3290339651296162,0.3862228462872718,0.38612143742255267,0.9290750616688945,0.7563997052463074,0.7489253875359441,0.23932848807452145,0.23925061425061425,1.0,1.0,undersample,0.9027934384417625,0.9011988888560667,0.7991554991152348,COMPLETE
799,0.6291631682059894,2025-09-23 14:53:33.732343,2025-09-23 14:54:39.661748,0 days 00:01:05.929405,0.01519992347994821,dart,0.7586066385603338,9.895766492019574,depthwise,0.0018711935243126,0.06895945400786956,1,4,0.6808143742314033,1000,forest,0.444008694921615,0.9843047427142037,undersample,0.7979288204679763,3.0026629578189397,0.0658912499867838,uniform,0.8658678497690767,0.4350525825248694,0.7220800491350189,0.7287059787059788,0.444008694921615,0.6223396856308249,0.6291631682059894,0.9843047427142037,0.8096870415405271,0.8068628309835162,0.461142032570604,0.4674568517363277,0.9568006843455945,0.9619169875909286,undersample,0.9213147901094979,0.9206592823423507,0.7979288204679763,COMPLETE
800,0.6508930642542333,2025-09-23 14:54:39.787989,2025-09-23 14:55:47.550062,0 days 00:01:07.762073,5.32696117494518,dart,0.8464888908040238,9.61472378005593,lossguide,0.00018553462637020744,0.004857483113197767,0,12,0.13389407328868044,1000,forest,0.3685595037818095,0.6396538372583193,none,0.8451054976706196,1.0348842348388503,0.03792040744421249,weighted,0.22226028598597433,0.20854204751181646,0.8425632101545706,0.8459254709254709,0.3685595037818095,0.6493388052895577,0.6508930642542333,0.6396538372583193,0.7553191309910218,0.7490273799285918,0.6953125,0.7107396149949341,0.6090675791274593,0.6003423192126658,none,0.8837329666176614,0.8808224367648345,0.8451054976706196,COMPLETE
801,0.0,2025-09-23 14:55:47.680803,2025-09-23 14:56:15.093234,0 days 00:00:27.412431,31.285381270912698,dart,0.6937065651758476,8.15484934539598,depthwise,0.00026044333627235096,0.00043440684932394296,2,5,0.22519585378852897,700,tree,0.6725037497622786,0.9991826131197319,oversample,0.8930506039843376,0.7946871983629626,0.3951683024698451,weighted,0.2512548018811756,0.4667342942465544,0.7606715119254785,0.7607493857493858,0.6725037497622786,0.0,0.0,0.9991826131197319,0.7410963666771363,0.7380559912603852,0.0,0.0,0.0,0.0,oversample,0.8963549917294427,0.8944265562962452,0.8930506039843376,COMPLETE
802,0.5448240431543796,2025-09-23 14:56:15.220745,2025-09-23 14:56:15.766300,0 days 00:00:00.545555,0.38607186496064905,gbtree,0.48308052890736886,1.7548059569103047,lossguide,0.000946742681161455,0.015091400847265578,7,6,97.9683205878335,600,,0.30415176735335214,0.5441063983552016,undersample,0.5019366414055754,1.1899776548406393,,,,0.728901570077537,0.6319991810830177,0.6371826371826372,0.30415176735335214,0.5429116338207247,0.5448240431543796,0.5441063983552016,0.6170992176345034,0.6074429277712929,0.3862855075085942,0.3892457331620481,0.9131736526946108,0.9075738125802311,undersample,0.8395831038194677,0.8401202919663644,0.5019366414055754,COMPLETE
803,0.0,2025-09-23 14:56:15.894608,2025-09-23 14:56:23.086246,0 days 00:00:07.191638,49.79539027758708,dart,0.4417681397114702,0.7253623589956115,lossguide,0.01795262517938335,0.00027354919281568843,0,11,0.25764706665443543,300,tree,0.6740076898230174,0.9088788457667718,none,0.9918710868480032,1.3101045808776515,0.1737543061711614,weighted,0.3812265778616629,0.5942788964992214,0.7606715119254785,0.7607493857493858,0.6740076898230174,0.0,0.0,0.9088788457667718,0.74719251413338,0.738109524387462,0.0,0.0,0.0,0.0,none,0.8988728235898006,0.8970272909282011,0.9918710868480032,COMPLETE
804,0.4703282828282828,2025-09-23 14:56:23.212408,2025-09-23 14:56:34.161108,0 days 00:00:10.948700,0.697565338658206,dart,0.4766353638912498,2.420975957521706,lossguide,1.812467538176501,0.024216795135216084,9,12,50.21539713018417,400,tree,0.6188930955704218,0.8893003185717725,none,0.6542020451992461,0.5694848754738719,0.17766508184945173,weighted,0.5733269684793155,0.4914857361398715,0.8297676323062749,0.8282145782145782,0.6188930955704218,0.4768795218622208,0.4703282828282828,0.8893003185717725,0.7736489111891028,0.7697940757387618,0.901307966706302,0.8965102286401926,0.3242087254063302,0.31878476679503637,none,0.9065475945853261,0.9045186619768796,0.6542020451992461,COMPLETE
805,0.0,2025-09-23 14:56:34.288247,2025-09-23 14:57:20.554374,0 days 00:00:46.266127,96.88888091344197,dart,0.2993521819556564,8.45394958990246,lossguide,7.076956622170116,0.00013524162058010955,0,10,0.1172969780469355,1000,forest,0.39550466014744257,0.670786545106931,none,0.8228858627535612,1.352160731199012,0.4632544698804098,weighted,0.17747424279044724,0.6376927954764862,0.7606715119254785,0.7607493857493858,0.39550466014744257,0.0,0.0,0.670786545106931,0.6796847246314658,0.672421725083613,0.0,0.0,0.0,0.0,none,0.8716708402216272,0.8731078453508117,0.8228858627535612,COMPLETE
806,0.6673923184574716,2025-09-23 14:57:20.681547,2025-09-23 14:57:21.210296,0 days 00:00:00.528749,2.54070394519536,gbtree,0.9977162592657975,8.975313058250741,depthwise,25.692133525547252,0.08887730783438222,1,3,10.192247532109496,600,,0.5032792866859934,0.6566222873037084,oversample,0.9985913159684405,1.9556055518088824,,,,0.601322076258153,0.7775616746852287,0.7810196560196561,0.5032792866859934,0.6656408678258193,0.6673923184574716,0.6566222873037084,0.8130398415614741,0.8059188770834038,0.5198269646719539,0.524181729360039,0.9251497005988024,0.9182712879760376,oversample,0.9220549327551714,0.9199389482367722,0.9985913159684405,COMPLETE
807,0.6960840496657116,2025-09-23 14:57:21.336759,2025-09-23 14:57:21.898161,0 days 00:00:00.561402,0.00010229215931362691,gbtree,0.8301946364939148,7.4805828599885995,lossguide,0.21834065823787063,0.0879109846953257,0,11,19.40622706194383,700,,0.4303929867874662,0.7804784656106599,none,0.8812637231179652,1.6146174668922724,,,,0.6967908091958179,0.8384686252431159,0.8371212121212122,0.4303929867874662,0.699885888170407,0.6960840496657116,0.7804784656106599,0.8066436130639802,0.8016131666466192,0.6301369863013698,0.6287094547964113,0.7869974337040205,0.7796320068463842,none,0.9170784677832754,0.9152198226824713,0.8812637231179652,COMPLETE
808,0.6183321847002068,2025-09-23 14:57:22.024953,2025-09-23 14:58:26.709650,0 days 00:01:04.684697,5.420233777669111,dart,0.5498113231633496,8.222799198266665,depthwise,23.082198600006727,0.013555349605557473,2,5,0.10415433143720196,1000,tree,0.49568672545177006,0.9820291559994848,oversample,0.615189180935348,4.205811755641678,0.29809177711593454,uniform,0.727903668880407,0.9336868952434887,0.7129695977070325,0.7165233415233415,0.49568672545177006,0.6167304537998907,0.6183321847002068,0.9820291559994848,0.8146268394601925,0.8086248752296291,0.45319405383688227,0.45607970719804797,0.9649272882805817,0.9597774925117672,oversample,0.9220734953186079,0.9205070329818529,0.615189180935348,COMPLETE
809,0.0,2025-09-23 14:58:26.835574,2025-09-23 14:58:28.254541,0 days 00:00:01.418967,0.009156238704087891,gbtree,0.4935677099602467,9.095019495216542,lossguide,0.0031847393917056764,0.0001732097619936864,3,11,3.3771312347634046,500,,0.5327685327580453,0.6879538392715359,undersample,0.7833724398973412,0.8931636951617618,,,,0.6278036193855676,0.7606715119254785,0.7607493857493858,0.5327685327580453,0.0,0.0,0.6879538392715359,0.763354041386468,0.7515371957128465,0.0,0.0,0.0,0.0,undersample,0.9012261825043609,0.8967726590552351,0.7833724398973412,COMPLETE
810,0.610359785659607,2025-09-23 14:58:28.380580,2025-09-23 14:59:25.590646,0 days 00:00:57.210066,0.0011269068385767972,dart,0.30690622769516596,6.496658464852171,depthwise,13.941286530406614,0.0012362653146309854,10,11,27.563175456766427,900,tree,0.6234302409448416,0.9004717174941321,undersample,0.8296631306841442,1.0430685949096192,0.11875097954389152,uniform,0.7446478137044391,0.9898584609533037,0.8432797625140751,0.8436732186732187,0.6234302409448416,0.6125031637560111,0.610359785659607,0.9004717174941321,0.7394460846948496,0.731782143611271,0.750154990700558,0.7560050568900126,0.5175363558597091,0.5117672229353872,undersample,0.8952272512475482,0.8936989091540619,0.8296631306841442,COMPLETE
811,0.6447093889716841,2025-09-23 14:59:25.716186,2025-09-23 14:59:35.589118,0 days 00:00:09.872932,0.0002411386022064865,dart,0.8251971733289098,5.807844900736805,lossguide,0.11712036212933231,0.054112261694853225,0,3,0.16097827198781656,400,tree,0.6087066095560223,0.8795397268253254,oversample,0.5362472008493537,3.5305839665771837,0.21538171932262118,weighted,0.4057875875893343,0.8447728062253457,0.7497184972873375,0.7559377559377559,0.6087066095560223,0.6401766004415012,0.6447093889716841,0.8795397268253254,0.8019618861999861,0.7950053304706841,0.4879964101413507,0.494626114795335,0.9302822925577416,0.9255455712451861,oversample,0.9154389473547282,0.9132121638025764,0.5362472008493537,COMPLETE
812,0.4925626859328517,2025-09-23 14:59:35.719801,2025-09-23 14:59:54.378294,0 days 00:00:18.658493,0.9214417382272173,dart,0.767116676731967,5.771800947913016,lossguide,86.62646750637042,0.003736698351653768,9,7,1.1358116489003656,500,forest,0.33961033479345276,0.7468795723257535,oversample,0.9607001360774374,3.0439184712586216,0.10425873148435488,weighted,0.4171193551345243,0.5058720541789896,0.5062954243013614,0.5110565110565111,0.33961033479345276,0.49086878496780323,0.4925626859328517,0.7468795723257535,0.7626108014734008,0.7578837849868486,0.3258584442887176,0.32763250883392225,0.9944396920444825,0.991869918699187,oversample,0.8984829521992983,0.8944636973089235,0.9607001360774374,COMPLETE
813,0.6445672191528545,2025-09-23 14:59:54.504945,2025-09-23 14:59:56.158171,0 days 00:00:01.653226,0.007287834463668838,gbtree,0.2914987221253809,3.2297173686343683,depthwise,0.0005613460118829394,0.0031831867262632975,8,11,0.7872874658482852,900,,0.46964684154380804,0.9010459492760732,none,0.6041481866601679,0.7734114378665383,,,,0.9973836229096309,0.8627290408434845,0.8616912366912367,0.46964684154380804,0.6486769714435421,0.6445672191528545,0.9010459492760732,0.8080448819712911,0.8002829338117525,0.837052062204192,0.8367486338797814,0.5295124037639007,0.5241762943945228,none,0.9175482877028112,0.9160753327993088,0.6041481866601679,COMPLETE
814,0.5745740498034076,2025-09-23 14:59:56.286553,2025-09-23 15:01:02.297350,0 days 00:01:06.010797,0.003170549553093874,dart,0.2337783705686917,6.4199415061373335,lossguide,0.004583986358184909,0.007704926433603527,5,3,46.174671370398784,1000,forest,0.5620852183185244,0.6751821142797835,none,0.8454861042552837,1.2908239796081395,0.040118326296539,weighted,0.47852869636580025,0.43265789894363443,0.8361142389190296,0.8338452088452089,0.5620852183185244,0.5851256802280383,0.5745740498034076,0.6751821142797835,0.718161960225443,0.7121618953269331,0.7422748191978962,0.7415426251691475,0.4828913601368691,0.4689773213521609,none,0.8870243537378786,0.8900976129154445,0.8454861042552837,COMPLETE
815,0.6211565585331452,2025-09-23 15:01:02.427025,2025-09-23 15:01:03.944174,0 days 00:00:01.517149,1.350864073835332,gbtree,0.8423105056624949,2.0717595100625905,lossguide,30.411711703353667,0.0028527324276559542,9,5,2.5204002393763716,900,,0.6666512530756847,0.9664702688322979,undersample,0.797037188762134,4.204650922650201,,,,0.2010497068529559,0.7179854642235644,0.7250204750204751,0.6666512530756847,0.615706514158181,0.6211565585331452,0.9664702688322979,0.7499617403863842,0.7403706586846848,0.4568412336990271,0.4632863454660215,0.9439692044482464,0.9422336328626444,undersample,0.9015553010709648,0.9001309551798959,0.797037188762134,COMPLETE
816,0.6915658425390145,2025-09-23 15:01:04.073754,2025-09-23 15:01:04.570427,0 days 00:00:00.496673,0.00014617942604351226,gbtree,0.5667306026878728,9.61267460214101,depthwise,0.009568740085072315,0.05695394369956672,3,8,1.9822061708348633,700,,0.34497669474356424,0.7299458141862103,none,0.5182596149613261,1.4217474199936642,,,,0.8241557064200287,0.8182004299314157,0.8199221949221949,0.34497669474356424,0.6909154194222068,0.6915658425390145,0.7299458141862103,0.8030097343147026,0.7965494555548351,0.5824530516431925,0.5858585858585859,0.84901625320787,0.8438168592212237,none,0.9147644787707012,0.915074252945959,0.5182596149613261,COMPLETE
817,0.38612143742255267,2025-09-23 15:01:04.701889,2025-09-23 15:01:05.618077,0 days 00:00:00.916188,17.083694020696672,gbtree,0.9515837201706736,3.525490219054883,depthwise,92.96257040578054,0.00022701624073864565,8,4,1.3799260036715704,800,,0.30455873314124243,0.9654649003486564,oversample,0.9129891192485861,2.4520077383742764,,,,0.36329763121538683,0.23932848807452145,0.23925061425061425,0.30455873314124243,0.3862228462872718,0.38612143742255267,0.9654649003486564,0.679786540295796,0.6734024611002675,0.23932848807452145,0.23925061425061425,1.0,1.0,oversample,0.8816308498407763,0.8806547263781288,0.9129891192485861,COMPLETE
818,0.689453125,2025-09-23 15:01:05.744937,2025-09-23 15:01:16.449006,0 days 00:00:10.704069,13.486943104719211,dart,0.24429822444629556,6.289187707191445,lossguide,0.00017355263966935882,0.04778147942813323,9,10,2.809156266813081,400,tree,0.6795286794755985,0.5459354331600087,oversample,0.5086789954243294,1.5775766657329386,0.34656119177324474,weighted,0.7712472314863952,0.8111807538778584,0.8303818200429931,0.8372235872235873,0.6795286794755985,0.6852801519468186,0.689453125,0.5459354331600087,0.7844678764587134,0.7826636879455365,0.6163307140416809,0.6342076895436579,0.7715996578272027,0.7552417629439452,oversample,0.905244905540439,0.9073870998149457,0.5086789954243294,COMPLETE
