number,value,datetime_start,datetime_complete,duration,params_alpha,params_booster,params_colsample_bytree,params_gamma,params_grow_policy,params_lambda,params_learning_rate,params_max_delta_step,params_max_depth,params_min_child_weight,params_n_estimators,params_normalize_type,params_params_decision_threshold,params_params_feature_fraction,params_params_resampling,params_params_sample_rows,params_params_scale_pos_weight,params_rate_drop,params_sample_type,params_skip_drop,params_subsample,user_attrs_acc_test,user_attrs_acc_val,user_attrs_decision_threshold,user_attrs_f1_test,user_attrs_f1_val,user_attrs_feature_fraction,user_attrs_pr_auc_test,user_attrs_pr_auc_val,user_attrs_prec_test,user_attrs_prec_val,user_attrs_rec_test,user_attrs_rec_val,user_attrs_resampling_strategy,user_attrs_roc_auc_test,user_attrs_roc_auc_val,user_attrs_sample_rows,state
1131,0.7134869156788191,2025-09-23 17:03:15.518352,2025-09-23 17:04:23.871068,0 days 00:01:08.352716,0.0004446385670753634,dart,0.41142876809204015,3.585914883098318,lossguide,0.11569995362879573,0.05649720327426679,3,6,0.3349243457829708,1000,forest,0.30702682981008794,0.9682014893740643,none,0.7827105695933404,0.5434259484216784,0.006035099366272709,weighted,0.6116563408294796,0.4620660389661813,0.8719418568942573,0.8688574938574939,0.30702682981008794,0.7215668818161585,0.7134869156788191,0.9682014893740643,0.8239509247479319,0.817502557676838,0.7522041763341067,0.7474226804123711,0.693327630453379,0.6824989302524604,none,0.925833522412468,0.9240997205671437,0.7827105695933404,COMPLETE
1132,0.6793547217690774,2025-09-23 17:04:24.003500,2025-09-23 17:04:31.076642,0 days 00:00:07.073142,2.54860567865181,dart,0.21172661901395168,0.9998054660843528,depthwise,1.5800300950584185,0.12416741578350064,1,12,0.6991720986142094,300,tree,0.30048807745608547,0.8835358915106553,none,0.7112284663499926,1.057528522850306,0.012385314165231257,weighted,0.8602005075618161,0.4612888490003297,0.8156413143617566,0.8188984438984439,0.30048807745608547,0.6775290957923008,0.6793547217690774,0.8835358915106553,0.7498457197871806,0.7444857024794228,0.5826917154296274,0.5893081761006289,0.8092386655260907,0.8018827556696619,none,0.8991779115510257,0.900413917871835,0.7112284663499926,COMPLETE
1133,0.6894287590282338,2025-09-23 17:04:31.209231,2025-09-23 17:04:56.502023,0 days 00:00:25.292792,0.0001726964341031762,dart,0.34489307890809867,3.251657200967906,depthwise,0.14319267107070904,0.24228250779010818,4,12,0.1735916347791939,600,forest,0.3011825293943531,0.9908302968555451,oversample,0.6923384871074658,0.6739215369596697,0.07806065262968476,weighted,0.7440162328394913,0.3522033154610451,0.8010031733033064,0.8063063063063063,0.3011825293943531,0.6846203763789747,0.6894287590282338,0.9908302968555451,0.8249460477599686,0.8140277660720667,0.5514898065865134,0.559254327563249,0.9024807527801539,0.8985879332477535,oversample,0.9266007750345091,0.9225501341769468,0.6923384871074658,COMPLETE
1134,0.715814043960319,2025-09-23 17:04:56.632374,2025-09-23 17:04:59.977905,0 days 00:00:03.345531,0.08554197202619407,dart,0.7673934971189044,2.6509750809078376,depthwise,6.0599341614929,0.13964574543409494,4,6,10.047831170979364,200,forest,0.6831323367884236,0.9916231664753536,none,0.8364493417543711,4.659584111563994,0.14589808822214234,weighted,0.5582976719497622,0.8913118210877436,0.8519807554509161,0.8504299754299754,0.6831323367884236,0.7210648148148148,0.715814043960319,0.9916231664753536,0.8248500765327991,0.8168959279204194,0.6567111735769501,0.6562054208273894,0.7994011976047904,0.787334189131365,none,0.9262215519362105,0.9237678411461039,0.8364493417543711,COMPLETE
1135,0.6796811452741175,2025-09-23 17:05:00.108442,2025-09-23 17:05:03.261263,0 days 00:00:03.152821,0.3069128164693621,dart,0.6899667519467623,2.47506624474268,depthwise,3.527317074186722,0.41154960109077693,4,3,2.4561655620922966,200,forest,0.5353490305374522,0.9462155452672156,none,0.8589826643100383,4.738106527465997,0.17868571642821307,weighted,0.5522843555872925,0.9286242190912117,0.7898454294195926,0.7984234234234234,0.5353490305374522,0.6720971090880051,0.6796811452741175,0.9462155452672156,0.8100243696929983,0.802285170567465,0.536324241651797,0.5482939632545932,0.8999144568006844,0.8938810440735986,none,0.9189443651482432,0.9173125891852165,0.8589826643100383,COMPLETE
1136,0.7151586832249163,2025-09-23 17:05:03.394140,2025-09-23 17:05:10.385767,0 days 00:00:06.991627,0.5370778901401189,dart,0.5958725381573953,1.1578770339575397,depthwise,0.22046129593798341,0.10120619545143465,3,8,21.539997814059024,300,forest,0.6558535613228028,0.9339227172359378,none,0.7715227232510573,3.96464898094448,0.14794593553570123,weighted,0.5316910529822034,0.9031851286695944,0.8502405568635479,0.8520679770679771,0.6558535613228028,0.7150925024342746,0.7151586832249163,0.9339227172359378,0.8204115250422979,0.8118084687201814,0.656417590275295,0.6630116959064327,0.7852865697177075,0.7762088147197261,none,0.9240854181826095,0.9211830569955618,0.7715227232510573,COMPLETE
1137,0.7097733184689706,2025-09-23 17:05:10.516369,2025-09-23 17:05:13.965258,0 days 00:00:03.448889,7.828999469669627,dart,0.4627274610944739,0.930680753135108,depthwise,0.17759478283667252,0.079474603058876,3,8,21.56030991876553,200,forest,0.6573222366539133,0.9935612211008237,none,0.977509919022605,4.91371627262979,0.16901819501255802,weighted,0.5147614547353847,0.7450175555155231,0.8401064592076978,0.8400900900900901,0.6573222366539133,0.7120206489675516,0.7097733184689706,0.9935612211008237,0.8202276598325338,0.8132023359711984,0.6257290991574854,0.6272577996715928,0.8259195893926433,0.8172871202396235,none,0.9242402501070872,0.9222370268026248,0.977509919022605,COMPLETE
1138,0.7106072252113759,2025-09-23 17:05:14.098599,2025-09-23 17:05:17.632360,0 days 00:00:03.533761,0.707750222023671,dart,0.4750882887629031,0.24604497464121333,depthwise,0.09809314150085896,0.12138022382974663,1,10,21.15186703349477,200,forest,0.5940771696806281,0.9446946904865934,none,0.6328282415238033,3.4606278036808047,0.1384016039765481,weighted,0.5044567615681836,0.9081351464818836,0.8459412427065206,0.8458230958230958,0.5940771696806281,0.713823920897509,0.7106072252113759,0.9446946904865934,0.8168874564405757,0.8081612579281247,0.6425881547415269,0.6449250087199163,0.8028229255774166,0.7911852802738554,none,0.9228560584580882,0.9197111788171619,0.6328282415238033,COMPLETE
1139,0.6975985078106784,2025-09-23 17:05:17.765054,2025-09-23 17:05:39.318421,0 days 00:00:21.553367,0.027558676363409678,dart,0.21329623110487708,0.31639640754632614,lossguide,0.15041768748476642,0.30912868733954774,8,11,0.11318960841679523,500,forest,0.3460768002340539,0.9150954765674012,none,0.6998042995829507,0.6056151941384642,0.12809447304641952,weighted,0.5180472251794905,0.5263589981652668,0.8691780120790255,0.8672194922194922,0.3460768002340539,0.7014018691588785,0.6975985078106784,0.9150954765674012,0.819340299097441,0.8091990113045822,0.7729145211122554,0.7663934426229508,0.6420017108639863,0.6401369276850664,none,0.9235009996156256,0.9217116686178654,0.6998042995829507,COMPLETE
1140,0.696236559139785,2025-09-23 17:05:39.453630,2025-09-23 17:05:42.788705,0 days 00:00:03.335075,0.12612414214180384,dart,0.7977054084118186,4.2517167761071955,depthwise,1.4850843397957711,0.057799915902805483,2,5,70.08592158503163,200,forest,0.6500837379593156,0.8358709445589377,none,0.9594887354749526,3.947918625043278,0.14616278414709405,weighted,0.6020072053421448,0.8521303924159666,0.8387757191114751,0.838042588042588,0.6500837379593156,0.70311027332705,0.696236559139785,0.8358709445589377,0.8074200162848817,0.7978198202721918,0.6285810583080553,0.6314872866597004,0.7976903336184773,0.7757809157038938,none,0.9185835031592045,0.9155724319710528,0.9594887354749526,COMPLETE
1141,0.6464285714285715,2025-09-23 17:05:42.923197,2025-09-23 17:05:49.876661,0 days 00:00:06.953464,0.21653434195707255,dart,0.757778717585588,0.6679389255761461,depthwise,0.14947961884659516,0.15575579931331107,7,9,62.825105082412385,300,forest,0.6405452464478737,0.8607145168291822,undersample,0.754063094618806,4.295777536119359,0.09728037253970495,weighted,0.5874102841542078,0.8995012767404418,0.753505988330433,0.7567567567567568,0.6405452464478737,0.6442080378250591,0.6464285714285715,0.8607145168291822,0.79286652336233,0.7830239000014618,0.49209932279909707,0.49555099247091033,0.932420872540633,0.9293966623876765,undersample,0.9131563851937397,0.9105135957124185,0.754063094618806,COMPLETE
1142,0.6031447386104019,2025-09-23 17:05:50.009235,2025-09-23 17:05:51.658934,0 days 00:00:01.649699,0.0035270306098393596,gbtree,0.9401084992444624,1.8618409999230239,lossguide,0.012617242283371894,0.009957976953263621,7,8,0.14166750833094535,200,,0.3205364891001651,0.967766960798166,undersample,0.9579306708750779,1.518359504162928,,,,0.822046876609607,0.6952605179649913,0.6976863226863227,0.3205364891001651,0.6003490401396161,0.6031447386104019,0.967766960798166,0.8018496772606709,0.794231740332078,0.4374877714732929,0.4396551724137931,0.9563729683490163,0.9602053915275995,undersample,0.9137257810349655,0.9121623975519869,0.9579306708750779,COMPLETE
1143,0.719069580910367,2025-09-23 17:05:51.789730,2025-09-23 17:05:55.401992,0 days 00:00:03.612262,0.0009973667052151033,dart,0.8665324742340625,2.7720305169155366,depthwise,9.170341878278636,0.36433996785648026,4,10,4.172415687207709,200,forest,0.6961773651896944,0.9565374956242154,none,0.9316768721639334,4.463813996544865,0.0907993832923327,weighted,0.4614589056075882,0.8778214938807993,0.8572013512130208,0.8565724815724816,0.6961773651896944,0.7192594083316562,0.719069580910367,0.9565374956242154,0.8230875945954805,0.8164293235803116,0.6792094260737362,0.6766037735849056,0.7643284858853722,0.7672229353872486,none,0.9245497988393706,0.9232106395814824,0.9316768721639334,COMPLETE
1144,0.713840155945419,2025-09-23 17:05:55.533604,2025-09-23 17:06:02.588914,0 days 00:00:07.055310,0.005411237855644279,dart,0.7393537850263276,2.531950416446293,depthwise,36.582496250518766,0.4924127310765022,7,8,1.4760354504037025,300,forest,0.6829850272794298,0.9524399855328506,none,0.9093773509190025,4.3059156270531425,0.09211856746231889,weighted,0.41908142973733387,0.7819271513765511,0.8494216398812571,0.8497133497133497,0.6829850272794298,0.7139801672175773,0.713840155945419,0.9524399855328506,0.8183580633224526,0.8122093630938791,0.6545454545454545,0.6555674901539563,0.7852865697177075,0.7834830979888746,none,0.9229636349885153,0.9210053559643601,0.9093773509190025,COMPLETE
1145,0.7107895296871675,2025-09-23 17:06:02.720292,2025-09-23 17:06:03.602781,0 days 00:00:00.882489,1.4447407914118693,gbtree,0.5473424778899898,0.5869061140940368,depthwise,1.083552752816476,0.03240811644534216,4,9,35.163689022907135,300,,0.6631446687834389,0.9560840079644016,none,0.7854739721124726,2.9593613952678046,,,,0.9509902944320607,0.8647763332992118,0.8608722358722358,0.6631446687834389,0.7203048909591362,0.7107895296871675,0.9560840079644016,0.8187395489473022,0.8090026533782582,0.7132075471698113,0.7070279424216765,0.7275449101796407,0.7145913564398801,none,0.9237311178439016,0.9208766580367077,0.7854739721124726,COMPLETE
1146,0.7101735882223688,2025-09-23 17:06:03.736076,2025-09-23 17:06:07.728680,0 days 00:00:03.992604,0.0006009098323238673,dart,0.933729516179484,0.6766663285220278,depthwise,13.965384245615992,0.24904973545656722,3,12,0.98093318229697,200,forest,0.6839126539068114,0.9464825881414091,none,0.8881859993846223,3.2924649032930633,0.07342126604874108,weighted,0.44895066499049596,0.730045503567861,0.8660047087726481,0.86496723996724,0.6839126539068114,0.711991199119912,0.7101735882223688,0.9464825881414091,0.8191864167692262,0.8104351176136968,0.7331218849116448,0.7299006323396567,0.6920444824636441,0.691484809584938,none,0.9234957330278597,0.9198948396852814,0.8881859993846223,COMPLETE
1147,0.6984993178717599,2025-09-23 17:06:07.862051,2025-09-23 17:06:25.792668,0 days 00:00:17.930617,0.0002566664546689303,dart,0.5805572416227952,5.647635653136252,depthwise,1.1445017036940262,0.031187926779342644,2,5,0.14499033547538914,500,forest,0.31739646289434215,0.8924129507929061,none,0.8409705689711189,1.8077924644618302,0.004585480416186644,weighted,0.4824572908084436,0.4591804897567477,0.8132869280376702,0.819000819000819,0.31739646289434215,0.6947791164658634,0.6984993178717599,0.8924129507929061,0.8234209557209831,0.817858223910622,0.5706432105552501,0.5806634533597959,0.8879384088964928,0.8763371844244758,none,0.9255286071262515,0.9243913207038919,0.8409705689711189,COMPLETE
1148,0.6649992183836173,2025-09-23 17:06:25.927455,2025-09-23 17:07:08.667091,0 days 00:00:42.739636,0.0016004301489704474,dart,0.535454701240926,1.944885702479382,depthwise,0.8370200297958739,0.044615245870424716,2,9,0.12201097620900792,800,forest,0.3009031034804218,0.8513555160969251,undersample,0.7728421561324551,0.6838891071556471,0.17112657197957667,weighted,0.49989929881127815,0.2769803815323689,0.7734670897737742,0.7806101556101556,0.3009031034804218,0.6604265766456958,0.6649992183836173,0.8513555160969251,0.8140015872008866,0.8074231757190633,0.514955731036133,0.5238916256157635,0.9204448246364414,0.9101412066752247,undersample,0.9207146868958893,0.9192152167362355,0.7728421561324551,COMPLETE
1149,0.6473577235772358,2025-09-23 17:07:08.797920,2025-09-23 17:07:34.117677,0 days 00:00:25.319757,0.0003377337692262159,dart,0.5887327592964007,1.6339564893123373,lossguide,0.0005268854760502791,0.07462802287879827,2,5,0.36229345410347036,600,forest,0.42098584881749423,0.7924531809313775,none,0.9136195210861814,0.5584746123295173,0.10596859274853938,weighted,0.5436150657717141,0.9124497538305302,0.8646739686764254,0.8579033579033579,0.42098584881749423,0.6693346673336669,0.6473577235772358,0.7924531809313775,0.8058897664550468,0.7933639966585104,0.8060240963855422,0.7967479674796748,0.572284003421728,0.5451433461703038,none,0.919891602687698,0.9146604905481306,0.9136195210861814,COMPLETE
1150,0.6618483776718438,2025-09-23 17:07:34.249160,2025-09-23 17:07:37.697827,0 days 00:00:03.448667,0.35029953210941617,dart,0.7606073820968898,2.20443927028333,depthwise,2.6494560421981315,0.03981588556427384,5,7,4.308017456144093,200,forest,0.6771264500055255,0.8577295238618865,oversample,0.7767107608696838,4.66470076142342,0.12650796862437352,weighted,0.6592589448168169,0.7208777319654298,0.7639471798546422,0.7748771498771498,0.6771264500055255,0.6509234029669997,0.6618483776718438,0.8577295238618865,0.8092431183696969,0.8036371532617587,0.5037488284910965,0.5165626500240038,0.9195893926432849,0.9208386820710313,oversample,0.9172840086019783,0.9166693010873332,0.7767107608696838,COMPLETE
1151,0.724969350224765,2025-09-23 17:07:37.830173,2025-09-23 17:07:41.281938,0 days 00:00:03.451765,0.00024025224527715884,dart,0.8673458043893043,6.010893155203215,depthwise,2.8916895804176965,0.16992967073915577,0,9,5.427459412276461,200,forest,0.6948240487565844,0.9826464483921938,none,0.9674189691672187,4.001365068616531,0.12349583581621532,weighted,0.6243741479225324,0.8279313562433814,0.8586344559320299,0.8622031122031122,0.6948240487565844,0.7192518804635089,0.724969350224765,0.9826464483921938,0.826393106613422,0.8201601985436482,0.6853932584269663,0.6937817755181854,0.7566295979469632,0.7590928540864356,none,0.9271746316467936,0.9250858864324573,0.9674189691672187,COMPLETE
1152,0.7171581769436998,2025-09-23 17:07:41.414752,2025-09-23 17:07:44.826383,0 days 00:00:03.411631,0.00010457459826180328,dart,0.8425583373675839,9.061964466498885,depthwise,0.10469048865671103,0.08997530356604481,3,9,4.435300225491789,200,forest,0.6623171794789897,0.9713322865227741,none,0.9175711276300307,2.4948586779370463,0.15074029603095285,weighted,0.6153878188487212,0.6473014804063321,0.8704063875524619,0.8703931203931204,0.6623171794789897,0.7171581769436998,0.7171581769436998,0.9713322865227741,0.8252158613619227,0.8177247299398689,0.7507015902712816,0.7503506311360448,0.6864841745081266,0.686777920410783,none,0.9264347192344649,0.9239157429927145,0.9175711276300307,COMPLETE
1153,0.6712816455696202,2025-09-23 17:07:44.957507,2025-09-23 17:07:51.866900,0 days 00:00:06.909393,0.00021125719139419911,dart,0.8887022519438799,9.536114930611316,depthwise,0.17723719645601266,0.020609591537574468,4,10,23.60118914639079,300,forest,0.6062334212829918,0.9026581853411564,none,0.9488607396921117,2.6445160865069504,0.1969372033616947,weighted,0.5834984396187975,0.6309655720645849,0.8326338417442932,0.8298525798525799,0.6062334212829918,0.679348891939596,0.6712816455696202,0.9026581853411564,0.7479397038400268,0.7397382861799782,0.6273089460340456,0.6241265171018757,0.7408041060735672,0.7261446298673513,none,0.89881440187852,0.89890204832397,0.9488607396921117,COMPLETE
1154,0.7141507651615341,2025-09-23 17:07:51.998506,2025-09-23 17:08:03.859184,0 days 00:00:11.860678,2.338232146790493,dart,0.28057007005647555,4.055089379545606,lossguide,0.00030710120651574857,0.12570042857567532,6,7,1.1379542696444511,400,forest,0.6599141261674482,0.9950009011683129,none,0.9096946573493493,4.881525612733436,0.1686067595086554,weighted,0.5864673594329316,0.3369864741142705,0.8447128672330843,0.8451064701064701,0.6599141261674482,0.7151173708920188,0.7141507651615341,0.9950009011683129,0.8211448401634562,0.8166621094390955,0.6374288583863408,0.6393775372124493,0.8143712574850299,0.8087291399229781,none,0.9249154957286534,0.9240927242368486,0.9096946573493493,COMPLETE
1155,0.6518959107806691,2025-09-23 17:08:03.996101,2025-09-23 17:08:07.361843,0 days 00:00:03.365742,0.007406063535671823,dart,0.7233308593416403,3.452766495155527,depthwise,14.807420085578581,0.07765137050232336,2,6,10.206832601265056,200,forest,0.6110927610460339,0.9953520851401774,undersample,0.8245503346645152,4.16770548437817,0.07965419179480585,weighted,0.5020479844309195,0.9744179169378664,0.7572934793735285,0.7603398853398854,0.6110927610460339,0.6501401800206581,0.6518959107806691,0.9953520851401774,0.8135760263413297,0.8065348347775667,0.49628294660959676,0.4995442114858706,0.9422583404619332,0.9379546427043218,undersample,0.9218360384024616,0.9200815812420498,0.8245503346645152,COMPLETE
1156,0.7143381004767143,2025-09-23 17:08:07.494618,2025-09-23 17:08:19.678466,0 days 00:00:12.183848,0.0008480894346088372,dart,0.5405728381712012,6.866580507978331,depthwise,4.358829696712303,0.0687277808377058,0,12,2.585697445440739,400,forest,0.6284641148255082,0.9399602307152007,none,0.9797153322451678,4.629112664338111,0.1545357620161369,weighted,0.6472045788815189,0.706267534107979,0.8377520728836114,0.8404995904995906,0.6284641148255082,0.7121844924641365,0.7143381004767143,0.9399602307152007,0.8248050709106842,0.8189418097520854,0.6188071946986431,0.6249598973371832,0.8387510692899914,0.8335472828412495,none,0.9263288118957888,0.9249062851633978,0.9797153322451678,COMPLETE
1157,0.6759435760579489,2025-09-23 17:08:19.811678,2025-09-23 17:08:41.069676,0 days 00:00:21.257998,0.007630563910521856,dart,0.3410676108475866,1.1209746082819811,lossguide,0.0008553675373438887,0.4670275858408449,3,10,0.23754413288999052,500,forest,0.3144399401138535,0.9859507028207888,none,0.8739362709527044,0.8760341410192302,0.1226102078738105,weighted,0.6201241183199714,0.7409436824178287,0.8247517657897431,0.825962325962326,0.3144399401138535,0.6747720364741642,0.6759435760579489,0.9859507028207888,0.739919772288536,0.7395460072669562,0.606971975393028,0.6094877964936404,0.7596236099230111,0.7586649550706034,none,0.8961539404609664,0.8984119021225484,0.8739362709527044,COMPLETE
1158,0.6763419483101392,2025-09-23 17:08:41.202170,2025-09-23 17:08:52.877580,0 days 00:00:11.675410,0.00015637091024527336,dart,0.9521337558584037,5.646785479470983,depthwise,5.639539782189782,0.13806761227738698,3,8,3.960687979766927,400,forest,0.6996086265302808,0.8420308858351908,none,0.9893413305731711,4.165752312770435,0.07287846121162807,weighted,0.5639467850919928,0.9147188610229601,0.8322243832531477,0.8333333333333334,0.6996086265302808,0.6776794493608653,0.6763419483101392,0.8420308858351908,0.7525737108940653,0.7472272199837582,0.6272297051328722,0.6316375789082808,0.7369546621043627,0.7278562259306803,none,0.9010651918379056,0.9010888766006842,0.9893413305731711,COMPLETE
1159,0.6450577663671374,2025-09-23 17:08:53.008499,2025-09-23 17:08:56.399090,0 days 00:00:03.390591,0.00103015324869075,dart,0.3973500975862816,2.1683709745564683,lossguide,0.0008459860080867407,0.13159545846357265,6,5,0.1597502360227853,200,forest,0.47398976930169234,0.7214189447138235,none,0.7085424743695723,3.3304076543241963,0.14660073921001446,weighted,0.5957547962649569,0.5262715362267856,0.7678370355205241,0.7735462735462736,0.47398976930169234,0.6375838926174496,0.6450577663671374,0.7214189447138235,0.7021251597642839,0.6994360421012457,0.5089285714285714,0.5160462130937099,0.8532934131736527,0.8600770218228498,none,0.8861055787956931,0.886595100253958,0.7085424743695723,COMPLETE
1160,0.6860670194003528,2025-09-23 17:08:56.530887,2025-09-23 17:09:57.993999,0 days 00:01:01.463112,0.00149085252534202,dart,0.7308322078401307,0.8927673295386558,lossguide,0.08178010664208027,0.021060057390583874,7,10,1.406556904013077,900,forest,0.5959223691428276,0.7450831298721906,undersample,0.7620347662185993,1.4492410800694993,0.12193349740737719,weighted,0.4512539557916909,0.7600422426997531,0.8196335346504248,0.8177723177723177,0.5959223691428276,0.6921733053808525,0.6860670194003528,0.7450831298721906,0.8020774599184718,0.7980713933076022,0.5850561134081512,0.5835583558355836,0.8473053892215568,0.8322635857937527,undersample,0.9145749679486403,0.9130354992647519,0.7620347662185993,COMPLETE
