number,value,datetime_start,datetime_complete,duration,params_alpha,params_booster,params_colsample_bytree,params_gamma,params_grow_policy,params_lambda,params_learning_rate,params_max_delta_step,params_max_depth,params_min_child_weight,params_n_estimators,params_normalize_type,params_params_decision_threshold,params_params_feature_fraction,params_params_resampling,params_params_sample_rows,params_params_scale_pos_weight,params_rate_drop,params_sample_type,params_skip_drop,params_subsample,user_attrs_acc_test,user_attrs_acc_val,user_attrs_decision_threshold,user_attrs_f1_test,user_attrs_f1_val,user_attrs_feature_fraction,user_attrs_pr_auc_test,user_attrs_pr_auc_val,user_attrs_prec_test,user_attrs_prec_val,user_attrs_rec_test,user_attrs_rec_val,user_attrs_resampling_strategy,user_attrs_roc_auc_test,user_attrs_roc_auc_val,user_attrs_sample_rows,state
2823,0.6673003802281369,2025-09-24 02:47:12.778747,2025-09-24 02:47:32.313717,0 days 00:00:19.534970,0.011029490575424284,dart,0.7002002837878075,2.6353072536163116,lossguide,0.002576727277958359,0.055409475401873354,6,10,8.872247798847882,500,forest,0.6792044219089717,0.8899253376166361,undersample,0.9404888557915929,4.729955618278693,0.09174246029657146,weighted,0.8010515629573955,0.43221379619963374,0.7855461152625652,0.785012285012285,0.6792044219089717,0.671784427385242,0.6673003802281369,0.8899253376166361,0.8059209553697578,0.7976774559313717,0.5300370828182942,0.5298113207547169,0.9170230966638152,0.9011553273427471,undersample,0.9201350456708131,0.9156395449172178,0.9404888557915929,COMPLETE
2824,0.0,2025-09-24 02:47:32.464899,2025-09-24 02:47:33.149919,0 days 00:00:00.685020,0.11111046575594546,gbtree,0.21674886959448075,5.051471144162921,depthwise,0.5245140002211184,0.001793320570220092,7,3,4.684846966280631,200,,0.6399795879451874,0.6479397172687711,oversample,0.7554170105001462,0.8303713520035555,,,,0.8947164458625216,0.7606715119254785,0.7607493857493858,0.6399795879451874,0.0,0.0,0.6479397172687711,0.7275566079361384,0.7183920320355781,0.0,0.0,0.0,0.0,oversample,0.8872479390949918,0.8844359118006325,0.7554170105001462,COMPLETE
2825,0.5746164574616457,2025-09-24 02:47:33.306032,2025-09-24 02:47:58.344967,0 days 00:00:25.038935,0.26037306912300806,dart,0.27333181996163136,7.347644232613996,lossguide,0.24244338993246906,0.0003894777565066445,6,3,61.381425967894764,600,forest,0.524141626425884,0.7667480978612566,none,0.8785253128421486,4.199903983698509,0.00035762766516543587,weighted,0.6245650673993551,0.2696606710260331,0.648889343842768,0.6565315315315315,0.524141626425884,0.5692037176588797,0.5746164574616457,0.7667480978612566,0.7221953529419914,0.7145168259550224,0.40291607396870555,0.4082882882882883,0.9692044482463644,0.9696191698759092,none,0.8826721664808107,0.8804078969969735,0.8785253128421486,COMPLETE
2826,0.6253021756647864,2025-09-24 02:47:58.501547,2025-09-24 02:48:00.606088,0 days 00:00:02.104541,0.32913734705603903,gbtree,0.9293233270541568,1.5584489618851949,depthwise,0.044237137716576995,0.4598834430268247,2,9,0.2700980790765219,900,,0.5013713505167959,0.5850838671730528,oversample,0.798481925302932,1.9870102522589572,,,,0.22861532564498044,0.8088852492578564,0.8095823095823096,0.5013713505167959,0.6318280418063499,0.6253021756647864,0.5850838671730528,0.696788114845396,0.6954518060604233,0.5861690450054885,0.5907879710696612,0.6852010265183918,0.6640992725716731,oversample,0.8635445528574894,0.86369671581891,0.798481925302932,COMPLETE
2827,0.6753901939145515,2025-09-24 02:48:00.762747,2025-09-24 02:48:01.852616,0 days 00:00:01.089869,0.00014879923447503113,gbtree,0.34237259407579956,3.0324003802107553,lossguide,9.44301347173178,0.1332609980586337,0,7,0.26590285949902837,1000,,0.6567632747870279,0.9730293639668053,undersample,0.6424744214933718,4.226333555929221,,,,0.7997852693820384,0.7832940935612652,0.7892096642096642,0.6567632747870279,0.66927042649586,0.6753901939145515,0.9730293639668053,0.8125868745097438,0.812207031288668,0.5271966527196653,0.5346979530703944,0.9161676646706587,0.9165596919127086,undersample,0.9221631424272971,0.9223046579954783,0.6424744214933718,COMPLETE
2828,0.6744783306581059,2025-09-24 02:48:02.007091,2025-09-24 02:48:22.894390,0 days 00:00:20.887299,0.1351018360262576,dart,0.46478354063638916,1.5759720902423782,lossguide,0.012040476879230051,0.013937358480349632,4,8,1.1026216161613382,500,forest,0.5976992588213736,0.9046454666153927,oversample,0.9913089693969968,2.7967345155364143,0.11877498077335069,weighted,0.6190794394278402,0.42353853230419863,0.7901525232879517,0.7923832923832924,0.5976992588213736,0.6753246753246753,0.6744783306581059,0.9046454666153927,0.8040008906454662,0.7919595654009919,0.5362173038229376,0.5396866170048805,0.911890504704876,0.8990158322635858,oversample,0.9199034884841308,0.9158053550660658,0.9913089693969968,COMPLETE
2829,0.7088926174496645,2025-09-24 02:48:23.047114,2025-09-24 02:48:24.650524,0 days 00:00:01.603410,0.00030555896608569364,gbtree,0.4759228074180521,0.5426174976223463,depthwise,0.18340669185766403,0.04600382339064895,0,9,0.25611922061274056,1000,,0.6461746435193504,0.9287778377780227,none,0.7150045381763827,3.8761556083025397,,,,0.9854029847586128,0.8572013512130208,0.8579033579033579,0.6461746435193504,0.7114788004136504,0.7088926174496645,0.9287778377780227,0.815441379191457,0.8098283935293746,0.6888265919102924,0.6951871657754011,0.7356715141146278,0.7231493367565255,none,0.9179905659584574,0.9182023035834973,0.7150045381763827,COMPLETE
2830,0.7177597641857038,2025-09-24 02:48:24.804099,2025-09-24 02:48:26.393927,0 days 00:00:01.589828,0.0002077095973714513,gbtree,0.2875498705750095,1.4276533084941043,lossguide,0.0024251282360479493,0.055374262323271535,0,5,4.436481990999803,1000,,0.6961524724813313,0.9747266050533779,oversample,0.7931684180190944,2.1602961447652635,,,,0.8682430803061771,0.8416419285494933,0.8431613431613432,0.6961524724813313,0.7158861340679522,0.7177597641857038,0.9747266050533779,0.8260389220657862,0.8197446533128809,0.6272932088831671,0.6302167583306373,0.8336184773310522,0.8335472828412495,oversample,0.9268569096307644,0.9255524812010333,0.7931684180190944,COMPLETE
2831,0.4847853272196749,2025-09-24 02:48:26.551644,2025-09-24 02:49:11.338404,0 days 00:00:44.786760,0.20188445790882678,dart,0.29943608895432106,0.5705689816716761,lossguide,0.014723021548945538,0.0018580987998171841,1,7,0.4398694823346122,800,forest,0.36889627475471676,0.7848297069485443,undersample,0.7177969776391679,1.6942712829944329,0.13620933162137688,weighted,0.4451636313485758,0.6623275858872226,0.494114034189784,0.49385749385749383,0.36889627475471676,0.48456403838130996,0.4847853272196749,0.7848297069485443,0.7558931500723546,0.7471293403884605,0.32041379310344825,0.3204298112687698,0.9935842600513259,0.9952931108258452,undersample,0.9023943864966302,0.9023004221925439,0.7177969776391679,COMPLETE
2832,0.7255340793489319,2025-09-24 02:49:11.491513,2025-09-24 02:49:12.509360,0 days 00:00:01.017847,0.00029803727926919167,gbtree,0.3338473977966595,0.15161368558250632,lossguide,0.003891288258748256,0.11385454325288384,1,5,0.26624304156648093,300,,0.68432938900046,0.9681876725923304,none,0.9068354432031267,3.9570794281298944,,,,0.6186765735862868,0.8615006653700481,0.8618959868959869,0.68432938900046,0.7262795872951648,0.7255340793489319,0.9681876725923304,0.8298330444325543,0.8223831830813573,0.6890595009596929,0.6916214119472459,0.7677502138579982,0.762943945228926,none,0.9287048487948261,0.9265658838089774,0.9068354432031267,COMPLETE
2833,0.7009009009009008,2025-09-24 02:49:12.665378,2025-09-24 02:49:13.490348,0 days 00:00:00.824970,0.01891126870840773,gbtree,0.5718850995390861,0.554007901490724,lossguide,0.0005969801506031368,0.3559208054730024,2,3,2.401819881683939,400,,0.6688603381971345,0.9521067967221343,none,0.7494738029259072,2.338491164505166,,,,0.6487553234673571,0.86651653188658,0.864045864045864,0.6688603381971345,0.7093178778421757,0.7009009009009008,0.9521067967221343,0.8123497886704814,0.8092407791833609,0.7406890130353817,0.7398953875416072,0.6804961505560307,0.6658108686350022,none,0.9202840642033312,0.9193087314720331,0.7494738029259072,COMPLETE
2834,0.6666666666666666,2025-09-24 02:49:13.644623,2025-09-24 02:49:14.542101,0 days 00:00:00.897478,0.005009610357378861,gbtree,0.9223657459452619,5.770540234177133,depthwise,27.94861228335978,0.20557538703857653,6,11,0.9430464413326164,900,,0.3415995305669005,0.7939348814700161,oversample,0.5361335375750751,0.5025572374644115,,,,0.7968648080824279,0.7951683898044836,0.8018018018018018,0.3415995305669005,0.6568341622363231,0.6666666666666666,0.7939348814700161,0.7406133789498889,0.7322077771656613,0.5482393358144861,0.5577643330452319,0.8190761334473909,0.8284124946512623,oversample,0.8937936745460576,0.8944146942053744,0.5361335375750751,COMPLETE
2835,0.7113617376775272,2025-09-24 02:49:14.695116,2025-09-24 02:49:15.601006,0 days 00:00:00.905890,0.0004189058860981609,gbtree,0.2797197527427348,0.07985820792553344,lossguide,0.0012238464121626744,0.21144828253238163,0,3,0.9420797457450107,500,,0.6823599543517563,0.9353196003469623,none,0.8174765095906121,3.5157935001252745,,,,0.512459722932194,0.8617053946156208,0.8585176085176085,0.6823599543517563,0.7206946454413893,0.7113617376775272,0.9353196003469623,0.8199392483615359,0.8101558420728603,0.6974789915966386,0.6948184414524684,0.7455089820359282,0.7287120239623449,none,0.9247868528471632,0.9212449011003931,0.8174765095906121,COMPLETE
2836,0.38612143742255267,2025-09-24 02:49:15.755580,2025-09-24 02:49:16.661328,0 days 00:00:00.905748,0.00214318307932028,gbtree,0.41870654019752185,8.648634279703929,depthwise,36.47728700558573,0.0001223218050325999,7,7,0.19935927917387894,300,,0.41708786258075853,0.9604991920750827,undersample,0.9565799759584306,2.262987523407017,,,,0.7117321095589442,0.23932848807452145,0.23925061425061425,0.41708786258075853,0.3862228462872718,0.38612143742255267,0.9604991920750827,0.7182166488985193,0.7134334931871419,0.23932848807452145,0.23925061425061425,1.0,1.0,undersample,0.8892597468423209,0.8879397200788404,0.9565799759584306,COMPLETE
2837,0.672784068723155,2025-09-24 02:49:16.813994,2025-09-24 02:49:17.502189,0 days 00:00:00.688195,0.00013132999962643386,gbtree,0.6763037690678033,7.404658920484166,depthwise,0.0189273303203298,0.2370070586825486,0,12,2.364336111740199,200,,0.6881672249790753,0.8975394649534175,none,0.9131994093795772,4.1222037483892064,,,,0.9195180145814812,0.8286416214556249,0.8284193284193284,0.6881672249790753,0.6760835913312694,0.672784068723155,0.8975394649534175,0.7525986658769708,0.7414808305973798,0.6173144876325088,0.6186714542190305,0.7472198460222412,0.7372700042789901,none,0.8990328357645399,0.8986473012850733,0.9131994093795772,COMPLETE
2838,0.38612143742255267,2025-09-24 02:49:17.657599,2025-09-24 02:49:24.065216,0 days 00:00:06.407617,0.7709220969915154,dart,0.9623945707233832,9.325085314373673,depthwise,23.57878087388124,0.0017095743694021126,3,9,13.63703634679903,300,tree,0.3569866716635083,0.7575513103295924,oversample,0.8822226446245724,1.188266769888984,0.49910056856857643,weighted,0.7171641455844577,0.9675126379215329,0.23932848807452145,0.23925061425061425,0.3569866716635083,0.3862228462872718,0.38612143742255267,0.7575513103295924,0.6670769822060483,0.662365995042496,0.23932848807452145,0.23925061425061425,1.0,1.0,oversample,0.8759335818241825,0.876929857095779,0.8822226446245724,COMPLETE
2839,0.6011716989634971,2025-09-24 02:49:24.222337,2025-09-24 02:49:24.905694,0 days 00:00:00.683357,0.0001806819747356258,gbtree,0.7816199057861555,9.235173916964339,depthwise,0.0001249454813746199,0.03456611971967158,0,11,87.17126386553744,200,,0.34228112031409685,0.6193568087942516,none,0.5706000675903702,2.1583271300599334,,,,0.21701434872081315,0.724639164704678,0.7281941031941032,0.34228112031409685,0.5998214817018744,0.6011716989634971,0.6193568087942516,0.6596926532584497,0.6467693783643517,0.45985401459854014,0.46319444444444446,0.8622754491017964,0.8562259306803595,none,0.8612511121709518,0.857835288188634,0.5706000675903702,COMPLETE
2840,0.7112937952632609,2025-09-24 02:49:25.058254,2025-09-24 02:50:33.478024,0 days 00:01:08.419770,0.00015928203635426545,dart,0.7385243401720227,3.4438902607505515,lossguide,0.11279482023705631,0.07003420705758454,0,6,0.7495822747389659,1000,forest,0.6442342976408358,0.9456902965919755,none,0.8346773105910202,3.796074066935785,0.20201703081362127,weighted,0.6536638530419798,0.8670054958138629,0.8493192752584706,0.848996723996724,0.6442342976408358,0.7125,0.7112937952632609,0.9456902965919755,0.8193769848301115,0.8118783140389803,0.6556434219985622,0.6554834054834054,0.7801539777587682,0.7774925117672229,none,0.9222581424612566,0.9201025702329353,0.8346773105910202,COMPLETE
2841,0.7109561387410535,2025-09-24 02:50:33.629249,2025-09-24 02:50:35.374007,0 days 00:00:01.744758,0.005189958478697445,gbtree,0.6165065573750417,4.482414716903749,depthwise,0.16391003680236174,0.005587945317938469,0,6,1.6422953024690643,1000,,0.6655517059444379,0.9440437207805739,none,0.7677315445291383,4.952880180419003,,,,0.865704893475828,0.8365236974101751,0.8387592137592138,0.6655517059444379,0.7105310857350009,0.7109561387410535,0.9440437207805739,0.8214140160191656,0.8138893729763894,0.6165460836741113,0.6224293059125964,0.8383233532934131,0.8288403936670946,none,0.9244156879159382,0.9225043269279769,0.7677315445291383,COMPLETE
2842,0.6575126262626263,2025-09-24 02:50:35.525767,2025-09-24 02:50:36.398364,0 days 00:00:00.872597,0.00013455282374815613,gbtree,0.48116458757373143,3.4614137225264296,depthwise,0.0004990088865673611,0.09890364564192879,5,12,99.27238077598095,900,,0.31083101871078267,0.8330158033756416,undersample,0.9104976057521721,0.6632522967277665,,,,0.7420013556927395,0.7742860067560651,0.7778460278460279,0.31083101871078267,0.6564885496183206,0.6575126262626263,0.8330158033756416,0.759070406785253,0.7565332655728589,0.516295025728988,0.5208802200550138,0.9011976047904192,0.8913136499786051,undersample,0.903292613112779,0.9024143788810558,0.9104976057521721,COMPLETE
2843,0.38612143742255267,2025-09-24 02:50:36.553633,2025-09-24 02:50:37.348772,0 days 00:00:00.795139,2.410933439603532,gbtree,0.8079122038322606,9.521518415420559,depthwise,19.498868008196794,0.00010307883026966077,2,3,1.4505060304745074,400,,0.36361195003973545,0.7797645807370408,oversample,0.856641209285968,1.7000319695131552,,,,0.25843950958227013,0.23932848807452145,0.23925061425061425,0.36361195003973545,0.3862228462872718,0.38612143742255267,0.7797645807370408,0.6575634190311953,0.6512915147168064,0.23932848807452145,0.23925061425061425,1.0,1.0,oversample,0.8595171097334715,0.8633277241766745,0.856641209285968,COMPLETE
2844,0.6647000983284169,2025-09-24 02:50:37.505810,2025-09-24 02:50:53.828146,0 days 00:00:16.322336,0.0005754776351404832,dart,0.6617872549538949,1.3895083489784987,lossguide,0.050231707749119996,0.020319439322762756,2,10,1.797769500866801,400,forest,0.6883522948997424,0.8539300853763122,none,0.9547167710979612,4.9310154513902145,0.13793437944145004,weighted,0.76175050541702,0.7768037629402259,0.8254683181492476,0.8254504504504504,0.6883522948997424,0.6693814233081249,0.6647000983284169,0.8539300853763122,0.7373968218773584,0.7343400687558881,0.6122738559772969,0.6149927219796215,0.7382378100940975,0.7231493367565255,none,0.8906532629417905,0.8932499347728959,0.9547167710979612,COMPLETE
2845,0.6580343213728549,2025-09-24 02:50:53.991603,2025-09-24 02:50:57.577369,0 days 00:00:03.585766,0.00022677196927609161,dart,0.3854139667994291,2.8129873504104403,lossguide,0.0002803179432734425,0.2481204329235943,2,9,0.11442167575454666,200,forest,0.6667750631747071,0.8520468991150444,undersample,0.7777415940636052,4.678113961702752,0.00011781007854114178,weighted,0.7234666134336497,0.7942075898283115,0.7774593100624424,0.7755937755937756,0.6667750631747071,0.6586055276381909,0.6580343213728549,0.8520468991150444,0.7949922780083787,0.7887604256583869,0.5203473945409429,0.517800147311564,0.8969204448246364,0.9024390243902439,undersample,0.912018687119676,0.909326753212712,0.7777415940636052,COMPLETE
2846,0.6765327695560254,2025-09-24 02:50:57.734023,2025-09-24 02:50:58.499208,0 days 00:00:00.765185,0.0004160205142952591,gbtree,0.404149433243425,2.075259751100282,lossguide,0.008127724554014218,0.020849123683965822,1,3,0.11608999157129633,300,,0.6709825415299666,0.9624558748479899,none,0.8435657516442135,2.5481107946077013,,,,0.5513913208429957,0.8594533729143208,0.859029484029484,0.6709825415299666,0.6800279655092053,0.6765327695560254,0.9624558748479899,0.7972122291761485,0.7920453183770075,0.7470558115719406,0.75,0.6240376390076989,0.6161745827984596,none,0.9136884832330838,0.9128308781972293,0.8435657516442135,COMPLETE
2847,0.4935532233883059,2025-09-24 02:50:58.662256,2025-09-24 02:51:13.908912,0 days 00:00:15.246656,0.000282584627555481,dart,0.6968936625260925,1.9829072087587787,lossguide,0.05717486321191534,0.002086638765205031,1,11,0.6256822207187881,400,tree,0.685591631388488,0.9855655681638579,none,0.9428780844752055,4.669117574373089,0.1264329336659774,uniform,0.4192630059670529,0.20435249064116975,0.8305865492885659,0.827088452088452,0.685591631388488,0.5078798691644365,0.4935532233883059,0.9855655681638579,0.759147186042064,0.7471697982093028,0.833170731707317,0.8246492985971944,0.3652694610778443,0.35216089002995293,none,0.9066815616129182,0.904994124522126,0.9428780844752055,COMPLETE
2848,0.6865844255975327,2025-09-24 02:51:14.069020,2025-09-24 02:51:16.450144,0 days 00:00:02.381124,0.09096045664271957,gbtree,0.43536801473644526,2.4426721743190303,lossguide,0.010545116124759021,0.004492558751014251,8,12,45.53245662234219,600,,0.41356715558010315,0.6498701329977346,none,0.8882093500006709,1.4311680242844638,,,,0.7065838320651137,0.8364213327873887,0.8335380835380836,0.41356715558010315,0.6970041714069017,0.6865844255975327,0.6498701329977346,0.7805787623539258,0.7705784614500866,0.6260217983651226,0.6246930901438091,0.786142001710864,0.7620881471972615,none,0.9103413796433895,0.9068873948412688,0.8882093500006709,COMPLETE
2849,0.7104477611940299,2025-09-24 02:51:16.605442,2025-09-24 02:51:17.312594,0 days 00:00:00.707152,0.08284536529108438,gbtree,0.7348131118248594,1.362812412045512,depthwise,0.0001982072489678078,0.08920219998182283,10,4,0.1693397008772412,200,,0.32330943232597004,0.8168372734874102,none,0.9351957189783435,0.7619946128823232,,,,0.5726735701357992,0.8612959361244754,0.8609746109746109,0.32330943232597004,0.7139539793118007,0.7104477611940299,0.8168372734874102,0.814602365892559,0.8086937413147754,0.7048770320967069,0.7080322991925202,0.723267750213858,0.7128797603765511,none,0.9203427737062929,0.919032304446666,0.9351957189783435,COMPLETE
2850,0.5911780527165142,2025-09-24 02:51:17.471312,2025-09-24 02:52:32.022196,0 days 00:01:14.550884,0.2543096860560546,dart,0.8689508302593696,6.3272111734307215,depthwise,5.045581739305486,0.0007422185918661394,0,11,11.796125624173614,1000,forest,0.5748982279926601,0.5776436007809024,oversample,0.984168436175431,0.6990560675195725,0.07458221411482416,weighted,0.6853067537102652,0.32274817765696356,0.8501381922407616,0.8443898443898444,0.5748982279926601,0.6106382978723405,0.5911780527165142,0.5776436007809024,0.7740987425171351,0.7657397370315411,0.8073136427566807,0.7958001448225923,0.49101796407185627,0.47026101839965767,oversample,0.9001482587624796,0.8982259955187784,0.984168436175431,COMPLETE
2851,0.6165235416049748,2025-09-24 02:52:32.173264,2025-09-24 02:52:33.370109,0 days 00:00:01.196845,0.073755261578704,gbtree,0.3068000983280814,5.944363275922527,lossguide,0.04403794501964227,0.0031058666261194164,7,4,96.60206384016564,800,,0.6652108128751788,0.7000791108735916,undersample,0.6074950222368761,2.528299534928894,,,,0.8356202753629498,0.7324188760364418,0.7348484848484849,0.6652108128751788,0.6182827102803738,0.6165235416049748,0.7000791108735916,0.7279806283690271,0.724628849811559,0.46940133037694015,0.47136065202626215,0.9054747647562019,0.8908857509627728,undersample,0.884957549000275,0.8809741966701269,0.6074950222368761,COMPLETE
2852,0.5683992759244892,2025-09-24 02:52:33.524228,2025-09-24 02:52:34.224280,0 days 00:00:00.700052,1.5259585461643153,gbtree,0.6924727051245475,5.763150700659906,depthwise,0.46520156335412466,0.02490086172252392,0,4,26.98554380892411,200,,0.30768915652258644,0.532752862825097,none,0.5283441891467652,3.5655709820300725,,,,0.5927984377827719,0.6547241273415908,0.6582719082719083,0.30768915652258644,0.5646056538014715,0.5683992759244892,0.532752862825097,0.6303981898547519,0.625555745032673,0.4043261231281198,0.4072632944228275,0.935414884516681,0.9405220367993153,none,0.8548806994120647,0.8565397002587836,0.5283441891467652,COMPLETE
2853,0.7037101550252569,2025-09-24 02:52:34.375735,2025-09-24 02:52:35.585155,0 days 00:00:01.209420,0.011202420226877823,gbtree,0.36222318152139726,1.0937097048374136,lossguide,7.347620073648612,0.11728916741448603,1,6,0.274412885493645,300,,0.6595199431364657,0.9047951940412438,oversample,0.9702840527992863,2.7896095813395543,,,,0.6252358348176776,0.8259801412631794,0.8258599508599509,0.6595199431364657,0.7058823529411765,0.7037101550252569,0.9047951940412438,0.8232305290352424,0.818890393640525,0.5926786751888437,0.5934195064629847,0.8725406330196749,0.8643560119811724,oversample,0.9263357764544732,0.9248609673696337,0.9702840527992863,COMPLETE
