number,value,datetime_start,datetime_complete,duration,params_alpha,params_booster,params_colsample_bytree,params_gamma,params_grow_policy,params_lambda,params_learning_rate,params_max_delta_step,params_max_depth,params_min_child_weight,params_n_estimators,params_normalize_type,params_params_decision_threshold,params_params_feature_fraction,params_params_resampling,params_params_sample_rows,params_params_scale_pos_weight,params_rate_drop,params_sample_type,params_skip_drop,params_subsample,user_attrs_acc_test,user_attrs_acc_val,user_attrs_decision_threshold,user_attrs_f1_test,user_attrs_f1_val,user_attrs_feature_fraction,user_attrs_pr_auc_test,user_attrs_pr_auc_val,user_attrs_prec_test,user_attrs_prec_val,user_attrs_rec_test,user_attrs_rec_val,user_attrs_resampling_strategy,user_attrs_roc_auc_test,user_attrs_roc_auc_val,user_attrs_sample_rows,state
978,0.5053730426773104,2025-09-23 15:48:58.246077,2025-09-23 15:49:37.524428,0 days 00:00:39.278351,0.08556662824359844,dart,0.2370859352468071,9.544009911143123,depthwise,0.5893676448977734,0.14826604875384947,1,9,0.12872845688222195,800,tree,0.6221246984119138,0.617287492153578,none,0.6801384235673558,0.8077927816258818,0.1345026376674064,uniform,0.4793587180507977,0.2691208110080641,0.8397993653393387,0.8350737100737101,0.6221246984119138,0.5235920852359208,0.5053730426773104,0.617287492153578,0.779795124014197,0.778424455197702,0.9081309398099261,0.8945652173913043,0.3678357570573139,0.35216089002995293,none,0.9020523460835408,0.9040135154129734,0.6801384235673558,COMPLETE
979,0.6585757629841157,2025-09-23 15:49:37.657936,2025-09-23 15:50:00.050189,0 days 00:00:22.392253,0.1191764227041107,dart,0.6923164226065723,8.732216976540116,lossguide,3.5455869707961383,0.3073954974126882,10,8,39.944637474720906,600,tree,0.6982381801011122,0.7473019514056816,oversample,0.7159794182452601,1.8278753777258563,0.2212340459406103,uniform,0.283747154448874,0.7280398007037692,0.7993653393387246,0.8041564291564292,0.6982381801011122,0.6568627450980392,0.6585757629841157,0.7473019514056816,0.700012100131963,0.687830506494675,0.5560165975103735,0.5649112063686467,0.8023952095808383,0.7894736842105263,oversample,0.8880551659815499,0.8851332127200541,0.7159794182452601,COMPLETE
980,0.38612143742255267,2025-09-23 15:50:00.180584,2025-09-23 15:50:01.845687,0 days 00:00:01.665103,0.0015782203612976836,gbtree,0.6676740797793919,9.143276074987757,lossguide,0.00514590938248652,0.000186542902211229,6,8,0.8117016669662076,700,,0.4578235174058728,0.5196621278884141,undersample,0.8798942552335531,3.1434219539483594,,,,0.20963926507238106,0.23932848807452145,0.23925061425061425,0.4578235174058728,0.3862228462872718,0.38612143742255267,0.5196621278884141,0.6410620439063321,0.6297691632834037,0.23932848807452145,0.23925061425061425,1.0,1.0,undersample,0.8653187022344951,0.8629054970829333,0.8798942552335531,COMPLETE
981,0.0,2025-09-23 15:50:01.978445,2025-09-23 15:50:38.477037,0 days 00:00:36.498592,18.453611386012195,dart,0.32944621783998485,2.2718150140503934,depthwise,0.007555092541840576,0.0008472107645507357,5,11,54.60312971865789,800,tree,0.6212788333855124,0.6917701918778372,undersample,0.6922223296243777,0.7598545407007008,0.38233317566138825,weighted,0.05480453346781524,0.41136337624083,0.7606715119254785,0.7607493857493858,0.6212788333855124,0.0,0.0,0.6917701918778372,0.6973951078561651,0.6913388323039034,0.0,0.0,0.0,0.0,undersample,0.87782656038635,0.8771891819804245,0.6922223296243777,COMPLETE
982,0.5256198347107438,2025-09-23 15:50:38.605772,2025-09-23 15:50:40.078961,0 days 00:00:01.473189,1.346902789714834,gbtree,0.7696942694422706,8.163703929566756,depthwise,0.03175832373233741,0.0029915824932139645,2,10,2.162724050796748,1000,,0.4245625434661457,0.5654701095774607,none,0.6958919979011147,0.6354530522234918,,,,0.5391984153117352,0.8245470365441704,0.8237100737100738,0.4245625434661457,0.5296377607025247,0.5256198347107438,0.5654701095774607,0.6840130925251274,0.6713269599062965,0.7388973966309341,0.7378190255220418,0.4127459366980325,0.40821566110397944,none,0.8687822175592296,0.8676956512250458,0.6958919979011147,COMPLETE
983,0.38612143742255267,2025-09-23 15:50:40.209397,2025-09-23 15:51:05.213608,0 days 00:00:25.004211,0.0005405607257166601,dart,0.8228876524736706,1.1876199329591663,depthwise,91.82327135022375,0.0002781088055800507,4,10,94.86625217434246,700,forest,0.6329616099034239,0.89901235392102,undersample,0.5223387978305014,2.6259330382926223,0.3398740762753652,uniform,0.24257560315900867,0.6823085549351839,0.23932848807452145,0.23925061425061425,0.6329616099034239,0.3862228462872718,0.38612143742255267,0.89901235392102,0.6376226697043614,0.6323692104084478,0.23932848807452145,0.23925061425061425,1.0,1.0,undersample,0.858266568541215,0.8574659510486059,0.5223387978305014,COMPLETE
984,0.0,2025-09-23 15:51:05.345354,2025-09-23 15:51:05.796757,0 days 00:00:00.451403,0.10959647885260167,gbtree,0.6498165637558242,5.541717517705013,depthwise,0.00289005791449672,0.00036716649247659785,10,8,32.10816196998909,200,,0.5709182713159184,0.9603315248103295,undersample,0.6207125196430228,0.5429119206905729,,,,0.6275906658103056,0.7606715119254785,0.7607493857493858,0.5709182713159184,0.0,0.0,0.9603315248103295,0.7285433943240454,0.726101065053,0.0,0.0,0.0,0.0,undersample,0.8853955391598716,0.8860687631587871,0.6207125196430228,COMPLETE
985,0.6011545173848839,2025-09-23 15:51:05.925640,2025-09-23 15:51:06.361611,0 days 00:00:00.435971,0.00012384616374560024,gbtree,0.8161977120758264,3.5838354029986466,lossguide,1.9704836943200181,0.19021719051193375,6,7,2.687553671320713,300,,0.36697311941738703,0.7853544643666729,undersample,0.5438559204210828,3.977713793267227,,,,0.796405760491038,0.6907564745623912,0.6958435708435708,0.36697311941738703,0.5990710019907101,0.6011545173848839,0.7853544643666729,0.8007441099242806,0.8012668320363386,0.43428901289205313,0.4379890453834116,0.9653550042771599,0.9580658964484382,undersample,0.9146959555714109,0.9147999564903113,0.5438559204210828,COMPLETE
986,0.38612143742255267,2025-09-23 15:51:06.491327,2025-09-23 15:51:10.057787,0 days 00:00:03.566460,1.0905638665960513,dart,0.6415954788027944,7.015370212366172,lossguide,0.2611575722724482,0.0018812875863890581,2,12,25.28635730492132,200,forest,0.40206837592337524,0.7065837261600245,oversample,0.656372358677963,3.3402954615440876,0.052965854122153155,weighted,0.1127295377242952,0.2925276967406819,0.23932848807452145,0.23925061425061425,0.40206837592337524,0.3862228462872718,0.38612143742255267,0.7065837261600245,0.7432625769594551,0.7388004412545567,0.23932848807452145,0.23925061425061425,1.0,1.0,oversample,0.8955855231114562,0.8923909984696174,0.656372358677963,COMPLETE
987,0.6242326332794831,2025-09-23 15:51:10.186226,2025-09-23 15:51:11.412763,0 days 00:00:01.226537,0.020677297637529367,gbtree,0.7169500676076586,2.348784534617674,lossguide,0.006185173406971274,0.001500121360206756,10,7,1.3134745521289122,300,,0.6723746477662192,0.6702879708625664,undersample,0.5666367727358332,1.943525493779343,,,,0.7310899179389823,0.763332992117924,0.7618755118755118,0.6723746477662192,0.6280566280566281,0.6242326332794831,0.6702879708625664,0.6654778101164632,0.6604111992481666,0.5033522434244456,0.5014274591227614,0.834901625320787,0.8267008985879333,undersample,0.871105012997248,0.8681876976643256,0.5666367727358332,COMPLETE
988,0.5475649156395835,2025-09-23 15:51:11.542205,2025-09-23 15:51:12.390477,0 days 00:00:00.848272,0.14145802189629753,gbtree,0.9737301027037588,1.8658660719871767,lossguide,0.01816527003987051,0.004412327069876211,0,4,0.18143055015437815,600,,0.41137785641226476,0.849200233725334,undersample,0.834145438097718,3.1683783364345066,,,,0.7036037594040663,0.6094789640700174,0.612919737919738,0.41137785641226476,0.5456710730022627,0.5475649156395835,0.849200233725334,0.7207787592784457,0.712620333261698,0.37811520052813996,0.38006644518272426,0.9798973481608212,0.979032948224219,undersample,0.8896506542828755,0.8905312414363333,0.834145438097718,COMPLETE
989,0.40638803941556234,2025-09-23 15:51:12.520604,2025-09-23 15:52:10.402742,0 days 00:00:57.882138,0.30192783752726476,dart,0.5756997454676338,9.327892206045211,lossguide,2.635314935441614,0.09806338962287144,10,7,4.198774754431654,1000,forest,0.6615743698508405,0.7339226476147389,none,0.916385070504429,0.5259918166321602,0.19738455618398942,uniform,0.08493462217701887,0.5254556458638314,0.8213737332377931,0.8211506961506961,0.6615743698508405,0.40827399118345203,0.40638803941556234,0.7339226476147389,0.8007292695588558,0.7945072861796632,0.9852700490998363,0.9867986798679867,0.25748502994011974,0.2558836114676936,none,0.9123236599642287,0.910846482835353,0.916385070504429,COMPLETE
990,0.2967509025270758,2025-09-23 15:52:10.533905,2025-09-23 15:52:18.125040,0 days 00:00:07.591135,6.287288903207844,dart,0.6612795353120082,2.217884680591,lossguide,0.49965868877814407,0.001559014382431128,3,8,0.2251513374251889,300,forest,0.6356060880540993,0.8056613748153534,oversample,0.885604815068836,0.9462407311272263,0.2746760670160611,uniform,0.5828938342881903,0.6858718419927727,0.80202681953117,0.8005733005733006,0.6356060880540993,0.30581478822684854,0.2967509025270758,0.8056613748153534,0.7715208325255142,0.762335515684684,0.9508928571428571,0.9491916859122402,0.1822070145423439,0.17586649550706032,oversample,0.9068430990835677,0.9035501452904591,0.885604815068836,COMPLETE
991,0.38612143742255267,2025-09-23 15:52:18.257590,2025-09-23 15:52:23.518181,0 days 00:00:05.260591,0.00011762684095284679,gbtree,0.47555839061761235,0.19873612422435905,lossguide,0.0045985324783270175,0.0005544941215236972,8,11,3.5651503947922207,400,,0.32376270774195065,0.7517057870035393,none,0.8779579058259068,4.681454673978931,,,,0.24381431030358316,0.23932848807452145,0.23925061425061425,0.32376270774195065,0.3862228462872718,0.38612143742255267,0.7517057870035393,0.7701291790117066,0.7621326615258415,0.23932848807452145,0.23925061425061425,1.0,1.0,none,0.9071477553572709,0.9050894531213337,0.8779579058259068,COMPLETE
992,0.0,2025-09-23 15:52:23.648258,2025-09-23 15:52:34.576569,0 days 00:00:10.928311,0.05982714299579379,dart,0.31377585420601967,7.420825398325048,depthwise,0.002844249096760402,0.00011386299227940125,6,6,54.99928921923398,400,tree,0.39584316975373984,0.6039126406231463,undersample,0.593541194949287,0.5205911473749941,0.007434315241416578,weighted,0.40868708971155404,0.30090907047423293,0.7606715119254785,0.7607493857493858,0.39584316975373984,0.0,0.0,0.6039126406231463,0.573127950053582,0.5624783631694777,0.0,0.0,0.0,0.0,undersample,0.8243412822546844,0.8179746896378937,0.593541194949287,COMPLETE
993,0.6316091954022989,2025-09-23 15:52:34.706902,2025-09-23 15:52:35.633749,0 days 00:00:00.926847,0.0485228102255481,gbtree,0.3210719717210204,3.3070609637440382,depthwise,0.011916859893328708,0.004394307371652819,7,9,2.3976233429398506,300,,0.6299035793305637,0.928469285993518,oversample,0.8463183353376946,3.425289020670632,,,,0.8946714471956847,0.7335448868870919,0.7375102375102375,0.6299035793305637,0.6287262872628726,0.6316091954022989,0.928469285993518,0.7585066901124344,0.7514645259021362,0.4716456237962765,0.4754488427428077,0.9426860564585116,0.9405220367993153,oversample,0.9051067943126377,0.9033218288326775,0.8463183353376946,COMPLETE
994,0.0,2025-09-23 15:52:35.763807,2025-09-23 15:52:49.581864,0 days 00:00:13.818057,1.0409975609866495,dart,0.38578909518888804,9.622798302424926,lossguide,0.16411799806786373,0.0005141253752179779,2,4,23.962228044289656,500,forest,0.6054463648299411,0.8135903012905523,undersample,0.889645600101037,0.7113674710696265,0.21848881767595785,weighted,0.01789565470756409,0.6304149690764391,0.7606715119254785,0.7607493857493858,0.6054463648299411,0.0,0.0,0.8135903012905523,0.7340960063144095,0.7277675164108511,0.0,0.0,0.0,0.0,undersample,0.889165322391724,0.8874800064746287,0.889645600101037,COMPLETE
995,0.0,2025-09-23 15:52:49.714568,2025-09-23 15:53:42.858426,0 days 00:00:53.143858,4.527019205258212,dart,0.5161931682274132,5.767788502660584,depthwise,62.487315627458806,0.0004941556584971498,9,4,0.1669623857646871,900,forest,0.5055490827563353,0.8739362253683927,oversample,0.5940114231875222,0.6072019379467984,0.17707539070357287,uniform,0.7015231120541771,0.41734286363185524,0.7606715119254785,0.7607493857493858,0.5055490827563353,0.0,0.0,0.8739362253683927,0.6770660319980396,0.6662707875635299,0.0,0.0,0.0,0.0,oversample,0.8707612746132396,0.871708406542876,0.5940114231875222,COMPLETE
996,0.38612143742255267,2025-09-23 15:53:42.987690,2025-09-23 15:53:44.134139,0 days 00:00:01.146449,0.04011630393264368,gbtree,0.3062564893775296,2.909712215917545,depthwise,0.0968636071128347,0.0007207294333341117,4,11,13.138169866817396,500,,0.31324439247579844,0.8156162833976741,oversample,0.503507818151584,1.3166617341720812,,,,0.8462844909231937,0.23932848807452145,0.23925061425061425,0.31324439247579844,0.3862228462872718,0.38612143742255267,0.8156162833976741,0.6925404233754705,0.6833779230008095,0.23932848807452145,0.23925061425061425,1.0,1.0,oversample,0.8821203547113052,0.8798640258888406,0.503507818151584,COMPLETE
997,0.567679040119985,2025-09-23 15:53:44.265299,2025-09-23 15:53:44.677353,0 days 00:00:00.412054,0.005734503757927907,gbtree,0.36138088917812267,1.1792122551802386,lossguide,1.3412689501003179,0.0039311089807268,6,3,88.72229833338878,300,,0.4226247448657002,0.9996990413664686,undersample,0.8694409211165817,1.5533467515864239,,,,0.6599106591843549,0.6398812570375678,0.6458845208845209,0.4226247448657002,0.5641724479682855,0.567679040119985,0.9996990413664686,0.7225290639968905,0.7160383878011278,0.39710498779211717,0.4009533898305085,0.9739093242087254,0.9717586649550706,undersample,0.8854058708812262,0.8829309234171321,0.8694409211165817,COMPLETE
998,0.6774847870182555,2025-09-23 15:53:44.812722,2025-09-23 15:53:45.438281,0 days 00:00:00.625559,7.948447985170702,gbtree,0.594487019395469,1.7323478429028683,lossguide,0.00019359901387151461,0.059743730820127516,9,6,1.5154354413818356,600,,0.30385748271929053,0.5555800723226121,none,0.7567880150431766,1.0059246724515902,,,,0.3097449545165614,0.8150271266250384,0.8209459459459459,0.30385748271929053,0.6736499909698392,0.6774847870182555,0.5555800723226121,0.7690117892414161,0.7594915641739834,0.5829946858393248,0.5952689565780946,0.7976903336184773,0.7860504920838682,none,0.9014124700595925,0.8982344026317257,0.7567880150431766,COMPLETE
999,0.6335531135531135,2025-09-23 15:53:45.568675,2025-09-23 15:54:41.280429,0 days 00:00:55.711754,0.5133270452570127,dart,0.20844687967271114,2.357650707472173,depthwise,0.39688073690051967,0.03141896176982621,9,6,3.991417429466205,1000,forest,0.48606852946365253,0.5667553510045963,none,0.664889995910009,4.169717593529945,0.43779893061882513,weighted,0.3834635942743911,0.30595615259148884,0.7399938581226329,0.743959868959869,0.48606852946365253,0.6323103647944412,0.6335531135531135,0.5667553510045963,0.749856825075663,0.7425174895257862,0.47789934354485775,0.48172905525846704,0.9341317365269461,0.9251176722293539,none,0.9012301540295614,0.9001089872785986,0.664889995910009,COMPLETE
1000,0.6844262295081968,2025-09-23 16:11:55.870688,2025-09-23 16:11:57.282842,0 days 00:00:01.412154,0.004874489797080916,gbtree,0.6181057006914824,0.2444996915432468,lossguide,8.138190083661694,0.4212572659892921,1,5,4.750886124500905,600,,0.5103741888675837,0.8218612115941804,oversample,0.9185526805067836,0.6829639418929396,,,,0.3132510093212233,0.8416419285494933,0.8423423423423423,0.5103741888675837,0.6857607150111721,0.6844262295081968,0.8218612115941804,0.7825202510703175,0.7825051020715786,0.6529980657640232,0.656704679512387,0.7219846022241232,0.7145913564398801,oversample,0.9048026560639606,0.9051304234012103,0.9185526805067836,COMPLETE
1001,0.6995618212992951,2025-09-23 16:11:57.417902,2025-09-23 16:11:58.240947,0 days 00:00:00.823045,0.0003630586514399698,gbtree,0.5303595367397219,0.7688940498454245,depthwise,1.6740168250436536,0.37706946137536745,3,11,58.30540270626938,1000,,0.6355178915032628,0.8316510947050995,undersample,0.8982988563920051,1.1497011770011465,,,,0.9525168291156686,0.839594636093766,0.8385544635544635,0.6355178915032628,0.7033882263865228,0.6995618212992951,0.8316510947050995,0.795127661877468,0.790310796972587,0.630899830220713,0.6304945054945055,0.7946963216424294,0.785622593068036,undersample,0.9160498139772132,0.9137821775769975,0.8982988563920051,COMPLETE
1002,0.7144266824551017,2025-09-23 16:11:58.374743,2025-09-23 16:13:24.021660,0 days 00:01:25.646917,0.0009596414826179933,dart,0.9182767969728383,0.013495258594524752,lossguide,0.10984002211977915,0.0033302800457361797,4,10,2.9175273154125874,1000,forest,0.6971800466236828,0.8599107529539963,oversample,0.922140850590961,1.5060923316978763,0.15439290848911233,weighted,0.7867424834851342,0.6543595759467334,0.8508547446002661,0.8518632268632269,0.6971800466236828,0.7129064039408867,0.7144266824551017,0.8599107529539963,0.8186405276118138,0.8129577138618767,0.6609426379247351,0.663003663003663,0.7737382378100941,0.7744972186563971,oversample,0.9224979017108526,0.9209874188706402,0.922140850590961,COMPLETE
1003,0.7163961335035565,2025-09-23 16:13:24.161290,2025-09-23 16:13:28.505737,0 days 00:00:04.344447,0.06745740253459459,gbtree,0.7465635364832042,0.8224896436411574,lossguide,0.013667574433466367,0.019232354483232073,10,11,0.553311827130226,400,,0.37368662956415544,0.9071665026252508,none,0.9711920334646786,1.6714547592258309,,,,0.7032878259514698,0.8377520728836114,0.8408067158067158,0.37368662956415544,0.7119752862075232,0.7163961335035565,0.9071665026252508,0.8276556265839963,0.8237250953023743,0.6189573459715639,0.6242848061029879,0.8378956372968349,0.8403936670945656,none,0.9275002967132233,0.9259562529543661,0.9711920334646786,COMPLETE
1004,0.7050300144897537,2025-09-23 16:13:28.637744,2025-09-23 16:13:36.936886,0 days 00:00:08.299142,0.02266625055594267,gbtree,0.8002347344242873,0.9375825586342967,lossguide,0.22693337838328972,0.02198738760087556,10,12,0.16111664201938278,500,,0.49813739430164883,0.9052638588538259,none,0.9713916739903651,1.7757220823250708,,,,0.8569724795395676,0.8558706111167981,0.8541154791154791,0.49813739430164883,0.7102880658436214,0.7050300144897537,0.9052638588538259,0.8074237474710053,0.792454967242791,0.6843774781919112,0.6828388131515638,0.7382378100940975,0.7287120239623449,none,0.9201059787110134,0.9137628872835909,0.9713916739903651,COMPLETE
1005,0.7148260211800302,2025-09-23 16:13:37.070544,2025-09-23 16:14:45.321191,0 days 00:01:08.250647,0.0004228135925839281,dart,0.8655767781487488,0.2873321789723675,lossguide,0.1045918742918904,0.015694613810732942,5,11,3.0953444751915073,900,forest,0.6099822046795186,0.9118203057287712,oversample,0.8699198892440091,1.7051374491512614,0.1262160843842225,weighted,0.7783011902502485,0.7528289495558638,0.8407206469444161,0.8456183456183456,0.6099822046795186,0.7069679849340866,0.7148260211800302,0.9118203057287712,0.8216200178930486,0.8148796609570432,0.6315612382234186,0.6404608607251779,0.8028229255774166,0.8087291399229781,oversample,0.9239968359031404,0.9222674018168693,0.8699198892440091,COMPLETE
1006,0.6837886471454278,2025-09-23 16:14:45.453684,2025-09-23 16:15:53.106475,0 days 00:01:07.652791,0.024720485790685465,dart,0.9863417466437584,0.2917220628598459,lossguide,0.689761584853236,0.002919878139163181,5,11,6.809969864277044,900,forest,0.627493054027912,0.853562620817855,oversample,0.91085877380599,2.523102149369815,0.1500623071252393,weighted,0.7465653182753387,0.6564951070526257,0.7951683898044836,0.8021089271089271,0.627493054027912,0.676056338028169,0.6837886471454278,0.853562620817855,0.8128788976972667,0.8080927822507491,0.5438916384475124,0.5534957627118644,0.893071000855432,0.8943089430894309,oversample,0.9205475662666247,0.9180681640656152,0.91085877380599,COMPLETE
1007,0.711802748585287,2025-09-23 16:15:53.240407,2025-09-23 16:15:56.773558,0 days 00:00:03.533151,0.01387445875783614,dart,0.9241907952114806,3.565902737773402,depthwise,0.0018527027803976956,0.07101733967068481,0,9,17.607512276189095,200,forest,0.6342671427255265,0.9668652048044472,none,0.8533151851105198,3.220339779086996,0.1416952996047498,weighted,0.8839488484043599,0.6551680694385872,0.8542327771522162,0.854013104013104,0.6342671427255265,0.7137112987535182,0.711802748585287,0.9668652048044472,0.8188697326292023,0.8101609949521772,0.6733687405159332,0.6744542320949828,0.7591958939264328,0.7535301668806161,none,0.9239163117907447,0.9203576627696244,0.8533151851105198,COMPLETE
1008,0.6975601193610672,2025-09-23 16:15:56.904577,2025-09-23 16:16:00.597777,0 days 00:00:03.693200,0.00012026931314365083,dart,0.900953345048904,0.8103931495580399,depthwise,0.0005796461019627843,0.14680222998041811,9,11,29.89703456741298,200,forest,0.44745477834212044,0.9946186490237855,none,0.7282930668123208,3.127191123665197,0.10645575576811961,weighted,0.8381682459529878,0.9504166789845588,0.8218855563517249,0.8236076986076986,0.44745477834212044,0.6979166666666666,0.6975601193610672,0.9946186490237855,0.8157133985107026,0.812145404240262,0.587375803623612,0.5913690476190476,0.8597091531223268,0.8502353444587077,none,0.9235924885910742,0.9204970999203224,0.7282930668123208,COMPLETE
1009,0.6963297108878409,2025-09-23 16:16:00.728170,2025-09-23 16:17:10.502726,0 days 00:01:09.774556,0.0025866574368791258,dart,0.6722028323713062,8.167987886964287,lossguide,12.450913155558089,0.011831912250111444,5,10,0.24244873496733668,1000,forest,0.6334098534901843,0.7389296820425859,none,0.5849343535054451,2.8252994960218896,0.129988957694727,weighted,0.7484570826681697,0.7869494329982469,0.8522878493192753,0.8483824733824734,0.6334098534901843,0.7068860450944546,0.6963297108878409,0.7389296820425859,0.8006005417142517,0.7900586592810922,0.6731141199226306,0.668503937007874,0.7442258340461934,0.7265725288831836,none,0.9181744648427351,0.9138919307090358,0.5849343535054451,COMPLETE
