number,value,datetime_start,datetime_complete,duration,params_alpha,params_booster,params_colsample_bytree,params_gamma,params_grow_policy,params_lambda,params_learning_rate,params_max_delta_step,params_max_depth,params_min_child_weight,params_n_estimators,params_normalize_type,params_params_decision_threshold,params_params_feature_fraction,params_params_resampling,params_params_sample_rows,params_params_scale_pos_weight,params_rate_drop,params_sample_type,params_skip_drop,params_subsample,user_attrs_acc_test,user_attrs_acc_val,user_attrs_decision_threshold,user_attrs_f1_test,user_attrs_f1_val,user_attrs_feature_fraction,user_attrs_pr_auc_test,user_attrs_pr_auc_val,user_attrs_prec_test,user_attrs_prec_val,user_attrs_rec_test,user_attrs_rec_val,user_attrs_resampling_strategy,user_attrs_roc_auc_test,user_attrs_roc_auc_val,user_attrs_sample_rows,state
2080,0.6899347787766614,2025-09-23 23:35:46.565534,2025-09-23 23:35:58.421396,0 days 00:00:11.855862,0.0032283666507203477,dart,0.7274051318282918,2.6531712697153713,lossguide,1.8900173874587671,0.013160976619244534,5,6,0.30827826155284854,400,tree,0.6027786667045018,0.920279896010687,none,0.9077438003162311,4.385133797516642,0.19411508709946543,weighted,0.5729448222082412,0.6867581003573191,0.8192240761592794,0.8199221949221949,0.6027786667045018,0.693721817551162,0.6899347787766614,0.920279896010687,0.798295879162228,0.7871980358614747,0.5834305717619603,0.5866306954436451,0.8554319931565441,0.8373983739837398,none,0.9161406410317954,0.9121500460059102,0.9077438003162311,COMPLETE
2081,0.7041742286751361,2025-09-23 23:35:58.564224,2025-09-23 23:35:59.520948,0 days 00:00:00.956724,0.25538956749082714,gbtree,0.37450708644684594,1.081652316384848,depthwise,94.06699208997873,0.3558227356029378,3,7,0.2504722675084983,400,,0.580610675316234,0.9990521056163516,none,0.9568755946631567,4.977613488472804,,,,0.7822098097175874,0.8291534445695568,0.8331285831285832,0.580610675316234,0.7009496506002508,0.7041742286751361,0.9990521056163516,0.8122440509306667,0.8088960909900711,0.603145235892692,0.6114087614245194,0.8366124893071001,0.8301240907145914,none,0.921681091361311,0.9203573748547973,0.9568755946631567,COMPLETE
2082,0.7187141216991964,2025-09-23 23:35:59.663727,2025-09-23 23:36:38.094188,0 days 00:00:38.430461,0.7003078037937038,dart,0.6383228807370416,1.5097687642642394,lossguide,0.00885433868577272,0.026061674419688475,8,10,0.9725880689518182,700,forest,0.4469863677458073,0.9690136256520681,none,0.7231635193498556,1.9013258026977609,0.16658955178839108,weighted,0.6456919478914,0.5405488152542381,0.8483979936533934,0.8495085995085995,0.4469863677458073,0.7180658671235485,0.7187141216991964,0.9690136256520681,0.8229726993790334,0.8189664086429612,0.6469982847341338,0.6500519210799585,0.806672369546621,0.803594351732991,none,0.9254534359391258,0.9243862246114546,0.7231635193498556,COMPLETE
2083,0.7221505376344086,2025-09-23 23:36:38.235779,2025-09-23 23:36:39.074045,0 days 00:00:00.838266,0.025425956343804557,gbtree,0.4123937244277105,1.4600722722722905,depthwise,0.3832441233406661,0.0337921361688445,3,6,0.3746476550457074,300,,0.6893054431097213,0.9895469678282274,none,0.9297038526235694,3.3437744258436424,,,,0.7557398143067087,0.8685638243423073,0.8677313677313677,0.6893054431097213,0.7250535331905782,0.7221505376344086,0.9895469678282274,0.8301462210050661,0.8224338347236776,0.7259862778730704,0.7258971033290099,0.7241231822070145,0.7184424475823705,none,0.9287687097688814,0.9267530860294685,0.9297038526235694,COMPLETE
2084,0.7141989062183512,2025-09-23 23:36:39.216414,2025-09-23 23:36:40.430261,0 days 00:00:01.213847,0.007100828671992608,gbtree,0.44500571241007336,0.584989586284501,depthwise,10.158900248023338,0.08995833340876723,3,8,4.186471695242534,500,,0.6572071524099113,0.9281140361221825,none,0.920851902872897,3.7085507345717716,,,,0.5642176323186379,0.8534138601699253,0.8555487305487306,0.6572071524099113,0.7103559870550162,0.7141989062183512,0.9281140361221825,0.8117210971681335,0.8073777172997156,0.6738296239447429,0.678076923076923,0.7510692899914457,0.7543859649122807,none,0.9199581689035564,0.9180064063352317,0.920851902872897,COMPLETE
2085,0.6631837738168408,2025-09-23 23:36:40.573539,2025-09-23 23:37:00.145258,0 days 00:00:19.571719,0.04904319971247752,dart,0.6416552214269584,2.461252614854531,lossguide,0.012692613597256255,0.006125432375341685,3,8,2.797211310097936,500,forest,0.6638049968044688,0.9941402331001028,undersample,0.9857703374226051,3.8816730151948278,0.24005004177948863,weighted,0.6798619760796174,0.8141159639502455,0.7743883713788514,0.7755937755937756,0.6638049968044688,0.6629969418960244,0.6631837738168408,0.9941402331001028,0.8062491546600974,0.7970714274070201,0.5159447881960971,0.5173819228002877,0.9272882805816938,0.9234060761660248,undersample,0.9201082234861265,0.9172634133327715,0.9857703374226051,COMPLETE
2086,0.7015120403210753,2025-09-23 23:37:00.289335,2025-09-23 23:37:01.692534,0 days 00:00:01.403199,0.00012821754742198626,gbtree,0.399953462639156,1.1627886162344345,depthwise,0.7556909072726885,0.013144498811729381,3,9,0.3644652912625686,400,,0.6609276549660583,0.9030666383055193,none,0.9312902375941849,4.78903427369043,,,,0.8458140008090286,0.8380591667519706,0.8363022113022113,0.6609276549660583,0.706819866567828,0.7015120403210753,0.9030666383055193,0.8027647599285843,0.7897003546717276,0.6236102027468934,0.6221854304635761,0.8156544054747648,0.8040222507488233,none,0.9195428567284372,0.9148943349705898,0.9312902375941849,COMPLETE
2087,0.7061199757624722,2025-09-23 23:37:01.835577,2025-09-23 23:37:21.733649,0 days 00:00:19.898072,0.0024999457759812558,dart,0.43344774098906186,1.155100005052823,lossguide,0.001774833381685678,0.004924637462325301,8,8,2.831260776122251,500,forest,0.4833842080997833,0.9879394890450353,none,0.8444042613354007,1.8295323474078264,0.1639726516607532,weighted,0.6589089528489332,0.4832986501109054,0.8543351417750026,0.851044226044226,0.4833842080997833,0.7132782591174692,0.7061199757624722,0.9879394890450353,0.8100983202193591,0.8012686782214423,0.6742857142857143,0.6687069625095639,0.7570573139435415,0.7479674796747967,none,0.919861010431988,0.9175259916549615,0.8444042613354007,COMPLETE
2088,0.6999401078059493,2025-09-23 23:37:21.875388,2025-09-23 23:37:25.281341,0 days 00:00:03.405953,0.00012927826924263348,dart,0.9384286809388982,6.552499879970668,depthwise,0.00011056991337743248,0.24076721690289965,3,10,3.3181251246556305,200,forest,0.5040951420848293,0.9508274050653025,none,0.9967366552123752,1.8438235778279302,0.2270401735661223,weighted,0.5299611378066998,0.4217276329520004,0.8479885351622479,0.8461302211302212,0.5040951420848293,0.7075044317510341,0.6999401078059493,0.9508274050653025,0.802395035199909,0.7915844370636413,0.655713764147499,0.656062874251497,0.7681779298545766,0.750106974753958,none,0.918179069509634,0.9138580431339022,0.9967366552123752,COMPLETE
2089,0.6750972762645915,2025-09-23 23:37:25.425171,2025-09-23 23:37:43.091103,0 days 00:00:17.665932,0.00023542747325523857,dart,0.23317901891896523,2.009338256416246,depthwise,0.0028845973270756305,0.029485499803892368,0,6,0.39411051812316095,500,forest,0.6452545473414621,0.9463273326827938,none,0.9937620613804896,3.4489812744573025,0.12953989959741313,weighted,0.6558681050522279,0.7743635568290481,0.8289487153239841,0.829033579033579,0.6452545473414621,0.6758486905916585,0.6750972762645915,0.9463273326827938,0.7466866080619521,0.7433065178763282,0.6183883564075258,0.6189796646450232,0.7450812660393499,0.7424047924689773,none,0.8964279756997914,0.8987526205287762,0.9937620613804896,COMPLETE
2090,0.6985507246376812,2025-09-23 23:37:43.232607,2025-09-23 23:37:44.778079,0 days 00:00:01.545472,0.006401155541145064,gbtree,0.4034162813058395,1.894896124735239,depthwise,0.07109704012677791,0.01083572174755367,2,6,1.0944658510629492,1000,,0.6251088626469198,0.8641431594765085,none,0.9270993263661381,4.661647058507773,,,,0.8284397742185771,0.8302794554202068,0.8296478296478297,0.6251088626469198,0.7029738445001792,0.6985507246376812,0.8641431594765085,0.8195624600649849,0.813081127459959,0.6048088779284834,0.6057178762174049,0.8391787852865698,0.8249893025246042,none,0.9219294555821744,0.9217715836933564,0.9270993263661381,COMPLETE
2091,0.6741657292838396,2025-09-23 23:37:44.922524,2025-09-23 23:37:48.784516,0 days 00:00:03.861992,0.0003422840393869976,gbtree,0.7889992990651986,3.07667241949998,lossguide,0.0004317955972261093,0.01969764892956392,1,12,0.16904664694154117,400,,0.6040101078541322,0.8111560138455222,none,0.91295791549097,3.3959671126728987,,,,0.7692096915879154,0.8195311700276384,0.8220720720720721,0.6040101078541322,0.6718779080588125,0.6741657292838396,0.8111560138455222,0.7492197618720051,0.7447574071969731,0.5947281713344317,0.5999332665999333,0.7720273738237811,0.76936243046641,none,0.8984055937953956,0.8985002055999779,0.91295791549097,COMPLETE
2092,0.7009680889207601,2025-09-23 23:37:48.928746,2025-09-23 23:38:01.870211,0 days 00:00:12.941465,0.00010481914395958503,dart,0.547342864730088,1.6782987121769664,lossguide,0.05160235131341017,0.010876137534252883,6,12,0.8856295109234978,300,forest,0.5506642938115699,0.9630677145197245,none,0.9884344268413817,3.6610269026116984,0.19241819982867714,weighted,0.6726838100541596,0.9337620542967433,0.8262872351315386,0.8292383292383292,0.5506642938115699,0.697773820124666,0.7009680889207601,0.9630677145197245,0.8111019120369678,0.8074898673905615,0.5978028684772658,0.6032088861462511,0.8378956372968349,0.8365425759520753,none,0.9195673190213379,0.918952494456632,0.9884344268413817,COMPLETE
2093,0.7245173344405231,2025-09-23 23:38:02.011674,2025-09-23 23:38:03.702335,0 days 00:00:01.690661,0.00015540994982475595,gbtree,0.26113262442976803,0.5555938594266532,lossguide,0.0021938223648702137,0.04960678448569493,1,7,0.15117585847224452,400,,0.6683052663233718,0.9183234538952543,none,0.830810992345149,3.4732512481261626,,,,0.6089498415240211,0.8638550516941345,0.8641482391482391,0.6683052663233718,0.7249793217535153,0.7245173344405231,0.9183234538952543,0.8295346176766292,0.8226683980938272,0.7017614091273019,0.7036290322580645,0.7497861420017109,0.7466837826273,none,0.9284462391901129,0.9261548278105222,0.830810992345149,COMPLETE
2094,0.0,2025-09-23 23:38:03.845206,2025-09-23 23:38:04.632465,0 days 00:00:00.787259,0.0034366573973376763,gbtree,0.5167034379282469,0.18968431961879165,depthwise,72.75485178563206,0.0012011705942738648,5,4,0.5353964302419607,400,,0.6366407594324923,0.8517611237723715,none,0.926675854939789,2.032120377555163,,,,0.7017457289385465,0.7606715119254785,0.7607493857493858,0.6366407594324923,0.0,0.0,0.8517611237723715,0.7143477562175018,0.7085376521618292,0.0,0.0,0.0,0.0,none,0.8858267949941285,0.8848321689769816,0.926675854939789,COMPLETE
2095,0.6998974358974359,2025-09-23 23:38:04.778272,2025-09-23 23:38:05.818140,0 days 00:00:01.039868,0.001255665041064018,gbtree,0.4375727495189966,0.6877067099709372,lossguide,0.0008008232568379465,0.2034437764559743,0,7,0.2571262827629214,200,,0.669267698657358,0.9111902546458585,none,0.7832098601050184,3.8749329087506426,,,,0.31982328393125214,0.8534138601699253,0.8502252252252253,0.669267698657358,0.7069177241097012,0.6998974358974359,0.9111902546458585,0.8024038465233295,0.7952456020288827,0.6777864992150706,0.6721828211189913,0.7386655260906758,0.7299957210098417,none,0.9147080428220208,0.9121674072699759,0.7832098601050184,COMPLETE
2096,0.7272727272727273,2025-09-23 23:38:05.960287,2025-09-23 23:38:07.437607,0 days 00:00:01.477320,0.00021822308581350162,gbtree,0.38315053499176704,0.48043839003694,lossguide,0.0005036043354740554,0.10796182280288605,1,7,0.23038966290036184,300,,0.6761390961955243,0.9727757345330675,none,0.9656461037244529,3.684814401911689,,,,0.6405602716493605,0.8623195823523391,0.8648648648648649,0.6761390961955243,0.7234217561176228,0.7272727272727273,0.9727757345330675,0.8251466205920218,0.8221549971113541,0.6966336633663366,0.7031562125449461,0.7523524379811805,0.753102267864784,none,0.9271432623535442,0.9258870958129295,0.9656461037244529,COMPLETE
2097,0.7214064115822131,2025-09-23 23:38:07.580441,2025-09-23 23:38:09.819180,0 days 00:00:02.238739,0.00013527038793357583,gbtree,0.23951965358600863,0.7054458237156525,lossguide,0.010020380943180727,0.050169730408744756,4,10,0.10655586778389833,300,,0.6138075334049877,0.7544723864909063,none,0.8426906660982525,2.827546924042599,,,,0.5811893050369246,0.8616030299928344,0.8621007371007371,0.6138075334049877,0.7220394736842105,0.7214064115822131,0.7544723864909063,0.8244447796966368,0.8187259782232333,0.6951702296120348,0.6981585268214572,0.7510692899914457,0.7462558836114677,none,0.9260318684391411,0.9250977773148108,0.8426906660982525,COMPLETE
2098,0.7124513618677043,2025-09-23 23:38:09.964524,2025-09-23 23:38:10.986680,0 days 00:00:01.022156,0.008133823833122476,gbtree,0.4019289496788463,0.025910100336403036,depthwise,24.491656033070576,0.0204802539153105,0,7,4.470843038206906,400,,0.6838145407460092,0.9741765639161141,none,0.9279022267033549,4.493585385963487,,,,0.8568064170506132,0.8514689323369843,0.8486895986895987,0.6838145407460092,0.7176493481222027,0.7124513618677043,0.9741765639161141,0.8221358777980988,0.8151781497925898,0.6583363084612638,0.6532286835533357,0.7887082976903336,0.7834830979888746,none,0.9250966605919599,0.9233874480767202,0.9279022267033549,COMPLETE
2099,0.6727587058532971,2025-09-23 23:38:11.129773,2025-09-23 23:38:12.368276,0 days 00:00:01.238503,0.0009036543460919439,gbtree,0.3561140547560156,2.1430689814371475,lossguide,0.00012074589138244561,0.01847527625725188,4,7,0.3704879174865991,200,,0.6877495302986313,0.9946388983212262,none,0.960925338236071,2.380997003480886,,,,0.4823732397067658,0.8660047087726481,0.8643529893529893,0.6877495302986313,0.6782993364463012,0.6727587058532971,0.9946388983212262,0.8121898875406943,0.8040803862862286,0.7972270363951474,0.7955607476635514,0.5902480752780154,0.582798459563543,none,0.9218208717808628,0.9197208815468303,0.960925338236071,COMPLETE
2100,0.5312767780634104,2025-09-23 23:38:12.509243,2025-09-23 23:38:16.221151,0 days 00:00:03.711908,0.0010348631476180229,gbtree,0.2567068313074236,0.14734127401246633,lossguide,0.002700045759928257,0.003998472320470818,1,8,0.4189666765902245,500,,0.6264096604311659,0.9221756801234319,none,0.810215647172356,1.8717313620664426,,,,0.7194374646438721,0.8343740403316614,0.832002457002457,0.6264096604311659,0.5475391498881432,0.5312767780634104,0.9221756801234319,0.732531938809891,0.7237655586234801,0.7907915993537964,0.7989690721649485,0.4187339606501283,0.3979460847240051,none,0.8921043373774971,0.893980461063349,0.810215647172356,COMPLETE
2101,0.6903088739990194,2025-09-23 23:38:16.365033,2025-09-23 23:38:17.249126,0 days 00:00:00.884093,0.00039107418012754563,gbtree,0.2567686154976529,2.459087775915641,lossguide,0.0003495967512096994,0.042199280287400213,2,3,0.2619114116286579,600,,0.657766029049805,0.8560831627486165,oversample,0.9075807104440506,3.058210584126169,,,,0.5783802330734439,0.8006960794349472,0.805999180999181,0.657766029049805,0.6859170834005485,0.6903088739990194,0.8560831627486165,0.8225544770523163,0.8149290193259202,0.5506345506345506,0.558434690639873,0.9093242087254063,0.9037227214377407,oversample,0.9256453642113086,0.9242102798606976,0.9075807104440506,COMPLETE
2102,0.7077802736369205,2025-09-23 23:38:17.393871,2025-09-23 23:38:18.159235,0 days 00:00:00.765364,0.00907155463761785,gbtree,0.3341836907392575,0.6083339668597871,depthwise,0.008639476969749935,0.05194618111139637,0,6,0.2925171373663219,300,,0.6739506672260651,0.7259178002647657,none,0.8391757399512244,4.3703145322077335,,,,0.7174625580023622,0.8525949431876344,0.8535012285012284,0.6739506672260651,0.708029197080292,0.7077802736369205,0.7259178002647657,0.8146197375084765,0.8105661567467569,0.6730917501927525,0.676953125,0.7467921300256629,0.7415489944373128,none,0.9187131245324104,0.9189503350954297,0.8391757399512244,COMPLETE
2103,0.7069710055521283,2025-09-23 23:38:18.300779,2025-09-23 23:38:19.970084,0 days 00:00:01.669305,0.00010201140840257601,gbtree,0.25378894972897514,1.2875311969628407,lossguide,0.0005481664880758382,0.24690754351645972,0,7,0.19109276579011847,500,,0.6221806103836114,0.9303208290583367,none,0.8350389404533336,3.8829444533678044,,,,0.6163768609142735,0.8518783908281298,0.8541154791154791,0.6221806103836114,0.7034228325476533,0.7069710055521283,0.9303208290583367,0.8035264464577332,0.7953748812872066,0.6753246753246753,0.6805225653206651,0.7339606501283148,0.7355584082156611,none,0.9148108132313724,0.9117475122863333,0.8350389404533336,COMPLETE
2104,0.649929610511497,2025-09-23 23:38:20.116368,2025-09-23 23:38:20.938785,0 days 00:00:00.822417,0.00016587553245396843,gbtree,0.37665852623393914,0.6299105533243551,lossguide,0.011995520343931797,0.0031835356362562967,4,3,0.1281525463668386,500,,0.6587062447036093,0.836707570365449,none,0.7544467719312997,3.600804408828371,,,,0.40351383078749836,0.8497287337496161,0.8472563472563472,0.6587062447036093,0.6606564956079519,0.649929610511497,0.836707570365449,0.76089453178003,0.7534472735706117,0.7188128772635815,0.7194805194805195,0.6112061591103507,0.592640136927685,none,0.9007917034032749,0.8977773666354049,0.7544467719312997,COMPLETE
2105,0.7206427688504327,2025-09-23 23:38:21.081726,2025-09-23 23:39:25.662243,0 days 00:01:04.580517,0.0718134453575351,dart,0.5675444602470613,0.08141642870866117,lossguide,0.00013945631967139993,0.025976853015440532,3,9,0.16406572762757923,900,tree,0.5246600481854155,0.9579462005329088,none,0.8679654500987248,2.1730529349717265,0.16472200567983444,weighted,0.7293634237749025,0.3523426879832189,0.860067560651039,0.8611793611793612,0.5246600481854155,0.7201637666325487,0.7206427688504327,0.9579462005329088,0.8246895975483771,0.8172106135274575,0.690616411464468,0.6948748510131109,0.7523524379811805,0.748395378690629,none,0.9254370030341299,0.9229310167015359,0.8679654500987248,COMPLETE
2106,0.6536497446680685,2025-09-23 23:39:25.804112,2025-09-23 23:39:26.697338,0 days 00:00:00.893226,0.0018839348834923926,gbtree,0.4919282197423534,1.4495228761011463,depthwise,0.24821401355635234,0.031850022170468506,3,6,26.620897720067184,400,,0.6348598033375852,0.9557303172049094,undersample,0.9059589239322338,4.223355574900206,,,,0.7610060334634927,0.7570887501279557,0.7639230139230139,0.6348598033375852,0.6478706039471732,0.6536497446680685,0.9557303172049094,0.8088007658803281,0.8002752187953681,0.49602363099295615,0.5035871326081925,0.9337040205303678,0.9311082584510055,undersample,0.9199813649130597,0.9177169367682034,0.9059589239322338,COMPLETE
2107,0.7064555420219245,2025-09-23 23:39:26.845711,2025-09-23 23:39:31.710242,0 days 00:00:04.864531,0.005460168486643035,gbtree,0.23485076990113896,0.39112443736323527,lossguide,0.00011361635874571052,0.02490425900658716,9,9,1.9888148919200084,900,,0.50616761224958,0.9647472999786708,oversample,0.9027965506473289,1.567981852217325,,,,0.4976270589716127,0.8213737332377931,0.8272932022932022,0.50616761224958,0.6999140154772141,0.7064555420219245,0.9647472999786708,0.8277641120929242,0.8195124434852843,0.5852746620649986,0.5953079178885631,0.8704020530367835,0.8686350021394951,oversample,0.9266762340133161,0.9247708788202771,0.9027965506473289,COMPLETE
2108,0.5920352834349462,2025-09-23 23:39:31.852011,2025-09-23 23:40:13.542365,0 days 00:00:41.690354,0.0023097113823916334,dart,0.25320594483569103,0.4101695867810018,lossguide,0.00643918419728668,0.0057596337357266585,10,5,0.3274615635351385,800,tree,0.38235669281745827,0.9675514796206798,undersample,0.8739145018202189,1.8379625596147546,0.26134482066868914,weighted,0.6738481768237176,0.3656100171539021,0.6706930084962637,0.678030303030303,0.38235669281745827,0.5852778135877272,0.5920352834349462,0.9675514796206798,0.791679367649166,0.7865296756295355,0.4188964753644584,0.424795234549516,0.9709153122326775,0.9764655541292255,undersample,0.9142535334199241,0.9137491249548623,0.8739145018202189,COMPLETE
2109,0.7140984834300693,2025-09-23 23:40:13.689861,2025-09-23 23:40:14.870295,0 days 00:00:01.180434,0.0001457501438259254,gbtree,0.5203972889400736,1.3862728622251086,lossguide,0.07459110221097566,0.05771347780244385,0,7,0.2611442603831164,200,,0.670550204350234,0.9532560720441381,oversample,0.7361801835807409,1.701354902957829,,,,0.616806556528233,0.8419490224178524,0.8436732186732187,0.670550204350234,0.7131178000743218,0.7140984834300693,0.9532560720441381,0.8268795999629162,0.8189481109726395,0.6304204993429697,0.6348202396804261,0.820786997433704,0.8160034231921267,oversample,0.9272661206222425,0.9248696336059254,0.7361801835807409,COMPLETE
2110,0.7102119460500963,2025-09-23 23:40:15.014241,2025-09-23 23:40:16.069158,0 days 00:00:01.054917,0.00015994706980323916,gbtree,0.5263647091037735,1.1515894502416741,lossguide,0.004564406798964829,0.0955660992932108,1,7,1.0836845367865706,200,,0.6751611003154631,0.7826252511265706,none,0.9662209968504915,4.61818907528185,,,,0.7949072509755969,0.8464530658204524,0.846027846027846,0.6751611003154631,0.7128637059724349,0.7102119460500963,0.7826252511265706,0.8205790405350772,0.8154901562547179,0.6451836451836452,0.6459866806869962,0.7964071856287425,0.7886178861788617,none,0.9237449894029346,0.9215356662841431,0.9662209968504915,COMPLETE
2111,0.683815160482586,2025-09-23 23:40:16.218866,2025-09-23 23:41:24.816625,0 days 00:01:08.597759,0.00046042695719422763,dart,0.5980800234871149,3.0264836681406577,lossguide,0.00020292216068043306,0.2306726889533184,4,7,0.651503557584015,1000,forest,0.41846875162619795,0.9618487318268171,none,0.691470710608639,0.9865998665765279,0.1375080196467181,weighted,0.4908384899089533,0.231525322466337,0.8612959361244754,0.8578009828009828,0.41846875162619795,0.6925346040390288,0.683815160482586,0.9618487318268171,0.802345656214698,0.7952936630240977,0.7375543740937651,0.730544747081712,0.6526946107784432,0.6427043217800599,none,0.9126167757915163,0.9108653700480018,0.691470710608639,COMPLETE
