number,value,datetime_start,datetime_complete,duration,params_alpha,params_booster,params_colsample_bytree,params_gamma,params_grow_policy,params_lambda,params_learning_rate,params_max_delta_step,params_max_depth,params_min_child_weight,params_n_estimators,params_normalize_type,params_params_decision_threshold,params_params_feature_fraction,params_params_resampling,params_params_sample_rows,params_params_scale_pos_weight,params_rate_drop,params_sample_type,params_skip_drop,params_subsample,user_attrs_acc_test,user_attrs_acc_val,user_attrs_decision_threshold,user_attrs_f1_test,user_attrs_f1_val,user_attrs_feature_fraction,user_attrs_pr_auc_test,user_attrs_pr_auc_val,user_attrs_prec_test,user_attrs_prec_val,user_attrs_rec_test,user_attrs_rec_val,user_attrs_resampling_strategy,user_attrs_roc_auc_test,user_attrs_roc_auc_val,user_attrs_sample_rows,state
1805,0.7171616503886785,2025-09-23 22:19:24.283662,2025-09-23 22:19:31.506154,0 days 00:00:07.222492,1.6614743063084525,dart,0.7585920969794685,7.694591015797423,lossguide,0.01232025917806904,0.2085157871463105,8,12,2.153202091555791,300,forest,0.6511099253606935,0.9902407213090572,none,0.8498407146710383,3.4680804666838942,0.31891712217377227,uniform,0.5408627808809525,0.9125811010671357,0.8550516941345071,0.8547297297297297,0.6511099253606935,0.7197149643705463,0.7171616503886785,0.9902407213090572,0.8255097100808468,0.8155451091804388,0.6698599852616065,0.6712686567164179,0.7775876817792986,0.7697903294822422,none,0.9262283438198866,0.9235817330019549,0.8498407146710383,COMPLETE
1806,0.6505169867060562,2025-09-23 22:19:31.644406,2025-09-23 22:19:35.658438,0 days 00:00:04.014032,0.05689754311506999,dart,0.9845456939174496,6.464876751721085,lossguide,0.005471280594044118,0.0371985887868531,7,8,1.305999754304727,200,tree,0.4052591371219796,0.8739203510408007,oversample,0.9817770703485957,1.946231358678318,0.2303989052767071,uniform,0.41453102188857793,0.353989755185921,0.7572934793735285,0.7577805077805078,0.4052591371219796,0.6511696336619097,0.6505169867060562,0.8739203510408007,0.8188037983699271,0.8102973865055004,0.49629961874859835,0.49672907737423866,0.946535500427716,0.9422336328626444,oversample,0.9238089367144943,0.9215737862072328,0.9817770703485957,COMPLETE
1807,0.6610515569167943,2025-09-23 22:19:35.794062,2025-09-23 22:19:39.493545,0 days 00:00:03.699483,0.00035699880938709004,dart,0.7792109704698592,5.267463924595276,depthwise,0.009822488239934993,0.008145055570792347,3,10,0.18817745090113894,200,forest,0.6018924215389186,0.9728435968240348,none,0.7309022703966912,1.6097766154167867,0.19827719886261297,uniform,0.6252514675641674,0.7897904957743537,0.8638550516941345,0.864045864045864,0.6018924215389186,0.6631205673758865,0.6610515569167943,0.9728435968240348,0.8137945233315551,0.8058389692920672,0.8130434782608695,0.8191018342820999,0.5598802395209581,0.5541292255027813,none,0.9193563964981969,0.91713451386474,0.7309022703966912,COMPLETE
1808,0.6641045349730976,2025-09-23 22:19:39.630356,2025-09-23 22:19:40.297986,0 days 00:00:00.667630,0.00023113777898851892,gbtree,0.5271820463008317,5.549755456050449,depthwise,0.0040896063802367605,0.2593807438265711,0,12,0.26280144840910247,500,,0.6738696735574237,0.8673512442595733,none,0.8885877365723738,1.3065554604056124,,,,0.5794889499473768,0.8697921998157436,0.8657862407862408,0.6738696735574237,0.6731757451181911,0.6641045349730976,0.8673512442595733,0.8225415121327304,0.8180114241391838,0.842985842985843,0.8275862068965517,0.5603079555175363,0.5545571245186136,none,0.9251390810857665,0.9239800343735753,0.8885877365723738,COMPLETE
1809,0.6868686868686869,2025-09-23 22:19:40.434699,2025-09-23 22:20:38.325753,0 days 00:00:57.891054,0.0006840924792610351,dart,0.3079293598452,0.2361677239323171,depthwise,0.0007190959158983491,0.05811419222376906,8,9,0.5307737331172826,900,forest,0.4392146794052116,0.9145910705096787,none,0.8198860816708418,4.961059265717994,0.24877237852803094,weighted,0.7158774157257134,0.36745413034345376,0.8003889855665882,0.8032350532350533,0.4392146794052116,0.6849757673667205,0.6868686868686869,0.9145910705096787,0.8214993206666646,0.8167140298811117,0.5503634475597092,0.5545908971323336,0.9067579127459366,0.9020111253744116,none,0.9247569800706563,0.9233307864387741,0.8198860816708418,COMPLETE
1810,0.6716857610474631,2025-09-23 22:20:38.464821,2025-09-23 22:20:39.285324,0 days 00:00:00.820503,0.0006870431941221938,gbtree,0.9427279125855498,3.3714827060260437,lossguide,0.0006373913223698401,0.009733755623775701,9,5,0.3696867086711972,200,,0.5010933455592388,0.965704175090344,undersample,0.9974124744301125,1.0973113346505445,,,,0.48820129270570145,0.7861603029992834,0.7946355446355446,0.5010933455592388,0.6653852314592343,0.6716857610474631,0.965704175090344,0.7967941830834884,0.78614799332918,0.5318822023047375,0.5438642989663398,0.888366124893071,0.8780487804878049,undersample,0.9122092339917891,0.9095633040345448,0.9974124744301125,COMPLETE
1811,0.7160397583317092,2025-09-23 22:20:39.421732,2025-09-23 22:20:40.165143,0 days 00:00:00.743411,0.00011064437633458935,gbtree,0.7945209457387865,7.040451037245055,depthwise,0.025192498806894136,0.17580767582697893,0,11,0.13301843783706624,700,,0.4925195049037002,0.7799902365894404,none,0.7864431694734377,1.925936366023879,,,,0.7793600694638066,0.8487050875217524,0.8508394758394758,0.4925195049037002,0.714891975308642,0.7160397583317092,0.7799902365894404,0.8213786346286913,0.8167041122478751,0.6510892480674632,0.65748031496063,0.7925577416595381,0.7860504920838682,none,0.9253365637373963,0.9232933863027515,0.7864431694734377,COMPLETE
1812,0.7212921016348237,2025-09-23 22:20:40.305657,2025-09-23 22:20:57.519298,0 days 00:00:17.213641,0.002293708911481628,dart,0.6230046747980553,9.871827486063047,depthwise,0.00024351604907907844,0.3063952153154067,2,12,0.3091886601708617,500,forest,0.6129304448491062,0.9908112756750362,none,0.9454202934562078,3.1936728857298555,0.08378056421984906,weighted,0.82166582807508,0.779926312872508,0.8549493295117208,0.8551392301392301,0.6129304448491062,0.7232962312048428,0.7212921016348237,0.9908112756750362,0.8259609700614111,0.8199722881037179,0.6654689184333453,0.6682481751824818,0.7921300256629598,0.7834830979888746,none,0.9272437592086142,0.9254545037854178,0.9454202934562078,COMPLETE
1813,0.6397984886649875,2025-09-23 22:20:57.654697,2025-09-23 22:21:00.925712,0 days 00:00:03.271015,10.727100581946106,dart,0.9126353923328295,5.267389456665734,lossguide,0.07314051598758742,0.013514430614605616,10,4,0.5759896025788886,200,forest,0.49385849380108027,0.963729181144307,none,0.8855230593486922,1.187600937135417,0.21085717344690855,uniform,0.5664051713639411,0.4115127110974661,0.8582249974408844,0.8536036036036037,0.49385849380108027,0.6565831886932805,0.6397984886649875,0.963729181144307,0.7878365887117698,0.7781620623284682,0.7811209439528024,0.7777097366809553,0.5662959794696322,0.5434317501069748,none,0.9079202745670778,0.9056987960611179,0.8855230593486922,COMPLETE
1814,0.6936974789915966,2025-09-23 22:21:01.063172,2025-09-23 22:21:39.168983,0 days 00:00:38.105811,0.03569454676841298,dart,0.6801236670256946,8.869505748288423,depthwise,0.03173181514218452,0.03926135515407798,4,12,0.56994353312711,800,tree,0.6478649562560381,0.7866957180574634,none,0.9646476614433915,4.122285158851157,0.47079308689714083,weighted,0.01834504871214082,0.6992646973693948,0.8503429214863343,0.8507371007371007,0.6478649562560381,0.6947807933194154,0.6936974789915966,0.7866957180574634,0.794607061154711,0.7909981841251585,0.6786296900489397,0.6813867106892282,0.7117194183062446,0.7064612751390672,none,0.9130356565834822,0.9107652908541494,0.9646476614433915,COMPLETE
1815,0.7096477089569422,2025-09-23 22:21:39.307494,2025-09-23 22:21:55.970748,0 days 00:00:16.663254,0.00012327201778464822,dart,0.919219802598565,6.368441392909187,depthwise,0.0003538771554239983,0.11717898525975337,1,8,0.10760163217792712,500,forest,0.6916453054897381,0.9017653115753396,none,0.8123481069360837,2.6126193001889426,0.19663987840906683,uniform,0.29678784650039314,0.6800835673186452,0.8696898351929573,0.8709049959049959,0.6916453054897381,0.7094270714448756,0.7096477089569422,0.9017653115753396,0.8209267683573312,0.8157742573531125,0.7606461086637298,0.7681954137587238,0.6646706586826348,0.6593923833975182,none,0.9246201063470845,0.923290967818205,0.8123481069360837,COMPLETE
1816,0.664180959482973,2025-09-23 22:21:56.108384,2025-09-23 22:21:59.557806,0 days 00:00:03.449422,0.0006662874426530922,dart,0.9203193708471907,6.5390178971752535,depthwise,63.34626769988058,0.018604617287632373,0,8,0.3612565857379886,200,forest,0.6522127218739082,0.9271456365705564,none,0.999798873599941,1.911022775398903,0.12554705516920517,weighted,0.7062185354655927,0.9875770698706364,0.8641621455624936,0.8616912366912367,0.6522127218739082,0.6722647567300568,0.664180959482973,0.9271456365705564,0.8063658875871101,0.7991705455644833,0.7954412624196376,0.7924080664294187,0.5821214713430283,0.5716730851519042,none,0.916362614755494,0.9146616997904038,0.999798873599941,COMPLETE
1817,0.7133295085102314,2025-09-23 22:21:59.694043,2025-09-23 22:22:06.801341,0 days 00:00:07.107298,0.007368442758116654,dart,0.39120177610092216,0.10435410890911334,depthwise,0.00019318482093125394,0.13146206449566758,0,9,0.15184853379881347,300,forest,0.3142623448472416,0.855426395094478,none,0.976984631398497,0.9517723210392031,0.17288505519322991,uniform,0.49740500061881193,0.891606090821213,0.8446105026102979,0.8465397215397216,0.3142623448472416,0.7088607594936709,0.7133295085102314,0.855426395094478,0.8208017401342061,0.8169198665650561,0.6425591098748261,0.6448824343015215,0.7904191616766467,0.7980316645271716,none,0.9224094057688877,0.9217473124734434,0.976984631398497,COMPLETE
1818,0.7129840546697038,2025-09-23 22:22:06.939796,2025-09-23 22:22:35.588388,0 days 00:00:28.648592,0.00469040994631341,dart,0.4211488259586225,1.638591820458256,lossguide,0.00013718968214622895,0.024429077062155757,8,9,0.13760451581338137,600,forest,0.4306649518211102,0.9421332456781386,none,0.9205841551269082,0.8599118859221218,0.06390740106637251,weighted,0.8362540876376916,0.2756296758903054,0.870713481420821,0.871007371007371,0.4306649518211102,0.7138001359619307,0.7129840546697038,0.9421332456781386,0.8253946605685307,0.8194475039810369,0.7590361445783133,0.7622990745250853,0.6736526946107785,0.6696619597774925,none,0.9261994495350957,0.9241928034307009,0.9205841551269082,COMPLETE
1819,0.676716368998853,2025-09-23 22:22:35.726957,2025-09-23 22:22:36.417927,0 days 00:00:00.690970,0.5926939102879432,gbtree,0.8275249398601898,3.843073501313069,lossguide,0.0002325838123830403,0.03393802660796893,4,5,2.4263743741996437,200,,0.33937983331652155,0.8271456299339826,undersample,0.8789253920078371,0.597147933393074,,,,0.6861579494016566,0.7892312416828744,0.798013923013923,0.33937983331652155,0.6679567811643283,0.676716368998853,0.8271456299339826,0.8051954651161418,0.793234954486279,0.5361118301837949,0.5483271375464684,0.8857998289136013,0.8836114676936243,undersample,0.9153700788054205,0.9125583956049917,0.8789253920078371,COMPLETE
1820,0.7035541195476576,2025-09-23 22:22:36.559587,2025-09-23 22:22:40.018535,0 days 00:00:03.458948,0.00846023311074186,dart,0.7716053556762104,9.281744197780633,depthwise,0.05255731440430576,0.11541279234002945,0,12,5.1327340254665,200,forest,0.697348278532497,0.935079180304123,none,0.8063026552366956,4.077782895331676,0.1999408917343049,uniform,0.7102200498128727,0.8706537432517512,0.8542327771522162,0.8497133497133497,0.697348278532497,0.7141710156563629,0.7035541195476576,0.935079180304123,0.8068432478301127,0.7942633129273136,0.6728441754916793,0.6661567877629063,0.760906757912746,0.7454000855798032,none,0.9202700775276255,0.9158369681140665,0.8063026552366956,COMPLETE
1821,0.7043938348286174,2025-09-23 22:22:40.155684,2025-09-23 22:22:47.782887,0 days 00:00:07.627203,0.000105328662716085,dart,0.7304199540338744,1.3475879636701857,depthwise,0.001483149031380399,0.0122227565913588,1,12,0.11675309784480506,300,forest,0.6330681951696757,0.7690345045914493,none,0.8971437233211109,2.1391544077996203,0.17540468554434077,uniform,0.4317314329551005,0.35204143528170573,0.8689732828334528,0.8684479934479934,0.6330681951696757,0.7076290543627227,0.7043938348286174,0.7690345045914493,0.81420862045926,0.8054283481959098,0.759313725490196,0.7616915422885572,0.6625320786997434,0.6551133932391956,none,0.9213370076272853,0.9194072559258197,0.8971437233211109,COMPLETE
1822,0.6884234453645073,2025-09-23 22:22:47.924584,2025-09-23 22:22:49.555762,0 days 00:00:01.631178,0.0002839525768285722,gbtree,0.5876788055452107,3.089758225692773,depthwise,0.0001640499310971633,0.01273942794267047,0,12,0.1826450001953424,500,,0.6424835366863926,0.9842015680503826,undersample,0.9568306121336617,3.7050241625495235,,,,0.5615345576304679,0.8001842563210154,0.8035421785421786,0.6424835366863926,0.6856682769726248,0.6884234453645073,0.9842015680503826,0.8236678515128769,0.8160991073538559,0.549845041322314,0.554683411826269,0.9106073567151411,0.9071459135643988,undersample,0.9263797510233586,0.9240519554973508,0.9568306121336617,COMPLETE
1823,0.7056128293241696,2025-09-23 22:22:49.695490,2025-09-23 22:22:50.622438,0 days 00:00:00.926948,0.00021768111284083922,gbtree,0.847937372219542,3.7642070380850887,depthwise,0.057782522527480125,0.07296448954294935,1,12,0.10000285216716154,500,,0.5885800223210592,0.8843709359803208,none,0.871595825600466,1.5059233426072363,,,,0.6658938603289394,0.8686661889650936,0.8684479934479934,0.5885800223210592,0.707678286625655,0.7056128293241696,0.8843709359803208,0.8228174080559365,0.8160581286462364,0.7571916138469039,0.7593688362919132,0.6642429426860564,0.658964484381686,none,0.9261001038467501,0.9236101214038933,0.871595825600466,COMPLETE
1824,0.6896127842655193,2025-09-23 22:22:50.758666,2025-09-23 22:22:51.374062,0 days 00:00:00.615396,0.0010122768337668252,gbtree,0.7788707921966367,2.6863710010305852,depthwise,0.7500667723046012,0.024872835085570512,0,4,19.17712324859591,200,,0.5957137394167648,0.9741083204453543,none,0.8476026097332459,2.8168176148007733,,,,0.6153171138095697,0.8421537516634251,0.8449017199017199,0.5957137394167648,0.6906099518459069,0.6896127842655193,0.9741083204453543,0.7993279730296431,0.7934098965702449,0.6504157218442933,0.6615566037735849,0.7360992301112061,0.7201540436456996,none,0.9123612167786234,0.9109806799362004,0.8476026097332459,COMPLETE
1825,0.7136094674556213,2025-09-23 22:22:51.511237,2025-09-23 22:23:03.182702,0 days 00:00:11.671465,0.00018305613147363205,dart,0.906796081543123,7.984399758607385,lossguide,0.062094109722358536,0.04411599486685066,8,10,0.4366724632137465,400,forest,0.3939281831352637,0.9414219285621517,none,0.9989368397792968,1.2515697754228188,0.1942216742452163,weighted,0.7652947896085127,0.3257071301996688,0.8533114955471389,0.8513513513513513,0.3939281831352637,0.7188542279772415,0.7136094674556213,0.9414219285621517,0.8228175788968165,0.8148771558736901,0.6640086988039144,0.6619099890230515,0.7835757057313943,0.7740693196405648,none,0.9247086310682171,0.9227386895971248,0.9989368397792968,COMPLETE
1826,0.7130473438541898,2025-09-23 22:23:03.322688,2025-09-23 22:23:05.440252,0 days 00:00:02.117564,0.000526744750077247,gbtree,0.2693555022815193,5.212297270056181,lossguide,0.18335987945436263,0.007846939799647302,6,9,0.24934728784506852,700,,0.4742840079620939,0.9989161432191542,none,0.963123154098436,1.1917673681764496,,,,0.7241841615260696,0.8695874705701709,0.8678337428337428,0.4742840079620939,0.7163846838824577,0.7130473438541898,0.9989161432191542,0.8210926245489971,0.8133450775369857,0.7469823584029712,0.7419056429232193,0.6881950384944396,0.6863500213949508,none,0.9243686051968961,0.9226375451184126,0.963123154098436,COMPLETE
1827,0.6644263082093135,2025-09-23 22:23:05.597136,2025-09-23 22:23:17.313645,0 days 00:00:11.716509,0.08448640596591495,dart,0.994572389976384,8.77980182541714,lossguide,0.02458644097684429,0.12103007605636842,10,7,0.24066755476434265,400,forest,0.40111508283928277,0.9210725061861347,none,0.8207312419414826,3.5469679222415125,0.12016758647772191,weighted,0.6917187595727141,0.27338132571811125,0.7827822704473334,0.7853194103194103,0.40111508283928277,0.6660371419578218,0.6644263082093135,0.9210725061861347,0.7948622419656505,0.7855112835257333,0.5268924302788844,0.5306748466257669,0.9050470487596236,0.8883183568677792,none,0.9147640183040114,0.9101204480162005,0.8207312419414826,COMPLETE
1828,0.7040487280544607,2025-09-23 22:23:17.453273,2025-09-23 22:23:29.049288,0 days 00:00:11.596015,0.0006364727809309862,dart,0.6850281008034145,7.609086565839485,depthwise,42.66408896782875,0.32064734733760825,2,11,40.0125932246459,400,forest,0.6141804151396155,0.9898655544417776,none,0.9034729728617596,4.844263634325848,0.18729144787425822,uniform,0.6060441486642436,0.9351922570384775,0.8281297983416931,0.8308763308763308,0.6141804151396155,0.7036187113857016,0.7040487280544607,0.9898655544417776,0.8180130395124636,0.8109449872420879,0.5990381725278028,0.6055469953775039,0.8524379811804962,0.8408215661103979,none,0.9239366874417725,0.9214150587631282,0.9034729728617596,COMPLETE
1829,0.6305732484076433,2025-09-23 22:23:29.191120,2025-09-23 22:23:29.984735,0 days 00:00:00.793615,0.013497432305644687,gbtree,0.7404869371125363,0.16370633148138428,depthwise,0.01493304242554069,0.025194273662476365,7,4,0.30612158321039606,400,,0.3798281584804646,0.9706511858996257,none,0.8105657371579096,0.5491153179956113,,,,0.6753291557705325,0.8468625243115979,0.8456183456183456,0.3798281584804646,0.6374212312166747,0.6305732484076433,0.9706511858996257,0.7516200011723777,0.7446303835374397,0.7354586129753915,0.7375358166189112,0.5624465355004277,0.5507060333761232,none,0.8997606033679224,0.9007836868841034,0.8105657371579096,COMPLETE
1830,0.685215140731155,2025-09-23 22:23:30.120889,2025-09-23 22:23:48.209720,0 days 00:00:18.088831,0.00017556482712099866,dart,0.7494890397601763,7.356988631288484,lossguide,0.012226340046419199,0.02387878251218522,0,7,0.7625020657730169,500,forest,0.49263541047749493,0.9005926601527011,none,0.986042883034337,4.97098109669589,0.23586045689832175,weighted,0.5910709468933906,0.8497558213882671,0.7970109530146381,0.8007780507780508,0.49263541047749493,0.6824659727782226,0.685215140731155,0.9005926601527011,0.8247473178423617,0.816736113197287,0.5454312771947786,0.5508452535760728,0.9114627887082977,0.9062901155327343,none,0.9261301492982661,0.9235445056148286,0.986042883034337,COMPLETE
1831,0.6625924734641364,2025-09-23 22:23:48.347547,2025-09-23 22:24:24.694394,0 days 00:00:36.346847,0.00031717221796833945,dart,0.4516444040949936,5.372049440075989,lossguide,0.00012658314762224092,0.01888117860975074,6,9,0.8331012662961682,700,forest,0.4866441963072976,0.9164357497376622,oversample,0.8270070384179575,1.3871587551998674,0.1784456599056491,uniform,0.5642784361561701,0.6391602355862063,0.7798136963865289,0.7852170352170352,0.4866441963072976,0.6568830754506301,0.6625924734641364,0.9164357497376622,0.7540671421215958,0.7466269932378864,0.5237852963622488,0.530791033238856,0.8806672369546621,0.881471972614463,oversample,0.8994863378957525,0.9011865948929554,0.8270070384179575,COMPLETE
1832,0.6892519346517627,2025-09-23 22:24:24.831865,2025-09-23 22:24:31.717827,0 days 00:00:06.885962,0.0013094817092740994,dart,0.9834623586983373,6.351153313612557,depthwise,0.16992104058818372,0.4917295039339878,4,12,10.631526662476595,300,tree,0.5445481245583375,0.7791440788531586,none,0.9215359969333984,4.360579775576187,0.13379522831399343,uniform,0.47229800836381275,0.5951762770638552,0.8067355921793428,0.81500819000819,0.5445481245583375,0.678254942058623,0.6892519346517627,0.7791440788531586,0.7973822959074419,0.7978633623434654,0.5637393767705382,0.5761932144910868,0.8511548331907614,0.8575096277278562,none,0.9112760694655443,0.9130239538801905,0.9215359969333984,COMPLETE
1833,0.7059035927062647,2025-09-23 22:24:31.854892,2025-09-23 22:24:38.658626,0 days 00:00:06.803734,0.7347675085330141,dart,0.7350291741184859,7.908703394501737,depthwise,0.003654544831014324,0.3801521752596952,7,9,27.007123872014226,300,forest,0.6253955295560065,0.9620785565678995,none,0.8620091937517202,4.880063277512882,0.10887478873565462,weighted,0.7072400069656334,0.8377281715691958,0.8319172893847886,0.8332309582309583,0.6253955295560065,0.7073083778966132,0.7059035927062647,0.9620785565678995,0.8199564751777498,0.8133550448266342,0.6063569682151589,0.6105559025608994,0.8485885372112917,0.8365425759520753,none,0.9251542477073652,0.9226971722790768,0.8620091937517202,COMPLETE
1834,0.7172303382029217,2025-09-23 22:24:38.794815,2025-09-23 22:24:52.169215,0 days 00:00:13.374400,0.06626063817817963,dart,0.9936956992105244,4.3745293844773405,lossguide,0.35810229727878423,0.20365845820824144,7,12,6.56283923340556,400,forest,0.6830172845864868,0.9321711344947744,none,0.9204824227036316,4.377057807393856,0.22185187671503512,uniform,0.6709132853932185,0.5495511597495764,0.8509571092230526,0.8553439803439803,0.6830172845864868,0.7115689381933439,0.7172303382029217,0.9321711344947744,0.8139751326856852,0.8106971111691992,0.6627306273062731,0.6736842105263158,0.7681779298545766,0.7667950363714163,none,0.9197169419163863,0.9190461243583602,0.9204824227036316,COMPLETE
1835,0.6666666666666666,2025-09-23 22:24:52.308480,2025-09-23 22:24:53.183188,0 days 00:00:00.874708,0.0006920220812557055,gbtree,0.6633154884602126,8.566888451950764,lossguide,0.04698591230775724,0.18874650997339007,0,10,0.5383857964804916,500,,0.5711218112900817,0.8659722293686839,oversample,0.8288609036608422,4.6435154587953855,,,,0.5048243348463325,0.7768451223257242,0.7798935298935299,0.5711218112900817,0.6639950678175093,0.6666666666666666,0.8659722293686839,0.8190293368380592,0.8080816485584835,0.5190361445783133,0.5227327984439581,0.9213002566295979,0.9199828840393667,oversample,0.9225461355966192,0.919654661136629,0.8288609036608422,COMPLETE
