number,value,datetime_start,datetime_complete,duration,params_alpha,params_booster,params_colsample_bytree,params_gamma,params_grow_policy,params_lambda,params_learning_rate,params_max_delta_step,params_max_depth,params_min_child_weight,params_n_estimators,params_normalize_type,params_params_decision_threshold,params_params_feature_fraction,params_params_resampling,params_params_sample_rows,params_params_scale_pos_weight,params_rate_drop,params_sample_type,params_skip_drop,params_subsample,user_attrs_acc_test,user_attrs_acc_val,user_attrs_decision_threshold,user_attrs_f1_test,user_attrs_f1_val,user_attrs_feature_fraction,user_attrs_pr_auc_test,user_attrs_pr_auc_val,user_attrs_prec_test,user_attrs_prec_val,user_attrs_rec_test,user_attrs_rec_val,user_attrs_resampling_strategy,user_attrs_roc_auc_test,user_attrs_roc_auc_val,user_attrs_sample_rows,state
1743,0.7255379618351604,2025-09-23 22:10:31.720761,2025-09-23 22:10:32.437935,0 days 00:00:00.717174,0.0022494779733204513,gbtree,0.8640509095601836,1.3377035335021459,depthwise,0.0003052549816683709,0.1476577598613817,10,5,0.18444710235427988,300,,0.35488235742513674,0.9045479322442128,none,0.9865949739418546,0.9732060388865629,,,,0.8135818927267418,0.8585320913092436,0.8615888615888616,0.35488235742513674,0.7206952303961196,0.7255379618351604,0.9045479322442128,0.8240992964714593,0.8191916110062574,0.6831417624521072,0.690227887215141,0.762617621899059,0.764655541292255,none,0.9260880453753086,0.9235120864053125,0.9865949739418546,COMPLETE
1744,0.7013532431171255,2025-09-23 22:10:32.574966,2025-09-23 22:10:33.313728,0 days 00:00:00.738762,0.00018876881783905805,gbtree,0.7699103653866447,4.026720625492475,depthwise,0.0008600174742464144,0.02296605227398987,9,5,0.39967085818106035,300,,0.4971616895144174,0.9984701932200882,none,0.9981630372151049,1.1347627983854203,,,,0.8398676412206308,0.8704063875524619,0.868959868959869,0.4971616895144174,0.7061281337047354,0.7013532431171255,0.9984701932200882,0.8229843129125664,0.816272215578598,0.7720812182741117,0.7711646998460749,0.6505560307955518,0.6431322207958922,none,0.9246619800366969,0.9228873976052512,0.9981630372151049,COMPLETE
1745,0.6757337151037939,2025-09-23 22:10:33.450994,2025-09-23 22:10:34.066192,0 days 00:00:00.615198,0.00015921022153973677,gbtree,0.7953796580523231,6.6642255627158935,depthwise,24.53487480391721,0.10045031446694437,1,9,7.935715625662139,200,,0.621086522025642,0.9287125580202392,none,0.9040726183167745,1.4924586611803294,,,,0.7713278137723012,0.8661070733954346,0.8608722358722358,0.621086522025642,0.6913638508730533,0.6757337151037939,0.9287125580202392,0.8021930050202434,0.790752802718916,0.7710526315789473,0.7637540453074434,0.6266039349871685,0.6059050064184852,none,0.9182800843897303,0.9143391200182747,0.9040726183167745,COMPLETE
1746,0.7218517065515888,2025-09-23 22:10:34.200887,2025-09-23 22:10:34.900927,0 days 00:00:00.700040,0.004760487894423314,gbtree,0.8769987551071758,0.128855024135623,depthwise,0.0014683422017491984,0.3349697120508103,8,3,0.4073977638561126,400,,0.4202031446069071,0.9520630390923884,oversample,0.8525121792577578,0.5115599754313462,,,,0.8125620406818507,0.8513665677141979,0.8548321048321048,0.4202031446069071,0.7195828505214369,0.7218517065515888,0.9520630390923884,0.8232433956619645,0.8178360736064705,0.6559859154929577,0.6664252082578775,0.7968349016253208,0.787334189131365,oversample,0.9251704215998477,0.9225341549040503,0.8525121792577578,COMPLETE
1747,0.7005610098176718,2025-09-23 22:10:35.038099,2025-09-23 22:10:35.755147,0 days 00:00:00.717048,0.30525644571234295,gbtree,0.7735484043656148,0.7105267588891534,depthwise,0.08120751367114197,0.4894751674557947,4,3,0.1303938210841457,400,,0.32765423873558785,0.9907654005630911,oversample,0.8673246514900353,0.6220456577389951,,,,0.882039590504196,0.8220902855972976,0.8251433251433251,0.32765423873558785,0.6989954970557672,0.7005610098176718,0.9907654005630911,0.8154902677120384,0.8136086298420834,0.5873108265424912,0.5934065934065934,0.863130881094953,0.8549422336328626,oversample,0.921662615135379,0.9214632844966446,0.8673246514900353,COMPLETE
1748,0.6902625456962446,2025-09-23 22:10:35.890345,2025-09-23 22:10:36.461738,0 days 00:00:00.571393,0.0022932224624141284,gbtree,0.875594715403832,2.897915153513987,depthwise,0.00016227608570832427,0.439951758697487,9,4,0.9007250016323896,200,,0.34696661777701565,0.9149377585390304,oversample,0.8748306333604765,0.8752180205116566,,,,0.6179679573788639,0.8045859351008292,0.8091728091728092,0.34696661777701565,0.6869978685030332,0.6902625456962446,0.9149377585390304,0.8184675928264544,0.8141731992265848,0.557032704068067,0.5642488454224396,0.8960650128314799,0.8887462558836114,oversample,0.9235209435791317,0.9210014979056786,0.8748306333604765,COMPLETE
1749,0.7158836689038032,2025-09-23 22:10:36.597425,2025-09-23 22:10:37.586188,0 days 00:00:00.988763,15.068821690718583,gbtree,0.8547531593049988,5.104324177817178,lossguide,0.004952172452513289,0.07450783030847317,5,12,3.2526922613165272,500,,0.6227744941325973,0.9529026102124762,none,0.9519528816956244,2.7731280291871303,,,,0.5415762775091846,0.8581226328180981,0.8569819819819819,0.6227744941325973,0.718978102189781,0.7158836689038032,0.9529026102124762,0.8199294553467034,0.8122633791380132,0.6835003855050116,0.6821705426356589,0.7583404619332763,0.753102267864784,none,0.9247145883560176,0.921969755468755,0.9519528816956244,COMPLETE
1750,0.7005099675475197,2025-09-23 22:10:37.721585,2025-09-23 22:10:38.282036,0 days 00:00:00.560451,0.09154498788417637,gbtree,0.9158378557204507,2.0656331875122387,depthwise,0.0019666695976164723,0.17133041158689546,10,3,0.19695373939325245,200,,0.39333058619802397,0.8509822140849931,none,0.9310425782044602,0.7473150778178851,,,,0.9418665392231711,0.8680520012283754,0.8677313677313677,0.39333058619802397,0.7030638101819857,0.7005099675475197,0.8509822140849931,0.8161445138730775,0.8105483268849306,0.7618572141787319,0.7642893272635306,0.6526946107784432,0.6465554129225503,none,0.9209552807413606,0.9199890742081465,0.9310425782044602,COMPLETE
1751,0.7021471829693522,2025-09-23 22:10:38.419801,2025-09-23 22:10:39.113733,0 days 00:00:00.693932,0.005861149403819543,gbtree,0.8304889197054764,0.9822953618277629,depthwise,0.00864885355375798,0.4367103235483577,8,3,1.7607535271342154,600,,0.38786466971652034,0.8113873419106332,oversample,0.8561258053665436,0.5236485309993552,,,,0.9796021551302605,0.8313031016480704,0.8338452088452089,0.38786466971652034,0.7003636363636364,0.7021471829693522,0.8113873419106332,0.8043410836905731,0.7918501936590461,0.6091081593927894,0.6147172236503856,0.823781009409752,0.8185708172871202,oversample,0.918544363490563,0.9144998052832025,0.8561258053665436,COMPLETE
1752,0.6390141268409979,2025-09-23 22:10:39.249633,2025-09-23 22:10:39.838290,0 days 00:00:00.588657,0.07344525080039585,gbtree,0.9637924331544397,1.4671819601224063,depthwise,0.04570982083922565,0.06943834140149625,8,3,0.6374159027051831,200,,0.3588594159491987,0.8605954941391685,oversample,0.7865903896311224,0.981863228780422,,,,0.9433067610426136,0.7487972156822602,0.7540950040950041,0.3588594159491987,0.6346039309112567,0.6390141268409979,0.8605954941391685,0.7184770655733138,0.7085107413596637,0.48675194152581086,0.492471623812833,0.9114627887082977,0.9097133076593924,oversample,0.8937804649078912,0.8929197540493351,0.7865903896311224,COMPLETE
1753,0.7196495619524406,2025-09-23 22:10:39.975162,2025-09-23 22:10:40.685898,0 days 00:00:00.710736,0.09947081759545752,gbtree,0.8520675283144492,0.8813351384171264,depthwise,0.0010275464319182592,0.19865639783483235,9,3,0.5304116313016327,400,,0.5131519100856056,0.9887488036654808,oversample,0.7454314529035047,0.5455498012718276,,,,0.7623550309269959,0.8613983007472618,0.8624078624078624,0.5131519100856056,0.7196687370600414,0.7196495619524406,0.9887488036654808,0.8251423126706868,0.8211575006770029,0.6974317817014446,0.702075702075702,0.7433704020530368,0.7381258023106547,oversample,0.9258737269103294,0.9247692377057635,0.7454314529035047,COMPLETE
1754,0.6994746059544659,2025-09-23 22:10:40.823239,2025-09-23 22:10:41.738752,0 days 00:00:00.915513,0.0007339229317725673,gbtree,0.8400543245415744,1.605122476075921,depthwise,0.0023169761587505723,0.06883406995630739,7,5,0.222231513522714,500,,0.40029616534950874,0.8644854149088677,oversample,0.8037886676698834,0.8629195908397976,,,,0.6454263022478978,0.8212713686150066,0.8243243243243243,0.40029616534950874,0.6982371240926374,0.6994746059544659,0.8644854149088677,0.8191748519511372,0.8149608629111502,0.58584686774942,0.5920545508449452,0.8639863130881095,0.8545143346170304,oversample,0.9216358217298605,0.9212259563047791,0.8037886676698834,COMPLETE
1755,0.713871635610766,2025-09-23 22:10:41.875591,2025-09-23 22:10:42.759270,0 days 00:00:00.883679,0.004463741899093777,gbtree,0.9144665724950818,0.9158373847413077,depthwise,0.0011126523399942038,0.06947646149171387,9,4,0.7433249971074092,600,,0.3881506859211004,0.9544681676020845,none,0.8533340867433865,1.1056526150786299,,,,0.9053833300535593,0.8558706111167981,0.8585176085176085,0.3881506859211004,0.7118297175603766,0.713871635610766,0.9544681676020845,0.8151390663150626,0.812073538628949,0.6824960753532182,0.6915363016446049,0.743798118049615,0.7376979032948224,none,0.9204259167229876,0.9198531496183371,0.8533340867433865,COMPLETE
1756,0.7184586699813549,2025-09-23 22:10:42.895619,2025-09-23 22:10:43.476862,0 days 00:00:00.581243,0.0014774039709211579,gbtree,0.7962883757355383,1.3434121606025753,depthwise,0.0004936795886045612,0.2725439254599028,8,3,0.8330676881444096,200,,0.5133680278387855,0.9420695787470965,oversample,0.8841276616481625,0.5502996128654127,,,,0.911502301788564,0.8655952502815027,0.8608722358722358,0.5133680278387855,0.7281010561192793,0.7184586699813549,0.9420695787470965,0.8281585850449941,0.8219664503003047,0.7057406663990365,0.6963855421686747,0.7519247219846023,0.7419768934531451,oversample,0.9272481048630001,0.9258205011134529,0.8841276616481625,COMPLETE
1757,0.7156525066972829,2025-09-23 22:10:43.614374,2025-09-23 22:10:44.332633,0 days 00:00:00.718259,1.1478152328632052,gbtree,0.7571876144472649,8.282887734458573,lossguide,0.001867734060376426,0.15383207251393305,3,9,7.841416041767536,300,,0.6728261324763306,0.9702785156175122,none,0.8441513367990805,4.475529985287484,,,,0.7670553052363607,0.8466577950660252,0.8478705978705978,0.6728261324763306,0.7163953048087845,0.7156525066972829,0.9702785156175122,0.8206527729777663,0.8174759146232318,0.6426630434782609,0.647282796815507,0.8092386655260907,0.8001711596063329,none,0.9257466093247497,0.9243527977000444,0.8441513367990805,COMPLETE
1758,0.7181300333922609,2025-09-23 22:10:44.469063,2025-09-23 22:10:45.136722,0 days 00:00:00.667659,0.06627902664457559,gbtree,0.868232193644483,1.272786506355684,depthwise,0.0006125748904100639,0.17467016064803842,8,3,0.15644186745183614,400,,0.4856853482336736,0.9790204040342858,undersample,0.8999235672484858,0.5644286424581233,,,,0.7099623830928543,0.8521854846964889,0.8530917280917281,0.4856853482336736,0.71796875,0.7181300333922609,0.9790204040342858,0.821353107809305,0.8131348059872024,0.6606757728253055,0.663761801016703,0.786142001710864,0.7821994009413779,undersample,0.9251193385764372,0.9224006200073052,0.8999235672484858,COMPLETE
1759,0.6879338842975207,2025-09-23 22:10:45.274122,2025-09-23 22:11:20.069681,0 days 00:00:34.795559,0.006273651109848556,dart,0.6279823895049772,6.5783602267753665,depthwise,0.004397344999490669,0.014799351007988026,4,12,0.4138550084736985,700,forest,0.6844418569935241,0.9938219734058416,undersample,0.9503861998624406,3.1690174200971186,0.12703675380143464,weighted,0.6852558323790707,0.4614559582564443,0.8046882997236156,0.8067158067158067,0.6844418569935241,0.6881333769205623,0.6879338842975207,0.9938219734058416,0.8212412309323371,0.8119143108596074,0.5568783068783069,0.5604632372744411,0.9003421727972626,0.8904578519469405,undersample,0.9254971802746661,0.9227032472819255,0.9503861998624406,COMPLETE
1760,0.6630347700688992,2025-09-23 22:11:20.210046,2025-09-23 22:11:23.992955,0 days 00:00:03.782909,0.00020745146708706048,dart,0.8960617883542259,5.408750276284074,depthwise,20.42987324851907,0.12031832639532392,0,12,3.923980770847003,200,tree,0.6862771290822659,0.9782495731100375,oversample,0.9926675739222786,4.006581807471707,0.15274632858001877,uniform,0.4076764316632641,0.6320891928662984,0.7727505374142696,0.7847051597051597,0.6862771290822659,0.6508335954702736,0.6630347700688992,0.9782495731100375,0.7514205215099297,0.7460485073679084,0.5146766169154229,0.529969262295082,0.8849443969204448,0.8853230637569534,oversample,0.900604869043849,0.9007383978818222,0.9926675739222786,COMPLETE
1761,0.6515127762972253,2025-09-23 22:11:24.129786,2025-09-23 22:11:24.768386,0 days 00:00:00.638600,0.00029329560844164164,gbtree,0.9379932682930207,0.8291892039835683,depthwise,0.001232893665780977,0.20876710874974824,9,6,0.10102100701412535,200,,0.4019539915515969,0.8836600778858198,undersample,0.9948763696478548,1.2239384518022123,,,,0.8780378219417424,0.7646637322141467,0.7724201474201474,0.4019539915515969,0.6426239701538939,0.6515127762972253,0.8836600778858198,0.7252917131447586,0.7213184610255301,0.5047619047619047,0.5141019297377536,0.8840889649272883,0.8891741548994437,undersample,0.8895743607081932,0.8916050197834915,0.9948763696478548,COMPLETE
1762,0.6277706277706278,2025-09-23 22:11:24.904669,2025-09-23 22:11:25.546083,0 days 00:00:00.641414,0.06077571130627284,gbtree,0.6024314554756878,2.1392935145086436,depthwise,0.0002063321437775698,0.019955875840866586,9,3,0.16859938239516056,300,,0.34222282346266125,0.78501347362764,oversample,0.9594648113256189,1.1835988379391802,,,,0.8151458475211305,0.7253557170641827,0.7335176085176085,0.34222282346266125,0.6215263083650726,0.6277706277706278,0.78501347362764,0.7804266169132215,0.768304376063093,0.4636918543464534,0.47143470790378006,0.9422583404619332,0.9392383397518186,oversample,0.9094027182960338,0.9049765905091641,0.9594648113256189,COMPLETE
1763,0.6665465032444124,2025-09-23 22:11:25.681173,2025-09-23 22:11:26.560895,0 days 00:00:00.879722,0.0002049414859693415,gbtree,0.8338835028673764,0.24410943243122352,depthwise,0.03311459969955185,0.35682258636710223,9,6,0.13004224959754684,500,,0.3039818019955173,0.9389005058862895,oversample,0.9904845735969983,0.5909368257870614,,,,0.9676421636615105,0.8016173610400246,0.8106060606060606,0.3039818019955173,0.6528126119670369,0.6665465032444124,0.9389005058862895,0.7124636483830347,0.7126049182161858,0.561652281134402,0.5758330738087823,0.7792985457656116,0.7911852802738554,oversample,0.8821400972206346,0.8872856927579114,0.9904845735969983,COMPLETE
1764,0.7082728592162555,2025-09-23 22:11:26.700165,2025-09-23 22:11:33.245803,0 days 00:00:06.545638,7.338217518909443,dart,0.7820651704807192,6.76863742452018,depthwise,0.4498383240879309,0.25415895254555765,5,11,0.4795836539269398,300,forest,0.6357737476896131,0.9161974945735378,none,0.994159892996679,4.858195794464622,0.23535684204183496,uniform,0.33024561058616575,0.6614302849056543,0.8321220186303614,0.8353808353808354,0.6357737476896131,0.7049298308744153,0.7082728592162555,0.9161974945735378,0.8197253670125128,0.810849439014647,0.6083850931677018,0.6148031496062992,0.8378956372968349,0.8352588789045785,none,0.9238255422944986,0.9210199820375697,0.994159892996679,COMPLETE
1765,0.7086938607334158,2025-09-23 22:11:33.383065,2025-09-23 22:11:34.301417,0 days 00:00:00.918352,0.0010076251187916756,gbtree,0.7919611737044829,2.0977238605899595,depthwise,0.00020291860703460302,0.06626651782040774,10,6,0.12062676113746654,600,,0.400988808739663,0.9612968975094127,none,0.9782595038182071,1.0302911956414103,,,,0.7802826287631912,0.8592486436687481,0.8552416052416052,0.400988808739663,0.7173689619732785,0.7086938607334158,0.9612968975094127,0.8110214923499467,0.7971031076427118,0.6905421448357737,0.6833531982518871,0.7463644140290847,0.7359863072314934,none,0.9221161460457594,0.9166129561556966,0.9782595038182071,COMPLETE
1766,0.7001298139333622,2025-09-23 22:11:34.442852,2025-09-23 22:11:35.015276,0 days 00:00:00.572424,0.00012673246898700644,gbtree,0.8026772019185471,0.9600685386195463,depthwise,0.0005151228404392843,0.04362353125377418,9,3,0.625714509651085,200,,0.43151911649072006,0.7992179259658628,none,0.8488840230476186,1.2629886318590071,,,,0.7566576222362417,0.8560753403623708,0.8581081081081081,0.43151911649072006,0.6980240549828178,0.7001298139333622,0.7992179259658628,0.8029793248137961,0.7973632177426773,0.7010353753235548,0.7080962800875273,0.695038494439692,0.6923406076166024,none,0.9142052419758212,0.9142526591957375,0.8488840230476186,COMPLETE
1767,0.7063711911357341,2025-09-23 22:11:35.151014,2025-09-23 22:11:53.337805,0 days 00:00:18.186791,0.00024701352005192874,dart,0.41953887816884083,2.381689807935469,lossguide,0.00010746365691914283,0.07213941562249666,6,5,0.22102614058339137,500,tree,0.3219169362504197,0.9918894806959789,oversample,0.9770658489459892,0.5641615353168234,0.16377553353056618,weighted,0.862628308449577,0.7700226922695961,0.8235233903163067,0.8263718263718264,0.3219169362504197,0.7037800687285224,0.7063711911357341,0.9918894806959789,0.8317734378144122,0.8241359649025968,0.5881677197013211,0.5931956964233789,0.8759623609923011,0.8729139922978177,oversample,0.9290988356063696,0.9272630119795024,0.9770658489459892,COMPLETE
1768,0.718839473181905,2025-09-23 22:11:53.474312,2025-09-23 22:12:00.166831,0 days 00:00:06.692519,0.013625178571698189,dart,0.9385282633947565,0.053152796511353406,depthwise,0.0007269019635823814,0.16499632363712377,10,5,0.19193087237307394,300,forest,0.34867713340344253,0.8852776682162649,none,0.8503412503406941,1.2283721122172047,0.12125811767382091,weighted,0.7004955301824783,0.5648781359487489,0.8482956290306071,0.8492014742014742,0.34867713340344253,0.720377358490566,0.718839473181905,0.8852776682162649,0.8268155332839526,0.8186780526884778,0.6444969615124916,0.6488628532046864,0.8165098374679213,0.8057338468121523,none,0.9265589876824007,0.9243100135567576,0.8503412503406941,COMPLETE
1769,0.7015610651974288,2025-09-23 22:12:00.303078,2025-09-23 22:12:01.272763,0 days 00:00:00.969685,0.04794269797258748,gbtree,0.9982967398924512,0.6738305457156749,depthwise,0.00018412372387349683,0.27665181309858766,8,5,2.8412333782157138,500,,0.4157785979278871,0.9812793287646026,oversample,0.9032135089296834,1.0072868894638567,,,,0.7822383238749085,0.8309960077797113,0.8336404586404587,0.4157785979278871,0.6977850997620355,0.7015610651974288,0.9812793287646026,0.8033701549259977,0.7998319987137971,0.60992,0.6145431145431145,0.8152266894781864,0.8172871202396235,oversample,0.9147048483343595,0.9133478580605239,0.9032135089296834,COMPLETE
1770,0.7022865142323845,2025-09-23 22:12:01.412528,2025-09-23 22:12:02.221446,0 days 00:00:00.808918,0.2896351411203493,gbtree,0.9848868685763859,4.955808194899185,depthwise,0.008467706849623667,0.024736616984398267,9,7,0.10848588373210385,300,,0.3589637227946301,0.9939727519169453,none,0.8551597694277564,0.6056398338004064,,,,0.7096245527877589,0.8713276691575391,0.8693693693693694,0.3589637227946301,0.7086906141367323,0.7022865142323845,0.9939727519169453,0.8232162582508844,0.8166896570057167,0.7733940313606474,0.7721908671113391,0.6539777587681779,0.6439880188275567,none,0.9243013770601712,0.9226282166780192,0.8551597694277564,COMPLETE
1771,0.6707503828483921,2025-09-23 22:12:02.358419,2025-09-23 22:12:02.951283,0 days 00:00:00.592864,0.0006624095091288536,gbtree,0.6876355501236529,1.646991237647931,depthwise,0.0002829457783349054,0.26473061674661175,8,5,0.2474853637755034,200,,0.4008314251933622,0.9049804549609356,none,0.9848011943536991,0.8386036432865953,,,,0.8028539842669132,0.8406182823216296,0.8459254709254709,0.4008314251933622,0.6672365890147467,0.6707503828483921,0.9049804549609356,0.744180079784232,0.7408846607626887,0.6668090559589919,0.6862130707251567,0.6676646706586826,0.6559691912708601,none,0.8985222933221164,0.8989862922023395,0.9848011943536991,COMPLETE
1772,0.7105765559373807,2025-09-23 22:12:03.092759,2025-09-23 22:12:06.497959,0 days 00:00:03.405200,0.0005754804555230124,dart,0.9999576776471739,4.618696781401382,depthwise,0.001445036137945345,0.22907561271838353,5,12,2.310565343763222,200,tree,0.6858524568294336,0.9043458809909737,none,0.8924593334668711,4.85210840628205,0.2084498988686504,uniform,0.5569714508398105,0.9526578114157634,0.8430750332685024,0.8447993447993448,0.6858524568294336,0.7074985689753863,0.7105765559373807,0.9043458809909737,0.8177729475546132,0.8148885549452668,0.6386496727523252,0.6415029300241296,0.7929854576561164,0.7963200684638425,none,0.9214495629537971,0.920540459893263,0.8924593334668711,COMPLETE
1773,0.6907044601917466,2025-09-23 22:12:06.638199,2025-09-23 22:12:08.084793,0 days 00:00:01.446594,0.0011769851596624534,gbtree,0.7861035227992741,0.858505078039935,lossguide,0.02188591046946042,0.2765211144951046,7,7,0.17484226013485643,300,,0.35140086500566314,0.9342790072012125,none,0.8896647675270157,0.944710075945105,,,,0.6077637781439791,0.8456341488381616,0.8480753480753481,0.35140086500566314,0.6885584469227591,0.6907044601917466,0.9342790072012125,0.7924127334918405,0.7861183953044026,0.6657348242811502,0.6733035351483136,0.7130025662959795,0.7090286692340607,none,0.9099755964166022,0.9071822484155615,0.8896647675270157,COMPLETE
