number,value,datetime_start,datetime_complete,duration,params_alpha,params_booster,params_colsample_bytree,params_gamma,params_grow_policy,params_lambda,params_learning_rate,params_max_delta_step,params_max_depth,params_min_child_weight,params_n_estimators,params_normalize_type,params_params_decision_threshold,params_params_feature_fraction,params_params_resampling,params_params_sample_rows,params_params_scale_pos_weight,params_rate_drop,params_sample_type,params_skip_drop,params_subsample,user_attrs_acc_test,user_attrs_acc_val,user_attrs_decision_threshold,user_attrs_f1_test,user_attrs_f1_val,user_attrs_feature_fraction,user_attrs_pr_auc_test,user_attrs_pr_auc_val,user_attrs_prec_test,user_attrs_prec_val,user_attrs_rec_test,user_attrs_rec_val,user_attrs_resampling_strategy,user_attrs_roc_auc_test,user_attrs_roc_auc_val,user_attrs_sample_rows,state
2729,0.47339936689472073,2025-09-24 02:24:13.225604,2025-09-24 02:25:06.260900,0 days 00:00:53.035296,24.811815777922043,dart,0.5556948815524537,2.387860850083323,lossguide,3.3756126617549493,0.025487089330818453,5,7,90.24346277777063,900,forest,0.31294866440871943,0.6441063265753371,undersample,0.6399890586704717,3.145679993922126,0.06700880480640994,weighted,0.5984908771216244,0.29276523800844295,0.4715938171767837,0.47205159705159705,0.31294866440871943,0.4735875994289211,0.47339936689472073,0.6441063265753371,0.6557297898156264,0.6602565778203563,0.31092662024638457,0.31089055793991416,0.9931565440547476,0.991869918699187,undersample,0.8545013036387574,0.8546712194062425,0.6399890586704717,COMPLETE
2730,0.7254293399544797,2025-09-24 02:25:06.415906,2025-09-24 02:25:09.286158,0 days 00:00:02.870252,0.00010421750512690849,gbtree,0.5302623527169302,2.3121523679115903,lossguide,0.09407720492076606,0.021387889962294158,0,7,0.576210745071739,1000,,0.6744765976374849,0.9927985119700832,none,0.7577720082131612,3.663136794025189,,,,0.926622929362939,0.8616030299928344,0.8641482391482391,0.6744765976374849,0.7218106995884773,0.7254293399544797,0.9927985119700832,0.8288536770319597,0.821424636090507,0.6954797779540047,0.702323717948718,0.7502138579982891,0.750106974753958,none,0.9281488640459434,0.9259120868199098,0.7577720082131612,COMPLETE
2731,0.0,2025-09-24 02:25:09.436847,2025-09-24 02:25:10.298173,0 days 00:00:00.861326,0.00015932688921334014,gbtree,0.4004677127947339,4.5004972985196074,depthwise,0.0002178546137196216,0.00039220508048165266,7,12,3.09381204693742,200,,0.6417595746393311,0.8229601237505592,undersample,0.7972939337885436,0.9545723442669052,,,,0.5495408605502439,0.7606715119254785,0.7607493857493858,0.6417595746393311,0.0,0.0,0.8229601237505592,0.765174642243167,0.7560321455188971,0.0,0.0,0.0,0.0,undersample,0.8990893868298928,0.8975787629877658,0.7972939337885436,COMPLETE
2732,0.7000935453695042,2025-09-24 02:25:10.452130,2025-09-24 02:25:28.661455,0 days 00:00:18.209325,0.001953943765158614,dart,0.5078400922151336,5.040115572375331,depthwise,0.7586795760017279,0.18489847381533792,0,7,15.398294705244822,500,forest,0.6305977478922603,0.9530677754635828,none,0.8663569869033982,4.347962746495476,0.04655538791226272,weighted,0.44102689485766766,0.25089879528121517,0.8377520728836114,0.8358927108927109,0.6305977478922603,0.7068614758646199,0.7000935453695042,0.9530677754635828,0.8084919564781985,0.7996266905202101,0.6226783968719453,0.6220079787234043,0.8173652694610778,0.8005990586221652,none,0.919469095720549,0.9164839703132174,0.8663569869033982,COMPLETE
2733,0.7057346169945584,2025-09-24 02:25:28.813068,2025-09-24 02:25:32.125726,0 days 00:00:03.312658,0.0009380070563825584,gbtree,0.49995725079898184,1.658414132670988,lossguide,0.14274577906418776,0.0031954836292399074,0,6,4.780800405016296,1000,,0.6198634743321059,0.9543075941322156,none,0.8233896357920493,2.867624562380168,,,,0.9974358068452414,0.8577131743269526,0.8560606060606061,0.6198634743321059,0.7110187110187111,0.7057346169945584,0.9543075941322156,0.8114956854159364,0.8040812992451426,0.691747572815534,0.6907005325686194,0.7313943541488451,0.7214377406931964,none,0.9198848108040221,0.9176117902733965,0.8233896357920493,COMPLETE
2734,0.7232299590403745,2025-09-24 02:25:32.277725,2025-09-24 02:25:35.249854,0 days 00:00:02.972129,0.0005057965830950429,gbtree,0.4143180646013478,2.879160958519577,lossguide,0.02623369046299296,0.022171114443248006,2,8,0.20302846074701783,1000,,0.603570515049719,0.9806153271501388,none,0.7315602861122216,3.40768135152465,,,,0.8378728365297833,0.8551540587572934,0.8547297297297297,0.603570515049719,0.7245474012069301,0.7232299590403745,0.9806153271501388,0.8291809429819412,0.8236440540109156,0.6648803143979993,0.6645161290322581,0.7959794696321643,0.7933247753530167,none,0.9285591974249783,0.9267142751107937,0.7315602861122216,COMPLETE
2735,0.71727078891258,2025-09-24 02:25:35.404868,2025-09-24 02:25:36.093684,0 days 00:00:00.688816,0.025068186675087888,gbtree,0.8979282394790328,2.2417211502933934,lossguide,0.028640060239924478,0.4170690655784137,8,3,0.13697628969990985,200,,0.48820508589759476,0.9966612451827157,none,0.9980029168814213,1.3722493601539478,,,,0.7388135723818161,0.8641621455624936,0.8642506142506142,0.48820508589759476,0.7195096174170366,0.71727078891258,0.9966612451827157,0.8191797405786228,0.8140570689244445,0.7112411199331383,0.7148321291967701,0.7279726261762189,0.7197261446298674,none,0.9239480839923475,0.9226549351739614,0.9980029168814213,COMPLETE
2736,0.6684994272623138,2025-09-24 02:25:36.244207,2025-09-24 02:25:38.826344,0 days 00:00:02.582137,0.0008714405411450806,gbtree,0.7324023767065705,1.998433082904482,lossguide,0.8364152319551902,0.011954960780459834,1,6,3.0204660043216522,900,,0.6591076258071369,0.9585041255103489,none,0.6855871820650113,2.123473903936041,,,,0.7218621079902553,0.8481932644078206,0.8518632268632269,0.6591076258071369,0.6647072122993444,0.6684994272623138,0.9585041255103489,0.7561230501269163,0.7457590909233351,0.7050359712230215,0.7194280078895463,0.6287425149700598,0.6243046640992725,none,0.9015030956599979,0.9010440194706432,0.6855871820650113,COMPLETE
2737,0.6784071077264795,2025-09-24 02:25:38.981127,2025-09-24 02:25:42.086238,0 days 00:00:03.105111,0.001603439375218023,gbtree,0.788672696928935,1.2300214185739968,lossguide,0.04593637395788834,0.004024318058548278,0,6,1.005719370575783,1000,,0.6826218792699286,0.8915988827281387,undersample,0.7712366672120929,3.637019427203723,,,,0.9368405414661408,0.7861603029992834,0.7924856674856675,0.6826218792699286,0.6717989002356638,0.6784071077264795,0.8915988827281387,0.8118112878560866,0.8051525873407631,0.5309163148745965,0.5390821986888553,0.9144568006843456,0.9148480958493795,undersample,0.9204826980216854,0.9197110348597483,0.7712366672120929,COMPLETE
2738,0.7211172238679645,2025-09-24 02:25:42.236960,2025-09-24 02:25:46.742778,0 days 00:00:04.505818,0.00010909531622867245,gbtree,0.698206817832417,0.3669386004830333,lossguide,0.3121351502426582,0.00937927302238304,1,8,2.468695262640617,900,,0.6499477024581112,0.9113754518066925,none,0.7519830014523943,2.8627378389837976,,,,0.9929094264836632,0.8643668748080663,0.8650696150696151,0.6499477024581112,0.7208763429534443,0.7211172238679645,0.9113754518066925,0.8266668303625531,0.8214364544061339,0.7102532171025322,0.7132691502720804,0.7318220701454234,0.7291399229781772,none,0.9273150452080438,0.9259901117380169,0.7519830014523943,COMPLETE
2739,0.6511125513069778,2025-09-24 02:25:46.894659,2025-09-24 02:25:59.509820,0 days 00:00:12.615161,0.0015676616383351932,dart,0.3977431514136496,1.5503785081669834,depthwise,0.0042974520914013095,0.09087884226857297,0,9,0.15962417420134015,400,forest,0.6893991394916875,0.7882921342805131,none,0.6864219103809464,3.6052129985283394,0.06787031617076725,weighted,0.8264216244546929,0.6757453756711295,0.8319172893847886,0.8346642096642096,0.6893991394916875,0.652265988987717,0.6511125513069778,0.7882921342805131,0.7066269458636139,0.6995772181045683,0.6459731543624161,0.6575043630017452,0.6586826347305389,0.6448438168592212,none,0.8847507994565114,0.8858551879401463,0.6864219103809464,COMPLETE
2740,0.7171347171347171,2025-09-24 02:25:59.661104,2025-09-24 02:26:01.011070,0 days 00:00:01.349966,0.0019079806431690982,gbtree,0.43800352686003124,3.1272868003073286,lossguide,4.3300134530595455,0.05312635588909896,3,7,1.623852233563609,1000,,0.6846271647939338,0.8969323534262266,none,0.6723419197221273,3.7917898401191055,,,,0.9832745157139124,0.8580202681953117,0.8576986076986077,0.6846271647939338,0.7192875936045335,0.7171347171347171,0.8969323534262266,0.822140397340543,0.814611867200379,0.68267383787937,0.6837407838571983,0.7600513259195893,0.7539580658964484,none,0.9237997561598643,0.9223133530232526,0.6723419197221273,COMPLETE
2741,0.7232006958034355,2025-09-24 02:26:01.162291,2025-09-24 02:26:11.301965,0 days 00:00:10.139674,0.009196999572964748,dart,0.6914663506564153,1.476027388748571,lossguide,0.017412626423677142,0.028536106560638912,3,11,2.0721845632998854,300,forest,0.6855563767503575,0.9482217233970306,none,0.9877645481176746,3.3189574010199174,0.09250259828901404,weighted,0.7267162187015997,0.5737244777840238,0.8675401781144436,0.8696764946764947,0.6855563767503575,0.7189400521285838,0.7232006958034355,0.9482217233970306,0.8250966946623842,0.8218597208764016,0.7303618711385702,0.7351900972590628,0.7078699743370402,0.7115960633290543,none,0.9262342147701828,0.9249953948023428,0.9877645481176746,COMPLETE
2742,0.5606789250353607,2025-09-24 02:26:11.455030,2025-09-24 02:26:12.469564,0 days 00:00:01.014534,0.00019242616863088006,gbtree,0.22680866345949763,2.868613189486829,lossguide,7.480201428051949,0.017512661291938944,1,7,0.29007203568369283,200,,0.6544094978862285,0.8802005149779281,none,0.9559158402979737,1.540958748751391,,,,0.9865828900334528,0.8461459719520934,0.841011466011466,0.6544094978862285,0.5800502933780386,0.5606789250353607,0.8802005149779281,0.777323515366745,0.7685236475388955,0.8364222401289283,0.827212020033389,0.4439692044482464,0.4240479246897732,none,0.909485544741879,0.9082032231834545,0.9559158402979737,COMPLETE
2743,0.7017678708685626,2025-09-24 02:26:12.625235,2025-09-24 02:26:38.652226,0 days 00:00:26.026991,0.0006098692314779928,dart,0.6558847444315564,0.9221018090480335,lossguide,0.0348585499996744,0.011665509832582178,0,6,9.60619171836711,600,forest,0.6817946949078539,0.9262611567577177,none,0.9089359192265172,4.583135846112927,0.06834953439033274,weighted,0.6028592463149463,0.20464544278055896,0.8433821271368614,0.8411138411138411,0.6817946949078539,0.707680550248376,0.7017678708685626,0.9262611567577177,0.8115153959658276,0.8040567789457413,0.6395027624309392,0.6369026857342169,0.7921300256629598,0.7813436029097133,none,0.9205325435408668,0.9183423165638493,0.9089359192265172,COMPLETE
2744,0.7169456460410005,2025-09-24 02:26:38.805040,2025-09-24 02:26:39.987085,0 days 00:00:01.182045,0.0012716105088231785,gbtree,0.5372283483361323,2.8619375575175807,lossguide,0.08859116400524687,0.20431137230348317,0,7,0.8951103446733775,900,,0.6045446687778055,0.9910537274328083,none,0.7723243407436406,4.905048322759574,,,,0.8958981916076761,0.8391851776026206,0.8459254709254709,0.6045446687778055,0.7083720066827548,0.7169456460410005,0.9910537274328083,0.8188540309585803,0.8189940732883267,0.625778943916038,0.6395973154362417,0.8160821214713431,0.8155755241762944,none,0.9232565781407945,0.9240804878567028,0.7723243407436406,COMPLETE
2745,0.6700150678051231,2025-09-24 02:26:40.137654,2025-09-24 02:27:15.178611,0 days 00:00:35.040957,5.068442890289251,dart,0.4723313402260436,2.082207842200283,lossguide,0.0021883807423164927,0.027718477725270998,8,5,2.2000083489140434,700,forest,0.47056993428955673,0.9022941233472289,none,0.9255912501528305,3.022603530888635,0.0012458194001270517,weighted,0.8221634619859983,0.6648483883351867,0.7959873067867745,0.7982186732186732,0.47056993428955673,0.6674453529117303,0.6700150678051231,0.9022941233472289,0.7544957364992169,0.7450077791190315,0.5471956224350205,0.5503300330033003,0.8554319931565441,0.8562259306803595,none,0.9012481697888034,0.9008960600410669,0.9255912501528305,COMPLETE
2746,0.550146315509444,2025-09-24 02:27:15.331743,2025-09-24 02:27:31.942033,0 days 00:00:16.610290,43.65982904775516,dart,0.9926391204527155,3.4453772110534784,depthwise,14.627068048507853,0.01733482308786669,10,7,42.84873643324525,500,forest,0.6804186674004227,0.5058405071087577,undersample,0.789743003760773,0.7325974185386049,0.11309020252592,weighted,0.6879636589830435,0.3040244122989297,0.8294605384379159,0.8268837018837019,0.6804186674004227,0.5650130548302872,0.550146315509444,0.5058405071087577,0.6658883080517004,0.6555647951525607,0.725201072386059,0.7271448663853727,0.4627887082976903,0.44244758237056053,undersample,0.8658074012883167,0.8668569265426203,0.789743003760773,COMPLETE
2747,0.7075451185040226,2025-09-24 02:27:32.090721,2025-09-24 02:27:33.150737,0 days 00:00:01.060016,0.004766506633822388,gbtree,0.8117633247569658,0.5726271645287091,depthwise,0.03261613860690533,0.25280422433367555,3,4,0.3477278544510591,900,,0.6071624336090345,0.8593230916088357,none,0.7920484176158767,2.0942063613459676,,,,0.9658302528283443,0.8630361347118436,0.8623054873054873,0.6071624336090345,0.7095093356491533,0.7075451185040226,0.8593230916088357,0.8129404039270084,0.8089927629418716,0.7204585537918872,0.7192749778956675,0.6988879384088965,0.6961916987590928,none,0.9192246742457182,0.9175298785051258,0.7920484176158767,COMPLETE
2748,0.6279544791362708,2025-09-24 02:27:33.312783,2025-09-24 02:27:34.065800,0 days 00:00:00.753017,24.59704664105255,gbtree,0.551298242638087,6.372560166112153,lossguide,24.307815863229447,0.027769808222627264,8,3,30.120449095890216,300,,0.4208691159165353,0.8764637563624984,undersample,0.9381055624886614,1.2315840082462048,,,,0.27064940782001135,0.7303715835807145,0.7389434889434889,0.4208691159165353,0.621551724137931,0.6279544791362708,0.8764637563624984,0.7586829553415979,0.75133915902649,0.46797922977066203,0.47642240425060883,0.9251497005988024,0.9208386820710313,undersample,0.8997179814199389,0.8973462717649934,0.9381055624886614,COMPLETE
2749,0.7110501029512697,2025-09-24 02:27:34.219623,2025-09-24 02:27:38.066894,0 days 00:00:03.847271,0.00011478376248283937,gbtree,0.5117723964787212,1.4967092538985858,lossguide,0.16476657864170333,0.01560652646310071,1,8,0.21470569501364292,1000,,0.6572007273189997,0.9275531411536158,none,0.6896172128290394,2.2188323276189528,,,,0.9801206145733619,0.8705087521752483,0.8707002457002457,0.6572007273189997,0.7146401985111662,0.7110501029512697,0.9275531411536158,0.8251025298482986,0.8231992468901324,0.7560859188544152,0.7640117994100295,0.6775021385799829,0.6649550706033376,none,0.9268610826101416,0.9266146565806648,0.6896172128290394,COMPLETE
2750,0.6820652173913043,2025-09-24 02:27:38.218292,2025-09-24 02:27:57.608134,0 days 00:00:19.389842,0.0013277586670548522,dart,0.9064493155576372,6.340166979632772,lossguide,0.00019424029595758964,0.046819727469550446,7,8,0.15286026356158974,500,forest,0.6920479496193852,0.97495173490632,none,0.8767838077694688,4.652535099684206,0.08915737185727667,weighted,0.6752559339472903,0.4429849504410961,0.8260825058859658,0.8323095823095823,0.6920479496193852,0.6743339083764616,0.6820652173913043,0.97495173490632,0.7503201769658532,0.7458661786075083,0.6109760333449115,0.6241563055062167,0.7523524379811805,0.7518185708172871,none,0.8998588554478792,0.9005572130812144,0.8767838077694688,COMPLETE
2751,0.12590216519647154,2025-09-24 02:27:57.759318,2025-09-24 02:27:58.797473,0 days 00:00:01.038155,0.1547405537033777,gbtree,0.39876953148342653,5.630169841144578,lossguide,1.4613317855234362,0.0015671182007755613,2,11,13.660505487742366,200,,0.4979640795088831,0.7678493191849541,none,0.5297399327388099,1.9218266905325923,,,,0.6046846762352396,0.7769474869485106,0.7768222768222768,0.4979640795088831,0.12735282338806567,0.12590216519647154,0.7678493191849541,0.7555651920466881,0.7476387637772779,1.0,1.0,0.06800684345594525,0.06718014548566538,none,0.8995379389441891,0.8983915177527995,0.5297399327388099,COMPLETE
2752,0.6554953178905865,2025-09-24 02:27:58.948677,2025-09-24 02:27:59.624899,0 days 00:00:00.676222,16.233370488862843,gbtree,0.5197235418026833,9.975101909406742,depthwise,5.301545279395351,0.2322057968711949,3,6,3.802271408985234,200,,0.5272852206974772,0.7977212065129585,oversample,0.985089473946918,1.228145750710958,,,,0.32242332712612737,0.7831917289384789,0.7853194103194103,0.5272852206974772,0.654373368146214,0.6554953178905865,0.7977212065129585,0.7352893833165757,0.7249922521009067,0.5290237467018469,0.532,0.8575705731394354,0.8536585365853658,oversample,0.8924185483350157,0.8924716434126498,0.985089473946918,COMPLETE
2753,0.7196776929601357,2025-09-24 02:27:59.778698,2025-09-24 02:28:12.745159,0 days 00:00:12.966461,2.495374197276667,dart,0.5790677156614594,3.8013239421069365,lossguide,2.5768037486783015,0.0318556216073858,0,9,0.1854226215383479,400,forest,0.6692727078868372,0.9985975238640385,none,0.9433265332188293,2.9660853653125647,0.004043911467906933,weighted,0.6143086102753318,0.35399201259084295,0.8662094380182209,0.8646601146601146,0.6692727078868372,0.7233862433862434,0.7196776929601357,0.9985975238640385,0.8224085895667941,0.8164848530615996,0.7159614578969418,0.7133249264396805,0.7309666381522669,0.7261446298673513,none,0.9256879861592922,0.9239376533110465,0.9433265332188293,COMPLETE
2754,0.6951151038742279,2025-09-24 02:28:12.894225,2025-09-24 02:28:13.717576,0 days 00:00:00.823351,0.00014871609827664362,gbtree,0.6794935687183837,0.6278437233742643,depthwise,0.3565027435098221,0.23526035842599236,9,7,1.382164185110671,200,,0.33319681164604203,0.9046662670628024,none,0.9649266537804038,1.3840464887652626,,,,0.8045600389698642,0.8328385709898659,0.8332309582309583,0.33319681164604203,0.6967502321262767,0.6951151038742279,0.9046662670628024,0.803883516396316,0.7989445896759759,0.615687561535937,0.6177644710578842,0.8023952095808383,0.7946084724005135,none,0.9129698386259951,0.9126790319174892,0.9649266537804038,COMPLETE
2755,0.7183728207420653,2025-09-24 02:28:13.868001,2025-09-24 02:28:17.004994,0 days 00:00:03.136993,0.0003786817297605821,gbtree,0.6194163620120495,0.9171161135900301,lossguide,0.01929384993716269,0.00856255693995648,1,6,0.22793285993828274,1000,,0.6483154421183743,0.9983809353621541,none,0.8565768676626351,2.4790190470524904,,,,0.9978601144934326,0.8725560446309756,0.871007371007371,0.6483154421183743,0.7227788911155645,0.7183728207420653,0.9983809353621541,0.8283865713212217,0.8213607508046386,0.7538318625174175,0.7519887693027609,0.6941830624465355,0.6876337184424476,none,0.9274519189316159,0.9254260002175484,0.8565768676626351,COMPLETE
2756,0.27540500736377027,2025-09-24 02:28:17.156991,2025-09-24 02:28:18.730153,0 days 00:00:01.573162,0.005738319299679015,gbtree,0.5149886202339666,8.575222222993428,depthwise,0.14384973106275994,0.0002694665083701542,6,9,0.14188184061583678,600,,0.39395649842602076,0.8303445310892102,none,0.9792447647680517,1.4841350210392084,,,,0.9286805332421979,0.7989558808475791,0.7985257985257985,0.39395649842602076,0.27740986019131714,0.27540500736377027,0.8303445310892102,0.7848228877335316,0.7810625692890294,0.9921052631578947,0.9868073878627969,0.16124893071000856,0.1600342319212666,none,0.9093968473457376,0.9063187918494998,0.9792447647680517,COMPLETE
2757,0.6718083360682638,2025-09-24 02:28:18.880907,2025-09-24 02:28:20.074812,0 days 00:00:01.193905,0.0010192995601275901,gbtree,0.8893721318059633,9.393160022515387,lossguide,0.002967865111464785,0.007946648559391664,9,8,0.29224664401288264,300,,0.3840076538005004,0.9632334800745133,undersample,0.9237051393462309,0.6511401296885004,,,,0.7612427994221481,0.7920974511208926,0.7952497952497952,0.3840076538005004,0.6705596107055961,0.6718083360682638,0.9632334800745133,0.7987031974681519,0.7921797643740687,0.540109746537758,0.5448496140537663,0.8840889649272883,0.8759092854086435,undersample,0.9112223099794988,0.9097167050543504,0.9237051393462309,COMPLETE
2758,0.0,2025-09-24 02:28:20.228705,2025-09-24 02:28:22.759074,0 days 00:00:02.530369,0.6899761837529392,gbtree,0.9898034564508807,3.226031209439628,lossguide,0.012877106244819692,0.0010078805835349851,0,7,24.25790769455154,700,,0.6403715601039399,0.8762342138540061,none,0.7090916851323763,0.7362703940942058,,,,0.9993890701426961,0.7606715119254785,0.7607493857493858,0.6403715601039399,0.0,0.0,0.8762342138540061,0.7845968549579002,0.7754779093692157,0.0,0.0,0.0,0.0,none,0.9062401755114835,0.90367273942378,0.7090916851323763,COMPLETE
2759,0.7183570829840737,2025-09-24 02:28:22.915965,2025-09-24 02:28:25.454581,0 days 00:00:02.538616,0.0024957635718081982,gbtree,0.824001114630467,1.8150567369158024,lossguide,0.033391515647781374,0.04411210407020982,0,7,0.3263720420569592,1000,,0.6561008256731239,0.9851815766501909,none,0.6284275434106315,3.7137230875589733,,,,0.8648350549312472,0.8595557375371071,0.8624078624078624,0.6561008256731239,0.7136894824707847,0.7183570829840737,0.9851815766501909,0.8207720468691189,0.8163035441582417,0.6968215158924206,0.7039014373716632,0.7313943541488451,0.7334189131364998,none,0.9235372613674547,0.9218526317171465,0.6284275434106315,COMPLETE
2760,0.0,2025-09-24 02:28:25.608560,2025-09-24 02:29:36.460771,0 days 00:01:10.852211,1.4666283008560428,dart,0.2783936393024407,6.756638947993442,depthwise,0.0830407410367443,0.00032042348486532326,6,9,0.4180815833619024,1000,forest,0.6766356375942442,0.540687205038075,none,0.6349958109064305,0.5264697127161442,0.07519637315034272,weighted,0.8109250422909231,0.8220785278833501,0.7606715119254785,0.7607493857493858,0.6766356375942442,0.0,0.0,0.540687205038075,0.7877839022622075,0.7830874150233836,0.0,0.0,0.0,0.0,none,0.9041224604254782,0.9035135225244694,0.6349958109064305,COMPLETE
