number,value,datetime_start,datetime_complete,duration,params_alpha,params_booster,params_colsample_bytree,params_gamma,params_grow_policy,params_lambda,params_learning_rate,params_max_delta_step,params_max_depth,params_min_child_weight,params_n_estimators,params_normalize_type,params_params_decision_threshold,params_params_feature_fraction,params_params_resampling,params_params_sample_rows,params_params_scale_pos_weight,params_rate_drop,params_sample_type,params_skip_drop,params_subsample,user_attrs_acc_test,user_attrs_acc_val,user_attrs_decision_threshold,user_attrs_f1_test,user_attrs_f1_val,user_attrs_feature_fraction,user_attrs_pr_auc_test,user_attrs_pr_auc_val,user_attrs_prec_test,user_attrs_prec_val,user_attrs_rec_test,user_attrs_rec_val,user_attrs_resampling_strategy,user_attrs_roc_auc_test,user_attrs_roc_auc_val,user_attrs_sample_rows,state
2049,0.7116815476190477,2025-09-23 23:27:17.466619,2025-09-23 23:27:43.902321,0 days 00:00:26.435702,0.0007446222910372607,dart,0.6495014434072317,7.258932769851681,depthwise,0.00011979347583076233,0.17169504361574484,6,12,0.5758041888032027,600,forest,0.633661091461092,0.8457438029589643,none,0.9948358731824443,4.212268475981015,0.23891295391327905,weighted,0.5281502398764215,0.9481340073635627,0.839594636093766,0.8413185913185913,0.633661091461092,0.7096535112099315,0.7116815476190477,0.8457438029589643,0.8196433934779956,0.8109879203054249,0.6260215756783263,0.6294833826916749,0.8190761334473909,0.8185708172871202,none,0.9239373493626393,0.9217257476529039,0.9948358731824443,COMPLETE
2050,0.6486565849361328,2025-09-23 23:27:44.043282,2025-09-23 23:27:56.429184,0 days 00:00:12.385902,0.00036009870980586853,dart,0.6431305930811021,6.337769762675217,lossguide,0.0019921750990956415,0.0408902255143752,1,10,4.106172855080985,400,forest,0.5757093232078678,0.9356981535310616,undersample,0.9250788611981835,4.573788752709744,0.2773698389899591,weighted,0.7753120153729383,0.9868195918389688,0.7518681543658512,0.75501638001638,0.5757093232078678,0.6470588235294118,0.6486565849361328,0.9356981535310616,0.8202601870130632,0.8133971184405021,0.49050772626931566,0.49374161823871254,0.9503849443969205,0.9452289259734703,undersample,0.9251265045892988,0.9230724692560228,0.9250788611981835,COMPLETE
2051,0.6958279727991178,2025-09-23 23:27:56.571879,2025-09-23 23:27:58.649517,0 days 00:00:02.077638,0.000955665051216797,gbtree,0.3043629853970461,1.9929547804165397,lossguide,0.004121283392741181,0.013519341330852358,1,6,0.803990685231386,700,,0.6494506959756214,0.8422271889870321,none,0.922535255546583,4.508258110903178,,,,0.6256750796737435,0.8348858634455932,0.8305692055692055,0.6494506959756214,0.706246585321435,0.6958279727991178,0.8422271889870321,0.800349429215012,0.7848463752745884,0.6149698699651126,0.6098582474226805,0.8293413173652695,0.810012836970475,none,0.9186242544612603,0.9133675514346882,0.922535255546583,COMPLETE
2052,0.7111292962356792,2025-09-23 23:27:58.794010,2025-09-23 23:27:59.417894,0 days 00:00:00.623884,0.0011852401867452195,gbtree,0.46041284242483455,4.66258364163151,lossguide,0.01041797736298171,0.3718079725776884,2,6,0.3800868288577273,400,,0.649644686999915,0.9304882475207724,undersample,0.8817588944935919,1.019629711582833,,,,0.9638142406765124,0.8583273620636708,0.8554463554463555,0.649644686999915,0.7181262729124236,0.7111292962356792,0.9304882475207724,0.8195593334230937,0.8140123183424266,0.6854587869362364,0.6813014504116033,0.7540633019674936,0.7436884895164741,undersample,0.9245160408751676,0.9236675604118726,0.8817588944935919,COMPLETE
2053,0.6950484195139777,2025-09-23 23:27:59.561090,2025-09-23 23:28:00.617187,0 days 00:00:01.056097,0.00018339467080455318,gbtree,0.6585155690160263,0.10107401028371221,lossguide,0.024547991664370418,0.0076734695337686435,3,4,1.1215455950708522,500,,0.6162193045735989,0.9455582598083999,none,0.9967442979804397,3.7735262851826343,,,,0.6316080604164214,0.8254683181492476,0.8291359541359541,0.6162193045735989,0.6911791342148161,0.6950484195139777,0.9455582598083999,0.8047516396456218,0.7971267286852088,0.5994344957587182,0.6065051020408163,0.8160821214713431,0.8138639281129654,none,0.915709759326724,0.9140862156342704,0.9967442979804397,COMPLETE
2054,0.7061621621621622,2025-09-23 23:28:00.764066,2025-09-23 23:28:54.218180,0 days 00:00:53.454114,0.00864422616665125,dart,0.2225944733251918,1.1881269964833214,lossguide,0.008715807303044238,0.0047503967122583335,7,12,0.11760254028637374,800,forest,0.4495748705092948,0.9129201141922072,none,0.9961209116130367,1.4258135779349828,0.1833438927955737,weighted,0.7685070931029886,0.443001071220002,0.8630361347118436,0.8608722358722358,0.4495748705092948,0.7096354166666666,0.7061621621621622,0.9129201141922072,0.8066383048041714,0.8007104772013951,0.7202643171806168,0.7137237762237763,0.6993156544054747,0.6987590928540864,none,0.9205816983600134,0.919693068974546,0.9961209116130367,COMPLETE
2055,0.7124020638257214,2025-09-23 23:28:54.360927,2025-09-23 23:28:59.813969,0 days 00:00:05.453042,0.00021769987303356505,gbtree,0.5211128575319316,1.789915365800902,lossguide,0.10892240694487458,0.009050148520180035,0,10,0.48024735968430177,400,,0.6583397996121588,0.9934367221161182,none,0.7865510376695637,4.5120587271156944,,,,0.8094266672061315,0.8463507011976661,0.8459254709254709,0.6583397996121588,0.71447593684611,0.7124020638257214,0.9934367221161182,0.8171876507459322,0.8105085146086939,0.6433710174717369,0.643646408839779,0.8032506415739948,0.7976037655113393,none,0.9239367162209406,0.9217398842709077,0.7865510376695637,COMPLETE
2056,0.7235305758955076,2025-09-23 23:28:59.958005,2025-09-23 23:29:09.875302,0 days 00:00:09.917297,0.0001372905729640367,dart,0.5711756762593738,1.7002939915347515,lossguide,0.006931692611093382,0.06540978399125016,7,12,2.5342686283464233,300,forest,0.5489602263861099,0.9575572740741802,none,0.9603156705587159,2.684662352904357,0.1806886120433624,weighted,0.6737929254377235,0.9263623078816291,0.8533114955471389,0.8569819819819819,0.5489602263861099,0.7177467008075635,0.7235305758955076,0.9575572740741802,0.8262192017520611,0.8220523955397834,0.6652062796641109,0.6730486008836525,0.7792985457656116,0.7821994009413779,none,0.926729187682654,0.9251890175234752,0.9603156705587159,COMPLETE
2057,0.7034299791548229,2025-09-23 23:29:10.015566,2025-09-23 23:29:25.065685,0 days 00:00:15.050119,0.0013935080462895953,dart,0.7155219286398204,0.22302189952899854,lossguide,0.03450091239363985,0.12391759004733295,7,11,6.851426479069411,400,forest,0.45309645652558106,0.9518457286535957,none,0.9382328130698125,1.9879973210526598,0.22102063845687075,weighted,0.6616021764528904,0.8743076165149729,0.8371378851468932,0.8397829647829648,0.45309645652558106,0.7026723976826761,0.7034299791548229,0.9518457286535957,0.8023899802870913,0.790793790130242,0.6239628277464321,0.6312925170068027,0.8041060735671514,0.7941805733846812,none,0.91814410282037,0.9130856252361261,0.9382328130698125,COMPLETE
2058,0.7096314758768025,2025-09-23 23:29:25.206605,2025-09-23 23:29:37.242155,0 days 00:00:12.035550,0.0003543354141604234,dart,0.6851528786222285,4.809570943651841,depthwise,0.00012435347400921372,0.026141308064379122,2,10,5.091257085105666,400,forest,0.4908843410682115,0.8097126263804132,none,0.9009706910950549,3.116671141479914,0.19395956676055945,weighted,0.6101923609513082,0.504952921318766,0.8283345275872659,0.8330262080262081,0.4908843410682115,0.7052206011601336,0.7096314758768025,0.8097126263804132,0.8253999318170164,0.8174566054428367,0.5986272754401671,0.6076219512195122,0.8579982891360137,0.8528027385537014,none,0.92663303648197,0.9241649044839684,0.9009706910950549,COMPLETE
2059,0.7127706584180291,2025-09-23 23:29:37.383656,2025-09-23 23:29:43.021235,0 days 00:00:05.637579,0.00018418943882352637,dart,0.45749884861163254,0.8891851794970391,lossguide,0.0006044678078929914,0.1981118239492335,9,12,2.3663873045530206,200,forest,0.5788923312061464,0.9530106336291105,none,0.9018057196191415,1.9702097858762027,0.1938487283848604,weighted,0.5055803084301602,0.8485030131434451,0.8660047087726481,0.866912366912367,0.5788923312061464,0.7141297226468661,0.7127706584180291,0.9530106336291105,0.8221853521678942,0.8198775254533073,0.7295850066934404,0.7368661489264504,0.6993156544054747,0.6902011125374412,none,0.9250686872405486,0.9236887797346196,0.9018057196191415,COMPLETE
2060,0.6992020783076638,2025-09-23 23:29:43.166173,2025-09-23 23:29:44.282223,0 days 00:00:01.116050,0.0048671866980003215,gbtree,0.9888839405376023,3.1341428304039964,lossguide,0.2839047229705399,0.014074553735610765,8,5,1.84323174737594,400,,0.359302781387673,0.9865810245842108,none,0.9875297840925499,1.2443043352821612,,,,0.7468562334734368,0.8357047804278841,0.834049959049959,0.359302781387673,0.7034915943099944,0.6992020783076638,0.9865810245842108,0.8140550450085565,0.8076642489928306,0.6191869918699187,0.617300131061599,0.8143712574850299,0.8061617458279846,none,0.9189102330548546,0.9171189376726014,0.9875297840925499,COMPLETE
2061,0.6751974723538705,2025-09-23 23:29:44.423485,2025-09-23 23:30:04.176953,0 days 00:00:19.753468,0.00043843213714449714,dart,0.35968373599458836,2.6065156413463737,lossguide,0.00107794779688507,0.038033552488039434,8,11,21.480041345132847,500,forest,0.4108786281073987,0.9587767692624859,none,0.8942770139704941,4.394964624125105,0.18359548576971457,weighted,0.6431092519526161,0.826653365881362,0.7861603029992834,0.7895167895167895,0.4108786281073987,0.6734406753165546,0.6751974723538705,0.9587767692624859,0.8224035078129388,0.814107313304907,0.5306725794530672,0.5351865765088906,0.9213002566295979,0.9144201968335472,none,0.925237477061564,0.9224336150464749,0.8942770139704941,COMPLETE
2062,0.6914983164983165,2025-09-23 23:30:04.321356,2025-09-23 23:30:06.242512,0 days 00:00:01.921156,0.00045816668494926173,gbtree,0.4842036104437253,0.944202333798577,lossguide,0.06927492642087503,0.21349727273208094,1,6,0.11328437547633179,600,,0.6602021861445192,0.9138847442080199,none,0.9167384447193079,3.5691846774775287,,,,0.6042286199878634,0.8482956290306071,0.8499180999181,0.6602021861445192,0.6868131868131868,0.6914983164983165,0.9138847442080199,0.7938334863497133,0.7920346151853324,0.6787802840434419,0.6803312629399586,0.695038494439692,0.7030380830124091,none,0.9094089921546836,0.9093070886300304,0.9167384447193079,COMPLETE
2063,0.7262295081967213,2025-09-23 23:30:06.402739,2025-09-23 23:30:56.016650,0 days 00:00:49.613911,0.03419112012229025,dart,0.4182312020790405,0.4214237731176622,lossguide,0.0006857239025486899,0.015122901165517911,7,9,1.3826061390162612,800,forest,0.49712412674642054,0.9875450158975105,none,0.8849072358869818,1.745093625077157,0.186936676833155,weighted,0.6419543732223916,0.45580185696189673,0.8609888422561163,0.8632268632268633,0.49712412674642054,0.7228571428571429,0.7262295081967213,0.9875450158975105,0.8282857612796792,0.8223778367796908,0.6912568306010929,0.6968147856861974,0.7574850299401198,0.7582370560547711,none,0.9275318386814813,0.9261448083745439,0.8849072358869818,COMPLETE
2064,0.6863849765258216,2025-09-23 23:30:56.162878,2025-09-23 23:31:00.677639,0 days 00:00:04.514761,0.0005525405702688258,dart,0.38575263192030734,4.000527528911871,lossguide,0.03721929899442873,0.006832608937471603,6,12,5.070711682958231,200,forest,0.4866018376572046,0.9672357316579729,none,0.9226906167084779,1.5626335516836876,0.2797476818250367,weighted,0.5413346638831013,0.942275535581474,0.8644692394308527,0.8632268632268633,0.4866018376572046,0.6916627852817886,0.6863849765258216,0.9672357316579729,0.7978497574326152,0.7902338890770125,0.75920245398773,0.7602704108164327,0.635158254918734,0.6255883611467694,none,0.9166204761018364,0.9153948173142994,0.9226906167084779,COMPLETE
2065,0.6661464023724052,2025-09-23 23:31:00.820695,2025-09-23 23:31:08.834387,0 days 00:00:08.013692,0.0028712359134612803,dart,0.49533745721829,1.4200503519442005,lossguide,0.01341759302208235,0.19628379198441834,9,12,6.9466877491996755,300,forest,0.5220559992035536,0.9874717082907842,undersample,0.8981754721932768,2.3275208266938385,0.22167954241235868,weighted,0.5747401779002033,0.8668163264440673,0.7759238407206469,0.7810196560196561,0.5220559992035536,0.662347678543884,0.6661464023724052,0.9874717082907842,0.8162459212636468,0.8109038975695788,0.5179734620024126,0.5243243243243243,0.91830624465355,0.9131364997860505,undersample,0.922392685072211,0.9208849787752069,0.8981754721932768,COMPLETE
2066,0.6766750948166877,2025-09-23 23:31:08.976365,2025-09-23 23:31:10.286581,0 days 00:00:01.310216,0.00012383700552814233,gbtree,0.23589379517945325,1.3783256093121516,lossguide,0.08772288209760376,0.09805328817993371,1,8,1.9737228813524277,400,,0.6002064770325641,0.9993272348545618,undersample,0.825901413118861,3.8595856817832055,,,,0.6596689962055993,0.7854437506397789,0.7905405405405406,0.6002064770325641,0.6707508639648131,0.6766750948166877,0.9993272348545618,0.8161541491709163,0.8130389625204125,0.5300397219463754,0.5364570283137058,0.9131736526946108,0.9161317928968763,undersample,0.9230243590332456,0.9221229261566993,0.825901413118861,COMPLETE
2067,0.6638655462184874,2025-09-23 23:31:10.428298,2025-09-23 23:31:16.136986,0 days 00:00:05.708688,0.00010341856483039513,dart,0.5924293234970787,0.08618491381735649,lossguide,0.00477643636276516,0.0051311169741237285,9,11,18.487855505921104,200,forest,0.5563309491126044,0.9301515297528081,none,0.9084376282659887,4.525328771758423,0.169488170030226,weighted,0.4756366011772547,0.8881421703839246,0.781553894973897,0.7870597870597871,0.5563309491126044,0.6610546378653113,0.6638655462184874,0.9301515297528081,0.7857484247131006,0.777551410299886,0.5257705912076807,0.5333679563749676,0.8900769888793841,0.8789045785194695,none,0.9088790813321163,0.9069128753034551,0.9084376282659887,COMPLETE
2068,0.7170769831965611,2025-09-23 23:31:16.280002,2025-09-23 23:31:18.633065,0 days 00:00:02.353063,0.0027803324403969988,gbtree,0.5784139540728437,0.10092180121314587,lossguide,0.015910195199724614,0.07923440595555549,8,12,5.143065180533395,200,,0.5436830608377458,0.9772383345169793,none,0.9896383251999684,2.899817297480296,,,,0.6674961892337483,0.8481932644078206,0.8517608517608518,0.5436830608377458,0.7105211789966817,0.7170769831965611,0.9772383345169793,0.8179967557802872,0.8123735249430504,0.6535008976660682,0.6598345918734269,0.7784431137724551,0.7851946940522037,none,0.9228472520326438,0.9212457936363567,0.9896383251999684,COMPLETE
2069,0.6631431680397948,2025-09-23 23:31:18.779158,2025-09-23 23:31:55.237323,0 days 00:00:36.458165,0.011552071268770541,dart,0.4335268690744237,2.0655690881183073,lossguide,0.00014988156151807215,0.00300077334851103,8,7,0.10963170253788498,700,forest,0.505527134966855,0.9348697568144131,oversample,0.8933734938715389,1.4963118526184205,0.1765749691089835,weighted,0.6257008117120422,0.42048221152819515,0.7692701402395332,0.7781531531531531,0.505527134966855,0.6547181372549019,0.6631431680397948,0.9348697568144131,0.7984131134491812,0.7915593218400752,0.5100238663484487,0.520751953125,0.9140290846877673,0.9127086007702182,oversample,0.9153727264888875,0.9137869281716424,0.8933734938715389,COMPLETE
2070,0.6820588858292734,2025-09-23 23:31:55.384181,2025-09-23 23:32:08.862951,0 days 00:00:13.478770,0.0002112867278522249,dart,0.6945464333989784,4.005619366011757,lossguide,0.01050836381572173,0.055282850300375615,8,12,4.063403123423803,400,forest,0.6255544400285451,0.8983079654847167,none,0.9213623982895804,2.4630191428702752,0.1841106030978396,weighted,0.5752276386521045,0.745212867668558,0.8388780837342614,0.8463349713349714,0.6255544400285451,0.6709866220735786,0.6820588858292734,0.8983079654847167,0.7542227278920157,0.7493109514285198,0.6561733442354865,0.6753355704697986,0.6864841745081266,0.6889174154899443,none,0.9012591922101929,0.9012592645952807,0.9213623982895804,COMPLETE
2071,0.6919650810618208,2025-09-23 23:32:09.008336,2025-09-23 23:32:14.581931,0 days 00:00:05.573595,0.0006817091646259618,gbtree,0.48639359684498495,0.6560689572590037,lossguide,0.00014715251972955925,0.007981535831829156,6,10,4.639633169077688,800,,0.4549262563020412,0.8904711778438039,none,0.9863699407378075,2.33822488579533,,,,0.537783817932871,0.8249564950353158,0.822993447993448,0.4549262563020412,0.6963778409090909,0.6919650810618208,0.8904711778438039,0.8139548398456414,0.8057693823267318,0.595324833029751,0.5927960927960928,0.8387510692899914,0.8309798887462558,none,0.9194070190549174,0.9178645219085043,0.9863699407378075,COMPLETE
2072,0.7078464106844741,2025-09-23 23:32:14.726706,2025-09-23 23:33:01.753429,0 days 00:00:47.026723,0.08650893901967992,dart,0.26581609912446724,0.4607899826607743,lossguide,0.00014160713499948167,0.015169342645204897,5,10,4.7252315858452345,800,forest,0.46862073050676023,0.9002367146702794,none,0.8210781448680772,2.190395016999917,0.17784728949012504,weighted,0.6355488536682613,0.49502699203601386,0.8381615313747569,0.8387592137592138,0.46862073050676023,0.7099614749587232,0.7078464106844741,0.9002367146702794,0.8167628870689014,0.8115163446689251,0.6215868936716993,0.6247544204322201,0.8276304533789564,0.8164313222079589,none,0.9216163670122124,0.9205695968737517,0.8210781448680772,COMPLETE
2073,0.7057717616093251,2025-09-23 23:33:01.897426,2025-09-23 23:34:01.612769,0 days 00:00:59.715343,0.1884078875351874,dart,0.45138767083371595,1.223367165299179,lossguide,0.0001799064422734615,0.015163284722347941,10,12,5.443034104730989,900,forest,0.4467853265940419,0.9310000194496288,none,0.9705612429740487,2.0269897664894363,0.2706010752288704,weighted,0.6149956150640109,0.4039249612087024,0.8418466577950661,0.8397829647829648,0.4467853265940419,0.7126650548633067,0.7057717616093251,0.9310000194496288,0.821481791922013,0.8138532628574574,0.6304705495228694,0.6294433266264252,0.8195038494439693,0.8031664527171587,none,0.924772923729794,0.9216545463161959,0.9705612429740487,COMPLETE
2074,0.6824557369510232,2025-09-23 23:34:01.755170,2025-09-23 23:35:07.782356,0 days 00:01:06.027186,57.60020488522023,dart,0.39108268105504235,0.797499940247579,lossguide,0.00036408427783205704,0.04771805185361062,6,8,0.7846296157719314,1000,forest,0.5311914501199226,0.9697789709792222,none,0.7604824683072673,1.4655958519308172,0.16696406750906417,weighted,0.6278058787490464,0.6410349028394204,0.8578155389497389,0.8586199836199836,0.5311914501199226,0.6843899113837764,0.6824557369510232,0.9697789709792222,0.7925452955454632,0.7874112877855045,0.7300048473097431,0.7375745526838966,0.6441402908468776,0.6350021394950791,none,0.9115680916844435,0.9107287544626078,0.7604824683072673,COMPLETE
2075,0.7091561938958707,2025-09-23 23:35:07.927990,2025-09-23 23:35:40.648494,0 days 00:00:32.720504,0.00025660819648197757,dart,0.551016816687154,0.6180997224968516,lossguide,0.25286468670563766,0.03766884669968953,6,11,0.9768194739180781,600,forest,0.5807784858388416,0.9083648277909464,none,0.9048670402509726,1.8276917737178662,0.13248813326739192,weighted,0.5332102888359769,0.9325793807512077,0.8681543658511618,0.8673218673218673,0.5807784858388416,0.7132680320569902,0.7091561938958707,0.9083648277909464,0.8243803272512502,0.8205953595559098,0.7437325905292479,0.7456347333647947,0.6852010265183918,0.6760804450149764,none,0.9250194173047295,0.9240597867806442,0.9048670402509726,COMPLETE
2076,0.6675986331158745,2025-09-23 23:35:40.793129,2025-09-23 23:35:42.797634,0 days 00:00:02.004505,0.004420125227286583,gbtree,0.5058775275513256,2.004052083217962,lossguide,0.00011933493206408786,0.02122177899665015,4,11,7.175176734709987,300,,0.6792400841136275,0.9652921476308509,undersample,0.9063942891205922,4.876321005657499,,,,0.7787451665260906,0.7746954652472106,0.780917280917281,0.6792400841136275,0.6625785681434923,0.6675986331158745,0.9652921476308509,0.8183579236023006,0.8114182446205295,0.51636798088411,0.5240185320653499,0.9242942686056459,0.9195549850235345,undersample,0.9241041534210546,0.9213620248520018,0.9063942891205922,COMPLETE
2077,0.723267921505807,2025-09-23 23:35:42.939483,2025-09-23 23:35:44.094904,0 days 00:00:01.155421,0.0006404774651494663,gbtree,0.41887084655673623,0.19726257953177995,depthwise,3.998975975057529,0.02784790164013135,3,7,0.8756449302483185,500,,0.6955421027587936,0.9845342323720888,none,0.9939688400512064,4.418945110302092,,,,0.8086207744277012,0.8585320913092436,0.8585176085176085,0.6955421027587936,0.7257936507936508,0.723267921505807,0.9845342323720888,0.8311565911020352,0.8235938225864143,0.6769059955588453,0.6797139631162966,0.7822925577416595,0.772785622593068,none,0.9293696187991973,0.9273188962474159,0.9939688400512064,COMPLETE
2078,0.7042777433353998,2025-09-23 23:35:44.236900,2025-09-23 23:35:44.946193,0 days 00:00:00.709293,0.00024779025759020477,gbtree,0.2177996937834617,0.8197231290952172,depthwise,0.7757322662406088,0.08221119196631786,2,3,1.117690934229714,400,,0.672292276980361,0.9679108149136219,none,0.9849908705314714,3.3617779105463264,,,,0.8687457080470851,0.8591462790459617,0.8535012285012284,0.672292276980361,0.7175697865353038,0.7042777433353998,0.9679108149136219,0.8092213163020866,0.7963723231235177,0.6898184688239937,0.6810551558752997,0.7476475620188195,0.7291399229781772,none,0.921798308913058,0.9172628662946001,0.9849908705314714,COMPLETE
2079,0.7133652047391394,2025-09-23 23:35:45.089446,2025-09-23 23:35:46.420820,0 days 00:00:01.331374,0.00019658076416208584,gbtree,0.4695516843001265,1.3433123579869883,depthwise,13.553209154328824,0.024290706531303705,1,8,0.15364503709722607,600,,0.6277911603207257,0.8064665030884393,none,0.9199557824900211,3.0290661933364174,,,,0.6930047567718469,0.8570989865902344,0.8588247338247338,0.6277911603207257,0.7146361406377759,0.7133652047391394,0.8064665030884393,0.813208875954663,0.8073627660488522,0.6844166014095536,0.6936135812449474,0.7476475620188195,0.7342747111681643,none,0.9185039575385248,0.9180197943746855,0.9199557824900211,COMPLETE
