number,value,datetime_start,datetime_complete,duration,params_alpha,params_booster,params_colsample_bytree,params_gamma,params_grow_policy,params_lambda,params_learning_rate,params_max_delta_step,params_max_depth,params_min_child_weight,params_n_estimators,params_normalize_type,params_params_decision_threshold,params_params_feature_fraction,params_params_resampling,params_params_sample_rows,params_params_scale_pos_weight,params_rate_drop,params_sample_type,params_skip_drop,params_subsample,user_attrs_acc_test,user_attrs_acc_val,user_attrs_decision_threshold,user_attrs_f1_test,user_attrs_f1_val,user_attrs_feature_fraction,user_attrs_pr_auc_test,user_attrs_pr_auc_val,user_attrs_prec_test,user_attrs_prec_val,user_attrs_rec_test,user_attrs_rec_val,user_attrs_resampling_strategy,user_attrs_roc_auc_test,user_attrs_roc_auc_val,user_attrs_sample_rows,state
1161,0.7075867327487609,2025-09-23 17:09:58.152030,2025-09-23 17:10:32.173360,0 days 00:00:34.021330,0.02641941608837349,dart,0.22338445887900282,5.585750829064553,depthwise,19.927787338327338,0.1945347354232678,4,11,0.41731673060627056,700,forest,0.4173224742382957,0.8684923182167927,none,0.7874110606518877,1.5535960552743753,0.12898434020548122,weighted,0.6608679172793407,0.9155102435156028,0.8454294195925888,0.842956592956593,0.4173224742382957,0.7143397654180855,0.7075867327487609,0.8684923182167927,0.8162897667543637,0.8062437143777558,0.6404341926729986,0.6380199381230663,0.8075278015397775,0.7941805733846812,none,0.9223570852412482,0.9198622477268692,0.7874110606518877,COMPLETE
1162,0.6940346375881976,2025-09-23 17:10:32.305218,2025-09-23 17:10:33.086128,0 days 00:00:00.780910,0.014415442074827065,gbtree,0.889489416177154,2.6294503993185145,depthwise,11.847551057956178,0.36197869601715327,1,10,45.219720549457556,300,,0.6358406271361895,0.9375826804790502,none,0.9710450508361123,2.599895304027933,,,,0.7056042710431334,0.8576108097041663,0.8535012285012284,0.6358406271361895,0.70485890091237,0.6940346375881976,0.9375826804790502,0.8071149957543475,0.7993057652852131,0.6993684210526315,0.6935897435897436,0.7104362703165098,0.6944801026957638,none,0.9198737308242965,0.915277031358589,0.9710450508361123,COMPLETE
1163,0.7029173139996547,2025-09-23 17:10:33.217108,2025-09-23 17:10:37.241456,0 days 00:00:04.024348,0.0001015718863813126,dart,0.7381544488773717,4.253464528632742,lossguide,1.4753763269091,0.11359958029915924,0,9,2.642355041801869,200,forest,0.5065512063340676,0.9905771889684776,none,0.9210823678224535,4.295125027718581,0.08877112708760514,weighted,0.5912825637939514,0.831343362412773,0.8182004299314157,0.8238124488124489,0.5065512063340676,0.6969283276450512,0.7029173139996547,0.9905771889684776,0.8251924092635183,0.8206984904949275,0.5797842135150483,0.5891203703703703,0.8733960650128315,0.8712023962344887,none,0.9265752191332197,0.9249250572101155,0.9210823678224535,COMPLETE
1164,0.7077551020408164,2025-09-23 17:10:37.375754,2025-09-23 17:10:37.994316,0 days 00:00:00.618562,0.0002742346127529197,gbtree,0.606999303439144,7.864648043033241,depthwise,0.06317938050548981,0.027173335191825482,1,6,10.294039454325867,200,,0.6077335945402442,0.9549394326789723,none,0.91183786359751,2.72540609518608,,,,0.5782629598574384,0.8554611526256526,0.8533988533988534,0.6077335945402442,0.7128914192761285,0.7077551020408164,0.9549394326789723,0.8162542593712057,0.8086712580309517,0.6794573643410853,0.6765509168942645,0.7497861420017109,0.7419768934531451,none,0.9219035831100358,0.9199164620887864,0.91183786359751,COMPLETE
1165,0.6884283880432789,2025-09-23 17:10:38.126373,2025-09-23 17:10:39.465188,0 days 00:00:01.338815,0.001033305066136573,gbtree,0.9042526218981523,2.6657553612037397,lossguide,2.729908888083977,0.006054723806894579,0,4,3.233114065029491,1000,,0.3827961613320785,0.7849952463258489,oversample,0.8943301409701259,0.5472978476910735,,,,0.37235656479226786,0.8211690039922203,0.8260647010647011,0.3827961613320785,0.6853952818296416,0.6884283880432789,0.7849952463258489,0.8008530619650149,0.7956789107521557,0.5919129082426128,0.6023748395378691,0.8139435414884517,0.8031664527171587,oversample,0.9129499809999932,0.9129640963876651,0.8943301409701259,COMPLETE
1166,0.6973532796317606,2025-09-23 17:10:39.600072,2025-09-23 17:10:40.332621,0 days 00:00:00.732549,0.00017118811750588132,gbtree,0.34114745859170287,1.8187402897766234,depthwise,1.3110086766680449,0.19366998964983498,1,8,0.4692565487289215,600,,0.3709985550592376,0.9412887309246372,none,0.5992407231918915,0.5987914984884849,,,,0.5103234780907073,0.8691780120790255,0.8653767403767404,0.3709985550592376,0.7072835547411819,0.6973532796317606,0.9412887309246372,0.8160690466780434,0.8089370211019267,0.7613412228796844,0.7544820717131474,0.660393498716852,0.6482670089858793,none,0.922891946080732,0.9205641840750047,0.5992407231918915,COMPLETE
1167,0.7052673904302372,2025-09-23 17:10:40.467440,2025-09-23 17:10:43.948730,0 days 00:00:03.481290,7.806942611375061,dart,0.8957672342802995,1.5447860798401831,lossguide,1.8050839685539775,0.07897092198324505,6,5,6.036017310509043,200,forest,0.6994959462475969,0.9113698855548615,none,0.9337296256393963,4.628346641159813,0.05371462860510072,weighted,0.5728022343365119,0.8169322281187238,0.8532091309243526,0.8499180999181,0.6994959462475969,0.7147971360381862,0.7052673904302372,0.9113698855548615,0.8143978789544822,0.8068045011037661,0.6680297397769517,0.6651497914296549,0.7686056458511549,0.7505348737697903,none,0.920289158116088,0.9189453253774406,0.9337296256393963,COMPLETE
1168,0.7157317587515816,2025-09-23 17:10:44.083114,2025-09-23 17:10:50.802285,0 days 00:00:06.719171,0.0006226086251585321,dart,0.7589336655304866,9.060156789320635,depthwise,0.13754026267200378,0.08893204210841897,4,7,0.9018039272692687,300,forest,0.6718345628980548,0.963997332487916,none,0.7850886089268387,3.251117698635,0.16471123901184992,weighted,0.6050344105076528,0.5875332748828146,0.8657999795270754,0.861998361998362,0.6718345628980548,0.7249842668344871,0.7157317587515816,0.963997332487916,0.8242119993886853,0.8170753900095802,0.7114038699053108,0.7056133056133056,0.739093242087254,0.7261446298673513,none,0.9262075364813369,0.9238153183010698,0.7850886089268387,COMPLETE
1169,0.7123493975903614,2025-09-23 17:10:50.933952,2025-09-23 17:10:57.565414,0 days 00:00:06.631462,0.020737321100145784,dart,0.8536000430230566,9.435731622494716,depthwise,0.009151899299056566,0.21491432635666774,4,7,0.4973789205390333,300,forest,0.5840231620070174,0.9638482599923355,none,0.87622897808236,3.2663315977289398,0.19994359568759215,weighted,0.48412506454458126,0.5034172197516474,0.8424608455317842,0.8435708435708436,0.5840231620070174,0.7124976648608257,0.7123493975903614,0.9638482599923355,0.8218996625849679,0.8118264823373806,0.6325041459369818,0.6359663865546219,0.8156544054747648,0.8095849379546427,none,0.9249066893032093,0.921900655910284,0.87622897808236,COMPLETE
1170,0.7061493079192194,2025-09-23 17:10:57.699511,2025-09-23 17:11:09.193675,0 days 00:00:11.494164,0.052053393493445496,dart,0.805429000443496,8.953139130877569,depthwise,2.1570092082089816,0.024218721678755273,4,7,1.1463733257848248,400,forest,0.639903148695322,0.9993618295735567,none,0.587048445673272,2.1426488644005324,0.20276516264792777,weighted,0.6143632445418434,0.6448276151723369,0.8689732828334528,0.8674242424242424,0.639903148695322,0.7123595505617978,0.7061493079192194,0.9993618295735567,0.819141061884378,0.8111728165937464,0.7504734848484849,0.7516908212560387,0.6779298545765612,0.6658108686350022,none,0.9233457935619619,0.9213111790935601,0.587048445673272,COMPLETE
1171,0.6750972762645915,2025-09-23 17:11:09.326916,2025-09-23 17:11:09.893465,0 days 00:00:00.566549,0.00025054586597911884,gbtree,0.8110707762064967,9.136156791792494,depthwise,0.5139903557026757,0.20630778194247829,5,10,0.5415167166865873,300,,0.6486610267776161,0.8182084110755794,none,0.9739059933981646,3.527068652141572,,,,0.6725449180897389,0.8301770907974204,0.829033579033579,0.6486610267776161,0.6806544754571704,0.6750972762645915,0.8182084110755794,0.7485040395374646,0.741313164119761,0.6188309415470774,0.6189796646450232,0.756201881950385,0.7424047924689773,none,0.8994490976522072,0.8990148821446569,0.9739059933981646,COMPLETE
1172,0.6550522648083623,2025-09-23 17:11:10.033276,2025-09-23 17:11:16.392662,0 days 00:00:06.359386,0.0003222882601512894,dart,0.8521179914328272,7.40056431072361,depthwise,10.535853577867675,0.08082376369203502,6,4,0.848681130073716,300,forest,0.598652337763089,0.9882061764786483,undersample,0.8686859181885032,3.0643074837179394,0.1588915398799114,weighted,0.576652611335324,0.6307383785080077,0.7634353567407104,0.7668918918918919,0.598652337763089,0.6537827715355805,0.6550522648083623,0.9882061764786483,0.805546590033545,0.7979423284176291,0.5031127507493659,0.5070356472795498,0.9332763045337895,0.9251176722293539,undersample,0.9194057527715203,0.9170401929674268,0.8686859181885032,COMPLETE
1173,0.548235294117647,2025-09-23 17:11:16.527101,2025-09-23 17:11:18.608975,0 days 00:00:02.081874,0.007768437935654279,gbtree,0.5244953025147098,1.3051095093023086,lossguide,0.22707997730489926,0.002435267970765475,9,8,12.145083829781848,500,,0.5418956478387453,0.9733824990373121,none,0.9392622335177566,1.1255402383681055,,,,0.3160814944633549,0.8474767120483161,0.8427518427518428,0.5418956478387453,0.5635618043350908,0.548235294117647,0.9733824990373121,0.7945578155027897,0.7849719584671786,0.8940520446096655,0.8767638758231421,0.41146278870829767,0.39880188275566963,none,0.9123573891492636,0.9095213260527735,0.9392622335177566,COMPLETE
1174,0.6998703943714127,2025-09-23 17:11:18.744977,2025-09-23 17:11:19.396642,0 days 00:00:00.651665,0.06344124487654385,gbtree,0.9604519711160502,3.9298242849238396,lossguide,0.0007545336761913117,0.30067637811081377,10,11,0.5535903030796918,400,,0.30129478933384485,0.9726015371058634,none,0.9362936222416505,1.0486205043223318,,,,0.8520479522747086,0.8322243832531477,0.834049959049959,0.30129478933384485,0.6995417048579285,0.6998703943714127,0.9726015371058634,0.8021687741357366,0.791132508818096,0.6121270452358036,0.6168407310704961,0.8160821214713431,0.8087291399229781,none,0.9184854525334245,0.9140131140597045,0.9362936222416505,COMPLETE
1175,0.6609645996673794,2025-09-23 17:11:19.530944,2025-09-23 17:11:50.965867,0 days 00:00:31.434923,5.476171090133477,dart,0.20754270498635907,8.517622303687952,depthwise,0.09461423417420405,0.09596903659935614,5,12,7.370431664809154,700,forest,0.3928409479483826,0.8501867577329751,none,0.5596576827958478,0.9016389626661077,0.13253396907232656,weighted,0.29412136757747553,0.9319151157572305,0.8539256832838571,0.8539107289107289,0.3928409479483826,0.6632050979466604,0.6609645996673794,0.8501867577329751,0.7737748524320623,0.76917862869642,0.7398630858346498,0.7430555555555556,0.6009409751924722,0.5952075310226786,none,0.9044944311734108,0.904396240592455,0.5596576827958478,COMPLETE
1176,0.6912780656303973,2025-09-23 17:11:51.099575,2025-09-23 17:12:48.336589,0 days 00:00:57.237014,0.00010716664952351876,dart,0.41216597921696907,1.5395499693981118,depthwise,14.76334767775498,0.47421556320251607,4,10,0.6227365649508351,900,forest,0.30412317265706373,0.9192660541579379,none,0.7011856319740919,0.6135161371426564,0.11113497893571862,weighted,0.6341174760818447,0.4363962990108367,0.8548469648889344,0.8536036036036037,0.30412317265706373,0.6982978723404255,0.6912780656303973,0.9192660541579379,0.7881601516019953,0.7819077047598288,0.6947502116850127,0.69760348583878,0.7018819503849444,0.685066324347454,none,0.9106306678413172,0.9083837457799604,0.7011856319740919,COMPLETE
1177,0.6814483968735046,2025-09-23 17:12:48.469464,2025-09-23 17:13:00.616225,0 days 00:00:12.146761,0.00019722014027375546,dart,0.926015760288122,8.23626408838437,depthwise,0.5862825892223763,0.1590214767247385,0,9,0.6427268423426491,400,forest,0.5452645804554893,0.9235975806776208,oversample,0.9981079198865299,2.3134307374277467,0.15373733354161756,weighted,0.45600901191651844,0.6088341825322919,0.7898454294195926,0.7955569205569205,0.5452645804554893,0.6759273875295975,0.6814483968735046,0.9235975806776208,0.8190282230310252,0.8121889714349138,0.5356517388041031,0.54323499491353,0.9157399486740804,0.9139922978177151,oversample,0.9240613012397259,0.9219217312756175,0.9981079198865299,COMPLETE
1178,0.6796610169491526,2025-09-23 17:13:00.749915,2025-09-23 17:13:04.517032,0 days 00:00:03.767117,0.0003701765004498923,dart,0.2877535783363433,2.176793496552494,lossguide,0.0015328549223346483,0.03785530386412648,3,8,4.572171519268292,200,forest,0.54696344150217,0.8287571334592883,none,0.7820917230461722,4.297325629449607,0.08026379782730571,weighted,0.5940335823196767,0.2167573656299736,0.8019244549083837,0.8065110565110565,0.54696344150217,0.6781972393148179,0.6796610169491526,0.8287571334592883,0.7955485860963504,0.7858979555981135,0.5548299319727891,0.5627280381700814,0.8721129170230967,0.8579375267436885,none,0.9137066428881666,0.9112637865855531,0.7820917230461722,COMPLETE
1179,0.7107902125952668,2025-09-23 17:13:04.649882,2025-09-23 17:13:08.161491,0 days 00:00:03.511609,0.15906997474629955,dart,0.877077597915699,2.6585509012879127,depthwise,4.137743163249734,0.03538733431550591,6,9,18.668772005536997,200,forest,0.6190825497518293,0.9905411068987541,none,0.7138042352891079,3.03062838739504,0.16513594654765393,weighted,0.6309752855814474,0.8681549107100549,0.8549493295117208,0.8523751023751024,0.6190825497518293,0.7168831168831169,0.7107902125952668,0.9905411068987541,0.8181633452803936,0.8090321890063417,0.672665916760405,0.6689316723291808,0.76732249786142,0.7582370560547711,none,0.9229047528105447,0.9204040170567653,0.7138042352891079,COMPLETE
1180,0.7102678571428571,2025-09-23 17:13:08.296496,2025-09-23 17:13:11.832707,0 days 00:00:03.536211,0.0006538872003081511,dart,0.7719288188555236,8.81631846418951,depthwise,12.25496927089414,0.03594511214502774,0,7,3.098892122438404,200,forest,0.6871838010844329,0.9589881306744847,none,0.8328118747600528,2.869536448591999,0.0036214463542730974,weighted,0.5919186692968472,0.8153658027413633,0.8689732828334528,0.8671171171171171,0.6871838010844329,0.716688800354139,0.7102678571428571,0.9589881306744847,0.8205502804604361,0.8129895143760123,0.7426605504587156,0.7424171721885208,0.6924721984602225,0.6807873341891314,none,0.924296945068281,0.9221331759245391,0.8328118747600528,COMPLETE
1181,0.6346733668341709,2025-09-23 17:13:11.965365,2025-09-23 17:13:30.103495,0 days 00:00:18.138130,0.017666511151689643,dart,0.21023573071730628,0.8715497941126664,lossguide,0.0004169444446027573,0.47798737578993,3,6,0.13996243909720232,500,forest,0.5657505152964057,0.5868093235365451,none,0.8171158098414761,1.905760382561016,0.08970063060455465,weighted,0.456670879744262,0.2288396300174319,0.8530044016787798,0.8511466011466011,0.5657505152964057,0.6401002506265664,0.6346733668341709,0.5868093235365451,0.7729388415658872,0.7643610740694392,0.7730024213075061,0.768715763846622,0.5461933276304534,0.540436456996149,none,0.9006016457770196,0.8957414345195021,0.8171158098414761,COMPLETE
1182,0.6680141485598787,2025-09-23 17:13:30.235625,2025-09-23 17:13:37.317414,0 days 00:00:07.081789,0.00035985186832702515,dart,0.8418624743584737,6.842117165063149,depthwise,0.17088668281146221,0.013011121977937752,3,8,0.9943756713797716,300,forest,0.6951536876920467,0.9117069365727051,none,0.9446534960458103,2.061216181889035,0.1193399374665517,weighted,0.6680441105859396,0.4056665459893186,0.8659023441498618,0.8654791154791155,0.6951536876920467,0.672990514228657,0.6680141485598787,0.9117069365727051,0.8195217830304022,0.8108259809173208,0.8081534772182254,0.8155459592843923,0.5765611633875107,0.5656824989302525,none,0.9231311585261337,0.9205596926037041,0.9446534960458103,COMPLETE
1183,0.6518836432999523,2025-09-23 17:13:37.452767,2025-09-23 17:13:39.161885,0 days 00:00:01.709118,0.0015455258340913106,gbtree,0.5756830836257556,0.4623783630871724,depthwise,0.00020310399327955151,0.010478963552762477,2,7,0.5863219128416576,900,,0.40436032270057926,0.8580542087131496,none,0.9630342444023546,0.6331924873067291,,,,0.7956258599823312,0.8489098167673252,0.8505323505323505,0.40436032270057926,0.652378709373528,0.6518836432999523,0.8580542087131496,0.7571356167036652,0.7506119921523684,0.7258909853249476,0.7361335487345181,0.5923866552609067,0.5849379546427044,none,0.9022242440547131,0.9030407375871137,0.9630342444023546,COMPLETE
1184,0.6978664831383344,2025-09-23 17:13:39.299254,2025-09-23 17:14:04.812752,0 days 00:00:25.513498,0.003373564923448606,dart,0.48873145606143925,1.2111235824535584,depthwise,0.0009126292157992545,0.44561005175997226,4,7,0.22645790637344976,600,forest,0.4053144767433,0.9992969130402207,undersample,0.903468308688915,0.6967631627383575,0.07601089331646149,weighted,0.6439337187838347,0.9356378698999621,0.8161531374756884,0.8202293202293203,0.4053144767433,0.6955932203389831,0.6978664831383344,0.9992969130402207,0.8191546678102464,0.8149117315666414,0.5760808534531162,0.5835971223021583,0.8776732249786142,0.8677792041078306,undersample,0.9241989232216691,0.922190442183622,0.903468308688915,COMPLETE
1185,0.6255408234473133,2025-09-23 17:14:04.946462,2025-09-23 17:14:16.985193,0 days 00:00:12.038731,0.0034259079076174696,dart,0.2714444128270814,2.8238159300345282,lossguide,0.0010344544851142506,0.039387117591034825,6,8,0.19808439324675026,400,forest,0.5293339514426679,0.8550657914801273,undersample,0.9258167071325556,4.745341123862247,0.21083212530865764,weighted,0.5539438004020337,0.3267426240198303,0.724332070836319,0.7253276003276004,0.5293339514426679,0.6256082302238287,0.6255408234473133,0.8550657914801273,0.8116561828787521,0.8036372704376731,0.46343975283213185,0.46416735708367857,0.962360992301112,0.9589216944801027,undersample,0.92219629602897,0.9200908520994778,0.9258167071325556,COMPLETE
1186,0.6732611084942691,2025-09-23 17:14:17.119271,2025-09-23 17:14:19.217685,0 days 00:00:02.098414,0.5806077881640264,gbtree,0.7802366643076356,1.4815623806241844,depthwise,0.00488945065984551,0.015527762450564246,10,12,0.34126690628038314,500,,0.36090190995400945,0.9208144122654601,oversample,0.8446983091790452,2.472678874757959,,,,0.7271704007943597,0.7830893643156925,0.786957411957412,0.36090190995400945,0.6697833878759545,0.6732611084942691,0.9208144122654601,0.8196078130458309,0.8183258838221505,0.5268448149056141,0.5317460317460317,0.9191616766467066,0.9174154899443732,oversample,0.9228842044845083,0.9225802500678472,0.8446983091790452,COMPLETE
1187,0.6784646061814557,2025-09-23 17:14:19.351722,2025-09-23 17:15:14.507014,0 days 00:00:55.155292,0.005912794647336984,dart,0.35620840989087105,4.793749100118307,depthwise,0.0017807380000781651,0.26228412566474146,3,10,0.11144902127116313,900,forest,0.3709579697585338,0.960381107261862,none,0.8289550552137193,0.5273008852289586,0.09577556265699115,weighted,0.6677051742409823,0.780104506609246,0.8687685535878801,0.8679361179361179,0.3709579697585338,0.6828302820385947,0.6784646061814557,0.960381107261862,0.8206316520774337,0.8163439171221627,0.8098591549295775,0.8125373134328359,0.5902480752780154,0.5823705605477107,none,0.9228028169970689,0.9224583757215936,0.8289550552137193,COMPLETE
1188,0.6823027718550106,2025-09-23 17:15:14.639546,2025-09-23 17:16:25.998271,0 days 00:01:11.358725,0.0002894243195765045,dart,0.3587275768620985,1.9029597076770985,lossguide,0.00023436579020864778,0.001592766721459778,10,12,0.23105212952921547,900,forest,0.37817533398943615,0.9243336059126636,none,0.9432284008261591,2.2617314439291376,0.08979029545432492,weighted,0.5113309467151272,0.37206508940708194,0.7964991299007064,0.8016994266994267,0.37817533398943615,0.6792513714101323,0.6823027718550106,0.9243336059126636,0.7987697524282535,0.7894558739037931,0.5453367875647669,0.5531914893617021,0.9003421727972626,0.8900299529311082,none,0.9176599220959432,0.9155987473862373,0.9432284008261591,COMPLETE
1189,0.6999776935088111,2025-09-23 17:16:26.130642,2025-09-23 17:16:51.224584,0 days 00:00:25.093942,0.12141073720008563,dart,0.7117760308332005,1.4000307268680907,depthwise,0.1589048504941484,0.2123330039582209,3,6,18.936514844163657,600,forest,0.6163655165630579,0.8844243559998215,none,0.6891520690563396,2.2722470814358013,0.16233995004983093,weighted,0.6453226821465324,0.6861042207290992,0.8651857917903573,0.8623054873054873,0.6163655165630579,0.71035847811744,0.6999776935088111,0.8844243559998215,0.8087457689419142,0.79850552063276,0.7311000452693527,0.7311276794035415,0.6907613344739093,0.6713735558408216,none,0.9183534137100964,0.915084099633041,0.6891520690563396,COMPLETE
1190,0.617431065539698,2025-09-23 17:16:51.357290,2025-09-23 17:17:35.008704,0 days 00:00:43.651414,59.7145315490406,dart,0.4614591886458472,3.6662986717734425,depthwise,25.59133187507968,0.4776092906784754,6,11,0.773056717100807,800,forest,0.3474188480494504,0.9318770468997307,oversample,0.5775003496698452,1.6405920633490911,0.03670771352853552,weighted,0.6434519463542335,0.9948535404449158,0.712560139215887,0.7173423423423423,0.3474188480494504,0.6149204607789358,0.617431065539698,0.9318770468997307,0.798843943995371,0.7942460478914699,0.45256358498183286,0.4565573770491803,0.9589392643284859,0.9533590072742832,oversample,0.9150720705195525,0.9144085938660207,0.5775003496698452,COMPLETE
1191,0.7148864592094197,2025-09-23 17:17:35.140429,2025-09-23 17:17:52.819021,0 days 00:00:17.678592,0.0004462169432562421,dart,0.6703866575056425,9.215145121084245,depthwise,0.36063056504365054,0.09494378294423345,4,6,0.8137455890202328,500,forest,0.6867180295871277,0.939034539061365,none,0.7146496446143663,3.5617462360571244,0.12372225301518297,weighted,0.7040256088736038,0.41296784211697635,0.8641621455624936,0.8611793611793612,0.6867180295871277,0.7229066610983503,0.7148864592094197,0.939034539061365,0.8219258706845651,0.8157558846563033,0.7062423500611995,0.7027697395618024,0.7403763900769889,0.727428326914848,none,0.9253817758105107,0.9237863252779946,0.7146496446143663,COMPLETE
