number,value,datetime_start,datetime_complete,duration,params_alpha,params_booster,params_colsample_bytree,params_gamma,params_grow_policy,params_lambda,params_learning_rate,params_max_delta_step,params_max_depth,params_min_child_weight,params_n_estimators,params_normalize_type,params_params_decision_threshold,params_params_feature_fraction,params_params_resampling,params_params_sample_rows,params_params_scale_pos_weight,params_rate_drop,params_sample_type,params_skip_drop,params_subsample,user_attrs_acc_test,user_attrs_acc_val,user_attrs_decision_threshold,user_attrs_f1_test,user_attrs_f1_val,user_attrs_feature_fraction,user_attrs_pr_auc_test,user_attrs_pr_auc_val,user_attrs_prec_test,user_attrs_prec_val,user_attrs_rec_test,user_attrs_rec_val,user_attrs_resampling_strategy,user_attrs_roc_auc_test,user_attrs_roc_auc_val,user_attrs_sample_rows,state
1927,0.6772735490869644,2025-09-23 22:47:12.579074,2025-09-23 22:47:14.442502,0 days 00:00:01.863428,0.028805157468388295,gbtree,0.9281844854747118,1.8727363477705348,lossguide,0.0002745185120909829,0.0508225991873243,9,6,0.5981020844245283,600,,0.4035497052626619,0.8959235353727059,none,0.931084851511473,1.824556147686839,,,,0.7057983323437313,0.8149247620022521,0.8172604422604423,0.4035497052626619,0.6749370729953255,0.6772735490869644,0.8959235353727059,0.7502081971168655,0.7442129659186115,0.582196029776675,0.5864120225422668,0.8028229255774166,0.8014548566538297,none,0.8992977192279031,0.899196671566401,0.931084851511473,COMPLETE
1928,0.7179893132792401,2025-09-23 22:47:14.583398,2025-09-23 22:47:15.366356,0 days 00:00:00.782958,0.0002951995932575098,gbtree,0.654806732929722,8.415920030829046,lossguide,0.03777579550931555,0.2776640757518492,4,12,0.13799682268938088,600,,0.5629209451486776,0.8755340078996144,none,0.8476747521375166,2.415600285078363,,,,0.5567715371463107,0.8527996724332071,0.8541154791154791,0.5629209451486776,0.7160347551342812,0.7179893132792401,0.8755340078996144,0.8180312861529124,0.8147596622459148,0.66507703595011,0.6678939617083947,0.7754491017964071,0.7762088147197261,none,0.9231784714785206,0.9232017718048119,0.8476747521375166,COMPLETE
1929,0.7276758718000403,2025-09-23 22:47:15.506647,2025-09-23 22:47:24.534106,0 days 00:00:09.027459,0.00021099379052389806,dart,0.478774795405574,3.3395570319773022,lossguide,0.005706571998013175,0.04687976343544297,2,11,1.0280733887804403,300,forest,0.6693159532814673,0.9781846924351283,none,0.9453755061972314,4.1846118003871755,0.18885197935674364,weighted,0.7824175231807025,0.8285243399155247,0.8575084450813799,0.8616912366912367,0.6693159532814673,0.7208182912154031,0.7276758718000403,0.9781846924351283,0.8277873678104848,0.8239108516814075,0.6786253776435045,0.6878810975609756,0.7686056458511549,0.7723577235772358,none,0.9271835531889103,0.9263382583467804,0.9453755061972314,COMPLETE
1930,0.7166212534059946,2025-09-23 22:47:24.677860,2025-09-23 22:47:33.389288,0 days 00:00:08.711428,0.038430398726516116,dart,0.6627469026231425,2.369628980763851,lossguide,0.00577007416816938,0.03717507980262424,0,11,12.414850300356228,300,forest,0.6524299368573954,0.9691153584846063,none,0.9625171916233282,4.199969767354615,0.21406109909169824,weighted,0.7261634273559306,0.6782942424683205,0.8511618384686253,0.8509418509418509,0.6524299368573954,0.7194133539174065,0.7166212534059946,0.9691153584846063,0.8244130279739657,0.817504526729714,0.6554149085794655,0.6572652624062835,0.7972626176218991,0.7877620881471973,none,0.9260466033732178,0.9236834245188381,0.9625171916233282,COMPLETE
1931,0.713865641257634,2025-09-23 22:47:33.531434,2025-09-23 22:47:45.893602,0 days 00:00:12.362168,0.00010377608761433678,dart,0.5530107526526017,7.841286184760168,lossguide,0.0006321398194221656,0.019477592409172833,1,8,0.3433920843247257,400,forest,0.661992651400977,0.890800299021445,none,0.997660483296007,2.5178684595893572,0.25469814787983586,weighted,0.7918988661489517,0.732309831142488,0.8715323984031119,0.8704954954954955,0.661992651400977,0.717151228307415,0.713865641257634,0.890800299021445,0.8245187007393502,0.8168008163540519,0.7579799904716532,0.7571976967370442,0.6804961505560307,0.675224646983312,none,0.9258836845024986,0.9237909031237432,0.997660483296007,COMPLETE
1932,0.6410909635845946,2025-09-23 22:47:46.038212,2025-09-23 22:48:17.482480,0 days 00:00:31.444268,0.0009541461146890121,dart,0.29291152362461603,0.10454198517002244,lossguide,0.0005337502682184523,0.02630953162303101,3,11,0.11254883768405645,600,forest,0.3886690932698831,0.8438027607171776,undersample,0.7938996459706505,1.2565215562679548,0.20850051620565543,weighted,0.750836439653607,0.2576636667978997,0.7510492373835602,0.7548116298116299,0.3886690932698831,0.6372315035799523,0.6410909635845946,0.8438027607171776,0.7351971622756275,0.7338222247269957,0.48923499770957396,0.4933118081180812,0.913601368691189,0.9152759948652118,undersample,0.8933254374807683,0.8959098359017927,0.7938996459706505,COMPLETE
1933,0.7233507853403142,2025-09-23 22:48:17.621567,2025-09-23 22:49:17.301442,0 days 00:00:59.679875,0.03917609432212403,dart,0.41058221803930817,0.6984712328860844,lossguide,0.0001828690597643667,0.12965202376836593,5,8,0.43130814171098747,900,forest,0.4853667128670914,0.9363453071839226,none,0.8556397024602027,1.5356984853203393,0.17506383473391707,weighted,0.6709846739193221,0.29577782990472035,0.8636503224485618,0.8647624897624898,0.4853667128670914,0.722615576842982,0.7233507853403142,0.9363453071839226,0.8222328259111088,0.8167848716826385,0.7041396103896104,0.7083675143560295,0.742087254063302,0.7389816003423192,none,0.924894573273431,0.9230145120013553,0.8556397024602027,COMPLETE
1934,0.6390168970814132,2025-09-23 22:49:17.445008,2025-09-23 22:50:06.777978,0 days 00:00:49.332970,0.01136038202062708,dart,0.3966025207560291,0.05487524966080182,lossguide,0.0024362079998186546,0.3602698738490246,2,8,0.26912787986944225,800,forest,0.5224725495687957,0.90305536439387,none,0.7964867994421525,1.003421706125168,0.23639720558524752,weighted,0.6829002185038267,0.30616859626407145,0.858941549800389,0.8556511056511057,0.5224725495687957,0.6513157894736842,0.6390168970814132,0.90305536439387,0.7842546870402916,0.7787923850333875,0.7973977695167286,0.7954110898661568,0.5504704875962361,0.5340179717586649,none,0.9092130060197963,0.9093291141142932,0.7964867994421525,COMPLETE
1935,0.6968772012209439,2025-09-23 22:50:06.917917,2025-09-23 22:50:18.253105,0 days 00:00:11.335188,0.16922861299840997,dart,0.966119313256805,5.10470571851939,depthwise,0.010851736795611973,0.03550226815694754,8,11,0.25860180143138534,400,forest,0.4240581352612013,0.9939321571768114,none,0.9000674674193867,0.758847809618724,0.22637008891705537,weighted,0.5905003390536557,0.2762668414770443,0.8724536800081891,0.8678337428337428,0.4240581352612013,0.7099627560521415,0.6968772012209439,0.9939321571768114,0.8210459541995279,0.8137349466154586,0.7788559754851889,0.7721123829344433,0.6522668947818648,0.6350021394950791,none,0.9238282187571337,0.9215977695123189,0.9000674674193867,COMPLETE
1936,0.7150279776179057,2025-09-23 22:50:18.393339,2025-09-23 22:51:26.060095,0 days 00:01:07.666756,0.06945934214334486,dart,0.6160379472493496,2.8735863656959473,lossguide,0.001201382455167162,0.04258407680912677,5,7,2.8152140680685345,1000,forest,0.5242951695886863,0.86579064819927,none,0.7726536844647226,2.1400560224156355,0.23366694252131442,weighted,0.6156189660314941,0.35048808421144184,0.8551540587572934,0.854013104013104,0.5242951695886863,0.7196354269863285,0.7150279776179057,0.86579064819927,0.821608033144462,0.8164175730137763,0.6703580657069029,0.6707911511061118,0.776732249786142,0.7655113393239196,none,0.9250071573791111,0.9228963517563696,0.7726536844647226,COMPLETE
1937,0.6893617021276596,2025-09-23 22:51:26.199645,2025-09-23 22:52:22.030434,0 days 00:00:55.830789,0.3442852653049453,dart,0.432341411212779,2.706984126505509,lossguide,0.03346574124667725,0.12559213668493013,5,8,0.7022068643785236,900,forest,0.5250361107434376,0.9222259565092996,none,0.8420181821748093,1.2576076381979129,0.33095607998087256,weighted,0.6047906326863192,0.24867619794348864,0.8691780120790255,0.8654791154791155,0.5250361107434376,0.6997180451127819,0.6893617021276596,0.9222259565092996,0.8105575977903685,0.8000833384166621,0.7763295099061522,0.7702060221870047,0.636869118905047,0.6238767650834403,none,0.9195294168569257,0.9168617433576753,0.8420181821748093,COMPLETE
1938,0.7037291237703043,2025-09-23 22:52:22.174677,2025-09-23 22:53:26.311069,0 days 00:01:04.136392,0.03828943308474623,dart,0.29442929100746795,0.7561086028462446,lossguide,0.00013369605743251807,0.22636657987206774,5,11,0.7310173428415043,900,forest,0.574467026059762,0.9862492221651594,none,0.9772432906148915,1.655459050297472,0.1872589555796373,weighted,0.7152957624109093,0.2447951644684548,0.8682567304739482,0.8674242424242424,0.574467026059762,0.7059629883481837,0.7037291237703043,0.9862492221651594,0.8155180573427003,0.8079544590178283,0.7577243746934772,0.7561455260570304,0.6608212147134302,0.6581086863500214,none,0.9221642935940219,0.9202860295606761,0.9772432906148915,COMPLETE
1939,0.7008691965232139,2025-09-23 22:53:26.451723,2025-09-23 22:54:44.202263,0 days 00:01:17.750540,0.028899244163137796,dart,0.37945693573676464,0.04735484368774279,lossguide,0.0007454679808627742,0.33887393027063895,8,9,1.0913460176015901,1000,forest,0.5238919346245785,0.8690941132196441,none,0.7866908794385857,1.7431121363170947,0.16393782643353838,weighted,0.5383583058690651,0.2688457141184194,0.8582249974408844,0.8555487305487306,0.5238919346245785,0.7070023270573302,0.7008691965232139,0.8690941132196441,0.8074088724845023,0.8006102821667824,0.69945583926329,0.6945378151260504,0.7147134302822925,0.7073170731707317,none,0.9164353397133296,0.9129487793188708,0.7866908794385857,COMPLETE
1940,0.7180840267911508,2025-09-23 22:54:44.342914,2025-09-23 22:54:47.125477,0 days 00:00:02.782563,0.00029762352232883855,gbtree,0.7762188278663401,0.11669236140507255,depthwise,0.0010980282850026463,0.008946364038994514,0,11,0.40985546739913864,600,,0.5864627007087855,0.8185363670379393,none,0.9820369621740828,2.6263336909663946,,,,0.9276663286065359,0.8611935715016891,0.8578009828009828,0.5864627007087855,0.724390243902439,0.7180840267911508,0.8185363670379393,0.8278504362878638,0.8213074645363267,0.6901626646010844,0.683011583011583,0.7621899059024807,0.7569533590072742,none,0.9267347132829329,0.9244455062743263,0.9820369621740828,COMPLETE
1941,0.7170790103750998,2025-09-23 22:54:47.269307,2025-09-23 22:54:55.802096,0 days 00:00:08.532789,0.00010646848182784092,dart,0.8846162302904872,5.94958119159664,lossguide,0.0001931903538676804,0.040599806924884345,3,11,2.0142819014502598,300,forest,0.6552944818384498,0.9758203590624941,none,0.9648587768060197,3.694463595384625,0.19399168444840312,weighted,0.601225149771123,0.9884959701370063,0.8549493295117208,0.8548321048321048,0.6552944818384498,0.7184581760381482,0.7170790103750998,0.9758203590624941,0.8264809810846617,0.82039077710281,0.6708719851576994,0.6717757009345794,0.7733105218135158,0.7689345314505777,none,0.9262825062142858,0.924845967007149,0.9648587768060197,COMPLETE
1942,0.6923210261743803,2025-09-23 22:54:55.942266,2025-09-23 22:54:56.745504,0 days 00:00:00.803238,0.001956499834865804,gbtree,0.5320548630150422,8.002391050416154,depthwise,0.007285554418416912,0.2455082145664779,0,12,0.6141766396691379,700,,0.6139807377032789,0.8400123080397923,oversample,0.8459808278717291,2.139952550678002,,,,0.356765252435273,0.8135940219060293,0.8182841932841933,0.6139807377032789,0.689408152822787,0.6923210261743803,0.8400123080397923,0.8138465751899975,0.805395296170763,0.5733333333333334,0.5818764568764568,0.8644140290846878,0.8545143346170304,oversample,0.9193423810433232,0.9175800332679824,0.8459808278717291,COMPLETE
1943,0.6066478266720495,2025-09-23 22:54:56.888512,2025-09-23 22:55:17.374032,0 days 00:00:20.485520,0.02431274414393741,dart,0.4215054441817319,3.4374424063370244,lossguide,0.002881048344682037,0.002696082615989074,6,12,0.44168811212831394,500,forest,0.365662591287397,0.994669467852193,undersample,0.8570917117667103,1.2701491648183714,0.1492542376836503,weighted,0.6201889470013517,0.539980697183039,0.6966936226840004,0.7007575757575758,0.365662591287397,0.6032936136028919,0.6066478266720495,0.994669467852193,0.7860965858918612,0.7777524569588803,0.4390956928473982,0.4424813506085591,0.9636441402908469,0.9644843816859221,undersample,0.9139245587491607,0.9118155177684619,0.8570917117667103,COMPLETE
1944,0.6982448720659759,2025-09-23 22:55:17.514511,2025-09-23 22:56:16.530078,0 days 00:00:59.015567,0.0034601888430715313,dart,0.6503615849508007,3.5364854513029482,lossguide,0.0008892453358401776,0.31703232816272753,5,8,0.2201488173259158,900,forest,0.537486684166034,0.9041036048533172,none,0.8483906822893551,1.8519894690824428,0.1782697371600042,weighted,0.6627378531330116,0.37719113404742577,0.8520831200737026,0.8539107289107289,0.537486684166034,0.6973821989528796,0.6982448720659759,0.9041036048533172,0.7922967013421562,0.7886515436288196,0.6832170701682396,0.6902173913043478,0.712147134302823,0.7064612751390672,none,0.9124357548240505,0.9113886552460068,0.8483906822893551,COMPLETE
1945,0.6734139718588003,2025-09-23 22:56:16.672737,2025-09-23 22:57:06.268421,0 days 00:00:49.595684,0.006228406323700801,dart,0.5873584158321661,0.26915702076331094,lossguide,0.055675644215643624,0.002298578780508303,2,11,1.7920938946431597,700,forest,0.6937243137819943,0.9667032041581666,none,0.9779062000129369,3.190378581791909,0.15587543809851337,weighted,0.7967012839657868,0.7051306622065924,0.8652881564131436,0.8645577395577395,0.6937243137819943,0.6761811023622047,0.6734139718588003,0.9667032041581666,0.810737990433102,0.803043216901522,0.7960602549246814,0.7957992998833139,0.5876817792985458,0.5836542575952075,none,0.9209087736056809,0.9186830349700773,0.9779062000129369,COMPLETE
1946,0.7201062887511072,2025-09-23 22:57:06.409942,2025-09-23 22:57:07.230012,0 days 00:00:00.820070,0.00023380697653454477,gbtree,0.6815081097858783,4.046681391352639,depthwise,0.030349170590890248,0.17355062415621228,2,11,0.21853985809573506,700,,0.6218710683940974,0.9947614315388805,none,0.9513499524304142,2.1110419300495753,,,,0.8673714728169695,0.8708158460436073,0.8705978705978706,0.6218710683940974,0.7199289835774523,0.7201062887511072,0.9947614315388805,0.825821576098283,0.8222551189609321,0.7481549815498155,0.7462138595686094,0.6937553464499572,0.6957637997432606,none,0.9264924790248789,0.9256721098116362,0.9513499524304142,COMPLETE
1947,0.6796422935297212,2025-09-23 22:57:07.376149,2025-09-23 22:58:24.521902,0 days 00:01:17.145753,0.0009312874144441242,dart,0.4333633344434733,2.2447850402209513,lossguide,0.00026130121276337633,0.005669916854477229,6,9,0.1406777433624864,1000,forest,0.42387639003292593,0.8356441442700417,none,0.7730923663210723,2.278372231972167,0.16771394972923223,weighted,0.679410713228944,0.2823311655485696,0.8043812058552564,0.812960687960688,0.42387639003292593,0.6686318709901162,0.6796422935297212,0.8356441442700417,0.7513461911303184,0.7437142701504309,0.5622630504520268,0.5757575757575758,0.8246364414029085,0.8292682926829268,none,0.8992237855450066,0.9010701621369315,0.7730923663210723,COMPLETE
1948,0.6632996632996633,2025-09-23 22:58:24.666649,2025-09-23 22:58:25.694276,0 days 00:00:01.027627,0.0011543090761552829,gbtree,0.8837767373801176,0.6966851212989723,depthwise,0.0011524309565060977,0.18724018773566697,10,7,0.2832412020273501,400,,0.3574276954950345,0.7580707595299961,none,0.9533423332131655,0.9037776886762704,,,,0.6895414492040151,0.8371378851468932,0.8361998361998362,0.3574276954950345,0.6697114386547643,0.6632996632996633,0.7580707595299961,0.7580373832615355,0.7532698474248951,0.6506655909640984,0.6525879917184265,0.6899059024807528,0.6743688489516474,none,0.8949213862487839,0.8951969299987499,0.9533423332131655,COMPLETE
1949,0.6826938385607387,2025-09-23 22:58:25.834855,2025-09-23 22:58:26.978616,0 days 00:00:01.143761,0.006373552723504014,gbtree,0.8056439751662612,2.8278286226733718,lossguide,0.00020769038782588188,0.06263471236005629,7,6,0.5215495117101432,300,,0.42342203980708343,0.9880687141534717,oversample,0.909668593286476,1.7629256438857268,,,,0.5403248944034176,0.7941447435766199,0.795966420966421,0.42342203980708343,0.6810467882632831,0.6826938385607387,0.9880687141534717,0.826391336060549,0.8213209623701654,0.5412150239475675,0.5436105476673428,0.91830624465355,0.9174154899443732,oversample,0.9273753087860843,0.9252019736906885,0.909668593286476,COMPLETE
1950,0.7008314949940607,2025-09-23 22:58:27.117927,2025-09-23 22:58:28.026873,0 days 00:00:00.908946,0.005331750665820808,gbtree,0.3854914457972455,5.307648649978307,lossguide,0.00011009760297106964,0.18909687500777939,5,8,0.21981511230447395,800,,0.42338845893304955,0.8928942518070214,oversample,0.9485991486802913,0.9877869138012269,,,,0.887677532211223,0.8131845634148838,0.8195126945126945,0.42338845893304955,0.6928126578017169,0.7008314949940607,0.8928942518070214,0.82632476191253,0.8179217307589695,0.5711906744379683,0.5807086614173228,0.8802395209580839,0.8836114676936243,oversample,0.9268491680345404,0.9248495947339688,0.9485991486802913,COMPLETE
1951,0.6965901183020181,2025-09-23 22:58:28.167140,2025-09-23 22:59:21.601812,0 days 00:00:53.434672,0.021085009074032234,dart,0.6013013417544241,1.5276487399322274,lossguide,0.0001685394154929668,0.05269528251135041,6,4,0.828021239485876,900,forest,0.45670208495571407,0.8465984236452105,oversample,0.8801498340818318,0.8435158002082369,0.1923207479546693,weighted,0.7232594365775196,0.4249517409160487,0.8179957006858429,0.8214578214578214,0.45670208495571407,0.6949210706932052,0.6965901183020181,0.8465984236452105,0.8047464668618436,0.7896999053327514,0.5802292263610315,0.5869246555262386,0.8661248930710008,0.8566538296961917,oversample,0.9196427204418086,0.9147673357404165,0.8801498340818318,COMPLETE
1952,0.7000451059990979,2025-09-23 22:59:21.750378,2025-09-23 23:00:17.565986,0 days 00:00:55.815608,0.10302976594466653,dart,0.28237646439030867,1.3747314898313459,depthwise,0.0002379539992267088,0.3571031901893976,4,6,1.2068772946722859,900,forest,0.5514650675342593,0.963427100890914,none,0.8266296276968015,1.7038510988173796,0.2085336531417175,weighted,0.7803082522690193,0.2837076697941172,0.8628314054662709,0.8638411138411138,0.5514650675342593,0.6990116801437556,0.7000451059990979,0.963427100890914,0.8084244673236818,0.8020344380923565,0.7360454115421002,0.7401049117787315,0.6655260906757913,0.6640992725716731,none,0.9187394574712389,0.9181812570096464,0.8266296276968015,COMPLETE
1953,0.7265782066747085,2025-09-23 23:00:17.705202,2025-09-23 23:00:44.109561,0 days 00:00:26.404359,0.0002158634123200446,dart,0.6729944200278422,4.393911652578084,depthwise,0.0002700210896959738,0.048369816593151024,2,11,2.4340073349681406,600,forest,0.6099625275192829,0.9303961077013898,none,0.9653562359167581,2.934432365246579,0.13261677131626137,weighted,0.6095758836146195,0.6033840724676653,0.8584297266864571,0.8607698607698607,0.6099625275192829,0.7220100502512563,0.7265782066747085,0.9303961077013898,0.8258174287427416,0.822505394567705,0.6810769814182783,0.6852483883200606,0.7681779298545766,0.7732135216089003,none,0.9270446361444018,0.9258538416504154,0.9653562359167581,COMPLETE
1954,0.6692648361381753,2025-09-23 23:00:44.251648,2025-09-23 23:01:10.593842,0 days 00:00:26.342194,0.00368948981197974,dart,0.5166868054816388,3.166615463132695,depthwise,0.00025823906227308654,0.3136112194343975,0,10,7.494422689615675,600,forest,0.5765859942984463,0.7949443341760337,none,0.9656025858229114,3.892724077661233,0.16524152441064904,weighted,0.5830366556240908,0.33814488629726364,0.8060190398198382,0.8088656838656839,0.5765859942984463,0.6665493577335914,0.6692648361381753,0.7949443341760337,0.7338461599907826,0.7345023176678772,0.5662182361733932,0.5710399032648126,0.8100940975192472,0.808301240907146,none,0.8917262078875872,0.8937582771913817,0.9656025858229114,COMPLETE
1955,0.7148161901225399,2025-09-23 23:01:10.739287,2025-09-23 23:01:28.770334,0 days 00:00:18.031047,0.0026261512222741585,dart,0.5565612165784657,3.4579852238110416,depthwise,0.009491735305071174,0.04974993612834263,2,12,0.44389390483063057,500,forest,0.4295534696292792,0.9721648621975423,none,0.8744436086475629,1.951546642505184,0.23928936463983944,weighted,0.4632536270677306,0.6023480924320268,0.8416419285494933,0.8427518427518428,0.4295534696292792,0.7150488119358998,0.7148161901225399,0.9721648621975423,0.8279449687493143,0.8205982701583041,0.6279521190553219,0.631354542472942,0.830196749358426,0.8237056054771074,none,0.9271334198780478,0.9251996991635556,0.8744436086475629,COMPLETE
1956,0.6586357476283692,2025-09-23 23:01:28.912156,2025-09-23 23:02:13.064969,0 days 00:00:44.152813,0.00043529566851384436,dart,0.9089032043059536,6.492888594981168,depthwise,0.009898768138857348,0.016818177556078437,4,10,5.876543213773264,800,forest,0.567986142952251,0.9832762940255605,undersample,0.7251306989908138,3.122687282066156,0.1184960871262816,weighted,0.5899239195571102,0.6123699003665707,0.7615927935305559,0.767915642915643,0.567986142952251,0.6531645569620254,0.6586357476283692,0.9832762940255605,0.8163049682236336,0.8079101700182345,0.5010281014393421,0.508131970260223,0.9379811804961505,0.9358151476251605,undersample,0.9233435200076805,0.9208098617968523,0.7251306989908138,COMPLETE
