number,value,datetime_start,datetime_complete,duration,params_alpha,params_booster,params_colsample_bytree,params_gamma,params_grow_policy,params_lambda,params_learning_rate,params_max_delta_step,params_max_depth,params_min_child_weight,params_n_estimators,params_normalize_type,params_params_decision_threshold,params_params_feature_fraction,params_params_resampling,params_params_sample_rows,params_params_scale_pos_weight,params_rate_drop,params_sample_type,params_skip_drop,params_subsample,user_attrs_acc_test,user_attrs_acc_val,user_attrs_decision_threshold,user_attrs_f1_test,user_attrs_f1_val,user_attrs_feature_fraction,user_attrs_pr_auc_test,user_attrs_pr_auc_val,user_attrs_prec_test,user_attrs_prec_val,user_attrs_rec_test,user_attrs_rec_val,user_attrs_resampling_strategy,user_attrs_roc_auc_test,user_attrs_roc_auc_val,user_attrs_sample_rows,state
2698,0.7226505521983747,2025-09-24 02:16:38.974619,2025-09-24 02:16:59.143510,0 days 00:00:20.168891,0.0014358316841049515,dart,0.5602033647001619,3.5149858564848153,lossguide,0.0889162036537743,0.07642244334561159,0,10,2.9897735556360447,500,forest,0.6764816090371379,0.9862695879321522,none,0.9919506148089985,3.7533600759084274,0.0011005522679483765,weighted,0.6522306426694193,0.4956673026974514,0.8573037158358071,0.8637387387387387,0.6764816090371379,0.7112676056338029,0.7226505521983747,0.9862695879321522,0.8175728725160571,0.8136256166780158,0.6895582329317269,0.7043054427294883,0.7343883661248931,0.7419768934531451,none,0.9230390076298179,0.9221424179904847,0.9919506148089985,COMPLETE
2699,0.6454973951872984,2025-09-24 02:16:59.298055,2025-09-24 02:17:03.609308,0 days 00:00:04.311253,0.0014772791160860789,gbtree,0.7727793583221989,4.0008888291109335,lossguide,0.57974369488771,0.001301960865011835,0,12,5.592632225808154,400,,0.6888569701177665,0.9498819795784795,none,0.9544401331483497,4.9745642495197755,,,,0.35008418634210137,0.8609888422561163,0.8537059787059788,0.6888569701177665,0.6678082191780822,0.6454973951872984,0.9498819795784795,0.7921168726088585,0.7829297888138645,0.78,0.768004722550177,0.5838323353293413,0.5566966195977749,none,0.9134887270271729,0.909775151764224,0.9544401331483497,COMPLETE
2700,0.7161366313309776,2025-09-24 02:17:03.762045,2025-09-24 02:17:32.562415,0 days 00:00:28.800370,0.00018083286078065158,dart,0.840493946047134,3.5975974346469455,lossguide,0.14353790988420678,0.01516850024334938,1,11,6.990541936795505,600,forest,0.6473677620890701,0.9418688057445405,none,0.8877428435619525,3.970536142443573,0.057682606263655484,weighted,0.47961240875561195,0.2738880796884205,0.8508547446002661,0.851965601965602,0.6473677620890701,0.7155963302752294,0.7161366313309776,0.9418688057445405,0.8192006528419289,0.8124170331592022,0.6581687612208259,0.661588683351469,0.7840034217279727,0.7804878048780488,none,0.9245657712776765,0.9215780185551893,0.8877428435619525,COMPLETE
2701,0.7113623075423894,2025-09-24 02:17:32.715933,2025-09-24 02:17:53.062179,0 days 00:00:20.346246,0.0003444225907491821,dart,0.6052666354829427,7.871555114178554,lossguide,0.017351199510542984,0.013186098311955245,2,10,1.28039214724288,500,forest,0.643254438163185,0.8987807237275195,none,0.9225755745138632,3.6315128475869973,0.008791302413718213,weighted,0.8007843144230149,0.38737197892367825,0.8495240045040434,0.8483824733824734,0.643254438163185,0.7166538164996145,0.7113623075423894,0.8987807237275195,0.821466060886346,0.8111482781576328,0.652280701754386,0.6531853972798854,0.7951240376390077,0.7809157038938811,none,0.924837216391371,0.92207061203264,0.9225755745138632,COMPLETE
2702,0.38612143742255267,2025-09-24 02:17:53.212940,2025-09-24 02:17:54.278465,0 days 00:00:01.065525,57.594225952229074,gbtree,0.7673560147130677,0.054797507094725084,lossguide,0.15677869623922047,0.00019955714572876768,10,8,17.429725287681812,400,,0.39300536956398946,0.5245040223109637,undersample,0.8798439632300591,3.455653443234269,,,,0.8761703183778182,0.23932848807452145,0.23925061425061425,0.39300536956398946,0.3862228462872718,0.38612143742255267,0.5245040223109637,0.6870245793356721,0.6822584798848264,0.23932848807452145,0.23925061425061425,1.0,1.0,undersample,0.873287193419839,0.8739090259398015,0.8798439632300591,COMPLETE
2703,0.603411513859275,2025-09-24 02:17:54.431574,2025-09-24 02:17:55.249420,0 days 00:00:00.817846,48.822511706764956,gbtree,0.6853473983451412,9.676692819738564,depthwise,37.75542910221782,0.0015859133060959825,2,5,0.18046860475415705,400,,0.37874925063691256,0.548186267397951,undersample,0.6676631147891054,0.620450198060825,,,,0.6181531924446972,0.7311905005630054,0.7334152334152334,0.37874925063691256,0.6032033847083711,0.603411513859275,0.548186267397951,0.682679736513154,0.6744530880192311,0.4663551401869159,0.4684322534878222,0.853721129170231,0.8476679503637141,undersample,0.8708078105280874,0.8692776280332762,0.6676631147891054,COMPLETE
2704,0.6560289026042451,2025-09-24 02:17:55.403921,2025-09-24 02:17:56.132871,0 days 00:00:00.728950,0.01243102637179671,gbtree,0.6244845236104561,1.7066293245694482,depthwise,0.00010444491401685486,0.023721734804435096,8,5,0.1448248742457989,200,,0.40482708003953355,0.8909888256431782,undersample,0.8574904625805214,1.3406528023522701,,,,0.5607632637922815,0.7608762411710512,0.7660728910728911,0.40482708003953355,0.6517590936195587,0.6560289026042451,0.8909888256431782,0.814987132300085,0.8041533236117326,0.5002288329519451,0.5060380863910822,0.9349871685201027,0.9323919554985024,undersample,0.9217362610265945,0.9191527392187846,0.8574904625805214,COMPLETE
2705,0.7146587094367773,2025-09-24 02:17:56.282812,2025-09-24 02:17:57.925455,0 days 00:00:01.642643,0.00011280291567007607,gbtree,0.4879342255114305,0.38473229038460954,depthwise,0.06827321165538272,0.049038857057420435,0,7,0.5470080249980762,800,,0.5113682872614588,0.9832298818862328,none,0.9428409037901022,3.5666203121923883,,,,0.6610701256412268,0.8387757191114751,0.8433660933660934,0.5113682872614588,0.7078464106844741,0.7146587094367773,0.9832298818862328,0.820974299636122,0.8195512172403249,0.6249590566655748,0.6333884297520661,0.8160821214713431,0.819854514334617,none,0.9242553879495178,0.9237446927940158,0.9428409037901022,COMPLETE
2706,0.6810477657935285,2025-09-24 02:17:58.076599,2025-09-24 02:18:25.134693,0 days 00:00:27.058094,0.0004684958162362668,dart,0.8014206961035666,4.797862407861792,lossguide,0.009536450048571324,0.10900478581396558,0,8,2.9863366729791854,600,forest,0.6353787921568415,0.833242021775463,none,0.8272004649413209,3.7297067798103885,0.04519509776673315,weighted,0.4860505947316135,0.41614182031498886,0.8251612242808886,0.8304668304668305,0.6353787921568415,0.6731725985457329,0.6810477657935285,0.833242021775463,0.7407078149238183,0.738038278681524,0.6090720221606648,0.6192644483362522,0.7523524379811805,0.756525459991442,none,0.8948791384299859,0.8973768483196167,0.8272004649413209,COMPLETE
2707,0.0,2025-09-24 02:18:25.284387,2025-09-24 02:18:26.466864,0 days 00:00:01.182477,29.471566874524335,gbtree,0.8233231921724689,6.552508309710573,depthwise,0.06730453040258572,0.00022479106275438907,9,3,9.649604425810278,1000,,0.524529582973561,0.9802645122147322,none,0.6131272095038547,1.6081180620228943,,,,0.8311964603105194,0.7606715119254785,0.7607493857493858,0.524529582973561,0.0,0.0,0.9802645122147322,0.7597037081814736,0.7495184527297835,0.0,0.0,0.0,0.0,none,0.8946847927076811,0.8914210134175795,0.6131272095038547,COMPLETE
2708,0.6695766041030118,2025-09-24 02:18:26.623328,2025-09-24 02:18:27.777488,0 days 00:00:01.154160,0.022114575401818954,gbtree,0.84692951707659,3.8605357969669427,lossguide,54.943868036242066,0.36070036964815244,3,7,44.739389946201904,1000,,0.6438543600567694,0.8493694535181519,none,0.748739562496445,2.5720954980988893,,,,0.2747803877177519,0.8486027228989661,0.845004095004095,0.6438543600567694,0.6810437783049386,0.6695766041030118,0.8493694535181519,0.7757208916934935,0.7670489149497464,0.686820356676816,0.6832962138084633,0.6753635585970915,0.6563970902866924,none,0.9010532197039682,0.8990113407922852,0.748739562496445,COMPLETE
2709,0.38612143742255267,2025-09-24 02:18:27.932461,2025-09-24 02:18:31.581056,0 days 00:00:03.648595,0.004310130110677509,dart,0.7605746907347986,3.7872132148839146,lossguide,0.0005702082199833164,0.002146137088696051,1,5,2.451163092225722,200,forest,0.566051476486647,0.9489177217239458,oversample,0.8689422620448753,4.321044592493414,0.007671409785614466,weighted,0.5934345293357175,0.35579868929266784,0.23932848807452145,0.23925061425061425,0.566051476486647,0.3862228462872718,0.38612143742255267,0.9489177217239458,0.7346671249761985,0.7238336984720078,0.23932848807452145,0.23925061425061425,1.0,1.0,oversample,0.897648212428019,0.8963987440694585,0.8689422620448753,COMPLETE
2710,0.7164383561643836,2025-09-24 02:18:31.734632,2025-09-24 02:18:32.547319,0 days 00:00:00.812687,0.0010093708382955637,gbtree,0.685632608469974,0.2243554102983576,depthwise,0.0026791681668064133,0.049315984010559755,2,6,0.32451914178808683,200,,0.6682192046020599,0.9969337748501282,none,0.9857966970839817,2.34119658888846,,,,0.6860071334134149,0.8726584092537619,0.8728501228501229,0.6682192046020599,0.7182971014492754,0.7164383561643836,0.9969337748501282,0.8301919706274816,0.8235663438366885,0.7632338787295476,0.7679882525697503,0.6783575705731394,0.6713735558408216,none,0.9285612695250829,0.9266562890646437,0.9857966970839817,COMPLETE
2711,0.5280988897791004,2025-09-24 02:18:32.697301,2025-09-24 02:18:33.969848,0 days 00:00:01.272547,0.005862667300128149,gbtree,0.7277320906342298,2.4808861722526423,lossguide,2.241224414701009,0.0045428079114136774,5,4,18.314421432896278,800,,0.31290738806072016,0.7959415076434623,undersample,0.8492183407842412,4.037290778892348,,,,0.29322515546979216,0.576005732418876,0.5779074529074529,0.31290738806072016,0.5263037511436414,0.5280988897791004,0.7959415076434623,0.7760591206365424,0.772240275710323,0.35919450515142054,0.36046875,0.9841745081266039,0.9871630295250321,undersample,0.9029939141268764,0.9030300847385161,0.8492183407842412,COMPLETE
2712,0.38612143742255267,2025-09-24 02:18:34.124968,2025-09-24 02:18:37.805944,0 days 00:00:03.680976,23.275807273709944,dart,0.803233075951402,9.11146662273028,lossguide,0.902413190774693,0.00029180571857046443,4,6,0.1571123084603309,200,tree,0.4369062967137254,0.587026649691506,oversample,0.5015675780281516,1.576676549102391,0.020176332674128647,weighted,0.46127692520286906,0.5869716403528638,0.23932848807452145,0.23925061425061425,0.4369062967137254,0.3862228462872718,0.38612143742255267,0.587026649691506,0.660324262005416,0.6529871926553301,0.23932848807452145,0.23925061425061425,1.0,1.0,oversample,0.8683530338250773,0.8686387738237283,0.5015675780281516,COMPLETE
2713,0.7113631760178246,2025-09-24 02:18:37.955150,2025-09-24 02:18:49.858026,0 days 00:00:11.902876,0.0010999308324178363,dart,0.36759198142883853,1.1126716342441016,lossguide,0.04007106452836767,0.029309411763859202,0,4,0.15778027169576925,400,forest,0.6421581422554128,0.8625640054038731,none,0.7487014026214537,3.333773410409087,0.009822918433288932,weighted,0.6874881030860354,0.47354591540692126,0.860067560651039,0.8541154791154791,0.6421581422554128,0.7234472992110055,0.7113631760178246,0.8625640054038731,0.824689468684227,0.8168268819950302,0.6863723608445298,0.6753846153846154,0.7647562018819504,0.7513906718014548,none,0.9256672651582469,0.9242993894996425,0.7487014026214537,COMPLETE
2714,0.6668878566688786,2025-09-24 02:18:50.007580,2025-09-24 02:18:51.306520,0 days 00:00:01.298940,0.0006223159202600112,gbtree,0.39538337388134726,0.9674283231885562,depthwise,0.35350973255112933,0.24527299201563021,2,9,0.24991977669778034,900,,0.626684929819797,0.94024679433561,undersample,0.9901674438243826,4.975489454111571,,,,0.7114619254272758,0.7915856280069608,0.7944307944307945,0.626684929819797,0.6638044914134742,0.6668878566688786,0.94024679433561,0.7647040688037958,0.7601672175354659,0.5406132329209252,0.5445678677865077,0.8597091531223268,0.8600770218228498,undersample,0.9020527489918945,0.8999694061704868,0.9901674438243826,COMPLETE
2715,0.7142560697240091,2025-09-24 02:18:51.458675,2025-09-24 02:19:13.466209,0 days 00:00:22.007534,0.025674041398945947,dart,0.7342869520152874,6.021686140189953,lossguide,0.20800222883042258,0.00951610040755759,0,11,0.972674426974955,500,forest,0.6626724897496555,0.878338241426226,none,0.9435785807069162,3.2904903326480097,0.014910188142849501,weighted,0.750694870112743,0.5816307511352561,0.8594533729143208,0.859029484029484,0.6626724897496555,0.7164980384059467,0.7142560697240091,0.878338241426226,0.8189222264637013,0.815733860447358,0.6926147704590818,0.693392425463336,0.742087254063302,0.7364142062473257,none,0.9242119314056586,0.9229904423218213,0.9435785807069162,COMPLETE
2716,0.6935511906831219,2025-09-24 02:19:13.615201,2025-09-24 02:19:26.654323,0 days 00:00:13.039122,0.0012388203211860505,dart,0.7124335297146387,4.614971546401639,lossguide,0.0004710592249439524,0.008892180411816596,1,8,2.332058312348671,400,forest,0.5991039936493181,0.96047772897473,none,0.9388284182415257,4.722389910703862,0.0522073621000284,weighted,0.5475555132591873,0.2581827951753378,0.8124680110553792,0.8195126945126945,0.5991039936493181,0.6877982276755283,0.6935511906831219,0.96047772897473,0.8100619239612239,0.8041709947843092,0.571671388101983,0.5840163934426229,0.863130881094953,0.8536585365853658,none,0.9191978520610318,0.9166878715936725,0.9388284182415257,COMPLETE
2717,0.6968523817539135,2025-09-24 02:19:26.807152,2025-09-24 02:19:35.334781,0 days 00:00:08.527629,0.00018503887847774782,dart,0.7529310076479611,6.024769632359366,lossguide,0.38163289191898064,0.05741402894875311,1,11,2.0584817414050867,300,forest,0.6952327689504418,0.9652124219546417,oversample,0.9854326461847195,4.123254371526889,0.020947502972160664,weighted,0.6639828059342221,0.5165065412013043,0.8118538233186611,0.8156224406224406,0.6952327689504418,0.6936666666666667,0.6968523817539135,0.9652124219546417,0.8249007756120068,0.8192145973385719,0.5682687056253414,0.574361820199778,0.8900769888793841,0.8857509627727856,oversample,0.9268331380378984,0.9250672583431526,0.9854326461847195,COMPLETE
2718,0.6753725096266533,2025-09-24 02:19:35.487853,2025-09-24 02:20:33.121965,0 days 00:00:57.634112,0.0014506768829443775,dart,0.9848029102367819,0.17731639534976118,lossguide,87.03974932986402,0.004799525494085379,5,11,42.128789352758815,900,forest,0.4398904290939324,0.8707325589137626,none,0.64908919575159,3.0251836602015607,0.05351564447844527,weighted,0.5994259207376184,0.34240289203392915,0.7913808987613881,0.8014946764946765,0.4398904290939324,0.6666666666666666,0.6753725096266533,0.8707325589137626,0.7881785713291248,0.7796402530476543,0.5397245762711864,0.5547304730473047,0.8716852010265184,0.8630723149336756,none,0.9105020537389953,0.9082321874150471,0.64908919575159,COMPLETE
2719,0.6907577019150708,2025-09-24 02:20:33.277575,2025-09-24 02:21:47.334811,0 days 00:01:14.057236,0.010316486913134231,dart,0.3470372843958072,0.72669555594883,depthwise,0.008320964902482854,0.007281706811778299,10,8,12.018048595223187,1000,forest,0.4022266729463736,0.8610974399160648,none,0.8272094780885247,2.694662422018503,0.0015765748642164873,weighted,0.7605054925144131,0.6676010511589029,0.8057119459514792,0.8098894348894349,0.4022266729463736,0.6884438608010506,0.6907577019150708,0.8610974399160648,0.8192230119002485,0.8119714020577418,0.5586041555673947,0.5654307524536533,0.8969204448246364,0.8874625588361147,none,0.9237056482801167,0.9219958117605951,0.8272094780885247,COMPLETE
2720,0.6455146364494806,2025-09-24 02:21:47.489189,2025-09-24 02:21:54.660968,0 days 00:00:07.171779,0.6821676755257244,dart,0.4858278121303293,2.7681687555489947,depthwise,0.05742264307228592,0.04126904959366281,7,11,0.4029900516672875,300,forest,0.6949502408454953,0.5282726846310948,undersample,0.6180031698496018,1.4796778322793462,0.06707481464362289,weighted,0.5523441484066406,0.3837947092527769,0.8017197256628109,0.8078419328419328,0.6949502408454953,0.6396279069767442,0.6455146364494806,0.5282726846310948,0.6873793973433315,0.6914560551357549,0.5660190977938755,0.5777552400270453,0.7352437981180496,0.7312794180573384,undersample,0.8712387210123268,0.8742318936267578,0.6180031698496018,COMPLETE
2721,0.6695665682771478,2025-09-24 02:21:54.811035,2025-09-24 02:22:09.145701,0 days 00:00:14.334666,0.0002567783692983615,dart,0.6815176791960745,3.5529927331865077,lossguide,0.003909680979224153,0.010111027190954792,0,9,7.059026004060293,400,forest,0.6728684886110743,0.9671157482417246,oversample,0.9184408018408741,4.528476028868607,0.006571985157261026,weighted,0.7006998646444514,0.33037902706148786,0.7756167468522879,0.7822481572481572,0.6728684886110743,0.6627692307692308,0.6695665682771478,0.9671157482417246,0.8152028391411392,0.8082273101845675,0.51753964440173,0.525609756097561,0.9213002566295979,0.922122379118528,oversample,0.922809925451594,0.9201839637545177,0.9184408018408741,COMPLETE
2722,0.6737668161434978,2025-09-24 02:22:09.297579,2025-09-24 02:22:12.629457,0 days 00:00:03.331878,0.0008907369425914004,dart,0.8813823184436265,9.037927343962043,depthwise,0.003614134142255873,0.2584795996663979,3,10,1.2146825731816993,200,tree,0.6839478497155764,0.8791739408735756,none,0.9013616688544897,4.831222623980781,0.0011817862726869752,weighted,0.8078423296356347,0.8620453908366557,0.8160507728529021,0.8212530712530712,0.6839478497155764,0.6678987248198115,0.6737668161434978,0.8791739408735756,0.7416022471789104,0.7415277831956164,0.5880247315327042,0.5980099502487563,0.7728828058169376,0.7715019255455713,none,0.8958611987628642,0.8969082093557693,0.9013616688544897,COMPLETE
2723,0.6340953234722845,2025-09-24 02:22:12.784453,2025-09-24 02:22:13.931043,0 days 00:00:01.146590,0.00010548254230122025,gbtree,0.43558631261755276,6.1642039863406275,depthwise,0.001183525675290787,0.007451104148785228,1,5,37.92449636507132,800,,0.6729058744280735,0.7483245537463765,undersample,0.7854695218624161,3.545713086687439,,,,0.2815213903009636,0.7404033166137782,0.7492833742833743,0.6729058744280735,0.6256273988780632,0.6340953234722845,0.7483245537463765,0.7479005751278908,0.7461364973284226,0.4776825969341749,0.4871441689623508,0.9063301967493584,0.9080017115960634,undersample,0.8919640101537509,0.8913712905269631,0.7854695218624161,COMPLETE
2724,0.6781758957654723,2025-09-24 02:22:14.081294,2025-09-24 02:22:17.476652,0 days 00:00:03.395358,0.001696255942507846,dart,0.781560366578381,7.065365999437084,depthwise,9.685487748853648,0.03923542116343875,0,4,5.635102889552563,200,forest,0.6991973748290979,0.8685470846335591,oversample,0.8614929251609104,3.225699693987959,0.08599858733546906,weighted,0.6742982097265805,0.5297050147466805,0.7893336063056607,0.7977067977067978,0.6991973748290979,0.6712460063897764,0.6781758957654723,0.8685470846335591,0.8067298345762047,0.7994158540064764,0.5356960734319225,0.547462529581909,0.8986313088109495,0.8908857509627728,oversample,0.9182281955496124,0.9168452746295731,0.8614929251609104,COMPLETE
2725,0.7222105041130563,2025-09-24 02:22:17.627558,2025-09-24 02:22:55.645698,0 days 00:00:38.018140,0.01102840101475232,dart,0.48172902983679206,4.500569492578954,lossguide,0.00011114379903518265,0.013411654944234956,2,12,4.343953803903395,700,forest,0.5551007884430703,0.8773393818431457,none,0.9920329220961196,1.950871798558936,0.07017399198090549,weighted,0.6256145143259126,0.5494101737065188,0.8638550516941345,0.8651719901719902,0.5551007884430703,0.7204707860445565,0.7222105041130563,0.8773393818431457,0.8277518949609376,0.8212172607438406,0.7082644628099174,0.7121464226289518,0.7331052181351583,0.7325631151048353,none,0.9275554088201703,0.9258430736358871,0.9920329220961196,COMPLETE
2726,0.66393193558189,2025-09-24 02:22:55.795983,2025-09-24 02:23:21.253492,0 days 00:00:25.457509,0.0016020979337939615,dart,0.8733438128331008,2.358906460871903,lossguide,0.0016814814682214695,0.13547179698317074,6,7,0.11258189625303684,600,tree,0.3880393753384743,0.9823944078613173,undersample,0.9511564841525645,1.709877499095096,0.0753042274704521,weighted,0.6318301124743039,0.8485030502147081,0.7722387143003379,0.7735462735462736,0.3880393753384743,0.6636432350718064,0.66393193558189,0.9823944078613173,0.8185901198795587,0.8127279623119962,0.5132101940612579,0.5147232037691402,0.938836612489307,0.9349593495934959,undersample,0.9253094825401968,0.9226149150130134,0.9511564841525645,COMPLETE
2727,0.6653756777691712,2025-09-24 02:23:21.404784,2025-09-24 02:23:52.577786,0 days 00:00:31.173002,0.0026521595039211815,dart,0.6415587094661562,3.164349283569378,lossguide,0.01913606412468832,0.0017876863442890963,1,10,2.7115680463996528,600,forest,0.6736619886623055,0.9161896647767956,none,0.9450044617075734,4.790910305240388,0.07594658942255791,weighted,0.7262804515433892,0.5155325543538433,0.8220902855972976,0.8230958230958231,0.6736619886623055,0.6636996904024768,0.6653756777691712,0.9161896647767956,0.7222335540492728,0.7189096386640325,0.6060070671378092,0.6077113547930668,0.7335329341317365,0.7351305091998288,none,0.8877429983449675,0.8907677634666834,0.9450044617075734,COMPLETE
2728,0.690698156204682,2025-09-24 02:23:52.732294,2025-09-24 02:24:13.074367,0 days 00:00:20.342073,0.026891565054918246,dart,0.7136143372032127,1.1878994974336605,lossguide,0.00019515831529824697,0.2253041983039438,2,9,9.525383351882972,500,forest,0.638057532166134,0.9705792152575589,none,0.7426006274966163,4.469496403696474,0.008418343893742797,weighted,0.6814939676282152,0.6451624762551509,0.8467601596888116,0.8471539721539721,0.638057532166134,0.6883198001249219,0.690698156204682,0.9705792152575589,0.7911183892483877,0.7845834963806337,0.6705882352941176,0.6694779116465863,0.7070145423438836,0.7133076593923834,none,0.9105879883349973,0.9072036404872049,0.7426006274966163,COMPLETE
