number,value,datetime_start,datetime_complete,duration,params_alpha,params_booster,params_colsample_bytree,params_gamma,params_grow_policy,params_lambda,params_learning_rate,params_max_delta_step,params_max_depth,params_min_child_weight,params_n_estimators,params_normalize_type,params_params_decision_threshold,params_params_feature_fraction,params_params_resampling,params_params_sample_rows,params_params_scale_pos_weight,params_rate_drop,params_sample_type,params_skip_drop,params_subsample,user_attrs_acc_test,user_attrs_acc_val,user_attrs_decision_threshold,user_attrs_f1_test,user_attrs_f1_val,user_attrs_feature_fraction,user_attrs_pr_auc_test,user_attrs_pr_auc_val,user_attrs_prec_test,user_attrs_prec_val,user_attrs_rec_test,user_attrs_rec_val,user_attrs_resampling_strategy,user_attrs_roc_auc_test,user_attrs_roc_auc_val,user_attrs_sample_rows,state
947,0.6561762391817466,2025-09-23 15:40:10.575006,2025-09-23 15:40:11.643526,0 days 00:00:01.068520,6.883875747186732,gbtree,0.42825196095606527,5.486458811944807,depthwise,0.0014963284641654351,0.015985393328457016,6,5,0.21724918808337051,1000,,0.6503648993914717,0.741495389938682,oversample,0.8917632970295875,2.7188251586269545,,,,0.4458689085119832,0.7720339850547651,0.7763104013104013,0.6503648993914717,0.6511044963183457,0.6561762391817466,0.741495389938682,0.7464509773016512,0.7376303884472615,0.5137206427688504,0.5189148830263813,0.8887938408896493,0.8921694480102695,oversample,0.8984261421214323,0.8985255996877161,0.8917632970295875,COMPLETE
948,0.5664739884393064,2025-09-23 15:40:11.775992,2025-09-23 15:40:12.289396,0 days 00:00:00.513404,0.40795574692038306,gbtree,0.29790570533215344,7.513487819091642,lossguide,2.2899663431191355,0.010338997863685194,10,8,63.528560236183814,500,,0.6286319474782103,0.5819024475279351,undersample,0.9243471953914929,0.6424431098050768,,,,0.3354091545386365,0.8270037874910431,0.8234029484029484,0.6286319474782103,0.5823035096391498,0.5664739884393064,0.5819024475279351,0.6713964378585368,0.6608253410059921,0.689695550351288,0.6863580998781973,0.5038494439692045,0.48224219084296105,undersample,0.8726649302467792,0.8707960908306787,0.9243471953914929,COMPLETE
949,0.6792392005157962,2025-09-23 15:40:12.421364,2025-09-23 15:40:13.023049,0 days 00:00:00.601685,12.832904123899835,gbtree,0.5472407040990426,6.511905424066507,lossguide,0.4784314594930884,0.3136641869406857,3,10,55.80918633084328,800,,0.4712473931867507,0.988996092012348,none,0.9543695742131898,4.841374787051868,,,,0.7838217107912562,0.7937352850854744,0.7962735462735463,0.4712473931867507,0.6782692000638672,0.6792392005157962,0.988996092012348,0.8156712227273996,0.8079889342724514,0.5411464968152866,0.5448668218257047,0.9084687767322498,0.9015832263585793,none,0.9233946893685954,0.9209151522490726,0.9543695742131898,COMPLETE
950,0.6849370686155095,2025-09-23 15:40:13.152120,2025-09-23 15:40:34.841994,0 days 00:00:21.689874,2.847988428032151,dart,0.6569252318531894,0.7258741971568772,lossguide,0.0006411422644899966,0.4686396546957932,3,4,0.2400623233224764,600,tree,0.5381703461586017,0.6689582337372254,oversample,0.6535978344560438,0.619886364830129,0.23222536064543015,weighted,0.25327383766560496,0.30589578842216886,0.8394922714709796,0.8411138411138411,0.5381703461586017,0.6871508379888268,0.6849370686155095,0.6689582337372254,0.7776156720031677,0.7642268377146763,0.643979057591623,0.6516029354963306,0.7365269461077845,0.7218656397090286,oversample,0.9071346320566088,0.9016058564639786,0.6535978344560438,COMPLETE
951,0.4343773303504847,2025-09-23 15:40:34.970636,2025-09-23 15:40:46.337962,0 days 00:00:11.367326,2.428486218509053,dart,0.929604579134639,6.347637092073734,depthwise,0.016063731609997425,0.0030378895851670903,0,5,2.5434726674498513,400,forest,0.32103746126305055,0.9078743561708873,oversample,0.6840710315658104,4.839798179864215,0.02543948694104675,weighted,0.2344122121498811,0.8132387476942229,0.37219776845122327,0.3787878787878788,0.32103746126305055,0.43239241092086994,0.4343773303504847,0.9078743561708873,0.7675497955484801,0.758200131591647,0.27589464981693634,0.2776784650220474,0.9991445680068435,0.9970047068891742,oversample,0.8999770514913422,0.8975419962643626,0.6840710315658104,COMPLETE
952,0.38612143742255267,2025-09-23 15:40:46.468409,2025-09-23 15:40:49.506887,0 days 00:00:03.038478,0.38438445461940784,dart,0.8009680538871946,5.298244931857061,depthwise,0.04355624990034075,0.000671476126572814,10,9,1.302375840579201,200,tree,0.3814270611713269,0.8215684646531283,undersample,0.7555434879097169,2.6803482102437437,0.3827468274890695,weighted,0.5831653607611201,0.9675494368330935,0.23932848807452145,0.23925061425061425,0.3814270611713269,0.3862228462872718,0.38612143742255267,0.8215684646531283,0.7723133884892511,0.765104622281347,0.23932848807452145,0.23925061425061425,1.0,1.0,undersample,0.9036531297518003,0.9010202664974188,0.7555434879097169,COMPLETE
953,0.5949809885931558,2025-09-23 15:40:49.634706,2025-09-23 15:40:50.596082,0 days 00:00:00.961376,0.6554048982414221,gbtree,0.3021962207352342,0.33727035769736013,lossguide,0.005900509964605533,0.3315108668188844,9,8,0.7931340161869321,700,,0.3588807665081902,0.5012510586496433,undersample,0.6749599745081962,0.8094637386866179,,,,0.8956907502207325,0.7269935510287645,0.7273751023751024,0.3588807665081902,0.5971907566832805,0.5949809885931558,0.5012510586496433,0.6556110817271712,0.6449947067359767,0.4615923418164838,0.46153846153846156,0.8455945252352438,0.8369704749679076,undersample,0.8533734768193586,0.8491687639822237,0.6749599745081962,COMPLETE
954,0.6379982019778244,2025-09-23 15:40:50.725549,2025-09-23 15:41:55.573960,0 days 00:01:04.848411,8.915542821655835,dart,0.3751927163673574,8.259804236574716,lossguide,28.192707339471166,0.0021050460116680465,5,4,0.4482181266237755,1000,forest,0.5269342438910254,0.7784711402149898,oversample,0.6279334709644964,1.5410090416428301,0.27928276209545577,uniform,0.7753309435079829,0.5686142417380042,0.7430647968062237,0.7526617526617526,0.5269342438910254,0.6312077578607111,0.6379982019778244,0.7784711402149898,0.7564954769084178,0.7511299763661459,0.4807520143240824,0.4908923218814849,0.9187339606501284,0.9109970047068892,oversample,0.8999548627527227,0.8989130754618426,0.6279334709644964,COMPLETE
955,0.6167849429188522,2025-09-23 15:41:55.704469,2025-09-23 15:41:56.530519,0 days 00:00:00.826050,8.049010423843603,gbtree,0.5448934405918494,0.9865193692107577,depthwise,0.0014342061647536007,0.03416725993617751,6,5,6.617250711330432,1000,,0.6352732622823517,0.5482597650852428,undersample,0.927274607991314,1.986196100908276,,,,0.945027872648281,0.739482035008701,0.7457002457002457,0.6352732622823517,0.6112723384756377,0.6167849429188522,0.5482597650852428,0.663147291551147,0.655198565977151,0.47540983606557374,0.4822677925211098,0.8558597091531224,0.8553701326486949,undersample,0.86533392641443,0.8667003296682352,0.927274607991314,COMPLETE
956,0.0,2025-09-23 15:41:56.661353,2025-09-23 15:41:57.743074,0 days 00:00:01.081721,7.895965943603552,gbtree,0.2080383092224535,3.071911338997051,depthwise,0.0002435534727502085,0.00016832122322839646,4,10,0.22351599576264525,800,,0.6434545268284191,0.5326716390762174,none,0.9002028006375954,1.41954941782635,,,,0.5698819399215763,0.7606715119254785,0.7607493857493858,0.6434545268284191,0.0,0.0,0.5326716390762174,0.7427380596730118,0.7324519440536795,0.0,0.0,0.0,0.0,none,0.8874700567145309,0.8838331621103858,0.9002028006375954,COMPLETE
957,0.38612143742255267,2025-09-23 15:41:57.873607,2025-09-23 15:42:06.188077,0 days 00:00:08.314470,89.77470798039302,dart,0.7465124899853215,2.5515385270941504,lossguide,4.240814674219682,0.0017956061785386486,0,4,5.249504859727081,400,tree,0.49580019120599844,0.8490360981619932,oversample,0.8790597161943832,3.257988516927089,0.45705031855460604,uniform,0.29420010793636375,0.7188451911409917,0.23932848807452145,0.23925061425061425,0.49580019120599844,0.3862228462872718,0.38612143742255267,0.8490360981619932,0.6540274476573856,0.6460690503924827,0.23932848807452145,0.23925061425061425,1.0,1.0,oversample,0.873264860785379,0.8734398399377827,0.8790597161943832,COMPLETE
958,0.6992703608755669,2025-09-23 15:42:06.316899,2025-09-23 15:43:05.901407,0 days 00:00:59.584508,0.14974266509583678,dart,0.9831709713074728,1.0878917993726978,depthwise,0.08206776583100879,0.07693313219206246,4,9,4.453694615775282,1000,tree,0.6731963149284032,0.9067785907026122,undersample,0.803403704606518,1.2084115003798332,0.25987753421514953,uniform,0.28812058272680074,0.5563931345379545,0.8423584809089979,0.8438779688779688,0.6731963149284032,0.7008547008547008,0.6992703608755669,0.9067785907026122,0.801874651131135,0.7950596005898599,0.6419928825622776,0.6485003657644477,0.7715996578272027,0.7586649550706034,undersample,0.9140932046743355,0.9138947810658228,0.803403704606518,COMPLETE
959,0.690472217587185,2025-09-23 15:43:06.032088,2025-09-23 15:43:13.280740,0 days 00:00:07.248652,0.3803006818021063,dart,0.4474717448832155,1.9076449427617292,lossguide,0.07786249004305665,0.016374753639881067,9,8,0.12091947938373503,300,tree,0.6635644394357538,0.7522138975085659,oversample,0.5289458280600783,2.6526122711135716,0.3801396036629062,weighted,0.7038871210156067,0.2702014397514325,0.8055072167059064,0.8100941850941851,0.6635644394357538,0.6858465608465608,0.690472217587185,0.7522138975085659,0.7992800466237,0.7887639330565724,0.5590296495956874,0.5659190371991247,0.8870829769033362,0.8853230637569534,oversample,0.917704558585695,0.9147939102789451,0.5289458280600783,COMPLETE
960,0.7110210099520826,2025-09-23 15:43:13.411448,2025-09-23 15:44:33.842760,0 days 00:01:20.431312,0.0012937501764987028,dart,0.9912138853621142,0.013045629588908092,lossguide,0.27000004998646526,0.012244798775557052,5,11,7.5842412553872025,1000,forest,0.6644486894869283,0.8858424840619449,oversample,0.9417182856831194,1.9758905014280241,0.34277637519587484,uniform,0.7544696803401917,0.6651074263413053,0.8358071450506704,0.8394758394758395,0.6644486894869283,0.7065495792169777,0.7110210099520826,0.8858424840619449,0.8211492701104234,0.8159712915744598,0.6173273657289002,0.6244739397863386,0.8259195893926433,0.8254172015404364,oversample,0.9240254423962502,0.9222808186478058,0.9417182856831194,COMPLETE
961,0.6905799530673818,2025-09-23 15:44:33.974187,2025-09-23 15:45:29.914134,0 days 00:00:55.939947,0.0014632558023874118,dart,0.9027180531394841,0.7541424885734882,depthwise,0.3647330867351494,0.010758790863422131,8,5,32.65186248130592,900,forest,0.4188005755946329,0.978647936388268,oversample,0.9637044318052785,0.8629777965162039,0.14000929092684172,uniform,0.7355448179489316,0.9104623037099846,0.8050977582147609,0.811015561015561,0.4188005755946329,0.686429512516469,0.6905799530673818,0.978647936388268,0.815938459325994,0.807915992965051,0.5581146223888591,0.5676494902176908,0.8913601368691189,0.881471972614463,oversample,0.9216105248410843,0.9195546395257421,0.9637044318052785,COMPLETE
962,0.38612143742255267,2025-09-23 15:45:30.042728,2025-09-23 15:46:21.190463,0 days 00:00:51.147735,0.002892164388176035,dart,0.898875635028288,9.95455405624191,depthwise,0.0013388945007879786,0.0001765013818851928,5,7,0.548778510113247,1000,forest,0.5602682164306358,0.8488715744063825,undersample,0.8008487281125529,4.117614465452142,0.3440082322188374,uniform,0.15372558995301425,0.5228674606485977,0.23932848807452145,0.23925061425061425,0.5602682164306358,0.3862228462872718,0.38612143742255267,0.8488715744063825,0.7639810614387946,0.7554380824772039,0.23932848807452145,0.23925061425061425,1.0,1.0,undersample,0.9056644194741033,0.902746056761717,0.8008487281125529,COMPLETE
963,0.584726867335563,2025-09-23 15:46:21.319882,2025-09-23 15:46:21.864788,0 days 00:00:00.544906,0.3448008264473922,gbtree,0.7761017451876937,9.522285607007836,depthwise,21.01565161704798,0.17012059399168536,2,3,1.6557295910546836,1000,,0.5651146629640555,0.640188051145399,none,0.8673045843880559,0.767321007640802,,,,0.28281874892894143,0.8515712969597707,0.8474610974610974,0.5651146629640555,0.6001103143960287,0.584726867335563,0.640188051145399,0.7789470382234249,0.7720045051045535,0.84472049689441,0.8385291766586731,0.46535500427716,0.4488660676080445,none,0.9030409968459183,0.9025907555040533,0.8673045843880559,COMPLETE
964,0.0,2025-09-23 15:46:22.001451,2025-09-23 15:46:54.584956,0 days 00:00:32.583505,2.488784178081932,dart,0.5856364182358216,0.8390830687822548,depthwise,11.90563309616095,0.0007084772967302848,5,3,24.56924202463145,700,tree,0.6128347473148661,0.5749509767270627,none,0.5906980504820611,0.8135548986394114,0.12435973520309429,uniform,0.8454552729869264,0.2553308524780198,0.7606715119254785,0.7607493857493858,0.6128347473148661,0.0,0.0,0.5749509767270627,0.6165369266600242,0.6060652048156214,0.0,0.0,0.0,0.0,none,0.8515245591635807,0.8481201205994594,0.5906980504820611,COMPLETE
965,0.5259903824135562,2025-09-23 15:46:54.716491,2025-09-23 15:46:55.902378,0 days 00:00:01.185887,0.23637609896458023,gbtree,0.22047896012548904,3.88747377420633,lossguide,0.018273422411504883,0.0010301421739970073,2,5,2.828428268970505,700,,0.6565023834979268,0.7033222238619607,undersample,0.994451669912106,3.8743384263941345,,,,0.7669488978896541,0.5704780427884123,0.5761670761670762,0.6565023834979268,0.5227479526842584,0.5259903824135562,0.7033222238619607,0.6889831320877706,0.6793716100332208,0.3560582584443756,0.3590745662029076,0.9828913601368692,0.9828840393667094,undersample,0.876229518009946,0.8758135537286784,0.994451669912106,COMPLETE
966,0.38612143742255267,2025-09-23 15:46:56.031421,2025-09-23 15:47:09.229578,0 days 00:00:13.198157,0.20634830027834003,dart,0.42260688685495956,0.015714659796161046,depthwise,0.014656465886822219,0.00026436127674697024,7,3,0.28752524198187673,500,forest,0.31403661280716055,0.6769898451258956,oversample,0.7255306548317143,1.69920880094292,0.3299849434036909,weighted,0.2621265812903546,0.6925372641286247,0.23932848807452145,0.23925061425061425,0.31403661280716055,0.3862228462872718,0.38612143742255267,0.6769898451258956,0.6985357184595059,0.6918715611088827,0.23932848807452145,0.23925061425061425,1.0,1.0,oversample,0.8710420729565727,0.8655938729882168,0.7255306548317143,COMPLETE
967,0.6125406684412895,2025-09-23 15:47:09.358506,2025-09-23 15:47:10.285174,0 days 00:00:00.926668,0.016215948667761253,gbtree,0.8411467065902694,1.6759165382786578,lossguide,0.4838856723556792,0.26383500770276874,5,7,0.12933459233171296,500,,0.3593417200295585,0.7699001272619563,undersample,0.6257293884082384,0.963181496380085,,,,0.2622164069416247,0.7302692189579282,0.7317772317772318,0.3593417200295585,0.6102647537346546,0.6125406684412895,0.7699001272619563,0.6482923092131171,0.6401404025352958,0.466425503052227,0.4680225988700565,0.8823781009409752,0.8861788617886179,undersample,0.8600850666162916,0.8631161643618221,0.6257293884082384,COMPLETE
968,0.42116650139727757,2025-09-23 15:47:10.417054,2025-09-23 15:47:11.577093,0 days 00:00:01.160039,0.00012150056830748194,gbtree,0.5297536803664321,1.6244389082197375,depthwise,0.07797967437904803,0.00037729759917835235,10,5,19.760478976015765,1000,,0.530698648844413,0.9532896934761848,undersample,0.9863188986167849,3.008213556216236,,,,0.46642151543488775,0.3352441396253455,0.34264946764946763,0.530698648844413,0.4185171919770774,0.42116650139727757,0.9532896934761848,0.7445826561571179,0.7368644531973176,0.26466591166477915,0.26678848789401555,0.9995722840034217,0.9995721009841677,undersample,0.8962560201702828,0.893967274564274,0.9863188986167849,COMPLETE
969,0.6738670055061414,2025-09-23 15:47:11.706895,2025-09-23 15:47:23.746821,0 days 00:00:12.039926,0.16975608377749302,dart,0.5649547377631279,1.2834060353625798,lossguide,8.663096358423033,0.001980408388311553,6,8,22.35493661469729,400,tree,0.47535270016019193,0.5033519228437634,none,0.5643394798213525,2.463168573936121,0.06330094426854976,weighted,0.5028434249377922,0.9578565939926409,0.8456341488381616,0.8423423423423423,0.47535270016019193,0.6863560732113144,0.6738670055061414,0.5033519228437634,0.7800553230667872,0.7731821519442074,0.6680161943319838,0.6670859538784067,0.7057313943541489,0.6807873341891314,none,0.903046752679542,0.9004943324830057,0.5643394798213525,COMPLETE
970,0.0,2025-09-23 15:47:23.878179,2025-09-23 15:47:45.170200,0 days 00:00:21.292021,0.00020084758730168264,dart,0.7844308677342169,2.839972667995907,depthwise,27.8137930348698,0.00038867729576726293,10,11,5.252229007130247,600,tree,0.603546712570727,0.7169280820576489,undersample,0.5983415064310615,0.6866471218519284,0.24598376774068198,weighted,0.30273472724885353,0.32862276313718597,0.7606715119254785,0.7607493857493858,0.603546712570727,0.0,0.0,0.7169280820576489,0.6912267903904673,0.6853113714730115,0.0,0.0,0.0,0.0,undersample,0.8741518347467935,0.8728611023441046,0.5983415064310615,COMPLETE
971,0.6638284932339973,2025-09-23 15:47:45.299221,2025-09-23 15:47:47.353838,0 days 00:00:02.054617,0.000834134116201092,gbtree,0.737449620662239,9.598816933464434,depthwise,0.7729323361886279,0.0033368451600207447,5,11,0.6923855199277311,900,,0.35668191783383413,0.8888668836590485,oversample,0.7738287960310233,1.185114102786807,,,,0.9904967758485732,0.7683488586344559,0.7736486486486487,0.35668191783383413,0.6588270767375245,0.6638284932339973,0.8888668836590485,0.8213923519226879,0.8133634880637854,0.5087310826542492,0.5148584905660377,0.9345594525235243,0.9341035515618314,oversample,0.9242117011723137,0.9218773636007825,0.7738287960310233,COMPLETE
972,0.6636219221604448,2025-09-23 15:47:47.487067,2025-09-23 15:47:48.525927,0 days 00:00:01.038860,0.17193010080765467,gbtree,0.5229520960720921,6.239925538969251,lossguide,0.027084576361784178,0.026487392626238542,1,8,1.3338072307678002,800,,0.5330208107611355,0.5400485767613468,none,0.9090940821907132,1.9080423624414053,,,,0.4225022257041193,0.8208619101238612,0.8265765765765766,0.5330208107611355,0.6591351772497078,0.6636219221604448,0.5400485767613468,0.7229216107330197,0.7180546467454532,0.6051502145922747,0.6191181919229344,0.7236954662104362,0.7150192554557124,none,0.8891924035889235,0.8906986926996949,0.9090940821907132,COMPLETE
973,0.6563262460787731,2025-09-23 15:47:48.657853,2025-09-23 15:47:58.978632,0 days 00:00:10.320779,7.316145001460226,dart,0.9921047776278817,6.996593661524027,lossguide,0.24234869075940274,0.4405552409179423,0,10,92.30022865331347,400,tree,0.44396407317733244,0.8933833107155729,none,0.5155919923890737,2.2683799768275343,0.07487973621849281,uniform,0.18329137328096898,0.34734744868483725,0.7895383355512335,0.7981162981162981,0.44396407317733244,0.6511706820495419,0.6563262460787731,0.8933833107155729,0.7317450774944784,0.7308668566868579,0.5396512935883014,0.5536606880329314,0.820786997433704,0.8057338468121523,none,0.8895446606066948,0.8892029175906574,0.5155919923890737,COMPLETE
974,0.6797616420216288,2025-09-23 15:47:59.148993,2025-09-23 15:48:10.345138,0 days 00:00:11.196145,0.00015414196130618537,dart,0.22376813752442157,9.869244315842632,lossguide,0.5651391831441657,0.04458891341384641,10,3,6.77776408883112,400,forest,0.5256242694426291,0.5588072587672426,oversample,0.9139422861317256,0.5011489294267888,0.01046214941753043,uniform,0.8705532716664389,0.5792260424614217,0.8539256832838571,0.8514537264537264,0.5256242694426291,0.6914594594594594,0.6797616420216288,0.5588072587672426,0.7864976135429934,0.7794196542999592,0.6991692173152602,0.7019143117593437,0.6839178785286569,0.658964484381686,oversample,0.9102689136980667,0.9077078081406995,0.9139422861317256,COMPLETE
975,0.6201349992819187,2025-09-23 15:48:10.478427,2025-09-23 15:48:10.969777,0 days 00:00:00.491350,0.0009256430142452076,gbtree,0.4830270864191408,5.890211926850624,depthwise,6.6522591955258426,0.15579994368635333,0,10,31.459949036529373,500,,0.3075585242722888,0.676519958103318,none,0.8425200342593054,3.7649772062224978,,,,0.7006147151316235,0.7251509878186099,0.7292178542178542,0.3075585242722888,0.6187704103365044,0.6201349992819187,0.676519958103318,0.7219381304502159,0.708598951780966,0.4631243358129649,0.46670990056204065,0.9319931565440548,0.9238339751818571,none,0.8933338122186908,0.8909105116378916,0.8425200342593054,COMPLETE
976,0.5425845211450112,2025-09-23 15:48:11.099934,2025-09-23 15:48:52.243673,0 days 00:00:41.143739,0.0001282406678344874,dart,0.27298973328025333,4.982185436186032,lossguide,0.02094322700793394,0.06112276400701681,7,7,0.19021636377905782,800,forest,0.3836087213066805,0.7901758132624832,oversample,0.7803711465513068,3.354610324379996,0.3014365595968474,weighted,0.4469405756274299,0.33233607782364605,0.6031323574572628,0.6024774774774775,0.3836087213066805,0.5429682895202169,0.5425845211450112,0.7901758132624832,0.7700251012977228,0.7652433459927155,0.3747762408462164,0.37434980494148246,0.9850299401197605,0.985451433461703,oversample,0.9021626566349393,0.9014820242969018,0.7803711465513068,COMPLETE
977,0.6570961293839723,2025-09-23 15:48:52.371859,2025-09-23 15:48:58.118019,0 days 00:00:05.746160,3.884978614857942,dart,0.3709165750574719,7.591929831269226,depthwise,39.91408183223415,0.41384269432515675,4,10,85.56590217131122,300,forest,0.4557266021428255,0.8752397529824975,oversample,0.8947059634937801,0.6549591465447668,0.29467946726058925,uniform,0.36853955443480146,0.7028651870219305,0.8072474152932746,0.8068181818181818,0.4557266021428255,0.664049955396967,0.6570961293839723,0.8752397529824975,0.7708722418504689,0.7634484443060973,0.5696357514539333,0.5710675931775111,0.7959794696321643,0.7736414206247325,oversample,0.8968005508102546,0.8938616098227785,0.8947059634937801,COMPLETE
