number,value,datetime_start,datetime_complete,duration,params_alpha,params_booster,params_colsample_bytree,params_gamma,params_grow_policy,params_lambda,params_learning_rate,params_max_delta_step,params_max_depth,params_min_child_weight,params_n_estimators,params_normalize_type,params_params_decision_threshold,params_params_feature_fraction,params_params_resampling,params_params_sample_rows,params_params_scale_pos_weight,params_rate_drop,params_sample_type,params_skip_drop,params_subsample,user_attrs_acc_test,user_attrs_acc_val,user_attrs_decision_threshold,user_attrs_f1_test,user_attrs_f1_val,user_attrs_feature_fraction,user_attrs_pr_auc_test,user_attrs_pr_auc_val,user_attrs_prec_test,user_attrs_prec_val,user_attrs_rec_test,user_attrs_rec_val,user_attrs_resampling_strategy,user_attrs_roc_auc_test,user_attrs_roc_auc_val,user_attrs_sample_rows,state
2949,0.6929027917928019,2025-09-24 02:58:49.569354,2025-09-24 02:58:50.438815,0 days 00:00:00.869461,0.00015682343631515574,gbtree,0.3653963858083052,3.4271685843150843,depthwise,0.0025441083135709576,0.052161420236667866,6,6,0.17701001944582304,400,,0.5897993570700578,0.9051155212813967,undersample,0.9780522323639803,1.759257107920966,,,,0.742727693094104,0.807349779916061,0.8130630630630631,0.5897993570700578,0.6861240827218146,0.6929027917928019,0.9051155212813967,0.8192485276699214,0.8121634672705736,0.5623291416074357,0.57079523413688,0.8798118049615056,0.881471972614463,undersample,0.9225386530129085,0.920954279874057,0.9780522323639803,COMPLETE
2950,0.7198451945818104,2025-09-24 02:58:50.596393,2025-09-24 02:58:51.561192,0 days 00:00:00.964799,0.003932350287858623,gbtree,0.802742146246475,3.500518142209586,depthwise,0.03340669510744469,0.09422533337427742,6,8,0.8607386963240147,300,,0.6050098913924293,0.9705087395161724,none,0.984338814651917,2.146652707018086,,,,0.4170394887358295,0.8652881564131436,0.8666052416052417,0.6050098913924293,0.7178387650085764,0.7198451945818104,0.9705087395161724,0.8206648731794595,0.8147957483568924,0.7196904557179707,0.7234226447709594,0.7159965782720273,0.7163029525032092,none,0.9241834688083895,0.9219195431229327,0.984338814651917,COMPLETE
2951,0.7196082605918671,2025-09-24 02:58:51.719671,2025-09-24 02:58:52.490597,0 days 00:00:00.770926,0.0006620902959294682,gbtree,0.38899232522757504,3.1220060889266046,depthwise,0.3101300071706888,0.33358365923822664,6,6,0.1639410817015881,400,,0.5518106934411078,0.9999859710335952,none,0.9116396956961793,1.8359565200558858,,,,0.7912934785016011,0.8640597809397073,0.8651719901719902,0.5518106934411078,0.7199493884436946,0.7196082605918671,0.9999859710335952,0.8215180945878264,0.8166924163034799,0.7100665557404326,0.7161016949152542,0.7301112061591104,0.7231493367565255,none,0.9251799187253269,0.922735464951063,0.9116396956961793,COMPLETE
2952,0.7092352092352092,2025-09-24 02:58:52.653323,2025-09-24 02:59:56.177441,0 days 00:01:03.524118,1.706374987915654,dart,0.4155204476345086,0.8277602157221652,lossguide,0.002495886282238854,0.10654707476621526,6,11,1.1909091153040852,900,forest,0.44172390008260476,0.9883709932733069,none,0.9930111511734941,2.1483909376355776,0.26871858126978654,weighted,0.6292981355678227,0.7707874889286142,0.8323267478759341,0.834971334971335,0.44172390008260476,0.7066618911174785,0.7092352092352092,0.9883709932733069,0.8222884915674784,0.8135996076792777,0.6078250154035736,0.6130339881509199,0.8438836612489307,0.8412494651262302,none,0.9245983205168188,0.921891730550648,0.9930111511734941,COMPLETE
2953,0.6850411202489443,2025-09-24 02:59:56.335658,2025-09-24 03:00:02.978052,0 days 00:00:06.642394,0.1172031761062519,dart,0.6724773077963035,6.897174077159084,depthwise,0.00017619530274047129,0.004753918393895792,3,7,6.139131397797325,300,tree,0.49495471109771016,0.9889268641580597,oversample,0.5672523823186981,0.7146402618434393,0.1284969186516101,weighted,0.2837642083152144,0.2584757511595871,0.8580202681953117,0.8549344799344799,0.49495471109771016,0.6954994511525796,0.6850411202489443,0.9889268641580597,0.7884873242680305,0.779471223014266,0.7144790257104194,0.7127659574468085,0.6775021385799829,0.6593923833975182,oversample,0.9093354613801408,0.9062580418210106,0.5672523823186981,COMPLETE
2954,0.7047820716428446,2025-09-24 03:00:03.134341,2025-09-24 03:00:03.942327,0 days 00:00:00.807986,0.00011708280638074674,gbtree,0.5545600719486059,2.4633698917430142,depthwise,0.06500936436632973,0.10243451410674229,2,5,0.6591653515755995,300,,0.5300594406767511,0.8953711778635601,undersample,0.9534311342128098,1.0871870383122264,,,,0.4711842318789507,0.8265943289998976,0.8287264537264537,0.5300594406767511,0.7038461538461539,0.7047820716428446,0.8953711778635601,0.8168416927124751,0.8128666986099138,0.5952099349497338,0.5996996996996997,0.8609923011120616,0.8545143346170304,undersample,0.9240135565998172,0.9216358606439261,0.9534311342128098,COMPLETE
2955,0.7151730257320319,2025-09-24 03:00:04.095525,2025-09-24 03:00:04.914658,0 days 00:00:00.819133,0.0005470188889489773,gbtree,0.35058215611047133,4.058585034531722,depthwise,0.10880588599379176,0.26825367627762164,6,7,0.8381177396078496,500,,0.48000510248566464,0.9638840513313496,none,0.841830228499524,1.1661772371206023,,,,0.49465596044766624,0.8671307196232982,0.8685503685503686,0.48000510248566464,0.712704736609119,0.7151730257320319,0.9638840513313496,0.8212971782123927,0.8138381385439513,0.7385321100917431,0.7425149700598802,0.688622754491018,0.6897732135216089,none,0.9249859471322077,0.921731333200547,0.841830228499524,COMPLETE
2956,0.0,2025-09-24 03:00:05.072447,2025-09-24 03:00:06.242287,0 days 00:00:01.169840,4.800546138690196,gbtree,0.2514573772863224,4.150023488098226,depthwise,0.0010264575366852647,0.00019458127731631134,9,5,61.86525286083343,900,,0.60405238849229,0.6382259380172485,none,0.8216121047100045,2.459971427067261,,,,0.24928092288668713,0.7606715119254785,0.7607493857493858,0.60405238849229,0.0,0.0,0.6382259380172485,0.6266982443157796,0.6271039542808602,0.0,0.0,0.0,0.0,none,0.8542120729991657,0.8530033288136463,0.8216121047100045,COMPLETE
2957,0.6452036793692509,2025-09-24 03:00:06.403596,2025-09-24 03:00:07.265754,0 days 00:00:00.862158,0.00011304868911552508,gbtree,0.40014343878173125,2.8505645096073713,depthwise,0.3556406076604671,0.05644145573544641,3,7,0.13149536867608674,300,,0.5495164407615686,0.8454798932029296,none,0.8909346971984394,1.6829769495266034,,,,0.622327421658949,0.8337598525949432,0.8341523341523341,0.5495164407615686,0.6503014642549526,0.6452036793692509,0.8454798932029296,0.7073924196388408,0.6973768145822179,0.6548135299219427,0.6608344549125168,0.6458511548331908,0.6302952503209243,none,0.884638618259185,0.885096906660374,0.8909346971984394,COMPLETE
2958,0.7155790267823463,2025-09-24 03:00:07.421883,2025-09-24 03:00:14.058533,0 days 00:00:06.636650,0.0018925782626536625,dart,0.23175518183695146,0.10128105459398384,lossguide,0.001797089524008762,0.29172739554783894,3,4,0.714353566931657,300,tree,0.624988247250328,0.9772287994537014,none,0.924043610527867,4.181729942569608,0.09462146045183151,uniform,0.3645078657319829,0.6829985705709847,0.8453270549698024,0.8456183456183456,0.624988247250328,0.7185695660271931,0.7155790267823463,0.9772287994537014,0.8266275092246336,0.8192887577321257,0.6364236225668096,0.6397976391231028,0.8250641573994867,0.811724433033804,none,0.9268458296510388,0.924652085162672,0.924043610527867,COMPLETE
2959,0.7195747104613632,2025-09-24 03:00:14.215240,2025-09-24 03:00:15.634141,0 days 00:00:01.418901,0.5650400572334707,gbtree,0.3418213156969086,0.07268905534392044,lossguide,0.004927252048936075,0.09021546928605709,2,6,0.8713962989315972,400,,0.514582967907673,0.9643423540857363,none,0.8190226049526891,2.727834955608,,,,0.6445253160188812,0.8472719828027434,0.8487919737919738,0.514582967907673,0.7183842959607399,0.7195747104613632,0.9643423540857363,0.8241318562715843,0.8220825043701872,0.6429054054054054,0.6467576791808873,0.8139435414884517,0.8108686350021395,none,0.9260181983342848,0.9256933291343836,0.8190226049526891,COMPLETE
2960,0.7186858316221766,2025-09-24 03:00:15.789594,2025-09-24 03:00:16.746350,0 days 00:00:00.956756,0.000247020257628706,gbtree,0.3798594123875614,3.601962827958381,depthwise,6.340472464509888,0.09973803900709499,4,9,0.5092848965877236,500,,0.5344139101404474,0.9321347682030543,none,0.941472274884123,3.0053372817110398,,,,0.7129046780747642,0.8421537516634251,0.8457207207207207,0.5344139101404474,0.7145501666049612,0.7186858316221766,0.9321347682030543,0.8264810667652498,0.8224205577903437,0.6298955613577023,0.6374172185430463,0.825491873396065,0.8237056054771074,none,0.9273937562328483,0.9265452978988493,0.941472274884123,COMPLETE
2961,0.7186978297161937,2025-09-24 03:00:16.900415,2025-09-24 03:00:17.810310,0 days 00:00:00.909895,0.0001436786484706374,gbtree,0.40561090036209746,5.496023782901047,depthwise,0.26811963701054403,0.1497564944798909,0,7,0.48714276386681493,600,,0.5665021055136533,0.9897374379423826,none,0.8873645297568007,2.1746708590271107,,,,0.43594816169543,0.8635479578257754,0.861998361998362,0.5665021055136533,0.7243019648397104,0.7186978297161937,0.9897374379423826,0.8194166497358534,0.8117809595583287,0.7012414897877453,0.7014256619144603,0.7489307100085543,0.7368421052631579,none,0.9225027653902644,0.9197921980494691,0.8873645297568007,COMPLETE
2962,0.6856110381077529,2025-09-24 03:00:17.967837,2025-09-24 03:00:19.430371,0 days 00:00:01.462534,0.0008735619399679087,gbtree,0.6069293568192388,2.6187658546901615,depthwise,0.10175803311706222,0.016916308833827588,0,5,1.1603349128875293,1000,,0.6499461608086813,0.8706756003685723,oversample,0.6954556411586907,2.831062048892088,,,,0.990349733418782,0.7986487869792199,0.8040540540540541,0.6499461608086813,0.678226729919843,0.6856110381077529,0.8706756003685723,0.8158794355576301,0.8100638206808806,0.5491390728476822,0.5563849640095975,0.886655260906758,0.8930252460419341,oversample,0.9205833675517642,0.9204327509564962,0.6954556411586907,COMPLETE
2963,0.6739690721649485,2025-09-24 03:00:19.588809,2025-09-24 03:00:20.528810,0 days 00:00:00.940001,0.0018931264777471129,gbtree,0.25295768528621,0.6368400558154912,lossguide,0.0077863339060471205,0.11287253244189639,2,4,0.33663802776757373,400,,0.6418319672653726,0.9330494471433133,none,0.9073167414748736,2.4483477454189346,,,,0.9526819660441419,0.8447128672330843,0.8445945945945946,0.6418319672653726,0.6786697733531032,0.6739690721649485,0.9330494471433133,0.7551342525022713,0.7504055536438905,0.6722618548048678,0.6765847347994826,0.6852010265183918,0.6713735558408216,none,0.9017898800702995,0.9037038918080572,0.9073167414748736,COMPLETE
2964,0.7127586991130316,2025-09-24 03:00:20.688902,2025-09-24 03:00:21.554402,0 days 00:00:00.865500,0.002024200682784301,gbtree,0.21174930952995807,0.04745995221874396,lossguide,0.004446995040120427,0.07190929455729575,0,4,0.8005035965105023,300,,0.6077920979976407,0.9655696781232865,none,0.7352153330034708,1.893423929583347,,,,0.7296164799017799,0.8704063875524619,0.8707002457002457,0.6077920979976407,0.7142212189616253,0.7127586991130316,0.9655696781232865,0.8272021158855655,0.8214008698441905,0.7562141491395793,0.7606796116504855,0.6766467065868264,0.670517757809157,none,0.9270733577541843,0.9261900973768252,0.7352153330034708,COMPLETE
2965,0.6414767810787424,2025-09-24 03:00:21.711481,2025-09-24 03:00:22.452181,0 days 00:00:00.740700,0.00021386476138647765,gbtree,0.2750534761723807,4.209692336490408,depthwise,4.684492776984774,0.2051233602171677,1,6,0.22106041787654773,300,,0.46221762730903765,0.7967090380792579,undersample,0.9338598244797127,2.549387671863214,,,,0.7820663495621943,0.7422458798239329,0.7454954954954955,0.46221762730903765,0.637906241012367,0.6414767810787424,0.7967090380792579,0.8144017461254289,0.8082496785843047,0.48050259965337955,0.48379377855122907,0.9486740804106074,0.9516474112109542,undersample,0.9219233831777012,0.920418931044802,0.9338598244797127,COMPLETE
2966,0.6267210606833248,2025-09-24 03:00:22.609269,2025-09-24 03:00:32.390189,0 days 00:00:09.780920,0.001845422086531563,dart,0.6421146177342716,4.197281690211986,depthwise,0.1768748231464093,0.002704204167731135,3,4,0.11972801278254808,400,forest,0.5252653565740226,0.9867704250085774,none,0.8933957437616431,1.8034466438436378,0.26648341174581897,weighted,0.3424994868561211,0.6372419936289064,0.8564847988535162,0.8501228501228502,0.5252653565740226,0.64738430583501,0.6267210606833248,0.9867704250085774,0.779135099694332,0.7700261460217295,0.7857142857142857,0.7753943217665615,0.5504704875962361,0.5258878904578519,none,0.9039221574153729,0.9018537799214763,0.8933957437616431,COMPLETE
2967,0.7132270379519425,2025-09-24 03:00:32.542694,2025-09-24 03:00:33.717952,0 days 00:00:01.175258,0.0013630414908136499,gbtree,0.20517502335571308,0.9511982212157886,lossguide,0.0010979455010677011,0.10275638534217509,4,5,5.822190092253786,600,,0.5457590563405648,0.9184916694606452,none,0.856272609294131,1.4131745990833993,,,,0.7580329474223216,0.8685638243423073,0.8692669942669943,0.5457590563405648,0.713903743315508,0.7132270379519425,0.9184916694606452,0.8249364355836355,0.8195605764725872,0.7451162790697674,0.7504725897920604,0.6852010265183918,0.6795036371416345,none,0.9266003145678192,0.9244176649105589,0.856272609294131,COMPLETE
2968,0.6591188776765936,2025-09-24 03:00:33.873613,2025-09-24 03:00:34.605532,0 days 00:00:00.731919,0.0007006914081644104,gbtree,0.5918132809972282,4.98641383649216,depthwise,1.553485407624755,0.062469251789477265,4,6,0.10772266378028293,200,,0.5296813030630872,0.9397043805009931,none,0.8823147226143875,0.955343306539348,,,,0.40699922846453884,0.8651857917903573,0.8582104832104832,0.5296813030630872,0.6822677925211098,0.6591188776765936,0.9397043805009931,0.8050188403275536,0.7919341814148058,0.7825124515771997,0.7757821552723059,0.6047904191616766,0.5729567821994009,none,0.9194194804347127,0.9146538685071103,0.8823147226143875,COMPLETE
2969,0.7160766961651918,2025-09-24 03:00:34.762602,2025-09-24 03:00:36.035497,0 days 00:00:01.272895,0.16984050426793498,gbtree,0.5549443633792219,0.57252981545528,depthwise,0.048677341782181686,0.058557354542602365,6,7,0.42763972326063543,500,,0.43948845017639865,0.9143027877796097,none,0.997348942639328,2.4530495931066585,,,,0.5672177904340585,0.8389804483570478,0.8423423423423423,0.43948845017639865,0.7121683440073193,0.7160766961651918,0.9143027877796097,0.82567392835536,0.8212839679568313,0.6223217141029741,0.6290897311305474,0.8323353293413174,0.8309798887462558,none,0.9267314036785993,0.9246671143166396,0.997348942639328,COMPLETE
2970,0.6418908412377546,2025-09-24 03:00:36.193765,2025-09-24 03:00:36.890006,0 days 00:00:00.696241,0.00038624223956121946,gbtree,0.3792225199046575,5.662479225752295,depthwise,0.29583538813571614,0.42402513137365516,4,10,0.137371910740395,200,,0.44917710739121747,0.9455351685855715,oversample,0.9181651409696243,1.471307441081553,,,,0.6470005650298082,0.7614904289077695,0.7642301392301393,0.44917710739121747,0.6395420792079208,0.6418908412377546,0.9455351685855715,0.7344823475324986,0.7264742128461041,0.5009694619486185,0.504152418172936,0.8840889649272883,0.883183568677792,oversample,0.8899656134987652,0.8909405123628612,0.9181651409696243,COMPLETE
2971,0.664292497625831,2025-09-24 03:00:37.045880,2025-09-24 03:00:48.685411,0 days 00:00:11.639531,0.0005177189285866994,dart,0.24195525063446655,3.5282988658214363,depthwise,0.45227206185604535,0.10722731911247789,2,5,0.6623929769266346,500,forest,0.5236664237633082,0.9044737886530848,none,0.993171315483452,1.6221651252929745,0.4800778119290205,uniform,0.19492554551380614,0.5974063385978228,0.8547446002661481,0.8552416052416052,0.5236664237633082,0.6649350649350649,0.664292497625831,0.9044737886530848,0.7819119883848463,0.7762622070087845,0.7422245651027939,0.7461333333333333,0.602224123182207,0.5986307231493367,none,0.9095089997638955,0.9080279406367996,0.993171315483452,COMPLETE
2972,0.6668735453840187,2025-09-24 03:00:48.839696,2025-09-24 03:00:49.832695,0 days 00:00:00.992999,0.0006655675910886925,gbtree,0.5511658789918423,3.5976792491825833,lossguide,74.91127531369202,0.03656027136721254,7,5,0.11023992925668638,300,,0.6212615887133732,0.8680540437645803,oversample,0.8001268030430144,3.2478534012163798,,,,0.6289544922718285,0.7731599959054151,0.7802006552006552,0.6212615887133732,0.660435182347533,0.6668735453840187,0.8680540437645803,0.8125842660707248,0.8051244351833448,0.5145654250238777,0.5231256085686465,0.9217279726261762,0.9195549850235345,oversample,0.921102946652977,0.919422860909441,0.8001268030430144,COMPLETE
2973,0.6625908790482485,2025-09-24 03:00:49.987840,2025-09-24 03:00:50.975769,0 days 00:00:00.987929,0.002470840553925812,gbtree,0.5923698871532652,3.0477214494915437,depthwise,1.5072882786034245,0.0030699487903293634,5,7,1.1364536174632704,300,,0.405702205189578,0.7473579453446557,none,0.9531054707603018,2.2565966699163336,,,,0.6350490739646361,0.7894359709284471,0.790950040950041,0.405702205189578,0.6656915325857305,0.6625908790482485,0.7473579453446557,0.7707151767686143,0.7613961658455787,0.5368283093053735,0.5397039030955586,0.8759623609923011,0.8579375267436885,none,0.9061347574186652,0.9014754886303298,0.9531054707603018,COMPLETE
2974,0.6364292936588184,2025-09-24 03:00:51.132877,2025-09-24 03:00:52.046169,0 days 00:00:00.913292,0.00045601676996608173,gbtree,0.5182441900126096,2.5430331071977648,depthwise,0.35049403226242426,0.012443617668764732,8,4,0.1740808715024548,400,,0.38226896362701357,0.9344535231110563,oversample,0.9115366517305705,1.3759146971330605,,,,0.5147412851026708,0.73866311802641,0.7423218673218673,0.38226896362701357,0.6337684693731171,0.6364292936588184,0.9344535231110563,0.8102503029649865,0.8032875850681418,0.47679689186272395,0.48037505451373747,0.9448246364414029,0.9426615318784767,oversample,0.9190306450942627,0.917766170203614,0.9115366517305705,COMPLETE
2975,0.6501393574886314,2025-09-24 03:00:52.203747,2025-09-24 03:00:53.233497,0 days 00:00:01.029750,0.010970831787133109,gbtree,0.5606855546278249,3.047815026464746,depthwise,0.008571524498786362,0.028500290331137268,1,6,0.6918229971148235,400,,0.4735939219079238,0.8018879078278405,oversample,0.9645412109457718,3.1498375998452044,,,,0.6798986168950709,0.7558603746545194,0.7558353808353808,0.4735939219079238,0.6514686540990794,0.6501393574886314,0.8018879078278405,0.8236855228524201,0.8185830398086733,0.49478357380688126,0.49464285714285716,0.9533789563729683,0.9482242190842961,oversample,0.9262139542358273,0.925064004905608,0.9645412109457718,COMPLETE
2976,0.6825699745547074,2025-09-24 03:00:53.389855,2025-09-24 03:00:54.117460,0 days 00:00:00.727605,0.0008237305637180147,gbtree,0.48244770041393104,2.6089082929160137,depthwise,1.7323168916244696,0.06027990621078869,7,4,0.2014106631021732,200,,0.42738727962146617,0.9509035830393967,none,0.973807089691773,4.028338507716585,,,,0.721117175742247,0.7877981369638652,0.7956592956592956,0.42738727962146617,0.6748235294117647,0.6825699745547074,0.9509035830393967,0.8236116016639355,0.8174907761983509,0.5328214020312113,0.5431536319919008,0.9200171086398631,0.9182712879760376,none,0.9256538252867355,0.9245571596442226,0.973807089691773,COMPLETE
2977,0.6866110838646395,2025-09-24 03:00:54.270737,2025-09-24 03:00:55.121271,0 days 00:00:00.850534,0.0002071742279823832,gbtree,0.46468083507771546,5.5099406316910535,depthwise,1.5417048699067282,0.45454693338917607,4,4,0.5118468459437687,800,,0.6495452597358048,0.9455610279729975,none,0.8577805259982286,1.5367118362171133,,,,0.7582416774564135,0.8694851059473846,0.8691646191646192,0.6495452597358048,0.6900072939460248,0.6866110838646395,0.9455610279729975,0.8227816829214591,0.8185122140136185,0.7994366197183098,0.80413555427915,0.606928999144568,0.599058622165169,none,0.9251395991107928,0.9242821721929902,0.8577805259982286,COMPLETE
2978,0.6984760522496372,2025-09-24 03:00:55.280879,2025-09-24 03:00:58.670632,0 days 00:00:03.389753,0.000134606278286859,dart,0.3969468157407543,0.2997778451801114,lossguide,0.6469330849419619,0.24643506963354067,4,5,0.39802001209269994,200,tree,0.5361257490936233,0.9340829263430328,none,0.9471147137015102,3.222579817890223,0.18096505477020874,uniform,0.39795715586937014,0.5910033099523158,0.8316101955164296,0.8298525798525799,0.5361257490936233,0.7031221801118932,0.6984760522496372,0.9340829263430328,0.8177072391486351,0.8132054785367222,0.608179831408055,0.6062992125984252,0.8331907613344739,0.8237056054771074,none,0.9211267758041791,0.9211962722861192,0.9471147137015102,COMPLETE
2979,0.6852032520325203,2025-09-24 03:00:58.826293,2025-09-24 03:00:59.657529,0 days 00:00:00.831236,0.00020848499683204547,gbtree,0.24148091232516758,2.004287315263502,lossguide,1.8337829808289172,0.4686141869140529,7,7,0.19842495780386402,300,,0.6553578843260375,0.8603869751478371,oversample,0.9272117900955793,3.9445765403706634,,,,0.9944032306637623,0.8011055379260927,0.8018018018018018,0.6553578843260375,0.6851401717711878,0.6852032520325203,0.8603869751478371,0.8192051361009576,0.8188934248672752,0.5515262196712758,0.5525832677681616,0.9041916167664671,0.9015832263585793,oversample,0.9236100438836268,0.9237164771409736,0.9272117900955793,COMPLETE
2980,0.6917945296864576,2025-09-24 03:00:59.811295,2025-09-24 03:01:00.627302,0 days 00:00:00.816007,0.0012869393787602777,gbtree,0.42581522236668146,3.9464316524223197,depthwise,0.33710756833391065,0.06932675975820239,5,3,0.5672579989580132,500,,0.5557932064814638,0.9753206195363262,undersample,0.7423859544366573,1.6962487650530251,,,,0.7414669554200051,0.806223769065411,0.8108108108108109,0.5557932064814638,0.6894175553732568,0.6917945296864576,0.9753206195363262,0.819220719309558,0.8099026770813869,0.5592227841362789,0.566821535938781,0.8986313088109495,0.8874625588361147,undersample,0.9244379917712301,0.9222091566473748,0.7423859544366573,COMPLETE
