number,value,datetime_start,datetime_complete,duration,params_alpha,params_booster,params_colsample_bytree,params_gamma,params_grow_policy,params_lambda,params_learning_rate,params_max_delta_step,params_max_depth,params_min_child_weight,params_n_estimators,params_normalize_type,params_params_decision_threshold,params_params_feature_fraction,params_params_resampling,params_params_sample_rows,params_params_scale_pos_weight,params_rate_drop,params_sample_type,params_skip_drop,params_subsample,user_attrs_acc_test,user_attrs_acc_val,user_attrs_decision_threshold,user_attrs_f1_test,user_attrs_f1_val,user_attrs_feature_fraction,user_attrs_pr_auc_test,user_attrs_pr_auc_val,user_attrs_prec_test,user_attrs_prec_val,user_attrs_rec_test,user_attrs_rec_val,user_attrs_resampling_strategy,user_attrs_roc_auc_test,user_attrs_roc_auc_val,user_attrs_sample_rows,state
1403,0.6593181235580621,2025-09-23 18:18:25.492788,2025-09-23 18:18:26.294571,0 days 00:00:00.801783,0.03353393526216308,gbtree,0.22197198618718764,0.6071302092464588,depthwise,0.00011102244410344255,0.020514458340803544,10,8,0.4644601964698258,300,,0.512667209187364,0.9042995641781938,none,0.7147042654932798,0.8617939793275533,,,,0.3055397472578827,0.8660047087726481,0.8639434889434889,0.512667209187364,0.6671751843376558,0.6593181235580621,0.9042995641781938,0.8139206759067656,0.8077805786057748,0.8225705329153605,0.8222506393861893,0.561163387510693,0.5502781343602909,none,0.9202652138482134,0.9191493706153091,0.7147042654932798,COMPLETE
1404,0.7232533889468196,2025-09-23 18:18:26.430434,2025-09-23 18:18:30.572220,0 days 00:00:04.141786,0.4596560727208212,dart,0.9238692584432758,6.461825428063708,lossguide,0.014237325290748429,0.16403375734555356,5,12,2.167130952967351,200,forest,0.691226654883216,0.9739530851375843,none,0.9984832914720465,3.6766581958630216,0.2018830686352829,uniform,0.6054223653814819,0.6667739658938465,0.8629337700890573,0.8641482391482391,0.691226654883216,0.7228317118608983,0.7232533889468196,0.9739530851375843,0.8261429549188049,0.8214505752812431,0.7003610108303249,0.7054515866558178,0.7467921300256629,0.7419768934531451,none,0.9270741635708917,0.9253023983823333,0.9984832914720465,COMPLETE
1405,0.6953367875647668,2025-09-23 18:18:30.708820,2025-09-23 18:18:31.425827,0 days 00:00:00.717007,0.026824371309381433,gbtree,0.783041110940911,2.6989145565057395,lossguide,0.00010979401351322254,0.153440995251579,8,11,0.3824534654378865,300,,0.3859447260628477,0.945211872522483,undersample,0.9490776184229677,0.6961290724359014,,,,0.5692505202466555,0.8152318558706111,0.8194103194103194,0.3859447260628477,0.6918217517500427,0.6953367875647668,0.945211872522483,0.8160111397473929,0.803531554553912,0.5757317419721512,0.582971329278888,0.8665526090675791,0.8613607188703466,undersample,0.9221204053626412,0.9186429572261642,0.9490776184229677,COMPLETE
1406,0.7166827386692382,2025-09-23 18:18:31.562364,2025-09-23 18:18:42.308280,0 days 00:00:10.745916,0.23932481260490396,dart,0.7659959351170168,4.715067677865957,lossguide,0.0016456698614844317,0.019348574943601843,4,12,1.107841425889952,300,forest,0.676164043322896,0.9208303462160351,none,0.9946581723142517,4.867653515240521,0.22171713633385248,uniform,0.6906785741474377,0.9346439882579035,0.8476814412938888,0.8496109746109746,0.676164043322896,0.7137360523278183,0.7166827386692382,0.9208303462160351,0.825220291811394,0.8202274738829611,0.6486013986013986,0.6523876404494382,0.7934131736526946,0.7950363714163458,none,0.9260732241037275,0.9242842451797443,0.9946581723142517,COMPLETE
1407,0.6602774274905422,2025-09-23 18:18:42.448238,2025-09-23 18:18:50.760461,0 days 00:00:08.312223,1.541296624080346,dart,0.9546692319915979,5.162353650317369,lossguide,0.010187758480420826,0.005484453398877844,6,12,7.361399626737167,300,forest,0.653355712164661,0.9907928561927881,none,0.9729267171645609,2.2481703240950055,0.2129562497642612,uniform,0.6005059531484925,0.48324501320100777,0.8636503224485618,0.8621007371007371,0.653355712164661,0.6674987518721918,0.6602774274905422,0.9907928561927881,0.8098034897804687,0.8004995760677954,0.8015587529976019,0.8040540540540541,0.5718562874251497,0.560119811724433,none,0.9178374032257303,0.9152385083547413,0.9729267171645609,COMPLETE
1408,0.6666666666666666,2025-09-23 18:18:50.895028,2025-09-23 18:18:54.832960,0 days 00:00:03.937932,0.328339462918654,dart,0.991724865532066,6.293141297650832,depthwise,0.0026689276667453484,0.011349935407277226,6,11,3.7755187511433377,200,forest,0.652866494424077,0.9667577594898694,oversample,0.9642418826458252,4.616763117224296,0.2153662611772925,uniform,0.5202144871772906,0.7633504588959937,0.781553894973897,0.7831695331695332,0.652866494424077,0.6661451814768461,0.6666666666666666,0.9667577594898694,0.8111711220723258,0.8008800041762052,0.5251603354711396,0.5272591486183719,0.9106073567151411,0.9062901155327343,oversample,0.9193507270020774,0.9153582233397923,0.9642418826458252,COMPLETE
1409,0.7018760195758564,2025-09-23 18:18:54.969854,2025-09-23 18:19:02.104856,0 days 00:00:07.135002,0.026132656393047023,dart,0.9378997090202671,6.512565538537448,lossguide,0.009637990325495593,0.47072789774240104,6,11,2.551782160500913,300,forest,0.6038214015020067,0.8133816721313221,none,0.9496317970544195,2.861653753365812,0.20459523701151,uniform,0.5889741973542478,0.7253632110838758,0.8513665677141979,0.8503276003276004,0.6038214015020067,0.7070217917675545,0.7018760195758564,0.8133816721313221,0.8052708813059118,0.8000579612722544,0.6692131398013751,0.6704324113751461,0.7493584260051326,0.7364142062473257,none,0.9138262491108675,0.9132915131288873,0.9496317970544195,COMPLETE
1410,0.7012153950033762,2025-09-23 18:19:02.239195,2025-09-23 18:19:03.308648,0 days 00:00:01.069453,0.3623520256511439,gbtree,0.6469162946414966,4.437119527983996,lossguide,0.001083952985027476,0.03600677838926058,10,6,0.507918150550201,400,,0.35537235323003813,0.9320971487703091,oversample,0.9013688438412945,0.7086947705564505,,,,0.651591385839373,0.8133892926604566,0.8187960687960688,0.35537235323003813,0.6959132610508757,0.7012153950033762,0.9320971487703091,0.828007310224518,0.8212054972947983,0.5704129067541701,0.5790354056314468,0.8922155688622755,0.8887462558836114,oversample,0.9274962388505185,0.925525762705091,0.9013688438412945,COMPLETE
1411,0.6643696162881754,2025-09-23 18:19:03.445951,2025-09-23 18:19:16.036501,0 days 00:00:12.590550,0.6516099347100714,dart,0.9262537373030414,6.531145726185273,lossguide,0.0002128150895457664,0.22865748708225286,8,11,9.109064567780973,400,forest,0.5984823856063282,0.982598541015617,oversample,0.80242840786274,4.239878523702082,0.21870394992262515,uniform,0.6887035460783671,0.5499640091980339,0.7756167468522879,0.7806101556101556,0.5984823856063282,0.661623958011732,0.6643696162881754,0.982598541015617,0.8161575956880218,0.80551049893571,0.5176328502415459,0.5239624505928854,0.916595380667237,0.9075738125802311,oversample,0.9205706759386241,0.9162927660766312,0.80242840786274,COMPLETE
1412,0.6980911569925984,2025-09-23 18:19:16.170862,2025-09-23 18:19:18.181236,0 days 00:00:02.010374,0.002644192948922763,gbtree,0.348487832284143,1.6734409567897388,lossguide,0.0007346587529100144,0.21104771744753373,7,9,0.19467962625416252,900,,0.3753464803170056,0.9374129145721064,none,0.9652423980245445,1.7256921855088274,,,,0.49285775741208804,0.839594636093766,0.8413185913185913,0.3753464803170056,0.6936461388074291,0.6980911569925984,0.9374129145721064,0.7973193170240087,0.7960718882379549,0.6388188692833994,0.6406864497676081,0.7587681779298546,0.7667950363714163,none,0.9125629011887982,0.9115855026132014,0.9652423980245445,COMPLETE
1413,0.6931252075722352,2025-09-23 18:19:18.318481,2025-09-23 18:19:53.356975,0 days 00:00:35.038494,3.5194534151521135,dart,0.757314351092821,0.5259992418908963,lossguide,0.00071586046936079,0.014669800099182777,0,6,0.9724106051905138,700,forest,0.3592665710042459,0.9997495943078095,none,0.883652526784324,2.4004339865065143,0.09822748329763159,uniform,0.5331805569831176,0.6877912492587097,0.8040741119868974,0.8108108108108109,0.3592665710042459,0.6879686990544506,0.6931252075722352,0.9997495943078095,0.8246245312133524,0.816553059147488,0.5558482613277134,0.5663500678426051,0.9024807527801539,0.8930252460419341,none,0.9261770593422993,0.9234418639790164,0.883652526784324,COMPLETE
1414,0.7197216786257882,2025-09-23 18:19:53.492630,2025-09-23 18:19:57.245359,0 days 00:00:03.752729,2.174645670143153,dart,0.8883336388147811,6.846478189336186,lossguide,0.08755565243718619,0.12802692900697002,7,10,1.2602661418979182,200,forest,0.6813127248159987,0.9631731538428216,none,0.9972346677143162,2.9644142030651506,0.16708918085137192,uniform,0.6258169706328855,0.5968686240681518,0.8698945644385301,0.868038493038493,0.6813127248159987,0.7243548037302103,0.7197216786257882,0.9631731538428216,0.8268164033655314,0.8184652974665791,0.7347118345798505,0.7316534040671971,0.7142857142857143,0.7081728712023962,none,0.9275539986409325,0.9249138573233469,0.9972346677143162,COMPLETE
1415,0.720110847189232,2025-09-23 18:19:57.381602,2025-09-23 18:20:01.466193,0 days 00:00:04.084591,0.06222700778505231,dart,0.6428452810128349,2.1397745326881212,lossguide,0.000985793697314414,0.4942114685453037,9,9,0.2590739765341502,200,forest,0.37715125141617195,0.9292114525739782,none,0.970804837540884,1.1941178411441187,0.2155595883715155,uniform,0.4906446902536701,0.9288824654173808,0.8512642030914116,0.8552416052416052,0.37715125141617195,0.7165984006241467,0.720110847189232,0.9292114525739782,0.8225674059808377,0.8181642126303327,0.6586590175690211,0.6699815837937385,0.7857142857142857,0.7783483097988875,none,0.9255514577857377,0.9236222714095913,0.970804837540884,COMPLETE
1416,0.7147134302822925,2025-09-23 18:20:01.604103,2025-09-23 18:20:11.790343,0 days 00:00:10.186240,0.01683126941531194,dart,0.6259873550476445,1.0214421162679563,lossguide,0.0003419090085630811,0.2504525135801754,9,11,0.27687890598424647,300,forest,0.4350308507040256,0.9297943016701676,none,0.9368593747293947,1.1405959973032584,0.22397516099390435,uniform,0.3647042058338396,0.9654240969170431,0.8667212611321528,0.8634316134316135,0.4350308507040256,0.7221510883482715,0.7147134302822925,0.9297943016701676,0.8230588531813423,0.817906335455875,0.7206132879045997,0.7144078666096623,0.7236954662104362,0.7150192554557124,none,0.9248500231211838,0.9225690789725609,0.9368593747293947,COMPLETE
1417,0.6992983056648981,2025-09-23 18:20:11.928158,2025-09-23 18:20:15.282039,0 days 00:00:03.353881,0.04411411152352353,dart,0.8340235966928915,2.9938371223437508,lossguide,0.00038041479802900354,0.33177433382927224,9,6,0.3081766416535288,200,forest,0.4225371421672802,0.9912962459701123,none,0.8423990654246901,2.7661784039909625,0.25019155694407896,uniform,0.4819716351625878,0.8682443872448347,0.8139011157743884,0.8201269451269452,0.4225371421672802,0.6940424099629754,0.6992983056648981,0.9912962459701123,0.8227998881295244,0.8166059360355438,0.5721420643729189,0.5827153451226469,0.8819503849443969,0.8741976893453145,none,0.9247407198406693,0.9231027866873022,0.8423990654246901,COMPLETE
1418,0.6910243576910243,2025-09-23 18:20:15.417107,2025-09-23 18:20:22.425582,0 days 00:00:07.008475,0.018170563817632303,dart,0.7253768289155441,3.4256136768201815,lossguide,0.17925898205413898,0.29482501682226514,7,10,0.26974445674954783,300,forest,0.43957433940689217,0.9077550723165527,undersample,0.8821256253256976,1.0582088435140267,0.1807317269383142,uniform,0.4823418682143576,0.8381298291599378,0.8053024874603337,0.8104013104013104,0.43957433940689217,0.687171052631579,0.6910243576910243,0.9077550723165527,0.8197137711687027,0.8153202011309535,0.5582576162479957,0.5663111840306262,0.8934987168520102,0.8861788617886179,undersample,0.9240454439180927,0.9234034561410995,0.8821256253256976,COMPLETE
1419,0.7136271436474276,2025-09-23 18:20:22.560970,2025-09-23 18:21:05.528779,0 days 00:00:42.967809,0.0304722433026109,dart,0.3924915314911561,0.9452035109561465,depthwise,0.01886785141247935,0.04263743477416602,9,7,0.19669924534618263,800,forest,0.3373335746885008,0.9717880487343638,none,0.928200565323151,1.263406907964707,0.20375656622035865,uniform,0.4941322030609512,0.8150294359457889,0.8412324700583478,0.841011466011466,0.3373335746885008,0.7157778999450247,0.7136271436474276,0.9717880487343638,0.8293114825465104,0.8230639622159737,0.6261622314844502,0.6270252754374595,0.8353293413173652,0.82798459563543,none,0.9278746273529415,0.9256968129037898,0.928200565323151,COMPLETE
1420,0.6770452740270055,2025-09-23 18:21:05.666462,2025-09-23 18:21:40.813774,0 days 00:00:35.147312,0.09788901306778242,dart,0.5620880532727839,8.744043611221933,depthwise,0.18036653453753168,0.019147746562986772,5,11,0.2242394556683368,700,forest,0.6511887117258085,0.8345353327474713,oversample,0.9249639261584071,4.820893819656601,0.2538682828967318,uniform,0.5606077101598077,0.9754401316740953,0.7881052308322244,0.7918714168714168,0.6511887117258085,0.6732954545454546,0.6770452740270055,0.8345353327474713,0.8185519577167011,0.8081273490000631,0.5335167583791895,0.5384032339565437,0.9123182207014542,0.9118528027385537,oversample,0.9225088953530738,0.9205588576507061,0.9249639261584071,COMPLETE
1421,0.7036599763872491,2025-09-23 18:21:40.952364,2025-09-23 18:21:47.341177,0 days 00:00:06.388813,0.00010213525234904797,dart,0.7952246035920196,3.482176966657378,lossguide,0.08673287437326338,0.019522710861761286,5,5,1.729292821664042,300,forest,0.31419962109677857,0.9593949707374586,none,0.876768457148533,0.9317368901654384,0.20699351270475552,uniform,0.4288911452945836,0.9292094819978776,0.8465554304432388,0.8458230958230958,0.31419962109677857,0.7059054345693545,0.7036599763872491,0.9593949707374586,0.8140238912122539,0.8064308490236959,0.6520478434215295,0.6513661202185792,0.7694610778443114,0.7650834403080873,none,0.9192221416789237,0.9179637661493586,0.876768457148533,COMPLETE
1422,0.7140287769784173,2025-09-23 18:21:47.478225,2025-09-23 18:21:55.349049,0 days 00:00:07.870824,3.3266665457580675,dart,0.7527495053034748,0.6865574452035639,lossguide,0.0008037906253880036,0.17438947889877854,6,10,0.5515139868074003,300,forest,0.4188845692891904,0.9966567649379507,none,0.9089485086262086,0.8525308287430132,0.15656151591912335,uniform,0.6284897551801314,0.5417200233038341,0.8689732828334528,0.8697788697788698,0.4188845692891904,0.7150489759572574,0.7140287769784173,0.9966567649379507,0.8223067178403937,0.8158994527860972,0.7455896007428041,0.7522501184272856,0.6869118905047049,0.6795036371416345,none,0.9253762214310637,0.9226653576906972,0.9089485086262086,COMPLETE
1423,0.6878824969400245,2025-09-23 18:21:55.486459,2025-09-23 18:21:58.973379,0 days 00:00:03.486920,0.6653653421599596,dart,0.7296171868100995,3.6057189376051078,depthwise,0.00015317994222674075,0.17618295153944288,10,10,0.11971159579831674,200,forest,0.3733388209676237,0.7964080876423424,none,0.8782570119069756,1.9689889058019172,0.1382440256657251,uniform,0.5056309982724556,0.7393372531170883,0.8209642747466476,0.8172604422604423,0.3733388209676237,0.6977708657335407,0.6878824969400245,0.7964080876423424,0.8043542512192564,0.791192783075688,0.5853870687155698,0.5816085156712004,0.8635585970915313,0.8416773641420625,none,0.919561073941856,0.913518188472155,0.8782570119069756,COMPLETE
1424,0.7170868347338936,2025-09-23 18:21:59.110495,2025-09-23 18:21:59.889808,0 days 00:00:00.779313,0.00011454022228391939,gbtree,0.9760886622278575,8.034765553216358,depthwise,0.0008866549444611733,0.03904704698547728,5,9,1.4359251897281902,200,,0.6554481749383392,0.9980867898600205,none,0.9440328674110071,4.834963300578571,,,,0.41783844313583296,0.8424608455317842,0.8449017199017199,0.6554481749383392,0.7144182594173316,0.7170868347338936,0.9980867898600205,0.8227917834804881,0.8175021605725067,0.6309406751884628,0.6361829025844931,0.8233532934131736,0.8215661103979461,none,0.92615533107037,0.9246284185638958,0.9440328674110071,COMPLETE
1425,0.6580021157624301,2025-09-23 18:22:00.025345,2025-09-23 18:22:26.425266,0 days 00:00:26.399921,1.5386780006617107,dart,0.39402814158236404,1.783560192549256,depthwise,0.0027568367283545983,0.4557077011876888,8,9,0.11971789028613164,600,forest,0.345307201301167,0.995411127925466,oversample,0.9633616804935118,1.5712692636272272,0.27432124832168653,uniform,0.6611009687450604,0.6548667840723474,0.7693725048623196,0.7683251433251433,0.345307201301167,0.6601297329914014,0.6580021157624301,0.995411127925466,0.8211965224604573,0.8145908406177762,0.5099044511768819,0.5086448598130842,0.9358426005132592,0.9315361574668378,oversample,0.9242277023897877,0.9222008647003582,0.9633616804935118,COMPLETE
1426,0.6829470198675497,2025-09-23 18:22:26.561337,2025-09-23 18:22:34.465815,0 days 00:00:07.904478,0.1543077480960977,dart,0.6999541255606684,2.6239053647982757,lossguide,0.001001970198475094,0.04294205420635752,1,8,0.14071808719990045,300,forest,0.4712366040250523,0.9088637964556149,none,0.7914302097367965,1.3502493744286912,0.09073833935110694,uniform,0.48969692761701744,0.5555345634462292,0.8391851776026206,0.8431613431613432,0.4712366040250523,0.6778757432848063,0.6829470198675497,0.9088637964556149,0.7545086264948806,0.7514300508264743,0.6510437179992122,0.6613226452905812,0.7070145423438836,0.7060333761232349,none,0.9005621319791929,0.9025894310958493,0.7914302097367965,COMPLETE
1427,0.705226480836237,2025-09-23 18:22:34.602739,2025-09-23 18:23:08.129754,0 days 00:00:33.527015,1.308229210661759,dart,0.2345758091802027,3.5076454983614047,lossguide,0.0035477996988400487,0.038429174088640286,7,9,1.7013518170931483,700,forest,0.4612771453698602,0.9823502916769244,none,0.99810972918318,1.0005279918416676,0.1895558405139432,uniform,0.6649896307154619,0.40449091575432117,0.872965503122121,0.870085995085995,0.4612771453698602,0.7142528206309003,0.705226480836237,0.9823502916769244,0.823427967344142,0.815976778596281,0.7735660847880299,0.7713414634146342,0.6633875106928999,0.6495507060333762,none,0.9250265545384229,0.9232311103256795,0.99810972918318,COMPLETE
1428,0.7105719237435009,2025-09-23 18:23:08.265948,2025-09-23 18:23:09.025555,0 days 00:00:00.759607,0.0004884347289592341,gbtree,0.7800826301024871,2.893100924879595,depthwise,0.22889364329853892,0.4018923171676664,1,10,0.7683980443641555,500,,0.48547497171209486,0.948929377671634,none,0.8730602520339777,2.27251275679442,,,,0.7091762581473813,0.8450199611014434,0.8461302211302212,0.48547497171209486,0.7102946804439342,0.7105719237435009,0.948929377671634,0.8108677974677756,0.8033739905906223,0.6426592797783933,0.6460084033613446,0.7938408896492729,0.7894736842105263,none,0.919353518581385,0.9160469443973704,0.8730602520339777,COMPLETE
1429,0.7268508753427547,2025-09-23 18:23:09.162434,2025-09-23 18:23:10.294860,0 days 00:00:01.132426,0.008423485007091629,gbtree,0.8722768134685656,3.2679791400278075,lossguide,0.004735995605134635,0.03837439576577445,8,7,0.22279482536405604,300,,0.3968005559346298,0.9795839008572709,none,0.967778545673965,1.0100973940718805,,,,0.6757966423776959,0.8683590950967346,0.8674242424242424,0.3968005559346298,0.7299454010919781,0.7268508753427547,0.9795839008572709,0.8283065397697882,0.8231763949664777,0.716996699669967,0.7167221297836939,0.7433704020530368,0.7372700042789901,none,0.9276430413870913,0.9258529491144517,0.967778545673965,COMPLETE
1430,0.7082945013979497,2025-09-23 18:23:10.430764,2025-09-23 18:23:12.721853,0 days 00:00:02.291089,0.001591229743692627,gbtree,0.7884290774574269,0.739169823761904,lossguide,0.01047698301779377,0.01937703830294768,7,7,0.449488450427054,500,,0.5086402672181154,0.9448491354917651,none,0.9770095563995004,1.0864692085258316,,,,0.5666568339819602,0.8733749616132664,0.8718263718263718,0.5086402672181154,0.7142527142527143,0.7082945013979497,0.9448491354917651,0.8286387908500094,0.8235649517261157,0.7764942240080361,0.7774936061381074,0.6612489307100086,0.6504065040650406,none,0.928043417173957,0.9262993898451403,0.9770095563995004,COMPLETE
1431,0.6740866198887007,2025-09-23 18:23:12.860158,2025-09-23 18:23:13.801072,0 days 00:00:00.940914,0.14123094765185853,gbtree,0.8850124784594511,2.528525118689215,lossguide,0.004839805640995434,0.009261154015250721,6,6,0.4596838308469494,200,,0.395184359415931,0.9999315497687056,none,0.849285237765744,0.8130435334354222,,,,0.5464150215926049,0.8644692394308527,0.8621007371007371,0.395184359415931,0.6812710640346654,0.6740866198887007,0.9999315497687056,0.8072895388751876,0.8007080484267141,0.7791850220264317,0.7756124721603563,0.605218135158255,0.5960633290543432,none,0.9152830218218618,0.9135139561241988,0.849285237765744,COMPLETE
1432,0.6602475928473177,2025-09-23 18:23:13.938318,2025-09-23 18:23:40.145169,0 days 00:00:26.206851,0.029646048398373183,dart,0.6519357532119375,1.3476689526438923,lossguide,0.0003254843768596655,0.4417409787536214,0,7,0.5433057105507757,600,forest,0.38216456428553,0.9829779778466361,undersample,0.7285372854602477,1.6794295445224958,0.10813421493961217,uniform,0.5922674183773949,0.6789926755591476,0.7706008803357559,0.7724201474201474,0.38216456428553,0.65926714307435,0.6602475928473177,0.9829779778466361,0.802970690730024,0.8054463143369156,0.5114413776834159,0.5135520684736091,0.9272882805816938,0.9242618741976893,undersample,0.9174875924372489,0.9184593251495271,0.7285372854602477,COMPLETE
1433,0.7121267969037965,2025-09-23 18:23:40.282813,2025-09-23 18:23:41.002781,0 days 00:00:00.719968,0.00015384177978729191,gbtree,0.6796607882681951,6.165624589481365,depthwise,0.003406133284380894,0.4424248565496084,1,12,0.1257371458309611,700,,0.6301756317211479,0.9007961498285387,oversample,0.9140188104461081,1.5989938220568005,,,,0.8840353608473275,0.8356024158050978,0.8400900900900901,0.6301756317211479,0.7078937795562023,0.7121267969037965,0.9007961498285387,0.8198957876501894,0.8157260400054529,0.6158227848101265,0.6254451278730981,0.8323353293413174,0.8267008985879333,oversample,0.9240478901473828,0.9228117911716907,0.9140188104461081,COMPLETE
