number,value,datetime_start,datetime_complete,duration,params_alpha,params_booster,params_colsample_bytree,params_gamma,params_grow_policy,params_lambda,params_learning_rate,params_max_delta_step,params_max_depth,params_min_child_weight,params_n_estimators,params_normalize_type,params_params_decision_threshold,params_params_feature_fraction,params_params_resampling,params_params_sample_rows,params_params_scale_pos_weight,params_rate_drop,params_sample_type,params_skip_drop,params_subsample,user_attrs_acc_test,user_attrs_acc_val,user_attrs_decision_threshold,user_attrs_f1_test,user_attrs_f1_val,user_attrs_feature_fraction,user_attrs_pr_auc_test,user_attrs_pr_auc_val,user_attrs_prec_test,user_attrs_prec_val,user_attrs_rec_test,user_attrs_rec_val,user_attrs_resampling_strategy,user_attrs_roc_auc_test,user_attrs_roc_auc_val,user_attrs_sample_rows,state
2267,0.6998325759387706,2025-09-24 00:20:03.932455,2025-09-24 00:20:07.416719,0 days 00:00:03.484264,0.010717220478253436,gbtree,0.31706355105498246,2.3999640936282747,lossguide,0.041471369057290236,0.011690032753735776,3,8,0.7723842723292849,1000,,0.6848182695098158,0.9595142298875542,none,0.8232518349973401,2.110141636916815,,,,0.8093684124814897,0.8737844201044119,0.8715192465192465,0.6848182695098158,0.7049533381191673,0.6998325759387706,0.9595142298875542,0.8248260852741468,0.8201653728749605,0.8001086366105378,0.7933839479392625,0.6300256629597947,0.6260162601626016,none,0.9251855306631099,0.9240822153456646,0.8232518349973401,COMPLETE
2268,0.684085510688836,2025-09-24 00:20:07.561416,2025-09-24 00:20:41.117962,0 days 00:00:33.556546,0.02117167806462903,dart,0.9176724701385487,8.031603740865398,depthwise,0.0040196885861307815,0.3735840759254037,6,12,0.28470526211422853,700,tree,0.6689301419743221,0.8821949335420272,oversample,0.8587093628367327,4.714627313126215,0.15249435678226664,uniform,0.6024320115852441,0.3449511735434936,0.8081686968983519,0.8093775593775594,0.6689301419743221,0.6844055237453688,0.684085510688836,0.8821949335420272,0.8069568822303397,0.8016596507964946,0.5644444444444444,0.5667697497891482,0.8691189050470488,0.8626444159178434,oversample,0.9166352110359131,0.9142586766156211,0.8587093628367327,COMPLETE
2269,0.715513536742587,2025-09-24 00:20:41.261279,2025-09-24 00:21:39.416366,0 days 00:00:58.155087,0.0001276264576602609,dart,0.26693888078004085,1.8879817747236158,lossguide,0.0005261071926701605,0.0879488320998057,7,8,0.15804450458271868,900,forest,0.45914277178151947,0.8863811694587822,none,0.793399249178886,1.1278293352893418,0.12070049366575239,weighted,0.8806626368050862,0.20455910070313074,0.8664141672637936,0.8644553644553644,0.45914277178151947,0.7183250593567883,0.715513536742587,0.8863811694587822,0.8198438578173259,0.8151300022141956,0.7250544662309368,0.7186016400517911,0.7117194183062446,0.7124518613607189,none,0.9241742019162552,0.9222948688913615,0.793399249178886,COMPLETE
2270,0.7203634861627427,2025-09-24 00:21:39.562540,2025-09-24 00:21:40.509826,0 days 00:00:00.947286,0.013394671240968064,gbtree,0.900084023041638,3.2141756369813783,depthwise,0.0005087219356988131,0.020862238473462667,10,6,1.5042992632787435,400,,0.32833368485855446,0.8663262854881971,none,0.9533929572514329,0.801680277605369,,,,0.8687541554831838,0.8628314054662709,0.8613841113841114,0.32833368485855446,0.7251845775225595,0.7203634861627427,0.8663262854881971,0.8256870169700843,0.8202832892047212,0.6966115051221434,0.6962075848303393,0.756201881950385,0.7462558836114677,none,0.9260763610330525,0.9244454774828437,0.9533929572514329,COMPLETE
2271,0.701885036071678,2025-09-24 00:21:40.654797,2025-09-24 00:21:44.800843,0 days 00:00:04.146046,0.00016039103812496926,gbtree,0.5942990583104373,2.075955448698406,lossguide,0.0021034445092869324,0.021964943853193513,1,10,1.2686093354840655,900,,0.6840754645161695,0.8939362544221461,none,0.7300674484813487,2.2946657266660617,,,,0.6990513710829672,0.8703040229296755,0.8688574938574939,0.6840754645161695,0.7071874277790617,0.701885036071678,0.8939362544221461,0.8252516456433324,0.8182613793370523,0.7692307692307693,0.7693877551020408,0.6544054747647562,0.6452717158750535,none,0.9259979953582655,0.9244838853207605,0.7300674484813487,COMPLETE
2272,0.6570754716981132,2025-09-24 00:21:44.944277,2025-09-24 00:21:46.816792,0 days 00:00:01.872515,0.7127779912154065,gbtree,0.5104510702664704,1.820666298592933,lossguide,0.0032143731197031085,0.1885267811365026,7,10,0.4886101962968833,1000,,0.5767015964312615,0.9822822309222496,none,0.8502056157289736,1.1420962737884042,,,,0.5433318513484546,0.8567918927218753,0.8511466011466011,0.5767015964312615,0.6745754826703885,0.6570754716981132,0.9822822309222496,0.784162929243188,0.7707296998896453,0.7394186639469659,0.7320021019442985,0.6201881950384944,0.5960633290543432,none,0.9107348196507383,0.9042901439787191,0.8502056157289736,COMPLETE
2273,0.6744881527490223,2025-09-24 00:21:46.965287,2025-09-24 00:21:55.201718,0 days 00:00:08.236431,0.00011849631180655361,gbtree,0.49627538481168165,1.0655636855831352,lossguide,0.2066143467872882,0.0014141274208011657,1,9,0.5676673072200014,900,,0.6753608459311372,0.8807524981055971,none,0.8448723281080112,4.065462082904829,,,,0.6585690367964165,0.8550516941345071,0.8551392301392301,0.6753608459311372,0.677007299270073,0.6744881527490223,0.8807524981055971,0.7648884994562317,0.7574215574955767,0.7253176930596286,0.7293532338308458,0.6347305389221557,0.6272999572100985,none,0.9054113642488366,0.9050993285998983,0.8448723281080112,COMPLETE
2274,0.7004279600570613,2025-09-24 00:21:55.347089,2025-09-24 00:21:56.664830,0 days 00:00:01.317741,0.0001682882931297354,gbtree,0.3188522837263856,1.1133584503332763,depthwise,0.04264732206204274,0.010099467781109421,0,7,0.743031142461911,600,,0.6932552864628484,0.9564012121949412,none,0.877610149559016,2.547794659850652,,,,0.567685715528432,0.8712253045347528,0.871007371007371,0.6932552864628484,0.7018957345971564,0.7004279600570613,0.9564012121949412,0.8209167689344468,0.8138033393360027,0.7869287991498406,0.7881219903691814,0.6334473909324209,0.6302952503209243,none,0.9249466347885577,0.9236818121958071,0.877610149559016,COMPLETE
2275,0.7020473066984695,2025-09-24 00:21:56.812285,2025-09-24 00:22:32.423436,0 days 00:00:35.611151,0.00016254103412992126,dart,0.6770810052991971,0.6366859547411852,depthwise,0.00015943888698785746,0.14261780647631145,4,8,19.39364217805364,700,tree,0.5837383008432636,0.9383853173812352,none,0.9895739967017878,3.132690116024283,0.1082735851559576,weighted,0.770138180063491,0.4748474490442737,0.8442010441191524,0.8465397215397216,0.5837383008432636,0.6998027613412229,0.7020473066984695,0.9383853173812352,0.7993365253736071,0.7959648563205743,0.6493411420204978,0.6555308092056422,0.7587681779298546,0.7556696619597775,none,0.9144800542521854,0.9121147764396073,0.9895739967017878,COMPLETE
2276,0.691820951488165,2025-09-24 00:22:32.567890,2025-09-24 00:22:36.070387,0 days 00:00:03.502497,0.002673617092769854,dart,0.9682041399788142,4.336045971144538,lossguide,5.460555180637954,0.47737860446861347,2,6,2.2142822441931447,200,forest,0.6923728163860395,0.7932650053994065,none,0.9208294678747837,2.6178313930229526,0.15747836700399712,weighted,0.499644586970427,0.8052572193463877,0.8689732828334528,0.8653767403767404,0.6923728163860395,0.7023255813953488,0.691820951488165,0.7932650053994065,0.8118274409048469,0.801830485478346,0.7696228338430173,0.7647668393782383,0.6458511548331908,0.631578947368421,none,0.919496694942775,0.9170265745961116,0.9208294678747837,COMPLETE
2277,0.7223113964686998,2025-09-24 00:22:36.213135,2025-09-24 00:22:37.449145,0 days 00:00:01.236010,0.006547723263848181,gbtree,0.444054095562145,0.45475294075808925,lossguide,0.002317233422141455,0.08328417568067957,4,6,0.1842285052690202,300,,0.6697664343791877,0.9210110785749331,none,0.9962243508129962,4.207162803875648,,,,0.5948312059473734,0.8584297266864571,0.8583128583128583,0.6697664343791877,0.7254318046456224,0.7223113964686998,0.9210110785749331,0.8275550922035348,0.8226927504097209,0.6769173768062245,0.6800151114469211,0.781437125748503,0.7702182284980744,none,0.9275830943799004,0.9258566920072022,0.9962243508129962,COMPLETE
2278,0.6750748182984181,2025-09-24 00:22:37.595925,2025-09-24 00:22:55.952563,0 days 00:00:18.356638,0.0007653928672872593,dart,0.8851683288632781,7.21366632149034,depthwise,0.0005310260554156934,0.03282752545116773,3,12,0.6381117125891406,500,forest,0.6831321662945705,0.9070275677682038,none,0.9428034788855871,3.1151631355886704,0.21693593521138224,weighted,0.7720605641134876,0.4004248229126633,0.8407206469444161,0.8443898443898444,0.6831321662945705,0.6722830665543387,0.6750748182984181,0.9070275677682038,0.7485137833832516,0.7455463723301179,0.6622406639004149,0.6744980777445536,0.6826347305389222,0.6756525459991441,none,0.8995570195326517,0.9011723143175379,0.9428034788855871,COMPLETE
2279,0.6785642670944455,2025-09-24 00:22:56.095997,2025-09-24 00:24:14.148885,0 days 00:01:18.052888,0.0004944524756997241,dart,0.32146740696129195,1.688803281386321,lossguide,0.005167709436461372,0.007314741524015499,2,9,0.13446525711492574,1000,tree,0.6282479720578868,0.9758931194208992,none,0.9773499665916929,3.1046337576011034,0.24176132153617746,weighted,0.7592592568613818,0.5685099020424751,0.8353976865595251,0.8358927108927109,0.6282479720578868,0.6789137380191693,0.6785642670944455,0.9758931194208992,0.7556147367725703,0.7475028778445101,0.6367041198501873,0.6384905660377358,0.7271171941830624,0.72400513478819,none,0.901323283417593,0.9020215478911477,0.9773499665916929,COMPLETE
2280,0.7167031654389807,2025-09-24 00:24:14.292915,2025-09-24 00:24:17.801207,0 days 00:00:03.508292,0.0024994054521103905,gbtree,0.3488775781531931,0.7124109306741292,lossguide,0.025430491561424188,0.008110043093536481,1,7,0.45877050548844045,900,,0.5601574626318945,0.9739663883445073,none,0.8182381788100112,2.427254341357984,,,,0.446473532613035,0.8560753403623708,0.8543202293202293,0.5601574626318945,0.7201433121019108,0.7167031654389807,0.9739663883445073,0.8224097262948341,0.8171312290297149,0.6734921816827997,0.6701414743112435,0.7737382378100941,0.7702182284980744,none,0.9252644431420911,0.9243084876081746,0.8182381788100112,COMPLETE
2281,0.7006118881118881,2025-09-24 00:24:17.950066,2025-09-24 00:24:18.925484,0 days 00:00:00.975418,0.003291180822821608,gbtree,0.7618957040558991,7.160431140399954,depthwise,0.011397525430446028,0.1960034388072609,6,12,0.10121747106375209,600,,0.6859806570765807,0.9919546781797326,none,0.9335960882959924,2.861823014158186,,,,0.2957324080367014,0.8601699252738254,0.8597461097461098,0.6859806570765807,0.7048401037165082,0.7006118881118881,0.9919546781797326,0.8001848161630176,0.8008756301238286,0.7122270742358079,0.7159446181330952,0.6976047904191617,0.6859221223791185,none,0.9163304108663691,0.9154715178242022,0.9335960882959924,COMPLETE
2282,0.7123349003805686,2025-09-24 00:24:19.069737,2025-09-24 00:24:20.317323,0 days 00:00:01.247586,0.0003443687254357304,gbtree,0.39290543882248447,0.7510954173025269,lossguide,0.00021012532038393162,0.02162795626846431,1,6,0.14088648991104114,300,,0.621011087247241,0.8777604027839754,none,0.7525097239686476,2.3228337045589416,,,,0.6427625244618023,0.8667212611321528,0.8684479934479934,0.621011087247241,0.7104092526690391,0.7123349003805686,0.8777604027839754,0.8160065564630387,0.8100164393485051,0.7400370713623726,0.7469483568075117,0.6830624465355004,0.6807873341891314,none,0.9220869064109509,0.9213015627383395,0.7525097239686476,COMPLETE
2283,0.7149355572403336,2025-09-24 00:24:20.465355,2025-09-24 00:24:58.156767,0 days 00:00:37.691412,0.004865789346786089,dart,0.8190392312251451,8.719773903495943,depthwise,0.06815120230383036,0.009888543664613433,2,12,0.44000005554689386,700,forest,0.6639428476198208,0.9948405581657064,none,0.9271024852283165,4.719230855690828,0.08871141866108376,weighted,0.6665057821122885,0.6748936548191358,0.8456341488381616,0.846027846027846,0.6639428476198208,0.7169669669669669,0.7149355572403336,0.9948405581657064,0.8261456258809969,0.8197330920800574,0.6387959866220736,0.6417148690030623,0.8169375534644996,0.8070175438596491,none,0.9274211540008971,0.9252078471531586,0.9271024852283165,COMPLETE
2284,0.7229204069419509,2025-09-24 00:24:58.299561,2025-09-24 00:25:34.492603,0 days 00:00:36.193042,0.00012598031620747227,dart,0.8152505291736004,6.9053927968252555,depthwise,0.00022332884676390177,0.03244235761126279,7,12,0.26090265347415803,700,forest,0.6564960697385996,0.9768814477761408,none,0.9968294454593666,3.812846121033271,0.15527665431708054,weighted,0.7829636116027207,0.6141850426795669,0.8564847988535162,0.8578009828009828,0.6564960697385996,0.721604447974583,0.7229204069419509,0.9768814477761408,0.82817383393302,0.820663438844553,0.6734618235730171,0.6771300448430493,0.7771599657827203,0.7753530166880617,none,0.9276556466627274,0.9252903923340491,0.9968294454593666,COMPLETE
2285,0.6923754182074309,2025-09-24 00:25:34.636166,2025-09-24 00:25:36.549067,0 days 00:00:01.912901,0.0027566635936845142,gbtree,0.2511010900392997,0.2903840235447256,lossguide,0.0009990204319910289,0.14968244902459,4,8,0.28688951284418623,300,,0.6156099006578558,0.9823001531164294,oversample,0.9671865021826672,3.312795403533349,,,,0.48528616914526745,0.8168696898351929,0.8211506961506961,0.6156099006578558,0.688923665449487,0.6923754182074309,0.9823001531164294,0.8101128416452412,0.8077954965491948,0.5804277761500146,0.5882704967085578,0.8473053892215568,0.8412494651262302,oversample,0.917512371300999,0.9154918158195032,0.9671865021826672,COMPLETE
2286,0.7056638811513464,2025-09-24 00:25:36.693152,2025-09-24 00:25:37.561827,0 days 00:00:00.868675,0.0063071214285324246,gbtree,0.7993199942246659,6.28352168462132,lossguide,0.006210894234115059,0.056132227829803885,6,9,1.0505652440584878,400,,0.4474535521164956,0.9533676069390059,none,0.9869389390431469,0.8584099623240653,,,,0.7032113437069298,0.8728631384993346,0.8701883701883701,0.4474535521164956,0.7138248847926267,0.7056638811513464,0.9533676069390059,0.8256161588707588,0.8181984238995811,0.7737262737262737,0.7711821410451547,0.6625320786997434,0.6504065040650406,none,0.9263739376313985,0.9237149799838733,0.9869389390431469,COMPLETE
2287,0.6935341009743136,2025-09-24 00:25:37.709882,2025-09-24 00:26:26.408593,0 days 00:00:48.698711,0.00030322676601808374,dart,0.7327144280550383,2.155643257473994,depthwise,0.0004133394966532948,0.0002799119028468016,4,12,1.1901103211618522,800,forest,0.6057638511439298,0.9033174397997566,none,0.9609783415560897,4.2810326567568495,0.06536967129248121,weighted,0.6728287276053541,0.5427581933521136,0.8607841130105436,0.8583128583128583,0.6057638511439298,0.701623519087319,0.6935341009743136,0.9033174397997566,0.798258610481176,0.7870587381076684,0.7202702702702702,0.7186782927948601,0.6839178785286569,0.6700898587933247,none,0.9162142581438426,0.9115994952737918,0.9609783415560897,COMPLETE
2288,0.7103369935630442,2025-09-24 00:26:26.557178,2025-09-24 00:27:13.312818,0 days 00:00:46.755640,0.004586037462378526,dart,0.4741799721389677,2.1227910654336406,lossguide,0.03241317430977799,0.006711357982297946,6,9,1.2537164788168855,800,tree,0.5292932181350162,0.9724087822468885,none,0.9597112813612164,2.518878864871218,0.3027307148678537,weighted,0.48995479647980467,0.5814501121537543,0.8439963148735797,0.8433660933660934,0.5292932181350162,0.7126696832579186,0.7103369935630442,0.9724087822468885,0.8164160448827689,0.8092693065044549,0.6372218476062036,0.6370118845500848,0.8083832335329342,0.8027385537013265,none,0.9226520429352956,0.9210874404815271,0.9597112813612164,COMPLETE
2289,0.6655121227115289,2025-09-24 00:27:13.456437,2025-09-24 00:27:49.941203,0 days 00:00:36.484766,0.11118752019439508,dart,0.3556282892719717,1.5533896302747494,lossguide,0.0007734388597132568,0.046024870520308535,8,9,4.461851507186546,700,forest,0.612391475194189,0.9848560682860521,none,0.9377833714075269,1.3191802883089532,0.14619310379068587,weighted,0.692968505385695,0.41748346804878267,0.8635479578257754,0.8615888615888616,0.612391475194189,0.673364371477579,0.6655121227115289,0.9848560682860521,0.804802157518794,0.7942890428233648,0.7882960413080895,0.7888563049853372,0.5876817792985458,0.5755241762943946,none,0.9201653501348419,0.9157704309975553,0.9377833714075269,COMPLETE
2290,0.709366391184573,2025-09-24 00:27:50.085795,2025-09-24 00:28:34.442967,0 days 00:00:44.357172,0.0022358380634871656,dart,0.21773281053784216,0.3922368782348912,depthwise,0.0004832515422355457,0.012438844642928356,8,8,0.5219358932928548,800,forest,0.46193591750177965,0.8056171495568897,none,0.9676016744949031,1.0652221388105563,0.24723633372524434,weighted,0.7340134140639949,0.23510737069212437,0.8685638243423073,0.8703931203931204,0.46193591750177965,0.7056396148555708,0.709366391184573,0.8056171495568897,0.8176435269613411,0.8137719678538808,0.7603754940711462,0.7652303120356612,0.6582549187339607,0.6611039794608472,none,0.9238567676919072,0.922661960295739,0.9676016744949031,COMPLETE
2291,0.6846465035638605,2025-09-24 00:28:34.590124,2025-09-24 00:28:35.760609,0 days 00:00:01.170485,1.9091800201796503,gbtree,0.3421815479347991,3.692268694505745,lossguide,0.004927455813700431,0.16043356418629695,3,11,2.6120927017362443,700,,0.6779157872472675,0.707737267838505,none,0.9765299880636096,4.818640202993046,,,,0.7987869375424655,0.8364213327873887,0.8324119574119574,0.6779157872472675,0.6983767459418648,0.6846465035638605,0.707737267838505,0.7895503297615396,0.7779226135748475,0.625,0.622634898388227,0.7912745936698032,0.7603765511339324,none,0.9105708359507987,0.9053178559535633,0.9765299880636096,COMPLETE
2292,0.6301056840902599,2025-09-24 00:28:35.904814,2025-09-24 00:28:41.233650,0 days 00:00:05.328836,0.00016475660575470362,gbtree,0.3717174447014762,0.8088947754494605,lossguide,0.013784662119606904,0.002235102267601017,2,8,0.5097537588425385,800,,0.594893857501567,0.996665386412835,undersample,0.7912548104916549,3.11298584924487,,,,0.793036793812381,0.7321117821680827,0.7348484848484849,0.594893857501567,0.6283198409316858,0.6301056840902599,0.996665386412835,0.7833726433296656,0.7771622434748127,0.4703380820752711,0.47288317256162915,0.9461077844311377,0.9439452289259734,undersample,0.9117517027770401,0.9108093418226748,0.7912548104916549,COMPLETE
2293,0.6800707736850571,2025-09-24 00:28:41.379422,2025-09-24 00:29:26.005134,0 days 00:00:44.625712,0.0025125358491666304,dart,0.36134533819519316,2.690312995424808,lossguide,0.00014358213404643677,0.026488246023175403,9,8,2.053345361746921,800,forest,0.4935852013734319,0.965668317686622,undersample,0.7544920045104065,1.6103801118671297,0.09970362865368755,weighted,0.5537663596192168,0.4729985522910887,0.7930187327259699,0.7963759213759214,0.4935852013734319,0.6778202676864244,0.6800707736850571,0.965668317686622,0.8190665072941765,0.8144853796649298,0.5401218892839005,0.5448453608247422,0.9097519247219846,0.9045785194694053,undersample,0.924055689301943,0.9220017428060305,0.7544920045104065,COMPLETE
2294,0.7132924335378323,2025-09-24 00:29:26.149884,2025-09-24 00:29:27.149425,0 days 00:00:00.999541,0.004260686844052403,gbtree,0.9667033905585061,8.409408449880749,lossguide,0.00019714811909934434,0.30327629519079385,2,12,5.543696993454572,800,,0.6310436253072033,0.9775594661930207,none,0.9128637862147917,2.8362868119149787,,,,0.4700129917263445,0.8543351417750026,0.8564701064701065,0.6310436253072033,0.7090574524637089,0.7132924335378323,0.9775594661930207,0.8080852350037228,0.8059190591013924,0.6792009400705052,0.6831179005092048,0.7416595380667237,0.7462558836114677,none,0.9201307287955954,0.9181053626612589,0.9128637862147917,COMPLETE
2295,0.7112648981161092,2025-09-24 00:29:27.294998,2025-09-24 00:29:28.284634,0 days 00:00:00.989636,0.002171912700153978,gbtree,0.5826955858614379,1.4768870730263601,lossguide,0.0002624933861613466,0.08221978335440262,0,4,1.7935116425966229,500,,0.681272655069446,0.9616498676348257,none,0.9647247173347492,4.981862881845622,,,,0.45099790604274237,0.8437915856280069,0.8462325962325963,0.681272655069446,0.7097755800684671,0.7112648981161092,0.9616498676348257,0.815427936028556,0.8090326071081955,0.6390410958904109,0.6457242582897034,0.7981180496150556,0.7916131792896877,none,0.9204461196990067,0.9197824089453525,0.9647247173347492,COMPLETE
2296,0.6711576846307385,2025-09-24 00:29:28.429282,2025-09-24 00:29:32.096567,0 days 00:00:03.667285,0.0004947081261216569,dart,0.7032091851376638,7.622548681235247,depthwise,37.56534745200927,0.023779114370466356,3,10,6.885410994313102,200,forest,0.6800377741427751,0.9647303316474757,none,0.9628040786451434,1.9465582624634061,0.0756782284365111,weighted,0.7683207883258387,0.9740549076919133,0.8668236257549391,0.8650696150696151,0.6800377741427751,0.6778905669720228,0.6711576846307385,0.9647303316474757,0.8151527450643773,0.808141830359281,0.8048206937095826,0.8049072411729503,0.5855431993156544,0.5755241762943946,none,0.9209427618032289,0.9190561437943385,0.9628040786451434,COMPLETE
2297,0.38612143742255267,2025-09-24 00:29:32.240225,2025-09-24 00:29:33.693155,0 days 00:00:01.452930,13.999085264187174,gbtree,0.31033061796650036,9.408069478248024,lossguide,89.13457284650167,0.00023349141740513558,4,8,0.13145857977821063,700,,0.35744420780255864,0.9369117114304351,oversample,0.6637894612796463,2.7678878391129227,,,,0.26038662605059015,0.23932848807452145,0.23925061425061425,0.35744420780255864,0.3862228462872718,0.38612143742255267,0.9369117114304351,0.7007016007834582,0.6922047251646707,0.23932848807452145,0.23925061425061425,1.0,1.0,oversample,0.8785289447634519,0.8767914564384579,0.6637894612796463,COMPLETE
