number,value,datetime_start,datetime_complete,duration,params_alpha,params_booster,params_colsample_bytree,params_gamma,params_grow_policy,params_lambda,params_learning_rate,params_max_delta_step,params_max_depth,params_min_child_weight,params_n_estimators,params_normalize_type,params_params_decision_threshold,params_params_feature_fraction,params_params_resampling,params_params_sample_rows,params_params_scale_pos_weight,params_rate_drop,params_sample_type,params_skip_drop,params_subsample,user_attrs_acc_test,user_attrs_acc_val,user_attrs_decision_threshold,user_attrs_f1_test,user_attrs_f1_val,user_attrs_feature_fraction,user_attrs_pr_auc_test,user_attrs_pr_auc_val,user_attrs_prec_test,user_attrs_prec_val,user_attrs_rec_test,user_attrs_rec_val,user_attrs_resampling_strategy,user_attrs_roc_auc_test,user_attrs_roc_auc_val,user_attrs_sample_rows,state
1896,0.6712328767123288,2025-09-23 22:37:50.006944,2025-09-23 22:38:14.849483,0 days 00:00:24.842539,0.0010945856159112,dart,0.35018258900678956,3.1196005431574987,depthwise,0.0014446604257389447,0.005611064931411647,3,8,0.18891518863056558,600,forest,0.32181106702108625,0.8396241116957253,undersample,0.9409472122174873,0.5073329323578497,0.2252447226301885,weighted,0.7485653187487298,0.849122468674899,0.7896407001740199,0.7936117936117936,0.32181106702108625,0.66934835076428,0.6712328767123288,0.8396241116957253,0.7945334025938103,0.7862222833086437,0.5364972917204024,0.542292490118577,0.8896492728828058,0.8806161745827985,undersample,0.9134224486029958,0.9109765339626921,0.9409472122174873,COMPLETE
1897,0.7079646017699115,2025-09-23 22:38:14.986748,2025-09-23 22:38:34.940333,0 days 00:00:19.953585,0.38475531276800295,dart,0.5773642608401645,0.5628235266402719,lossguide,0.4697964161819858,0.03934587449073092,1,11,25.618251677799908,500,forest,0.589873980105569,0.9004453980425866,none,0.9176387885888916,4.790318161125626,0.14068329227243204,weighted,0.6536416035191283,0.8209985252601406,0.8288463507011977,0.831081081081081,0.589873980105569,0.7068723702664796,0.7079646017699115,0.9004453980425866,0.821265237042961,0.8131301654008601,0.5989304812834224,0.6036824630244492,0.8622754491017964,0.8557980316645272,none,0.9246928313049201,0.922763594229657,0.9176387885888916,COMPLETE
1898,0.6499624906226557,2025-09-23 22:38:35.077687,2025-09-23 22:38:35.898337,0 days 00:00:00.820650,0.0005300036618183033,gbtree,0.849059773741636,0.9752505342958454,depthwise,0.0018731056862074697,0.01762107780364924,8,3,0.8534976769393585,600,,0.38359604872600916,0.6500258828327834,undersample,0.9548039303854416,1.225323522602295,,,,0.7873575084990447,0.752379977479783,0.7611588861588862,0.38359604872600916,0.6412576004745663,0.6499624906226557,0.6500258828327834,0.7985269719422124,0.7896365029839835,0.49080590238365496,0.5004621072088724,0.9247219846022241,0.926829268292683,undersample,0.911946854316052,0.9113365138708439,0.9548039303854416,COMPLETE
1899,0.6499924207973321,2025-09-23 22:38:36.038097,2025-09-23 22:38:39.562788,0 days 00:00:03.524691,0.0008371402422050616,dart,0.6104286982824045,8.839749254615617,depthwise,34.44393121457478,0.011310767222938846,4,10,2.6513503713976183,200,forest,0.6550885527947027,0.8720699180702116,undersample,0.8724033922427834,3.2543669013820695,0.19949348783681733,weighted,0.8964598282954127,0.9512871021136229,0.7549390930494421,0.7636158886158886,0.6550885527947027,0.6430062630480167,0.6499924207973321,0.8720699180702116,0.7726898079964184,0.7648174316026224,0.4935897435897436,0.5032863849765258,0.9221556886227545,0.9174154899443732,undersample,0.908372481635725,0.9063337346290191,0.8724033922427834,COMPLETE
1900,0.676362226100446,2025-09-23 22:38:39.701536,2025-09-23 22:38:43.893707,0 days 00:00:04.192171,0.0001768950457014494,dart,0.2887952425302086,2.0812669455301904,lossguide,0.00020537683014100992,0.14655101872408602,2,10,2.6664411128670182,200,forest,0.6221783058136636,0.9059820105251174,none,0.9854445544331868,3.439298146789122,0.13829063952046322,weighted,0.8867777140400189,0.8186908477588294,0.8246494011669567,0.8291359541359541,0.6221783058136636,0.6684730017418231,0.676362226100446,0.9059820105251174,0.7390908867637167,0.7415374238662757,0.6104630611523506,0.6184397163120567,0.7386655260906758,0.7462558836114677,none,0.8911618484007819,0.8960343014814888,0.9854445544331868,COMPLETE
1901,0.7096027767065175,2025-09-23 22:38:44.031903,2025-09-23 22:39:02.757629,0 days 00:00:18.725726,0.0012253524000983777,dart,0.5333205903594394,3.5685073374543834,lossguide,0.012189417759704103,0.028736086407733067,1,8,3.878003996115019,500,forest,0.6786680141319329,0.9487088082270813,none,0.8671768993701391,4.780948211479316,0.2492645070050133,weighted,0.6361323904916361,0.6993009496746734,0.8517760262053434,0.8458230958230958,0.6786680141319329,0.720786733513305,0.7096027767065175,0.9487088082270813,0.8266294576183257,0.8188011128216584,0.65625,0.6458406458406458,0.7994011976047904,0.787334189131365,none,0.9267610750009295,0.9245722463811553,0.8671768993701391,COMPLETE
1902,0.7163147792706334,2025-09-23 22:39:02.899765,2025-09-23 22:39:04.503200,0 days 00:00:01.603435,0.0008030007247614707,gbtree,0.7399362521449503,7.42197507054337,depthwise,0.01841302959716129,0.018560574354463226,3,12,3.076469403731891,800,,0.6687818553928491,0.9864374514594483,none,0.8911435954487525,4.670694587703432,,,,0.4488426789289704,0.8488074521445389,0.8486895986895987,0.6687818553928491,0.7177527231033823,0.7163147792706334,0.9864374514594483,0.8252153221711527,0.8183533090723486,0.6487046632124353,0.6494953010790114,0.8032506415739948,0.7984595635430038,none,0.9269100359751113,0.9248182120178297,0.8911435954487525,COMPLETE
1903,0.6845441248171623,2025-09-23 22:39:04.642673,2025-09-23 22:39:06.082550,0 days 00:00:01.439877,1.5006103691214632,gbtree,0.5070613692123903,1.115254551756733,lossguide,0.0001558021620516184,0.016882041727441097,9,8,0.44259824289774125,300,,0.44531730883357656,0.9946205314222094,none,0.6879194703169852,0.7714198581616091,,,,0.46432584182912523,0.8688709182106664,0.8675266175266175,0.44531730883357656,0.6905049528871708,0.6845441248171623,0.9946205314222094,0.8209271606221598,0.8159085567403166,0.7934480843975569,0.7954674220963173,0.6112061591103507,0.6007702182284981,none,0.923465428563831,0.9220353424663372,0.6879194703169852,COMPLETE
1904,0.6953471196454948,2025-09-23 22:39:06.222255,2025-09-23 22:39:31.173855,0 days 00:00:24.951600,0.00022203684837008626,dart,0.8875615989963315,6.095234413265717,depthwise,0.00019360347245394184,0.025276311645985317,1,11,0.21689024222901787,600,forest,0.6523653100083957,0.9610003743095696,undersample,0.9073410793583215,1.3794125976108227,0.15964948001549747,weighted,0.7680925268318933,0.44250707454503646,0.8317125601392159,0.831081081081081,0.6523653100083957,0.7020659659296846,0.6953471196454948,0.9610003743095696,0.7995640275365944,0.7871258775510084,0.6091194968553459,0.6115621955180254,0.8284858853721129,0.8057338468121523,undersample,0.9182014597024303,0.9136122502461239,0.9073410793583215,COMPLETE
1905,0.7019607843137254,2025-09-23 22:39:31.316413,2025-09-23 22:39:32.638273,0 days 00:00:01.321860,0.0028921177157478807,gbtree,0.8658194969057935,9.056588883661234,depthwise,0.00019596434088718024,0.009497598800008913,3,8,0.608973465854811,600,,0.6558352792059486,0.8730323018900401,none,0.9365953391417493,2.514069599049921,,,,0.4866063574457734,0.8643668748080663,0.85995085995086,0.6558352792059486,0.7110141766630316,0.7019607843137254,0.8730323018900401,0.8063788978268245,0.7932352639660905,0.7254116599910992,0.715046604527297,0.6971770744225834,0.6893453145057766,none,0.9206875769195216,0.9155581226041528,0.9365953391417493,COMPLETE
1906,0.7085220255249074,2025-09-23 22:39:32.775865,2025-09-23 22:39:34.962132,0 days 00:00:02.186267,1.6036087409538637,gbtree,0.690772134186422,4.119725625296551,lossguide,0.00028368796794355465,0.005126333957075494,4,9,0.194581123009702,400,,0.32221208658699485,0.9715522753237251,none,0.9546858654176231,0.8949057886558486,,,,0.7258429649391341,0.8551540587572934,0.855036855036855,0.32221208658699485,0.7102191275855008,0.7085220255249074,0.9715522753237251,0.8131587012873178,0.8071374114216215,0.681335952848723,0.682665608885363,0.7416595380667237,0.7364142062473257,none,0.9185696603793395,0.9164573957746887,0.9546858654176231,COMPLETE
1907,0.7103128621089224,2025-09-23 22:39:35.101665,2025-09-23 22:39:38.085241,0 days 00:00:02.983576,0.0012825594601309678,gbtree,0.877119139545841,4.066579984160014,lossguide,0.0001279115045761248,0.006944597592800874,9,9,0.11778177158880708,300,,0.5041821565600055,0.9647514058477864,none,0.8806634478204685,2.1544755034171006,,,,0.6969843986445403,0.8488074521445389,0.8464373464373465,0.5041821565600055,0.7154690811019071,0.7103128621089224,0.9647514058477864,0.8173932407622496,0.810197470596561,0.650893796004206,0.6473072861668426,0.7942686056458511,0.7869062901155327,none,0.9217140147296387,0.9198413739019144,0.8806634478204685,COMPLETE
1908,0.7111878718096335,2025-09-23 22:39:38.223810,2025-09-23 22:40:12.013681,0 days 00:00:33.789871,0.008848868163063892,dart,0.2552350707424579,2.381615006729607,depthwise,0.00016301786473198632,0.012593463049821448,5,5,0.1128989520414417,700,forest,0.4918362621471852,0.9893085415354175,none,0.9391725280313422,2.044814383359635,0.09279111994412642,weighted,0.7268864534583477,0.6123979438665947,0.8481932644078206,0.8459254709254709,0.4918362621471852,0.7181144269150351,0.7111878718096335,0.9893085415354175,0.8198887044448384,0.8134340084382752,0.6462538487854943,0.6447459986082116,0.8079555175363559,0.7928968763371844,none,0.9241942034380977,0.9227516745558207,0.9391725280313422,COMPLETE
1909,0.6714601769911505,2025-09-23 22:40:12.152709,2025-09-23 22:40:15.642331,0 days 00:00:03.489622,0.23014283466857172,dart,0.9866021922379274,8.623893022146234,depthwise,0.07736477340172417,0.03928036913651993,10,8,1.8116960828513533,200,forest,0.47272051449163177,0.8799581028589378,none,0.8997618350542643,1.9286410547824364,0.036232098570304815,weighted,0.8593507089006142,0.3204183554287624,0.8154365851161839,0.8175675675675675,0.47272051449163177,0.6703236423477784,0.6714601769911505,0.8799581028589378,0.7379170232611274,0.7315472624689701,0.5854359629511339,0.5898931000971818,0.7840034217279727,0.7792041078305519,none,0.8964854189193561,0.8947319187617221,0.8997618350542643,COMPLETE
1910,0.6938571666389213,2025-09-23 22:40:15.780238,2025-09-23 22:40:29.120916,0 days 00:00:13.340678,0.003121065368689002,dart,0.267072475403611,4.511282719940035,lossguide,0.0012629223102761339,0.04402954080980747,5,10,2.8128729565995374,400,forest,0.6364809890551534,0.9287243346264886,oversample,0.8635888753937978,3.0967834740788045,0.17079211035052286,weighted,0.6322742081206852,0.8069037929202402,0.8058143105742656,0.8117321867321867,0.6364809890551534,0.6886591170195306,0.6938571666389213,0.9287243346264886,0.8224550184349372,0.8166218597282888,0.5587217043941411,0.5678474114441416,0.8973481608212147,0.8917415489944374,oversample,0.9259432861596721,0.9244961792838717,0.8635888753937978,COMPLETE
1911,0.6793425717048018,2025-09-23 22:40:29.260067,2025-09-23 22:41:07.574821,0 days 00:00:38.314754,0.007484973473371717,dart,0.6662660604541701,1.7009648179992982,lossguide,0.00012592743310252746,0.12106888742208738,5,11,10.24379693151471,700,forest,0.5963149649550428,0.983907917877691,oversample,0.781236501186158,4.466274688124082,0.2154819272287249,weighted,0.7520494643301074,0.6203433812172159,0.7913808987613881,0.7962735462735463,0.5963149649550428,0.6746487867177522,0.6793425717048018,0.983907917877691,0.8206972013792544,0.8137863746132964,0.5382068262862965,0.5448436288446628,0.9037639007698888,0.9020111253744116,oversample,0.9241002394541905,0.9214275254751357,0.781236501186158,COMPLETE
1912,0.6647653616800622,2025-09-23 22:41:07.714663,2025-09-23 22:42:18.892065,0 days 00:01:11.177402,0.004339288178118318,dart,0.5670499322493323,2.9748364287518423,lossguide,0.00048259730693481684,0.038104096101986826,5,10,0.12192177799005578,1000,forest,0.5874315390019202,0.9298709938665844,none,0.9897875399732812,0.9637867577855201,0.10543514572147311,weighted,0.719721864023083,0.7359243965622779,0.8694851059473846,0.8676289926289926,0.5874315390019202,0.6699456381050997,0.6647653616800622,0.9298709938665844,0.8296748928810653,0.8239952752578031,0.8485245901639344,0.843421052631579,0.553464499572284,0.5485665382969619,none,0.9287871572156453,0.9267634509632392,0.9897875399732812,COMPLETE
1913,0.6685419596812002,2025-09-23 22:42:19.029897,2025-09-23 22:42:19.615437,0 days 00:00:00.585540,0.5543986295271398,gbtree,0.8360691645370699,4.466530338738433,lossguide,0.06204555636084814,0.34469457115003554,7,8,1.3195320839360052,200,,0.35224223939663807,0.9847576338883338,undersample,0.8165535116415601,1.0992416082954943,,,,0.7874600112288435,0.7800184256321016,0.7828624078624079,0.35224223939663807,0.6663561558764167,0.6685419596812002,0.9847576338883338,0.8144706762935475,0.810170911685318,0.5230319278576652,0.5265878877400295,0.9178785286569717,0.9152759948652118,undersample,0.9226363870678391,0.9211575189504101,0.8165535116415601,COMPLETE
1914,0.7137375287797391,2025-09-23 22:42:19.753440,2025-09-23 22:42:33.202457,0 days 00:00:13.449017,0.00010078643487401251,dart,0.9771679350351768,5.163691058783259,lossguide,0.0002568456981503746,0.02796627117903498,0,9,0.7719600702614341,400,forest,0.6649910916663144,0.9188856123667164,none,0.747794668403496,4.4525415550876035,0.2679089537178612,weighted,0.7395783404738492,0.8401880011688958,0.8489098167673252,0.8472563472563472,0.6649910916663144,0.7181054239877769,0.7137375287797391,0.9188856123667164,0.8243527522770532,0.816508245615337,0.6487232574189096,0.6469565217391304,0.8041060735671514,0.7958921694480102,none,0.9257655172382036,0.9234505590067905,0.747794668403496,COMPLETE
1915,0.7163498098859316,2025-09-23 22:42:33.339737,2025-09-23 22:43:20.208717,0 days 00:00:46.868980,0.009606805047033248,dart,0.4426488833738907,3.7098327659033243,lossguide,0.00010870010128313505,0.04414805817117287,3,10,0.15843294088328547,800,forest,0.38069978260531656,0.9775039946768598,none,0.9593124385571303,1.3929325836454247,0.132382049082548,weighted,0.7691916477361659,0.471241019114064,0.8495240045040434,0.8472563472563472,0.38069978260531656,0.7228506787330317,0.7163498098859316,0.9775039946768598,0.8289365262071089,0.8236788809431679,0.6463250168577208,0.6445432774546699,0.8199315654405475,0.8061617458279846,none,0.9281985368901162,0.9267347170635084,0.9593124385571303,COMPLETE
1916,0.7116212338593975,2025-09-23 22:43:20.347494,2025-09-23 22:43:45.057591,0 days 00:00:24.710097,0.02502465501993795,dart,0.3046507291395044,2.571185473081231,depthwise,0.00027800681875903526,0.011539326405140701,3,5,0.1683947923111429,600,forest,0.3327957044951235,0.9383511917026257,none,0.9732727356641955,0.8742135230656086,0.11548172331853729,weighted,0.6390591566812978,0.7582459414181997,0.8591462790459617,0.855958230958231,0.3327957044951235,0.7187244480784954,0.7116212338593975,0.9383511917026257,0.8211347650073937,0.8137739388291356,0.6883320281910729,0.6829268292682927,0.7519247219846023,0.7428326914848096,none,0.9233868902140352,0.9220673010121299,0.9732727356641955,COMPLETE
1917,0.5376279349789284,2025-09-23 22:43:45.196357,2025-09-23 22:43:48.790785,0 days 00:00:03.594428,0.002076191925796582,dart,0.9000248746462909,8.783423202529491,lossguide,0.004296249934178699,0.021972269146156315,8,7,0.27273832700659095,200,forest,0.5975598412588528,0.9202405978704732,none,0.8892349989122073,0.6421476523217355,0.24199847065365412,weighted,0.8949229528344714,0.5451376527735627,0.8523902139420616,0.8427518427518428,0.5975598412588528,0.5733727810650887,0.5376279349789284,0.9202405978704732,0.8161153500398298,0.8080902529528003,0.9299424184261037,0.9065989847715736,0.4144568006843456,0.3821138211382114,none,0.92029692849148,0.9185669189203632,0.8892349989122073,COMPLETE
1918,0.7063474632110697,2025-09-23 22:43:48.932847,2025-09-23 22:43:50.157798,0 days 00:00:01.224951,0.019969703685374193,gbtree,0.20040587415628822,4.742227623959607,lossguide,0.00028675019502895425,0.02981353922291783,3,12,1.632801277240203,300,,0.6414491063869752,0.9044141650133493,none,0.8990447913255009,2.519277315094705,,,,0.7764910322108938,0.8638550516941345,0.8631244881244882,0.6414491063869752,0.7104919460165433,0.7063474632110697,0.9044141650133493,0.8128447020137026,0.8088352958980642,0.723404255319149,0.7256317689530686,0.69803250641574,0.6880616174582799,none,0.9212483102311438,0.9203914639703098,0.8990447913255009,COMPLETE
1919,0.7130573885222955,2025-09-23 22:43:50.294989,2025-09-23 22:45:01.425819,0 days 00:01:11.130830,0.0001922257376821791,dart,0.21209812647051962,1.9849393432009839,lossguide,0.0009914857312666565,0.15269501766518903,9,7,0.4643364208865326,1000,forest,0.5214777651187497,0.9364517206918647,none,0.8734891356545087,2.3167349139955493,0.10232700318639872,weighted,0.7851928109578328,0.755579242322496,0.8508547446002661,0.8530917280917281,0.5214777651187497,0.7138086819878217,0.7130573885222955,0.9364517206918647,0.8189291090723124,0.8144565573890172,0.6600072648020342,0.6692942942942943,0.7771599657827203,0.762943945228926,none,0.9218595222036461,0.920410236017028,0.8734891356545087,COMPLETE
1920,0.7168851496771669,2025-09-23 22:45:01.565472,2025-09-23 22:45:02.153861,0 days 00:00:00.588389,0.00018407697151897551,gbtree,0.8483524718155797,1.622101994079061,lossguide,0.0006844662951027481,0.41409397281983945,10,3,1.3456222399411875,200,,0.4221993347615944,0.8589868710108186,none,0.9337318926582547,1.532351593643476,,,,0.9956629148583671,0.8539256832838571,0.8518632268632269,0.4221993347615944,0.7223195174158397,0.7168851496771669,0.8589868710108186,0.8282055865621891,0.8206088323040173,0.6626204926811853,0.6604181687094448,0.7938408896492729,0.7839109970047069,none,0.9274566962735237,0.9255112517978122,0.9337318926582547,COMPLETE
1921,0.716816003334028,2025-09-23 22:45:02.292021,2025-09-23 22:45:03.365519,0 days 00:00:01.073498,0.08403932126066174,gbtree,0.4183137058776363,2.735348672434638,lossguide,0.003039746683848307,0.10146850865823047,8,7,0.1589876492973438,700,,0.3347947528492873,0.9900746414124545,none,0.6194839535432412,0.7859594266769797,,,,0.30478296972464824,0.8581226328180981,0.8608722358722358,0.3347947528492873,0.7145799011532126,0.716816003334028,0.9900746414124545,0.8141702939755416,0.8112799235380805,0.6890389197776012,0.6986190089358245,0.742087254063302,0.7359863072314934,none,0.921617489399769,0.9206641193114434,0.6194839535432412,COMPLETE
1922,0.6883206634416034,2025-09-23 22:45:03.505652,2025-09-23 22:45:04.194031,0 days 00:00:00.688379,0.005173698849321316,gbtree,0.6975440558566902,6.467994064097267,depthwise,0.0014519626829826461,0.07198715600332053,0,10,0.184665712904755,500,,0.664150637952312,0.7940052526384508,undersample,0.6956351608367629,1.960565315329674,,,,0.8974819686792143,0.813798751151602,0.8153153153153153,0.664150637952312,0.6912239008657274,0.6883206634416034,0.7940052526384508,0.7958204066653342,0.7849386855470014,0.5730368702504925,0.5772239930454941,0.8708297690333618,0.8523748395378691,undersample,0.9164796884114004,0.9127519895346414,0.6956351608367629,COMPLETE
1923,0.7151335311572701,2025-09-23 22:45:04.332855,2025-09-23 22:45:07.480900,0 days 00:00:03.148045,0.004429661454944384,gbtree,0.5611760381973773,0.7443673366382595,lossguide,0.08659003235805636,0.0603480843217889,3,12,0.6789118444239193,200,,0.6676926867492853,0.9587424884212804,none,0.7537764064681332,4.0919093845831185,,,,0.8151931870550481,0.8650834271675709,0.8624078624078624,0.6676926867492853,0.7212351945854484,0.7151335311572701,0.9587424884212804,0.8245674166217724,0.8169811517233525,0.7133891213389121,0.7085258294834104,0.7292557741659538,0.7218656397090286,none,0.9258719713810741,0.9229952504994314,0.7537764064681332,COMPLETE
1924,0.7219630906509835,2025-09-23 22:45:07.618643,2025-09-23 22:45:21.113336,0 days 00:00:13.494693,0.00046816387712218923,dart,0.4674692188288864,4.422957833467311,lossguide,0.007579938714893347,0.06122061493183422,2,11,0.6751426657702283,400,forest,0.6830015241531734,0.9457503068060006,none,0.9373720748005261,4.2072406140827985,0.16427272480767496,weighted,0.8071554343593287,0.8317253122308427,0.8591462790459617,0.8596437346437347,0.6830015241531734,0.7222446507872426,0.7219630906509835,0.9457503068060006,0.8274020388091,0.8228238720848247,0.683868501529052,0.6861989205859677,0.7651839178785287,0.7616602481814292,none,0.927543925932091,0.9257131664659612,0.9373720748005261,COMPLETE
1925,0.7111111111111111,2025-09-23 22:45:21.252624,2025-09-23 22:45:48.542495,0 days 00:00:27.289871,0.0013100416274172716,dart,0.5146753260542551,1.0074881101006503,depthwise,0.0001071661074420512,0.4971049281073058,6,8,0.2673344344577671,600,forest,0.4363180140994465,0.9287189929274002,oversample,0.993318471372548,0.6382000647039775,0.18815583102684533,weighted,0.7578229197588247,0.9436058278004049,0.8388780837342614,0.8402948402948403,0.4363180140994465,0.7099152230003686,0.7111111111111111,0.9287189929274002,0.8278362338531637,0.818225909356826,0.6237046632124352,0.6268364348677767,0.823781009409752,0.8215661103979461,oversample,0.9265045374963207,0.9234596859068053,0.993318471372548,COMPLETE
1926,0.7075928917609047,2025-09-23 22:45:48.680564,2025-09-23 22:47:12.434312,0 days 00:01:23.753748,0.0007798916818125431,dart,0.30402797694021433,0.795364621591379,lossguide,0.00011564010383275825,0.004157963641219809,5,10,0.14600321093717528,1000,forest,0.4339886474197924,0.9326113309499001,none,0.6573663855335692,2.3109834560731755,0.18281453949445658,weighted,0.8992355283393137,0.6891339753746288,0.8297676323062749,0.8332309582309583,0.4339886474197924,0.7057158025128296,0.7075928917609047,0.9326113309499001,0.8125959589146791,0.8047728172454373,0.6018714156353758,0.6094619666048238,0.8528656971770744,0.8433889602053916,none,0.9224692376594064,0.9206259418053884,0.6573663855335692,COMPLETE
