number,value,datetime_start,datetime_complete,duration,params_alpha,params_booster,params_colsample_bytree,params_gamma,params_grow_policy,params_lambda,params_learning_rate,params_max_delta_step,params_max_depth,params_min_child_weight,params_n_estimators,params_normalize_type,params_params_decision_threshold,params_params_feature_fraction,params_params_resampling,params_params_sample_rows,params_params_scale_pos_weight,params_rate_drop,params_sample_type,params_skip_drop,params_subsample,user_attrs_acc_test,user_attrs_acc_val,user_attrs_decision_threshold,user_attrs_f1_test,user_attrs_f1_val,user_attrs_feature_fraction,user_attrs_pr_auc_test,user_attrs_pr_auc_val,user_attrs_prec_test,user_attrs_prec_val,user_attrs_rec_test,user_attrs_rec_val,user_attrs_resampling_strategy,user_attrs_roc_auc_test,user_attrs_roc_auc_val,user_attrs_sample_rows,state
2360,0.6960690316395014,2025-09-24 00:45:34.583379,2025-09-24 00:45:38.214482,0 days 00:00:03.631103,0.00038581813674964396,gbtree,0.21863240293509933,0.8957364357504456,lossguide,0.014663861151805761,0.039727343392840224,5,9,0.7001848434571003,800,,0.6721216162285919,0.989322927777304,none,0.9606924095831386,1.992748744730031,,,,0.7435954681318253,0.8712253045347528,0.8701883701883701,0.6721216162285919,0.6996179560649475,0.6960690316395014,0.989322927777304,0.8278003264043525,0.8251153023834767,0.7918918918918919,0.7912806539509537,0.6266039349871685,0.6213093709884467,none,0.9276901528853014,0.9269113240183673,0.9606924095831386,COMPLETE
2361,0.7175056348610067,2025-09-24 00:45:38.361289,2025-09-24 00:45:39.406972,0 days 00:00:01.045683,0.00011872926675374857,gbtree,0.2625612316968492,5.41361941068372,lossguide,0.47031698817037876,0.27901302697405367,1,11,0.4615981231210621,1000,,0.5692068028578993,0.9787692614466148,none,0.9048987345897469,3.380487571840455,,,,0.6524091175572959,0.8429726686457161,0.846027846027846,0.5692068028578993,0.7143389199255121,0.7175056348610067,0.9787692614466148,0.8206076368926131,0.8190598669824621,0.6325857519788918,0.639437562772012,0.8203592814371258,0.8172871202396235,none,0.9248676359720722,0.9249079838608767,0.9048987345897469,COMPLETE
2362,0.6727772685609532,2025-09-24 00:45:39.554736,2025-09-24 00:45:46.534465,0 days 00:00:06.979729,0.0006826146184638611,dart,0.9512209951465369,4.7791371150936195,depthwise,0.07709504622163439,0.009971515716498871,6,9,16.62147383242928,300,forest,0.5635879024477471,0.8392780982388803,undersample,0.6862549998097063,0.513478978310727,0.11444218544356674,weighted,0.7614125199414361,0.8912911580673879,0.8595557375371071,0.8538083538083538,0.5635879024477471,0.6912691269126913,0.6727772685609532,0.8392780982388803,0.7853483915230525,0.7730822485347904,0.7293447293447294,0.7242229896398619,0.6569717707442259,0.6281557552417629,undersample,0.9100218157606007,0.9051006242166197,0.6862549998097063,COMPLETE
2363,0.7123287671232876,2025-09-24 00:45:46.677689,2025-09-24 00:45:49.602858,0 days 00:00:02.925169,0.0038382119850399977,gbtree,0.606982399944589,3.2300257751190036,lossguide,2.7022786778376697,0.013995250191404764,2,9,0.21831114432266963,500,,0.6883868293325711,0.9922516640651481,none,0.9779831949915484,2.444132185447422,,,,0.6177381382518532,0.8728631384993346,0.8731572481572482,0.6883868293325711,0.7144827586206897,0.7123287671232876,0.9922516640651481,0.8271048849222331,0.8198865103373383,0.7723658051689861,0.7786802030456853,0.6646706586826348,0.6563970902866924,none,0.9272972021238104,0.9249048455892628,0.9779831949915484,COMPLETE
2364,0.7163878250352751,2025-09-24 00:45:49.746463,2025-09-24 00:46:31.530141,0 days 00:00:41.783678,0.03679627927139339,dart,0.22267450921136375,0.12634100871296405,lossguide,0.007516016121872064,0.09541315983969875,9,10,0.1685556595059007,700,forest,0.4894713055691147,0.9723613709324713,none,0.9063312730247007,2.297605260994758,0.2504587432343529,weighted,0.8970977604810094,0.4344937653054818,0.8547446002661481,0.855958230958231,0.4894713055691147,0.7180607987283926,0.7163878250352751,0.9723613709324713,0.8194549432202405,0.8138270861278143,0.6705009276437848,0.6772103658536586,0.7728828058169376,0.7603765511339324,none,0.9227665840244075,0.921399338613576,0.9063312730247007,COMPLETE
2365,0.6887755102040817,2025-09-24 00:46:31.676167,2025-09-24 00:47:21.297812,0 days 00:00:49.621645,0.060222105695519966,dart,0.26715679732765557,0.8285393609087345,lossguide,0.0002672135187208666,0.002528480193952227,7,9,0.23917785016046803,800,tree,0.4338385590389485,0.9809824920147721,none,0.865289916132433,1.9167606882629586,0.16228469524024441,weighted,0.4771690195882335,0.5539187420164983,0.8360118742962432,0.8376330876330876,0.4338385590389485,0.6912104857363146,0.6887755102040817,0.9809824920147721,0.7795808044052888,0.7715264750610639,0.6291228070175439,0.6361000362450163,0.7668947818648417,0.7509627727856226,none,0.908587030334049,0.9077905548619687,0.865289916132433,COMPLETE
2366,0.652384675527756,2025-09-24 00:47:21.445837,2025-09-24 00:47:22.341978,0 days 00:00:00.896141,0.0028875844481439823,gbtree,0.3376105621561451,0.9093618780110058,depthwise,0.00018941951104497486,0.3534013121529916,3,8,0.17155114570638427,300,,0.4811002458793079,0.9638159067687362,undersample,0.9428977579374497,3.9514233370317053,,,,0.5260646806290497,0.7707032449585424,0.7724201474201474,0.4811002458793079,0.6492326965236455,0.652384675527756,0.9638159067687362,0.7773292765724502,0.7706437422506797,0.5121047430830039,0.5140463282405126,0.886655260906758,0.8925973470261018,undersample,0.9046703294489514,0.9023142421042383,0.9428977579374497,COMPLETE
2367,0.650663485910243,2025-09-24 00:47:22.487678,2025-09-24 00:47:24.757997,0 days 00:00:02.270319,0.000491428558712913,gbtree,0.6309763113669995,2.5413986028625732,lossguide,1.4828718839836061,0.008084032156850635,4,9,0.17372595995669385,200,,0.6790855379926136,0.891981704334069,undersample,0.9435243067575199,4.531086255571609,,,,0.9091155640042798,0.7544272699355102,0.7601351351351351,0.6790855379926136,0.6461129960171117,0.650663485910243,0.891981704334069,0.7924339335261352,0.785632153383917,0.4931321774375141,0.4993135011441648,0.9366980325064157,0.9336756525459992,undersample,0.9153253559781642,0.9138775061762049,0.9435243067575199,COMPLETE
2368,0.0,2025-09-24 00:47:24.901424,2025-09-24 00:47:30.069864,0 days 00:00:05.168440,0.00012722244541619597,gbtree,0.3475207844659856,0.6424860186772492,lossguide,0.0006767238438383568,0.000399599762973347,3,10,0.7039130449531227,300,,0.6693229631577811,0.9677939002269754,none,0.9581550618808972,4.284183374330553,,,,0.8769518551819201,0.7606715119254785,0.7607493857493858,0.6693229631577811,0.0,0.0,0.9677939002269754,0.7775226417091283,0.7713795147762261,0.0,0.0,0.0,0.0,none,0.9096944527232519,0.9092807444233633,0.9581550618808972,COMPLETE
2369,0.6588163327725952,2025-09-24 00:47:30.217642,2025-09-24 00:48:45.477340,0 days 00:01:15.259698,0.001285763727070214,dart,0.8562716845370346,6.886581918572684,depthwise,0.0006733100795964359,0.2512510640462886,3,10,1.2493538357789158,1000,forest,0.6173822611554433,0.9858870163461987,oversample,0.966370944140054,4.649111204893477,0.22557653750909776,weighted,0.6758104028308372,0.4421907116747027,0.7688606817483877,0.7716011466011466,0.6173822611554433,0.6575674855929633,0.6588163327725952,0.9858870163461987,0.8103064513248178,0.8020609648991948,0.5093984962406015,0.5126130414088529,0.9272882805816938,0.9216944801026957,oversample,0.9199647593330553,0.9163751960915908,0.966370944140054,COMPLETE
2370,0.6758684149988498,2025-09-24 00:48:45.622640,2025-09-24 00:48:51.325193,0 days 00:00:05.702553,0.00016494892195865435,dart,0.49862305566895426,2.33328220884662,lossguide,0.014345276661376105,0.008605138521672906,1,10,0.6418927327910807,200,forest,0.6912665537589462,0.9584303024137392,none,0.9982010630792421,3.6232424713743523,0.14560498661417498,weighted,0.6611879846940018,0.7177477443444192,0.8576108097041663,0.8557534807534808,0.6912665537589462,0.6808901124111034,0.6758684149988498,0.9584303024137392,0.770902453708276,0.7591173254538954,0.7342899554675903,0.7308457711442786,0.6347305389221557,0.6285836542575952,none,0.9111747667937669,0.9087292147808332,0.9982010630792421,COMPLETE
2371,0.7041513399894903,2025-09-24 00:48:51.470810,2025-09-24 00:48:52.446262,0 days 00:00:00.975452,0.0017157877335217987,gbtree,0.9921537913160746,0.8268985738797584,depthwise,0.00010161260457795065,0.02643747244000428,10,7,1.6899583203076984,300,,0.3781417368835902,0.8097769443286935,oversample,0.9618758633883533,0.6447574036650822,,,,0.9784040791727577,0.8245470365441704,0.827088452088452,0.3781417368835902,0.7023271969433831,0.7041513399894903,0.8097769443286935,0.8267513893383891,0.8207971030109703,0.5912280701754385,0.5960854092526691,0.864841745081266,0.8600770218228498,oversample,0.9274060737168031,0.9249455855372781,0.9618758633883533,COMPLETE
2372,0.7111111111111111,2025-09-24 00:48:52.594571,2025-09-24 00:49:12.625843,0 days 00:00:20.031272,0.00034288101090529827,dart,0.4779766867234251,3.612656224236025,depthwise,0.00015668216380245855,0.008727664913462458,1,11,1.2300650690477697,500,forest,0.6272621926989913,0.9594251986985839,none,0.9408849842142816,3.552423622045719,0.04814381319830265,weighted,0.7270627256074982,0.3709246753432977,0.8515712969597707,0.8482800982800983,0.6272621926989913,0.7186651144741948,0.7111111111111111,0.9594251986985839,0.8143897546304097,0.8082439035960285,0.6576704545454546,0.6530612244897959,0.7921300256629598,0.7804878048780488,none,0.9230384320464555,0.9217905284889705,0.9408849842142816,COMPLETE
2373,0.7167336577110218,2025-09-24 00:49:12.769284,2025-09-24 00:49:13.988258,0 days 00:00:01.218974,0.0014121794448224113,gbtree,0.21080598230989028,4.934539607459593,lossguide,0.00013012004750127912,0.04694222144361682,4,10,0.1885011407908378,200,,0.6925493321446085,0.9385852978135837,none,0.9396028268300619,3.715423301263185,,,,0.8027897920039585,0.8619101238611936,0.862919737919738,0.6925493321446085,0.7161792552072376,0.7167336577110218,0.9385852978135837,0.8195514227030757,0.8129612340564494,0.7047619047619048,0.7087866108786611,0.7279726261762189,0.7248609328198545,none,0.9251680041497258,0.9237708354603041,0.9396028268300619,COMPLETE
2374,0.7102225886232482,2025-09-24 00:49:14.136422,2025-09-24 00:49:16.342013,0 days 00:00:02.205591,0.0007944178269891983,gbtree,0.384233271329132,0.13575642396047405,depthwise,0.033907548581388926,0.05028105049462519,2,11,4.61587425661626,800,,0.5917556979311179,0.9940255672747403,none,0.7305115891907314,3.2760576517912114,,,,0.7944992924179155,0.8534138601699253,0.8560606060606061,0.5917556979311179,0.7063166529942576,0.7102225886232482,0.9940255672747403,0.8109761363102563,0.8045759884638977,0.6784869976359338,0.685089463220676,0.7365269461077845,0.7372700042789901,none,0.9184522989317518,0.9173744332900482,0.7305115891907314,COMPLETE
2375,0.6537556561085973,2025-09-24 00:49:16.486406,2025-09-24 00:49:58.246309,0 days 00:00:41.759903,8.80607747977274,dart,0.288239650381401,7.356796156896131,lossguide,0.00033025280547324654,0.04539975793901892,10,5,0.23786318273816145,800,tree,0.3534825601732574,0.7356299889142197,none,0.5298750017085644,1.1755999154409826,0.11714364765678098,uniform,0.6408258028003498,0.9768466036153824,0.8053024874603337,0.8041564291564292,0.3534825601732574,0.6574207492795389,0.6537556561085973,0.7356299889142197,0.7169172495342028,0.7057313085528834,0.5678282514001245,0.5664993726474279,0.7805816937553465,0.772785622593068,none,0.8822535159221899,0.8835565335446398,0.5298750017085644,COMPLETE
2376,0.7029528426619657,2025-09-24 00:49:58.394060,2025-09-24 00:50:36.033708,0 days 00:00:37.639648,0.0001742616181253942,dart,0.991583087191531,3.442838497245117,depthwise,0.0012128127746202908,0.43570746886605055,4,12,0.3081318062420356,700,forest,0.6459514809775232,0.9636765150851143,none,0.9971312924042592,2.6980549353343837,0.11208904806960415,weighted,0.7919587637702076,0.3337286089229753,0.8579179035725253,0.861998361998362,0.6459514809775232,0.6983920034767492,0.7029528426619657,0.9636765150851143,0.8040724887464712,0.802426723553735,0.7098056537102474,0.724670604270786,0.6873396065012831,0.6824989302524604,none,0.9165840416749982,0.9174088391118703,0.9971312924042592,COMPLETE
2377,0.7087257863870624,2025-09-24 00:50:36.178998,2025-09-24 00:50:45.978525,0 days 00:00:09.799527,0.00012909615736702383,dart,0.4224594746011314,1.9747569960904412,lossguide,0.00016153114608230085,0.03770545713657439,0,12,3.5995546291016574,300,forest,0.5553641271387296,0.9915152771965826,none,0.8792516938093001,4.945373850346882,0.0868106308418663,weighted,0.6251991985265624,0.6995338936765435,0.8274132459821886,0.8322072072072072,0.5553641271387296,0.7043142756927394,0.7087257863870624,0.9915152771965826,0.8252785884696263,0.8193056329466317,0.5969084423305588,0.6060790273556231,0.8588537211291702,0.8532306375695335,none,0.9262118533565546,0.9247337090161161,0.8792516938093001,COMPLETE
2378,0.7146047342563644,2025-09-24 00:50:46.122399,2025-09-24 00:50:47.107372,0 days 00:00:00.984973,0.004795458831370106,gbtree,0.7302702988411822,3.3249333043347047,lossguide,0.001000960316674548,0.023463146122284197,5,6,0.4656049020709379,200,,0.4922295730153483,0.9320781748107916,none,0.9836413443798007,1.3043452728739668,,,,0.6583167677343303,0.8669259903777254,0.8691646191646192,0.4922295730153483,0.7114957833999113,0.7146047342563644,0.9320781748107916,0.8212806588976123,0.8147104440631745,0.7393911439114391,0.7473143390938813,0.6856287425149701,0.6846384253316218,none,0.9237818842964627,0.9219355511873117,0.9836413443798007,COMPLETE
2379,0.700886607559496,2025-09-24 00:50:47.257086,2025-09-24 00:51:13.565688,0 days 00:00:26.308602,0.00020462616280175517,dart,0.9438732977813075,7.932323488168563,depthwise,0.00012735427441920623,0.3905270589997055,5,12,0.7599224085401128,600,forest,0.6817517683814026,0.9955496005992162,none,0.9342927911515418,2.311318095424155,0.19952964653553054,weighted,0.545857379545139,0.39763525459924814,0.8686661889650936,0.8687551187551188,0.6817517683814026,0.702389236836001,0.700886607559496,0.9955496005992162,0.8129003840192461,0.8036419301882172,0.7673593512417638,0.7706516162134428,0.6475620188195038,0.6427043217800599,none,0.9207162409709677,0.917517411793118,0.9342927911515418,COMPLETE
2380,0.6782069970845481,2025-09-24 00:51:13.710747,2025-09-24 00:51:26.533947,0 days 00:00:12.823200,0.0002920177937155199,dart,0.6298844095350972,2.6882199691919704,depthwise,0.00044096544169519916,0.06550470750656939,1,11,0.5321974112818875,400,forest,0.6184985734296542,0.7830406287210174,oversample,0.9289917702591428,1.6542560663169503,0.25757653236971945,weighted,0.7678644662359506,0.5923745173985158,0.8153342204933974,0.8192055692055692,0.6184985734296542,0.6730699528814788,0.6782069970845481,0.7830406287210174,0.7489392425317141,0.7462002431905037,0.5839622641509434,0.5906061567756268,0.7942686056458511,0.7963200684638425,oversample,0.8986109043807535,0.8996605023526384,0.9289917702591428,COMPLETE
2381,0.7024808138497234,2025-09-24 00:51:26.679736,2025-09-24 00:51:30.302898,0 days 00:00:03.623162,0.00019663553201151805,dart,0.9605554558400163,9.730244616452588,depthwise,0.0046682427567291416,0.2278501610695016,4,11,5.956670450110797,200,forest,0.5891181824482961,0.9348255290083978,none,0.9625540755083857,4.394303218773477,0.14752487758538635,weighted,0.6967000395738616,0.49314097667922596,0.8289487153239841,0.8293407043407044,0.5891181824482961,0.7044047408455687,0.7024808138497234,0.9348255290083978,0.8220594682547604,0.8143841837221574,0.600603318250377,0.6025719534598898,0.8515825491873396,0.8421052631578947,none,0.9253212532199571,0.9224317723915822,0.9625540755083857,COMPLETE
2382,0.7124242980363369,2025-09-24 00:51:30.447015,2025-09-24 00:52:05.469618,0 days 00:00:35.022603,0.001338215626384597,dart,0.8370442891783609,6.663300139706124,depthwise,0.0020032761548015917,0.0782605783593468,3,11,0.18036384854441426,700,tree,0.6040266386377926,0.9824797225797867,none,0.9976368899842672,4.769111255259643,0.019126427630919984,uniform,0.41916273112300045,0.5936555626461173,0.8362166035418159,0.8395782145782146,0.6040266386377926,0.7091966557615412,0.7124242980363369,0.9824797225797867,0.8275635816810347,0.8188136840159784,0.6166245259165614,0.6237146529562982,0.8344739093242087,0.8305519897304237,none,0.9280200484894445,0.9242149728723771,0.9976368899842672,COMPLETE
2383,0.6957110609480812,2025-09-24 00:52:05.614417,2025-09-24 00:52:07.722392,0 days 00:00:02.107975,0.3593546159239367,gbtree,0.40507012904900014,1.6244135844310923,lossguide,0.005792666924307096,0.03935345897787263,2,8,0.1229741506343844,400,,0.696468609131844,0.8181244417000059,none,0.8736091075041365,2.7336272635779046,,,,0.7602371536994007,0.8656976149042891,0.861998361998362,0.696468609131844,0.7067501117568171,0.6957110609480812,0.8181244417000059,0.8064050360547845,0.7971994624726193,0.7401685393258427,0.7362637362637363,0.676218990590248,0.6593923833975182,none,0.9209305306567785,0.9167506082344676,0.8736091075041365,COMPLETE
2384,0.7027908662558898,2025-09-24 00:52:07.867773,2025-09-24 00:52:53.419042,0 days 00:00:45.551269,0.0001884748623657319,dart,0.28662534712191895,2.6646615364990525,lossguide,0.006355565099663746,0.038399804778318516,0,7,0.19043614761065691,800,forest,0.5413478352226542,0.7169717696622495,none,0.8634114664870047,3.3463114738352537,0.1052767796598933,weighted,0.4849271720165226,0.8152826571086261,0.8307912785341386,0.8321048321048321,0.5413478352226542,0.7024302430243025,0.7027908662558898,0.7169717696622495,0.8169861649977198,0.8086823425059577,0.606465651227852,0.6095567431625275,0.8344739093242087,0.8296961916987591,none,0.9208778359999537,0.9183443895506036,0.8634114664870047,COMPLETE
2385,0.6967741935483871,2025-09-24 00:52:53.562042,2025-09-24 00:52:54.740847,0 days 00:00:01.178805,0.00014345789281193863,gbtree,0.8100857079823374,0.6709231066034843,lossguide,0.0001025091822172518,0.293028333281237,9,8,0.17508940330385356,300,,0.4402238247784874,0.8733000394204306,none,0.9555854826900859,0.8738608450299726,,,,0.8353182666484305,0.8627290408434845,0.8604627354627354,0.4402238247784874,0.7025948103792415,0.6967741935483871,0.8733000394204306,0.804608460613208,0.8025774763360831,0.72961768770152,0.7256719184430028,0.6775021385799829,0.6700898587933247,none,0.9164614999771493,0.9164572518172752,0.9555854826900859,COMPLETE
2386,0.6470239857862008,2025-09-24 00:52:54.886387,2025-09-24 00:52:55.680444,0 days 00:00:00.794057,0.01761525578348318,gbtree,0.5478168695127277,2.6422986991263135,lossguide,73.73057903578392,0.13781748379600867,9,7,0.21939241935703632,200,,0.650049367140292,0.5047405202342965,oversample,0.9386561853130821,4.30859745275516,,,,0.5441697008748495,0.7521752482342102,0.7559377559377559,0.650049367140292,0.6438134471090187,0.6470239857862008,0.5047405202342965,0.7956347655254123,0.7932619298476825,0.49069298048889887,0.494679646819108,0.9358426005132592,0.9349593495934959,oversample,0.9127607579696135,0.9118660180291114,0.9386561853130821,COMPLETE
2387,0.7074067588863596,2025-09-24 00:52:55.827833,2025-09-24 00:52:57.661047,0 days 00:00:01.833214,0.0001660902070959678,gbtree,0.6592804359082244,4.198124759212929,lossguide,0.004778559328696064,0.04269995793729376,3,10,0.7966991095054422,200,,0.550964200953176,0.9330414632266371,none,0.9947349373340952,4.907420190558268,,,,0.5987632062611077,0.8241375780530249,0.8289312039312039,0.550964200953176,0.7021497919556172,0.7074067588863596,0.9330414632266371,0.8275355110034666,0.8213816263753055,0.5903790087463557,0.5986959098992294,0.8661248930710008,0.8643560119811724,none,0.9272330821372423,0.9255152826053895,0.9947349373340952,COMPLETE
2388,0.7165095373821531,2025-09-24 00:52:57.804751,2025-09-24 00:52:59.762337,0 days 00:00:01.957586,0.00013379606936601339,gbtree,0.4574575229803407,3.428033388915961,lossguide,0.007629446436982992,0.026616559174413735,3,7,1.0700499131250643,800,,0.681371601603734,0.9218316105252509,none,0.8697032586179712,3.1156689442556025,,,,0.7740933026498228,0.8678472719828028,0.8676289926289926,0.681371601603734,0.7197742565660951,0.7165095373821531,0.9218316105252509,0.8197959188788746,0.8142221094997704,0.7307183781401498,0.7347122302158273,0.7091531223267751,0.6991869918699187,none,0.9221723805402633,0.9219246967983354,0.8697032586179712,COMPLETE
2389,0.689745264532985,2025-09-24 00:52:59.909368,2025-09-24 00:53:02.290246,0 days 00:00:02.380878,0.0048515909875792565,gbtree,0.6454480589758811,4.485892652519035,lossguide,2.221536222195215,0.02417977219230968,1,7,0.5701014073720452,700,,0.6358134466579174,0.9399448472313359,oversample,0.9222910891406164,3.628227360937426,,,,0.7254691050368209,0.8021291841539564,0.8054873054873055,0.6358134466579174,0.6870649182451029,0.689745264532985,0.9399448472313359,0.827690146888354,0.8187717577617692,0.5527481114873665,0.5576973857935041,0.9076133447390933,0.9037227214377407,oversample,0.9272939212986451,0.9251215878710006,0.9222910891406164,COMPLETE
2390,0.7043584806581481,2025-09-24 00:53:02.436654,2025-09-24 00:53:32.533934,0 days 00:00:30.097280,0.02329327363833528,dart,0.25994859890169736,0.8178030740041371,lossguide,0.0001741560754356853,0.09403656851914965,6,10,0.22691109616681665,600,forest,0.4566323557643016,0.928356000280983,oversample,0.8686533826890065,1.3884745213287684,0.19521064542727484,weighted,0.7974606108242502,0.5014707425588937,0.8234210256935203,0.827088452088452,0.4566323557643016,0.7004688313943392,0.7043584806581481,0.928356000280983,0.8239036115972275,0.8186030498166903,0.5895936860567086,0.5959715639810427,0.8627031650983746,0.8609328198545143,oversample,0.9253824377313775,0.9230341765840366,0.8686533826890065,COMPLETE
