number,value,datetime_start,datetime_complete,duration,params_alpha,params_booster,params_colsample_bytree,params_gamma,params_grow_policy,params_lambda,params_learning_rate,params_max_delta_step,params_max_depth,params_min_child_weight,params_n_estimators,params_normalize_type,params_params_decision_threshold,params_params_feature_fraction,params_params_resampling,params_params_sample_rows,params_params_scale_pos_weight,params_rate_drop,params_sample_type,params_skip_drop,params_subsample,user_attrs_acc_test,user_attrs_acc_val,user_attrs_decision_threshold,user_attrs_f1_test,user_attrs_f1_val,user_attrs_feature_fraction,user_attrs_pr_auc_test,user_attrs_pr_auc_val,user_attrs_prec_test,user_attrs_prec_val,user_attrs_rec_test,user_attrs_rec_val,user_attrs_resampling_strategy,user_attrs_roc_auc_test,user_attrs_roc_auc_val,user_attrs_sample_rows,state
1496,0.6157908634803274,2025-09-23 18:36:40.253864,2025-09-23 18:36:41.407016,0 days 00:00:01.153152,0.46746987882341945,gbtree,0.2173580018656553,0.8769643712580841,lossguide,0.00016176904857554818,0.008605985864366953,7,8,4.528565658950223,400,,0.39848337427990177,0.8814920585520319,none,0.6908938032499824,0.586330595572871,,,,0.4601138942146693,0.8510594738458389,0.851044226044226,0.39848337427990177,0.6211923978130696,0.6157908634803274,0.8814920585520319,0.7773468570262111,0.7691455763038368,0.7937458416500333,0.8041379310344827,0.5102651839178786,0.49893025246041933,none,0.909011551842966,0.9066665353775055,0.6908938032499824,COMPLETE
1497,0.7031279265780108,2025-09-23 18:36:41.543083,2025-09-23 18:36:45.161616,0 days 00:00:03.618533,14.103858918421766,dart,0.9761868899357764,7.52434057576841,depthwise,0.0017372230758884353,0.0611648215015527,5,11,2.2654594902104517,200,forest,0.6193936002179937,0.7173237803913741,none,0.9830611309711477,3.9777077525747804,0.06270133380174907,uniform,0.651873765482353,0.7265492800697445,0.8405159176988433,0.8377354627354627,0.6193936002179937,0.711053412462908,0.7031279265780108,0.7173237803913741,0.8123288145950924,0.8074794077813542,0.6277013752455796,0.6252498334443705,0.8199315654405475,0.8031664527171587,none,0.9218755809794565,0.91904387862271,0.9830611309711477,COMPLETE
1498,0.7079217148182665,2025-09-23 18:36:45.298688,2025-09-23 18:36:46.070805,0 days 00:00:00.772117,0.09549900620819302,gbtree,0.4980253909278747,1.7025976953216426,lossguide,0.00017290115581911086,0.030358123195368646,10,5,0.686800510662233,300,,0.4078544633387448,0.9047854534138978,undersample,0.6947154494463639,0.5259167400815237,,,,0.3804007102317385,0.8411301054355614,0.8395782145782146,0.4078544633387448,0.7146009562339095,0.7079217148182665,0.9047854534138978,0.8182594041121711,0.811909479414308,0.6267741935483871,0.6271466314398944,0.8310521813515825,0.8125802310654685,undersample,0.9234528520673633,0.9209853746753688,0.6947154494463639,COMPLETE
1499,0.6817086527929901,2025-09-23 18:36:46.206851,2025-09-23 18:36:46.830625,0 days 00:00:00.623774,0.0007289893147000535,gbtree,0.9625188944475421,5.146032310992669,lossguide,0.0031745533344083123,0.03844104582556149,9,4,0.1608816981116881,200,,0.462569868369603,0.8254493625096392,none,0.9906257229023696,1.5283291384270965,,,,0.6475151293518591,0.8520831200737026,0.8512489762489762,0.462569868369603,0.6879723601813863,0.6817086527929901,0.8254493625096392,0.7857378154579111,0.7768252309247657,0.6947230702136938,0.6983842010771992,0.6813515825491874,0.6658108686350022,none,0.9086554096374988,0.9060396008417939,0.9906257229023696,COMPLETE
1500,0.6773888363292336,2025-09-23 20:58:42.787688,2025-09-23 20:59:26.034510,0 days 00:00:43.246822,0.0031284073657295453,dart,0.4380805328156421,9.895819085521053,depthwise,3.5151871927395533,0.03642644630641387,4,11,0.10575236332931608,800,forest,0.6232606249897837,0.8963959975674581,none,0.7909974759786668,1.7988036710274258,0.1410039661101593,weighted,0.7735904537203656,0.39342856694498846,0.8659023441498618,0.8603603603603603,0.6232606249897837,0.6944962686567164,0.6773888363292336,0.8963959975674581,0.7982515112494665,0.7868561228538657,0.7635897435897436,0.7572712850343734,0.636869118905047,0.6127513906718015,none,0.9167092886146504,0.9126732160379845,0.7909974759786668,COMPLETE
1501,0.5422619047619047,2025-09-23 20:59:26.172391,2025-09-23 21:00:17.360944,0 days 00:00:51.188553,0.027986947796093693,dart,0.5159218778278316,3.0801888022581023,lossguide,0.0006162677978811197,0.001836175747250314,6,10,0.10481433330658928,800,forest,0.5968501733342593,0.9967470204733995,none,0.8888339147557943,1.1300802873124378,0.17889012154707987,uniform,0.7677954594775094,0.3695299910796343,0.8480908997850343,0.8425470925470926,0.5968501733342593,0.5635294117647058,0.5422619047619047,0.9967470204733995,0.8095874007111512,0.8013475542919364,0.9020715630885122,0.8905180840664711,0.40975192472198463,0.3898160034231921,none,0.9193757360991724,0.9172628087116347,0.8888339147557943,COMPLETE
1502,0.7160955347871236,2025-09-23 21:00:17.495031,2025-09-23 21:00:35.973745,0 days 00:00:18.478714,0.0003668290048372739,dart,0.9084086603631313,8.91958255679036,depthwise,0.00022798849646084928,0.08011243851967348,0,12,0.1530261702715663,500,forest,0.6948538847471669,0.9461334679522125,none,0.9834806009563233,4.2341616741850325,0.08061118160260786,uniform,0.39407025412935315,0.8790960262467531,0.8591462790459617,0.860053235053235,0.6948538847471669,0.7169888934594817,0.7160955347871236,0.9461334679522125,0.8174113326739121,0.8106401679217016,0.6905705229793978,0.6957223567393059,0.7455089820359282,0.7376979032948224,none,0.9202368088092802,0.9198829200114451,0.9834806009563233,COMPLETE
1503,0.6762677484787019,2025-09-23 21:00:36.108631,2025-09-23 21:00:37.094870,0 days 00:00:00.986239,0.003344127954636204,gbtree,0.40677539986295647,2.704147334206761,depthwise,0.00012007113859468741,0.008772072131570118,7,5,0.26677473453497696,600,,0.3635379109384595,0.9442803572989841,none,0.6513467380646051,0.9699908516041876,,,,0.8855738511054932,0.8374449790152523,0.8366093366093366,0.3635379109384595,0.6794509487283004,0.6762677484787019,0.9442803572989841,0.7506647904495249,0.7426205654769924,0.643348623853211,0.6428846895487852,0.7198460222412318,0.7133076593923834,none,0.8981274431355295,0.89979089897777,0.6513467380646051,COMPLETE
1504,0.7233210171701804,2025-09-23 21:00:37.228280,2025-09-23 21:01:23.003125,0 days 00:00:45.774845,0.0022683438510389758,dart,0.29614587943642584,3.551597204909771,lossguide,0.00018648446061076884,0.03552515813526378,6,8,0.1699398886747029,800,forest,0.5149707625523603,0.9510326032793625,none,0.9626323283146143,1.492232510359422,0.1718518033027754,uniform,0.5692933148292487,0.657858284976597,0.8706111167980346,0.8696764946764947,0.5149707625523603,0.7242582897033158,0.7233210171701804,0.9510326032793625,0.8296609051495126,0.822630413419444,0.7390917186108638,0.734982332155477,0.7100085543199316,0.7120239623448866,none,0.9283514981686664,0.9262881899583715,0.9626323283146143,COMPLETE
1505,0.714591023897416,2025-09-23 21:01:23.136540,2025-09-23 21:01:30.093642,0 days 00:00:06.957102,0.0004772092827416413,dart,0.9075992131887307,7.119756352358365,depthwise,1.3342288681084462,0.499460308034653,0,10,1.3484238010245975,300,forest,0.6409420630299105,0.9746596527979321,none,0.9741695359697014,3.890107215998765,0.15726580950984928,uniform,0.508457771283768,0.757153213252604,0.8498310983724024,0.8496109746109746,0.6409420630299105,0.7178303519907675,0.714591023897416,0.9746596527979321,0.8211910542132766,0.816409319400667,0.6522195036700454,0.6544483985765125,0.7981180496150556,0.7869062901155327,none,0.9249714999898121,0.9237538484855133,0.9741695359697014,COMPLETE
1506,0.7153831740678284,2025-09-23 21:01:30.228246,2025-09-23 21:02:24.441585,0 days 00:00:54.213339,0.01546884083725439,dart,0.26500801498585186,1.0380224051683191,lossguide,0.0008468437989879622,0.16939325503708846,3,6,0.4611220708973112,900,forest,0.48500741920462037,0.9862904744965996,none,0.9067065441576715,2.2828419930755146,0.2420399755715445,uniform,0.6126133400264477,0.6242757235178078,0.8443034087419388,0.8444922194922195,0.48500741920462037,0.7162842753217683,0.7153831740678284,0.9862904744965996,0.8285408964998735,0.8212099922080156,0.6351306649024148,0.6363333333333333,0.8212147134302823,0.8168592212237912,none,0.9272107495027825,0.9252676182712362,0.9067065441576715,COMPLETE
1507,0.7004706889174155,2025-09-23 21:02:24.575684,2025-09-23 21:02:58.130100,0 days 00:00:33.554416,0.001980146036936037,dart,0.4017579325677189,4.162875042957039,lossguide,0.0011096272237512716,0.0700205012559106,6,7,0.14867939939203298,700,forest,0.5364260005277519,0.8904398588608343,none,0.9936525728762894,1.6625933630734744,0.17053411392795179,uniform,0.49996086294335135,0.636313532748955,0.8623195823523391,0.8566748566748567,0.5364260005277519,0.7129135538954109,0.7004706889174155,0.8904398588608343,0.8063873946925542,0.7959980278216335,0.7115466553046442,0.7004706889174155,0.7142857142857143,0.7004706889174155,none,0.9204518755326305,0.9161966888988737,0.9936525728762894,COMPLETE
1508,0.6970934422291617,2025-09-23 21:02:58.263216,2025-09-23 21:04:06.422664,0 days 00:01:08.159448,0.05588283967367196,dart,0.23776676340159839,2.8839281407193913,lossguide,0.0003715299531576289,0.03739237339726196,7,7,0.10134986039004654,1000,forest,0.47932452332746284,0.9678198051245588,none,0.9621886712934492,0.9469886799428432,0.20497545192219485,uniform,0.5790507350341034,0.5735628130950261,0.8717371276486846,0.8709049959049959,0.47932452332746284,0.7014534191088873,0.6970934422291617,0.9678198051245588,0.8258430178253662,0.8208766653870911,0.7918235610543303,0.7946330777656079,0.6295979469632165,0.6208814719726145,none,0.9266598011083202,0.9251692089833804,0.9621886712934492,COMPLETE
1509,0.6784754072433972,2025-09-23 21:04:06.554914,2025-09-23 21:04:48.941614,0 days 00:00:42.386700,0.008804973271593084,dart,0.5248643968011828,7.098445597975125,depthwise,0.00045970986033242063,0.40921979490041005,0,10,0.14552180740389326,800,forest,0.6075328484030074,0.9829506211498078,undersample,0.9643877872324935,2.9020838660788795,0.2026641396346121,uniform,0.6003667782498107,0.9410717078903783,0.7867744907360016,0.7918714168714168,0.6075328484030074,0.6720201543064085,0.6784754072433972,0.9829506211498078,0.8204366434093087,0.8113478662515838,0.5317717418390232,0.5381334671349725,0.9127459366980325,0.9178433889602053,undersample,0.925156377365806,0.9225393949539009,0.9643877872324935,COMPLETE
1510,0.6768901569186876,2025-09-23 21:04:49.076620,2025-09-23 21:05:00.093996,0 days 00:00:11.017376,0.0010771572377484115,dart,0.7747779771079252,9.372956280412629,lossguide,0.0001530815768332988,0.4415419270685868,3,9,0.18069027267835808,400,forest,0.6825586217083554,0.9167858449715427,undersample,0.9789035822754305,1.6716297773737958,0.15711968647516822,uniform,0.6115154477820844,0.9246300104667787,0.8089876138806429,0.8144963144963145,0.6825586217083554,0.6703180212014134,0.6768901569186876,0.9167858449715427,0.744322853405965,0.7391328647228725,0.5710415412402168,0.5802506878630388,0.811377245508982,0.8121523320496363,undersample,0.8981822098924592,0.8991066981829752,0.9789035822754305,COMPLETE
1511,0.7134831460674157,2025-09-23 21:05:00.229147,2025-09-23 21:05:01.373864,0 days 00:00:01.144717,0.0009838501125729651,gbtree,0.8800008640650366,5.5958688124248,lossguide,0.017836138433338776,0.049315264813492694,8,10,0.27669992357867407,700,,0.3203589685562058,0.9852335138160785,none,0.9888926733721831,1.1692766940779464,,,,0.5213715018557294,0.8429726686457161,0.8433660933660934,0.3203589685562058,0.7155044510385756,0.7134831460674157,0.9852335138160785,0.8280711941469483,0.8213027031352453,0.6316306483300589,0.6343656343656343,0.8250641573994867,0.8151476251604621,none,0.9275378823067862,0.9253333780177144,0.9888926733721831,COMPLETE
1512,0.5891783567134269,2025-09-23 21:05:01.508453,2025-09-23 21:05:35.801882,0 days 00:00:34.293429,0.22134603227679941,dart,0.4659536920159726,7.026572478147697,lossguide,0.00010220193118023499,0.01144612151241477,7,8,0.7249945634606247,700,forest,0.611307785873412,0.9917700723952007,none,0.9681092937809941,0.7779367310245501,0.13802012598857444,uniform,0.5684253807455779,0.8509063540915326,0.8596581021598936,0.8530917280917281,0.611307785873412,0.6108430315072382,0.5891783567134269,0.9917700723952007,0.8247621961902712,0.8178053723682677,0.9080168776371308,0.8901384083044983,0.4602224123182207,0.44030808729139925,none,0.9250745581908448,0.9234108843436352,0.9681092937809941,COMPLETE
1513,0.709576837416481,2025-09-23 21:05:35.935261,2025-09-23 21:05:36.582211,0 days 00:00:00.646950,4.863959625444226,gbtree,0.9048181513209789,2.26783778585066,depthwise,0.010290293347993293,0.3366084215152976,9,6,1.507041523339563,400,,0.3283727329592406,0.9629350319741924,none,0.9461487980171074,0.6071343410635337,,,,0.6587664001748532,0.8663118026410073,0.8665028665028665,0.3283727329592406,0.7109340416113324,0.709576837416481,0.9629350319741924,0.8216419354758873,0.8136287757100447,0.736697247706422,0.7398978169995355,0.6869118905047049,0.6816431322207959,none,0.9240986278207757,0.9218237250685194,0.9461487980171074,COMPLETE
1514,0.682685162249195,2025-09-23 21:05:36.714137,2025-09-23 21:05:38.029307,0 days 00:00:01.315170,0.12286906970686845,gbtree,0.5536296971086034,2.3869910282181444,lossguide,0.00028645117740950995,0.02492815777633671,10,6,0.3289894700206992,500,,0.4731495169330311,0.8966206990937073,none,0.9881962567688996,0.7083914832488596,,,,0.6695274084765236,0.8714300337803256,0.8688574938574939,0.4731495169330311,0.6901825357671436,0.682685162249195,0.8966206990937073,0.8303667444237557,0.8228700273969185,0.8152680652680653,0.8105882352941176,0.5983746792130026,0.5896448438168592,none,0.9287461469010765,0.9260688276517085,0.9881962567688996,COMPLETE
1515,0.7094252873563218,2025-09-23 21:05:38.164708,2025-09-23 21:05:39.605788,0 days 00:00:01.441080,3.2451400188481245,gbtree,0.5003917285156876,0.5582922926596124,depthwise,0.10641512672509496,0.05054610350960943,8,7,0.18438286009918972,900,,0.3975096238521773,0.9256819401859012,none,0.9595627627492563,0.6757632533906789,,,,0.7757321688828532,0.8704063875524619,0.8705978705978706,0.3975096238521773,0.7106946983546618,0.7094252873563218,0.9256819401859012,0.8268351875750646,0.8206454477410337,0.7630029440628067,0.7665176353700944,0.665098374679213,0.6602481814291827,none,0.9272653723638713,0.9248566774387119,0.9595627627492563,COMPLETE
1516,0.6949529512403764,2025-09-23 21:05:39.741171,2025-09-23 21:06:04.887408,0 days 00:00:25.146237,0.005515611026289638,dart,0.9686456613898418,5.842293428078681,depthwise,0.0028010901369399923,0.2375129552806669,1,8,14.640685322874054,600,forest,0.42468385017678445,0.754628884200455,none,0.8237869131220955,2.843028829854288,0.10239124043839302,uniform,0.48932280922778526,0.7959299924745786,0.813798751151602,0.8174651924651924,0.42468385017678445,0.6930993757381475,0.6949529512403764,0.754628884200455,0.8224110688672798,0.81213525563254,0.5723042630259125,0.5789623717217788,0.8785286569717707,0.8690629011553274,none,0.9250228708049039,0.9213706910882933,0.8237869131220955,COMPLETE
1517,0.6755555555555556,2025-09-23 21:06:05.020494,2025-09-23 21:06:09.178891,0 days 00:00:04.158397,0.25965769612695205,dart,0.8989904927185891,4.638146637042472,lossguide,0.3794999212373008,0.04186043397114747,5,11,2.9320525262477335,200,forest,0.6876875346572385,0.9730627919622976,undersample,0.9286407138893318,4.840676109843964,0.15243036849047933,uniform,0.6247301386531431,0.4441478638919024,0.7841130105435562,0.7907452907452908,0.6876875346572385,0.669798027242837,0.6755555555555556,0.9730627919622976,0.8157251722385797,0.8076176046704642,0.5282785873055076,0.536966944234166,0.9148845166809239,0.9105691056910569,undersample,0.9234878763149634,0.920724178344348,0.9286407138893318,COMPLETE
1518,0.4424083769633508,2025-09-23 21:06:09.311396,2025-09-23 21:06:09.973089,0 days 00:00:00.661693,0.009287884810459954,gbtree,0.5805881349369785,1.065205998640721,lossguide,0.000511530272372342,0.0056205927543766425,9,3,0.610758120897692,300,,0.5202158787128386,0.9493656502178425,none,0.7243079779160451,0.7835180987437463,,,,0.4314288082829231,0.8277203398505476,0.8255528255528255,0.5202158787128386,0.4501796798431885,0.4424083769633508,0.9493656502178425,0.7827892232639296,0.7731707269047122,0.9529737206085753,0.9401947148817803,0.2946963216424294,0.2892597347026102,none,0.9045184617787897,0.9018170131980732,0.7243079779160451,COMPLETE
1519,0.6168018699298776,2025-09-23 21:06:10.105841,2025-09-23 21:06:11.719852,0 days 00:00:01.614011,0.0043135855661619645,gbtree,0.4427540243909944,3.01703899722522,lossguide,0.0013935974424929623,0.006487380871299101,9,7,0.3945500239086851,400,,0.4274541782407463,0.9190569055939759,undersample,0.8197467275249902,2.1239000125249166,,,,0.3679280130488068,0.7109223052513052,0.7146805896805897,0.4274541782407463,0.6139967195188628,0.6168018699298776,0.9190569055939759,0.7957790769413084,0.789061507791263,0.45118521494576136,0.4544165316045381,0.960650128314799,0.9597774925117672,undersample,0.9170235571305052,0.9149729357183505,0.8197467275249902,COMPLETE
1520,0.7096626118889144,2025-09-23 21:06:11.852754,2025-09-23 21:06:48.434453,0 days 00:00:36.581699,0.0003437293965853775,dart,0.4955428095116876,0.10102073314940929,depthwise,0.00020890915744915857,0.02908476948390692,4,10,0.11847897522123726,700,forest,0.37651696533454854,0.7268297090230076,none,0.9243710863016792,0.662725022592345,0.22083688852030098,uniform,0.6505354007930186,0.7183796874525709,0.8674378134916573,0.8704954954954955,0.37651696533454854,0.7044053868979685,0.7096626118889144,0.7268297090230076,0.8246547570169611,0.8207663072871523,0.7552618697993148,0.7653465346534654,0.6599657827202737,0.6615318784766795,none,0.9259488117599509,0.9239598803356879,0.9243710863016792,COMPLETE
1521,0.7111274871039057,2025-09-23 21:06:48.568590,2025-09-23 21:07:16.802683,0 days 00:00:28.234093,0.19116745395256798,dart,0.3300599049423159,0.49645587847428535,depthwise,0.07693941614498835,0.3703623213786767,4,12,0.2132653504220614,600,forest,0.34113052649072517,0.9827210808180674,none,0.9404347053289366,2.1302027355431075,0.1448946707485198,uniform,0.7124500358425644,0.8306070723432994,0.8329409356126523,0.8394758394758395,0.34113052649072517,0.7020810514786419,0.7111274871039057,0.9827210808180674,0.8154841137557773,0.8134672905517673,0.6124203821656051,0.6243934001941119,0.8224978614200171,0.8258451005562687,none,0.920575050372178,0.9206260281798364,0.9404347053289366,COMPLETE
1522,0.7170033339870563,2025-09-23 21:07:16.936880,2025-09-23 21:07:18.106829,0 days 00:00:01.169949,0.005379649881910075,gbtree,0.9452302792976465,2.9866308439638845,depthwise,0.00020203606563251665,0.09064678577366261,1,12,6.1837999732649465,700,,0.501914467744819,0.895613284004036,none,0.8316810607752265,2.3175454032981104,,,,0.6839419789670752,0.8474767120483161,0.8522727272727273,0.501914467744819,0.7105672105672106,0.7170033339870563,0.895613284004036,0.8146892723394755,0.810831634608568,0.6508896797153025,0.6618392469225199,0.7822925577416595,0.7821994009413779,none,0.9216095463493682,0.9194289647037728,0.8316810607752265,COMPLETE
1523,0.7078511661029019,2025-09-23 21:07:18.240016,2025-09-23 21:07:20.249773,0 days 00:00:02.009757,0.006271025181803747,gbtree,0.5023287418194852,2.4749190273426263,depthwise,0.0006551226783513504,0.007710106254218737,1,12,0.1536003139536784,500,,0.5568984397850567,0.9624599324068338,none,0.9765885150984156,4.163230484086889,,,,0.573178169776753,0.8296652676834886,0.832002457002457,0.5568984397850567,0.7062146892655368,0.7078511661029019,0.9624599324068338,0.8168700566305563,0.8096328704742721,0.6013229104028863,0.6060975609756097,0.8554319931565441,0.85066324347454,none,0.9243564891671182,0.9225380993371797,0.9765885150984156,COMPLETE
1524,0.7182274247491639,2025-09-23 21:07:20.385065,2025-09-23 21:08:05.770192,0 days 00:00:45.385127,0.00029128679131049996,dart,0.9623208759156118,5.5534173568476835,depthwise,0.01712718057575426,0.37022387821287334,0,9,10.700341325592667,800,forest,0.6942804503124294,0.991733742424125,none,0.9142004925009856,3.710344213107451,0.08154726081879847,uniform,0.6693080047916113,0.6121171276495669,0.8587368205548163,0.861998361998362,0.6942804503124294,0.713216957605985,0.7182274247491639,0.991733742424125,0.816736903431672,0.810199382505508,0.6936135812449474,0.7020841847159788,0.7339606501283148,0.7351305091998288,none,0.9234049059732775,0.9202763844139727,0.9142004925009856,COMPLETE
1525,0.6805364511691885,2025-09-23 21:08:05.904168,2025-09-23 21:08:06.846095,0 days 00:00:00.941927,0.0015727319895099854,gbtree,0.9190412858629879,4.762082511448508,lossguide,0.000889052443546634,0.010657207900623208,5,5,0.1403950633270278,300,,0.3326399966530769,0.9874896755941991,none,0.9798394158370763,1.3161835488047122,,,,0.7709478095664123,0.8088852492578564,0.8097870597870598,0.3326399966530769,0.6802534680595993,0.6805364511691885,0.9874896755941991,0.8031587412994267,0.7972753991766468,0.5672664952870609,0.5688416211555044,0.8494439692044482,0.8468121523320497,none,0.9144164810698114,0.9121981853649783,0.9798394158370763,COMPLETE
1526,0.7187366623986342,2025-09-23 21:08:06.980031,2025-09-23 21:08:50.528584,0 days 00:00:43.548553,0.010413537904670946,dart,0.9562438933099753,6.5514173827559965,depthwise,0.1590161629991568,0.17110769760489425,0,12,0.40827038498408313,800,tree,0.6325227253737953,0.7504532707224837,none,0.9344126503860051,2.619288192505332,0.0921450852163417,uniform,0.6841468282512542,0.9747389621724648,0.8656976149042891,0.8650696150696151,0.6325227253737953,0.7212069698257544,0.7187366623986342,0.7504532707224837,0.8228612865429863,0.8180464417482273,0.7166385135135135,0.7169008088548319,0.7258340461933276,0.7205819426615319,none,0.925407130257623,0.9240382219601045,0.9344126503860051,COMPLETE
