number,value,datetime_start,datetime_complete,duration,params_alpha,params_booster,params_colsample_bytree,params_gamma,params_grow_policy,params_lambda,params_learning_rate,params_max_delta_step,params_max_depth,params_min_child_weight,params_n_estimators,params_normalize_type,params_params_decision_threshold,params_params_feature_fraction,params_params_resampling,params_params_sample_rows,params_params_scale_pos_weight,params_rate_drop,params_sample_type,params_skip_drop,params_subsample,user_attrs_acc_test,user_attrs_acc_val,user_attrs_decision_threshold,user_attrs_f1_test,user_attrs_f1_val,user_attrs_feature_fraction,user_attrs_pr_auc_test,user_attrs_pr_auc_val,user_attrs_prec_test,user_attrs_prec_val,user_attrs_rec_test,user_attrs_rec_val,user_attrs_resampling_strategy,user_attrs_roc_auc_test,user_attrs_roc_auc_val,user_attrs_sample_rows,state
1313,0.7168191151764047,2025-09-23 17:50:16.649928,2025-09-23 17:51:15.641308,0 days 00:00:58.991380,0.0015822379610615845,dart,0.9093950389847809,3.249270843950614,lossguide,0.00027116086838109717,0.20041525939344157,1,8,0.10947196278484837,800,forest,0.5673683744917498,0.9936907816802417,none,0.9455965343446366,3.7537257522448217,0.12774894119639985,uniform,0.7305145114189922,0.8891114451005071,0.8429726686457161,0.8446969696969697,0.5673683744917498,0.7152932442464737,0.7168191151764047,0.9936907816802417,0.827853054178117,0.8247154651555985,0.6318032786885246,0.6357615894039735,0.8242087254063302,0.8215661103979461,none,0.926285211456089,0.9253012467230254,0.9455965343446366,COMPLETE
1314,0.6994797919167667,2025-09-23 17:51:15.781562,2025-09-23 17:51:23.293895,0 days 00:00:07.512333,0.0006867736303234654,dart,0.8850165207944336,8.520298896819837,lossguide,0.009689887620962857,0.14133991766591927,3,10,0.11796556573360199,300,forest,0.5941961343131771,0.8299841634084297,none,0.8630618477048979,2.988515932723922,0.11098993730973984,uniform,0.7909041313963102,0.8216139215145778,0.8464530658204524,0.8462325962325963,0.5941961343131771,0.7051886792452831,0.6994797919167667,0.8299841634084297,0.8078128666006669,0.8009859664854475,0.6523636363636364,0.6568959037955656,0.76732249786142,0.7479674796747967,none,0.9151921659881114,0.9148992583141309,0.8630618477048979,COMPLETE
1315,0.7226822864067866,2025-09-23 17:51:23.437137,2025-09-23 17:51:43.300686,0 days 00:00:19.863549,0.00019643279597811257,dart,0.8067081025132394,7.245560906102957,depthwise,0.00013268665287151973,0.43460520223919535,2,11,0.30502759139715707,500,forest,0.657149142464958,0.9826332590456539,none,0.9713603880968594,3.566099185931137,0.1059487439603692,uniform,0.607707846602736,0.8909402741189882,0.8582249974408844,0.8594389844389845,0.657149142464958,0.7209349183961313,0.7226822864067866,0.9826332590456539,0.8275200323512364,0.8224238484676683,0.6815238095238095,0.6843917368018363,0.7651839178785287,0.7655113393239196,none,0.9275345727024524,0.9256560441642917,0.9713603880968594,COMPLETE
1316,0.705159165751921,2025-09-23 17:51:43.442728,2025-09-23 17:51:58.124592,0 days 00:00:14.681864,0.00010234684178758941,dart,0.9379571913947373,3.303404513710039,lossguide,0.0006691897766814075,0.032795150781459094,1,7,1.4996136931023534,400,forest,0.6919093467716095,0.7610464095635422,none,0.9242611743012935,3.218540735042803,0.08571714198814585,uniform,0.5247593597512433,0.726004489528844,0.8639574163169209,0.8625102375102375,0.6919093467716095,0.7091267235718975,0.705159165751921,0.7610464095635422,0.8152884403797873,0.8072303239293904,0.7261317794710892,0.7240757439134355,0.6928999144568007,0.6872058194266153,none,0.9198199137799146,0.9189765641361658,0.9242611743012935,COMPLETE
1317,0.6998867497168743,2025-09-23 17:51:58.361639,2025-09-23 17:52:19.762763,0 days 00:00:21.401124,0.00023102666794683617,dart,0.9739375806555292,7.331404314530004,lossguide,0.00012242195972326435,0.3017619220309162,0,12,0.4955622148916022,500,forest,0.6799289333425912,0.8412946200924359,none,0.986366633197185,2.8028614691623086,0.14026916549568408,uniform,0.5655806070709102,0.9200816732377405,0.8650834271675709,0.8643529893529893,0.6799289333425912,0.7038202247191011,0.6998867497168743,0.8412946200924359,0.8074674476170242,0.8036477596955572,0.7414772727272727,0.7435033686236766,0.669803250641574,0.6611039794608472,none,0.9155841958162226,0.91483678079668,0.986366633197185,COMPLETE
1318,0.68128078817734,2025-09-23 17:52:19.906766,2025-09-23 17:52:20.882548,0 days 00:00:00.975782,0.0006638103017070683,gbtree,0.7727798314396942,7.347479322698071,depthwise,0.01744644904888766,0.023533573451352468,4,12,0.18697079645286413,500,,0.5717351589002646,0.8313087966305011,none,0.9071613403276252,1.2136869558943415,,,,0.610773580179293,0.8704063875524619,0.8675266175266175,0.5717351589002646,0.6900097943192948,0.68128078817734,0.8313087966305011,0.8227447341788878,0.8163120083421127,0.806987399770905,0.8026697620429484,0.6026518391787853,0.5917843388960206,none,0.9245307758092443,0.9224616003676556,0.9071613403276252,COMPLETE
1319,0.38612143742255267,2025-09-23 17:52:21.031364,2025-09-23 17:52:37.728954,0 days 00:00:16.697590,0.00015082931439368082,dart,0.910203953183817,7.772330867666277,lossguide,0.00010331472215040833,0.0018071240919392065,1,11,0.14277779627527792,300,forest,0.6169570119948253,0.9564977672335602,oversample,0.9155528478919387,4.183398532934172,0.0985231954497749,uniform,0.7275018393681035,0.5774490248281996,0.23932848807452145,0.23925061425061425,0.6169570119948253,0.3862228462872718,0.38612143742255267,0.9564977672335602,0.705322700057044,0.6949921463742862,0.23932848807452145,0.23925061425061425,1.0,1.0,oversample,0.8847887591792596,0.8848298656583659,0.9155528478919387,COMPLETE
1320,0.7168602322787345,2025-09-23 17:52:37.872729,2025-09-23 17:53:15.441875,0 days 00:00:37.569146,0.0003813611180991644,dart,0.7474123905506876,6.615905965413963,depthwise,0.0010784401181415436,0.49799694028574504,4,8,0.23119645491000193,700,forest,0.6485975438048631,0.9758725810022242,none,0.9415724247970506,3.5543206997888084,0.13632739929774132,uniform,0.6145026325586725,0.8832960839738968,0.8575084450813799,0.8552416052416052,0.6485975438048631,0.7225986448784376,0.7168602322787345,0.9758725810022242,0.826303834503781,0.818158821208304,0.6764925373134328,0.6736921339856982,0.7754491017964071,0.7659392383397519,none,0.9269715946157168,0.9234440233402186,0.9415724247970506,COMPLETE
1321,0.6599474145486416,2025-09-23 17:53:15.583701,2025-09-23 17:53:16.341935,0 days 00:00:00.758234,0.0003393921696305171,gbtree,0.8747469356986127,0.586001654744633,depthwise,0.00013616676454158804,0.08011100609985623,9,6,14.007724647610189,300,,0.4010933078306636,0.8614497279779227,none,0.994239476074326,0.8649290706573453,,,,0.8327218601021227,0.8410277408127751,0.8411138411138411,0.4010933078306636,0.6666666666666666,0.6599474145486416,0.8614497279779227,0.7431227710467241,0.7359525565212051,0.6691081430417923,0.6762460709474629,0.6642429426860564,0.6444159178433889,none,0.8979577899394705,0.8972233897168456,0.994239476074326,COMPLETE
1322,0.7021575984990619,2025-09-23 17:53:16.481765,2025-09-23 17:53:38.874574,0 days 00:00:22.392809,0.003095777406057825,dart,0.6808118012394552,6.2098960284247875,depthwise,0.00011836231408617469,0.2021979680439109,1,11,0.4315198961818026,500,forest,0.6858799891271347,0.943883290226433,none,0.891602878756767,2.378933568857243,0.05584548209877743,uniform,0.7026078018207911,0.9512810758833721,0.8730678677449074,0.86998361998362,0.6858799891271347,0.7118959107806692,0.7021575984990619,0.943883290226433,0.823289379624597,0.8183347960475157,0.7792472024415056,0.7768552153606643,0.6552609067579127,0.6405648267008985,none,0.9243907651563474,0.922734399666203,0.891602878756767,COMPLETE
1323,0.6953824948311509,2025-09-23 17:53:39.098779,2025-09-23 17:54:35.464805,0 days 00:00:56.366026,0.00016145850267494877,dart,0.8315272057566516,8.071294501502082,lossguide,0.005163167964572063,0.0021935505029634754,0,11,0.34214133024554544,700,forest,0.5380905426495399,0.9311279931217014,none,0.8355116881074468,4.264455090297956,0.07459054206020346,uniform,0.5109421853768404,0.7346349681150665,0.8159484082301157,0.819000819000819,0.5380905426495399,0.6939053455907388,0.6953824948311509,0.9311279931217014,0.8145481679160899,0.8065951874930195,0.5763574660633484,0.582059417363715,0.8716852010265184,0.8635002139495079,none,0.9215309216620682,0.9191686897001983,0.8355116881074468,COMPLETE
1324,0.674344209852847,2025-09-23 17:54:35.605465,2025-09-23 17:55:13.116429,0 days 00:00:37.510964,0.0001515119963403809,dart,0.9788854910886636,8.02989115888688,lossguide,0.0001352926164240115,0.004167850544067859,0,9,2.996291132020665,600,forest,0.6474757261715791,0.896125768190587,undersample,0.9979820810021638,2.661823382079054,0.07143599029392234,uniform,0.706326731010665,0.9173006441707796,0.7839082812979834,0.7915642915642915,0.6474757261715791,0.6677160396662993,0.674344209852847,0.896125768190587,0.807591232840963,0.8011477342625091,0.5282689912826899,0.5384418901660281,0.907185628742515,0.9020111253744116,undersample,0.9186354495576584,0.9169086446829876,0.9979820810021638,COMPLETE
1325,0.704807483141179,2025-09-23 17:55:13.356861,2025-09-23 17:55:14.881931,0 days 00:00:01.525070,0.0003477442195377363,gbtree,0.9124845744590411,3.242947509531878,depthwise,0.0008842835676926121,0.05989746958494741,2,12,0.10946446919192002,700,,0.6167806109142486,0.8907282579963739,none,0.9454264576238962,2.6643752879945186,,,,0.6014253233585843,0.8576108097041663,0.8610769860769861,0.6167806109142486,0.7020775326622403,0.704807483141179,0.8907282579963739,0.8067935013574186,0.8063091754754648,0.7031317031317031,0.7168141592920354,0.7010265183917879,0.693196405648267,none,0.9153516601378245,0.9166166702569645,0.9454264576238962,COMPLETE
1326,0.6715848384634953,2025-09-23 17:55:15.107094,2025-09-23 17:55:15.793012,0 days 00:00:00.685918,0.0002550813684551347,gbtree,0.7605842743299684,5.463216268157987,depthwise,0.008446078449026164,0.14420769037725756,0,9,0.2511898029328593,300,,0.6923727018507748,0.9551325154887206,none,0.9717252208546029,1.55368236316148,,,,0.8230531453066482,0.8696898351929573,0.8678337428337428,0.6923727018507748,0.6782916350770786,0.6715848384634953,0.9551325154887206,0.8283147304516846,0.8213758710042403,0.8289067325509574,0.8281053952321205,0.5739948674080411,0.5648267008985879,none,0.9281490079417841,0.9255021536892801,0.9717252208546029,COMPLETE
1327,0.6535326086956522,2025-09-23 17:55:16.008529,2025-09-23 17:56:02.081176,0 days 00:00:46.072647,0.0015789108530832366,dart,0.7843908260851494,8.364018971999208,depthwise,0.001420117634790828,0.43538756419064006,0,12,0.14508164608431726,700,forest,0.5457106986548164,0.8331428933534366,none,0.9416726730065399,3.7888157363856196,0.01761759218591051,uniform,0.7014170739434665,0.43255693305143683,0.7818609888422561,0.7911547911547911,0.5457106986548164,0.6411853847449065,0.6535326086956522,0.8331428933534366,0.6725316300376578,0.6718282601430234,0.5287420161066371,0.541819205857505,0.8143712574850299,0.8232777064612752,none,0.8737621935896361,0.8796672361046115,0.9416726730065399,COMPLETE
1328,0.6858647358894191,2025-09-23 17:56:02.220278,2025-09-23 17:56:03.364914,0 days 00:00:01.144636,0.0014312147790896063,gbtree,0.7190925877856346,8.542105394819762,lossguide,0.003351468721680248,0.13023779159128976,3,12,4.708175097924197,800,,0.44200612909391374,0.9539425844880819,none,0.8939462908073326,4.337128434312806,,,,0.46317739179831224,0.8029481011362473,0.8045659295659295,0.44200612909391374,0.6852003270645952,0.6858647358894191,0.9539425844880819,0.8170823947399226,0.8153278845269167,0.554673020916071,0.5572192513368984,0.8960650128314799,0.8917415489944374,none,0.924009613853785,0.9230104236108124,0.8939462908073326,COMPLETE
1329,0.703202846975089,2025-09-23 17:56:03.507346,2025-09-23 17:56:23.961503,0 days 00:00:20.454157,0.00011164166521226045,dart,0.7076706278671703,5.874766314301796,depthwise,0.00018645860232258102,0.39443526463300876,8,11,0.10552647895527631,500,forest,0.4767888128860647,0.9311634582103836,none,0.9460472597378783,3.042601274922825,0.11925207597534772,uniform,0.6237084380760907,0.49633445178977875,0.8280274337189067,0.8292383292383292,0.4767888128860647,0.7041211694258541,0.703202846975089,0.9311634582103836,0.8148790433714732,0.806988884157199,0.598502994011976,0.6018885166006701,0.8550042771599657,0.8455284552845529,none,0.9220807188898057,0.9195467218680006,0.9460472597378783,COMPLETE
1330,0.7142857142857143,2025-09-23 17:56:24.102987,2025-09-23 17:56:45.828026,0 days 00:00:21.725039,0.00019939106614237,dart,0.9699459683436307,7.246471973578965,depthwise,0.012923627909258098,0.013201119312647235,6,12,0.13001686883831137,500,forest,0.6053738830650807,0.9967282226348124,none,0.9255423840849839,3.119692870119381,0.09716244847278158,uniform,0.6160558267409831,0.5177939722651538,0.8513665677141979,0.8505323505323505,0.6053738830650807,0.7170693686671863,0.7142857142857143,0.9967282226348124,0.82464023377668,0.8189536491276617,0.658554044380816,0.6581319870176704,0.7869974337040205,0.7809157038938811,none,0.9263513459844255,0.9246218541058411,0.9255423840849839,COMPLETE
1331,0.7125145292522278,2025-09-23 17:56:45.963182,2025-09-23 17:56:54.117968,0 days 00:00:08.154786,0.0058358720498432465,dart,0.743120345153766,8.292476618413064,depthwise,0.00011412956843392701,0.0194308717795543,5,10,0.7574640526681833,300,forest,0.6959795759476833,0.9180903728019287,none,0.5921102522485652,4.915543886973197,0.09143594329876766,uniform,0.5835194813130714,0.5537488184589017,0.8506500153546934,0.8480753480753481,0.6959795759476833,0.7182853832786252,0.7125145292522278,0.9180903728019287,0.8195098457334914,0.8121862652430083,0.6546990496304118,0.6509734513274337,0.795551753635586,0.7869062901155327,none,0.9245710954237785,0.9222549638963444,0.5921102522485652,COMPLETE
1332,0.6895432413633202,2025-09-23 17:56:54.313503,2025-09-23 17:56:54.978291,0 days 00:00:00.664788,0.00720759279877721,gbtree,0.706794611094365,9.086436632892756,lossguide,0.01837086241000401,0.30940121300714146,6,12,12.907215870599657,300,,0.6340884966170404,0.9667946627776381,none,0.7816002583995221,1.7383281180189212,,,,0.3497973981562465,0.8655952502815027,0.862919737919738,0.6340884966170404,0.6997484564372285,0.6895432413633202,0.9667946627776381,0.8112091226473697,0.8052967468350936,0.7518427518427518,0.7525303643724697,0.6544054747647562,0.636285836542576,none,0.9208443946065996,0.9191328155127587,0.7816002583995221,COMPLETE
1333,0.6891385767790262,2025-09-23 17:56:55.175362,2025-09-23 17:57:21.241176,0 days 00:00:26.065814,3.5493859431094226,dart,0.3731832709618804,1.9948700091651714,depthwise,0.0008408605111750987,0.160084794997293,1,8,0.11803575166216966,500,forest,0.4032083774175114,0.9822480113276167,oversample,0.953343131728463,1.302271466312324,0.008740046793038855,uniform,0.6602032456224795,0.9366171486540912,0.8007984440577336,0.8045659295659295,0.4032083774175114,0.6857235142118863,0.6891385767790262,0.9822480113276167,0.8260367035220284,0.8223884992939494,0.5508562532433835,0.5562565720294427,0.9080410607356715,0.9054343175010697,oversample,0.9265308992143173,0.9258630837163608,0.953343131728463,COMPLETE
1334,0.7198435122799391,2025-09-23 17:57:21.602728,2025-09-23 17:57:31.572485,0 days 00:00:09.969757,0.00021566130282895326,dart,0.9362622232327327,3.6411953132777053,depthwise,0.0003860565567479012,0.10698585590630404,0,10,0.28034546171764463,300,forest,0.6816165072914209,0.940681715905475,none,0.9934224143425833,3.409350478008454,0.10836498393581365,uniform,0.7792491268046882,0.8067539553218308,0.8675401781144436,0.868038493038493,0.6816165072914209,0.7202766969303934,0.7198435122799391,0.940681715905475,0.8243887244080901,0.8211786270193233,0.7281468531468531,0.7314487632508834,0.7125748502994012,0.7086007702182285,none,0.9254076482826493,0.9246720664516633,0.9934224143425833,COMPLETE
1335,0.6993337631635504,2025-09-23 17:57:31.844030,2025-09-23 17:57:41.761091,0 days 00:00:09.917061,0.0012998659989405064,dart,0.9843552812875082,2.958477843836402,depthwise,0.002656070025422108,0.11152698248875176,0,9,0.12280432296848826,300,forest,0.6549182460527337,0.838787653610696,none,0.9510672354026714,2.8383936389459112,0.14015427456603669,uniform,0.8597304448175878,0.7059750062674675,0.8578155389497389,0.8567772317772318,0.6549182460527337,0.7059072623332627,0.6993337631635504,0.838787653610696,0.8044364954726819,0.7922732748037853,0.6989517819706499,0.7025043177892919,0.7130025662959795,0.6961916987590928,none,0.9190247741439665,0.9143286111270904,0.9510672354026714,COMPLETE
1336,0.7164546573656134,2025-09-23 17:57:42.002457,2025-09-23 17:58:09.296701,0 days 00:00:27.294244,0.00043577401357037095,dart,0.7269597910427501,4.8508017026499965,lossguide,0.0005497149817096803,0.01393407036564093,3,8,0.3967026597538203,500,forest,0.6841690001118873,0.948164043886635,none,0.8853553253564561,3.8164346473826036,0.10339849880285415,uniform,0.8034957724519574,0.9222596300526633,0.8617053946156208,0.8585176085176085,0.6841690001118873,0.723439099283521,0.7164546573656134,0.948164043886635,0.8271435101876281,0.8197707896997202,0.6937573616018846,0.6882144264879779,0.7557741659538066,0.7471116816431322,none,0.9274519477107842,0.9250190038181536,0.8853553253564561,COMPLETE
1337,0.6311522872032426,2025-09-23 17:58:09.432128,2025-09-23 17:58:22.429542,0 days 00:00:12.997414,0.0019238035815836018,dart,0.5416000543087519,1.3003239110315015,depthwise,0.0001240905880657874,0.007919118073267308,6,7,0.4139340078332837,400,forest,0.3424491910969655,0.8063766558136576,undersample,0.6062282510627484,0.901862233602415,0.14309355347844918,uniform,0.7264812515950131,0.5006739129637832,0.7321117821680827,0.7391482391482391,0.3424491910969655,0.6256615648691174,0.6311522872032426,0.8063766558136576,0.7943279907674317,0.7883429338390957,0.4700193423597679,0.47691971122292715,0.935414884516681,0.9328198545143346,undersample,0.9095277925606772,0.9078793765860866,0.6062282510627484,COMPLETE
1338,0.6936319572121009,2025-09-23 17:58:22.586377,2025-09-23 17:58:51.277982,0 days 00:00:28.691605,0.00035885347766783277,dart,0.8781780238105511,6.810886896919224,depthwise,0.0003155753428927648,0.018704798807172348,4,8,0.2684017978732991,600,forest,0.613387064967702,0.8809499883726122,undersample,0.8776025046461768,2.022992937877695,0.09039944126181101,uniform,0.8173719039135251,0.8187789680272283,0.8056095813286928,0.8123464373464373,0.613387064967702,0.6872014495140834,0.6936319572121009,0.8809499883726122,0.8167518426347371,0.8106096452835105,0.5587998928475757,0.5691168403730115,0.8922155688622755,0.887890457851947,undersample,0.9228671672169817,0.9215794293378416,0.8776025046461768,COMPLETE
1339,0.681420233463035,2025-09-23 17:58:51.445602,2025-09-23 17:59:38.034232,0 days 00:00:46.588630,17.42473614189684,dart,0.21938173594237936,0.05780887866534701,lossguide,0.0010309557351933715,0.07858321751124105,0,7,0.556311101808453,700,forest,0.42648467379884203,0.9914363891308212,none,0.8883585488045094,0.7272011626310744,0.12430623510687608,uniform,0.735037588550062,0.8529595620539996,0.8664141672637936,0.8658886158886159,0.42648467379884203,0.6847064508335347,0.681420233463035,0.9914363891308212,0.8114723393108514,0.806572264086009,0.7867851193781232,0.7892957746478874,0.6060735671514115,0.5994865211810013,none,0.919397435591934,0.9184692006280919,0.8883585488045094,COMPLETE
1340,0.6862793572311495,2025-09-23 17:59:38.174528,2025-09-23 17:59:42.101876,0 days 00:00:03.927348,0.0001634111084908633,dart,0.6838482684571517,5.4709299463460805,depthwise,0.00019124843585734377,0.06256576316968196,10,10,0.2594183101625593,200,forest,0.4137425047091591,0.999480383580498,none,0.9521212492935368,0.5772176444124826,0.003094654589131371,uniform,0.42048686137056646,0.8073075125724587,0.8705087521752483,0.870085995085995,0.4137425047091591,0.6888068880688807,0.6862793572311495,0.999480383580498,0.825980513803702,0.8202743096319625,0.8106543138390272,0.8126463700234192,0.5988023952095808,0.5939238339751819,none,0.926161230799834,0.9243733260272067,0.9521212492935368,COMPLETE
1341,0.7224383916990921,2025-09-23 17:59:42.243645,2025-09-23 17:59:56.116652,0 days 00:00:13.873007,0.00013778672832253727,dart,0.9786094549537151,6.768526116679869,depthwise,0.0001509525462208485,0.041574435981229896,1,10,0.1530162760089768,400,forest,0.6808540990390536,0.997573611419468,none,0.900842424854574,2.9984969816257414,0.15769804217363137,uniform,0.606048619023552,0.7580511896152978,0.8691780120790255,0.8685503685503686,0.6808540990390536,0.7232568211346904,0.7224383916990921,0.997573611419468,0.8270360793247156,0.8209054044907684,0.7324561403508771,0.7300131061598951,0.7142857142857143,0.7150192554557124,none,0.9270481472029124,0.9258319601235661,0.900842424854574,COMPLETE
1342,0.0,2025-09-23 17:59:56.273632,2025-09-23 18:00:04.678239,0 days 00:00:08.404607,0.00013389792517070644,dart,0.9526965921804955,6.773235088312353,depthwise,0.00016354170780537636,0.0010528321941181765,3,9,0.5426971366738064,300,forest,0.6405705026887322,0.9850671075213888,none,0.9632160453442306,2.216527401385862,0.11305324573182007,uniform,0.5907662075899512,0.7378828909061061,0.7606715119254785,0.7607493857493858,0.6405705026887322,0.0,0.0,0.9850671075213888,0.8049208482798123,0.798754701580871,0.0,0.0,0.0,0.0,none,0.9158525327797602,0.9142280136865496,0.9632160453442306,COMPLETE
