number,value,datetime_start,datetime_complete,duration,params_alpha,params_booster,params_colsample_bytree,params_gamma,params_grow_policy,params_lambda,params_learning_rate,params_max_delta_step,params_max_depth,params_min_child_weight,params_n_estimators,params_normalize_type,params_params_decision_threshold,params_params_feature_fraction,params_params_resampling,params_params_sample_rows,params_params_scale_pos_weight,params_rate_drop,params_sample_type,params_skip_drop,params_subsample,user_attrs_acc_test,user_attrs_acc_val,user_attrs_decision_threshold,user_attrs_f1_test,user_attrs_f1_val,user_attrs_feature_fraction,user_attrs_pr_auc_test,user_attrs_pr_auc_val,user_attrs_prec_test,user_attrs_prec_val,user_attrs_rec_test,user_attrs_rec_val,user_attrs_resampling_strategy,user_attrs_roc_auc_test,user_attrs_roc_auc_val,user_attrs_sample_rows,state
662,0.6339209310285812,2025-09-23 14:21:55.991253,2025-09-23 14:22:38.390483,0 days 00:00:42.399230,0.00017683759464462158,dart,0.43580231364245825,6.5514809100466485,lossguide,0.03633562820236425,0.16423743380286204,9,6,3.6624205715379583,700,forest,0.4890425597782335,0.5024714837238888,oversample,0.5060349083310569,0.6388207477331473,0.3332036463312279,uniform,0.39434694695683825,0.46922069261649757,0.779301873272597,0.7810196560196561,0.4890425597782335,0.6319562990781836,0.6339209310285812,0.5024714837238888,0.6613918312614672,0.6587284724609238,0.5258522727272728,0.5282373074729035,0.7917023096663816,0.7924689773213521,oversample,0.8617637842718163,0.8602603659846599,0.5060349083310569,COMPLETE
663,0.0,2025-09-23 14:22:38.594381,2025-09-23 14:23:23.489489,0 days 00:00:44.895108,0.038201615696834335,dart,0.8792367219867023,5.622619532806205,depthwise,85.55146726722647,0.00021864396408414433,8,7,1.8094831341559556,800,tree,0.6301074112105339,0.7833491307393057,oversample,0.6127244277192329,0.820614078177379,0.470589088818553,weighted,0.6134469026303566,0.7249018883792027,0.7606715119254785,0.7607493857493858,0.6301074112105339,0.0,0.0,0.7833491307393057,0.719208686843074,0.7057532900757605,0.0,0.0,0.0,0.0,oversample,0.8887898118061126,0.8864397702048117,0.6127244277192329,COMPLETE
664,0.6657051282051282,2025-09-23 14:23:23.619849,2025-09-23 14:23:24.712564,0 days 00:00:01.092715,0.3027781854543518,gbtree,0.24473624060201227,4.1305806940495255,lossguide,0.07915812312609162,0.020928778838239157,6,11,10.900368321876053,800,,0.302145310457082,0.8607723281864419,oversample,0.8953614666296341,0.6576830011967641,,,,0.3725476069643179,0.7759238407206469,0.7864455364455365,0.302145310457082,0.6551126516464472,0.6657051282051282,0.8607723281864419,0.8001248160409136,0.7924906409202096,0.5185831878273883,0.5321547527542916,0.8892215568862275,0.8887462558836114,oversample,0.9097660265143627,0.9088345916075016,0.8953614666296341,COMPLETE
665,0.0,2025-09-23 14:23:24.839562,2025-09-23 14:23:35.716674,0 days 00:00:10.877112,0.05125631402170803,dart,0.7447482291525576,0.9292052639984161,lossguide,0.0015846916624828941,0.0044450016745232294,8,4,56.04478890419304,400,tree,0.6910601274367715,0.8440686412247809,none,0.6632353242143549,0.5773169485113329,0.30790259396142816,uniform,0.421767729938689,0.5247973150086529,0.7606715119254785,0.7607493857493858,0.6910601274367715,0.0,0.0,0.8440686412247809,0.748341142857623,0.7437414837025024,0.0,0.0,0.0,0.0,none,0.8955821271696184,0.893340167279666,0.6632353242143549,COMPLETE
666,0.6590139254798645,2025-09-23 14:23:35.847855,2025-09-23 14:24:19.244048,0 days 00:00:43.396193,0.3215842115818582,dart,0.36122336751773293,9.975713050264176,lossguide,0.01722208202267867,0.4462796116906661,9,12,61.575767221776005,700,tree,0.5765630488188775,0.5179686028292285,oversample,0.5952690775801637,0.8557639876690442,0.055785770159552606,weighted,0.09978271722076719,0.9449751101532355,0.8153342204933974,0.8144963144963145,0.5765630488188775,0.6639344262295082,0.6590139254798645,0.5179686028292285,0.7518638364789522,0.7442939518283649,0.5881188118811881,0.5881760161236144,0.7621899059024807,0.7492511767222936,oversample,0.8943948425888866,0.8894897671327604,0.5952690775801637,COMPLETE
667,0.5578446909667195,2025-09-23 14:24:19.470672,2025-09-23 14:24:34.513225,0 days 00:00:15.042553,0.000578077257669983,dart,0.48488659743635343,8.535182884087817,depthwise,0.036607232132995965,0.0024839002826323765,2,3,5.24722635986505,400,tree,0.378222419695714,0.75459895786871,oversample,0.5217556162153014,0.976347374536786,0.01585286689162979,weighted,0.1376945560601787,0.6104668329186499,0.6235029173917495,0.6286855036855037,0.378222419695714,0.5543978677005088,0.5578446909667195,0.75459895786871,0.7323337589714303,0.7243526437602604,0.3867478025693036,0.39004432321854754,0.9786142001710864,0.979032948224219,oversample,0.892636061287656,0.8900133690370753,0.5217556162153014,COMPLETE
668,0.6916717080056463,2025-09-23 14:24:34.754746,2025-09-23 14:24:35.577923,0 days 00:00:00.823177,16.588130600775756,gbtree,0.27182224872059235,0.89474077142642,lossguide,0.018786678517188658,0.049898534531391134,4,10,39.51303102011287,600,,0.5562120563703974,0.7784687056987215,oversample,0.7589067531038505,0.659270155304181,,,,0.5750623715131515,0.8487050875217524,0.8434684684684685,0.5562120563703974,0.7034510433386838,0.6916717080056463,0.7784687056987215,0.786233173881027,0.780238443087885,0.6625094482237339,0.6540808543096872,0.7497861420017109,0.733846812152332,oversample,0.9123325527271772,0.9097525216588247,0.7589067531038505,COMPLETE
669,0.0,2025-09-23 14:24:35.831731,2025-09-23 14:24:37.277341,0 days 00:00:01.445610,2.345102358020933,gbtree,0.6192579213519249,4.993711533041363,lossguide,0.08379900453880325,0.00016778559320205515,6,6,6.218835519739379,500,,0.3173881645296451,0.6570740680367612,none,0.7200772311995587,0.7609680591955377,,,,0.7230354094967251,0.7606715119254785,0.7607493857493858,0.3173881645296451,0.0,0.0,0.6570740680367612,0.7099202391214108,0.7016917479178466,0.0,0.0,0.0,0.0,none,0.8746405338006149,0.8779918885179969,0.7200772311995587,COMPLETE
670,0.5548098434004475,2025-09-23 14:24:37.491246,2025-09-23 14:25:21.193487,0 days 00:00:43.702241,0.0009885971418594486,dart,0.2715374922809082,6.273683753983099,depthwise,0.00014263626896458595,0.004683462254010197,6,9,59.90487564552713,700,tree,0.6216136206487841,0.5767379801518624,oversample,0.8875889040235959,0.6772825272278336,0.08301213753163439,uniform,0.8972985198002599,0.8605899941262745,0.8370355205241069,0.8370188370188371,0.6216136206487841,0.558023320377568,0.5548098434004475,0.5767379801518624,0.7396515309122393,0.7332939913105733,0.7950949367088608,0.8006456820016142,0.4298545765611634,0.4244758237056055,oversample,0.8930351995702925,0.8870744496493688,0.8875889040235959,COMPLETE
671,0.5069686411149826,2025-09-23 14:25:21.322931,2025-09-23 14:26:28.899922,0 days 00:01:07.576991,0.0001283556548000829,dart,0.4757931920907523,2.532462573545379,depthwise,40.66680898414467,0.03076050906158185,9,4,1.0925336403165413,1000,forest,0.6957159078485553,0.8014483937902888,undersample,0.5374156722368756,0.7528821338623036,0.25762985527984406,weighted,0.09322442171299854,0.9148039333267213,0.8306889139113522,0.8261670761670762,0.6957159078485553,0.5244393329499712,0.5069686411149826,0.8014483937902888,0.7388999016442972,0.7303607025127538,0.8,0.7886178861788617,0.3900769888793841,0.3735558408215661,undersample,0.894651495210168,0.8932700024363354,0.5374156722368756,COMPLETE
672,0.47611236415829405,2025-09-23 14:26:29.026218,2025-09-23 14:26:35.858512,0 days 00:00:06.832294,0.3296716576109844,dart,0.437974449519552,8.228607468192273,depthwise,0.2872777614318786,0.004770141398804043,3,3,4.235670461682877,300,tree,0.45293074093272123,0.7539280527949506,oversample,0.942667949599213,2.3133370425837207,0.39600577071792603,uniform,0.7138468763921203,0.45422275313959637,0.47527894359709283,0.47686322686322685,0.45293074093272123,0.47629750715161423,0.47611236415829405,0.7539280527949506,0.7095403907592543,0.7049158999032312,0.31288590604026845,0.31306458136712956,0.9970059880239521,0.993581514762516,oversample,0.8811929747978522,0.8786399560020078,0.942667949599213,COMPLETE
673,0.5551774428779777,2025-09-23 14:26:35.992809,2025-09-23 14:26:36.643671,0 days 00:00:00.650862,77.30505258833196,gbtree,0.40436469586965285,5.965606514334484,lossguide,0.000571853410890548,0.002284419293560602,3,3,2.1979554483646804,500,,0.6076067179324325,0.927872535265831,oversample,0.6114562192089219,4.48915128216679,,,,0.489246769967537,0.6212508956904493,0.6253071253071253,0.6076067179324325,0.5533558667310478,0.5551774428779777,0.927872535265831,0.7128640929265904,0.7029475827723307,0.3854692230070636,0.38771006620268206,0.9803250641573995,0.97732135216089,oversample,0.8827699005357414,0.8796443756673507,0.6114562192089219,COMPLETE
674,0.0,2025-09-23 14:26:36.773918,2025-09-23 14:26:37.330943,0 days 00:00:00.557025,0.133250232945486,gbtree,0.6978126136166412,1.4000808111874752,depthwise,12.057826524533818,0.0014192547110361393,9,6,3.0168333408000065,300,,0.6512755309775775,0.5754825038482764,undersample,0.7451760631681603,0.8760386064868257,,,,0.9855538694913422,0.7606715119254785,0.7607493857493858,0.6512755309775775,0.0,0.0,0.5754825038482764,0.6897730403804836,0.6844032393294274,0.0,0.0,0.0,0.0,undersample,0.8744600020790071,0.877229893136957,0.7451760631681603,COMPLETE
675,0.6353206695504984,2025-09-23 14:26:37.464620,2025-09-23 14:26:49.423670,0 days 00:00:11.959050,46.923155268430975,dart,0.7791508369665183,9.527203152310205,lossguide,0.00034737812386393134,0.1084355178446394,4,11,12.002003406180002,400,tree,0.516740742996435,0.5494264458222937,none,0.8895854130696452,2.3162598070923663,0.17884968869162715,weighted,0.5419896229015059,0.3223167030088336,0.8023339133995291,0.8014946764946765,0.516740742996435,0.6415444588824949,0.6353206695504984,0.5494264458222937,0.727858051485186,0.7265757463457789,0.5667431944899968,0.5667785234899329,0.739093242087254,0.7227214377406932,none,0.8789514805097689,0.875031692224578,0.8895854130696452,COMPLETE
676,0.0,2025-09-23 14:26:49.556341,2025-09-23 14:27:02.108451,0 days 00:00:12.552110,0.004025702687275028,dart,0.32869121020142156,5.234164668673017,lossguide,0.04800178144999597,0.0004081940083905315,4,5,5.517347946534968,400,tree,0.6153729221739008,0.6856143325898869,none,0.6171135659017493,0.5837031418362326,0.09013157712169445,weighted,0.13830517868689507,0.9819422249435139,0.7606715119254785,0.7607493857493858,0.6153729221739008,0.0,0.0,0.6856143325898869,0.7581196676711768,0.751538983605972,0.0,0.0,0.0,0.0,none,0.9010191163897476,0.9001124422565221,0.6171135659017493,COMPLETE
677,0.5508708708708708,2025-09-23 14:27:02.401030,2025-09-23 14:27:04.468037,0 days 00:00:02.067007,54.03046177274709,gbtree,0.8674960751208776,0.9957892885632702,lossguide,0.028845146434719412,0.003399017243114252,3,9,51.37192765022747,500,,0.33196647731743156,0.7008312242426946,oversample,0.9023588019811134,2.1439135282887585,,,,0.5728008906860371,0.614699559832122,0.6172194922194922,0.33196647731743156,0.5500836720057375,0.5508708708708708,0.7008312242426946,0.7704290428407911,0.7600665487624169,0.38171864631718644,0.3829325317301269,0.9841745081266039,0.9811724433033804,oversample,0.9051518049315752,0.9016772881325481,0.9023588019811134,COMPLETE
678,0.38612143742255267,2025-09-23 14:27:04.688373,2025-09-23 14:28:26.193853,0 days 00:01:21.505480,0.012107100126143331,dart,0.8247116472850378,4.09120819321405,depthwise,4.374354031901431,0.0005112804598488345,4,5,0.2380451933591076,1000,tree,0.415055769403903,0.5428155466029324,undersample,0.6044266660585902,2.7182194629813217,0.43006626432738354,uniform,0.889231427969403,0.399240697228789,0.23932848807452145,0.23925061425061425,0.415055769403903,0.3862228462872718,0.38612143742255267,0.5428155466029324,0.735000452180832,0.725469241827045,0.23932848807452145,0.23925061425061425,1.0,1.0,undersample,0.8953846445179886,0.8926431542750717,0.6044266660585902,COMPLETE
679,0.38612143742255267,2025-09-23 14:28:26.487551,2025-09-23 14:28:31.452424,0 days 00:00:04.964873,54.47946098632262,dart,0.7438279130026875,3.4134748637695598,depthwise,0.5878450299954151,0.0002321631965174217,9,6,2.106456033773423,200,tree,0.5068290088775758,0.6865067357712016,undersample,0.9976129671942884,2.6577308075117134,0.2100143533667594,uniform,0.8756144065676745,0.3577514687058419,0.23932848807452145,0.23925061425061425,0.5068290088775758,0.3862228462872718,0.38612143742255267,0.6865067357712016,0.6567340011380778,0.6573062162044074,0.23932848807452145,0.23925061425061425,1.0,1.0,undersample,0.8668707915502982,0.8681633112784817,0.9976129671942884,COMPLETE
680,0.7086925287356322,2025-09-23 14:28:31.674150,2025-09-23 14:28:36.539512,0 days 00:00:04.865362,0.004693147402935569,gbtree,0.9968892084553336,0.8639705119030094,lossguide,0.001105961577286726,0.005584184953101903,0,7,2.578885994768864,1000,,0.6092330113112063,0.7998238437955086,oversample,0.8330814284063495,1.4469707810106514,,,,0.6701682946827641,0.8309960077797113,0.833947583947584,0.6092330113112063,0.7064888888888889,0.7086925287356322,0.7998238437955086,0.8209393720667844,0.8153137697166168,0.6045025859446304,0.610646858557722,0.8498716852010265,0.844244758237056,oversample,0.9241003257916948,0.9227999866637853,0.8330814284063495,COMPLETE
681,0.38612143742255267,2025-09-23 14:28:36.766050,2025-09-23 14:28:37.262085,0 days 00:00:00.496035,23.49166017608676,gbtree,0.8077526233863277,1.3021489360400018,depthwise,1.9274721082673962,0.0005654776880874641,8,4,74.59781291002234,300,,0.3059146846490476,0.6718338994913471,oversample,0.8152393303530243,0.7243604145686979,,,,0.5460893719445141,0.23932848807452145,0.23925061425061425,0.3059146846490476,0.3862228462872718,0.38612143742255267,0.6718338994913471,0.7317178404517337,0.7250813975991988,0.23932848807452145,0.23925061425061425,1.0,1.0,oversample,0.8893352346002961,0.8864128789599732,0.8152393303530243,COMPLETE
682,0.6127492277450154,2025-09-23 14:28:37.479607,2025-09-23 14:29:14.825267,0 days 00:00:37.345660,0.006767521984416771,dart,0.7113660522782892,7.856258371166796,lossguide,67.81385464680938,0.014146801806113492,9,9,0.30677543023838183,600,tree,0.5561954653132078,0.5911932935843561,oversample,0.8465475681748215,3.441348478900127,0.24195945729824442,uniform,0.7064640304160601,0.9058020999325127,0.7112293991196642,0.7176494676494677,0.5561954653132078,0.6066099567703249,0.6127492277450154,0.5911932935843561,0.7329699077964803,0.7223052504666938,0.4500310366232154,0.4560083594566353,0.9302822925577416,0.9336756525459992,oversample,0.8898871327073058,0.8889314427003141,0.8465475681748215,COMPLETE
683,0.609308885754584,2025-09-23 14:29:14.959520,2025-09-23 14:29:15.664974,0 days 00:00:00.705454,0.00023014337998711446,gbtree,0.4300848823427023,4.711848511905746,depthwise,0.00016060745693205258,0.0006374165505013931,5,3,1.4678880818339015,700,,0.5956051857329888,0.6192383354450429,oversample,0.7540280668644781,1.8162704744928602,,,,0.7892891576677299,0.7135837854437507,0.7164209664209664,0.5956051857329888,0.6093270036302709,0.609308885754584,0.6192383354450429,0.7225707915631397,0.7188777791884301,0.45232172470978443,0.45444982116557964,0.9332763045337895,0.9242618741976893,oversample,0.8839046343554888,0.8817045790031662,0.7540280668644781,COMPLETE
684,0.6956711849584609,2025-09-23 14:29:15.800871,2025-09-23 14:29:17.505146,0 days 00:00:01.704275,0.2789082557485059,gbtree,0.8177811055116446,1.177964063058592,depthwise,2.160179117319394,0.05359986218294739,2,10,0.25242233412778176,600,,0.644746010778082,0.8699236485988131,none,0.7628336475526442,3.0449517543353717,,,,0.23626525117761626,0.8520831200737026,0.8574938574938575,0.644746010778082,0.6897144084174361,0.6956711849584609,0.8699236485988131,0.7944801181369161,0.7915514557995136,0.692539887882708,0.711220384443451,0.6869118905047049,0.6807873341891314,none,0.9112897971287369,0.9098230032084652,0.7628336475526442,COMPLETE
685,0.5897166841552991,2025-09-23 14:29:17.640586,2025-09-23 14:29:21.056924,0 days 00:00:03.416338,0.004168416111656164,dart,0.3421058341400934,0.4165785290111035,depthwise,0.0002983716266833475,0.04996635855962593,6,12,44.23948731029719,200,tree,0.3362029238891393,0.8632189155528632,oversample,0.5664211623464142,1.2639089359357523,0.1926246974307817,uniform,0.20709347931619543,0.20654869683446925,0.6712048316101955,0.6797706797706797,0.3362029238891393,0.5833981841763943,0.5897166841552991,0.8632189155528632,0.7629278967335874,0.7617911252781691,0.4186522710349963,0.425193871760923,0.9619332763045337,0.9619169875909286,oversample,0.9007869260613671,0.901055219357412,0.5664211623464142,COMPLETE
686,0.6547583308315821,2025-09-23 14:29:21.192844,2025-09-23 14:29:21.711646,0 days 00:00:00.518802,1.3861030859960737,gbtree,0.40169838276074954,6.944651037408553,depthwise,0.006092202546938672,0.31951428152338257,0,3,0.5239277357126858,800,,0.3208880600195845,0.819690856459622,undersample,0.5701339207140079,1.0358665262985731,,,,0.5744164558560195,0.7534036237076467,0.7645372645372646,0.3208880600195845,0.6435863293386596,0.6547583308315821,0.819690856459622,0.7966608480717816,0.7917562055051554,0.49197014250169646,0.5042774566473989,0.9302822925577416,0.9332477535301669,undersample,0.9157071404224253,0.9148537101885055,0.5701339207140079,COMPLETE
687,0.5819128171763175,2025-09-23 14:29:21.846913,2025-09-23 14:29:22.388870,0 days 00:00:00.541957,4.557867961271271,gbtree,0.34622800426671785,3.685303812780283,lossguide,0.0020491175975531095,0.1850033624933258,10,11,34.77834036286866,600,,0.41800232947008353,0.770091984766234,undersample,0.5458317171516579,2.9187318639235498,,,,0.4093852902018984,0.6661889650936637,0.6710687960687961,0.41800232947008353,0.5767683322517846,0.5819128171763175,0.770091984766234,0.7017386835625516,0.689955387369668,0.4140115520775107,0.4181002243829469,0.9503849443969205,0.9567821994009413,undersample,0.8787297945777515,0.8801420076542734,0.5458317171516579,COMPLETE
688,0.5371049828382057,2025-09-23 14:29:22.523533,2025-09-23 14:29:52.770186,0 days 00:00:30.246653,0.004723542211639313,dart,0.39637184794369146,2.208551524666278,lossguide,0.0018917275266780859,0.0018758159373024393,1,8,0.2124998170154748,600,forest,0.3611801717450713,0.5158464533424492,none,0.8198977792088816,3.151543564692185,0.10017397417229046,uniform,0.4752859689895506,0.9458761889934137,0.590848602722899,0.5996109746109746,0.3611801717450713,0.5319124019205996,0.5371049828382057,0.5158464533424492,0.7319964899684731,0.7293880658604174,0.36623125302370585,0.3712369109947644,0.9713430282292558,0.9709028669234061,none,0.8909857774502324,0.8914371366478894,0.8198977792088816,COMPLETE
689,0.6096991344964968,2025-09-23 14:29:52.931228,2025-09-23 14:30:27.784978,0 days 00:00:34.853750,0.01388128181380558,dart,0.2634276191507711,4.4976085981888145,depthwise,0.2962920673299736,0.22856002281293694,2,8,33.37896848859155,600,forest,0.5404468469400795,0.8660982005721569,oversample,0.7252617441715437,2.6514103227499484,0.16640829413688596,weighted,0.3300205189851768,0.6258461606740098,0.7028355000511823,0.7091523341523341,0.5404468469400795,0.6059454323333786,0.6096991344964968,0.8660982005721569,0.7679563318828577,0.7597081905256414,0.4438258103002585,0.4490084985835694,0.9546621043627032,0.9495079161317929,oversample,0.9038096596471974,0.9022365914754062,0.7252617441715437,COMPLETE
690,0.6389489439547646,2025-09-23 14:30:28.008050,2025-09-23 14:30:29.065104,0 days 00:00:01.057054,13.748457313149444,gbtree,0.33888743957392997,0.37358176811850496,depthwise,0.002162292461129452,0.0013464973924710625,3,10,0.26982487218158674,500,,0.5627750148203599,0.7243493344948432,undersample,0.8212995110995194,1.2304842637662512,,,,0.9899087674303646,0.7753096529839287,0.7777436527436528,0.5627750148203599,0.6395138774839875,0.6389489439547646,0.7243493344948432,0.7381049587241775,0.7322549083419916,0.5190615835777126,0.5225788900979326,0.8327630453378957,0.8219940094137783,undersample,0.8898321644961993,0.887337862924557,0.8212995110995194,COMPLETE
691,0.24200581395348839,2025-09-23 14:30:29.291029,2025-09-23 14:30:30.266830,0 days 00:00:00.975801,0.000884522152680897,gbtree,0.4962910051737945,9.850581154858148,depthwise,4.92769768886069,0.007018510304296411,8,3,44.67988182814248,900,,0.5262167054675344,0.5507396953050216,none,0.7581930217833306,0.5299433956860203,,,,0.7129983454950555,0.7900501586651654,0.7864455364455365,0.5262167054675344,0.25929938605994945,0.24200581395348839,0.5507396953050216,0.6437333760438593,0.6339291988315137,0.8329466357308585,0.8024096385542169,0.15355004277159967,0.14249037227214378,none,0.844275921310387,0.848750279781233,0.7581930217833306,COMPLETE
692,0.38612143742255267,2025-09-23 14:30:30.488724,2025-09-23 14:30:35.956203,0 days 00:00:05.467479,0.026610588403835907,dart,0.9944840830539821,5.361156701786035,lossguide,0.2786782674465489,0.001534807892115014,4,11,1.0002568718461886,200,tree,0.3365050697067593,0.9663600019920624,none,0.9984761038296546,2.533784549563365,0.3546973768519717,uniform,0.2537985878184307,0.6738865556549078,0.23932848807452145,0.23925061425061425,0.3365050697067593,0.3862228462872718,0.38612143742255267,0.9663600019920624,0.7935679749483107,0.7907412128427539,0.23932848807452145,0.23925061425061425,1.0,1.0,none,0.9104011539755715,0.9094346924813405,0.9984761038296546,COMPLETE
