number,value,datetime_start,datetime_complete,duration,params_alpha,params_booster,params_colsample_bytree,params_gamma,params_grow_policy,params_lambda,params_learning_rate,params_max_delta_step,params_max_depth,params_min_child_weight,params_n_estimators,params_normalize_type,params_params_decision_threshold,params_params_feature_fraction,params_params_resampling,params_params_sample_rows,params_params_scale_pos_weight,params_rate_drop,params_sample_type,params_skip_drop,params_subsample,user_attrs_acc_test,user_attrs_acc_val,user_attrs_decision_threshold,user_attrs_f1_test,user_attrs_f1_val,user_attrs_feature_fraction,user_attrs_pr_auc_test,user_attrs_pr_auc_val,user_attrs_prec_test,user_attrs_prec_val,user_attrs_rec_test,user_attrs_rec_val,user_attrs_resampling_strategy,user_attrs_roc_auc_test,user_attrs_roc_auc_val,user_attrs_sample_rows,state
1712,0.719804798698658,2025-09-23 22:03:41.268172,2025-09-23 22:03:41.981990,0 days 00:00:00.713818,0.00043744070572590625,gbtree,0.42717523711554123,5.904210474526665,depthwise,0.28068004750280706,0.15717023032915053,1,9,0.2919967858087784,500,,0.6502766769114072,0.9664126970901116,none,0.8104252538932444,3.2238317489198836,,,,0.8231499909375123,0.8617053946156208,0.8589271089271089,0.6502766769114072,0.7269051950677178,0.719804798698658,0.9664126970901116,0.8261968175187683,0.8180128490879719,0.689152932157915,0.6857807051530415,0.7690333618477331,0.7573812580231065,none,0.927649228908237,0.9252862463605406,0.8104252538932444,COMPLETE
1713,0.716927453769559,2025-09-23 22:03:42.117602,2025-09-23 22:03:43.177833,0 days 00:00:01.060231,0.0006349092102634499,gbtree,0.2434213953628338,4.153266061513432,lossguide,0.00039614521934237823,0.04312782257534379,8,6,4.763830910263416,800,,0.3898689956336862,0.9229113502146911,none,0.9994230458202586,1.1677149091661931,,,,0.7987404931317018,0.8584297266864571,0.8573914823914824,0.3898689956336862,0.7202103985433947,0.716927453769559,0.9229113502146911,0.8253219276812276,0.8176323776695006,0.6833013435700576,0.6826625386996904,0.7613344739093242,0.754813863928113,none,0.926079181391528,0.9239350044946383,0.9994230458202586,COMPLETE
1714,0.7158224134558967,2025-09-23 22:03:43.318277,2025-09-23 22:03:44.172642,0 days 00:00:00.854365,0.00024775776228271203,gbtree,0.40485371293151123,8.180147795884803,depthwise,3.67735661161537,0.05523635052920696,0,12,1.2643064018301169,500,,0.683681458660387,0.9209173641393024,none,0.9470419255754376,4.390609353942988,,,,0.5752779535826282,0.8512642030914116,0.8512489762489762,0.683681458660387,0.7183562705950766,0.7158224134558967,0.9209173641393024,0.8243554317413533,0.8176297603682503,0.6568592697624955,0.659221902017291,0.7925577416595381,0.7830551989730423,none,0.9267505706045663,0.9250243590339351,0.9470419255754376,COMPLETE
1715,0.6814888010540184,2025-09-23 22:03:44.310728,2025-09-23 22:04:27.185235,0 days 00:00:42.874507,0.0015378674760991907,dart,0.27464223216021877,5.160284625544846,depthwise,0.01548358237995984,0.12981913137795276,6,6,3.951538680509222,800,tree,0.44209278047450656,0.8291133212984642,oversample,0.9864000101810928,1.0934916337912535,0.1103624793866732,uniform,0.5803415140649043,0.5025176795961284,0.7958849421639881,0.802006552006552,0.44209278047450656,0.6759831004224894,0.6814888010540184,0.8291133212984642,0.814976683910542,0.8091160813520144,0.5450733752620545,0.5539491298527444,0.8896492728828058,0.8853230637569534,oversample,0.920405627409464,0.9195300803910021,0.9864000101810928,COMPLETE
1716,0.6681701030927835,2025-09-23 22:04:27.321378,2025-09-23 22:04:28.894162,0 days 00:00:01.572784,0.000884980209583685,gbtree,0.42727513672023465,0.17275384124321058,lossguide,0.0001452449602038584,0.11326758557248186,7,7,0.5408427482584061,400,,0.4019398288738289,0.8754260005532258,undersample,0.6459923752332076,1.4563268518837258,,,,0.37233642576816645,0.780427884123247,0.7891072891072891,0.4019398288738289,0.6597938144329897,0.6681701030927835,0.8754260005532258,0.7817453493801247,0.7839934711780909,0.5243256869170658,0.5357788685094291,0.8896492728828058,0.8874625588361147,undersample,0.9078790915775001,0.9096579416381675,0.6459923752332076,COMPLETE
1717,0.6624485922176526,2025-09-23 22:04:29.032133,2025-09-23 22:04:29.642625,0 days 00:00:00.610492,0.004353643104960467,gbtree,0.5912814193150899,6.953592773178728,depthwise,3.8718526216897096,0.29103391884505003,0,11,0.19161225404566384,300,,0.559060021658879,0.7593932244826807,oversample,0.9014772792071997,2.434296931052406,,,,0.7082239357013392,0.7808373426143924,0.7815315315315315,0.559060021658879,0.6654164713236443,0.6624485922176526,0.7593932244826807,0.7973410204993824,0.78860347156981,0.5242551095789214,0.5254705144291092,0.9106073567151411,0.8960205391527599,oversample,0.9151814313584031,0.9106945789726473,0.9014772792071997,COMPLETE
1718,0.6946454413892909,2025-09-23 22:04:29.779133,2025-09-23 22:04:31.173904,0 days 00:00:01.394771,0.00016703712502538065,gbtree,0.7568880626163262,3.0549654005152753,depthwise,0.02330184627256194,0.02190360026367474,5,9,0.2746754094240604,1000,,0.5672411602080747,0.8723935562770542,none,0.931528492694743,1.2094413658387517,,,,0.8214757605333617,0.8732725969904801,0.8703931203931204,0.5672411602080747,0.7039693926351028,0.6946454413892909,0.8723935562770542,0.8296580112794616,0.8239223478810115,0.7982646420824295,0.7960199004975125,0.6295979469632165,0.6161745827984596,none,0.928149209395961,0.9264000736601293,0.931528492694743,COMPLETE
1719,0.6888743025927141,2025-09-23 22:04:31.311311,2025-09-23 22:04:35.042564,0 days 00:00:03.731253,0.0001260320399716655,dart,0.9623130571757879,7.5377896564099816,depthwise,0.00017756687016190226,0.05806599699149972,1,10,0.12505710100571055,200,forest,0.6807635964145115,0.8415950567861302,oversample,0.9152762929187028,4.892137862192055,0.1864093487103874,weighted,0.8959540029124782,0.668513844413628,0.8039717473641109,0.8058968058968059,0.6807635964145115,0.6878565607171964,0.6888743025927141,0.8415950567861302,0.8242659238863614,0.8172990593596625,0.5557018698972873,0.5586904445035933,0.9024807527801539,0.8981600342319213,oversample,0.9257708989426418,0.9241580233196037,0.9152762929187028,COMPLETE
1720,0.6912511759172154,2025-09-23 22:04:35.177648,2025-09-23 22:04:35.906363,0 days 00:00:00.728715,0.2322841597686216,gbtree,0.4709156965740684,6.9222248803045385,depthwise,7.549768179420246,0.39396668326178375,2,9,0.41316169518073076,600,,0.6500805443862003,0.8646731217532716,none,0.9320148578179817,4.188081413376345,,,,0.6203255236374836,0.8325314771215068,0.832002457002457,0.6500805443862003,0.6960237829803048,0.6912511759172154,0.8646731217532716,0.7924172050344807,0.7819821359256837,0.6153088042049935,0.6168569509738079,0.8011120615911035,0.7860504920838682,none,0.9123020468089716,0.9077162152536469,0.9320148578179817,COMPLETE
1721,0.6977485554891413,2025-09-23 22:04:36.042009,2025-09-23 22:05:02.303859,0 days 00:00:26.261850,0.11701676633080761,dart,0.5675717701078957,9.15715843197315,depthwise,0.0001994510346384901,0.00246646621922123,6,10,0.5589838541082973,600,forest,0.6619858192284284,0.8014274210268322,undersample,0.9470261822954585,1.3754054039980164,0.0743193675255838,uniform,0.7909479944690466,0.48353724924243585,0.8458388780837343,0.8446969696969697,0.6619858192284284,0.7034265458842064,0.6977485554891413,0.8014274210268322,0.7933998154691563,0.7872721883616435,0.6518248175182482,0.6528709917971663,0.7639007698887939,0.7492511767222936,undersample,0.9139744906058463,0.9124774051641671,0.9470261822954585,COMPLETE
1722,0.7081942899517983,2025-09-23 22:05:02.439858,2025-09-23 22:05:07.169128,0 days 00:00:04.729270,0.6571360515799642,dart,0.9214303941043502,9.691146595927055,lossguide,0.00022817946593813357,0.01635049189623441,7,12,6.648897630433332,200,forest,0.6476955690662737,0.8819944877837308,none,0.9736057518130022,4.569342096384647,0.13893940428924612,uniform,0.5252482931676189,0.7858231569330557,0.8383662606203296,0.8388615888615889,0.6476955690662737,0.7096892811178526,0.7081942899517983,0.8819944877837308,0.8199561437908796,0.812151780508869,0.6223798774588842,0.624795551193981,0.825491873396065,0.8172871202396235,none,0.923926844966276,0.9212646808490056,0.9736057518130022,COMPLETE
1723,0.6923076923076923,2025-09-23 22:05:07.305997,2025-09-23 22:05:08.097882,0 days 00:00:00.791885,0.0010946580847002896,gbtree,0.4464730660933133,6.998299884773591,depthwise,1.2679979895726474,0.41683423615882353,1,11,0.32214334934785127,800,,0.6956939505792293,0.9180927006593903,none,0.8435488332820686,2.0574305881016657,,,,0.47746623822935563,0.8690756474562391,0.8665028665028665,0.6956939505792293,0.697421339011119,0.6923076923076923,0.9180927006593903,0.8134722747543124,0.8042783447644843,0.7803070407623081,0.7716991057338243,0.630453378956373,0.6277278562259306,none,0.9214482391120635,0.9188122223529356,0.8435488332820686,COMPLETE
1724,0.7057815845824411,2025-09-23 22:05:08.237586,2025-09-23 22:05:09.138188,0 days 00:00:00.900602,0.005062589865601299,gbtree,0.6807431969612026,4.444556568815965,depthwise,0.682109873493125,0.18501132704421225,1,12,0.11768855667159638,500,,0.6799231332294566,0.9604320470295877,none,0.8645303601847039,3.105779481785416,,,,0.5164397492489343,0.8627290408434845,0.8593366093366094,0.6799231332294566,0.712540192926045,0.7057815845824411,0.9604320470295877,0.8131629624713245,0.8114983966326738,0.7142243231628707,0.7063866266609515,0.7108639863130881,0.7051775780915703,none,0.921953169616704,0.919954610803359,0.8645303601847039,COMPLETE
1725,0.6898831827198589,2025-09-23 22:05:09.274278,2025-09-23 22:06:03.059407,0 days 00:00:53.785129,0.00040773055093217545,dart,0.3018131893511142,6.949811092018242,lossguide,0.00021409243421066122,0.1951497123483363,7,7,91.76541901423963,900,forest,0.4486414555499287,0.8879314234113774,none,0.9892537349531275,1.1744858976112496,0.19426927185303536,weighted,0.7138644871077675,0.532516086766367,0.8535162247927116,0.855958230958231,0.4486414555499287,0.6892508143322476,0.6898831827198589,0.8879314234113774,0.7862492877484155,0.7831215094858432,0.7000441111601235,0.7113636363636363,0.6787852865697177,0.6696619597774925,none,0.9101988364236979,0.9103424015563062,0.9892537349531275,COMPLETE
1726,0.6910008410428932,2025-09-23 22:06:03.193469,2025-09-23 22:06:04.233343,0 days 00:00:01.039874,0.00014901367763357109,gbtree,0.44310946568271237,1.9130235651334342,depthwise,0.00035191683082897373,0.05282895316782847,1,9,0.44690727001741454,500,,0.6892591526427078,0.8219401584408869,undersample,0.9227500391210836,3.259514766090082,,,,0.7231752116663526,0.8131845634148838,0.8119369369369369,0.6892591526427078,0.693637737115998,0.6910008410428932,0.8219401584408869,0.8177636457091644,0.8102291049989429,0.5708759325780602,0.5692904656319291,0.88366124893071,0.8789045785194695,undersample,0.9236448954562182,0.9218231204473828,0.9227500391210836,COMPLETE
1727,0.7123115577889447,2025-09-23 22:06:04.370141,2025-09-23 22:06:06.139711,0 days 00:00:01.769570,0.00010152859233213323,gbtree,0.6483237468453741,4.95536434223774,lossguide,0.18027299439051853,0.026722409936806565,0,8,0.1082469552662238,700,,0.6172003848532762,0.9371356780926707,none,0.7647630017158495,2.7756209784738153,,,,0.5195786025589652,0.8616030299928344,0.8593366093366094,0.6172003848532762,0.718801996672213,0.7123115577889447,0.9371356780926707,0.8167778942342132,0.8096222016527783,0.6995951417004048,0.6974169741697417,0.739093242087254,0.7278562259306803,none,0.920609297582239,0.9194236382794742,0.7647630017158495,COMPLETE
1728,0.676716368998853,2025-09-23 22:06:06.276520,2025-09-23 22:06:09.969013,0 days 00:00:03.692493,0.00028492445621103253,dart,0.9379556028143988,9.64997457627543,depthwise,0.0011200966938315737,0.01478262365395145,5,12,3.322182024820512,200,forest,0.6692986848547744,0.9440799045012653,oversample,0.7879300471166694,2.5136774865964133,0.09566387243048402,uniform,0.619323506623216,0.2493632529082025,0.7920974511208926,0.798013923013923,0.6692986848547744,0.6711996114618747,0.676716368998853,0.9440799045012653,0.8038740942871399,0.7948887102126158,0.5399843709299297,0.5483271375464684,0.886655260906758,0.8836114676936243,oversample,0.9152914828972885,0.9132851502112116,0.7879300471166694,COMPLETE
1729,0.695194430293768,2025-09-23 22:06:10.105872,2025-09-23 22:06:27.658063,0 days 00:00:17.552191,0.00012495527197941135,dart,0.7980698918332809,6.188651975774466,depthwise,0.0003554565153175952,0.18190845122696275,4,12,0.3375925517222725,500,forest,0.689409366830707,0.9749647774838485,undersample,0.9547263995539114,3.0594792537701427,0.14242672038869642,weighted,0.6958026355566908,0.939985394107792,0.8111372709591566,0.8162366912366913,0.689409366830707,0.6905919839007211,0.695194430293768,0.9749647774838485,0.8214809594532868,0.8142500839672109,0.568,0.576295045045045,0.8806672369546621,0.8759092854086435,undersample,0.9248019043520894,0.9226975465683518,0.9547263995539114,COMPLETE
1730,0.6770470782194541,2025-09-23 22:06:27.795546,2025-09-23 22:06:28.618815,0 days 00:00:00.823269,0.0015906086013489703,gbtree,0.5041506024656769,8.870384828000535,depthwise,0.09728208036925864,0.48309767586414254,0,8,0.6594239633366871,600,,0.5986366402871136,0.9395310880858277,none,0.7741946904906475,4.598185736000279,,,,0.46297066494556427,0.8175862421946976,0.8195126945126945,0.5986366402871136,0.6805306561491574,0.6770470782194541,0.9395310880858277,0.7792225259816743,0.7762946015224048,0.5858024691358025,0.5919282511210763,0.8118049615055604,0.7907573812580231,none,0.9042473620151128,0.9021756974895037,0.7741946904906475,COMPLETE
1731,0.6995553673512598,2025-09-23 22:06:28.753841,2025-09-23 22:06:29.593783,0 days 00:00:00.839942,0.0009105360862448797,gbtree,0.29330493289624265,5.359568006664203,depthwise,0.00018784709400897868,0.06307379701875399,7,5,44.377976335886146,900,,0.5118030623268741,0.8674647511571899,none,0.9458016593937065,1.5438737373646776,,,,0.6465445068805137,0.8597604667826799,0.8547297297297297,0.5118030623268741,0.7123057538849223,0.6995553673512598,0.8674647511571899,0.810281169584061,0.8014068418952558,0.6996699669966997,0.6923721709974854,0.7254063301967494,0.7068891741548995,none,0.9194738730624569,0.917863427832162,0.9458016593937065,COMPLETE
1732,0.6866639643291447,2025-09-23 22:06:29.730047,2025-09-23 22:07:01.418281,0 days 00:00:31.688234,0.09802278432273383,dart,0.24268607761484776,5.604734285245833,lossguide,0.00041490714160235273,0.37452355801410425,4,8,0.10855955069508916,700,forest,0.476073428555842,0.8795996546460505,none,0.962836236009547,1.5304852039603947,0.2635173965033461,uniform,0.47591889863820325,0.9746802284518923,0.8475790766711024,0.8417280917280917,0.476073428555842,0.701423701624223,0.6866639643291447,0.8795996546460505,0.7868117287099493,0.7794064878585427,0.6602491506228766,0.6522911051212938,0.7480752780153977,0.7248609328198545,none,0.9117386945930505,0.9078457193428148,0.962836236009547,COMPLETE
1733,0.6573692551505547,2025-09-23 22:07:01.552585,2025-09-23 22:07:08.470006,0 days 00:00:06.917421,0.002247091604328738,dart,0.9736550790161225,6.056922536112351,lossguide,0.012081104539640617,0.1902364413508372,0,9,1.0933855942766761,300,forest,0.6956960731914977,0.7849635806484999,undersample,0.9509662242326389,3.279369561499916,0.2300569426524207,uniform,0.6486279941293733,0.6208757752271403,0.769781963353465,0.7786650286650286,0.6956960731914977,0.6497430306805794,0.6573692551505547,0.7849635806484999,0.7797056684573708,0.7680948291284586,0.5108988488856233,0.5220236597029952,0.8922155688622755,0.8874625588361147,undersample,0.9051202629633174,0.9020324886545721,0.9509662242326389,COMPLETE
1734,0.7202072538860104,2025-09-23 22:07:08.606880,2025-09-23 22:07:43.972970,0 days 00:00:35.366090,0.00034403273768549925,dart,0.8794823961092859,8.98595247831225,depthwise,0.004058727098666786,0.04076254651965314,5,12,0.163533304709293,700,tree,0.699268571004887,0.8187092643497703,none,0.9844320022597036,3.2607979307007855,0.05963683999476632,uniform,0.39527905717767464,0.3992190139403655,0.8702016583068891,0.8673218673218673,0.699268571004887,0.7273118279569892,0.7202072538860104,0.8187092643497703,0.8244152512861573,0.8182937345207217,0.731401384083045,0.726797385620915,0.723267750213858,0.7137355584082157,none,0.9265145526468259,0.9243462332419895,0.9844320022597036,COMPLETE
1735,0.6706436420722135,2025-09-23 22:07:44.109972,2025-09-23 22:08:37.161207,0 days 00:00:53.051235,0.0001903575678652922,dart,0.2511761899304032,3.2759432958915276,lossguide,0.00013213430875218875,0.20472118181328675,9,5,3.908593663334274,900,forest,0.5073222445766227,0.8473987136346146,undersample,0.9459270303066025,1.5503671796043645,0.16271052896647753,uniform,0.6356724650325173,0.683275878658702,0.7820657180878289,0.7852170352170352,0.5073222445766227,0.6677071952551896,0.6706436420722135,0.8473987136346146,0.8119816919678452,0.8036574593137702,0.5256819857458835,0.5296305479791719,0.9148845166809239,0.9139922978177151,undersample,0.9219433559203757,0.9185169369064023,0.9459270303066025,COMPLETE
1736,0.7111008963456676,2025-09-23 22:08:37.300504,2025-09-23 22:08:48.842184,0 days 00:00:11.541680,0.007851125445682951,dart,0.986735090530688,8.59242088011032,lossguide,0.013364126014437807,0.24564063708025985,5,10,1.1889250976349874,400,forest,0.6998075179972684,0.9757408522457587,none,0.9440475667469965,2.7472014334147543,0.08950577199804148,weighted,0.8193968079174623,0.8499144874367814,0.8717371276486846,0.8713144963144963,0.6998075179972684,0.7142531356898517,0.7111008963456676,0.9757408522457587,0.8271507256638562,0.8197633906882128,0.7650219833903273,0.7681231380337636,0.669803250641574,0.6619597774925118,none,0.9278550287394529,0.92509766214888,0.9440475667469965,COMPLETE
1737,0.6019716574245225,2025-09-23 22:08:48.979874,2025-09-23 22:08:49.985856,0 days 00:00:01.005982,0.0002822689302895147,gbtree,0.4645192088593721,5.316121850775962,depthwise,0.008680422224236558,0.48188600334871695,0,12,0.11152002572638868,700,,0.49105461419511337,0.7751256471338288,undersample,0.8630689384258571,3.3971002939950092,,,,0.5462417603804202,0.7329306991503737,0.7354627354627354,0.49105461419511337,0.6008872571515986,0.6019716574245225,0.7751256471338288,0.6334631101693661,0.6219562254399222,0.4677304120028578,0.47027677496991577,0.8400342172797263,0.8361146769362431,undersample,0.8470063161064687,0.8438700946727292,0.8630689384258571,COMPLETE
1738,0.683982683982684,2025-09-23 22:08:50.127551,2025-09-23 22:09:40.062400,0 days 00:00:49.934849,0.00021329420751690331,dart,0.2951299293643653,3.664782751036021,lossguide,0.0001306300745964864,0.06619752712161725,2,4,3.5510928062265625,900,forest,0.3905607451823978,0.9000632696078336,none,0.9858874093917055,0.7490033174676373,0.18074435253830823,uniform,0.37190288983120845,0.6290695700766872,0.86651653188658,0.8654791154791155,0.3905607451823978,0.6892278360343184,0.683982683982684,0.9000632696078336,0.8151964077991694,0.807865056698472,0.7782561894510226,0.7808896210873146,0.6184773310521814,0.6084724005134788,none,0.9206542506428403,0.9186170736832201,0.9858874093917055,COMPLETE
1739,0.6587497199193367,2025-09-23 22:09:40.197760,2025-09-23 22:09:43.389383,0 days 00:00:03.191623,0.03875077425506532,gbtree,0.8843503566873628,0.03617246954227227,lossguide,0.005249124950126361,0.3697628359039817,9,10,0.19217331707125798,200,,0.5204623495631033,0.955858629251256,none,0.9427682101503214,1.3299826746271572,,,,0.5605982712172655,0.8461459719520934,0.844082719082719,0.5204623495631033,0.6660742057320596,0.6587497199193367,0.955858629251256,0.7677098918045028,0.7661233666328924,0.6930189551548774,0.691439322671684,0.6411462788708298,0.6290115532734275,none,0.8971677154371112,0.894836950090598,0.9427682101503214,COMPLETE
1740,0.7149938042131351,2025-09-23 22:09:43.526232,2025-09-23 22:09:50.184489,0 days 00:00:06.658257,0.00043895612106367694,dart,0.8731453234469688,8.047113748265783,depthwise,0.0008047616278780735,0.40146202063468034,2,12,0.8147103758809147,300,tree,0.6743862224104137,0.9723840733118565,none,0.8911986929989235,3.4410269172548054,0.17023348385957537,uniform,0.6644500230402581,0.5461203893238303,0.8618077592384072,0.8587223587223587,0.6743862224104137,0.7235872235872236,0.7149938042131351,0.9723840733118565,0.8153636374914355,0.8117052192482257,0.6940298507462687,0.6910179640718563,0.7557741659538066,0.7406931964056482,none,0.9225381925462184,0.9203192549317075,0.8911986929989235,COMPLETE
1741,0.6789955226786062,2025-09-23 22:09:50.321791,2025-09-23 22:09:51.138459,0 days 00:00:00.816668,0.001908398015935291,gbtree,0.7812826039748192,7.724532669605306,depthwise,0.7077199822291486,0.2129126548599242,0,12,0.2980968673509026,800,,0.5481453201263098,0.8686951075490748,none,0.7762225340000672,2.3827100817918665,,,,0.5206135269870839,0.8284368922100522,0.8311834561834562,0.5481453201263098,0.6781874039938556,0.6789955226786062,0.8686951075490748,0.7454367775741972,0.7404842724647565,0.6153310104529617,0.6228571428571429,0.7553464499572284,0.7462558836114677,none,0.8976280382311679,0.8981969737042207,0.7762225340000672,COMPLETE
1742,0.6590239109073043,2025-09-23 22:09:51.274399,2025-09-23 22:10:31.585261,0 days 00:00:40.310862,0.0007259865680343467,dart,0.20626265625884135,0.6731512238040652,lossguide,0.00016634023079078864,0.05720986514738569,8,11,0.11987717478749998,700,forest,0.3270323144793333,0.8412135447869992,none,0.9905173797782115,2.5095292520827392,0.10431361701076355,uniform,0.7074857078173794,0.20394554299894355,0.7856484798853516,0.7868550368550369,0.3270323144793333,0.6584013050570963,0.6590239109073043,0.8412135447869992,0.7399347284351236,0.735910715213469,0.5321729957805907,0.5338286017511277,0.863130881094953,0.8609328198545143,none,0.894274372991142,0.8964213741748577,0.9905173797782115,COMPLETE
