number,value,datetime_start,datetime_complete,duration,params_alpha,params_booster,params_colsample_bytree,params_gamma,params_grow_policy,params_lambda,params_learning_rate,params_max_delta_step,params_max_depth,params_min_child_weight,params_n_estimators,params_normalize_type,params_params_decision_threshold,params_params_feature_fraction,params_params_resampling,params_params_sample_rows,params_params_scale_pos_weight,params_rate_drop,params_sample_type,params_skip_drop,params_subsample,user_attrs_acc_test,user_attrs_acc_val,user_attrs_decision_threshold,user_attrs_f1_test,user_attrs_f1_val,user_attrs_feature_fraction,user_attrs_pr_auc_test,user_attrs_pr_auc_val,user_attrs_prec_test,user_attrs_prec_val,user_attrs_rec_test,user_attrs_rec_val,user_attrs_resampling_strategy,user_attrs_roc_auc_test,user_attrs_roc_auc_val,user_attrs_sample_rows,state
440,0.5488480606590843,2025-09-23 13:33:23.788433,2025-09-23 13:33:26.302352,0 days 00:00:02.513919,0.00011768644254449692,dart,0.5905573264443496,3.8902314453248277,depthwise,0.0001681129191433931,0.058589638444841705,8,11,0.34722270968950353,200,tree,0.4804411101306044,0.5781111916077818,oversample,0.9121963442222358,0.5057674899103656,0.352876359765074,uniform,0.0014005781366689175,0.9970142973078755,0.8452246903470161,0.8416257166257166,0.4804411101306044,0.5647668393782384,0.5488480606590843,0.5781111916077818,0.7568711385759702,0.7467263978551605,0.863556338028169,0.8617216117216118,0.4195893926432849,0.40265297389816,oversample,0.8849777807554624,0.8848922855928515,0.9121963442222358,COMPLETE
441,0.6917694101966011,2025-09-23 13:33:26.426963,2025-09-23 13:33:44.290802,0 days 00:00:17.863839,0.07009862588485781,gbtree,0.9053187313670821,0.3019745488202563,lossguide,17.594821246451527,0.004350807273809891,0,11,0.18455903559996775,1000,,0.411970271493653,0.9925651513244176,none,0.9266101591618233,3.2414281502163846,,,,0.7309559263422012,0.8040741119868974,0.8106060606060606,0.411970271493653,0.685817465528562,0.6917694101966011,0.9925651513244176,0.8218387459287912,0.8145057827333821,0.556473095364944,0.5664392905866303,0.8934987168520102,0.8883183568677792,none,0.9246344671519755,0.9223132666488043,0.9266101591618233,COMPLETE
442,0.0,2025-09-23 13:33:44.413729,2025-09-23 13:33:44.968818,0 days 00:00:00.555089,27.28939889796122,gbtree,0.9301954500988983,3.0927788165325385,depthwise,0.03170326841972978,0.00032627583687471243,3,10,1.4481975862435703,200,,0.4479376898405702,0.5231193897495554,none,0.8370312585706554,2.0165880809234085,,,,0.5407582089774896,0.7606715119254785,0.7607493857493858,0.4479376898405702,0.0,0.0,0.5231193897495554,0.7124040897090693,0.70663938822875,0.0,0.0,0.0,0.0,none,0.8721311342365157,0.8689641751611616,0.8370312585706554,COMPLETE
443,0.6382714130265816,2025-09-23 13:33:45.092257,2025-09-23 13:33:45.645925,0 days 00:00:00.553668,0.19304859092473775,gbtree,0.500239874282173,2.7267993433329307,lossguide,0.000270859563113111,0.4822747634925712,1,3,0.14820918232286662,600,,0.41159077602398275,0.5992670602177489,oversample,0.5564408350709942,1.4849048458550322,,,,0.48145463724332505,0.7620022520217014,0.7617731367731367,0.41159077602398275,0.6403712296983759,0.6382714130265816,0.5992670602177489,0.7589946504010985,0.7458740164818071,0.501574993942331,0.501220703125,0.8853721129170231,0.8784766795036372,oversample,0.8940451469170776,0.8890942873264442,0.5564408350709942,COMPLETE
444,0.6073697585768743,2025-09-23 13:33:45.770712,2025-09-23 13:33:46.537015,0 days 00:00:00.766303,78.43422479210871,gbtree,0.6363459638722971,2.2271719437819004,depthwise,0.07306028199479019,0.004975163973717491,9,8,28.230716876833338,700,,0.5310715366286526,0.8413209352098985,undersample,0.7726673686323382,1.8958294608675992,,,,0.3466094314305872,0.7093868359095097,0.7152948402948403,0.5310715366286526,0.6049812160845972,0.6073697585768743,0.8413209352098985,0.7182337613074652,0.7103183465653226,0.44833986388946173,0.4532237673830594,0.9298545765611634,0.920410783055199,undersample,0.8851067402078017,0.881495581630274,0.7726673686323382,COMPLETE
445,0.6529784537389101,2025-09-23 13:33:46.661112,2025-09-23 13:33:57.998351,0 days 00:00:11.337239,0.000787918170997014,dart,0.3574513869888285,0.7395790212188069,depthwise,0.0002557974209924554,0.10091181264201604,3,5,0.7298807906049858,400,tree,0.6623193639593645,0.9192392948302341,none,0.9335493412819774,1.3604316837130477,0.252429364311552,uniform,0.8742123645158382,0.5153535203699389,0.8633432285802027,0.8598484848484849,0.6623193639593645,0.6644885649660719,0.6529784537389101,0.9192392948302341,0.8084095660676823,0.7971450895372875,0.805606337599025,0.8009950248756219,0.5654405474764757,0.5511339323919555,none,0.921476471475988,0.9163720578199768,0.9335493412819774,COMPLETE
446,0.6839163072991535,2025-09-23 13:33:58.122050,2025-09-23 13:33:58.763861,0 days 00:00:00.641811,1.9879367632457587,gbtree,0.428201168883396,5.411617955795399,depthwise,11.90594450187272,0.17653990891756152,3,12,1.3927208686184611,900,,0.3811155464762591,0.9575489819732015,oversample,0.8691147931239386,1.2189463145794042,,,,0.7672839521025268,0.7917903572525335,0.7973996723996724,0.3811155464762591,0.6780626780626781,0.6839163072991535,0.9575489819732015,0.8246889990346438,0.817394207613907,0.5381909547738694,0.5456167176350663,0.9161676646706587,0.9161317928968763,oversample,0.9267477790252586,0.9247747080874756,0.8691147931239386,COMPLETE
447,0.6040714582467802,2025-09-23 13:33:58.886263,2025-09-23 13:33:59.257547,0 days 00:00:00.371284,0.0002924497006592606,gbtree,0.5835218360924648,5.773359468594568,depthwise,73.9509732187859,0.09294207330221609,1,7,4.835540694214277,400,,0.4661794243803254,0.7329336429127506,undersample,0.6514012625170474,2.0192368376673624,,,,0.5800107146487107,0.699662196744805,0.7073095823095823,0.4661794243803254,0.5975308641975309,0.6040714582467802,0.7329336429127506,0.6855680196926843,0.6757293406006462,0.43982229402261713,0.4465601965601966,0.9315654405474765,0.9332477535301669,undersample,0.8779147397574653,0.8788342697187251,0.6514012625170474,COMPLETE
448,0.0,2025-09-23 13:33:59.379618,2025-09-23 13:34:10.026161,0 days 00:00:10.646543,1.9990016922559377,dart,0.6773361618878333,6.3006049906195845,depthwise,0.0001439987978240987,0.0030427245082081146,6,10,0.19296883630816927,400,tree,0.6527527740535649,0.6858744092267695,none,0.6872181139145488,2.1127375377384263,0.2158955626436716,weighted,0.30257596521608177,0.20971223820844634,0.7606715119254785,0.7607493857493858,0.6527527740535649,0.0,0.0,0.6858744092267695,0.7080862944255522,0.6975888830339075,0.0,0.0,0.0,0.0,none,0.8812058966443376,0.8801540712855229,0.6872181139145488,COMPLETE
449,0.6975937567743334,2025-09-23 13:34:10.148634,2025-09-23 13:34:10.965477,0 days 00:00:00.816843,5.278102974941027,gbtree,0.7949290500057498,2.9242481057170986,lossguide,0.1891842582338486,0.01782429442726294,3,5,14.470730543339446,500,,0.3923002353129716,0.9482483575568141,none,0.6832627557623332,0.9330550837912156,,,,0.7135230482169075,0.8582249974408844,0.8571867321867321,0.3923002353129716,0.7028534649216907,0.6975937567743334,0.9482483575568141,0.8089461685126039,0.8001922590509511,0.7051226861816616,0.7069420035149385,0.7005988023952096,0.6884895164741122,none,0.9182190437741508,0.9159735261164949,0.6832627557623332,COMPLETE
450,0.499568345323741,2025-09-23 13:34:11.088070,2025-09-23 13:34:14.014736,0 days 00:00:02.926666,11.600165570848194,dart,0.9001739804299811,0.34415175744971216,depthwise,58.621373949925434,0.009083941949402517,10,10,2.648262446503338,200,forest,0.697592529265021,0.8311801263454869,undersample,0.5444100487463962,0.6790238698558155,0.4668592364700797,uniform,0.6264694002410757,0.8562992864941297,0.8248541304125294,0.821969696969697,0.697592529265021,0.512396694214876,0.499568345323741,0.8311801263454869,0.7169990603114145,0.7120186822122849,0.7677198975234842,0.7627416520210897,0.38451668092386654,0.3714163457424048,undersample,0.888490393341007,0.8878817628241726,0.5444100487463962,COMPLETE
451,0.38612143742255267,2025-09-23 13:34:14.134851,2025-09-23 13:34:14.645244,0 days 00:00:00.510393,0.2253638720822467,gbtree,0.3253090695959172,7.7071102651781,depthwise,0.0011080485532290753,0.00013820816126017399,10,7,0.32056416587247427,200,,0.34551975486428094,0.9261953776959471,none,0.6839454634751967,3.9796051817462987,,,,0.6919827889573945,0.23932848807452145,0.23925061425061425,0.34551975486428094,0.3862228462872718,0.38612143742255267,0.9261953776959471,0.7536078397419066,0.7477650696554262,0.23932848807452145,0.23925061425061425,1.0,1.0,none,0.8997418393503092,0.8984288603058566,0.6839454634751967,COMPLETE
452,0.0,2025-09-23 13:34:14.765872,2025-09-23 13:34:15.277973,0 days 00:00:00.512101,16.952040549040404,gbtree,0.5796035586850189,4.153994834023528,depthwise,0.0008064113107886504,0.00011344958016521443,4,3,17.01023849635276,500,,0.6546217343450478,0.9114907308030802,undersample,0.5096582155239167,1.1955675852529335,,,,0.7102173804503702,0.7606715119254785,0.7607493857493858,0.6546217343450478,0.0,0.0,0.9114907308030802,0.7052217153519745,0.6980987279988835,0.0,0.0,0.0,0.0,undersample,0.8834808898841109,0.8808592898626859,0.5096582155239167,COMPLETE
453,0.6396953831508805,2025-09-23 13:34:15.398550,2025-09-23 13:34:15.974875,0 days 00:00:00.576325,0.024846294704597347,gbtree,0.6228719092950248,3.874829141486218,depthwise,9.08865584081321,0.0005239826708532804,0,3,0.48661054571677037,600,,0.39866818449679403,0.6302460827012624,undersample,0.8513340937919271,0.6312518575390296,,,,0.7931428876278404,0.7616951581533422,0.7675061425061425,0.39866818449679403,0.636477201748907,0.6396953831508805,0.6302460827012624,0.7328379048934763,0.7252984249778772,0.5012297097884899,0.5083207261724659,0.8716852010265184,0.8626444159178434,undersample,0.8907596595263249,0.8867383090888895,0.8513340937919271,COMPLETE
454,0.6597904387688278,2025-09-23 13:34:16.097007,2025-09-23 13:34:26.794551,0 days 00:00:10.697544,0.26630325227606216,gbtree,0.7190418471401816,2.5744457837839763,lossguide,0.0006255256414283923,0.0019344087102470791,7,11,1.685414024533653,600,,0.45037617211110187,0.9613378012042506,none,0.5619986855818133,3.179033561142497,,,,0.9370737056283778,0.7799160610093152,0.7872645372645373,0.45037617211110187,0.651652624756967,0.6597904387688278,0.9613378012042506,0.7388745672313041,0.7306341643227151,0.5245174752217006,0.5343410236011668,0.8601368691189051,0.8622165169020112,none,0.8939728248675958,0.8945743429769253,0.5619986855818133,COMPLETE
455,0.38612143742255267,2025-09-23 13:34:26.920879,2025-09-23 13:34:30.930315,0 days 00:00:04.009436,0.0002040514759042528,gbtree,0.5410983414590871,2.6368708785576644,lossguide,1.7629962641801717,0.00022103037355995637,5,10,0.6079813855664938,400,,0.6883274212220625,0.6007624418840276,oversample,0.9652765943380884,3.736699596844849,,,,0.47598491343368343,0.23932848807452145,0.23925061425061425,0.6883274212220625,0.3862228462872718,0.38612143742255267,0.6007624418840276,0.76876116098723,0.7653769369083456,0.23932848807452145,0.23925061425061425,1.0,1.0,oversample,0.9071247895811122,0.9061730205726085,0.9652765943380884,COMPLETE
456,0.6387358654682517,2025-09-23 13:34:31.052727,2025-09-23 13:34:31.501778,0 days 00:00:00.449051,0.0033997842315727353,gbtree,0.38746075973724503,5.497180447766543,depthwise,0.041783932744829264,0.0226052199297185,1,7,0.19160374672440206,200,,0.5072679480005611,0.8564509087323738,oversample,0.7051598432634161,2.4077473881443043,,,,0.33750230648924573,0.7354898147200327,0.7448812448812449,0.5072679480005611,0.6295871559633027,0.6387358654682517,0.8564509087323738,0.7898810786620507,0.7878897049241024,0.47347994825355755,0.4830081122560842,0.9392643284858854,0.9426615318784767,oversample,0.9113966254007931,0.9119765197396997,0.7051598432634161,COMPLETE
457,0.6613807774124928,2025-09-23 13:34:31.622050,2025-09-23 13:34:32.657922,0 days 00:00:01.035872,0.002212837230508666,gbtree,0.7337395339208879,1.1659202119486356,lossguide,0.00022848367222470407,0.009497575627752655,3,5,15.12511111353219,500,,0.4340062016707168,0.7466796848494007,none,0.7300123954481678,1.3558134883844113,,,,0.5353978561565143,0.8229092025795884,0.8207411957411958,0.4340062016707168,0.670224933282501,0.6613807774124928,0.7466796848494007,0.7205060230537366,0.7094877196371893,0.6045392022008254,0.6033874382498235,0.7519247219846023,0.7317073170731707,none,0.8922332104923323,0.8914842395135806,0.7300123954481678,COMPLETE
458,0.615128449096099,2025-09-23 13:34:32.780103,2025-09-23 13:35:15.509617,0 days 00:00:42.729514,0.12456640776149694,dart,0.8263923183012796,6.767315329538038,depthwise,0.24693409028594043,0.01062736134415921,7,8,0.1412498431500951,800,tree,0.6277621990813212,0.6157054805624451,none,0.7925542051520111,2.1207756025991507,0.16540117462529547,weighted,0.40930123783089456,0.8131557442459594,0.8366260620329614,0.8343570843570843,0.6277621990813212,0.625703564727955,0.615128449096099,0.6157054805624451,0.6996621489683457,0.6900620314110129,0.6926272066458983,0.6925549009105517,0.5705731394354149,0.5532734274711169,none,0.8803013386112025,0.8805690429256247,0.7925542051520111,COMPLETE
459,0.5590761030500444,2025-09-23 13:35:15.635866,2025-09-23 13:35:32.254564,0 days 00:00:16.618698,1.0416447558150832,dart,0.6864552920674294,6.4261009275814684,depthwise,0.020403011803289343,0.19490185555755007,0,7,5.996206678141856,500,tree,0.6906651837354363,0.9235892355679284,none,0.8249567167392556,0.970176670754175,0.061301960549625445,weighted,0.5174150812580397,0.5232927566178656,0.8510594738458389,0.8475634725634725,0.6906651837354363,0.5744369698742322,0.5590761030500444,0.9235892355679284,0.814209203947951,0.8078357672550371,0.9084181313598519,0.9076923076923077,0.42001710863986313,0.40393667094565683,none,0.9194321720478531,0.9179069317625161,0.8249567167392556,COMPLETE
460,0.4440863680309378,2025-09-23 13:35:32.376040,2025-09-23 13:35:35.153998,0 days 00:00:02.777958,0.0005139763055731117,gbtree,0.9946097717950475,3.250594958087054,lossguide,0.0010250389907673547,0.00025406493584419736,7,7,16.146648910874408,1000,,0.4683846037460067,0.7896200936645003,undersample,0.7047144771862697,0.5596338108271741,,,,0.7580588919065867,0.8270037874910431,0.8234029484029484,0.4683846037460067,0.461440407903123,0.4440863680309378,0.7896200936645003,0.773471917531648,0.7652858163595402,0.905,0.8994778067885117,0.30966638152266895,0.2948224219084296,undersample,0.9032142474379921,0.9009211662139782,0.7047144771862697,COMPLETE
461,0.38612143742255267,2025-09-23 13:35:35.275522,2025-09-23 13:35:36.295212,0 days 00:00:01.019690,73.15348771022275,gbtree,0.844672481236584,3.6245143775401276,depthwise,0.040654162255326795,0.0004956600806250022,0,12,0.24234743669587872,300,,0.34789249195508876,0.9616975473816138,oversample,0.9299726315540837,4.916853578389399,,,,0.6432439305951793,0.23932848807452145,0.23925061425061425,0.34789249195508876,0.3862228462872718,0.38612143742255267,0.9616975473816138,0.7076974223822267,0.6966057469692856,0.23932848807452145,0.23925061425061425,1.0,1.0,oversample,0.8937782776911142,0.8910594787693622,0.9299726315540837,COMPLETE
462,0.6631410256410256,2025-09-23 13:35:36.418667,2025-09-23 13:35:36.953507,0 days 00:00:00.534840,0.3846927115273131,gbtree,0.2251646236024583,7.349362550586455,depthwise,0.198716244082877,0.09623196449478842,8,3,5.379304077820976,900,,0.5814016492518645,0.6131316575605876,oversample,0.5524804672376566,1.8361902163991255,,,,0.2296170991776493,0.7788924147814515,0.7848075348075348,0.5814016492518645,0.6601636249213342,0.6631410256410256,0.6131316575605876,0.7715642003312425,0.7638416059291454,0.5221503235440518,0.5301050473994363,0.8973481608212147,0.8853230637569534,oversample,0.9056249056762765,0.9035306534566738,0.5524804672376566,COMPLETE
463,0.6233236151603498,2025-09-23 13:35:37.076770,2025-09-23 13:35:57.246501,0 days 00:00:20.169731,10.275180267623735,dart,0.34940522221522463,5.99694298183382,lossguide,0.3037218936692009,0.0373116045232676,8,3,56.91451292922024,600,tree,0.584776142603929,0.6534975538191501,oversample,0.6744565393660644,2.1144550810584684,0.4221940172850587,weighted,0.11649897802641697,0.8662707229062894,0.7301668543351417,0.7354627354627354,0.584776142603929,0.6208285385500575,0.6233236151603498,0.6534975538191501,0.7481124754783943,0.7381748314389284,0.46770697876029477,0.47269511386248064,0.9230111206159111,0.9148480958493795,oversample,0.8973815446562322,0.8935415924926094,0.6744565393660644,COMPLETE
464,0.6672804271773154,2025-09-23 13:35:57.367518,2025-09-23 13:36:02.994557,0 days 00:00:05.627039,0.0004753764405736134,dart,0.7161615970228088,8.636843855310488,lossguide,39.60561705133818,0.08565259617596654,8,7,0.5570623054285108,300,forest,0.5663383289086228,0.8209741722728962,oversample,0.6784793111724015,0.9321817228681291,0.2509462809121204,weighted,0.06182145798866702,0.29256039553932284,0.8139011157743884,0.81500819000819,0.5663383289086228,0.6677631578947368,0.6672804271773154,0.8209741722728962,0.7642499980979633,0.759402234621305,0.5829610721123165,0.5856496444731739,0.781437125748503,0.7753530166880617,oversample,0.9004832482793799,0.8987039341315369,0.6784793111724015,COMPLETE
465,0.6422047244094489,2025-09-23 13:36:03.114393,2025-09-23 13:36:09.951957,0 days 00:00:06.837564,0.002608032333263212,dart,0.8231636697267155,1.8727168976970043,depthwise,2.7875579471081195,0.020757260510222687,4,11,5.400299672267153,300,tree,0.3238085713152959,0.7776406140004296,none,0.6323556845884478,2.285490315292435,0.25532612318957104,weighted,0.564182137074688,0.8384345767839967,0.7683488586344559,0.7674037674037674,0.3238085713152959,0.6477821011673152,0.6422047244094489,0.7776406140004296,0.7175506027210938,0.7084459179002855,0.5091754343038903,0.5080986792923,0.8900769888793841,0.8724860932819855,none,0.8918569228691817,0.8897991316143321,0.6323556845884478,COMPLETE
466,0.6569005397070162,2025-09-23 13:36:10.074414,2025-09-23 13:36:10.758225,0 days 00:00:00.683811,1.290281854694483,gbtree,0.40905451481154387,8.280626626852323,lossguide,0.0004129650506680835,0.04825283941713629,6,5,1.0462728644773078,900,,0.3736172041412387,0.7519550816663686,oversample,0.6757792169063175,1.0118879352982622,,,,0.715923455693831,0.7708056095813287,0.7722153972153972,0.3736172041412387,0.6589489718202589,0.6569005397070162,0.7519550816663686,0.799719946335732,0.7876767720562837,0.5117104329311568,0.5135004821600772,0.9251497005988024,0.9114249037227214,oversample,0.9173447902050447,0.912552666099935,0.6757792169063175,COMPLETE
467,0.5312716362797139,2025-09-23 13:36:10.879908,2025-09-23 13:36:24.401660,0 days 00:00:13.521752,1.6594682342577485,dart,0.8747585801765043,3.0325157772172116,depthwise,0.004118881551859459,0.061156136266043756,2,3,16.03138284766263,500,tree,0.3000827793928257,0.6569817250913372,oversample,0.5118693107045116,3.6405455062124936,0.474501528009008,weighted,0.21175342067966926,0.32512410576379003,0.5781553894973896,0.5841523341523341,0.3000827793928257,0.5272456120224848,0.5312716362797139,0.6569817250913372,0.7104459614653638,0.7007626412135348,0.36024455243768616,0.3637225470058461,0.9828913601368692,0.9850235344458708,oversample,0.8890047921919585,0.8884790997156725,0.5118693107045116,COMPLETE
468,0.600748416810593,2025-09-23 13:36:24.523712,2025-09-23 13:36:25.559825,0 days 00:00:01.036113,0.44106582771533304,gbtree,0.7205492731963459,2.7861905890643324,lossguide,0.0019124033917889884,0.0004176414816073871,0,4,0.49110998660767197,800,,0.5230846640269133,0.6173355924152404,undersample,0.8946323325756993,1.2159384567467064,,,,0.6088927546931961,0.7177807349779916,0.716011466011466,0.5230846640269133,0.6058613295210865,0.600748416810593,0.6173355924152404,0.6522883485208799,0.6439514993358462,0.4550139574833584,0.4526133159835177,0.9063301967493584,0.8930252460419341,undersample,0.8660361381165231,0.8643178056836345,0.8946323325756993,COMPLETE
469,0.6129175946547885,2025-09-23 13:36:25.685064,2025-09-23 13:36:26.874798,0 days 00:00:01.189734,1.2946767841781923,gbtree,0.662556835221873,5.6290066292321566,lossguide,27.062218817619854,0.00011556528923468732,2,11,9.06415337054302,800,,0.4932360376644558,0.8644764097326664,undersample,0.550272194298537,0.9242599083310136,,,,0.5348679800738689,0.8229092025795884,0.8220720720720721,0.4932360376644558,0.6242397914856647,0.6129175946547885,0.8644764097326664,0.6964246288769999,0.6911583442217544,0.6341571050308914,0.6391082210868555,0.6146278870829769,0.5887890457851946,undersample,0.8801253827773255,0.8793607795627921,0.550272194298537,COMPLETE
470,0.6627257799671593,2025-09-23 13:36:27.001454,2025-09-23 13:37:37.341213,0 days 00:01:10.339759,0.0012156839517280973,dart,0.5356526432502815,1.4751381329854552,depthwise,0.1013023315605059,0.00017527821227873315,6,7,0.7047679989033909,1000,tree,0.49320201247545714,0.7044566791739244,oversample,0.6182722828804224,0.9728202092643117,0.06215166132259642,uniform,0.23556731873403605,0.9971053585514571,0.7855461152625652,0.7897215397215397,0.49320201247545714,0.6612772837510105,0.6627257799671593,0.7044566791739244,0.7525725011022983,0.7471443256160691,0.5315830517286197,0.5377031707966959,0.8746792130025663,0.8635002139495079,oversample,0.8991982008645492,0.8972445226651447,0.6182722828804224,COMPLETE
471,0.6145251396648045,2025-09-23 13:37:37.463094,2025-09-23 13:37:49.297617,0 days 00:00:11.834523,0.06247734652105153,dart,0.9896117035148031,4.7034262584427555,depthwise,0.006301328829370002,0.0012219239878379304,9,11,0.1424812414812238,400,tree,0.39303247444500444,0.9716747450193397,undersample,0.8128856690027548,0.8107216432703522,0.15646798293206793,uniform,0.7091036039246557,0.4336211579853589,0.7151192547855462,0.7174447174447175,0.39303247444500444,0.6137404580152672,0.6145251396648045,0.9716747450193397,0.7912322404156047,0.790538669229634,0.4542839531538936,0.4561476259589467,0.9456800684345594,0.9413778348309799,undersample,0.9106430428836082,0.9098377732390883,0.8128856690027548,COMPLETE
