number,value,datetime_start,datetime_complete,duration,params_alpha,params_booster,params_colsample_bytree,params_gamma,params_grow_policy,params_lambda,params_learning_rate,params_max_delta_step,params_max_depth,params_min_child_weight,params_n_estimators,params_normalize_type,params_params_decision_threshold,params_params_feature_fraction,params_params_resampling,params_params_sample_rows,params_params_scale_pos_weight,params_rate_drop,params_sample_type,params_skip_drop,params_subsample,user_attrs_acc_test,user_attrs_acc_val,user_attrs_decision_threshold,user_attrs_f1_test,user_attrs_f1_val,user_attrs_feature_fraction,user_attrs_pr_auc_test,user_attrs_pr_auc_val,user_attrs_prec_test,user_attrs_prec_val,user_attrs_rec_test,user_attrs_rec_val,user_attrs_resampling_strategy,user_attrs_roc_auc_test,user_attrs_roc_auc_val,user_attrs_sample_rows,state
1040,0.6106959706959707,2025-09-23 16:25:15.534039,2025-09-23 16:25:26.486543,0 days 00:00:10.952504,0.0010914788956294748,dart,0.3687504221304365,5.453322789809866,lossguide,32.059375054829225,0.0016269256629269377,5,3,14.340982160622561,400,forest,0.572734683666019,0.9344599090800563,oversample,0.5846830314486493,1.5373576013647476,0.12901715499337,weighted,0.7327148870095255,0.5691510398705801,0.7247415293274644,0.727989352989353,0.572734683666019,0.6102333671546601,0.6106959706959707,0.9344599090800563,0.7165677127375876,0.7070887898289525,0.4615215961411971,0.464349376114082,0.9003421727972626,0.8917415489944374,oversample,0.8856770857615757,0.882366495190354,0.5846830314486493,COMPLETE
1041,0.7247956403269755,2025-09-23 16:25:26.616632,2025-09-23 16:26:18.261557,0 days 00:00:51.644925,0.001766998303873433,dart,0.29831959767602434,1.2108394020080335,lossguide,0.0002616812009925102,0.022999195399194115,6,10,0.11231275805042033,800,forest,0.41965126435541733,0.9550233427621407,none,0.8553491433176766,1.6885867803135413,0.19023168182241013,weighted,0.8965715703130456,0.36322121435178506,0.8508547446002661,0.8552416052416052,0.41965126435541733,0.7200768491834775,0.7247956403269755,0.9550233427621407,0.8256572047354617,0.8217282678040734,0.65364492500872,0.664762584791146,0.8015397775876818,0.7967479674796748,none,0.9268934303951069,0.925905349612959,0.8553491433176766,COMPLETE
1042,0.6808964781216649,2025-09-23 16:26:18.394624,2025-09-23 16:26:20.090418,0 days 00:00:01.695794,0.00017317965279087258,gbtree,0.5084614895389312,1.2444168783614757,depthwise,15.676310668344986,0.0018542875549263879,6,10,13.205845877775447,900,,0.6447571487662432,0.7124310800666241,undersample,0.984633517259115,1.0779719012867925,,,,0.6394929798772842,0.8454294195925888,0.846949221949222,0.6447571487662432,0.6804909013965298,0.6808964781216649,0.7124310800666241,0.7659297654122315,0.7573024174325789,0.6733668341708543,0.6793015332197615,0.6877673224978614,0.6824989302524604,undersample,0.9046697538655891,0.9027018618357784,0.984633517259115,COMPLETE
1043,0.7127638190954774,2025-09-23 16:26:20.222392,2025-09-23 16:27:15.649766,0 days 00:00:55.427374,0.004127023185515316,dart,0.3203886040398975,0.13993060765083132,lossguide,0.00240532715140754,0.05683426708310466,6,10,0.11234359937778726,800,forest,0.40493361754795787,0.9294691310437583,none,0.8038652367679668,1.6940313757190404,0.19380240911678567,weighted,0.8820436929371696,0.43723269212941174,0.8506500153546934,0.8537059787059788,0.40493361754795787,0.7077909072701782,0.7127638190954774,0.9294691310437583,0.8134791599917643,0.8095529579600256,0.6655367231638418,0.6721000758150114,0.7557741659538066,0.7586649550706034,none,0.9197555635600014,0.9182837546880451,0.8038652367679668,COMPLETE
1044,0.7088288288288288,2025-09-23 16:27:15.785711,2025-09-23 16:28:21.293134,0 days 00:01:05.507423,0.09786062936558798,dart,0.46575284719707866,1.7561057543360956,lossguide,0.00730349940753748,0.019354687396500526,3,10,0.1224385854995459,900,forest,0.41203127324812827,0.9612837024987867,none,0.8957284753972685,2.635179807660111,0.23475711827924012,weighted,0.8808449287000238,0.333643072556289,0.8334527587265841,0.8345618345618345,0.41203127324812827,0.7094123950705483,0.7088288288288288,0.9612837024987867,0.8266886533922022,0.8182762045921044,0.609015639374425,0.6122004357298475,0.8494439692044482,0.8416773641420625,none,0.9273293772337671,0.924365897824671,0.8957284753972685,COMPLETE
1045,0.7008867667121419,2025-09-23 16:28:21.425435,2025-09-23 16:29:10.333143,0 days 00:00:48.907708,0.004213622871323024,dart,0.26503330767719574,1.402129237627852,lossguide,0.0038698103982989685,0.030459510724119183,10,8,0.10524714583990334,800,forest,0.3629371401322174,0.9909317602960964,none,0.7213523284481065,2.7601702599269915,0.1887018473016416,weighted,0.8930661503542919,0.48715081862718007,0.8162555020984748,0.8204340704340705,0.3629371401322174,0.6987749622419869,0.7008867667121419,0.9909317602960964,0.8274883476493765,0.8202330829895317,0.5749792874896438,0.5826481428976468,0.8905047048759623,0.8793324775353016,none,0.9269581547442056,0.9253782927307208,0.7213523284481065,COMPLETE
1046,0.7117253293025264,2025-09-23 16:29:10.465321,2025-09-23 16:30:01.150020,0 days 00:00:50.684699,0.006899549682790925,dart,0.2849289584881204,1.4740618054177714,lossguide,0.00017236641192681565,0.008332759424024474,5,12,0.2046241258753197,800,forest,0.3890909857300762,0.7186338897786619,none,0.8317368051563486,0.948325430912924,0.2035080776357401,weighted,0.747826097181339,0.5676272493273997,0.8636503224485618,0.8633292383292384,0.3890909857300762,0.7148972602739726,0.7117253293025264,0.7186338897786619,0.8172634259867129,0.8114201029920687,0.715509854327335,0.7183958151700087,0.7142857142857143,0.7051775780915703,none,0.9231967174711078,0.9220749019635618,0.8317368051563486,COMPLETE
1047,0.70223534373682,2025-09-23 16:30:01.280943,2025-09-23 16:30:40.873538,0 days 00:00:39.592595,0.00031046191100309826,dart,0.2826435008990143,1.1428481510646946,lossguide,0.00015080554649730233,0.006847708099912208,6,12,0.29407258840048656,700,forest,0.3902231641098115,0.7799567112940226,none,0.6984903079331487,1.074220372029731,0.20465199367917086,weighted,0.7346926620484213,0.42736627837117447,0.8575084450813799,0.8554463554463555,0.3902231641098115,0.7106029106029106,0.70223534373682,0.7799567112940226,0.8072157764565301,0.800295140591212,0.6913430420711975,0.6923076923076923,0.7309666381522669,0.7124518613607189,none,0.9180982000472209,0.9163381702448432,0.6984903079331487,COMPLETE
1048,0.7058189655172413,2025-09-23 16:30:41.006611,2025-09-23 16:30:41.653358,0 days 00:00:00.646747,0.05239805496660384,gbtree,0.9862280376573438,6.576013634072051,depthwise,0.0001707091542662148,0.0905533806046898,3,7,12.616480811236077,400,,0.5148194270222001,0.9433443820078354,none,0.9334763588657573,3.1280604254632336,,,,0.8476220820722039,0.8296652676834886,0.8323095823095823,0.5148194270222001,0.7050691244239631,0.7058189655172413,0.9433443820078354,0.8241994692411501,0.8168884416971676,0.6019975786924939,0.6081708449396471,0.850727117194183,0.8408215661103979,none,0.9261343510568114,0.9237964598799039,0.9334763588657573,COMPLETE
1049,0.6689689195855945,2025-09-23 16:30:41.788200,2025-09-23 16:30:42.505778,0 days 00:00:00.717578,0.008366081273477984,gbtree,0.6513090694296476,1.7422163383590001,depthwise,0.47072024955573805,0.011099712938122541,0,4,2.624533885577103,400,,0.3715202691550048,0.832347534826875,oversample,0.8549325880165045,0.5537818803284085,,,,0.4856049902834931,0.7852390213942062,0.793918918918919,0.3715202691550048,0.6597469996756407,0.6689689195855945,0.832347534826875,0.7898144898086836,0.781498462214225,0.5313479623824452,0.5432692307692307,0.8699743370402053,0.8703465982028241,oversample,0.9093348282384421,0.9063061235971134,0.8549325880165045,COMPLETE
1050,0.667246628969117,2025-09-23 16:30:42.642202,2025-09-23 16:31:49.493998,0 days 00:01:06.851796,0.005603012482021417,dart,0.42253213299823944,6.243324189420845,lossguide,0.0030930515750426956,0.026174210639782265,2,11,0.10299750869600537,1000,forest,0.3848980183090384,0.6612850431733571,none,0.7438259899065959,0.838795405315496,0.1972811786020245,weighted,0.7487254892070783,0.7389258610275018,0.8426655747773569,0.8433660933660934,0.3848980183090384,0.6695334336701785,0.667246628969117,0.6612850431733571,0.7508467133102626,0.7446986719572575,0.6731517509727627,0.6784608580274215,0.6659538066723696,0.6563970902866924,none,0.8989854652538167,0.9005332873590938,0.7438259899065959,COMPLETE
1051,0.6420687480290129,2025-09-23 16:31:49.627557,2025-09-23 16:33:04.910075,0 days 00:01:15.282518,0.00019358621603465803,dart,0.38968806861710215,1.7362572961545901,lossguide,0.0001249041611685059,0.26943760593481764,8,11,0.3126389569341538,1000,forest,0.49025706359571325,0.8635782043057179,undersample,0.8857420974528093,1.4690881809156164,0.21124573901460075,weighted,0.8077247427119791,0.3270838344712278,0.763332992117924,0.7676085176085176,0.49025706359571325,0.6403235843186061,0.6420687480290129,0.8635782043057179,0.7096986027360188,0.6920417967630477,0.5031784841075795,0.5083645443196005,0.8802395209580839,0.8712023962344887,undersample,0.8866173587423457,0.8833597437604105,0.8857420974528093,COMPLETE
1052,0.7139279522250048,2025-09-23 16:33:05.044517,2025-09-23 16:33:06.985702,0 days 00:00:01.941185,0.004595745311426135,gbtree,0.6754259433942986,1.5450886791057323,lossguide,0.0008877992140808977,0.010307113909741688,10,8,1.075313337342041,300,,0.32347004675546404,0.9319844857303488,none,0.825051309257134,0.9986042310935935,,,,0.6219045001726888,0.8479885351622479,0.847972972972973,0.32347004675546404,0.7161154654941694,0.7139279522250048,0.9319844857303488,0.8233883310958862,0.8159961131255384,0.6474248185274801,0.6492641906096707,0.8011120615911035,0.7928968763371844,none,0.9240825690449656,0.9218180531464283,0.825051309257134,COMPLETE
1053,0.6819526627218935,2025-09-23 16:33:07.119716,2025-09-23 16:34:21.100310,0 days 00:01:13.980594,0.28768298015818294,dart,0.3050742970362279,2.7386907725652017,lossguide,0.0002767568621870563,0.008039728379567642,8,9,0.26598547307569703,1000,forest,0.3074826778141489,0.7570682382230073,none,0.8397916411778972,1.064658148868061,0.15553161725093892,weighted,0.89871838943779,0.6893899757029686,0.8296652676834886,0.823914823914824,0.3074826778141489,0.6949028236156949,0.6819526627218935,0.7570682382230073,0.7903012745114321,0.7748211924488049,0.6081514762516046,0.6004558775643113,0.8105218135158255,0.789045785194694,none,0.9094460021648841,0.9053613886754002,0.8397916411778972,COMPLETE
1054,0.7202660406885759,2025-09-23 16:34:21.235209,2025-09-23 16:34:22.157002,0 days 00:00:00.921793,0.019087026981770797,gbtree,0.8744458067236276,2.568216075719587,lossguide,0.00023151812542438732,0.0825335143237465,9,9,0.8091187962348243,200,,0.3073146206216393,0.9605195958829059,none,0.9771728228978682,0.9013526146066769,,,,0.738854377569742,0.8520831200737026,0.8536036036036037,0.3073146206216393,0.7203406231856009,0.7202660406885759,0.9605195958829059,0.8265630507051448,0.8210984636584795,0.6578296217744786,0.6634234234234234,0.7959794696321643,0.7877620881471973,none,0.9271429457826948,0.9251079119167197,0.9771728228978682,COMPLETE
1055,0.7040183696900115,2025-09-23 16:34:22.289402,2025-09-23 16:34:22.805951,0 days 00:00:00.516549,0.007553253516800395,gbtree,0.9259442075697935,4.627042540351763,lossguide,0.0006487670353025809,0.25564701784884014,7,8,0.6989162932518129,200,,0.3690108610286913,0.7919390805758608,none,0.9887292155439154,0.6853476860867137,,,,0.6724942737191844,0.8694851059473846,0.868038493038493,0.3690108610286913,0.7057465958919917,0.7040183696900115,0.7919390805758608,0.8180585135718169,0.8129455345412363,0.7664160401002507,0.7596630327056492,0.6539777587681779,0.6559691912708601,none,0.9233539956248759,0.9217310452857199,0.9887292155439154,COMPLETE
1056,0.7222813364545648,2025-09-23 16:34:22.935640,2025-09-23 16:34:24.555213,0 days 00:00:01.619573,0.025251083624148407,gbtree,0.4617096294070302,0.4620655550414592,lossguide,0.00017235466359036936,0.0288278216975451,9,7,0.6505995788582053,400,,0.43257773896915774,0.9596670824495979,none,0.697720133859388,1.1675708382157575,,,,0.38481215685080317,0.86651653188658,0.8664004914004914,0.43257773896915774,0.722080136402387,0.7222813364545648,0.9596670824495979,0.8248633601440183,0.8200647374157657,0.719626168224299,0.718458933107536,0.7245508982035929,0.7261446298673513,none,0.9257990737482299,0.924827569249706,0.697720133859388,COMPLETE
1057,0.6958415841584158,2025-09-23 16:34:24.688448,2025-09-23 16:34:28.350008,0 days 00:00:03.661560,0.004172277099662834,dart,0.536853625465524,3.150884874998626,lossguide,0.0003415418907381307,0.006431155839444661,10,6,1.6596306290832112,200,forest,0.3522683348758648,0.8986014303341381,none,0.8638347668504027,1.1584443218594933,0.07619379993371339,weighted,0.694245148695958,0.546342870810068,0.8419490224178524,0.8427518427518428,0.3522683348758648,0.6970172684458399,0.6958415841584158,0.8986014303341381,0.7989275615675553,0.7918779355357807,0.6439448875997099,0.647622558053815,0.7596236099230111,0.7518185708172871,none,0.9132530256402818,0.9115765772535656,0.8638347668504027,COMPLETE
1058,0.7110141766630316,2025-09-23 16:34:28.482125,2025-09-23 16:34:30.306106,0 days 00:00:01.823981,0.06839576484380337,gbtree,0.4760278770185139,1.2256781374581522,lossguide,0.003233369171026675,0.018973813259611907,8,9,0.9247243188791682,500,,0.4775749233504575,0.9209963960487597,none,0.6804983445589057,1.2386327059819673,,,,0.2649015751392084,0.8634455932029891,0.8643529893529893,0.4775749233504575,0.7070707070707071,0.7110141766630316,0.9209963960487597,0.8140505728871096,0.809814680293261,0.7265342960288809,0.7250889679715302,0.688622754491018,0.6974753958065897,none,0.9193567706273824,0.9194144825879765,0.6804983445589057,COMPLETE
1059,0.6954143878838872,2025-09-23 16:34:30.437322,2025-09-23 16:34:31.982054,0 days 00:00:01.544732,0.03631378073507637,gbtree,0.5458253416535862,1.545733136028337,lossguide,0.0001735115423176063,0.003997570476747963,10,8,0.8772694314732468,300,,0.34161982761182036,0.8702343534101509,none,0.5355809985173603,1.0449658675186348,,,,0.3191157860977987,0.852492578564848,0.8517608517608518,0.34161982761182036,0.6996039191161142,0.6954143878838872,0.8702343534101509,0.7983502421034123,0.7887232735605835,0.6823912159414396,0.6839056681836988,0.7177074422583405,0.7073170731707317,none,0.9108360935433475,0.9083468638906265,0.5355809985173603,COMPLETE
1060,0.7165254237288136,2025-09-23 16:34:32.111260,2025-09-23 16:34:34.378400,0 days 00:00:02.267140,0.012979734845284812,gbtree,0.39136258097904936,0.6505597410878636,lossguide,0.15702038690014733,0.013542912889947016,7,8,1.4892258746937153,500,,0.4282841756371396,0.8678778443255559,none,0.8098490157556264,1.1781794432122266,,,,0.3314921605928161,0.8645716040536391,0.8630221130221131,0.4282841756371396,0.7188097768331562,0.7165254237288136,0.8678778443255559,0.8232204847979074,0.8173583994791324,0.7144064216307562,0.7096097356273605,0.723267750213858,0.7235772357723578,none,0.9250029843997337,0.9232143824742329,0.8098490157556264,COMPLETE
1061,0.7079000182448458,2025-09-23 16:34:34.511018,2025-09-23 16:34:35.902423,0 days 00:00:01.391405,2.1519113094534665,gbtree,0.6674772421634159,0.44691755652974896,lossguide,0.00029774518235539703,0.06459366403124117,8,7,6.295011708405989,400,,0.31118221806457613,0.9527882334385829,none,0.9212389062618148,1.3371447177864653,,,,0.7401425184788929,0.8381615313747569,0.8360974610974611,0.31118221806457613,0.7152890329551593,0.7079000182448458,0.9527882334385829,0.8244711492287166,0.8157084284314267,0.6177293934681182,0.6170483460559797,0.8494439692044482,0.8301240907145914,none,0.9264077531539379,0.9232039599574969,0.9212389062618148,COMPLETE
1062,0.6883756152972359,2025-09-23 16:34:36.036092,2025-09-23 16:34:37.400661,0 days 00:00:01.364569,0.00440059577010773,gbtree,0.92674264514978,3.0463162862245925,lossguide,0.00043758225916445406,0.025220637362240363,10,8,0.11657695582544053,400,,0.31801269932715953,0.8849312013023836,none,0.6813586790202073,1.0297501446613846,,,,0.8221583257114615,0.8324291124987204,0.8314905814905815,0.31801269932715953,0.6953284943234692,0.6883756152972359,0.8849312013023836,0.79261991706361,0.7816565377006945,0.6154859967051071,0.6173174872665534,0.7989734816082121,0.7779204107830552,none,0.9121804548236706,0.9093105436079539,0.6813586790202073,COMPLETE
1063,0.6267666570522065,2025-09-23 16:34:37.531963,2025-09-23 16:34:45.237231,0 days 00:00:07.705268,0.0019306815443609774,dart,0.21412321542429621,0.9422561002061491,lossguide,0.00025752740130966753,0.011243486435355516,1,7,0.10586253766533037,300,tree,0.5120748293432276,0.8475633677504039,oversample,0.8578640485973585,1.9317100047301885,0.2034188371996658,weighted,0.8894852126968543,0.42852628351169253,0.7260722694236872,0.735053235053235,0.5120748293432276,0.6174957118353345,0.6267666570522065,0.8475633677504039,0.759024964080663,0.751268401348335,0.463718334048948,0.47269958668696976,0.9238665526090676,0.9298245614035088,oversample,0.9006081210898464,0.9003593868036082,0.8578640485973585,COMPLETE
1064,0.6888,2025-09-23 16:34:45.367604,2025-09-23 16:35:06.349466,0 days 00:00:20.981862,0.0005887297892350407,dart,0.25266519304489027,0.654437673051045,lossguide,0.00034904321591089566,0.0782134504530552,5,12,2.797787101089093,500,forest,0.5290911505836985,0.6090166218887751,none,0.9106077568313715,2.2371753707171242,0.1287839753543678,weighted,0.7432838276113075,0.31766983715828234,0.8459412427065206,0.8407043407043407,0.5290911505836985,0.7025103775449694,0.6888,0.6090166218887751,0.7899536929440011,0.7792871369663421,0.6530687247335538,0.6466391288021028,0.7600513259195893,0.7368421052631579,none,0.9128145750139953,0.9084210883330174,0.9106077568313715,COMPLETE
1065,0.707409626522868,2025-09-23 16:35:06.481392,2025-09-23 16:35:07.727337,0 days 00:00:01.245945,0.006063067678855729,gbtree,0.26682392896509444,5.2115753364331265,lossguide,0.0004170265937795855,0.12240627167697173,3,11,0.5305025185726342,500,,0.6734715349231708,0.8727198260643966,none,0.9879462767210481,4.4192320723409715,,,,0.24283161776516388,0.8473743474255298,0.8500204750204751,0.6734715349231708,0.7066692897894944,0.707409626522868,0.8727198260643966,0.8090257058747501,0.8033104149106102,0.654280510018215,0.6632958801498128,0.7681779298545766,0.7578091570389388,none,0.9187261614955682,0.9163570286660094,0.9879462767210481,COMPLETE
1066,0.7047223663725999,2025-09-23 16:35:07.857518,2025-09-23 16:35:21.832280,0 days 00:00:13.974762,0.021999732642751506,dart,0.7910201226014953,1.162180271955961,lossguide,0.5102812755024183,0.021741790346314287,10,8,0.6930023940550406,400,forest,0.31418944451035535,0.9340023110078782,none,0.9780489552202496,1.708971951429018,0.09790206424686232,weighted,0.8935155419300049,0.8133750286410816,0.8223973794656567,0.8252457002457002,0.31418944451035535,0.7031650983746792,0.7047223663725999,0.9340023110078782,0.8295447101411444,0.8247471912131528,0.5859709153122327,0.5914634146341463,0.878956372968349,0.8716302952503209,none,0.9282220206913009,0.9260633572699961,0.9780489552202496,COMPLETE
1067,0.6567528035104827,2025-09-23 16:35:21.964789,2025-09-23 16:35:23.533347,0 days 00:00:01.568558,0.013496717328402484,gbtree,0.23279230911150628,2.118087701551853,lossguide,0.1208049231912826,0.0053986003532202325,7,8,0.8294473716320173,500,,0.3732430279718441,0.8038106884941456,none,0.9132981423856033,0.7599656655059694,,,,0.37517160880951983,0.8578155389497389,0.8558558558558559,0.3732430279718441,0.6660254868958885,0.6567528035104827,0.8038106884941456,0.779020120508878,0.7715506441822569,0.7605711147721033,0.7631728045325779,0.5923866552609067,0.576379974326059,none,0.9089261640511583,0.9075741004950582,0.9132981423856033,COMPLETE
1068,0.6811185779319315,2025-09-23 16:35:23.665033,2025-09-23 16:35:49.254836,0 days 00:00:25.589803,0.03603589256833269,dart,0.6119552813458989,1.2477583395857021,depthwise,0.0026717919640014045,0.03653254240895101,1,12,68.08341409451208,600,forest,0.6342165138035897,0.8353154712790788,none,0.6984589589138287,2.436431799920605,0.21538978263614802,weighted,0.7739664807548405,0.38273822263169177,0.8508547446002661,0.8494062244062244,0.6342165138035897,0.6898020012774111,0.6811185779319315,0.8353154712790788,0.785154068933976,0.7761834901375813,0.6867316659601526,0.6902460456942003,0.6928999144568007,0.6722293538724861,none,0.9106346681456857,0.9080049650336081,0.6984589589138287,COMPLETE
1069,0.6607171314741036,2025-09-23 16:35:49.387097,2025-09-23 16:36:14.105411,0 days 00:00:24.718314,1.2402154742584302,dart,0.6630394545947806,2.5499328651640685,lossguide,15.429624362762736,0.018719526672331413,2,3,4.5844981650178225,600,forest,0.33390550919839734,0.8062604649034588,oversample,0.9370597248835876,0.6077436198500299,0.23937795833827336,weighted,0.8723074017266893,0.40925265988506243,0.7760262053434334,0.782043407043407,0.33390550919839734,0.6568381430363864,0.6607171314741036,0.8062604649034588,0.7881867675607834,0.7789785155232607,0.5185735512630015,0.526409344845099,0.8956372968349017,0.8870346598202824,oversample,0.9071749804503111,0.9060528737153168,0.9370597248835876,COMPLETE
1070,0.7125416204217536,2025-09-23 16:36:14.237619,2025-09-23 16:36:43.485404,0 days 00:00:29.247785,0.007961702327496916,dart,0.4168474813912979,4.20387419444298,lossguide,0.005367693108637658,0.015056461275466079,5,10,0.10670632643560153,600,forest,0.6312924768420056,0.8855056324755651,none,0.8048413526927025,4.799712040471886,0.14879972804486674,weighted,0.7059028435449682,0.48943009747129756,0.8392875422254069,0.8409090909090909,0.6312924768420056,0.7103321033210332,0.7125416204217536,0.8855056324755651,0.8221103662721615,0.8118929466268171,0.6245944192083063,0.6275659824046921,0.8233532934131736,0.8241335044929397,none,0.9254780421278671,0.9226542441783765,0.8048413526927025,COMPLETE
