number,value,datetime_start,datetime_complete,duration,params_alpha,params_booster,params_colsample_bytree,params_gamma,params_grow_policy,params_lambda,params_learning_rate,params_max_delta_step,params_max_depth,params_min_child_weight,params_n_estimators,params_normalize_type,params_params_decision_threshold,params_params_feature_fraction,params_params_resampling,params_params_sample_rows,params_params_scale_pos_weight,params_rate_drop,params_sample_type,params_skip_drop,params_subsample,user_attrs_acc_test,user_attrs_acc_val,user_attrs_decision_threshold,user_attrs_f1_test,user_attrs_f1_val,user_attrs_feature_fraction,user_attrs_pr_auc_test,user_attrs_pr_auc_val,user_attrs_prec_test,user_attrs_prec_val,user_attrs_rec_test,user_attrs_rec_val,user_attrs_resampling_strategy,user_attrs_roc_auc_test,user_attrs_roc_auc_val,user_attrs_sample_rows,state
2018,0.6743332517739173,2025-09-23 23:21:26.486590,2025-09-23 23:21:27.414263,0 days 00:00:00.927673,0.006785060439304582,gbtree,0.5985885721700719,1.2146896874203472,lossguide,0.003750780232220525,0.28143519124530486,3,6,0.10738395189995088,400,,0.6672234822445238,0.8459653813914161,none,0.8202951028197528,1.5341803511625218,,,,0.8712539986834222,0.8644692394308527,0.8637387387387387,0.6672234822445238,0.6770731707317074,0.6743332517739173,0.8459653813914161,0.8137151117388852,0.8094353867075165,0.7877412031782066,0.7874285714285715,0.5936698032506416,0.5896448438168592,none,0.9215355551081355,0.9193232999622774,0.8202951028197528,COMPLETE
2019,0.6866611433305717,2025-09-23 23:21:27.554763,2025-09-23 23:22:37.449421,0 days 00:01:09.894658,0.14534005030713223,dart,0.464836380042451,3.236888306485211,lossguide,0.00021986187513542887,0.03382787850401758,4,8,3.7801830171061708,1000,forest,0.5740686290695912,0.9731362865521965,undersample,0.878201432704288,1.9336719976708696,0.16307122627213436,weighted,0.89889875628844,0.2815865351933374,0.7996724332070836,0.8064086814086814,0.5740686290695912,0.682253612599448,0.6866611433305717,0.9731362865521965,0.8139945533073668,0.8062751757399511,0.549856058623397,0.560302866414278,0.8986313088109495,0.8866067608044501,undersample,0.9226578275480875,0.9199343991825061,0.878201432704288,COMPLETE
2020,0.7050390964378801,2025-09-23 23:22:37.595933,2025-09-23 23:22:38.874478,0 days 00:00:01.278545,0.12475928647271514,gbtree,0.775114929763518,3.213613976570785,lossguide,0.0192547154963797,0.012695309236385061,1,6,0.5010808408207532,300,,0.631838899442481,0.996994753524413,none,0.6944578927585847,2.5742331151297115,,,,0.9569882900280935,0.8598628314054663,0.8609746109746109,0.631838899442481,0.704,0.7050390964378801,0.996994753524413,0.81262610329969,0.8071032187687797,0.7118495846086577,0.7159241288045876,0.6963216424294268,0.6944801026957638,none,0.919654232109056,0.9182987838420125,0.6944578927585847,COMPLETE
2021,0.6868997310795236,2025-09-23 23:22:39.015488,2025-09-23 23:22:39.745851,0 days 00:00:00.730363,0.0004061382088997161,gbtree,0.67685718036692,2.127696635849761,lossguide,0.027215237339883364,0.14346045994505374,7,5,0.7924766513606217,200,,0.618376480600604,0.9700086355922075,none,0.6253309055238829,3.6596075352506783,,,,0.8471380776081052,0.8389804483570478,0.8331285831285832,0.618376480600604,0.7006660323501427,0.6868997310795236,0.9700086355922075,0.7942239040077695,0.7831626648385016,0.6311278711004457,0.6232136632973161,0.7874251497005988,0.7650834403080873,none,0.911795850020934,0.9087210955827127,0.6253309055238829,COMPLETE
2022,0.70205775549023,2025-09-23 23:22:39.888065,2025-09-23 23:22:41.186010,0 days 00:00:01.297945,0.0001055746817728871,gbtree,0.24219955811741334,4.758412465971961,lossguide,2.0399415781716805,0.03336984523327888,2,6,0.9381808104833417,500,,0.6930435477133494,0.9030438671503448,oversample,0.7801888967537765,2.825253519157504,,,,0.7043764269059218,0.8227044733340158,0.8236076986076986,0.6930435477133494,0.70362765229295,0.70205775549023,0.9030438671503448,0.8236399673577953,0.8169162768424938,0.5864232743867656,0.5890887986070806,0.8793840889649273,0.8686350021394951,oversample,0.9268049056739742,0.9248783574251823,0.7801888967537765,COMPLETE
2023,0.6517213771016813,2025-09-23 23:22:41.327703,2025-09-23 23:22:43.441976,0 days 00:00:02.114273,0.001300446618632018,gbtree,0.5632066493614597,0.7940392450085981,lossguide,0.0014787809532058316,0.036378280203941606,0,7,1.266175611949372,400,,0.597540392950031,0.9395006316116132,oversample,0.8999919950566625,2.9429022308042474,,,,0.842848708337039,0.7720339850547651,0.7773341523341524,0.597540392950031,0.6480164374901217,0.6517213771016813,0.9395006316116132,0.7234342896039335,0.7139692034401754,0.5139132614690398,0.5207267144319345,0.8768177929854577,0.8707744972186564,oversample,0.8925060370060961,0.891905861986185,0.8999919950566625,COMPLETE
2024,0.7092034029389018,2025-09-23 23:22:43.586213,2025-09-23 23:23:27.742410,0 days 00:00:44.156197,0.6974633104705424,dart,0.5651523878465272,1.188516646121377,lossguide,0.00014532825446465937,0.009062843824197694,4,7,0.2253065841378434,800,forest,0.43874098892081864,0.8151335213247535,none,0.999350457060214,1.6130084369852187,0.2522003820795134,weighted,0.6231808205869078,0.3194301347506172,0.8517760262053434,0.846027846027846,0.43874098892081864,0.7210019267822736,0.7092034029389018,0.8151335213247535,0.8228630394852053,0.8130516035294983,0.656030855539972,0.6469135802469136,0.800256629597947,0.7847667950363714,none,0.9247551669830648,0.9221565833999712,0.999350457060214,COMPLETE
2025,0.6957844415471535,2025-09-23 23:23:27.884779,2025-09-23 23:23:29.540987,0 days 00:00:01.656208,0.0025318973881458128,gbtree,0.487479063136209,2.3930094999318405,lossguide,0.26300451188954677,0.21159083285677907,1,10,1.4361411310392551,600,,0.6155370607066702,0.9325393279636652,none,0.8734235412330896,2.4763392961452193,,,,0.5600058789859996,0.8545398710205753,0.8566748566748567,0.6155370607066702,0.6959126899208218,0.6957844415471535,0.9325393279636652,0.8015385164581166,0.7975853007744443,0.6963597430406853,0.7068432671081678,0.6954662104362703,0.685066324347454,none,0.9147886244927527,0.9123307125598294,0.8734235412330896,COMPLETE
2026,0.680514705882353,2025-09-23 23:23:29.683693,2025-09-23 23:23:30.537469,0 days 00:00:00.853776,0.01175848127929916,gbtree,0.5797169034996169,4.639972346203016,depthwise,0.00011868386062028537,0.2959646439876999,6,11,18.474707126318123,600,,0.6318721806132286,0.8554303842007458,none,0.8762266722636197,4.839520299064807,,,,0.7072585631016354,0.8234210256935203,0.8220720720720721,0.6318721806132286,0.6861924686192469,0.680514705882353,0.8554303842007458,0.786028379017406,0.7668708695032597,0.5970243748021525,0.5965194972607154,0.806672369546621,0.79204107830552,none,0.9088604899895116,0.9021604092121919,0.8762266722636197,COMPLETE
2027,0.7164004674717569,2025-09-23 23:23:30.678969,2025-09-23 23:23:31.545403,0 days 00:00:00.866434,0.03546217818112535,gbtree,0.438264113930718,1.5349234817069655,lossguide,4.350555127682622,0.47787265214216945,1,6,3.301031569049464,400,,0.6270898335573477,0.9964181098960978,none,0.975259141214924,4.1687796794994725,,,,0.9222241683939933,0.8490121813901116,0.8509418509418509,0.6270898335573477,0.7154157823654255,0.7164004674717569,0.9964181098960978,0.8202947016553553,0.81299243653961,0.6516695957820738,0.6574901680371827,0.7929854576561164,0.7869062901155327,none,0.9234748393518057,0.9201252003383344,0.975259141214924,COMPLETE
2028,0.7145503189956781,2025-09-23 23:23:31.687269,2025-09-23 23:23:33.425465,0 days 00:00:01.738196,0.0006486433476672767,gbtree,0.4427080727811224,0.17825283381942025,lossguide,1.2272363472762755,0.16195963508801717,2,7,1.3984863304166173,400,,0.5875409110691117,0.9537228528632701,none,0.768587237126133,3.0090140662505886,,,,0.7725813428195646,0.8545398710205753,0.858005733005733,0.5875409110691117,0.7075529944433011,0.7145503189956781,0.9537228528632701,0.8115020237878375,0.8129743084939325,0.6818722729075763,0.6883425852498017,0.7352437981180496,0.7428326914848096,none,0.9187945120198497,0.9199619238399637,0.768587237126133,COMPLETE
2029,0.6980908937320494,2025-09-23 23:23:33.567037,2025-09-23 23:23:34.845807,0 days 00:00:01.278770,0.0001995737244791162,gbtree,0.3259427366640547,4.510911857365351,lossguide,0.007602183968832206,0.01755583513248617,3,8,0.9880262823240185,400,,0.6147854843145871,0.9783072252353403,undersample,0.6587193068403514,1.8220962238879714,,,,0.985159814982849,0.8092947077490019,0.8170556920556921,0.6147854843145871,0.6908909905425585,0.6980908937320494,0.9783072252353403,0.8169256569132372,0.8093607537435964,0.5643805909460559,0.5767727526521497,0.8905047048759623,0.8840393667094566,undersample,0.9231934078667741,0.9218851660925933,0.6587193068403514,COMPLETE
2030,0.6979271483195814,2025-09-23 23:23:34.988032,2025-09-23 23:23:35.918030,0 days 00:00:00.929998,0.00567056445259785,gbtree,0.5311434179568074,1.2942613810728647,depthwise,0.05166852942924681,0.4857804746053223,1,9,5.343903030401679,500,,0.5548635370726721,0.9711028898943883,none,0.9223142769720293,3.385018863245121,,,,0.8535690411447094,0.8437915856280069,0.8463349713349714,0.5548635370726721,0.6963788300835655,0.6979271483195814,0.9711028898943883,0.791623346865719,0.7898951487122651,0.6510416666666666,0.6588145896656535,0.7485029940119761,0.7419768934531451,none,0.909338425634457,0.9084043316900882,0.9223142769720293,COMPLETE
2031,0.7182628062360802,2025-09-23 23:23:36.061238,2025-09-23 23:24:42.265437,0 days 00:01:06.204199,0.23529494832614595,dart,0.5148819922328289,0.7878147345168033,lossguide,0.00010935134471699584,0.02066780548835203,3,9,0.15600722812999027,900,tree,0.5444803005404847,0.9381441274058177,oversample,0.9342436836486346,1.3234531325675183,0.23575704902121397,weighted,0.8879689273796887,0.5322038613513318,0.8407206469444161,0.8445945945945946,0.5444803005404847,0.7138653916881207,0.7182628062360802,0.9381441274058177,0.828169544795448,0.8222402731214804,0.6261290322580645,0.6342182890855457,0.830196749358426,0.82798459563543,oversample,0.9275516387491467,0.9256282315920072,0.9342436836486346,COMPLETE
2032,0.7137225455228083,2025-09-23 23:24:42.407102,2025-09-23 23:24:43.349595,0 days 00:00:00.942493,0.0002006862564769907,gbtree,0.609335438830703,2.3796304012497664,depthwise,0.013178990364369987,0.017061601109510195,2,6,0.5309225643562506,400,,0.5736721288691684,0.9792123487518335,none,0.8055241631967739,3.221394810286027,,,,0.9178680843664088,0.8449175964786569,0.8438779688779688,0.5736721288691684,0.7171924584655591,0.7137225455228083,0.9792123487518335,0.8269859469743057,0.8212489201220098,0.636303411725737,0.6357859531772575,0.8216424294268606,0.8134360290971331,none,0.9268675291438002,0.9255266840325374,0.8055241631967739,COMPLETE
2033,0.720521429982224,2025-09-23 23:24:43.492081,2025-09-23 23:24:44.261653,0 days 00:00:00.769572,0.00020774198763444404,gbtree,0.5386887399848098,4.971936189336399,lossguide,0.0844818802472187,0.2889997062324614,1,6,0.2144786724529871,600,,0.6565093558210257,0.9790369874014676,none,0.8230990491977436,3.6886340404630373,,,,0.9271928933155622,0.8539256832838571,0.8551392301392301,0.6565093558210257,0.721125659566152,0.720521429982224,0.9790369874014676,0.8240280825689357,0.81648558044872,0.6639078805325657,0.669112252384446,0.7891360136869119,0.7804878048780488,none,0.9264976880543083,0.9235237757472873,0.8230990491977436,COMPLETE
2034,0.5179452669358456,2025-09-23 23:24:44.405988,2025-09-23 23:24:59.394364,0 days 00:00:14.988376,0.000359390659528809,dart,0.26036760814044435,3.3759668545300796,lossguide,0.5931152713992639,0.0029081533485129456,1,11,2.577266819597347,400,forest,0.6483963178341005,0.9017514891594337,oversample,0.9320931467717267,4.350268067502484,0.18717794316563321,weighted,0.7524545558515312,0.7228356695552007,0.5554304432388166,0.55999180999181,0.6483963178341005,0.5152360754548498,0.5179452669358456,0.9017514891594337,0.7551505103501993,0.7474499411872935,0.3485878266122942,0.3509651922784618,0.9871685201026519,0.9880188275566966,oversample,0.9013730138201019,0.9013586527935484,0.9320931467717267,COMPLETE
2035,0.6876010159316555,2025-09-23 23:24:59.535939,2025-09-23 23:25:00.681488,0 days 00:00:01.145549,0.000806531206368753,gbtree,0.6650953877036867,2.925316693773871,lossguide,0.001681556006669588,0.04812935435881763,5,7,1.3511801354823707,500,,0.6718966127221409,0.9170292775717777,none,0.6216989060351742,2.2630311715119675,,,,0.9630524438839592,0.8667212611321528,0.8614864864864865,0.6718966127221409,0.702603928734582,0.6876010159316555,0.9170292775717777,0.8079220593971504,0.7953220510962877,0.753921568627451,0.746740220661986,0.6578272027373824,0.6371416345742404,none,0.9208127663008374,0.9159958683070671,0.6216989060351742,COMPLETE
2036,0.7114364135407136,2025-09-23 23:25:00.823750,2025-09-23 23:25:08.037954,0 days 00:00:07.214204,0.017950019578956443,dart,0.9922713737419652,5.789339849855772,depthwise,0.8087367499484022,0.07632211510243088,1,9,16.50655066007742,300,forest,0.6356013536726169,0.9769561445263806,none,0.9525288689221865,4.974746173784954,0.14319514615375048,weighted,0.7935707985232704,0.9101260472835851,0.8371378851468932,0.8385544635544635,0.6356013536726169,0.7116186333152076,0.7114364135407136,0.9769561445263806,0.8239709953187411,0.8153888203429462,0.6174897766593268,0.6214833759590793,0.839606501283148,0.8318356867779204,none,0.9262852977935933,0.9235276338059686,0.9525288689221865,COMPLETE
2037,0.698306595365419,2025-09-23 23:25:08.178802,2025-09-23 23:25:15.273931,0 days 00:00:07.095129,0.0002549100392423472,dart,0.5456847188802743,3.6480773199273178,lossguide,0.008305348264595759,0.0033772322886674337,2,12,1.0051992045453138,200,forest,0.6252627919553846,0.9718431531590966,none,0.7606471350409973,3.7216455027923647,0.16869945477723933,weighted,0.6841882551600185,0.8701346643736317,0.8593510082915344,0.8613841113841114,0.6252627919553846,0.6961521450685537,0.698306595365419,0.9718431531590966,0.7955791044517909,0.7859049829872042,0.7206959706959707,0.7284983728498373,0.6732249786142002,0.670517757809157,none,0.9159873631823958,0.913559533041307,0.7606471350409973,COMPLETE
2038,0.7124094202898551,2025-09-23 23:25:15.415850,2025-09-23 23:25:16.178057,0 days 00:00:00.762207,0.0009218105860020601,gbtree,0.6395034225277418,2.7744620556356474,lossguide,0.0010875675249929263,0.3610282851865676,7,4,0.3533138576919831,500,,0.6567304132995695,0.9368168219736692,none,0.8984169004775108,2.170382932363814,,,,0.8623123021222855,0.8694851059473846,0.86998361998362,0.6567304132995695,0.7140614487553263,0.7124094202898551,0.9368168219736692,0.8219740973684653,0.8185802939491756,0.7505893446487506,0.7566137566137566,0.6809238665526091,0.6730851519041506,none,0.924929914091881,0.9243844971224928,0.8984169004775108,COMPLETE
2039,0.5947786606129398,2025-09-23 23:25:16.318302,2025-09-23 23:25:17.058047,0 days 00:00:00.739745,0.00024731990951186737,gbtree,0.43371515031636354,2.8502813533254643,lossguide,0.01927212577813318,0.03088039183948685,2,3,1.780799733679167,400,,0.6406721360742862,0.9890358245914601,none,0.7204337050552931,0.9393585847468049,,,,0.9943384185306632,0.8584297266864571,0.8538083538083538,0.6406721360742862,0.610312764158918,0.5947786606129398,0.9890358245914601,0.8184724976464958,0.810819566198087,0.8943022295623452,0.8828980623420387,0.4632164242942686,0.44843816859221225,none,0.922260444794706,0.9209179450228941,0.7204337050552931,COMPLETE
2040,0.7082941508369381,2025-09-23 23:25:17.205923,2025-09-23 23:25:30.481481,0 days 00:00:13.275558,0.026873033130421244,dart,0.29873298534932796,0.6018249423149244,lossguide,0.0011248560169079167,0.05527125555049518,8,10,7.965986397216139,400,forest,0.4805878088994907,0.9319499786612273,none,0.9361835135079938,2.3764903004565454,0.08761621628274407,weighted,0.8897038219562242,0.22491479957521565,0.8414371993039206,0.8412162162162162,0.4805878088994907,0.7122422441018019,0.7082941508369381,0.9319499786612273,0.8158608728219908,0.8082357955208329,0.6295566502463055,0.6318791946308725,0.8199315654405475,0.8057338468121523,none,0.922840287473959,0.9199815596311626,0.9361835135079938,COMPLETE
2041,0.7004199720018666,2025-09-23 23:25:30.624648,2025-09-23 23:25:31.205666,0 days 00:00:00.581018,0.0014379603164778442,gbtree,0.6824481267012468,6.329421448623055,lossguide,0.0019200014177320577,0.3612743259474396,5,5,0.2122660494714265,200,,0.6701161415265882,0.9985655730563812,none,0.718420496209455,2.126872159453788,,,,0.927421804081877,0.8728631384993346,0.8685503685503686,0.6701161415265882,0.7111627906976744,0.7004199720018666,0.9985655730563812,0.8252570821052609,0.815089952039215,0.7793068297655453,0.7701385325808107,0.6539777587681779,0.6422764227642277,none,0.9257344069574676,0.9237034921822774,0.718420496209455,COMPLETE
2042,0.7139951931965243,2025-09-23 23:25:31.348516,2025-09-23 23:26:41.168745,0 days 00:01:09.820229,0.15402143964426843,dart,0.507234127866634,1.7933828679306774,depthwise,0.0001371752523784747,0.03433947771119543,8,7,0.14692619109191418,1000,forest,0.41763509615845396,0.9905465238627668,none,0.9549112907303821,1.944032087356835,0.18298942972138088,weighted,0.7398576804682995,0.2638450159195024,0.8407206469444161,0.8416257166257166,0.41763509615845396,0.7148093841642229,0.7139951931965243,0.9905465238627668,0.8272692825459661,0.8205875522649215,0.6254008980115459,0.6285807291666666,0.8340461933276304,0.826272999572101,none,0.9272195559282266,0.9252228187241606,0.9549112907303821,COMPLETE
2043,0.6772882458136888,2025-09-23 23:26:41.314733,2025-09-23 23:27:09.461815,0 days 00:00:28.147082,0.00017286331556352403,dart,0.8920661338056686,9.843776895878142,depthwise,0.00013025408693467737,0.0061229733591165675,4,11,0.10766196138651662,600,forest,0.6183532710644133,0.979854137900322,oversample,0.853319491919851,2.727044457213109,0.14126335645003327,weighted,0.899802130060397,0.48297171422054064,0.795577848295629,0.7967854217854218,0.6183532710644133,0.678577176887172,0.6772882458136888,0.979854137900322,0.8028977862032718,0.7904758961015976,0.544,0.5461457787100157,0.9016253207869974,0.8913136499786051,oversample,0.9187798922024456,0.9144195058379625,0.853319491919851,COMPLETE
2044,0.7103986500738241,2025-09-23 23:27:09.604366,2025-09-23 23:27:11.054070,0 days 00:00:01.449704,0.0005425790138474041,gbtree,0.31924158480513154,1.3378557524574044,lossguide,0.035109351752348465,0.25320416680993585,1,9,0.3657789884696742,300,,0.5552550981431558,0.9545767004639767,none,0.9875113193034779,2.1413726487973532,,,,0.686376888115093,0.8587368205548163,0.8594389844389845,0.5552550981431558,0.7115384615384616,0.7103986500738241,0.9545767004639767,0.8135000488488765,0.8052941901582913,0.695829926410466,0.7004991680532446,0.7279726261762189,0.7205819426615319,none,0.9201164255490403,0.9170475060040318,0.9875113193034779,COMPLETE
2045,0.669985996576941,2025-09-23 23:27:11.196023,2025-09-23 23:27:11.998789,0 days 00:00:00.802766,0.009984961239182326,gbtree,0.4594583469721661,3.8251371465413797,lossguide,0.03824815253012613,0.12130026455831464,5,6,0.17908420026792943,500,,0.6030706863886084,0.8326855613263894,undersample,0.8880288773944239,3.408442838816486,,,,0.7101740579314909,0.7858532091309244,0.7828624078624079,0.6030706863886084,0.6755583126550868,0.669985996576941,0.8326855613263894,0.8181561646937934,0.8152820605320987,0.5299270072992701,0.5264058679706601,0.9315654405474765,0.9212665810868635,undersample,0.9239772660688197,0.9232586349831371,0.8880288773944239,COMPLETE
2046,0.7121650279545017,2025-09-23 23:27:12.140534,2025-09-23 23:27:13.071012,0 days 00:00:00.930478,0.00016614793953635608,gbtree,0.49263346927054724,2.161431150995948,lossguide,1.3542075031234313,0.2697492169407502,0,6,24.46626103831659,700,,0.4914193819965887,0.9703696656355241,none,0.9077244755856488,2.1482799007614504,,,,0.823368904873837,0.8451223257242297,0.8471539721539721,0.4914193819965887,0.7100977198697068,0.7121650279545017,0.9703696656355241,0.8134091281606224,0.8088195548067848,0.6431794515793128,0.6480701754385965,0.7925577416595381,0.7903294822421908,none,0.9217933876753098,0.9202154616365872,0.9077244755856488,COMPLETE
2047,0.7021887334050951,2025-09-23 23:27:13.213812,2025-09-23 23:27:14.770544,0 days 00:00:01.556732,0.00019291313137906742,gbtree,0.49558130464468353,2.177914209585904,lossguide,0.1670340029890258,0.26556776651219044,2,10,0.42396902127337377,900,,0.555618008650183,0.9767544284181281,oversample,0.9041781442235759,3.1856863922556236,,,,0.7347349634288605,0.8257754120176067,0.8300573300573301,0.555618008650183,0.6986543909348442,0.7021887334050951,0.9767544284181281,0.8090967361724691,0.8044808649880701,0.5960725075528701,0.6045721346926166,0.8438836612489307,0.8373983739837398,oversample,0.9176914352850328,0.9164838551472865,0.9041781442235759,COMPLETE
2048,0.7240252668263994,2025-09-23 23:27:14.913179,2025-09-23 23:27:17.324077,0 days 00:00:02.410898,0.0001422353132641549,gbtree,0.361321796456495,1.923652382610628,lossguide,0.009286011599287183,0.03500297654889175,0,8,0.3992914041046016,500,,0.6978830823276692,0.989525609689102,none,0.9083388932783034,3.342253072523896,,,,0.7284153358857157,0.8697921998157436,0.8702907452907452,0.6978830823276692,0.7232375979112271,0.7240252668263994,0.989525609689102,0.8318893189825054,0.8245952758407917,0.7360496014171833,0.7373558118899733,0.7108639863130881,0.711168164313222,none,0.9295640796381743,0.9272418790312034,0.9083388932783034,COMPLETE
