number,value,datetime_start,datetime_complete,duration,params_alpha,params_booster,params_colsample_bytree,params_gamma,params_grow_policy,params_lambda,params_learning_rate,params_max_delta_step,params_max_depth,params_min_child_weight,params_n_estimators,params_normalize_type,params_params_decision_threshold,params_params_feature_fraction,params_params_resampling,params_params_sample_rows,params_params_scale_pos_weight,params_rate_drop,params_sample_type,params_skip_drop,params_subsample,user_attrs_acc_test,user_attrs_acc_val,user_attrs_decision_threshold,user_attrs_f1_test,user_attrs_f1_val,user_attrs_feature_fraction,user_attrs_pr_auc_test,user_attrs_pr_auc_val,user_attrs_prec_test,user_attrs_prec_val,user_attrs_rec_test,user_attrs_rec_val,user_attrs_resampling_strategy,user_attrs_roc_auc_test,user_attrs_roc_auc_val,user_attrs_sample_rows,state
693,0.4631159780985565,2025-09-23 14:30:36.090065,2025-09-23 14:31:22.876378,0 days 00:00:46.786313,0.08945436843632175,dart,0.9613385636283289,3.5147751472783617,lossguide,0.00011449735975598519,0.0013584050221233715,4,4,0.19218111047570638,900,forest,0.3095056823808026,0.8279700803205936,oversample,0.5754645694492078,3.135675955487088,0.36310793048279394,uniform,0.09840441892916184,0.9820283668638108,0.44508137987511515,0.4478910728910729,0.3095056823808026,0.46236239214519487,0.4631159780985565,0.8279700803205936,0.7394072370208313,0.7313151810158378,0.30096836668818594,0.30176440062272963,0.9970059880239521,0.9952931108258452,oversample,0.8924523350783871,0.8869657330107075,0.5754645694492078,COMPLETE
694,0.6181311018131102,2025-09-23 14:31:23.051266,2025-09-23 14:31:45.482369,0 days 00:00:22.431103,2.7793469635263874,dart,0.6039737901835418,4.228184820242004,depthwise,24.68584090721963,0.007183523216050857,4,8,31.486992214880946,500,tree,0.4134612892952158,0.9449134205730078,oversample,0.8904429311819959,1.6696634665026713,0.2046815338671858,uniform,0.6598789065689841,0.46614698160089,0.7166547241273415,0.7196969696969697,0.4134612892952158,0.6164079822616408,0.6181311018131102,0.9449134205730078,0.7863757154579325,0.7781690674653772,0.45592455924559244,0.4585143803020898,0.951240376390077,0.9482242190842961,oversample,0.9108404967560697,0.9086917282703627,0.8904429311819959,COMPLETE
695,0.0,2025-09-23 14:31:45.699244,2025-09-23 14:32:38.051791,0 days 00:00:52.352547,0.010991287640554397,dart,0.37002181392991107,7.6765397962181625,lossguide,14.988184227450391,0.0005580035469895379,6,4,0.1524983669617564,800,forest,0.6284711219567742,0.7578369515207712,none,0.6295453202879651,0.6015218753811314,0.11804127360680322,uniform,0.7174194623114908,0.4506732962559452,0.7606715119254785,0.7607493857493858,0.6284711219567742,0.0,0.0,0.7578369515207712,0.7347693434790571,0.7263622184167314,0.0,0.0,0.0,0.0,none,0.8894179459294687,0.8867364952254797,0.6295453202879651,COMPLETE
696,0.0,2025-09-23 14:32:38.181045,2025-09-23 14:32:39.121410,0 days 00:00:00.940365,3.566412255903112,gbtree,0.4869244230539426,9.452379400406636,lossguide,0.002003516248588346,0.00026392461038568467,8,3,15.835111926555648,1000,,0.4599505203965267,0.5628396277210732,none,0.9918413028784936,0.6114154647878416,,,,0.3290633064632752,0.7606715119254785,0.7607493857493858,0.4599505203965267,0.0,0.0,0.5628396277210732,0.7357260226345586,0.7289700917511818,0.0,0.0,0.0,0.0,none,0.8890692863077123,0.8835295271338706,0.9918413028784936,COMPLETE
697,0.38612143742255267,2025-09-23 14:32:39.251512,2025-09-23 14:32:40.229625,0 days 00:00:00.978113,6.096861049220452,gbtree,0.5759856362217064,1.0963419591784263,depthwise,72.5595436373045,0.00014432699347382156,1,6,0.8458231275223691,800,,0.3686316493843383,0.5958451700306371,undersample,0.8643686668730454,1.3028080207728938,,,,0.9654994908817285,0.23932848807452145,0.23925061425061425,0.3686316493843383,0.3862228462872718,0.38612143742255267,0.5958451700306371,0.6701865250870943,0.6659563544672639,0.23932848807452145,0.23925061425061425,1.0,1.0,undersample,0.8546840513563104,0.8518297879789456,0.8643686668730454,COMPLETE
698,0.6114453616902197,2025-09-23 14:32:40.364220,2025-09-23 14:32:43.502778,0 days 00:00:03.138558,1.2257837188243002,gbtree,0.9653400115034194,4.5517579732159135,lossguide,11.020036446789097,0.0013134785647176278,7,6,0.17171818237335512,900,,0.3621291293091154,0.6858621390508506,none,0.9749583095285577,3.700562290135123,,,,0.9830579390096639,0.7113317637424507,0.7157043407043407,0.3621291293091154,0.608876560332871,0.6114453616902197,0.6858621390508506,0.765703354998245,0.7561147095400164,0.4505336617405583,0.45426195426195426,0.938836612489307,0.9349593495934959,none,0.8993962878787093,0.8973426152466909,0.9749583095285577,COMPLETE
699,0.6162480707169917,2025-09-23 14:32:43.633302,2025-09-23 14:32:44.552634,0 days 00:00:00.919332,0.00407035256723669,gbtree,0.2037778620482488,6.808278460974302,depthwise,0.014136586607482135,0.03640080317230816,7,12,0.28602153732570873,700,,0.4814617130590694,0.8293996659026339,oversample,0.6979619592604998,4.034595944476685,,,,0.9077796108997449,0.7180878288463507,0.720004095004095,0.4814617130590694,0.6148251748251748,0.6162480707169917,0.8293996659026339,0.7484792359707004,0.7415957789984036,0.4567747298420615,0.45845511482254697,0.9401197604790419,0.9396662387676509,oversample,0.8980999878091442,0.8986327615863118,0.6979619592604998,COMPLETE
700,0.5796766743648961,2025-09-23 14:32:44.680300,2025-09-23 14:33:50.064699,0 days 00:01:05.384399,0.0003662487857073127,dart,0.2228702956136849,8.079856433637612,depthwise,0.0002632234691784546,0.004515710807935233,7,11,7.9872711748999,900,forest,0.4491974610510533,0.9751752961790269,oversample,0.5962504701731536,2.7807852611217068,0.28058352279368876,uniform,0.6096513371863548,0.5732268012777779,0.6561572320605998,0.6646191646191646,0.4491974610510533,0.5719383203772143,0.5796766743648961,0.9751752961790269,0.7367971971381175,0.7289476485128372,0.40733345434743146,0.41396371632765255,0.9597946963216424,0.9666238767650834,oversample,0.8946789505365529,0.8956146368297077,0.5962504701731536,COMPLETE
701,0.0,2025-09-23 14:33:50.195476,2025-09-23 14:34:20.612732,0 days 00:00:30.417256,0.06332451355304383,dart,0.5813072341110119,0.9792665550884816,lossguide,0.03078751129756081,0.0002629525743024745,10,3,0.7035714881540007,700,tree,0.5885325198980216,0.7996998394739852,none,0.9281462656043653,0.7774385532764696,0.40728135794783626,uniform,0.5176101216093913,0.36796143783366314,0.7606715119254785,0.7607493857493858,0.5885325198980216,0.0,0.0,0.7996998394739852,0.7670606667417965,0.7597597905477984,0.0,0.0,0.0,0.0,none,0.8975750270034935,0.8954384329556064,0.9281462656043653,COMPLETE
702,0.38612143742255267,2025-09-23 14:34:20.744259,2025-09-23 14:34:33.234727,0 days 00:00:12.490468,17.757065081247656,dart,0.4512007671990609,7.133096972433338,depthwise,6.2583526164451735,0.00020500461791213214,9,10,97.54865466322424,400,tree,0.5148073515786838,0.5706270250200394,none,0.5256271526416914,3.870681947046186,0.025473946937959457,uniform,0.018826925161779418,0.5671617348933885,0.23932848807452145,0.23925061425061425,0.5148073515786838,0.3862228462872718,0.38612143742255267,0.5706270250200394,0.7112344718363994,0.7024081185109687,0.23932848807452145,0.23925061425061425,1.0,1.0,none,0.8825152624562285,0.8786201186704301,0.5256271526416914,COMPLETE
703,0.5255856265635661,2025-09-23 14:34:33.399501,2025-09-23 14:34:36.893400,0 days 00:00:03.493899,11.615436979247441,dart,0.263403472958082,0.5313428636176831,lossguide,0.05506767137539885,0.02127533770980973,10,7,73.31096201821717,200,tree,0.5668109902433476,0.9290752202117272,oversample,0.5181944247366159,4.378950617829296,0.09586968162474035,weighted,0.0652919046002279,0.9918288089019607,0.574879721568226,0.5728910728910729,0.5668109902433476,0.527154730729819,0.5255856265635661,0.9290752202117272,0.7507734929972625,0.7417968674695135,0.3591931730023274,0.3579061483661143,0.9901625320786998,0.9888746255883611,oversample,0.8966440784731938,0.8946519648142744,0.5181944247366159,COMPLETE
704,0.6143919203254313,2025-09-23 14:34:37.032495,2025-09-23 14:34:37.344718,0 days 00:00:00.312223,0.00012858746918724656,gbtree,0.4015567526778394,8.966126660656073,lossguide,82.72332729168382,0.25978811790031087,6,7,0.3731702812571165,300,,0.36997336796469915,0.5774099721270436,undersample,0.7363375869258733,1.522229547219485,,,,0.3100007452647462,0.7140956085576825,0.7185708435708436,0.36997336796469915,0.6126750797392873,0.6143919203254313,0.5774099721270436,0.7563806739663288,0.750666996825404,0.4533141801764827,0.4570116861435726,0.9448246364414029,0.9370988446726572,undersample,0.8999397536894606,0.8982168974102465,0.7363375869258733,COMPLETE
705,0.6186406186406186,2025-09-23 14:34:37.490229,2025-09-23 14:35:27.401181,0 days 00:00:49.910952,0.013507364512024469,dart,0.6947630895445809,5.8963697915767534,lossguide,1.12303819986047,0.006372974608846187,6,12,90.43482341267051,800,tree,0.5235465818885595,0.9722492288500764,undersample,0.5873175763823777,0.7478033665916092,0.17786202319618666,weighted,0.2702290574711699,0.4607220574513951,0.8058143105742656,0.8081490581490581,0.5235465818885595,0.6239841427155599,0.6186406186406186,0.9722492288500764,0.664338272367319,0.6453001638975903,0.5814554857776136,0.5898331393092744,0.6732249786142002,0.6504065040650406,undersample,0.8655906941523839,0.8609423498352867,0.5873175763823777,COMPLETE
706,0.0,2025-09-23 14:35:27.532833,2025-09-23 14:35:27.995712,0 days 00:00:00.462879,0.00018854170273353455,gbtree,0.2172383267926235,2.737467934213935,depthwise,91.9299953711125,0.00044417291356191525,3,12,0.6038865774582931,200,,0.3636854312797905,0.7943878471703185,none,0.5214461013790999,1.479302917813863,,,,0.6483295113756185,0.7606715119254785,0.7607493857493858,0.3636854312797905,0.0,0.0,0.7943878471703185,0.7357216364955407,0.7326937817970202,0.0,0.0,0.0,0.0,none,0.8915606413334011,0.8921782006210093,0.5214461013790999,COMPLETE
707,0.6148282097649186,2025-09-23 14:35:28.126187,2025-09-23 14:36:18.930802,0 days 00:00:50.804615,20.70766036859749,dart,0.40727921867384387,8.430385979736485,lossguide,0.012671490808098094,0.46555735662416364,7,10,0.1416558160278209,800,tree,0.6140598758751152,0.5068854295195804,oversample,0.7004086750177276,0.5168585195120927,0.017100814765592054,uniform,0.54511153412744,0.756154597330732,0.847169618179957,0.8473587223587223,0.6140598758751152,0.6219296024309952,0.6148282097649186,0.5068854295195804,0.7526825188500892,0.7486856383245631,0.7622594661700807,0.7757496740547588,0.525235243798118,0.5091998288403937,oversample,0.8969689089437481,0.893435467087391,0.7004086750177276,COMPLETE
708,0.0,2025-09-23 14:36:19.055784,2025-09-23 14:36:46.371334,0 days 00:00:27.315550,4.66518618162672,dart,0.848206690644679,4.5432864156155155,depthwise,11.353775379315644,0.00023332178778906034,0,11,3.5675981502627425,700,tree,0.6958820835465845,0.9000496252886953,oversample,0.6886421362292721,0.8011614457353664,0.4192587241657767,uniform,0.2997324865463504,0.728013691876287,0.7606715119254785,0.7607493857493858,0.6958820835465845,0.0,0.0,0.9000496252886953,0.7576209283348752,0.7524109894325777,0.0,0.0,0.0,0.0,oversample,0.9045077847074177,0.9019662106614055,0.6886421362292721,COMPLETE
709,0.5988670083625574,2025-09-23 14:36:46.494495,2025-09-23 14:36:47.443068,0 days 00:00:00.948573,0.027470176723349633,gbtree,0.4776553063864102,6.0434644782651725,lossguide,0.5950105574530969,0.010811150172704497,8,8,2.033962888171224,700,,0.4946298367931602,0.5896135182351457,undersample,0.6480929929335026,3.195900414354961,,,,0.6226109567686815,0.6936226840004095,0.6955364455364456,0.4946298367931602,0.5977691170541594,0.5988670083625574,0.5896135182351457,0.7689718775614401,0.7633770587392164,0.4358220654516951,0.43726610202875715,0.951240376390077,0.9499358151476252,undersample,0.9015572292752289,0.900033956674692,0.6480929929335026,COMPLETE
710,0.5612097304404997,2025-09-23 14:36:47.567130,2025-09-23 14:36:48.126070,0 days 00:00:00.558940,42.77044236167406,gbtree,0.991240270027669,5.544666603572567,depthwise,2.6243994674904907,0.15311207356286205,4,6,0.4674432267398855,1000,,0.3138691430899062,0.5616910545814873,oversample,0.6282567946313846,1.0608437897886402,,,,0.9064465961617842,0.6530862933770089,0.6583742833742834,0.3138691430899062,0.5567037279267495,0.5612097304404997,0.5616910545814873,0.6706884974532437,0.6728101372000651,0.4009798379498775,0.4050873196659074,0.9101796407185628,0.9131364997860505,oversample,0.8495080316326802,0.8536881054380949,0.6282567946313846,COMPLETE
711,0.6422218754875956,2025-09-23 14:36:48.254105,2025-09-23 14:36:48.870241,0 days 00:00:00.616136,0.0006287661749867924,gbtree,0.7306121733847466,8.514615659389314,depthwise,0.0002445508985545168,0.005979999252536714,3,4,1.2713564589760016,600,,0.49548067343367574,0.6526391913849452,undersample,0.889482072477451,1.213018596651703,,,,0.4773995413496751,0.7533012590848602,0.7652538902538902,0.49548067343367574,0.6291166512773161,0.6422218754875956,0.6526391913849452,0.7207809893938351,0.7148077768778174,0.4913461538461538,0.5054027504911591,0.874251497005988,0.8806161745827985,undersample,0.8847639227571733,0.8872550586203225,0.889482072477451,COMPLETE
712,0.0,2025-09-23 14:36:48.995160,2025-09-23 14:36:52.008451,0 days 00:00:03.013291,0.3784407138926965,dart,0.9478117668791282,2.710829514670978,depthwise,0.00018654764063231278,0.00012620558170542136,3,12,43.14085106618877,200,tree,0.3536964137101709,0.8987252911076755,none,0.830399894183333,0.6118717556736254,0.40366394044857956,weighted,0.7207309342678336,0.867265424950374,0.7606715119254785,0.7607493857493858,0.3536964137101709,0.0,0.0,0.8987252911076755,0.7485359211795475,0.7443828453318462,0.0,0.0,0.0,0.0,none,0.8950484462760274,0.894045760146104,0.830399894183333,COMPLETE
713,0.6754370780682015,2025-09-23 14:36:52.133030,2025-09-23 14:36:52.801915,0 days 00:00:00.668885,0.0025821424213647165,gbtree,0.20880212210583135,5.369713822990418,depthwise,0.0003274499488399014,0.04668839741528868,7,9,2.47919545743118,800,,0.5169470823820141,0.6807245729257771,oversample,0.9753521329957265,0.9958152203530377,,,,0.7456988580502188,0.8078616030299929,0.808046683046683,0.5169470823820141,0.6788708297690333,0.6754370780682015,0.6807245729257771,0.7881515764337671,0.7790602289418133,0.5657256914741945,0.5671511627906977,0.8485885372112917,0.8348309798887462,oversample,0.908247493708586,0.9070548748961133,0.9753521329957265,COMPLETE
714,0.6283240568954854,2025-09-23 14:36:52.926418,2025-09-23 14:37:15.818776,0 days 00:00:22.892358,0.15942427429007638,dart,0.43335145063335,9.860155087105221,lossguide,0.00036136113597980824,0.013470640516726069,1,7,0.8232902344044996,600,forest,0.489065474642406,0.5230670282209888,oversample,0.7878597663402257,1.1367806309543624,0.19540005115866366,uniform,0.265369960450552,0.882857257099241,0.7414269628416419,0.7538902538902539,0.489065474642406,0.6161094224924012,0.6283240568954854,0.5230670282209888,0.6775203103391354,0.6731002471336484,0.47784064120697783,0.4918905833938514,0.8669803250641575,0.8694908001711597,oversample,0.8692107681516832,0.8731817242954105,0.7878597663402257,COMPLETE
715,0.6061050777810391,2025-09-23 14:37:15.947118,2025-09-23 14:37:16.383353,0 days 00:00:00.436235,6.739077952274268,gbtree,0.8985995278667533,4.776442969300378,lossguide,0.00023011698996211604,0.0034547210376937574,7,3,4.435300327173028,300,,0.4780800227211853,0.6018761700635795,none,0.5385320024201135,4.995219484449788,,,,0.9481659258234969,0.7240249769679599,0.7252252252252253,0.4780800227211853,0.6090487238979119,0.6061050777810391,0.6018761700635795,0.7164347466401824,0.7112074682693071,0.46072838964458096,0.46124637033727944,0.8982035928143712,0.8836114676936243,none,0.8771299894012078,0.8733234071817589,0.5385320024201135,COMPLETE
716,0.628955223880597,2025-09-23 14:37:16.505270,2025-09-23 14:37:17.049108,0 days 00:00:00.543838,64.8259193900087,gbtree,0.8134691084409582,2.474961833872756,lossguide,0.01937283520839503,0.0035574301927350977,8,11,3.0924443969872244,200,,0.6953711055712581,0.6875003096342849,undersample,0.87656358962941,2.876485932464577,,,,0.9189874093875259,0.7407104104821374,0.7454954954954955,0.6953711055712581,0.6286468259785956,0.628955223880597,0.6875003096342849,0.7032416396653978,0.6983098799073151,0.4782511710907874,0.48292459316983727,0.9170230966638152,0.9015832263585793,undersample,0.8835616154506836,0.8816970068432173,0.87656358962941,COMPLETE
717,0.4575638506876228,2025-09-23 14:37:17.173241,2025-09-23 14:37:18.851235,0 days 00:00:01.677994,0.0001195319683634455,gbtree,0.7827961271373083,2.1007806338304613,lossguide,0.00018593249890827595,0.0007711048677389359,2,8,65.86149004797936,800,,0.578532160319859,0.778238584980912,undersample,0.9831396984454845,3.8899186071492413,,,,0.32693948422249397,0.4302385095710922,0.4346846846846847,0.578532160319859,0.4558075870160344,0.4575638506876228,0.778238584980912,0.7295591792351531,0.7235780611185667,0.29543726235741447,0.29695269667219176,0.9970059880239521,0.9965768078733419,undersample,0.8817804151774886,0.8842131233075287,0.9831396984454845,COMPLETE
718,0.0,2025-09-23 14:37:18.976951,2025-09-23 14:37:19.957655,0 days 00:00:00.980704,0.003136989989513787,gbtree,0.7833115286612593,3.0601225026181913,depthwise,0.00032224855548689517,0.00016959614298746214,8,8,2.825235624395903,500,,0.6349986010481494,0.5840172333296372,none,0.6760673773786045,0.610866310073458,,,,0.9923954975012901,0.7606715119254785,0.7607493857493858,0.6349986010481494,0.0,0.0,0.5840172333296372,0.7887139393923396,0.7840414774313479,0.0,0.0,0.0,0.0,none,0.9057111568431279,0.9053093048832024,0.6760673773786045,COMPLETE
719,0.5905218317358892,2025-09-23 14:37:20.083432,2025-09-23 14:37:24.893776,0 days 00:00:04.810344,21.267033683642985,dart,0.7357414937165252,1.5291026461544666,depthwise,13.682529488618986,0.08302498324241182,7,4,0.18290372101807142,300,forest,0.6978453476457024,0.6596303292087655,none,0.8302449364480551,2.27696294223508,0.4364443500740604,weighted,0.0924998116435995,0.7230207917540301,0.8465554304432388,0.8425470925470926,0.6978453476457024,0.6039630118890357,0.5905218317358892,0.6596303292087655,0.75271309339235,0.7462501148138615,0.7899101589495507,0.7815362931642001,0.4888793840889649,0.47454000855798034,none,0.8964324076916816,0.8936977862862368,0.8302449364480551,COMPLETE
720,0.38612143742255267,2025-09-23 14:37:25.018956,2025-09-23 14:37:30.746584,0 days 00:00:05.727628,12.647559279052206,dart,0.9401478828596659,6.560600866774905,depthwise,0.01899098857706335,0.00658081476938312,7,12,6.873833591952315,300,tree,0.41142116304271115,0.6244308015405216,undersample,0.5457665425965758,2.050997182045959,0.2186967724568089,uniform,0.21703765929218005,0.6731898504667809,0.23932848807452145,0.23925061425061425,0.41142116304271115,0.3862228462872718,0.38612143742255267,0.6244308015405216,0.727191142379867,0.7195854996888977,0.23932848807452145,0.23925061425061425,1.0,1.0,undersample,0.8906793944264422,0.8876097696871408,0.5457665425965758,COMPLETE
721,0.6372212692967409,2025-09-23 14:37:30.869440,2025-09-23 14:37:31.514143,0 days 00:00:00.644703,0.009672119065843705,gbtree,0.35385931183773967,3.807452730430696,lossguide,0.0002383963160897144,0.4376430366249993,3,6,9.753075482959522,1000,,0.6636199921107987,0.6015861248690217,undersample,0.6779554712788975,1.0272564045385644,,,,0.26164867537846465,0.8305865492885659,0.8267813267813268,0.6636199921107987,0.6529670790522122,0.6372212692967409,0.6015861248690217,0.7311287219917977,0.7213975707213848,0.6404771698889345,0.6385904598195101,0.6659538066723696,0.6358579375267437,undersample,0.8701306079230893,0.8642847242700165,0.6779554712788975,COMPLETE
722,0.6896551724137931,2025-09-23 14:37:31.640462,2025-09-23 14:37:49.180871,0 days 00:00:17.540409,30.78936454536989,dart,0.31777234169973473,5.393480109890392,depthwise,7.516589241772085,0.2977556220923438,6,11,21.15259805298855,500,forest,0.6621281176195424,0.8140660187746489,oversample,0.6576893542775495,2.1458370302807035,0.044839454546097446,weighted,0.11452189999469532,0.9727311804326402,0.8107278124680111,0.8148034398034398,0.6621281176195424,0.6875105627851952,0.6896551724137931,0.8140660187746489,0.8057219702742995,0.8002896031132871,0.5683151718357083,0.5756013745704467,0.8699743370402053,0.8600770218228498,oversample,0.9178658370438314,0.916602879136753,0.6576893542775495,COMPLETE
723,0.0,2025-09-23 14:37:49.305114,2025-09-23 14:37:50.022055,0 days 00:00:00.716941,0.0018979977639599585,gbtree,0.7252162984511292,9.800334491231625,lossguide,6.880234885293594,0.00020498840602580014,6,8,0.7446893820891967,300,,0.5056839847174459,0.7246320107433766,none,0.8338194063779008,0.5265266670999282,,,,0.2920253365671565,0.7606715119254785,0.7607493857493858,0.5056839847174459,0.0,0.0,0.7246320107433766,0.7714106058364811,0.7645386784800541,0.0,0.0,0.0,0.0,none,0.9013965264004548,0.8993098796763631,0.8338194063779008,COMPLETE
724,0.5655839325564096,2025-09-23 14:37:50.149726,2025-09-23 14:37:51.666290,0 days 00:00:01.516564,80.90072291502152,gbtree,0.6680541535611688,7.862169991911064,depthwise,0.004652721909829854,0.00043767416277178144,6,10,12.428498815755189,800,,0.568167400564838,0.7429685433932488,oversample,0.931445268648569,1.9650924933403588,,,,0.7577357797495308,0.6376292353362678,0.6412776412776413,0.568167400564838,0.5633941785890478,0.5655839325564096,0.7429685433932488,0.7464133114120695,0.7421354116265045,0.395840554592721,0.3981497643567813,0.9769033361847733,0.9760376551133932,oversample,0.8960828271365454,0.8917289959079817,0.931445268648569,COMPLETE
