number,value,datetime_start,datetime_complete,duration,params_alpha,params_booster,params_colsample_bytree,params_gamma,params_grow_policy,params_lambda,params_learning_rate,params_max_delta_step,params_max_depth,params_min_child_weight,params_n_estimators,params_normalize_type,params_params_decision_threshold,params_params_feature_fraction,params_params_resampling,params_params_sample_rows,params_params_scale_pos_weight,params_rate_drop,params_sample_type,params_skip_drop,params_subsample,user_attrs_acc_test,user_attrs_acc_val,user_attrs_decision_threshold,user_attrs_f1_test,user_attrs_f1_val,user_attrs_feature_fraction,user_attrs_pr_auc_test,user_attrs_pr_auc_val,user_attrs_prec_test,user_attrs_prec_val,user_attrs_rec_test,user_attrs_rec_val,user_attrs_resampling_strategy,user_attrs_roc_auc_test,user_attrs_roc_auc_val,user_attrs_sample_rows,state
883,0.5458851391355832,2025-09-23 15:20:22.909183,2025-09-23 15:20:23.502103,0 days 00:00:00.592920,98.28668451498187,gbtree,0.7997687012314609,1.3480263095792988,depthwise,0.0007346152570884474,0.0167585940133251,6,8,0.3075254066703401,400,,0.30979793214480317,0.8612492289113843,undersample,0.783960256381095,3.842828227384451,,,,0.7693448491466512,0.6034394513256218,0.6073914823914824,0.30979793214480317,0.543698468786808,0.5458851391355832,0.8612492289113843,0.7675649383825286,0.7603520349712785,0.3751625487646294,0.37737393582187295,0.9871685201026519,0.9863072314933675,undersample,0.9055396617803093,0.9035294154229178,0.783960256381095,COMPLETE
884,0.38612143742255267,2025-09-23 15:20:23.629049,2025-09-23 15:20:25.794622,0 days 00:00:02.165573,0.0009067991282751611,gbtree,0.5150257531617186,2.2587191466196286,lossguide,49.2056544524165,0.00011393591449431194,10,8,18.226044078778667,700,,0.6926996513232015,0.5841224000646077,oversample,0.6323182553715634,4.835544201574727,,,,0.4958481628345028,0.23932848807452145,0.23925061425061425,0.6926996513232015,0.3862228462872718,0.38612143742255267,0.5841224000646077,0.6794743108961718,0.6708578011076909,0.23932848807452145,0.23925061425061425,1.0,1.0,oversample,0.8742325890925342,0.8743953716655072,0.6323182553715634,COMPLETE
885,0.6290439576381837,2025-09-23 15:20:25.923059,2025-09-23 15:20:26.451752,0 days 00:00:00.528693,21.05026478658927,gbtree,0.7450945806842104,8.684125166188426,depthwise,0.6122145180246567,0.3710284957774802,8,3,4.568582977604276,800,,0.3775381803336428,0.5535436881416342,none,0.9804057870156477,4.372139613364678,,,,0.714018859727702,0.7366158255706827,0.7382268632268633,0.3775381803336428,0.6279103398409255,0.6290439576381837,0.5535436881416342,0.7428694489672869,0.7382914454834043,0.47432816255188986,0.47585601404741,0.9285714285714286,0.9276850663243474,none,0.897039993489001,0.8974629636443614,0.9804057870156477,COMPLETE
886,0.6368907021687782,2025-09-23 15:20:26.606904,2025-09-23 15:20:26.933867,0 days 00:00:00.326963,18.44027391940139,gbtree,0.4451710623879024,1.5235644512480218,lossguide,1.758873886009638,0.1763523407900096,1,5,1.8308273497323693,200,,0.3060914447322541,0.5088703415094973,none,0.9413969947121252,0.6735788764092838,,,,0.921929110481903,0.8232162964479476,0.8268837018837019,0.3060914447322541,0.6374133949191686,0.6368907021687782,0.5088703415094973,0.7096252950800715,0.7036240955632406,0.625979381443299,0.6392241379310345,0.649272882805817,0.6345742404792469,none,0.8805554011073534,0.8839848932241953,0.9413969947121252,COMPLETE
887,0.6440079452659457,2025-09-23 15:20:27.063345,2025-09-23 15:21:24.485289,0 days 00:00:57.421944,0.0752143338502219,dart,0.8140030964217395,5.230643835246504,depthwise,0.16900574382370315,0.01519015965180813,1,8,2.1157415173162515,1000,forest,0.6013862254217952,0.6446174239910818,oversample,0.6365212467377028,0.6464426164448444,0.33742968216936264,weighted,0.3753920308385444,0.616275233526324,0.8338622172177296,0.8348689598689598,0.6013862254217952,0.6477100065118299,0.6440079452659457,0.6446174239910818,0.7203916164538653,0.7163864971857711,0.6575583957690613,0.6649954421148587,0.6381522668947819,0.6243046640992725,oversample,0.8870348293550738,0.888999217850581,0.6365212467377028,COMPLETE
888,0.676056338028169,2025-09-23 15:21:24.614366,2025-09-23 15:22:21.313698,0 days 00:00:56.699332,0.49339248184702095,dart,0.3346945807396259,5.896943718144931,depthwise,0.26671154091463406,0.015381156633776755,1,6,0.8818609663964838,900,forest,0.5206078716671203,0.9415848114422773,oversample,0.9550473819451613,0.5398422956410117,0.19968214665846812,uniform,0.8077532481117551,0.7954621527851997,0.8415395639267069,0.8398853398853399,0.5206078716671203,0.682916837361737,0.676056338028169,0.9415848114422773,0.7547876497130894,0.747802132717293,0.6552672955974843,0.6551585708550783,0.7130025662959795,0.6983311938382541,oversample,0.9009958052635718,0.9012938719574817,0.9550473819451613,COMPLETE
889,0.6650414431984398,2025-09-23 15:22:21.443820,2025-09-23 15:23:16.942694,0 days 00:00:55.498874,1.019254840148668,dart,0.762665974250542,8.097929592554356,lossguide,0.00012068576988327923,0.0011888125626177103,7,7,54.415785585240066,900,tree,0.607093329998075,0.9058516294245358,oversample,0.6316771209010623,1.7058562581918826,0.494292283743665,uniform,0.859206196425631,0.7347948744492816,0.7825775412017607,0.789004914004914,0.607093329998075,0.6610277689115863,0.6650414431984398,0.9058516294245358,0.7802322222188671,0.772883433218053,0.5272403258655805,0.5361635220125787,0.8857998289136013,0.8754813863928113,oversample,0.9080267574891165,0.9052589197884839,0.6316771209010623,COMPLETE
890,0.0,2025-09-23 15:23:17.070712,2025-09-23 15:24:20.202847,0 days 00:01:03.132135,0.3659119830240681,dart,0.7815667363251702,9.789578281417805,depthwise,0.4638036989716376,0.0003854302002156992,1,5,30.102353150678443,1000,tree,0.5361441522236585,0.6424373500100558,none,0.640387303858637,1.2362039680037868,0.3257719348705459,uniform,0.650231299498723,0.9896962354885352,0.7606715119254785,0.7607493857493858,0.5361441522236585,0.0,0.0,0.6424373500100558,0.7142837057949646,0.7007173508722556,0.0,0.0,0.0,0.0,none,0.8869112228280046,0.8837272670370289,0.640387303858637,COMPLETE
891,0.5312609559425032,2025-09-23 15:24:20.331386,2025-09-23 15:25:16.893448,0 days 00:00:56.562062,0.07900540449213825,dart,0.6818652435357735,3.2156693476539386,lossguide,0.008672332852157781,0.0076365660761421456,6,12,26.04303341172606,900,tree,0.5125873971189628,0.5120594380122103,oversample,0.9532935041160269,2.1073882379337787,0.27889655005438135,weighted,0.06767370888318874,0.4644151510659036,0.5791790357252533,0.5893734643734644,0.5125873971189628,0.524244879064923,0.5312609559425032,0.5120594380122103,0.6883938330256938,0.6841027272676372,0.35935268919562113,0.36543408360128615,0.9687767322497861,0.9726144629867352,oversample,0.8700694521908372,0.8722812994655668,0.9532935041160269,COMPLETE
892,0.5554059017999265,2025-09-23 15:25:17.023318,2025-09-23 15:25:18.490900,0 days 00:00:01.467582,2.5862789748007233,gbtree,0.9294791640855431,1.6667383481753972,lossguide,98.33341622624262,0.0007851200749255334,6,8,0.21687590631768427,400,,0.6383983580492978,0.9245845033746098,undersample,0.6054240759038103,3.132212619379636,,,,0.8644125129379339,0.6207390725765175,0.6282760032760033,0.6383983580492978,0.5506367495451789,0.5554059017999265,0.9245845033746098,0.6694471934497245,0.6606178000497309,0.38428982563060776,0.38902229845626074,0.9709153122326775,0.9704749679075738,undersample,0.8841262915083381,0.8823634145017056,0.6054240759038103,COMPLETE
893,0.38612143742255267,2025-09-23 15:25:18.618168,2025-09-23 15:25:32.240990,0 days 00:00:13.622822,0.0012274198724346866,dart,0.3636768711895516,5.43309467361948,depthwise,46.94956344845548,0.0003759412110676902,0,3,0.1163139887405443,500,tree,0.3479884959095587,0.5812373023280923,oversample,0.9727409177078185,0.7104519720477412,0.3517840716346544,weighted,0.1670905196124249,0.8998211914552408,0.23932848807452145,0.23925061425061425,0.3479884959095587,0.3862228462872718,0.38612143742255267,0.5812373023280923,0.6830261468194968,0.6768763617080529,0.23932848807452145,0.23925061425061425,1.0,1.0,oversample,0.871613253106222,0.8747397465900375,0.9727409177078185,COMPLETE
894,0.6827731092436975,2025-09-23 15:25:32.369911,2025-09-23 15:25:32.949474,0 days 00:00:00.579563,66.29507481688447,gbtree,0.6613133602664054,0.9453007638198141,depthwise,0.005642147285511256,0.33602989457635607,0,10,0.15491540699516412,900,,0.36576824665841645,0.8388318994612649,none,0.8389307118777937,1.0400173192408977,,,,0.2960838178481464,0.8488074521445389,0.8454135954135954,0.36576824665841645,0.6945191313340228,0.6827731092436975,0.8388318994612649,0.7764512824554209,0.7705040925362261,0.6724068882659191,0.6706562113082954,0.7181351582549187,0.6953359007274283,none,0.9062092666849242,0.9055779582082415,0.8389307118777937,COMPLETE
895,0.6548089591567853,2025-09-23 15:25:33.080450,2025-09-23 15:25:42.177393,0 days 00:00:09.096943,1.0718745127234741,dart,0.7938007865892636,7.6086649967707585,lossguide,0.0005023653895635275,0.4443411462739399,9,9,2.175544661954385,400,tree,0.5807996500860618,0.5651899800084619,undersample,0.5328151855078175,1.42853700527153,0.3135028704358032,weighted,0.3715956912178931,0.30485998693919447,0.7795066025181697,0.7854217854217854,0.5807996500860618,0.6495281483891963,0.6548089591567853,0.5651899800084619,0.6926616970775369,0.686370395100647,0.5241596638655462,0.5322623828647925,0.853721129170231,0.85066324347454,undersample,0.8856785247199815,0.8856114968306048,0.5328151855078175,COMPLETE
896,0.630398472918158,2025-09-23 15:25:42.310062,2025-09-23 15:26:09.542766,0 days 00:00:27.232704,0.1418010184788982,dart,0.24167858721629668,7.800889935179439,depthwise,18.919129173612927,0.04556309201649109,10,4,4.289561961278868,800,forest,0.3079972541946112,0.6543245888308048,none,0.9562064239281276,0.6495036671917314,0.42694955490090314,uniform,0.10183005431497176,0.37501881610808435,0.8423584809089979,0.8414209664209664,0.3079972541946112,0.6403549743110696,0.630398472918158,0.6543245888308048,0.7355773966527914,0.7293014757507956,0.7052469135802469,0.7125134843581445,0.586398631308811,0.5652545999144202,none,0.8893583154931269,0.8841415764730285,0.9562064239281276,COMPLETE
897,0.6517816179844013,2025-09-23 15:26:09.672965,2025-09-23 15:27:10.789991,0 days 00:01:01.117026,18.13673730349595,dart,0.9821414679896103,7.894779780584925,lossguide,0.07530941969539924,0.0017761348365709214,4,12,1.2483632971047718,900,forest,0.5268121114219906,0.9140499817940009,oversample,0.9595334232883341,1.7593692404857186,0.28186481398161467,weighted,0.8457054855932322,0.5441611672137285,0.7601596888115467,0.7668918918918919,0.5268121114219906,0.6471916879987953,0.6517816179844013,0.9140499817940009,0.797529339539657,0.7881431934271836,0.49941900999302813,0.5071394574012376,0.9191616766467066,0.9118528027385537,oversample,0.9127967031505937,0.9095816154175396,0.9595334232883341,COMPLETE
898,0.6188856918650275,2025-09-23 15:27:10.919258,2025-09-23 15:27:11.405849,0 days 00:00:00.486591,0.26736033821837485,gbtree,0.530261800433667,8.132163185252747,depthwise,4.2554344390307515,0.0072515649162017285,9,8,3.573445888889287,300,,0.6364708958515076,0.6452837788436694,undersample,0.9913618042507164,0.6364969523626804,,,,0.2851875769380418,0.8523902139420616,0.8508394758394758,0.6364708958515076,0.628158844765343,0.6188856918650275,0.6452837788436694,0.777123902112011,0.7707046474272038,0.7909090909090909,0.7960969044414535,0.5209580838323353,0.5062045357295678,undersample,0.9070323796722836,0.9054605753332888,0.9913618042507164,COMPLETE
899,0.6928632115548004,2025-09-23 15:27:11.535270,2025-09-23 15:27:12.198572,0 days 00:00:00.663302,6.535830563458189,gbtree,0.32533966343571197,2.8721041645122347,depthwise,18.50253288524884,0.036134537532083996,5,4,20.001884930850895,800,,0.6858071429100598,0.6170383364060557,undersample,0.9365475359205448,1.0618553213873867,,,,0.7338738794283319,0.8509571092230526,0.851965601965602,0.6858071429100598,0.695906432748538,0.6928632115548004,0.6170383364060557,0.7951328376135691,0.7878387105539086,0.68,0.6878954027836356,0.7125748502994012,0.6979032948224219,undersample,0.9130102445780335,0.9118634267956687,0.9365475359205448,COMPLETE
900,0.6682948490230906,2025-09-23 15:27:12.328435,2025-09-23 15:27:55.912803,0 days 00:00:43.584368,0.00047038389964356727,dart,0.24405545679518142,7.324571661407048,depthwise,1.3644320982492104,0.015590646683454912,1,12,32.29602992997133,900,forest,0.3853607345659325,0.981261689825439,none,0.6841213551359736,0.9937114256342913,0.3430693597892939,weighted,0.22117767480656356,0.7425585706385358,0.8496263691268298,0.847051597051597,0.3853607345659325,0.6744959007312209,0.6682948490230906,0.981261689825439,0.7589710960700915,0.7506463021457519,0.6997701149425287,0.6945085371481311,0.65098374679213,0.6439880188275567,none,0.9023445409774488,0.9021679525806584,0.6841213551359736,COMPLETE
901,0.6195574589578873,2025-09-23 15:27:56.041746,2025-09-23 15:29:00.449369,0 days 00:01:04.407623,0.0003715014638903142,dart,0.6591756464584744,8.725232116165287,depthwise,0.05027089547357279,0.028977168920407137,6,7,17.342536745654073,1000,forest,0.6033750121460761,0.5838458902372097,oversample,0.6512958458659415,4.463739460105097,0.16363796167198597,uniform,0.3111437134288906,0.4860556488700805,0.7226942368717372,0.7271703521703522,0.6033750121460761,0.6179664363277394,0.6195574589578873,0.5838458902372097,0.7172104704107629,0.703156388956184,0.46097201767304863,0.46486718080548417,0.937125748502994,0.928540864356012,oversample,0.8906397367327746,0.8888419587720939,0.6512958458659415,COMPLETE
902,0.5686599515491522,2025-09-23 15:29:00.579396,2025-09-23 15:29:01.561566,0 days 00:00:00.982170,73.21554125396702,gbtree,0.27801721325855255,2.071169870542442,depthwise,1.895680338007316,0.0004219008738493157,2,11,0.2687104129708807,800,,0.452814513058979,0.6044275637857426,oversample,0.9129846796421619,0.9801885666144713,,,,0.5285227054067354,0.6534957518681543,0.6536650286650286,0.452814513058979,0.5681847174384488,0.5686599515491522,0.6044275637857426,0.6992026091862468,0.6907400820421977,0.4048354844573714,0.40501271340355977,0.9525235243798118,0.9542148053059478,oversample,0.8700847914874444,0.865233317250411,0.9129846796421619,COMPLETE
903,0.0,2025-09-23 15:29:01.694839,2025-09-23 15:29:10.054718,0 days 00:00:08.359879,2.6885155449489,dart,0.48983668499670563,4.561534104347455,depthwise,7.608901373719799,0.0009072824047346062,7,5,7.153326474203233,400,forest,0.6099927502628419,0.9809258755451252,undersample,0.5040499245006929,0.6754988157099254,0.47721061812328475,uniform,0.4347071292482798,0.42865176191730675,0.7606715119254785,0.7607493857493858,0.6099927502628419,0.0,0.0,0.9809258755451252,0.727558029580476,0.7197198958672594,0.0,0.0,0.0,0.0,undersample,0.8901694275673809,0.8882658987863066,0.5040499245006929,COMPLETE
904,0.0,2025-09-23 15:29:10.182055,2025-09-23 15:29:10.553977,0 days 00:00:00.371922,90.04050875542234,gbtree,0.7855328480154495,4.224922386327031,lossguide,0.517299170319729,0.0002785443735063949,10,8,11.538468907740985,200,,0.6615602776504358,0.8458473085678258,undersample,0.804604113472029,0.6094902767718986,,,,0.4504589743884915,0.7606715119254785,0.7607493857493858,0.6615602776504358,0.0,0.0,0.8458473085678258,0.655495329322693,0.6470738647549745,0.0,0.0,0.0,0.0,undersample,0.864574041259427,0.8633687232480339,0.804604113472029,COMPLETE
905,0.66930761281433,2025-09-23 15:29:10.681477,2025-09-23 15:29:56.221805,0 days 00:00:45.540328,37.093108757984744,dart,0.6868816263469439,0.5072500412640779,lossguide,0.0004745797553615965,0.3026132662071446,4,12,11.83440128127391,800,forest,0.6213860317890518,0.7501698191889401,none,0.9709070592822044,4.276689168761842,0.293326813787217,weighted,0.619624446241232,0.5309979586111857,0.8029481011362473,0.8034398034398035,0.6213860317890518,0.6726747151844924,0.66930761281433,0.7501698191889401,0.7763188939277055,0.7702683062575053,0.5582839401637031,0.5601037763044104,0.8460222412318221,0.8314077877620881,none,0.9034539203500837,0.9027785335541987,0.9709070592822044,COMPLETE
906,0.6984186046511628,2025-09-23 15:29:56.350400,2025-09-23 15:30:40.374661,0 days 00:00:44.024261,0.0022598186280570055,dart,0.6689137953472539,9.666971339817572,depthwise,0.009856358595739871,0.19233858296034168,0,3,0.934648967158702,900,tree,0.4907712136363619,0.6349912084285116,none,0.8055003774250817,2.2184625058036738,0.3564093043695788,weighted,0.28393846027037845,0.4306456068488264,0.8317125601392159,0.834049959049959,0.4907712136363619,0.6963428149242704,0.6984186046511628,0.6349912084285116,0.8068454810883996,0.7995210097499575,0.6128088426527959,0.6178406846609612,0.8062446535500428,0.8031664527171587,none,0.9165673497574895,0.9151480455161096,0.8055003774250817,COMPLETE
907,0.38612143742255267,2025-09-23 15:30:40.502689,2025-09-23 15:30:43.774340,0 days 00:00:03.271651,0.009678997422598257,gbtree,0.5649698868540298,3.4385609057374475,lossguide,11.41251692640549,0.00011672646723261727,4,12,1.5398053889530818,300,,0.44761903636656486,0.730154617845105,oversample,0.6575524891681117,2.0721624606776343,,,,0.6833904069100459,0.23932848807452145,0.23925061425061425,0.44761903636656486,0.3862228462872718,0.38612143742255267,0.730154617845105,0.6958334309537078,0.6843533109988623,0.23932848807452145,0.23925061425061425,1.0,1.0,oversample,0.8858863390929658,0.8866536333382797,0.6575524891681117,COMPLETE
908,0.38612143742255267,2025-09-23 15:30:43.903056,2025-09-23 15:30:53.694615,0 days 00:00:09.791559,15.435741645741418,dart,0.8973939022545185,5.707771096976636,depthwise,0.04374834118495704,0.00022253426730892042,9,10,2.5782413204664727,400,forest,0.3789311771490698,0.9377888202605738,undersample,0.617965809770858,2.178074417864541,0.19161416286787097,weighted,0.06224133564097,0.7674335005129327,0.23932848807452145,0.23925061425061425,0.3789311771490698,0.3862228462872718,0.38612143742255267,0.9377888202605738,0.7302882686899395,0.7261651862734436,0.23932848807452145,0.23925061425061425,1.0,1.0,undersample,0.8918924651418081,0.8900226686859862,0.617965809770858,COMPLETE
909,0.6299605235819655,2025-09-23 15:30:53.822353,2025-09-23 15:30:55.826425,0 days 00:00:02.004072,5.373722050242277,gbtree,0.26203431083832474,2.701089865019001,lossguide,0.00010798482912875758,0.0002240497220631228,1,9,19.30805603472061,1000,,0.5920851936127545,0.5198116186974756,none,0.9887292874956639,4.400451565146054,,,,0.707202297199766,0.820247722387143,0.8176699426699426,0.5920851936127545,0.6377887788778878,0.6299605235819655,0.5198116186974756,0.6950319497077199,0.6891684193581031,0.6159362549800796,0.6122778675282714,0.6612489307100086,0.6486949080017116,none,0.8752678333280955,0.8732484341608179,0.9887292874956639,COMPLETE
910,0.0851063829787234,2025-09-23 15:30:55.956045,2025-09-23 15:30:56.898059,0 days 00:00:00.942014,0.6203771040195065,gbtree,0.813838195354752,7.724880208951234,depthwise,0.025516091956982043,0.0022244656901071053,7,9,0.10912458928841999,600,,0.6430689639941419,0.563905006919089,none,0.5114134809988657,0.5936436636678875,,,,0.5238890257841027,0.7722387143003379,0.7710892710892711,0.6430689639941419,0.09294741133306156,0.0851063829787234,0.563905006919089,0.7178469268982713,0.7018537414430026,0.991304347826087,0.9719626168224299,0.04875962360992301,0.044501497646555414,none,0.8819416360772889,0.8815967261089861,0.5114134809988657,COMPLETE
911,0.0,2025-09-23 15:30:57.026032,2025-09-23 15:31:47.942535,0 days 00:00:50.916503,2.4692538519198584,dart,0.8164523978761751,7.855108884798174,lossguide,0.5502237555810159,0.000400155658569813,1,4,0.21823956396260855,900,tree,0.5554769598756124,0.6828533408553781,none,0.649829025291062,0.8560833422786421,0.22236881175178314,weighted,0.5787745113951908,0.9740147939042232,0.7606715119254785,0.7607493857493858,0.5554769598756124,0.0,0.0,0.6828533408553781,0.6383841768415852,0.6351306495640052,0.0,0.0,0.0,0.0,none,0.8604475690179133,0.8653398745278701,0.649829025291062,COMPLETE
912,0.6947890818858561,2025-09-23 15:31:48.070132,2025-09-23 15:31:48.765793,0 days 00:00:00.695661,19.12883812749553,gbtree,0.5813320424938879,9.638053875283688,depthwise,38.527373554832614,0.04228388809662813,10,10,4.387358710389528,700,,0.5243781565961577,0.8121078220463496,none,0.877322776646289,3.2964597832383755,,,,0.4648159701283981,0.8182004299314157,0.8237100737100738,0.5243781565961577,0.6895104895104895,0.6947890818858561,0.8121078220463496,0.8013768056623072,0.7960658411591397,0.5830869308101715,0.5930408472012103,0.8434559452523525,0.8386820710312366,none,0.9158466906086321,0.9153416394457594,0.877322776646289,COMPLETE
913,0.578386605783866,2025-09-23 15:31:48.899658,2025-09-23 15:32:53.657916,0 days 00:01:04.758258,2.3869158938426915,dart,0.32333621467080187,4.645070047461221,depthwise,0.0004397710929180935,0.32715205808751313,6,7,11.984425591571801,1000,forest,0.35719919353737845,0.9432775459188971,oversample,0.8696000017986073,4.175075117442431,0.2653712207215087,uniform,0.6191755380419863,0.4024854813244563,0.6552359504555225,0.6597051597051597,0.35719919353737845,0.5750693918748423,0.578386605783866,0.9432775459188971,0.7968467920207498,0.7879925170144119,0.40783822476735865,0.411032990805841,0.974764756201882,0.975609756097561,oversample,0.9161571027159592,0.9130435608799067,0.8696000017986073,COMPLETE
914,0.5860892388451444,2025-09-23 15:32:53.786124,2025-09-23 15:32:55.713765,0 days 00:00:01.927641,10.77694075833682,gbtree,0.6741183439877119,3.0909554144177775,lossguide,2.4912970506945817,0.0011169351835151966,5,5,0.19391390926830643,1000,,0.38172285082264795,0.729745370024482,none,0.9488839408721885,4.731012516396403,,,,0.4439351196174854,0.6689528099088955,0.6771089271089271,0.38172285082264795,0.5814134092674087,0.5860892388451444,0.729745370024482,0.7692175802356742,0.7614438696569417,0.41685226429101707,0.4226765095589627,0.960650128314799,0.9554985023534446,none,0.9025146546401979,0.9000024587926222,0.9488839408721885,COMPLETE
