number,value,datetime_start,datetime_complete,duration,params_alpha,params_booster,params_colsample_bytree,params_gamma,params_grow_policy,params_lambda,params_learning_rate,params_max_delta_step,params_max_depth,params_min_child_weight,params_n_estimators,params_normalize_type,params_params_decision_threshold,params_params_feature_fraction,params_params_resampling,params_params_sample_rows,params_params_scale_pos_weight,params_rate_drop,params_sample_type,params_skip_drop,params_subsample,user_attrs_acc_test,user_attrs_acc_val,user_attrs_decision_threshold,user_attrs_f1_test,user_attrs_f1_val,user_attrs_feature_fraction,user_attrs_pr_auc_test,user_attrs_pr_auc_val,user_attrs_prec_test,user_attrs_prec_val,user_attrs_rec_test,user_attrs_rec_val,user_attrs_resampling_strategy,user_attrs_roc_auc_test,user_attrs_roc_auc_val,user_attrs_sample_rows,state
1527,0.6978361669242659,2025-09-23 21:08:50.662928,2025-09-23 21:08:51.957316,0 days 00:00:01.294388,1.253498846868438,gbtree,0.2509817375047287,1.6144315263001048,lossguide,0.0030757598752189186,0.00993249998610688,10,7,0.3542565707758576,300,,0.4145189767831026,0.9133662794615109,none,0.7354383798162426,1.501011994917256,,,,0.6289733012201983,0.8392875422254069,0.8398853398853399,0.4145189767831026,0.700038211692778,0.6978361669242659,0.9133662794615109,0.7970364151934117,0.7904799350843581,0.6325966850828729,0.6361394857344135,0.7835757057313943,0.772785622593068,none,0.9162603623711687,0.9144950834800404,0.7354383798162426,COMPLETE
1528,0.694012258368694,2025-09-23 21:08:52.095938,2025-09-23 21:09:25.125822,0 days 00:00:33.029884,0.15048488694355824,dart,0.35934007659433476,3.926322892651512,depthwise,0.010035800124624124,0.2724064178459557,9,11,0.20242979583775295,700,forest,0.3466181439070112,0.9619530820823212,none,0.9565989980300568,0.5666630637209638,0.21409612285806767,uniform,0.8823448496312565,0.9865580762135686,0.8679496366055891,0.8671171171171171,0.3466181439070112,0.6968984962406015,0.694012258368694,0.9619530820823212,0.8182292218352758,0.8129529582397962,0.7732012513034411,0.7727034120734908,0.6343028229255774,0.629867351305092,none,0.9207894551746614,0.9201430222661234,0.9565989980300568,COMPLETE
1529,0.7217337967695767,2025-09-23 21:09:25.260310,2025-09-23 21:09:25.985702,0 days 00:00:00.725392,0.0002967034619035716,gbtree,0.8318114200637485,5.6567658995199315,depthwise,3.0488241854956675,0.05116563359243886,0,8,7.977872450054104,200,,0.634574391999375,0.9998336067214285,none,0.9445241184111272,2.89979751651926,,,,0.844602608941011,0.8605793837649708,0.8606674856674856,0.634574391999375,0.7230581537210248,0.7217337967695767,0.9998336067214285,0.8253331810286775,0.8190738516108049,0.6891472868217055,0.6910728269381362,0.7604790419161677,0.7552417629439452,none,0.9267160356028237,0.9251134974643629,0.9445241184111272,COMPLETE
1530,0.6858265782363056,2025-09-23 21:09:26.120692,2025-09-23 21:10:14.184454,0 days 00:00:48.063762,0.00040814135095887713,dart,0.2577813001295083,2.287159904597626,lossguide,0.00010455602558859008,0.011337274853070858,6,8,0.19008132456731733,800,forest,0.6601789740489867,0.9219395338412346,none,0.8743719805740648,1.8753807596068375,0.0757088954850151,uniform,0.518297656613317,0.6555207857857416,0.8700992936841028,0.8690622440622441,0.6601789740489867,0.6891991182953711,0.6858265782363056,0.9219395338412346,0.825032105859194,0.8190297827123655,0.8063037249283668,0.8050749711649365,0.6017964071856288,0.59734702610184,none,0.9264669519027579,0.9254052991414897,0.8743719805740648,COMPLETE
1531,0.6978879706152433,2025-09-23 21:10:14.318787,2025-09-23 21:10:15.113984,0 days 00:00:00.795197,0.00043543746874697944,gbtree,0.7414934364330308,7.832248430514548,depthwise,3.2452734846221722,0.015499475078196644,4,6,3.091270157766327,300,,0.6695139977910628,0.9364980312685364,none,0.8145085235911276,2.6001464947326047,,,,0.8706559315375941,0.8696898351929573,0.8652743652743653,0.6695139977910628,0.7107475573733243,0.6978879706152433,0.9364980312685364,0.8149505315940713,0.8043878746905136,0.7581192438196801,0.7528479445269936,0.6689478186484175,0.6504065040650406,none,0.9212333162845542,0.9187453109471493,0.8145085235911276,COMPLETE
1532,0.712193109139674,2025-09-23 21:10:15.248514,2025-09-23 21:10:16.575287,0 days 00:00:01.326773,0.006043273899862484,gbtree,0.7825621204435845,3.443788811127675,lossguide,1.1036544571243347,0.016522784957163965,1,7,7.57313379443755,300,,0.5911815446877385,0.9484385364151884,none,0.9889793252696687,2.480356678915619,,,,0.7930155202280286,0.8579179035725253,0.8571867321867321,0.5911815446877385,0.7145207733443028,0.712193109139674,0.9484385364151884,0.8206197582940804,0.81270290172442,0.6881933438985737,0.6876494023904383,0.7429426860564585,0.7385537013264869,none,0.9240532142934846,0.9217550573822888,0.9889793252696687,COMPLETE
1533,0.6677532013969733,2025-09-23 21:10:16.710165,2025-09-23 21:11:20.057660,0 days 00:01:03.347495,0.00011324919147541293,dart,0.37521895756802154,2.1226148686381565,lossguide,0.07409843031952353,0.00036008291424142666,5,8,0.3093463931737526,900,forest,0.5156608006971941,0.8480515672856704,none,0.7709823528298325,2.8168520536016377,0.14452046619275696,weighted,0.7734170061971133,0.35553606915235936,0.8546422356433616,0.8539107289107289,0.5156608006971941,0.6720554272517321,0.6677532013969733,0.8480515672856704,0.7720546261411452,0.7639796511840008,0.7304216867469879,0.7323799795709908,0.6223267750213858,0.613607188703466,none,0.9070148531588993,0.9055679675637458,0.7709823528298325,COMPLETE
1534,0.6908150064683053,2025-09-23 21:11:20.191865,2025-09-23 21:11:20.844554,0 days 00:00:00.652689,0.003232465045493458,gbtree,0.4813097861299753,6.083147873684894,lossguide,0.00022706897624526364,0.102722951821499,10,10,5.1467556101688885,400,,0.31619498550297664,0.8637046190507183,none,0.9251369437737639,0.6637986963453676,,,,0.6984869092818279,0.858941549800389,0.8531941031941032,0.31619498550297664,0.7056813327637762,0.6908150064683053,0.8637046190507183,0.7996203564331161,0.7882465023619032,0.7047781569965871,0.6962190352020861,0.7065868263473054,0.6854942233632862,none,0.9148890637894866,0.911117986517179,0.9251369437737639,COMPLETE
1535,0.7141153081510935,2025-09-23 21:11:20.978693,2025-09-23 21:11:21.526972,0 days 00:00:00.548279,0.00018478971504078614,gbtree,0.8797433202030585,5.225648386197046,depthwise,6.2495579889558215,0.33509420616764546,0,7,22.84407660081436,200,,0.6608956059712745,0.93828284975685,none,0.907944414910336,3.8491961729654345,,,,0.8679861900159049,0.8516736615825571,0.8527846027846028,0.6608956059712745,0.7158266326730731,0.7141153081510935,0.93828284975685,0.8190415115024572,0.808139664500213,0.6609923940601231,0.6669142220571853,0.7805816937553465,0.7685066324347454,none,0.9237735383377084,0.9210091276485933,0.907944414910336,COMPLETE
1536,0.7007513285688107,2025-09-23 21:11:21.660539,2025-09-23 21:11:23.526261,0 days 00:00:01.865722,0.00015955377185525562,gbtree,0.8535074922360557,2.79859212256412,depthwise,0.00016429824803496573,0.01980131317178286,1,11,0.7525842948968173,600,,0.5469689142953338,0.9068155725049974,none,0.7970567267319042,3.923710835785614,,,,0.5530192618469154,0.8324291124987204,0.8328214578214578,0.5469689142953338,0.7024177422286857,0.7007513285688107,0.9068155725049974,0.8049702791040274,0.7937742148892961,0.6108125197597217,0.6128205128205129,0.8263473053892215,0.8181429182712879,none,0.9198921207127241,0.9151727773997457,0.7970567267319042,COMPLETE
1537,0.672663668165917,2025-09-23 21:11:23.660603,2025-09-23 21:12:36.031078,0 days 00:01:12.370475,0.00021609796657657217,dart,0.4108364471066611,0.16839999127755112,depthwise,0.05087885037967676,0.0037024429651014937,8,10,0.10621546773847354,1000,forest,0.4717092910205712,0.9969337474185841,none,0.9655339870210592,0.7755947195401643,0.13839015316827186,uniform,0.5151770617856506,0.22011017835254165,0.8674378134916573,0.8658886158886159,0.4717092910205712,0.6782608695652174,0.672663668165917,0.9969337474185841,0.8200661729281011,0.8118500419390988,0.8091286307053942,0.8084084084084084,0.5838323353293413,0.5759520753102267,none,0.9236241744551729,0.9213820637239583,0.9655339870210592,COMPLETE
1538,0.7050388368850826,2025-09-23 21:12:36.164476,2025-09-23 21:13:10.657952,0 days 00:00:34.493476,0.0029471332596152713,dart,0.9393320954687636,6.885288682323327,depthwise,0.14186674529684898,0.08691510016633568,0,12,1.7892662799586596,700,forest,0.6762011274384345,0.8543514442683734,none,0.7226140250904418,4.471904477316571,0.2170781094608721,uniform,0.546518661581024,0.8801345489339915,0.8506500153546934,0.8483824733824734,0.6762011274384345,0.7135283722756725,0.7050388368850826,0.8543514442683734,0.8148759766696734,0.8080248874911684,0.6595281306715064,0.6594634873323398,0.7771599657827203,0.7573812580231065,none,0.9193496909520253,0.9185396245947671,0.7226140250904418,COMPLETE
1539,0.7107806691449814,2025-09-23 21:13:10.793014,2025-09-23 21:13:11.557884,0 days 00:00:00.764870,0.000592926891659824,gbtree,0.7542388756781122,7.69356490634046,depthwise,0.46815961064066275,0.03215132830971838,0,8,6.249430383258454,300,,0.48857965014011995,0.9568731634644719,none,0.9335600337249353,2.269755986849167,,,,0.9264124342838781,0.8418466577950661,0.8407043407043407,0.48857965014011995,0.7143649473100389,0.7107806691449814,0.9568731634644719,0.8245440302050322,0.817177496529571,0.629111038749593,0.6283273085770621,0.8263473053892215,0.8181429182712879,none,0.9264188331336635,0.9244115035332621,0.9335600337249353,COMPLETE
1540,0.675531914893617,2025-09-23 21:13:11.693691,2025-09-23 21:13:12.593545,0 days 00:00:00.899854,0.00011970112824348321,gbtree,0.7973063881362643,4.5840298919647395,depthwise,58.3457778749747,0.0049590941456385965,1,8,8.603324010423988,300,,0.5867790780327548,0.8966947903107435,none,0.9132835549809526,4.902374076060713,,,,0.7121376984957576,0.7906643464018835,0.8001638001638002,0.5867790780327548,0.6675337343521378,0.675531914893617,0.8966947903107435,0.7774994931873533,0.7699045065904622,0.5384211906635196,0.552324001087252,0.8781009409751924,0.8694908001711597,none,0.9093276334464124,0.9076191591654778,0.9132835549809526,COMPLETE
1541,0.7143984220907298,2025-09-23 21:13:12.729602,2025-09-23 21:13:13.995324,0 days 00:00:01.265722,0.002281867113242868,gbtree,0.8793170264595611,2.526093781605714,depthwise,0.0006027308732605946,0.021759062959643475,0,11,0.12889020669639253,300,,0.6167347206962288,0.9454192945846579,none,0.7062738081195472,3.7042978594737273,,,,0.6594264664444165,0.8488074521445389,0.8517608517608518,0.6167347206962288,0.7104489315820427,0.7143984220907298,0.9454192945846579,0.8212815113869003,0.8176374712634829,0.6558089033659066,0.6626417855836078,0.7750213857998289,0.7749251176722294,none,0.9240440912971911,0.9243024701882913,0.7062738081195472,COMPLETE
1542,0.7257255073096225,2025-09-23 21:13:14.128091,2025-09-23 21:13:39.857995,0 days 00:00:25.729904,0.0011156872850501143,dart,0.7839652014254659,7.981502450561728,depthwise,0.00033690572008045466,0.028948827153834712,3,12,0.27249987775739026,600,tree,0.6714859122566107,0.9692334392602573,none,0.9925990479802094,2.6863580677684356,0.1522700941569027,uniform,0.5268148690671031,0.5601931712252037,0.8699969290613164,0.8713144963144963,0.6714859122566107,0.7234320557491289,0.7257255073096225,0.9692334392602573,0.8270811588373042,0.8208903819710685,0.7369121561668146,0.7404274265360641,0.7104362703165098,0.7115960633290543,none,0.9276507254249791,0.925714980329371,0.9925990479802094,COMPLETE
1543,0.0,2025-09-23 21:13:39.991249,2025-09-23 21:13:57.932905,0 days 00:00:17.941656,0.0008983928569077773,dart,0.6984446213608089,1.921650327580974,depthwise,0.0011632326318887496,0.00030030277778798654,10,7,0.6927675186135746,500,tree,0.3313848379209756,0.9230454954970907,none,0.9559084771005488,0.8924685580857453,0.12495927611725591,uniform,0.49361821868524874,0.6906838785141121,0.7606715119254785,0.7607493857493858,0.3313848379209756,0.0,0.0,0.9230454954970907,0.8016557537366591,0.7955328168241587,0.0,0.0,0.0,0.0,none,0.9123005502922295,0.910956351133322,0.9559084771005488,COMPLETE
1544,0.7169511710996427,2025-09-23 21:13:58.067182,2025-09-23 21:13:59.057315,0 days 00:00:00.990133,0.00011866311787675015,gbtree,0.7354697549805977,5.194568958514236,depthwise,0.0009851914239812356,0.02981226259994979,4,11,0.23679909791748727,400,,0.6384895729831344,0.9320798546871647,none,0.9232965219858779,3.4361009702732175,,,,0.9178949167518611,0.8541304125294298,0.854013104013104,0.6384895729831344,0.7186574531095755,0.7169511710996427,0.9320798546871647,0.8282810396303318,0.8225030403283431,0.6674000733406674,0.6686412439837097,0.7784431137724551,0.772785622593068,none,0.9277255800412556,0.9260437214787972,0.9232965219858779,COMPLETE
1545,0.6643339165208698,2025-09-23 21:13:59.196558,2025-09-23 21:14:01.901582,0 days 00:00:02.705024,0.0264457420914502,gbtree,0.5670333629300806,0.5489359776464244,lossguide,0.00026726281220585915,0.0039041061076602935,10,7,2.579551007012473,600,,0.4984901728328359,0.9892274335182085,none,0.6794970823230073,1.0505750327000183,,,,0.587421108837473,0.8644692394308527,0.8625102375102375,0.4984901728328359,0.6719524281466799,0.6643339165208698,0.9892274335182085,0.8123122400408518,0.8036625039535896,0.7985865724381626,0.7986778846153846,0.5799828913601369,0.5686777920410783,none,0.9187515159426806,0.9165407471170944,0.6794970823230073,COMPLETE
1546,0.6478283621140764,2025-09-23 21:14:02.035884,2025-09-23 21:14:21.186891,0 days 00:00:19.151007,0.00013572437262616773,dart,0.751325923714482,5.358522561169013,depthwise,0.0005476590232116159,0.007064794908199694,3,12,0.22119168477071113,500,tree,0.6969205937291336,0.9624934359383254,none,0.9784790831813754,2.163091703634784,0.16813560890125356,uniform,0.5276579978135866,0.8420515701185215,0.8645716040536391,0.8622031122031122,0.6969205937291336,0.6591084771965988,0.6478283621140764,0.9624934359383254,0.819531037052323,0.8113033050278315,0.8289047310434219,0.8336700336700337,0.5470487596236099,0.5297389816003423,none,0.9227373443895991,0.9205586561103272,0.9784790831813754,COMPLETE
1547,0.706430568499534,2025-09-23 21:14:21.318983,2025-09-23 21:15:12.509351,0 days 00:00:51.190368,0.010067160895452284,dart,0.2687535266898402,6.014549076284659,lossguide,0.004949198552537047,0.16326847987747792,5,9,0.17147911233961252,900,tree,0.5058429778932063,0.9272289065122552,undersample,0.9961078714493784,0.7702620956484352,0.1626351559706554,uniform,0.5798885974776473,0.7684293442554615,0.8388780837342614,0.8387592137592138,0.5058429778932063,0.7078693392724573,0.706430568499534,0.9272289065122552,0.8171194951266846,0.8089358177617495,0.6252459016393442,0.6258256274768824,0.8156544054747648,0.8108686350021395,undersample,0.9223239316395757,0.9205407765995728,0.9961078714493784,COMPLETE
1548,0.7023041474654378,2025-09-23 21:15:12.642894,2025-09-23 21:15:13.609802,0 days 00:00:00.966908,0.0017098646725458228,gbtree,0.9531608117817891,5.182456892761223,depthwise,39.121713979508776,0.03540382450304105,0,9,10.03415797437745,600,,0.6124485269204483,0.8565140669950554,none,0.8343646407252524,1.7526601939163056,,,,0.926380462992569,0.8691780120790255,0.8677313677313677,0.6124485269204483,0.7082191780821918,0.7023041474654378,0.8565140669950554,0.8183009992145884,0.8105649885959683,0.7595494613124388,0.7608587119321019,0.6633875106928999,0.6521181001283697,none,0.9230696862230322,0.9206543589988097,0.8343646407252524,COMPLETE
1549,0.7105780574125049,2025-09-23 21:15:13.744509,2025-09-23 21:15:15.773439,0 days 00:00:02.028930,0.03952455793407403,gbtree,0.46847321913667755,0.1393396536677946,lossguide,0.0003108196893116822,0.011325384595272844,9,7,0.38511842451413053,400,,0.35370499249789855,0.9559007474083854,none,0.8543919138741932,1.111320263067245,,,,0.2745627978914663,0.8522878493192753,0.8493038493038493,0.35370499249789855,0.7182190978324546,0.7105780574125049,0.9559007474083854,0.8228308190916794,0.816310181815765,0.660797700323392,0.6573299381593307,0.7865697177074422,0.7732135216089003,none,0.9244804410442049,0.9225523799125972,0.8543919138741932,COMPLETE
1550,0.712016110986798,2025-09-23 21:15:15.907668,2025-09-23 21:15:19.194024,0 days 00:00:03.286356,0.0007409360744528024,dart,0.9197539447111723,7.711157495236988,depthwise,0.00010506170520222585,0.31395085379789434,2,11,2.3103140307074455,200,tree,0.6380602239640116,0.9400304088984139,none,0.8005910956159534,2.042198106716038,0.19111404387838238,uniform,0.5771022798297234,0.6334362563203757,0.8694851059473846,0.8682432432432432,0.6380602239640116,0.7153382451440053,0.712016110986798,0.9400304088984139,0.8221996658099912,0.8148032162607397,0.7482484820177487,0.7462476547842402,0.6852010265183918,0.6807873341891314,none,0.9251994885596476,0.923718607710693,0.8005910956159534,COMPLETE
1551,0.6715045960328979,2025-09-23 21:15:19.327397,2025-09-23 21:15:35.103010,0 days 00:00:15.775613,0.0003396523365116867,dart,0.8584410344996294,8.44475947256135,depthwise,0.00010112311649477932,0.44705251257372464,0,12,2.2192239714388013,500,tree,0.5902443317972303,0.9237572604961549,undersample,0.8909322487146809,2.099338689628092,0.24773843849697386,uniform,0.5274839262417143,0.8304549095879902,0.782679905824547,0.7914619164619164,0.5902443317972303,0.6625337784136067,0.6715045960328979,0.9237572604961549,0.8044646776156408,0.7957786689756007,0.5271945357955983,0.5388198757763976,0.8913601368691189,0.8908857509627728,undersample,0.914365196592224,0.9127492831352682,0.8909322487146809,COMPLETE
1552,0.696165191740413,2025-09-23 21:15:35.233931,2025-09-23 21:15:59.225830,0 days 00:00:23.991899,0.02387201685277516,dart,0.868187954714854,1.4904651411453718,depthwise,0.010096427818202452,0.008714222338039002,7,5,0.9412861340625129,600,tree,0.43117423881064587,0.9849524366473409,none,0.866297230654592,1.7347656377362053,0.13276255015679891,uniform,0.48035139475924726,0.8940619881368215,0.8279250690961204,0.8312858312858313,0.43117423881064587,0.6936395115728085,0.696165191740413,0.9849524366473409,0.8055047769279673,0.7975833024072102,0.6043188313750397,0.611597019760285,0.8139435414884517,0.8078733418913137,none,0.9152566313246971,0.9134943203329999,0.866297230654592,COMPLETE
1553,0.6726501305483029,2025-09-23 21:15:59.360308,2025-09-23 21:15:59.953461,0 days 00:00:00.593153,0.0008322950382400083,gbtree,0.875425824650845,5.31194875158533,depthwise,2.2459864740274087,0.3279944119868529,0,8,7.9589537970894435,300,,0.5745794519683286,0.8769718429614761,oversample,0.9368046107257602,1.86501561280643,,,,0.6141677321419542,0.7898454294195926,0.7946355446355446,0.5745794519683286,0.6681752060772588,0.6726501305483029,0.8769718429614761,0.8057683449241935,0.8012096360087815,0.5370226032735775,0.5436560274333949,0.8840889649272883,0.8818998716302953,oversample,0.9156032476255171,0.9147959256827338,0.9368046107257602,COMPLETE
1554,0.7083067771404291,2025-09-23 21:16:00.088937,2025-09-23 21:16:03.661949,0 days 00:00:03.573012,0.002398555672982368,dart,0.6981143617659464,4.62874016787578,depthwise,1.5556087613851626,0.022490127115286054,0,8,3.002143436202875,200,tree,0.6617705203132964,0.855632555415191,none,0.9512194490613234,3.469743047835223,0.1652947536016338,uniform,0.5390185234205287,0.7049502918420567,0.8605793837649708,0.8594389844389845,0.6617705203132964,0.710828025477707,0.7083067771404291,0.855632555415191,0.8129060788674674,0.8069215142776451,0.7057335581787522,0.7033755274261604,0.7159965782720273,0.7133076593923834,none,0.9201220662659917,0.9176922336760498,0.9512194490613234,COMPLETE
1555,0.710736266241167,2025-09-23 21:16:03.797292,2025-09-23 21:16:27.977103,0 days 00:00:24.179811,0.0001686503011103972,dart,0.8370925108836182,9.233497282083821,depthwise,0.000132418887735708,0.45299773024676665,2,10,0.12308065733377223,600,tree,0.568673930746949,0.9711737797086396,none,0.9595622570669428,1.4795226672531183,0.09246328747589205,uniform,0.5827454831153838,0.5695834048879531,0.8706111167980346,0.870085995085995,0.568673930746949,0.7127272727272728,0.710736266241167,0.9711737797086396,0.8240317474688017,0.8178249185370858,0.7604267701260912,0.7604878048780488,0.6706586826347305,0.6670945656824989,none,0.926144222311476,0.9247429798735444,0.9595622570669428,COMPLETE
1556,0.70568700705687,2025-09-23 21:16:28.113111,2025-09-23 21:16:34.527493,0 days 00:00:06.414382,0.12534246451772735,dart,0.22880833322208724,0.11185804887813572,lossguide,0.00014886100168939417,0.05791341442449783,7,3,0.29289168343651056,300,tree,0.38894049910158934,0.8398295745869572,none,0.6352440875932516,1.1124032848959782,0.06917568933953924,uniform,0.4896803779683401,0.31960531901643385,0.8539256832838571,0.8548321048321048,0.38894049910158934,0.7044936839925451,0.70568700705687,0.8398295745869572,0.8053078869195935,0.8016131135014147,0.6828582898434363,0.6852075775896815,0.7275449101796407,0.727428326914848,none,0.9170536025820208,0.9171946016891271,0.6352440875932516,COMPLETE
1557,0.7105608703807916,2025-09-23 21:16:34.661217,2025-09-23 21:17:29.036983,0 days 00:00:54.375766,0.004772850504737745,dart,0.39226725924206873,5.170223620897656,lossguide,0.00015795474447983493,0.027480576859139738,7,10,1.2892950173366997,900,tree,0.3283470429953,0.9563280780095124,none,0.8077341659547572,1.1851048278644096,0.1565453103184683,uniform,0.3715696201026252,0.43373974604766297,0.8442010441191524,0.842035217035217,0.3283470429953,0.7172054998141955,0.7105608703807916,0.9563280780095124,0.8252271954178058,0.8169463422161511,0.6340341655716163,0.6325985303941216,0.825491873396065,0.8104407359863073,none,0.9260062837586837,0.9238341767222359,0.8077341659547572,COMPLETE
