number,value,datetime_start,datetime_complete,duration,params_alpha,params_booster,params_colsample_bytree,params_gamma,params_grow_policy,params_lambda,params_learning_rate,params_max_delta_step,params_max_depth,params_min_child_weight,params_n_estimators,params_normalize_type,params_params_decision_threshold,params_params_feature_fraction,params_params_resampling,params_params_sample_rows,params_params_scale_pos_weight,params_rate_drop,params_sample_type,params_skip_drop,params_subsample,user_attrs_acc_test,user_attrs_acc_val,user_attrs_decision_threshold,user_attrs_f1_test,user_attrs_f1_val,user_attrs_feature_fraction,user_attrs_pr_auc_test,user_attrs_pr_auc_val,user_attrs_prec_test,user_attrs_prec_val,user_attrs_rec_test,user_attrs_rec_val,user_attrs_resampling_strategy,user_attrs_roc_auc_test,user_attrs_roc_auc_val,user_attrs_sample_rows,state
220,0.657088122605364,2025-09-23 12:37:33.308079,2025-09-23 12:37:37.518597,0 days 00:00:04.210518,0.001143985267091196,gbtree,0.4434893147886054,0.5108977065763043,lossguide,0.004581068038397229,0.09674442730424898,4,11,0.5202007803424709,700,,0.3817131689585445,0.7515049161100404,undersample,0.8761831529382049,1.8547101024183201,,,,0.2221685995985122,0.768655952502815,0.7800982800982801,0.3817131689585445,0.6426312460468058,0.657088122605364,0.7515049161100404,0.7502116845975069,0.754203878395922,0.5097842448569995,0.5240641711229946,0.8691189050470488,0.8806161745827985,undersample,0.8915547128247685,0.8952967212777752,0.8761831529382049,COMPLETE
221,0.643455497382199,2025-09-23 12:37:37.641082,2025-09-23 12:37:38.150198,0 days 00:00:00.509116,0.03517098427401143,gbtree,0.23104049193051834,3.881798489827343,depthwise,0.4404758206730532,0.09510919173409087,3,4,0.1287826989372609,800,,0.417347566342403,0.8446481015547178,none,0.5470119402582142,0.5137876271212736,,,,0.7245537165432643,0.8632408639574163,0.8605651105651105,0.417347566342403,0.6522644456012493,0.643455497382199,0.8446481015547178,0.8159012439209417,0.8097590479077772,0.8331117021276596,0.8287255563047876,0.5359281437125748,0.5258878904578519,none,0.9210651883844054,0.9202359035893016,0.5470119402582142,COMPLETE
222,0.0,2025-09-23 12:37:38.271599,2025-09-23 12:37:40.940493,0 days 00:00:02.668894,0.002947734671959534,dart,0.24504880374322174,0.5628354713367167,depthwise,0.00012627073446103943,0.00013808454726410788,9,3,0.3951864206372108,200,tree,0.5022653030764421,0.7764111778450133,oversample,0.6153242616024975,0.7520128296291273,0.33035047878859913,uniform,0.6991863658769332,0.8390831388524267,0.7606715119254785,0.7607493857493858,0.5022653030764421,0.0,0.0,0.7764111778450133,0.7235271112967389,0.7161530921353826,0.0,0.0,0.0,0.0,oversample,0.8854158572525633,0.8825081492852198,0.6153242616024975,COMPLETE
223,0.0,2025-09-23 12:37:41.059167,2025-09-23 12:37:43.920877,0 days 00:00:02.861710,17.194127592235006,dart,0.5947735520736919,7.664119839578025,depthwise,0.006734185090986614,0.001911184555879808,0,5,36.350287792515445,200,tree,0.6510450590346758,0.8260342508845839,undersample,0.6464122879852441,0.5985242487276513,0.1285801546847647,weighted,0.43539459520524804,0.25004533210363444,0.7606715119254785,0.7607493857493858,0.6510450590346758,0.0,0.0,0.8260342508845839,0.630785100138586,0.6267857042738709,0.0,0.0,0.0,0.0,undersample,0.8429384382512441,0.8399993389475573,0.6464122879852441,COMPLETE
224,0.5995617639003012,2025-09-23 12:37:44.038974,2025-09-23 12:37:44.498478,0 days 00:00:00.459504,0.025232658640248543,gbtree,0.4966355270570743,3.392923295762893,depthwise,0.0025611946152951162,0.3685623674648591,8,3,19.344227894954493,500,,0.36272520835712335,0.6149836233683286,oversample,0.7468669817353152,1.7086420130472841,,,,0.452931565809771,0.697717268911864,0.7006552006552007,0.36272520835712335,0.5978482908892823,0.5995617639003012,0.6149836233683286,0.7034843360197833,0.6984759306385716,0.4385614385614386,0.4408862034239678,0.938836612489307,0.936670945656825,oversample,0.886453576496583,0.8854965036487157,0.7468669817353152,COMPLETE
225,0.5506474646012344,2025-09-23 12:37:44.617566,2025-09-23 12:37:45.634623,0 days 00:00:01.017057,0.15037448449046953,gbtree,0.7330182658983075,5.978752446681308,depthwise,0.0018513147263463927,0.0029209304825044058,2,12,82.27222525544838,700,,0.39658522033663896,0.7355705204588094,undersample,0.7496772620762836,2.703733735111885,,,,0.7120364364180194,0.614392465963763,0.6198812448812449,0.39658522033663896,0.5472899891839923,0.5506474646012344,0.7355705204588094,0.7043384280764036,0.6942977104436745,0.3805783051980612,0.3839014512318596,0.9739093242087254,0.9734702610183996,undersample,0.8815361375984981,0.8826091210150357,0.7496772620762836,COMPLETE
226,0.7001819836214741,2025-09-23 12:37:45.770027,2025-09-23 12:37:51.553429,0 days 00:00:05.783402,0.0011321258172976001,dart,0.7257486323698399,8.218955666615354,lossguide,9.47127563813457,0.2378313159525974,6,10,27.358678010143095,300,tree,0.6536700963427304,0.9986768405364883,oversample,0.6826367574019714,0.691408828528136,0.49681225453675076,weighted,0.6768663250051837,0.9966501835866186,0.8655952502815027,0.8650696150696151,0.6536700963427304,0.7030083691472517,0.7001819836214741,0.9986768405364883,0.8117570581643913,0.8014758290813743,0.7460393662986078,0.7474502185526954,0.6646706586826348,0.6585365853658537,oversample,0.9202213256168325,0.917048830412236,0.6826367574019714,COMPLETE
227,0.6277707006369426,2025-09-23 12:37:51.676035,2025-09-23 12:38:32.977415,0 days 00:00:41.301380,0.0018599668729256378,dart,0.8502019382456216,3.9385675759328875,depthwise,0.11140749401345217,0.0008786473110271082,3,5,2.1089819772459295,900,tree,0.5119041859738911,0.9690561243483062,undersample,0.934140197731002,0.7964293859993931,0.43662255917087545,uniform,0.3791051198952338,0.5950403800280331,0.8579179035725253,0.8504299754299754,0.5119041859738911,0.6487854251012146,0.6277707006369426,0.9690561243483062,0.7849917401310633,0.7750046819485966,0.7942998760842627,0.7758186397984886,0.5483319076133447,0.5271715875053488,undersample,0.9066428824109667,0.904550188650432,0.934140197731002,COMPLETE
228,0.5985185185185186,2025-09-23 12:38:33.100469,2025-09-23 12:38:34.546158,0 days 00:00:01.445689,0.0021744883331203373,gbtree,0.376305702605634,7.210893163713941,depthwise,0.37844054804077476,0.002634372621407785,3,8,0.30720374819608853,1000,,0.5946495775989433,0.719208363401667,none,0.9092980722523014,2.090258064467553,,,,0.399969467719137,0.8370355205241069,0.8335380835380836,0.5946495775989433,0.613779718583212,0.5985185185185186,0.719208363401667,0.710419985681918,0.7033443678887863,0.7090807174887892,0.7075306479859895,0.5410607356715141,0.5186136071887034,none,0.8785845173370889,0.8814943435965179,0.9092980722523014,COMPLETE
229,0.688162344983089,2025-09-23 12:38:34.667537,2025-09-23 12:39:05.702622,0 days 00:00:31.035085,0.0010310986946114706,dart,0.2121830922961853,7.4527327977779,depthwise,0.012187382389989149,0.00935525365880134,5,5,0.19306155475870318,700,forest,0.5082742533255259,0.9553832838013057,oversample,0.5521323670717178,0.5089239889581069,0.15298237795196712,uniform,0.35245048745718793,0.32993717038355797,0.8580202681953117,0.8584152334152334,0.5082742533255259,0.6885245901639344,0.688162344983089,0.9553832838013057,0.7954172042168866,0.7895360139426657,0.724822695035461,0.7273593898951383,0.655688622754491,0.6529738981600343,oversample,0.9141003131288609,0.9129533571646195,0.5521323670717178,COMPLETE
230,0.5674314493564634,2025-09-23 12:39:05.821682,2025-09-23 12:40:16.493623,0 days 00:01:10.671941,0.002428966172321749,dart,0.5364209291312112,9.245041076022758,depthwise,1.098900543605174,0.002331257502280924,10,8,25.189533004142664,1000,tree,0.5771670209400339,0.6833901097760053,oversample,0.617726740511108,0.8262771685123124,0.03418762025936917,weighted,0.14021703396675353,0.8554084126765862,0.8458388780837343,0.8417280917280917,0.5771670209400339,0.5800334634690463,0.5674314493564634,0.6833901097760053,0.7650087122999828,0.7562868347002505,0.8333333333333334,0.8197251414713015,0.4448246364414029,0.4338896020539153,oversample,0.9012947344828194,0.8988733144242391,0.617726740511108,COMPLETE
231,0.6732860520094562,2025-09-23 12:40:16.614873,2025-09-23 12:40:17.225868,0 days 00:00:00.610995,0.005347625382646883,gbtree,0.8330269251603899,1.4368104195420506,depthwise,0.004688801046114823,0.06638123664819025,3,5,0.2162145417548586,500,,0.5368873099930578,0.76777506602095,undersample,0.6920490275542247,2.746860239886315,,,,0.8770439493568905,0.7854437506397789,0.7877764127764127,0.5368873099930578,0.6726023117775695,0.6732860520094562,0.76777506602095,0.8200379359862299,0.810253044026378,0.5297736220472441,0.5329341317365269,0.9208725406330197,0.9139922978177151,undersample,0.9240727841278052,0.9223774428637345,0.6920490275542247,COMPLETE
232,0.0,2025-09-23 12:40:17.347708,2025-09-23 12:40:23.582223,0 days 00:00:06.234515,1.443763724927159,dart,0.7569986050154476,3.603505576518653,depthwise,2.056624812183046,0.00025113418018688123,2,9,0.12217563641255863,300,forest,0.3635675564074566,0.5357244389960457,none,0.5565500280069183,0.6576329297147003,0.284274027928309,weighted,0.572962273387507,0.8341362815603113,0.7606715119254785,0.7607493857493858,0.3635675564074566,0.0,0.0,0.5357244389960457,0.7257271906373584,0.7204000829717191,0.0,0.0,0.0,0.0,none,0.8862947730469045,0.8830375958605217,0.5565500280069183,COMPLETE
233,0.6955183031132398,2025-09-23 12:40:23.702221,2025-09-23 12:40:24.390414,0 days 00:00:00.688193,0.23361313012190305,gbtree,0.6659788588819016,7.023227446203606,depthwise,1.2814041850487703,0.04865333723166577,10,7,1.5387915630034457,900,,0.506855828621514,0.7575793845906607,oversample,0.7708211457813088,1.2322098096792287,,,,0.8765917073265037,0.8148223973794656,0.8177723177723177,0.506855828621514,0.6928171166581762,0.6955183031132398,0.7575793845906607,0.8178338161690752,0.8131386370388296,0.5744860602647142,0.5793673411228271,0.8725406330196749,0.8699186991869918,oversample,0.9221275713755026,0.9207550428137985,0.7708211457813088,COMPLETE
234,0.6989978525411596,2025-09-23 12:40:24.511644,2025-09-23 12:40:24.981655,0 days 00:00:00.470011,7.128608102573641,gbtree,0.3368709741536936,4.757729089470616,depthwise,0.005435644844267607,0.14498533971135016,6,8,1.7976132439850276,300,,0.6180431780633249,0.8538298637688885,none,0.5954371404253771,4.964236449347642,,,,0.29653195630739076,0.8236257549390931,0.8278050778050778,0.6180431780633249,0.695529245449726,0.6989978525411596,0.8538298637688885,0.8085617493000363,0.8038355140769713,0.5925925925925926,0.6007382343894186,0.8417450812660393,0.8356867779204108,none,0.9194560011990551,0.9179210395890373,0.5954371404253771,COMPLETE
235,0.5885193133047211,2025-09-23 12:40:25.099874,2025-09-23 12:40:25.630309,0 days 00:00:00.530435,0.013778665284200112,gbtree,0.5041039429328436,7.535250348263977,lossguide,0.09141959872064963,0.012702487024269649,1,10,11.820133561640288,200,,0.303562463956783,0.6328906912943247,undersample,0.8987359717232943,0.9030808135185022,,,,0.8163007090419987,0.6787798136963865,0.685913185913186,0.303562463956783,0.5824906865353912,0.5885193133047211,0.6328906912943247,0.6617296503012468,0.6693713180455501,0.4227500965623793,0.428599335807775,0.9362703165098375,0.9388104407359863,undersample,0.8723046438411026,0.8755932413030865,0.8987359717232943,COMPLETE
236,0.4681126578180641,2025-09-23 12:40:25.748153,2025-09-23 12:40:27.449313,0 days 00:00:01.701160,0.00018947454175658805,gbtree,0.3806399295123843,0.5560046476925895,depthwise,0.0070407271769947,0.004696191875279474,0,9,0.6780285906384945,900,,0.6355189113599891,0.7258633551266839,none,0.875479229674746,0.5741202491235714,,,,0.5440216566016299,0.8334527587265841,0.8317977067977068,0.6355189113599891,0.4739734885224701,0.4681126578180641,0.7258633551266839,0.8123100198012791,0.8086557105527516,0.9708609271523179,0.961436170212766,0.3135158254918734,0.30937098844672656,none,0.9163167407615128,0.9166652990712386,0.875479229674746,COMPLETE
237,0.6280044101433296,2025-09-23 12:40:27.573045,2025-09-23 12:40:28.021780,0 days 00:00:00.448735,14.590218779124548,gbtree,0.27387942027216977,9.053631703226673,depthwise,0.0005646533360044234,0.006111013526938087,0,3,48.120113959736095,400,,0.4881821417414085,0.6673496319218407,oversample,0.5081850774496798,0.5560412667660591,,,,0.22754502863745138,0.8261848705087522,0.8272932022932022,0.4881821417414085,0.6310299869621904,0.6280044101433296,0.6673496319218407,0.6748705830293774,0.6628396231041568,0.6413427561837456,0.6478616924476797,0.621043627031651,0.6093281985451433,oversample,0.8735006485097744,0.873602483023534,0.5081850774496798,COMPLETE
238,0.0,2025-09-23 12:40:28.142604,2025-09-23 12:40:37.948922,0 days 00:00:09.806318,6.7762759693282755,dart,0.483626136052606,2.9964630421758,lossguide,0.013615869716263253,0.0010749995791527272,1,3,0.5689841488631985,400,tree,0.6708601750589294,0.5712360874882257,oversample,0.7404147521892781,0.6279508542713309,0.23951747240439797,uniform,0.43203908934351826,0.24782754875824153,0.7606715119254785,0.7607493857493858,0.6708601750589294,0.0,0.0,0.5712360874882257,0.6732329928434997,0.6691509215270781,0.0,0.0,0.0,0.0,oversample,0.871973165382713,0.8705254508933334,0.7404147521892781,COMPLETE
239,0.7004588158182216,2025-09-23 12:40:38.074295,2025-09-23 12:41:35.639061,0 days 00:00:57.564766,0.0001036929333918466,dart,0.8050739845936998,1.4654046155326628,lossguide,56.12394972804153,0.008600121553913417,5,8,0.21321955705676296,900,forest,0.39284474719223966,0.966320465510059,none,0.5919019774520617,0.9250275414176163,0.13019857885076402,uniform,0.7908761259595581,0.5875349490779433,0.8607841130105436,0.8596437346437347,0.39284474719223966,0.7042192257503262,0.7004588158182216,0.966320465510059,0.8094478832509847,0.8006198314682984,0.7163716814159292,0.715625,0.6924721984602225,0.6859221223791185,none,0.9176678939255121,0.9158533792592031,0.5919019774520617,COMPLETE
240,0.6513860926126684,2025-09-23 12:41:35.757977,2025-09-23 12:41:38.226301,0 days 00:00:02.468324,0.04109535894722091,dart,0.3367941167746976,6.461075337502055,depthwise,0.037444699378124995,0.10689589339557817,5,4,4.067051467286247,200,tree,0.48132410184259206,0.9883498129892148,none,0.8050005430844147,3.5815585632077744,0.3331653864478769,weighted,0.012714259536297113,0.3003232110387739,0.7625140751356331,0.7695536445536445,0.48132410184259206,0.6460176991150443,0.6513860926126684,0.9883498129892148,0.7739625553719727,0.7678027274776269,0.502134724857685,0.5104368932038835,0.9054747647562019,0.8998716302952503,none,0.9051908294835441,0.903854096973284,0.8050005430844147,COMPLETE
241,0.1430274135876043,2025-09-23 12:41:38.344766,2025-09-23 12:41:38.805530,0 days 00:00:00.460764,23.030723276671964,gbtree,0.3436251225548336,4.184069335740222,depthwise,0.2909577976627814,0.005456027856808489,8,12,54.14734219156084,200,,0.6362934506285083,0.9177728205859716,oversample,0.7474075670456894,0.5132184570271348,,,,0.5686647462992176,0.7790971440270242,0.7791769041769042,0.6362934506285083,0.14297061159650518,0.1430274135876043,0.9177728205859716,0.7399892805304904,0.7322499612752171,1.0,1.0,0.07698887938408897,0.07702182284980745,oversample,0.8956710260199365,0.8924786109514623,0.7474075670456894,COMPLETE
242,0.668083297917552,2025-09-23 12:41:38.925608,2025-09-23 12:41:39.585791,0 days 00:00:00.660183,0.0049258031745890215,gbtree,0.9775019265438643,4.193509917347735,lossguide,0.008203752935705277,0.09469614407535211,6,8,78.3733623980699,800,,0.6815694364185764,0.5823046144483676,oversample,0.9808164878375656,0.8833141149710381,,,,0.7527891733217338,0.8369331559013206,0.8400900900900901,0.6815694364185764,0.666247642991829,0.668083297917552,0.5823046144483676,0.7412292191479879,0.7312779211230866,0.6529774127310062,0.6635711270578303,0.6800684345594525,0.6726572528883183,oversample,0.8959591630511398,0.89547894257176,0.9808164878375656,COMPLETE
243,0.0,2025-09-23 12:41:39.707407,2025-09-23 12:42:27.286475,0 days 00:00:47.579068,0.0010566649928749573,dart,0.6621882351145947,8.883279571262591,lossguide,0.003973367245587871,0.0016100609225405758,3,11,35.9914531927972,900,tree,0.6625870919292008,0.842136522577118,none,0.7537782494264829,0.8846098300217422,0.3303454069984864,weighted,0.378364638616306,0.8055829993149568,0.7606715119254785,0.7607493857493858,0.6625870919292008,0.0,0.0,0.842136522577118,0.6978137032164494,0.6942932888740492,0.0,0.0,0.0,0.0,none,0.8769315282578622,0.879248550363242,0.7537782494264829,COMPLETE
244,0.0,2025-09-23 12:42:27.404871,2025-09-23 12:42:51.353603,0 days 00:00:23.948732,54.211863003405014,dart,0.8214113346041956,6.321208142767394,lossguide,0.0007714385048589104,0.0004288814606870491,4,10,0.8795848839270194,600,tree,0.39577095761533077,0.9358947925572487,none,0.8605462758408933,1.2805522539567948,0.3738144226227973,uniform,0.8103045084350665,0.3022859822308003,0.7606715119254785,0.7607493857493858,0.39577095761533077,0.0,0.0,0.9358947925572487,0.7178319283475906,0.7097343938078328,0.0,0.0,0.0,0.0,none,0.8858491276285886,0.8838878659275086,0.8605462758408933,COMPLETE
245,0.6922752216124948,2025-09-23 12:42:51.473504,2025-09-23 12:42:52.747312,0 days 00:00:01.273808,0.00014271357403740297,gbtree,0.5553339501696947,0.5846129302789316,depthwise,7.092217401047954,0.13329003411681267,4,10,9.412189975350227,600,,0.6149193706353593,0.7351999646104566,oversample,0.9066253809858515,0.9337624621311966,,,,0.5102145136174452,0.8480908997850343,0.8507371007371007,0.6149193706353593,0.6892797319932998,0.6922752216124948,0.7351999646104566,0.7912899627053439,0.7924723423799853,0.6751435602953241,0.68304872969596,0.7040205303678357,0.7017543859649122,oversample,0.9068561360467254,0.9104320582334225,0.9066253809858515,COMPLETE
246,0.5076600903780447,2025-09-23 12:42:52.867188,2025-09-23 12:43:15.758348,0 days 00:00:22.891160,0.09016469881157826,dart,0.29084248565873844,6.277085445621183,depthwise,20.961298260262723,0.0019368804909744098,10,3,6.9707298667315465,600,tree,0.6757470779152333,0.6347887999680044,oversample,0.8014808443043719,3.39569804717717,0.10603912134439142,uniform,0.33873278093439035,0.2837902351528643,0.5426348653905211,0.5426904176904177,0.6757470779152333,0.5085789705235372,0.5076600903780447,0.6347887999680044,0.6807207574865062,0.6690802142544924,0.3423156647912348,0.34189429928741094,0.9888793840889649,0.985451433461703,oversample,0.8772719282583689,0.8761120350297907,0.8014808443043719,COMPLETE
247,0.38612143742255267,2025-09-23 12:43:15.876752,2025-09-23 12:43:27.656512,0 days 00:00:11.779760,0.0017691275612873533,dart,0.6804449809329919,0.5801545716674017,depthwise,2.5871928909237387,0.00010142702660843562,9,6,11.09261483879771,400,tree,0.4546969344350388,0.5459655395990941,none,0.9952758669146022,2.7650849058964098,0.030920437798157896,uniform,0.45780143169119114,0.3318119225240037,0.23932848807452145,0.23925061425061425,0.4546969344350388,0.3862228462872718,0.38612143742255267,0.5459655395990941,0.763276616500222,0.7560354744964227,0.23932848807452145,0.23925061425061425,1.0,1.0,none,0.9000011396550575,0.8976590624330059,0.9952758669146022,COMPLETE
248,0.39636608344549124,2025-09-23 12:43:27.778154,2025-09-23 12:43:53.455005,0 days 00:00:25.676851,0.003534015622132019,dart,0.339377251049645,5.0202452840010094,depthwise,46.6955824119378,0.022087955955460644,9,3,9.932516289423184,700,forest,0.6114077294457892,0.8958088938972771,none,0.6322510157050846,0.8551585270279936,0.3967628397374126,uniform,0.405435397596704,0.8815327269217077,0.8178933360630566,0.8163390663390664,0.6114077294457892,0.40080835298080164,0.39636608344549124,0.8958088938972771,0.7775059373083604,0.7711240590916154,0.9429477020602218,0.9275590551181102,0.25449101796407186,0.25203252032520324,none,0.9059996104451804,0.9034547591082864,0.6322510157050846,COMPLETE
249,0.0,2025-09-23 12:43:53.573932,2025-09-23 12:43:54.556581,0 days 00:00:00.982649,1.0611238788957114,gbtree,0.8889328004135124,6.374190342166811,lossguide,2.6643775829137537,0.001772626777455282,10,12,0.12202709318448728,200,,0.5911581286897294,0.912573895642629,none,0.8885693204052364,0.6217822602410479,,,,0.5127329985042488,0.7606715119254785,0.7607493857493858,0.5911581286897294,0.0,0.0,0.912573895642629,0.7976303702435125,0.7910937125588103,0.0,0.0,0.0,0.0,none,0.9086638707129255,0.9079967594610394,0.8885693204052364,COMPLETE
250,0.6084556152840331,2025-09-23 12:43:54.677063,2025-09-23 12:44:47.722113,0 days 00:00:53.045050,0.05684275769981542,dart,0.45311357934722163,4.458547688324669,lossguide,0.0003219026949024895,0.0029674941878504277,1,3,38.142544120976844,900,forest,0.5859520085979836,0.8574842489585535,oversample,0.8539778586104256,1.9811437968738392,0.04669321908143692,uniform,0.2694211230120514,0.7857727461498487,0.7228989661173099,0.7240990990990991,0.5859520085979836,0.6104475464095553,0.6084556152840331,0.8574842489585535,0.7472618834910446,0.7439335040731645,0.45998698763825635,0.46062472503299606,0.907185628742515,0.8960205391527599,oversample,0.8919484981821351,0.889769764301982,0.8539778586104256,COMPLETE
251,0.5431214562817069,2025-09-23 12:44:47.842095,2025-09-23 12:44:48.396221,0 days 00:00:00.554126,0.00020064602201377016,gbtree,0.738445640026482,4.5159296307332175,lossguide,0.017929045511284387,0.10481331293675182,9,6,35.98066257011489,700,,0.6510696307363373,0.8434728699902589,none,0.9245047463463887,0.7551852914713948,,,,0.83366126083088,0.8503429214863343,0.8432637182637183,0.6510696307363373,0.568731563421829,0.5431214562817069,0.8434728699902589,0.8110201829171968,0.8024192478457046,0.9163498098859315,0.8974358974358975,0.41231822070145424,0.3893881044073599,none,0.918574207487902,0.9171169222688127,0.9245047463463887,COMPLETE
