number,value,datetime_start,datetime_complete,duration,params_alpha,params_booster,params_colsample_bytree,params_gamma,params_grow_policy,params_lambda,params_learning_rate,params_max_delta_step,params_max_depth,params_min_child_weight,params_n_estimators,params_normalize_type,params_params_decision_threshold,params_params_feature_fraction,params_params_resampling,params_params_sample_rows,params_params_scale_pos_weight,params_rate_drop,params_sample_type,params_skip_drop,params_subsample,user_attrs_acc_test,user_attrs_acc_val,user_attrs_decision_threshold,user_attrs_f1_test,user_attrs_f1_val,user_attrs_feature_fraction,user_attrs_pr_auc_test,user_attrs_pr_auc_val,user_attrs_prec_test,user_attrs_prec_val,user_attrs_rec_test,user_attrs_rec_val,user_attrs_resampling_strategy,user_attrs_roc_auc_test,user_attrs_roc_auc_val,user_attrs_sample_rows,state
93,0.6518407212622088,2025-09-23 12:16:19.437141,2025-09-23 12:17:19.565738,0 days 00:01:00.128597,0.9902834298225415,dart,0.9791146591790956,8.871315434314075,lossguide,0.0009846313896225145,0.08251272176110586,6,5,0.6607637505752858,1000,tree,0.3684688192620634,0.7719607499014924,undersample,0.660373958022473,1.3514894348397086,0.2384006819644301,uniform,0.5596941522549286,0.26736901177054606,0.7586242194697512,0.7627968877968878,0.3684688192620634,0.6488981536628946,0.6518407212622088,0.7719607499014924,0.8048260179642976,0.7981588761951119,0.49771585198720875,0.5023158869847152,0.9319931565440548,0.9281129653401797,undersample,0.9181784939262717,0.9160827610018446,0.660373958022473,COMPLETE
94,0.640134187252211,2025-09-23 12:17:19.685421,2025-09-23 12:17:20.579515,0 days 00:00:00.894094,10.967311693958415,gbtree,0.2472185962152918,7.890378914618652,depthwise,0.0007335683952903126,0.0023090660104979205,9,5,0.45481853566991426,800,,0.5994889225634552,0.9841021955452544,undersample,0.9182735903095989,1.8200819040598992,,,,0.7292621185838672,0.7513563312519194,0.7583947583947583,0.5994889225634552,0.6351209253417456,0.640134187252211,0.9841021955452544,0.7518549283731779,0.7450223627087583,0.48946515397082657,0.4972755271262734,0.9041916167664671,0.8981600342319213,undersample,0.8986472524700873,0.8970229146228313,0.9182735903095989,COMPLETE
95,0.38612143742255267,2025-09-23 12:17:20.697665,2025-09-23 12:17:21.567131,0 days 00:00:00.869466,0.5467766223611461,gbtree,0.9666234670736846,8.742827749512301,depthwise,1.6919719795963557,0.00012732498771700956,5,8,4.761512185527357,400,,0.30532644529858693,0.892029307233577,none,0.9945440376784269,2.019444446633682,,,,0.964769400566601,0.23932848807452145,0.23925061425061425,0.30532644529858693,0.3862228462872718,0.38612143742255267,0.892029307233577,0.7898512565029401,0.7805619466992901,0.23932848807452145,0.23925061425061425,1.0,1.0,none,0.9096567520130165,0.907151499112042,0.9945440376784269,COMPLETE
96,0.15911776289877905,2025-09-23 12:17:21.686563,2025-09-23 12:18:03.119213,0 days 00:00:41.432650,0.0064596568474545105,dart,0.8754616111862579,3.13695054022317,lossguide,0.11870004733697044,0.0002369449142119844,4,8,2.821642415765135,900,forest,0.5774893354688911,0.5560359404374575,none,0.7452745273969663,3.0069342291872583,0.4545463785142816,weighted,0.1686248112836905,0.8894583935804767,0.7817586242194697,0.7814291564291564,0.5774893354688911,0.1619496855345912,0.15911776289877905,0.5560359404374575,0.7231344376911597,0.7185427319544023,1.0,1.0,0.08810949529512403,0.08643560119811725,none,0.8785076769582123,0.875130763716536,0.7452745273969663,COMPLETE
97,0.0,2025-09-23 12:18:03.237072,2025-09-23 12:18:04.239089,0 days 00:00:01.002017,0.0006293455260843357,gbtree,0.26484303090724926,6.155972191096447,depthwise,47.79060367777462,0.0004682778816213446,2,12,1.6001649001825637,600,,0.438983867246339,0.8040857928383898,none,0.9326057314553147,1.4227718786395434,,,,0.9343012935944908,0.7606715119254785,0.7607493857493858,0.438983867246339,0.0,0.0,0.8040857928383898,0.6780492214459322,0.6682779087371614,0.0,0.0,0.0,0.0,none,0.8750651704262045,0.8747727704206902,0.9326057314553147,COMPLETE
98,0.38612143742255267,2025-09-23 12:18:04.356481,2025-09-23 12:18:05.219197,0 days 00:00:00.862716,10.567159349216155,gbtree,0.28386736580260075,6.0018442398144,lossguide,0.0022387704610020423,0.00014601408795210684,1,8,0.27385678011580733,500,,0.356363905664824,0.9787442717239248,undersample,0.6271440651386719,3.644484120320581,,,,0.4615537998193525,0.23932848807452145,0.23925061425061425,0.356363905664824,0.3862228462872718,0.38612143742255267,0.9787442717239248,0.7098117079950992,0.7033839720154209,0.23932848807452145,0.23925061425061425,1.0,1.0,undersample,0.8834372031069069,0.882726820596298,0.6271440651386719,COMPLETE
99,0.591937859916968,2025-09-23 12:18:05.337012,2025-09-23 12:18:05.845909,0 days 00:00:00.508897,3.0269334006978776,gbtree,0.5664167704710423,7.188789152714245,lossguide,8.996734951309387,0.09255838684470365,10,10,0.11993998932609251,700,,0.54681408425645,0.6425874640662861,undersample,0.8506284237228636,3.8619292261414886,,,,0.6098793165244785,0.6766301566178728,0.6880630630630631,0.54681408425645,0.5817555938037866,0.591937859916968,0.6425874640662861,0.6907218227077218,0.680365240927558,0.4212847555129434,0.43079922027290446,0.9396920444824637,0.9456568249893025,undersample,0.8783037189937559,0.8806531716380632,0.8506284237228636,COMPLETE
100,0.5841432225063938,2025-09-23 12:18:05.965913,2025-09-23 12:18:07.970074,0 days 00:00:02.004161,0.0013085219072829102,gbtree,0.9422024634589634,0.588087209344621,depthwise,0.28478497342729947,0.0009864973466467575,9,9,0.24506871167713745,700,,0.6932810953160472,0.5740193396388811,oversample,0.5212448041190791,1.4046582243580072,,,,0.20739839537895952,0.8312007370252841,0.8335380835380836,0.6932810953160472,0.5859904594526739,0.5841432225063938,0.5740193396388811,0.6947857742806948,0.6886141097154186,0.7094224924012158,0.7260012714558169,0.4991445680068435,0.488660676080445,oversample,0.8803940650908806,0.879541388533746,0.5212448041190791,COMPLETE
101,0.65248,2025-09-23 12:18:08.089880,2025-09-23 12:18:09.770131,0 days 00:00:01.680251,2.3859882367720435,gbtree,0.3480931111033845,9.444041214695561,lossguide,0.000915291693015619,0.0001672406677420493,5,9,6.98695991798949,600,,0.6771117638244774,0.9384103102003154,undersample,0.8571499231468718,2.204289499398329,,,,0.6872751183548347,0.7722387143003379,0.7776412776412777,0.6771117638244774,0.6485547306902543,0.65248,0.9384103102003154,0.7465113279265008,0.7399605508427838,0.5141497620836464,0.5210835675951955,0.8781009409751924,0.8724860932819855,undersample,0.8978689198683203,0.896839599252504,0.8571499231468718,COMPLETE
102,0.38612143742255267,2025-09-23 12:18:09.888452,2025-09-23 12:18:16.650099,0 days 00:00:06.761647,0.20707078344949514,dart,0.3211888062449543,7.808851846280236,lossguide,0.0009952855121494613,0.0002903816833224269,3,5,78.0960862314429,400,forest,0.34555764192454536,0.648985132078465,undersample,0.8490581878534498,2.6362982130590447,0.4707196458419716,uniform,0.06804960575857597,0.5310145664538215,0.23932848807452145,0.23925061425061425,0.34555764192454536,0.3862228462872718,0.38612143742255267,0.648985132078465,0.7159036682499849,0.7118500504522782,0.23932848807452145,0.23925061425061425,1.0,1.0,undersample,0.8808362570090225,0.8806012893862445,0.8490581878534498,COMPLETE
103,0.631578947368421,2025-09-23 12:18:16.768145,2025-09-23 12:18:33.070156,0 days 00:00:16.302011,17.831901602584352,dart,0.7282708767825781,9.004101465401794,lossguide,0.0010943580008024546,0.002129728291660664,7,6,7.077099973783123,500,forest,0.4002082345668714,0.7085148705959967,none,0.6514524043349175,2.013784626847659,0.240053903572592,weighted,0.5794776330503371,0.222122525204274,0.7594431364520422,0.7678132678132679,0.4002082345668714,0.6230349695219762,0.631578947368421,0.7085148705959967,0.6578236776803067,0.6529976994968273,0.4984599589322382,0.5090337784760408,0.8306244653550042,0.8318356867779204,none,0.8686140033215766,0.8696552859118035,0.6514524043349175,COMPLETE
104,0.0,2025-09-23 12:18:33.195411,2025-09-23 12:18:33.590151,0 days 00:00:00.394740,0.07066920476881804,gbtree,0.22817584366032567,4.618534421619371,lossguide,2.2775068288827693,0.0001239743306850402,6,3,0.6526057110125796,300,,0.6410944631575769,0.7857750977084672,undersample,0.63399434125221,1.1198812059356218,,,,0.9232406555482255,0.7606715119254785,0.7607493857493858,0.6410944631575769,0.0,0.0,0.7857750977084672,0.6957143689093562,0.691926983940292,0.0,0.0,0.0,0.0,undersample,0.8745578800297784,0.873356287054998,0.63399434125221,COMPLETE
105,0.6461928130441665,2025-09-23 12:18:33.709196,2025-09-23 12:18:34.134083,0 days 00:00:00.424887,0.023829084645634505,gbtree,0.25069520363907866,5.369988910428293,lossguide,74.66926667231428,0.09509165749865074,2,10,20.311470065693417,300,,0.6775310356292593,0.5246426295367792,oversample,0.6437876914287857,2.430823196293574,,,,0.6815549584904899,0.7741836421332787,0.7711916461916462,0.6775310356292593,0.6510597912053148,0.6461928130441665,0.5246426295367792,0.7582747827414875,0.7490156109667861,0.516566265060241,0.5128140703517587,0.8802395209580839,0.87334189131365,oversample,0.8971151934552949,0.8942061862876879,0.6437876914287857,COMPLETE
106,0.0780608052588332,2025-09-23 12:18:34.254073,2025-09-23 12:18:35.026738,0 days 00:00:00.772665,0.02300268197062762,gbtree,0.65452979534476,5.323360708973222,lossguide,0.000489455144759772,0.0008718192693723941,5,3,17.67265583708025,800,,0.456808686922068,0.8325914222059444,none,0.9024114824948611,0.6965407647965806,,,,0.500439484067634,0.7707032449585424,0.7702702702702703,0.456808686922068,0.08346972176759411,0.0780608052588332,0.8325914222059444,0.6780218194215766,0.6704729998166408,0.9622641509433962,0.979381443298969,0.04362703165098375,0.04065040650406504,none,0.8680452406220491,0.8704553724244507,0.9024114824948611,COMPLETE
107,0.6809785322016975,2025-09-23 12:18:35.147029,2025-09-23 12:18:35.944687,0 days 00:00:00.797658,0.0006391490420005849,gbtree,0.6599922618192915,8.196898055745352,depthwise,0.085242229553452,0.006308721206285499,10,8,11.95814680023295,400,,0.41812292893432557,0.9741483758291316,none,0.6828381665629591,2.536744790160787,,,,0.8805023998391728,0.7961920360323472,0.8037469287469288,0.41812292893432557,0.6731242817271385,0.6809785322016975,0.9741483758291316,0.8053373453797423,0.800163744244677,0.5462296829203304,0.5571895424836601,0.8768177929854577,0.8754813863928113,none,0.914745484519743,0.9137503054056528,0.6828381665629591,COMPLETE
108,0.666020358700921,2025-09-23 12:18:36.068002,2025-09-23 12:18:37.105126,0 days 00:00:01.037124,0.4601913064912012,gbtree,0.9797785899321898,2.3040031430717556,lossguide,0.03632022021945108,0.005636890512777356,10,5,31.807443885230626,700,,0.4657752100914084,0.8773919465982822,undersample,0.5219312148831913,1.1333128666476247,,,,0.6365031396587884,0.7790971440270242,0.7883906633906634,0.4657752100914084,0.6588681631362631,0.666020358700921,0.8773919465982822,0.7854044253602841,0.7816738976189928,0.522567703109328,0.5350467289719626,0.8913601368691189,0.8818998716302953,undersample,0.9090992131890554,0.9080185546134406,0.5219312148831913,COMPLETE
109,0.38612143742255267,2025-09-23 12:18:37.225368,2025-09-23 12:19:25.505898,0 days 00:00:48.280530,0.04071283209774007,dart,0.5272172092742997,3.927589459044728,lossguide,0.00014983926726318015,0.0016053985895890406,7,5,13.337695588153588,900,tree,0.3459697399952928,0.7697683025548154,oversample,0.6016979209993478,2.6487595206728005,0.18299901323559042,uniform,0.09181757822742663,0.9266184691323314,0.23932848807452145,0.23925061425061425,0.3459697399952928,0.3862228462872718,0.38612143742255267,0.7697683025548154,0.7331598403092395,0.7250658838238485,0.23932848807452145,0.23925061425061425,1.0,1.0,oversample,0.8892967856316896,0.8882235465152604,0.6016979209993478,COMPLETE
110,0.7029543419874664,2025-09-23 12:19:25.624764,2025-09-23 12:20:02.797266,0 days 00:00:37.172502,1.9031634048735135,dart,0.5425589261396258,8.477393315953481,depthwise,0.2335566866708997,0.01310618174080441,0,8,0.47242403559822044,800,forest,0.5276783888923777,0.9631329400702919,none,0.915098289917526,3.0761391492304044,0.29513996086440847,weighted,0.2803044559879806,0.9854913736106421,0.8279250690961204,0.8301597051597052,0.5276783888923777,0.7025305255706954,0.7029543419874664,0.9631329400702919,0.8164471824502315,0.8076962572375547,0.5991548445517658,0.604371921182266,0.84901625320787,0.8399657680787335,none,0.9222149737090788,0.9196008210639869,0.915098289917526,COMPLETE
111,0.644121915820029,2025-09-23 12:20:02.914901,2025-09-23 12:20:03.376881,0 days 00:00:00.461980,0.00541303241934452,gbtree,0.8876293016173691,6.12180873070558,depthwise,2.196537218347972,0.44925447128200574,6,6,0.10989203590757132,600,,0.4178600967818187,0.8159520731782133,oversample,0.8164248284574812,3.531820632027466,,,,0.9789132146052257,0.7474664755860375,0.7489762489762489,0.4178600967818187,0.6437545126353791,0.644121915820029,0.8159520731782133,0.819593427881234,0.810573201647058,0.48593852190974496,0.48737096419942894,0.9533789563729683,0.9495079161317929,oversample,0.9240643806107146,0.921197798234702,0.8164248284574812,COMPLETE
112,0.6609800970061883,2025-09-23 12:20:03.496790,2025-09-23 12:20:04.194350,0 days 00:00:00.697560,0.0001477542894857808,gbtree,0.28165738329532153,4.660217438260493,depthwise,21.992336234761733,0.025413913011637684,7,12,3.2940027116925523,1000,,0.5415131615370262,0.8071837558841571,undersample,0.7657838611211993,1.2156203845294653,,,,0.2910465584188573,0.7840106459207697,0.7924856674856675,0.5415131615370262,0.6505465385889367,0.6609800970061883,0.8071837558841571,0.7194028721695034,0.7083598109452209,0.5308108108108108,0.542559033498078,0.8400342172797263,0.8455284552845529,undersample,0.8882208764315765,0.8907087121356734,0.7657838611211993,COMPLETE
113,0.0,2025-09-23 12:20:04.314153,2025-09-23 12:20:30.525651,0 days 00:00:26.211498,5.606894439673926,dart,0.5517962494742785,2.569754591527016,lossguide,0.003998116015575143,0.00015347057987661188,10,11,1.8311773472158959,600,tree,0.4214195402614829,0.6383974507337495,none,0.9489567757430137,1.0688847676212272,0.10877610514001923,weighted,0.03721173508490102,0.6990933802150829,0.7606715119254785,0.7607493857493858,0.4214195402614829,0.0,0.0,0.6383974507337495,0.7845029845274907,0.7776600522082409,0.0,0.0,0.0,0.0,none,0.9036563817977978,0.9027176683597786,0.9489567757430137,COMPLETE
114,0.557422197741669,2025-09-23 12:20:30.645940,2025-09-23 12:21:24.184306,0 days 00:00:53.538366,4.576126425448643,dart,0.5100537387388349,2.762476674692543,lossguide,0.015002291812789515,0.00018538682724622026,8,9,0.1038686419581386,1000,forest,0.5785294740322022,0.5665379950920831,undersample,0.7645871348563282,1.162236138306754,0.31809477454292223,weighted,0.07026736876047386,0.9736044191442934,0.8400040945849114,0.8354832104832105,0.5785294740322022,0.573067467904944,0.557422197741669,0.5665379950920831,0.7493436398656764,0.7428779156615508,0.7928949357520786,0.7820710973724884,0.44867408041060736,0.4330338040222507,undersample,0.8968937089774542,0.8948687646789776,0.7645871348563282,COMPLETE
115,0.0,2025-09-23 12:21:24.304030,2025-09-23 12:21:25.472559,0 days 00:00:01.168529,0.0011420624192024068,gbtree,0.6653438745182895,5.723170159586255,depthwise,23.400139216598284,0.0009399841207819925,9,5,1.001203103209491,1000,,0.6695513210045444,0.8190422988611419,none,0.8436758977236369,1.514526826851128,,,,0.4237430380793762,0.7606715119254785,0.7607493857493858,0.6695513210045444,0.0,0.0,0.8190422988611419,0.6878618449632217,0.6773564295539716,0.0,0.0,0.0,0.0,none,0.8763619885207958,0.8749411430114982,0.8436758977236369,COMPLETE
116,0.7086903304773562,2025-09-23 12:21:25.591298,2025-09-23 12:21:31.949124,0 days 00:00:06.357826,0.08523118519176241,dart,0.5380880590648389,3.4470217876778806,lossguide,2.2182034848896186,0.009480866723058293,6,12,0.11143672704571006,200,forest,0.6589733306917038,0.7822985548203607,oversample,0.9553626174214203,1.3117843062853252,0.34116328953127945,uniform,0.7251321042348098,0.9841272299527939,0.8586344559320299,0.8538083538083538,0.6589733306917038,0.7198214648001623,0.7086903304773562,0.7822985548203607,0.8080813239238012,0.7998652978862941,0.6846777306059436,0.6771929824561403,0.7587681779298546,0.7432605905006419,oversample,0.9201934961612619,0.9179991508815923,0.9553626174214203,COMPLETE
117,0.653725548753173,2025-09-23 12:21:32.066781,2025-09-23 12:21:44.788909,0 days 00:00:12.722128,0.0004750393532618008,dart,0.8762988296857632,2.4394081886689145,depthwise,2.1523088636364545,0.007385832567655079,3,10,2.7309761691907113,400,forest,0.37610420356933294,0.9463199015236607,none,0.7857487232312278,4.8922562671090475,0.25079573547038375,weighted,0.7914757158217512,0.9923626474891882,0.7617975227761286,0.7625921375921376,0.37610420356933294,0.6537717601547389,0.653725548753173,0.9463199015236607,0.8136892089702837,0.8070976477172753,0.5012548482774355,0.5020642201834863,0.9396920444824637,0.936670945656825,none,0.9204700064085451,0.9190757507940548,0.7857487232312278,COMPLETE
118,0.6041442411194833,2025-09-23 12:21:44.907816,2025-09-23 12:22:12.602376,0 days 00:00:27.694560,0.03670865177565725,dart,0.255851442367756,1.4198647542526377,lossguide,0.0035995060773937513,0.1260598233654764,2,9,64.04397681278094,700,tree,0.4166664533692013,0.9980502201506191,oversample,0.6366748538962955,2.9874709161140145,0.438340946111524,weighted,0.29184558798781,0.20072262841699973,0.6941345071143413,0.6988124488124489,0.4166664533692013,0.6006415396952687,0.6041442411194833,0.9980502201506191,0.7752585315355907,0.7741703476369046,0.4368195956454121,0.44062806673209026,0.9610778443113772,0.9606332905434317,oversample,0.9087542085216498,0.9084033815711593,0.6366748538962955,COMPLETE
119,0.0,2025-09-23 12:22:12.723186,2025-09-23 12:22:22.337029,0 days 00:00:09.613843,0.017045458163741097,dart,0.7827031970614946,8.878650314643885,lossguide,0.006187840164283614,0.0002359787434747833,1,6,1.2006855989387075,400,forest,0.6789234327332963,0.6439168810700364,undersample,0.7362144226582584,0.9185350552908496,0.23224517661042116,uniform,0.10641251586227968,0.9555793315503478,0.7606715119254785,0.7607493857493858,0.6789234327332963,0.0,0.0,0.6439168810700364,0.6736609377417643,0.6635143349840023,0.0,0.0,0.0,0.0,undersample,0.8759102131396702,0.8767339886389962,0.7362144226582584,COMPLETE
120,0.6472523856531753,2025-09-23 12:22:22.456302,2025-09-23 12:22:22.818114,0 days 00:00:00.361812,0.0001547507123774549,gbtree,0.6873290114845145,8.866832208474523,depthwise,9.670585893652907,0.05395484780360699,5,7,3.7997303695561255,300,,0.38191254477434095,0.7034732001357946,undersample,0.7937442623658617,0.5657608749410017,,,,0.6547352342929729,0.7756167468522879,0.7805077805077805,0.38191254477434095,0.6435772357723577,0.6472523856531753,0.7034732001357946,0.7071594182917816,0.6998459396868452,0.5191500524658972,0.5257952419139268,0.8464499572284003,0.8416773641420625,undersample,0.8798535059761095,0.8834753127719535,0.7937442623658617,COMPLETE
121,0.0,2025-09-23 12:22:22.935920,2025-09-23 12:22:29.229453,0 days 00:00:06.293533,23.175819070965183,dart,0.8109974937505715,9.622799113275983,lossguide,0.013014956474669805,0.0017963412440820416,0,5,0.6796011819394776,300,tree,0.6635506204891221,0.7424526375995186,undersample,0.704647656117381,0.9890705610138926,0.405145381534718,weighted,0.8554374324340055,0.3448333372167401,0.7606715119254785,0.7607493857493858,0.6635506204891221,0.0,0.0,0.7424526375995186,0.6819480537989548,0.6725237458325571,0.0,0.0,0.0,0.0,undersample,0.8722864266276835,0.8683664063974215,0.704647656117381,COMPLETE
122,0.638095238095238,2025-09-23 12:22:29.348299,2025-09-23 12:22:36.440270,0 days 00:00:07.091971,0.4007063820009861,dart,0.8940646810733177,5.84644597787864,lossguide,0.00035287779020927673,0.04569243902277097,4,10,4.772122707826837,300,forest,0.3105557326853404,0.9893982688710745,none,0.9388091886924883,4.477955729944286,0.43813096912515653,weighted,0.22852500029027012,0.5052177656566659,0.7407104104821374,0.7432432432432432,0.3105557326853404,0.6365332185392453,0.638095238095238,0.9893982688710745,0.8150528246113474,0.8064030652059966,0.47894623191535307,0.4813847158719791,0.9486740804106074,0.9460847240051348,none,0.9213107898051294,0.9183455700013939,0.9388091886924883,COMPLETE
123,0.6830649442576535,2025-09-23 12:22:36.561165,2025-09-23 12:22:37.834259,0 days 00:00:01.273094,0.00039181017605775874,gbtree,0.6468184779457959,6.197720842759777,lossguide,0.004239349143544125,0.009503191879978804,5,12,0.11853417574728924,600,,0.617563353239504,0.8008167478915733,undersample,0.7767252148349431,1.3259276315679314,,,,0.5223267557855145,0.8176886068174839,0.8166461916461917,0.617563353239504,0.6874890331637129,0.6830649442576535,0.8008167478915733,0.7863238092589843,0.7769711558150916,0.5828622433799464,0.5823777911888955,0.8378956372968349,0.8258451005562687,undersample,0.9106135730154548,0.9069182017277538,0.7767252148349431,COMPLETE
124,0.694773069477307,2025-09-23 12:22:37.952458,2025-09-23 12:22:38.767062,0 days 00:00:00.814604,0.0014106721126126568,gbtree,0.8810587503056697,7.0233914269170725,lossguide,2.218124278438951,0.030143504355251982,6,6,2.6001128560002833,900,,0.6820504137890255,0.8665546519233991,oversample,0.5771388888290018,0.9103671573888009,,,,0.7297393874291604,0.8588391851776026,0.8547297297297297,0.6820504137890255,0.7040137368534021,0.694773069477307,0.8665546519233991,0.7991187528089311,0.7859373908900548,0.7065919862128393,0.6985294117647058,0.7014542343883661,0.6910569105691057,oversample,0.9171164275060237,0.9121634628368467,0.5771388888290018,COMPLETE
