number,value,datetime_start,datetime_complete,duration,params_alpha,params_booster,params_colsample_bytree,params_gamma,params_grow_policy,params_lambda,params_learning_rate,params_max_delta_step,params_max_depth,params_min_child_weight,params_n_estimators,params_normalize_type,params_params_decision_threshold,params_params_feature_fraction,params_params_resampling,params_params_sample_rows,params_params_scale_pos_weight,params_rate_drop,params_sample_type,params_skip_drop,params_subsample,user_attrs_acc_test,user_attrs_acc_val,user_attrs_decision_threshold,user_attrs_f1_test,user_attrs_f1_val,user_attrs_feature_fraction,user_attrs_pr_auc_test,user_attrs_pr_auc_val,user_attrs_prec_test,user_attrs_prec_val,user_attrs_rec_test,user_attrs_rec_val,user_attrs_resampling_strategy,user_attrs_roc_auc_test,user_attrs_roc_auc_val,user_attrs_sample_rows,state
1866,0.6965933286018453,2025-09-23 22:31:07.897651,2025-09-23 22:31:51.216546,0 days 00:00:43.318895,0.2272457168726559,dart,0.7127817288219713,0.006519341862752048,lossguide,0.0005080863250928686,0.013502692498723257,2,11,1.7497157766474056,700,forest,0.5646247216680437,0.8764801892595654,none,0.9084036172047195,4.359255603606117,0.25026456230698413,weighted,0.730288250726339,0.6466023271298764,0.8246494011669567,0.8249385749385749,0.5646247216680437,0.6963304378656267,0.6965933286018453,0.8764801892595654,0.8165574659999318,0.8109719329755569,0.5946109597335756,0.5950287966050318,0.8400342172797263,0.8399657680787335,none,0.9196076674150402,0.91965114857574,0.9084036172047195,COMPLETE
1867,0.6985431453119163,2025-09-23 22:31:51.356646,2025-09-23 22:32:06.053648,0 days 00:00:14.697002,0.00034014696012069453,dart,0.3484304571553053,0.40034688976646504,lossguide,0.005731782802470553,0.009438858070589494,1,11,15.006381362151526,400,forest,0.5928060178186445,0.9932911364914472,none,0.9908570785826588,3.5468814369210446,0.20027488184220704,weighted,0.6681354475126811,0.9396577494219108,0.8339645818405159,0.8347665847665847,0.5928060178186445,0.6996296296296296,0.6985431453119163,0.9932911364914472,0.7917070856947706,0.7823537198089061,0.6169170476812541,0.6198210142525687,0.8079555175363559,0.8001711596063329,none,0.9157776206051477,0.9141098534415639,0.9908570785826588,COMPLETE
1868,0.6918531025749262,2025-09-23 22:32:06.194094,2025-09-23 22:32:16.261923,0 days 00:00:10.067829,0.0015372865783596383,dart,0.378547138441681,3.8624034744743665,lossguide,0.00019883279715814288,0.005448133699060568,4,12,4.236590951395032,300,forest,0.6550624899587352,0.9954534745771235,none,0.9692525689421757,3.8086770342707847,0.1953859106230854,weighted,0.7182904007901355,0.8702142565462913,0.8566895280990889,0.8505323505323505,0.6550624899587352,0.7058823529411765,0.6918531025749262,0.9954534745771235,0.7884817041752414,0.777991017958267,0.6936416184971098,0.6826322365680966,0.718562874251497,0.7013264869490801,none,0.9151450832690694,0.9127364133425029,0.9692525689421757,COMPLETE
1869,0.7194869673148532,2025-09-23 22:32:16.398948,2025-09-23 22:32:25.377717,0 days 00:00:08.978769,0.0005322249555957371,dart,0.4439023339528523,1.8390061170298893,lossguide,0.0025875730051393153,0.06339067547361547,1,12,0.17660666344313347,300,forest,0.6236852168306932,0.8120362732728769,none,0.8099498437030758,2.8961882699959567,0.23501191387882975,weighted,0.7451133161477548,0.9544231732026518,0.8599651960282526,0.8611793611793612,0.6236852168306932,0.7185185185185186,0.7194869673148532,0.8120362732728769,0.8278553940491062,0.822770325603829,0.6923076923076923,0.6964357228674409,0.7467921300256629,0.7441163885323063,none,0.9266609234958769,0.9256543454668126,0.8099498437030758,COMPLETE
1870,0.6963666240642687,2025-09-23 22:32:25.516080,2025-09-23 22:32:43.434317,0 days 00:00:17.918237,0.0014133552699872342,dart,0.4314028110746221,1.6502837863262343,depthwise,0.00022732129814618022,0.007677845423407435,6,5,0.20644848442663147,500,forest,0.5048717466992514,0.8492979828365699,oversample,0.99419036558534,0.7752989518207019,0.14085277750251604,weighted,0.8498809436632774,0.9529636334589121,0.8262872351315386,0.8297502047502048,0.5048717466992514,0.6942893172401369,0.6963666240642687,0.8492979828365699,0.8039654003499513,0.7959259211977951,0.5997510115157174,0.6073248407643312,0.8242087254063302,0.8160034231921267,oversample,0.917200203664417,0.9150021302818048,0.99419036558534,COMPLETE
1871,0.68625,2025-09-23 22:32:43.572350,2025-09-23 22:32:45.734056,0 days 00:00:02.161706,0.008924211273861535,gbtree,0.2934819111735011,1.9241639841665332,lossguide,0.00032833620187713446,0.1602834995111808,5,11,0.12118678574566949,800,,0.4565971871866164,0.9121006772150257,none,0.6797182238767463,1.5641193799262667,,,,0.23867407836394844,0.8372402497696796,0.8458230958230958,0.4565971871866164,0.6717588769611891,0.68625,0.9121006772150257,0.7707087525344585,0.7767174618409671,0.6492418196328811,0.6686967113276492,0.6958939264328486,0.7047496790757382,none,0.9004166820635215,0.9032001848182858,0.6797182238767463,COMPLETE
1872,0.707869798104656,2025-09-23 22:32:45.872331,2025-09-23 22:32:47.079057,0 days 00:00:01.206726,0.0016895978051644938,gbtree,0.6371714397114229,2.480357134872025,lossguide,0.00021584988595782699,0.2834683431326609,2,11,6.060368993887197,600,,0.6854058296467916,0.990215234012109,none,0.9064484593232274,4.599987267232694,,,,0.8326357202428241,0.8526973078104207,0.8548321048321048,0.6854058296467916,0.7059063968935213,0.707869798104656,0.990215234012109,0.809456680469119,0.8027344393394288,0.6759295499021526,0.6825586015097338,0.7386655260906758,0.7351305091998288,none,0.918319310395876,0.9153949612717128,0.9064484593232274,COMPLETE
1873,0.6932284541723667,2025-09-23 22:32:47.217959,2025-09-23 22:32:50.757497,0 days 00:00:03.539538,0.012301649274922047,dart,0.8087857593459208,5.928519362543875,lossguide,0.00012071014223803792,0.23602374612517435,8,11,0.2238922298327074,200,tree,0.6892008501288213,0.9540760939243446,undersample,0.9744379072837026,2.6902190464432727,0.22594505070572482,weighted,0.6848590274115824,0.5258477015256005,0.8141058450199611,0.8163390663390664,0.6892008501288213,0.693863789615644,0.6932284541723667,0.9540760939243446,0.8123848969916065,0.8064830415601685,0.5726210350584308,0.5773283964682426,0.8802395209580839,0.8673513050919983,undersample,0.9223138013723978,0.9198871235679189,0.9744379072837026,COMPLETE
1874,0.710290426676228,2025-09-23 22:32:50.896113,2025-09-23 22:32:54.808543,0 days 00:00:03.912430,0.002142653465422725,dart,0.6213877780571931,8.319095851174707,lossguide,0.010643139807147636,0.05098307303727347,1,9,2.7394711528172415,200,forest,0.6051848225853422,0.9790399364743824,none,0.9924876264347283,4.589346319629037,0.18357142874364366,weighted,0.7073135803019218,0.7992664378254021,0.8314054662708568,0.8345618345618345,0.6051848225853422,0.7077196095829636,0.710290426676228,0.9790399364743824,0.8266201130445054,0.8193942602461042,0.6047922353654838,0.6112311015118791,0.8528656971770744,0.8476679503637141,none,0.927595872330545,0.925272858321087,0.9924876264347283,COMPLETE
1875,0.7109737248840804,2025-09-23 22:32:54.945439,2025-09-23 22:33:22.346582,0 days 00:00:27.401143,0.0003253205396382373,dart,0.7272906262501978,0.13235077718084587,lossguide,0.0007605742625378905,0.06619149235770051,2,12,0.7824338908773012,500,forest,0.6596031089413298,0.9835570361395677,none,0.9625570012128417,3.5592003944213886,0.18641627449624543,weighted,0.7675868023136992,0.723057695425288,0.8625243115979118,0.865990990990991,0.6596031089413298,0.705159165751921,0.7109737248840804,0.9835570361395677,0.8177466730024728,0.8148414192020138,0.724402345511953,0.7344890510948905,0.6869118905047049,0.6889174154899443,none,0.9228386758405445,0.9215904276842314,0.9625570012128417,COMPLETE
1876,0.69662100456621,2025-09-23 22:33:22.485333,2025-09-23 22:33:48.082686,0 days 00:00:25.597353,0.0002923012169983198,dart,0.722354956688009,3.866258275243349,lossguide,0.00010606792977204015,0.06692461280312346,0,8,59.49457966287982,600,forest,0.5775081744103115,0.9141743723378851,none,0.9233896683932725,3.6569331067207598,0.20686666562238748,weighted,0.8702964808845084,0.915649229927082,0.8286416214556249,0.829954954954955,0.5775081744103115,0.6981608366390191,0.69662100456621,0.9141743723378851,0.8061222809901274,0.7963171112013938,0.6034912718204489,0.6077119184193754,0.8280581693755347,0.8160034231921267,none,0.9180565853701215,0.9150118042199906,0.9233896683932725,COMPLETE
1877,0.7008517887563884,2025-09-23 22:33:48.219710,2025-09-23 22:33:49.362643,0 days 00:00:01.142933,0.08108324036757401,gbtree,0.25941724824752344,2.493601544848577,lossguide,0.0024612359874604155,0.082524192989772,9,7,0.45206202227613923,400,,0.4773075724477842,0.9831581296622884,oversample,0.6845380209523552,1.4050457548931299,,,,0.2772834102022678,0.8174838775719111,0.8202293202293203,0.4773075724477842,0.6962003748509116,0.7008517887563884,0.9831581296622884,0.8207104665602314,0.8160233479191736,0.578589634664401,0.5822247381828475,0.8738237810094097,0.8801882755669662,oversample,0.923716440468161,0.9232032689619121,0.6845380209523552,COMPLETE
1878,0.688298918387414,2025-09-23 22:33:49.502028,2025-09-23 22:34:03.689013,0 days 00:00:14.186985,0.06176517718072092,dart,0.6327135149947448,0.3069896815004518,lossguide,0.004124224881696851,0.384838586327809,2,11,2.1898971736823425,400,forest,0.6915241296733878,0.9374939652211493,undersample,0.9040753568374078,4.930377323850881,0.16160518725301184,weighted,0.8118651577053668,0.6786406596649277,0.7982393284880746,0.8052825552825553,0.6915241296733878,0.6768322675848499,0.688298918387414,0.9374939652211493,0.801285475467838,0.8021395142685264,0.5487902153682531,0.5577689243027888,0.8828058169375534,0.8985879332477535,undersample,0.9166351822567451,0.9184552655504671,0.9040753568374078,COMPLETE
1879,0.6747603833865815,2025-09-23 22:34:03.831877,2025-09-23 22:34:08.597660,0 days 00:00:04.765783,0.0006342296175642422,dart,0.4426090183121667,2.0975664320986924,lossguide,0.0008315434100009234,0.09325286588476593,0,12,17.633790869786342,200,forest,0.64404315600965,0.9724511463746691,oversample,0.997411551231944,4.589504170411042,0.20371641004080984,weighted,0.6592969778247357,0.6492396038285753,0.7881052308322244,0.7915642915642915,0.64404315600965,0.6729857819905213,0.6747603833865815,0.9724511463746691,0.81823203043727,0.8108470621274888,0.5335671342685371,0.5383634973234769,0.9110350727117195,0.9037227214377407,oversample,0.9233439229160342,0.9206892254843546,0.997411551231944,COMPLETE
1880,0.7004840271055179,2025-09-23 22:34:08.737338,2025-09-23 22:34:10.174123,0 days 00:00:01.436785,0.007979001619713195,gbtree,0.7802660836725059,4.708566896802193,lossguide,0.0013412859405294005,0.010767131841939167,4,8,0.5878654594737777,200,,0.44206020192567874,0.9128351748479248,oversample,0.9284251595502543,0.5214558199290676,,,,0.7463457313979662,0.8426655747773569,0.8416257166257166,0.44206020192567874,0.7044799077100558,0.7004840271055179,0.9128351748479248,0.80852316721838,0.7998139204710567,0.6398882291302829,0.6396746817538896,0.7835757057313943,0.7740693196405648,oversample,0.9159624116436369,0.9138557398152864,0.9284251595502543,COMPLETE
1881,0.7171802448290417,2025-09-23 22:34:10.311484,2025-09-23 22:34:40.408903,0 days 00:00:30.097419,0.09717917367679443,dart,0.51016698218054,0.48581451679947474,lossguide,0.0007143339801836362,0.4061197177536721,0,9,0.9761940353532708,600,forest,0.6937249288820146,0.8868966197645696,none,0.8975129234086509,4.119883884660511,0.14240164152077986,weighted,0.7761410009808136,0.8433777434138261,0.8620124884839799,0.8628173628173628,0.6937249288820146,0.7174004192872118,0.7171802448290417,0.8868966197645696,0.8243168699345924,0.8177593651206047,0.7035361842105263,0.7076218242399,0.7318220701454234,0.7270004278990159,none,0.9252588024251398,0.9235514731536412,0.8975129234086509,COMPLETE
1882,0.72,2025-09-23 22:34:40.548261,2025-09-23 22:34:53.916862,0 days 00:00:13.368601,0.010688476976433273,dart,0.2978595802680606,3.109614889320092,lossguide,0.009424534585982943,0.049973363761963714,1,11,1.768873568885188,400,forest,0.5895876536643843,0.9734632644944314,none,0.8521560998863607,3.2600399347487135,0.2914252046687985,weighted,0.8857636276912899,0.7581006908561962,0.8533114955471389,0.8523751023751024,0.5895876536643843,0.7233056574628307,0.72,0.9734632644944314,0.8271402213440211,0.8211372652316741,0.6592749032030975,0.659082829719161,0.8011120615911035,0.7933247753530167,none,0.9276207375317995,0.9264149012737178,0.8521560998863607,COMPLETE
1883,0.5045984058859595,2025-09-23 22:34:54.052720,2025-09-23 22:35:12.641580,0 days 00:00:18.588860,0.011475804493159646,dart,0.5182643490414806,1.9836680257342243,lossguide,0.00018768893803920494,0.0024798590694246566,2,11,0.9963393687112921,400,forest,0.6988475560333816,0.9395096527313122,none,0.8541029457461082,2.8869168734878192,0.20496814037214467,weighted,0.8930469378590291,0.6876215790215954,0.839594636093766,0.8345618345618345,0.6988475560333816,0.5244309559939302,0.5045984058859595,0.9395096527313122,0.8025273535510999,0.7944734005539618,0.9028213166144201,0.8897297297297297,0.369546621043627,0.35216089002995293,none,0.9190086865889884,0.9167279205461029,0.8541029457461082,COMPLETE
1884,0.6839123867069486,2025-09-23 22:35:12.779081,2025-09-23 22:35:13.513466,0 days 00:00:00.734385,6.847069202707208,gbtree,0.651331111584641,0.4313908154521088,lossguide,0.0019011465682594207,0.015456902835035568,10,5,0.2342963750112723,200,,0.41657097323199693,0.8525787075087695,none,0.6888323619652645,1.5061973723511362,,,,0.388489948814439,0.8246494011669567,0.8286240786240786,0.41657097323199693,0.6817759613598365,0.6839123867069486,0.8525787075087695,0.791565853517255,0.7832656445089374,0.6026272577996716,0.6120310915849949,0.7848588537211292,0.7749251176722294,none,0.9078320376376262,0.9058477919840712,0.6888323619652645,COMPLETE
1885,0.7138692211578509,2025-09-23 22:35:13.655938,2025-09-23 22:35:41.678552,0 days 00:00:28.022614,0.005988724127022158,dart,0.6188373495189652,1.9658642661988583,lossguide,0.00011205571794743582,0.15535711712261968,2,12,7.011574582099865,600,forest,0.6956458655906673,0.9559005700111011,none,0.9864420243858065,4.620953447675511,0.1143967237909028,weighted,0.8967779883278993,0.8359430553379089,0.8566895280990889,0.8593366093366094,0.6956458655906673,0.7103847745138602,0.7138692211578509,0.9559005700111011,0.8163978872026623,0.8139819580366876,0.6879006410256411,0.6953346855983773,0.7343883661248931,0.7334189131364998,none,0.9220127137155415,0.92104016486694,0.9864420243858065,COMPLETE
1886,0.7168474651317246,2025-09-23 22:35:41.815007,2025-09-23 22:36:30.126098,0 days 00:00:48.311091,0.02760650319470651,dart,0.6060035077938064,3.6249468898214094,lossguide,0.02390725797907375,0.19202026469200525,5,11,3.5120647275665933,800,forest,0.6478708897390753,0.9998236995281511,none,0.9074735450709966,2.4826923977902027,0.18502441365560393,weighted,0.7143415054502142,0.6071395686961327,0.8686661889650936,0.8690622440622441,0.6478708897390753,0.7164640883977901,0.7168474651317246,0.9998236995281511,0.8240336389213534,0.817105240568907,0.7411979881115683,0.7426605504587156,0.693327630453379,0.6927685066324347,none,0.9259988011749728,0.9236508901433914,0.9074735450709966,COMPLETE
1887,0.7050925925925926,2025-09-23 22:36:30.263113,2025-09-23 22:36:31.374405,0 days 00:00:01.111292,0.06680010029500907,gbtree,0.8916927845865921,7.295506403379144,lossguide,0.06772052634587411,0.02464440877586971,9,8,0.19318512651561762,300,,0.5675821396052966,0.8618013114156913,none,0.9711095478275367,1.4309935357232397,,,,0.5169563717336688,0.8714300337803256,0.8695741195741196,0.5675821396052966,0.7109986194201565,0.7050925925925926,0.8618013114156913,0.8240589895515539,0.8169726744324539,0.7694223107569721,0.7680282400403429,0.6608212147134302,0.6516902011125374,none,0.9254547310016911,0.9236556119465535,0.9711095478275367,COMPLETE
1888,0.7169050977231514,2025-09-23 22:36:31.513382,2025-09-23 22:36:38.579284,0 days 00:00:07.065902,0.0025869813331028326,dart,0.4258938418563812,3.2971023609095473,depthwise,0.0006858439888173487,0.03211483037106722,1,9,8.12688992869898,300,forest,0.6866035153283385,0.9422366556293698,none,0.8418749137918242,4.105123668175655,0.2863401322658434,weighted,0.7747669699352608,0.692803031431693,0.8563824342307299,0.8561629811629812,0.6866035153283385,0.719231538923354,0.7169050977231514,0.9422366556293698,0.8217542680784645,0.8128265442787456,0.6758179766829635,0.6774562071591774,0.7686056458511549,0.7612323491655969,none,0.9252237206192034,0.9229260645665123,0.8418749137918242,COMPLETE
1889,0.7091078066914498,2025-09-23 22:36:38.717874,2025-09-23 22:36:42.373274,0 days 00:00:03.655400,0.11679219865781014,dart,0.7224995785409196,4.166020058292264,lossguide,0.03408551021065802,0.30951651806968894,3,11,1.710828504005634,200,forest,0.654479000525646,0.9997959622071845,none,0.9023269026694853,2.047589418972084,0.22541796216520785,weighted,0.8970346695839828,0.7264041045805127,0.8712253045347528,0.8718263718263718,0.654479000525646,0.7108045977011495,0.7091078066914498,0.9997959622071845,0.8264779378661875,0.8191766429265278,0.768389662027833,0.7758007117437722,0.6612489307100086,0.6529738981600343,none,0.9271203541357218,0.9241651060243471,0.9023269026694853,COMPLETE
1890,0.7163819095477387,2025-09-23 22:36:42.512075,2025-09-23 22:36:54.366543,0 days 00:00:11.854468,0.00014982178610179855,dart,0.9229875086147985,7.803195592724703,depthwise,0.005953148236462994,0.06174606746312729,0,11,3.2599361886521705,400,forest,0.6254186608296142,0.9982002038042862,none,0.8291684900490017,3.120071757250705,0.1260347950370604,weighted,0.7462126056172703,0.866475726140924,0.8580202681953117,0.8555487305487306,0.6254186608296142,0.7235399641219853,0.7163819095477387,0.9982002038042862,0.8266718025468593,0.8193241385194202,0.6774916013437849,0.6755117513267627,0.7763045337895638,0.7625160462130937,none,0.9269052874123718,0.924736185083628,0.8291684900490017,COMPLETE
1891,0.7191739218465276,2025-09-23 22:36:54.508106,2025-09-23 22:37:14.718729,0 days 00:00:20.210623,0.00017769749749443618,dart,0.6149364875339607,1.481845625415679,lossguide,0.060535151091328614,0.02180151444008628,4,9,12.538035189104214,500,forest,0.6399499080507528,0.964769127406872,none,0.9892662143246306,3.2843215090559448,0.1410282801795492,weighted,0.660691852802145,0.6020340823476855,0.8576108097041663,0.858005733005733,0.6399499080507528,0.7204020100502513,0.7191739218465276,0.964769127406872,0.8243647344440375,0.8169072603851244,0.6795601061812666,0.6825518831667948,0.7664670658682635,0.7599486521181001,none,0.9261058596803738,0.9236043631073542,0.9892662143246306,COMPLETE
1892,0.6975982532751092,2025-09-23 22:37:14.858543,2025-09-23 22:37:26.869759,0 days 00:00:12.011216,0.0011896455341111514,dart,0.8237322805504175,5.460987082958857,depthwise,0.00012801453582268613,0.4686059341530683,2,11,0.7800808382290083,400,forest,0.5798972745290113,0.9509699789885725,none,0.9392450872933581,4.136293159934398,0.14981699842992574,weighted,0.7360779700035674,0.9675654821061125,0.8296652676834886,0.8298525798525799,0.5798972745290113,0.6993133357426816,0.6975982532751092,0.9509699789885725,0.8049528034411102,0.7908625476162625,0.6054443053817271,0.6068376068376068,0.8276304533789564,0.8202824133504493,none,0.9176626848960825,0.9125408040090642,0.9392450872933581,COMPLETE
1893,0.7194968553459119,2025-09-23 22:37:27.007304,2025-09-23 22:37:33.905531,0 days 00:00:06.898227,0.001122642612754999,dart,0.8528864225193773,4.951072453920203,depthwise,0.0003049435699728079,0.07396752856945435,5,8,0.3592117190854814,300,tree,0.44865833284306866,0.9171449842202504,none,0.9420425990478956,1.2340278368329138,0.18591166405550458,weighted,0.7603909814275525,0.2790754339795548,0.8620124884839799,0.8630221130221131,0.44865833284306866,0.7192836318200749,0.7194968553459119,0.9171449842202504,0.8217285856894239,0.8164286715386098,0.7008928571428571,0.7053020961775586,0.7386655260906758,0.7342747111681643,none,0.9246741824039791,0.9229589444397515,0.9420425990478956,COMPLETE
1894,0.6809351333552848,2025-09-23 22:37:34.042850,2025-09-23 22:37:42.115129,0 days 00:00:08.072279,0.020973349143164725,gbtree,0.2711863685975422,1.1031402331997182,lossguide,0.0007104974104143486,0.003244473096981266,8,11,0.2910925128583149,800,,0.39817979479787524,0.8826144973830587,none,0.8409279247132232,2.426508270381037,,,,0.34468872610903334,0.7952707544272699,0.8015970515970516,0.39817979479787524,0.6759559300064809,0.6809351333552848,0.8826144973830587,0.8002443893956439,0.792304289381675,0.5440792905581638,0.5533850682365534,0.8922155688622755,0.8848951647411211,none,0.9169782587198865,0.9154202977764856,0.8409279247132232,COMPLETE
1895,0.7217084984588287,2025-09-23 22:37:42.256048,2025-09-23 22:37:49.869171,0 days 00:00:07.613123,0.004948347327858474,dart,0.8260941994240244,6.2230936546394515,depthwise,0.09127768581924266,0.02174292978063836,5,11,0.24591477897783048,300,forest,0.6897811865378064,0.9991134834393742,none,0.9805150477848801,3.0291054653825,0.11614728371472761,weighted,0.8094510806984767,0.7311267529765393,0.8714300337803256,0.8705978705978706,0.6897811865378064,0.7243195785776997,0.7217084984588287,0.9991134834393742,0.8281499704927712,0.8213519053895654,0.7439134355275022,0.7433106575963719,0.7057313943541489,0.7013264869490801,none,0.9278424522429851,0.9255079695687848,0.9805150477848801,COMPLETE
