number,value,datetime_start,datetime_complete,duration,params_alpha,params_booster,params_colsample_bytree,params_gamma,params_grow_policy,params_lambda,params_learning_rate,params_max_delta_step,params_max_depth,params_min_child_weight,params_n_estimators,params_normalize_type,params_params_decision_threshold,params_params_feature_fraction,params_params_resampling,params_params_sample_rows,params_params_scale_pos_weight,params_rate_drop,params_sample_type,params_skip_drop,params_subsample,user_attrs_acc_test,user_attrs_acc_val,user_attrs_decision_threshold,user_attrs_f1_test,user_attrs_f1_val,user_attrs_feature_fraction,user_attrs_pr_auc_test,user_attrs_pr_auc_val,user_attrs_prec_test,user_attrs_prec_val,user_attrs_rec_test,user_attrs_rec_val,user_attrs_resampling_strategy,user_attrs_roc_auc_test,user_attrs_roc_auc_val,user_attrs_sample_rows,state
2329,0.6875593542260209,2025-09-24 00:35:41.074212,2025-09-24 00:35:58.805295,0 days 00:00:17.731083,0.00014677719153329035,dart,0.9772171201016376,9.534822836086505,depthwise,0.0001766281659030685,0.04205663506917361,0,11,9.297084971120354,500,tree,0.6970157053691555,0.9921699284077982,none,0.8594546004334322,2.1999908176176777,0.12926579155469684,weighted,0.6620445573029526,0.5089015391583463,0.8693827413245983,0.8652743652743653,0.6970157053691555,0.699623352165725,0.6875593542260209,0.9921699284077982,0.8204035549528611,0.8107731128237197,0.7780104712041885,0.7722666666666667,0.6355859709153122,0.6195977749251177,none,0.9242631295457415,0.9215840071835901,0.8594546004334322,COMPLETE
2330,0.713203214695752,2025-09-24 00:35:58.957465,2025-09-24 00:37:00.922396,0 days 00:01:01.964931,0.284754826434476,dart,0.2726960411402525,0.4226660860593018,lossguide,0.006589630616200795,0.013553171317649793,8,8,0.9182476199931044,900,forest,0.42252098330852184,0.9395340933600844,none,0.7997630622228692,0.8526785499080733,0.11455345838100231,weighted,0.8943695893482014,0.5251568770811301,0.8710205752891801,0.8721334971334971,0.42252098330852184,0.7124600638977636,0.713203214695752,0.9395340933600844,0.8280607696733813,0.8221775882507836,0.7636986301369864,0.7695738354806739,0.6676646706586826,0.6645271715875053,none,0.9275544878867905,0.9260114174352121,0.7997630622228692,COMPLETE
2331,0.7072368421052632,2025-09-24 00:37:01.069091,2025-09-24 00:37:02.480650,0 days 00:00:01.411559,0.03180947110392136,gbtree,0.37749080877127816,2.476059213066631,lossguide,0.24759570926238234,0.03504954673105702,0,6,0.1620667003090157,500,,0.6810955532815269,0.9618483271420439,none,0.6870602365709098,2.243194518472068,,,,0.6125842260481226,0.8714300337803256,0.8724406224406225,0.6810955532815269,0.707089552238806,0.7072368421052632,0.9618483271420439,0.8274934555763047,0.8231975608125921,0.7774358974358975,0.7842626367899947,0.6484174508126604,0.6439880188275567,none,0.9280058028012261,0.9268821582463961,0.6870602365709098,COMPLETE
2332,0.3152674459794545,2025-09-24 00:37:02.628972,2025-09-24 00:37:50.800559,0 days 00:00:48.171587,0.0045231041573879725,dart,0.23871286428236116,1.2859493875148171,lossguide,0.0002558881181347285,0.0019136660297809254,6,8,0.34395530971664157,800,forest,0.5834157401421398,0.9389140681339546,none,0.9432470460611619,1.1374527174303064,0.10674729434896418,weighted,0.5124772125373651,0.33318653317943026,0.8065308629337701,0.8021089271089271,0.5834157401421398,0.3373071528751753,0.3152674459794545,0.9389140681339546,0.7714277548393152,0.76049663312451,0.9357976653696498,0.9156378600823045,0.20573139435414883,0.1904150620453573,none,0.9080478813985156,0.9056580849045853,0.9432470460611619,COMPLETE
2333,0.6137146795313577,2025-09-24 00:37:50.948298,2025-09-24 00:37:57.640619,0 days 00:00:06.692321,0.003975339314149945,dart,0.8223126340559265,3.1822925292107334,lossguide,0.05027500506859121,0.028309683708135035,9,4,6.439542028012261,300,forest,0.3797978144856985,0.5077730032337657,none,0.8184279700111017,1.4300718251196354,0.1728197326058937,weighted,0.7520955226068313,0.7361447316421846,0.7733647251509879,0.7704750204750205,0.3797978144856985,0.6224420190995907,0.6137146795313577,0.5077730032337657,0.6640675089118558,0.6513311312440001,0.5175836642087351,0.5137006057109893,0.7805816937553465,0.7620881471972615,none,0.8586521518356677,0.856133740352766,0.8184279700111017,COMPLETE
2334,0.6879063719115734,2025-09-24 00:37:57.790377,2025-09-24 00:37:58.713110,0 days 00:00:00.922733,0.0014204957584603045,gbtree,0.3903973489051745,0.14716018795131836,depthwise,0.00017061677104395786,0.028032943115479953,3,6,0.11293089581050789,400,,0.6848469702299375,0.9942203285659488,undersample,0.7300488514504158,3.7810437906439556,,,,0.5809750108277287,0.7987511516020064,0.8034398034398035,0.6848469702299375,0.6850368471643704,0.6879063719115734,0.9942203285659488,0.8264270409147871,0.8145193630420149,0.5476434426229508,0.5546526867627785,0.9144568006843456,0.9054343175010697,undersample,0.9270200299556605,0.9240655450771833,0.7300488514504158,COMPLETE
2335,0.7029702970297029,2025-09-24 00:37:58.862027,2025-09-24 00:38:35.313135,0 days 00:00:36.451108,0.0008121972619844317,dart,0.7423053865104688,3.211163176265773,depthwise,0.0001467050072034641,0.00956403604338433,1,9,6.454260616700348,700,forest,0.4875286666401715,0.9099455842180758,none,0.9843818703623396,2.278696985119947,0.059130078023216265,weighted,0.7064251790928904,0.6715942343065964,0.8413348346811342,0.8402948402948403,0.4875286666401715,0.7087561067267945,0.7029702970297029,0.9099455842180758,0.8160587238213437,0.8087608297399345,0.6320375335120644,0.6332761578044597,0.806672369546621,0.7899015832263586,none,0.920188402248505,0.9187311743291455,0.9843818703623396,COMPLETE
2336,0.6773830573862724,2025-09-24 00:38:35.461527,2025-09-24 00:38:37.152850,0 days 00:00:01.691323,0.00025617476991404985,gbtree,0.334406626480258,0.902482015255262,lossguide,0.05302050085664104,0.007700089977974718,1,5,0.12139845305584374,700,,0.5081885643126932,0.9284661970979461,none,0.9381223222327448,4.535434246272148,,,,0.8721071952786322,0.7861603029992834,0.7945331695331695,0.5081885643126932,0.6705566945276771,0.6773830573862724,0.9284661970979461,0.805505766183888,0.7993368727610218,0.5311016737446915,0.5424819773429455,0.9093242087254063,0.9015832263585793,none,0.9186226428278457,0.9173318218956577,0.9381223222327448,COMPLETE
2337,0.5886126704089816,2025-09-24 00:38:37.299948,2025-09-24 00:38:49.341128,0 days 00:00:12.041180,0.01574498851372175,dart,0.4361527450785142,2.972666698111867,depthwise,0.006697359784062835,0.0030016862655797357,0,11,0.5295743084886776,400,forest,0.6385100368039432,0.9446164824351679,none,0.78595408930071,2.5522182630803987,0.29540525362500214,weighted,0.5887871835710632,0.915018366528507,0.8424608455317842,0.8424447174447175,0.6385100368039432,0.5968037725962798,0.5886126704089816,0.9446164824351679,0.7439765936836302,0.7359178931145571,0.7701149425287356,0.7841880341880342,0.4871685201026518,0.4711168164313222,none,0.8965883332245481,0.8976721049746672,0.78595408930071,COMPLETE
2338,0.7148330596606459,2025-09-24 00:38:49.492407,2025-09-24 00:38:50.748678,0 days 00:00:01.256271,0.00023164757771107074,gbtree,0.29291207158644317,3.78033254920362,lossguide,0.044449222969777887,0.07850728601403727,3,6,1.316750357272934,700,,0.5940945944791488,0.9286937269263571,none,0.7900208343191603,4.638385265872982,,,,0.6866230493375836,0.8381615313747569,0.839987714987715,0.5940945944791488,0.7128065395095368,0.7148330596606459,0.9286937269263571,0.8246386041885989,0.8200381432264081,0.6195137353962741,0.6230916030534351,0.8391787852865698,0.8382541720154044,none,0.9265353024270393,0.9255670496912776,0.7900208343191603,COMPLETE
2339,0.6729176433817784,2025-09-24 00:38:50.895150,2025-09-24 00:39:44.248490,0 days 00:00:53.353340,0.00025955223430535184,dart,0.4475983862091846,2.5130656448645774,lossguide,0.005155770302758728,0.014358298308232311,3,11,0.11265191810498289,800,forest,0.46684149563059313,0.8775590894739433,oversample,0.9378799038772491,2.867216452866854,0.13810341069373938,weighted,0.6347589079593718,0.32796329738508184,0.7811444364827516,0.7857289107289107,0.46684149563059313,0.6693473553974637,0.6729176433817784,0.8775590894739433,0.8223894620720691,0.8153522835976945,0.5242248062015504,0.5300344657804037,0.9255774165953806,0.9212665810868635,oversample,0.9255045477417045,0.92333383833594,0.9378799038772491,COMPLETE
2340,0.7054461181923523,2025-09-24 00:39:44.393228,2025-09-24 00:40:19.624509,0 days 00:00:35.231281,0.0010521388657313527,dart,0.8699404493982551,9.805836769973572,lossguide,0.0006376607625666609,0.026774497504092325,5,12,0.13784366482153226,700,forest,0.6651215759762342,0.9575553268903855,none,0.909865476201035,2.2005766695382025,0.17674968370663302,weighted,0.799642415815001,0.5855157732723797,0.8722489507626164,0.8698812448812449,0.6651215759762342,0.7129714811407544,0.7054461181923523,0.9575553268903855,0.8256651016530903,0.8178596874771704,0.7711442786069652,0.7694641051567239,0.6629597946963216,0.6512623020967052,none,0.926617495731186,0.9245754710272174,0.909865476201035,COMPLETE
2341,0.6954083420960393,2025-09-24 00:40:19.768467,2025-09-24 00:40:23.748494,0 days 00:00:03.980027,0.0003710457640616696,dart,0.28455162991581173,4.969741089506973,lossguide,0.0009469633730724086,0.459795290110962,0,12,0.31726258931544055,200,forest,0.6971368185932189,0.9537351044950004,oversample,0.9619268033580424,4.5525890609022825,0.08178175039282211,weighted,0.7769017060627619,0.9513974117856566,0.8211690039922203,0.8220720720720721,0.6971368185932189,0.6966487237367599,0.6954083420960393,0.9537351044950004,0.8158745320195969,0.8065285178022537,0.5863782519731073,0.5888987830216682,0.8579982891360137,0.848951647411211,oversample,0.9202887264285662,0.9169376664975454,0.9619268033580424,COMPLETE
2342,0.6754111198120595,2025-09-24 00:40:23.891897,2025-09-24 00:40:24.997262,0 days 00:00:01.105365,0.0003636165162483056,gbtree,0.21777894907690015,7.759362348777854,lossguide,0.032414801585588814,0.002424597399321018,5,4,0.3928696925316792,600,,0.6066209358223851,0.9076143064046067,none,0.913604130963971,4.086152239097882,,,,0.7914534468773502,0.8258777766403931,0.8302620802620803,0.6066209358223851,0.6731988472622479,0.6754111198120595,0.9076143064046067,0.756788647807465,0.7519733969068331,0.6110917335193582,0.6225189462287982,0.7493584260051326,0.7381258023106547,none,0.8968122351525106,0.8973692185767022,0.913604130963971,COMPLETE
2343,0.712430426716141,2025-09-24 00:40:25.141846,2025-09-24 00:40:25.748778,0 days 00:00:00.606932,0.0009935963348969789,gbtree,0.969662633160002,3.2521357062120946,depthwise,0.0003989599908003442,0.2546088391563702,9,7,0.8860341768134821,200,,0.3786577323384939,0.8007329174311535,none,0.8644432744575472,1.4058948216412663,,,,0.9875049532928506,0.8382638959975433,0.8413185913185913,0.3786577323384939,0.7088094360486547,0.712430426716141,0.8007329174311535,0.8218210383785362,0.8201932032339095,0.6227331606217616,0.6288896167703898,0.8224978614200171,0.8215661103979461,none,0.9244794049941527,0.9244283177591566,0.8644432744575472,COMPLETE
2344,0.7147971360381862,2025-09-24 00:40:25.893515,2025-09-24 00:40:26.848929,0 days 00:00:00.955414,0.0010154172978576557,gbtree,0.6374831722452653,8.458893598588478,depthwise,0.00024336926114489486,0.17831661861988526,0,10,0.9708538393247332,600,,0.6906562154948404,0.9903248037281444,none,0.926382418604643,4.614211371024284,,,,0.3320089555545087,0.8506500153546934,0.8531941031941032,0.6906562154948404,0.7145372725494032,0.7147971360381862,0.9903248037281444,0.8124988940058463,0.8025409523680741,0.6584926072845294,0.6677814938684504,0.7810094097519247,0.7689345314505777,none,0.9209450353575105,0.9164689123677674,0.926382418604643,COMPLETE
2345,0.6922519913106444,2025-09-24 00:40:26.993089,2025-09-24 00:40:57.904152,0 days 00:00:30.911063,0.0018868365729244091,dart,0.6442960243149854,0.33662246583708866,lossguide,0.001350206470787284,0.009150143553540917,3,10,0.6233430163481561,600,forest,0.47015606043853136,0.9950675996798053,none,0.9108987118955421,0.8306001580546865,0.20404148691432833,weighted,0.5803079788953592,0.3952433607784391,0.8726584092537619,0.8694717444717445,0.47015606043853136,0.7019645424053665,0.6922519913106444,0.9950675996798053,0.8278093982082805,0.8200344491030112,0.7979302832244008,0.7940199335548173,0.6266039349871685,0.613607188703466,none,0.9267542255589174,0.9241105749561204,0.9108987118955421,COMPLETE
2346,0.7041585865115277,2025-09-24 00:40:58.047907,2025-09-24 00:40:59.168791,0 days 00:00:01.120884,0.00012810179330430255,gbtree,0.29398383566142017,0.8366934314599838,lossguide,0.004982206717101385,0.4017693585170372,3,8,0.5633472756565323,200,,0.6763210749566968,0.959485478087627,none,0.826406219791223,3.8421937884488373,,,,0.8607179474975868,0.8540280479066434,0.8594389844389845,0.6763210749566968,0.6968537414965986,0.7041585865115277,0.959485478087627,0.8070056582118084,0.8018098020032755,0.6927303465765005,0.7092013888888888,0.7010265183917879,0.6991869918699187,none,0.9160091777918298,0.9133409193131942,0.826406219791223,COMPLETE
2347,0.680021085925145,2025-09-24 00:40:59.315747,2025-09-24 00:41:46.965810,0 days 00:00:47.650063,0.00021398822787427842,dart,0.3484271184025369,3.1739722817934526,lossguide,0.034737898696854445,0.021116314250662814,6,8,0.18800499492054382,800,forest,0.44789641354701343,0.9653766964423582,none,0.9560835647001397,2.451285450511513,0.34037367967425636,weighted,0.8893762370279478,0.34100496776602607,0.8085781553894974,0.8135749385749386,0.44789641354701343,0.6745562130177515,0.680021085925145,0.9653766964423582,0.7560550463771516,0.7495259039698405,0.5686619718309859,0.5769230769230769,0.8289136013686912,0.82798459563543,none,0.9014878714800632,0.9024453009334716,0.9560835647001397,COMPLETE
2348,0.6546862896979087,2025-09-24 00:41:47.109771,2025-09-24 00:41:48.462975,0 days 00:00:01.353204,0.0014565625299284585,gbtree,0.4848991957394634,3.4638981441961922,lossguide,0.19507786210510605,0.01812798025676645,5,4,0.4873071257320429,800,,0.5598340931068722,0.8689426658499034,oversample,0.9259019360488334,2.1111486607385355,,,,0.9220186389469526,0.7683488586344559,0.7718058968058968,0.5598340931068722,0.6515781370284834,0.6546862896979087,0.8689426658499034,0.7539445508549723,0.7471659644141724,0.5090209285542459,0.5131131617289947,0.9050470487596236,0.904150620453573,oversample,0.9016658706348766,0.902232647042277,0.9259019360488334,COMPLETE
2349,0.6854203504259765,2025-09-24 00:41:48.608841,2025-09-24 00:41:51.158886,0 days 00:00:02.550045,0.0005662416527379814,gbtree,0.21252047967459722,1.6682830299692317,lossguide,0.15011415862775176,0.029747852453008188,1,7,0.5498168613092518,800,,0.6277362809361423,0.8553933163228118,oversample,0.8141366964755457,3.820277478237188,,,,0.8890611976965472,0.7929163681031836,0.7996519246519247,0.6277362809361423,0.6779175290558829,0.6854203504259765,0.8553933163228118,0.826149521385074,0.8202020859923738,0.5399442049201116,0.548918640576725,0.9106073567151411,0.9122807017543859,oversample,0.9263632605600265,0.9254811934898771,0.8141366964755457,COMPLETE
2350,0.6705417344803534,2025-09-24 00:41:51.304365,2025-09-24 00:41:54.232840,0 days 00:00:02.928475,0.00023429126336559035,gbtree,0.4543575427424889,0.08204362663362197,lossguide,0.07434158059901863,0.20831803665874474,1,7,2.3124750633387805,800,,0.6670933146980638,0.9857935388613415,none,0.8313689981519521,1.870756680131916,,,,0.6605049129266608,0.8554611526256526,0.8549344799344799,0.6670933146980638,0.6708624708624709,0.6705417344803534,0.9857935388613415,0.7911351790575312,0.7867146917032966,0.7371926229508197,0.7342158859470469,0.6154833190761334,0.6170303808301241,none,0.9086190903273331,0.9076534786128517,0.8313689981519521,COMPLETE
2351,0.6764370623676925,2025-09-24 00:41:54.378888,2025-09-24 00:42:25.538031,0 days 00:00:31.159143,0.000180000852156254,dart,0.41450534120399896,0.10799955235062109,lossguide,0.008172248252410407,0.01525251139316457,2,11,4.832477462054319,600,forest,0.6925787461317675,0.9519589658461162,undersample,0.9518264347430694,4.21779625482908,0.1990169574587551,weighted,0.7958112049391322,0.82326331355018,0.7924045449892517,0.7965806715806716,0.6925787461317675,0.67552,0.6764370623676925,0.9519589658461162,0.7975008509399246,0.7886191524322441,0.5396216768916156,0.5460042060988434,0.9029084687767323,0.8887462558836114,undersample,0.9176925001142534,0.9141523784615063,0.9518264347430694,COMPLETE
2352,0.6867727380669675,2025-09-24 00:42:25.684170,2025-09-24 00:42:26.521842,0 days 00:00:00.837672,0.0002434584120497062,gbtree,0.6757570123256448,7.983120083217209,depthwise,0.0007829959186446183,0.2780471618631044,2,9,21.778476133821112,800,,0.5812181726455965,0.9906525256995652,none,0.9870149446029283,1.2743467833656288,,,,0.5820747688002964,0.8683590950967346,0.86496723996724,0.5812181726455965,0.6976962858486131,0.6867727380669675,0.9906525256995652,0.8160656593852378,0.8089795448099,0.7745302713987474,0.7716115261472786,0.6347305389221557,0.6187419768934531,none,0.9221665095899669,0.9202576987417027,0.9870149446029283,COMPLETE
2353,0.7192546583850932,2025-09-24 00:42:26.667066,2025-09-24 00:43:37.559551,0 days 00:01:10.892485,0.08566058159569419,dart,0.7749909942638991,5.776883515420631,depthwise,0.013849912949346429,0.29498904970017575,4,12,0.17373383185055763,1000,forest,0.6541516455163245,0.9206146926827543,none,0.9811018981643062,3.245280874629455,0.08329386509214609,weighted,0.6705298404682096,0.5822996729224648,0.8643668748080663,0.8611793611793612,0.6541516455163245,0.7258431615973515,0.7192546583850932,0.9206146926827543,0.8272223183161327,0.8197236760050497,0.7030060120240481,0.6967509025270758,0.7502138579982891,0.7432605905006419,none,0.9274179595132359,0.9250878154617977,0.9811018981643062,COMPLETE
2354,0.6671081677704195,2025-09-24 00:43:37.708325,2025-09-24 00:43:44.745930,0 days 00:00:07.037605,0.0003434909619057472,dart,0.4815213805498323,2.349089199555789,lossguide,0.04444272123073663,0.26982342530918696,1,6,0.47586721763871764,300,tree,0.6382190964856942,0.9226575914707889,none,0.9664092961633256,2.243030101524507,0.15541608554068892,weighted,0.876097939222967,0.8053930886448987,0.8428703040229297,0.8456183456183456,0.6382190964856942,0.6683949017066321,0.6671081677704195,0.9226575914707889,0.7508468303549548,0.744907791053824,0.6752509821038848,0.6890104879160966,0.6616766467065869,0.6465554129225503,none,0.8998455882513766,0.9001299186865186,0.9664092961633256,COMPLETE
2355,0.7159713442899284,2025-09-24 00:43:44.889080,2025-09-24 00:44:32.777747,0 days 00:00:47.888667,0.08299621528731978,dart,0.8549200776352933,6.878400674047443,depthwise,0.0005740347267593482,0.016088082812641118,4,12,0.36602591320565786,800,forest,0.6802118164604243,0.8177040092089973,none,0.987671248564989,3.641309796224161,0.14666522374505955,weighted,0.8956949870325086,0.44624907645413925,0.8602722898966118,0.861998361998362,0.6802118164604243,0.7166286070168154,0.7159713442899284,0.8177040092089973,0.8134247608867635,0.8100697641010515,0.6962484872932634,0.705271897052719,0.7382378100940975,0.7270004278990159,none,0.9197873357616042,0.9195938535251744,0.987671248564989,COMPLETE
2356,0.6223329699423765,2025-09-24 00:44:32.922552,2025-09-24 00:44:33.810903,0 days 00:00:00.888351,0.19168050953957175,gbtree,0.7949314713420013,5.254300659823564,lossguide,14.228544194462833,0.0022621992398315595,8,4,42.214076281799656,400,,0.5501668131083616,0.6015339685681077,oversample,0.8101012468048551,1.166374473340309,,,,0.44391840774147845,0.7542225406899375,0.7517403767403767,0.5501668131083616,0.6306722042762651,0.6223329699423765,0.6015339685681077,0.6980538535239046,0.6911793983363279,0.4924333413403795,0.4892262487757101,0.8768177929854577,0.8549422336328626,oversample,0.8802064536939156,0.8742570573826342,0.8101012468048551,COMPLETE
2357,0.7221195317313617,2025-09-24 00:44:33.958164,2025-09-24 00:44:34.902394,0 days 00:00:00.944230,0.7160515296406396,gbtree,0.45469860394345685,3.932351259698472,lossguide,0.0021338311431181476,0.36017152636424776,1,11,0.16000730012703457,600,,0.6556814167519892,0.908544249761346,none,0.9910071031798227,3.2032052732128475,,,,0.8510722502516596,0.8582249974408844,0.8614864864864865,0.6556814167519892,0.7158974358974359,0.7221195317313617,0.908544249761346,0.822099385089238,0.8163984733324194,0.6878202601497833,0.6943127962085308,0.7463644140290847,0.7522464698331194,none,0.9252548308999395,0.9227249848513615,0.9910071031798227,COMPLETE
2358,0.6434731764361935,2025-09-24 00:44:35.049920,2025-09-24 00:45:30.737701,0 days 00:00:55.687781,0.0013978017156006423,dart,0.37385300960996287,3.9606411219087967,depthwise,0.00011014018582490147,0.008630832475053257,5,11,0.12620200609675963,900,forest,0.4162509024910178,0.7678951205600817,undersample,0.8884442667747516,1.5997002949370522,0.1626318609951,weighted,0.7068104219574673,0.2999744940539766,0.7419387859555737,0.7503071253071253,0.4162509024910178,0.6352192157430184,0.6434731764361935,0.7678951205600817,0.8033358310365764,0.7980036427133312,0.4799912530067789,0.48867673179396093,0.938836612489307,0.9418057338468121,undersample,0.9164691552358688,0.9150214205752112,0.8884442667747516,COMPLETE
2359,0.7068607068607069,2025-09-24 00:45:30.882977,2025-09-24 00:45:34.439364,0 days 00:00:03.556387,0.0005071339944277004,dart,0.8624479935355059,7.6803245509430305,depthwise,0.2879890016035761,0.0341727021579434,1,7,6.018552347688174,200,forest,0.690703101847892,0.9950566927843405,none,0.9850948940208705,2.6788327687335984,0.09934975415919665,weighted,0.5508244019844108,0.9442708460140802,0.8712253045347528,0.870085995085995,0.690703101847892,0.7105384261389783,0.7068607068607069,0.9950566927843405,0.8227024984694703,0.8143472970173071,0.7689243027888446,0.7680722891566265,0.660393498716852,0.6546854942233633,none,0.9249995021203916,0.9228953440544754,0.9850948940208705,COMPLETE
