number,value,datetime_start,datetime_complete,duration,params_alpha,params_booster,params_colsample_bytree,params_gamma,params_grow_policy,params_lambda,params_learning_rate,params_max_delta_step,params_max_depth,params_min_child_weight,params_n_estimators,params_normalize_type,params_params_decision_threshold,params_params_feature_fraction,params_params_resampling,params_params_sample_rows,params_params_scale_pos_weight,params_rate_drop,params_sample_type,params_skip_drop,params_subsample,user_attrs_acc_test,user_attrs_acc_val,user_attrs_decision_threshold,user_attrs_f1_test,user_attrs_f1_val,user_attrs_feature_fraction,user_attrs_pr_auc_test,user_attrs_pr_auc_val,user_attrs_prec_test,user_attrs_prec_val,user_attrs_rec_test,user_attrs_rec_val,user_attrs_resampling_strategy,user_attrs_roc_auc_test,user_attrs_roc_auc_val,user_attrs_sample_rows,state
2112,0.7130730050933786,2025-09-23 23:41:24.960583,2025-09-23 23:41:26.020795,0 days 00:00:01.060212,0.00013743983149665728,gbtree,0.4943770121474235,1.9658034491046879,lossguide,0.00024257489256996885,0.2313097060270554,0,7,0.22999833429084518,200,,0.6555873243970108,0.9539412687794129,none,0.9739040991295709,3.0999204406281455,,,,0.6495439256247069,0.8628314054662709,0.8615888615888616,0.6555873243970108,0.7148936170212766,0.7130730050933786,0.9539412687794129,0.815278001939358,0.8088309987739072,0.7112616426756986,0.7073684210526315,0.718562874251497,0.7188703465982028,none,0.9212693190238704,0.9189010728685363,0.9739040991295709,COMPLETE
2113,0.6356125356125356,2025-09-23 23:41:26.164479,2025-09-23 23:42:12.724590,0 days 00:00:46.560111,0.20773961938194266,dart,0.4995898186158605,0.2829490651524002,lossguide,0.0033122057393004103,0.05223572406475765,7,8,0.424430440719716,800,forest,0.4397935877157642,0.9402030663698602,oversample,0.8357785219754437,3.769625629413565,0.29506704769940734,weighted,0.658342415645843,0.32131755989282124,0.7369229194390419,0.7381244881244882,0.4397935877157642,0.6344238975817923,0.6356125356125356,0.9402030663698602,0.8217646601023029,0.8132515325831842,0.4752770673486786,0.47640401452060643,0.9538066723695466,0.9546427043217801,oversample,0.9251346490938763,0.9224447285587958,0.8357785219754437,COMPLETE
2114,0.7047663118926423,2025-09-23 23:42:12.866265,2025-09-23 23:42:16.393733,0 days 00:00:03.527468,0.000938398785794025,gbtree,0.2653845240621986,1.9118655937786966,lossguide,0.024355898505558554,0.03574459715942482,0,11,0.16488696095291522,700,,0.693023796033562,0.9912352434533074,none,0.7967188751853328,2.6420678482572506,,,,0.5782422363835286,0.8699969290613164,0.8693693693693694,0.693023796033562,0.7091158955565735,0.7047663118926423,0.9912352434533074,0.825576266690239,0.8224444255926383,0.7633136094674556,0.7672544080604534,0.6621043627031651,0.6516902011125374,none,0.9264181999919648,0.9247974821502886,0.7967188751853328,COMPLETE
2115,0.6924107142857143,2025-09-23 23:42:16.539031,2025-09-23 23:42:17.249663,0 days 00:00:00.710632,0.00019199167173300404,gbtree,0.9331246615063565,0.1664149264216248,depthwise,0.00015795896197179644,0.09082051522007488,10,4,0.1275691255127951,300,,0.3581157320987278,0.8639456741590236,none,0.9965376660075691,0.6955191570812853,,,,0.989414224827955,0.8647763332992118,0.8589271089271089,0.3581157320987278,0.711004156639685,0.6924107142857143,0.8639456741590236,0.8028250542391344,0.7937051870890989,0.7277205553067622,0.7237517498833411,0.695038494439692,0.6636713735558408,none,0.9174252279799362,0.9127407032734246,0.9965376660075691,COMPLETE
2116,0.7243897350302525,2025-09-23 23:42:17.394786,2025-09-23 23:42:20.133247,0 days 00:00:02.738461,0.016535544810104722,gbtree,0.32086900984147243,1.7611679159674496,lossguide,0.0006427279314233126,0.04948115366638553,1,10,0.2903784744635606,400,,0.6821464400622063,0.9296356060467951,none,0.8655534127152419,3.932452387082847,,,,0.7341633186678213,0.8626266762206981,0.8647624897624898,0.6821464400622063,0.7230705736690054,0.7243897350302525,0.9296356060467951,0.8263865684340594,0.8201509013090875,0.6985645933014354,0.7068403908794788,0.7493584260051326,0.7428326914848096,none,0.9268269792959212,0.9254078040004844,0.8655534127152419,COMPLETE
2117,0.7152682255845942,2025-09-23 23:42:20.280055,2025-09-23 23:43:30.500327,0 days 00:01:10.220272,1.0832924433402855,dart,0.23058588447071296,1.835338602557842,lossguide,0.0003051863334839856,0.048789265517995,4,10,0.34416270541213584,1000,forest,0.41463715393967776,0.8028409850960782,none,0.8286458018901386,1.421229045290846,0.1485908053361623,weighted,0.7191011910508387,0.27078703734014303,0.8532091309243526,0.8516584766584766,0.41463715393967776,0.7189337514700117,0.7152682255845942,0.8028409850960782,0.8226190742323393,0.8164842320077337,0.6635311143270622,0.6613372093023255,0.7844311377245509,0.7787762088147198,none,0.9254358518674055,0.923448140522244,0.8286458018901386,COMPLETE
2118,0.6975828111011638,2025-09-23 23:43:30.641186,2025-09-23 23:43:33.737637,0 days 00:00:03.096451,0.006669087245023134,gbtree,0.2639493960739928,3.6732527092788585,lossguide,0.00020063048197653616,0.005752587415789137,0,8,0.1601325393433584,500,,0.634587486893939,0.9934468220927647,none,0.7883980269354545,4.909584552858493,,,,0.8233614056597276,0.8253659535264612,0.827088452088452,0.634587486893939,0.6967650195520796,0.6975828111011638,0.9934468220927647,0.7936340978953198,0.7855783487922885,0.5961070559610706,0.5997536945812808,0.8383233532934131,0.8335472828412495,none,0.9159504107305316,0.9147704452205476,0.7883980269354545,COMPLETE
2119,0.6958591147072822,2025-09-23 23:43:33.882605,2025-09-23 23:44:34.705236,0 days 00:01:00.822631,1.2630961618656507,dart,0.30861286605801275,0.15456157112207425,depthwise,0.0003456155387328497,0.004860761822496554,8,11,1.0540136325050022,900,forest,0.6096996273474722,0.9791510127412852,none,0.9267326579452791,1.8267467247741578,0.14070641327425235,weighted,0.5625095366270454,0.49497612071718056,0.8695874705701709,0.8691646191646192,0.6096996273474722,0.6992445703493863,0.6958591147072822,0.9791510127412852,0.8157119687908247,0.8086544170869504,0.7802950474183351,0.7839142091152815,0.6334473909324209,0.6255883611467694,none,0.9226496830435098,0.9213266977027333,0.9267326579452791,COMPLETE
2120,0.6745457752690068,2025-09-23 23:44:34.848684,2025-09-23 23:44:38.522313,0 days 00:00:03.673629,2.2356283177980085,gbtree,0.22559075153902483,0.15712636631213783,lossguide,0.01020210666426698,0.08056162075921243,2,12,0.666040062235545,600,,0.6969597855632217,0.9015797850703912,oversample,0.7754125591736285,2.808780636679718,,,,0.37179698830389946,0.8032551950046064,0.8111179361179361,0.6969597855632217,0.663986013986014,0.6745457752690068,0.9015797850703912,0.734326843174608,0.7375120107423306,0.5615020697811945,0.5738295318127251,0.8122326775021386,0.8181429182712879,oversample,0.892626132474655,0.8963021198535297,0.7754125591736285,COMPLETE
2121,0.7106495622072898,2025-09-23 23:44:38.665772,2025-09-23 23:44:41.952789,0 days 00:00:03.287017,0.04233984254383942,gbtree,0.4436726102161935,0.1529841215959471,lossguide,0.00016556008645259894,0.10887298239698877,1,9,0.5476783629189317,500,,0.65128734852084,0.9484446535141734,none,0.7915116458102269,4.24501874096955,,,,0.7359332951662838,0.8533114955471389,0.8545249795249795,0.65128734852084,0.7080871867997556,0.7106495622072898,0.9484446535141734,0.8112376035834945,0.8066641182266512,0.676001555814858,0.677933177933178,0.7433704020530368,0.7466837826273,none,0.9189014266294103,0.9175955230856729,0.7915116458102269,COMPLETE
2122,0.7167802385008518,2025-09-23 23:44:42.099496,2025-09-23 23:44:43.061205,0 days 00:00:00.961709,0.020686214726314687,gbtree,0.20813885955438705,3.1034055436930466,lossguide,0.0005877176129743261,0.14945534966519444,0,8,0.44169159952015585,300,,0.6898011312964991,0.9752232619594761,none,0.8725884328164333,3.4829611198439294,,,,0.6985207990990263,0.8650834271675709,0.8638411138411138,0.6898011312964991,0.7218235542422963,0.7167802385008518,0.9752232619594761,0.825875756042759,0.8177207351101956,0.7125,0.7134378974141585,0.7313943541488451,0.7201540436456996,none,0.9267746012099454,0.9245202777548887,0.8725884328164333,COMPLETE
2123,0.6457649376231123,2025-09-23 23:44:43.203982,2025-09-23 23:44:44.097383,0 days 00:00:00.893401,0.39080061799832844,gbtree,0.33895328030220334,4.272471656516787,lossguide,0.00017193217158753763,0.43278720412244903,3,10,0.10822551369259478,500,,0.6819176918946185,0.8518567700208574,oversample,0.8076015769527946,4.213178140342852,,,,0.6332670011092155,0.7703961510901832,0.7790745290745291,0.6819176918946185,0.6349877949552482,0.6457649376231123,0.8518567700208574,0.7104796471086721,0.7037088859691957,0.5124770160231154,0.5238348868175766,0.8344739093242087,0.8416773641420625,oversample,0.8769483352920434,0.8791912553126765,0.8076015769527946,COMPLETE
2124,0.3804310639753678,2025-09-23 23:44:44.240572,2025-09-23 23:45:34.997675,0 days 00:00:50.757103,0.8153791996541784,dart,0.3312689814160172,0.3293977258148988,lossguide,0.027917661902180885,0.0016340161016084936,6,10,4.810578383880326,800,forest,0.5947994269097502,0.9851222382365852,none,0.9279409719964492,1.1243030167410157,0.13382338239713787,weighted,0.7132249444818951,0.7642318898114795,0.8183027945542021,0.8145986895986896,0.5947994269097502,0.39769256871394637,0.3804310639753678,0.9851222382365852,0.7991458670187583,0.7905686620757213,0.9622331691297209,0.9488054607508533,0.2506415739948674,0.23791185280273855,none,0.9165395203019189,0.9145090473491481,0.9279409719964492,COMPLETE
2125,0.6833954126641835,2025-09-23 23:45:35.139772,2025-09-23 23:45:38.978125,0 days 00:00:03.838353,0.00010377650537186525,gbtree,0.410006117498154,0.8085035492559997,lossguide,0.0009482394466046261,0.06300145597149008,0,10,0.1766878201059507,300,,0.6981470887436577,0.8647961335121239,oversample,0.9599859786136044,2.295324721303836,,,,0.687106264084286,0.8242399426758112,0.8346642096642096,0.6981470887436577,0.6656280428432327,0.6833954126641835,0.8647961335121239,0.7393117309317212,0.7383417647972245,0.6110117983553808,0.6306078147612156,0.7309666381522669,0.7458279845956355,oversample,0.8935206753572846,0.8966580977455867,0.9599859786136044,COMPLETE
2126,0.7168968318440292,2025-09-23 23:45:39.122910,2025-09-23 23:45:52.708842,0 days 00:00:13.585932,0.0001387682517409431,dart,0.5556069184698211,2.8203120018345547,lossguide,0.0034242280427250454,0.15141873479738324,4,12,4.318071720910107,400,forest,0.5096266034462673,0.9508633878151093,none,0.9561704788834541,1.85985211128875,0.25555137409556883,weighted,0.6765191303023306,0.9084175983062338,0.8585320913092436,0.8572891072891073,0.5096266034462673,0.7209208400646203,0.7168968318440292,0.9508633878151093,0.8225995832485388,0.8168332191986971,0.6828615149196634,0.682257441051411,0.7634730538922155,0.7552417629439452,none,0.9250737235949695,0.9233828126480063,0.9561704788834541,COMPLETE
2127,0.7160971416290566,2025-09-23 23:45:52.852130,2025-09-23 23:47:03.945185,0 days 00:01:11.093055,0.1629087994160655,dart,0.4189707585664042,0.7068930744330875,lossguide,0.0005859060019005973,0.0051990615345595325,6,7,1.251506210353645,1000,forest,0.5208860053020483,0.9457788996612834,none,0.9429926906717001,1.658260279966506,0.23084679627811155,weighted,0.6505851136741243,0.5008528971556929,0.8662094380182209,0.8647624897624898,0.5208860053020483,0.7189851644807568,0.7160971416290566,0.9457788996612834,0.8205902979812962,0.8132767958111136,0.7228707306528318,0.7193436960276338,0.7151411462788708,0.7128797603765511,none,0.923952573542574,0.9220256109451858,0.9429926906717001,COMPLETE
2128,0.7035739313244569,2025-09-23 23:47:04.088350,2025-09-23 23:47:39.373474,0 days 00:00:35.285124,0.027484816837284494,dart,0.2824985777682692,1.0976807787128648,lossguide,0.00010680562884340013,0.019252942278573566,2,7,4.860697951165233,700,forest,0.5179816771643224,0.9652018831840963,none,0.9257282523416119,1.1706619214462082,0.1411269800305615,weighted,0.6994336159204143,0.28228044933606844,0.8708158460436073,0.870085995085995,0.5179816771643224,0.7073283858998145,0.7035739313244569,0.9652018831840963,0.8215028304016196,0.8130546415263032,0.7725430597771024,0.7746913580246914,0.6522668947818648,0.6444159178433889,none,0.9241895412128623,0.922165422385159,0.9257282523416119,COMPLETE
2129,0.7035921205098493,2025-09-23 23:47:39.517234,2025-09-23 23:47:40.493754,0 days 00:00:00.976520,0.00383375398074068,gbtree,0.2832527092102893,1.1057143154885065,depthwise,0.00015760502587433981,0.09810374690528136,0,7,0.14134282970283188,400,,0.6508958062683391,0.9798133880978347,none,0.9812209107913341,1.96269258629336,,,,0.5668114797733116,0.8699969290613164,0.8690622440622441,0.6508958062683391,0.7061545580749653,0.7035921205098493,0.9798133880978347,0.8249099423614699,0.8193079872200505,0.7691532258064516,0.7674418604651163,0.6526946107784432,0.6495507060333762,none,0.926366512606024,0.9244323197752514,0.9812209107913341,COMPLETE
2130,0.7117546199276052,2025-09-23 23:47:40.642331,2025-09-23 23:47:41.401832,0 days 00:00:00.759501,0.0003112789424982668,gbtree,0.25119857594762873,0.6396196040459304,lossguide,0.0001695705623008599,0.4197646665250995,4,4,3.4805929746105613,300,,0.5865066194107147,0.9897831287481385,none,0.9683543022116224,3.712145227076804,,,,0.6475098135820452,0.8418466577950661,0.8451064701064701,0.5865066194107147,0.7105115233277122,0.7117546199276052,0.9897831287481385,0.8143018674825211,0.8104550386961942,0.6322107369123041,0.6414835164835165,0.8109495295124037,0.7993153615746684,none,0.921799517638119,0.9195334489944775,0.9683543022116224,COMPLETE
2131,0.7119529719137818,2025-09-23 23:47:41.544766,2025-09-23 23:47:43.773709,0 days 00:00:02.228943,0.00014651598589141807,gbtree,0.2704007675142542,3.6210586887539224,lossguide,0.0009063289262325557,0.011792570095668933,0,9,5.764791619770982,500,,0.6854634277995472,0.9378955598531082,none,0.903982594219418,3.2177113441924226,,,,0.6372521581800915,0.8656976149042891,0.8645577395577395,0.6854634277995472,0.7156480277416558,0.7119529719137818,0.9378955598531082,0.8150998070829976,0.8089120968818693,0.7253954305799648,0.7247340425531915,0.7061591103507271,0.699614890885751,none,0.9232178701596748,0.9216837984626155,0.903982594219418,COMPLETE
2132,0.711197046932677,2025-09-23 23:47:43.917868,2025-09-23 23:48:02.325205,0 days 00:00:18.407337,0.00047400020087283885,dart,0.4330330537123526,2.3691684700069864,lossguide,0.00849753358205035,0.055615734422059186,1,5,0.11362370555462037,500,forest,0.6746165386857034,0.911404441563782,oversample,0.9751292675505583,2.310505809967668,0.10510935136054714,weighted,0.7300470999157121,0.7088892482864244,0.8256730473948204,0.8317977067977068,0.6746165386857034,0.7053123377747015,0.711197046932677,0.911404441563782,0.8257026890428412,0.820874175454593,0.5922696890438826,0.6035202863961814,0.8716852010265184,0.8656397090286693,oversample,0.9269894952582866,0.9257101433602781,0.9751292675505583,COMPLETE
2133,0.6906213944288775,2025-09-23 23:48:02.469986,2025-09-23 23:48:03.689834,0 days 00:00:01.219848,0.000757634045527258,gbtree,0.41734396716670874,0.7639658855023796,lossguide,0.0012016037183049985,0.02740131657065645,0,6,0.21342151464057482,300,,0.6314106499287387,0.886191916266263,undersample,0.9205378281701047,2.4512017499575194,,,,0.6974224158692145,0.8038693827413246,0.8078419328419328,0.6314106499287387,0.6874388254486133,0.6906213944288775,0.886191916266263,0.8224170078666245,0.8131443895969108,0.5556434599156118,0.561662198391421,0.9011976047904192,0.8964484381685922,undersample,0.9259201189293369,0.9232591820213083,0.9205378281701047,COMPLETE
2134,0.7201283079390537,2025-09-23 23:48:03.837044,2025-09-23 23:48:15.989764,0 days 00:00:12.152720,0.00011597989456840994,dart,0.47363797112316236,0.6657089130385245,lossguide,0.00014490722553260594,0.12227734244473262,0,6,0.18047636316024096,400,forest,0.656701245608717,0.9365345449240927,none,0.9089080820257498,3.765197250029322,0.12509617670948608,weighted,0.6029877413020599,0.6034241165367976,0.8580202681953117,0.857084357084357,0.656701245608717,0.7225445089017803,0.7201283079390537,0.9365345449240927,0.8302513855786404,0.8224425298909184,0.6786922209695603,0.6774801961523953,0.7724550898203593,0.7685066324347454,none,0.9283691397987229,0.9259531434742346,0.9089080820257498,COMPLETE
2135,0.6838379866299646,2025-09-23 23:48:16.132275,2025-09-23 23:48:22.542580,0 days 00:00:06.410305,0.004338273915042257,gbtree,0.3883176488256987,1.7925879447490831,lossguide,0.00017108004597285014,0.023712212949392738,1,12,0.16501490589178325,400,,0.661338836203336,0.9057213316653072,none,0.9236791360077303,4.345077584102674,,,,0.9336462116568303,0.8301770907974204,0.8353808353808354,0.661338836203336,0.6766712141882674,0.6838379866299646,0.9057213316653072,0.7540620246796205,0.7487630351934751,0.6215538847117794,0.6325936704256093,0.7425149700598802,0.7441163885323063,none,0.9001031618060379,0.9014588471533314,0.9236791360077303,COMPLETE
2136,0.6959798994974874,2025-09-23 23:48:22.687775,2025-09-23 23:48:24.523471,0 days 00:00:01.835696,0.0011455748756050632,gbtree,0.29023355714395327,1.4684659427120972,lossguide,0.0020886916184890947,0.2679804416011075,2,11,2.4795203394835146,300,,0.675920606026694,0.961281406178426,none,0.9825227481046134,4.443598037192008,,,,0.5598075488440568,0.8526973078104207,0.8513513513513513,0.675920606026694,0.69901694206233,0.6959798994974874,0.961281406178426,0.7977754308916292,0.7886103668706521,0.6839950880065493,0.6814268142681427,0.7147134302822925,0.711168164313222,none,0.9129140645981813,0.9081963996020557,0.9825227481046134,COMPLETE
2137,0.6703042328042328,2025-09-23 23:48:24.664893,2025-09-23 23:48:30.790436,0 days 00:00:06.125543,0.00030189619457564836,gbtree,0.28977002626704224,0.11535141179589903,lossguide,0.2653485759069252,0.0032914415796896387,2,10,0.1735149979966898,400,,0.6819305774951991,0.9944737870003427,oversample,0.83017957309364,2.629744812128542,,,,0.43328379656233856,0.7919950864981062,0.7958640458640459,0.6819305774951991,0.6688396349413298,0.6703042328042328,0.9944737870003427,0.7731046519269117,0.7645229760559568,0.5402843601895735,0.5462139585017516,0.8776732249786142,0.8673513050919983,oversample,0.9081665666878365,0.9072363188200651,0.83017957309364,COMPLETE
2138,0.7097353073126963,2025-09-23 23:48:30.939585,2025-09-23 23:48:33.805929,0 days 00:00:02.866344,0.032855168183011506,gbtree,0.5070689761627791,0.11369965917142111,lossguide,0.0003260182838078375,0.0616656074654979,3,7,0.11307231661574627,600,,0.5414302411099863,0.9313503985627994,none,0.8392974677787564,1.4007974155063596,,,,0.3759521454014434,0.8664141672637936,0.8675266175266175,0.5414302411099863,0.7086403215003348,0.7097353073126963,0.9313503985627994,0.8163945932558803,0.8122036219880779,0.7412424100887436,0.7458745874587459,0.6787852865697177,0.676936243046641,none,0.9221084332287037,0.920277017826592,0.8392974677787564,COMPLETE
2139,0.7012830793905372,2025-09-23 23:48:33.949010,2025-09-23 23:48:34.914770,0 days 00:00:00.965760,0.0002766917666333112,gbtree,0.40272676914345956,1.6293465843467456,depthwise,0.0016039131852472826,0.22944026947905813,2,7,0.25997292657255816,400,,0.608282019203699,0.9693187902133235,none,0.7557910796474991,4.6503237765007315,,,,0.5791776667777013,0.8468625243115979,0.8474610974610974,0.608282019203699,0.7019920318725099,0.7012830793905372,0.9693187902133235,0.7993354700414645,0.7963801799976975,0.656972408650261,0.6597510373443983,0.7536355859709153,0.748395378690629,none,0.9137494087319911,0.9116486135432716,0.7557910796474991,COMPLETE
2140,0.7255774528501802,2025-09-23 23:48:35.058274,2025-09-23 23:48:37.441288,0 days 00:00:02.383014,0.00010503763189115144,gbtree,0.30626705822415806,3.2734366376999713,lossguide,0.010940272409037548,0.024036989530253773,1,8,0.2665022576415351,700,,0.6667327941360368,0.9834205623275954,none,0.9177817272323209,3.294244714202593,,,,0.7583728907341296,0.8666188965093664,0.8674242424242424,0.6667327941360368,0.7265477439664219,0.7255774528501802,0.9834205623275954,0.8301237581856669,0.8240857494045777,0.7132262051915945,0.7187237615449202,0.7403763900769889,0.7325631151048353,none,0.9287100866034239,0.9271593050588306,0.9177817272323209,COMPLETE
2141,0.6400701446733889,2025-09-23 23:48:37.588063,2025-09-23 23:49:01.246750,0 days 00:00:23.658687,0.0003527746698185262,dart,0.842924093266235,6.795047571191834,depthwise,0.003759711220210636,0.041584094018848314,0,9,41.96865151435965,600,forest,0.561085024241347,0.8670913392397767,oversample,0.8946904582559201,3.6566929330663487,0.24490584318547437,weighted,0.3979535427573916,0.7052133854946986,0.7422458798239329,0.7478501228501229,0.561085024241347,0.6351782092147203,0.6400701446733889,0.8670913392397767,0.8044267583790372,0.7950592797527971,0.4802804557405784,0.48601864181091875,0.9375534644995723,0.9370988446726572,oversample,0.9168829708942459,0.9137338078860676,0.8946904582559201,COMPLETE
2142,0.6565579984836998,2025-09-23 23:49:01.389198,2025-09-23 23:49:03.546214,0 days 00:00:02.157016,0.00016919308637981432,gbtree,0.4318358970533156,2.4701715548850656,lossguide,0.0035411143449959573,0.017081696384017672,3,8,0.1688205328276336,500,,0.6226955947421634,0.9804299318775422,undersample,0.8389234022510379,4.472756223303562,,,,0.41323075583874685,0.7646637322141467,0.7681203931203932,0.6226955947421634,0.6536085580834714,0.6565579984836998,0.9804299318775422,0.8090900879497094,0.8025746444419762,0.5045359385903698,0.50845467355566,0.927715996578272,0.9264013692768507,undersample,0.9180197480349296,0.9173253150205682,0.8389234022510379,COMPLETE
