number,value,datetime_start,datetime_complete,duration,params_alpha,params_booster,params_colsample_bytree,params_gamma,params_grow_policy,params_lambda,params_learning_rate,params_max_delta_step,params_max_depth,params_min_child_weight,params_n_estimators,params_normalize_type,params_params_decision_threshold,params_params_feature_fraction,params_params_resampling,params_params_sample_rows,params_params_scale_pos_weight,params_rate_drop,params_sample_type,params_skip_drop,params_subsample,user_attrs_acc_test,user_attrs_acc_val,user_attrs_decision_threshold,user_attrs_f1_test,user_attrs_f1_val,user_attrs_feature_fraction,user_attrs_pr_auc_test,user_attrs_pr_auc_val,user_attrs_prec_test,user_attrs_prec_val,user_attrs_rec_test,user_attrs_rec_val,user_attrs_resampling_strategy,user_attrs_roc_auc_test,user_attrs_roc_auc_val,user_attrs_sample_rows,state
2422,0.6974753958065897,2025-09-24 01:00:15.740448,2025-09-24 01:00:16.445750,0 days 00:00:00.705302,0.00034331836258414853,gbtree,0.3723873607088188,1.6438344536879692,depthwise,0.000163155508165997,0.4112057341114256,5,7,0.38300425887826456,200,,0.6719375810601488,0.8853691715106804,none,0.9053781164678674,3.230843515500876,,,,0.794281998496379,0.8520831200737026,0.8552416052416052,0.6719375810601488,0.6907768029103359,0.6974753958065897,0.8853691715106804,0.7945710174865708,0.7990649705325752,0.691220556745182,0.6974753958065897,0.6903336184773311,0.6974753958065897,none,0.9089197750758359,0.9122526876417225,0.9053781164678674,COMPLETE
2423,0.7090014966859097,2025-09-24 01:00:16.594096,2025-09-24 01:00:17.361518,0 days 00:00:00.767422,0.10102837114710704,gbtree,0.42432006538940586,3.83149304512933,lossguide,0.0017726095050648889,0.22755528580660914,1,4,0.5734736736571627,500,,0.6206740271079589,0.9551610188132333,none,0.9951951177678726,2.296499498661015,,,,0.8777966855961881,0.8623195823523391,0.8606674856674856,0.6206740271079589,0.71570492496301,0.7090014966859097,0.9551610188132333,0.8067460675586855,0.797258584012063,0.7074801504387798,0.7085470085470086,0.7241231822070145,0.709456568249893,none,0.9206720649479057,0.9176248903980233,0.9951951177678726,COMPLETE
2424,0.677739664199314,2025-09-24 01:00:17.508400,2025-09-24 01:00:51.078201,0 days 00:00:33.569801,0.00020894682022371499,dart,0.5966709055417625,0.3479712423169148,lossguide,0.0013189810535495768,0.028314648436100657,2,10,1.1448600784910394,600,forest,0.6862575119617901,0.9362217105403474,oversample,0.9287619921231877,3.5018021776107764,0.16761019030223498,weighted,0.8974402158240442,0.4785812431132151,0.8131845634148838,0.8172604422604423,0.6862575119617901,0.6715853877991722,0.677739664199314,0.9362217105403474,0.7507691044985103,0.745242085790186,0.5796831314072693,0.5861961274203623,0.7981180496150556,0.8031664527171587,oversample,0.8980174779341484,0.898899111592735,0.9287619921231877,COMPLETE
2425,0.7075773745997865,2025-09-24 01:00:51.226763,2025-09-24 01:00:53.218777,0 days 00:00:01.992014,0.00021701000533499472,gbtree,0.3967088728228118,1.9515599953039284,lossguide,0.00015484328220331743,0.013331566716003133,3,8,1.674647816832134,300,,0.6066649460218739,0.9102875979249493,none,0.8937342798663035,4.695961678401553,,,,0.7035658906697355,0.8276179752277613,0.8316953316953317,0.6066649460218739,0.7047685834502104,0.7075773745997865,0.9102875979249493,0.8135241778389701,0.8054451863741914,0.5971479500891266,0.6054794520547945,0.8597091531223268,0.8510911424903723,none,0.9230274096250662,0.9212187872255877,0.8937342798663035,COMPLETE
2426,0.6780669144981413,2025-09-24 01:00:53.364335,2025-09-24 01:01:00.566288,0 days 00:00:07.201953,0.005179002439829343,dart,0.32572195021472644,6.250860329967946,lossguide,0.0006153332203852589,0.040288251367805374,2,12,2.0227869220721804,300,forest,0.6676515687778846,0.9118813999041206,none,0.778984678146453,1.913531803676556,0.17249571236524078,weighted,0.36449689291100124,0.9517665834321657,0.8686661889650936,0.867014742014742,0.6676515687778846,0.6842234801870539,0.6780669144981413,0.9118813999041206,0.822530244632877,0.8153589978604627,0.8057971014492754,0.8056537102473498,0.5945252352437981,0.5853658536585366,none,0.925492287816086,0.9235347740936772,0.778984678146453,COMPLETE
2427,0.6422110552763819,2025-09-24 01:01:00.710366,2025-09-24 01:01:02.126471,0 days 00:00:01.416105,0.0003741312834313048,gbtree,0.40694271995218373,5.495495080329578,lossguide,0.0019102287594140316,0.0028658765193006505,0,6,0.8558431646811079,300,,0.6891014575230885,0.9745054519510088,none,0.9813755193978664,4.488976488350018,,,,0.9049847920425483,0.8562800696079435,0.8542178542178542,0.6891014575230885,0.6497005988023952,0.6422110552763819,0.9745054519510088,0.7740895668466277,0.7697275699000259,0.7796407185628742,0.7778454047474133,0.5568862275449101,0.5468549422336328,none,0.9076956819390805,0.906502020845379,0.9813755193978664,COMPLETE
2428,0.723037776472891,2025-09-24 01:01:02.270498,2025-09-24 01:01:35.466465,0 days 00:00:33.195967,0.006527047761111664,dart,0.48659791517675843,0.24949024471688763,lossguide,0.0008282072053265009,0.027478026014021054,1,12,2.3925707697074525,600,forest,0.6319267738462394,0.95549367218234,none,0.9099806348200071,4.519963196404764,0.09648802065862731,weighted,0.6208875831204206,0.5661836810189764,0.8510594738458389,0.8551392301392301,0.6319267738462394,0.7169811320754716,0.723037776472891,0.95549367218234,0.8254953204311917,0.8207806971758672,0.6575098109168748,0.6663059163059163,0.7882805816937554,0.7903294822421908,none,0.9259834618783657,0.9245893773133597,0.9099806348200071,COMPLETE
2429,0.6966332378223495,2025-09-24 01:01:35.612218,2025-09-24 01:02:32.354901,0 days 00:00:56.742683,0.00143521857567057,dart,0.8820478611672173,9.206971901612846,lossguide,0.0007542816057458132,0.047721917370935535,2,11,0.1865552694872157,900,forest,0.5932304408661251,0.7391803999273441,none,0.9664843098038925,4.228534175606818,0.14101814206361735,weighted,0.6876936246859704,0.3279497233033303,0.8250588596581021,0.8265765765765766,0.5932304408661251,0.6988546255506608,0.6966332378223495,0.7391803999273441,0.7993850699157614,0.7902366187463974,0.5942463290380582,0.5990144748999076,0.8481608212147135,0.8322635857937527,none,0.918015690172225,0.9143851863905885,0.9664843098038925,COMPLETE
2430,0.69035352638124,2025-09-24 01:02:32.501054,2025-09-24 01:02:33.842682,0 days 00:00:01.341628,0.0004281510785914108,gbtree,0.533577109257056,2.815534524750735,lossguide,0.00042281365546733776,0.3621312683112522,1,7,0.11886693521994247,500,,0.6077732561810683,0.8686959763071092,oversample,0.8444738074008941,3.86009398477268,,,,0.49224997579950003,0.8193264407820657,0.8215601965601965,0.6077732561810683,0.688327741479781,0.69035352638124,0.8686959763071092,0.7973678235482885,0.788495380490019,0.5861654135338346,0.5902187120291617,0.8336184773310522,0.8314077877620881,oversample,0.9111578158637451,0.9076462519506949,0.8444738074008941,COMPLETE
2431,0.38612143742255267,2025-09-24 01:02:33.989226,2025-09-24 01:02:40.762426,0 days 00:00:06.773200,0.02857368041620942,dart,0.7604580555064828,9.735604944413224,lossguide,43.71703288635334,0.00016053125359700426,7,3,1.830877435085846,300,forest,0.4292631552440921,0.7981117101032421,undersample,0.8369530614278338,2.378942972779383,0.0026471820465933937,weighted,0.7890161800924888,0.8191779166746311,0.23932848807452145,0.23925061425061425,0.4292631552440921,0.3862228462872718,0.38612143742255267,0.7981117101032421,0.6560510886316699,0.6525535566628883,0.23932848807452145,0.23925061425061425,1.0,1.0,undersample,0.8755766050228397,0.8738679117025112,0.8369530614278338,COMPLETE
2432,0.38612143742255267,2025-09-24 01:02:40.908015,2025-09-24 01:02:41.645452,0 days 00:00:00.737437,0.2834364786756818,gbtree,0.9386316969204447,0.5644599938069348,depthwise,12.191222837061076,0.001064167384014568,7,5,0.45152586079384466,200,,0.4600461084571278,0.8524758621502985,oversample,0.6499841659885732,3.3230085248212418,,,,0.4589546622077548,0.23932848807452145,0.23925061425061425,0.4600461084571278,0.3862228462872718,0.38612143742255267,0.8524758621502985,0.7412182799017283,0.7341011663725764,0.23932848807452145,0.23925061425061425,1.0,1.0,oversample,0.895007292065618,0.8899537418764112,0.6499841659885732,COMPLETE
2433,0.686413393432067,2025-09-24 01:02:41.792381,2025-09-24 01:02:43.522572,0 days 00:00:01.730191,0.00013362173120863233,gbtree,0.3683416463297718,2.05854451889868,lossguide,0.000171374586072059,0.007721430657561306,1,6,0.10254666246590635,500,,0.6794524659786138,0.7784021263558392,none,0.8609828842973521,3.81567447029296,,,,0.5233054582215331,0.8510594738458389,0.8504299754299754,0.6794524659786138,0.6912794398472311,0.686413393432067,0.7784021263558392,0.786652901790414,0.7820433115614414,0.6858947368421052,0.6886304909560723,0.6967493584260052,0.6842105263157895,none,0.9086685329381607,0.9083240322448483,0.8609828842973521,COMPLETE
2434,0.7193229901269393,2025-09-24 01:02:43.668251,2025-09-24 01:02:44.426001,0 days 00:00:00.757750,0.021191726974364746,gbtree,0.8404157663118036,3.3293439849484225,depthwise,0.003841327609088163,0.1017488932285029,10,4,0.1834376038003169,300,,0.4816106611397998,0.956824365367883,none,0.8783383188810323,1.7037844156590456,,,,0.5368001730011964,0.8582249974408844,0.8573914823914824,0.4816106611397998,0.7229445889177836,0.7193229901269393,0.956824365367883,0.8269562973761344,0.8189958962395761,0.6790680195415257,0.6797410510281797,0.7728828058169376,0.7637997432605905,none,0.9272759055394028,0.9242651852181996,0.8783383188810323,COMPLETE
2435,0.702316076294278,2025-09-24 01:02:44.572337,2025-09-24 01:02:48.625246,0 days 00:00:04.052909,0.04783319795198911,gbtree,0.5119928857560363,2.22819272012195,lossguide,0.043613933220620814,0.017080345706602735,5,8,0.226536918301076,800,,0.6422965243484205,0.9597501880166908,oversample,0.715459142449284,3.390696159794816,,,,0.7963224027283136,0.8190193469137066,0.821048321048321,0.6422965243484205,0.7002373685995252,0.702316076294278,0.9597501880166908,0.8263474687658658,0.8194840003126777,0.5800561797752809,0.5833097595473833,0.8832335329341318,0.8823277706461276,oversample,0.9259786845364579,0.9247155991735002,0.715459142449284,COMPLETE
2436,0.6656327543424317,2025-09-24 01:02:48.776738,2025-09-24 01:02:52.192914,0 days 00:00:03.416176,0.0009494256863860808,dart,0.7830316530621887,3.9434348210351997,depthwise,27.58191048958506,0.1381248647068358,0,10,4.690018309957573,200,tree,0.6904088547266737,0.9536013401320652,undersample,0.9523566649675572,4.8338392240805375,0.321546255203479,weighted,0.8789948244194052,0.9017244010309657,0.7807349779916061,0.7792792792792793,0.6904088547266737,0.6695464362850972,0.6656327543424317,0.9536013401320652,0.816582280480902,0.8063761773321636,0.5236486486486487,0.5220141084894186,0.9281437125748503,0.9182712879760376,undersample,0.9233470022870229,0.9204800553625662,0.9523566649675572,COMPLETE
2437,0.7154761904761905,2025-09-24 01:02:52.340564,2025-09-24 01:03:05.001963,0 days 00:00:12.661399,0.0003203655094220626,dart,0.9235123882050853,6.077164957914327,depthwise,0.08805504699986114,0.4915984161314214,1,12,1.2729173074302602,400,forest,0.6953650403451621,0.8740820416505406,none,0.9912697596179186,4.191981394755346,0.16760000315204784,weighted,0.5814648920681393,0.4556541885120291,0.8500358276179752,0.8531941031941032,0.6953650403451621,0.708457711442786,0.7154761904761905,0.8740820416505406,0.8131829736889344,0.8108162276432995,0.6624488276888724,0.6670366259711432,0.7613344739093242,0.7715019255455713,none,0.9212961987668933,0.920007788671899,0.9912697596179186,COMPLETE
2438,0.7040994754225762,2025-09-24 01:03:05.149106,2025-09-24 01:03:05.949694,0 days 00:00:00.800588,0.003159037111236887,gbtree,0.9247016892761093,2.109513504576533,depthwise,0.0021331966134568634,0.021558342373212074,10,3,0.20220241552658488,400,,0.32053223235080774,0.8074039304177608,none,0.8837158524805794,0.9873710737634459,,,,0.7436229241968264,0.8429726686457161,0.844082719082719,0.32053223235080774,0.7056792018419032,0.7040994754225762,0.8074039304177608,0.8107803579184123,0.8049805245311771,0.639874739039666,0.6448398576512455,0.7865697177074422,0.7753530166880617,none,0.9193176309587412,0.9187098686319501,0.8837158524805794,COMPLETE
2439,0.7179702243656951,2025-09-24 01:03:06.098362,2025-09-24 01:03:07.410486,0 days 00:00:01.312124,0.04083154800933938,gbtree,0.8654711168727096,7.6206990526934,depthwise,0.00022218092343054526,0.015621640887241287,0,11,7.364600348059856,500,,0.6449648168268434,0.9470712503859021,none,0.8711520126667869,2.9196916157119706,,,,0.5430458540130167,0.8645716040536391,0.8623054873054873,0.6449648168268434,0.7237419085404051,0.7179702243656951,0.9470712503859021,0.8219110368978305,0.8158314053629128,0.7070583435332517,0.7039473684210527,0.7412318220701454,0.7325631151048353,none,0.9251625073286152,0.9228391142887695,0.8711520126667869,COMPLETE
2440,0.7096535112099315,2025-09-24 01:03:07.562196,2025-09-24 01:03:08.973318,0 days 00:00:01.411122,0.00015364487896511777,gbtree,0.5857457286250718,1.3788788926883462,lossguide,0.0501045229986868,0.019886103994571497,2,7,0.1321952472894467,200,,0.5862878917731162,0.973260657391474,none,0.8635432698971922,3.5083769540412755,,,,0.8549159130123394,0.8372402497696796,0.8395782145782146,0.5862878917731162,0.708256880733945,0.7096535112099315,0.973260657391474,0.8211432144132393,0.8143987816950157,0.6201799485861182,0.6258169934640523,0.825491873396065,0.8194266153187848,none,0.9240157725957624,0.9223311749510416,0.8635432698971922,COMPLETE
2441,0.7198139141467541,2025-09-24 01:03:09.124518,2025-09-24 01:03:12.956960,0 days 00:00:03.832442,0.00018422133978873332,dart,0.9336001348312126,7.3138607630217685,depthwise,0.02420764869621574,0.029007355016572426,0,12,0.5954080451351135,200,forest,0.6620439992214754,0.9827815598321507,none,0.9066454537581,2.9599308427851803,0.1171017725574976,weighted,0.7993537295258305,0.46402731698885785,0.8634455932029891,0.8643529893529893,0.6620439992214754,0.7192760942760943,0.7198139141467541,0.9827815598321507,0.8244876420984373,0.8180447627541436,0.707953603976802,0.7115384615384616,0.7309666381522669,0.7282841249465126,none,0.9260740011412667,0.9242797824999263,0.9066454537581,COMPLETE
2442,0.642461358996792,2025-09-24 01:03:13.104205,2025-09-24 01:03:15.063081,0 days 00:00:01.958876,0.00020884970674570262,gbtree,0.22552937484978586,0.29003844475062723,lossguide,0.009938775605935674,0.012133812940457386,0,7,0.12730412803175215,400,,0.6212983713257227,0.8535292451031409,oversample,0.8978125901080385,4.389285951303688,,,,0.40703352062721343,0.7413245982188555,0.7489762489762489,0.6212983713257227,0.63530090922211,0.642461358996792,0.8535292451031409,0.7949127990422803,0.7892100812644607,0.4794162491831845,0.48728157487281576,0.9414029084687767,0.9426615318784767,oversample,0.9145084592911185,0.9139499743381514,0.8978125901080385,COMPLETE
2443,0.6646341463414634,2025-09-24 01:03:15.211116,2025-09-24 01:04:28.569659,0 days 00:01:13.358543,0.008800149148030824,dart,0.8244025686215799,1.5264912180927064,lossguide,0.039553063460122946,0.002839171239782131,9,9,2.3892373885655407,1000,forest,0.4704475009329587,0.9436659215647555,none,0.8924813861520536,0.7797338613969936,0.2254857400812163,weighted,0.7035325735558733,0.6520083157745353,0.8659023441498618,0.8648648648648649,0.4704475009329587,0.6703573225968797,0.6646341463414634,0.9436659215647555,0.8151064682708236,0.8091926824868756,0.8141809290953546,0.8180112570356473,0.5697177074422584,0.5596919127086007,none,0.9186563144545443,0.916794745577441,0.8924813861520536,COMPLETE
2444,0.6442070665571077,2025-09-24 01:04:28.717973,2025-09-24 01:04:31.966778,0 days 00:00:03.248805,0.00857591601920354,dart,0.8545015804671703,2.5435777983919126,depthwise,0.0003434615431595927,0.008905567811246504,10,3,0.14178017035779172,200,forest,0.3233578148878349,0.855865291029019,none,0.9458392487764736,1.251288375797623,0.07899195882672873,weighted,0.6714872830253278,0.943823573827941,0.7693725048623196,0.7783579033579033,0.3233578148878349,0.6360846389920853,0.6442070665571077,0.855865291029019,0.7039377857703274,0.6954783326034157,0.5110303659486115,0.5229455709711847,0.8421727972626176,0.8386820710312366,none,0.8807357025956162,0.8830722608056882,0.9458392487764736,COMPLETE
2445,0.721298337006612,2025-09-24 01:04:32.122218,2025-09-24 01:04:49.122469,0 days 00:00:17.000251,0.057391457220163956,dart,0.34552220934432143,0.27528751699002585,lossguide,0.00022369968383876396,0.085043665527935,3,11,1.2154956086241688,400,forest,0.6076669355647907,0.9708527351224414,none,0.9457690462403489,3.7652246357573795,0.09772968973635689,weighted,0.5135997315745409,0.942648940332788,0.8512642030914116,0.8575962325962326,0.6076669355647907,0.7095742554467319,0.721298337006612,0.9708527351224414,0.8213619463234302,0.818662864002619,0.6660412757973734,0.6782215523737755,0.7591958939264328,0.7702182284980744,none,0.92348701293992,0.923594430045824,0.9457690462403489,COMPLETE
2446,0.7205044751830757,2025-09-24 01:04:49.275523,2025-09-24 01:04:52.678198,0 days 00:00:03.402675,0.00025575749900473007,dart,0.6360005127259256,6.324437445940879,depthwise,12.584070210915952,0.29842224022476227,2,9,1.877570338243515,200,forest,0.6810416955437623,0.9866187691552297,none,0.9804944130415836,3.756537659751006,0.18694289628859434,weighted,0.8981188863597859,0.9356021376726085,0.8595557375371071,0.8593366093366094,0.6810416955437623,0.7219294689906769,0.7205044751830757,0.9866187691552297,0.8258799414468945,0.8186342212575944,0.6860554699537751,0.6867002714230321,0.7617621899059025,0.7578091570389388,none,0.9274901376668773,0.9246683235589129,0.9804944130415836,COMPLETE
2447,0.4513882170842604,2025-09-24 01:04:52.830003,2025-09-24 01:05:27.615230,0 days 00:00:34.785227,0.0003203940722813311,dart,0.26738166244932543,5.187362021820471,depthwise,47.65949178147609,0.0037068615804205984,6,10,19.924457007866106,700,forest,0.31412875676415764,0.5680028195795055,oversample,0.81152754921666,3.227491066613705,0.13143806388920132,weighted,0.7149611451501522,0.4303610243259425,0.4147814515303511,0.41943079443079445,0.31412875676415764,0.4494944631680308,0.4513882170842604,0.5680028195795055,0.7069215724322575,0.6966987049128195,0.2900459798682739,0.291625,0.998289136013687,0.998288403936671,oversample,0.8852438441647186,0.8857303480711751,0.81152754921666,COMPLETE
2448,0.6961552818215753,2025-09-24 01:05:27.762476,2025-09-24 01:05:29.342026,0 days 00:00:01.579550,0.0002464070748834128,gbtree,0.3655232011766817,0.9660907616781529,lossguide,0.00012375753670033508,0.16588854317934532,5,8,0.11839967238652858,300,,0.6071631960904016,0.8995836742660773,none,0.878188056936569,4.36273018785798,,,,0.6215778850480302,0.8327362063670796,0.8333333333333334,0.6071631960904016,0.6965081723625557,0.6961552818215753,0.8995836742660773,0.8078548099296472,0.7992242754591338,0.6155613919894944,0.6173452499172459,0.80196749358426,0.7980316645271716,none,0.9158199259822819,0.9130168135924821,0.878188056936569,COMPLETE
2449,0.7236871260802127,2025-09-24 01:05:29.493975,2025-09-24 01:05:34.030147,0 days 00:00:04.536172,0.0004839710977369869,dart,0.39362455769153115,3.897276207417855,lossguide,0.00042263734934984816,0.10066140501181449,1,11,0.49609804784506595,200,forest,0.6893073753182335,0.9402934560048394,none,0.9273054469110366,3.145376043189219,0.256136708619379,weighted,0.6183368597455723,0.9109606572278737,0.8709182106663937,0.8723382473382474,0.6893073753182335,0.7207087486157253,0.7236871260802127,0.9402934560048394,0.8243899114084401,0.8197964440946477,0.7473587505741847,0.7504595588235294,0.6958939264328486,0.6987590928540864,none,0.9259586542354473,0.9251922997525026,0.9273054469110366,COMPLETE
2450,0.06085526315789474,2025-09-24 01:05:34.175436,2025-09-24 01:06:29.565622,0 days 00:00:55.390186,0.005333524019389352,dart,0.6502487058950271,1.4302913191154043,lossguide,0.0006883733932209473,0.0013339659648867017,5,7,1.7223247740985346,900,forest,0.6994295273701555,0.5326690020510239,undersample,0.9804151789358512,0.6471068490088454,0.2344401559091991,weighted,0.789701756526892,0.6394735584319939,0.7685535878800287,0.7661752661752662,0.6994295273701555,0.06993006993006994,0.06085526315789474,0.5326690020510239,0.6290446349637813,0.6069241139627931,0.9139784946236559,0.7789473684210526,0.03635585970915312,0.031664527171587506,undersample,0.8528124844952232,0.8515731982851563,0.9804151789358512,COMPLETE
2451,0.7189672293942403,2025-09-24 01:06:29.717502,2025-09-24 01:06:33.237401,0 days 00:00:03.519899,0.0014705742798814382,dart,0.7990132039514719,8.273819089447422,depthwise,1.588975914692859,0.4265060862786315,1,11,12.23125499427103,200,forest,0.6959012191205411,0.9846347957276641,none,0.9923620870975991,4.581156916276764,0.10816940053710714,weighted,0.7884999690482282,0.5853547198877737,0.8501381922407616,0.8551392301392301,0.6959012191205411,0.7115839243498818,0.7189672293942403,0.9846347957276641,0.8193527932940146,0.8158223049450987,0.6596055514974434,0.6708673091178651,0.7724550898203593,0.7744972186563971,none,0.9243988233234207,0.9230325642610058,0.9923620870975991,COMPLETE
2452,0.6936936936936937,2025-09-24 01:06:33.389636,2025-09-24 01:06:47.971934,0 days 00:00:14.582298,0.0007225286551364351,dart,0.27680312847035093,5.241032864080948,lossguide,0.00018032167017230597,0.005375432413399631,0,12,0.3687997649917451,400,forest,0.6774844259893312,0.8723646880197181,none,0.8520450185142504,4.200590361713741,0.16799041701267572,weighted,0.5517496260209211,0.7692206988094067,0.8542327771522162,0.8538083538083538,0.6774844259893312,0.6952054794520548,0.6936936936936937,0.8723646880197181,0.7860094526352215,0.7795528241568057,0.6958011996572407,0.6954838709677419,0.6946107784431138,0.6919127086007703,none,0.9143914431935481,0.9138606055758621,0.8520450185142504,COMPLETE
