number,value,datetime_start,datetime_complete,duration,params_alpha,params_booster,params_colsample_bytree,params_gamma,params_grow_policy,params_lambda,params_learning_rate,params_max_delta_step,params_max_depth,params_min_child_weight,params_n_estimators,params_normalize_type,params_params_decision_threshold,params_params_feature_fraction,params_params_resampling,params_params_sample_rows,params_params_scale_pos_weight,params_rate_drop,params_sample_type,params_skip_drop,params_subsample,user_attrs_acc_test,user_attrs_acc_val,user_attrs_decision_threshold,user_attrs_f1_test,user_attrs_f1_val,user_attrs_feature_fraction,user_attrs_pr_auc_test,user_attrs_pr_auc_val,user_attrs_prec_test,user_attrs_prec_val,user_attrs_rec_test,user_attrs_rec_val,user_attrs_resampling_strategy,user_attrs_roc_auc_test,user_attrs_roc_auc_val,user_attrs_sample_rows,state
252,0.6831097079715864,2025-09-23 12:44:48.517160,2025-09-23 12:44:50.310306,0 days 00:00:01.793146,0.00010068059716344974,gbtree,0.4107487641573669,1.03328313808852,lossguide,0.0027419613465525733,0.0010509219478662046,2,9,18.617518242305927,700,,0.5269279154304469,0.523627559198728,undersample,0.798749787830575,0.934190474344756,,,,0.6021903334409109,0.8340669464633023,0.8355855855855856,0.5269279154304469,0.6823437193807564,0.6831097079715864,0.523627559198728,0.7718153434690197,0.7645965339928158,0.6296564195298372,0.6338337605272794,0.7446535500427716,0.7406931964056482,undersample,0.9047239162599883,0.9037020203616819,0.798749787830575,COMPLETE
253,0.6959986142386974,2025-09-23 12:44:50.432821,2025-09-23 12:45:40.925140,0 days 00:00:50.492319,0.16225113387975168,dart,0.6930571428196975,6.321213368990781,depthwise,0.4680491963306042,0.0802038533024057,9,3,2.8708492882288947,900,tree,0.42405187588642956,0.9510000708131128,undersample,0.802153889611825,0.7489855144237494,0.37674771127820733,uniform,0.8679322799387201,0.7400623516151195,0.8170744190807657,0.8203316953316954,0.42405187588642956,0.6938495802638341,0.6959986142386974,0.9510000708131128,0.8135198896875513,0.8063796182598874,0.5787367819376965,0.5846915017462165,0.8661248930710008,0.8596491228070176,undersample,0.9207623164191255,0.9199697839147399,0.802153889611825,COMPLETE
254,0.5969738651994498,2025-09-23 12:45:41.045197,2025-09-23 12:46:37.277850,0 days 00:00:56.232653,0.024820896523931577,dart,0.7737181008588188,8.999673054988357,lossguide,10.15913732104864,0.0011821309704031881,2,12,1.504526549478215,900,forest,0.4409665387882875,0.6296303784950409,none,0.9824321208269569,1.5385328817740158,0.2593975918471024,weighted,0.6948921835402352,0.5738706126769519,0.8224997440884431,0.8200245700245701,0.4409665387882875,0.6089309878213802,0.5969738651994498,0.6296303784950409,0.6462519837894624,0.6353187832246638,0.6440839694656488,0.642962962962963,0.5774165953806673,0.5571245186136072,none,0.8629972018590422,0.862019727117782,0.9824321208269569,COMPLETE
255,0.6715328467153284,2025-09-23 12:46:37.399386,2025-09-23 12:46:38.189853,0 days 00:00:00.790467,0.0001072069309976898,gbtree,0.9355247911284776,1.487804745516349,lossguide,16.334258416770286,0.09403419660617893,7,3,0.35076785300140556,800,,0.3448929449160976,0.9731032298305675,none,0.603695492790955,3.1181636732234113,,,,0.25062390728257766,0.7808373426143924,0.788083538083538,0.3448929449160976,0.6661468891314517,0.6715328467153284,0.9731032298305675,0.8064666436884442,0.7999290237828749,0.5241717791411042,0.5336696090794452,0.913601368691189,0.9054343175010697,none,0.9184869778293346,0.9165257755460923,0.603695492790955,COMPLETE
256,0.6605230386052304,2025-09-23 12:46:38.311360,2025-09-23 12:46:50.216358,0 days 00:00:11.904998,0.7953883219205165,dart,0.680751247210172,8.931135181516046,lossguide,0.00023288059674164227,0.013580407393317912,8,6,25.16248784418333,400,forest,0.690540729954992,0.9077917917493821,oversample,0.8256796741554404,0.6705900610090159,0.0858123502234236,uniform,0.859186046500032,0.6739236771259967,0.8636503224485618,0.8604627354627354,0.690540729954992,0.6701337295690936,0.6605230386052304,0.9077917917493821,0.8067357466191751,0.7983598704165032,0.7958823529411765,0.7902264600715138,0.5786997433704021,0.5673940949935815,oversample,0.9177782044769105,0.915289526862079,0.8256796741554404,COMPLETE
257,0.0,2025-09-23 12:46:50.336596,2025-09-23 12:47:44.802771,0 days 00:00:54.466175,2.0577068856518648,dart,0.6018312452287883,2.0087805194596364,depthwise,0.048311829438479684,0.0010502394481587858,3,11,22.53531409425431,900,tree,0.49375805540938866,0.5271915853984876,none,0.9795224938497538,1.4525721199483388,0.10813648383401919,weighted,0.0736137681438214,0.7486387402759047,0.7606715119254785,0.7607493857493858,0.49375805540938866,0.0,0.0,0.5271915853984876,0.7505432388403885,0.745746076778693,0.0,0.0,0.0,0.0,none,0.8864412302334601,0.8878575203957424,0.9795224938497538,COMPLETE
258,0.6399167781245356,2025-09-23 12:47:44.921627,2025-09-23 12:47:55.697224,0 days 00:00:10.775597,46.89473980368245,dart,0.4090889820786376,4.838963968296392,depthwise,20.84369023435287,0.1249129747068328,1,12,17.11548547016884,400,tree,0.4652734277513615,0.7296469300430493,oversample,0.7482490410836606,1.88972509056828,0.37181119959695835,uniform,0.7279961045186055,0.9101376000933692,0.7483877571911147,0.7519451269451269,0.4652734277513615,0.6391661773341163,0.6399167781245356,0.7296469300430493,0.7877065170134729,0.7825211580351126,0.48658918194009837,0.4902094717668488,0.9311377245508982,0.9212665810868635,oversample,0.9121384947965537,0.9084426819450397,0.7482490410836606,COMPLETE
259,0.3639921722113503,2025-09-23 12:47:55.817179,2025-09-23 12:47:56.328975,0 days 00:00:00.511796,0.0152530483154795,gbtree,0.7558124901711116,5.844328307136614,depthwise,0.07393120027621912,0.0007042820510559024,8,3,3.162230396824422,500,,0.3245503474282278,0.5249137743964463,none,0.9585509838334217,0.9771234632684814,,,,0.8427979770978571,0.8030504657590337,0.8003685503685504,0.3245503474282278,0.3728813559322034,0.3639921722113503,0.5249137743964463,0.6181684852037591,0.6047595282301622,0.7835616438356164,0.7654320987654321,0.2446535500427716,0.23876765083440307,none,0.836809770504553,0.8324393865870963,0.9585509838334217,COMPLETE
260,0.38612143742255267,2025-09-23 12:47:56.450221,2025-09-23 12:48:14.290712,0 days 00:00:17.840491,43.179742838486405,dart,0.3356716756727828,4.50965581916813,depthwise,0.00012610499964126664,0.00012945511605428616,6,7,7.929071163888674,500,forest,0.42096523459396407,0.555800112569441,none,0.7103782907476308,3.4531972808429,0.002983070409485533,weighted,0.3882905042368429,0.358160338482143,0.23932848807452145,0.23925061425061425,0.42096523459396407,0.3862228462872718,0.38612143742255267,0.555800112569441,0.6980593108007513,0.691789542969334,0.23932848807452145,0.23925061425061425,1.0,1.0,none,0.8745629739425353,0.8716799029750066,0.7103782907476308,COMPLETE
261,0.7016057091882248,2025-09-23 12:48:14.409071,2025-09-23 12:48:21.176324,0 days 00:00:06.767253,0.0002715982426545934,dart,0.29202245058067255,3.904229415533713,depthwise,14.352501831176323,0.05174431550284401,10,10,0.5421764735940529,300,tree,0.39917471561576573,0.933551710821884,none,0.7363275400130749,0.8827056874506006,0.07649135616258723,uniform,0.8912755560129202,0.6518526069561901,0.8673354488688709,0.8630221130221131,0.39917471561576573,0.7150395778364116,0.7016057091882248,0.933551710821884,0.8116032155045192,0.8056298110109573,0.7357466063348417,0.7326502095947834,0.6954662104362703,0.6730851519041506,none,0.9177609369760392,0.91684225152389,0.7363275400130749,COMPLETE
262,0.5906989393527332,2025-09-23 12:48:21.296385,2025-09-23 12:49:23.331392,0 days 00:01:02.035007,0.026707658024397833,dart,0.6752639515564929,9.895770615282798,depthwise,0.0005227531134356641,0.004371847283500504,5,3,19.70425200797358,1000,tree,0.5756116096325569,0.6918883639668476,undersample,0.8235441832318485,0.518102966598257,0.3045969563016264,uniform,0.7328380856367712,0.8023684494462007,0.8486027228989661,0.8459254709254709,0.5756116096325569,0.5973318812959434,0.5906989393527332,0.6918883639668476,0.7586534203691941,0.7478617494876207,0.8217228464419476,0.8104477611940298,0.4692044482463644,0.46469833119383824,undersample,0.8927694527318857,0.8882185367972713,0.8235441832318485,COMPLETE
263,0.6951627088830256,2025-09-23 12:49:23.450492,2025-09-23 12:49:25.453486,0 days 00:00:02.002994,0.001185124313257589,gbtree,0.6526648926155927,0.5481582681013986,lossguide,19.28182281836498,0.03343370571106965,9,8,44.11921617838393,900,,0.41422288643152005,0.9438124861463608,oversample,0.6794952643490433,0.7973576375268265,,,,0.804237662639417,0.8192240761592794,0.8225839475839476,0.41422288643152005,0.6928695652173913,0.6951627088830256,0.9438124861463608,0.8072145871197364,0.7962871480159011,0.5838218053927315,0.5902031063321386,0.8520102651839179,0.8455284552845529,oversample,0.9185929139471791,0.9146900018178942,0.6794952643490433,COMPLETE
264,0.5846645367412141,2025-09-23 12:49:25.573538,2025-09-23 12:49:26.106315,0 days 00:00:00.532777,0.1571066063621611,gbtree,0.2734869445266143,5.3829992496789,lossguide,0.07197030718084342,0.15252081715697527,7,6,52.40043504755147,900,,0.6363490893853323,0.6007084304751446,none,0.5621359901730143,1.413963729135778,,,,0.39049777443507927,0.8402088238304842,0.8402948402948403,0.6363490893853323,0.5899658523771999,0.5846645367412141,0.6007084304751446,0.7432578109963195,0.7420645617786641,0.7644656228727025,0.773784355179704,0.4803250641573995,0.46983311938382544,none,0.8872349884693385,0.8870595068698494,0.5621359901730143,COMPLETE
265,0.6534757485554193,2025-09-23 12:49:26.226152,2025-09-23 12:49:26.659120,0 days 00:00:00.432968,0.002470851645586179,gbtree,0.480030030601177,4.74954644495594,lossguide,0.3777150221934426,0.13398436039970327,3,6,4.84032038812693,600,,0.41156448421234093,0.6842280311664993,oversample,0.5190022439907311,0.5006562265431387,,,,0.6171068327288434,0.7911761695158154,0.7973996723996724,0.41156448421234093,0.6437303527768076,0.6534757485554193,0.6842280311664993,0.7098859102673676,0.7130201784856355,0.543978748524203,0.5530527563722585,0.7882805816937554,0.7984595635430038,oversample,0.8767798620418774,0.8840338675362616,0.5190022439907311,COMPLETE
266,0.0,2025-09-23 12:49:26.779056,2025-09-23 12:49:27.339855,0 days 00:00:00.560799,6.522652898918042,gbtree,0.29192177934355046,4.067203069274563,lossguide,0.015252725748564141,0.00010117318080264922,7,4,1.4104017088888605,500,,0.6614654962407559,0.5199212561841401,oversample,0.5638996758414339,0.924836240447188,,,,0.276444224506888,0.7606715119254785,0.7607493857493858,0.6614654962407559,0.0,0.0,0.5199212561841401,0.600832789114238,0.5952358889480196,0.0,0.0,0.0,0.0,oversample,0.8383969416262924,0.837044843367712,0.5638996758414339,COMPLETE
267,0.6464199517296862,2025-09-23 12:49:27.458636,2025-09-23 12:49:39.253819,0 days 00:00:11.795183,0.0002429226116967252,dart,0.6860391562378729,6.035510202410394,lossguide,1.23293968464742,0.10383213564452129,9,8,10.013585544843908,500,tree,0.5696318166907802,0.7243295720859646,oversample,0.795595494204167,0.8153401889827624,0.46323922246583915,uniform,0.16241696265593575,0.27823941337429936,0.8169720544579793,0.8200245700245701,0.5696318166907802,0.6478928712091374,0.6464199517296862,0.7243295720859646,0.7111373600582255,0.7050197437503833,0.6003649635036497,0.6098671726755218,0.7035928143712575,0.6876337184424476,oversample,0.8779580524054837,0.8807039310220568,0.795595494204167,COMPLETE
268,0.38612143742255267,2025-09-23 12:49:39.372907,2025-09-23 12:49:39.983262,0 days 00:00:00.610355,0.0007093364977984901,gbtree,0.8750591127372298,2.2867230474585067,lossguide,0.00036302881989705356,0.0003404755319704654,2,3,22.554841125447382,600,,0.5505363329838393,0.539846244282169,oversample,0.7669777453754085,3.9616636014612268,,,,0.3131457676115475,0.23932848807452145,0.23925061425061425,0.5505363329838393,0.3862228462872718,0.38612143742255267,0.539846244282169,0.6042466146703013,0.5998631000795713,0.23932848807452145,0.23925061425061425,1.0,1.0,oversample,0.8465634910466282,0.8413884128217225,0.7669777453754085,COMPLETE
269,0.619722300935109,2025-09-23 12:49:40.104107,2025-09-23 12:49:41.497014,0 days 00:00:01.392907,0.6252667731127585,gbtree,0.9887217625411677,4.391232897305251,lossguide,85.21746246303138,0.0014881815433186896,2,8,0.4651144732041029,300,,0.6097225791706083,0.9371737745586424,oversample,0.7863534312888778,2.202693796693504,,,,0.4228823724596351,0.7176783703552052,0.7252252252252253,0.6097225791706083,0.6141578063794069,0.619722300935109,0.9371737745586424,0.7166096164805671,0.7070229741875319,0.45634095634095634,0.46324931158652827,0.938836612489307,0.9358151476251605,oversample,0.8920748962885118,0.8892878524646113,0.7863534312888778,COMPLETE
270,0.659959125923597,2025-09-23 12:49:41.618148,2025-09-23 12:50:37.223333,0 days 00:00:55.605185,0.00011179926195682586,dart,0.4282722960942352,7.488048209052919,depthwise,0.015883060361657597,0.0009034979208301049,8,9,1.1335095365512808,900,forest,0.3625252598171534,0.8030961338046302,oversample,0.7770965931223529,0.6152760249269424,0.11079136808624734,uniform,0.3692819840699592,0.2844146357137898,0.7710103388269014,0.7785626535626535,0.3625252598171534,0.651828793774319,0.659959125923597,0.8030961338046302,0.7789362225397704,0.7739641022761596,0.512356251529239,0.5216202783300199,0.8956372968349017,0.8981600342319213,oversample,0.9068156437571826,0.9061636921322148,0.7770965931223529,COMPLETE
271,0.38612143742255267,2025-09-23 12:50:37.344267,2025-09-23 12:50:38.189535,0 days 00:00:00.845268,0.0009391589436013017,gbtree,0.6235434467386467,6.436891470845286,depthwise,0.15197113420604486,0.00012953442765327013,2,3,0.21198454985270812,1000,,0.34823331694052445,0.854141570287355,oversample,0.9633846449296335,1.9659471924155678,,,,0.3183239579370123,0.23932848807452145,0.23925061425061425,0.34823331694052445,0.3862228462872718,0.38612143742255267,0.854141570287355,0.7144214991155745,0.7099333298576307,0.23932848807452145,0.23925061425061425,1.0,1.0,oversample,0.8799526789894461,0.8744717554691006,0.9633846449296335,COMPLETE
272,0.7003410059676044,2025-09-23 12:50:38.313608,2025-09-23 12:51:24.656434,0 days 00:00:46.342826,0.00022360431390869228,dart,0.7520401102098457,2.0617459289731563,depthwise,32.48502953955742,0.0062217961316721,1,10,0.6989208258562064,800,forest,0.5732226475584066,0.8880024589725202,none,0.535241489748906,1.994884674230414,0.0697640256295376,uniform,0.6268705854452726,0.4696585123360218,0.8578155389497389,0.8560606060606061,0.5732226475584066,0.7071473750790639,0.7003410059676044,0.8880024589725202,0.8029855860041383,0.7944274830732883,0.6972972972972973,0.6976645435244161,0.7172797262617622,0.7030380830124091,none,0.9151494289234553,0.9141934063243484,0.535241489748906,COMPLETE
273,0.638377147588491,2025-09-23 12:51:24.778520,2025-09-23 12:51:25.317767,0 days 00:00:00.539247,0.01324812980418021,gbtree,0.2032898399721031,9.543471631043495,depthwise,3.115868163409763,0.15224339829463937,0,11,1.2634358615116783,1000,,0.6449425958010746,0.7819786017637285,undersample,0.6881750397265243,0.9564916255122228,,,,0.9110663151559686,0.8198382638959976,0.8211506961506961,0.6449425958010746,0.6424217797643235,0.638377147588491,0.7819786017637285,0.6891120365111427,0.6766234678811086,0.6118421052631579,0.6182838813151563,0.676218990590248,0.6598202824133504,undersample,0.8787606458459746,0.8789016993711998,0.6881750397265243,COMPLETE
274,0.48590526009880847,2025-09-23 12:51:25.438940,2025-09-23 12:51:26.410896,0 days 00:00:00.971956,9.515863799071496,gbtree,0.7692458026354203,8.435008643936305,lossguide,38.28808985505213,0.0018023645052384135,10,5,2.094734593091738,600,,0.4419789919979662,0.6518474454697001,none,0.7360470285089891,0.7446559801924706,,,,0.6205597719144853,0.8239328488074521,0.8188984438984439,0.4419789919979662,0.5068807339449541,0.48590526009880847,0.6518474454697001,0.6888663978531134,0.6798255001803711,0.768695652173913,0.7572463768115942,0.3781009409751925,0.35772357723577236,none,0.8776254515595372,0.8792371201446115,0.7360470285089891,COMPLETE
275,0.6940348525469169,2025-09-23 12:51:26.531917,2025-09-23 12:51:27.753257,0 days 00:00:01.221340,0.0014018558639440678,gbtree,0.5981920014054657,7.593824605373287,lossguide,0.00014074531000413983,0.027682629545003053,0,9,3.7082076005349984,300,,0.5317656967542457,0.7540782860200597,none,0.7950497487605357,4.9939967390864295,,,,0.9730973955400954,0.8102159893540792,0.8130630630630631,0.5317656967542457,0.6929446836700894,0.6940348525469169,0.7540782860200597,0.8243501240211887,0.8189360209689656,0.5654054054054054,0.5703662902781603,0.894781864841745,0.8861788617886179,none,0.9261866140261147,0.9243921268654073,0.7950497487605357,COMPLETE
276,0.6882012920775247,2025-09-23 12:51:27.873741,2025-09-23 12:51:29.013178,0 days 00:00:01.139437,0.018182011226603977,gbtree,0.26791937136867117,4.490439126266183,lossguide,0.0020234696263599296,0.019848313923951106,2,7,33.10351256918945,700,,0.6662736637876777,0.9588043139716901,oversample,0.8431567265509496,2.442987831652052,,,,0.32044109732067483,0.8066332275565564,0.8122440622440622,0.6662736637876777,0.6846937072275079,0.6882012920775247,0.9588043139716901,0.8045459389222291,0.7964787196230405,0.561456337257049,0.5709449929478139,0.8772455089820359,0.8660676080445014,oversample,0.9181023730265978,0.9158945222879762,0.8431567265509496,COMPLETE
277,0.536753354708467,2025-09-23 12:51:29.136513,2025-09-23 12:52:09.377277,0 days 00:00:40.240764,0.0019733028723340003,dart,0.5791118230879386,2.2505507332950425,depthwise,63.55367961710489,0.1260428803371617,10,4,7.542133977112778,800,tree,0.39395377808025095,0.5223621400285101,undersample,0.9511075770127331,2.9682680749859847,0.10224451540395574,uniform,0.19834554531307744,0.7428702455465532,0.5982188555635173,0.6006347256347256,0.39395377808025095,0.5363260484347312,0.536753354708467,0.5223621400285101,0.6432095741418238,0.6445017326624337,0.3704912681573364,0.3714661406969099,0.9709153122326775,0.9670517757809157,undersample,0.8579488177460178,0.8609208425977126,0.9511075770127331,COMPLETE
278,0.6612695492180313,2025-09-23 12:52:09.498022,2025-09-23 12:52:09.912521,0 days 00:00:00.414499,11.170574830368716,gbtree,0.5807008501320223,3.364938083574237,lossguide,17.835931762615992,0.1493908125199914,0,9,21.72209583029124,300,,0.5107090008294456,0.5702125922868468,none,0.8093910052234247,2.374698623842138,,,,0.6193693574590629,0.8082710615211383,0.8115274365274365,0.5107090008294456,0.660134276900744,0.6612695492180313,0.5702125922868468,0.7244332184747291,0.7132524513080881,0.5732745036243303,0.5800516462233699,0.7780153977758768,0.7689345314505777,none,0.8865558864392444,0.8869094168705535,0.8093910052234247,COMPLETE
279,0.5749756572541382,2025-09-23 12:52:10.037833,2025-09-23 12:52:26.506135,0 days 00:00:16.468302,1.349940206091951,dart,0.31576982942541065,6.377696458650873,lossguide,0.021381176897242355,0.2364377093742572,3,5,81.34176152122787,500,tree,0.5935359923756842,0.5714948950638306,oversample,0.6895272231119556,0.5783288072269142,0.028935945874437874,uniform,0.3408617460004955,0.21244630152224817,0.8217831917289384,0.8212530712530712,0.5935359923756842,0.5837915371742768,0.5749756572541382,0.5714948950638306,0.6564394226252792,0.6634364480799722,0.6617886178861788,0.6668548842461886,0.5222412318220702,0.5053487376979033,oversample,0.8512053406308093,0.8486185875393804,0.6895272231119556,COMPLETE
280,0.6772544724351953,2025-09-23 12:52:26.625951,2025-09-23 12:52:27.465496,0 days 00:00:00.839545,0.0015589250379138707,gbtree,0.47220992650049215,4.088680328694464,lossguide,0.9840490869693677,0.009747469969888617,7,10,25.106517349941903,200,,0.6285378252673406,0.6268863400310869,oversample,0.9562646272229174,1.3346485535423533,,,,0.353475659798391,0.8165625959668339,0.819000819000819,0.6285378252673406,0.679427549194991,0.6772544724351953,0.6268863400310869,0.7788428674203722,0.7717052563893846,0.5839483394833949,0.5905762496020376,0.8122326775021386,0.793752674368849,oversample,0.906567452211328,0.9037278463216607,0.9562646272229174,COMPLETE
281,0.5847423778458262,2025-09-23 12:52:27.584868,2025-09-23 12:52:30.223027,0 days 00:00:02.638159,6.145388287544458,dart,0.665692275958276,6.287130625457747,lossguide,0.0022342618963058377,0.15512864133391294,0,12,40.250681878264245,200,tree,0.4007104710466666,0.5119924257938551,undersample,0.5304212172919389,1.7033545908993326,0.1933927518733698,weighted,0.42938496137474463,0.24304045213944525,0.6751970518988637,0.6806920556920557,0.4007104710466666,0.5810114881816981,0.5847423778458262,0.5119924257938551,0.7102990517154586,0.7088679507240488,0.42024832855778416,0.42442984151526864,0.9409751924721984,0.9396662387676509,undersample,0.8773862678933039,0.8776992806793547,0.5304212172919389,COMPLETE
282,0.0,2025-09-23 12:52:30.373710,2025-09-23 12:52:32.233136,0 days 00:00:01.859426,1.6815241955446705,gbtree,0.2035716763116512,4.899696315046706,lossguide,0.0012423108628913525,0.0002972543524514968,10,10,1.43429020660085,1000,,0.46181115140006623,0.7698478285346795,none,0.5604635589860264,0.7399833829138679,,,,0.8731030082150515,0.7606715119254785,0.7607493857493858,0.46181115140006623,0.0,0.0,0.7698478285346795,0.7711193631176895,0.765735718066052,0.0,0.0,0.0,0.0,none,0.9010415353617122,0.900081635370037,0.5604635589860264,COMPLETE
283,0.669021190716448,2025-09-23 12:52:32.356209,2025-09-23 12:52:33.349436,0 days 00:00:00.993227,0.08785402421323879,gbtree,0.8080607925319874,9.859047964010813,lossguide,7.365010499285576,0.013468132222970794,8,10,0.3207715631161382,700,,0.48360295580895546,0.8887815971652695,none,0.7988835393530774,0.7704387752079745,,,,0.6959761404652689,0.8641621455624936,0.8656838656838657,0.48360295580895546,0.6648143470573377,0.669021190716448,0.8887815971652695,0.8109959209181201,0.8047121187480731,0.811844540407156,0.8149969268592502,0.562874251497006,0.5673940949935815,none,0.9187492136092312,0.9161737996701302,0.7988835393530774,COMPLETE
