number,value,datetime_start,datetime_complete,duration,params_alpha,params_booster,params_colsample_bytree,params_gamma,params_grow_policy,params_lambda,params_learning_rate,params_max_delta_step,params_max_depth,params_min_child_weight,params_n_estimators,params_normalize_type,params_params_decision_threshold,params_params_feature_fraction,params_params_resampling,params_params_sample_rows,params_params_scale_pos_weight,params_rate_drop,params_sample_type,params_skip_drop,params_subsample,user_attrs_acc_test,user_attrs_acc_val,user_attrs_decision_threshold,user_attrs_f1_test,user_attrs_f1_val,user_attrs_feature_fraction,user_attrs_pr_auc_test,user_attrs_pr_auc_val,user_attrs_prec_test,user_attrs_prec_val,user_attrs_rec_test,user_attrs_rec_val,user_attrs_resampling_strategy,user_attrs_roc_auc_test,user_attrs_roc_auc_val,user_attrs_sample_rows,state
2236,0.6533827618164968,2025-09-24 00:09:39.912099,2025-09-24 00:10:38.758212,0 days 00:00:58.846113,0.007068625503206192,dart,0.7790961514758313,8.97843344314368,depthwise,0.00013317671563433257,0.02796783911263273,4,11,0.38323810747114656,900,forest,0.6476734622991982,0.7943370595312528,oversample,0.9566802804895341,3.8174477426632145,0.11056570828489186,weighted,0.5697481790465672,0.6525599435686763,0.7605691473026922,0.7702702702702703,0.6476734622991982,0.6429552740039689,0.6533827618164968,0.7943370595312528,0.7875621867196767,0.7741645734698313,0.49988131972466177,0.5112400290065264,0.9007698887938409,0.9050064184852374,oversample,0.9077931569814981,0.9041143431853758,0.9566802804895341,COMPLETE
2237,0.7051214822583465,2025-09-24 00:10:38.906374,2025-09-24 00:10:39.959626,0 days 00:00:01.053252,0.00015131888408394592,gbtree,0.7370693749181199,2.631635075152809,lossguide,0.9740075383725167,0.13699906524958438,3,7,0.41994709001145325,300,,0.6679460066439286,0.9856248966821349,undersample,0.9947911446112643,2.447086031528079,,,,0.562707798804016,0.820247722387143,0.8272932022932022,0.6679460066439286,0.6975542542197727,0.7051214822583465,0.9856248966821349,0.8140752664382682,0.8065960402030534,0.5839100346020761,0.5960401891252955,0.8661248930710008,0.8630723149336756,undersample,0.923001853723777,0.9197842228087623,0.9947911446112643,COMPLETE
2238,0.6941401495392105,2025-09-24 00:10:40.104722,2025-09-24 00:11:24.747668,0 days 00:00:44.642946,0.0004492755103020532,dart,0.40392250497681886,1.4892824778798397,lossguide,6.298810949226756,0.30312008452324457,3,5,0.6092251445025203,800,forest,0.5605614370197669,0.9469756462034639,none,0.8348829076855304,3.9760174266884887,0.0978514251678015,weighted,0.6703268092761255,0.7406527439691125,0.8162555020984748,0.8199221949221949,0.5605614370197669,0.6922681296074061,0.6941401495392105,0.9469756462034639,0.8025404105850656,0.7924241950243275,0.5776824034334764,0.5846514352665495,0.8635585970915313,0.8540864356011981,none,0.9186692075218617,0.9148336713165488,0.8348829076855304,COMPLETE
2239,0.7062780269058296,2025-09-24 00:11:24.892541,2025-09-24 00:11:28.269739,0 days 00:00:03.377198,0.00014583889660957602,gbtree,0.4528844783620128,0.17204571794412227,lossguide,0.00043958644796280395,0.08465528304468571,0,7,0.11116769421914677,700,,0.6554826435892025,0.9980858691944002,none,0.9361131351972419,2.661769322705281,,,,0.6396259843774802,0.8639574163169209,0.8658886158886159,0.6554826435892025,0.7032819825853985,0.7062780269058296,0.9980858691944002,0.8136646243851353,0.8133057780054558,0.7356375525455394,0.7418747056052756,0.6736526946107785,0.6739409499358151,none,0.920302770662608,0.9204945374783624,0.9361131351972419,COMPLETE
2240,0.6890263757733637,2025-09-24 00:11:28.417272,2025-09-24 00:12:32.280668,0 days 00:01:03.863396,0.000208507614666693,dart,0.2544450671772558,1.4855056082915385,lossguide,0.004936642724620105,0.026334822574861985,4,10,0.13525797515204632,900,forest,0.31306271086771453,0.9966456737805014,oversample,0.9388497087152428,0.9205308453405256,0.06322935227477011,weighted,0.7547756858720202,0.22240994413475643,0.7998771624526564,0.8044635544635544,0.31306271086771453,0.6860446442909909,0.6890263757733637,0.9966456737805014,0.8249393090928965,0.8197573720245788,0.5492414502442787,0.5561103810775295,0.913601368691189,0.9054343175010697,oversample,0.9267459371584991,0.9254070554219342,0.9388497087152428,COMPLETE
2241,0.6644829199812822,2025-09-24 00:12:32.424499,2025-09-24 00:13:40.186434,0 days 00:01:07.761935,0.00016960286376791175,dart,0.7973354829243708,8.890615677691494,lossguide,0.003851686444525906,0.008226369884800477,4,9,0.15415257896231335,1000,forest,0.6389285038190762,0.8170460852645922,undersample,0.80222885194637,3.1467376528038584,0.32709638132204105,weighted,0.7626364193303319,0.6607617196990635,0.7719316204319787,0.7797911547911548,0.6389285038190762,0.6561728395061729,0.6644829199812822,0.8170460852645922,0.8010010694288232,0.791600959686301,0.5132786093674553,0.5228276877761414,0.9093242087254063,0.9114249037227214,undersample,0.9134093540815019,0.9128199086423221,0.80222885194637,COMPLETE
2242,0.6656666666666666,2025-09-24 00:13:40.330461,2025-09-24 00:13:41.262500,0 days 00:00:00.932039,0.0059774393071254294,gbtree,0.762742197723105,4.029690077450484,lossguide,0.2191286118120867,0.2109444175078202,7,11,0.34652062152761093,200,,0.4248207704186624,0.9941252423710002,oversample,0.9496588194712484,1.0733906445608687,,,,0.6288992909498794,0.7888217831917289,0.7946355446355446,0.4248207704186624,0.6600757950238919,0.6656666666666666,0.9941252423710002,0.7452973977430228,0.7436677991619689,0.536853390511927,0.5451815451815452,0.8567151411462789,0.8545143346170304,oversample,0.8980635821614743,0.898603538231375,0.9496588194712484,COMPLETE
2243,0.6703104503716659,2025-09-24 00:13:41.407672,2025-09-24 00:13:42.462876,0 days 00:00:01.055204,0.0303134190111704,gbtree,0.2486813952447458,5.574531134923757,lossguide,0.06639771845989272,0.06806613667774955,1,8,1.1405781172902425,700,,0.6995642439315448,0.90773502425073,none,0.8552444940412179,3.0335342263289364,,,,0.9049835478542415,0.8452246903470161,0.8456183456183456,0.6995642439315448,0.6728688879273041,0.6703104503716659,0.90773502425073,0.7554044982264334,0.7497404465637814,0.6808231173380035,0.6852928028609745,0.665098374679213,0.6559691912708601,none,0.9012874533532854,0.9027646272680563,0.8552444940412179,COMPLETE
2244,0.7085121602288984,2025-09-24 00:13:42.606234,2025-09-24 00:13:46.476751,0 days 00:00:03.870517,0.0008824630033238191,dart,0.338765613243134,5.949079329588404,lossguide,0.006477083310729468,0.10049185532955254,1,12,2.3360035634177647,200,forest,0.5957414714477945,0.9356929937076601,none,0.9086832976747358,4.74950064928997,0.14800408816374694,weighted,0.7713526808523753,0.48138278331508616,0.8325314771215068,0.8331285831285832,0.5957414714477945,0.7096201632942847,0.7085121602288984,0.9356929937076601,0.8244181944461535,0.8196478302134099,0.6064927184466019,0.6086021505376344,0.8550042771599657,0.8476679503637141,none,0.9263776213649177,0.9250038594982554,0.9086832976747358,COMPLETE
2245,0.6575342465753424,2025-09-24 00:13:46.619960,2025-09-24 00:14:03.906092,0 days 00:00:17.286132,0.002323313866891031,dart,0.9264561506337448,8.97819895153899,depthwise,0.01101448180380649,0.466588717150196,1,12,1.2000391226739748,500,forest,0.6536468050051396,0.9394006793927339,none,0.8621666636725219,1.1683282761200158,0.1682069709393273,weighted,0.7825473117888146,0.8955390189354535,0.8664141672637936,0.8643529893529893,0.6536468050051396,0.6630518977536793,0.6575342465753424,0.9394006793927339,0.8172448068976754,0.8115659073418762,0.8364820846905537,0.8302872062663186,0.5491873396065012,0.5442875481386393,none,0.9224691225427338,0.9209575333116016,0.8621666636725219,COMPLETE
2246,0.7170466883821933,2025-09-24 00:14:04.048885,2025-09-24 00:14:31.988969,0 days 00:00:27.940084,0.0008006533307270346,dart,0.8159251901440272,9.527181233335787,depthwise,0.0002522724666683892,0.002982313152908302,5,12,0.206953805889186,600,forest,0.6488316666418917,0.9144439675413176,none,0.9886293223086521,3.1099746023709764,0.10010749774570782,weighted,0.6369925643323417,0.7077225585550194,0.8655952502815027,0.8666052416052417,0.6488316666418917,0.7157393375189435,0.7170466883821933,0.9144439675413176,0.8183227546743495,0.8098937728770662,0.7246821569487067,0.7279541446208113,0.7070145423438836,0.7064612751390672,none,0.9226332789176822,0.9199482478856831,0.9886293223086521,COMPLETE
2247,0.6968168377109062,2025-09-24 00:14:32.131595,2025-09-24 00:14:32.897113,0 days 00:00:00.765518,0.0012335646224178036,gbtree,0.30626935374087855,4.649049159170147,lossguide,0.07899533702551643,0.16512960456415451,0,4,0.5756833097936274,500,,0.5089178667325331,0.9583375773755706,none,0.8769038176584903,3.4436107088376327,,,,0.828330136718468,0.8180980653086294,0.8215601965601965,0.5089178667325331,0.6926137346479848,0.6968168377109062,0.9583375773755706,0.8195504622935852,0.8104426575250556,0.5814696485623003,0.5870457209847597,0.8562874251497006,0.8570817287120239,none,0.9221564656602937,0.9203845828059453,0.8769038176584903,COMPLETE
2248,0.7018083878414775,2025-09-24 00:14:33.042068,2025-09-24 00:15:28.936632,0 days 00:00:55.894564,0.0002709321929861377,dart,0.9273276849640768,6.9376092987517,lossguide,0.005015517736958872,0.18542725751178754,0,12,28.120589303536665,900,forest,0.6732132973004975,0.855563846016925,none,0.8610301635546963,4.481678086306761,0.06757893320694451,weighted,0.7768909846729267,0.5181216962854955,0.8397993653393387,0.8413185913185913,0.6732132973004975,0.7039909211272933,0.7018083878414775,0.855563846016925,0.808154501770638,0.7963731095960765,0.6310613767378772,0.6375393219154142,0.7959794696321643,0.7804878048780488,none,0.9196271509118565,0.9157198731539407,0.8610301635546963,COMPLETE
2249,0.7128712871287128,2025-09-24 00:15:29.081039,2025-09-24 00:16:24.409275,0 days 00:00:55.328236,0.0064605168715794045,dart,0.7327510297282288,7.33052074102323,depthwise,0.00013157472340947758,0.03216073737509717,0,11,1.4106844836177461,900,forest,0.5916630613098672,0.9020105834905647,none,0.9739924611139171,2.356530347205852,0.15405056503030556,weighted,0.41996428953270204,0.582111157332438,0.8641621455624936,0.8634316134316135,0.5916630613098672,0.7166346359171472,0.7128712871287128,0.9020105834905647,0.8162908999526812,0.8095896071953845,0.7155650319829424,0.7171935902988307,0.7177074422583405,0.7086007702182285,none,0.9204154698849606,0.9192565900968702,0.9739924611139171,COMPLETE
2250,0.7187755102040816,2025-09-24 00:16:24.552486,2025-09-24 00:16:25.357279,0 days 00:00:00.804793,0.0001526422427915929,gbtree,0.21970730052453225,0.0823216877392477,lossguide,0.04349254975500337,0.06832932001800926,4,5,0.5372659196274654,200,,0.6383274350611214,0.9041956101128157,none,0.766569319338582,3.235569557008901,,,,0.5709324500282538,0.8574060804585935,0.8589271089271089,0.6383274350611214,0.716697173073012,0.7187755102040816,0.9041956101128157,0.8193887988244799,0.8143686173053342,0.6832105467235362,0.6870854467420991,0.7536355859709153,0.7535301668806161,none,0.9242517329951665,0.9234411154004661,0.766569319338582,COMPLETE
2251,0.7038266643368862,2025-09-24 00:16:25.503582,2025-09-24 00:16:26.620681,0 days 00:00:01.117099,0.0005537824335960319,gbtree,0.44710255872822596,2.010336656689836,lossguide,0.014037538600284165,0.23959639045920123,2,9,0.5797095516582611,400,,0.6846552612279084,0.9894930113729236,oversample,0.8967668919936799,4.692522993411389,,,,0.9474655912704955,0.8226021087112294,0.8264742014742015,0.6846552612279084,0.6984513659300504,0.7038266643368862,0.9894930113729236,0.8217356493225086,0.8183670054201624,0.5887356996186565,0.5948021264028353,0.8584260051325919,0.8617886178861789,oversample,0.9221764096237999,0.9223015197238644,0.8967668919936799,COMPLETE
2252,0.6987362413371382,2025-09-24 00:16:26.766475,2025-09-24 00:16:29.015370,0 days 00:00:02.248895,0.0892686344310311,gbtree,0.4427431901524806,0.9494472650590292,lossguide,0.0034390201233134364,0.006346778359360449,0,7,0.5218860076378183,400,,0.6866791658423073,0.8943744749256777,none,0.9816033254260597,4.528350654510886,,,,0.5196781919865986,0.8501381922407616,0.8486895986895987,0.6866791658423073,0.7054325955734406,0.6987362413371382,0.8943744749256777,0.7946843411255418,0.787325634090078,0.666033434650456,0.6671856753600622,0.7497861420017109,0.7334189131364998,none,0.9136803675076746,0.9123740437412873,0.9816033254260597,COMPLETE
2253,0.6745394426074633,2025-09-24 00:16:29.158946,2025-09-24 00:17:16.775278,0 days 00:00:47.616332,0.00037956187779275704,dart,0.24397581881888492,2.51820983707829,depthwise,0.001430011649416785,0.23083728429841283,7,11,0.2268766804673822,800,forest,0.4933111200671472,0.9768539494457608,oversample,0.9090161872060738,2.4116512068322256,0.22358887362968688,weighted,0.7713945412044657,0.5019326882142963,0.7871839492271471,0.7883906633906634,0.4933111200671472,0.6740868474682552,0.6745394426074633,0.9768539494457608,0.8180592767237264,0.8126182895579439,0.5320465231378372,0.5336322869955157,0.9195893926432849,0.9165596919127086,oversample,0.9240836914325221,0.9224747004922826,0.9090161872060738,COMPLETE
2254,0.6881018442957402,2025-09-24 00:17:16.918464,2025-09-24 00:17:49.200998,0 days 00:00:32.282534,0.0033619000669343263,dart,0.4036254627708403,1.9972263494012845,lossguide,0.00013884933100122437,0.020191426203361937,5,12,0.31775829381462967,600,forest,0.3066490921782555,0.90068766927155,none,0.7895268955659643,3.021385435353067,0.0916437400917349,weighted,0.5766758226858382,0.5752108734625946,0.8023339133995291,0.8043611793611793,0.3066490921782555,0.6885986131269151,0.6881018442957402,0.90068766927155,0.8265101338597131,0.8215188332575742,0.552679264820088,0.5562005277044855,0.9131736526946108,0.9020111253744116,none,0.9272373414541238,0.9254346088708747,0.7895268955659643,COMPLETE
2255,0.6903019213174748,2025-09-24 00:17:49.357585,2025-09-24 00:17:52.852495,0 days 00:00:03.494910,0.0001280464414475208,dart,0.8556219822254072,7.402039039983408,lossguide,44.84090172530984,0.16337274970431329,1,12,11.146814342342468,200,tree,0.6936948260837564,0.9962688693417312,none,0.9564921948241493,2.94803305509779,0.20210416673468667,uniform,0.0023874728739773365,0.639047127661564,0.8632408639574163,0.8613841113841114,0.6936948260837564,0.6984198645598194,0.6903019213174748,0.9962688693417312,0.8048109462210107,0.7951867158935293,0.7394837476099426,0.7415233415233415,0.6616766467065869,0.6456996148908858,none,0.9155309831343714,0.9131436688652419,0.9564921948241493,COMPLETE
2256,0.7137447936387732,2025-09-24 00:17:52.997526,2025-09-24 00:18:18.497788,0 days 00:00:25.500262,0.0016201112143656772,dart,0.9742229351201905,9.907878104259389,depthwise,0.005687778323343015,0.44383919433437224,1,9,1.1850836478217792,600,forest,0.6687905596540191,0.8714958537918182,none,0.8684175143133994,4.559811520271762,0.15926356065844877,weighted,0.760184689316565,0.7281540395013504,0.8426655747773569,0.8452088452088452,0.6687905596540191,0.7099452726929609,0.7137447936387732,0.8714958537918182,0.8172789121529729,0.8101401575060703,0.6352583586626139,0.6400679117147708,0.8045337895637297,0.8065896448438169,none,0.921861162616229,0.9208993457250724,0.8684175143133994,COMPLETE
2257,0.6787330316742082,2025-09-24 00:18:18.645371,2025-09-24 00:18:44.717097,0 days 00:00:26.071726,0.0011113332254605109,dart,0.6437573270097174,9.529010948315804,depthwise,0.001616893168547485,0.02627258542161609,3,12,1.142597339158454,600,forest,0.673972637066276,0.9675139882173794,none,0.9800168101802402,1.5986566786073861,0.029745996407150588,weighted,0.7651257806636753,0.6714622291482957,0.8695874705701709,0.8691646191646192,0.673972637066276,0.6822942643391521,0.6787330316742082,0.9675139882173794,0.8271201650642859,0.8191549258390476,0.8181818181818182,0.8226691042047533,0.5851154833190761,0.5776636713735558,none,0.9273268446669727,0.9249201626580573,0.9800168101802402,COMPLETE
2258,0.6442013129102845,2025-09-24 00:18:44.860409,2025-09-24 00:18:45.702414,0 days 00:00:00.842005,0.007020274562214303,gbtree,0.9711347469174468,3.977444406189784,depthwise,0.00025813952963935565,0.0164560529575266,7,7,0.3341350862291694,200,,0.384085670303697,0.9786406868962607,oversample,0.9584301087326873,1.6910429306073256,,,,0.8657856132051991,0.7503326850240557,0.7503071253071253,0.384085670303697,0.645339537589065,0.6442013129102845,0.9786406868962607,0.8150516372754465,0.8069703127705964,0.4888742013659396,0.48871181938911024,0.9491017964071856,0.944801026957638,oversample,0.9221804962656727,0.9192144393662027,0.9584301087326873,COMPLETE
2259,0.6957826304384064,2025-09-24 00:18:45.851983,2025-09-24 00:18:46.585113,0 days 00:00:00.733130,0.0005334172942215914,gbtree,0.23119577578649717,0.26988220181939404,depthwise,0.0026378377156091597,0.15936947482200883,1,4,0.2173229988688141,300,,0.6221290032513052,0.9981890714379522,oversample,0.9356940904106349,2.7227081603556313,,,,0.9762282635135682,0.8077592384072064,0.8131654381654382,0.6221290032513052,0.6910167818361304,0.6957826304384064,0.9981890714379522,0.8276016585617569,0.8206600523328298,0.5614973262032086,0.5699071545603496,0.8982035928143712,0.8930252460419341,oversample,0.927404577200061,0.9257782640083375,0.9356940904106349,COMPLETE
2260,0.7243419710263211,2025-09-24 00:18:46.733065,2025-09-24 00:18:50.085381,0 days 00:00:03.352316,0.00018961493906419975,gbtree,0.38632829716648365,1.491342453753516,lossguide,0.020852397518818993,0.03688211482847348,1,8,0.6245260262620063,800,,0.6448972797661707,0.973601130928534,none,0.8394688841584441,3.5752444178706364,,,,0.6789847707351618,0.8584297266864571,0.8616912366912367,0.6448972797661707,0.7190737355271176,0.7243419710263211,0.973601130928534,0.8263345209529691,0.8221397520979776,0.6847195357833655,0.6922776911076443,0.7570573139435415,0.7595207531022679,none,0.9265514763195221,0.9258762702154356,0.8394688841584441,COMPLETE
2261,0.7142857142857143,2025-09-24 00:18:50.228728,2025-09-24 00:18:52.656900,0 days 00:00:02.428172,0.6695985160514754,gbtree,0.5405649853488941,5.122185946993331,lossguide,0.0026543436314166277,0.01353101300050351,2,10,0.5610233690615355,300,,0.6045488257485635,0.8572703840053735,none,0.8174812956175315,2.907907461020948,,,,0.8472164315213793,0.8564847988535162,0.8546273546273546,0.6045488257485635,0.7196,0.7142857142857143,0.8572703840053735,0.824002134332197,0.8163099075422027,0.6758076634109692,0.6741359665780479,0.7694610778443114,0.7595207531022679,none,0.9258726620811091,0.9232166857928485,0.8174812956175315,COMPLETE
2262,0.7007049775688955,2025-09-24 00:18:52.805296,2025-09-24 00:18:54.428763,0 days 00:00:01.623467,0.0001578287168274723,gbtree,0.5832617733301857,2.7936124329846583,lossguide,0.008725523904456071,0.14130636398772412,6,8,1.1603200427685127,700,,0.6699836726214741,0.95535958163426,none,0.734510532546689,3.23651388906863,,,,0.5712995913106382,0.8586344559320299,0.8565724815724816,0.6699836726214741,0.702819023025608,0.7007049775688955,0.95535958163426,0.8078371568378535,0.8010053697976773,0.707232568211347,0.6996587030716723,0.6984602224123182,0.7017543859649122,none,0.918023489326785,0.9158810478740744,0.734510532546689,COMPLETE
2263,0.6519916142557652,2025-09-24 00:18:54.573389,2025-09-24 00:18:56.537343,0 days 00:00:01.963954,0.0005018000241319661,gbtree,0.29784279808226666,3.195799957061509,lossguide,0.4494064993392803,0.013747186986724762,0,7,0.3161507437908137,600,,0.6505101199332439,0.8764403102259382,undersample,0.8129213780233071,4.881860936595235,,,,0.9950261726822921,0.7572934793735285,0.762080262080262,0.6505101199332439,0.6505526897568165,0.6519916142557652,0.8764403102259382,0.8006464637958388,0.7977027450282497,0.49628963346076005,0.50149735084082,0.9439692044482464,0.9315361574668378,undersample,0.9179076531751078,0.9173620529524888,0.8129213780233071,COMPLETE
2264,0.6689377516258904,2025-09-24 00:18:56.686038,2025-09-24 00:19:54.305008,0 days 00:00:57.618970,0.14145176538995155,dart,0.2809939806311453,4.051690508978734,lossguide,0.08136500614212511,0.006510911989787429,9,7,0.5233529892646471,900,forest,0.38256946746783904,0.9178529103379466,none,0.99085151665317,3.337862652818555,0.13934483960051341,weighted,0.67101565914825,0.23369230502793525,0.7740812775104924,0.7811220311220312,0.38256946746783904,0.6624866187490442,0.6689377516258904,0.9178529103379466,0.8096964044581788,0.8026241088113089,0.515591525827184,0.5241446250909974,0.9264328485885372,0.9242618741976893,none,0.9211812547694276,0.9196355435921186,0.99085151665317,COMPLETE
2265,0.6844245628304189,2025-09-24 00:19:54.449806,2025-09-24 00:19:58.700829,0 days 00:00:04.251023,0.0002848094736896062,gbtree,0.4490037180935796,0.7008706270003995,lossguide,0.009414067975793512,0.14570010007228432,2,8,0.9688573617551356,1000,,0.5763680258338073,0.9160762455779412,none,0.888316156372551,4.859679585572202,,,,0.633149330107187,0.8364213327873887,0.8411138411138411,0.5763680258338073,0.6766491299069203,0.6844245628304189,0.9160762455779412,0.7776219157509817,0.7795093404289966,0.642089093701997,0.6520728399845022,0.7151411462788708,0.7201540436456996,none,0.9002222212245444,0.9025956788475943,0.888316156372551,COMPLETE
2266,0.6926644906373476,2025-09-24 00:19:58.848281,2025-09-24 00:20:03.788244,0 days 00:00:04.939963,0.04570854586454104,dart,0.5553924992509693,1.6702525968302968,lossguide,0.0006869498649172421,0.027116511593340394,4,9,0.6275006356334338,200,tree,0.5910623066572397,0.9185865642616645,none,0.9498617691268497,4.83386949024108,0.11564541490032262,uniform,0.3459680172382915,0.6078522719280157,0.8130821987920974,0.8168509418509419,0.5910623066572397,0.689561373682421,0.6926644906373476,0.9185865642616645,0.8059985819360256,0.8020556562675596,0.572234762979684,0.5786452353616532,0.8674080410607357,0.8626444159178434,none,0.9188401845596541,0.9171534010773887,0.9498617691268497,COMPLETE
