number,value,datetime_start,datetime_complete,duration,params_alpha,params_booster,params_colsample_bytree,params_gamma,params_grow_policy,params_lambda,params_learning_rate,params_max_delta_step,params_max_depth,params_min_child_weight,params_n_estimators,params_normalize_type,params_params_decision_threshold,params_params_feature_fraction,params_params_resampling,params_params_sample_rows,params_params_scale_pos_weight,params_rate_drop,params_sample_type,params_skip_drop,params_subsample,user_attrs_acc_test,user_attrs_acc_val,user_attrs_decision_threshold,user_attrs_f1_test,user_attrs_f1_val,user_attrs_feature_fraction,user_attrs_pr_auc_test,user_attrs_pr_auc_val,user_attrs_prec_test,user_attrs_prec_val,user_attrs_rec_test,user_attrs_rec_val,user_attrs_resampling_strategy,user_attrs_roc_auc_test,user_attrs_roc_auc_val,user_attrs_sample_rows,state
2761,0.6818666098444491,2025-09-24 02:29:36.614304,2025-09-24 02:29:37.838383,0 days 00:00:01.224079,0.00013603188761418547,gbtree,0.22335265740181334,0.7931056291136611,depthwise,0.00037413413241017715,0.01009897392781344,5,10,0.12853402349598397,300,,0.649932491530418,0.8925402078367246,none,0.809483649382193,3.464770990731143,,,,0.5402775112093807,0.8449175964786569,0.8471539721539721,0.649932491530418,0.6812539448769198,0.6818666098444491,0.8925402078367246,0.766120384302419,0.757609212003729,0.6703933747412009,0.6791171477079796,0.6924721984602225,0.6846384253316218,none,0.9047043752048357,0.9039609421655699,0.809483649382193,COMPLETE
2762,0.6995172968624296,2025-09-24 02:29:37.988555,2025-09-24 02:29:38.961806,0 days 00:00:00.973251,10.903049579398523,gbtree,0.8951054767267568,2.4590628391285008,lossguide,0.5104618827137934,0.035498355471284375,5,11,31.040866506263953,500,,0.31932843622703655,0.6416519838774926,none,0.6967789324927105,0.8686406488878413,,,,0.32663463708268253,0.8446105026102979,0.847051597051597,0.31932843622703655,0.698450536352801,0.6995172968624296,0.6416519838774926,0.7952959957570636,0.7909905827931838,0.6520771513353115,0.6599620493358633,0.7519247219846023,0.7441163885323063,none,0.9128707807293309,0.9125182602781132,0.6967789324927105,COMPLETE
2763,0.6203047216774777,2025-09-24 02:29:39.111728,2025-09-24 02:29:40.883030,0 days 00:00:01.771302,61.35645421219271,gbtree,0.6863739522953396,0.2975663337222665,lossguide,0.0001703247632613649,0.0013696116252683843,6,8,48.21988749719704,1000,,0.6522091987688932,0.5811062731507184,undersample,0.7047314303685501,2.157829472774873,,,,0.7657645752386688,0.7422458798239329,0.7423218673218673,0.6522091987688932,0.6238422467881685,0.6203047216774777,0.5811062731507184,0.7313112384017838,0.7292728907430238,0.4793388429752066,0.4790307548928239,0.893071000855432,0.8797603765511339,undersample,0.887024440075383,0.8831468595373542,0.7047314303685501,COMPLETE
2764,0.46648130985480385,2025-09-24 02:29:41.033941,2025-09-24 02:29:45.133538,0 days 00:00:04.099597,0.06507294022789055,gbtree,0.2956897183832771,0.192160106498795,lossguide,0.8312469183390663,0.0017002915525489947,1,8,0.16743943833886507,600,,0.6973762542445768,0.9704341459931669,none,0.7674599099531585,3.615691385668457,,,,0.9078795020700853,0.8252635889036749,0.8231981981981982,0.6973762542445768,0.4790967348184315,0.46648130985480385,0.9704341459931669,0.7425836628632974,0.7380112278682776,0.8359957401490948,0.8388888888888889,0.33575705731394356,0.323063756953359,none,0.8961047856418197,0.8973844492710485,0.7674599099531585,COMPLETE
2765,0.6666666666666666,2025-09-24 02:29:45.287466,2025-09-24 02:29:47.326198,0 days 00:00:02.038732,0.00044023989497231147,gbtree,0.6504833996817007,3.1797686039964725,lossguide,0.055963379248727615,0.04067315775084457,2,9,1.0044525866701624,1000,,0.6239616674205855,0.9605192584219484,oversample,0.7464987284718584,3.8088852737053482,,,,0.9835649170065349,0.7799160610093152,0.7858312858312858,0.6239616674205855,0.6610970996216898,0.6666666666666666,0.9605192584219484,0.8098322484276699,0.8018869951403035,0.5234648027958063,0.5310992637725311,0.8969204448246364,0.8951647411210955,oversample,0.9146118628421684,0.9136316844969439,0.7464987284718584,COMPLETE
2766,0.6209697892866209,2025-09-24 02:29:47.478201,2025-09-24 02:29:49.038103,0 days 00:00:01.559902,0.0008250271239128988,gbtree,0.3843467589752749,3.668106694541585,lossguide,0.9745520191700571,0.0009639833946163184,0,4,0.6776607011077416,900,,0.6690911758738131,0.9976768644781686,none,0.7733365484749869,4.082161720854355,,,,0.7742542572220583,0.8483979936533934,0.8471539721539721,0.6690911758738131,0.6287290047630986,0.6209697892866209,0.9976768644781686,0.7546596239454864,0.748605472684603,0.7595396729254997,0.7634207240948814,0.5363558597091531,0.5233204963628584,none,0.8992791854436348,0.8968644750935535,0.7733365484749869,COMPLETE
2767,0.694947936752796,2025-09-24 02:29:49.188972,2025-09-24 02:29:50.944639,0 days 00:00:01.755667,0.008957345381901958,gbtree,0.6783204300482641,6.0490562055521675,lossguide,0.10519166064483866,0.02653643679710054,0,9,1.0264553719235925,300,,0.6948452830694585,0.9325413829273593,none,0.9792011606120588,4.659126258516948,,,,0.36242476293474507,0.8443034087419388,0.838042588042588,0.6948452830694585,0.7078932206644901,0.694947936752796,0.9325413829273593,0.800522444722558,0.790956328692223,0.6423841059602649,0.6325026325026325,0.7882805816937554,0.771074026529739,none,0.9167810063016018,0.9125985885148358,0.9792011606120588,COMPLETE
2768,0.716588451336462,2025-09-24 02:29:51.096002,2025-09-24 02:30:18.371735,0 days 00:00:27.275733,0.0029332593696006475,dart,0.5802249948888318,5.486241930270884,lossguide,0.0018706448104337883,0.11136741848911891,1,12,1.1530689273825556,600,forest,0.6766132559523808,0.9806899195281964,none,0.9275330383071331,3.855524407290941,0.14168248050187196,weighted,0.5810360040331338,0.24947883383778818,0.8587368205548163,0.8578009828009828,0.6766132559523808,0.7215496368038741,0.716588451336462,0.9806899195281964,0.821080599023884,0.8159479949264565,0.6829640947288006,0.6848673946957878,0.7647562018819504,0.7513906718014548,none,0.9249027465571767,0.9233105172349557,0.9275330383071331,COMPLETE
2769,0.6166616359794748,2025-09-24 02:30:18.523772,2025-09-24 02:30:20.163707,0 days 00:00:01.639935,0.0008066679831019028,gbtree,0.5673746620564798,0.20811025478759682,depthwise,90.03341989371113,0.3761516829616419,9,7,43.584018479379026,900,,0.5566290393555894,0.6760650756923079,oversample,0.8036296813962416,2.6346314711666925,,,,0.32689474987785017,0.7321117821680827,0.73996723996724,0.5566290393555894,0.6108550185873606,0.6166616359794748,0.6760650756923079,0.6744157944289091,0.6627053741934819,0.468201504444951,0.47633480997901606,0.8785286569717707,0.8741976893453145,oversample,0.8725932125598275,0.8695118179535279,0.8036296813962416,COMPLETE
2770,0.6964549483013294,2025-09-24 02:30:20.321072,2025-09-24 02:30:47.176145,0 days 00:00:26.855073,0.07977600886094664,dart,0.8439806047222157,5.317528775105851,lossguide,0.5943458712111142,0.10429198496102231,1,8,4.685042935067965,600,forest,0.6143151357955079,0.913022088847597,none,0.9918999107996239,4.349099311889731,0.09197598759642771,weighted,0.7237228346942121,0.20949491730050862,0.8317125601392159,0.8316953316953317,0.6143151357955079,0.6996711728169529,0.6964549483013294,0.913022088847597,0.8002983116381821,0.7863934216733897,0.6106505102040817,0.61253653783696,0.8190761334473909,0.8070175438596491,none,0.9178174880413922,0.9125611595873305,0.9918999107996239,COMPLETE
2771,0.6884045915820994,2025-09-24 02:30:47.325925,2025-09-24 02:30:48.084135,0 days 00:00:00.758210,0.04074391263694686,gbtree,0.21156148883855447,5.381393017106602,lossguide,0.0009499768942353557,0.12290406039615362,3,8,2.240522283432758,300,,0.6447682467759533,0.8924740183363018,undersample,0.7688679774239028,2.457580093620291,,,,0.6142651655363207,0.8048930289691882,0.8082514332514332,0.6447682467759533,0.6865131578947369,0.6884045915820994,0.8924740183363018,0.811649841537608,0.804309988115453,0.5577231427044361,0.5631464344039194,0.8926432848588537,0.8853230637569534,undersample,0.9216603991394339,0.9200247756466898,0.7688679774239028,COMPLETE
2772,0.7131698455949137,2025-09-24 02:30:48.235362,2025-09-24 02:30:51.372937,0 days 00:00:03.137575,0.00020936680233775545,gbtree,0.6739902328345854,4.4095159591846365,lossguide,0.3090435337430691,0.016824163129660227,0,8,0.3745730623280383,900,,0.5798955362715994,0.9280029519782425,none,0.7304804722711477,4.611983138525452,,,,0.8565387232298629,0.8327362063670796,0.8383497133497133,0.5798955362715994,0.7066427289048474,0.7131698455949137,0.9280029519782425,0.8265936234664537,0.8215222460640006,0.6089108910891089,0.6196338383838383,0.8417450812660393,0.8399657680787335,none,0.9270707676290535,0.9257125906363074,0.7304804722711477,COMPLETE
2773,0.7224597841580126,2025-09-24 02:30:51.525875,2025-09-24 02:30:53.662648,0 days 00:00:02.136773,0.7631830122394142,gbtree,0.5278682422069996,2.9736881819180896,lossguide,0.004115501840547506,0.029399078321182454,3,10,3.5776869730110317,300,,0.6620126084749081,0.9826897810806441,none,0.9021243363668766,3.605765550047885,,,,0.6519129606167711,0.8590439144231754,0.8604627354627354,0.6620126084749081,0.7223230490018149,0.7224597841580126,0.9826897810806441,0.8268323349487292,0.8219266349199552,0.6833269744372377,0.6891996891996892,0.7660393498716852,0.7590928540864356,none,0.9276989593107459,0.9263597655843545,0.9021243363668766,COMPLETE
2774,0.0,2025-09-24 02:30:53.817026,2025-09-24 02:30:54.665765,0 days 00:00:00.848739,18.98461168708381,gbtree,0.9054185426248623,7.705561312419507,depthwise,0.22101457724448648,0.00016939472007116959,0,3,3.7982165426207244,500,,0.6485581476128365,0.8616003088222146,none,0.510871216965812,0.9479637570502848,,,,0.5274919214213685,0.7606715119254785,0.7607493857493858,0.6485581476128365,0.0,0.0,0.8616003088222146,0.7436838498705101,0.7341960910804228,0.0,0.0,0.0,0.0,none,0.8919598083952056,0.8891767461328863,0.510871216965812,COMPLETE
2775,0.7076066790352504,2025-09-24 02:30:54.822138,2025-09-24 02:31:08.125723,0 days 00:00:13.303585,0.0005113935056483482,dart,0.608150365285699,0.09895495675496946,lossguide,0.0005966675928334073,0.09087544732387716,0,8,10.64776428367312,400,forest,0.6160328061278012,0.8959085730942253,none,0.9734102561950603,4.870404679969211,0.006239247386155953,weighted,0.39149430638771754,0.620949801789409,0.8360118742962432,0.8386568386568387,0.6160328061278012,0.7047548838923701,0.7076066790352504,0.8959085730942253,0.8159430116686894,0.8106525459391852,0.6191709844559585,0.6246315099901736,0.8177929854576561,0.8160034231921267,none,0.9221180742500235,0.9199387466963933,0.9734102561950603,COMPLETE
2776,0.7041591320072332,2025-09-24 02:31:08.276983,2025-09-24 02:31:57.865635,0 days 00:00:49.588652,0.0004770983109750238,dart,0.4545248780663095,0.37965747133383976,lossguide,0.0004796745346955938,0.05326678632679458,7,8,0.11262200455052271,800,tree,0.3347390551579551,0.9835957402789208,none,0.8113987514270063,2.221325721243148,0.09930258229329308,weighted,0.7362938992274196,0.2883052069922646,0.8309960077797113,0.8325143325143325,0.3347390551579551,0.7037502242957114,0.7041591320072332,0.9835957402789208,0.8128512902822963,0.8059481293178412,0.6061823802163833,0.6097713748825556,0.8387510692899914,0.8331193838254172,none,0.9200822071181474,0.9179422877032672,0.8113987514270063,COMPLETE
2777,0.0,2025-09-24 02:31:58.021391,2025-09-24 02:32:01.537353,0 days 00:00:03.515962,1.0580024783112105,dart,0.478892449554699,1.185329844495846,lossguide,0.7278385613968403,0.00027783113582181053,10,4,2.4763761068147887,200,forest,0.5805298839461063,0.9767318421233389,none,0.5338803164218522,3.0481010659023533,0.002181160769589338,weighted,0.650286029182128,0.3221058440917448,0.7606715119254785,0.7607493857493858,0.5805298839461063,0.0,0.0,0.9767318421233389,0.7500599050366538,0.7418622915969998,0.0,0.0,0.0,0.0,none,0.8982679142551163,0.8941480850756067,0.5338803164218522,COMPLETE
2778,0.6952955367913148,2025-09-24 02:32:01.688827,2025-09-24 02:32:19.757917,0 days 00:00:18.069090,0.2675057460116391,dart,0.8279232397046404,1.376117815184418,depthwise,0.01564667498128706,0.029976233473744913,3,7,0.3200082132795753,500,forest,0.6884150322064042,0.9916244739116507,none,0.9717299842683876,2.1160077819562924,0.13677199815520671,weighted,0.6266924885629848,0.5742840347208994,0.8716347630258983,0.8707002457002457,0.6884150322064042,0.699424736337488,0.6952955367913148,0.9916244739116507,0.8300553796730379,0.8219475379360178,0.7955288985823337,0.7970132743362832,0.6240376390076989,0.6166024818142918,none,0.9288073601916647,0.9257745786985524,0.9717299842683876,COMPLETE
2779,0.7048181650359978,2025-09-24 02:32:19.907954,2025-09-24 02:32:23.397369,0 days 00:00:03.489415,0.0002434366882189574,dart,0.8813768060389253,8.814030397968871,depthwise,0.11139115615937722,0.4958030534100033,0,8,20.295480787780424,200,forest,0.6464396242514263,0.9656770414376896,none,0.8905555013489015,4.746965535516941,0.08094322947180492,weighted,0.7829788756681023,0.8154655711894416,0.8388780837342614,0.8363022113022113,0.6464396242514263,0.7112986060161408,0.7048181650359978,0.9656770414376896,0.8203182064768775,0.8093461875253828,0.6226718047527297,0.6198051948051948,0.8293413173652695,0.8168592212237912,none,0.9242435021530847,0.9204000438321533,0.8905555013489015,COMPLETE
2780,0.6193717277486911,2025-09-24 02:32:23.551744,2025-09-24 02:32:25.117022,0 days 00:00:01.565278,0.004734184795355346,gbtree,0.47477561113418637,2.1984624065809335,depthwise,5.543843636615732,0.0007336913251215373,8,7,3.285605527115903,700,,0.46306398769588447,0.8719589608265697,oversample,0.8883445335119109,0.5482181462625088,,,,0.7523555078205785,0.8530044016787798,0.8511466011466011,0.46306398769588447,0.6287487073422957,0.6193717277486911,0.8719589608265697,0.7763619606047518,0.7707983864162995,0.7947712418300653,0.7977073499662846,0.5201026518391788,0.5062045357295678,oversample,0.9081136993560027,0.906905389517954,0.8883445335119109,COMPLETE
2781,0.0,2025-09-24 02:32:25.274690,2025-09-24 02:32:31.666317,0 days 00:00:06.391627,0.00018658656808289152,dart,0.9300967129855178,5.681290685647306,depthwise,6.082037120286008,0.00013667357255210883,1,3,0.28350917181720997,300,forest,0.6896428265698862,0.9732055567911553,none,0.8428497547162417,4.822315869533465,0.12701692803977468,weighted,0.5165714290831496,0.3424079378047268,0.7606715119254785,0.7607493857493858,0.6896428265698862,0.0,0.0,0.9732055567911553,0.6595576460186898,0.6509695874435494,0.0,0.0,0.0,0.0,none,0.8787801581219589,0.8767379618636082,0.8428497547162417,COMPLETE
2782,0.6766122766122766,2025-09-24 02:32:31.821824,2025-09-24 02:32:39.541537,0 days 00:00:07.719713,0.010490185653336113,dart,0.6092272501156949,3.347440350359913,lossguide,0.0002269212421639179,0.09586737330688538,3,7,7.9251923818939005,300,forest,0.5286372043323623,0.9711773747190149,oversample,0.9460537456041819,3.5316055213091313,0.11993804866870578,weighted,0.6971079949463976,0.6635353081630669,0.7810420718599652,0.786957411957412,0.5286372043323623,0.6709736963544071,0.6766122766122766,0.9711773747190149,0.8263005357815822,0.8198585296789697,0.5239010329089598,0.5312347486578819,0.9328485885372113,0.9315361574668378,oversample,0.9270115688802334,0.9250685827513567,0.9460537456041819,COMPLETE
2783,0.5952060328575276,2025-09-24 02:32:39.691755,2025-09-24 02:33:36.592520,0 days 00:00:56.900765,0.0010865011214757736,dart,0.6685604014273625,2.3511506396392368,lossguide,0.16742688095893038,0.0003349236277153141,0,10,11.193805495438983,900,forest,0.3632662032821675,0.8328938638668396,undersample,0.6949730578053438,0.6721457802256587,0.07052592603948332,weighted,0.523278541108322,0.23688399458447595,0.6855358788002867,0.6922604422604423,0.3632662032821675,0.5908364411294619,0.5952060328575276,0.8328938638668396,0.7308503367991819,0.7208166222068833,0.4290135396518375,0.4342699941049322,0.9486740804106074,0.9456568249893025,undersample,0.8910861016302939,0.8896837353516854,0.6949730578053438,COMPLETE
2784,0.38612143742255267,2025-09-24 02:33:36.745625,2025-09-24 02:33:37.918751,0 days 00:00:01.173126,29.2649889100512,gbtree,0.5069588785323772,1.489689120062645,depthwise,0.00011086656602956253,0.0004568728390111373,4,9,0.1073284468909075,700,,0.615844470143275,0.6945468990905627,undersample,0.8273139591490766,4.772256493867341,,,,0.23202037593295033,0.23932848807452145,0.23925061425061425,0.615844470143275,0.3862228462872718,0.38612143742255267,0.6945468990905627,0.6922188676448212,0.6847448880657072,0.23932848807452145,0.23925061425061425,1.0,1.0,undersample,0.876620569346341,0.8750709925984583,0.8273139591490766,COMPLETE
2785,0.7215189873417721,2025-09-24 02:33:38.070599,2025-09-24 02:33:39.340999,0 days 00:00:01.270400,0.0002360068728221278,gbtree,0.4375881676421015,5.31724148005496,lossguide,1.8487220641464248,0.06549064459040173,0,10,3.35776733340138,900,,0.6725261294246605,0.9491691538383544,none,0.8533154162117339,3.177184523654397,,,,0.9402124022204867,0.8654928856587163,0.8648648648648649,0.6725261294246605,0.7238335435056746,0.7215189873417721,0.9491691538383544,0.8274274272355714,0.8205191001876976,0.7115702479338843,0.7116104868913857,0.7365269461077845,0.7317073170731707,none,0.9276143485564772,0.9260816398615084,0.8533154162117339,COMPLETE
2786,0.642587757470264,2025-09-24 02:33:39.494722,2025-09-24 02:33:40.566415,0 days 00:00:01.071693,0.33679661894519614,gbtree,0.9569022364056251,9.409213641772933,lossguide,7.217719874205799,0.06209457464360201,10,6,82.40816982166915,800,,0.4818274314186279,0.9852774017046986,oversample,0.7525314302097678,2.933023356118534,,,,0.5825553702838608,0.7432695260517965,0.7477477477477478,0.4818274314186279,0.6383040092298817,0.642587757470264,0.9852774017046986,0.8057180562054543,0.7981740290734046,0.48150565709312443,0.48606539389949527,0.946535500427716,0.9477963200684638,oversample,0.9193867297413938,0.9168908515466812,0.7525314302097678,COMPLETE
2787,0.7030123037759864,2025-09-24 02:33:40.717546,2025-09-24 02:33:42.237640,0 days 00:00:01.520094,0.00017769574832116617,gbtree,0.5834252219274219,3.536139088047486,lossguide,0.09494337886333429,0.030284096373439633,2,5,1.552300485082807,1000,,0.6874666459401291,0.8872916171109184,none,0.6871104983663336,3.309705437924205,,,,0.8403392730906897,0.8620124884839799,0.8566748566748567,0.6874666459401291,0.7169256614867703,0.7030123037759864,0.8872916171109184,0.8096964263860378,0.7969041035242772,0.7042079207920792,0.6970971813209929,0.7301112061591104,0.7090286692340607,none,0.9209134933892525,0.9170150580030332,0.6871104983663336,COMPLETE
2788,0.710126582278481,2025-09-24 02:33:42.391830,2025-09-24 02:34:59.346447,0 days 00:01:16.954617,0.0030463168851098343,dart,0.5504119187991132,0.7586705242486935,lossguide,0.1375064419162119,0.03289862168952494,0,9,1.1714257298552295,1000,forest,0.6456846744023396,0.9108560783595996,none,0.5381887394792376,3.954745428663882,0.06830385670076575,weighted,0.6553325839408718,0.9294049827555594,0.8586344559320299,0.8593366093366094,0.6456846744023396,0.7130687720756285,0.710126582278481,0.9108560783595996,0.8166173411658542,0.8105609303170868,0.6933333333333334,0.700374531835206,0.7339606501283148,0.7201540436456996,none,0.9208557048196703,0.9196474920574376,0.5381887394792376,COMPLETE
2789,0.6906167979002624,2025-09-24 02:34:59.496421,2025-09-24 02:35:03.325079,0 days 00:00:03.828658,0.00015950080709400375,dart,0.97750017158125,7.96009289953454,lossguide,13.036211808346883,0.21815399909219224,2,7,1.6381718301642931,200,forest,0.6758310293399981,0.9716503965062566,oversample,0.9843227917742647,3.6327125475502022,0.13019041126362574,weighted,0.6704770809183471,0.8755630154253851,0.8017197256628109,0.806920556920557,0.6758310293399981,0.6845790587852142,0.6906167979002624,0.9716503965062566,0.8232141919241096,0.8149008683587824,0.552721535629766,0.5599893588720405,0.8990590248075278,0.9007274283269149,oversample,0.9259730150403386,0.9235665886820565,0.9843227917742647,COMPLETE
2790,0.6234463276836159,2025-09-24 02:35:03.479060,2025-09-24 02:35:07.121038,0 days 00:00:03.641978,0.14760346554761458,dart,0.2298852910423601,9.416862168049732,lossguide,21.87913805963275,0.029720810363551762,7,8,54.320934406136125,200,forest,0.3618093706937893,0.8542894556957703,none,0.8446098931969208,4.093903285942529,0.0661618569627217,weighted,0.8929327921698188,0.6303659203538592,0.7205445797932235,0.7270679770679771,0.3618093706937893,0.6190343287747697,0.6234463276836159,0.8542894556957703,0.7793448730628697,0.7711940882245018,0.45940347970173984,0.46531730971958674,0.9486740804106074,0.9443731279418057,none,0.908624903719293,0.9069598054202501,0.8446098931969208,COMPLETE
2791,0.6501835985312118,2025-09-24 02:35:07.277080,2025-09-24 02:35:57.449363,0 days 00:00:50.172283,51.18801765483718,dart,0.22133267975676596,8.974158713322142,depthwise,0.0579657125999263,0.018118333664629,5,3,6.738301137427462,900,forest,0.4530136633519595,0.9865250950225403,none,0.5624329075489345,1.0569270113655274,0.18316719965133116,weighted,0.5640708536974832,0.8620949618307703,0.8554611526256526,0.8537059787059788,0.4530136633519595,0.6592664092664092,0.6501835985312118,0.9865250950225403,0.7793919045495497,0.7752834721683698,0.7563676633444075,0.7597254004576659,0.5842600513259196,0.5682498930252461,none,0.9053310415906177,0.9043033304777941,0.5624329075489345,COMPLETE
2792,0.7065368567454798,2025-09-24 02:35:57.606697,2025-09-24 02:35:58.432628,0 days 00:00:00.825931,0.003688022033313712,gbtree,0.6411545183929837,8.449878167213395,depthwise,0.0026490922930336685,0.10866218164439842,4,11,0.12931290479361712,500,,0.6524584681062854,0.9663479017392658,none,0.9855061044045491,1.9842746626311127,,,,0.6656683974651445,0.8722489507626164,0.8703931203931204,0.6524584681062854,0.7117782909930715,0.7065368567454798,0.9663479017392658,0.8276871018686396,0.819855776876508,0.7735943775100401,0.7708649468892261,0.6591103507271172,0.6521181001283697,none,0.9270486364487704,0.9254333420456359,0.9855061044045491,COMPLETE
