number,value,datetime_start,datetime_complete,duration,params_alpha,params_booster,params_colsample_bytree,params_gamma,params_grow_policy,params_lambda,params_learning_rate,params_max_delta_step,params_max_depth,params_min_child_weight,params_n_estimators,params_normalize_type,params_params_decision_threshold,params_params_feature_fraction,params_params_resampling,params_params_sample_rows,params_params_scale_pos_weight,params_rate_drop,params_sample_type,params_skip_drop,params_subsample,user_attrs_acc_test,user_attrs_acc_val,user_attrs_decision_threshold,user_attrs_f1_test,user_attrs_f1_val,user_attrs_feature_fraction,user_attrs_pr_auc_test,user_attrs_pr_auc_val,user_attrs_prec_test,user_attrs_prec_val,user_attrs_rec_test,user_attrs_rec_val,user_attrs_resampling_strategy,user_attrs_roc_auc_test,user_attrs_roc_auc_val,user_attrs_sample_rows,state
2174,0.6831017480950247,2025-09-23 23:54:10.344519,2025-09-23 23:54:11.900803,0 days 00:00:01.556284,0.00013574259685992038,gbtree,0.4087682074655026,1.588237833566391,lossguide,0.04168608877945134,0.0031878908921205455,2,5,0.4201712592633858,600,,0.6421137697391738,0.9651813152727147,none,0.7178674243474181,3.2727036223317567,,,,0.7840410586484207,0.8555635172484389,0.8552416052416052,0.6421137697391738,0.6865141079760053,0.6831017480950247,0.9651813152727147,0.787565520456662,0.7817733572674099,0.7142857142857143,0.7171764705882353,0.6608212147134302,0.6521181001283697,none,0.9112351742676479,0.9102967958477155,0.7178674243474181,COMPLETE
2175,0.7226162332545312,2025-09-23 23:54:12.045202,2025-09-23 23:54:47.810283,0 days 00:00:35.765081,0.00033819585019400115,dart,0.7814941173419556,6.081986738369036,depthwise,0.0003605424988568541,0.09181856135278212,0,12,2.722585963521149,700,forest,0.6876528303900314,0.9530264946457536,none,0.8532928778062008,4.860550176836765,0.07680321136087354,weighted,0.7103789085148183,0.5419935018598038,0.8529020370559934,0.8558558558558559,0.6876528303900314,0.7170702894270525,0.7226162332545312,0.9530264946457536,0.8211252829079001,0.8190469323209262,0.6643560744253922,0.669587440671778,0.7788708297690333,0.7847667950363714,none,0.9243437399956416,0.9245495299013081,0.8532928778062008,COMPLETE
2176,0.7036958817317845,2025-09-23 23:54:47.952631,2025-09-23 23:54:50.227031,0 days 00:00:02.274400,0.000219020896189364,gbtree,0.30039197438833853,3.565503643192141,lossguide,0.0008914655795958252,0.01757653644605044,0,7,0.21382708064190104,800,,0.6118311888036746,0.989151652362722,none,0.868606111160177,2.4302000227681586,,,,0.9041960144846682,0.8628314054662709,0.8563677313677314,0.6118311888036746,0.719195305951383,0.7036958817317845,0.989151652362722,0.811127996470697,0.7978049322357045,0.705012325390304,0.6947456213511259,0.7339606501283148,0.7128797603765511,none,0.9225344224751949,0.9178077738961101,0.868606111160177,COMPLETE
2177,0.7141306707184719,2025-09-23 23:54:50.371042,2025-09-23 23:54:52.487913,0 days 00:00:02.116871,0.00010451317718522884,gbtree,0.7085947529953421,1.9435041798727968,depthwise,0.00040054740827108606,0.011237227127296651,6,12,0.18801717330580722,600,,0.6135086602742039,0.8937207577198948,none,0.8142128962359398,2.429007928219017,,,,0.49824563572598335,0.8641621455624936,0.8651719901719902,0.6135086602742039,0.7143164693218514,0.7141306707184719,0.8937207577198948,0.8200274694357645,0.8162161042891976,0.7191157347204161,0.724669603524229,0.7095808383233533,0.7038938810440736,none,0.9226104282581961,0.9216990291569618,0.8142128962359398,COMPLETE
2178,0.7033697199810157,2025-09-23 23:54:52.632082,2025-09-23 23:55:19.627341,0 days 00:00:26.995259,0.00013312860525593968,dart,0.8188659883858678,6.232852471419093,depthwise,0.002056465560446701,0.01636130591462477,0,11,1.8334104287113817,600,forest,0.63732528797758,0.9468132592375821,none,0.9593861774906431,1.755120262716533,0.08214488125013246,weighted,0.6165854250815753,0.38868712984947507,0.8713276691575391,0.872031122031122,0.63732528797758,0.705137227304715,0.7033697199810157,0.9468132592375821,0.8246292903808616,0.8176563071396131,0.7807792207792208,0.7895578050079914,0.6428571428571429,0.6341463414634146,none,0.9260448478439626,0.9238131301483848,0.9593861774906431,COMPLETE
2179,0.7074391988555079,2025-09-23 23:55:19.774340,2025-09-23 23:55:56.689007,0 days 00:00:36.914667,0.0006375261668620543,dart,0.812801103428331,7.4217853643788105,depthwise,0.0024626367282226274,0.011967538073463556,0,12,2.3695912534815164,700,forest,0.6859974300445234,0.9741793154108356,oversample,0.8381326021021511,2.3228855478851673,0.09605529933229164,weighted,0.6314099621607789,0.47085084371159486,0.8320196540075749,0.8325143325143325,0.6859974300445234,0.7090941322460557,0.7074391988555079,0.9741793154108356,0.8246600483323931,0.8179967768859907,0.6055101422948834,0.6076804915514593,0.8554319931565441,0.8463842533162174,oversample,0.9264846223119825,0.9243656962842921,0.8381326021021511,COMPLETE
2180,0.7096342551293487,2025-09-23 23:55:56.832616,2025-09-23 23:56:52.882511,0 days 00:00:56.049895,0.00026175143476152144,dart,0.9617646928892559,8.594886123592794,depthwise,0.0008849431463990935,0.19470250559916283,1,11,0.9753318593313748,900,forest,0.595652970677794,0.965374406454885,none,0.8199295755242229,1.9575295079877897,0.10914079796167526,weighted,0.5062195105219442,0.4462391292711697,0.8656976149042891,0.8667076167076168,0.595652970677794,0.7096060203629925,0.7096342551293487,0.965374406454885,0.8146175186399354,0.8078399409773959,0.7353211009174312,0.7410340009315324,0.6856287425149701,0.6807873341891314,none,0.921194464407594,0.9195004539553077,0.8199295755242229,COMPLETE
2181,0.6774826172223213,2025-09-23 23:56:53.024518,2025-09-23 23:57:00.493433,0 days 00:00:07.468915,0.000330626096952863,dart,0.6912577627377966,3.6187273257507298,lossguide,0.01265666208747971,0.24652074688669967,7,9,3.4525832665624754,300,forest,0.5852351349492645,0.9613826167277328,none,0.9472566740642627,4.45304584944225,0.07110144624674064,weighted,0.7375236986233561,0.8886975316508298,0.8098065308629337,0.8148034398034398,0.5852351349492645,0.6706841545551223,0.6774826172223213,0.9613826167277328,0.7480799154020845,0.7457730568787383,0.572639225181598,0.5806845965770171,0.8092386655260907,0.8130081300813008,none,0.8973308069828393,0.8992371235995895,0.9472566740642627,COMPLETE
2182,0.6793552812071331,2025-09-23 23:57:00.637577,2025-09-23 23:57:01.273708,0 days 00:00:00.636131,0.0010084437160310334,gbtree,0.25295312205894893,0.538733364450569,lossguide,0.0002994331109860809,0.02900044976489545,1,3,0.142791342649614,200,,0.6132770955991217,0.8839494420894854,none,0.928361604475558,4.825082709536332,,,,0.6583837854082001,0.8022315487767427,0.8085585585585585,0.6132770955991217,0.6752941176470588,0.6793552812071331,0.8839494420894854,0.7819304279041474,0.778744513375976,0.5562015503875969,0.5668097281831187,0.8592814371257484,0.8476679503637141,none,0.9084326876554292,0.9083676513411332,0.928361604475558,COMPLETE
2183,0.6511418269230769,2025-09-23 23:57:01.417035,2025-09-23 23:57:09.406844,0 days 00:00:07.989809,0.0005769089557222033,dart,0.41358073801393447,2.7540360795956382,lossguide,0.00020716597177105627,0.017622206661479137,4,12,5.652549356008328,300,forest,0.5814139949164391,0.8842346360072874,undersample,0.796368392359414,3.0890743632108046,0.09858043966460299,weighted,0.6182642623184731,0.7968176564214945,0.7572934793735285,0.7622850122850123,0.5814139949164391,0.6473300609846795,0.6511418269230769,0.8842346360072874,0.8030284553179209,0.7954714308316029,0.49623717217787916,0.5017365130817318,0.93071000855432,0.9272571673085152,undersample,0.9170989297718076,0.9145302378804125,0.796368392359414,COMPLETE
2184,0.6720306513409962,2025-09-23 23:57:09.549063,2025-09-23 23:57:11.907356,0 days 00:00:02.358293,0.0021262125968579573,gbtree,0.7143547829004115,0.1495842186824059,depthwise,0.00014289688709231163,0.006508351799355306,3,12,0.13518201351153258,300,,0.6198035161949212,0.7735321225931981,none,0.8763747183650645,4.277107236908009,,,,0.6686115767041058,0.8214760978605794,0.8247338247338247,0.6198035161949212,0.6674294431731502,0.6720306513409962,0.7735321225931981,0.7429730008965074,0.7358315568921472,0.6022023399862354,0.608394033992369,0.7485029940119761,0.7505348737697903,none,0.8952872270339072,0.8959773807201982,0.8763747183650645,COMPLETE
2185,0.5842523724031803,2025-09-23 23:57:12.050453,2025-09-23 23:57:16.402918,0 days 00:00:04.352465,0.012675421557204603,gbtree,0.31844427966823063,3.1515761134884093,lossguide,0.0019066157832111953,0.0019212058757282948,1,8,0.4486454101793654,700,,0.6484638029960355,0.9868236610293755,oversample,0.927062376706091,4.983480450035871,,,,0.7269888471051045,0.662094380182209,0.6680999180999181,0.6484638029960355,0.5794368709389731,0.5842523724031803,0.9868236610293755,0.7575644358100846,0.7511858794787789,0.4126292868807839,0.41713971800036626,0.9726261762189906,0.9747539580658965,oversample,0.902649456263665,0.9025442284680161,0.927062376706091,COMPLETE
2186,0.7048722044728435,2025-09-23 23:57:16.545868,2025-09-23 23:58:14.914704,0 days 00:00:58.368836,0.0007525378259770655,dart,0.9404487023879788,9.103977389072536,depthwise,0.00012877809473359854,0.005817877677739857,0,10,24.062594735478932,900,forest,0.6789382149316361,0.8518158677275409,none,0.949523017551112,3.778852584095218,0.48840361503719926,uniform,0.8860094663856144,0.5789624674284308,0.8513665677141979,0.8486895986895987,0.6789382149316361,0.7129300118623962,0.7048722044728435,0.8518158677275409,0.8120223681287042,0.8033672714011706,0.6628676470588235,0.6608011980531636,0.7711719418306244,0.7552417629439452,none,0.9208098020465212,0.9178625640876812,0.949523017551112,COMPLETE
2187,0.6941489361702128,2025-09-23 23:58:15.067093,2025-09-23 23:58:18.810149,0 days 00:00:03.743056,0.0019002246505170463,dart,0.9151198590725875,9.76997133302912,depthwise,0.00012434134234802046,0.09254557481273008,0,12,2.0020984272150777,200,forest,0.6464003068870999,0.9953814885835434,oversample,0.930394919302448,3.040952421197864,0.08123329829089936,weighted,0.7023654899707178,0.42587099141161733,0.8047906643464019,0.8116298116298116,0.6464003068870999,0.6864002631146193,0.6941489361702128,0.9953814885835434,0.822768500651346,0.8170576002408476,0.5575741383916645,0.5675455286762707,0.8926432848588537,0.8934531450577664,oversample,0.9253715592058286,0.9240524449525566,0.930394919302448,COMPLETE
2188,0.7232272821792473,2025-09-23 23:58:18.954453,2025-09-23 23:58:22.622065,0 days 00:00:03.667612,0.0007910684553827537,dart,0.34141759775530456,4.188380305952556,depthwise,0.00021515505830877282,0.10007023707166399,2,11,0.6242447958538703,200,forest,0.6451231113668037,0.9570409827880033,none,0.9740457642856091,3.1637948230739985,0.10591358277715641,weighted,0.6145623246769008,0.8396290346568808,0.8627290408434845,0.8637387387387387,0.6451231113668037,0.7241308372762806,0.7232272821792473,0.9570409827880033,0.8279870270661247,0.8211228530634073,0.6975822433610781,0.7034789644012945,0.7527801539777588,0.7441163885323063,none,0.9280484247492098,0.9257400289193168,0.9740457642856091,COMPLETE
2189,0.7164480322906155,2025-09-23 23:58:22.773600,2025-09-23 23:58:24.025814,0 days 00:00:01.252214,0.0004657519561942183,gbtree,0.27121905146569464,1.7078883615120257,lossguide,0.035588834450128594,0.06480714870327053,0,6,0.6358957750538881,400,,0.676595871882979,0.8146831001783394,none,0.724458967908661,4.074867054626388,,,,0.7762339269283298,0.8556658818712253,0.8561629811629812,0.676595871882979,0.7167537163519486,0.7164480322906155,0.8146831001783394,0.8239963417001834,0.8187074759503088,0.6757575757575758,0.6779984721161192,0.7630453378956373,0.7595207531022679,none,0.9260266881888798,0.9249134542425891,0.724458967908661,COMPLETE
2190,0.7202082171407325,2025-09-23 23:58:24.170093,2025-09-23 23:59:26.974119,0 days 00:01:02.804026,0.0017984920073037627,dart,0.2673460080209759,0.6956232150989541,lossguide,0.00032442365184300243,0.014203659566259016,8,8,0.2601479013054014,900,forest,0.36986677824601294,0.9873457566130611,none,0.991690817667927,1.5208468048864339,0.04108574923098381,weighted,0.8234500222429366,0.472390367602169,0.8454294195925888,0.8459254709254709,0.36986677824601294,0.7218128224023581,0.7202082171407325,0.9873457566130611,0.8318974941633523,0.8247591850765983,0.6339805825242718,0.6367521367521367,0.8378956372968349,0.8288403936670946,none,0.9289505653322226,0.9271704761541167,0.991690817667927,COMPLETE
2191,0.7257966308098234,2025-09-23 23:59:27.124961,2025-09-23 23:59:28.395220,0 days 00:00:01.270259,0.0002604317317916508,gbtree,0.37195253428487435,2.1046562540967226,lossguide,0.009738959401974966,0.05321016644404501,1,5,0.9312354271739071,600,,0.6411582590563069,0.9993110235825726,none,0.9344468171578503,3.3146115638876457,,,,0.8438313903286638,0.8603746545193981,0.8616912366912367,0.6411582590563069,0.7254428341384863,0.7257966308098234,0.9993110235825726,0.8316783525285907,0.8242655160028739,0.685171102661597,0.6903474903474903,0.7707442258340462,0.7650834403080873,none,0.929267596648217,0.9276090280185467,0.9344468171578503,COMPLETE
2192,0.6962328767123288,2025-09-23 23:59:28.541500,2025-09-24 00:00:04.230076,0 days 00:00:35.688576,0.00017961753240914124,dart,0.5472150743011412,3.282633682715925,depthwise,0.0009568980439461474,0.023687451964780774,2,10,1.1914125917248612,700,forest,0.6399388845437873,0.8021014033136761,undersample,0.7697651465413318,2.0503451641531356,0.017147752735865787,weighted,0.8122989409007095,0.6071988752270552,0.8145153035111066,0.8183865683865684,0.6399388845437873,0.6924643584521385,0.6962328767123288,0.8021014033136761,0.815090618300998,0.809865848783762,0.5740011254924029,0.5803596916928347,0.8725406330196749,0.8699186991869918,undersample,0.9227547270071426,0.9214138783123375,0.7697651465413318,COMPLETE
2193,0.6779359430604982,2025-09-24 00:00:04.373540,2025-09-24 00:00:28.310590,0 days 00:00:23.937050,0.0016594103425222986,dart,0.9379232166966026,9.631453398768764,depthwise,0.00011985549868404696,0.2856728079498753,0,12,59.86646527657987,600,tree,0.6587375924242517,0.8464493335098429,none,0.8820989210295088,2.428692977865775,0.15066847411614648,weighted,0.740434141152107,0.3903518101141463,0.8531067663015662,0.8517608517608518,0.6587375924242517,0.6853760140320105,0.6779359430604982,0.8464493335098429,0.7875596093900237,0.7805938183974834,0.7031039136302294,0.7058823529411765,0.6685201026518391,0.6521181001283697,none,0.9102188667247084,0.9068260114001603,0.8820989210295088,COMPLETE
2194,0.7133017649591046,2025-09-24 00:00:28.454662,2025-09-24 00:00:54.422087,0 days 00:00:25.967425,0.00027881247212156057,dart,0.8336380003099187,7.2136993732308,depthwise,0.00014870162045916413,0.059327412046832964,2,9,7.157026079280777,600,forest,0.6681299477400807,0.8868220201004744,none,0.9639489512238434,2.9398363810893358,0.07088852894072065,weighted,0.7448788917354289,0.6715580005169982,0.8648786979219981,0.8636363636363636,0.6681299477400807,0.7162510748065348,0.7133017649591046,0.8868220201004744,0.8242331167978252,0.8171079324712176,0.7199654278305964,0.7176266782156778,0.7125748502994012,0.7090286692340607,none,0.9264402448347437,0.9234212780688886,0.9639489512238434,COMPLETE
2195,0.7180156657963447,2025-09-24 00:00:54.567520,2025-09-24 00:00:55.887323,0 days 00:00:01.319803,0.0004794842665458247,gbtree,0.410587207802036,1.2089411393333653,lossguide,0.0012411691954948981,0.11759518088291007,1,7,4.1375506166689195,800,,0.6990499685596947,0.9813330040127248,none,0.7654200225418345,3.3103266781915193,,,,0.9536496994938007,0.8655952502815027,0.8673218673218673,0.6990499685596947,0.7149989146950293,0.7180156657963447,0.9813330040127248,0.8218206687886436,0.8191326971007301,0.7258704275011018,0.7304116865869854,0.704448246364414,0.7060333761232349,none,0.9248345687079039,0.9246557704724572,0.7654200225418345,COMPLETE
2196,0.7174995022894685,2025-09-24 00:00:56.034523,2025-09-24 00:00:57.412285,0 days 00:00:01.377762,0.0005786777248541008,gbtree,0.349303434395844,2.10812841776511,lossguide,0.2712988214481184,0.021907197448906096,3,5,1.4326160038724358,600,,0.571367872520826,0.9931588911615924,none,0.993220225215639,2.558186302477155,,,,0.7766703523340825,0.8560753403623708,0.8547297297297297,0.571367872520826,0.7218045112781954,0.7174995022894685,0.9931588911615924,0.8301773440105731,0.8220218583717611,0.6715758468335787,0.6708860759493671,0.7801539777587682,0.771074026529739,none,0.928491221029882,0.9264475796065782,0.993220225215639,COMPLETE
2197,0.7051863537763755,2025-09-24 00:00:57.559971,2025-09-24 00:00:58.581080,0 days 00:00:01.021109,0.00012209518646242996,gbtree,0.5025761112734335,1.335539199659783,lossguide,0.41432788032441453,0.06522340470951074,1,4,6.0780253423962405,600,,0.6864058565949622,0.9000414687475172,none,0.8684180726490133,4.175701907705149,,,,0.9660211514791194,0.8482956290306071,0.846949221949222,0.6864058565949622,0.7109984399375975,0.7051863537763755,0.9000414687475172,0.8087069458223246,0.7973482174084372,0.6534050179211469,0.653986832479883,0.77972626176219,0.7650834403080873,none,0.9209216666729982,0.9176825021548987,0.8684180726490133,COMPLETE
2198,0.717018732562774,2025-09-24 00:00:58.727130,2025-09-24 00:00:59.882735,0 days 00:00:01.155605,0.0005042295912275544,gbtree,0.3835961902136242,2.435392947540295,lossguide,0.0012818665816796506,0.13089581254084098,1,4,3.8236784955267997,800,,0.5803641686313512,0.9635032947952741,none,0.8823380767400292,2.629300634422638,,,,0.5595784796765477,0.8540280479066434,0.8546273546273546,0.5803641686313512,0.7169511710996427,0.717018732562774,0.9635032947952741,0.8186683396454001,0.8149283521230353,0.6688888888888889,0.6710182767624021,0.7724550898203593,0.7697903294822422,none,0.9222837559208822,0.9206978053461983,0.8823380767400292,COMPLETE
2199,0.7073853692684634,2025-09-24 00:01:00.031463,2025-09-24 00:01:44.006268,0 days 00:00:43.974805,0.002912085147201997,dart,0.8071259087835978,8.233762563681871,depthwise,0.04404706951222029,0.28068990419107137,0,12,10.701687387945086,800,forest,0.5267388721199777,0.9438444344777092,none,0.9816423497238029,3.7435220631267505,0.10743921888418291,weighted,0.7993213548220697,0.6066241041711559,0.8236257549390931,0.8288288288288288,0.5267388721199777,0.70205775549023,0.7073853692684634,0.9438444344777092,0.8219528277534865,0.8157042293902572,0.5892597968069666,0.598460171750074,0.8682634730538922,0.8647839109970047,none,0.9257473288039528,0.9234915580781501,0.9816423497238029,COMPLETE
2200,0.7196783560419924,2025-09-24 00:01:44.149939,2025-09-24 00:01:51.728745,0 days 00:00:07.578806,0.0018983680306715565,dart,0.3888574305491749,2.7484980123911242,lossguide,0.000801415164586592,0.1408149024276233,4,10,6.2198220006486045,300,tree,0.6891570495148266,0.9557021779274248,none,0.8737978289130945,2.84599856633423,0.1094383919999706,weighted,0.5285011783150788,0.9651919763591044,0.8708158460436073,0.8715192465192465,0.6891570495148266,0.7194308581591818,0.7196783560419924,0.9557021779274248,0.8268053120918688,0.8202917073467623,0.7490740740740741,0.752803738317757,0.6920444824636441,0.6893453145057766,none,0.9277515100717303,0.9253907018597627,0.8737978289130945,COMPLETE
2201,0.6625520752970221,2025-09-24 00:01:51.871728,2025-09-24 00:01:56.058137,0 days 00:00:04.186409,0.00011516069885288848,gbtree,0.25112844421185854,5.248251529818396,lossguide,0.11903178342691523,0.01067110714198292,2,10,0.6782411268416221,500,,0.6480670378137687,0.7860711318931841,oversample,0.980291878397546,4.317835655846287,,,,0.9384138360369256,0.7726481727914832,0.7761056511056511,0.6480670378137687,0.6602417010861251,0.6625520752970221,0.7860711318931841,0.789879181342195,0.7836467311358637,0.5139318885448917,0.5180984555984556,0.9230111206159111,0.9186991869918699,oversample,0.9141275382219011,0.9133885980085391,0.980291878397546,COMPLETE
2202,0.6795483061480552,2025-09-24 00:01:56.205624,2025-09-24 00:02:04.071927,0 days 00:00:07.866303,0.00010167587795138175,gbtree,0.3230902123948515,0.37918797063138343,lossguide,0.00022815196116761287,0.008152772875825411,5,11,0.30617136130239314,600,,0.5722395601796946,0.904682118172492,none,0.933460313513821,1.1347235582855855,,,,0.36394514249554627,0.8692803767018119,0.8692669942669943,0.5722395601796946,0.6790650917315908,0.6795483061480552,0.904682118172492,0.8228583526801947,0.8160831995182556,0.8232784887263863,0.8216019417475728,0.5778443113772455,0.5793752674368849,none,0.9253773725977885,0.923465588160758,0.933460313513821,COMPLETE
2203,0.7205580631924497,2025-09-24 00:02:04.216254,2025-09-24 00:02:07.909160,0 days 00:00:03.692906,0.00012915068914112816,dart,0.7935431282902747,4.251059304858556,depthwise,0.003811654343503726,0.2870585000981915,2,12,0.7267436539788582,200,forest,0.6249413308438452,0.9956691610447932,none,0.9950504360184186,3.0440846405737707,0.0841817181453646,weighted,0.6753461858649403,0.5463807881950236,0.8559729757395844,0.8605651105651105,0.6249413308438452,0.7133835811774292,0.7205580631924497,0.9956691610447932,0.8175720107189965,0.8186339617917795,0.6810579541034617,0.6921560898699252,0.7489307100085543,0.7513906718014548,none,0.9225531864928083,0.9238575266147026,0.9950504360184186,COMPLETE
2204,0.7040110650069157,2025-09-24 00:02:08.052990,2025-09-24 00:02:09.053928,0 days 00:00:01.000938,0.0009941274510220218,gbtree,0.27362129298746685,1.1561537510155298,lossguide,0.005226020024050056,0.23513156780087707,0,5,3.586444202682947,600,,0.6858122188476959,0.9027094615467633,none,0.9708368846045722,2.341346090862418,,,,0.8913317236869737,0.8698945644385301,0.8685503685503686,0.6858122188476959,0.7076144467448815,0.7040110650069157,0.9027094615467633,0.820817405990918,0.8192763771870393,0.7655550024888004,0.7631184407796102,0.6578272027373824,0.6534017971758665,none,0.924725322985726,0.9237592900757429,0.9708368846045722,COMPLETE
