number,value,datetime_start,datetime_complete,duration,params_alpha,params_booster,params_colsample_bytree,params_gamma,params_grow_policy,params_lambda,params_learning_rate,params_max_delta_step,params_max_depth,params_min_child_weight,params_n_estimators,params_normalize_type,params_params_decision_threshold,params_params_feature_fraction,params_params_resampling,params_params_sample_rows,params_params_scale_pos_weight,params_rate_drop,params_sample_type,params_skip_drop,params_subsample,user_attrs_acc_test,user_attrs_acc_val,user_attrs_decision_threshold,user_attrs_f1_test,user_attrs_f1_val,user_attrs_feature_fraction,user_attrs_pr_auc_test,user_attrs_pr_auc_val,user_attrs_prec_test,user_attrs_prec_val,user_attrs_rec_test,user_attrs_rec_val,user_attrs_resampling_strategy,user_attrs_roc_auc_test,user_attrs_roc_auc_val,user_attrs_sample_rows,state
2668,0.6540746382330541,2025-09-24 02:08:59.556635,2025-09-24 02:09:00.402084,0 days 00:00:00.845449,1.2241495095276402,gbtree,0.6072974830289473,9.63695088920609,depthwise,93.58867580514878,0.06934398115135376,7,11,2.2393269734129237,700,,0.6098920396454379,0.9115634458041137,undersample,0.6633556753997916,3.14999999909835,,,,0.7383679434555969,0.7603644180571194,0.7675061425061425,0.6098920396454379,0.6486567612186702,0.6540746382330541,0.9115634458041137,0.78617011307985,0.783082129125266,0.4996531791907514,0.5078051087984863,0.9242942686056459,0.9186991869918699,undersample,0.9111072508653608,0.9111237736052008,0.6633556753997916,COMPLETE
2669,0.695618901855749,2025-09-24 02:09:00.555942,2025-09-24 02:09:36.205122,0 days 00:00:35.649180,0.00017231658803722394,dart,0.48992154671375776,4.998579347748008,depthwise,0.000501198493188285,0.027927092401093194,2,8,4.269335375650846,700,forest,0.6658754949028538,0.9391492538437596,none,0.9388804346212319,4.289499403069106,0.013057703084466118,weighted,0.7501663797809851,0.6420945697983221,0.8416419285494933,0.8371212121212122,0.6658754949028538,0.7065073041168659,0.695618901855749,0.9391492538437596,0.8044066067594166,0.7916127051134401,0.6348448687350835,0.6290657439446367,0.7964071856287425,0.7779204107830552,none,0.9179147904088013,0.9134194336865068,0.9388804346212319,COMPLETE
2670,0.7040816326530612,2025-09-24 02:09:36.356141,2025-09-24 02:09:45.014781,0 days 00:00:08.658640,0.0020377888800289456,dart,0.20751925665643275,0.174783062556101,lossguide,0.0013004787914407834,0.09562565879267329,1,9,0.1369188249925647,300,forest,0.6583216626652488,0.8820142389249866,none,0.9169522501670531,2.908268427550119,0.08927095570570086,weighted,0.6974236727620453,0.8327626699643338,0.8659023441498618,0.8634316134316135,0.6583216626652488,0.7104332449160036,0.7040816326530612,0.8820142389249866,0.8186580305796202,0.8135144884953491,0.7351326623970723,0.730999539382773,0.6873396065012831,0.6790757381258024,none,0.920572402688711,0.920294638214002,0.9169522501670531,COMPLETE
2671,0.6578947368421053,2025-09-24 02:09:45.168430,2025-09-24 02:10:49.093922,0 days 00:01:03.925492,7.145861899283063,dart,0.31336820195907256,4.8593570263957835,depthwise,0.0013885613663934407,0.137317800786467,10,10,1.3677360711519275,1000,forest,0.4909545493151036,0.6807793506140772,undersample,0.5097601187162504,0.9593679338584072,0.18898503937624267,weighted,0.46913333176084243,0.706503018971762,0.7884123247005835,0.795045045045045,0.4909545493151036,0.6565874730021598,0.6578947368421053,0.6807793506140772,0.7498777502634406,0.7445584826888446,0.5368106492800869,0.5476529160739687,0.8451668092386655,0.8237056054771074,undersample,0.8935821188812179,0.8935931580381185,0.5097601187162504,COMPLETE
2672,0.6705094251441034,2025-09-24 02:10:49.247095,2025-09-24 02:10:56.568580,0 days 00:00:07.321485,0.0005862732877990243,dart,0.9849049627038859,5.813104842531622,depthwise,4.663080261451283,0.07644131089078991,2,9,16.82732132053883,300,forest,0.6142078181505415,0.9967039412120996,oversample,0.7937078976752223,4.793971611730247,0.1285387753271475,weighted,0.5427531428805661,0.8216341187020656,0.7813491657283242,0.7834766584766585,0.6142078181505415,0.6696566656356325,0.6705094251441034,0.9967039412120996,0.8204954239653232,0.8119317779559533,0.5244670542635659,0.5271925526702597,0.9260051325919589,0.9208386820710313,oversample,0.9247193656979255,0.9212286339126697,0.7937078976752223,COMPLETE
2673,0.6897130391005202,2025-09-24 02:10:56.721164,2025-09-24 02:11:04.357311,0 days 00:00:07.636147,0.0005694410553900924,dart,0.5306345264595168,2.7231170951750086,lossguide,0.0022536294986578356,0.07138568293201873,2,11,5.282615320366038,300,forest,0.6509202192772053,0.9655216374593272,undersample,0.9313381644803245,2.589033884297846,0.08266450013945291,weighted,0.6838564358580839,0.3991430643381805,0.8042788412324701,0.8107084357084358,0.6509202192772053,0.6841757515692104,0.6897130391005202,0.9655216374593272,0.8112302104134883,0.8004698046642513,0.5573196986006459,0.567366096079514,0.8857998289136013,0.8793324775353016,undersample,0.9206609561890119,0.9172556396324433,0.9313381644803245,COMPLETE
2674,0.7007650273224044,2025-09-24 02:11:04.507693,2025-09-24 02:11:15.864663,0 days 00:00:11.356970,1.4745102259620082,dart,0.3360941363065336,7.651015788190244,depthwise,0.4030696202489733,0.05710307541452136,1,4,27.322021038293784,400,forest,0.619384590463474,0.5173374172214802,oversample,0.9573406688694894,0.7543643121985678,0.08365489909790241,weighted,0.4534613998847172,0.9954934888066834,0.8617053946156208,0.8598484848484849,0.619384590463474,0.7059847660500544,0.7007650273224044,0.5173374172214802,0.8103097957925516,0.8004948161599073,0.718653079308817,0.7162645218945487,0.6937553464499572,0.6859221223791185,oversample,0.9195460799952665,0.9168980782088382,0.9573406688694894,COMPLETE
2675,0.7157853810264385,2025-09-24 02:11:16.014845,2025-09-24 02:11:57.488711,0 days 00:00:41.473866,0.0024530089823044244,dart,0.46704084477856483,0.9105217232176117,lossguide,0.0015288512167412924,0.01056264296668522,4,11,0.1079891388932575,700,forest,0.3418440802103249,0.9851197712191672,none,0.5888293161271705,1.1773420855215981,0.08227563771839053,weighted,0.7791793712253796,0.2394863683149281,0.8501381922407616,0.8503276003276004,0.3418440802103249,0.7174835970667696,0.7157853810264385,0.9851197712191672,0.8209645095306348,0.8123506748993607,0.6536568213783404,0.655860349127182,0.7951240376390077,0.7877620881471973,none,0.9244255879497709,0.9213948183507928,0.5888293161271705,COMPLETE
2676,0.7077037866069763,2025-09-24 02:11:57.638367,2025-09-24 02:12:05.462117,0 days 00:00:07.823750,0.0025243780101457084,dart,0.33489538349532094,0.18689755915703066,lossguide,0.029827828369253115,0.3210268680830826,1,9,11.685946924156436,300,forest,0.5960629784410318,0.9272617667537737,none,0.9050052758229978,4.0075334901647635,0.12342265850711749,weighted,0.6242491035439186,0.43203494632243866,0.8408230115672024,0.8395782145782146,0.5960629784410318,0.7121969276327966,0.7077037866069763,0.9272617667537737,0.8152330548252813,0.8089711152256838,0.6277324632952692,0.6273148148148148,0.8229255774165953,0.811724433033804,none,0.9223854327218451,0.9202483415098266,0.9050052758229978,COMPLETE
2677,0.6441605839416058,2025-09-24 02:12:05.613580,2025-09-24 02:12:08.967564,0 days 00:00:03.353984,0.00025977570385862775,dart,0.8858842304944778,8.27839724948673,depthwise,0.02141184091155684,0.25221905614791085,0,12,34.50578832103831,200,forest,0.6679594178841479,0.8478425932853337,none,0.8137457184537988,2.0989928602851413,0.04952648005851443,weighted,0.6295444318552289,0.6032306644350196,0.8418466577950661,0.8402948402948403,0.6679594178841479,0.6519486370804235,0.6441605839416058,0.8478425932853337,0.7350111341011167,0.7262020464620997,0.6887196573060448,0.6897899364924279,0.6189050470487596,0.6041934103551562,none,0.894886678572033,0.8948241090893155,0.8137457184537988,COMPLETE
2678,0.7182674199623352,2025-09-24 02:12:09.120163,2025-09-24 02:12:09.975747,0 days 00:00:00.855584,0.00013151533427013768,gbtree,0.344991633322967,3.232537252407094,lossguide,0.0014193848336508305,0.17743603461557864,2,6,1.5079149505716243,500,,0.6090691867370609,0.9944535979852673,none,0.9905019746923492,3.7050507693489867,,,,0.9968962828571349,0.8457365134609479,0.8468468468468469,0.6090691867370609,0.717948717948718,0.7182674199623352,0.9944535979852673,0.8296542292247264,0.8236863802185701,0.6382695507487521,0.641439623276152,0.8203592814371258,0.8160034231921267,none,0.92888972617082,0.926776464713418,0.9905019746923492,COMPLETE
2679,0.6403780348704579,2025-09-24 02:12:10.124563,2025-09-24 02:12:31.732732,0 days 00:00:21.608169,0.001737143636654579,dart,0.7910040593518366,4.581978637623014,depthwise,0.0022732406062317937,0.08373111359279363,9,11,36.8701407838192,600,tree,0.5472613359280845,0.5537986701590165,undersample,0.638354223162594,1.0133414288548621,0.22126134883902004,uniform,0.3845936834309317,0.47357348264426957,0.771726891186406,0.7740581490581491,0.5472613359280845,0.6443381180223285,0.6403780348704579,0.5537986701590165,0.7274625568957042,0.7257699286798281,0.513733468972533,0.5171052631578947,0.8639863130881095,0.8408215661103979,undersample,0.8879999099787621,0.8863901336886433,0.638354223162594,COMPLETE
2680,0.297008547008547,2025-09-24 02:12:31.887129,2025-09-24 02:12:32.774165,0 days 00:00:00.887036,0.00038655554973645277,gbtree,0.36258831685101933,2.695859164207785,lossguide,1.5143523411039022,0.18080256641835574,4,8,14.323896944005885,900,,0.693090182943017,0.6985050091435915,none,0.7837387467081721,0.5073777054416692,,,,0.6884217339030643,0.8023339133995291,0.797911547911548,0.693090182943017,0.3222183222183222,0.297008547008547,0.6985050091435915,0.7281262614877381,0.7220563405557093,0.898238747553816,0.8853503184713376,0.19632164242942687,0.17843388960205392,none,0.887105770004486,0.8883975622366767,0.7837387467081721,COMPLETE
2681,0.621467353473479,2025-09-24 02:12:32.927332,2025-09-24 02:12:36.412793,0 days 00:00:03.485461,4.381157335296748,dart,0.3772324976612814,2.5237821701136456,lossguide,0.0009291009609166759,0.12622957230977458,8,6,0.15493364171092744,200,forest,0.5421515789836964,0.9753653689210707,undersample,0.5708088780210245,4.502760317514475,0.09753394743305539,weighted,0.6931959655937844,0.2601701725462465,0.7161429010134097,0.7216420966420967,0.5421515789836964,0.6168301782506563,0.621467353473479,0.9753653689210707,0.7942672437478332,0.7939127543024864,0.4556031843233313,0.4605860503508048,0.9546621043627032,0.9550706033376123,undersample,0.914881868997457,0.915351543715807,0.5708088780210245,COMPLETE
2682,0.0,2025-09-24 02:12:36.579950,2025-09-24 02:12:40.317011,0 days 00:00:03.737061,0.0268118256823436,dart,0.6211336161724423,3.4960940929387703,lossguide,0.0006886116359070418,0.00010961138445528705,9,6,6.33053686794235,200,forest,0.6490179831373102,0.6752733005726472,oversample,0.8519090320889602,0.5143659192040355,0.14059711647748863,weighted,0.575939120100698,0.5820454310475242,0.7606715119254785,0.7607493857493858,0.6490179831373102,0.0,0.0,0.6752733005726472,0.7022393591183267,0.6940997783216215,0.0,0.0,0.0,0.0,oversample,0.883588926881228,0.8834906874237134,0.8519090320889602,COMPLETE
2683,0.6035678889990089,2025-09-24 02:12:40.468342,2025-09-24 02:12:41.282581,0 days 00:00:00.814239,0.00033912118478977214,gbtree,0.2590833297340785,1.9839154192194768,lossguide,0.005754452566330851,0.17998192216374695,0,4,0.1218758542697691,300,,0.6853310370796855,0.6755108935167241,none,0.8740074344911954,1.7632578628187925,,,,0.5950503991261806,0.8377520728836114,0.8361998361998362,0.6853310370796855,0.6140735329924519,0.6035678889990089,0.6755108935167241,0.7132186006794257,0.7001267692670992,0.712832108535896,0.7168922895821072,0.539349871685201,0.521181001283697,none,0.8897612238467871,0.8899640492272163,0.8740074344911954,COMPLETE
2684,0.7079265911753222,2025-09-24 02:12:41.431484,2025-09-24 02:12:50.018746,0 days 00:00:08.587262,0.001022382213201817,dart,0.6147171612163692,1.8104908773464072,depthwise,0.007203085045388303,0.0026814818367951227,3,12,1.1280133077914931,300,forest,0.6231705642242107,0.9728141324331181,none,0.9977170407364332,4.2136610844640146,0.029268561963268463,weighted,0.7899163441039346,0.726301156330021,0.8490121813901116,0.8468468468468469,0.6231705642242107,0.7129791788285659,0.7079265911753222,0.9728141324331181,0.8013721360894388,0.7940250283192245,0.6540521242413424,0.6509874326750449,0.7835757057313943,0.7757809157038938,none,0.918510116280502,0.9166272943140794,0.9977170407364332,COMPLETE
2685,0.6613503455608719,2025-09-24 02:12:50.166703,2025-09-24 02:13:14.481557,0 days 00:00:24.314854,2.576029810945246,dart,0.8231332516600329,4.662858544631697,lossguide,25.976728911779272,0.01621215689509005,3,11,0.5615399078039625,600,forest,0.46170243422236834,0.547035166195738,none,0.6289173552907599,2.3838600131424363,0.22343366916807722,weighted,0.49996003116134113,0.47805899938968804,0.8056095813286928,0.8043611793611793,0.46170243422236834,0.6676002100472607,0.6613503455608719,0.547035166195738,0.7667870835383115,0.7570946912215428,0.565037037037037,0.5644283121597096,0.8156544054747648,0.7984595635430038,none,0.8981664389083301,0.8936917688663532,0.6289173552907599,COMPLETE
2686,0.7071044333147839,2025-09-24 02:13:14.634112,2025-09-24 02:13:48.190993,0 days 00:00:33.556881,0.0032065314071143157,dart,0.5259742269219329,0.6179338826249917,lossguide,0.0004010672111959621,0.004017132179042602,7,10,0.4238069978817257,600,tree,0.5007549787272945,0.9467783926264207,none,0.9828987037454723,2.6565480803637356,0.1565885705156952,weighted,0.6092848052942907,0.3293962327704194,0.8375473436380387,0.8383497133497133,0.5007549787272945,0.7080036798528059,0.7071044333147839,0.9467783926264207,0.8078271591431609,0.7986508304252977,0.6212463674523733,0.6240995415848068,0.8229255774165953,0.8155755241762944,none,0.9200464921705123,0.9180326641674508,0.9828987037454723,COMPLETE
2687,0.4985607369027058,2025-09-24 02:13:48.344944,2025-09-24 02:13:49.449120,0 days 00:00:01.104176,0.0003274472587098439,gbtree,0.9030602299675897,2.817790099544544,depthwise,34.43259599263801,0.0007389606437370845,0,10,0.12424571741137042,300,,0.47103061104892957,0.8171782768161876,oversample,0.6733530527123159,0.6659165371138108,,,,0.396029012358254,0.8286416214556249,0.8216625716625716,0.47103061104892957,0.5257790368271955,0.4985607369027058,0.8171782768161876,0.7356446268538331,0.7228185935222987,0.7785234899328859,0.7616534740545294,0.39692044482463645,0.37056054771074026,oversample,0.8953160925395304,0.8925862335137811,0.6733530527123159,COMPLETE
2688,0.7076461769115442,2025-09-24 02:13:49.599941,2025-09-24 02:13:50.494682,0 days 00:00:00.894741,0.00011767753099854329,gbtree,0.27908267253159663,5.052648387870002,lossguide,0.002777474158466777,0.05477641197271009,0,3,3.765258863139403,600,,0.6827377524824569,0.9206106958500992,none,0.872841264171657,3.4546872566600144,,,,0.762623773984344,0.8622172177295526,0.8602579852579852,0.6827377524824569,0.7149512918254977,0.7076461769115442,0.9206106958500992,0.8142180505966914,0.8083844066107737,0.7080536912751678,0.7084048027444254,0.7219846022241232,0.7068891741548995,none,0.9200652274089574,0.9198054421315094,0.872841264171657,COMPLETE
2689,0.7245796637309848,2025-09-24 02:13:50.645893,2025-09-24 02:14:12.076910,0 days 00:00:21.431017,0.0027151064745683526,dart,0.6730984969260244,4.310624353588337,lossguide,0.040398313286923664,0.01752861883461151,0,10,2.6000127751068245,500,forest,0.6989257003767695,0.986591023596454,none,0.941600479930685,4.575733070095699,0.005639770914394701,weighted,0.6390579463802839,0.37302379754226644,0.8573037158358071,0.8591318591318591,0.6989257003767695,0.722531847133758,0.7245796637309848,0.986591023596454,0.8252880642519219,0.8199414815975395,0.6757259865971705,0.6807070327190673,0.7763045337895638,0.7744972186563971,none,0.9265677077703409,0.9251345152467312,0.941600479930685,COMPLETE
2690,0.687037037037037,2025-09-24 02:14:12.228551,2025-09-24 02:14:51.854377,0 days 00:00:39.625826,0.020666278044925445,dart,0.5948397426312189,3.736211981337034,lossguide,0.31594339692784423,0.0039022993529245847,1,11,0.6475182644970042,700,forest,0.6616787354219172,0.8813266698986086,none,0.9117919410705938,2.6865393953298176,0.0021062360551035047,weighted,0.5504755489233634,0.2869909932058509,0.8621148531067663,0.8615888615888616,0.6616787354219172,0.6888426888426888,0.687037037037037,0.8813266698986086,0.7988240718197493,0.7907592409661752,0.748869914615771,0.7483610690872415,0.6377245508982036,0.6350021394950791,none,0.9153343350786172,0.9134348659212321,0.9117919410705938,COMPLETE
2691,0.6751529987760098,2025-09-24 02:14:52.003059,2025-09-24 02:15:20.722112,0 days 00:00:28.719053,0.0024337911823849394,dart,0.7566245051992129,5.261131922832167,lossguide,0.013058349924191779,0.004789150945056159,1,10,3.2426924034308415,600,forest,0.6830207538874151,0.9954805989879001,none,0.888753963199787,2.2539392160612173,0.0012260083195175095,weighted,0.6833826644854395,0.35437708185091354,0.8678472719828028,0.8641482391482391,0.6830207538874151,0.6871819723770293,0.6751529987760098,0.9954805989879001,0.8147521208205019,0.8073777259849623,0.7926215762996087,0.7889016018306636,0.6065012831479898,0.5900727428326915,none,0.9217764655244559,0.9194288495378419,0.888753963199787,COMPLETE
2692,0.6823045267489712,2025-09-24 02:15:20.872749,2025-09-24 02:15:25.148447,0 days 00:00:04.275698,0.0033343170577333024,dart,0.6820368254007704,4.108682130784573,lossguide,0.1293892232702769,0.009557355280009956,1,11,9.982596314189793,200,forest,0.6484865078449167,0.7678575913033989,none,0.8855802815004343,3.4585025799804754,0.020357884433578284,weighted,0.614715220341229,0.2713545786837803,0.8461459719520934,0.8419328419328419,0.6484865078449167,0.6942014242115971,0.6823045267489712,0.7678575913033989,0.768367264115584,0.7529011194118074,0.6620100892510671,0.6571541815299247,0.7296834901625321,0.709456568249893,none,0.9085210397015531,0.903301415671446,0.8855802815004343,COMPLETE
2693,0.7028688524590164,2025-09-24 02:15:25.302622,2025-09-24 02:15:34.410265,0 days 00:00:09.107643,0.017558192157696738,dart,0.5746414468285087,3.043942548623353,lossguide,0.01062190673631846,0.00959329743149775,1,10,1.1177161482147908,300,forest,0.6632624494954867,0.9641931048931399,none,0.7913552218389661,3.7447227450564835,0.009525507664947119,weighted,0.6232351636454811,0.2924352795224634,0.8566895280990889,0.8515561015561015,0.6632624494954867,0.7141690485912617,0.7028688524590164,0.9641931048931399,0.8039239759205089,0.7956961148184819,0.683203125,0.674400314589068,0.7480752780153977,0.733846812152332,none,0.9191924415774253,0.9163676527231245,0.7913552218389661,COMPLETE
2694,0.723083035359555,2025-09-24 02:15:34.563843,2025-09-24 02:16:24.166218,0 days 00:00:49.602375,0.00010050804224138954,dart,0.6896716968008999,3.400845407323593,lossguide,2.7675744722584685,0.026055985841385045,2,9,1.9960277563915219,800,forest,0.6489541511181394,0.993729076707125,none,0.8600898367736827,3.918451793363113,0.011225122364879105,weighted,0.5380912626414696,0.4380011928039911,0.8535162247927116,0.8572891072891073,0.6489541511181394,0.7178071386314336,0.723083035359555,0.993729076707125,0.8231084571395832,0.8149687813476862,0.6659348701061105,0.674823878383389,0.7784431137724551,0.7787762088147198,none,0.9258282558247022,0.9227516457643382,0.8600898367736827,COMPLETE
2695,0.5686103858427618,2025-09-24 02:16:24.319355,2025-09-24 02:16:33.357927,0 days 00:00:09.038572,0.00025748661724667854,dart,0.5454173324136062,3.62647618669175,lossguide,0.19672486277896847,0.006099354803324189,0,10,1.077875163603063,300,forest,0.6847661286620994,0.9678791595710122,none,0.9459303529280004,1.6582620612304009,0.0015733944603391614,weighted,0.6226785833627083,0.34867930808583575,0.8531067663015662,0.8477682227682227,0.6847661286620994,0.5853799479919098,0.5686103858427618,0.9678791595710122,0.8133859143828519,0.8051740608745166,0.9020480854853072,0.8828828828828829,0.43327630453378957,0.4193410355156183,none,0.9209355382320312,0.9186211908652456,0.9459303529280004,COMPLETE
2696,0.5847584758475848,2025-09-24 02:16:33.513209,2025-09-24 02:16:34.463020,0 days 00:00:00.949811,0.30784507568342284,gbtree,0.3286050510339876,4.145984483455259,depthwise,0.0056059870109172886,0.020688720167105497,2,10,88.61837159971063,1000,,0.6158321290341013,0.5180068714857906,undersample,0.5648342835810939,1.5700517280644173,,,,0.36945401813727874,0.7168594533729143,0.7166257166257166,0.6158321290341013,0.5870409077336518,0.5847584758475848,0.5180068714857906,0.6380724230942929,0.6376413786600448,0.45091743119266053,0.4502194502194502,0.8408896492728828,0.8339751818570817,undersample,0.8463934349422154,0.8435490984321483,0.5648342835810939,COMPLETE
2697,0.7201243891603731,2025-09-24 02:16:34.622310,2025-09-24 02:16:38.825059,0 days 00:00:04.202749,0.01799286707350623,gbtree,0.3086194372063795,0.8334385275020755,lossguide,0.010425932834987151,0.021464012851542532,10,9,0.3365714646614504,800,,0.49879672368931666,0.9879439528904567,none,0.8535800917059185,1.255285633037973,,,,0.31714367470474125,0.8696898351929573,0.871007371007371,0.49879672368931666,0.7191705272446504,0.7201243891603731,0.9879439528904567,0.8262637129370393,0.8237572352371691,0.7425968109339408,0.748729792147806,0.6971770744225834,0.6936243046640993,none,0.9270275125393714,0.9262229772500645,0.8535800917059185,COMPLETE
