number,value,datetime_start,datetime_complete,duration,params_alpha,params_booster,params_colsample_bytree,params_gamma,params_grow_policy,params_lambda,params_learning_rate,params_max_delta_step,params_max_depth,params_min_child_weight,params_n_estimators,params_normalize_type,params_params_decision_threshold,params_params_feature_fraction,params_params_resampling,params_params_sample_rows,params_params_scale_pos_weight,params_rate_drop,params_sample_type,params_skip_drop,params_subsample,user_attrs_acc_test,user_attrs_acc_val,user_attrs_decision_threshold,user_attrs_f1_test,user_attrs_f1_val,user_attrs_feature_fraction,user_attrs_pr_auc_test,user_attrs_pr_auc_val,user_attrs_prec_test,user_attrs_prec_val,user_attrs_rec_test,user_attrs_rec_val,user_attrs_resampling_strategy,user_attrs_roc_auc_test,user_attrs_roc_auc_val,user_attrs_sample_rows,state
2917,0.7224123182207014,2025-09-24 02:57:32.235396,2025-09-24 02:57:33.065248,0 days 00:00:00.829852,0.0026765946006026826,gbtree,0.31751537758900716,3.758116965568719,lossguide,5.6043259436198865,0.2161385228465987,3,6,1.0942883716119298,300,,0.6258800532213519,0.8400958141485537,none,0.9855100031151858,2.458320185000887,,,,0.5895041513411959,0.8647763332992118,0.8671171171171171,0.6258800532213519,0.721013727560718,0.7224123182207014,0.8400958141485537,0.8205376354098226,0.8151367708648388,0.7121401752190237,0.7221034630183839,0.7301112061591104,0.7227214377406932,none,0.9243104137189603,0.9232998931778409,0.9855100031151858,COMPLETE
2918,0.6990058279053822,2025-09-24 02:57:33.222295,2025-09-24 02:57:33.940348,0 days 00:00:00.718053,0.0006454603380905467,gbtree,0.2284511971658962,6.285323933218065,depthwise,0.10985861649965077,0.36120142243487247,5,5,0.5946094721956336,300,,0.5657955722851826,0.8679642247291504,oversample,0.8851231981551028,1.6452358782897496,,,,0.6626056570566888,0.8167673252124066,0.8202293202293203,0.5657955722851826,0.6970209884901828,0.6990058279053822,0.8679642247291504,0.8189315881429333,0.8127056771081411,0.576750700280112,0.5830712038890478,0.8806672369546621,0.8724860932819855,oversample,0.9236508527440188,0.9227242938557767,0.8851231981551028,COMPLETE
2919,0.6093468312300652,2025-09-24 02:57:34.098377,2025-09-24 02:57:34.764823,0 days 00:00:00.666446,4.178529448578632,gbtree,0.9919694767007374,6.916389571037289,depthwise,0.01207716091350074,0.09055113183915081,10,7,3.8044377575412764,200,,0.4574239847133688,0.5093880068181882,undersample,0.6111425384948526,2.526946973491363,,,,0.3614228571843343,0.7073395434537824,0.7116093366093366,0.4574239847133688,0.6074419881916793,0.6093468312300652,0.5093880068181882,0.7206494867554244,0.7089750239238489,0.4473205257836198,0.4507591300779647,0.9461077844311377,0.940094137783483,undersample,0.8908978858707983,0.8889590537322198,0.6111425384948526,COMPLETE
2920,0.665781990521327,2025-09-24 02:57:34.922081,2025-09-24 02:57:35.669918,0 days 00:00:00.747837,0.06752539035079543,gbtree,0.5835786488447634,5.421503168019906,depthwise,0.11503109128317011,0.16126392900574257,4,7,0.1065041263048176,300,,0.49258065985797567,0.8175337168267963,none,0.9932623783873935,1.7994603714777335,,,,0.5502486146950756,0.8182004299314157,0.8195126945126945,0.49258065985797567,0.667291120269764,0.665781990521327,0.8175337168267963,0.7115133165334463,0.6994478495314927,0.5936666666666667,0.5976855003403676,0.7617621899059025,0.7513906718014548,none,0.8920969411312908,0.8889663091858592,0.9932623783873935,COMPLETE
2921,0.6977859778597786,2025-09-24 02:57:35.827067,2025-09-24 02:57:46.958359,0 days 00:00:11.131292,0.00016915756129211375,dart,0.25648181872771253,4.20684093632576,lossguide,23.024063703606004,0.1830272521509947,3,5,0.28638603433685894,400,tree,0.5808449796798291,0.9182280710781144,none,0.9711764652143078,3.4884316537445033,0.19735563946501342,weighted,0.5483405147466728,0.6636946326901707,0.8355000511823114,0.8323095823095823,0.5808449796798291,0.7072326471124066,0.6977859778597786,0.9182280710781144,0.8052527600551352,0.7930777975607987,0.6159949222469058,0.6133636068764191,0.830196749358426,0.8091570389388104,none,0.9204265498646861,0.9160386812418366,0.9711764652143078,COMPLETE
2922,0.6865817825661117,2025-09-24 02:57:47.109795,2025-09-24 02:57:48.304884,0 days 00:00:01.195089,0.00022493283531673758,gbtree,0.5834241921081145,4.7854926827726185,depthwise,0.037079595018935985,0.014632764463051303,3,7,0.16841664612646304,500,,0.547138062225957,0.979232188456612,none,0.9205369510528125,1.0694115489234743,,,,0.7554648981782816,0.8695874705701709,0.868959868959869,0.547138062225957,0.6901750972762646,0.6865817825661117,0.979232188456612,0.8270982363284384,0.8207474311329273,0.7998872604284104,0.8025186033199772,0.606928999144568,0.5999144201968335,none,0.9268974306994753,0.9252137494071114,0.9205369510528125,COMPLETE
2923,0.0,2025-09-24 02:57:48.459162,2025-09-24 02:57:49.414686,0 days 00:00:00.955524,0.015783510046404884,gbtree,0.3475800651997592,6.576226599433393,depthwise,10.485611978060925,0.0015629805158931269,5,8,89.36384443098235,400,,0.5678549189114792,0.6285759989809174,none,0.8063983848003151,1.7370236995567863,,,,0.8583183637846753,0.7606715119254785,0.7607493857493858,0.5678549189114792,0.0,0.0,0.6285759989809174,0.6776460602971626,0.6734627259736037,0.0,0.0,0.0,0.0,none,0.8709585270315242,0.8731179223697555,0.8063983848003151,COMPLETE
2924,0.6761979575805185,2025-09-24 02:57:49.565686,2025-09-24 02:57:50.372438,0 days 00:00:00.806752,0.000378978411538306,gbtree,0.699186243997359,3.2596430499391302,lossguide,3.7934443397533566,0.06199304096972685,3,5,3.428843444767587,200,,0.5981149064395458,0.8335183766778306,undersample,0.9420881595146424,2.7363782689799048,,,,0.9769259213152837,0.7837035520524107,0.789004914004914,0.5981149064395458,0.6714352355776707,0.6761979575805185,0.8335183766778306,0.8177220463975343,0.8119532419330161,0.5274859516247251,0.5342601787487586,0.9234388366124893,0.9208386820710313,undersample,0.9243650941383857,0.9231803509416859,0.9420881595146424,COMPLETE
2925,0.7268242548818088,2025-09-24 02:57:50.527142,2025-09-24 02:57:51.406002,0 days 00:00:00.878860,0.00012133756748097902,gbtree,0.5144377357639803,3.4649722754241865,depthwise,0.1636971338967404,0.05928703429874873,5,6,0.41036116127115246,300,,0.5322208581655009,0.9647329080327965,none,0.9551084530094727,1.9072958694402988,,,,0.5884899908412415,0.8610912068789026,0.8639434889434889,0.5322208581655009,0.7220970714724555,0.7268242548818088,0.9647329080327965,0.8298896986604952,0.8249810867955272,0.6927308447937132,0.6993670886075949,0.7540633019674936,0.756525459991442,none,0.9285976463935846,0.9272026074488058,0.9551084530094727,COMPLETE
2926,0.6990688167158755,2025-09-24 02:57:51.557427,2025-09-24 02:57:52.402434,0 days 00:00:00.845007,0.00021463593750308593,gbtree,0.5806528122137666,3.3303108131357075,depthwise,5.4975321522834655,0.0646965072705258,4,6,0.4531621339764321,300,,0.6090398234665936,0.8261378519869399,none,0.9586109188547435,1.8330735049516163,,,,0.5172071431494398,0.8667212611321528,0.8643529893529893,0.6090398234665936,0.7038216560509554,0.6990688167158755,0.8261378519869399,0.8159831840672727,0.8074448628083917,0.7517006802721088,0.744917715392062,0.6616766467065869,0.6585365853658537,none,0.9206628556141075,0.9188443536476246,0.9586109188547435,COMPLETE
2927,0.7057941121320083,2025-09-24 02:57:52.553334,2025-09-24 02:58:05.214847,0 days 00:00:12.661513,0.0014648581439509606,dart,0.45958313312617494,2.76690654538493,depthwise,0.10042629802253432,0.008331491835483798,8,8,0.44397834189678576,400,tree,0.6263341812669644,0.8898905313310471,oversample,0.898391639984913,1.298258713622739,0.10501179765590797,uniform,0.7483020375527674,0.7250271320937893,0.8383662606203296,0.8393734643734644,0.6263341812669644,0.70677808727948,0.7057941121320083,0.8898905313310471,0.8051882589530194,0.7980317585447064,0.6245487364620939,0.6281708945260347,0.8139435414884517,0.80530594779632,oversample,0.9199926463469622,0.9179374795256569,0.898391639984913,COMPLETE
2928,0.7185398655139289,2025-09-24 02:58:05.371106,2025-09-24 02:58:06.383426,0 days 00:00:01.012320,0.00118739614939677,gbtree,0.5524974680960633,1.8377752790622526,depthwise,0.079500873445658,0.07739721499365429,3,5,1.0159156442267454,500,,0.5054143532124661,0.9478238766720528,none,0.9094788516859855,2.402735027061278,,,,0.7825444542838516,0.8498310983724024,0.8500204750204751,0.5054143532124661,0.7196636728454041,0.7185398655139289,0.9478238766720528,0.8292337568962989,0.8225139533256292,0.6504317789291882,0.6520223152022315,0.8053892215568862,0.8001711596063329,none,0.928291666278148,0.925912173194358,0.9094788516859855,COMPLETE
2929,0.7009063444108762,2025-09-24 02:58:06.540058,2025-09-24 02:58:07.336364,0 days 00:00:00.796306,0.0002414166007133364,gbtree,0.44979368393766045,0.7945254482109823,depthwise,2.1442340260821586,0.030018557673854477,9,6,0.3343778525856125,200,,0.5337158050919933,0.9110567027584958,none,0.8525213385039296,1.3381676247677996,,,,0.3751788867165293,0.8713276691575391,0.8682432432432432,0.5337158050919933,0.710435383552177,0.7009063444108762,0.9110567027584958,0.8210913152885244,0.8130770446149418,0.7698452321517724,0.7670396744659207,0.6595380667236954,0.6452717158750535,none,0.9239920297820645,0.9218604917919226,0.8525213385039296,COMPLETE
2930,0.7045857114741193,2025-09-24 02:58:07.493599,2025-09-24 02:58:08.266286,0 days 00:00:00.772687,0.0002874731843050511,gbtree,0.5627889893643497,4.62660222803421,depthwise,0.03769405890198469,0.3745936975645853,8,5,0.7423838458162203,300,,0.5071442851499233,0.983311460351992,none,0.8650819006307781,2.151040978166066,,,,0.48590146433070724,0.8457365134609479,0.8463349713349714,0.5071442851499233,0.7053763440860215,0.7045857114741193,0.983311460351992,0.8067018388184368,0.8052297041530372,0.6496218941303565,0.652332361516035,0.7715996578272027,0.7659392383397519,none,0.9169839569951739,0.9152968686901665,0.8650819006307781,COMPLETE
2931,0.7237336872373369,2025-09-24 02:58:08.421479,2025-09-24 02:58:09.238648,0 days 00:00:00.817169,0.002389589807757457,gbtree,0.6254490690037828,4.274971677340373,depthwise,0.10478068374655183,0.06207753096438357,6,6,0.4258726876228009,300,,0.5487413612559838,0.9357167136826985,none,0.9609377922812494,1.5665843858779402,,,,0.8409375872506785,0.8720442215170437,0.8721334971334971,0.5487413612559838,0.7233289065958388,0.7237336872373369,0.9357167136826985,0.8289804987609795,0.823530208766027,0.7495412844036697,0.7490842490842491,0.6988879384088965,0.7000427899015832,none,0.9280233580937783,0.926714649400069,0.9609377922812494,COMPLETE
2932,0.7139747496734872,2025-09-24 02:58:09.390512,2025-09-24 02:58:10.217514,0 days 00:00:00.827002,0.0006799973552773628,gbtree,0.4067919493987338,2.69384467306358,lossguide,2.4443251559007235,0.31034098156098516,6,7,0.3252416770083385,300,,0.47014284034966963,0.9280102254864927,none,0.9690905905839498,1.1690527684140017,,,,0.5744732285149414,0.8648786979219981,0.8654791154791155,0.47014284034966963,0.7131681877444589,0.7139747496734872,0.9280102254864927,0.8189226876734028,0.8134776604830161,0.7248233215547704,0.7266282676118742,0.7018819503849444,0.7017543859649122,none,0.9251905382383626,0.9219263379128491,0.9690905905839498,COMPLETE
2933,0.6646821922605498,2025-09-24 02:58:10.369699,2025-09-24 02:58:11.177847,0 days 00:00:00.808148,0.0037794175734721606,gbtree,0.6411698960568654,6.165874236586429,depthwise,0.07653560596593467,0.03272157231156204,6,6,0.13197121916199886,400,,0.5579629586018325,0.8183787879665864,undersample,0.956200472254843,0.9968929262295737,,,,0.6444912950359674,0.7985464223564336,0.803951678951679,0.5579629586018325,0.6611570247933884,0.6646821922605498,0.8183787879665864,0.7373099086451398,0.7267567201139705,0.553314121037464,0.5625370480142264,0.8212147134302823,0.8121523320496363,undersample,0.8936711904065449,0.8937058479013917,0.956200472254843,COMPLETE
2934,0.7196620583717358,2025-09-24 02:58:11.340447,2025-09-24 02:58:18.037696,0 days 00:00:06.697249,0.0020217304431998768,dart,0.3120223028272876,3.4346643433452613,depthwise,0.002789332609778985,0.09349400285414519,6,8,0.4250128071879818,300,tree,0.43976887080733806,0.9613976654885976,none,0.9276607644305691,1.7710243138585187,0.29324465843902886,weighted,0.5750499603170964,0.7345787689756791,0.8517760262053434,0.8505323505323505,0.43976887080733806,0.7224990417784591,0.7196620583717358,0.9613976654885976,0.8287553866519134,0.8238071442216004,0.6545138888888888,0.6527342389411355,0.8062446535500428,0.8018827556696619,none,0.9280911905930339,0.9264304774658567,0.9276607644305691,COMPLETE
2935,0.7157894736842105,2025-09-24 02:58:18.194006,2025-09-24 02:58:24.889956,0 days 00:00:06.695950,0.00032776199413106765,dart,0.6661526834762042,4.407368161283804,depthwise,0.608496662857187,0.11807780453056126,3,7,1.61483883029083,300,forest,0.4444884365576743,0.9066862138102788,none,0.960246302379513,1.530275564746206,0.20657230911261265,weighted,0.4184531389810744,0.6719618711509585,0.8546422356433616,0.8535012285012284,0.4444884365576743,0.7203623473808586,0.7157894736842105,0.9066862138102788,0.8239114168537622,0.8165226232465108,0.6675182481751825,0.6679021497405485,0.7822925577416595,0.771074026529739,none,0.9252164107105012,0.9231508684634049,0.960246302379513,COMPLETE
2936,0.7006890611541774,2025-09-24 02:58:25.042098,2025-09-24 02:58:26.916860,0 days 00:00:01.874762,0.02210019354723388,gbtree,0.8296830896950681,4.221443270357939,lossguide,0.015786593028342212,0.001723831428812989,10,7,0.3003990197157072,300,,0.3947661548140633,0.9981141749253963,none,0.9839097290497804,1.5210755747074836,,,,0.667102002196851,0.8534138601699253,0.8576986076986077,0.3947661548140633,0.6963528413910093,0.7006890611541774,0.9981141749253963,0.8039054736163215,0.7970752019550066,0.6904962153069807,0.705244906805375,0.7023096663815227,0.6961916987590928,none,0.9143062568559173,0.9128113863634439,0.9839097290497804,COMPLETE
2937,0.6718936424066815,2025-09-24 02:58:27.076455,2025-09-24 02:58:37.406092,0 days 00:00:10.329637,0.0004290832817177162,dart,0.2566939300275588,7.174884146911179,depthwise,0.1518420865236679,0.014939313902853085,3,5,0.6819631772140692,400,tree,0.4808065873725123,0.7906311520760918,none,0.980749109916995,2.804940161784937,0.2652495944746312,uniform,0.47221276275329405,0.5528370107803333,0.7983416931108609,0.8029279279279279,0.4808065873725123,0.6667794316644113,0.6718936424066815,0.7906311520760918,0.7707751049748627,0.7668896544702362,0.5514829322887521,0.558356940509915,0.8430282292557741,0.8433889602053916,none,0.9030350395581178,0.9050772455326703,0.980749109916995,COMPLETE
2938,0.7204864751520235,2025-09-24 02:58:37.560445,2025-09-24 02:58:38.450427,0 days 00:00:00.889982,0.00012971015996618963,gbtree,0.3371989353396474,5.11639386571368,depthwise,0.03334348587593638,0.04776523391778088,5,5,0.7939596329248709,400,,0.6060833414525247,0.9837564482471868,none,0.9927706653357762,2.4686930420883386,,,,0.46812275104293954,0.8655952502815027,0.8635339885339886,0.6060833414525247,0.7254860965920971,0.7204864751520235,0.9837564482471868,0.8285081044355441,0.8202662166799751,0.7096114519427403,0.7064144736842105,0.742087254063302,0.7351305091998288,none,0.9279259693888652,0.9260601614154168,0.9927706653357762,COMPLETE
2939,0.7138263665594855,2025-09-24 02:58:38.612872,2025-09-24 02:58:39.607028,0 days 00:00:00.994156,0.005845651096836115,gbtree,0.7276842257275415,4.346845962486232,depthwise,0.15481820363355864,0.02269245407638705,7,5,0.15918699668530983,500,,0.6053988109179856,0.8609911172914657,none,0.981204542499114,3.4933067986636543,,,,0.43201803161329994,0.8461459719520934,0.8451064701064701,0.6053988109179856,0.7171089779785432,0.7138263665594855,0.8609911172914657,0.8257096917352733,0.8195029889458738,0.6403361344537815,0.6396610169491526,0.8147989734816082,0.8074454428754814,none,0.9272979503821817,0.9256829642006129,0.981204542499114,COMPLETE
2940,0.717222111355019,2025-09-24 02:58:39.766110,2025-09-24 02:58:40.466777,0 days 00:00:00.700667,0.0002510511370196594,gbtree,0.5455055722685298,6.018915334778777,depthwise,6.221111695851316,0.48121332535981315,3,5,0.4343643675297607,300,,0.49375990690686183,0.9002122417476863,none,0.9847171516805985,1.9179500650066317,,,,0.6332070839106564,0.8557682464940116,0.8549344799344799,0.49375990690686183,0.7202700019853087,0.717222111355019,0.9002122417476863,0.8204710141684981,0.8120498976303266,0.6721007780659504,0.6720269259536276,0.7758768177929855,0.7689345314505777,none,0.9233781989052635,0.9220381064486759,0.9847171516805985,COMPLETE
2941,0.7054930509596293,2025-09-24 02:58:40.624435,2025-09-24 02:58:41.846723,0 days 00:00:01.222288,0.002106247852629244,gbtree,0.3430174346563405,0.6929505292246345,lossguide,0.29176712735096194,0.28527081451115277,4,5,0.10513111543340256,500,,0.5809299096987289,0.9582981227491898,none,0.9235544647039446,1.7701749128385724,,,,0.8316469898691323,0.8621148531067663,0.8633292383292384,0.5809299096987289,0.7029768467475193,0.7054930509596293,0.9582981227491898,0.8143323111719176,0.81233279365776,0.7255348202093764,0.7281420765027322,0.6817792985457656,0.6842105263157895,none,0.9204904396179093,0.9192137771621006,0.9235544647039446,COMPLETE
2942,0.6703351675837919,2025-09-24 02:58:42.005689,2025-09-24 02:58:42.823332,0 days 00:00:00.817643,0.0009063850281786469,gbtree,0.5723746184428621,3.4763806164225244,depthwise,0.014418222431204806,0.0038992352739253573,3,6,0.523436413822744,200,,0.6460266368583173,0.9977918892518628,undersample,0.9273973790260036,1.865664594368845,,,,0.6525666550361872,0.7935305558399017,0.7976044226044227,0.6460266368583173,0.6695067999344585,0.6703351675837919,0.9977918892518628,0.7712355542830021,0.7636529814076398,0.5426294820717131,0.5491803278688525,0.8738237810094097,0.8600770218228498,undersample,0.9070997804840173,0.9048656569263352,0.9273973790260036,COMPLETE
2943,0.6792822185970636,2025-09-24 02:58:42.979511,2025-09-24 02:58:43.803427,0 days 00:00:00.823916,0.00037371246579125805,gbtree,0.3304315832415651,0.7345579675583455,lossguide,0.035988024493927497,0.05908078057056769,3,3,0.16555540420538686,400,,0.6672583338318329,0.9046237132351141,undersample,0.9122765055548319,2.627576221217476,,,,0.554998177485734,0.7954754836728427,0.7987305487305487,0.6672583338318329,0.6771170006464124,0.6792822185970636,0.9046237132351141,0.8099363362630667,0.8045276630677646,0.5441558441558442,0.5489058792512523,0.8960650128314799,0.8908857509627728,undersample,0.918397733628999,0.9179365581982106,0.9122765055548319,COMPLETE
2944,0.6702875399361022,2025-09-24 02:58:43.957355,2025-09-24 02:58:44.836216,0 days 00:00:00.878861,0.000761733019451789,gbtree,0.40125376496220555,4.048960528359558,depthwise,1.9960137078678473,0.011933410829380325,9,6,2.101072379410963,300,,0.5995719041321443,0.8476399266812014,undersample,0.9837720619296643,2.1248204619951165,,,,0.7765266922461527,0.7831917289384789,0.7886977886977887,0.5995719041321443,0.6673994974874372,0.6702875399361022,0.8476399266812014,0.8002765106136076,0.7925899366194296,0.5272952853598015,0.5347947998980372,0.9088964927288281,0.897732135216089,undersample,0.9169411335930134,0.9154162957603909,0.9837720619296643,COMPLETE
2945,0.5875946340815513,2025-09-24 02:58:44.993002,2025-09-24 02:58:45.818463,0 days 00:00:00.825461,0.00019679340512202123,gbtree,0.7704341897801691,1.4920180439349509,depthwise,0.2552004429777613,0.002681307922711267,4,3,0.10367761496095224,400,,0.5668532993516202,0.8541919845643493,oversample,0.9064437812282788,3.1059474935813514,,,,0.6349341386456829,0.6750946872760774,0.6821253071253072,0.5668532993516202,0.5842284516636101,0.5875946340815513,0.8541919845643493,0.72897137742547,0.7215826075297015,0.42107250755287007,0.42604006163328195,0.9538066723695466,0.9465126230209671,oversample,0.8938680399164758,0.8893861753780192,0.9064437812282788,COMPLETE
2946,0.7080322991925202,2025-09-24 02:58:45.975124,2025-09-24 02:58:47.001678,0 days 00:00:01.026554,0.00010748550528593225,gbtree,0.43167536196584305,2.3708194763340598,lossguide,7.23415465304669,0.31367696930787375,6,7,0.26267288599745453,300,,0.6335979516293,0.9704809105281734,none,0.8961677457866583,2.6796906928285904,,,,0.6306996952208911,0.8577131743269526,0.8593366093366094,0.6335979516293,0.7073684210526315,0.7080322991925202,0.9704809105281734,0.8126196646495825,0.8105165960703924,0.6965174129353234,0.7032503165892782,0.718562874251497,0.7128797603765511,none,0.9215267486826911,0.9206924789218995,0.8961677457866583,COMPLETE
2947,0.7207765386204048,2025-09-24 02:58:47.159808,2025-09-24 02:58:48.557924,0 days 00:00:01.398116,0.00011024239067768272,gbtree,0.4617908788192669,5.36670126528624,lossguide,0.05071118500921099,0.0772187878302099,0,9,0.19188631152153973,1000,,0.6825958475222559,0.9997347215955609,none,0.908685232158596,3.756278619919954,,,,0.9702759908677109,0.8616030299928344,0.8615888615888616,0.6825958475222559,0.7240816326530612,0.7207765386204048,0.9997347215955609,0.8275703913465879,0.8236315137103745,0.6924277907884465,0.6966067864271457,0.7587681779298546,0.7466837826273,none,0.927848754880803,0.926568187127593,0.908685232158596,COMPLETE
2948,0.6702227800439284,2025-09-24 02:58:48.716318,2025-09-24 02:58:49.416881,0 days 00:00:00.700563,0.0009704259882169633,gbtree,0.44053242259821235,3.7030358652931517,depthwise,3.047790195625929,0.43424510481668616,7,8,0.524668547381624,200,,0.46536726087631197,0.9315676389143943,undersample,0.9150673992252488,1.6944486289932823,,,,0.5014437174735886,0.7803255195004607,0.7848075348075348,0.46536726087631197,0.6671836228287841,0.6702227800439284,0.9315676389143943,0.8057438210677683,0.7972543736591637,0.5233576642335767,0.5291057716125837,0.9200171086398631,0.9139922978177151,undersample,0.9195718373507326,0.9159905130912857,0.9150673992252488,COMPLETE
