number,value,datetime_start,datetime_complete,duration,params_alpha,params_booster,params_colsample_bytree,params_gamma,params_grow_policy,params_lambda,params_learning_rate,params_max_delta_step,params_max_depth,params_min_child_weight,params_n_estimators,params_normalize_type,params_params_decision_threshold,params_params_feature_fraction,params_params_resampling,params_params_sample_rows,params_params_scale_pos_weight,params_rate_drop,params_sample_type,params_skip_drop,params_subsample,user_attrs_acc_test,user_attrs_acc_val,user_attrs_decision_threshold,user_attrs_f1_test,user_attrs_f1_val,user_attrs_feature_fraction,user_attrs_pr_auc_test,user_attrs_pr_auc_val,user_attrs_prec_test,user_attrs_prec_val,user_attrs_rec_test,user_attrs_rec_val,user_attrs_resampling_strategy,user_attrs_roc_auc_test,user_attrs_roc_auc_val,user_attrs_sample_rows,state
725,0.6513364192922204,2025-09-23 14:37:51.790819,2025-09-23 14:37:52.638523,0 days 00:00:00.847704,0.0012025692683603564,gbtree,0.48503748436079563,3.734295058365328,lossguide,0.03144887283070155,0.01033410993985711,6,4,0.26928052544013065,600,,0.40629403636737765,0.9644246490877841,oversample,0.6310174435352476,1.4661123217901857,,,,0.9409805061789962,0.7561674685228785,0.760954135954136,0.40629403636737765,0.6478415138971023,0.6513364192922204,0.9644246490877841,0.8154411437099718,0.807251666578287,0.49502937189335744,0.5002293577981651,0.937125748502994,0.9332477535301669,oversample,0.9214409004241934,0.9192093720652481,0.6310174435352476,COMPLETE
726,0.38612143742255267,2025-09-23 14:37:52.763587,2025-09-23 14:38:15.669397,0 days 00:00:22.905810,0.005016861298241822,dart,0.45921417543768783,5.085591188459704,lossguide,0.035411688266370416,0.0005351165255556319,6,3,7.046074394695618,600,tree,0.447876966346078,0.6090291768881211,undersample,0.8686800651961311,3.310749198728777,0.4098889157391994,uniform,0.843095637139385,0.9281335999997447,0.23932848807452145,0.23925061425061425,0.447876966346078,0.3862228462872718,0.38612143742255267,0.6090291768881211,0.6823669636354021,0.6815764253426111,0.23932848807452145,0.23925061425061425,1.0,1.0,undersample,0.8656635054477239,0.8614610571875432,0.8686800651961311,COMPLETE
727,0.38612143742255267,2025-09-23 14:38:15.797317,2025-09-23 14:38:16.773912,0 days 00:00:00.976595,0.0002582950756550213,gbtree,0.4907512396779087,8.580401316869205,depthwise,1.0451581117637845,0.00034008078152729404,6,11,31.103103344171288,600,,0.4353374702448327,0.6362709850377024,oversample,0.6566947852746543,2.3994079019729546,,,,0.2674004770640232,0.23932848807452145,0.23925061425061425,0.4353374702448327,0.3862228462872718,0.38612143742255267,0.6362709850377024,0.6994459063410625,0.6891211495179466,0.23932848807452145,0.23925061425061425,1.0,1.0,oversample,0.8693902926024069,0.8657437614471337,0.6566947852746543,COMPLETE
728,0.6491788321167883,2025-09-23 14:38:16.899470,2025-09-23 14:38:17.425439,0 days 00:00:00.525969,0.0007994728016937698,gbtree,0.35519877288279683,5.080689444976461,lossguide,0.00021729665238184038,0.1692147599131938,1,3,0.3417718514257961,900,,0.5479731818876246,0.5896932910579866,none,0.5305529945549254,1.3469437633059613,,,,0.4390282627605568,0.8410277408127751,0.8425470925470926,0.5479731818876246,0.6510896427769041,0.6491788321167883,0.5896932910579866,0.7335419131299163,0.73124830233332,0.6857548509228585,0.6951636541279922,0.6197604790419161,0.6089002995293111,none,0.8920297417737338,0.8939039908853076,0.5305529945549254,COMPLETE
729,0.5854111405835544,2025-09-23 14:38:17.551211,2025-09-23 14:39:22.113318,0 days 00:01:04.562107,0.01051349620818853,dart,0.47992900136935,6.566303846548918,depthwise,0.004533309064350929,0.001823384807661586,7,5,0.59408855458284,1000,forest,0.4970435809352339,0.7939692952613565,undersample,0.5777589681975169,2.0703243477769,0.41357552174294526,uniform,0.7910906442662428,0.5717354005381214,0.6705906438734773,0.6799754299754299,0.4970435809352339,0.5775794171698608,0.5854111405835544,0.7939692952613565,0.6767042503763565,0.6742000268065281,0.4166666666666667,0.4241783586392466,0.9409751924721984,0.9443731279418057,undersample,0.8727639881434431,0.8735794210458943,0.5777589681975169,COMPLETE
730,0.6971507352941176,2025-09-23 14:39:22.238477,2025-09-23 14:39:49.626309,0 days 00:00:27.387832,0.00017897815670209788,dart,0.8889078005768016,1.1883113111765808,depthwise,0.005551186019110971,0.43111021184577525,2,11,0.1950975255784737,600,forest,0.3437450890663714,0.9030322974308056,none,0.9104662418538347,0.5220789044734991,0.1667794151942163,weighted,0.5888981510855411,0.40121281319757013,0.8634455932029891,0.8650696150696151,0.3437450890663714,0.6919168591224019,0.6971507352941176,0.9030322974308056,0.8089808884199836,0.8036140374963542,0.7520080321285141,0.7528535980148884,0.6407185628742516,0.6491228070175439,none,0.9185394422528149,0.9170514216456787,0.9104662418538347,COMPLETE
731,0.5954932673811487,2025-09-23 14:39:49.750171,2025-09-23 14:40:33.081938,0 days 00:00:43.331767,13.615173892593951,dart,0.20462282482897784,6.809713577930562,depthwise,0.7083823570402844,0.4493022824735369,6,10,19.55226193159799,800,forest,0.6602319641642784,0.9573850471609614,undersample,0.9925340501383284,3.2093111193278783,0.2466179869755158,weighted,0.02032079936687652,0.7258835383902078,0.6927014023953322,0.6986076986076986,0.6602319641642784,0.5895542794640416,0.5954932673811487,0.9573850471609614,0.7050248079761627,0.6966586090086762,0.4332797427652733,0.43857518720906696,0.9221556886227545,0.9272571673085152,undersample,0.8736855258857681,0.8706226509389161,0.9925340501383284,COMPLETE
732,0.6113918863543232,2025-09-23 14:40:33.205755,2025-09-23 14:40:40.216454,0 days 00:00:07.010699,16.797746051197077,dart,0.8394614639786564,2.5347684163173523,lossguide,4.749942629734081,0.04900633072566594,0,10,5.568709942622636,300,forest,0.30286451335983267,0.7443588185218236,oversample,0.9946309022844833,1.2932787423578895,0.04676006799819771,weighted,0.27063375092663,0.22377258597847371,0.7034496877879005,0.7087428337428338,0.30286451335983267,0.6064393424806412,0.6113918863543232,0.7443588185218236,0.7961745804922711,0.792517240757669,0.44435596257216803,0.44903691813804175,0.9546621043627032,0.9576379974326059,oversample,0.9140588711267701,0.9117081831209702,0.9946309022844833,COMPLETE
733,0.5599609613273149,2025-09-23 14:40:40.343447,2025-09-23 14:40:43.553841,0 days 00:00:03.210394,0.003043008676816606,dart,0.619829934026012,0.3468624671972165,depthwise,0.00032523249143779216,0.015528897840605653,5,6,12.252183569787235,200,forest,0.35975123364522577,0.9983380517600398,undersample,0.6527774435927486,4.127084241056325,0.029039099578327288,uniform,0.2988763740106707,0.5841746241932677,0.6282116900399222,0.6307330057330057,0.35975123364522577,0.5591162903617383,0.5599609613273149,0.9983380517600398,0.7911398738181462,0.7841853845888898,0.39033898305084747,0.3916382252559727,0.9850299401197605,0.982028241335045,undersample,0.9126122286829537,0.9104893532839883,0.6527774435927486,COMPLETE
734,0.6968373230822995,2025-09-23 14:40:43.679114,2025-09-23 14:40:49.396863,0 days 00:00:05.717749,19.784382743486507,dart,0.6161697013977143,6.17957446379671,lossguide,0.0006496080536451504,0.37572352589358476,5,12,0.9971328275050417,300,tree,0.6609551148093482,0.64892164425406,oversample,0.6370321375262453,2.086774889392852,0.3686860057302008,uniform,0.38941674737655774,0.5439951479708434,0.8176886068174839,0.8223791973791974,0.6609551148093482,0.6939336655782781,0.6968373230822995,0.64892164425406,0.8076925163747226,0.8037571369756437,0.580005745475438,0.5888954518606024,0.8635585970915313,0.8532306375695335,oversample,0.9194366040397433,0.9182779100170577,0.6370321375262453,COMPLETE
735,0.38612143742255267,2025-09-23 14:40:49.522618,2025-09-23 14:41:13.417864,0 days 00:00:23.895246,5.125467861107895,dart,0.8645650486526237,8.85418683565318,depthwise,0.010745835019962546,0.0013256153531491955,9,5,0.14525607282118191,600,tree,0.34521780446999667,0.6641453609914201,undersample,0.9343516588158627,2.773137945365412,0.17928087812044946,uniform,0.7240908824023569,0.8430216903244483,0.23932848807452145,0.23925061425061425,0.34521780446999667,0.3862228462872718,0.38612143742255267,0.6641453609914201,0.6181328656607664,0.6116538870718387,0.23932848807452145,0.23925061425061425,1.0,1.0,undersample,0.86287868924473,0.860229904595967,0.9343516588158627,COMPLETE
736,0.4425063987107783,2025-09-23 14:41:13.541615,2025-09-23 14:41:31.194637,0 days 00:00:17.653022,1.187976323347632,dart,0.2347191846667176,1.732092698562644,depthwise,0.007516234675864715,0.010017356827988417,3,3,1.5037866350509996,600,forest,0.31849854457008087,0.7682327714306753,oversample,0.7707167394730521,4.529968200707811,0.32722394812787253,weighted,0.11307896859703247,0.3043524210070002,0.39328488074521445,0.39793202293202296,0.31849854457008087,0.44090180171681914,0.4425063987107783,0.7682327714306753,0.7416188532136662,0.7359557715655236,0.28282706038968897,0.28421821724305896,0.9995722840034217,0.9987163029525032,oversample,0.8941814450572871,0.8926333651709548,0.7707167394730521,COMPLETE
737,0.5726894464758543,2025-09-23 14:41:31.317927,2025-09-23 14:41:32.092773,0 days 00:00:00.774846,0.0012209578476200307,gbtree,0.38981957095282455,4.292394826317542,lossguide,0.00020329269837941793,0.024686886326983407,8,7,61.14405044591141,300,,0.30044500039949157,0.9472318691170873,oversample,0.7496938676040887,2.1987843594453413,,,,0.49205130273758685,0.6437711127034497,0.653050778050778,0.30044500039949157,0.5657599201397554,0.5726894464758543,0.9472318691170873,0.7372382493355496,0.7265780492466034,0.39940098661028894,0.4059706828745084,0.9696321642429427,0.9717586649550706,oversample,0.895321589360641,0.8959000180061932,0.7496938676040887,COMPLETE
738,0.6554906762102091,2025-09-23 14:41:32.219645,2025-09-23 14:41:34.893645,0 days 00:00:02.674000,2.0992256245180587,gbtree,0.42488596335390566,5.474373698262709,lossguide,0.003567093388090941,0.003943864648340286,7,7,0.33744777261272935,700,,0.5612923438796728,0.8748827309168606,oversample,0.7779766433904308,0.9199861355067461,,,,0.97648665859037,0.8115467294503019,0.8127559377559378,0.5612923438796728,0.6554370204005241,0.6554906762102091,0.8748827309168606,0.7278657333099046,0.7221030227559971,0.5826955074875207,0.585464333781965,0.7489307100085543,0.7445442875481386,oversample,0.8854547379086916,0.8869595716334104,0.7779766433904308,COMPLETE
739,0.648427260812582,2025-09-23 14:41:35.018721,2025-09-23 14:41:35.513701,0 days 00:00:00.494980,0.0002052060041819044,gbtree,0.4751496902539447,2.2799450608437932,lossguide,0.20882071768907226,0.15795081490415003,6,11,0.41819214644172814,200,,0.33557622164712203,0.6477572423112823,none,0.8005175677864224,1.9720974803865121,,,,0.29485864418354224,0.7810420718599652,0.7803030303030303,0.33557622164712203,0.651685393258427,0.648427260812582,0.6477572423112823,0.7809554539859499,0.7750781520684529,0.5261635550880883,0.5253517387841784,0.8558597091531224,0.8468121523320497,none,0.8986907377931144,0.8965744009053885,0.8005175677864224,COMPLETE
740,0.0,2025-09-23 14:41:35.637028,2025-09-23 14:42:18.619601,0 days 00:00:42.982573,0.46848460407227527,dart,0.9559991544780042,4.505687897868656,lossguide,13.354228784238702,0.0007231333365393676,1,11,3.636437720302573,800,tree,0.6822259440818506,0.649085778595784,undersample,0.5442608107097531,1.0503915085584863,0.17176726736755377,weighted,0.6606440026499417,0.4752356757753952,0.7606715119254785,0.7607493857493858,0.6822259440818506,0.0,0.0,0.649085778595784,0.6798964777929531,0.6869455764084159,0.0,0.0,0.0,0.0,undersample,0.8706845205718674,0.8710597344377284,0.5442608107097531,COMPLETE
741,0.38612143742255267,2025-09-23 14:42:18.744011,2025-09-23 14:42:35.953112,0 days 00:00:17.209101,34.95020520313805,dart,0.8106997980498998,2.8903963754742557,depthwise,0.7925217482457457,0.00013283447431759,2,7,0.7098401918050564,500,tree,0.6836903598077044,0.7181026198882305,undersample,0.7159414489602611,4.604007428056639,0.14846110977111132,weighted,0.6860416688592623,0.7858446285172829,0.23932848807452145,0.23925061425061425,0.6836903598077044,0.3862228462872718,0.38612143742255267,0.7181026198882305,0.707358439507429,0.696710864897717,0.23932848807452145,0.23925061425061425,1.0,1.0,undersample,0.8823106713500732,0.8803822437858911,0.7159414489602611,COMPLETE
742,0.0,2025-09-23 14:42:36.077212,2025-09-23 14:43:02.866456,0 days 00:00:26.789244,2.353649917278121,dart,0.9356956809605272,0.08838136581726497,lossguide,0.0020008522794344808,0.00014765154788381606,9,6,2.58356907789295,800,tree,0.5336436933396809,0.6550149138603776,undersample,0.8284425146632195,0.5980645143186041,0.46904665438808185,uniform,0.06107636533379636,0.6116439053340603,0.7606715119254785,0.7607493857493858,0.5336436933396809,0.0,0.0,0.6550149138603776,0.7599019830986629,0.7497707004348031,0.0,0.0,0.0,0.0,undersample,0.8950881615280312,0.8908783803432025,0.8284425146632195,COMPLETE
743,0.7064994298745724,2025-09-23 14:43:02.990083,2025-09-23 14:43:15.837027,0 days 00:00:12.846944,0.34168040482076534,dart,0.6351561524482094,2.8220215489307843,lossguide,0.002083983079180021,0.021280750532091417,0,10,1.4753190108602332,400,forest,0.6316436274269934,0.6715775104553494,none,0.5536594568338153,2.051634014357791,0.04567781988736236,uniform,0.8528207147655706,0.38550742586141906,0.8675401781144436,0.8682432432432432,0.6316436274269934,0.7059090909090909,0.7064994298745724,0.6715775104553494,0.819585908232094,0.8153486162896746,0.7531522793404462,0.75634765625,0.6642429426860564,0.6628155755241762,none,0.924354244392005,0.9227329888835508,0.5536594568338153,COMPLETE
744,0.6144678492239468,2025-09-23 14:43:15.964935,2025-09-23 14:43:21.714000,0 days 00:00:05.749065,0.01948527384935946,dart,0.7248809211574503,1.2782224972230893,depthwise,7.513349919848517,0.010339269125087543,9,9,0.5746727204986706,300,forest,0.6024740000414874,0.7895847682935643,undersample,0.7870531154996894,4.896856795539336,0.35777329589699697,weighted,0.26734973384236227,0.39017221346460573,0.707237178830996,0.7151924651924652,0.6024740000414874,0.6095030038230476,0.6144678492239468,0.7895847682935643,0.7736080197135649,0.7683084970905345,0.44765342960288806,0.45439639270342286,0.9546621043627032,0.9486521181001284,undersample,0.9077811848475609,0.9062265151474582,0.7870531154996894,COMPLETE
745,0.6861940298507463,2025-09-23 14:43:21.837877,2025-09-23 14:43:22.335619,0 days 00:00:00.497742,32.94477615627489,gbtree,0.6425104451656649,6.133972919693297,depthwise,0.036126695404505825,0.37395642205989815,4,11,0.6876759762263254,800,,0.48815862164060825,0.9931036436210499,undersample,0.5668361945079687,0.7301052670599527,,,,0.8604082115752423,0.8223973794656567,0.8278050778050778,0.48815862164060825,0.6839132811076699,0.6861940298507463,0.9931036436210499,0.7773820370046188,0.7727345133062646,0.5956839098698826,0.6083360899768442,0.8028229255774166,0.7869062901155327,undersample,0.9066752877542682,0.9060016248761174,0.5668361945079687,COMPLETE
746,0.14336633663366335,2025-09-23 14:43:22.461159,2025-09-23 14:43:24.078023,0 days 00:00:01.616864,0.7596833455179438,gbtree,0.3301968775019839,1.4635776060027872,depthwise,0.0006130617334281355,0.00012525792600326667,0,8,6.348435084819119,900,,0.6638531645130283,0.8138795025522997,oversample,0.6525646911975687,1.7677296854590714,,,,0.3286239963497215,0.7790971440270242,0.7785626535626535,0.6638531645130283,0.1483820047355959,0.14336633663366335,0.8138795025522997,0.7375662240915937,0.7304693101166635,0.9591836734693877,0.9627659574468085,0.08041060735671514,0.07744972186563971,oversample,0.8950996156369423,0.8927883497223089,0.6525646911975687,COMPLETE
747,0.38612143742255267,2025-09-23 14:43:24.204937,2025-09-23 14:43:31.547243,0 days 00:00:07.342306,0.002091249003412843,dart,0.5821923260262365,5.73464700699188,depthwise,0.05716779995926609,0.000264877049142896,3,8,0.10235305683713773,300,tree,0.3753603406011145,0.7303230482752718,oversample,0.9478987843591975,1.3097274216053094,0.04018217284696579,uniform,0.26947587203336715,0.9219430239110789,0.23932848807452145,0.23925061425061425,0.3753603406011145,0.3862228462872718,0.38612143742255267,0.7303230482752718,0.7920139031799175,0.7860659027345835,0.23932848807452145,0.23925061425061425,1.0,1.0,oversample,0.913165939877555,0.9114475338281207,0.9478987843591975,COMPLETE
748,0.0,2025-09-23 14:43:31.673530,2025-09-23 14:43:32.130019,0 days 00:00:00.456489,0.025599516861781756,gbtree,0.316994898246136,3.8588096405740933,depthwise,1.098556807012595,0.0004999701441612425,1,3,1.5739535929852697,400,,0.5167655614477275,0.6332473909247468,oversample,0.9790017725600807,0.8429143921575415,,,,0.45252399798946785,0.7606715119254785,0.7607493857493858,0.5167655614477275,0.0,0.0,0.6332473909247468,0.7218519808731343,0.7196756472147432,0.0,0.0,0.0,0.0,oversample,0.8863611090294179,0.8875368696529538,0.9790017725600807,COMPLETE
749,0.6946216955332726,2025-09-23 14:43:32.253444,2025-09-23 14:43:41.929949,0 days 00:00:09.676505,0.0011663856604018912,dart,0.42168224585529956,6.968372466688963,depthwise,0.00011199651463575166,0.015798506385033474,5,8,6.820955420786176,400,tree,0.5547987504369906,0.7962556287559368,none,0.6063060513714795,3.290008427592467,0.3100910188275991,weighted,0.1779333191545504,0.5826872905118101,0.8248541304125294,0.8285217035217035,0.5547987504369906,0.6923215249055925,0.6946216955332726,0.7962556287559368,0.7855366427489006,0.777060542266182,0.5972696245733788,0.605146124523507,0.8233532934131736,0.8151476251604621,none,0.9118390187731119,0.9101704300301614,0.6063060513714795,COMPLETE
750,0.0,2025-09-23 14:43:42.057241,2025-09-23 14:43:43.468865,0 days 00:00:01.411624,0.0028885786224198784,gbtree,0.3943673393186532,9.797319057173853,lossguide,0.008526221951329904,0.00018264773997826305,1,11,1.1408489807193218,400,,0.49297854825200804,0.6597455392907459,oversample,0.807702929337047,0.6939615333689627,,,,0.9625975753848144,0.7606715119254785,0.7607493857493858,0.49297854825200804,0.0,0.0,0.6597455392907459,0.7196237728932479,0.7107603488911108,0.0,0.0,0.0,0.0,oversample,0.8890693726452166,0.8877711747391362,0.807702929337047,COMPLETE
751,0.6037735849056604,2025-09-23 14:43:43.594733,2025-09-23 14:43:44.305667,0 days 00:00:00.710934,67.4628453346967,gbtree,0.36692581393848167,9.514942327257783,lossguide,0.011137726228647275,0.001179829150841953,7,6,0.3636785556692843,400,,0.45835599265601035,0.7990484758230589,none,0.9297179162647575,1.9820164708538552,,,,0.6932814351255969,0.8467601596888116,0.8430589680589681,0.45835599265601035,0.6178197600204238,0.6037735849056604,0.7990484758230589,0.7437257393186548,0.7386295300237465,0.766307789740342,0.762402088772846,0.5175363558597091,0.49978605049208386,none,0.896953799880486,0.8956245986827206,0.9297179162647575,COMPLETE
752,0.6036860068259385,2025-09-23 14:43:44.431613,2025-09-23 14:43:44.711535,0 days 00:00:00.279922,0.622311094800289,gbtree,0.3089143755151804,9.302194109147369,lossguide,52.50993623246564,0.32579252872962994,4,5,2.1168376567832783,200,,0.3190253086913438,0.7783421482558817,oversample,0.5063776650640367,1.6755285956610215,,,,0.249441522976852,0.6950557887194185,0.7028050778050778,0.3190253086913438,0.5960677966101695,0.6036860068259385,0.7783421482558817,0.7617882053571073,0.7588505414644509,0.4363708556680564,0.4432638331996792,0.9401197604790419,0.9460847240051348,oversample,0.8962821516549345,0.8970267726815125,0.5063776650640367,COMPLETE
753,0.6656626506024096,2025-09-23 14:43:44.835780,2025-09-23 14:43:58.464807,0 days 00:00:13.629027,0.00015866418195295778,dart,0.3016955250633401,7.741873743489704,lossguide,6.678669621886271,0.05552518030681795,9,12,0.18504168039426552,500,tree,0.44663104671766907,0.5907592217328705,undersample,0.7475719408873881,0.6323012644105284,0.36298301759069107,uniform,0.39381713325570833,0.23420517815144964,0.8120585525642338,0.8181818181818182,0.44663104671766907,0.6633663366336634,0.6656626506024096,0.5907592217328705,0.7649257372311852,0.7584624312446043,0.5805519897304237,0.5942857142857143,0.7737382378100941,0.756525459991442,undersample,0.897047763864393,0.8963307097958471,0.7475719408873881,COMPLETE
754,0.0,2025-09-23 14:43:58.590212,2025-09-23 14:44:00.082528,0 days 00:00:01.492316,1.88410348968107,gbtree,0.7578394198231222,8.217685558801328,depthwise,73.11132635729632,0.0004330740845884779,7,9,2.0815390837515824,900,,0.6684326362116559,0.9269075243320704,none,0.8871002275255613,3.13541059547368,,,,0.31483589938050804,0.7606715119254785,0.7607493857493858,0.6684326362116559,0.0,0.0,0.9269075243320704,0.7270743796725001,0.7181112087237308,0.0,0.0,0.0,0.0,none,0.893153510730428,0.8914806981612089,0.8871002275255613,COMPLETE
755,0.38612143742255267,2025-09-23 14:44:00.206883,2025-09-23 14:44:00.998072,0 days 00:00:00.791189,25.705154248458744,gbtree,0.5957072106582141,8.035321076999647,depthwise,5.768362971098379,0.0010322719243977953,3,8,0.524567389982581,400,,0.5258390576836401,0.921317739564067,oversample,0.5303877790936924,4.315993619424412,,,,0.6490432313470396,0.23932848807452145,0.23925061425061425,0.5258390576836401,0.3862228462872718,0.38612143742255267,0.921317739564067,0.7285504945250747,0.7231818590496298,0.23932848807452145,0.23925061425061425,1.0,1.0,oversample,0.8937849256789494,0.8921779990806302,0.5303877790936924,COMPLETE
756,0.38612143742255267,2025-09-23 14:44:01.123734,2025-09-23 14:44:02.001897,0 days 00:00:00.878163,50.49503746598499,gbtree,0.3553990982150991,2.768985553163591,depthwise,9.941135891346569,0.00011701711139226647,6,9,0.1975331070469681,800,,0.4389023299989739,0.8030208116365265,undersample,0.8703686540224876,1.692672467827835,,,,0.612340981731327,0.23932848807452145,0.23925061425061425,0.4389023299989739,0.3862228462872718,0.38612143742255267,0.8030208116365265,0.689100797004721,0.6868612757410993,0.23932848807452145,0.23925061425061425,1.0,1.0,undersample,0.8728960845251075,0.8717077155472913,0.8703686540224876,COMPLETE
