number,value,datetime_start,datetime_complete,duration,params_alpha,params_booster,params_colsample_bytree,params_gamma,params_grow_policy,params_lambda,params_learning_rate,params_max_delta_step,params_max_depth,params_min_child_weight,params_n_estimators,params_normalize_type,params_params_decision_threshold,params_params_feature_fraction,params_params_resampling,params_params_sample_rows,params_params_scale_pos_weight,params_rate_drop,params_sample_type,params_skip_drop,params_subsample,user_attrs_acc_test,user_attrs_acc_val,user_attrs_decision_threshold,user_attrs_f1_test,user_attrs_f1_val,user_attrs_feature_fraction,user_attrs_pr_auc_test,user_attrs_pr_auc_val,user_attrs_prec_test,user_attrs_prec_val,user_attrs_rec_test,user_attrs_rec_val,user_attrs_resampling_strategy,user_attrs_roc_auc_test,user_attrs_roc_auc_val,user_attrs_sample_rows,state
377,0.6919351442408929,2025-09-23 13:16:07.573500,2025-09-23 13:16:08.390136,0 days 00:00:00.816636,1.1762875153657026,gbtree,0.5899431006845455,1.1191336648993921,depthwise,10.458444690509186,0.24816827745653747,6,4,11.730328606087863,800,,0.6159164650281816,0.7622048746498487,oversample,0.9379480200050687,0.7920168398766773,,,,0.769517701403801,0.8519807554509161,0.8502252252252253,0.6159164650281816,0.6983729662077597,0.6919351442408929,0.7622048746498487,0.7920183281046357,0.7821432150562465,0.6815960912052117,0.6811774461028193,0.7159965782720273,0.7030380830124091,oversample,0.9127069409252319,0.9100083051910985,0.9379480200050687,COMPLETE
378,0.539378911323651,2025-09-23 13:16:08.519084,2025-09-23 13:16:58.328247,0 days 00:00:49.809163,0.09200544550314764,dart,0.21196798414138363,2.829793171046294,depthwise,0.008940274345000807,0.00027005422123225624,9,5,3.3955908250761273,800,forest,0.624275122766875,0.6720004429952845,oversample,0.9199530727125104,1.882558365211157,0.12988837440897333,weighted,0.3636030910148783,0.7849603725140148,0.5933053536697718,0.6006347256347256,0.624275122766875,0.5350497366881217,0.539378911323651,0.6720004429952845,0.719028961169631,0.7135819987719281,0.3682938617689705,0.3724722765818656,0.9777587681779298,0.97732135216089,oversample,0.8872043962136286,0.8892001536083184,0.9199530727125104,COMPLETE
379,0.6936801734200434,2025-09-23 13:16:58.548093,2025-09-23 13:17:30.041246,0 days 00:00:31.493153,0.004159902250628906,dart,0.36698783156931497,2.9497545938416927,lossguide,3.0944991536800743,0.12486620918764724,7,7,3.0110528747826026,600,forest,0.40662407218224444,0.885395677426582,oversample,0.744192361124913,0.8850627528200159,0.1916065926992248,uniform,0.6524860219602149,0.42102839052140706,0.8096018016173611,0.8119369369369369,0.40662407218224444,0.6933728981206726,0.6936801734200434,0.885395677426582,0.8219714123117566,0.8151443496769708,0.5641094420600858,0.5683060109289617,0.8994867408041061,0.8900299529311082,oversample,0.925051045610492,0.923590831110487,0.744192361124913,COMPLETE
380,0.6529832935560859,2025-09-23 13:17:30.170699,2025-09-23 13:17:30.905280,0 days 00:00:00.734581,2.0379162943578915,gbtree,0.9452910339250484,7.955567869219886,depthwise,19.079340463415836,0.002835133812145824,4,3,2.4159255537450717,700,,0.47144953683882707,0.9048969179030801,undersample,0.6518570693931451,1.0354359813539051,,,,0.8202017999436375,0.7693725048623196,0.7767199017199017,0.47144953683882707,0.6480237462896422,0.6529832935560859,0.9048969179030801,0.7507733788592069,0.7409236602712822,0.5104602510460251,0.5197568389057751,0.8870829769033362,0.8780487804878049,undersample,0.8988441019800183,0.8952030625845641,0.6518570693931451,COMPLETE
381,0.6612407862407862,2025-09-23 13:17:31.035865,2025-09-23 13:17:31.441264,0 days 00:00:00.405399,2.029916759622878,gbtree,0.7124031966212765,6.797638790481367,lossguide,6.740809149924045,0.18910154650738623,7,4,0.11035738009229815,300,,0.44874801887505067,0.7416268522596137,oversample,0.9734772751924821,1.6451891654065456,,,,0.3155274100683908,0.766403930801515,0.7741605241605242,0.44874801887505067,0.6531914893617021,0.6612407862407862,0.7416268522596137,0.8043371896777732,0.7996209699300408,0.5066006600660066,0.515688622754491,0.9191616766467066,0.9212665810868635,oversample,0.9161639233788033,0.9154251059540959,0.9734772751924821,COMPLETE
382,0.6290616064465817,2025-09-23 13:17:31.569706,2025-09-23 13:17:46.122474,0 days 00:00:14.552768,0.0007317473222459161,dart,0.7817608779124772,4.706436180102043,lossguide,0.020098007942487107,0.011803206579073931,0,10,11.750417314746137,400,tree,0.5178023075368856,0.6172887956712076,none,0.9862990597642014,1.1124953194252847,0.014803753328280544,weighted,0.7268189791261627,0.9900001609386728,0.8539256832838571,0.8539107289107289,0.5178023075368856,0.6315517686547896,0.6290616064465817,0.6172887956712076,0.7764166694415539,0.774698110359855,0.796742671009772,0.8013245033112583,0.5230966638152267,0.517757809157039,none,0.898567591732735,0.8980535633289105,0.9862990597642014,COMPLETE
383,0.6819551389353867,2025-09-23 13:17:46.247776,2025-09-23 13:18:07.025106,0 days 00:00:20.777330,0.01830525723475737,dart,0.7745888045846263,6.151297098740985,depthwise,0.00026042686827462924,0.008857982126251185,6,7,23.95520377001596,500,forest,0.4202737983721688,0.9168351031523507,none,0.8064843378595583,2.7611584290233218,0.014872525338264442,weighted,0.7519096669819214,0.5650148266041457,0.7975227761285699,0.8054873054873055,0.4202737983721688,0.6771139405811296,0.6819551389353867,0.9168351031523507,0.8077032309536445,0.7978832827590276,0.5475184794086589,0.5600769865273577,0.8870829769033362,0.8716302952503209,none,0.9184806464123486,0.9153045848075292,0.8064843378595583,COMPLETE
384,0.6319208622471578,2025-09-23 13:18:07.189808,2025-09-23 13:18:07.720777,0 days 00:00:00.530969,0.0012642529769641643,gbtree,0.9717484885654339,9.255180551897967,depthwise,6.337141493147446,0.018291518387390585,10,9,48.91565526804741,400,,0.5798076890515219,0.8329844090548906,undersample,0.7061822863101843,2.4854929624410422,,,,0.4975968710048945,0.7357969085883919,0.7447788697788698,0.5798076890515219,0.6249091701787531,0.6319208622471578,0.8329844090548906,0.7645901527133627,0.7616237763178031,0.4732555580013207,0.4824165915238954,0.9195893926432849,0.9157038938810441,undersample,0.8960326650465146,0.8968967215541735,0.7061822863101843,COMPLETE
385,0.6197524872603737,2025-09-23 13:18:07.850113,2025-09-23 13:18:08.654146,0 days 00:00:00.804033,0.12966426518114318,gbtree,0.5664213534660352,1.4132073720942229,depthwise,0.08441064487267239,0.00512298895768724,2,12,6.398661967039813,200,,0.6821285582612187,0.8097068162544316,none,0.9635033923744902,3.906765537810361,,,,0.32211475437463755,0.8375473436380387,0.8395782145782146,0.6821285582612187,0.6180505415162455,0.6197524872603737,0.8097068162544316,0.7199518371380069,0.7125550301570089,0.7066593285635663,0.7158071748878924,0.5491873396065012,0.5464270432178006,none,0.8859687914096255,0.8872950787812703,0.9635033923744902,COMPLETE
386,0.0,2025-09-23 13:18:08.837774,2025-09-23 13:18:11.560094,0 days 00:00:02.722320,0.267474029356556,dart,0.8169692473462411,9.012276238851848,lossguide,0.3863728238637781,0.03745441344418118,2,8,65.77451561424542,200,tree,0.6908961339600574,0.8679842354886611,none,0.9280505503783751,0.6918222602971491,0.34816120432845643,uniform,0.10106418259500734,0.25465175000920104,0.7606715119254785,0.7607493857493858,0.6908961339600574,0.0,0.0,0.8679842354886611,0.7127142593496117,0.7037531726010325,0.0,0.0,0.0,0.0,none,0.8849571748710894,0.8804237611039392,0.9280505503783751,COMPLETE
387,0.6542404473438956,2025-09-23 13:18:11.754520,2025-09-23 13:19:22.729731,0 days 00:01:10.975211,0.06454793416996751,dart,0.7095442030757984,6.045899677506546,lossguide,2.568668367270449,0.3739961117996025,0,5,23.916947848551448,900,tree,0.5535644483246871,0.9575847616150253,oversample,0.785099012345317,4.159590228181492,0.08025598969885955,uniform,0.8103147239091483,0.2742776280860289,0.7724434435459105,0.7721130221130221,0.5535644483246871,0.6579473765194646,0.6542404473438956,0.9575847616150253,0.7871306462178724,0.779065298308564,0.5138187935592405,0.5135332845647403,0.9144568006843456,0.9011553273427471,oversample,0.9113148925633363,0.9070889352201428,0.785099012345317,COMPLETE
388,0.0,2025-09-23 13:19:22.883618,2025-09-23 13:20:53.957825,0 days 00:01:31.074207,0.00020305183253461426,dart,0.42589592029551904,3.6519397578720616,lossguide,0.008236543303891833,0.00018191958522358384,5,11,0.49979982160677916,1000,tree,0.5493837673185402,0.5964384480892677,undersample,0.7041023852523078,0.6351672977004076,0.11072366140447137,uniform,0.7629522397593108,0.3365733183289633,0.7606715119254785,0.7607493857493858,0.5493837673185402,0.0,0.0,0.5964384480892677,0.7721990440573553,0.7631537201906857,0.0,0.0,0.0,0.0,undersample,0.9033840733090598,0.9026145372687605,0.7041023852523078,COMPLETE
389,0.5910208306378574,2025-09-23 13:20:54.089090,2025-09-23 13:21:00.925125,0 days 00:00:06.836035,0.001012147706555947,dart,0.7844976034093338,5.687203990394377,depthwise,5.591321222824587,0.17055581703166656,7,3,0.1779766396066088,300,tree,0.31252927678925935,0.7841148539937898,oversample,0.9287510366793819,2.8377003594171444,0.07855806611934651,uniform,0.27176963065788784,0.7170533998249629,0.6743781349165728,0.6763923013923014,0.31252927678925935,0.5903412749517064,0.5910208306378574,0.7841148539937898,0.8188201570437141,0.8126753816855785,0.4223327805417358,0.4235905044510386,0.9803250641573995,0.97732135216089,oversample,0.924369324676099,0.9230638893941795,0.9287510366793819,COMPLETE
390,0.6737111751520973,2025-09-23 13:21:01.056244,2025-09-23 13:21:01.897941,0 days 00:00:00.841697,0.004661417954971511,gbtree,0.4603509817048013,4.682269112657101,depthwise,0.0018045375707678867,0.04563520788817426,3,10,1.7152922761121832,900,,0.36704731847840616,0.8126501023934694,oversample,0.6826148790442406,1.0440543085436518,,,,0.7458081236055956,0.7861603029992834,0.7913595413595413,0.36704731847840616,0.6683600571519289,0.6737111751520973,0.8126501023934694,0.8142037424057621,0.8054097715089598,0.5314314567028529,0.5382450754668713,0.9003421727972626,0.9002995293110826,oversample,0.9192166736369813,0.9175405889366884,0.6826148790442406,COMPLETE
391,0.6437449556093624,2025-09-23 13:21:02.026504,2025-09-23 13:21:07.228973,0 days 00:00:05.202469,9.209131230995812,dart,0.34870085215367697,7.59776958731249,depthwise,0.00023476479571955686,0.01272843117442375,9,8,1.237715739824794,300,forest,0.5725381788915584,0.6928100647985471,oversample,0.787412722465612,1.3898936595035993,0.3957409274148158,weighted,0.06112083514917205,0.9108224995279552,0.7656873784420104,0.7740581490581491,0.5725381788915584,0.6349864455429756,0.6437449556093624,0.6928100647985471,0.6863961922523535,0.6818687476810599,0.5062293414696161,0.5168481078278901,0.8515825491873396,0.8532306375695335,oversample,0.8777981841265852,0.8793490614293348,0.787412722465612,COMPLETE
392,0.38612143742255267,2025-09-23 13:21:07.360576,2025-09-23 13:22:32.017186,0 days 00:01:24.656610,0.0023598102347106597,dart,0.3868444624692715,9.394692397340764,depthwise,0.019046092326410066,0.0001606412087969531,6,3,1.2247077897519476,1000,tree,0.6019591363711438,0.6383599145068866,oversample,0.5096131281725209,2.1711714380414167,0.07247618810535006,weighted,0.2508353581471679,0.9809751673678104,0.23932848807452145,0.23925061425061425,0.6019591363711438,0.3862228462872718,0.38612143742255267,0.6383599145068866,0.6552865045508222,0.6448674992546993,0.23932848807452145,0.23925061425061425,1.0,1.0,oversample,0.8642115100786374,0.8633739057149193,0.5096131281725209,COMPLETE
393,0.7042020285655144,2025-09-23 13:22:32.145630,2025-09-23 13:22:33.445117,0 days 00:00:01.299487,0.006515218317038477,gbtree,0.4933494270506935,1.0663266827984974,lossguide,1.3381082300430562,0.08257072505267002,9,11,5.844126291818583,900,,0.3703432469937056,0.688301415823511,none,0.6322169914315185,0.9849085801219977,,,,0.826715800324169,0.8539256832838571,0.8537059787059788,0.3703432469937056,0.7072820512820512,0.7042020285655144,0.688301415823511,0.8089723332006418,0.8004434358746642,0.6795427670476941,0.6820368885324779,0.737382378100941,0.7278562259306803,none,0.916776200180526,0.9145822928811275,0.6322169914315185,COMPLETE
394,0.5566759810472603,2025-09-23 13:22:33.572374,2025-09-23 13:22:34.060752,0 days 00:00:00.488378,0.16670447686867676,gbtree,0.9205421929514088,6.855068058840487,depthwise,0.00275739390499162,0.006266591563241419,2,3,0.5585353975574812,400,,0.3240899844683577,0.9745061521465265,undersample,0.6799898851235404,2.826099537695886,,,,0.7092557196166525,0.6182823216296448,0.6264332514332515,0.3240899844683577,0.5514254781667268,0.5566759810472603,0.9745061521465265,0.7731713322395584,0.763111209235773,0.38359832635983265,0.3887003732609433,0.9803250641573995,0.9803166452717159,undersample,0.9048220244441045,0.9019119099250403,0.6799898851235404,COMPLETE
395,0.7029469548133596,2025-09-23 13:22:34.187817,2025-09-23 13:23:02.409001,0 days 00:00:28.221184,4.694409155771595,dart,0.577188704727216,1.826541733828273,depthwise,94.49684466352639,0.36787129785288536,0,4,0.1859521954874301,600,forest,0.6870906174005926,0.9441344807123396,oversample,0.5255581239518309,1.4923209265084127,0.023658687801967948,weighted,0.2951892776406321,0.8726614535130237,0.8467601596888116,0.8452088452088452,0.6870906174005926,0.7091509617252768,0.7029469548133596,0.9441344807123396,0.8106806430387163,0.8038705825990178,0.6496974012103952,0.6498365419542318,0.7805816937553465,0.7655113393239196,oversample,0.9205206577444339,0.9188867059186708,0.5255581239518309,COMPLETE
396,0.6039933444259568,2025-09-23 13:23:02.533580,2025-09-23 13:23:03.122166,0 days 00:00:00.588586,0.008863351586362665,gbtree,0.582926499124202,4.523909543674454,depthwise,0.00023195573153187663,0.0018783301736138892,10,8,1.5645667783860038,300,,0.5761401290521428,0.5467395350028597,undersample,0.5785857382155248,1.8135072994368022,,,,0.794570352489113,0.704166240147405,0.7076167076167076,0.5761401290521428,0.600828729281768,0.6039933444259568,0.5467395350028597,0.705661922050236,0.6965719768564271,0.44369645042839656,0.44676923076923075,0.9302822925577416,0.9319640564826701,undersample,0.8833050203877384,0.8822017791178485,0.5785857382155248,COMPLETE
397,0.0,2025-09-23 13:23:03.251335,2025-09-23 13:23:51.317493,0 days 00:00:48.066158,0.06696281292421824,dart,0.7021645308938951,1.595664825969223,depthwise,0.0004705700469217179,0.0004664768920903207,2,11,7.5114042105312135,800,forest,0.6728024006577017,0.9710446495797105,none,0.9500227850569075,2.166034706630296,0.4660482398903262,uniform,0.37026762465537577,0.888835111479872,0.7606715119254785,0.7607493857493858,0.6728024006577017,0.0,0.0,0.9710446495797105,0.7958104635688157,0.7878466667991413,0.0,0.0,0.0,0.0,none,0.9143532820166231,0.9126090686145371,0.9500227850569075,COMPLETE
398,0.0,2025-09-23 13:23:51.446917,2025-09-23 13:24:01.901836,0 days 00:00:10.454919,0.0017830605525369439,dart,0.5008067178090234,8.205372927310568,lossguide,98.4303486505776,0.006358230661963152,6,8,14.328076418381258,400,tree,0.6946151098678088,0.8909155913441908,none,0.6405035324353495,0.5610426735028637,0.4384716989578346,weighted,0.2824179453902618,0.5493307782863792,0.7606715119254785,0.7607493857493858,0.6946151098678088,0.0,0.0,0.8909155913441908,0.7110171618820065,0.7024074248773678,0.0,0.0,0.0,0.0,none,0.8830828452098629,0.8819380779278332,0.6405035324353495,COMPLETE
399,0.5287514318442154,2025-09-23 13:24:02.026399,2025-09-23 13:24:03.005134,0 days 00:00:00.978735,28.036561652303888,gbtree,0.5902283054078783,6.94386494245736,depthwise,0.0023315814354188586,0.0037034653180633183,10,11,0.46400849412873935,600,,0.4091631790620162,0.9059356320328376,undersample,0.6941024926184731,4.6207486842318275,,,,0.5350565586094214,0.5749820861910124,0.5788288288288288,0.4091631790620162,0.5277525022747953,0.5287514318442154,0.9059356320328376,0.7580508497257747,0.7504381649455439,0.3594669972110319,0.3610198654778664,0.9923011120615911,0.9875909285408644,undersample,0.9013540195691436,0.8987977079906787,0.6941024926184731,COMPLETE
400,0.0,2025-09-23 13:24:03.132559,2025-09-23 13:24:11.501063,0 days 00:00:08.368504,0.001041826955072772,dart,0.8756317528014195,3.1834143156516803,depthwise,0.0053844129852298325,0.00037124085981612195,10,11,3.2816884934988697,300,tree,0.5162179545971651,0.6091270671484412,none,0.5885843201941137,0.8137585230844642,0.06692475421284488,weighted,0.4322872514115357,0.638233509389787,0.7606715119254785,0.7607493857493858,0.5162179545971651,0.0,0.0,0.6091270671484412,0.7987092944478229,0.7930618664976116,0.0,0.0,0.0,0.0,none,0.911975230575817,0.9121140278610571,0.5885843201941137,COMPLETE
401,0.562641794807159,2025-09-23 13:24:11.629625,2025-09-23 13:24:46.304848,0 days 00:00:34.675223,58.31964274730057,dart,0.5782190458289351,2.8307566634520933,lossguide,0.0005007067227168575,0.0014664338685067223,2,12,1.5535699796625717,700,tree,0.3099881314744845,0.8270928944152957,undersample,0.88270103138443,0.5652421580954192,0.2580348889888448,weighted,0.34888463109809403,0.2768362257568113,0.6378339645818405,0.6447583947583948,0.3099881314744845,0.5590727816550349,0.562641794807159,0.8270928944152957,0.6802303961624798,0.6700325727928729,0.3944776644389729,0.3987850634268358,0.9593669803250642,0.9550706033376123,undersample,0.8678874156640868,0.8651252916073346,0.88270103138443,COMPLETE
402,0.5055884286653517,2025-09-23 13:24:46.437255,2025-09-23 13:24:46.800763,0 days 00:00:00.363508,10.875909866221958,gbtree,0.5962058804319845,1.6627715989860148,lossguide,0.0007462027609605712,0.010849838718271497,5,3,0.8329654582395916,200,,0.3827591664521914,0.6785181989752482,oversample,0.6894915206555472,2.1660309395986044,,,,0.21804059735460035,0.5358788002866209,0.538083538083538,0.3827591664521914,0.5058849171752398,0.5055884286653517,0.6785181989752482,0.7538576964441197,0.7459983879817622,0.33942673296285464,0.3398144056562086,0.9927288280581694,0.9871630295250321,oversample,0.8971104736717234,0.8931104688307152,0.6894915206555472,COMPLETE
403,0.0,2025-09-23 13:24:46.934990,2025-09-23 13:25:09.357939,0 days 00:00:22.422949,0.00010663533578132116,dart,0.21248932388361796,8.641966211531821,depthwise,0.34453603879135175,0.00010585194927893557,9,5,0.6711470384109745,500,tree,0.6337569309493394,0.5766483765551325,none,0.6242911948506976,1.8516561995721952,0.44296287019029273,uniform,0.7967400375198497,0.8303418541695702,0.7606715119254785,0.7607493857493858,0.6337569309493394,0.0,0.0,0.5766483765551325,0.7050404861338181,0.7017628156705056,0.0,0.0,0.0,0.0,none,0.8782137553142173,0.879895552562393,0.6242911948506976,COMPLETE
404,0.6990176817288801,2025-09-23 13:25:09.484388,2025-09-23 13:25:10.295495,0 days 00:00:00.811107,0.00033580856658924725,gbtree,0.38561381722244664,1.448006684225307,depthwise,0.009027917064388461,0.0157615362264572,10,4,0.10672154484889118,700,,0.6641982475850069,0.8905632522023533,none,0.7888866183521733,3.781212844003281,,,,0.9868257566562391,0.8458388780837343,0.8431613431613432,0.6641982475850069,0.7055142745404771,0.6990176817288801,0.8905632522023533,0.8055870644556312,0.7938663992230327,0.6498559077809798,0.6462041409371595,0.7715996578272027,0.7612323491655969,none,0.9195633474961376,0.9155673646700984,0.7888866183521733,COMPLETE
405,0.684887459807074,2025-09-23 13:25:10.422713,2025-09-23 13:25:52.761187,0 days 00:00:42.338474,0.16421802049528814,dart,0.4592229090811219,5.394171628836234,lossguide,87.74878984443399,0.10030628579443794,2,5,45.9605847686883,800,forest,0.47991279193119196,0.784644327460355,oversample,0.6582381933643586,0.5247310635004283,0.14196493500398127,uniform,0.3313938008414192,0.8185048225171347,0.8404135530760569,0.8394758394758395,0.47991279193119196,0.6914704136156739,0.684887459807074,0.784644327460355,0.7856511253617772,0.7784277121400367,0.6434622467771639,0.6456991284577491,0.7472198460222412,0.7291399229781772,oversample,0.9091643980048439,0.9077864376799434,0.6582381933643586,COMPLETE
406,0.0,2025-09-23 13:25:52.890992,2025-09-23 13:25:53.437055,0 days 00:00:00.546063,0.005251915802704723,gbtree,0.6750546036114589,8.553650198579636,depthwise,0.0009297311358985536,0.00010111084740779067,8,4,1.5698460438100728,400,,0.6601209790090465,0.9594719894936277,oversample,0.5666081258580286,0.8948471693131098,,,,0.6345621809801216,0.7606715119254785,0.7607493857493858,0.6601209790090465,0.0,0.0,0.9594719894936277,0.7521262928900952,0.7468527113926521,0.0,0.0,0.0,0.0,oversample,0.8953507426579449,0.8933251957086641,0.5666081258580286,COMPLETE
407,0.648240018899126,2025-09-23 13:25:53.571812,2025-09-23 13:26:55.149989,0 days 00:01:01.578177,0.00183961125105903,dart,0.7067511446542944,0.10389553165235488,depthwise,26.652086116916877,0.011024471196613964,10,8,5.010365053336418,900,tree,0.5910032597582556,0.9923293534902933,undersample,0.8565758990420428,0.5832176776378284,0.1957474755529709,weighted,0.23939470390793732,0.22036647821049168,0.8473743474255298,0.8475634725634725,0.5910032597582556,0.6549409858828975,0.648240018899126,0.9923293534902933,0.7574713173241764,0.7475701466274849,0.713565305093293,0.7236286919831224,0.605218135158255,0.5870774497218656,undersample,0.9020377262661367,0.9001206190376079,0.8565758990420428,COMPLETE
408,0.6449806118052563,2025-09-23 13:26:55.282364,2025-09-23 13:27:04.934173,0 days 00:00:09.651809,0.004946927092861259,dart,0.9759190671460418,7.421331710376631,lossguide,0.013468883902972446,0.2578951726288439,6,8,2.8052761864041873,300,forest,0.49811648003409137,0.7020590557114605,none,0.8662290784169415,1.6975895837496255,0.33910625575035785,weighted,0.41154000161587606,0.2788794120694674,0.8297676323062749,0.8312858312858313,0.49811648003409137,0.6471461913855294,0.6449806118052563,0.7020590557114605,0.7149479751407879,0.7098809937576602,0.6421052631578947,0.6494577006507593,0.6522668947818648,0.6405648267008985,none,0.8823057213331569,0.8833695040730447,0.8662290784169415,COMPLETE
