number,value,datetime_start,datetime_complete,duration,params_alpha,params_booster,params_colsample_bytree,params_gamma,params_grow_policy,params_lambda,params_learning_rate,params_max_delta_step,params_max_depth,params_min_child_weight,params_n_estimators,params_normalize_type,params_params_decision_threshold,params_params_feature_fraction,params_params_resampling,params_params_sample_rows,params_params_scale_pos_weight,params_rate_drop,params_sample_type,params_skip_drop,params_subsample,user_attrs_acc_test,user_attrs_acc_val,user_attrs_decision_threshold,user_attrs_f1_test,user_attrs_f1_val,user_attrs_feature_fraction,user_attrs_pr_auc_test,user_attrs_pr_auc_val,user_attrs_prec_test,user_attrs_prec_val,user_attrs_rec_test,user_attrs_rec_val,user_attrs_resampling_strategy,user_attrs_roc_auc_test,user_attrs_roc_auc_val,user_attrs_sample_rows,state
567,0.7098005939753924,2025-09-23 13:59:32.251180,2025-09-23 13:59:37.968744,0 days 00:00:05.717564,5.756207983946843,dart,0.47674736766419834,0.09235881993884698,lossguide,1.7765233178424205,0.3590149651060528,0,9,0.17488523720381582,300,tree,0.3578745630798037,0.8830444543763162,none,0.7587628632392744,0.8204791556276738,0.3980948079661283,uniform,0.1275268924381587,0.5330215656787113,0.8623195823523391,0.85995085995086,0.3578745630798037,0.7146191385529387,0.7098005939753924,0.8830444543763162,0.8160958566532791,0.8083535955644229,0.7090526315789474,0.7038283550694152,0.72027373823781,0.715875053487377,none,0.9212683980904907,0.9197512277695923,0.7587628632392744,COMPLETE
568,0.5454326923076923,2025-09-23 13:59:38.090914,2025-09-23 13:59:56.333496,0 days 00:00:18.242582,4.600471790546896,dart,0.7371650995973271,2.543546393165199,depthwise,0.0001034665488279612,0.0003731648451559221,3,10,23.255221989067493,500,forest,0.43749669714740785,0.6824326844659148,undersample,0.7657485948611285,0.9624997515647516,0.0037069587035251095,uniform,0.8208737842714082,0.6722389162300753,0.6096836933155901,0.6128173628173628,0.43749669714740785,0.5439540724793684,0.5454326923076923,0.6824326844659148,0.7467390353863201,0.7397456324102623,0.3775527145940561,0.379241183352833,0.9726261762189906,0.9709028669234061,undersample,0.8932067234122794,0.8912657409513984,0.7657485948611285,COMPLETE
569,0.5033271517399367,2025-09-23 13:59:56.459777,2025-09-23 13:59:57.109781,0 days 00:00:00.650004,1.6314278524597317,gbtree,0.4084646540709018,4.043834050247563,lossguide,0.03381978062183902,0.007095222137930932,5,4,1.592270024400936,400,,0.3556046790033819,0.6625505895952367,oversample,0.958739436331918,3.329825688510896,,,,0.5615305219608184,0.5326031323574573,0.5338861588861589,0.3556046790033819,0.5026143790849673,0.5033271517399367,0.6625505895952367,0.6904657773097926,0.6836350705035064,0.3371821104940076,0.3377745241581259,0.9867408041060736,0.9871630295250321,oversample,0.8772959876429158,0.8796598942765239,0.958739436331918,COMPLETE
570,0.6170640620511347,2025-09-23 13:59:57.233034,2025-09-23 14:00:18.856702,0 days 00:00:21.623668,0.0001814901894911708,dart,0.820641792854576,7.169418487551793,lossguide,0.00011819040218294158,0.14744723585173392,10,5,58.781919935178074,600,tree,0.3731612855025786,0.8329659899804258,none,0.7984858655777524,4.436071362272221,0.39609863589710625,uniform,0.5836530281796833,0.6621788510593741,0.7175760057324189,0.7270679770679771,0.3731612855025786,0.6093727877672377,0.6170640620511347,0.8329659899804258,0.7110021198097756,0.7002999937826133,0.45544973544973544,0.46443243243243243,0.9204448246364414,0.9191270860077022,none,0.8884379289175269,0.8865663087712619,0.7984858655777524,COMPLETE
571,0.38612143742255267,2025-09-23 14:00:18.979498,2025-09-23 14:00:19.796657,0 days 00:00:00.817159,7.258102230752392,gbtree,0.26049078243902346,5.455674066953825,depthwise,0.00018239738402169332,0.0001736912467837615,1,8,0.3456899565198631,600,,0.6066655063096364,0.9817037378768996,undersample,0.5172955279007079,4.291695689897098,,,,0.5138817296228111,0.23932848807452145,0.23925061425061425,0.6066655063096364,0.3862228462872718,0.38612143742255267,0.9817037378768996,0.7156208246320983,0.7089090263091724,0.23932848807452145,0.23925061425061425,1.0,1.0,undersample,0.8850810116315037,0.8851876574138325,0.5172955279007079,COMPLETE
572,0.7117466802860062,2025-09-23 14:00:19.921960,2025-09-23 14:00:36.660777,0 days 00:00:16.738817,0.013201793243133204,dart,0.6054829909607689,5.692433255743683,lossguide,6.728705753694333,0.035537283325385055,4,4,2.3216305681143523,500,tree,0.6745938197007776,0.9944671860597782,oversample,0.5341649705097775,1.1430329921554105,0.2995818911189088,weighted,0.7982601674342904,0.5940153931554142,0.8568942573446617,0.8555487305487306,0.6745938197007776,0.7161997563946407,0.7117466802860062,0.9944671860597782,0.8183753424697267,0.8115987718049591,0.6816074188562596,0.6810007818608288,0.7544910179640718,0.7454000855798032,oversample,0.9231634775319307,0.9218629966509171,0.5341649705097775,COMPLETE
573,0.5649873475960433,2025-09-23 14:00:36.782351,2025-09-23 14:00:37.509132,0 days 00:00:00.726781,0.00014160090496926096,gbtree,0.20339090817299468,1.7330187548825826,depthwise,0.8262378820993466,0.012596113078587169,4,8,1.644258220146519,700,,0.5293368175041545,0.5929468367378117,undersample,0.6313953685864941,0.5956896196787379,,,,0.3854061828040397,0.8083734261439247,0.8064086814086814,0.5293368175041545,0.5755102040816327,0.5649873475960433,0.5929468367378117,0.6263142034675835,0.6162339287660696,0.6124517374517374,0.6109452736318408,0.5427715996578272,0.5254599914420197,undersample,0.8334892876453678,0.8350542866285386,0.6313953685864941,COMPLETE
574,0.5720164609053497,2025-09-23 14:00:37.633698,2025-09-23 14:00:39.289798,0 days 00:00:01.656100,0.00037757437048765557,gbtree,0.5149012635597705,5.995283657656146,lossguide,33.144220464402906,0.0021765865153417358,1,10,6.386673122125464,900,,0.335688219863409,0.5452980207004077,undersample,0.7223733851685681,0.913116849649656,,,,0.8716339334664394,0.6565666905517453,0.6592956592956593,0.335688219863409,0.5699269324445584,0.5720164609053497,0.5452980207004077,0.6868544106813395,0.6799142526701699,0.40691927512355847,0.40889869461298034,0.9508126603934988,0.9516474112109542,undersample,0.8753425728276994,0.875784013667432,0.7223733851685681,COMPLETE
575,0.330028328611898,2025-09-23 14:00:39.414235,2025-09-23 14:01:32.970134,0 days 00:00:53.555899,0.21467571108563888,dart,0.5586286650401271,3.685099399342613,lossguide,0.008909208093240856,0.0016959677681607122,2,5,0.18497487752355846,900,tree,0.5914113766370352,0.5816817189457624,none,0.9208074842795826,1.0999595362995485,0.32559579842474345,uniform,0.8016605562965543,0.7614613960284669,0.8060190398198382,0.8063063063063063,0.5914113766370352,0.3272985445509407,0.330028328611898,0.5816817189457624,0.7701514779015668,0.760846330946589,0.9624217118997912,0.9568788501026694,0.1971770744225834,0.19940094137783482,none,0.9015051389809343,0.8987647993259569,0.9208074842795826,COMPLETE
576,0.0,2025-09-23 14:01:33.093081,2025-09-23 14:01:33.840862,0 days 00:00:00.747781,0.025604658710003687,gbtree,0.8064068202840207,1.9402919457434198,depthwise,0.005619530002930792,0.0002937245393473184,0,8,0.14461846222396546,300,,0.4822206885024508,0.7110854135980569,undersample,0.9158318669962133,0.6384899130162026,,,,0.7555952598991877,0.7606715119254785,0.7607493857493858,0.4822206885024508,0.0,0.0,0.7110854135980569,0.7215575724240283,0.7170687927598985,0.0,0.0,0.0,0.0,undersample,0.8879070683824116,0.8897885075572172,0.9158318669962133,COMPLETE
577,0.6538818434890195,2025-09-23 14:01:33.964775,2025-09-23 14:01:34.473291,0 days 00:00:00.508516,0.0027716548704389697,gbtree,0.34442412491060004,7.871298232003491,depthwise,0.00083278281858192,0.32463039848381103,4,6,30.468856611926885,900,,0.31513454763964727,0.592838943443931,oversample,0.9606132312732467,0.7479703889863851,,,,0.47973254665523096,0.7687583171256014,0.7708845208845209,0.31513454763964727,0.6549564686115779,0.6538818434890195,0.592838943443931,0.7820913803217742,0.7750310959818023,0.5093846519363269,0.5119883749091789,0.9170230966638152,0.9045785194694053,oversample,0.9107083428160692,0.9063030141169822,0.9606132312732467,COMPLETE
578,0.6825926576497453,2025-09-23 14:01:34.598599,2025-09-23 14:02:39.927786,0 days 00:01:05.329187,0.010595284288105413,dart,0.45883496979766286,5.806806014518394,lossguide,4.232238752940525,0.03830718771598505,7,4,0.17029367226525388,1000,tree,0.5710676573354179,0.5737796933186217,oversample,0.9824999848645959,1.3287677241756626,0.30896122791659314,uniform,0.8215266529238613,0.6854564725116952,0.8112396355819429,0.81500819000819,0.5710676573354179,0.6801942421089143,0.6825926576497453,0.5737796933186217,0.7993861242722236,0.7958787298771963,0.5720536756126021,0.5789630512514898,0.8387510692899914,0.8314077877620881,oversample,0.9114435066656583,0.912019246300021,0.9824999848645959,COMPLETE
579,0.62643196423582,2025-09-23 14:02:40.053316,2025-09-23 14:02:40.525091,0 days 00:00:00.471775,2.8301274341681393,gbtree,0.4976275344901138,6.609045325798055,lossguide,0.0226080623860476,0.09586357946168979,4,4,33.712107214437744,200,,0.3142366307078777,0.8449730675193237,oversample,0.6913505259270032,1.5189765498866274,,,,0.8803131525953449,0.7189067458286417,0.7262489762489762,0.3142366307078777,0.6193512614360965,0.62643196423582,0.8449730675193237,0.8150172124814966,0.8049902190912405,0.4581624282198523,0.4650487450736362,0.9555175363558597,0.959349593495935,oversample,0.9217077408709888,0.9187892755412265,0.6913505259270032,COMPLETE
580,0.7064997981429149,2025-09-23 14:02:40.650309,2025-09-23 14:02:41.220980,0 days 00:00:00.570671,4.377208262638028,gbtree,0.2184284000542964,4.201373927733485,depthwise,0.006431110803900053,0.06433417790621312,7,4,0.12215964612459503,700,,0.5623406828721377,0.8058360762200036,none,0.8464290033096519,2.3650157452315628,,,,0.9341722735083156,0.8534138601699253,0.8511466011466011,0.5623406828721377,0.7140575079872205,0.7064997981429149,0.8058360762200036,0.8178954808184344,0.8103996297076177,0.6696629213483146,0.6687046236148262,0.7647562018819504,0.7488232777064613,none,0.9212196749588659,0.9196664080615691,0.8464290033096519,COMPLETE
581,0.7115179902065148,2025-09-23 14:02:41.345220,2025-09-23 14:02:43.728966,0 days 00:00:02.383746,0.0070436909103538635,gbtree,0.5387735238620275,7.353248807221579,lossguide,12.18301488940785,0.007650281630968961,1,11,0.8885098290352664,1000,,0.6644962381152038,0.9671864405314228,none,0.5604923338979281,3.092454463630289,,,,0.939780285629261,0.8621148531067663,0.8612817362817363,0.6644962381152038,0.7157628191601604,0.7115179902065148,0.9671864405314228,0.8182705709657894,0.8114316370505377,0.7063723448563098,0.7080508474576271,0.7254063301967494,0.7150192554557124,none,0.9235843153073287,0.92178859945963,0.5604923338979281,COMPLETE
582,0.6162709006603906,2025-09-23 14:02:43.854399,2025-09-23 14:02:45.672845,0 days 00:00:01.818446,1.4664221348491295,gbtree,0.894929513435184,7.689336065847417,lossguide,20.59287782442711,0.0012422554683892589,4,5,0.17542592356024,900,,0.41358632151983443,0.6890809948100612,none,0.7110084364513893,4.58254880318691,,,,0.8910469607987528,0.7101033882690142,0.7204135954135954,0.41358632151983443,0.6086235489220564,0.6162709006603906,0.6890809948100612,0.7635859330405678,0.7534081813614584,0.4495712535728869,0.45878661087866107,0.941830624465355,0.938382541720154,none,0.9004178907885826,0.8968381020954037,0.7110084364513893,COMPLETE
583,0.0,2025-09-23 14:02:45.798170,2025-09-23 14:02:46.353535,0 days 00:00:00.555365,0.018249565450424495,gbtree,0.5788723614140241,3.427234811453237,depthwise,1.966983800026199,0.0008999256687497646,0,3,0.2565784682025248,600,,0.6787646007411483,0.8404946661961277,undersample,0.880819865900685,0.9710567872569519,,,,0.5671738088974855,0.7606715119254785,0.7607493857493858,0.6787646007411483,0.0,0.0,0.8404946661961277,0.7491034401854125,0.7409973460871311,0.0,0.0,0.0,0.0,undersample,0.89502332206226,0.8911286647022814,0.880819865900685,COMPLETE
584,0.631073610707012,2025-09-23 14:02:46.478398,2025-09-23 14:02:47.084700,0 days 00:00:00.606302,0.023697458611854006,gbtree,0.47909902614151323,5.617904307041535,lossguide,0.29644209373507496,0.006685422145716869,1,3,0.6504290012477252,600,,0.42484123324050693,0.9501321453023484,oversample,0.5378194518185199,1.257806638247845,,,,0.8025254549796912,0.7358992732111782,0.7403767403767404,0.42484123324050693,0.6282420749279539,0.631073610707012,0.9501321453023484,0.7715429380098859,0.764155108099532,0.4737070838765754,0.4780692087282345,0.932420872540633,0.9281129653401797,oversample,0.9059552617471096,0.9031249238825176,0.5378194518185199,COMPLETE
585,0.22610015174506828,2025-09-23 14:02:47.208638,2025-09-23 14:02:47.909968,0 days 00:00:00.701330,0.009180778622290225,gbtree,0.39862854740311787,6.675817686302359,depthwise,0.0005129301301465528,0.0002133048295096674,7,4,0.6068701145620309,700,,0.4673968588075191,0.8572536031218299,none,0.5102867979062891,2.2726293100674084,,,,0.9967498950392655,0.7923021803664654,0.7911547911547911,0.4673968588075191,0.23405058512646282,0.22610015174506828,0.8572536031218299,0.7395245516111342,0.7331892523444352,0.9967845659163987,0.9966555183946488,0.13259195893926431,0.12751390671801455,none,0.89372388506337,0.8906011471563199,0.5102867979062891,COMPLETE
586,0.600970130201685,2025-09-23 14:02:48.035492,2025-09-23 14:02:48.901454,0 days 00:00:00.865962,72.34677371270163,gbtree,0.728855876036606,0.4344724109150988,lossguide,0.3906451696044043,0.0005866300991920644,10,3,0.3446375966055387,900,,0.5694305698558624,0.9641389167164411,none,0.8964111315921532,2.846775356893391,,,,0.9139109871618649,0.846043607329307,0.839987714987715,0.5694305698558624,0.6174974567650051,0.600970130201685,0.9641389167164411,0.7435083209175298,0.7363631347372837,0.7616060225846926,0.7449367088607595,0.5192472198460223,0.5036371416345743,none,0.8917566274682887,0.8883403823520418,0.8964111315921532,COMPLETE
587,0.38612143742255267,2025-09-23 14:02:49.025638,2025-09-23 14:02:50.176517,0 days 00:00:01.150879,0.48304774786187304,gbtree,0.21990901061105853,8.5682720140232,lossguide,0.00019786169951867668,0.00018032216771178146,5,8,0.5167816334889068,500,,0.3121499386542627,0.8368530617293661,none,0.5108727246690702,1.6406441285757472,,,,0.6627588772393702,0.23932848807452145,0.23925061425061425,0.3121499386542627,0.3862228462872718,0.38612143742255267,0.8368530617293661,0.7066786185188558,0.6983099561867655,0.23932848807452145,0.23925061425061425,1.0,1.0,none,0.8818126766249496,0.8831948261475263,0.5108727246690702,COMPLETE
588,0.5749274081555359,2025-09-23 14:02:50.299969,2025-09-23 14:02:50.840887,0 days 00:00:00.540918,23.554864873971347,gbtree,0.3321016642826272,5.129402043371137,depthwise,0.018719487594202278,0.010841380052064507,0,12,0.5769100474209652,400,,0.4995145672686626,0.8893204575142633,undersample,0.5892662560937894,3.963986752318119,,,,0.38175152213403946,0.6486846145971952,0.6553030303030303,0.4995145672686626,0.5703555332999499,0.5749274081555359,0.8893204575142633,0.7498211966999532,0.7436112752067199,0.4031858407079646,0.4077722063037249,0.9743370402053037,0.9743260590500642,undersample,0.8990648381994877,0.8973270966375176,0.5892662560937894,COMPLETE
589,0.5870503597122302,2025-09-23 14:02:50.963851,2025-09-23 14:02:56.752208,0 days 00:00:05.788357,0.012326851002917178,dart,0.21022967528358444,8.233579335389638,lossguide,0.07584322055966222,0.11518174069208026,3,8,3.0893947166184237,300,tree,0.48603701604580196,0.5774425505040925,oversample,0.8741967841041607,4.732588009638116,0.40948759030926735,uniform,0.6210598781705171,0.30168143657009594,0.673866311802641,0.6768018018018018,0.48603701604580196,0.5849400729546639,0.5870503597122302,0.5774425505040925,0.7728515597672319,0.7675305160069962,0.42056950168602475,0.42275810097965333,0.9602224123182207,0.9602053915275995,oversample,0.9041321877843023,0.9030992994629179,0.8741967841041607,COMPLETE
590,0.6779327962271566,2025-09-23 14:02:56.874892,2025-09-23 14:03:24.556980,0 days 00:00:27.682088,0.00015353306842618995,dart,0.30155440598339744,0.2115272250771949,depthwise,0.43129526582336625,0.02751116832490373,7,11,51.39946249573907,700,forest,0.6137792626389784,0.6509491965942394,none,0.6021122771404449,3.720664052665634,0.27438588835604766,uniform,0.035952560815316406,0.8726184862643789,0.8310983724024977,0.8322072072072072,0.6137792626389784,0.6810977966756862,0.6779327962271566,0.6509491965942394,0.7778300798506002,0.7709334102829855,0.6212976022566996,0.6268168604651163,0.7536355859709153,0.7381258023106547,none,0.9055891043911369,0.9037951032252391,0.6021122771404449,COMPLETE
591,0.0,2025-09-23 14:03:24.679790,2025-09-23 14:03:48.101239,0 days 00:00:23.421449,1.9510226293439954,dart,0.3949680673800692,1.1352686806724122,depthwise,0.22083733390028,0.0014225334802443178,9,3,1.1326158502420882,600,tree,0.5126286770057107,0.8615294465255787,none,0.5545615321119033,0.8949725097887734,0.14886260588367584,weighted,0.6824118251270579,0.3088094953759686,0.7606715119254785,0.7607493857493858,0.5126286770057107,0.0,0.0,0.8615294465255787,0.7642962116229156,0.7566261534737423,0.0,0.0,0.0,0.0,none,0.8991962438811171,0.8959411610349662,0.5545615321119033,COMPLETE
592,0.0,2025-09-23 14:03:48.224145,2025-09-23 14:04:12.241229,0 days 00:00:24.017084,0.00296154458802372,dart,0.7839579871668467,5.470827239496151,depthwise,2.0960018586106877,0.00012197454095254484,6,7,6.058406435165727,600,forest,0.6337845455507645,0.7696833472321112,none,0.5593661588561849,1.50850966337145,0.1389178389043017,uniform,0.40834952239558914,0.5652875305522592,0.7606715119254785,0.7607493857493858,0.6337845455507645,0.0,0.0,0.7696833472321112,0.7896398970278988,0.7789653750146212,0.0,0.0,0.0,0.0,none,0.9077193096361057,0.9052795056986118,0.5593661588561849,COMPLETE
593,0.6653968253968254,2025-09-23 14:04:12.367652,2025-09-23 14:04:13.605817,0 days 00:00:01.238165,0.0001671766251057747,gbtree,0.63420462492823,7.016335909990409,lossguide,0.005250345689664212,0.0012240547826693094,3,4,4.629987010845397,1000,,0.6241634705355802,0.8254097565936319,undersample,0.7810205228468194,1.1313422282031547,,,,0.6998253616161496,0.8381615313747569,0.8381449631449631,0.6241634705355802,0.6755592037759081,0.6653968253968254,0.8254097565936319,0.7692195837808199,0.7622187581358115,0.6493096646942801,0.6582914572864321,0.7040205303678357,0.6726572528883183,undersample,0.9016842893024724,0.8990244121254293,0.7810205228468194,COMPLETE
594,0.7104815864022663,2025-09-23 14:04:13.730323,2025-09-23 14:04:15.065306,0 days 00:00:01.334983,0.2092047326419195,gbtree,0.9758414402555982,7.974203581181253,depthwise,0.00011211705890421363,0.007709635270464121,3,10,6.510996673429789,600,,0.49713961753040264,0.9979204739779857,none,0.974847360139226,2.175021951609484,,,,0.7742086086466549,0.8447128672330843,0.8430589680589681,0.49713961753040264,0.7151173708920188,0.7104815864022663,0.9979204739779857,0.8236200825330997,0.8159928710985223,0.6374288583863408,0.6359026369168357,0.8143712574850299,0.8048780487804879,none,0.9257692873092271,0.923237588409286,0.974847360139226,COMPLETE
595,0.6610738255033557,2025-09-23 14:04:15.190219,2025-09-23 14:04:16.743786,0 days 00:00:01.553567,0.9308146715148717,gbtree,0.7491953238234501,2.0028190473975815,lossguide,0.0948187747019834,0.0017275012778706971,2,6,24.483724857383354,600,,0.48420951205071827,0.9320458979606046,oversample,0.7259595457532175,0.5417423109989851,,,,0.8931766769908223,0.8567918927218753,0.8552416052416052,0.48420951205071827,0.6676170111665479,0.6610738255033557,0.9320458979606046,0.7880291944850317,0.7812383611109538,0.7509353287012293,0.7514986376021798,0.6009409751924722,0.5900727428326915,oversample,0.906170645041309,0.9031928429901982,0.7259595457532175,COMPLETE
596,0.6638566912539515,2025-09-23 14:04:16.867206,2025-09-23 14:04:20.014687,0 days 00:00:03.147481,0.11817282303173346,dart,0.5485629567141035,4.264647489187519,depthwise,0.0004754280048824557,0.010067416149608214,0,12,27.13480199207702,200,forest,0.5097075180426441,0.6691175962432292,undersample,0.9367381587620808,0.5952103396974437,0.056270839056937305,weighted,0.0253287912039755,0.6194879567501361,0.8371378851468932,0.8367117117117117,0.5097075180426441,0.6672244300355574,0.6638566912539515,0.6691175962432292,0.7577179203551564,0.7500116491551857,0.6528857961522718,0.6540697674418605,0.6822070145423439,0.6739409499358151,undersample,0.8970020337662525,0.8933350136042634,0.9367381587620808,COMPLETE
597,0.6552671755725191,2025-09-23 14:04:20.137090,2025-09-23 14:04:21.392515,0 days 00:00:01.255425,0.6680683675900262,gbtree,0.6698101034420707,3.208974062434783,lossguide,0.00019667204363132075,0.008639912213606242,3,7,21.81912994197433,500,,0.6483867004908427,0.9400071934752556,undersample,0.5417256958890247,3.3666325855570913,,,,0.9268948918619031,0.7584194902241785,0.7688370188370188,0.6483867004908427,0.6467065868263473,0.6552671755725191,0.9400071934752556,0.7981293339585851,0.7892914270916219,0.49746660525103636,0.5093757417517208,0.9238665526090676,0.9182712879760376,undersample,0.9140706705856987,0.9123174972692718,0.5417256958890247,COMPLETE
598,0.6379675370501059,2025-09-23 14:04:21.516147,2025-09-23 14:05:17.577749,0 days 00:00:56.061602,0.0001292885841431615,dart,0.3983632209290556,0.7189115379287292,depthwise,0.05039227267077191,0.05666117196239969,4,5,0.5369641890013985,900,forest,0.4664067062070172,0.6763326843708202,none,0.7465128162946055,0.8843530776776273,0.20594889513293935,weighted,0.8904005105230501,0.7885389974321211,0.8442010441191524,0.8424447174447175,0.4664067062070172,0.6488232579603138,0.6379675370501059,0.6763326843708202,0.7357769547700239,0.7349324895837448,0.7044088176352705,0.7084639498432602,0.6013686911890505,0.5802310654685494,none,0.8912706912146062,0.8932083886633652,0.7465128162946055,COMPLETE
