number,value,datetime_start,datetime_complete,duration,params_alpha,params_booster,params_colsample_bytree,params_gamma,params_grow_policy,params_lambda,params_learning_rate,params_max_delta_step,params_max_depth,params_min_child_weight,params_n_estimators,params_normalize_type,params_params_decision_threshold,params_params_feature_fraction,params_params_resampling,params_params_sample_rows,params_params_scale_pos_weight,params_rate_drop,params_sample_type,params_skip_drop,params_subsample,user_attrs_acc_test,user_attrs_acc_val,user_attrs_decision_threshold,user_attrs_f1_test,user_attrs_f1_val,user_attrs_feature_fraction,user_attrs_pr_auc_test,user_attrs_pr_auc_val,user_attrs_prec_test,user_attrs_prec_val,user_attrs_rec_test,user_attrs_rec_val,user_attrs_resampling_strategy,user_attrs_roc_auc_test,user_attrs_roc_auc_val,user_attrs_sample_rows,state
819,0.38612143742255267,2025-09-23 15:01:16.576717,2025-09-23 15:01:18.822223,0 days 00:00:02.245506,26.58864202771042,gbtree,0.8482265178629596,8.218748077795626,lossguide,1.0189441658639828,0.0015166476466900642,6,11,23.20269166675871,500,,0.3025510649669105,0.6766173547748311,oversample,0.6750022518177624,4.922331596426,,,,0.7411670131442756,0.23932848807452145,0.23925061425061425,0.3025510649669105,0.3862228462872718,0.38612143742255267,0.6766173547748311,0.7396424016886761,0.7325786545962099,0.23932848807452145,0.23925061425061425,1.0,1.0,oversample,0.8963425879079835,0.8928594358930861,0.6750022518177624,COMPLETE
820,0.4231083658824598,2025-09-23 15:01:18.952916,2025-09-23 15:02:22.860068,0 days 00:01:03.907152,18.84724559345894,dart,0.9626912100352514,7.723096517655305,lossguide,35.91768572026666,0.0011516019265673842,6,4,44.73826095868902,1000,tree,0.30688321047165007,0.5097293602852797,none,0.5644049885558127,4.709930562541733,0.3575366905384723,uniform,0.8026449914604867,0.5086224588364137,0.3439451325621865,0.3498157248157248,0.30688321047165007,0.4213092550790068,0.4231083658824598,0.5097293602852797,0.6462341669813153,0.64043692030811,0.2670252947235893,0.26856549815498154,0.9978614200171086,0.9965768078733419,none,0.8625541465658566,0.8655562137288499,0.5644049885558127,COMPLETE
821,0.633418043202033,2025-09-23 15:02:22.985756,2025-09-23 15:02:55.041705,0 days 00:00:32.055949,0.00044330910271733607,dart,0.6590853494719056,0.27486681478902764,lossguide,0.1313827287540852,0.0025474483253310077,7,11,24.618050739053253,600,forest,0.6719924461858581,0.5675042273480808,oversample,0.8324971539885566,2.4708967380714646,0.14490665530797686,weighted,0.39266629936830566,0.9209657995422627,0.7615927935305559,0.7637182637182637,0.6719924461858581,0.6327077747989276,0.633418043202033,0.5675042273480808,0.7064131898781147,0.6998587200474509,0.5011241568823382,0.5036625410457186,0.8579982891360137,0.8532306375695335,oversample,0.8805584804783422,0.8786305123956835,0.8324971539885566,COMPLETE
822,0.6361948955916473,2025-09-23 15:02:55.169759,2025-09-23 15:02:56.540885,0 days 00:00:01.371126,0.005118762491002762,gbtree,0.7643568706348769,9.726330053403881,depthwise,0.0006570456399139526,0.0010741306497281688,8,8,53.026741771517834,800,,0.48652775169421036,0.6588017040932372,none,0.8321645208536668,2.1121741198684054,,,,0.7499095006979881,0.8417442931722796,0.8394758394758395,0.48652775169421036,0.6463860933211345,0.6361948955916473,0.6588017040932372,0.7507875564179476,0.7467685165899928,0.6946902654867256,0.6948808920425747,0.6043627031650983,0.5866495507060334,none,0.8897337109620655,0.8902223664099675,0.8321645208536668,COMPLETE
823,0.38612143742255267,2025-09-23 15:02:56.669793,2025-09-23 15:02:58.183508,0 days 00:00:01.513715,0.10152904623753413,gbtree,0.41654453246189144,0.2911016932389354,depthwise,0.0003182149803334181,0.00024249334706248786,7,6,13.183374480995719,1000,,0.5443314461108257,0.9691716504112995,oversample,0.855189031987688,4.605923535356204,,,,0.6023670163673127,0.23932848807452145,0.23925061425061425,0.5443314461108257,0.3862228462872718,0.38612143742255267,0.9691716504112995,0.7457465965750436,0.7383677030087363,0.23932848807452145,0.23925061425061425,1.0,1.0,oversample,0.8957452187153463,0.8939026952685861,0.855189031987688,COMPLETE
824,0.6750483558994197,2025-09-23 15:02:58.315105,2025-09-23 15:02:58.666985,0 days 00:00:00.351880,0.0007801066071732145,gbtree,0.799030362642843,1.9693379400679356,lossguide,0.0018465479866942671,0.06478977312176146,10,3,15.40635244241654,200,,0.5620606060652777,0.8230610452174905,undersample,0.7671566246903141,1.8420814371676872,,,,0.9481535336462386,0.7870815846043607,0.7936117936117936,0.5620606060652777,0.6710942441492727,0.6750483558994197,0.8230610452174905,0.8064070520756776,0.7977474839338332,0.5323632714500752,0.5415050426687354,0.9076133447390933,0.8960205391527599,undersample,0.9181922503686323,0.9161777153117769,0.7671566246903141,COMPLETE
825,0.0,2025-09-23 15:02:58.794741,2025-09-23 15:02:59.621827,0 days 00:00:00.827086,0.00026076461562154655,gbtree,0.6776834410555881,8.955015816316308,depthwise,0.013117164771494674,0.000243562365795158,0,4,0.1646630860847247,800,,0.6791877534236953,0.8100736263633993,none,0.5033251797022288,2.3356137071109817,,,,0.6184622722187587,0.7606715119254785,0.7607493857493858,0.6791877534236953,0.0,0.0,0.8100736263633993,0.7600697336120683,0.7479435239531707,0.0,0.0,0.0,0.0,none,0.89908040772944,0.8939717084526092,0.5033251797022288,COMPLETE
826,0.0,2025-09-23 15:02:59.750618,2025-09-23 15:03:00.237522,0 days 00:00:00.486904,0.005499027372377124,gbtree,0.933955875332741,2.9960312247440646,depthwise,4.58788594966556,0.0001519100272683463,7,8,68.37678588498969,200,,0.583579423174315,0.7270202186663813,none,0.7382462274431132,3.919149400400897,,,,0.363480210220862,0.7606715119254785,0.7607493857493858,0.583579423174315,0.0,0.0,0.7270202186663813,0.7128352653654754,0.7107645885380209,0.0,0.0,0.0,0.0,none,0.8713495495887513,0.8737478224281849,0.7382462274431132,COMPLETE
827,0.6507671781187458,2025-09-23 15:03:00.365177,2025-09-23 15:03:03.113116,0 days 00:00:02.747939,0.06133751626335348,dart,0.7704958068889676,9.675309214824676,depthwise,0.047203673784856987,0.0056717148077477415,5,3,5.929237622769442,200,forest,0.37114873409105387,0.7979595495121772,undersample,0.5008157071815911,0.5083689634598176,0.26948119632806616,uniform,0.5123133394294014,0.8349551401896884,0.7829869996929061,0.7856265356265356,0.37114873409105387,0.6523450311577567,0.6507671781187458,0.7979595495121772,0.7560923246592355,0.743645738085307,0.5289893617021276,0.5332057939327686,0.850727117194183,0.8348309798887462,undersample,0.8946049017369839,0.8899472350013219,0.5008157071815911,COMPLETE
828,0.6668233082706767,2025-09-23 15:03:03.240241,2025-09-23 15:03:04.022192,0 days 00:00:00.781951,5.341579679360824,gbtree,0.5457912328660717,8.475558495885187,lossguide,0.4678149338775849,0.056094229638276,10,12,0.43054918603194925,1000,,0.6994767163603717,0.5697615207582825,none,0.8489451183433173,2.4509977447405302,,,,0.6664767379543802,0.8567918927218753,0.8548321048321048,0.6994767163603717,0.6750290360046458,0.6668233082706767,0.5697615207582825,0.7749940439377202,0.7660467806803639,0.7386883579054397,0.7394476289734236,0.6214713430282293,0.6071887034659821,none,0.9025313177785383,0.8990629639207597,0.8489451183433173,COMPLETE
829,0.38612143742255267,2025-09-23 15:03:04.159625,2025-09-23 15:03:39.573881,0 days 00:00:35.414256,0.006371957254662856,dart,0.5616013946426457,1.1255208721707888,lossguide,0.0024087767588676277,0.00015015391351023264,9,12,39.24213246590142,700,tree,0.5734948773984376,0.9252667843074972,oversample,0.6327913947043801,2.7183527408094337,0.44828717046024297,uniform,0.7275177087565867,0.7450890189645452,0.23932848807452145,0.23925061425061425,0.5734948773984376,0.3862228462872718,0.38612143742255267,0.9252667843074972,0.756867461586083,0.7484567907583898,0.23932848807452145,0.23925061425061425,1.0,1.0,oversample,0.8987233445905927,0.8968462212935242,0.6327913947043801,COMPLETE
830,0.6957250628667225,2025-09-23 15:03:39.704647,2025-09-23 15:04:03.552709,0 days 00:00:23.848062,0.015152806136031868,dart,0.7340052859804751,7.645942728275741,lossguide,0.003841882501076443,0.11464775173523657,10,9,6.989171428986875,600,tree,0.631961467375868,0.6523150424847775,oversample,0.7614244472728988,0.8920042461966416,0.27828414254803086,uniform,0.7031935505396903,0.8556598500802604,0.8526973078104207,0.8513513513513513,0.631961467375868,0.7018852289206546,0.6957250628667225,0.6523150424847775,0.7987979024950148,0.7874959344270382,0.6805946163117718,0.6817248459958932,0.7245508982035929,0.7103123662815576,oversample,0.9133214337228996,0.9086009775169039,0.7614244472728988,COMPLETE
831,0.0,2025-09-23 15:04:03.678801,2025-09-23 15:04:04.469722,0 days 00:00:00.790921,0.03193940413238606,gbtree,0.4188845545938841,2.265801208937641,depthwise,0.0013007715547338013,0.0007066323105738521,6,11,20.890242729383893,400,,0.5946809433737263,0.7892270730647906,none,0.6213230928992329,0.5131088128007197,,,,0.9863500691350842,0.7606715119254785,0.7607493857493858,0.5946809433737263,0.0,0.0,0.7892270730647906,0.7672172869953396,0.7588031998889738,0.0,0.0,0.0,0.0,none,0.8987021919020256,0.8956013639561847,0.6213230928992329,COMPLETE
832,0.6831700189100911,2025-09-23 15:04:04.595751,2025-09-23 15:04:29.205927,0 days 00:00:24.610176,0.23507464305768044,dart,0.3243609257822043,0.38215680322191137,lossguide,19.355138486534024,0.22543265367817925,1,12,4.270517100562641,600,tree,0.5089516546031455,0.632777829299294,oversample,0.8299056591167615,1.2173135651931977,0.22505788298797302,weighted,0.2505425245765328,0.3634776711606012,0.8035622888729655,0.8113226863226863,0.5089516546031455,0.6765548626327321,0.6831700189100911,0.632777829299294,0.8028195752755141,0.7936404114428799,0.5582753824756607,0.5709770114942528,0.8584260051325919,0.8502353444587077,oversample,0.9127310290889471,0.9106047495466348,0.8299056591167615,COMPLETE
833,0.6789286866731203,2025-09-23 15:04:29.332637,2025-09-23 15:04:53.372477,0 days 00:00:24.039840,0.46332254357655334,dart,0.9227394386511028,4.475215614019309,depthwise,0.455186709877317,0.04645187525373368,1,8,1.3658841014916017,600,forest,0.5107721130959999,0.6994303077451758,undersample,0.6063783548729244,1.5091069514489317,0.14598773363700912,uniform,0.4986400006125677,0.8981804888500857,0.7886170539461562,0.7962735462735463,0.5107721130959999,0.6715444568156513,0.6789286866731203,0.6994303077451758,0.8130509295432153,0.8040552020872941,0.5345657128386934,0.544936544936545,0.9029084687767323,0.9002995293110826,undersample,0.9193630157068642,0.9167189663949845,0.6063783548729244,COMPLETE
834,0.5171102661596958,2025-09-23 15:04:53.499929,2025-09-23 15:05:39.973656,0 days 00:00:46.473727,1.153921204571796,dart,0.6631128803775361,9.268554699116775,lossguide,0.17718766542927505,0.08894236669723807,7,3,2.068451960578538,900,forest,0.3996346447426897,0.6989446047622323,undersample,0.9318485671542879,4.444568612862108,0.16184220675544714,uniform,0.028150364839079314,0.7555542547666179,0.5501074828539256,0.5579443079443079,0.3996346447426897,0.5134506808369312,0.5171102661596958,0.6989446047622323,0.7805228678557761,0.7751225825451505,0.3463778939507095,0.3500378501135503,0.9918733960650128,0.9893025246041934,undersample,0.9063875824105869,0.9029366563771666,0.9318485671542879,COMPLETE
835,0.6978170665704492,2025-09-23 15:05:40.101644,2025-09-23 15:05:40.842916,0 days 00:00:00.741272,4.784994707444528,gbtree,0.45195614995493205,2.2437363038530966,lossguide,1.1395441304999259,0.015778637112466038,3,3,3.1594847572644364,800,,0.5672378091547641,0.9196365956482881,undersample,0.8934040060617523,1.0845434416991135,,,,0.649062273299888,0.8274132459821886,0.8285217035217035,0.5672378091547641,0.6989285714285715,0.6978170665704492,0.9196365956482881,0.8055019595913786,0.7998386183300751,0.5999386879215205,0.603243917654398,0.8370402053036784,0.8275566966195977,undersample,0.9181133378896512,0.9170562874062543,0.8934040060617523,COMPLETE
836,0.659206510681587,2025-09-23 15:05:40.970614,2025-09-23 15:06:21.516364,0 days 00:00:40.545750,0.0015083038534805713,dart,0.4132961267817525,7.168727216322075,depthwise,5.776219998208229,0.009438342688103394,1,3,10.867918415316774,800,tree,0.6859085791193551,0.5562909415867338,oversample,0.5933338294506733,1.8076690878365231,0.36994941996294833,uniform,0.8350220132695059,0.48465901580941523,0.7908690756474562,0.7942260442260443,0.6859085791193551,0.6602361549975054,0.659206510681587,0.5562909415867338,0.7622897254770412,0.756457877333654,0.5401360544217687,0.5459140690817186,0.84901625320787,0.8318356867779204,oversample,0.8996258593027913,0.897252641863265,0.5933338294506733,COMPLETE
837,0.38612143742255267,2025-09-23 15:06:21.645593,2025-09-23 15:06:36.853011,0 days 00:00:15.207418,0.0002332416297434216,dart,0.5076937710309497,6.260680733360261,depthwise,0.007890519609315942,0.00032830530919886945,4,7,0.7090034231561917,500,tree,0.5971159178977685,0.9380957832636226,oversample,0.9793767051397932,4.779962614244172,0.48069950649139215,weighted,0.24018400783541696,0.5772553750407425,0.23932848807452145,0.23925061425061425,0.5971159178977685,0.3862228462872718,0.38612143742255267,0.9380957832636226,0.7485911347428915,0.7425177462553761,0.23932848807452145,0.23925061425061425,1.0,1.0,oversample,0.9008955674210147,0.8979150187141758,0.9793767051397932,COMPLETE
838,0.38612143742255267,2025-09-23 15:06:36.984538,2025-09-23 15:06:37.489374,0 days 00:00:00.504836,0.16079408381240864,gbtree,0.33733044316514826,3.646974265420766,depthwise,8.933514221801762,0.0004195742495929956,9,7,1.7948835604266993,200,,0.4926963559858316,0.6215502788497427,oversample,0.6943645191614896,3.459073157154818,,,,0.9239295320449545,0.23932848807452145,0.23925061425061425,0.4926963559858316,0.3862228462872718,0.38612143742255267,0.6215502788497427,0.7370159887830172,0.732120129987361,0.23932848807452145,0.23925061425061425,1.0,1.0,oversample,0.8946601001814354,0.8934342290536349,0.6943645191614896,COMPLETE
839,0.6219739292364991,2025-09-23 15:06:37.617146,2025-09-23 15:06:39.142425,0 days 00:00:01.525279,0.6910619099649403,gbtree,0.32298338145222605,7.896003953770143,lossguide,0.00012313784236914638,0.0014848393318669351,3,10,1.3626376361190988,700,,0.3190954623147853,0.700881390227023,none,0.6364587076415342,0.6551459700770108,,,,0.7675838995788293,0.8570989865902344,0.8545249795249795,0.3190954623147853,0.6322444678609063,0.6219739292364991,0.700881390227023,0.7868432392130886,0.7780859640682634,0.823045267489712,0.8220815752461322,0.5132591958939264,0.5002139495079161,none,0.9047985694220879,0.9031832842179429,0.6364587076415342,COMPLETE
840,0.42446895797246786,2025-09-23 15:06:39.271235,2025-09-23 15:07:43.334321,0 days 00:01:04.063086,1.0507681821382262,dart,0.7467053498859095,3.141330807005712,lossguide,2.403955355191624,0.0007113169972838534,2,8,59.2003946719106,1000,forest,0.34608175402768043,0.518766560425878,oversample,0.7440521161069662,1.7076793778730361,0.15171731078273992,weighted,0.11712234885666656,0.6748234612845796,0.3472208004913502,0.3537059787059787,0.34608175402768043,0.42232086239695626,0.42446895797246786,0.518766560425878,0.6665220518193465,0.6647343090150597,0.26790024135156876,0.26969416126042633,0.9970059880239521,0.9961489088575096,oversample,0.8697595005502001,0.8718039366824623,0.7440521161069662,COMPLETE
841,0.4624277456647399,2025-09-23 15:07:43.463191,2025-09-23 15:07:44.054818,0 days 00:00:00.591627,67.14204955504076,gbtree,0.4438267525213364,8.405848417416584,lossguide,0.0014253309887119993,0.0006071666900751249,3,7,11.563511580828303,500,,0.670350137066001,0.7034202990741966,undersample,0.9581678319528133,3.4532700331992268,,,,0.2216197684986625,0.445593202989047,0.4477886977886978,0.670350137066001,0.46248511314013496,0.4624277456647399,0.7034202990741966,0.6758783626567539,0.673947895701342,0.30111139829413286,0.30141613615694424,0.9965782720273738,0.9927257167308515,undersample,0.8567594898443497,0.8530846647522634,0.9581678319528133,COMPLETE
842,0.6045025417574437,2025-09-23 15:07:44.182881,2025-09-23 15:07:44.934741,0 days 00:00:00.751860,0.2097980822157878,gbtree,0.759842217593707,7.438784077321015,depthwise,0.024839571133108834,0.0001566970053051166,6,3,0.2599932229626083,1000,,0.49071620203204924,0.7536754779742698,undersample,0.8094735826502772,1.0289352164798753,,,,0.6725420022451714,0.7199303920565052,0.7212325962325963,0.49071620203204924,0.6068965517241379,0.6045025417574437,0.7536754779742698,0.7171898325154269,0.7071051721627284,0.4569450454348767,0.45756376429199647,0.9033361847733106,0.8904578519469405,undersample,0.878234591431935,0.8713720932335005,0.8094735826502772,COMPLETE
843,0.6768971332209106,2025-09-23 15:07:45.063898,2025-09-23 15:07:47.712965,0 days 00:00:02.649067,0.24223971684594783,dart,0.7663566543038463,4.422533983832482,depthwise,0.03815027167355142,0.0029468906322677037,9,8,0.3938420324313784,200,forest,0.36327532867822376,0.6809678204353828,oversample,0.6660913526668335,0.5625764657053616,0.24943117982785312,weighted,0.0026307640087940734,0.3797085358516511,0.7967038591462791,0.8038493038493039,0.36327532867822376,0.6699900299102692,0.6768971332209106,0.6809678204353828,0.7940600557017821,0.7860239813496996,0.5478260869565217,0.5585861397161147,0.8622754491017964,0.858793324775353,oversample,0.9091771183971522,0.907530423815808,0.6660913526668335,COMPLETE
844,0.6984056687333924,2025-09-23 15:07:47.844423,2025-09-23 15:07:49.377373,0 days 00:00:01.532950,0.003526949035995764,gbtree,0.5428937623308829,8.00320442513193,depthwise,0.013151690400872466,0.0024052012901966237,0,9,0.4153862016090904,700,,0.5906645227670984,0.9218788693593869,oversample,0.8243136759040539,0.8043998987328443,,,,0.8098437582689317,0.8630361347118436,0.8605651105651105,0.5906645227670984,0.7061923583662714,0.6984056687333924,0.9218788693593869,0.7960673012724628,0.7886042742778694,0.7256317689530686,0.7237264800367141,0.6877673224978614,0.6747967479674797,oversample,0.9130773288189178,0.9115376511689601,0.8243136759040539,COMPLETE
845,0.6600397614314115,2025-09-23 15:07:49.505257,2025-09-23 15:07:50.045330,0 days 00:00:00.540073,0.0007397055170005575,gbtree,0.563986280075482,8.54309715802973,depthwise,65.70981530825065,0.07760211977211756,8,8,1.3739163166814021,800,,0.42449896325712233,0.5178726234722123,none,0.5784684699233051,2.578748097883271,,,,0.9534657518699725,0.7827822704473334,0.7899262899262899,0.42449896325712233,0.6527004909983634,0.6600397614314115,0.5178726234722123,0.7786020945891615,0.7704814848711233,0.5286320254506893,0.5385239253852393,0.8528656971770744,0.8523748395378691,none,0.9006125530817366,0.8996898120820234,0.5784684699233051,COMPLETE
846,0.27363896848137537,2025-09-23 15:07:50.174173,2025-09-23 15:07:50.969659,0 days 00:00:00.795486,55.29064400522755,gbtree,0.3303257160039599,6.728713350478191,depthwise,0.000286782450948516,0.004958509387513826,8,7,0.3815425921274759,800,,0.5452835484141344,0.6933588645200461,none,0.9419529031624615,0.5681267410007682,,,,0.6659215631117675,0.7947589313133381,0.7923832923832924,0.5452835484141344,0.28367274026438016,0.27363896848137537,0.6933588645200461,0.6943514944271264,0.686926580412304,0.8611713665943601,0.8395604395604396,0.169803250641574,0.16345742404792468,none,0.8725327475276105,0.8752038364996191,0.9419529031624615,COMPLETE
847,0.573980875691998,2025-09-23 15:07:51.100544,2025-09-23 15:08:35.070224,0 days 00:00:43.969680,0.7214946268427435,dart,0.4754775962077415,6.470064323151402,depthwise,0.01745112412978703,0.0011518696957673316,0,6,0.14018348763411922,800,forest,0.6248962035053782,0.7340199875892599,undersample,0.5135028907986381,4.863941482990516,0.16876959123762297,uniform,0.7652442480157261,0.9611387004759526,0.651448459412427,0.6533579033579033,0.6248962035053782,0.5725047080979284,0.573980875691998,0.7340199875892599,0.7500730268810111,0.7462735289248994,0.4051892660387418,0.40652290144359293,0.9751924721984602,0.9760376551133932,undersample,0.8972828033304174,0.8944992547900533,0.5135028907986381,COMPLETE
848,0.0,2025-09-23 15:08:35.197697,2025-09-23 15:08:54.030195,0 days 00:00:18.832498,0.011880295286571887,dart,0.27793722990064396,3.6425244416322986,lossguide,4.293622875007696,0.00016595361636637603,7,12,46.65755529556386,600,forest,0.635604183570828,0.5447090351917434,undersample,0.741675305773702,1.0083071132913926,0.30725581865734636,uniform,0.10703897770004202,0.6782947210897483,0.7606715119254785,0.7607493857493858,0.635604183570828,0.0,0.0,0.5447090351917434,0.6981157145727375,0.6862210802658959,0.0,0.0,0.0,0.0,undersample,0.876588250340544,0.8767594691011822,0.741675305773702,COMPLETE
849,0.6861386138613862,2025-09-23 15:08:54.158635,2025-09-23 15:08:54.669048,0 days 00:00:00.510413,1.05784910388415,gbtree,0.33969069643054195,6.685641861833859,depthwise,6.978300793441532,0.059420939161514884,10,5,54.68334201768658,400,,0.6523482618310239,0.8854197091758393,oversample,0.7059958879228847,2.7315073474855267,,,,0.9542225077568243,0.7981369638652882,0.8052825552825553,0.6523482618310239,0.6803889789303079,0.6861386138613862,0.8854197091758393,0.8108693337351669,0.805535578198284,0.5477557411273486,0.5584206285253828,0.897775876817793,0.889602053915276,oversample,0.9205747625804968,0.9194244156495067,0.7059958879228847,COMPLETE
850,0.0,2025-09-23 15:08:54.796220,2025-09-23 15:08:57.658282,0 days 00:00:02.862062,2.0332902613028025,dart,0.27860747210307324,6.188360831118519,depthwise,0.03224896493638949,0.0003319245005646516,2,10,0.7163464842226738,200,forest,0.668295263058899,0.7042100865795066,none,0.9705068846253283,1.256394269358539,0.44802779992775554,weighted,0.5900230095070521,0.3889701695572327,0.7606715119254785,0.7607493857493858,0.668295263058899,0.0,0.0,0.7042100865795066,0.7407840048983234,0.7374479187710207,0.0,0.0,0.0,0.0,none,0.8908013605409286,0.8936168246368948,0.9705068846253283,COMPLETE
