number,value,datetime_start,datetime_complete,duration,params_alpha,params_booster,params_colsample_bytree,params_gamma,params_grow_policy,params_lambda,params_learning_rate,params_max_delta_step,params_max_depth,params_min_child_weight,params_n_estimators,params_normalize_type,params_params_decision_threshold,params_params_feature_fraction,params_params_resampling,params_params_sample_rows,params_params_scale_pos_weight,params_rate_drop,params_sample_type,params_skip_drop,params_subsample,user_attrs_acc_test,user_attrs_acc_val,user_attrs_decision_threshold,user_attrs_f1_test,user_attrs_f1_val,user_attrs_feature_fraction,user_attrs_pr_auc_test,user_attrs_pr_auc_val,user_attrs_prec_test,user_attrs_prec_val,user_attrs_rec_test,user_attrs_rec_val,user_attrs_resampling_strategy,user_attrs_roc_auc_test,user_attrs_roc_auc_val,user_attrs_sample_rows,state
1651,0.6810140434068941,2025-09-23 21:35:50.610483,2025-09-23 21:35:54.498387,0 days 00:00:03.887904,0.13620035972613398,dart,0.4316119887340786,5.858806294730834,lossguide,0.0004656788595241825,0.018286561786381737,7,9,3.0561616483152534,200,forest,0.3277042782500966,0.9207715762361035,none,0.8852386211779556,1.1248097138608488,0.12055773423478269,weighted,0.7806936849701684,0.8551410685663536,0.8136963865288156,0.8209459459459459,0.3277042782500966,0.6719538572458543,0.6810140434068941,0.9207715762361035,0.7506163899612772,0.7448494522972439,0.5806853582554518,0.5934520025429116,0.7972626176218991,0.7988874625588361,none,0.8985299773600042,0.9001398805395318,0.8852386211779556,COMPLETE
1652,0.6678844237794752,2025-09-23 21:35:54.632956,2025-09-23 21:36:18.448973,0 days 00:00:23.816017,0.00030522757967132877,dart,0.7051679411239029,8.473070958710734,depthwise,0.00018809665321962011,0.39937618589067064,1,11,0.7208827297627394,600,tree,0.4528374383252551,0.9043013876884678,none,0.9108808028126023,3.153130442205029,0.010245807305899662,uniform,0.6477253310450951,0.9890453450589649,0.7897430647968062,0.7952497952497952,0.4528374383252551,0.6621710526315789,0.6678844237794752,0.9043013876884678,0.7513654487010516,0.7452343749877445,0.5379476215927311,0.5457259158751696,0.8609923011120616,0.860504920838682,none,0.8994965257212664,0.9000867026709917,0.9108808028126023,COMPLETE
1653,0.6774918810891831,2025-09-23 21:36:18.585228,2025-09-23 21:37:03.364494,0 days 00:00:44.779266,0.004769659455248357,dart,0.5900078066876786,0.13257785881434048,depthwise,0.000454870817020059,0.15568592390970395,3,7,0.36573414094240986,800,forest,0.47713506873179024,0.9299754807206699,none,0.9878668731588522,0.656207861781203,0.10580298202745561,uniform,0.5052445581532969,0.9308842017242074,0.8692803767018119,0.8678337428337428,0.47713506873179024,0.6809892580564576,0.6774918810891831,0.9299754807206699,0.827200035834692,0.823617452170582,0.8186186186186186,0.8139255702280912,0.5829769033361848,0.5802310654685494,none,0.9272761069935795,0.9259615505871821,0.9878668731588522,COMPLETE
1654,0.7078907435508346,2025-09-23 21:37:03.501537,2025-09-23 21:37:07.177550,0 days 00:00:03.676013,0.013931788052780458,dart,0.9450250169263656,2.8351711085807962,depthwise,0.003657833185985194,0.3930730029498274,5,9,0.1849142783254598,200,forest,0.6861597298763076,0.9966514917447892,oversample,0.9775514183716493,2.269096879641645,0.15323922958975494,uniform,0.2856460392339594,0.8604352627869195,0.8430750332685024,0.8423423423423423,0.6861597298763076,0.7107001321003963,0.7078907435508346,0.9966514917447892,0.8180248085605341,0.8118974342261351,0.6359338061465721,0.6357751277683135,0.8053892215568862,0.7984595635430038,oversample,0.921365815574572,0.9187362992130654,0.9775514183716493,COMPLETE
1655,0.7124920195786337,2025-09-23 21:37:07.313400,2025-09-23 21:37:08.301667,0 days 00:00:00.988267,0.006282834008786682,gbtree,0.7743043637251589,7.380766526285633,depthwise,1.0183329085004988,0.021993993823611606,1,11,21.55410149598093,300,,0.6753246722673857,0.9928392810254206,none,0.8271954611791169,3.0524844297523672,,,,0.7692887735775368,0.8641621455624936,0.8616912366912367,0.6753246722673857,0.719983118801435,0.7124920195786337,0.9928392810254206,0.8198140951162929,0.8120131039314002,0.7105372761349438,0.7087214225232854,0.7296834901625321,0.7163029525032092,none,0.9240761800696432,0.9216028080217907,0.8271954611791169,COMPLETE
1656,0.651798863875447,2025-09-23 21:37:08.438457,2025-09-23 21:37:10.021924,0 days 00:00:01.583467,0.00014930112999021885,gbtree,0.7427939979774162,1.6189340645803965,lossguide,0.05995787595013844,0.4429173124560917,1,11,0.2736638742762836,400,,0.6442050635116647,0.750353380982652,none,0.8408653704209761,3.0839283071180166,,,,0.6542779781631077,0.8368307912785341,0.8305692055692055,0.6442050635116647,0.6635711270578303,0.651798863875447,0.750353380982652,0.7511381062913878,0.7412460400114405,0.655,0.6411423841059603,0.6723695466210436,0.6628155755241762,none,0.8953983721811812,0.8887459967602672,0.8408653704209761,COMPLETE
1657,0.6652844966597559,2025-09-23 21:37:10.159009,2025-09-23 21:37:16.997477,0 days 00:00:06.838468,0.07559515764793286,dart,0.9805534048224098,5.733745896930416,lossguide,0.04057680362778283,0.011482448834447764,10,11,0.27576958870266705,300,forest,0.43506964115931884,0.736090509311764,none,0.9431348665909757,1.0086556912909663,0.26717084752776826,uniform,0.6477178050453084,0.2647683756462066,0.8563824342307299,0.8512489762489762,0.43506964115931884,0.6816428409348764,0.6652844966597559,0.736090509311764,0.778313851273839,0.7676857273624317,0.7259545674238763,0.720558882235529,0.6424294268605646,0.6178861788617886,none,0.9031531204849084,0.900055953367472,0.9431348665909757,COMPLETE
1658,0.6518939961072017,2025-09-23 21:37:17.131854,2025-09-23 21:37:19.290055,0 days 00:00:02.158201,0.0003415820571538191,gbtree,0.36896903794237706,4.023553616418201,depthwise,0.0051780738708753484,0.0026841404458776735,3,10,0.13320791955001798,600,,0.5858845758870838,0.952239656195261,oversample,0.9613167381774753,2.7289964853735404,,,,0.8605452157070914,0.758828948715324,0.7619778869778869,0.5858845758870838,0.6485680190930787,0.6518939961072017,0.952239656195261,0.7805038194499099,0.7742150173225483,0.4979386165826844,0.5013818516812529,0.9298545765611634,0.9315361574668378,oversample,0.9120304577994366,0.911432994129359,0.9613167381774753,COMPLETE
1659,0.6650702426564495,2025-09-23 21:37:19.426288,2025-09-23 21:37:21.113014,0 days 00:00:01.686726,0.3457984245555497,gbtree,0.5838492778456579,1.4679233876544706,lossguide,0.00011821707944835155,0.17452301742559537,6,6,1.3380220940881173,600,,0.31599180797356186,0.9383434704560565,oversample,0.7971401889184765,2.5199519900414815,,,,0.35809109310750953,0.7784829562903061,0.7852170352170352,0.31599180797356186,0.6583517524471109,0.6650702426564495,0.9383434704560565,0.7919297073430881,0.7925749250918925,0.5217717717717718,0.5304303539597657,0.8917878528656972,0.8913136499786051,oversample,0.9094167913092437,0.9093234997751671,0.7971401889184765,COMPLETE
1660,0.7157708471577084,2025-09-23 21:37:21.250283,2025-09-23 21:38:08.781958,0 days 00:00:47.531675,0.00010358559270065133,dart,0.2940341066322759,3.6699533410117704,lossguide,0.00019743110684629806,0.00884314801014253,6,12,0.14997203278683005,800,forest,0.5417886053725923,0.9827802232296151,none,0.871100464659767,1.6413868803621898,0.14100625595881813,uniform,0.5746042756181299,0.2681196522693636,0.8696898351929573,0.8684479934479934,0.5417886053725923,0.7189224994480018,0.7157708471577084,0.9827802232296151,0.8220095169162398,0.8154347533920541,0.7430397078959379,0.7408424908424909,0.6963216424294268,0.6923406076166024,none,0.9251576724283712,0.9236307936884693,0.871100464659767,COMPLETE
1661,0.6964897260273972,2025-09-23 21:38:08.921248,2025-09-23 21:39:21.517008,0 days 00:01:12.595760,0.0009094764020331436,dart,0.21868345099577133,4.3368698137245625,lossguide,0.0021122738333016837,0.0026879859396274305,5,7,0.23294833157077735,1000,forest,0.45081884630703917,0.9406488370170765,none,0.9921543501169128,1.4267845787763436,0.2314988403359149,weighted,0.8986056203076407,0.9504182536877788,0.8569966219674481,0.8548321048321048,0.45081884630703917,0.7019415404309793,0.6964897260273972,0.9406488370170765,0.7959436398015141,0.7877222302273617,0.7002979991485738,0.6967880085653105,0.7035928143712575,0.6961916987590928,none,0.9150181671376665,0.9137764192804584,0.9921543501169128,COMPLETE
1662,0.6690552517442957,2025-09-23 21:39:21.654872,2025-09-23 21:39:49.198148,0 days 00:00:27.543276,0.00024210762289091518,dart,0.2716787969648773,1.7990917839801057,lossguide,0.0008828060035933866,0.002342008317240273,5,7,0.1427804661442844,600,forest,0.3667534241852397,0.9161983109756896,none,0.7545685833245923,1.3836753766663892,0.11996102133739651,weighted,0.7604130325184866,0.45553641925950306,0.8194288054048521,0.8203316953316954,0.3667534241852397,0.6699101796407185,0.6690552517442957,0.9161983109756896,0.7378516321640145,0.7319815025995104,0.5954757152361942,0.598111935266352,0.7656116338751069,0.7590928540864356,none,0.8932979821543833,0.8953951305656311,0.7545685833245923,COMPLETE
1663,0.7206088523933507,2025-09-23 21:39:49.332614,2025-09-23 21:39:50.033184,0 days 00:00:00.700570,0.0003612719452048013,gbtree,0.9575213990299748,6.926176626511691,depthwise,0.0003355309525624497,0.18159458164770395,2,12,0.5747582534275837,300,,0.6194994879155621,0.9281641615391221,none,0.9325386838316617,3.001412701759994,,,,0.5609587570722868,0.8551540587572934,0.8571867321867321,0.6194994879155621,0.7182958391399562,0.7206088523933507,0.9281641615391221,0.8199304649100174,0.8190214017417894,0.6718808193668528,0.6773343373493976,0.7715996578272027,0.7697903294822422,none,0.9239587322845513,0.9240000156625665,0.9325386838316617,COMPLETE
1664,0.7155595185020063,2025-09-23 21:39:50.168701,2025-09-23 21:39:50.814391,0 days 00:00:00.645690,0.47143231589417794,gbtree,0.8117585974777709,3.7519397254780875,lossguide,0.957047078311748,0.2613015550459798,5,8,0.8658304276447089,300,,0.444232903058588,0.942132879978757,none,0.9447623801658152,0.9873918354821037,,,,0.7623949158350564,0.871839492271471,0.8693693693693694,0.444232903058588,0.7204108977221975,0.7155595185020063,0.942132879978757,0.8244992647863133,0.8201237734395614,0.7537383177570094,0.7468590041879944,0.6899059024807528,0.686777920410783,none,0.9259365806135005,0.9255889600096096,0.9447623801658152,COMPLETE
1665,0.6972579742585339,2025-09-23 21:39:50.948908,2025-09-23 21:39:57.537442,0 days 00:00:06.588534,0.00032092881135860086,dart,0.8921368288921945,9.441710163214701,depthwise,0.015943279059726943,0.15933657200624907,3,12,0.33702080251596206,300,tree,0.5648814356100771,0.8842877144698875,none,0.9971038698915932,3.216159953661062,0.17880626695407487,uniform,0.47526164194485404,0.3251648210717294,0.8382638959975433,0.8338452088452089,0.5648814356100771,0.7072989996294924,0.6972579742585339,0.8842877144698875,0.8120480052460772,0.8041260069391509,0.6238562091503268,0.6180555555555556,0.8165098374679213,0.7997432605905006,none,0.9181839907473822,0.916769063574876,0.9971038698915932,COMPLETE
1666,0.7055489964580873,2025-09-23 21:39:57.672179,2025-09-23 21:40:43.145340,0 days 00:00:45.473161,0.043501981410462826,dart,0.5891169630066031,5.907031633714266,depthwise,0.00012783313656296923,0.011102989778345054,4,10,1.3037395253126824,800,forest,0.698293573181084,0.9801712590498518,none,0.9092048660736998,2.484560716197429,0.1681311256333364,uniform,0.6162788039788251,0.5381480471958491,0.8735796908588391,0.8723382473382474,0.698293573181084,0.7107050831576481,0.7055489964580873,0.9801712590498518,0.8276676396023418,0.8204270901555888,0.785603314344899,0.7871443624868283,0.6488451668092386,0.6392811296534018,none,0.9274295862971559,0.9252277420677018,0.9092048660736998,COMPLETE
1667,0.7018939393939394,2025-09-23 21:40:43.281377,2025-09-23 21:41:28.788829,0 days 00:00:45.507452,0.0001774139354682637,dart,0.877593580268795,8.642343509895841,lossguide,0.00012792371265099074,0.042646883315278376,2,8,0.7851795901524083,800,forest,0.6407048134383249,0.9141071929305179,none,0.8597268371317077,4.476801029790837,0.1144058873625394,uniform,0.5559111217612835,0.8791098396448196,0.8405159176988433,0.8388615888615889,0.6407048134383249,0.7083489329839011,0.7018939393939394,0.9141071929305179,0.8163009070586293,0.8067680703056082,0.62982689747004,0.6296296296296297,0.8092386655260907,0.7928968763371844,none,0.9199880992383995,0.9183648027118351,0.8597268371317077,COMPLETE
1668,0.6381880733944955,2025-09-23 21:41:28.924741,2025-09-23 21:41:35.893806,0 days 00:00:06.969065,0.8692872696099917,dart,0.8822469395267514,6.115075821517631,lossguide,0.0070176427423265485,0.15360688101685846,4,12,3.170019273627003,300,forest,0.5389454978666336,0.9250977252368057,undersample,0.903936195594886,4.748928706468037,0.1279066824392922,weighted,0.7665535088993167,0.7456599978317673,0.7400962227454192,0.7416052416052417,0.5389454978666336,0.6376480662194948,0.6381880733944955,0.9250977252368057,0.8206321547189435,0.8142647252292954,0.4784750481901906,0.47984479413666736,0.9555175363558597,0.9525032092426188,undersample,0.9254157352288905,0.9234272666972894,0.903936195594886,COMPLETE
1669,0.7103284527107242,2025-09-23 21:41:36.033009,2025-09-23 21:42:12.437767,0 days 00:00:36.404758,0.0034279216839009606,dart,0.25290988335729647,3.945742882455934,lossguide,0.00012389544782127697,0.007652018683530649,7,10,0.10061963979421575,700,forest,0.5058856867269731,0.9536054151198409,none,0.9908971371430878,2.079630154890653,0.16524799000121543,uniform,0.4455082127778859,0.7351843863184493,0.8498310983724024,0.8501228501228502,0.5058856867269731,0.7101363366923533,0.7103284527107242,0.9536054151198409,0.8065680965024069,0.799675949854851,0.6599338964377525,0.6606551343393449,0.7686056458511549,0.7680787334189131,none,0.9208628420533637,0.9194803862918683,0.9908971371430878,COMPLETE
1670,0.7167192429022082,2025-09-23 21:42:12.573311,2025-09-23 21:42:13.121358,0 days 00:00:00.548047,0.0028886361223637515,gbtree,0.5767848809431394,6.068343389846454,lossguide,0.02393768096717229,0.38871222771683045,10,8,0.2626455223309206,200,,0.3005396803373537,0.8707170763849216,none,0.9641921671618586,0.7012721705900322,,,,0.8085003220345297,0.8632408639574163,0.8621007371007371,0.3005396803373537,0.7216666666666667,0.7167192429022082,0.8707170763849216,0.8230841551066991,0.8157234540427496,0.7034930950446792,0.7047146401985112,0.7408041060735672,0.7291399229781772,none,0.924736028836266,0.9234716631636071,0.9641921671618586,COMPLETE
1671,0.7115938816227001,2025-09-23 21:42:13.257025,2025-09-23 21:42:37.663216,0 days 00:00:24.406191,0.001980082974073567,dart,0.532016782269618,3.954977482070672,depthwise,0.00011485907222493866,0.31045532301634055,4,8,0.17276117122593576,600,forest,0.34910627544821576,0.8320920714570385,none,0.9543284560053812,0.7242624300332098,0.2267922449826753,uniform,0.6590670173136545,0.6730177925759787,0.8691780120790255,0.8668099918099919,0.34910627544821576,0.7181296868107632,0.7115938816227001,0.8320920714570385,0.8231683715552587,0.8159428650847327,0.7413479052823315,0.7382704691812327,0.6963216424294268,0.686777920410783,none,0.9246867876796152,0.9225735416523788,0.9543284560053812,COMPLETE
1672,0.7029495718363463,2025-09-23 21:42:37.797257,2025-09-23 21:42:38.637727,0 days 00:00:00.840470,0.08105906280567056,gbtree,0.6943133271618598,8.386891338203814,lossguide,0.08151722571995725,0.3041798792633884,2,8,0.324154148494501,700,,0.6013737406027777,0.8193630282421936,none,0.8764804432967777,3.6682713720026165,,,,0.5552468473233586,0.8378544375063978,0.8401924651924652,0.6013737406027777,0.7009063444108762,0.7029495718363463,0.8193630282421936,0.8045327433398839,0.8013954278601084,0.6274509803921569,0.6329677861549006,0.7938408896492729,0.7903294822421908,none,0.9155744108990624,0.915543496530943,0.8764804432967777,COMPLETE
1673,0.7161253123198155,2025-09-23 21:42:38.773738,2025-09-23 21:42:47.004439,0 days 00:00:08.230701,0.6766346811673574,dart,0.9960087351575394,5.747935340382735,lossguide,0.00433588198605053,0.06328561029074954,5,12,0.7154222322436818,300,forest,0.6084878975016281,0.9752744476644377,none,0.8545770284706056,3.610750855413877,0.2458479477921309,weighted,0.7548205866768042,0.5971766695200447,0.8481932644078206,0.8487919737919738,0.6084878975016281,0.7170387330662087,0.7161253123198155,0.9752744476644377,0.8226648457803019,0.8187788717897933,0.6472614536686186,0.6500348918353105,0.8036783575705732,0.7971758664955071,none,0.9260123561631567,0.9241711234442307,0.8545770284706056,COMPLETE
1674,0.702048417132216,2025-09-23 21:42:47.140601,2025-09-23 21:43:13.437094,0 days 00:00:26.296493,0.0010531733006511953,dart,0.6073279270941481,7.675417015895051,depthwise,0.00013983255276304123,0.0049251827327983074,2,12,1.2791273938091203,600,forest,0.5484367035659038,0.9959737938219221,none,0.8772566699903599,1.4956104235016752,0.14407500348258737,uniform,0.6099915959333311,0.7074049435234869,0.8704063875524619,0.868959868959869,0.5484367035659038,0.7068087077350625,0.702048417132216,0.9959737938219221,0.8182666566773426,0.811194686038941,0.7707070707070707,0.7697805002552323,0.6526946107784432,0.6452717158750535,none,0.9223940376931126,0.9203399847992487,0.8772566699903599,COMPLETE
1675,0.7012925969447709,2025-09-23 21:43:13.571550,2025-09-23 21:43:38.695901,0 days 00:00:25.124351,0.0003491786362148726,dart,0.8201583093454253,6.481872280951118,lossguide,0.011406848009214104,0.3511588866375246,0,9,2.987023047282999,600,forest,0.6601939377181006,0.999414173886927,none,0.8481561796593564,2.0547766195898123,0.22487887633497716,uniform,0.5546698545826063,0.7630643119013765,0.8702016583068891,0.8698812448812449,0.6601939377181006,0.7051162790697675,0.7012925969447709,0.999414173886927,0.8244208695176185,0.8170006929739531,0.7726809378185525,0.7778936392075079,0.6484174508126604,0.6384253316217373,none,0.9253742932267998,0.923142778056767,0.8481561796593564,COMPLETE
1676,0.6221728874705148,2025-09-23 21:43:38.829582,2025-09-23 21:44:31.380743,0 days 00:00:52.551161,0.004124132667645129,dart,0.3817003545980573,0.6939078788399315,lossguide,0.00021945357535446683,0.020793553823994414,8,10,0.10604595234911268,800,forest,0.3222712522409339,0.9082916640037082,undersample,0.8659324010385073,3.8073944825975152,0.13694102779887862,weighted,0.7395902403566476,0.5162685450467622,0.7249462585730372,0.7212325962325963,0.3222712522409339,0.6266499930526608,0.6221728874705148,0.9082916640037082,0.8193097691128073,0.8117109428980114,0.4640872607532414,0.46036960985626285,0.9644995722840034,0.959349593495935,undersample,0.9237920145636405,0.9213630613453788,0.8659324010385073,COMPLETE
1677,0.6683616716987129,2025-09-23 21:44:31.516865,2025-09-23 21:44:32.347355,0 days 00:00:00.830490,0.0002034104294681363,gbtree,0.8047961867166915,9.285477987980212,depthwise,0.04818912705951001,0.20531553463218027,0,11,0.10706033660939279,900,,0.47350877178641704,0.818883992817697,oversample,0.9879742246553431,1.555778284069153,,,,0.36671875431214684,0.7806326133688197,0.7863431613431613,0.47350877178641704,0.6632091780606633,0.6683616716987129,0.818883992817697,0.8111352551334103,0.8033844098879315,0.5242236024844721,0.53159757330637,0.9024807527801539,0.8998716302952503,oversample,0.9187628261557511,0.9164912257668568,0.9879742246553431,COMPLETE
1678,0.7063907209460996,2025-09-23 21:44:32.483639,2025-09-23 21:44:33.157697,0 days 00:00:00.674058,0.3761872398736019,gbtree,0.8919576898205606,3.0119450894214634,lossguide,0.0005124698100710641,0.10831078278277786,10,5,0.12370570717738692,200,,0.3731199487690726,0.9253925374466472,none,0.9932232648362095,0.7038304727442249,,,,0.5539237314564833,0.8687685535878801,0.8678337428337428,0.3731199487690726,0.7117805755395683,0.7063907209460996,0.9253925374466472,0.820923689787352,0.8160411644502752,0.7502369668246446,0.753883495145631,0.6770744225834047,0.6645271715875053,none,0.9224018080685045,0.9205856049381307,0.9932232648362095,COMPLETE
1679,0.0,2025-09-23 21:44:33.292490,2025-09-23 21:44:36.798577,0 days 00:00:03.506087,0.00024959250268176967,gbtree,0.727938398970961,1.455675405393826,depthwise,0.00018081640549316396,0.00023926673797888327,5,11,0.1700301816671238,700,,0.5310939764614478,0.7502592032390902,none,0.9841160100882607,2.195176598403904,,,,0.6223721928839727,0.7606715119254785,0.7607493857493858,0.5310939764614478,0.0,0.0,0.7502592032390902,0.790712186198312,0.7777490861459605,0.0,0.0,0.0,0.0,none,0.9130690404184998,0.9088691989697026,0.9841160100882607,COMPLETE
1680,0.7138560256667336,2025-09-23 21:44:36.933898,2025-09-23 21:45:22.121973,0 days 00:00:45.188075,0.00019170843671485914,dart,0.7745605943115321,7.418271957163979,depthwise,0.0966228413858505,0.16543081169295848,5,11,0.5382420193087497,800,forest,0.6969013902324537,0.9040707167292871,none,0.9746213406178602,4.372766255907838,0.08213459634048886,uniform,0.5754568097959069,0.5432589689391502,0.8554611526256526,0.8539107289107289,0.6969013902324537,0.7178257394084733,0.7138560256667336,0.9040707167292871,0.8195455508039562,0.8122811311589739,0.673668417104276,0.6716981132075471,0.7681779298545766,0.7616602481814292,none,0.9226350632261056,0.920543396624498,0.9746213406178602,COMPLETE
1681,0.7215107445192099,2025-09-23 21:45:22.257366,2025-09-23 21:46:16.916232,0 days 00:00:54.658866,0.00030297697804698037,dart,0.23047774195168713,4.715950985650483,lossguide,0.0003177684474699972,0.08362199486341275,7,5,5.860679235184809,900,forest,0.49593439418490315,0.9604326300889949,none,0.9990406389040071,1.3534953061439232,0.0023046789046032162,uniform,0.7887275643561878,0.577572839742696,0.8684614597195209,0.8686527436527437,0.49593439418490315,0.7214394103620204,0.7215107445192099,0.9604326300889949,0.8251544331161753,0.8177932543678774,0.7314285714285714,0.73215859030837,0.7117194183062446,0.711168164313222,none,0.9262085725313891,0.9248699791037176,0.9990406389040071,COMPLETE
