number,value,datetime_start,datetime_complete,duration,params_alpha,params_booster,params_colsample_bytree,params_gamma,params_grow_policy,params_lambda,params_learning_rate,params_max_delta_step,params_max_depth,params_min_child_weight,params_n_estimators,params_normalize_type,params_params_decision_threshold,params_params_feature_fraction,params_params_resampling,params_params_sample_rows,params_params_scale_pos_weight,params_rate_drop,params_sample_type,params_skip_drop,params_subsample,user_attrs_acc_test,user_attrs_acc_val,user_attrs_decision_threshold,user_attrs_f1_test,user_attrs_f1_val,user_attrs_feature_fraction,user_attrs_pr_auc_test,user_attrs_pr_auc_val,user_attrs_prec_test,user_attrs_prec_val,user_attrs_rec_test,user_attrs_rec_val,user_attrs_resampling_strategy,user_attrs_roc_auc_test,user_attrs_roc_auc_val,user_attrs_sample_rows,state
1192,0.6842105263157895,2025-09-23 17:17:52.952457,2025-09-23 17:17:53.640654,0 days 00:00:00.688197,0.8623219884381951,gbtree,0.47183731841195026,0.2066318413492556,lossguide,0.0015491248425026803,0.12794714592268044,5,4,0.5831382091235771,300,,0.5111671247257836,0.8635878150675478,none,0.6618305141882176,0.8266748706158135,,,,0.4657506489450996,0.871839492271471,0.8685503685503686,0.5111671247257836,0.6946341463414634,0.6842105263157895,0.8635878150675478,0.8236410160791139,0.8125252729928314,0.8081725312145289,0.8045112781954887,0.6090675791274593,0.5952075310226786,none,0.9249728238315458,0.9215683158255207,0.6618305141882176,COMPLETE
1193,0.6622426408031309,2025-09-23 17:17:53.773035,2025-09-23 17:18:00.205182,0 days 00:00:06.432147,0.0028056325633435135,dart,0.8519141911345178,8.680649312727478,depthwise,0.5170269219209321,0.03310442072149572,2,6,1.6130229959758737,300,forest,0.6172497363337697,0.7826615902007494,none,0.7375849245329601,4.851220891888072,0.17358932804978533,weighted,0.4735927908681037,0.23747919818831187,0.7919950864981062,0.7967854217854218,0.6172497363337697,0.657335581787521,0.6622426408031309,0.7826615902007494,0.7097102102676494,0.6948779980591921,0.5425946547884187,0.5497175141242938,0.8336184773310522,0.832691484809585,none,0.8894754467073697,0.8872091362054219,0.7375849245329601,COMPLETE
1194,0.6626790492680623,2025-09-23 17:18:00.337900,2025-09-23 17:18:01.115477,0 days 00:00:00.777577,1.655393365451116,gbtree,0.6213950396722862,3.488868012368454,lossguide,0.4772369205301825,0.4013665832512284,1,3,21.8220291599034,700,,0.40989087791537443,0.9323619710988823,oversample,0.91587588050453,1.2253987524434242,,,,0.5946293953454375,0.7742860067560651,0.7806101556101556,0.40989087791537443,0.6564885496183206,0.6626790492680623,0.9323619710988823,0.7880646433030655,0.7757266767854708,0.516295025728988,0.5241533864541833,0.9011976047904192,0.9007274283269149,oversample,0.9109222583726946,0.9085508515455296,0.91587588050453,COMPLETE
1195,0.6926536731634183,2025-09-23 17:18:01.247395,2025-09-23 17:18:07.733640,0 days 00:00:06.486245,0.0005157283301828898,dart,0.39965558500513193,7.459803097542635,depthwise,40.0787652348865,0.05782537233442297,6,5,6.31284404532165,300,forest,0.6765632857308018,0.966777036487846,none,0.5691155157740707,3.273152100005514,0.10458464023106738,weighted,0.6575237330409102,0.25134845877803197,0.8515712969597707,0.8530917280917281,0.6765632857308018,0.6940928270042194,0.6926536731634183,0.966777036487846,0.7912020609773469,0.7876682923749216,0.6848459616985845,0.6933962264150944,0.7035928143712575,0.6919127086007703,none,0.9123675481956095,0.9119445899853895,0.5691155157740707,COMPLETE
1196,0.7096212451023074,2025-09-23 17:18:07.864826,2025-09-23 17:18:08.706428,0 days 00:00:00.841602,0.4112006137432565,gbtree,0.40033979080709453,4.9819968942931165,depthwise,0.3968745975811406,0.018904140320249712,2,10,2.8897173602774973,400,,0.34964251548644076,0.9101498271987507,none,0.5206043663779847,0.7395837203863626,,,,0.9499673174407063,0.8673354488688709,0.8634316134316135,0.34964251548644076,0.7171540811872544,0.7096212451023074,0.9101498271987507,0.8204366684253326,0.812030729575187,0.732174688057041,0.7221976074435091,0.7027373823781009,0.6974753958065897,none,0.923333159507158,0.9209175995251018,0.5206043663779847,COMPLETE
1197,0.7073490813648294,2025-09-23 17:18:08.837880,2025-09-23 17:18:42.436712,0 days 00:00:33.598832,0.0008983560715909772,dart,0.5986508730640903,8.517604271478216,depthwise,3.7795957385005483,0.06741180049551132,5,5,1.290887584642573,700,forest,0.6635553953450122,0.860874752478035,none,0.7210578870698265,2.985329583215447,0.07425904672328665,weighted,0.38987332570365774,0.5496397202951152,0.8646739686764254,0.8630221130221131,0.6635553953450122,0.7114797031863815,0.7073490813648294,0.860874752478035,0.8122314089369356,0.8046107545962409,0.7263814616755794,0.723489932885906,0.6971770744225834,0.6919127086007703,none,0.9188097649789527,0.9177765639288673,0.7210578870698265,COMPLETE
1198,0.6957739901937894,2025-09-23 17:18:42.568739,2025-09-23 17:19:24.159092,0 days 00:00:41.590353,0.00010957354752616097,dart,0.8004104800343136,9.533398655250528,depthwise,0.0020642080098734563,0.012857887846542898,3,4,0.4080729668088573,800,forest,0.6802223033455556,0.9689120771764423,none,0.6610332553252841,2.5841667268920796,0.18090893104507794,weighted,0.607468891066491,0.3476380881250397,0.8689732828334528,0.8666052416052417,0.6802223033455556,0.7037037037037037,0.6957739901937894,0.9689120771764423,0.8135121839288773,0.8062647995970025,0.7669021190716448,0.7656731757451182,0.6501283147989735,0.6375695335900727,none,0.920738659942932,0.9192729436590417,0.6610332553252841,COMPLETE
1199,0.6814288023274608,2025-09-23 17:19:24.290135,2025-09-23 17:19:24.834242,0 days 00:00:00.544107,0.0019164119423740898,gbtree,0.7448787222920028,6.532842177391496,depthwise,9.60043059590357,0.17447401193901266,0,11,3.279491355358826,200,,0.6894799901463367,0.9759693028113839,undersample,0.8756834602372705,3.653584106974059,,,,0.717039401003195,0.7934281912171154,0.7982186732186732,0.6894799901463367,0.6778416347381865,0.6814288023274608,0.9759693028113839,0.811755719303592,0.8055834106817763,0.5407539480387162,0.5475324675324675,0.9080410607356715,0.9020111253744116,undersample,0.9218004673506668,0.9201370624292053,0.8756834602372705,COMPLETE
1200,0.6979667282809612,2025-09-23 17:19:24.966979,2025-09-23 17:20:10.424295,0 days 00:00:45.457316,0.0010900932977595077,dart,0.6895348317971811,8.546187400369988,depthwise,0.21067396354300158,0.40458223312178077,2,9,3.4526703317500105,800,forest,0.6331078334884335,0.958803843955982,none,0.7424579505032728,4.361140622573786,0.07343561833505269,weighted,0.5712454878173923,0.2425299520879434,0.8285392568328386,0.8327190827190827,0.6331078334884335,0.6947330052852196,0.6979667282809612,0.958803843955982,0.7916897476428674,0.7806993994618219,0.6052715147665926,0.6143833387569151,0.8152266894781864,0.8078733418913137,none,0.9144503829298551,0.9107378525711398,0.7424579505032728,COMPLETE
1201,0.7000949667616334,2025-09-23 17:20:10.556640,2025-09-23 17:20:11.730975,0 days 00:00:01.174335,0.0019249534934964558,gbtree,0.2491787838754569,0.7500821749448348,lossguide,0.00037376677255582377,0.01716407269990476,7,5,0.36296174676824466,500,,0.43597373361302,0.9615972231545576,none,0.6856218073331783,1.6788539603276404,,,,0.4024658713079849,0.8420513870406388,0.8383497133497133,0.43597373361302,0.7093614616688642,0.7000949667616334,0.9615972231545576,0.8021039829604926,0.7919344327639706,0.6337933355772467,0.6294398907103825,0.8053892215568862,0.7886178861788617,none,0.9186514795543005,0.91535200437953,0.6856218073331783,COMPLETE
1202,0.7008615507914245,2025-09-23 17:20:11.864068,2025-09-23 17:20:12.435100,0 days 00:00:00.571032,2.3783624334505467,gbtree,0.836262323913076,6.656157150682506,depthwise,0.10601556917971341,0.2086795037496999,2,9,28.24168033815298,200,,0.6979162335423083,0.8684184718659289,none,0.8157878622660849,4.376612242059452,,,,0.5807276769980053,0.8513665677141979,0.8471539721539721,0.6979162335423083,0.7129300118623962,0.7008615507914245,0.8684184718659289,0.8035272999715547,0.7947323701149156,0.6628676470588235,0.6590052750565185,0.7711719418306244,0.748395378690629,none,0.915065854219239,0.9129248248052673,0.8157878622660849,COMPLETE
1203,0.681225664465888,2025-09-23 17:20:12.565626,2025-09-23 17:20:13.205421,0 days 00:00:00.639795,0.021005681812117715,gbtree,0.6734769360101993,1.1757737320311747,lossguide,10.600163291160385,0.03426946923599013,0,5,12.809026083388789,300,,0.3195035811668536,0.7717921173898542,undersample,0.7433027704590076,0.5195347873213927,,,,0.40602428237741334,0.7982393284880746,0.8072276822276823,0.3195035811668536,0.674053249545229,0.681225664465888,0.7717921173898542,0.792433693591089,0.7880580932194556,0.5494742518198975,0.5635854341736695,0.8716852010265184,0.8609328198545143,undersample,0.9120700003764315,0.9115833144605164,0.7433027704590076,COMPLETE
1204,0.718913676042677,2025-09-23 17:20:13.339277,2025-09-23 17:20:38.900984,0 days 00:00:25.561707,0.002188541062878736,dart,0.6944801240170939,4.234590145434965,depthwise,0.00022744540412817618,0.0657672390613154,5,7,0.13895452225372462,600,forest,0.3589699863368691,0.9117203006006125,none,0.9879833256779117,1.1315802664133385,0.09620704916091494,weighted,0.6891570037455754,0.925983239877234,0.8522878493192753,0.8516584766584766,0.3589699863368691,0.722018878828742,0.718913676042677,0.9117203006006125,0.8288593120653959,0.8209309840250316,0.6568524360322467,0.6575585521646558,0.8015397775876818,0.7928968763371844,none,0.9278401211303675,0.9256795092226894,0.9879833256779117,COMPLETE
1205,0.7205387205387206,2025-09-23 17:20:39.034849,2025-09-23 17:21:16.736706,0 days 00:00:37.701857,0.5814823341439126,dart,0.2976006982497542,0.1553481332590972,depthwise,0.003060873947709479,0.24244949812113503,6,9,0.18649671668496037,700,forest,0.3357718190258782,0.9639172210472512,none,0.9437900645029211,1.1048375821146412,0.02561263289346777,weighted,0.6211341110295487,0.8797663732619152,0.8490121813901116,0.8555487305487306,0.3357718190258782,0.7086707485680427,0.7205387205387206,0.9639172210472512,0.8138551679695079,0.8139294289049668,0.658348623853211,0.6707227138643068,0.76732249786142,0.7783483097988875,none,0.9203051017752257,0.9214571231193477,0.9437900645029211,COMPLETE
1206,0.7146529562982005,2025-09-23 17:21:16.872882,2025-09-23 17:22:16.288480,0 days 00:00:59.415598,0.9729769827190067,dart,0.35087513404896176,0.8119411117404782,depthwise,0.0036434055058410146,0.18605005908617228,7,7,0.22117103081999462,900,forest,0.47822386546952717,0.9792424275961346,none,0.9636401453024026,2.9596856627855015,0.03090006497096703,weighted,0.5745076593231354,0.9003051327593414,0.8370355205241069,0.8409090909090909,0.47822386546952717,0.7088514996342355,0.7146529562982005,0.9792424275961346,0.8245349437760493,0.8224440640940436,0.6191693290734824,0.6259247346413638,0.8289136013686912,0.832691484809585,none,0.9254195628582502,0.9244235671645117,0.9636401453024026,COMPLETE
1207,0.7108112906089118,2025-09-23 17:22:16.422461,2025-09-23 17:23:03.417512,0 days 00:00:46.995051,4.072222301982135,dart,0.28553387711658096,1.5518239020435196,depthwise,0.0011997122238062866,0.049802210169645124,7,11,0.4391991074788082,800,forest,0.3096437938988035,0.9066668019105618,none,0.9352510928537646,1.4589642235539535,0.0058203027072187,weighted,0.6225591610323108,0.8322899509170711,0.8285392568328386,0.8332309582309583,0.3096437938988035,0.7065007885053444,0.7108112906089118,0.9066668019105618,0.8273936773555177,0.8208062717432536,0.5983971504897596,0.6074029126213593,0.8622754491017964,0.8566538296961917,none,0.9274792879204968,0.925457613265549,0.9352510928537646,COMPLETE
1208,0.6982564102564103,2025-09-23 17:23:03.551024,2025-09-23 17:23:28.407337,0 days 00:00:24.856313,0.04169466681135982,dart,0.6755767006317345,5.1146429280032795,depthwise,0.0013458582444144968,0.24243653352548453,7,5,0.31991397235335706,600,forest,0.3927602053713246,0.7672738128202432,none,0.8017929812844065,1.0232200821737152,0.03169397310376609,weighted,0.6817367358812026,0.8218759831605138,0.8516736615825571,0.8494062244062244,0.3927602053713246,0.7056672760511883,0.6982564102564103,0.7672738128202432,0.7991012007039955,0.7895374477561606,0.6719535783365571,0.6706067769897557,0.7429426860564585,0.7282841249465126,none,0.9154131036617577,0.9117715531743849,0.8017929812844065,COMPLETE
1209,0.7182298805560995,2025-09-23 17:23:28.544076,2025-09-23 17:23:52.972167,0 days 00:00:24.428091,0.0016470332229876665,dart,0.8703554264483928,2.8824846896800755,depthwise,0.0012327107813378422,0.442906336728399,6,9,0.13618978196278472,600,forest,0.33189858027753505,0.900615004445381,none,0.8507574252385939,0.9729132345992069,0.010027019404636899,weighted,0.7064923542517855,0.9069880198939622,0.8496263691268298,0.8526822276822277,0.33189858027753505,0.7140354292388553,0.7182298805560995,0.900615004445381,0.8181586187352424,0.8160338202173307,0.6552340121471955,0.6620938628158844,0.7844311377245509,0.7847667950363714,none,0.9235302680296018,0.9218504435644614,0.8507574252385939,COMPLETE
1210,0.7044145873320538,2025-09-23 17:23:53.103131,2025-09-23 17:23:53.807409,0 days 00:00:00.704278,0.0027802460724238682,gbtree,0.9150580498110844,1.1960713628705977,depthwise,0.0004663545242460497,0.4043259686491649,3,7,0.3476342970499735,700,,0.3068746385671482,0.9131268060394488,none,0.7689331188234577,1.0448536170011355,,,,0.9510990988361326,0.8446105026102979,0.8423423423423423,0.3068746385671482,0.7108571428571429,0.7044145873320538,0.9131268060394488,0.8135696065656174,0.8042734712037594,0.6407967032967034,0.6387051862164984,0.7981180496150556,0.7851946940522037,none,0.9210114001191918,0.9160153889323351,0.7689331188234577,COMPLETE
1211,0.7100240874559941,2025-09-23 17:23:53.941658,2025-09-23 17:24:28.184224,0 days 00:00:34.242566,0.001107750092849523,dart,0.8340905981717288,6.733228288999528,depthwise,0.00019568745205032138,0.05738470082136146,6,10,0.3775037355218142,700,forest,0.38548449682361496,0.9362378181454619,none,0.9588822129305472,1.5480832906915636,0.004435966149977252,weighted,0.6862143583426054,0.9141482494154234,0.8409253761899887,0.8397829647829648,0.38548449682361496,0.7137067059690494,0.7100240874559941,0.9362378181454619,0.827487764283984,0.8226429508511777,0.6268608414239483,0.6261437908496732,0.8284858853721129,0.819854514334617,none,0.9275561282993733,0.9261280517316148,0.9588822129305472,COMPLETE
1212,0.6648140230867893,2025-09-23 17:24:28.317009,2025-09-23 17:24:55.713790,0 days 00:00:27.396781,0.04232496736866177,dart,0.23845880104259037,0.5269921816038028,depthwise,0.0002744485926427611,0.39659630940880675,3,8,0.44174268133382033,600,forest,0.6769014583603786,0.8826045434505069,none,0.7781398754563545,4.611671109005999,0.0008440828601830319,weighted,0.7102925822472338,0.37468577666573527,0.8414371993039206,0.8394758394758395,0.6769014583603786,0.6699339441721713,0.6648140230867893,0.8826045434505069,0.7604613535864919,0.7548621876813337,0.6675159235668789,0.664246048697138,0.6723695466210436,0.6653829696191699,none,0.8942107134712639,0.8915482429796143,0.7781398754563545,COMPLETE
1213,0.671648910796629,2025-09-23 17:24:55.845762,2025-09-23 17:25:12.977076,0 days 00:00:17.131314,0.00020268773049320643,dart,0.8948207568009207,4.199902049959889,depthwise,0.0009738663051463612,0.10557446949681795,4,6,0.11216667146697967,500,tree,0.3971625186141867,0.7314002220540594,undersample,0.8688560406652001,0.9788038358694794,0.009084345714254344,weighted,0.6176219974145389,0.9930849538228332,0.7838059166751971,0.7885954135954136,0.3971625186141867,0.6688617121354656,0.671648910796629,0.7314002220540594,0.8008806052048274,0.7849007172928208,0.527970297029703,0.5344129554655871,0.9123182207014542,0.9037227214377407,undersample,0.9186201965985555,0.9133651617416244,0.8688560406652001,COMPLETE
1214,0.720294630742392,2025-09-23 17:25:13.110141,2025-09-23 17:25:31.765527,0 days 00:00:18.655386,0.004777551082294157,dart,0.5551988166239872,1.209213150926785,depthwise,0.00012492119359786046,0.04624365908282374,4,7,0.11308008795673097,500,forest,0.31794400591041183,0.914599025007666,none,0.7036872718103347,1.0088621745892314,0.039080129795706714,weighted,0.649874916103947,0.7243692339098268,0.8508547446002661,0.8522727272727273,0.31794400591041183,0.7202918026492608,0.720294630742392,0.914599025007666,0.8274572657448962,0.8205967384680881,0.653430860327412,0.6583982990786676,0.8023952095808383,0.7950363714163458,none,0.9272819203855396,0.924503549903442,0.7036872718103347,COMPLETE
1215,0.7200162899613114,2025-09-23 17:25:31.897387,2025-09-23 17:25:39.111645,0 days 00:00:07.214258,0.00034150579813761197,dart,0.7541787082139594,2.540314312367276,depthwise,0.0022327432411333287,0.04573898409322785,7,8,0.19811002236306952,300,forest,0.3620432257061795,0.977171958343558,none,0.9289632487741293,0.9781065228030347,0.003314730955992301,weighted,0.6847119974986363,0.999869807561542,0.8619101238611936,0.8592342342342343,0.3620432257061795,0.7269783444646832,0.7200162899613114,0.977171958343558,0.8298517102515859,0.8233458260580135,0.6899731079523627,0.6868686868686869,0.7681779298545766,0.756525459991442,none,0.9283741761531438,0.9263185361811335,0.9289632487741293,COMPLETE
1216,0.6933580189770886,2025-09-23 17:25:39.244686,2025-09-23 17:25:43.033984,0 days 00:00:03.789298,0.0008514901980074501,dart,0.9467482769330762,1.9856394108360527,depthwise,0.0342693626224085,0.00885162708717794,10,9,0.22014746472796223,200,forest,0.40794252790113966,0.9724723329471585,none,0.7435335048599324,0.9813362989572857,0.0020539088570539488,weighted,0.7191591943211929,0.9591734421144777,0.8637526870713481,0.8643529893529893,0.40794252790113966,0.6909681913164616,0.6933580189770886,0.9724723329471585,0.8049671873459214,0.7991461202118758,0.755713560182834,0.7550403225806451,0.6364414029084687,0.6409927257167308,none,0.9138158598311767,0.9118857401947583,0.7435335048599324,COMPLETE
1217,0.7189979123173278,2025-09-23 17:25:43.164819,2025-09-23 17:26:08.270390,0 days 00:00:25.105571,4.274451991479221,dart,0.3013260807949831,0.5822822049793038,depthwise,0.004084633328074923,0.3231896274266695,2,8,0.18428729155775125,600,forest,0.3388087189238471,0.9873820224805552,none,0.9906284578603478,0.798496891770446,0.0012126875785166413,weighted,0.5593147987831486,0.9007276420403099,0.8617053946156208,0.8622031122031122,0.3388087189238471,0.7177773135575517,0.7189979123173278,0.9873820224805552,0.8248797321230851,0.8185276227531877,0.7015108207431605,0.7019975540154912,0.7348160821214713,0.7368421052631579,none,0.9267950631984777,0.9236099774464799,0.9906284578603478,COMPLETE
1218,0.7039328325231993,2025-09-23 17:26:08.401942,2025-09-23 17:27:16.548936,0 days 00:01:08.146994,0.008175312648640671,dart,0.9022431244472433,1.1417844539388813,depthwise,0.0032845057996905426,0.3408487616582874,6,8,0.14478252395507266,1000,forest,0.4655908543087264,0.8705564546769464,none,0.7826101131968332,1.0703739648211206,0.0036861164732031396,weighted,0.5794733155022445,0.9106549698210594,0.8607841130105436,0.8628173628173628,0.4655908543087264,0.7003085059497576,0.7039328325231993,0.8705564546769464,0.810053721003221,0.809604002982113,0.7222727272727273,0.7277295568752855,0.6796407185628742,0.6816431322207959,none,0.9184668324116517,0.9178308358737497,0.7826101131968332,COMPLETE
1219,0.65716165825839,2025-09-23 17:27:16.683073,2025-09-23 17:27:50.506311,0 days 00:00:33.823238,0.00023540991854600226,dart,0.7477591953854295,1.963900617449999,depthwise,0.0016416931107222723,0.14539997296172338,8,10,0.15256793437980226,700,forest,0.30837009903922014,0.8083202222893636,none,0.8133262982243235,0.5728662462866001,0.01702957894808973,weighted,0.48888759762921935,0.7341462812876817,0.8388780837342614,0.839987714987715,0.30837009903922014,0.6566317626527051,0.65716165825839,0.8083202222893636,0.7344979146568228,0.7337187745204397,0.6700801424755121,0.6741674167416741,0.6437125748502994,0.6409927257167308,none,0.8928536030194643,0.8955109874920011,0.8133262982243235,COMPLETE
1220,0.6653551052528035,2025-09-23 17:27:50.638489,2025-09-23 17:28:14.973920,0 days 00:00:24.335431,86.02669150766226,dart,0.2816569347822837,1.7044767675316774,depthwise,0.05148618817836077,0.4114035799145268,3,6,0.4626666098673023,600,forest,0.37096218757482635,0.8910301097672456,none,0.9829870743417828,1.1081579456751727,0.003557333021290448,weighted,0.755957403260868,0.831173330636991,0.8232162964479476,0.8258599508599509,0.37096218757482635,0.6638115631691649,0.6653551052528035,0.8910301097672456,0.7300223073298452,0.7199176538025054,0.609146123615577,0.6158048069919884,0.7292557741659538,0.7235772357723578,none,0.89099682865079,0.892361947863577,0.9829870743417828,COMPLETE
1221,0.7158573596358119,2025-09-23 17:28:15.112125,2025-09-23 17:28:26.434445,0 days 00:00:11.322320,0.0003962473807018406,dart,0.6994214388945077,2.920773899049304,depthwise,0.003959104077646718,0.15360212217786348,7,8,1.2730462386117987,400,forest,0.3637938757061923,0.981502135115022,none,0.8850834731925276,1.2830535989329437,0.0013848795142618973,weighted,0.49337071444166886,0.9650724615754318,0.8473743474255298,0.8466420966420967,0.3637938757061923,0.7187323146576118,0.7158573596358119,0.981502135115022,0.8261578012640673,0.8225567753020817,0.6429294633817078,0.6429301533219761,0.8147989734816082,0.8074454428754814,none,0.9271230018191889,0.9255235745524063,0.8850834731925276,COMPLETE
