number,value,datetime_start,datetime_complete,duration,params_alpha,params_booster,params_colsample_bytree,params_gamma,params_grow_policy,params_lambda,params_learning_rate,params_max_delta_step,params_max_depth,params_min_child_weight,params_n_estimators,params_normalize_type,params_params_decision_threshold,params_params_feature_fraction,params_params_resampling,params_params_sample_rows,params_params_scale_pos_weight,params_rate_drop,params_sample_type,params_skip_drop,params_subsample,user_attrs_acc_test,user_attrs_acc_val,user_attrs_decision_threshold,user_attrs_f1_test,user_attrs_f1_val,user_attrs_feature_fraction,user_attrs_pr_auc_test,user_attrs_pr_auc_val,user_attrs_prec_test,user_attrs_prec_val,user_attrs_rec_test,user_attrs_rec_val,user_attrs_resampling_strategy,user_attrs_roc_auc_test,user_attrs_roc_auc_val,user_attrs_sample_rows,state
315,0.6006272869837951,2025-09-23 13:00:12.300972,2025-09-23 13:00:36.110188,0 days 00:00:23.809216,0.024817843982081655,dart,0.8754907066631099,9.736269962839451,depthwise,0.011607118594933633,0.19110658169080078,4,10,0.10139948783897017,600,tree,0.5196030734719268,0.7448947760388591,none,0.8950541763822981,0.7247277795857447,0.001363365781009207,uniform,0.7228019891128181,0.494146560353346,0.8424608455317842,0.8435708435708436,0.5196030734719268,0.6018111254851229,0.6006272869837951,0.7448947760388591,0.7455051813408595,0.7429975034753186,0.7616240995415848,0.7716588314304903,0.4974337040205304,0.49165596919127086,none,0.8963963761731971,0.898738426327807,0.8950541763822981,COMPLETE
316,0.4871713652201457,2025-09-23 13:00:36.232407,2025-09-23 13:01:03.598175,0 days 00:00:27.365768,0.1722475362067157,dart,0.3582160238274075,1.32306010044691,lossguide,0.021429868956753185,0.0018159296117748176,10,11,18.72735743975209,600,forest,0.4701291037172117,0.6086692651014348,oversample,0.6949658799845198,2.307610154540478,0.06357764742789934,uniform,0.49314594616006246,0.3452178442357371,0.49841334834681134,0.5027641277641277,0.4701291037172117,0.4858342077649528,0.4871713652201457,0.6086692651014348,0.7345634253911147,0.7323963425064545,0.3218854282536151,0.32338099243061397,0.9901625320786998,0.9871630295250321,oversample,0.8846154798080177,0.884308941361942,0.6949658799845198,COMPLETE
317,0.38612143742255267,2025-09-23 13:01:03.719405,2025-09-23 13:01:05.850318,0 days 00:00:02.130913,0.0008797820455843156,gbtree,0.9156509256209062,8.604208332925896,lossguide,16.451805317768024,0.0002854191321896689,4,9,9.639758471561967,400,,0.4996050657375244,0.8066124078701802,oversample,0.7145068554227731,3.9272093875109175,,,,0.5738661219353829,0.23932848807452145,0.23925061425061425,0.4996050657375244,0.3862228462872718,0.38612143742255267,0.8066124078701802,0.7251769710553189,0.7173837404410389,0.23932848807452145,0.23925061425061425,1.0,1.0,oversample,0.8925350176283916,0.884270735064404,0.7145068554227731,COMPLETE
318,0.6995417048579285,2025-09-23 13:01:05.971479,2025-09-23 13:01:39.532472,0 days 00:00:33.560993,0.0013356152848760941,dart,0.9568538749256696,9.699265919173937,lossguide,0.00025466575069900594,0.03189526567256226,1,11,13.844058300310264,700,tree,0.5933881688510723,0.8185350767187956,oversample,0.7132005293604419,1.1628698744741337,0.13533360187275134,uniform,0.24849874324156565,0.454497834466421,0.8325314771215068,0.8322072072072072,0.5933881688510723,0.7022206042955952,0.6995417048579285,0.8185350767187956,0.8116646518667048,0.8046190921670725,0.6112167300380228,0.6119307248236049,0.8250641573994867,0.8164313222079589,oversample,0.9203682144909098,0.9181164473820971,0.7132005293604419,COMPLETE
319,0.38612143742255267,2025-09-23 13:01:39.654964,2025-09-23 13:01:42.654406,0 days 00:00:02.999442,0.027075148168171526,dart,0.9858633386252644,0.6521464721662573,depthwise,1.3318001357385578,0.0006657444787204412,0,4,11.806176902576185,200,tree,0.4652665047608946,0.8106145617076288,oversample,0.6229450797849867,1.1365545686190173,0.1571608220466345,weighted,0.5512106081628747,0.31436297865905055,0.23932848807452145,0.23925061425061425,0.4652665047608946,0.3862228462872718,0.38612143742255267,0.8106145617076288,0.7507215693708287,0.7437952504442534,0.23932848807452145,0.23925061425061425,1.0,1.0,oversample,0.895879847663805,0.8933317601667188,0.6229450797849867,COMPLETE
320,0.6875,2025-09-23 13:01:42.776740,2025-09-23 13:01:43.618864,0 days 00:00:00.842124,0.027749389741075377,gbtree,0.6073487749774165,6.842286710979711,depthwise,48.20466033685431,0.02087721606512741,4,12,30.773488289269515,700,,0.5639897561957126,0.8213348904807263,none,0.5163115798629836,3.6495770903254066,,,,0.8181801985273178,0.8173815129491248,0.8218673218673219,0.5639897561957126,0.6844711708524938,0.6875,0.8213348904807263,0.797518740534354,0.7923858229833181,0.5835343787696019,0.5923862581244197,0.8276304533789564,0.8189987163029525,none,0.9125573180301834,0.9108639304738669,0.5163115798629836,COMPLETE
321,0.0,2025-09-23 13:01:43.744045,2025-09-23 13:01:49.828700,0 days 00:00:06.084655,0.059215256964686186,dart,0.2650108293107078,1.9218128376428567,depthwise,1.6014209722694897,0.0004352986662120106,6,5,98.61555796279897,300,tree,0.6235185539125734,0.9805134686797392,none,0.8206503890304808,2.0873866929640905,0.10473240126438199,uniform,0.005720525505761409,0.22663622794198057,0.7606715119254785,0.7607493857493858,0.6235185539125734,0.0,0.0,0.9805134686797392,0.7039396702233502,0.6983898248208534,0.0,0.0,0.0,0.0,none,0.8768376506114595,0.8749688692093347,0.8206503890304808,COMPLETE
322,0.6814893241574025,2025-09-23 13:01:49.951427,2025-09-23 13:01:50.709359,0 days 00:00:00.757932,7.515033944879203,gbtree,0.6603769988220483,2.7845959539033363,depthwise,28.621931410963064,0.3976295820520076,6,5,0.4700209073725697,1000,,0.33122100813996935,0.7513562595552634,none,0.807256380630188,1.482057284048225,,,,0.2779129806927599,0.8088852492578564,0.8152129402129402,0.33122100813996935,0.677825711820535,0.6814893241574025,0.7513562595552634,0.7940297713739004,0.7879039217258503,0.5681226496962685,0.5798798798798799,0.8400342172797263,0.826272999572101,none,0.9103589061567736,0.9092926928886824,0.807256380630188,COMPLETE
323,0.6154737757171834,2025-09-23 13:01:50.832167,2025-09-23 13:02:45.150952,0 days 00:00:54.318785,0.9457959762951322,dart,0.5662378253381217,0.7500483980227612,lossguide,6.324224385690576,0.3857838953757444,5,3,25.677807475322183,1000,forest,0.6370606015369764,0.6767399615522154,oversample,0.6232928197828856,2.9463386158748643,0.26318395069016104,uniform,0.21992299109635668,0.9245903530860649,0.7238202477223872,0.7282964782964783,0.6370606015369764,0.6117985611510791,0.6154737757171834,0.6767399615522154,0.6838908337918741,0.6788494811912967,0.46097137901127494,0.46527929901423876,0.9093242087254063,0.9088575096277278,oversample,0.8756719504068166,0.8768494424846083,0.6232928197828856,COMPLETE
324,0.38612143742255267,2025-09-23 13:02:45.274164,2025-09-23 13:03:23.468635,0 days 00:00:38.194471,0.12417172345088126,dart,0.7039685659837003,4.763882338380981,lossguide,0.009589607834658412,0.0005766250557801549,7,4,1.565307135080664,800,forest,0.34962600834194074,0.7890923466735893,oversample,0.7559780232162521,3.055959263248532,0.29686192413883994,weighted,0.4648663490114971,0.9139602001578286,0.23932848807452145,0.23925061425061425,0.34962600834194074,0.3862228462872718,0.38612143742255267,0.7890923466735893,0.7342934537176214,0.7264575478217322,0.23932848807452145,0.23925061425061425,1.0,1.0,oversample,0.8904358075474865,0.8845016715471109,0.7559780232162521,COMPLETE
325,0.5998075998075998,2025-09-23 13:03:23.590451,2025-09-23 13:04:32.010119,0 days 00:01:08.419668,0.0007543805587876616,dart,0.5931517976475169,3.612846182579472,depthwise,3.040006859097075,0.0035697002856188388,10,9,55.85656777601665,1000,tree,0.4752771121275215,0.7385436322224599,none,0.5310452987426029,1.5537126429306456,0.06180967599362597,uniform,0.18314270970056198,0.7577277566618785,0.8282321629644794,0.8296478296478297,0.4752771121275215,0.6046182846371347,0.5998075998075998,0.7385436322224599,0.6936064868876258,0.6819889090094934,0.6731374606505771,0.6847885777045579,0.548759623609923,0.5335900727428327,none,0.8741584827346288,0.8752948751679047,0.5310452987426029,COMPLETE
326,0.46014027462214757,2025-09-23 13:04:32.129755,2025-09-23 13:04:32.577872,0 days 00:00:00.448117,42.87187695925143,gbtree,0.23186030138728952,4.899256787427068,lossguide,0.00021616457316249565,0.008194553585871362,6,5,96.29263970470771,400,,0.44719443298280964,0.5087193797255916,undersample,0.8966367821729494,4.133044158879072,,,,0.44477671687345516,0.43576619920155596,0.4405200655200655,0.44719443298280964,0.4585461689587426,0.46014027462214757,0.5087193797255916,0.723443728766463,0.721586047639259,0.297628156082632,0.29912663755458513,0.998289136013687,0.9965768078733419,undersample,0.8813939685079923,0.8813570370155395,0.8966367821729494,COMPLETE
327,0.5884035361414457,2025-09-23 13:04:32.697397,2025-09-23 13:04:42.353950,0 days 00:00:09.656553,0.03834396515613698,dart,0.7096682953012843,3.6582710326906573,depthwise,55.14951074687708,0.01888903839241618,9,12,5.612171378571435,400,forest,0.46898631770322746,0.9447471550567581,undersample,0.5627678251378134,4.117473884857891,0.2968017702522926,uniform,0.34960102371730895,0.7075089918022748,0.6712048316101955,0.6758804258804259,0.46898631770322746,0.5852272727272727,0.5884035361414457,0.9447471550567581,0.7689486945703939,0.7620267496594972,0.4191638919718831,0.4225957049486461,0.9692044482463644,0.9683354728284125,undersample,0.9073415830545495,0.9054820537793802,0.5627678251378134,COMPLETE
328,0.5929070245104752,2025-09-23 13:04:42.473876,2025-09-23 13:05:14.489739,0 days 00:00:32.015863,1.8433860840469343,dart,0.9401091168966473,4.081781442159303,lossguide,9.1378671754989,0.0010192466362725994,10,6,1.1217188775623665,700,forest,0.552802725140459,0.5381051740044325,oversample,0.5726975594957696,1.971697488800353,0.16048089212824268,weighted,0.3530763533532085,0.8614738915520359,0.693213225509264,0.6956388206388207,0.552802725140459,0.592964824120603,0.5929070245104752,0.5381051740044325,0.7223722298826548,0.7196743508443023,0.4344278606965174,0.43596455900120823,0.9337040205303678,0.9264013692768507,oversample,0.8841451130842877,0.8812045285316972,0.5726975594957696,COMPLETE
329,0.5966120369095166,2025-09-23 13:05:14.609792,2025-09-23 13:05:15.018781,0 days 00:00:00.408989,0.008684854940853748,gbtree,0.6737821907596588,8.117443998973643,lossguide,0.11593649724177825,0.11901599474135328,10,11,0.25232020364285357,500,,0.34927540844483,0.6943545679918716,undersample,0.5243382298345686,1.2466771649571655,,,,0.2867033833240701,0.6892210052205958,0.7001433251433251,0.34927540844483,0.5873878771405273,0.5966120369095166,0.6943545679918716,0.6997411329285297,0.6949202765780709,0.4304780876494024,0.4398862713241267,0.9242942686056459,0.926829268292683,undersample,0.8738749791494927,0.8764947890007553,0.5243382298345686,COMPLETE
330,0.38612143742255267,2025-09-23 13:05:15.142745,2025-09-23 13:05:18.184933,0 days 00:00:03.042188,7.204250746428672,dart,0.8489763926948637,2.3704086020441117,depthwise,0.0016252584323210193,0.0016101595939427636,9,11,17.42606827260225,200,tree,0.6400429812939004,0.7815906204763743,undersample,0.8997819650112182,4.92638741226524,0.18880877448704708,uniform,0.19769806178823643,0.8139105349142581,0.23932848807452145,0.23925061425061425,0.6400429812939004,0.3862228462872718,0.38612143742255267,0.7815906204763743,0.6921746161298428,0.6859678329095602,0.23932848807452145,0.23925061425061425,1.0,1.0,undersample,0.8802874670521694,0.8788725048077459,0.8997819650112182,COMPLETE
331,0.622256331542594,2025-09-23 13:05:18.307797,2025-09-23 13:05:18.654540,0 days 00:00:00.346743,0.00101558439328637,gbtree,0.6462815452288837,8.567286077597107,lossguide,1.6782582095139873,0.09527190418558824,9,3,17.054747107511197,300,,0.5511456818670756,0.5070203160616118,oversample,0.6189620516054872,1.3140479835325447,,,,0.788767215842556,0.7463404647353874,0.7480548730548731,0.5511456818670756,0.621910283796155,0.622256331542594,0.5070203160616118,0.6968113578969382,0.6959886817256328,0.4833965844402277,0.4851603638104356,0.8716852010265184,0.8673513050919983,oversample,0.8769620053968998,0.876537573144042,0.6189620516054872,COMPLETE
332,0.5839793281653747,2025-09-23 13:05:18.774196,2025-09-23 13:05:19.621870,0 days 00:00:00.847674,4.3076325146621866,gbtree,0.7515921451383696,9.878447676074753,depthwise,35.87777998950927,0.0038657206848984713,0,8,0.11263424421387438,500,,0.5489258068384062,0.7732502648238179,undersample,0.8738936449327315,4.43663549688938,,,,0.5205447190846848,0.6658818712253045,0.6703521703521703,0.5489258068384062,0.5816457318636247,0.5839793281653747,0.7732502648238179,0.75217230009476,0.7411125864275423,0.41526354319180087,0.41828613733111236,0.9704875962360993,0.9670517757809157,undersample,0.9029567314416671,0.9004890636416722,0.8738936449327315,COMPLETE
333,0.6678424456202234,2025-09-23 13:05:19.742592,2025-09-23 13:05:20.983038,0 days 00:00:01.240446,0.00011084024211861169,gbtree,0.21879312092655434,4.553767219453412,depthwise,5.6517772075335575,0.002010096125521356,3,9,6.870707770263544,1000,,0.34427980565329125,0.6384716673922712,none,0.8170396110905347,1.0981589795558628,,,,0.6684524093978147,0.8190193469137066,0.8264742014742015,0.34427980565329125,0.6632380952380953,0.6678424456202234,0.6384716673922712,0.746232575298214,0.7408168324041028,0.5978708791208791,0.6160520607375272,0.7446535500427716,0.7291399229781772,none,0.8940412041710454,0.893167735089798,0.8170396110905347,COMPLETE
334,0.45892169448010267,2025-09-23 13:05:21.104285,2025-09-23 13:05:21.709836,0 days 00:00:00.605551,2.1857780732659298,gbtree,0.5106296776022388,8.930837091964431,depthwise,0.0017588690783723847,0.04528585198472238,3,5,19.12737152410152,1000,,0.6761957404255593,0.5952572452719675,none,0.6575819760162304,0.7578770091189104,,,,0.4824607800257596,0.8308936431569249,0.8273955773955773,0.6761957404255593,0.4715291106845809,0.45892169448010267,0.5952572452719675,0.7825426839570545,0.7721542438032803,0.9352791878172588,0.9178433889602053,0.3152266894781865,0.30594779632006847,none,0.9061465568775939,0.9041008111885084,0.6575819760162304,COMPLETE
335,0.0,2025-09-23 13:05:21.832889,2025-09-23 13:05:22.562519,0 days 00:00:00.729630,1.6220710134815906,gbtree,0.6722876950010971,7.198801015737461,depthwise,0.00827766033528057,0.0001706365973569748,1,10,0.3225622566267178,500,,0.6712616793214553,0.7988313931613882,undersample,0.5249502646376849,1.5995099376264343,,,,0.2182882751839931,0.7606715119254785,0.7607493857493858,0.6712616793214553,0.0,0.0,0.7988313931613882,0.7147828548944788,0.7059222536010393,0.0,0.0,0.0,0.0,undersample,0.8886596148495443,0.8885233810160595,0.5249502646376849,COMPLETE
336,0.6334962239004887,2025-09-23 13:05:22.682235,2025-09-23 13:06:12.372664,0 days 00:00:49.690429,0.06916910781979359,dart,0.9931386484021143,0.525304210213815,depthwise,98.76672651905618,0.2979850517464118,0,12,15.349481014244432,900,tree,0.5859319983609095,0.7057283654054,oversample,0.5216602741239227,4.487345377330445,0.21420058472825437,uniform,0.16494367246930727,0.24879762850914677,0.7403009519909919,0.7466216216216216,0.5859319983609095,0.6291477854114895,0.6334962239004887,0.7057283654054,0.7676890037243063,0.7620203301692343,0.4779036198090162,0.484375,0.9204448246364414,0.9152759948652118,oversample,0.9030101743568633,0.9001138242476916,0.5216602741239227,COMPLETE
337,0.6854865493191631,2025-09-23 13:06:12.496886,2025-09-23 13:07:19.392735,0 days 00:01:06.895849,0.10013957820233851,dart,0.8836833068454366,8.056069161573312,lossguide,0.005933778554165041,0.2351459438814856,4,4,7.573083432208864,1000,forest,0.6097062399093254,0.8693126865124214,oversample,0.5554516206120806,2.3287548056435403,0.02479475660276076,uniform,0.37093288430061666,0.36716735210735846,0.8035622888729655,0.8061015561015561,0.6097062399093254,0.6853582554517134,0.6854865493191631,0.8693126865124214,0.8120835111396337,0.8086450597543708,0.5557032704068067,0.5601085481682496,0.8939264328485885,0.883183568677792,oversample,0.9214730179758137,0.9195547834831554,0.5554516206120806,COMPLETE
338,0.6692160611854685,2025-09-23 13:07:19.519837,2025-09-23 13:07:22.725782,0 days 00:00:03.205945,0.555241360696109,dart,0.8581856525364435,1.6535719938920312,lossguide,0.004024124995340761,0.1104295977182976,6,6,0.15858665726808874,200,forest,0.3320820783264644,0.7411999063940193,undersample,0.8265568419050136,0.6868851301243021,0.24581393259866868,uniform,0.8175472263038973,0.9797467582867134,0.7778687685535879,0.7874692874692875,0.3320820783264644,0.658052316419792,0.6692160611854685,0.7411999063940193,0.8022888548475704,0.7984538581139033,0.5209580838323353,0.5331302361005331,0.893071000855432,0.8985879332477535,undersample,0.9120915559733525,0.9127006543209941,0.8265568419050136,COMPLETE
339,0.607249120908845,2025-09-23 13:07:22.845283,2025-09-23 13:07:23.526580,0 days 00:00:00.681297,3.436938919531131,gbtree,0.32100365744780457,5.184905463875858,lossguide,0.006282176486770849,0.023330766898525396,6,3,4.098211371406838,800,,0.38812883727661707,0.558973841478908,oversample,0.554362906632504,2.7616891754441166,,,,0.5204908411077538,0.6997645613675914,0.7027027027027027,0.38812883727661707,0.60625587327158,0.607249120908845,0.558973841478908,0.794488741525386,0.785821956934496,0.4417922128741929,0.4439390943246984,0.9657827202737382,0.9606332905434317,oversample,0.91547043176465,0.9127047715030195,0.554362906632504,COMPLETE
340,0.38612143742255267,2025-09-23 13:07:23.647050,2025-09-23 13:07:30.065677,0 days 00:00:06.418627,0.06413327946699156,dart,0.25430514747064453,3.9074000582160706,lossguide,0.000865933008087206,0.0001323446810275773,6,8,2.9650024644903916,300,forest,0.4436970562490574,0.6027429013112553,undersample,0.9683978425821571,2.670636659350343,0.3135956472788142,weighted,0.6735627498058867,0.5817355266428248,0.23932848807452145,0.23925061425061425,0.4436970562490574,0.3862228462872718,0.38612143742255267,0.6027429013112553,0.7264929363177071,0.7219215830431871,0.23932848807452145,0.23925061425061425,1.0,1.0,undersample,0.8852679898867701,0.8868115546208689,0.9683978425821571,COMPLETE
341,0.6495334251185559,2025-09-23 13:07:30.185986,2025-09-23 13:07:30.766122,0 days 00:00:00.580136,0.0003633037691072994,gbtree,0.8542277227037496,6.300614901694244,lossguide,11.53148189726688,0.1813751310488931,0,10,2.11035677052778,800,,0.3460112318430934,0.7123488528459807,oversample,0.6988286002978373,1.1676515729571462,,,,0.2953265340702137,0.7585218548469649,0.7654586404586404,0.3460112318430934,0.6446754029221268,0.6495334251185559,0.7123488528459807,0.7813610453535252,0.771735011734769,0.49755870727737733,0.5054761904761905,0.9153122326775022,0.9084296106118956,oversample,0.9088735845110057,0.9052549753553546,0.6988286002978373,COMPLETE
342,0.599646306624949,2025-09-23 13:07:30.887075,2025-09-23 13:07:46.826439,0 days 00:00:15.939364,0.03898334516810573,dart,0.3070692224563969,6.17529432658452,lossguide,0.0006217875498330883,0.023265310251367667,0,8,0.1502150377720812,500,forest,0.47504835764799747,0.6875507064991165,undersample,0.5300341454458221,2.122168949962678,0.1431383069581974,weighted,0.06972221504327612,0.9138641384612276,0.6915753915446822,0.6987100737100738,0.47504835764799747,0.5902352781177751,0.599646306624949,0.6875507064991165,0.7117955191630674,0.7114046097362838,0.43270189431704886,0.4395692062225768,0.9281437125748503,0.943089430894309,undersample,0.880379099923459,0.8853217105572667,0.5300341454458221,COMPLETE
343,0.6158987825256624,2025-09-23 13:07:46.945856,2025-09-23 13:08:41.861396,0 days 00:00:54.915540,0.001064563726621398,dart,0.7439660107779575,7.594638594043187,depthwise,0.0008070544911978018,0.009197662196065335,9,3,1.9009463341669315,1000,tree,0.3318638660399502,0.5996726184409771,none,0.7252807667812342,0.5384444380714315,0.4936988364636973,uniform,0.6006997866727364,0.7728034810370301,0.8361142389190296,0.8352784602784603,0.3318638660399502,0.6219598583234947,0.6158987825256624,0.5996726184409771,0.7020950254119376,0.686000944862041,0.6942540853979968,0.6965442764578834,0.5633019674935843,0.55198973042362,none,0.8853249726396449,0.8841202131928677,0.7252807667812342,COMPLETE
344,0.38612143742255267,2025-09-23 13:08:41.981786,2025-09-23 13:08:42.701332,0 days 00:00:00.719546,0.0005161360320056685,gbtree,0.695750915670404,7.646654092051191,lossguide,19.96505086107309,0.00035390641988178014,4,3,0.19830765946546305,700,,0.34305809974519413,0.710312908911821,none,0.839317721267079,4.541685640645671,,,,0.69253194671371,0.23932848807452145,0.23925061425061425,0.34305809974519413,0.3862228462872718,0.38612143742255267,0.710312908911821,0.6986621434824718,0.6914335954690884,0.23932848807452145,0.23925061425061425,1.0,1.0,none,0.8836723001312674,0.880248478557284,0.839317721267079,COMPLETE
345,0.48679678530424797,2025-09-23 13:08:42.823627,2025-09-23 13:08:43.229525,0 days 00:00:00.405898,0.20812293426550946,gbtree,0.5572758802084401,0.10541814088031343,lossguide,0.07406056163864698,0.0002915230534301883,0,3,13.742613468416225,300,,0.6923809619685377,0.6995095927298051,oversample,0.5009600138513043,2.1746648715540866,,,,0.8498140655719459,0.8205548162555021,0.816953316953317,0.6923809619685377,0.5018471156578573,0.48679678530424797,0.6995095927298051,0.6947358739975095,0.6851196751796373,0.7476714648602879,0.7393199651264167,0.3776732249786142,0.3628583654257595,oversample,0.8828032555915909,0.8796653646582362,0.5009600138513043,COMPLETE
