number,value,datetime_start,datetime_complete,duration,params_alpha,params_booster,params_colsample_bytree,params_gamma,params_grow_policy,params_lambda,params_learning_rate,params_max_delta_step,params_max_depth,params_min_child_weight,params_n_estimators,params_normalize_type,params_params_decision_threshold,params_params_feature_fraction,params_params_resampling,params_params_sample_rows,params_params_scale_pos_weight,params_rate_drop,params_sample_type,params_skip_drop,params_subsample,user_attrs_acc_test,user_attrs_acc_val,user_attrs_decision_threshold,user_attrs_f1_test,user_attrs_f1_val,user_attrs_feature_fraction,user_attrs_pr_auc_test,user_attrs_pr_auc_val,user_attrs_prec_test,user_attrs_prec_val,user_attrs_rec_test,user_attrs_rec_val,user_attrs_resampling_strategy,user_attrs_roc_auc_test,user_attrs_roc_auc_val,user_attrs_sample_rows,state
1101,0.695119818086409,2025-09-23 16:50:35.493679,2025-09-23 16:50:54.547220,0 days 00:00:19.053541,0.00012483169757446374,dart,0.43665337262618875,1.1919462598471533,depthwise,0.005745573888530625,0.12264854726783196,3,9,0.2218964373918428,500,forest,0.32559976302814075,0.8115415787608057,oversample,0.9628819711233079,0.6517687070505819,0.012944841035410055,weighted,0.5718111820888369,0.778019428459883,0.8189169822909202,0.8215601965601965,0.32559976302814075,0.6958913529310641,0.695119818086409,0.8115415787608057,0.8171322107146826,0.81431518379303,0.5817763725208394,0.5878698224852071,0.8656971770744226,0.8502353444587077,oversample,0.9205235644404137,0.9203430366964147,0.9628819711233079,COMPLETE
1102,0.5769845498135322,2025-09-23 16:50:54.685061,2025-09-23 16:51:51.182742,0 days 00:00:56.497681,0.0003212770398516966,dart,0.4653280541034756,2.0780647934111216,depthwise,0.5381592641742872,0.002853760407925248,1,8,0.1956878912256914,900,forest,0.3777283396856112,0.8601260564950842,none,0.5708398559219916,0.5751379832684481,0.10284500406384431,weighted,0.5546965311702979,0.22625767813513878,0.8412324700583478,0.8374283374283374,0.3777283396856112,0.5919494869771112,0.5769845498135322,0.8601260564950842,0.7372002015244745,0.7260415776354521,0.7689678742310321,0.7642907551164432,0.481180496150556,0.4634146341463415,none,0.8917035586822779,0.8933937770204465,0.5708398559219916,COMPLETE
1103,0.6801024765157985,2025-09-23 16:51:51.316277,2025-09-23 16:51:52.154898,0 days 00:00:00.838621,0.10610422260109878,gbtree,0.6230274191261925,1.3421889289104056,lossguide,73.01004461203169,0.2355109817677682,0,4,63.00356705364962,700,,0.35075307056800137,0.6341323242219445,oversample,0.9325841598385394,0.5876439962092778,,,,0.5597063083205946,0.8041764766096837,0.8082514332514332,0.35075307056800137,0.678972982043967,0.6801024765157985,0.6341323242219445,0.796946879193704,0.7879346351154397,0.5586854460093896,0.5659465605457646,0.8652694610778443,0.8519469405220368,oversample,0.913111777483156,0.9096110691043378,0.9325841598385394,COMPLETE
1104,0.7138214490537182,2025-09-23 16:51:52.287938,2025-09-23 16:52:03.568166,0 days 00:00:11.280228,0.00519731211173201,dart,0.22577026287048527,9.240849333483869,lossguide,0.1301690579666404,0.19000591730453079,7,4,0.29854922052011423,400,forest,0.6142887558637353,0.8520218884813735,none,0.792335773206365,3.6114894736828336,0.05925204975179019,weighted,0.7267551922298905,0.594782538507895,0.8469648889343843,0.8467444717444718,0.6142887558637353,0.7173378710531292,0.7138214490537182,0.8520218884813735,0.8229610979456747,0.8173221600447516,0.642832937987123,0.6451278507256393,0.811377245508982,0.7988874625588361,none,0.9255806110830418,0.9242896579784914,0.792335773206365,COMPLETE
1105,0.7015265836111598,2025-09-23 16:52:03.700269,2025-09-23 16:52:51.067809,0 days 00:00:47.367540,0.16946074859246282,dart,0.37161182992456276,4.060860289105855,depthwise,0.002229707128207122,0.0070359583292721895,1,8,7.299570906266065,800,forest,0.401171249831774,0.8334236239994962,none,0.7865452410715333,2.0228965275952624,0.056530650748238445,weighted,0.7578683904150914,0.7615324167596766,0.8204524516327157,0.8258599508599509,0.401171249831774,0.6977946243969676,0.7015265836111598,0.8334236239994962,0.8085994912517979,0.8041860417436273,0.5842469705712637,0.5945865556216537,0.8661248930710008,0.8553701326486949,none,0.9205064120562152,0.9195112795528014,0.7865452410715333,COMPLETE
1106,0.693607305936073,2025-09-23 16:52:51.198671,2025-09-23 16:53:08.080759,0 days 00:00:16.882088,0.00011424287160504439,dart,0.2644067954103721,9.29357741217208,lossguide,0.042914659892657504,0.32759390255476517,5,3,0.21169250324003677,500,forest,0.6401806203435734,0.8252620867360753,none,0.8674264884039918,2.3540069627584956,0.09826322184240348,weighted,0.6364879749412609,0.6272798743264687,0.8635479578257754,0.8626126126126126,0.6401806203435734,0.6991649740464906,0.693607305936073,0.8252620867360753,0.8104860999625285,0.8042219750383786,0.7400860009555662,0.7435144395496819,0.6625320786997434,0.6499786050492083,none,0.9205869937269472,0.919088706961268,0.8674264884039918,COMPLETE
1107,0.6859464627151052,2025-09-23 16:53:08.212404,2025-09-23 16:54:19.217667,0 days 00:01:11.005263,0.00042919293768726855,dart,0.6175838466960647,0.0713719937851442,lossguide,0.1997187117772901,0.03132269486441992,4,11,0.7913450283126077,900,forest,0.6713179591532087,0.9317019840149137,oversample,0.787992066671373,0.7327755651513134,0.0013510425573009036,weighted,0.8740978050275613,0.8296334239192472,0.8648786979219981,0.8654791154791155,0.6713179591532087,0.6867584242999525,0.6859464627151052,0.9317019840149137,0.816237958856638,0.8128360209243083,0.7713219616204691,0.7769355711965349,0.6189050470487596,0.6140350877192983,oversample,0.9209993416477502,0.9206881314080124,0.787992066671373,COMPLETE
1108,0.6712029161603889,2025-09-23 16:54:19.348397,2025-09-23 16:54:20.061493,0 days 00:00:00.713096,0.000284157418158734,gbtree,0.21090608784076684,1.1249640549362323,depthwise,0.0006830976791686201,0.2641070820765159,5,9,0.14112297728387374,500,,0.41667508178003654,0.9933436617340227,none,0.7851515826594138,0.5133949723864697,,,,0.6380744939737085,0.8643668748080663,0.8614864864864865,0.41667508178003654,0.6786320640310454,0.6712029161603889,0.9933436617340227,0.8075206124508518,0.8048437144379221,0.7837535014005602,0.7767154105736783,0.5983746792130026,0.590928540864356,none,0.9188991818542971,0.9175735551843759,0.7851515826594138,COMPLETE
1109,0.703850802970126,2025-09-23 16:54:20.194342,2025-09-23 16:54:31.766205,0 days 00:00:11.571863,0.003754848184368204,dart,0.30912692252647767,7.599982858689264,lossguide,0.04384156967738963,0.12345841750955142,10,5,0.13574021377615425,400,forest,0.4966128172465367,0.9512471034239353,none,0.7706251848020549,3.6220573289686637,0.06245593452160027,weighted,0.7500793783486543,0.8895616864901102,0.8215784624833657,0.8244266994266994,0.4966128172465367,0.7027119222241174,0.703850802970126,0.9512471034239353,0.8278972089580932,0.8183753523186805,0.5843971631205673,0.5900405327156919,0.8810949529512404,0.8720581942661532,none,0.9277119099363993,0.9249280515243161,0.7706251848020549,COMPLETE
1110,0.699870872532743,2025-09-23 16:54:31.896287,2025-09-23 16:54:35.025023,0 days 00:00:03.128736,0.0004859561819119575,gbtree,0.49274238884379395,3.346742407637419,lossguide,0.00016399270227444144,0.002484973386955178,9,9,0.881308315283396,500,,0.3240468714858205,0.9917879679171692,none,0.8705852133339907,1.1307909309456587,,,,0.5397960185534652,0.8325314771215068,0.8334357084357085,0.3240468714858205,0.7014598540145985,0.699870872532743,0.9917879679171692,0.805633269996199,0.7984612540925397,0.6117122851686824,0.6151102464332037,0.8220701454234388,0.811724433033804,none,0.9178283090086048,0.9158162382465248,0.8705852133339907,COMPLETE
1111,0.7044850203864563,2025-09-23 16:54:35.156532,2025-09-23 16:54:52.329254,0 days 00:00:17.172722,0.04580212290399814,dart,0.3821016395453561,9.420751489852295,lossguide,0.09030327215807768,0.3448315435409692,6,4,0.6601060872369294,500,forest,0.5629266198184486,0.9082918647985233,none,0.6104394997980465,4.204199610861288,0.011894415869780822,weighted,0.6250766063300135,0.3805048035902133,0.8264919643771113,0.8293407043407044,0.5629266198184486,0.7005829358770536,0.7044850203864563,0.9082918647985233,0.8134726088838814,0.8074853908916526,0.596749924766777,0.6013922518159807,0.8481608212147135,0.8502353444587077,none,0.9213183011680083,0.9197493275317344,0.6104394997980465,COMPLETE
1112,0.6927644600835716,2025-09-23 16:54:52.461074,2025-09-23 16:55:04.388661,0 days 00:00:11.927587,0.007441072001617775,dart,0.274807721516264,5.752949580368565,lossguide,0.699478583656995,0.043940744684234846,9,9,0.9653968936162056,400,forest,0.581075771764862,0.8733127685108135,none,0.7697842153737371,1.8470786205848468,0.09377904862820205,weighted,0.6882986745573202,0.5374388709659703,0.8603746545193981,0.8569819819819819,0.581075771764862,0.7021834061135371,0.6927644600835716,0.8733127685108135,0.8015950251828564,0.7877673913632306,0.7172167707404103,0.7126696832579186,0.6877673224978614,0.6739409499358151,none,0.9186881729936517,0.9141020797412359,0.7697842153737371,COMPLETE
1113,0.6730025773195877,2025-09-23 16:55:04.521397,2025-09-23 16:56:02.385248,0 days 00:00:57.863851,0.0054242692640952455,dart,0.22417245126679367,0.8256404238242421,depthwise,0.0020541901387616866,0.13230065749495382,6,11,1.2993698867810524,900,forest,0.3398814951590012,0.9840864902922418,undersample,0.75490128446069,0.8476805009372606,0.04491869637190961,weighted,0.7574577563821767,0.5980391543362239,0.7912785341386017,0.7921785421785422,0.3398814951590012,0.6766058683584457,0.6730025773195877,0.9840864902922418,0.8087457648972437,0.7983586329076016,0.5376859087471642,0.5396538362180315,0.9123182207014542,0.8938810440735986,undersample,0.9197270721835643,0.9164057438547315,0.75490128446069,COMPLETE
1114,0.6667706221737096,2025-09-23 16:56:02.517267,2025-09-23 16:56:11.986510,0 days 00:00:09.469243,0.002699814885595595,gbtree,0.6040793779020637,0.38673282176763313,lossguide,0.0020374452007302416,0.006575217926354359,9,12,0.6508036689841944,300,,0.3088874741552131,0.9536914746272974,none,0.9685260373610333,2.5707484519122152,,,,0.7674301851637302,0.7784829562903061,0.7812244062244063,0.3088874741552131,0.6654298082869512,0.6667706221737096,0.9536914746272974,0.8127223850828075,0.8059408626971889,0.5210653753026634,0.5245338567222767,0.9204448246364414,0.9148480958493795,none,0.9216580104684801,0.9199536318929473,0.9685260373610333,COMPLETE
1115,0.6459071990134114,2025-09-23 16:56:12.119021,2025-09-23 16:56:13.745695,0 days 00:00:01.626674,0.07623522483648199,gbtree,0.9537959824416551,2.344407725549031,lossguide,0.0001612561991428769,0.07289811711696416,9,10,2.4663291211308294,200,,0.31745740962359115,0.9145531950674992,oversample,0.9520313805895219,1.1049737488395073,,,,0.8159622360376828,0.7607738765482649,0.7648443898443898,0.31745740962359115,0.6429335370511841,0.6459071990134114,0.9145531950674992,0.7457021338353713,0.7345309305263537,0.5001188495364868,0.5048192771084338,0.8999144568006844,0.8964484381685922,oversample,0.8959040221650246,0.8947062079676743,0.9520313805895219,COMPLETE
1116,0.7155351936693044,2025-09-23 16:56:13.880059,2025-09-23 16:56:39.665693,0 days 00:00:25.785634,0.05135380171962616,dart,0.21355637210035494,1.3106122737501136,depthwise,1.756570848614209,0.026304065627529124,3,12,0.3438986362650507,600,forest,0.3096521594261488,0.9036170317179774,none,0.6043215972583226,0.7069235089908334,0.11369300942991313,weighted,0.5959932514896304,0.530620554943542,0.8644692394308527,0.8601556101556102,0.3096521594261488,0.7237061769616027,0.7155351936693044,0.9036170317179774,0.8221663144120093,0.8157422531879033,0.706601466992665,0.6969574036511156,0.7416595380667237,0.7351305091998288,none,0.9245110620790831,0.9232379339070785,0.6043215972583226,COMPLETE
1117,0.7080745341614907,2025-09-23 16:56:39.796224,2025-09-23 16:57:49.406105,0 days 00:01:09.609881,0.0005734937802384369,dart,0.7113814836171091,0.7070398864784871,lossguide,1.2963306746162342,0.001963785099943217,2,9,0.14846785291419412,900,forest,0.6736487631909917,0.710334973174407,oversample,0.9590789267069518,1.4159144475713195,0.09780119502451906,weighted,0.5954952637021963,0.49303351035246834,0.8479885351622479,0.846027846027846,0.6736487631909917,0.7113702623906706,0.7080745341614907,0.710334973174407,0.8129473215897169,0.8055242955163561,0.6519415746348415,0.6479573712255773,0.7827202737382378,0.7804878048780488,oversample,0.9207467468891735,0.9190742824284371,0.9590789267069518,COMPLETE
1118,0.7125934025879351,2025-09-23 16:57:49.537551,2025-09-23 16:57:50.709792,0 days 00:00:01.172241,0.041048012176577865,gbtree,0.5369720045422636,2.557403616097579,lossguide,0.0001697393222800422,0.016092729988349378,8,5,0.33039193857036514,500,,0.528950276055173,0.9493145922951173,oversample,0.7824120736229885,0.9161705018304379,,,,0.4639516657502878,0.8348858634455932,0.8385544635544635,0.528950276055173,0.7094217258151685,0.7125934025879351,0.9493145922951173,0.8247612380494027,0.8175068203258901,0.612822906940554,0.6206349206349207,0.8421727972626176,0.8365425759520753,oversample,0.9259367245093412,0.9241547986735418,0.7824120736229885,COMPLETE
1119,0.7126249235162145,2025-09-23 16:57:50.841557,2025-09-23 16:58:10.448607,0 days 00:00:19.607050,0.003285024364272952,dart,0.2571254748159941,0.4467101612217038,depthwise,1.9882570739774588,0.01372755624837081,6,12,1.0985584179405032,500,forest,0.3095937028129233,0.9878905686489441,none,0.572229821368833,0.79277503406881,0.013017655133316375,uniform,0.5594546812700028,0.47058771046763503,0.8533114955471389,0.8557534807534808,0.3095937028129233,0.7109138591890256,0.7126249235162145,0.9878905686489441,0.8106994349255128,0.8049767045049419,0.6727758686521573,0.6808261886204209,0.7536355859709153,0.7475395806589645,none,0.9186232184112081,0.9176027497478298,0.572229821368833,COMPLETE
1120,0.715906828588493,2025-09-23 16:58:10.580259,2025-09-23 16:58:35.463303,0 days 00:00:24.883044,2.655166791264241,dart,0.2537786913188943,4.591464068792757,depthwise,0.5696561980265848,0.07934709382699143,4,10,0.99162461859034,600,forest,0.34011699438420434,0.9218466651342443,none,0.6523263966733754,0.9526114112456215,0.12958041962629563,weighted,0.611486833444258,0.9252609496829614,0.8569966219674481,0.8539107289107289,0.34011699438420434,0.7223216060425363,0.715906828588493,0.9218466651342443,0.8223582730781405,0.8155829419656966,0.6747122168585221,0.6693968726731199,0.7771599657827203,0.76936243046641,none,0.9240593154771258,0.9229684744205239,0.6523263966733754,COMPLETE
1121,0.6303146769156858,2025-09-23 16:58:35.594688,2025-09-23 16:59:00.325372,0 days 00:00:24.730684,7.933744468061936,dart,0.26609182685605337,3.435290788808877,depthwise,0.1731576610907635,0.03754012711712016,5,9,0.40117331643926796,600,forest,0.3484356210430355,0.832716556642604,none,0.6687533166564484,0.5860606050080086,0.12346931853205728,weighted,0.5558593544831956,0.9166978446889087,0.8423584809089979,0.8424447174447175,0.3484356210430355,0.6306954436450839,0.6303146769156858,0.832716556642604,0.7363826235820186,0.7299353240404142,0.7177947598253275,0.7185104052573932,0.5624465355004277,0.5614035087719298,none,0.8941058134034716,0.8938215032873827,0.6687533166564484,COMPLETE
1122,0.6746107403876708,2025-09-23 16:59:00.458250,2025-09-23 16:59:27.594286,0 days 00:00:27.136036,0.15530664128618413,dart,0.2425132550467178,1.7911644335832293,depthwise,0.24141855642179524,0.020205860413619593,4,12,0.14736580947704303,600,forest,0.3430397470942075,0.8015255360300385,oversample,0.6221649835600277,0.8818743345353112,0.12295771786341042,weighted,0.5820622047855497,0.5311431515110762,0.7846248336574879,0.7903357903357904,0.3430397470942075,0.6693903205531112,0.6746107403876708,0.8015255360300385,0.8123682228270348,0.8100792765684428,0.5290611028315947,0.5365175638109679,0.9110350727117195,0.9084296106118956,oversample,0.9211982920369538,0.9199532576036723,0.6221649835600277,COMPLETE
1123,0.6943413729128015,2025-09-23 16:59:27.727506,2025-09-23 16:59:28.366229,0 days 00:00:00.638723,0.0007952895280978734,gbtree,0.33475333762280707,4.303547847845133,depthwise,2.2084658681460043,0.46599434280391494,7,12,0.3708080272543629,700,,0.4259865441203474,0.8848155632141514,none,0.6306066206656649,0.7740511452251576,,,,0.6721854026328324,0.8685638243423073,0.8650696150696151,0.4259865441203474,0.7055045871559633,0.6943413729128015,0.8848155632141514,0.8167981855189483,0.8067103427753476,0.7606330365974283,0.7579746835443038,0.6578272027373824,0.6405648267008985,none,0.9221425941012604,0.9198272372839106,0.6306066206656649,COMPLETE
1124,0.7030326149151249,2025-09-23 16:59:28.498831,2025-09-23 16:59:45.921106,0 days 00:00:17.422275,0.17434505477301065,dart,0.39352086815618426,4.898635235291274,depthwise,0.000989570679938246,0.14197729332125988,2,12,0.1286809206312345,500,forest,0.33735344658935573,0.964182601662615,none,0.7429302657099313,1.1743492953123906,0.08962106210335141,weighted,0.5871325455524832,0.3203422158038756,0.8411301054355614,0.8406019656019657,0.33735344658935573,0.708051166290444,0.7030326149151249,0.964182601662615,0.8132691605925024,0.8071914369310829,0.6319677635997314,0.6342050929112182,0.804961505560308,0.7886178861788617,none,0.9187356874002154,0.9183557909777513,0.7429302657099313,COMPLETE
1125,0.6881028938906752,2025-09-23 16:59:46.052413,2025-09-23 16:59:48.024545,0 days 00:00:01.972132,0.07845302844389054,gbtree,0.3209908166477914,0.7842490360528953,lossguide,6.853429652586466,0.003186710401997737,5,11,9.834534021030697,500,,0.39927832787661766,0.9648892447245148,none,0.7766923737387992,1.8218420124077757,,,,0.33144053627728476,0.8171767837035521,0.8212530712530712,0.39927832787661766,0.6868863955119214,0.6881028938906752,0.9648892447245148,0.7752372042471832,0.7671834165197404,0.5819964349376114,0.5906163753449862,0.8378956372968349,0.8241335044929397,none,0.9076020633051908,0.9063727470880726,0.7766923737387992,COMPLETE
1126,0.7083429096759366,2025-09-23 16:59:48.160183,2025-09-23 17:00:24.821940,0 days 00:00:36.661757,0.02987750331884347,dart,0.2698304513119526,1.2536503172921958,depthwise,0.0875091553579227,0.026988661583644134,1,12,0.10937148578107718,700,forest,0.33029021961426464,0.9836034614236238,none,0.6159807898523649,0.5044219559375384,0.0018835197278798121,weighted,0.6872263957644885,0.6350340115086974,0.8713276691575391,0.870085995085995,0.33029021961426464,0.7121593771467827,0.7083429096759366,0.9836034614236238,0.8267385978429926,0.8209329226451715,0.7663873829472647,0.7651439920556107,0.665098374679213,0.6593923833975182,none,0.9268499450720796,0.9255553027663375,0.6159807898523649,COMPLETE
1127,0.675320407492606,2025-09-23 17:00:24.954724,2025-09-23 17:01:08.364577,0 days 00:00:43.409853,22.183354824968077,dart,0.3680781354918697,4.762310100813125,depthwise,3.6268772627225525,0.020862824394426757,3,11,1.8643245193662945,800,forest,0.315171614070119,0.9911669841874825,none,0.5868892468590655,1.826052795978473,0.11023430503033518,weighted,0.6097249578257625,0.661768964733438,0.7895383355512335,0.7977067977067978,0.315171614070119,0.669983948635634,0.675320407492606,0.9911669841874825,0.8008330890719809,0.7940970153663747,0.5362281603288798,0.5481461723126168,0.8926432848588537,0.8793324775353016,none,0.9150442410639819,0.9134463249313451,0.5868892468590655,COMPLETE
1128,0.6229279843989414,2025-09-23 17:01:08.497587,2025-09-23 17:01:43.802010,0 days 00:00:35.304423,0.04988634244386823,dart,0.22968973147548324,5.066412619285791,depthwise,0.24500045383626884,0.007423950617015633,4,11,0.4203022163738663,700,forest,0.3365131605794063,0.9756658112320363,undersample,0.5275420552202477,1.1977176165895407,0.05079862904293894,weighted,0.5119784451796282,0.9089796590543805,0.7158358071450507,0.7228705978705978,0.3365131605794063,0.6165745856353592,0.6229279843989414,0.9756658112320363,0.8020679542191338,0.7968886784450393,0.45532435740514077,0.4617926476662536,0.9546621043627032,0.9567821994009413,undersample,0.9183898769161026,0.9161851723057952,0.5275420552202477,COMPLETE
1129,0.712085050987199,2025-09-23 17:01:43.932782,2025-09-23 17:02:42.392948,0 days 00:00:58.460166,0.0006214488572458708,dart,0.2596582853191675,4.303832198889465,depthwise,0.009739363517344373,0.0035367485285730978,4,10,0.662349834388375,900,forest,0.3417352008750698,0.9737618560367233,none,0.8755806624709008,0.8147970228324758,0.09369571742955926,weighted,0.6780410849866556,0.47303406438572043,0.8643668748080663,0.8641482391482391,0.3417352008750698,0.7133895738697815,0.712085050987199,0.9737618560367233,0.8102583247532986,0.8031406101492811,0.7216630196936543,0.7222711267605634,0.7053036783575706,0.7021822849807445,none,0.919797725041295,0.9184939900946933,0.8755806624709008,COMPLETE
1130,0.7115384615384616,2025-09-23 17:02:42.525437,2025-09-23 17:03:15.385126,0 days 00:00:32.859689,0.0029687539938166086,dart,0.5210683096168662,6.4481726349610735,depthwise,0.00032869791092823256,0.16686057539310817,1,4,0.6999789538008744,700,forest,0.35490471307691096,0.9534801804164531,none,0.9427660996241025,0.9124686576156127,0.06967852612507514,weighted,0.7634703465936375,0.7586177922002787,0.8597604667826799,0.8587223587223587,0.35490471307691096,0.7172926124638878,0.7115384615384616,0.9534801804164531,0.8211956615033826,0.813921142083416,0.6929824561403509,0.6955455659991827,0.7433704020530368,0.7282841249465126,none,0.9228075367806403,0.9211671640971131,0.9427660996241025,COMPLETE
