number,value,datetime_start,datetime_complete,duration,params_alpha,params_booster,params_colsample_bytree,params_gamma,params_grow_policy,params_lambda,params_learning_rate,params_max_delta_step,params_max_depth,params_min_child_weight,params_n_estimators,params_normalize_type,params_params_feature_fraction,params_params_labeled_ratio,params_params_missing_rate,params_params_resampling,params_params_sample_rows,params_params_scale_pos_weight,params_params_selftrain_max_iter,params_params_selftrain_threshold,params_rate_drop,params_sample_type,params_skip_drop,params_subsample,params_user_attrs_decision_threshold,user_attrs_acc_test,user_attrs_acc_val,user_attrs_f1_test,user_attrs_f1_val,user_attrs_feature_fraction,user_attrs_labeled_ratio,user_attrs_missing_rate,user_attrs_pr_auc_test,user_attrs_pr_auc_val,user_attrs_prec_test,user_attrs_prec_val,user_attrs_rec_test,user_attrs_rec_val,user_attrs_resampling_strategy,user_attrs_roc_auc_test,user_attrs_roc_auc_val,user_attrs_sample_rows,user_attrs_user_attrs_decision_threshold,state
2392,0.7094272076372315,2025-11-30 13:59:38.406307,2025-11-30 13:59:42.776913,0 days 00:00:04.370606,0.08220843914165482,gbtree,0.748405444707239,2.4890540953586546,lossguide,0.00030457806931934585,0.07010224144051747,7,6,2.080834417961281,500,,0.6799898851235404,0.28447420477221724,0.09053849090933398,none,0.9503388705946305,2.826099537695886,9.0,0.8923311669212719,,,,0.3992135205411995,,0.5563093622795116,0.5594753505201266,0.7069017030176278,0.7094272076372315,0.6799898851235404,0.28447420477221724,0.1,0.5560236066178175,0.5512110768074231,0.5590737240075614,0.5608490566037736,0.9610073111291633,0.9650974025974026,none,0.5063342396259884,0.5043996159611583,0.9503388705946305,0.5,COMPLETE
2393,0.7156549520766773,2025-11-30 13:59:43.552706,2025-11-30 13:59:44.389281,0 days 00:00:00.836575,94.49684466352639,gbtree,0.8726614535130237,0.8980043677436733,depthwise,0.0012471682330621855,0.0004326916163245103,2,8,77.96682144210615,1000,,0.5848104511394698,0.8363354253255122,0.00473173756039359,oversample,0.5269170069574758,,8.0,0.9387042902255185,,,,0.8228774585590797,,0.5567616463138851,0.5572139303482587,0.715281812899477,0.7156549520766773,0.5848104511394698,0.8363354253255122,0.08,0.5567616463138851,0.5572139303482587,0.5567616463138851,0.5572139303482587,1.0,1.0,oversample,0.5,0.5,0.5269170069574758,0.5,COMPLETE
2394,0.0,2025-11-30 13:59:45.179121,2025-11-30 14:00:02.208786,0 days 00:00:17.029665,0.14091814389317922,dart,0.5185050944824199,2.626456515920524,depthwise,0.0011348268383889898,0.19305463995234742,3,11,79.2302961549214,400,tree,0.5467395350028597,0.27799568469435265,0.015717147643104955,undersample,0.7797746518179933,,10.0,0.7277204083151514,0.37160647030569566,uniform,0.4307923115147272,0.47548683738478675,,0.44323835368611486,0.4427860696517413,0.0,0.0,0.5467395350028597,0.27799568469435265,0.08,0.5567616463138851,0.5572139303482587,0.0,0.0,0.0,0.0,undersample,0.5,0.5,0.7797746518179933,0.5,COMPLETE
2395,0.12724623603691113,2025-11-30 14:00:03.008297,2025-11-30 14:00:03.709728,0 days 00:00:00.701431,1.2281796650369936,gbtree,0.41350429285775975,8.6104388934984,depthwise,0.5837595274746794,0.0002598181617714919,5,4,2.5877173903697095,700,,0.9500227850569075,0.7417669185123275,0.006915139007142301,undersample,0.5361110066154731,,5.0,0.6451028741627068,,,,0.5145329203276929,,0.18860244233378562,0.18724559023066487,0.12743190661478598,0.12724623603691113,0.9500227850569075,0.7417669185123275,0.08,0.36644181524262176,0.36784703161153326,0.15878787878787878,0.15840386940749698,0.10641754670999187,0.10633116883116883,undersample,0.08586307796879922,0.08764368292585861,0.5361110066154731,0.5,COMPLETE
2396,0.7156549520766773,2025-11-30 14:00:04.500034,2025-11-30 14:00:05.172341,0 days 00:00:00.672307,98.4303486505776,gbtree,0.5493307782863792,7.187292963814044,depthwise,8.3796090356882,0.008072295843328603,2,5,2.9011601086303136,700,,0.5896834457453344,0.2759994090928986,0.08769433979156693,oversample,0.773224385622107,,5.0,0.9452882211343328,,,,0.36682214560237647,,0.5567616463138851,0.5572139303482587,0.715281812899477,0.7156549520766773,0.5896834457453344,0.2759994090928986,0.08,0.5567616463138851,0.5572139303482587,0.5567616463138851,0.5572139303482587,1.0,1.0,oversample,0.5,0.5,0.773224385622107,0.5,COMPLETE
2397,0.5773480662983426,2025-11-30 14:00:05.945755,2025-11-30 14:00:25.172668,0 days 00:00:19.226913,22.954113277653434,dart,0.377740248216632,1.0777282854360704,depthwise,0.10250675544475266,0.07797764110027702,9,4,15.03530747411454,400,tree,0.9059356320328376,0.6135213808386231,0.038820498523694624,undersample,0.9828711720914083,,6.0,0.810821592324376,0.20941034913088835,uniform,0.439006843583863,0.5392529877493941,,0.5933966530981456,0.5848032564450475,0.5851407475772958,0.5773480662983426,0.9059356320328376,0.6135213808386231,0.08,0.6557713111420325,0.6518727855067663,0.6773504273504274,0.6670212765957447,0.5150284321689683,0.5089285714285714,undersample,0.6462619572605647,0.6380023513258958,0.9828711720914083,0.5,COMPLETE
2398,0.5492679066086268,2025-11-30 14:00:25.951077,2025-11-30 14:00:26.636937,0 days 00:00:00.685860,0.09583529178792775,gbtree,0.9416886697615454,5.4779188673723365,lossguide,11.674496142667609,0.0011674496150778154,8,6,0.32277344300186334,600,,0.5885843201941137,0.8059184272409794,0.09277803906599386,undersample,0.9489616469292066,,5.0,0.729175761650979,,,,0.4879187054336789,,0.4947987336047038,0.48484848484848486,0.5533786485405837,0.5492679066086268,0.5885843201941137,0.8059184272409794,0.1,0.5338011604166462,0.5477960726924792,0.5448818897637795,0.5359073359073359,0.5621445978878961,0.5633116883116883,undersample,0.4787566935791376,0.4724606343605322,0.9489616469292066,0.5,COMPLETE
2399,0.7057772483621203,2025-11-30 14:00:27.419943,2025-11-30 14:01:27.605226,0 days 00:01:00.185283,0.0005007067227168575,dart,0.2768362257568113,3.9711027352524573,lossguide,0.004994062786178146,0.26284559722656253,7,9,0.8828390624535553,700,forest,0.9521335487114801,0.2056861329643654,0.0024970328686211296,oversample,0.5017620378899892,,7.0,0.8289650260907069,0.13603541631484717,uniform,0.46446280017992064,0.9687753139906794,,0.5468113975576662,0.5531433740388965,0.7005379557680813,0.7057772483621203,0.9521335487114801,0.2056861329643654,0.08,0.5568503679732881,0.5376822297574873,0.5541371158392435,0.5573847601128881,0.9520714865962632,0.9618506493506493,oversample,0.4326563769293258,0.4076022611198811,0.5017620378899892,0.5,COMPLETE
2400,0.7156549520766773,2025-11-30 14:01:28.374990,2025-11-30 14:01:33.193209,0 days 00:00:04.818219,0.00013655401696394617,dart,0.25819310378555055,1.454761419338988,lossguide,10.875909866221958,0.0013649724207010102,2,8,0.3153780617039318,200,tree,0.932098310576591,0.6126773765599338,0.06681983620560102,none,0.7230768208373584,0.9431394195257121,11.0,0.6016275665481261,0.3183473257312534,uniform,0.34108473717998505,0.5962058804319845,,0.5567616463138851,0.5572139303482587,0.715281812899477,0.7156549520766773,0.932098310576591,0.6126773765599338,0.08,0.4841756254927977,0.4659994151600869,0.5567616463138851,0.5572139303482587,1.0,1.0,none,0.4003149919594158,0.3732141198944059,0.7230768208373584,0.5,COMPLETE
2401,0.7156549520766773,2025-11-30 14:01:33.975937,2025-11-30 14:02:15.616843,0 days 00:00:41.640906,0.012798115783324765,dart,0.8675138618986789,3.7580221866405585,depthwise,0.001303976342362521,0.1892399130088368,9,12,45.26891912407307,600,forest,0.5438409809117792,0.888472537074209,0.05941109395136212,oversample,0.5986631805561904,,12.0,0.6812060450348204,0.23044276836919725,weighted,0.009791524087975612,0.3074212824237245,,0.5567616463138851,0.5572139303482587,0.715281812899477,0.7156549520766773,0.5438409809117792,0.888472537074209,0.08,0.6818902267733792,0.6791929623022339,0.5567616463138851,0.5572139303482587,1.0,1.0,oversample,0.7096756411744227,0.6993698015467679,0.5986631805561904,0.5,COMPLETE
2402,0.7156549520766773,2025-11-30 14:02:16.370618,2025-11-30 14:03:59.182205,0 days 00:01:42.811587,4.861373916032583,dart,0.9955379132569429,1.8082008271965422,depthwise,0.05310720963749053,0.013714054526760725,8,11,78.3298404808776,1000,tree,0.8122535696173199,0.43956540045425163,0.07837604758050785,oversample,0.6194149755763709,,8.0,0.7123238424325735,0.4437309242825125,uniform,0.4854754465952611,0.5868094780859936,,0.5567616463138851,0.5572139303482587,0.715281812899477,0.7156549520766773,0.8122535696173199,0.43956540045425163,0.08,0.5597426370796785,0.5358989305243724,0.5567616463138851,0.5572139303482587,1.0,1.0,oversample,0.5283716573550623,0.4951613759070348,0.6194149755763709,0.5,COMPLETE
2403,0.3235935455734845,2025-11-30 14:03:59.977998,2025-11-30 14:04:00.483572,0 days 00:00:00.505574,4.45120863971221,gbtree,0.30297866327135703,5.6928865492071,lossguide,10.892065186604881,0.0007431317832044452,9,7,2.6978167477626562,400,,0.5012681135731651,0.7395017403673931,0.028671962583024124,undersample,0.5806964479460253,,7.0,0.9151058566329157,,,,0.40530277818393423,,0.31614654002713705,0.29850746268656714,0.3516295025728988,0.3235935455734845,0.5012681135731651,0.7395017403673931,0.08,0.45468700496299275,0.4431433541160057,0.3723887375113533,0.34967012252591895,0.3330625507717303,0.30113636363636365,undersample,0.29289983255690577,0.2715035220142472,0.5806964479460253,0.5,COMPLETE
2404,0.7156549520766773,2025-11-30 14:04:01.301511,2025-11-30 14:05:25.068934,0 days 00:01:23.767423,0.10171948485981298,dart,0.6532984985479048,5.370332293031122,lossguide,5.425543075161119,0.25069531269712103,2,10,0.13574454422731982,800,tree,0.5334303374350029,0.6992062586588599,0.010119690363929224,none,0.6329970577266318,2.6697964652689516,8.0,0.6243758391964394,0.012729048881557292,uniform,0.5700950377360813,0.6417138316308391,,0.5567616463138851,0.5572139303482587,0.715281812899477,0.7156549520766773,0.5334303374350029,0.6992062586588599,0.08,0.5490907810323767,0.5431731329866856,0.5567616463138851,0.5572139303482587,1.0,1.0,none,0.4964049470316153,0.5011478881180107,0.6329970577266318,0.5,COMPLETE
2405,0.7156549520766773,2025-11-30 14:05:25.848109,2025-11-30 14:05:43.376206,0 days 00:00:17.528097,2.8366060590742443,dart,0.42591140131177774,9.222684176785776,lossguide,0.07869574482006425,0.0006049336149376658,4,6,4.2820542790616996,400,forest,0.9796731978279605,0.6604757243685053,0.09120944270224823,oversample,0.8831901056577782,,8.0,0.8975169001573617,0.4368065037468033,uniform,0.557726797789103,0.4839108812623205,,0.5567616463138851,0.5572139303482587,0.715281812899477,0.7156549520766773,0.9796731978279605,0.6604757243685053,0.1,0.5115580739333714,0.5052824493180491,0.5567616463138851,0.5572139303482587,1.0,1.0,oversample,0.43970307863194014,0.434817448894313,0.8831901056577782,0.5,COMPLETE
2406,0.7156549520766773,2025-11-30 14:05:44.164777,2025-11-30 14:06:05.015956,0 days 00:00:20.851179,64.97075399830273,dart,0.24394383589510396,4.36388290533235,depthwise,14.932243550275206,0.00019552228306837508,2,11,2.6779352498114832,400,tree,0.790073978089965,0.2777058609900707,0.03451355894440416,oversample,0.6969232273589003,,11.0,0.9138984006431852,0.18852196851040115,uniform,0.7998278864750575,0.9629009901987937,,0.5567616463138851,0.5572139303482587,0.715281812899477,0.7156549520766773,0.790073978089965,0.2777058609900707,0.08,0.5567616463138851,0.5572139303482587,0.5567616463138851,0.5572139303482587,1.0,1.0,oversample,0.5,0.5,0.6969232273589003,0.5,COMPLETE
2407,0.7156549520766773,2025-11-30 14:06:05.813893,2025-11-30 14:06:06.516019,0 days 00:00:00.702126,21.538117729726146,gbtree,0.5439932684225958,7.989117043909168,lossguide,42.40108658907386,0.06463582586525445,2,4,12.073539677586721,700,,0.8504000659107918,0.27331816168176326,0.02431181226616246,oversample,0.8826010347338565,,6.0,0.8945689389978022,,,,0.9163233733934955,,0.5567616463138851,0.5572139303482587,0.715281812899477,0.7156549520766773,0.8504000659107918,0.27331816168176326,0.08,0.5567616463138851,0.5572139303482587,0.5567616463138851,0.5572139303482587,1.0,1.0,oversample,0.5,0.5,0.8826010347338565,0.5,COMPLETE
2408,0.43410178338408,2025-11-30 14:06:07.301108,2025-11-30 14:10:19.082692,0 days 00:04:11.781584,0.34382977166858414,dart,0.909999115370377,7.088992140956821,lossguide,0.12633120738445425,0.13969803386209104,7,6,9.774850059772389,800,tree,0.9265349030930622,0.6865873953835586,0.009962278082764398,undersample,0.9698423045745626,,6.0,0.6162412215092833,0.44419693125491144,weighted,0.6696403264224402,0.3310364756674954,,0.431026684758028,0.41157847127996383,0.4520905923344948,0.43410178338408,0.9265349030930622,0.6865873953835586,0.08,0.47366688589069195,0.4691818591309294,0.48732394366197185,0.4676663542642924,0.421608448415922,0.4050324675324675,undersample,0.39826257066595927,0.39076947057028777,0.9698423045745626,0.5,COMPLETE
2409,0.7156549520766773,2025-11-30 14:10:19.908268,2025-11-30 14:11:54.635833,0 days 00:01:34.727565,31.38667642468785,dart,0.5329610289189541,6.982985901212432,lossguide,23.24450047566924,0.0005837158723118852,10,10,1.7799964403493227,900,tree,0.8804548641753038,0.46361632220575194,0.028128818267820255,oversample,0.7780779188226875,,11.0,0.6602872540918302,0.2490273850600983,weighted,0.48385286678886746,0.6037065302152558,,0.5567616463138851,0.5572139303482587,0.715281812899477,0.7156549520766773,0.8804548641753038,0.46361632220575194,0.08,0.5567616463138851,0.5572139303482587,0.5567616463138851,0.5572139303482587,1.0,1.0,oversample,0.5,0.5,0.7780779188226875,0.5,COMPLETE
2410,0.5580603998298597,2025-11-30 14:11:55.450230,2025-11-30 14:11:56.100732,0 days 00:00:00.650502,2.228716374233053,gbtree,0.44452955352439383,4.989599042284931,lossguide,0.009320054101713684,0.00039335313971468897,9,3,0.24958532088466814,600,,0.6294983236991007,0.25107788854384117,0.05616771527188963,undersample,0.7463573769162017,,9.0,0.6738217712636616,,,,0.28654179790959367,,0.5042966983265491,0.5300768882858435,0.535593220338983,0.5580603998298597,0.6294983236991007,0.25107788854384117,0.08,0.5380112215715698,0.5563658793002735,0.5597874224977857,0.5862377122430742,0.5134037367993501,0.5324675324675324,undersample,0.4951462225832657,0.525378318055795,0.7463573769162017,0.5,COMPLETE
2411,0.0,2025-11-30 14:11:56.924760,2025-11-30 14:11:57.375673,0 days 00:00:00.450913,0.15613016456010004,gbtree,0.31137102549224727,2.4587031031185713,depthwise,1.7470215471478312,0.00012498939889999514,8,7,9.12369156839734,200,,0.7715246206750332,0.683367696907583,0.03601892931921826,none,0.7855763510040594,0.6607484026780396,6.0,0.7626934969823496,,,,0.24333919290850448,,0.44323835368611486,0.4427860696517413,0.0,0.0,0.7715246206750332,0.683367696907583,0.08,0.47098582414218765,0.48434776938771884,0.0,0.0,0.0,0.0,none,0.37658532137469125,0.4001457556743563,0.7855763510040594,0.5,COMPLETE
2412,0.47674418604651164,2025-11-30 14:11:58.154925,2025-11-30 14:11:58.985545,0 days 00:00:00.830620,0.8291410964922113,gbtree,0.23346220559491826,5.144381148622968,depthwise,0.25023154870272185,0.003253368645504374,1,8,0.26607155122554266,900,,0.5709920416054943,0.2741055109656674,0.004413780818978985,undersample,0.6611089620633819,,10.0,0.8657075296242756,,,,0.764444015853337,,0.5210312075983717,0.5115332428765265,0.48716707021791766,0.47674418604651164,0.5709920416054943,0.2741055109656674,0.08,0.579007184396466,0.5769850464980617,0.6031175059952039,0.5913461538461539,0.40861088545897645,0.39935064935064934,undersample,0.5437834678956879,0.5304126096069406,0.6611089620633819,0.5,COMPLETE
2413,0.47872797593467986,2025-11-30 14:11:59.781584,2025-11-30 14:14:32.980126,0 days 00:02:33.198542,0.05561831768870662,dart,0.8146831486344679,0.5122786488890974,lossguide,0.10528584737079225,0.0012380677784485342,2,11,0.2510101551518013,1000,forest,0.6195875727595757,0.790744940553076,0.041330767238155756,undersample,0.6233691937533894,,8.0,0.846030789613648,0.18705116246522413,weighted,0.5186583284015337,0.8009106809277851,,0.48032564450474896,0.45137946630483944,0.5075010715816545,0.47872797593467986,0.6195875727595757,0.790744940553076,0.08,0.5306333645114663,0.5100079813678329,0.5372050816696915,0.508675799086758,0.4809098294069862,0.45211038961038963,undersample,0.4656397652480976,0.44304170038337554,0.6233691937533894,0.5,COMPLETE
2414,0.7156549520766773,2025-11-30 14:14:33.757802,2025-11-30 14:15:06.394440,0 days 00:00:32.636638,0.032576421737498154,dart,0.44040945398601716,5.499050733841443,lossguide,0.8737485612857799,0.0005130697537377331,10,7,31.751283496707057,500,forest,0.5072412583365986,0.4904705626331799,0.004489142321743723,none,0.9119444334350096,3.051578046739992,6.0,0.7909259721182043,0.04737335404061693,uniform,0.4058971997823189,0.2155019067019831,,0.5567616463138851,0.5572139303482587,0.715281812899477,0.7156549520766773,0.5072412583365986,0.4904705626331799,0.08,0.5198459429107398,0.5205780223309997,0.5567616463138851,0.5572139303482587,1.0,1.0,none,0.43193272434887847,0.43979909263361766,0.9119444334350096,0.5,COMPLETE
2415,0.5015184381778742,2025-11-30 14:15:07.176126,2025-11-30 14:15:09.085819,0 days 00:00:01.909693,0.002670544287791268,gbtree,0.8567497122524821,0.31468363242337705,depthwise,0.932987485324628,0.02319004168316209,8,9,1.465596027622871,300,,0.9512555262931419,0.829180698720192,0.06118398498689395,undersample,0.7353446052829602,,9.0,0.8654997559518504,,,,0.31994047296484207,,0.4577114427860697,0.48032564450474896,0.4743533537921964,0.5015184381778742,0.9512555262931419,0.829180698720192,0.08,0.5199320432665715,0.5242332162546202,0.5152380952380953,0.5386766076421249,0.4394800974817222,0.46915584415584416,undersample,0.44811833750559527,0.4595167345422708,0.7353446052829602,0.5,COMPLETE
2416,0.7156549520766773,2025-11-30 14:15:09.882879,2025-11-30 14:15:13.561849,0 days 00:00:03.678970,7.150288580898529,gbtree,0.5236556004274047,1.9452715158150224,lossguide,31.63621289674396,0.08158670763546207,4,11,0.11924579374601686,1000,,0.6305718717388967,0.6089618660113757,0.03008623131749587,none,0.649435289054459,1.501542873783947,9.0,0.6976470201199682,,,,0.876927697928126,,0.5567616463138851,0.5572139303482587,0.715281812899477,0.7156549520766773,0.6305718717388967,0.6089618660113757,0.08,0.5986423060379984,0.597164159245732,0.5567616463138851,0.5572139303482587,1.0,1.0,none,0.5570164458959864,0.5464192026053619,0.649435289054459,0.5,COMPLETE
2417,0.5401993355481728,2025-11-30 14:15:14.351129,2025-11-30 14:15:15.136133,0 days 00:00:00.785004,26.613050970137145,gbtree,0.9947345184895882,4.021777318327482,depthwise,4.139272505935889,0.0006548455821820517,6,9,0.7667952171134684,900,,0.6146013368685629,0.6696583290122236,0.004932154355627438,undersample,0.7292666736302658,,12.0,0.693668920897009,,,,0.21962588439939268,,0.3808231569425599,0.37403889642695615,0.5441225441225441,0.5401993355481728,0.6146013368685629,0.6696583290122236,0.08,0.4783097769576698,0.47290990702403124,0.46106094808126413,0.45725534308211474,0.6636880584890333,0.6599025974025974,undersample,0.30791375851721675,0.2846944934534312,0.7292666736302658,0.5,COMPLETE
2418,0.7156549520766773,2025-11-30 14:15:15.917186,2025-11-30 14:15:21.147554,0 days 00:00:05.230368,0.0058649501973597985,dart,0.9280084544387686,8.613083900711784,lossguide,0.0005540524273058285,0.0003526624543953449,2,10,0.449938980302801,200,forest,0.5073086500028771,0.43225358435289396,0.02007201402481327,oversample,0.7042676376984172,,6.0,0.923519179256405,0.14440447327524897,uniform,0.40055403369044323,0.4959257866863797,,0.5567616463138851,0.5572139303482587,0.715281812899477,0.7156549520766773,0.5073086500028771,0.43225358435289396,0.08,0.501503607617093,0.5070173099199414,0.5567616463138851,0.5572139303482587,1.0,1.0,oversample,0.3740769906662909,0.3734653370123237,0.7042676376984172,0.5,COMPLETE
2419,0.4380378657487091,2025-11-30 14:15:21.969727,2025-11-30 14:15:22.885091,0 days 00:00:00.915364,0.0006402106191311107,gbtree,0.7031924755151653,5.673522449386201,depthwise,0.002137537181412545,0.001433482033470605,9,11,18.02343534484447,1000,,0.6807649479082716,0.44188879880015236,0.09145893784418926,undersample,0.5970392286636176,,10.0,0.7154499571964382,,,,0.3993958007618771,,0.4120307553143374,0.4093170511080959,0.44821731748726656,0.4380378657487091,0.6807649479082716,0.44188879880015236,0.1,0.48123157614056955,0.48504629201249766,0.4693333333333333,0.4661172161172161,0.4289195775792039,0.41314935064935066,undersample,0.4007244815066563,0.4030869857925527,0.5970392286636176,0.5,COMPLETE
2420,0.540445999125492,2025-11-30 14:15:23.717756,2025-11-30 14:15:24.452736,0 days 00:00:00.734980,0.0004234480962551584,gbtree,0.9418282332893815,4.113122512158963,lossguide,0.22750746198980276,0.2194685827144631,6,5,4.946887326390071,600,,0.7485085590723879,0.49606928278445556,0.055573283451850135,undersample,0.743430984548121,,6.0,0.9290293110786277,,,,0.2891474363517739,,0.5146992311171416,0.5246494798733605,0.5216228265715559,0.540445999125492,0.7485085590723879,0.49606928278445556,0.08,0.5845139632578578,0.5839834502045831,0.5780632411067194,0.5857819905213271,0.4752233956133225,0.5016233766233766,undersample,0.5151954608000795,0.518739304617752,0.743430984548121,0.5,COMPLETE
2421,0.5432409739714525,2025-11-30 14:15:25.234348,2025-11-30 14:15:30.576101,0 days 00:00:05.341753,0.010527854899264253,dart,0.7482944223098369,5.693634277517539,lossguide,0.0003449695857349712,0.15904420681562945,6,10,0.9924278537425198,200,forest,0.877671420065872,0.5671196088963856,0.027437673346499016,undersample,0.8248000312406047,,10.0,0.7698173855539006,0.46562731483080655,weighted,0.8290099709088208,0.39906515880840454,,0.519674355495251,0.5079149706015378,0.5534062237174096,0.5432409739714525,0.877671420065872,0.5671196088963856,0.08,0.56455905254217,0.5603686328080191,0.5736704446381866,0.5626086956521739,0.5345247766043867,0.5251623376623377,undersample,0.5142844708964007,0.5080712826499343,0.8248000312406047,0.5,COMPLETE
