number,value,datetime_start,datetime_complete,duration,params_alpha,params_booster,params_colsample_bytree,params_gamma,params_grow_policy,params_lambda,params_learning_rate,params_max_delta_step,params_max_depth,params_min_child_weight,params_n_estimators,params_normalize_type,params_params_feature_fraction,params_params_labeled_ratio,params_params_missing_rate,params_params_resampling,params_params_sample_rows,params_params_scale_pos_weight,params_params_selftrain_max_iter,params_params_selftrain_threshold,params_rate_drop,params_sample_type,params_skip_drop,params_subsample,params_user_attrs_decision_threshold,user_attrs_acc_test,user_attrs_acc_val,user_attrs_f1_test,user_attrs_f1_val,user_attrs_feature_fraction,user_attrs_labeled_ratio,user_attrs_missing_rate,user_attrs_pr_auc_test,user_attrs_pr_auc_val,user_attrs_prec_test,user_attrs_prec_val,user_attrs_rec_test,user_attrs_rec_val,user_attrs_resampling_strategy,user_attrs_roc_auc_test,user_attrs_roc_auc_val,user_attrs_sample_rows,user_attrs_user_attrs_decision_threshold,state
1356,0.7149084568439407,2025-11-27 02:52:49.047776,2025-11-27 02:52:49.681594,0 days 00:00:00.633818,0.1415584404447045,gbtree,0.49705536976442966,3.8344653307614234,lossguide,0.0006623738669105095,0.023661437947745913,0,5,0.4369016589092677,200,,0.8256591779122354,0.8992133261981418,0.07260929508503916,undersample,0.8926200586421897,,8.0,0.6859303386742978,,,,0.21414608141966107,0.41940455312664915,0.555857078245138,0.5563093622795116,0.7145348837209302,0.7149084568439407,0.8256591779122354,0.8992133261981418,0.08,0.4443542914727958,0.4476975388207507,0.5563603440470801,0.5568130375735627,0.9983753046303818,0.9983766233766234,undersample,0.32209792934232995,0.32644752464083415,0.8926200586421897,0.41940455312664915,COMPLETE
1357,0.7156549520766773,2025-11-27 02:52:49.856214,2025-11-27 02:54:06.787769,0 days 00:01:16.931555,0.12565014172273548,dart,0.4924043916497305,3.320965751166981,lossguide,5.647922474455052,0.0938065911519445,8,3,16.60206331267714,800,forest,0.7835426093553849,0.47060978594257596,0.028103346037991216,none,0.7433944487896975,1.3589103027925429,9.0,0.7554648854397301,0.10882526648786939,uniform,0.07906150076706664,0.5465690151247883,0.18115432463456313,0.5567616463138851,0.5572139303482587,0.715281812899477,0.7156549520766773,0.7835426093553849,0.47060978594257596,0.02,0.5880219785769989,0.5731818112429063,0.5567616463138851,0.5572139303482587,1.0,1.0,none,0.587847941776223,0.5539300140615258,0.7433944487896975,0.18115432463456313,COMPLETE
1358,0.7138572285542891,2025-11-27 02:54:06.971316,2025-11-27 02:54:08.570069,0 days 00:00:01.598753,0.03333566335556201,gbtree,0.9878986035275098,5.949482151592529,lossguide,1.7750109395547424,0.4415835386092992,10,8,8.12151745753867,500,,0.9377685801369636,0.6020728859476301,0.06291337232726843,oversample,0.6936134021751794,,6.0,0.6707198528340713,,,,0.6452231659483258,0.43408301997380544,0.5649027589326097,0.5685210312075983,0.7098914354644149,0.7138572285542891,0.9377685801369636,0.6020728859476301,0.05,0.5204229025488323,0.519353597153182,0.5645083932853717,0.566127497621313,0.9561332250203087,0.9659090909090909,oversample,0.4641572307233211,0.4579302528421528,0.6936134021751794,0.43408301997380544,COMPLETE
1359,0.7172205438066466,2025-11-27 02:54:08.754706,2025-11-27 02:54:09.580687,0 days 00:00:00.825981,0.2082634070999243,gbtree,0.7297742271979243,2.896248636178255,lossguide,5.463982163723973,0.08751133167145729,10,6,39.03347253883662,500,,0.8454980284015189,0.8439437674010094,0.0022247976571652204,oversample,0.5246767672652932,,9.0,0.7301290177731886,,,,0.4609153176100005,0.4630496489801891,0.5771144278606966,0.576662143826323,0.7186277460126392,0.7172205438066466,0.8454980284015189,0.8439437674010094,0.0,0.5830087645522628,0.5583177680135251,0.5707456978967496,0.5712223291626564,0.9699431356620634,0.963474025974026,oversample,0.5363865448697758,0.5083241579666503,0.5246767672652932,0.4630496489801891,COMPLETE
1360,0.7156549520766773,2025-11-27 02:54:09.765625,2025-11-27 02:54:11.271519,0 days 00:00:01.505894,0.059625157517599205,gbtree,0.674079820374714,0.3815436075521541,lossguide,0.03385370627490216,0.017147785516158944,7,3,26.734347966456912,1000,,0.9320866560328649,0.49484786389114493,0.03338469338455216,oversample,0.6088480447880604,,11.0,0.8048343012493951,,,,0.30784308774699504,0.3819708462964895,0.5567616463138851,0.5572139303482587,0.715281812899477,0.7156549520766773,0.9320866560328649,0.49484786389114493,0.02,0.5741533745375809,0.5611110944710543,0.5567616463138851,0.5572139303482587,1.0,1.0,oversample,0.5242324143304762,0.5245595823992146,0.6088480447880604,0.3819708462964895,COMPLETE
1361,0.455842997323818,2025-11-27 02:54:11.453632,2025-11-27 02:54:12.323994,0 days 00:00:00.870362,0.26212192393984707,gbtree,0.6311107744835299,1.0005022612694658,lossguide,0.04651448403434951,0.004041986876252706,7,10,63.87295224761333,500,,0.8585608254554858,0.26734298634553927,0.08801383473286392,oversample,0.7139063512457229,,8.0,0.7390389174557822,,,,0.7082912768107799,0.5694696793364127,0.4554500226142017,0.44821347806422435,0.47007042253521125,0.455842997323818,0.8585608254554858,0.26734298634553927,0.08,0.5045965262195027,0.5028902092154344,0.5129682997118156,0.505940594059406,0.4337936636880585,0.4147727272727273,oversample,0.4652136971766774,0.45682174694559774,0.7139063512457229,0.5694696793364127,COMPLETE
1362,0.7156549520766773,2025-11-27 02:54:12.520524,2025-11-27 02:54:15.868927,0 days 00:00:03.348403,0.5035193539295116,gbtree,0.6791872115583616,3.3828813017749524,lossguide,10.177744543262941,0.11062924716941328,7,10,4.214933831885867,700,,0.8281360935249875,0.91598851229459,0.0027003254400223583,oversample,0.514367200820533,,11.0,0.636863662526184,,,,0.45593241690581554,0.20303763897008886,0.5567616463138851,0.5572139303482587,0.715281812899477,0.7156549520766773,0.8281360935249875,0.91598851229459,0.0,0.5291748838727017,0.5291912582307311,0.5567616463138851,0.5572139303482587,1.0,1.0,oversample,0.5035440740065319,0.5044734058076754,0.514367200820533,0.20303763897008886,COMPLETE
1363,0.7165519305597127,2025-11-27 02:54:16.045708,2025-11-27 02:54:16.720418,0 days 00:00:00.674710,0.011427066958518946,gbtree,0.6227876445264828,3.507166157618027,lossguide,16.73031865974839,0.14129187817603697,9,6,11.58683141074302,300,,0.8260467830569119,0.7526079919209744,0.020016020559663103,oversample,0.5249115554972802,,10.0,0.7624007203989951,,,,0.32037113691409125,0.4717508661566139,0.5698778833107191,0.5716870194482134,0.7182222222222222,0.7165519305597127,0.8260467830569119,0.7526079919209744,0.02,0.4740299598850487,0.4729010116904449,0.5652985074626866,0.5675675675675675,0.9845653939886271,0.9715909090909091,oversample,0.4097701387622474,0.4102620119920937,0.5249115554972802,0.4717508661566139,COMPLETE
1364,0.7156549520766773,2025-11-27 02:54:16.915710,2025-11-27 02:54:17.587634,0 days 00:00:00.671924,0.0033959229167538066,gbtree,0.4433482180122976,2.9949746715205734,lossguide,9.625457495589881,0.019708013096812953,9,5,39.52177122309074,300,,0.8134045222258852,0.5825439118741912,0.040077518166474604,oversample,0.516257292765929,,10.0,0.7229104768543823,,,,0.6563841354048905,0.432552998448243,0.5567616463138851,0.5572139303482587,0.715281812899477,0.7156549520766773,0.8134045222258852,0.5825439118741912,0.05,0.5328685073132086,0.5601879266471054,0.5567616463138851,0.5572139303482587,1.0,1.0,oversample,0.41838641224158224,0.44183080071103564,0.516257292765929,0.432552998448243,COMPLETE
1365,0.6915061572466056,2025-11-27 02:54:17.780137,2025-11-27 02:54:18.760169,0 days 00:00:00.980032,0.7428637584825165,gbtree,0.5226087789579124,1.3676242269492787,lossguide,3.670728746741449,0.01140505791450608,4,12,1.9744452433258073,600,,0.7016641070963471,0.09314842932608738,0.08488126415216746,undersample,0.6431406467848069,,7.0,0.7862987557794813,,,,0.7866718124893707,0.3752535259842118,0.5658073270013568,0.5581184984170059,0.6977329974811083,0.6915061572466056,0.7016641070963471,0.09314842932608738,0.08,0.5239279318989805,0.49918540902518843,0.5696658097686376,0.5658914728682171,0.9000812347684809,0.8887987012987013,undersample,0.4740546096586482,0.45001484087924337,0.6431406467848069,0.3752535259842118,COMPLETE
1366,0.29475982532751094,2025-11-27 02:54:18.952613,2025-11-27 02:54:19.724117,0 days 00:00:00.771504,0.006685835898701082,gbtree,0.6737665941812254,1.6471018895323515,lossguide,60.47743014252745,0.1485854435502592,8,7,1.4341038095122978,400,,0.8892091294367065,0.723898146033758,0.008540256105513922,oversample,0.526487990086032,,10.0,0.7829659298743156,,,,0.37778532972864104,0.5950976486221362,0.4265038444142922,0.4156490275893261,0.30022075055187636,0.29475982532751094,0.8892091294367065,0.723898146033758,0.0,0.5039223805208806,0.4894740407634034,0.46815834767641995,0.45,0.22095857026807472,0.21915584415584416,oversample,0.4375399956895837,0.43123822678853324,0.526487990086032,0.5950976486221362,COMPLETE
1367,0.6893537308773026,2025-11-27 02:54:19.915188,2025-11-27 02:54:20.800803,0 days 00:00:00.885615,0.6361606419090287,gbtree,0.6427949177830818,6.866563487206417,lossguide,0.21900246672451357,0.03362751869288633,10,5,62.711819277007116,700,,0.86242393031768,0.9476941109798681,0.017562532183052502,oversample,0.5118435206801445,,9.0,0.7755419213049333,,,,0.5870105177605764,0.5373560207458083,0.55359565807327,0.5499773857982814,0.6930015552099533,0.6893537308773026,0.86242393031768,0.9476941109798681,0.02,0.5379993380191127,0.5599394888638152,0.561491935483871,0.5601217656012176,0.9049553208773355,0.8961038961038961,oversample,0.4950397055654106,0.5061228990621227,0.5118435206801445,0.5373560207458083,COMPLETE
1368,0.16164207825529187,2025-11-27 02:54:20.986516,2025-11-27 02:54:23.696611,0 days 00:00:02.710095,0.5161235838838939,gbtree,0.9911895457802651,3.962767728191098,lossguide,0.18813828423043796,0.14942217790667336,10,7,30.4981789997488,600,,0.9195351069066184,0.7805451482548559,0.0019499408594088295,undersample,0.5743595773865423,,10.0,0.6600631291928267,,,,0.4761728213425025,0.59006845533186,0.41971958389868835,0.4088647670737223,0.1822817080943276,0.16164207825529187,0.9195351069066184,0.7805451482548559,0.0,0.4946589337709839,0.4841452528518379,0.4230769230769231,0.3853211009174312,0.11616571892770106,0.10227272727272728,undersample,0.4210953430925579,0.4006506772083892,0.5743595773865423,0.59006845533186,COMPLETE
1369,0.7156549520766773,2025-11-27 02:54:23.883052,2025-11-27 02:54:24.783335,0 days 00:00:00.900283,0.02532875584445587,gbtree,0.7505976245148842,1.6279202272681181,lossguide,2.5486164558383706,0.008810661472617203,9,6,43.52305718226026,400,,0.9741924677466015,0.9030847303465667,0.0026347697076259226,oversample,0.5519734881211383,,9.0,0.8113354942344533,,,,0.4052784122278679,0.40785826599145847,0.5567616463138851,0.5572139303482587,0.715281812899477,0.7156549520766773,0.9741924677466015,0.9030847303465667,0.0,0.5210593680638362,0.524752714163396,0.5567616463138851,0.5572139303482587,1.0,1.0,oversample,0.4777412589731262,0.4872011925765757,0.5519734881211383,0.40785826599145847,COMPLETE
1370,0.7156549520766773,2025-11-27 02:54:24.977804,2025-11-27 02:54:25.571608,0 days 00:00:00.593804,0.35416781906414874,gbtree,0.40554280261030484,3.2163713352326844,lossguide,71.18207851949468,0.17053167082175874,5,5,4.0580115885140735,200,,0.9088831379204715,0.6470576838961883,0.030650092930456313,oversample,0.5472025583153096,,10.0,0.6706540081670684,,,,0.2971061219674047,0.44494314413868136,0.5567616463138851,0.5572139303482587,0.715281812899477,0.7156549520766773,0.9088831379204715,0.6470576838961883,0.02,0.4665377490403574,0.46803639816522913,0.5567616463138851,0.5572139303482587,1.0,1.0,oversample,0.34433594721397903,0.3511795597150551,0.5472025583153096,0.44494314413868136,COMPLETE
1371,0.7035993740219092,2025-11-27 02:54:25.755007,2025-11-27 02:54:27.497118,0 days 00:00:01.742111,0.008783371447699298,gbtree,0.6370627595260748,3.0764626307072036,lossguide,0.26131830397387,0.22144395222829838,10,4,19.650928910399195,300,,0.7268136136300379,0.5043207481207252,0.03181286908189626,oversample,0.525858886908573,,10.0,0.7418023812059428,,,,0.23958301629455764,0.42291547736032065,0.5811849841700588,0.5716870194482134,0.7067764407853071,0.7035993740219092,0.7268136136300379,0.5043207481207252,0.02,0.48845968471624224,0.47516697398131635,0.5791385573430202,0.5725929699439634,0.9065800162469537,0.9123376623376623,oversample,0.4399351779704571,0.4124748782882082,0.525858886908573,0.42291547736032065,COMPLETE
1372,0.12831241283124128,2025-11-27 02:54:27.678916,2025-11-27 02:54:28.288887,0 days 00:00:00.609971,0.019751683143391596,gbtree,0.7838772570482642,4.542322401742128,lossguide,1.145172444917736,0.05694695127943363,10,5,6.142092964986759,200,,0.8245039285569089,0.8156566333779075,0.017439217567677464,oversample,0.508676098133689,,9.0,0.7119090684687651,,,,0.40147327600633065,0.6132023014263613,0.4369063772048847,0.43464495703301675,0.13601665510062458,0.12831241283124128,0.8245039285569089,0.8156566333779075,0.02,0.5343368670906457,0.5318606371976068,0.4666666666666667,0.45544554455445546,0.07961007311129163,0.07467532467532467,oversample,0.494299888923888,0.4911203454359736,0.508676098133689,0.6132023014263613,COMPLETE
1373,0.7156549520766773,2025-11-27 02:54:28.474898,2025-11-27 02:54:29.123254,0 days 00:00:00.648356,65.64460098822475,gbtree,0.7515049608813573,4.19312025081077,lossguide,5.307641692969061,0.03377893535902322,8,7,36.99562680334407,300,,0.6958351597515207,0.7989129089514158,0.03173747319163561,oversample,0.5779753620303577,,8.0,0.7269653673265389,,,,0.5102897598657865,0.5240347543333835,0.5567616463138851,0.5572139303482587,0.715281812899477,0.7156549520766773,0.6958351597515207,0.7989129089514158,0.02,0.5567616463138851,0.5572139303482587,0.5567616463138851,0.5572139303482587,1.0,1.0,oversample,0.5,0.5,0.5779753620303577,0.5240347543333835,COMPLETE
1374,0.7268351383874849,2025-11-27 02:54:29.306172,2025-11-27 02:54:30.420694,0 days 00:00:01.114522,1.1808399353303969,gbtree,0.994539940705679,1.5127347514940424,lossguide,0.9640299672931688,0.03347462157920692,10,5,47.33967866442313,800,,0.8870660816291497,0.7039433832499673,0.01411293243456212,oversample,0.5013517600177987,,7.0,0.7255780574064422,,,,0.29389605752963055,0.47094890911655946,0.6006331976481231,0.5893260967887833,0.732505301423811,0.7268351383874849,0.8870660816291497,0.7039433832499673,0.02,0.6894075686080151,0.6817348033200785,0.5840579710144927,0.5774378585086042,0.9821283509341998,0.9805194805194806,oversample,0.6455544687411927,0.6322098483743019,0.5013517600177987,0.47094890911655946,COMPLETE
1375,0.6282478347768155,2025-11-27 02:54:30.609788,2025-11-27 02:55:02.249789,0 days 00:00:31.640001,0.12914161314756503,dart,0.6094568504459912,1.9890270027026329,depthwise,0.15258590714492481,0.010691063754389796,5,6,0.21958815035892149,500,tree,0.8130843123418875,0.5502148562476981,0.09372872234785838,undersample,0.5736520584965504,,8.0,0.8151429629112265,0.3254513478131513,uniform,0.6786112482931025,0.4780559872020843,0.4478778547861576,0.4794210764360018,0.49525101763907736,0.6133691635875042,0.6282478347768155,0.8130843123418875,0.5502148562476981,0.1,0.5502726983208484,0.5197615919755831,0.52290950744559,0.5327683615819209,0.7416734362307067,0.765422077922078,undersample,0.4574951507816774,0.442456356207633,0.5736520584965504,0.4478778547861576,COMPLETE
1376,0.7156549520766773,2025-11-27 02:55:02.431855,2025-11-27 02:55:03.753239,0 days 00:00:01.321384,1.1955491610661104,gbtree,0.8743803681241705,1.7317585654690084,lossguide,0.13023848198451296,0.005568874958377678,10,6,43.54756948261407,1000,,0.9120536792313761,0.7349820611962197,0.025347329190027006,oversample,0.520009230138756,,6.0,0.7556374079999039,,,,0.300191410595996,0.46704064805458223,0.5567616463138851,0.5572139303482587,0.715281812899477,0.7156549520766773,0.9120536792313761,0.7349820611962197,0.02,0.5612362404673205,0.5706070070211151,0.5567616463138851,0.5572139303482587,1.0,1.0,oversample,0.4936019330559194,0.4901921686587162,0.520009230138756,0.46704064805458223,COMPLETE
1377,0.7066227150134852,2025-11-27 02:55:03.938402,2025-11-27 02:55:06.780521,0 days 00:00:02.842119,0.7910097015945313,gbtree,0.6909417712178751,2.1202339322250214,lossguide,23.93530137609816,0.22808343591847804,10,5,29.70882087013199,500,,0.8290826480390604,0.9059452579023084,0.019046299564636014,oversample,0.6969399435182714,,10.0,0.7228924426041701,,,,0.439470205707175,0.42242431080045134,0.5608322026232474,0.5572139303482587,0.7081454764051698,0.7066227150134852,0.8290826480390604,0.9059452579023084,0.02,0.4999495180818024,0.4938130936779339,0.5620229007633588,0.5600950118764846,0.9569455727051178,0.9569805194805194,oversample,0.4434353188879126,0.4325602257803483,0.6969399435182714,0.42242431080045134,COMPLETE
1378,0.7178048019956346,2025-11-27 02:55:06.967884,2025-11-27 02:55:08.279518,0 days 00:00:01.311634,1.2840033957595263,gbtree,0.9085727038181247,0.6034640667924697,lossguide,1.64789868581012,0.047683204012533766,10,5,39.26043908877961,500,,0.9405604456697985,0.7290696320906482,0.014155682625005762,oversample,0.5095618769685102,,8.0,0.6409550943017172,,,,0.21838976601338872,0.5085288274902783,0.5988240615106287,0.5906829488919041,0.724619683328159,0.7178048019956346,0.9405604456697985,0.7290696320906482,0.02,0.6310057756617882,0.6197978883000541,0.58643216080402,0.5827848101265822,0.9480097481722177,0.9342532467532467,oversample,0.6063516470763772,0.5881830120849528,0.5095618769685102,0.5085288274902783,COMPLETE
1379,0.0,2025-11-27 02:55:08.472751,2025-11-27 02:55:09.443852,0 days 00:00:00.971101,13.128281698741574,gbtree,0.8490073992100923,2.5377411019046483,lossguide,6.155834422831924,0.08500040413125538,6,6,10.358235658384386,500,,0.9439322183990537,0.8757911449822001,0.017784216418736367,oversample,0.519348555993209,,7.0,0.6320815555324312,,,,0.35769074917152277,0.6539527339333377,0.44323835368611486,0.4427860696517413,0.0,0.0,0.9439322183990537,0.8757911449822001,0.02,0.4628357484618232,0.44817177432935684,0.0,0.0,0.0,0.0,oversample,0.39318581209900694,0.36103713702028306,0.519348555993209,0.6539527339333377,COMPLETE
1380,0.40454076367389064,2025-11-27 02:55:09.638073,2025-11-27 02:55:18.081270,0 days 00:00:08.443197,2.2078904302066404,gbtree,0.9141034302712728,0.1491371960081574,lossguide,6.055571878967325,0.3678885463877853,9,5,11.449612549734676,700,,0.7756547160136061,0.723631932597144,0.025604809987244008,none,0.5208216703323133,2.0492419834150337,10.0,0.6458526401534089,,,,0.322127715263509,0.8737480668101532,0.4685662596110357,0.47806422433288104,0.40446021287379624,0.40454076367389064,0.7756547160136061,0.723631932597144,0.02,0.5502034988154719,0.5561499108596376,0.5377358490566038,0.5552407932011332,0.3241267262388302,0.3181818181818182,none,0.5071494885525291,0.5267318228247748,0.5208216703323133,0.8737480668101532,COMPLETE
1381,0.7156549520766773,2025-11-27 02:55:18.267900,2025-11-27 02:55:19.107654,0 days 00:00:00.839754,11.278349246196134,gbtree,0.9762969284270626,2.0624057957916175,depthwise,5.392721340115816,0.049295029074086304,9,5,33.10859846386886,500,,0.9352995474995066,0.805265873662204,0.007352303301027834,oversample,0.5436200443873135,,8.0,0.7076002619953146,,,,0.47776033751754604,0.22500012581118184,0.5567616463138851,0.5572139303482587,0.715281812899477,0.7156549520766773,0.9352995474995066,0.805265873662204,0.0,0.5230121495042558,0.5097560148426541,0.5567616463138851,0.5572139303482587,1.0,1.0,oversample,0.4541446310449444,0.43143099239881677,0.5436200443873135,0.22500012581118184,COMPLETE
1382,0.4399624765478424,2025-11-27 02:55:19.305648,2025-11-27 02:55:22.836749,0 days 00:00:03.531101,1.6535755146551792,gbtree,0.9239129453575644,0.05879325034123728,lossguide,0.26060426383308116,0.13225893349722814,9,4,16.56278995332167,400,,0.9091534388292976,0.7326687788881595,0.0012629914414065135,oversample,0.7451579378188702,,8.0,0.6373624619712187,,,,0.27206303802946336,0.659929107648355,0.4445952057892356,0.4599728629579376,0.4218455743879473,0.4399624765478424,0.9091534388292976,0.7326687788881595,0.0,0.5048342844791089,0.5213970250943236,0.5016797312430011,0.5211111111111111,0.36393176279447603,0.3806818181818182,oversample,0.43264891659344484,0.45945703938553784,0.7451579378188702,0.659929107648355,COMPLETE
1383,0.7156549520766773,2025-11-27 02:55:23.022735,2025-11-27 02:55:26.660024,0 days 00:00:03.637289,0.15639642771927406,gbtree,0.8748578639890743,0.7523708613361719,lossguide,0.29095951803797176,0.07247678437943157,9,4,39.236684692072004,600,,0.9483191900571357,0.8168922329606204,0.020745382134523004,oversample,0.6109627527760803,,8.0,0.663840128609588,,,,0.26653302670360146,0.2228248843048084,0.5567616463138851,0.5572139303482587,0.715281812899477,0.7156549520766773,0.9483191900571357,0.8168922329606204,0.02,0.5877582303065302,0.5913386087527425,0.5567616463138851,0.5572139303482587,1.0,1.0,oversample,0.552568427858552,0.5736244411870051,0.6109627527760803,0.2228248843048084,COMPLETE
1384,0.6783302639656231,2025-11-27 02:55:26.841618,2025-11-27 02:55:27.805585,0 days 00:00:00.963967,0.10623480745097626,gbtree,0.9521397908335405,4.382601504973966,depthwise,0.01147980718561767,0.053702525918581115,10,5,67.848059761253,800,,0.8797827236327792,0.7025584650433446,0.010341486016375615,oversample,0.5664002899798424,,6.0,0.7620733035565928,,,,0.305379368117506,0.49405744045416305,0.5382180009045681,0.5260063319764813,0.6869058570990494,0.6783302639656231,0.8797827236327792,0.7025584650433446,0.02,0.46740567756593765,0.44801236979930265,0.5517241379310345,0.5454096742349457,0.9098294069861901,0.8969155844155844,oversample,0.36618975778776175,0.3192385053659313,0.5664002899798424,0.49405744045416305,COMPLETE
