number,value,datetime_start,datetime_complete,duration,params_alpha,params_booster,params_colsample_bytree,params_gamma,params_grow_policy,params_lambda,params_learning_rate,params_max_delta_step,params_max_depth,params_min_child_weight,params_n_estimators,params_normalize_type,params_params_feature_fraction,params_params_labeled_ratio,params_params_missing_rate,params_params_resampling,params_params_sample_rows,params_params_scale_pos_weight,params_params_selftrain_max_iter,params_params_selftrain_threshold,params_rate_drop,params_sample_type,params_skip_drop,params_subsample,params_user_attrs_decision_threshold,user_attrs_acc_test,user_attrs_acc_val,user_attrs_f1_test,user_attrs_f1_val,user_attrs_feature_fraction,user_attrs_labeled_ratio,user_attrs_missing_rate,user_attrs_pr_auc_test,user_attrs_pr_auc_val,user_attrs_prec_test,user_attrs_prec_val,user_attrs_rec_test,user_attrs_rec_val,user_attrs_resampling_strategy,user_attrs_roc_auc_test,user_attrs_roc_auc_val,user_attrs_sample_rows,user_attrs_user_attrs_decision_threshold,state
2212,0.7083202511773941,2025-11-30 12:46:47.613110,2025-11-30 12:46:48.908556,0 days 00:00:01.295446,0.008860030810174252,gbtree,0.5467452409374767,1.608262682766265,lossguide,31.605377043075546,0.00817436501395651,10,12,0.5850047772546415,900,,0.8574881648130783,0.7290932157697934,0.09571382224472132,oversample,0.8183873386140335,,12.0,0.7166025355719576,,,,0.5976029847064528,,0.5902306648575305,0.5798281320669381,0.7184586699813549,0.7083202511773941,0.8574881648130783,0.7290932157697934,0.1,0.5631598727693329,0.5616440396001052,0.5817815802717665,0.5775729646697388,0.9390739236393176,0.9155844155844156,oversample,0.5472206104212602,0.5428312749558919,0.8183873386140335,0.5,COMPLETE
2213,0.27235772357723576,2025-11-30 12:46:49.672404,2025-11-30 12:47:35.884612,0 days 00:00:46.212208,8.20938445615098,dart,0.47706212006867593,4.518468315175906,lossguide,0.00039996685645853064,0.0012366515058157659,8,8,52.90259001829761,600,tree,0.9222829298692479,0.5165548493592902,0.05994131178177925,undersample,0.74821997366802,,11.0,0.833428950855957,0.07591913693078772,uniform,0.7571286576270405,0.9723631166006304,,0.3613749434644957,0.352329262777024,0.29187562688064195,0.27235772357723576,0.9222829298692479,0.5165548493592902,0.08,0.4751017335284798,0.4675299668210212,0.381389252948886,0.3641304347826087,0.23639317627944761,0.21753246753246752,undersample,0.32913053929939157,0.3127292459838425,0.74821997366802,0.5,COMPLETE
2214,0.17752596789423986,2025-11-30 12:47:36.624615,2025-11-30 12:48:37.062013,0 days 00:01:00.437398,0.00022182065219765522,dart,0.5961796461615365,3.278882195041742,lossguide,67.89487047370646,0.23036345534517585,0,11,51.672149095359856,700,tree,0.5396232950116313,0.5273599474033701,0.03384508981600203,none,0.7075015135738412,0.7902832924718036,5.0,0.8958913770780568,0.27685707879513716,weighted,0.7690188976864624,0.6931221547457339,,0.22478516508367255,0.21212121212121213,0.2064814814814815,0.17752596789423986,0.5396232950116313,0.5273599474033701,0.08,0.524272058315984,0.5243891510497533,0.24004305705059203,0.21218961625282168,0.18115353371242893,0.1525974025974026,none,0.23687809811170613,0.2250868067070825,0.7075015135738412,0.5,COMPLETE
2215,0.7156549520766773,2025-11-30 12:48:37.828006,2025-11-30 12:48:38.640929,0 days 00:00:00.812923,64.14200047796851,gbtree,0.6232776486952363,5.419484409878162,depthwise,4.463482626222435,0.03704463027307958,8,6,1.575203541721064,900,,0.6904420302141812,0.20270653896871432,0.059540328313628016,oversample,0.9916356594220654,,8.0,0.8949390160963746,,,,0.3079099580529655,,0.5567616463138851,0.5572139303482587,0.715281812899477,0.7156549520766773,0.6904420302141812,0.20270653896871432,0.08,0.5567616463138851,0.5572139303482587,0.5567616463138851,0.5572139303482587,1.0,1.0,oversample,0.5,0.5,0.9916356594220654,0.5,COMPLETE
2216,0.699489642749925,2025-11-30 12:48:39.423518,2025-11-30 12:48:44.844725,0 days 00:00:05.421207,0.0003090491763599842,gbtree,0.45737953594158154,1.3020496221070255,depthwise,0.18724114927249244,0.0014571974750096218,9,9,0.8129583820619384,600,,0.8745182484813164,0.655916607167907,0.093054657416206,none,0.5947652150453805,0.9265912435486882,8.0,0.6219577789612695,,,,0.5574877273827511,,0.5418362731795567,0.5472636815920398,0.6953383458646617,0.699489642749925,0.8745182484813164,0.655916607167907,0.1,0.537931665754883,0.5385365743084718,0.5520534861509073,0.5550262029537876,0.9390739236393176,0.9456168831168831,none,0.5022144763673138,0.5085231418224267,0.5947652150453805,0.5,COMPLETE
2217,0.0,2025-11-30 12:48:45.624491,2025-11-30 12:48:46.368374,0 days 00:00:00.743883,4.124336611224423,gbtree,0.7834776079439698,9.475721682300842,depthwise,0.1674661481844844,0.16095282332139138,0,4,3.215846348144641,800,,0.9431826640470997,0.6675598172790941,0.04124804579304489,none,0.71627285457899,0.5451720939305995,7.0,0.7478553255447132,,,,0.977691116739372,,0.44323835368611486,0.4427860696517413,0.0,0.0,0.9431826640470997,0.6675598172790941,0.08,0.5567616463138851,0.5572139303482587,0.0,0.0,0.0,0.0,none,0.5,0.5,0.71627285457899,0.5,COMPLETE
2218,0.707395498392283,2025-11-30 12:48:47.155435,2025-11-30 12:49:15.623523,0 days 00:00:28.468088,0.0001804820262592698,dart,0.4909620526615224,6.499003572033311,lossguide,0.03438215983607695,0.22601219163058006,1,10,0.7708229527852537,500,tree,0.5983639229544269,0.5990026757352218,0.02523693137024965,oversample,0.7887703553609196,,8.0,0.7872324361231942,0.3140848288652279,weighted,0.47384672886836954,0.6923461383885262,,0.5427408412483039,0.5472636815920398,0.7030837004405286,0.707395498392283,0.5983639229544269,0.5990026757352218,0.08,0.5246160383136967,0.5132520874362554,0.5505979760809567,0.5527638190954773,0.9723801787164906,0.9821428571428571,oversample,0.4467410766093602,0.44014980167942375,0.7887703553609196,0.5,COMPLETE
2219,0.0,2025-11-30 12:49:16.359311,2025-11-30 12:49:17.116201,0 days 00:00:00.756890,0.00010637700536566547,gbtree,0.4059142202646706,4.991818345516955,lossguide,0.04865030620016435,0.00014477800919744996,10,8,1.9234601240771905,800,,0.9181973211473468,0.5168469125477175,0.0013741593071443293,none,0.514720141683014,0.6339262782279557,6.0,0.6435355433243594,,,,0.7219430870282018,,0.44323835368611486,0.4427860696517413,0.0,0.0,0.9181973211473468,0.5168469125477175,0.08,0.5434660067473966,0.5356542357567443,0.0,0.0,0.0,0.0,none,0.48627298197914426,0.4635880271413979,0.514720141683014,0.5,COMPLETE
2220,0.4366319444444444,2025-11-30 12:49:17.850109,2025-11-30 12:49:18.305645,0 days 00:00:00.455536,3.710032192376277,gbtree,0.31891327306203315,1.5876824849159765,depthwise,0.0007238814854005704,0.00013172630295021706,8,9,0.21421005142989893,200,,0.9628173679427521,0.42822877663270664,0.0879643396240148,undersample,0.743872925334744,,5.0,0.7787740633680597,,,,0.2747563647068383,,0.38444142921754865,0.4129353233830846,0.4120950323974082,0.4366319444444444,0.9628173679427521,0.42822877663270664,0.08,0.45787519741338134,0.4625523202685874,0.44003690036900367,0.46921641791044777,0.3874898456539399,0.4082792207792208,undersample,0.34075747276977403,0.3548313280182535,0.743872925334744,0.5,COMPLETE
2221,0.7059516794342958,2025-11-30 12:49:19.047132,2025-11-30 12:49:21.022985,0 days 00:00:01.975853,0.042742556452966964,gbtree,0.9622556096960515,1.7047921327901827,depthwise,6.474750243516374,0.001119692352467977,8,9,0.6063533309693991,1000,,0.8901797953536619,0.5958911860742748,0.06721637765313697,oversample,0.5600633719787838,,8.0,0.860936622877026,,,,0.42155648915180105,,0.5463591135232926,0.5486205336951605,0.7042170451194338,0.7059516794342958,0.8901797953536619,0.5958911860742748,0.08,0.6165877620684772,0.6082351523997123,0.5527777777777778,0.5541165587419057,0.9699431356620634,0.9724025974025974,oversample,0.5806528622821997,0.5660875130997705,0.5600633719787838,0.5,COMPLETE
2222,0.7156549520766773,2025-11-30 12:49:21.813248,2025-11-30 12:49:22.557854,0 days 00:00:00.744606,0.0020246412285032014,gbtree,0.7340960551074545,8.912940059690603,lossguide,0.45308723157957254,0.005001661871947791,8,4,10.006072118584957,800,,0.8520757554363863,0.7648120194987296,0.08588012394980443,oversample,0.7612646789587691,,9.0,0.677732557810896,,,,0.579244524692679,,0.5567616463138851,0.5572139303482587,0.715281812899477,0.7156549520766773,0.8520757554363863,0.7648120194987296,0.08,0.6461016033160893,0.6485631559122251,0.5567616463138851,0.5572139303482587,1.0,1.0,oversample,0.6281553076145161,0.6213076058262472,0.7612646789587691,0.5,COMPLETE
2223,0.7156549520766773,2025-11-30 12:49:23.368421,2025-11-30 12:50:00.465568,0 days 00:00:37.097147,49.00733632050058,dart,0.3360776097487925,7.988822867835662,depthwise,0.00023510756890375166,0.019263841336709105,4,9,16.19225975909244,600,tree,0.5017553480222625,0.3365385001293044,0.07900794282391058,oversample,0.8774356442559783,,11.0,0.8964980015228875,0.2999572572343436,uniform,0.2035775353065948,0.5251559299207084,,0.5567616463138851,0.5572139303482587,0.715281812899477,0.7156549520766773,0.5017553480222625,0.3365385001293044,0.08,0.5567616463138851,0.5572139303482587,0.5567616463138851,0.5572139303482587,1.0,1.0,oversample,0.5,0.5,0.8774356442559783,0.5,COMPLETE
2224,0.7156549520766773,2025-11-30 12:50:01.255960,2025-11-30 12:50:06.556436,0 days 00:00:05.300476,0.7039197717183696,dart,0.786965121786072,6.148152219392081,lossguide,0.00024204358294314227,0.0003956541258740325,6,8,36.33766703240208,200,forest,0.5936332631301489,0.4279215393929331,0.00841018432522711,oversample,0.7049216808459207,,9.0,0.8859686675383296,0.3156759320242684,weighted,0.7156459176268843,0.9137585688740282,,0.5567616463138851,0.5572139303482587,0.715281812899477,0.7156549520766773,0.5936332631301489,0.4279215393929331,0.08,0.612531721348164,0.6290262860400503,0.5567616463138851,0.5572139303482587,1.0,1.0,oversample,0.5832316517183641,0.5915620066858576,0.7049216808459207,0.5,COMPLETE
2225,0.32172470978441126,2025-11-30 12:50:07.372908,2025-11-30 12:50:38.406221,0 days 00:00:31.033313,0.24630438668449406,dart,0.6155750887491109,3.4607207433010077,depthwise,26.31891001863904,0.013723491947266502,1,11,1.64439612574413,500,tree,0.9213856776727634,0.5899894640611321,0.03075943841177005,undersample,0.6664154774823974,,12.0,0.805683424309521,0.3446546268910618,weighted,0.702939246952171,0.4013708515239642,,0.2799638172772501,0.2600633197648123,0.35337124289195776,0.32172470978441126,0.9213856776727634,0.5899894640611321,0.08,0.3864034255080688,0.3816691709753107,0.35337124289195776,0.3288135593220339,0.35337124289195776,0.31493506493506496,undersample,0.17945174820537477,0.16104219452661742,0.6664154774823974,0.5,COMPLETE
2226,0.7156549520766773,2025-11-30 12:50:39.185797,2025-11-30 12:50:57.012749,0 days 00:00:17.826952,35.127400127118015,dart,0.8540981753415364,0.5303920645675886,lossguide,0.036039314440401655,0.013956395233336064,8,7,15.261208425758486,400,tree,0.5009806409540443,0.4323797634496216,0.03814602801848396,none,0.8213048493226502,4.349519298400508,8.0,0.8933719493392775,0.3106771185459709,weighted,0.39883739630215637,0.5700742193679096,,0.5567616463138851,0.5572139303482587,0.715281812899477,0.7156549520766773,0.5009806409540443,0.4323797634496216,0.08,0.682876262056558,0.6945098251440069,0.5567616463138851,0.5572139303482587,1.0,1.0,none,0.6500866227888393,0.6502659750872213,0.8213048493226502,0.5,COMPLETE
2227,0.7156549520766773,2025-11-30 12:50:57.808348,2025-11-30 12:51:25.080994,0 days 00:00:27.272646,0.00039172706612992415,dart,0.7262101501034872,9.24162029492106,depthwise,57.28456092994194,0.0009634457766685659,3,6,0.8692334219593663,500,forest,0.8999285876609139,0.8045024049003782,0.052733238483650906,oversample,0.9493129774589538,,5.0,0.679080737992415,0.37305143504631416,weighted,0.4462261460884462,0.7883311062953171,,0.5567616463138851,0.5572139303482587,0.715281812899477,0.7156549520766773,0.8999285876609139,0.8045024049003782,0.08,0.44211276237247066,0.44965880730698826,0.5567616463138851,0.5572139303482587,1.0,1.0,oversample,0.2745739319285797,0.2824691906663306,0.9493129774589538,0.5,COMPLETE
2228,0.46255506607929514,2025-11-30 12:51:25.851912,2025-11-30 12:53:31.609052,0 days 00:02:05.757140,19.25809458651443,dart,0.6741665952588154,2.7528778539056553,lossguide,0.1684635177694408,0.023720724248424113,5,8,0.21689202250850223,1000,forest,0.50104193938179,0.6908501966359748,0.012230210793411845,undersample,0.9362762950859943,,7.0,0.6675775008171958,0.08013521435208831,uniform,0.305073875118684,0.5873117825525288,,0.42469470827679784,0.44821347806422435,0.43416370106761565,0.46255506607929514,0.50104193938179,0.6908501966359748,0.08,0.49782711243470035,0.5186635665010998,0.47984267453294,0.5057803468208093,0.39642567018683994,0.42613636363636365,undersample,0.43739037450886126,0.45753352877969833,0.9362762950859943,0.5,COMPLETE
2229,0.40436241610738255,2025-11-30 12:53:32.340804,2025-11-30 12:53:33.548845,0 days 00:00:01.208041,0.009683950368627637,gbtree,0.5866850363662675,9.400753783706342,lossguide,0.2686826245583519,0.3790728874855168,5,4,15.154885167423927,300,,0.6845904720496147,0.6703112199247507,0.0814190702784407,undersample,0.5974251731392617,,9.0,0.648547977837287,,,,0.3311414801185116,,0.37630031659882407,0.357756671189507,0.4099272571673085,0.40436241610738255,0.6845904720496147,0.6703112199247507,0.08,0.4428284964484165,0.4352113000700163,0.43309222423146476,0.4184027777777778,0.3891145410235581,0.3912337662337662,undersample,0.32482551103300783,0.3037032553758805,0.5974251731392617,0.5,COMPLETE
2230,0.1654501216545012,2025-11-30 12:53:34.289806,2025-11-30 12:54:13.789396,0 days 00:00:39.499590,0.45349839116019913,dart,0.36171633566916334,7.9895401755886555,depthwise,0.003393516548753896,0.0003465913125095741,7,3,0.6711597759380583,600,forest,0.9710832410225787,0.42712703686895404,0.09202589125636922,undersample,0.5991896182955235,,6.0,0.8063727970794712,0.22455010128587594,uniform,0.25161772624725787,0.2627053517615511,,0.3776571687019448,0.37946630483943916,0.1558282208588957,0.1654501216545012,0.9710832410225787,0.42712703686895404,0.1,0.4191167082456893,0.42161732015178843,0.3182957393483709,0.3300970873786408,0.10316815597075549,0.11038961038961038,undersample,0.25585636366650644,0.26384139991775335,0.5991896182955235,0.5,COMPLETE
2231,0.7231772377000593,2025-11-30 12:54:14.538392,2025-11-30 12:55:26.356140,0 days 00:01:11.817748,0.00015046763916072776,dart,0.9772247426772371,2.985567448977707,lossguide,0.010990098973945579,0.04004894212966448,4,8,37.778482948319294,800,tree,0.6346954151722459,0.6311521301697891,0.06760677570305994,oversample,0.6584213047534799,,11.0,0.896019694893435,0.37373678924133324,weighted,0.14508744503595394,0.6434094502923356,,0.5798281320669381,0.5775667118950701,0.7249037607343797,0.7231772377000593,0.6346954151722459,0.6311521301697891,0.08,0.6161250677985413,0.6259558114466599,0.570363466915191,0.5695611577964519,0.9943135662063363,0.9902597402597403,oversample,0.6095044679122665,0.6149596062772774,0.6584213047534799,0.5,COMPLETE
2232,0.7156549520766773,2025-11-30 12:55:27.141690,2025-11-30 12:55:27.676883,0 days 00:00:00.535193,0.018508507437742707,gbtree,0.6554448265561221,5.208113899890296,depthwise,0.7978364463810337,0.00012661968570760847,9,4,0.818624862436866,400,,0.5671171024073829,0.7636043929001046,0.0503009832220081,oversample,0.6319335123113492,,8.0,0.612816710957154,,,,0.3634263379170891,,0.5567616463138851,0.5572139303482587,0.715281812899477,0.7156549520766773,0.5671171024073829,0.7636043929001046,0.08,0.5006437833479591,0.4964002408909859,0.5567616463138851,0.5572139303482587,1.0,1.0,oversample,0.4251463054758865,0.4211758619317353,0.6319335123113492,0.5,COMPLETE
2233,0.577023498694517,2025-11-30 12:55:28.454997,2025-11-30 12:55:30.679894,0 days 00:00:02.224897,0.00011772855757714751,gbtree,0.8815071433056587,2.877463221161809,depthwise,0.005757228878111527,0.16128749867095413,7,3,0.17099026318499588,700,,0.5994670021635424,0.2393984829935702,0.029865743427986702,undersample,0.5372650419865396,,6.0,0.605909324550152,,,,0.27521910441314273,,0.5545002261420172,0.5603799185888738,0.5500228414801279,0.577023498694517,0.5994670021635424,0.2393984829935702,0.08,0.60797267858595,0.5910236861765237,0.6283924843423799,0.6219512195121951,0.4890333062550772,0.5381493506493507,undersample,0.6114188729919262,0.6053532460899672,0.5372650419865396,0.5,COMPLETE
2234,0.7156549520766773,2025-11-30 12:55:31.476016,2025-11-30 12:55:32.334565,0 days 00:00:00.858549,0.0034990342450306757,gbtree,0.6505234827167796,7.76873739863259,depthwise,0.006377832779302867,0.1608216214405209,2,9,9.596279147487001,1000,,0.5458069254093765,0.3902473940382885,0.04099180412477171,none,0.7748625561207103,4.462403705682686,11.0,0.7212380524889395,,,,0.731539982151145,,0.5567616463138851,0.5572139303482587,0.715281812899477,0.7156549520766773,0.5458069254093765,0.3902473940382885,0.08,0.5401248042234088,0.5365151355657307,0.5567616463138851,0.5572139303482587,1.0,1.0,none,0.4614926474245262,0.46059414921136066,0.7748625561207103,0.5,COMPLETE
2235,0.7050746268656717,2025-11-30 12:55:33.143818,2025-11-30 12:55:34.074432,0 days 00:00:00.930614,0.003491096520736716,gbtree,0.45448508805687055,3.1219431437521825,depthwise,0.000260031783275559,0.006688356436861322,0,3,9.20561299222537,900,,0.660631368341271,0.6564479512384175,0.007811174585382919,oversample,0.9388063237933448,,5.0,0.765245952633085,,,,0.5870174179602206,,0.5477159656264133,0.5531433740388965,0.7020262216924911,0.7050746268656717,0.660631368341271,0.6564479512384175,0.08,0.461652435965393,0.4716540123887168,0.5543529411764706,0.5576015108593012,0.9569455727051178,0.9586038961038961,oversample,0.36182256005570385,0.3924828044784633,0.9388063237933448,0.5,COMPLETE
2236,0.2775644541963796,2025-11-30 12:55:34.870161,2025-11-30 12:55:35.736199,0 days 00:00:00.866038,0.01677901463806937,gbtree,0.5236201148747834,4.0032716873111776,depthwise,0.007888360387799451,0.0017990040862613077,5,10,0.5060824651472441,1000,,0.6907670553291299,0.24002795159030063,0.05912319467043519,undersample,0.7468669817353152,,12.0,0.8184634479607094,,,,0.9349715435662549,,0.41745816372682043,0.4043419267299864,0.3,0.2775644541963796,0.6907670553291299,0.24002795159030063,0.08,0.5534343501405852,0.5473203452530284,0.45320197044334976,0.428087986463621,0.22420796100731114,0.20535714285714285,undersample,0.48657636897163414,0.48804065571813277,0.7468669817353152,0.5,COMPLETE
2237,0.7156549520766773,2025-11-30 12:55:36.553444,2025-11-30 12:56:28.732493,0 days 00:00:52.179049,0.0013730419808761613,dart,0.393170440673278,6.662728323728844,depthwise,0.6733654824270104,0.00909310028542493,7,5,8.320254995642395,700,tree,0.5878245578561869,0.8970689106382912,0.09127592370115671,oversample,0.8932227513723858,,8.0,0.8300150266618049,0.39968170521035745,uniform,0.5076625683611413,0.36664846923065836,,0.5567616463138851,0.5572139303482587,0.715281812899477,0.7156549520766773,0.5878245578561869,0.8970689106382912,0.1,0.4677775244074849,0.46496802081885236,0.5567616463138851,0.5572139303482587,1.0,1.0,oversample,0.36614209453074487,0.35779660201902286,0.8932227513723858,0.5,COMPLETE
2238,0.7156549520766773,2025-11-30 12:56:29.538752,2025-11-30 12:56:30.428240,0 days 00:00:00.889488,20.186054670932855,gbtree,0.49221881184315414,7.3010997222506155,depthwise,0.007549960277031446,0.002287763305300078,7,10,16.89221793760346,1000,,0.6275780262030699,0.5089503359598773,0.007799663706111271,undersample,0.9986768405364883,,9.0,0.737849865157651,,,,0.3126119330938349,,0.5567616463138851,0.5572139303482587,0.715281812899477,0.7156549520766773,0.6275780262030699,0.5089503359598773,0.08,0.5264562177080571,0.5357122938746073,0.5567616463138851,0.5572139303482587,1.0,1.0,undersample,0.42882507999137914,0.4520875893769153,0.9986768405364883,0.5,COMPLETE
2239,0.7156549520766773,2025-11-30 12:56:31.238268,2025-11-30 12:57:41.452572,0 days 00:01:10.214304,0.0024594791294337663,dart,0.9693350863542427,8.73245118341751,lossguide,0.033679641959536454,0.0292639946607256,2,11,0.7317982925485124,900,tree,0.7981664718947905,0.35602499288459616,0.09624825097357576,none,0.7075604324838503,2.630627287306797,6.0,0.6874866421271224,0.43414019773100204,uniform,0.17507402415851295,0.3076778472063751,,0.5567616463138851,0.5572139303482587,0.715281812899477,0.7156549520766773,0.7981664718947905,0.35602499288459616,0.1,0.5084161848651114,0.518678718916059,0.5567616463138851,0.5572139303482587,1.0,1.0,none,0.4042540493045309,0.4109252915113487,0.7075604324838503,0.5,COMPLETE
2240,0.0,2025-11-30 12:57:42.226830,2025-11-30 12:57:42.742216,0 days 00:00:00.515386,0.26146574818035795,gbtree,0.4890400350179205,7.448249549157927,depthwise,0.0001341726582470343,0.01985686934475119,2,10,28.561988076261702,400,,0.5076144326851157,0.7445161772799664,0.009523193310604096,none,0.7664330293523327,0.7267607548327412,8.0,0.8550449564930545,,,,0.5507333814426674,,0.44323835368611486,0.4427860696517413,0.0,0.0,0.5076144326851157,0.7445161772799664,0.08,0.4624917403184268,0.4670789147500817,0.0,0.0,0.0,0.0,none,0.31960493376879595,0.33312799304883056,0.7664330293523327,0.5,COMPLETE
2241,0.7156549520766773,2025-11-30 12:57:43.554550,2025-11-30 13:00:21.439756,0 days 00:02:37.885206,0.00042226822710267933,dart,0.5584502856975149,5.206856333138149,depthwise,0.00011119813648262895,0.0001286349810624775,3,4,0.44378574616170113,900,forest,0.9704324522087189,0.24786266836311685,0.02309035777539016,none,0.8367465323517893,1.532228798502641,6.0,0.6545288465426263,0.18885796502949792,uniform,0.8263545582038817,0.7582911854933696,,0.5567616463138851,0.5572139303482587,0.715281812899477,0.7156549520766773,0.9704324522087189,0.24786266836311685,0.08,0.45433747434707095,0.44992451033963843,0.5567616463138851,0.5572139303482587,1.0,1.0,none,0.2834198179678045,0.25933939018081,0.8367465323517893,0.5,COMPLETE
