number,value,datetime_start,datetime_complete,duration,params_alpha,params_booster,params_colsample_bytree,params_gamma,params_grow_policy,params_lambda,params_learning_rate,params_max_delta_step,params_max_depth,params_min_child_weight,params_n_estimators,params_normalize_type,params_params_feature_fraction,params_params_labeled_ratio,params_params_missing_rate,params_params_resampling,params_params_sample_rows,params_params_scale_pos_weight,params_params_selftrain_max_iter,params_params_selftrain_threshold,params_rate_drop,params_sample_type,params_skip_drop,params_subsample,params_user_attrs_decision_threshold,user_attrs_acc_test,user_attrs_acc_val,user_attrs_f1_test,user_attrs_f1_val,user_attrs_feature_fraction,user_attrs_labeled_ratio,user_attrs_missing_rate,user_attrs_pr_auc_test,user_attrs_pr_auc_val,user_attrs_prec_test,user_attrs_prec_val,user_attrs_rec_test,user_attrs_rec_val,user_attrs_resampling_strategy,user_attrs_roc_auc_test,user_attrs_roc_auc_val,user_attrs_sample_rows,user_attrs_user_attrs_decision_threshold,state
2422,0.7156549520766773,2025-11-30 14:15:31.359190,2025-11-30 14:15:31.752740,0 days 00:00:00.393550,22.216418249353676,gbtree,0.8722279922857685,1.435767642427045,lossguide,39.716732257045344,0.1601866557863718,1,7,0.4415898318717288,200,,0.6139377619334984,0.320142683300058,0.005698035389492973,oversample,0.948696811299883,,12.0,0.7797289894224769,,,,0.41493942035637216,,0.5567616463138851,0.5572139303482587,0.715281812899477,0.7156549520766773,0.6139377619334984,0.320142683300058,0.08,0.5237598843185285,0.5457802610864011,0.5567616463138851,0.5572139303482587,1.0,1.0,oversample,0.44519720154511844,0.4748990156931934,0.948696811299883,0.5,COMPLETE
2423,0.45701357466063347,2025-11-30 14:15:32.551168,2025-11-30 14:15:52.828248,0 days 00:00:20.277080,0.15325664676627726,dart,0.8282541841369875,0.13063353996892513,lossguide,0.3173987025338284,0.033922393621573496,4,5,20.61664449779944,400,forest,0.9434768189287925,0.8012002130370659,0.08592833511096468,undersample,0.6365341397494626,,6.0,0.8008315079458749,0.2240258499965555,weighted,0.43705579671645256,0.5112058392665171,,0.451831750339213,0.45725915875169604,0.4399260628465804,0.45701357466063347,0.9434768189287925,0.8012002130370659,0.08,0.5002473064944106,0.5033045462278619,0.5101822079314041,0.516359918200409,0.3866774979691308,0.4099025974025974,undersample,0.45391377509574105,0.4616425454014831,0.6365341397494626,0.5,COMPLETE
2424,0.7156549520766773,2025-11-30 14:15:53.597195,2025-11-30 14:17:38.772112,0 days 00:01:45.174917,99.15474423593909,dart,0.905783985702729,9.13008726393362,depthwise,2.1586228326946744,0.00012114726828685519,0,3,2.4093935232133674,900,forest,0.6863172952556043,0.6415858885663694,0.09557053406766965,none,0.9579981851995869,4.583715949543613,7.0,0.7539013987102872,0.06541652080056509,weighted,0.7339337221018382,0.7018388802149207,,0.5567616463138851,0.5572139303482587,0.715281812899477,0.7156549520766773,0.6863172952556043,0.6415858885663694,0.1,0.5567616463138851,0.5572139303482587,0.5567616463138851,0.5572139303482587,1.0,1.0,none,0.5,0.5,0.9579981851995869,0.5,COMPLETE
2425,0.7156549520766773,2025-11-30 14:17:39.564472,2025-11-30 14:17:40.186538,0 days 00:00:00.622066,0.5638318677199027,gbtree,0.9347176854126913,9.946183206154915,depthwise,0.05709771815731122,0.00037596564092829185,10,3,4.19015771921362,600,,0.7082816910130978,0.5084042987610797,0.08857792618098893,oversample,0.7637448473864086,,8.0,0.9442384899972978,,,,0.8813539430419948,,0.5567616463138851,0.5572139303482587,0.715281812899477,0.7156549520766773,0.7082816910130978,0.5084042987610797,0.08,0.5567616463138851,0.5572139303482587,0.5567616463138851,0.5572139303482587,1.0,1.0,oversample,0.5,0.5,0.7637448473864086,0.5,COMPLETE
2426,0.7128712871287128,2025-11-30 14:17:40.988497,2025-11-30 14:19:28.025038,0 days 00:01:47.036541,0.00011280485314310746,dart,0.9208919405343543,2.0059645931716883,lossguide,0.007119257148174472,0.054062104126369116,0,5,26.389694056050736,400,forest,0.7744379887398086,0.8263984752268558,0.0024681182738760968,none,0.8673575928062269,1.7192825310177995,9.0,0.7550927838020964,0.2939473737323622,uniform,0.8586395225933693,0.5078661699618325,,0.5549525101763908,0.5540479421076436,0.7134536983110076,0.7128712871287128,0.7744379887398086,0.8263984752268558,0.08,0.5053776281326323,0.5001735375436345,0.5560599182932365,0.555858310626703,0.9951259138911455,0.9935064935064936,none,0.42683151245876094,0.4370224387461364,0.8673575928062269,0.5,COMPLETE
2427,0.3926509186351706,2025-11-30 14:19:28.809555,2025-11-30 14:19:29.611875,0 days 00:00:00.802320,0.00011936280415486378,gbtree,0.2754185283483264,8.679998499682924,lossguide,0.008063599013728558,0.2422529042044592,9,12,0.3884677146597836,900,,0.7743760218011602,0.3343634546426476,0.0838803858881463,undersample,0.6614066853908892,,11.0,0.6809323123149731,,,,0.6264994227897636,,0.4902758932609679,0.4767073722297603,0.4077771939043615,0.3926509186351706,0.7743760218011602,0.3343634546426476,0.08,0.5744209930152712,0.5725897911724419,0.5773809523809523,0.5557206537890045,0.3151909017059301,0.30357142857142855,undersample,0.5000998856081831,0.4750067986150724,0.6614066853908892,0.5,COMPLETE
2428,0.4747522416234073,2025-11-30 14:19:30.398055,2025-11-30 14:20:15.512723,0 days 00:00:45.114668,1.522723065820091,dart,0.2592908374452029,0.06197712056338234,depthwise,33.02482572585779,0.004952643622587568,9,9,0.5589493727492547,600,tree,0.5190611246383994,0.5419543168780456,0.020037072067654926,undersample,0.9298087272596669,,11.0,0.783801148234678,0.38236013049274004,uniform,0.6649363885929447,0.8254654385512938,,0.5124378109452736,0.4966078697421981,0.49579045837231056,0.4747522416234073,0.5190611246383994,0.5419543168780456,0.08,0.5748978283773454,0.5564168807221782,0.5843439911797134,0.5670800450958287,0.4305442729488221,0.4082792207792208,undersample,0.5559168752797625,0.5319912148627675,0.9298087272596669,0.5,COMPLETE
2429,0.7156549520766773,2025-11-30 14:20:16.266909,2025-11-30 14:20:16.824494,0 days 00:00:00.557585,0.060607212378697026,gbtree,0.6634715684403087,9.845932605635547,depthwise,0.19641068714173512,0.451554078151697,10,9,1.4198841278270304,500,,0.9406534964643932,0.2993533766179621,0.07801886588891607,oversample,0.7472541679560118,,6.0,0.9097438111972124,,,,0.5323472062613793,,0.5567616463138851,0.5572139303482587,0.715281812899477,0.7156549520766773,0.9406534964643932,0.2993533766179621,0.08,0.5748068423293515,0.5720118421668701,0.5567616463138851,0.5572139303482587,1.0,1.0,oversample,0.534238382599181,0.5283133299284984,0.7472541679560118,0.5,COMPLETE
2430,0.7156549520766773,2025-11-30 14:20:17.606648,2025-11-30 14:21:14.356164,0 days 00:00:56.749516,0.004881515842716712,dart,0.7237172985630285,7.470396488062953,depthwise,0.3552330902791275,0.0009551173216283856,1,5,10.857061207049576,700,forest,0.972413430650084,0.6196196428648852,0.04539689299939673,none,0.6117527577283618,1.4048788506376422,9.0,0.6864294657446759,0.369422287940904,uniform,0.6407204048577404,0.34941664214843215,,0.5567616463138851,0.5572139303482587,0.715281812899477,0.7156549520766773,0.972413430650084,0.6196196428648852,0.08,0.4617567358562143,0.4584978982222767,0.5567616463138851,0.5572139303482587,1.0,1.0,none,0.384426963311726,0.3794315362880225,0.6117527577283618,0.5,COMPLETE
2431,0.637085137085137,2025-11-30 14:21:15.148349,2025-11-30 14:21:16.625526,0 days 00:00:01.477177,0.0001723705362506454,gbtree,0.9133667127964245,1.3946815777465627,lossguide,0.0007861202961848193,0.16252266765511425,4,4,0.2172621918583318,500,,0.5961521120584032,0.7827279893668819,0.0864392661010607,none,0.5630769429002808,0.9174864243735623,6.0,0.7636665099238161,,,,0.8861854797336661,,0.5440976933514247,0.5450022614201718,0.6381909547738693,0.637085137085137,0.5961521120584032,0.7827279893668819,0.08,0.5309651803092542,0.534139047032015,0.5717041800643087,0.5733766233766234,0.7221770917952883,0.7167207792207793,none,0.48325610504152916,0.4873114627966517,0.5630769429002808,0.5,COMPLETE
2432,0.268188302425107,2025-11-30 14:21:17.419672,2025-11-30 14:23:24.529859,0 days 00:02:07.110187,0.05407425774879162,dart,0.47082068773715735,6.717702480745642,lossguide,0.01253665227112892,0.23519704380184991,9,3,0.1492180156109223,1000,forest,0.9231800194417799,0.5838235365091282,0.037674289525697215,undersample,0.6120203140885703,,12.0,0.9469798591210598,0.20465829166437421,weighted,0.7345989920572438,0.37691104142179993,,0.28222523744911804,0.3039348710990502,0.22623110677718186,0.268188302425107,0.9231800194417799,0.5838235365091282,0.08,0.3984920779728678,0.40105457821869606,0.28292682926829266,0.3237657864523536,0.18846466287571081,0.2288961038961039,undersample,0.22082013959117358,0.22715167876046324,0.6120203140885703,0.5,COMPLETE
2433,0.5943325876211782,2025-11-30 14:23:25.281865,2025-11-30 14:27:08.829658,0 days 00:03:43.547793,0.003738475901079092,dart,0.6403574559643004,1.9460689248999208,lossguide,0.00048330418213244004,0.463275228998775,0,8,12.160459513682456,800,tree,0.8528763597650739,0.2010893385507425,0.04881966580554369,oversample,0.9981339358174222,,5.0,0.8699293355640827,0.40678753997561445,weighted,0.6734411831607289,0.7884017867692779,,0.5061058344640434,0.5079149706015378,0.5943536404160475,0.5943325876211782,0.8528763597650739,0.2010893385507425,0.08,0.4980509408821586,0.4907132018841255,0.5475701574264202,0.5496551724137931,0.6498781478472786,0.6469155844155844,oversample,0.44912341053399424,0.4396535856890811,0.9981339358174222,0.5,COMPLETE
2434,0.7156549520766773,2025-11-30 14:27:09.619059,2025-11-30 14:27:10.255833,0 days 00:00:00.636774,0.0008656339863744749,gbtree,0.6001911446740438,5.56446876169447,depthwise,36.27477959556918,0.11204792707530571,4,3,0.8404362236937835,600,,0.6523294957423486,0.8270341128739434,0.0030197454882025633,none,0.544355885357372,3.8073115694775104,7.0,0.6096363537996909,,,,0.8938636903447372,,0.5567616463138851,0.5572139303482587,0.715281812899477,0.7156549520766773,0.6523294957423486,0.8270341128739434,0.08,0.467263112767846,0.4794882944898622,0.5567616463138851,0.5572139303482587,1.0,1.0,none,0.3255048160612742,0.3406756994282531,0.544355885357372,0.5,COMPLETE
2435,0.0,2025-11-30 14:27:11.080496,2025-11-30 14:28:47.101758,0 days 00:01:36.021262,0.00017130651986896892,dart,0.3110763075507736,5.270060151117548,depthwise,0.0032777644287045257,0.07692509256454418,4,6,90.23830060404602,1000,forest,0.8059358607128497,0.23236714564937766,0.06056471916201021,undersample,0.6849221123007128,,8.0,0.7908576671374453,0.4529994974662815,uniform,0.38335298509967575,0.8077224502270473,,0.44323835368611486,0.4427860696517413,0.0,0.0,0.8059358607128497,0.23236714564937766,0.08,0.5567616463138851,0.5572139303482587,0.0,0.0,0.0,0.0,undersample,0.5,0.5,0.6849221123007128,0.5,COMPLETE
2436,0.22691879866518352,2025-11-30 14:28:47.884856,2025-11-30 14:28:48.825691,0 days 00:00:00.940835,0.017856611795271926,gbtree,0.9232160924554551,5.476111060042706,lossguide,0.012909510625727252,0.0010200815623069201,5,3,0.16457811613732573,1000,,0.8606056990366904,0.3511252461274188,0.03865380820516027,undersample,0.5564408350709942,,9.0,0.8189804325667205,,,,0.8313340166863512,,0.37946630483943916,0.3713251922207146,0.24366041896361632,0.22691879866518352,0.8606056990366904,0.3511252461274188,0.08,0.46319917432397373,0.4501379629941251,0.379073756432247,0.36042402826855124,0.17952883834281072,0.16558441558441558,undersample,0.3335739982426764,0.3227414503269968,0.5564408350709942,0.5,COMPLETE
2437,0.03711952487008166,2025-11-30 14:28:49.622444,2025-11-30 14:29:05.699913,0 days 00:00:16.077469,0.0005531416451108994,dart,0.6621430732573053,5.454324548403714,depthwise,0.005736337559807168,0.4304604341789624,2,7,0.35463808067322977,400,forest,0.6970959502312117,0.33776996361522493,0.08121022889603224,none,0.6394656088299395,0.7053156554608333,6.0,0.6822578258206242,0.2843165827930875,uniform,0.08225011299187363,0.8812743847140336,,0.4097693351424695,0.41338760741745817,0.034048852701702444,0.03711952487008166,0.6970959502312117,0.33776996361522493,0.08,0.5434778002201806,0.5436548125962081,0.19166666666666668,0.21739130434782608,0.01868399675060926,0.020292207792207792,none,0.48055007543228506,0.46986969873844237,0.6394656088299395,0.5,COMPLETE
2438,0.7156549520766773,2025-11-30 14:29:06.469997,2025-11-30 14:30:52.241771,0 days 00:01:45.771774,0.040573306444181834,dart,0.7584722020221886,7.100930298974863,lossguide,27.21387962169278,0.00043465923091314695,9,10,25.61840406352423,1000,tree,0.5272305578744735,0.4080031796932667,0.08459606423014997,none,0.7705808977897699,2.040665838431521,8.0,0.6709761031667267,0.4038561399043112,weighted,0.22095537544656352,0.8936789460511638,,0.5567616463138851,0.5572139303482587,0.715281812899477,0.7156549520766773,0.5272305578744735,0.4080031796932667,0.08,0.5567616463138851,0.5572139303482587,0.5567616463138851,0.5572139303482587,1.0,1.0,none,0.5,0.5,0.7705808977897699,0.5,COMPLETE
2439,0.6683122493057698,2025-11-30 14:30:53.028181,2025-11-30 14:30:54.853076,0 days 00:00:01.824895,0.031410823786552876,gbtree,0.6491853446696011,2.4449777185584276,lossguide,0.0032673481344137442,0.24261626893737753,0,11,2.1809704883271017,300,,0.8031086281457382,0.41196176752386643,0.0479402295115581,none,0.7375066966554442,1.3014232623587239,12.0,0.7741317214407512,,,,0.8419543500555549,,0.5070104025327906,0.5137946630483944,0.663372452130945,0.6683122493057698,0.8031086281457382,0.41196176752386643,0.08,0.45921614459436055,0.46067141433569736,0.5351270553064275,0.5390741662518665,0.8724614134849715,0.8790584415584416,none,0.34207712329448425,0.3537149456774074,0.7375066966554442,0.5,COMPLETE
2440,0.7156549520766773,2025-11-30 14:30:55.645552,2025-11-30 14:31:36.340336,0 days 00:00:40.694784,0.6030634312329937,dart,0.7734417549027328,4.0099342002648575,lossguide,0.0003723697178612905,0.0009669544927485476,9,9,25.107426638989338,600,forest,0.9362637683126402,0.624771332674725,0.014333008106702051,none,0.7649418147148013,4.799347190509652,7.0,0.7301120864587385,0.34920421363097176,uniform,0.5619093792651172,0.22111451551960776,,0.5567616463138851,0.5572139303482587,0.715281812899477,0.7156549520766773,0.9362637683126402,0.624771332674725,0.08,0.5599299318840307,0.5429435023001303,0.5567616463138851,0.5572139303482587,1.0,1.0,none,0.5468177522836917,0.5322714504596526,0.7649418147148013,0.5,COMPLETE
2441,0.37414543194530764,2025-11-30 14:31:37.128299,2025-11-30 14:31:56.948198,0 days 00:00:19.819899,0.7102690024744737,dart,0.3744637501781209,5.461474994188221,depthwise,5.278102974941027,0.04611722124008024,2,9,0.7538317613439965,400,forest,0.7371601703482524,0.22409062302147986,0.021572405999137567,undersample,0.5673134537606328,,11.0,0.936469932929878,0.13546863957684135,uniform,0.3298729603721999,0.7949290500057498,,0.5210312075983717,0.5445499773857982,0.3301707779886148,0.37414543194530764,0.7371601703482524,0.22409062302147986,0.08,0.5968239037334664,0.6161421461537262,0.7457142857142857,0.7984084880636605,0.21202274573517466,0.24431818181818182,undersample,0.5606032096022812,0.583343973442288,0.5673134537606328,0.5,COMPLETE
2442,0.6694762191450934,2025-11-30 14:31:57.755478,2025-11-30 14:33:17.522012,0 days 00:01:19.766534,0.0001015468954266607,dart,0.6758427780297889,6.96077111378973,depthwise,0.005650203101146707,0.3922124375995989,0,4,63.26382099813552,800,tree,0.5870465659184914,0.5911698345168526,0.044607532714300374,oversample,0.5507979292620129,,6.0,0.8152424701688601,0.21315921900161988,weighted,0.6758606000405358,0.5886894155309905,,0.5015829941203076,0.5033921302578019,0.6678722121760097,0.6694762191450934,0.5870465659184914,0.5911698345168526,0.08,0.44485646567074083,0.4261017884807971,0.5309056061332056,0.5320574162679426,0.9000812347684809,0.9025974025974026,oversample,0.2872287338981084,0.25775788307708636,0.5507979292620129,0.5,COMPLETE
2443,0.7156549520766773,2025-11-30 14:33:18.299714,2025-11-30 14:33:19.163855,0 days 00:00:00.864141,2.505756688684315,gbtree,0.6203511028609714,7.898407898029339,depthwise,0.023196678936152015,0.2149270343646163,0,4,1.2696171517860748,1000,,0.8188858627814815,0.5321531138493916,0.07435701342636418,oversample,0.5074078585385948,,7.0,0.7249447476388684,,,,0.8819126043135155,,0.5567616463138851,0.5572139303482587,0.715281812899477,0.7156549520766773,0.8188858627814815,0.5321531138493916,0.08,0.5917580172915486,0.585267357262358,0.5567616463138851,0.5572139303482587,1.0,1.0,oversample,0.5655610172582437,0.553256785349482,0.5074078585385948,0.5,COMPLETE
2444,0.7156549520766773,2025-11-30 14:33:19.947751,2025-11-30 14:33:51.672876,0 days 00:00:31.725125,98.26291976309537,dart,0.5881490785132462,1.6635220075314339,lossguide,8.66739860189898,0.0003436413195789,2,3,1.0930114408907032,500,forest,0.7846127606058322,0.7555819131781363,0.003881180846421595,oversample,0.5986118878338085,,7.0,0.7409087377299843,0.1937414570743109,weighted,0.7437749487525539,0.46733041669035846,,0.5567616463138851,0.5572139303482587,0.715281812899477,0.7156549520766773,0.7846127606058322,0.7555819131781363,0.08,0.5567616463138851,0.5572139303482587,0.5567616463138851,0.5572139303482587,1.0,1.0,oversample,0.5,0.5,0.5986118878338085,0.5,COMPLETE
2445,0.4166290103931315,2025-11-30 14:33:52.469615,2025-11-30 14:33:54.324749,0 days 00:00:01.855134,0.26630325227606216,gbtree,0.7190418471401816,2.5744457837839763,lossguide,0.0006255256414283923,0.0019344087102470791,7,11,1.685414024533653,600,,0.7729107257939709,0.8458729216859509,0.08033251084614394,undersample,0.6879702151388774,,5.0,0.8389379612586075,,,,0.9370737056283778,,0.43509724106739034,0.4161013116236997,0.4495372410753636,0.4166290103931315,0.7729107257939709,0.8458729216859509,0.08,0.4912649863665439,0.46915386585825625,0.4913294797687861,0.46992864424057085,0.41429731925264013,0.3741883116883117,undersample,0.4067375122266616,0.37516416168101563,0.6879702151388774,0.5,COMPLETE
2446,0.3264733395696913,2025-11-30 14:33:55.128987,2025-11-30 14:33:59.244010,0 days 00:00:04.115023,0.03616076094628668,dart,0.5667212306178344,0.5162329006208055,lossguide,0.011745914919719519,0.000944866885188752,9,5,13.277786954836152,200,forest,0.7748590223883272,0.5057844199423618,0.006514402647970641,undersample,0.597862417342097,,6.0,0.6893346623910044,0.46527659433808843,weighted,0.24365697148090354,0.25863423740815245,,0.3473541383989145,0.3487109905020353,0.32412177985948476,0.3264733395696913,0.7748590223883272,0.5057844199423618,0.08,0.42712554426634847,0.4357218946788741,0.3827433628318584,0.3852097130242826,0.28107229894394803,0.2832792207792208,undersample,0.2806541056715131,0.3002463254314633,0.597862417342097,0.5,COMPLETE
2447,0.3933649289099526,2025-11-30 14:34:00.063059,2025-11-30 14:34:05.556447,0 days 00:00:05.493388,0.004426745759131046,dart,0.7703214539717982,4.1031968652683215,depthwise,0.00276787835052992,0.008254576681302864,4,4,11.166645992570816,200,forest,0.6675077520883961,0.5032609621028602,0.06671744174011099,undersample,0.7096236600978214,,8.0,0.7610086768137174,0.12276975779627997,uniform,0.48117488985555623,0.7195188907559416,,0.41383989145183175,0.42107643600180916,0.38636363636363635,0.3933649289099526,0.6675077520883961,0.5032609621028602,0.08,0.49093925190476506,0.4955093833731364,0.46311010215664017,0.47266514806378135,0.3314378554021121,0.33685064935064934,undersample,0.4109327077703543,0.4187213131607922,0.7096236600978214,0.5,COMPLETE
2448,0.3191489361702128,2025-11-30 14:34:06.361415,2025-11-30 14:34:50.036280,0 days 00:00:43.674865,0.0001995151818992646,dart,0.65234414003254,5.82851268091193,lossguide,0.19364681078446894,0.48614923839327007,8,6,20.363785386105302,600,tree,0.7925542051520111,0.8795984682384848,0.09418489703467511,undersample,0.7114694706137904,,11.0,0.7713998574035189,0.10834532623586657,uniform,0.16618429462666454,0.7413852263630429,,0.44414292175486203,0.42107643600180916,0.3417246920192823,0.3191489361702128,0.7925542051520111,0.8795984682384848,0.1,0.45670368722339505,0.44447360274214,0.5015723270440252,0.46296296296296297,0.25913891145410234,0.2435064935064935,undersample,0.31636424675475394,0.29544749810965343,0.7114694706137904,0.5,COMPLETE
2449,0.7156549520766773,2025-11-30 14:34:50.853087,2025-11-30 14:34:51.324426,0 days 00:00:00.471339,0.020403011803289343,gbtree,0.5232927566178656,5.9262553125363295,depthwise,0.7172334842889027,0.005058853049539733,3,6,46.57588463626311,300,,0.7913195369854251,0.8836640715370134,0.01226039210992509,none,0.5418012396958665,3.9630626860771616,10.0,0.7007582880029047,,,,0.7356959508977192,,0.5567616463138851,0.5572139303482587,0.715281812899477,0.7156549520766773,0.7913195369854251,0.8836640715370134,0.08,0.5871003563041552,0.5928378420512164,0.5567616463138851,0.5572139303482587,1.0,1.0,none,0.5614168006764038,0.5675923285090803,0.5418012396958665,0.5,COMPLETE
2450,0.0,2025-11-30 14:34:52.114561,2025-11-30 14:34:52.745459,0 days 00:00:00.630898,0.0004537848406605511,gbtree,0.4600475966469644,9.90225518444119,depthwise,0.027336031078458094,0.0016811135980613742,7,11,0.10638015324767375,600,,0.7047144771862697,0.22048597876706091,0.03919146822192435,none,0.9966311073719047,0.5596338108271741,8.0,0.9332845753852347,,,,0.7888219739136526,,0.44323835368611486,0.4427860696517413,0.0,0.0,0.7047144771862697,0.22048597876706091,0.08,0.5567616463138851,0.5572139303482587,0.0,0.0,0.0,0.0,none,0.5,0.5,0.9966311073719047,0.5,COMPLETE
