number,value,datetime_start,datetime_complete,duration,params_alpha,params_booster,params_colsample_bytree,params_gamma,params_grow_policy,params_lambda,params_learning_rate,params_max_delta_step,params_max_depth,params_min_child_weight,params_n_estimators,params_normalize_type,params_params_feature_fraction,params_params_labeled_ratio,params_params_missing_rate,params_params_resampling,params_params_sample_rows,params_params_scale_pos_weight,params_params_selftrain_max_iter,params_params_selftrain_threshold,params_rate_drop,params_sample_type,params_skip_drop,params_subsample,params_user_attrs_decision_threshold,user_attrs_acc_test,user_attrs_acc_val,user_attrs_f1_test,user_attrs_f1_val,user_attrs_feature_fraction,user_attrs_labeled_ratio,user_attrs_missing_rate,user_attrs_pr_auc_test,user_attrs_pr_auc_val,user_attrs_prec_test,user_attrs_prec_val,user_attrs_rec_test,user_attrs_rec_val,user_attrs_resampling_strategy,user_attrs_roc_auc_test,user_attrs_roc_auc_val,user_attrs_sample_rows,user_attrs_user_attrs_decision_threshold,state
2004,0.7171129220023282,2025-11-27 12:03:18.862684,2025-11-27 12:05:07.772238,0 days 00:01:48.909554,0.00011280485314310746,dart,0.9208919405343543,2.0059645931716883,lossguide,0.007119257148174472,0.054062104126369116,0,5,26.389694056050736,400,forest,0.7744379887398086,0.8263984752268558,0.0024681182738760968,none,0.8673575928062269,1.7192825310177995,9.0,0.7550927838020964,0.2939473737323622,uniform,0.8586395225933693,0.5078661699618325,,0.5608322026232474,0.5603799185888738,0.7169921305741767,0.7171129220023282,0.7744379887398086,0.8263984752268558,0.0,0.6015415430350336,0.5760266547830233,0.5590909090909091,0.558983666061706,0.9991876523151909,1.0,none,0.5873439546411579,0.5669112233527452,0.8673575928062269,0.5,COMPLETE
2005,0.3514344262295082,2025-11-27 12:05:07.993121,2025-11-27 12:05:08.809347,0 days 00:00:00.816226,0.00011936280415486378,gbtree,0.2754185283483264,8.679998499682924,lossguide,0.008063599013728558,0.2422529042044592,9,12,0.3884677146597836,900,,0.7743760218011602,0.3343634546426476,0.0838803858881463,undersample,0.6614066853908892,,11.0,0.6809323123149731,,,,0.6264994227897636,,0.41700587969244685,0.42740841248303935,0.3493185259969712,0.3514344262295082,0.7743760218011602,0.3343634546426476,0.08,0.5278679330593513,0.5237794055550531,0.4613333333333333,0.47638888888888886,0.28107229894394803,0.2784090909090909,undersample,0.40692236277126614,0.4006900594298449,0.6614066853908892,0.5,COMPLETE
2006,0.3970988213961922,2025-11-27 12:05:09.003521,2025-11-27 12:05:54.131892,0 days 00:00:45.128371,1.522723065820091,dart,0.2592908374452029,0.06197712056338234,depthwise,33.02482572585779,0.004952643622587568,9,9,0.5589493727492547,600,tree,0.5190611246383994,0.5419543168780456,0.020037072067654926,undersample,0.9298087272596669,,11.0,0.783801148234678,0.38236013049274004,uniform,0.6649363885929447,0.8254654385512938,,0.383989145183175,0.3984622342831298,0.3729281767955801,0.3970988213961922,0.5190611246383994,0.5419543168780456,0.02,0.45628391557322306,0.464450643141761,0.4303931987247609,0.44969199178644764,0.3290008123476848,0.3555194805194805,undersample,0.3591310366551169,0.37540874600374086,0.9298087272596669,0.5,COMPLETE
2007,0.64704,2025-11-27 12:05:54.337761,2025-11-27 12:05:54.920086,0 days 00:00:00.582325,0.060607212378697026,gbtree,0.6634715684403087,9.845932605635547,depthwise,0.19641068714173512,0.451554078151697,10,9,1.4198841278270304,500,,0.9406534964643932,0.2993533766179621,0.07801886588891607,oversample,0.7472541679560118,,6.0,0.9097438111972124,,,,0.5323472062613793,,0.49163274536408863,0.501130710085934,0.6395125080179602,0.64704,0.9406534964643932,0.2993533766179621,0.08,0.527701567942588,0.5543755434802417,0.5283518812930578,0.5340729001584786,0.809910641754671,0.8206168831168831,oversample,0.4507601253336428,0.49535662881551557,0.7472541679560118,0.5,COMPLETE
2008,0.7156549520766773,2025-11-27 12:05:55.123921,2025-11-27 12:06:52.447399,0 days 00:00:57.323478,0.004881515842716712,dart,0.7237172985630285,7.470396488062953,depthwise,0.3552330902791275,0.0009551173216283856,1,5,10.857061207049576,700,forest,0.972413430650084,0.6196196428648852,0.04539689299939673,none,0.6117527577283618,1.4048788506376422,9.0,0.6864294657446759,0.369422287940904,uniform,0.6407204048577404,0.34941664214843215,,0.5567616463138851,0.5572139303482587,0.715281812899477,0.7156549520766773,0.972413430650084,0.6196196428648852,0.05,0.6500765953450706,0.6672413438474026,0.5567616463138851,0.5572139303482587,1.0,1.0,none,0.634877899169416,0.6454331546900494,0.6117527577283618,0.5,COMPLETE
2009,0.6070640176600441,2025-11-27 12:06:52.651626,2025-11-27 12:06:54.121249,0 days 00:00:01.469623,0.0001723705362506454,gbtree,0.9133667127964245,1.3946815777465627,lossguide,0.0007861202961848193,0.16252266765511425,4,4,0.2172621918583318,500,,0.5961521120584032,0.7827279893668819,0.0864392661010607,none,0.5630769429002808,0.9174864243735623,6.0,0.7636665099238161,,,,0.8861854797336661,,0.5232926277702397,0.5169606512890095,0.605833956619297,0.6070640176600441,0.5961521120584032,0.7827279893668819,0.08,0.5439518319599719,0.5368532694817084,0.5613305613305614,0.5551816958277255,0.6580016246953696,0.6696428571428571,none,0.4965765347568759,0.4885364571587759,0.5630769429002808,0.5,COMPLETE
2010,0.6882530120481928,2025-11-27 12:06:54.320066,2025-11-27 12:09:02.505567,0 days 00:02:08.185501,0.05407425774879162,dart,0.47082068773715735,6.717702480745642,lossguide,0.01253665227112892,0.23519704380184991,9,3,0.1492180156109223,1000,forest,0.9231800194417799,0.5838235365091282,0.037674289525697215,undersample,0.6120203140885703,,12.0,0.9469798591210598,0.20465829166437421,weighted,0.7345989920572438,0.37691104142179993,,0.6304839439167798,0.6255088195386703,0.6943509165731387,0.6882530120481928,0.9231800194417799,0.5838235365091282,0.05,0.6180254874364217,0.6137676061466315,0.6435506241331485,0.6418539325842697,0.7538586515028433,0.7418831168831169,undersample,0.625113148427527,0.6107353448390221,0.6120203140885703,0.5,COMPLETE
2011,0.6142322097378277,2025-11-27 12:09:02.711762,2025-11-27 12:12:49.977652,0 days 00:03:47.265890,0.003738475901079092,dart,0.6403574559643004,1.9460689248999208,lossguide,0.00048330418213244004,0.463275228998775,0,8,12.160459513682456,800,tree,0.8528763597650739,0.2010893385507425,0.04881966580554369,oversample,0.9981339358174222,,5.0,0.8699293355640827,0.40678753997561445,weighted,0.6734411831607289,0.7884017867692779,,0.5499773857982814,0.5341474445952058,0.6260804208944006,0.6142322097378277,0.8528763597650739,0.2010893385507425,0.05,0.5616629954613532,0.5377915382683072,0.5825174825174825,0.5702364394993046,0.6766856214459789,0.6655844155844156,oversample,0.5315696546693414,0.4957574983749652,0.9981339358174222,0.5,COMPLETE
2012,0.7156549520766773,2025-11-27 12:12:50.185788,2025-11-27 12:12:50.825608,0 days 00:00:00.639820,0.0008656339863744749,gbtree,0.6001911446740438,5.56446876169447,depthwise,36.27477959556918,0.11204792707530571,4,3,0.8404362236937835,600,,0.6523294957423486,0.8270341128739434,0.0030197454882025633,none,0.544355885357372,3.8073115694775104,7.0,0.6096363537996909,,,,0.8938636903447372,,0.5567616463138851,0.5572139303482587,0.715281812899477,0.7156549520766773,0.6523294957423486,0.8270341128739434,0.0,0.43779881397243153,0.43234611218650343,0.5567616463138851,0.5572139303482587,1.0,1.0,none,0.26937697906132396,0.25122540891182366,0.544355885357372,0.5,COMPLETE
2013,0.0,2025-11-27 12:12:51.030392,2025-11-27 12:14:26.200579,0 days 00:01:35.170187,0.00017130651986896892,dart,0.3110763075507736,5.270060151117548,depthwise,0.0032777644287045257,0.07692509256454418,4,6,90.23830060404602,1000,forest,0.8059358607128497,0.23236714564937766,0.06056471916201021,undersample,0.6849221123007128,,8.0,0.7908576671374453,0.4529994974662815,uniform,0.38335298509967575,0.8077224502270473,,0.44323835368611486,0.4427860696517413,0.0,0.0,0.8059358607128497,0.23236714564937766,0.05,0.5567616463138851,0.5572139303482587,0.0,0.0,0.0,0.0,undersample,0.5,0.5,0.6849221123007128,0.5,COMPLETE
2014,0.5984538426557526,2025-11-27 12:14:26.401747,2025-11-27 12:14:27.290556,0 days 00:00:00.888809,0.017856611795271926,gbtree,0.9232160924554551,5.476111060042706,lossguide,0.012909510625727252,0.0010200815623069201,5,3,0.16457811613732573,1000,,0.8606056990366904,0.3511252461274188,0.03865380820516027,undersample,0.5564408350709942,,9.0,0.8189804325667205,,,,0.8313340166863512,,0.5707824513794663,0.6006331976481231,0.5612575127138234,0.5984538426557526,0.8606056990366904,0.3511252461274188,0.05,0.6414530868861295,0.6771213659448178,0.6512875536480687,0.6804550155118925,0.4930950446791227,0.5340909090909091,undersample,0.5905622606475571,0.6351759514744705,0.5564408350709942,0.5,COMPLETE
2015,0.0,2025-11-27 12:14:27.493142,2025-11-27 12:14:43.508400,0 days 00:00:16.015258,0.0005531416451108994,dart,0.6621430732573053,5.454324548403714,depthwise,0.005736337559807168,0.4304604341789624,2,7,0.35463808067322977,400,forest,0.6970959502312117,0.33776996361522493,0.08121022889603224,none,0.6394656088299395,0.7053156554608333,6.0,0.6822578258206242,0.2843165827930875,uniform,0.08225011299187363,0.8812743847140336,,0.44323835368611486,0.4427860696517413,0.0,0.0,0.6970959502312117,0.33776996361522493,0.08,0.5567616463138851,0.5572139303482587,0.0,0.0,0.0,0.0,none,0.5,0.5,0.6394656088299395,0.5,COMPLETE
2016,0.7156549520766773,2025-11-27 12:14:43.715005,2025-11-27 12:16:31.217500,0 days 00:01:47.502495,0.040573306444181834,dart,0.7584722020221886,7.100930298974863,lossguide,27.21387962169278,0.00043465923091314695,9,10,25.61840406352423,1000,tree,0.5272305578744735,0.4080031796932667,0.08459606423014997,none,0.7705808977897699,2.040665838431521,8.0,0.6709761031667267,0.4038561399043112,weighted,0.22095537544656352,0.8936789460511638,,0.5567616463138851,0.5572139303482587,0.715281812899477,0.7156549520766773,0.5272305578744735,0.4080031796932667,0.08,0.5567616463138851,0.5572139303482587,0.5567616463138851,0.5572139303482587,1.0,1.0,none,0.5,0.5,0.7705808977897699,0.5,COMPLETE
2017,0.6972365624051017,2025-11-27 12:16:31.417135,2025-11-27 12:16:33.280063,0 days 00:00:01.862928,0.031410823786552876,gbtree,0.6491853446696011,2.4449777185584276,lossguide,0.0032673481344137442,0.24261626893737753,0,11,2.1809704883271017,300,,0.8031086281457382,0.41196176752386643,0.0479402295115581,none,0.7375066966554442,1.3014232623587239,12.0,0.7741317214407512,,,,0.8419543500555549,,0.5549525101763908,0.5490728177295342,0.6987140232700552,0.6972365624051017,0.8031086281457382,0.41196176752386643,0.05,0.5196604250901244,0.5027128334755299,0.5606879606879607,0.5570111596312469,0.9268887083671812,0.9318181818181818,none,0.47711541968533966,0.45590932305692267,0.7375066966554442,0.5,COMPLETE
2018,0.7156549520766773,2025-11-27 12:16:33.489231,2025-11-27 12:17:14.321285,0 days 00:00:40.832054,0.6030634312329937,dart,0.7734417549027328,4.0099342002648575,lossguide,0.0003723697178612905,0.0009669544927485476,9,9,25.107426638989338,600,forest,0.9362637683126402,0.624771332674725,0.014333008106702051,none,0.7649418147148013,4.799347190509652,7.0,0.7301120864587385,0.34920421363097176,uniform,0.5619093792651172,0.22111451551960776,,0.5567616463138851,0.5572139303482587,0.715281812899477,0.7156549520766773,0.9362637683126402,0.624771332674725,0.02,0.7517302796980375,0.7867367107454593,0.5567616463138851,0.5572139303482587,1.0,1.0,none,0.7280807042557071,0.7562684060066593,0.7649418147148013,0.5,COMPLETE
2019,0.5303370786516854,2025-11-27 12:17:14.519847,2025-11-27 12:17:34.593080,0 days 00:00:20.073233,0.7102690024744737,dart,0.3744637501781209,5.461474994188221,depthwise,5.278102974941027,0.04611722124008024,2,9,0.7538317613439965,400,forest,0.7371601703482524,0.22409062302147986,0.021572405999137567,undersample,0.5673134537606328,,11.0,0.936469932929878,0.13546863957684135,uniform,0.3298729603721999,0.7949290500057498,,0.6006331976481231,0.6218905472636815,0.4974388161639158,0.5303370786516854,0.7371601703482524,0.22409062302147986,0.02,0.6598989983647563,0.6927545870813316,0.8307984790874525,0.8613138686131386,0.35499593826157594,0.38311688311688313,undersample,0.6180623020938676,0.6482251469164136,0.5673134537606328,0.5,COMPLETE
2020,0.7156549520766773,2025-11-27 12:17:34.787887,2025-11-27 12:18:54.682774,0 days 00:01:19.894887,0.0001015468954266607,dart,0.6758427780297889,6.96077111378973,depthwise,0.005650203101146707,0.3922124375995989,0,4,63.26382099813552,800,tree,0.5870465659184914,0.5911698345168526,0.044607532714300374,oversample,0.5507979292620129,,6.0,0.8152424701688601,0.21315921900161988,weighted,0.6758606000405358,0.5886894155309905,,0.5567616463138851,0.5572139303482587,0.715281812899477,0.7156549520766773,0.5870465659184914,0.5911698345168526,0.05,0.46866156722628005,0.450704798280236,0.5567616463138851,0.5572139303482587,1.0,1.0,oversample,0.3641568162602165,0.3303132005889922,0.5507979292620129,0.5,COMPLETE
2021,0.7156549520766773,2025-11-27 12:18:54.884446,2025-11-27 12:18:55.760051,0 days 00:00:00.875605,2.505756688684315,gbtree,0.6203511028609714,7.898407898029339,depthwise,0.023196678936152015,0.2149270343646163,0,4,1.2696171517860748,1000,,0.8188858627814815,0.5321531138493916,0.07435701342636418,oversample,0.5074078585385948,,7.0,0.7249447476388684,,,,0.8819126043135155,,0.5567616463138851,0.5572139303482587,0.715281812899477,0.7156549520766773,0.8188858627814815,0.5321531138493916,0.08,0.5567616463138851,0.5572139303482587,0.5567616463138851,0.5572139303482587,1.0,1.0,oversample,0.5,0.5,0.5074078585385948,0.5,COMPLETE
2022,0.7156549520766773,2025-11-27 12:18:55.958845,2025-11-27 12:19:27.844907,0 days 00:00:31.886062,98.26291976309537,dart,0.5881490785132462,1.6635220075314339,lossguide,8.66739860189898,0.0003436413195789,2,3,1.0930114408907032,500,forest,0.7846127606058322,0.7555819131781363,0.003881180846421595,oversample,0.5986118878338085,,7.0,0.7409087377299843,0.1937414570743109,weighted,0.7437749487525539,0.46733041669035846,,0.5567616463138851,0.5572139303482587,0.715281812899477,0.7156549520766773,0.7846127606058322,0.7555819131781363,0.0,0.5567616463138851,0.5572139303482587,0.5567616463138851,0.5572139303482587,1.0,1.0,oversample,0.5,0.5,0.5986118878338085,0.5,COMPLETE
2023,0.5143570536828964,2025-11-27 12:19:28.043364,2025-11-27 12:19:29.945406,0 days 00:00:01.902042,0.26630325227606216,gbtree,0.7190418471401816,2.5744457837839763,lossguide,0.0006255256414283923,0.0019344087102470791,7,11,1.685414024533653,600,,0.7729107257939709,0.8458729216859509,0.08033251084614394,undersample,0.6879702151388774,,5.0,0.8389379612586075,,,,0.9370737056283778,,0.48077792853912255,0.47218453188602444,0.5216666666666666,0.5143570536828964,0.7729107257939709,0.8458729216859509,0.08,0.5019378265227464,0.4923430018133435,0.5355004277159966,0.5277540563620837,0.5085296506904955,0.5016233766233766,undersample,0.4454098211177241,0.4311296147672552,0.6879702151388774,0.5,COMPLETE
2024,0.7717666948436179,2025-11-27 12:19:30.150812,2025-11-27 12:19:34.287049,0 days 00:00:04.136237,0.03616076094628668,dart,0.5667212306178344,0.5162329006208055,lossguide,0.011745914919719519,0.000944866885188752,9,5,13.277786954836152,200,forest,0.7748590223883272,0.5057844199423618,0.006514402647970641,undersample,0.597862417342097,,6.0,0.6893346623910044,0.46527659433808843,weighted,0.24365697148090354,0.25863423740815245,,0.7602894617819991,0.7557666214382632,0.7773109243697479,0.7717666948436179,0.7748590223883272,0.5057844199423618,0.0,0.8280434844136955,0.8266763978618215,0.8050478677110531,0.8051146384479718,0.7514216084484159,0.7410714285714286,undersample,0.8276434456804656,0.8159681227863047,0.597862417342097,0.5,COMPLETE
2025,0.296010296010296,2025-11-27 12:19:34.492425,2025-11-27 12:19:40.040159,0 days 00:00:05.547734,0.004426745759131046,dart,0.7703214539717982,4.1031968652683215,depthwise,0.00276787835052992,0.008254576681302864,4,4,11.166645992570816,200,forest,0.6675077520883961,0.5032609621028602,0.06671744174011099,undersample,0.7096236600978214,,8.0,0.7610086768137174,0.12276975779627997,uniform,0.48117488985555623,0.7195188907559416,,0.27951153324287653,0.25780189959294436,0.32869785082174463,0.296010296010296,0.6675077520883961,0.5032609621028602,0.08,0.3955299559421771,0.38836760775994833,0.3415061295971979,0.31392174704276615,0.31681559707554835,0.2800324675324675,undersample,0.21194151096669372,0.18443730681984002,0.7096236600978214,0.5,COMPLETE
2026,0.3950398582816652,2025-11-27 12:19:40.245293,2025-11-27 12:20:24.724969,0 days 00:00:44.479676,0.0001995151818992646,dart,0.65234414003254,5.82851268091193,lossguide,0.19364681078446894,0.48614923839327007,8,6,20.363785386105302,600,tree,0.7925542051520111,0.8795984682384848,0.09418489703467511,undersample,0.7114694706137904,,11.0,0.7713998574035189,0.10834532623586657,uniform,0.16618429462666454,0.7413852263630429,,0.39077340569877883,0.38218000904568067,0.4216401889222842,0.3950398582816652,0.7925542051520111,0.8795984682384848,0.08,0.46411637256217053,0.46381360055822296,0.4471766848816029,0.4346978557504873,0.39886271324126726,0.362012987012987,undersample,0.35246315423001046,0.345757664194845,0.7114694706137904,0.5,COMPLETE
2027,0.7156549520766773,2025-11-27 12:20:24.929887,2025-11-27 12:20:25.407548,0 days 00:00:00.477661,0.020403011803289343,gbtree,0.5232927566178656,5.9262553125363295,depthwise,0.7172334842889027,0.005058853049539733,3,6,46.57588463626311,300,,0.7913195369854251,0.8836640715370134,0.01226039210992509,none,0.5418012396958665,3.9630626860771616,10.0,0.7007582880029047,,,,0.7356959508977192,,0.5567616463138851,0.5572139303482587,0.715281812899477,0.7156549520766773,0.7913195369854251,0.8836640715370134,0.02,0.6550054290956723,0.6547697009725194,0.5567616463138851,0.5572139303482587,1.0,1.0,none,0.6476209817802019,0.6392033018054468,0.5418012396958665,0.5,COMPLETE
2028,0.0,2025-11-27 12:20:25.612360,2025-11-27 12:20:26.255833,0 days 00:00:00.643473,0.0004537848406605511,gbtree,0.4600475966469644,9.90225518444119,depthwise,0.027336031078458094,0.0016811135980613742,7,11,0.10638015324767375,600,,0.7047144771862697,0.22048597876706091,0.03919146822192435,none,0.9966311073719047,0.5596338108271741,8.0,0.9332845753852347,,,,0.7888219739136526,,0.44323835368611486,0.4427860696517413,0.0,0.0,0.7047144771862697,0.22048597876706091,0.05,0.5411633098366729,0.5403847569762184,0.0,0.0,0.0,0.0,none,0.4560818315953513,0.44892747701736463,0.9966311073719047,0.5,COMPLETE
2029,0.07823613086770982,2025-11-27 12:20:26.463973,2025-11-27 12:21:30.480913,0 days 00:01:04.016940,0.040654162255326795,dart,0.6432439305951793,1.2814614351959597,depthwise,0.014952321499754381,0.3311235609990549,4,4,0.36628540250947644,700,forest,0.9032635231084385,0.6038360887150925,0.09233950947632276,none,0.9499336929379266,0.5683359941839629,9.0,0.857227689270526,0.03732461831230943,uniform,0.1077581068989497,0.9818980048857455,,0.4206241519674355,0.41383989145183175,0.09341825902335456,0.07823613086770982,0.9032635231084385,0.6038360887150925,0.08,0.49545964530491404,0.49813097382019533,0.3626373626373626,0.3160919540229885,0.05361494719740049,0.044642857142857144,none,0.42175060926076363,0.43703902073411777,0.9499336929379266,0.5,COMPLETE
2030,0.7156549520766773,2025-11-27 12:21:30.689818,2025-11-27 12:21:31.111587,0 days 00:00:00.421769,0.00042634935161488377,gbtree,0.5071851913230746,7.035041231296615,depthwise,0.24529347076787905,0.0011929130029871256,4,11,26.40236165824124,200,,0.799847149091691,0.6062888782152416,0.049670185927825385,oversample,0.8208438978858483,,11.0,0.8923543845758354,,,,0.25283392326554427,,0.5567616463138851,0.5572139303482587,0.715281812899477,0.7156549520766773,0.799847149091691,0.6062888782152416,0.05,0.6581774593071492,0.6801289388117091,0.5567616463138851,0.5572139303482587,1.0,1.0,oversample,0.6062505180788806,0.6149206386055213,0.8208438978858483,0.5,COMPLETE
2031,0.6569484936831875,2025-11-27 12:21:31.323817,2025-11-27 12:23:19.428729,0 days 00:01:48.104912,2.404183025151458,dart,0.769552285207858,4.394670610097167,depthwise,1.7935740209772157,0.1328513622182126,3,10,0.24452874940892358,900,tree,0.5564198045417581,0.2809903460969075,0.07928532882832406,oversample,0.7399812159257486,,9.0,0.8258206986974788,0.014504674847509669,weighted,0.3527908331749642,0.25744393402586907,,0.5440976933514247,0.5210312075983717,0.6733635774465327,0.6569484936831875,0.5564198045417581,0.2809903460969075,0.08,0.5502622439868979,0.5139224563218074,0.5601078167115903,0.5466307277628032,0.8440292445166532,0.823051948051948,oversample,0.5054356836154446,0.4515150962418582,0.7399812159257486,0.5,COMPLETE
2032,0.7156549520766773,2025-11-27 12:23:19.620672,2025-11-27 12:23:20.312179,0 days 00:00:00.691507,0.988723675369334,gbtree,0.48556689787584234,3.0457161899335414,lossguide,45.58023683449187,0.0002321234057182187,3,3,2.2155065203965245,600,,0.8132182787607123,0.604230834062436,0.017255373468917746,oversample,0.8209741722728962,,10.0,0.6655450914193951,,,,0.4164244633635277,,0.5567616463138851,0.5572139303482587,0.715281812899477,0.7156549520766773,0.8132182787607123,0.604230834062436,0.02,0.4249107286330458,0.4194564993053787,0.5567616463138851,0.5572139303482587,1.0,1.0,oversample,0.2880916460816658,0.27575763103086903,0.8209741722728962,0.5,COMPLETE
