number,value,datetime_start,datetime_complete,duration,params_alpha,params_booster,params_colsample_bytree,params_gamma,params_grow_policy,params_lambda,params_learning_rate,params_max_delta_step,params_max_depth,params_min_child_weight,params_n_estimators,params_normalize_type,params_params_feature_fraction,params_params_labeled_ratio,params_params_missing_rate,params_params_resampling,params_params_sample_rows,params_params_scale_pos_weight,params_params_selftrain_max_iter,params_params_selftrain_threshold,params_rate_drop,params_sample_type,params_skip_drop,params_subsample,params_user_attrs_decision_threshold,user_attrs_acc_test,user_attrs_acc_val,user_attrs_f1_test,user_attrs_f1_val,user_attrs_feature_fraction,user_attrs_labeled_ratio,user_attrs_missing_rate,user_attrs_pr_auc_test,user_attrs_pr_auc_val,user_attrs_prec_test,user_attrs_prec_val,user_attrs_rec_test,user_attrs_rec_val,user_attrs_resampling_strategy,user_attrs_roc_auc_test,user_attrs_roc_auc_val,user_attrs_sample_rows,user_attrs_user_attrs_decision_threshold,state
1013,0.7156549520766773,2025-11-26 23:35:45.357685,2025-11-26 23:35:46.043008,0 days 00:00:00.685323,1.6095839678074548,gbtree,0.7535332117138611,6.007290223528521,lossguide,0.07975813125307345,0.027056488489071048,10,10,20.18618188683695,400,,0.9100148389719949,0.2734295820753378,0.08946886322827302,oversample,0.5827995381855121,,6.0,0.7022769539559515,,,,0.42109668084801144,0.03950261479001588,0.5567616463138851,0.5572139303482587,0.715281812899477,0.7156549520766773,0.9100148389719949,0.2734295820753378,0.08,0.5002407883149242,0.4960109991264082,0.5567616463138851,0.5572139303482587,1.0,1.0,oversample,0.436291218355742,0.4085155141079554,0.5827995381855121,0.03950261479001588,COMPLETE
1014,0.4171066525871172,2025-11-26 23:35:46.226889,2025-11-26 23:35:48.359290,0 days 00:00:02.132401,1.1370943145661376,gbtree,0.5516887439581324,4.540722458444826,depthwise,0.010681060542535115,0.09367486435447336,10,12,2.221756618264114,900,,0.6339720904985036,0.585224502483182,0.03754448700105145,oversample,0.8646009752725263,,5.0,0.645996283609349,,,,0.7680323043239483,0.5709239814704421,0.5070104025327906,0.5006784260515604,0.4189765458422175,0.4171066525871172,0.6339720904985036,0.585224502483182,0.05,0.595911881966859,0.5930390429883949,0.6093023255813953,0.5966767371601208,0.3192526401299756,0.32061688311688313,oversample,0.5598347950065485,0.5618072874520781,0.8646009752725263,0.5709239814704421,COMPLETE
1015,0.7156549520766773,2025-11-26 23:35:48.546145,2025-11-26 23:35:49.156084,0 days 00:00:00.609939,0.0668537130670417,gbtree,0.8246256266386871,4.6583526080671485,lossguide,0.00080258796355708,0.0156307955427719,2,7,0.20220661543104945,200,,0.7241691941224984,0.9033558728628777,0.09822226111449812,none,0.7577394054401985,0.7900803036297852,5.0,0.692948098692069,,,,0.31482413180823565,0.16378405052524447,0.5567616463138851,0.5572139303482587,0.715281812899477,0.7156549520766773,0.7241691941224984,0.9033558728628777,0.1,0.44744752630786977,0.44832460231150606,0.5567616463138851,0.5572139303482587,1.0,1.0,none,0.33819194615295345,0.33780369910987884,0.7577394054401985,0.16378405052524447,COMPLETE
1016,0.696434521826058,2025-11-26 23:35:49.339259,2025-11-26 23:35:53.815242,0 days 00:00:04.475983,0.01010663873206741,gbtree,0.9581794658820937,2.1960140898366554,lossguide,0.03817246640468858,0.22448964425714454,7,7,2.858324039261442,800,,0.894878134745928,0.23623375900103008,0.08531875590959823,oversample,0.6123105977733946,,11.0,0.6738446648998262,,,,0.6443617028331966,0.211376978851103,0.5879692446856626,0.5879692446856626,0.6978441127694859,0.696434521826058,0.894878134745928,0.23623375900103008,0.08,0.6249236774212497,0.604857778920944,0.5896860986547086,0.5907292255511588,0.8545897644191714,0.8482142857142857,oversample,0.5927672043634674,0.5880043411644535,0.6123105977733946,0.211376978851103,COMPLETE
1017,0.0,2025-11-26 23:35:53.997360,2025-11-26 23:35:55.175767,0 days 00:00:01.178407,1.1113533151319286,gbtree,0.5153437059005057,2.7532068398535334,depthwise,0.0001154893625577359,0.00013452197058561575,10,7,2.010683348866593,600,,0.7489991132827272,0.6110389586578774,0.05775138424323292,oversample,0.9754896563265917,,6.0,0.6679464154083881,,,,0.6993487523398481,0.5690842191091436,0.44323835368611486,0.4427860696517413,0.0,0.0,0.7489991132827272,0.6110389586578774,0.05,0.4877176247210933,0.48490067875208936,0.0,0.0,0.0,0.0,oversample,0.4267540078582205,0.421395987822188,0.9754896563265917,0.5690842191091436,COMPLETE
1018,0.6304071246819338,2025-11-26 23:35:55.348227,2025-11-26 23:36:09.444067,0 days 00:00:14.095840,0.2409842576938966,gbtree,0.7415846961062846,1.3275566486926875,lossguide,0.024866729158959974,0.007592170943614668,7,12,0.7237167284415696,500,,0.9869610946344142,0.16168404788556878,0.0822276157122496,oversample,0.546363175375357,,8.0,0.6395800016386243,,,,0.3786159858037631,0.13402261320901152,0.4690185436454093,0.47444595205789236,0.6268277177368087,0.6304071246819338,0.9869610946344142,0.16168404788556878,0.08,0.48802918008563195,0.4821831117447435,0.5148825065274152,0.518305439330544,0.8009748172217709,0.8043831168831169,oversample,0.36932558563636664,0.3744793255773848,0.546363175375357,0.13402261320901152,COMPLETE
1019,0.7156549520766773,2025-11-26 23:36:09.634299,2025-11-26 23:36:10.532607,0 days 00:00:00.898308,0.02127498258100434,gbtree,0.7914148782732615,4.326681086226011,depthwise,5.625557354350426,0.053862794234795806,4,7,30.09194677749132,700,,0.9729201653374083,0.48503062101160765,0.08610921082853411,oversample,0.9400363163743157,,11.0,0.9060801253789723,,,,0.7088447087673757,0.41928223676561327,0.5567616463138851,0.5572139303482587,0.715281812899477,0.7156549520766773,0.9729201653374083,0.48503062101160765,0.08,0.41073429124424343,0.41230371553365575,0.5567616463138851,0.5572139303482587,1.0,1.0,oversample,0.2563657388219301,0.26033638220819016,0.9400363163743157,0.41928223676561327,COMPLETE
1020,0.7156549520766773,2025-11-26 23:36:10.713494,2025-11-26 23:36:11.820933,0 days 00:00:01.107439,8.866198098230043,gbtree,0.7979044234802283,0.6490289889169591,lossguide,0.5940238266628793,0.030055603123825617,6,11,7.184185081457871,1000,,0.6983612534976847,0.14689858865546002,0.05088121003316627,oversample,0.5883233609283263,,7.0,0.81458003570873,,,,0.678651596216583,0.3387798158295656,0.5567616463138851,0.5572139303482587,0.715281812899477,0.7156549520766773,0.6983612534976847,0.14689858865546002,0.05,0.3920558830681569,0.39919931600510505,0.5567616463138851,0.5572139303482587,1.0,1.0,oversample,0.19966884397950896,0.22247472905031637,0.5883233609283263,0.3387798158295656,COMPLETE
1021,0.7156549520766773,2025-11-26 23:36:11.995777,2025-11-26 23:37:31.685575,0 days 00:01:19.689798,0.009695374696212298,dart,0.6050759971423378,1.467529930897911,lossguide,0.03173997058545675,0.011224060180547555,2,12,19.475907608479154,600,tree,0.9316729359635052,0.0680375145954052,0.07690881953345172,oversample,0.5812933639310689,,6.0,0.6539860859264177,0.3493938419908061,weighted,0.4376084899701329,0.7381697236838634,0.7120728017478706,0.5567616463138851,0.5572139303482587,0.715281812899477,0.7156549520766773,0.9316729359635052,0.0680375145954052,0.08,0.7881374743294614,0.7940287387592178,0.5567616463138851,0.5572139303482587,1.0,1.0,oversample,0.7671475820222484,0.7782639985142539,0.5812933639310689,0.7120728017478706,COMPLETE
1022,0.7155322862129145,2025-11-26 23:37:31.860516,2025-11-26 23:37:53.084537,0 days 00:00:21.224021,0.009332806765337523,dart,0.7829084155626518,0.39815638871122194,lossguide,0.00038476140049010696,0.03482431219447493,6,6,0.3046744198763455,200,tree,0.8151547445975786,0.6398348221312683,0.06713383575246064,oversample,0.5206219693525145,,7.0,0.7182629193487663,0.2914143973768251,weighted,0.2743287406785011,0.3538367487955339,0.18870204622250858,0.5572139303482587,0.5576662143826323,0.7153242221576039,0.7155322862129145,0.8151547445975786,0.6398348221312683,0.08,0.6735887897823329,0.6451619902020633,0.5570652173913043,0.557570262919311,0.9991876523151909,0.9983766233766234,oversample,0.6089855601054395,0.5986964070148442,0.5206219693525145,0.18870204622250858,COMPLETE
1023,0.7156549520766773,2025-11-26 23:37:53.264685,2025-11-26 23:38:05.885207,0 days 00:00:12.620522,2.2928095677851226,dart,0.6916698130394436,3.325062002545149,lossguide,0.08247857236898927,0.045452341451636444,10,9,12.227159295101933,300,forest,0.9999851326964987,0.06612271447067294,0.08288299739220825,oversample,0.5781230234632084,,9.0,0.683681496176897,0.0012018296673588433,weighted,0.18820456020899287,0.6286705461794508,0.02250182050020994,0.5567616463138851,0.5572139303482587,0.715281812899477,0.7156549520766773,0.9999851326964987,0.06612271447067294,0.08,0.7608443030461586,0.7799540533297085,0.5567616463138851,0.5572139303482587,1.0,1.0,oversample,0.7375424824682106,0.7572973183609037,0.5781230234632084,0.02250182050020994,COMPLETE
1024,0.7156549520766773,2025-11-26 23:38:06.076050,2025-11-26 23:38:27.867429,0 days 00:00:21.791379,0.013203374730468414,dart,0.879675041144286,3.2276077888786356,lossguide,0.0008524848099619404,0.0022583513783538548,1,7,3.2218747209486582,400,forest,0.7973759951711812,0.7533762258777437,0.06979487758253104,none,0.5206916648950126,1.1733450580829063,8.0,0.7314057973888657,0.12931747255820675,weighted,0.5358009098933381,0.2737148598181161,0.3506826316677451,0.5567616463138851,0.5572139303482587,0.715281812899477,0.7156549520766773,0.7973759951711812,0.7533762258777437,0.08,0.5096877986958792,0.5234703507919374,0.5567616463138851,0.5572139303482587,1.0,1.0,none,0.44563487458346457,0.46085904646936315,0.5206916648950126,0.3506826316677451,COMPLETE
1025,0.29585087191822007,2025-11-26 23:38:28.056038,2025-11-26 23:38:28.983115,0 days 00:00:00.927077,0.00048427482091580244,gbtree,0.36496271037848577,7.803851509650864,lossguide,0.00024419175621649,0.016592176070534287,8,11,1.021122661558247,800,,0.5583020425780254,0.3376788966938007,0.006273557877445525,none,0.8457027647586988,0.6917111782071869,7.0,0.7209533014125663,,,,0.5004852793857759,0.4656991813928485,0.43735866123925826,0.4703753957485301,0.2311495673671199,0.29585087191822007,0.5583020425780254,0.3376788966938007,0.0,0.5182098556936889,0.5485298498484027,0.48320413436692505,0.5707656612529002,0.15190901705930138,0.19967532467532467,none,0.43849367529302546,0.4715647924598384,0.8457027647586988,0.4656991813928485,COMPLETE
1026,0.26045963464938127,2025-11-26 23:38:29.168136,2025-11-26 23:38:52.096201,0 days 00:00:22.928065,0.017163504327074513,dart,0.7666071593866565,0.8968495854899896,lossguide,0.0003765931258767433,0.014480398644136574,6,4,1.83759347252587,400,forest,0.847403216766804,0.8280214825768064,0.08691417276164061,undersample,0.6873632752577057,,7.0,0.7556588452607694,0.06677070483867001,uniform,0.25396431230369276,0.2565444292471154,0.542621481597573,0.44821347806422435,0.4323835368611488,0.29069767441860467,0.26045963464938127,0.847403216766804,0.8280214825768064,0.08,0.5316973708802801,0.5214742275728469,0.5112474437627812,0.4752688172043011,0.20308692120227456,0.1793831168831169,undersample,0.5007447901987765,0.49394715983709847,0.6873632752577057,0.542621481597573,COMPLETE
1027,0.7156549520766773,2025-11-26 23:38:52.276609,2025-11-26 23:38:53.034480,0 days 00:00:00.757871,7.055637654009387,gbtree,0.9086299178084573,2.9460202099272212,depthwise,0.11829946385804399,0.05584856939177655,4,4,1.2452521822104305,400,,0.8613738618804424,0.8172711797573267,0.09942039299026491,none,0.8519670632011587,0.892775643838101,8.0,0.7213476215514911,,,,0.27906570682501525,0.252145880185757,0.5567616463138851,0.5572139303482587,0.715281812899477,0.7156549520766773,0.8613738618804424,0.8172711797573267,0.1,0.5934780036856748,0.5818080071339773,0.5567616463138851,0.5572139303482587,1.0,1.0,none,0.5590004807772012,0.5391028149582797,0.8519670632011587,0.252145880185757,COMPLETE
1028,0.7156549520766773,2025-11-26 23:38:53.210969,2025-11-26 23:40:40.300434,0 days 00:01:47.089465,13.52054302250233,dart,0.23343979389859842,1.336898992632642,lossguide,0.00032211497982185974,0.07162049772006192,8,9,0.3179463758452043,1000,tree,0.8884902439601963,0.6761134136237154,0.04227161687826639,oversample,0.7403522526362144,,5.0,0.6389300075542673,0.4101960486465296,weighted,0.285110304097933,0.6864038615355333,0.2616651868064575,0.5567616463138851,0.5572139303482587,0.715281812899477,0.7156549520766773,0.8884902439601963,0.6761134136237154,0.05,0.6902074153164539,0.7038183646915881,0.5567616463138851,0.5572139303482587,1.0,1.0,oversample,0.6707907127107545,0.6733717316901688,0.7403522526362144,0.2616651868064575,COMPLETE
1029,0.6809037449705974,2025-11-26 23:40:40.479569,2025-11-26 23:40:47.752824,0 days 00:00:07.273255,0.326215659077383,gbtree,0.7933720857917095,2.140899704777626,lossguide,0.00031840855989014635,0.1489409105914265,4,7,0.3003922891922624,600,,0.7313355828256525,0.5788874757218969,0.08008890006390998,none,0.7587717973516038,1.3581091528791034,9.0,0.689776688557076,,,,0.2048608386656915,0.23162063399576774,0.532790592492085,0.5336951605608322,0.6806800618238021,0.6809037449705974,0.7313355828256525,0.5788874757218969,0.08,0.5318174334109412,0.5407522529524948,0.5494011976047904,0.5502751375687844,0.8943948009748173,0.8928571428571429,none,0.4569397702216549,0.4854082651260895,0.7587717973516038,0.23162063399576774,COMPLETE
1030,0.7156549520766773,2025-11-26 23:40:47.931803,2025-11-26 23:42:20.305300,0 days 00:01:32.373497,0.00029778079457217285,dart,0.6865648596840634,1.305495619753362,lossguide,20.91653465818735,0.00012396288120411204,3,12,59.91907792831522,900,tree,0.63774948875316,0.22244340960734124,0.04323772409882834,oversample,0.539874785415019,,7.0,0.9217729642982472,0.19219688168118354,weighted,0.12415003735037493,0.8760463354178941,0.31933725948590247,0.5567616463138851,0.5572139303482587,0.715281812899477,0.7156549520766773,0.63774948875316,0.22244340960734124,0.05,0.4757147566610407,0.4818982038044847,0.5567616463138851,0.5572139303482587,1.0,1.0,oversample,0.35457898837845453,0.36310615457065915,0.539874785415019,0.31933725948590247,COMPLETE
1031,0.7156549520766773,2025-11-26 23:42:20.505059,2025-11-26 23:42:21.515691,0 days 00:00:01.010632,38.789535222337996,gbtree,0.452619647145267,0.3460301346834912,depthwise,0.00016221296618320152,0.000562705947989351,10,8,9.489472683847954,800,,0.7822667540795173,0.5868902124980652,0.0370644665341027,undersample,0.9714905734237829,,9.0,0.7569145713399764,,,,0.5841618592041967,0.3679561239657101,0.5567616463138851,0.5572139303482587,0.715281812899477,0.7156549520766773,0.7822667540795173,0.5868902124980652,0.05,0.44799579898551023,0.4439786541054715,0.5567616463138851,0.5572139303482587,1.0,1.0,undersample,0.3193732488933835,0.3120966431423531,0.9714905734237829,0.3679561239657101,COMPLETE
1032,0.685625,2025-11-26 23:42:21.719300,2025-11-26 23:42:23.523625,0 days 00:00:01.804325,0.4345608369336136,gbtree,0.92342579237833,2.1592554456119952,lossguide,1.8019630238083368,0.004241546395924095,7,7,11.348177745201808,500,,0.872780826374628,0.23231498336423353,0.07669528998464671,undersample,0.5501257626783934,,11.0,0.6117926939878834,,,,0.6552155970371569,0.3715320536487259,0.5554047942107644,0.5450022614201718,0.6913657770800627,0.685625,0.872780826374628,0.23231498336423353,0.08,0.7203513468546269,0.7052355635076819,0.5634595701125895,0.5574186991869918,0.8943948009748173,0.890422077922078,undersample,0.7065008537939953,0.6955812318427232,0.5501257626783934,0.3715320536487259,COMPLETE
1033,0.67360454115421,2025-11-26 23:42:23.744912,2025-11-26 23:42:28.929539,0 days 00:00:05.184627,0.09077076226776573,gbtree,0.6835631060691263,0.6240245386924299,lossguide,0.001078915259849255,0.02682987899048823,10,6,7.994476451548553,600,,0.8651398074533232,0.2072607060952206,0.08825763597109298,oversample,0.6020152939806307,,5.0,0.6163238628080552,,,,0.6160004648893539,0.18644017556976708,0.5359565807327001,0.5318860244233379,0.6753164556962026,0.67360454115421,0.8651398074533232,0.2072607060952206,0.08,0.544309021800262,0.5275790318717822,0.5531363400725765,0.5507993811242908,0.8667749796913079,0.8668831168831169,oversample,0.5021050581077272,0.4792675404268867,0.6020152939806307,0.18644017556976708,COMPLETE
1034,0.7156549520766773,2025-11-26 23:42:29.115938,2025-11-26 23:45:55.864155,0 days 00:03:26.748217,0.06209674869288712,dart,0.7191940158773501,3.4235872544847776,lossguide,0.41978800445530157,0.0018259148148655007,6,11,13.217679168219938,900,forest,0.7770107788274081,0.1341357331262542,0.08091471877592055,oversample,0.6460065278079822,,5.0,0.604752235404814,0.19548833064876964,weighted,0.7207693240600219,0.4697787148087774,0.5062085615725782,0.5567616463138851,0.5572139303482587,0.715281812899477,0.7156549520766773,0.7770107788274081,0.1341357331262542,0.08,0.5772849248735786,0.5700517967035112,0.5567616463138851,0.5572139303482587,1.0,1.0,oversample,0.580739485071039,0.5553224865022618,0.6460065278079822,0.5062085615725782,COMPLETE
1035,0.7156549520766773,2025-11-26 23:45:56.056979,2025-11-26 23:46:36.724549,0 days 00:00:40.667570,0.13879087386096603,dart,0.52758390933358,2.5834788282830763,lossguide,0.12728037741904868,0.008704873018097074,6,10,37.21773115831631,600,tree,0.9466274139754481,0.1804330106117953,0.0895001724601272,none,0.6278216752961983,0.6112647460949167,5.0,0.6326810358980344,0.2165989396066801,uniform,0.322369737800948,0.5569762222505363,0.363107901528834,0.5567616463138851,0.5572139303482587,0.715281812899477,0.7156549520766773,0.9466274139754481,0.1804330106117953,0.08,0.5322067970191358,0.5312465884754072,0.5567616463138851,0.5572139303482587,1.0,1.0,none,0.4666759230093337,0.4624144369420161,0.6278216752961983,0.363107901528834,COMPLETE
1036,0.7156549520766773,2025-11-26 23:46:36.904286,2025-11-26 23:46:41.988919,0 days 00:00:05.084633,0.03218646414094012,dart,0.6164206541507156,9.790811036687666,depthwise,0.0009675904530403122,0.005640389433095716,4,6,0.21823972409538836,200,tree,0.7834251476711064,0.6864029140502894,0.014461574463588072,oversample,0.8020778499360026,,11.0,0.8035792144656253,0.24058007268243314,weighted,0.3053337576688346,0.3899293967405572,0.3168428763092015,0.5567616463138851,0.5572139303482587,0.715281812899477,0.7156549520766773,0.7834251476711064,0.6864029140502894,0.02,0.44123883227888194,0.43879596056160025,0.5567616463138851,0.5572139303482587,1.0,1.0,oversample,0.26077521179064644,0.2549285813777642,0.8020778499360026,0.3168428763092015,COMPLETE
1037,0.699578567128236,2025-11-26 23:46:42.178812,2025-11-26 23:49:41.217189,0 days 00:02:59.038377,0.25232380118579545,dart,0.998940876916366,2.38197376083073,lossguide,0.3466050986617139,0.03746439165443243,8,9,3.4346628204497662,700,tree,0.9916710172765443,0.22842565357398856,0.08734356036141659,none,0.5929186575248184,0.5021658232534105,9.0,0.6420176295432867,0.33322462305356526,uniform,0.3164379786471271,0.5675490669776329,0.05327605638476038,0.5431931252826775,0.5486205336951605,0.6933819064966606,0.699578567128236,0.9916710172765443,0.22842565357398856,0.08,0.4570671899096586,0.46512180980328255,0.553562772661173,0.5559808612440191,0.9277010560519903,0.9431818181818182,none,0.3804091579767569,0.4002842152740007,0.5929186575248184,0.05327605638476038,COMPLETE
1038,0.7156549520766773,2025-11-26 23:49:41.396059,2025-11-26 23:50:10.591864,0 days 00:00:29.195805,0.012178575294056419,dart,0.8297882586961488,3.127992848893296,lossguide,0.01320591498827051,0.025983094883264644,10,12,2.719445138839739,500,tree,0.8789687079188147,0.10716419238373329,0.0830119886641596,oversample,0.6701227593808727,,6.0,0.6592380226311819,0.1681722591776056,weighted,0.00784395304868532,0.628261748161934,0.4854075975945915,0.5567616463138851,0.5572139303482587,0.715281812899477,0.7156549520766773,0.8789687079188147,0.10716419238373329,0.08,0.4842659897810502,0.5125208826300822,0.5567616463138851,0.5572139303482587,1.0,1.0,oversample,0.42738233392463404,0.4695832448960641,0.6701227593808727,0.4854075975945915,COMPLETE
1039,0.715281812899477,2025-11-26 23:50:10.783409,2025-11-26 23:51:28.240294,0 days 00:01:17.456885,2.3627524824890247,dart,0.9643659574746832,0.063883434909076,depthwise,0.032210384363621405,0.08193510534998015,10,9,0.8413062676946791,400,tree,0.9862005549565809,0.3542794460176273,0.08301291417541377,oversample,0.6279659066348613,,7.0,0.6084746820612081,0.2946572630354557,weighted,0.16789026834280274,0.5903985292332017,0.03879721403999518,0.5554047942107644,0.5567616463138851,0.7141610933410876,0.715281812899477,0.9862005549565809,0.3542794460176273,0.08,0.5854770336375803,0.6168639726610232,0.5561594202898551,0.5570135746606335,0.9975629569455727,0.9991883116883117,oversample,0.5139251313848041,0.5568538330923418,0.6279659066348613,0.03879721403999518,COMPLETE
1040,0.7156549520766773,2025-11-26 23:51:28.417295,2025-11-26 23:52:37.704969,0 days 00:01:09.287674,89.5448275900775,dart,0.6606282340935765,5.066909150822022,lossguide,17.276446401958268,0.00046758289423841695,8,7,2.365711451252708,800,tree,0.71147904420485,0.3424938777725249,0.09926570618709084,undersample,0.9703726498295421,,9.0,0.9279302835574958,0.3236301208929398,weighted,0.4119828294393366,0.6343362743767007,0.42579706921738236,0.5567616463138851,0.5572139303482587,0.715281812899477,0.7156549520766773,0.71147904420485,0.3424938777725249,0.1,0.5567616463138851,0.5572139303482587,0.5567616463138851,0.5572139303482587,1.0,1.0,undersample,0.5,0.5,0.9703726498295421,0.42579706921738236,COMPLETE
