number,value,datetime_start,datetime_complete,duration,params_alpha,params_booster,params_colsample_bytree,params_gamma,params_grow_policy,params_lambda,params_learning_rate,params_max_delta_step,params_max_depth,params_min_child_weight,params_n_estimators,params_normalize_type,params_params_feature_fraction,params_params_labeled_ratio,params_params_missing_rate,params_params_resampling,params_params_sample_rows,params_params_scale_pos_weight,params_params_selftrain_max_iter,params_params_selftrain_threshold,params_rate_drop,params_sample_type,params_skip_drop,params_subsample,params_user_attrs_decision_threshold,user_attrs_acc_test,user_attrs_acc_val,user_attrs_f1_test,user_attrs_f1_val,user_attrs_feature_fraction,user_attrs_labeled_ratio,user_attrs_missing_rate,user_attrs_pr_auc_test,user_attrs_pr_auc_val,user_attrs_prec_test,user_attrs_prec_val,user_attrs_rec_test,user_attrs_rec_val,user_attrs_resampling_strategy,user_attrs_roc_auc_test,user_attrs_roc_auc_val,user_attrs_sample_rows,user_attrs_user_attrs_decision_threshold,state
1099,0.7156549520766773,2025-11-27 00:14:36.574533,2025-11-27 00:14:37.376362,0 days 00:00:00.801829,0.009097352657910146,gbtree,0.7795355703416292,3.384713292211665,lossguide,0.48556885783599035,0.2074862541284903,7,11,45.27023912193351,600,,0.9986120345604763,0.4775949763406462,0.0769938578940612,oversample,0.5186944055549407,,6.0,0.8051714933588857,,,,0.7793047138875593,0.05973183838572707,0.5567616463138851,0.5572139303482587,0.715281812899477,0.7156549520766773,0.9986120345604763,0.4775949763406462,0.08,0.39863949350318867,0.39960655866049744,0.5567616463138851,0.5572139303482587,1.0,1.0,oversample,0.20736335151444818,0.2024142545401483,0.5186944055549407,0.05973183838572707,COMPLETE
1100,0.5961603233411923,2025-11-27 00:14:37.554581,2025-11-27 00:14:39.543353,0 days 00:00:01.988772,0.41895365905707654,gbtree,0.919844626386726,4.692053966817207,lossguide,3.1095455333590034,0.046727431333186964,8,11,13.044932635446344,700,,0.8838617820459109,0.15630181529523896,0.09984267776663895,oversample,0.6866449555008847,,5.0,0.6409241983906444,,,,0.4776368661933488,0.7996787603268716,0.4531886024423338,0.4577114427860697,0.5925176946410515,0.5961603233411923,0.8838617820459109,0.15630181529523896,0.1,0.5317474014046613,0.5204864044158485,0.506336405529954,0.5094991364421416,0.7140536149471974,0.7183441558441559,oversample,0.42928679188978597,0.4189849667696961,0.6866449555008847,0.7996787603268716,COMPLETE
1101,0.7094430992736077,2025-11-27 00:14:39.720299,2025-11-27 00:14:42.965706,0 days 00:00:03.245407,0.12868257582747453,gbtree,0.7848785439491079,0.6725650333655137,lossguide,0.6296219315656997,0.11673127397489709,10,11,7.623681287304766,400,,0.9257373399447857,0.18142728598487828,0.07608468336901669,oversample,0.662345095022676,,5.0,0.6371396382920006,,,,0.7959163029164408,0.020815758538029666,0.5753052917232022,0.5658073270013568,0.7145028884159319,0.7094430992736077,0.9257373399447857,0.18142728598487828,0.08,0.6181712629020596,0.601059509742504,0.5709426627793974,0.5656370656370656,0.9545085296506904,0.9512987012987013,oversample,0.5760630978630282,0.5666711990767149,0.662345095022676,0.020815758538029666,COMPLETE
1102,0.6160807518273581,2025-11-27 00:14:43.139067,2025-11-27 00:14:49.193271,0 days 00:00:06.054204,0.2779949621411104,gbtree,0.8897723307294017,0.2161458994665364,lossguide,0.8296638358267665,0.1096279034889273,9,12,26.29477523617735,600,,0.9733246888444382,0.5561464336200107,0.06961233152400778,oversample,0.7385986826041998,,5.0,0.6560768844972897,,,,0.7261431499230359,0.41989180524752157,0.4993215739484396,0.501130710085934,0.6194568580268134,0.6160807518273581,0.9733246888444382,0.5561464336200107,0.08,0.5259915427359798,0.523915503982799,0.5369487485101311,0.5393053016453382,0.7319252640129975,0.7183441558441559,oversample,0.4476806644672491,0.4497831075972036,0.7385986826041998,0.41989180524752157,COMPLETE
1103,0.08433734939759036,2025-11-27 00:14:49.362531,2025-11-27 00:14:50.280870,0 days 00:00:00.918339,0.06061237483136214,gbtree,0.9717237123579867,1.096830259762977,lossguide,0.020771420898203618,0.02701507980076962,5,3,0.2608212247456621,200,,0.9960955449020146,0.9108898603036415,0.09968245664825448,undersample,0.6465227859899587,,7.0,0.7117877766824879,,,,0.24718656680473583,0.5987727979756405,0.45635459068294887,0.4500226142017187,0.09351432880844646,0.08433734939759036,0.9960955449020146,0.9108898603036415,0.1,0.5786452319047095,0.5721549658700592,0.6526315789473685,0.5833333333333334,0.050365556458164096,0.045454545454545456,undersample,0.5307067424857839,0.5282200562461032,0.6465227859899587,0.5987727979756405,COMPLETE
1104,0.7156549520766773,2025-11-27 00:14:50.448333,2025-11-27 00:15:01.944469,0 days 00:00:11.496136,0.03937786311616938,dart,0.8375406204860368,4.067671311267745,lossguide,0.006562791164161502,0.0011726271439969776,5,3,0.1740772232556291,300,tree,0.9609478837647872,0.5498880913078961,0.09531032551444353,oversample,0.9038721452586687,,5.0,0.8004437272768398,0.18389863459289946,weighted,0.5326812399476857,0.2053152107131477,0.28655335792477016,0.5567616463138851,0.5572139303482587,0.715281812899477,0.7156549520766773,0.9609478837647872,0.5498880913078961,0.1,0.5063589013147172,0.5138422246364713,0.5567616463138851,0.5572139303482587,1.0,1.0,oversample,0.41750650707074055,0.4340994488147195,0.9038721452586687,0.28655335792477016,COMPLETE
1105,0.0,2025-11-27 00:15:02.117872,2025-11-27 00:15:02.923527,0 days 00:00:00.805655,0.20070338693760362,gbtree,0.8665898507826109,5.92429920181218,depthwise,0.059427718610808505,0.05119723878869091,5,9,96.46072674583137,400,,0.9829643422930543,0.5239527769420927,0.08461625335700947,oversample,0.7864495771780301,,11.0,0.9024484298567322,,,,0.572695555766225,0.8321382210706483,0.44323835368611486,0.4427860696517413,0.0,0.0,0.9829643422930543,0.5239527769420927,0.08,0.4277605264818638,0.42156311490566745,0.0,0.0,0.0,0.0,oversample,0.27405378073243913,0.2541952429592879,0.7864495771780301,0.8321382210706483,COMPLETE
1106,0.6735483870967742,2025-11-27 00:15:03.095394,2025-11-27 00:15:05.931117,0 days 00:00:02.835723,0.0010689072301004615,gbtree,0.9588310120649599,2.0306370497212662,lossguide,8.090019414548141,0.22953012973261547,9,10,18.23989428241931,800,,0.9889612970406707,0.4473548130439545,0.09479159677792717,oversample,0.6277525500562868,,7.0,0.7387316620295712,,,,0.6839762796395829,0.38613651755747863,0.5336951605608322,0.5422885572139303,0.6677408959071865,0.6735483870967742,0.9889612970406707,0.4473548130439545,0.1,0.526208405732755,0.522734152381143,0.5534188034188035,0.5588865096359743,0.8415922014622258,0.8474025974025974,oversample,0.4502403886006068,0.4514529137869281,0.6277525500562868,0.38613651755747863,COMPLETE
1107,0.5476104922745239,2025-11-27 00:15:06.121060,2025-11-27 00:15:07.601307,0 days 00:00:01.480247,0.008328175869626359,gbtree,0.9423265723322954,0.8704091760855034,lossguide,31.268421199266708,0.21363184398567658,6,12,3.7721618892120308,300,,0.9714045301321041,0.24338728246543218,0.09493874752565568,oversample,0.5776365816231299,,5.0,0.7592338245083363,,,,0.7257951744207948,0.3661083574264312,0.41745816372682043,0.43057440072365444,0.5285505124450952,0.5476104922745239,0.9714045301321041,0.24338728246543218,0.1,0.4662313651632163,0.4692465951585945,0.4810126582278481,0.4912959381044487,0.586515028432169,0.6185064935064936,oversample,0.3587625789552214,0.36718117811708206,0.5776365816231299,0.3661083574264312,COMPLETE
1108,0.7156549520766773,2025-11-27 00:15:07.777269,2025-11-27 00:16:06.449569,0 days 00:00:58.672300,96.7363873312593,dart,0.8347233131861026,5.87136274775965,lossguide,4.541619088967278,0.012773115921688812,10,7,93.40524751208484,700,forest,0.879618449453452,0.09595877847388881,0.08566585549350789,undersample,0.878633885868574,,9.0,0.9307493294831508,0.22580919095382523,weighted,0.6025526752801039,0.46643065771258285,0.47151634144120097,0.5567616463138851,0.5572139303482587,0.715281812899477,0.7156549520766773,0.879618449453452,0.09595877847388881,0.08,0.5567616463138851,0.5572139303482587,0.5567616463138851,0.5572139303482587,1.0,1.0,undersample,0.5,0.5,0.878633885868574,0.47151634144120097,COMPLETE
1109,0.6590257879656161,2025-11-27 00:16:06.621843,2025-11-27 00:16:09.659814,0 days 00:00:03.037971,0.004318378866899775,gbtree,0.9088056609957109,1.5400585576346941,lossguide,4.02848368529393,0.2581184761087947,10,11,0.26897375814373237,500,,0.9015651525063031,0.6142972507978404,0.079630143786825,oversample,0.5816687430268352,,5.0,0.6137666959652527,,,,0.43965166835980357,0.237267115149304,0.5237449118046132,0.5156037991858887,0.6621751684311838,0.6590257879656161,0.9015651525063031,0.6142972507978404,0.08,0.547040761081286,0.5341822745462208,0.5471898197242842,0.5421686746987951,0.8383428107229894,0.8400974025974026,oversample,0.4780749017722442,0.4653171139381558,0.5816687430268352,0.237267115149304,COMPLETE
1110,0.7156549520766773,2025-11-27 00:16:09.835496,2025-11-27 00:16:12.127398,0 days 00:00:02.291902,0.0018817952018109138,gbtree,0.7758492476046852,4.504336774961791,lossguide,0.021244285021845076,0.13572200962571696,9,11,5.525107289359934,700,,0.9711155618081745,0.5074939226669635,0.058941759646377344,oversample,0.7565469961621443,,7.0,0.676588157424295,,,,0.6300647334877778,0.0864160444379608,0.5567616463138851,0.5572139303482587,0.715281812899477,0.7156549520766773,0.9711155618081745,0.5074939226669635,0.05,0.5503612167829192,0.5282029987095486,0.5567616463138851,0.5572139303482587,1.0,1.0,oversample,0.5039887929176545,0.47522153535943124,0.7565469961621443,0.0864160444379608,COMPLETE
1111,0.7156549520766773,2025-11-27 00:16:12.301852,2025-11-27 00:16:13.311014,0 days 00:00:01.009162,0.8869895118492406,gbtree,0.4234004084420185,4.482753759690379,depthwise,0.0002465075037609299,0.0030300832403695526,9,6,1.6781587890133507,800,,0.7620125405893572,0.48304786729357535,8.801341015872541e-05,oversample,0.8328063152545478,,6.0,0.7973465520696739,,,,0.6028069693705289,0.12026140884812858,0.5567616463138851,0.5572139303482587,0.715281812899477,0.7156549520766773,0.7620125405893572,0.48304786729357535,0.0,0.5672538257684188,0.5781115998257045,0.5567616463138851,0.5572139303482587,1.0,1.0,oversample,0.5367375951192825,0.5401669640369845,0.8328063152545478,0.12026140884812858,COMPLETE
1112,0.6800880780119535,2025-11-27 00:16:13.482813,2025-11-27 00:16:16.645014,0 days 00:00:03.162201,0.0012868121065754943,gbtree,0.8691211885755874,0.512704578769505,depthwise,15.413690272715247,0.13426952919070367,10,11,5.498809005452949,500,,0.8374428132921306,0.6826430040814542,0.09060191950381664,oversample,0.6639272182925627,,7.0,0.7200089497787602,,,,0.8744820706880113,0.358742314437496,0.5373134328358209,0.5400271370420624,0.679410842995926,0.6800880780119535,0.8374428132921306,0.6826430040814542,0.1,0.5836158215065703,0.5887472761349664,0.5530612244897959,0.5552131484334875,0.8805848903330625,0.877435064935065,oversample,0.5154545002403885,0.5188483311887295,0.6639272182925627,0.358742314437496,COMPLETE
1113,0.7075833579226911,2025-11-27 00:16:16.823654,2025-11-27 00:16:17.815937,0 days 00:00:00.992283,0.343036732467105,gbtree,0.3313088943600203,4.107301298877964,depthwise,0.006119351004256633,0.015282866570136009,5,6,1.5979879699111261,800,,0.8334940437056636,0.5926433597906848,0.003224882688914831,oversample,0.8797578536866529,,5.0,0.72482034534195,,,,0.6051756627581606,0.4989932334128291,0.55359565807327,0.5517865219357757,0.70859167404783,0.7075833579226911,0.8334940437056636,0.5926433597906848,0.0,0.4831111707069103,0.49364398225032424,0.5565862708719852,0.5558646267964766,0.974817221770918,0.9732142857142857,oversample,0.3964882541156186,0.40625331639759626,0.8797578536866529,0.4989932334128291,COMPLETE
1114,0.6108202443280978,2025-11-27 00:16:17.988340,2025-11-27 00:17:20.943926,0 days 00:01:02.955586,0.0003001028924820675,gbtree,0.5236124989505992,0.005049499243359179,lossguide,0.0002796610094229796,0.027165699292199492,5,12,0.1954537747897258,300,,0.8614100590950744,0.5376087601276894,0.06694661456807813,undersample,0.8457689070666561,,10.0,0.6874551178072802,,,,0.34910224382560623,0.18584626024269263,0.5042966983265491,0.49570330167345095,0.606038820992092,0.6108202443280978,0.8614100590950744,0.5376087601276894,0.08,0.5376270170106149,0.5314457611631949,0.5435203094777563,0.5358236374770361,0.6848090982940699,0.7102272727272727,undersample,0.46873704802798455,0.4565361222026186,0.8457689070666561,0.18584626024269263,COMPLETE
1115,0.7156549520766773,2025-11-27 00:17:21.140212,2025-11-27 00:17:22.035823,0 days 00:00:00.895611,1.7236366719579959,gbtree,0.39831116131235456,4.391326796785689,depthwise,0.001159631551018768,0.02042899121782934,10,10,0.27434847646407684,700,,0.7016120777229476,0.6738167105707221,0.04452198526369798,oversample,0.9529455642964877,,6.0,0.6855211626887581,,,,0.713444730293539,0.45068302634378926,0.5567616463138851,0.5572139303482587,0.715281812899477,0.7156549520766773,0.7016120777229476,0.6738167105707221,0.05,0.45962906186811936,0.45289645025225556,0.5567616463138851,0.5572139303482587,1.0,1.0,oversample,0.363043982824649,0.3496888389955295,0.9529455642964877,0.45068302634378926,COMPLETE
1116,0.7154896832316188,2025-11-27 00:17:22.223293,2025-11-27 00:18:55.754701,0 days 00:01:33.531408,0.002921573690204743,dart,0.9176503548157822,1.5294418835157404,lossguide,0.19680167670142454,0.14920891818111398,10,9,4.495384336373907,400,forest,0.9426893430662617,0.2056871957155631,0.07784923552254956,oversample,0.5742059532480732,,8.0,0.661011036379193,0.14563885937578902,uniform,0.21091339663715425,0.48240107936930976,0.013389315802186968,0.5549525101763908,0.5572139303482587,0.7136204889406287,0.7154896832316188,0.9426893430662617,0.2056871957155631,0.08,0.5156856194394561,0.5315098278028939,0.5560090702947846,0.5572657311000453,0.9959382615759546,0.9991883116883117,oversample,0.4329125151279033,0.4353078611888622,0.5742059532480732,0.013389315802186968,COMPLETE
1117,0.7156549520766773,2025-11-27 00:18:55.935413,2025-11-27 00:18:56.591385,0 days 00:00:00.655972,0.14529963895968254,gbtree,0.7259658895818931,3.4047861308703253,lossguide,5.683994657099428,0.03570365382809926,8,8,9.742575047716956,300,,0.9154146128163686,0.4568197858275613,0.047586246892193824,none,0.6132353237327883,0.5019878483481598,5.0,0.7325405344020898,,,,0.8038930253357962,0.20304699157570016,0.5567616463138851,0.5572139303482587,0.715281812899477,0.7156549520766773,0.9154146128163686,0.4568197858275613,0.05,0.7251365671892995,0.7228386018057074,0.5567616463138851,0.5572139303482587,1.0,1.0,none,0.7217050183192693,0.7099130440550256,0.6132353237327883,0.20304699157570016,COMPLETE
1118,0.7156549520766773,2025-11-27 00:18:56.771865,2025-11-27 00:18:57.411867,0 days 00:00:00.640002,0.019581666222034697,gbtree,0.8841102983403732,8.68818557029374,depthwise,0.0015510214415527016,0.0014401484294681672,6,5,0.10724281968460724,300,,0.6756740524117772,0.848470567214472,0.04118242779161038,oversample,0.8761159507911356,,10.0,0.7508246450016405,,,,0.5243017405038708,0.40786085706994735,0.5567616463138851,0.5572139303482587,0.715281812899477,0.7156549520766773,0.6756740524117772,0.848470567214472,0.05,0.6014729946386675,0.6105226773397708,0.5567616463138851,0.5572139303482587,1.0,1.0,oversample,0.5751085893333775,0.5909227710491756,0.8761159507911356,0.40786085706994735,COMPLETE
1119,0.715281812899477,2025-11-27 00:18:57.589203,2025-11-27 00:19:05.803330,0 days 00:00:08.214127,0.00017714632453345785,gbtree,0.6076374183162617,1.3036974757980349,lossguide,0.01739197906467085,0.0026591649147154985,3,12,0.24721409069238473,300,,0.9297845817523211,0.657573522787295,0.03848461886488937,undersample,0.726831522179652,,12.0,0.6369408153902443,,,,0.3649345767626044,0.3161103065629596,0.5563093622795116,0.5567616463138851,0.7149084568439407,0.715281812899477,0.9297845817523211,0.657573522787295,0.05,0.551774764553409,0.5272186605699917,0.5565610859728507,0.5570135746606335,0.9991876523151909,0.9991883116883117,undersample,0.4821826456008886,0.4593791040420254,0.726831522179652,0.3161103065629596,COMPLETE
1120,0.7156549520766773,2025-11-27 00:19:05.983302,2025-11-27 00:20:18.943600,0 days 00:01:12.960298,0.006179112853471837,dart,0.9363464477965825,8.610312281600617,lossguide,0.007399801898096438,0.026352920046089388,5,9,76.38348122046455,800,tree,0.9839117057089626,0.5797173900550632,0.052646636218981364,oversample,0.8073668811546657,,12.0,0.7947109445054478,0.292861888118416,weighted,0.5463121983962631,0.7935482310884598,0.12033953694774085,0.5567616463138851,0.5572139303482587,0.715281812899477,0.7156549520766773,0.9839117057089626,0.5797173900550632,0.05,0.5151663678755385,0.5026977027772179,0.5567616463138851,0.5572139303482587,1.0,1.0,oversample,0.4021576949219981,0.38332042701935454,0.8073668811546657,0.12033953694774085,COMPLETE
1121,0.7156549520766773,2025-11-27 00:20:19.112633,2025-11-27 00:20:20.325484,0 days 00:00:01.212851,4.4534828015578105,gbtree,0.9688733887230215,3.9605232142784184,depthwise,0.497315991256887,0.01201074560748963,9,10,4.493733285022447,200,,0.8050082481816745,0.37904277002606046,0.04839675872004201,oversample,0.60949262765416,,6.0,0.6091736656402672,,,,0.5256317541558791,0.2728498002086923,0.5567616463138851,0.5572139303482587,0.715281812899477,0.7156549520766773,0.8050082481816745,0.37904277002606046,0.05,0.5160125813899201,0.49565303673804983,0.5567616463138851,0.5572139303482587,1.0,1.0,oversample,0.42181816674679623,0.38228322367111944,0.60949262765416,0.2728498002086923,COMPLETE
1122,0.6373333333333333,2025-11-27 00:20:20.495896,2025-11-27 00:20:22.833545,0 days 00:00:02.337649,0.08319176834036393,gbtree,0.8255237674943836,0.889046265157793,depthwise,0.8304276489117586,0.3937171976501857,8,11,28.17835744387138,500,,0.8895441252102161,0.4743974814075287,0.09467838572599836,oversample,0.6451470085238576,,5.0,0.737452723732391,,,,0.4793522990232129,0.26413220096516293,0.5210312075983717,0.5079149706015378,0.6499173553719009,0.6373333333333333,0.8895441252102161,0.4743974814075287,0.1,0.49966667497817707,0.48725142036938734,0.5479375696767002,0.5407239819004525,0.7985377741673436,0.775974025974026,oversample,0.43235133208441784,0.4182317299656421,0.6451470085238576,0.26413220096516293,COMPLETE
1123,0.0,2025-11-27 00:20:23.001807,2025-11-27 00:20:39.185640,0 days 00:00:16.183833,0.24861522838581424,dart,0.6239516014237712,3.463918250856823,lossguide,5.662655550072121,0.00969737538510479,8,11,26.351244198620833,400,tree,0.9938913579756665,0.05657922930486326,0.08401712217580327,none,0.5014865958086718,0.8039162220808649,5.0,0.7189479407951809,0.45792964010500253,weighted,0.5147142350812501,0.5885554154148385,0.9134680613145063,0.44323835368611486,0.4427860696517413,0.0,0.0,0.9938913579756665,0.05657922930486326,0.08,0.5567616463138851,0.5572139303482587,0.0,0.0,0.0,0.0,none,0.5,0.5,0.5014865958086718,0.9134680613145063,COMPLETE
1124,0.7156549520766773,2025-11-27 00:20:39.355123,2025-11-27 00:20:40.932435,0 days 00:00:01.577312,0.09769243944812758,gbtree,0.874267574358886,6.527915053451686,depthwise,3.093407497556194,0.14278622249883863,10,7,1.8697764319029848,400,,0.9423584553370643,0.5497285793887142,0.039417439587048714,oversample,0.542098946397326,,8.0,0.6182890628013945,,,,0.6476760187763102,0.12352409898308493,0.5567616463138851,0.5572139303482587,0.715281812899477,0.7156549520766773,0.9423584553370643,0.5497285793887142,0.05,0.49122593066397624,0.4913394706873164,0.5567616463138851,0.5572139303482587,1.0,1.0,oversample,0.43607984217244977,0.43371350304445305,0.542098946397326,0.12352409898308493,COMPLETE
1125,0.7214369846878681,2025-11-27 00:20:41.102063,2025-11-27 00:21:21.396641,0 days 00:00:40.294578,0.05800445900656848,dart,0.8883708867018393,4.552252405938989,lossguide,0.09493774003434877,0.03266581418199254,1,3,0.18716442886335974,300,tree,0.9280454385302009,0.903755581616381,0.07938204151202374,oversample,0.7574166262159365,,6.0,0.6318378863017624,0.30174871684110216,uniform,0.7596990795688052,0.22637293832065863,0.4600548906828986,0.5739484396200815,0.572139303482587,0.7219598583234947,0.7214369846878681,0.9280454385302009,0.903755581616381,0.08,0.5629711391715098,0.5661847363008523,0.5669911914696337,0.5660813308687616,0.9935012185215272,0.9943181818181818,oversample,0.5335126577032112,0.5349390777761565,0.7574166262159365,0.4600548906828986,COMPLETE
1126,0.6838836220987251,2025-11-27 00:21:21.577496,2025-11-27 00:22:08.472691,0 days 00:00:46.895195,2.5950682455605962,dart,0.9898519145458136,0.7262003887563717,lossguide,0.0003786325799766567,0.07900626381106698,2,3,1.3312397573809858,300,tree,0.8686763900290776,0.657691686765946,0.08719410739262848,oversample,0.9330847230267556,,7.0,0.7587822286797191,0.29526672967988576,uniform,0.7845392342773972,0.22725477976581598,0.47889432068572657,0.572139303482587,0.5626413387607417,0.6916558018252934,0.6838836220987251,0.8686763900290776,0.657691686765946,0.08,0.4921734065530309,0.47830088123210823,0.577572128470332,0.5725232621784346,0.8619008935824533,0.849025974025974,oversample,0.45261028863210595,0.42642323202844146,0.9330847230267556,0.47889432068572657,COMPLETE
1127,0.07915194346289753,2025-11-27 00:22:08.645929,2025-11-27 00:22:33.585097,0 days 00:00:24.939168,0.19197537648175889,dart,0.9003276844448662,1.646874207038648,lossguide,1.157328025832324,0.01997154349725552,0,4,0.6678730708627838,200,tree,0.8313706167814494,0.915474190265069,0.07450497137478623,oversample,0.8547910476338598,,8.0,0.6294077498673267,0.3285033679405005,uniform,0.7398914306932429,0.21738449160775364,0.6298519416256673,0.4097693351424695,0.41067390321121666,0.06317300789662599,0.07915194346289753,0.8313706167814494,0.915474190265069,0.08,0.485885547673909,0.497767409892985,0.2716049382716049,0.30601092896174864,0.03574329813160033,0.045454545454545456,oversample,0.4307958520532502,0.4545570619370415,0.8547910476338598,0.6298519416256673,COMPLETE
