number,value,datetime_start,datetime_complete,duration,params_alpha,params_booster,params_colsample_bytree,params_gamma,params_grow_policy,params_lambda,params_learning_rate,params_max_delta_step,params_max_depth,params_min_child_weight,params_n_estimators,params_normalize_type,params_params_feature_fraction,params_params_labeled_ratio,params_params_missing_rate,params_params_resampling,params_params_sample_rows,params_params_scale_pos_weight,params_params_selftrain_max_iter,params_params_selftrain_threshold,params_rate_drop,params_sample_type,params_skip_drop,params_subsample,params_user_attrs_decision_threshold,user_attrs_acc_test,user_attrs_acc_val,user_attrs_f1_test,user_attrs_f1_val,user_attrs_feature_fraction,user_attrs_labeled_ratio,user_attrs_missing_rate,user_attrs_pr_auc_test,user_attrs_pr_auc_val,user_attrs_prec_test,user_attrs_prec_val,user_attrs_rec_test,user_attrs_rec_val,user_attrs_resampling_strategy,user_attrs_roc_auc_test,user_attrs_roc_auc_val,user_attrs_sample_rows,user_attrs_user_attrs_decision_threshold,state
2810,0.7156549520766773,2025-11-30 17:43:36.507782,2025-11-30 17:44:04.160355,0 days 00:00:27.652573,0.0013763588101448725,dart,0.5311419874998529,8.36790598462941,depthwise,10.466367730422235,0.052510125946618004,6,9,81.71625623764002,500,tree,0.9351527238793211,0.4279110531269937,0.004884604508293955,oversample,0.6210780344845808,,10.0,0.9163994804672788,0.2868211541886029,uniform,0.34861411407506077,0.25748115532879745,,0.5567616463138851,0.5572139303482587,0.715281812899477,0.7156549520766773,0.9351527238793211,0.4279110531269937,0.08,0.5567616463138851,0.5572139303482587,0.5567616463138851,0.5572139303482587,1.0,1.0,oversample,0.5,0.5,0.6210780344845808,0.5,COMPLETE
2811,0.7156549520766773,2025-11-30 17:44:04.946635,2025-11-30 17:44:05.340160,0 days 00:00:00.393525,0.03073457288218376,gbtree,0.3271785086952984,6.709489921167378,lossguide,0.00047050388155071984,0.31995620862541385,5,10,4.970704361364373,200,,0.5189793707357147,0.43515393563363736,0.06271985676462637,oversample,0.9322078137000206,,10.0,0.836262530041087,,,,0.5788521336543551,,0.5567616463138851,0.5572139303482587,0.715281812899477,0.7156549520766773,0.5189793707357147,0.43515393563363736,0.08,0.6616024388612117,0.6388294997982733,0.5567616463138851,0.5572139303482587,1.0,1.0,oversample,0.6359658648187139,0.6009329026438321,0.9322078137000206,0.5,COMPLETE
2812,0.242503259452412,2025-11-30 17:44:06.146280,2025-11-30 17:44:06.992548,0 days 00:00:00.846268,0.00650498391114143,gbtree,0.32552561649244993,4.883213249545843,depthwise,2.3331129687211116,0.003045785721514111,8,8,0.21535385066524748,900,,0.5321551407712701,0.4720415145287242,0.0724868061371901,undersample,0.6419783455158681,,7.0,0.7524682266897791,,,,0.8755866564600476,,0.4798733604703754,0.47444595205789236,0.25997425997426,0.242503259452412,0.5321551407712701,0.4720415145287242,0.08,0.5727115289470533,0.5724642719431039,0.6253869969040248,0.6158940397350994,0.16409423233143786,0.15097402597402598,undersample,0.501385550158325,0.49165884549566874,0.6419783455158681,0.5,COMPLETE
2813,0.4540540540540541,2025-11-30 17:44:07.786848,2025-11-30 17:44:09.400034,0 days 00:00:01.613186,0.11561946197176229,gbtree,0.7723297971720322,4.254415222879748,depthwise,0.06726998130680224,0.4696370129817882,1,12,2.4540687392199687,400,,0.8281248026605776,0.31622544272588565,0.06687817126655694,undersample,0.7677184015062977,,9.0,0.8897225544054819,,,,0.560209531689295,,0.46675712347354137,0.451831750339213,0.472954850245865,0.4540540540540541,0.8281248026605776,0.31622544272588565,0.08,0.5051887273298561,0.4927727940008938,0.525844930417495,0.5101214574898786,0.429731925264013,0.4090909090909091,undersample,0.4512483628707372,0.4339290688882108,0.7677184015062977,0.5,COMPLETE
2814,0.716365754222481,2025-11-30 17:44:10.193342,2025-11-30 17:45:31.048340,0 days 00:01:20.854998,0.56927206902686,dart,0.2329252689314333,4.464557603349974,depthwise,0.014479703971033814,0.058543011540975284,10,12,0.7848738152525937,800,forest,0.679966187014734,0.8721915776386915,0.0957991514481232,oversample,0.846411200277952,,8.0,0.8463202762885378,0.36136224484016705,uniform,0.8264879570147374,0.5137383690806923,,0.5549525101763908,0.5594753505201266,0.7136204889406287,0.716365754222481,0.679966187014734,0.8721915776386915,0.1,0.5489530556980244,0.5660667314822616,0.5560090702947846,0.55858310626703,0.9959382615759546,0.9983766233766234,oversample,0.47314652099670096,0.4968792698619052,0.846411200277952,0.5,COMPLETE
2815,0.7156549520766773,2025-11-30 17:45:31.829251,2025-11-30 17:46:18.884829,0 days 00:00:47.055578,0.004028870786554618,dart,0.31094365889417586,3.810214358763936,lossguide,0.035013050803804416,0.0008941946936742827,3,3,0.5446469679770692,600,tree,0.7165845369947436,0.844246223360509,0.058115791184090694,none,0.6252271429935923,2.3494488615855995,5.0,0.6595655123943356,0.07139319559531732,weighted,0.23405202226844105,0.29011699728336915,,0.5567616463138851,0.5572139303482587,0.715281812899477,0.7156549520766773,0.7165845369947436,0.844246223360509,0.08,0.5210805802274097,0.5199859204061293,0.5567616463138851,0.5572139303482587,1.0,1.0,none,0.44500281834911054,0.43670862462358895,0.6252271429935923,0.5,COMPLETE
2816,0.20777891504605936,2025-11-30 17:46:19.665750,2025-11-30 17:46:20.502092,0 days 00:00:00.836342,0.04335239216377094,gbtree,0.39811362883097745,7.605126752663834,lossguide,4.563824655803614,0.00026650316326921625,1,12,31.45121278082055,900,,0.696066154259712,0.7827917703449372,0.005352276895413611,undersample,0.6498197653505887,,6.0,0.8711286541326114,,,,0.6872858498267097,,0.29534147444595205,0.29986431478968795,0.21392532795156408,0.20777891504605936,0.696066154259712,0.7827917703449372,0.08,0.4337424431137199,0.429026466595789,0.2822902796271638,0.28116343490304707,0.17221770917952883,0.16477272727272727,undersample,0.2853342230474643,0.27138952084687523,0.6498197653505887,0.5,COMPLETE
2817,0.7076452599388379,2025-11-30 17:46:21.300439,2025-11-30 17:47:52.091907,0 days 00:01:30.791468,0.001540905999339431,dart,0.9591063830807491,1.0672227431248027,lossguide,0.02044490395725868,0.07741797047424999,7,6,7.078106944384532,400,tree,0.5194095742401001,0.8344428955012402,0.01939853484439096,none,0.9585481299528331,1.5567528870255873,7.0,0.6905181650864699,0.23044190872188874,uniform,0.8227835734768105,0.6363764571374753,,0.5712347354138398,0.5676164631388512,0.7111517367458866,0.7076452599388379,0.5194095742401001,0.8344428955012402,0.08,0.5313936348114221,0.5220061095236208,0.5689907362262311,0.5677134445534838,0.9480097481722177,0.9391233766233766,none,0.4891004492780053,0.4808411710863192,0.9585481299528331,0.5,COMPLETE
2818,0.7169042769857433,2025-11-30 17:47:52.879112,2025-11-30 17:47:54.208865,0 days 00:00:01.329753,0.9984699042737124,gbtree,0.8669574868003436,1.3217260193638058,depthwise,0.003644097704883156,0.03243595204701594,6,9,56.302383592812795,1000,,0.7333190689769631,0.4518049696323931,0.08685794660475418,none,0.8926424787717209,2.0052095243138344,6.0,0.9378436097924532,,,,0.7505542149316902,,0.5581184984170059,0.5599276345545002,0.7159057865658621,0.7169042769857433,0.7333190689769631,0.4518049696323931,0.08,0.5504428411008744,0.5488868037656184,0.5575181159420289,0.5587301587301587,1.0,1.0,none,0.5417041065004393,0.5439592646883249,0.8926424787717209,0.5,COMPLETE
2819,0.7156549520766773,2025-11-30 17:47:55.006345,2025-11-30 17:47:55.764333,0 days 00:00:00.757988,27.372037814168795,gbtree,0.9427904949504786,4.804176203630522,depthwise,0.004964360595519037,0.005530424941484146,3,10,83.85324710592047,800,,0.615856497732003,0.7822228517171232,0.021006167307550918,oversample,0.9910416712249325,,8.0,0.9355105992773572,,,,0.5864089082514106,,0.5567616463138851,0.5572139303482587,0.715281812899477,0.7156549520766773,0.615856497732003,0.7822228517171232,0.08,0.44718991132255903,0.44134217795812974,0.5567616463138851,0.5572139303482587,1.0,1.0,oversample,0.3115979210530679,0.29562699812955173,0.9910416712249325,0.5,COMPLETE
2820,0.7156549520766773,2025-11-30 17:47:56.562667,2025-11-30 17:48:21.968720,0 days 00:00:25.406053,0.002923943030945224,dart,0.3252179201084652,4.192285330002682,lossguide,0.005456972037300156,0.010259370827320346,4,3,3.6862708675964844,500,tree,0.8280276296732342,0.27545291755540763,0.02149696045853662,oversample,0.6154356450895775,,9.0,0.609000970580276,0.3909344221668485,uniform,0.3527210378777552,0.6280543094943019,,0.5567616463138851,0.5572139303482587,0.715281812899477,0.7156549520766773,0.8280276296732342,0.27545291755540763,0.08,0.44918937259869895,0.43999320242876383,0.5567616463138851,0.5572139303482587,1.0,1.0,oversample,0.3378189293589085,0.3276074347001313,0.6154356450895775,0.5,COMPLETE
2821,0.40653357531760437,2025-11-30 17:48:22.756891,2025-11-30 17:48:23.417192,0 days 00:00:00.660301,0.002918868703762072,gbtree,0.872240409003247,4.793346881152866,depthwise,0.04015506152780822,0.006129182553190543,8,3,25.05991435114504,600,,0.8412963161197109,0.7891163239214449,0.0035677715887555087,undersample,0.5548820935027926,,11.0,0.7111771039053425,,,,0.627706421456252,,0.4056987788331072,0.4084124830393487,0.39222941720629045,0.40653357531760437,0.8412963161197109,0.7891163239214449,0.08,0.49239661370179744,0.4932914449741028,0.45542427497314714,0.4609053497942387,0.34443541835905767,0.36363636363636365,undersample,0.3731162651900728,0.37369748484406295,0.5548820935027926,0.5,COMPLETE
2822,0.0,2025-11-30 17:48:24.174736,2025-11-30 17:50:31.095862,0 days 00:02:06.921126,0.09741978826509404,dart,0.6955425894276999,3.730401661882392,lossguide,0.1139333864526346,0.0002128187582571432,8,6,1.6323383913145575,1000,forest,0.8495811378021028,0.46805210667733416,0.046685725965057046,none,0.999680535415546,0.6462179334767914,6.0,0.6511746082954216,0.07741206304336767,weighted,0.19030031237105371,0.8999586137859255,,0.44323835368611486,0.4427860696517413,0.0,0.0,0.8495811378021028,0.46805210667733416,0.08,0.46804167378212536,0.4577126501469556,0.0,0.0,0.0,0.0,none,0.3343938062633664,0.32351458551662843,0.999680535415546,0.5,COMPLETE
2823,0.7156549520766773,2025-11-30 17:50:31.892163,2025-11-30 17:52:03.033129,0 days 00:01:31.140966,0.0003068022723900418,dart,0.4233975761608406,6.9631383286428425,lossguide,0.002863819719186289,0.029856652225544168,5,7,73.58370490611836,900,forest,0.8560801714392607,0.7824632286835842,0.04192549285267321,none,0.994849351202967,1.240134252642356,5.0,0.8104461670538794,0.25768921856088783,weighted,0.3444813035310083,0.8579117701470511,,0.5567616463138851,0.5572139303482587,0.715281812899477,0.7156549520766773,0.8560801714392607,0.7824632286835842,0.08,0.4839138950704165,0.4952304984393424,0.5567616463138851,0.5572139303482587,1.0,1.0,none,0.3699999171073791,0.3878879356088243,0.994849351202967,0.5,COMPLETE
2824,0.5673306772908366,2025-11-30 17:52:03.816374,2025-11-30 17:52:05.456513,0 days 00:00:01.640139,1.237180608770351,gbtree,0.4500954483156594,5.039311634662187,depthwise,0.0005034427723651503,0.04047365639342084,0,7,1.8255744880128317,500,,0.9771428482582074,0.4605063405431606,0.06497701290924288,undersample,0.7216820868068143,,7.0,0.615438721869365,,,,0.24986843175481727,,0.5101763907734057,0.508819538670285,0.5731178557351202,0.5673306772908366,0.9771428482582074,0.4605063405431606,0.08,0.5103944710922464,0.5168576286694394,0.5566615620214395,0.5571205007824727,0.5905767668562144,0.577922077922078,undersample,0.4643242593544323,0.4770509431834764,0.7216820868068143,0.5,COMPLETE
2825,0.36505612493899464,2025-11-30 17:52:06.239873,2025-11-30 17:52:55.103869,0 days 00:00:48.863996,0.22248225350616513,dart,0.7733624727187418,6.207792045402649,lossguide,0.13947959854763145,0.0003652018067591176,1,8,1.5126398389766262,600,forest,0.9847341132733172,0.8688145477248117,0.062142278661230746,undersample,0.982136468095997,,7.0,0.8789471767933232,0.14895042111679452,weighted,0.8441057855542883,0.9316629218357897,,0.4292175486205337,0.41157847127996383,0.38558909444985395,0.36505612493899464,0.9847341132733172,0.8688145477248117,0.08,0.5073329616218112,0.4919753916694174,0.48116646415552855,0.45777233782129745,0.32168968318440294,0.30357142857142855,undersample,0.43378703227838655,0.41303990952867364,0.982136468095997,0.5,COMPLETE
2826,0.41134113411341133,2025-11-30 17:52:55.875830,2025-11-30 17:53:01.504940,0 days 00:00:05.629110,0.00011970499513902712,dart,0.36144238965144865,1.2833211654349452,depthwise,0.010211560483738587,0.005386561555625406,7,4,8.695186519250525,200,forest,0.7292126089568532,0.7649646864244752,0.07299649026149091,undersample,0.6246462593235542,,11.0,0.749187013220622,0.08962137617814275,weighted,0.16680689137326896,0.7985292006587874,,0.3939393939393939,0.4084124830393487,0.38419117647058826,0.41134113411341133,0.7292126089568532,0.7649646864244752,0.08,0.4479162346064762,0.45477547270629115,0.44232804232804235,0.4616161616161616,0.3395613322502031,0.37094155844155846,undersample,0.3497720452925281,0.36884849700860933,0.6246462593235542,0.5,COMPLETE
2827,0.0,2025-11-30 17:53:02.284548,2025-11-30 17:53:03.092850,0 days 00:00:00.808302,38.23481992396977,gbtree,0.6490093279057336,8.987443795405444,lossguide,0.013015619250281623,0.0018840844959090704,3,10,88.30160276289887,900,,0.7745408233368383,0.8135981878416234,0.056439080339189596,none,0.9610318594986951,0.5050488569127141,8.0,0.6889452451588747,,,,0.7793127395336179,,0.44323835368611486,0.4427860696517413,0.0,0.0,0.7745408233368383,0.8135981878416234,0.08,0.5567616463138851,0.5572139303482587,0.0,0.0,0.0,0.0,none,0.5,0.5,0.9610318594986951,0.5,COMPLETE
2828,0.7156549520766773,2025-11-30 17:53:03.876977,2025-11-30 17:53:04.300894,0 days 00:00:00.423917,83.21723011514534,gbtree,0.5753328914457718,5.792355640727883,lossguide,0.00021726788183947117,0.007002572977039334,7,9,28.58400246156526,300,,0.7849992790018678,0.3581118381294494,0.047127710595531815,undersample,0.5708341340643537,,7.0,0.6297522546206712,,,,0.20915915974217247,,0.5567616463138851,0.5572139303482587,0.715281812899477,0.7156549520766773,0.7849992790018678,0.3581118381294494,0.08,0.5567616463138851,0.5572139303482587,0.5567616463138851,0.5572139303482587,1.0,1.0,undersample,0.5,0.5,0.5708341340643537,0.5,COMPLETE
2829,0.7156549520766773,2025-11-30 17:53:05.095676,2025-11-30 17:53:05.668123,0 days 00:00:00.572447,11.932237600165399,gbtree,0.8647986067288611,9.58953872848934,depthwise,1.76685827139089,0.0602301404803442,0,8,70.92229944125565,500,,0.6447940687869647,0.8453696700946038,0.09158709025412252,undersample,0.787167233216632,,7.0,0.7946816487760688,,,,0.5128405685969926,,0.5567616463138851,0.5572139303482587,0.715281812899477,0.7156549520766773,0.6447940687869647,0.8453696700946038,0.1,0.5567616463138851,0.5572139303482587,0.5567616463138851,0.5572139303482587,1.0,1.0,undersample,0.5,0.5,0.787167233216632,0.5,COMPLETE
2830,0.6795698924731183,2025-11-30 17:53:06.460801,2025-11-30 17:53:07.211953,0 days 00:00:00.751152,0.0003467842050662198,gbtree,0.4117646327614597,5.262421513838841,depthwise,0.0789428252012823,0.09828055668554568,8,5,6.683595463055319,800,,0.5243774250420074,0.49055232406192645,0.056210172618792055,oversample,0.8708601547127404,,6.0,0.7968860570075011,,,,0.5356997768401724,,0.514246947082768,0.5282677521483492,0.6676980198019802,0.6795698924731183,0.5243774250420074,0.49055232406192645,0.08,0.465891405869561,0.4745795781388907,0.5392303848075962,0.5467128027681661,0.8765231519090171,0.8977272727272727,oversample,0.37315273794326825,0.3867765278643726,0.8708601547127404,0.5,COMPLETE
2831,0.4758293838862559,2025-11-30 17:53:08.003494,2025-11-30 17:53:08.411071,0 days 00:00:00.407577,0.18404907378378707,gbtree,0.706364449176559,6.079451247315797,lossguide,0.00012158218278026118,0.00020807331840983306,0,4,0.33264222881256966,200,,0.6371620764341974,0.5830878011808456,0.07666337322970596,undersample,0.9627371204605053,,8.0,0.9379215160707028,,,,0.2509034591415715,,0.5124378109452736,0.4997738579828132,0.4929444967074318,0.4758293838862559,0.6371620764341974,0.5830878011808456,0.08,0.5618389964329162,0.5578211864637332,0.5854748603351956,0.571753986332574,0.4256701868399675,0.4074675324675325,undersample,0.518412108954061,0.507663780295292,0.9627371204605053,0.5,COMPLETE
2832,0.6818461538461539,2025-11-30 17:53:09.205198,2025-11-30 17:53:16.793422,0 days 00:00:07.588224,0.2017078060537696,dart,0.4584821501611542,7.188141194108865,lossguide,0.0004379419917558998,0.0020848580064317846,4,7,1.5131877698632594,300,forest,0.6434921766215418,0.7312848458859851,0.08134402933723314,undersample,0.8285328612473792,,12.0,0.6573415758948238,0.4646636286905094,weighted,0.12101125708920443,0.3952300524157013,,0.5368611488014473,0.5323383084577115,0.6835599505562423,0.6818461538461539,0.6434921766215418,0.7312848458859851,0.08,0.601000390734022,0.5929055046048999,0.5516209476309227,0.5490584737363726,0.8984565393988627,0.8993506493506493,undersample,0.5412142111109269,0.5254972938195613,0.8285328612473792,0.5,COMPLETE
2833,0.7156549520766773,2025-11-30 17:53:17.574583,2025-11-30 17:53:48.391831,0 days 00:00:30.817248,0.36067883610190676,dart,0.2858785095202273,0.02595413523669876,lossguide,0.002093629003890674,0.006799938864881219,3,11,18.06340159161098,500,tree,0.6026319845265313,0.644355178101626,0.009236132728419088,none,0.6010366983793285,4.273308898858679,5.0,0.7293012015372793,0.3411006737417531,uniform,0.47060361679361196,0.7079683058685851,,0.5567616463138851,0.5572139303482587,0.715281812899477,0.7156549520766773,0.6026319845265313,0.644355178101626,0.08,0.5069376141281245,0.49543591178322827,0.5567616463138851,0.5572139303482587,1.0,1.0,none,0.4278415590444139,0.4215145490362549,0.6010366983793285,0.5,COMPLETE
2834,0.7156549520766773,2025-11-30 17:53:49.178922,2025-11-30 17:53:49.924065,0 days 00:00:00.745143,17.8245310409072,gbtree,0.8177094742976725,6.386548739136671,depthwise,0.11166431785687919,0.019924123806162698,8,7,8.022865188225218,800,,0.7056286981720419,0.4467726976498972,0.005429210493356163,oversample,0.6434001613835973,,12.0,0.6219466044886359,,,,0.9104944274383129,,0.5567616463138851,0.5572139303482587,0.715281812899477,0.7156549520766773,0.7056286981720419,0.4467726976498972,0.08,0.6134423224182313,0.6136142682160765,0.5567616463138851,0.5572139303482587,1.0,1.0,oversample,0.5832619075249921,0.580660593237202,0.6434001613835973,0.5,COMPLETE
2835,0.7156549520766773,2025-11-30 17:53:50.738968,2025-11-30 17:55:55.593642,0 days 00:02:04.854674,29.681441233150593,dart,0.43922766516174266,1.4205101770910311,depthwise,57.068954057880916,0.0033213866222651916,0,11,3.6478859900836302,1000,tree,0.8270637332720774,0.2473446845313487,0.08337864028386766,none,0.6428856923588876,1.6284500751639976,7.0,0.674778057016057,0.23654417249328785,weighted,0.7282431751500054,0.6822073743419228,,0.5567616463138851,0.5572139303482587,0.715281812899477,0.7156549520766773,0.8270637332720774,0.2473446845313487,0.08,0.5567616463138851,0.5572139303482587,0.5567616463138851,0.5572139303482587,1.0,1.0,none,0.5,0.5,0.6428856923588876,0.5,COMPLETE
2836,0.0,2025-11-30 17:55:56.395378,2025-11-30 17:57:19.552838,0 days 00:01:23.157460,26.664481865664452,dart,0.48578487657963454,8.558762120232053,depthwise,0.03531259134574186,0.07026542816491396,0,3,0.14156481641175897,800,forest,0.9910161131307957,0.8119709357439435,0.09430901352417648,none,0.5376228652956764,0.5199823665550087,9.0,0.6870294670838184,0.10445325806341244,weighted,0.7690565838100861,0.6658687914796722,,0.44323835368611486,0.4427860696517413,0.0,0.0,0.9910161131307957,0.8119709357439435,0.1,0.5567616463138851,0.5572139303482587,0.0,0.0,0.0,0.0,none,0.5,0.5,0.5376228652956764,0.5,COMPLETE
2837,0.0,2025-11-30 17:57:20.363013,2025-11-30 17:57:20.864073,0 days 00:00:00.501060,98.28668451498187,gbtree,0.7997687012314609,1.3480263095792988,depthwise,0.0007346152570884474,0.0167585940133251,6,8,0.3075254066703401,400,,0.8612492289113843,0.6748796362320454,0.08856809678029748,none,0.5122474151810039,0.600626598950759,10.0,0.7977389000252872,,,,0.7693448491466512,,0.44323835368611486,0.4427860696517413,0.0,0.0,0.8612492289113843,0.6748796362320454,0.08,0.5567616463138851,0.5572139303482587,0.0,0.0,0.0,0.0,none,0.5,0.5,0.5122474151810039,0.5,COMPLETE
2838,0.6316176470588235,2025-11-30 17:57:21.662601,2025-11-30 17:57:26.792488,0 days 00:00:05.129887,0.00019820312624818157,gbtree,0.9670884042513181,3.698102035431284,lossguide,0.023051179293723693,0.3229228667001421,2,5,0.30113105590011147,800,,0.6879020435245058,0.7328110906310941,0.045349310983261316,oversample,0.6131044890254395,,12.0,0.6130237554403593,,,,0.31789064542386436,,0.5422885572139303,0.5468113975576662,0.6301169590643275,0.6316176470588235,0.6879020435245058,0.7328110906310941,0.08,0.5770389269516893,0.5566004299600229,0.5727574750830565,0.5772849462365591,0.7002437043054427,0.6972402597402597,oversample,0.5291152041645253,0.515543126434342,0.6131044890254395,0.5,COMPLETE
2839,0.6922844175491679,2025-11-30 17:57:27.576152,2025-11-30 17:58:31.522600,0 days 00:01:03.946448,4.614259490461431,dart,0.9533792138186021,4.424781832770428,depthwise,0.009441217605467138,0.023805397065352337,3,11,11.068905445517496,700,forest,0.9512056940511893,0.4145246795894145,0.04208824638307961,oversample,0.938822324158884,,9.0,0.7356630394859394,0.04216651686760242,uniform,0.09637863865494163,0.3550763606672856,,0.5305291723202171,0.5400271370420624,0.6854545454545454,0.6922844175491679,0.9512056940511893,0.4145246795894145,0.08,0.43776460433314146,0.4352385815322802,0.5466408893185114,0.551857211770381,0.9187652315190902,0.9285714285714286,oversample,0.33129818133589745,0.3263384980698566,0.938822324158884,0.5,COMPLETE
