number,value,datetime_start,datetime_complete,duration,params_alpha,params_booster,params_colsample_bytree,params_gamma,params_grow_policy,params_lambda,params_learning_rate,params_max_delta_step,params_max_depth,params_min_child_weight,params_n_estimators,params_normalize_type,params_params_feature_fraction,params_params_labeled_ratio,params_params_missing_rate,params_params_resampling,params_params_sample_rows,params_params_scale_pos_weight,params_params_selftrain_max_iter,params_params_selftrain_threshold,params_rate_drop,params_sample_type,params_skip_drop,params_subsample,params_user_attrs_decision_threshold,user_attrs_acc_test,user_attrs_acc_val,user_attrs_f1_test,user_attrs_f1_val,user_attrs_feature_fraction,user_attrs_labeled_ratio,user_attrs_missing_rate,user_attrs_pr_auc_test,user_attrs_pr_auc_val,user_attrs_prec_test,user_attrs_prec_val,user_attrs_rec_test,user_attrs_rec_val,user_attrs_resampling_strategy,user_attrs_roc_auc_test,user_attrs_roc_auc_val,user_attrs_sample_rows,user_attrs_user_attrs_decision_threshold,state
1156,0.7156549520766773,2025-11-27 00:40:40.964158,2025-11-27 00:40:41.738426,0 days 00:00:00.774268,0.0009064900851907342,gbtree,0.6937771109157524,6.260925123604245,lossguide,43.05051019525275,0.005063141485842241,9,12,0.3172391266028506,500,,0.8810513209498045,0.72691834372222,0.04170338864162369,undersample,0.5525887904227926,,10.0,0.6993032820253141,,,,0.6666413373332969,0.2410460806227008,0.5567616463138851,0.5572139303482587,0.715281812899477,0.7156549520766773,0.8810513209498045,0.72691834372222,0.05,0.49914924181859316,0.4981725756814861,0.5567616463138851,0.5572139303482587,1.0,1.0,undersample,0.38833700823952644,0.39854932478144933,0.5525887904227926,0.2410460806227008,COMPLETE
1157,0.7156549520766773,2025-11-27 00:40:41.917726,2025-11-27 00:40:43.917911,0 days 00:00:02.000185,5.287839775080081,gbtree,0.5977791942565784,1.3140491954171474,lossguide,0.00032417101203125495,0.00793626269673961,9,7,0.18866753635240957,900,,0.7110287823111445,0.8849172844701207,0.03849399755271847,oversample,0.9641196673835876,,10.0,0.7631225860650293,,,,0.5792313910197788,0.06187420274847827,0.5567616463138851,0.5572139303482587,0.715281812899477,0.7156549520766773,0.7110287823111445,0.8849172844701207,0.05,0.5145536055830638,0.5249402424981078,0.5567616463138851,0.5572139303482587,1.0,1.0,oversample,0.4519144050796598,0.47987485573670463,0.9641196673835876,0.06187420274847827,COMPLETE
1158,0.7045860631328171,2025-11-27 00:40:44.095911,2025-11-27 00:40:48.075509,0 days 00:00:03.979598,1.8353836743721,gbtree,0.6618124668840569,0.2380789124963541,depthwise,0.0011609142533852695,0.0016386505143145746,7,9,1.0072846733719223,1000,,0.5644951243696117,0.7957390922573437,0.03990605093196161,undersample,0.972569706340869,,6.0,0.7005629250575712,,,,0.5948772368517561,0.42366477689401355,0.5454545454545454,0.5513342379014021,0.700268416343573,0.7045860631328171,0.5644951243696117,0.7957390922573437,0.05,0.5140890764053467,0.4997310187059353,0.5532516493873704,0.5564440263405456,0.9536961819658814,0.9602272727272727,undersample,0.45593552611946486,0.4394914967565632,0.972569706340869,0.42366477689401355,COMPLETE
1159,0.7156549520766773,2025-11-27 00:40:48.256430,2025-11-27 00:40:51.897173,0 days 00:00:03.640743,0.00037865366918317714,gbtree,0.43316765930172574,3.7844913015950175,lossguide,0.0006195170842477148,0.039033821147854045,3,10,0.2134133378371666,700,,0.8659028351455175,0.8590565773529694,0.0292338534310248,none,0.8218133195707239,0.6516853354320509,12.0,0.6182104168509367,,,,0.4461166493694033,0.27139455575251936,0.555857078245138,0.5572139303482587,0.7145348837209302,0.7156549520766773,0.8659028351455175,0.8590565773529694,0.02,0.5116592045055413,0.4979255700952996,0.5563603440470801,0.5572139303482587,0.9983753046303818,1.0,none,0.4355547174190553,0.4252533727763554,0.8218133195707239,0.27139455575251936,COMPLETE
1160,0.7156549520766773,2025-11-27 00:40:52.078361,2025-11-27 00:41:04.079723,0 days 00:00:12.001362,0.10331973857631213,dart,0.6843914972092185,2.0693231398471106,lossguide,0.18485199764343027,0.015099907165776605,1,3,0.3327996517533759,300,tree,0.7428338898082322,0.8717605064720938,0.09216086596207293,undersample,0.8043291486707077,,5.0,0.6715191761294602,0.22521116877255448,uniform,0.734002178420147,0.39309636649443747,0.3492386154332013,0.5567616463138851,0.5572139303482587,0.715281812899477,0.7156549520766773,0.7428338898082322,0.8717605064720938,0.1,0.489111842292192,0.485923522768112,0.5567616463138851,0.5572139303482587,1.0,1.0,undersample,0.4325403272600673,0.4351217283737713,0.8043291486707077,0.3492386154332013,COMPLETE
1161,0.7156549520766773,2025-11-27 00:41:04.260282,2025-11-27 00:41:05.047906,0 days 00:00:00.787624,0.0001570732009460507,gbtree,0.9147361670639639,1.4688455829466551,lossguide,1.6316021659172748,0.2203308140955748,10,10,3.952586520555999,500,,0.8378020006174712,0.5803919352914961,0.04983773330093011,oversample,0.538833417310862,,6.0,0.7203662994823955,,,,0.9964480990343307,0.23191136990593092,0.5567616463138851,0.5572139303482587,0.715281812899477,0.7156549520766773,0.8378020006174712,0.5803919352914961,0.05,0.5474225830308816,0.549079537459805,0.5567616463138851,0.5572139303482587,1.0,1.0,oversample,0.4849661798106732,0.49610862197047073,0.538833417310862,0.23191136990593092,COMPLETE
1162,0.6655917445985166,2025-11-27 00:41:05.227387,2025-11-27 00:41:30.144751,0 days 00:00:24.917364,0.3845356260784938,gbtree,0.8463188402853989,0.8217271093607231,lossguide,0.10685953996932909,0.003912709965671535,9,8,0.3693413414669609,700,,0.6774099228709148,0.5017686727119195,0.07547615723801297,oversample,0.5948538424677328,,7.0,0.6303513134131945,,,,0.6306222644730705,0.5209072770283842,0.5382180009045681,0.5309814563545907,0.6698997736825089,0.6655917445985166,0.6774099228709148,0.5017686727119195,0.08,0.506163430124316,0.5132960021414424,0.556390977443609,0.5521669341894061,0.8415922014622258,0.8376623376623377,oversample,0.4596578192609294,0.451788699043551,0.5948538424677328,0.5209072770283842,COMPLETE
1163,0.7156549520766773,2025-11-27 00:41:30.323494,2025-11-27 00:41:31.016268,0 days 00:00:00.692774,0.013346137191101854,gbtree,0.6873301313568284,4.865677139789191,lossguide,21.94276296318022,0.15551990400934873,8,12,5.705411270209431,400,,0.8598325658147559,0.5627061585484509,0.09900742191732029,oversample,0.7414726099767139,,6.0,0.6660958265747641,,,,0.8925966175002542,0.313615746339608,0.5567616463138851,0.5572139303482587,0.715281812899477,0.7156549520766773,0.8598325658147559,0.5627061585484509,0.1,0.49979977688877625,0.5063700520366418,0.5567616463138851,0.5572139303482587,1.0,1.0,oversample,0.3829887763391303,0.39439470769271584,0.7414726099767139,0.313615746339608,COMPLETE
1164,0.23739237392373924,2025-11-27 00:41:31.193797,2025-11-27 00:41:52.700704,0 days 00:00:21.506907,0.40017563377932913,gbtree,0.618931736240721,0.4433376121793112,depthwise,0.004590471283425045,0.008325960849656568,7,11,1.4027242000296658,1000,,0.9956003432965232,0.7474030037602437,0.072566618253838,undersample,0.8807236542427521,,8.0,0.6924540956713432,,,,0.6304191072384819,0.7250724191754523,0.4635911352329263,0.4391677973767526,0.2559598494353827,0.23739237392373924,0.9956003432965232,0.7474030037602437,0.08,0.5461063862832966,0.5328119912018452,0.5619834710743802,0.48984771573604063,0.16571892770105606,0.15665584415584416,undersample,0.48414761517929683,0.4675051072522982,0.8807236542427521,0.7250724191754523,COMPLETE
1165,0.7156549520766773,2025-11-27 00:41:52.874362,2025-11-27 00:41:53.742200,0 days 00:00:00.867838,0.0006951853217443673,gbtree,0.45387502245174893,7.308445849153018,depthwise,0.0029383237258819163,0.005891961236336754,5,11,0.3141656707727583,700,,0.8287056141533742,0.37950894080022557,0.024957489165886207,oversample,0.7178848279617781,,5.0,0.6646601979701461,,,,0.5192935522952923,0.5040666037263227,0.5567616463138851,0.5572139303482587,0.715281812899477,0.7156549520766773,0.8287056141533742,0.37950894080022557,0.02,0.47894209880532923,0.4666371227734682,0.5567616463138851,0.5572139303482587,1.0,1.0,oversample,0.4004592251197798,0.3784905084700795,0.7178848279617781,0.5040666037263227,COMPLETE
1166,0.7156549520766773,2025-11-27 00:41:53.922001,2025-11-27 00:42:37.876302,0 days 00:00:43.954301,7.817213263209122,dart,0.3027205598142519,6.698122565731237,lossguide,0.37852842447805296,0.00010112475703371366,0,9,17.922964062022487,600,forest,0.7447905066742395,0.37538210308133196,0.0335549445319916,none,0.6074813463621116,0.8924058846560081,6.0,0.774060909204234,0.2740436922130821,uniform,0.7457833540774409,0.7012316581549648,0.11769354076963426,0.5567616463138851,0.5572139303482587,0.715281812899477,0.7156549520766773,0.7447905066742395,0.37538210308133196,0.02,0.5567616463138851,0.5572139303482587,0.5567616463138851,0.5572139303482587,1.0,1.0,none,0.5,0.5,0.6074813463621116,0.11769354076963426,COMPLETE
1167,0.0,2025-11-27 00:42:38.060240,2025-11-27 00:43:17.784774,0 days 00:00:39.724534,23.099274063388265,dart,0.6804984444305938,4.89855037121727,lossguide,3.2165237387621195,0.019242802614136384,9,8,3.396724013931814,600,tree,0.7473317318805636,0.316533498845153,0.055688297716103015,undersample,0.9563064238646128,,11.0,0.8349376700951031,0.2711805848311106,uniform,0.45134469518695125,0.739530762451273,0.7103092152838335,0.44323835368611486,0.4427860696517413,0.0,0.0,0.7473317318805636,0.316533498845153,0.05,0.5567616463138851,0.5572139303482587,0.0,0.0,0.0,0.0,undersample,0.5,0.5,0.9563064238646128,0.7103092152838335,COMPLETE
1168,0.7156549520766773,2025-11-27 00:43:17.956421,2025-11-27 00:43:18.739946,0 days 00:00:00.783525,1.1839016854650326,gbtree,0.3181380797466421,5.013224855267444,lossguide,0.006184487109292418,0.24019587211190518,0,7,2.1637192310830686,500,,0.8405266514089399,0.5809582801505353,0.03212209645189803,oversample,0.925959776791249,,7.0,0.7908572831537751,,,,0.8994415621462125,0.3564502218892033,0.5567616463138851,0.5572139303482587,0.715281812899477,0.7156549520766773,0.8405266514089399,0.5809582801505353,0.02,0.49730615745838463,0.4992525529421258,0.5567616463138851,0.5572139303482587,1.0,1.0,oversample,0.3826824881049089,0.3873556537946221,0.925959776791249,0.3564502218892033,COMPLETE
1169,0.7156549520766773,2025-11-27 00:43:18.913761,2025-11-27 00:43:31.124459,0 days 00:00:12.210698,0.004403366440922722,gbtree,0.7234978667974626,0.13817331362575536,lossguide,0.000149219041374945,0.0024325793564817983,4,12,0.1902931576625751,300,,0.9932543007426806,0.9318906048843673,0.08192115613266124,undersample,0.7472049419530907,,12.0,0.8048945163461527,,,,0.4680972542229167,0.10524305401776192,0.5567616463138851,0.5572139303482587,0.715281812899477,0.7156549520766773,0.9932543007426806,0.9318906048843673,0.08,0.5268872491139096,0.5472838715264655,0.5567616463138851,0.5572139303482587,1.0,1.0,undersample,0.4739418756942257,0.4991170091399918,0.7472049419530907,0.10524305401776192,COMPLETE
1170,0.7156549520766773,2025-11-27 00:43:31.303903,2025-11-27 00:43:32.587422,0 days 00:00:01.283519,0.010093811345442615,gbtree,0.9936421982112367,3.055423794976168,lossguide,0.4576090273041343,0.1435608440598168,10,12,1.3163987700137851,400,,0.8522196059883603,0.4951511525255516,0.09863780449730347,oversample,0.603583383221983,,5.0,0.766159225095383,,,,0.8321848029537443,0.05012127017403045,0.5567616463138851,0.5572139303482587,0.715281812899477,0.7156549520766773,0.8522196059883603,0.4951511525255516,0.1,0.49573603066752636,0.4827970280815047,0.5567616463138851,0.5572139303482587,1.0,1.0,oversample,0.4689181684046486,0.4376392886990435,0.603583383221983,0.05012127017403045,COMPLETE
1171,0.6769327467001885,2025-11-27 00:43:32.771045,2025-11-27 00:43:33.787234,0 days 00:00:01.016189,0.0007325383194883256,gbtree,0.646187758698269,1.9813599335530783,lossguide,0.0007691987472918063,0.026420542638497725,5,5,0.1146925352065254,600,,0.7467732882543858,0.4326300027570565,0.09973668474332263,undersample,0.5073148547661108,,7.0,0.8366372284680619,,,,0.6780167473288148,0.3993702565513029,0.5269109000452284,0.535052012663953,0.6696146557169931,0.6769327467001885,0.7467732882543858,0.4326300027570565,0.1,0.5040184387796979,0.509499022869234,0.5478036175710594,0.5523076923076923,0.8610885458976442,0.8741883116883117,undersample,0.42860002652563867,0.4442766439382884,0.5073148547661108,0.3993702565513029,COMPLETE
1172,0.6486671223513328,2025-11-27 00:43:33.966786,2025-11-27 00:43:53.033628,0 days 00:00:19.066842,0.46536236281658616,dart,0.8077067618694909,2.1209389822859697,lossguide,0.0012284625953264785,0.06423111500133798,3,3,0.4095095333114904,200,tree,0.8521882707196241,0.6195412123371891,0.09457795006833877,undersample,0.575977154770646,,6.0,0.7090070497744035,0.29542673119289786,uniform,0.8365708665157668,0.27029446535174045,0.3909264332982612,0.5336951605608322,0.535052012663953,0.6508635286149679,0.6486671223513328,0.8521882707196241,0.6195412123371891,0.1,0.5071693731303346,0.5024394490394459,0.5580720092915215,0.5602125147579693,0.7806661251015434,0.7702922077922078,undersample,0.4627219449924568,0.4552336070466816,0.575977154770646,0.3909264332982612,COMPLETE
1173,0.7156549520766773,2025-11-27 00:43:53.213047,2025-11-27 00:43:53.826029,0 days 00:00:00.612982,0.007820150687870453,gbtree,0.7874593489394874,5.154175930614166,lossguide,0.04989890636947753,0.010400967954953252,1,3,0.11034460217711618,200,,0.9325451991370038,0.7865680808113455,0.08097873248327576,oversample,0.8283843105931518,,7.0,0.6126600049060907,,,,0.30684282385998174,0.36863549403005946,0.5567616463138851,0.5572139303482587,0.715281812899477,0.7156549520766773,0.9325451991370038,0.7865680808113455,0.08,0.5366720728597552,0.5566320603976906,0.5567616463138851,0.5572139303482587,1.0,1.0,oversample,0.48802035842769276,0.5081869420161044,0.8283843105931518,0.36863549403005946,COMPLETE
1174,0.0,2025-11-27 00:43:54.008679,2025-11-27 00:44:23.031639,0 days 00:00:29.022960,19.37085248878315,dart,0.7757879337127649,6.216070769554228,lossguide,94.71445886450967,0.020374125799610555,9,8,5.637825294330993,500,forest,0.7935891558164526,0.06415390658695622,0.07622121002840279,none,0.7820285418096209,0.6411786346261725,9.0,0.8688034363470069,0.13009221487279168,uniform,0.017894437983481393,0.579838623679476,0.8626569386063102,0.44323835368611486,0.4427860696517413,0.0,0.0,0.7935891558164526,0.06415390658695622,0.08,0.5567616463138851,0.5572139303482587,0.0,0.0,0.0,0.0,none,0.5,0.5,0.7820285418096209,0.8626569386063102,COMPLETE
1175,0.0,2025-11-27 00:44:23.209396,2025-11-27 00:44:24.047922,0 days 00:00:00.838526,27.944661422701202,gbtree,0.4219777683830265,2.720849608867689,depthwise,0.0004134510309806439,0.31099076686503835,0,3,2.1970673033252486,600,,0.8409263403099699,0.31184767279024816,0.00940886708071258,none,0.9648053598889519,0.5153314307756184,8.0,0.7835407023731462,,,,0.7504505593336244,0.5070042879707239,0.44323835368611486,0.4427860696517413,0.0,0.0,0.8409263403099699,0.31184767279024816,0.0,0.5567616463138851,0.5572139303482587,0.0,0.0,0.0,0.0,none,0.5,0.5,0.9648053598889519,0.5070042879707239,COMPLETE
1176,0.7156549520766773,2025-11-27 00:44:24.230352,2025-11-27 00:44:24.948452,0 days 00:00:00.718100,0.0007944549351265968,gbtree,0.6569244770777252,4.961631717854583,lossguide,0.011733098759011894,0.006872937114161016,10,11,0.1595219028895969,400,,0.9958861836967895,0.27972597747994354,0.049976942044179844,undersample,0.5881376680965278,,12.0,0.7848893984905408,,,,0.7316434828498763,0.31345536244549876,0.5567616463138851,0.5572139303482587,0.715281812899477,0.7156549520766773,0.9958861836967895,0.27972597747994354,0.05,0.5941025403158526,0.5769404931471527,0.5567616463138851,0.5572139303482587,1.0,1.0,undersample,0.60369328072415,0.5643418443150312,0.5881376680965278,0.31345536244549876,COMPLETE
1177,0.7156549520766773,2025-11-27 00:44:25.128973,2025-11-27 00:44:52.656043,0 days 00:00:27.527070,0.41106885526427955,dart,0.8415934247734234,2.44221116674953,lossguide,0.3925486569955361,0.018431472732852734,10,7,21.446103236126007,500,tree,0.9546973094802784,0.38135207933834303,0.09467345119981518,oversample,0.5680967242473206,,7.0,0.7056375297649764,0.37283141815346543,weighted,0.4811039128571201,0.35188779586553853,0.16490669055881085,0.5567616463138851,0.5572139303482587,0.715281812899477,0.7156549520766773,0.9546973094802784,0.38135207933834303,0.1,0.5534618286340445,0.521838093271923,0.5567616463138851,0.5572139303482587,1.0,1.0,oversample,0.4878918748652995,0.44189256861626625,0.5680967242473206,0.16490669055881085,COMPLETE
1178,0.7156549520766773,2025-11-27 00:44:52.841346,2025-11-27 00:44:53.675786,0 days 00:00:00.834440,0.0003466987349541483,gbtree,0.9308572821210549,9.360075861473717,lossguide,19.74279592166761,0.15637412703825787,7,7,79.20199219057196,600,,0.8002479844913069,0.7941390369692758,0.0933933972475027,oversample,0.7963797117915717,,11.0,0.8802061489269223,,,,0.564864238747544,0.40533830686283523,0.5567616463138851,0.5572139303482587,0.715281812899477,0.7156549520766773,0.8002479844913069,0.7941390369692758,0.1,0.49209347920160657,0.481480002718749,0.5567616463138851,0.5572139303482587,1.0,1.0,oversample,0.39249282978829225,0.3742940218616929,0.7963797117915717,0.40533830686283523,COMPLETE
1179,0.7156549520766773,2025-11-27 00:44:53.859853,2025-11-27 00:46:46.364247,0 days 00:01:52.504394,0.01438860143195927,dart,0.7341373187538812,4.954137661346662,lossguide,0.38532625612429483,0.026677888475517022,2,7,1.6025837693250922,500,forest,0.7795527257244627,0.560068227361758,0.09126318870049123,undersample,0.8392454353551331,,6.0,0.6044347962896892,0.11187763165630074,weighted,0.6845693453358428,0.3347641667626868,0.3379095881046723,0.5567616463138851,0.5572139303482587,0.715281812899477,0.7156549520766773,0.7795527257244627,0.560068227361758,0.1,0.5360979774172521,0.5330337167159197,0.5567616463138851,0.5572139303482587,1.0,1.0,undersample,0.49455022463900267,0.4916240233209079,0.8392454353551331,0.3379095881046723,COMPLETE
1180,0.7156549520766773,2025-11-27 00:46:46.542765,2025-11-27 00:46:47.548186,0 days 00:00:01.005421,76.896230229056,gbtree,0.7956589008357785,1.5795185052144527,depthwise,0.00042430375219668065,0.0051934322153429,9,6,1.2329651647235478,900,,0.9417942961864911,0.8728540226970234,0.08322137706545348,oversample,0.9054694753214245,,8.0,0.7632535701413854,,,,0.34202862119913735,0.212447540988584,0.5567616463138851,0.5572139303482587,0.715281812899477,0.7156549520766773,0.9417942961864911,0.8728540226970234,0.08,0.5567616463138851,0.5572139303482587,0.5567616463138851,0.5572139303482587,1.0,1.0,oversample,0.5,0.5,0.9054694753214245,0.212447540988584,COMPLETE
1181,0.6634860050890585,2025-11-27 00:46:47.734986,2025-11-27 00:46:56.615738,0 days 00:00:08.880752,0.01834199969169066,gbtree,0.8389927403687961,0.613786540673775,lossguide,0.025530868513734612,0.13795396835871798,9,7,4.053307750691402,400,,0.878980002610749,0.5207117898126384,0.07025093639143958,oversample,0.5554283605488451,,10.0,0.6148628530925635,,,,0.4298574759980607,0.10824535001786982,0.5382180009045681,0.5214834916327453,0.6749442852594715,0.6634860050890585,0.878980002610749,0.5207117898126384,0.08,0.5372377994284614,0.5207037899879807,0.5549738219895288,0.5455020920502092,0.8610885458976442,0.8465909090909091,oversample,0.4615195875263184,0.4453192364326174,0.5554283605488451,0.10824535001786982,COMPLETE
1182,0.7149084568439407,2025-11-27 00:46:56.794146,2025-11-27 00:46:58.852759,0 days 00:00:02.058613,0.00041396746056355436,gbtree,0.9293305866586797,2.1744274199264613,lossguide,0.007285778090542221,0.41869708397772615,9,12,5.334807189585483,600,,0.9950606953385308,0.6280110473507007,0.08816198761291526,none,0.6457311905898886,0.9650258051439268,5.0,0.6203339631938459,,,,0.6920733935665824,0.028983802502183964,0.5572139303482587,0.5563093622795116,0.7154896832316188,0.7149084568439407,0.9950606953385308,0.6280110473507007,0.08,0.5456684044206628,0.5435076112336439,0.5570135746606335,0.5568130375735627,1.0,0.9983766233766234,none,0.5065617798703559,0.5020760648952682,0.6457311905898886,0.028983802502183964,COMPLETE
1183,0.7156549520766773,2025-11-27 00:46:59.032231,2025-11-27 00:47:24.976317,0 days 00:00:25.944086,0.0011980044838159737,dart,0.8472547380330994,1.7906871843610683,lossguide,14.533796175571087,0.05134157740374757,9,9,6.252161005644261,500,tree,0.919420612782225,0.15618026849850447,0.07925854189502567,undersample,0.7684685250784478,,5.0,0.7092316028442404,0.47891031354276814,weighted,0.3349208491397415,0.39443079996685293,0.03635534247504964,0.5567616463138851,0.5572139303482587,0.715281812899477,0.7156549520766773,0.919420612782225,0.15618026849850447,0.08,0.5377990872137837,0.518635597942783,0.5567616463138851,0.5572139303482587,1.0,1.0,undersample,0.4503953978016877,0.42146024302561585,0.7684685250784478,0.03635534247504964,COMPLETE
1184,0.7156549520766773,2025-11-27 00:47:25.154835,2025-11-27 00:48:08.599754,0 days 00:00:43.444919,0.2122479761132092,dart,0.7684886589998776,2.4779486734532634,lossguide,0.06876447327502239,0.015652168347822758,1,3,0.12244183833302268,300,tree,0.9499596168933135,0.7735609987112091,0.08566438207237174,oversample,0.8303192708075117,,7.0,0.6769433936811262,0.32547194885394054,uniform,0.5627082815914456,0.21826093147093759,0.3139487377664035,0.5567616463138851,0.5572139303482587,0.715281812899477,0.7156549520766773,0.9499596168933135,0.7735609987112091,0.08,0.5250880417595246,0.5205438925175794,0.5567616463138851,0.5572139303482587,1.0,1.0,oversample,0.4764593245909249,0.4694891421142698,0.8303192708075117,0.3139487377664035,COMPLETE
