number,value,datetime_start,datetime_complete,duration,params_alpha,params_booster,params_colsample_bytree,params_gamma,params_grow_policy,params_lambda,params_learning_rate,params_max_delta_step,params_max_depth,params_min_child_weight,params_n_estimators,params_normalize_type,params_params_feature_fraction,params_params_labeled_ratio,params_params_missing_rate,params_params_resampling,params_params_sample_rows,params_params_scale_pos_weight,params_params_selftrain_max_iter,params_params_selftrain_threshold,params_rate_drop,params_sample_type,params_skip_drop,params_subsample,params_user_attrs_decision_threshold,user_attrs_acc_test,user_attrs_acc_val,user_attrs_f1_test,user_attrs_f1_val,user_attrs_feature_fraction,user_attrs_labeled_ratio,user_attrs_missing_rate,user_attrs_pr_auc_test,user_attrs_pr_auc_val,user_attrs_prec_test,user_attrs_prec_val,user_attrs_rec_test,user_attrs_rec_val,user_attrs_resampling_strategy,user_attrs_roc_auc_test,user_attrs_roc_auc_val,user_attrs_sample_rows,user_attrs_user_attrs_decision_threshold,state
291,0.7156549520766773,2025-11-26 18:17:44.988116,2025-11-26 18:17:46.573589,0 days 00:00:01.585473,0.45804940119298676,gbtree,0.2456488622585521,2.255279569467488,lossguide,0.3605347083993051,0.25119281769264257,9,6,0.3448263837504313,400,,0.5040350716484576,0.5465622548797725,0.018651211047607117,none,0.5201928986004103,0.8248702649005687,8.0,0.7308743662344324,,,,0.7716499009434874,0.04766421502574977,0.5567616463138851,0.5572139303482587,0.715281812899477,0.7156549520766773,0.5040350716484576,0.5465622548797725,0.02,0.5223747588785232,0.5191284780412593,0.5567616463138851,0.5572139303482587,1.0,1.0,none,0.4577027967970291,0.4631796956873566,0.5201928986004103,0.04766421502574977,COMPLETE
292,0.7156549520766773,2025-11-26 18:17:46.755190,2025-11-26 18:17:58.804140,0 days 00:00:12.048950,0.00032128868443013933,dart,0.8575902729433752,9.507265295434301,lossguide,5.724346834844185,0.00017723219211704277,6,5,10.469638943059142,300,forest,0.6738777885351828,0.7891996416520461,0.09068106542932158,oversample,0.7399491433580025,,12.0,0.6095079690128361,0.08298103937554777,weighted,0.00280059228697202,0.94823773737513,0.5021425703496017,0.5567616463138851,0.5572139303482587,0.715281812899477,0.7156549520766773,0.6738777885351828,0.7891996416520461,0.1,0.5264562177080571,0.5357122938746073,0.5567616463138851,0.5572139303482587,1.0,1.0,oversample,0.42882507999137914,0.4520875893769153,0.7399491433580025,0.5021425703496017,COMPLETE
293,0.7156549520766773,2025-11-26 18:17:58.990890,2025-11-26 18:18:04.400751,0 days 00:00:05.409861,0.05383792033259837,dart,0.8843196204415651,8.188105040418026,lossguide,4.897735115638682,0.014966455431252195,3,3,20.0652785935613,200,tree,0.8027353062751117,0.8914723506693331,0.0953362874475931,undersample,0.7070363697631584,,11.0,0.7238543245143716,0.18725275971302247,weighted,0.23217859508354335,0.8648837801207957,0.24928285506690592,0.5567616463138851,0.5572139303482587,0.715281812899477,0.7156549520766773,0.8027353062751117,0.8914723506693331,0.1,0.5258593793736633,0.525516466752266,0.5567616463138851,0.5572139303482587,1.0,1.0,undersample,0.47184220560685686,0.4659949026968946,0.7070363697631584,0.24928285506690592,COMPLETE
294,0.7156549520766773,2025-11-26 18:18:04.587308,2025-11-26 18:18:05.575552,0 days 00:00:00.988244,0.3916683633942258,gbtree,0.3652821722669276,4.736377861887269,lossguide,0.00933172154951682,0.0020894214968018364,7,6,0.26654799769807785,800,,0.8452761565984749,0.924373878966607,0.057478830271514306,oversample,0.5685682649783934,,11.0,0.6545090915598695,,,,0.590207695151611,0.05779326670839614,0.5567616463138851,0.5572139303482587,0.715281812899477,0.7156549520766773,0.8452761565984749,0.924373878966607,0.05,0.4849810968560678,0.4758560967707712,0.5567616463138851,0.5572139303482587,1.0,1.0,oversample,0.4118366518012567,0.3859955162304498,0.5685682649783934,0.05779326670839614,COMPLETE
295,0.7156549520766773,2025-11-26 18:18:05.756676,2025-11-26 18:18:06.440785,0 days 00:00:00.684109,5.825528088516733,gbtree,0.5810061811574503,7.0795996981319025,lossguide,9.22997257361497,0.010623132673375642,0,8,2.4767642290004837,500,,0.7204848738068976,0.1580726784325167,0.04913473984457951,undersample,0.9349175555610979,,9.0,0.9125783887625021,,,,0.2821954449244068,0.36807103959287407,0.5567616463138851,0.5572139303482587,0.715281812899477,0.7156549520766773,0.7204848738068976,0.1580726784325167,0.05,0.5567616463138851,0.5572139303482587,0.5567616463138851,0.5572139303482587,1.0,1.0,undersample,0.5,0.5,0.9349175555610979,0.36807103959287407,COMPLETE
296,0.7156549520766773,2025-11-26 18:18:06.630582,2025-11-26 18:18:07.195698,0 days 00:00:00.565116,41.52888175743089,gbtree,0.3267948800902976,5.632189520054222,lossguide,0.1454057077856112,0.10427412397057377,7,12,6.1211121581258485,300,,0.5770045953647305,0.9340601839835387,0.04934101511798407,undersample,0.6325821252574845,,11.0,0.8041693708323165,,,,0.8377543709440863,0.2248906731384655,0.5567616463138851,0.5572139303482587,0.715281812899477,0.7156549520766773,0.5770045953647305,0.9340601839835387,0.05,0.5567616463138851,0.5572139303482587,0.5567616463138851,0.5572139303482587,1.0,1.0,undersample,0.5,0.5,0.6325821252574845,0.2248906731384655,COMPLETE
297,0.7156549520766773,2025-11-26 18:18:07.366845,2025-11-26 18:19:03.916774,0 days 00:00:56.549929,0.006530413881479355,dart,0.9076278536771516,1.8190926695633194,lossguide,6.099112723742121,0.046350413231146,1,6,0.1401371813556512,700,forest,0.5845926806219979,0.34136642442837645,0.06034739998945137,oversample,0.8415176117468219,,9.0,0.8291475689995872,0.4008297138097707,weighted,0.5462243802545835,0.9040228791038607,0.2297506863793753,0.5567616463138851,0.5572139303482587,0.715281812899477,0.7156549520766773,0.5845926806219979,0.34136642442837645,0.05,0.7558852270495264,0.743283626209717,0.5567616463138851,0.5572139303482587,1.0,1.0,oversample,0.7711939853114275,0.7634894472228486,0.8415176117468219,0.2297506863793753,COMPLETE
298,0.7156549520766773,2025-11-26 18:19:04.086252,2025-11-26 18:19:04.745970,0 days 00:00:00.659718,0.25886245974018923,gbtree,0.2794735205371671,6.972855072758828,depthwise,48.59756113096244,0.00026976087134151843,1,7,0.17612471998644363,500,,0.6819605156663517,0.6085428208081634,0.008529939204657248,undersample,0.5287603809039113,,7.0,0.7551383925295706,,,,0.27559898595086074,0.11895044435963065,0.5567616463138851,0.5572139303482587,0.715281812899477,0.7156549520766773,0.6819605156663517,0.6085428208081634,0.0,0.5021890219353853,0.49783967111010763,0.5567616463138851,0.5572139303482587,1.0,1.0,undersample,0.3898518708864537,0.37035165421912103,0.5287603809039113,0.11895044435963065,COMPLETE
299,0.0,2025-11-26 18:19:04.914223,2025-11-26 18:19:46.251025,0 days 00:00:41.336802,0.5757018631819995,dart,0.8411197745305377,4.409773595156395,depthwise,0.11072240456201671,0.003700098020578502,4,11,18.328942967028542,600,forest,0.870080975486526,0.6817137388023391,0.08187514905405208,undersample,0.9503621239744799,,12.0,0.8518502091819294,0.29012582662291064,uniform,0.5062649009291185,0.9559707803538043,0.6561578934833687,0.44323835368611486,0.4427860696517413,0.0,0.0,0.870080975486526,0.6817137388023391,0.08,0.4699918464125602,0.4610273576929956,0.0,0.0,0.0,0.0,undersample,0.3587588487872809,0.3439614203467625,0.9503621239744799,0.6561578934833687,COMPLETE
300,0.7156549520766773,2025-11-26 18:19:46.422972,2025-11-26 18:19:47.170086,0 days 00:00:00.747114,0.002117659230313949,gbtree,0.4063922508872396,8.0273887655409,lossguide,3.4224871953959823,0.004327814380016069,3,4,0.10095874424744389,600,,0.8505420082698584,0.7198538832933061,0.01311861960892222,undersample,0.656960176854586,,5.0,0.7682442644920597,,,,0.7529321105088131,0.10038862784573828,0.5567616463138851,0.5572139303482587,0.715281812899477,0.7156549520766773,0.8505420082698584,0.7198538832933061,0.02,0.47101055656550306,0.4654955674726351,0.5567616463138851,0.5572139303482587,1.0,1.0,undersample,0.36923523267958686,0.3541112551901623,0.656960176854586,0.10038862784573828,COMPLETE
301,0.7156549520766773,2025-11-26 18:19:47.341167,2025-11-26 18:20:07.391576,0 days 00:00:20.050409,0.02014231088464932,dart,0.5396263628189791,8.88426447946215,lossguide,7.040835556319791,0.00012241769198303212,1,3,40.30467364427636,400,forest,0.678778191014657,0.3859731768915063,0.05215748588990221,oversample,0.655296633761028,,12.0,0.8693804689639613,0.20592508340172405,weighted,0.5773337616933638,0.5783570494548466,0.03745584529191731,0.5567616463138851,0.5572139303482587,0.715281812899477,0.7156549520766773,0.678778191014657,0.3859731768915063,0.05,0.648377888220364,0.6336047762657246,0.5567616463138851,0.5572139303482587,1.0,1.0,oversample,0.5175682620733102,0.49513111377896873,0.655296633761028,0.03745584529191731,COMPLETE
302,0.7156549520766773,2025-11-26 18:20:07.561641,2025-11-26 18:20:08.393871,0 days 00:00:00.832230,24.086002649980802,gbtree,0.6914458006216224,0.5876892409295892,lossguide,0.2917075508303479,0.001573734232464031,5,8,0.16212147661009865,600,,0.6972712713418994,0.4303604091774493,0.09197826619808443,oversample,0.8068639269852584,,5.0,0.9387463271341812,,,,0.7188664344189423,0.3546010458139478,0.5567616463138851,0.5572139303482587,0.715281812899477,0.7156549520766773,0.6972712713418994,0.4303604091774493,0.1,0.4554718570063081,0.43348880445919946,0.5567616463138851,0.5572139303482587,1.0,1.0,oversample,0.33936156103383674,0.3058854449942294,0.8068639269852584,0.3546010458139478,COMPLETE
303,0.7156549520766773,2025-11-26 18:20:08.577983,2025-11-26 18:20:11.150570,0 days 00:00:02.572587,0.07744238629138805,gbtree,0.8750966035237424,3.761506612924281,lossguide,0.00283712738181697,0.0043379530021606105,4,6,0.2113833179243779,400,,0.8040211138032665,0.4776162749756795,0.09954714236166268,none,0.7641340349000576,1.6729224848217479,7.0,0.692455783861008,,,,0.26938107415457,0.4456965683720919,0.5567616463138851,0.5572139303482587,0.715281812899477,0.7156549520766773,0.8040211138032665,0.4776162749756795,0.1,0.611235684940098,0.5811058864021782,0.5567616463138851,0.5572139303482587,1.0,1.0,none,0.6052077289079726,0.5637560855895892,0.7641340349000576,0.4456965683720919,COMPLETE
304,0.0,2025-11-26 18:20:11.343769,2025-11-26 18:20:38.996155,0 days 00:00:27.652386,0.08194091486644241,dart,0.28307016348390246,2.6360604559542042,depthwise,0.00012507303948109622,0.12261904798973271,4,7,0.21484751159475463,500,tree,0.7813607949253144,0.1495189418649727,0.004901754214856281,none,0.8930749412397072,0.5253276842615201,7.0,0.8230939197922775,0.28776410058122315,weighted,0.13154644906243104,0.9936272300498787,0.8401068047618623,0.44323835368611486,0.4427860696517413,0.0,0.0,0.7813607949253144,0.1495189418649727,0.0,0.550635888570939,0.5551561839504057,0.0,0.0,0.0,0.0,none,0.4885923175118951,0.5018335533210406,0.8930749412397072,0.8401068047618623,COMPLETE
305,0.7156549520766773,2025-11-26 18:20:39.168874,2025-11-26 18:21:41.645426,0 days 00:01:02.476552,0.0012032690299712888,dart,0.7804249139443209,2.633207677153304,lossguide,0.0001245819192223776,0.00012136400335645553,2,12,8.157239604571751,800,forest,0.5464698495741425,0.19410608303438995,0.081545735894195,none,0.9904168946434474,2.219733413515326,5.0,0.7375994485878726,0.35187823702525634,uniform,0.16524341277188737,0.2950333386081335,0.2847036939867903,0.5567616463138851,0.5572139303482587,0.715281812899477,0.7156549520766773,0.5464698495741425,0.19410608303438995,0.08,0.7622618274487694,0.7729053238186149,0.5567616463138851,0.5572139303482587,1.0,1.0,none,0.7359679371342362,0.7377728566122335,0.9904168946434474,0.2847036939867903,COMPLETE
306,0.7156549520766773,2025-11-26 18:21:41.805336,2025-11-26 18:21:49.811509,0 days 00:00:08.006173,0.0737899786808077,gbtree,0.9997803533666649,1.0005070818818955,lossguide,0.31440315413495373,0.0004587196428029457,6,10,0.8272152230732148,600,,0.7313256616354815,0.5735290833613016,0.09968670638227832,oversample,0.7890430892425863,,5.0,0.81460103473447,,,,0.5958292846614935,0.4513119803750714,0.5567616463138851,0.5572139303482587,0.715281812899477,0.7156549520766773,0.7313256616354815,0.5735290833613016,0.1,0.5093519376631677,0.5055910703011924,0.5567616463138851,0.5572139303482587,1.0,1.0,oversample,0.44792727001442334,0.444849551623045,0.7890430892425863,0.4513119803750714,COMPLETE
307,0.7156549520766773,2025-11-26 18:21:49.983193,2025-11-26 18:22:10.949006,0 days 00:00:20.965813,0.8252378229877717,dart,0.8096946505058258,6.455662906897757,lossguide,0.00048024475161953707,0.008394219972098148,4,4,0.36835059865369785,400,forest,0.652406856352409,0.8416169019409396,0.029079570188525826,oversample,0.783682018893096,,9.0,0.8784146616467211,0.026993495708621626,uniform,0.11401233541808975,0.22788757190917824,0.06784958056097756,0.5567616463138851,0.5572139303482587,0.715281812899477,0.7156549520766773,0.652406856352409,0.8416169019409396,0.02,0.4548889969198532,0.45445874777599315,0.5567616463138851,0.5572139303482587,1.0,1.0,oversample,0.34529501483777914,0.33937567157051324,0.783682018893096,0.06784958056097756,COMPLETE
308,0.7156549520766773,2025-11-26 18:22:11.116135,2025-11-26 18:23:55.540327,0 days 00:01:44.424192,0.010247358446352692,dart,0.5891223162896319,7.88214266938786,lossguide,0.08011174418703734,0.0006369353374601671,3,3,3.7737862090211434,1000,forest,0.5374019412392148,0.2978218526380308,0.09632641974736406,oversample,0.882915074830844,,11.0,0.7493145597217877,0.3006069799326262,uniform,0.29261091366036723,0.962285096108596,0.1476671736175384,0.5567616463138851,0.5572139303482587,0.715281812899477,0.7156549520766773,0.5374019412392148,0.2978218526380308,0.1,0.5567616463138851,0.5572139303482587,0.5567616463138851,0.5572139303482587,1.0,1.0,oversample,0.5,0.5,0.882915074830844,0.1476671736175384,COMPLETE
309,0.7156549520766773,2025-11-26 18:23:55.712311,2025-11-26 18:23:56.501291,0 days 00:00:00.788980,42.24906604296187,gbtree,0.6466872002531404,0.02190087426142906,lossguide,0.20499605355333872,0.005968175690169453,5,10,0.2376505856461101,700,,0.7757165140229199,0.3409384249935402,0.06190728468239008,oversample,0.6509788750442199,,9.0,0.6820968069639441,,,,0.6952293441539678,0.3066809031428274,0.5567616463138851,0.5572139303482587,0.715281812899477,0.7156549520766773,0.7757165140229199,0.3409384249935402,0.05,0.5567616463138851,0.5572139303482587,0.5567616463138851,0.5572139303482587,1.0,1.0,oversample,0.5,0.5,0.6509788750442199,0.3066809031428274,COMPLETE
310,0.7156549520766773,2025-11-26 18:23:56.679085,2025-11-26 18:23:57.343754,0 days 00:00:00.664669,0.00014337010577223852,gbtree,0.9676508199361252,2.6862822996355455,lossguide,38.1225166957989,0.04294903573855407,2,4,0.3919580497144523,500,,0.5477970277249734,0.16609852372300674,0.07554843816314828,oversample,0.876169918228724,,9.0,0.8008407171926667,,,,0.9995993166557708,0.03929550864389539,0.5567616463138851,0.5572139303482587,0.715281812899477,0.7156549520766773,0.5477970277249734,0.16609852372300674,0.08,0.5813445841226129,0.5857642800172722,0.5567616463138851,0.5572139303482587,1.0,1.0,oversample,0.5419507120476135,0.549330585145192,0.876169918228724,0.03929550864389539,COMPLETE
311,0.7156549520766773,2025-11-26 18:23:57.513566,2025-11-26 18:23:57.993816,0 days 00:00:00.480250,0.20399463247856245,gbtree,0.20258190669007137,8.292781997233618,lossguide,3.4829970116500997,0.3170638580099329,5,7,0.14550770704113347,200,,0.7145779188447078,0.6528483750067152,0.063959315106702,oversample,0.5913302487210271,,12.0,0.6199237612188718,,,,0.9341591460426041,0.0903498267353402,0.5567616463138851,0.5572139303482587,0.715281812899477,0.7156549520766773,0.7145779188447078,0.6528483750067152,0.05,0.5156094435201981,0.5171065619652895,0.5567616463138851,0.5572139303482587,1.0,1.0,oversample,0.37648377791409005,0.38085053990952866,0.5913302487210271,0.0903498267353402,COMPLETE
312,0.04402054292002935,2025-11-26 18:23:58.163283,2025-11-26 18:24:29.576244,0 days 00:00:31.412961,0.01413589354271106,dart,0.7448563441239904,8.045446329892975,lossguide,0.00010612243644290377,0.02205419487525272,6,3,0.16781880025352217,500,forest,0.8496624625361707,0.7292173058865201,0.013753447366220924,oversample,0.9048903640698065,,11.0,0.7623893364063227,0.38750752571296754,uniform,0.8559605031625823,0.6287001241987785,0.5718320086682425,0.4084124830393487,0.41067390321121666,0.0424597364568082,0.04402054292002935,0.8496624625361707,0.7292173058865201,0.02,0.47042153431168643,0.4634689180490464,0.21481481481481482,0.22900763358778625,0.023558082859463852,0.024350649350649352,oversample,0.3730884961620716,0.36119010585941125,0.9048903640698065,0.5718320086682425,COMPLETE
313,0.7156549520766773,2025-11-26 18:24:29.749464,2025-11-26 18:24:30.300117,0 days 00:00:00.550653,0.2027000117258786,gbtree,0.2102147627340364,8.324674622985402,lossguide,0.2756327813183437,0.06489219486699033,6,9,0.26054536209929285,300,,0.8865732512233024,0.9424346988166019,0.07724917230977574,none,0.5139352051827132,1.2612751507188287,12.0,0.7075218564836105,,,,0.7640176825158219,0.165276809140703,0.5567616463138851,0.5572139303482587,0.715281812899477,0.7156549520766773,0.8865732512233024,0.9424346988166019,0.08,0.6387276658338902,0.6569128595809696,0.5567616463138851,0.5572139303482587,1.0,1.0,none,0.6060979956564266,0.6069467751349775,0.5139352051827132,0.165276809140703,COMPLETE
314,0.7156549520766773,2025-11-26 18:24:30.472104,2025-11-26 18:25:00.801932,0 days 00:00:30.329828,0.023945684062818665,dart,0.4901821380272786,2.2173069119575577,depthwise,0.6292393353283802,0.37134901136373055,0,12,53.83895275149396,500,tree,0.9809487579534424,0.2513456430984015,0.060828116305764096,none,0.5435551900674562,3.149249961397152,10.0,0.6631765515198572,0.11775646072994539,weighted,0.016479840859500185,0.9005526715186142,0.021388803551492502,0.5567616463138851,0.5572139303482587,0.715281812899477,0.7156549520766773,0.9809487579534424,0.2513456430984015,0.05,0.689342897959146,0.690971571512409,0.5567616463138851,0.5572139303482587,1.0,1.0,none,0.6532572655382217,0.6565982217476088,0.5435551900674562,0.021388803551492502,COMPLETE
315,0.7156549520766773,2025-11-26 18:25:00.973039,2025-11-26 18:25:42.232357,0 days 00:00:41.259318,1.0623283407434156,dart,0.6026060317841166,6.521718524510174,depthwise,0.0001269453117817865,0.027703606458047748,7,4,0.2599578493876225,600,tree,0.7359383565553328,0.8956458895482453,0.0246817689356352,oversample,0.8359941281408955,,8.0,0.7592642082830415,0.38589996997027065,uniform,0.6561585182074405,0.49140798370909655,0.3459213014761282,0.5567616463138851,0.5572139303482587,0.715281812899477,0.7156549520766773,0.7359383565553328,0.8956458895482453,0.02,0.5480830805989886,0.5616356607111651,0.5567616463138851,0.5572139303482587,1.0,1.0,oversample,0.4672789668263731,0.47825438096122463,0.8359941281408955,0.3459213014761282,COMPLETE
316,0.7156549520766773,2025-11-26 18:25:42.405412,2025-11-26 18:25:50.415358,0 days 00:00:08.009946,0.0018723193256273364,dart,0.5469795966590965,9.971860171843202,lossguide,21.884397778890307,0.0007552230576760231,1,6,4.835113870550374,300,forest,0.674776203306891,0.4234233695802284,0.03926487377956873,undersample,0.775772411555924,,11.0,0.8628252850558785,0.4560683846389396,weighted,0.19896596266088523,0.28351201336109216,0.13700780300835513,0.5567616463138851,0.5572139303482587,0.715281812899477,0.7156549520766773,0.674776203306891,0.4234233695802284,0.05,0.4962399468636398,0.49497094357409543,0.5567616463138851,0.5572139303482587,1.0,1.0,undersample,0.3166452527396011,0.2961522325988618,0.775772411555924,0.13700780300835513,COMPLETE
317,0.7156549520766773,2025-11-26 18:25:50.586324,2025-11-26 18:25:51.143795,0 days 00:00:00.557471,3.4346992811313783,gbtree,0.20140871051034565,7.27382412225786,lossguide,5.791183597231304,0.01084852086888178,6,7,0.18778767813073094,300,,0.9229969698425751,0.811471337653439,0.06025451599057786,oversample,0.5250407518868188,,10.0,0.6554671359535363,,,,0.5639734425375376,0.12536213195914894,0.5567616463138851,0.5572139303482587,0.715281812899477,0.7156549520766773,0.9229969698425751,0.811471337653439,0.05,0.4839023580574469,0.4937302299560205,0.5567616463138851,0.5572139303482587,1.0,1.0,oversample,0.36318821598501294,0.3741874825889126,0.5250407518868188,0.12536213195914894,COMPLETE
318,0.7156549520766773,2025-11-26 18:25:51.313714,2025-11-26 18:26:45.977421,0 days 00:00:54.663707,0.0005161782121735232,dart,0.7811392638940423,0.2841113529234278,depthwise,2.8124250797961965,0.0005413928044961245,3,10,17.98171173861314,700,tree,0.516313514807949,0.14075392069022574,0.049766772294645545,none,0.6937242667764868,0.7819886194844438,5.0,0.9201624595285105,0.29309829396638043,weighted,0.43054810053878195,0.9023525947247882,0.3134119661288944,0.5567616463138851,0.5572139303482587,0.715281812899477,0.7156549520766773,0.516313514807949,0.14075392069022574,0.05,0.5636912475672973,0.5940822207325009,0.5567616463138851,0.5572139303482587,1.0,1.0,none,0.47001193653740947,0.4769464766591937,0.6937242667764868,0.3134119661288944,COMPLETE
319,0.7156549520766773,2025-11-26 18:26:46.140896,2025-11-26 18:26:56.054684,0 days 00:00:09.913788,14.157110270409422,dart,0.5379391492420091,9.080871635417532,lossguide,0.8423432164571202,0.0002921529250521085,2,4,0.530535665896117,300,forest,0.805106388428027,0.6135781541032461,0.08615130757147155,none,0.5114946182003248,1.7106092902985397,12.0,0.7106700020868599,0.3484712108376302,weighted,0.45867976212260864,0.5970244911252603,0.032773334023520964,0.5567616463138851,0.5572139303482587,0.715281812899477,0.7156549520766773,0.805106388428027,0.6135781541032461,0.08,0.5264562177080571,0.5357122938746073,0.5567616463138851,0.5572139303482587,1.0,1.0,none,0.42882507999137914,0.4520875893769153,0.5114946182003248,0.032773334023520964,COMPLETE
