number,value,datetime_start,datetime_complete,duration,params_alpha,params_booster,params_colsample_bytree,params_gamma,params_grow_policy,params_lambda,params_learning_rate,params_max_delta_step,params_max_depth,params_min_child_weight,params_n_estimators,params_normalize_type,params_params_feature_fraction,params_params_labeled_ratio,params_params_missing_rate,params_params_resampling,params_params_sample_rows,params_params_scale_pos_weight,params_params_selftrain_max_iter,params_params_selftrain_threshold,params_rate_drop,params_sample_type,params_skip_drop,params_subsample,params_user_attrs_decision_threshold,user_attrs_acc_test,user_attrs_acc_val,user_attrs_f1_test,user_attrs_f1_val,user_attrs_feature_fraction,user_attrs_labeled_ratio,user_attrs_missing_rate,user_attrs_pr_auc_test,user_attrs_pr_auc_val,user_attrs_prec_test,user_attrs_prec_val,user_attrs_rec_test,user_attrs_rec_val,user_attrs_resampling_strategy,user_attrs_roc_auc_test,user_attrs_roc_auc_val,user_attrs_sample_rows,user_attrs_user_attrs_decision_threshold,state
2511,0.0,2025-11-30 15:03:58.877922,2025-11-30 15:03:59.291778,0 days 00:00:00.413856,4.2282485635337075,gbtree,0.5290569434609849,6.504411755201984,lossguide,89.59026975546287,0.006967226322436301,9,3,22.584334186955154,300,,0.8831552929916071,0.5555320330664018,0.012251640228727968,undersample,0.6679233511569022,,5.0,0.8054981849440018,,,,0.7826314765645157,,0.44323835368611486,0.4427860696517413,0.0,0.0,0.8831552929916071,0.5555320330664018,0.08,0.5567616463138851,0.5572139303482587,0.0,0.0,0.0,0.0,undersample,0.5,0.5,0.6679233511569022,0.5,COMPLETE
2512,0.0,2025-11-30 15:04:00.078845,2025-11-30 15:04:05.740549,0 days 00:00:05.661704,12.425817208791894,dart,0.785704058268571,0.33394411873771457,depthwise,0.0033007238694823847,0.0006336590515464498,6,10,1.212940041727127,200,forest,0.5718855360108248,0.5089771094946263,0.016126186369678865,none,0.9352767703698809,0.5905334976498137,7.0,0.6166852093283995,0.09600089472891682,weighted,0.17795067893558547,0.6268134752073019,,0.44323835368611486,0.4427860696517413,0.0,0.0,0.5718855360108248,0.5089771094946263,0.08,0.6205498088475164,0.6523645188557958,0.0,0.0,0.0,0.0,none,0.6305749432185546,0.6547497446373851,0.9352767703698809,0.5,COMPLETE
2513,0.7156549520766773,2025-11-30 15:04:06.521026,2025-11-30 15:04:06.952750,0 days 00:00:00.431724,0.0002465051321284012,gbtree,0.3918675791376689,7.904256105147233,depthwise,0.06966827642744837,0.00024067946364433814,7,7,9.089152477139452,300,,0.5075975157245085,0.5914749450661616,0.08585430535910171,none,0.9094629822117093,0.7979455108962676,8.0,0.8441790097051243,,,,0.6898457532500576,,0.5567616463138851,0.5572139303482587,0.715281812899477,0.7156549520766773,0.5075975157245085,0.5914749450661616,0.08,0.5411633098366729,0.5403847569762184,0.5567616463138851,0.5572139303482587,1.0,1.0,none,0.4560818315953513,0.44892747701736463,0.9094629822117093,0.5,COMPLETE
2514,0.11223203026481715,2025-11-30 15:04:07.729408,2025-11-30 15:04:08.274177,0 days 00:00:00.544769,0.0879131635535496,gbtree,0.5819448515263814,9.678738448655878,depthwise,0.0036446108144801374,0.13510897356191875,3,6,0.4079942658987547,500,,0.9745136682015892,0.6176863633840609,0.08075780196418098,none,0.5109864358125078,0.7192470795740783,7.0,0.6918479027149895,,,,0.4053590144986112,,0.37358661239258256,0.36318407960199006,0.11388355726167626,0.11223203026481715,0.9745136682015892,0.6176863633840609,0.08,0.5125902464538586,0.5079195774438394,0.2680722891566265,0.2514124293785311,0.07229894394800974,0.07224025974025974,none,0.3909079228767055,0.377996779777934,0.5109864358125078,0.5,COMPLETE
2515,0.0,2025-11-30 15:04:09.052841,2025-11-30 15:04:09.498375,0 days 00:00:00.445534,0.0005488993265803538,gbtree,0.3917246238725083,5.877796067519371,depthwise,0.0007176862999704625,0.004131588896014154,10,10,10.15584621556935,300,,0.9588290269254776,0.5837092912000199,0.04287118888637564,none,0.7502451091390782,0.5284663756270952,12.0,0.8550203010259771,,,,0.8042475238897668,,0.44323835368611486,0.4427860696517413,0.0,0.0,0.9588290269254776,0.5837092912000199,0.08,0.4772630250421432,0.4808406753011325,0.0,0.0,0.0,0.0,none,0.31820031830766426,0.32140079659870263,0.7502451091390782,0.5,COMPLETE
2516,0.20182440136830102,2025-11-30 15:04:10.274368,2025-11-30 15:04:10.642171,0 days 00:00:00.367803,0.0009361534833224535,gbtree,0.3416267914252805,4.880064067813896,depthwise,0.0005761806609948004,0.013428208111037848,10,7,1.1365986821611722,200,,0.5773361147062087,0.8059091932393914,0.023021752938427665,undersample,0.5487769811298436,,6.0,0.7682764682728932,,,,0.9228223856071827,,0.3749434644957033,0.36680235187697874,0.21387940841865757,0.20182440136830102,0.5773361147062087,0.8059091932393914,0.08,0.49726252627624024,0.5008004901478139,0.3567362428842505,0.3390804597701149,0.15272136474411047,0.14366883116883117,undersample,0.3523723868101261,0.3427666881127044,0.5487769811298436,0.5,COMPLETE
2517,0.0,2025-11-30 15:04:11.469305,2025-11-30 15:04:11.951824,0 days 00:00:00.482519,0.0036458179708800634,gbtree,0.43197093878473364,0.7883994785396142,depthwise,0.5211276895480987,0.05366141950244182,3,11,96.39603262215533,400,,0.7466762433685803,0.3852969967221298,0.012381700819534892,none,0.5523209081356651,0.6247678542797601,10.0,0.9057620136016882,,,,0.3220574236927112,,0.44323835368611486,0.4427860696517413,0.0,0.0,0.7466762433685803,0.3852969967221298,0.08,0.5567616463138851,0.5572139303482587,0.0,0.0,0.0,0.0,none,0.5,0.5,0.5523209081356651,0.5,COMPLETE
2518,0.7156549520766773,2025-11-30 15:04:12.739288,2025-11-30 15:05:06.124251,0 days 00:00:53.384963,0.00017729757402829355,dart,0.8465025402447386,0.8882617899238232,depthwise,4.655930415481612,0.015663000544673473,10,11,67.56910155044936,700,forest,0.5417573548841219,0.395652444812103,0.023213762917250524,none,0.7198109039660601,2.8063155330979073,8.0,0.9233857268190329,0.19770196846184518,weighted,0.004910675064354208,0.28582829280333377,,0.5567616463138851,0.5572139303482587,0.715281812899477,0.7156549520766773,0.5417573548841219,0.395652444812103,0.08,0.5551997919697902,0.5331261271894412,0.5567616463138851,0.5572139303482587,1.0,1.0,none,0.5015434606011373,0.47842185903983653,0.7198109039660601,0.5,COMPLETE
2519,0.2739393939393939,2025-11-30 15:05:06.899491,2025-11-30 15:06:28.713649,0 days 00:01:21.814158,0.00019101229557127314,dart,0.7133699085231449,6.937704137861035,lossguide,46.28609195478262,0.009342919861430068,4,4,0.4162099668701524,900,tree,0.5813758686712105,0.4259764581827661,0.012927516685013275,undersample,0.85193649505412,,5.0,0.8502119320916619,0.49349899890732074,weighted,0.4318843969271531,0.7165501439227133,,0.4703753957485301,0.45816372682044326,0.2950030102347983,0.2739393939393939,0.5813758686712105,0.4259764581827661,0.08,0.6244182272312493,0.6053178452548327,0.5697674418604651,0.5406698564593302,0.1990251827782291,0.18344155844155843,undersample,0.616123858154147,0.5810030112890174,0.85193649505412,0.5,COMPLETE
2520,0.7057001239157373,2025-11-30 15:06:29.517435,2025-11-30 15:06:32.397005,0 days 00:00:02.879570,0.007312271959787059,gbtree,0.5470915068888338,2.1080649758640124,lossguide,24.123122574599723,0.3837906486217945,0,5,36.156597705130295,1000,,0.8860453019901177,0.42989612852760234,0.04216546086013782,none,0.9846000730792115,2.0089670633229817,5.0,0.8577359520727385,,,,0.553849520209204,,0.566711895070104,0.5703301673450927,0.7052307692307692,0.7057001239157373,0.8860453019901177,0.42989612852760234,0.08,0.5941752436737209,0.5952011351175497,0.5676077265973254,0.5706412825651302,0.9309504467912266,0.924512987012987,none,0.5439397204860823,0.5475256357534193,0.9846000730792115,0.5,COMPLETE
2521,0.39873703202525934,2025-11-30 15:06:33.181377,2025-11-30 15:06:51.735276,0 days 00:00:18.553899,9.78882234823258,dart,0.2944413965053969,5.028492656497837,depthwise,0.00017808842356116747,0.0012860962049555404,2,8,0.7972408294711677,400,tree,0.8819054937499147,0.5735065756867197,0.02636708115133951,undersample,0.8609112816750331,,11.0,0.8066696931938664,0.4337340121274058,weighted,0.6738572024476498,0.6550002008816624,,0.41926729986431477,0.39710538218000907,0.4288256227758007,0.39873703202525934,0.8819054937499147,0.5735065756867197,0.08,0.49215386322440835,0.48263768768248383,0.47394296951819076,0.44873096446700506,0.3915515840779854,0.3587662337662338,undersample,0.4075162884000066,0.3827877306554528,0.8609112816750331,0.5,COMPLETE
2522,0.31094978826376285,2025-11-30 15:06:52.505805,2025-11-30 15:06:52.869878,0 days 00:00:00.364073,0.002647800934367551,gbtree,0.22325640888767967,8.79958445654153,lossguide,1.0848769562527736,0.0727039650154954,2,6,0.12592687084120655,200,,0.979104413972161,0.41436907413187396,0.09464105329947912,none,0.5894796897101011,0.7619437631899892,9.0,0.8130484684941527,,,,0.5491152051535713,,0.48575305291723203,0.48484848484848486,0.3244206773618538,0.31094978826376285,0.979104413972161,0.41436907413187396,0.1,0.5545705545226873,0.5563675160810019,0.6039823008849557,0.6104513064133017,0.22177091795288384,0.2086038961038961,none,0.4710045756726736,0.46522632755395776,0.5894796897101011,0.5,COMPLETE
2523,0.7156549520766773,2025-11-30 15:06:53.655218,2025-11-30 15:06:54.127245,0 days 00:00:00.472027,50.12327055362008,gbtree,0.4801081365375846,8.369886906491535,depthwise,0.14758272062991357,0.07793704612953856,7,4,1.4695368473270733,400,,0.5454078876368587,0.7217384638960769,0.07255724948351328,oversample,0.5297764227325137,,10.0,0.9202204472838464,,,,0.5540048263462941,,0.5567616463138851,0.5572139303482587,0.715281812899477,0.7156549520766773,0.5454078876368587,0.7217384638960769,0.08,0.5567616463138851,0.5572139303482587,0.5567616463138851,0.5572139303482587,1.0,1.0,oversample,0.5,0.5,0.5297764227325137,0.5,COMPLETE
2524,0.4090150250417362,2025-11-30 15:06:54.919671,2025-11-30 15:07:06.558988,0 days 00:00:11.639317,0.0003105198713984263,dart,0.28279738477470834,5.8733907526031395,lossguide,20.552826269564555,0.12110318144278484,6,6,0.1868478103811278,300,forest,0.6414831446222242,0.5138953702715691,0.016256404111280254,undersample,0.6958944784291725,,8.0,0.6332162996018174,0.11184525555516422,weighted,0.3876999050965742,0.33601319347201253,,0.36635006784260515,0.35956580732700133,0.41551939924906134,0.4090150250417362,0.6414831446222242,0.5138953702715691,0.08,0.4741881282319551,0.46305768431284067,0.42710120068610635,0.4209621993127148,0.40454914703493094,0.3977272727272727,undersample,0.3299059997679007,0.3124854907605163,0.6958944784291725,0.5,COMPLETE
2525,0.0,2025-11-30 15:07:07.338297,2025-11-30 15:07:55.647855,0 days 00:00:48.309558,0.00020616158218137888,dart,0.5513688544873456,9.080222450535674,depthwise,38.430512818327266,0.004418104598265336,3,5,0.4414656220591793,600,forest,0.5361026945736956,0.6978557808227319,0.06210951088925183,undersample,0.8506256918581359,,8.0,0.7653244180205807,0.012767465509343046,uniform,0.7921426704155135,0.7979301699736434,,0.44323835368611486,0.4427860696517413,0.0,0.0,0.5361026945736956,0.6978557808227319,0.08,0.5567616463138851,0.5572139303482587,0.0,0.0,0.0,0.0,undersample,0.5,0.5,0.8506256918581359,0.5,COMPLETE
2526,0.6570841889117043,2025-11-30 15:07:56.421836,2025-11-30 15:07:58.084919,0 days 00:00:01.663083,4.301042912665008,gbtree,0.8809549305709405,2.9032020744534757,depthwise,3.4262420383713112,0.09464229707943635,6,12,0.9973990062091252,400,,0.6438017312527571,0.8886811350768129,0.09290853379300343,none,0.6603925833381403,0.8958432228194371,10.0,0.6402306646607145,,,,0.20486823620731587,,0.5450022614201718,0.5468113975576662,0.6535812672176309,0.6570841889117043,0.6438017312527571,0.8886811350768129,0.1,0.524149602780436,0.5194575661875882,0.5672444710101614,0.5680473372781065,0.7709179528838342,0.7792207792207793,none,0.4799341832590063,0.4844029821047186,0.6603925833381403,0.5,COMPLETE
2527,0.5709006928406467,2025-11-30 15:07:58.864809,2025-11-30 15:07:59.648527,0 days 00:00:00.783718,0.01877440073680595,gbtree,0.7331164580504539,7.108820010446733,depthwise,0.5144021331767538,0.04483888463251801,3,3,0.10023573687775604,900,,0.8561257119902494,0.3441410637213791,0.08355163860597851,undersample,0.9372384859324321,,8.0,0.6809963521311688,,,,0.7200505792927074,,0.5522388059701493,0.5798281320669381,0.543778801843318,0.5709006928406467,0.8561257119902494,0.3441410637213791,0.08,0.7026101876111698,0.7096384212033373,0.6283280085197018,0.662379421221865,0.479285134037368,0.5016233766233766,undersample,0.6598977933984317,0.6760418463048699,0.9372384859324321,0.5,COMPLETE
2528,0.4078794901506373,2025-11-30 15:08:00.436055,2025-11-30 15:08:24.255692,0 days 00:00:23.819637,0.19697825993856197,dart,0.23673473620631366,9.109571435700026,lossguide,0.003458312853770358,0.004752334239459118,8,6,58.71922345538179,500,forest,0.6365656184567937,0.8650187474466384,0.04354394358089665,undersample,0.6022830950946401,,10.0,0.7086458795453839,0.3669764228266717,weighted,0.18307021093286227,0.5461346734660931,,0.5522388059701493,0.5377657168701945,0.44130925507900676,0.4078794901506373,0.6365656184567937,0.8650187474466384,0.08,0.6529769385295637,0.6353954432245786,0.722735674676525,0.7125506072874493,0.31762794476035744,0.2857142857142857,undersample,0.6497662428090651,0.6219596925036148,0.6022830950946401,0.5,COMPLETE
2529,0.715281812899477,2025-11-30 15:08:25.003677,2025-11-30 15:08:25.790062,0 days 00:00:00.786385,0.7488329936446092,gbtree,0.5007900577935344,2.339895934695555,lossguide,54.96039022759504,0.02535712030168634,2,10,1.6883607309522701,800,,0.7628999413639794,0.782787062838429,0.02006285853022395,oversample,0.7695535747325719,,9.0,0.8666716106242683,,,,0.20557837239512677,,0.5563093622795116,0.5567616463138851,0.7149084568439407,0.715281812899477,0.7628999413639794,0.782787062838429,0.08,0.41717347222748835,0.4169611157095084,0.5565610859728507,0.5570135746606335,0.9991876523151909,0.9991883116883117,oversample,0.2751052736285416,0.27218379807118315,0.7695535747325719,0.5,COMPLETE
2530,0.7156549520766773,2025-11-30 15:08:26.566573,2025-11-30 15:08:26.995937,0 days 00:00:00.429364,0.041106532651281245,gbtree,0.5813752456705161,6.3901240007880595,depthwise,0.021011900510052757,0.00030463435515282156,2,12,7.799251908268726,300,,0.6910567885572929,0.4070711949422637,0.05626247232617693,none,0.7834366801926359,1.6928540981011477,5.0,0.6169510919789385,,,,0.613614708689239,,0.5567616463138851,0.5572139303482587,0.715281812899477,0.7156549520766773,0.6910567885572929,0.4070711949422637,0.08,0.48631349489651854,0.4849794222904177,0.5567616463138851,0.5572139303482587,1.0,1.0,none,0.34208168238863373,0.34260045368319114,0.7834366801926359,0.5,COMPLETE
2531,0.7156549520766773,2025-11-30 15:08:27.775688,2025-11-30 15:08:28.633857,0 days 00:00:00.858169,0.0019555739428367283,gbtree,0.2957866106136493,5.934967777107625,lossguide,0.3641385958499915,0.0003262563724607923,3,5,0.12307364141192642,1000,,0.9370014039634929,0.8130143806635872,0.060007127999444854,oversample,0.6511000594044546,,6.0,0.921525137775729,,,,0.5268832393369818,,0.5567616463138851,0.5572139303482587,0.715281812899477,0.7156549520766773,0.9370014039634929,0.8130143806635872,0.08,0.48205738538819065,0.47721423599626334,0.5567616463138851,0.5572139303482587,1.0,1.0,oversample,0.40531756163066357,0.3954178163511667,0.6511000594044546,0.5,COMPLETE
2532,0.2857142857142857,2025-11-30 15:08:29.391877,2025-11-30 15:08:29.860416,0 days 00:00:00.468539,0.007143836713901617,gbtree,0.49079803956354334,7.609714997119036,depthwise,29.096946598619667,0.018048855092637827,8,9,0.27196689783335526,400,,0.7245473388183002,0.3891957279677042,0.09757602077156047,undersample,0.7926852092703323,,9.0,0.6887796691842536,,,,0.2793369460727941,,0.48575305291723203,0.4798733604703754,0.30030769230769233,0.2857142857142857,0.7245473388183002,0.3891957279677042,0.1,0.5958234626462244,0.5893589045664862,0.6192893401015228,0.6084656084656085,0.19821283509341997,0.18668831168831168,undersample,0.553608730250833,0.5379138864200151,0.7926852092703323,0.5,COMPLETE
2533,0.491817398794143,2025-11-30 15:08:30.630925,2025-11-30 15:08:30.995207,0 days 00:00:00.364282,0.23071308029697782,gbtree,0.931507672718922,5.491201046414588,depthwise,0.08017401286301955,0.009381925500728066,6,3,5.619158326887457,200,,0.9543768678679991,0.6854003594267053,0.02408422922617003,undersample,0.8048818479377589,,6.0,0.8560708081958077,,,,0.44080215774449477,,0.4658525554047942,0.4663048394391678,0.4911676001723395,0.491817398794143,0.9543768678679991,0.6854003594267053,0.08,0.5291614443899004,0.5265331262393415,0.5229357798165137,0.5238532110091743,0.46303818034118605,0.463474025974026,undersample,0.44489257116331504,0.4499348327872331,0.8048818479377589,0.5,COMPLETE
2534,0.7156549520766773,2025-11-30 15:08:31.768017,2025-11-30 15:08:32.131550,0 days 00:00:00.363533,0.011471660153422238,gbtree,0.4969722780070557,8.264253851711837,lossguide,0.0024097307451177046,0.010408772719141068,8,11,12.295594753751732,200,,0.8809464133409065,0.6617257948914614,0.09243466900712888,oversample,0.8023562247645695,,9.0,0.6439553962180533,,,,0.8453936315042285,,0.5567616463138851,0.5572139303482587,0.715281812899477,0.7156549520766773,0.8809464133409065,0.6617257948914614,0.1,0.49916379804269934,0.49625239531055826,0.5567616463138851,0.5572139303482587,1.0,1.0,oversample,0.3205337455859679,0.29801065890187445,0.8023562247645695,0.5,COMPLETE
2535,0.7156549520766773,2025-11-30 15:08:32.929386,2025-11-30 15:08:33.280035,0 days 00:00:00.350649,25.541886498863114,gbtree,0.22482083661356356,9.251087731108887,depthwise,20.18849020608622,0.01706452537903133,0,3,0.143363744739006,200,,0.8916206192239342,0.40875455728963217,0.012144412649291081,oversample,0.5278439106962453,,9.0,0.7556212485339834,,,,0.7185958117123377,,0.5567616463138851,0.5572139303482587,0.715281812899477,0.7156549520766773,0.8916206192239342,0.40875455728963217,0.08,0.5567616463138851,0.5572139303482587,0.5567616463138851,0.5572139303482587,1.0,1.0,oversample,0.5,0.5,0.5278439106962453,0.5,COMPLETE
2536,0.23196448390677027,2025-11-30 15:08:34.086440,2025-11-30 15:09:16.841240,0 days 00:00:42.754800,0.12441638763949059,dart,0.6253425627601836,3.614101744878787,depthwise,1.276413324291559,0.000720591857157592,3,8,21.28715436983899,600,forest,0.6856232727058517,0.41185483636853026,0.09802800179423186,undersample,0.6860352645562231,,5.0,0.7280910233856219,0.35423860440423005,weighted,0.6224007081490217,0.8754307046040857,,0.3889642695612845,0.37403889642695615,0.2564667033571822,0.23196448390677027,0.6856232727058517,0.41185483636853026,0.1,0.5134811525341747,0.5093786200016922,0.39761092150170646,0.36666666666666664,0.1892770105605199,0.16964285714285715,undersample,0.47506880087534603,0.4719776839605747,0.6860352645562231,0.5,COMPLETE
2537,0.0,2025-11-30 15:09:17.612709,2025-11-30 15:09:18.345287,0 days 00:00:00.732578,8.081275177957279,gbtree,0.22987324420192828,9.604326206179827,depthwise,0.021819898793536775,0.03780474529316306,2,5,2.2157278937968052,800,,0.950103952566197,0.2352498534326159,0.09407987264321169,undersample,0.7557444172082699,,5.0,0.7052569776511067,,,,0.9513379190476987,,0.44323835368611486,0.4427860696517413,0.0,0.0,0.950103952566197,0.2352498534326159,0.1,0.5567616463138851,0.5572139303482587,0.0,0.0,0.0,0.0,undersample,0.5,0.5,0.7557444172082699,0.5,COMPLETE
2538,0.7156549520766773,2025-11-30 15:09:19.118327,2025-11-30 15:09:19.520503,0 days 00:00:00.402176,0.3135799147384643,gbtree,0.9138024891450958,1.5604059634335676,depthwise,0.012225325461317,0.00944568953920567,9,9,44.24478417515601,200,,0.5676393622235014,0.5081614630766889,0.009566664723066066,oversample,0.7458420138229171,,10.0,0.8434781639980713,,,,0.26477569669423195,,0.5567616463138851,0.5572139303482587,0.715281812899477,0.7156549520766773,0.5676393622235014,0.5081614630766889,0.08,0.5066877217347303,0.4971113944714803,0.5567616463138851,0.5572139303482587,1.0,1.0,oversample,0.42803386992489934,0.40910873472798914,0.7458420138229171,0.5,COMPLETE
2539,0.36380090497737555,2025-11-30 15:09:20.292190,2025-11-30 15:09:25.579545,0 days 00:00:05.287355,4.636688090753576,dart,0.44756466188970156,5.008407519620471,lossguide,8.655321127728225,0.0005931731192553787,5,4,1.7601515425753242,200,tree,0.7295527971778389,0.8862056110613512,0.03613499910471152,undersample,0.8764546118246217,,6.0,0.8366689725800366,0.3092344963928709,weighted,0.6259348598366209,0.5999714973323551,,0.36635006784260515,0.36408864767073723,0.3714670255720054,0.36380090497737555,0.7295527971778389,0.8862056110613512,0.08,0.4532330003176155,0.44947118901502947,0.4148296593186373,0.4110429447852761,0.3363119415109667,0.3262987012987013,undersample,0.3333709113214742,0.3307157283472401,0.8764546118246217,0.5,COMPLETE
2540,0.7156549520766773,2025-11-30 15:09:26.353594,2025-11-30 15:10:42.146918,0 days 00:01:15.793324,19.103392638918095,dart,0.4108223171976564,3.749599388927555,lossguide,0.010674213776114768,0.015389833782208517,1,11,0.17055069997336497,900,forest,0.859108914726978,0.2912178074685803,0.06655251733029816,none,0.897397167281037,3.7476876681450797,6.0,0.8691534528152467,0.4882623563254211,uniform,0.3882894767293481,0.3228303735425387,,0.5567616463138851,0.5572139303482587,0.715281812899477,0.7156549520766773,0.859108914726978,0.2912178074685803,0.08,0.41772143281804186,0.4184953198558385,0.5567616463138851,0.5572139303482587,1.0,1.0,none,0.2646467116497289,0.26492793468023296,0.897397167281037,0.5,COMPLETE
