number,value,datetime_start,datetime_complete,duration,params_alpha,params_booster,params_colsample_bytree,params_gamma,params_grow_policy,params_lambda,params_learning_rate,params_max_delta_step,params_max_depth,params_min_child_weight,params_n_estimators,params_normalize_type,params_params_feature_fraction,params_params_labeled_ratio,params_params_missing_rate,params_params_resampling,params_params_sample_rows,params_params_scale_pos_weight,params_params_selftrain_max_iter,params_params_selftrain_threshold,params_rate_drop,params_sample_type,params_skip_drop,params_subsample,params_user_attrs_decision_threshold,user_attrs_acc_test,user_attrs_acc_val,user_attrs_f1_test,user_attrs_f1_val,user_attrs_feature_fraction,user_attrs_labeled_ratio,user_attrs_missing_rate,user_attrs_pr_auc_test,user_attrs_pr_auc_val,user_attrs_prec_test,user_attrs_prec_val,user_attrs_rec_test,user_attrs_rec_val,user_attrs_resampling_strategy,user_attrs_roc_auc_test,user_attrs_roc_auc_val,user_attrs_sample_rows,user_attrs_user_attrs_decision_threshold,state
2750,0.7106569343065693,2025-11-30 17:02:28.045834,2025-11-30 17:02:29.682459,0 days 00:00:01.636625,0.05172080003119669,gbtree,0.47919180771549014,2.2852833629447877,depthwise,0.0022505374967214027,0.3807539451740773,9,4,0.4306048223814389,900,,0.828862696426999,0.8586257171865042,0.01743976154127147,none,0.9180837639417807,3.8538197992119967,12.0,0.6482498186250497,,,,0.9141276109186542,,0.55359565807327,0.5517865219357757,0.7121609798775154,0.7106569343065693,0.828862696426999,0.8586257171865042,0.08,0.5492249561987551,0.5571892396305689,0.5555050045495905,0.5549475604195167,0.991876523151909,0.9878246753246753,none,0.47626162569008107,0.5056445087088601,0.9180837639417807,0.5,COMPLETE
2751,0.6312607944732297,2025-11-30 17:02:30.429527,2025-11-30 17:02:31.129074,0 days 00:00:00.699547,0.30558985989499693,gbtree,0.5740992544243052,3.5563627278259546,lossguide,6.977804002978412,0.07611388442576374,1,10,72.66641592409093,800,,0.7683576485651654,0.44058905214072125,0.0884311047332464,undersample,0.5192451963213478,,11.0,0.6317982781326772,,,,0.87764201381364,,0.6273179556761647,0.613749434644957,0.6508474576271186,0.6312607944732297,0.7683576485651654,0.44058905214072125,0.08,0.754290213089804,0.7285705341756488,0.6802480070859167,0.6743542435424354,0.6238830219333875,0.5933441558441559,undersample,0.701312604651934,0.6747447202950267,0.5192451963213478,0.5,COMPLETE
2752,0.7156549520766773,2025-11-30 17:02:31.885370,2025-11-30 17:02:55.052997,0 days 00:00:23.167627,0.0034635731483002394,dart,0.20891461398154096,0.9065680013040311,lossguide,32.23510435480927,0.0007049231925084507,4,6,0.2261215695287881,500,forest,0.7253505682788235,0.258462652478877,0.08981889171339508,oversample,0.8586593920221774,,9.0,0.7377924473919613,0.47348412204536006,weighted,0.4500601098283968,0.2850231745054168,,0.5567616463138851,0.5572139303482587,0.715281812899477,0.7156549520766773,0.7253505682788235,0.258462652478877,0.08,0.40055322548747935,0.3984797278150759,0.5567616463138851,0.5572139303482587,1.0,1.0,oversample,0.21479716175666042,0.2075957112346285,0.8586593920221774,0.5,COMPLETE
2753,0.7156549520766773,2025-11-30 17:02:55.805573,2025-11-30 17:02:56.363817,0 days 00:00:00.558244,0.21981635036534572,gbtree,0.3296705759118902,9.487858623926291,lossguide,0.0010575390637317524,0.00019873310286213795,6,10,75.31497359270462,500,,0.8028412574112666,0.37942269367314746,0.07055332307489182,oversample,0.8374123442317594,,11.0,0.6142498709033104,,,,0.6031202443639161,,0.5567616463138851,0.5572139303482587,0.715281812899477,0.7156549520766773,0.8028412574112666,0.37942269367314746,0.08,0.5567616463138851,0.5572139303482587,0.5567616463138851,0.5572139303482587,1.0,1.0,oversample,0.5,0.5,0.8374123442317594,0.5,COMPLETE
2754,0.7156549520766773,2025-11-30 17:02:57.106283,2025-11-30 17:02:57.549722,0 days 00:00:00.443439,1.4823764988661867,gbtree,0.9170415558861793,6.072408923064354,lossguide,0.12683209345098628,0.06118146445330761,8,3,1.3962188526894204,300,,0.6342320834681623,0.840484724032434,0.09229665246491894,none,0.9379918742228688,2.551321974036353,6.0,0.7001355554933819,,,,0.870100428116384,,0.5567616463138851,0.5572139303482587,0.715281812899477,0.7156549520766773,0.6342320834681623,0.840484724032434,0.1,0.4663397387004633,0.4601261462076139,0.5567616463138851,0.5572139303482587,1.0,1.0,none,0.31702863111125845,0.304728436782829,0.9379918742228688,0.5,COMPLETE
2755,0.672753834915997,2025-11-30 17:02:58.293581,2025-11-30 17:02:59.760209,0 days 00:00:01.466628,0.0006597844643211929,gbtree,0.7137719436652255,4.85313933970845,depthwise,0.0078789084667517,0.3959253098844689,9,6,0.25458194588895716,400,,0.7259412520474009,0.25256514988069,0.0018336638311006294,oversample,0.6545713460027875,,8.0,0.7658678178036129,,,,0.5246245352667456,,0.5897783808231569,0.5947535052012664,0.6601723491944549,0.672753834915997,0.7259412520474009,0.25256514988069,0.08,0.6155056016164449,0.6217563819496063,0.6126564673157163,0.6115537848605578,0.7156783103168156,0.747564935064935,oversample,0.5965081483446344,0.6110823229375324,0.6545713460027875,0.5,COMPLETE
2756,0.7156549520766773,2025-11-30 17:03:00.499362,2025-11-30 17:07:09.306917,0 days 00:04:08.807555,0.03349708658963306,dart,0.5720748269574494,2.0029072126091707,lossguide,0.12254133281814086,0.0006900657705123661,4,9,0.3255011093328531,1000,forest,0.964476840247029,0.3134720645721991,0.0016555442103573293,none,0.9914869210033235,1.5110908164009507,7.0,0.6857216270162324,0.4925326847560874,uniform,0.14410381048504628,0.31342920185788614,,0.5567616463138851,0.5572139303482587,0.715281812899477,0.7156549520766773,0.964476840247029,0.3134720645721991,0.08,0.45262007737761845,0.45437400402035644,0.5567616463138851,0.5572139303482587,1.0,1.0,none,0.3268194930287306,0.32832584932942444,0.9914869210033235,0.5,COMPLETE
2757,0.0,2025-11-30 17:07:10.071713,2025-11-30 17:07:10.913419,0 days 00:00:00.841706,49.044986146319985,gbtree,0.790100038886671,1.4320819800276363,depthwise,0.00269344430832257,0.15937238080473548,4,9,34.926859861105534,1000,,0.5682844144409143,0.3610808829130635,0.024855469396119337,none,0.6962412880367289,0.6857301474017156,7.0,0.6598539680584116,,,,0.2893653620059664,,0.44323835368611486,0.4427860696517413,0.0,0.0,0.5682844144409143,0.3610808829130635,0.08,0.5567616463138851,0.5572139303482587,0.0,0.0,0.0,0.0,none,0.5,0.5,0.6962412880367289,0.5,COMPLETE
2758,0.7156549520766773,2025-11-30 17:07:11.667323,2025-11-30 17:10:18.912274,0 days 00:03:07.244951,0.00204397726655,dart,0.27000708476342555,6.1331902500237945,depthwise,0.00016329032736224787,0.027497364834534375,1,5,5.842547911005968,1000,tree,0.5741961207095009,0.5362879567591277,0.05293615098709299,none,0.763005808453038,1.9828095527085485,11.0,0.6475610736130244,0.05774514098811545,uniform,0.7220576950818105,0.43459925283616463,,0.5567616463138851,0.5572139303482587,0.715281812899477,0.7156549520766773,0.5741961207095009,0.5362879567591277,0.08,0.5055064669472928,0.49983672511634736,0.5567616463138851,0.5572139303482587,1.0,1.0,none,0.436808468310151,0.42310849263096456,0.763005808453038,0.5,COMPLETE
2759,0.0,2025-11-30 17:10:19.663943,2025-11-30 17:12:25.165533,0 days 00:02:05.501590,0.01519992347994821,dart,0.7586066385603338,9.895766492019574,depthwise,0.0018711935243126,0.06895945400786956,1,4,0.6808143742314033,1000,forest,0.9843047427142037,0.4540318948178095,0.0778536582017388,none,0.6800108686520188,0.5262227712346917,12.0,0.8387595067278114,0.0658912499867838,uniform,0.8658678497690767,0.4350525825248694,,0.44323835368611486,0.4427860696517413,0.0,0.0,0.9843047427142037,0.4540318948178095,0.08,0.4833595896319733,0.48573614755709643,0.0,0.0,0.0,0.0,none,0.3123750393739949,0.3160891712985686,0.6800108686520188,0.5,COMPLETE
2760,0.7156549520766773,2025-11-30 17:12:25.911381,2025-11-30 17:12:26.608029,0 days 00:00:00.696648,0.009993946182458765,gbtree,0.22872809545013428,0.10677559389770552,lossguide,7.057756668406497,0.00014638030729600677,5,12,23.08021051668545,200,,0.9639954019330368,0.36459800646070306,0.003818312811892455,none,0.9333402117196379,2.450084143697909,7.0,0.7405051513304899,,,,0.6000256628980103,,0.5567616463138851,0.5572139303482587,0.715281812899477,0.7156549520766773,0.9639954019330368,0.36459800646070306,0.08,0.5044974441701303,0.5094082667644543,0.5567616463138851,0.5572139303482587,1.0,1.0,none,0.4474125068386412,0.44850919637053444,0.9333402117196379,0.5,COMPLETE
2761,0.7156549520766773,2025-11-30 17:12:27.367399,2025-11-30 17:13:15.908758,0 days 00:00:48.541359,31.285381270912698,dart,0.6937065651758476,8.15484934539598,depthwise,0.00026044333627235096,0.00043440684932394296,2,5,0.22519585378852897,700,tree,0.9991826131197319,0.2921197087168918,0.0201226212675961,none,0.9656296872028483,4.577802242519838,8.0,0.6174802709749806,0.3951683024698451,weighted,0.2512548018811756,0.4667342942465544,,0.5567616463138851,0.5572139303482587,0.715281812899477,0.7156549520766773,0.9991826131197319,0.2921197087168918,0.08,0.5567616463138851,0.5572139303482587,0.5567616463138851,0.5572139303482587,1.0,1.0,none,0.5,0.5,0.9656296872028483,0.5,COMPLETE
2762,0.20182440136830102,2025-11-30 17:13:16.645928,2025-11-30 17:15:20.809155,0 days 00:02:04.163227,0.60019549179265,dart,0.7600095434507206,6.611269625969212,lossguide,0.013277122639346042,0.0003997993840710902,0,4,6.2134681536212035,1000,forest,0.6878439969701535,0.8646720663983785,0.08903779948393152,undersample,0.5954198847859729,,7.0,0.7724970172184094,0.06674520330793993,uniform,0.5276375687461488,0.888221150257581,,0.3749434644957033,0.36680235187697874,0.21387940841865757,0.20182440136830102,0.6878439969701535,0.8646720663983785,0.08,0.5208260667215544,0.5191599031282079,0.3567362428842505,0.3390804597701149,0.15272136474411047,0.14366883116883117,undersample,0.4549615378239029,0.446158285024475,0.5954198847859729,0.5,COMPLETE
2763,0.29473684210526313,2025-11-30 17:15:21.549664,2025-11-30 17:15:26.783790,0 days 00:00:05.234126,0.15103766731580137,dart,0.5346687686803557,8.081418951744508,depthwise,0.44360361267683135,0.003688319454178381,0,6,16.17028921922982,200,forest,0.6821785850874197,0.44205594340484355,0.09002789672249584,undersample,0.8222676400498279,,6.0,0.6164355968863022,0.18315177365758972,weighted,0.7359819223801893,0.9480153796460349,,0.4785165083672546,0.48484848484848486,0.29046153846153844,0.29473684210526313,0.6821785850874197,0.44205594340484355,0.1,0.5838658418686383,0.579195582828618,0.5989847715736041,0.6214099216710183,0.1917140536149472,0.19318181818181818,undersample,0.5589362389960048,0.548633312550575,0.8222676400498279,0.5,COMPLETE
2764,0.0,2025-11-30 17:15:27.539377,2025-11-30 17:15:28.223932,0 days 00:00:00.684555,0.00021830975425305286,gbtree,0.9868930920702745,6.029677738786898,depthwise,6.072904247132663,0.01826965519616037,8,7,54.21943036250382,700,,0.922697479495123,0.7658154289233188,0.09418685796965874,none,0.8610309973301388,0.5273095200297516,9.0,0.9491993131517402,,,,0.44672327231879366,,0.44323835368611486,0.4427860696517413,0.0,0.0,0.922697479495123,0.7658154289233188,0.1,0.4887691896822041,0.4720819443381812,0.0,0.0,0.0,0.0,none,0.4011306553490608,0.3698662165209663,0.8610309973301388,0.5,COMPLETE
2765,0.45707070707070707,2025-11-30 17:15:28.979579,2025-11-30 17:15:29.561252,0 days 00:00:00.581673,0.0011221004197887689,gbtree,0.39100932029488517,7.37612173469643,lossguide,2.864349411471227,0.26737991255822685,9,3,0.3904638294678802,600,,0.7475389895242044,0.2465796518065058,0.0018508253868771418,undersample,0.5335853075380956,,10.0,0.8790173509491468,,,,0.7413138571138986,,0.4251469923111714,0.41655359565807326,0.4745762711864407,0.45707070707070707,0.7475389895242044,0.2465796518065058,0.08,0.5234388541887722,0.514770856804554,0.4831649831649832,0.47465034965034963,0.4662875710804224,0.4407467532467532,undersample,0.41590460717186956,0.39483827587121767,0.5335853075380956,0.5,COMPLETE
2766,0.7270581292416642,2025-11-30 17:15:30.306877,2025-11-30 17:16:49.312852,0 days 00:01:19.005975,0.11199259304377245,dart,0.9977461055495049,4.292598751982634,depthwise,0.00035732393322975703,0.487989686852963,10,8,71.82832049556598,800,tree,0.8938716478086967,0.2775340075552518,0.07480582859988599,oversample,0.8813235180872054,,5.0,0.9015104245233176,0.15662228730370836,weighted,0.8334357951283858,0.6738490057480637,,0.5784712799638173,0.5816372682044324,0.7253977607542722,0.7270581292416642,0.8938716478086967,0.2775340075552518,0.08,0.5018819481115119,0.5074549255858571,0.5691169671752196,0.5711636532220676,1.0,1.0,oversample,0.4397130257464481,0.4425624809307138,0.8813235180872054,0.5,COMPLETE
2767,0.7156549520766773,2025-11-30 17:16:50.057154,2025-11-30 17:18:01.373257,0 days 00:01:11.316103,0.13446546539463983,dart,0.4161205139131517,5.609569312213198,depthwise,0.00027913171536380054,0.00037081005862084083,9,5,0.1239555767692812,800,tree,0.5959047735204264,0.5424517695405977,0.059618355423186914,none,0.5912569770116065,0.8635544221674224,6.0,0.9237079391809233,0.44693976444922867,uniform,0.7101027027453937,0.9363324564758064,,0.5567616463138851,0.5572139303482587,0.715281812899477,0.7156549520766773,0.5959047735204264,0.5424517695405977,0.08,0.5189890645116882,0.5284996115546207,0.5567616463138851,0.5572139303482587,1.0,1.0,none,0.4082921633316202,0.42673787525038803,0.5912569770116065,0.5,COMPLETE
2768,0.7156549520766773,2025-11-30 17:18:02.113448,2025-11-30 17:18:02.642600,0 days 00:00:00.529152,0.00024377088399220824,gbtree,0.9276015596173235,4.316601234555604,lossguide,13.182691270712391,0.0016984291285069703,5,12,0.14377009882846897,400,,0.6259805287266342,0.5967214158562777,0.014617276524489454,oversample,0.6834798187251542,,10.0,0.6059188553459436,,,,0.6076127833534263,,0.5567616463138851,0.5572139303482587,0.715281812899477,0.7156549520766773,0.6259805287266342,0.5967214158562777,0.08,0.6191631151007909,0.6544773973078121,0.5567616463138851,0.5572139303482587,1.0,1.0,oversample,0.5417165403935742,0.5566735039730443,0.6834798187251542,0.5,COMPLETE
2769,0.7156549520766773,2025-11-30 17:18:03.399643,2025-11-30 17:18:35.377556,0 days 00:00:31.977913,0.7906696686927732,dart,0.34025173525224384,2.952475103393123,depthwise,7.597286412604915,0.19393223893151137,7,11,33.88348059381489,500,tree,0.858252197133506,0.2376815083393303,0.03594131391703936,none,0.7923692578310851,1.940890538867762,6.0,0.8803302022458925,0.007282672425528602,weighted,0.8205609159652549,0.8859070470924653,,0.5567616463138851,0.5572139303482587,0.715281812899477,0.7156549520766773,0.858252197133506,0.2376815083393303,0.08,0.6336881184099438,0.6412712033011899,0.5567616463138851,0.5572139303482587,1.0,1.0,none,0.6083999237387888,0.6189156540599339,0.7923692578310851,0.5,COMPLETE
2770,0.7156549520766773,2025-11-30 17:18:36.131053,2025-11-30 17:18:36.549281,0 days 00:00:00.418228,6.851663831517667,gbtree,0.5231273042064812,5.114387344216023,depthwise,0.0002411386022064865,0.00017986305498152226,4,10,5.525269553974322,200,,0.9244382701415974,0.25074608118909514,0.0710175101490725,none,0.7254375486607413,2.9562184846599258,10.0,0.6987025821545801,,,,0.8251971733289098,,0.5567616463138851,0.5572139303482587,0.715281812899477,0.7156549520766773,0.9244382701415974,0.25074608118909514,0.08,0.5567616463138851,0.5572139303482587,0.5567616463138851,0.5572139303482587,1.0,1.0,none,0.5,0.5,0.7254375486607413,0.5,COMPLETE
2771,0.42179616548940463,2025-11-30 17:18:37.305337,2025-11-30 17:18:38.017162,0 days 00:00:00.711825,0.290456144826205,gbtree,0.7285957173931887,4.251151100461469,lossguide,0.01290068101777768,0.0023115895359171563,6,6,2.721023508488065,400,,0.7303303728995998,0.23118695641495068,0.08557062511366982,undersample,0.9551768874929693,,5.0,0.7438740257627756,,,,0.991686747320198,,0.47173224785165085,0.4816824966078697,0.3935617860851506,0.42179616548940463,0.7303303728995998,0.23118695641495068,0.08,0.5423008285884396,0.5497206051733992,0.5453237410071943,0.5573333333333333,0.30787977254264826,0.3392857142857143,undersample,0.46595019811336397,0.4796058129817068,0.9551768874929693,0.5,COMPLETE
2772,0.4316279069767442,2025-11-30 17:18:38.784789,2025-11-30 17:19:58.645288,0 days 00:01:19.860499,5.620882454862909,dart,0.5250336419907506,3.5772425178028247,lossguide,0.000418864812978171,0.09481725779965099,1,9,3.028847684425018,800,forest,0.8747780888955361,0.7614643289865024,0.0189440586164916,undersample,0.7120585519297601,,10.0,0.6623471976582375,0.15521654162372905,weighted,0.8970565757733346,0.8538040908125881,,0.4500226142017187,0.4473089099954772,0.44424131627056673,0.4316279069767442,0.8747780888955361,0.7614643289865024,0.08,0.5057471129679034,0.507703585785023,0.5078369905956113,0.5054466230936819,0.39480097481722176,0.37662337662337664,undersample,0.4087455859679371,0.41229662191740846,0.7120585519297601,0.5,COMPLETE
2773,0.6102062975027145,2025-11-30 17:19:59.406484,2025-11-30 17:20:04.001270,0 days 00:00:04.594786,0.0001791999067220336,gbtree,0.9612856787621205,2.5018909087387176,depthwise,0.005558200923928818,0.023698295258722624,5,11,0.6770514277501309,600,,0.7059485101748224,0.6836805459573972,0.07946512052468761,oversample,0.6531043474263621,,9.0,0.7995187233157569,,,,0.2705710797221656,,0.5097241067390321,0.5128900949796472,0.6055312954876274,0.6102062975027145,0.7059485101748224,0.6836805459573972,0.08,0.5264384366873514,0.513911941834778,0.5484508899143046,0.550620509470934,0.6758732737611698,0.6842532467532467,oversample,0.46884149273031717,0.4601961814998076,0.6531043474263621,0.5,COMPLETE
2774,0.7156549520766773,2025-11-30 17:20:04.758238,2025-11-30 17:28:26.940797,0 days 00:08:22.182559,0.0017500711521655648,dart,0.7507482202393934,3.934233143723549,lossguide,0.06352417366648475,0.09797049342484274,2,3,0.5296931910337699,800,tree,0.7653605055493996,0.721460476526238,0.0527249807804325,none,0.9211973375101807,2.0660699665022433,12.0,0.751334029444715,0.20542522288963538,weighted,0.7452431309424636,0.931072115308488,,0.5567616463138851,0.5572139303482587,0.715281812899477,0.7156549520766773,0.7653605055493996,0.721460476526238,0.08,0.5183066160157989,0.5130060179418894,0.5567616463138851,0.5572139303482587,1.0,1.0,none,0.490982940698619,0.4935993526391892,0.9211973375101807,0.5,COMPLETE
2775,0.6969504447268107,2025-11-30 17:28:27.699496,2025-11-30 17:28:28.834310,0 days 00:00:01.134814,0.05285847957751306,gbtree,0.7193080191229693,3.382529244660548,depthwise,0.00047277055617457803,0.05508397590153206,5,7,0.42939237901791455,900,,0.6762745109527442,0.8963026143979838,0.037306550415878915,none,0.8662646355980065,1.1992837171149866,6.0,0.9052339374202607,,,,0.22921538393812188,,0.5522388059701493,0.5685210312075983,0.6863117870722434,0.6969504447268107,0.6762745109527442,0.8963026143979838,0.08,0.5690791393162864,0.5890945347748978,0.5625974025974027,0.5725469728601252,0.8797725426482534,0.890422077922078,none,0.5297008405311758,0.5552615476964302,0.8662646355980065,0.5,COMPLETE
2776,0.37708830548926014,2025-11-30 17:28:29.583009,2025-11-30 17:28:30.312672,0 days 00:00:00.729663,0.1548129108644083,gbtree,0.9447438405578501,8.259782384971722,lossguide,0.00013499536211081763,0.00011019364345606657,2,10,11.79384718785308,700,,0.9274927937847774,0.734783159643126,0.07243258499718573,undersample,0.8997927928570391,,7.0,0.6193804731952542,,,,0.890277339014417,,0.3948439620081411,0.4097693351424695,0.36346336822074216,0.37708830548926014,0.9274927937847774,0.734783159643126,0.08,0.5078444914370966,0.524212944973525,0.43857634902411025,0.45770567786790267,0.3103168155970755,0.32061688311688313,undersample,0.44274109318788435,0.44124214013769686,0.8997927928570391,0.5,COMPLETE
2777,0.7156549520766773,2025-11-30 17:28:31.068015,2025-11-30 17:29:50.537562,0 days 00:01:19.469547,49.309453828265816,dart,0.21388639267892692,3.077136913011138,lossguide,0.0053277213462465094,0.00036981707391204097,9,11,6.458585485481193,800,tree,0.9051415736643498,0.3081719714274684,0.08218748077795626,undersample,0.8942563948109352,,10.0,0.855462514374739,0.0459354331600087,weighted,0.6622122644646584,0.5992163756543449,,0.5567616463138851,0.5572139303482587,0.715281812899477,0.7156549520766773,0.9051415736643498,0.3081719714274684,0.08,0.5567616463138851,0.5572139303482587,0.5567616463138851,0.5572139303482587,1.0,1.0,undersample,0.5,0.5,0.8942563948109352,0.5,COMPLETE
2778,0.7156549520766773,2025-11-30 17:29:51.291693,2025-11-30 17:30:20.712732,0 days 00:00:29.421039,4.757446783704082,dart,0.3393380235249508,3.532347095496621,lossguide,1.7506047069118926,0.0004185424875403086,8,3,0.5696136789796625,500,forest,0.7627696872716226,0.21204561832538765,0.07150733810769447,none,0.7845226516233632,3.0332552098999783,6.0,0.940915575046607,0.4629423621712436,weighted,0.7912871834653482,0.995316598523353,,0.5567616463138851,0.5572139303482587,0.715281812899477,0.7156549520766773,0.7627696872716226,0.21204561832538765,0.08,0.6119941317102734,0.6283702005790681,0.5567616463138851,0.5572139303482587,1.0,1.0,none,0.5354063396276464,0.5434091572370429,0.7845226516233632,0.5,COMPLETE
2779,0.46296296296296297,2025-11-30 17:30:21.461411,2025-11-30 17:30:22.080641,0 days 00:00:00.619230,0.019089995057850053,gbtree,0.22198934518312222,4.7725882667051405,depthwise,22.912081104460125,0.00022742515181556732,9,3,0.9426977570572784,600,,0.7181479440935031,0.24741368718670065,0.021328304479486238,undersample,0.786928343419941,,9.0,0.8631891990201024,,,,0.8376676433211918,,0.4251469923111714,0.4491180461329715,0.43435692033822876,0.46296296296296297,0.7181479440935031,0.24741368718670065,0.08,0.5088982634510285,0.5129400924408416,0.48031496062992124,0.5067567567567568,0.39642567018683994,0.42613636363636365,undersample,0.3936011041297104,0.4085005903187721,0.786928343419941,0.5,COMPLETE
