number,value,datetime_start,datetime_complete,duration,params_alpha,params_booster,params_colsample_bytree,params_gamma,params_grow_policy,params_lambda,params_learning_rate,params_max_delta_step,params_max_depth,params_min_child_weight,params_n_estimators,params_normalize_type,params_params_feature_fraction,params_params_labeled_ratio,params_params_missing_rate,params_params_resampling,params_params_sample_rows,params_params_scale_pos_weight,params_params_selftrain_max_iter,params_params_selftrain_threshold,params_rate_drop,params_sample_type,params_skip_drop,params_subsample,params_user_attrs_decision_threshold,user_attrs_acc_test,user_attrs_acc_val,user_attrs_f1_test,user_attrs_f1_val,user_attrs_feature_fraction,user_attrs_labeled_ratio,user_attrs_missing_rate,user_attrs_pr_auc_test,user_attrs_pr_auc_val,user_attrs_prec_test,user_attrs_prec_val,user_attrs_rec_test,user_attrs_rec_val,user_attrs_resampling_strategy,user_attrs_roc_auc_test,user_attrs_roc_auc_val,user_attrs_sample_rows,user_attrs_user_attrs_decision_threshold,state
1675,0.49954254345837146,2025-11-27 09:38:25.459935,2025-11-27 09:39:46.171634,0 days 00:01:20.711699,4.360685406122895,dart,0.986399307933226,1.6981950317171468,lossguide,0.000776736343127755,0.020885681919822388,1,3,3.2163197899017386,900,forest,0.7124269606008448,0.6649379735568043,0.010473610668129331,undersample,0.5929083741129979,,5.0,0.740590864751396,0.46912806848198113,weighted,0.22011264811850653,0.6541541990694753,,0.49389416553595655,0.5052012663952963,0.49159472966833256,0.49954254345837146,0.7124269606008448,0.6649379735568043,0.02,0.5502425063961736,0.569417842680249,0.5577319587628866,0.5723270440251572,0.4394800974817222,0.4431818181818182,undersample,0.5107420547422868,0.5305058832893359,0.5929083741129979,0.5,COMPLETE
1676,0.7156549520766773,2025-11-27 09:39:46.375346,2025-11-27 09:39:57.067827,0 days 00:00:10.692481,0.1181637582753712,dart,0.4910758200733103,5.861079417411448,depthwise,0.26044829571681344,0.0003625735058414386,4,12,26.084788048179167,300,tree,0.9896431599945887,0.8031136747478944,0.025937738414152024,none,0.9581701649182871,4.508340249906989,12.0,0.7256839807056037,0.47773296665289045,weighted,0.5384843724282184,0.9774104608911609,,0.5567616463138851,0.5572139303482587,0.715281812899477,0.7156549520766773,0.9896431599945887,0.8031136747478944,0.02,0.5748068423293515,0.5720118421668701,0.5567616463138851,0.5572139303482587,1.0,1.0,none,0.534238382599181,0.5283133299284984,0.9581701649182871,0.5,COMPLETE
1677,0.0,2025-11-27 09:39:57.268325,2025-11-27 09:39:57.660853,0 days 00:00:00.392528,0.006366591017496882,gbtree,0.6390770627729339,7.480227993432699,lossguide,5.773035236611467,0.007199021690866607,0,10,22.83313258036857,200,,0.6656344401463632,0.42422840055758215,0.029217736516752205,none,0.5511584079437971,0.562371196655068,11.0,0.9313825098305828,,,,0.8406388792541049,,0.44323835368611486,0.4427860696517413,0.0,0.0,0.6656344401463632,0.42422840055758215,0.02,0.5021408484938658,0.5107529166966955,0.0,0.0,0.0,0.0,none,0.4041429731925264,0.41807668837801626,0.5511584079437971,0.5,COMPLETE
1678,0.7156549520766773,2025-11-27 09:39:57.861433,2025-11-27 09:39:58.971660,0 days 00:00:01.110227,0.0058290393186489885,gbtree,0.8363652214210517,1.0023343742412305,lossguide,15.947303133178103,0.0003660931937628903,6,9,97.32262472209193,900,,0.5837179097297696,0.7753327358855082,0.08843603632419504,none,0.5489050807395264,1.2450670760407843,12.0,0.8451850179862519,,,,0.5482827730601256,,0.5567616463138851,0.5572139303482587,0.715281812899477,0.7156549520766773,0.5837179097297696,0.7753327358855082,0.08,0.3805433676203684,0.3797062391361201,0.5567616463138851,0.5572139303482587,1.0,1.0,none,0.14866874450836387,0.14313281840733322,0.5489050807395264,0.5,COMPLETE
1679,0.6767600302800908,2025-11-27 09:39:59.179854,2025-11-27 09:40:00.108843,0 days 00:00:00.928989,15.732880281987725,gbtree,0.25209717483905475,3.4210387520378873,lossguide,8.72630351549692,0.00013719594993780352,3,9,0.11034547930671884,1000,,0.8840973322313899,0.569400307901006,0.09824448830007099,undersample,0.7789937003048164,,7.0,0.6831330982952224,,,,0.9686500230581423,,0.6426956128448665,0.613749434644957,0.6970858895705522,0.6767600302800908,0.8840973322313899,0.569400307901006,0.08,0.6375321199855275,0.61945721985509,0.6601307189542484,0.6340425531914894,0.7384240454914703,0.7256493506493507,undersample,0.6353798139889586,0.6070533144077577,0.7789937003048164,0.5,COMPLETE
1680,0.41808952468850946,2025-11-27 09:40:00.308285,2025-11-27 09:41:17.497510,0 days 00:01:17.189225,0.030386544738139426,dart,0.4367135811014989,1.6892611586456563,lossguide,0.017553986096615532,0.036932472304219796,8,12,22.05862978488097,800,tree,0.8698162505899747,0.8698093983739525,0.0767210066054097,undersample,0.8539911773255933,,11.0,0.697296480678413,0.28879504502167436,weighted,0.06774955184946102,0.7491041840003785,,0.44323835368611486,0.42966983265490727,0.4472384373596767,0.41808952468850946,0.8698162505899747,0.8698093983739525,0.08,0.509498293897554,0.5167577029171831,0.5,0.4844919786096257,0.40454914703493094,0.3676948051948052,undersample,0.4234660720502661,0.4285436537415598,0.8539911773255933,0.5,COMPLETE
1681,0.45913354175971416,2025-11-27 09:41:17.697555,2025-11-27 09:41:18.473540,0 days 00:00:00.775985,0.1249517101435212,gbtree,0.4194365630742012,7.562872315011157,depthwise,0.00031823512831683594,0.00013668487316648986,9,12,0.2768218122849474,800,,0.5505537452817457,0.4228652556663236,0.05023932939071011,undersample,0.7222394776761349,,9.0,0.6588497413079871,,,,0.3758886213132856,,0.4699231117141565,0.4522840343735866,0.47584973166368516,0.45913354175971416,0.5505537452817457,0.4228652556663236,0.05,0.5180059899710447,0.5180078431117026,0.5293532338308458,0.5104270109235353,0.4321689683184403,0.4172077922077922,undersample,0.4874169001475489,0.4741553135322288,0.7222394776761349,0.5,COMPLETE
1682,0.0,2025-11-27 09:41:18.676823,2025-11-27 09:43:24.277285,0 days 00:02:05.600462,0.007612786854907503,dart,0.36101341260869235,8.87283151235186,lossguide,3.894212934606418,0.01923551732642716,10,9,90.3931859764261,1000,forest,0.596618146237278,0.6798270021391819,0.01220856068364672,none,0.82211158896491,0.6780717939101959,5.0,0.6173249104913737,0.059174717009734534,uniform,0.022671260361455538,0.49243122249446114,,0.44323835368611486,0.4427860696517413,0.0,0.0,0.596618146237278,0.6798270021391819,0.02,0.5576589999620548,0.562410501761018,0.0,0.0,0.0,0.0,none,0.4990993716739336,0.5039742879694361,0.82211158896491,0.5,COMPLETE
1683,0.7156549520766773,2025-11-27 09:43:24.525845,2025-11-27 09:43:45.256122,0 days 00:00:20.730277,0.023969593712727173,dart,0.5270190635758698,5.339779236287958,lossguide,46.261137520515526,0.05973275808356322,7,5,98.64347503303642,400,tree,0.8545254049077723,0.630693498644568,0.07044015394011736,oversample,0.6985068333888167,,11.0,0.8773746169631207,0.2305251095762041,uniform,0.8416444608700431,0.2853459574421708,,0.5567616463138851,0.5572139303482587,0.715281812899477,0.7156549520766773,0.8545254049077723,0.630693498644568,0.08,0.5264562177080571,0.5357122938746073,0.5567616463138851,0.5572139303482587,1.0,1.0,oversample,0.42882507999137914,0.4520875893769153,0.6985068333888167,0.5,COMPLETE
1684,0.7156549520766773,2025-11-27 09:43:45.452750,2025-11-27 09:45:29.153023,0 days 00:01:43.700273,0.006778478394891626,dart,0.9217049718433856,5.379457791519025,lossguide,42.264775240559246,0.017672258769011157,8,5,3.799724301708131,1000,tree,0.5702197606855265,0.6990246118892345,0.04428730246222125,none,0.821401687654256,1.6358260065419186,5.0,0.8906667207923358,0.3389474848092606,weighted,0.28785050044483884,0.986747182587661,,0.5567616463138851,0.5572139303482587,0.715281812899477,0.7156549520766773,0.5702197606855265,0.6990246118892345,0.05,0.5567616463138851,0.5572139303482587,0.5567616463138851,0.5572139303482587,1.0,1.0,none,0.5,0.5,0.821401687654256,0.5,COMPLETE
1685,0.6731371321227301,2025-11-27 09:45:29.355035,2025-11-27 09:45:32.389013,0 days 00:00:03.033978,0.013271322272455983,gbtree,0.7262897069811427,8.020685238956139,lossguide,0.01763940384452955,0.36859414281235686,10,9,3.930817084833671,1000,,0.7233966601845405,0.7858932557020786,0.01936232904024965,oversample,0.5152132576685029,,8.0,0.6776384106784986,,,,0.5026142536841062,,0.5192220714608774,0.5278154681139756,0.6677086589559237,0.6731371321227301,0.7233966601845405,0.7858932557020786,0.02,0.5048436915533092,0.4894531011643676,0.5426829268292683,0.5479102956167177,0.867587327376117,0.872564935064935,oversample,0.4292814038694275,0.40591960388947107,0.5152132576685029,0.5,COMPLETE
1686,0.5220367993153616,2025-11-27 09:45:32.588113,2025-11-27 09:45:43.657564,0 days 00:00:11.069451,0.026831303621185503,gbtree,0.817544693927168,0.4551071396259154,lossguide,0.001541334145874469,0.42336604296893837,8,8,5.8342691992125975,900,,0.8708015535761618,0.7393808431314557,0.09792702400358186,undersample,0.6586300986249913,,6.0,0.9178869327321026,,,,0.6810217380590211,,0.4626865671641791,0.4947987336047038,0.48660328435609335,0.5220367993153616,0.8708015535761618,0.7393808431314557,0.08,0.5268863443860747,0.547376410420644,0.5198522622345337,0.5520361990950227,0.45735174654752236,0.49512987012987014,undersample,0.4614922329614217,0.5013008569571389,0.6586300986249913,0.5,COMPLETE
1687,0.5345778532032245,2025-11-27 09:45:43.869767,2025-11-27 09:45:50.489028,0 days 00:00:06.619261,2.0200261950539815,gbtree,0.9251953001903368,0.7382628156424853,depthwise,0.08826698925113494,0.4310338139826232,5,4,42.30132512963687,1000,,0.9312796248920474,0.6103941250644326,0.013843684136435143,undersample,0.8508928814679271,,11.0,0.7220328192014287,,,,0.7905212365528451,,0.5156037991858887,0.5038444142921755,0.5417201540436457,0.5345778532032245,0.9312796248920474,0.6103941250644326,0.02,0.5567541627873271,0.5553027330575062,0.5723327305605787,0.56,0.5142160844841592,0.5113636363636364,undersample,0.5063425288880784,0.4936457822055371,0.8508928814679271,0.5,COMPLETE
1688,0.7156549520766773,2025-11-27 09:45:50.699286,2025-11-27 09:47:19.180862,0 days 00:01:28.481576,32.9934617130999,dart,0.7124516748169747,0.5975791796039398,depthwise,0.012636512871402413,0.00029622011025719105,5,7,33.260036738728985,900,forest,0.5204374300470092,0.3804751860159755,0.07223915186982365,undersample,0.7954633627667846,,10.0,0.8590857491862348,0.2734340894031706,weighted,0.3060906715117,0.9686131787560806,,0.5567616463138851,0.5572139303482587,0.715281812899477,0.7156549520766773,0.5204374300470092,0.3804751860159755,0.08,0.5567616463138851,0.5572139303482587,0.5567616463138851,0.5572139303482587,1.0,1.0,undersample,0.5,0.5,0.7954633627667846,0.5,COMPLETE
1689,0.7156549520766773,2025-11-27 09:47:19.376043,2025-11-27 09:47:20.227808,0 days 00:00:00.851765,0.00016054701752711586,gbtree,0.30526079789291344,5.867171662232343,lossguide,0.33802282183462345,0.41814992507353993,4,10,49.713650857027524,900,,0.5732918680755283,0.8434197005066597,0.009875988679055503,none,0.5984260273326569,4.11507403597617,7.0,0.7440692608279528,,,,0.9988212621666834,,0.5567616463138851,0.5572139303482587,0.715281812899477,0.7156549520766773,0.5732918680755283,0.8434197005066597,0.0,0.5567616463138851,0.5572139303482587,0.5567616463138851,0.5572139303482587,1.0,1.0,none,0.5,0.5,0.5984260273326569,0.5,COMPLETE
1690,0.3080597014925373,2025-11-27 09:47:20.437722,2025-11-27 09:47:32.757046,0 days 00:00:12.319324,0.03191529421463887,dart,0.5144979321787337,8.273132277758497,lossguide,1.2793556137837199,0.0002476982687964158,10,9,8.968958439366267,300,forest,0.9226822593338815,0.7446271928472892,0.07321422191397015,undersample,0.8147306135045761,,12.0,0.7076362137265492,0.026764810103659054,weighted,0.16346015518111948,0.5064530876510156,,0.4898236092265943,0.4758028041610131,0.3380281690140845,0.3080597014925373,0.9226822593338815,0.7446271928472892,0.08,0.5762593492725048,0.5593522682341894,0.6088794926004228,0.582392776523702,0.23395613322502032,0.20941558441558442,undersample,0.5405448531971684,0.5245550223525198,0.8147306135045761,0.5,COMPLETE
1691,0.0,2025-11-27 09:47:32.950059,2025-11-27 09:47:33.481134,0 days 00:00:00.531075,0.0012938308954772585,gbtree,0.6159879919626479,6.730101338348399,lossguide,6.4698647552347595,0.022976570204596536,10,7,0.2019811309611274,400,,0.5987595534230428,0.5698205889401454,0.0077992817875824575,none,0.89947658200409,0.7113230814337569,8.0,0.8350914501637987,,,,0.5321002038654351,,0.44323835368611486,0.4427860696517413,0.0,0.0,0.5987595534230428,0.5698205889401454,0.0,0.6162475422345507,0.6019162119181862,0.0,0.0,0.0,0.0,none,0.5766566090286642,0.5599828542244273,0.89947658200409,0.5,COMPLETE
1692,0.7156549520766773,2025-11-27 09:47:33.680208,2025-11-27 09:47:34.488488,0 days 00:00:00.808280,0.21436964756070284,gbtree,0.5203757682353072,5.961844467792437,depthwise,0.03739888211551971,0.011996807331155518,1,11,2.337047319504903,800,,0.9090386125869306,0.6300424099857416,0.07710773468151881,oversample,0.925599235857502,,5.0,0.6775215625810351,,,,0.5335471617030413,,0.5567616463138851,0.5572139303482587,0.715281812899477,0.7156549520766773,0.9090386125869306,0.6300424099857416,0.08,0.5285725907810078,0.5308763686004607,0.5567616463138851,0.5572139303482587,1.0,1.0,oversample,0.4778299540774881,0.4827286158682992,0.925599235857502,0.5,COMPLETE
1693,0.6813812744749022,2025-11-27 09:47:34.691816,2025-11-27 09:49:18.880148,0 days 00:01:44.188332,6.574341661977047,dart,0.6134664323047767,3.3909458847740304,depthwise,0.001356417129912784,0.00013220171093142403,9,11,0.5400961749046704,900,tree,0.6550977491221015,0.5608031606804327,0.09006752388088651,undersample,0.8642369827705074,,6.0,0.7455836601204228,0.05823162708095808,uniform,0.14686353496270863,0.8139726104679541,,0.5965626413387607,0.5952057892356399,0.681655960028551,0.6813812744749022,0.6550977491221015,0.5608031606804327,0.08,0.5421194148727422,0.5447223310578929,0.6078930617441121,0.6068484464172479,0.7757920389926889,0.7767857142857143,undersample,0.5410583729836369,0.5452841655280368,0.8642369827705074,0.5,COMPLETE
1694,0.7156549520766773,2025-11-27 09:49:19.079229,2025-11-27 09:49:40.854126,0 days 00:00:21.774897,0.0034008470670645694,dart,0.3651611289970518,1.5484070340157663,lossguide,0.0016782847684591073,0.00010321013398066273,10,6,34.295163828741686,400,tree,0.5122740582619888,0.4718332165321168,0.048155335462820574,oversample,0.5863483430775247,,8.0,0.6329428526299309,0.05778065680015698,uniform,0.1955510751040482,0.9076976454758741,,0.5567616463138851,0.5572139303482587,0.715281812899477,0.7156549520766773,0.5122740582619888,0.4718332165321168,0.05,0.41720770807114965,0.4062484498333456,0.5567616463138851,0.5572139303482587,1.0,1.0,oversample,0.2325486165221572,0.21247123025085232,0.5863483430775247,0.5,COMPLETE
1695,0.7156549520766773,2025-11-27 09:49:41.062503,2025-11-27 09:49:41.475460,0 days 00:00:00.412957,6.866649954262973,gbtree,0.20724799961790794,7.619265114495991,lossguide,22.10986438196247,0.1222109142234538,6,9,0.5175086684864164,200,,0.9792661721225324,0.3452589138471579,0.07034070306614736,none,0.6921365876211591,3.830841916198736,7.0,0.8759639354585544,,,,0.2858408252124036,,0.5567616463138851,0.5572139303482587,0.715281812899477,0.7156549520766773,0.9792661721225324,0.3452589138471579,0.08,0.5000268146996819,0.4892908694753573,0.5567616463138851,0.5572139303482587,1.0,1.0,none,0.36747666572721693,0.3387210975949485,0.6921365876211591,0.5,COMPLETE
1696,0.7371910789632309,2025-11-27 09:49:41.678082,2025-11-27 09:49:42.385712,0 days 00:00:00.707630,0.07257853263826115,gbtree,0.6229932093595585,8.418157394050853,lossguide,0.2511979183786717,0.40031530341061117,1,3,12.644452634526429,700,,0.8858014033471748,0.5807450498620893,0.04318426506497062,oversample,0.5855860240775792,,5.0,0.9427635880425291,,,,0.6975059131154921,,0.5970149253731343,0.6056083220262325,0.7323520576749775,0.7371910789632309,0.8858014033471748,0.5807450498620893,0.05,0.7820876638929923,0.7925685704945573,0.5810295519542421,0.5862895493767977,0.9902518277822908,0.9926948051948052,oversample,0.7489348298214493,0.7531920326864148,0.5855860240775792,0.5,COMPLETE
1697,0.7156549520766773,2025-11-27 09:49:42.591888,2025-11-27 09:49:43.172177,0 days 00:00:00.580289,0.0002260161493835957,gbtree,0.7022045729303836,8.40016697735278,depthwise,0.9321072573320905,0.0829139285186256,6,5,0.270844677867281,500,,0.6130981504210031,0.21101676776932377,0.027805023830122212,oversample,0.9182735903095989,,9.0,0.7140491947013287,,,,0.8487853852801228,,0.5567616463138851,0.5572139303482587,0.715281812899477,0.7156549520766773,0.6130981504210031,0.21101676776932377,0.02,0.5666067508918763,0.5772260402650695,0.5567616463138851,0.5572139303482587,1.0,1.0,oversample,0.5125097398829557,0.5202752112545269,0.9182735903095989,0.5,COMPLETE
1698,0.7156549520766773,2025-11-27 09:49:43.373974,2025-11-27 09:51:18.293376,0 days 00:01:34.919402,0.4430483100282441,dart,0.21065289059717385,9.582793338421059,lossguide,8.822645274399271,0.020153066611002923,8,10,73.77092892282819,900,tree,0.6508507873198266,0.8032760943829169,0.010128424696474216,oversample,0.7778313126362038,,7.0,0.8955144548939877,0.17030232194217598,uniform,0.13684232253997983,0.5902116475981654,,0.5567616463138851,0.5572139303482587,0.715281812899477,0.7156549520766773,0.6508507873198266,0.8032760943829169,0.02,0.4995063939911891,0.4950471091494518,0.5567616463138851,0.5572139303482587,1.0,1.0,oversample,0.36656443243422465,0.365070291047053,0.7778313126362038,0.5,COMPLETE
1699,0.7160709096192968,2025-11-27 09:51:18.502590,2025-11-27 09:51:19.400617,0 days 00:00:00.898027,1.4532489974858396,gbtree,0.5924392438351462,1.7527551956309018,depthwise,0.0016285405265747516,0.03809574134435404,5,4,81.49406540406702,1000,,0.5906338310739212,0.48097177263730434,0.03214219252756647,oversample,0.5560359404374575,,12.0,0.8154590266883757,,,,0.8233231396199312,,0.5576662143826323,0.5581184984170059,0.7156976744186047,0.7160709096192968,0.5906338310739212,0.48097177263730434,0.02,0.5327648768929085,0.5164255193044226,0.5572657311000453,0.5577184246265279,1.0,1.0,oversample,0.5366493144780252,0.508320841569054,0.5560359404374575,0.5,COMPLETE
1700,0.7156549520766773,2025-11-27 09:51:19.603470,2025-11-27 09:51:25.144139,0 days 00:00:05.540669,15.533480532151101,dart,0.6151405429097322,3.474596681158475,depthwise,0.05308741884491078,0.004803018762406425,3,7,0.4254104820329808,200,forest,0.5590101556209396,0.298636834913442,0.08373263760812975,none,0.612500797338581,4.32606484414248,7.0,0.9019331202764636,0.09709710380673453,uniform,0.3718212946044883,0.9640513162988478,,0.5567616463138851,0.5572139303482587,0.715281812899477,0.7156549520766773,0.5590101556209396,0.298636834913442,0.08,0.5103275605068762,0.5130820563217328,0.5567616463138851,0.5572139303482587,1.0,1.0,none,0.42336411412656044,0.42726849886579205,0.612500797338581,0.5,COMPLETE
1701,0.7156549520766773,2025-11-27 09:51:25.344903,2025-11-27 09:52:24.201532,0 days 00:00:58.856629,6.482513684626146,dart,0.7751031322171396,5.584100265458799,depthwise,2.037601053670763,0.04189252919108342,5,12,0.2178986450557569,700,forest,0.6573663860002379,0.6050269860819701,0.006833637743884758,none,0.8506284237228636,1.1347431128843324,7.0,0.8392605251237449,0.22901048154440146,weighted,0.4944767249698343,0.22105706822727322,,0.5567616463138851,0.5572139303482587,0.715281812899477,0.7156549520766773,0.6573663860002379,0.6050269860819701,0.0,0.5464329192306028,0.5500225927059919,0.5567616463138851,0.5572139303482587,1.0,1.0,none,0.4795280094166017,0.49617660812119435,0.8506284237228636,0.5,COMPLETE
1702,0.7156549520766773,2025-11-27 09:52:24.411984,2025-11-27 09:52:25.123613,0 days 00:00:00.711629,11.41633417378657,gbtree,0.5588805296141738,5.371404190832406,lossguide,0.0003586650685236915,0.00010819521474572431,4,4,60.70986092289029,700,,0.5301897410127983,0.6303339254315407,0.014803867927776205,none,0.9427613187244386,2.2047895676245837,6.0,0.9305414425143446,,,,0.9865621906320945,,0.5567616463138851,0.5572139303482587,0.715281812899477,0.7156549520766773,0.5301897410127983,0.6303339254315407,0.02,0.5567616463138851,0.5572139303482587,0.5567616463138851,0.5572139303482587,1.0,1.0,none,0.5,0.5,0.9427613187244386,0.5,COMPLETE
1703,0.7156549520766773,2025-11-27 09:52:25.331032,2025-11-27 09:52:25.810606,0 days 00:00:00.479574,1.931074716857852,gbtree,0.6655111541076559,9.427794095611935,lossguide,0.7341617683940664,0.00010822881513866373,8,3,3.947091803115648,300,,0.8904425923140118,0.3164272296037471,0.029772294755562135,oversample,0.9990994764223048,,8.0,0.7934402648878749,,,,0.5950923895364297,,0.5567616463138851,0.5572139303482587,0.715281812899477,0.7156549520766773,0.8904425923140118,0.3164272296037471,0.02,0.6980079511190642,0.6948750553244882,0.5567616463138851,0.5572139303482587,1.0,1.0,oversample,0.6969309007112188,0.6797736227000782,0.9990994764223048,0.5,COMPLETE
1704,0.48737953189536487,2025-11-27 09:52:26.011142,2025-11-27 09:55:15.200479,0 days 00:02:49.189337,0.00010683764624358758,dart,0.29111528384909074,4.608030422931906,depthwise,0.0005993966220321445,0.3036377054375032,1,6,0.16859008095240424,1000,tree,0.9375998049181592,0.21935720955373977,0.03591065076533001,undersample,0.6877942812307296,,8.0,0.8311185085923778,0.4708710716327583,weighted,0.6489390675892407,0.6430128589648613,,0.5115332428765265,0.4947987336047038,0.4953271028037383,0.48737953189536487,0.9375998049181592,0.21935720955373977,0.05,0.544946899345434,0.5327083881320474,0.583058305830583,0.5607180570221753,0.4305442729488221,0.4310064935064935,undersample,0.5284085445713622,0.5131859968427895,0.6877942812307296,0.5,COMPLETE
