number,value,datetime_start,datetime_complete,duration,params_alpha,params_booster,params_colsample_bytree,params_gamma,params_grow_policy,params_lambda,params_learning_rate,params_max_delta_step,params_max_depth,params_min_child_weight,params_n_estimators,params_normalize_type,params_params_feature_fraction,params_params_labeled_ratio,params_params_missing_rate,params_params_resampling,params_params_sample_rows,params_params_scale_pos_weight,params_params_selftrain_max_iter,params_params_selftrain_threshold,params_rate_drop,params_sample_type,params_skip_drop,params_subsample,params_user_attrs_decision_threshold,user_attrs_acc_test,user_attrs_acc_val,user_attrs_f1_test,user_attrs_f1_val,user_attrs_feature_fraction,user_attrs_labeled_ratio,user_attrs_missing_rate,user_attrs_pr_auc_test,user_attrs_pr_auc_val,user_attrs_prec_test,user_attrs_prec_val,user_attrs_rec_test,user_attrs_rec_val,user_attrs_resampling_strategy,user_attrs_roc_auc_test,user_attrs_roc_auc_val,user_attrs_sample_rows,user_attrs_user_attrs_decision_threshold,state
1443,0.0,2025-11-27 04:02:13.577990,2025-11-27 04:03:36.517436,0 days 00:01:22.939446,0.2901495168525431,dart,0.5273564918224799,3.734072414307493,lossguide,0.41988431015616146,0.00286353329391093,3,9,0.3946556276380933,800,forest,0.9372810029083689,0.3828948962305227,0.06405305423189427,oversample,0.551778663570768,,7.0,0.6683619355381651,0.1317980520538395,weighted,0.5780122254525843,0.29071942956644553,0.6946057972594364,0.44323835368611486,0.4427860696517413,0.0,0.0,0.9372810029083689,0.3828948962305227,0.05,0.4499565376937658,0.4399438949674471,0.0,0.0,0.0,0.0,oversample,0.3496468774349707,0.3267194692437287,0.551778663570768,0.6946057972594364,COMPLETE
1444,0.006354249404289118,2025-11-27 04:03:36.700711,2025-11-27 04:11:48.120036,0 days 00:08:11.419325,0.004276557571857641,dart,0.7004156841429752,2.3512297342201807,lossguide,1.680042804696582,0.12234357831376502,3,3,1.9409814068616016,800,forest,0.8107744616320167,0.7298005982190939,0.02038201371821167,undersample,0.8076314184002346,,11.0,0.6267837815426679,0.17305109232449292,weighted,0.6550319939161923,0.3770095324234714,0.636544057319217,0.4396200814111262,0.43419267299864317,0.015885623510722795,0.006354249404289118,0.8107744616320167,0.7298005982190939,0.02,0.47998154505441193,0.4674985518920842,0.35714285714285715,0.14814814814814814,0.008123476848090982,0.003246753246753247,undersample,0.3831272070160315,0.3638904826021782,0.8076314184002346,0.636544057319217,COMPLETE
1445,0.6492262343404569,2025-11-27 04:11:48.295423,2025-11-27 04:15:53.784723,0 days 00:04:05.489300,1.8947782398691242,dart,0.7131650992005463,1.240423007350962,lossguide,0.38261653430088116,0.04226707101210801,0,7,2.2887093273178833,600,forest,0.8258094621711064,0.9193501938173381,0.017622584389224063,oversample,0.8381093570293564,,9.0,0.6669627945895783,0.15617620149453967,weighted,0.769536744646175,0.2257390743244512,0.521361799186809,0.5481682496607869,0.5694255992763455,0.6344676180021954,0.6492262343404569,0.8258094621711064,0.9193501938173381,0.02,0.5873185788589661,0.5894693248797152,0.5772303595206392,0.5944669365721997,0.7043054427294883,0.7150974025974026,oversample,0.5449406488834363,0.5715608127827229,0.8381093570293564,0.521361799186809,COMPLETE
1446,0.10600255427841634,2025-11-27 04:15:53.968792,2025-11-27 04:27:42.540000,0 days 00:11:48.571208,0.0020324591149856507,dart,0.7682042509079543,3.6101143523919443,lossguide,0.5233001010811497,0.017318187506246616,5,9,0.3311950984802327,1000,forest,0.8787460197304184,0.6207987177316832,0.08637096860931778,oversample,0.6790136924249421,,10.0,0.6303150969533539,0.22232500112120515,weighted,0.768125667131626,0.24335889505600516,0.7850120300450957,0.3645409317051108,0.36680235187697874,0.10452517527087317,0.10600255427841634,0.8787460197304184,0.6207987177316832,0.08,0.41808277914027964,0.4275070130163349,0.24260355029585798,0.24850299401197604,0.06661251015434606,0.06737012987012987,oversample,0.2685969594986654,0.29373374965177823,0.6790136924249421,0.7850120300450957,COMPLETE
1447,0.0,2025-11-27 04:27:42.719955,2025-11-27 04:34:38.122022,0 days 00:06:55.402067,0.3073919916627146,dart,0.5322669842083976,1.6176759189245629,lossguide,0.802455685049127,0.05321614762396726,5,10,1.9865730978395875,700,forest,0.8277259021940226,0.7044034750319236,0.05104323537637221,oversample,0.6285539279854472,,12.0,0.6175069231180927,0.18292065547201725,weighted,0.5281772621351584,0.28970683081458387,0.9180412098275748,0.44323835368611486,0.4423337856173677,0.0,0.0,0.8277259021940226,0.7044034750319236,0.05,0.5072262702872697,0.5588918041949117,0.0,0.0,0.0,0.0,oversample,0.43213829804870774,0.4962267686348381,0.6285539279854472,0.9180412098275748,COMPLETE
1448,0.0,2025-11-27 04:34:38.300455,2025-11-27 04:36:20.596303,0 days 00:01:42.295848,1.7115207691442402,dart,0.6766750809908608,5.561963898430582,lossguide,48.3160790743104,0.004421190545192116,4,8,0.32746384097331005,900,forest,0.9943579324055123,0.7201103055564344,0.02884876927968097,oversample,0.6452424859044348,,8.0,0.6777507062526568,0.10149451417942283,weighted,0.5568793945265942,0.28067358461521286,0.5863491725015201,0.44323835368611486,0.4427860696517413,0.0,0.0,0.9943579324055123,0.7201103055564344,0.02,0.4987211147311822,0.4778982800540049,0.0,0.0,0.0,0.0,oversample,0.405623849864885,0.36803349229932475,0.6452424859044348,0.5863491725015201,COMPLETE
1449,0.7156549520766773,2025-11-27 04:36:20.785822,2025-11-27 04:40:30.345021,0 days 00:04:09.559199,0.6824347319089805,dart,0.544013705584911,4.240171049118843,lossguide,4.0544661578423,0.06597111561166606,1,3,0.16959313958480007,600,forest,0.8686064413356769,0.3573996933384078,0.0007962526723499647,oversample,0.8358835559014518,,10.0,0.6279365486912335,0.18612186748759535,weighted,0.6666416613475632,0.3030433431692626,0.5605256881474844,0.5567616463138851,0.5572139303482587,0.715281812899477,0.7156549520766773,0.8686064413356769,0.3573996933384078,0.0,0.5400503823863575,0.5377185543117102,0.5567616463138851,0.5572139303482587,1.0,1.0,oversample,0.5170762943682754,0.513409853680538,0.8358835559014518,0.5605256881474844,COMPLETE
1450,0.0,2025-11-27 04:40:30.519282,2025-11-27 04:41:17.668109,0 days 00:00:47.148827,0.36600823250942965,dart,0.6557565404527028,4.787545861013308,lossguide,0.10644092868875887,0.006705737562744546,0,3,0.9733948976829703,600,forest,0.7510601050967539,0.7287028664218831,0.0342592628310971,oversample,0.7617571661057588,,8.0,0.6390218797440752,0.10299651430408795,weighted,0.8010860573029586,0.20684322800183125,0.7333641455296733,0.44323835368611486,0.4427860696517413,0.0,0.0,0.7510601050967539,0.7287028664218831,0.02,0.4446019424459672,0.4593677882165384,0.0,0.0,0.0,0.0,oversample,0.3216532104312074,0.3510415146651102,0.7617571661057588,0.7333641455296733,COMPLETE
1451,0.3926940639269406,2025-11-27 04:41:17.861909,2025-11-27 04:50:50.924313,0 days 00:09:33.062404,0.10529964790570723,dart,0.7596894553257827,1.9544780899394363,lossguide,3.2840308208580344,0.049200046256540626,4,9,0.29494285344262233,900,forest,0.8099901266299709,0.39940523952531937,0.015870635670970294,oversample,0.5454264370765168,,10.0,0.6847109321320125,0.18378684491090186,weighted,0.6350783407387802,0.5124155902117395,0.7037805226560628,0.2600633197648123,0.2781546811397558,0.3697996918335901,0.3926940639269406,0.8099901266299709,0.39940523952531937,0.02,0.40151720646523464,0.4222180610757059,0.3516483516483517,0.36962750716332377,0.38992688870836717,0.41883116883116883,oversample,0.19745478207529965,0.22820422044758104,0.5454264370765168,0.7037805226560628,COMPLETE
1452,0.7156549520766773,2025-11-27 04:50:51.104916,2025-11-27 04:52:16.184665,0 days 00:01:25.079749,0.02266281813498374,dart,0.6209200375786987,3.774051475263267,lossguide,0.036565150562353314,0.00024141862870010524,2,7,0.3585127309290104,800,tree,0.8084214532031229,0.6097233994012028,0.04388961040031397,oversample,0.9057649076853314,,11.0,0.6885895040676355,0.15887972186203278,weighted,0.6302933274893009,0.46635652602472577,0.4728765428930921,0.5567616463138851,0.5572139303482587,0.715281812899477,0.7156549520766773,0.8084214532031229,0.6097233994012028,0.05,0.4880568275752158,0.4875549658823734,0.5567616463138851,0.5572139303482587,1.0,1.0,oversample,0.4247475919693629,0.42045827640184125,0.9057649076853314,0.4728765428930921,COMPLETE
1453,0.016051364365971106,2025-11-27 04:52:16.367827,2025-11-27 04:52:17.375850,0 days 00:00:01.008023,0.09591297788503686,gbtree,0.8428042605528635,2.2286308704973092,lossguide,0.13660757862815376,0.043321022456997774,5,7,60.85841337782802,700,,0.8643703264726503,0.7619090351289896,0.09493197790021982,none,0.7019409920347693,0.8812630049205448,10.0,0.8515045915330618,,,,0.5978228130403871,0.6435886312049803,0.4468566259611036,0.44549977385798284,0.014504431909750202,0.016051364365971106,0.8643703264726503,0.7619090351289896,0.1,0.5745717706625746,0.5722158170415773,0.9,0.7142857142857143,0.007311129163281885,0.008116883116883116,none,0.5126858867023658,0.5231053420532481,0.7019409920347693,0.6435886312049803,COMPLETE
1454,0.715281812899477,2025-11-27 04:52:17.558367,2025-11-27 04:54:13.844742,0 days 00:01:56.286375,0.004034664488465491,dart,0.876699473175773,2.9529387376974734,depthwise,0.0018212313343281058,0.03453344201588533,8,6,4.974397435853623,500,forest,0.9292650527443178,0.7494491142614942,0.09401739816858261,undersample,0.6438392372541528,,6.0,0.6336516273684978,0.1761549355842632,weighted,0.8116123585422967,0.25175638160165187,0.1623227326169439,0.555857078245138,0.5567616463138851,0.7145348837209302,0.715281812899477,0.9292650527443178,0.7494491142614942,0.1,0.47268379634699864,0.4724845579553084,0.5563603440470801,0.5570135746606335,0.9983753046303818,0.9991883116883117,undersample,0.41182794807606227,0.4096953225528302,0.6438392372541528,0.1623227326169439,COMPLETE
1455,0.7156549520766773,2025-11-27 04:54:14.030589,2025-11-27 04:55:05.976400,0 days 00:00:51.945811,0.7541504518151484,dart,0.8137752522605788,3.9445572648256477,lossguide,3.289502265442386,0.016336959353963194,3,11,0.14354912201087972,400,forest,0.7917244132585907,0.47001381423988703,0.04746626125837764,none,0.7355868570668389,1.2890878008811222,11.0,0.6242690935726184,0.11463663899931814,uniform,0.586514805907332,0.2561459169904482,0.42281686675165886,0.5567616463138851,0.5572139303482587,0.715281812899477,0.7156549520766773,0.7917244132585907,0.47001381423988703,0.05,0.5676917624355525,0.5707286063964532,0.5567616463138851,0.5572139303482587,1.0,1.0,none,0.5007418889570451,0.4940429208176911,0.7355868570668389,0.42281686675165886,COMPLETE
1456,0.685909373060211,2025-11-27 04:55:06.159830,2025-11-27 04:55:40.456602,0 days 00:00:34.296772,1.9394928322600682,dart,0.650230414531938,0.707119212678437,lossguide,4.984136478347012,0.0071497608648934145,7,10,0.7076661005307273,500,forest,0.8377896784045282,0.23183199112844927,0.09468050004522119,oversample,0.5377900118946854,,7.0,0.7934296188510438,0.2290671504967461,weighted,0.7304543743353586,0.9621807933039481,0.4767595733881879,0.5386702849389416,0.5422885572139303,0.6808510638297872,0.685909373060211,0.8377896784045282,0.23183199112844927,0.1,0.48440927988408355,0.4739173071676907,0.5536895674300254,0.5552763819095478,0.8838342810722989,0.8969155844155844,oversample,0.40997529799897214,0.39562923669792927,0.5377900118946854,0.4767595733881879,COMPLETE
1457,0.7156549520766773,2025-11-27 04:55:40.638069,2025-11-27 04:55:42.128511,0 days 00:00:01.490442,0.014655230232053949,gbtree,0.9104141668286833,0.6626735447047883,lossguide,0.7009671020095154,0.016613974014359642,8,5,72.46245152799005,800,,0.8942928757466069,0.6361228233903903,0.003070893961574799,none,0.5160009816167572,2.9187283580683245,7.0,0.7455365829005743,,,,0.2828639362816043,0.33894267468637396,0.5567616463138851,0.5572139303482587,0.715281812899477,0.7156549520766773,0.8942928757466069,0.6361228233903903,0.0,0.5892943334186048,0.584014643039232,0.5567616463138851,0.5572139303482587,1.0,1.0,none,0.5315891344352526,0.5039382221455766,0.5160009816167572,0.33894267468637396,COMPLETE
1458,0.0,2025-11-27 04:55:42.315201,2025-11-27 04:55:43.319927,0 days 00:00:01.004726,4.992748503965117,gbtree,0.6184029636330539,2.0781263575994355,lossguide,0.02246168460174349,0.0038016594903327347,0,7,0.2219239411484537,700,,0.9504588192778892,0.6653015769168934,0.009781001218262388,oversample,0.6973747908078671,,9.0,0.6176891428364932,,,,0.23092167857626045,0.6019140650307493,0.44323835368611486,0.4427860696517413,0.0,0.0,0.9504588192778892,0.6653015769168934,0.0,0.48607664354842095,0.4833089165081883,0.0,0.0,0.0,0.0,oversample,0.39691142094530746,0.39139502606688514,0.6973747908078671,0.6019140650307493,COMPLETE
1459,0.0,2025-11-27 04:55:43.498256,2025-11-27 04:57:15.474852,0 days 00:01:31.976596,0.06227225593133934,dart,0.632556204780655,4.890756040721179,lossguide,0.01564963722092099,0.014582682469393891,2,9,1.217431534943298,600,forest,0.8800718293662824,0.6587633549308732,0.060302913542356555,oversample,0.7864162664310563,,10.0,0.6355472704021836,0.1187112981495484,weighted,0.6875055929695636,0.41984838555955106,0.6690834113027909,0.44323835368611486,0.4427860696517413,0.0,0.0,0.8800718293662824,0.6587633549308732,0.05,0.5367142242747152,0.5371321410710537,0.0,0.0,0.0,0.0,oversample,0.5087828876473416,0.5046873134526352,0.7864162664310563,0.6690834113027909,COMPLETE
1460,0.6587632169176546,2025-11-27 04:57:15.658154,2025-11-27 05:03:24.761802,0 days 00:06:09.103648,0.05125019102954879,dart,0.8522309461875017,0.5570751805486718,lossguide,7.545599949773073,0.005508495777698699,3,12,0.8587206916706703,700,forest,0.8845779024836974,0.5223453635719003,0.048934320760339864,oversample,0.8285351658684932,,10.0,0.605074958319968,0.15734644803098238,weighted,0.4406942738995496,0.21223127653229468,0.7436100515336509,0.5228403437358661,0.5183175033921302,0.65846552282292,0.6587632169176546,0.8845779024836974,0.5223453635719003,0.05,0.47554669379171594,0.47455170566808036,0.5473627556512379,0.5442032821598729,0.826157595450853,0.8344155844155844,oversample,0.4081636797692269,0.40484965111497284,0.8285351658684932,0.7436100515336509,COMPLETE
1461,0.11631205673758865,2025-11-27 05:03:24.944563,2025-11-27 05:03:27.689065,0 days 00:00:02.744502,0.03572764498409778,gbtree,0.4713362721875867,0.5844129622679755,lossguide,4.457834418784286,0.3654429965815129,10,8,16.241975829670114,300,,0.7593734238098374,0.7342067795778292,0.01925513095628812,undersample,0.5507081568447448,,7.0,0.8215085595256486,,,,0.548676455406226,0.7643911548706686,0.4527363184079602,0.4364540931705111,0.1490857946554149,0.11631205673758865,0.7593734238098374,0.7342067795778292,0.02,0.5512310887563376,0.5324431827945725,0.5549738219895288,0.4606741573033708,0.08610885458976442,0.06655844155844155,undersample,0.5067855899467829,0.4964178760463235,0.5507081568447448,0.7643911548706686,COMPLETE
1462,0.0,2025-11-27 05:03:27.872353,2025-11-27 05:04:45.935924,0 days 00:01:18.063571,92.27451200732172,dart,0.9414027321242334,1.103482341610564,lossguide,3.7927305173429775,0.0058824079810773445,10,9,96.3560658871061,800,forest,0.874613941112309,0.8768816227716298,0.023396679130701967,oversample,0.6037746978237818,,6.0,0.7125763541598434,0.1789887103786366,weighted,0.5964662746413605,0.41654707494118026,0.6121055207674644,0.44323835368611486,0.4427860696517413,0.0,0.0,0.874613941112309,0.8768816227716298,0.02,0.5567616463138851,0.5572139303482587,0.0,0.0,0.0,0.0,oversample,0.5,0.5,0.6037746978237818,0.6121055207674644,COMPLETE
1463,0.7156549520766773,2025-11-27 05:04:46.120474,2025-11-27 05:04:58.857168,0 days 00:00:12.736694,5.179357173465529,dart,0.6161293859676343,0.1196057108545796,depthwise,0.8997521503006107,0.02002312781373522,10,6,3.6050394784210877,300,forest,0.9984953147082033,0.28041395063362284,0.036933472509658075,oversample,0.5448496611981144,,6.0,0.7801133664736397,0.07144310959518259,weighted,0.630736781383057,0.26691426348500985,0.3391632203407459,0.5567616463138851,0.5572139303482587,0.715281812899477,0.7156549520766773,0.9984953147082033,0.28041395063362284,0.05,0.49809479528255873,0.48654536137050197,0.5567616463138851,0.5572139303482587,1.0,1.0,oversample,0.4702204114789701,0.43989526816390967,0.5448496611981144,0.3391632203407459,COMPLETE
1464,0.18686868686868688,2025-11-27 05:04:59.038264,2025-11-27 05:06:45.173339,0 days 00:01:46.135075,0.08779919109570558,dart,0.7332571603767026,2.9799209197808163,lossguide,4.600473223480173,0.010037390073735483,1,9,1.095901406613407,900,forest,0.7584037401965477,0.6114740424919819,0.03343736110972019,oversample,0.6600561213692433,,10.0,0.6873974316605642,0.13237646506392536,weighted,0.7311793319916307,0.2331417690202721,0.5953231667063568,0.4188150158299412,0.41745816372682043,0.17469492614001284,0.18686868686868688,0.7584037401965477,0.6114740424919819,0.02,0.5137255474009351,0.5072170396168811,0.4171779141104294,0.42045454545454547,0.11047928513403736,0.12012987012987013,oversample,0.457752117906464,0.4496757392250242,0.6600561213692433,0.5953231667063568,COMPLETE
1465,0.7156549520766773,2025-11-27 05:06:45.369533,2025-11-27 05:06:46.099729,0 days 00:00:00.730196,43.18098313064949,gbtree,0.9784053160520687,1.3202823533856851,lossguide,30.34070913396988,0.01347384955946179,10,3,9.447002494524313,400,,0.9280405419805733,0.5854265744939025,0.023957469760407066,oversample,0.5290167163725612,,9.0,0.6587020920621168,,,,0.33242553609339187,0.4200080016649104,0.5567616463138851,0.5572139303482587,0.715281812899477,0.7156549520766773,0.9280405419805733,0.5854265744939025,0.02,0.5567616463138851,0.5572139303482587,0.5567616463138851,0.5572139303482587,1.0,1.0,oversample,0.5,0.5,0.5290167163725612,0.4200080016649104,COMPLETE
1466,0.2613941018766756,2025-11-27 05:06:46.292253,2025-11-27 05:06:47.304144,0 days 00:00:01.011891,0.8479403396146744,gbtree,0.9282052331698492,4.018554934621193,lossguide,0.0008747028247514109,0.0026933875721818117,4,8,7.699361230510774,700,,0.7209591912981866,0.10895743617597922,0.09834507207295694,undersample,0.840068510623159,,7.0,0.7411945590341779,,,,0.7562165381424203,0.5489556340595977,0.501130710085934,0.5015829941203076,0.2661343978709248,0.2613941018766756,0.7209591912981866,0.10895743617597922,0.1,0.6807773036572904,0.7042927830093683,0.7352941176470589,0.75,0.16246953696181965,0.15827922077922077,undersample,0.6337343954641158,0.6558769052704191,0.840068510623159,0.5489556340595977,COMPLETE
1467,0.7122888759464182,2025-11-27 05:06:47.498060,2025-11-27 05:07:18.743662,0 days 00:00:31.245602,0.03897891643803802,dart,0.6584319769274284,4.7190386793095405,depthwise,1.3510226514533183,0.0034741894561509824,8,9,0.5224654475638816,500,forest,0.9490209710223604,0.6347267255659441,0.08353294037415088,oversample,0.663795423452241,,10.0,0.6764899198115675,0.23582723196904273,weighted,0.691154687286313,0.38553356776342096,0.5341346859790258,0.5545002261420172,0.5531433740388965,0.7134128600523713,0.7122888759464182,0.9490209710223604,0.6347267255659441,0.08,0.455722409891513,0.44627462375897353,0.5557570262919311,0.5554041780199819,0.9959382615759546,0.9926948051948052,oversample,0.3441755499925397,0.3230817956303145,0.663795423452241,0.5341346859790258,COMPLETE
1468,0.7156549520766773,2025-11-27 05:07:18.931168,2025-11-27 05:07:19.591616,0 days 00:00:00.660448,0.0039043355628343474,gbtree,0.642794382181667,3.454962617657826,lossguide,64.81012943100447,0.45572508201656897,7,8,3.6713863258021684,300,,0.7997946804217126,0.7750892295071882,0.02841589833351073,undersample,0.52027497232811,,9.0,0.7959137261020428,,,,0.22368699853458884,0.1406088962221611,0.5567616463138851,0.5572139303482587,0.715281812899477,0.7156549520766773,0.7997946804217126,0.7750892295071882,0.02,0.4673045529145748,0.4575528109638721,0.5567616463138851,0.5572139303482587,1.0,1.0,undersample,0.37631343357814284,0.36433156348248275,0.52027497232811,0.1406088962221611,COMPLETE
1469,0.7156549520766773,2025-11-27 05:07:19.775221,2025-11-27 05:07:20.591017,0 days 00:00:00.815796,0.06526535772488948,gbtree,0.7716388865943244,2.0007929349254825,lossguide,76.89608891609839,0.009845199416302243,8,12,0.7046405560678852,500,,0.6789571496391901,0.25264405953250013,0.07696194738578266,oversample,0.6183384087172055,,7.0,0.762197791710396,,,,0.6157209966454341,0.5262414198094907,0.5567616463138851,0.5572139303482587,0.715281812899477,0.7156549520766773,0.6789571496391901,0.25264405953250013,0.08,0.4607282788114395,0.459940115662147,0.5567616463138851,0.5572139303482587,1.0,1.0,oversample,0.36165263018286115,0.35386542721833836,0.6183384087172055,0.5262414198094907,COMPLETE
1470,0.6887019230769231,2025-11-27 05:07:20.771891,2025-11-27 05:08:23.144343,0 days 00:01:02.372452,0.022574060657340037,dart,0.8122363594433684,1.2707548541288924,lossguide,2.5341887963707697,0.0909528612150261,10,4,16.63699646787128,700,forest,0.8908626395054184,0.2670835322531474,0.03321225056390531,oversample,0.7044490688181577,,10.0,0.7934945210423038,0.14786867475928778,weighted,0.5788391771559608,0.20462578729398703,0.4892229804329307,0.5386702849389416,0.5314337403889643,0.6942446043165468,0.6887019230769231,0.8908626395054184,0.2670835322531474,0.02,0.48672532523363055,0.48780656440804404,0.5501187648456057,0.5467557251908397,0.9406986190089358,0.9301948051948052,oversample,0.4015364147283609,0.39965865977740334,0.7044490688181577,0.4892229804329307,COMPLETE
