number,value,datetime_start,datetime_complete,duration,params_alpha,params_booster,params_colsample_bytree,params_gamma,params_grow_policy,params_lambda,params_learning_rate,params_max_delta_step,params_max_depth,params_min_child_weight,params_n_estimators,params_normalize_type,params_params_feature_fraction,params_params_labeled_ratio,params_params_missing_rate,params_params_resampling,params_params_sample_rows,params_params_scale_pos_weight,params_params_selftrain_max_iter,params_params_selftrain_threshold,params_rate_drop,params_sample_type,params_skip_drop,params_subsample,params_user_attrs_decision_threshold,user_attrs_acc_test,user_attrs_acc_val,user_attrs_f1_test,user_attrs_f1_val,user_attrs_feature_fraction,user_attrs_labeled_ratio,user_attrs_missing_rate,user_attrs_pr_auc_test,user_attrs_pr_auc_val,user_attrs_prec_test,user_attrs_prec_val,user_attrs_rec_test,user_attrs_rec_val,user_attrs_resampling_strategy,user_attrs_roc_auc_test,user_attrs_roc_auc_val,user_attrs_sample_rows,user_attrs_user_attrs_decision_threshold,state
1128,0.7156549520766773,2025-11-27 00:22:33.760320,2025-11-27 00:22:42.061431,0 days 00:00:08.301111,0.0318054762402788,dart,0.9070644279063075,5.502884193928105,lossguide,0.3530673642605856,0.09897889952893378,4,4,0.1557605249578921,200,tree,0.8788061937246877,0.9345636378162067,0.06307205568322,oversample,0.7749166346043701,,5.0,0.6645711312822223,0.22395947213496387,uniform,0.8200623004605827,0.4322777341704379,0.4086336504846221,0.5567616463138851,0.5572139303482587,0.715281812899477,0.7156549520766773,0.8788061937246877,0.9345636378162067,0.05,0.49505619473893714,0.49339680747911707,0.5567616463138851,0.5572139303482587,1.0,1.0,oversample,0.42091836734693877,0.42787457052651134,0.7749166346043701,0.4086336504846221,COMPLETE
1129,0.7156549520766773,2025-11-27 00:22:42.252585,2025-11-27 00:22:54.315722,0 days 00:00:12.063137,0.39786313301589027,dart,0.8400912873246058,5.81893841191796,lossguide,0.005031684495092543,0.018739404392370224,0,4,0.4240013401492299,300,tree,0.88749363496977,0.776972562711151,0.0656928611345742,oversample,0.7215742200114486,,6.0,0.6616770196426629,0.2975604613725731,uniform,0.8828097859790702,0.22215976984666258,0.43937633800035064,0.5567616463138851,0.5572139303482587,0.715281812899477,0.7156549520766773,0.88749363496977,0.776972562711151,0.08,0.45591057559489917,0.45321465095820634,0.5567616463138851,0.5572139303482587,1.0,1.0,oversample,0.3437387058804025,0.3366761239271454,0.7215742200114486,0.43937633800035064,COMPLETE
1130,0.7,2025-11-27 00:22:54.498779,2025-11-27 00:22:56.383835,0 days 00:00:01.885056,0.000995559295377909,gbtree,0.9576532336251887,2.511674368192468,lossguide,0.04442415670114523,0.03441537532638821,9,11,3.7992389173349395,200,,0.9106598375263428,0.48323475660208787,0.05646208444645467,oversample,0.5892776959328738,,5.0,0.6017457692602888,,,,0.5163262036503055,0.24495745200770586,0.5440976933514247,0.5576662143826323,0.6909871244635193,0.7,0.9106598375263428,0.48323475660208787,0.05,0.5325662681010592,0.517891402669101,0.5548990645002462,0.5626232741617357,0.9155158407798538,0.9261363636363636,oversample,0.46974087766707007,0.47149804995821337,0.5892776959328738,0.24495745200770586,COMPLETE
1131,0.7156549520766773,2025-11-27 00:22:56.569700,2025-11-27 00:22:57.146486,0 days 00:00:00.576786,0.4252324244050902,gbtree,0.7543424369865981,6.981019538241407,lossguide,0.08749348237974844,0.037320059615269865,0,6,0.1538428239904821,200,,0.8252170714451167,0.9171714635001276,0.08158343296086479,oversample,0.7356755532507745,,5.0,0.6709371709751879,,,,0.2712518342599385,0.4998565245763377,0.5567616463138851,0.5572139303482587,0.715281812899477,0.7156549520766773,0.8252170714451167,0.9171714635001276,0.08,0.4814659463228802,0.47771590366345895,0.5567616463138851,0.5572139303482587,1.0,1.0,oversample,0.35533414015484344,0.3593984220580237,0.7356755532507745,0.4998565245763377,COMPLETE
1132,0.5869090909090909,2025-11-27 00:22:57.331410,2025-11-27 00:22:58.249210,0 days 00:00:00.917800,3.146553962719521,gbtree,0.8851156305136924,0.15575404120505532,lossguide,0.009988702871948417,0.018191713030791853,7,9,54.625304847998535,300,,0.9248926633534804,0.8495426508332298,0.07171599877507934,none,0.8076449472857483,0.507124598139784,12.0,0.9065197437337542,,,,0.6162647718421314,0.37388739567578666,0.4767073722297603,0.4862053369516056,0.5785063752276867,0.5869090909090909,0.9248926633534804,0.8495426508332298,0.08,0.5023989523342456,0.5031701586064112,0.52443857331572,0.5316205533596838,0.6450040617384241,0.6550324675324676,none,0.4262624546162901,0.42867340779751406,0.8076449472857483,0.37388739567578666,COMPLETE
1133,0.25448028673835127,2025-11-27 00:22:58.436127,2025-11-27 00:23:00.538103,0 days 00:00:02.101976,0.017518585541395754,gbtree,0.7830035311623161,3.8182654536360023,lossguide,1.2158405386146827,0.09481747163610763,0,7,0.20207231495720682,600,,0.6991022706686804,0.8227673225529433,0.06882232250497329,undersample,0.8289034591224516,,6.0,0.6294110628482703,,,,0.3149471252935121,0.5658911831108018,0.4559023066485753,0.4355495251017639,0.2739891369945685,0.25448028673835127,0.6991022706686804,0.8227673225529433,0.08,0.5381589636432241,0.5251953308344317,0.5328638497652582,0.4819004524886878,0.1844029244516653,0.1728896103896104,undersample,0.46726197383908885,0.46408797407903635,0.8289034591224516,0.5658911831108018,COMPLETE
1134,0.7156549520766773,2025-11-27 00:23:00.718349,2025-11-27 00:24:16.435919,0 days 00:01:15.717570,4.487043220222803,dart,0.3893369406131763,5.944080547166628,lossguide,4.465831907008744,0.00014984717064637072,4,11,59.892177518327195,800,tree,0.7095764301901175,0.1268001311577189,0.028619188173486774,none,0.938844644129362,0.8142611835530651,8.0,0.8029584180095873,0.24405075849154995,uniform,0.6077981821960956,0.7079693553902194,0.18267344535445462,0.5567616463138851,0.5572139303482587,0.715281812899477,0.7156549520766773,0.7095764301901175,0.1268001311577189,0.02,0.5264562177080571,0.5357122938746073,0.5567616463138851,0.5572139303482587,1.0,1.0,none,0.42882507999137914,0.4520875893769153,0.938844644129362,0.18267344535445462,COMPLETE
1135,0.6091663659328762,2025-11-27 00:24:16.612762,2025-11-27 00:24:18.540215,0 days 00:00:01.927453,0.018455020786421486,gbtree,0.7882247177472013,2.3908079446757653,lossguide,0.017929538916452513,0.1424907760336495,7,11,2.0724053080714184,500,,0.9390087789304565,0.6421933691326338,0.0899422419398295,oversample,0.6837679342799703,,7.0,0.7532951993029219,,,,0.8281763552654126,0.5333304269021546,0.5237449118046132,0.5101763907734057,0.6269925611052072,0.6091663659328762,0.9390087789304565,0.6421933691326338,0.08,0.536538374334661,0.5064253186796809,0.5559045226130653,0.548408057179987,0.718927701056052,0.685064935064935,oversample,0.4771419453240272,0.4413561413050687,0.6837679342799703,0.5333304269021546,COMPLETE
1136,0.7001223990208079,2025-11-27 00:24:18.719329,2025-11-27 00:24:22.596681,0 days 00:00:03.877352,0.020553283567544055,gbtree,0.9405760385897515,2.6447744769227546,lossguide,0.34426735517426926,0.08390365118645156,7,12,2.5005288698840262,800,,0.868294744127463,0.36615435067675817,0.09245050955357875,oversample,0.536613556142697,,8.0,0.6548166935202822,,,,0.5306999137501173,0.11825993351721525,0.5531433740388965,0.5567616463138851,0.6965601965601965,0.7001223990208079,0.868294744127463,0.36615435067675817,0.1,0.584282577651157,0.5824125450685944,0.56,0.5618860510805501,0.9212022745735174,0.9285714285714286,oversample,0.5439496676005902,0.5518415126752716,0.536613556142697,0.11825993351721525,COMPLETE
1137,0.7156549520766773,2025-11-27 00:24:22.776802,2025-11-27 00:25:05.745359,0 days 00:00:42.968557,0.1779311975444041,dart,0.849197639780831,2.031423610098113,depthwise,0.14063720572386343,0.009803376196831609,9,10,11.85428446367365,600,tree,0.9009333963074055,0.055887655140323594,0.051225035366932514,oversample,0.6292666898910507,,6.0,0.7089436107597135,0.3217081276337227,uniform,0.6549569805856007,0.40230992087468687,0.2284238166252121,0.5567616463138851,0.5572139303482587,0.715281812899477,0.7156549520766773,0.9009333963074055,0.055887655140323594,0.05,0.4948350107282149,0.49580365972427415,0.5567616463138851,0.5572139303482587,1.0,1.0,oversample,0.41575332813872906,0.4144891752782458,0.6292666898910507,0.2284238166252121,COMPLETE
1138,0.7156549520766773,2025-11-27 00:25:05.921385,2025-11-27 00:25:10.074418,0 days 00:00:04.153033,0.000625505868216072,gbtree,0.3330729872873465,2.867937572094959,lossguide,18.978690026783944,0.04445897998656425,10,10,1.0392767303141872,800,,0.9002527745307652,0.5810039544442589,0.05387449554787058,oversample,0.6037305322538151,,12.0,0.6428520180634169,,,,0.4727839037858792,0.15231919671703464,0.5567616463138851,0.5572139303482587,0.715281812899477,0.7156549520766773,0.9002527745307652,0.5810039544442589,0.05,0.7246158533035721,0.720781728414515,0.5567616463138851,0.5572139303482587,1.0,1.0,oversample,0.7213261990417612,0.6996960521603014,0.6037305322538151,0.15231919671703464,COMPLETE
1139,0.0,2025-11-27 00:25:10.258328,2025-11-27 00:26:26.675613,0 days 00:01:16.417285,0.02148531092376589,dart,0.3368388640110582,4.1042719386024435,depthwise,0.0005352671450850442,0.014287244606316531,8,5,0.12624387964616915,800,tree,0.5852658612380977,0.6858358228541439,0.0007262478611523771,undersample,0.8172958474286239,,7.0,0.6004520025074593,0.33046562520787326,uniform,0.7753386404063464,0.46029381973382755,0.5788057363770566,0.44323835368611486,0.4427860696517413,0.0,0.0,0.5852658612380977,0.6858358228541439,0.0,0.5801004252239897,0.5763892096957115,0.0,0.0,0.0,0.0,undersample,0.5250600971501517,0.5380622952124484,0.8172958474286239,0.5788057363770566,COMPLETE
1140,0.7156549520766773,2025-11-27 00:26:26.845840,2025-11-27 00:26:34.510247,0 days 00:00:07.664407,0.10633428559183503,dart,0.8192318626526014,1.0696546771785094,lossguide,0.01084423239854303,0.003175736292157969,3,8,0.15674653067128,200,tree,0.8879022361164564,0.6874040395751077,0.0848422125435896,oversample,0.7389335035494063,,5.0,0.7027657090803058,0.19952382367302174,uniform,0.6675538457852918,0.298473004262188,0.3229742487807598,0.5567616463138851,0.5572139303482587,0.715281812899477,0.7156549520766773,0.8879022361164564,0.6874040395751077,0.08,0.5142716815770306,0.5157366650355759,0.5567616463138851,0.5572139303482587,1.0,1.0,oversample,0.4467157943599861,0.4593467691654617,0.7389335035494063,0.3229742487807598,COMPLETE
1141,0.7156549520766773,2025-11-27 00:26:34.689125,2025-11-27 00:26:50.913120,0 days 00:00:16.223995,0.39935290833297077,dart,0.7053878320399654,5.084122079530122,lossguide,17.47464808741851,0.19410309438177192,0,4,0.14656488897135747,300,tree,0.9875309379674925,0.769834577262205,0.08735602365980778,oversample,0.7018401390781438,,7.0,0.6603469548512332,0.4228484530756671,uniform,0.7253389476170642,0.4366432961375325,0.3477531819335701,0.5567616463138851,0.5572139303482587,0.715281812899477,0.7156549520766773,0.9875309379674925,0.769834577262205,0.08,0.5262434874092523,0.5285202058295165,0.5567616463138851,0.5572139303482587,1.0,1.0,oversample,0.47453207115502577,0.4758968368199727,0.7018401390781438,0.3477531819335701,COMPLETE
1142,0.7156549520766773,2025-11-27 00:26:51.089884,2025-11-27 00:27:11.148613,0 days 00:00:20.058729,2.7691186234413485,dart,0.754556566504074,9.007174066922294,depthwise,0.0001663733384412253,0.01108490952553863,5,4,0.3722834673290585,400,tree,0.668645582473208,0.874699520584655,0.03375595415804378,oversample,0.8326936878428588,,11.0,0.8262015979631827,0.29126196044374714,uniform,0.7817663322765638,0.5879804026627001,0.4028515236640607,0.5567616463138851,0.5572139303482587,0.715281812899477,0.7156549520766773,0.668645582473208,0.874699520584655,0.02,0.4936229637531183,0.4955176863476832,0.5567616463138851,0.5572139303482587,1.0,1.0,oversample,0.39849674231999865,0.391405804359073,0.8326936878428588,0.4028515236640607,COMPLETE
1143,0.7116564417177914,2025-11-27 00:27:11.324609,2025-11-27 00:27:15.652598,0 days 00:00:04.327989,0.24059646453448688,gbtree,0.830994885645904,0.9583322939998689,lossguide,0.4947330197976188,0.13734478171136985,10,12,1.2810922741810524,300,,0.9866552906706152,0.5015891404763541,0.05907010815709601,oversample,0.5581944942475822,,7.0,0.8885904071184884,,,,0.5394555712076017,0.03289544619276247,0.5563093622795116,0.55359565807327,0.7129060579455663,0.7116564417177914,0.9866552906706152,0.5015891404763541,0.05,0.5716981781290597,0.5538753980049973,0.5571820677035682,0.5559105431309904,0.9894394800974817,0.9886363636363636,oversample,0.5202805086291218,0.495224387461364,0.5581944942475822,0.03289544619276247,COMPLETE
1144,0.3562281722933644,2025-11-27 00:27:15.835451,2025-11-27 00:27:17.913245,0 days 00:00:02.077794,0.004862702345362383,gbtree,0.3384642321058409,1.7058207163088004,depthwise,0.09640931777918395,0.32598174377701084,0,3,1.8410070289286613,700,,0.9208446487584052,0.27126917190892186,0.012883367943938465,none,0.970812758539663,0.6652599033571287,6.0,0.6779098062541881,,,,0.8027765458179557,0.6199792720755836,0.4966078697421981,0.4997738579828132,0.34413671184443134,0.3562281722933644,0.9208446487584052,0.27126917190892186,0.02,0.5871320071201468,0.5968343070822566,0.6266094420600858,0.6296296296296297,0.2372055239642567,0.2483766233766234,none,0.5333091563189045,0.557212418582439,0.970812758539663,0.6199792720755836,COMPLETE
1145,0.7156549520766773,2025-11-27 00:27:18.091197,2025-11-27 00:27:48.416211,0 days 00:00:30.325014,6.828675151939851,dart,0.7471593481907979,1.0303067542037805,depthwise,3.2177709081401256,0.014807360993706263,8,11,96.47166109239146,500,tree,0.9680626695009412,0.4066069795799184,0.07738105317180106,oversample,0.5311935540859476,,6.0,0.6848674809937085,0.2526249905404826,uniform,0.6649322321003872,0.5746671046158415,0.03972983859374289,0.5567616463138851,0.5572139303482587,0.715281812899477,0.7156549520766773,0.9680626695009412,0.4066069795799184,0.08,0.4987630207600936,0.5031910043233859,0.5567616463138851,0.5572139303482587,1.0,1.0,oversample,0.33865282912515127,0.35445242959287904,0.5311935540859476,0.03972983859374289,COMPLETE
1146,0.7156549520766773,2025-11-27 00:27:48.606683,2025-11-27 00:27:50.205029,0 days 00:00:01.598346,0.3954260537228297,gbtree,0.855933648301375,3.38235628629721,lossguide,1.783943275742933,0.12616578861736064,9,10,15.478294014489357,400,,0.9526662130668984,0.8725012371088889,0.057969023453957096,oversample,0.5668107251858403,,7.0,0.6166066344378102,,,,0.6558284331010744,0.12077387311680998,0.5567616463138851,0.5572139303482587,0.715281812899477,0.7156549520766773,0.9526662130668984,0.8725012371088889,0.05,0.5610000724232178,0.5446825258563084,0.5567616463138851,0.5572139303482587,1.0,1.0,oversample,0.5095169018054013,0.4898920346762533,0.5668107251858403,0.12077387311680998,COMPLETE
1147,0.715281812899477,2025-11-27 00:27:50.378953,2025-11-27 00:28:09.512236,0 days 00:00:19.133283,0.0031338952763749436,gbtree,0.8332857207832822,0.47066056581944027,lossguide,1.5521483663019422,0.023383271552848747,10,12,3.8802025675524696,600,,0.9402026021252702,0.6666300290818513,0.059468488087364144,none,0.670879878013223,0.9194619175493086,7.0,0.7956188757470554,,,,0.6661633824208947,0.049280943673429056,0.5549525101763908,0.5567616463138851,0.7137870855148342,0.715281812899477,0.9402026021252702,0.6666300290818513,0.05,0.5618633404053057,0.5801238048989292,0.55595831445401,0.5570135746606335,0.9967506092607636,0.9991883116883117,none,0.494636847427842,0.5080057837974079,0.670879878013223,0.049280943673429056,COMPLETE
1148,0.5051546391752577,2025-11-27 00:28:09.686448,2025-11-27 00:28:13.291789,0 days 00:00:03.605341,0.00028250935809544437,gbtree,0.6091257798803258,2.434440475075346,lossguide,0.00739836127419095,0.1405549445605624,8,12,0.43073584737977894,500,,0.8757847453904376,0.3033704553780641,0.05290445167363683,undersample,0.5756968751016536,,11.0,0.6547216958228581,,,,0.4517734396460391,0.4714348680065227,0.4925373134328358,0.4789687924016282,0.5205128205128206,0.5051546391752577,0.8757847453904376,0.3033704553780641,0.05,0.527589184366756,0.5247049639946464,0.5491433724075744,0.5364963503649635,0.49471974004874086,0.4772727272727273,undersample,0.46500770901374355,0.4600150232811111,0.5756968751016536,0.4714348680065227,COMPLETE
1149,0.7156549520766773,2025-11-27 00:28:13.468835,2025-11-27 00:28:14.261257,0 days 00:00:00.792422,1.5409762944424892,gbtree,0.8086037071343151,2.535525666051096,lossguide,23.560870695489022,0.11873583816152525,7,6,26.961176049494323,600,,0.952173487237362,0.17455211611832938,0.06945908640801622,oversample,0.5134948073908805,,9.0,0.6928702287238845,,,,0.44230179348678367,0.021137322805940634,0.5567616463138851,0.5572139303482587,0.715281812899477,0.7156549520766773,0.952173487237362,0.17455211611832938,0.08,0.5403464181357804,0.5303037516969106,0.5567616463138851,0.5572139303482587,1.0,1.0,oversample,0.4608925048492183,0.44253014605415014,0.5134948073908805,0.021137322805940634,COMPLETE
1150,0.7156549520766773,2025-11-27 00:28:14.441150,2025-11-27 00:33:11.493052,0 days 00:04:57.051902,0.08874165422901607,dart,0.8351699183407214,2.5427258521085023,lossguide,0.30359269905617337,0.014777806666565682,1,5,0.20618559779044454,800,tree,0.8161132744395271,0.9420327748680071,0.08699865052609294,oversample,0.6048902971293293,,6.0,0.6255078972230694,0.31546898141605384,weighted,0.850462452659996,0.2741735756133777,0.11771013501904831,0.5567616463138851,0.5572139303482587,0.715281812899477,0.7156549520766773,0.8161132744395271,0.9420327748680071,0.08,0.5407431068737684,0.5364643797337556,0.5567616463138851,0.5572139303482587,1.0,1.0,oversample,0.4847465143652912,0.4775575229163074,0.6048902971293293,0.11771013501904831,COMPLETE
1151,0.5362318840579711,2025-11-27 00:33:11.672972,2025-11-27 00:33:24.824448,0 days 00:00:13.151476,0.04656141427529214,gbtree,0.974251620750229,0.1855138197767453,lossguide,2.661487120325396,0.06921725335483454,9,8,2.3511388798743114,700,,0.6229543777576145,0.4228152152429231,0.09738169105539839,undersample,0.6439222065232884,,6.0,0.7039848777197774,,,,0.8255509416258975,0.4981380000297544,0.5106286748077793,0.5079149706015378,0.5476588628762542,0.5362318840579711,0.6229543777576145,0.4228152152429231,0.1,0.5640889795375577,0.5538198278381106,0.5641688199827735,0.5646319569120287,0.5320877335499594,0.510551948051948,undersample,0.5130157993335432,0.49821453444410546,0.6439222065232884,0.4981380000297544,COMPLETE
1152,0.6456241032998565,2025-11-27 00:33:25.006225,2025-11-27 00:33:29.080621,0 days 00:00:04.074396,0.003198668690817071,gbtree,0.8886912763424522,2.068041415240439,lossguide,0.07510174509039842,0.050953899886861866,0,5,0.19970696905918497,800,,0.854856780304841,0.45890544637202557,0.07799778646215119,undersample,0.6123867411474142,,6.0,0.7832248083813821,,,,0.37664767007091937,0.33731542366422856,0.5323383084577115,0.5531433740388965,0.627521613832853,0.6456241032998565,0.854856780304841,0.45890544637202557,0.08,0.5276378858066908,0.5266942016377595,0.5637540453074433,0.5784061696658098,0.7075548334687246,0.7305194805194806,undersample,0.48376796697557983,0.5000174110873804,0.6123867411474142,0.33731542366422856,COMPLETE
1153,0.6616257088846881,2025-11-27 00:33:29.262015,2025-11-27 00:34:29.009542,0 days 00:00:59.747527,0.10465383749266119,dart,0.9640231895372507,3.115592660291429,lossguide,0.004679131624624605,0.1319273705165431,1,3,0.9802399135105107,400,tree,0.959666541513731,0.6062320511568392,0.09349461219228505,oversample,0.7727805130523433,,5.0,0.7449916881498212,0.3864004423666191,uniform,0.7512036052089577,0.36487221823066696,0.42923813487439527,0.527363184079602,0.514246947082768,0.6718995290423861,0.6616257088846881,0.959666541513731,0.6062320511568392,0.1,0.48084445522508135,0.4892750528725939,0.5475946775844421,0.5406797116374872,0.8692120227457352,0.8522727272727273,oversample,0.41509308841326953,0.4252376198877731,0.7727805130523433,0.42923813487439527,COMPLETE
1154,0.5206431986093003,2025-11-27 00:34:29.184399,2025-11-27 00:40:08.887977,0 days 00:05:39.703578,0.06856976289866608,dart,0.5962111831388275,1.4677284117027565,depthwise,0.0003052900685706507,0.12469482498329532,7,11,0.6736247744691697,900,tree,0.8141851404391541,0.42575555403773635,0.008883850272206567,oversample,0.872138786233397,,6.0,0.776429199815903,0.3554811183993771,uniform,0.6454287832966934,0.7665509512224086,0.5818653735116391,0.5119855269109,0.501130710085934,0.5294374182293938,0.5206431986093003,0.8141851404391541,0.42575555403773635,0.0,0.5675857960399473,0.5656178389305399,0.571563088512241,0.5603367633302152,0.4930950446791227,0.4862012987012987,oversample,0.5162718214824517,0.5148740432192934,0.872138786233397,0.5818653735116391,COMPLETE
1155,0.7156549520766773,2025-11-27 00:40:09.068062,2025-11-27 00:40:40.783566,0 days 00:00:31.715504,0.05874519892983564,dart,0.9385626614777213,3.5754743271166296,lossguide,16.269669284638866,0.09470478374249106,7,11,3.2127250638595646,500,tree,0.9867160639708407,0.43926849483481,0.0514504696157645,oversample,0.648139135544582,,5.0,0.8229577826989308,0.3714452115829761,uniform,0.8454249729063069,0.5484809249478485,0.37180194196158145,0.5567616463138851,0.5572139303482587,0.715281812899477,0.7156549520766773,0.9867160639708407,0.43926849483481,0.05,0.6073013603906194,0.6102624297834057,0.5567616463138851,0.5572139303482587,1.0,1.0,oversample,0.5410687345612494,0.5469672373081464,0.648139135544582,0.37180194196158145,COMPLETE
