number,value,datetime_start,datetime_complete,duration,params_alpha,params_booster,params_colsample_bytree,params_gamma,params_grow_policy,params_lambda,params_learning_rate,params_max_delta_step,params_max_depth,params_min_child_weight,params_n_estimators,params_normalize_type,params_params_feature_fraction,params_params_labeled_ratio,params_params_missing_rate,params_params_resampling,params_params_sample_rows,params_params_scale_pos_weight,params_params_selftrain_max_iter,params_params_selftrain_threshold,params_rate_drop,params_sample_type,params_skip_drop,params_subsample,params_user_attrs_decision_threshold,user_attrs_acc_test,user_attrs_acc_val,user_attrs_f1_test,user_attrs_f1_val,user_attrs_feature_fraction,user_attrs_labeled_ratio,user_attrs_missing_rate,user_attrs_pr_auc_test,user_attrs_pr_auc_val,user_attrs_prec_test,user_attrs_prec_val,user_attrs_rec_test,user_attrs_rec_val,user_attrs_resampling_strategy,user_attrs_roc_auc_test,user_attrs_roc_auc_val,user_attrs_sample_rows,user_attrs_user_attrs_decision_threshold,state
839,0.7156549520766773,2025-11-26 21:58:46.709641,2025-11-26 21:58:47.458788,0 days 00:00:00.749147,0.35050581184425705,gbtree,0.852912329908305,4.140270748231225,lossguide,0.031935087510271236,0.017877220138856346,5,5,67.80720910699243,400,,0.9054631405244336,0.8344388754707065,0.09387024764905624,oversample,0.8174755010359331,,11.0,0.8178289233952388,,,,0.5715874214139915,0.48075222968110193,0.5567616463138851,0.5572139303482587,0.715281812899477,0.7156549520766773,0.9054631405244336,0.8344388754707065,0.1,0.4447492566351847,0.43741173992514004,0.5567616463138851,0.5572139303482587,1.0,1.0,oversample,0.32801231784346563,0.31461213071912764,0.8174755010359331,0.48075222968110193,COMPLETE
840,0.7156549520766773,2025-11-26 21:58:47.639428,2025-11-26 21:58:48.884281,0 days 00:00:01.244853,0.0038361760574145243,gbtree,0.4188301151278081,2.149060957133787,lossguide,0.0005647407862520653,0.0005240764549395264,2,10,0.1738358379305908,200,,0.9654525576669344,0.6812331928398252,0.061943624780250166,undersample,0.8276636136609805,,12.0,0.6522571188580809,,,,0.540808858118677,0.0925319250514341,0.5567616463138851,0.5572139303482587,0.715281812899477,0.7156549520766773,0.9654525576669344,0.6812331928398252,0.05,0.49304782437470507,0.4965235886321009,0.5567616463138851,0.5572139303482587,1.0,1.0,undersample,0.4393731660007626,0.45301037700807867,0.8276636136609805,0.0925319250514341,COMPLETE
841,0.7156549520766773,2025-11-26 21:58:49.070547,2025-11-26 21:58:50.179247,0 days 00:00:01.108700,0.13134561406393563,gbtree,0.8208483813960621,4.434826811189142,lossguide,0.03562282601659084,0.01094394377699714,4,8,0.2645795404773973,900,,0.974473583502636,0.606106662049596,0.09643828957850968,oversample,0.5289048808543351,,8.0,0.8011053079744055,,,,0.4225986221794147,0.20680420086668133,0.5567616463138851,0.5572139303482587,0.715281812899477,0.7156549520766773,0.974473583502636,0.606106662049596,0.1,0.62046716037646,0.6446371424457464,0.5567616463138851,0.5572139303482587,1.0,1.0,oversample,0.5829369684510685,0.6161800405927066,0.5289048808543351,0.20680420086668133,COMPLETE
842,0.0015772870662460567,2025-11-26 21:58:50.357322,2025-11-26 21:58:51.135797,0 days 00:00:00.778475,2.4159151926212585,gbtree,0.9850904088305084,9.042990900861607,depthwise,0.00036102955538636625,0.04281107690073752,5,5,0.12707139954997396,600,,0.9521949939541183,0.8146486135733431,0.04802559337990607,undersample,0.6718165629361322,,12.0,0.9063577396338073,,,,0.27434008201754556,0.5412515319794016,0.42966983265490727,0.42740841248303935,0.0,0.0015772870662460567,0.9521949939541183,0.8146486135733431,0.05,0.40118089555321873,0.393762620291753,0.0,0.027777777777777776,0.0,0.0008116883116883117,undersample,0.22202291152041648,0.19849095618375498,0.6718165629361322,0.5412515319794016,COMPLETE
843,0.0,2025-11-26 21:58:51.312256,2025-11-26 22:00:08.296273,0 days 00:01:16.984017,0.11140170121363416,dart,0.7398462106375084,8.457600845297836,depthwise,0.0002889655196316882,0.14713542026123172,9,5,0.15960106040031236,800,forest,0.8025741664729888,0.8924918479067779,0.039395474950669036,oversample,0.8797832580953976,,10.0,0.8566586354712014,0.2629047026499924,weighted,0.46297979880510337,0.6505828008369188,0.7533534188543567,0.44323835368611486,0.4427860696517413,0.0,0.0,0.8025741664729888,0.8924918479067779,0.05,0.4461691461555291,0.4642733768443153,0.0,0.0,0.0,0.0,oversample,0.3104908901009632,0.3159706100845018,0.8797832580953976,0.7533534188543567,COMPLETE
844,0.0,2025-11-26 22:00:08.469044,2025-11-26 22:00:09.511944,0 days 00:00:01.042900,0.004391941591069224,gbtree,0.6728642963123078,6.247316735696652,depthwise,0.00014415161494398616,0.00044005625499791295,9,12,0.23255058731519526,1000,,0.5826438352150675,0.7299373739131709,0.002837872456012771,none,0.9214069371520885,1.0241520934375137,6.0,0.664413421069208,,,,0.7643169348458553,0.6737652065608987,0.44323835368611486,0.4427860696517413,0.0,0.0,0.5826438352150675,0.7299373739131709,0.0,0.43623593435005414,0.43877337191361776,0.0,0.0,0.0,0.0,none,0.2760465193388484,0.27602294283857104,0.9214069371520885,0.6737652065608987,COMPLETE
845,0.7025900565644537,2025-11-26 22:00:09.685721,2025-11-26 22:00:28.220478,0 days 00:00:18.534757,0.032743676769589496,gbtree,0.5977512935093828,1.1888360072421398,lossguide,0.0017755744904122326,0.0035973742736863444,1,12,0.4914145299078465,300,,0.7593679547113728,0.5608319409994384,0.042458067582614195,undersample,0.6095453327543303,,12.0,0.6139124553793477,,,,0.6425492053576567,0.3757458732426915,0.5522388059701493,0.5481682496607869,0.7069271758436945,0.7025900565644537,0.7593679547113728,0.5608319409994384,0.05,0.5333738359197797,0.5165185295410202,0.5561248253376805,0.5547719793135872,0.9699431356620634,0.9577922077922078,undersample,0.48794202490094335,0.46914838226125255,0.6095453327543303,0.3757458732426915,COMPLETE
846,0.7156549520766773,2025-11-26 22:00:28.421469,2025-11-26 22:00:35.421633,0 days 00:00:07.000164,0.0004473590974835053,gbtree,0.6245947605402252,1.2901696893534018,lossguide,0.004853515007363785,0.00038985678130647915,10,11,0.1432684809834495,400,,0.8642283633568819,0.5982593424344664,0.04620920542550315,oversample,0.5869850210665162,,12.0,0.6768385437151241,,,,0.7428908707915427,0.049699777468701745,0.5567616463138851,0.5572139303482587,0.715281812899477,0.7156549520766773,0.8642283633568819,0.5982593424344664,0.05,0.5366478229672152,0.5229767886573191,0.5567616463138851,0.5572139303482587,1.0,1.0,oversample,0.4988200235415043,0.4756257213164772,0.5869850210665162,0.049699777468701745,COMPLETE
847,0.7168922895821072,2025-11-26 22:00:35.595806,2025-11-26 22:00:38.053693,0 days 00:00:02.457887,0.13788630157410148,gbtree,0.48466116882124005,2.8212168093422494,depthwise,0.0002005187185573348,0.028858147585709232,7,8,0.5751964955227693,900,,0.7268907427268104,0.629949448864533,0.0007933558819737761,oversample,0.8633913137974385,,5.0,0.675528264653564,,,,0.6358975901520242,0.4496080446467998,0.5662596110357304,0.5649027589326097,0.7176920812481602,0.7168922895821072,0.7268907427268104,0.629949448864533,0.0,0.5284726753254858,0.5171946070081832,0.5627885503231763,0.5623268698060941,0.9902518277822908,0.9886363636363636,oversample,0.5048749150350637,0.4933647175092527,0.8633913137974385,0.4496080446467998,COMPLETE
848,0.7169921305741767,2025-11-26 22:00:38.224232,2025-11-26 22:00:39.265073,0 days 00:00:01.040841,1.6766054570786046,gbtree,0.4316419521028553,2.9781224025933706,depthwise,0.00041972321868367235,0.022647378481244415,9,11,0.5458803791577438,900,,0.7150333733013369,0.7809627415087634,0.026712671910078346,oversample,0.9189622758078528,,6.0,0.6450692767035078,,,,0.6452289248429904,0.4774769478863587,0.5594753505201266,0.5608322026232474,0.716365754222481,0.7169921305741767,0.7150333733013369,0.7809627415087634,0.02,0.5376210357569497,0.5341934799799076,0.5583295506128008,0.5593451568894953,0.9991876523151909,0.9983766233766234,oversample,0.5181327608216316,0.5046471021317804,0.9189622758078528,0.4774769478863587,COMPLETE
849,0.7156549520766773,2025-11-26 22:00:39.432052,2025-11-26 22:00:40.320662,0 days 00:00:00.888610,8.104318850210213,gbtree,0.4597834155276654,4.524269076038424,lossguide,0.007365293845353056,0.015136500046255894,10,11,1.0052798717110414,800,,0.7553054249396651,0.9276397339887646,0.0045051269908807055,oversample,0.967748790714037,,7.0,0.6130036688975296,,,,0.642885421529443,0.521315625505213,0.5567616463138851,0.5572139303482587,0.715281812899477,0.7156549520766773,0.7553054249396651,0.9276397339887646,0.0,0.48862717920217374,0.4813367181047358,0.5567616463138851,0.5572139303482587,1.0,1.0,oversample,0.4247177506258393,0.4160511985460913,0.967748790714037,0.521315625505213,COMPLETE
850,0.6912302070645554,2025-11-26 22:00:40.486601,2025-11-26 22:00:43.451332,0 days 00:00:02.964731,0.013258563293449644,gbtree,0.6593763677300087,2.232016725905831,depthwise,0.0009852433126533403,0.2050318448602574,8,12,1.0326357000399298,1000,,0.6482785996577767,0.8502263043188409,0.004281589795796991,oversample,0.9928026078718402,,6.0,0.725578785536245,,,,0.6593272460180012,0.3738073443059116,0.5413839891451832,0.5413839891451832,0.6902871105681124,0.6912302070645554,0.6482785996577767,0.8502263043188409,0.0,0.5219154938547019,0.496806217200167,0.5531081742535487,0.5531189083820662,0.9179528838342811,0.9212662337662337,oversample,0.46526011704438075,0.4360424432564371,0.9928026078718402,0.3738073443059116,COMPLETE
851,0.7160782025094835,2025-11-26 22:00:43.628404,2025-11-26 22:00:54.715607,0 days 00:00:11.087203,4.785003272555462,gbtree,0.5713245335262088,0.012854883608719447,depthwise,0.00014877073882243596,0.005670338546587578,9,8,0.4768678000352929,1000,,0.7199267762280402,0.8041728822818767,0.05503212081171212,oversample,0.9720072193505253,,7.0,0.656108434290006,,,,0.485901872961695,0.42393169228736904,0.5585707824513795,0.5599276345545002,0.7151196730881495,0.7160782025094835,0.7199267762280402,0.8041728822818767,0.05,0.510924211602089,0.5056335878586313,0.5580865603644647,0.558997722095672,0.9951259138911455,0.9959415584415584,oversample,0.46530943815381554,0.46394412533329793,0.9720072193505253,0.42393169228736904,COMPLETE
852,0.7002949852507374,2025-11-26 22:00:54.896732,2025-11-26 22:00:57.838069,0 days 00:00:02.941337,3.7125151879329454,gbtree,0.36979787728649083,1.2026864814246707,depthwise,0.0049884977448194125,0.03145722901497663,5,11,0.41935416501499634,700,,0.7042089501013489,0.6353540109037868,0.020177197357088165,oversample,0.8557921979594004,,5.0,0.640082497235097,,,,0.6304032029665069,0.4160400699518473,0.5418362731795567,0.540479421076436,0.7014441497200118,0.7002949852507374,0.7042089501013489,0.6353540109037868,0.02,0.49148121007643075,0.4972538837853201,0.5504162812210915,0.5500463392029658,0.966693744922827,0.963474025974026,oversample,0.40818191614582466,0.4169644515341655,0.8557921979594004,0.4160400699518473,COMPLETE
853,0.0,2025-11-26 22:00:58.015345,2025-11-26 22:00:59.371119,0 days 00:00:01.355774,3.4192664542865714,gbtree,0.42329965008481757,2.057325558138921,depthwise,0.00010413894075784657,0.01594800977754809,9,7,4.4343839354988495,1000,,0.800846280933151,0.8310350156199271,0.06201737556053758,oversample,0.897162642694588,,8.0,0.7640858485778675,,,,0.49607976286913946,0.6960076910105256,0.4427860696517413,0.44097693351424694,0.0,0.0,0.800846280933151,0.8310350156199271,0.05,0.49920630014246975,0.5059434611325238,0.0,0.0,0.0,0.0,oversample,0.4498934829821449,0.46562180796731356,0.897162642694588,0.6960076910105256,COMPLETE
854,0.7156549520766773,2025-11-26 22:00:59.548124,2025-11-26 22:01:00.564779,0 days 00:00:01.016655,12.78955175413587,gbtree,0.6100400135894056,1.953129837976156,depthwise,0.00012426509347996574,0.022791000221824474,10,11,0.22248740651612464,800,,0.6806750083146615,0.9233291737476106,0.0736241769799748,undersample,0.8740387342784905,,7.0,0.638565919035334,,,,0.4246548027025351,0.42282586656545784,0.5567616463138851,0.5572139303482587,0.715281812899477,0.7156549520766773,0.6806750083146615,0.9233291737476106,0.08,0.510726102279662,0.5041372898629868,0.5567616463138851,0.5572139303482587,1.0,1.0,undersample,0.4869862729819791,0.4775629120624013,0.8740387342784905,0.42282586656545784,COMPLETE
855,0.7104495037945125,2025-11-26 22:01:00.740358,2025-11-26 22:08:08.176840,0 days 00:07:07.436482,0.2525678320831689,dart,0.7635709261824348,1.5850669376029183,depthwise,0.0005984051233289553,0.0038844150213348527,10,10,0.22607153486083528,800,tree,0.7447035173679072,0.6951785133425283,0.028392608542327613,oversample,0.995242820539379,,8.0,0.6025772011510718,0.01614995022122806,uniform,0.8531781073902474,0.5082932122177716,0.30480112163938733,0.5526910900045229,0.5513342379014021,0.7115777194517352,0.7104495037945125,0.7447035173679072,0.6951785133425283,0.02,0.4960589706213847,0.4974754053758676,0.5550500454959054,0.5546946216955333,0.9910641754670999,0.9878246753246753,oversample,0.4161926590294932,0.40563729554408817,0.995242820539379,0.30480112163938733,COMPLETE
856,0.7156549520766773,2025-11-26 22:08:08.350219,2025-11-26 22:09:14.014333,0 days 00:01:05.664114,0.0008173460750243079,dart,0.8103421309404382,1.7291082515769165,depthwise,0.041083520103815344,0.00028133704441909795,2,12,24.60758369711565,700,tree,0.5415140071329686,0.0649424492213015,0.022985702601745112,none,0.5272221207148698,4.677523624100597,7.0,0.9352088801229032,0.12269925845136284,weighted,0.814694473319366,0.9807381900116909,0.1500660952882104,0.5567616463138851,0.5572139303482587,0.715281812899477,0.7156549520766773,0.5415140071329686,0.0649424492213015,0.02,0.44529314761921174,0.456685060429322,0.5567616463138851,0.5572139303482587,1.0,1.0,none,0.2652480976143504,0.28209941233434593,0.5272221207148698,0.1500660952882104,COMPLETE
857,0.7156549520766773,2025-11-26 22:09:14.200611,2025-11-26 22:09:16.184009,0 days 00:00:01.983398,0.14338666778300285,gbtree,0.4451328317000537,3.1165750718222323,depthwise,0.00016448183975023716,0.07796629054146208,9,5,0.25496459371857577,800,,0.6555139824596291,0.38065214306001605,0.035187727874445525,oversample,0.9081226606603771,,5.0,0.6860204769717052,,,,0.7430751053784861,0.2788010894868411,0.5567616463138851,0.5572139303482587,0.715281812899477,0.7156549520766773,0.6555139824596291,0.38065214306001605,0.05,0.5155222809265148,0.5049415282602102,0.5567616463138851,0.5572139303482587,1.0,1.0,oversample,0.4601676088794575,0.4462018127429261,0.9081226606603771,0.2788010894868411,COMPLETE
858,0.7156549520766773,2025-11-26 22:09:16.361513,2025-11-26 22:09:17.417330,0 days 00:00:01.055817,40.65833176959763,gbtree,0.5671106791822637,0.7599227370352448,depthwise,0.0005497159595310808,0.0017529000018531586,6,9,1.1590973501412059,1000,,0.6342650188151727,0.7409883143956597,0.07317986091344403,oversample,0.8573470708808467,,6.0,0.649786143152984,,,,0.6322131010100962,0.4564555549029351,0.5567616463138851,0.5572139303482587,0.715281812899477,0.7156549520766773,0.6342650188151727,0.7409883143956597,0.08,0.4994059178456116,0.5097754560954072,0.5567616463138851,0.5572139303482587,1.0,1.0,oversample,0.42265123758683004,0.42182670496000424,0.8573470708808467,0.4564555549029351,COMPLETE
859,0.7156549520766773,2025-11-26 22:09:17.594821,2025-11-26 22:09:20.997939,0 days 00:00:03.403118,0.3739084645357758,gbtree,0.5346119747920521,0.9795767118147546,depthwise,0.04689341480808841,0.001048875775477615,10,9,2.330808546517228,900,,0.7503701715816461,0.9004352797408931,0.038589228160032456,oversample,0.9113282019402661,,6.0,0.7348398024738237,,,,0.5703830489455601,0.2413634744679898,0.5567616463138851,0.5572139303482587,0.715281812899477,0.7156549520766773,0.7503701715816461,0.9004352797408931,0.05,0.4996357823026232,0.4819648857582543,0.5567616463138851,0.5572139303482587,1.0,1.0,oversample,0.4564701835242627,0.4280030809333669,0.9113282019402661,0.2413634744679898,COMPLETE
860,0.7156549520766773,2025-11-26 22:09:21.177352,2025-11-26 22:09:22.155937,0 days 00:00:00.978585,0.19462488877798248,gbtree,0.42348841428359946,5.726006807355132,depthwise,0.0008130874251432812,0.03564353108384648,9,9,1.8046664934945256,900,,0.6823924854547024,0.5498877617255067,0.03147068941006513,oversample,0.8438013263464544,,7.0,0.6532558180893637,,,,0.4510928978535135,0.34373015347360436,0.5567616463138851,0.5572139303482587,0.715281812899477,0.7156549520766773,0.6823924854547024,0.5498877617255067,0.02,0.42586853904168087,0.4172182066258242,0.5567616463138851,0.5572139303482587,1.0,1.0,oversample,0.27180863409539285,0.26050220208800395,0.8438013263464544,0.34373015347360436,COMPLETE
861,0.7156549520766773,2025-11-26 22:09:22.333463,2025-11-26 22:09:26.991852,0 days 00:00:04.658389,8.060444352078363,gbtree,0.4690111085064053,1.0710338592362656,depthwise,0.0002753327200115978,0.04313688861468983,10,10,0.13609378175086725,1000,,0.8499632782259783,0.7739547298570435,0.044432901623008225,oversample,0.8915806240961274,,8.0,0.6740482460469706,,,,0.6436037599617961,0.3354022886698454,0.5567616463138851,0.5572139303482587,0.715281812899477,0.7156549520766773,0.8499632782259783,0.7739547298570435,0.05,0.48851046055699077,0.481740263278646,0.5567616463138851,0.5572139303482587,1.0,1.0,oversample,0.42418640892587745,0.41948076821033925,0.8915806240961274,0.3354022886698454,COMPLETE
862,0.7156549520766773,2025-11-26 22:09:27.172259,2025-11-26 22:09:29.737612,0 days 00:00:02.565353,0.6023369559155769,gbtree,0.32202305089981315,2.9739011575498755,depthwise,0.0004224453966196175,0.01978147117041257,9,8,1.2403420493556727,1000,,0.6125191101120301,0.7948457737406327,0.008720878613235696,oversample,0.9687860006096379,,5.0,0.6394565412122142,,,,0.6211207456138531,0.3791727317629094,0.5567616463138851,0.5572139303482587,0.715281812899477,0.7156549520766773,0.6125191101120301,0.7948457737406327,0.0,0.5388632274916213,0.5285204210154699,0.5567616463138851,0.5572139303482587,1.0,1.0,oversample,0.4950504816061274,0.4806521364233315,0.9687860006096379,0.3791727317629094,COMPLETE
863,0.7156549520766773,2025-11-26 22:09:29.921556,2025-11-26 22:10:55.301734,0 days 00:01:25.380178,0.0001208517780407804,dart,0.9393683377354507,2.7608410722476147,lossguide,0.011415576491963206,0.00022555378445019157,0,12,37.93592832609108,900,tree,0.6086377101833659,0.22920398625554947,0.014619267163678215,none,0.5716313260490599,0.6969601965815779,5.0,0.8266700289920031,0.31153302794516696,weighted,0.004163796556314159,0.8128460453599093,0.29012337132847094,0.5567616463138851,0.5572139303482587,0.715281812899477,0.7156549520766773,0.6086377101833659,0.22920398625554947,0.02,0.7431224751975016,0.7009307892884574,0.5567616463138851,0.5572139303482587,1.0,1.0,none,0.7542880352790994,0.7094744504729183,0.5716313260490599,0.29012337132847094,COMPLETE
864,0.07358351729212656,2025-11-26 22:10:55.476058,2025-11-26 22:10:59.078133,0 days 00:00:03.602075,0.046348162999627546,gbtree,0.5436846683019677,2.218273583832548,depthwise,0.0015824863415729484,0.016998015829283255,7,11,0.4543707304845949,900,,0.7022575659922983,0.6985968075030027,0.032976181302012166,none,0.9289296566032118,0.8049128529219014,6.0,0.6345319703591022,,,,0.5407401862502937,0.6676904049862621,0.44052464947987335,0.43057440072365444,0.08977189109639441,0.07358351729212656,0.7022575659922983,0.6985968075030027,0.02,0.5010446558083088,0.4901075145481931,0.4765625,0.3937007874015748,0.04955320877335499,0.040584415584415584,none,0.42681451947147664,0.42065477295942055,0.9289296566032118,0.6676904049862621,COMPLETE
865,0.0,2025-11-26 22:10:59.251785,2025-11-26 22:11:00.272774,0 days 00:00:01.020989,1.23507936256953,gbtree,0.8190112348614906,5.853264038241164,depthwise,0.00045011489014228485,0.014653210846563784,6,6,0.48817800437943615,1000,,0.6166515314044156,0.7230585179024627,0.007156882559092969,oversample,0.8482812793612609,,6.0,0.7583584322556144,,,,0.8806643960921077,0.7361348967667647,0.44323835368611486,0.4427860696517413,0.0,0.0,0.6166515314044156,0.7230585179024627,0.0,0.5964194110427838,0.6064289518898918,0.0,0.0,0.0,0.0,oversample,0.549738473781064,0.5571792546064763,0.8482812793612609,0.7361348967667647,COMPLETE
866,0.039304610733182165,2025-11-26 22:11:00.448821,2025-11-26 22:11:01.349498,0 days 00:00:00.900677,0.006919947748424053,gbtree,0.46596692021019254,5.00434703507746,depthwise,0.0011299078655643653,0.008050943475724872,10,9,1.1271788207296176,700,,0.9551812731692189,0.7351120303285755,0.015006355061231732,oversample,0.9350716299137708,,5.0,0.6156951477438474,,,,0.8365267942250233,0.5807407939446007,0.433288104929896,0.4251469923111714,0.03541185527328714,0.039304610733182165,0.9551812731692189,0.7351120303285755,0.02,0.4536942412995355,0.4490412367906873,0.3382352941176471,0.2857142857142857,0.01868399675060926,0.021103896103896104,oversample,0.33305136026790894,0.33421701510950746,0.9350716299137708,0.5807407939446007,COMPLETE
867,0.7156549520766773,2025-11-26 22:11:01.525166,2025-11-26 22:11:02.571861,0 days 00:00:01.046695,56.478558937557615,gbtree,0.3485170177887146,0.22935710920782615,depthwise,0.0006396404370547992,0.0023784333621896516,9,6,0.19397639317551216,1000,,0.6950692588801637,0.7011870264565534,0.05415079692436716,oversample,0.9383267702164579,,8.0,0.646340110322469,,,,0.7451358216283588,0.33192734920054084,0.5567616463138851,0.5572139303482587,0.715281812899477,0.7156549520766773,0.6950692588801637,0.7011870264565534,0.05,0.4439359431335098,0.43877926549048923,0.5567616463138851,0.5572139303482587,1.0,1.0,oversample,0.266622457268854,0.25362938261942347,0.9383267702164579,0.33192734920054084,COMPLETE
