number,value,datetime_start,datetime_complete,duration,params_alpha,params_booster,params_colsample_bytree,params_gamma,params_grow_policy,params_lambda,params_learning_rate,params_max_delta_step,params_max_depth,params_min_child_weight,params_n_estimators,params_normalize_type,params_params_feature_fraction,params_params_labeled_ratio,params_params_missing_rate,params_params_resampling,params_params_sample_rows,params_params_scale_pos_weight,params_params_selftrain_max_iter,params_params_selftrain_threshold,params_rate_drop,params_sample_type,params_skip_drop,params_subsample,params_user_attrs_decision_threshold,user_attrs_acc_test,user_attrs_acc_val,user_attrs_f1_test,user_attrs_f1_val,user_attrs_feature_fraction,user_attrs_labeled_ratio,user_attrs_missing_rate,user_attrs_pr_auc_test,user_attrs_pr_auc_val,user_attrs_prec_test,user_attrs_prec_val,user_attrs_rec_test,user_attrs_rec_val,user_attrs_resampling_strategy,user_attrs_roc_auc_test,user_attrs_roc_auc_val,user_attrs_sample_rows,user_attrs_user_attrs_decision_threshold,state
2092,0.7156549520766773,2025-11-30 11:53:25.099754,2025-11-30 11:53:37.318963,0 days 00:00:12.219209,30.179083405396703,dart,0.4833798574618102,0.42906190402558164,lossguide,1.603739761099678,0.15320332002846337,9,12,7.128053451506492,300,tree,0.8916983227574029,0.5632929442705022,0.09292916715697835,oversample,0.647974916794464,,8.0,0.6231259923480852,0.05012587203792429,weighted,0.6830860992771077,0.6196616539829007,,0.5567616463138851,0.5572139303482587,0.715281812899477,0.7156549520766773,0.8916983227574029,0.5632929442705022,0.1,0.525464229800636,0.522910455019989,0.5567616463138851,0.5572139303482587,1.0,1.0,oversample,0.4771672275734015,0.47078378082591565,0.647974916794464,0.5,COMPLETE
2093,0.0,2025-11-30 11:53:38.093099,2025-11-30 11:53:38.954271,0 days 00:00:00.861172,0.00016254003850423002,gbtree,0.8530914444158848,2.6279995632448907,lossguide,0.13563585959803665,0.0004031467584773451,10,6,2.1092226675739285,500,,0.7915964154952642,0.2014452449020952,0.06308318084098039,none,0.5552611470263302,0.6714147452932394,12.0,0.6696189671334009,,,,0.9249851358298273,,0.44323835368611486,0.4427860696517413,0.0,0.0,0.7915964154952642,0.2014452449020952,0.08,0.7512336330145911,0.7360608723760669,0.0,0.0,0.0,0.0,none,0.6695663887000779,0.6578974205059496,0.5552611470263302,0.5,COMPLETE
2094,0.0,2025-11-30 11:53:39.718951,2025-11-30 11:53:57.612828,0 days 00:00:17.893877,0.022589865253079346,dart,0.746981157820837,7.917614211803708,lossguide,0.0004456492160229924,0.049535538490659566,3,12,0.9748851897811399,400,tree,0.8169908265036916,0.7257226096744431,0.08002556035835236,none,0.6343545143784246,0.6352736505070803,8.0,0.6545922748120597,0.2531714596619021,uniform,0.31490791245349103,0.3769745021852739,,0.44323835368611486,0.4427860696517413,0.0,0.0,0.8169908265036916,0.7257226096744431,0.08,0.5324959077159156,0.5270307594445289,0.0,0.0,0.0,0.0,none,0.432823405560437,0.4134432663863205,0.6343545143784246,0.5,COMPLETE
2095,0.7156549520766773,2025-11-30 11:53:58.402790,2025-11-30 11:53:58.779487,0 days 00:00:00.376697,0.021400538569549852,gbtree,0.6705211683482395,9.234555382041066,depthwise,0.006236226311408818,0.004083364082339155,4,8,24.892455914672496,200,,0.8323327932672193,0.4961381081162848,0.0944625718422124,oversample,0.6318838432252311,,7.0,0.6696468289739194,,,,0.5890176690634519,,0.5567616463138851,0.5572139303482587,0.715281812899477,0.7156549520766773,0.8323327932672193,0.4961381081162848,0.1,0.4987168407681256,0.4995381300440668,0.5567616463138851,0.5572139303482587,1.0,1.0,oversample,0.3666585155589449,0.3589187880556624,0.6318838432252311,0.5,COMPLETE
2096,0.6855403348554033,2025-11-30 11:53:59.576043,2025-11-30 11:54:03.973507,0 days 00:00:04.397464,0.019026697903292627,gbtree,0.7345745836342168,2.763371527370494,depthwise,0.016486984924996048,0.10445209417828871,4,11,54.24411475424581,1000,,0.7744246336996523,0.770657528501461,0.0942184719018048,none,0.6542639797772003,1.1047376851182296,11.0,0.6345136290529838,,,,0.6483604709678242,,0.5300768882858435,0.532790592492085,0.6825542315918118,0.6855403348554033,0.7744246336996523,0.770657528501461,0.1,0.5109543642120558,0.524548841987496,0.5470127326150832,0.5484656600097418,0.9073923639317628,0.913961038961039,none,0.4148340489729604,0.43750829099399074,0.6542639797772003,0.5,COMPLETE
2097,0.568944099378882,2025-11-30 11:54:04.740566,2025-11-30 11:55:24.206092,0 days 00:01:19.465526,4.360685406122895,dart,0.986399307933226,1.6981950317171468,lossguide,0.000776736343127755,0.020885681919822388,1,3,3.2163197899017386,900,forest,0.7124269606008448,0.6649379735568043,0.010473610668129331,undersample,0.5929083741129979,,5.0,0.740590864751396,0.46912806848198113,weighted,0.22011264811850653,0.6541541990694753,,0.5110809588421529,0.5291723202170964,0.5549608892548373,0.568944099378882,0.7124269606008448,0.6649379735568043,0.08,0.5150750662219191,0.5225987428978375,0.5626043405676127,0.5807269653423499,0.5475223395613322,0.5576298701298701,undersample,0.5003726023309405,0.5140341655280368,0.5929083741129979,0.5,COMPLETE
2098,0.7156549520766773,2025-11-30 11:55:24.972734,2025-11-30 11:55:35.220261,0 days 00:00:10.247527,0.1181637582753712,dart,0.4910758200733103,5.861079417411448,depthwise,0.26044829571681344,0.0003625735058414386,4,12,26.084788048179167,300,tree,0.9896431599945887,0.8031136747478944,0.025937738414152024,none,0.9581701649182871,4.508340249906989,12.0,0.7256839807056037,0.47773296665289045,weighted,0.5384843724282184,0.9774104608911609,,0.5567616463138851,0.5572139303482587,0.715281812899477,0.7156549520766773,0.9896431599945887,0.8031136747478944,0.08,0.5917580172915486,0.585267357262358,0.5567616463138851,0.5572139303482587,1.0,1.0,none,0.5655610172582437,0.553256785349482,0.9581701649182871,0.5,COMPLETE
2099,0.0,2025-11-30 11:55:35.995641,2025-11-30 11:55:36.377111,0 days 00:00:00.381470,0.006366591017496882,gbtree,0.6390770627729339,7.480227993432699,lossguide,5.773035236611467,0.007199021690866607,0,10,22.83313258036857,200,,0.6656344401463632,0.42422840055758215,0.029217736516752205,none,0.5511584079437971,0.562371196655068,11.0,0.9313825098305828,,,,0.8406388792541049,,0.44323835368611486,0.4427860696517413,0.0,0.0,0.6656344401463632,0.42422840055758215,0.08,0.49537019198246296,0.49523036347176685,0.0,0.0,0.0,0.0,none,0.19746597257912102,0.20453674900176436,0.5511584079437971,0.5,COMPLETE
2100,0.7156549520766773,2025-11-30 11:55:37.167245,2025-11-30 11:55:38.209822,0 days 00:00:01.042577,0.0058290393186489885,gbtree,0.8363652214210517,1.0023343742412305,lossguide,15.947303133178103,0.0003660931937628903,6,9,97.32262472209193,900,,0.5837179097297696,0.7753327358855082,0.08843603632419504,none,0.5489050807395264,1.2450670760407843,12.0,0.8451850179862519,,,,0.5482827730601256,,0.5567616463138851,0.5572139303482587,0.715281812899477,0.7156549520766773,0.5837179097297696,0.7753327358855082,0.08,0.5142673096506059,0.5085173201281347,0.5567616463138851,0.5572139303482587,1.0,1.0,none,0.398542333261493,0.38358864067495324,0.5489050807395264,0.5,COMPLETE
2101,0.34460887949260044,2025-11-30 11:55:38.991982,2025-11-30 11:55:39.903158,0 days 00:00:00.911176,15.732880281987725,gbtree,0.25209717483905475,3.4210387520378873,lossguide,8.72630351549692,0.00013719594993780352,3,9,0.11034547930671884,1000,,0.8840973322313899,0.569400307901006,0.09824448830007099,undersample,0.7789937003048164,,7.0,0.6831330982952224,,,,0.9686500230581423,,0.45409317051108095,0.4391677973767526,0.36640419947506564,0.34460887949260044,0.8840973322313899,0.569400307901006,0.1,0.5060750498333159,0.4971193980655585,0.5178041543026706,0.49393939393939396,0.2835093419983753,0.26461038961038963,undersample,0.3811232779058008,0.3639729779923855,0.7789937003048164,0.5,COMPLETE
2102,0.5188101487314086,2025-11-30 11:55:40.688723,2025-11-30 11:56:58.265168,0 days 00:01:17.576445,0.030386544738139426,dart,0.4367135811014989,1.6892611586456563,lossguide,0.017553986096615532,0.036932472304219796,8,12,22.05862978488097,800,tree,0.8698162505899747,0.8698093983739525,0.0767210066054097,undersample,0.8539911773255933,,11.0,0.697296480678413,0.28879504502167436,weighted,0.06774955184946102,0.7491041840003785,,0.5047489823609227,0.5024875621890548,0.5261791432280398,0.5188101487314086,0.8698162505899747,0.8698093983739525,0.08,0.5435011725173118,0.5372247710211429,0.562962962962963,0.562618595825427,0.4939073923639318,0.48133116883116883,undersample,0.5299250650707075,0.5292522849979439,0.8539911773255933,0.5,COMPLETE
2103,0.6454605699138503,2025-11-30 11:56:59.044152,2025-11-30 11:56:59.789633,0 days 00:00:00.745481,0.1249517101435212,gbtree,0.4194365630742012,7.562872315011157,depthwise,0.00031823512831683594,0.00013668487316648986,9,12,0.2768218122849474,800,,0.5505537452817457,0.4228652556663236,0.05023932939071011,undersample,0.7222394776761349,,9.0,0.6588497413079871,,,,0.3758886213132856,,0.5074626865671642,0.5160560832202623,0.6409495548961425,0.6454605699138503,0.5505537452817457,0.4228652556663236,0.08,0.446612895061452,0.46340093936397553,0.5394006659267481,0.5453527435610303,0.7896019496344435,0.7905844155844156,undersample,0.31038976110346655,0.33851299364578225,0.7222394776761349,0.5,COMPLETE
2104,0.0,2025-11-30 11:57:00.566801,2025-11-30 11:59:03.364957,0 days 00:02:02.798156,0.007612786854907503,dart,0.36101341260869235,8.87283151235186,lossguide,3.894212934606418,0.01923551732642716,10,9,90.3931859764261,1000,forest,0.596618146237278,0.6798270021391819,0.01220856068364672,none,0.82211158896491,0.6780717939101959,5.0,0.6173249104913737,0.059174717009734534,uniform,0.022671260361455538,0.49243122249446114,,0.44323835368611486,0.4427860696517413,0.0,0.0,0.596618146237278,0.6798270021391819,0.08,0.5748068423293515,0.5720118421668701,0.0,0.0,0.0,0.0,none,0.534238382599181,0.5283133299284984,0.82211158896491,0.5,COMPLETE
2105,0.7156549520766773,2025-11-30 11:59:04.140927,2025-11-30 11:59:24.941002,0 days 00:00:20.800075,0.023969593712727173,dart,0.5270190635758698,5.339779236287958,lossguide,46.261137520515526,0.05973275808356322,7,5,98.64347503303642,400,tree,0.8545254049077723,0.630693498644568,0.07044015394011736,oversample,0.6985068333888167,,11.0,0.8773746169631207,0.2305251095762041,uniform,0.8416444608700431,0.2853459574421708,,0.5567616463138851,0.5572139303482587,0.715281812899477,0.7156549520766773,0.8545254049077723,0.630693498644568,0.08,0.5832110286838654,0.5723869064195272,0.5567616463138851,0.5572139303482587,1.0,1.0,oversample,0.5481531524063727,0.5289562965124763,0.6985068333888167,0.5,COMPLETE
2106,0.7156549520766773,2025-11-30 11:59:25.716468,2025-11-30 12:01:08.784308,0 days 00:01:43.067840,0.006778478394891626,dart,0.9217049718433856,5.379457791519025,lossguide,42.264775240559246,0.017672258769011157,8,5,3.799724301708131,1000,tree,0.5702197606855265,0.6990246118892345,0.04428730246222125,none,0.821401687654256,1.6358260065419186,5.0,0.8906667207923358,0.3389474848092606,weighted,0.28785050044483884,0.986747182587661,,0.5567616463138851,0.5572139303482587,0.715281812899477,0.7156549520766773,0.5702197606855265,0.6990246118892345,0.08,0.5166752985064772,0.5229528001368527,0.5567616463138851,0.5572139303482587,1.0,1.0,none,0.41469023027570084,0.43339678707400875,0.821401687654256,0.5,COMPLETE
2107,0.5776045357902198,2025-11-30 12:01:09.556682,2025-11-30 12:01:12.537039,0 days 00:00:02.980357,0.013271322272455983,gbtree,0.7262897069811427,8.020685238956139,lossguide,0.01763940384452955,0.36859414281235686,10,9,3.930817084833671,1000,,0.7233966601845405,0.7858932557020786,0.01936232904024965,oversample,0.5152132576685029,,8.0,0.6776384106784986,,,,0.5026142536841062,,0.4635911352329263,0.46087743102668477,0.5815102328863797,0.5776045357902198,0.7233966601845405,0.7858932557020786,0.08,0.4743447088426615,0.4913678815784177,0.5140361821584529,0.5125786163522013,0.669374492282697,0.661525974025974,oversample,0.385092591057544,0.39983567249910457,0.5152132576685029,0.5,COMPLETE
2108,0.5127768313458262,2025-11-30 12:01:13.319198,2025-11-30 12:01:24.008678,0 days 00:00:10.689480,0.026831303621185503,gbtree,0.817544693927168,0.4551071396259154,lossguide,0.001541334145874469,0.42336604296893837,8,8,5.8342691992125975,900,,0.8708015535761618,0.7393808431314557,0.09792702400358186,undersample,0.6586300986249913,,6.0,0.9178869327321026,,,,0.6810217380590211,,0.4531886024423338,0.48258706467661694,0.48,0.5127768313458262,0.8708015535761618,0.7393808431314557,0.1,0.4946629069208022,0.5110951311629223,0.5100548446069469,0.5394265232974911,0.45329000812347686,0.48863636363636365,undersample,0.42674198842819017,0.46078111112585074,0.6586300986249913,0.5,COMPLETE
2109,0.4714160070360598,2025-11-30 12:01:24.766421,2025-11-30 12:01:31.462942,0 days 00:00:06.696521,2.0200261950539815,gbtree,0.9251953001903368,0.7382628156424853,depthwise,0.08826698925113494,0.4310338139826232,5,4,42.30132512963687,1000,,0.9312796248920474,0.6103941250644326,0.013843684136435143,undersample,0.8508928814679271,,11.0,0.7220328192014287,,,,0.7905212365528451,,0.4577114427860697,0.45635459068294887,0.46015308419630796,0.4714160070360598,0.9312796248920474,0.6103941250644326,0.08,0.5168585298202893,0.5153463977039258,0.5161616161616162,0.5143953934740882,0.4151096669374492,0.43506493506493504,undersample,0.4433760506639699,0.44946473342796117,0.8508928814679271,0.5,COMPLETE
2110,0.7156549520766773,2025-11-30 12:01:32.234700,2025-11-30 12:03:00.051914,0 days 00:01:27.817214,32.9934617130999,dart,0.7124516748169747,0.5975791796039398,depthwise,0.012636512871402413,0.00029622011025719105,5,7,33.260036738728985,900,forest,0.5204374300470092,0.3804751860159755,0.07223915186982365,undersample,0.7954633627667846,,10.0,0.8590857491862348,0.2734340894031706,weighted,0.3060906715117,0.9686131787560806,,0.5567616463138851,0.5572139303482587,0.715281812899477,0.7156549520766773,0.5204374300470092,0.3804751860159755,0.08,0.5567616463138851,0.5572139303482587,0.5567616463138851,0.5572139303482587,1.0,1.0,undersample,0.5,0.5,0.7954633627667846,0.5,COMPLETE
2111,0.7156549520766773,2025-11-30 12:03:00.820894,2025-11-30 12:03:01.653441,0 days 00:00:00.832547,0.00016054701752711586,gbtree,0.30526079789291344,5.867171662232343,lossguide,0.33802282183462345,0.41814992507353993,4,10,49.713650857027524,900,,0.5732918680755283,0.8434197005066597,0.009875988679055503,none,0.5984260273326569,4.11507403597617,7.0,0.7440692608279528,,,,0.9988212621666834,,0.5567616463138851,0.5572139303482587,0.715281812899477,0.7156549520766773,0.5732918680755283,0.8434197005066597,0.08,0.5442959158755893,0.546748840319109,0.5567616463138851,0.5572139303482587,1.0,1.0,none,0.4621657355062252,0.47570821670668456,0.5984260273326569,0.5,COMPLETE
2112,0.20136518771331058,2025-11-30 12:03:02.433244,2025-11-30 12:03:14.583940,0 days 00:00:12.150696,0.03191529421463887,dart,0.5144979321787337,8.273132277758497,lossguide,1.2793556137837199,0.0002476982687964158,10,9,8.968958439366267,300,forest,0.9226822593338815,0.7446271928472892,0.07321422191397015,undersample,0.8147306135045761,,12.0,0.7076362137265492,0.026764810103659054,weighted,0.16346015518111948,0.5064530876510156,,0.373134328358209,0.3649932157394844,0.2133938706015891,0.20136518771331058,0.9226822593338815,0.7446271928472892,0.08,0.45796890685140723,0.4595195030577713,0.3540489642184557,0.3365019011406844,0.15272136474411047,0.14366883116883117,undersample,0.32496891526716287,0.32454432697027186,0.8147306135045761,0.5,COMPLETE
2113,0.0,2025-11-30 12:03:15.351220,2025-11-30 12:03:15.868818,0 days 00:00:00.517598,0.0012938308954772585,gbtree,0.6159879919626479,6.730101338348399,lossguide,6.4698647552347595,0.022976570204596536,10,7,0.2019811309611274,400,,0.5987595534230428,0.5698205889401454,0.0077992817875824575,none,0.89947658200409,0.7113230814337569,8.0,0.8350914501637987,,,,0.5321002038654351,,0.44323835368611486,0.4427860696517413,0.0,0.0,0.5987595534230428,0.5698205889401454,0.08,0.5668271103007086,0.5561094694515614,0.0,0.0,0.0,0.0,none,0.5063893632188863,0.4850442904898983,0.89947658200409,0.5,COMPLETE
2114,0.7140361094933023,2025-11-30 12:03:16.651930,2025-11-30 12:03:17.452171,0 days 00:00:00.800241,0.21436964756070284,gbtree,0.5203757682353072,5.961844467792437,depthwise,0.03739888211551971,0.011996807331155518,1,11,2.337047319504903,800,,0.9090386125869306,0.6300424099857416,0.07710773468151881,oversample,0.925599235857502,,5.0,0.6775215625810351,,,,0.5335471617030413,,0.5540479421076436,0.555857078245138,0.7128712871287128,0.7140361094933023,0.9090386125869306,0.6300424099857416,0.08,0.5183918656954594,0.5221531009808174,0.5556059918293237,0.5567665758401453,0.9943135662063363,0.9951298701298701,oversample,0.46869808849616207,0.4737179635992199,0.925599235857502,0.5,COMPLETE
2115,0.4577338129496403,2025-11-30 12:03:18.226889,2025-11-30 12:04:59.590029,0 days 00:01:41.363140,6.574341661977047,dart,0.6134664323047767,3.3909458847740304,depthwise,0.001356417129912784,0.00013220171093142403,9,11,0.5400961749046704,900,tree,0.6550977491221015,0.5608031606804327,0.09006752388088651,undersample,0.8642369827705074,,6.0,0.7455836601204228,0.05823162708095808,uniform,0.14686353496270863,0.8139726104679541,,0.43509724106739034,0.45454545454545453,0.4246890833717181,0.4577338129496403,0.6550977491221015,0.5608031606804327,0.1,0.5145589148421743,0.5270644160059266,0.49042553191489363,0.5131048387096774,0.3744922826969943,0.41314935064935066,undersample,0.47679089507452044,0.4916580163962697,0.8642369827705074,0.5,COMPLETE
2116,0.7156549520766773,2025-11-30 12:05:00.314367,2025-11-30 12:05:20.560290,0 days 00:00:20.245923,0.0034008470670645694,dart,0.3651611289970518,1.5484070340157663,lossguide,0.0016782847684591073,0.00010321013398066273,10,6,34.295163828741686,400,tree,0.5122740582619888,0.4718332165321168,0.048155335462820574,oversample,0.5863483430775247,,8.0,0.6329428526299309,0.05778065680015698,uniform,0.1955510751040482,0.9076976454758741,,0.5567616463138851,0.5572139303482587,0.715281812899477,0.7156549520766773,0.5122740582619888,0.4718332165321168,0.08,0.5944628635892713,0.6076079764431572,0.5567616463138851,0.5572139303482587,1.0,1.0,oversample,0.5055666539564648,0.5120493015666662,0.5863483430775247,0.5,COMPLETE
2117,0.7156549520766773,2025-11-30 12:05:21.287020,2025-11-30 12:05:21.668727,0 days 00:00:00.381707,6.866649954262973,gbtree,0.20724799961790794,7.619265114495991,lossguide,22.10986438196247,0.1222109142234538,6,9,0.5175086684864164,200,,0.9792661721225324,0.3452589138471579,0.07034070306614736,none,0.6921365876211591,3.830841916198736,7.0,0.8759639354585544,,,,0.2858408252124036,,0.5567616463138851,0.5572139303482587,0.715281812899477,0.7156549520766773,0.9792661721225324,0.3452589138471579,0.08,0.49259713088904594,0.5098640812420829,0.5567616463138851,0.5572139303482587,1.0,1.0,none,0.3687772509491205,0.388404464534444,0.6921365876211591,0.5,COMPLETE
2118,0.6525660964230171,2025-11-30 12:05:22.415359,2025-11-30 12:05:23.085554,0 days 00:00:00.670195,0.07257853263826115,gbtree,0.6229932093595585,8.418157394050853,lossguide,0.2511979183786717,0.40031530341061117,1,3,12.644452634526429,700,,0.8858014033471748,0.5807450498620893,0.04318426506497062,oversample,0.5855860240775792,,5.0,0.9427635880425291,,,,0.6975059131154921,,0.5015829941203076,0.4947987336047038,0.6588235294117647,0.6525660964230171,0.8858014033471748,0.5807450498620893,0.08,0.4166374525272416,0.4185609764284352,0.5322661330665333,0.5289964699949571,0.8643379366368806,0.851461038961039,oversample,0.2527926523980835,0.2545720686361646,0.5855860240775792,0.5,COMPLETE
2119,0.7156549520766773,2025-11-30 12:05:23.823199,2025-11-30 12:05:24.381760,0 days 00:00:00.558561,0.0002260161493835957,gbtree,0.7022045729303836,8.40016697735278,depthwise,0.9321072573320905,0.0829139285186256,6,5,0.270844677867281,500,,0.6130981504210031,0.21101676776932377,0.027805023830122212,oversample,0.9182735903095989,,9.0,0.7140491947013287,,,,0.8487853852801228,,0.5567616463138851,0.5572139303482587,0.715281812899477,0.7156549520766773,0.6130981504210031,0.21101676776932377,0.08,0.608983743157858,0.607021535708659,0.5567616463138851,0.5572139303482587,1.0,1.0,oversample,0.6019156484689734,0.5840093257100407,0.9182735903095989,0.5,COMPLETE
2120,0.7156549520766773,2025-11-30 12:05:25.115299,2025-11-30 12:06:56.742569,0 days 00:01:31.627270,0.4430483100282441,dart,0.21065289059717385,9.582793338421059,lossguide,8.822645274399271,0.020153066611002923,8,10,73.77092892282819,900,tree,0.6508507873198266,0.8032760943829169,0.010128424696474216,oversample,0.7778313126362038,,7.0,0.8955144548939877,0.17030232194217598,uniform,0.13684232253997983,0.5902116475981654,,0.5567616463138851,0.5572139303482587,0.715281812899477,0.7156549520766773,0.6508507873198266,0.8032760943829169,0.08,0.658137109877068,0.6412921106808083,0.5567616463138851,0.5572139303482587,1.0,1.0,oversample,0.6165014340423415,0.6003894279877426,0.7778313126362038,0.5,COMPLETE
2121,0.71375,2025-11-30 12:06:57.520362,2025-11-30 12:06:58.432549,0 days 00:00:00.912187,1.4532489974858396,gbtree,0.5924392438351462,1.7527551956309018,depthwise,0.0016285405265747516,0.03809574134435404,5,4,81.49406540406702,1000,,0.5906338310739212,0.48097177263730434,0.03214219252756647,oversample,0.5560359404374575,,12.0,0.8154590266883757,,,,0.8233231396199312,,0.6010854816824966,0.5857078245137947,0.724202626641651,0.71375,0.5906338310739212,0.48097177263730434,0.08,0.7420939782304843,0.7182315787272673,0.5887137773258769,0.5802845528455285,0.9406986190089358,0.926948051948052,oversample,0.7150661483114772,0.690236028016927,0.5560359404374575,0.5,COMPLETE
