number,value,datetime_start,datetime_complete,duration,params_alpha,params_booster,params_colsample_bytree,params_gamma,params_grow_policy,params_lambda,params_learning_rate,params_max_delta_step,params_max_depth,params_min_child_weight,params_n_estimators,params_normalize_type,params_params_feature_fraction,params_params_labeled_ratio,params_params_missing_rate,params_params_resampling,params_params_sample_rows,params_params_scale_pos_weight,params_params_selftrain_max_iter,params_params_selftrain_threshold,params_rate_drop,params_sample_type,params_skip_drop,params_subsample,params_user_attrs_decision_threshold,user_attrs_acc_test,user_attrs_acc_val,user_attrs_f1_test,user_attrs_f1_val,user_attrs_feature_fraction,user_attrs_labeled_ratio,user_attrs_missing_rate,user_attrs_pr_auc_test,user_attrs_pr_auc_val,user_attrs_prec_test,user_attrs_prec_val,user_attrs_rec_test,user_attrs_rec_val,user_attrs_resampling_strategy,user_attrs_roc_auc_test,user_attrs_roc_auc_val,user_attrs_sample_rows,user_attrs_user_attrs_decision_threshold,state
145,0.7156549520766773,2025-11-26 17:17:43.103168,2025-11-26 17:17:48.261128,0 days 00:00:05.157960,0.0013871279275570643,gbtree,0.5575503975627207,3.3259894302267616,lossguide,0.07769727378895928,0.015092911921666056,10,12,0.10161125331928107,500,,0.9533638234323069,0.6588766502239893,0.05008991823543785,none,0.5935270047678249,1.6819919257380571,12.0,0.6745008811704271,,,,0.48908943113703557,0.24860043887789718,0.5567616463138851,0.5572139303482587,0.715281812899477,0.7156549520766773,0.9533638234323069,0.6588766502239893,0.05,0.5615379610740329,0.563672086915448,0.5567616463138851,0.5572139303482587,1.0,1.0,none,0.5316653956464795,0.5383276070201504,0.5935270047678249,0.24860043887789718,COMPLETE
146,0.7156549520766773,2025-11-26 17:17:48.422782,2025-11-26 17:17:48.888469,0 days 00:00:00.465687,2.3217588071239548,gbtree,0.3826845670779912,8.934353819649491,lossguide,0.04151130344999586,0.00011819638824964218,3,3,0.15146417907312268,200,,0.500282057135589,0.5365993473387849,0.06900685068290285,none,0.5014682102168283,2.0912950237471835,12.0,0.7091059617905302,,,,0.6544292494992918,0.11339794463211288,0.5567616463138851,0.5572139303482587,0.715281812899477,0.7156549520766773,0.500282057135589,0.5365993473387849,0.08,0.5567616463138851,0.5572139303482587,0.5567616463138851,0.5572139303482587,1.0,1.0,none,0.5,0.5,0.5014682102168283,0.11339794463211288,COMPLETE
147,0.0,2025-11-26 17:17:49.067249,2025-11-26 17:17:54.205498,0 days 00:00:05.138249,0.42911890289851323,dart,0.5331223041485585,9.694334168848076,lossguide,23.072648788431486,0.0021611803475789686,4,3,28.87197170033033,200,forest,0.6464626184279263,0.39012181097909787,0.036432085210845164,undersample,0.6892962964761229,,12.0,0.8559148947366946,0.1902305429351503,uniform,0.4209135054858554,0.47871589838602735,0.5287315519117444,0.44323835368611486,0.4427860696517413,0.0,0.0,0.6464626184279263,0.39012181097909787,0.05,0.5211113019262068,0.5149107859852605,0.0,0.0,0.0,0.0,undersample,0.4035589946782938,0.36750784328031516,0.6892962964761229,0.5287315519117444,COMPLETE
148,0.7156549520766773,2025-11-26 17:17:54.364438,2025-11-26 17:18:05.508068,0 days 00:00:11.143630,0.05073514768635268,dart,0.7626055325392961,9.589165674104493,depthwise,1.8007511845948023,0.0002015202973144256,3,3,4.925554005432946,300,forest,0.8141692676065977,0.40959615523712933,0.02875364018861735,oversample,0.705809187089824,,12.0,0.8470695510414059,0.08300076323946065,weighted,0.19054035175302736,0.29504520083259844,0.1998069840706064,0.5567616463138851,0.5572139303482587,0.715281812899477,0.7156549520766773,0.8141692676065977,0.40959615523712933,0.02,0.5953097882658684,0.6025420648490905,0.5567616463138851,0.5572139303482587,1.0,1.0,oversample,0.5238117342794145,0.5121168731676904,0.705809187089824,0.1998069840706064,COMPLETE
149,0.7156549520766773,2025-11-26 17:18:05.663403,2025-11-26 17:19:41.432023,0 days 00:01:35.768620,0.034939354027690946,dart,0.7653034436391162,5.482681088376699,lossguide,0.001378179870766068,0.0003043481021167422,6,11,3.4539786072744314,900,forest,0.5833572839841181,0.1214092983927069,0.0981843762793563,undersample,0.9748773727953255,,5.0,0.7368027735374176,0.24792336676943116,weighted,0.5888374839195077,0.3622697325583782,0.2134223935103107,0.5567616463138851,0.5572139303482587,0.715281812899477,0.7156549520766773,0.5833572839841181,0.1214092983927069,0.1,0.48392293550769083,0.5059435240694548,0.5567616463138851,0.5572139303482587,1.0,1.0,undersample,0.4014427460667451,0.4340240007694043,0.9748773727953255,0.2134223935103107,COMPLETE
150,0.7156549520766773,2025-11-26 17:19:41.612181,2025-11-26 17:19:42.532097,0 days 00:00:00.919916,0.21065946949465245,gbtree,0.776439104695718,0.6290965731673042,lossguide,0.2675256393160783,0.002286784220915389,5,11,11.055211330250689,300,,0.6730137486698519,0.33286068577603795,0.08374821671610402,oversample,0.5065406550804907,,8.0,0.6757466160973705,,,,0.5778681151346513,0.08312936387298725,0.5567616463138851,0.5572139303482587,0.715281812899477,0.7156549520766773,0.6730137486698519,0.33286068577603795,0.08,0.5483586202513444,0.5430827299287483,0.5567616463138851,0.5572139303482587,1.0,1.0,oversample,0.5179769226943418,0.5066269914967565,0.5065406550804907,0.08312936387298725,COMPLETE
151,0.0,2025-11-26 17:19:42.712468,2025-11-26 17:19:48.030551,0 days 00:00:05.318083,0.002880633628018366,dart,0.888856104046052,9.412058170884597,lossguide,0.0619217505170263,0.012263944859588715,7,11,1.001355338184792,200,forest,0.7333786057555742,0.6621725873135325,0.09746344878860431,oversample,0.6280227802339075,,11.0,0.7195553202442202,0.16303760767371145,uniform,0.30716411748667644,0.9451543301616958,0.761128249329217,0.44323835368611486,0.4427860696517413,0.0,0.0,0.7333786057555742,0.6621725873135325,0.1,0.5156094435201981,0.5171065619652895,0.0,0.0,0.0,0.0,oversample,0.37648377791409005,0.38085053990952866,0.6280227802339075,0.761128249329217,COMPLETE
152,0.7156549520766773,2025-11-26 17:19:48.208106,2025-11-26 17:20:42.016970,0 days 00:00:53.808864,0.2197179695995511,dart,0.8976129316719514,4.242013432372927,depthwise,1.495491295877548,0.0035064294367016264,6,7,66.37431023996923,700,forest,0.9321403375438025,0.7652511483367516,0.0726655932017467,oversample,0.8975969250604152,,10.0,0.9267221061581,0.2027346038963261,weighted,0.12832955868811216,0.9282941093969515,0.3241048767984258,0.5567616463138851,0.5572139303482587,0.715281812899477,0.7156549520766773,0.9321403375438025,0.7652511483367516,0.08,0.4369855721748397,0.4295147574777467,0.5567616463138851,0.5572139303482587,1.0,1.0,oversample,0.28725650292610955,0.2622258997386679,0.8975969250604152,0.3241048767984258,COMPLETE
153,0.7156549520766773,2025-11-26 17:20:42.181417,2025-11-26 17:21:10.404349,0 days 00:00:28.222932,0.1720044106448349,dart,0.5284031564776075,9.635325434984676,lossguide,40.61176948192262,0.0002216367598487882,2,3,0.2713803331863616,500,forest,0.6894900990107435,0.2042589266768765,0.06122238777451765,none,0.5813755698159664,1.4132214183680116,11.0,0.7444855049885754,0.17066472037322888,weighted,0.04371050029465656,0.9461594049404707,0.5400822262895167,0.5567616463138851,0.5572139303482587,0.715281812899477,0.7156549520766773,0.6894900990107435,0.2042589266768765,0.05,0.5567616463138851,0.5572139303482587,0.5567616463138851,0.5572139303482587,1.0,1.0,none,0.5,0.5,0.5813755698159664,0.5400822262895167,COMPLETE
154,0.7156549520766773,2025-11-26 17:21:10.572721,2025-11-26 17:22:27.889889,0 days 00:01:17.317168,0.4461114856567253,dart,0.9519397012350718,5.8862380255002495,depthwise,18.725067888385702,0.021100207014779757,7,12,87.8299197641817,800,tree,0.8570265512992242,0.8349721007011105,0.09678939468342426,oversample,0.953857953274047,,12.0,0.8333614368976356,0.10545403539801501,weighted,0.03113213901082501,0.9652331302696101,0.09834894680235473,0.5567616463138851,0.5572139303482587,0.715281812899477,0.7156549520766773,0.8570265512992242,0.8349721007011105,0.1,0.4702144442351463,0.47545654112314045,0.5567616463138851,0.5572139303482587,1.0,1.0,oversample,0.30945721911835405,0.3167288214849502,0.953857953274047,0.09834894680235473,COMPLETE
155,0.7156549520766773,2025-11-26 17:22:28.054551,2025-11-26 17:24:02.264682,0 days 00:01:34.210131,2.8703302522915477,dart,0.8846554271720244,1.9451060406382479,depthwise,0.6423251758887147,0.016684215328951747,5,8,85.93608213876689,900,forest,0.8250511401645185,0.7007558613630712,0.09435216247721522,oversample,0.9859840298630039,,12.0,0.8300789408356262,0.13682848237452064,uniform,0.04396559475960599,0.4106265813831146,0.4182274331813571,0.5567616463138851,0.5572139303482587,0.715281812899477,0.7156549520766773,0.8250511401645185,0.7007558613630712,0.1,0.487565440131435,0.47603181687485024,0.5567616463138851,0.5572139303482587,1.0,1.0,oversample,0.41486720602132,0.395131777058488,0.9859840298630039,0.4182274331813571,COMPLETE
156,0.7156549520766773,2025-11-26 17:24:02.430681,2025-11-26 17:24:07.583808,0 days 00:00:05.153127,0.00010483776763443151,dart,0.7862022552723518,9.912905857103214,lossguide,0.005939544847509838,0.0031046598370287944,5,5,6.196344343627414,200,forest,0.7207130324803507,0.93398849908611,0.09629312111340335,oversample,0.669692135657327,,11.0,0.6994109388287953,0.18248102208976225,weighted,0.3649728287986115,0.8948914250716262,0.25373944499484835,0.5567616463138851,0.5572139303482587,0.715281812899477,0.7156549520766773,0.7207130324803507,0.93398849908611,0.1,0.5567616463138851,0.5572139303482587,0.5567616463138851,0.5572139303482587,1.0,1.0,oversample,0.5,0.5,0.669692135657327,0.25373944499484835,COMPLETE
157,0.0,2025-11-26 17:24:07.750952,2025-11-26 17:25:05.023750,0 days 00:00:57.272798,0.002047950694245639,dart,0.5571716976880554,2.719133515837353,depthwise,0.0020261164371023917,0.0005160014681561811,3,11,0.14068740722014403,800,forest,0.6782211301350477,0.706510870486156,0.05013807241699124,oversample,0.9178521491149154,,6.0,0.691817776220143,0.47704179356351695,uniform,0.23893815990638698,0.43236041416124515,0.6007103422945983,0.44323835368611486,0.4427860696517413,0.0,0.0,0.6782211301350477,0.706510870486156,0.05,0.5348766106615761,0.5218213628749927,0.0,0.0,0.0,0.0,oversample,0.4807564780583233,0.46862646418953874,0.9178521491149154,0.6007103422945983,COMPLETE
158,0.7156549520766773,2025-11-26 17:25:05.203336,2025-11-26 17:25:06.095776,0 days 00:00:00.892440,0.0001930255122388963,gbtree,0.46250408004268184,4.083202985338019,lossguide,0.025327660680273218,0.0015679213260948587,10,12,2.4637872596041857,700,,0.914092946521928,0.312838809660799,0.08654705936965726,undersample,0.600158892719732,,11.0,0.6638057697508493,,,,0.7149637202700941,0.20749859167525808,0.5567616463138851,0.5572139303482587,0.715281812899477,0.7156549520766773,0.914092946521928,0.312838809660799,0.08,0.49633926670241824,0.4990692434575883,0.5567616463138851,0.5572139303482587,1.0,1.0,undersample,0.4549627812132164,0.46663123648567983,0.600158892719732,0.20749859167525808,COMPLETE
159,0.11400848999393572,2025-11-26 17:25:06.282146,2025-11-26 17:25:07.283904,0 days 00:00:01.001758,0.005198276144104885,gbtree,0.7739003185722887,2.3996674415758457,depthwise,1.43740255653191,0.003287511906293852,8,11,49.72495785707104,600,,0.8530143198307435,0.82908430501538,0.09065104282924283,undersample,0.8475968090796844,,11.0,0.9454991518705574,,,,0.6882854505796174,0.5173447396765387,0.33242876526458615,0.33921302578018997,0.1108433734939759,0.11400848999393572,0.8530143198307435,0.82908430501538,0.1,0.41838908573771816,0.4146948810187948,0.21445221445221446,0.22541966426858512,0.07473598700243704,0.0762987012987013,undersample,0.2786825046834331,0.2643774126792513,0.8475968090796844,0.5173447396765387,COMPLETE
160,0.7156549520766773,2025-11-26 17:25:07.459033,2025-11-26 17:25:12.038997,0 days 00:00:04.579964,93.70826143883575,dart,0.3955827334240714,8.107279441718099,lossguide,0.014842706045984075,0.00016137346384095962,5,8,0.3445255574870812,200,tree,0.777755541992812,0.40158148226048795,0.055020660987645346,none,0.594202773466819,0.7161995973897466,12.0,0.7611446610487748,0.263037609600399,weighted,0.19437308773695447,0.7259706889872239,0.31897315099395374,0.5567616463138851,0.5572139303482587,0.715281812899477,0.7156549520766773,0.777755541992812,0.40158148226048795,0.05,0.5567616463138851,0.5572139303482587,0.5567616463138851,0.5572139303482587,1.0,1.0,none,0.5,0.5,0.594202773466819,0.31897315099395374,COMPLETE
161,0.6648666891663855,2025-11-26 17:25:12.209188,2025-11-26 17:25:15.714808,0 days 00:00:03.505620,0.04682543405031622,gbtree,0.9514202487446524,2.564274625086248,lossguide,0.011162567852310021,0.27690273294995266,4,7,1.0275123060863078,500,,0.6609076067158947,0.5101478689761872,0.08709894166449221,none,0.7046292194834047,2.58306298703312,6.0,0.7227157954302786,,,,0.37858408447091646,0.5616723658681327,0.5450022614201718,0.5508819538670285,0.6599053414469236,0.6648666891663855,0.6609076067158947,0.5101478689761872,0.08,0.5494466052154543,0.5569383013185262,0.5651418645049219,0.5690352397458117,0.7928513403736799,0.799512987012987,none,0.5084048972960427,0.5147878168817903,0.7046292194834047,0.5616723658681327,COMPLETE
162,0.7156549520766773,2025-11-26 17:25:15.882891,2025-11-26 17:25:16.463091,0 days 00:00:00.580200,3.7625937901595163,gbtree,0.24680139337779744,7.342111745185438,lossguide,0.47893351020220903,0.007296351926844834,1,9,0.31935965180480314,400,,0.6752052967523064,0.9248199895755271,0.07312522899611856,oversample,0.5312102689271525,,12.0,0.6128150333603257,,,,0.5197078106169526,0.047049620455340474,0.5567616463138851,0.5572139303482587,0.715281812899477,0.7156549520766773,0.6752052967523064,0.9248199895755271,0.08,0.6017115718603195,0.6091973669597145,0.5567616463138851,0.5572139303482587,1.0,1.0,oversample,0.5336999950264427,0.5406590345303318,0.5312102689271525,0.047049620455340474,COMPLETE
163,0.7156549520766773,2025-11-26 17:25:16.630345,2025-11-26 17:25:17.216494,0 days 00:00:00.586149,0.3374290290300758,gbtree,0.29726655698839405,8.72724600166554,lossguide,0.048157747472543054,0.006406375272426609,1,4,0.17640121894167987,400,,0.8812381539315399,0.7988409476895517,0.07635990805470773,oversample,0.5548232889770784,,10.0,0.6832013389353935,,,,0.7836382990736247,0.09557428184221728,0.5567616463138851,0.5572139303482587,0.715281812899477,0.7156549520766773,0.8812381539315399,0.7988409476895517,0.08,0.5567616463138851,0.5572139303482587,0.5567616463138851,0.5572139303482587,1.0,1.0,oversample,0.5,0.5,0.5548232889770784,0.09557428184221728,COMPLETE
164,0.0,2025-11-26 17:25:17.384745,2025-11-26 17:25:27.357034,0 days 00:00:09.972289,52.27960378833539,dart,0.7854456689377178,7.195532399947221,depthwise,0.0004063967120617363,0.12072974624429679,4,5,0.15630024755264918,300,forest,0.9025435150618388,0.9157296449871813,0.044461485049364174,oversample,0.8392911180342819,,12.0,0.7952041935998493,0.4825515049362119,uniform,0.5644597152850235,0.2918215123957329,0.7527929221894494,0.44323835368611486,0.4427860696517413,0.0,0.0,0.9025435150618388,0.9157296449871813,0.05,0.5567616463138851,0.5572139303482587,0.0,0.0,0.0,0.0,oversample,0.5,0.5,0.8392911180342819,0.7527929221894494,COMPLETE
165,0.14867762687634023,2025-11-26 17:25:27.524535,2025-11-26 17:25:54.669497,0 days 00:00:27.144962,1.0756147977160206,dart,0.9744887544716894,0.29039280794794353,lossguide,0.153355462009587,0.007937462507532293,3,12,0.2382516205110508,400,forest,0.7768423478225237,0.3976855405089115,0.0965989353927036,none,0.7624648658749787,0.6645669322133783,7.0,0.8756921981382394,0.38070525016594964,uniform,0.687410119918347,0.8567655658790136,0.6476422169732861,0.459520578923564,0.46132971506105835,0.1602248770203795,0.14867762687634023,0.7768423478225237,0.3976855405089115,0.1,0.5639441192543246,0.5557498600283057,0.59375,0.6227544910179641,0.0926076360682372,0.08441558441558442,none,0.5002242245395314,0.47741160142207134,0.7624648658749787,0.6476422169732861,COMPLETE
166,0.7156549520766773,2025-11-26 17:25:54.836378,2025-11-26 17:26:07.651677,0 days 00:00:12.815299,8.837272776024545,dart,0.8651874022891177,2.164056350528081,depthwise,7.823286450473941,0.0023622040352738573,7,10,30.74078315440901,300,tree,0.7653941022726469,0.4197855922270658,0.09080259648222032,oversample,0.7808910476498616,,12.0,0.9042724439559695,0.03673783328460517,uniform,0.7474471825775506,0.971298307880867,0.37495726013468744,0.5567616463138851,0.5572139303482587,0.715281812899477,0.7156549520766773,0.7653941022726469,0.4197855922270658,0.1,0.43050829322739526,0.42695433029709984,0.5567616463138851,0.5572139303482587,1.0,1.0,oversample,0.2404988477925695,0.23843903797938526,0.7808910476498616,0.37495726013468744,COMPLETE
167,0.7156549520766773,2025-11-26 17:26:07.819473,2025-11-26 17:26:11.341185,0 days 00:00:03.521712,0.2495507743025551,gbtree,0.9897691780844049,1.5964684851112971,lossguide,0.0884039615519576,0.0001130167761151003,7,12,0.1570237929857408,600,,0.8604967540367979,0.0505963638469345,0.09508135376030466,oversample,0.8151838958168195,,5.0,0.8608304413727319,,,,0.9122095131208048,0.35110293302696577,0.5567616463138851,0.5572139303482587,0.715281812899477,0.7156549520766773,0.8604967540367979,0.0505963638469345,0.1,0.6016989027068136,0.5552671589403565,0.5567616463138851,0.5572139303482587,1.0,1.0,oversample,0.52999262255674,0.4798421063104414,0.8151838958168195,0.35110293302696577,COMPLETE
168,0.7156549520766773,2025-11-26 17:26:11.504571,2025-11-26 17:26:12.084135,0 days 00:00:00.579564,26.81154370324188,gbtree,0.22304271019253855,7.011732741259758,depthwise,0.41907772708262075,0.00972538029422012,3,7,0.14836287909463355,400,,0.9416314487326729,0.8009869759342523,0.06769230607783458,undersample,0.5560248281600586,,11.0,0.7055609273114744,,,,0.6087448857265243,0.19050455139181605,0.5567616463138851,0.5572139303482587,0.715281812899477,0.7156549520766773,0.9416314487326729,0.8009869759342523,0.08,0.5567616463138851,0.5572139303482587,0.5567616463138851,0.5572139303482587,1.0,1.0,undersample,0.5,0.5,0.5560248281600586,0.19050455139181605,COMPLETE
169,0.0,2025-11-26 17:26:12.255499,2025-11-26 17:27:53.663749,0 days 00:01:41.408250,1.3287144398624775,dart,0.9364877631511862,4.175134103700437,lossguide,14.939878080796367,0.0006518461077683223,8,11,35.45514471878067,900,forest,0.7689428479853184,0.868835193145645,0.09007466543312202,oversample,0.8404880331213178,,12.0,0.8311902871651534,0.07487398912342769,weighted,0.159078068307892,0.9715396801940245,0.7445525673170623,0.44323835368611486,0.4427860696517413,0.0,0.0,0.7689428479853184,0.868835193145645,0.1,0.45870121241939366,0.44899586352828946,0.0,0.0,0.0,0.0,oversample,0.33926664898290754,0.3099418138041734,0.8404880331213178,0.7445525673170623,COMPLETE
170,0.6811594202898551,2025-11-26 17:27:53.823361,2025-11-26 17:28:00.069459,0 days 00:00:06.246098,1.2413510479921857,gbtree,0.8643955411499957,2.5670748854671257,depthwise,0.1380211249838756,0.0031762198986443565,5,11,1.3300275423376244,900,,0.8087932909895912,0.1752934968236956,0.09331598406337403,oversample,0.5980288579763362,,7.0,0.6488411461693336,,,,0.48885375413879395,0.5450652974938232,0.5291723202170964,0.5223880597014925,0.6880431525322146,0.6811594202898551,0.8087932909895912,0.1752934968236956,0.1,0.6103610412622422,0.6056722236725709,0.5451092117758785,0.5423076923076923,0.9325751421608448,0.9155844155844156,oversample,0.51099777847776,0.5111091028481223,0.5980288579763362,0.5450652974938232,COMPLETE
171,0.7156549520766773,2025-11-26 17:28:00.229515,2025-11-26 17:28:16.904238,0 days 00:00:16.674723,84.30398696725824,dart,0.6439755199950665,8.708262289746996,lossguide,0.2677541036276167,0.000129112157877502,5,3,0.2551228345251691,400,tree,0.7482247990024468,0.5469795438410572,0.04819891476118522,oversample,0.5822553678974596,,12.0,0.6784610707083367,0.23683747509853942,weighted,0.08381366732802306,0.7511437112847006,0.48388294633212847,0.5567616463138851,0.5572139303482587,0.715281812899477,0.7156549520766773,0.7482247990024468,0.5469795438410572,0.05,0.5567616463138851,0.5572139303482587,0.5567616463138851,0.5572139303482587,1.0,1.0,oversample,0.5,0.5,0.5822553678974596,0.48388294633212847,COMPLETE
172,0.7156549520766773,2025-11-26 17:28:17.060854,2025-11-26 17:28:17.827847,0 days 00:00:00.766993,0.00402551352866334,gbtree,0.34975096925382376,4.3741127163499876,lossguide,8.647939035001858,0.0007584607854900864,2,5,0.13380958132764575,600,,0.6801645572043329,0.8909497415031912,0.0021534601363896923,undersample,0.6186056978616793,,7.0,0.768496281888354,,,,0.25572931383066944,0.36335588253955825,0.5567616463138851,0.5572139303482587,0.715281812899477,0.7156549520766773,0.6801645572043329,0.8909497415031912,0.0,0.3772538782716414,0.3739361872355308,0.5567616463138851,0.5572139303482587,1.0,1.0,undersample,0.14512218372320496,0.13054170038337556,0.6186056978616793,0.36335588253955825,COMPLETE
173,0.7156549520766773,2025-11-26 17:28:17.985044,2025-11-26 17:28:18.716857,0 days 00:00:00.731813,0.009007170666758511,gbtree,0.20770418146629932,9.916649472175337,lossguide,3.34410568193504,0.07644471470956932,6,8,0.19142504392491397,700,,0.7068250336321797,0.947922594477771,0.07191695289392436,oversample,0.6146552653558057,,10.0,0.6962047629178478,,,,0.5565415754920509,0.28149010339613184,0.5567616463138851,0.5572139303482587,0.715281812899477,0.7156549520766773,0.7068250336321797,0.947922594477771,0.08,0.4808366172836404,0.483656696877021,0.5567616463138851,0.5572139303482587,1.0,1.0,oversample,0.36266267676851405,0.37328708064152394,0.6146552653558057,0.28149010339613184,COMPLETE
