number,value,datetime_start,datetime_complete,duration,params_alpha,params_booster,params_colsample_bytree,params_gamma,params_grow_policy,params_lambda,params_learning_rate,params_max_delta_step,params_max_depth,params_min_child_weight,params_n_estimators,params_normalize_type,params_params_feature_fraction,params_params_labeled_ratio,params_params_missing_rate,params_params_resampling,params_params_sample_rows,params_params_scale_pos_weight,params_params_selftrain_max_iter,params_params_selftrain_threshold,params_rate_drop,params_sample_type,params_skip_drop,params_subsample,params_user_attrs_decision_threshold,user_attrs_acc_test,user_attrs_acc_val,user_attrs_f1_test,user_attrs_f1_val,user_attrs_feature_fraction,user_attrs_labeled_ratio,user_attrs_missing_rate,user_attrs_pr_auc_test,user_attrs_pr_auc_val,user_attrs_prec_test,user_attrs_prec_val,user_attrs_rec_test,user_attrs_rec_val,user_attrs_resampling_strategy,user_attrs_roc_auc_test,user_attrs_roc_auc_val,user_attrs_sample_rows,user_attrs_user_attrs_decision_threshold,state
2601,0.699929228591649,2025-11-30 15:33:56.928057,2025-11-30 15:35:07.036806,0 days 00:01:10.108749,0.00018165870055688845,dart,0.9317833485872551,1.6673438081825365,depthwise,0.02653692450021265,0.047600909476448156,0,4,4.507778730546322,800,tree,0.7401907359455964,0.3530043164552845,0.0032420991497835727,oversample,0.9619940932882647,,9.0,0.8755889170118979,0.3916157135421199,weighted,0.23444820740633596,0.3978192729964854,,0.6426956128448665,0.6164631388511985,0.721830985915493,0.699929228591649,0.7401907359455964,0.3530043164552845,0.08,0.6675541995994466,0.6495377366932675,0.637041640770665,0.6204516938519448,0.8326563769293257,0.8027597402597403,oversample,0.6549698270859928,0.6295140316782298,0.9619940932882647,0.5,COMPLETE
2602,0.7156549520766773,2025-11-30 15:35:07.831980,2025-11-30 15:35:08.407803,0 days 00:00:00.575823,3.522949070384798,gbtree,0.9183901282791882,7.308723558099937,depthwise,0.00018525958147371058,0.008988155187972892,7,7,0.5764717057579558,500,,0.7709212376895505,0.4688643416032433,0.012757234517735928,none,0.5377706821073418,1.0820602990609605,6.0,0.7559609444240707,,,,0.6091680838676381,,0.5567616463138851,0.5572139303482587,0.715281812899477,0.7156549520766773,0.7709212376895505,0.4688643416032433,0.08,0.5944048557062904,0.6096859973121962,0.5567616463138851,0.5572139303482587,1.0,1.0,none,0.5252602828296224,0.5254036055874667,0.5377706821073418,0.5,COMPLETE
2603,0.44988864142538976,2025-11-30 15:35:09.188717,2025-11-30 15:35:12.631807,0 days 00:00:03.443090,0.0010175694570309908,gbtree,0.5090508365455603,5.384075547273341,lossguide,0.004900050889418569,0.09567294161094525,1,10,0.1540605931618772,800,,0.5808010534605152,0.5501102121819987,0.05973380443247526,undersample,0.9797059776733752,,11.0,0.6006330909508777,,,,0.4036506194129663,,0.4554500226142017,0.4414292175486205,0.4648888888888889,0.44988864142538976,0.5808010534605152,0.5501102121819987,0.08,0.4914715307661004,0.4891536282716201,0.5132482826300294,0.49851924975320827,0.4248578391551584,0.4099025974025974,undersample,0.4291487756759893,0.4296011700250719,0.9797059776733752,0.5,COMPLETE
2604,0.7156549520766773,2025-11-30 15:35:13.410463,2025-11-30 15:35:46.893230,0 days 00:00:33.482767,1.1565042133379078,dart,0.791308217434131,8.96053768790637,depthwise,0.0008515043040604047,0.04673966052604273,6,6,0.2632445334462067,500,tree,0.5630509948539685,0.746414498871258,0.053433767553111924,oversample,0.9696058996240464,,8.0,0.8158338885320321,0.008542095169968622,weighted,0.5956676361589984,0.9854321489690296,,0.5567616463138851,0.5572139303482587,0.715281812899477,0.7156549520766773,0.5630509948539685,0.746414498871258,0.08,0.52621349371862,0.5258749495914962,0.5567616463138851,0.5572139303482587,1.0,1.0,oversample,0.4034014986985859,0.3956342112943237,0.9696058996240464,0.5,COMPLETE
2605,0.5550361240968976,2025-11-30 15:35:47.672736,2025-11-30 15:35:52.908822,0 days 00:00:05.236086,0.0031517469819257403,gbtree,0.40320860857114316,0.8477694557911319,lossguide,0.0007838070308157929,0.16965398815676158,8,9,0.5147639174504074,400,,0.6522385717347585,0.5857789884442637,0.033303140197656116,undersample,0.7285463889939321,,5.0,0.8970877933914012,,,,0.2259390031066859,,0.5359565807327001,0.5264586160108549,0.5592783505154639,0.5550361240968976,0.6522385717347585,0.5857789884442637,0.08,0.5791812597184525,0.5688709978004686,0.593436645396536,0.5825156110615521,0.528838342810723,0.5300324675324676,undersample,0.543332532037998,0.5289591983603731,0.7285463889939321,0.5,COMPLETE
2606,0.7156549520766773,2025-11-30 15:35:53.686335,2025-11-30 15:35:54.302643,0 days 00:00:00.616308,36.48763962616655,gbtree,0.5319800600061133,9.223763423547176,depthwise,0.4751671372846695,0.08115470194314608,4,4,22.479044153088786,600,,0.9255447913644517,0.37462194915409985,0.06147567295480616,undersample,0.9114396643776592,,5.0,0.944340423171171,,,,0.858388806005765,,0.5567616463138851,0.5572139303482587,0.715281812899477,0.7156549520766773,0.9255447913644517,0.37462194915409985,0.08,0.5567616463138851,0.5572139303482587,0.5567616463138851,0.5572139303482587,1.0,1.0,undersample,0.5,0.5,0.9114396643776592,0.5,COMPLETE
2607,0.7156549520766773,2025-11-30 15:35:55.095156,2025-11-30 15:36:06.587814,0 days 00:00:11.492658,1.0366126457594207,dart,0.6337961142628958,7.042064736518492,lossguide,0.0437344421920312,0.014429915164884982,7,6,0.24188268456278467,300,tree,0.6711984320978528,0.27010592858121785,0.015526436858914151,oversample,0.7212228079097159,,12.0,0.7745118343671494,0.11217864462246913,uniform,0.2092025233318432,0.5202728451963547,,0.5567616463138851,0.5572139303482587,0.715281812899477,0.7156549520766773,0.6711984320978528,0.27010592858121785,0.08,0.6165051401931851,0.6162737400791909,0.5567616463138851,0.5572139303482587,1.0,1.0,oversample,0.6107946915565576,0.5895555861401112,0.7212228079097159,0.5,COMPLETE
2608,0.7156549520766773,2025-11-30 15:36:07.380031,2025-11-30 15:37:21.183324,0 days 00:01:13.803293,57.36699880646233,dart,0.20103429840165835,1.033408509290159,lossguide,0.0003894321388742603,0.1067791350631536,10,3,0.14444818683563854,800,tree,0.9250422316596958,0.5669284457065829,0.0911832554722551,undersample,0.6421181122581077,,9.0,0.9367527957153382,0.19613707724468143,uniform,0.2887515818885542,0.6252420818243611,,0.5567616463138851,0.5572139303482587,0.715281812899477,0.7156549520766773,0.9250422316596958,0.5669284457065829,0.1,0.5567616463138851,0.5572139303482587,0.5567616463138851,0.5572139303482587,1.0,1.0,undersample,0.5,0.5,0.6421181122581077,0.5,COMPLETE
2609,0.4210069444444444,2025-11-30 15:37:21.976919,2025-11-30 15:37:22.428452,0 days 00:00:00.451533,0.012912100572017153,gbtree,0.618840904529433,3.3780934119515296,depthwise,0.019226877945404376,0.014785648592884332,8,7,0.3019120031974679,200,,0.5419816897818517,0.8783472782588007,0.0767566687317987,undersample,0.9889803016533195,,5.0,0.8160991036827717,,,,0.6764560860542927,,0.417910447761194,0.3966530981456355,0.4516403919897742,0.4210069444444444,0.5419816897818517,0.8783472782588007,0.08,0.4642498640235784,0.45378754770191,0.47491039426523296,0.45242537313432835,0.4305442729488221,0.39366883116883117,undersample,0.36713970722326295,0.35505062480930716,0.9889803016533195,0.5,COMPLETE
2610,0.7156549520766773,2025-11-30 15:37:23.211535,2025-11-30 15:39:33.334042,0 days 00:02:10.122507,9.251193761853035,dart,0.8130582320729758,4.137652079709725,lossguide,0.0006579480382180509,0.004731521524679913,6,3,0.18689675397287175,1000,tree,0.5435295815348651,0.281988341962232,0.07185338121966575,oversample,0.9808243391166583,,9.0,0.6632512146731402,0.11849364489444181,uniform,0.721948169621503,0.44735494546500726,,0.5567616463138851,0.5572139303482587,0.715281812899477,0.7156549520766773,0.5435295815348651,0.281988341962232,0.08,0.46375385654086454,0.4538322748286314,0.5567616463138851,0.5572139303482587,1.0,1.0,oversample,0.35650334057262223,0.339318049162278,0.9808243391166583,0.5,COMPLETE
2611,0.7156549520766773,2025-11-30 15:39:34.126805,2025-11-30 15:39:35.054801,0 days 00:00:00.927996,0.2523970093868474,gbtree,0.7400961655323774,8.632798906813646,lossguide,0.00013845307444788297,0.023067018940689053,2,5,2.7534847433524807,700,,0.5542605493372732,0.4231273366937178,0.07933908765927855,none,0.8366227687145158,1.4245447751794587,8.0,0.6243979457603016,,,,0.5793048268186978,,0.5567616463138851,0.5572139303482587,0.715281812899477,0.7156549520766773,0.5542605493372732,0.4231273366937178,0.08,0.5899251390918088,0.6037961799273365,0.5567616463138851,0.5572139303482587,1.0,1.0,none,0.5746501931398067,0.5913679974264755,0.8366227687145158,0.5,COMPLETE
2612,0.7156549520766773,2025-11-30 15:39:35.846830,2025-11-30 15:40:51.171271,0 days 00:01:15.324441,0.07490390075390507,dart,0.2186784075240052,4.868112036209026,lossguide,0.06446757369430602,0.0025607303989566605,2,4,0.24863730645215903,900,forest,0.6576059151229225,0.5429837398972177,0.08784605096609706,oversample,0.6769524164074221,,12.0,0.851594791270123,0.3584535610808529,weighted,0.1149499856099685,0.9903789349363739,,0.5567616463138851,0.5572139303482587,0.715281812899477,0.7156549520766773,0.6576059151229225,0.5429837398972177,0.08,0.4944395628175516,0.4893029394779892,0.5567616463138851,0.5572139303482587,1.0,1.0,oversample,0.43156716789071436,0.43001945067190217,0.6769524164074221,0.5,COMPLETE
2613,0.314002828854314,2025-11-30 15:40:51.950126,2025-11-30 15:41:01.713765,0 days 00:00:09.763639,0.008738856575584842,dart,0.7266647153168693,2.8836673281099157,depthwise,3.23184429317878,0.0924505400940003,7,11,0.9633895045304994,300,tree,0.6822500275529062,0.45898941542148985,0.09540073018410655,undersample,0.8917706209263057,,7.0,0.918597917587858,0.25924741455241723,uniform,0.02461593233993924,0.7968312376178657,,0.3491632745364089,0.3419267299864315,0.32976245924545877,0.314002828854314,0.6822500275529062,0.45898941542148985,0.1,0.4360906292510855,0.43266973378579565,0.3864628820960699,0.374578177727784,0.2875710804224208,0.2702922077922078,undersample,0.2980408329050548,0.29729348792168,0.8917706209263057,0.5,COMPLETE
2614,0.7156549520766773,2025-11-30 15:41:02.489909,2025-11-30 15:42:44.730395,0 days 00:01:42.240486,0.00032148782530849653,dart,0.5081896414267659,8.248710981094105,lossguide,22.769726842257995,0.36776752014600256,2,7,83.29146554402159,1000,forest,0.817843814088095,0.5678500426245181,0.04230658164711504,none,0.8167373470224748,2.323282845105035,5.0,0.6429452381565709,0.319450156358754,uniform,0.28091704805031054,0.5446782947609982,,0.5567616463138851,0.5572139303482587,0.715281812899477,0.7156549520766773,0.817843814088095,0.5678500426245181,0.08,0.4978267526263388,0.49462529365708924,0.5567616463138851,0.5572139303482587,1.0,1.0,none,0.4070869046237504,0.3846486442566627,0.8167373470224748,0.5,COMPLETE
2615,0.7156549520766773,2025-11-30 15:42:45.551661,2025-11-30 15:42:58.491157,0 days 00:00:12.939496,1.7915424912116675,dart,0.716735210798878,0.4615550905140209,lossguide,0.09016581377081447,0.00010131871124620114,5,5,0.3119771174523041,300,tree,0.9515435402593733,0.5118797770444498,0.05377677089371341,oversample,0.9388926785909721,,6.0,0.7885478224793747,0.14695570916515577,weighted,0.5281254602512687,0.8413480898937842,,0.5567616463138851,0.5572139303482587,0.715281812899477,0.7156549520766773,0.9515435402593733,0.5118797770444498,0.08,0.46313716387897613,0.4593135342470974,0.5567616463138851,0.5572139303482587,1.0,1.0,oversample,0.3740367877451549,0.37066339559317085,0.9388926785909721,0.5,COMPLETE
2616,0.7156549520766773,2025-11-30 15:42:59.259122,2025-11-30 15:43:01.042739,0 days 00:00:01.783617,0.00020766840300880002,gbtree,0.6015417201148983,0.6607659237261754,depthwise,4.409566551830327,0.0014437708482061633,2,5,13.895701622854968,900,,0.9692332495424307,0.7253168802314678,0.04680787032364314,none,0.6176652725838063,1.880626630717579,5.0,0.606332823084253,,,,0.862871800123364,,0.5567616463138851,0.5572139303482587,0.715281812899477,0.7156549520766773,0.9692332495424307,0.7253168802314678,0.08,0.5358811384755474,0.5603992575009353,0.5567616463138851,0.5572139303482587,1.0,1.0,none,0.47062119730101626,0.5160107384954168,0.6176652725838063,0.5,COMPLETE
2617,0.014251781472684086,2025-11-30 15:43:01.818584,2025-11-30 15:44:49.604784,0 days 00:01:47.786200,0.0002608629015333376,dart,0.4489669751850417,2.294152706213992,lossguide,0.00030153808205650104,0.008720338434852853,10,11,6.9398852343439215,900,tree,0.5328284324912657,0.8528709741562415,0.03409321217625113,none,0.5812678257557377,0.6204173707581001,12.0,0.6767033249300564,0.07806393625121522,uniform,0.6447849556488576,0.2847829067692472,,0.43057440072365444,0.4369063772048847,0.007880220646178092,0.014251781472684086,0.5328284324912657,0.8528709741562415,0.08,0.48607096106179204,0.4918074118712888,0.13157894736842105,0.2903225806451613,0.004061738424045491,0.007305194805194805,none,0.4039925230855949,0.4140866475199979,0.5812678257557377,0.5,COMPLETE
2618,0.7156549520766773,2025-11-30 15:44:50.373324,2025-11-30 15:45:41.267909,0 days 00:00:50.894585,87.00104919034177,dart,0.9923792849236925,1.4764750265217141,lossguide,0.05052966336133428,0.007774450868143821,3,6,95.53776693742122,700,forest,0.9031504577091352,0.4960597148915717,0.04554366332354684,oversample,0.7364014883782585,,11.0,0.8877552947509764,0.31565057559008874,uniform,0.28009276927706256,0.7153620709459105,,0.5567616463138851,0.5572139303482587,0.715281812899477,0.7156549520766773,0.9031504577091352,0.4960597148915717,0.08,0.5567616463138851,0.5572139303482587,0.5567616463138851,0.5572139303482587,1.0,1.0,oversample,0.5,0.5,0.7364014883782585,0.5,COMPLETE
2619,0.7156549520766773,2025-11-30 15:45:42.055629,2025-11-30 15:46:14.997219,0 days 00:00:32.941590,68.51953996667226,dart,0.8723831963925759,3.394643479080858,depthwise,70.18844977425647,0.0077045920664884195,10,8,0.6734676901589152,600,forest,0.6643765924203151,0.36571391655030694,0.03175571366506202,none,0.9508269507702833,3.4085205771180047,8.0,0.9079459428878303,0.46901677751175314,uniform,0.32223652272593395,0.25959231160379864,,0.5567616463138851,0.5572139303482587,0.715281812899477,0.7156549520766773,0.6643765924203151,0.36571391655030694,0.08,0.4975250027915116,0.4926978558456622,0.5567616463138851,0.5572139303482587,1.0,1.0,none,0.38669283310399705,0.3787620385232745,0.9508269507702833,0.5,COMPLETE
2620,0.7156549520766773,2025-11-30 15:46:15.792811,2025-11-30 15:46:16.940970,0 days 00:00:01.148159,0.008663420988148329,gbtree,0.8300294919854074,1.793786500900082,depthwise,0.10287884135351502,0.00028008061096820646,3,3,2.2702138141594936,900,,0.9795525889302459,0.2577790339828394,0.08147763284482841,oversample,0.5223387505772121,,8.0,0.8618136390183402,,,,0.7756356017266792,,0.5567616463138851,0.5572139303482587,0.715281812899477,0.7156549520766773,0.9795525889302459,0.2577790339828394,0.08,0.5371280067454727,0.5397237288976968,0.5567616463138851,0.5572139303482587,1.0,1.0,oversample,0.5122668645037218,0.5255955420983511,0.5223387505772121,0.5,COMPLETE
2621,0.7156549520766773,2025-11-30 15:46:17.726498,2025-11-30 15:46:29.720873,0 days 00:00:11.994375,0.003064017455460035,dart,0.36565960358756344,0.5457466485821338,lossguide,0.006420715161911684,0.0015050567423499075,3,4,49.249801461061175,300,tree,0.6231504330277867,0.2154067267894388,0.04432823735459196,none,0.8955353569171848,3.5686918154014484,9.0,0.7529591193310454,0.40173446114518135,uniform,0.7622265839975135,0.6810239042738004,,0.5567616463138851,0.5572139303482587,0.715281812899477,0.7156549520766773,0.6231504330277867,0.2154067267894388,0.08,0.6702664835556467,0.66372151359698,0.5567616463138851,0.5572139303482587,1.0,1.0,none,0.6463112783699996,0.6463161455500577,0.8955353569171848,0.5,COMPLETE
2622,0.7156549520766773,2025-11-30 15:46:30.499497,2025-11-30 15:47:52.345602,0 days 00:01:21.846105,64.65168846344855,dart,0.46764113878902924,4.138709137131185,lossguide,0.0008072908201581674,0.43335183763262164,1,8,4.9940294619947085,800,forest,0.6178526482813107,0.8931673462465635,0.052667164752890905,none,0.9240147108045065,3.4084093888804112,5.0,0.8534582270634541,0.043667765802462066,weighted,0.07972047152049064,0.560803341746434,,0.5567616463138851,0.5572139303482587,0.715281812899477,0.7156549520766773,0.6178526482813107,0.8931673462465635,0.08,0.6580014107363282,0.6365499816420328,0.5567616463138851,0.5572139303482587,1.0,1.0,none,0.6490794774449178,0.6148306813207223,0.9240147108045065,0.5,COMPLETE
2623,0.7156549520766773,2025-11-30 15:47:53.129747,2025-11-30 15:48:57.611535,0 days 00:01:04.481788,61.192039768326694,dart,0.3815922702517999,5.754224345205801,depthwise,0.0001384607366701745,0.009908214749904352,2,7,0.7178922622138855,700,tree,0.8711982061986925,0.8611266551962995,0.038613785874463305,none,0.5533559845072132,4.391531114481236,6.0,0.8809121309940904,0.054787521338272416,uniform,0.6200442674210974,0.9999696138730443,,0.5567616463138851,0.5572139303482587,0.715281812899477,0.7156549520766773,0.8711982061986925,0.8611266551962995,0.08,0.5748068423293515,0.5720118421668701,0.5567616463138851,0.5572139303482587,1.0,1.0,none,0.534238382599181,0.5283133299284984,0.5533559845072132,0.5,COMPLETE
2624,0.4156521739130435,2025-11-30 15:48:58.393029,2025-11-30 15:48:59.675622,0 days 00:00:01.282593,0.1224859479751862,gbtree,0.3896265456699743,2.1254028546530424,lossguide,0.02461733821645238,0.45824217106454823,3,7,51.52968655057722,500,,0.96735758071042,0.35592978071595466,0.02983530389634185,undersample,0.8598605678946991,,10.0,0.7615658635530712,,,,0.6582012140560171,,0.3952962460425147,0.3921302578018996,0.3969327920613442,0.4156521739130435,0.96735758071042,0.35592978071595466,0.08,0.45875421640359654,0.4575516249756548,0.4462474645030426,0.44756554307116103,0.35743298131600326,0.387987012987013,undersample,0.35330244201661165,0.35096399387129723,0.8598605678946991,0.5,COMPLETE
2625,0.671067106710671,2025-11-30 15:49:00.461902,2025-11-30 15:49:06.509853,0 days 00:00:06.047951,0.4771765270691966,gbtree,0.5378480575676883,2.622957750324282,depthwise,0.0009556655432492586,0.03312312766338466,1,7,0.2723778627464616,1000,,0.7008177837136731,0.4885776753041862,0.05176431810208654,oversample,0.6641348547604183,,11.0,0.7949459547439965,,,,0.2632378035640664,,0.6001809136137495,0.5943012211668928,0.677136596055515,0.671067106710671,0.7008177837136731,0.4885776753041862,0.08,0.5890900499304668,0.5800341393275781,0.6151293961512939,0.6120401337792643,0.7530463038180342,0.7426948051948052,oversample,0.5863106981216533,0.5833054203202314,0.6641348547604183,0.5,COMPLETE
2626,0.4427947598253275,2025-11-30 15:49:07.303622,2025-11-30 15:49:07.852294,0 days 00:00:00.548672,1.6562144056787274,gbtree,0.820179053156948,1.5521203719332788,depthwise,0.00020117537542668025,0.00010252770687340207,10,3,17.8914846977093,300,,0.5300738067760751,0.8307412058001862,0.0048752528141438045,undersample,0.5479566010681447,,11.0,0.9112730975866516,,,,0.5254610927912411,,0.43464495703301675,0.4228855721393035,0.4454303460514641,0.4427947598253275,0.5300738067760751,0.8307412058001862,0.08,0.49176364321992594,0.4839010428474808,0.49071358748778104,0.4792060491493384,0.40779853777416736,0.411525974025974,undersample,0.41727440773222363,0.40479949060132925,0.5479566010681447,0.5,COMPLETE
2627,0.0,2025-11-30 15:49:08.619450,2025-11-30 15:50:12.968719,0 days 00:01:04.349269,0.016272322129444648,dart,0.29194441106639346,7.859652653560501,lossguide,0.00011766381857076018,0.2615432129519678,2,6,0.25702086914589756,700,forest,0.5970629858599177,0.6111843349880525,0.06685833272623601,none,0.9903702914366304,0.5773420475559247,10.0,0.7664049355756568,0.0996255069539102,weighted,0.7054546361953118,0.9828358662029184,,0.44323835368611486,0.4427860696517413,0.0,0.0,0.5970629858599177,0.6111843349880525,0.08,0.5567616463138851,0.5572139303482587,0.0,0.0,0.0,0.0,none,0.5,0.5,0.9903702914366304,0.5,COMPLETE
2628,0.7156549520766773,2025-11-30 15:50:13.745591,2025-11-30 15:50:14.315613,0 days 00:00:00.570022,0.005248871997388821,gbtree,0.9441209884402235,9.383937768780017,lossguide,0.007150736142809264,0.0019614657046706854,7,5,70.07674374228766,500,,0.9059996935155636,0.4421599513496639,0.0992682933109282,oversample,0.869767865333622,,12.0,0.916260941365825,,,,0.34591754888848825,,0.5567616463138851,0.5572139303482587,0.715281812899477,0.7156549520766773,0.9059996935155636,0.4421599513496639,0.1,0.5335745228125428,0.53608101191279,0.5567616463138851,0.5572139303482587,1.0,1.0,oversample,0.45113479998010575,0.45748668466365094,0.869767865333622,0.5,COMPLETE
2629,0.35029459025174076,2025-11-30 15:50:15.112586,2025-11-30 15:50:15.559717,0 days 00:00:00.447131,2.074014237976608,gbtree,0.7135633299746607,7.722180787773404,lossguide,0.772997935388337,0.003567019768390388,10,6,98.35767403378549,300,,0.9991053142583934,0.8471990921493768,0.07630408068590631,undersample,0.7760540372703852,,5.0,0.8984186793775013,,,,0.48128279532369067,,0.4626865671641791,0.45137946630483944,0.37009544008483564,0.35029459025174076,0.9991053142583934,0.8471990921493768,0.08,0.6050583325984391,0.6020559698908741,0.5328244274809161,0.5149606299212598,0.2835093419983753,0.26542207792207795,undersample,0.5619887597606061,0.5593941936510884,0.7760540372703852,0.5,COMPLETE
2630,0.7156549520766773,2025-11-30 15:50:16.348864,2025-11-30 15:50:50.708604,0 days 00:00:34.359740,0.016101911825737645,dart,0.6111472841853445,4.107014097463798,depthwise,2.14628874482645,0.03371106465699447,7,6,0.41207820580640786,600,tree,0.552568746776855,0.7173331291781018,0.04452943331710563,undersample,0.741618470653105,,10.0,0.7179570361454991,0.32148025676500075,uniform,0.0432978725250408,0.9931243439013595,,0.5567616463138851,0.5572139303482587,0.715281812899477,0.7156549520766773,0.552568746776855,0.7173331291781018,0.08,0.5567616463138851,0.5572139303482587,0.5567616463138851,0.5572139303482587,1.0,1.0,undersample,0.5,0.5,0.741618470653105,0.5,COMPLETE
