number,value,datetime_start,datetime_complete,duration,params_alpha,params_booster,params_colsample_bytree,params_gamma,params_grow_policy,params_lambda,params_learning_rate,params_max_delta_step,params_max_depth,params_min_child_weight,params_n_estimators,params_normalize_type,params_params_feature_fraction,params_params_labeled_ratio,params_params_missing_rate,params_params_resampling,params_params_sample_rows,params_params_scale_pos_weight,params_params_selftrain_max_iter,params_params_selftrain_threshold,params_rate_drop,params_sample_type,params_skip_drop,params_subsample,params_user_attrs_decision_threshold,user_attrs_acc_test,user_attrs_acc_val,user_attrs_f1_test,user_attrs_f1_val,user_attrs_feature_fraction,user_attrs_labeled_ratio,user_attrs_missing_rate,user_attrs_pr_auc_test,user_attrs_pr_auc_val,user_attrs_prec_test,user_attrs_prec_val,user_attrs_rec_test,user_attrs_rec_val,user_attrs_resampling_strategy,user_attrs_roc_auc_test,user_attrs_roc_auc_val,user_attrs_sample_rows,user_attrs_user_attrs_decision_threshold,state
2272,0.7156549520766773,2025-11-30 13:13:46.361999,2025-11-30 13:13:57.747168,0 days 00:00:11.385169,0.005168247419608223,dart,0.48719242295846926,9.58509719514732,depthwise,11.184068317482131,0.012387746935793087,10,10,0.997165424350406,300,forest,0.5459293403291339,0.4708439941040216,0.05382999249678899,undersample,0.9532224821116855,,10.0,0.874426119070065,0.4438124861463608,weighted,0.7873604952456763,0.36214652332586517,,0.5567616463138851,0.5572139303482587,0.715281812899477,0.7156549520766773,0.5459293403291339,0.4708439941040216,0.08,0.5474531261880313,0.5480826067354109,0.5567616463138851,0.5572139303482587,1.0,1.0,undersample,0.46662577297368985,0.4828094530597084,0.9532224821116855,0.5,COMPLETE
2273,0.7156549520766773,2025-11-30 13:13:58.554207,2025-11-30 13:13:59.140070,0 days 00:00:00.585863,0.0005936841237385243,gbtree,0.5081101500753734,2.014168609502891,depthwise,11.627530870019786,0.00013998205396882738,5,8,1.9615765192461891,300,,0.6803977114305313,0.3952378473715966,0.02321411117260931,none,0.7980970214666264,3.0936316459233084,5.0,0.6001993660958697,,,,0.5797099381693211,,0.5567616463138851,0.5572139303482587,0.715281812899477,0.7156549520766773,0.6803977114305313,0.3952378473715966,0.08,0.5498136495132923,0.551238200630955,0.5567616463138851,0.5572139303482587,1.0,1.0,none,0.4856794708135082,0.48724637849382485,0.7980970214666264,0.5,COMPLETE
2274,0.4857667584940312,2025-11-30 13:13:59.942398,2025-11-30 13:15:22.468558,0 days 00:01:22.526160,0.00010190991891539513,dart,0.525376245541965,3.5056705308389646,lossguide,0.0008798014887742644,0.08837342118806303,1,6,5.77429069297409,800,tree,0.5954475155569536,0.7274911269345663,0.05092144995565676,undersample,0.5638996758414339,,9.0,0.7352321509979451,0.057451112089719036,weighted,0.21011697771177915,0.5064914201325306,,0.5070104025327906,0.49344188150158297,0.4990808823529412,0.4857667584940312,0.5954475155569536,0.7274911269345663,0.08,0.5514726683605382,0.5570999529303058,0.5746031746031746,0.5591966173361522,0.44110479285134035,0.42938311688311687,undersample,0.5102252192509822,0.5074718437844077,0.5638996758414339,0.5,COMPLETE
2275,0.7156549520766773,2025-11-30 13:15:23.245143,2025-11-30 13:15:23.952399,0 days 00:00:00.707256,94.25082188414356,gbtree,0.9411827559453427,6.075489452973411,lossguide,0.01610890542935416,0.00017283793104807543,0,9,0.19651594772836173,700,,0.5112014068992984,0.6798759343710105,0.004222165222392127,none,0.8675711601200158,0.9439406558849079,10.0,0.7570307004601752,,,,0.8565272160307185,,0.5567616463138851,0.5572139303482587,0.715281812899477,0.7156549520766773,0.5112014068992984,0.6798759343710105,0.08,0.5567616463138851,0.5572139303482587,0.5567616463138851,0.5572139303482587,1.0,1.0,none,0.5,0.5,0.8675711601200158,0.5,COMPLETE
2276,0.43103448275862066,2025-11-30 13:15:24.768421,2025-11-30 13:15:29.528692,0 days 00:00:04.760271,0.000705656355049685,dart,0.6719540293621087,0.9332351731567312,depthwise,0.0007093364977984901,0.07971152359597974,6,4,0.48530740080479323,200,tree,0.6112599756474184,0.5073863028113675,0.02017188242858591,undersample,0.8805541798664297,,10.0,0.9459475015491623,0.449453795493869,uniform,0.48055994167573535,0.8750591127372298,,0.4093170511080959,0.43283582089552236,0.4003673094582185,0.43103448275862066,0.6112599756474184,0.5073863028113675,0.08,0.4766591125003413,0.4818697880731643,0.4604012671594509,0.4886831275720165,0.35418359057676685,0.38555194805194803,undersample,0.39519885939753635,0.41796849090643773,0.8805541798664297,0.5,COMPLETE
2277,0.35395033860045144,2025-11-30 13:15:30.310000,2025-11-30 13:15:48.384370,0 days 00:00:18.074370,0.05667209213693521,dart,0.6875417907769794,6.439841243857556,depthwise,0.27304936788161766,0.0009420201273744448,8,10,21.033877669187337,400,tree,0.9032138605711175,0.35510791532074626,0.010551829464223717,undersample,0.5040365780469582,,11.0,0.7436096604716508,0.43996126758013493,weighted,0.5551990022278342,0.3942746078767764,,0.3550429669832655,0.35278154681139756,0.3622540250447227,0.35395033860045144,0.9032138605711175,0.35510791532074626,0.08,0.4177555012059908,0.42298628436263513,0.40298507462686567,0.3987792472024415,0.3290008123476848,0.3181818181818182,undersample,0.26192493244251397,0.27176966292134835,0.5040365780469582,0.5,COMPLETE
2278,0.0,2025-11-30 13:15:49.194984,2025-11-30 13:15:49.872547,0 days 00:00:00.677563,0.33686771558799095,gbtree,0.9526121653550712,3.194922423549149,lossguide,0.12081901734168246,0.00021541560141179856,0,4,4.598112139795115,500,,0.7647146542116542,0.871304129134985,0.010876806974633214,none,0.515191419556192,0.7028699104457978,7.0,0.6639555020781025,,,,0.6849538140874083,,0.44323835368611486,0.4427860696517413,0.0,0.0,0.7647146542116542,0.871304129134985,0.08,0.47235857174164364,0.4703627058804846,0.0,0.0,0.0,0.0,none,0.35630647059798737,0.34225637743257764,0.515191419556192,0.5,COMPLETE
2279,0.7156549520766773,2025-11-30 13:15:50.662560,2025-11-30 13:17:41.976209,0 days 00:01:51.313649,0.685236689508911,dart,0.7827827616674932,7.0828314057471005,depthwise,0.14781550136998278,0.005590775868066412,2,5,52.825507211556484,1000,tree,0.7143429904064746,0.6781396332272116,0.01395280512590752,none,0.552116432932519,1.185123296746163,5.0,0.8103317263336847,0.45930693883482,weighted,0.052422026694770495,0.7846716561874567,,0.5567616463138851,0.5572139303482587,0.715281812899477,0.7156549520766773,0.7143429904064746,0.6781396332272116,0.08,0.5185508088306621,0.5298331237485323,0.5567616463138851,0.5572139303482587,1.0,1.0,none,0.48838757273827477,0.5063293448124908,0.552116432932519,0.5,COMPLETE
2280,0.7156549520766773,2025-11-30 13:17:42.755879,2025-11-30 13:17:43.127932,0 days 00:00:00.372053,14.531493877209307,gbtree,0.9634777304834796,9.688407845223875,depthwise,15.190994742061774,0.1404984310107447,9,10,1.7722847343283175,200,,0.6408555838062501,0.46344505561713406,0.05715910412338831,oversample,0.5020561499825644,,11.0,0.7663036950502932,,,,0.49374751994634947,,0.5567616463138851,0.5572139303482587,0.715281812899477,0.7156549520766773,0.6408555838062501,0.46344505561713406,0.08,0.5567616463138851,0.5572139303482587,0.5567616463138851,0.5572139303482587,1.0,1.0,oversample,0.5,0.5,0.5020561499825644,0.5,COMPLETE
2281,0.7156549520766773,2025-11-30 13:17:43.938385,2025-11-30 13:17:44.517029,0 days 00:00:00.578644,11.508141319299991,gbtree,0.8637930956447881,3.395114382042821,lossguide,0.04387913015495211,0.005868841712642379,3,5,0.5850602549791162,500,,0.8262958093957941,0.2885599818659471,0.09404896563472047,oversample,0.7295984612771411,,7.0,0.6427354965354137,,,,0.944408493397231,,0.5567616463138851,0.5572139303482587,0.715281812899477,0.7156549520766773,0.8262958093957941,0.2885599818659471,0.1,0.6861218970423634,0.6607824528796311,0.5567616463138851,0.5572139303482587,1.0,1.0,oversample,0.6731365738821931,0.6516613493758537,0.7295984612771411,0.5,COMPLETE
2282,0.0,2025-11-30 13:17:45.303595,2025-11-30 13:17:45.755820,0 days 00:00:00.452225,0.0014018558639440678,gbtree,0.5981920014054657,7.593824605373287,lossguide,0.00014074531000413983,0.027682629545003053,0,9,3.7082076005349984,300,,0.6185162728014049,0.5557096004280835,0.09994782500995682,undersample,0.7897071209428072,,5.0,0.9149251584420866,,,,0.9730973955400954,,0.44323835368611486,0.4427860696517413,0.0,0.0,0.6185162728014049,0.5557096004280835,0.1,0.5567616463138851,0.5572139303482587,0.0,0.0,0.0,0.0,undersample,0.5,0.5,0.7897071209428072,0.5,COMPLETE
2283,0.7156549520766773,2025-11-30 13:17:46.544280,2025-11-30 13:17:47.319512,0 days 00:00:00.775232,0.00032314339635888464,gbtree,0.7005588396891749,3.766069869311608,lossguide,0.0008004021193313372,0.004581418481423014,7,11,0.44982992634549435,700,,0.5096989918680441,0.6188057932696662,0.06917106852566379,oversample,0.8431567265509496,,6.0,0.8368015195446175,,,,0.5007010795225308,,0.5567616463138851,0.5572139303482587,0.715281812899477,0.7156549520766773,0.5096989918680441,0.6188057932696662,0.08,0.5786331785255155,0.5740088129128997,0.5567616463138851,0.5572139303482587,1.0,1.0,oversample,0.5575921351481292,0.5470103504768979,0.8431567265509496,0.5,COMPLETE
2284,0.7156549520766773,2025-11-30 13:17:48.110999,2025-11-30 13:17:48.624319,0 days 00:00:00.513320,0.00038597106080618076,gbtree,0.3635912246463292,4.738897788599234,lossguide,2.1862958749022696,0.0006287535796779222,3,12,10.85833961226217,400,,0.6167387214691809,0.7413442998003856,0.0037098496526235536,oversample,0.7210648428256098,,5.0,0.6101313425777957,,,,0.9620362044266835,,0.5567616463138851,0.5572139303482587,0.715281812899477,0.7156549520766773,0.6167387214691809,0.7413442998003856,0.08,0.5285946482901515,0.5227410642184848,0.5567616463138851,0.5572139303482587,1.0,1.0,oversample,0.4544658399509276,0.439669753127363,0.7210648428256098,0.5,COMPLETE
2285,0.46296296296296297,2025-11-30 13:17:49.425531,2025-11-30 13:17:49.864738,0 days 00:00:00.439207,11.170574830368716,gbtree,0.5807008501320223,3.364938083574237,lossguide,17.835931762615992,0.1493908125199914,0,9,21.72209583029124,300,,0.9148538455077857,0.2982976292015856,0.06766384962322589,undersample,0.763386251036807,,12.0,0.6600768261142764,,,,0.6193693574590629,,0.4251469923111714,0.4491180461329715,0.43435692033822876,0.46296296296296297,0.9148538455077857,0.2982976292015856,0.08,0.5044740231822302,0.5135614759443567,0.48031496062992124,0.5067567567567568,0.39642567018683994,0.42613636363636365,undersample,0.23264062733135493,0.25523534815541965,0.763386251036807,0.5,COMPLETE
2286,0.7156549520766773,2025-11-30 13:17:50.641565,2025-11-30 13:17:51.516106,0 days 00:00:00.874541,0.0007383694520640284,gbtree,0.8657796011306222,6.883857553986217,depthwise,0.00012397875231180233,0.02286076660222772,4,12,1.462230381890704,1000,,0.531602410608458,0.4653381123567377,0.005605993807075327,oversample,0.6206270762409094,,10.0,0.7198517329851263,,,,0.49497155529388587,,0.5567616463138851,0.5572139303482587,0.715281812899477,0.7156549520766773,0.531602410608458,0.4653381123567377,0.08,0.5016770619531846,0.4975147701505625,0.5567616463138851,0.5572139303482587,1.0,1.0,oversample,0.4124732671297601,0.41459986004802146,0.6206270762409094,0.5,COMPLETE
2287,0.7156549520766773,2025-11-30 13:17:52.298821,2025-11-30 13:17:53.154940,0 days 00:00:00.856119,0.028392798297266493,gbtree,0.35904336430843087,5.376880330339259,lossguide,6.303372134429341,0.00012828262790912039,5,9,19.983246128311205,900,,0.5545838620501127,0.33104231616308477,0.06668048227723276,oversample,0.8582633952896637,,7.0,0.8393011513514819,,,,0.7324022350304413,,0.5567616463138851,0.5572139303482587,0.715281812899477,0.7156549520766773,0.5545838620501127,0.33104231616308477,0.08,0.6417266173896088,0.6740095379721436,0.5567616463138851,0.5572139303482587,1.0,1.0,oversample,0.521909348629785,0.5530917945690674,0.8582633952896637,0.5,COMPLETE
2288,0.7156549520766773,2025-11-30 13:17:53.961394,2025-11-30 13:17:59.130907,0 days 00:00:05.169513,6.145388287544458,dart,0.665692275958276,6.287130625457747,lossguide,0.0022342618963058377,0.15512864133391294,0,12,40.250681878264245,200,tree,0.8209571251231262,0.2167893961113972,0.05323350610316762,oversample,0.6258880888083334,,6.0,0.7994565995468133,0.1933927518733698,weighted,0.42938496137474463,0.24304045213944525,,0.5567616463138851,0.5572139303482587,0.715281812899477,0.7156549520766773,0.8209571251231262,0.2167893961113972,0.08,0.5567616463138851,0.5572139303482587,0.5567616463138851,0.5572139303482587,1.0,1.0,oversample,0.5,0.5,0.6258880888083334,0.5,COMPLETE
2289,0.7156549520766773,2025-11-30 13:17:59.903437,2025-11-30 13:18:00.363469,0 days 00:00:00.460032,0.00010636226382807208,gbtree,0.4267702713234841,7.042838534638232,depthwise,11.175644070294789,0.006492066652446138,1,6,0.35246430498581727,300,,0.6590752691518337,0.6478982599989077,0.0901356163685757,none,0.5604635589860264,2.993117498009141,9.0,0.8578959044871886,,,,0.3065787105078995,,0.5567616463138851,0.5572139303482587,0.715281812899477,0.7156549520766773,0.6590752691518337,0.6478982599989077,0.1,0.5407296040666809,0.5351885969232826,0.5567616463138851,0.5572139303482587,1.0,1.0,none,0.5107188448084351,0.494066964700264,0.5604635589860264,0.5,COMPLETE
2290,0.7156549520766773,2025-11-30 13:18:01.188542,2025-11-30 13:19:49.417298,0 days 00:01:48.228756,4.340776117697817,dart,0.3502145022574791,4.585851836596073,depthwise,2.7208038236795344,0.019644957023469193,5,7,19.064612043399876,900,tree,0.8877684361504844,0.763728170612298,0.06397270437316123,none,0.6358406790658724,1.5300329758546594,12.0,0.8766993952399136,0.02929101158684666,uniform,0.699806874897485,0.567205911617911,,0.5567616463138851,0.5572139303482587,0.715281812899477,0.7156549520766773,0.8877684361504844,0.763728170612298,0.08,0.5744620099404723,0.5792715396248177,0.5567616463138851,0.5572139303482587,1.0,1.0,none,0.5292996402460253,0.5329645775572742,0.6358406790658724,0.5,COMPLETE
2291,0.7156549520766773,2025-11-30 13:19:50.194135,2025-11-30 13:20:18.931551,0 days 00:00:28.737416,3.0651455193226176,dart,0.6315600910491646,9.297235523838182,depthwise,0.13769632660693124,0.3873336061244046,6,4,29.891449032991215,500,tree,0.8147431002428638,0.610381830064362,0.007775737697313989,none,0.5657310682953531,1.229769937477642,10.0,0.9232802324080158,0.19636763221606995,weighted,0.1478948747529701,0.6155712302194268,,0.5567616463138851,0.5572139303482587,0.715281812899477,0.7156549520766773,0.8147431002428638,0.610381830064362,0.08,0.7840598851316823,0.777115264155278,0.5567616463138851,0.5572139303482587,1.0,1.0,none,0.7644635189575423,0.7684549235238715,0.5657310682953531,0.5,COMPLETE
2292,0.7156549520766773,2025-11-30 13:20:19.697812,2025-11-30 13:21:19.196264,0 days 00:00:59.498452,0.013986825229667833,dart,0.7097485321695254,9.000573049353441,depthwise,1.5095968345321986,0.01310351351352171,8,10,26.416324153840606,700,forest,0.8706666439604444,0.2756011091376678,0.0829516640558441,oversample,0.5531263749954952,,10.0,0.6932563838573533,0.11093724341387523,weighted,0.04904114592639271,0.4239825884822865,,0.5567616463138851,0.5572139303482587,0.715281812899477,0.7156549520766773,0.8706666439604444,0.2756011091376678,0.08,0.42150519920665924,0.4132545489750536,0.5567616463138851,0.5572139303482587,1.0,1.0,oversample,0.23574910061506327,0.20568670986827267,0.5531263749954952,0.5,COMPLETE
2293,0.4246517517940059,2025-11-30 13:21:19.958830,2025-11-30 13:21:54.456165,0 days 00:00:34.497335,0.005061431606392069,dart,0.35184305231070634,4.646399700689676,depthwise,0.130721112405878,0.00025744348196297327,2,11,15.894260161498135,600,tree,0.5470155702517714,0.4372296031554797,0.07227287544489251,undersample,0.8063440741753953,,6.0,0.7686397513062816,0.48089795630299564,uniform,0.40267285423439303,0.41525052294608955,,0.40479421076436,0.3835368611488014,0.4507512520868113,0.4246517517940059,0.5470155702517714,0.4372296031554797,0.08,0.46478214680800656,0.45613880497423676,0.463519313304721,0.44239226033421286,0.4386677497969131,0.4082792207792208,undersample,0.36980263266963975,0.3521661879999469,0.8063440741753953,0.5,COMPLETE
2294,0.5406779661016949,2025-11-30 13:21:55.260457,2025-11-30 13:21:56.305152,0 days 00:00:01.044695,0.4089860870953208,gbtree,0.6246850605447004,4.120593377116154,depthwise,0.0036115086785606237,0.00024907338147671674,0,10,9.885177488932392,1000,,0.5996189537442259,0.33982742946570077,0.07904622642826706,undersample,0.6743694570834995,,10.0,0.8621008546241407,,,,0.4417521338714616,,0.508819538670285,0.5097241067390321,0.5448449287510477,0.5406779661016949,0.5996189537442259,0.33982742946570077,0.08,0.5638837378860524,0.575879076007588,0.5627705627705628,0.5656028368794326,0.5280259951259139,0.5178571428571429,undersample,0.5097705532253518,0.5134450904049984,0.6743694570834995,0.5,COMPLETE
2295,0.7156549520766773,2025-11-30 13:21:57.105248,2025-11-30 13:21:57.783774,0 days 00:00:00.678526,0.5284982369863053,gbtree,0.2543863328407236,4.543027437485102,depthwise,37.068140783522914,0.005663461801531655,6,7,36.497416765097775,700,,0.7732667936878794,0.43001190260055333,0.0158896438494607,oversample,0.7157930348350962,,7.0,0.6154609838978589,,,,0.26833943437691493,,0.5567616463138851,0.5572139303482587,0.715281812899477,0.7156549520766773,0.7732667936878794,0.43001190260055333,0.08,0.6057361206205203,0.5832057607308287,0.5567616463138851,0.5572139303482587,1.0,1.0,oversample,0.5689592002519935,0.5333870037010998,0.7157930348350962,0.5,COMPLETE
2296,0.7156549520766773,2025-11-30 13:21:58.561218,2025-11-30 13:23:24.101183,0 days 00:01:25.539965,0.0004697083513701216,dart,0.22536256916885852,6.517763473952897,lossguide,0.232603720193843,0.0006952790110671996,10,5,7.649771839380182,800,tree,0.6507487395668996,0.6177535007914232,0.06882168777089945,none,0.6322794348594691,1.6548829541953798,10.0,0.8703407620384487,0.04395778339202272,weighted,0.8155916606020838,0.4285761187132724,,0.5567616463138851,0.5572139303482587,0.715281812899477,0.7156549520766773,0.6507487395668996,0.6177535007914232,0.08,0.4906349928211794,0.4840994200533174,0.5567616463138851,0.5572139303482587,1.0,1.0,none,0.39871474991296274,0.379165809930621,0.6322794348594691,0.5,COMPLETE
2297,0.7156549520766773,2025-11-30 13:23:24.908364,2025-11-30 13:24:46.251954,0 days 00:01:21.343590,0.31022588587615796,dart,0.6611037639885091,4.941364782806675,depthwise,0.00013830455625743934,0.0006585319943228431,1,5,2.8507585754332503,800,tree,0.6376817251899117,0.8681019652701665,0.03011881362852883,none,0.5343634080594345,1.967047005011347,8.0,0.6802047583311771,0.10325934439478823,uniform,0.2758833521209964,0.5341931458404519,,0.5567616463138851,0.5572139303482587,0.715281812899477,0.7156549520766773,0.6376817251899117,0.8681019652701665,0.08,0.4440180551224626,0.4322980365574273,0.5567616463138851,0.5572139303482587,1.0,1.0,none,0.3197960012599678,0.2946926031068013,0.5343634080594345,0.5,COMPLETE
2298,0.20182440136830102,2025-11-30 13:24:47.029192,2025-11-30 13:25:16.072276,0 days 00:00:29.043084,1.87942334378709,dart,0.7436457918919943,9.283330925386885,lossguide,6.137282169991642,0.3788417662917761,8,12,0.19531790351292347,500,tree,0.5636969463994587,0.41552079820868737,0.07785880290226876,undersample,0.712704273827264,,10.0,0.6067676867979621,0.16001179502987462,uniform,0.16651169282190087,0.4902287850827114,,0.3749434644957033,0.36680235187697874,0.21387940841865757,0.20182440136830102,0.5636969463994587,0.41552079820868737,0.08,0.5278117128208656,0.533718109501804,0.3567362428842505,0.3390804597701149,0.15272136474411047,0.14366883116883117,undersample,0.4674812248213664,0.4834130374222305,0.712704273827264,0.5,COMPLETE
2299,0.7156549520766773,2025-11-30 13:25:16.831601,2025-11-30 13:25:21.522396,0 days 00:00:04.690795,0.7501630773386471,dart,0.5592940353650644,8.561173411486967,lossguide,0.0004637387445130719,0.006949135433311601,3,11,0.22547695298070264,200,forest,0.744571475587276,0.6850818127136195,0.02303523796379018,none,0.8116865681077283,1.0196071275182088,8.0,0.8655357127551175,0.19384742326414578,uniform,0.17963619371209605,0.396174050087771,,0.5567616463138851,0.5572139303482587,0.715281812899477,0.7156549520766773,0.744571475587276,0.6850818127136195,0.08,0.5348180884727611,0.5196612312541838,0.5567616463138851,0.5572139303482587,1.0,1.0,none,0.5054899782821334,0.4801434839420028,0.8116865681077283,0.5,COMPLETE
2300,0.7156549520766773,2025-11-30 13:25:22.271549,2025-11-30 13:25:22.928699,0 days 00:00:00.657150,63.44501123519197,gbtree,0.4504445096837544,8.139319337481362,depthwise,0.02629558887758289,0.0011548003256328008,10,4,3.9960439423833596,700,,0.87142369049104,0.5931175458814457,0.022891553502815187,undersample,0.5241735970006839,,12.0,0.8905755948329125,,,,0.7323204557901086,,0.5567616463138851,0.5572139303482587,0.715281812899477,0.7156549520766773,0.87142369049104,0.5931175458814457,0.08,0.5567616463138851,0.5572139303482587,0.5567616463138851,0.5572139303482587,1.0,1.0,undersample,0.5,0.5,0.5241735970006839,0.5,COMPLETE
2301,0.5541850220264317,2025-11-30 13:25:23.681519,2025-11-30 13:25:24.575713,0 days 00:00:00.894194,0.011286839375912662,gbtree,0.3639753750766194,3.989347229262198,lossguide,0.27056703158914713,0.10558554811983939,6,3,1.3487078198009355,700,,0.7379306369641638,0.34290373331503715,0.06947589432350375,undersample,0.61801690068624,,12.0,0.8154288923965162,,,,0.4401881919343774,,0.535052012663953,0.5422885572139303,0.5435168738898757,0.5541850220264317,0.7379306369641638,0.34290373331503715,0.08,0.6049526222832431,0.6357055524546628,0.5994123408423114,0.6059730250481695,0.49715678310316813,0.510551948051948,undersample,0.5546817752283691,0.5747822784978045,0.61801690068624,0.5,COMPLETE
