number,value,datetime_start,datetime_complete,duration,params_alpha,params_booster,params_colsample_bytree,params_gamma,params_grow_policy,params_lambda,params_learning_rate,params_max_delta_step,params_max_depth,params_min_child_weight,params_n_estimators,params_normalize_type,params_params_feature_fraction,params_params_labeled_ratio,params_params_missing_rate,params_params_resampling,params_params_sample_rows,params_params_scale_pos_weight,params_params_selftrain_max_iter,params_params_selftrain_threshold,params_rate_drop,params_sample_type,params_skip_drop,params_subsample,params_user_attrs_decision_threshold,user_attrs_acc_test,user_attrs_acc_val,user_attrs_f1_test,user_attrs_f1_val,user_attrs_feature_fraction,user_attrs_labeled_ratio,user_attrs_missing_rate,user_attrs_pr_auc_test,user_attrs_pr_auc_val,user_attrs_prec_test,user_attrs_prec_val,user_attrs_rec_test,user_attrs_rec_val,user_attrs_resampling_strategy,user_attrs_roc_auc_test,user_attrs_roc_auc_val,user_attrs_sample_rows,user_attrs_user_attrs_decision_threshold,state
2571,0.7156549520766773,2025-11-30 15:25:45.621667,2025-11-30 15:26:46.477383,0 days 00:01:00.855716,0.11505538519815882,dart,0.8379362864945004,4.704634398234121,lossguide,2.181154457789179,0.0037647606258006472,7,9,0.2553094844331077,700,forest,0.9181634096619289,0.5611467961161367,0.09939356068614297,oversample,0.974847360139226,,7.0,0.7856723858041192,0.4849009001597488,uniform,0.7621614730538294,0.6836393262557596,,0.5567616463138851,0.5572139303482587,0.715281812899477,0.7156549520766773,0.9181634096619289,0.5611467961161367,0.1,0.5775931264844881,0.5962135555596622,0.5567616463138851,0.5572139303482587,1.0,1.0,oversample,0.5377571743563387,0.5567054242999085,0.974847360139226,0.5,COMPLETE
2572,0.7156549520766773,2025-11-30 15:26:47.237044,2025-11-30 15:27:04.224034,0 days 00:00:16.986990,0.015813203091045756,dart,0.5684190241014366,6.864941547793126,lossguide,0.0022675608051473564,0.027975917185226427,1,7,39.75690231593405,300,tree,0.762179972968835,0.5049925871248404,0.054147993056340694,none,0.9512718916161698,1.625759396314208,5.0,0.6424659860465829,0.30305629853040605,weighted,0.7338474447652963,0.38982177711407684,,0.5567616463138851,0.5572139303482587,0.715281812899477,0.7156549520766773,0.762179972968835,0.5049925871248404,0.08,0.5296176762996452,0.5511298785590314,0.5567616463138851,0.5572139303482587,1.0,1.0,none,0.46919337190603294,0.4903783014738071,0.9512718916161698,0.5,COMPLETE
2573,0.0,2025-11-30 15:27:05.001750,2025-11-30 15:27:10.180914,0 days 00:00:05.179164,0.00028457895199805007,dart,0.5777457631249798,8.783796719738593,depthwise,0.13983399667255234,0.2929661915260826,3,9,0.4302823975573545,200,forest,0.6183952225321216,0.3859519485714967,0.004895710509794749,undersample,0.6604487031217392,,11.0,0.7255873885739664,0.10233704670438054,weighted,0.015382127663087252,0.8987810540193293,,0.44323835368611486,0.4427860696517413,0.0,0.0,0.6183952225321216,0.3859519485714967,0.08,0.6107847947457425,0.6131883602988445,0.0,0.0,0.0,0.0,undersample,0.5826352393109966,0.5861620822997228,0.6604487031217392,0.5,COMPLETE
2574,0.17370325693606756,2025-11-30 15:27:10.966966,2025-11-30 15:27:11.399640,0 days 00:00:00.432674,17.556837450072294,gbtree,0.795470749936217,4.613388652139157,depthwise,0.24825958526287184,0.030823039505486153,4,9,43.655921600863955,300,,0.6936448604700939,0.48832845318611506,0.07356737467901513,undersample,0.509296681621892,,8.0,0.9462668652034083,,,,0.4276193953905352,,0.37403889642695615,0.38037087290818633,0.18106508875739644,0.17370325693606756,0.6936448604700939,0.48832845318611506,0.08,0.5141723254532727,0.5142214009768544,0.3333333333333333,0.3380281690140845,0.12428919577579203,0.11688311688311688,undersample,0.43816956514531075,0.4400656480904183,0.509296681621892,0.5,COMPLETE
2575,0.7156549520766773,2025-11-30 15:27:12.178181,2025-11-30 15:27:12.811746,0 days 00:00:00.633565,1.0535657533577356,gbtree,0.8195733207573768,8.860646887466245,lossguide,18.01560938588483,0.0008242727802151322,9,7,3.0135395652745633,600,,0.8486068648813663,0.7340277670521422,0.054292670250903854,oversample,0.6532626474848737,,11.0,0.7625893433258212,,,,0.4821322949933124,,0.5567616463138851,0.5572139303482587,0.715281812899477,0.7156549520766773,0.8486068648813663,0.7340277670521422,0.08,0.45012591795195545,0.45065627991827495,0.5567616463138851,0.5572139303482587,1.0,1.0,oversample,0.3317217626286908,0.3357549944947799,0.6532626474848737,0.5,COMPLETE
2576,0.7156549520766773,2025-11-30 15:27:13.579551,2025-11-30 15:27:14.389035,0 days 00:00:00.809484,3.182215594707768,gbtree,0.24868019513134582,5.824970364547362,depthwise,0.21280233495339893,0.11300385238154288,4,11,1.4686770831291145,900,,0.8453368776043267,0.7120071549403222,0.020601011250106604,none,0.7966587090215302,3.256897357641583,10.0,0.7331067448971558,,,,0.985968636354928,,0.5567616463138851,0.5572139303482587,0.715281812899477,0.7156549520766773,0.8453368776043267,0.7120071549403222,0.08,0.5575759391674409,0.5780353671224201,0.5567616463138851,0.5572139303482587,1.0,1.0,none,0.47149654337770847,0.4925463964023719,0.7966587090215302,0.5,COMPLETE
2577,0.7156549520766773,2025-11-30 15:27:15.219451,2025-11-30 15:27:26.080639,0 days 00:00:10.861188,4.600616722930924,dart,0.422412329758774,3.873041255173092,lossguide,0.0044492859276864085,0.15215395868156992,2,12,0.100705436995545,300,forest,0.5537278933442262,0.4437858124748669,0.09343171152800467,none,0.8182027224522328,1.2046384315802565,8.0,0.7975685628497804,0.4649903201391066,uniform,0.7262758807163914,0.34458050073291535,,0.5567616463138851,0.5572139303482587,0.715281812899477,0.7156549520766773,0.5537278933442262,0.4437858124748669,0.1,0.5796350146996696,0.5951325033674743,0.5567616463138851,0.5572139303482587,1.0,1.0,none,0.5185219416767519,0.5206943210007561,0.8182027224522328,0.5,COMPLETE
2578,0.7156549520766773,2025-11-30 15:27:26.901926,2025-11-30 15:29:34.990541,0 days 00:02:08.088615,2.374535926040458,dart,0.9311742372185707,7.608106844888659,depthwise,3.1376096691987945,0.00902568561654717,2,4,80.24925642875874,1000,forest,0.8556389051039806,0.3487240536717815,0.0723565708034751,none,0.9403530754096628,2.2641603201239136,8.0,0.87017729880886,0.46392032941972583,uniform,0.8922869004931325,0.9642035610432986,,0.5567616463138851,0.5572139303482587,0.715281812899477,0.7156549520766773,0.8556389051039806,0.3487240536717815,0.08,0.49821832212700023,0.4948726250724051,0.5567616463138851,0.5572139303482587,1.0,1.0,none,0.3648307332681245,0.3567299656421209,0.9403530754096628,0.5,COMPLETE
2579,0.7156549520766773,2025-11-30 15:29:35.784625,2025-11-30 15:29:36.186777,0 days 00:00:00.402152,0.40522608677801536,gbtree,0.8525891379619204,5.713178210231885,depthwise,0.005750623472162281,0.00040081852090782176,1,8,4.984691381023981,200,,0.5202064838909926,0.31494232093704894,0.037525977494926976,oversample,0.8301031890393498,,9.0,0.7512160010137559,,,,0.30134553056598884,,0.5567616463138851,0.5572139303482587,0.715281812899477,0.7156549520766773,0.5202064838909926,0.31494232093704894,0.08,0.5599007950141897,0.5597155038575925,0.5567616463138851,0.5572139303482587,1.0,1.0,oversample,0.47535395149123827,0.4671369871191118,0.8301031890393498,0.5,COMPLETE
2580,0.5163132137030995,2025-11-30 15:29:37.001069,2025-11-30 15:30:38.989292,0 days 00:01:01.988223,0.223953351152033,dart,0.6155521938879687,0.681142370469513,lossguide,0.0002308289966895901,0.037623068833048744,4,3,0.3139603402184089,300,tree,0.6732337793745735,0.24710071086907684,0.0021720139738790724,undersample,0.5252012658733235,,10.0,0.7666486410425765,0.20234363614237083,uniform,0.4015072670226199,0.6136301270159171,,0.45906829488919043,0.4635911352329263,0.5246422893481717,0.5163132137030995,0.6732337793745735,0.24710071086907684,0.08,0.5453275614987572,0.5465949662752754,0.5136186770428015,0.5188524590163934,0.5361494719740049,0.5137987012987013,undersample,0.4366957343457285,0.442938062958492,0.5252012658733235,0.5,COMPLETE
2581,0.7156549520766773,2025-11-30 15:30:39.805648,2025-11-30 15:30:52.453192,0 days 00:00:12.647544,0.009666628667467057,dart,0.4297572762500343,3.0585486254474192,lossguide,4.997363361056987,0.03361255481283532,4,11,85.15903136469935,300,tree,0.7785125624087927,0.27859236194618436,0.05940313134627362,none,0.6558455430189399,3.6337001926708035,7.0,0.6806929948543594,0.007498104805811701,uniform,0.8428477779663022,0.6183558454267817,,0.5567616463138851,0.5572139303482587,0.715281812899477,0.7156549520766773,0.7785125624087927,0.27859236194618436,0.08,0.39197273483753303,0.3892714907579319,0.5567616463138851,0.5572139303482587,1.0,1.0,none,0.18026451035328833,0.17179975922953453,0.6558455430189399,0.5,COMPLETE
2582,0.7156549520766773,2025-11-30 15:30:53.234343,2025-11-30 15:30:53.620159,0 days 00:00:00.385816,0.001344694328926237,gbtree,0.8091198133862443,7.106690541715514,lossguide,0.41653983727612637,0.012806121080671603,7,3,4.445719519898279,200,,0.919148924702196,0.3133996934148874,0.03147267097846198,oversample,0.5337061468144227,,10.0,0.8410171433193154,,,,0.6324531378692908,,0.5567616463138851,0.5572139303482587,0.715281812899477,0.7156549520766773,0.919148924702196,0.3133996934148874,0.08,0.6361187294654674,0.6193728206229101,0.5567616463138851,0.5572139303482587,1.0,1.0,oversample,0.5634460120360085,0.5408920114614701,0.5337061468144227,0.5,COMPLETE
2583,0.5899159663865546,2025-11-30 15:30:54.405501,2025-11-30 15:31:45.904186,0 days 00:00:51.498685,2.5691274988384682,dart,0.633986990414525,0.7089144529386304,lossguide,72.57750205402363,0.0011419200434520634,1,3,9.96007313536261,700,forest,0.9905065630414548,0.8685102582864932,0.031951708834311136,undersample,0.7245217773098491,,7.0,0.8093542222798032,0.25613460760669027,uniform,0.05702309131443389,0.6789948097771605,,0.5838986883763003,0.5585707824513795,0.6118143459915611,0.5899159663865546,0.9905065630414548,0.8685102582864932,0.08,0.6083160054298874,0.5896704495959157,0.636523266022827,0.6114982578397212,0.5889520714865962,0.5698051948051948,undersample,0.6064221058041414,0.574799689585185,0.7245217773098491,0.5,COMPLETE
2584,0.48546255506607927,2025-11-30 15:31:46.698591,2025-11-30 15:31:48.040703,0 days 00:00:01.342112,0.585856951488109,gbtree,0.3358033285887134,0.7465359088211598,lossguide,0.11033134731785343,0.00021531278598397138,9,7,52.6880396428464,800,,0.9262945194685401,0.7595716160691977,0.077100806071965,undersample,0.5056232294452606,,12.0,0.8730527917124391,,,,0.9650961625287462,,0.44323835368611486,0.47173224785165085,0.46962516156828954,0.48546255506607927,0.9262945194685401,0.7595716160691977,0.08,0.485089117856715,0.5051888073123962,0.5,0.5308285163776493,0.4427294882209586,0.4472402597402597,undersample,0.407338069265074,0.44074260774975793,0.5056232294452606,0.5,COMPLETE
2585,0.7156549520766773,2025-11-30 15:31:48.814348,2025-11-30 15:31:49.496023,0 days 00:00:00.681675,18.361702889067708,gbtree,0.208198888364881,4.214090891431706,depthwise,0.0020232202537149827,0.031879506531414574,6,4,1.0400833903340767,700,,0.8765919407152878,0.27171927295333503,0.04787049891552408,oversample,0.9761537162296152,,6.0,0.7122082696077149,,,,0.2867393348268505,,0.5567616463138851,0.5572139303482587,0.715281812899477,0.7156549520766773,0.8765919407152878,0.27171927295333503,0.08,0.5567616463138851,0.5572139303482587,0.5567616463138851,0.5572139303482587,1.0,1.0,oversample,0.5,0.5,0.9761537162296152,0.5,COMPLETE
2586,0.7156549520766773,2025-11-30 15:31:50.280310,2025-11-30 15:31:55.391698,0 days 00:00:05.111388,0.0003497865677977261,dart,0.8328664423195689,8.498852650966898,lossguide,25.018322100360994,0.251786664737496,10,4,2.4254942600208915,200,forest,0.9827921849022742,0.43231887845147277,0.036692386985302305,oversample,0.9599635185361548,,8.0,0.7120191290896638,0.20599142475902332,weighted,0.3872213858608059,0.43600144717092637,,0.5567616463138851,0.5572139303482587,0.715281812899477,0.7156549520766773,0.9827921849022742,0.43231887845147277,0.08,0.38648846902253053,0.38141454896006194,0.5567616463138851,0.5572139303482587,1.0,1.0,oversample,0.1421699630298911,0.12162349269729247,0.9599635185361548,0.5,COMPLETE
2587,0.7156549520766773,2025-11-30 15:31:56.228372,2025-11-30 15:31:56.957587,0 days 00:00:00.729215,0.00043871395573891805,gbtree,0.7207017237569293,2.6118403229175833,depthwise,0.00021033174015913802,0.0009194607694089618,8,3,4.918069093476008,500,,0.6421076587518268,0.5489100925550877,0.010727009244393583,oversample,0.5125822953287581,,7.0,0.695014228197965,,,,0.48425997485226724,,0.5567616463138851,0.5572139303482587,0.715281812899477,0.7156549520766773,0.6421076587518268,0.5489100925550877,0.08,0.5319618124617206,0.5151859606043973,0.5567616463138851,0.5572139303482587,1.0,1.0,oversample,0.4917128102256337,0.4691164619343884,0.5125822953287581,0.5,COMPLETE
2588,0.7156549520766773,2025-11-30 15:31:57.738665,2025-11-30 15:31:58.283639,0 days 00:00:00.544974,0.00020456467061869013,gbtree,0.3142625759938123,8.410396730737515,lossguide,0.14936416512433173,0.18537239566426794,8,3,35.3828901107819,300,,0.5945547743917783,0.3873755469359986,0.02030247013231079,none,0.6843008387726474,2.5775995501211884,8.0,0.7084240166181226,,,,0.41518693446681865,,0.5567616463138851,0.5572139303482587,0.715281812899477,0.7156549520766773,0.5945547743917783,0.3873755469359986,0.08,0.5926379345478648,0.6098780271644387,0.5567616463138851,0.5572139303482587,1.0,1.0,none,0.5258260249672575,0.5360442672751151,0.6843008387726474,0.5,COMPLETE
2589,0.7156549520766773,2025-11-30 15:31:59.071308,2025-11-30 15:31:59.475891,0 days 00:00:00.404583,1.8500787499622595,gbtree,0.47118216243467326,6.2408285934858725,depthwise,0.026376225891523195,0.002424288493854128,8,4,16.85689423647622,200,,0.8177576230968455,0.5853648986266218,0.0864297707283625,oversample,0.6139341212831391,,9.0,0.8054843659211494,,,,0.380659478030521,,0.5567616463138851,0.5572139303482587,0.715281812899477,0.7156549520766773,0.8177576230968455,0.5853648986266218,0.08,0.7416081162425019,0.740508355099467,0.5567616463138851,0.5572139303482587,1.0,1.0,oversample,0.757451217692601,0.7464920804425403,0.6139341212831391,0.5,COMPLETE
2590,0.7156549520766773,2025-11-30 15:32:00.281800,2025-11-30 15:32:00.967867,0 days 00:00:00.686067,0.2758674809248694,gbtree,0.4160980775361261,3.5636132647821004,depthwise,0.0004198465078904425,0.007829342785069556,4,5,0.8160355136171079,600,,0.8141517265199902,0.2632152752961642,0.030213466988783612,oversample,0.9304443173911319,,5.0,0.8621818053847543,,,,0.9832650342925193,,0.5567616463138851,0.5572139303482587,0.715281812899477,0.7156549520766773,0.8141517265199902,0.2632152752961642,0.08,0.5949368089907814,0.606137186871853,0.5567616463138851,0.5572139303482587,1.0,1.0,oversample,0.5220859099122995,0.5456012960481808,0.9304443173911319,0.5,COMPLETE
2591,0.645224171539961,2025-11-30 15:32:01.749044,2025-11-30 15:32:31.323636,0 days 00:00:29.574592,0.0001544567822024668,dart,0.6824739292378404,3.9808657693991103,depthwise,0.05794731903496819,0.17530166508746145,1,5,0.29097404181750347,500,tree,0.9674364207978885,0.38931399591544213,0.04601485715310501,oversample,0.5192308340119751,,5.0,0.8056894229187048,0.196135504303515,uniform,0.3816102078756348,0.620077925698445,,0.5074626865671642,0.5061058344640434,0.6451612903225806,0.645224171539961,0.9674364207978885,0.38931399591544213,0.08,0.47255813885055664,0.47063718495858486,0.5386289445048966,0.537919826652221,0.8042242079610074,0.8060064935064936,oversample,0.39873713092060536,0.397748414761949,0.5192308340119751,0.5,COMPLETE
2592,0.7156549520766773,2025-11-30 15:32:32.066268,2025-11-30 15:32:32.620417,0 days 00:00:00.554149,0.15609787842999723,gbtree,0.36046659738628617,5.322388163671824,lossguide,0.0003443309636037687,0.3024423068401591,2,12,1.040002845059285,500,,0.9201142755037786,0.8861306715923076,0.09257859727176407,oversample,0.6434214541507642,,9.0,0.7844037581295402,,,,0.9037761235202126,,0.5567616463138851,0.5572139303482587,0.715281812899477,0.7156549520766773,0.9201142755037786,0.8861306715923076,0.1,0.5477969003503357,0.5490001402128449,0.5567616463138851,0.5572139303482587,1.0,1.0,oversample,0.5084861320645236,0.5140611112585066,0.6434214541507642,0.5,COMPLETE
2593,0.4249877029021151,2025-11-30 15:32:33.384315,2025-11-30 15:32:34.258908,0 days 00:00:00.874593,20.87608650149194,gbtree,0.5207961257822173,6.274963450126077,depthwise,0.00020722276597761528,0.004221222111660693,5,6,24.189560068110545,1000,,0.8272330758329312,0.8472871206416794,0.0293087827474106,undersample,0.7827655439058918,,6.0,0.7813656682190512,,,,0.6236942476638452,,0.47444595205789236,0.47127996381727727,0.4386473429951691,0.4249877029021151,0.8272330758329312,0.8472871206416794,0.08,0.5478439692675932,0.5547139719679582,0.5411203814064363,0.5393258426966292,0.3688058489033306,0.35064935064935066,undersample,0.4802752863940052,0.481008649164931,0.7827655439058918,0.5,COMPLETE
2594,0.2612942612942613,2025-11-30 15:32:35.029862,2025-11-30 15:32:56.316229,0 days 00:00:21.286367,0.0025475209317286033,dart,0.2823486610610017,8.497537002128077,lossguide,0.056321942030481374,0.009311894553857333,4,5,0.7895013685220876,400,forest,0.7289899326930385,0.29626017198327076,0.055551124081564776,undersample,0.5884699492553234,,9.0,0.8000170665843827,0.06751042506773647,uniform,0.8493099646806214,0.2005065402468735,,0.4491180461329715,0.4527363184079602,0.24814814814814815,0.2612942612942613,0.7289899326930385,0.29626017198327076,0.08,0.5528086200578388,0.5623607123866401,0.5167095115681234,0.5270935960591133,0.16328188464662877,0.1737012987012987,undersample,0.488044811750858,0.49998963625751164,0.5884699492553234,0.5,COMPLETE
2595,0.7156549520766773,2025-11-30 15:32:57.089075,2025-11-30 15:32:57.748668,0 days 00:00:00.659593,0.08139728462775835,gbtree,0.9636682418617446,3.2058278691221043,lossguide,12.839598782105748,0.00043080454302742074,6,7,0.42998215694243475,400,,0.9755351694592695,0.5229792523166791,0.06799998554620652,none,0.8113326318293465,4.564611817109567,7.0,0.7775036330700051,,,,0.21205702120043704,,0.5567616463138851,0.5572139303482587,0.715281812899477,0.7156549520766773,0.9755351694592695,0.5229792523166791,0.08,0.5930873898782258,0.6038465618595638,0.5567616463138851,0.5572139303482587,1.0,1.0,none,0.5585458147515708,0.5672876344799225,0.8113326318293465,0.5,COMPLETE
2596,0.3991150442477876,2025-11-30 15:32:58.560470,2025-11-30 15:32:59.408398,0 days 00:00:00.847928,0.021729451211544362,gbtree,0.24377154505165902,9.08838342063514,lossguide,1.7519431704198019,0.007851782090089424,8,3,11.015899498666128,1000,,0.8422928845661377,0.7806180417044422,0.03393566959411851,undersample,0.7241947672825075,,6.0,0.6310395837270073,,,,0.23767869809146475,,0.37630031659882407,0.3857982813206694,0.39491004826678366,0.3991150442477876,0.8422928845661377,0.7806180417044422,0.08,0.4821970195690446,0.49145241096513087,0.42938931297709926,0.438715953307393,0.3655564581640942,0.36607142857142855,undersample,0.35032908370496857,0.3633839028693472,0.7241947672825075,0.5,COMPLETE
2597,0.7156549520766773,2025-11-30 15:33:00.197785,2025-11-30 15:33:11.792799,0 days 00:00:11.595014,17.50628892836092,dart,0.49955636868568476,4.859145870822017,lossguide,0.005193118643055741,0.0001645001947795258,10,3,0.24768037039046598,300,forest,0.9960332540182387,0.5888049542817952,0.03007672726964067,undersample,0.7847122706146159,,8.0,0.9124185122915005,0.46496729098324413,uniform,0.765456087594691,0.23668376977920538,,0.5567616463138851,0.5572139303482587,0.715281812899477,0.7156549520766773,0.9960332540182387,0.5888049542817952,0.08,0.5567616463138851,0.5572139303482587,0.5567616463138851,0.5572139303482587,1.0,1.0,undersample,0.5,0.5,0.7847122706146159,0.5,COMPLETE
2598,0.7156549520766773,2025-11-30 15:33:12.565773,2025-11-30 15:33:13.145418,0 days 00:00:00.579645,0.6359109454922055,gbtree,0.8394819632253303,6.3222181708958605,depthwise,4.931324782224414,0.09566017864270991,6,8,0.20671481622325222,500,,0.5365330263334345,0.7743073862235814,0.021673747560879687,none,0.5700390554145884,1.2322259772527056,7.0,0.9167881807144482,,,,0.758174570739367,,0.5567616463138851,0.5572139303482587,0.715281812899477,0.7156549520766773,0.5365330263334345,0.7743073862235814,0.08,0.5799555728670776,0.5740938771238464,0.5567616463138851,0.5572139303482587,1.0,1.0,none,0.5416145824698686,0.5272392316570048,0.5700390554145884,0.5,COMPLETE
2599,0.0,2025-11-30 15:33:13.907725,2025-11-30 15:33:53.290395,0 days 00:00:39.382670,10.84170733584051,dart,0.5876492610551705,0.22390470107642613,depthwise,0.00017743272325453194,0.000891194213403845,1,12,0.25252801722854623,600,tree,0.6582125785208459,0.37891383364926107,0.0816885344399314,none,0.5451447657462554,0.5659578840193776,8.0,0.6584099272741932,0.34118941690325433,weighted,0.4565608512752577,0.44987842052678123,,0.44323835368611486,0.4427860696517413,0.0,0.0,0.6582125785208459,0.37891383364926107,0.08,0.6723683539406754,0.6558005686104261,0.0,0.0,0.0,0.0,none,0.6351531026708003,0.620832531870581,0.5451447657462554,0.5,COMPLETE
2600,0.47368421052631576,2025-11-30 15:33:54.065753,2025-11-30 15:33:56.148089,0 days 00:00:02.082336,1.1650937130407018,gbtree,0.8264116216354811,1.0583659116554611,depthwise,0.01703149373437747,0.0015661367903930122,1,11,0.5303295524883219,700,,0.5038239281688086,0.6852690069525457,0.049115972942233965,undersample,0.7019066462903941,,10.0,0.8018271706312634,,,,0.29247835727945415,,0.4654002713704206,0.44821347806422435,0.49872773536895676,0.47368421052631576,0.5038239281688086,0.6852690069525457,0.08,0.529528023646314,0.533351227676483,0.5217391304347826,0.505524861878453,0.4776604386677498,0.44561688311688313,undersample,0.4548305674828827,0.44924336388840985,0.7019066462903941,0.5,COMPLETE
