number,value,datetime_start,datetime_complete,duration,params_alpha,params_booster,params_colsample_bytree,params_gamma,params_grow_policy,params_lambda,params_learning_rate,params_max_delta_step,params_max_depth,params_min_child_weight,params_n_estimators,params_normalize_type,params_params_feature_fraction,params_params_labeled_ratio,params_params_missing_rate,params_params_resampling,params_params_sample_rows,params_params_scale_pos_weight,params_params_selftrain_max_iter,params_params_selftrain_threshold,params_rate_drop,params_sample_type,params_skip_drop,params_subsample,params_user_attrs_decision_threshold,user_attrs_acc_test,user_attrs_acc_val,user_attrs_f1_test,user_attrs_f1_val,user_attrs_feature_fraction,user_attrs_labeled_ratio,user_attrs_missing_rate,user_attrs_pr_auc_test,user_attrs_pr_auc_val,user_attrs_prec_test,user_attrs_prec_val,user_attrs_rec_test,user_attrs_rec_val,user_attrs_resampling_strategy,user_attrs_roc_auc_test,user_attrs_roc_auc_val,user_attrs_sample_rows,user_attrs_user_attrs_decision_threshold,state
1735,0.06194081211286993,2025-11-27 10:07:35.790750,2025-11-27 10:07:45.878495,0 days 00:00:10.087745,0.0006704232617817619,dart,0.884827997547045,6.325089742882501,lossguide,0.12239205197575,0.18274720467924035,7,6,1.2808066839951084,300,forest,0.9899320592111855,0.8071002539849497,0.04533040523767576,none,0.9289892895005605,0.7678449299790588,12.0,0.6932766235621225,0.43333028749857294,weighted,0.09368273892012031,0.7192556782326682,,0.39755766621438265,0.3835368611488014,0.07242339832869081,0.06194081211286993,0.9899320592111855,0.8071002539849497,0.05,0.47374797320927503,0.46114573131985237,0.25365853658536586,0.20361990950226244,0.04224207961007311,0.036525974025974024,none,0.39360276198212835,0.37490382446970805,0.9289892895005605,0.5,COMPLETE
1736,0.6748541602701873,2025-11-27 10:07:46.079287,2025-11-27 10:07:46.947874,0 days 00:00:00.868587,0.00042652494518732295,gbtree,0.6412559686089409,7.034304233584269,lossguide,0.01027591395020131,0.44756448679360494,5,12,0.9599181695070947,300,,0.9820255844228005,0.7396580606219121,0.05927595785429434,none,0.6171914762522865,1.3391498725544169,5.0,0.7247228158827073,,,,0.5141538455058592,,0.5332428765264586,0.5210312075983717,0.6820702402957486,0.6748541602701873,0.9820255844228005,0.7396580606219121,0.05,0.45065615596341774,0.45635589624410877,0.5493796526054591,0.542716049382716,0.8992688870836718,0.8920454545454546,none,0.33740570964372757,0.3349080694586313,0.6171914762522865,0.5,COMPLETE
1737,0.6982968369829684,2025-11-27 10:07:47.145024,2025-11-27 10:07:48.407641,0 days 00:00:01.262617,0.055732516795748706,gbtree,0.7612047616999023,3.01768552165938,depthwise,0.000977087900674966,0.4997827319500499,8,12,0.6451585567341808,300,,0.6743166149841464,0.2754947768824811,0.02814161142143904,none,0.9592633141980301,4.66222762210027,8.0,0.7360062233671174,,,,0.8926750078685981,,0.5445499773857982,0.5513342379014021,0.6960458798671899,0.6982968369829684,0.6743166149841464,0.2754947768824811,0.02,0.5334101112188899,0.5208737354408198,0.5537944284341979,0.5583657587548638,0.9366368805848904,0.9318181818181818,none,0.48600358096122287,0.4790072032155791,0.9592633141980301,0.5,COMPLETE
1738,0.7156549520766773,2025-11-27 10:07:48.604731,2025-11-27 10:09:33.772929,0 days 00:01:45.168198,0.015589821834350455,dart,0.419697688198435,3.0904958501240243,depthwise,0.000261530684883269,0.005717855437302292,2,12,14.386319618108498,900,forest,0.6332306380896915,0.8367078742370926,0.00737869831214143,oversample,0.5185151328025084,,5.0,0.8663296605110595,0.16541838124540337,weighted,0.7427723557941825,0.7583321826626381,,0.5567616463138851,0.5572139303482587,0.715281812899477,0.7156549520766773,0.6332306380896915,0.8367078742370926,0.0,0.4636484283521832,0.4626606735258483,0.5567616463138851,0.5572139303482587,1.0,1.0,oversample,0.39942969876821566,0.3983213224467055,0.5185151328025084,0.5,COMPLETE
1739,0.46296296296296297,2025-11-27 10:09:33.976831,2025-11-27 10:11:28.085800,0 days 00:01:54.108969,2.017968358037072,dart,0.7560704340837809,2.8423272884048876,depthwise,66.26400205471587,0.0002865296615868151,10,10,5.348479031649375,1000,forest,0.5582261405462208,0.37345751900763213,0.09115463022293835,undersample,0.5531009338095688,,5.0,0.8597950492304272,0.16596356739634333,weighted,0.03729251855944739,0.6886124718299353,,0.4251469923111714,0.4491180461329715,0.43435692033822876,0.46296296296296297,0.5582261405462208,0.37345751900763213,0.08,0.4690541148205647,0.47551618785055005,0.48031496062992124,0.5067567567567568,0.39642567018683994,0.42613636363636365,undersample,0.3321047265372436,0.35568903134659013,0.5531009338095688,0.5,COMPLETE
1740,0.0,2025-11-27 10:11:28.284922,2025-11-27 10:11:29.104410,0 days 00:00:00.819488,33.828698304028066,gbtree,0.6712107911882228,9.668005974515538,lossguide,40.4913491231298,0.0004251684443334555,3,9,20.244948165906724,900,,0.6505775994486382,0.7963256915618258,0.04444937233583467,undersample,0.5768332713863062,,11.0,0.830893424344115,,,,0.20624817232459458,,0.44323835368611486,0.4427860696517413,0.0,0.0,0.6505775994486382,0.7963256915618258,0.05,0.5567616463138851,0.5572139303482587,0.0,0.0,0.0,0.0,undersample,0.5,0.5,0.5768332713863062,0.5,COMPLETE
1741,0.7156549520766773,2025-11-27 10:11:29.299120,2025-11-27 10:12:15.996630,0 days 00:00:46.697510,56.43070319964645,dart,0.43480980166915484,1.3950519378682968,lossguide,6.750938648817193,0.09912426604101286,10,5,5.051983971483572,600,forest,0.7542549468453351,0.6257346686579168,0.08757651744100993,oversample,0.6687852680630149,,6.0,0.6133063813898777,0.06799634499580381,uniform,0.436643668187384,0.4769310981027727,,0.5567616463138851,0.5572139303482587,0.715281812899477,0.7156549520766773,0.7542549468453351,0.6257346686579168,0.08,0.5567616463138851,0.5572139303482587,0.5567616463138851,0.5572139303482587,1.0,1.0,oversample,0.5,0.5,0.6687852680630149,0.5,COMPLETE
1742,0.7156549520766773,2025-11-27 10:12:16.210636,2025-11-27 10:12:25.853557,0 days 00:00:09.642921,0.00036472388655969654,dart,0.577183773373824,3.650435474567474,depthwise,0.004037422864431131,0.001988230920042789,10,11,25.222753123337494,300,forest,0.6436464408873733,0.8157770798115531,0.00257377755831153,none,0.7518486525907582,1.493427134208028,12.0,0.699724468482537,0.2708165054274115,weighted,0.022451066830299096,0.424565272459307,,0.5567616463138851,0.5572139303482587,0.715281812899477,0.7156549520766773,0.6436464408873733,0.8157770798115531,0.0,0.6203635619751954,0.6125815270037209,0.5567616463138851,0.5572139303482587,1.0,1.0,none,0.5884625905601883,0.5835690739291353,0.7518486525907582,0.5,COMPLETE
1743,0.34460887949260044,2025-11-27 10:12:26.054148,2025-11-27 10:12:26.872353,0 days 00:00:00.818205,7.9154622547514695,gbtree,0.8627116420028684,7.785842640282813,lossguide,12.863133165765777,0.0033980898225559946,6,9,7.742031038636278,900,,0.5350867839324522,0.5505311270453727,0.060334759505620006,undersample,0.5573462627234522,,9.0,0.9372598055382105,,,,0.3328616708747344,,0.45409317051108095,0.4391677973767526,0.36640419947506564,0.34460887949260044,0.5350867839324522,0.5505311270453727,0.05,0.5219120132548908,0.5202512499358968,0.5178041543026706,0.49393939393939396,0.2835093419983753,0.26461038961038963,undersample,0.4409638753958122,0.44217736425984644,0.5573462627234522,0.5,COMPLETE
1744,0.34460887949260044,2025-11-27 10:12:27.074794,2025-11-27 10:12:57.231083,0 days 00:00:30.156289,0.0003266745100223719,dart,0.9239545706374586,9.14602694494837,lossguide,0.0007727238877514441,0.02215971878700033,0,9,72.23248301270094,500,forest,0.6302738191828413,0.5919631875527117,0.05778637242618545,undersample,0.8386062145569764,,8.0,0.7673754739460215,0.10990219892823594,uniform,0.13443857519104904,0.8477138622390636,,0.45409317051108095,0.4391677973767526,0.36640419947506564,0.34460887949260044,0.6302738191828413,0.5919631875527117,0.05,0.5457168333878788,0.5404708306166923,0.5178041543026706,0.49393939393939396,0.2835093419983753,0.26461038961038963,undersample,0.47593834446857547,0.4617229680431927,0.8386062145569764,0.5,COMPLETE
1745,0.48180677540777916,2025-11-27 10:12:57.430586,2025-11-27 10:13:13.094088,0 days 00:00:15.663502,0.3615753672394016,dart,0.5313768400767132,7.738629651893243,depthwise,0.02715209645357722,0.051695778754417235,8,6,64.65296948975022,400,tree,0.6264399436007886,0.8244793344767383,0.040850911789762606,undersample,0.8737881818248033,,5.0,0.7339986569376004,0.4192542954038124,uniform,0.28492596992695757,0.7971982527005632,,0.44821347806422435,0.4396200814111262,0.49503311258278143,0.48180677540777916,0.6264399436007886,0.8244793344767383,0.05,0.533278539585945,0.5304008341603531,0.5046413502109705,0.4969801553062985,0.48578391551584077,0.4675324675324675,undersample,0.44057552346690093,0.4318530039929427,0.8737881818248033,0.5,COMPLETE
1746,0.7156549520766773,2025-11-27 10:13:13.303431,2025-11-27 10:14:45.865424,0 days 00:01:32.561993,0.00028900857182324386,dart,0.74468809664891,2.4792722825366518,depthwise,0.01126172424503792,0.0005491239718730559,9,10,32.89180280433446,900,forest,0.6242426440680247,0.8985005881163437,0.03995204466363517,oversample,0.8463308231419517,,8.0,0.8428958489959906,0.39687562484632666,uniform,0.5982108510431964,0.24428505050749108,,0.5567616463138851,0.5572139303482587,0.715281812899477,0.7156549520766773,0.6242426440680247,0.8985005881163437,0.05,0.46735404574619954,0.47782728459145474,0.5567616463138851,0.5572139303482587,1.0,1.0,oversample,0.3848028813475025,0.39943646113845294,0.8463308231419517,0.5,COMPLETE
1747,0.7156549520766773,2025-11-27 10:14:46.065640,2025-11-27 10:16:41.681917,0 days 00:01:55.616277,0.012000657854649207,dart,0.2380966086798548,2.3985798314356552,lossguide,16.895963910633697,0.0010176159450975247,3,4,13.451575201557022,1000,tree,0.6896178772281955,0.7231502210736063,0.04582788935837623,oversample,0.6672721893328608,,6.0,0.8909562806840405,0.45876974312941016,weighted,0.6819608431062043,0.3446715199326553,,0.5567616463138851,0.5572139303482587,0.715281812899477,0.7156549520766773,0.6896178772281955,0.7231502210736063,0.05,0.46674626579091544,0.4610622172146627,0.5567616463138851,0.5572139303482587,1.0,1.0,oversample,0.36054684262007,0.3510709476937771,0.6672721893328608,0.5,COMPLETE
1748,0.7156549520766773,2025-11-27 10:16:41.884349,2025-11-27 10:16:42.884166,0 days 00:00:00.999817,0.001470439449262901,gbtree,0.9511719176820199,7.9973012895200934,lossguide,0.0009397779230710418,0.0002886529888236269,9,12,0.17459089217410229,1000,,0.621790135554285,0.32434260305292617,0.0566088448063145,oversample,0.8026952402510181,,10.0,0.7445326590484022,,,,0.9056287380206616,,0.5567616463138851,0.5572139303482587,0.715281812899477,0.7156549520766773,0.621790135554285,0.32434260305292617,0.05,0.5616311314494917,0.5585074776063994,0.5567616463138851,0.5572139303482587,1.0,1.0,oversample,0.4960058190619871,0.4904794516004935,0.8026952402510181,0.5,COMPLETE
1749,0.37877312560856863,2025-11-27 10:16:43.079206,2025-11-27 10:17:34.895445,0 days 00:00:51.816239,10.708258585598033,dart,0.5200351093480389,1.91173764997013,lossguide,0.38699504467196594,0.0003947674489039386,3,4,0.19019601802384434,700,tree,0.8671481012922249,0.7018825510870823,0.0243712226106518,undersample,0.7166324117502467,,5.0,0.8045690478174953,0.29783450221934754,uniform,0.15667425994829912,0.9150941216539659,,0.4097693351424695,0.4228855721393035,0.34190620272314676,0.37877312560856863,0.8671481012922249,0.7018825510870823,0.02,0.5209565684326543,0.5313946237214058,0.4507978723404255,0.4732360097323601,0.27538586515028435,0.3157467532467532,undersample,0.46027205358179013,0.47099851757027444,0.7166324117502467,0.5,COMPLETE
1750,0.7156549520766773,2025-11-27 10:17:35.096185,2025-11-27 10:17:35.501037,0 days 00:00:00.404852,4.0194364986988695,gbtree,0.7072728647172541,9.286424880696137,lossguide,2.085029320764586,0.0007758333429426453,9,6,6.080552524319319,200,,0.8499943823134306,0.6057832168216644,0.0795336225388004,none,0.6940495176034925,0.8107556697002672,8.0,0.6961081449371,,,,0.9607144882964982,,0.5567616463138851,0.5572139303482587,0.715281812899477,0.7156549520766773,0.8499943823134306,0.6057832168216644,0.08,0.5567616463138851,0.5572139303482587,0.5567616463138851,0.5572139303482587,1.0,1.0,none,0.5,0.5,0.6940495176034925,0.5,COMPLETE
1751,0.5758222981631781,2025-11-27 10:17:35.701893,2025-11-27 10:17:36.380802,0 days 00:00:00.678909,0.00025314784807531744,gbtree,0.5362074716787003,3.6772668506784956,depthwise,3.7705245503234495,0.01016400564886467,1,7,3.6790953262794757,500,,0.6149247638968407,0.4783670637520879,0.016822325458257025,undersample,0.9641041971646881,,12.0,0.8755776851088888,,,,0.22843077802747686,,0.561284486657621,0.5508819538670285,0.5889830508474576,0.5758222981631781,0.6149247638968407,0.4783670637520879,0.02,0.6197339254338781,0.604577738763778,0.6155890168290522,0.6077547339945897,0.5645816409423233,0.547077922077922,undersample,0.5839710538967822,0.5581509591021848,0.9641041971646881,0.5,COMPLETE
1752,0.7156549520766773,2025-11-27 10:17:36.576969,2025-11-27 10:18:49.449002,0 days 00:01:12.872033,63.82110189970078,dart,0.7979054252466149,0.39783298028444825,lossguide,0.00012106469354934353,0.010955950103411329,10,8,27.582335570455804,1000,tree,0.5998364169650985,0.8048403842548555,0.03677468090306375,oversample,0.9867593789900498,,12.0,0.8067004427693598,0.46679979781197734,uniform,0.008322396281575916,0.862856548458145,,0.5567616463138851,0.5572139303482587,0.715281812899477,0.7156549520766773,0.5998364169650985,0.8048403842548555,0.05,0.5996295292277274,0.6137602970271117,0.5567616463138851,0.5572139303482587,1.0,1.0,oversample,0.5708010742883669,0.5896778783014738,0.9867593789900498,0.5,COMPLETE
1753,0.7156549520766773,2025-11-27 10:18:49.646334,2025-11-27 10:18:50.531394,0 days 00:00:00.885060,0.045133071728336714,gbtree,0.8882249892146437,9.623967374499934,lossguide,0.0007646911007587632,0.0001267847678443686,5,3,67.8568557346479,1000,,0.5305987235517708,0.4680927916574019,0.07354093600258586,none,0.8242068511209142,1.1551288890960145,12.0,0.7363483969652672,,,,0.5952740223905459,,0.5567616463138851,0.5572139303482587,0.715281812899477,0.7156549520766773,0.5305987235517708,0.4680927916574019,0.08,0.5007100047314063,0.5061883145593746,0.5567616463138851,0.5572139303482587,1.0,1.0,none,0.20423374061241065,0.21566616478516373,0.8242068511209142,0.5,COMPLETE
1754,0.3788271925272444,2025-11-27 10:18:50.734900,2025-11-27 10:20:35.737276,0 days 00:01:45.002376,0.012854568020799966,dart,0.9396041688549868,8.14158700037487,lossguide,25.766000969684598,0.00010168523906603265,3,7,0.7178076357562369,900,forest,0.9820504698862312,0.5158763730148893,0.03207605619149589,undersample,0.8841805720488163,,6.0,0.9428825366652231,0.04895939939537075,uniform,0.4511126806074121,0.4351930023832387,,0.46494798733604703,0.45861601085481685,0.40463009562154,0.3788271925272444,0.9820504698862312,0.5158763730148893,0.02,0.5377241677521969,0.5311380705407254,0.5317460317460317,0.5251798561151079,0.32656376929325753,0.2962662337662338,undersample,0.4707915416369635,0.4541984764469443,0.8841805720488163,0.5,COMPLETE
1755,0.20182440136830102,2025-11-27 10:20:35.933186,2025-11-27 10:20:36.369323,0 days 00:00:00.436137,0.04042499094616994,gbtree,0.6913794653013485,8.865051551042045,lossguide,0.6517238033022593,0.0031001154388840954,5,5,1.9651341966541556,200,,0.813318375871275,0.8946428736237724,0.08965112620633213,undersample,0.9405838470340862,,7.0,0.8914059812377644,,,,0.9903981596878502,,0.3749434644957033,0.36680235187697874,0.21387940841865757,0.20182440136830102,0.813318375871275,0.8946428736237724,0.08,0.5267428192287701,0.524389000196064,0.3567362428842505,0.3390804597701149,0.15272136474411047,0.14366883116883117,undersample,0.40390009781329267,0.3944552319488479,0.9405838470340862,0.5,COMPLETE
1756,0.7156549520766773,2025-11-27 10:20:36.567147,2025-11-27 10:21:09.627435,0 days 00:00:33.060288,0.005980814933832687,dart,0.6094452480528296,9.567513987490006,lossguide,83.12543442517558,0.001479500545650217,10,5,2.9496473746857776,500,forest,0.864232747446509,0.4354454587078482,0.08726019267536066,oversample,0.6527364900621934,,12.0,0.8679106396163433,0.014717618530680598,weighted,0.09087865174848941,0.48117496619798805,,0.5567616463138851,0.5572139303482587,0.715281812899477,0.7156549520766773,0.864232747446509,0.4354454587078482,0.08,0.5567616463138851,0.5572139303482587,0.5567616463138851,0.5572139303482587,1.0,1.0,oversample,0.5,0.5,0.6527364900621934,0.5,COMPLETE
1757,0.7156549520766773,2025-11-27 10:21:09.822695,2025-11-27 10:21:15.012546,0 days 00:00:05.189851,0.7863501173292637,dart,0.7737481922384848,5.425058428622357,lossguide,0.0038147480061473424,0.00022701300477231967,8,11,1.3145444889328513,200,forest,0.5454629649101902,0.7474947543970911,0.06073648217266423,none,0.9300717501523246,2.116330251554564,9.0,0.6898598428521701,0.40534817300072784,weighted,0.6428159773666934,0.6435429819139291,,0.5567616463138851,0.5572139303482587,0.715281812899477,0.7156549520766773,0.5454629649101902,0.7474947543970911,0.05,0.5237081184045044,0.5157736887366745,0.5567616463138851,0.5572139303482587,1.0,1.0,none,0.44618320927071076,0.425851982542483,0.9300717501523246,0.5,COMPLETE
1758,0.7156549520766773,2025-11-27 10:21:15.214901,2025-11-27 10:21:15.943378,0 days 00:00:00.728477,0.04194133338965697,gbtree,0.21638927621594758,3.024312445516868,lossguide,2.8963853574925316,0.00692995032040251,8,12,0.6860791954813222,600,,0.9548706339931349,0.46924087120387753,0.0023128386675719927,oversample,0.87325542999133,,9.0,0.7009837510020125,,,,0.5350307878283922,,0.5567616463138851,0.5572139303482587,0.715281812899477,0.7156549520766773,0.9548706339931349,0.46924087120387753,0.0,0.6049288021171968,0.5927615513533528,0.5567616463138851,0.5572139303482587,1.0,1.0,oversample,0.5897975762197649,0.5745563489115584,0.87325542999133,0.5,COMPLETE
1759,0.7156549520766773,2025-11-27 10:21:16.144670,2025-11-27 10:21:16.944935,0 days 00:00:00.800265,0.01695143429945738,gbtree,0.6126834383212678,6.9737082571724995,depthwise,53.694312860503416,0.00029162786192737337,7,4,4.287591497920469,900,,0.6678361269896979,0.6677082216590107,0.08621976301852417,oversample,0.6901574685562453,,6.0,0.7007291632455362,,,,0.4772454817629573,,0.5567616463138851,0.5572139303482587,0.715281812899477,0.7156549520766773,0.6678361269896979,0.6677082216590107,0.08,0.44509464382144814,0.4480988233920726,0.5567616463138851,0.5572139303482587,1.0,1.0,oversample,0.11088670236575543,0.11363636363636365,0.6901574685562453,0.5,COMPLETE
1760,0.2923076923076923,2025-11-27 10:21:17.140793,2025-11-27 10:21:48.723853,0 days 00:00:31.583060,0.3868354279044417,dart,0.8675987455788141,7.558082877570287,depthwise,0.0022597724757873554,0.001545224906183851,3,5,0.10193254553646897,600,forest,0.7325947752357778,0.5456418443894246,0.07619133153738572,undersample,0.8944974540268633,,12.0,0.6829185788285999,0.4602435594186359,uniform,0.23635279624017222,0.2200876305417145,,0.3545906829488919,0.3342379014020805,0.3049196298100341,0.2923076923076923,0.7325947752357778,0.5456418443894246,0.08,0.4638469202530709,0.445289075495072,0.38077858880778587,0.3584905660377358,0.25426482534524775,0.24675324675324675,undersample,0.3876974916692916,0.3476977567886659,0.8944974540268633,0.5,COMPLETE
1761,0.6081481481481481,2025-11-27 10:21:48.921913,2025-11-27 10:21:54.858300,0 days 00:00:05.936387,0.000624001832312612,gbtree,0.825378469304602,0.13781904624582508,depthwise,71.51715004284408,0.06963494881903591,3,11,1.9112628810015337,400,,0.823219446198624,0.3302649119163715,0.03776908204064149,oversample,0.6159570217070847,,9.0,0.613084648860026,,,,0.8811381412737915,,0.5133423790140208,0.5214834916327453,0.6041206769683591,0.6081481481481481,0.823219446198624,0.3302649119163715,0.05,0.5803402121874248,0.5836965924418933,0.5521183591123067,0.5592643051771117,0.6669374492282697,0.6663961038961039,oversample,0.5144722226827368,0.5298185598875078,0.6159570217070847,0.5,COMPLETE
1762,0.7156549520766773,2025-11-27 10:21:55.056829,2025-11-27 10:21:55.658140,0 days 00:00:00.601311,0.8897079641976331,gbtree,0.38925136889058004,9.713928217354079,lossguide,0.00018939059254584497,0.02193519065547663,5,8,2.6911092723632963,500,,0.708233184948723,0.7851751986002862,0.05891236204917122,none,0.996088753348941,2.4176256187417158,10.0,0.7501143323947813,,,,0.9276463214302606,,0.5567616463138851,0.5572139303482587,0.715281812899477,0.7156549520766773,0.708233184948723,0.7851751986002862,0.05,0.5671159133943393,0.5630744128006648,0.5567616463138851,0.5572139303482587,1.0,1.0,none,0.5189600291782025,0.5111219538888078,0.996088753348941,0.5,COMPLETE
1763,0.7156549520766773,2025-11-27 10:21:55.855734,2025-11-27 10:21:56.883903,0 days 00:00:01.028169,0.03439950222405912,gbtree,0.3264183890330238,3.3565001754871835,lossguide,0.056636798004384,0.0002679402574303701,9,10,4.849917749782427,800,,0.8237762162966763,0.5941166857006163,0.04316172502868561,none,0.5122613246314665,2.6693757567735794,11.0,0.6600742858198633,,,,0.2838195233993509,,0.5567616463138851,0.5572139303482587,0.715281812899477,0.7156549520766773,0.8237762162966763,0.5941166857006163,0.05,0.6655964725336325,0.68147934420189,0.5567616463138851,0.5572139303482587,1.0,1.0,none,0.6601257481059036,0.6805264449544327,0.5122613246314665,0.5,COMPLETE
