number,value,datetime_start,datetime_complete,duration,params_alpha,params_booster,params_colsample_bytree,params_gamma,params_grow_policy,params_lambda,params_learning_rate,params_max_delta_step,params_max_depth,params_min_child_weight,params_n_estimators,params_normalize_type,params_params_feature_fraction,params_params_labeled_ratio,params_params_missing_rate,params_params_resampling,params_params_sample_rows,params_params_scale_pos_weight,params_params_selftrain_max_iter,params_params_selftrain_threshold,params_rate_drop,params_sample_type,params_skip_drop,params_subsample,params_user_attrs_decision_threshold,user_attrs_acc_test,user_attrs_acc_val,user_attrs_f1_test,user_attrs_f1_val,user_attrs_feature_fraction,user_attrs_labeled_ratio,user_attrs_missing_rate,user_attrs_pr_auc_test,user_attrs_pr_auc_val,user_attrs_prec_test,user_attrs_prec_val,user_attrs_rec_test,user_attrs_rec_val,user_attrs_resampling_strategy,user_attrs_roc_auc_test,user_attrs_roc_auc_val,user_attrs_sample_rows,user_attrs_user_attrs_decision_threshold,state
1327,0.7156549520766773,2025-11-27 02:32:08.651109,2025-11-27 02:32:09.568955,0 days 00:00:00.917846,30.51360607709989,gbtree,0.770358750835468,1.419587751285814,lossguide,0.02304802512945388,0.007276138449209005,8,6,2.8848995183746458,800,,0.7514551892946784,0.16917479152286932,0.0922797002100339,oversample,0.8121484987378523,,6.0,0.6687487169721243,,,,0.7113228966087678,0.23879537812784185,0.5567616463138851,0.5572139303482587,0.715281812899477,0.7156549520766773,0.7514551892946784,0.16917479152286932,0.1,0.5567616463138851,0.5572139303482587,0.5567616463138851,0.5572139303482587,1.0,1.0,oversample,0.5,0.5,0.8121484987378523,0.23879537812784185,COMPLETE
1328,0.7156549520766773,2025-11-27 02:32:09.745408,2025-11-27 02:33:14.936267,0 days 00:01:05.190859,0.011282321358424253,dart,0.6882239966943374,1.3425772563521399,lossguide,0.051982502519559264,0.003051278874989857,6,9,63.524192388898946,700,tree,0.790540045383245,0.1220592240274545,0.0935025741886654,oversample,0.8591811696593081,,6.0,0.6678374876944209,0.024108475259348255,weighted,0.6332472971312066,0.8040285448458312,0.43761318712185193,0.5567616463138851,0.5572139303482587,0.715281812899477,0.7156549520766773,0.790540045383245,0.1220592240274545,0.1,0.4909448984277048,0.489996374841962,0.5567616463138851,0.5572139303482587,1.0,1.0,oversample,0.3618329216333162,0.3651287425546874,0.8591811696593081,0.43761318712185193,COMPLETE
1329,0.7156549520766773,2025-11-27 02:33:15.120221,2025-11-27 02:34:28.179824,0 days 00:01:13.059603,0.319379408305398,dart,0.6438091919203471,2.9669826845839036,lossguide,3.7635661401581695,0.057673088983080725,8,6,54.057753395603974,800,tree,0.9913202761002241,0.06366323366658422,0.021757836947181287,oversample,0.660409550230879,,8.0,0.7420448220981107,0.18162916776672056,weighted,0.3778147749617659,0.37252841699332867,0.23798679897292954,0.5567616463138851,0.5572139303482587,0.715281812899477,0.7156549520766773,0.9913202761002241,0.06366323366658422,0.02,0.5567616463138851,0.5572139303482587,0.5567616463138851,0.5572139303482587,1.0,1.0,oversample,0.5,0.5,0.660409550230879,0.23798679897292954,COMPLETE
1330,0.7156549520766773,2025-11-27 02:34:28.354520,2025-11-27 02:34:29.245517,0 days 00:00:00.890997,0.04453157405808446,gbtree,0.9957249173204282,4.334647569908883,lossguide,0.42973529495827434,0.01022174059119223,6,7,63.46049917604415,700,,0.8876144347961544,0.6288475125844067,0.09384813663830295,oversample,0.8808423219572932,,10.0,0.9096024196964255,,,,0.7539966886058251,0.5127921868434565,0.5567616463138851,0.5572139303482587,0.715281812899477,0.7156549520766773,0.8876144347961544,0.6288475125844067,0.1,0.583435778633271,0.5909171367190174,0.5567616463138851,0.5572139303482587,1.0,1.0,oversample,0.5476935128234884,0.560493994003953,0.8808423219572932,0.5127921868434565,COMPLETE
1331,0.7156549520766773,2025-11-27 02:34:29.422028,2025-11-27 02:34:59.335646,0 days 00:00:29.913618,0.15538981904684435,dart,0.6589045555787056,5.301255298249401,lossguide,0.16977888969079297,0.01785031517471812,8,5,5.56658316125028,500,tree,0.9067664074662022,0.4201370503351376,0.00031241688985120947,oversample,0.6730022912062624,,7.0,0.8412446945902237,0.15042513015772696,weighted,0.318850988682714,0.28564622675992574,0.40493507108116383,0.5567616463138851,0.5572139303482587,0.715281812899477,0.7156549520766773,0.9067664074662022,0.4201370503351376,0.0,0.41064557856476447,0.4041599247156677,0.5567616463138851,0.5572139303482587,1.0,1.0,oversample,0.2360707239841509,0.2188366408872027,0.6730022912062624,0.40493507108116383,COMPLETE
1332,0.7156549520766773,2025-11-27 02:34:59.517705,2025-11-27 02:35:00.331545,0 days 00:00:00.813840,49.192906651689654,gbtree,0.7801936109568841,0.4808800376963085,lossguide,0.048906556227414986,0.017738017842786124,6,11,23.12080718648418,600,,0.8300361117045332,0.23727565819976715,0.0993017899528619,oversample,0.708864216182814,,7.0,0.6074872610031165,,,,0.6746287410820067,0.2919119814769965,0.5567616463138851,0.5572139303482587,0.715281812899477,0.7156549520766773,0.8300361117045332,0.23727565819976715,0.1,0.5567616463138851,0.5572139303482587,0.5567616463138851,0.5572139303482587,1.0,1.0,oversample,0.5,0.5,0.708864216182814,0.2919119814769965,COMPLETE
1333,0.458628841607565,2025-11-27 02:35:00.512893,2025-11-27 02:35:02.152140,0 days 00:00:01.639247,0.8445917992851436,gbtree,0.9084600514671045,5.093003193752544,lossguide,1.2601628861130856,0.338144799280889,10,10,2.2893884170292393,500,,0.9555517788666292,0.39313608535916483,0.06571614265378956,undersample,0.6181282711352853,,6.0,0.6863199364887448,,,,0.4527449385204264,0.6293020816653896,0.472636815920398,0.48213478064224335,0.45206766917293234,0.458628841607565,0.9555517788666292,0.39313608535916483,0.08,0.5430362981017967,0.5391901338614986,0.5362318840579711,0.549263873159683,0.39073923639317626,0.39366883116883117,undersample,0.48016835491304566,0.48086438586949315,0.6181282711352853,0.6293020816653896,COMPLETE
1334,0.7156549520766773,2025-11-27 02:35:02.331847,2025-11-27 02:35:04.660778,0 days 00:00:02.328931,5.216099314675005,gbtree,0.5593046026962869,0.1310304968628042,lossguide,0.050284505627506616,0.008155916050904828,8,8,33.89134543104694,700,,0.7865591696702632,0.15693114339284686,0.08189496729839352,none,0.7388285413923112,1.46836682872451,5.0,0.6746274033969696,,,,0.7735947490749817,0.3031835262539846,0.5567616463138851,0.5572139303482587,0.715281812899477,0.7156549520766773,0.7865591696702632,0.15693114339284686,0.08,0.6468177570419896,0.6490289890398019,0.5567616463138851,0.5572139303482587,1.0,1.0,none,0.6369866874450837,0.635551948051948,0.7388285413923112,0.3031835262539846,COMPLETE
1335,0.7156549520766773,2025-11-27 02:35:04.841108,2025-11-27 02:35:46.356144,0 days 00:00:41.515036,0.0750388628404024,dart,0.8101852508176893,3.363697475768528,lossguide,0.28070131173852747,0.39488749099317366,6,4,21.38323591436221,600,tree,0.7943728622473205,0.2000924304484442,0.006355421458825313,oversample,0.6703152124966584,,7.0,0.7800184089622738,0.22453556833188926,weighted,0.38619797896611296,0.2320969866332802,0.10048140644432568,0.5567616463138851,0.5572139303482587,0.715281812899477,0.7156549520766773,0.7943728622473205,0.2000924304484442,0.0,0.44458052768913653,0.45572835908676473,0.5567616463138851,0.5572139303482587,1.0,1.0,oversample,0.31783393292329115,0.33746791385325603,0.6703152124966584,0.10048140644432568,COMPLETE
1336,0.7156549520766773,2025-11-27 02:35:46.543430,2025-11-27 02:35:48.181992,0 days 00:00:01.638562,0.00016114788107936373,gbtree,0.5426153816996289,1.3830669029828693,depthwise,0.06916401971977605,0.003072822711384575,8,12,0.28711700298133,400,,0.9148938298476744,0.531863710151638,0.08433700475040853,undersample,0.6114117086240863,,10.0,0.6809457535049792,,,,0.27891517963774387,0.16419845902814922,0.5567616463138851,0.5572139303482587,0.715281812899477,0.7156549520766773,0.9148938298476744,0.531863710151638,0.08,0.5450348640032026,0.5511472368181455,0.5567616463138851,0.5572139303482587,1.0,1.0,undersample,0.5030943815381554,0.5159618216308717,0.6114117086240863,0.16419845902814922,COMPLETE
1337,0.7156549520766773,2025-11-27 02:35:48.363380,2025-11-27 02:35:49.373316,0 days 00:00:01.009936,1.3094596738465318,gbtree,0.8554755042912829,0.10679811055829713,lossguide,0.08062535489926809,0.1523185036770048,8,7,81.41874337341615,700,,0.6963214016589989,0.7389888334004285,0.02695433747371244,oversample,0.7176050893211123,,6.0,0.7680556119071448,,,,0.28499668809868894,0.441444013917372,0.5567616463138851,0.5572139303482587,0.715281812899477,0.7156549520766773,0.6963214016589989,0.7389888334004285,0.02,0.48717854430904717,0.4647316881368472,0.5567616463138851,0.5572139303482587,1.0,1.0,oversample,0.3962474510519073,0.3542269145563324,0.7176050893211123,0.441444013917372,COMPLETE
1338,0.0,2025-11-27 02:35:49.554567,2025-11-27 02:35:50.696344,0 days 00:00:01.141777,4.870224743924042,gbtree,0.7574239329359848,1.7227920993233712,lossguide,0.040272552200527334,0.0015250624465501282,2,8,25.678839183840232,800,,0.8114706562687368,0.235057568153206,0.08418748965369088,oversample,0.7211013384385279,,8.0,0.6427643304641598,,,,0.8060147870614169,0.8650543392073018,0.44323835368611486,0.4427860696517413,0.0,0.0,0.8114706562687368,0.235057568153206,0.08,0.5351419876356427,0.5422551745972436,0.0,0.0,0.0,0.0,oversample,0.5077131583746415,0.5060976115304512,0.7211013384385279,0.8650543392073018,COMPLETE
1339,0.7156549520766773,2025-11-27 02:35:50.878454,2025-11-27 02:35:51.940170,0 days 00:00:01.061716,8.317176208141849,gbtree,0.802151308808868,4.735320448612865,lossguide,0.015119858019738378,0.007359110291441221,7,11,3.8097906688455896,900,,0.9111723419512583,0.42989400785751053,0.0845345872744303,none,0.7013385886232478,3.266614742290459,10.0,0.684127475423712,,,,0.8523786196387518,0.28718631964178637,0.5567616463138851,0.5572139303482587,0.715281812899477,0.7156549520766773,0.9111723419512583,0.42989400785751053,0.08,0.5261302230666554,0.5127233787323132,0.5567616463138851,0.5572139303482587,1.0,1.0,none,0.45890183855833155,0.45053675895095713,0.7013385886232478,0.28718631964178637,COMPLETE
1340,0.7156549520766773,2025-11-27 02:35:52.123053,2025-11-27 02:35:53.133040,0 days 00:00:01.009987,22.077829912843974,gbtree,0.5483921441270593,4.679528090432765,depthwise,0.00021038211728390474,0.21652084448837225,6,11,0.17570213759498893,900,,0.7777612339989692,0.898899961648652,0.000805085835090362,oversample,0.9276845262715774,,8.0,0.6880687322012768,,,,0.40676580366990095,0.5015626221068542,0.5567616463138851,0.5572139303482587,0.715281812899477,0.7156549520766773,0.7777612339989692,0.898899961648652,0.0,0.4330981959733859,0.4241771452762751,0.5567616463138851,0.5572139303482587,1.0,1.0,oversample,0.2978592980652862,0.27596946592733107,0.9276845262715774,0.5015626221068542,COMPLETE
1341,0.7156549520766773,2025-11-27 02:35:53.319551,2025-11-27 02:35:54.131886,0 days 00:00:00.812335,3.245515340021016,gbtree,0.32539673493758364,2.014200241473438,lossguide,0.04250110080489947,0.014724527815738735,9,9,15.241017033134787,500,,0.771171783673745,0.2989269103835488,0.07049118849701153,oversample,0.7878655769473047,,7.0,0.7921630469117272,,,,0.718240476652527,0.27166146886029385,0.5567616463138851,0.5572139303482587,0.715281812899477,0.7156549520766773,0.771171783673745,0.2989269103835488,0.08,0.569787041460588,0.5861533735624805,0.5567616463138851,0.5572139303482587,1.0,1.0,oversample,0.4978323579634941,0.5157562049799027,0.7878655769473047,0.27166146886029385,COMPLETE
1342,0.7156549520766773,2025-11-27 02:35:54.313728,2025-11-27 02:37:30.563968,0 days 00:01:36.250240,0.016905258127541112,dart,0.7751522313884698,2.281974900297314,depthwise,12.00451023843981,0.023090397342752766,0,5,0.7728645938955384,700,tree,0.8218099370220917,0.8420177571403117,0.01499636015238176,none,0.8290793692833751,2.0229930361129513,6.0,0.6325883568350364,0.13431918038588186,weighted,0.6074415898749748,0.33476164130005354,0.5298655686672954,0.5567616463138851,0.5572139303482587,0.715281812899477,0.7156549520766773,0.8218099370220917,0.8420177571403117,0.02,0.5125700601810468,0.5179766551249195,0.5567616463138851,0.5572139303482587,1.0,1.0,none,0.4415951027039573,0.45570785190294893,0.8290793692833751,0.5298655686672954,COMPLETE
1343,0.0,2025-11-27 02:37:30.745199,2025-11-27 02:37:31.819805,0 days 00:00:01.074606,0.00029018143124200156,gbtree,0.6088220419740756,5.783612390422748,lossguide,0.0013299940277294157,0.018161231049319312,5,11,0.29229785000360253,1000,,0.5862786760084294,0.26025177443054986,0.04991941141269449,oversample,0.8325596041695081,,5.0,0.6541312600075986,,,,0.7610863216463728,0.6656158117343197,0.44323835368611486,0.4427860696517413,0.0,0.0,0.5862786760084294,0.26025177443054986,0.05,0.5532440946693883,0.5492769971255804,0.0,0.0,0.0,0.0,oversample,0.5513345711964721,0.5462442626321584,0.8325596041695081,0.6656158117343197,COMPLETE
1344,0.715281812899477,2025-11-27 02:37:31.999019,2025-11-27 02:40:24.988293,0 days 00:02:52.989274,21.022921247149924,dart,0.8634491530314732,0.10282455943260782,lossguide,0.0797416448577366,0.020878761284703038,1,4,1.2593444547637036,800,forest,0.7287752551840426,0.7658377653677082,0.07596309922450963,none,0.6731866057131605,1.405691439727722,7.0,0.6044539984670467,0.007637750372204571,uniform,0.3610369485237702,0.47590531055411134,0.6597031712176602,0.5563093622795116,0.5567616463138851,0.7149084568439407,0.715281812899477,0.7287752551840426,0.7658377653677082,0.08,0.5140192948512567,0.5203418307478828,0.5565610859728507,0.5570135746606335,0.9991876523151909,0.9991883116883117,none,0.3969147366501433,0.3944374063117679,0.6731866057131605,0.6597031712176602,COMPLETE
1345,0.715281812899477,2025-11-27 02:40:25.160008,2025-11-27 02:41:21.551941,0 days 00:00:56.391933,0.33574155787667415,dart,0.9202638064293533,2.3732598039787107,depthwise,0.06688100013656709,0.33806515329476844,3,4,1.5515049259711888,400,forest,0.9690233168173166,0.8739755364776103,0.08724084617185125,oversample,0.8245019282782826,,5.0,0.6725487720201763,0.15505351636071035,uniform,0.18359312842095554,0.2768456398217638,0.24778560243272307,0.5567616463138851,0.5567616463138851,0.715281812899477,0.715281812899477,0.9690233168173166,0.8739755364776103,0.08,0.5186365606185648,0.5056667635670993,0.5567616463138851,0.5570135746606335,1.0,0.9991883116883117,oversample,0.42890382798123317,0.4245428345913535,0.8245019282782826,0.24778560243272307,COMPLETE
1346,0.7156549520766773,2025-11-27 02:41:21.728442,2025-11-27 02:42:28.059224,0 days 00:01:06.330782,0.06842374217170248,dart,0.9491997060105513,3.4405022345857814,lossguide,0.34177224700789693,0.03951896534307491,8,12,22.414190221482556,600,forest,0.892140194016763,0.21950159268513178,0.07212414304505738,none,0.5212519239407551,2.5387827394440876,5.0,0.6825755834699467,0.12349508967887518,uniform,0.2649916179435488,0.3668646924933505,0.5242039835590916,0.5567616463138851,0.5572139303482587,0.715281812899477,0.7156549520766773,0.892140194016763,0.21950159268513178,0.08,0.4475457903952034,0.4396105743697291,0.5567616463138851,0.5572139303482587,1.0,1.0,none,0.3297708847958355,0.32199608996723394,0.5212519239407551,0.5242039835590916,COMPLETE
1347,0.0,2025-11-27 02:42:28.243390,2025-11-27 02:44:51.581840,0 days 00:02:23.338450,0.09453348657774927,dart,0.8130472335505455,4.005806072682077,lossguide,0.013609164568881272,0.005848431470631891,3,6,0.10251087781191123,600,tree,0.9648353889207072,0.89133498106361,0.08725305461439135,oversample,0.804186387715341,,5.0,0.6039945034666843,0.14935108634792538,uniform,0.7736705066253907,0.21164980496022004,0.6909686190591553,0.44323835368611486,0.4423337856173677,0.0,0.0,0.9648353889207072,0.89133498106361,0.08,0.4539703297225295,0.4424877117523595,0.0,0.0,0.0,0.0,oversample,0.361771581093851,0.3406180770200178,0.804186387715341,0.6909686190591553,COMPLETE
1348,0.7156549520766773,2025-11-27 02:44:51.766697,2025-11-27 02:44:52.795013,0 days 00:00:01.028316,0.5838192425877675,gbtree,0.6070012214550572,5.530703566385011,lossguide,23.54716828048295,0.2335533797766628,10,5,7.222104912557639,900,,0.9505630217710739,0.34678796247317206,0.004281417185748622,oversample,0.6824389431774992,,8.0,0.8323436899796867,,,,0.565441626106022,0.2188678417832083,0.5567616463138851,0.5572139303482587,0.715281812899477,0.7156549520766773,0.9505630217710739,0.34678796247317206,0.0,0.43407159431504877,0.4270345873171868,0.5567616463138851,0.5572139303482587,1.0,1.0,oversample,0.3129755964124074,0.29692495323879387,0.6824389431774992,0.2188678417832083,COMPLETE
1349,0.7156549520766773,2025-11-27 02:44:52.973866,2025-11-27 02:44:53.932913,0 days 00:00:00.959047,41.17380412507597,gbtree,0.9021277778311076,2.6656100236318494,lossguide,0.0001803953881849848,0.012053466212637929,6,10,7.018574888151753,800,,0.8737240917377843,0.38185451569512385,0.06802737093582223,oversample,0.9783914206159808,,8.0,0.6368896726658186,,,,0.639672051243458,0.4640002332274252,0.5567616463138851,0.5572139303482587,0.715281812899477,0.7156549520766773,0.8737240917377843,0.38185451569512385,0.08,0.5567616463138851,0.5572139303482587,0.5567616463138851,0.5572139303482587,1.0,1.0,oversample,0.5,0.5,0.9783914206159808,0.4640002332274252,COMPLETE
1350,0.7156549520766773,2025-11-27 02:44:54.141647,2025-11-27 02:44:55.089498,0 days 00:00:00.947851,1.0734914625597365,gbtree,0.4649679440680649,0.27983455296125426,lossguide,0.05048311883102383,0.003061150525908979,9,3,2.2019100038302444,400,,0.9782016399912964,0.299604400758615,0.026912748826253545,oversample,0.6352805102026746,,6.0,0.7674975977892012,,,,0.28325711346236404,0.23839923424076837,0.5567616463138851,0.5572139303482587,0.715281812899477,0.7156549520766773,0.9782016399912964,0.299604400758615,0.02,0.5869543759499425,0.5622556955315057,0.5567616463138851,0.5572139303482587,1.0,1.0,oversample,0.542439778510917,0.5090189432630698,0.6352805102026746,0.23839923424076837,COMPLETE
1351,0.4502868068833652,2025-11-27 02:44:55.282497,2025-11-27 02:44:56.314234,0 days 00:00:01.031737,0.02795310552574876,gbtree,0.5611848491592457,1.1199588146540682,lossguide,0.00895221269141769,0.0024557815499604645,3,4,2.0793019853847334,300,,0.9605279780649695,0.5126331842872344,0.0795544704475906,oversample,0.8814915436227145,,5.0,0.730441897658775,,,,0.46310640220273686,0.5590053381322005,0.47535052012663953,0.4798733604703754,0.4346978557504873,0.4502868068833652,0.9605279780649695,0.5126331842872344,0.08,0.5566109992844711,0.5556201263798606,0.5432399512789281,0.5476744186046512,0.36230706742485785,0.3823051948051948,oversample,0.49830691821814016,0.5060296253797275,0.8814915436227145,0.5590053381322005,COMPLETE
1352,0.02482544608223429,2025-11-27 02:44:56.501057,2025-11-27 02:44:58.944818,0 days 00:00:02.443761,0.3362700842095994,gbtree,0.8167392590574837,2.1181504185451834,depthwise,8.429952344221899,0.0541412007038272,8,6,1.9284749251078779,500,,0.7871997016213308,0.5416708346005653,0.015953710395199435,undersample,0.6637911231163507,,7.0,0.7185481363323312,,,,0.3303663922963847,0.6796633966880279,0.431026684758028,0.4314789687924016,0.023291925465838508,0.02482544608223429,0.7871997016213308,0.5416708346005653,0.02,0.49561388547133944,0.4977273524112049,0.2631578947368421,0.2807017543859649,0.012185215272136474,0.012987012987012988,undersample,0.42454118934332463,0.43159183768223597,0.6637911231163507,0.6796633966880279,COMPLETE
1353,0.7156549520766773,2025-11-27 02:44:59.127388,2025-11-27 02:47:06.772533,0 days 00:02:07.645145,0.01886705561430402,dart,0.7449856826103923,4.263236368663698,lossguide,0.19060424849757776,0.20686840868511644,10,3,33.62187116725077,1000,tree,0.9841827523931214,0.3518174004504402,0.0018969884626960339,undersample,0.5658836702153925,,9.0,0.7660360466011583,0.07092397810574441,uniform,0.5112875334156743,0.4313193651856594,0.21041191151155508,0.5567616463138851,0.5572139303482587,0.715281812899477,0.7156549520766773,0.9841827523931214,0.3518174004504402,0.0,0.4508078661746189,0.4459888610258692,0.5567616463138851,0.5572139303482587,1.0,1.0,undersample,0.365015583812729,0.3516343207354443,0.5658836702153925,0.21041191151155508,COMPLETE
1354,0.6457178065311152,2025-11-27 02:47:06.950143,2025-11-27 02:48:49.504839,0 days 00:01:42.554696,0.009756641237018845,dart,0.5630378732073822,5.261121384363137,lossguide,42.14115579393181,0.36304020925661346,10,4,4.990749100330269,900,tree,0.9308147292435441,0.34460043175072114,0.01713416571409415,oversample,0.6649911107107741,,10.0,0.8018472549114677,0.2638980072708189,uniform,0.823274713150093,0.2679305308093024,0.4967604646254076,0.4730890999547716,0.4798733604703754,0.6385355259075396,0.6457178065311152,0.9308147292435441,0.34460043175072114,0.02,0.4124004278816432,0.41616358645365176,0.516566265060241,0.5203574975173784,0.8359057676685622,0.8506493506493507,oversample,0.23859646214294006,0.2438974138731544,0.6649911107107741,0.4967604646254076,COMPLETE
1355,0.7149505526468877,2025-11-27 02:48:49.685254,2025-11-27 02:52:48.872341,0 days 00:03:59.187087,0.0627837067535586,dart,0.8634847802347668,4.008156844000487,lossguide,0.007700806433327527,0.0843084143928334,0,6,0.15326406319624208,700,tree,0.7829256476947236,0.629964505477651,0.05848222141955901,none,0.6739778561925714,1.7183172654185346,7.0,0.6609189333618593,0.18352943003735295,weighted,0.360668873496643,0.3364651025007676,0.2588158821111647,0.5554047942107644,0.5567616463138851,0.7136615205359743,0.7149505526468877,0.7829256476947236,0.629964505477651,0.05,0.5247081175434964,0.5373863560824201,0.5563124432334242,0.557116953762466,0.9951259138911455,0.997564935064935,none,0.47534856347087984,0.4870104997147898,0.6739778561925714,0.2588158821111647,COMPLETE
