number,value,datetime_start,datetime_complete,duration,params_alpha,params_booster,params_colsample_bytree,params_gamma,params_grow_policy,params_lambda,params_learning_rate,params_max_delta_step,params_max_depth,params_min_child_weight,params_n_estimators,params_normalize_type,params_params_feature_fraction,params_params_labeled_ratio,params_params_missing_rate,params_params_resampling,params_params_sample_rows,params_params_scale_pos_weight,params_params_selftrain_max_iter,params_params_selftrain_threshold,params_rate_drop,params_sample_type,params_skip_drop,params_subsample,params_user_attrs_decision_threshold,user_attrs_acc_test,user_attrs_acc_val,user_attrs_f1_test,user_attrs_f1_val,user_attrs_feature_fraction,user_attrs_labeled_ratio,user_attrs_missing_rate,user_attrs_pr_auc_test,user_attrs_pr_auc_val,user_attrs_prec_test,user_attrs_prec_val,user_attrs_rec_test,user_attrs_rec_val,user_attrs_resampling_strategy,user_attrs_roc_auc_test,user_attrs_roc_auc_val,user_attrs_sample_rows,user_attrs_user_attrs_decision_threshold,state
580,0.7156549520766773,2025-11-26 20:05:20.386502,2025-11-26 20:05:49.895881,0 days 00:00:29.509379,0.39102566079299667,dart,0.8593897603552354,5.982714353507495,lossguide,0.03058689406629211,0.05120563187786611,0,8,0.6597538116917855,500,forest,0.9660774475993795,0.7158327798520902,0.09896668367015862,oversample,0.7999994089813269,,5.0,0.6467674211695745,0.38099543896107996,weighted,0.7022810131744628,0.23551899679204702,0.24573564919884555,0.5567616463138851,0.5572139303482587,0.715281812899477,0.7156549520766773,0.9660774475993795,0.7158327798520902,0.1,0.5112527751265916,0.5068911662296042,0.5567616463138851,0.5572139303482587,1.0,1.0,oversample,0.4348455710472654,0.42549712799968165,0.7999994089813269,0.24573564919884555,COMPLETE
581,0.7149084568439407,2025-11-26 20:05:50.069908,2025-11-26 20:06:15.933696,0 days 00:00:25.863788,0.0001026122522509733,gbtree,0.7151537250383093,1.0862564314463756,lossguide,0.00037571240781247617,0.003969743374910513,5,9,0.11400485017762792,300,,0.7929600468837569,0.7992605285567059,0.07173220292277532,undersample,0.7256281796069055,,12.0,0.610354249236757,,,,0.4750069415404157,0.2500921253486686,0.5563093622795116,0.5563093622795116,0.7149084568439407,0.7149084568439407,0.7929600468837569,0.7992605285567059,0.08,0.5052110277357806,0.49822409659767397,0.5565610859728507,0.5568130375735627,0.9991876523151909,0.9983766233766234,undersample,0.4479724464928132,0.43076688378016265,0.7256281796069055,0.2500921253486686,COMPLETE
582,0.7156549520766773,2025-11-26 20:06:16.119972,2025-11-26 20:06:16.880483,0 days 00:00:00.760511,2.295810417077259,gbtree,0.8926751903373007,2.1701470562433953,lossguide,17.37249657958389,0.0004265255366630098,5,12,0.2664742751958738,500,,0.7392053568437364,0.18784819942361253,0.09364043089283451,oversample,0.665455082521702,,8.0,0.7945399176542456,,,,0.5363501581050728,0.1146723720989993,0.5567616463138851,0.5572139303482587,0.715281812899477,0.7156549520766773,0.7392053568437364,0.18784819942361253,0.1,0.5144465919042596,0.49744881821673725,0.5567616463138851,0.5572139303482587,1.0,1.0,oversample,0.4468185812099007,0.4273783545361687,0.665455082521702,0.1146723720989993,COMPLETE
583,0.7156549520766773,2025-11-26 20:06:17.056358,2025-11-26 20:06:59.689308,0 days 00:00:42.632950,0.2206358890605724,dart,0.3654182488897044,7.81391791453571,depthwise,1.3308068994061035,0.0005784774015306476,4,4,0.10838275498711454,600,forest,0.7695047962745315,0.09321674139074841,0.08684206426147678,oversample,0.8893274595300653,,12.0,0.660983830597359,0.1275480062394136,uniform,0.20995861732771115,0.8997159944034592,0.1679047068379791,0.5567616463138851,0.5572139303482587,0.715281812899477,0.7156549520766773,0.7695047962745315,0.09321674139074841,0.08,0.5567616463138851,0.5572139303482587,0.5567616463138851,0.5572139303482587,1.0,1.0,oversample,0.5,0.5,0.8893274595300653,0.1679047068379791,COMPLETE
584,0.7156549520766773,2025-11-26 20:06:59.865469,2025-11-26 20:07:00.560783,0 days 00:00:00.695314,3.2885977861843925,gbtree,0.423755300454408,5.546388520462802,lossguide,5.636624016543717,0.004525430170835371,4,8,32.983566182618056,400,,0.5063399632937345,0.30006008239880233,0.0988073173186453,none,0.8940826337662581,1.726024000054143,12.0,0.9080886607475813,,,,0.2593962539946585,0.1486873828571919,0.5567616463138851,0.5572139303482587,0.715281812899477,0.7156549520766773,0.5063399632937345,0.30006008239880233,0.1,0.7391976545120531,0.7094115556010494,0.5567616463138851,0.5572139303482587,1.0,1.0,none,0.7165698204545831,0.6977783452502555,0.8940826337662581,0.1486873828571919,COMPLETE
585,0.7100175746924429,2025-11-26 20:07:00.746874,2025-11-26 20:07:44.440996,0 days 00:00:43.694122,2.5648509604101726,dart,0.9899599498482243,1.659049639592948,lossguide,0.9912290395914654,0.002112964932433686,8,9,0.20774696768394849,600,forest,0.7369420108064966,0.3947926408612114,0.08927019782514645,oversample,0.9615073649820975,,5.0,0.8619539299213419,0.48553893149161065,uniform,0.6661472334369762,0.676859053278334,0.5034782304359736,0.5517865219357757,0.5522388059701493,0.7087863649720835,0.7100175746924429,0.7369420108064966,0.3947926408612114,0.08,0.4716536039324954,0.46455969179682155,0.5552486187845304,0.5554537121906508,0.9796913078797725,0.9837662337662337,oversample,0.413191531689849,0.3976713085178356,0.9615073649820975,0.5034782304359736,COMPLETE
586,0.7156549520766773,2025-11-26 20:07:44.620002,2025-11-26 20:08:01.165421,0 days 00:00:16.545419,0.004846685603305548,gbtree,0.8243750346327063,0.2895959495780148,depthwise,0.0006226887996862854,0.004522122742576652,3,12,0.11411477010329167,300,,0.9126153082003439,0.7910863617587075,0.05327632000557228,undersample,0.7769315671724244,,11.0,0.6852045898743336,,,,0.647837788722703,0.021433545930927084,0.5567616463138851,0.5572139303482587,0.715281812899477,0.7156549520766773,0.9126153082003439,0.7910863617587075,0.05,0.5717531898941354,0.558621723748693,0.5567616463138851,0.5572139303482587,1.0,1.0,undersample,0.526084649944462,0.5111165647427138,0.7769315671724244,0.021433545930927084,COMPLETE
587,0.7156549520766773,2025-11-26 20:08:01.352825,2025-11-26 20:08:18.795394,0 days 00:00:17.442569,0.5843789546120284,dart,0.41979405694405886,5.202764992289451,depthwise,14.655640237856717,0.05265677316604817,5,7,62.99335161989536,400,tree,0.5015925782603661,0.2437136271135693,0.09995920156773694,none,0.905502235073657,0.5037996000736809,12.0,0.7281791562567905,0.3833932300092414,weighted,0.5114646109093841,0.22424284210124923,0.25069208582874364,0.5567616463138851,0.5572139303482587,0.715281812899477,0.7156549520766773,0.5015925782603661,0.2437136271135693,0.1,0.5567616463138851,0.5572139303482587,0.5567616463138851,0.5572139303482587,1.0,1.0,none,0.5,0.5,0.905502235073657,0.25069208582874364,COMPLETE
588,0.7156549520766773,2025-11-26 20:08:18.967057,2025-11-26 20:08:19.491614,0 days 00:00:00.524557,0.009751201601282235,gbtree,0.6118241991001558,9.660168179594567,lossguide,47.006458973448225,0.0008768977165554046,1,4,7.804975267793584,200,,0.811711389491045,0.456043535276293,0.016598509204864824,oversample,0.8141830657219341,,11.0,0.7663072097113335,,,,0.2703594049515583,0.16854681320051487,0.5567616463138851,0.5572139303482587,0.715281812899477,0.7156549520766773,0.811711389491045,0.456043535276293,0.02,0.5567616463138851,0.5572139303482587,0.5567616463138851,0.5572139303482587,1.0,1.0,oversample,0.5,0.5,0.8141830657219341,0.16854681320051487,COMPLETE
589,0.0,2025-11-26 20:08:19.667719,2025-11-26 20:09:21.564698,0 days 00:01:01.896979,54.34762726262894,dart,0.6836889775157909,2.5691431426757787,depthwise,66.70576888496386,0.0032370996256022816,7,8,0.9420020131142368,700,forest,0.8480021056998274,0.29003588412917614,0.058781471004019745,undersample,0.9764404431567537,,10.0,0.9170005866237091,0.0390116660887284,uniform,0.027839974563064307,0.47603021671857715,0.5663906069120779,0.44323835368611486,0.4427860696517413,0.0,0.0,0.8480021056998274,0.29003588412917614,0.05,0.5567616463138851,0.5572139303482587,0.0,0.0,0.0,0.0,undersample,0.5,0.5,0.9764404431567537,0.5663906069120779,COMPLETE
590,0.7156549520766773,2025-11-26 20:09:21.734358,2025-11-26 20:10:11.239760,0 days 00:00:49.505402,0.000726454874192999,dart,0.9377032271931779,2.954936106167433,depthwise,0.3960691862805193,0.0010213978351894764,0,12,57.30436960325767,700,tree,0.6139099516223512,0.11606330021398338,0.061266862503885106,none,0.5890762019317338,1.2145441771294498,5.0,0.8913070212016125,0.431556211659929,weighted,0.3963575641781002,0.8453039828481896,0.2575144916020254,0.5567616463138851,0.5572139303482587,0.715281812899477,0.7156549520766773,0.6139099516223512,0.11606330021398338,0.05,0.5567616463138851,0.5572139303482587,0.5567616463138851,0.5572139303482587,1.0,1.0,none,0.5,0.5,0.5890762019317338,0.2575144916020254,COMPLETE
591,0.7156549520766773,2025-11-26 20:10:11.420265,2025-11-26 20:12:14.572702,0 days 00:02:03.152437,0.009265464488572513,dart,0.9723834690343106,2.2513733374538694,lossguide,0.25724035637099957,0.39119089542689517,0,3,2.2318233850088207,500,forest,0.9908557477117628,0.6113071529368553,0.08079362834920156,oversample,0.6425498584368246,,7.0,0.7444419881838361,0.33798823546879964,uniform,0.7366562732091547,0.4129686857062298,0.19883322192334038,0.5567616463138851,0.5572139303482587,0.715281812899477,0.7156549520766773,0.9908557477117628,0.6113071529368553,0.08,0.5127342137549915,0.4903284187089372,0.5567616463138851,0.5572139303482587,1.0,1.0,oversample,0.4460045756726736,0.4057761696934322,0.6425498584368246,0.19883322192334038,COMPLETE
592,0.02177068214804064,2025-11-26 20:12:14.730810,2025-11-26 20:12:26.512177,0 days 00:00:11.781367,0.4581275178255927,dart,0.814860263448994,8.78179308864682,depthwise,0.00011876447060271755,0.09490544359237105,6,5,0.26207913730526605,300,forest,0.7833799173242649,0.903085773137216,0.027661856059749548,oversample,0.9398376110741374,,9.0,0.7794687327250367,0.012377038763085945,weighted,0.22009249233495481,0.27833701461818805,0.5864576382377155,0.3939393939393939,0.39032112166440525,0.021897810218978103,0.02177068214804064,0.7833799173242649,0.903085773137216,0.02,0.434772787822792,0.4342604852759592,0.1079136690647482,0.10273972602739725,0.012185215272136474,0.012175324675324676,oversample,0.3183337754273114,0.31665503163843306,0.9398376110741374,0.5864576382377155,COMPLETE
593,0.7156549520766773,2025-11-26 20:12:26.693720,2025-11-26 20:12:27.796397,0 days 00:00:01.102677,0.0009681275531270391,gbtree,0.4333335189630182,4.966150694506217,depthwise,0.2024903409312603,0.00016729330022269778,8,11,0.6315625762606734,1000,,0.6913378123363648,0.44592014494423815,0.02060616802306342,oversample,0.9743331989430701,,6.0,0.7017997777580007,,,,0.399368571806675,0.3804805442616339,0.5567616463138851,0.5572139303482587,0.715281812899477,0.7156549520766773,0.6913378123363648,0.44592014494423815,0.02,0.5932348567860082,0.5627164753780827,0.5567616463138851,0.5572139303482587,1.0,1.0,oversample,0.5854759694292014,0.5508494952442858,0.9743331989430701,0.3804805442616339,COMPLETE
594,0.7156549520766773,2025-11-26 20:12:27.975505,2025-11-26 20:12:28.728232,0 days 00:00:00.752727,0.606487842621999,gbtree,0.2957996436076199,5.944846982685387,lossguide,16.547477723536264,0.0045071033432504915,4,5,0.6101624272959785,600,,0.7979927512798897,0.7022034513276039,0.09043964165306892,oversample,0.5027844556835059,,12.0,0.6599413455699082,,,,0.6899160515704166,0.15777646874357645,0.5567616463138851,0.5572139303482587,0.715281812899477,0.7156549520766773,0.7979927512798897,0.7022034513276039,0.1,0.5816907120684275,0.5636823707233868,0.5567616463138851,0.5572139303482587,1.0,1.0,oversample,0.5788354415689916,0.5406449398405476,0.5027844556835059,0.15777646874357645,COMPLETE
595,0.7156549520766773,2025-11-26 20:12:28.905475,2025-11-26 20:12:29.700511,0 days 00:00:00.795036,70.56566578780384,gbtree,0.3573033758207701,8.436464629458055,lossguide,0.10180949070969343,0.042046135758457746,3,7,0.1938872733261743,700,,0.8063885705905296,0.6989721260701649,0.06094761941367131,oversample,0.517765716139705,,10.0,0.6193375916715984,,,,0.7039450173718036,0.26268338367961364,0.5567616463138851,0.5572139303482587,0.715281812899477,0.7156549520766773,0.8063885705905296,0.6989721260701649,0.05,0.5567616463138851,0.5572139303482587,0.5567616463138851,0.5572139303482587,1.0,1.0,oversample,0.5,0.5,0.517765716139705,0.26268338367961364,COMPLETE
596,0.0,2025-11-26 20:12:29.869829,2025-11-26 20:12:30.644826,0 days 00:00:00.774997,0.00041094996230377857,gbtree,0.31684340501100444,5.829291298916278,lossguide,0.0008210731339356827,0.0022120830510620466,6,11,1.8102328265146888,600,,0.5540193786451438,0.3006529111819688,0.06941229253944893,undersample,0.7297980352204181,,6.0,0.6075198580778965,,,,0.6780519406147262,0.5290742052769715,0.44323835368611486,0.4427860696517413,0.0,0.0,0.5540193786451438,0.3006529111819688,0.08,0.47721507818949815,0.5028450978543775,0.0,0.0,0.0,0.0,undersample,0.3793908221290141,0.4214739231657005,0.7297980352204181,0.5290742052769715,COMPLETE
597,0.7156549520766773,2025-11-26 20:12:30.826996,2025-11-26 20:12:31.367647,0 days 00:00:00.540651,7.409459438680008,gbtree,0.7365661984607271,2.1671411991935408,lossguide,0.3315201720779765,0.014808994338174744,0,6,1.0607807326908258,200,,0.7498815615374026,0.9424419280500386,0.09231666820754975,undersample,0.8795940430867796,,5.0,0.6213733137877312,,,,0.3653019706282419,0.2181437595983387,0.5567616463138851,0.5572139303482587,0.715281812899477,0.7156549520766773,0.7498815615374026,0.9424419280500386,0.1,0.5380108017644102,0.539384096117659,0.5567616463138851,0.5572139303482587,1.0,1.0,undersample,0.5101879175715778,0.5000999064775878,0.8795940430867796,0.2181437595983387,COMPLETE
598,0.0,2025-11-26 20:12:31.535405,2025-11-26 20:12:32.409103,0 days 00:00:00.873698,0.0006345031264951342,gbtree,0.31732899114337854,5.933235381359872,lossguide,0.00037264533348720926,0.0020599733034421803,5,5,0.5409538394398034,800,,0.6581082448009387,0.3682084965183482,0.017790894852492634,undersample,0.7139803870562584,,5.0,0.6949153272999827,,,,0.38159337790447606,0.7094326291137857,0.44323835368611486,0.4427860696517413,0.0,0.0,0.6581082448009387,0.3682084965183482,0.02,0.4111542567852901,0.41785819189531237,0.0,0.0,0.0,0.0,undersample,0.24909398365357513,0.2697798243635833,0.7139803870562584,0.7094326291137857,COMPLETE
599,0.7156549520766773,2025-11-26 20:12:32.574339,2025-11-26 20:13:01.763884,0 days 00:00:29.189545,14.124829494434733,dart,0.2592774024201131,5.950336281764609,depthwise,12.764452746790564,0.00014845205127945478,1,10,1.1416447558548126,500,forest,0.8286109532308756,0.12288174756133388,0.06394661328303707,undersample,0.7823443844814019,,6.0,0.7607509375076725,0.297645484012531,weighted,0.6024839438235529,0.7016800155840611,0.16864159206685517,0.5567616463138851,0.5572139303482587,0.715281812899477,0.7156549520766773,0.8286109532308756,0.12288174756133388,0.05,0.5567616463138851,0.5572139303482587,0.5567616463138851,0.5572139303482587,1.0,1.0,undersample,0.5,0.5,0.7823443844814019,0.16864159206685517,COMPLETE
600,0.6857871255576801,2025-11-26 20:13:01.933584,2025-11-26 20:13:11.032189,0 days 00:00:09.098605,0.3462832955633798,gbtree,0.988744069785863,0.3866463170545946,lossguide,0.008450456863377235,0.024717646456919234,6,7,0.33442032240696357,400,,0.8895459522950079,0.4493954636581592,0.0875438350543857,none,0.7446485839384323,2.2327229883018536,5.0,0.8788981786096851,,,,0.6747987463499833,0.4328954691304207,0.5563093622795116,0.5540479421076436,0.6846673095467696,0.6857871255576801,0.8895459522950079,0.4493954636581592,0.08,0.5643974390964999,0.5548999589516813,0.5664893617021277,0.5645330535152151,0.8651502843216897,0.8733766233766234,none,0.5119916610023376,0.5033673872093178,0.7446485839384323,0.4328954691304207,COMPLETE
601,0.7156549520766773,2025-11-26 20:13:11.199428,2025-11-26 20:13:11.701625,0 days 00:00:00.502197,1.463801452348446,gbtree,0.33691979725485566,9.40629945321206,lossguide,3.917307971656209,0.046190457382653004,2,4,0.12074508983686848,200,,0.6652172055440584,0.8390364400030517,0.07699138099681255,oversample,0.5080371414165693,,10.0,0.6728438194630914,,,,0.4760681840095782,0.24845696475157025,0.5567616463138851,0.5572139303482587,0.715281812899477,0.7156549520766773,0.6652172055440584,0.8390364400030517,0.08,0.5277496077740623,0.5265031838803538,0.5567616463138851,0.5572139303482587,1.0,1.0,oversample,0.43041454599711537,0.43850362482257266,0.5080371414165693,0.24845696475157025,COMPLETE
602,0.7156549520766773,2025-11-26 20:13:11.866799,2025-11-26 20:13:31.483619,0 days 00:00:19.616820,0.0019124236200885984,dart,0.7641167861810654,0.6978219279994053,lossguide,0.0008741212978005102,0.0005246142339492162,2,11,0.14609359976090078,300,tree,0.9881069031534174,0.7929701397092745,0.04900928053849523,undersample,0.6439203588807231,,12.0,0.6464818771700483,0.2659694102419332,weighted,0.5214833289241266,0.5362070865143053,0.04360349305864522,0.5567616463138851,0.5572139303482587,0.715281812899477,0.7156549520766773,0.9881069031534174,0.7929701397092745,0.05,0.5572926216896216,0.5438256050559135,0.5567616463138851,0.5572139303482587,1.0,1.0,undersample,0.5327417563288516,0.5097767401138188,0.6439203588807231,0.04360349305864522,COMPLETE
603,0.7156549520766773,2025-11-26 20:13:31.640638,2025-11-26 20:13:32.217389,0 days 00:00:00.576751,0.028402436574156326,gbtree,0.3819095407685702,5.329403744947948,lossguide,5.770324394170354,0.00014050586290809532,0,8,0.36368854791643335,300,,0.7852202801462195,0.7045980890402745,0.008590762233782825,undersample,0.7819853297241748,,6.0,0.7861858025640324,,,,0.398762981958822,0.25892861224438835,0.5567616463138851,0.5572139303482587,0.715281812899477,0.7156549520766773,0.7852202801462195,0.7045980890402745,0.0,0.5160340477501528,0.5096338692980436,0.5567616463138851,0.5572139303482587,1.0,1.0,undersample,0.457977585835309,0.4423224566546834,0.7819853297241748,0.25892861224438835,COMPLETE
604,0.0,2025-11-26 20:13:32.382328,2025-11-26 20:14:36.142622,0 days 00:01:03.760294,0.018987513668705755,dart,0.3513945884566226,5.575110080948303,lossguide,0.00034068920996089576,0.0010757155662405673,2,10,2.8423960237702373,700,forest,0.708188828607936,0.2646830584305444,0.033853442979879654,oversample,0.8147791056996833,,6.0,0.7322824947435643,0.15566212859278086,uniform,0.8860153424490502,0.6258758562265444,0.7698180386583264,0.44323835368611486,0.4427860696517413,0.0,0.0,0.708188828607936,0.2646830584305444,0.02,0.5621804412521028,0.5327085539893437,0.0,0.0,0.0,0.0,oversample,0.5258430179545417,0.48744163140230556,0.8147791056996833,0.7698180386583264,COMPLETE
605,0.7156549520766773,2025-11-26 20:14:36.314857,2025-11-26 20:14:37.270364,0 days 00:00:00.955507,0.00012122797325320654,gbtree,0.5016938522481167,3.3803494584071436,lossguide,0.006107209662162127,0.006284749344160538,8,12,0.11814790373235005,600,,0.8207056896055585,0.7466578636386456,0.07019487938131688,undersample,0.55993316103218,,12.0,0.709700690016342,,,,0.8316717898470105,0.2800751172922269,0.5567616463138851,0.5572139303482587,0.715281812899477,0.7156549520766773,0.8207056896055585,0.7466578636386456,0.08,0.4516080539973212,0.4481607450789313,0.5567616463138851,0.5572139303482587,1.0,1.0,undersample,0.349813077139873,0.3403788818433864,0.55993316103218,0.2800751172922269,COMPLETE
606,0.7156549520766773,2025-11-26 20:14:37.447896,2025-11-26 20:14:54.608420,0 days 00:00:17.160524,2.8255828224621227,dart,0.2386571091240774,3.064709084724929,depthwise,0.499088190028136,0.023251882158062502,4,5,3.683591422261235,400,tree,0.529626438920673,0.3869981786433648,0.04070610189000814,oversample,0.8290777609807436,,10.0,0.8333913418178939,0.31665131134251395,weighted,0.2174345403160696,0.30095753020836424,0.06731137180233597,0.5567616463138851,0.5572139303482587,0.715281812899477,0.7156549520766773,0.529626438920673,0.3869981786433648,0.05,0.5881741807607159,0.5858289455477508,0.5567616463138851,0.5572139303482587,1.0,1.0,oversample,0.5646429814817885,0.5570291876152449,0.8290777609807436,0.06731137180233597,COMPLETE
607,0.6873628096582001,2025-11-26 20:14:54.778856,2025-11-26 20:14:56.361424,0 days 00:00:01.582568,0.028682831449828538,gbtree,0.9206774312494246,0.6158210783791485,depthwise,0.014145563969727463,0.3673114390689919,4,3,0.5443021520125648,300,,0.9155536141114208,0.841640252442688,0.09781847547304158,oversample,0.8722673099087352,,6.0,0.7475967187974177,,,,0.5075925395351125,0.2569827472128605,0.5531433740388965,0.5490728177295342,0.6900878293601004,0.6873628096582001,0.9155536141114208,0.841640252442688,0.1,0.5540458712039369,0.5489434940430997,0.5620848237097599,0.5600408788962699,0.8935824532900081,0.8896103896103896,oversample,0.49663124388666924,0.5025362150617513,0.8722673099087352,0.2569827472128605,COMPLETE
608,0.0,2025-11-26 20:14:56.536279,2025-11-26 20:15:00.777658,0 days 00:00:04.241379,0.03810335147851356,dart,0.9294213502178986,9.754923153598424,lossguide,0.9784296203112838,0.02516501820499716,3,5,6.778506984059601,200,forest,0.7057473056437522,0.8949380592665532,0.09136518549607141,oversample,0.6607216342851937,,11.0,0.6228429362981555,0.3375515954570298,weighted,0.14646491180436738,0.845747550772304,0.639413321847857,0.44323835368611486,0.4427860696517413,0.0,0.0,0.7057473056437522,0.8949380592665532,0.1,0.5567616463138851,0.5572139303482587,0.0,0.0,0.0,0.0,oversample,0.5,0.5,0.6607216342851937,0.639413321847857,COMPLETE
