number,value,datetime_start,datetime_complete,duration,params_alpha,params_booster,params_colsample_bytree,params_gamma,params_grow_policy,params_lambda,params_learning_rate,params_max_delta_step,params_max_depth,params_min_child_weight,params_n_estimators,params_normalize_type,params_params_feature_fraction,params_params_labeled_ratio,params_params_missing_rate,params_params_resampling,params_params_sample_rows,params_params_scale_pos_weight,params_params_selftrain_max_iter,params_params_selftrain_threshold,params_rate_drop,params_sample_type,params_skip_drop,params_subsample,params_user_attrs_decision_threshold,user_attrs_acc_test,user_attrs_acc_val,user_attrs_f1_test,user_attrs_f1_val,user_attrs_feature_fraction,user_attrs_labeled_ratio,user_attrs_missing_rate,user_attrs_pr_auc_test,user_attrs_pr_auc_val,user_attrs_prec_test,user_attrs_prec_val,user_attrs_rec_test,user_attrs_rec_val,user_attrs_resampling_strategy,user_attrs_roc_auc_test,user_attrs_roc_auc_val,user_attrs_sample_rows,user_attrs_user_attrs_decision_threshold,state
436,0.0,2025-11-26 19:08:11.062417,2025-11-26 19:08:11.748788,0 days 00:00:00.686371,0.27500551307285687,gbtree,0.5261761526629969,5.565029695281116,lossguide,0.008797204877952807,0.25094333889892184,1,3,3.3216489179377824,500,,0.7218324935073005,0.38344934074127407,0.006046012884086902,none,0.9249630743978415,0.9385368469790404,7.0,0.8118505931381581,,,,0.7308061102555486,0.8027835038847531,0.44323835368611486,0.4427860696517413,0.0,0.0,0.7218324935073005,0.38344934074127407,0.0,0.6161551947284793,0.6094066152808334,0.0,0.0,0.0,0.0,none,0.5961343026243804,0.5892927616306064,0.9249630743978415,0.8027835038847531,COMPLETE
437,0.0,2025-11-26 19:08:11.926211,2025-11-26 19:08:28.660130,0 days 00:00:16.733919,0.00040146456290508694,dart,0.8838452814086205,7.850624277436313,lossguide,0.04644297288765024,0.007616189194253573,5,7,15.981129087901213,400,forest,0.8819622953060943,0.8765188769975524,0.09413686739165175,oversample,0.7580464933586872,,9.0,0.635147805104156,0.349336127249162,uniform,0.37454382646820694,0.9886862758949908,0.7124924845700773,0.44323835368611486,0.4427860696517413,0.0,0.0,0.8819622953060943,0.8765188769975524,0.1,0.5567616463138851,0.5572139303482587,0.0,0.0,0.0,0.0,oversample,0.5,0.5,0.7580464933586872,0.7124924845700773,COMPLETE
438,0.7156549520766773,2025-11-26 19:08:28.836268,2025-11-26 19:08:29.746277,0 days 00:00:00.910009,58.40737346750037,gbtree,0.24011888514272428,6.80230059869663,depthwise,3.951396303494751,0.09856944473849436,4,6,0.4262927644812545,900,,0.7496178418849418,0.8066190633446118,0.05318711867339402,oversample,0.5094419664925115,,11.0,0.6402385463139074,,,,0.5618778833053547,0.06011343793227197,0.5567616463138851,0.5572139303482587,0.715281812899477,0.7156549520766773,0.7496178418849418,0.8066190633446118,0.05,0.5567616463138851,0.5572139303482587,0.5567616463138851,0.5572139303482587,1.0,1.0,oversample,0.5,0.5,0.5094419664925115,0.06011343793227197,COMPLETE
439,0.7156549520766773,2025-11-26 19:08:29.918517,2025-11-26 19:08:30.724322,0 days 00:00:00.805805,0.0006636745804565101,gbtree,0.8549450343501903,4.353763463167597,lossguide,32.42314115913366,0.002306154618092579,3,6,0.6968629099543752,600,,0.6476104334313793,0.24788279388304377,0.05748070558423116,undersample,0.8549760597219924,,9.0,0.8834054756546349,,,,0.6878965874773082,0.35200444965435534,0.5567616463138851,0.5572139303482587,0.715281812899477,0.7156549520766773,0.6476104334313793,0.24788279388304377,0.05,0.6857904195838438,0.6997565005230675,0.5567616463138851,0.5572139303482587,1.0,1.0,undersample,0.6645766673850695,0.6656304306010639,0.8549760597219924,0.35200444965435534,COMPLETE
440,0.602322206095791,2025-11-26 19:08:30.906661,2025-11-26 19:08:34.602430,0 days 00:00:03.695769,0.012346150246099197,gbtree,0.8532856232231985,1.2152587740983154,depthwise,3.2062787112256395,0.1844856286232367,8,11,20.742750759194426,800,,0.9815894504232759,0.14951806846115676,0.0642452728123958,undersample,0.7399028861809398,,8.0,0.6598539048085055,,,,0.6815711534899771,0.09937980449373081,0.4966078697421981,0.5042966983265491,0.5921582997434958,0.602322206095791,0.9815894504232759,0.14951806846115676,0.05,0.548708765896082,0.543591238254244,0.5393858477970628,0.5446194225721784,0.6563769293257514,0.6737012987012987,undersample,0.4775203501384307,0.4838271725720653,0.7399028861809398,0.09937980449373081,COMPLETE
441,0.7156549520766773,2025-11-26 19:08:34.780053,2025-11-26 19:09:52.433256,0 days 00:01:17.653203,1.1155104877902053,dart,0.5399830422916304,9.109022449811441,lossguide,0.08828078556914601,0.04543047644854204,1,3,0.9458352947891799,800,tree,0.591481194193684,0.4306520935717869,0.0977787623072092,oversample,0.8278292619057772,,8.0,0.6274924722732982,0.257657354739156,uniform,0.6705767410652321,0.6209535686107776,0.1097894371917953,0.5567616463138851,0.5572139303482587,0.715281812899477,0.7156549520766773,0.591481194193684,0.4306520935717869,0.1,0.5592376001113034,0.5576891391896016,0.5567616463138851,0.5572139303482587,1.0,1.0,oversample,0.5049934514829489,0.5009621698526193,0.8278292619057772,0.1097894371917953,COMPLETE
442,0.2456351595424443,2025-11-26 19:09:52.604307,2025-11-26 19:10:21.605636,0 days 00:00:29.001329,0.0005666361158052546,dart,0.746853176101663,1.2018179625880183,lossguide,0.9430883688736901,0.007216774063668819,8,7,55.9787860158628,500,forest,0.9268344626460173,0.6200613506928239,0.09571117536089366,oversample,0.8848521031042659,,9.0,0.9015465888038415,0.20853829139501162,weighted,0.1352006218312315,0.6641651493778357,0.5848396107353642,0.44866576209859793,0.433288104929896,0.27136879856545126,0.2456351595424443,0.9268344626460173,0.6200613506928239,0.1,0.5298867693277518,0.5132040801933199,0.5135746606334841,0.4755244755244755,0.1844029244516653,0.16558441558441558,oversample,0.4733632852003515,0.45345767613387633,0.8848521031042659,0.5848396107353642,COMPLETE
443,0.7156549520766773,2025-11-26 19:10:21.784333,2025-11-26 19:11:23.589943,0 days 00:01:01.805610,82.38355583911932,dart,0.6656191121984282,4.04382848655413,lossguide,0.2366660731011882,0.00012192201771377214,2,10,30.946808880477807,700,tree,0.7612549135082405,0.1581570176516583,0.05532460295489331,none,0.6512707920053598,0.504919091327113,6.0,0.8671076062091373,0.23562930927881323,weighted,0.8259630724285381,0.772143604807283,0.25734772160481306,0.5567616463138851,0.5572139303482587,0.715281812899477,0.7156549520766773,0.7612549135082405,0.1581570176516583,0.05,0.5567616463138851,0.5572139303482587,0.5567616463138851,0.5572139303482587,1.0,1.0,none,0.5,0.5,0.6512707920053598,0.25734772160481306,COMPLETE
444,0.0,2025-11-26 19:11:23.764290,2025-11-26 19:11:24.556057,0 days 00:00:00.791767,3.926399049770418,gbtree,0.9375936040399478,6.921159223514877,lossguide,77.31382329147026,0.10378523748876685,9,11,36.131960541846695,600,,0.9239318009572389,0.19825034706827532,0.09827846226976239,undersample,0.990596356030023,,9.0,0.9105473579762743,,,,0.5767783503016,0.5809862318215349,0.44323835368611486,0.4427860696517413,0.0,0.0,0.9239318009572389,0.19825034706827532,0.1,0.5567616463138851,0.5572139303482587,0.0,0.0,0.0,0.0,undersample,0.5,0.5,0.990596356030023,0.5809862318215349,COMPLETE
445,0.7156549520766773,2025-11-26 19:11:24.737193,2025-11-26 19:11:25.600003,0 days 00:00:00.862810,0.086564258032317,gbtree,0.9959171255196231,5.177572656020572,lossguide,12.285505388751385,0.004614042422823231,7,9,74.24347574495951,700,,0.8317528748840803,0.8260968859393057,0.07543035945687707,oversample,0.7800323473079944,,9.0,0.8161915085117145,,,,0.6600487298320614,0.33229942668689016,0.5567616463138851,0.5572139303482587,0.715281812899477,0.7156549520766773,0.8317528748840803,0.8260968859393057,0.08,0.46528752352462305,0.45598592219146605,0.5567616463138851,0.5572139303482587,1.0,1.0,oversample,0.370601717535105,0.36303982661873374,0.7800323473079944,0.33229942668689016,COMPLETE
446,0.7156549520766773,2025-11-26 19:11:25.781382,2025-11-26 19:11:29.550227,0 days 00:00:03.768845,0.0009014090039666036,gbtree,0.3864972406731119,4.438631603562898,depthwise,0.006941455313952061,0.0021139187238189043,7,8,0.8195027473992477,900,,0.7152575967918796,0.4772218191420988,0.0021533601722229408,none,0.9084143956586826,1.710525839526865,6.0,0.7183714787430198,,,,0.6302578815110197,0.531226272798,0.5567616463138851,0.5572139303482587,0.715281812899477,0.7156549520766773,0.7152575967918796,0.4772218191420988,0.0,0.5964076594939848,0.5890733335411014,0.5567616463138851,0.5572139303482587,1.0,1.0,none,0.5674899285465609,0.5661144588302403,0.9084143956586826,0.531226272798,COMPLETE
447,0.7156549520766773,2025-11-26 19:11:29.725150,2025-11-26 19:11:30.502451,0 days 00:00:00.777301,0.15399481323496633,gbtree,0.6058290242974844,1.6212598871765516,depthwise,53.77372853190474,0.003146209242222207,6,10,0.9421819939979412,600,,0.813328693701892,0.19028793583415957,0.08963812197154568,oversample,0.7299528912708039,,8.0,0.635846559345037,,,,0.6317567694679223,0.21350356806824872,0.5567616463138851,0.5572139303482587,0.715281812899477,0.7156549520766773,0.813328693701892,0.19028793583415957,0.08,0.4327610350371485,0.45811143043902675,0.5567616463138851,0.5572139303482587,1.0,1.0,oversample,0.3034483330293937,0.3463189644880146,0.7299528912708039,0.21350356806824872,COMPLETE
448,0.7156549520766773,2025-11-26 19:11:30.678435,2025-11-26 19:11:31.415617,0 days 00:00:00.737182,0.18948490069303214,gbtree,0.30162231790945576,5.763356253985102,lossguide,11.578926493727705,0.00013501413382469168,0,5,0.1791611274892989,600,,0.84694352313715,0.74777801682545,0.0008861285840248067,none,0.5651747743744606,3.498209521449049,6.0,0.769342339902732,,,,0.41488573876430934,0.5630029215381818,0.5567616463138851,0.5572139303482587,0.715281812899477,0.7156549520766773,0.84694352313715,0.74777801682545,0.0,0.4788320329570615,0.47015760432983356,0.5567616463138851,0.5572139303482587,1.0,1.0,none,0.38436603723536533,0.37876701311966887,0.5651747743744606,0.5630029215381818,COMPLETE
449,0.7156549520766773,2025-11-26 19:11:31.586212,2025-11-26 19:11:49.400862,0 days 00:00:17.814650,0.0008114940735889917,gbtree,0.7788504998968289,0.878378041590368,lossguide,0.0004533831449886663,0.009765874098112881,6,9,0.40932756481884175,200,,0.875950720863258,0.7738831441255992,0.05059419996968242,oversample,0.7972069902772171,,11.0,0.6013531209364773,,,,0.3262790355673625,0.10428783686353625,0.5567616463138851,0.5572139303482587,0.715281812899477,0.7156549520766773,0.875950720863258,0.7738831441255992,0.05,0.5651037996681811,0.5466726894874102,0.5567616463138851,0.5572139303482587,1.0,1.0,oversample,0.5224904259022862,0.5164269463937492,0.7972069902772171,0.10428783686353625,COMPLETE
450,0.7156549520766773,2025-11-26 19:11:49.582076,2025-11-26 19:12:50.159669,0 days 00:01:00.577593,2.063429069644043,dart,0.3050419082656334,1.8000520042581796,depthwise,0.00028833337766055614,0.28124546511610127,1,3,5.019024012100328,700,forest,0.7610330155527075,0.7332591074719595,0.00529736310147732,none,0.9703469535742913,1.2568477458957998,11.0,0.7715073980049053,0.11771761030839036,weighted,0.13466542347321722,0.5125006125336493,0.48506685234404145,0.5567616463138851,0.5572139303482587,0.715281812899477,0.7156549520766773,0.7610330155527075,0.7332591074719595,0.0,0.5888970786649631,0.6316328194511935,0.5567616463138851,0.5572139303482587,1.0,1.0,none,0.5688630448117509,0.6162173500656646,0.9703469535742913,0.48506685234404145,COMPLETE
451,0.0,2025-11-26 19:12:50.325340,2025-11-26 19:12:51.280139,0 days 00:00:00.954799,0.041811288002013086,gbtree,0.9228933787280764,3.341534249396582,lossguide,0.0002682287887561191,0.00038228429511580906,0,12,50.07928978357735,1000,,0.551927824262576,0.10430135208975348,0.06928608912242455,undersample,0.8856308265706749,,6.0,0.7822521751838329,,,,0.43003287645426586,0.5666325094685474,0.44323835368611486,0.4427860696517413,0.0,0.0,0.551927824262576,0.10430135208975348,0.08,0.5567616463138851,0.5572139303482587,0.0,0.0,0.0,0.0,undersample,0.5,0.5,0.8856308265706749,0.5666325094685474,COMPLETE
452,0.7119137780367026,2025-11-26 19:12:51.448574,2025-11-26 19:13:03.888428,0 days 00:00:12.439854,0.0008379821383730405,gbtree,0.8683969133868661,1.5142026924240057,lossguide,1.7793926899349624,0.007973171342950978,10,12,0.1708396514464764,400,,0.8034727603263495,0.44134867844017833,0.06860445649335876,oversample,0.7706984880264145,,11.0,0.6874590767100431,,,,0.46493203661556626,0.3239609763540533,0.5495251017639078,0.5526910900045229,0.7091121495327103,0.7119137780367026,0.8034727603263495,0.44134867844017833,0.08,0.49110723367631715,0.4914502954841773,0.5535795713634291,0.5552021808268969,0.9861900893582454,0.9918831168831169,oversample,0.3860052388136408,0.3714199487948211,0.7706984880264145,0.3239609763540533,COMPLETE
453,0.7156549520766773,2025-11-26 19:13:04.052549,2025-11-26 19:13:14.644112,0 days 00:00:10.591563,20.310778246613175,dart,0.853914023392923,8.23283767795021,depthwise,0.000301359061864178,0.009366350073803112,8,10,0.19868821942885898,300,tree,0.7246437383591144,0.9014918547463137,0.04662456102721122,oversample,0.7773914854664435,,10.0,0.85099081364168,0.4875235708184269,uniform,0.6235788230182872,0.44382761299466467,0.3620158283823385,0.5567616463138851,0.5572139303482587,0.715281812899477,0.7156549520766773,0.7246437383591144,0.9014918547463137,0.05,0.5264562177080571,0.5357122938746073,0.5567616463138851,0.5572139303482587,1.0,1.0,oversample,0.42882507999137914,0.4520875893769153,0.7773914854664435,0.3620158283823385,COMPLETE
454,0.5852551984877127,2025-11-26 19:13:14.809861,2025-11-26 19:13:17.748985,0 days 00:00:02.939124,1.9916694296898507,gbtree,0.5459245715526417,0.975452661277223,lossguide,0.033097433696703836,0.27206089147304957,2,5,0.7802662735123065,800,,0.845365431496829,0.4152286147568707,0.016883711384073248,undersample,0.9602319150019214,,5.0,0.7942511862303616,,,,0.7274387292854856,0.40679798621052166,0.501130710085934,0.5038444142921755,0.5798095238095238,0.5852551984877127,0.845365431496829,0.4152286147568707,0.02,0.5568428469209038,0.5404304676421965,0.5459110473457676,0.5477707006369427,0.6181965881397238,0.6282467532467533,undersample,0.4990367877451549,0.48374882267885333,0.9602319150019214,0.40679798621052166,COMPLETE
455,0.6774677467746775,2025-11-26 19:13:17.915679,2025-11-26 19:13:19.050211,0 days 00:00:01.134532,0.8992182364638547,gbtree,0.748740558427877,2.9138422579166403,lossguide,3.830689782707829,0.002370912662105594,8,9,1.1104926638747543,800,,0.773882852039846,0.4342772895837639,0.06968802979472966,undersample,0.6604239484928691,,7.0,0.6361670141075947,,,,0.6470358392977901,0.4626899561167601,0.5133423790140208,0.5137946630483944,0.6770708283313326,0.6774677467746775,0.773882852039846,0.4342772895837639,0.08,0.5022635272710022,0.49963378943216824,0.5368871965730605,0.5373631603998096,0.9163281884646629,0.9163961038961039,undersample,0.3958226263698006,0.4091576515925341,0.6604239484928691,0.4626899561167601,COMPLETE
456,0.7156549520766773,2025-11-26 19:13:19.211159,2025-11-26 19:13:19.893071,0 days 00:00:00.681912,0.00011586625064748502,gbtree,0.4398281365912907,5.029032993756079,lossguide,3.4596532151435264,0.0023011902846637386,4,12,0.45257790669797904,500,,0.9245620307827123,0.3211756557784887,0.042454382022796916,oversample,0.5458816610937474,,11.0,0.6161277269366008,,,,0.6501950508331045,0.24783268165034156,0.5567616463138851,0.5572139303482587,0.715281812899477,0.7156549520766773,0.9245620307827123,0.3211756557784887,0.05,0.4277714759790899,0.41871474622883864,0.5567616463138851,0.5572139303482587,1.0,1.0,oversample,0.26799059997679003,0.24716779645278114,0.5458816610937474,0.24783268165034156,COMPLETE
457,0.0,2025-11-26 19:13:20.057180,2025-11-26 19:13:20.663197,0 days 00:00:00.606017,2.3381008129629555,gbtree,0.9705172036255603,3.3256080643810497,lossguide,0.0509421369371534,0.0002182146734255917,3,8,0.37390918683109037,200,,0.8392372842635784,0.22482053668837454,0.07947574067028759,oversample,0.7078389910392917,,5.0,0.7874113821173032,,,,0.6427856311229743,0.6875560234168165,0.44323835368611486,0.4427860696517413,0.0,0.0,0.8392372842635784,0.22482053668837454,0.08,0.7874445367952034,0.8092726086419872,0.0,0.0,0.0,0.0,oversample,0.8467066761716872,0.8592396495231022,0.7078389910392917,0.6875560234168165,COMPLETE
458,0.7156549520766773,2025-11-26 19:13:20.834622,2025-11-26 19:14:32.940885,0 days 00:01:12.106263,0.04493845379899334,dart,0.5209341188910388,9.915683706800895,lossguide,2.225321850014623,0.0007467844822356141,2,5,0.4822191114367692,800,forest,0.5991976490236579,0.08311995485462603,0.07692369420084001,oversample,0.8475906931802852,,10.0,0.7283003992170185,0.35851834091211765,weighted,0.6310070380887096,0.6017930150472084,0.07077807242219898,0.5567616463138851,0.5572139303482587,0.715281812899477,0.7156549520766773,0.5991976490236579,0.08311995485462603,0.08,0.5156094435201981,0.5171065619652895,0.5567616463138851,0.5572139303482587,1.0,1.0,oversample,0.37648377791409005,0.38085053990952866,0.8475906931802852,0.07077807242219898,COMPLETE
459,0.0,2025-11-26 19:14:33.109981,2025-11-26 19:14:38.200632,0 days 00:00:05.090651,2.3112404143719534,dart,0.8497435203145361,9.55927946359193,depthwise,0.00014024181572347183,0.0021311882998006773,5,4,1.0509678771179594,200,forest,0.7776208512811172,0.8182765920252716,0.05939971315574254,oversample,0.6842188681188138,,11.0,0.8300546982729496,0.20364399156217317,uniform,0.3319894460237458,0.20158800046225486,0.6210978387494027,0.44323835368611486,0.4427860696517413,0.0,0.0,0.7776208512811172,0.8182765920252716,0.05,0.4667103128269106,0.462202252182416,0.0,0.0,0.0,0.0,oversample,0.3706311444155242,0.3578907048008172,0.6842188681188138,0.6210978387494027,COMPLETE
460,0.7133645955451349,2025-11-26 19:14:38.367745,2025-11-26 19:15:02.364492,0 days 00:00:23.996747,0.0006040086627213763,gbtree,0.4242955019897581,0.47415596699217266,depthwise,0.00010059971613482377,0.004426238884063576,2,11,0.6487936523657055,800,,0.958246466815031,0.8072917687423041,0.08271424079638842,undersample,0.703198895472715,,11.0,0.6580002539511608,,,,0.6423385058708038,0.16185928634641636,0.555857078245138,0.5576662143826323,0.7123608670181605,0.7133645955451349,0.958246466815031,0.8072917687423041,0.08,0.5517654552883349,0.5353114030477473,0.5570316078790655,0.558256880733945,0.9878147847278635,0.9878246753246753,undersample,0.4943516968119498,0.47837211307589245,0.703198895472715,0.16185928634641636,COMPLETE
461,0.0,2025-11-26 19:15:02.532204,2025-11-26 19:15:14.694149,0 days 00:00:12.161945,0.40158497421444783,dart,0.7042274847265187,8.593889052557111,depthwise,0.0005278139066357946,0.006809389256038991,4,3,0.19325432230275408,300,forest,0.9237150361206493,0.8270515818447697,0.03380271298559688,oversample,0.8862603019806078,,8.0,0.8032848828951968,0.016170453971786722,weighted,0.06329616100856644,0.5828930955288156,0.7616266844699701,0.44323835368611486,0.4427860696517413,0.0,0.0,0.9237150361206493,0.8270515818447697,0.02,0.46659401605109263,0.46446261311358233,0.0,0.0,0.0,0.0,oversample,0.35329249490210385,0.3585266240399029,0.8862603019806078,0.7616266844699701,COMPLETE
462,0.7156549520766773,2025-11-26 19:15:14.864420,2025-11-26 19:15:19.636522,0 days 00:00:04.772102,6.9810817710789195,dart,0.3601864750268798,7.633901648086399,lossguide,1.400697767696487,0.0003281564041818018,5,3,0.25870353192944634,200,tree,0.7406369686424762,0.6499378586629104,0.007438770761141522,none,0.6450564377967023,2.3431775151734575,11.0,0.8272446999123862,0.23429420571206516,weighted,0.11732221177620776,0.5695750047055057,0.06114388192460421,0.5567616463138851,0.5572139303482587,0.715281812899477,0.7156549520766773,0.7406369686424762,0.6499378586629104,0.0,0.49478984709453977,0.5037663787727723,0.5567616463138851,0.5572139303482587,1.0,1.0,none,0.3826149306188763,0.39232154464534447,0.6450564377967023,0.06114388192460421,COMPLETE
463,0.7156549520766773,2025-11-26 19:15:19.810477,2025-11-26 19:16:01.179711,0 days 00:00:41.369234,14.306264786846064,dart,0.32585144607584615,8.962964839581804,lossguide,0.05851969162874368,0.0690626743960974,3,9,0.4116136411249657,600,tree,0.927258847855175,0.8566726413187582,0.09509165558716318,oversample,0.5099069945835605,,10.0,0.7495386317204308,0.1357076919495174,weighted,0.026302553868020134,0.744719003609385,0.023264731122720365,0.5567616463138851,0.5572139303482587,0.715281812899477,0.7156549520766773,0.927258847855175,0.8566726413187582,0.1,0.5567616463138851,0.5572139303482587,0.5567616463138851,0.5572139303482587,1.0,1.0,oversample,0.5,0.5,0.5099069945835605,0.023264731122720365,COMPLETE
464,0.7156549520766773,2025-11-26 19:16:01.350099,2025-11-26 19:17:34.513941,0 days 00:01:33.163842,13.886501148237771,dart,0.4733527413357166,6.586635868836316,lossguide,27.987204145752163,0.00019154099764388978,0,6,14.206365938039157,900,forest,0.7719697358587676,0.23400252657748982,0.020461289572001887,none,0.8188949015771912,0.7343446751398846,7.0,0.6736833243435991,0.2557668167840044,weighted,0.5076800677829324,0.5524459122609469,0.31990204531033944,0.5567616463138851,0.5572139303482587,0.715281812899477,0.7156549520766773,0.7719697358587676,0.23400252657748982,0.02,0.5567616463138851,0.5572139303482587,0.5567616463138851,0.5572139303482587,1.0,1.0,none,0.5,0.5,0.8188949015771912,0.31990204531033944,COMPLETE
