number,value,datetime_start,datetime_complete,duration,params_alpha,params_booster,params_colsample_bytree,params_gamma,params_grow_policy,params_lambda,params_learning_rate,params_max_delta_step,params_max_depth,params_min_child_weight,params_n_estimators,params_normalize_type,params_params_feature_fraction,params_params_labeled_ratio,params_params_missing_rate,params_params_resampling,params_params_sample_rows,params_params_scale_pos_weight,params_params_selftrain_max_iter,params_params_selftrain_threshold,params_rate_drop,params_sample_type,params_skip_drop,params_subsample,params_user_attrs_decision_threshold,user_attrs_acc_test,user_attrs_acc_val,user_attrs_f1_test,user_attrs_f1_val,user_attrs_feature_fraction,user_attrs_labeled_ratio,user_attrs_missing_rate,user_attrs_pr_auc_test,user_attrs_pr_auc_val,user_attrs_prec_test,user_attrs_prec_val,user_attrs_rec_test,user_attrs_rec_val,user_attrs_resampling_strategy,user_attrs_roc_auc_test,user_attrs_roc_auc_val,user_attrs_sample_rows,user_attrs_user_attrs_decision_threshold,state
2152,0.7156549520766773,2025-11-30 12:19:53.937266,2025-11-30 12:20:11.569072,0 days 00:00:17.631806,0.00011605572822683442,dart,0.3764044625726348,6.619487321735314,depthwise,0.0002586229648238957,0.0009105346114025045,10,10,77.99399589893298,400,tree,0.7541356875230982,0.7512265354266274,0.06566050997098814,undersample,0.5996140732120896,,12.0,0.7567573325219059,0.32600642983430705,uniform,0.4539476912004997,0.9976370753640804,,0.5567616463138851,0.5572139303482587,0.715281812899477,0.7156549520766773,0.7541356875230982,0.7512265354266274,0.08,0.5567616463138851,0.5572139303482587,0.5567616463138851,0.5572139303482587,1.0,1.0,undersample,0.5,0.5,0.5996140732120896,0.5,COMPLETE
2153,0.7156549520766773,2025-11-30 12:20:12.357807,2025-11-30 12:21:54.424183,0 days 00:01:42.066376,0.005371453287502338,dart,0.9344035216313173,6.734584835406308,depthwise,52.194022370392666,0.013986192368845227,6,6,12.044124117982347,1000,forest,0.5380725811007652,0.3106418135208347,0.04346325243910505,oversample,0.5029693768415349,,10.0,0.8327785684497117,0.3728818670481641,weighted,0.3177327514027582,0.4330892229007936,,0.5567616463138851,0.5572139303482587,0.715281812899477,0.7156549520766773,0.5380725811007652,0.3106418135208347,0.08,0.5567616463138851,0.5572139303482587,0.5567616463138851,0.5572139303482587,1.0,1.0,oversample,0.5,0.5,0.5029693768415349,0.5,COMPLETE
2154,0.7156549520766773,2025-11-30 12:21:55.235605,2025-11-30 12:22:32.454564,0 days 00:00:37.218959,43.10962621573522,dart,0.25855783881998273,5.904214750302634,lossguide,0.18841774919244533,0.034559706579674124,6,4,6.400686650767645,600,forest,0.5888582919581289,0.5254455180883637,0.0758365495956166,oversample,0.7358465349378159,,6.0,0.8131777606125008,0.3062126245483672,uniform,0.20934168971137584,0.3033251174612464,,0.5567616463138851,0.5572139303482587,0.715281812899477,0.7156549520766773,0.5888582919581289,0.5254455180883637,0.08,0.5567616463138851,0.5572139303482587,0.5567616463138851,0.5572139303482587,1.0,1.0,oversample,0.5,0.5,0.7358465349378159,0.5,COMPLETE
2155,0.5059184568171854,2025-11-30 12:22:33.228662,2025-11-30 12:22:34.260925,0 days 00:00:01.032263,0.0003689127582472901,gbtree,0.8688140662181689,4.325966430678648,depthwise,0.9095449697779293,0.001751093009237661,1,7,0.22408924917939135,1000,,0.5623700939046818,0.5232303408270629,0.028702022134098438,undersample,0.9522425131004499,,12.0,0.7520207885694687,,,,0.4450152761341989,,0.5083672546359114,0.4902758932609679,0.5200883002207506,0.5059184568171854,0.5623700939046818,0.5232303408270629,0.08,0.5429677635108829,0.5337792532262648,0.5696324951644101,0.550047664442326,0.4784727863525589,0.46834415584415584,undersample,0.5036721431058208,0.479186288685778,0.9522425131004499,0.5,COMPLETE
2156,0.7156549520766773,2025-11-30 12:22:35.049971,2025-11-30 12:22:35.439860,0 days 00:00:00.389889,0.0015503883149084825,gbtree,0.47218498745355647,5.938300983792906,lossguide,0.16816675110025403,0.004594128200581197,3,12,0.2830216017214953,200,,0.6368191551500114,0.34749744980443875,0.08797224082996742,oversample,0.6110699608806066,,7.0,0.8699011339691058,,,,0.6824305115410968,,0.5567616463138851,0.5572139303482587,0.715281812899477,0.7156549520766773,0.6368191551500114,0.34749744980443875,0.08,0.6475500852593317,0.6668669398738769,0.5567616463138851,0.5572139303482587,1.0,1.0,oversample,0.5841608779986406,0.602897039120226,0.6110699608806066,0.5,COMPLETE
2157,0.0,2025-11-30 12:22:36.233798,2025-11-30 12:22:46.157133,0 days 00:00:09.923335,0.0006704232617817619,dart,0.884827997547045,6.325089742882501,lossguide,0.12239205197575,0.18274720467924035,7,6,1.2808066839951084,300,forest,0.9899320592111855,0.8071002539849497,0.04533040523767576,none,0.9289892895005605,0.7678449299790588,12.0,0.6932766235621225,0.43333028749857294,weighted,0.09368273892012031,0.7192556782326682,,0.44323835368611486,0.4427860696517413,0.0,0.0,0.9899320592111855,0.8071002539849497,0.08,0.6487469390852153,0.6661247064969193,0.0,0.0,0.0,0.0,none,0.6034271954110645,0.6059684378440763,0.9289892895005605,0.5,COMPLETE
2158,0.7112970711297071,2025-11-30 12:22:46.901439,2025-11-30 12:22:47.772303,0 days 00:00:00.870864,0.00042652494518732295,gbtree,0.6412559686089409,7.034304233584269,lossguide,0.01027591395020131,0.44756448679360494,5,12,0.9599181695070947,300,,0.9820255844228005,0.7396580606219121,0.05927595785429434,none,0.6171914762522865,1.3391498725544169,5.0,0.7247228158827073,,,,0.5141538455058592,,0.5626413387607417,0.5630936227951153,0.7093477607454163,0.7112970711297071,0.9820255844228005,0.7396580606219121,0.08,0.5095346090136106,0.5006938088275377,0.5629770992366412,0.5629139072847682,0.958570268074736,0.9659090909090909,none,0.4607080687677183,0.4381686686653489,0.6171914762522865,0.5,COMPLETE
2159,0.700738552437223,2025-11-30 12:22:48.517880,2025-11-30 12:22:49.523757,0 days 00:00:01.005877,0.055732516795748706,gbtree,0.7612047616999023,3.01768552165938,depthwise,0.000977087900674966,0.4997827319500499,8,12,0.6451585567341808,300,,0.6743166149841464,0.2754947768824811,0.02814161142143904,none,0.9592633141980301,4.66222762210027,8.0,0.7360062233671174,,,,0.8926750078685981,,0.5454545454545454,0.5418362731795567,0.702398578620077,0.700738552437223,0.6743166149841464,0.2754947768824811,0.08,0.471409388695666,0.4648164306413032,0.5526561043802423,0.5508592661402694,0.9634443541835905,0.9626623376623377,none,0.3895082809728278,0.3796077199103246,0.9592633141980301,0.5,COMPLETE
2160,0.7156976744186047,2025-11-30 12:22:50.301020,2025-11-30 12:24:33.209903,0 days 00:01:42.908883,0.015589821834350455,dart,0.419697688198435,3.0904958501240243,depthwise,0.000261530684883269,0.005717855437302292,2,12,14.386319618108498,900,forest,0.6332306380896915,0.8367078742370926,0.00737869831214143,oversample,0.5185151328025084,,5.0,0.8663296605110595,0.16541838124540337,weighted,0.7427723557941825,0.7583321826626381,,0.5563093622795116,0.5576662143826323,0.7149084568439407,0.7156976744186047,0.6332306380896915,0.8367078742370926,0.08,0.5450421163528338,0.5561187864650236,0.5565610859728507,0.5575181159420289,0.9991876523151909,0.9991883116883117,oversample,0.46011041297103733,0.4793230900866243,0.5185151328025084,0.5,COMPLETE
2161,0.7482142857142857,2025-11-30 12:24:33.986986,2025-11-30 12:26:27.101107,0 days 00:01:53.114121,2.017968358037072,dart,0.7560704340837809,2.8423272884048876,depthwise,66.26400205471587,0.0002865296615868151,10,10,5.348479031649375,1000,forest,0.5582261405462208,0.37345751900763213,0.09115463022293835,undersample,0.5531009338095688,,5.0,0.8597950492304272,0.16596356739634333,weighted,0.03729251855944739,0.6886124718299353,,0.7657168701944821,0.7449118046132972,0.7695729537366548,0.7482142857142857,0.5582261405462208,0.37345751900763213,0.1,0.853088065967596,0.8359682268016538,0.8505408062930186,0.8313492063492064,0.7026807473598701,0.6801948051948052,undersample,0.8129221306719275,0.7858738873486064,0.5531009338095688,0.5,COMPLETE
2162,0.0,2025-11-30 12:26:27.890859,2025-11-30 12:26:28.685620,0 days 00:00:00.794761,33.828698304028066,gbtree,0.6712107911882228,9.668005974515538,lossguide,40.4913491231298,0.0004251684443334555,3,9,20.244948165906724,900,,0.6505775994486382,0.7963256915618258,0.04444937233583467,undersample,0.5768332713863062,,11.0,0.830893424344115,,,,0.20624817232459458,,0.44323835368611486,0.4427860696517413,0.0,0.0,0.6505775994486382,0.7963256915618258,0.08,0.5567616463138851,0.5572139303482587,0.0,0.0,0.0,0.0,undersample,0.5,0.5,0.5768332713863062,0.5,COMPLETE
2163,0.7156549520766773,2025-11-30 12:26:29.465944,2025-11-30 12:27:15.825082,0 days 00:00:46.359138,56.43070319964645,dart,0.43480980166915484,1.3950519378682968,lossguide,6.750938648817193,0.09912426604101286,10,5,5.051983971483572,600,forest,0.7542549468453351,0.6257346686579168,0.08757651744100993,oversample,0.6687852680630149,,6.0,0.6133063813898777,0.06799634499580381,uniform,0.436643668187384,0.4769310981027727,,0.5567616463138851,0.5572139303482587,0.715281812899477,0.7156549520766773,0.7542549468453351,0.6257346686579168,0.08,0.5567616463138851,0.5572139303482587,0.5567616463138851,0.5572139303482587,1.0,1.0,oversample,0.5,0.5,0.6687852680630149,0.5,COMPLETE
2164,0.7156549520766773,2025-11-30 12:27:16.630665,2025-11-30 12:27:26.165721,0 days 00:00:09.535056,0.00036472388655969654,dart,0.577183773373824,3.650435474567474,depthwise,0.004037422864431131,0.001988230920042789,10,11,25.222753123337494,300,forest,0.6436464408873733,0.8157770798115531,0.00257377755831153,none,0.7518486525907582,1.493427134208028,12.0,0.699724468482537,0.2708165054274115,weighted,0.022451066830299096,0.424565272459307,,0.5567616463138851,0.5572139303482587,0.715281812899477,0.7156549520766773,0.6436464408873733,0.8157770798115531,0.08,0.5790842883672539,0.573747466895347,0.5567616463138851,0.5572139303482587,1.0,1.0,none,0.54649944461944,0.5346837151612434,0.7518486525907582,0.5,COMPLETE
2165,0.20182440136830102,2025-11-30 12:27:26.937304,2025-11-30 12:27:27.762707,0 days 00:00:00.825403,7.9154622547514695,gbtree,0.8627116420028684,7.785842640282813,lossguide,12.863133165765777,0.0033980898225559946,6,9,7.742031038636278,900,,0.5350867839324522,0.5505311270453727,0.060334759505620006,undersample,0.5573462627234522,,9.0,0.9372598055382105,,,,0.3328616708747344,,0.3749434644957033,0.36680235187697874,0.21387940841865757,0.20182440136830102,0.5350867839324522,0.5505311270453727,0.08,0.5406900790472248,0.5297536743777034,0.3567362428842505,0.3390804597701149,0.15272136474411047,0.14366883116883117,undersample,0.48628831711401055,0.45540896156958466,0.5573462627234522,0.5,COMPLETE
2166,0.4648910411622276,2025-11-30 12:27:28.533571,2025-11-30 12:27:58.933831,0 days 00:00:30.400260,0.0003266745100223719,dart,0.9239545706374586,9.14602694494837,lossguide,0.0007727238877514441,0.02215971878700033,0,9,72.23248301270094,500,forest,0.6302738191828413,0.5919631875527117,0.05778637242618545,undersample,0.8386062145569764,,8.0,0.7673754739460215,0.10990219892823594,uniform,0.13443857519104904,0.8477138622390636,,0.5156037991858887,0.5002261420171868,0.49457291175082585,0.4648910411622276,0.6302738191828413,0.5919631875527117,0.08,0.5729126741708574,0.5665764118165432,0.5900900900900901,0.5762304921968787,0.4256701868399675,0.38961038961038963,undersample,0.5326186607868167,0.5237992982502686,0.8386062145569764,0.5,COMPLETE
2167,0.28382502543234994,2025-11-30 12:27:59.710030,2025-11-30 12:28:15.488741,0 days 00:00:15.778711,0.3615753672394016,dart,0.5313768400767132,7.738629651893243,depthwise,0.02715209645357722,0.051695778754417235,8,6,64.65296948975022,400,tree,0.6264399436007886,0.8244793344767383,0.040850911789762606,undersample,0.8737881818248033,,5.0,0.7339986569376004,0.4192542954038124,uniform,0.28492596992695757,0.7971982527005632,,0.35956580732700133,0.36318407960199006,0.2834008097165992,0.28382502543234994,0.6264399436007886,0.8244793344767383,0.08,0.49883421709206416,0.5063923933400964,0.37583892617449666,0.3801089918256131,0.22745735174654752,0.22646103896103897,undersample,0.32893408378786126,0.33264089715187783,0.8737881818248033,0.5,COMPLETE
2168,0.7156549520766773,2025-11-30 12:28:16.264822,2025-11-30 12:29:46.355644,0 days 00:01:30.090822,0.00028900857182324386,dart,0.74468809664891,2.4792722825366518,depthwise,0.01126172424503792,0.0005491239718730559,9,10,32.89180280433446,900,forest,0.6242426440680247,0.8985005881163437,0.03995204466363517,oversample,0.8463308231419517,,8.0,0.8428958489959906,0.39687562484632666,uniform,0.5982108510431964,0.24428505050749108,,0.5567616463138851,0.5572139303482587,0.715281812899477,0.7156549520766773,0.6242426440680247,0.8985005881163437,0.08,0.46106726036107754,0.45698482357035536,0.5567616463138851,0.5572139303482587,1.0,1.0,oversample,0.3599831727979575,0.35791806508098645,0.8463308231419517,0.5,COMPLETE
2169,0.7156549520766773,2025-11-30 12:29:47.136140,2025-11-30 12:31:42.349711,0 days 00:01:55.213571,0.012000657854649207,dart,0.2380966086798548,2.3985798314356552,lossguide,16.895963910633697,0.0010176159450975247,3,4,13.451575201557022,1000,tree,0.6896178772281955,0.7231502210736063,0.04582788935837623,oversample,0.6672721893328608,,6.0,0.8909562806840405,0.45876974312941016,weighted,0.6819608431062043,0.3446715199326553,,0.5567616463138851,0.5572139303482587,0.715281812899477,0.7156549520766773,0.6896178772281955,0.7231502210736063,0.08,0.5793608871428749,0.5603777193894608,0.5567616463138851,0.5572139303482587,1.0,1.0,oversample,0.5509901523566372,0.5101286928087234,0.6672721893328608,0.5,COMPLETE
2170,0.7156549520766773,2025-11-30 12:31:43.135778,2025-11-30 12:31:44.008652,0 days 00:00:00.872874,0.001470439449262901,gbtree,0.9511719176820199,7.9973012895200934,lossguide,0.0009397779230710418,0.0002886529888236269,9,12,0.17459089217410229,1000,,0.621790135554285,0.32434260305292617,0.0566088448063145,oversample,0.8026952402510181,,10.0,0.7445326590484022,,,,0.9056287380206616,,0.5567616463138851,0.5572139303482587,0.715281812899477,0.7156549520766773,0.621790135554285,0.32434260305292617,0.08,0.5303130904157232,0.5279716042994623,0.5567616463138851,0.5572139303482587,1.0,1.0,oversample,0.42161549428869843,0.41353571096931674,0.8026952402510181,0.5,COMPLETE
2171,0.47467320261437906,2025-11-30 12:31:44.790850,2025-11-30 12:32:36.208028,0 days 00:00:51.417178,10.708258585598033,dart,0.5200351093480389,1.91173764997013,lossguide,0.38699504467196594,0.0003947674489039386,3,4,0.19019601802384434,700,tree,0.8671481012922249,0.7018825510870823,0.0243712226106518,undersample,0.7166324117502467,,5.0,0.8045690478174953,0.29783450221934754,uniform,0.15667425994829912,0.9150941216539659,,0.4088647670737223,0.4183627317955676,0.4650020466639378,0.47467320261437906,0.8671481012922249,0.7018825510870823,0.08,0.5074049734657188,0.5090813317539988,0.46864686468646866,0.4777960526315789,0.4614134849715678,0.4715909090909091,undersample,0.4236898821266931,0.4274488279850895,0.7166324117502467,0.5,COMPLETE
2172,0.7156549520766773,2025-11-30 12:32:36.993829,2025-11-30 12:32:37.395137,0 days 00:00:00.401308,4.0194364986988695,gbtree,0.7072728647172541,9.286424880696137,lossguide,2.085029320764586,0.0007758333429426453,9,6,6.080552524319319,200,,0.8499943823134306,0.6057832168216644,0.0795336225388004,none,0.6940495176034925,0.8107556697002672,8.0,0.6961081449371,,,,0.9607144882964982,,0.5567616463138851,0.5572139303482587,0.715281812899477,0.7156549520766773,0.8499943823134306,0.6057832168216644,0.08,0.5567616463138851,0.5572139303482587,0.5567616463138851,0.5572139303482587,1.0,1.0,none,0.5,0.5,0.6940495176034925,0.5,COMPLETE
2173,0.43197990791125995,2025-11-30 12:32:38.195180,2025-11-30 12:32:38.835594,0 days 00:00:00.640414,0.00025314784807531744,gbtree,0.5362074716787003,3.6772668506784956,depthwise,3.7705245503234495,0.01016400564886467,1,7,3.6790953262794757,500,,0.6149247638968407,0.4783670637520879,0.016822325458257025,undersample,0.9641041971646881,,12.0,0.8755776851088888,,,,0.22843077802747686,,0.38037087290818633,0.386250565355043,0.41602728047740833,0.43197990791125995,0.6149247638968407,0.4783670637520879,0.08,0.4415443873163429,0.44471917601960576,0.43766816143497755,0.445980985306828,0.39642567018683994,0.41883116883116883,undersample,0.31775891510137766,0.325414881339294,0.9641041971646881,0.5,COMPLETE
2174,0.7156549520766773,2025-11-30 12:32:39.628734,2025-11-30 12:33:52.377950,0 days 00:01:12.749216,63.82110189970078,dart,0.7979054252466149,0.39783298028444825,lossguide,0.00012106469354934353,0.010955950103411329,10,8,27.582335570455804,1000,tree,0.5998364169650985,0.8048403842548555,0.03677468090306375,oversample,0.9867593789900498,,12.0,0.8067004427693598,0.46679979781197734,uniform,0.008322396281575916,0.862856548458145,,0.5567616463138851,0.5572139303482587,0.715281812899477,0.7156549520766773,0.5998364169650985,0.8048403842548555,0.08,0.5634385297968274,0.5650766328717889,0.5567616463138851,0.5572139303482587,1.0,1.0,oversample,0.5355907757091464,0.5349900673891992,0.9867593789900498,0.5,COMPLETE
2175,0.7156549520766773,2025-11-30 12:33:53.223946,2025-11-30 12:33:54.107077,0 days 00:00:00.883131,0.045133071728336714,gbtree,0.8882249892146437,9.623967374499934,lossguide,0.0007646911007587632,0.0001267847678443686,5,3,67.8568557346479,1000,,0.5305987235517708,0.4680927916574019,0.07354093600258586,none,0.8242068511209142,1.1551288890960145,12.0,0.7363483969652672,,,,0.5952740223905459,,0.5567616463138851,0.5572139303482587,0.715281812899477,0.7156549520766773,0.5305987235517708,0.4680927916574019,0.08,0.5372705538491128,0.5421812981935586,0.5567616463138851,0.5572139303482587,1.0,1.0,none,0.47535312256502926,0.47022248053274607,0.8242068511209142,0.5,COMPLETE
2176,0.3798604187437687,2025-11-30 12:33:54.914159,2025-11-30 12:35:39.937310,0 days 00:01:45.023151,0.012854568020799966,dart,0.9396041688549868,8.14158700037487,lossguide,25.766000969684598,0.00010168523906603265,3,7,0.7178076357562369,900,forest,0.9820504698862312,0.5158763730148893,0.03207605619149589,undersample,0.8841805720488163,,6.0,0.9428825366652231,0.04895939939537075,uniform,0.4511126806074121,0.4351930023832387,,0.4355495251017639,0.43735866123925826,0.3741223671013039,0.3798604187437687,0.9820504698862312,0.5158763730148893,0.08,0.5151846669904975,0.5162854138035039,0.4888597640891219,0.49224806201550386,0.30300568643379366,0.3092532467532468,undersample,0.453207944428787,0.4599333569903028,0.8841805720488163,0.5,COMPLETE
2177,0.0,2025-11-30 12:35:40.702029,2025-11-30 12:35:41.095350,0 days 00:00:00.393321,0.04042499094616994,gbtree,0.6913794653013485,8.865051551042045,lossguide,0.6517238033022593,0.0031001154388840954,5,5,1.9651341966541556,200,,0.813318375871275,0.8946428736237724,0.08965112620633213,undersample,0.9405838470340862,,7.0,0.8914059812377644,,,,0.9903981596878502,,0.44323835368611486,0.4427860696517413,0.0,0.0,0.813318375871275,0.8946428736237724,0.08,0.5567616463138851,0.5572139303482587,0.0,0.0,0.0,0.0,undersample,0.5,0.5,0.9405838470340862,0.5,COMPLETE
2178,0.7156549520766773,2025-11-30 12:35:41.881076,2025-11-30 12:36:14.720745,0 days 00:00:32.839669,0.005980814933832687,dart,0.6094452480528296,9.567513987490006,lossguide,83.12543442517558,0.001479500545650217,10,5,2.9496473746857776,500,forest,0.864232747446509,0.4354454587078482,0.08726019267536066,oversample,0.6527364900621934,,12.0,0.8679106396163433,0.014717618530680598,weighted,0.09087865174848941,0.48117496619798805,,0.5567616463138851,0.5572139303482587,0.715281812899477,0.7156549520766773,0.864232747446509,0.4354454587078482,0.08,0.5567616463138851,0.5572139303482587,0.5567616463138851,0.5572139303482587,1.0,1.0,oversample,0.5,0.5,0.6527364900621934,0.5,COMPLETE
2179,0.7156549520766773,2025-11-30 12:36:15.484925,2025-11-30 12:36:20.748899,0 days 00:00:05.263974,0.7863501173292637,dart,0.7737481922384848,5.425058428622357,lossguide,0.0038147480061473424,0.00022701300477231967,8,11,1.3145444889328513,200,forest,0.5454629649101902,0.7474947543970911,0.06073648217266423,none,0.9300717501523246,2.116330251554564,9.0,0.6898598428521701,0.40534817300072784,weighted,0.6428159773666934,0.6435429819139291,,0.5567616463138851,0.5572139303482587,0.715281812899477,0.7156549520766773,0.5454629649101902,0.7474947543970911,0.08,0.5477495720799181,0.5270606493660068,0.5567616463138851,0.5572139303482587,1.0,1.0,none,0.47281039141895587,0.4468750414549699,0.9300717501523246,0.5,COMPLETE
2180,0.7156549520766773,2025-11-30 12:36:21.578136,2025-11-30 12:36:22.281012,0 days 00:00:00.702876,0.04194133338965697,gbtree,0.21638927621594758,3.024312445516868,lossguide,2.8963853574925316,0.00692995032040251,8,12,0.6860791954813222,600,,0.9548706339931349,0.46924087120387753,0.0023128386675719927,oversample,0.87325542999133,,9.0,0.7009837510020125,,,,0.5350307878283922,,0.5567616463138851,0.5572139303482587,0.715281812899477,0.7156549520766773,0.9548706339931349,0.46924087120387753,0.08,0.47084662785033105,0.4610464640674794,0.5567616463138851,0.5572139303482587,1.0,1.0,oversample,0.3862580613073824,0.3720790828170808,0.87325542999133,0.5,COMPLETE
2181,0.7156549520766773,2025-11-30 12:36:23.052454,2025-11-30 12:36:23.840363,0 days 00:00:00.787909,0.01695143429945738,gbtree,0.6126834383212678,6.9737082571724995,depthwise,53.694312860503416,0.00029162786192737337,7,4,4.287591497920469,900,,0.6678361269896979,0.6677082216590107,0.08621976301852417,oversample,0.6901574685562453,,6.0,0.7007291632455362,,,,0.4772454817629573,,0.5567616463138851,0.5572139303482587,0.715281812899477,0.7156549520766773,0.6678361269896979,0.6677082216590107,0.08,0.5238319652282958,0.5345930089558726,0.5567616463138851,0.5572139303482587,1.0,1.0,oversample,0.4372283194350039,0.4492081271639495,0.6901574685562453,0.5,COMPLETE
