number,value,datetime_start,datetime_complete,duration,params_alpha,params_booster,params_colsample_bytree,params_gamma,params_grow_policy,params_lambda,params_learning_rate,params_max_delta_step,params_max_depth,params_min_child_weight,params_n_estimators,params_normalize_type,params_params_feature_fraction,params_params_labeled_ratio,params_params_missing_rate,params_params_resampling,params_params_sample_rows,params_params_scale_pos_weight,params_params_selftrain_max_iter,params_params_selftrain_threshold,params_rate_drop,params_sample_type,params_skip_drop,params_subsample,params_user_attrs_decision_threshold,user_attrs_acc_test,user_attrs_acc_val,user_attrs_f1_test,user_attrs_f1_val,user_attrs_feature_fraction,user_attrs_labeled_ratio,user_attrs_missing_rate,user_attrs_pr_auc_test,user_attrs_pr_auc_val,user_attrs_prec_test,user_attrs_prec_val,user_attrs_rec_test,user_attrs_rec_val,user_attrs_resampling_strategy,user_attrs_roc_auc_test,user_attrs_roc_auc_val,user_attrs_sample_rows,user_attrs_user_attrs_decision_threshold,state
1070,0.7156549520766773,2025-11-27 00:08:00.416095,2025-11-27 00:08:01.284835,0 days 00:00:00.868740,14.38781157039813,gbtree,0.6634210922534336,5.492671196534221,depthwise,0.0005095846560953239,0.034515566921734714,6,5,0.46143986623971806,700,,0.7601920058489376,0.5420682117253365,0.08719405014503025,undersample,0.538662332404556,,6.0,0.741518251727924,,,,0.44986615798763363,0.3469372030626332,0.5567616463138851,0.5572139303482587,0.715281812899477,0.7156549520766773,0.7601920058489376,0.5420682117253365,0.08,0.464592445050736,0.46263920220734955,0.5567616463138851,0.5572139303482587,1.0,1.0,undersample,0.33846176163397934,0.3373725674223631,0.538662332404556,0.3469372030626332,COMPLETE
1071,0.7156549520766773,2025-11-27 00:08:01.463928,2025-11-27 00:08:06.713299,0 days 00:00:05.249371,0.00252445001789156,dart,0.8377104654886725,0.7611034628983198,lossguide,0.005890565443225044,0.029703642031757165,0,5,2.9435243853867497,200,tree,0.9549883761398659,0.7928003702587051,0.09681606509931988,oversample,0.5953782397592889,,5.0,0.7479288996514496,0.30802194356312856,weighted,0.1518659856483944,0.20199392013525977,0.3344668283551367,0.5567616463138851,0.5572139303482587,0.715281812899477,0.7156549520766773,0.9549883761398659,0.7928003702587051,0.1,0.533285225583507,0.5291370456410405,0.5567616463138851,0.5572139303482587,1.0,1.0,oversample,0.48142334919345475,0.49609577092978524,0.5953782397592889,0.3344668283551367,COMPLETE
1072,0.3567220139260846,2025-11-27 00:08:06.891521,2025-11-27 00:10:17.333573,0 days 00:02:10.442052,1.5247781360264148,dart,0.6019676907055085,2.5269106943275474,depthwise,0.0002488535088893699,0.010177596375812309,9,10,0.21713770137923075,1000,forest,0.5563223456160732,0.8334955899846878,0.05844109391711134,oversample,0.953869874797401,,5.0,0.7339758187402508,0.04023938673777916,weighted,0.6224854789558912,0.6510850723670887,0.5683941323386323,0.451831750339213,0.45680687471732245,0.35394456289978676,0.3567220139260846,0.5563223456160732,0.8334955899846878,0.05,0.5324185047486553,0.5254273357974755,0.5147286821705427,0.5244094488188976,0.2696994313566206,0.2702922077922078,oversample,0.4973026741159502,0.49580641523951025,0.953869874797401,0.5683941323386323,COMPLETE
1073,0.7156549520766773,2025-11-27 00:10:17.510264,2025-11-27 00:10:38.334076,0 days 00:00:20.823812,0.00037648421925446946,dart,0.8580534994100325,5.173074770173217,lossguide,0.06864841660792942,0.006628790332373252,4,3,1.3185885295665445,400,forest,0.918818893929448,0.8723896550088375,0.07287593366122522,oversample,0.667097462444969,,5.0,0.7289334885147947,0.19971119699891038,weighted,0.778777477209553,0.2720353748183148,0.04989420303718045,0.5567616463138851,0.5572139303482587,0.715281812899477,0.7156549520766773,0.918818893929448,0.8723896550088375,0.08,0.48128115889382084,0.4775433069700605,0.5567616463138851,0.5572139303482587,1.0,1.0,oversample,0.4037757588819444,0.40127415995648885,0.667097462444969,0.04989420303718045,COMPLETE
1074,0.7156549520766773,2025-11-27 00:10:38.509024,2025-11-27 00:10:50.409102,0 days 00:00:11.900078,0.7696980636247912,dart,0.801272679600995,5.146411715227476,lossguide,0.02386701863102185,0.0003301122185261398,1,7,4.206347451362601,300,forest,0.9270118517023821,0.371935438534417,0.07068135837334553,none,0.7914275265384744,1.4669543939782899,6.0,0.7756229797373713,0.05784458714528707,weighted,0.13709429447028285,0.8455913274201153,0.4415200874459493,0.5567616463138851,0.5572139303482587,0.715281812899477,0.7156549520766773,0.9270118517023821,0.371935438534417,0.08,0.4589706216679903,0.44091188038848916,0.5567616463138851,0.5572139303482587,1.0,1.0,none,0.31606127422536845,0.28701472812172507,0.7914275265384744,0.4415200874459493,COMPLETE
1075,0.0,2025-11-27 00:10:50.571900,2025-11-27 00:11:06.856732,0 days 00:00:16.284832,0.004905361361123593,dart,0.5031149747537421,9.784921936500103,depthwise,0.00010836945119097432,0.00575122724932873,10,3,0.13235026448346388,400,tree,0.8486083858302581,0.806280650516847,0.0835710386482253,oversample,0.9076496082090333,,11.0,0.8003984358993734,0.41864585008468524,weighted,0.3466351852606715,0.3515314884658436,0.7078550568327682,0.44323835368611486,0.4427860696517413,0.0,0.0,0.8486083858302581,0.806280650516847,0.08,0.5683487487699617,0.5501134150570943,0.0,0.0,0.0,0.0,oversample,0.49896425670186845,0.4845592673414431,0.9076496082090333,0.7078550568327682,COMPLETE
1076,0.0,2025-11-27 00:11:07.028406,2025-11-27 00:12:24.808089,0 days 00:01:17.779683,3.8684613115196833,dart,0.8167809833122687,5.376876195486438,lossguide,2.7671340171330914,0.03218873168609814,6,11,1.024736898149551,800,tree,0.8249325811928212,0.14142791570627206,0.09604571474826862,none,0.6109112638485057,0.7010970285239548,6.0,0.6104920292310483,0.08481812956163065,weighted,0.0021792525678824837,0.7125800185315013,0.6569201487449319,0.44323835368611486,0.4427860696517413,0.0,0.0,0.8249325811928212,0.14142791570627206,0.1,0.37314398267632093,0.37531165596776783,0.0,0.0,0.0,0.0,none,0.09558555347402975,0.09856706750858946,0.6109112638485057,0.6569201487449319,COMPLETE
1077,0.7156549520766773,2025-11-27 00:12:24.984660,2025-11-27 00:12:33.320299,0 days 00:00:08.335639,0.015412115751452229,dart,0.6633862426177444,1.7136608753871727,lossguide,0.00875042045539098,0.029052674837508317,5,6,0.6247665976902507,200,tree,0.9382715389154378,0.8350116413606047,0.09768288975391078,oversample,0.8714874856308563,,5.0,0.7382027815084298,0.28331201414858537,weighted,0.37487384983618766,0.24210335572792618,0.1546103549962528,0.5567616463138851,0.5572139303482587,0.715281812899477,0.7156549520766773,0.9382715389154378,0.8350116413606047,0.1,0.5318883691904659,0.5381619347483692,0.5567616463138851,0.5572139303482587,1.0,1.0,oversample,0.48076476732041307,0.502278365148641,0.8714874856308563,0.1546103549962528,COMPLETE
1078,0.7156549520766773,2025-11-27 00:12:33.500703,2025-11-27 00:12:34.223474,0 days 00:00:00.722771,0.004815775932165456,gbtree,0.8686113513281362,3.3736181581570035,lossguide,0.601933286688628,0.06357597796423804,6,12,20.69207960475274,500,,0.8722349446339211,0.11658442913018488,0.07371734309933681,oversample,0.5218172638554105,,6.0,0.7077226859231089,,,,0.32375373310898475,0.38412608004787807,0.5567616463138851,0.5572139303482587,0.715281812899477,0.7156549520766773,0.8722349446339211,0.11658442913018488,0.08,0.5567616463138851,0.5572139303482587,0.5567616463138851,0.5572139303482587,1.0,1.0,oversample,0.5,0.5,0.5218172638554105,0.38412608004787807,COMPLETE
1079,0.7156549520766773,2025-11-27 00:12:34.403622,2025-11-27 00:12:39.847748,0 days 00:00:05.444126,0.00023487141121241874,dart,0.6686974227563384,3.899532223279586,depthwise,0.00045803174928986927,0.026278364809239094,3,12,0.24717289094378386,200,forest,0.9665578826206463,0.8690557954064468,0.03506772983476382,undersample,0.7710680919389057,,12.0,0.7747385813404182,0.2945621417954572,uniform,0.5784240819474769,0.38950587033812323,0.2500537421859046,0.5567616463138851,0.5572139303482587,0.715281812899477,0.7156549520766773,0.9665578826206463,0.8690557954064468,0.05,0.4821344222546702,0.4634596379854248,0.5567616463138851,0.5572139303482587,1.0,1.0,undersample,0.4153094381538155,0.3873709921335049,0.7710680919389057,0.2500537421859046,COMPLETE
1080,0.7156549520766773,2025-11-27 00:12:40.025345,2025-11-27 00:13:19.996396,0 days 00:00:39.971051,51.113500172803235,dart,0.48061017537968004,4.859778674015736,lossguide,0.019687471023693393,0.0002034958386220729,0,7,0.6809971815942392,600,tree,0.8529285139818085,0.5370386579822467,0.0623025142974788,undersample,0.7306442585916895,,5.0,0.7476641648392066,0.20185429470673316,weighted,0.19881599462694338,0.6480129781335484,0.24345172151692474,0.5567616463138851,0.5572139303482587,0.715281812899477,0.7156549520766773,0.8529285139818085,0.5370386579822467,0.05,0.5567616463138851,0.5572139303482587,0.5567616463138851,0.5572139303482587,1.0,1.0,undersample,0.5,0.5,0.7306442585916895,0.24345172151692474,COMPLETE
1081,0.7156549520766773,2025-11-27 00:13:20.177623,2025-11-27 00:13:24.787801,0 days 00:00:04.610178,29.47217714198704,dart,0.9147137264595159,3.6948099723959364,depthwise,0.01369623048268895,0.017488708166593616,2,3,0.9327730667150749,200,tree,0.9885425300688637,0.6852584446017262,0.07648219494478911,oversample,0.6793090120148257,,5.0,0.7836082027718648,0.2587848983250829,weighted,0.0005484907215619964,0.24442773597191908,0.13895848901505042,0.5567616463138851,0.5572139303482587,0.715281812899477,0.7156549520766773,0.9885425300688637,0.6852584446017262,0.08,0.5567616463138851,0.5572139303482587,0.5567616463138851,0.5572139303482587,1.0,1.0,oversample,0.5,0.5,0.6793090120148257,0.13895848901505042,COMPLETE
1082,0.7156549520766773,2025-11-27 00:13:24.969789,2025-11-27 00:13:25.864238,0 days 00:00:00.894449,0.06451324692003954,gbtree,0.5441914440012934,4.962794335801423,lossguide,0.1586575954740227,0.47243024154579505,2,5,0.38008413595635326,200,,0.830569554254264,0.7867815568933323,0.07788628763525338,undersample,0.8209108908193864,,5.0,0.771364071279671,,,,0.4446402664730362,0.07897506650312047,0.5567616463138851,0.5572139303482587,0.715281812899477,0.7156549520766773,0.830569554254264,0.7867815568933323,0.08,0.5262301849907196,0.5245372031023914,0.5567616463138851,0.5572139303482587,1.0,1.0,undersample,0.47931912001193655,0.4760464892615046,0.8209108908193864,0.07897506650312047,COMPLETE
1083,0.7156549520766773,2025-11-27 00:13:26.048535,2025-11-27 00:14:02.222764,0 days 00:00:36.174229,82.40981348076735,dart,0.5869473934436386,2.314602563530269,lossguide,0.015175066897243458,0.00019420220956772256,1,9,26.575398617457385,600,tree,0.7283715333130372,0.7093216237914166,0.058226726235670004,none,0.6826301817246254,1.0576772689388014,5.0,0.7218152513674212,0.25550257933482157,uniform,0.05077618426438257,0.7761643401942875,0.11496975489614751,0.5567616463138851,0.5572139303482587,0.715281812899477,0.7156549520766773,0.7283715333130372,0.7093216237914166,0.05,0.5567616463138851,0.5572139303482587,0.5567616463138851,0.5572139303482587,1.0,1.0,none,0.5,0.5,0.6826301817246254,0.11496975489614751,COMPLETE
1084,0.6946107784431138,2025-11-27 00:14:02.400114,2025-11-27 00:14:11.708319,0 days 00:00:09.308205,0.7243972617516029,gbtree,0.632187215875782,0.2948222940887899,lossguide,0.18827037684503367,0.029676628855946983,10,8,9.306385271115614,500,,0.8899012057886188,0.33238286805693423,0.09440190815031942,oversample,0.5092398106289177,,9.0,0.6832333757629535,,,,0.8902177872157113,0.19585239145599045,0.576662143826323,0.5848032564450475,0.6888297872340425,0.6946107784431138,0.8899012057886188,0.33238286805693423,0.1,0.582006680385395,0.5953672376286824,0.5830050647158131,0.588500563697858,0.8415922014622258,0.8474025974025974,oversample,0.555733682587576,0.5663180027327116,0.5092398106289177,0.19585239145599045,COMPLETE
1085,0.3740139211136891,2025-11-27 00:14:11.884268,2025-11-27 00:14:12.880161,0 days 00:00:00.995893,0.3512028251007297,gbtree,0.9847325489110806,3.621103035128251,lossguide,0.02318553798835488,0.004745781485427031,6,10,23.325460531252393,700,,0.8155998058935526,0.6272786616061969,0.07714383701456705,oversample,0.8331562952244979,,11.0,0.7887488547926933,,,,0.7641490107277198,0.5626884761833014,0.3790140208050656,0.38986883763003166,0.3483626008542952,0.3740139211136891,0.8155998058935526,0.6272786616061969,0.08,0.4570774567410667,0.4612169508504333,0.4189497716894977,0.43661971830985913,0.2981316003249391,0.32711038961038963,oversample,0.3876212304580646,0.3954439329822374,0.8331562952244979,0.5626884761833014,COMPLETE
1086,0.7156549520766773,2025-11-27 00:14:13.054117,2025-11-27 00:14:16.697668,0 days 00:00:03.643551,0.04327466856720581,gbtree,0.9604042138002866,3.1695663089334167,lossguide,4.097655464380174,0.023775589961706846,9,10,0.5312552268949642,700,,0.9604046269006987,0.6069162101292734,0.07561982342079535,oversample,0.5121324670160032,,10.0,0.6127487823218647,,,,0.6825231793944978,0.414210304954552,0.5567616463138851,0.5572139303482587,0.715281812899477,0.7156549520766773,0.9604046269006987,0.6069162101292734,0.08,0.48338464585879815,0.48187851060627324,0.5567616463138851,0.5572139303482587,1.0,1.0,oversample,0.42793356985361164,0.42209284586710527,0.5121324670160032,0.414210304954552,COMPLETE
1087,0.7156549520766773,2025-11-27 00:14:16.871068,2025-11-27 00:14:17.813166,0 days 00:00:00.942098,19.309034159136317,gbtree,0.37952674064484965,3.7987772644406403,depthwise,0.001168279603594932,0.1489064717342085,7,12,0.9184521809946424,800,,0.6100371994778679,0.5851180979979713,0.03823282963469177,oversample,0.9162421816173096,,10.0,0.6209989152511831,,,,0.6527209296700658,0.43862428189418257,0.5567616463138851,0.5572139303482587,0.715281812899477,0.7156549520766773,0.6100371994778679,0.5851180979979713,0.05,0.394852422345888,0.3935711138661012,0.5567616463138851,0.5572139303482587,1.0,1.0,oversample,0.16047099587194746,0.15525093522412214,0.9162421816173096,0.43862428189418257,COMPLETE
1088,0.7175305765870704,2025-11-27 00:14:17.989718,2025-11-27 00:14:19.869275,0 days 00:00:01.879557,0.030346511493327274,gbtree,0.928841394913993,2.565643636314057,lossguide,4.082839888556423,0.06348141250058065,10,10,5.154063548879823,400,,0.9619750737341278,0.5367115012244952,0.05278730213559371,oversample,0.5955544210571007,,6.0,0.6242960593516966,,,,0.5606698594515066,0.22498364943419438,0.5590230664857531,0.561284486657621,0.7161572052401747,0.7175305765870704,0.9619750737341278,0.5367115012244952,0.05,0.6481087207580786,0.6348377211759064,0.558076225045372,0.5594913714804723,0.9991876523151909,1.0,oversample,0.6138339495018154,0.6123587214623987,0.5955544210571007,0.22498364943419438,COMPLETE
1089,0.0,2025-11-27 00:14:20.049185,2025-11-27 00:14:21.656798,0 days 00:00:01.607613,0.5423619828366077,gbtree,0.3160152217802126,2.373767406673572,depthwise,0.0029705521200937336,0.0019926213735574046,8,11,0.7679848846331497,1000,,0.7098232507915616,0.8789812238353695,0.009907199700177009,oversample,0.9057652446374181,,9.0,0.6514882301508224,,,,0.5827168723799209,0.7370101512724431,0.44323835368611486,0.4427860696517413,0.0,0.0,0.7098232507915616,0.8789812238353695,0.0,0.4750543347599214,0.48201238949889336,0.0,0.0,0.0,0.0,oversample,0.39629014075167024,0.40572974012708435,0.9057652446374181,0.7370101512724431,COMPLETE
1090,0.7156549520766773,2025-11-27 00:14:21.835136,2025-11-27 00:14:24.072188,0 days 00:00:02.237052,0.09839791697937932,gbtree,0.8197787301557782,3.241074763407333,lossguide,23.638874306002847,0.02795167104510154,10,11,2.931416020558048,600,,0.9546905162130079,0.5508256826813717,0.033000264207611804,oversample,0.5757939976130214,,7.0,0.61325177903916,,,,0.541933311069978,0.27434315715897445,0.5567616463138851,0.5572139303482587,0.715281812899477,0.7156549520766773,0.9546905162130079,0.5508256826813717,0.02,0.44364040404727034,0.4585486000782982,0.5567616463138851,0.5572139303482587,1.0,1.0,oversample,0.3098571760141912,0.3251035545149437,0.5757939976130214,0.27434315715897445,COMPLETE
1091,0.7156549520766773,2025-11-27 00:14:24.254138,2025-11-27 00:14:24.832038,0 days 00:00:00.577900,0.0032332736668752348,gbtree,0.9341836975083978,4.774066953508823,lossguide,2.2781452743397166,0.052545419827746666,8,10,4.927796064772725,200,,0.9851229672482477,0.7046027093704128,0.028463589119948878,oversample,0.6255870504621905,,6.0,0.7366064812560598,,,,0.6033410730091516,0.09434854085730732,0.5567616463138851,0.5572139303482587,0.715281812899477,0.7156549520766773,0.9851229672482477,0.7046027093704128,0.02,0.5549511279798753,0.551823891110596,0.5567616463138851,0.5572139303482587,1.0,1.0,oversample,0.5137626618478424,0.5066394279877425,0.6255870504621905,0.09434854085730732,COMPLETE
1092,0.7156549520766773,2025-11-27 00:14:25.013360,2025-11-27 00:14:26.801766,0 days 00:00:01.788406,0.00851402613412255,gbtree,0.6358373189905726,3.1471812225853455,depthwise,2.743364991756741,0.13282633235013663,6,7,0.2299878680108219,500,,0.905404103422653,0.893124930227781,0.09286344726025707,undersample,0.6124908884029535,,8.0,0.784017050926608,,,,0.22489436783066158,0.10183977568292488,0.5567616463138851,0.5572139303482587,0.715281812899477,0.7156549520766773,0.905404103422653,0.893124930227781,0.1,0.5128310274558895,0.5040829605622857,0.5567616463138851,0.5572139303482587,1.0,1.0,undersample,0.4572945506391021,0.4483744677181858,0.6124908884029535,0.10183977568292488,COMPLETE
1093,0.0,2025-11-27 00:14:26.976739,2025-11-27 00:14:27.610854,0 days 00:00:00.634115,2.224467573151378,gbtree,0.6349216204382548,9.186326049736998,depthwise,0.0006464999495583717,0.258738267890932,5,4,0.1235728119545944,300,,0.7569417405579095,0.8351712371650748,0.040358325480915946,oversample,0.8955787869422546,,11.0,0.9142101062923439,,,,0.3914398424011469,0.7023991524196227,0.44323835368611486,0.4427860696517413,0.0,0.0,0.7569417405579095,0.8351712371650748,0.05,0.4840397465806766,0.48383772113369966,0.0,0.0,0.0,0.0,oversample,0.38375926325038545,0.3824295597150551,0.8955787869422546,0.7023991524196227,COMPLETE
1094,0.7156549520766773,2025-11-27 00:14:27.804097,2025-11-27 00:14:30.275946,0 days 00:00:02.471849,0.10749756795345666,gbtree,0.8613389172649076,1.9037831898113606,lossguide,13.879349824222148,0.013599970940761617,7,8,5.518999616914754,400,,0.9403894567303879,0.4758184391003689,0.05880084487280819,oversample,0.6855085931718315,,6.0,0.6342650996379807,,,,0.32362766745385774,0.09344698682319649,0.5567616463138851,0.5572139303482587,0.715281812899477,0.7156549520766773,0.9403894567303879,0.4758184391003689,0.05,0.5010016604158236,0.49426628233054953,0.5567616463138851,0.5572139303482587,1.0,1.0,oversample,0.406933138811983,0.40208336096998,0.6855085931718315,0.09344698682319649,COMPLETE
1095,0.7156549520766773,2025-11-27 00:14:30.451796,2025-11-27 00:14:31.451884,0 days 00:00:01.000088,0.0301129368553919,gbtree,0.9034816360514866,5.755247605562251,lossguide,7.503302655127341,0.17747469359349807,8,11,2.1433678824092244,200,,0.9772876625359895,0.5545973230993563,0.07601068230013486,none,0.714768168925229,0.8648470738949483,7.0,0.61545454179117,,,,0.45564735624803093,0.3280741347763104,0.5567616463138851,0.5572139303482587,0.715281812899477,0.7156549520766773,0.9772876625359895,0.5545973230993563,0.08,0.4220259981577942,0.42071511685942053,0.5567616463138851,0.5572139303482587,1.0,1.0,none,0.27207969296573215,0.26478408593449454,0.714768168925229,0.3280741347763104,COMPLETE
1096,0.7260483624119988,2025-11-27 00:14:31.631114,2025-11-27 00:14:33.860020,0 days 00:00:02.228906,0.018140818221893104,gbtree,0.9008807086766677,1.5210967797533932,lossguide,2.814866216092729,0.17705376106378995,9,12,7.772725782313732,500,,0.9631338660393979,0.4539427648587937,0.08758786566014101,oversample,0.6356025478597316,,6.0,0.7119909275678784,,,,0.754142734168431,0.21088921673509584,0.6001809136137495,0.5952057892356399,0.7293325168401714,0.7260483624119988,0.9631338660393979,0.4539427648587937,0.08,0.7193163281365621,0.6721389048178246,0.5852579852579852,0.5828009828009828,0.9675060926076361,0.9626623376623377,oversample,0.6844845736832508,0.6637284765796001,0.6356025478597316,0.21088921673509584,COMPLETE
1097,0.7156549520766773,2025-11-27 00:14:34.038379,2025-11-27 00:14:35.603721,0 days 00:00:01.565342,0.026614661976995326,gbtree,0.9405529274385618,1.7139061019898605,lossguide,31.566145035898785,0.07250588269859776,10,11,22.345559850791684,300,,0.8952123844792388,0.5301300734298879,0.09448400513407325,oversample,0.5689731210265518,,7.0,0.6845407058819054,,,,0.654402011650773,0.022995026744812436,0.5567616463138851,0.5572139303482587,0.715281812899477,0.7156549520766773,0.8952123844792388,0.5301300734298879,0.1,0.5544572239112082,0.5400292785323866,0.5567616463138851,0.5572139303482587,1.0,1.0,oversample,0.5026289394718082,0.48825497791279204,0.5689731210265518,0.022995026744812436,COMPLETE
1098,0.7156549520766773,2025-11-27 00:14:35.779549,2025-11-27 00:14:36.392087,0 days 00:00:00.612538,0.10674220382006915,gbtree,0.7823296230579324,3.6428501189169706,lossguide,58.20819726182137,0.156911935736111,8,9,14.608417275779324,300,,0.8540510453818582,0.43414604913753735,0.037751856086792254,undersample,0.5116918908934566,,7.0,0.6431447384230419,,,,0.49889603475545846,0.21296941677094755,0.5567616463138851,0.5572139303482587,0.715281812899477,0.7156549520766773,0.8540510453818582,0.43414604913753735,0.05,0.6149253069988914,0.6546468106850974,0.5567616463138851,0.5572139303482587,1.0,1.0,undersample,0.5604548318108722,0.5945902922409563,0.5116918908934566,0.21296941677094755,COMPLETE
