number,value,datetime_start,datetime_complete,duration,params_alpha,params_booster,params_colsample_bytree,params_gamma,params_grow_policy,params_lambda,params_learning_rate,params_max_delta_step,params_max_depth,params_min_child_weight,params_n_estimators,params_normalize_type,params_params_feature_fraction,params_params_labeled_ratio,params_params_missing_rate,params_params_resampling,params_params_sample_rows,params_params_scale_pos_weight,params_params_selftrain_max_iter,params_params_selftrain_threshold,params_rate_drop,params_sample_type,params_skip_drop,params_subsample,params_user_attrs_decision_threshold,user_attrs_acc_test,user_attrs_acc_val,user_attrs_f1_test,user_attrs_f1_val,user_attrs_feature_fraction,user_attrs_labeled_ratio,user_attrs_missing_rate,user_attrs_pr_auc_test,user_attrs_pr_auc_val,user_attrs_prec_test,user_attrs_prec_val,user_attrs_rec_test,user_attrs_rec_val,user_attrs_resampling_strategy,user_attrs_roc_auc_test,user_attrs_roc_auc_val,user_attrs_sample_rows,user_attrs_user_attrs_decision_threshold,state
782,0.7014880048587914,2025-11-26 21:29:46.931325,2025-11-26 21:29:48.500103,0 days 00:00:01.568778,0.004766066988862407,gbtree,0.49246194212459954,3.33311359184484,depthwise,0.0011376292315623106,0.335120824935199,1,5,0.4149399873771632,300,,0.8116649181524449,0.8493810956638669,0.09942301412483623,undersample,0.6780278120140474,,7.0,0.9127470266924826,,,,0.30149195114159455,0.22332315275707582,0.5517865219357757,0.5554047942107644,0.7003326277592985,0.7014880048587914,0.8116649181524449,0.8493810956638669,0.1,0.5196728446169523,0.5061093574877354,0.5578034682080925,0.5604075691411936,0.9406986190089358,0.9375,undersample,0.46955354034383856,0.45729143175517023,0.6780278120140474,0.22332315275707582,COMPLETE
783,0.7142857142857143,2025-11-26 21:29:48.684205,2025-11-26 21:29:50.056178,0 days 00:00:01.371973,0.11032502286086006,gbtree,0.3497668883066403,3.986589087606446,depthwise,0.0001332570920953694,0.4718856242973631,2,6,6.715110844308998,600,,0.9414660023172121,0.2186002020410981,0.027058171139423957,none,0.9196682846709435,3.5948407114504874,7.0,0.7726041610286064,,,,0.7799453340223921,0.9138480308529162,0.5581184984170059,0.5567616463138851,0.7152433692800932,0.7142857142857143,0.9414660023172121,0.2186002020410981,0.02,0.707982643558248,0.6989948976292275,0.5577272727272727,0.5573248407643312,0.9967506092607636,0.9943181818181818,none,0.6696650309189477,0.662192984492525,0.9196682846709435,0.9138480308529162,COMPLETE
784,0.7156549520766773,2025-11-26 21:29:50.237346,2025-11-26 21:29:59.954068,0 days 00:00:09.716722,0.0003508465511860053,dart,0.5802282438151828,3.470229124817379,lossguide,0.25207097818177304,0.059725523761066136,6,9,0.13271632343557435,300,forest,0.7607529926367669,0.5045935875736536,0.08122939885805078,undersample,0.5605124388420659,,12.0,0.6745515515433019,0.3991990610968418,weighted,0.29112262575784503,0.562462848707627,0.0360777295521299,0.5567616463138851,0.5572139303482587,0.715281812899477,0.7156549520766773,0.7607529926367669,0.5045935875736536,0.08,0.6492067886294334,0.6522737000502877,0.5567616463138851,0.5572139303482587,1.0,1.0,undersample,0.5744222384323348,0.5959794482840959,0.5605124388420659,0.0360777295521299,COMPLETE
785,0.7156549520766773,2025-11-26 21:30:00.130085,2025-11-26 21:30:01.980663,0 days 00:00:01.850578,0.03167449810730869,gbtree,0.8211069849428387,3.064038402924631,lossguide,0.08869527027105063,0.0005162991001561045,5,7,0.1820277488381316,500,,0.7393999671205171,0.2722492467625213,0.09888786227685806,none,0.8607211437779687,1.3824601413843638,5.0,0.9414401604465961,,,,0.7842117857411497,0.4638366095695106,0.5567616463138851,0.5572139303482587,0.715281812899477,0.7156549520766773,0.7393999671205171,0.2722492467625213,0.1,0.5471770212270648,0.5596019674722239,0.5567616463138851,0.5572139303482587,1.0,1.0,none,0.478276745304133,0.5030772024196436,0.8607211437779687,0.4638366095695106,COMPLETE
786,0.7156549520766773,2025-11-26 21:30:02.155879,2025-11-26 21:30:20.891428,0 days 00:00:18.735549,11.237745164131118,dart,0.4559379659864454,0.1521478403614802,depthwise,26.457649583306967,0.018754280242332454,2,7,2.4542542841040387,400,forest,0.5073699977216629,0.6595741814487087,0.09349786170831816,none,0.9496892302466283,0.8956595584576139,12.0,0.7713896244027028,0.29747534835917044,weighted,0.46061785960779905,0.40436006109865064,0.1436511062401079,0.5567616463138851,0.5572139303482587,0.715281812899477,0.7156549520766773,0.5073699977216629,0.6595741814487087,0.1,0.4782239154962479,0.49188203876812847,0.5567616463138851,0.5572139303482587,1.0,1.0,none,0.3796875777118321,0.3923733633577862,0.9496892302466283,0.1436511062401079,COMPLETE
787,0.7156549520766773,2025-11-26 21:30:21.071949,2025-11-26 21:30:21.935587,0 days 00:00:00.863638,0.16674792744362235,gbtree,0.85505809748515,2.2848171332638114,depthwise,0.0025100057386550317,0.013890897062060346,4,8,3.4723088518617744,300,,0.9005515426545391,0.5032079302820286,0.08793827148803272,undersample,0.644224419436398,,9.0,0.8455462185930603,,,,0.27242395213351295,0.17904475961448293,0.5567616463138851,0.5572139303482587,0.715281812899477,0.7156549520766773,0.9005515426545391,0.5032079302820286,0.08,0.6577822412043277,0.6407417358273266,0.5567616463138851,0.5572139303482587,1.0,1.0,undersample,0.5910413799963528,0.573316430760251,0.644224419436398,0.17904475961448293,COMPLETE
788,0.7156549520766773,2025-11-26 21:30:22.109434,2025-11-26 21:31:54.490101,0 days 00:01:32.380667,26.89686953078544,dart,0.6870901611035798,7.966729396857856,depthwise,48.15232074087436,0.005670660327842508,10,7,4.683624915527688,900,tree,0.7988498574278452,0.19727603936672303,0.08248544160636169,undersample,0.9528456908018587,,10.0,0.9352622634398515,0.17789773178549004,weighted,0.31549651234947124,0.6191397384933832,0.3861908167702237,0.5567616463138851,0.5572139303482587,0.715281812899477,0.7156549520766773,0.7988498574278452,0.19727603936672303,0.08,0.5567616463138851,0.5572139303482587,0.5567616463138851,0.5572139303482587,1.0,1.0,undersample,0.5,0.5,0.9528456908018587,0.3861908167702237,COMPLETE
789,0.7156549520766773,2025-11-26 21:31:54.675572,2025-11-26 21:32:10.651959,0 days 00:00:15.976387,0.08808101749452332,dart,0.7748361425998955,9.148249622949857,lossguide,75.16373806719083,0.00016784010280705258,0,3,1.5239802244821758,400,tree,0.8912481659752248,0.4836938087797628,0.04854002075849103,oversample,0.7712611872005956,,11.0,0.8227558984045944,0.3990322647786163,weighted,0.3996853859647335,0.4670328791237578,0.025318314817117184,0.5567616463138851,0.5572139303482587,0.715281812899477,0.7156549520766773,0.8912481659752248,0.4836938087797628,0.05,0.5567616463138851,0.5572139303482587,0.5567616463138851,0.5572139303482587,1.0,1.0,oversample,0.5,0.5,0.7712611872005956,0.025318314817117184,COMPLETE
790,0.7156549520766773,2025-11-26 21:32:10.823724,2025-11-26 21:32:24.292225,0 days 00:00:13.468501,0.08017941972443501,gbtree,0.779517250131388,0.08232154673054914,lossguide,9.129506298764314,0.0036353875467477056,7,10,2.5731206128565645,800,,0.7240089894075995,0.3084263768707791,0.08722104092595753,none,0.7285197088751931,2.3048415806232287,8.0,0.742699798419673,,,,0.6437626782549253,0.614918310496978,0.5567616463138851,0.5572139303482587,0.715281812899477,0.7156549520766773,0.7240089894075995,0.3084263768707791,0.08,0.5570418189308168,0.5503719478086031,0.5567616463138851,0.5572139303482587,1.0,1.0,none,0.5085350387108539,0.5085911279731505,0.7285197088751931,0.614918310496978,COMPLETE
791,0.7156549520766773,2025-11-26 21:32:24.464495,2025-11-26 21:32:34.224817,0 days 00:00:09.760322,11.806865952762863,dart,0.2993085832899261,5.637885255018758,depthwise,2.316633393473375,0.0963357868661885,2,7,30.40152370338974,300,tree,0.5006710667929022,0.33622454098714605,0.09777327293816057,undersample,0.9860996277544869,,12.0,0.8675382319691558,0.35694089680761965,weighted,0.16244889992398862,0.22827971211533302,0.056959980747457305,0.5567616463138851,0.5572139303482587,0.715281812899477,0.7156549520766773,0.5006710667929022,0.33622454098714605,0.1,0.5525199260221083,0.5700114191813577,0.5567616463138851,0.5572139303482587,1.0,1.0,undersample,0.48908718645866145,0.5187314281734609,0.9860996277544869,0.056959980747457305,COMPLETE
792,0.7156549520766773,2025-11-26 21:32:34.398178,2025-11-26 21:32:39.989984,0 days 00:00:05.591806,0.013809926796629133,gbtree,0.9545484872436361,2.041083240603747,lossguide,0.13007584796797528,0.0033821220692128373,8,12,0.3293649795532749,500,,0.912824026244919,0.5039767657061974,0.09686096056732191,undersample,0.538678453074079,,12.0,0.6570427915883971,,,,0.41059439695752614,0.1735856506887447,0.5567616463138851,0.5572139303482587,0.715281812899477,0.7156549520766773,0.912824026244919,0.5039767657061974,0.1,0.5635725151358417,0.5656323426455596,0.5567616463138851,0.5572139303482587,1.0,1.0,undersample,0.5520648551865912,0.5668262406643407,0.538678453074079,0.1735856506887447,COMPLETE
793,0.7156549520766773,2025-11-26 21:32:40.184699,2025-11-26 21:32:41.297140,0 days 00:00:01.112441,2.7167991440400683,gbtree,0.9080785884281176,2.032407272446544,lossguide,0.003431100941457375,0.016648287137399694,3,6,0.5225956771829101,600,,0.9391481661162213,0.4101860084972423,0.07926582346431912,undersample,0.5047088343330853,,8.0,0.9350421622825157,,,,0.36568339874012734,0.26285274540375886,0.5572139303482587,0.5572139303482587,0.7154896832316188,0.7156549520766773,0.9391481661162213,0.4101860084972423,0.08,0.6156290701618347,0.6210943686027142,0.5570135746606335,0.5572139303482587,1.0,1.0,undersample,0.5790977967141365,0.5831748371648781,0.5047088343330853,0.26285274540375886,COMPLETE
794,0.0,2025-11-26 21:32:41.469566,2025-11-26 21:32:47.024043,0 days 00:00:05.554477,0.009306965811989337,dart,0.8692234164234298,8.545415310328332,lossguide,0.004851925090860129,0.00020281595006130682,1,7,0.8258975748483617,200,tree,0.7503187048276487,0.6581798865598263,0.09641183228677665,oversample,0.8010239883433181,,10.0,0.6644581359516142,0.03749965299435354,uniform,0.1824446372491095,0.9827424857387422,0.6184690032402153,0.44323835368611486,0.4427860696517413,0.0,0.0,0.7503187048276487,0.6581798865598263,0.1,0.5621865710458054,0.5577048291133241,0.0,0.0,0.0,0.0,oversample,0.5167169548566787,0.5079780089675391,0.8010239883433181,0.6184690032402153,COMPLETE
795,0.7156549520766773,2025-11-26 21:32:47.198822,2025-11-26 21:33:14.451871,0 days 00:00:27.253049,94.67463715052611,dart,0.3764654686636282,8.051201647191387,lossguide,6.572845634897523,0.00012180427564475958,1,8,1.6871002735913307,500,tree,0.9075177691905262,0.18951649212099508,0.02719852460762081,none,0.7050451835461523,0.6402075293724865,6.0,0.8468809364347243,0.2850028787785037,uniform,0.33261253248010003,0.7984862674973566,0.2864532356445546,0.5567616463138851,0.5572139303482587,0.715281812899477,0.7156549520766773,0.9075177691905262,0.18951649212099508,0.02,0.5567616463138851,0.5572139303482587,0.5567616463138851,0.5572139303482587,1.0,1.0,none,0.5,0.5,0.7050451835461523,0.2864532356445546,COMPLETE
796,0.7156549520766773,2025-11-26 21:33:14.627827,2025-11-26 21:34:07.124791,0 days 00:00:52.496964,0.003955746086797567,dart,0.43880780893026333,6.822211528938694,lossguide,0.00014857259816337956,0.013548877511864845,4,11,0.295357227993319,700,tree,0.6871144728156846,0.32001074708241317,0.028408950820558197,oversample,0.810797901344339,,8.0,0.6105854382876019,0.3392809925623366,weighted,0.3880416681700232,0.43746735897259625,0.4932851787215525,0.5567616463138851,0.5572139303482587,0.715281812899477,0.7156549520766773,0.6871144728156846,0.32001074708241317,0.02,0.37361431127445205,0.37513057188556104,0.5567616463138851,0.5572139303482587,1.0,1.0,oversample,0.12327459009598968,0.12694962723691017,0.810797901344339,0.4932851787215525,COMPLETE
797,0.7145348837209302,2025-11-26 21:34:07.307788,2025-11-26 21:34:09.558002,0 days 00:00:02.250214,0.005799816927095837,gbtree,0.7041875794976902,4.492536755352619,lossguide,0.36697342645706005,0.06933959690897067,1,7,0.14290065566191273,500,,0.8605265130341505,0.4778436902697025,0.09453170254143281,none,0.5603322422519429,1.773179009422962,8.0,0.8155546285377241,,,,0.3910929599330907,0.35719269912782947,0.5545002261420172,0.555857078245138,0.7134128600523713,0.7145348837209302,0.8605265130341505,0.4778436902697025,0.1,0.45342849493385584,0.4470932664505558,0.5557570262919311,0.5566123188405797,0.9959382615759546,0.997564935064935,none,0.3363036522488768,0.3303977687276972,0.5603322422519429,0.35719269912782947,COMPLETE
798,0.6980740740740741,2025-11-26 21:34:09.731660,2025-11-26 21:34:10.647148,0 days 00:00:00.915488,0.007210672505165583,gbtree,0.6401703181482955,3.860836405890722,lossguide,0.12411372578087462,0.015779750527149944,9,10,0.4409650902228209,600,,0.9475345500342824,0.4433289293016471,0.07170574041853729,undersample,0.7953005064631502,,12.0,0.7064875558262673,,,,0.41020209125150103,0.39059571240733076,0.5418362731795567,0.5391225689733152,0.7003845016267376,0.6980740740740741,0.9475345500342824,0.4433289293016471,0.08,0.4820668355869148,0.4833868320262522,0.5506976744186046,0.5496966868875408,0.9618196588139724,0.9561688311688312,undersample,0.3986107196737346,0.391556285900004,0.7953005064631502,0.39059571240733076,COMPLETE
799,0.6719643992371265,2025-11-26 21:34:10.843856,2025-11-26 21:34:13.501102,0 days 00:00:02.657246,0.0014445393651354086,gbtree,0.6907386598237316,0.9384347783746099,lossguide,0.0003381743962910529,0.0015471567939830835,1,5,0.5405030323804672,800,,0.8743741003381841,0.7339414749851801,0.07243825005809512,undersample,0.6172300718265062,,6.0,0.7302004590243416,,,,0.47211160181943046,0.47292321115436253,0.519674355495251,0.5332428765264586,0.6637112096263458,0.6719643992371265,0.8743741003381841,0.7339414749851801,0.08,0.5255354205392554,0.5199238445896387,0.5438505448884277,0.5522466039707419,0.851340373679935,0.8579545454545454,undersample,0.4767805334969081,0.4671842457848587,0.6172300718265062,0.47292321115436253,COMPLETE
800,0.7156549520766773,2025-11-26 21:34:13.678323,2025-11-26 21:34:53.288704,0 days 00:00:39.610381,67.56835324044886,dart,0.45699155652077633,5.679100412839441,depthwise,0.5852569259632364,0.00020320827462710737,0,7,0.35529295399390975,600,forest,0.7045391897831671,0.1663116787241376,0.05336890822651981,none,0.8023904167160291,1.1664331936020556,6.0,0.7309840453827496,0.4873471283930181,weighted,0.686020992379802,0.7390183632679871,0.3868878268375958,0.5567616463138851,0.5572139303482587,0.715281812899477,0.7156549520766773,0.7045391897831671,0.1663116787241376,0.05,0.5567616463138851,0.5572139303482587,0.5567616463138851,0.5572139303482587,1.0,1.0,none,0.5,0.5,0.8023904167160291,0.3868878268375958,COMPLETE
801,0.7156549520766773,2025-11-26 21:34:53.466242,2025-11-26 21:35:04.704837,0 days 00:00:11.238595,36.550509565380615,dart,0.49807395815372235,6.400507808647799,lossguide,0.019368546119689117,0.002441611359285202,2,4,0.25706824217275787,300,forest,0.7979983943699455,0.880701912913219,0.08918230464783508,undersample,0.8996694356833604,,5.0,0.6488662840905821,0.12884273602933605,uniform,0.3235911172887565,0.28552309283714045,0.361654473187856,0.5567616463138851,0.5572139303482587,0.715281812899477,0.7156549520766773,0.7979983943699455,0.880701912913219,0.08,0.5567616463138851,0.5572139303482587,0.5567616463138851,0.5572139303482587,1.0,1.0,undersample,0.5,0.5,0.8996694356833604,0.361654473187856,COMPLETE
802,0.7156549520766773,2025-11-26 21:35:04.877697,2025-11-26 21:35:23.889446,0 days 00:00:19.011749,30.562261304492758,dart,0.6733789516651545,9.99308102177159,lossguide,0.5562027063710759,0.00018620368128911336,2,4,0.6006445108960429,400,forest,0.5353856536359693,0.44589353196080445,0.08701250501907601,oversample,0.5653404547045278,,12.0,0.6972517047253599,0.3463202731563488,weighted,0.6521653835189035,0.6496711458887413,0.23235751301415847,0.5567616463138851,0.5572139303482587,0.715281812899477,0.7156549520766773,0.5353856536359693,0.44589353196080445,0.08,0.5567616463138851,0.5572139303482587,0.5567616463138851,0.5572139303482587,1.0,1.0,oversample,0.5,0.5,0.5653404547045278,0.23235751301415847,COMPLETE
803,0.7156549520766773,2025-11-26 21:35:24.063910,2025-11-26 21:36:55.744392,0 days 00:01:31.680482,0.000927751100086369,dart,0.7922892444668713,8.101040323569944,lossguide,0.00011448076072289437,0.0006942104029078254,5,11,3.5118503006794564,1000,forest,0.5829719844959912,0.07267338179652155,0.06282616962649767,none,0.9026931031215721,2.7683153086804153,7.0,0.8341434963607988,0.40959398322516294,uniform,0.21707594762573051,0.33709208973684357,0.3019988272729883,0.5567616463138851,0.5572139303482587,0.715281812899477,0.7156549520766773,0.5829719844959912,0.07267338179652155,0.05,0.42082867787355105,0.4059229188522853,0.5567616463138851,0.5572139303482587,1.0,1.0,none,0.2837091132147416,0.2405059827812637,0.9026931031215721,0.3019988272729883,COMPLETE
804,0.7156549520766773,2025-11-26 21:36:55.922545,2025-11-26 21:38:37.501148,0 days 00:01:41.578603,0.06657573090917314,dart,0.9316777068426692,1.194974478327644,lossguide,0.010038776392500483,0.01586912576342167,3,7,0.28377065916964317,500,forest,0.8974847032829373,0.5486505600545042,0.09950671663021526,oversample,0.8502591533319956,,6.0,0.7297435975674695,0.27026120200324705,weighted,0.01822803870682603,0.2428582215091201,0.1352558875763583,0.5567616463138851,0.5572139303482587,0.715281812899477,0.7156549520766773,0.8974847032829373,0.5486505600545042,0.1,0.5809620614506139,0.5721385414480209,0.5567616463138851,0.5572139303482587,1.0,1.0,oversample,0.5315895488983571,0.5441909979703646,0.8502591533319956,0.1352558875763583,COMPLETE
805,0.6963272618692147,2025-11-26 21:38:37.678979,2025-11-26 21:38:50.916663,0 days 00:00:13.237684,0.0005699167328345804,gbtree,0.5706400528008743,0.7278811324696344,lossguide,0.08677074224932704,0.022910524028673294,10,12,1.7798330921905823,200,,0.8520214850914247,0.5239929900479671,0.0755526938962196,undersample,0.654823029746118,,12.0,0.6279303731990048,,,,0.5319207896040253,0.13542611491708936,0.550429669832655,0.5400271370420624,0.7046939988116458,0.6963272618692147,0.8520214850914247,0.5239929900479671,0.08,0.5370704250854672,0.5292307754831088,0.5555035128805621,0.5507794048181389,0.9634443541835905,0.9464285714285714,undersample,0.4838591488585686,0.4643549440855365,0.654823029746118,0.13542611491708936,COMPLETE
806,0.7156549520766773,2025-11-26 21:38:51.093622,2025-11-26 21:39:50.029304,0 days 00:00:58.935682,0.6151294869686325,dart,0.40906498489054655,3.022847635628643,depthwise,2.4346553961982393,0.09574443117914017,5,7,22.316129351799958,700,forest,0.6041510590843245,0.4257658107176978,0.06019109141475924,none,0.7296349326243755,1.7511485221488123,12.0,0.7794001315078734,0.11981539596377713,weighted,0.12454228140733985,0.3496012145223832,0.020087965487430803,0.5567616463138851,0.5572139303482587,0.715281812899477,0.7156549520766773,0.6041510590843245,0.4257658107176978,0.05,0.6035450403065595,0.5757171439792605,0.5567616463138851,0.5572139303482587,1.0,1.0,none,0.5136076526467613,0.49082311330140743,0.7296349326243755,0.020087965487430803,COMPLETE
807,0.7082720047100383,2025-11-26 21:39:50.209241,2025-11-26 21:39:51.060148,0 days 00:00:00.850907,0.15102063862064422,gbtree,0.8503048594107168,5.093032329996733,lossguide,0.002515018011042379,0.35124615797211645,5,10,52.05728173405076,700,,0.9880550262656286,0.9078090067123218,0.09071272439139402,oversample,0.7565148810034401,,12.0,0.840016647377306,,,,0.8601578633687722,0.4876221477157953,0.5563093622795116,0.5517865219357757,0.7103631532329495,0.7082720047100383,0.9880550262656286,0.9078090067123218,0.1,0.4706534696032403,0.46513044431834516,0.5579777365491652,0.5556581986143188,0.9772542648253453,0.976461038961039,oversample,0.384840183026907,0.3793312152607352,0.7565148810034401,0.4876221477157953,COMPLETE
808,0.5676638176638177,2025-11-26 21:39:51.237083,2025-11-26 21:39:51.912670,0 days 00:00:00.675587,0.012469077603296052,gbtree,0.6983514193002182,3.51706835169438,lossguide,0.058729844583575476,0.09336077470647294,3,5,0.7850401396230418,300,,0.8793212474267593,0.47180209823117303,0.08989242840858465,none,0.9893984511095858,0.640705735250895,6.0,0.79940390338425,,,,0.30399064934779535,0.4184355907477923,0.42966983265490727,0.45092718227046585,0.5416212286441294,0.5676638176638177,0.8793212474267593,0.47180209823117303,0.08,0.4870073901363041,0.4930189739437709,0.4901315789473684,0.5057106598984772,0.6051990251827782,0.6469155844155844,none,0.37747600258624975,0.38943462053778705,0.9893984511095858,0.4184355907477923,COMPLETE
809,0.7156549520766773,2025-11-26 21:39:52.101631,2025-11-26 21:41:03.273633,0 days 00:01:11.172002,0.0014696247361742853,dart,0.6301758270114318,1.5450853884859888,lossguide,0.0016852897710566276,0.003095969112211371,2,10,58.46825654690839,800,tree,0.7119741598483112,0.09746621898125121,0.027404117010809675,undersample,0.5556547704918423,,6.0,0.888591150665445,0.3691747015476072,weighted,0.5643516270431712,0.8219649297991731,0.4362989175724499,0.5567616463138851,0.5572139303482587,0.715281812899477,0.7156549520766773,0.7119741598483112,0.09746621898125121,0.02,0.5567616463138851,0.5572139303482587,0.5567616463138851,0.5572139303482587,1.0,1.0,undersample,0.5,0.5,0.5556547704918423,0.4362989175724499,COMPLETE
