number,value,datetime_start,datetime_complete,duration,params_alpha,params_booster,params_colsample_bytree,params_gamma,params_grow_policy,params_lambda,params_learning_rate,params_max_delta_step,params_max_depth,params_min_child_weight,params_n_estimators,params_normalize_type,params_params_feature_fraction,params_params_labeled_ratio,params_params_missing_rate,params_params_resampling,params_params_sample_rows,params_params_scale_pos_weight,params_params_selftrain_max_iter,params_params_selftrain_threshold,params_rate_drop,params_sample_type,params_skip_drop,params_subsample,params_user_attrs_decision_threshold,user_attrs_acc_test,user_attrs_acc_val,user_attrs_f1_test,user_attrs_f1_val,user_attrs_feature_fraction,user_attrs_labeled_ratio,user_attrs_missing_rate,user_attrs_pr_auc_test,user_attrs_pr_auc_val,user_attrs_prec_test,user_attrs_prec_val,user_attrs_rec_test,user_attrs_rec_val,user_attrs_resampling_strategy,user_attrs_roc_auc_test,user_attrs_roc_auc_val,user_attrs_sample_rows,user_attrs_user_attrs_decision_threshold,state
897,0.7156549520766773,2025-11-26 22:23:09.719508,2025-11-26 22:24:31.860907,0 days 00:01:22.141399,0.18095662983023827,dart,0.9629737463745818,3.999303748930828,lossguide,0.0003141473812366778,0.00026429400600005423,3,11,16.59430293790962,1000,forest,0.5322429906001905,0.09855478142675503,0.08181873723953424,none,0.9780948008127077,0.910328007402002,8.0,0.7309656975581339,0.44193575688212794,weighted,0.1301090446018375,0.43836938710879103,0.3289427291593821,0.5567616463138851,0.5572139303482587,0.715281812899477,0.7156549520766773,0.5322429906001905,0.09855478142675503,0.08,0.40667972237196576,0.4055389293099759,0.5567616463138851,0.5572139303482587,1.0,1.0,none,0.23594182595865318,0.2290830658105939,0.9780948008127077,0.3289427291593821,COMPLETE
898,0.7156549520766773,2025-11-26 22:24:32.041443,2025-11-26 22:24:47.096480,0 days 00:00:15.055037,23.15441923985312,dart,0.4095333109861614,4.788575804596549,depthwise,0.07238952581918032,0.009831786664277814,3,6,7.452652292268947,400,tree,0.5479626503990448,0.39764431905629744,0.05947275982559382,none,0.8445333081479348,2.941028762017339,12.0,0.8333961140566694,0.39147942271353225,uniform,0.1874803922176248,0.29619420514823785,0.2724491031794414,0.5567616463138851,0.5572139303482587,0.715281812899477,0.7156549520766773,0.5479626503990448,0.39764431905629744,0.05,0.5313318373275244,0.5322745870843746,0.5567616463138851,0.5572139303482587,1.0,1.0,none,0.4171384638339495,0.405020445591181,0.8445333081479348,0.2724491031794414,COMPLETE
899,0.7156549520766773,2025-11-26 22:24:47.279321,2025-11-26 22:26:20.451443,0 days 00:01:33.172122,0.23188445597945517,dart,0.9260040739740137,7.616379878896119,lossguide,0.0028048701297385763,0.0011754191920388794,3,12,0.8123742474938362,900,forest,0.5494328999348359,0.07544790768402881,0.09686798789074688,oversample,0.8470733329783333,,5.0,0.8226075914306314,0.32279706203340225,weighted,0.5469697712949498,0.5631674061044561,0.29132718745064756,0.5567616463138851,0.5572139303482587,0.715281812899477,0.7156549520766773,0.5494328999348359,0.07544790768402881,0.1,0.39740216232926573,0.40176330950160044,0.5567616463138851,0.5572139303482587,1.0,1.0,oversample,0.14003713589416272,0.14215821206372792,0.8470733329783333,0.29132718745064756,COMPLETE
900,0.006359300476947536,2025-11-26 22:26:20.628894,2025-11-26 22:26:21.617172,0 days 00:00:00.988278,0.07603918926209297,gbtree,0.5399424638958531,3.4608552881117425,depthwise,0.0013306382601502985,0.010835273355636263,8,10,0.15059523357677873,700,,0.6991630900451384,0.8255488504389423,0.008713097438127829,oversample,0.7346270406204618,,6.0,0.6975637678841008,,,,0.42846615923736997,0.6381869638115559,0.4369063772048847,0.43464495703301675,0.006384676775738229,0.006359300476947536,0.6991630900451384,0.8255488504389423,0.0,0.47022943039522447,0.4612714850908469,0.18181818181818182,0.15384615384615385,0.003249390739236393,0.003246753246753247,oversample,0.39111681228137074,0.37143653078280253,0.7346270406204618,0.6381869638115559,COMPLETE
901,0.7156549520766773,2025-11-26 22:26:21.791241,2025-11-26 22:26:22.802054,0 days 00:00:01.010813,0.1956347387804788,gbtree,0.8567661808956981,7.318239061527455,lossguide,0.5037440367891202,0.01598858815809018,8,11,87.94065085519844,1000,,0.8903287160247465,0.48308523542789816,0.08826784177453666,oversample,0.7845077863012241,,12.0,0.9229189297627238,,,,0.5863748842995677,0.5383888618462911,0.5567616463138851,0.5572139303482587,0.715281812899477,0.7156549520766773,0.8903287160247465,0.48308523542789816,0.08,0.46478982170449024,0.4458067577517348,0.5567616463138851,0.5572139303482587,1.0,1.0,oversample,0.33613869593328805,0.31224463738508684,0.7845077863012241,0.5383888618462911,COMPLETE
902,0.5344902386117136,2025-11-26 22:26:22.981995,2025-11-26 22:26:25.806476,0 days 00:00:02.824481,0.04126172829024101,gbtree,0.47136029590769213,1.5945966727588443,depthwise,0.003686380796677418,0.11431723331787022,7,5,1.0373442983639911,900,,0.7394503692924999,0.5758884769129632,0.0008518831589795842,oversample,0.8831660029343655,,6.0,0.6146580296661163,,,,0.7369354567478896,0.7277693296748797,0.5133423790140208,0.5146992311171416,0.5393835616438356,0.5344902386117136,0.7394503692924999,0.5758884769129632,0.0,0.5694758692909254,0.5496467317741432,0.5701357466063348,0.5740913327120224,0.511779041429732,0.5,oversample,0.5238772194499245,0.5216440543623895,0.8831660029343655,0.7277693296748797,COMPLETE
903,0.7156549520766773,2025-11-26 22:26:25.985601,2025-11-26 22:28:10.213336,0 days 00:01:44.227735,0.011114942448933242,dart,0.7064867759154952,1.2665738246392721,depthwise,0.1863662115923839,0.0007792829667195133,0,11,91.06314271754528,900,forest,0.6000806977616652,0.21455148688846926,0.040081586866750604,none,0.5147475900189582,0.6235750217146057,8.0,0.9406236677339632,0.008136285181909314,uniform,0.14501128123164836,0.5130953933749802,0.2438706528823241,0.5567616463138851,0.5572139303482587,0.715281812899477,0.7156549520766773,0.6000806977616652,0.21455148688846926,0.05,0.5567616463138851,0.5572139303482587,0.5567616463138851,0.5572139303482587,1.0,1.0,none,0.5,0.5,0.5147475900189582,0.2438706528823241,COMPLETE
904,0.0,2025-11-26 22:28:10.387806,2025-11-26 22:28:11.241281,0 days 00:00:00.853475,0.16722856309411593,gbtree,0.9967243963072246,5.084160778052936,lossguide,0.48915978036785845,0.004718392128096436,10,8,72.14169274813443,600,,0.942086894147374,0.8516348545607161,0.0906450550154162,oversample,0.9827036210390314,,10.0,0.9026052578078079,,,,0.678752508783456,0.8384968052757518,0.44323835368611486,0.4427860696517413,0.0,0.0,0.942086894147374,0.8516348545607161,0.1,0.49594907913865316,0.4964460933339662,0.0,0.0,0.0,0.0,oversample,0.4517875793696846,0.4599408188848945,0.9827036210390314,0.8384968052757518,COMPLETE
905,0.7156549520766773,2025-11-26 22:28:11.415089,2025-11-26 22:28:15.912061,0 days 00:00:04.496972,31.26345958649871,dart,0.24577879566101685,6.249528276657649,depthwise,48.461051693651434,0.018028086807276366,3,5,8.6909909583598,200,tree,0.6158863947524087,0.42599870504999215,0.09681382884182776,oversample,0.6874030072357475,,11.0,0.8533050640407803,0.3766886701211311,weighted,0.27325578838415926,0.28393886471817464,0.055855164325649694,0.5567616463138851,0.5572139303482587,0.715281812899477,0.7156549520766773,0.6158863947524087,0.42599870504999215,0.1,0.5567616463138851,0.5572139303482587,0.5567616463138851,0.5572139303482587,1.0,1.0,oversample,0.5,0.5,0.6874030072357475,0.055855164325649694,COMPLETE
906,0.7156549520766773,2025-11-26 22:28:16.081798,2025-11-26 22:28:17.117960,0 days 00:00:01.036162,89.07793737450443,gbtree,0.5224418164277396,4.281666980899709,depthwise,0.004451051393844843,0.022462271563259386,8,11,2.1905659693947315,1000,,0.7465958344297804,0.88445186237977,0.02440295698407937,none,0.9130803442390353,0.912380290786564,8.0,0.6472866454801033,,,,0.579170688064753,0.4285626400821763,0.5567616463138851,0.5572139303482587,0.715281812899477,0.7156549520766773,0.7465958344297804,0.88445186237977,0.02,0.5567616463138851,0.5572139303482587,0.5567616463138851,0.5572139303482587,1.0,1.0,none,0.5,0.5,0.9130803442390353,0.4285626400821763,COMPLETE
907,0.7156549520766773,2025-11-26 22:28:17.287911,2025-11-26 22:29:16.595912,0 days 00:00:59.308001,0.8458214414802172,dart,0.8741778944766606,4.346414646546055,lossguide,84.63745070167288,0.012589381433773016,10,9,1.842620923388963,700,forest,0.7789213479784389,0.0776152923910609,0.09264579864921589,undersample,0.8774060317441166,,11.0,0.8994105189659192,0.27438554701699336,uniform,0.7221458661768333,0.3887276554275035,0.4524067708876948,0.5567616463138851,0.5572139303482587,0.715281812899477,0.7156549520766773,0.7789213479784389,0.0776152923910609,0.1,0.5567616463138851,0.5572139303482587,0.5567616463138851,0.5572139303482587,1.0,1.0,undersample,0.5,0.5,0.8774060317441166,0.4524067708876948,COMPLETE
908,0.043154761904761904,2025-11-26 22:29:16.774561,2025-11-26 22:29:17.833607,0 days 00:00:01.059046,17.4464474093038,gbtree,0.6873392571576853,2.4557339327263046,depthwise,0.00018642651638822903,0.007364574102954048,7,8,0.11263965670528246,900,,0.6702471544429015,0.9380189114519542,0.07268051896262095,oversample,0.9536122565738989,,9.0,0.712448123474942,,,,0.6713213607940502,0.5710117354066071,0.41971958389868835,0.4183627317955676,0.04325130499627144,0.043154761904761904,0.6702471544429015,0.9380189114519542,0.08,0.45868319418013154,0.4529557495295909,0.2636363636363636,0.25892857142857145,0.023558082859463852,0.02353896103896104,oversample,0.35422628027652975,0.3505826081477256,0.9536122565738989,0.5710117354066071,COMPLETE
909,0.7156549520766773,2025-11-26 22:29:18.006876,2025-11-26 22:29:18.720899,0 days 00:00:00.714023,0.037658406448866644,gbtree,0.3235565304958331,9.698749007549395,depthwise,0.020166608094383885,0.0016049132868948507,3,6,0.277355969079776,500,,0.6158455853818077,0.32587657567487993,0.07438788215838596,oversample,0.864936817950214,,7.0,0.6365232844390147,,,,0.963263094112492,0.16106449738868478,0.5567616463138851,0.5572139303482587,0.715281812899477,0.7156549520766773,0.6158455853818077,0.32587657567487993,0.08,0.5567616463138851,0.5572139303482587,0.5567616463138851,0.5572139303482587,1.0,1.0,oversample,0.5,0.5,0.864936817950214,0.16106449738868478,COMPLETE
910,0.6675418444371513,2025-11-26 22:29:18.907767,2025-11-26 22:29:20.973505,0 days 00:00:02.065738,0.024936491064824217,gbtree,0.546315988917568,0.037732529254259295,depthwise,0.01757167848205053,0.0013079678756362663,9,5,0.19823141017046267,1000,,0.6530717364586751,0.6330742227248821,0.0794025442758362,oversample,0.9480611253709897,,8.0,0.7038750200019567,,,,0.4412055693410582,0.5313123327993896,0.5540479421076436,0.5418362731795567,0.6771447282252783,0.6675418444371513,0.6530717364586751,0.6330742227248821,0.08,0.6303331768605689,0.593642201556877,0.5671969281404279,0.5603305785123966,0.8399675060926076,0.825487012987013,oversample,0.5866277623965914,0.5429307668837802,0.9480611253709897,0.5313123327993896,COMPLETE
911,0.7156549520766773,2025-11-26 22:29:21.149927,2025-11-26 22:29:26.027856,0 days 00:00:04.877929,0.06631409667545712,dart,0.8400855724283101,6.621891001011868,lossguide,3.6245230682213294,0.0006144644425373087,0,3,28.917277444737614,200,tree,0.813100971803123,0.2636794185386772,0.07241070413964308,none,0.985387518348087,0.5035478001648291,12.0,0.8032705570471582,0.33485756232300773,weighted,0.5076087223772336,0.4308504219433999,0.033716605090732224,0.5567616463138851,0.5572139303482587,0.715281812899477,0.7156549520766773,0.813100971803123,0.2636794185386772,0.08,0.5057297736377602,0.5063777515243769,0.5567616463138851,0.5572139303482587,1.0,1.0,none,0.3935459805368126,0.39487019619808184,0.985387518348087,0.033716605090732224,COMPLETE
912,0.7156549520766773,2025-11-26 22:29:26.199579,2025-11-26 22:29:27.194675,0 days 00:00:00.995096,0.00011571135423354704,gbtree,0.38675512328989076,5.626579423137111,depthwise,0.0005121666441764132,0.0021426666312856597,7,11,10.776742856386925,900,,0.7028229238859706,0.6560267162725282,0.0008696844157713695,oversample,0.9013566460327995,,5.0,0.614202959994048,,,,0.3583352069419727,0.33112128849399125,0.5567616463138851,0.5572139303482587,0.715281812899477,0.7156549520766773,0.7028229238859706,0.6560267162725282,0.0,0.48507574045614643,0.47693665210775504,0.5567616463138851,0.5572139303482587,1.0,1.0,oversample,0.4094066546196058,0.39090502832203544,0.9013566460327995,0.33112128849399125,COMPLETE
913,0.7156549520766773,2025-11-26 22:29:27.372980,2025-11-26 22:29:28.430813,0 days 00:00:01.057833,1.622031287867283,gbtree,0.48121194823638513,1.9057839039713618,depthwise,0.005323304509826169,0.025434580218958478,9,9,0.49137391150980203,900,,0.7741106193150877,0.901787816711885,0.011124446835728097,undersample,0.7806534023569704,,6.0,0.6725388409770483,,,,0.8914478072595762,0.3594974873353277,0.5567616463138851,0.5572139303482587,0.715281812899477,0.7156549520766773,0.7741106193150877,0.901787816711885,0.02,0.5015320058232984,0.5031105773587905,0.5567616463138851,0.5572139303482587,1.0,1.0,undersample,0.42722566687113517,0.427683463115026,0.7806534023569704,0.3594974873353277,COMPLETE
914,0.7150772820064158,2025-11-26 22:29:28.600044,2025-11-26 22:29:29.291258,0 days 00:00:00.691214,0.043507456441046255,gbtree,0.8691462194235929,3.031228735460383,lossguide,0.02002184548241268,0.009194936586306305,4,6,2.94275881449427,200,,0.9264803705328548,0.5853548874369479,0.05316739653583667,undersample,0.64720480657872,,6.0,0.8020979010410845,,,,0.2626591581171139,0.4156265442879553,0.5572139303482587,0.5581184984170059,0.7148266822021555,0.7150772820064158,0.9264803705328548,0.5853548874369479,0.05,0.6000091609454286,0.5724255996570525,0.5572207084468664,0.5580336822940373,0.9967506092607636,0.9951298701298701,undersample,0.5628081533181917,0.5378960607829352,0.64720480657872,0.4156265442879553,COMPLETE
915,0.7156549520766773,2025-11-26 22:29:29.469124,2025-11-26 22:29:31.548416,0 days 00:00:02.079292,0.727727788921425,gbtree,0.32178952667556715,1.2268580920344094,depthwise,0.001374688773563734,0.09527205308834212,9,12,1.9757439070572775,700,,0.7160988498989763,0.8698232932820644,0.0551823682546046,oversample,0.8982527668663632,,6.0,0.659141584528767,,,,0.9649105472009716,0.3607030147184921,0.5576662143826323,0.5572139303482587,0.7156976744186047,0.7156549520766773,0.7160988498989763,0.8698232932820644,0.05,0.49511063869594113,0.4939302839170191,0.5572657311000453,0.5572139303482587,1.0,1.0,oversample,0.4647780964538536,0.4642923470809068,0.8982527668663632,0.3607030147184921,COMPLETE
916,0.7156549520766773,2025-11-26 22:29:31.728935,2025-11-26 22:29:35.075275,0 days 00:00:03.346340,0.49160599025647034,gbtree,0.5755354413797978,3.4790170926341677,depthwise,0.000920796263206926,0.047771121326294866,7,7,1.109440423079036,800,,0.6140426025332819,0.6951795359746727,0.005635353367506402,none,0.7166543908792341,2.593664765215234,8.0,0.7713482038968871,,,,0.5098874637044161,0.2950115464322429,0.5567616463138851,0.5572139303482587,0.715281812899477,0.7156549520766773,0.6140426025332819,0.6951795359746727,0.0,0.5451995411806123,0.5260058366843557,0.5567616463138851,0.5572139303482587,1.0,1.0,none,0.4948921567002105,0.4691852771845111,0.7166543908792341,0.2950115464322429,COMPLETE
917,0.7049717177731468,2025-11-26 22:29:35.250918,2025-11-26 22:29:38.217053,0 days 00:00:02.966135,0.2722529141223345,gbtree,0.455149387035175,2.75808369236023,depthwise,0.0002407230091330574,0.026654673716441448,7,12,1.2261870627144833,900,,0.8329902976814159,0.8943722957289553,0.04414682200977932,oversample,0.9043211069943512,,5.0,0.6164765252842496,,,,0.47396725842259646,0.44874546940154125,0.5581184984170059,0.5517865219357757,0.7089663389931486,0.7049717177731468,0.8329902976814159,0.8943722957289553,0.05,0.513505786374969,0.5187062331437003,0.5597365945437441,0.5566525622943113,0.966693744922827,0.961038961038961,oversample,0.46322800444304446,0.4706208627939986,0.9043211069943512,0.44874546940154125,COMPLETE
918,0.7156549520766773,2025-11-26 22:29:38.401304,2025-11-26 22:30:09.344651,0 days 00:00:30.943347,79.68186341559831,dart,0.6199759207179046,0.6810233034369408,lossguide,0.06927584159066122,0.0014881753255072865,5,5,0.24693708680247253,600,forest,0.9943162216073962,0.8758394447077983,0.09383621599873532,oversample,0.8160265709785013,,5.0,0.7567810991843669,0.4916325078841946,weighted,0.25930421061928843,0.4087814524636999,0.49324482677113957,0.5567616463138851,0.5572139303482587,0.715281812899477,0.7156549520766773,0.9943162216073962,0.8758394447077983,0.1,0.5567616463138851,0.5572139303482587,0.5567616463138851,0.5572139303482587,1.0,1.0,oversample,0.5,0.5,0.8160265709785013,0.49324482677113957,COMPLETE
919,0.037706205813040065,2025-11-26 22:30:09.516901,2025-11-26 22:30:34.075638,0 days 00:00:24.558737,0.22796061850178176,gbtree,0.8564011498093036,0.3105367899195608,lossguide,0.05933011584811116,0.005197231650136813,4,10,0.2746360839611641,500,,0.744271563568973,0.3348645303586453,0.06150499374659082,oversample,0.9539075644864875,,6.0,0.8778782330606482,,,,0.5838425137515972,0.8376537252904896,0.44414292175486203,0.4459520578923564,0.020717131474103586,0.037706205813040065,0.744271563568973,0.3348645303586453,0.05,0.5648903111835384,0.5720529070726019,0.5416666666666666,0.5853658536585366,0.010560519902518278,0.01948051948051948,oversample,0.5091517598103417,0.5220212945889657,0.9539075644864875,0.8376537252904896,COMPLETE
920,0.7156549520766773,2025-11-26 22:30:34.273169,2025-11-26 22:31:06.292117,0 days 00:00:32.018948,1.6790551737890815,dart,0.8356326555102191,8.163394130677602,depthwise,0.00010566410516283348,0.010861359842579627,6,4,0.3402249176894097,500,forest,0.7055436302057747,0.6459090545221656,0.04763505731192989,undersample,0.7598627567456664,,9.0,0.8288415270310279,0.18110498128424646,weighted,0.7140687868282093,0.29172800482256384,0.3415436007695332,0.5567616463138851,0.5572139303482587,0.715281812899477,0.7156549520766773,0.7055436302057747,0.6459090545221656,0.05,0.49252527134927243,0.4930258884473305,0.5567616463138851,0.5572139303482587,1.0,1.0,undersample,0.4215620285482186,0.4170282921878939,0.7598627567456664,0.3415436007695332,COMPLETE
921,0.7156549520766773,2025-11-26 22:31:06.468895,2025-11-26 22:31:45.798747,0 days 00:00:39.329852,0.01853809804017971,dart,0.4812678072504999,4.969348294933681,lossguide,0.00045412313913996964,0.00846504212861642,0,3,0.18236703460932918,600,tree,0.7775640643277646,0.8048012776940073,0.09399137276752545,undersample,0.8613735743776595,,5.0,0.6365784901187084,0.2856638470300269,weighted,0.3072529096426865,0.38729148842611627,0.37819173174655324,0.5567616463138851,0.5572139303482587,0.715281812899477,0.7156549520766773,0.7775640643277646,0.8048012776940073,0.1,0.506510535473753,0.5118456904165343,0.5567616463138851,0.5572139303482587,1.0,1.0,undersample,0.4503469056184618,0.44134370481408275,0.8613735743776595,0.37819173174655324,COMPLETE
922,0.7156549520766773,2025-11-26 22:31:45.977493,2025-11-26 22:31:46.995979,0 days 00:00:01.018486,0.003321211808040037,gbtree,0.3522403367634082,9.36008969775656,lossguide,0.0005133665461384816,0.00041626880459334683,5,12,0.2110023962728933,1000,,0.6396984622197709,0.2198241608078021,0.03987475030633651,oversample,0.7523993553805556,,5.0,0.6224445529112249,,,,0.5489827704387418,0.06290836276111283,0.5567616463138851,0.5572139303482587,0.715281812899477,0.7156549520766773,0.6396984622197709,0.2198241608078021,0.05,0.6681765806177747,0.6993206972232365,0.5567616463138851,0.5572139303482587,1.0,1.0,oversample,0.5855808285946384,0.6196465051802129,0.7523993553805556,0.06290836276111283,COMPLETE
923,0.7156549520766773,2025-11-26 22:31:47.178822,2025-11-26 22:33:50.128213,0 days 00:02:02.949391,0.10824700030777239,dart,0.6847075800004838,4.751894392447179,depthwise,0.0012584630317817444,0.021010821936984565,10,7,0.11646584197932539,900,tree,0.6373824164285814,0.700932646848903,0.026407818458172968,oversample,0.6774188489746109,,5.0,0.6194335873823924,0.4939618535957263,weighted,0.41470240133410113,0.6648200594501971,0.26340432259470614,0.5567616463138851,0.5572139303482587,0.715281812899477,0.7156549520766773,0.6373824164285814,0.700932646848903,0.02,0.5472565964821645,0.5364487132088903,0.5567616463138851,0.5572139303482587,1.0,1.0,oversample,0.4862178583862464,0.4798765139355027,0.6774188489746109,0.26340432259470614,COMPLETE
924,0.7156549520766773,2025-11-26 22:33:50.320087,2025-11-26 22:33:55.321064,0 days 00:00:05.000977,7.094396629470064,dart,0.6227800249929492,2.583337316927982,depthwise,0.003416166266549206,0.0006723519400927395,1,7,0.14406357330954744,200,tree,0.9651113544508712,0.935060103405449,0.0928107221854751,undersample,0.9226691164675987,,6.0,0.8325086358919604,0.22347030939066714,weighted,0.11879526250238301,0.3249839495852279,0.38056178145435937,0.5567616463138851,0.5572139303482587,0.715281812899477,0.7156549520766773,0.9651113544508712,0.935060103405449,0.1,0.4226975721044809,0.4151243024082877,0.5567616463138851,0.5572139303482587,1.0,1.0,undersample,0.2759458048044563,0.2625206445750368,0.9226691164675987,0.38056178145435937,COMPLETE
925,0.7156549520766773,2025-11-26 22:33:55.510049,2025-11-26 22:35:03.613127,0 days 00:01:08.103078,9.226265307233842,dart,0.5390819107408362,7.919411396475478,lossguide,0.811486358794786,0.0006382625557659941,0,8,12.293655005813648,800,forest,0.8676807809554243,0.3756319054566355,0.06044132648750088,none,0.6561246436207555,0.7268134301080448,7.0,0.7228781037089905,0.3790682545756936,weighted,0.4735704056928436,0.7344093674246,0.24930425650903787,0.5567616463138851,0.5572139303482587,0.715281812899477,0.7156549520766773,0.8676807809554243,0.3756319054566355,0.05,0.5567616463138851,0.5572139303482587,0.5567616463138851,0.5572139303482587,1.0,1.0,none,0.5,0.5,0.6561246436207555,0.24930425650903787,COMPLETE
