number,value,datetime_start,datetime_complete,duration,params_alpha,params_booster,params_colsample_bytree,params_gamma,params_grow_policy,params_lambda,params_learning_rate,params_max_delta_step,params_max_depth,params_min_child_weight,params_n_estimators,params_normalize_type,params_params_feature_fraction,params_params_labeled_ratio,params_params_missing_rate,params_params_resampling,params_params_sample_rows,params_params_scale_pos_weight,params_params_selftrain_max_iter,params_params_selftrain_threshold,params_rate_drop,params_sample_type,params_skip_drop,params_subsample,params_user_attrs_decision_threshold,user_attrs_acc_test,user_attrs_acc_val,user_attrs_f1_test,user_attrs_f1_val,user_attrs_feature_fraction,user_attrs_labeled_ratio,user_attrs_missing_rate,user_attrs_pr_auc_test,user_attrs_pr_auc_val,user_attrs_prec_test,user_attrs_prec_val,user_attrs_rec_test,user_attrs_rec_val,user_attrs_resampling_strategy,user_attrs_roc_auc_test,user_attrs_roc_auc_val,user_attrs_sample_rows,user_attrs_user_attrs_decision_threshold,state
1764,0.7156549520766773,2025-11-27 10:21:57.084863,2025-11-27 10:21:58.157386,0 days 00:00:01.072523,1.507322429447836,gbtree,0.46026116277912393,3.2497210636760143,lossguide,0.011054156230237587,0.0014333799808321664,6,6,0.6855137242098673,900,,0.8910394053785891,0.602714694704203,0.05415846607086229,oversample,0.5525591147314035,,10.0,0.6507554562994892,,,,0.392209760921018,,0.5567616463138851,0.5572139303482587,0.715281812899477,0.7156549520766773,0.8910394053785891,0.602714694704203,0.05,0.7633905546057627,0.7588446163437143,0.5567616463138851,0.5572139303482587,1.0,1.0,oversample,0.7544782738440625,0.7368442652852766,0.5525591147314035,0.5,COMPLETE
1765,0.7156549520766773,2025-11-27 10:21:58.352406,2025-11-27 10:21:59.281467,0 days 00:00:00.929061,8.80829837676039,gbtree,0.6912005210245775,3.078479320806945,lossguide,0.0003951911920654505,0.001290864022368976,9,10,7.087015332367672,1000,,0.8240707355946657,0.21213992276454452,0.004790288699711854,oversample,0.5816522303884532,,9.0,0.6060513784594188,,,,0.732645627607226,,0.5567616463138851,0.5572139303482587,0.715281812899477,0.7156549520766773,0.8240707355946657,0.21213992276454452,0.0,0.6179967540064542,0.5928194256448276,0.5567616463138851,0.5572139303482587,1.0,1.0,oversample,0.5958781644258029,0.5707105713489778,0.5816522303884532,0.5,COMPLETE
1766,0.7156549520766773,2025-11-27 10:21:59.479361,2025-11-27 10:22:00.167569,0 days 00:00:00.688208,69.59639138542751,gbtree,0.40597318246421976,1.1619479623427964,depthwise,60.05672320385749,0.0017600384095422192,7,5,1.684592028022286,700,,0.8560927035756815,0.26587350285488065,0.041057870144117214,none,0.7309058936388196,1.8414629526087585,6.0,0.7321673824225253,,,,0.556001351271526,,0.5567616463138851,0.5572139303482587,0.715281812899477,0.7156549520766773,0.8560927035756815,0.26587350285488065,0.05,0.5567616463138851,0.5572139303482587,0.5567616463138851,0.5572139303482587,1.0,1.0,none,0.5,0.5,0.7309058936388196,0.5,COMPLETE
1767,0.6141491395793499,2025-11-27 10:22:00.368132,2025-11-27 10:22:03.588170,0 days 00:00:03.220038,0.004105143099260572,gbtree,0.8642429487799959,0.5257151420438899,depthwise,1.236867112803627,0.3678639628209538,0,3,3.6048855349579205,600,,0.5760704273519761,0.6037255481883153,0.0655271247322768,oversample,0.8642788717670835,,8.0,0.6746047633632375,,,,0.2854140740707439,,0.5508819538670285,0.5436454093170511,0.6245746691871455,0.6141491395793499,0.5760704273519761,0.6037255481883153,0.08,0.5896850118675138,0.5737240958347539,0.5841584158415841,0.5806218365871294,0.6709991876523151,0.6517857142857143,oversample,0.5546365987499793,0.5352624265417932,0.8642788717670835,0.5,COMPLETE
1768,0.7156549520766773,2025-11-27 10:22:03.795914,2025-11-27 10:22:04.552110,0 days 00:00:00.756196,11.762239649939913,gbtree,0.4764074387592677,8.412800663481075,depthwise,68.90923896897563,0.00022681689527652684,8,7,1.207549607105641,800,,0.9491144005080021,0.4961223880518538,0.0071087900630119605,oversample,0.888891633308395,,8.0,0.6334830746204202,,,,0.3297827126188405,,0.5567616463138851,0.5572139303482587,0.715281812899477,0.7156549520766773,0.9491144005080021,0.4961223880518538,0.0,0.5567616463138851,0.5572139303482587,0.5567616463138851,0.5572139303482587,1.0,1.0,oversample,0.5,0.5,0.888891633308395,0.5,COMPLETE
1769,0.7114485981308412,2025-11-27 10:22:04.750729,2025-11-27 10:22:27.464777,0 days 00:00:22.714048,0.08649345766664047,dart,0.8230650012454299,1.9586895905880652,depthwise,0.0007385220950884463,0.020889688877076058,4,6,3.277741238750154,400,forest,0.6080610097849588,0.6385746473899906,0.011528118273788836,none,0.5145568989163571,1.8443472125293916,11.0,0.9252899377508403,0.0009097473902646147,weighted,0.7469256286759403,0.8235127651202243,,0.5508819538670285,0.5531433740388965,0.7092240117130307,0.7114485981308412,0.6080610097849588,0.6385746473899906,0.02,0.4569109070486253,0.4472475394420829,0.5544871794871795,0.5556569343065694,0.983753046303818,0.9886363636363636,none,0.3709933851688523,0.34995207805473383,0.5145568989163571,0.5,COMPLETE
1770,0.7154896832316188,2025-11-27 10:22:27.666144,2025-11-27 10:23:04.520793,0 days 00:00:36.854649,0.03396265559727684,gbtree,0.6618373691396564,1.4533366133006653,lossguide,1.8242516875117873,0.0024279816486471803,8,12,2.410081801772011,1000,,0.7667139697523291,0.730422987799189,0.06325319473789155,none,0.8440569406919634,2.08636894127715,8.0,0.7293223972324312,,,,0.8424121162035274,,0.5567616463138851,0.5572139303482587,0.715281812899477,0.7154896832316188,0.7667139697523291,0.730422987799189,0.05,0.5382941347682763,0.539520016201809,0.5567616463138851,0.5572657311000453,1.0,0.9991883116883117,none,0.4981858949916278,0.5046848261544381,0.8440569406919634,0.5,COMPLETE
1771,0.7156549520766773,2025-11-27 10:23:04.722038,2025-11-27 10:23:05.708427,0 days 00:00:00.986389,0.0031423205431497713,gbtree,0.48017736121915944,0.9338409764882383,lossguide,0.0021024746991630964,0.0015999888400768682,3,3,1.4850780489602928,400,,0.8467544859637179,0.6490506193398821,0.05935997813267829,none,0.5611826170108489,1.3151182858475736,11.0,0.6018220927759388,,,,0.38197616656695105,,0.5567616463138851,0.5572139303482587,0.715281812899477,0.7156549520766773,0.8467544859637179,0.6490506193398821,0.05,0.6364792972389501,0.6627170281668388,0.5567616463138851,0.5572139303482587,1.0,1.0,none,0.5759557519189642,0.5995653031850683,0.5611826170108489,0.5,COMPLETE
1772,0.41147467503361723,2025-11-27 10:23:05.911583,2025-11-27 10:23:11.708200,0 days 00:00:05.796617,0.004596179447046184,dart,0.9442362712372614,1.8696718051616434,lossguide,1.1150322923109313,0.00011817854974954253,3,6,28.12137847437678,200,tree,0.9896216869890134,0.7948723401320443,0.09524104481773524,undersample,0.9978663360975479,,9.0,0.9167217554593883,0.41491766683919723,weighted,0.8475141000656542,0.30828089147011817,,0.4079601990049751,0.40615106286748076,0.41379310344827586,0.41147467503361723,0.9896216869890134,0.7948723401320443,0.08,0.4789580080226836,0.4714499253152972,0.46107784431137727,0.4594594594594595,0.3753046303818034,0.37256493506493504,undersample,0.42246058455876256,0.40883015732990197,0.9978663360975479,0.5,COMPLETE
1773,0.31613203161320313,2025-11-27 10:23:11.907831,2025-11-27 10:23:12.565433,0 days 00:00:00.657602,0.0017756005295123264,gbtree,0.42073097744516597,5.358879925710621,depthwise,0.04136746618537037,0.055443917787718504,9,9,0.32445138895806236,600,,0.9782657951855835,0.4759079862289316,0.061033460265779306,undersample,0.6690514124597953,,6.0,0.8125922948491502,,,,0.6423698538870593,,0.34283129805517865,0.33469018543645407,0.33318035796236806,0.31613203161320313,0.9782657951855835,0.4759079862289316,0.05,0.4417212450978802,0.43789363751102955,0.3829113924050633,0.36996735582154516,0.29488220958570266,0.275974025974026,undersample,0.31928538271523066,0.3161322844673202,0.6690514124597953,0.5,COMPLETE
1774,0.2955665024630542,2025-11-27 10:23:12.764899,2025-11-27 10:23:13.312086,0 days 00:00:00.547187,0.06207486798574115,gbtree,0.3812364258366776,4.578687853426443,depthwise,10.298082503239476,0.00014077716726437005,1,12,18.101699937771162,400,,0.9978563419461528,0.6837902202574928,0.00450698273905008,undersample,0.9029154129027444,,11.0,0.781855254300075,,,,0.2524656765363224,,0.35323383084577115,0.35323383084577115,0.29207920792079206,0.2955665024630542,0.9978563419461528,0.6837902202574928,0.0,0.4272414321186242,0.4256067708632761,0.37389100126742714,0.37593984962406013,0.239642567018684,0.2435064935064935,undersample,0.288894875578176,0.2868244498096388,0.9029154129027444,0.5,COMPLETE
1775,0.7156549520766773,2025-11-27 10:23:13.519263,2025-11-27 10:23:14.048223,0 days 00:00:00.528960,1.68827155663707,gbtree,0.7409120654511443,3.9113571212334652,lossguide,0.0002052007161032924,0.0017636395944511554,2,11,2.2025259192388775,300,,0.5527748421304901,0.5339520078523932,0.06534914117970339,none,0.7098413157185989,1.3041790719296478,9.0,0.6542878326062253,,,,0.6320592646289726,,0.5567616463138851,0.5572139303482587,0.715281812899477,0.7156549520766773,0.5527748421304901,0.5339520078523932,0.08,0.5545049977687009,0.546207571096773,0.5567616463138851,0.5572139303482587,1.0,1.0,none,0.4861482285846914,0.47434807914251226,0.7098413157185989,0.5,COMPLETE
1776,0.7156549520766773,2025-11-27 10:23:14.256984,2025-11-27 10:23:33.065675,0 days 00:00:18.808691,0.00022066844329900404,dart,0.3880108496283753,8.240772244494227,lossguide,4.464361642403242,0.000475043889954217,2,6,43.03497248615578,400,tree,0.5408444687965194,0.41678625448516526,0.04155887020861522,none,0.9401609658321851,0.9882848662350009,11.0,0.8129645928108445,0.2504058491238348,weighted,0.4734867135604867,0.6453755535799373,,0.5567616463138851,0.5572139303482587,0.715281812899477,0.7156549520766773,0.5408444687965194,0.41678625448516526,0.05,0.4601634808553668,0.44887983659193786,0.5567616463138851,0.5572139303482587,1.0,1.0,none,0.3323844891327774,0.30054355756602946,0.9401609658321851,0.5,COMPLETE
1777,0.7156549520766773,2025-11-27 10:23:33.278535,2025-11-27 10:23:45.161242,0 days 00:00:11.882707,7.45316454072329,dart,0.4652558433502223,2.276689383929903,depthwise,3.094532715356673,0.18395977194117863,6,8,0.45069280293295655,300,forest,0.9247426244913071,0.6177614123933748,0.0027614044963305442,oversample,0.7248234494097029,,6.0,0.8364364093943449,0.24821501604836255,weighted,0.6962861781708526,0.39843706375527943,,0.5567616463138851,0.5572139303482587,0.715281812899477,0.7156549520766773,0.9247426244913071,0.6177614123933748,0.0,0.5503844764729465,0.5478408724872245,0.5567616463138851,0.5572139303482587,1.0,1.0,oversample,0.46235721746050173,0.4658498103020575,0.7248234494097029,0.5,COMPLETE
1778,0.5990747879722437,2025-11-27 10:23:45.362164,2025-11-27 10:23:54.057361,0 days 00:00:08.695197,0.009596634365156648,gbtree,0.6807462296158049,1.2398890832731169,lossguide,0.012175874955195006,0.012023423714273779,0,5,0.2650854183874763,900,,0.8159352161573863,0.2909091957009625,0.06691931285020628,none,0.6623929288688143,1.019040552980021,8.0,0.8346980730442977,,,,0.4630825870491263,,0.5160560832202623,0.52962460425147,0.5774091627172195,0.5990747879722437,0.8159352161573863,0.2909091957009625,0.08,0.5712118755363709,0.5622999988308104,0.5618754803996926,0.5704845814977973,0.5938261575954509,0.6306818181818182,none,0.5224303287521345,0.5205624941963043,0.6623929288688143,0.5,COMPLETE
1779,0.7156549520766773,2025-11-27 10:23:54.272569,2025-11-27 10:24:03.259775,0 days 00:00:08.987206,0.0004881751858095,dart,0.4670267239157624,4.923655407134378,lossguide,0.12597769444334475,0.00011397278186793941,5,4,38.36198480154331,300,forest,0.8819341888500929,0.22341998947439556,0.08573542571210434,oversample,0.9925773415592037,,5.0,0.6135179695097661,0.4157792155195203,weighted,0.33965309857229015,0.2862209088381019,,0.5567616463138851,0.5572139303482587,0.715281812899477,0.7156549520766773,0.8819341888500929,0.22341998947439556,0.08,0.5940585781845695,0.5864490666819332,0.5567616463138851,0.5572139303482587,1.0,1.0,oversample,0.5663165834977371,0.5474170237321412,0.9925773415592037,0.5,COMPLETE
1780,0.0,2025-11-27 10:24:03.470663,2025-11-27 10:24:04.311930,0 days 00:00:00.841267,0.0008227286322122714,gbtree,0.31372520180971863,5.4520119716500925,depthwise,0.007957925453508314,0.006452508462941986,1,5,13.193413212690107,900,,0.9966889968449526,0.3920578030613419,0.010354719431977223,none,0.8603212734584538,0.5447296823462292,9.0,0.9332870177250971,,,,0.6324827348995297,,0.44323835368611486,0.4427860696517413,0.0,0.0,0.9966889968449526,0.3920578030613419,0.02,0.5455525149790426,0.5467882520508556,0.0,0.0,0.0,0.0,none,0.48984814071851324,0.48801868458405745,0.8603212734584538,0.5,COMPLETE
1781,0.6839332748024582,2025-11-27 10:24:04.518703,2025-11-27 10:24:09.040179,0 days 00:00:04.521476,0.014912584734908188,gbtree,0.26107517980576705,1.7567656948828547,lossguide,0.039174154412824215,0.008293898453466902,0,10,0.2294940431203251,1000,,0.5938851485545438,0.48327588204038396,0.037634145819040635,undersample,0.529775977005088,,7.0,0.6419663669709399,,,,0.6465104054970663,,0.6743554952510177,0.6743554952510177,0.6797153024911032,0.6839332748024582,0.5938851485545438,0.48327588204038396,0.05,0.7370883236790066,0.7327514402654366,0.7512291052114061,0.7447418738049714,0.620633631194151,0.6323051948051948,undersample,0.7204380046088297,0.7163630228300811,0.529775977005088,0.5,COMPLETE
1782,0.7156549520766773,2025-11-27 10:24:09.244729,2025-11-27 10:27:28.219862,0 days 00:03:18.975133,0.00020859230104762385,dart,0.2913210765784884,1.3741442640032386,lossguide,0.012539294671928325,0.001209133249956598,10,6,5.0067375068696585,1000,forest,0.8395749980837426,0.6623633737245184,0.0874028822863436,none,0.6048460723607443,4.253478757611225,7.0,0.795917610197528,0.09756933112972,uniform,0.1864819339222175,0.5032545150257022,,0.5567616463138851,0.5572139303482587,0.715281812899477,0.7156549520766773,0.8395749980837426,0.6623633737245184,0.08,0.5704652953979947,0.5659299253027014,0.5567616463138851,0.5572139303482587,1.0,1.0,none,0.5606342943351184,0.5560595558680339,0.6048460723607443,0.5,COMPLETE
1783,0.7156549520766773,2025-11-27 10:27:28.422412,2025-11-27 10:27:29.576560,0 days 00:00:01.154148,0.0002957458236170526,gbtree,0.6045549105150042,3.0379159085703735,depthwise,0.0019366008180733572,0.017696275698022984,0,10,1.0634667712318695,400,,0.6210304173712289,0.8677707389381504,0.018825318915517,none,0.8692479648325586,3.744688714916275,7.0,0.6575213934400486,,,,0.7005687252154071,,0.5567616463138851,0.5572139303482587,0.715281812899477,0.7156549520766773,0.6210304173712289,0.8677707389381504,0.02,0.5308837525424133,0.5330411448771061,0.5567616463138851,0.5572139303482587,1.0,1.0,none,0.5146027785606525,0.5159970583553322,0.8692479648325586,0.5,COMPLETE
1784,0.7156549520766773,2025-11-27 10:27:29.773124,2025-11-27 10:27:30.292820,0 days 00:00:00.519696,6.190311161207981,gbtree,0.5936556953239147,8.415615453566597,lossguide,0.00032717658181667105,0.00015470071812118995,2,9,46.9694559480455,400,,0.9673038141018135,0.7856562774209743,0.04748675001029421,undersample,0.8248306294941874,,9.0,0.6146337104036554,,,,0.9689363535065565,,0.5567616463138851,0.5572139303482587,0.715281812899477,0.7156549520766773,0.9673038141018135,0.7856562774209743,0.05,0.5567616463138851,0.5572139303482587,0.5567616463138851,0.5572139303482587,1.0,1.0,undersample,0.5,0.5,0.8248306294941874,0.5,COMPLETE
1785,0.3464741810105497,2025-11-27 10:27:30.485825,2025-11-27 10:27:31.041263,0 days 00:00:00.555438,0.0016120397396815799,gbtree,0.5776618077989293,5.605119006191838,lossguide,0.3122270938857949,0.00013943365477780246,6,7,0.19155010001832595,400,,0.5418501046072222,0.6198772083282158,0.06503917479374362,undersample,0.9964100538988085,,8.0,0.6798161343577216,,,,0.558562178993237,,0.4730890999547716,0.46766169154228854,0.3545706371191136,0.3464741810105497,0.5418501046072222,0.6198772083282158,0.08,0.564769941330064,0.5576634390976631,0.5574912891986062,0.5483304042179262,0.25995125913891143,0.2532467532467532,undersample,0.5390076095425985,0.515676611437592,0.9964100538988085,0.5,COMPLETE
1786,0.7156549520766773,2025-11-27 10:27:31.240664,2025-11-27 10:27:53.941587,0 days 00:00:22.700923,0.4726761657186216,dart,0.6832395390145356,7.891842270707597,depthwise,0.0001144088424094618,0.0006277365985375386,5,4,3.1720192986600186,500,forest,0.6954686525761307,0.2666177727018887,0.05394257808850114,oversample,0.9219843138060202,,12.0,0.6474589096040096,0.38702646292226756,weighted,0.15801973132915859,0.292705406940533,,0.5567616463138851,0.5572139303482587,0.715281812899477,0.7156549520766773,0.6954686525761307,0.2666177727018887,0.05,0.44694944895363425,0.43929028561755357,0.5567616463138851,0.5572139303482587,1.0,1.0,oversample,0.2711347170874849,0.26045287067375933,0.9219843138060202,0.5,COMPLETE
1787,0.7156549520766773,2025-11-27 10:27:54.152155,2025-11-27 10:30:00.177975,0 days 00:02:06.025820,28.58394381341989,dart,0.7061180293674141,2.3696501831116388,lossguide,13.05376076855161,0.04694985646448634,9,4,0.8079226690741754,1000,tree,0.9496288563476918,0.36263954252252545,0.05226158468487513,none,0.7070076923875755,1.5368176168008685,10.0,0.6334955935331988,0.15933617609076434,uniform,0.5876702858227335,0.47764040751390413,,0.5567616463138851,0.5572139303482587,0.715281812899477,0.7156549520766773,0.9496288563476918,0.36263954252252545,0.05,0.6365348683334454,0.6298568602605137,0.5567616463138851,0.5572139303482587,1.0,1.0,none,0.5777321407848273,0.5753535279837629,0.7070076923875755,0.5,COMPLETE
1788,0.509645580978017,2025-11-27 10:30:00.378949,2025-11-27 10:30:00.936467,0 days 00:00:00.557518,0.1155125195641311,gbtree,0.35844838265222656,4.996212124009408,depthwise,0.009827568945576293,0.019161274606475275,2,5,0.658984238083113,400,,0.7826211226795207,0.6365851281835114,0.04017004765201964,undersample,0.9292102007410801,,6.0,0.936901029882172,,,,0.3834911197515476,,0.48077792853912255,0.5056535504296699,0.4852017937219731,0.509645580978017,0.7826211226795207,0.6365851281835114,0.05,0.5533054867641285,0.5572562179443538,0.5415415415415415,0.5697091273821464,0.4394800974817222,0.461038961038961,undersample,0.49846690097647506,0.5189722815488904,0.9292102007410801,0.5,COMPLETE
1789,0.7164873509741204,2025-11-27 10:30:01.138493,2025-11-27 10:31:27.568847,0 days 00:01:26.430354,0.1356093016747709,dart,0.7068747487626397,4.100515213789782,lossguide,0.0008679616272222507,0.05222816366062425,8,7,1.738422641329617,800,forest,0.6066855106912712,0.7637017788022855,0.03257544359864233,none,0.7164494948281488,2.721894447857387,8.0,0.942706352176433,0.07396661659677956,uniform,0.5319827668670536,0.41013153134802227,,0.5576662143826323,0.5590230664857531,0.7156976744186047,0.7164873509741204,0.6066855106912712,0.7637017788022855,0.02,0.5115290660159963,0.5066500165641553,0.5572657311000453,0.558223833257816,1.0,1.0,none,0.43548467315439576,0.44209694161813673,0.7164494948281488,0.5,COMPLETE
1790,0.6967703349282297,2025-11-27 10:31:27.774741,2025-11-27 10:31:29.075706,0 days 00:00:01.300965,0.008860030810174252,gbtree,0.5467452409374767,1.608262682766265,lossguide,31.605377043075546,0.00817436501395651,10,12,0.5850047772546415,900,,0.8574881648130783,0.7290932157697934,0.09571382224472132,oversample,0.8183873386140335,,12.0,0.7166025355719576,,,,0.5976029847064528,,0.5377657168701945,0.5413839891451832,0.6916113458056729,0.6967703349282297,0.8574881648130783,0.7290932157697934,0.08,0.5163885928942127,0.5101390525098717,0.5501680268843014,0.5516098484848485,0.9309504467912266,0.9456168831168831,oversample,0.46451242560387274,0.45604861175596617,0.8183873386140335,0.5,COMPLETE
1791,0.20182440136830102,2025-11-27 10:31:29.287444,2025-11-27 10:32:17.058762,0 days 00:00:47.771318,8.20938445615098,dart,0.47706212006867593,4.518468315175906,lossguide,0.00039996685645853064,0.0012366515058157659,8,8,52.90259001829761,600,tree,0.9222829298692479,0.5165548493592902,0.05994131178177925,undersample,0.74821997366802,,11.0,0.833428950855957,0.07591913693078772,uniform,0.7571286576270405,0.9723631166006304,,0.3749434644957033,0.36680235187697874,0.21387940841865757,0.20182440136830102,0.9222829298692479,0.5165548493592902,0.05,0.52621349371862,0.5258749495914962,0.3567362428842505,0.3390804597701149,0.15272136474411047,0.14366883116883117,undersample,0.4034014986985859,0.3956342112943237,0.74821997366802,0.5,COMPLETE
1792,0.4858709405314213,2025-11-27 10:32:17.252548,2025-11-27 10:33:18.200338,0 days 00:01:00.947790,0.00022182065219765522,dart,0.5961796461615365,3.278882195041742,lossguide,67.89487047370646,0.23036345534517585,0,11,51.672149095359856,700,tree,0.5396232950116313,0.5273599474033701,0.03384508981600203,none,0.7075015135738412,0.7902832924718036,5.0,0.8958913770780568,0.27685707879513716,weighted,0.7690188976864624,0.6931221547457339,,0.4084124830393487,0.44866576209859793,0.44903117101937656,0.4858709405314213,0.5396232950116313,0.5273599474033701,0.02,0.4581434463908906,0.4790353188185917,0.4663167104111986,0.5057067603160668,0.4329813160032494,0.4675324675324675,none,0.3551799598799716,0.39676551742435295,0.7075015135738412,0.5,COMPLETE
1793,0.7156549520766773,2025-11-27 10:33:18.398844,2025-11-27 10:33:19.236365,0 days 00:00:00.837521,64.14200047796851,gbtree,0.6232776486952363,5.419484409878162,depthwise,4.463482626222435,0.03704463027307958,8,6,1.575203541721064,900,,0.6904420302141812,0.20270653896871432,0.059540328313628016,oversample,0.9916356594220654,,8.0,0.8949390160963746,,,,0.3079099580529655,,0.5567616463138851,0.5572139303482587,0.715281812899477,0.7156549520766773,0.6904420302141812,0.20270653896871432,0.05,0.5567616463138851,0.5572139303482587,0.5567616463138851,0.5572139303482587,1.0,1.0,oversample,0.5,0.5,0.9916356594220654,0.5,COMPLETE
