number,value,datetime_start,datetime_complete,duration,params_alpha,params_booster,params_colsample_bytree,params_gamma,params_grow_policy,params_lambda,params_learning_rate,params_max_delta_step,params_max_depth,params_min_child_weight,params_n_estimators,params_normalize_type,params_params_feature_fraction,params_params_labeled_ratio,params_params_missing_rate,params_params_resampling,params_params_sample_rows,params_params_scale_pos_weight,params_params_selftrain_max_iter,params_params_selftrain_threshold,params_rate_drop,params_sample_type,params_skip_drop,params_subsample,params_user_attrs_decision_threshold,user_attrs_acc_test,user_attrs_acc_val,user_attrs_f1_test,user_attrs_f1_val,user_attrs_feature_fraction,user_attrs_labeled_ratio,user_attrs_missing_rate,user_attrs_pr_auc_test,user_attrs_pr_auc_val,user_attrs_prec_test,user_attrs_prec_val,user_attrs_rec_test,user_attrs_rec_val,user_attrs_resampling_strategy,user_attrs_roc_auc_test,user_attrs_roc_auc_val,user_attrs_sample_rows,user_attrs_user_attrs_decision_threshold,state
2720,0.7156549520766773,2025-11-30 16:38:26.256926,2025-11-30 16:40:29.262430,0 days 00:02:03.005504,59.33642588820765,dart,0.47657603622584577,5.6515016195570364,lossguide,0.003752183328964627,0.013824450507522835,5,6,0.471063540985167,1000,forest,0.8347747803766463,0.6058521299843486,0.05922929953441175,undersample,0.6813922778697187,,6.0,0.8785295220060577,0.21062491684263968,uniform,0.5897406333352725,0.2761589221778342,,0.5567616463138851,0.5572139303482587,0.715281812899477,0.7156549520766773,0.8347747803766463,0.6058521299843486,0.08,0.5567616463138851,0.5572139303482587,0.5567616463138851,0.5572139303482587,1.0,1.0,undersample,0.5,0.5,0.6813922778697187,0.5,COMPLETE
2721,0.5704169944925256,2025-11-30 16:40:30.041499,2025-11-30 16:41:39.945117,0 days 00:01:09.903618,0.00013525833096357062,dart,0.7461375848336187,0.4330332413802629,lossguide,0.0013846990415080096,0.3556415403189154,4,8,0.21009415229508935,300,tree,0.6194941993098013,0.4977842481316797,0.09352087179366947,oversample,0.9951262939486005,,9.0,0.8975218164937799,0.3845657348431207,uniform,0.704776388354823,0.6560035173660937,,0.5101763907734057,0.5061058344640434,0.5704085680285601,0.5704169944925256,0.6194941993098013,0.4977842481316797,0.1,0.5096245296208534,0.5095949593573004,0.5573643410852713,0.5534351145038168,0.5840779853777417,0.588474025974026,oversample,0.4648402659195279,0.4557231902418317,0.9951262939486005,0.5,COMPLETE
2722,0.7156549520766773,2025-11-30 16:41:40.712949,2025-11-30 16:42:18.349323,0 days 00:00:37.636374,34.59543068524616,dart,0.8042547679018652,1.5034249644376407,lossguide,0.022594417896580874,0.004264149856621953,3,11,43.5706708002892,600,forest,0.9520113234476588,0.2977820299560916,0.04908914598375496,oversample,0.8773794820871129,,8.0,0.7721086377848716,0.24416107610675258,uniform,0.08508367419989486,0.3550843117090683,,0.5567616463138851,0.5572139303482587,0.715281812899477,0.7156549520766773,0.9520113234476588,0.2977820299560916,0.08,0.6039854830535231,0.6119750188375035,0.5567616463138851,0.5572139303482587,1.0,1.0,oversample,0.5867562459589848,0.5994819786954618,0.8773794820871129,0.5,COMPLETE
2723,0.6763133060710915,2025-11-30 16:42:19.163768,2025-11-30 16:42:20.023273,0 days 00:00:00.859505,1.470638886377331,gbtree,0.26865489905260065,3.141145936822818,depthwise,0.012463902597717279,0.24179763939673135,2,12,4.570353730455601,200,,0.6841630777410712,0.7026530477381976,0.004261075823091276,oversample,0.7729515608659189,,6.0,0.6034365658074734,,,,0.25147197678698974,,0.508819538670285,0.5345997286295794,0.6565464895635673,0.6763133060710915,0.6841630777410712,0.7026530477381976,0.08,0.5191292215966898,0.5354991398905993,0.5375453133091662,0.5521314843348741,0.843216896831844,0.872564935064935,oversample,0.42047323397271175,0.4635755906504119,0.7729515608659189,0.5,COMPLETE
2724,0.4859732412602503,2025-11-30 16:42:20.817394,2025-11-30 16:53:24.309257,0 days 00:11:03.491863,1.4345001678100084,dart,0.7703692198972834,1.4497966236680304,lossguide,0.026081722890191457,0.06975209171350642,2,10,0.12933358006982767,900,forest,0.9272230081482851,0.7050569954173977,0.021735385153759525,undersample,0.6544814360688642,,12.0,0.6286250804905396,0.33443927065114837,weighted,0.05162253756691104,0.8769314909692454,,0.4739936680235188,0.46132971506105835,0.4932461873638344,0.4859732412602503,0.9272230081482851,0.7050569954173977,0.08,0.5104204761423342,0.48367418850061195,0.5319548872180451,0.5188940092165899,0.45978878960194963,0.4569805194805195,undersample,0.4668139392231304,0.42714993765172515,0.6544814360688642,0.5,COMPLETE
2725,0.7156549520766773,2025-11-30 16:53:25.050615,2025-11-30 16:53:36.380619,0 days 00:00:11.330004,69.85345796799132,dart,0.5850959346011649,1.8552050433145062,lossguide,50.70395021976255,0.007065582646824564,5,5,5.450010598370018,300,forest,0.7452974230881682,0.23102881919873297,0.0001509434426787748,undersample,0.5856884892380156,,10.0,0.7758144421468194,0.2381114200113208,uniform,0.7847984144628599,0.35269971990217014,,0.5567616463138851,0.5572139303482587,0.715281812899477,0.7156549520766773,0.7452974230881682,0.23102881919873297,0.08,0.5567616463138851,0.5572139303482587,0.5567616463138851,0.5572139303482587,1.0,1.0,undersample,0.5,0.5,0.5856884892380156,0.5,COMPLETE
2726,0.6541648495420846,2025-11-30 16:53:37.132425,2025-11-30 16:53:37.637446,0 days 00:00:00.505021,0.9080018549829131,gbtree,0.3999341423974168,3.0619529272195334,lossguide,0.5035628874378855,0.03350642872938936,3,3,31.485508217380033,400,,0.838699531079717,0.21380867402813789,0.04818242610481628,undersample,0.9622784562036133,,11.0,0.8537145158862582,,,,0.21865979869812222,,0.6562641338760742,0.6413387607417458,0.6663740122914837,0.6541648495420846,0.838699531079717,0.21380867402813789,0.08,0.6127268902805563,0.5988024201709296,0.7249283667621776,0.706880301602262,0.6165718927701056,0.6087662337662337,undersample,0.5763938394204149,0.5715641291803192,0.9622784562036133,0.5,COMPLETE
2727,0.0,2025-11-30 16:53:38.379481,2025-11-30 16:54:40.745189,0 days 00:01:02.365708,1.3666164246251813,dart,0.676572961951699,7.778778468802468,depthwise,0.00015487385251019607,0.028066029493562124,7,7,5.639303633886503,900,forest,0.6977174177697236,0.6024399534183285,0.026663159763927524,none,0.712201450772491,0.5765201079491649,10.0,0.6724118816614947,0.40539706172902085,uniform,0.03312147332733818,0.4117176488129352,,0.44323835368611486,0.4427860696517413,0.0,0.0,0.6977174177697236,0.6024399534183285,0.08,0.4346547791529996,0.4235184722471462,0.0,0.0,0.0,0.0,none,0.26042457600424407,0.2349095618375496,0.712201450772491,0.5,COMPLETE
2728,0.40991589198760514,2025-11-30 16:54:41.493078,2025-11-30 16:54:42.353390,0 days 00:00:00.860312,0.04760575748406901,gbtree,0.4384324716663584,6.094862025439774,depthwise,0.646353785349446,0.016028829979160022,8,7,45.264823750283135,1000,,0.9210624982203381,0.8365511232098888,0.08368906467280302,undersample,0.6879861089420815,,11.0,0.9334079973914113,,,,0.2608782941175937,,0.40343735866123925,0.39710538218000907,0.422251423565484,0.40991589198760514,0.9210624982203381,0.8365511232098888,0.08,0.4651703464808813,0.4613828489105701,0.45817490494296575,0.4508276533592989,0.3915515840779854,0.3758116883116883,undersample,0.36844775278104747,0.3605707686083069,0.6879861089420815,0.5,COMPLETE
2729,0.5056740807989106,2025-11-30 16:54:43.102841,2025-11-30 16:54:43.849134,0 days 00:00:00.746293,4.721150556998258,gbtree,0.9198985188758821,7.680521671633489,lossguide,0.015099893371096493,0.004704507498903589,4,9,4.67522773932165,800,,0.9847809814966144,0.6515686021179792,0.08285445686427304,undersample,0.5389904759870419,,11.0,0.690033170267756,,,,0.2963173941594227,,0.5083672546359114,0.5074626865671642,0.4951230840687413,0.5056740807989106,0.9847809814966144,0.6515686021179792,0.08,0.5593008506068918,0.5540820058065095,0.5780911062906724,0.5736354273944387,0.4329813160032494,0.45211038961038963,undersample,0.5339569621512293,0.5175416705357972,0.5389904759870419,0.5,COMPLETE
2730,0.7156549520766773,2025-11-30 16:54:44.591559,2025-11-30 16:55:45.585220,0 days 00:01:00.993661,20.21081704337092,dart,0.6253593276093392,5.425162863110867,depthwise,5.669946366337093,0.08814332749693014,8,5,40.64204279311874,700,tree,0.5980998252693444,0.2610118737818269,0.06036882999850628,none,0.8085582362388318,3.7379133177839754,9.0,0.7505796855432496,0.02611008412389043,uniform,0.5342244087600513,0.24081117079690878,,0.5567616463138851,0.5572139303482587,0.715281812899477,0.7156549520766773,0.5980998252693444,0.2610118737818269,0.08,0.4999798118956334,0.5131402519522115,0.5567616463138851,0.5572139303482587,1.0,1.0,none,0.388893217725758,0.42337877903506094,0.8085582362388318,0.5,COMPLETE
2731,0.7156549520766773,2025-11-30 16:55:46.329902,2025-11-30 16:55:50.834097,0 days 00:00:04.504195,0.02994285969938985,dart,0.29340666787874536,0.36495821048145305,depthwise,0.002184813843277413,0.00037664729458166557,7,6,0.16238383453781158,200,forest,0.8540248979994136,0.46590835764139954,0.07034348584263703,oversample,0.6635597587974253,,7.0,0.8992846873495933,0.44436493247264,weighted,0.37307094968266186,0.9265292125886722,,0.5567616463138851,0.5572139303482587,0.715281812899477,0.7156549520766773,0.8540248979994136,0.46590835764139954,0.08,0.4598239580626089,0.4350477206458082,0.5567616463138851,0.5572139303482587,1.0,1.0,oversample,0.340649297899501,0.30080223657853894,0.6635597587974253,0.5,COMPLETE
2732,0.0,2025-11-30 16:55:51.577172,2025-11-30 16:55:52.441523,0 days 00:00:00.864351,7.045119722223801,gbtree,0.6656936295255217,2.7205004156832615,lossguide,43.706134454329806,0.0002415898217502273,9,6,80.99467237709905,1000,,0.7464614745278718,0.5046528029305216,0.05108632824647798,none,0.5985268897690148,0.6129785885536554,7.0,0.9332612264721345,,,,0.6808081655246188,,0.44323835368611486,0.4427860696517413,0.0,0.0,0.7464614745278718,0.5046528029305216,0.08,0.5639030569527321,0.5556666036073938,0.0,0.0,0.0,0.0,none,0.5369759114043667,0.5346414310918908,0.5985268897690148,0.5,COMPLETE
2733,0.060398078242964996,2025-11-30 16:55:53.198544,2025-11-30 16:57:33.979766,0 days 00:01:40.781222,0.0248510462529264,dart,0.72234804023299,3.6963039454704028,lossguide,4.205347421692328,0.011286451003143478,0,5,21.13758347361134,900,forest,0.7755953030199,0.6278713029310234,0.027928341944090596,none,0.7762960866577842,0.7074974817895759,8.0,0.7209962988021654,0.12110047574270905,weighted,0.8273508911512156,0.6415831252612951,,0.3853459972862958,0.3808231569425599,0.06854009595613433,0.060398078242964996,0.7755953030199,0.6278713029310234,0.08,0.4501342510033107,0.445000862646862,0.21929824561403508,0.19555555555555557,0.04061738424045491,0.03571428571428571,none,0.34904051791309537,0.33762295544088183,0.7762960866577842,0.5,COMPLETE
2734,0.7156549520766773,2025-11-30 16:57:34.724625,2025-11-30 16:57:39.127973,0 days 00:00:04.403348,0.28789222525851715,dart,0.9128215662053225,0.13159522299689308,depthwise,20.96704571023854,0.0011790126780840018,1,3,3.9741106498329617,200,tree,0.6355233421401597,0.8676376365020955,0.006047963388260958,none,0.5387473908823289,3.5316210474985876,6.0,0.7173458716217578,0.41480872688097953,weighted,0.0564776324160723,0.9981539982814243,,0.5567616463138851,0.5572139303482587,0.715281812899477,0.7156549520766773,0.6355233421401597,0.8676376365020955,0.08,0.5532329624784189,0.5475398644168405,0.5567616463138851,0.5572139303482587,1.0,1.0,none,0.47298239360732103,0.4538904660201903,0.5387473908823289,0.5,COMPLETE
2735,0.7156549520766773,2025-11-30 16:57:39.881821,2025-11-30 16:58:02.638215,0 days 00:00:22.756394,0.056285921391124934,dart,0.8762546567699487,6.236692710556214,depthwise,0.048792005023467144,0.008795586553275983,5,8,0.4614481391658974,500,forest,0.9986145772417464,0.2920683140225372,0.017673167280416603,none,0.5270420277073398,1.7804266898205332,11.0,0.6098839203035987,0.3111218649712038,weighted,0.023287104824205797,0.9543828171059812,,0.5567616463138851,0.5572139303482587,0.715281812899477,0.7156549520766773,0.9986145772417464,0.2920683140225372,0.08,0.5567616463138851,0.5572139303482587,0.5567616463138851,0.5572139303482587,1.0,1.0,none,0.5,0.5,0.5270420277073398,0.5,COMPLETE
2736,0.5497630331753555,2025-11-30 16:58:03.393206,2025-11-30 16:58:11.870792,0 days 00:00:08.477586,0.04963821692566441,gbtree,0.631503373134597,1.2132086273768794,depthwise,0.7298588925410248,0.02745155957429519,0,9,10.566707312658108,800,,0.936876288233863,0.5749275829553979,0.07532499637158972,undersample,0.6612467049427555,,12.0,0.7241037178583182,,,,0.4845363081000909,,0.5223880597014925,0.527363184079602,0.5467811158798284,0.5497630331753555,0.936876288233863,0.5749275829553979,0.08,0.5860798472669527,0.6088138898725417,0.5796178343949044,0.5858585858585859,0.5174654752233956,0.5178571428571429,undersample,0.5415499262255674,0.5559476274491597,0.6612467049427555,0.5,COMPLETE
2737,0.24774560987185573,2025-11-30 16:58:12.610649,2025-11-30 16:58:37.872441,0 days 00:00:25.261792,0.010594028789993389,dart,0.693975936934389,0.6006276989926962,depthwise,0.3808580846344674,0.0057962423952406476,10,6,54.174395464993076,500,tree,0.8595991699957142,0.4273686175514572,0.002605246737426603,undersample,0.8501674467943245,,10.0,0.617276260781885,0.3610285754642951,weighted,0.39846514002096384,0.42546165220188703,,0.276797829036635,0.2831298055178652,0.2559329920893439,0.24774560987185573,0.8595991699957142,0.4273686175514572,0.08,0.3953477415450575,0.3993200367636557,0.2995642701525055,0.29828571428571427,0.22339561332250202,0.21185064935064934,undersample,0.20666995474062896,0.21770450565777433,0.8501674467943245,0.5,COMPLETE
2738,0.7156549520766773,2025-11-30 16:58:38.625782,2025-11-30 16:59:26.661577,0 days 00:00:48.035795,87.53761420356292,dart,0.8649010894025597,4.059353444973489,lossguide,0.0001376026621171971,0.08677743768621493,6,8,1.5299138508116001,700,tree,0.5827578317006785,0.46068110897811526,0.09788324473997942,undersample,0.5620325189705497,,9.0,0.6037317670243095,0.2862069994683848,uniform,0.21164200402972888,0.4984984843375996,,0.5567616463138851,0.5572139303482587,0.715281812899477,0.7156549520766773,0.5827578317006785,0.46068110897811526,0.1,0.5567616463138851,0.5572139303482587,0.5567616463138851,0.5572139303482587,1.0,1.0,undersample,0.5,0.5,0.5620325189705497,0.5,COMPLETE
2739,0.7156549520766773,2025-11-30 16:59:27.404799,2025-11-30 17:00:08.036538,0 days 00:00:40.631739,2.774598413187728,dart,0.6204214150538233,7.586808366365188,depthwise,0.00018435123117513036,0.08659908700418752,1,8,2.702667798542269,600,forest,0.900830895569654,0.5351105523826617,0.019046819051121988,none,0.9265668736865719,1.2732382799231212,11.0,0.6645326575579076,0.28256960455267427,weighted,0.5357528949574201,0.20469826848321057,,0.5567616463138851,0.5572139303482587,0.715281812899477,0.7156549520766773,0.900830895569654,0.5351105523826617,0.08,0.6001203285437395,0.6002561383995182,0.5567616463138851,0.5572139303482587,1.0,1.0,none,0.5819924070359257,0.5895858482681771,0.9265668736865719,0.5,COMPLETE
2740,0.7156549520766773,2025-11-30 17:00:08.795381,2025-11-30 17:00:09.528457,0 days 00:00:00.733076,32.07289826339588,gbtree,0.28660734683042827,2.8601842196548577,lossguide,3.370189694728123,0.0009593593680216712,3,11,0.8130065315150689,800,,0.9076197692426617,0.2740633155018387,0.010208523813942183,oversample,0.7682249057328125,,7.0,0.7451477881018924,,,,0.23168307594911255,,0.5567616463138851,0.5572139303482587,0.715281812899477,0.7156549520766773,0.9076197692426617,0.2740633155018387,0.08,0.5567616463138851,0.5572139303482587,0.5567616463138851,0.5572139303482587,1.0,1.0,oversample,0.5,0.5,0.7682249057328125,0.5,COMPLETE
2741,0.44731977818853974,2025-11-30 17:00:10.284285,2025-11-30 17:00:10.660544,0 days 00:00:00.376259,0.0007793312979703275,gbtree,0.31310442931196686,5.856677518516435,depthwise,0.8290427115630548,0.0005578340314784579,6,6,10.259906454586082,200,,0.5244965039017331,0.3589923372871316,0.09948444075856722,undersample,0.8737528377487314,,5.0,0.7373783510061469,,,,0.6450543462805576,,0.4758028041610131,0.45906829488919043,0.4795689268073642,0.44731977818853974,0.5244965039017331,0.3589923372871316,0.1,0.5865276408331179,0.5712701456316195,0.536144578313253,0.51931330472103,0.4337936636880585,0.39285714285714285,undersample,0.5034325834314229,0.4891487470649881,0.8737528377487314,0.5,COMPLETE
2742,0.20182440136830102,2025-11-30 17:00:11.406502,2025-11-30 17:00:12.097476,0 days 00:00:00.690974,4.600201077802711,gbtree,0.42573657232720585,6.187336670873377,lossguide,35.56002870261742,0.0021316486540913226,6,11,0.1020987663195115,700,,0.7556983177597679,0.8517892614993174,0.06214819195002215,undersample,0.5552251949726309,,12.0,0.8020852475347593,,,,0.6849385946410476,,0.3749434644957033,0.36680235187697874,0.21387940841865757,0.20182440136830102,0.7556983177597679,0.8517892614993174,0.08,0.4824734280131445,0.4841649225724115,0.3567362428842505,0.3390804597701149,0.15272136474411047,0.14366883116883117,undersample,0.33458570268074733,0.32329114322857944,0.5552251949726309,0.5,COMPLETE
2743,0.7156549520766773,2025-11-30 17:00:12.854544,2025-11-30 17:01:56.113781,0 days 00:01:43.259237,0.00020331323811328245,dart,0.416894438078573,5.647871484215159,depthwise,0.2298982253114316,0.0010340879155463607,1,5,17.568619132053414,1000,tree,0.8637513335459632,0.23576255321298728,0.02460465708886376,oversample,0.7989998466418831,,6.0,0.8908874458309992,0.2825714689445882,uniform,0.29531727948440606,0.7179600339681458,,0.5567616463138851,0.5572139303482587,0.715281812899477,0.7156549520766773,0.8637513335459632,0.23576255321298728,0.08,0.6737337638298024,0.6616455157378895,0.5567616463138851,0.5572139303482587,1.0,1.0,oversample,0.6534404582304083,0.6299542834591353,0.7989998466418831,0.5,COMPLETE
2744,0.7156549520766773,2025-11-30 17:01:56.858875,2025-11-30 17:01:57.492250,0 days 00:00:00.633375,5.9419723662373665,gbtree,0.2507603958187882,8.691324214540307,lossguide,2.5153840877743736,0.00043451868431565135,5,4,84.32603786174673,600,,0.8244452597803014,0.7230096475392205,0.0643319138623095,oversample,0.9154810964619191,,10.0,0.6865444037625174,,,,0.7858338501890347,,0.5567616463138851,0.5572139303482587,0.715281812899477,0.7156549520766773,0.8244452597803014,0.7230096475392205,0.08,0.52621349371862,0.5258749495914962,0.5567616463138851,0.5572139303482587,1.0,1.0,oversample,0.4034014986985859,0.3956342112943237,0.9154810964619191,0.5,COMPLETE
2745,0.3870967741935484,2025-11-30 17:01:58.236224,2025-11-30 17:01:58.609541,0 days 00:00:00.373317,7.004877392893597,gbtree,0.8410385368884123,3.114444313159077,lossguide,3.269315983123202,0.03531629811073522,1,5,0.4347343782005912,200,,0.7596365597666261,0.5894174451284449,0.07924832239957239,undersample,0.618128521453452,,12.0,0.8414218837359321,,,,0.8677705769199766,,0.35052012663952964,0.32971506105834464,0.4190938511326861,0.3870967741935484,0.7596365597666261,0.5894174451284449,0.08,0.444452858407687,0.43150621021157676,0.41740531829170024,0.3946037099494098,0.4207961007311129,0.37987012987012986,undersample,0.30776828196753925,0.28030399758566255,0.618128521453452,0.5,COMPLETE
2746,0.7156549520766773,2025-11-30 17:01:59.356616,2025-11-30 17:02:00.088235,0 days 00:00:00.731619,1.5290790479264198,gbtree,0.48735574303479545,7.7047321559670365,lossguide,0.04083572976877962,0.29100660492478003,2,11,80.67404161233235,800,,0.5046208863336863,0.3608394920053151,0.08479690435856078,oversample,0.7721627824993764,,11.0,0.6795790693350651,,,,0.7798407760470873,,0.5567616463138851,0.5572139303482587,0.715281812899477,0.7156549520766773,0.5046208863336863,0.3608394920053151,0.08,0.5044116228222525,0.4943055970069201,0.5567616463138851,0.5572139303482587,1.0,1.0,oversample,0.35156998623982494,0.32222782324927374,0.7721627824993764,0.5,COMPLETE
2747,0.7156549520766773,2025-11-30 17:02:00.840353,2025-11-30 17:02:01.297201,0 days 00:00:00.456848,0.0009907630691213473,gbtree,0.446414669193185,6.0355847322045175,depthwise,0.45844261422587634,0.003450084493644603,8,6,43.70616551451043,300,,0.9974278925144543,0.6853817290022642,0.02556123570199921,none,0.8142125612223253,1.4155669114973712,6.0,0.7068412920091487,,,,0.9809404869581932,,0.5567616463138851,0.5572139303482587,0.715281812899477,0.7156549520766773,0.9974278925144543,0.6853817290022642,0.08,0.5662819970174937,0.5475439868521486,0.5567616463138851,0.5572139303482587,1.0,1.0,none,0.4909162121387953,0.46034583394133954,0.8142125612223253,0.5,COMPLETE
2748,0.4820647419072616,2025-11-30 17:02:02.039154,2025-11-30 17:02:06.089183,0 days 00:00:04.050029,0.0005170949236757813,dart,0.35716601460885933,1.311843254960362,depthwise,0.015805978029546537,0.19074015773481384,3,5,6.4894127200542995,200,forest,0.6549196759716162,0.8954655760997368,0.08795633146572057,undersample,0.7914466176628407,,12.0,0.6972374098934595,0.3693010713486733,uniform,0.10449307071156841,0.6088041791589214,,0.4730890999547716,0.46449570330167345,0.49935539321014183,0.4820647419072616,0.6549196759716162,0.8954655760997368,0.08,0.5355504967750082,0.5120781966913925,0.5301094890510949,0.5227703984819735,0.4719740048740861,0.4472402597402597,undersample,0.47461827948076063,0.4466557446639163,0.7914466176628407,0.5,COMPLETE
2749,0.20182440136830102,2025-11-30 17:02:06.834298,2025-11-30 17:02:27.301109,0 days 00:00:20.466811,0.0299185959452449,dart,0.25000958978259513,8.757812461719505,lossguide,0.5632976783561957,0.26756023540828944,0,5,24.707100274418636,400,tree,0.9527774652744616,0.4930460142104302,0.04191418541294284,undersample,0.9491798859375273,,7.0,0.8949997032197804,0.015847516534522932,weighted,0.7521995402117688,0.8648617749941239,,0.3749434644957033,0.36680235187697874,0.21387940841865757,0.20182440136830102,0.9527774652744616,0.4930460142104302,0.08,0.52621349371862,0.5258749495914962,0.3567362428842505,0.3390804597701149,0.15272136474411047,0.14366883116883117,undersample,0.4034014986985859,0.3956342112943237,0.9491798859375273,0.5,COMPLETE
