number,value,datetime_start,datetime_complete,duration,params_alpha,params_booster,params_colsample_bytree,params_gamma,params_grow_policy,params_lambda,params_learning_rate,params_max_delta_step,params_max_depth,params_min_child_weight,params_n_estimators,params_normalize_type,params_params_feature_fraction,params_params_labeled_ratio,params_params_missing_rate,params_params_resampling,params_params_sample_rows,params_params_scale_pos_weight,params_params_selftrain_max_iter,params_params_selftrain_threshold,params_rate_drop,params_sample_type,params_skip_drop,params_subsample,params_user_attrs_decision_threshold,user_attrs_acc_test,user_attrs_acc_val,user_attrs_f1_test,user_attrs_f1_val,user_attrs_feature_fraction,user_attrs_labeled_ratio,user_attrs_missing_rate,user_attrs_pr_auc_test,user_attrs_pr_auc_val,user_attrs_prec_test,user_attrs_prec_val,user_attrs_rec_test,user_attrs_rec_val,user_attrs_resampling_strategy,user_attrs_roc_auc_test,user_attrs_roc_auc_val,user_attrs_sample_rows,user_attrs_user_attrs_decision_threshold,state
0,,2025-11-26 15:52:53.878376,2025-11-26 15:52:53.952827,0 days 00:00:00.074451,60.53082080079022,dart,0.8333800304661316,4.375872112626925,lossguide,22.420123713724433,0.0036905100721932025,10,8,8.663279761354557,700,forest,,,,,0.989309171116382,,,,0.03551802909894347,weighted,0.07841636973138665,0.5067532150606222,,,,,,,,,,,,,,,,,,,,FAIL
1,0.7156549520766773,2025-11-26 15:58:28.839316,2025-11-26 15:59:31.680355,0 days 00:01:02.841039,60.53082080079022,dart,0.8333800304661316,4.375872112626925,lossguide,22.420123713724433,0.0036905100721932025,10,8,8.663279761354557,700,forest,0.819960510663762,0.17901795866814174,0.07991585642167237,undersample,0.989309171116382,,9.0,0.9306341209673543,0.03551802909894347,weighted,0.07841636973138665,0.5067532150606222,0.4163687011907131,0.5567616463138851,0.5572139303482587,0.715281812899477,0.7156549520766773,0.819960510663762,0.17901795866814174,0.08,0.5567616463138851,0.5572139303482587,0.5567616463138851,0.5572139303482587,1.0,1.0,undersample,0.5,0.5,0.989309171116382,0.4163687011907131,COMPLETE
2,0.7156549520766773,2025-11-26 15:59:31.851207,2025-11-26 16:00:13.612112,0 days 00:00:41.760905,45.971478464161336,dart,0.48760632045902885,6.120957227224214,lossguide,0.5030416925289531,0.00011735535410272082,0,8,7.126995609048578,600,forest,0.8265541627326992,0.27796244228580386,0.043860151346232036,none,0.7850983852089398,0.7249023743090239,6.0,0.7632087704997071,0.33338335772283384,uniform,0.6035740826563435,0.7454562392827868,0.16579019197260933,0.5567616463138851,0.5572139303482587,0.715281812899477,0.7156549520766773,0.8265541627326992,0.27796244228580386,0.05,0.5567616463138851,0.5572139303482587,0.5567616463138851,0.5572139303482587,1.0,1.0,none,0.5,0.5,0.7850983852089398,0.16579019197260933,COMPLETE
3,0.6091718001368925,2025-11-26 16:00:13.773874,2025-11-26 16:00:26.556695,0 days 00:00:12.782821,0.0003772162969353184,dart,0.5749209613181613,0.9710127579306127,depthwise,10.657846106959465,0.0023115502886561076,8,4,29.038868465087933,300,forest,0.5469702553792208,0.5683518460005613,0.006414749634878436,none,0.707131497257335,1.668084541977012,7.0,0.9252536691516748,0.019593896127160337,weighted,0.2545262663187686,0.9811675720107167,0.664062172364408,0.5020352781546812,0.4834916327453641,0.6230742896268401,0.6091718001368925,0.5469702553792208,0.5683518460005613,0.0,0.5454874591580643,0.5409309670750738,0.5384615384615384,0.5266272189349113,0.7392363931762794,0.7224025974025974,none,0.490386942754356,0.48075038470212117,0.707131497257335,0.664062172364408,COMPLETE
4,0.7156549520766773,2025-11-26 16:00:26.715044,2025-11-26 16:00:45.455168,0 days 00:00:18.740124,1.1665388871103268,dart,0.788155217698076,8.289400292173632,depthwise,0.00010670207305103142,0.014773852304194575,6,4,0.114900690488732,400,forest,0.7906364363179293,0.8435618256693674,0.029743695085513368,oversample,0.8497396376587522,,10.0,0.842386056527218,0.2960209656359195,weighted,0.515026715211786,0.4160063785537319,0.5012978942881682,0.5567616463138851,0.5572139303482587,0.715281812899477,0.7156549520766773,0.7906364363179293,0.8435618256693674,0.02,0.4147251171645714,0.4106724255937141,0.5567616463138851,0.5572139303482587,1.0,1.0,oversample,0.2512686715628575,0.24032648276136528,0.8497396376587522,0.5012978942881682,COMPLETE
5,0.0,2025-11-26 16:00:45.616401,2025-11-26 16:00:46.186646,0 days 00:00:00.570245,0.5106138305628326,gbtree,0.3083792513779602,6.60173537492685,lossguide,0.0055013039835233235,0.00011775925917055318,6,9,0.80301646482701,500,,0.6837809350239483,0.4422784327390641,0.06532008198571336,oversample,0.7871626244247893,,11.0,0.9121731742554853,,,,0.5430149607566129,0.699810811869559,0.44323835368611486,0.4427860696517413,0.0,0.0,0.6837809350239483,0.4422784327390641,0.08,0.5669967609608149,0.5458008169895884,0.0,0.0,0.0,0.0,oversample,0.5185778941958588,0.49377304896329416,0.7871626244247893,0.699810811869559,COMPLETE
6,0.7156549520766773,2025-11-26 16:00:46.352650,2025-11-26 16:01:53.568211,0 days 00:01:07.215561,0.0005532480566576553,dart,0.8458551669800085,1.6249293467637482,depthwise,0.49357980912948746,0.00035711228955423056,0,12,40.21408319922197,800,tree,0.5999982624482001,0.06666961501455257,0.03599780644783639,none,0.505857042092501,0.566640996669681,6.0,0.8777941961750972,0.3487143865722818,weighted,0.408188414410262,0.8784065834577877,0.34844464708296463,0.5567616463138851,0.5572139303482587,0.715281812899477,0.7156549520766773,0.5999982624482001,0.06666961501455257,0.05,0.5567616463138851,0.5572139303482587,0.5567616463138851,0.5572139303482587,1.0,1.0,none,0.5,0.5,0.505857042092501,0.34844464708296463,COMPLETE
7,0.0,2025-11-26 16:01:53.751118,2025-11-26 16:01:54.115018,0 days 00:00:00.363900,0.4828316556556039,gbtree,0.6719279810836568,2.3789282137450862,depthwise,40.298045932583044,0.019898941052492777,4,4,5.391204002783814,200,,0.6271782408851965,0.10222624429148805,0.018619300588033617,none,0.6049218744875611,0.8440819868725569,7.0,0.7520458189453423,,,,0.6285062424199667,0.6924166190391503,0.44323835368611486,0.4427860696517413,0.0,0.0,0.6271782408851965,0.10222624429148805,0.02,0.6080750839459248,0.5990385193861401,0.0,0.0,0.0,0.0,none,0.6071009963693033,0.5913597064324847,0.6049218744875611,0.6924166190391503,COMPLETE
8,0.0,2025-11-26 16:01:54.286345,2025-11-26 16:01:54.674921,0 days 00:00:00.388576,87.50516426087297,gbtree,0.7304625624800807,5.365792111087222,depthwise,23.989862470391174,0.03258768354914551,8,3,2.296627356539994,200,,0.9363253277236976,0.29618783133407217,0.0383463894171898,undersample,0.6600085754112339,,6.0,0.8793163918693973,,,,0.37351758751877917,0.9437358238325056,0.44323835368611486,0.4427860696517413,0.0,0.0,0.9363253277236976,0.29618783133407217,0.05,0.5567616463138851,0.5572139303482587,0.0,0.0,0.0,0.0,undersample,0.5,0.5,0.6600085754112339,0.9437358238325056,COMPLETE
9,0.7156549520766773,2025-11-26 16:01:54.853539,2025-11-26 16:01:55.822602,0 days 00:00:00.969063,0.001757196998010447,gbtree,0.49933598426738046,5.1820071393066325,depthwise,0.000142552982584589,0.0008696059824411717,6,10,0.43645144139468633,1000,,0.6980298514036469,0.5588791806726581,0.011753185596203308,oversample,0.9319278029616157,,6.0,0.6641479426749275,,,,0.5397483750012051,0.4882951550359755,0.5567616463138851,0.5572139303482587,0.715281812899477,0.7156549520766773,0.6980298514036469,0.5588791806726581,0.02,0.483994927778857,0.48428768081058593,0.5567616463138851,0.5572139303482587,1.0,1.0,oversample,0.3898361212884829,0.3856456362840428,0.9319278029616157,0.4882951550359755,COMPLETE
10,0.0,2025-11-26 16:01:56.000991,2025-11-26 16:03:15.431571,0 days 00:01:19.430580,59.104190192022145,dart,0.39266302393235747,5.521924699224066,depthwise,0.32125982151191756,0.2202075523354931,10,10,0.17793742700293239,800,forest,0.9746594112078407,0.8972399342358487,0.08765052453165909,undersample,0.9887475698722235,,10.0,0.879720905573337,0.334958273295455,weighted,0.706637620820824,0.4337180214340391,0.8668022072924481,0.44323835368611486,0.4427860696517413,0.0,0.0,0.9746594112078407,0.8972399342358487,0.08,0.5567616463138851,0.5572139303482587,0.0,0.0,0.0,0.0,undersample,0.5,0.5,0.9887475698722235,0.8668022072924481,COMPLETE
11,0.7156549520766773,2025-11-26 16:03:15.592558,2025-11-26 16:04:09.135544,0 days 00:00:53.542986,0.09646020776080412,dart,0.49486768490369404,9.818293898182532,lossguide,0.07416890071863386,0.0019248919990375575,2,3,0.2782419336717048,700,tree,0.6161170710854713,0.16923887128218468,0.07740473326986388,oversample,0.9532777496105895,,10.0,0.6186995136253888,0.255659491273228,weighted,0.20188532607726534,0.7115780131189788,0.021198909452530407,0.5567616463138851,0.5572139303482587,0.715281812899477,0.7156549520766773,0.6161170710854713,0.16923887128218468,0.08,0.52621349371862,0.5258749495914962,0.5567616463138851,0.5572139303482587,1.0,1.0,oversample,0.4034014986985859,0.3956342112943237,0.9532777496105895,0.021198909452530407,COMPLETE
12,0.0,2025-11-26 16:04:09.302283,2025-11-26 16:04:09.662887,0 days 00:00:00.360604,14.564884431737521,gbtree,0.41626232419097176,4.205394666800984,depthwise,0.2209086633808476,0.03061150492100243,3,3,0.5446300872028187,200,,0.6899634779500603,0.21303586556321275,0.04561405668004797,undersample,0.6310590746198391,,5.0,0.8759909293072815,,,,0.7816354101690626,0.6930572968904876,0.44323835368611486,0.4427860696517413,0.0,0.0,0.6899634779500603,0.21303586556321275,0.05,0.5567616463138851,0.5572139303482587,0.0,0.0,0.0,0.0,undersample,0.5,0.5,0.6310590746198391,0.6930572968904876,COMPLETE
13,0.7156549520766773,2025-11-26 16:04:09.830064,2025-11-26 16:04:12.245072,0 days 00:00:02.415008,0.057429535353143005,gbtree,0.8398367076564945,3.708527992178887,lossguide,0.0015216882288724503,0.014911228491510877,3,6,0.6583634422487264,400,,0.7680887473517259,0.663253259543454,0.09594333408334252,none,0.7887714744156877,1.618031069340598,6.0,0.6971586342061181,,,,0.23568984100329127,0.39482216301615247,0.5567616463138851,0.5572139303482587,0.715281812899477,0.7156549520766773,0.7680887473517259,0.663253259543454,0.1,0.6018720072081207,0.599528940833489,0.5567616463138851,0.5572139303482587,1.0,1.0,none,0.5896197715479369,0.5960685764694957,0.7887714744156877,0.39482216301615247,COMPLETE
14,0.0,2025-11-26 16:04:12.412114,2025-11-26 16:04:13.271827,0 days 00:00:00.859713,0.024782888913965042,gbtree,0.752020016152982,4.586039617685858,depthwise,2.2131243659012685,0.004898934617751051,8,8,44.27149936432988,1000,,0.7290694136300214,0.5818857487913164,0.024002027337970955,oversample,0.8180305277235707,,8.0,0.900202925467744,,,,0.9232355143207662,0.9428369872960815,0.44323835368611486,0.4427860696517413,0.0,0.0,0.7290694136300214,0.5818857487913164,0.02,0.5761672172426334,0.5612794425453602,0.0,0.0,0.0,0.0,oversample,0.5703679603441701,0.5429485925208601,0.8180305277235707,0.9428369872960815,COMPLETE
15,0.7156549520766773,2025-11-26 16:04:13.437926,2025-11-26 16:06:10.216998,0 days 00:01:56.779072,0.03501011290536151,dart,0.8792306467428086,3.984342586196771,lossguide,0.00023783606570654232,0.00038874903014590945,3,11,7.703628251542054,1000,tree,0.5165372957377528,0.0640454580021454,0.08694885305466322,none,0.9726507667395398,2.057949487694828,5.0,0.7500785028743833,0.17835344520127144,weighted,0.014695652415337102,0.40694725351152616,0.25690216848117103,0.5567616463138851,0.5572139303482587,0.715281812899477,0.7156549520766773,0.5165372957377528,0.0640454580021454,0.08,0.36579867445687414,0.3677844908210265,0.5567616463138851,0.5572139303482587,1.0,1.0,none,0.09030363567035263,0.09607189286709206,0.9726507667395398,0.25690216848117103,COMPLETE
16,0.7156549520766773,2025-11-26 16:06:10.396959,2025-11-26 16:06:19.435901,0 days 00:00:09.038942,0.02846587724811423,dart,0.7110094058932235,9.742562128180502,lossguide,87.51248361872723,0.0002674071104278963,0,3,7.168706146781598,300,forest,0.7074284346667821,0.374491004437303,0.04240889884358493,oversample,0.7586542586011444,,12.0,0.8900299200945081,0.39161721915690656,weighted,0.2595586475983445,0.3303635408372843,0.05508716466955099,0.5567616463138851,0.5572139303482587,0.715281812899477,0.7156549520766773,0.7074284346667821,0.374491004437303,0.05,0.5567616463138851,0.5572139303482587,0.5567616463138851,0.5572139303482587,1.0,1.0,oversample,0.5,0.5,0.7586542586011444,0.05508716466955099,COMPLETE
17,0.0,2025-11-26 16:06:19.600548,2025-11-26 16:08:00.796543,0 days 00:01:41.195995,0.0031370413722230676,dart,0.9607620888443154,2.965562650640299,lossguide,89.55038565050516,0.3838815773469024,0,12,51.861495564087015,900,forest,0.6188709130078194,0.5021505117403353,0.0171853099047643,oversample,0.6189036212695194,,10.0,0.9299042598942756,0.3653545495637381,weighted,0.7935481911004557,0.2847249239057858,0.8599436173532155,0.44323835368611486,0.4427860696517413,0.0,0.0,0.6188709130078194,0.5021505117403353,0.02,0.6425362319392489,0.6157553271942866,0.0,0.0,0.0,0.0,oversample,0.6022766458329878,0.5630302090657044,0.6189036212695194,0.8599436173532155,COMPLETE
18,0.6219739292364991,2025-11-26 16:08:00.961660,2025-11-26 16:08:07.739784,0 days 00:00:06.778124,0.0008205938052847576,gbtree,0.3050314627786048,0.7086977818420837,depthwise,0.005711684218776122,0.47671486370021665,9,12,2.2670706161121985,800,,0.7033666729178741,0.5468704490227737,0.054688490166942216,oversample,0.9838973358992509,,8.0,0.6950784686621511,,,,0.5339890998368095,0.40367926467200665,0.5305291723202171,0.5409317051108096,0.6112359550561798,0.6219739292364991,0.7033666729178741,0.5468704490227737,0.05,0.5390684338618693,0.5325303280845096,0.5670604586518415,0.5746730901582932,0.6628757108042242,0.6777597402597403,oversample,0.5002872229314147,0.496962179801812,0.9838973358992509,0.40367926467200665,COMPLETE
19,0.7156549520766773,2025-11-26 16:08:07.898228,2025-11-26 16:08:25.996791,0 days 00:00:18.098563,14.924894881878382,dart,0.40291401940545823,3.3350746579127533,depthwise,35.07135938710523,0.008746814557090189,3,6,17.856036655235922,400,forest,0.5039420517542201,0.3854111628388959,0.08792347630313271,none,0.8381212411387314,2.566296509826986,12.0,0.7856880250969736,0.37004876280884125,weighted,0.6124630330285433,0.23895223678042285,0.0977046541322421,0.5567616463138851,0.5572139303482587,0.715281812899477,0.7156549520766773,0.5039420517542201,0.3854111628388959,0.08,0.4449901501484325,0.45051593786567046,0.5567616463138851,0.5572139303482587,1.0,1.0,none,0.2973130356935625,0.3041704528872558,0.8381212411387314,0.0977046541322421,COMPLETE
20,0.7156549520766773,2025-11-26 16:08:26.164501,2025-11-26 16:08:29.303202,0 days 00:00:03.138701,1.4846361646055142,gbtree,0.959088816576406,1.1570323332709365,lossguide,0.290296275667789,0.0010771197016602304,6,9,0.4258433297085861,500,,0.7549035983107921,0.3505683826371282,0.09627703198402425,oversample,0.7943698049851441,,5.0,0.8767940571295917,,,,0.7375657124766579,0.44319492497532675,0.5567616463138851,0.5572139303482587,0.715281812899477,0.7156549520766773,0.7549035983107921,0.3505683826371282,0.1,0.5981333381836718,0.581825030986848,0.5567616463138851,0.5572139303482587,1.0,1.0,oversample,0.5303072000530513,0.5158975664274439,0.7943698049851441,0.44319492497532675,COMPLETE
21,0.7156549520766773,2025-11-26 16:08:29.468464,2025-11-26 16:08:34.435424,0 days 00:00:04.966960,0.0006320753089450743,dart,0.8974285878043944,8.869607812174175,lossguide,0.5163652520537522,0.0032937692680663276,5,5,7.411122963983674,200,forest,0.7231972077416015,0.8670880349188934,0.09521426972954208,oversample,0.6945673385505928,,10.0,0.6560806632120502,0.46165303394458157,uniform,0.7469076317430089,0.984464106229826,0.441458477772902,0.5567616463138851,0.5572139303482587,0.715281812899477,0.7156549520766773,0.7231972077416015,0.8670880349188934,0.1,0.5567616463138851,0.5572139303482587,0.5567616463138851,0.5572139303482587,1.0,1.0,oversample,0.5,0.5,0.6945673385505928,0.441458477772902,COMPLETE
22,0.7156549520766773,2025-11-26 16:08:34.597999,2025-11-26 16:08:52.720259,0 days 00:00:18.122260,24.45536467150049,dart,0.6231519432247066,9.077329574850395,lossguide,2.7498151918585525,0.0001666219301967132,3,3,0.15248797993516156,400,forest,0.6839637902685207,0.4608679021363898,0.0607249374011541,none,0.5316038091693154,1.634868204636672,12.0,0.7181170836174839,0.23532447460695477,uniform,0.3404206574311156,0.7380658490372172,0.14077064311069196,0.5567616463138851,0.5572139303482587,0.715281812899477,0.7156549520766773,0.6839637902685207,0.4608679021363898,0.05,0.5567616463138851,0.5572139303482587,0.5567616463138851,0.5572139303482587,1.0,1.0,none,0.5,0.5,0.5316038091693154,0.14077064311069196,COMPLETE
23,0.7156549520766773,2025-11-26 16:08:52.891535,2025-11-26 16:09:49.304440,0 days 00:00:56.412905,0.6691079148860227,dart,0.9809805307630561,3.518929961930426,depthwise,2.1302962739729616,0.002947411622896571,7,9,99.50249753387712,700,forest,0.8726990369736465,0.8133353423122863,0.0958740923056593,oversample,0.8865417770274358,,12.0,0.9275412280758759,0.1677490848379498,weighted,0.13291702038603662,0.8504430905979685,0.40180565838003535,0.5567616463138851,0.5572139303482587,0.715281812899477,0.7156549520766773,0.8726990369736465,0.8133353423122863,0.1,0.4700644169186215,0.46302409528487926,0.5567616463138851,0.5572139303482587,1.0,1.0,oversample,0.39430030338699246,0.38331628152235914,0.8865417770274358,0.40180565838003535,COMPLETE
24,0.6879141685074156,2025-11-26 16:09:49.472171,2025-11-26 16:09:52.748366,0 days 00:00:03.276195,0.0028141175863917577,gbtree,0.8876646691356973,4.977769078253418,lossguide,0.306543123309618,0.1544342715511099,1,9,0.19578255163153227,800,,0.635626038380932,0.413413466600601,0.09799623263423093,undersample,0.7285293806656836,,10.0,0.7399342490032658,,,,0.33522032490332904,0.34782376482799754,0.5540479421076436,0.5526910900045229,0.6897419760855884,0.6879141685074156,0.635626038380932,0.413413466600601,0.1,0.5819067324456411,0.5510473062681065,0.5629173086800205,0.5627258647392875,0.8903330625507717,0.8847402597402597,undersample,0.5495934116944909,0.5075870886008782,0.7285293806656836,0.34782376482799754,COMPLETE
25,0.7156549520766773,2025-11-26 16:09:52.914203,2025-11-26 16:09:53.476384,0 days 00:00:00.562181,2.280629756653519,gbtree,0.2883816887933958,8.224067383556903,lossguide,0.8327736338593846,0.01875510623299546,3,7,0.1622282825269533,500,,0.8173931614668474,0.9132280267801774,0.07372542425964773,oversample,0.5149751624523746,,11.0,0.6361543542797985,,,,0.6295384008659124,0.03860643015193499,0.5567616463138851,0.5572139303482587,0.715281812899477,0.7156549520766773,0.8173931614668474,0.9132280267801774,0.08,0.5643193211442495,0.5422400248344046,0.5567616463138851,0.5572139303482587,1.0,1.0,oversample,0.40844800145891014,0.37427287982701674,0.5149751624523746,0.03860643015193499,COMPLETE
26,0.7156549520766773,2025-11-26 16:09:53.659894,2025-11-26 16:09:54.307685,0 days 00:00:00.647791,0.01734985040210936,gbtree,0.2644256027774753,5.181498137911743,lossguide,11.393605448518128,0.0005068755025947707,1,6,0.11412182084972848,600,,0.779841202911724,0.7461099900041275,0.006614946211695472,undersample,0.632519849182241,,6.0,0.7597433478686733,,,,0.3782910544119842,0.20560421927771205,0.5567616463138851,0.5572139303482587,0.715281812899477,0.7156549520766773,0.779841202911724,0.7461099900041275,0.0,0.5544045618802877,0.5656999910664035,0.5567616463138851,0.5572139303482587,1.0,1.0,undersample,0.5231034168338334,0.5166582651260894,0.632519849182241,0.20560421927771205,COMPLETE
27,0.7156549520766773,2025-11-26 16:09:54.480978,2025-11-26 16:10:23.929061,0 days 00:00:29.448083,0.02266797530151996,dart,0.7526278209252237,0.2895254902696054,depthwise,23.667247218110433,0.05998001247170296,4,10,60.48329215213328,500,forest,0.9853657213853164,0.05347431635923499,0.052437981107722,undersample,0.6386701356526218,,9.0,0.6625029888201797,0.25053158641737605,uniform,0.33875023967491613,0.9026979963039954,0.08974220687623918,0.5567616463138851,0.5572139303482587,0.715281812899477,0.7156549520766773,0.9853657213853164,0.05347431635923499,0.05,0.5567616463138851,0.5572139303482587,0.5567616463138851,0.5572139303482587,1.0,1.0,undersample,0.5,0.5,0.6386701356526218,0.08974220687623918,COMPLETE
28,0.0,2025-11-26 16:10:24.102637,2025-11-26 16:10:25.014138,0 days 00:00:00.911501,0.004010903296253375,gbtree,0.4975349988099691,9.308187172979732,lossguide,0.1332197527993949,0.0012917670818204754,3,8,4.451452242358954,1000,,0.9725133884701957,0.9427012962391664,0.0458503167066445,oversample,0.929388734115951,,12.0,0.7318594434363453,,,,0.9019190313392957,0.7860419782382833,0.44323835368611486,0.4427860696517413,0.0,0.0,0.9725133884701957,0.9427012962391664,0.05,0.52621349371862,0.5258749495914962,0.0,0.0,0.0,0.0,oversample,0.4034014986985859,0.3956342112943237,0.929388734115951,0.7860419782382833,COMPLETE
