number,value,datetime_start,datetime_complete,duration,params_alpha,params_booster,params_colsample_bytree,params_gamma,params_grow_policy,params_lambda,params_learning_rate,params_max_delta_step,params_max_depth,params_min_child_weight,params_n_estimators,params_normalize_type,params_params_feature_fraction,params_params_labeled_ratio,params_params_missing_rate,params_params_resampling,params_params_sample_rows,params_params_scale_pos_weight,params_params_selftrain_max_iter,params_params_selftrain_threshold,params_rate_drop,params_sample_type,params_skip_drop,params_subsample,params_user_attrs_decision_threshold,user_attrs_acc_test,user_attrs_acc_val,user_attrs_f1_test,user_attrs_f1_val,user_attrs_feature_fraction,user_attrs_labeled_ratio,user_attrs_missing_rate,user_attrs_pr_auc_test,user_attrs_pr_auc_val,user_attrs_prec_test,user_attrs_prec_val,user_attrs_rec_test,user_attrs_rec_val,user_attrs_resampling_strategy,user_attrs_roc_auc_test,user_attrs_roc_auc_val,user_attrs_sample_rows,user_attrs_user_attrs_decision_threshold,state
1471,0.5420077552778975,2025-11-27 05:08:23.331814,2025-11-27 05:09:10.191761,0 days 00:00:46.859947,4.267678754053845,dart,0.8052871472452079,2.1354531078636434,lossguide,0.000991336768876,0.2686364418408729,0,4,0.17236665250765468,600,forest,0.8596385233147356,0.5988639785055577,0.03300054464983111,oversample,0.687303192808052,,8.0,0.7509339402108253,0.17251162872072429,weighted,0.7937115119584481,0.26376841195969686,0.5546360310091716,0.5097241067390321,0.5192220714608774,0.5343642611683849,0.5420077552778975,0.8596385233147356,0.5988639785055577,0.02,0.5643879782126489,0.5712261768169528,0.5670009115770283,0.5775941230486685,0.5052802599512591,0.510551948051948,oversample,0.5078926208988875,0.5149979935794542,0.687303192808052,0.5546360310091716,COMPLETE
1472,0.7166180758017493,2025-11-27 05:09:10.376989,2025-11-27 05:13:43.877443,0 days 00:04:33.500454,0.005844188344887854,dart,0.8131273980446122,2.4564665071120624,lossguide,0.011501919825461403,0.0043048654495684196,1,5,0.478583541887055,700,forest,0.7781875287379063,0.7195811538594036,0.018837668411101467,none,0.8448812394321991,1.5960125705706476,12.0,0.6637624945951252,0.051631311930979557,weighted,0.7759971571232726,0.28722425175351307,0.6568332028410184,0.5617367706919946,0.5603799185888738,0.7175750510055378,0.7166180758017493,0.7781875287379063,0.7195811538594036,0.02,0.5828662186033857,0.578059097307139,0.5595454545454546,0.5591446769790719,1.0,0.997564935064935,none,0.5478485220245694,0.5484832455593436,0.8448812394321991,0.6568332028410184,COMPLETE
1473,0.7156549520766773,2025-11-27 05:13:44.059920,2025-11-27 05:14:50.121509,0 days 00:01:06.061589,0.0015929019252976827,dart,0.7792858168921079,5.623270822706008,lossguide,0.02363714100078226,0.00308455263528532,0,6,0.10994628358417963,700,forest,0.6450128039232336,0.4714970268103262,0.005154779370705537,none,0.8243384333425005,1.570449031062732,9.0,0.7370332743028574,0.016440203116845263,weighted,0.8397572800152714,0.3107857191685086,0.4043678565159216,0.5567616463138851,0.5572139303482587,0.715281812899477,0.7156549520766773,0.6450128039232336,0.4714970268103262,0.0,0.5903562419697006,0.5757749881075411,0.5567616463138851,0.5572139303482587,1.0,1.0,none,0.5377422536845771,0.5225154378308106,0.8243384333425005,0.4043678565159216,COMPLETE
1474,0.7156549520766773,2025-11-27 05:14:50.306146,2025-11-27 05:17:10.884416,0 days 00:02:20.578270,0.004025602659798314,dart,0.915400303722022,0.182014914418561,lossguide,0.05049261878686142,0.0004852681251988011,5,7,0.27587656060109395,600,forest,0.901691920084094,0.5314797186354506,0.006078179582764716,none,0.94466749497246,1.5218687727987623,12.0,0.6677412426954129,0.014275049109045694,weighted,0.6324757032877433,0.3489597750568427,0.4133760865243955,0.5567616463138851,0.5572139303482587,0.715281812899477,0.7156549520766773,0.901691920084094,0.5314797186354506,0.0,0.6172102426772849,0.6142865588214566,0.5567616463138851,0.5572139303482587,1.0,1.0,none,0.5863135993633847,0.5846303211599433,0.94466749497246,0.4133760865243955,COMPLETE
1475,0.03366488140780413,2025-11-27 05:17:11.070729,2025-11-27 05:18:37.681545,0 days 00:01:26.610816,0.0005767614782381109,dart,0.7670002411229974,1.4957123224321722,lossguide,0.038815176439891186,0.0014825864676900325,2,3,0.9544958750959524,800,forest,0.6979874246774938,0.8529574306409189,0.03256273486421725,none,0.9704409870245596,1.3286174759592129,12.0,0.703277517150492,0.03650251766246267,weighted,0.7766833885733987,0.20442611727385934,0.6518115150617836,0.43826322930800543,0.4287652645861601,0.053353658536585365,0.03366488140780413,0.6979874246774938,0.8529574306409189,0.02,0.5351991560670302,0.5287557664732949,0.43209876543209874,0.29333333333333333,0.02843216896831844,0.017857142857142856,none,0.48494960128649345,0.4819111238608174,0.9704409870245596,0.6518115150617836,COMPLETE
1476,0.6478184991273996,2025-11-27 05:18:37.862194,2025-11-27 05:26:27.764264,0 days 00:07:49.902070,0.0008330353475528524,dart,0.9427721348756166,0.49918833714190725,lossguide,0.11759818115395168,0.028048341847764186,1,8,0.8817048567650009,700,forest,0.7348026832982401,0.8704638170437997,0.00140293517889898,none,0.8728629490525028,1.7742192818569322,11.0,0.7309019064878588,0.07481382833471613,weighted,0.85800508355858,0.35265984685250373,0.5530147391844301,0.5246494798733605,0.5436454093170511,0.6318739054290718,0.6478184991273996,0.7348026832982401,0.8704638170437997,0.0,0.547870350570778,0.549324130042875,0.5554187192118226,0.5682792406613595,0.7327376116978067,0.7532467532467533,none,0.49358203882690366,0.4968291093482615,0.8728629490525028,0.5530147391844301,COMPLETE
1477,0.0,2025-11-27 05:26:27.957119,2025-11-27 05:26:28.841787,0 days 00:00:00.884668,0.008500316514679843,gbtree,0.6609332030388997,5.034508307672267,lossguide,0.00045927532643471475,0.0006137107142941009,0,6,1.2153884701604336,500,,0.6630117107385012,0.6250548955739966,0.03284644481615522,none,0.7056070972861994,1.2314862316109088,12.0,0.6896666454912196,,,,0.36041724669559994,0.6780467066592606,0.44323835368611486,0.4427860696517413,0.0,0.0,0.6630117107385012,0.6250548955739966,0.02,0.4979322338665097,0.49191902901867207,0.0,0.0,0.0,0.0,none,0.42168015053299956,0.4166726085456934,0.7056070972861994,0.6780467066592606,COMPLETE
1478,0.714868804664723,2025-11-27 05:26:29.038783,2025-11-27 05:26:29.702549,0 days 00:00:00.663766,0.169377507260685,gbtree,0.5528763806231947,4.537540935900184,depthwise,0.14223512468075167,0.16199372431363143,9,5,4.20496258584031,300,,0.8390325765381907,0.8986195122394259,0.06507916623013879,oversample,0.5042733542477345,,10.0,0.7840404610885314,,,,0.525557804216726,0.3787781469801713,0.5545002261420172,0.5576662143826323,0.7130789397028838,0.714868804664723,0.8390325765381907,0.8986195122394259,0.08,0.5214188697259334,0.5326303470179894,0.555858310626703,0.5577797998180164,0.9943135662063363,0.9951298701298701,oversample,0.4823078134584459,0.4988691084196702,0.5042733542477345,0.3787781469801713,COMPLETE
1479,0.5789687373122209,2025-11-27 05:26:29.896408,2025-11-27 05:40:25.116660,0 days 00:13:55.220252,0.0765903664756751,dart,0.672223585194442,1.8495008680004041,depthwise,1.092396797353534,0.04240322390979369,4,9,0.1226341224796443,1000,forest,0.9920170879001947,0.6498787163565891,0.0592115017405534,oversample,0.5681426938442681,,11.0,0.6425080545931972,0.028053974515618984,weighted,0.7903562494064754,0.24367909514646774,0.5458588339523519,0.5201266395296246,0.5309814563545907,0.5664078463424601,0.5789687373122209,0.9920170879001947,0.6498787163565891,0.05,0.5630774504672839,0.5652280929305935,0.5699013157894737,0.579203899268887,0.5629569455727051,0.5787337662337663,oversample,0.5137402808401996,0.5251888688431079,0.5681426938442681,0.5458588339523519,COMPLETE
1480,0.0,2025-11-27 05:40:25.296781,2025-11-27 05:41:20.805107,0 days 00:00:55.508326,0.13027923913328998,dart,0.9783331624786704,3.097821440196476,lossguide,1.1210041493068468,0.01732352123504689,0,5,1.8038548620798396,400,forest,0.85514542259256,0.695785372891785,0.016620173814397707,none,0.7929976325852095,1.7985969745574586,7.0,0.600587686636567,0.059796347273878225,weighted,0.6583278527773943,0.25625143378881454,0.882303928085374,0.44323835368611486,0.4427860696517413,0.0,0.0,0.85514542259256,0.695785372891785,0.02,0.5217970858925711,0.4969659655812667,0.0,0.0,0.0,0.0,none,0.46867570748851933,0.4328309267341443,0.7929976325852095,0.882303928085374,COMPLETE
1481,0.017488076311605722,2025-11-27 05:41:20.987983,2025-11-27 05:50:39.172924,0 days 00:09:18.184941,0.008321860608512094,dart,0.8296980652901723,3.555160378807483,lossguide,0.044327479834521184,0.008104285125196698,0,4,1.3918180927569292,800,tree,0.7618611632693819,0.8303822726230388,0.014852491726481142,none,0.7567961459263629,1.2447193686294666,12.0,0.6691782011329883,0.043334654347357005,weighted,0.806901556484706,0.38849181961600604,0.7217728144205938,0.44323835368611486,0.44097693351424694,0.022239872915011914,0.017488076311605722,0.7618611632693819,0.8303822726230388,0.02,0.5281011953891592,0.5220096094344193,0.5,0.4230769230769231,0.011372867587327376,0.008928571428571428,none,0.4525688423216565,0.4533308239258188,0.7567961459263629,0.7217728144205938,COMPLETE
1482,0.0,2025-11-27 05:50:39.359445,2025-11-27 05:52:07.380062,0 days 00:01:28.020617,0.0002432235335140593,dart,0.9668852300123227,1.1985158480930933,lossguide,0.15883238263336852,0.0016003888782666982,1,5,0.2129052289022676,800,forest,0.7627060774524846,0.7471533320556752,0.008368769731103396,undersample,0.9190282555109819,,12.0,0.6619556267478706,0.08199136064898782,weighted,0.7318718373294094,0.6613180915874969,0.7076041337699823,0.44323835368611486,0.4427860696517413,0.0,0.0,0.7627060774524846,0.7471533320556752,0.0,0.5895947308970133,0.5815933285103945,0.0,0.0,0.0,0.0,undersample,0.5541396574876905,0.5596159777403393,0.9190282555109819,0.7076041337699823,COMPLETE
1483,0.0,2025-11-27 05:52:07.562841,2025-11-27 05:52:08.548899,0 days 00:00:00.986058,61.0868312409613,gbtree,0.2728092694442449,0.1683298795390007,depthwise,0.00041653470620870705,0.1319239205541134,8,12,0.1276898892871388,800,,0.7998508732173315,0.7022282999734226,0.01179460155547683,oversample,0.96236986754073,,7.0,0.6773115663579602,,,,0.90939499659242,0.8460931996137951,0.44323835368611486,0.4427860696517413,0.0,0.0,0.7998508732173315,0.7022282999734226,0.02,0.5567616463138851,0.5572139303482587,0.0,0.0,0.0,0.0,oversample,0.5,0.5,0.96236986754073,0.8460931996137951,COMPLETE
1484,0.45614035087719296,2025-11-27 05:52:08.725802,2025-11-27 05:54:59.207779,0 days 00:02:50.481977,0.005145697904906761,dart,0.5370142607604325,2.319951601230416,lossguide,2.169846414429494,0.14602851409440312,2,5,0.22565940862647296,500,forest,0.8118136794257957,0.6153090225453399,0.05423679212680131,undersample,0.6609981819912842,,9.0,0.6176524203072759,0.0967947445552054,weighted,0.8985067251629398,0.208698369651888,0.5377999327223894,0.48846675712347354,0.46720940750791495,0.48567530695770805,0.45614035087719296,0.8118136794257957,0.6153090225453399,0.05,0.5549769008209379,0.5377382012102018,0.5516528925619835,0.5289079229122056,0.4337936636880585,0.400974025974026,undersample,0.49429284305111154,0.4809282265232214,0.6609981819912842,0.5377999327223894,COMPLETE
1485,0.7156549520766773,2025-11-27 05:54:59.392378,2025-11-27 05:55:01.913732,0 days 00:00:02.521354,0.0018384301316830146,gbtree,0.8673152743048199,1.2098048990726489,depthwise,0.035056705335541574,0.0006766815443546624,3,6,2.090343800059423,1000,,0.7945585468367453,0.5407772397860542,0.004737634825082177,none,0.8918062876779594,1.604751437187935,12.0,0.759277391571176,,,,0.2590614856208874,0.5410603159921537,0.5567616463138851,0.5572139303482587,0.715281812899477,0.7156549520766773,0.7945585468367453,0.5407772397860542,0.0,0.5438182900178596,0.5587565708421494,0.5567616463138851,0.5572139303482587,1.0,1.0,none,0.5168591157015202,0.5343889703248743,0.8918062876779594,0.5410603159921537,COMPLETE
1486,0.0,2025-11-27 05:55:02.093463,2025-11-27 05:55:15.676079,0 days 00:00:13.582616,0.16385552586745236,dart,0.9656172070227499,1.683588834666693,lossguide,0.0020482392653274942,0.0017985514765794005,1,5,0.45981369417969786,300,forest,0.6341588956082,0.6035673051299488,0.030272278844513036,none,0.8999020094217339,1.1249942314988761,12.0,0.6569061487497692,0.034156503033521246,uniform,0.7064093489254109,0.2866633233686044,0.8852033885504066,0.44323835368611486,0.4427860696517413,0.0,0.0,0.6341588956082,0.6035673051299488,0.02,0.589164078012077,0.5815628705019612,0.0,0.0,0.0,0.0,none,0.5794973391468692,0.5722833729090113,0.8999020094217339,0.8852033885504066,COMPLETE
1487,0.0032232070910556,2025-11-27 05:55:15.861253,2025-11-27 05:55:17.128984,0 days 00:00:01.267731,0.7447441371192194,gbtree,0.5149097752473264,3.1134945683834148,lossguide,0.6028371627174214,0.01157048258443815,6,9,1.731549516833002,900,,0.7187759600479893,0.8661914903966091,0.06774783880112609,oversample,0.7349742147772634,,9.0,0.704419761093155,,,,0.3954608610934326,0.6725311523495576,0.44097693351424694,0.44052464947987335,0.0016155088852988692,0.0032232070910556,0.7187759600479893,0.8661914903966091,0.08,0.525386543382935,0.5341150064755179,0.14285714285714285,0.2222222222222222,0.0008123476848090983,0.0016233766233766235,oversample,0.4903973043319684,0.504746179509969,0.7349742147772634,0.6725311523495576,COMPLETE
1488,0.7156549520766773,2025-11-27 05:55:17.307960,2025-11-27 05:58:19.753196,0 days 00:03:02.445236,0.0024997892819799855,dart,0.5591552823375909,2.6280472888101607,lossguide,0.0002736374856614051,0.002888369394956092,1,7,0.3970679759124302,800,forest,0.7942787170156598,0.6317505390361151,0.016070150999074564,none,0.7939786806771993,2.0679852394406306,12.0,0.6837763814043437,0.001927455435727407,weighted,0.6530369318418942,0.2951723756280837,0.6297351042334656,0.5567616463138851,0.5572139303482587,0.715281812899477,0.7156549520766773,0.7942787170156598,0.6317505390361151,0.02,0.5675624832867636,0.5511666473063764,0.5567616463138851,0.5572139303482587,1.0,1.0,none,0.5261613256187934,0.5114299643155619,0.7939786806771993,0.6297351042334656,COMPLETE
1489,0.7156549520766773,2025-11-27 05:58:19.936006,2025-11-27 05:58:49.408741,0 days 00:00:29.472735,0.061767924901509584,gbtree,0.8194749352640747,1.7071678054905892,lossguide,0.5472536726513887,0.0017928488145560971,3,8,1.4744428215267935,900,,0.7336713554376378,0.8050845989921991,0.03232459494118982,none,0.7642174190216852,1.4118814237081667,11.0,0.6214389597541645,,,,0.5095116965815643,0.44140451507115425,0.5567616463138851,0.5572139303482587,0.715281812899477,0.7156549520766773,0.7336713554376378,0.8050845989921991,0.02,0.5605241539370915,0.5570149937690592,0.5567616463138851,0.5572139303482587,1.0,1.0,none,0.5347506589963361,0.5296303543239191,0.7642174190216852,0.44140451507115425,COMPLETE
1490,0.0,2025-11-27 05:58:49.586670,2025-11-27 05:58:50.243914,0 days 00:00:00.657244,0.000872984666068367,gbtree,0.5668182543561263,6.634770462357011,lossguide,52.45859496204178,0.3917747155480449,8,6,50.89784187189825,300,,0.9470070288003631,0.8513600197149503,0.013103507415961231,oversample,0.6352289511472763,,12.0,0.6665300876990455,,,,0.438041995497633,0.7480423295328545,0.44323835368611486,0.4427860696517413,0.0,0.0,0.9470070288003631,0.8513600197149503,0.02,0.539456274176385,0.5090000452074843,0.0,0.0,0.0,0.0,oversample,0.4280114889172566,0.39386657137550907,0.6352289511472763,0.7480423295328545,COMPLETE
1491,0.012789768185451638,2025-11-27 05:58:50.422257,2025-11-27 06:09:08.568190,0 days 00:10:18.145933,0.46999225922138116,dart,0.6738956006125536,1.1796492628048267,lossguide,13.923631986435506,0.0671891575725914,5,8,0.28148699350415185,900,forest,0.9680059239650217,0.7592531161354394,0.06735996165198092,undersample,0.7491686157840824,,10.0,0.6936540631364226,0.0016501532950233336,weighted,0.7879019410576891,0.21666486208817862,0.8147500091879469,0.4418815015829941,0.4414292175486205,0.004838709677419355,0.012789768185451638,0.9680059239650217,0.7592531161354394,0.08,0.579563664721036,0.5810483133590083,0.3333333333333333,0.42105263157894735,0.002437043054427295,0.006493506493506494,undersample,0.5502876373945191,0.5577940318108858,0.7491686157840824,0.8147500091879469,COMPLETE
1492,0.7156549520766773,2025-11-27 06:09:08.750860,2025-11-27 06:09:09.484188,0 days 00:00:00.733328,0.8206772429760655,gbtree,0.785473959837174,6.0334392009223565,lossguide,24.3981904806154,0.20900886453790066,9,8,20.389568152730607,400,,0.999343567416785,0.7359261739388038,0.01765358655679638,oversample,0.5174625394042539,,10.0,0.6968426241941361,,,,0.4384867445362385,0.42650043953777456,0.5567616463138851,0.5572139303482587,0.715281812899477,0.7156549520766773,0.999343567416785,0.7359261739388038,0.02,0.5873900107654132,0.5907016592787293,0.5567616463138851,0.5572139303482587,1.0,1.0,oversample,0.5384650773388153,0.5348089091705026,0.5174625394042539,0.42650043953777456,COMPLETE
1493,0.7035294117647058,2025-11-27 06:09:09.662525,2025-11-27 06:09:57.518672,0 days 00:00:47.856147,0.8698360916892345,dart,0.5029973405333241,2.116244168105559,depthwise,12.49522818984207,0.06957887857884713,9,4,5.914052014288915,600,forest,0.7609668752365938,0.6368856230959887,0.007770641166583152,oversample,0.5478972545511454,,9.0,0.7260829600683594,0.09864053090334542,weighted,0.7398756194252631,0.20066493294640067,0.4499963438775483,0.5454545454545454,0.5440976933514247,0.70415072122461,0.7035294117647058,0.7609668752365938,0.6368856230959887,0.0,0.4528560505493786,0.439197694258047,0.5521698984302862,0.551660516605166,0.9715678310316815,0.9707792207792207,oversample,0.36646413236293707,0.3303513391613494,0.5478972545511454,0.4499963438775483,COMPLETE
1494,0.0,2025-11-27 06:09:57.713884,2025-11-27 06:09:58.805318,0 days 00:00:01.091434,7.380975034130438,gbtree,0.9815019902332248,0.4956787740535973,depthwise,3.5322581259358037,0.21253716965325886,9,5,52.06088302908174,800,,0.7785720756219515,0.6543565727040869,0.005401736018288078,undersample,0.5264331032948507,,5.0,0.7141357628457756,,,,0.26987769751479457,0.6854010273898417,0.44323835368611486,0.4427860696517413,0.0,0.0,0.7785720756219515,0.6543565727040869,0.0,0.6332273012314211,0.6163911642146207,0.0,0.0,0.0,0.0,undersample,0.6000223810076427,0.5656501631667616,0.5264331032948507,0.6854010273898417,COMPLETE
1495,0.14744027303754267,2025-11-27 06:09:58.989396,2025-11-27 06:11:24.679771,0 days 00:01:25.690375,0.09182691867864388,dart,0.9172948033552352,0.2670568445106869,lossguide,0.09222506079376848,0.06831231779727154,9,5,33.20007407074263,800,forest,0.858546493363961,0.5871703757335716,0.03607750383588981,oversample,0.5171024977924383,,6.0,0.7949749321726076,0.16402344858570375,weighted,0.8949569675836061,0.3206313179492039,0.6248821313421447,0.43509724106739034,0.43509724106739034,0.1439342015078821,0.14744027303754267,0.858546493363961,0.5871703757335716,0.05,0.5512384878633362,0.5475312326747022,0.4605263157894737,0.463519313304721,0.08529650690495533,0.08766233766233766,oversample,0.5082967224257696,0.5092490183463114,0.5171024977924383,0.6248821313421447,COMPLETE
1496,0.0,2025-11-27 06:11:24.864639,2025-11-27 06:13:10.211904,0 days 00:01:45.347265,0.49396727864783246,dart,0.6111532050263498,2.729791637881883,lossguide,57.57785386255474,0.001369027663818871,6,6,0.39232898027035895,900,forest,0.8623065076845787,0.43701600131086527,0.07467409976217229,oversample,0.7413296760680481,,10.0,0.647888841330688,0.10167779361794278,weighted,0.7287200663362774,0.2498532446964526,0.6747248657143718,0.44323835368611486,0.4427860696517413,0.0,0.0,0.8623065076845787,0.43701600131086527,0.08,0.5110158185536471,0.47219342784936535,0.0,0.0,0.0,0.0,oversample,0.4375225882391949,0.3734242965920698,0.7413296760680481,0.6747248657143718,COMPLETE
1497,0.7156549520766773,2025-11-27 06:13:10.395196,2025-11-27 06:13:11.180094,0 days 00:00:00.784898,0.1700399225301738,gbtree,0.7120491326602981,3.572438806806976,lossguide,44.98523974861662,0.0019924442014509843,10,6,40.99859120900658,400,,0.762724537907838,0.8864324599425423,0.00010964881876606054,oversample,0.5182399290100678,,9.0,0.6630760404089013,,,,0.6041453667049435,0.2971268967555905,0.5567616463138851,0.5572139303482587,0.715281812899477,0.7156549520766773,0.762724537907838,0.8864324599425423,0.0,0.42604082395404597,0.4196623882955688,0.5567616463138851,0.5572139303482587,1.0,1.0,oversample,0.2878156136540725,0.2742163352480002,0.5182399290100678,0.2971268967555905,COMPLETE
1498,0.0,2025-11-27 06:13:11.378934,2025-11-27 06:13:58.855992,0 days 00:00:47.477058,1.3567000307885582,dart,0.8653771899212179,3.883419823373326,depthwise,3.3067350390597565,0.04162648998833219,8,11,7.570618977925281,600,forest,0.7053788097404222,0.4567039240305446,0.06998382601373146,oversample,0.6575545743588862,,6.0,0.6896142429930238,0.06946496676021044,weighted,0.7574147758150076,0.6923174040172643,0.7313012119638849,0.44323835368611486,0.4427860696517413,0.0,0.0,0.7053788097404222,0.4567039240305446,0.08,0.6245594416934538,0.6519184314660099,0.0,0.0,0.0,0.0,oversample,0.5605646645335632,0.5761958929732168,0.6575545743588862,0.7313012119638849,COMPLETE
1499,0.0,2025-11-27 06:13:59.049539,2025-11-27 06:14:46.460406,0 days 00:00:47.410867,0.12868855940832374,dart,0.7990029519029762,5.290061032916515,lossguide,0.10329120839084821,0.012776924730024071,3,3,4.42589560062574,600,forest,0.7920159410212467,0.7406965476460252,0.06705872734786919,none,0.7799569116131471,1.0515817074063103,7.0,0.6671819566920814,0.028236735219590192,weighted,0.4636419361671903,0.4302994619923227,0.6903574147758723,0.44323835368611486,0.4427860696517413,0.0,0.0,0.7920159410212467,0.7406965476460252,0.08,0.48862179293459906,0.48245923193212853,0.0,0.0,0.0,0.0,none,0.4232169797244649,0.41749424605017044,0.7799569116131471,0.6903574147758723,COMPLETE
