number,value,datetime_start,datetime_complete,duration,params_alpha,params_booster,params_colsample_bytree,params_gamma,params_grow_policy,params_lambda,params_learning_rate,params_max_delta_step,params_max_depth,params_min_child_weight,params_n_estimators,params_normalize_type,params_params_feature_fraction,params_params_labeled_ratio,params_params_missing_rate,params_params_resampling,params_params_sample_rows,params_params_scale_pos_weight,params_params_selftrain_max_iter,params_params_selftrain_threshold,params_rate_drop,params_sample_type,params_skip_drop,params_subsample,params_user_attrs_decision_threshold,user_attrs_acc_test,user_attrs_acc_val,user_attrs_f1_test,user_attrs_f1_val,user_attrs_feature_fraction,user_attrs_labeled_ratio,user_attrs_missing_rate,user_attrs_pr_auc_test,user_attrs_pr_auc_val,user_attrs_prec_test,user_attrs_prec_val,user_attrs_rec_test,user_attrs_rec_val,user_attrs_resampling_strategy,user_attrs_roc_auc_test,user_attrs_roc_auc_val,user_attrs_sample_rows,user_attrs_user_attrs_decision_threshold,state
551,0.7105882352941176,2025-11-26 19:55:06.918221,2025-11-26 19:55:17.132343,0 days 00:00:10.214122,0.00017315597141284549,gbtree,0.2526181532623428,1.2647703141166806,lossguide,0.00012288263130033622,0.0011241493675892761,4,10,0.45547833778188046,800,,0.7458617106968076,0.3705829927858576,0.016645122425059576,oversample,0.7029328146227538,,9.0,0.6050057488075054,,,,0.6650055438662823,0.8240517601437711,0.5531433740388965,0.5549525101763908,0.7083825265643447,0.7105882352941176,0.7458617106968076,0.3705829927858576,0.02,0.6492343345103597,0.6257974169520943,0.5563282336578581,0.5571955719557196,0.974817221770918,0.9805194805194806,oversample,0.6477179661466536,0.6298539624318481,0.7029328146227538,0.8240517601437711,COMPLETE
552,0.7156549520766773,2025-11-26 19:55:17.307389,2025-11-26 19:55:18.009668,0 days 00:00:00.702279,0.0001223603153792752,gbtree,0.5471485929877645,5.923415764142897,lossguide,0.0814078892215565,0.009329272086667844,5,12,0.5018848457330236,500,,0.9743752433987514,0.675427273499571,0.07039046806352814,undersample,0.7301160074130826,,12.0,0.7562527595095974,,,,0.5716373217844899,0.06554672210778942,0.5567616463138851,0.5572139303482587,0.715281812899477,0.7156549520766773,0.9743752433987514,0.675427273499571,0.08,0.4569225931113744,0.45292955615130115,0.5567616463138851,0.5572139303482587,1.0,1.0,undersample,0.35029717004592253,0.34532777615642785,0.7301160074130826,0.06554672210778942,COMPLETE
553,0.7156549520766773,2025-11-26 19:55:18.184288,2025-11-26 19:55:19.290620,0 days 00:00:01.106332,0.9689185142814664,gbtree,0.8219770140550623,1.6397508066214912,lossguide,0.05024355074472595,0.006193410112458957,8,8,0.8522111353463951,400,,0.7469956690837614,0.19293983701797796,0.08617015000513573,oversample,0.540062739643457,,6.0,0.897372967522908,,,,0.456023384086451,0.30088269650472155,0.5567616463138851,0.5572139303482587,0.715281812899477,0.7156549520766773,0.7469956690837614,0.19293983701797796,0.08,0.6482073411443343,0.6335389782993857,0.5567616463138851,0.5572139303482587,1.0,1.0,oversample,0.6076940930718349,0.5938403718344984,0.540062739643457,0.30088269650472155,COMPLETE
554,0.7125147579693034,2025-11-26 19:55:19.461685,2025-11-26 19:55:21.832540,0 days 00:00:02.370855,0.0008861214672067043,gbtree,0.3821836559748558,6.695911143973296,depthwise,0.0006475833745612407,0.01064066720623179,3,8,0.3472772229931282,800,,0.5579008214867965,0.12854590552822764,0.02028593892322785,oversample,0.7723724245243242,,7.0,0.6152918672121085,,,,0.4395117612095509,0.5204561593489222,0.5590230664857531,0.5594753505201266,0.7134880987364091,0.7125147579693034,0.5579008214867965,0.12854590552822764,0.02,0.6145808608966167,0.6217932826932537,0.5589318600368324,0.5598330241187384,0.9861900893582454,0.9797077922077922,oversample,0.5850938344468575,0.5938519792260855,0.7723724245243242,0.5204561593489222,COMPLETE
555,0.715281812899477,2025-11-26 19:55:22.005734,2025-11-26 19:55:23.728527,0 days 00:00:01.722793,0.16146982593648868,gbtree,0.7044032663890802,4.363242010776046,lossguide,0.003178705915900052,0.022406186381639763,1,9,1.4683923077166037,600,,0.7590528156606386,0.7859631363485328,0.08294859662042145,none,0.9034122878588087,2.1122699635171247,7.0,0.6354142948437134,,,,0.24623389558115014,0.6058354982042702,0.555857078245138,0.5567616463138851,0.7145348837209302,0.715281812899477,0.7590528156606386,0.7859631363485328,0.08,0.5362443457022977,0.5347957110455778,0.5563603440470801,0.5570135746606335,0.9983753046303818,0.9991883116883117,none,0.5031606956348746,0.5131159379435681,0.9034122878588087,0.6058354982042702,COMPLETE
556,0.7156549520766773,2025-11-26 19:55:23.898639,2025-11-26 19:55:24.860304,0 days 00:00:00.961665,0.024866694680227838,gbtree,0.49772731807166404,5.656674973772646,lossguide,0.0001623938662455185,0.0015568985543310582,5,9,0.9443855463588617,900,,0.7551256120801161,0.1431324948424616,0.049196311015195074,none,0.7765158726653754,1.492730748194314,7.0,0.6740352129068172,,,,0.6614071495096765,0.4318484338335427,0.5567616463138851,0.5572139303482587,0.715281812899477,0.7156549520766773,0.7551256120801161,0.1431324948424616,0.05,0.44172161824808603,0.44021994802990355,0.5567616463138851,0.5572139303482587,1.0,1.0,none,0.34950057195908424,0.34206485547139276,0.7765158726653754,0.4318484338335427,COMPLETE
557,0.7137850467289719,2025-11-26 19:55:25.041390,2025-11-26 19:55:28.675913,0 days 00:00:03.634523,0.0011034747361263544,gbtree,0.8361259275539459,2.4926775036452753,lossguide,0.0010577200352261675,0.01498708356040539,0,8,0.4742897643207116,400,,0.7092306815915139,0.5343120692749355,0.0901099210141694,oversample,0.7270154548488763,,6.0,0.6509926632234972,,,,0.4320359587703033,0.20252216739956155,0.5581184984170059,0.5567616463138851,0.7144109909383222,0.7137850467289719,0.7092306815915139,0.5343120692749355,0.1,0.5939015475669245,0.5715148051830339,0.5579908675799087,0.5574817518248175,0.9926888708367181,0.9918831168831169,oversample,0.5420207563122731,0.5226820868100235,0.7270154548488763,0.20252216739956155,COMPLETE
558,0.7156549520766773,2025-11-26 19:55:28.857051,2025-11-26 19:56:44.370911,0 days 00:01:15.513860,0.004648843342826408,dart,0.4071322577307297,8.895102106738403,lossguide,0.038196948885452324,0.00024142277162709597,1,3,0.6381642480861097,800,forest,0.6778608201859708,0.1200316566599896,0.08385816623942192,oversample,0.9308704704501336,,8.0,0.6027040623575213,0.2752856481807022,weighted,0.6604364325286218,0.617099929333215,0.18685574750244163,0.5567616463138851,0.5572139303482587,0.715281812899477,0.7156549520766773,0.6778608201859708,0.1200316566599896,0.08,0.5841075151672901,0.6003157854165935,0.5567616463138851,0.5572139303482587,1.0,1.0,oversample,0.5481987433478672,0.5627085184988657,0.9308704704501336,0.18685574750244163,COMPLETE
559,0.0,2025-11-26 19:56:44.542497,2025-11-26 19:56:45.500088,0 days 00:00:00.957591,0.0002201157122474178,gbtree,0.2847105569370733,6.579709720993654,lossguide,0.00014205362835201208,0.0036520627537701793,6,9,0.12870185318839014,900,,0.7088320131242338,0.22730825969247748,0.03212408748811746,oversample,0.8745486443876433,,8.0,0.6231361165466552,,,,0.5112777739717728,0.6383741602084255,0.44323835368611486,0.4427860696517413,0.0,0.0,0.7088320131242338,0.22730825969247748,0.02,0.6232821691651715,0.6351161242249274,0.0,0.0,0.0,0.0,oversample,0.5663505694723056,0.5891008251197218,0.8745486443876433,0.6383741602084255,COMPLETE
560,0.7156549520766773,2025-11-26 19:56:45.682179,2025-11-26 19:58:08.537045,0 days 00:01:22.854866,0.34541019101047715,dart,0.42568759021307156,7.705903565315084,depthwise,0.0158387885610532,0.00022053302218128738,0,9,48.188100612995804,900,forest,0.8101061481408522,0.1802004702114701,0.016168755942747182,none,0.764270968994469,0.937782898783333,5.0,0.784254076420215,0.39962239222497525,weighted,0.44608674390866915,0.5638007198032244,0.19869621436192625,0.5567616463138851,0.5572139303482587,0.715281812899477,0.7156549520766773,0.8101061481408522,0.1802004702114701,0.02,0.48352259123061403,0.49464879085808344,0.5567616463138851,0.5572139303482587,1.0,1.0,none,0.252086407268025,0.2765432027114867,0.764270968994469,0.19869621436192625,COMPLETE
561,0.7156549520766773,2025-11-26 19:58:08.711373,2025-11-26 19:58:48.300038,0 days 00:00:39.588665,0.41080788679330504,dart,0.957275867274315,2.7940089275727686,depthwise,10.812047494626936,0.0012125316609308083,7,10,64.47708413985099,600,tree,0.8260349216520548,0.859408998271595,0.09664914891306588,oversample,0.7943788391247391,,11.0,0.9165079824655785,0.3607818035727607,weighted,0.3880443167530866,0.7364937146620879,0.25355484966745023,0.5567616463138851,0.5572139303482587,0.715281812899477,0.7156549520766773,0.8260349216520548,0.859408998271595,0.1,0.5062049812400247,0.5184919042570116,0.5567616463138851,0.5572139303482587,1.0,1.0,oversample,0.4664852699812662,0.48534898451905595,0.7943788391247391,0.25355484966745023,COMPLETE
562,0.7061668681983071,2025-11-26 19:58:48.481974,2025-11-26 19:59:02.500712,0 days 00:00:14.018738,0.7205973716225729,gbtree,0.8618652517181196,0.49184272199389345,lossguide,0.6319457700983581,0.011406164181805284,6,9,0.9251863544185046,500,,0.8300224781944795,0.2970069684148937,0.05347042396301208,oversample,0.7570241004738683,,5.0,0.7074176528230555,,,,0.6191200136381793,0.09489680353593216,0.5630936227951153,0.5603799185888738,0.7086851628468034,0.7061668681983071,0.8300224781944795,0.2970069684148937,0.05,0.5890647639812812,0.5621923734526892,0.5635491606714629,0.5626204238921002,0.9545085296506904,0.948051948051948,oversample,0.5261020573948507,0.4918134725335951,0.7570241004738683,0.09489680353593216,COMPLETE
563,0.7156549520766773,2025-11-26 19:59:02.695924,2025-11-26 19:59:45.712210,0 days 00:00:43.016286,0.0065245069661052976,dart,0.9106351753603178,1.1010434086828815,depthwise,0.1345449918324181,0.0002939669851480288,1,12,70.17327782409895,600,tree,0.5843187650003788,0.10122932641457347,0.05193661405528198,undersample,0.6120059154938027,,5.0,0.9334408076593828,0.3872730031355387,uniform,0.8721921655007705,0.7888763051607136,0.4165316862941996,0.5567616463138851,0.5572139303482587,0.715281812899477,0.7156549520766773,0.5843187650003788,0.10122932641457347,0.05,0.5567616463138851,0.5572139303482587,0.5567616463138851,0.5572139303482587,1.0,1.0,undersample,0.5,0.5,0.6120059154938027,0.4165316862941996,COMPLETE
564,0.7156549520766773,2025-11-26 19:59:45.879537,2025-11-26 19:59:51.360218,0 days 00:00:05.480681,0.024501015093322906,dart,0.6837432116061972,9.527252037353229,lossguide,74.73326090729964,0.0005824812414825319,0,5,2.1551496558747734,200,forest,0.7582498081943407,0.09521022181592342,0.0324733740636884,oversample,0.6839604005027797,,11.0,0.8594115002268499,0.08862440747428571,weighted,0.2882800627358554,0.7131328031856253,0.18782744225415154,0.5567616463138851,0.5572139303482587,0.715281812899477,0.7156549520766773,0.7582498081943407,0.09521022181592342,0.02,0.5567616463138851,0.5572139303482587,0.5567616463138851,0.5572139303482587,1.0,1.0,oversample,0.5,0.5,0.6839604005027797,0.18782744225415154,COMPLETE
565,0.7156549520766773,2025-11-26 19:59:51.527562,2025-11-26 19:59:52.346740,0 days 00:00:00.819178,0.031603255571167166,gbtree,0.23129668406126278,9.22043825917342,lossguide,20.974778996664853,0.00019821821840646986,4,8,0.14097884350447598,700,,0.7977020317191521,0.7198648733100143,0.03557909281705115,oversample,0.6641426227638962,,7.0,0.7440010715361511,,,,0.3929639163804805,0.2990617080581293,0.5567616463138851,0.5572139303482587,0.715281812899477,0.7156549520766773,0.7977020317191521,0.7198648733100143,0.05,0.4608709155856022,0.45897650577901306,0.5567616463138851,0.5572139303482587,1.0,1.0,oversample,0.33057825892339066,0.3333402424949922,0.6641426227638962,0.2990617080581293,COMPLETE
566,0.7156549520766773,2025-11-26 19:59:52.507234,2025-11-26 20:00:17.731997,0 days 00:00:25.224763,0.7788438191087594,dart,0.6409522210962815,0.5656183183593781,lossguide,0.000785275363197464,0.007019786118325676,3,7,0.3406739052737865,400,forest,0.8734852437561333,0.7337488308166209,0.07020341073350074,oversample,0.8382670818012357,,5.0,0.8159349449754144,0.008617939292339345,weighted,0.024894335505331926,0.20570932395356767,0.27036067007460873,0.5567616463138851,0.5572139303482587,0.715281812899477,0.7156549520766773,0.8734852437561333,0.7337488308166209,0.08,0.5389028814863104,0.5411400554674886,0.5567616463138851,0.5572139303482587,1.0,1.0,oversample,0.48400545433445513,0.5123287080641523,0.8382670818012357,0.27036067007460873,COMPLETE
567,0.7156549520766773,2025-11-26 20:00:17.908633,2025-11-26 20:00:34.052890,0 days 00:00:16.144257,9.413017468556271,dart,0.4313333893649811,5.279782703722903,lossguide,0.022731809473630255,0.00010279225981524873,1,8,6.267675921270679,400,forest,0.8601762765516645,0.3031003579938203,0.025339325024252686,oversample,0.8024743290607671,,8.0,0.6433583000256688,0.34986915854701894,weighted,0.28672711389997846,0.7157757387766805,0.15245619115918135,0.5567616463138851,0.5572139303482587,0.715281812899477,0.7156549520766773,0.8601762765516645,0.3031003579938203,0.02,0.7035625984451603,0.6940730276683067,0.5567616463138851,0.5572139303482587,1.0,1.0,oversample,0.6951391767104893,0.6928472765742939,0.8024743290607671,0.15245619115918135,COMPLETE
568,0.7156549520766773,2025-11-26 20:00:34.209515,2025-11-26 20:00:34.875237,0 days 00:00:00.665722,0.16341099034614343,gbtree,0.21852686037071656,7.004339451242831,lossguide,0.12188531290345604,0.00028623143524765803,4,6,0.14981235638635793,500,,0.7742835633497375,0.9390248631579579,0.029529221771194485,undersample,0.6766604703837045,,7.0,0.8403761176507355,,,,0.5239136006757542,0.19502601778307901,0.5567616463138851,0.5572139303482587,0.715281812899477,0.7156549520766773,0.7742835633497375,0.9390248631579579,0.02,0.46059293773236315,0.4629120001411312,0.5567616463138851,0.5572139303482587,1.0,1.0,undersample,0.2972288996833502,0.3083113898359046,0.6766604703837045,0.19502601778307901,COMPLETE
569,0.7156549520766773,2025-11-26 20:00:35.036169,2025-11-26 20:00:35.756550,0 days 00:00:00.720381,0.1302603066139789,gbtree,0.5023693118857482,5.517986222987995,lossguide,20.227033693264563,0.00022809939439724853,0,3,0.36791667407551487,600,,0.9518199817994676,0.9046050107016557,4.607222399255137e-05,undersample,0.6748325909939724,,7.0,0.6979250653542518,,,,0.3640628971691119,0.15790506194195664,0.5567616463138851,0.5572139303482587,0.715281812899477,0.7156549520766773,0.9518199817994676,0.9046050107016557,0.0,0.4987239082295396,0.4917551527426346,0.5567616463138851,0.5572139303482587,1.0,1.0,undersample,0.42743538520200935,0.4167513729886049,0.6748325909939724,0.15790506194195664,COMPLETE
570,0.7156549520766773,2025-11-26 20:00:35.911818,2025-11-26 20:00:38.488003,0 days 00:00:02.576185,0.03543579987646432,gbtree,0.47785636051925495,2.0987405888446746,depthwise,0.019870950278894847,0.0863049521153944,4,5,17.826509943433297,600,,0.6764362419206869,0.5202602268243777,0.004222566560160198,none,0.8823898656258313,2.8290084602039003,8.0,0.8126734062600808,,,,0.7095038809653071,0.613030766720629,0.5567616463138851,0.5572139303482587,0.715281812899477,0.7156549520766773,0.6764362419206869,0.5202602268243777,0.0,0.5996097601769856,0.589502037111238,0.5567616463138851,0.5572139303482587,1.0,1.0,none,0.6002602828296225,0.5907424419298781,0.8823898656258313,0.613030766720629,COMPLETE
571,0.0,2025-11-26 20:00:38.643766,2025-11-26 20:00:39.383203,0 days 00:00:00.739437,0.0010006248441865608,gbtree,0.3823446582686661,6.705448068519666,depthwise,0.00015486264445580325,0.02226805941115607,4,10,11.826780206265715,700,,0.7841802901588786,0.07975983074383247,0.026032480665389046,oversample,0.7521101872568503,,7.0,0.6044182126710915,,,,0.8486037871531928,0.600159962146168,0.44323835368611486,0.4427860696517413,0.0,0.0,0.7841802901588786,0.07975983074383247,0.02,0.5567616463138851,0.5572139303482587,0.0,0.0,0.0,0.0,oversample,0.5,0.5,0.7521101872568503,0.600159962146168,COMPLETE
572,0.7156549520766773,2025-11-26 20:00:39.539745,2025-11-26 20:01:21.260444,0 days 00:00:41.720699,26.391197493685496,dart,0.9660667096251806,5.894063328259531,lossguide,4.551758195261576,0.003577159685979126,10,10,16.944282274235725,600,tree,0.8956397623947749,0.3028339211684758,0.061981503439156864,undersample,0.9369012378538707,,9.0,0.8736648520741499,0.20577912399976822,uniform,0.41973353962017085,0.4065666697687026,0.10854131498907793,0.5567616463138851,0.5572139303482587,0.715281812899477,0.7156549520766773,0.8956397623947749,0.3028339211684758,0.05,0.5567616463138851,0.5572139303482587,0.5567616463138851,0.5572139303482587,1.0,1.0,undersample,0.5,0.5,0.9369012378538707,0.10854131498907793,COMPLETE
573,0.6009741476208318,2025-11-26 20:01:21.431019,2025-11-26 20:01:26.219589,0 days 00:00:04.788570,0.3714671048369029,dart,0.7181899117868958,5.466126021314039,lossguide,0.0021717653019968385,0.11250346871770163,3,4,0.21226890301495033,200,tree,0.7977141751350619,0.756514783526761,0.0971795390965973,undersample,0.7395054977252279,,5.0,0.7379079708232124,0.26949293308093025,weighted,0.26946917801811787,0.36009605441599374,0.4894376540427514,0.5192220714608774,0.5183175033921302,0.6011257035647279,0.6009741476208318,0.7977141751350619,0.756514783526761,0.1,0.52446476256591,0.5295622114406199,0.5585774058577406,0.5581071677105081,0.6506904955320877,0.650974025974026,undersample,0.47750418607735545,0.47704555403738247,0.7395054977252279,0.4894376540427514,COMPLETE
574,0.6859296482412061,2025-11-26 20:01:26.390236,2025-11-26 20:02:25.686030,0 days 00:00:59.295794,0.2444271967375257,dart,0.8726989454501356,1.642892607734645,lossguide,0.0004353793011120682,0.453035115195821,6,3,0.49221017377407267,400,tree,0.9879492082040201,0.913827043703535,0.08509418116096823,oversample,0.7118278570438514,,5.0,0.688809286657011,0.48049222659515395,weighted,0.7562265095387557,0.20157233428302687,0.17882175247254253,0.5486205336951605,0.5477159656264133,0.6863607793840352,0.6859296482412061,0.9879492082040201,0.913827043703535,0.08,0.5651200762497313,0.5438331760366883,0.5597129677088672,0.5594262295081968,0.8870836718115354,0.8863636363636364,oversample,0.512967721613422,0.49807980579175676,0.7118278570438514,0.17882175247254253,COMPLETE
575,0.7156549520766773,2025-11-26 20:02:25.852873,2025-11-26 20:02:47.497839,0 days 00:00:21.644966,0.7674066302995265,dart,0.6411032408347975,8.912652214635706,lossguide,4.853952115730842,0.0003482197582104156,4,5,0.17432587156359097,400,forest,0.5864778684500396,0.6254985955814034,0.042349325687396355,none,0.5239432733952909,0.6401337998963572,12.0,0.7916157139517825,0.4146501633968643,uniform,0.87077647574465,0.7965755218490509,0.0489780814810859,0.5567616463138851,0.5572139303482587,0.715281812899477,0.7156549520766773,0.5864778684500396,0.6254985955814034,0.05,0.5567616463138851,0.5572139303482587,0.5567616463138851,0.5572139303482587,1.0,1.0,none,0.5,0.5,0.5239432733952909,0.0489780814810859,COMPLETE
576,0.7091866588648332,2025-11-26 20:02:47.670660,2025-11-26 20:04:56.856345,0 days 00:02:09.185685,0.06801183815983772,dart,0.5806986890092014,2.138385724947834,lossguide,0.0002560518390945953,0.027137134298921298,5,11,0.10506498162626388,400,forest,0.8957229645878848,0.6189368557325401,0.04820550633452339,undersample,0.7833761441966671,,12.0,0.6571878847905018,0.1749099428841939,weighted,0.20262006428393492,0.4729067365005522,0.3107617945643608,0.5517865219357757,0.550429669832655,0.7099795141937372,0.7091866588648332,0.8957229645878848,0.6189368557325401,0.05,0.5331333909803102,0.5321434389646702,0.5548947849954254,0.5544373284537969,0.9853777416734363,0.9837662337662337,undersample,0.499068701404201,0.49579190600002654,0.7833761441966671,0.3107617945643608,COMPLETE
577,0.6479827533107484,2025-11-26 20:04:57.030587,2025-11-26 20:04:59.725671,0 days 00:00:02.695084,1.7243257916615216,gbtree,0.9863701171960093,4.225914074914064,lossguide,0.09903313239896018,0.03541800142489154,6,11,2.2307637520930816,600,,0.7056693091588936,0.11404515233918311,0.08202982024707389,oversample,0.7435358009378428,,8.0,0.636565896980313,,,,0.7544926576546173,0.4691215696056442,0.4997738579828132,0.4830393487109905,0.6640340218712029,0.6479827533107484,0.7056693091588936,0.11404515233918311,0.08,0.5152365032628712,0.5162051789468429,0.5303250849102378,0.5220843672456575,0.8878960194963444,0.8538961038961039,oversample,0.40372975347734547,0.3908801553400634,0.7435358009378428,0.4691215696056442,COMPLETE
578,0.7156549520766773,2025-11-26 20:04:59.917663,2025-11-26 20:05:00.705113,0 days 00:00:00.787450,0.05139404982260215,gbtree,0.8666049735261462,4.523917995712316,lossguide,0.26736537203688493,0.04471457600045601,7,8,4.689065720391707,500,,0.8593816523010986,0.6299722822725327,0.09442290317826998,oversample,0.9178948983562186,,12.0,0.8807647441849686,,,,0.5490852409031263,0.20354880671983766,0.5567616463138851,0.5572139303482587,0.715281812899477,0.7156549520766773,0.8593816523010986,0.6299722822725327,0.1,0.4843842163128423,0.4728981407571507,0.5567616463138851,0.5572139303482587,1.0,1.0,oversample,0.39422984465922845,0.3866202426276481,0.9178948983562186,0.20354880671983766,COMPLETE
579,0.7156549520766773,2025-11-26 20:05:00.890928,2025-11-26 20:05:20.211766,0 days 00:00:19.320838,0.0404241164460144,dart,0.5557751667229383,7.963100906479159,depthwise,0.053933759980561595,0.009838027395616119,0,3,0.23338807632311986,400,tree,0.7033786210084905,0.8160798490797311,0.09833854553342398,undersample,0.8708781267631811,,6.0,0.6142177169798313,0.12175318249660214,weighted,0.12154396999651987,0.4647429098703296,0.30658953268814854,0.5567616463138851,0.5572139303482587,0.715281812899477,0.7156549520766773,0.7033786210084905,0.8160798490797311,0.1,0.5057277490261892,0.4997317145897495,0.5567616463138851,0.5572139303482587,1.0,1.0,undersample,0.4150736086473582,0.3952975969383017,0.8708781267631811,0.30658953268814854,COMPLETE
