number,value,datetime_start,datetime_complete,duration,params_alpha,params_booster,params_colsample_bytree,params_gamma,params_grow_policy,params_lambda,params_learning_rate,params_max_delta_step,params_max_depth,params_min_child_weight,params_n_estimators,params_normalize_type,params_params_feature_fraction,params_params_labeled_ratio,params_params_missing_rate,params_params_resampling,params_params_sample_rows,params_params_scale_pos_weight,params_params_selftrain_max_iter,params_params_selftrain_threshold,params_rate_drop,params_sample_type,params_skip_drop,params_subsample,params_user_attrs_decision_threshold,user_attrs_acc_test,user_attrs_acc_val,user_attrs_f1_test,user_attrs_f1_val,user_attrs_feature_fraction,user_attrs_labeled_ratio,user_attrs_missing_rate,user_attrs_pr_auc_test,user_attrs_pr_auc_val,user_attrs_prec_test,user_attrs_prec_val,user_attrs_rec_test,user_attrs_rec_val,user_attrs_resampling_strategy,user_attrs_roc_auc_test,user_attrs_roc_auc_val,user_attrs_sample_rows,user_attrs_user_attrs_decision_threshold,state
494,0.7156549520766773,2025-11-26 19:27:46.059175,2025-11-26 19:29:08.645930,0 days 00:01:22.586755,0.049014025712074895,dart,0.5719547555870332,0.7835723304899582,lossguide,0.0038010504463707375,0.017961480360670575,4,6,0.13510752852163355,500,forest,0.9295962709250748,0.6552495185905496,0.08987182771285127,undersample,0.7831483080259409,,6.0,0.8234784361897627,0.17918251515230063,uniform,0.2638128527428992,0.3035932836987778,0.11606746564655496,0.5567616463138851,0.5572139303482587,0.715281812899477,0.7156549520766773,0.9295962709250748,0.6552495185905496,0.08,0.5595280476317404,0.5458673360703584,0.5567616463138851,0.5572139303482587,1.0,1.0,undersample,0.5269110893748239,0.5194423809081623,0.7831483080259409,0.11606746564655496,COMPLETE
495,0.715862870424172,2025-11-26 19:29:08.819483,2025-11-26 19:29:26.734820,0 days 00:00:17.915337,0.3094344030204984,dart,0.7308735301130194,3.933147614216828,lossguide,0.03133899037911673,0.04394113720381134,0,5,0.45182772332413385,400,tree,0.796633227405092,0.8081612740141283,0.08723893285421785,undersample,0.8352962927401165,,5.0,0.648262009002569,0.2959254496269079,weighted,0.35545729958815986,0.31620062225018136,0.3761563391622317,0.5563093622795116,0.5576662143826323,0.7149084568439407,0.715862870424172,0.796633227405092,0.8081612740141283,0.08,0.4728450120658459,0.4668992421255315,0.5565610859728507,0.5574660633484163,0.9991876523151909,1.0,undersample,0.3652161839553043,0.3579168214318878,0.8352962927401165,0.3761563391622317,COMPLETE
496,0.7089108910891089,2025-11-26 19:29:26.918248,2025-11-26 19:29:55.223205,0 days 00:00:28.304957,2.8405060484823808,dart,0.7225311402159191,4.478362137508211,lossguide,0.4252010161735063,0.13933142555877925,0,7,0.9520173982491154,500,tree,0.8937123741411009,0.9070969421130939,0.07759471815783887,undersample,0.8260612891946639,,6.0,0.6924674680411164,0.23733796779057925,weighted,0.3777698971336837,0.508090142133786,0.48033799459369414,0.623699683401176,0.6010854816824966,0.7213663764233088,0.7089108910891089,0.8937123741411009,0.9070969421130939,0.08,0.534540340089602,0.5156816296491492,0.6136752136752137,0.5973303670745272,0.8748984565393989,0.8717532467532467,undersample,0.5252192509822775,0.4963208714166324,0.8260612891946639,0.48033799459369414,COMPLETE
497,0.7156549520766773,2025-11-26 19:29:55.393801,2025-11-26 19:30:26.020506,0 days 00:00:30.626705,0.2991897685840981,dart,0.7834229302010387,2.267174441720873,lossguide,0.02727279763045704,0.04918153198683817,0,4,10.299092629515215,300,tree,0.7951725313912895,0.749958348753748,0.0971679253689955,undersample,0.6863872046203332,,5.0,0.615057078739704,0.30536716363752187,weighted,0.35741940098363384,0.4365232935273733,0.1191725298210714,0.5567616463138851,0.5572139303482587,0.715281812899477,0.7156549520766773,0.7951725313912895,0.749958348753748,0.1,0.5148093868117706,0.5391540160830968,0.5567616463138851,0.5572139303482587,1.0,1.0,undersample,0.4801973673303602,0.5146116332594882,0.6863872046203332,0.1191725298210714,COMPLETE
498,0.7138225758915414,2025-11-26 19:30:26.192657,2025-11-26 19:30:53.989024,0 days 00:00:27.796367,0.036022079507896064,dart,0.7630027500061488,1.2134606635420688,lossguide,0.11218674722769051,0.006881690487857154,1,4,0.2903264628812473,500,tree,0.9315657208487942,0.6588669552648051,0.08956075165830735,undersample,0.8394657683757176,,5.0,0.6148147901254882,0.3099898980900904,weighted,0.23036581186982927,0.34307000362695994,0.4498001505759263,0.555857078245138,0.5608322026232474,0.7108362779740872,0.7138225758915414,0.9315657208487942,0.6588669552648051,0.08,0.5761491121699178,0.5755020536269595,0.5575057736720554,0.5603887089310504,0.9805036555645816,0.9829545454545454,undersample,0.5499759611399393,0.5553332647944497,0.8394657683757176,0.4498001505759263,COMPLETE
499,0.7156549520766773,2025-11-26 19:30:54.158305,2025-11-26 19:32:23.408543,0 days 00:01:29.250238,0.2427069589297758,dart,0.565978801626644,3.7123880575404673,lossguide,0.02390081292920805,0.38286418867823313,0,6,0.4079722032641759,700,forest,0.7363745304117669,0.5942128949127277,0.09451885304548485,undersample,0.908325733250272,,5.0,0.6481718021005166,0.4736142988575209,uniform,0.01979955803303801,0.36973654850332655,0.4317371338745001,0.5567616463138851,0.5572139303482587,0.715281812899477,0.7156549520766773,0.7363745304117669,0.5942128949127277,0.1,0.5018952592056658,0.4924115285545835,0.5567616463138851,0.5572139303482587,1.0,1.0,undersample,0.4246157927021336,0.3986156527333749,0.908325733250272,0.4317371338745001,COMPLETE
500,0.7159487776484285,2025-11-26 19:32:23.577495,2025-11-26 19:32:52.339795,0 days 00:00:28.762300,0.029797500551907122,dart,0.9783662253789737,2.3813458443704105,lossguide,0.013925681409509784,0.06487957663109185,3,3,0.98237470465559,300,tree,0.9674585346084417,0.8176776392207998,0.09221017654108728,oversample,0.7319701070175626,,5.0,0.7559466704496236,0.4269183743337721,weighted,0.4110637139961662,0.2284936378235462,0.3446264980947465,0.5576662143826323,0.5585707824513795,0.7155322862129145,0.7159487776484285,0.9674585346084417,0.8176776392207998,0.1,0.519318336966001,0.5233566144147317,0.5573176257362936,0.558076225045372,0.9991876523151909,0.9983766233766234,oversample,0.470307448730914,0.4892366316012894,0.7319701070175626,0.3446264980947465,COMPLETE
501,0.7156549520766773,2025-11-26 19:32:52.508421,2025-11-26 19:33:10.092703,0 days 00:00:17.584282,0.018673790083844812,dart,0.9650151960498017,1.5549886561606119,lossguide,0.035234706809034816,0.006818522868454548,3,4,4.579457600416738,400,tree,0.9768127439703141,0.7453068918101582,0.07007121651303416,oversample,0.8594423173595398,,5.0,0.7333049920501042,0.4639574295158965,weighted,0.42064162576457564,0.24955229300029547,0.3554028264309756,0.5567616463138851,0.5572139303482587,0.715281812899477,0.7156549520766773,0.9768127439703141,0.7453068918101582,0.08,0.5982027866504203,0.5759057843784829,0.5567616463138851,0.5572139303482587,1.0,1.0,oversample,0.573507103897611,0.5616543186129499,0.8594423173595398,0.3554028264309756,COMPLETE
502,0.7156549520766773,2025-11-26 19:33:10.263435,2025-11-26 19:33:15.268277,0 days 00:00:05.004842,0.30094465116254787,dart,0.9738896323690496,2.998169713885172,lossguide,0.04233330555376233,0.042884625911423675,1,3,0.2400276473542838,200,tree,0.9497657364682898,0.933751631411245,0.09331544945437202,oversample,0.7470720974981354,,5.0,0.8505651127710747,0.4019874183455978,weighted,0.49451185516275076,0.34715794836151603,0.41040703977507065,0.5567616463138851,0.5572139303482587,0.715281812899477,0.7156549520766773,0.9497657364682898,0.933751631411245,0.1,0.5412678266492317,0.5161896608176,0.5567616463138851,0.5572139303482587,1.0,1.0,oversample,0.4775278104743116,0.4508149217993447,0.7470720974981354,0.41040703977507065,COMPLETE
503,0.7093364650616559,2025-11-26 19:33:15.443998,2025-11-26 19:33:43.113264,0 days 00:00:27.669266,0.005706470516642621,dart,0.9542769469720317,6.300354313632173,lossguide,0.0030615715636006643,0.13631250359925698,2,3,0.5343972323021235,300,tree,0.7509188574217904,0.8798957629046831,0.0785866094020611,undersample,0.9300802078560566,,5.0,0.6140447698303058,0.42680983923108007,weighted,0.39962895316410224,0.38687156144141177,0.45032424550103317,0.5603799185888738,0.5522388059701493,0.7149560117302053,0.7093364650616559,0.7509188574217904,0.8798957629046831,0.08,0.4930749652059092,0.49190383948531136,0.5594309316200092,0.5556577736890524,0.9902518277822908,0.9805194805194806,undersample,0.4141775394154412,0.41481210949418307,0.9300802078560566,0.45032424550103317,COMPLETE
504,0.7156549520766773,2025-11-26 19:33:43.285395,2025-11-26 19:33:53.785087,0 days 00:00:10.499692,1.031523692233739,dart,0.8785721287772258,2.667430566903625,depthwise,0.14455110451451889,0.02736061028369238,2,6,0.3352489934837973,300,tree,0.7816172864039428,0.8697434860159924,0.07618315038568926,undersample,0.7676862899004047,,5.0,0.6534193200501857,0.40829225870743235,weighted,0.40222452946839177,0.3307463920081998,0.20915058723249938,0.5567616463138851,0.5572139303482587,0.715281812899477,0.7156549520766773,0.7816172864039428,0.8697434860159924,0.08,0.5952990577354794,0.600435011067666,0.5567616463138851,0.5572139303482587,1.0,1.0,undersample,0.5521253667998476,0.5616684133027341,0.7676862899004047,0.20915058723249938,COMPLETE
505,0.7156549520766773,2025-11-26 19:33:53.960364,2025-11-26 19:33:58.920766,0 days 00:00:04.960402,0.016281499817261742,dart,0.9890471784610629,3.860733296634237,lossguide,0.00020561617369850536,0.02305335958662481,2,5,2.864823050119476,200,tree,0.6525888979743077,0.5813429434342896,0.0789508535390409,none,0.8875251497631229,0.8471272328712005,7.0,0.7119689089519524,0.2972159598017651,weighted,0.3659290335084681,0.22004237625278042,0.4185008327255785,0.5567616463138851,0.5572139303482587,0.715281812899477,0.7156549520766773,0.6525888979743077,0.5813429434342896,0.08,0.6043195610035896,0.6153667946412111,0.5567616463138851,0.5572139303482587,1.0,1.0,none,0.554167840978796,0.5640748743085311,0.8875251497631229,0.4185008327255785,COMPLETE
506,0.0,2025-11-26 19:33:59.095796,2025-11-26 19:35:21.586373,0 days 00:01:22.490577,0.000798168497903697,dart,0.7855272159440204,6.183441956485386,depthwise,0.0004339468092912413,0.00033534631494698655,8,10,0.3074313934387786,900,tree,0.6553638539479258,0.5433374362438144,0.011128861979158489,oversample,0.9180090148614486,,6.0,0.7158787750266569,0.38306872160940664,weighted,0.2519527692073462,0.5681193554224678,0.589278725284417,0.44323835368611486,0.4427860696517413,0.0,0.0,0.6553638539479258,0.5433374362438144,0.02,0.5207060342138741,0.5141383696561546,0.0,0.0,0.0,0.0,oversample,0.4731054891493559,0.45946740312802625,0.9180090148614486,0.589278725284417,COMPLETE
507,0.7156549520766773,2025-11-26 19:35:21.751728,2025-11-26 19:35:32.411050,0 days 00:00:10.659322,0.2883236937292917,dart,0.26836878668371383,1.8496576656169432,depthwise,11.87117073979881,0.002453379421983225,3,3,15.202328886954914,300,tree,0.5024894317338695,0.3043059303092982,0.07603025512884012,undersample,0.6251893624866248,,12.0,0.8523753149122957,0.31367086819766565,weighted,0.5242661443115234,0.3655053652714148,0.21805085578263347,0.5567616463138851,0.5572139303482587,0.715281812899477,0.7156549520766773,0.5024894317338695,0.3043059303092982,0.08,0.503099297386412,0.514547546253661,0.5567616463138851,0.5572139303482587,1.0,1.0,undersample,0.4380265753742602,0.45661239934733294,0.6251893624866248,0.21805085578263347,COMPLETE
508,0.011058451816745656,2025-11-26 19:35:32.595314,2025-11-26 19:36:03.084426,0 days 00:00:30.489112,0.015307784205880954,dart,0.6739259867731395,2.0660423073197833,lossguide,0.18822352479968393,0.0017661680297228497,2,8,0.1901626869513076,500,tree,0.8665783881745757,0.6622367206911546,0.08709972359747785,oversample,0.8168191280840161,,5.0,0.7997938954744209,0.48003871925087216,weighted,0.5392326956024894,0.20295600025077037,0.5962720571987845,0.438715513342379,0.4337403889642696,0.018972332015810278,0.011058451816745656,0.8665783881745757,0.6622367206911546,0.08,0.5507655769778979,0.5366189999625104,0.35294117647058826,0.20588235294117646,0.00974817221770918,0.005681818181818182,oversample,0.5205275286394005,0.5086516522292824,0.8168191280840161,0.5962720571987845,COMPLETE
509,0.6573612495845796,2025-11-26 19:36:03.243900,2025-11-26 19:37:05.390970,0 days 00:01:02.147070,0.0765832479147449,dart,0.9281412481603327,2.1826565878936,depthwise,0.015175582231271861,0.4069005500262549,7,3,0.2567875353457862,400,tree,0.916386551985178,0.7845527384876076,0.06882264725668456,oversample,0.5206756127318066,,6.0,0.7998482926043264,0.33195548456241736,weighted,0.39136375340325325,0.32497190983638985,0.4128047802092103,0.5210312075983717,0.5336951605608322,0.6454636759290258,0.6573612495845796,0.916386551985178,0.7845527384876076,0.08,0.5336033321142232,0.540108221857651,0.5489749430523918,0.5565559932470456,0.7831031681559708,0.8027597402597403,oversample,0.4824317379266898,0.495935754745765,0.5206756127318066,0.4128047802092103,COMPLETE
510,0.0,2025-11-26 19:37:05.555541,2025-11-26 19:37:22.027747,0 days 00:00:16.472206,0.8919196635329123,dart,0.3956752272450075,5.120723071113074,depthwise,0.002856986664379531,0.14864711844025472,3,4,3.2389969842702926,400,tree,0.7776817235119896,0.12422118100647517,0.004056378360895137,undersample,0.9624109898087688,,8.0,0.7571431298718371,0.39464532651708634,weighted,0.30630346932255864,0.7321014571568348,0.6457579220593826,0.44323835368611486,0.4427860696517413,0.0,0.0,0.7776817235119896,0.12422118100647517,0.0,0.519138690192233,0.4988171023404477,0.0,0.0,0.0,0.0,undersample,0.42667070077421704,0.3795003515381452,0.9624109898087688,0.6457579220593826,COMPLETE
511,0.7156549520766773,2025-11-26 19:37:22.185215,2025-11-26 19:37:26.780629,0 days 00:00:04.595414,0.012286489421786149,dart,0.7573832694074993,4.210471724850176,lossguide,0.0007798600446298963,0.20591580061994683,4,3,5.8326386965031745,200,tree,0.9538398517503488,0.7371965448879849,0.09684620706718301,oversample,0.7241964231278961,,6.0,0.7424767304800818,0.2300053776177216,weighted,0.23608999898330202,0.420488451655205,0.3731471207122777,0.5567616463138851,0.5572139303482587,0.715281812899477,0.7156549520766773,0.9538398517503488,0.7371965448879849,0.1,0.5356561914741366,0.5113685089958575,0.5567616463138851,0.5572139303482587,1.0,1.0,oversample,0.45718637576882903,0.4270433983789448,0.7241964231278961,0.3731471207122777,COMPLETE
512,0.7156549520766773,2025-11-26 19:37:26.940104,2025-11-26 19:38:06.324036,0 days 00:00:39.383932,0.0008821283772417327,dart,0.8945382272772225,1.7724759915301864,lossguide,0.057757654220457984,0.162299303498833,3,3,0.4340570429511317,300,forest,0.819983987908939,0.7543549456883007,0.0984304054616723,oversample,0.8162500872151954,,6.0,0.6900957564850573,0.44585061355065236,weighted,0.6265093061469604,0.21860421309205358,0.253974685149375,0.5567616463138851,0.5572139303482587,0.715281812899477,0.7156549520766773,0.819983987908939,0.7543549456883007,0.1,0.5098670392923668,0.5005218156771346,0.5567616463138851,0.5572139303482587,1.0,1.0,oversample,0.44138496990997866,0.44126079487417585,0.8162500872151954,0.253974685149375,COMPLETE
513,0.0,2025-11-26 19:38:06.486877,2025-11-26 19:38:44.047191,0 days 00:00:37.560314,13.817214881401974,dart,0.9825018242256089,5.024602073924534,lossguide,13.519941392970937,0.008288390561088993,9,4,4.289912666534774,600,tree,0.7983315146752272,0.25110802069255317,0.08142970807293683,undersample,0.9349739584963095,,10.0,0.8565339296741428,0.48526483755071775,weighted,0.23184411461154616,0.2796209626942193,0.5114445255900316,0.44323835368611486,0.4427860696517413,0.0,0.0,0.7983315146752272,0.25110802069255317,0.08,0.6330918551116838,0.612964570625733,0.0,0.0,0.0,0.0,undersample,0.6304365125416536,0.5992904567342769,0.9349739584963095,0.5114445255900316,COMPLETE
514,0.7156549520766773,2025-11-26 19:38:44.213384,2025-11-26 19:39:13.675915,0 days 00:00:29.462531,30.970466550835322,dart,0.6097012628177676,4.123475209818663,depthwise,0.8062780689058855,0.00011168467453841294,3,9,24.813371319218945,500,tree,0.8175836613391938,0.07760977009137307,0.04266396209261119,none,0.9054667865006708,1.7353842273421116,7.0,0.7529658878151505,0.14586360967990838,uniform,0.2149476569687527,0.623056505460077,0.5038663767452792,0.5567616463138851,0.5572139303482587,0.715281812899477,0.7156549520766773,0.8175836613391938,0.07760977009137307,0.05,0.5567616463138851,0.5572139303482587,0.5567616463138851,0.5572139303482587,1.0,1.0,none,0.5,0.5,0.9054667865006708,0.5038663767452792,COMPLETE
515,0.6740045322110716,2025-11-26 19:39:13.847217,2025-11-26 19:39:40.617040,0 days 00:00:26.769823,0.053506221536082685,dart,0.7336046783468785,2.4091378294161485,depthwise,0.001757510617309645,0.02270986044446714,2,7,0.4111453308775915,300,forest,0.986477002650811,0.6089621437789852,0.09354469578460158,oversample,0.8633419205072866,,5.0,0.7676193597607499,0.3026724821249119,weighted,0.39666580276033647,0.2915612452156948,0.4846901633203834,0.5187697874265038,0.5445499773857982,0.655663430420712,0.6740045322110716,0.986477002650811,0.6089621437789852,0.1,0.5148682130113571,0.5039153931644431,0.5449166218396988,0.5605815831987075,0.8229082047116165,0.8449675324675324,oversample,0.44892322485452346,0.4567060875794277,0.8633419205072866,0.4846901633203834,COMPLETE
516,0.7156549520766773,2025-11-26 19:39:40.789428,2025-11-26 19:39:51.951596,0 days 00:00:11.162168,36.28706180519147,dart,0.2808977752309144,2.236890897296525,depthwise,58.18757679795342,0.0011384431639883184,1,6,70.0747466957104,300,forest,0.5441720827962203,0.519269099026783,0.08187500112956228,none,0.7963528925602782,1.2711317320720423,12.0,0.7955838125610928,0.1086108661707609,weighted,0.12256195440700426,0.2803842375706886,0.06049352024382162,0.5567616463138851,0.5572139303482587,0.715281812899477,0.7156549520766773,0.5441720827962203,0.519269099026783,0.08,0.5567616463138851,0.5572139303482587,0.5567616463138851,0.5572139303482587,1.0,1.0,none,0.5,0.5,0.7963528925602782,0.06049352024382162,COMPLETE
517,0.7156549520766773,2025-11-26 19:39:52.116748,2025-11-26 19:40:24.815506,0 days 00:00:32.698758,4.042689531114544,dart,0.6959418217589683,0.36002571791427646,lossguide,0.00390998738314228,0.001087578827538918,3,11,0.41435090057337753,500,forest,0.9213556803184535,0.6936986829841677,0.09545564815440687,oversample,0.8136169682035219,,6.0,0.6836258792924949,0.4608219016974049,uniform,0.7698071211395311,0.2439540072407897,0.14614800546188708,0.5567616463138851,0.5572139303482587,0.715281812899477,0.7156549520766773,0.9213556803184535,0.6936986829841677,0.1,0.5504087480929283,0.5274151799229678,0.5567616463138851,0.5572139303482587,1.0,1.0,oversample,0.5255810772725011,0.49373656858973514,0.8136169682035219,0.14614800546188708,COMPLETE
518,0.7156549520766773,2025-11-26 19:40:24.981999,2025-11-26 19:41:57.937263,0 days 00:01:32.955264,0.4943782668619195,dart,0.8515832651669313,4.660596548750403,lossguide,0.000687457007675354,0.00044617385305668764,4,10,1.4288354794224432,900,tree,0.5096185692358763,0.05982317399759823,0.0955159786159557,none,0.9716324995229007,2.299745320005837,5.0,0.6700756115151848,0.20363364788781424,weighted,0.011400014392196999,0.30361670430546084,0.6691838090857526,0.5567616463138851,0.5572139303482587,0.715281812899477,0.7156549520766773,0.5096185692358763,0.05982317399759823,0.1,0.5567616463138851,0.5572139303482587,0.5567616463138851,0.5572139303482587,1.0,1.0,none,0.5,0.5,0.9716324995229007,0.6691838090857526,COMPLETE
519,0.7156549520766773,2025-11-26 19:41:58.110361,2025-11-26 19:42:34.732853,0 days 00:00:36.622492,8.560991722006827,dart,0.37582545072269874,5.265138788555626,lossguide,0.5976213182853595,0.00015070366065329124,0,8,2.1986579716506176,600,forest,0.666688372335231,0.20777403360760657,0.06691739503253889,none,0.8422609689003512,0.6338836688655932,6.0,0.8592512772907948,0.269919336292891,uniform,0.1539216274073471,0.9323163970157133,0.0843720701531386,0.5567616463138851,0.5572139303482587,0.715281812899477,0.7156549520766773,0.666688372335231,0.20777403360760657,0.08,0.5567616463138851,0.5572139303482587,0.5567616463138851,0.5572139303482587,1.0,1.0,none,0.5,0.5,0.8422609689003512,0.0843720701531386,COMPLETE
520,0.7156549520766773,2025-11-26 19:42:34.904975,2025-11-26 19:42:38.059963,0 days 00:00:03.154988,2.6064053053016067,gbtree,0.8741424071811933,1.425122243266725,lossguide,12.821573106923244,0.0040274743807772444,5,8,0.6732043102538994,500,,0.7863789295041085,0.38490031311008577,0.08922116779314151,none,0.530797118337736,1.6727100367452317,7.0,0.7027833591246353,,,,0.5913075647581053,0.20985236662896095,0.5567616463138851,0.5572139303482587,0.715281812899477,0.7156549520766773,0.7863789295041085,0.38490031311008577,0.08,0.4816040749098166,0.48329236425669597,0.5567616463138851,0.5572139303482587,1.0,1.0,none,0.42698610719673735,0.42351848228380407,0.530797118337736,0.20985236662896095,COMPLETE
521,0.7156549520766773,2025-11-26 19:42:38.234100,2025-11-26 19:42:39.268825,0 days 00:00:01.034725,0.00025805137643132375,gbtree,0.5282532643114602,8.354538943034479,depthwise,0.00022614138745978695,0.0002184124470300112,2,9,0.39636060253409316,1000,,0.7105081768364503,0.5338095284506801,0.05813364628546034,none,0.9244265451199454,1.1022721304798504,6.0,0.6290054623514859,,,,0.5663314616255879,0.2976975942421238,0.5567616463138851,0.5572139303482587,0.715281812899477,0.7156549520766773,0.7105081768364503,0.5338095284506801,0.05,0.4697329622178137,0.4633121375841973,0.5567616463138851,0.5572139303482587,1.0,1.0,none,0.35735298993683584,0.3335251316609846,0.9244265451199454,0.2976975942421238,COMPLETE
