number,value,datetime_start,datetime_complete,duration,params_alpha,params_booster,params_colsample_bytree,params_gamma,params_grow_policy,params_lambda,params_learning_rate,params_max_delta_step,params_max_depth,params_min_child_weight,params_n_estimators,params_normalize_type,params_params_feature_fraction,params_params_labeled_ratio,params_params_missing_rate,params_params_resampling,params_params_sample_rows,params_params_scale_pos_weight,params_params_selftrain_max_iter,params_params_selftrain_threshold,params_rate_drop,params_sample_type,params_skip_drop,params_subsample,params_user_attrs_decision_threshold,user_attrs_acc_test,user_attrs_acc_val,user_attrs_f1_test,user_attrs_f1_val,user_attrs_feature_fraction,user_attrs_labeled_ratio,user_attrs_missing_rate,user_attrs_pr_auc_test,user_attrs_pr_auc_val,user_attrs_prec_test,user_attrs_prec_val,user_attrs_rec_test,user_attrs_rec_val,user_attrs_resampling_strategy,user_attrs_roc_auc_test,user_attrs_roc_auc_val,user_attrs_sample_rows,user_attrs_user_attrs_decision_threshold,state
407,0.7156549520766773,2025-11-26 18:59:54.816962,2025-11-26 18:59:56.429170,0 days 00:00:01.612208,0.0341226378233446,gbtree,0.21310771954418492,6.54621581567429,depthwise,0.004807513259770818,0.16473420978169873,0,6,8.073603550103815,1000,,0.7051428851861918,0.26183231579039457,0.03213032461862388,none,0.8873349726226278,4.779078556282921,8.0,0.8104677385774219,,,,0.6685037889231296,0.43691196935109766,0.5567616463138851,0.5572139303482587,0.715281812899477,0.7156549520766773,0.7051428851861918,0.26183231579039457,0.02,0.5381787461371319,0.5258640736177591,0.5567616463138851,0.5572139303482587,1.0,1.0,none,0.47091878181004326,0.45126926827003433,0.8873349726226278,0.43691196935109766,COMPLETE
408,0.7156549520766773,2025-11-26 18:59:56.598004,2025-11-26 19:00:24.864163,0 days 00:00:28.266159,0.833508318607109,dart,0.40451013115762147,4.185043144107052,lossguide,0.3809726376925614,0.0001063106076447511,4,9,1.0880628188701618,500,forest,0.8136956513532981,0.5252331736957925,0.03784936745115407,none,0.7946995253828891,1.3573814052026627,5.0,0.7847418773872677,0.48676854324800783,uniform,0.6465334327595821,0.8229039380874575,0.205925519502123,0.5567616463138851,0.5572139303482587,0.715281812899477,0.7156549520766773,0.8136956513532981,0.5252331736957925,0.05,0.44408862317589787,0.43665250290687835,0.5567616463138851,0.5572139303482587,1.0,1.0,none,0.332638140552728,0.3149404540811589,0.7946995253828891,0.205925519502123,COMPLETE
409,0.7156549520766773,2025-11-26 19:00:25.036667,2025-11-26 19:00:45.648834,0 days 00:00:20.612167,0.23723452065850856,dart,0.5356878367315461,4.350754126571715,lossguide,0.019761679845042027,0.0004129749650151366,0,8,4.1158052019245535,400,forest,0.761438589316535,0.19557579129392563,0.05353415782870195,none,0.8245262928051345,2.1013847240167944,6.0,0.8849376979213326,0.16599197497696888,uniform,0.5040417159061058,0.4257719955106853,0.04788946124671392,0.5567616463138851,0.5572139303482587,0.715281812899477,0.7156549520766773,0.761438589316535,0.19557579129392563,0.05,0.5280032267780417,0.5593671323147984,0.5567616463138851,0.5572139303482587,1.0,1.0,none,0.46220842520598815,0.49924095950015257,0.8245262928051345,0.04788946124671392,COMPLETE
410,0.40233236151603496,2025-11-26 19:00:45.811544,2025-11-26 19:00:46.980027,0 days 00:00:01.168483,2.4422100460080456,gbtree,0.8895294869373715,1.2087578450187109,lossguide,35.0874299234407,0.009200939857080277,5,11,0.5194068215306198,800,,0.5852045922884065,0.5189512847104232,0.08540664529961874,oversample,0.6435210140297017,,7.0,0.7027991456493425,,,,0.7346072520579924,0.5792893611998521,0.555857078245138,0.5364088647670737,0.44141069397042093,0.40233236151603496,0.5852045922884065,0.5189512847104232,0.08,0.6842500606958704,0.6698348167168275,0.7362428842504743,0.7142857142857143,0.3151909017059301,0.2800324675324675,oversample,0.6064100863741109,0.5906545573935766,0.6435210140297017,0.5792893611998521,COMPLETE
411,0.7156549520766773,2025-11-26 19:00:47.143301,2025-11-26 19:00:58.828841,0 days 00:00:11.685540,0.013410738081914649,dart,0.6887532823413878,0.32917897082775555,depthwise,89.84268404907978,0.0066744974263403594,4,10,84.36414192444622,300,tree,0.869121261662262,0.29232757060207376,0.0694634977293461,none,0.693499068434862,0.6794793660998066,8.0,0.6786376487245925,0.02794452645192036,weighted,0.8915046481076505,0.9125693383546297,0.233166962763536,0.5567616463138851,0.5572139303482587,0.715281812899477,0.7156549520766773,0.869121261662262,0.29232757060207376,0.08,0.47171223322859607,0.4744858657989046,0.5567616463138851,0.5572139303482587,1.0,1.0,none,0.3557631094679951,0.36869386997068304,0.693499068434862,0.233166962763536,COMPLETE
412,0.7156549520766773,2025-11-26 19:00:58.992893,2025-11-26 19:01:09.996610,0 days 00:00:11.003717,7.788640736575971,dart,0.7574361949030556,9.847902936839025,lossguide,1.046244840163638,0.00039480922383172093,3,3,0.14824131429112347,300,forest,0.6577230088251479,0.4746230386473428,0.04518931374169357,none,0.6410833969626233,0.9908021680080334,12.0,0.6647213783402367,0.06826164287903673,weighted,0.18665209223072207,0.794380447908368,0.3854446222321933,0.5567616463138851,0.5572139303482587,0.715281812899477,0.7156549520766773,0.6577230088251479,0.4746230386473428,0.05,0.46236935865314194,0.45131727126742793,0.5567616463138851,0.5572139303482587,1.0,1.0,none,0.3128334355675657,0.2856889981826141,0.6410833969626233,0.3854446222321933,COMPLETE
413,0.7156549520766773,2025-11-26 19:01:10.156889,2025-11-26 19:02:22.234070,0 days 00:01:12.077181,2.5566928958772226,dart,0.9640156702022339,1.5047667031171903,lossguide,2.526200012237437,0.09142458410912224,4,7,62.53035512627025,800,forest,0.9618543174412867,0.8242626014404946,0.09687583018120621,oversample,0.8098059352936148,,9.0,0.7753111459183807,0.23106183810249456,uniform,0.24882939856657948,0.6790535017716292,0.393357485212105,0.5567616463138851,0.5572139303482587,0.715281812899477,0.7156549520766773,0.9618543174412867,0.8242626014404946,0.1,0.4964810964766839,0.4830297095074508,0.5567616463138851,0.5572139303482587,1.0,1.0,oversample,0.45557701553407715,0.43552425613201917,0.8098059352936148,0.393357485212105,COMPLETE
414,0.7156549520766773,2025-11-26 19:02:22.403731,2025-11-26 19:02:23.276763,0 days 00:00:00.873032,0.045371141284989744,gbtree,0.8568150769707759,2.8719139728187857,lossguide,5.434976507254374,0.00018688027709180518,3,4,1.561859962086839,400,,0.9181943150997905,0.3065691499570613,0.07014175478387603,oversample,0.9529281956350752,,8.0,0.706706245465235,,,,0.6834308882348001,0.3143369387873466,0.5567616463138851,0.5572139303482587,0.715281812899477,0.7156549520766773,0.9181943150997905,0.3065691499570613,0.08,0.6695087166023296,0.651823832292853,0.5567616463138851,0.5572139303482587,1.0,1.0,oversample,0.6246924683764652,0.6190089277423292,0.9529281956350752,0.3143369387873466,COMPLETE
415,0.7156549520766773,2025-11-26 19:02:23.448214,2025-11-26 19:02:24.120567,0 days 00:00:00.672353,3.2504797491550046,gbtree,0.44063173663698474,8.57020025720088,depthwise,0.16884559737216662,0.07366203551032852,5,3,0.3353951728201223,500,,0.8002366376610155,0.8476001520060166,0.08766883055738568,oversample,0.7698442957302158,,11.0,0.6184313823074635,,,,0.4259185426874581,0.07221496803817981,0.5567616463138851,0.5572139303482587,0.715281812899477,0.7156549520766773,0.8002366376610155,0.8476001520060166,0.08,0.5525784970938217,0.5660448793922578,0.5567616463138851,0.5572139303482587,1.0,1.0,oversample,0.49337480727465644,0.5062369002294947,0.7698442957302158,0.07221496803817981,COMPLETE
416,0.02384737678855326,2025-11-26 19:02:24.285663,2025-11-26 19:02:25.356830,0 days 00:00:01.071167,0.036815702006684235,gbtree,0.8156220657578716,2.9184376316561726,lossguide,0.27650969420020455,0.013882440709651962,8,6,29.20279913547962,900,,0.7441210102554714,0.7653973567583207,0.06510472525198753,oversample,0.9255041219986251,,9.0,0.8870344343482531,,,,0.6052334261971601,0.624112174410092,0.4423337856173677,0.4445952057892356,0.01752988047808765,0.02384737678855326,0.7441210102554714,0.7653973567583207,0.08,0.5630312713458369,0.5741466575945202,0.4583333333333333,0.5769230769230769,0.008935824532900082,0.012175324675324676,oversample,0.5367666075365971,0.5546944437074672,0.9255041219986251,0.624112174410092,COMPLETE
417,0.7156976744186047,2025-11-26 19:02:25.531188,2025-11-26 19:03:00.851845,0 days 00:00:35.320657,0.0008982550780528449,gbtree,0.5781143258108064,1.1097914611393462,lossguide,0.00021129673732520478,0.005401819022227771,4,12,0.2359271652473764,300,,0.9592767058273955,0.6647904632160971,0.05664759162460131,undersample,0.7227115774821292,,12.0,0.6364794878037489,,,,0.46624859318645157,0.16918421774730835,0.5567616463138851,0.5576662143826323,0.715281812899477,0.7156976744186047,0.9592767058273955,0.6647904632160971,0.05,0.562954329865778,0.548253192690078,0.5567616463138851,0.5575181159420289,1.0,0.9991883116883117,undersample,0.5205250418607736,0.5160530225647693,0.7227115774821292,0.16918421774730835,COMPLETE
418,0.7156549520766773,2025-11-26 19:03:01.016413,2025-11-26 19:03:04.468661,0 days 00:00:03.452248,0.00029328112506675524,gbtree,0.619508658975827,2.6967030269314343,lossguide,0.0001940058447184618,0.03224633928016847,1,12,0.1682989317161544,300,,0.9897588770660429,0.7188279261127937,0.048047093511473786,undersample,0.6879631815514218,,11.0,0.6572721336628986,,,,0.3836750716464208,0.15386068571930683,0.5567616463138851,0.5572139303482587,0.715281812899477,0.7156549520766773,0.9897588770660429,0.7188279261127937,0.05,0.5313249073751473,0.5250742381826005,0.5567616463138851,0.5572139303482587,1.0,1.0,undersample,0.5010096321225485,0.4848623031718026,0.6879631815514218,0.15386068571930683,COMPLETE
419,0.7156549520766773,2025-11-26 19:03:04.645616,2025-11-26 19:03:05.264870,0 days 00:00:00.619254,0.0009011224371422771,gbtree,0.30489671942127233,3.6750619756412215,depthwise,0.0010578415872199338,0.0033105531626143117,4,10,0.6243519021955506,300,,0.9005539026030271,0.52176912377193,0.03189566858818477,undersample,0.7262482055604969,,12.0,0.6623531353777617,,,,0.37284253724139976,0.18706369404356685,0.5567616463138851,0.5572139303482587,0.715281812899477,0.7156549520766773,0.9005539026030271,0.52176912377193,0.02,0.4458597985141758,0.4435099154339236,0.5567616463138851,0.5572139303482587,1.0,1.0,undersample,0.33727639715512525,0.3274034762479604,0.7262482055604969,0.18706369404356685,COMPLETE
420,0.7156549520766773,2025-11-26 19:03:05.457019,2025-11-26 19:03:06.380543,0 days 00:00:00.923524,2.269333240503953,gbtree,0.6255164390916179,5.982007507545865,lossguide,0.5810104257378317,0.0003629255864025879,0,7,0.9535464760124234,900,,0.8221508089026988,0.17095579046122386,0.03146880895744572,none,0.7365532668620018,1.7621051414730569,7.0,0.8223300722931394,,,,0.7512413824205766,0.2013643856605428,0.5567616463138851,0.5572139303482587,0.715281812899477,0.7156549520766773,0.8221508089026988,0.17095579046122386,0.02,0.48462614277973604,0.47060436635184927,0.5567616463138851,0.5572139303482587,1.0,1.0,none,0.37473225683449657,0.35618110183993745,0.7365532668620018,0.2013643856605428,COMPLETE
421,0.7123687281213535,2025-11-26 19:03:06.551919,2025-11-26 19:03:29.707866,0 days 00:00:23.155947,0.019558206101880114,gbtree,0.5628555099067725,0.9324594973455581,lossguide,0.0019050562718271155,0.002445799137229144,6,10,0.411811589410164,400,,0.9949728662102105,0.7439059761359192,0.04870786743396621,undersample,0.6917931399927288,,12.0,0.6260842754089585,,,,0.559340362829416,0.30348282234555557,0.5572139303482587,0.5540479421076436,0.7146604488487321,0.7123687281213535,0.9949728662102105,0.7439059761359192,0.05,0.5229528233342695,0.5401156044029183,0.5572727272727273,0.5560109289617486,0.9959382615759546,0.9910714285714286,undersample,0.46840299076576203,0.4897821790058766,0.6917931399927288,0.30348282234555557,COMPLETE
422,0.7156549520766773,2025-11-26 19:03:29.869265,2025-11-26 19:03:42.003604,0 days 00:00:12.134339,1.1657408921816326,dart,0.806775562917405,2.4363299271891705,lossguide,0.006585666098330944,0.0005810502666186841,6,7,0.7706413853691693,300,forest,0.7104720379835846,0.24269288090342928,0.08373867979185616,oversample,0.8308569429277187,,5.0,0.8092802695314065,0.3322697476914275,uniform,0.5513521840686667,0.587271913210974,0.2097257173994991,0.5567616463138851,0.5572139303482587,0.715281812899477,0.7156549520766773,0.7104720379835846,0.24269288090342928,0.08,0.48829453882915674,0.48929619719310186,0.5567616463138851,0.5572139303482587,1.0,1.0,oversample,0.3988826074702829,0.3798091910642983,0.8308569429277187,0.2097257173994991,COMPLETE
423,0.7156549520766773,2025-11-26 19:03:42.174490,2025-11-26 19:03:42.952517,0 days 00:00:00.778027,0.7473044220270877,gbtree,0.241268169915786,9.229729176787844,lossguide,2.337956363060904,0.16001911434999452,2,6,0.45292638469581925,600,,0.7686912299042853,0.9221320992089667,0.0847655964773298,undersample,0.701883562813359,,11.0,0.7119169007275999,,,,0.5674443332383721,0.05128444139678838,0.5567616463138851,0.5572139303482587,0.715281812899477,0.7156549520766773,0.7686912299042853,0.9221320992089667,0.08,0.4831050933607726,0.48492010106710065,0.5567616463138851,0.5572139303482587,1.0,1.0,undersample,0.38118296059284806,0.3702148528182747,0.701883562813359,0.05128444139678838,COMPLETE
424,0.0,2025-11-26 19:03:43.121850,2025-11-26 19:04:28.129043,0 days 00:00:45.007193,12.205784701216077,dart,0.8867672183900974,5.762410752965138,depthwise,0.1798410614903684,0.005969204668270553,4,11,55.611223745015984,600,forest,0.8594738493191122,0.9227894044869469,0.09974361818190979,oversample,0.7995971882253807,,12.0,0.9169174394739124,0.358096680485274,weighted,0.7871655581088496,0.869928971097114,0.7098966685452539,0.44323835368611486,0.4427860696517413,0.0,0.0,0.8594738493191122,0.9227894044869469,0.1,0.4744037443191779,0.47198731132040755,0.0,0.0,0.0,0.0,oversample,0.33633390805550495,0.3370997937200695,0.7995971882253807,0.7098966685452539,COMPLETE
425,0.7156549520766773,2025-11-26 19:04:28.299984,2025-11-26 19:04:29.524917,0 days 00:00:01.224933,0.036109486489857644,gbtree,0.9015525321693024,0.4869328190518307,lossguide,98.67030582179723,0.011333686166491138,0,3,1.8488260476733727,800,,0.5741783482889422,0.217790625068274,0.08353063851258827,none,0.9102173106699205,2.779240238010248,11.0,0.9396244391049338,,,,0.9377021261594387,0.3064522869411735,0.5567616463138851,0.5572139303482587,0.715281812899477,0.7156549520766773,0.5741783482889422,0.217790625068274,0.08,0.5178263940294523,0.4995075809411007,0.5567616463138851,0.5572139303482587,1.0,1.0,none,0.4687295876921037,0.44263253982993517,0.9102173106699205,0.3064522869411735,COMPLETE
426,0.0,2025-11-26 19:04:29.697504,2025-11-26 19:04:30.788907,0 days 00:00:01.091403,0.2023266378993172,gbtree,0.9952274007221574,1.2972443355334728,lossguide,3.8310305882479776,0.0002158316209369388,5,5,1.93954736352509,300,,0.9636002542965446,0.4121538916624433,0.05322831826282011,undersample,0.9878293849181282,,7.0,0.6156705969862055,,,,0.3139252998387462,0.5307568394086882,0.44323835368611486,0.4427860696517413,0.0,0.0,0.9636002542965446,0.4121538916624433,0.05,0.49721352222583814,0.4794902730723671,0.0,0.0,0.0,0.0,undersample,0.4251276546361843,0.39923706273297693,0.9878293849181282,0.5307568394086882,COMPLETE
427,0.7156549520766773,2025-11-26 19:04:30.958460,2025-11-26 19:05:22.680068,0 days 00:00:51.721608,0.028399671585526063,dart,0.4957624156766883,8.769977673813251,lossguide,0.032807276670037515,0.00044020751541952864,1,8,0.3007950500949855,700,tree,0.5543385343706828,0.1040135311167876,0.06734636730334423,none,0.9226378590156673,0.6637117893513667,10.0,0.6101414866417533,0.40824430456566607,weighted,0.012607385256969805,0.47930172925264014,0.06615852097780416,0.5567616463138851,0.5572139303482587,0.715281812899477,0.7156549520766773,0.5543385343706828,0.1040135311167876,0.08,0.5567616463138851,0.5572139303482587,0.5567616463138851,0.5572139303482587,1.0,1.0,none,0.5,0.5,0.9226378590156673,0.06615852097780416,COMPLETE
428,0.7156549520766773,2025-11-26 19:05:22.856041,2025-11-26 19:05:23.471840,0 days 00:00:00.615799,2.6411113293921047,gbtree,0.2735446775798906,5.408682321306385,lossguide,0.025448462638875895,0.4236762151261403,6,4,0.4631620278952366,400,,0.5062757393785903,0.505463921519051,0.0024517504634666894,oversample,0.6232845019846609,,9.0,0.6758344533008416,,,,0.9034057064841962,0.23631301639435062,0.5567616463138851,0.5572139303482587,0.715281812899477,0.7156549520766773,0.5062757393785903,0.505463921519051,0.0,0.5332811169686568,0.5307297206535886,0.5567616463138851,0.5572139303482587,1.0,1.0,oversample,0.42299441303735147,0.4128032016502394,0.6232845019846609,0.23631301639435062,COMPLETE
429,0.7156549520766773,2025-11-26 19:05:23.647466,2025-11-26 19:05:27.648845,0 days 00:00:04.001379,0.0012875197359868936,gbtree,0.6414425976256843,1.7019326209778964,lossguide,0.0023266827777130494,0.0008693739229708077,4,11,0.12256071517475751,400,,0.9104044690747524,0.3808813221325607,0.07114618158389838,undersample,0.7972864571325629,,11.0,0.7171714469229913,,,,0.4910972087601795,0.2331242800328399,0.5567616463138851,0.5572139303482587,0.715281812899477,0.7156549520766773,0.9104044690747524,0.3808813221325607,0.08,0.5775193439884942,0.552372977117568,0.5567616463138851,0.5572139303482587,1.0,1.0,undersample,0.5458690462375039,0.5000878845363013,0.7972864571325629,0.2331242800328399,COMPLETE
430,0.7156549520766773,2025-11-26 19:05:27.819421,2025-11-26 19:05:53.188765,0 days 00:00:25.369344,2.741805746126124,dart,0.9000386478557073,9.843704856024784,lossguide,27.775685379782555,0.0009872640971907104,0,4,4.510369271000919,500,forest,0.6823399461651508,0.27926952192353716,0.0473523442561251,oversample,0.7158431694582175,,12.0,0.9202738374222588,0.30118429537645625,weighted,0.15604641928055957,0.34561408057306287,0.04961251667993017,0.5567616463138851,0.5572139303482587,0.715281812899477,0.7156549520766773,0.6823399461651508,0.27926952192353716,0.05,0.5567616463138851,0.5572139303482587,0.5567616463138851,0.5572139303482587,1.0,1.0,oversample,0.5,0.5,0.7158431694582175,0.04961251667993017,COMPLETE
431,0.7156549520766773,2025-11-26 19:05:53.363035,2025-11-26 19:07:12.471549,0 days 00:01:19.108514,0.015137656312321578,dart,0.34607797285248826,1.8013029225753696,lossguide,55.75092291204862,0.004689015156197023,1,8,0.3021619341427863,800,forest,0.9001214373265535,0.9225621027153249,0.025350852850060314,undersample,0.691971023689236,,6.0,0.7637114280004826,0.3939538229969968,uniform,0.7894553727570037,0.49711995665703596,0.04484132385107106,0.5567616463138851,0.5572139303482587,0.715281812899477,0.7156549520766773,0.9001214373265535,0.9225621027153249,0.02,0.5985387861805437,0.6057488201849959,0.5567616463138851,0.5572139303482587,1.0,1.0,undersample,0.5940963875395813,0.5842775393656394,0.691971023689236,0.04484132385107106,COMPLETE
432,0.012830793905372895,2025-11-26 19:07:12.640564,2025-11-26 19:07:38.340662,0 days 00:00:25.700098,1.0485815977044957,dart,0.9200852071630408,6.40751621799927,depthwise,0.07605010791660126,0.007835158949588597,4,5,0.8363134127244157,500,tree,0.797277654908989,0.7457411341856811,0.027487371494920008,oversample,0.7913806230149407,,8.0,0.8504117970692288,0.34577457482324214,weighted,0.29017496460010805,0.26482621630608427,0.5715331473078009,0.4468566259611036,0.44323835368611486,0.017670682730923693,0.012830793905372895,0.797277654908989,0.7457411341856811,0.02,0.5631308648670212,0.5592500471310332,0.7857142857142857,0.5333333333333333,0.008935824532900082,0.006493506493506494,oversample,0.4922744077322237,0.4926247462955839,0.7913806230149407,0.5715331473078009,COMPLETE
433,0.7156549520766773,2025-11-26 19:07:38.520927,2025-11-26 19:07:41.167309,0 days 00:00:02.646382,0.0012691179568996862,gbtree,0.5344448077445285,2.742864823971184,lossguide,0.0005257371393883808,0.010138052184201194,3,10,0.11576668148064331,300,,0.8649505145286267,0.6539429333712504,0.0972705176656061,none,0.7868967115872458,1.3895521253367513,11.0,0.6069316969663974,,,,0.71999701018366,0.08396285135900762,0.5567616463138851,0.5572139303482587,0.715281812899477,0.7156549520766773,0.8649505145286267,0.6539429333712504,0.1,0.5499489350065874,0.5466132157570414,0.5567616463138851,0.5572139303482587,1.0,1.0,none,0.5072439861403537,0.49903451374978447,0.7868967115872458,0.08396285135900762,COMPLETE
434,0.7156549520766773,2025-11-26 19:07:41.357714,2025-11-26 19:08:08.637314,0 days 00:00:27.279600,31.957293270896216,dart,0.633430549202,3.298420409245418,lossguide,5.186652914575345,0.02067757993402263,10,8,13.08830982167668,500,forest,0.8022398003190229,0.24508943398352978,0.04068042379096294,undersample,0.9453591057301396,,10.0,0.94141480770188,0.36316579419760875,weighted,0.43433475545925765,0.34229162682797704,0.3728936694198595,0.5567616463138851,0.5572139303482587,0.715281812899477,0.7156549520766773,0.8022398003190229,0.24508943398352978,0.05,0.5567616463138851,0.5572139303482587,0.5567616463138851,0.5572139303482587,1.0,1.0,undersample,0.5,0.5,0.9453591057301396,0.3728936694198595,COMPLETE
435,0.7156549520766773,2025-11-26 19:08:08.808913,2025-11-26 19:08:10.891054,0 days 00:00:02.082141,1.5914421744671898,gbtree,0.8160623406654754,3.543027758163733,lossguide,2.0753184714122,0.01255583714022621,5,10,4.591470652786747,700,,0.7065750557291327,0.19327563433358103,0.0949660326164773,none,0.8908282793305373,2.1490103496228774,6.0,0.784147265745222,,,,0.8419577023657372,0.27883659522187476,0.5567616463138851,0.5572139303482587,0.715281812899477,0.7156549520766773,0.7065750557291327,0.19327563433358103,0.1,0.5019678545684829,0.5051230863520532,0.5567616463138851,0.5572139303482587,1.0,1.0,none,0.42528680846831013,0.42940467346749267,0.8908282793305373,0.27883659522187476,COMPLETE
