number,value,datetime_start,datetime_complete,duration,params_alpha,params_booster,params_colsample_bytree,params_gamma,params_grow_policy,params_lambda,params_learning_rate,params_max_delta_step,params_max_depth,params_min_child_weight,params_n_estimators,params_normalize_type,params_params_feature_fraction,params_params_labeled_ratio,params_params_missing_rate,params_params_resampling,params_params_sample_rows,params_params_scale_pos_weight,params_params_selftrain_max_iter,params_params_selftrain_threshold,params_rate_drop,params_sample_type,params_skip_drop,params_subsample,params_user_attrs_decision_threshold,user_attrs_acc_test,user_attrs_acc_val,user_attrs_f1_test,user_attrs_f1_val,user_attrs_feature_fraction,user_attrs_labeled_ratio,user_attrs_missing_rate,user_attrs_pr_auc_test,user_attrs_pr_auc_val,user_attrs_prec_test,user_attrs_prec_val,user_attrs_rec_test,user_attrs_rec_val,user_attrs_resampling_strategy,user_attrs_roc_auc_test,user_attrs_roc_auc_val,user_attrs_sample_rows,user_attrs_user_attrs_decision_threshold,state
2362,0.7156549520766773,2025-11-30 13:45:55.344796,2025-11-30 13:45:55.896398,0 days 00:00:00.551602,3.746908875542772,gbtree,0.8028635187927655,7.3550554304397835,lossguide,0.24035119868994884,0.0006164619304095906,5,8,1.019937297176429,500,,0.5860526561171999,0.24319467098163478,0.0835053782511844,oversample,0.5310454761624103,,6.0,0.9268198278554118,,,,0.809571681633581,,0.5567616463138851,0.5572139303482587,0.715281812899477,0.7156549520766773,0.5860526561171999,0.24319467098163478,0.08,0.5023897557030648,0.5046036512382037,0.5567616463138851,0.5572139303482587,1.0,1.0,oversample,0.3863202307730566,0.3863503707732513,0.5310454761624103,0.5,COMPLETE
2363,0.7156549520766773,2025-11-30 13:45:56.677641,2025-11-30 13:45:57.055768,0 days 00:00:00.378127,0.12924912756951093,gbtree,0.6219607787318449,7.067345745006033,depthwise,99.96954389819174,0.0019786976940339897,6,6,3.0221294357290245,200,,0.6531378245727477,0.22012613535615422,0.027404842679220998,undersample,0.6302810088161634,,8.0,0.6854163030432867,,,,0.9542024936078555,,0.5567616463138851,0.5572139303482587,0.715281812899477,0.7156549520766773,0.6531378245727477,0.22012613535615422,0.08,0.5567616463138851,0.5572139303482587,0.5567616463138851,0.5572139303482587,1.0,1.0,undersample,0.5,0.5,0.6302810088161634,0.5,COMPLETE
2364,0.7156549520766773,2025-11-30 13:45:57.849744,2025-11-30 13:45:58.653602,0 days 00:00:00.803858,0.014304745276482933,gbtree,0.8494914872908124,9.700932119220377,depthwise,0.0740444066562092,0.0043577574363224455,5,8,0.9677104398046448,900,,0.5646535062368634,0.7585416486115311,0.0687497214665849,oversample,0.5481588261229194,,9.0,0.6908479516890411,,,,0.9261825581470091,,0.5567616463138851,0.5572139303482587,0.715281812899477,0.7156549520766773,0.5646535062368634,0.7585416486115311,0.08,0.5578691491569403,0.5542084619103582,0.5567616463138851,0.5572139303482587,1.0,1.0,oversample,0.49872138132263466,0.49148432007216475,0.5481588261229194,0.5,COMPLETE
2365,0.5831435079726651,2025-11-30 13:45:59.432086,2025-11-30 13:46:01.660449,0 days 00:00:02.228363,0.00010353296171482126,gbtree,0.6664103270272954,1.466541830127922,depthwise,0.5065676218291872,0.3938436351424474,6,11,0.11336924662510901,500,,0.8376365007167312,0.4180292634987069,0.023522474818799377,oversample,0.5512061962535609,,10.0,0.9328812332775067,,,,0.8063920139458762,,0.5119855269109,0.5033921302578019,0.5923687193048734,0.5831435079726651,0.8376365007167312,0.4180292634987069,0.08,0.5398380949533967,0.5355750507312426,0.5536723163841808,0.5477888730385164,0.6368805848903331,0.6233766233766234,oversample,0.4892765960974154,0.4748426369340568,0.5512061962535609,0.5,COMPLETE
2366,0.7156549520766773,2025-11-30 13:46:02.440265,2025-11-30 13:46:13.512514,0 days 00:00:11.072249,0.04218330978305251,dart,0.4127252431237205,5.874662404772718,lossguide,0.12670659661750633,0.00016808243983701474,6,6,0.27762810401224536,300,forest,0.9663854938518901,0.34537244301834635,0.08852820636230296,oversample,0.6818078078103968,,11.0,0.676005917286223,0.3407167495406554,uniform,0.6709474517612519,0.7735699117358958,,0.5567616463138851,0.5572139303482587,0.715281812899477,0.7156549520766773,0.9663854938518901,0.34537244301834635,0.08,0.6212133548020087,0.6223178771123409,0.5567616463138851,0.5572139303482587,1.0,1.0,oversample,0.5998947263714585,0.6028137146306196,0.6818078078103968,0.5,COMPLETE
2367,0.615884476534296,2025-11-30 13:46:14.296124,2025-11-30 13:46:17.203817,0 days 00:00:02.907693,0.008689739502450649,gbtree,0.8586332285849283,1.2708861207970024,depthwise,0.01695182525092501,0.12055838607622978,7,6,2.339553476429963,400,,0.5170520949902195,0.4447968583333658,0.09358360142997617,none,0.6693547043567267,1.1457788420050645,7.0,0.941719286227539,,,,0.2608813632709761,,0.527363184079602,0.5187697874265038,0.6201381315885133,0.615884476534296,0.5170520949902195,0.4447968583333658,0.1,0.5773386181866562,0.5601552658536448,0.5611842105263158,0.5546163849154746,0.6929325751421609,0.6923701298701299,none,0.515204993451483,0.49350732260589253,0.6693547043567267,0.5,COMPLETE
2368,0.7156549520766773,2025-11-30 13:46:17.985192,2025-11-30 13:46:18.419955,0 days 00:00:00.434763,1.0446369238318007,gbtree,0.9515648143299356,9.698255037310616,lossguide,0.004888610865118554,0.00011325552896536072,0,5,2.824464317377023,300,,0.7783830378417733,0.5256821688510923,0.07426521103683334,oversample,0.6566933357014917,,10.0,0.7447449111866629,,,,0.8754248915290903,,0.5567616463138851,0.5572139303482587,0.715281812899477,0.7156549520766773,0.7783830378417733,0.5256821688510923,0.08,0.5567616463138851,0.5572139303482587,0.5567616463138851,0.5572139303482587,1.0,1.0,oversample,0.5,0.5,0.6566933357014917,0.5,COMPLETE
2369,0.7156549520766773,2025-11-30 13:46:19.208033,2025-11-30 13:46:19.936122,0 days 00:00:00.728089,4.875828043465182,gbtree,0.6028112847391238,2.3016157765452103,depthwise,0.21206525193669795,0.0005455071900686421,9,6,31.498479752444577,500,,0.6806179056706443,0.7275457494439788,0.03727027081362557,none,0.701493123152866,1.8256251811782702,11.0,0.8653998177968885,,,,0.22063558479924802,,0.5567616463138851,0.5572139303482587,0.715281812899477,0.7156549520766773,0.6806179056706443,0.7275457494439788,0.08,0.4278357299689628,0.4194851554899045,0.5567616463138851,0.5572139303482587,1.0,1.0,none,0.30902451963726185,0.2846202890572145,0.701493123152866,0.5,COMPLETE
2370,0.7147426577493458,2025-11-30 13:46:20.729313,2025-11-30 13:46:22.569010,0 days 00:00:01.839697,0.00016227962100047572,gbtree,0.2017425860764071,5.302157678808871,depthwise,0.0009941935560527505,0.2411662736953105,4,5,1.607344672775449,900,,0.8553142402049936,0.4927939248394852,0.015004428264856585,none,0.8043169299441952,3.5913614918409134,6.0,0.7270925198934554,,,,0.2734038756834596,,0.5554047942107644,0.5563093622795116,0.7141610933410876,0.7147426577493458,0.8553142402049936,0.4927939248394852,0.08,0.5220540357799592,0.5330165780269757,0.5561594202898551,0.5568645219755324,0.9975629569455727,0.997564935064935,none,0.4657218289427875,0.4828376424392768,0.8043169299441952,0.5,COMPLETE
2371,0.7156549520766773,2025-11-30 13:46:23.342618,2025-11-30 13:46:50.617639,0 days 00:00:27.275021,0.0012731996590265538,dart,0.8549060490805178,8.020842826887446,depthwise,0.0740110936779646,0.0014035631843439616,4,3,0.2518942408801104,500,forest,0.5069156862308404,0.8483762574967861,0.05379903722625175,none,0.540836501695245,2.0890951858530955,5.0,0.6375763263240379,0.37225114540502474,uniform,0.495286234475514,0.3291451743947268,,0.5567616463138851,0.5572139303482587,0.715281812899477,0.7156549520766773,0.5069156862308404,0.8483762574967861,0.08,0.5904517289951767,0.5995299290520172,0.5567616463138851,0.5572139303482587,1.0,1.0,none,0.5322962084915202,0.5210703175782339,0.540836501695245,0.5,COMPLETE
2372,0.7156549520766773,2025-11-30 13:46:51.398155,2025-11-30 13:48:41.313641,0 days 00:01:49.915486,1.4776136497690422,dart,0.6166728258434653,5.363473283730771,depthwise,0.004131582976843875,0.0095487679520572,5,7,2.1342288833848326,1000,tree,0.8288732922004887,0.5622646640593627,0.09808588710857735,none,0.8852079359737792,0.9798153179320304,8.0,0.8317795926001293,0.4210566304932098,weighted,0.5258884921667595,0.7679428682906597,,0.5567616463138851,0.5572139303482587,0.715281812899477,0.7156549520766773,0.8288732922004887,0.5622646640593627,0.1,0.44019832594163555,0.4349108639156713,0.5567616463138851,0.5572139303482587,1.0,1.0,none,0.3016711152373216,0.29438210538185,0.8852079359737792,0.5,COMPLETE
2373,0.5006564551422319,2025-11-30 13:48:42.091445,2025-11-30 13:49:31.043779,0 days 00:00:48.952334,2.1511445607258675,dart,0.6741239230906744,2.3383749483744696,lossguide,3.8855461006109664,0.0011282559324019162,3,9,8.64872979871939,600,forest,0.7023529331417382,0.8477524423398421,0.03094495362992712,undersample,0.9443217509648885,,8.0,0.665555815437741,0.010130574823940641,weighted,0.4532535438588191,0.2941986457943491,,0.48258706467661694,0.4839439167797377,0.5004366812227075,0.5006564551422319,0.7023529331417382,0.8477524423398421,0.08,0.5093925507466172,0.5197118190044377,0.5410764872521246,0.5432098765432098,0.4654752233956133,0.4642857142857143,undersample,0.45301397569588353,0.46504807118315794,0.9443217509648885,0.5,COMPLETE
2374,0.7156549520766773,2025-11-30 13:49:31.788817,2025-11-30 13:50:20.372584,0 days 00:00:48.583767,0.0005019254924437858,dart,0.8789833916375811,2.6202118844280853,lossguide,7.488848570480625,0.030145568568685294,10,11,62.072980317355814,500,forest,0.677458908578682,0.3406518762811752,0.09894057680301244,none,0.8016079282808098,3.8462087867064003,9.0,0.7841158854607415,0.09246695125799731,weighted,0.5563268624437879,0.8415440787408346,,0.5567616463138851,0.5572139303482587,0.715281812899477,0.7156549520766773,0.677458908578682,0.3406518762811752,0.1,0.4133347265741848,0.4114198457735543,0.5567616463138851,0.5572139303482587,1.0,1.0,none,0.25472073476019164,0.24774443508483346,0.8016079282808098,0.5,COMPLETE
2375,0.631404958677686,2025-11-30 13:50:21.194668,2025-11-30 13:50:24.202352,0 days 00:00:03.007684,0.016531717861143574,gbtree,0.21574780657313114,3.6625945108514557,depthwise,0.6438651820282896,0.2990314098475635,2,9,17.204727417367383,900,,0.6971759624610989,0.33397255070420473,0.02968920253769294,oversample,0.7140733309447374,,9.0,0.7029175383860716,,,,0.937252386476096,,0.5052012663952963,0.49570330167345095,0.6434159061277706,0.631404958677686,0.6971759624610989,0.33397255070420473,0.08,0.5264407944733186,0.51845810611971,0.5372890582471421,0.5326268823201339,0.80178716490658,0.7751623376623377,oversample,0.4099711533679271,0.3943068231564145,0.7140733309447374,0.5,COMPLETE
2376,0.7156549520766773,2025-11-30 13:50:24.979182,2025-11-30 13:51:41.864283,0 days 00:01:16.885101,0.00046933203527988544,dart,0.7427351316827244,9.177544728074384,depthwise,1.3760060920680328,0.05649374313558897,6,4,0.22147877545097713,800,tree,0.8571759370220513,0.3908116054382872,0.06345490613013686,oversample,0.573783254321286,,9.0,0.6408242941618432,0.21405681115638187,uniform,0.5107586017391824,0.8692622805308452,,0.5567616463138851,0.5572139303482587,0.715281812899477,0.7156549520766773,0.8571759370220513,0.3908116054382872,0.08,0.54694772819079,0.5493323572825226,0.5567616463138851,0.5572139303482587,1.0,1.0,oversample,0.4796875777118321,0.483757113672844,0.573783254321286,0.5,COMPLETE
2377,0.7156549520766773,2025-11-30 13:51:42.656006,2025-11-30 13:52:24.313604,0 days 00:00:41.657598,0.003619599277958967,dart,0.23793875899957576,1.2349014168125105,depthwise,13.163365505660629,0.00011358906323278095,3,10,2.7205212035251716,600,forest,0.7464530636484896,0.40648282156891846,0.011429768112828566,none,0.6720004429952845,3.436212742829457,7.0,0.8619511048147525,0.4053439034585939,uniform,0.5182006007123101,0.5232027475687807,,0.5567616463138851,0.5572139303482587,0.715281812899477,0.7156549520766773,0.7464530636484896,0.40648282156891846,0.08,0.5718878373234189,0.5901887294940216,0.5567616463138851,0.5572139303482587,1.0,1.0,none,0.5037019844493443,0.5249442845203826,0.6720004429952845,0.5,COMPLETE
2378,0.7156549520766773,2025-11-30 13:52:25.121638,2025-11-30 13:52:25.507431,0 days 00:00:00.385793,0.06273235192819077,gbtree,0.6232486036103477,7.2498446884468315,depthwise,58.54295780766792,0.03906722413146843,5,11,1.41136569187017,200,,0.5735542357283524,0.6496742389643995,0.028928197349516873,undersample,0.75036523051351,,8.0,0.6011964013216079,,,,0.5906282852312026,,0.5567616463138851,0.5572139303482587,0.715281812899477,0.7156549520766773,0.5735542357283524,0.6496742389643995,0.08,0.5567616463138851,0.5572139303482587,0.5567616463138851,0.5572139303482587,1.0,1.0,undersample,0.5,0.5,0.75036523051351,0.5,COMPLETE
2379,0.4407561088059013,2025-11-30 13:52:26.336929,2025-11-30 13:54:04.697225,0 days 00:01:38.360296,0.01662820282197617,dart,0.45292259862864603,4.845471479506448,lossguide,0.004767835806928716,0.07372840153134867,10,10,62.350706264096054,900,tree,0.5722046312927442,0.6483527970436168,0.001426712722868484,undersample,0.9429199313267016,,8.0,0.643220370246265,0.32146404577881704,uniform,0.7288144522255442,0.5428990736776542,,0.45454545454545453,0.45137946630483944,0.43380281690140843,0.4407561088059013,0.5722046312927442,0.6483527970436168,0.08,0.538596387456497,0.5348739051009034,0.5139043381535039,0.5101387406616862,0.3753046303818034,0.387987012987013,undersample,0.4776297683980172,0.46736706220235336,0.9429199313267016,0.5,COMPLETE
2380,0.0,2025-11-30 13:54:05.479526,2025-11-30 13:54:06.109463,0 days 00:00:00.629937,0.09509103946289595,gbtree,0.4142461329746569,9.075651158169935,depthwise,0.07934548646186818,0.0014064425512405332,7,12,0.3349883563303602,600,,0.7275347460993711,0.5450424148044261,0.03838588355861747,undersample,0.7353218090051021,,5.0,0.6000888449492083,,,,0.9628500745889892,,0.44323835368611486,0.4427860696517413,0.0,0.0,0.7275347460993711,0.5450424148044261,0.08,0.5567616463138851,0.5572139303482587,0.0,0.0,0.0,0.0,undersample,0.5,0.5,0.7353218090051021,0.5,COMPLETE
2381,0.0,2025-11-30 13:54:06.881744,2025-11-30 13:54:07.617241,0 days 00:00:00.735497,29.135693917470327,gbtree,0.34033597277572436,3.4732818812409905,depthwise,68.48393669904165,0.032568582026007334,9,10,4.300483706092577,800,,0.5346404823689244,0.46396718088845107,0.04858198982665251,undersample,0.6817069376992977,,10.0,0.7596939866393138,,,,0.5794519452727993,,0.44323835368611486,0.4427860696517413,0.0,0.0,0.5346404823689244,0.46396718088845107,0.08,0.5567616463138851,0.5572139303482587,0.0,0.0,0.0,0.0,undersample,0.5,0.5,0.6817069376992977,0.5,COMPLETE
2382,0.7156549520766773,2025-11-30 13:54:08.391367,2025-11-30 13:54:09.132229,0 days 00:00:00.740862,16.093020368349343,gbtree,0.7936970574823292,3.3313122503113233,lossguide,0.0024983225238779747,0.12311860080472813,2,3,0.5249501694446465,700,,0.8057945529845464,0.8275378376529705,0.08336702063047016,none,0.7586107894966554,2.41722822469725,11.0,0.9239313193164288,,,,0.44054759674433774,,0.5567616463138851,0.5572139303482587,0.715281812899477,0.7156549520766773,0.8057945529845464,0.8275378376529705,0.08,0.5061336908767853,0.5105077997107617,0.5567616463138851,0.5572139303482587,1.0,1.0,none,0.41481954276430316,0.4164665773450247,0.7586107894966554,0.5,COMPLETE
2383,0.7156549520766773,2025-11-30 13:54:09.918594,2025-11-30 13:56:24.193756,0 days 00:02:14.275162,0.029798021949451404,dart,0.9867964099028621,6.995192226288048,lossguide,1.5088817325549266,0.0017196943207577942,0,7,76.91168477522524,1000,tree,0.7875989430122602,0.33016734328769626,0.051880338386677105,oversample,0.7438664348471125,,12.0,0.9343624884785663,0.007161473707492427,uniform,0.008944546707179169,0.27481007768656496,,0.5567616463138851,0.5572139303482587,0.715281812899477,0.7156549520766773,0.7875989430122602,0.33016734328769626,0.08,0.5567616463138851,0.5572139303482587,0.5567616463138851,0.5572139303482587,1.0,1.0,oversample,0.5,0.5,0.7438664348471125,0.5,COMPLETE
2384,0.49784296807592754,2025-11-30 13:56:24.975089,2025-11-30 13:56:28.096326,0 days 00:00:03.121237,0.21046461478627318,gbtree,0.9514820422608607,1.162821254650872,depthwise,0.0004542279689450614,0.019552056651839015,6,10,0.10401198067925232,700,,0.8481612043284564,0.27860547535167235,0.07712115591828013,undersample,0.5341573437557506,,6.0,0.7728588629995273,,,,0.7565880225389232,,0.4681139755766621,0.4735413839891452,0.4900260190806591,0.49784296807592754,0.8481612043284564,0.27860547535167235,0.08,0.5394480177392107,0.5305676787631279,0.5255813953488372,0.5313075506445673,0.45897644191714054,0.46834415584415584,undersample,0.4729604270627829,0.47439409415916056,0.5341573437557506,0.5,COMPLETE
2385,0.7149505526468877,2025-11-30 13:56:28.879566,2025-11-30 13:56:32.289143,0 days 00:00:03.409577,2.6050185839656828,gbtree,0.8471546991609713,3.872128540644427,depthwise,0.00012805994446804308,0.14678858782330853,10,4,15.956235930397671,1000,,0.70811426574358,0.8852005340920728,0.06045899677506547,none,0.8964509594234988,2.1672063183315693,6.0,0.6221707587951277,,,,0.278518347351534,,0.5549525101763908,0.5567616463138851,0.7137870855148342,0.7149505526468877,0.70811426574358,0.8852005340920728,0.08,0.5750073365264134,0.5743134078405006,0.55595831445401,0.557116953762466,0.9967506092607636,0.997564935064935,none,0.5265919527843631,0.5297621811283711,0.8964509594234988,0.5,COMPLETE
2386,0.7156549520766773,2025-11-30 13:56:33.033006,2025-11-30 13:56:33.468821,0 days 00:00:00.435815,0.7110352967777558,gbtree,0.7667351995933493,9.200805449433547,depthwise,0.2637473763492446,0.00019152753214802032,2,6,7.9750490426339775,300,,0.6596454155073578,0.23588747322229503,0.0804973194003595,oversample,0.9683144373847976,,7.0,0.6597508267689214,,,,0.43424349498136516,,0.5567616463138851,0.5572139303482587,0.715281812899477,0.7156549520766773,0.6596454155073578,0.23588747322229503,0.08,0.4640714688348845,0.4637295216253497,0.5567616463138851,0.5572139303482587,1.0,1.0,oversample,0.33593395115966773,0.33793635501372987,0.9683144373847976,0.5,COMPLETE
2387,0.36024844720496896,2025-11-30 13:56:34.209380,2025-11-30 13:57:20.045870,0 days 00:00:45.836490,0.6678692223372463,dart,0.2831345004167113,3.8627736921801903,depthwise,11.149495736673352,0.1366810408429304,4,5,19.14255842667251,600,tree,0.8231583748906017,0.7114354029831671,0.008345433418587145,undersample,0.9368603330650318,,5.0,0.8475169642041729,0.029724010444878546,weighted,0.173589206560682,0.6987675346370805,,0.32202623247399365,0.3012211668928087,0.3953206938281565,0.36024844720496896,0.8231583748906017,0.7114354029831671,0.08,0.4232855812938159,0.4079385963168966,0.3926282051282051,0.36770921386306,0.3980503655564582,0.3530844155844156,undersample,0.25738614698519535,0.22838081861958265,0.9368603330650318,0.5,COMPLETE
2388,0.7156549520766773,2025-11-30 13:57:20.835542,2025-11-30 13:57:21.404633,0 days 00:00:00.569091,3.341790231209603,gbtree,0.5660412550717129,5.51227556101778,lossguide,0.00015414844634078646,0.00015602813434840242,6,12,38.475649525778444,400,,0.734113455632855,0.346576025000058,0.04169749626978672,none,0.9583455561095444,1.2894842689623207,10.0,0.6973302192719398,,,,0.8860016586870112,,0.5567616463138851,0.5572139303482587,0.715281812899477,0.7156549520766773,0.734113455632855,0.346576025000058,0.08,0.533788859241598,0.5525179287432211,0.5567616463138851,0.5572139303482587,1.0,1.0,none,0.43476930983603845,0.4430819117042304,0.9583455561095444,0.5,COMPLETE
2389,0.7156549520766773,2025-11-30 13:57:22.182405,2025-11-30 13:58:21.036718,0 days 00:00:58.854313,0.00023492692013772894,dart,0.700240163829551,3.6522975808848113,lossguide,0.749364447234611,0.0004168838296876391,1,6,0.9104566173985907,700,forest,0.5339560195273179,0.3728254318564287,0.018587606519209623,none,0.9442640622049719,3.0935123856474926,5.0,0.8978103079529847,0.2909202832042599,weighted,0.5121148288564411,0.8928920062587398,,0.5567616463138851,0.5572139303482587,0.715281812899477,0.7156549520766773,0.5339560195273179,0.3728254318564287,0.08,0.5771341157269942,0.558445667063847,0.5567616463138851,0.5572139303482587,1.0,1.0,none,0.4762367579038114,0.47777018691216855,0.9442640622049719,0.5,COMPLETE
2390,0.20182440136830102,2025-11-30 13:58:21.831589,2025-11-30 13:58:22.411808,0 days 00:00:00.580219,0.0007729939191256873,gbtree,0.9916030433062943,6.880821119954666,depthwise,0.020593054913263013,0.0009198301754880285,3,8,5.915307605351396,500,,0.8423404256486486,0.27819667618681887,0.037996764754209926,undersample,0.9697346198670382,,6.0,0.8212493392157683,,,,0.955963494933532,,0.3749434644957033,0.36680235187697874,0.21387940841865757,0.20182440136830102,0.8423404256486486,0.27819667618681887,0.08,0.526971689359099,0.5248678962999601,0.3567362428842505,0.3390804597701149,0.15272136474411047,0.14366883116883117,undersample,0.4039224788209354,0.3946753578393007,0.9697346198670382,0.5,COMPLETE
2391,0.7156549520766773,2025-11-30 13:58:23.233335,2025-11-30 13:59:37.616121,0 days 00:01:14.382786,0.00024751044803648367,dart,0.3996050438579249,6.377241128336434,lossguide,0.00013042400676584873,0.00046354776396754203,7,8,18.39473445557537,800,forest,0.9414027086689976,0.32310068223898475,0.07833947504052113,oversample,0.6511607477476746,,7.0,0.703049070784074,0.43600158935806177,uniform,0.7337830638760869,0.27369359520188974,,0.5567616463138851,0.5572139303482587,0.715281812899477,0.7156549520766773,0.9414027086689976,0.32310068223898475,0.08,0.37471836215543863,0.373675605873242,0.5567616463138851,0.5572139303482587,1.0,1.0,oversample,0.13510626833999237,0.1292383561280395,0.6511607477476746,0.5,COMPLETE
