number,value,datetime_start,datetime_complete,duration,params_alpha,params_booster,params_colsample_bytree,params_gamma,params_grow_policy,params_lambda,params_learning_rate,params_max_delta_step,params_max_depth,params_min_child_weight,params_n_estimators,params_normalize_type,params_params_feature_fraction,params_params_labeled_ratio,params_params_missing_rate,params_params_resampling,params_params_sample_rows,params_params_scale_pos_weight,params_params_selftrain_max_iter,params_params_selftrain_threshold,params_rate_drop,params_sample_type,params_skip_drop,params_subsample,params_user_attrs_decision_threshold,user_attrs_acc_test,user_attrs_acc_val,user_attrs_f1_test,user_attrs_f1_val,user_attrs_feature_fraction,user_attrs_labeled_ratio,user_attrs_missing_rate,user_attrs_pr_auc_test,user_attrs_pr_auc_val,user_attrs_prec_test,user_attrs_prec_val,user_attrs_rec_test,user_attrs_rec_val,user_attrs_resampling_strategy,user_attrs_roc_auc_test,user_attrs_roc_auc_val,user_attrs_sample_rows,user_attrs_user_attrs_decision_threshold,state
724,0.012789768185451638,2025-11-26 21:07:52.550777,2025-11-26 21:07:53.528038,0 days 00:00:00.977261,1.4546554475877107,gbtree,0.2737841092349955,5.647198723147783,depthwise,0.0007337979165033484,0.11615748704590213,2,4,4.3913473102101355,900,,0.7766833874458076,0.838154246005935,0.01868216795844669,oversample,0.9195505989127494,,9.0,0.779585038857471,,,,0.504428465087194,0.6448572941446589,0.4414292175486205,0.4414292175486205,0.012789768185451638,0.012789768185451638,0.7766833874458076,0.838154246005935,0.02,0.5019417182654897,0.5079370877810033,0.4,0.42105263157894735,0.006498781478472786,0.006493506493506494,oversample,0.43085346242477496,0.43304317618030586,0.9195505989127494,0.6448572941446589,COMPLETE
725,0.7156549520766773,2025-11-26 21:07:53.694440,2025-11-26 21:08:56.348580,0 days 00:01:02.654140,5.651556689800692,dart,0.9389080680087006,4.012865926734046,lossguide,1.704518834123194,0.0008197707456924676,10,7,1.6455273566757176,700,forest,0.879421528724552,0.21843932797838864,0.07303225918568446,none,0.9668206013776193,2.258612095678477,9.0,0.8994623945578993,0.22232969075769152,weighted,0.8301072965300664,0.4872010349953685,0.41445541486744464,0.5567616463138851,0.5572139303482587,0.715281812899477,0.7156549520766773,0.879421528724552,0.21843932797838864,0.08,0.4819748058261336,0.4899191913367005,0.5567616463138851,0.5572139303482587,1.0,1.0,none,0.4207650159982758,0.43759285913269574,0.9668206013776193,0.41445541486744464,COMPLETE
726,0.6608985024958403,2025-11-26 21:08:56.517988,2025-11-26 21:09:14.937150,0 days 00:00:18.419162,0.022155020686383524,dart,0.8798955240952205,2.5449027889395563,depthwise,0.031113699097447663,0.1671353800326173,3,3,1.3432549759451209,200,tree,0.9232533498981234,0.8445808449178571,0.07366911194889139,undersample,0.707494163889389,,6.0,0.7929367515009725,0.21186452817250903,weighted,0.6330701756431381,0.26050951864831184,0.40006405197404327,0.5260063319764813,0.5391225689733152,0.6464237516869096,0.6608985024958403,0.9232533498981234,0.8445808449178571,0.08,0.5323333553057659,0.5298545853644585,0.552798615118292,0.560067681895093,0.7782290820471162,0.8060064935064936,undersample,0.4787977254264826,0.48217436292002175,0.707494163889389,0.40006405197404327,COMPLETE
727,0.7156549520766773,2025-11-26 21:09:15.111742,2025-11-26 21:09:20.235551,0 days 00:00:05.123809,0.004332742519411108,dart,0.8485693844509651,7.037008594779885,lossguide,37.75351694135861,0.002299877725206931,7,6,1.6235048632136606,200,tree,0.90446037866375,0.9123166543628453,0.09616401881758078,oversample,0.8015061606389484,,12.0,0.7743142905359462,0.1338253742518848,weighted,0.1529711991702361,0.8772657894605189,0.36888866056567854,0.5567616463138851,0.5572139303482587,0.715281812899477,0.7156549520766773,0.90446037866375,0.9123166543628453,0.1,0.49371501364569104,0.4936173158155917,0.5567616463138851,0.5572139303482587,1.0,1.0,oversample,0.32846201031184197,0.33039818327739673,0.8015061606389484,0.36888866056567854,COMPLETE
728,0.7156549520766773,2025-11-26 21:09:20.404254,2025-11-26 21:09:33.028638,0 days 00:00:12.624384,0.0005719762391002097,dart,0.46102222302211204,1.651414282135346,lossguide,8.84678840723761,0.004672834639240697,10,12,0.29317771792055497,300,forest,0.884451572910872,0.341620429784513,0.07767096910849723,undersample,0.6487668245632187,,12.0,0.6407081898192547,0.09756548034205144,weighted,0.7711260354909897,0.4064716005995699,0.35425045746261946,0.5567616463138851,0.5572139303482587,0.715281812899477,0.7156549520766773,0.884451572910872,0.341620429784513,0.08,0.5816587155102118,0.5634995444666722,0.5567616463138851,0.5572139303482587,1.0,1.0,undersample,0.5569078565626089,0.5171196589416712,0.6487668245632187,0.35425045746261946,COMPLETE
729,0.0,2025-11-26 21:09:33.196386,2025-11-26 21:09:34.060921,0 days 00:00:00.864535,0.32561543601012116,gbtree,0.849265314402576,8.337221769977461,depthwise,0.00021544402999397683,0.037868162422168394,6,3,0.25641588218685374,700,,0.9635457229668165,0.8967015926227676,0.022365817751614094,oversample,0.9824839559054634,,9.0,0.8858085179810389,,,,0.41984796079522146,0.6377756666620163,0.44323835368611486,0.4427860696517413,0.0,0.0,0.9635457229668165,0.8967015926227676,0.02,0.4778184329991605,0.48966004191174617,0.0,0.0,0.0,0.0,oversample,0.3876150135114972,0.39723768953212263,0.9824839559054634,0.6377756666620163,COMPLETE
730,0.7156549520766773,2025-11-26 21:09:34.234880,2025-11-26 21:09:34.763243,0 days 00:00:00.528363,0.00973083624405556,gbtree,0.839268676972809,7.207168532641298,lossguide,1.4298433041569323,0.0036984074004629236,3,3,20.17167974059197,200,,0.6297304710142752,0.7312303918165549,0.07334020435399163,oversample,0.6074349221468023,,7.0,0.650096024477752,,,,0.7810052109992485,0.47619502415704773,0.5567616463138851,0.5572139303482587,0.715281812899477,0.7156549520766773,0.6297304710142752,0.7312303918165549,0.08,0.5129628091130818,0.5079329553938964,0.5567616463138851,0.5572139303482587,1.0,1.0,oversample,0.39280574943218555,0.3718332548452569,0.6074349221468023,0.47619502415704773,COMPLETE
731,0.7156549520766773,2025-11-26 21:09:34.934430,2025-11-26 21:10:35.741127,0 days 00:01:00.806697,0.08176781610383628,dart,0.855934601633075,1.2022333307985158,lossguide,0.7057407091051422,0.009077662650268669,7,9,6.505016304797838,700,tree,0.752691335519143,0.48578985881197023,0.07881829001962233,oversample,0.7137848912974535,,7.0,0.8251666302203108,0.2766649924010951,weighted,0.33242780707322106,0.9287309957675248,0.25961635101281344,0.5567616463138851,0.5572139303482587,0.715281812899477,0.7156549520766773,0.752691335519143,0.48578985881197023,0.08,0.5520847134050033,0.5421330227035692,0.5567616463138851,0.5572139303482587,1.0,1.0,oversample,0.47378189293589085,0.45766867198174654,0.7137848912974535,0.25961635101281344,COMPLETE
732,0.7156549520766773,2025-11-26 21:10:35.912945,2025-11-26 21:10:40.176487,0 days 00:00:04.263542,0.004479815442153573,dart,0.9918411014910276,6.9361549150332245,lossguide,0.002898067884041349,0.0036376003685015088,3,3,3.6898195838686285,200,forest,0.9280628671813161,0.6768653853768603,0.07889992798723636,undersample,0.692508289258447,,7.0,0.7163318194464865,0.3737038907795311,weighted,0.13734780868266033,0.2032080685199334,0.2936767367138499,0.5567616463138851,0.5572139303482587,0.715281812899477,0.7156549520766773,0.9280628671813161,0.6768653853768603,0.08,0.4775538082929075,0.46575456422861994,0.5567616463138851,0.5572139303482587,1.0,1.0,undersample,0.3947901987765049,0.3694027499568868,0.692508289258447,0.2936767367138499,COMPLETE
733,0.0,2025-11-26 21:10:40.370245,2025-11-26 21:10:45.015340,0 days 00:00:04.645095,0.00058269856749617,dart,0.9318250147054888,7.1513896624795965,lossguide,15.250272311619073,0.0048075945189274185,6,7,6.7315567080586005,200,tree,0.6847935975460936,0.8842397480124086,0.07380038585713054,undersample,0.5568724028494189,,10.0,0.6441212534524935,0.37273992689727425,weighted,0.3634279912568105,0.9560580452256762,0.8280436944131047,0.44323835368611486,0.4427860696517413,0.0,0.0,0.6847935975460936,0.8842397480124086,0.08,0.5567616463138851,0.5572139303482587,0.0,0.0,0.0,0.0,undersample,0.5,0.5,0.5568724028494189,0.8280436944131047,COMPLETE
734,0.7156549520766773,2025-11-26 21:10:45.194168,2025-11-26 21:11:41.396332,0 days 00:00:56.202164,0.0023615254878098318,dart,0.8798697017482956,1.548564215367821,depthwise,0.3270554954098233,0.0002343937238724297,0,12,38.85912452362138,700,forest,0.777182119205865,0.3184618468403879,0.005957991540090565,none,0.5991973288573896,0.6357599818154305,7.0,0.9341750155169851,0.494193435153465,uniform,0.6959226980704316,0.9289765653485385,0.13338145192943043,0.5567616463138851,0.5572139303482587,0.715281812899477,0.7156549520766773,0.777182119205865,0.3184618468403879,0.0,0.6121182264380671,0.5987269853287172,0.5567616463138851,0.5572139303482587,1.0,1.0,none,0.5740761617400819,0.5533973176976241,0.5991973288573896,0.13338145192943043,COMPLETE
735,0.7156549520766773,2025-11-26 21:11:41.571288,2025-11-26 21:11:46.335920,0 days 00:00:04.764632,0.0005638182159831101,dart,0.9934972267129033,7.457482464640399,lossguide,22.67550032922283,0.002491322773333024,5,3,4.035374360313744,200,tree,0.8322475865113466,0.5530160503231182,0.08095989298050402,oversample,0.543382935769061,,8.0,0.6980514146615684,0.2331743338445924,weighted,0.003982446598000759,0.8128336086527004,0.42617102202366186,0.5567616463138851,0.5572139303482587,0.715281812899477,0.7156549520766773,0.8322475865113466,0.5530160503231182,0.08,0.505466978718503,0.491704460992373,0.5567616463138851,0.5572139303482587,1.0,1.0,oversample,0.4161238581541471,0.37660513643659715,0.543382935769061,0.42617102202366186,COMPLETE
736,0.7156549520766773,2025-11-26 21:11:46.510563,2025-11-26 21:11:47.366003,0 days 00:00:00.855440,23.405638702790576,gbtree,0.2746491156750135,5.148228798225732,depthwise,0.0020191964281671593,0.2146310111402014,7,5,3.1889770687385806,700,,0.7455622865970859,0.3027512214124791,0.010298131339660668,none,0.921832763299095,0.9598281528330938,10.0,0.7752045009645525,,,,0.6129050935261935,0.5070665452984595,0.5567616463138851,0.5572139303482587,0.715281812899477,0.7156549520766773,0.7455622865970859,0.3027512214124791,0.02,0.5567616463138851,0.5572139303482587,0.5567616463138851,0.5572139303482587,1.0,1.0,none,0.5,0.5,0.921832763299095,0.5070665452984595,COMPLETE
737,0.7156549520766773,2025-11-26 21:11:47.539827,2025-11-26 21:12:29.600754,0 days 00:00:42.060927,0.01016291917769991,dart,0.849106641857289,2.012615549146086,lossguide,0.12369766673614763,0.1509468392957257,3,3,0.6664720964513496,300,forest,0.9350251547397461,0.7514460608062914,0.07597406855350068,none,0.7209586149744199,1.6194300087479643,7.0,0.7029190702207506,0.2870285592701071,weighted,0.31204419716740833,0.31712233707645077,0.3430072347719215,0.5567616463138851,0.5572139303482587,0.715281812899477,0.7156549520766773,0.9350251547397461,0.7514460608062914,0.08,0.5693111500714407,0.5802951388167872,0.5567616463138851,0.5572139303482587,1.0,1.0,none,0.5317375122266617,0.5635048684716714,0.7209586149744199,0.3430072347719215,COMPLETE
738,0.0,2025-11-26 21:12:29.778623,2025-11-26 21:12:30.616848,0 days 00:00:00.838225,0.0010032323437442299,gbtree,0.3402095565603387,6.989113353934185,lossguide,0.00047391093217492814,0.001469203586435559,9,8,0.9129261787884092,700,,0.9106977509679035,0.42544056963671917,0.03836297430814747,oversample,0.6543454001305278,,7.0,0.6485575897219562,,,,0.807973479909975,0.7997461630286276,0.44323835368611486,0.4427860696517413,0.0,0.0,0.9106977509679035,0.42544056963671917,0.05,0.602730986594232,0.5840677017254661,0.0,0.0,0.0,0.0,oversample,0.566982211243555,0.5371759879548439,0.6543454001305278,0.7997461630286276,COMPLETE
739,0.7156549520766773,2025-11-26 21:12:30.791066,2025-11-26 21:13:48.123925,0 days 00:01:17.332859,0.16680177510486835,dart,0.31030449089003653,5.814028458891071,lossguide,1.2596523911894566,0.001994337599361442,5,3,0.1992042718500107,800,forest,0.6822364690649159,0.06733504056839994,0.07722591651280283,oversample,0.9819031547480608,,9.0,0.6443374329184122,0.2208755958217219,uniform,0.6028667307409088,0.7567132504823283,0.11745426296035232,0.5567616463138851,0.5572139303482587,0.715281812899477,0.7156549520766773,0.6822364690649159,0.06733504056839994,0.08,0.7300327525467707,0.7085212352171094,0.5567616463138851,0.5572139303482587,1.0,1.0,oversample,0.7249154495266832,0.6898467658490641,0.9819031547480608,0.11745426296035232,COMPLETE
740,0.7156549520766773,2025-11-26 21:13:48.293320,2025-11-26 21:13:50.092704,0 days 00:00:01.799384,1.1086678187393186,gbtree,0.87014323706701,0.39428595336004046,lossguide,0.13287202102696116,0.0012416304978207413,5,8,0.7659726636849353,200,,0.7706139765373723,0.2739951872047186,0.09374393505431246,oversample,0.7652332230694182,,5.0,0.9141711003902327,,,,0.6798547832511239,0.29291175631896443,0.5567616463138851,0.5572139303482587,0.715281812899477,0.7156549520766773,0.7706139765373723,0.2739951872047186,0.1,0.5194105533288996,0.5233150125446957,0.5567616463138851,0.5572139303482587,1.0,1.0,oversample,0.45414214426631744,0.4617685685101416,0.7652332230694182,0.29291175631896443,COMPLETE
741,0.7156549520766773,2025-11-26 21:13:50.264123,2025-11-26 21:14:02.268279,0 days 00:00:12.004156,0.01026191485166099,dart,0.5896283179901622,9.75351955680947,lossguide,40.27210924657169,0.0007012979906933631,0,3,23.540010643821155,300,forest,0.6240207792845438,0.4704174547896418,0.02082720144910736,oversample,0.7457144207692737,,12.0,0.9385043148148335,0.050268369684525416,uniform,0.7225964792505127,0.40862913230216796,0.014905423915809762,0.5567616463138851,0.5572139303482587,0.715281812899477,0.7156549520766773,0.6240207792845438,0.4704174547896418,0.02,0.5567616463138851,0.5572139303482587,0.5567616463138851,0.5572139303482587,1.0,1.0,oversample,0.5,0.5,0.7457144207692737,0.014905423915809762,COMPLETE
742,0.7156549520766773,2025-11-26 21:14:02.439378,2025-11-26 21:14:03.330264,0 days 00:00:00.890886,0.08462912639544728,gbtree,0.5092301329746989,5.529512267116168,depthwise,0.0007072040161861098,0.2746527211471794,3,4,0.4026574765919399,800,,0.7556765072791736,0.09175528994458293,0.005462121063455296,none,0.9413355486372886,3.120335251132409,8.0,0.9228074978569475,,,,0.9699502725650639,0.3672091715940534,0.5567616463138851,0.5572139303482587,0.715281812899477,0.7156549520766773,0.7556765072791736,0.09175528994458293,0.0,0.5379745386910381,0.53501930468666,0.5567616463138851,0.5572139303482587,1.0,1.0,none,0.4035324690396061,0.37739651181300826,0.9413355486372886,0.3672091715940534,COMPLETE
743,0.7246200607902735,2025-11-26 21:14:03.510578,2025-11-26 21:14:06.780146,0 days 00:00:03.269568,0.03828530977410248,gbtree,0.7147566342198642,2.4969539883420877,lossguide,0.008309126153246749,0.024227130709954033,3,6,0.3838137029197032,500,,0.8521010059014062,0.6117839708790254,0.09131053320522783,undersample,0.5483617686822824,,7.0,0.7695111605909313,,,,0.34773001478075444,0.3230347036846556,0.5861601085481682,0.5902306648575305,0.7239819004524887,0.7246200607902735,0.8521010059014062,0.6117839708790254,0.1,0.6633886070915472,0.6848975809376873,0.5758157389635317,0.5792031098153547,0.974817221770918,0.9675324675324676,undersample,0.640092673950165,0.670924230264118,0.5483617686822824,0.3230347036846556,COMPLETE
744,0.5964912280701754,2025-11-26 21:14:06.956161,2025-11-26 21:14:16.892746,0 days 00:00:09.936585,0.1849709407692555,gbtree,0.8598567736636094,0.9108335540093759,lossguide,0.1735563151078016,0.0225588817416777,4,6,1.1467985526067213,600,,0.7659247072871578,0.6099316676352917,0.047820992388442424,undersample,0.6598393125664659,,8.0,0.8296672350197151,,,,0.46857164051374284,0.4462171183265847,0.5391225689733152,0.5422885572139303,0.5869477097689502,0.5964912280701754,0.7659247072871578,0.6099316676352917,0.05,0.5535896558882984,0.5565035500369748,0.5857605177993528,0.5862068965517241,0.5881397238017871,0.6071428571428571,undersample,0.5169515409738226,0.5243100234800949,0.6598393125664659,0.4462171183265847,COMPLETE
745,0.6892824977484239,2025-11-26 21:14:17.065219,2025-11-26 21:14:17.709017,0 days 00:00:00.643798,0.008057176433995075,gbtree,0.8087587398471948,3.1609889912642894,lossguide,0.0001363436860819834,0.02893137022579942,3,4,4.152135145189567,300,,0.9759558650251972,0.5309273419331946,0.09555568402986304,undersample,0.5159046351241894,,8.0,0.7625943893106241,,,,0.5276265724367539,0.39182607546786435,0.5282677521483492,0.5318860244233379,0.6868808165716002,0.6892824977484239,0.9759558650251972,0.5309273419331946,0.1,0.44339738316089705,0.44061339452181225,0.5447619047619048,0.5469271081467365,0.9293257514216084,0.9318181818181818,undersample,0.33060188332034685,0.3270511090033562,0.5159046351241894,0.39182607546786435,COMPLETE
746,0.7156549520766773,2025-11-26 21:14:17.875238,2025-11-26 21:14:18.856329,0 days 00:00:00.981091,0.18060930605341907,gbtree,0.9584519292514564,1.58639013452491,lossguide,0.0007108557600545941,0.0004843444043911335,3,9,26.619128718993114,1000,,0.6342281613822114,0.06126113014413542,0.09524509165755901,none,0.8913247791363831,1.1778492316504203,5.0,0.7877575058752134,,,,0.5505595902254032,0.21449710682809414,0.5567616463138851,0.5572139303482587,0.715281812899477,0.7156549520766773,0.6342281613822114,0.06126113014413542,0.1,0.6688986227379072,0.6529061413686741,0.5567616463138851,0.5572139303482587,1.0,1.0,none,0.6553295810606939,0.6333643692875051,0.8913247791363831,0.21449710682809414,COMPLETE
747,0.715281812899477,2025-11-26 21:14:19.027684,2025-11-26 21:14:22.797442,0 days 00:00:03.769758,0.07799796328963779,gbtree,0.87884243869496,2.0339910369737346,depthwise,0.00010404922371341846,0.005558285384093899,2,7,1.4210275201976792,500,,0.6673209601311707,0.8155290450775365,0.09384422776017219,none,0.7724715742243593,2.0683712090210444,5.0,0.657621295536409,,,,0.3501384115585811,0.4164048751997261,0.5554047942107644,0.5567616463138851,0.7141610933410876,0.715281812899477,0.6673209601311707,0.8155290450775365,0.1,0.560545317408197,0.5740415265725807,0.5561594202898551,0.5570135746606335,0.9975629569455727,0.9991883116883117,none,0.5004331139441967,0.5197752643168885,0.7724715742243593,0.4164048751997261,COMPLETE
748,0.7156549520766773,2025-11-26 21:14:22.975987,2025-11-26 21:14:40.399916,0 days 00:00:17.423929,39.329147696563886,dart,0.558037548109465,5.466389939295846,depthwise,0.0050878988200433505,0.0006222486813537326,0,8,11.621952962878828,400,forest,0.7647930702967193,0.16671936953640115,0.041029930080252484,none,0.6630253001798733,0.5045474497254574,6.0,0.6424373618392346,0.3694935769557851,uniform,0.5106840075201065,0.881708501901659,0.34390404113313716,0.5567616463138851,0.5572139303482587,0.715281812899477,0.7156549520766773,0.7647930702967193,0.16671936953640115,0.05,0.5567616463138851,0.5572139303482587,0.5567616463138851,0.5572139303482587,1.0,1.0,none,0.5,0.5,0.6630253001798733,0.34390404113313716,COMPLETE
749,0.0,2025-11-26 21:14:40.572801,2025-11-26 21:15:00.413098,0 days 00:00:19.840297,0.02356231904659184,dart,0.7120643770783494,5.656273691040663,lossguide,3.278801795598047,0.01327077198222126,1,5,0.16428961800967612,400,forest,0.7724890117870022,0.8961606446479176,0.09171176053117691,undersample,0.692858050273272,,7.0,0.667780575459135,0.12820549631104472,weighted,0.28659798866862035,0.27189903841537866,0.6374602773812156,0.44323835368611486,0.4427860696517413,0.0,0.0,0.7724890117870022,0.8961606446479176,0.1,0.416107064001697,0.4144269039304786,0.0,0.0,0.0,0.0,undersample,0.26416966461645586,0.25937379780587133,0.692858050273272,0.6374602773812156,COMPLETE
750,0.7156549520766773,2025-11-26 21:15:00.581770,2025-11-26 21:15:02.140764,0 days 00:00:01.558994,0.03804776018750397,gbtree,0.46908009765622727,1.0395608616087708,lossguide,0.04967187336068715,0.005183714629063355,2,5,0.4249182982439695,500,,0.6242895121688927,0.5759766615304076,0.09268705396495633,undersample,0.5277235818291803,,7.0,0.7725522186335861,,,,0.29675052772503074,0.16136174380851193,0.5567616463138851,0.5572139303482587,0.715281812899477,0.7156549520766773,0.6242895121688927,0.5759766615304076,0.1,0.5058687522332072,0.48687638701810576,0.5567616463138851,0.5572139303482587,1.0,1.0,undersample,0.4411251015434606,0.41901481434806254,0.5277235818291803,0.16136174380851193,COMPLETE
751,0.7156549520766773,2025-11-26 21:15:02.317596,2025-11-26 21:15:02.992277,0 days 00:00:00.674681,0.8126887193680354,gbtree,0.927060638076242,5.855847092924403,lossguide,0.04310349204835572,0.01595103623546975,10,9,64.90745648163895,400,,0.9085311425922011,0.7726859937648027,0.04260301078510364,oversample,0.8357672542047673,,10.0,0.8593683237927341,,,,0.5454045495476098,0.4607987327204311,0.5567616463138851,0.5572139303482587,0.715281812899477,0.7156549520766773,0.9085311425922011,0.7726859937648027,0.05,0.4446563382378319,0.4384022317144354,0.5567616463138851,0.5572139303482587,1.0,1.0,oversample,0.32239302707273,0.3092142790814905,0.8357672542047673,0.4607987327204311,COMPLETE
752,0.7107728337236534,2025-11-26 21:15:03.171402,2025-11-26 21:15:05.791298,0 days 00:00:02.619896,0.6128355023703751,gbtree,0.6994203697457383,2.7307577180879945,lossguide,0.004988379192646823,0.06409937416640563,1,5,1.281897994117571,500,,0.8650877166353109,0.7263290547423756,0.09285966230589232,undersample,0.5557739734671189,,7.0,0.7071212756255552,,,,0.3282764010991519,0.2002598019546316,0.5567616463138851,0.5531433740388965,0.7122724603640634,0.7107728337236534,0.8650877166353109,0.7263290547423756,0.1,0.586272096092417,0.5692077805927743,0.5577011494252874,0.5558608058608059,0.9853777416734363,0.9853896103896104,undersample,0.5447951723337588,0.5258761922449359,0.5557739734671189,0.2002598019546316,COMPLETE
