number,value,datetime_start,datetime_complete,duration,params_alpha,params_booster,params_colsample_bytree,params_gamma,params_grow_policy,params_lambda,params_learning_rate,params_max_delta_step,params_max_depth,params_min_child_weight,params_n_estimators,params_normalize_type,params_params_feature_fraction,params_params_labeled_ratio,params_params_missing_rate,params_params_resampling,params_params_sample_rows,params_params_scale_pos_weight,params_params_selftrain_max_iter,params_params_selftrain_threshold,params_rate_drop,params_sample_type,params_skip_drop,params_subsample,params_user_attrs_decision_threshold,user_attrs_acc_test,user_attrs_acc_val,user_attrs_f1_test,user_attrs_f1_val,user_attrs_feature_fraction,user_attrs_labeled_ratio,user_attrs_missing_rate,user_attrs_pr_auc_test,user_attrs_pr_auc_val,user_attrs_prec_test,user_attrs_prec_val,user_attrs_rec_test,user_attrs_rec_val,user_attrs_resampling_strategy,user_attrs_roc_auc_test,user_attrs_roc_auc_val,user_attrs_sample_rows,user_attrs_user_attrs_decision_threshold,state
609,0.7156549520766773,2025-11-26 20:15:00.951632,2025-11-26 20:15:01.712199,0 days 00:00:00.760567,0.0054834757231253094,gbtree,0.31498254163580786,2.5352224198021607,lossguide,48.120837230027014,0.0001243448304112003,4,8,0.14493005468828635,500,,0.8360024108028896,0.89204832111503,0.014555803452359432,undersample,0.6530558853772485,,6.0,0.6230284366350469,,,,0.4232559327382678,0.05847158112245818,0.5567616463138851,0.5572139303482587,0.715281812899477,0.7156549520766773,0.8360024108028896,0.89204832111503,0.02,0.46824811502615926,0.4616472690048711,0.5567616463138851,0.5572139303482587,1.0,1.0,undersample,0.4095637361362092,0.3942844374726397,0.6530558853772485,0.05847158112245818,COMPLETE
610,0.7156549520766773,2025-11-26 20:15:01.884027,2025-11-26 20:15:11.348041,0 days 00:00:09.464014,0.4704021023317178,dart,0.7221666155794463,5.092212371223498,lossguide,12.187089647577933,0.00018100025968367445,3,5,0.16425905517139658,300,tree,0.7473800499163651,0.36527239279781326,0.0567592461359444,oversample,0.6299209043493363,,12.0,0.672773530755187,0.30183893493679703,uniform,0.13352457508410698,0.8365514444154619,0.07465930873821786,0.5567616463138851,0.5572139303482587,0.715281812899477,0.7156549520766773,0.7473800499163651,0.36527239279781326,0.05,0.5321122365907113,0.5377815848863624,0.5567616463138851,0.5572139303482587,1.0,1.0,oversample,0.4719147366501434,0.46270503628138976,0.6299209043493363,0.07465930873821786,COMPLETE
611,0.7156549520766773,2025-11-26 20:15:11.528273,2025-11-26 20:15:12.151729,0 days 00:00:00.623456,0.00013804502740295097,gbtree,0.5592883025698551,4.059095992400229,depthwise,0.060034490722426975,0.038340943234196484,8,12,0.7574577528978841,300,,0.9181852935135266,0.5718350988394156,0.04896597858966631,undersample,0.6285625891886572,,12.0,0.7065511567120204,,,,0.624690680446454,0.23831716424377525,0.5567616463138851,0.5572139303482587,0.715281812899477,0.7156549520766773,0.9181852935135266,0.5718350988394156,0.05,0.4312623488374578,0.4313116831761634,0.5567616463138851,0.5572139303482587,1.0,1.0,undersample,0.30176395497272834,0.30466418157940117,0.6285625891886572,0.23831716424377525,COMPLETE
612,0.7156549520766773,2025-11-26 20:15:12.326144,2025-11-26 20:15:14.261004,0 days 00:00:01.934860,0.0012225022099952658,gbtree,0.5458133849585276,3.8535005707607772,lossguide,0.00017337753719361016,0.02797619548597637,5,5,0.9117779304699204,600,,0.7011634425291949,0.6932434450684447,0.08273091014025312,none,0.7002675214701224,0.8446043387528287,6.0,0.602789081877185,,,,0.4096149475892926,0.16017842217197245,0.5567616463138851,0.5572139303482587,0.715281812899477,0.7156549520766773,0.7011634425291949,0.6932434450684447,0.08,0.4947780044174255,0.48444731956219544,0.5567616463138851,0.5572139303482587,1.0,1.0,none,0.4528510916958173,0.434901187933619,0.7002675214701224,0.16017842217197245,COMPLETE
613,0.7156549520766773,2025-11-26 20:15:14.436041,2025-11-26 20:15:15.396357,0 days 00:00:00.960316,0.37486711198195694,gbtree,0.4442220887814506,8.449394963019039,depthwise,0.00012880720096601194,0.0006848360408158547,5,10,0.8733267998619337,900,,0.7903613877909533,0.49757579501974003,0.0429361199696125,oversample,0.9709459517843564,,6.0,0.7774920208015673,,,,0.43856002543061695,0.517353691392655,0.5567616463138851,0.5572139303482587,0.715281812899477,0.7156549520766773,0.7903613877909533,0.49757579501974003,0.05,0.4682611156486378,0.4611413791263138,0.5567616463138851,0.5572139303482587,1.0,1.0,oversample,0.36459407483545814,0.3579164068821883,0.9709459517843564,0.517353691392655,COMPLETE
614,0.7156549520766773,2025-11-26 20:15:15.567259,2025-11-26 20:15:47.995823,0 days 00:00:32.428564,8.051097285421054,dart,0.613724055343845,3.983946253313001,lossguide,0.9048711532097434,0.00029505410270113503,0,9,34.39648637368992,500,tree,0.957079108428206,0.5182053939124802,0.016816800234645175,undersample,0.8298886651609427,,6.0,0.8486861563639494,0.19326546747247464,uniform,0.8967941898195635,0.9637446600584513,0.06850091038369781,0.5567616463138851,0.5572139303482587,0.715281812899477,0.7156549520766773,0.957079108428206,0.5182053939124802,0.02,0.5567616463138851,0.5572139303482587,0.5567616463138851,0.5572139303482587,1.0,1.0,undersample,0.5,0.5,0.8298886651609427,0.06850091038369781,COMPLETE
615,0.7156549520766773,2025-11-26 20:15:48.168984,2025-11-26 20:15:49.152003,0 days 00:00:00.983019,0.00020550233218243977,gbtree,0.5722846388275503,7.065174524814178,lossguide,0.0006832023544255022,0.0011305361053774046,6,8,0.14633124855751947,500,,0.5834816261437358,0.22989809411234224,0.05331427370779965,none,0.946637897166905,1.5214117650446728,5.0,0.6496730386737523,,,,0.5701973685870081,0.6530358373771736,0.5567616463138851,0.5572139303482587,0.715281812899477,0.7156549520766773,0.5834816261437358,0.22989809411234224,0.05,0.5559559579695497,0.5494211192990026,0.5567616463138851,0.5572139303482587,1.0,1.0,none,0.49835375254894804,0.48278126368014007,0.946637897166905,0.6530358373771736,COMPLETE
616,0.7156549520766773,2025-11-26 20:15:49.340181,2025-11-26 20:16:18.580473,0 days 00:00:29.240292,10.158706887956482,dart,0.8760757575784989,5.410073332297831,lossguide,0.1067976286002112,0.026165488321360404,0,5,0.45845756479487965,500,tree,0.7066209635754468,0.6948816755173686,0.09432659147508156,undersample,0.870976043398957,,5.0,0.7317777640274689,0.1235121615396988,weighted,0.008708498017358292,0.22117146595510195,0.06661533227253003,0.5567616463138851,0.5572139303482587,0.715281812899477,0.7156549520766773,0.7066209635754468,0.6948816755173686,0.1,0.46988675652705175,0.46483340538956397,0.5567616463138851,0.5572139303482587,1.0,1.0,undersample,0.30719259271539645,0.28081057731849357,0.870976043398957,0.06661533227253003,COMPLETE
617,0.5822784810126582,2025-11-26 20:16:18.756098,2025-11-26 20:16:19.826443,0 days 00:00:01.070345,0.5597819651883962,gbtree,0.9987650882619267,2.4584292761643924,lossguide,0.012149849576899092,0.005201612517775823,6,8,2.681764574728794,400,,0.7277528849822048,0.4790077561847202,0.08268674655239923,undersample,0.7860064753999926,,5.0,0.876263360279089,,,,0.916683155275009,0.48988361208900605,0.49163274536408863,0.5074626865671642,0.5748865355521936,0.5822784810126582,0.7277528849822048,0.4790077561847202,0.08,0.5269619170070059,0.534093482509369,0.537862703467799,0.552,0.6173842404549147,0.6160714285714286,undersample,0.46889495847079693,0.4851574625578712,0.7860064753999926,0.48988361208900605,COMPLETE
618,0.7156549520766773,2025-11-26 20:16:20.005092,2025-11-26 20:18:03.859908,0 days 00:01:43.854816,0.0007702873061060146,dart,0.6234343030893655,6.83230743489166,depthwise,0.0013052153606020564,0.0013102512965235428,3,9,1.0488288956629646,1000,forest,0.7568887716636072,0.5105572718361264,0.004276729375911987,undersample,0.9707272009163896,,7.0,0.6272082824075361,0.23994434585276897,weighted,0.13388811630472777,0.4749088244057895,0.24436652114487226,0.5567616463138851,0.5572139303482587,0.715281812899477,0.7156549520766773,0.7568887716636072,0.5105572718361264,0.0,0.6025204110796429,0.6170114848404056,0.5567616463138851,0.5572139303482587,1.0,1.0,undersample,0.5272604817719126,0.5425340428213258,0.9707272009163896,0.24436652114487226,COMPLETE
619,0.0,2025-11-26 20:18:04.036637,2025-11-26 20:18:44.304865,0 days 00:00:40.268228,0.4034685229485536,dart,0.9766835195494852,4.746267504680059,depthwise,8.446068353249514,0.008772751303317831,9,7,51.19574432826252,600,forest,0.8220424758342852,0.847251290843477,0.09570981622806118,oversample,0.8997288603450425,,12.0,0.8536726557577309,0.3613710308190328,weighted,0.5344484407029452,0.8342646232269064,0.7040972179003206,0.44323835368611486,0.4427860696517413,0.0,0.0,0.8220424758342852,0.847251290843477,0.1,0.47360545340214083,0.4725331988684446,0.0,0.0,0.0,0.0,oversample,0.3872996070889769,0.38330135773317586,0.8997288603450425,0.7040972179003206,COMPLETE
620,0.0,2025-11-26 20:18:44.479510,2025-11-26 20:19:43.234148,0 days 00:00:58.754638,20.91361774829832,dart,0.7673382293379141,3.33987699674596,lossguide,17.593844903780845,0.003780483393923346,9,6,22.032724979130318,700,forest,0.9232357448734989,0.37272644208766537,0.07880298542076983,undersample,0.9936813719180673,,7.0,0.9243298857977409,0.16071619004216525,weighted,0.45577646277028433,0.6686419633581734,0.5909607228422598,0.44323835368611486,0.4427860696517413,0.0,0.0,0.9232357448734989,0.37272644208766537,0.08,0.5679849638177298,0.5583033098489307,0.0,0.0,0.0,0.0,undersample,0.5017776322551767,0.47584584720692996,0.9936813719180673,0.5909607228422598,COMPLETE
621,0.7156549520766773,2025-11-26 20:19:43.407440,2025-11-26 20:19:44.668799,0 days 00:00:01.261359,0.0004461269358566755,gbtree,0.5748401664347136,3.8511252695285996,depthwise,0.0006155073348812697,0.0010377649595996413,7,11,0.22583678667281157,1000,,0.7205241633447815,0.6431730965194529,9.926087124204758e-05,undersample,0.885409571495379,,6.0,0.6021230919664949,,,,0.5130479940990559,0.44992386992793754,0.5567616463138851,0.5572139303482587,0.715281812899477,0.7156549520766773,0.7205241633447815,0.6431730965194529,0.0,0.47953196568766476,0.48622374118378625,0.5567616463138851,0.5572139303482587,1.0,1.0,undersample,0.3990856943914853,0.40611236949975454,0.885409571495379,0.44992386992793754,COMPLETE
622,0.7156549520766773,2025-11-26 20:19:44.838595,2025-11-26 20:19:47.644211,0 days 00:00:02.805616,0.0011618310922482348,gbtree,0.4816007501744179,2.1145912107658384,lossguide,0.0001693426322763028,0.0005589899044045355,3,12,0.2770738450790537,600,,0.8945522788055017,0.6929948258129904,0.060824275200397446,oversample,0.7452949111702551,,10.0,0.6669793479536382,,,,0.28533666939819724,0.19098277893884702,0.5567616463138851,0.5572139303482587,0.715281812899477,0.7156549520766773,0.8945522788055017,0.6929948258129904,0.05,0.6083459769158853,0.6068185986339575,0.5567616463138851,0.5572139303482587,1.0,1.0,oversample,0.6062816028117176,0.5958961237944895,0.7452949111702551,0.19098277893884702,COMPLETE
623,0.7156549520766773,2025-11-26 20:19:47.824931,2025-11-26 20:19:58.243910,0 days 00:00:10.418979,20.70039194114707,dart,0.8381270468938623,7.1322595976215,lossguide,0.00011618428358057257,0.058528703738615344,9,4,0.19408164171683864,300,tree,0.8383546801953532,0.7192850168502791,0.023850002942839527,none,0.8980781539314812,2.1856709395832765,11.0,0.922386392299259,0.28517417212199847,weighted,0.41137074422941217,0.5185105694486454,0.46535405570137167,0.5567616463138851,0.5572139303482587,0.715281812899477,0.7156549520766773,0.8383546801953532,0.7192850168502791,0.02,0.5231338327770427,0.5507709037136304,0.5567616463138851,0.5572139303482587,1.0,1.0,none,0.4441009466337307,0.48123250600267964,0.8980781539314812,0.46535405570137167,COMPLETE
624,0.7156549520766773,2025-11-26 20:19:58.415731,2025-11-26 20:19:59.196469,0 days 00:00:00.780738,0.4927217741406464,gbtree,0.5424180780865242,6.008094927195729,depthwise,0.004749536484096887,0.16777145977800365,5,3,0.7615946980406655,600,,0.8562083049952061,0.38676889246320123,0.015527429791200966,oversample,0.8949768598450631,,8.0,0.8582479411183765,,,,0.8721094019604999,0.3775112717726637,0.5567616463138851,0.5572139303482587,0.715281812899477,0.7156549520766773,0.8562083049952061,0.38676889246320123,0.02,0.4755245970863397,0.47585708933307885,0.5567616463138851,0.5572139303482587,1.0,1.0,oversample,0.24073219052039985,0.23922626785880102,0.8949768598450631,0.3775112717726637,COMPLETE
625,0.7130594727161251,2025-11-26 20:19:59.369703,2025-11-26 20:20:00.239513,0 days 00:00:00.869810,0.009566932068239286,gbtree,0.8814330108334034,4.372547540693954,lossguide,0.10149164878468281,0.003485059924002202,5,8,31.785409991989244,600,,0.9011155835163975,0.5355394697279741,0.0875278090527313,oversample,0.7610516168928985,,11.0,0.9167076905848527,,,,0.4901657550274471,0.5373080277652866,0.5671641791044776,0.576662143826323,0.7030716723549488,0.7130594727161251,0.9011155835163975,0.5355394697279741,0.08,0.589176833727906,0.5814333373652578,0.5687751004016064,0.5729064039408867,0.9203899268887084,0.9439935064935064,oversample,0.55156584160878,0.5318100566440709,0.7610516168928985,0.5373080277652866,COMPLETE
626,0.6948948948948949,2025-11-26 20:20:00.413689,2025-11-26 20:20:01.060300,0 days 00:00:00.646611,0.03364738517986945,gbtree,0.9153959557791634,7.257806818431158,lossguide,0.0001444465951161375,0.0710444376357367,1,6,0.25191031604947833,400,,0.7521331970523684,0.6324216886590238,0.07106554652511529,none,0.656512744453825,1.1048311716631736,5.0,0.7168307596228684,,,,0.3014439877975449,0.5159795617286816,0.5395748530076888,0.540479421076436,0.6948441247002398,0.6948948948948949,0.7521331970523684,0.6324216886590238,0.08,0.5463720841903066,0.546237021054963,0.5505938242280285,0.5514775977121068,0.9415109666937449,0.9391233766233766,none,0.4871657355062253,0.490835964342093,0.656512744453825,0.5159795617286816,COMPLETE
627,0.7156549520766773,2025-11-26 20:20:01.232841,2025-11-26 20:20:31.512861,0 days 00:00:30.280020,0.06412404954673602,dart,0.9460637006550738,4.318416531709845,lossguide,0.004887518682251138,0.003062858115075367,7,5,0.6802526712531841,500,forest,0.9992312585962099,0.6794234166148503,0.08760685267166649,oversample,0.5432522649158206,,5.0,0.7418520545099833,0.13866734959068006,weighted,0.13694561371778782,0.2789044140525091,0.31439347782317006,0.5567616463138851,0.5572139303482587,0.715281812899477,0.7156549520766773,0.9992312585962099,0.6794234166148503,0.08,0.49817494395802464,0.5093618967494193,0.5567616463138851,0.5572139303482587,1.0,1.0,oversample,0.4293522770602961,0.43433366939495643,0.5432522649158206,0.31439347782317006,COMPLETE
628,0.7156549520766773,2025-11-26 20:20:31.680685,2025-11-26 20:21:12.504950,0 days 00:00:40.824265,0.04904502211310973,dart,0.6545992045193005,8.772614162134126,lossguide,0.1667539258561998,0.009599049401805443,3,4,0.26433237009582755,700,forest,0.5358321637781654,0.07528677507659484,0.075999495427678,none,0.8958914834809646,3.1240354874995626,11.0,0.6895598389408126,0.4548680548240133,weighted,0.1628263511056415,0.7832542945272458,0.09622614954141333,0.5567616463138851,0.5572139303482587,0.715281812899477,0.7156549520766773,0.5358321637781654,0.07528677507659484,0.08,0.5567616463138851,0.5572139303482587,0.5567616463138851,0.5572139303482587,1.0,1.0,none,0.5,0.5,0.8958914834809646,0.09622614954141333,COMPLETE
629,0.7156549520766773,2025-11-26 20:21:12.693119,2025-11-26 20:21:13.741548,0 days 00:00:01.048429,0.001447576631840198,gbtree,0.7109720146260803,5.612772596634417,depthwise,0.000798903804243086,0.00020339178113760065,7,8,3.5070906971111357,900,,0.7225215126315278,0.4307925344289901,0.005139435294961529,oversample,0.9966431385746198,,7.0,0.6412748918543311,,,,0.6391314314968637,0.41745905002886563,0.5567616463138851,0.5572139303482587,0.715281812899477,0.7156549520766773,0.7225215126315278,0.4307925344289901,0.0,0.5329421672477141,0.5327230431398369,0.5567616463138851,0.5572139303482587,1.0,1.0,oversample,0.47703750062169464,0.47080948290728675,0.9966431385746198,0.41745905002886563,COMPLETE
630,0.7156549520766773,2025-11-26 20:21:13.932172,2025-11-26 20:21:17.522331,0 days 00:00:03.590159,0.29381172034962905,gbtree,0.40295549066131425,1.9286874434772963,lossguide,2.903631361706917,0.0015649416238123714,8,10,1.644105008275182,900,,0.6610702217019266,0.18045761422256118,0.09304582699595637,oversample,0.6034713126919413,,7.0,0.6277253753480263,,,,0.6255628208426358,0.5090834648705649,0.5567616463138851,0.5572139303482587,0.715281812899477,0.7156549520766773,0.6610702217019266,0.18045761422256118,0.1,0.6407235891910228,0.627809441463343,0.5567616463138851,0.5572139303482587,1.0,1.0,oversample,0.6111685372768116,0.5988522777018691,0.6034713126919413,0.5090834648705649,COMPLETE
631,0.7156549520766773,2025-11-26 20:21:17.707018,2025-11-26 20:21:19.584186,0 days 00:00:01.877168,0.0006440463418657224,gbtree,0.41901698026054834,1.0100539077504052,lossguide,0.0017056166025355203,0.0025347990217325983,4,12,1.3019502767037054,200,,0.8607124430487785,0.9037732544856897,0.09309972358053757,undersample,0.7390509638911009,,8.0,0.6909427543212371,,,,0.23750490653492473,0.06792644791617247,0.5567616463138851,0.5572139303482587,0.715281812899477,0.7156549520766773,0.8607124430487785,0.9037732544856897,0.1,0.5244957029582586,0.5309382971895492,0.5567616463138851,0.5572139303482587,1.0,1.0,undersample,0.4623195013179927,0.47599881604605815,0.7390509638911009,0.06792644791617247,COMPLETE
632,0.5949188426252646,2025-11-26 20:21:19.752599,2025-11-26 20:21:20.445535,0 days 00:00:00.692936,0.014951977621305873,gbtree,0.9642829460801519,3.904188215661945,lossguide,0.00020778093643291203,0.056590259388269545,5,5,2.3823571098438374,400,,0.8255412163795911,0.8359174869639722,0.08845968643102523,none,0.7509040314853135,0.7053072529584868,7.0,0.781311843011302,,,,0.3138156900847517,0.4415510429360217,0.4739936680235188,0.48077792853912255,0.5886098337460205,0.5949188426252646,0.8255412163795911,0.8359174869639722,0.08,0.48970407083549944,0.48532297295646915,0.5213032581453634,0.5262172284644194,0.6758732737611698,0.6842532467532467,none,0.40835267494487637,0.40879243330724435,0.7509040314853135,0.4415510429360217,COMPLETE
633,0.7156549520766773,2025-11-26 20:21:20.620155,2025-11-26 20:21:21.670282,0 days 00:00:01.050127,0.0007886789217430395,gbtree,0.2341965649397884,4.774462557340613,lossguide,0.0016208738913013217,0.0011481456659010881,5,10,0.14069332768293136,1000,,0.6339200556167895,0.37662545399187014,0.023164837732560555,undersample,0.8339770234544767,,6.0,0.6707905843671884,,,,0.7520609173606331,0.26735411785501484,0.5567616463138851,0.5572139303482587,0.715281812899477,0.7156549520766773,0.6339200556167895,0.37662545399187014,0.02,0.502039022563655,0.50180126931907,0.5567616463138851,0.5572139303482587,1.0,1.0,undersample,0.44993948838674375,0.4535691900030511,0.8339770234544767,0.26735411785501484,COMPLETE
634,0.7156549520766773,2025-11-26 20:21:21.847203,2025-11-26 20:21:43.249162,0 days 00:00:21.401959,9.510593869306524,dart,0.7416296796361882,7.041730176582396,depthwise,0.0018450891711731259,0.01541768462586669,7,4,0.11606066099987564,400,forest,0.887670947759384,0.9224049652205587,0.03055943919841557,oversample,0.8463049724058546,,9.0,0.8837448830190273,0.0030824189342346653,weighted,0.87590663824567,0.4532271639719639,0.3458589052076465,0.5567616463138851,0.5572139303482587,0.715281812899477,0.7156549520766773,0.887670947759384,0.9224049652205587,0.02,0.4532206101502303,0.4480081631457699,0.5567616463138851,0.5572139303482587,1.0,1.0,oversample,0.35235166365490145,0.3433798071183157,0.8463049724058546,0.3458589052076465,COMPLETE
635,0.7156549520766773,2025-11-26 20:21:43.417956,2025-11-26 20:21:54.823679,0 days 00:00:11.405723,0.04026675540279248,dart,0.7212054637190612,0.5120710232655843,lossguide,0.011909959315753964,0.007689914116107702,0,5,0.11214919673952563,300,tree,0.9027798596443153,0.7072868302649801,0.07302115983907545,oversample,0.8862317553522739,,5.0,0.7497460166841248,0.20638360059169678,weighted,0.14654286829083507,0.5444824069848193,0.2059255421666168,0.5567616463138851,0.5572139303482587,0.715281812899477,0.7156549520766773,0.9027798596443153,0.7072868302649801,0.08,0.5053923512430611,0.4939063245430957,0.5567616463138851,0.5572139303482587,1.0,1.0,oversample,0.455664052786021,0.4509761816324636,0.8862317553522739,0.2059255421666168,COMPLETE
636,0.7156549520766773,2025-11-26 20:21:54.983015,2025-11-26 20:22:57.621043,0 days 00:01:02.638028,13.411232804205737,dart,0.7675605028629817,1.4458942981595535,lossguide,2.8201628531069507,0.01172607992708722,9,6,64.18478939876948,800,forest,0.8266404037869044,0.17347882908735474,0.09979887905365782,undersample,0.9486276298537254,,10.0,0.8334371395259647,0.4496982490818302,uniform,0.4635535525971946,0.4090072353212834,0.02336029738691886,0.5567616463138851,0.5572139303482587,0.715281812899477,0.7156549520766773,0.8266404037869044,0.17347882908735474,0.1,0.5567616463138851,0.5572139303482587,0.5567616463138851,0.5572139303482587,1.0,1.0,undersample,0.5,0.5,0.9486276298537254,0.02336029738691886,COMPLETE
637,0.7156549520766773,2025-11-26 20:22:57.792966,2025-11-26 20:23:05.588226,0 days 00:00:07.795260,0.001882480137574031,dart,0.7287416720043899,6.92698818682936,lossguide,4.515070444572122,0.0017698743947525044,5,5,5.212106110957702,200,forest,0.5154921952316696,0.768936400322681,0.08972560069530297,none,0.5816311588767842,1.6655389650770003,10.0,0.6612742777845149,0.24957738532842147,weighted,0.4468077016250026,0.9787500229622528,0.35301994816638693,0.5567616463138851,0.5572139303482587,0.715281812899477,0.7156549520766773,0.5154921952316696,0.768936400322681,0.08,0.4687432885898076,0.4657477778881104,0.5567616463138851,0.5572139303482587,1.0,1.0,none,0.20519861071967369,0.191689853813194,0.5816311588767842,0.35301994816638693,COMPLETE
