number,value,datetime_start,datetime_complete,duration,params_alpha,params_booster,params_colsample_bytree,params_gamma,params_grow_policy,params_lambda,params_learning_rate,params_max_delta_step,params_max_depth,params_min_child_weight,params_n_estimators,params_normalize_type,params_params_feature_fraction,params_params_labeled_ratio,params_params_missing_rate,params_params_resampling,params_params_sample_rows,params_params_scale_pos_weight,params_params_selftrain_max_iter,params_params_selftrain_threshold,params_rate_drop,params_sample_type,params_skip_drop,params_subsample,params_user_attrs_decision_threshold,user_attrs_acc_test,user_attrs_acc_val,user_attrs_f1_test,user_attrs_f1_val,user_attrs_feature_fraction,user_attrs_labeled_ratio,user_attrs_missing_rate,user_attrs_pr_auc_test,user_attrs_pr_auc_val,user_attrs_prec_test,user_attrs_prec_val,user_attrs_rec_test,user_attrs_rec_val,user_attrs_resampling_strategy,user_attrs_roc_auc_test,user_attrs_roc_auc_val,user_attrs_sample_rows,user_attrs_user_attrs_decision_threshold,state
320,0.7156549520766773,2025-11-26 18:26:56.247273,2025-11-26 18:27:23.726962,0 days 00:00:27.479689,0.10572203551923412,dart,0.4629726850248317,7.815689895248133,lossguide,44.46561047940293,0.0003332693763979514,2,5,4.081543693427961,500,forest,0.7561324922587178,0.3991353979319157,0.07952408295727373,oversample,0.7619650131944242,,12.0,0.9246902487138481,0.3766195470456659,uniform,0.5293924049095424,0.23967344532283005,0.487894027778751,0.5567616463138851,0.5572139303482587,0.715281812899477,0.7156549520766773,0.7561324922587178,0.3991353979319157,0.08,0.5264562177080571,0.5357122938746073,0.5567616463138851,0.5572139303482587,1.0,1.0,oversample,0.42882507999137914,0.4520875893769153,0.7619650131944242,0.487894027778751,COMPLETE
321,0.7156549520766773,2025-11-26 18:27:23.886602,2025-11-26 18:27:29.204476,0 days 00:00:05.317874,0.0015590056544219249,dart,0.8346901586941532,6.563682480954834,lossguide,0.14707973685126866,0.011798056903702697,4,6,0.966502174851032,200,forest,0.5871420370370667,0.6239562612592331,0.09192388063233267,oversample,0.793291494509403,,8.0,0.6469421863897294,0.11811034996542114,uniform,0.6358129127448459,0.9735483728392325,0.17590523454002804,0.5567616463138851,0.5572139303482587,0.715281812899477,0.7156549520766773,0.5871420370370667,0.6239562612592331,0.1,0.5567616463138851,0.5572139303482587,0.5567616463138851,0.5572139303482587,1.0,1.0,oversample,0.5,0.5,0.793291494509403,0.17590523454002804,COMPLETE
322,0.7156549520766773,2025-11-26 18:27:29.366607,2025-11-26 18:27:30.347813,0 days 00:00:00.981206,0.17574156889577566,gbtree,0.7587982736598758,0.35472868542902036,depthwise,61.94257984526209,0.008813763747386,0,4,0.13811287466918992,500,,0.5458534734924172,0.35339391792819663,0.0733495859568399,oversample,0.883441773944214,,8.0,0.8862403321025341,,,,0.7252012054042071,0.14353211866471657,0.5567616463138851,0.5572139303482587,0.715281812899477,0.7156549520766773,0.5458534734924172,0.35339391792819663,0.08,0.5004925936431609,0.48765940253110684,0.5567616463138851,0.5572139303482587,1.0,1.0,oversample,0.44410343341235764,0.41795481076635316,0.883441773944214,0.14353211866471657,COMPLETE
323,0.7156549520766773,2025-11-26 18:27:30.510550,2025-11-26 18:28:20.187708,0 days 00:00:49.677158,0.12502260425434797,dart,0.979310138540027,3.897511065043474,depthwise,0.9656309087106385,0.00015081559093542697,8,11,37.118635920494796,600,tree,0.9950043479242207,0.6840356844278422,0.09817724331918183,oversample,0.8536441855673401,,12.0,0.7907609263788253,0.0014568722811352242,uniform,0.019760194645281226,0.8465822561861357,0.4145018781449183,0.5567616463138851,0.5572139303482587,0.715281812899477,0.7156549520766773,0.9950043479242207,0.6840356844278422,0.1,0.5207161766298105,0.5096823482435258,0.5567616463138851,0.5572139303482587,1.0,1.0,oversample,0.44572771431887137,0.4343506659326374,0.8536441855673401,0.4145018781449183,COMPLETE
324,0.7156549520766773,2025-11-26 18:28:20.355181,2025-11-26 18:28:20.841371,0 days 00:00:00.486190,10.767227106332122,gbtree,0.332891352271196,3.7814080019726557,depthwise,0.001474622162855933,0.3370481762964316,8,5,0.7146461682637816,200,,0.541846996405981,0.327587100167662,0.028913846454599074,oversample,0.5794084422112352,,10.0,0.691315629571425,,,,0.9368446344567755,0.158521862175009,0.5567616463138851,0.5572139303482587,0.715281812899477,0.7156549520766773,0.541846996405981,0.327587100167662,0.02,0.6604485194416301,0.6483257634980172,0.5567616463138851,0.5572139303482587,1.0,1.0,oversample,0.6613471708748487,0.645547570407121,0.5794084422112352,0.158521862175009,COMPLETE
325,0.7099236641221374,2025-11-26 18:28:21.018272,2025-11-26 18:28:24.135915,0 days 00:00:03.117643,0.00012195025551399989,gbtree,0.784678150542963,2.637358245007681,lossguide,0.26183626906856083,0.17666600727600368,9,11,0.39289825363840364,500,,0.9608372176314431,0.4501320807359307,0.05856003315633156,undersample,0.5836402772735131,,12.0,0.6464802561959929,,,,0.738598398838195,0.09486496086594923,0.5563093622795116,0.5531433740388965,0.7125695868737182,0.7099236641221374,0.9608372176314431,0.4501320807359307,0.05,0.46934797923884974,0.4566821479504746,0.5572868927589367,0.5561177552897885,0.9878147847278635,0.9813311688311688,undersample,0.3722334587774996,0.35429365705795735,0.5836402772735131,0.09486496086594923,COMPLETE
326,0.7156549520766773,2025-11-26 18:28:24.309484,2025-11-26 18:28:24.919644,0 days 00:00:00.610160,0.21088499652809795,gbtree,0.7748471964968856,9.869060666874246,lossguide,2.391145237042303,0.03322549790858677,4,7,1.7877882647023418,400,,0.9196712464897999,0.534958942441029,0.08975533384686209,oversample,0.9327130247736677,,10.0,0.8069715597484005,,,,0.4336973656317688,0.2665926368903302,0.5567616463138851,0.5572139303482587,0.715281812899477,0.7156549520766773,0.9196712464897999,0.534958942441029,0.08,0.7649101642458153,0.7378662047477321,0.5567616463138851,0.5572139303482587,1.0,1.0,oversample,0.7627422536845769,0.7286142101004205,0.9327130247736677,0.2665926368903302,COMPLETE
327,0.7156549520766773,2025-11-26 18:28:25.089645,2025-11-26 18:28:29.792159,0 days 00:00:04.702514,9.694296895197432,dart,0.7457378800649476,9.930898419951053,lossguide,30.28481352663975,0.00010745738369451163,0,3,2.461536048215375,200,forest,0.6396710695209894,0.3392090558825449,0.04445829180882858,undersample,0.7511687237586268,,12.0,0.8535654829463384,0.27536206031813065,weighted,0.27155697406828394,0.4887403230395054,0.020120048663762755,0.5567616463138851,0.5572139303482587,0.715281812899477,0.7156549520766773,0.6396710695209894,0.3392090558825449,0.05,0.5567616463138851,0.5572139303482587,0.5567616463138851,0.5572139303482587,1.0,1.0,undersample,0.5,0.5,0.7511687237586268,0.020120048663762755,COMPLETE
328,0.7156549520766773,2025-11-26 18:28:29.958735,2025-11-26 18:28:30.517279,0 days 00:00:00.558544,16.997403918595946,gbtree,0.37614157920793556,1.1111733070705676,lossguide,0.09865784117221192,0.12050719749098665,8,5,1.9224708735030087,300,,0.5779356713005701,0.8867482882373436,0.025043646420011986,oversample,0.5070675723340581,,8.0,0.6925493907008748,,,,0.9695208212046607,0.24297863602852116,0.5567616463138851,0.5572139303482587,0.715281812899477,0.7156549520766773,0.5779356713005701,0.8867482882373436,0.02,0.6198889818678561,0.6416129261707932,0.5567616463138851,0.5572139303482587,1.0,1.0,oversample,0.5499523367429832,0.5864120557685419,0.5070675723340581,0.24297863602852116,COMPLETE
329,0.7156549520766773,2025-11-26 18:28:30.685014,2025-11-26 18:29:33.036833,0 days 00:01:02.351819,6.8408542608530905,dart,0.27438128665062217,2.4806114533163033,lossguide,4.08151126423605,0.019555630422905257,6,11,0.6909076567517636,700,tree,0.8402089012691889,0.8012086807517362,0.007875035980552343,undersample,0.508773040997339,,12.0,0.7705093708851848,0.11149581475265927,weighted,0.42484463822609764,0.9936195170085558,0.1424872930094418,0.5567616463138851,0.5572139303482587,0.715281812899477,0.7156549520766773,0.8402089012691889,0.8012086807517362,0.0,0.5361004711766445,0.5296235465901216,0.5567616463138851,0.5572139303482587,1.0,1.0,undersample,0.47633125549163613,0.470559094888768,0.508773040997339,0.1424872930094418,COMPLETE
330,0.7156549520766773,2025-11-26 18:29:33.209976,2025-11-26 18:29:36.636333,0 days 00:00:03.426357,0.8414941660456642,gbtree,0.9274249732602392,1.618743009941518,lossguide,8.79621889618798,0.01292419508944503,6,11,4.311996762937956,700,,0.5245771920138398,0.366386342471509,0.06749077795478817,none,0.6414865252634885,2.1629006032270177,7.0,0.7488858953497017,,,,0.3581525920118117,0.2840654238068937,0.5567616463138851,0.5572139303482587,0.715281812899477,0.7156549520766773,0.5245771920138398,0.366386342471509,0.08,0.6097294516402589,0.6071905010489572,0.5567616463138851,0.5572139303482587,1.0,1.0,none,0.5735796349408976,0.586727113540188,0.6414865252634885,0.2840654238068937,COMPLETE
331,0.7191084890199935,2025-11-26 18:29:36.806710,2025-11-26 18:29:37.641683,0 days 00:00:00.834973,1.1519362583692838,gbtree,0.34538241041757195,3.8548687307987115,depthwise,0.007355635749523933,0.41680764658351743,2,4,1.9871249496310153,700,,0.7785777981859737,0.37882387877492396,0.001336502335595768,none,0.9826938678382671,1.2221501449862462,8.0,0.7923377266464586,,,,0.7775734178246879,0.5562838165162729,0.6101311623699683,0.6123925825418363,0.7197659297789337,0.7191084890199935,0.7785777981859737,0.37882387877492396,0.0,0.6408020639018773,0.6449307412903595,0.6,0.6030786146234195,0.8992688870836718,0.890422077922078,none,0.6270064158888576,0.6385595061220699,0.9826938678382671,0.5562838165162729,COMPLETE
332,0.7156549520766773,2025-11-26 18:29:37.838797,2025-11-26 18:30:23.907727,0 days 00:00:46.068930,0.15268394838610413,dart,0.9877210524648494,1.5286764284223258,depthwise,0.7757264856224078,0.005630270876894401,8,10,51.06105479099712,600,forest,0.8198193779500516,0.5683542721640061,0.08398530122676127,oversample,0.9619875072032998,,12.0,0.9010014940851785,0.2674977916865415,uniform,0.7034523152096555,0.8458381025492072,0.3983108276231307,0.5567616463138851,0.5572139303482587,0.715281812899477,0.7156549520766773,0.8198193779500516,0.5683542721640061,0.08,0.507291671151757,0.5359933584722607,0.5567616463138851,0.5572139303482587,1.0,1.0,oversample,0.4649654337770852,0.5074987895148773,0.9619875072032998,0.3983108276231307,COMPLETE
333,0.0,2025-11-26 18:30:24.079328,2025-11-26 18:30:24.961143,0 days 00:00:00.881815,5.111506013130505,gbtree,0.34677316749152837,5.516492970755954,depthwise,0.018852532321389767,0.287512458044771,4,3,1.1846330096693545,800,,0.8501722697345148,0.3935155985887033,0.010853131621857925,none,0.9073431794960326,1.0364039329757335,5.0,0.7375775392661325,,,,0.900098466311818,0.6979489443314257,0.44323835368611486,0.4427860696517413,0.0,0.0,0.8501722697345148,0.3935155985887033,0.02,0.5168111818873778,0.5031050557695511,0.0,0.0,0.0,0.0,none,0.4371309206054476,0.40920988485467547,0.9073431794960326,0.6979489443314257,COMPLETE
334,0.7156549520766773,2025-11-26 18:30:25.129365,2025-11-26 18:30:27.141261,0 days 00:00:02.011896,2.836225877167804,gbtree,0.4545851249500481,3.8117863607983624,depthwise,0.0014958106382742975,0.3923859547682537,4,5,6.951725246864873,600,,0.8856977345437781,0.4472372545432494,0.01026372052080463,none,0.9005058822994714,1.122002299884892,7.0,0.8148600498267865,,,,0.5149345009116026,0.24127834657173897,0.5567616463138851,0.5572139303482587,0.715281812899477,0.7156549520766773,0.8856977345437781,0.4472372545432494,0.02,0.5643157019932002,0.5656920360108394,0.5567616463138851,0.5572139303482587,1.0,1.0,none,0.5089992373878877,0.5147049069418834,0.9005058822994714,0.24127834657173897,COMPLETE
335,0.0,2025-11-26 18:30:27.310903,2025-11-26 18:32:11.987198,0 days 00:01:44.676295,45.11522567756707,dart,0.9242889785795938,4.653941850129837,lossguide,18.73698234333236,0.0004378090100912272,10,9,11.908376346920926,900,forest,0.6955889047659418,0.34783338854263746,0.07478944939959753,undersample,0.9558218085027592,,10.0,0.9356775577783616,0.047939846270219216,weighted,0.49243261777117764,0.3142964530538225,0.6249763012195448,0.44323835368611486,0.4427860696517413,0.0,0.0,0.6955889047659418,0.34783338854263746,0.08,0.5567616463138851,0.5572139303482587,0.0,0.0,0.0,0.0,undersample,0.5,0.5,0.9558218085027592,0.6249763012195448,COMPLETE
336,0.0,2025-11-26 18:32:12.159755,2025-11-26 18:32:12.967657,0 days 00:00:00.807902,14.424837927109294,gbtree,0.4882456287900226,4.741622271584943,depthwise,0.01926117536388945,0.2563869589215775,1,4,4.681426110270178,700,,0.8287491582892964,0.45697863278575723,0.014514116223013702,none,0.9379598852749083,0.9927768700984195,10.0,0.8541255134147611,,,,0.8367495224149877,0.6449837195048336,0.44323835368611486,0.4427860696517413,0.0,0.0,0.8287491582892964,0.45697863278575723,0.02,0.4998899158188514,0.48780198594856683,0.0,0.0,0.0,0.0,none,0.3693011323132015,0.34791871177851774,0.9379598852749083,0.6449837195048336,COMPLETE
337,0.7156549520766773,2025-11-26 18:32:13.137243,2025-11-26 18:32:13.633001,0 days 00:00:00.495758,9.162131036881549,gbtree,0.7509283607441173,9.941486654536096,lossguide,0.19812935054729386,0.009381151640805272,3,8,1.1469622915533293,200,,0.7079530881719743,0.6750924912260384,0.06356471576049283,undersample,0.7726785349026252,,10.0,0.8280290444812368,,,,0.2821949792230065,0.433563009509246,0.5567616463138851,0.5572139303482587,0.715281812899477,0.7156549520766773,0.7079530881719743,0.6750924912260384,0.05,0.5982767321249917,0.58922524633316,0.5567616463138851,0.5572139303482587,1.0,1.0,undersample,0.5571055554634526,0.5390460216494436,0.7726785349026252,0.433563009509246,COMPLETE
338,0.7156549520766773,2025-11-26 18:32:13.802380,2025-11-26 18:32:56.228372,0 days 00:00:42.425992,0.0013759225861201111,dart,0.8467888644700742,0.955120224331537,depthwise,0.16112200753798825,0.0005595620460777807,0,11,19.32893472858665,600,forest,0.6179712866971792,0.06945422155053754,0.021602025328871968,oversample,0.555175265789347,,10.0,0.8310007001008621,0.15453426461102857,weighted,0.13141409561844036,0.89566307096174,0.29099597185355025,0.5567616463138851,0.5572139303482587,0.715281812899477,0.7156549520766773,0.6179712866971792,0.06945422155053754,0.02,0.6684018305602777,0.6605136216175063,0.5567616463138851,0.5572139303482587,1.0,1.0,oversample,0.6483222533530065,0.6362757518273351,0.555175265789347,0.29099597185355025,COMPLETE
339,0.7156549520766773,2025-11-26 18:32:56.402665,2025-11-26 18:32:57.176038,0 days 00:00:00.773373,0.007336280411215301,gbtree,0.8054448702249332,4.161569545111348,lossguide,7.869428114590541,0.0004288029206470181,0,5,0.1735930335754269,500,,0.5196229951267434,0.48767168622488477,0.07798161517882349,none,0.8798759087881078,0.682984339787955,10.0,0.7521242247513678,,,,0.9177395389451324,0.22708623436671646,0.5567616463138851,0.5572139303482587,0.715281812899477,0.7156549520766773,0.5196229951267434,0.48767168622488477,0.08,0.5999551964040837,0.6035150905768524,0.5567616463138851,0.5572139303482587,1.0,1.0,none,0.534085031250518,0.5419698406802596,0.8798759087881078,0.22708623436671646,COMPLETE
340,0.7156549520766773,2025-11-26 18:32:57.354299,2025-11-26 18:33:15.068126,0 days 00:00:17.713827,9.054600912577829,dart,0.37046515732817514,9.436122751229455,lossguide,0.24110791532464318,0.00024397697087333731,3,6,0.10425794627350084,400,forest,0.6258644727891726,0.5748880968940661,0.052707228608121146,undersample,0.6505673219938279,,12.0,0.6346825227111542,0.2545801040262599,uniform,0.3796291945341248,0.7800757664440526,0.11775980995192353,0.5567616463138851,0.5572139303482587,0.715281812899477,0.7156549520766773,0.6258644727891726,0.5748880968940661,0.05,0.5567616463138851,0.5572139303482587,0.5567616463138851,0.5572139303482587,1.0,1.0,undersample,0.5,0.5,0.6505673219938279,0.11775980995192353,COMPLETE
341,0.7156549520766773,2025-11-26 18:33:15.236890,2025-11-26 18:33:33.100317,0 days 00:00:17.863427,69.60931870362279,dart,0.8650279411122859,6.297557080082769,lossguide,3.498505696856149,0.004282071881907392,10,8,1.8968555126093463,400,tree,0.831615010309103,0.2230070513602081,0.07044696115763804,oversample,0.9987934931678322,,10.0,0.8798131114921935,0.4203717521145459,weighted,0.602570709288058,0.607263878633975,0.4198424683834238,0.5567616463138851,0.5572139303482587,0.715281812899477,0.7156549520766773,0.831615010309103,0.2230070513602081,0.08,0.5567616463138851,0.5572139303482587,0.5567616463138851,0.5572139303482587,1.0,1.0,oversample,0.5,0.5,0.9987934931678322,0.4198424683834238,COMPLETE
342,0.7156549520766773,2025-11-26 18:33:33.274093,2025-11-26 18:33:44.468749,0 days 00:00:11.194656,10.850405121823561,dart,0.4045054079921929,2.6519530851890707,lossguide,0.009596494624314129,0.0007751291184692685,5,11,1.5152027803244503,300,forest,0.5805731778627847,0.8244672449329155,0.02801251808668803,undersample,0.5965430788223028,,11.0,0.7538221735983281,0.2746445048106293,weighted,0.5667242519194656,0.6375758154598765,0.056046845374037535,0.5567616463138851,0.5572139303482587,0.715281812899477,0.7156549520766773,0.5805731778627847,0.8244672449329155,0.02,0.5475973512177835,0.5263571882364313,0.5567616463138851,0.5572139303482587,1.0,1.0,undersample,0.5452958437639882,0.5221456594988259,0.5965430788223028,0.056046845374037535,COMPLETE
343,0.7156549520766773,2025-11-26 18:33:44.639435,2025-11-26 18:33:49.291398,0 days 00:00:04.651963,0.001730987006884282,dart,0.9340703876479344,9.013024383162884,lossguide,8.68661162488244,0.020213312077114447,6,7,11.980011175259474,200,tree,0.6643228902670246,0.8590031367514674,0.0947839265563962,oversample,0.7326504025162038,,8.0,0.7463452301092359,0.2687302192379132,weighted,0.23431649978106045,0.9377424398040493,0.37429148558915587,0.5567616463138851,0.5572139303482587,0.715281812899477,0.7156549520766773,0.6643228902670246,0.8590031367514674,0.1,0.52621349371862,0.5258749495914962,0.5567616463138851,0.5572139303482587,1.0,1.0,oversample,0.4034014986985859,0.3956342112943237,0.7326504025162038,0.37429148558915587,COMPLETE
344,0.7156549520766773,2025-11-26 18:33:49.466109,2025-11-26 18:34:37.065999,0 days 00:00:47.599890,17.83861865816029,dart,0.5553854648182601,5.37616298936225,lossguide,0.11133119693489718,0.0009837582163642186,9,8,29.52152622734799,600,forest,0.7850005198471813,0.13035845067891974,0.08365333753849381,undersample,0.9628918777424739,,12.0,0.9497479176376958,0.0019725505766723106,weighted,0.15918157963212096,0.5742021730821445,0.2376995244371127,0.5567616463138851,0.5572139303482587,0.715281812899477,0.7156549520766773,0.7850005198471813,0.13035845067891974,0.08,0.45299725582788836,0.45512221263542785,0.5567616463138851,0.5572139303482587,1.0,1.0,undersample,0.08934912714070192,0.09729854542801428,0.9628918777424739,0.2376995244371127,COMPLETE
345,0.7156549520766773,2025-11-26 18:34:37.236474,2025-11-26 18:35:20.012902,0 days 00:00:42.776428,0.05081685377178238,dart,0.9228804899699063,1.3898394576339836,depthwise,7.577889340197562,0.0073644629453473555,5,9,84.0831057240207,600,forest,0.9179003803789637,0.14904951829244512,0.052265362025337214,undersample,0.7554170945001953,,11.0,0.7215719653961246,0.1486661837046595,uniform,0.32791958559092843,0.7907493153653415,0.22453247173564428,0.5567616463138851,0.5572139303482587,0.715281812899477,0.7156549520766773,0.9179003803789637,0.14904951829244512,0.05,0.5567616463138851,0.5572139303482587,0.5567616463138851,0.5572139303482587,1.0,1.0,undersample,0.5,0.5,0.7554170945001953,0.22453247173564428,COMPLETE
346,0.7156549520766773,2025-11-26 18:35:20.187256,2025-11-26 18:36:12.824595,0 days 00:00:52.637339,1.7104802538572637,dart,0.6195892369935546,9.628488485776078,depthwise,0.06066892032443637,0.021436548065626587,1,4,0.5171647723501815,700,tree,0.7989688521550421,0.25887263738468513,0.07267631553412376,oversample,0.9616640610083553,,9.0,0.6770512300116656,0.2056479466409169,uniform,0.06421189125407473,0.6450232890277584,0.3334532261512312,0.5567616463138851,0.5572139303482587,0.715281812899477,0.7156549520766773,0.7989688521550421,0.25887263738468513,0.08,0.6341963051029373,0.614567990650955,0.5567616463138851,0.5572139303482587,1.0,1.0,oversample,0.6193633017788757,0.5868900315721052,0.9616640610083553,0.3334532261512312,COMPLETE
347,0.7156549520766773,2025-11-26 18:36:12.994305,2025-11-26 18:36:48.585812,0 days 00:00:35.591507,0.006352396636129344,dart,0.5031671164888656,6.698651127433578,depthwise,0.569676727576475,0.005339478465109447,0,3,0.26880588348968343,700,tree,0.6645009179272393,0.20471070247800607,0.08778447815530735,none,0.9688262138416375,1.2621188002279595,10.0,0.6188060241489559,0.47049112509248137,uniform,0.01554937028456016,0.5729870760942118,0.10546273867158865,0.5567616463138851,0.5572139303482587,0.715281812899477,0.7156549520766773,0.6645009179272393,0.20471070247800607,0.08,0.6288482442853287,0.6303778996375833,0.5567616463138851,0.5572139303482587,1.0,1.0,none,0.6158979757621976,0.6224447156520703,0.9688262138416375,0.10546273867158865,COMPLETE
348,0.7156549520766773,2025-11-26 18:36:48.752631,2025-11-26 18:37:32.741377,0 days 00:00:43.988746,9.291595422349394,dart,0.312975786780742,6.195984900925962,lossguide,0.015897987370903557,0.004971325789732814,7,11,0.31461361809189164,600,forest,0.6185870270140351,0.7697241284628352,0.0009671421153469792,undersample,0.702524981954132,,12.0,0.7391632676645484,0.49920363405543855,uniform,0.8332519540806775,0.8376811414333583,0.02587463371108356,0.5567616463138851,0.5572139303482587,0.715281812899477,0.7156549520766773,0.6185870270140351,0.7697241284628352,0.0,0.6192249938262991,0.6015516826567405,0.5567616463138851,0.5572139303482587,1.0,1.0,undersample,0.6058273512491917,0.5679521576482761,0.702524981954132,0.02587463371108356,COMPLETE
