number,value,datetime_start,datetime_complete,duration,params_alpha,params_booster,params_colsample_bytree,params_gamma,params_grow_policy,params_lambda,params_learning_rate,params_max_delta_step,params_max_depth,params_min_child_weight,params_n_estimators,params_normalize_type,params_params_feature_fraction,params_params_labeled_ratio,params_params_missing_rate,params_params_resampling,params_params_sample_rows,params_params_scale_pos_weight,params_params_selftrain_max_iter,params_params_selftrain_threshold,params_rate_drop,params_sample_type,params_skip_drop,params_subsample,params_user_attrs_decision_threshold,user_attrs_acc_test,user_attrs_acc_val,user_attrs_f1_test,user_attrs_f1_val,user_attrs_feature_fraction,user_attrs_labeled_ratio,user_attrs_missing_rate,user_attrs_pr_auc_test,user_attrs_pr_auc_val,user_attrs_prec_test,user_attrs_prec_val,user_attrs_rec_test,user_attrs_rec_val,user_attrs_resampling_strategy,user_attrs_roc_auc_test,user_attrs_roc_auc_val,user_attrs_sample_rows,user_attrs_user_attrs_decision_threshold,state
1500,0.7156549520766773,2025-11-27 06:14:46.640821,2025-11-27 06:14:47.710451,0 days 00:00:01.069630,0.5974816968896878,gbtree,0.8818297928248614,0.6634474064353747,lossguide,51.78575389673417,0.022288180015065384,10,5,82.73085534829826,900,,0.8111181520442594,0.6506736564730928,0.011288477326984282,oversample,0.5034462974263332,,8.0,0.653212752358345,,,,0.3648028140569429,0.3169877628921137,0.5567616463138851,0.5572139303482587,0.715281812899477,0.7156549520766773,0.8111181520442594,0.6506736564730928,0.02,0.49151400060535694,0.4844632853864673,0.5567616463138851,0.5572139303482587,1.0,1.0,oversample,0.39708549544919514,0.3899926044333603,0.5034462974263332,0.3169877628921137,COMPLETE
1501,0.2980308674827036,2025-11-27 06:14:47.898532,2025-11-27 06:22:18.493313,0 days 00:07:30.594781,0.011742329708406544,dart,0.7638681719179115,4.131861438257905,depthwise,0.4340781278239384,0.04453329822798301,6,6,0.5365561347165325,800,forest,0.84178182361947,0.6888599846000438,0.03698994631560444,oversample,0.7700186238088421,,10.0,0.6184276862905911,0.13494055834762397,weighted,0.6899945460450572,0.5241215526714392,0.7366224509228618,0.40660334690185435,0.40343735866123925,0.29914529914529914,0.2980308674827036,0.84178182361947,0.6888599846000438,0.05,0.48172795990569883,0.4790764713814879,0.43681747269890797,0.4327666151468315,0.22745735174654752,0.22727272727272727,oversample,0.41347999801057705,0.4053384052107239,0.7700186238088421,0.7366224509228618,COMPLETE
1502,0.7117143700206551,2025-11-27 06:22:18.674846,2025-11-27 06:22:23.985394,0 days 00:00:05.310548,0.01050942850412198,gbtree,0.992769124659044,0.6264838489496628,lossguide,17.918110901984004,0.33610017833866285,10,11,3.013593738101972,600,,0.9175099373236674,0.6667150096457792,0.09032387529172455,undersample,0.6408137843286472,,7.0,0.7213214108803373,,,,0.7029674147874679,0.0467572972971903,0.5499773857982814,0.5581184984170059,0.7074389885327845,0.7117143700206551,0.9175099373236674,0.6667150096457792,0.1,0.5307997985576185,0.5304355872806675,0.5543778801843318,0.5591098748261474,0.9772542648253453,0.9788961038961039,undersample,0.476448548550208,0.4738792234323389,0.6408137843286472,0.0467572972971903,COMPLETE
1503,0.7156549520766773,2025-11-27 06:22:24.167855,2025-11-27 06:28:47.816944,0 days 00:06:23.649089,3.0701793521348053,dart,0.8335490594673418,1.7700133216623575,lossguide,3.5360894983808184,0.02179839370315932,2,5,0.1952515264794076,800,forest,0.7653981447701423,0.7122700066111923,0.02353973237639702,oversample,0.7936201270879759,,8.0,0.6087909052698296,0.1586594256294989,uniform,0.756309064692974,0.4200471403525129,0.4012640547109251,0.5567616463138851,0.5572139303482587,0.715281812899477,0.7156549520766773,0.7653981447701423,0.7122700066111923,0.02,0.5096259670977286,0.5027938479903684,0.5567616463138851,0.5572139303482587,1.0,1.0,oversample,0.4465114640494703,0.4553708229972275,0.7936201270879759,0.4012640547109251,COMPLETE
1504,0.7149084568439407,2025-11-27 06:28:48.001604,2025-11-27 06:33:00.393084,0 days 00:04:12.391480,2.8516058160408977,dart,0.5948769367007649,3.0902350999972295,lossguide,3.800388063095792,0.19283459749995893,4,12,1.4582312559754005,800,tree,0.9788147940985308,0.4530800682377172,0.032846981261828515,none,0.7066584821608306,1.7414915352483453,10.0,0.6582656639811229,0.19745718369247295,weighted,0.8905012535922042,0.3303024567736135,0.6503826755656593,0.5563093622795116,0.5563093622795116,0.7145766656968287,0.7149084568439407,0.9788147940985308,0.4530800682377172,0.02,0.5637676203237985,0.543411013402547,0.556663644605621,0.5568130375735627,0.9975629569455727,0.9983766233766234,none,0.5025075017821914,0.47618370521205045,0.7066584821608306,0.6503826755656593,COMPLETE
1505,0.0,2025-11-27 06:33:00.572247,2025-11-27 06:33:01.695921,0 days 00:00:01.123674,9.991311710960384,gbtree,0.6788175354656093,1.6996857474797076,lossguide,0.005280876211079772,0.005894663202057282,6,8,1.8903332559886397,800,,0.8500033444050091,0.22438763566821512,0.08589547862990025,oversample,0.7181854628396126,,8.0,0.7653657660264567,,,,0.6688815573131281,0.6532561551785376,0.44323835368611486,0.4427860696517413,0.0,0.0,0.8500033444050091,0.22438763566821512,0.08,0.5413581862038503,0.5653389070836441,0.0,0.0,0.0,0.0,oversample,0.4519707720618711,0.4748078147592959,0.7181854628396126,0.6532561551785376,COMPLETE
1506,0.00801924619085806,2025-11-27 06:33:01.882716,2025-11-27 06:33:13.470325,0 days 00:00:11.587609,0.00026734052174715945,gbtree,0.648443613399706,2.192434332360416,lossguide,0.0478256829391768,0.008436393645739969,0,6,0.1495961128549427,800,,0.8372791696375463,0.8320225862930217,0.03359544072687055,undersample,0.8041616743930837,,11.0,0.6454474777387793,,,,0.23654403242784777,0.7417342888267002,0.4396200814111262,0.44052464947987335,0.003218020917135961,0.00801924619085806,0.8372791696375463,0.8320225862930217,0.02,0.5319759587065702,0.542762065008672,0.16666666666666666,0.3333333333333333,0.0016246953696181965,0.004058441558441558,undersample,0.4936205838956216,0.5148947707042701,0.8041616743930837,0.7417342888267002,COMPLETE
1507,0.5529652351738241,2025-11-27 06:33:13.655530,2025-11-27 06:33:18.944247,0 days 00:00:05.288717,1.206778364705583,gbtree,0.2354509464098718,0.1632631384235097,depthwise,0.000932436391314098,0.29360014355918845,5,3,0.8395406803295814,900,,0.7959678824577899,0.4100818815194478,0.006162885661990486,undersample,0.8646272605900164,,9.0,0.8313100446337459,,,,0.6650268272710366,0.43202435600231465,0.49886928991406604,0.5056535504296699,0.5462735462735463,0.5529652351738241,0.7959678824577899,0.4100818815194478,0.0,0.5312040120881979,0.5275956562884668,0.550784475639967,0.5572959604286892,0.5418359057676686,0.5487012987012987,undersample,0.4864541023558083,0.48581784022922947,0.8646272605900164,0.43202435600231465,COMPLETE
1508,0.715862870424172,2025-11-27 06:33:19.133180,2025-11-27 06:40:06.414029,0 days 00:06:47.280849,1.135432654998184,dart,0.5571265304296059,2.137966095791496,lossguide,13.002516496047832,0.03525857365870365,4,7,0.30635196758703265,700,forest,0.9811016582289112,0.8950528816541555,0.04321302176588174,oversample,0.5708751082908903,,12.0,0.608720463934898,0.26763741544631714,weighted,0.7300252932758934,0.34483209817781335,0.34174309348056203,0.5567616463138851,0.5576662143826323,0.715281812899477,0.715862870424172,0.9811016582289112,0.8950528816541555,0.05,0.4915162054429759,0.4877903707787193,0.5567616463138851,0.5574660633484163,1.0,1.0,oversample,0.4121686367479567,0.4102814958279718,0.5708751082908903,0.34174309348056203,COMPLETE
1509,0.7156549520766773,2025-11-27 06:40:06.605205,2025-11-27 06:41:14.316018,0 days 00:01:07.710813,0.4058643489147143,dart,0.6912189488716458,4.141537685551058,depthwise,0.8882996685645868,0.022113356814226263,2,5,7.940983555770187,500,forest,0.9951117920874183,0.5771284090876481,0.05770978480993012,none,0.8526579714475664,1.3809224474194173,6.0,0.61041380106236,0.011409435027629589,uniform,0.8401974205359339,0.20630084451116523,0.5414932467809983,0.5567616463138851,0.5572139303482587,0.715281812899477,0.7156549520766773,0.9951117920874183,0.5771284090876481,0.05,0.6306569147985642,0.6154013513846364,0.5567616463138851,0.5572139303482587,1.0,1.0,none,0.5652655050647392,0.5597100805221337,0.8526579714475664,0.5414932467809983,COMPLETE
1510,0.23400129282482224,2025-11-27 06:41:14.501515,2025-11-27 06:41:35.925414,0 days 00:00:21.423899,0.12024590381092665,dart,0.8373668088923392,0.7977425022094689,lossguide,2.151495516911263,0.025776561379771596,10,4,3.7498241443206943,400,forest,0.7137221235469141,0.5542597940119802,0.012379882690111761,oversample,0.5557373360653236,,9.0,0.7923742050247842,0.20019928614978896,weighted,0.6353286082827689,0.23143226753558566,0.6363085605069572,0.45680687471732245,0.46404341926729986,0.20934825543120475,0.23400129282482224,0.7137221235469141,0.5542597940119802,0.02,0.5845528529537292,0.5906719608395079,0.5520833333333334,0.5746031746031746,0.12916328188464662,0.14691558441558442,oversample,0.5690018899517565,0.5713021337702134,0.5557373360653236,0.6363085605069572,COMPLETE
1511,0.7156549520766773,2025-11-27 06:41:36.112079,2025-11-27 06:41:36.960437,0 days 00:00:00.848358,67.39261705889895,gbtree,0.94908413275322,0.773913503471323,lossguide,1.798997803713978,0.021006824416379286,8,6,17.163119542853014,600,,0.9325488450598585,0.8342821321310356,0.011457775781784064,oversample,0.6115280926562474,,5.0,0.8549969772687853,,,,0.2571941341395382,0.3996044838777845,0.5567616463138851,0.5572139303482587,0.715281812899477,0.7156549520766773,0.9325488450598585,0.8342821321310356,0.02,0.5567616463138851,0.5572139303482587,0.5567616463138851,0.5572139303482587,1.0,1.0,oversample,0.5,0.5,0.6115280926562474,0.3996044838777845,COMPLETE
1512,0.7156549520766773,2025-11-27 06:41:37.144696,2025-11-27 06:41:38.228044,0 days 00:00:01.083348,0.08774808729982832,gbtree,0.6373750035860406,5.329810653177217,lossguide,0.16230845706539052,0.013712472743903673,1,6,1.1255619514413115,700,,0.9663257766072979,0.6677998254864382,0.010290842638139005,none,0.9410227263626336,2.1575645155224175,11.0,0.6096232619820066,,,,0.3153229421036295,0.44721732345867216,0.5567616463138851,0.5572139303482587,0.715281812899477,0.7156549520766773,0.9663257766072979,0.6677998254864382,0.02,0.5888942785300972,0.5845068328600338,0.5567616463138851,0.5572139303482587,1.0,1.0,none,0.5990881811701122,0.5911876683071781,0.9410227263626336,0.44721732345867216,COMPLETE
1513,0.7156549520766773,2025-11-27 06:41:38.409475,2025-11-27 06:41:39.052717,0 days 00:00:00.643242,0.1259272499772228,gbtree,0.568273348912502,4.905446358732866,lossguide,18.477952516977908,0.014765936328549415,9,12,17.64189837102352,200,,0.8547746241105969,0.927204456869062,0.018025766039922727,oversample,0.6389410946025942,,11.0,0.8532333290377059,,,,0.45783161905751313,0.4958960379550115,0.5567616463138851,0.5572139303482587,0.715281812899477,0.7156549520766773,0.8547746241105969,0.927204456869062,0.02,0.48224186939762004,0.4738787897885266,0.5567616463138851,0.5572139303482587,1.0,1.0,oversample,0.4188153815547341,0.402988737513763,0.6389410946025942,0.4958960379550115,COMPLETE
1514,0.7156549520766773,2025-11-27 06:41:39.239154,2025-11-27 06:43:22.464277,0 days 00:01:43.225123,28.630686892862457,dart,0.855477704410239,1.600398522015742,lossguide,0.0464033718454973,0.09511616381334921,3,9,1.785717989128392,900,forest,0.8092714457001523,0.5423321125164923,0.07051909154666239,oversample,0.7493766852884602,,8.0,0.6504389816904681,0.08819005386026124,weighted,0.5634800581261903,0.31662970642773197,0.4678486808280462,0.5567616463138851,0.5572139303482587,0.715281812899477,0.7156549520766773,0.8092714457001523,0.5423321125164923,0.08,0.5693587259396442,0.5745126905872597,0.5567616463138851,0.5572139303482587,1.0,1.0,oversample,0.5446894842421128,0.5402967180929388,0.7493766852884602,0.4678486808280462,COMPLETE
1515,0.708007224563516,2025-11-27 06:43:22.644419,2025-11-27 06:43:23.465474,0 days 00:00:00.821055,0.0005840487026219077,gbtree,0.48653848355382423,4.472372350253343,lossguide,0.0004013005431041982,0.02243992679402204,10,10,0.13924975955154337,500,,0.5244719382966416,0.46224094673507493,0.009252154429303088,oversample,0.8416982850955812,,7.0,0.6619208393932523,,,,0.6286458035988878,0.5218569414072569,0.5662596110357304,0.561284486657621,0.7133034379671152,0.708007224563516,0.5244719382966416,0.46224094673507493,0.0,0.5194222999764524,0.5093507865556814,0.564333017975402,0.5626794258373206,0.9691307879772543,0.9545454545454546,oversample,0.48517589814154743,0.4654671809293873,0.8416982850955812,0.5218569414072569,COMPLETE
1516,0.7156549520766773,2025-11-27 06:43:23.650346,2025-11-27 06:43:24.591672,0 days 00:00:00.941326,0.03639269108453813,gbtree,0.8919557109919503,0.49262403386595643,lossguide,1.1423916406712544,0.09686310040531765,9,4,58.6203274112663,400,,0.8065168335846128,0.9336530819118168,0.0037686664190630962,undersample,0.5114321769887434,,9.0,0.7174897395543872,,,,0.487302370158986,0.26502183029603127,0.5567616463138851,0.5572139303482587,0.715281812899477,0.7156549520766773,0.8065168335846128,0.9336530819118168,0.0,0.5869311147772035,0.573411360589088,0.5567616463138851,0.5572139303482587,1.0,1.0,undersample,0.5425939587857889,0.5366768701166046,0.5114321769887434,0.26502183029603127,COMPLETE
1517,0.0,2025-11-27 06:43:24.775292,2025-11-27 06:43:28.176581,0 days 00:00:03.401289,0.4489978085131829,gbtree,0.4332677260375582,4.226606532986053,lossguide,0.5897568024911566,0.17887310555279376,1,6,0.6210249321824847,700,,0.7731309351281976,0.7760126537139678,0.0003603179587344345,oversample,0.6905978178440613,,11.0,0.6384294865875413,,,,0.3911413626492692,0.9610815841603457,0.44323835368611486,0.4427860696517413,0.0,0.0,0.7731309351281976,0.7760126537139678,0.0,0.5257133413996252,0.518075835666642,0.0,0.0,0.0,0.0,oversample,0.4980424907574728,0.49059262366846634,0.6905978178440613,0.9610815841603457,COMPLETE
1518,0.3918067226890756,2025-11-27 06:43:28.361968,2025-11-27 06:54:08.726737,0 days 00:10:40.364769,0.34924243629854695,dart,0.8303513328172123,1.1325141219772499,lossguide,0.00037727785882868284,0.06998073181329956,0,5,0.8389714622565797,900,forest,0.7190176808273769,0.4342429417202933,0.00686722851613733,none,0.8533735932564636,1.0954072136418826,11.0,0.6807521571537255,0.11702668903067961,weighted,0.7911762282464887,0.24093471464445682,0.838734149519409,0.4699231117141565,0.4762550881953867,0.3883089770354906,0.3918067226890756,0.7190176808273769,0.4342429417202933,0.0,0.5491879391899726,0.5680023293839267,0.5430656934306569,0.5550595238095238,0.3021933387489846,0.3027597402597403,none,0.4770345993799632,0.502400242760304,0.8533735932564636,0.838734149519409,COMPLETE
1519,0.0,2025-11-27 06:54:08.913342,2025-11-27 06:54:09.719533,0 days 00:00:00.806191,0.03208874579577848,gbtree,0.7035064168856975,1.4425263669109132,lossguide,22.343849610052075,0.0009752224057949,6,10,7.3428267689561215,400,,0.9008812036257233,0.10501823256477319,0.06097761683804571,undersample,0.5612088350157344,,6.0,0.717840788176266,,,,0.8391878681530573,0.7322084985836543,0.44323835368611486,0.4427860696517413,0.0,0.0,0.9008812036257233,0.10501823256477319,0.05,0.4142304811409624,0.4131094787387999,0.0,0.0,0.0,0.0,undersample,0.26128624479848805,0.25268503840388423,0.5612088350157344,0.7322084985836543,COMPLETE
1520,0.7156549520766773,2025-11-27 06:54:09.903854,2025-11-27 06:54:11.121155,0 days 00:00:01.217301,0.00047386699869070845,gbtree,0.69404337411164,3.926950259679354,lossguide,3.8805634126575037,0.2230068846508418,9,6,7.172216269652707,600,,0.760930020554358,0.9164124971807032,0.02584456909381537,oversample,0.5400419520022047,,11.0,0.746415764401822,,,,0.5253365445388466,0.1544153245372401,0.5567616463138851,0.5572139303482587,0.715281812899477,0.7156549520766773,0.760930020554358,0.9164124971807032,0.02,0.6340186567202131,0.64898052669225,0.5567616463138851,0.5572139303482587,1.0,1.0,oversample,0.6076439430361908,0.6155088846291604,0.5400419520022047,0.1544153245372401,COMPLETE
1521,0.6461647225167904,2025-11-27 06:54:11.299568,2025-11-27 06:59:08.121883,0 days 00:04:56.822315,0.08174440747392908,dart,0.8063033456056418,2.2528294750667985,lossguide,0.0006592617812750796,0.0059797965807340024,0,6,0.8955704002817694,600,forest,0.8360793952762118,0.9262538965404874,0.0369754294644314,none,0.9313431628813714,1.5641265240444193,11.0,0.6742312317876895,0.016785791734004518,weighted,0.7035951206245925,0.2361446706982984,0.6395032012763879,0.5278154681139756,0.5472636815920398,0.6313559322033898,0.6461647225167904,0.8360793952762118,0.9262538965404874,0.05,0.5273823488944545,0.5254697998150062,0.5584009993753903,0.5723231058234189,0.7262388302193339,0.7418831168831169,none,0.48101220179379633,0.49710271214995416,0.9313431628813714,0.6395032012763879,COMPLETE
1522,0.0,2025-11-27 06:59:08.298738,2025-11-27 06:59:09.304602,0 days 00:00:01.005864,0.046449835909273804,gbtree,0.2284644413134317,8.10180693817226,depthwise,0.17404454386422408,0.040153676916619835,6,4,1.2258129905424984,900,,0.7129099877138383,0.5518600562544833,0.0032546359150242834,none,0.9287133966715793,1.0334734752205037,10.0,0.8416056493182064,,,,0.9573800257945948,0.7999209451351414,0.44323835368611486,0.4427860696517413,0.0,0.0,0.7129099877138383,0.5518600562544833,0.0,0.52621349371862,0.5258749495914962,0.0,0.0,0.0,0.0,none,0.4034014986985859,0.3956342112943237,0.9287133966715793,0.7999209451351414,COMPLETE
1523,0.7156549520766773,2025-11-27 06:59:09.484101,2025-11-27 06:59:10.313256,0 days 00:00:00.829155,0.006890861838636088,gbtree,0.5270323244952982,1.2616351468076195,lossguide,63.7619902642015,0.01918334040401397,10,12,6.622239114422535,500,,0.9885048346270859,0.32381076136466724,0.07349728185849878,oversample,0.6723344184143367,,7.0,0.6674919082671228,,,,0.7188057968438574,0.38099662609217777,0.5567616463138851,0.5572139303482587,0.715281812899477,0.7156549520766773,0.9885048346270859,0.32381076136466724,0.08,0.45367135367290945,0.45775345836141523,0.5567616463138851,0.5572139303482587,1.0,1.0,oversample,0.3567951225981863,0.37005400753485534,0.6723344184143367,0.38099662609217777,COMPLETE
1524,0.3395196506550218,2025-11-27 06:59:10.491060,2025-11-27 06:59:41.168690,0 days 00:00:30.677630,0.006745382742553743,dart,0.525548772653378,1.3382942281468688,lossguide,30.679102007784795,0.03682252976749815,9,12,5.8213380166663695,500,tree,0.8692437851944984,0.24627439691642797,0.09234338493818774,undersample,0.5135484166039164,,5.0,0.7001159217861058,0.10479499043275542,weighted,0.6944614343913249,0.4621111426247731,0.5211369287368967,0.46494798733604703,0.4527363184079602,0.3350196739741428,0.3395196506550218,0.8692437851944984,0.24627439691642797,0.1,0.5543736234426833,0.5389431154533662,0.5437956204379562,0.5183333333333333,0.2420796100731113,0.25243506493506496,undersample,0.4788225932127522,0.45980899208044257,0.5135484166039164,0.5211369287368967,COMPLETE
1525,0.0,2025-11-27 06:59:41.342851,2025-11-27 06:59:42.036296,0 days 00:00:00.693445,54.86106102907693,gbtree,0.9011848175185161,1.57322807363738,lossguide,1.4909703333652153,0.004895321550708652,10,6,25.427356800172056,400,,0.9136642354048727,0.8491436675982732,0.021508666199478436,undersample,0.519341315920699,,8.0,0.6665152484953112,,,,0.28674210750295726,0.7427368625412014,0.44323835368611486,0.4427860696517413,0.0,0.0,0.9136642354048727,0.8491436675982732,0.02,0.5567616463138851,0.5572139303482587,0.0,0.0,0.0,0.0,undersample,0.5,0.5,0.519341315920699,0.7427368625412014,COMPLETE
1526,0.740627390971691,2025-11-27 06:59:42.215632,2025-11-27 07:02:55.893422,0 days 00:03:13.677790,0.04811593618649192,dart,0.8418777249538276,0.22046698726455283,lossguide,2.0086462548359476,0.01164346010247625,8,12,2.843297308121233,700,tree,0.701684900894346,0.05158492488573671,0.06945512360091725,oversample,0.5136868960944443,,5.0,0.6745778213168441,0.4221653575621427,weighted,0.8973548457438731,0.7785686125279123,0.29563668537506854,0.6752600633197648,0.6933514246947082,0.7274107820804859,0.740627390971691,0.701684900894346,0.05158492488573671,0.08,0.7294148543986081,0.7499821634715745,0.6828225231646472,0.7004341534008683,0.7782290820471162,0.7857142857142857,oversample,0.699626154279746,0.7164446891208893,0.5136868960944443,0.29563668537506854,COMPLETE
1527,0.6924275475225927,2025-11-27 07:02:56.071542,2025-11-27 07:05:58.452987,0 days 00:03:02.381445,1.0077656924248704,dart,0.863141059581321,0.8496495940287819,lossguide,11.10042530363406,0.027912168965105826,7,12,2.527129931899516,700,tree,0.6615239486623781,0.14850334688407035,0.08345341993586688,oversample,0.5366833715194342,,5.0,0.7503515995425742,0.38899619902116384,weighted,0.8568899636831411,0.7265271934668986,0.3575864908260017,0.5590230664857531,0.55359565807327,0.6932997798049702,0.6924275475225927,0.6615239486623781,0.14850334688407035,0.08,0.5201826707692532,0.5311121267219682,0.5657084188911704,0.5619625695498229,0.8952071486596264,0.9017857142857143,oversample,0.46764369435832825,0.4746531877213695,0.5366833715194342,0.3575864908260017,COMPLETE
1528,0.7156549520766773,2025-11-27 07:05:58.632538,2025-11-27 07:07:02.855059,0 days 00:01:04.222521,0.09776712005158113,dart,0.8182052919593032,1.1975634122388599,lossguide,1.4553074739423806,0.0011111868486401936,10,10,5.5070260501724135,700,tree,0.642328715533931,0.4329974203033893,0.0687124283100746,oversample,0.5678035645323901,,5.0,0.6817957984118832,0.44716414348963185,weighted,0.8894110967455972,0.6706513666520877,0.33314572144500515,0.5567616463138851,0.5572139303482587,0.715281812899477,0.7156549520766773,0.642328715533931,0.4329974203033893,0.08,0.5366624678359877,0.5318923193742753,0.5567616463138851,0.5572139303482587,1.0,1.0,oversample,0.5013536364992789,0.502050362813897,0.5678035645323901,0.33314572144500515,COMPLETE
