number,value,datetime_start,datetime_complete,duration,params_alpha,params_booster,params_colsample_bytree,params_gamma,params_grow_policy,params_lambda,params_learning_rate,params_max_delta_step,params_max_depth,params_min_child_weight,params_n_estimators,params_normalize_type,params_params_feature_fraction,params_params_labeled_ratio,params_params_missing_rate,params_params_resampling,params_params_sample_rows,params_params_scale_pos_weight,params_params_selftrain_max_iter,params_params_selftrain_threshold,params_rate_drop,params_sample_type,params_skip_drop,params_subsample,params_user_attrs_decision_threshold,user_attrs_acc_test,user_attrs_acc_val,user_attrs_f1_test,user_attrs_f1_val,user_attrs_feature_fraction,user_attrs_labeled_ratio,user_attrs_missing_rate,user_attrs_pr_auc_test,user_attrs_pr_auc_val,user_attrs_prec_test,user_attrs_prec_val,user_attrs_rec_test,user_attrs_rec_val,user_attrs_resampling_strategy,user_attrs_roc_auc_test,user_attrs_roc_auc_val,user_attrs_sample_rows,user_attrs_user_attrs_decision_threshold,state
1557,0.2937062937062937,2025-11-27 07:45:15.944776,2025-11-27 07:46:07.513652,0 days 00:00:51.568876,0.00039982211624097494,dart,0.966318873861826,2.5319409515900593,lossguide,2.6392312031812644,0.006292399856589563,0,5,0.15613627499116203,500,tree,0.6779792514428217,0.68628202054886,0.02790342711836332,none,0.8579671035547238,1.66009285722751,12.0,0.6016134607556519,0.4986831872500019,weighted,0.8473369293497715,0.2436441670929308,0.8045130818665408,0.5042966983265491,0.4975124378109453,0.3141426783479349,0.2937062937062937,0.6779792514428217,0.68628202054886,0.02,0.6330060590176012,0.6285471174205752,0.6839237057220708,0.6774193548387096,0.20389926888708368,0.1875,none,0.5634642484126063,0.5601320921162597,0.8579671035547238,0.8045130818665408,COMPLETE
1558,0.7156549520766773,2025-11-27 07:46:07.719537,2025-11-27 07:48:09.645807,0 days 00:02:01.926270,0.00840489358527942,dart,0.7874375229002507,1.3524330276604084,lossguide,0.23669105926122275,0.0024375904059886254,7,11,4.233882025617101,600,tree,0.7374690756096307,0.16186323014306564,0.07003714562407956,oversample,0.519921715145446,,7.0,0.6185217086614083,0.4089553425873802,weighted,0.7669066873105778,0.614062935125232,0.5198639243215847,0.5567616463138851,0.5572139303482587,0.715281812899477,0.7156549520766773,0.7374690756096307,0.16186323014306564,0.08,0.5255991000080037,0.5250174658441324,0.5567616463138851,0.5572139303482587,1.0,1.0,oversample,0.48518874649778676,0.4813013212528023,0.519921715145446,0.5198639243215847,COMPLETE
1559,0.0,2025-11-27 07:48:09.858323,2025-11-27 07:49:14.566342,0 days 00:01:04.708019,0.00013634290944873463,dart,0.8558955058053768,2.0907995750182535,lossguide,0.6590056718272749,0.0387422582277647,6,10,10.609621439831713,700,tree,0.6860322176117322,0.521121123952138,0.07591187515763667,undersample,0.5968752837527334,,5.0,0.6715948878543373,0.37774905484097954,weighted,0.8769609432687224,0.9497698415662825,0.6629898298178336,0.44323835368611486,0.4427860696517413,0.0,0.0,0.6860322176117322,0.521121123952138,0.08,0.4845691493504289,0.48210455325871737,0.0,0.0,0.0,0.0,undersample,0.41601195311593364,0.4166825577384822,0.5968752837527334,0.6629898298178336,COMPLETE
1560,0.670926517571885,2025-11-27 07:49:14.749410,2025-11-27 07:53:33.222768,0 days 00:04:18.473358,0.00448148844891222,dart,0.988523734456979,0.26359838178209527,lossguide,0.013145664413353955,0.012129286390138428,0,7,0.21305120180033013,500,tree,0.8843822305641574,0.5294590418284907,0.029753124425994183,oversample,0.8144563390343121,,12.0,0.7500501640550968,0.42152292007510395,weighted,0.8904454982287696,0.3435523509433176,0.372191275089264,0.550429669832655,0.5341474445952058,0.6805912596401028,0.670926517571885,0.8843822305641574,0.5294590418284907,0.02,0.5394423523658983,0.5119082088084339,0.5629984051036683,0.553213909378293,0.8602761982128351,0.8522727272727273,oversample,0.4824624081964224,0.44947219532255284,0.8144563390343121,0.372191275089264,COMPLETE
1561,0.0,2025-11-27 07:53:33.414674,2025-11-27 07:53:34.506091,0 days 00:00:01.091417,0.478593836301384,gbtree,0.7303253778852603,6.070693321834726,lossguide,7.588979971609779,0.004809634256672958,10,4,1.7871314051569576,600,,0.9064695047567444,0.8002178811588361,0.0072833203259144545,oversample,0.657000919644693,,5.0,0.6891847961264456,,,,0.3665426511505549,0.595607752738577,0.44323835368611486,0.4427860696517413,0.0,0.0,0.9064695047567444,0.8002178811588361,0.0,0.540785069150634,0.5222178411560322,0.0,0.0,0.0,0.0,oversample,0.48859231751189514,0.4658460793547617,0.657000919644693,0.595607752738577,COMPLETE
1562,0.12454742939898625,2025-11-27 07:53:34.693553,2025-11-27 07:53:35.808380,0 days 00:00:01.114827,8.951935478322204,gbtree,0.8206224223003751,3.593072400655358,lossguide,0.5087430288974384,0.28787408060248976,10,6,2.7965047078666796,600,,0.9972326919316309,0.7154549766296653,0.0328439426464902,oversample,0.8332588054451165,,5.0,0.7349726739606512,,,,0.38862320661322164,0.6340520537081347,0.44549977385798284,0.4531886024423338,0.09587020648967552,0.12454742939898625,0.9972326919316309,0.7154549766296653,0.02,0.5486335187503617,0.5586062236185682,0.52,0.5771812080536913,0.05280259951259139,0.0698051948051948,oversample,0.4929263581955934,0.497112661342743,0.8332588054451165,0.6340520537081347,COMPLETE
1563,0.0,2025-11-27 07:53:35.999282,2025-11-27 07:54:22.212791,0 days 00:00:46.213509,0.002049751666073403,dart,0.7654104170643931,3.299843961075012,depthwise,0.006378994315585778,0.0007238355684659744,2,8,2.0810198158251922,600,tree,0.7391255119528243,0.777165749689361,0.03883819248627203,none,0.8058141501923067,1.226593590003241,12.0,0.6748119770451989,0.4892147914830682,weighted,0.7363455591266073,0.358385205925987,0.8371821663658503,0.44323835368611486,0.4427860696517413,0.0,0.0,0.7391255119528243,0.777165749689361,0.05,0.5676132049320696,0.5654837856564348,0.0,0.0,0.0,0.0,none,0.5491445481523235,0.5471098424047862,0.8058141501923067,0.8371821663658503,COMPLETE
1564,0.7156549520766773,2025-11-27 07:54:22.399421,2025-11-27 07:54:23.372223,0 days 00:00:00.972802,1.7573783032912125,gbtree,0.7144220450575826,4.119968471803119,lossguide,15.974822762338274,0.006549983074144912,4,8,0.11379200172401266,700,,0.7958325686834969,0.5376363348460865,0.07255571944269162,oversample,0.7167634181846687,,11.0,0.682457180600589,,,,0.20795590369776037,0.35436342063839993,0.5567616463138851,0.5572139303482587,0.715281812899477,0.7156549520766773,0.7958325686834969,0.5376363348460865,0.08,0.5071877868600343,0.47616829154496676,0.5567616463138851,0.5572139303482587,1.0,1.0,oversample,0.426045275949535,0.38297013252324796,0.7167634181846687,0.35436342063839993,COMPLETE
1565,0.0,2025-11-27 07:54:23.574166,2025-11-27 07:54:24.287860,0 days 00:00:00.713694,0.022856886101384997,gbtree,0.44824446478855356,3.3636925879381154,lossguide,21.44676187912824,0.0044198337989902504,10,4,14.663979996998588,300,,0.9469253403272687,0.5294138519403584,0.04493621469314864,oversample,0.666488031762296,,5.0,0.7637445675126537,,,,0.37882859999344537,0.5788044226439057,0.44323835368611486,0.4427860696517413,0.0,0.0,0.9469253403272687,0.5294138519403584,0.05,0.6607631503682693,0.6929924742561065,0.0,0.0,0.0,0.0,oversample,0.6197139375652779,0.6399743642465808,0.666488031762296,0.5788044226439057,COMPLETE
1566,0.7156549520766773,2025-11-27 07:54:24.474741,2025-11-27 07:54:25.403785,0 days 00:00:00.929044,0.0009877835792216913,gbtree,0.7055508558768881,1.4844712191119345,lossguide,0.44027574102514283,0.005208104813913012,9,12,78.1446590765117,700,,0.7687821860185202,0.27822235069784157,0.060358211773835865,oversample,0.516697649962041,,8.0,0.6618390677298992,,,,0.7808135368084769,0.4898194939042847,0.5567616463138851,0.5572139303482587,0.715281812899477,0.7156549520766773,0.7687821860185202,0.27822235069784157,0.05,0.5592883989253329,0.5697995678278072,0.5567616463138851,0.5572139303482587,1.0,1.0,oversample,0.4673751222666158,0.48317094039770236,0.516697649962041,0.4898194939042847,COMPLETE
1567,0.7156549520766773,2025-11-27 07:54:25.593195,2025-11-27 07:54:26.422372,0 days 00:00:00.829177,13.03834243521409,gbtree,0.600371354256201,6.631967419799302,lossguide,0.06630261456710823,0.09219722856371845,8,5,1.7297135190561705,500,,0.8668903579821597,0.6131191547688255,0.018504985345599502,undersample,0.8549084569610664,,6.0,0.7795800048470791,,,,0.28716303806312315,0.4074736388558536,0.5567616463138851,0.5572139303482587,0.715281812899477,0.7156549520766773,0.8668903579821597,0.6131191547688255,0.02,0.43986724301761165,0.4371601322123597,0.5567616463138851,0.5572139303482587,1.0,1.0,undersample,0.22667235862663504,0.2193676790523062,0.8549084569610664,0.4074736388558536,COMPLETE
1568,0.7156549520766773,2025-11-27 07:54:26.614358,2025-11-27 07:56:13.229586,0 days 00:01:46.615228,0.004541965021646978,dart,0.9396591799355463,0.9102517548007,lossguide,0.5095169324658575,0.00028184013828720666,6,12,1.555178818099841,900,tree,0.5634573983545511,0.054425358165456454,0.018333803172265538,oversample,0.6290757353144868,,5.0,0.8129930037695464,0.3655137910389453,weighted,0.7315306982369327,0.6913722301044246,0.09195051542269037,0.5567616463138851,0.5572139303482587,0.715281812899477,0.7156549520766773,0.5634573983545511,0.054425358165456454,0.02,0.6843516418855329,0.7349153907010602,0.5567616463138851,0.5572139303482587,1.0,1.0,oversample,0.6028150334057262,0.6628322201292068,0.6290757353144868,0.09195051542269037,COMPLETE
1569,0.7156549520766773,2025-11-27 07:56:13.416940,2025-11-27 07:57:38.376755,0 days 00:01:24.959815,9.23877392174156,dart,0.5393854091156822,1.0869703649060718,depthwise,7.1673014521350895,0.004316241102046429,6,12,2.7043422172475045,800,tree,0.7137312637618298,0.09498726113197373,0.04588603382892265,oversample,0.5789716657088174,,7.0,0.7611471840771771,0.3952892499793274,weighted,0.8930824956996108,0.7648469716837232,0.5249577814912934,0.5567616463138851,0.5572139303482587,0.715281812899477,0.7156549520766773,0.7137312637618298,0.09498726113197373,0.05,0.44686617882495516,0.45263063070998233,0.5567616463138851,0.5572139303482587,1.0,1.0,oversample,0.32819385268323414,0.34878760794874175,0.5789716657088174,0.5249577814912934,COMPLETE
1570,0.7156549520766773,2025-11-27 07:57:38.565354,2025-11-27 07:57:39.673595,0 days 00:00:01.108241,71.12206207105817,gbtree,0.42770894423897926,2.7214451636822576,depthwise,0.0007639497677331008,0.03314629099996409,10,12,1.2336631677647332,1000,,0.7110002453299713,0.8798552859009149,0.010795498934520444,oversample,0.738993277292223,,6.0,0.6919682577930444,,,,0.6426581008952148,0.38316169973329284,0.5567616463138851,0.5572139303482587,0.715281812899477,0.7156549520766773,0.7110002453299713,0.8798552859009149,0.02,0.5567616463138851,0.5572139303482587,0.5567616463138851,0.5572139303482587,1.0,1.0,oversample,0.5,0.5,0.738993277292223,0.38316169973329284,COMPLETE
1571,0.0,2025-11-27 07:57:39.861047,2025-11-27 07:57:41.059949,0 days 00:00:01.198902,0.25660339580041025,gbtree,0.5723546491937268,3.151226822675609,lossguide,0.0332566133265978,0.01452448243933194,8,5,1.0629013971323764,400,,0.9562349238651314,0.5974877368921289,0.03594344978509786,oversample,0.6270294046101533,,6.0,0.7204045129675551,,,,0.2931240370750234,0.7468284678251704,0.4445952057892356,0.4427860696517413,0.004862236628849271,0.0,0.9562349238651314,0.5974877368921289,0.05,0.7159133102728334,0.7057191598694601,1.0,0.0,0.002437043054427295,0.0,oversample,0.664599877318921,0.6651723531830784,0.6270294046101533,0.7468284678251704,COMPLETE
1572,0.7156549520766773,2025-11-27 07:57:41.252926,2025-11-27 07:57:44.729223,0 days 00:00:03.476297,0.0442874730104315,gbtree,0.6955484064191694,1.0278397674674065,lossguide,0.0006323391292926087,0.0009822428614661904,5,5,0.42437385187470644,500,,0.7284744242811243,0.6301211543162676,0.02386246520198972,none,0.9245463723275296,2.2695307144163186,12.0,0.7181037175930157,,,,0.21354258729677933,0.516021250640215,0.5567616463138851,0.5572139303482587,0.715281812899477,0.7156549520766773,0.7284744242811243,0.6301211543162676,0.02,0.5551498904822436,0.5566582568715799,0.5567616463138851,0.5572139303482587,1.0,1.0,none,0.5372175433942871,0.5419959573113302,0.9245463723275296,0.516021250640215,COMPLETE
1573,0.6262626262626263,2025-11-27 07:57:44.914814,2025-11-27 08:01:30.936643,0 days 00:03:46.021829,0.02550046567726166,dart,0.9938373170251075,1.934059964533018,lossguide,0.8602933676965352,0.004992429090937512,5,12,6.029093600052326,600,tree,0.6376181367311508,0.23888262639872482,0.06438536126945339,undersample,0.5124391745605521,,8.0,0.6406553897289313,0.4501793884150312,weighted,0.8930219984903591,0.5920671217056068,0.7922114995558932,0.5716870194482134,0.5983717774762551,0.5971926839642705,0.6262626262626263,0.6376181367311508,0.23888262639872482,0.05,0.632101722247158,0.6482004722882677,0.6267857142857143,0.6503496503496503,0.570268074735987,0.6038961038961039,undersample,0.5781764452328454,0.6089046933658782,0.5124391745605521,0.7922114995558932,COMPLETE
1574,0.32198811453268505,2025-11-27 08:01:31.127923,2025-11-27 08:01:32.239550,0 days 00:00:01.111627,3.5322457330447423,gbtree,0.2265873566070063,2.800098714126098,lossguide,2.166586199485201,0.3688543067835771,3,7,1.6748259638086795,700,,0.9141112924482528,0.6633838340456256,0.027452364844869168,oversample,0.7768332344031236,,6.0,0.8378601691273699,,,,0.2192147080541198,0.5994427598652209,0.4319312528267752,0.4323835368611488,0.30837004405286345,0.32198811453268505,0.9141112924482528,0.6633838340456256,0.02,0.5010531656985372,0.5088221488806857,0.47863247863247865,0.481421647819063,0.22745735174654752,0.2418831168831169,oversample,0.42255922677763225,0.4334423875409575,0.7768332344031236,0.5994427598652209,COMPLETE
1575,0.0,2025-11-27 08:01:32.425072,2025-11-27 08:01:33.583893,0 days 00:00:01.158821,8.602668587149548,gbtree,0.5190276871871278,3.368717538304651,lossguide,0.0012673214434766834,0.001014555704115462,6,8,33.88888164933763,900,,0.7572812820762925,0.29845445307459545,0.09829241298550564,none,0.8080084247977188,0.9124838719345918,9.0,0.6678133099860779,,,,0.6146321133156933,0.7244858673767696,0.44323835368611486,0.4427860696517413,0.0,0.0,0.7572812820762925,0.29845445307459545,0.1,0.4313170715482919,0.44169329323812556,0.0,0.0,0.0,0.0,none,0.2928148676204844,0.3126811582186965,0.8080084247977188,0.7244858673767696,COMPLETE
1576,0.7156549520766773,2025-11-27 08:01:33.767730,2025-11-27 08:01:44.982130,0 days 00:00:11.214400,14.537869334206814,dart,0.85055208462234,1.9539259630728947,lossguide,0.11693947378621741,0.13851089307098802,10,6,78.55594017064186,300,tree,0.7600017209661803,0.8147892716735419,0.029511637737558327,oversample,0.837325203100507,,8.0,0.7707429672370603,0.44599073981984677,weighted,0.6821184047617139,0.5648844837520618,0.4463982015227021,0.5567616463138851,0.5572139303482587,0.715281812899477,0.7156549520766773,0.7600017209661803,0.8147892716735419,0.02,0.611532630569276,0.6178869597892274,0.5567616463138851,0.5572139303482587,1.0,1.0,oversample,0.5564320529186492,0.5469825756470291,0.837325203100507,0.4463982015227021,COMPLETE
1577,0.715281812899477,2025-11-27 08:01:45.172494,2025-11-27 08:01:50.521727,0 days 00:00:05.349233,0.0006918814185187076,gbtree,0.8533179715098366,1.840440531809787,lossguide,0.00472969237448455,0.0038265323154467604,1,5,0.10818728964405808,700,,0.70938781380857,0.7500012562885429,0.03399724451399919,none,0.8928718861971341,1.578282407156357,12.0,0.6218717327157551,,,,0.34698343002161225,0.591534879619298,0.5567616463138851,0.5567616463138851,0.7151162790697675,0.715281812899477,0.70938781380857,0.7500012562885429,0.02,0.5278281762068888,0.5559904505237073,0.5568130375735627,0.5570135746606335,0.9991876523151909,0.9991883116883117,none,0.49454566554485324,0.539473007839964,0.8928718861971341,0.591534879619298,COMPLETE
1578,0.6574845958680682,2025-11-27 08:01:50.706602,2025-11-27 08:13:22.049732,0 days 00:11:31.343130,0.38344302469849845,dart,0.5936949807912534,4.931939866269827,lossguide,0.3491823276083374,0.21684974633126675,6,8,0.253007745572302,1000,tree,0.993784407472395,0.3945810635514824,0.05013584967475131,oversample,0.6893755739090881,,10.0,0.6758678302957648,0.44314259709999043,weighted,0.7617727615328151,0.37437035049684686,0.4440221196326344,0.5725915875169606,0.5725915875169606,0.6579804560260586,0.6574845958680682,0.993784407472395,0.3945810635514824,0.05,0.6455994579572449,0.628818523452829,0.5933420365535248,0.5939751146037983,0.7384240454914703,0.7362012987012987,oversample,0.5999908818117012,0.5922621811283711,0.6893755739090881,0.4440221196326344,COMPLETE
1579,0.7156549520766773,2025-11-27 08:13:22.230606,2025-11-27 08:14:29.456742,0 days 00:01:07.226136,0.023377795719531424,dart,0.8935775483757323,0.34413784649451473,lossguide,19.915442024790995,0.0032481731714046366,8,12,1.7984573003645874,700,tree,0.6861749823483876,0.08224770466107326,0.043966429716819536,oversample,0.6216211331799387,,6.0,0.6900356635323355,0.4940051103156482,weighted,0.8454142536344935,0.8099031147008295,0.12409389398224369,0.5567616463138851,0.5572139303482587,0.715281812899477,0.7156549520766773,0.6861749823483876,0.08224770466107326,0.05,0.4993829905569947,0.49718417401036114,0.5567616463138851,0.5572139303482587,1.0,1.0,oversample,0.3893366932475671,0.38078960110369714,0.6216211331799387,0.12409389398224369,COMPLETE
1580,0.7156549520766773,2025-11-27 08:14:29.643262,2025-11-27 08:15:56.369580,0 days 00:01:26.726318,0.9558390712463711,dart,0.9616448363041237,1.8731385223090324,depthwise,0.746664001908811,0.1488516521490014,10,7,23.160380264066085,400,forest,0.9537989898067701,0.41648636763530444,0.07984298108151874,undersample,0.7010852883889107,,7.0,0.676954755547862,0.3750558961328703,weighted,0.8660653525449166,0.6569064177903804,0.16419332618510504,0.5567616463138851,0.5572139303482587,0.715281812899477,0.7156549520766773,0.9537989898067701,0.41648636763530444,0.08,0.5043005842115399,0.5071451153103426,0.5567616463138851,0.5572139303482587,1.0,1.0,undersample,0.40270105605199025,0.39201311966889085,0.7010852883889107,0.16419332618510504,COMPLETE
1581,0.48419150858175247,2025-11-27 08:15:56.582303,2025-11-27 08:25:03.795936,0 days 00:09:07.213633,0.0006714224232586408,dart,0.825379033831808,1.5259829987788034,depthwise,0.09347710604275287,0.128701718902896,2,5,2.867955582230099,800,tree,0.8319298826620636,0.5688188038423194,0.008933246908071521,none,0.9429320834401894,1.1853171516309278,12.0,0.6728564166436742,0.449003065847172,uniform,0.7560853743198541,0.2900927341991672,0.7568213562069208,0.5074626865671642,0.4834916327453641,0.511001347103727,0.48419150858175247,0.8319298826620636,0.5688188038423194,0.0,0.5729984212907252,0.5409527382510333,0.571285140562249,0.5458248472505092,0.46222583265637696,0.43506493506493504,none,0.5156928165254729,0.4876331533634904,0.9429320834401894,0.7568213562069208,COMPLETE
1582,0.7156549520766773,2025-11-27 08:25:03.980175,2025-11-27 08:26:05.231395,0 days 00:01:01.251220,0.0008012785516633319,dart,0.8419870938541821,5.34027673064753,lossguide,0.019815093876124727,0.011456642704602116,2,3,0.3095438124412932,700,tree,0.922160655773784,0.8463115294426414,0.010105948655462488,none,0.9099714498974927,1.893962901798618,11.0,0.792365883411695,0.4145340931660032,weighted,0.7706058845165398,0.46628612616965615,0.30791639592579145,0.5567616463138851,0.5572139303482587,0.715281812899477,0.7156549520766773,0.922160655773784,0.8463115294426414,0.02,0.4592908574956368,0.4553078493934657,0.5567616463138851,0.5572139303482587,1.0,1.0,none,0.36480213531391437,0.35835085496730035,0.9099714498974927,0.30791639592579145,COMPLETE
1583,0.5977281629455542,2025-11-27 08:26:05.414193,2025-11-27 08:26:08.575922,0 days 00:00:03.161729,2.771447681848403,gbtree,0.5831846695974714,1.4263857734504763,lossguide,0.010528918961105313,0.31280619315252983,10,8,5.429623458996932,500,,0.6216041392963034,0.8202216492216576,0.0029347331974446944,oversample,0.5687180009406538,,9.0,0.7040478833940533,,,,0.5756287322856468,0.5297522602475238,0.5463591135232926,0.5355042966983266,0.6002391390992428,0.5977281629455542,0.6216041392963034,0.8202216492216576,0.0,0.6002569246512561,0.6045660503199362,0.5892018779342723,0.5775927327781983,0.6116978066612511,0.6193181818181818,oversample,0.5507095608348944,0.5458218364883329,0.5687180009406538,0.5297522602475238,COMPLETE
1584,0.7156549520766773,2025-11-27 08:26:08.795165,2025-11-27 08:26:09.610492,0 days 00:00:00.815327,0.05803719005396075,gbtree,0.6992670311521211,4.014081975229654,lossguide,0.00023891454494105144,0.005535588178752564,0,4,0.4418753667250139,400,,0.9338089136726264,0.6667579235020419,0.07553835548070204,none,0.546167681468548,0.9326115578435423,9.0,0.7978655615339287,,,,0.26014804475724135,0.050074294167431255,0.5567616463138851,0.5572139303482587,0.715281812899477,0.7156549520766773,0.9338089136726264,0.6667579235020419,0.08,0.505501068455768,0.5048917569708549,0.5567616463138851,0.5572139303482587,1.0,1.0,none,0.4534155904441387,0.452144797235451,0.546167681468548,0.050074294167431255,COMPLETE
1585,0.7156549520766773,2025-11-27 08:26:09.799548,2025-11-27 08:28:04.299312,0 days 00:01:54.499764,0.0001482720980535835,dart,0.8542190628406444,0.09848078702901908,lossguide,0.17888385155679462,0.0069140202330606765,3,10,44.36189215777846,600,tree,0.7444922225374734,0.2685272779795301,0.08268312477103439,oversample,0.500060250122074,,5.0,0.6102288190596202,0.3138947875905358,weighted,0.7178427042043325,0.6209813803257112,0.4421600890704752,0.5567616463138851,0.5572139303482587,0.715281812899477,0.7156549520766773,0.7444922225374734,0.2685272779795301,0.08,0.5435293295097885,0.5294804073090355,0.5567616463138851,0.5572139303482587,1.0,1.0,oversample,0.4954168669905005,0.48592189220381254,0.500060250122074,0.4421600890704752,COMPLETE
