number,value,datetime_start,datetime_complete,duration,params_alpha,params_booster,params_colsample_bytree,params_gamma,params_grow_policy,params_lambda,params_learning_rate,params_max_delta_step,params_max_depth,params_min_child_weight,params_n_estimators,params_normalize_type,params_params_feature_fraction,params_params_labeled_ratio,params_params_missing_rate,params_params_resampling,params_params_sample_rows,params_params_scale_pos_weight,params_params_selftrain_max_iter,params_params_selftrain_threshold,params_rate_drop,params_sample_type,params_skip_drop,params_subsample,params_user_attrs_decision_threshold,user_attrs_acc_test,user_attrs_acc_val,user_attrs_f1_test,user_attrs_f1_val,user_attrs_feature_fraction,user_attrs_labeled_ratio,user_attrs_missing_rate,user_attrs_pr_auc_test,user_attrs_pr_auc_val,user_attrs_prec_test,user_attrs_prec_val,user_attrs_rec_test,user_attrs_rec_val,user_attrs_resampling_strategy,user_attrs_roc_auc_test,user_attrs_roc_auc_val,user_attrs_sample_rows,user_attrs_user_attrs_decision_threshold,state
1615,0.7156549520766773,2025-11-27 09:08:12.391911,2025-11-27 09:09:14.687891,0 days 00:01:02.295980,0.6691079148860227,dart,0.9809805307630561,3.518929961930426,depthwise,2.1302962739729616,0.002947411622896571,7,9,99.50249753387712,700,forest,0.8726990369736465,0.7937052662428894,0.0958740923056593,oversample,0.8865417770274358,,12.0,0.9275412280758759,0.1677490848379498,weighted,0.13291702038603662,0.8504430905979685,0.4398810153347156,0.5567616463138851,0.5572139303482587,0.715281812899477,0.7156549520766773,0.8726990369736465,0.7937052662428894,0.08,0.5049374228309181,0.5073570130167964,0.5567616463138851,0.5572139303482587,1.0,1.0,oversample,0.44481921119381956,0.4401390233872359,0.8865417770274358,0.4398810153347156,COMPLETE
1616,0.6746647847565279,2025-11-27 09:09:14.887374,2025-11-27 09:09:18.589502,0 days 00:00:03.702128,0.0028141175863917577,gbtree,0.8876646691356973,4.977769078253418,lossguide,0.306543123309618,0.1544342715511099,1,9,0.19578255163153227,800,,0.635626038380932,0.48265491846713415,0.09799623263423093,undersample,0.7285293806656836,,10.0,0.7399342490032658,,,,0.33522032490332904,0.40683087642530463,0.5712347354138398,0.5829941203075532,0.659727207465901,0.6746647847565279,0.635626038380932,0.48265491846713415,0.08,0.5603008415194461,0.5728352335866969,0.5909967845659164,0.5967540574282147,0.7465475223395613,0.775974025974026,undersample,0.5518887083671812,0.5638137079978245,0.7285293806656836,0.40683087642530463,COMPLETE
1617,0.7156549520766773,2025-11-27 09:09:18.805951,2025-11-27 09:09:19.558241,0 days 00:00:00.752290,2.280629756653519,gbtree,0.2883816887933958,8.224067383556903,lossguide,0.8327736338593846,0.01875510623299546,3,7,0.1622282825269533,500,,0.8173931614668474,0.8713995763845825,0.07372542425964773,oversample,0.5149751624523746,,11.0,0.6361543542797985,,,,0.6295384008659124,0.21751414090934795,0.5567616463138851,0.5572139303482587,0.715281812899477,0.7156549520766773,0.8173931614668474,0.8713995763845825,0.08,0.6179336169208768,0.6141256618449439,0.5567616463138851,0.5572139303482587,1.0,1.0,oversample,0.6267540078582204,0.6078484207314646,0.5149751624523746,0.21751414090934795,COMPLETE
1618,0.7156549520766773,2025-11-27 09:09:19.788374,2025-11-27 09:09:20.753799,0 days 00:00:00.965425,0.01734985040210936,gbtree,0.2644256027774753,5.181498137911743,lossguide,11.393605448518128,0.0005068755025947707,1,6,0.11412182084972848,600,,0.779841202911724,0.7414188811143214,0.006614946211695472,undersample,0.632519849182241,,6.0,0.7597433478686733,,,,0.3782910544119842,0.3197576852720686,0.5567616463138851,0.5572139303482587,0.715281812899477,0.7156549520766773,0.779841202911724,0.7414188811143214,0.0,0.6264915503355124,0.6235370469802229,0.5567616463138851,0.5572139303482587,1.0,1.0,undersample,0.5900027354564896,0.5747238269901702,0.632519849182241,0.3197576852720686,COMPLETE
1619,0.7156549520766773,2025-11-27 09:09:20.973246,2025-11-27 09:09:53.630226,0 days 00:00:32.656980,0.02266797530151996,dart,0.7526278209252237,0.2895254902696054,depthwise,23.667247218110433,0.05998001247170296,4,10,60.48329215213328,500,forest,0.9853657213853164,0.2027022460571828,0.052437981107722,undersample,0.6386701356526218,,9.0,0.6625029888201797,0.25053158641737605,uniform,0.33875023967491613,0.9026979963039954,0.2488217593119832,0.5567616463138851,0.5572139303482587,0.715281812899477,0.7156549520766773,0.9853657213853164,0.2027022460571828,0.05,0.5314210725893473,0.5221875813568204,0.5567616463138851,0.5572139303482587,1.0,1.0,undersample,0.4813860475140503,0.4729784069352507,0.6386701356526218,0.2488217593119832,COMPLETE
1620,0.0,2025-11-27 09:09:53.870562,2025-11-27 09:09:54.962239,0 days 00:00:01.091677,0.004010903296253375,gbtree,0.4975349988099691,9.308187172979732,lossguide,0.1332197527993949,0.0012917670818204754,3,8,4.451452242358954,1000,,0.9725133884701957,0.8943232304082405,0.0458503167066445,oversample,0.929388734115951,,12.0,0.7318594434363453,,,,0.9019190313392957,0.6751277417785408,0.44323835368611486,0.4427860696517413,0.0,0.0,0.9725133884701957,0.8943232304082405,0.05,0.5187237381783724,0.5165763601118242,0.0,0.0,0.0,0.0,oversample,0.4249763756030438,0.41983230635554436,0.929388734115951,0.6751277417785408,COMPLETE
1621,0.7156549520766773,2025-11-27 09:09:55.187034,2025-11-27 09:09:55.781064,0 days 00:00:00.594030,4.6669115794217255,gbtree,0.31125816091889025,4.530942454488784,lossguide,0.0919913524613221,0.25896974105003945,8,4,0.76248268725988,300,,0.553808852574791,0.5977523155688915,0.015638334886796303,oversample,0.5512068792262081,,9.0,0.6862949289339046,,,,0.8753879692424194,0.2705153857421826,0.5567616463138851,0.5572139303482587,0.715281812899477,0.7156549520766773,0.553808852574791,0.5977523155688915,0.02,0.5403549520118279,0.5207967317426512,0.5567616463138851,0.5572139303482587,1.0,1.0,oversample,0.4210605281917804,0.38048076157754396,0.5512068792262081,0.2705153857421826,COMPLETE
1622,0.7156549520766773,2025-11-27 09:09:56.021100,2025-11-27 09:09:57.751016,0 days 00:00:01.729916,0.02817198510090523,gbtree,0.8474919771913587,0.3999280190071697,lossguide,0.6890181091952633,0.0008437532884887862,3,5,2.8195552271052584,500,,0.9371999585374211,0.2786991220486179,0.0769967186250089,undersample,0.9487713823247028,,6.0,0.6743520264529144,,,,0.5019252580711099,0.44181560144257326,0.5567616463138851,0.5572139303482587,0.715281812899477,0.7156549520766773,0.9371999585374211,0.2786991220486179,0.08,0.4530387963178614,0.46159765964731625,0.5567616463138851,0.5572139303482587,1.0,1.0,undersample,0.35921683051774733,0.38070088746799674,0.9487713823247028,0.44181560144257326,COMPLETE
1623,0.7156549520766773,2025-11-27 09:09:57.983139,2025-11-27 09:09:58.860474,0 days 00:00:00.877335,0.0019606010281997283,gbtree,0.8423146972490674,2.082532521214838,lossguide,39.297383376753125,0.003745831365599346,1,3,0.155117688524062,600,,0.5246744733942199,0.40502199551891027,0.06374622773722066,oversample,0.8639440791847557,,8.0,0.8502684091128084,,,,0.88667011090741,0.30377081256269384,0.5567616463138851,0.5572139303482587,0.715281812899477,0.7156549520766773,0.5246744733942199,0.40502199551891027,0.05,0.6146364983176034,0.6390058009802546,0.5567616463138851,0.5572139303482587,1.0,1.0,oversample,0.503098940632305,0.5244576031731292,0.8639440791847557,0.30377081256269384,COMPLETE
1624,0.7156549520766773,2025-11-27 09:09:59.066725,2025-11-27 09:10:47.941606,0 days 00:00:48.874881,21.59532374531766,dart,0.2041223714152186,3.7351101415568366,lossguide,0.1241166599356985,0.051572063928654176,7,11,1.6950347920230588,600,tree,0.6284583218433346,0.81148977910354,0.03396310441661992,undersample,0.6414184260880414,,12.0,0.7721622810979205,0.08850289078374796,weighted,0.43516631468471284,0.7898228637713343,0.3113107385139058,0.5567616463138851,0.5572139303482587,0.715281812899477,0.7156549520766773,0.6284583218433346,0.81148977910354,0.02,0.5560456235588824,0.5758615993253288,0.5567616463138851,0.5572139303482587,1.0,1.0,undersample,0.46556018833203466,0.49536491980950614,0.6414184260880414,0.3113107385139058,COMPLETE
1625,0.5431826534362367,2025-11-27 09:10:48.184788,2025-11-27 09:10:49.060463,0 days 00:00:00.875675,2.31889961244565,gbtree,0.6621675394534723,9.149707703156185,lossguide,2.4573392222449875,0.00399889953831396,3,7,1.180431089126519,400,,0.7432052244443328,0.513858425228598,0.0735893896807733,undersample,0.885436378284324,,9.0,0.7987461005171276,,,,0.43193075967356437,0.4989077394577661,0.4500226142017187,0.43781094527363185,0.5584604212055192,0.5431826534362367,0.7432052244443328,0.513858425228598,0.08,0.47210241897846983,0.4639585376387715,0.504924491135916,0.49630624580255206,0.6246953696181966,0.5998376623376623,undersample,0.2989642567018684,0.27925601594523963,0.885436378284324,0.4989077394577661,COMPLETE
1626,0.7156549520766773,2025-11-27 09:10:49.286381,2025-11-27 09:10:50.161053,0 days 00:00:00.874672,18.036866361523266,gbtree,0.2960961457307808,2.1145479578241355,depthwise,0.0002271428800135744,0.09983152738785285,1,7,1.1080920224313444,500,,0.6839587439089367,0.43963966363761053,0.0056877259145355465,none,0.9499333715000151,1.8427911221550444,7.0,0.865077450133198,,,,0.9348371609522801,0.5943913499702851,0.5567616463138851,0.5572139303482587,0.715281812899477,0.7156549520766773,0.6839587439089367,0.43963966363761053,0.0,0.6384545050807147,0.6051014813938204,0.5567616463138851,0.5572139303482587,1.0,1.0,none,0.5702063197334174,0.5394240909754189,0.9499333715000151,0.5943913499702851,COMPLETE
1627,0.7022192779065916,2025-11-27 09:10:50.390469,2025-11-27 09:10:55.875026,0 days 00:00:05.484557,0.0020008821070452995,gbtree,0.2343393524870656,0.3855724605899835,depthwise,4.35171369711343,0.11442904341567875,5,8,15.021752502893076,1000,,0.5701919788996734,0.35915371435425125,0.02981873596630641,oversample,0.9100112179348758,,10.0,0.6240981875726809,,,,0.9225197174812572,0.4371399461218021,0.5920398009950248,0.5933966530981456,0.7007299270072993,0.7022192779065916,0.5701919788996734,0.35915371435425125,0.02,0.579127839489064,0.5836794148224916,0.5922602355580482,0.5931729155008394,0.8578391551584078,0.8603896103896104,oversample,0.5667103234470068,0.5720002354642293,0.9100112179348758,0.4371399461218021,COMPLETE
1628,0.0,2025-11-27 09:10:56.078153,2025-11-27 09:11:18.905121,0 days 00:00:22.826968,0.005559624242030495,dart,0.4764045250850676,9.738186968459834,lossguide,0.0009422099527740529,0.10360915000362406,9,10,0.4497679764578832,500,tree,0.8674068873152805,0.3235495722223421,0.0482584241712101,oversample,0.6582503727268032,,9.0,0.9287063181805796,0.4447239544079333,uniform,0.19809347470281574,0.3438362326668333,0.7998851468701793,0.44323835368611486,0.4427860696517413,0.0,0.0,0.8674068873152805,0.3235495722223421,0.05,0.5550478730184706,0.5325387129164018,0.0,0.0,0.0,0.0,oversample,0.5274378719806363,0.492940633166629,0.6582503727268032,0.7998851468701793,COMPLETE
1629,,2025-11-27 09:11:19.102755,2025-11-27 09:11:33.765789,0 days 00:00:14.663034,0.22648669406981098,dart,0.5938891253527073,8.05263855579175,depthwise,2.206217834580685,0.015357945224542225,2,6,58.23139585227663,400,forest,0.5050318478280467,0.5330783371000559,0.051492220193676844,none,0.5488381837238621,1.958169469810967,5.0,0.848069636829367,0.3856127314829551,uniform,0.01095404124893289,0.9378388029339582,,,,,,,,,,,,,,,,,,,,FAIL
1630,0.7156549520766773,2025-11-27 09:11:39.856627,2025-11-27 09:12:48.201168,0 days 00:01:08.344541,60.53082080079022,dart,0.8333800304661316,4.375872112626925,lossguide,22.420123713724433,0.0036905100721932025,10,8,8.663279761354557,700,forest,0.819960510663762,0.30034730118633246,0.07991585642167237,undersample,0.989309171116382,,9.0,0.9306341209673543,0.03551802909894347,weighted,0.07841636973138665,0.5067532150606222,,0.5567616463138851,0.5572139303482587,0.715281812899477,0.7156549520766773,0.819960510663762,0.30034730118633246,0.08,0.5567616463138851,0.5572139303482587,0.5567616463138851,0.5572139303482587,1.0,1.0,undersample,0.5,0.5,0.989309171116382,0.5,COMPLETE
1631,0.7156549520766773,2025-11-27 09:12:48.410966,2025-11-27 09:12:49.281639,0 days 00:00:00.870673,0.5030416925289531,gbtree,0.7454562392827868,6.176354970758771,lossguide,0.47051593504005473,0.012665435463447151,7,7,0.11385953381489414,800,,0.6818553854713113,0.5991377392925157,0.06667667154456677,none,0.5301127358146349,1.0337091375281589,12.0,0.7535105297118121,,,,0.9549984628116994,,0.5567616463138851,0.5572139303482587,0.715281812899477,0.7156549520766773,0.6818553854713113,0.5991377392925157,0.08,0.501601804734428,0.5052855531185749,0.5567616463138851,0.5572139303482587,1.0,1.0,none,0.4072149737230391,0.4155939502275049,0.5301127358146349,0.5,COMPLETE
1632,0.49307013859722804,2025-11-27 09:12:49.488842,2025-11-27 09:13:03.546731,0 days 00:00:14.057889,0.0004594633206288106,dart,0.31054636107889105,2.4442559200160274,lossguide,0.0008991196763419829,0.0008648046978293341,9,9,2.5057187257477667,300,forest,0.6480700987610725,0.28310940326797085,0.07392635793983017,undersample,0.802422759872523,,8.0,0.7112941127878916,0.048550637896530635,weighted,0.7541504167489236,0.7250636715722187,,0.4292175486205337,0.45409317051108095,0.468407750631845,0.49307013859722804,0.6480700987610725,0.28310940326797085,0.08,0.47752590632163433,0.4843126575052702,0.4864391951006124,0.5108790252393386,0.4516653127538586,0.476461038961039,undersample,0.39903512989273693,0.42243940941591607,0.802422759872523,0.5,COMPLETE
1633,0.7156549520766773,2025-11-27 09:13:03.783972,2025-11-27 09:13:57.114332,0 days 00:00:53.330360,0.00815480751951184,dart,0.30543828992351374,5.759464955561793,depthwise,37.65105808785361,0.00861943610441284,2,5,0.1913469447807097,700,tree,0.7861259528954367,0.3561571428484328,0.09621885451174383,oversample,0.8675970110612974,,8.0,0.9334621540309447,0.2932564674050416,uniform,0.0180967915687442,0.7339283039709454,,0.5567616463138851,0.5572139303482587,0.715281812899477,0.7156549520766773,0.7861259528954367,0.3561571428484328,0.08,0.4308352340333452,0.4253670636584858,0.5567616463138851,0.5572139303482587,1.0,1.0,oversample,0.22154752233956132,0.20824489606409935,0.8675970110612974,0.5,COMPLETE
1634,0.20182440136830102,2025-11-27 09:13:57.348072,2025-11-27 09:13:57.961111,0 days 00:00:00.613039,1.4295177111669275,gbtree,0.6010595055413619,5.812728726358587,depthwise,19.516959959177033,0.002928618772873263,4,11,43.98550589524232,400,,0.8090077144994208,0.5001380906620363,0.0019193198309333526,undersample,0.8031966070639622,,7.0,0.6474159224778575,,,,0.7802034238557125,,0.3749434644957033,0.36680235187697874,0.21387940841865757,0.20182440136830102,0.8090077144994208,0.5001380906620363,0.0,0.4585026902407371,0.453816935432579,0.3567362428842505,0.3390804597701149,0.15272136474411047,0.14366883116883117,undersample,0.2879718662444669,0.27332215154610456,0.8031966070639622,0.5,COMPLETE
1635,0.0,2025-11-27 09:13:58.201227,2025-11-27 09:15:07.493262,0 days 00:01:09.292035,0.04122774218913467,dart,0.8449551912368687,8.96546595851063,depthwise,0.01604616376673368,0.025829169094729203,10,9,1.9690434802692807,700,forest,0.8487143865722818,0.5174798778746481,0.08480082293222345,none,0.5619099914247208,0.5863230931198441,11.0,0.8527194598146217,0.3571206497745557,weighted,0.8989623059110798,0.9135386840125377,,0.44323835368611486,0.4427860696517413,0.0,0.0,0.8487143865722818,0.5174798778746481,0.08,0.5567616463138851,0.5572139303482587,0.0,0.0,0.0,0.0,none,0.5,0.5,0.5619099914247208,0.5,COMPLETE
1636,0.48293736501079915,2025-11-27 09:15:07.711259,2025-11-27 09:15:08.255880,0 days 00:00:00.544621,0.0015848171030417315,gbtree,0.8349581626859366,5.210366062041293,lossguide,0.00021184973741527021,0.05014333253307727,10,6,0.3272570655120269,200,,0.6189464106872543,0.8539497985473556,0.003183892953130785,undersample,0.8522072009617664,,9.0,0.8148880845880635,,,,0.2148174355684912,,0.4785165083672546,0.45861601085481685,0.5049377415199656,0.48293736501079915,0.6189464106872543,0.8539497985473556,0.0,0.5156115517853461,0.5038628142358558,0.5355191256830601,0.5161588180978762,0.4776604386677498,0.4537337662337662,undersample,0.4635056947230557,0.4478040473316265,0.8522072009617664,0.5,COMPLETE
1637,0.5246045694200352,2025-11-27 09:15:08.489821,2025-11-27 09:15:26.656578,0 days 00:00:18.166757,0.08765018795171545,dart,0.4034851854163144,9.443723899839336,lossguide,2.7371889009007284,0.0005973181798679008,3,6,0.3618920291309286,400,forest,0.8315391015500504,0.38432566371600546,0.053657921110872225,undersample,0.7268484222780227,,11.0,0.607227849813005,0.34817174440772974,uniform,0.33997665536323285,0.3819317023786586,,0.5083672546359114,0.5106286748077793,0.5127745405647691,0.5246045694200352,0.8315391015500504,0.38432566371600546,0.05,0.5725685838228116,0.5903909652130106,0.572,0.5718390804597702,0.4646628757108042,0.48457792207792205,undersample,0.5012176926010047,0.5082064258519825,0.7268484222780227,0.5,COMPLETE
1638,0.7156549520766773,2025-11-27 09:15:26.853049,2025-11-27 09:16:31.871854,0 days 00:01:05.018805,0.00129961784452684,dart,0.7499906211102523,2.7354203481563575,lossguide,6.141592588083613,0.021212163831303317,8,11,41.49081505976884,700,forest,0.5587659279810165,0.5621653750078799,0.046357542436481075,oversample,0.6870849901671128,,10.0,0.6462238372208037,0.12697082129751291,uniform,0.1919807796307338,0.9622333255775557,,0.5567616463138851,0.5572139303482587,0.715281812899477,0.7156549520766773,0.5587659279810165,0.5621653750078799,0.05,0.484532237780823,0.4988759488300542,0.5567616463138851,0.5572139303482587,1.0,1.0,oversample,0.3697006747459341,0.3973156248756351,0.6870849901671128,0.5,COMPLETE
1639,0.7156549520766773,2025-11-27 09:16:32.077784,2025-11-27 09:16:45.688280,0 days 00:00:13.610496,3.1044289096576936,dart,0.26673794835361486,9.40431945252813,lossguide,3.907972714791352,0.006387126866226349,10,4,1.166375029847802,300,tree,0.9382526226582955,0.43671126628579193,0.02817301057539491,none,0.8925764560115689,4.7475018656987675,6.0,0.9365495540895244,0.14607376339627443,uniform,0.21674590192390214,0.9229757917967467,,0.5567616463138851,0.5572139303482587,0.715281812899477,0.7156549520766773,0.9382526226582955,0.43671126628579193,0.02,0.5567616463138851,0.5572139303482587,0.5567616463138851,0.5572139303482587,1.0,1.0,none,0.5,0.5,0.8925764560115689,0.5,COMPLETE
1640,0.34336457819437594,2025-11-27 09:16:45.924782,2025-11-27 09:16:46.899871,0 days 00:00:00.975089,0.0001200663052709496,gbtree,0.31851268875853206,8.489435553129182,depthwise,0.5096360623323918,0.17138190411780674,5,9,0.7569389501910003,900,,0.755659491273228,0.3570219202823175,0.03685846061296175,undersample,0.8197362581993618,,11.0,0.6342455695729119,,,,0.4777868143457757,,0.40117593848937133,0.39800995024875624,0.3464955577492596,0.34336457819437594,0.755659491273228,0.3570219202823175,0.05,0.5142522388453057,0.5190185939330652,0.44150943396226416,0.4377358490566038,0.2851340373679935,0.2824675324675325,undersample,0.4431538984399609,0.4447334777071754,0.8197362581993618,0.5,COMPLETE
1641,0.7156549520766773,2025-11-27 09:16:47.150419,2025-11-27 09:16:52.086074,0 days 00:00:04.935655,0.0006236282906317988,gbtree,0.7804754913684631,4.072411714138074,lossguide,0.0024740293816906357,0.001707237432566824,1,10,0.17510726706671334,1000,,0.9302755869143968,0.7089309838979299,0.008960303423860538,none,0.5397610412933779,1.8044248342914155,6.0,0.6946147668335501,,,,0.24274174542946023,,0.5567616463138851,0.5572139303482587,0.715281812899477,0.7156549520766773,0.9302755869143968,0.7089309838979299,0.0,0.6317465277712566,0.6258339705369942,0.5567616463138851,0.5572139303482587,1.0,1.0,none,0.5747923539846482,0.561583845164029,0.5397610412933779,0.5,COMPLETE
1642,0.7156549520766773,2025-11-27 09:16:52.323723,2025-11-27 09:17:12.656853,0 days 00:00:20.333130,0.001221534593066732,dart,0.24547846114659225,2.835188465821666,lossguide,0.0190353880831562,0.03368504754782006,8,7,12.214518086254559,400,tree,0.7887714744156877,0.8716033385833977,0.004461230125411409,none,0.7299279418780037,1.013398142412313,5.0,0.8259495855596013,0.12971128217267747,uniform,0.3364318241393053,0.830836409845215,,0.5567616463138851,0.5572139303482587,0.715281812899477,0.7156549520766773,0.7887714744156877,0.8716033385833977,0.0,0.5264394740835182,0.5103834388390438,0.5567616463138851,0.5572139303482587,1.0,1.0,none,0.43943948009748174,0.42414486687980046,0.7299279418780037,0.5,COMPLETE
1643,0.7156549520766773,2025-11-27 09:17:12.853878,2025-11-27 09:17:56.071684,0 days 00:00:43.217806,0.0013267385568109008,dart,0.6350447600618612,3.9267567654709437,lossguide,54.75633057805166,0.001063701174639439,5,9,0.24354638990657174,600,tree,0.9795833015176112,0.5206971790820301,0.06360610554471413,oversample,0.8783893213684446,,11.0,0.8068444578632896,0.36208381830577163,uniform,0.3591227895327918,0.9231871639425897,,0.5567616463138851,0.5572139303482587,0.715281812899477,0.7156549520766773,0.9795833015176112,0.5206971790820301,0.05,0.470189397457631,0.47740008212751783,0.5567616463138851,0.5572139303482587,1.0,1.0,oversample,0.3612775410732937,0.37560524256132016,0.8783893213684446,0.5,COMPLETE
1644,0.7156549520766773,2025-11-27 09:17:56.268994,2025-11-27 09:20:28.050225,0 days 00:02:31.781231,0.024581339879607013,dart,0.5392258015118736,1.5941446344895593,lossguide,0.5934588823795691,0.2300306216183661,0,11,27.962207637483363,700,forest,0.6163720646395284,0.630125294533812,0.009961493022127134,none,0.9646457086513569,1.0608912955470213,5.0,0.611576107016427,0.4794913609317368,uniform,0.31983196362473665,0.25017036161867656,,0.5567616463138851,0.5572139303482587,0.715281812899477,0.7156549520766773,0.6163720646395284,0.630125294533812,0.0,0.4690196583582178,0.4737539675634571,0.5567616463138851,0.5572139303482587,1.0,1.0,none,0.35199025182778226,0.35971513802846794,0.9646457086513569,0.5,COMPLETE
