number,value,datetime_start,datetime_complete,duration,params_alpha,params_booster,params_colsample_bytree,params_gamma,params_grow_policy,params_lambda,params_learning_rate,params_max_delta_step,params_max_depth,params_min_child_weight,params_n_estimators,params_normalize_type,params_params_feature_fraction,params_params_labeled_ratio,params_params_missing_rate,params_params_resampling,params_params_sample_rows,params_params_scale_pos_weight,params_params_selftrain_max_iter,params_params_selftrain_threshold,params_rate_drop,params_sample_type,params_skip_drop,params_subsample,params_user_attrs_decision_threshold,user_attrs_acc_test,user_attrs_acc_val,user_attrs_f1_test,user_attrs_f1_val,user_attrs_feature_fraction,user_attrs_labeled_ratio,user_attrs_missing_rate,user_attrs_pr_auc_test,user_attrs_pr_auc_val,user_attrs_prec_test,user_attrs_prec_val,user_attrs_rec_test,user_attrs_rec_val,user_attrs_resampling_strategy,user_attrs_roc_auc_test,user_attrs_roc_auc_val,user_attrs_sample_rows,user_attrs_user_attrs_decision_threshold,state
88,0.7156549520766773,2025-11-26 16:41:24.195515,2025-11-26 16:41:24.957133,0 days 00:00:00.761618,0.00011427324656663321,gbtree,0.7224277463191088,3.6959167076843014,lossguide,3.991830981989556,0.0005407660700469454,1,11,35.03989397315872,800,,0.6365601316544869,0.07349636047844688,0.03588632302389578,none,0.5017183439241292,2.5251168490242155,5.0,0.8344680471432026,,,,0.9437342950151109,0.5796589719731193,0.5567616463138851,0.5572139303482587,0.715281812899477,0.7156549520766773,0.6365601316544869,0.07349636047844688,0.05,0.5264562177080571,0.5357122938746073,0.5567616463138851,0.5572139303482587,1.0,1.0,none,0.42882507999137914,0.4520875893769153,0.5017183439241292,0.5796589719731193,COMPLETE
89,0.7156549520766773,2025-11-26 16:41:25.112103,2025-11-26 16:41:26.353817,0 days 00:00:01.241714,0.0608957266451273,gbtree,0.7961504708259163,1.8005318344145966,lossguide,0.0002567397148287317,0.057538607191810635,0,4,3.3901603499984705,200,,0.6810094514780076,0.6146867305951914,0.0921566691972561,none,0.7227504146541718,0.7346999973716697,6.0,0.7147162627197705,,,,0.36902706856440726,0.10139414551197362,0.5567616463138851,0.5572139303482587,0.715281812899477,0.7156549520766773,0.6810094514780076,0.6146867305951914,0.1,0.5454299578068866,0.5455368695340583,0.5567616463138851,0.5572139303482587,1.0,1.0,none,0.49146288897362356,0.490907266890413,0.7227504146541718,0.10139414551197362,COMPLETE
90,0.7156549520766773,2025-11-26 16:41:26.508476,2025-11-26 16:42:16.936957,0 days 00:00:50.428481,37.650887206098616,dart,0.573410751482961,6.298317154797586,depthwise,0.2942181166788186,0.0005374261402683141,0,8,2.95232935749812,700,tree,0.8576215416584151,0.6805660056156604,0.05102124935433868,none,0.8759980698240465,1.360164506765546,6.0,0.7455705857948435,0.3189932506565302,weighted,0.355576886735824,0.8113053979842011,0.20532484584225316,0.5567616463138851,0.5572139303482587,0.715281812899477,0.7156549520766773,0.8576215416584151,0.6805660056156604,0.05,0.5567616463138851,0.5572139303482587,0.5567616463138851,0.5572139303482587,1.0,1.0,none,0.5,0.5,0.8759980698240465,0.20532484584225316,COMPLETE
91,0.7156549520766773,2025-11-26 16:42:17.098174,2025-11-26 16:42:58.368996,0 days 00:00:41.270822,0.3843392097382337,dart,0.7447665036161784,2.3058559601700015,lossguide,0.0001783202300847545,0.0010168468198763253,7,12,6.226654904388828,600,tree,0.6934901344173765,0.13571346300758766,0.06765806958586609,none,0.9779487697425194,0.6799898201004237,5.0,0.785122138969832,0.2014455990236001,weighted,0.02940357728902179,0.3043418980925965,0.2850221222484295,0.5567616463138851,0.5572139303482587,0.715281812899477,0.7156549520766773,0.6934901344173765,0.13571346300758766,0.08,0.6254467335783114,0.6157638356630147,0.5567616463138851,0.5572139303482587,1.0,1.0,none,0.6414753228667585,0.6229305678999244,0.9779487697425194,0.2850221222484295,COMPLETE
92,0.7156549520766773,2025-11-26 16:42:58.528837,2025-11-26 16:43:29.855100,0 days 00:00:31.326263,0.0003275653390528451,dart,0.7109919984513682,9.259549793197337,lossguide,65.52376686027922,0.00038291159523125756,3,5,17.722482904675733,600,forest,0.7541725412670176,0.3426364057213472,0.017077656593654306,oversample,0.7242591122507069,,12.0,0.9318621793362836,0.42767574304515277,weighted,0.18385649505351317,0.35601893970357723,0.2862595925332744,0.5567616463138851,0.5572139303482587,0.715281812899477,0.7156549520766773,0.7541725412670176,0.3426364057213472,0.02,0.5567616463138851,0.5572139303482587,0.5567616463138851,0.5572139303482587,1.0,1.0,oversample,0.5,0.5,0.7242591122507069,0.2862595925332744,COMPLETE
93,0.7156549520766773,2025-11-26 16:43:30.018401,2025-11-26 16:43:30.926507,0 days 00:00:00.908106,0.029166316214871018,gbtree,0.4746294787444962,7.218707180193359,lossguide,0.0012846725162698365,0.0016217906004211676,5,11,0.5867052849934183,900,,0.8323845000774477,0.713366649558281,0.02266349590983072,oversample,0.8231721457973026,,6.0,0.675805252636664,,,,0.5830603521014198,0.25638742181703467,0.5567616463138851,0.5572139303482587,0.715281812899477,0.7156549520766773,0.8323845000774477,0.713366649558281,0.02,0.582798938340426,0.5985790679212867,0.5567616463138851,0.5572139303482587,1.0,1.0,oversample,0.5286912084086275,0.5329902796386453,0.8231721457973026,0.25638742181703467,COMPLETE
94,0.7156549520766773,2025-11-26 16:43:31.091727,2025-11-26 16:43:47.227759,0 days 00:00:16.136032,0.13577049317915835,dart,0.7627393601257707,9.961387669012625,lossguide,0.08333571048055292,0.0003274184239760571,1,4,1.2114523466254639,400,forest,0.664703289163976,0.5602480052439026,0.06797714501573605,oversample,0.6792757864621466,,11.0,0.9140960801129707,0.37159542351768243,weighted,0.2914506145800306,0.4925726214913812,0.08312227852274583,0.5567616463138851,0.5572139303482587,0.715281812899477,0.7156549520766773,0.664703289163976,0.5602480052439026,0.08,0.5348866489965212,0.5310061826080326,0.5567616463138851,0.5572139303482587,1.0,1.0,oversample,0.4606488005437756,0.45877925062679914,0.6792757864621466,0.08312227852274583,COMPLETE
95,0.7156549520766773,2025-11-26 16:43:47.393333,2025-11-26 16:44:13.617758,0 days 00:00:26.224425,0.5998467188718386,dart,0.7296387754558842,7.7974654143113336,lossguide,56.50853227571238,0.0007094616963705801,2,3,6.662463723521171,500,tree,0.8161750828941016,0.24934458997019174,0.044080282263704,oversample,0.8854948382808531,,11.0,0.7755254614508656,0.47426099049960935,weighted,0.5283085589676009,0.4338296234012152,0.13577053874878856,0.5567616463138851,0.5572139303482587,0.715281812899477,0.7156549520766773,0.8161750828941016,0.24934458997019174,0.05,0.5567616463138851,0.5572139303482587,0.5567616463138851,0.5572139303482587,1.0,1.0,oversample,0.5,0.5,0.8854948382808531,0.13577053874878856,COMPLETE
96,0.6939890710382514,2025-11-26 16:44:13.782693,2025-11-26 16:44:15.869454,0 days 00:00:02.086761,0.0005487894133770259,gbtree,0.5121015257691598,3.150713049717841,lossguide,0.002019153913879655,0.27527153412660976,9,11,0.39637795270974646,300,,0.8930783758085068,0.6342173700089782,0.0748873020785612,undersample,0.5868059413418236,,11.0,0.6634307459915844,,,,0.4298867217952381,0.14990884803817506,0.5431931252826775,0.5440976933514247,0.691131498470948,0.6939890710382514,0.8930783758085068,0.6342173700089782,0.08,0.566368031622233,0.5671017555801706,0.5541932319764591,0.5543161978661494,0.9179528838342811,0.9277597402597403,undersample,0.5248818780152191,0.5278784672936869,0.5868059413418236,0.14990884803817506,COMPLETE
97,0.7156549520766773,2025-11-26 16:44:16.054303,2025-11-26 16:44:20.565291,0 days 00:00:04.510988,0.02368125717834576,dart,0.7482710085716837,7.443777274241334,lossguide,71.76506655742897,0.0001866395296571883,0,4,4.067307445035214,200,forest,0.5824253485769619,0.5022103434009123,0.0308660262590584,oversample,0.8166947689543571,,12.0,0.8787565039124661,0.31195351295842255,weighted,0.10953811924634219,0.265119472137815,0.17064432476719774,0.5567616463138851,0.5572139303482587,0.715281812899477,0.7156549520766773,0.5824253485769619,0.5022103434009123,0.02,0.52621349371862,0.5258749495914962,0.5567616463138851,0.5572139303482587,1.0,1.0,oversample,0.4034014986985859,0.3956342112943237,0.8166947689543571,0.17064432476719774,COMPLETE
98,0.7156549520766773,2025-11-26 16:44:20.731233,2025-11-26 16:44:53.716644,0 days 00:00:32.985411,38.88765328090464,dart,0.6277149030427787,8.61933519974816,depthwise,0.00021298164349714798,0.022294847806421183,10,6,0.30465519330485885,500,forest,0.8903680916604786,0.7180770570766847,0.03383161481511473,oversample,0.7237726747275007,,11.0,0.7375506905788975,0.06534998493403338,uniform,0.44917335600628316,0.46212202574681144,0.35741243445626314,0.5567616463138851,0.5572139303482587,0.715281812899477,0.7156549520766773,0.8903680916604786,0.7180770570766847,0.02,0.5567616463138851,0.5572139303482587,0.5567616463138851,0.5572139303482587,1.0,1.0,oversample,0.5,0.5,0.7237726747275007,0.35741243445626314,COMPLETE
99,0.7156549520766773,2025-11-26 16:44:53.902289,2025-11-26 16:46:49.252423,0 days 00:01:55.350134,12.304130175557697,dart,0.926217756323822,4.114434168926021,depthwise,0.00014274093848091237,0.00022618263125145154,3,12,2.0321600859461872,1000,forest,0.5693423401067577,0.05327854681728079,0.09203569173034701,none,0.8839292910318415,2.2181799029703,7.0,0.7763504148757032,0.3697092462319216,uniform,0.6622925572693961,0.4937685866453732,0.019772681028124434,0.5567616463138851,0.5572139303482587,0.715281812899477,0.7156549520766773,0.5693423401067577,0.05327854681728079,0.1,0.802750239555713,0.8069789655245054,0.5567616463138851,0.5572139303482587,1.0,1.0,none,0.7863293489613555,0.7841858409721025,0.8839292910318415,0.019772681028124434,COMPLETE
100,0.7156549520766773,2025-11-26 16:46:49.420045,2025-11-26 16:46:50.287358,0 days 00:00:00.867313,0.15340542695444817,gbtree,0.6818212101820559,0.24426144719833287,depthwise,0.05232221721049384,0.0007392220142026556,4,12,16.597427918144323,900,,0.5504926706860832,0.06330626168084272,0.030078320743886968,none,0.6264563527534678,0.5139892389845977,7.0,0.817032263387133,,,,0.7063674797583045,0.38752819445271375,0.5567616463138851,0.5572139303482587,0.715281812899477,0.7156549520766773,0.5504926706860832,0.06330626168084272,0.02,0.5044740231822302,0.5135614759443567,0.5567616463138851,0.5572139303482587,1.0,1.0,none,0.23264062733135493,0.25523534815541965,0.6264563527534678,0.38752819445271375,COMPLETE
101,0.7156549520766773,2025-11-26 16:46:50.463370,2025-11-26 16:47:30.472998,0 days 00:00:40.009628,9.061434833973705,dart,0.4229613683583768,3.437248540580768,lossguide,0.20111201008522295,0.00011258048046960201,0,6,19.970842012786846,600,forest,0.8115432821380564,0.39537447446557955,0.037024586280626375,none,0.777417287071841,1.0868879560729428,9.0,0.7677215701627561,0.35525637984991276,weighted,0.50622150909975,0.9767063769220662,0.2374984036520428,0.5567616463138851,0.5572139303482587,0.715281812899477,0.7156549520766773,0.8115432821380564,0.39537447446557955,0.05,0.4477160281561234,0.44314140244286065,0.5567616463138851,0.5572139303482587,1.0,1.0,none,0.16223785208640723,0.14396647785309685,0.777417287071841,0.2374984036520428,COMPLETE
102,0.7156549520766773,2025-11-26 16:47:30.649512,2025-11-26 16:47:42.373259,0 days 00:00:11.723747,30.046376598689132,dart,0.4568023434993239,2.84268498961445,depthwise,20.63830135085489,0.021895964417848322,4,4,19.393799191342396,300,forest,0.5535529585446346,0.345686297447046,0.09264945661346341,none,0.7961311405483573,2.9478658846606844,12.0,0.824174051732042,0.2793269851376676,weighted,0.7862658332275128,0.23281250268952086,0.16935264364989405,0.5567616463138851,0.5572139303482587,0.715281812899477,0.7156549520766773,0.5535529585446346,0.345686297447046,0.1,0.5710118431146443,0.5765326346139208,0.5567616463138851,0.5572139303482587,1.0,1.0,none,0.5311572638803694,0.541348845230357,0.7961311405483573,0.16935264364989405,COMPLETE
103,0.7156549520766773,2025-11-26 16:47:42.536605,2025-11-26 16:49:14.428564,0 days 00:01:31.891959,1.2906583043709214,dart,0.3632837039897154,7.774706879919027,lossguide,0.0015935304284798559,0.01144533515297182,3,5,0.1756278756043982,900,forest,0.6504850543506315,0.07728171249590463,0.054511429359025865,oversample,0.9052186112249915,,8.0,0.6333110459645581,0.39415113361247167,weighted,0.632321050844445,0.9195484755271046,0.12378701907934299,0.5567616463138851,0.5572139303482587,0.715281812899477,0.7156549520766773,0.6504850543506315,0.07728171249590463,0.05,0.548124549269713,0.5457736415524164,0.5567616463138851,0.5572139303482587,1.0,1.0,oversample,0.48217891543294816,0.47625127681307455,0.9052186112249915,0.12378701907934299,COMPLETE
104,0.7156549520766773,2025-11-26 16:49:14.594052,2025-11-26 16:51:09.245017,0 days 00:01:54.650965,0.13189505617393618,dart,0.9778220203324155,3.817229021176492,depthwise,9.23384439807796,0.0006884442392383616,10,8,6.068647829276603,1000,forest,0.6934889243031889,0.14038125785136918,0.0906292798759707,undersample,0.9424238621087799,,8.0,0.8080917104187704,0.3310278597052557,weighted,0.6000254337472595,0.6145154988405916,0.468137050865796,0.5567616463138851,0.5572139303482587,0.715281812899477,0.7156549520766773,0.6934889243031889,0.14038125785136918,0.1,0.5790977800445518,0.5671762124393167,0.5567616463138851,0.5572139303482587,1.0,1.0,undersample,0.5333932923291169,0.5131010141543849,0.9424238621087799,0.468137050865796,COMPLETE
105,0.7156549520766773,2025-11-26 16:51:09.413824,2025-11-26 16:52:13.245456,0 days 00:01:03.831632,35.431663256309555,dart,0.5500329928522545,5.7775305956072796,lossguide,0.01046016062204202,0.0002966195756900907,0,9,1.8800531256485218,700,forest,0.8245777929979534,0.2953094057566018,0.025406719109166632,none,0.6494215729201669,2.3769358523158584,6.0,0.7179045816588754,0.004213141920143049,weighted,0.006069634185762521,0.6528964936708321,0.30601757739269336,0.5567616463138851,0.5572139303482587,0.715281812899477,0.7156549520766773,0.8245777929979534,0.2953094057566018,0.02,0.5567616463138851,0.5572139303482587,0.5567616463138851,0.5572139303482587,1.0,1.0,none,0.5,0.5,0.6494215729201669,0.30601757739269336,COMPLETE
106,0.7156549520766773,2025-11-26 16:52:13.411842,2025-11-26 16:52:14.692153,0 days 00:00:01.280311,7.5952850292817935,gbtree,0.33652107100647954,0.23421785050821642,depthwise,8.446457575260803,0.004930236916675751,2,8,24.66577894095758,700,,0.5518402950524746,0.612661741929858,0.09947845081607128,none,0.9278123376652785,2.209758974081402,10.0,0.8562226607674926,,,,0.4136880815846886,0.2931175752937561,0.5567616463138851,0.5572139303482587,0.715281812899477,0.7156549520766773,0.5518402950524746,0.612661741929858,0.1,0.6208745036144248,0.6146971974058867,0.5567616463138851,0.5572139303482587,1.0,1.0,none,0.6028129610902038,0.5885867834922993,0.9278123376652785,0.2931175752937561,COMPLETE
107,0.7156549520766773,2025-11-26 16:52:14.871154,2025-11-26 16:53:12.985289,0 days 00:00:58.114135,0.00015073051824898272,dart,0.9450505846842605,1.737202820550566,depthwise,1.361022041741742,0.0001222554548415572,2,12,58.47410436502166,800,forest,0.6273895664697453,0.07042219455568673,0.021355637542452177,none,0.5012793570965759,1.9551764735277408,6.0,0.8246981657841117,0.4956578735481503,weighted,0.3407607019566854,0.8044300810665603,0.3159355096531399,0.5567616463138851,0.5572139303482587,0.715281812899477,0.7156549520766773,0.6273895664697453,0.07042219455568673,0.02,0.5567616463138851,0.5572139303482587,0.5567616463138851,0.5572139303482587,1.0,1.0,none,0.5,0.5,0.5012793570965759,0.3159355096531399,COMPLETE
108,0.7156549520766773,2025-11-26 16:53:13.136380,2025-11-26 16:53:32.450533,0 days 00:00:19.314153,7.908677738346083,dart,0.7460392820430152,3.253122455048246,lossguide,0.0009905891694304196,0.02899679971733387,1,9,0.8439139444330973,400,tree,0.80651024550694,0.5793299384242657,0.0960373365128028,none,0.7174665597246694,3.2897452657171957,6.0,0.6495449272614174,0.3314799605080773,uniform,0.7630486629305182,0.22142074425486175,0.5462982820413178,0.5567616463138851,0.5572139303482587,0.715281812899477,0.7156549520766773,0.80651024550694,0.5793299384242657,0.1,0.48399246242880056,0.48002421565646913,0.5567616463138851,0.5572139303482587,1.0,1.0,none,0.3892459258276828,0.37693677619622457,0.7174665597246694,0.5462982820413178,COMPLETE
109,0.7156549520766773,2025-11-26 16:53:32.629596,2025-11-26 16:55:12.912893,0 days 00:01:40.283297,0.38043965316672446,dart,0.7966740613313632,5.727912338622051,lossguide,0.00010936733553234183,0.0007985552394762526,3,12,58.82772060577315,1000,tree,0.5685539530494245,0.1434077377469341,0.09653903426470772,none,0.9504015538336021,1.7289922604700465,5.0,0.7988647535978721,0.3966386716753223,weighted,0.38674662338865684,0.4443542886200139,0.5072294505642992,0.5567616463138851,0.5572139303482587,0.715281812899477,0.7156549520766773,0.5685539530494245,0.1434077377469341,0.1,0.47700911103526256,0.48257345853305883,0.5567616463138851,0.5572139303482587,1.0,1.0,none,0.3288387572738275,0.3397989268137378,0.9504015538336021,0.5072294505642992,COMPLETE
110,0.7156549520766773,2025-11-26 16:55:13.109341,2025-11-26 16:55:41.572537,0 days 00:00:28.463196,0.02165802723601361,dart,0.5071469087564947,9.85616148579356,lossguide,0.0025152976501794304,0.013367862065991222,0,4,0.14027980114770955,500,tree,0.5245198730306286,0.24709970428134836,0.07587530156082566,undersample,0.734961348600727,,10.0,0.6106608277177472,0.22029759424395562,weighted,0.3052047989182683,0.8084890741661471,0.014531027132424445,0.5567616463138851,0.5572139303482587,0.715281812899477,0.7156549520766773,0.5245198730306286,0.24709970428134836,0.08,0.5567616463138851,0.5572139303482587,0.5567616463138851,0.5572139303482587,1.0,1.0,undersample,0.5,0.5,0.734961348600727,0.014531027132424445,COMPLETE
111,0.7156549520766773,2025-11-26 16:55:41.731407,2025-11-26 16:55:45.666509,0 days 00:00:03.935102,0.001875335546648694,dart,0.4375283782926529,5.685244736323673,lossguide,0.022232370870165264,0.02540464299076871,7,11,0.16992160341396065,200,tree,0.9988634698075953,0.42049107345799097,0.07743513043282488,undersample,0.6153381387316027,,12.0,0.6543169256591367,0.33963664324146176,uniform,0.10304444294481324,0.9168499712942344,0.21419355768766557,0.5567616463138851,0.5572139303482587,0.715281812899477,0.7156549520766773,0.9988634698075953,0.42049107345799097,0.08,0.5137997002332167,0.5140809818889869,0.5567616463138851,0.5572139303482587,1.0,1.0,undersample,0.43131475986007733,0.4307544472891766,0.6153381387316027,0.21419355768766557,COMPLETE
112,0.0,2025-11-26 16:55:45.822747,2025-11-26 16:55:46.448880,0 days 00:00:00.626133,8.944557893018901,gbtree,0.9458626579361109,2.225362001637903,lossguide,0.06579218437703974,0.0003944632907908016,9,9,0.8449624638373475,400,,0.6638304921771138,0.3676427243440667,0.09887178679880765,oversample,0.7917058000913861,,6.0,0.8665407339128355,,,,0.9058198993466233,0.7630528480976075,0.44323835368611486,0.4427860696517413,0.0,0.0,0.6638304921771138,0.3676427243440667,0.1,0.5495021995599565,0.520371754416742,0.0,0.0,0.0,0.0,oversample,0.5240645567731561,0.4762226728838067,0.7917058000913861,0.7630528480976075,COMPLETE
113,0.7008700870087009,2025-11-26 16:55:46.605262,2025-11-26 17:02:31.740892,0 days 00:06:45.135630,0.799931321292925,dart,0.8089246649695829,0.7465973159806887,lossguide,4.137204830072438,0.061454333494807396,10,10,2.04952180027377,800,tree,0.7768905025386528,0.18006130476930687,0.08599844961201471,none,0.9446368609641262,1.9434270327381764,9.0,0.8875214675542791,0.2882510044665205,weighted,0.529605606070227,0.39841415403339747,0.3406578041686843,0.5400271370420624,0.5490728177295342,0.6933976484775399,0.7008700870087009,0.7768905025386528,0.18006130476930687,0.08,0.529310941655885,0.5246359016224801,0.551294343240652,0.5559257496430271,0.934199837530463,0.948051948051948,none,0.46704023607818435,0.4672418681930939,0.9446368609641262,0.3406578041686843,COMPLETE
114,0.7156549520766773,2025-11-26 17:02:31.906732,2025-11-26 17:02:35.621449,0 days 00:00:03.714717,0.028326031802558497,gbtree,0.9738616579147538,0.35893875609118187,lossguide,7.833066746787469,0.0008570203482243695,6,7,0.108268211466183,500,,0.6791191629285952,0.4254021455336018,0.07485821714466795,oversample,0.917384376786903,,7.0,0.8670478061912176,,,,0.6968085420135746,0.37946624833397363,0.5567616463138851,0.5572139303482587,0.715281812899477,0.7156549520766773,0.6791191629285952,0.4254021455336018,0.08,0.5695075876926412,0.5486339638806239,0.5567616463138851,0.5572139303482587,1.0,1.0,oversample,0.49422528556507905,0.4795917182919226,0.917384376786903,0.37946624833397363,COMPLETE
115,0.6157443491816056,2025-11-26 17:02:35.793327,2025-11-26 17:02:37.008280,0 days 00:00:01.214953,7.67689982299187,gbtree,0.8818188989634519,0.3227474962919742,depthwise,0.5908730812455546,0.0010159900893922126,7,10,0.41906387948204793,700,,0.8251010498536973,0.1883433515152884,0.09716630840254793,oversample,0.8332187486333356,,5.0,0.8997380610710997,,,,0.5403929580509443,0.550211693842816,0.5689733152419719,0.5540479421076436,0.6243594797004336,0.6157443491816056,0.8251010498536973,0.1883433515152884,0.1,0.5391226764412913,0.5211442883326187,0.6064318529862175,0.5922038980509745,0.6433793663688059,0.6412337662337663,oversample,0.5107971783351846,0.481688925221867,0.8332187486333356,0.550211693842816,COMPLETE
