number,value,datetime_start,datetime_complete,duration,params_alpha,params_booster,params_colsample_bytree,params_gamma,params_grow_policy,params_lambda,params_learning_rate,params_max_delta_step,params_max_depth,params_min_child_weight,params_n_estimators,params_normalize_type,params_params_feature_fraction,params_params_labeled_ratio,params_params_missing_rate,params_params_resampling,params_params_sample_rows,params_params_scale_pos_weight,params_params_selftrain_max_iter,params_params_selftrain_threshold,params_rate_drop,params_sample_type,params_skip_drop,params_subsample,params_user_attrs_decision_threshold,user_attrs_acc_test,user_attrs_acc_val,user_attrs_f1_test,user_attrs_f1_val,user_attrs_feature_fraction,user_attrs_labeled_ratio,user_attrs_missing_rate,user_attrs_pr_auc_test,user_attrs_pr_auc_val,user_attrs_prec_test,user_attrs_prec_val,user_attrs_rec_test,user_attrs_rec_val,user_attrs_resampling_strategy,user_attrs_roc_auc_test,user_attrs_roc_auc_val,user_attrs_sample_rows,user_attrs_user_attrs_decision_threshold,state
984,0.7100868403473614,2025-11-26 23:09:29.330924,2025-11-26 23:13:10.216410,0 days 00:03:40.885486,0.1714171603551885,dart,0.8387037896891255,0.32180858146674596,depthwise,18.12085154109026,0.1479032108174388,8,10,8.164643650719713,600,tree,0.8716714793484026,0.3189887111528667,0.09245152950754258,oversample,0.5644032734021697,,9.0,0.6048003930152277,0.17647195665244783,weighted,0.1868375493828778,0.46658681247605077,0.3472386043022817,0.6182722749886929,0.6074174581637268,0.7162071284465367,0.7100868403473614,0.8716714793484026,0.3189887111528667,0.1,0.6224754486321041,0.5986226637287988,0.6110154905335629,0.6032917139614075,0.8651502843216897,0.8628246753246753,oversample,0.6159742369734247,0.5892558667073478,0.5644032734021697,0.3472386043022817,COMPLETE
985,0.7156549520766773,2025-11-26 23:13:10.391513,2025-11-26 23:13:29.688818,0 days 00:00:19.297305,1.4008309994299077,dart,0.9827394141709872,2.4028017997417175,lossguide,0.19389622042347382,0.04828055940205208,7,9,54.11484907973512,400,tree,0.9443301192086367,0.2053477139840335,0.051513093044419145,oversample,0.5264832509460388,,7.0,0.637172634555484,0.2326495457136991,weighted,0.5657870578765679,0.5365637980642447,0.18343129312435372,0.5567616463138851,0.5572139303482587,0.715281812899477,0.7156549520766773,0.9443301192086367,0.2053477139840335,0.05,0.5567616463138851,0.5572139303482587,0.5567616463138851,0.5572139303482587,1.0,1.0,oversample,0.5,0.5,0.5264832509460388,0.18343129312435372,COMPLETE
986,0.6001386001386001,2025-11-26 23:13:29.852394,2025-11-26 23:13:31.641568,0 days 00:00:01.789174,0.04019947271346853,gbtree,0.6306672205802508,3.845146560505953,depthwise,0.003074978739414772,0.3549251087524629,0,5,2.3968553063079554,400,,0.8396590937626789,0.23988267792566143,0.003910233922619839,undersample,0.896259293082033,,9.0,0.8081439280665371,,,,0.6168108416158185,0.2740039643463477,0.46675712347354137,0.47806422433288104,0.5873293664683235,0.6001386001386001,0.8396590937626789,0.23988267792566143,0.0,0.48240469228207955,0.4991047534012619,0.515990159901599,0.5235792019347038,0.6815597075548334,0.702922077922078,undersample,0.39637096105704667,0.41573945717204147,0.896259293082033,0.2740039643463477,COMPLETE
987,0.7160493827160493,2025-11-26 23:13:31.814449,2025-11-26 23:13:34.940997,0 days 00:00:03.126548,0.14515480822809923,gbtree,0.9262238947105418,2.2789975220212786,lossguide,0.38450930858923,0.10883520146033518,8,9,5.579826703612648,600,,0.8635606207968918,0.263173396177306,0.08353191427397669,oversample,0.5114857145736315,,9.0,0.6738149440267273,,,,0.613676852588525,0.20632791379169788,0.6074174581637268,0.6151062867480778,0.7102803738317757,0.7160493827160493,0.8635606207968918,0.263173396177306,0.08,0.6512011484787383,0.6620766886593887,0.6028328611898017,0.6079320113314448,0.8643379366368806,0.8709415584415584,oversample,0.634768895372934,0.6533241082206863,0.5114857145736315,0.20632791379169788,COMPLETE
988,0.6915151515151515,2025-11-26 23:13:35.111192,2025-11-26 23:13:36.985672,0 days 00:00:01.874480,0.014568608876474478,gbtree,0.8316077083683792,3.438812110038505,lossguide,0.22823836784335738,0.08586880951935658,9,8,12.941741585756029,400,,0.8545081648624987,0.18673525512801853,0.08538846805578487,oversample,0.6247658589474313,,9.0,0.7466144358398173,,,,0.6078810383938227,0.36643688508564354,0.5422885572139303,0.5395748530076888,0.692588092345079,0.6915151515151515,0.8545081648624987,0.18673525512801853,0.08,0.502433021663504,0.48856284498825087,0.5531295487627366,0.5517408123791102,0.9260763606823721,0.9261363636363636,oversample,0.4202821664815398,0.4015274498229044,0.6247658589474313,0.36643688508564354,COMPLETE
989,0.14970453053184504,2025-11-26 23:13:37.153627,2025-11-26 23:13:41.658182,0 days 00:00:04.504555,2.128392565561629,dart,0.6236209131212322,3.535230358053909,lossguide,0.2510565893603857,0.13781413980218213,0,4,2.039100278081397,200,tree,0.674646231656185,0.7284257365794132,0.06746675686349934,undersample,0.8133848905835277,,5.0,0.6586696483867736,0.23507070899363935,uniform,0.13110722672172342,0.2845260897201885,0.5172529165175668,0.42695612844866576,0.41429217548620534,0.1614824619457313,0.14970453053184504,0.674646231656185,0.7284257365794132,0.08,0.5043025946612936,0.49448273400072346,0.4357142857142857,0.3917525773195876,0.09910641754670999,0.09253246753246754,undersample,0.46143130688506107,0.43700171126115966,0.8133848905835277,0.5172529165175668,COMPLETE
990,0.6242774566473989,2025-11-26 23:13:41.822404,2025-11-26 23:13:44.420682,0 days 00:00:02.598278,4.242784550226752,gbtree,0.9893738604491377,2.1082438737518587,lossguide,0.3324189769624048,0.3168842008197589,9,10,8.655277465214958,600,,0.7864705536456656,0.15177168124639523,0.08169295299657223,oversample,0.5073917350640453,,9.0,0.6338265534189206,,,,0.6313152872541711,0.28726831560985566,0.5264586160108549,0.52962460425147,0.6213381555153707,0.6242774566473989,0.7864705536456656,0.15177168124639523,0.08,0.5256878200169248,0.5120598278098534,0.559973924380704,0.5625,0.6978066612510154,0.7012987012987013,oversample,0.45842686384058096,0.4558434096546967,0.5073917350640453,0.28726831560985566,COMPLETE
991,0.6121457489878542,2025-11-26 23:13:44.611489,2025-11-26 23:18:49.688804,0 days 00:05:05.077315,0.05494204175417538,dart,0.9343238713558203,0.9187135742507682,lossguide,2.4921985845103998,0.048629531007435264,8,8,3.1463660364508463,700,tree,0.8437883048806799,0.1174689894165172,0.08174760073503436,undersample,0.5215336614192233,,9.0,0.7417944581787475,0.2134961161307448,weighted,0.3352661272240437,0.6162747976147196,0.378446016658989,0.5725915875169606,0.566711895070104,0.6169436562626672,0.6121457489878542,0.8437883048806799,0.1174689894165172,0.08,0.6339497692539549,0.6167974981261106,0.6156957928802589,0.6106623586429726,0.6181965881397238,0.6136363636363636,undersample,0.6084886188431506,0.5922045587201358,0.5215336614192233,0.378446016658989,COMPLETE
992,0.7156549520766773,2025-11-26 23:18:49.870772,2025-11-26 23:19:00.380417,0 days 00:00:10.509645,0.003880361218333467,dart,0.8645070009902388,9.160442054194416,lossguide,60.47063989950816,0.0004773322902117868,0,3,1.7922321800784395,300,tree,0.7041565206959982,0.46923812987909297,0.06234246405886662,none,0.7360944666560347,0.500050730502002,11.0,0.8869596264626055,0.2973771313992815,weighted,0.40563707489526357,0.45544508684927143,0.3588931907729096,0.5567616463138851,0.5572139303482587,0.715281812899477,0.7156549520766773,0.7041565206959982,0.46923812987909297,0.05,0.5567616463138851,0.5572139303482587,0.5567616463138851,0.5572139303482587,1.0,1.0,none,0.5,0.5,0.7360944666560347,0.3588931907729096,COMPLETE
993,0.7156549520766773,2025-11-26 23:19:00.561024,2025-11-26 23:19:01.517486,0 days 00:00:00.956462,0.004112606546255518,gbtree,0.4920190149203947,9.379462922832392,depthwise,0.006713980661923881,0.002000535507553475,6,9,0.2269057729694285,800,,0.829527868068948,0.10268502851727153,0.04392436971327965,undersample,0.8068090458214404,,6.0,0.6403898246729816,,,,0.5811943241475646,0.25151808640660545,0.5567616463138851,0.5572139303482587,0.715281812899477,0.7156549520766773,0.829527868068948,0.10268502851727153,0.05,0.6109171449063261,0.5997552751443317,0.5567616463138851,0.5572139303482587,1.0,1.0,undersample,0.6098144863144283,0.5787996796359922,0.8068090458214404,0.25151808640660545,COMPLETE
994,0.7372881355932204,2025-11-26 23:19:01.706900,2025-11-26 23:21:01.147909,0 days 00:01:59.441009,0.11389620107538483,dart,0.7467593291389857,2.3318730738684224,lossguide,1.7016823908031407,0.02897992680194154,8,12,10.336126948440223,600,tree,0.9120407115595388,0.08025726659532151,0.08954124549890807,oversample,0.5532299869245304,,5.0,0.6717188818277695,0.2717224617813699,weighted,0.17015072207591875,0.5248155633160676,0.5813047449281781,0.6178199909543193,0.6074174581637268,0.7416692143075512,0.7372881355932204,0.9120407115595388,0.08025726659532151,0.08,0.6564301887459689,0.6450412735732554,0.5946078431372549,0.5878378378378378,0.9853777416734363,0.9886363636363636,oversample,0.7013097034102025,0.6840273171670005,0.5532299869245304,0.5813047449281781,COMPLETE
995,0.0,2025-11-26 23:21:01.329832,2025-11-26 23:21:56.786933,0 days 00:00:55.457101,0.9732754139787514,dart,0.9941942639268639,2.5000669654737693,lossguide,42.251218585760455,0.11955851110466012,8,9,37.9629491429289,700,tree,0.9279470990009172,0.36688815277150816,0.08901396712819301,oversample,0.5692603384132777,,5.0,0.6645773209460051,0.2891190309286008,weighted,0.10238687630545358,0.6114114838261876,0.9237990552394582,0.44323835368611486,0.4427860696517413,0.0,0.0,0.9279470990009172,0.36688815277150816,0.08,0.632460128789534,0.6060237112169838,0.0,0.0,0.0,0.0,oversample,0.5724821366401963,0.5595367987477283,0.5692603384132777,0.9237990552394582,COMPLETE
996,0.0,2025-11-26 23:21:56.967796,2025-11-26 23:22:52.208565,0 days 00:00:55.240769,0.03769570406442852,dart,0.76113771826644,3.2867837264446793,lossguide,17.202586034156372,0.0013848613316005314,9,12,24.817566657559276,700,tree,0.9012036737105891,0.15431033992575993,0.0841491548592508,oversample,0.6216454243215708,,6.0,0.7850879204818312,0.29457611504639264,weighted,0.13849286304535943,0.7265864721436861,0.7715737190396935,0.44323835368611486,0.4427860696517413,0.0,0.0,0.9012036737105891,0.15431033992575993,0.08,0.48963188696875626,0.4949744946981607,0.0,0.0,0.0,0.0,oversample,0.4433122233458777,0.4436904706631468,0.6216454243215708,0.7715737190396935,COMPLETE
997,0.7156549520766773,2025-11-26 23:22:52.390106,2025-11-26 23:23:20.765033,0 days 00:00:28.374927,0.03835328234204183,dart,0.5914133456069278,2.4894427411021045,lossguide,42.357497714631414,0.15150019801788858,8,12,5.056600113184654,500,tree,0.8000765572685908,0.33105722446891944,0.09331804866531179,oversample,0.6561561387558678,,5.0,0.6681840000373995,0.2389595889338021,weighted,0.13804205758907354,0.7334982167568768,0.49558703388726244,0.5567616463138851,0.5572139303482587,0.715281812899477,0.7156549520766773,0.8000765572685908,0.33105722446891944,0.1,0.593920789487698,0.5787825978532961,0.5567616463138851,0.5572139303482587,1.0,1.0,oversample,0.5636876440259289,0.5505120517888649,0.6561561387558678,0.49558703388726244,COMPLETE
998,0.0,2025-11-26 23:23:20.947674,2025-11-26 23:23:49.983906,0 days 00:00:29.036232,0.0011258653774384659,dart,0.4376980314962157,0.3590384550965011,depthwise,0.3403733851381307,0.005051098852436952,7,12,40.777813645441604,500,tree,0.8470367040569191,0.11115884295930216,0.08463441722499768,oversample,0.5219416063493547,,6.0,0.6150627449510571,0.38981449657660683,weighted,0.11441401043818017,0.6393070058188555,0.6383941853714583,0.44323835368611486,0.4427860696517413,0.0,0.0,0.8470367040569191,0.11115884295930216,0.08,0.5567616463138851,0.5572139303482587,0.0,0.0,0.0,0.0,oversample,0.5,0.5,0.5219416063493547,0.6383941853714583,COMPLETE
999,0.0,2025-11-26 23:23:50.166574,2025-11-26 23:24:07.591751,0 days 00:00:17.425177,0.13219218396950028,dart,0.6869871364909744,3.686987195161815,lossguide,2.3389011621925335,0.038464398154141106,7,9,72.08221000043221,400,tree,0.9629332696680044,0.21783073603454475,0.09845676229288555,oversample,0.6150663345302373,,6.0,0.7773045410914835,0.26293699288697253,weighted,0.18677137533506205,0.24412090564272526,0.6659982479709655,0.44323835368611486,0.4427860696517413,0.0,0.0,0.9629332696680044,0.21783073603454475,0.1,0.5567616463138851,0.5572139303482587,0.0,0.0,0.0,0.0,oversample,0.5,0.5,0.6150663345302373,0.6659982479709655,COMPLETE
1000,0.7091136079900124,2025-11-26 23:24:07.781102,2025-11-26 23:27:22.941181,0 days 00:03:15.160079,0.11538943480377255,dart,0.8502546244549992,2.5076277811476944,lossguide,12.641607496668676,0.12502400346017506,4,12,2.5356799531638283,700,tree,0.9259445277976881,0.1484190407277626,0.09666469219967633,oversample,0.5555292164762529,,6.0,0.6029967312966628,0.32280448905505466,weighted,0.19739317276998292,0.44768520694998115,0.3939219112629878,0.566711895070104,0.5784712799638173,0.6983627204030227,0.7091136079900124,0.9259445277976881,0.1484190407277626,0.1,0.6123621681295345,0.6069986889784318,0.5701799485861182,0.5760649087221096,0.90089358245329,0.922077922077922,oversample,0.5973548964671165,0.5858101296048182,0.5555292164762529,0.3939219112629878,COMPLETE
1001,0.0,2025-11-26 23:27:23.124455,2025-11-26 23:27:45.180863,0 days 00:00:22.056408,0.1901064352647132,dart,0.8862482674568521,0.9456181400364883,lossguide,1.8073387360736382,0.003252966588185423,6,11,1.3435800985820194,400,tree,0.949761410137379,0.3348995773561991,0.08403116933901639,oversample,0.6393295980539093,,5.0,0.66002737485231,0.20609150538041068,weighted,0.1946731912141631,0.589140315957826,0.6828977820618682,0.44323835368611486,0.4427860696517413,0.0,0.0,0.949761410137379,0.3348995773561991,0.08,0.5982267885721035,0.6079964222787188,0.0,0.0,0.0,0.0,oversample,0.5545806462308724,0.5767696297573723,0.6393295980539093,0.6828977820618682,COMPLETE
1002,0.7156549520766773,2025-11-26 23:27:45.356696,2025-11-26 23:28:03.460531,0 days 00:00:18.103835,1.0405891812912198,dart,0.6566412815468772,0.4044451581553208,lossguide,0.274450466361152,0.045387907666867594,7,12,27.796188596569362,400,tree,0.9293967747184505,0.1407881711711436,0.08021984639757633,oversample,0.6774326761297447,,6.0,0.6957619412013138,0.2228442903773985,weighted,0.05479913382362773,0.47636004298721385,0.47617877112562274,0.5567616463138851,0.5572139303482587,0.715281812899477,0.7156549520766773,0.9293967747184505,0.1407881711711436,0.08,0.6389810473841098,0.6138767664925925,0.5567616463138851,0.5572139303482587,1.0,1.0,oversample,0.5733110628491852,0.5597531936908853,0.6774326761297447,0.47617877112562274,COMPLETE
1003,0.6337828246983677,2025-11-26 23:28:03.629993,2025-11-26 23:28:06.875558,0 days 00:00:03.245565,0.1812882099102259,gbtree,0.9196299401265537,2.733424765366708,lossguide,4.351704648024231,0.2979216259866853,7,8,7.684542377353508,700,,0.8968532306644046,0.2409597415402972,0.08883306817371685,none,0.5147704013179454,0.9173776036082781,11.0,0.7181691672924863,,,,0.6454026985877089,0.2557112724151169,0.5422885572139303,0.5332428765264586,0.63831308077198,0.6337828246983677,0.8968532306644046,0.2409597415402972,0.08,0.5408320909051972,0.5650711471536533,0.5698787492022974,0.5630517023959647,0.7254264825345248,0.7248376623376623,none,0.4896898158125964,0.5030195800114085,0.5147704013179454,0.2557112724151169,COMPLETE
1004,0.0,2025-11-26 23:28:07.048752,2025-11-26 23:28:46.175420,0 days 00:00:39.126668,0.8897758588626384,dart,0.8436247550429881,9.822755552892891,lossguide,0.0004589166125306529,0.004802317610812247,5,7,0.2887280631841034,600,tree,0.9057325356098873,0.8647502208556931,0.03760270201224989,oversample,0.8861000619367687,,12.0,0.7949078943072004,0.27100815370185427,weighted,0.28296579210128886,0.22097060698539964,0.6807086856581517,0.44323835368611486,0.4427860696517413,0.0,0.0,0.9057325356098873,0.8647502208556931,0.05,0.4697069600083702,0.479185575039146,0.0,0.0,0.0,0.0,oversample,0.3946148808833038,0.40529404839287375,0.8861000619367687,0.6807086856581517,COMPLETE
1005,0.5013077593722755,2025-11-26 23:28:46.357030,2025-11-26 23:28:50.209974,0 days 00:00:03.852944,1.5347985163498217,gbtree,0.853483559341476,0.18993280837173376,lossguide,0.01180302388482362,0.03845958349778276,3,6,0.3279941927153954,200,,0.8224119593581248,0.7948906054277989,0.0913485121656157,none,0.7342720528067531,1.1586997552565883,6.0,0.6176078197047166,,,,0.31871100339939906,0.6473349301052324,0.5006784260515604,0.48258706467661694,0.5080213903743316,0.5013077593722755,0.8224119593581248,0.7948906054277989,0.1,0.5584194823068218,0.5329265069277673,0.562685093780849,0.5414312617702448,0.46303818034118605,0.4667207792207792,none,0.5034375569886769,0.4865719061326824,0.7342720528067531,0.6473349301052324,COMPLETE
1006,0.7156549520766773,2025-11-26 23:28:50.391904,2025-11-26 23:29:20.324530,0 days 00:00:29.932626,7.560476101186436,dart,0.907831694263442,2.995239686665589,lossguide,0.047206207077195035,0.14363116719790003,9,8,2.148450934726946,500,tree,0.8466798644605398,0.39599576515917706,0.08453419478153211,oversample,0.5085022172711617,,8.0,0.7583513654588356,0.18315554145825574,weighted,0.4474576868275078,0.602259612922053,0.29400572268616243,0.5567616463138851,0.5572139303482587,0.715281812899477,0.7156549520766773,0.8466798644605398,0.39599576515917706,0.08,0.5556510733478576,0.560763631283385,0.5567616463138851,0.5572139303482587,1.0,1.0,oversample,0.5115896317909779,0.5157611795762971,0.5085022172711617,0.29400572268616243,COMPLETE
1007,0.617174136161478,2025-11-26 23:29:20.517671,2025-11-26 23:29:23.720179,0 days 00:00:03.202508,0.025547706199191528,gbtree,0.663661680527774,2.4034689932365825,lossguide,0.1727587392808159,0.4542267058564439,5,12,35.30022457581757,600,,0.8915024599272932,0.3189532421539981,0.08215815299973338,oversample,0.6475077929857841,,10.0,0.6038336640807631,,,,0.5813226269239367,0.28465931745671635,0.5024875621890548,0.49389416553595655,0.6293800539083558,0.617174136161478,0.8915024599272932,0.3189532421539981,0.08,0.5330073259954802,0.5308680866638393,0.5377086931491076,0.5334121821407452,0.7587327376116978,0.7321428571428571,oversample,0.47087319086854895,0.4718636827932027,0.6475077929857841,0.28465931745671635,COMPLETE
1008,0.0,2025-11-26 23:29:23.905899,2025-11-26 23:30:19.913523,0 days 00:00:56.007624,0.7153498174793385,dart,0.5816073526846754,2.7954338910499708,lossguide,1.4541510258708361,0.013328116918068022,8,10,2.3010765791954886,700,tree,0.9997044602378512,0.17285764209315335,0.09062246868210594,oversample,0.5364330847950904,,6.0,0.671653083839298,0.2800297444980574,weighted,0.030320591576990408,0.6131213334980643,0.6291407872113963,0.44323835368611486,0.4427860696517413,0.0,0.0,0.9997044602378512,0.17285764209315335,0.1,0.5701198439313864,0.564605702192331,0.0,0.0,0.0,0.0,oversample,0.5589942638306338,0.5442772243078678,0.5364330847950904,0.6291407872113963,COMPLETE
1009,0.5997966790918333,2025-11-26 23:30:20.098104,2025-11-26 23:32:58.133128,0 days 00:02:38.035024,0.06877454251775955,dart,0.8785407544526138,0.9105560567958284,lossguide,11.998167654940296,0.13466806016164526,9,11,21.42104656612935,700,tree,0.8760371025770156,0.17349060188083965,0.0946975468001837,oversample,0.5509906729739726,,5.0,0.6950414092804715,0.3341237426515109,weighted,0.2787827379001174,0.4102423754298191,0.40299276671340994,0.4762550881953867,0.4658525554047942,0.6063902107409925,0.5997966790918333,0.8760371025770156,0.17349060188083965,0.1,0.6237554237222454,0.5900869042714476,0.5213325540619521,0.5148342059336823,0.7246141348497157,0.7183441558441559,oversample,0.5443724199671746,0.5067915677274718,0.5509906729739726,0.40299276671340994,COMPLETE
1010,0.0,2025-11-26 23:32:58.317839,2025-11-26 23:33:39.667758,0 days 00:00:41.349919,0.04276973947696761,dart,0.9606136593968658,1.272061324235307,lossguide,0.5824722408840732,0.030634979227941044,7,11,36.15935003743309,600,tree,0.9199386644171373,0.13969601807420223,0.09024146477874108,undersample,0.6235084359394092,,5.0,0.6530275020806695,0.24992519669682012,weighted,0.22355359727008156,0.6764513583065832,0.6379244895989773,0.44323835368611486,0.4427860696517413,0.0,0.0,0.9199386644171373,0.13969601807420223,0.1,0.58687585965359,0.5704711399012213,0.0,0.0,0.0,0.0,undersample,0.5419652182562708,0.5171258771871642,0.6235084359394092,0.6379244895989773,COMPLETE
1011,0.7156549520766773,2025-11-26 23:33:39.869917,2025-11-26 23:35:38.720269,0 days 00:01:58.850352,0.00024732829063957437,dart,0.7396498783503178,2.960926436780018,lossguide,0.00152333140643833,0.0003935197909221603,1,9,45.57109274737228,1000,tree,0.544672174379229,0.19199235226600622,0.08922233512740335,undersample,0.8797673776643522,,5.0,0.7319211035784181,0.14230939309968663,weighted,0.18444207780322686,0.2672340192603945,0.3524370784546185,0.5567616463138851,0.5572139303482587,0.715281812899477,0.7156549520766773,0.544672174379229,0.19199235226600622,0.08,0.5567616463138851,0.5572139303482587,0.5567616463138851,0.5572139303482587,1.0,1.0,undersample,0.5,0.5,0.8797673776643522,0.3524370784546185,COMPLETE
1012,0.6446070633153038,2025-11-26 23:35:38.905872,2025-11-26 23:35:45.176578,0 days 00:00:06.270706,0.020664032630561945,gbtree,0.9171821525361349,1.1151327643385889,depthwise,0.05776956360933961,0.016301505512219715,6,7,6.039163453883026,700,,0.71832206907118,0.4163226139750322,0.09540200776031484,oversample,0.5539985569391642,,11.0,0.7027582686962923,,,,0.7945096415113103,0.38676603637674434,0.48530076888285845,0.4947987336047038,0.6352564102564102,0.6446070633153038,0.71832206907118,0.4163226139750322,0.1,0.5470884222757444,0.5400873550994931,0.5246161990471149,0.5300889586603872,0.8050365556458164,0.8222402597402597,oversample,0.4518402161839553,0.45066195296021655,0.5539985569391642,0.38676603637674434,COMPLETE
