number,value,datetime_start,datetime_complete,duration,params_alpha,params_booster,params_colsample_bytree,params_gamma,params_grow_policy,params_lambda,params_learning_rate,params_max_delta_step,params_max_depth,params_min_child_weight,params_n_estimators,params_normalize_type,params_params_feature_fraction,params_params_labeled_ratio,params_params_missing_rate,params_params_resampling,params_params_sample_rows,params_params_scale_pos_weight,params_params_selftrain_max_iter,params_params_selftrain_threshold,params_rate_drop,params_sample_type,params_skip_drop,params_subsample,params_user_attrs_decision_threshold,user_attrs_acc_test,user_attrs_acc_val,user_attrs_f1_test,user_attrs_f1_val,user_attrs_feature_fraction,user_attrs_labeled_ratio,user_attrs_missing_rate,user_attrs_pr_auc_test,user_attrs_pr_auc_val,user_attrs_prec_test,user_attrs_prec_val,user_attrs_rec_test,user_attrs_rec_val,user_attrs_resampling_strategy,user_attrs_roc_auc_test,user_attrs_roc_auc_val,user_attrs_sample_rows,user_attrs_user_attrs_decision_threshold,state
926,0.7156549520766773,2025-11-26 22:35:03.789413,2025-11-26 22:35:04.730313,0 days 00:00:00.940900,20.350017610647186,gbtree,0.935708050179138,4.1136728674939125,lossguide,18.39513629577371,0.0005397004802917356,9,7,12.071427776375756,800,,0.8385254738725543,0.3810011040341039,0.0788814484278895,oversample,0.9112183586566739,,9.0,0.9367397075643717,,,,0.6045273137310332,0.5110154597099161,0.5567616463138851,0.5572139303482587,0.715281812899477,0.7156549520766773,0.8385254738725543,0.3810011040341039,0.08,0.4784787371195156,0.47667236896434473,0.5567616463138851,0.5572139303482587,1.0,1.0,oversample,0.421453439214841,0.41466535890054784,0.9112183586566739,0.5110154597099161,COMPLETE
927,0.7156549520766773,2025-11-26 22:35:04.915979,2025-11-26 22:35:05.499769,0 days 00:00:00.583790,53.17972851175542,gbtree,0.28571377998568037,2.9571128724752844,lossguide,0.1503633192884399,0.00012227427215394517,0,10,12.82610752872802,300,,0.8313951719762624,0.34079310605999363,0.02718303557840421,none,0.6904864585843005,3.827907164991762,5.0,0.8350679484015957,,,,0.6947275866032675,0.10038101243220575,0.5567616463138851,0.5572139303482587,0.715281812899477,0.7156549520766773,0.8313951719762624,0.34079310605999363,0.02,0.5812041507799761,0.588846815097116,0.5567616463138851,0.5572139303482587,1.0,1.0,none,0.5465060760291118,0.5594538888078213,0.6904864585843005,0.10038101243220575,COMPLETE
928,0.7156549520766773,2025-11-26 22:35:05.674371,2025-11-26 22:35:06.700016,0 days 00:00:01.025645,0.0011735186248015385,gbtree,0.4222758209710277,7.504898127704614,depthwise,0.0001752556390021193,0.00012023582469296263,9,9,0.21175640622962852,1000,,0.7305059381606331,0.6720273049744778,0.01934639273120714,oversample,0.9727347709108399,,5.0,0.6118027565484433,,,,0.6010487518896614,0.48842589598739194,0.5567616463138851,0.5572139303482587,0.715281812899477,0.7156549520766773,0.7305059381606331,0.6720273049744778,0.02,0.5436659843509533,0.5828094086819157,0.5567616463138851,0.5572139303482587,1.0,1.0,oversample,0.46783766309123165,0.5018559390048154,0.9727347709108399,0.48842589598739194,COMPLETE
929,0.622286541244573,2025-11-26 22:35:06.879146,2025-11-26 22:35:51.124498,0 days 00:00:44.245352,0.3652367128654881,dart,0.9102359592032578,0.6717666345358555,lossguide,0.002873322287505993,0.38086187734403765,3,8,0.13662548984333583,300,tree,0.9785010418472844,0.4778075372593336,0.08321849822432353,undersample,0.7160871501086378,,6.0,0.6890164779309721,0.43613802148819236,uniform,0.4808998256629925,0.2758472972515084,0.13007768539899353,0.5115332428765265,0.5278154681139756,0.6092619392185239,0.622286541244573,0.9785010418472844,0.4778075372593336,0.08,0.5320292274022365,0.5492883402575003,0.5492498369210698,0.5613577023498695,0.6839967506092608,0.698051948051948,undersample,0.46713722044463607,0.4930513179364048,0.7160871501086378,0.13007768539899353,COMPLETE
930,0.6758361988121288,2025-11-26 22:35:51.303536,2025-11-26 22:35:53.544897,0 days 00:00:02.241361,0.010221584398732678,gbtree,0.42911513255115735,2.974357384782619,lossguide,0.4292527361322007,0.05928201334124665,4,11,0.42315629094748053,300,,0.9730079344996766,0.5726700598379052,0.04506992359092238,undersample,0.5164235734851409,,12.0,0.6375004370142194,,,,0.5882745388003958,0.3138568904427049,0.5223880597014925,0.5309814563545907,0.6668769716088329,0.6758361988121288,0.9730079344996766,0.5726700598379052,0.05,0.6281057682824985,0.6191485353676329,0.5451263537906137,0.5495678698525673,0.8586515028432169,0.877435064935065,undersample,0.5748387738523516,0.5668577464415054,0.5164235734851409,0.3138568904427049,COMPLETE
931,0.45454545454545453,2025-11-26 22:35:53.734901,2025-11-26 22:36:01.986097,0 days 00:00:08.251196,1.3474746289360235,gbtree,0.7541258233455469,0.45411502334269754,depthwise,0.0008736867842799373,0.0016642419601987295,8,7,0.279046987699089,900,,0.8390835365806097,0.9134214544531957,0.02576402713574857,oversample,0.977318535556947,,8.0,0.6416733313363041,,,,0.4361737369467249,0.562285305981648,0.4739936680235188,0.4626865671641791,0.4677345537757437,0.45454545454545453,0.8390835365806097,0.9134214544531957,0.02,0.5159272339811065,0.5068653414550182,0.5356394129979035,0.5232558139534884,0.4151096669374492,0.4017857142857143,oversample,0.473510419602447,0.47357991854927506,0.977318535556947,0.562285305981648,COMPLETE
932,0.7156549520766773,2025-11-26 22:36:02.160003,2025-11-26 22:36:07.805571,0 days 00:00:05.645568,0.8400582655754432,dart,0.7680573581891164,0.2982389486773655,depthwise,0.000984690375538645,0.004935030848103069,3,5,4.904062781718647,200,tree,0.8320230187613256,0.8124807532307994,0.08567337967744841,oversample,0.8613310715590418,,5.0,0.6136624729174206,0.31229009761480425,uniform,0.5642057670433277,0.21678808634729502,0.19261144084780346,0.5567616463138851,0.5572139303482587,0.715281812899477,0.7156549520766773,0.8320230187613256,0.8124807532307994,0.08,0.6001906399560446,0.5915421024691647,0.5567616463138851,0.5572139303482587,1.0,1.0,oversample,0.5642886155274457,0.5610254467187562,0.8613310715590418,0.19261144084780346,COMPLETE
933,0.0,2025-11-26 22:36:07.992770,2025-11-26 22:36:08.931347,0 days 00:00:00.938577,16.126987237722524,gbtree,0.8164963365863067,0.28701886094287254,lossguide,0.4101168533056708,0.003236687169500716,7,10,10.80940011310197,500,,0.819634552797503,0.5096796695543258,0.09530373801549624,oversample,0.7442164202552325,,5.0,0.9222862310823318,,,,0.5836987828804003,0.7901405126812225,0.44323835368611486,0.4427860696517413,0.0,0.0,0.819634552797503,0.5096796695543258,0.1,0.48822570014357364,0.5004966099271817,0.0,0.0,0.0,0.0,oversample,0.4127915747940119,0.4203815847074274,0.7442164202552325,0.7901405126812225,COMPLETE
934,0.0,2025-11-26 22:36:09.106924,2025-11-26 22:36:09.982787,0 days 00:00:00.875863,0.004196866408800294,gbtree,0.5317324692426967,7.264750511062232,lossguide,0.0001348487553101338,0.00036715712852631026,7,12,0.6186899344854967,800,,0.6159332619871606,0.09635213022161944,0.014952054123915166,oversample,0.6929512960902111,,5.0,0.6147375869240478,,,,0.32550152511269315,0.6404646038390035,0.44323835368611486,0.4427860696517413,0.0,0.0,0.6159332619871606,0.09635213022161944,0.02,0.5361752807417153,0.5631179867100324,0.0,0.0,0.0,0.0,oversample,0.48255897809976955,0.5126441803854981,0.6929512960902111,0.6404646038390035,COMPLETE
935,0.7149084568439407,2025-11-26 22:36:10.152806,2025-11-26 22:37:28.139633,0 days 00:01:17.986827,0.1602288907791926,dart,0.48937562389092554,3.678930327995044,depthwise,0.001576080588473422,0.010278811121733422,6,8,1.0850365938358555,800,forest,0.7194032345383837,0.6533433354422505,0.014999776949612516,oversample,0.9003605811977744,,6.0,0.748630998630345,0.21013129882512854,weighted,0.5341086488145279,0.4120107885685317,0.5013505575562297,0.5567616463138851,0.5563093622795116,0.7151162790697675,0.7149084568439407,0.7194032345383837,0.6533433354422505,0.02,0.4940252473722857,0.4891078011717682,0.5568130375735627,0.5568130375735627,0.9991876523151909,0.9983766233766234,oversample,0.4316003249390739,0.4279243164904554,0.9003605811977744,0.5013505575562297,COMPLETE
936,0.0,2025-11-26 22:37:28.315522,2025-11-26 22:37:29.228555,0 days 00:00:00.913033,0.0027117624520971097,gbtree,0.5245307501727537,5.744920363059629,lossguide,0.0009135878081229502,0.0013666242998011178,5,6,0.8258999463336342,800,,0.5575127944456582,0.05442373556994873,0.02126453108492015,oversample,0.8787022177809585,,5.0,0.6045719192502932,,,,0.5390511108427689,0.5890798199485706,0.44323835368611486,0.4427860696517413,0.0,0.0,0.5575127944456582,0.05442373556994873,0.02,0.4227765761865187,0.4247818090861242,0.0,0.0,0.0,0.0,oversample,0.26801256652132827,0.2775613367735431,0.8787022177809585,0.5890798199485706,COMPLETE
937,0.715281812899477,2025-11-26 22:37:29.415634,2025-11-26 22:37:40.731990,0 days 00:00:11.316356,0.005046808141316509,dart,0.9571468639206223,0.4657378544372911,depthwise,0.0006337153405547939,0.02814113368077284,7,3,0.5129006971030202,300,forest,0.9697309018503995,0.3825721215642384,0.06370849972105896,undersample,0.7278493518942235,,7.0,0.8019428294960809,0.3477620794696609,weighted,0.6752276397667172,0.43375428437308394,0.22842961870404402,0.5576662143826323,0.5567616463138851,0.7153667054714785,0.715281812899477,0.9697309018503995,0.3825721215642384,0.05,0.5342914043031624,0.5356959118725717,0.5573696145124717,0.5570135746606335,0.9983753046303818,0.9991883116883117,undersample,0.4805160894577165,0.4823061897244737,0.7278493518942235,0.22842961870404402,COMPLETE
938,0.004815409309791332,2025-11-26 22:37:40.923039,2025-11-26 22:38:03.500542,0 days 00:00:22.577503,0.020674818454241024,dart,0.9135141305678909,2.7635958589593885,lossguide,0.02701378437390498,0.035746736315624555,5,4,1.115154112792299,300,tree,0.9969017927573834,0.8907774266260922,0.08366229426248652,oversample,0.6522704937409304,,6.0,0.7446631509181556,0.17457010127592779,weighted,0.16529077164754055,0.2346042791049904,0.693349783934081,0.44097693351424694,0.4391677973767526,0.0032258064516129032,0.004815409309791332,0.9969017927573834,0.8907774266260922,0.08,0.46598989314568806,0.4683950642559607,0.2222222222222222,0.21428571428571427,0.0016246953696181965,0.002435064935064935,oversample,0.3734250402029211,0.38069093827520795,0.6522704937409304,0.693349783934081,COMPLETE
939,0.7010494752623688,2025-11-26 22:38:03.684543,2025-11-26 22:38:04.795348,0 days 00:00:01.110805,0.0010499857050675994,gbtree,0.5942388767679952,3.974948328641915,depthwise,0.00011528277647779936,0.0015831379950035534,4,10,1.4883928859436821,900,,0.6630836622094038,0.6022200036297168,0.00075457806376804,oversample,0.9209947975090725,,6.0,0.7321532527367283,,,,0.5254840765479282,0.5424911352620835,0.5490728177295342,0.5490728177295342,0.7010494752623688,0.7010494752623688,0.6630836622094038,0.6022200036297168,0.0,0.6154552487450804,0.6056233667177731,0.5556083650190115,0.5558725630052306,0.9496344435418359,0.9488636363636364,oversample,0.5627484706311444,0.5544017716195959,0.9209947975090725,0.5424911352620835,COMPLETE
940,0.7156549520766773,2025-11-26 22:38:04.973557,2025-11-26 22:38:17.683459,0 days 00:00:12.709902,0.010959209034524816,dart,0.6399405285045291,2.716597893690576,depthwise,0.005525500387500879,0.012250063745920541,4,4,2.1214792826116478,300,forest,0.8563859493451141,0.5834570825984808,0.0311857042246853,undersample,0.6278896645538192,,5.0,0.6932063716022994,0.012398214253963792,weighted,0.3401554565266523,0.32462177905727607,0.10662893370370974,0.5567616463138851,0.5572139303482587,0.715281812899477,0.7156549520766773,0.8563859493451141,0.5834570825984808,0.02,0.5681646767412765,0.5550550254391742,0.5567616463138851,0.5572139303482587,1.0,1.0,undersample,0.5362630348646363,0.5283419338577663,0.6278896645538192,0.10662893370370974,COMPLETE
941,0.7143688190808609,2025-11-26 22:38:17.859211,2025-11-26 22:38:32.190954,0 days 00:00:14.331743,0.002007952059721771,dart,0.5642548755793451,0.11476712223460306,lossguide,0.3818627335096032,0.013197698097088302,4,6,0.12691124307412438,300,forest,0.8113525944098261,0.8787067980461228,0.09665785534955211,oversample,0.7045360593546115,,5.0,0.8124691422094805,0.10097241303554091,weighted,0.883947357143304,0.2657887790939093,0.2799898094867119,0.5549525101763908,0.555857078245138,0.7136204889406287,0.7143688190808609,0.8113525944098261,0.8787067980461228,0.1,0.5172371232127759,0.5065411351705102,0.5560090702947846,0.556663644605621,0.9959382615759546,0.9967532467532467,oversample,0.4306528622821996,0.4287140336680684,0.7045360593546115,0.2799898094867119,COMPLETE
942,0.6219224283305228,2025-11-26 22:38:32.370953,2025-11-26 22:38:44.483206,0 days 00:00:12.112253,0.007851161479616703,gbtree,0.6532133589560063,0.46930498996853165,lossguide,0.0001033887302681415,0.018583040740695014,7,11,1.4344348732249055,200,,0.9385397656586825,0.6930454593612595,0.08451332148325753,undersample,0.6081643563430755,,11.0,0.6586140775007561,,,,0.2471521849726913,0.34678138392838564,0.4929895974672094,0.4929895974672094,0.6206429780033841,0.6219224283305228,0.9385397656586825,0.6930454593612595,0.08,0.5282476478543887,0.5144547484487502,0.5319025522041764,0.5320253894979804,0.7449228269699432,0.7483766233766234,undersample,0.44733956133225017,0.43719903691813805,0.6081643563430755,0.34678138392838564,COMPLETE
943,0.03522205206738132,2025-11-26 22:38:44.667124,2025-11-26 22:38:47.856211,0 days 00:00:03.189087,0.007514419292315093,gbtree,0.5185859867882809,1.8235797714932418,depthwise,0.0001180239950653641,0.02404754967966083,4,9,0.16158627526408742,1000,,0.7074739345464431,0.5605134731990641,0.013660111469274719,oversample,0.7992110672776461,,6.0,0.7312172957714739,,,,0.8156443512404328,0.671293087922686,0.433288104929896,0.43012211668928085,0.03837298541826554,0.03522205206738132,0.7074739345464431,0.5605134731990641,0.02,0.5201366490478476,0.5130600941050409,0.3472222222222222,0.3108108108108108,0.020308692120227456,0.018668831168831168,oversample,0.4666767519355427,0.45577335075547537,0.7992110672776461,0.671293087922686,COMPLETE
944,0.0,2025-11-26 22:38:48.035216,2025-11-26 22:38:48.995491,0 days 00:00:00.960275,0.00037262855436946224,gbtree,0.5668760466340947,7.622493453098118,lossguide,0.00025252958879259317,0.0006478288251740388,7,8,0.5114280408782054,900,,0.7971086556956294,0.21945398961037227,0.054100376845043624,oversample,0.7874472241376024,,5.0,0.6318094333716168,,,,0.6708617252115995,0.713148337362015,0.44323835368611486,0.4427860696517413,0.0,0.0,0.7971086556956294,0.21945398961037227,0.05,0.4457768579013767,0.43906730204592503,0.0,0.0,0.0,0.0,oversample,0.2672404217576551,0.25950189366302745,0.7874472241376024,0.713148337362015,COMPLETE
945,0.12368236120871398,2025-11-26 22:38:49.186939,2025-11-26 22:50:33.213669,0 days 00:11:44.026730,0.32811444303583454,dart,0.546791979119106,0.3567319736682433,depthwise,0.000173339677827917,0.002290296247753843,7,6,3.36976162908962,1000,forest,0.6452575736853504,0.8343644624198893,0.06847096429617694,oversample,0.9946610021275301,,9.0,0.6431148075614964,0.002843434884160091,weighted,0.02856943486700529,0.5437353761958772,0.6113815681527447,0.4314789687924016,0.4360018091361375,0.11541168191414497,0.12368236120871398,0.6452575736853504,0.8343644624198893,0.08,0.529221372188283,0.5476290971608644,0.43157894736842106,0.4607329842931937,0.06661251015434606,0.07142857142857142,oversample,0.4730151361925761,0.5134761816324636,0.9946610021275301,0.6113815681527447,COMPLETE
946,0.6995319812792512,2025-11-26 22:50:33.382449,2025-11-26 22:50:34.273480,0 days 00:00:00.891031,0.5103946586492478,gbtree,0.31728741799813753,0.6317550003189489,depthwise,0.009542901430262169,0.27246058855795047,5,3,3.8022409120763605,700,,0.9125441971926379,0.5423599113155424,0.02723893356325121,none,0.9905462653074703,1.092731848352077,8.0,0.8936458744246345,,,,0.9639244800308691,0.48682248072674134,0.550429669832655,0.5644504748982361,0.6897627965043696,0.6995319812792512,0.9125441971926379,0.5423599113155424,0.02,0.564529478752773,0.585501290034442,0.5600608210846427,0.5681702990369994,0.8976441917140536,0.9099025974025974,none,0.5129697939289444,0.5521586431954154,0.9905462653074703,0.48682248072674134,COMPLETE
947,0.7156549520766773,2025-11-26 22:50:34.444558,2025-11-26 22:51:12.272129,0 days 00:00:37.827571,0.8454399647717904,dart,0.8869979199381264,6.374994032941383,depthwise,0.00021040073878381813,0.0009144324750564203,6,4,1.1132807842296781,600,tree,0.9060342739776099,0.8428576942122333,0.04117741116072189,oversample,0.8297342472458986,,12.0,0.733935007084754,0.3942519525389991,weighted,0.4266588484149017,0.5113012475994507,0.5027633474638413,0.5567616463138851,0.5572139303482587,0.715281812899477,0.7156549520766773,0.9060342739776099,0.8428576942122333,0.05,0.48675980664967505,0.47480644903046143,0.5567616463138851,0.5572139303482587,1.0,1.0,oversample,0.4102587907624463,0.38252573524534705,0.8297342472458986,0.5027633474638413,COMPLETE
948,0.7018390111546579,2025-11-26 22:51:12.448010,2025-11-26 22:51:14.017883,0 days 00:00:01.569873,0.009399628584112913,gbtree,0.9877808872317784,0.9144895022787436,lossguide,0.0001985666672672942,0.03405068189885427,1,4,1.4515029269478839,200,,0.8633601002995895,0.7155734254833467,0.06454457638591606,undersample,0.6286364645891601,,5.0,0.6316172222601005,,,,0.21086761224908246,0.28195400216432465,0.5486205336951605,0.5526910900045229,0.6962872793670115,0.7018390111546579,0.8633601002995895,0.7155734254833467,0.05,0.530362957907625,0.5132304798191801,0.55669099756691,0.5582733812949641,0.9293257514216084,0.9448051948051948,undersample,0.49136922031200786,0.4631042476420413,0.6286364645891601,0.28195400216432465,COMPLETE
949,0.7156549520766773,2025-11-26 22:51:14.207900,2025-11-26 22:51:18.813133,0 days 00:00:04.605233,0.026082427968527697,dart,0.8385895097527475,9.648459148724458,lossguide,69.004131101784,0.0007624642839256535,1,4,1.8033375164080954,200,tree,0.768229068553598,0.6527559626708994,0.031934098236208984,oversample,0.5776172533618259,,12.0,0.8995201527564107,0.32147889628641213,weighted,0.2505165755687445,0.20659067926100472,0.07716191867386114,0.5567616463138851,0.5572139303482587,0.715281812899477,0.7156549520766773,0.768229068553598,0.6527559626708994,0.02,0.5567616463138851,0.5572139303482587,0.5567616463138851,0.5572139303482587,1.0,1.0,oversample,0.5,0.5,0.5776172533618259,0.07716191867386114,COMPLETE
950,0.7156549520766773,2025-11-26 22:51:18.983557,2025-11-26 22:51:20.152204,0 days 00:00:01.168647,27.55102076569209,gbtree,0.4515578233338181,1.5308186579824392,depthwise,0.0005811898688386209,0.005297980023920526,10,7,0.19147169170135447,1000,,0.7251205547849371,0.7945270039731124,0.039529226047135976,none,0.9805893709439896,2.387921637373619,8.0,0.6264695739414613,,,,0.4406944584610889,0.20619901232530932,0.5567616463138851,0.5572139303482587,0.715281812899477,0.7156549520766773,0.7251205547849371,0.7945270039731124,0.05,0.46357189314044367,0.47223540603722,0.5567616463138851,0.5572139303482587,1.0,1.0,none,0.34892571163315045,0.3581120743403685,0.9805893709439896,0.20619901232530932,COMPLETE
951,0.7064496684749849,2025-11-26 22:51:20.336025,2025-11-26 22:51:22.166154,0 days 00:00:01.830129,1.0061506237196747,gbtree,0.9876987343969704,1.3132633164906704,lossguide,0.0001569665762671572,0.006029604826692838,6,10,0.1392552261486278,500,,0.5839177028014056,0.4648116056820493,0.09070970558204892,oversample,0.7374874340054426,,5.0,0.7652965463169237,,,,0.9450191817149354,0.45894154445297747,0.5585707824513795,0.5594753505201266,0.7051359516616315,0.7064496684749849,0.5839177028014056,0.4648116056820493,0.1,0.5492283182377716,0.5687462919164226,0.5613275613275613,0.5618408437200384,0.9480097481722177,0.9512987012987013,oversample,0.4649625325353537,0.5000634261040288,0.7374874340054426,0.45894154445297747,COMPLETE
952,0.7156549520766773,2025-11-26 22:51:22.337133,2025-11-26 22:51:39.791934,0 days 00:00:17.454801,1.038541452237985,dart,0.7129288099350805,6.483470096670649,lossguide,4.420220937869067,0.0018074793738063985,10,8,4.846806468067197,400,tree,0.828589665064929,0.18796980881933137,0.09849332950210685,undersample,0.9414969344559134,,7.0,0.9301403821992644,0.2680464631256994,weighted,0.4517621925009751,0.5154468026273292,0.4146563441869033,0.5567616463138851,0.5572139303482587,0.715281812899477,0.7156549520766773,0.828589665064929,0.18796980881933137,0.1,0.4930516650648541,0.488682626088459,0.5567616463138851,0.5572139303482587,1.0,1.0,undersample,0.3780583232480645,0.3621286463791572,0.9414969344559134,0.4146563441869033,COMPLETE
953,0.0,2025-11-26 22:51:39.963928,2025-11-26 22:51:40.971986,0 days 00:00:01.008058,0.0003324746239117605,gbtree,0.5063579591856737,7.449154140760478,lossguide,0.0004669015733890119,0.0031180193783038102,3,9,0.14867145211248567,1000,,0.5498010112905247,0.1602381848358268,0.017181029431179336,none,0.6478539590229657,0.64275054949704,6.0,0.6010060794630157,,,,0.5841463590382121,0.6474035242391452,0.44323835368611486,0.4427860696517413,0.0,0.0,0.5498010112905247,0.1602381848358268,0.02,0.5437902459240188,0.550766371126849,0.0,0.0,0.0,0.0,none,0.4392492415325187,0.4394438235411168,0.6478539590229657,0.6474035242391452,COMPLETE
954,0.0,2025-11-26 22:51:41.152995,2025-11-26 22:51:41.963971,0 days 00:00:00.810976,0.46772895705041484,gbtree,0.5003361379152265,5.1320408635075925,depthwise,0.0005779370103367869,0.03135746876440049,8,8,1.5473490160427719,600,,0.8453614225674072,0.6863186433018731,0.004776546509810958,none,0.8527018381890363,1.073783468983111,6.0,0.7126298666439796,,,,0.7498182513783956,0.6652630954030384,0.44323835368611486,0.4427860696517413,0.0,0.0,0.8453614225674072,0.6863186433018731,0.0,0.5392005579680468,0.544722138785837,0.0,0.0,0.0,0.0,none,0.5131803411860276,0.52010317312922,0.8527018381890363,0.6652630954030384,COMPLETE
