number,value,datetime_start,datetime_complete,duration,params_alpha,params_booster,params_colsample_bytree,params_gamma,params_grow_policy,params_lambda,params_learning_rate,params_max_delta_step,params_max_depth,params_min_child_weight,params_n_estimators,params_normalize_type,params_params_feature_fraction,params_params_labeled_ratio,params_params_missing_rate,params_params_resampling,params_params_sample_rows,params_params_scale_pos_weight,params_params_selftrain_max_iter,params_params_selftrain_threshold,params_rate_drop,params_sample_type,params_skip_drop,params_subsample,params_user_attrs_decision_threshold,user_attrs_acc_test,user_attrs_acc_val,user_attrs_f1_test,user_attrs_f1_val,user_attrs_feature_fraction,user_attrs_labeled_ratio,user_attrs_missing_rate,user_attrs_pr_auc_test,user_attrs_pr_auc_val,user_attrs_prec_test,user_attrs_prec_val,user_attrs_rec_test,user_attrs_rec_val,user_attrs_resampling_strategy,user_attrs_roc_auc_test,user_attrs_roc_auc_val,user_attrs_sample_rows,user_attrs_user_attrs_decision_threshold,state
2063,0.7156549520766773,2025-11-30 11:33:40.126147,2025-11-30 11:33:44.022038,0 days 00:00:03.895891,0.0006236282906317988,gbtree,0.7804754913684631,4.072411714138074,lossguide,0.0024740293816906357,0.001707237432566824,1,10,0.17510726706671334,1000,,0.9302755869143968,0.7089309838979299,0.008960303423860538,none,0.5397610412933779,1.8044248342914155,6.0,0.6946147668335501,,,,0.24274174542946023,,0.5567616463138851,0.5572139303482587,0.715281812899477,0.7156549520766773,0.9302755869143968,0.7089309838979299,0.08,0.4915845674657324,0.49067774304809325,0.5567616463138851,0.5572139303482587,1.0,1.0,none,0.44129959051045275,0.44396573166363773,0.5397610412933779,0.5,COMPLETE
2064,0.7156549520766773,2025-11-30 11:33:44.808165,2025-11-30 11:34:04.864012,0 days 00:00:20.055847,0.001221534593066732,dart,0.24547846114659225,2.835188465821666,lossguide,0.0190353880831562,0.03368504754782006,8,7,12.214518086254559,400,tree,0.7887714744156877,0.8716033385833977,0.004461230125411409,none,0.7299279418780037,1.013398142412313,5.0,0.8259495855596013,0.12971128217267747,uniform,0.3364318241393053,0.830836409845215,,0.5567616463138851,0.5572139303482587,0.715281812899477,0.7156549520766773,0.7887714744156877,0.8716033385833977,0.08,0.44046785370938907,0.43352198529089103,0.5567616463138851,0.5572139303482587,1.0,1.0,none,0.31473582121719523,0.29999593741294456,0.7299279418780037,0.5,COMPLETE
2065,0.7156549520766773,2025-11-30 11:34:05.647397,2025-11-30 11:34:43.051502,0 days 00:00:37.404105,0.0013267385568109008,dart,0.6350447600618612,3.9267567654709437,lossguide,54.75633057805166,0.001063701174639439,5,9,0.24354638990657174,600,tree,0.9795833015176112,0.5206971790820301,0.06360610554471413,oversample,0.8783893213684446,,11.0,0.8068444578632896,0.36208381830577163,uniform,0.3591227895327918,0.9231871639425897,,0.5567616463138851,0.5572139303482587,0.715281812899477,0.7156549520766773,0.9795833015176112,0.5206971790820301,0.08,0.5014736544601626,0.4951844910576812,0.5567616463138851,0.5572139303482587,1.0,1.0,oversample,0.422203617433976,0.42046573829643297,0.8783893213684446,0.5,COMPLETE
2066,0.7156549520766773,2025-11-30 11:34:43.836814,2025-11-30 11:36:54.878925,0 days 00:02:11.042111,0.024581339879607013,dart,0.5392258015118736,1.5941446344895593,lossguide,0.5934588823795691,0.2300306216183661,0,11,27.962207637483363,700,forest,0.6163720646395284,0.630125294533812,0.009961493022127134,none,0.9646457086513569,1.0608912955470213,5.0,0.611576107016427,0.4794913609317368,uniform,0.31983196362473665,0.25017036161867656,,0.5567616463138851,0.5572139303482587,0.715281812899477,0.7156549520766773,0.6163720646395284,0.630125294533812,0.08,0.5431453168710008,0.4998275473784513,0.5567616463138851,0.5572139303482587,1.0,1.0,none,0.46391932890134124,0.4180708846822228,0.9646457086513569,0.5,COMPLETE
2067,0.5430227374052609,2025-11-30 11:36:55.685435,2025-11-30 11:36:56.647022,0 days 00:00:00.961587,0.5139034781890428,gbtree,0.9922760012487151,0.1203622289765427,depthwise,0.000493066824932584,0.0008640654318901449,7,5,0.2472667346319083,400,,0.620709310038287,0.6637532000728732,0.09894097772844315,undersample,0.7451526732743685,,10.0,0.6861221147468375,,,,0.9794049702544403,,0.5554047942107644,0.5364088647670737,0.5633051976899156,0.5430227374052609,0.620709310038287,0.6637532000728732,0.1,0.587973868698013,0.5671192975760827,0.6215686274509804,0.6023738872403561,0.5150284321689683,0.4943181818181818,undersample,0.5726048177191267,0.5413608671716434,0.7451526732743685,0.5,COMPLETE
2068,0.7156549520766773,2025-11-30 11:36:57.457261,2025-11-30 11:36:58.088556,0 days 00:00:00.631295,35.46512310726877,gbtree,0.3861015942638124,3.6054556048589226,lossguide,9.374356973386925,0.041076993031082885,10,5,1.7561863934069641,600,,0.5529530774411161,0.8656668277387758,0.09049483455499269,undersample,0.9844858523351758,,10.0,0.6816970894138337,,,,0.23680584870983756,,0.5567616463138851,0.5572139303482587,0.715281812899477,0.7156549520766773,0.5529530774411161,0.8656668277387758,0.1,0.5567616463138851,0.5572139303482587,0.5567616463138851,0.5572139303482587,1.0,1.0,undersample,0.5,0.5,0.9844858523351758,0.5,COMPLETE
2069,0.0,2025-11-30 11:36:58.902727,2025-11-30 11:38:27.713357,0 days 00:01:28.810630,0.0010742827303657958,dart,0.44357472590185565,7.487882575401331,depthwise,0.002672043076701355,0.0025241786468567042,5,5,1.3270538612281322,900,tree,0.7087431873980059,0.29190252993127924,0.09944007896476795,none,0.9839827833021135,0.7101084981003168,8.0,0.8114412314073087,0.4712917998489652,weighted,0.5705979279701947,0.5594333189501906,,0.44323835368611486,0.4427860696517413,0.0,0.0,0.7087431873980059,0.29190252993127924,0.1,0.5620304429169416,0.586676163341969,0.0,0.0,0.0,0.0,none,0.4908424377061953,0.5195273635965667,0.9839827833021135,0.5,COMPLETE
2070,0.7156549520766773,2025-11-30 11:38:28.486697,2025-11-30 11:39:12.463973,0 days 00:00:43.977276,0.004264976137499388,dart,0.5213708283036789,4.067333458357483,lossguide,0.2053381572041068,0.01551109846090249,3,5,49.009861438893566,600,tree,0.8402572405714129,0.6356690999962034,0.025364252425682278,none,0.5243451479877643,2.7483214659062685,6.0,0.848684940952821,0.18651743194037373,uniform,0.47247339802883787,0.5643553195600216,,0.5567616463138851,0.5572139303482587,0.715281812899477,0.7156549520766773,0.8402572405714129,0.6356690999962034,0.08,0.5518994552685412,0.5417299070110242,0.5567616463138851,0.5572139303482587,1.0,1.0,none,0.488261990417613,0.48125737898465176,0.5243451479877643,0.5,COMPLETE
2071,0.7156549520766773,2025-11-30 11:39:13.237274,2025-11-30 11:40:54.062700,0 days 00:01:40.825426,0.01722163652622783,dart,0.9376891694137546,7.103368289742134,lossguide,0.00011150763916557579,0.001110957714586585,0,8,0.1232269711843384,900,forest,0.7943698049851441,0.8739392238881696,0.06719571405958223,none,0.847635002952343,1.9923344358040764,10.0,0.6059050856795138,0.17130549217079516,uniform,0.5600079529558154,0.6244297716502254,,0.5567616463138851,0.5572139303482587,0.715281812899477,0.7156549520766773,0.7943698049851441,0.8739392238881696,0.08,0.5152920238403488,0.5242452907732831,0.5567616463138851,0.5572139303482587,1.0,1.0,none,0.4061236923689054,0.41526479776607456,0.847635002952343,0.5,COMPLETE
2072,0.7156549520766773,2025-11-30 11:40:54.835504,2025-11-30 11:40:55.488661,0 days 00:00:00.653157,0.00035100588034674287,gbtree,0.5282412501521005,5.199523745708382,lossguide,1.457936019217978,0.0002289278687009983,6,10,2.1188826906330074,500,,0.7706903968785679,0.8463142475224141,0.09805801327872825,oversample,0.5667307354674672,,12.0,0.8904640790111701,,,,0.3822076012302888,,0.5567616463138851,0.5572139303482587,0.715281812899477,0.7156549520766773,0.7706903968785679,0.8463142475224141,0.1,0.6732579181748805,0.6593805905013983,0.5567616463138851,0.5572139303482587,1.0,1.0,oversample,0.7028108887746812,0.6926553400634095,0.5667307354674672,0.5,COMPLETE
2073,0.7157296272899558,2025-11-30 11:40:56.260164,2025-11-30 11:40:56.717763,0 days 00:00:00.457599,0.047683320759355684,gbtree,0.3281843730561146,1.6046764388760104,depthwise,20.788731808052948,0.332619171253426,0,6,0.7944869324642225,300,,0.9538664787425197,0.7179187424803708,0.02473987555391537,oversample,0.8482315723262503,,10.0,0.9143218250248073,,,,0.926300475483461,,0.5947535052012664,0.592944369063772,0.7191222570532916,0.7157296272899558,0.9538664787425197,0.7179187424803708,0.08,0.6100178443363347,0.5911610211172036,0.5855028075548749,0.5858324715615305,0.9317627944760357,0.9196428571428571,oversample,0.5815501749034301,0.5681469960070573,0.8482315723262503,0.5,COMPLETE
2074,0.5917197452229299,2025-11-30 11:40:57.511357,2025-11-30 11:40:58.364449,0 days 00:00:00.853092,0.0092881240145897,gbtree,0.2505660946709045,9.795269293354586,depthwise,0.0011167354747701733,0.005507016094327542,3,6,1.36375239020291,1000,,0.9852468467979888,0.2934076022219228,0.051451274329875674,undersample,0.619206640462029,,7.0,0.633881383612431,,,,0.7442789328120012,,0.4260515603799186,0.42017186793306194,0.5975261655566128,0.5917197452229299,0.9852468467979888,0.2934076022219228,0.08,0.5057611218251948,0.5041910625241025,0.49011446409989595,0.4868972746331237,0.7652315190901706,0.7540584415584416,undersample,0.3826157595450853,0.3770292207792208,0.619206640462029,0.5,COMPLETE
2075,0.7156549520766773,2025-11-30 11:40:59.124699,2025-11-30 11:41:30.560859,0 days 00:00:31.436160,72.00356188559924,dart,0.8116495794861669,6.375826945307929,depthwise,7.556543373563311,0.0020028186998598675,1,12,14.595534501939149,500,forest,0.9679160401083943,0.8883983695824493,0.010700414019379156,oversample,0.5586602401924055,,8.0,0.739930592278584,0.03131800152990488,weighted,0.21771153378133634,0.9118349251564322,,0.5567616463138851,0.5572139303482587,0.715281812899477,0.7156549520766773,0.9679160401083943,0.8883983695824493,0.08,0.5567616463138851,0.5572139303482587,0.5567616463138851,0.5572139303482587,1.0,1.0,oversample,0.5,0.5,0.5586602401924055,0.5,COMPLETE
2076,0.28382502543234994,2025-11-30 11:41:31.311842,2025-11-30 11:42:14.660906,0 days 00:00:43.349064,0.001033123967241688,dart,0.24682793778844703,5.810819296720631,depthwise,0.0028141175863917577,0.00022895725277032706,5,11,3.114086870539179,700,forest,0.6995805726273865,0.5022320893580234,0.06713834786701532,undersample,0.6999060700046653,,5.0,0.8150846949336122,0.48998116317115464,uniform,0.38133571810992556,0.8876646691356973,,0.35956580732700133,0.36318407960199006,0.2834008097165992,0.28382502543234994,0.6995805726273865,0.5022320893580234,0.08,0.5043032859816372,0.5049977751319707,0.37583892617449666,0.3801089918256131,0.22745735174654752,0.22646103896103897,undersample,0.4276695568560487,0.4345276786543385,0.6999060700046653,0.5,COMPLETE
2077,0.7156549520766773,2025-11-30 11:42:15.440534,2025-11-30 11:42:16.306851,0 days 00:00:00.866317,0.00015125228676802824,gbtree,0.28782756645000057,4.053735828485561,lossguide,0.008438357878410558,0.00025624271058086634,6,8,1.6409934209582835,800,,0.7620919301968792,0.45556991394200685,0.010329815508513862,none,0.9795711259889874,1.2682755562309638,5.0,0.6666984202290238,,,,0.7898033940771818,,0.5567616463138851,0.5572139303482587,0.715281812899477,0.7156549520766773,0.7620919301968792,0.45556991394200685,0.08,0.5646692061044367,0.5712883823869017,0.5567616463138851,0.5572139303482587,1.0,1.0,none,0.5253120907176843,0.5262007846596712,0.9795711259889874,0.5,COMPLETE
2078,0.47402880838061984,2025-11-30 11:42:17.098519,2025-11-30 11:42:45.629028,0 days 00:00:28.530509,0.003892585765620009,dart,0.25248389376794056,2.213964462927722,depthwise,0.00039818451389085055,0.00019855712014502504,6,5,0.18027386476022017,500,forest,0.9478456456051016,0.4747981519235057,0.07814796002346613,undersample,0.6747201460242674,,10.0,0.9074303733829978,0.38672777222451526,weighted,0.41076860880516,0.2529195696935638,,0.4893713251922207,0.4549977385798281,0.5164882226980728,0.47402880838061984,0.9478456456051016,0.4747981519235057,0.08,0.5366855430740125,0.5060324784347061,0.5461956521739131,0.5127478753541076,0.48984565393988627,0.4407467532467532,undersample,0.4965831661665478,0.46292723492034016,0.6747201460242674,0.5,COMPLETE
2079,0.4777015437392796,2025-11-30 11:42:46.416161,2025-11-30 11:42:47.353677,0 days 00:00:00.937516,1.231514899192274,gbtree,0.619503848861776,2.6090449938105973,lossguide,0.09458489198939785,0.0024674717833727657,0,8,1.2437569142170812,500,,0.9409482515484162,0.7037341104896018,0.00038603515102610955,undersample,0.9853657213853164,,9.0,0.9382364900032627,,,,0.42187221704419486,,0.44640434192673,0.4491180461329715,0.47736976942783943,0.4777015437392796,0.9409482515484162,0.7037341104896018,0.08,0.4956391374010952,0.49189385069039215,0.5031503150315032,0.5063636363636363,0.45410235580828595,0.45211038961038963,undersample,0.43671065501749035,0.43380802037594685,0.9853657213853164,0.5,COMPLETE
2080,0.7156549520766773,2025-11-30 11:42:48.149827,2025-11-30 11:44:55.824108,0 days 00:02:07.674281,0.0030627400310896937,dart,0.8870219745855217,3.719187485124613,depthwise,0.00010192954838222679,0.0009736229351619111,3,8,42.87423336797892,1000,tree,0.647038331191583,0.517165971814215,0.024488947942009943,oversample,0.8378445738221334,,11.0,0.7728852418955282,0.4403390615235398,uniform,0.8505240992463523,0.4545868073416499,,0.5567616463138851,0.5572139303482587,0.715281812899477,0.7156549520766773,0.647038331191583,0.517165971814215,0.08,0.6381160299277364,0.6307349544445253,0.5567616463138851,0.5572139303482587,1.0,1.0,oversample,0.5724891825129726,0.5788842477746973,0.8378445738221334,0.5,COMPLETE
2081,0.5802513464991024,2025-11-30 11:44:56.619288,2025-11-30 11:44:58.811743,0 days 00:00:02.192455,0.00028323988833655136,gbtree,0.28609416411966554,1.5638334886796301,depthwise,0.0066863968560887475,0.1061403854737481,6,11,0.20288095259064706,500,,0.7416967676011961,0.2279949613305019,0.09758838684185334,none,0.5587628214518188,0.8899553479733955,8.0,0.8238967871262944,,,,0.5397304022724743,,0.49389416553595655,0.47127996381727727,0.6019210245464247,0.5802513464991024,0.7416967676011961,0.2279949613305019,0.1,0.5166394519352752,0.5075806126761941,0.5354430379746835,0.5202833226014166,0.6872461413484972,0.6558441558441559,none,0.4512363434407069,0.4309152925725959,0.5587628214518188,0.5,COMPLETE
2082,0.7156549520766773,2025-11-30 11:44:59.590159,2025-11-30 11:46:19.976335,0 days 00:01:20.386176,0.5370226690412615,dart,0.8995199336598738,7.699671862500889,lossguide,0.01394915530455735,0.002003556514071346,2,12,49.27518845685146,800,forest,0.5795731184711215,0.6239983700891951,0.020825325212148384,none,0.5317768874180793,3.1758748193980817,10.0,0.6404816551667546,0.20151300120214433,uniform,0.6707096640289162,0.43085596612135646,,0.5567616463138851,0.5572139303482587,0.715281812899477,0.7156549520766773,0.5795731184711215,0.6239983700891951,0.08,0.39563325434250585,0.39844370245986976,0.5567616463138851,0.5572139303482587,1.0,1.0,none,0.2033173626883735,0.20896538344189008,0.5317768874180793,0.5,COMPLETE
2083,0.0,2025-11-30 11:46:20.748892,2025-11-30 11:47:02.381765,0 days 00:00:41.632873,0.0010907070633969166,dart,0.8538712891692972,7.1505259746516705,lossguide,0.032259324598661675,0.00015224403084946234,8,12,0.7562505353207543,600,tree,0.679497639169816,0.8559819293583624,0.09195074069058207,none,0.8470789256845628,0.6906945390061935,7.0,0.9231568576455479,0.2048631028153718,weighted,0.3361599127401153,0.28576859634283686,,0.44323835368611486,0.4427860696517413,0.0,0.0,0.679497639169816,0.8559819293583624,0.1,0.4721587492730669,0.4644565249761763,0.0,0.0,0.0,0.0,none,0.3739887100250336,0.35600823461523157,0.8470789256845628,0.5,COMPLETE
2084,0.4666073018699911,2025-11-30 11:47:03.124981,2025-11-30 11:49:13.039699,0 days 00:02:09.914718,0.001297500055624896,dart,0.46101570611949794,4.918922317083445,lossguide,24.76090724949146,0.0008919221690614458,4,4,41.75134608001761,1000,forest,0.5707532428109501,0.8061618279965341,0.07955903685432131,undersample,0.889589716650917,,8.0,0.7544625145631437,0.1786734398389772,uniform,0.8234736932840567,0.6261348699770886,,0.42469470827679784,0.45816372682044326,0.4306177260519248,0.4666073018699911,0.5707532428109501,0.8061618279965341,0.08,0.5095283760800693,0.5289775493404422,0.4795613160518445,0.5167652859960552,0.39073923639317626,0.4253246753246753,undersample,0.4108266052156037,0.4382217310268893,0.889589716650917,0.5,COMPLETE
2085,0.7176609568812758,2025-11-30 11:49:13.821334,2025-11-30 11:50:17.549563,0 days 00:01:03.728229,7.328780098114473,dart,0.3691638366259309,4.0142794930551995,lossguide,0.031633740047206454,0.160777333509946,10,7,7.641951350340607,700,tree,0.8786820716188544,0.420201306503001,0.009645086069738419,none,0.9902428317345033,1.0997966208319891,9.0,0.8300616208159997,0.06006009108173799,uniform,0.3010263673465034,0.4785535541972161,,0.5639981908638625,0.5676164631388512,0.714792899408284,0.7176609568812758,0.8786820716188544,0.420201306503001,0.08,0.5935182646391756,0.574484352445866,0.5621219171707771,0.564066852367688,0.9813160032493907,0.9862012987012987,none,0.568894958470797,0.5479816404229071,0.9902428317345033,0.5,COMPLETE
2086,0.7156549520766773,2025-11-30 11:50:18.341656,2025-11-30 11:51:00.575612,0 days 00:00:42.233956,26.236015639072303,dart,0.466457627579455,7.731100525054192,lossguide,0.0020008821070452995,0.048291949585923054,9,11,0.1305183990867426,600,forest,0.6679887711701276,0.7094398912500925,0.07057100439896077,oversample,0.534425982246687,,6.0,0.8853197883600097,0.14909367983153204,weighted,0.13584140757993743,0.2343393524870656,,0.5567616463138851,0.5572139303482587,0.715281812899477,0.7156549520766773,0.6679887711701276,0.7094398912500925,0.08,0.5567616463138851,0.5572139303482587,0.5567616463138851,0.5572139303482587,1.0,1.0,oversample,0.5,0.5,0.534425982246687,0.5,COMPLETE
2087,0.7156549520766773,2025-11-30 11:51:01.379861,2025-11-30 11:51:01.887769,0 days 00:00:00.507908,21.7113812154315,gbtree,0.698315225748602,5.221758690021191,lossguide,13.232327885463295,0.001896771690757418,3,4,2.755387370527037,400,,0.8674068873152805,0.3235495722223421,0.0482584241712101,oversample,0.6582503727268032,,9.0,0.9287063181805796,,,,0.3760830886247251,,0.5567616463138851,0.5572139303482587,0.715281812899477,0.7156549520766773,0.8674068873152805,0.3235495722223421,0.08,0.6330918551116838,0.612964570625733,0.5567616463138851,0.5572139303482587,1.0,1.0,oversample,0.6304365125416536,0.5992904567342769,0.6582503727268032,0.5,COMPLETE
2088,0.20777891504605936,2025-11-30 11:51:02.655453,2025-11-30 11:51:03.291995,0 days 00:00:00.636542,2.206217834580685,gbtree,0.9378388029339582,9.217190668708334,lossguide,6.785519977801067,0.0013339171765349898,9,5,5.931931707708352,600,,0.7534314792436567,0.7157972131765498,0.07712254629659103,undersample,0.6069176734007933,,9.0,0.6341867286067034,,,,0.6473390256813618,,0.29534147444595205,0.29986431478968795,0.21392532795156408,0.20777891504605936,0.7534314792436567,0.7157972131765498,0.08,0.4562621862950352,0.4592376360719792,0.2822902796271638,0.28116343490304707,0.17221770917952883,0.16477272727272727,undersample,0.26057461164807105,0.2569743841449663,0.6069176734007933,0.5,COMPLETE
2089,0.7156549520766773,2025-11-30 11:51:04.055885,2025-11-30 11:51:04.796558,0 days 00:00:00.740673,18.92905347583455,gbtree,0.22452883866057435,7.087703909410487,lossguide,0.00018359150928781495,0.00010894951677731856,6,8,2.6759536548929748,800,,0.6218389376406162,0.6120473002043906,0.02875445022805615,none,0.5537362838844022,1.5432228309175438,6.0,0.8636340418572619,,,,0.6160651333085385,,0.5567616463138851,0.5572139303482587,0.715281812899477,0.7156549520766773,0.6218389376406162,0.6120473002043906,0.08,0.5917580172915486,0.585267357262358,0.5567616463138851,0.5572139303482587,1.0,1.0,none,0.5655610172582437,0.553256785349482,0.5537362838844022,0.5,COMPLETE
2090,0.7156549520766773,2025-11-30 11:51:05.591844,2025-11-30 11:53:02.500874,0 days 00:01:56.909030,0.000597220306749746,dart,0.2544744793936853,1.8534858697938283,lossguide,94.38256107301632,0.13740537011509105,7,10,2.9597820042900405,1000,tree,0.9266229880792565,0.5327273475484577,0.0626706475959105,none,0.6583653332767281,2.244370745342649,7.0,0.9392220551011898,0.17499642181508446,uniform,0.2289441610058619,0.5771658554834123,,0.5567616463138851,0.5572139303482587,0.715281812899477,0.7156549520766773,0.9266229880792565,0.5327273475484577,0.08,0.46040670814172,0.49045982342463723,0.5567616463138851,0.5572139303482587,1.0,1.0,none,0.34260266251098326,0.3701108008436915,0.6583653332767281,0.5,COMPLETE
2091,0.42864007688611244,2025-11-30 11:53:03.286588,2025-11-30 11:53:24.320486,0 days 00:00:21.033898,0.22300131290951122,dart,0.5349094908560212,7.912274310191123,lossguide,1.9537073580810582,0.0007261379457072568,5,11,0.8548455492323593,400,tree,0.6323247990014002,0.8825662761484325,0.027832529832011434,undersample,0.9708338976948783,,9.0,0.8238119710659035,0.04164548985949962,uniform,0.0459679321523311,0.7639584495382077,,0.4522840343735866,0.4622342831298055,0.410705596107056,0.42864007688611244,0.6323247990014002,0.8825662761484325,0.08,0.5744849940878125,0.5966096801065648,0.5121359223300971,0.525323910482921,0.3428107229894395,0.362012987012987,undersample,0.4807805169183839,0.4826792844540546,0.9708338976948783,0.5,COMPLETE
