number,value,datetime_start,datetime_complete,duration,params_alpha,params_booster,params_colsample_bytree,params_gamma,params_grow_policy,params_lambda,params_learning_rate,params_max_delta_step,params_max_depth,params_min_child_weight,params_n_estimators,params_normalize_type,params_params_feature_fraction,params_params_labeled_ratio,params_params_missing_rate,params_params_resampling,params_params_sample_rows,params_params_scale_pos_weight,params_params_selftrain_max_iter,params_params_selftrain_threshold,params_rate_drop,params_sample_type,params_skip_drop,params_subsample,params_user_attrs_decision_threshold,user_attrs_acc_test,user_attrs_acc_val,user_attrs_f1_test,user_attrs_f1_val,user_attrs_feature_fraction,user_attrs_labeled_ratio,user_attrs_missing_rate,user_attrs_pr_auc_test,user_attrs_pr_auc_val,user_attrs_prec_test,user_attrs_prec_val,user_attrs_rec_test,user_attrs_rec_val,user_attrs_resampling_strategy,user_attrs_roc_auc_test,user_attrs_roc_auc_val,user_attrs_sample_rows,user_attrs_user_attrs_decision_threshold,state
2541,0.7156549520766773,2025-11-30 15:10:42.925866,2025-11-30 15:12:10.441710,0 days 00:01:27.515844,12.288772441941806,dart,0.4610058731394993,0.940438579362507,lossguide,0.006073430648179664,0.0019055789621090055,10,8,25.28683970983014,800,forest,0.7984097635508034,0.8137010362293777,0.012251754577234809,none,0.885230145549895,3.440492643200025,10.0,0.6431817335419903,0.03963930741715427,uniform,0.8536227886815224,0.48992441902268064,,0.5567616463138851,0.5572139303482587,0.715281812899477,0.7156549520766773,0.7984097635508034,0.8137010362293777,0.08,0.465832302119429,0.47164910952490446,0.5567616463138851,0.5572139303482587,1.0,1.0,none,0.36389404665196706,0.38494877823912554,0.885230145549895,0.5,COMPLETE
2542,0.46296296296296297,2025-11-30 15:12:11.222393,2025-11-30 15:12:52.682263,0 days 00:00:41.459870,0.01583685916038292,dart,0.48416381056085056,6.861235921996194,lossguide,46.232398495115355,0.007581438235811455,3,5,2.7010260490481413,600,tree,0.543419305983732,0.5209573802184069,0.028327157889053947,undersample,0.9948450295953406,,12.0,0.7188683457778785,0.466190950560621,weighted,0.6918049325609501,0.6566437951448774,,0.4251469923111714,0.4491180461329715,0.43435692033822876,0.46296296296296297,0.543419305983732,0.5209573802184069,0.08,0.531811972858052,0.542996421346344,0.48031496062992124,0.5067567567567568,0.39642567018683994,0.42613636363636365,undersample,0.45305127737528805,0.46713242707241687,0.9948450295953406,0.5,COMPLETE
2543,0.7156549520766773,2025-11-30 15:12:53.469895,2025-11-30 15:12:54.237424,0 days 00:00:00.767529,11.413822913174325,gbtree,0.23851903108639094,2.7163157576691677,lossguide,0.015623405189270795,0.000715381944688565,0,8,18.596419934967283,800,,0.8651347716849966,0.8580298039307526,0.09927985609496327,oversample,0.9978565241896572,,12.0,0.6760349395393208,,,,0.4920383953234378,,0.5567616463138851,0.5572139303482587,0.715281812899477,0.7156549520766773,0.8651347716849966,0.8580298039307526,0.1,0.4990677745231567,0.4833396446565801,0.5567616463138851,0.5572139303482587,1.0,1.0,oversample,0.41167169548566795,0.3919890757863178,0.9978565241896572,0.5,COMPLETE
2544,0.31085604973696795,2025-11-30 15:12:55.024403,2025-11-30 15:12:55.689915,0 days 00:00:00.665512,0.005270331408232434,gbtree,0.3081252094321274,6.583213051797815,lossguide,15.321084812254423,0.0023562701290800927,2,5,44.988318777218964,700,,0.8722363616130151,0.8193448975456128,0.07781666863089062,undersample,0.8392921851939827,,12.0,0.8236641538783176,,,,0.2586964001253165,,0.3672546359113523,0.3482587064676617,0.32120329936923825,0.31085604973696795,0.8722363616130151,0.8193448975456128,0.08,0.450275520807408,0.44199499531236497,0.39879518072289155,0.37834691501746215,0.2688870836718115,0.2637987012987013,undersample,0.33445058770868213,0.3190859510765026,0.8392921851939827,0.5,COMPLETE
2545,0.6290894757587702,2025-11-30 15:12:56.473812,2025-11-30 15:13:37.868302,0 days 00:00:41.394490,0.02859432258178495,dart,0.3239329608391115,0.4760201384429008,depthwise,0.19097329891888365,0.061796498394770034,8,8,98.85960707337152,600,forest,0.9598180669742791,0.3581450204337243,0.08384347042454483,undersample,0.8748622379098372,,5.0,0.8749350516238448,0.44637409857667076,uniform,0.6718594658822332,0.943560940154359,,0.592944369063772,0.574400723654455,0.6473354231974922,0.6290894757587702,0.9598180669742791,0.3581450204337243,0.08,0.6536587556996298,0.633764424225054,0.6252838758516276,0.6114942528735632,0.6709991876523151,0.6477272727272727,undersample,0.6124106832009814,0.5941284838756749,0.8748622379098372,0.5,COMPLETE
2546,0.6704545454545454,2025-11-30 15:13:38.654802,2025-11-30 15:15:29.347921,0 days 00:01:50.693119,0.06817866992020205,dart,0.8996696862100495,6.222537878853479,lossguide,0.15863499265919223,0.00045207752994116783,4,8,0.16815269192670798,1000,tree,0.5581142328549643,0.7417208807525557,0.04117955765386301,undersample,0.6573202951149748,,7.0,0.7614718241752382,0.30817028329722945,uniform,0.4314799378944204,0.28185783944780085,,0.6187245590230664,0.6065128900949797,0.6808027262400606,0.6704545454545454,0.5581142328549643,0.7417208807525557,0.08,0.6197780873822394,0.6289746458257418,0.6375886524822695,0.6285511363636364,0.7303005686433793,0.7183441558441559,undersample,0.6209523533215073,0.6154056617539764,0.6573202951149748,0.5,COMPLETE
2547,0.2046783625730994,2025-11-30 15:15:30.116623,2025-11-30 15:15:30.622809,0 days 00:00:00.506186,0.14906076014827277,gbtree,0.3272055268928675,9.900196236907217,lossguide,4.105660266612227,0.004928021075544905,1,4,3.8347604350744597,400,,0.9188923267324236,0.21324616607906172,0.0639117153489668,undersample,0.9499570252173843,,9.0,0.7382794954314233,,,,0.4994626022169058,,0.40117593848937133,0.38489371325192223,0.22300469483568075,0.2046783625730994,0.9188923267324236,0.21324616607906172,0.08,0.5009135586233616,0.4967325887811145,0.40169133192389006,0.36610878661087864,0.15434606011372867,0.14204545454545456,undersample,0.388822758997994,0.3838199594072934,0.9499570252173843,0.5,COMPLETE
2548,0.7156549520766773,2025-11-30 15:15:31.402728,2025-11-30 15:17:20.785835,0 days 00:01:49.383107,0.011901597464507203,dart,0.8708307610992729,7.933560795874285,lossguide,0.03145297593002462,0.00010818405366491072,1,3,13.328628278417925,1000,forest,0.5389364035015556,0.8287329570949682,0.044303062570291186,oversample,0.7587628632392744,,11.0,0.738028452463976,0.4104001011092931,uniform,0.4873181878631943,0.48130805908385155,,0.5567616463138851,0.5572139303482587,0.715281812899477,0.7156549520766773,0.5389364035015556,0.8287329570949682,0.08,0.5213682406900904,0.5155975134958297,0.5567616463138851,0.5572139303482587,1.0,1.0,oversample,0.4259889089673237,0.4164533117546397,0.7587628632392744,0.5,COMPLETE
2549,0.49321068769163384,2025-11-30 15:17:21.565569,2025-11-30 15:17:43.630895,0 days 00:00:22.065326,0.0024769141072101823,dart,0.2059311339256402,6.714563744966587,depthwise,0.3906222215324645,0.07491941053686366,1,3,5.900596751785421,400,tree,0.664076520750529,0.2798457349696051,0.0004212479120345614,undersample,0.8094413190157568,,8.0,0.7751401331100894,0.00021178503007185379,uniform,0.7066688424980296,0.4632836480546006,,0.4943464495703302,0.4767073722297603,0.516017316017316,0.49321068769163384,0.664076520750529,0.2798457349696051,0.08,0.5410708831948827,0.5277555362500448,0.5523632993512512,0.5356803044719315,0.4841592201462226,0.4569805194805195,undersample,0.47594539034135186,0.46023141822426805,0.8094413190157568,0.5,COMPLETE
2550,0.7156549520766773,2025-11-30 15:17:44.406458,2025-11-30 15:19:03.007309,0 days 00:01:18.600851,0.0006824489737969399,dart,0.9339830981310688,9.45688972412858,depthwise,0.0671434238941158,0.0009201966078235375,8,7,3.0154351137712507,800,forest,0.88790112053411,0.2990047771565224,0.07169418487551793,oversample,0.9615406278159045,,12.0,0.9158818281113847,0.16255058959523672,uniform,0.49296591431459125,0.8587611960691481,,0.5567616463138851,0.5572139303482587,0.715281812899477,0.7156549520766773,0.88790112053411,0.2990047771565224,0.08,0.4599649669099654,0.45937794244543195,0.5567616463138851,0.5572139303482587,1.0,1.0,oversample,0.30583771282680416,0.3077434567475425,0.9615406278159045,0.5,COMPLETE
2551,0.7156549520766773,2025-11-30 15:19:03.784957,2025-11-30 15:19:04.972825,0 days 00:00:01.187868,0.3817951321953402,gbtree,0.8636397364991071,1.8290321375644658,lossguide,48.772062052557345,0.29728983893646793,6,3,0.7128375459199442,500,,0.5217515504418506,0.767096026112966,0.05420635621847273,none,0.698737653204332,1.7560521576750772,5.0,0.7373232567099798,,,,0.9639219524145153,,0.5567616463138851,0.5572139303482587,0.715281812899477,0.7156549520766773,0.5217515504418506,0.767096026112966,0.08,0.5968748505906494,0.5965165579327749,0.5567616463138851,0.5572139303482587,1.0,1.0,none,0.5499917107379102,0.546408424313174,0.698737653204332,0.5,COMPLETE
2552,0.49025069637883006,2025-11-30 15:19:05.759086,2025-11-30 15:19:07.423611,0 days 00:00:01.664525,0.03305983819964183,gbtree,0.5579434762405415,0.6049778785416948,depthwise,0.07866192550901985,0.28416875415781573,2,10,0.12699106559088771,300,,0.7462596207221339,0.5547976170906727,0.04552643711126565,undersample,0.8447830371396257,,10.0,0.6239000607624225,,,,0.9707259806030393,,0.5332428765264586,0.5033921302578019,0.5359712230215827,0.49025069637883006,0.7462596207221339,0.5547976170906727,0.08,0.5660430398134162,0.5461155666974089,0.6002014098690835,0.5726681127982647,0.4841592201462226,0.42857142857142855,undersample,0.5276600242046453,0.5040057937466007,0.8447830371396257,0.5,COMPLETE
2553,0.2962226640159046,2025-11-30 15:19:08.190467,2025-11-30 15:20:44.769929,0 days 00:01:36.579462,0.014273568694209378,dart,0.4738231135859316,5.410710072637177,lossguide,41.58218397012222,0.031041959837463714,10,5,4.706953241320136,900,tree,0.7495872492364866,0.4495056986152349,0.06528508505036688,undersample,0.5866509377441291,,9.0,0.7494916238694173,0.40639528150281556,uniform,0.7144313773373162,0.25466395281564397,,0.3722297602894618,0.35956580732700133,0.3301158301158301,0.2962226640159046,0.7495872492364866,0.4495056986152349,0.08,0.45487660471122693,0.4496239420895,0.40665873959571935,0.382051282051282,0.2778229082047116,0.2418831168831169,undersample,0.33253784048144036,0.32140535664539754,0.5866509377441291,0.5,COMPLETE
2554,0.7156549520766773,2025-11-30 15:20:45.545339,2025-11-30 15:21:07.432828,0 days 00:00:21.887489,7.494581077413415,dart,0.48932939335683207,8.383494958466146,depthwise,0.09044055629263746,0.05518517655789892,10,11,0.36114451264619374,400,tree,0.594062664836269,0.2634172289805707,0.026155635250925027,oversample,0.5446102748292614,,10.0,0.7385523850180746,0.048083542249037436,uniform,0.7555881751497443,0.785267704262367,,0.5567616463138851,0.5572139303482587,0.715281812899477,0.7156549520766773,0.594062664836269,0.2634172289805707,0.08,0.5559084649347904,0.5589700773529239,0.5567616463138851,0.5572139303482587,1.0,1.0,oversample,0.42734834795006543,0.42572761763262273,0.5446102748292614,0.5,COMPLETE
2555,0.7156549520766773,2025-11-30 15:21:08.214834,2025-11-30 15:21:08.787769,0 days 00:00:00.572935,0.048945750019627345,gbtree,0.790374283140804,5.55297151686278,lossguide,1.6254008039029706,0.002307316724834469,9,3,0.9438860150060945,400,,0.9208074842795826,0.6564435355830365,0.0030863860986016568,none,0.7045588700328156,1.0999595362995485,6.0,0.7025558465397845,,,,0.20105521986670727,,0.5567616463138851,0.5572139303482587,0.715281812899477,0.7156549520766773,0.9208074842795826,0.6564435355830365,0.08,0.5371661532614557,0.5513373586547365,0.5567616463138851,0.5572139303482587,1.0,1.0,none,0.47951225981863094,0.4894198625684836,0.7045588700328156,0.5,COMPLETE
2556,0.7181933842239185,2025-11-30 15:21:09.562525,2025-11-30 15:21:15.527830,0 days 00:00:05.965305,0.005619530002930792,dart,0.7555952598991877,0.534079130750873,depthwise,0.001459402774105605,0.015387759206135426,5,4,0.2396164596726093,200,forest,0.6987680378425425,0.8645018549803996,0.04221708271961139,oversample,0.529157889512615,,11.0,0.889783218316387,0.03227219494355782,weighted,0.4099965491305145,0.52110919885394,,0.5920398009950248,0.5992763455450023,0.7154574132492113,0.7181933842239185,0.6987680378425425,0.8645018549803996,0.08,0.57040265159502,0.5619658229952509,0.5848375451263538,0.5904811715481172,0.9212022745735174,0.9163961038961039,oversample,0.5677696911420946,0.5618466696735338,0.529157889512615,0.5,COMPLETE
2557,0.5119266055045871,2025-11-30 15:21:16.320388,2025-11-30 15:21:49.050404,0 days 00:00:32.730016,0.0011206923434516562,dart,0.5988361729870617,4.12537787465973,lossguide,0.00016866237620094177,0.0001889885947449855,2,4,0.11954624256078085,500,tree,0.6553172412530568,0.4327175295322337,0.07710950265895819,undersample,0.7903403007259198,,9.0,0.8270088166219312,0.2475075782100753,uniform,0.7585816137187896,0.9369811700371948,,0.5282677521483492,0.5187697874265038,0.5341670388566324,0.5119266055045871,0.6553172412530568,0.4327175295322337,0.08,0.5865631018129421,0.5814440061417075,0.5932539682539683,0.5886075949367089,0.48578391551584077,0.45292207792207795,undersample,0.5352293638820272,0.5361731922316704,0.7903403007259198,0.5,COMPLETE
2558,0.34023991275899673,2025-11-30 15:21:49.840574,2025-11-30 15:21:50.520673,0 days 00:00:00.680099,0.00011860718258085827,gbtree,0.34940802339835,4.244790662040633,lossguide,61.65947439973934,0.011062781186092229,0,9,10.789651812706957,700,,0.6961886119103717,0.7193773656460907,0.012850106063604538,undersample,0.5509885248054156,,7.0,0.8976370042604633,,,,0.32257618966437307,,0.4522840343735866,0.4527363184079602,0.324595649749024,0.34023991275899673,0.6961886119103717,0.7193773656460907,0.08,0.5547939882581128,0.5484840790337727,0.5177935943060499,0.5182724252491694,0.23639317627944761,0.2532467532467532,undersample,0.5066256071884481,0.505064139129512,0.5509885248054156,0.5,COMPLETE
2559,0.7156549520766773,2025-11-30 15:21:51.333693,2025-11-30 15:22:12.844805,0 days 00:00:21.511112,81.47341196837715,dart,0.9302837540920308,9.10593725948175,lossguide,0.00027584900289828463,0.006096111246090386,2,3,1.406381534474167,500,forest,0.8374320160442592,0.6850006046335126,0.08395344447986333,undersample,0.5115177500339352,,7.0,0.9226182073994693,0.3796248350769899,uniform,0.026078329792215017,0.7519569080309179,,0.5567616463138851,0.5572139303482587,0.715281812899477,0.7156549520766773,0.8374320160442592,0.6850006046335126,0.08,0.5567616463138851,0.5572139303482587,0.5567616463138851,0.5572139303482587,1.0,1.0,undersample,0.5,0.5,0.5115177500339352,0.5,COMPLETE
2560,0.7156549520766773,2025-11-30 15:22:13.629639,2025-11-30 15:22:49.709260,0 days 00:00:36.079621,2.581958659283874,dart,0.4463733720135287,5.092437681267846,depthwise,0.007894497162922787,0.20371646516345399,3,7,25.685501959963165,600,forest,0.6478582805985513,0.40707051993600196,0.06286820299884684,none,0.9382891928027853,3.797181644173956,11.0,0.6284776066896526,0.3069496994207338,uniform,0.12696912082454354,0.8781006366641002,,0.5567616463138851,0.5572139303482587,0.715281812899477,0.7156549520766773,0.6478582805985513,0.40707051993600196,0.08,0.5753477450278484,0.5691337172605728,0.5567616463138851,0.5572139303482587,1.0,1.0,none,0.536369966345596,0.5287117121897509,0.9382891928027853,0.5,COMPLETE
2561,0.0,2025-11-30 15:22:50.478650,2025-11-30 15:22:51.305127,0 days 00:00:00.826477,59.26831314410409,gbtree,0.8871456740224877,3.7695149552615903,depthwise,0.005055857476682492,0.004821636018715708,4,11,14.26007210746252,900,,0.6713617405726618,0.7009434246959154,0.019942495454722254,none,0.9203512890656202,0.6845051821040709,8.0,0.7319063974498327,,,,0.537613498322223,,0.44323835368611486,0.4427860696517413,0.0,0.0,0.6713617405726618,0.7009434246959154,0.08,0.5567616463138851,0.5572139303482587,0.0,0.0,0.0,0.0,none,0.5,0.5,0.9203512890656202,0.5,COMPLETE
2562,0.48662420382165605,2025-11-30 15:22:52.074384,2025-11-30 15:23:28.448692,0 days 00:00:36.374308,1.2787525114661065,dart,0.7447914659138044,7.616397318013699,depthwise,0.1597623332070966,0.3181245915774419,6,3,0.7325273955651195,300,tree,0.6560515415506337,0.48045071467806927,0.03488737826768915,undersample,0.876578409362307,,5.0,0.6264736162729638,0.018539133298618338,weighted,0.44407387736497234,0.23681145853290053,,0.43283582089552236,0.4531886024423338,0.4585492227979275,0.48662420382165605,0.6560515415506337,0.48045071467806927,0.08,0.4780534990958836,0.4814956475210637,0.4894009216589862,0.5102404274265361,0.43135662063363117,0.4650974025974026,undersample,0.39853984648286606,0.4147519997877505,0.876578409362307,0.5,COMPLETE
2563,0.527648796960743,2025-11-30 15:23:29.224008,2025-11-30 15:25:03.121517,0 days 00:01:33.897509,0.0036829133594853264,dart,0.2946744281075919,1.1232001213680753,lossguide,0.0003417143285862871,0.0028095418132025496,2,11,7.127390300522288,1000,tree,0.6271953070388611,0.7906000125020773,0.016434037729669282,undersample,0.882130496174298,,6.0,0.6197929521208011,0.37936397564753255,uniform,0.0535484638824927,0.7340654149041888,,0.5033921302578019,0.49389416553595655,0.5355329949238579,0.527648796960743,0.6271953070388611,0.7906000125020773,0.08,0.5387988646976247,0.5290737048572787,0.558693733451015,0.5496921723834652,0.5142160844841592,0.5073051948051948,undersample,0.4965947711334737,0.487724354297388,0.882130496174298,0.5,COMPLETE
2564,0.7156549520766773,2025-11-30 15:25:03.891796,2025-11-30 15:25:04.579916,0 days 00:00:00.688120,36.6257560042019,gbtree,0.8043065546924875,2.413687344562624,depthwise,3.4945874027171246,0.19994896438734572,5,12,9.620763417877306,700,,0.5346108672453869,0.36643831641692126,0.09282778334328823,none,0.7616241528508023,1.75930269943702,5.0,0.899889520490812,,,,0.7388611397117246,,0.5567616463138851,0.5572139303482587,0.715281812899477,0.7156549520766773,0.5346108672453869,0.36643831641692126,0.1,0.5677150008048055,0.5523835163275059,0.5567616463138851,0.5572139303482587,1.0,1.0,none,0.5258156633896451,0.4973452237241818,0.7616241528508023,0.5,COMPLETE
2565,0.7156549520766773,2025-11-30 15:25:05.356108,2025-11-30 15:25:06.905203,0 days 00:00:01.549095,0.00013504319239132848,gbtree,0.3961720224176053,0.30374846635656816,lossguide,0.1248148634098503,0.015253296291909375,4,4,4.094263597623347,200,,0.6893578297237843,0.826742738671667,0.026882104318721834,none,0.6236762875028614,1.628959206969139,6.0,0.6795162909336422,,,,0.4328515766350082,,0.5567616463138851,0.5572139303482587,0.715281812899477,0.7156549520766773,0.6893578297237843,0.826742738671667,0.08,0.5234818077198381,0.5231643227906929,0.5567616463138851,0.5572139303482587,1.0,1.0,none,0.45514017142194,0.45127175556823157,0.6236762875028614,0.5,COMPLETE
2566,0.0,2025-11-30 15:25:07.672930,2025-11-30 15:25:08.060119,0 days 00:00:00.387189,14.494878399116802,gbtree,0.4328120292280982,8.341315892525275,depthwise,52.651339290213606,0.21182341727228968,5,7,0.34323971805689696,200,,0.5063935470522403,0.4471647424520927,0.049662446649844205,none,0.9138156884160279,0.6699953677283617,7.0,0.8877194594885636,,,,0.8229127320228213,,0.44323835368611486,0.4427860696517413,0.0,0.0,0.5063935470522403,0.4471647424520927,0.08,0.5567616463138851,0.5572139303482587,0.0,0.0,0.0,0.0,none,0.5,0.5,0.9138156884160279,0.5,COMPLETE
2567,0.7156549520766773,2025-11-30 15:25:08.833254,2025-11-30 15:25:09.399524,0 days 00:00:00.566270,3.092868171155623,gbtree,0.47248375568497547,4.65092540114505,depthwise,71.9071652915692,0.042121246594810924,5,3,5.046908938125063,500,,0.5105763612538597,0.624057047291983,0.06590767091865234,oversample,0.7788732216958335,,11.0,0.610861779225158,,,,0.4760013633164123,,0.5567616463138851,0.5572139303482587,0.715281812899477,0.7156549520766773,0.5105763612538597,0.624057047291983,0.08,0.5322185805509096,0.5296040306244688,0.5567616463138851,0.5572139303482587,1.0,1.0,oversample,0.4674385351216035,0.46149289295995116,0.7788732216958335,0.5,COMPLETE
2568,0.7156549520766773,2025-11-30 15:25:10.184013,2025-11-30 15:25:15.165350,0 days 00:00:04.981337,0.05214864003336684,dart,0.8275585252779571,7.507774612344408,depthwise,0.1550235833190012,0.010712487823490676,5,9,0.13177768365259124,200,tree,0.8575218588899255,0.2952083084539725,0.03117252898068661,oversample,0.5307752870482487,,8.0,0.6852985294787802,0.18442300526645622,uniform,0.28663951494655043,0.9149533902949716,,0.5567616463138851,0.5572139303482587,0.715281812899477,0.7156549520766773,0.8575218588899255,0.2952083084539725,0.08,0.5658480618990822,0.5769476376921164,0.5567616463138851,0.5572139303482587,1.0,1.0,oversample,0.5180714202821665,0.5384639938712973,0.5307752870482487,0.5,COMPLETE
2569,0.7156549520766773,2025-11-30 15:25:15.941899,2025-11-30 15:25:34.368211,0 days 00:00:18.426312,0.154678572389506,dart,0.2872984513790452,7.047807626020539,depthwise,0.0012064514168870376,0.00823792823206254,8,10,6.270746044758119,400,tree,0.9252770603159486,0.566661097638858,0.05470827239496151,none,0.7970597341865209,2.684834304931111,7.0,0.8145985635331657,0.3615294465255787,uniform,0.5356299483681286,0.4022717530248991,,0.5567616463138851,0.5572139303482587,0.715281812899477,0.7156549520766773,0.9252770603159486,0.566661097638858,0.08,0.668649679809992,0.6555749783152467,0.5567616463138851,0.5572139303482587,1.0,1.0,none,0.5991437192261144,0.5776132383959248,0.7970597341865209,0.5,COMPLETE
2570,0.7156549520766773,2025-11-30 15:25:35.154161,2025-11-30 15:25:44.812243,0 days 00:00:09.658082,55.73126414032042,dart,0.6646157048029866,4.795780922336263,depthwise,0.0005156961703527864,0.00048674876000799795,1,3,31.870148833377495,300,tree,0.6636025736294063,0.7672860734372653,0.06247817020201869,oversample,0.51859796280182,,9.0,0.7241183977114749,0.46039955248811154,weighted,0.11098185629452063,0.3092051693085447,,0.5567616463138851,0.5572139303482587,0.715281812899477,0.7156549520766773,0.6636025736294063,0.7672860734372653,0.08,0.5567616463138851,0.5572139303482587,0.5567616463138851,0.5572139303482587,1.0,1.0,oversample,0.5,0.5,0.51859796280182,0.5,COMPLETE
