number,value,datetime_start,datetime_complete,duration,params_alpha,params_booster,params_colsample_bytree,params_gamma,params_grow_policy,params_lambda,params_learning_rate,params_max_delta_step,params_max_depth,params_min_child_weight,params_n_estimators,params_normalize_type,params_params_feature_fraction,params_params_labeled_ratio,params_params_missing_rate,params_params_resampling,params_params_sample_rows,params_params_scale_pos_weight,params_params_selftrain_max_iter,params_params_selftrain_threshold,params_rate_drop,params_sample_type,params_skip_drop,params_subsample,params_user_attrs_decision_threshold,user_attrs_acc_test,user_attrs_acc_val,user_attrs_f1_test,user_attrs_f1_val,user_attrs_feature_fraction,user_attrs_labeled_ratio,user_attrs_missing_rate,user_attrs_pr_auc_test,user_attrs_pr_auc_val,user_attrs_prec_test,user_attrs_prec_val,user_attrs_rec_test,user_attrs_rec_val,user_attrs_resampling_strategy,user_attrs_roc_auc_test,user_attrs_roc_auc_val,user_attrs_sample_rows,user_attrs_user_attrs_decision_threshold,state
2182,0.2871912693854107,2025-11-30 12:36:24.614852,2025-11-30 12:36:56.237136,0 days 00:00:31.622284,0.3868354279044417,dart,0.8675987455788141,7.558082877570287,depthwise,0.0022597724757873554,0.001545224906183851,3,5,0.10193254553646897,600,forest,0.7325947752357778,0.5456418443894246,0.07619133153738572,undersample,0.8944974540268633,,12.0,0.6829185788285999,0.4602435594186359,uniform,0.23635279624017222,0.2200876305417145,,0.4495703301673451,0.438715513342379,0.3033772180881511,0.2871912693854107,0.7325947752357778,0.5456418443894246,0.08,0.5182594684387077,0.5163956314256524,0.5135658914728682,0.4911591355599214,0.21527213647441104,0.20292207792207792,undersample,0.4443454798653824,0.4319214046933658,0.8944974540268633,0.5,COMPLETE
2183,0.5858156028368794,2025-11-30 12:36:57.020614,2025-11-30 12:37:03.110404,0 days 00:00:06.089790,0.000624001832312612,gbtree,0.825378469304602,0.13781904624582508,depthwise,71.51715004284408,0.06963494881903591,3,11,1.9112628810015337,400,,0.823219446198624,0.3302649119163715,0.03776908204064149,oversample,0.6159570217070847,,9.0,0.613084648860026,,,,0.8811381412737915,,0.4762550881953867,0.47173224785165085,0.5976372480889507,0.5858156028368794,0.823219446198624,0.3302649119163715,0.08,0.5075518927460765,0.5009868827230766,0.5221615057680632,0.5201511335012594,0.6986190089358245,0.6704545454545454,oversample,0.4268559657819262,0.4201303675895096,0.6159570217070847,0.5,COMPLETE
2184,0.7156549520766773,2025-11-30 12:37:03.898625,2025-11-30 12:37:04.476258,0 days 00:00:00.577633,0.8897079641976331,gbtree,0.38925136889058004,9.713928217354079,lossguide,0.00018939059254584497,0.02193519065547663,5,8,2.6911092723632963,500,,0.708233184948723,0.7851751986002862,0.05891236204917122,none,0.996088753348941,2.4176256187417158,10.0,0.7501143323947813,,,,0.9276463214302606,,0.5567616463138851,0.5572139303482587,0.715281812899477,0.7156549520766773,0.708233184948723,0.7851751986002862,0.08,0.5671159133943393,0.5630744128006648,0.5567616463138851,0.5572139303482587,1.0,1.0,none,0.5189600291782025,0.5111219538888078,0.996088753348941,0.5,COMPLETE
2185,0.7156549520766773,2025-11-30 12:37:05.332177,2025-11-30 12:37:06.421450,0 days 00:00:01.089273,0.03439950222405912,gbtree,0.3264183890330238,3.3565001754871835,lossguide,0.056636798004384,0.0002679402574303701,9,10,4.849917749782427,800,,0.8237762162966763,0.5941166857006163,0.04316172502868561,none,0.5122613246314665,2.6693757567735794,11.0,0.6600742858198633,,,,0.2838195233993509,,0.5567616463138851,0.5572139303482587,0.715281812899477,0.7156549520766773,0.8237762162966763,0.5941166857006163,0.08,0.5169944223598488,0.5102082916030753,0.5567616463138851,0.5572139303482587,1.0,1.0,none,0.45242419469818795,0.443245244285847,0.5122613246314665,0.5,COMPLETE
2186,0.7156549520766773,2025-11-30 12:37:07.238593,2025-11-30 12:37:08.302283,0 days 00:00:01.063690,1.507322429447836,gbtree,0.46026116277912393,3.2497210636760143,lossguide,0.011054156230237587,0.0014333799808321664,6,6,0.6855137242098673,900,,0.8910394053785891,0.602714694704203,0.05415846607086229,oversample,0.5525591147314035,,10.0,0.6507554562994892,,,,0.392209760921018,,0.5567616463138851,0.5572139303482587,0.715281812899477,0.7156549520766773,0.8910394053785891,0.602714694704203,0.08,0.5526580731391921,0.5409224840549856,0.5567616463138851,0.5572139303482587,1.0,1.0,oversample,0.49700426068071424,0.47688429420426365,0.5525591147314035,0.5,COMPLETE
2187,0.7156549520766773,2025-11-30 12:37:09.087555,2025-11-30 12:37:09.997436,0 days 00:00:00.909881,8.80829837676039,gbtree,0.6912005210245775,3.078479320806945,lossguide,0.0003951911920654505,0.001290864022368976,9,10,7.087015332367672,1000,,0.8240707355946657,0.21213992276454452,0.004790288699711854,oversample,0.5816522303884532,,9.0,0.6060513784594188,,,,0.732645627607226,,0.5567616463138851,0.5572139303482587,0.715281812899477,0.7156549520766773,0.8240707355946657,0.21213992276454452,0.08,0.4364255936511739,0.4366581824757664,0.5567616463138851,0.5572139303482587,1.0,1.0,oversample,0.31773197499958555,0.3113811303609567,0.5816522303884532,0.5,COMPLETE
2188,0.7156549520766773,2025-11-30 12:37:10.773796,2025-11-30 12:37:11.440254,0 days 00:00:00.666458,69.59639138542751,gbtree,0.40597318246421976,1.1619479623427964,depthwise,60.05672320385749,0.0017600384095422192,7,5,1.684592028022286,700,,0.8560927035756815,0.26587350285488065,0.041057870144117214,none,0.7309058936388196,1.8414629526087585,6.0,0.7321673824225253,,,,0.556001351271526,,0.5567616463138851,0.5572139303482587,0.715281812899477,0.7156549520766773,0.8560927035756815,0.26587350285488065,0.08,0.5567616463138851,0.5572139303482587,0.5567616463138851,0.5572139303482587,1.0,1.0,none,0.5,0.5,0.7309058936388196,0.5,COMPLETE
2189,0.5844057532172596,2025-11-30 12:37:12.222064,2025-11-30 12:37:15.431998,0 days 00:00:03.209934,0.004105143099260572,gbtree,0.8642429487799959,0.5257151420438899,depthwise,1.236867112803627,0.3678639628209538,0,3,3.6048855349579205,600,,0.5760704273519761,0.6037255481883153,0.0655271247322768,oversample,0.8642788717670835,,8.0,0.6746047633632375,,,,0.2854140740707439,,0.506558118498417,0.5033921302578019,0.5878352852285607,0.5844057532172596,0.5760704273519761,0.6037255481883153,0.08,0.5472130970942097,0.5295778848024437,0.5494350282485876,0.5475177304964539,0.6320064987814785,0.6266233766233766,oversample,0.49538163762661847,0.48060073226058925,0.8642788717670835,0.5,COMPLETE
2190,0.7156549520766773,2025-11-30 12:37:16.212259,2025-11-30 12:37:16.964112,0 days 00:00:00.751853,11.762239649939913,gbtree,0.4764074387592677,8.412800663481075,depthwise,68.90923896897563,0.00022681689527652684,8,7,1.207549607105641,800,,0.9491144005080021,0.4961223880518538,0.0071087900630119605,oversample,0.888891633308395,,8.0,0.6334830746204202,,,,0.3297827126188405,,0.5567616463138851,0.5572139303482587,0.715281812899477,0.7156549520766773,0.9491144005080021,0.4961223880518538,0.08,0.5567616463138851,0.5572139303482587,0.5567616463138851,0.5572139303482587,1.0,1.0,oversample,0.5,0.5,0.888891633308395,0.5,COMPLETE
2191,0.7145348837209302,2025-11-30 12:37:17.738779,2025-11-30 12:37:40.153443,0 days 00:00:22.414664,0.08649345766664047,dart,0.8230650012454299,1.9586895905880652,depthwise,0.0007385220950884463,0.020889688877076058,4,6,3.277741238750154,400,forest,0.6080610097849588,0.6385746473899906,0.011528118273788836,none,0.5145568989163571,1.8443472125293916,11.0,0.9252899377508403,0.0009097473902646147,weighted,0.7469256286759403,0.8235127651202243,,0.5549525101763908,0.555857078245138,0.7137870855148342,0.7145348837209302,0.6080610097849588,0.6385746473899906,0.08,0.5947620734947865,0.611685027799717,0.55595831445401,0.5566123188405797,0.9967506092607636,0.997564935064935,none,0.5050527197068917,0.5283489812026585,0.5145568989163571,0.5,COMPLETE
2192,0.7156549520766773,2025-11-30 12:37:40.934648,2025-11-30 12:38:20.226261,0 days 00:00:39.291613,0.03396265559727684,gbtree,0.6618373691396564,1.4533366133006653,lossguide,1.8242516875117873,0.0024279816486471803,8,12,2.410081801772011,1000,,0.7667139697523291,0.730422987799189,0.06325319473789155,none,0.8440569406919634,2.08636894127715,8.0,0.7293223972324312,,,,0.8424121162035274,,0.5567616463138851,0.5572139303482587,0.715281812899477,0.7156549520766773,0.7667139697523291,0.730422987799189,0.08,0.5503482320408098,0.5481281800009379,0.5567616463138851,0.5572139303482587,1.0,1.0,none,0.526082163165835,0.5240127913455288,0.8440569406919634,0.5,COMPLETE
2193,0.7156549520766773,2025-11-30 12:38:21.007505,2025-11-30 12:38:21.992791,0 days 00:00:00.985286,0.0031423205431497713,gbtree,0.48017736121915944,0.9338409764882383,lossguide,0.0021024746991630964,0.0015999888400768682,3,3,1.4850780489602928,400,,0.8467544859637179,0.6490506193398821,0.05935997813267829,none,0.5611826170108489,1.3151182858475736,11.0,0.6018220927759388,,,,0.38197616656695105,,0.5567616463138851,0.5572139303482587,0.715281812899477,0.7156549520766773,0.8467544859637179,0.6490506193398821,0.08,0.6071921526013547,0.6145305377050737,0.5567616463138851,0.5572139303482587,1.0,1.0,none,0.6021087882756677,0.6049934169507714,0.5611826170108489,0.5,COMPLETE
2194,0.4563405002193945,2025-11-30 12:38:22.819171,2025-11-30 12:38:28.573105,0 days 00:00:05.753934,0.004596179447046184,dart,0.9442362712372614,1.8696718051616434,lossguide,1.1150322923109313,0.00011817854974954253,3,6,28.12137847437678,200,tree,0.9896216869890134,0.7948723401320443,0.09524104481773524,undersample,0.9978663360975479,,9.0,0.9167217554593883,0.41491766683919723,weighted,0.8475141000656542,0.30828089147011817,,0.4323835368611488,0.4396200814111262,0.45076586433260396,0.4563405002193945,0.9896216869890134,0.7948723401320443,0.1,0.4892968074379779,0.48539462287024304,0.48861480075901326,0.49665711556829034,0.41835905767668563,0.42207792207792205,undersample,0.4101348662942025,0.40470124232253957,0.9978663360975479,0.5,COMPLETE
2195,0.4425569959767546,2025-11-30 12:38:29.381452,2025-11-30 12:38:30.017224,0 days 00:00:00.635772,0.0017756005295123264,gbtree,0.42073097744516597,5.358879925710621,depthwise,0.04136746618537037,0.055443917787718504,9,9,0.32445138895806236,600,,0.9782657951855835,0.4759079862289316,0.061033460265779306,undersample,0.6690514124597953,,6.0,0.8125922948491502,,,,0.6423698538870593,,0.44007236544549977,0.4360018091361375,0.455584872471416,0.4425569959767546,0.9782657951855835,0.4759079862289316,0.08,0.5047997549235471,0.5040496828773398,0.4966442953020134,0.4925373134328358,0.4207961007311129,0.4017857142857143,undersample,0.43763159203567703,0.4438293448124909,0.6690514124597953,0.5,COMPLETE
2196,0.3143552311435523,2025-11-30 12:38:30.831770,2025-11-30 12:38:31.371451,0 days 00:00:00.539681,0.06207486798574115,gbtree,0.3812364258366776,4.578687853426443,depthwise,10.298082503239476,0.00014077716726437005,1,12,18.101699937771162,400,,0.9978563419461528,0.6837902202574928,0.00450698273905008,undersample,0.9029154129027444,,11.0,0.781855254300075,,,,0.2524656765363224,,0.3550429669832655,0.3627317955676165,0.30166503428011754,0.3143552311435523,0.9978563419461528,0.6837902202574928,0.08,0.4342516465871089,0.4357364772381165,0.3797780517879161,0.39246658566221143,0.2502030869212023,0.2621753246753247,undersample,0.30789635106682806,0.3079304186620325,0.9029154129027444,0.5,COMPLETE
2197,0.7156549520766773,2025-11-30 12:38:32.163803,2025-11-30 12:38:32.897906,0 days 00:00:00.734103,1.68827155663707,gbtree,0.7409120654511443,3.9113571212334652,lossguide,0.0002052007161032924,0.0017636395944511554,2,11,2.2025259192388775,300,,0.5527748421304901,0.5339520078523932,0.06534914117970339,none,0.7098413157185989,1.3041790719296478,9.0,0.6542878326062253,,,,0.6320592646289726,,0.5567616463138851,0.5572139303482587,0.715281812899477,0.7156549520766773,0.5527748421304901,0.5339520078523932,0.08,0.4478423102605698,0.4456819356200431,0.5567616463138851,0.5572139303482587,1.0,1.0,none,0.32091339378968486,0.3321956707745778,0.7098413157185989,0.5,COMPLETE
2198,0.7156549520766773,2025-11-30 12:38:33.673916,2025-11-30 12:38:52.669242,0 days 00:00:18.995326,0.00022066844329900404,dart,0.3880108496283753,8.240772244494227,lossguide,4.464361642403242,0.000475043889954217,2,6,43.03497248615578,400,tree,0.5408444687965194,0.41678625448516526,0.04155887020861522,none,0.9401609658321851,0.9882848662350009,11.0,0.8129645928108445,0.2504058491238348,weighted,0.4734867135604867,0.6453755535799373,,0.5567616463138851,0.5572139303482587,0.715281812899477,0.7156549520766773,0.5408444687965194,0.41678625448516526,0.08,0.5233604927814829,0.5203461262138909,0.5567616463138851,0.5572139303482587,1.0,1.0,none,0.4585872610620203,0.4537006022578035,0.9401609658321851,0.5,COMPLETE
2199,0.6960118168389956,2025-11-30 12:38:53.443040,2025-11-30 12:39:05.248301,0 days 00:00:11.805261,7.45316454072329,dart,0.4652558433502223,2.276689383929903,depthwise,3.094532715356673,0.18395977194117863,6,8,0.45069280293295655,300,forest,0.9247426244913071,0.6177614123933748,0.0027614044963305442,oversample,0.7248234494097029,,6.0,0.8364364093943449,0.24821501604836255,weighted,0.6962861781708526,0.39843706375527943,,0.5305291723202171,0.5345997286295794,0.6932624113475178,0.6960118168389956,0.9247426244913071,0.6177614123933748,0.08,0.4656143866449749,0.44383951955195144,0.5448211797491872,0.5471435206688342,0.9528838342810723,0.9561688311688312,oversample,0.3493940549412291,0.31670353395327855,0.7248234494097029,0.5,COMPLETE
2200,0.6312829525483304,2025-11-30 12:39:06.034135,2025-11-30 12:39:14.730778,0 days 00:00:08.696643,0.009596634365156648,gbtree,0.6807462296158049,1.2398890832731169,lossguide,0.012175874955195006,0.012023423714273779,0,5,0.2650854183874763,900,,0.8159352161573863,0.2909091957009625,0.06691931285020628,none,0.6623929288688143,1.019040552980021,8.0,0.8346980730442977,,,,0.4630825870491263,,0.5232926277702397,0.5255540479421077,0.627034677990092,0.6312829525483304,0.8159352161573863,0.2909091957009625,0.08,0.5204728969521115,0.5190071803366167,0.5554858934169279,0.5567265964042157,0.7197400487408611,0.7288961038961039,none,0.46048260083887327,0.4609519056020588,0.6623929288688143,0.5,COMPLETE
2201,0.7156549520766773,2025-11-30 12:39:15.516559,2025-11-30 12:39:24.464423,0 days 00:00:08.947864,0.0004881751858095,dart,0.4670267239157624,4.923655407134378,lossguide,0.12597769444334475,0.00011397278186793941,5,4,38.36198480154331,300,forest,0.8819341888500929,0.22341998947439556,0.08573542571210434,oversample,0.9925773415592037,,5.0,0.6135179695097661,0.4157792155195203,weighted,0.33965309857229015,0.2862209088381019,,0.5567616463138851,0.5572139303482587,0.715281812899477,0.7156549520766773,0.8819341888500929,0.22341998947439556,0.08,0.6076748599916085,0.5857253209983041,0.5567616463138851,0.5572139303482587,1.0,1.0,oversample,0.5282112601336231,0.5211843187456057,0.9925773415592037,0.5,COMPLETE
2202,0.0,2025-11-30 12:39:25.248682,2025-11-30 12:39:26.076742,0 days 00:00:00.828060,0.0008227286322122714,gbtree,0.31372520180971863,5.4520119716500925,depthwise,0.007957925453508314,0.006452508462941986,1,5,13.193413212690107,900,,0.9966889968449526,0.3920578030613419,0.010354719431977223,none,0.8603212734584538,0.5447296823462292,9.0,0.9332870177250971,,,,0.6324827348995297,,0.44323835368611486,0.4427860696517413,0.0,0.0,0.9966889968449526,0.3920578030613419,0.08,0.5081693896508661,0.508927412423158,0.0,0.0,0.0,0.0,none,0.43805973242261975,0.4284076814401125,0.8603212734584538,0.5,COMPLETE
2203,0.4925,2025-11-30 12:39:26.858972,2025-11-30 12:39:31.421706,0 days 00:00:04.562734,0.014912584734908188,gbtree,0.26107517980576705,1.7567656948828547,lossguide,0.039174154412824215,0.008293898453466902,0,10,0.2294940431203251,1000,,0.5938851485545438,0.48327588204038396,0.037634145819040635,undersample,0.529775977005088,,7.0,0.6419663669709399,,,,0.6465104054970663,,0.4473089099954772,0.4491180461329715,0.5004088307440719,0.4925,0.5938851485545438,0.48327588204038396,0.08,0.5163831846971348,0.5212245758540541,0.5037037037037037,0.5059931506849316,0.49715678310316813,0.4797077922077922,undersample,0.43176859695949865,0.4380841005266439,0.529775977005088,0.5,COMPLETE
2204,0.7156549520766773,2025-11-30 12:39:32.215979,2025-11-30 12:42:46.600847,0 days 00:03:14.384868,0.00020859230104762385,dart,0.2913210765784884,1.3741442640032386,lossguide,0.012539294671928325,0.001209133249956598,10,6,5.0067375068696585,1000,forest,0.8395749980837426,0.6623633737245184,0.0874028822863436,none,0.6048460723607443,4.253478757611225,7.0,0.795917610197528,0.09756933112972,uniform,0.1864819339222175,0.5032545150257022,,0.5567616463138851,0.5572139303482587,0.715281812899477,0.7156549520766773,0.8395749980837426,0.6623633737245184,0.08,0.5254703207753021,0.5139093457828928,0.5567616463138851,0.5572139303482587,1.0,1.0,none,0.4909174555281089,0.4808677022670894,0.6048460723607443,0.5,COMPLETE
2205,0.7156549520766773,2025-11-30 12:42:47.346502,2025-11-30 12:42:48.296945,0 days 00:00:00.950443,0.0002957458236170526,gbtree,0.6045549105150042,3.0379159085703735,depthwise,0.0019366008180733572,0.017696275698022984,0,10,1.0634667712318695,400,,0.6210304173712289,0.8677707389381504,0.018825318915517,none,0.8692479648325586,3.744688714916275,7.0,0.6575213934400486,,,,0.7005687252154071,,0.5567616463138851,0.5572139303482587,0.715281812899477,0.7156549520766773,0.6210304173712289,0.8677707389381504,0.08,0.5301439373260315,0.5153212357082032,0.5567616463138851,0.5572139303482587,1.0,1.0,none,0.4674252723022597,0.45832117320881366,0.8692479648325586,0.5,COMPLETE
2206,0.20182440136830102,2025-11-30 12:42:49.020488,2025-11-30 12:42:49.565453,0 days 00:00:00.544965,6.190311161207981,gbtree,0.5936556953239147,8.415615453566597,lossguide,0.00032717658181667105,0.00015470071812118995,2,9,46.9694559480455,400,,0.9673038141018135,0.7856562774209743,0.04748675001029421,undersample,0.8248306294941874,,9.0,0.6146337104036554,,,,0.9689363535065565,,0.3749434644957033,0.36680235187697874,0.21387940841865757,0.20182440136830102,0.9673038141018135,0.7856562774209743,0.08,0.493855357378885,0.4941499923437232,0.3567362428842505,0.3390804597701149,0.15272136474411047,0.14366883116883117,undersample,0.3129449261426748,0.294857593887216,0.8248306294941874,0.5,COMPLETE
2207,0.3603258265452803,2025-11-30 12:42:50.299738,2025-11-30 12:42:50.835806,0 days 00:00:00.536068,0.0016120397396815799,gbtree,0.5776618077989293,5.605119006191838,lossguide,0.3122270938857949,0.00013943365477780246,6,7,0.19155010001832595,400,,0.5418501046072222,0.6198772083282158,0.06503917479374362,undersample,0.9964100538988085,,8.0,0.6798161343577216,,,,0.558562178993237,,0.38489371325192223,0.39620081411126185,0.3480345158197507,0.3603258265452803,0.5418501046072222,0.6198772083282158,0.08,0.4803730774811846,0.4819809513346464,0.4245614035087719,0.439766081871345,0.29488220958570266,0.3051948051948052,undersample,0.40735050315820887,0.4069095485719592,0.9964100538988085,0.5,COMPLETE
2208,0.7156549520766773,2025-11-30 12:42:51.641056,2025-11-30 12:43:14.253312,0 days 00:00:22.612256,0.4726761657186216,dart,0.6832395390145356,7.891842270707597,depthwise,0.0001144088424094618,0.0006277365985375386,5,4,3.1720192986600186,500,forest,0.6954686525761307,0.2666177727018887,0.05394257808850114,oversample,0.9219843138060202,,12.0,0.6474589096040096,0.38702646292226756,weighted,0.15801973132915859,0.292705406940533,,0.5567616463138851,0.5572139303482587,0.715281812899477,0.7156549520766773,0.6954686525761307,0.2666177727018887,0.08,0.46974928135044564,0.484381450158739,0.5567616463138851,0.5572139303482587,1.0,1.0,oversample,0.3199410633465409,0.33900920963612485,0.9219843138060202,0.5,COMPLETE
2209,0.7156549520766773,2025-11-30 12:43:15.030341,2025-11-30 12:45:20.361112,0 days 00:02:05.330771,28.58394381341989,dart,0.7061180293674141,2.3696501831116388,lossguide,13.05376076855161,0.04694985646448634,9,4,0.8079226690741754,1000,tree,0.9496288563476918,0.36263954252252545,0.05226158468487513,none,0.7070076923875755,1.5368176168008685,10.0,0.6334955935331988,0.15933617609076434,uniform,0.5876702858227335,0.47764040751390413,,0.5567616463138851,0.5572139303482587,0.715281812899477,0.7156549520766773,0.9496288563476918,0.36263954252252545,0.08,0.5831205931245815,0.5932720277613678,0.5567616463138851,0.5572139303482587,1.0,1.0,none,0.5731117060959234,0.5910960528235809,0.7070076923875755,0.5,COMPLETE
2210,0.4182888184698959,2025-11-30 12:45:21.142710,2025-11-30 12:45:21.688190,0 days 00:00:00.545480,0.1155125195641311,gbtree,0.35844838265222656,4.996212124009408,depthwise,0.009827568945576293,0.019161274606475275,2,5,0.658984238083113,400,,0.7826211226795207,0.6365851281835114,0.04017004765201964,undersample,0.9292102007410801,,6.0,0.936901029882172,,,,0.3834911197515476,,0.42017186793306194,0.4188150158299412,0.4276785714285714,0.4182888184698959,0.7826211226795207,0.6365851281835114,0.08,0.47124599651475574,0.4708308478015344,0.47472745292368684,0.4728761514841351,0.3891145410235581,0.375,undersample,0.38811071138447256,0.38908018054468513,0.9292102007410801,0.5,COMPLETE
2211,0.7160709096192968,2025-11-30 12:45:22.464927,2025-11-30 12:46:46.831924,0 days 00:01:24.366997,0.1356093016747709,dart,0.7068747487626397,4.100515213789782,lossguide,0.0008679616272222507,0.05222816366062425,8,7,1.738422641329617,800,forest,0.6066855106912712,0.7637017788022855,0.03257544359864233,none,0.7164494948281488,2.721894447857387,8.0,0.942706352176433,0.07396661659677956,uniform,0.5319827668670536,0.41013153134802227,,0.5581184984170059,0.5581184984170059,0.7159057865658621,0.7160709096192968,0.6066855106912712,0.7637017788022855,0.08,0.5470986613730449,0.5257782662830863,0.5575181159420289,0.5577184246265279,1.0,1.0,none,0.4946426499113049,0.48091164453524005,0.7164494948281488,0.5,COMPLETE
