number,value,datetime_start,datetime_complete,duration,params_alpha,params_booster,params_colsample_bytree,params_gamma,params_grow_policy,params_lambda,params_learning_rate,params_max_delta_step,params_max_depth,params_min_child_weight,params_n_estimators,params_normalize_type,params_params_feature_fraction,params_params_labeled_ratio,params_params_missing_rate,params_params_resampling,params_params_sample_rows,params_params_scale_pos_weight,params_params_selftrain_max_iter,params_params_selftrain_threshold,params_rate_drop,params_sample_type,params_skip_drop,params_subsample,params_user_attrs_decision_threshold,user_attrs_acc_test,user_attrs_acc_val,user_attrs_f1_test,user_attrs_f1_val,user_attrs_feature_fraction,user_attrs_labeled_ratio,user_attrs_missing_rate,user_attrs_pr_auc_test,user_attrs_pr_auc_val,user_attrs_prec_test,user_attrs_prec_val,user_attrs_rec_test,user_attrs_rec_val,user_attrs_resampling_strategy,user_attrs_roc_auc_test,user_attrs_roc_auc_val,user_attrs_sample_rows,user_attrs_user_attrs_decision_threshold,state
1974,0.7156549520766773,2025-11-27 11:45:42.269499,2025-11-27 11:45:42.957600,0 days 00:00:00.688101,98.4303486505776,gbtree,0.5493307782863792,7.187292963814044,depthwise,8.3796090356882,0.008072295843328603,2,5,2.9011601086303136,700,,0.5896834457453344,0.2759994090928986,0.08769433979156693,oversample,0.773224385622107,,5.0,0.9452882211343328,,,,0.36682214560237647,,0.5567616463138851,0.5572139303482587,0.715281812899477,0.7156549520766773,0.5896834457453344,0.2759994090928986,0.08,0.5567616463138851,0.5572139303482587,0.5567616463138851,0.5572139303482587,1.0,1.0,oversample,0.5,0.5,0.773224385622107,0.5,COMPLETE
1975,0.406518786781349,2025-11-27 11:45:43.165796,2025-11-27 11:46:02.808586,0 days 00:00:19.642790,22.954113277653434,dart,0.377740248216632,1.0777282854360704,depthwise,0.10250675544475266,0.07797764110027702,9,4,15.03530747411454,400,tree,0.9059356320328376,0.6135213808386231,0.038820498523694624,undersample,0.9828711720914083,,6.0,0.810821592324376,0.20941034913088835,uniform,0.439006843583863,0.5392529877493941,,0.4260515603799186,0.40705563093622793,0.43272239606616003,0.406518786781349,0.9059356320328376,0.6135213808386231,0.05,0.4766418838898049,0.4692672167297924,0.48111332007952284,0.4595701125895599,0.3931762794476036,0.36444805194805197,undersample,0.39340464861818003,0.3758373903930594,0.9828711720914083,0.5,COMPLETE
1976,0.29296668429402434,2025-11-27 11:46:03.016528,2025-11-27 11:46:03.709186,0 days 00:00:00.692658,0.09583529178792775,gbtree,0.9416886697615454,5.4779188673723365,lossguide,11.674496142667609,0.0011674496150778154,8,6,0.32277344300186334,600,,0.5885843201941137,0.8059184272409794,0.09277803906599386,undersample,0.9489616469292066,,5.0,0.729175761650979,,,,0.4879187054336789,,0.39258254183627317,0.3952962460425147,0.2814339218833601,0.29296668429402434,0.5885843201941137,0.8059184272409794,0.08,0.46753575564186345,0.4719661941759808,0.4122257053291536,0.4203338391502276,0.21364744110479286,0.22483766233766234,undersample,0.3813798305674829,0.38023990820211456,0.9489616469292066,0.5,COMPLETE
1977,0.7156549520766773,2025-11-27 11:46:03.911330,2025-11-27 11:47:04.740138,0 days 00:01:00.828808,0.0005007067227168575,dart,0.2768362257568113,3.9711027352524573,lossguide,0.004994062786178146,0.26284559722656253,7,9,0.8828390624535553,700,forest,0.9521335487114801,0.2056861329643654,0.0024970328686211296,oversample,0.5017620378899892,,7.0,0.8289650260907069,0.13603541631484717,uniform,0.46446280017992064,0.9687753139906794,,0.5567616463138851,0.5572139303482587,0.715281812899477,0.7156549520766773,0.9521335487114801,0.2056861329643654,0.0,0.6024915236954596,0.6134520068766198,0.5567616463138851,0.5572139303482587,1.0,1.0,oversample,0.5626075531756163,0.5821023970921827,0.5017620378899892,0.5,COMPLETE
1978,0.7156549520766773,2025-11-27 11:47:04.940489,2025-11-27 11:47:09.964142,0 days 00:00:05.023653,0.00013655401696394617,dart,0.25819310378555055,1.454761419338988,lossguide,10.875909866221958,0.0013649724207010102,2,8,0.3153780617039318,200,tree,0.932098310576591,0.6126773765599338,0.06681983620560102,none,0.7230768208373584,0.9431394195257121,11.0,0.6016275665481261,0.3183473257312534,uniform,0.34108473717998505,0.5962058804319845,,0.5567616463138851,0.5572139303482587,0.715281812899477,0.7156549520766773,0.932098310576591,0.6126773765599338,0.08,0.47827938661395625,0.4683971658566847,0.5567616463138851,0.5572139303482587,1.0,1.0,none,0.39289858916759224,0.37770037674276696,0.7230768208373584,0.5,COMPLETE
1979,0.7156549520766773,2025-11-27 11:47:10.161971,2025-11-27 11:47:54.209485,0 days 00:00:44.047514,0.012798115783324765,dart,0.8675138618986789,3.7580221866405585,depthwise,0.001303976342362521,0.1892399130088368,9,12,45.26891912407307,600,forest,0.5438409809117792,0.888472537074209,0.05941109395136212,oversample,0.5986631805561904,,12.0,0.6812060450348204,0.23044276836919725,weighted,0.009791524087975612,0.3074212824237245,,0.5567616463138851,0.5572139303482587,0.715281812899477,0.7156549520766773,0.5438409809117792,0.888472537074209,0.05,0.46424865965991335,0.46686004825068605,0.5567616463138851,0.5572139303482587,1.0,1.0,oversample,0.3675686765364147,0.3819059834445432,0.5986631805561904,0.5,COMPLETE
1980,0.7156549520766773,2025-11-27 11:47:54.413961,2025-11-27 11:49:39.391349,0 days 00:01:44.977388,4.861373916032583,dart,0.9955379132569429,1.8082008271965422,depthwise,0.05310720963749053,0.013714054526760725,8,11,78.3298404808776,1000,tree,0.8122535696173199,0.43956540045425163,0.07837604758050785,oversample,0.6194149755763709,,8.0,0.7123238424325735,0.4437309242825125,uniform,0.4854754465952611,0.5868094780859936,,0.5567616463138851,0.5572139303482587,0.715281812899477,0.7156549520766773,0.8122535696173199,0.43956540045425163,0.08,0.5980418248203083,0.5924011869119972,0.5567616463138851,0.5572139303482587,1.0,1.0,oversample,0.5290845338947927,0.531720928458671,0.6194149755763709,0.5,COMPLETE
1981,0.3425774877650897,2025-11-27 11:49:39.598071,2025-11-27 11:49:40.123804,0 days 00:00:00.525733,4.45120863971221,gbtree,0.30297866327135703,5.6928865492071,lossguide,10.892065186604881,0.0007431317832044452,9,7,2.6978167477626562,400,,0.5012681135731651,0.7395017403673931,0.028671962583024124,undersample,0.5806964479460253,,7.0,0.9151058566329157,,,,0.40530277818393423,,0.4500226142017187,0.4531886024423338,0.3434125269978402,0.3425774877650897,0.5012681135731651,0.7395017403673931,0.02,0.5329337548735841,0.552530493908557,0.5120772946859904,0.5189456342668863,0.25832656376929325,0.2556818181818182,undersample,0.46537782456605714,0.4867903738243371,0.5806964479460253,0.5,COMPLETE
1982,0.7156549520766773,2025-11-27 11:49:40.332956,2025-11-27 11:51:05.642270,0 days 00:01:25.309314,0.10171948485981298,dart,0.6532984985479048,5.370332293031122,lossguide,5.425543075161119,0.25069531269712103,2,10,0.13574454422731982,800,tree,0.5334303374350029,0.6992062586588599,0.010119690363929224,none,0.6329970577266318,2.6697964652689516,8.0,0.6243758391964394,0.012729048881557292,uniform,0.5700950377360813,0.6417138316308391,,0.5567616463138851,0.5572139303482587,0.715281812899477,0.7156549520766773,0.5334303374350029,0.6992062586588599,0.02,0.575624520498555,0.5696755444996078,0.5567616463138851,0.5572139303482587,1.0,1.0,none,0.5300949949435501,0.5199352805009088,0.6329970577266318,0.5,COMPLETE
1983,0.7156549520766773,2025-11-27 11:51:05.843957,2025-11-27 11:51:23.544715,0 days 00:00:17.700758,2.8366060590742443,dart,0.42591140131177774,9.222684176785776,lossguide,0.07869574482006425,0.0006049336149376658,4,6,4.2820542790616996,400,forest,0.9796731978279605,0.6604757243685053,0.09120944270224823,oversample,0.8831901056577782,,8.0,0.8975169001573617,0.4368065037468033,uniform,0.557726797789103,0.4839108812623205,,0.5567616463138851,0.5572139303482587,0.715281812899477,0.7156549520766773,0.9796731978279605,0.6604757243685053,0.08,0.5835180952036885,0.586858568772833,0.5567616463138851,0.5572139303482587,1.0,1.0,oversample,0.5315414711782357,0.5231733282039718,0.8831901056577782,0.5,COMPLETE
1984,0.7156549520766773,2025-11-27 11:51:23.741775,2025-11-27 11:51:44.839988,0 days 00:00:21.098213,64.97075399830273,dart,0.24394383589510396,4.36388290533235,depthwise,14.932243550275206,0.00019552228306837508,2,11,2.6779352498114832,400,tree,0.790073978089965,0.2777058609900707,0.03451355894440416,oversample,0.6969232273589003,,11.0,0.9138984006431852,0.18852196851040115,uniform,0.7998278864750575,0.9629009901987937,,0.5567616463138851,0.5572139303482587,0.715281812899477,0.7156549520766773,0.790073978089965,0.2777058609900707,0.02,0.5567616463138851,0.5572139303482587,0.5567616463138851,0.5572139303482587,1.0,1.0,oversample,0.5,0.5,0.6969232273589003,0.5,COMPLETE
1985,0.7156549520766773,2025-11-27 11:51:45.038741,2025-11-27 11:51:45.760285,0 days 00:00:00.721544,21.538117729726146,gbtree,0.5439932684225958,7.989117043909168,lossguide,42.40108658907386,0.06463582586525445,2,4,12.073539677586721,700,,0.8504000659107918,0.27331816168176326,0.02431181226616246,oversample,0.8826010347338565,,6.0,0.8945689389978022,,,,0.9163233733934955,,0.5567616463138851,0.5572139303482587,0.715281812899477,0.7156549520766773,0.8504000659107918,0.27331816168176326,0.02,0.5567616463138851,0.5572139303482587,0.5567616463138851,0.5572139303482587,1.0,1.0,oversample,0.5,0.5,0.8826010347338565,0.5,COMPLETE
1986,0.35663082437275984,2025-11-27 11:51:45.963128,2025-11-27 11:56:01.356053,0 days 00:04:15.392925,0.34382977166858414,dart,0.909999115370377,7.088992140956821,lossguide,0.12633120738445425,0.13969803386209104,7,6,9.774850059772389,800,tree,0.9265349030930622,0.6865873953835586,0.009962278082764398,undersample,0.9698423045745626,,6.0,0.6162412215092833,0.44419693125491144,weighted,0.6696403264224402,0.3310364756674954,,0.378561736770692,0.35052012663952964,0.3810810810810811,0.35663082437275984,0.9265349030930622,0.6865873953835586,0.0,0.44593017771456317,0.44142259203208933,0.4277047522750253,0.398,0.3436230706742486,0.32305194805194803,undersample,0.3438435650458396,0.3203681532971625,0.9698423045745626,0.5,COMPLETE
1987,0.7156549520766773,2025-11-27 11:56:01.564139,2025-11-27 11:57:36.948752,0 days 00:01:35.384613,31.38667642468785,dart,0.5329610289189541,6.982985901212432,lossguide,23.24450047566924,0.0005837158723118852,10,10,1.7799964403493227,900,tree,0.8804548641753038,0.46361632220575194,0.028128818267820255,oversample,0.7780779188226875,,11.0,0.6602872540918302,0.2490273850600983,weighted,0.48385286678886746,0.6037065302152558,,0.5567616463138851,0.5572139303482587,0.715281812899477,0.7156549520766773,0.8804548641753038,0.46361632220575194,0.02,0.5567616463138851,0.5572139303482587,0.5567616463138851,0.5572139303482587,1.0,1.0,oversample,0.5,0.5,0.7780779188226875,0.5,COMPLETE
1988,0.48946236559139783,2025-11-27 11:57:37.153416,2025-11-27 11:57:37.812833,0 days 00:00:00.659417,2.228716374233053,gbtree,0.44452955352439383,4.989599042284931,lossguide,0.009320054101713684,0.00039335313971468897,9,3,0.24958532088466814,600,,0.6294983236991007,0.25107788854384117,0.05616771527188963,undersample,0.7463573769162017,,9.0,0.6738217712636616,,,,0.28654179790959367,,0.47715965626413387,0.4631388511985527,0.5118243243243243,0.48946236559139783,0.6294983236991007,0.25107788854384117,0.05,0.5228833968665781,0.5020590387335477,0.5329815303430079,0.5205855443732845,0.49228269699431354,0.46185064935064934,undersample,0.4447802516619971,0.42934912380775503,0.7463573769162017,0.5,COMPLETE
1989,0.0,2025-11-27 11:57:38.010512,2025-11-27 11:57:38.467893,0 days 00:00:00.457381,0.15613016456010004,gbtree,0.31137102549224727,2.4587031031185713,depthwise,1.7470215471478312,0.00012498939889999514,8,7,9.12369156839734,200,,0.7715246206750332,0.683367696907583,0.03601892931921826,none,0.7855763510040594,0.6607484026780396,6.0,0.7626934969823496,,,,0.24333919290850448,,0.44323835368611486,0.4427860696517413,0.0,0.0,0.7715246206750332,0.683367696907583,0.05,0.5105172153384453,0.5007389544522738,0.0,0.0,0.0,0.0,none,0.4650267743165503,0.44417383561280394,0.7855763510040594,0.5,COMPLETE
1990,0.28382502543234994,2025-11-27 11:57:38.665679,2025-11-27 11:57:39.483899,0 days 00:00:00.818220,0.8291410964922113,gbtree,0.23346220559491826,5.144381148622968,depthwise,0.25023154870272185,0.003253368645504374,1,8,0.26607155122554266,900,,0.5709920416054943,0.2741055109656674,0.004413780818978985,undersample,0.6611089620633819,,10.0,0.8657075296242756,,,,0.764444015853337,,0.35956580732700133,0.36318407960199006,0.2834008097165992,0.28382502543234994,0.5709920416054943,0.2741055109656674,0.0,0.4166691441612432,0.41841170810795186,0.37583892617449666,0.3801089918256131,0.22745735174654752,0.22646103896103897,undersample,0.18219259271539648,0.18458157011527798,0.6611089620633819,0.5,COMPLETE
1991,0.4984423676012461,2025-11-27 11:57:39.686563,2025-11-27 12:00:15.873397,0 days 00:02:36.186834,0.05561831768870662,dart,0.8146831486344679,0.5122786488890974,lossguide,0.10528584737079225,0.0012380677784485342,2,11,0.2510101551518013,1000,forest,0.6195875727595757,0.790744940553076,0.041330767238155756,undersample,0.6233691937533894,,8.0,0.846030789613648,0.18705116246522413,weighted,0.5186583284015337,0.8009106809277851,,0.48484848484848486,0.4902758932609679,0.498016747465844,0.4984423676012461,0.6195875727595757,0.790744940553076,0.05,0.5600991200440436,0.5508363978644849,0.5443159922928709,0.5517241379310345,0.45897644191714054,0.45454545454545453,undersample,0.5006067739849799,0.4969004118965815,0.6233691937533894,0.5,COMPLETE
1992,0.7156549520766773,2025-11-27 12:00:16.074462,2025-11-27 12:00:48.836805,0 days 00:00:32.762343,0.032576421737498154,dart,0.44040945398601716,5.499050733841443,lossguide,0.8737485612857799,0.0005130697537377331,10,7,31.751283496707057,500,forest,0.5072412583365986,0.4904705626331799,0.004489142321743723,none,0.9119444334350096,3.051578046739992,6.0,0.7909259721182043,0.04737335404061693,uniform,0.4058971997823189,0.2155019067019831,,0.5567616463138851,0.5572139303482587,0.715281812899477,0.7156549520766773,0.5072412583365986,0.4904705626331799,0.0,0.4790035943877355,0.5020918942325181,0.5567616463138851,0.5572139303482587,1.0,1.0,none,0.40482808070425574,0.4306823156414576,0.9119444334350096,0.5,COMPLETE
1993,0.5147313691507799,2025-11-27 12:00:49.036492,2025-11-27 12:00:51.484255,0 days 00:00:02.447763,0.002670544287791268,gbtree,0.8567497122524821,0.31468363242337705,depthwise,0.932987485324628,0.02319004168316209,8,9,1.465596027622871,300,,0.9512555262931419,0.829180698720192,0.06118398498689395,undersample,0.7353446052829602,,9.0,0.8654997559518504,,,,0.31994047296484207,,0.5056535504296699,0.49344188150158297,0.5311025311025311,0.5147313691507799,0.9512555262931419,0.829180698720192,0.05,0.5586123355187896,0.5405150927770979,0.5627272727272727,0.5520446096654275,0.5028432168968319,0.48214285714285715,undersample,0.5110031664981183,0.49255220009816536,0.7353446052829602,0.5,COMPLETE
1994,0.7156549520766773,2025-11-27 12:00:51.688412,2025-11-27 12:00:55.263980,0 days 00:00:03.575568,7.150288580898529,gbtree,0.5236556004274047,1.9452715158150224,lossguide,31.63621289674396,0.08158670763546207,4,11,0.11924579374601686,1000,,0.6305718717388967,0.6089618660113757,0.03008623131749587,none,0.649435289054459,1.501542873783947,9.0,0.6976470201199682,,,,0.876927697928126,,0.5567616463138851,0.5572139303482587,0.715281812899477,0.7156549520766773,0.6305718717388967,0.6089618660113757,0.02,0.5332731765560424,0.5198459853702577,0.5567616463138851,0.5572139303482587,1.0,1.0,none,0.4953256851075117,0.4735260270883356,0.649435289054459,0.5,COMPLETE
1995,0.46296296296296297,2025-11-27 12:00:55.463628,2025-11-27 12:00:56.408579,0 days 00:00:00.944951,26.613050970137145,gbtree,0.9947345184895882,4.021777318327482,depthwise,4.139272505935889,0.0006548455821820517,6,9,0.7667952171134684,900,,0.6146013368685629,0.6696583290122236,0.004932154355627438,undersample,0.7292666736302658,,12.0,0.693668920897009,,,,0.21962588439939268,,0.4251469923111714,0.4491180461329715,0.43435692033822876,0.46296296296296297,0.6146013368685629,0.6696583290122236,0.0,0.5264562177080571,0.5357122938746073,0.48031496062992124,0.5067567567567568,0.39642567018683994,0.42613636363636365,undersample,0.42882507999137914,0.4520875893769153,0.7292666736302658,0.5,COMPLETE
1996,0.7156549520766773,2025-11-27 12:00:56.615253,2025-11-27 12:01:02.011872,0 days 00:00:05.396619,0.0058649501973597985,dart,0.9280084544387686,8.613083900711784,lossguide,0.0005540524273058285,0.0003526624543953449,2,10,0.449938980302801,200,forest,0.5073086500028771,0.43225358435289396,0.02007201402481327,oversample,0.7042676376984172,,6.0,0.923519179256405,0.14440447327524897,uniform,0.40055403369044323,0.4959257866863797,,0.5567616463138851,0.5572139303482587,0.715281812899477,0.7156549520766773,0.5073086500028771,0.43225358435289396,0.02,0.5568395821973954,0.5496779986732094,0.5567616463138851,0.5572139303482587,1.0,1.0,oversample,0.48623568029973974,0.4712489055887933,0.7042676376984172,0.5,COMPLETE
1997,0.5,2025-11-27 12:01:02.207263,2025-11-27 12:01:03.152832,0 days 00:00:00.945569,0.0006402106191311107,gbtree,0.7031924755151653,5.673522449386201,depthwise,0.002137537181412545,0.001433482033470605,9,11,18.02343534484447,1000,,0.6807649479082716,0.44188879880015236,0.09145893784418926,undersample,0.5970392286636176,,10.0,0.7154499571964382,,,,0.3993958007618771,,0.5178652193577566,0.5269109000452284,0.48151750972762647,0.5,0.6807649479082716,0.44188879880015236,0.08,0.5888034023044084,0.579549277107743,0.6,0.608139534883721,0.4021121039805037,0.424512987012987,undersample,0.5416431804240787,0.5523443614608069,0.5970392286636176,0.5,COMPLETE
1998,0.5015210777922642,2025-11-27 12:01:03.351932,2025-11-27 12:01:04.344086,0 days 00:00:00.992154,0.0004234480962551584,gbtree,0.9418282332893815,4.113122512158963,lossguide,0.22750746198980276,0.2194685827144631,6,5,4.946887326390071,600,,0.7485085590723879,0.49606928278445556,0.055573283451850135,undersample,0.743430984548121,,6.0,0.9290293110786277,,,,0.2891474363517739,,0.46449570330167345,0.48123021257349613,0.47703180212014135,0.5015210777922642,0.7485085590723879,0.49606928278445556,0.05,0.5215070021656192,0.5339952028333554,0.5227492739593417,0.539756782039289,0.4386677497969131,0.46834415584415584,undersample,0.4517196074205474,0.46622870872743194,0.743430984548121,0.5,COMPLETE
1999,0.488556338028169,2025-11-27 12:01:04.544472,2025-11-27 12:01:09.899776,0 days 00:00:05.355304,0.010527854899264253,dart,0.7482944223098369,5.693634277517539,lossguide,0.0003449695857349712,0.15904420681562945,6,10,0.9924278537425198,200,forest,0.877671420065872,0.5671196088963856,0.027437673346499016,undersample,0.8248000312406047,,10.0,0.7698173855539006,0.46562731483080655,weighted,0.8290099709088208,0.39906515880840454,,0.4902758932609679,0.47444595205789236,0.5165165165165165,0.488556338028169,0.877671420065872,0.5671196088963856,0.02,0.5347816275515648,0.5300345226866483,0.5472727272727272,0.5336538461538461,0.4890333062550772,0.450487012987013,undersample,0.4871678078217477,0.47396047517344764,0.8248000312406047,0.5,COMPLETE
2000,0.7156549520766773,2025-11-27 12:01:10.098152,2025-11-27 12:01:10.512989,0 days 00:00:00.414837,22.216418249353676,gbtree,0.8722279922857685,1.435767642427045,lossguide,39.716732257045344,0.1601866557863718,1,7,0.4415898318717288,200,,0.6139377619334984,0.320142683300058,0.005698035389492973,oversample,0.948696811299883,,12.0,0.7797289894224769,,,,0.41493942035637216,,0.5567616463138851,0.5572139303482587,0.715281812899477,0.7156549520766773,0.6139377619334984,0.320142683300058,0.0,0.610709482716785,0.6254317641547824,0.5567616463138851,0.5572139303482587,1.0,1.0,oversample,0.5157156119962201,0.5344810003581709,0.948696811299883,0.5,COMPLETE
2001,0.5169642857142858,2025-11-27 12:01:10.726481,2025-11-27 12:01:31.244868,0 days 00:00:20.518387,0.15325664676627726,dart,0.8282541841369875,0.13063353996892513,lossguide,0.3173987025338284,0.033922393621573496,4,5,20.61664449779944,400,forest,0.9434768189287925,0.8012002130370659,0.08592833511096468,undersample,0.6365341397494626,,6.0,0.8008315079458749,0.2240258499965555,weighted,0.43705579671645256,0.5112058392665171,,0.5079149706015378,0.5106286748077793,0.5022872827081427,0.5169642857142858,0.9434768189287925,0.8012002130370659,0.08,0.6030670744205315,0.6087642447449735,0.574869109947644,0.5744047619047619,0.44597887896019495,0.4699675324675325,undersample,0.5416203849533314,0.5420892309937254,0.6365341397494626,0.5,COMPLETE
2002,0.7156549520766773,2025-11-27 12:01:31.445168,2025-11-27 12:03:17.792418,0 days 00:01:46.347250,99.15474423593909,dart,0.905783985702729,9.13008726393362,depthwise,2.1586228326946744,0.00012114726828685519,0,3,2.4093935232133674,900,forest,0.6863172952556043,0.6415858885663694,0.09557053406766965,none,0.9579981851995869,4.583715949543613,7.0,0.7539013987102872,0.06541652080056509,weighted,0.7339337221018382,0.7018388802149207,,0.5567616463138851,0.5572139303482587,0.715281812899477,0.7156549520766773,0.6863172952556043,0.6415858885663694,0.08,0.5567616463138851,0.5572139303482587,0.5567616463138851,0.5572139303482587,1.0,1.0,none,0.5,0.5,0.9579981851995869,0.5,COMPLETE
2003,0.7156549520766773,2025-11-27 12:03:18.001021,2025-11-27 12:03:18.660145,0 days 00:00:00.659124,0.5638318677199027,gbtree,0.9347176854126913,9.946183206154915,depthwise,0.05709771815731122,0.00037596564092829185,10,3,4.19015771921362,600,,0.7082816910130978,0.5084042987610797,0.08857792618098893,oversample,0.7637448473864086,,8.0,0.9442384899972978,,,,0.8813539430419948,,0.5567616463138851,0.5572139303482587,0.715281812899477,0.7156549520766773,0.7082816910130978,0.5084042987610797,0.08,0.5156094435201981,0.5171065619652895,0.5567616463138851,0.5572139303482587,1.0,1.0,oversample,0.37648377791409005,0.38085053990952866,0.7637448473864086,0.5,COMPLETE
