number,value,datetime_start,datetime_complete,duration,params_alpha,params_booster,params_colsample_bytree,params_gamma,params_grow_policy,params_lambda,params_learning_rate,params_max_delta_step,params_max_depth,params_min_child_weight,params_n_estimators,params_normalize_type,params_params_feature_fraction,params_params_labeled_ratio,params_params_missing_rate,params_params_resampling,params_params_sample_rows,params_params_scale_pos_weight,params_params_selftrain_max_iter,params_params_selftrain_threshold,params_rate_drop,params_sample_type,params_skip_drop,params_subsample,params_user_attrs_decision_threshold,user_attrs_acc_test,user_attrs_acc_val,user_attrs_f1_test,user_attrs_f1_val,user_attrs_feature_fraction,user_attrs_labeled_ratio,user_attrs_missing_rate,user_attrs_pr_auc_test,user_attrs_pr_auc_val,user_attrs_prec_test,user_attrs_prec_val,user_attrs_rec_test,user_attrs_rec_val,user_attrs_resampling_strategy,user_attrs_roc_auc_test,user_attrs_roc_auc_val,user_attrs_sample_rows,user_attrs_user_attrs_decision_threshold,state
2033,0.4007597340930674,2025-11-27 12:23:20.535129,2025-11-27 12:25:05.055723,0 days 00:01:44.520594,0.004028175560397536,dart,0.4632784338753486,5.106522463791421,depthwise,0.5770510653608156,0.07855227836618808,7,12,1.244043470177628,900,forest,0.914031331342616,0.27185655152255433,0.08722395642271102,undersample,0.9146154625736904,,10.0,0.8397899344055386,0.13235568458844782,uniform,0.7664181285753624,0.840041294612454,,0.42424242424242425,0.4292175486205337,0.40873200185787273,0.4007597340930674,0.914031331342616,0.27185655152255433,0.08,0.48163355711942685,0.47535707888805434,0.4772234273318872,0.482837528604119,0.35743298131600326,0.3425324675324675,undersample,0.40106475571544614,0.3963377021344335,0.9146154625736904,0.5,COMPLETE
2034,0.7156549520766773,2025-11-27 12:25:05.260539,2025-11-27 12:27:23.064852,0 days 00:02:17.804313,1.277747059012227,dart,0.6031281306661898,3.5155843381263487,lossguide,0.007362343745042331,0.0004794789822358969,4,9,0.8288715639604011,1000,forest,0.6176407892664829,0.41630072824988923,0.08434482252206305,none,0.5782025661023688,4.446036874791976,9.0,0.7546412172941828,0.02313934887598612,uniform,0.6779714441483667,0.9600022242969595,,0.5567616463138851,0.5572139303482587,0.715281812899477,0.7156549520766773,0.6176407892664829,0.41630072824988923,0.08,0.52621349371862,0.5258749495914962,0.5567616463138851,0.5572139303482587,1.0,1.0,none,0.4034014986985859,0.3956342112943237,0.5782025661023688,0.5,COMPLETE
2035,0.711764705882353,2025-11-27 12:27:23.267384,2025-11-27 12:27:26.289112,0 days 00:00:03.021728,0.0011974075667252927,gbtree,0.7501941575401196,9.36699107864331,lossguide,0.007652101131348856,0.18231788047280495,2,3,29.40717020051474,900,,0.8210241077352973,0.7986090293289752,0.02135965842129748,oversample,0.6393095294532166,,9.0,0.612854329123226,,,,0.24342922099269773,,0.5513342379014021,0.5567616463138851,0.7085781433607521,0.711764705882353,0.8210241077352973,0.7986090293289752,0.02,0.49440389297813947,0.5122640170281647,0.5549930971007824,0.5581180811808119,0.9796913078797725,0.9821428571428571,oversample,0.4286377426681477,0.4412587221256782,0.6393095294532166,0.5,COMPLETE
2036,0.7156549520766773,2025-11-27 12:27:26.496836,2025-11-27 12:27:44.085061,0 days 00:00:17.588225,3.0082738409835446,dart,0.21358808760342846,3.278369850634232,depthwise,0.0002406880065602626,0.0009936146560537767,9,9,0.5058404492243007,400,forest,0.5482195411828614,0.710266973625733,0.026682411069535075,oversample,0.7415450470805698,,10.0,0.608283858699158,0.34268011336757853,uniform,0.37672647758310246,0.9050480483764891,,0.5567616463138851,0.5572139303482587,0.715281812899477,0.7156549520766773,0.5482195411828614,0.710266973625733,0.02,0.499999932476354,0.4900749584061814,0.5567616463138851,0.5572139303482587,1.0,1.0,oversample,0.4316376266184785,0.41323391878805565,0.7415450470805698,0.5,COMPLETE
2037,0.7156549520766773,2025-11-27 12:27:44.287659,2025-11-27 12:27:44.692175,0 days 00:00:00.404516,0.032915073133169756,gbtree,0.2513312692941818,1.8080344726729936,depthwise,95.12401859462643,0.00035127655958082577,2,5,3.182802720253108,200,,0.6182722828804224,0.35630709703442887,0.009811599180804764,none,0.6495696242445653,0.9728202092643117,11.0,0.8344525315917223,,,,0.5098729495248893,,0.5567616463138851,0.5572139303482587,0.715281812899477,0.7156549520766773,0.6182722828804224,0.35630709703442887,0.0,0.5489201229187305,0.5521648304236202,0.5567616463138851,0.5572139303482587,1.0,1.0,none,0.49066504749747175,0.49495285740816897,0.6495696242445653,0.5,COMPLETE
2038,0.6611733684904416,2025-11-27 12:27:44.898335,2025-11-27 12:27:51.991522,0 days 00:00:07.093187,0.006301328829370002,gbtree,0.4336211579853589,0.5125256353600727,depthwise,0.06638282877270361,0.1658853996036037,6,5,0.7614346008720952,800,,0.5468087135993157,0.3628068302787578,0.031293596586413584,none,0.9532800586397474,2.632944682572268,10.0,0.6734656170125315,,,,0.5727630101753605,,0.5355042966983266,0.535052012663953,0.6629471611421069,0.6611733684904416,0.5468087135993157,0.3628068302787578,0.02,0.5115279459678101,0.5081540245512054,0.5561674008810573,0.5566037735849056,0.8204711616571893,0.8141233766233766,none,0.4663509839354101,0.4566579998142817,0.9532800586397474,0.5,COMPLETE
2039,0.3168056164984642,2025-11-27 12:27:52.197224,2025-11-27 12:28:07.416730,0 days 00:00:15.219506,0.017679247510347215,dart,0.3132030795214049,4.515219621667268,depthwise,0.08717577234589141,0.3210868945463361,9,12,31.256459858477598,400,forest,0.753888172392779,0.37527534493164094,0.03616597341041387,undersample,0.7201049080728557,,8.0,0.7024258425791705,0.3449865820320912,uniform,0.12000128206951063,0.5686636299194083,,0.3179556761646314,0.29579375848032563,0.3488773747841105,0.3168056164984642,0.753888172392779,0.37527534493164094,0.05,0.450512600888067,0.4349052833873163,0.3723502304147465,0.3447946513849093,0.3281884646628757,0.2930194805194805,undersample,0.3025858353089408,0.27598729156441104,0.7201049080728557,0.5,COMPLETE
2040,0.7156549520766773,2025-11-27 12:28:07.618387,2025-11-27 12:28:25.933177,0 days 00:00:18.314790,8.352808479688044,dart,0.46320944851385903,2.307660181511376,lossguide,0.002111745109429483,0.024245614224527826,5,6,96.50195205683569,400,tree,0.6966697133721109,0.41987902744430017,0.08143355705533162,oversample,0.5524062884254237,,10.0,0.7802669237559113,0.3800772153296365,weighted,0.594852351585874,0.8384556939016825,,0.5567616463138851,0.5572139303482587,0.715281812899477,0.7156549520766773,0.6966697133721109,0.41987902744430017,0.08,0.5038183566643109,0.5225061311495625,0.5567616463138851,0.5572139303482587,1.0,1.0,oversample,0.4360893748238531,0.4607661873366674,0.5524062884254237,0.5,COMPLETE
2041,0.5541429197720298,2025-11-27 12:28:26.129756,2025-11-27 12:28:26.663288,0 days 00:00:00.533532,0.6313626514793637,gbtree,0.8003437706089802,2.7057021830747283,lossguide,4.13337648638954,0.13143696957069395,5,3,12.900704495937095,400,,0.869477009072724,0.2074203101470009,0.07306238195624563,undersample,0.670239260081805,,9.0,0.7740314264003553,,,,0.7281044277905622,,0.5305291723202171,0.5400271370420624,0.5378450578806767,0.5541429197720298,0.869477009072724,0.2074203101470009,0.08,0.5845809495982595,0.6165497331095998,0.5950738916256157,0.6024785510009533,0.49065800162469536,0.512987012987013,undersample,0.5501272401730799,0.5731564145762308,0.670239260081805,0.5,COMPLETE
2042,0.4516982796647552,2025-11-27 12:28:26.865728,2025-11-27 12:28:27.573085,0 days 00:00:00.707357,4.271427257760289,gbtree,0.7142161579577746,0.41768967545595337,depthwise,52.841947262540394,0.04651941036448792,3,4,5.538592495248186,500,,0.9733559647006461,0.4672397158050541,0.012160651693961145,undersample,0.8770739473688958,,9.0,0.7834537513932471,,,,0.9795118278177799,,0.4414292175486205,0.43781094527363185,0.4449438202247191,0.4516982796647552,0.9733559647006461,0.4672397158050541,0.02,0.48711645236159895,0.48352984415761213,0.49798792756539234,0.49468599033816424,0.4021121039805037,0.4155844155844156,undersample,0.43684121089540606,0.4272158510539512,0.8770739473688958,0.5,COMPLETE
2043,0.13516896120150187,2025-11-27 12:28:27.776867,2025-11-27 12:28:28.460581,0 days 00:00:00.683714,10.600501845733113,gbtree,0.6115147013635618,5.111583332462218,lossguide,88.08558988337627,0.0006684678654836029,4,3,0.23447236619879888,700,,0.8948270414108128,0.8736654726479072,0.0924296110485215,undersample,0.5138258555901637,,5.0,0.8173379518107362,,,,0.5910680883140629,,0.3853459972862958,0.3749434644957033,0.16574585635359115,0.13516896120150187,0.8948270414108128,0.8736654726479072,0.08,0.5015911955846027,0.4941995330937192,0.3391959798994975,0.29508196721311475,0.10966693744922827,0.08766233766233766,undersample,0.3885546013693861,0.3720330678004325,0.5138258555901637,0.5,COMPLETE
2044,0.7156549520766773,2025-11-27 12:28:28.665017,2025-11-27 12:28:29.403125,0 days 00:00:00.738108,0.02389728454452468,gbtree,0.8755151231877578,2.1184696844819317,lossguide,4.955186087691825,0.0011398145849035271,2,3,49.68056491983307,500,,0.5896417608989203,0.5417422806144175,0.027108715356823743,none,0.9397450729227437,1.1796070776528453,5.0,0.6850472122912431,,,,0.4953653214352926,,0.5567616463138851,0.5572139303482587,0.715281812899477,0.7156549520766773,0.5896417608989203,0.5417422806144175,0.02,0.6989752569023641,0.6986827910629401,0.5567616463138851,0.5572139303482587,1.0,1.0,none,0.5851046104875743,0.57686083069127,0.9397450729227437,0.5,COMPLETE
2045,0.0,2025-11-27 12:28:29.608247,2025-11-27 12:28:30.063814,0 days 00:00:00.455567,0.0012405552408111971,gbtree,0.648630585071307,9.622235482895821,depthwise,0.0005115951311548123,0.006414542677165338,6,12,4.88512283607777,300,,0.6004659958445632,0.5556097532846578,0.06710662329055557,undersample,0.7207226880514526,,5.0,0.8901985651643372,,,,0.7681638262112154,,0.44323835368611486,0.4427860696517413,0.0,0.0,0.6004659958445632,0.5556097532846578,0.08,0.5567616463138851,0.5572139303482587,0.0,0.0,0.0,0.0,undersample,0.5,0.5,0.7207226880514526,0.5,COMPLETE
2046,0.7156549520766773,2025-11-27 12:28:30.268515,2025-11-27 12:29:29.741860,0 days 00:00:59.473345,0.13085709693015335,dart,0.5349891095779309,3.1967975644496507,lossguide,0.00010898412205428017,0.00016282626114806745,6,12,0.3056516530006453,700,tree,0.9703615267061219,0.2143587154688395,0.05397318654423397,none,0.6308233398898496,0.944183217271009,6.0,0.6425434304474463,0.1317511568819867,weighted,0.2876813221011006,0.7125077449219324,,0.5567616463138851,0.5572139303482587,0.715281812899477,0.7156549520766773,0.9703615267061219,0.2143587154688395,0.05,0.6325826587088422,0.6190486582855953,0.5567616463138851,0.5572139303482587,1.0,1.0,none,0.6152655050647391,0.6064016422800897,0.6308233398898496,0.5,COMPLETE
2047,0.5192644483362522,2025-11-27 12:29:29.936451,2025-11-27 12:30:32.506108,0 days 00:01:02.569657,1.0126211712476396,dart,0.7830863245530322,1.790887670004172,lossguide,0.005957200226602143,0.004944426112577236,6,3,22.34659758743376,700,tree,0.6091442460126928,0.7829454082810883,0.04674061396322578,undersample,0.7034313125269692,,12.0,0.8334787266571033,0.18939746072405622,weighted,0.5566167702936737,0.4542677467208194,,0.5241971958389868,0.5033921302578019,0.5381913959613697,0.5192644483362522,0.6091442460126928,0.7829454082810883,0.05,0.5230734847573196,0.5152412739893608,0.5854823304680038,0.5636882129277566,0.4979691307879773,0.48133116883116883,undersample,0.5103595052968385,0.49636688643328075,0.7034313125269692,0.5,COMPLETE
2048,0.7156549520766773,2025-11-27 12:30:32.705906,2025-11-27 12:31:57.680978,0 days 00:01:24.975072,72.54716984347026,dart,0.26277943707749407,5.2762763288044665,lossguide,0.7661156747637378,0.026083069089441996,4,8,32.57468184987444,800,forest,0.6399199415408088,0.29361184252627115,0.04387024701366811,oversample,0.511838509544494,,7.0,0.6419102490531756,0.021714080487393317,weighted,0.6545930335004665,0.77623701919904,,0.5567616463138851,0.5572139303482587,0.715281812899477,0.7156549520766773,0.6399199415408088,0.29361184252627115,0.05,0.5567616463138851,0.5572139303482587,0.5567616463138851,0.5572139303482587,1.0,1.0,oversample,0.5,0.5,0.511838509544494,0.5,COMPLETE
2049,0.7156549520766773,2025-11-27 12:31:57.888384,2025-11-27 12:31:58.335478,0 days 00:00:00.447094,4.758663575153697,gbtree,0.3966433690920327,5.395282826303712,lossguide,0.261132743243581,0.001969519768581429,9,5,0.4091383178364572,300,,0.596980305486812,0.7665422293574096,0.002342707135716826,oversample,0.5037199143202554,,10.0,0.7456027660611371,,,,0.7564116198595752,,0.5567616463138851,0.5572139303482587,0.715281812899477,0.7156549520766773,0.596980305486812,0.7665422293574096,0.0,0.5758508512805184,0.5501977620094178,0.5567616463138851,0.5572139303482587,1.0,1.0,oversample,0.5532709428206701,0.5068935469535572,0.5037199143202554,0.5,COMPLETE
2050,0.7156549520766773,2025-11-27 12:31:58.537847,2025-11-27 12:31:59.361153,0 days 00:00:00.823306,7.491340899500442,gbtree,0.44108006684324946,4.287951528237243,depthwise,0.00039431771877611245,0.00012880871495653216,4,6,79.50219387298645,800,,0.666924283537345,0.3701096438025158,0.024558338126439927,none,0.6107584870826622,2.164579135108345,6.0,0.87873892225048,,,,0.8788834556711285,,0.5567616463138851,0.5572139303482587,0.715281812899477,0.7156549520766773,0.666924283537345,0.3701096438025158,0.02,0.5129655203193525,0.5217848749993597,0.5567616463138851,0.5572139303482587,1.0,1.0,none,0.4153471542963245,0.4272295311940358,0.6107584870826622,0.5,COMPLETE
2051,,2025-11-27 12:31:59.568852,2025-11-27 12:32:07.074215,0 days 00:00:07.505363,0.10713247030625014,dart,0.38558949515771695,6.521096151384587,depthwise,0.007389453688357245,0.033234735404217015,1,7,5.826495349727358,900,tree,0.5567985105794118,0.8116022780899497,0.026540702205610858,undersample,0.6126328155696323,,9.0,0.7384940623527086,0.0891373709679289,weighted,0.4963677100798997,0.26115892852958444,,,,,,,,,,,,,,,,,,,,FAIL
2052,0.7156549520766773,2025-11-30 11:28:51.582916,2025-11-30 11:29:55.355525,0 days 00:01:03.772609,60.53082080079022,dart,0.8333800304661316,4.375872112626925,lossguide,22.420123713724433,0.0036905100721932025,10,8,8.663279761354557,700,forest,0.819960510663762,0.30034730118633246,0.07991585642167237,undersample,0.989309171116382,,9.0,0.9306341209673543,0.03551802909894347,weighted,0.07841636973138665,0.5067532150606222,,0.5567616463138851,0.5572139303482587,0.715281812899477,0.7156549520766773,0.819960510663762,0.30034730118633246,0.08,0.5567616463138851,0.5572139303482587,0.5567616463138851,0.5572139303482587,1.0,1.0,undersample,0.5,0.5,0.989309171116382,0.5,COMPLETE
2053,0.7156549520766773,2025-11-30 11:29:56.154232,2025-11-30 11:29:56.892572,0 days 00:00:00.738340,0.5030416925289531,gbtree,0.7454562392827868,6.176354970758771,lossguide,0.47051593504005473,0.012665435463447151,7,7,0.11385953381489414,800,,0.6818553854713113,0.5991377392925157,0.06667667154456677,none,0.5301127358146349,1.0337091375281589,12.0,0.7535105297118121,,,,0.9549984628116994,,0.5567616463138851,0.5572139303482587,0.715281812899477,0.7156549520766773,0.6818553854713113,0.5991377392925157,0.08,0.4698176658809662,0.4755595874192209,0.5567616463138851,0.5572139303482587,1.0,1.0,none,0.32479525522637975,0.3341581490521735,0.5301127358146349,0.5,COMPLETE
2054,0.42857142857142855,2025-11-30 11:29:57.672310,2025-11-30 11:30:10.044006,0 days 00:00:12.371696,0.0004594633206288106,dart,0.31054636107889105,2.4442559200160274,lossguide,0.0008991196763419829,0.0008648046978293341,9,9,2.5057187257477667,300,forest,0.6480700987610725,0.28310940326797085,0.07392635793983017,undersample,0.802422759872523,,8.0,0.7112941127878916,0.048550637896530635,weighted,0.7541504167489236,0.7250636715722187,,0.40615106286748076,0.42107643600180916,0.4151447661469933,0.42857142857142855,0.6480700987610725,0.28310940326797085,0.08,0.46547804508296875,0.481550805781919,0.45956607495069035,0.47619047619047616,0.3785540211210398,0.38961038961038963,undersample,0.36831471012450473,0.3926042675404268,0.802422759872523,0.5,COMPLETE
2055,0.7156549520766773,2025-11-30 11:30:10.866864,2025-11-30 11:30:57.684610,0 days 00:00:46.817746,0.00815480751951184,dart,0.30543828992351374,5.759464955561793,depthwise,37.65105808785361,0.00861943610441284,2,5,0.1913469447807097,700,tree,0.7861259528954367,0.3561571428484328,0.09621885451174383,oversample,0.8675970110612974,,8.0,0.9334621540309447,0.2932564674050416,uniform,0.0180967915687442,0.7339283039709454,,0.5567616463138851,0.5572139303482587,0.715281812899477,0.7156549520766773,0.7861259528954367,0.3561571428484328,0.1,0.5285324671081616,0.5407173600492979,0.5567616463138851,0.5572139303482587,1.0,1.0,oversample,0.44419461529534643,0.46410538516641686,0.8675970110612974,0.5,COMPLETE
2056,0.4551282051282051,2025-11-30 11:30:58.462688,2025-11-30 11:30:58.984723,0 days 00:00:00.522035,1.4295177111669275,gbtree,0.6010595055413619,5.812728726358587,depthwise,19.516959959177033,0.002928618772873263,4,11,43.98550589524232,400,,0.8090077144994208,0.5001380906620363,0.0019193198309333526,undersample,0.8031966070639622,,7.0,0.6474159224778575,,,,0.7802034238557125,,0.35956580732700133,0.38489371325192223,0.42764753435731606,0.4551282051282051,0.8090077144994208,0.5001380906620363,0.08,0.44324643942229613,0.45772070247289015,0.4255832662912309,0.44936708860759494,0.429731925264013,0.461038961038961,undersample,0.22531250518078882,0.245580485653264,0.8031966070639622,0.5,COMPLETE
2057,0.0,2025-11-30 11:30:59.761172,2025-11-30 11:32:03.825641,0 days 00:01:04.064469,0.04122774218913467,dart,0.8449551912368687,8.96546595851063,depthwise,0.01604616376673368,0.025829169094729203,10,9,1.9690434802692807,700,forest,0.8487143865722818,0.5174798778746481,0.08480082293222345,none,0.5619099914247208,0.5863230931198441,11.0,0.8527194598146217,0.3571206497745557,weighted,0.8989623059110798,0.9135386840125377,,0.44323835368611486,0.4427860696517413,0.0,0.0,0.8487143865722818,0.5174798778746481,0.08,0.5567616463138851,0.5572139303482587,0.0,0.0,0.0,0.0,none,0.5,0.5,0.5619099914247208,0.5,COMPLETE
2058,0.48300536672629696,2025-11-30 11:32:04.590784,2025-11-30 11:32:05.002997,0 days 00:00:00.412213,0.0015848171030417315,gbtree,0.8349581626859366,5.210366062041293,lossguide,0.00021184973741527021,0.05014333253307727,10,6,0.3272570655120269,200,,0.6189464106872543,0.8539497985473556,0.003183892953130785,undersample,0.8522072009617664,,9.0,0.8148880845880635,,,,0.2148174355684912,,0.4839439167797377,0.47715965626413387,0.4894854586129754,0.48300536672629696,0.6189464106872543,0.8539497985473556,0.08,0.5397693036894822,0.5385190310805981,0.5448207171314741,0.5378486055776892,0.44435418359057677,0.4383116883116883,undersample,0.5059782158192279,0.509399085337543,0.8522072009617664,0.5,COMPLETE
2059,0.6518420179223365,2025-11-30 11:32:05.788799,2025-11-30 11:32:22.468695,0 days 00:00:16.679896,0.08765018795171545,dart,0.4034851854163144,9.443723899839336,lossguide,2.7371889009007284,0.0005973181798679008,3,6,0.3618920291309286,400,forest,0.8315391015500504,0.38432566371600546,0.053657921110872225,undersample,0.7268484222780227,,11.0,0.607227849813005,0.34817174440772974,uniform,0.33997665536323285,0.3819317023786586,,0.5305291723202171,0.5255540479421077,0.6571994715984147,0.6518420179223365,0.8315391015500504,0.38432566371600546,0.08,0.5685348180255687,0.5611807203049043,0.55370061213133,0.5513756316676025,0.8082859463850528,0.797077922077922,undersample,0.5006113330791293,0.4819181712057095,0.7268484222780227,0.5,COMPLETE
2060,0.7156549520766773,2025-11-30 11:32:23.244069,2025-11-30 11:33:23.096674,0 days 00:00:59.852605,0.00129961784452684,dart,0.7499906211102523,2.7354203481563575,lossguide,6.141592588083613,0.021212163831303317,8,11,41.49081505976884,700,forest,0.5587659279810165,0.5621653750078799,0.046357542436481075,oversample,0.6870849901671128,,10.0,0.6462238372208037,0.12697082129751291,uniform,0.1919807796307338,0.9622333255775557,,0.5567616463138851,0.5572139303482587,0.715281812899477,0.7156549520766773,0.5587659279810165,0.5621653750078799,0.08,0.5601325844408934,0.5778909147444442,0.5567616463138851,0.5572139303482587,1.0,1.0,oversample,0.4814088429847975,0.5049012210975949,0.6870849901671128,0.5,COMPLETE
2061,0.7156549520766773,2025-11-30 11:33:23.875803,2025-11-30 11:33:34.904991,0 days 00:00:11.029188,3.1044289096576936,dart,0.26673794835361486,9.40431945252813,lossguide,3.907972714791352,0.006387126866226349,10,4,1.166375029847802,300,tree,0.9382526226582955,0.43671126628579193,0.02817301057539491,none,0.8925764560115689,4.7475018656987675,6.0,0.9365495540895244,0.14607376339627443,uniform,0.21674590192390214,0.9229757917967467,,0.5567616463138851,0.5572139303482587,0.715281812899477,0.7156549520766773,0.9382526226582955,0.43671126628579193,0.08,0.52621349371862,0.5258749495914962,0.5567616463138851,0.5572139303482587,1.0,1.0,none,0.4034014986985859,0.3956342112943237,0.8925764560115689,0.5,COMPLETE
2062,0.6011635423400129,2025-11-30 11:33:35.699654,2025-11-30 11:33:39.336907,0 days 00:00:03.637253,0.0001200663052709496,gbtree,0.31851268875853206,8.489435553129182,depthwise,0.5096360623323918,0.17138190411780674,5,9,0.7569389501910003,900,,0.755659491273228,0.3570219202823175,0.03685846061296175,undersample,0.8197362581993618,,11.0,0.6342455695729119,,,,0.4777868143457757,,0.45454545454545453,0.4418815015829941,0.6117192530585963,0.6011635423400129,0.755659491273228,0.3570219202823175,0.08,0.5292582426627388,0.5183561672060092,0.5066666666666667,0.49946294307196565,0.7717303005686433,0.7548701298701299,undersample,0.40036721431058214,0.3712777582478808,0.8197362581993618,0.5,COMPLETE
