number,value,datetime_start,datetime_complete,duration,params_alpha,params_booster,params_colsample_bytree,params_gamma,params_grow_policy,params_lambda,params_learning_rate,params_max_delta_step,params_max_depth,params_min_child_weight,params_n_estimators,params_normalize_type,params_params_feature_fraction,params_params_labeled_ratio,params_params_missing_rate,params_params_resampling,params_params_sample_rows,params_params_scale_pos_weight,params_params_selftrain_max_iter,params_params_selftrain_threshold,params_rate_drop,params_sample_type,params_skip_drop,params_subsample,params_user_attrs_decision_threshold,user_attrs_acc_test,user_attrs_acc_val,user_attrs_f1_test,user_attrs_f1_val,user_attrs_feature_fraction,user_attrs_labeled_ratio,user_attrs_missing_rate,user_attrs_pr_auc_test,user_attrs_pr_auc_val,user_attrs_prec_test,user_attrs_prec_val,user_attrs_rec_test,user_attrs_rec_val,user_attrs_resampling_strategy,user_attrs_roc_auc_test,user_attrs_roc_auc_val,user_attrs_sample_rows,user_attrs_user_attrs_decision_threshold,state
696,0.7156549520766773,2025-11-26 20:47:45.213369,2025-11-26 20:47:46.264590,0 days 00:00:01.051221,0.001706292203057627,gbtree,0.972881701846486,5.688996605041903,lossguide,0.0002951752827062984,0.00010375073776672,6,12,5.414426084335757,1000,,0.5280768286914651,0.13385615629989533,0.09990420873308198,none,0.9503421118495494,0.7620087200960852,5.0,0.7197154754749321,,,,0.30749309834450655,0.08555781054715456,0.5567616463138851,0.5572139303482587,0.715281812899477,0.7156549520766773,0.5280768286914651,0.13385615629989533,0.1,0.823981054849323,0.8447163245870254,0.5567616463138851,0.5572139303482587,1.0,1.0,none,0.7841940350470002,0.7987369499754586,0.9503421118495494,0.08555781054715456,COMPLETE
697,0.7156549520766773,2025-11-26 20:47:46.443059,2025-11-26 20:53:37.400216,0 days 00:05:50.957157,0.10832298846399438,dart,0.8527352493925855,3.0689153552533655,depthwise,0.00042422129866328,0.008902856769588382,4,10,7.745721673959896,1000,forest,0.5319462712554275,0.3369061926962502,0.08120327202818503,none,0.9553431749068064,2.366968110335878,7.0,0.7852393893284714,0.19516941010166564,uniform,0.2452285361015497,0.290848273066321,0.22579071930262554,0.5567616463138851,0.5572139303482587,0.715281812899477,0.7156549520766773,0.5319462712554275,0.3369061926962502,0.08,0.5472847022587328,0.5238191173761348,0.5567616463138851,0.5572139303482587,1.0,1.0,none,0.4805339113712097,0.4435209198360373,0.9553431749068064,0.22579071930262554,COMPLETE
698,0.7156549520766773,2025-11-26 20:53:37.578189,2025-11-26 20:55:23.225398,0 days 00:01:45.647209,0.13594685010753155,dart,0.8684265605797702,3.0004235632232374,lossguide,3.802853206863889,0.00511013604582524,7,7,81.62832074829937,1000,tree,0.9013173572198215,0.8995573285391287,0.0868739522467861,oversample,0.9673945337059098,,12.0,0.9403469025851915,0.43020816214723295,weighted,0.27717622107114853,0.7033688900879354,0.48518527574642395,0.5567616463138851,0.5572139303482587,0.715281812899477,0.7156549520766773,0.9013173572198215,0.8995573285391287,0.08,0.4514988490572708,0.447345189487107,0.5567616463138851,0.5572139303482587,1.0,1.0,oversample,0.3511948971302575,0.34550561797752805,0.9673945337059098,0.48518527574642395,COMPLETE
699,0.7156549520766773,2025-11-26 20:55:23.389435,2025-11-26 20:55:23.912656,0 days 00:00:00.523221,0.00011300624620041076,gbtree,0.7855938119763033,4.921859611433318,lossguide,1.4071474207036139,0.03299020393610164,10,10,1.093644819672343,200,,0.8264349793894924,0.3229794110738893,0.08117405485699605,none,0.6505085734020254,1.0021225033441272,10.0,0.7279293762333141,,,,0.47066113803476456,0.06312349948778238,0.5567616463138851,0.5572139303482587,0.715281812899477,0.7156549520766773,0.8264349793894924,0.3229794110738893,0.08,0.47783443060458436,0.4833953411735807,0.5567616463138851,0.5572139303482587,1.0,1.0,none,0.4008239526517349,0.40311517517212103,0.6505085734020254,0.06312349948778238,COMPLETE
700,0.7156549520766773,2025-11-26 20:55:24.075400,2025-11-26 20:56:01.284026,0 days 00:00:37.208626,0.00466204784921056,dart,0.3916226839504182,9.701176730282231,lossguide,0.002722345611717413,0.002664154406958319,4,3,3.4031720714832923,600,tree,0.6471245666850355,0.3500163624050882,0.0631759468377726,oversample,0.9395951800574358,,10.0,0.6300364592313035,0.28087755970931527,weighted,0.19367465071645562,0.8308401917930501,0.1148493684925105,0.5567616463138851,0.5572139303482587,0.715281812899477,0.7156549520766773,0.6471245666850355,0.3500163624050882,0.05,0.4885020350545127,0.49265287661876145,0.5567616463138851,0.5572139303482587,1.0,1.0,oversample,0.3109227606558464,0.3275937545600467,0.9395951800574358,0.1148493684925105,COMPLETE
701,0.7156549520766773,2025-11-26 20:56:01.464398,2025-11-26 20:56:02.308424,0 days 00:00:00.844026,25.545927855297265,gbtree,0.9908430579357226,8.23040854185538,lossguide,5.7373886970438095,0.07659449668756589,6,9,24.409789515961194,600,,0.9572608992688271,0.8570286387024347,0.09871074212760914,oversample,0.8146377438510658,,12.0,0.866632961858462,,,,0.6861365419844419,0.5476616966565638,0.5567616463138851,0.5572139303482587,0.715281812899477,0.7156549520766773,0.9572608992688271,0.8570286387024347,0.1,0.5567616463138851,0.5572139303482587,0.5567616463138851,0.5572139303482587,1.0,1.0,oversample,0.5,0.5,0.8146377438510658,0.5476616966565638,COMPLETE
702,0.5820952380952381,2025-11-26 20:56:02.479969,2025-11-26 20:56:03.531453,0 days 00:00:01.051484,5.985376802204347,gbtree,0.7490773227650628,0.8198912653022861,lossguide,7.316096360549698,0.06536448018935245,4,12,6.5242868832204115,600,,0.805762787707824,0.49099525324653015,0.07563273462857432,oversample,0.7382692777540641,,9.0,0.8651307967400512,,,,0.7630484976233105,0.5326280000911614,0.4843962008141113,0.5038444142921755,0.5618754803996926,0.5820952380952381,0.805762787707824,0.49099525324653015,0.08,0.5069958343194487,0.5257482090515371,0.5331874544128373,0.548456568557071,0.5938261575954509,0.6201298701298701,oversample,0.4478613703808087,0.47360562063064615,0.7382692777540641,0.5326280000911614,COMPLETE
703,0.7156549520766773,2025-11-26 20:56:03.720086,2025-11-26 20:56:04.605539,0 days 00:00:00.885453,0.161798074240631,gbtree,0.3271726179318737,5.13350924517473,lossguide,0.005876661571915629,0.18615308433513728,0,3,0.7247265586741575,700,,0.8597635166721833,0.275389082966061,0.0008117199337882713,none,0.9420537004778702,1.7526055175077335,10.0,0.8188671403925852,,,,0.8228517915774997,0.22169036740978176,0.5567616463138851,0.5572139303482587,0.715281812899477,0.7156549520766773,0.8597635166721833,0.275389082966061,0.0,0.6424356948206464,0.6281055137806278,0.5567616463138851,0.5572139303482587,1.0,1.0,none,0.60450479948275,0.5774851425387685,0.9420537004778702,0.22169036740978176,COMPLETE
704,0.7156549520766773,2025-11-26 20:56:04.776460,2025-11-26 20:57:15.231683,0 days 00:01:10.455223,59.038301047506984,dart,0.6580548807131268,3.9063993802082293,lossguide,22.470930313473392,0.016940287015243787,9,8,10.836160021743773,800,forest,0.9254423012958337,0.08287769846512595,0.08691844666746744,oversample,0.9059103585228861,,9.0,0.9128325452973177,0.30126335197171006,uniform,0.5198195181910956,0.40063093743095224,0.5475082731715422,0.5567616463138851,0.5572139303482587,0.715281812899477,0.7156549520766773,0.9254423012958337,0.08287769846512595,0.08,0.5567616463138851,0.5572139303482587,0.5567616463138851,0.5572139303482587,1.0,1.0,oversample,0.5,0.5,0.9059103585228861,0.5475082731715422,COMPLETE
705,0.00963855421686747,2025-11-26 20:57:15.402072,2025-11-26 20:57:16.138672,0 days 00:00:00.736600,0.3885497993963728,gbtree,0.8286352518892399,4.829837114536427,lossguide,0.30159387824267064,0.26005889076391936,6,10,27.63201416929428,500,,0.6798788781342283,0.6863023593634425,0.07685306938108485,oversample,0.8281336676442119,,10.0,0.9178560699069166,,,,0.6569123053450034,0.6590560096730778,0.44369063772048845,0.4423337856173677,0.00966183574879227,0.00963855421686747,0.6798788781342283,0.6863023593634425,0.08,0.5372204682218782,0.5344963969027214,0.5454545454545454,0.46153846153846156,0.00487408610885459,0.00487012987012987,oversample,0.4942484954989307,0.4851247131316079,0.8281336676442119,0.6590560096730778,COMPLETE
706,0.7156549520766773,2025-11-26 20:57:16.310593,2025-11-26 20:57:17.356405,0 days 00:00:01.045812,0.002643430905160275,gbtree,0.32293036252121177,5.03673361507623,lossguide,3.6724797434173264,0.00015386210376896472,0,9,0.18952964631561725,1000,,0.7529104817769809,0.716398283733514,0.011062301488585074,undersample,0.5734598026595177,,8.0,0.7632653803891397,,,,0.349122617899643,0.2018762372266595,0.5567616463138851,0.5572139303482587,0.715281812899477,0.7156549520766773,0.7529104817769809,0.716398283733514,0.02,0.44812134481531624,0.4433754026364433,0.5567616463138851,0.5572139303482587,1.0,1.0,undersample,0.35356189592002524,0.3416071926031068,0.5734598026595177,0.2018762372266595,COMPLETE
707,0.7156549520766773,2025-11-26 20:57:17.524717,2025-11-26 20:58:46.449719,0 days 00:01:28.925002,0.003184384904960027,dart,0.9968387008203254,2.086887638108516,depthwise,0.20323331089122923,0.017714481568371777,3,9,75.96472928949125,900,forest,0.582103823114329,0.07611139097151237,0.02585104620158111,none,0.5115620355161017,1.2532520667903702,8.0,0.9225678621758459,0.17061244046606974,weighted,0.005352182057494714,0.7809870361011091,0.357396571188283,0.5567616463138851,0.5572139303482587,0.715281812899477,0.7156549520766773,0.582103823114329,0.07611139097151237,0.02,0.5567616463138851,0.5572139303482587,0.5567616463138851,0.5572139303482587,1.0,1.0,none,0.5,0.5,0.5115620355161017,0.357396571188283,COMPLETE
708,0.7156549520766773,2025-11-26 20:58:46.624571,2025-11-26 20:59:29.639720,0 days 00:00:43.015149,47.906037296361646,dart,0.6544759733199664,9.928450553010808,lossguide,3.494250752434312,0.0002465737777134007,4,4,0.1971301955736603,600,forest,0.7425628932166157,0.5144933243355106,0.052282885139591576,none,0.5253629008476036,2.894388696310022,12.0,0.7010294670097091,0.3355568312496388,weighted,0.7496048744284101,0.6443007039973287,0.1612766532841882,0.5567616463138851,0.5572139303482587,0.715281812899477,0.7156549520766773,0.7425628932166157,0.5144933243355106,0.05,0.5567616463138851,0.5572139303482587,0.5567616463138851,0.5572139303482587,1.0,1.0,none,0.5,0.5,0.5253629008476036,0.1612766532841882,COMPLETE
709,0.7189813443885105,2025-11-26 20:59:29.813507,2025-11-26 20:59:49.736057,0 days 00:00:19.922550,0.031097114532898436,dart,0.9011879355842237,1.323424544252233,lossguide,0.003610622698246192,0.04897622042484966,4,4,1.069749201217905,200,forest,0.916095102829875,0.7006377527328693,0.08095522941501124,undersample,0.6298976524215248,,6.0,0.7190983589908043,0.1792050068267052,weighted,0.7246757873155211,0.2445654824567936,0.2636298623020884,0.5639981908638625,0.5707824513794663,0.7144549763033176,0.7189813443885105,0.916095102829875,0.7006377527328693,0.08,0.6037330666023355,0.6379589127792256,0.5622377622377622,0.565967365967366,0.9796913078797725,0.9853896103896104,undersample,0.5880041943666174,0.6080818122123025,0.6298976524215248,0.2636298623020884,COMPLETE
710,0.6685015290519878,2025-11-26 20:59:49.909469,2025-11-26 21:00:29.492868,0 days 00:00:39.583399,0.1611794039984682,dart,0.8633743314509563,1.06098274323215,lossguide,0.04431784580394762,0.045613457881527,6,3,1.28222416653489,300,forest,0.9773878705087233,0.5500478156040691,0.07895428029869231,undersample,0.7697939124711612,,6.0,0.68262433165633,0.2801335694362369,weighted,0.5790542465706283,0.2316452818495487,0.37983974441407525,0.5042966983265491,0.5097241067390321,0.6631837738168408,0.6685015290519878,0.9773878705087233,0.5500478156040691,0.08,0.42348974166207554,0.41849062566759143,0.5333662876915473,0.5363101079489696,0.8765231519090171,0.8871753246753247,undersample,0.29014572522754023,0.2788012549248504,0.7697939124711612,0.37983974441407525,COMPLETE
711,0.0,2025-11-26 21:00:29.664872,2025-11-26 21:02:37.754328,0 days 00:02:08.089456,0.011327629700345237,dart,0.7413412626927458,2.833407314289703,lossguide,0.0003870106206858102,0.0001852134695149144,5,11,6.94016488762253,1000,forest,0.5308443032813384,0.07065365970736595,0.09456213564148631,none,0.7516181336135926,0.7145247377283616,10.0,0.7425911955544968,0.17539258135709873,weighted,0.7515115762131347,0.36444833224981543,0.524662874992755,0.44323835368611486,0.4427860696517413,0.0,0.0,0.5308443032813384,0.07065365970736595,0.1,0.47982797839023517,0.46388401251172384,0.0,0.0,0.0,0.0,none,0.4215172665329332,0.39299933340408316,0.7516181336135926,0.524662874992755,COMPLETE
712,0.7156549520766773,2025-11-26 21:02:37.940320,2025-11-26 21:02:43.676461,0 days 00:00:05.736141,11.513331307767807,dart,0.8645419701611798,2.1950555607661557,lossguide,0.0019339555525513096,0.02661206702571505,1,6,0.706781872358102,200,forest,0.9783076119264346,0.757859296650423,0.08062938972946737,undersample,0.6516161327741539,,9.0,0.7607660071792895,0.15959116996672548,weighted,0.828310380790988,0.47710660307992314,0.24997383740998966,0.5567616463138851,0.5572139303482587,0.715281812899477,0.7156549520766773,0.9783076119264346,0.757859296650423,0.08,0.6861397102220206,0.6468134003036186,0.5567616463138851,0.5572139303482587,1.0,1.0,undersample,0.6699261426747791,0.6375666595916852,0.6516161327741539,0.24997383740998966,COMPLETE
713,0.6972477064220184,2025-11-26 21:02:43.847464,2025-11-26 21:03:38.196132,0 days 00:00:54.348668,0.15854351619646614,dart,0.9381207888432195,0.5269174739077235,lossguide,0.0012928824138451988,0.16433853751778785,6,4,1.0587657730344402,300,forest,0.9250222833518894,0.8893583619568569,0.05918091370213422,undersample,0.5212051323089042,,8.0,0.6730191426625488,0.19172957739689186,weighted,0.6464600331518978,0.2598516191135333,0.30292361032199033,0.5526910900045229,0.5522388059701493,0.6955986457371499,0.6972477064220184,0.9250222833518894,0.8893583619568569,0.05,0.5825423662709617,0.5404232411715433,0.5599603567888999,0.5593719332679097,0.9179528838342811,0.9253246753246753,undersample,0.5366675508546229,0.4992305957576642,0.5212051323089042,0.30292361032199033,COMPLETE
714,0.7156549520766773,2025-11-26 21:03:38.369502,2025-11-26 21:03:39.464601,0 days 00:00:01.095099,4.76217518358457,gbtree,0.7101373765186983,4.4608359621123235,lossguide,0.003699385112338993,0.005199777007097812,3,5,1.8451885187409196,600,,0.7016391359410632,0.5493903461764257,0.09326069090773009,none,0.8190524869214398,1.936670053144851,5.0,0.665530142700979,,,,0.2651262664297207,0.09643265176660137,0.5567616463138851,0.5572139303482587,0.715281812899477,0.7156549520766773,0.7016391359410632,0.5493903461764257,0.1,0.6175841242899855,0.6083124340118315,0.5567616463138851,0.5572139303482587,1.0,1.0,none,0.5791860773553937,0.564561970205484,0.8190524869214398,0.09643265176660137,COMPLETE
715,0.7156549520766773,2025-11-26 21:03:39.636460,2025-11-26 21:03:40.283531,0 days 00:00:00.647071,0.036324799562944446,gbtree,0.7035355809220281,1.3051325474178337,lossguide,0.08103936865538836,0.001120576246729374,4,3,0.24516526265664293,200,,0.8639680415945219,0.7120954339301478,0.09852953412027955,oversample,0.6589734973320123,,7.0,0.7725941047330791,,,,0.24357357550482844,0.24588312164219595,0.5567616463138851,0.5572139303482587,0.715281812899477,0.7156549520766773,0.8639680415945219,0.7120954339301478,0.1,0.5480285342824558,0.5344763600096432,0.5567616463138851,0.5572139303482587,1.0,1.0,oversample,0.4963038180341186,0.4867310932173037,0.6589734973320123,0.24588312164219595,COMPLETE
716,0.5179319981369352,2025-11-26 21:03:40.454758,2025-11-26 21:04:00.871933,0 days 00:00:20.417175,0.0014086128375968533,dart,0.988727710608605,0.21001537028082762,lossguide,0.0004076745764856103,0.2190003569681162,2,5,0.8095084084648619,200,forest,0.8097985511186171,0.560486683369961,0.09812923681045337,undersample,0.5043227905479586,,6.0,0.7382729388819427,0.17699201103556483,weighted,0.5804266884130371,0.31911184619436883,0.58445983919029,0.5210312075983717,0.5318860244233379,0.5053713218122373,0.5179319981369352,0.8097985511186171,0.560486683369961,0.1,0.6130633038141047,0.5976680432769008,0.5945054945054945,0.6076502732240437,0.4394800974817222,0.4512987012987013,undersample,0.5433926291881497,0.5420465323746734,0.5043227905479586,0.58445983919029,COMPLETE
717,0.0,2025-11-26 21:04:01.060756,2025-11-26 21:06:04.401496,0 days 00:02:03.340740,0.007469487752787426,dart,0.37466238065724045,5.599429103792269,depthwise,0.0003545194540817507,0.00042011651148920147,4,10,1.1457599110854615,1000,forest,0.7480380873683128,0.5948989050721442,0.0034488132139218336,oversample,0.9897172079214738,,6.0,0.6450760174969884,0.2525432283481599,weighted,0.7333979627774457,0.7870373122060268,0.6040671342919094,0.44323835368611486,0.4427860696517413,0.0,0.0,0.7480380873683128,0.5948989050721442,0.0,0.5679626106615345,0.5723638848066945,0.0,0.0,0.0,0.0,oversample,0.5290633962764635,0.517954147486834,0.9897172079214738,0.6040671342919094,COMPLETE
718,0.7156549520766773,2025-11-26 21:06:04.575463,2025-11-26 21:06:06.606903,0 days 00:00:02.031440,0.009707899526539665,gbtree,0.7827861138788121,1.1608799102004654,lossguide,11.535234128719958,0.000577135907247565,4,10,1.6333542309316729,600,,0.7801848230633935,0.3963125380542773,0.061580884078184725,oversample,0.7616306637666407,,7.0,0.7077898482175001,,,,0.7356377506256272,0.4623189252014051,0.5567616463138851,0.5572139303482587,0.715281812899477,0.7156549520766773,0.7801848230633935,0.3963125380542773,0.05,0.5512167847663796,0.5412034180059494,0.5567616463138851,0.5572139303482587,1.0,1.0,oversample,0.460506639698934,0.44653635435045036,0.7616306637666407,0.4623189252014051,COMPLETE
719,0.030039525691699605,2025-11-26 21:06:06.781220,2025-11-26 21:06:08.611664,0 days 00:00:01.830444,0.0011500272590224962,gbtree,0.9943721049629723,3.007911493476007,lossguide,0.005961615714367464,0.008008710653901368,3,3,1.818860201851229,500,,0.6895276791370493,0.3340722052305177,0.09754193898899245,oversample,0.7457709527564965,,5.0,0.7273048279806811,,,,0.2632025764272736,0.722371544824955,0.44323835368611486,0.4450474898236092,0.017557861133280128,0.030039525691699605,0.6895276791370493,0.3340722052305177,0.1,0.5595527216658794,0.5665097123633431,0.5,0.5757575757575758,0.008935824532900082,0.015422077922077922,oversample,0.5266984698022182,0.5248058249207381,0.7457709527564965,0.722371544824955,COMPLETE
720,0.7156549520766773,2025-11-26 21:06:08.782806,2025-11-26 21:06:09.691938,0 days 00:00:00.909132,1.7399307044532306,gbtree,0.8057163157926015,1.5819455882604987,lossguide,43.19641449124339,0.0006807778671502428,6,9,0.5639563015519856,400,,0.7007484672316151,0.4715972447204154,0.06457394725661791,none,0.7463904404605068,1.475034151097371,6.0,0.8974472706796928,,,,0.9295143905040707,0.4775900696167596,0.5567616463138851,0.5572139303482587,0.715281812899477,0.7156549520766773,0.7007484672316151,0.4715972447204154,0.05,0.5980525973519891,0.6036478678466082,0.5567616463138851,0.5572139303482587,1.0,1.0,none,0.5846652795968103,0.5793298887016967,0.7463904404605068,0.4775900696167596,COMPLETE
721,0.7156549520766773,2025-11-26 21:06:09.873149,2025-11-26 21:06:51.800442,0 days 00:00:41.927293,0.10412950263781089,dart,0.912950688785408,0.9983386061901696,lossguide,0.0005666556358419764,0.011829813683334939,3,3,0.839295342983889,300,forest,0.7847782492098268,0.5292214680984755,0.0752258676538842,undersample,0.6837588176462281,,6.0,0.6569254356357441,0.11617663192890486,weighted,0.6674884456613418,0.39498567630913717,0.1458643475845561,0.5567616463138851,0.5572139303482587,0.715281812899477,0.7156549520766773,0.7847782492098268,0.5292214680984755,0.08,0.6045958057134517,0.5933450927722587,0.5567616463138851,0.5572139303482587,1.0,1.0,undersample,0.5829846317080852,0.5784929128583367,0.6837588176462281,0.1458643475845561,COMPLETE
722,0.7156549520766773,2025-11-26 21:06:51.972710,2025-11-26 21:07:04.644193,0 days 00:00:12.671483,0.009689166733745857,dart,0.8953228169974486,0.367064266832125,lossguide,0.03728215931109386,0.04817679254542175,4,6,8.73823019287132,300,forest,0.8842797788891276,0.7665167847530708,0.08622013870592818,undersample,0.6817194035960554,,5.0,0.7909101498216351,0.14611074602564145,weighted,0.6427367051258035,0.3372859111685286,0.026052791829656058,0.5567616463138851,0.5572139303482587,0.715281812899477,0.7156549520766773,0.8842797788891276,0.7665167847530708,0.08,0.5219892543084268,0.5130163492906067,0.5567616463138851,0.5572139303482587,1.0,1.0,undersample,0.4606707670883138,0.4580285011209424,0.6817194035960554,0.026052791829656058,COMPLETE
723,0.7111764705882353,2025-11-26 21:07:04.802278,2025-11-26 21:07:52.359867,0 days 00:00:47.557589,2.094190218601976,dart,0.9652200984285261,2.8449656367560285,lossguide,0.03730159797752924,0.33723669002130746,5,5,0.9828156576209909,300,forest,0.8928253124908128,0.6558792544479721,0.09825937463706151,oversample,0.6789987217768637,,7.0,0.7701440485638718,0.17670300275694933,weighted,0.7536297788247219,0.21820678319579773,0.3591344948128145,0.5590230664857531,0.555857078245138,0.7128129602356407,0.7111764705882353,0.8928253124908128,0.6558792544479721,0.1,0.5112040181356554,0.5297113758247187,0.5591497227356746,0.5576568265682657,0.9829406986190089,0.9813311688311688,oversample,0.45502495067889054,0.46134158231962114,0.6789987217768637,0.3591344948128145,COMPLETE
