number,value,datetime_start,datetime_complete,duration,params_alpha,params_booster,params_colsample_bytree,params_gamma,params_grow_policy,params_lambda,params_learning_rate,params_max_delta_step,params_max_depth,params_min_child_weight,params_n_estimators,params_normalize_type,params_params_feature_fraction,params_params_labeled_ratio,params_params_missing_rate,params_params_resampling,params_params_sample_rows,params_params_scale_pos_weight,params_params_selftrain_max_iter,params_params_selftrain_threshold,params_rate_drop,params_sample_type,params_skip_drop,params_subsample,params_user_attrs_decision_threshold,user_attrs_acc_test,user_attrs_acc_val,user_attrs_f1_test,user_attrs_f1_val,user_attrs_feature_fraction,user_attrs_labeled_ratio,user_attrs_missing_rate,user_attrs_pr_auc_test,user_attrs_pr_auc_val,user_attrs_prec_test,user_attrs_prec_val,user_attrs_rec_test,user_attrs_rec_val,user_attrs_resampling_strategy,user_attrs_roc_auc_test,user_attrs_roc_auc_val,user_attrs_sample_rows,user_attrs_user_attrs_decision_threshold,state
174,0.7156549520766773,2025-11-26 17:28:18.876438,2025-11-26 17:28:19.580264,0 days 00:00:00.703826,5.110455299262106,gbtree,0.29389555763506486,7.099916422831409,lossguide,1.2739926151692824,0.11738944219272572,2,5,0.13521153326694468,600,,0.9027627637678901,0.7948152196135781,0.05564028286025381,oversample,0.5281208558305324,,11.0,0.7565656365727442,,,,0.36433102071700735,0.07625633292721429,0.5567616463138851,0.5572139303482587,0.715281812899477,0.7156549520766773,0.9027627637678901,0.7948152196135781,0.05,0.44313008701503287,0.445899952224155,0.5567616463138851,0.5572139303482587,1.0,1.0,oversample,0.327758666423515,0.33397118713768353,0.5281208558305324,0.07625633292721429,COMPLETE
175,0.7156549520766773,2025-11-26 17:28:19.743409,2025-11-26 17:28:20.460309,0 days 00:00:00.716900,20.11895809212773,gbtree,0.8449838296204012,3.6596549338833246,lossguide,2.368000354109307,0.008649933660178239,10,7,69.02921552426827,600,,0.6789710169572495,0.35354769359562055,0.06483026874813792,undersample,0.957222472444992,,10.0,0.915040804765716,,,,0.3448325402944913,0.4170125767720697,0.5567616463138851,0.5572139303482587,0.715281812899477,0.7156549520766773,0.6789710169572495,0.35354769359562055,0.05,0.527614191054097,0.5207511568104589,0.5567616463138851,0.5572139303482587,1.0,1.0,undersample,0.3400168272020425,0.33068297892097687,0.957222472444992,0.4170125767720697,COMPLETE
176,0.7156549520766773,2025-11-26 17:28:20.628846,2025-11-26 17:28:21.645706,0 days 00:00:01.016860,0.0007336346664102302,gbtree,0.6971022172149712,5.603970887343191,depthwise,0.0002031025337473722,0.00014070229777749015,4,8,0.21425987439906005,900,,0.7783859694093715,0.19828861463916986,0.005592293083286664,oversample,0.9813564430085322,,5.0,0.6124973467400076,,,,0.2867044389951863,0.48844846410490805,0.5567616463138851,0.5572139303482587,0.715281812899477,0.7156549520766773,0.7783859694093715,0.19828861463916986,0.0,0.705628179824907,0.6948849230106302,0.5567616463138851,0.5572139303482587,1.0,1.0,oversample,0.6743816210480942,0.6701560696708807,0.9813564430085322,0.48844846410490805,COMPLETE
177,0.7156549520766773,2025-11-26 17:28:21.812330,2025-11-26 17:28:39.393355,0 days 00:00:17.581025,29.137912519012772,dart,0.6668149949082687,6.861311734238297,lossguide,0.03130269769495208,0.00037466302340925746,2,3,0.2897840824067516,400,forest,0.5245518747806701,0.39929878422903253,0.0683628665185603,undersample,0.5225994940215458,,12.0,0.7933421202269,0.2748484913708751,weighted,0.31454156153406254,0.7045133373394424,0.2610059273350069,0.5567616463138851,0.5572139303482587,0.715281812899477,0.7156549520766773,0.5245518747806701,0.39929878422903253,0.08,0.5567616463138851,0.5572139303482587,0.5567616463138851,0.5572139303482587,1.0,1.0,undersample,0.5,0.5,0.5225994940215458,0.2610059273350069,COMPLETE
178,0.7156549520766773,2025-11-26 17:28:39.559477,2025-11-26 17:28:44.529146,0 days 00:00:04.969669,0.021332984615481828,dart,0.8330695942062664,9.282829472628771,lossguide,13.236161487710016,0.0027603429025544537,0,4,29.016112891259365,200,forest,0.8503384811365597,0.2860638331616554,0.051960130172215124,oversample,0.6380110795596969,,11.0,0.9371858310744613,0.3930715104619004,weighted,0.6024346039977574,0.2856465143393509,0.025788815315060738,0.5567616463138851,0.5572139303482587,0.715281812899477,0.7156549520766773,0.8503384811365597,0.2860638331616554,0.05,0.5567616463138851,0.5572139303482587,0.5567616463138851,0.5572139303482587,1.0,1.0,oversample,0.5,0.5,0.6380110795596969,0.025788815315060738,COMPLETE
179,0.0,2025-11-26 17:28:44.690262,2025-11-26 17:28:45.507452,0 days 00:00:00.817190,18.762638549246216,gbtree,0.7726051920731369,1.2927562699286066,lossguide,0.005162731510759572,0.00017736504903254372,5,4,0.3452441705085267,600,,0.7488280752580937,0.4352732838816955,0.08613582259188679,oversample,0.8075774412598891,,5.0,0.8307985879543263,,,,0.43102553941758687,0.6110852290882142,0.44323835368611486,0.4427860696517413,0.0,0.0,0.7488280752580937,0.4352732838816955,0.08,0.6565691986001718,0.6570860578966903,0.0,0.0,0.0,0.0,oversample,0.6111171438518543,0.6032021476990833,0.8075774412598891,0.6110852290882142,COMPLETE
180,0.7156549520766773,2025-11-26 17:28:45.680079,2025-11-26 17:30:00.920886,0 days 00:01:15.240807,2.1205042581600235,dart,0.8975500733263058,2.048712103795488,depthwise,28.9312923422288,0.0003372717805988755,9,8,94.33730785964104,800,tree,0.8719880052429626,0.8641042728078193,0.08729297480278848,none,0.9621661995023427,1.0941540040328916,12.0,0.8729378757109894,0.2640055945290981,uniform,0.5138852571214079,0.6044298373189742,0.2904950864988732,0.5567616463138851,0.5572139303482587,0.715281812899477,0.7156549520766773,0.8719880052429626,0.8641042728078193,0.08,0.4547086763236307,0.4533648377186635,0.5567616463138851,0.5572139303482587,1.0,1.0,none,0.3663982327293224,0.35999537362535317,0.9621661995023427,0.2904950864988732,COMPLETE
181,0.6857142857142857,2025-11-26 17:30:01.087469,2025-11-26 17:30:02.052270,0 days 00:00:00.964801,0.08175212249115983,gbtree,0.48066908665244024,3.2334967758402784,lossguide,0.040557895633951783,0.0050647775939423835,2,3,0.9366949244933074,400,,0.9266041939260432,0.5756941775817602,0.09239840353356446,none,0.7492848307580544,1.7959882222667638,7.0,0.6113676803953422,,,,0.21327121931045995,0.8074153056874468,0.5287200361827228,0.527363184079602,0.6872749099639855,0.6857142857142857,0.9266041939260432,0.5756941775817602,0.1,0.4414095461941288,0.4411048649131549,0.5449785816277963,0.544672718585762,0.9301380991064175,0.9253246753246753,none,0.3264759031151047,0.32729403512728333,0.7492848307580544,0.8074153056874468,COMPLETE
182,0.7156549520766773,2025-11-26 17:30:02.216216,2025-11-26 17:30:12.285717,0 days 00:00:10.069501,0.009767495379080183,dart,0.7861269110601636,2.1418953448097318,depthwise,10.817226106688203,0.16383645748420775,3,11,23.97115403904918,300,forest,0.9490552001114234,0.1167353727579461,0.0817532278715475,undersample,0.6179974509937011,,10.0,0.7807256199544598,0.2766221327281265,uniform,0.32158815492253234,0.8519903123926548,0.44200091923816676,0.5567616463138851,0.5572139303482587,0.715281812899477,0.7156549520766773,0.9490552001114234,0.1167353727579461,0.08,0.42461450323689826,0.4320203309702973,0.5567616463138851,0.5572139303482587,1.0,1.0,undersample,0.2529857922047779,0.2712394538556438,0.6179974509937011,0.44200091923816676,COMPLETE
183,0.7156549520766773,2025-11-26 17:30:12.448748,2025-11-26 17:31:03.137351,0 days 00:00:50.688603,0.052231966108075824,dart,0.7047904784128407,0.4718922740454983,depthwise,3.9089433363352777,0.011049764142349483,0,12,70.81922386018994,800,forest,0.9951572401989843,0.28370141785759606,0.051129694357288286,undersample,0.6703099412674781,,7.0,0.6999397100738156,0.42883637561882876,weighted,0.019346230735148656,0.659759064592516,0.024711909935475215,0.5567616463138851,0.5572139303482587,0.715281812899477,0.7156549520766773,0.9951572401989843,0.28370141785759606,0.05,0.4872560905510499,0.4715925468701453,0.5567616463138851,0.5572139303482587,1.0,1.0,undersample,0.40195792370563166,0.370394352838173,0.6703099412674781,0.024711909935475215,COMPLETE
184,0.0,2025-11-26 17:31:03.305710,2025-11-26 17:31:04.047941,0 days 00:00:00.742231,0.008827774208810436,gbtree,0.2631268253151804,5.313879536935128,lossguide,14.12815740429197,0.00016830155529816367,3,10,0.1482155975073347,600,,0.9565172164163999,0.531111501322977,0.01695053579000137,undersample,0.7454643817073815,,6.0,0.7058669365923804,,,,0.45362027205137234,0.5083059839960586,0.44323835368611486,0.4427860696517413,0.0,0.0,0.9565172164163999,0.531111501322977,0.02,0.5882404696226742,0.5810506682231849,0.0,0.0,0.0,0.0,undersample,0.5687163248727598,0.5495013796214001,0.7454643817073815,0.5083059839960586,COMPLETE
185,0.7156549520766773,2025-11-26 17:31:04.217058,2025-11-26 17:31:23.253261,0 days 00:00:19.036203,0.01150958379948309,dart,0.8007860426708551,1.5479302423409322,depthwise,97.61706136588832,0.09568172073358293,5,12,24.81805731827086,400,forest,0.9445391398918813,0.09308428734087387,0.04181668863821895,undersample,0.5424126449429774,,9.0,0.7205500472095929,0.23085682492415954,uniform,0.4852782786923848,0.8133633360422703,0.04340032422754301,0.5567616463138851,0.5572139303482587,0.715281812899477,0.7156549520766773,0.9445391398918813,0.09308428734087387,0.05,0.5690018191853428,0.5770145417003005,0.5567616463138851,0.5572139303482587,1.0,1.0,undersample,0.5240616555314246,0.5382770319568072,0.5424126449429774,0.04340032422754301,COMPLETE
186,0.7156549520766773,2025-11-26 17:31:23.420418,2025-11-26 17:37:27.694037,0 days 00:06:04.273619,0.015658783046658162,dart,0.8915206492264669,1.1459292293277044,depthwise,0.9360837074326519,0.04285615117579548,5,8,24.122256173673687,800,tree,0.9148697786297137,0.16363762299863674,0.05508775999190228,oversample,0.6575239771624857,,9.0,0.6947194523573621,0.3553256654519455,weighted,0.5270743137527575,0.8967404141043055,0.021246601333600693,0.5567616463138851,0.5572139303482587,0.715281812899477,0.7156549520766773,0.9148697786297137,0.16363762299863674,0.05,0.45630176156236524,0.4481586063475325,0.5567616463138851,0.5572139303482587,1.0,1.0,oversample,0.30408867852583765,0.30582574983749655,0.6575239771624857,0.021246601333600693,COMPLETE
187,0.7156549520766773,2025-11-26 17:37:27.857806,2025-11-26 17:37:28.732177,0 days 00:00:00.874371,0.3739791956584029,gbtree,0.21870001782734005,4.804163603371751,lossguide,1.0020575048291775,0.004762112400395298,1,6,0.28121790886731785,800,,0.9403837938247843,0.916824960699528,0.002635396195147823,oversample,0.6434676768242351,,6.0,0.8132005979231781,,,,0.5311555916964892,0.1319165719159855,0.5567616463138851,0.5572139303482587,0.715281812899477,0.7156549520766773,0.9403837938247843,0.916824960699528,0.0,0.4031937219301117,0.3993907223872635,0.5567616463138851,0.5572139303482587,1.0,1.0,oversample,0.23467108208027324,0.22132020813711312,0.6434676768242351,0.1319165719159855,COMPLETE
188,0.7156549520766773,2025-11-26 17:37:28.896136,2025-11-26 17:39:23.276975,0 days 00:01:54.380839,0.8828010875886193,dart,0.7900502880935822,1.590906954910417,lossguide,0.00026352184623074993,0.0028137639580163264,2,12,2.1347108777936654,1000,forest,0.5508044999503923,0.20828871376146654,0.08127042098513201,none,0.9169257383540235,0.5066236319559722,5.0,0.7408542720343151,0.2133367873738996,uniform,0.27877776929485454,0.42596399294750437,0.16486618407458947,0.5567616463138851,0.5572139303482587,0.715281812899477,0.7156549520766773,0.5508044999503923,0.20828871376146654,0.08,0.45051510798422895,0.45803531277296794,0.5567616463138851,0.5572139303482587,1.0,1.0,none,0.34067996816923357,0.3585009219585318,0.9169257383540235,0.16486618407458947,COMPLETE
189,0.7156549520766773,2025-11-26 17:39:23.445370,2025-11-26 17:40:10.061816,0 days 00:00:46.616446,0.021701710465354854,dart,0.2755791381479607,7.556906593130446,lossguide,87.39152935154456,0.00016228137969242262,0,6,0.15932041628543256,600,forest,0.7485636068560044,0.7980477906783334,0.024624701090110883,undersample,0.5653063569817819,,5.0,0.6415066530659239,0.04326047343958839,weighted,0.7103132913507306,0.45889614109049426,0.16061680254217103,0.5567616463138851,0.5572139303482587,0.715281812899477,0.7156549520766773,0.7485636068560044,0.7980477906783334,0.02,0.4962399468636398,0.49497094357409543,0.5567616463138851,0.5572139303482587,1.0,1.0,undersample,0.3166452527396011,0.2961522325988618,0.5653063569817819,0.16061680254217103,COMPLETE
190,0.7156549520766773,2025-11-26 17:40:10.225633,2025-11-26 17:40:28.317135,0 days 00:00:18.091502,0.22692772336521466,dart,0.5721184876569925,0.011202934252719232,depthwise,5.513422495985675,0.12126503309176585,6,9,43.26542285151577,400,forest,0.9917222302587694,0.1763596660978097,0.07439274337583075,undersample,0.7300197954081391,,8.0,0.6066403547998486,0.37926367605146305,weighted,0.24968012044778157,0.7693521003580939,0.22127251698722242,0.5567616463138851,0.5572139303482587,0.715281812899477,0.7156549520766773,0.9917222302587694,0.1763596660978097,0.08,0.8391979650437025,0.8221411892632993,0.5567616463138851,0.5572139303482587,1.0,1.0,undersample,0.8151892438535121,0.7910586604406828,0.7300197954081391,0.22127251698722242,COMPLETE
191,0.7156549520766773,2025-11-26 17:40:28.475505,2025-11-26 17:40:29.012668,0 days 00:00:00.537163,55.67090109791843,gbtree,0.37216580517772935,4.9484106287251475,depthwise,31.06613195561319,0.009378194328351751,3,9,10.546587390758033,300,,0.6004369749376028,0.5646856904594577,0.08884896852049293,none,0.7729849653943449,0.8978066928328405,11.0,0.7189476929113815,,,,0.2222112914574857,0.04195139339819406,0.5567616463138851,0.5572139303482587,0.715281812899477,0.7156549520766773,0.6004369749376028,0.5646856904594577,0.08,0.5567616463138851,0.5572139303482587,0.5567616463138851,0.5572139303482587,1.0,1.0,none,0.5,0.5,0.7729849653943449,0.04195139339819406,COMPLETE
192,0.7156549520766773,2025-11-26 17:40:29.172686,2025-11-26 17:40:29.887849,0 days 00:00:00.715163,11.14404323187958,gbtree,0.3436577753241246,3.0894585969329764,lossguide,0.016209485218915437,0.2063310121284114,8,4,0.1610735587818479,600,,0.6447875079956984,0.5873386204763134,0.020878504563003913,oversample,0.6287793154477624,,8.0,0.7726488975972536,,,,0.9013684756926748,0.048449460707280595,0.5567616463138851,0.5572139303482587,0.715281812899477,0.7156549520766773,0.6447875079956984,0.5873386204763134,0.02,0.4530930263630018,0.4721851758013401,0.5567616463138851,0.5572139303482587,1.0,1.0,oversample,0.3292395430958736,0.3647589642227027,0.6287793154477624,0.048449460707280595,COMPLETE
193,0.7156549520766773,2025-11-26 17:40:30.052863,2025-11-26 17:40:30.519654,0 days 00:00:00.466791,1.350269616954417,gbtree,0.2811739701083829,6.2897900371259325,lossguide,0.005697389342958497,0.020676703037540194,8,4,1.1223772564553383,200,,0.6458781475179398,0.7248545705805848,0.02737372946059813,oversample,0.5745107468583747,,9.0,0.6165101432530649,,,,0.779191192753977,0.17416362018390957,0.5567616463138851,0.5572139303482587,0.715281812899477,0.7156549520766773,0.6458781475179398,0.7248545705805848,0.02,0.4686353028317468,0.4692003711921292,0.5567616463138851,0.5572139303482587,1.0,1.0,oversample,0.2827699398199572,0.27437386413382325,0.5745107468583747,0.17416362018390957,COMPLETE
194,0.7156549520766773,2025-11-26 17:40:30.682803,2025-11-26 17:40:41.281091,0 days 00:00:10.598288,47.97270875024158,dart,0.3960452707677793,2.689644474460967,depthwise,0.21447072742788476,0.0003315482233063534,1,8,19.881615973158272,300,forest,0.5050167622554194,0.31067241396002987,0.09457367218023263,none,0.9743510021425162,2.710296216330471,12.0,0.6434525332338279,0.3046541824211215,weighted,0.5025061434833447,0.3749878713332332,0.2028883345970811,0.5567616463138851,0.5572139303482587,0.715281812899477,0.7156549520766773,0.5050167622554194,0.31067241396002987,0.1,0.5567616463138851,0.5572139303482587,0.5567616463138851,0.5572139303482587,1.0,1.0,none,0.5,0.5,0.9743510021425162,0.2028883345970811,COMPLETE
195,0.7156549520766773,2025-11-26 17:40:41.454924,2025-11-26 17:42:27.532006,0 days 00:01:46.077082,0.00035411677938189146,dart,0.47305813742043035,5.21580211090981,depthwise,0.0009179150490975157,0.0004451890723389064,5,5,2.7338872852133655,1000,tree,0.6894401053584877,0.6897686259960775,0.019935299935581106,oversample,0.8208277736367265,,5.0,0.655074023312603,0.32238452080306657,weighted,0.3785166166699123,0.5221050753909406,0.41362166855213156,0.5567616463138851,0.5572139303482587,0.715281812899477,0.7156549520766773,0.6894401053584877,0.6897686259960775,0.02,0.4072199312747758,0.40225488881423865,0.5567616463138851,0.5572139303482587,1.0,1.0,oversample,0.24346391684212268,0.2291228625817492,0.8208277736367265,0.41362166855213156,COMPLETE
196,0.7156549520766773,2025-11-26 17:42:27.699780,2025-11-26 17:42:39.970354,0 days 00:00:12.270574,0.012735590144977634,dart,0.6950999516737537,7.10368514713133,depthwise,0.0003561222716146459,0.018816066448114052,7,4,0.12365877451785381,300,forest,0.7413918595707684,0.7941953507084559,0.036801580351672844,oversample,0.585145148681542,,7.0,0.7673729663418413,0.004379615851256069,weighted,0.08461551222533684,0.6478776475998232,0.4616906784070641,0.5567616463138851,0.5572139303482587,0.715281812899477,0.7156549520766773,0.7413918595707684,0.7941953507084559,0.05,0.6796388307607177,0.652070423623833,0.5567616463138851,0.5572139303482587,1.0,1.0,oversample,0.6653202141945325,0.6300094185691734,0.585145148681542,0.4616906784070641,COMPLETE
197,0.0,2025-11-26 17:42:40.135972,2025-11-26 17:42:50.553637,0 days 00:00:10.417665,2.42939851130934,dart,0.5588248292191276,5.98112460566017,depthwise,0.0010982902773558826,0.0031321022262080804,8,3,0.12655582388310344,300,tree,0.7119726429859131,0.8166630519509608,0.030093499000652047,oversample,0.8230512774952737,,11.0,0.866582330614965,0.2054791857544747,weighted,0.03175832631557335,0.4673515959441575,0.647782611206779,0.44323835368611486,0.4427860696517413,0.0,0.0,0.7119726429859131,0.8166630519509608,0.02,0.4803230215576873,0.47170434619037394,0.0,0.0,0.0,0.0,oversample,0.3980603126709661,0.39048799132430384,0.8230512774952737,0.647782611206779,COMPLETE
198,0.7156549520766773,2025-11-26 17:42:50.740077,2025-11-26 17:42:51.520424,0 days 00:00:00.780347,30.685471524068806,gbtree,0.35158368034868154,9.447484778473184,lossguide,6.755343260463384,0.09167015247890696,7,5,0.11154537681943985,700,,0.9975395824184802,0.8874228772519077,0.09531629908473031,oversample,0.5310341700669575,,11.0,0.6509252510255658,,,,0.6989329765992842,0.018131159751378155,0.5567616463138851,0.5572139303482587,0.715281812899477,0.7156549520766773,0.9975395824184802,0.8874228772519077,0.1,0.5567616463138851,0.5572139303482587,0.5567616463138851,0.5572139303482587,1.0,1.0,oversample,0.5,0.5,0.5310341700669575,0.018131159751378155,COMPLETE
199,0.7156549520766773,2025-11-26 17:42:51.689884,2025-11-26 17:42:52.305102,0 days 00:00:00.615218,58.3282399217844,gbtree,0.4873237871023198,9.079033586755312,lossguide,29.552224443699842,0.00018260357755526177,7,3,0.31351206556801103,400,,0.7283496282708559,0.45849909518418713,0.051650843390221024,none,0.5069945004860906,4.739841573291755,12.0,0.7417469199719082,,,,0.7845066771278819,0.2372287119830026,0.5567616463138851,0.5572139303482587,0.715281812899477,0.7156549520766773,0.7283496282708559,0.45849909518418713,0.05,0.5567616463138851,0.5572139303482587,0.5567616463138851,0.5572139303482587,1.0,1.0,none,0.5,0.5,0.5069945004860906,0.2372287119830026,COMPLETE
200,0.7156549520766773,2025-11-26 17:42:52.474114,2025-11-26 17:43:11.359816,0 days 00:00:18.885702,0.4934978842313843,dart,0.3973384314676375,3.9675746257142217,lossguide,0.010344011480626195,0.2059387167525839,6,3,4.193426567746106,400,forest,0.5210105613068111,0.6206269286410974,0.011669460920364508,oversample,0.7960822111988671,,7.0,0.6531215562373183,0.2941552642721477,uniform,0.5995881382585471,0.8427557702962727,0.18920527296701836,0.5567616463138851,0.5572139303482587,0.715281812899477,0.7156549520766773,0.5210105613068111,0.6206269286410974,0.02,0.48796424528647964,0.47654530516335347,0.5567616463138851,0.5572139303482587,1.0,1.0,oversample,0.4128446260713871,0.403308355332104,0.7960822111988671,0.18920527296701836,COMPLETE
201,0.7156549520766773,2025-11-26 17:43:11.530606,2025-11-26 17:43:12.067788,0 days 00:00:00.537182,8.78584344216223,gbtree,0.4986528424856787,6.731233969487561,lossguide,2.146759651256186,0.20168633050737167,9,3,1.38284188588826,300,,0.5435836545951619,0.42374052606418433,0.022139237479282405,oversample,0.50959282629665,,8.0,0.697249692230816,,,,0.9170208551012757,0.1458060877024979,0.5567616463138851,0.5572139303482587,0.715281812899477,0.7156549520766773,0.5435836545951619,0.42374052606418433,0.02,0.5457168333878788,0.5404708306166923,0.5567616463138851,0.5572139303482587,1.0,1.0,oversample,0.47593834446857547,0.4617229680431927,0.50959282629665,0.1458060877024979,COMPLETE
202,0.0,2025-11-26 17:43:12.240604,2025-11-26 17:43:13.088233,0 days 00:00:00.847629,0.03378929046252447,gbtree,0.6696886437951278,1.8856249795960163,lossguide,1.8010261852864347,0.0010532517893520506,2,6,13.231136966590475,400,,0.9643743489067885,0.1676873139833837,0.0734326438250452,undersample,0.9908113025812744,,6.0,0.7445546538803182,,,,0.5512105699457742,0.5442257511966044,0.44323835368611486,0.4427860696517413,0.0,0.0,0.9643743489067885,0.1676873139833837,0.08,0.501589650795577,0.4876687426330548,0.0,0.0,0.0,0.0,undersample,0.40831786004409887,0.3881967751349774,0.9908113025812744,0.5442257511966044,COMPLETE
