number,value,datetime_start,datetime_complete,duration,params_alpha,params_booster,params_colsample_bytree,params_gamma,params_grow_policy,params_lambda,params_learning_rate,params_max_delta_step,params_max_depth,params_min_child_weight,params_n_estimators,params_normalize_type,params_params_feature_fraction,params_params_labeled_ratio,params_params_missing_rate,params_params_resampling,params_params_sample_rows,params_params_scale_pos_weight,params_params_selftrain_max_iter,params_params_selftrain_threshold,params_rate_drop,params_sample_type,params_skip_drop,params_subsample,params_user_attrs_decision_threshold,user_attrs_acc_test,user_attrs_acc_val,user_attrs_f1_test,user_attrs_f1_val,user_attrs_feature_fraction,user_attrs_labeled_ratio,user_attrs_missing_rate,user_attrs_pr_auc_test,user_attrs_pr_auc_val,user_attrs_prec_test,user_attrs_prec_val,user_attrs_rec_test,user_attrs_rec_val,user_attrs_resampling_strategy,user_attrs_roc_auc_test,user_attrs_roc_auc_val,user_attrs_sample_rows,user_attrs_user_attrs_decision_threshold,state
2780,0.7156549520766773,2025-11-30 17:30:22.844056,2025-11-30 17:30:23.581742,0 days 00:00:00.737686,15.724125139353973,gbtree,0.7929749512179194,4.795113646581779,depthwise,0.0006457296496911359,0.005432074780900486,9,9,0.5413622992620234,800,,0.7381601646908942,0.44005131884958126,0.013626592295158092,oversample,0.9863165026701941,,8.0,0.8612640083872154,,,,0.81610639749248,,0.5567616463138851,0.5572139303482587,0.715281812899477,0.7156549520766773,0.7381601646908942,0.44005131884958126,0.08,0.4300748293421479,0.42150879257446583,0.5567616463138851,0.5572139303482587,1.0,1.0,oversample,0.2658051360267909,0.23161762267354707,0.9863165026701941,0.5,COMPLETE
2781,0.7156549520766773,2025-11-30 17:30:24.338429,2025-11-30 17:31:17.888967,0 days 00:00:53.550538,58.01242443432633,dart,0.2832015025900286,5.83971270974529,depthwise,0.002068413783305264,0.006431261784337079,0,6,0.8970367270284236,700,forest,0.9691716504112995,0.6688495807872785,0.09643467194683747,none,0.8054143076385322,1.2231918168760472,5.0,0.7069158064105476,0.2505491922039084,weighted,0.45266289341322674,0.5102336338796262,,0.5567616463138851,0.5572139303482587,0.715281812899477,0.7156549520766773,0.9691716504112995,0.6688495807872785,0.1,0.5567616463138851,0.5572139303482587,0.5567616463138851,0.5572139303482587,1.0,1.0,none,0.5,0.5,0.8054143076385322,0.5,COMPLETE
2782,0.7156549520766773,2025-11-30 17:31:18.642521,2025-11-30 17:32:38.885732,0 days 00:01:20.243211,2.9158219355537707,dart,0.9848657377416965,9.351919170577982,depthwise,3.1097660633232205,0.0006035384982917957,5,4,0.27930388596888767,800,tree,0.6764866644979783,0.24856234361939603,0.015589027798109611,oversample,0.8362090214851241,,9.0,0.7830772440957069,0.08220721361462813,weighted,0.8380123656662181,0.921430657048915,,0.5567616463138851,0.5572139303482587,0.715281812899477,0.7156549520766773,0.6764866644979783,0.24856234361939603,0.08,0.5646904523232315,0.5713872664561261,0.5567616463138851,0.5572139303482587,1.0,1.0,oversample,0.49385807125449693,0.49641082870143133,0.8362090214851241,0.5,COMPLETE
2783,0.24597553122987767,2025-11-30 17:32:39.642987,2025-11-30 17:32:40.017179,0 days 00:00:00.374192,6.055754815764036,gbtree,0.4773378302633498,8.718273683435852,depthwise,0.00015534107268289722,0.029936789919428934,6,12,0.10470105992480795,200,,0.6021751313880388,0.8422113909161484,0.09449695608401792,undersample,0.5245455412562527,,9.0,0.8947082679326055,,,,0.6961178021814389,,0.4798733604703754,0.4703753957485301,0.2721518987341772,0.24597553122987767,0.6021751313880388,0.8422113909161484,0.1,0.5671159133943393,0.5630744128006648,0.6160458452722063,0.5950155763239875,0.17465475223395613,0.15503246753246752,undersample,0.5189600291782025,0.5111219538888078,0.5245455412562527,0.5,COMPLETE
2784,0.7156549520766773,2025-11-30 17:32:40.778875,2025-11-30 17:34:12.081261,0 days 00:01:31.302386,0.0027754246243817397,dart,0.24620578678649993,2.520198291852732,lossguide,0.05299594296115545,0.006378008693816184,6,7,1.6581219613865348,1000,forest,0.6970040696873081,0.36133257764775994,0.05431744979854777,oversample,0.6202242918845347,,6.0,0.7708600570272045,0.4837654607412338,weighted,0.401096370056983,0.9197262211120838,,0.5567616463138851,0.5572139303482587,0.715281812899477,0.7156549520766773,0.6970040696873081,0.36133257764775994,0.08,0.5984284710695508,0.5989515910175015,0.5567616463138851,0.5572139303482587,1.0,1.0,oversample,0.525634543012981,0.520722095830625,0.6202242918845347,0.5,COMPLETE
2785,0.7156549520766773,2025-11-30 17:34:12.835161,2025-11-30 17:34:13.409274,0 days 00:00:00.574113,86.93492067096865,gbtree,0.794526191855198,4.4748754287326475,lossguide,0.03890787620240744,0.000630867976609022,6,7,6.134191036870426,500,,0.9586297983535891,0.8990842536306505,0.05830959224429753,oversample,0.8939724759224247,,10.0,0.8416305175566803,,,,0.9818731106296146,,0.5567616463138851,0.5572139303482587,0.715281812899477,0.7156549520766773,0.9586297983535891,0.8990842536306505,0.08,0.5567616463138851,0.5572139303482587,0.5567616463138851,0.5572139303482587,1.0,1.0,oversample,0.5,0.5,0.8939724759224247,0.5,COMPLETE
2786,0.7156549520766773,2025-11-30 17:34:14.153830,2025-11-30 17:34:14.721082,0 days 00:00:00.567252,0.00019335498480889653,gbtree,0.29004166977366314,5.601878937467947,lossguide,38.68420384286744,0.00010049266378523783,7,4,0.3332177939711166,500,,0.9041765048647704,0.8805445140501353,0.04163216178580961,oversample,0.7260008716516535,,12.0,0.6448725947503997,,,,0.8916673598525899,,0.5567616463138851,0.5572139303482587,0.715281812899477,0.7156549520766773,0.9041765048647704,0.8805445140501353,0.08,0.4410574764487331,0.43426473175489216,0.5567616463138851,0.5572139303482587,1.0,1.0,oversample,0.2704168669905005,0.24833143745937414,0.7260008716516535,0.5,COMPLETE
2787,0.2159468438538206,2025-11-30 17:34:15.484868,2025-11-30 17:34:16.208275,0 days 00:00:00.723407,0.0006350906139673569,gbtree,0.6291905881435793,7.479694070822065,lossguide,12.682398980086797,0.011533883168252438,6,5,0.38589618938482356,800,,0.5960582912762227,0.8505042405764962,0.02640906797338708,undersample,0.882297136413787,,9.0,0.9478430336672063,,,,0.30902531386583,,0.36363636363636365,0.35956580732700133,0.2273476112026359,0.2159468438538206,0.5960582912762227,0.8505042405764962,0.08,0.500296245818718,0.49361632146175843,0.35084745762711866,0.3397212543554007,0.16815597075548336,0.15827922077922077,undersample,0.4115975065899633,0.39129719233779503,0.882297136413787,0.5,COMPLETE
2788,0.40053763440860213,2025-11-30 17:34:16.961071,2025-11-30 17:35:37.976803,0 days 00:01:21.015732,0.15886021713355555,dart,0.8321367845957981,2.5139691741160797,lossguide,0.1371176518365279,0.0007454631820900152,8,9,30.882397262984274,800,tree,0.7795496514274207,0.715691650904021,0.09829375864188553,undersample,0.708693900799781,,6.0,0.6039338143333706,0.1349871056341312,weighted,0.7336183629270504,0.6612562273376913,,0.4088647670737223,0.3948439620081411,0.4275076653526062,0.40053763440860213,0.7795496514274207,0.715691650904021,0.1,0.4649460314019326,0.4589764691717201,0.46387832699619774,0.447,0.39642567018683994,0.3628246753246753,undersample,0.38333526749448765,0.36692042635607497,0.708693900799781,0.5,COMPLETE
2789,0.7156549520766773,2025-11-30 17:35:38.732167,2025-11-30 17:35:39.112493,0 days 00:00:00.380326,27.468732945873114,gbtree,0.23057254425775292,4.490383541716003,depthwise,77.86588587738484,0.0003834404340090539,2,8,8.886725715995734,200,,0.5112233030444637,0.6918183116624816,0.054115766469821636,none,0.5777255786138777,0.9491843897175692,10.0,0.9088528071150999,,,,0.6347947907372895,,0.5567616463138851,0.5572139303482587,0.715281812899477,0.7156549520766773,0.5112233030444637,0.6918183116624816,0.08,0.5567616463138851,0.5572139303482587,0.5567616463138851,0.5572139303482587,1.0,1.0,none,0.5,0.5,0.5777255786138777,0.5,COMPLETE
2790,0.35323383084577115,2025-11-30 17:35:39.870755,2025-11-30 17:35:40.581693,0 days 00:00:00.710938,0.0014797937324312154,gbtree,0.6107553539488305,2.655556585985882,depthwise,0.00010782249664414006,0.006497424017892177,4,4,66.0821460118404,700,,0.6320081885799529,0.27795137109031076,0.061098057198245605,undersample,0.8048491311201238,,9.0,0.7021914135459064,,,,0.5584393154098992,,0.3152419719583899,0.2944369063772049,0.3845528455284553,0.35323383084577115,0.6320081885799529,0.27795137109031076,0.08,0.4135035430516335,0.4125088796391707,0.38486574450772987,0.3610169491525424,0.3842404549147035,0.3457792207792208,undersample,0.2418168404648618,0.2378387700144595,0.8048491311201238,0.5,COMPLETE
2791,0.5651988029072254,2025-11-30 17:35:41.327760,2025-11-30 17:35:41.940357,0 days 00:00:00.612597,0.10794771116579321,gbtree,0.5190884923922812,2.127567097458487,lossguide,0.0011642256179891927,0.008894044749576367,9,9,2.7494767136965423,200,,0.8385146795053392,0.6861099729207905,0.07972783445383576,undersample,0.5392586726872496,,11.0,0.802611885165172,,,,0.21339561454120598,,0.532790592492085,0.5400271370420624,0.5609859753506162,0.5651988029072254,0.8385146795053392,0.6861099729207905,0.08,0.5618831640384361,0.5582833967003307,0.5882352941176471,0.5971093044263776,0.5361494719740049,0.536525974025974,undersample,0.5416112667650326,0.5439762612260058,0.5392586726872496,0.5,COMPLETE
2792,0.4494706448508181,2025-11-30 17:35:42.684711,2025-11-30 17:35:45.194266,0 days 00:00:02.509555,0.0031226238406261444,gbtree,0.8909577074468606,0.3525116892471414,lossguide,75.42437941687513,0.045926923608366775,5,3,5.291166891715586,400,,0.7971191285029989,0.5499104617116823,0.013805613043877441,undersample,0.6989446047622323,,10.0,0.6785307706348583,,,,0.9590876885250577,,0.4839439167797377,0.48258706467661694,0.4564078132444021,0.4494706448508181,0.7971191285029989,0.5499104617116823,0.08,0.5329411244122468,0.5331426951577733,0.5518433179723502,0.5520094562647754,0.3891145410235581,0.37905844155844154,undersample,0.49109484573683254,0.5004609792658823,0.6989446047622323,0.5,COMPLETE
2793,0.7156549520766773,2025-11-30 17:35:45.938185,2025-11-30 17:35:46.433674,0 days 00:00:00.495489,5.258332843508098,gbtree,0.3794207065601034,6.680945228869102,lossguide,0.010415057906503522,0.03462193678164078,4,6,0.9679743775840887,400,,0.8584363608161037,0.7555251013432374,0.06722366342681932,oversample,0.7901408603813338,,7.0,0.6687451823685275,,,,0.22450833045883556,,0.5567616463138851,0.5572139303482587,0.715281812899477,0.7156549520766773,0.8584363608161037,0.7555251013432374,0.08,0.5185069045240739,0.5107510010695635,0.5567616463138851,0.5572139303482587,1.0,1.0,oversample,0.4601435700193969,0.44157668174522113,0.7901408603813338,0.5,COMPLETE
2794,0.7156549520766773,2025-11-30 17:35:47.171181,2025-11-30 17:36:58.984648,0 days 00:01:11.813467,35.24747969335981,dart,0.9718171582387103,8.851678081242458,depthwise,0.0001595017699493083,0.054558649941744995,1,4,60.73047960799609,800,forest,0.5306505056109874,0.5300984531606496,0.01395734232466871,undersample,0.7009346875062707,,11.0,0.7346160248260405,0.2453541730146236,uniform,0.49011824859180947,0.9189899252704887,,0.5567616463138851,0.5572139303482587,0.715281812899477,0.7156549520766773,0.5306505056109874,0.5300984531606496,0.08,0.5567616463138851,0.5572139303482587,0.5567616463138851,0.5572139303482587,1.0,1.0,undersample,0.5,0.5,0.7009346875062707,0.5,COMPLETE
2795,0.7156549520766773,2025-11-30 17:36:59.726423,2025-11-30 17:38:57.932965,0 days 00:01:58.206542,2.8624556624600896,dart,0.9670027282236691,9.760503399844325,depthwise,0.553807595889691,0.051748633035964886,7,5,98.12306195760699,1000,tree,0.5858315269782177,0.8191975967736644,0.03646974265420766,oversample,0.7090060466366599,,12.0,0.732244820201783,0.43809578326362264,uniform,0.7663380388606015,0.9843635964165367,,0.5567616463138851,0.5572139303482587,0.715281812899477,0.7156549520766773,0.5858315269782177,0.8191975967736644,0.08,0.5567616463138851,0.5572139303482587,0.5567616463138851,0.5572139303482587,1.0,1.0,oversample,0.5,0.5,0.7090060466366599,0.5,COMPLETE
2796,0.68416,2025-11-30 17:38:58.716568,2025-11-30 17:40:06.559852,0 days 00:01:07.843284,0.011232268163517667,dart,0.8307870023527262,2.4310055769948526,lossguide,0.054715303574762134,0.06287766876692656,8,4,24.062416415409434,500,forest,0.5114579642956898,0.33518617119957805,0.004773865578696335,oversample,0.6631900594277518,,7.0,0.7406169731589161,0.00753262829836937,uniform,0.5759275434198229,0.6638732429585814,,0.5355042966983266,0.55359565807327,0.672408293460925,0.68416,0.5114579642956898,0.33518617119957805,0.08,0.5463454913814809,0.5525673104278556,0.5535714285714286,0.5647120972002113,0.8562144597887896,0.8676948051948052,oversample,0.4989418756942257,0.5014745532812438,0.6631900594277518,0.5,COMPLETE
2797,0.7156549520766773,2025-11-30 17:40:07.355632,2025-11-30 17:40:53.741069,0 days 00:00:46.385437,0.3640625105558639,dart,0.20573922681418272,7.301543996584195,depthwise,1.0507681821382262,0.26196816323124883,3,5,0.8757885079443557,600,tree,0.518766560425878,0.838786796021173,0.04881042322139324,oversample,0.7667181647639036,,8.0,0.912557380363294,0.06506797158703698,uniform,0.18156134305967087,0.7467053498859095,,0.5567616463138851,0.5572139303482587,0.715281812899477,0.7156549520766773,0.518766560425878,0.838786796021173,0.08,0.47689639869280787,0.4688872274550866,0.5567616463138851,0.5572139303482587,1.0,1.0,oversample,0.3548732571826455,0.34308050223525205,0.7667181647639036,0.5,COMPLETE
2798,0.7156549520766773,2025-11-30 17:40:54.573126,2025-11-30 17:40:55.852661,0 days 00:00:01.279535,1.2380555797879174,gbtree,0.46578837370573833,0.2702471062332812,depthwise,0.006740632405432662,0.0005144975099388622,10,11,81.9402523519672,800,,0.545141535452285,0.8596821384318998,0.0752351297408987,oversample,0.6029183197964734,,5.0,0.6086472432085144,,,,0.9582015444912233,,0.5567616463138851,0.5572139303482587,0.715281812899477,0.7156549520766773,0.545141535452285,0.8596821384318998,0.08,0.6495978670459401,0.6174432946637605,0.5567616463138851,0.5572139303482587,1.0,1.0,oversample,0.6212677597440276,0.5831839572582678,0.6029183197964734,0.5,COMPLETE
2799,0.7156549520766773,2025-11-30 17:40:56.688370,2025-11-30 17:41:26.015980,0 days 00:00:29.327610,0.3773347746572873,dart,0.45073442189136836,8.229735782677173,depthwise,0.0021334753295915243,0.015307291939760718,6,8,12.572114161137943,500,forest,0.612317834907282,0.6955620725158654,0.019844068798590297,oversample,0.698617995886404,,10.0,0.8944881891748399,0.23112627458038548,weighted,0.45661586035368557,0.5814324040640986,,0.5567616463138851,0.5572139303482587,0.715281812899477,0.7156549520766773,0.612317834907282,0.6955620725158654,0.08,0.4396670261607304,0.4256407428557434,0.5567616463138851,0.5572139303482587,1.0,1.0,oversample,0.2606761551086722,0.23418202711486674,0.698617995886404,0.5,COMPLETE
2800,0.4147046674927716,2025-11-30 17:41:26.812451,2025-11-30 17:41:27.228362,0 days 00:00:00.415911,0.0002028940615796561,gbtree,0.5004506980469507,9.959126271198526,lossguide,0.0008894671846499469,0.4455879254924851,3,8,0.9105335455904167,200,,0.6030753443247219,0.7602243097592352,0.0248380967441159,undersample,0.9150395268344662,,7.0,0.7236072586436887,,,,0.4657461642669337,,0.3776571687019448,0.35911352329262775,0.44336569579288027,0.4147046674927716,0.6030753443247219,0.7602243097592352,0.08,0.5112259326913653,0.5077582807891603,0.44157937147461723,0.4222035323801514,0.44516653127538586,0.4074675324675325,undersample,0.3915863989787629,0.3752445843227252,0.9150395268344662,0.5,COMPLETE
2801,0.7156549520766773,2025-11-30 17:41:27.994066,2025-11-30 17:41:29.336958,0 days 00:00:01.342892,0.008293956086079456,gbtree,0.6364418155547754,2.0650200291468046,depthwise,0.7794066570324363,0.00011617784260764762,0,10,15.135052116333034,800,,0.984802520542749,0.301390200081888,0.05880459106406416,oversample,0.8711681873733563,,8.0,0.929641266443113,,,,0.6226641292736841,,0.5567616463138851,0.5572139303482587,0.715281812899477,0.7156549520766773,0.984802520542749,0.301390200081888,0.08,0.5536814048015576,0.5613275024280808,0.5567616463138851,0.5572139303482587,1.0,1.0,oversample,0.4891095674663042,0.494296625233806,0.8711681873733563,0.5,COMPLETE
2802,0.7195517546446476,2025-11-30 17:41:30.145844,2025-11-30 17:41:30.892623,0 days 00:00:00.746779,0.06820032888584619,gbtree,0.7445800541658456,8.048396450507289,lossguide,0.0021087243923171095,0.043180750007106555,4,6,0.29567242247732434,800,,0.7912009769448547,0.3140350015034649,0.019384767529700545,oversample,0.7291652997719342,,8.0,0.8217710598027342,,,,0.2285961975555397,,0.5676164631388512,0.5698778833107191,0.7163204747774481,0.7195517546446476,0.7912009769448547,0.3140350015034649,0.08,0.6790644579467546,0.699753720960766,0.5642823749415615,0.5650764242704956,0.9805036555645816,0.9902597402597403,oversample,0.6891074951507816,0.6897037462027248,0.7291652997719342,0.5,COMPLETE
2803,0.5240936209270307,2025-11-30 17:41:31.652331,2025-11-30 17:41:33.772058,0 days 00:00:02.119727,1.8650933953205608,gbtree,0.7558944759335109,0.03826083935613123,depthwise,0.020907705505798766,0.35538953309055094,0,11,13.84195510990202,200,,0.673210217727544,0.3011232072831839,0.03736372346107001,undersample,0.8235032161575702,,7.0,0.6219240779217972,,,,0.9510362506111143,,0.5052012663952963,0.5309814563545907,0.5072072072072072,0.5240936209270307,0.673210217727544,0.3011232072831839,0.08,0.5851740296422542,0.6073739876471757,0.5692618806875632,0.6029567053854277,0.45735174654752236,0.463474025974026,undersample,0.524925396641191,0.5529243164904555,0.8235032161575702,0.5,COMPLETE
2804,0.7156549520766773,2025-11-30 17:41:34.530774,2025-11-30 17:42:05.472089,0 days 00:00:30.941315,0.00033442578261891353,dart,0.563371440023221,9.88018337058761,lossguide,0.0001452227610678574,0.418374852736349,10,11,27.335154084352794,500,forest,0.8315697346593216,0.6301581461202849,0.05978684013621854,oversample,0.672902269602972,,9.0,0.6416262691055719,0.2504797673078438,weighted,0.8555160251274937,0.7417000961016469,,0.5567616463138851,0.5572139303482587,0.715281812899477,0.7156549520766773,0.8315697346593216,0.6301581461202849,0.08,0.5968239037334664,0.6161421461537262,0.5567616463138851,0.5572139303482587,1.0,1.0,oversample,0.5606032096022812,0.583343973442288,0.672902269602972,0.5,COMPLETE
2805,0.0,2025-11-30 17:42:06.227386,2025-11-30 17:43:25.541635,0 days 00:01:19.314249,0.2496672964898957,dart,0.8169278269958089,4.0479474630668255,depthwise,83.25747553492664,0.001339031206574271,2,11,2.8187193356984808,800,forest,0.8687161843627513,0.48839424309203855,0.027284236501588722,undersample,0.5873066852690887,,10.0,0.7067747850545181,0.3749610713784771,weighted,0.8213565146920334,0.2715344563067894,,0.44323835368611486,0.4427860696517413,0.0,0.0,0.8687161843627513,0.48839424309203855,0.08,0.48598849660152776,0.49849566773808307,0.0,0.0,0.0,0.0,undersample,0.38504575672673624,0.397030829232055,0.5873066852690887,0.5,COMPLETE
2806,0.7156549520766773,2025-11-30 17:43:26.312168,2025-11-30 17:43:27.319702,0 days 00:00:01.007534,0.5164359880930084,gbtree,0.7744265840731324,1.4086064765310335,depthwise,0.005131522854581857,0.0001372639612857958,5,9,19.59953742538021,500,,0.5010357126589855,0.34624696566841134,0.018215432819629906,none,0.6117905520231284,4.429865444200265,8.0,0.9222583551765366,,,,0.5344687706757443,,0.5567616463138851,0.5572139303482587,0.715281812899477,0.7156549520766773,0.5010357126589855,0.34624696566841134,0.08,0.534870122415882,0.5536969672729773,0.5567616463138851,0.5572139303482587,1.0,1.0,none,0.4029940814668678,0.427840992000849,0.6117905520231284,0.5,COMPLETE
2807,0.46296296296296297,2025-11-30 17:43:28.101949,2025-11-30 17:43:28.833395,0 days 00:00:00.731446,19.803655851298174,gbtree,0.8936004036033787,7.704008409258845,depthwise,0.0006864535385113407,0.00324141001539387,3,6,10.297794451831313,800,,0.6058290477501482,0.7188645405157394,0.050389614744702486,undersample,0.5640314568018585,,5.0,0.608970397499463,,,,0.7783764990514379,,0.4251469923111714,0.4491180461329715,0.43435692033822876,0.46296296296296297,0.6058290477501482,0.7188645405157394,0.08,0.5264562177080571,0.5357122938746073,0.48031496062992124,0.5067567567567568,0.39642567018683994,0.42613636363636365,undersample,0.42882507999137914,0.4520875893769153,0.5640314568018585,0.5,COMPLETE
2808,0.7156549520766773,2025-11-30 17:43:29.616863,2025-11-30 17:43:30.235703,0 days 00:00:00.618840,83.10648923571885,gbtree,0.6875447017594392,3.188614589754031,depthwise,12.13075984998578,0.0026972719410192584,8,12,12.850807061811896,600,,0.9818826708689392,0.24316549582978064,0.006507816600441485,none,0.8647365487792578,1.5225591473528892,12.0,0.7575584812756823,,,,0.8374327802213246,,0.5567616463138851,0.5572139303482587,0.715281812899477,0.7156549520766773,0.9818826708689392,0.24316549582978064,0.08,0.5567616463138851,0.5572139303482587,0.5567616463138851,0.5572139303482587,1.0,1.0,none,0.5,0.5,0.8647365487792578,0.5,COMPLETE
2809,0.7156549520766773,2025-11-30 17:43:31.004307,2025-11-30 17:43:35.722391,0 days 00:00:04.718084,0.05594562944671849,dart,0.8438464856226433,4.0044366831823925,lossguide,0.0003164677227105388,0.00013083674226548213,8,6,12.92548081939845,200,tree,0.5996749797557694,0.24061170386645975,0.006642158888346661,none,0.7602810944663136,3.4356522263681564,11.0,0.6839206021058111,0.4328268227946369,weighted,0.5930617805039875,0.6717492637346321,,0.5567616463138851,0.5572139303482587,0.715281812899477,0.7156549520766773,0.5996749797557694,0.24061170386645975,0.08,0.5567616463138851,0.5572139303482587,0.5567616463138851,0.5572139303482587,1.0,1.0,none,0.5,0.5,0.7602810944663136,0.5,COMPLETE
