number,value,datetime_start,datetime_complete,duration,params_alpha,params_booster,params_colsample_bytree,params_gamma,params_grow_policy,params_lambda,params_learning_rate,params_max_delta_step,params_max_depth,params_min_child_weight,params_n_estimators,params_normalize_type,params_params_feature_fraction,params_params_labeled_ratio,params_params_missing_rate,params_params_resampling,params_params_sample_rows,params_params_scale_pos_weight,params_params_selftrain_max_iter,params_params_selftrain_threshold,params_rate_drop,params_sample_type,params_skip_drop,params_subsample,params_user_attrs_decision_threshold,user_attrs_acc_test,user_attrs_acc_val,user_attrs_f1_test,user_attrs_f1_val,user_attrs_feature_fraction,user_attrs_labeled_ratio,user_attrs_missing_rate,user_attrs_pr_auc_test,user_attrs_pr_auc_val,user_attrs_prec_test,user_attrs_prec_val,user_attrs_rec_test,user_attrs_rec_val,user_attrs_resampling_strategy,user_attrs_roc_auc_test,user_attrs_roc_auc_val,user_attrs_sample_rows,user_attrs_user_attrs_decision_threshold,state
1944,0.7156549520766773,2025-11-27 11:31:54.118376,2025-11-27 11:32:05.036348,0 days 00:00:10.917972,0.04218330978305251,dart,0.4127252431237205,5.874662404772718,lossguide,0.12670659661750633,0.00016808243983701474,6,6,0.27762810401224536,300,forest,0.9663854938518901,0.34537244301834635,0.08852820636230296,oversample,0.6818078078103968,,11.0,0.676005917286223,0.3407167495406554,uniform,0.6709474517612519,0.7735699117358958,,0.5567616463138851,0.5572139303482587,0.715281812899477,0.7156549520766773,0.9663854938518901,0.34537244301834635,0.08,0.5143331286747508,0.5279007614118052,0.5567616463138851,0.5572139303482587,1.0,1.0,oversample,0.40762943682753366,0.42624456110794207,0.6818078078103968,0.5,COMPLETE
1945,0.6091331269349846,2025-11-27 11:32:05.240659,2025-11-27 11:32:08.083844,0 days 00:00:02.843185,0.008689739502450649,gbtree,0.8586332285849283,1.2708861207970024,depthwise,0.01695182525092501,0.12055838607622978,7,6,2.339553476429963,400,,0.5170520949902195,0.4447968583333658,0.09358360142997617,none,0.6693547043567267,1.1457788420050645,7.0,0.941719286227539,,,,0.2608813632709761,,0.5468113975576662,0.5431931252826775,0.6160919540229886,0.6091331269349846,0.5170520949902195,0.4447968583333658,0.08,0.5563387797575403,0.5513739145013582,0.5830311820159536,0.5821005917159763,0.6531275385865151,0.6387987012987013,none,0.5194830816160746,0.5145469635063609,0.6693547043567267,0.5,COMPLETE
1946,0.7156549520766773,2025-11-27 11:32:08.293294,2025-11-27 11:32:08.755479,0 days 00:00:00.462185,1.0446369238318007,gbtree,0.9515648143299356,9.698255037310616,lossguide,0.004888610865118554,0.00011325552896536072,0,5,2.824464317377023,300,,0.7783830378417733,0.5256821688510923,0.07426521103683334,oversample,0.6566933357014917,,10.0,0.7447449111866629,,,,0.8754248915290903,,0.5567616463138851,0.5572139303482587,0.715281812899477,0.7156549520766773,0.7783830378417733,0.5256821688510923,0.08,0.5560588361918265,0.5490431394880442,0.5567616463138851,0.5572139303482587,1.0,1.0,oversample,0.48218015882226173,0.4670673427695899,0.6566933357014917,0.5,COMPLETE
1947,0.7156549520766773,2025-11-27 11:32:08.959947,2025-11-27 11:32:09.680175,0 days 00:00:00.720228,4.875828043465182,gbtree,0.6028112847391238,2.3016157765452103,depthwise,0.21206525193669795,0.0005455071900686421,9,6,31.498479752444577,500,,0.6806179056706443,0.7275457494439788,0.03727027081362557,none,0.701493123152866,1.8256251811782702,11.0,0.8653998177968885,,,,0.22063558479924802,,0.5567616463138851,0.5572139303482587,0.715281812899477,0.7156549520766773,0.6806179056706443,0.7275457494439788,0.05,0.68445669585552,0.6839402206884257,0.5567616463138851,0.5572139303482587,1.0,1.0,none,0.6997944263001707,0.6794345210458591,0.701493123152866,0.5,COMPLETE
1948,0.7156549520766773,2025-11-27 11:32:09.880047,2025-11-27 11:32:11.682822,0 days 00:00:01.802775,0.00016227962100047572,gbtree,0.2017425860764071,5.302157678808871,depthwise,0.0009941935560527505,0.2411662736953105,4,5,1.607344672775449,900,,0.8553142402049936,0.4927939248394852,0.015004428264856585,none,0.8043169299441952,3.5913614918409134,6.0,0.7270925198934554,,,,0.2734038756834596,,0.5567616463138851,0.5572139303482587,0.715281812899477,0.7156549520766773,0.8553142402049936,0.4927939248394852,0.02,0.6136145718386361,0.6180061113532387,0.5567616463138851,0.5572139303482587,1.0,1.0,none,0.5834388832706112,0.5812492538105408,0.8043169299441952,0.5,COMPLETE
1949,0.7156549520766773,2025-11-27 11:32:11.889200,2025-11-27 11:32:38.975844,0 days 00:00:27.086644,0.0012731996590265538,dart,0.8549060490805178,8.020842826887446,depthwise,0.0740110936779646,0.0014035631843439616,4,3,0.2518942408801104,500,forest,0.5069156862308404,0.8483762574967861,0.05379903722625175,none,0.540836501695245,2.0890951858530955,5.0,0.6375763263240379,0.37225114540502474,uniform,0.495286234475514,0.3291451743947268,,0.5567616463138851,0.5572139303482587,0.715281812899477,0.7156549520766773,0.5069156862308404,0.8483762574967861,0.05,0.5093651653552178,0.5140228071315317,0.5567616463138851,0.5572139303482587,1.0,1.0,none,0.4507199224125068,0.4567255714153059,0.540836501695245,0.5,COMPLETE
1950,0.7156549520766773,2025-11-27 11:32:39.178750,2025-11-27 11:34:28.801262,0 days 00:01:49.622512,1.4776136497690422,dart,0.6166728258434653,5.363473283730771,depthwise,0.004131582976843875,0.0095487679520572,5,7,2.1342288833848326,1000,tree,0.8288732922004887,0.5622646640593627,0.09808588710857735,none,0.8852079359737792,0.9798153179320304,8.0,0.8317795926001293,0.4210566304932098,weighted,0.5258884921667595,0.7679428682906597,,0.5567616463138851,0.5572139303482587,0.715281812899477,0.7156549520766773,0.8288732922004887,0.5622646640593627,0.08,0.4650207989524049,0.4458748786873983,0.5567616463138851,0.5572139303482587,1.0,1.0,none,0.35763896947893703,0.3274776806441771,0.8852079359737792,0.5,COMPLETE
1951,0.43405381561535067,2025-11-27 11:34:29.006987,2025-11-27 11:35:19.805777,0 days 00:00:50.798790,2.1511445607258675,dart,0.6741239230906744,2.3383749483744696,lossguide,3.8855461006109664,0.0011282559324019162,3,9,8.64872979871939,600,forest,0.7023529331417382,0.8477524423398421,0.03094495362992712,undersample,0.9443217509648885,,8.0,0.665555815437741,0.010130574823940641,weighted,0.4532535438588191,0.2941986457943491,,0.3998190863862506,0.41971958389868835,0.4130915524104379,0.43405381561535067,0.7023529331417382,0.8477524423398421,0.02,0.4815412514920327,0.4891092040274827,0.4533980582524272,0.4753623188405797,0.3793663688058489,0.39935064935064934,undersample,0.38303353835441567,0.39285051006195026,0.9443217509648885,0.5,COMPLETE
1952,0.7156549520766773,2025-11-27 11:35:20.005376,2025-11-27 11:36:09.280728,0 days 00:00:49.275352,0.0005019254924437858,dart,0.8789833916375811,2.6202118844280853,lossguide,7.488848570480625,0.030145568568685294,10,11,62.072980317355814,500,forest,0.677458908578682,0.3406518762811752,0.09894057680301244,none,0.8016079282808098,3.8462087867064003,9.0,0.7841158854607415,0.09246695125799731,weighted,0.5563268624437879,0.8415440787408346,,0.5567616463138851,0.5572139303482587,0.715281812899477,0.7156549520766773,0.677458908578682,0.3406518762811752,0.08,0.551432685064029,0.5302410580697621,0.5567616463138851,0.5572139303482587,1.0,1.0,none,0.49067540907508417,0.473494521311171,0.8016079282808098,0.5,COMPLETE
1953,0.7256965944272445,2025-11-27 11:36:09.481159,2025-11-27 11:36:10.295701,0 days 00:00:00.814542,0.016531717861143574,gbtree,0.21574780657313114,3.6625945108514557,depthwise,0.6438651820282896,0.2990314098475635,2,9,17.204727417367383,900,,0.6971759624610989,0.33397255070420473,0.02968920253769294,oversample,0.7140733309447374,,9.0,0.7029175383860716,,,,0.937252386476096,,0.5961103573043871,0.5992763455450023,0.7215466167758029,0.7256965944272445,0.6971759624610989,0.33397255070420473,0.02,0.6428364613614361,0.6502959373390396,0.5855263157894737,0.5865865865865866,0.9398862713241267,0.9512987012987013,oversample,0.5672350337372967,0.5788850768740963,0.7140733309447374,0.5,COMPLETE
1954,0.7156549520766773,2025-11-27 11:36:10.494405,2025-11-27 11:37:26.892420,0 days 00:01:16.398015,0.00046933203527988544,dart,0.7427351316827244,9.177544728074384,depthwise,1.3760060920680328,0.05649374313558897,6,4,0.22147877545097713,800,tree,0.8571759370220513,0.3908116054382872,0.06345490613013686,oversample,0.573783254321286,,9.0,0.6408242941618432,0.21405681115638187,uniform,0.5107586017391824,0.8692622805308452,,0.5567616463138851,0.5572139303482587,0.715281812899477,0.7156549520766773,0.8571759370220513,0.3908116054382872,0.05,0.5567616463138851,0.5572139303482587,0.5567616463138851,0.5572139303482587,1.0,1.0,oversample,0.5,0.5,0.573783254321286,0.5,COMPLETE
1955,0.7156549520766773,2025-11-27 11:37:27.091091,2025-11-27 11:38:09.144777,0 days 00:00:42.053686,0.003619599277958967,dart,0.23793875899957576,1.2349014168125105,depthwise,13.163365505660629,0.00011358906323278095,3,10,2.7205212035251716,600,forest,0.7464530636484896,0.40648282156891846,0.011429768112828566,none,0.6720004429952845,3.436212742829457,7.0,0.8619511048147525,0.4053439034585939,uniform,0.5182006007123101,0.5232027475687807,,0.5567616463138851,0.5572139303482587,0.715281812899477,0.7156549520766773,0.7464530636484896,0.40648282156891846,0.02,0.4629111486350291,0.45537297799474674,0.5567616463138851,0.5572139303482587,1.0,1.0,none,0.3577546046850909,0.3483038284493852,0.6720004429952845,0.5,COMPLETE
1956,0.6618653222902413,2025-11-27 11:38:09.352923,2025-11-27 11:38:09.757437,0 days 00:00:00.404514,0.06273235192819077,gbtree,0.6232486036103477,7.2498446884468315,depthwise,58.54295780766792,0.03906722413146843,5,11,1.41136569187017,200,,0.5735542357283524,0.6496742389643995,0.028928197349516873,undersample,0.75036523051351,,8.0,0.6011964013216079,,,,0.5906282852312026,,0.5888738127544098,0.5753052917232022,0.6761667260420378,0.6618653222902413,0.5735542357283524,0.6496742389643995,0.02,0.5917580172915486,0.585267357262358,0.6021573604060914,0.594822006472492,0.7709179528838342,0.7459415584415584,undersample,0.5655610172582437,0.553256785349482,0.75036523051351,0.5,COMPLETE
1957,0.48454545454545456,2025-11-27 11:38:09.969752,2025-11-27 11:39:49.897056,0 days 00:01:39.927304,0.01662820282197617,dart,0.45292259862864603,4.845471479506448,lossguide,0.004767835806928716,0.07372840153134867,10,10,62.350706264096054,900,tree,0.5722046312927442,0.6483527970436168,0.001426712722868484,undersample,0.9429199313267016,,8.0,0.643220370246265,0.32146404577881704,uniform,0.7288144522255442,0.5428990736776542,,0.4767073722297603,0.4871099050203528,0.46853468075333027,0.48454545454545456,0.5722046312927442,0.6483527970436168,0.0,0.547096120568049,0.5444127760820909,0.5391120507399577,0.5506198347107438,0.41429731925264013,0.43262987012987014,undersample,0.4544190056201197,0.4620293202711487,0.9429199313267016,0.5,COMPLETE
1958,0.0,2025-11-27 11:39:50.113795,2025-11-27 11:39:50.756987,0 days 00:00:00.643192,0.09509103946289595,gbtree,0.4142461329746569,9.075651158169935,depthwise,0.07934548646186818,0.0014064425512405332,7,12,0.3349883563303602,600,,0.7275347460993711,0.5450424148044261,0.03838588355861747,undersample,0.7353218090051021,,5.0,0.6000888449492083,,,,0.9628500745889892,,0.44323835368611486,0.4427860696517413,0.0,0.0,0.7275347460993711,0.5450424148044261,0.05,0.5567616463138851,0.5572139303482587,0.0,0.0,0.0,0.0,undersample,0.5,0.5,0.7353218090051021,0.5,COMPLETE
1959,0.0,2025-11-27 11:39:50.960100,2025-11-27 11:39:51.716808,0 days 00:00:00.756708,29.135693917470327,gbtree,0.34033597277572436,3.4732818812409905,depthwise,68.48393669904165,0.032568582026007334,9,10,4.300483706092577,800,,0.5346404823689244,0.46396718088845107,0.04858198982665251,undersample,0.6817069376992977,,10.0,0.7596939866393138,,,,0.5794519452727993,,0.44323835368611486,0.4427860696517413,0.0,0.0,0.5346404823689244,0.46396718088845107,0.05,0.5567616463138851,0.5572139303482587,0.0,0.0,0.0,0.0,undersample,0.5,0.5,0.6817069376992977,0.5,COMPLETE
1960,0.7156549520766773,2025-11-27 11:39:51.925039,2025-11-27 11:39:52.668198,0 days 00:00:00.743159,16.093020368349343,gbtree,0.7936970574823292,3.3313122503113233,lossguide,0.0024983225238779747,0.12311860080472813,2,3,0.5249501694446465,700,,0.8057945529845464,0.8275378376529705,0.08336702063047016,none,0.7586107894966554,2.41722822469725,11.0,0.9239313193164288,,,,0.44054759674433774,,0.5567616463138851,0.5572139303482587,0.715281812899477,0.7156549520766773,0.8057945529845464,0.8275378376529705,0.08,0.6533014815869889,0.6491775913445001,0.5567616463138851,0.5572139303482587,1.0,1.0,none,0.6105447703045475,0.6150640728015601,0.7586107894966554,0.5,COMPLETE
1961,0.7156549520766773,2025-11-27 11:39:52.875525,2025-11-27 11:42:05.633191,0 days 00:02:12.757666,0.029798021949451404,dart,0.9867964099028621,6.995192226288048,lossguide,1.5088817325549266,0.0017196943207577942,0,7,76.91168477522524,1000,tree,0.7875989430122602,0.33016734328769626,0.051880338386677105,oversample,0.7438664348471125,,12.0,0.9343624884785663,0.007161473707492427,uniform,0.008944546707179169,0.27481007768656496,,0.5567616463138851,0.5572139303482587,0.715281812899477,0.7156549520766773,0.7875989430122602,0.33016734328769626,0.05,0.5567616463138851,0.5572139303482587,0.5567616463138851,0.5572139303482587,1.0,1.0,oversample,0.5,0.5,0.7438664348471125,0.5,COMPLETE
1962,0.5292895720814291,2025-11-27 11:42:05.834579,2025-11-27 11:42:09.325241,0 days 00:00:03.490662,0.21046461478627318,gbtree,0.9514820422608607,1.162821254650872,depthwise,0.0004542279689450614,0.019552056651839015,6,10,0.10401198067925232,700,,0.8481612043284564,0.27860547535167235,0.07712115591828013,undersample,0.5341573437557506,,6.0,0.7728588629995273,,,,0.7565880225389232,,0.5214834916327453,0.48756218905472637,0.5554621848739496,0.5292895720814291,0.8481612043284564,0.27860547535167235,0.08,0.5596975687595912,0.5330517649118757,0.5752828546562228,0.5421276595744681,0.536961819658814,0.5170454545454546,undersample,0.5192029045574362,0.4847155525781675,0.5341573437557506,0.5,COMPLETE
1963,0.715862870424172,2025-11-27 11:42:09.525547,2025-11-27 11:42:12.940318,0 days 00:00:03.414771,2.6050185839656828,gbtree,0.8471546991609713,3.872128540644427,depthwise,0.00012805994446804308,0.14678858782330853,10,4,15.956235930397671,1000,,0.70811426574358,0.8852005340920728,0.06045899677506547,none,0.8964509594234988,2.1672063183315693,6.0,0.6221707587951277,,,,0.278518347351534,,0.5572139303482587,0.5576662143826323,0.7154896832316188,0.715862870424172,0.70811426574358,0.8852005340920728,0.05,0.5525868554714883,0.5438419776760002,0.5570135746606335,0.5574660633484163,1.0,1.0,none,0.5086050829755134,0.497955855431596,0.8964509594234988,0.5,COMPLETE
1964,0.7156549520766773,2025-11-27 11:42:13.156134,2025-11-27 11:42:13.629432,0 days 00:00:00.473298,0.7110352967777558,gbtree,0.7667351995933493,9.200805449433547,depthwise,0.2637473763492446,0.00019152753214802032,2,6,7.9750490426339775,300,,0.6596454155073578,0.23588747322229503,0.0804973194003595,oversample,0.9683144373847976,,7.0,0.6597508267689214,,,,0.43424349498136516,,0.5567616463138851,0.5572139303482587,0.715281812899477,0.7156549520766773,0.6596454155073578,0.23588747322229503,0.08,0.5802399441490558,0.5765315309779513,0.5567616463138851,0.5572139303482587,1.0,1.0,oversample,0.5253742601833584,0.5135682116657602,0.9683144373847976,0.5,COMPLETE
1965,0.4571159283694628,2025-11-27 11:42:13.831715,2025-11-27 11:43:00.697560,0 days 00:00:46.865845,0.6678692223372463,dart,0.2831345004167113,3.8627736921801903,depthwise,11.149495736673352,0.1366810408429304,4,5,19.14255842667251,600,tree,0.8231583748906017,0.7114354029831671,0.008345433418587145,undersample,0.9368603330650318,,5.0,0.8475169642041729,0.029724010444878546,weighted,0.173589206560682,0.6987675346370805,,0.48484848484848486,0.4789687924016282,0.46298915605846297,0.4571159283694628,0.8231583748906017,0.7114354029831671,0.0,0.5369557747536559,0.5462006914539328,0.5516853932584269,0.5449438202247191,0.39886271324126726,0.39366883116883117,undersample,0.5037898506274971,0.5068392409429182,0.9368603330650318,0.5,COMPLETE
1966,0.7156549520766773,2025-11-27 11:43:00.915751,2025-11-27 11:43:01.500292,0 days 00:00:00.584541,3.341790231209603,gbtree,0.5660412550717129,5.51227556101778,lossguide,0.00015414844634078646,0.00015602813434840242,6,12,38.475649525778444,400,,0.734113455632855,0.346576025000058,0.04169749626978672,none,0.9583455561095444,1.2894842689623207,10.0,0.6973302192719398,,,,0.8860016586870112,,0.5567616463138851,0.5572139303482587,0.715281812899477,0.7156549520766773,0.734113455632855,0.346576025000058,0.05,0.46587102768071725,0.46412098326153695,0.5567616463138851,0.5572139303482587,1.0,1.0,none,0.3908967323728842,0.38575549195441944,0.9583455561095444,0.5,COMPLETE
1967,0.7156549520766773,2025-11-27 11:43:01.698502,2025-11-27 11:44:02.328191,0 days 00:01:00.629689,0.00023492692013772894,dart,0.700240163829551,3.6522975808848113,lossguide,0.749364447234611,0.0004168838296876391,1,6,0.9104566173985907,700,forest,0.5339560195273179,0.3728254318564287,0.018587606519209623,none,0.9442640622049719,3.0935123856474926,5.0,0.8978103079529847,0.2909202832042599,weighted,0.5121148288564411,0.8928920062587398,,0.5567616463138851,0.5572139303482587,0.715281812899477,0.7156549520766773,0.5339560195273179,0.3728254318564287,0.02,0.45961918598670515,0.4606096351915791,0.5567616463138851,0.5572139303482587,1.0,1.0,none,0.3599873174290025,0.36257926190255096,0.9442640622049719,0.5,COMPLETE
1968,0.2146298729741568,2025-11-27 11:44:02.533572,2025-11-27 11:44:03.168608,0 days 00:00:00.635036,0.0007729939191256873,gbtree,0.9916030433062943,6.880821119954666,depthwise,0.020593054913263013,0.0009198301754880285,3,8,5.915307605351396,500,,0.8423404256486486,0.27819667618681887,0.037996764754209926,undersample,0.9697346198670382,,6.0,0.8212493392157683,,,,0.955963494933532,,0.1863410221619177,0.1890547263681592,0.2120017520805957,0.2146298729741568,0.8423404256486486,0.27819667618681887,0.05,0.3839064717882111,0.3849974254403281,0.2300380228136882,0.23311132254995243,0.1965881397238018,0.19886363636363635,undersample,0.14206841956928995,0.14207903307111686,0.9697346198670382,0.5,COMPLETE
1969,0.7156549520766773,2025-11-27 11:44:03.367175,2025-11-27 11:45:18.188113,0 days 00:01:14.820938,0.00024751044803648367,dart,0.3996050438579249,6.377241128336434,lossguide,0.00013042400676584873,0.00046354776396754203,7,8,18.39473445557537,800,forest,0.9414027086689976,0.32310068223898475,0.07833947504052113,oversample,0.6511607477476746,,7.0,0.703049070784074,0.43600158935806177,uniform,0.7337830638760869,0.27369359520188974,,0.5567616463138851,0.5572139303482587,0.715281812899477,0.7156549520766773,0.9414027086689976,0.32310068223898475,0.08,0.38810269277910087,0.3850990161569635,0.5567616463138851,0.5572139303482587,1.0,1.0,oversample,0.17288831048260084,0.1608291159810567,0.6511607477476746,0.5,COMPLETE
1970,0.7106993424985056,2025-11-27 11:45:18.396914,2025-11-27 11:45:22.680174,0 days 00:00:04.283260,0.08220843914165482,gbtree,0.748405444707239,2.4890540953586546,lossguide,0.00030457806931934585,0.07010224144051747,7,6,2.080834417961281,500,,0.6799898851235404,0.28447420477221724,0.09053849090933398,none,0.9503388705946305,2.826099537695886,9.0,0.8923311669212719,,,,0.3992135205411995,,0.561284486657621,0.5621890547263682,0.711481261154075,0.7106993424985056,0.6799898851235404,0.28447420477221724,0.08,0.5312728501850325,0.5255832503165652,0.5612388549976537,0.5624408703878903,0.9715678310316815,0.9650974025974026,none,0.4754745602546462,0.4701694181712057,0.9503388705946305,0.5,COMPLETE
1971,0.7156549520766773,2025-11-27 11:45:22.882457,2025-11-27 11:45:23.739793,0 days 00:00:00.857336,94.49684466352639,gbtree,0.8726614535130237,0.8980043677436733,depthwise,0.0012471682330621855,0.0004326916163245103,2,8,77.96682144210615,1000,,0.5848104511394698,0.8363354253255122,0.00473173756039359,oversample,0.5269170069574758,,8.0,0.9387042902255185,,,,0.8228774585590797,,0.5567616463138851,0.5572139303482587,0.715281812899477,0.7156549520766773,0.5848104511394698,0.8363354253255122,0.0,0.5567616463138851,0.5572139303482587,0.5567616463138851,0.5572139303482587,1.0,1.0,oversample,0.5,0.5,0.5269170069574758,0.5,COMPLETE
1972,0.0,2025-11-27 11:45:23.945594,2025-11-27 11:45:41.162947,0 days 00:00:17.217353,0.14091814389317922,dart,0.5185050944824199,2.626456515920524,depthwise,0.0011348268383889898,0.19305463995234742,3,11,79.2302961549214,400,tree,0.5467395350028597,0.27799568469435265,0.015717147643104955,undersample,0.7797746518179933,,10.0,0.7277204083151514,0.37160647030569566,uniform,0.4307923115147272,0.47548683738478675,,0.44323835368611486,0.4427860696517413,0.0,0.0,0.5467395350028597,0.27799568469435265,0.02,0.5567616463138851,0.5572139303482587,0.0,0.0,0.0,0.0,undersample,0.5,0.5,0.7797746518179933,0.5,COMPLETE
1973,0.2818627450980392,2025-11-27 11:45:41.365643,2025-11-27 11:45:42.064276,0 days 00:00:00.698633,1.2281796650369936,gbtree,0.41350429285775975,8.6104388934984,depthwise,0.5837595274746794,0.0002598181617714919,5,4,2.5877173903697095,700,,0.9500227850569075,0.7417669185123275,0.006915139007142301,undersample,0.5361110066154731,,5.0,0.6451028741627068,,,,0.5145329203276929,,0.47218453188602444,0.4699231117141565,0.2871105681124007,0.2818627450980392,0.9500227850569075,0.7417669185123275,0.0,0.5785795751977252,0.5720673396616112,0.5788177339901478,0.575,0.1909017059301381,0.18668831168831168,undersample,0.48966163232149074,0.479699086664102,0.5361110066154731,0.5,COMPLETE
