number,value,datetime_start,datetime_complete,duration,params_alpha,params_booster,params_colsample_bytree,params_gamma,params_grow_policy,params_lambda,params_learning_rate,params_max_delta_step,params_max_depth,params_min_child_weight,params_n_estimators,params_normalize_type,params_params_feature_fraction,params_params_labeled_ratio,params_params_missing_rate,params_params_resampling,params_params_sample_rows,params_params_scale_pos_weight,params_params_selftrain_max_iter,params_params_selftrain_threshold,params_rate_drop,params_sample_type,params_skip_drop,params_subsample,params_user_attrs_decision_threshold,user_attrs_acc_test,user_attrs_acc_val,user_attrs_f1_test,user_attrs_f1_val,user_attrs_feature_fraction,user_attrs_labeled_ratio,user_attrs_missing_rate,user_attrs_pr_auc_test,user_attrs_pr_auc_val,user_attrs_prec_test,user_attrs_prec_val,user_attrs_rec_test,user_attrs_rec_val,user_attrs_resampling_strategy,user_attrs_roc_auc_test,user_attrs_roc_auc_val,user_attrs_sample_rows,user_attrs_user_attrs_decision_threshold,state
1705,0.0,2025-11-27 09:55:15.402711,2025-11-27 09:55:16.052489,0 days 00:00:00.649778,0.0031851032740754974,gbtree,0.44232384693586807,4.76083985968232,depthwise,0.13770063403685767,0.007178666197504419,1,9,27.199154994365998,600,,0.6357751450032378,0.523297409513356,0.042681951511054084,none,0.7085148705959967,0.5299096539679713,8.0,0.8541851484571444,,,,0.6840344134483779,,0.44323835368611486,0.4427860696517413,0.0,0.0,0.6357751450032378,0.523297409513356,0.05,0.5395595349801009,0.5358430164867396,0.0,0.0,0.0,0.0,none,0.4447549694126228,0.4253727630898213,0.7085148705959967,0.5,COMPLETE
1706,0.7156549520766773,2025-11-27 09:55:16.248087,2025-11-27 09:55:16.739161,0 days 00:00:00.491074,0.000235144601763317,gbtree,0.5037331545653432,3.5020195195657644,lossguide,0.004054451363151272,0.013681731941109014,0,6,36.1583391280855,300,,0.6980922799976603,0.6213605886791786,0.07791109940193555,none,0.572725070349433,4.7624122358588545,8.0,0.6221791515920969,,,,0.8570427821584834,,0.5567616463138851,0.5572139303482587,0.715281812899477,0.7156549520766773,0.6980922799976603,0.6213605886791786,0.08,0.5155678806948514,0.5372489118551803,0.5567616463138851,0.5572139303482587,1.0,1.0,none,0.4379349790281669,0.45862752543676955,0.572725070349433,0.5,COMPLETE
1707,0.3465045592705167,2025-11-27 09:55:16.953878,2025-11-27 09:55:18.524556,0 days 00:00:01.570678,0.0001975657031255486,gbtree,0.40228310219860897,0.8316477180810911,depthwise,70.57429282164722,0.0011580644106181186,2,9,20.27667630202752,1000,,0.7840811220904749,0.6675839507221524,0.05323360708973223,undersample,0.87455030332486,,8.0,0.8942905848442875,,,,0.9467647129189747,,0.3211216644052465,0.31931252826775214,0.3516198704103672,0.3465045592705167,0.7840811220904749,0.6675839507221524,0.05,0.4209959757775325,0.4210558418771976,0.37546125461254615,0.37254901960784315,0.330625507717303,0.32386363636363635,undersample,0.2768820769575092,0.280682896011037,0.87455030332486,0.5,COMPLETE
1708,0.7156549520766773,2025-11-27 09:55:18.739196,2025-11-27 09:55:19.669794,0 days 00:00:00.930598,0.00014560851290158146,gbtree,0.6764680157089304,6.6518284441188875,lossguide,0.0009746160051382196,0.0032485191751538056,9,10,3.5916741570437005,900,,0.9841058856656208,0.40671512563506973,0.013426702371782485,none,0.7442212333651379,2.5329968980363526,7.0,0.8468573704727417,,,,0.45400295934934837,,0.5567616463138851,0.5572139303482587,0.715281812899477,0.7156549520766773,0.9841058856656208,0.40671512563506973,0.02,0.7512508097892998,0.7362576243554948,0.5567616463138851,0.5572139303482587,1.0,1.0,none,0.7029820620368374,0.681826887361872,0.7442212333651379,0.5,COMPLETE
1709,0.6891679748822606,2025-11-27 09:55:19.866621,2025-11-27 09:55:20.444051,0 days 00:00:00.577430,0.06923319173258802,gbtree,0.38432025144574045,5.831379784738219,lossguide,0.0035335866091156564,0.0012084001958871707,6,12,0.5469804672209326,500,,0.6776899075305256,0.2307037008364678,0.0680370254395195,undersample,0.9873616187076186,,6.0,0.6644715072815894,,,,0.8673410052449897,,0.6404341926729986,0.6417910447761194,0.6853977047882865,0.6891679748822606,0.6776899075305256,0.2307037008364678,0.08,0.6765869258030526,0.6768883348586128,0.6682098765432098,0.6671732522796353,0.7034930950446792,0.7126623376623377,undersample,0.6991930403355494,0.6990203361500604,0.9873616187076186,0.5,COMPLETE
1710,0.5091225021720244,2025-11-27 09:55:20.644361,2025-11-27 09:56:00.865096,0 days 00:00:40.220735,0.0227276051347091,dart,0.5479641752215023,3.2592393982149916,depthwise,1.7789412360225176,0.10835898357765411,3,9,0.49240428530048325,600,tree,0.5880519188947481,0.42386513477725046,0.021727563002800834,undersample,0.9609578996242825,,9.0,0.8858887995174531,0.4947625414725136,uniform,0.5799740078133119,0.22341675208083533,,0.4622342831298055,0.4889190411578471,0.480104940970704,0.5091225021720244,0.5880519188947481,0.42386513477725046,0.02,0.5034482741657781,0.521143825679085,0.5198863636363636,0.5476635514018692,0.44597887896019495,0.47564935064935066,undersample,0.44970075763855505,0.47609872252364593,0.9609578996242825,0.5,COMPLETE
1711,0.0,2025-11-27 09:56:01.074628,2025-11-27 09:57:08.608141,0 days 00:01:07.533513,1.9031634048735135,dart,0.5425589261396258,8.477393315953481,depthwise,0.2335566866708997,0.01310618174080441,0,8,0.47242403559822044,800,forest,0.7106366981582054,0.8483861160984087,0.07890359725593335,undersample,0.7845979861154723,,5.0,0.8316172581115436,0.29513996086440847,weighted,0.2803044559879806,0.9854913736106421,,0.44323835368611486,0.4427860696517413,0.0,0.0,0.7106366981582054,0.8483861160984087,0.08,0.5567616463138851,0.5572139303482587,0.0,0.0,0.0,0.0,undersample,0.5,0.5,0.7845979861154723,0.5,COMPLETE
1712,0.7156549520766773,2025-11-27 09:57:08.803553,2025-11-27 09:57:09.701149,0 days 00:00:00.897596,14.362160049743643,gbtree,0.21538564748123878,2.889067713573552,depthwise,69.47828815870221,0.018383943927623627,9,3,14.82071934269039,1000,,0.9779561546551023,0.6095357072967087,0.053887700432110976,oversample,0.8164248284574812,,12.0,0.938590210610979,,,,0.93252227278865,,0.5567616463138851,0.5572139303482587,0.715281812899477,0.7156549520766773,0.9779561546551023,0.6095357072967087,0.05,0.7099727251247957,0.7226654878129889,0.5567616463138851,0.5572139303482587,1.0,1.0,oversample,0.684105754405743,0.6855715147977661,0.8164248284574812,0.5,COMPLETE
1713,0.7156549520766773,2025-11-27 09:57:09.902060,2025-11-27 09:57:17.679892,0 days 00:00:07.777832,0.010912044869831612,gbtree,0.6830263230740525,1.0207172911915185,lossguide,3.4802620891682015,0.00012720981549971437,7,11,0.21949498100586118,600,,0.7640409639546931,0.7608913939019453,0.05756340728609815,oversample,0.9704751649390692,,8.0,0.6176018721015861,,,,0.7103748357925608,,0.5567616463138851,0.5572139303482587,0.715281812899477,0.7156549520766773,0.7640409639546931,0.7608913939019453,0.05,0.5384779672547129,0.5247523200865141,0.5567616463138851,0.5572139303482587,1.0,1.0,oversample,0.49364047812463735,0.4763544996882586,0.9704751649390692,0.5,COMPLETE
1714,0.7156549520766773,2025-11-27 09:57:17.884623,2025-11-27 09:58:55.409296,0 days 00:01:37.524673,0.002019822760099051,dart,0.6241594904095218,9.649279429455298,depthwise,59.175170801008576,0.004232575542189877,6,9,0.10758636114094972,900,forest,0.5362369621244281,0.2038463724664139,0.012354668493190935,undersample,0.6383974507337495,,7.0,0.696686683614239,0.1517744253268536,uniform,0.2969647953922764,0.23307709785324537,,0.5567616463138851,0.5572139303482587,0.715281812899477,0.7156549520766773,0.5362369621244281,0.2038463724664139,0.02,0.5567616463138851,0.5572139303482587,0.5567616463138851,0.5572139303482587,1.0,1.0,undersample,0.5,0.5,0.6383974507337495,0.5,COMPLETE
1715,0.7156549520766773,2025-11-27 09:58:55.605763,2025-11-27 09:59:24.816135,0 days 00:00:29.210372,0.008695432880916584,dart,0.3608043853447246,6.361895490858444,depthwise,0.00029406891898989577,0.4787538864818412,4,9,17.258369049760752,500,forest,0.7861585079793127,0.8264088181406877,0.09630938902119274,oversample,0.7031362484530594,,7.0,0.6616985740490051,0.2645871348563283,uniform,0.48852582187753224,0.9307137267657255,,0.5567616463138851,0.5572139303482587,0.715281812899477,0.7156549520766773,0.7861585079793127,0.8264088181406877,0.08,0.5946431700099927,0.575183898620571,0.5567616463138851,0.5572139303482587,1.0,1.0,oversample,0.5731063180755649,0.5406544744836368,0.7031362484530594,0.5,COMPLETE
1716,0.6927674835624626,2025-11-27 09:59:25.012922,2025-11-27 09:59:25.673103,0 days 00:00:00.660181,0.1288838385849484,gbtree,0.710467678177827,6.873517954472738,lossguide,6.402539495098635,0.26145570861881906,0,11,2.779207020772087,600,,0.7442165439679165,0.8861113262086946,0.053443202816535966,oversample,0.9550656935667334,,7.0,0.7479135258408669,,,,0.4354531271629883,,0.5355042966983266,0.535052012663953,0.6940720881739648,0.6927674835624626,0.7442165439679165,0.8861113262086946,0.05,0.4458385586702534,0.44781409415213985,0.5479774223894638,0.5482497634815515,0.9463850528025995,0.9407467532467533,oversample,0.3312277226081334,0.33802672684822843,0.9550656935667334,0.5,COMPLETE
1717,0.7156549520766773,2025-11-27 09:59:25.883288,2025-11-27 09:59:26.672967,0 days 00:00:00.789679,24.243759123282818,gbtree,0.9285801878742725,1.2479644789430067,lossguide,0.3030323539467789,0.030450214284727013,9,11,1.8502162217379765,800,,0.739386318408854,0.37075857320682404,0.00909693392955635,none,0.7822985548203607,1.5998653884252834,5.0,0.8527527679950364,,,,0.535113941214732,,0.5567616463138851,0.5572139303482587,0.715281812899477,0.7156549520766773,0.739386318408854,0.37075857320682404,0.0,0.5247013962751375,0.5085649216706878,0.5567616463138851,0.5572139303482587,1.0,1.0,none,0.47924783235796353,0.44237634811562293,0.7822985548203607,0.5,COMPLETE
1718,0.46687211093990755,2025-11-27 09:59:26.882681,2025-11-27 09:59:27.515324,0 days 00:00:00.632643,0.1007452903428296,gbtree,0.4697192909319612,8.79417462024168,lossguide,0.004467230936575621,0.001147160231064257,6,7,3.197233927330889,600,,0.5827416141698065,0.637792327245818,0.009824991345203671,undersample,0.8664075620183478,,11.0,0.8179761479364788,,,,0.3876399216536247,,0.373134328358209,0.37403889642695615,0.45,0.46687211093990755,0.5827416141698065,0.637792327245818,0.0,0.45198435027463896,0.459498598733845,0.43987587276958884,0.4442815249266862,0.4606011372867587,0.49188311688311687,undersample,0.3093602347519024,0.31698252590106524,0.8664075620183478,0.5,COMPLETE
1719,0.7156549520766773,2025-11-27 09:59:27.722939,2025-11-27 09:59:29.616805,0 days 00:00:01.893866,0.0032295084782628446,gbtree,0.45941830043360893,2.264912779410216,lossguide,0.07702146662395043,0.00010077231279752786,4,7,0.16197310546569157,400,,0.787555558234992,0.8972703082108666,0.02916661334230033,none,0.6135644084496619,1.5050324464135105,7.0,0.6812734143072573,,,,0.9013455137784385,,0.5567616463138851,0.5572139303482587,0.715281812899477,0.7156549520766773,0.787555558234992,0.8972703082108666,0.02,0.6324573115259566,0.6199181687851925,0.5567616463138851,0.5572139303482587,1.0,1.0,none,0.5913053929939156,0.5978527983762918,0.6135644084496619,0.5,COMPLETE
1720,0.7156549520766773,2025-11-27 09:59:29.815767,2025-11-27 09:59:35.011539,0 days 00:00:05.195772,2.3457081563899065,dart,0.8217541827227526,3.7193477984906886,lossguide,46.43495046839785,0.19239160570559305,1,6,0.7866282580916866,200,tree,0.5931057975933616,0.331879665947963,0.08113794039634868,none,0.7362144226582584,1.5629375442561892,10.0,0.7525444245984088,0.11680907250979,weighted,0.12768053376623276,0.6133909718544387,,0.5567616463138851,0.5572139303482587,0.715281812899477,0.7156549520766773,0.5931057975933616,0.331879665947963,0.08,0.4423091448985158,0.4330305365953811,0.5567616463138851,0.5572139303482587,1.0,1.0,none,0.30522306404283894,0.28951073186262155,0.7362144226582584,0.5,COMPLETE
1721,0.046681254558716266,2025-11-27 09:59:35.215199,2025-11-27 10:01:24.765797,0 days 00:01:49.550598,0.15368186626089325,dart,0.24293032503327128,9.615751443000814,lossguide,0.00013785412317529386,0.012663827595994038,8,3,6.72177224439729,900,forest,0.8818734335941072,0.24294187521724994,0.027741804183599828,none,0.6695592070172642,0.7585979693990786,5.0,0.7619664303142695,0.015144205077953388,weighted,0.3662517602444304,0.3638250895486819,,0.41067390321121666,0.4088647670737223,0.05511240029006526,0.046681254558716266,0.8818734335941072,0.24294187521724994,0.02,0.5200995953948362,0.5125114281293413,0.25675675675675674,0.2302158273381295,0.030869212022745736,0.025974025974025976,none,0.4233881529866211,0.4003849508509876,0.6695592070172642,0.5,COMPLETE
1722,0.25381330079316655,2025-11-27 10:01:25.018382,2025-11-27 10:01:28.968661,0 days 00:00:03.950279,0.02856089899838868,dart,0.7255511695201153,9.088765512228052,lossguide,0.005991611249443494,0.07285549820614083,7,12,1.1928469827734556,200,forest,0.7882975386817623,0.4985999797908361,0.06004710432403803,undersample,0.545635360428389,,7.0,0.9066916783876096,0.41061880047455546,uniform,0.13494725065949595,0.27736900975361733,,0.46178199909543194,0.4468566259611036,0.2617866004962779,0.25381330079316655,0.7882975386817623,0.4985999797908361,0.05,0.47256863731908366,0.458275108860952,0.5538057742782152,0.5110565110565111,0.17140536149471974,0.16883116883116883,undersample,0.3354581475157081,0.3076543285621426,0.545635360428389,0.5,COMPLETE
1723,0.0,2025-11-27 10:01:29.174675,2025-11-27 10:01:54.831775,0 days 00:00:25.657100,0.00012652578855627136,dart,0.9830372301937191,8.776183773849764,depthwise,0.5536144324863598,0.0001252025996443666,5,8,71.8338881636614,500,tree,0.89695419154938,0.496484871770778,0.055852309743224485,undersample,0.7014542223659466,,10.0,0.7937076503844601,0.483368871921743,weighted,0.481237356974934,0.5023811791863013,,0.44323835368611486,0.4427860696517413,0.0,0.0,0.89695419154938,0.496484871770778,0.05,0.5346266790264026,0.5435509236148895,0.0,0.0,0.0,0.0,undersample,0.4518468475936272,0.47104370348752367,0.7014542223659466,0.5,COMPLETE
1724,0.46296296296296297,2025-11-27 10:01:55.036166,2025-11-27 10:01:55.825042,0 days 00:00:00.788876,0.06760586863937952,gbtree,0.7794647833886232,3.7743018521539384,lossguide,1.050590933738374,0.00014456292743983453,9,9,25.25117114690687,700,,0.5771388888290018,0.41848471069718995,0.07581834698938779,undersample,0.6177836002524875,,11.0,0.6902855723692716,,,,0.761871314153366,,0.4251469923111714,0.4491180461329715,0.43435692033822876,0.46296296296296297,0.5771388888290018,0.41848471069718995,0.08,0.4936095079490012,0.5062741370299824,0.48031496062992124,0.5067567567567568,0.39642567018683994,0.42613636363636365,undersample,0.3701619721812364,0.3942417388535876,0.6177836002524875,0.5,COMPLETE
1725,0.0,2025-11-27 10:01:56.034195,2025-11-27 10:01:56.499472,0 days 00:00:00.465277,0.005027432989570434,gbtree,0.45073641818793053,6.4937273062938585,lossguide,0.10096075604390303,0.3454056936058375,9,11,3.933846905140258,300,,0.5956010985087246,0.6228188533516568,0.03672514125601705,none,0.7308196806594184,0.5668500116236214,9.0,0.8317642784954593,,,,0.4289180831972834,,0.44323835368611486,0.4427860696517413,0.0,0.0,0.5956010985087246,0.6228188533516568,0.05,0.5270197976534984,0.5205299911983193,0.0,0.0,0.0,0.0,none,0.4544600374674646,0.43543388429752067,0.7308196806594184,0.5,COMPLETE
1726,0.0,2025-11-27 10:01:56.709010,2025-11-27 10:03:21.424368,0 days 00:01:24.715358,0.0011705644151321407,dart,0.47074993582299807,6.832706964459297,lossguide,0.12883288277836136,0.12153442983509656,5,7,0.22970062796991078,800,tree,0.8501018843674681,0.8009342980212979,0.07571297778090658,none,0.6781265887689497,0.5171729781806363,7.0,0.6866100151286405,0.05756892508821593,weighted,0.736865175912561,0.9783468938241713,,0.44323835368611486,0.4427860696517413,0.0,0.0,0.8501018843674681,0.8009342980212979,0.08,0.5567616463138851,0.5572139303482587,0.0,0.0,0.0,0.0,none,0.5,0.5,0.6781265887689497,0.5,COMPLETE
1727,0.7156549520766773,2025-11-27 10:03:21.622000,2025-11-27 10:03:22.023522,0 days 00:00:00.401522,46.29764714118846,gbtree,0.9060687789857973,4.54386298099938,lossguide,72.05106099357593,0.0009252116030663461,1,7,1.6523875252530922,200,,0.9714197231055082,0.5739092144101141,0.07433402256486647,undersample,0.6829460726784671,,7.0,0.8807517838957283,,,,0.31178412123181287,,0.5567616463138851,0.5572139303482587,0.715281812899477,0.7156549520766773,0.9714197231055082,0.5739092144101141,0.08,0.5567616463138851,0.5572139303482587,0.5567616463138851,0.5572139303482587,1.0,1.0,undersample,0.5,0.5,0.6829460726784671,0.5,COMPLETE
1728,0.5392,2025-11-27 10:03:22.221790,2025-11-27 10:03:53.364381,0 days 00:00:31.142591,0.04990758807370292,dart,0.3238955325235833,8.89762135819764,depthwise,0.00023500045294421918,0.008320154786067326,1,4,0.19516847012165883,500,forest,0.7793654954032445,0.43143194991789563,0.05080443388649867,undersample,0.9310831335210137,,8.0,0.8958332986012287,0.3163828205531551,uniform,0.7132996505974015,0.4277552531123444,,0.506558118498417,0.4789687924016282,0.5713163064833006,0.5392,0.7793654954032445,0.43143194991789563,0.05,0.5608841707661706,0.5493425890819068,0.5532724505327246,0.5315457413249212,0.5905767668562144,0.547077922077922,undersample,0.5157367496145494,0.4946564543730019,0.9310831335210137,0.5,COMPLETE
1729,0.7156549520766773,2025-11-27 10:03:53.565066,2025-11-27 10:04:58.745344,0 days 00:01:05.180278,0.5051585171086325,dart,0.8508653453208497,9.958300034113988,lossguide,8.007399641155509,0.00011299964187107858,8,7,6.830554671299298,900,forest,0.9768530909815417,0.7566769685569308,0.015851485058039905,oversample,0.7697509625137242,,9.0,0.7364252479754916,0.42321308198943236,uniform,0.05235876213904026,0.931519109438308,,0.5567616463138851,0.5572139303482587,0.715281812899477,0.7156549520766773,0.9768530909815417,0.7566769685569308,0.02,0.4962399468636398,0.49497094357409543,0.5567616463138851,0.5572139303482587,1.0,1.0,oversample,0.3166452527396011,0.2961522325988618,0.7697509625137242,0.5,COMPLETE
1730,0.3168056164984642,2025-11-27 10:04:58.936764,2025-11-27 10:05:16.488941,0 days 00:00:17.552177,0.00011605572822683442,dart,0.3764044625726348,6.619487321735314,depthwise,0.0002586229648238957,0.0009105346114025045,10,10,77.99399589893298,400,tree,0.7541356875230982,0.7512265354266274,0.06566050997098814,undersample,0.5996140732120896,,12.0,0.7567573325219059,0.32600642983430705,uniform,0.4539476912004997,0.9976370753640804,,0.3179556761646314,0.29579375848032563,0.3488773747841105,0.3168056164984642,0.7541356875230982,0.7512265354266274,0.08,0.493855357378885,0.4941499923437232,0.3723502304147465,0.3447946513849093,0.3281884646628757,0.2930194805194805,undersample,0.3129449261426748,0.294857593887216,0.5996140732120896,0.5,COMPLETE
1731,0.7156549520766773,2025-11-27 10:05:16.691939,2025-11-27 10:06:57.812259,0 days 00:01:41.120320,0.005371453287502338,dart,0.9344035216313173,6.734584835406308,depthwise,52.194022370392666,0.013986192368845227,6,6,12.044124117982347,1000,forest,0.5380725811007652,0.3106418135208347,0.04346325243910505,oversample,0.5029693768415349,,10.0,0.8327785684497117,0.3728818670481641,weighted,0.3177327514027582,0.4330892229007936,,0.5567616463138851,0.5572139303482587,0.715281812899477,0.7156549520766773,0.5380725811007652,0.3106418135208347,0.05,0.5457168333878788,0.5404708306166923,0.5567616463138851,0.5572139303482587,1.0,1.0,oversample,0.47593834446857547,0.4617229680431927,0.5029693768415349,0.5,COMPLETE
1732,0.7156549520766773,2025-11-27 10:06:58.003285,2025-11-27 10:07:33.684825,0 days 00:00:35.681540,43.10962621573522,dart,0.25855783881998273,5.904214750302634,lossguide,0.18841774919244533,0.034559706579674124,6,4,6.400686650767645,600,forest,0.5888582919581289,0.5254455180883637,0.0758365495956166,oversample,0.7358465349378159,,6.0,0.8131777606125008,0.3062126245483672,uniform,0.20934168971137584,0.3033251174612464,,0.5567616463138851,0.5572139303482587,0.715281812899477,0.7156549520766773,0.5888582919581289,0.5254455180883637,0.08,0.5567616463138851,0.5572139303482587,0.5567616463138851,0.5572139303482587,1.0,1.0,oversample,0.5,0.5,0.7358465349378159,0.5,COMPLETE
1733,0.5611015490533563,2025-11-27 10:07:33.888622,2025-11-27 10:07:35.000134,0 days 00:00:01.111512,0.0003689127582472901,gbtree,0.8688140662181689,4.325966430678648,depthwise,0.9095449697779293,0.001751093009237661,1,7,0.22408924917939135,1000,,0.5623700939046818,0.5232303408270629,0.028702022134098438,undersample,0.9522425131004499,,12.0,0.7520207885694687,,,,0.4450152761341989,,0.5382180009045681,0.5386702849389416,0.5570498915401302,0.5611015490533563,0.5623700939046818,0.5232303408270629,0.02,0.5649590014919768,0.5577036805874199,0.5977653631284916,0.5970695970695971,0.5215272136474411,0.5292207792207793,undersample,0.5501003000712876,0.5477602708833555,0.9522425131004499,0.5,COMPLETE
1734,0.7156549520766773,2025-11-27 10:07:35.196021,2025-11-27 10:07:35.592570,0 days 00:00:00.396549,0.0015503883149084825,gbtree,0.47218498745355647,5.938300983792906,lossguide,0.16816675110025403,0.004594128200581197,3,12,0.2830216017214953,200,,0.6368191551500114,0.34749744980443875,0.08797224082996742,oversample,0.6110699608806066,,7.0,0.8699011339691058,,,,0.6824305115410968,,0.5567616463138851,0.5572139303482587,0.715281812899477,0.7156549520766773,0.6368191551500114,0.34749744980443875,0.08,0.5699517804934917,0.563090304452081,0.5567616463138851,0.5572139303482587,1.0,1.0,oversample,0.5390585885044513,0.538129452263773,0.6110699608806066,0.5,COMPLETE
