number,value,datetime_start,datetime_complete,duration,params_alpha,params_booster,params_colsample_bytree,params_gamma,params_grow_policy,params_lambda,params_learning_rate,params_max_delta_step,params_max_depth,params_min_child_weight,params_n_estimators,params_normalize_type,params_params_feature_fraction,params_params_labeled_ratio,params_params_missing_rate,params_params_resampling,params_params_sample_rows,params_params_scale_pos_weight,params_params_selftrain_max_iter,params_params_selftrain_threshold,params_rate_drop,params_sample_type,params_skip_drop,params_subsample,params_user_attrs_decision_threshold,user_attrs_acc_test,user_attrs_acc_val,user_attrs_f1_test,user_attrs_f1_val,user_attrs_feature_fraction,user_attrs_labeled_ratio,user_attrs_missing_rate,user_attrs_pr_auc_test,user_attrs_pr_auc_val,user_attrs_prec_test,user_attrs_prec_val,user_attrs_rec_test,user_attrs_rec_val,user_attrs_resampling_strategy,user_attrs_roc_auc_test,user_attrs_roc_auc_val,user_attrs_sample_rows,user_attrs_user_attrs_decision_threshold,state
116,0.7156549520766773,2025-11-26 17:02:37.175177,2025-11-26 17:02:39.711919,0 days 00:00:02.536742,0.38619226023665987,gbtree,0.7461504482282877,2.059364704727333,depthwise,0.00092150071108603,0.004958286764933046,6,6,0.19909979756858237,400,,0.8614404128708146,0.4435840199937193,0.09896210532277605,none,0.7966157999385897,1.731640753713308,5.0,0.6724173807452607,,,,0.23339785094939028,0.12903376936414096,0.5567616463138851,0.5572139303482587,0.715281812899477,0.7156549520766773,0.8614404128708146,0.4435840199937193,0.1,0.5515560525394361,0.5536076325409116,0.5567616463138851,0.5572139303482587,1.0,1.0,none,0.5107350088695104,0.5147795258877996,0.7966157999385897,0.12903376936414096,COMPLETE
117,0.7216128075896828,2025-11-26 17:02:39.883955,2025-11-26 17:02:51.792340,0 days 00:00:11.908385,0.6055233792397844,gbtree,0.8514761231168408,1.096263600260001,lossguide,2.3116466074499,0.006562694044943271,6,10,1.4770165534368174,700,,0.7795214642669368,0.2850977811661107,0.08310336822016004,oversample,0.6722431398626314,,7.0,0.7044896550177941,,,,0.669020884118135,0.35362205939908486,0.5780189959294437,0.5753052917232022,0.7232275289231682,0.7216128075896828,0.7795214642669368,0.2850977811661107,0.08,0.5588297671156763,0.5489990497867385,0.569626168224299,0.5684259691732835,0.9902518277822908,0.9878246753246753,oversample,0.5201093353669657,0.5214554342491012,0.6722431398626314,0.35362205939908486,COMPLETE
118,0.7156549520766773,2025-11-26 17:02:51.957981,2025-11-26 17:02:53.079486,0 days 00:00:01.121505,2.767048013651658,gbtree,0.921457779472882,1.3898245309331596,lossguide,17.96623286303732,0.003513904700260614,9,9,3.670369826642166,700,,0.7808925413666388,0.29164069743723836,0.07860088035006976,oversample,0.7081377341397065,,7.0,0.7506336242451564,,,,0.7716631895423562,0.43251357206855523,0.5567616463138851,0.5572139303482587,0.715281812899477,0.7156549520766773,0.7808925413666388,0.29164069743723836,0.08,0.510537184942118,0.5359107615720925,0.5567616463138851,0.5572139303482587,1.0,1.0,oversample,0.4149434672325469,0.4376438487457385,0.7081377341397065,0.43251357206855523,COMPLETE
119,0.0,2025-11-26 17:02:53.246446,2025-11-26 17:02:54.192434,0 days 00:00:00.945988,0.03720242049111143,gbtree,0.41902085212746454,6.555519238484576,depthwise,0.00010443877325184346,0.005836323360590851,6,8,0.15655029517830443,1000,,0.6976899899566601,0.4877135156773821,0.02847085109573003,oversample,0.7334065050398965,,7.0,0.6965097858561352,,,,0.5440565547623762,0.6888905116273045,0.44323835368611486,0.4427860696517413,0.0,0.0,0.6976899899566601,0.4877135156773821,0.02,0.3922635021427244,0.3799588256271246,0.0,0.0,0.0,0.0,oversample,0.19312530048575077,0.14782179005876656,0.7334065050398965,0.6888905116273045,COMPLETE
120,0.0,2025-11-26 17:02:54.359373,2025-11-26 17:02:55.344486,0 days 00:00:00.985113,0.0037733121260268973,gbtree,0.5299368851904269,6.82585488914799,depthwise,0.000872456893177867,0.00016592393539242175,6,12,1.2763138836023724,1000,,0.736408978625706,0.805830300546495,0.006162507018817311,oversample,0.9055598590138785,,7.0,0.6191556817178667,,,,0.523871069274328,0.9069522719814708,0.44323835368611486,0.4427860696517413,0.0,0.0,0.736408978625706,0.805830300546495,0.0,0.5363551709361791,0.5521262269690024,0.0,0.0,0.0,0.0,oversample,0.4611399393226015,0.4785536858442885,0.9055598590138785,0.9069522719814708,COMPLETE
121,0.7156549520766773,2025-11-26 17:02:55.509971,2025-11-26 17:04:36.466387,0 days 00:01:40.956416,0.1147587558245933,dart,0.7062555339795495,7.416192004724467,depthwise,0.12519425519873212,0.00042572531436506616,3,3,0.6563387864238909,900,forest,0.6428017735324086,0.3394229672721344,0.06725044883451396,oversample,0.8154222355576557,,9.0,0.6449657348287056,0.2183488158390117,uniform,0.7211072045288269,0.7255180126600855,0.02963407576667469,0.5567616463138851,0.5572139303482587,0.715281812899477,0.7156549520766773,0.6428017735324086,0.3394229672721344,0.08,0.5689784710478587,0.5871861537218278,0.5567616463138851,0.5572139303482587,1.0,1.0,oversample,0.49373870588040253,0.5001144157170715,0.8154222355576557,0.02963407576667469,COMPLETE
122,0.6829896907216495,2025-11-26 17:04:36.631502,2025-11-26 17:04:43.584277,0 days 00:00:06.952775,0.04779273289990064,gbtree,0.6330530929989793,1.9138151532261354,lossguide,0.3913393910377292,0.01053370565942328,3,11,1.4261567758886957,700,,0.999833904432484,0.37042628334982663,0.06874609834625535,oversample,0.7209368863539963,,7.0,0.7300481541883386,,,,0.5785966872349391,0.4636354819258071,0.5712347354138398,0.5549525101763908,0.6971246006389776,0.6829896907216495,0.999833904432484,0.37042628334982663,0.08,0.5469103410515187,0.5402010097522921,0.5745129015271195,0.5662393162393162,0.8862713241267263,0.8603896103896104,oversample,0.5044911222003017,0.5004037714073465,0.7209368863539963,0.4636354819258071,COMPLETE
123,0.7156549520766773,2025-11-26 17:04:43.752844,2025-11-26 17:05:28.260462,0 days 00:00:44.507618,5.347655731744088,dart,0.5043402408277974,3.9243867412787052,depthwise,29.82694315184097,0.0021344926282979766,3,12,6.722212862007625,600,tree,0.5688292285519365,0.44218830487505845,0.08155828941798651,none,0.8488486978545465,4.069291788889204,12.0,0.883002173759752,0.10733957052293247,uniform,0.3041093549760642,0.2561749518804369,0.05013072647246754,0.5567616463138851,0.5572139303482587,0.715281812899477,0.7156549520766773,0.5688292285519365,0.44218830487505845,0.08,0.45977576176426266,0.4657329950529904,0.5567616463138851,0.5572139303482587,1.0,1.0,none,0.3434900280177059,0.35996055145059236,0.8488486978545465,0.05013072647246754,COMPLETE
124,0.7156549520766773,2025-11-26 17:05:28.428857,2025-11-26 17:06:30.753415,0 days 00:01:02.324558,46.47660459276436,dart,0.7292495332987877,9.939987994026001,lossguide,1.01584927293463,0.000314941254568827,0,10,27.757572726315516,800,forest,0.893886768699009,0.41207571087130046,0.029267089292868732,oversample,0.788856333831945,,7.0,0.7664902389713008,0.3573570310399143,weighted,0.3734667443685285,0.8642781803119626,0.19654465086375542,0.5567616463138851,0.5572139303482587,0.715281812899477,0.7156549520766773,0.893886768699009,0.41207571087130046,0.02,0.5567616463138851,0.5572139303482587,0.5567616463138851,0.5572139303482587,1.0,1.0,oversample,0.5,0.5,0.788856333831945,0.19654465086375542,COMPLETE
125,0.7038158691701999,2025-11-26 17:06:30.911754,2025-11-26 17:12:22.812445,0 days 00:05:51.900691,0.05572741817443019,dart,0.7157192803854535,2.0785438852665883,lossguide,0.44292513941774786,0.01408407054793609,6,11,0.5893868224590516,800,tree,0.6803473631589326,0.44864449422264674,0.0842545405626855,oversample,0.6635171409077326,,7.0,0.6455289575068667,0.088417520497996,weighted,0.7494141483205041,0.5667733405026371,0.25538928612995415,0.5545002261420172,0.5576662143826323,0.7039374812143072,0.7038158691701999,0.6803473631589326,0.44864449422264674,0.08,0.5665789554340905,0.5549909094038485,0.5586832061068703,0.561352657004831,0.9512591389114541,0.9431818181818182,oversample,0.5335967937134236,0.5175599107225768,0.6635171409077326,0.25538928612995415,COMPLETE
126,0.7156549520766773,2025-11-26 17:12:22.976814,2025-11-26 17:12:23.816536,0 days 00:00:00.839722,20.469818502936402,gbtree,0.9820267666271599,1.4631385023956867,lossguide,0.6435886888642564,0.000699403637808064,7,11,0.1919192322096666,600,,0.8625809515445894,0.4468462794859921,0.08243711100034405,undersample,0.6964823039827972,,5.0,0.9021168650897795,,,,0.8595500007125719,0.28537746474094366,0.5567616463138851,0.5572139303482587,0.715281812899477,0.7156549520766773,0.8625809515445894,0.4468462794859921,0.08,0.6301813502037803,0.6570211335547347,0.5567616463138851,0.5572139303482587,1.0,1.0,undersample,0.5766881082246058,0.5973785535200243,0.6964823039827972,0.28537746474094366,COMPLETE
127,0.7156549520766773,2025-11-26 17:12:23.984979,2025-11-26 17:13:01.268161,0 days 00:00:37.283182,0.7692338861091816,dart,0.37196335009884707,4.870288152488737,depthwise,38.16730862922701,0.014306133050482117,4,6,29.362874610006667,600,tree,0.5112759475692644,0.5793973894368316,0.06200856005808205,undersample,0.9327980227300361,,11.0,0.7312689159746518,0.3376144540205094,weighted,0.25129726300729116,0.213425341811214,0.07495566916196655,0.5567616463138851,0.5572139303482587,0.715281812899477,0.7156549520766773,0.5112759475692644,0.5793973894368316,0.05,0.43923833372140175,0.43971118722016245,0.5567616463138851,0.5572139303482587,1.0,1.0,undersample,0.32107876456837814,0.31527623933778176,0.9327980227300361,0.07495566916196655,COMPLETE
128,0.7156549520766773,2025-11-26 17:13:01.433223,2025-11-26 17:13:01.914035,0 days 00:00:00.480812,38.56299585377948,gbtree,0.8470335574655102,6.913175299190674,depthwise,0.0006801673490251187,0.0013578416774010127,8,4,0.4220856126793325,200,,0.8482184613142114,0.9208196249601779,0.037530813153788416,oversample,0.8528076447450019,,10.0,0.8266865996936352,,,,0.3442370141156354,0.45615674149191043,0.5567616463138851,0.5572139303482587,0.715281812899477,0.7156549520766773,0.8482184613142114,0.9208196249601779,0.05,0.5567616463138851,0.5572139303482587,0.5567616463138851,0.5572139303482587,1.0,1.0,oversample,0.5,0.5,0.8528076447450019,0.45615674149191043,COMPLETE
129,0.7156549520766773,2025-11-26 17:13:02.081696,2025-11-26 17:13:02.716272,0 days 00:00:00.634576,7.137631598072363,gbtree,0.8747874346981289,2.7184809795476648,lossguide,0.4119220004157232,0.0065908059641889265,1,8,2.266430345399412,400,,0.5875114879864484,0.2846260013156929,0.09235515053287799,oversample,0.8645654245819456,,5.0,0.9195370644285791,,,,0.592767858399766,0.1966362683345445,0.5567616463138851,0.5572139303482587,0.715281812899477,0.7156549520766773,0.5875114879864484,0.2846260013156929,0.1,0.5018759709817115,0.5175244904484148,0.5567616463138851,0.5572139303482587,1.0,1.0,oversample,0.3927510403023923,0.42747411551676107,0.8645654245819456,0.1966362683345445,COMPLETE
130,0.7156549520766773,2025-11-26 17:13:02.879600,2025-11-26 17:14:43.012238,0 days 00:01:40.132638,13.15984661511764,dart,0.9850727654029134,5.149982304836356,lossguide,0.10213146903028543,0.005131898690604253,10,7,1.4322953422365667,900,forest,0.697190305557446,0.24548262009765948,0.06515839164885637,undersample,0.9490704410267009,,8.0,0.9464877515848054,0.4067386957587723,weighted,0.8522122324618999,0.5581339451169183,0.13456059054101216,0.5567616463138851,0.5572139303482587,0.715281812899477,0.7156549520766773,0.697190305557446,0.24548262009765948,0.08,0.8699352399636613,0.870815153733945,0.5567616463138851,0.5572139303482587,1.0,1.0,undersample,0.8496912249871517,0.8485181506440443,0.9490704410267009,0.13456059054101216,COMPLETE
131,0.7156549520766773,2025-11-26 17:14:43.178363,2025-11-26 17:14:43.907994,0 days 00:00:00.729631,2.6398225548152565,gbtree,0.7621031933454196,6.2281636488454755,lossguide,0.0003292464457143004,0.016116576107979168,3,6,0.43607691219910955,600,,0.6917389457487101,0.8421068962498826,0.09665161825544638,oversample,0.6714755029540028,,5.0,0.6855802540333613,,,,0.533788766787626,0.3033912164605443,0.5567616463138851,0.5572139303482587,0.715281812899477,0.7156549520766773,0.6917389457487101,0.8421068962498826,0.1,0.5742200068693115,0.5931875119020249,0.5567616463138851,0.5572139303482587,1.0,1.0,oversample,0.47202664168835695,0.4978489016091161,0.6714755029540028,0.3033912164605443,COMPLETE
132,0.7156549520766773,2025-11-26 17:14:44.083357,2025-11-26 17:15:02.265745,0 days 00:00:18.182388,0.00020226014324345535,dart,0.7236205193484384,8.850568086229213,lossguide,8.161138708891173,0.0013507370554405108,2,5,3.9582907180307623,400,forest,0.8200400012684179,0.8583836782784129,0.08034274446816467,oversample,0.633464332681209,,10.0,0.7024659582933974,0.4615428731174802,uniform,0.6676534822034429,0.8720339999120061,0.5158587107643361,0.5567616463138851,0.5572139303482587,0.715281812899477,0.7156549520766773,0.8200400012684179,0.8583836782784129,0.08,0.5567616463138851,0.5572139303482587,0.5567616463138851,0.5572139303482587,1.0,1.0,oversample,0.5,0.5,0.633464332681209,0.5158587107643361,COMPLETE
133,0.7156549520766773,2025-11-26 17:15:02.433777,2025-11-26 17:15:03.116103,0 days 00:00:00.682326,0.10703746689574042,gbtree,0.461132758051112,9.964051971024382,lossguide,0.0008784798372515484,0.007904576854540619,4,3,0.9346263369795553,500,,0.6470874388624956,0.39814941455529534,0.08817136086329252,oversample,0.9210792735390105,,11.0,0.6275021887472607,,,,0.6555101278349708,0.07746053233931784,0.5567616463138851,0.5572139303482587,0.715281812899477,0.7156549520766773,0.6470874388624956,0.39814941455529534,0.08,0.5651923891896323,0.5735457146647837,0.5567616463138851,0.5572139303482587,1.0,1.0,oversample,0.5116455843100847,0.522646020986164,0.9210792735390105,0.07746053233931784,COMPLETE
134,0.7156549520766773,2025-11-26 17:15:03.287488,2025-11-26 17:15:23.584909,0 days 00:00:20.297421,0.0002754285515205235,dart,0.8106128182818083,7.408214386867645,lossguide,0.4677970804440521,0.030597545579157275,8,4,11.488515849718688,400,forest,0.7301709385148205,0.7891413926899998,0.09807033193661374,none,0.7839300024930259,2.5838623203723827,12.0,0.6238163068618802,0.49644193406751247,uniform,0.8672794196090403,0.9481223143559689,0.5743634750528444,0.5567616463138851,0.5572139303482587,0.715281812899477,0.7156549520766773,0.7301709385148205,0.7891413926899998,0.1,0.5783109713162835,0.6119732460288662,0.5567616463138851,0.5572139303482587,1.0,1.0,none,0.48632105969926553,0.5213302402398419,0.7839300024930259,0.5743634750528444,COMPLETE
135,0.7156549520766773,2025-11-26 17:15:23.749502,2025-11-26 17:15:24.581709,0 days 00:00:00.832207,0.03404243672342359,gbtree,0.9098701390751256,2.1468894980024547,lossguide,35.93474519812121,0.012578375852629735,4,12,0.9555357242317978,800,,0.7750450362451996,0.13577795361087996,0.07615695567007053,undersample,0.5017978901348885,,6.0,0.6446859951257519,,,,0.6037871078696603,0.022330955646637785,0.5567616463138851,0.5572139303482587,0.715281812899477,0.7156549520766773,0.7750450362451996,0.13577795361087996,0.08,0.5253961848196942,0.5560080904665978,0.5567616463138851,0.5572139303482587,1.0,1.0,undersample,0.42976591123858154,0.4635822234456045,0.5017978901348885,0.022330955646637785,COMPLETE
136,0.0,2025-11-26 17:15:24.752274,2025-11-26 17:15:30.231729,0 days 00:00:05.479455,0.0010898429727604355,dart,0.943051123227868,5.389230450405354,lossguide,2.7259849642817207,0.00291480935920341,3,4,30.322472499365848,200,forest,0.6108335000535834,0.8073986730114912,0.09569717793509451,oversample,0.7487843816788475,,11.0,0.6951789183980542,0.35927315504720037,uniform,0.825591088059447,0.7871167357144919,0.5838263272205413,0.44323835368611486,0.4427860696517413,0.0,0.0,0.6108335000535834,0.8073986730114912,0.1,0.6810940226762725,0.7010474377605425,0.0,0.0,0.0,0.0,oversample,0.6705735340439996,0.6664168313810807,0.7487843816788475,0.5838263272205413,COMPLETE
137,0.7156549520766773,2025-11-26 17:15:30.400390,2025-11-26 17:15:30.932931,0 days 00:00:00.532541,0.00020961820005906384,gbtree,0.8532335508575819,9.390357098292604,lossguide,0.3262444295481066,0.0014896389137927844,7,5,1.9012611032029023,300,,0.7091765252687033,0.7825537538097952,0.0739762784716132,oversample,0.8286912806603978,,10.0,0.62671827136553,,,,0.9969923253018995,0.4479661813810783,0.5567616463138851,0.5572139303482587,0.715281812899477,0.7156549520766773,0.7091765252687033,0.7825537538097952,0.08,0.52621349371862,0.5258749495914962,0.5567616463138851,0.5572139303482587,1.0,1.0,oversample,0.4034014986985859,0.3956342112943237,0.8286912806603978,0.4479661813810783,COMPLETE
138,0.7156549520766773,2025-11-26 17:15:31.100679,2025-11-26 17:15:31.855846,0 days 00:00:00.755167,0.8495740261451286,gbtree,0.6396530111667935,5.84409822898346,lossguide,0.00014825597067308683,0.39513714288100876,4,7,0.5018891281308059,600,,0.7584896692599382,0.5936273603179869,0.09423670529223155,none,0.8088405162938311,0.7479688777833138,6.0,0.8304346704606649,,,,0.3033078487013203,0.2174343092783235,0.5567616463138851,0.5572139303482587,0.715281812899477,0.7156549520766773,0.7584896692599382,0.5936273603179869,0.1,0.6005690461631119,0.5805873467705234,0.5567616463138851,0.5572139303482587,1.0,1.0,none,0.6069555198196257,0.5788315999628564,0.8088405162938311,0.2174343092783235,COMPLETE
139,0.7156549520766773,2025-11-26 17:15:32.033216,2025-11-26 17:15:37.325877,0 days 00:00:05.292661,0.17242649494857437,dart,0.9187310300571342,9.494942965237538,lossguide,0.22130602595162716,0.00039771221959897,6,5,27.048112762930945,200,tree,0.7746702749793217,0.8847390041347926,0.07861290422231987,oversample,0.7117624190629368,,8.0,0.6346544316286374,0.4758075303478206,uniform,0.8405012800488929,0.9083392339486818,0.46801277178819595,0.5567616463138851,0.5572139303482587,0.715281812899477,0.7156549520766773,0.7746702749793217,0.8847390041347926,0.08,0.5567616463138851,0.5572139303482587,0.5567616463138851,0.5572139303482587,1.0,1.0,oversample,0.5,0.5,0.7117624190629368,0.46801277178819595,COMPLETE
140,0.7156549520766773,2025-11-26 17:15:37.504497,2025-11-26 17:15:55.637016,0 days 00:00:18.132519,16.40082387348216,dart,0.6892422308781158,7.093577140438829,lossguide,5.701809360589626,0.00016038155591448222,0,8,5.635628752522867,400,forest,0.7670441467265532,0.1689334635907006,0.03435216497871549,none,0.8525773945099124,1.5739842079640802,7.0,0.7473310383667426,0.3379049606478141,uniform,0.5102047656694654,0.8241661870232581,0.11966770352927447,0.5567616463138851,0.5572139303482587,0.715281812899477,0.7156549520766773,0.7670441467265532,0.1689334635907006,0.02,0.5567616463138851,0.5572139303482587,0.5567616463138851,0.5572139303482587,1.0,1.0,none,0.5,0.5,0.8525773945099124,0.11966770352927447,COMPLETE
141,0.0,2025-11-26 17:15:55.820543,2025-11-26 17:16:38.328364,0 days 00:00:42.507821,19.896492458311076,dart,0.9072311727635767,1.5441691584200092,lossguide,22.393414679003364,0.0007104890592098857,8,7,4.30012674972249,600,tree,0.7394944726181883,0.2200396146490934,0.07883709374682646,undersample,0.8400684297980994,,9.0,0.9450749347254633,0.14304643242304016,weighted,0.18265425060200902,0.6348834728269424,0.539727688961612,0.44323835368611486,0.4427860696517413,0.0,0.0,0.7394944726181883,0.2200396146490934,0.08,0.48447024493668567,0.4809601876390275,0.0,0.0,0.0,0.0,undersample,0.3301318821598502,0.3092901416765053,0.8400684297980994,0.539727688961612,COMPLETE
142,0.7156549520766773,2025-11-26 17:16:38.490542,2025-11-26 17:17:03.861504,0 days 00:00:25.370962,11.73590230682445,dart,0.749753079247502,6.8851822761060255,lossguide,3.87406708798887,0.0002077398488672255,3,4,0.1256477000167466,500,forest,0.7017854933125776,0.5752605289843694,0.06137912763268624,none,0.5984224156911561,1.5833091791963005,10.0,0.6992092040430036,0.2925300345923803,uniform,0.25433900406236004,0.5381631565574324,0.1347040987462492,0.5567616463138851,0.5572139303482587,0.715281812899477,0.7156549520766773,0.7017854933125776,0.5752605289843694,0.05,0.43331405134797596,0.423585654971526,0.5567616463138851,0.5572139303482587,1.0,1.0,none,0.2954351033670982,0.274298416088508,0.5984224156911561,0.1347040987462492,COMPLETE
143,0.7156549520766773,2025-11-26 17:17:04.018997,2025-11-26 17:17:04.784120,0 days 00:00:00.765123,9.271685478805928,gbtree,0.8377135444334372,0.1205565909441102,lossguide,19.510568140829612,0.00046578962836665643,4,11,1.3451467217967528,200,,0.8672454711882293,0.5655037686312597,0.08842006458430952,oversample,0.8032462504463269,,6.0,0.8402430873007682,,,,0.5213504016476832,0.14682167566402676,0.5567616463138851,0.5572139303482587,0.715281812899477,0.7156549520766773,0.8672454711882293,0.5655037686312597,0.08,0.4333515339092514,0.432624548503486,0.5567616463138851,0.5572139303482587,1.0,1.0,oversample,0.2682264294832474,0.2697736061180903,0.8032462504463269,0.14682167566402676,COMPLETE
144,0.7156549520766773,2025-11-26 17:17:04.935463,2025-11-26 17:17:42.937036,0 days 00:00:38.001573,0.01676468523514238,dart,0.542701533911793,8.911678021188175,lossguide,0.5491575824688313,0.001460933825974968,2,3,0.16942565242397278,600,forest,0.5902293876624318,0.2426779507759225,0.06237739885963352,oversample,0.9809349107431973,,8.0,0.6464770685999672,0.2805858496237413,uniform,0.38067888868640665,0.8351070504800833,0.054056231937112856,0.5567616463138851,0.5572139303482587,0.715281812899477,0.7156549520766773,0.5902293876624318,0.2426779507759225,0.05,0.5567616463138851,0.5572139303482587,0.5567616463138851,0.5572139303482587,1.0,1.0,oversample,0.5,0.5,0.9809349107431973,0.054056231937112856,COMPLETE
