number,value,datetime_start,datetime_complete,duration,params_alpha,params_booster,params_colsample_bytree,params_gamma,params_grow_policy,params_lambda,params_learning_rate,params_max_delta_step,params_max_depth,params_min_child_weight,params_n_estimators,params_normalize_type,params_params_feature_fraction,params_params_labeled_ratio,params_params_missing_rate,params_params_resampling,params_params_sample_rows,params_params_scale_pos_weight,params_params_selftrain_max_iter,params_params_selftrain_threshold,params_rate_drop,params_sample_type,params_skip_drop,params_subsample,params_user_attrs_decision_threshold,user_attrs_acc_test,user_attrs_acc_val,user_attrs_f1_test,user_attrs_f1_val,user_attrs_feature_fraction,user_attrs_labeled_ratio,user_attrs_missing_rate,user_attrs_pr_auc_test,user_attrs_pr_auc_val,user_attrs_prec_test,user_attrs_prec_val,user_attrs_rec_test,user_attrs_rec_val,user_attrs_resampling_strategy,user_attrs_roc_auc_test,user_attrs_roc_auc_val,user_attrs_sample_rows,user_attrs_user_attrs_decision_threshold,state
868,0.06092916984006093,2025-11-26 22:11:02.759441,2025-11-26 22:11:03.685319,0 days 00:00:00.925878,0.0004872727921219875,gbtree,0.6806290220795357,5.77119526108743,depthwise,0.016272713671337348,0.005614260350129935,3,5,0.21586774280146076,700,,0.9540991055155171,0.7634488861163897,0.08055970492913461,undersample,0.5192387751969441,,7.0,0.765700819321181,,,,0.4977447224089916,0.5375796675184525,0.44369063772048845,0.4423337856173677,0.07099697885196375,0.06092916984006093,0.9540991055155171,0.7634488861163897,0.08,0.5871717306782106,0.583477235301686,0.5053763440860215,0.49382716049382713,0.038180341186027617,0.032467532467532464,undersample,0.5597452709759778,0.5556416897709032,0.5192387751969441,0.5375796675184525,COMPLETE
869,0.7156549520766773,2025-11-26 22:11:03.862573,2025-11-26 22:11:04.912114,0 days 00:00:01.049541,0.0031102653138739686,gbtree,0.4018525122727681,5.691909028116864,lossguide,0.0002260357790387491,0.0027519268034651395,7,8,0.11513569417886206,900,,0.7158190005364637,0.8224675079854094,0.005634246707689422,oversample,0.9035212619138357,,5.0,0.6508232450745008,,,,0.3881130076505026,0.514520156346124,0.5567616463138851,0.5572139303482587,0.715281812899477,0.7156549520766773,0.7158190005364637,0.8224675079854094,0.0,0.47097475523555743,0.46295141459298295,0.5567616463138851,0.5572139303482587,1.0,1.0,oversample,0.38278278817619654,0.366993387103193,0.9035212619138357,0.514520156346124,COMPLETE
870,0.7156549520766773,2025-11-26 22:11:05.092708,2025-11-26 22:11:06.220819,0 days 00:00:01.128111,22.02342994762007,gbtree,0.7429891227154279,1.05659462791293,depthwise,0.001062440134604308,0.002190096341506688,10,10,0.5807007303346099,900,,0.7045262440742176,0.6611098597180094,0.046228368615556424,oversample,0.9051284645253784,,8.0,0.6374419965414444,,,,0.43718294947214614,0.3048708586438241,0.5567616463138851,0.5572139303482587,0.715281812899477,0.7156549520766773,0.7045262440742176,0.6611098597180094,0.05,0.42255151294126847,0.4136900057057844,0.5567616463138851,0.5572139303482587,1.0,1.0,oversample,0.2803420149538288,0.2542939057877771,0.9051284645253784,0.3048708586438241,COMPLETE
871,0.7156549520766773,2025-11-26 22:11:06.392204,2025-11-26 22:11:09.114030,0 days 00:00:02.721826,0.20176217923701376,gbtree,0.6558076055097039,0.27046642858060294,depthwise,0.00014316670872205182,0.0006811157083256295,5,6,0.3147220909211859,1000,,0.8904015317097349,0.7498792368150948,0.06274644426042103,oversample,0.8955067059543632,,10.0,0.6477193418053114,,,,0.47554266005060536,0.39590420337083376,0.5567616463138851,0.5572139303482587,0.715281812899477,0.7156549520766773,0.8904015317097349,0.7498792368150948,0.05,0.5972113285428318,0.569879100357286,0.5567616463138851,0.5572139303482587,1.0,1.0,oversample,0.5735220245693728,0.5574474682620749,0.8955067059543632,0.39590420337083376,COMPLETE
872,0.7156549520766773,2025-11-26 22:11:09.291031,2025-11-26 22:11:20.244242,0 days 00:00:10.953211,0.49460305963632006,dart,0.3056839830993311,7.50160961213624,lossguide,63.23153873013944,0.000637748813530697,1,4,36.39180125578974,300,tree,0.5393354705455691,0.49968662611688736,0.09141188320714069,none,0.8657804793180969,0.511769723239896,12.0,0.7103355097603115,0.21096871178518029,weighted,0.4244386163077484,0.22752134131676693,0.05619423817276747,0.5567616463138851,0.5572139303482587,0.715281812899477,0.7156549520766773,0.5393354705455691,0.49968662611688736,0.1,0.5567616463138851,0.5572139303482587,0.5567616463138851,0.5572139303482587,1.0,1.0,none,0.5,0.5,0.8657804793180969,0.05619423817276747,COMPLETE
873,0.0,2025-11-26 22:11:20.425536,2025-11-26 22:11:21.289132,0 days 00:00:00.863596,12.548988421527678,gbtree,0.26569144226893504,6.265230411549896,depthwise,0.04384569368968768,0.2566432084742324,4,3,1.6506986593690538,700,,0.666226737172252,0.4750282520389209,0.015074684284561574,undersample,0.9046912530106009,,7.0,0.8127940811746175,,,,0.7698533158168482,0.5650936456597843,0.44323835368611486,0.4427860696517413,0.0,0.0,0.666226737172252,0.4750282520389209,0.02,0.5087027863846363,0.5133309765158837,0.0,0.0,0.0,0.0,undersample,0.4221754339428704,0.4306014784500484,0.9046912530106009,0.5650936456597843,COMPLETE
874,0.7153667054714785,2025-11-26 22:11:21.467843,2025-11-26 22:11:24.293515,0 days 00:00:02.825672,0.2139233868600554,gbtree,0.49594042654392506,3.927959668837585,depthwise,0.00021161930428472857,0.023185164301235236,8,6,0.18584379985348962,1000,,0.8846478114464202,0.3690781467175745,0.002995348139060699,oversample,0.6365313844903246,,6.0,0.6327261568266265,,,,0.6539444231785763,0.4154437885138074,0.5581184984170059,0.5576662143826323,0.7149110008754013,0.7153667054714785,0.8846478114464202,0.3690781467175745,0.0,0.6229271023510665,0.6237989085588269,0.557832422586521,0.5576225045372051,0.9951259138911455,0.997564935064935,oversample,0.6141315340108424,0.6111731093217303,0.6365313844903246,0.4154437885138074,COMPLETE
875,0.7149084568439407,2025-11-26 22:11:24.458766,2025-11-26 22:11:45.647801,0 days 00:00:21.189035,1.362506822419882,dart,0.6266919410428264,1.9661903077249487,lossguide,0.0010269058868245962,0.09401041837029432,6,4,3.7942698830651143,200,tree,0.9623667346912164,0.6933882718686162,0.09548367337980324,undersample,0.5865336596688869,,7.0,0.7284293020516599,0.3195907897572798,weighted,0.6251245476419243,0.4068617546925803,0.13533145820673623,0.5563093622795116,0.5563093622795116,0.7149084568439407,0.7149084568439407,0.9623667346912164,0.6933882718686162,0.1,0.6673517876056567,0.6369043881449179,0.5565610859728507,0.5568130375735627,0.9991876523151909,0.9983766233766234,undersample,0.6286679984747757,0.5999640999960203,0.5865336596688869,0.13533145820673623,COMPLETE
876,0.6019558131111916,2025-11-26 22:11:45.822607,2025-11-26 22:11:48.901825,0 days 00:00:03.079218,0.41421226064668226,gbtree,0.47848834900890486,0.9360147830164061,lossguide,0.00025821940187916337,0.19459874118056542,6,8,0.4779209652632936,900,,0.6474949079129066,0.46700703093302853,0.028738043876168337,oversample,0.978332574726616,,5.0,0.6221360919857302,,,,0.859933124303036,0.6206107709352628,0.49072817729534146,0.5029398462234284,0.5893508388037928,0.6019558131111916,0.6474949079129066,0.46700703093302853,0.02,0.5491252487800196,0.5616384214883605,0.5347452018530774,0.5434924787442773,0.6563769293257514,0.674512987012987,oversample,0.4761078598783136,0.4931313260284149,0.978332574726616,0.6206107709352628,COMPLETE
877,0.7156549520766773,2025-11-26 22:11:49.093534,2025-11-26 22:11:54.160005,0 days 00:00:05.066471,0.0010364675070248634,dart,0.8304936157157128,2.948094551680205,lossguide,0.1735455258293268,0.022060832419162586,3,5,0.3901671738914623,200,tree,0.8349186230029509,0.7358648017933197,0.0910209738134746,undersample,0.5883588004384264,,7.0,0.7014776617856368,0.33065352992308067,weighted,0.32556327736708524,0.232009608892028,0.19783463544957366,0.5567616463138851,0.5572139303482587,0.715281812899477,0.7156549520766773,0.8349186230029509,0.7358648017933197,0.1,0.5833048998036507,0.5926983409991082,0.5567616463138851,0.5572139303482587,1.0,1.0,undersample,0.5493816210480943,0.5562369831394346,0.5883588004384264,0.19783463544957366,COMPLETE
878,0.62460345435319,2025-11-26 22:11:54.342707,2025-11-26 22:12:01.473995,0 days 00:00:07.131288,1.5607198633896262,gbtree,0.5796914453897228,0.464306902213264,depthwise,0.00013860572195844534,0.048340315000510524,8,7,0.6994817682132123,900,,0.6810672467986947,0.8547777354117274,0.05658427300757496,oversample,0.9055282899664403,,5.0,0.6795475111389803,,,,0.4235997846840906,0.4350380267900994,0.5332428765264586,0.5183175033921302,0.6345609065155807,0.62460345435319,0.6810672467986947,0.8547777354117274,0.05,0.5362736406646298,0.5169506206665436,0.5624607658505963,0.5520249221183801,0.7278635255889521,0.7191558441558441,oversample,0.48521278535784745,0.4566534397675869,0.9055282899664403,0.4350380267900994,COMPLETE
879,0.7156549520766773,2025-11-26 22:12:01.656169,2025-11-26 22:12:03.612001,0 days 00:00:01.955832,0.13707439258398188,gbtree,0.663803087219234,4.052757091847817,depthwise,0.006468613113419531,0.020557690847131403,4,7,0.5284599597307126,600,,0.6805390547554668,0.7572206544869464,0.0015918381204580692,oversample,0.9670770269865141,,6.0,0.6304663196435885,,,,0.6686015629776396,0.38365434350731,0.5567616463138851,0.5572139303482587,0.715281812899477,0.7156549520766773,0.6805390547554668,0.7572206544869464,0.0,0.4626486557553609,0.451915124771284,0.5567616463138851,0.5572139303482587,1.0,1.0,oversample,0.3787985543526915,0.3572651493042198,0.9670770269865141,0.38365434350731,COMPLETE
880,0.6882442748091603,2025-11-26 22:12:03.789031,2025-11-26 22:12:05.895850,0 days 00:00:02.106819,0.00412749120603113,gbtree,0.4304471135156091,4.05279988699034,depthwise,0.0002212760199661856,0.24175520042653528,5,7,3.3156955952810265,900,,0.6809597526017035,0.7349855850130169,0.012068858022875871,oversample,0.7283762306823508,,5.0,0.7078452357878905,,,,0.5719492700098129,0.48720218887186106,0.5287200361827228,0.5382180009045681,0.6801718845917741,0.6882442748091603,0.6809597526017035,0.7349855850130169,0.02,0.49661405139957004,0.49262771663899363,0.5466206216082881,0.5516397454723446,0.9000812347684809,0.9147727272727273,oversample,0.43169938162104804,0.4232249810965337,0.7283762306823508,0.48720218887186106,COMPLETE
881,0.6863287250384025,2025-11-26 22:12:06.070535,2025-11-26 22:12:13.868320,0 days 00:00:07.797785,0.02088664822262892,gbtree,0.3959943214345964,0.6725645054335274,depthwise,0.00035697882744289733,0.006173991036163768,5,8,0.36586071067719583,800,,0.7028993116579577,0.4561132631279633,0.002195206672565217,undersample,0.913574820666755,,6.0,0.7395323049827199,,,,0.4781880321980725,0.30198812066126157,0.5255540479421077,0.5382180009045681,0.6749302757979547,0.6863287250384025,0.7028993116579577,0.4561132631279633,0.0,0.5012464245131649,0.49689305285106106,0.5455911823647295,0.5521502718734552,0.8846466287571081,0.9066558441558441,undersample,0.43188008753460766,0.4367330830558614,0.913574820666755,0.30198812066126157,COMPLETE
882,0.0,2025-11-26 22:12:14.045404,2025-11-26 22:12:24.084512,0 days 00:00:10.039108,20.33036685672902,dart,0.7575729637533581,8.259575857319593,depthwise,0.0010812333474211075,0.006590330180908841,6,5,0.15662729099057712,300,forest,0.722914847815473,0.7665768541389439,0.0008306445631222417,oversample,0.7905285441978696,,9.0,0.782725468025175,0.35241854258849226,weighted,0.40368398615012624,0.4868581257895144,0.7428698789510617,0.44323835368611486,0.4427860696517413,0.0,0.0,0.722914847815473,0.7665768541389439,0.0,0.5567616463138851,0.5572139303482587,0.0,0.0,0.0,0.0,oversample,0.5,0.5,0.7905285441978696,0.7428698789510617,COMPLETE
883,0.7156549520766773,2025-11-26 22:12:24.263067,2025-11-26 22:12:26.365109,0 days 00:00:02.102042,0.17374681485256754,gbtree,0.6240631062844519,2.556318963260433,lossguide,0.00028823382655835197,0.00012282218715361392,10,8,0.9803362000745032,800,,0.6055659595296429,0.6740135645446489,0.08421232769274115,oversample,0.9809012840348871,,7.0,0.6460392586405257,,,,0.4195317790918366,0.13533557281071984,0.5567616463138851,0.5572139303482587,0.715281812899477,0.7156549520766773,0.6055659595296429,0.6740135645446489,0.08,0.5081614143748081,0.4997442036190075,0.5567616463138851,0.5572139303482587,1.0,1.0,oversample,0.42393151411661334,0.4255186845840574,0.9809012840348871,0.13533557281071984,COMPLETE
884,0.0,2025-11-26 22:12:26.547050,2025-11-26 22:12:27.517673,0 days 00:00:00.970623,98.02149413672656,gbtree,0.6291202424585757,3.541521093155355,depthwise,0.0001926575065714371,0.0031285723041763495,9,12,0.34176365616220833,900,,0.7473673154906908,0.8303669620262688,0.028088556730716537,oversample,0.9015179614590723,,5.0,0.6583097226345873,,,,0.8182911878288549,0.5580688957888048,0.44323835368611486,0.4427860696517413,0.0,0.0,0.7473673154906908,0.8303669620262688,0.02,0.5567616463138851,0.5572139303482587,0.0,0.0,0.0,0.0,oversample,0.5,0.5,0.9015179614590723,0.5580688957888048,COMPLETE
885,0.39496611810261373,2025-11-26 22:12:27.698251,2025-11-26 22:21:13.564874,0 days 00:08:45.866623,3.2494838247257043,dart,0.6083117921978977,0.3794610474811535,depthwise,0.00012019013601362923,0.011921756871903411,10,4,0.5769027531985123,1000,forest,0.8380796109964956,0.7727956609487345,0.021306455684655938,oversample,0.9249398286517155,,7.0,0.6815890241035292,0.2762686391005319,weighted,0.8355038928408007,0.7570361216440082,0.5714954955803735,0.4491180461329715,0.43464495703301675,0.41889312977099236,0.39496611810261373,0.8380796109964956,0.7727956609487345,0.02,0.5127321430393934,0.5059560949940699,0.507514450867052,0.4892086330935252,0.3566206336311942,0.33116883116883117,oversample,0.4578756279116033,0.4502275048751045,0.9249398286517155,0.5714954955803735,COMPLETE
886,0.7034482758620689,2025-11-26 22:21:13.748747,2025-11-26 22:21:30.763058,0 days 00:00:17.014311,0.01749262644878722,gbtree,0.47994538495433386,1.1030892173231024,lossguide,0.00026796332473789204,0.011236561345897574,3,10,0.23148534393800385,200,,0.9895143697438928,0.30869918122640483,0.03296549289222223,oversample,0.7261425213976437,,12.0,0.6253470429540542,,,,0.47648851847159784,0.4097840054770368,0.5490728177295342,0.5526910900045229,0.6981531940660006,0.7034482758620689,0.9895143697438928,0.30869918122640483,0.02,0.5680235249266236,0.5594955051902779,0.5564671814671814,0.557774607703281,0.9366368805848904,0.9521103896103896,oversample,0.5253071171604303,0.5290209662656037,0.7261425213976437,0.4097840054770368,COMPLETE
887,0.02664576802507837,2025-11-26 22:21:30.938059,2025-11-26 22:21:31.747268,0 days 00:00:00.809209,0.009920102979773799,gbtree,0.8055066400921879,2.646751917792388,depthwise,0.08141392305369521,0.009384498790551246,5,5,0.24246357748127334,400,,0.7571972600364422,0.25715489273333997,0.09354809527018751,undersample,0.5465456541575993,,6.0,0.7871073564180039,,,,0.2343756574238668,0.6500148502510472,0.4369063772048847,0.43826322930800543,0.023529411764705882,0.02664576802507837,0.7571972600364422,0.25715489273333997,0.1,0.49337675927458763,0.4959699890209939,0.3409090909090909,0.38636363636363635,0.012185215272136474,0.013798701298701298,undersample,0.4258057162751372,0.41851072191342875,0.5465456541575993,0.6500148502510472,COMPLETE
888,0.7156549520766773,2025-11-26 22:21:31.928155,2025-11-26 22:21:48.340177,0 days 00:00:16.412022,0.37769637892061103,dart,0.7496981950223942,4.380899943806417,depthwise,11.862346054588091,0.010569957692176295,0,4,3.454176002290455,400,tree,0.5301974234566611,0.3031149373461432,0.0525352982648232,none,0.7405803362746664,3.058273143191624,12.0,0.7441976143920717,0.433102453225942,weighted,0.47053856709750264,0.33891175060434653,0.20613256466245955,0.5567616463138851,0.5572139303482587,0.715281812899477,0.7156549520766773,0.5301974234566611,0.3031149373461432,0.05,0.5472120010877316,0.5487199701145746,0.5567616463138851,0.5572139303482587,1.0,1.0,none,0.48964629718662445,0.5051615583089026,0.7405803362746664,0.20613256466245955,COMPLETE
889,0.7081481481481482,2025-11-26 22:21:48.510931,2025-11-26 22:21:53.229679,0 days 00:00:04.718748,0.07328730633843682,gbtree,0.41142469822588373,1.1266898390984534,lossguide,0.005982951580842321,0.05845499322054241,6,7,1.1287765234357487,900,,0.7922037732757977,0.8580538381807171,0.010331975782426868,oversample,0.8230797388625574,,6.0,0.8300937209814654,,,,0.7202556051731478,0.3026265117409037,0.5499773857982814,0.5545002261420172,0.7058823529411765,0.7081481481481482,0.7922037732757977,0.8580538381807171,0.02,0.5483284292337031,0.5552941628207466,0.5548327137546468,0.5576294913672422,0.9699431356620634,0.9699675324675324,oversample,0.5120815994960128,0.5240886539405436,0.8230797388625574,0.3026265117409037,COMPLETE
890,0.43279961183891313,2025-11-26 22:21:53.406640,2025-11-26 22:21:56.299194,0 days 00:00:02.892554,0.2869687968706909,gbtree,0.7456685248775534,2.4077655698961222,lossguide,0.0012002974552479816,0.3765432444227023,5,5,0.3442185674898387,500,,0.859688915715102,0.5429289373266264,0.0684956384368744,undersample,0.5273667028960274,,7.0,0.8044326221780798,,,,0.35152145189888595,0.6144732365945851,0.47127996381727727,0.47127996381727727,0.44465558194774346,0.43279961183891313,0.859688915715102,0.5429289373266264,0.08,0.5299224959161977,0.5377127089585677,0.5354691075514875,0.5379975874547648,0.380178716490658,0.362012987012987,undersample,0.48600440988743177,0.494464932411817,0.5273667028960274,0.6144732365945851,COMPLETE
891,0.7156549520766773,2025-11-26 22:21:56.471043,2025-11-26 22:21:57.244570,0 days 00:00:00.773527,1.7159543268941557,gbtree,0.8773409204179382,2.957121882398407,lossguide,20.380461533447615,0.0032295948989937524,4,9,1.3958745298579378,600,,0.6257426680125168,0.07541009315419109,0.06690170688812704,oversample,0.6363671230264308,,6.0,0.6801079830330391,,,,0.6874730133242155,0.31567151225051715,0.5567616463138851,0.5572139303482587,0.715281812899477,0.7156549520766773,0.6257426680125168,0.07541009315419109,0.08,0.5452442968518513,0.5356206171648146,0.5567616463138851,0.5572139303482587,1.0,1.0,oversample,0.4668698917422371,0.4581375276919199,0.6363671230264308,0.31567151225051715,COMPLETE
892,0.7005917159763314,2025-11-26 22:21:57.417004,2025-11-26 22:21:58.210798,0 days 00:00:00.793794,0.3061818009297684,gbtree,0.3879063400341751,4.603339871175278,depthwise,0.00014607698507836862,0.02314049330622749,8,10,0.12161426747566463,600,,0.7262503307644288,0.544227152204616,0.0003369304913100273,oversample,0.8872590644048298,,5.0,0.8085527034626361,,,,0.770873217692989,0.5268528832773406,0.5382180009045681,0.5422885572139303,0.6973021049510821,0.7005917159763314,0.7262503307644288,0.544227152204616,0.0,0.48501738123051125,0.4776970166631714,0.5490196078431373,0.5512104283054003,0.9553208773354996,0.961038961038961,oversample,0.40566115154428956,0.39919146226602814,0.8872590644048298,0.5268528832773406,COMPLETE
893,0.7156549520766773,2025-11-26 22:21:58.389253,2025-11-26 22:21:59.400951,0 days 00:00:01.011698,0.061711597283147804,gbtree,0.47368532551110115,4.935469171517493,depthwise,0.00032630975457225906,0.019437257371524522,7,6,0.23664305282612821,1000,,0.8224548384581754,0.8230943747362931,0.03540270468010734,oversample,0.7634909406166661,,5.0,0.6998188874184929,,,,0.8288817381852649,0.506230635836066,0.5567616463138851,0.5572139303482587,0.715281812899477,0.7156549520766773,0.8224548384581754,0.8230943747362931,0.05,0.4831521488759679,0.4729233181882459,0.5567616463138851,0.5572139303482587,1.0,1.0,oversample,0.3929068784296822,0.3622845170661821,0.7634909406166661,0.506230635836066,COMPLETE
894,0.43308746048472074,2025-11-26 22:21:59.577110,2025-11-26 22:22:17.012381,0 days 00:00:17.435271,0.001243011007279437,dart,0.8833101462137332,1.1299060401835135,lossguide,0.0017938152524238293,0.07610341186218329,3,5,0.3158376925816408,300,tree,0.9572380283682215,0.43149694282215845,0.0926048029619245,oversample,0.7462931326188992,,5.0,0.7848449409158215,0.14326833508097955,weighted,0.002202235274232656,0.3962683094894356,0.5934353487645985,0.5309814563545907,0.5133423790140208,0.4635281945162959,0.43308746048472074,0.9572380283682215,0.43149694282215845,0.1,0.635955409827192,0.6217933105698059,0.6381766381766382,0.6171171171171171,0.36393176279447603,0.3336038961038961,oversample,0.6009350287637394,0.5860717104652242,0.7462931326188992,0.5934353487645985,COMPLETE
895,0.6655439541933311,2025-11-26 22:22:17.197307,2025-11-26 22:23:08.437660,0 days 00:00:51.240353,0.006615291496149052,dart,0.7591503966734687,0.48222981267808773,lossguide,0.1371210161510343,0.021787852079593887,4,7,0.11660649622349599,300,forest,0.76372945237111,0.5703403726811312,0.07338554810496872,none,0.828111320041282,0.6990704719266654,6.0,0.7568615443844406,0.09663998578250697,weighted,0.7036875791670942,0.26370661440953125,0.3525464907735154,0.5373134328358209,0.5508819538670285,0.6521591295477729,0.6655439541933311,0.76372945237111,0.5703403726811312,0.08,0.5607469912316743,0.5854510869523966,0.5608187134502924,0.568796776050662,0.7790414297319253,0.801948051948052,none,0.49634650773388156,0.5340925672897072,0.828111320041282,0.3525464907735154,COMPLETE
896,0.0,2025-11-26 22:23:08.625246,2025-11-26 22:23:09.540631,0 days 00:00:00.915385,11.425254994677761,gbtree,0.2025886331100186,3.5481034057617524,depthwise,0.20779733160020397,0.02611571130550439,10,10,0.7097773208462551,800,,0.6821029129715569,0.7984544631793256,0.028209143563020383,oversample,0.8738804769532621,,6.0,0.6819367940271621,,,,0.6471011284483141,0.8534880050838705,0.44323835368611486,0.4427860696517413,0.0,0.0,0.6821029129715569,0.7984544631793256,0.02,0.4140744152733849,0.4097471417379249,0.0,0.0,0.0,0.0,oversample,0.24832639798405146,0.23552765543955534,0.8738804769532621,0.8534880050838705,COMPLETE
