number,value,datetime_start,datetime_complete,duration,params_alpha,params_booster,params_colsample_bytree,params_gamma,params_grow_policy,params_lambda,params_learning_rate,params_max_delta_step,params_max_depth,params_min_child_weight,params_n_estimators,params_normalize_type,params_params_feature_fraction,params_params_labeled_ratio,params_params_missing_rate,params_params_resampling,params_params_sample_rows,params_params_scale_pos_weight,params_params_selftrain_max_iter,params_params_selftrain_threshold,params_rate_drop,params_sample_type,params_skip_drop,params_subsample,params_user_attrs_decision_threshold,user_attrs_acc_test,user_attrs_acc_val,user_attrs_f1_test,user_attrs_f1_val,user_attrs_feature_fraction,user_attrs_labeled_ratio,user_attrs_missing_rate,user_attrs_pr_auc_test,user_attrs_pr_auc_val,user_attrs_prec_test,user_attrs_prec_val,user_attrs_rec_test,user_attrs_rec_val,user_attrs_resampling_strategy,user_attrs_roc_auc_test,user_attrs_roc_auc_val,user_attrs_sample_rows,user_attrs_user_attrs_decision_threshold,state
2690,0.716695753344968,2025-11-30 16:19:49.638401,2025-11-30 16:20:17.217008,0 days 00:00:27.578607,0.8692050450311868,dart,0.43213881465716003,2.130492827412025,depthwise,0.0004899931675185683,0.4218075330749804,0,5,26.230201839279832,200,tree,0.6389755913174606,0.8892611136145949,0.07378546933813089,none,0.6459882722582938,3.0562368196292753,9.0,0.8440094036404197,0.3338194063779007,uniform,0.86277947953249,0.3653949456655403,,0.5567616463138851,0.5594753505201266,0.715281812899477,0.716695753344968,0.6389755913174606,0.8892611136145949,0.08,0.5089132486097004,0.5183874368767439,0.5567616463138851,0.5584768812330009,1.0,1.0,none,0.43475065899633614,0.4517559496172877,0.6459882722582938,0.5,COMPLETE
2691,0.6099585062240664,2025-11-30 16:20:18.005887,2025-11-30 16:20:19.125872,0 days 00:00:01.119985,0.005599211062190189,gbtree,0.8935484292678884,0.8990214114247919,depthwise,0.0003299439462520518,0.015802137220419954,1,9,38.78569803005533,700,,0.9631128163618725,0.44940779881569615,0.014340164868672501,undersample,0.7722748596410481,,10.0,0.7403040273286318,,,,0.588749669429198,,0.5522388059701493,0.5748530076888286,0.5843828715365239,0.6099585062240664,0.9631128163618725,0.44940779881569615,0.08,0.6519684960375598,0.6612235051011532,0.6046915725456126,0.6239388794567062,0.5653939886271324,0.5965909090909091,undersample,0.5834314229347304,0.6010651439979836,0.7722748596410481,0.5,COMPLETE
2692,0.0,2025-11-30 16:20:19.901783,2025-11-30 16:20:20.508328,0 days 00:00:00.606545,0.001734381269590597,gbtree,0.6087913729285344,9.185763644149217,lossguide,37.419311211914255,0.0031315460432425547,6,5,0.16756692191185302,600,,0.5599291724139566,0.6403145730174261,0.042485777206907265,undersample,0.7542795594229852,,11.0,0.7972083382289585,,,,0.9528273859954177,,0.44323835368611486,0.4427860696517413,0.0,0.0,0.5599291724139566,0.6403145730174261,0.08,0.5567616463138851,0.5572139303482587,0.0,0.0,0.0,0.0,undersample,0.5,0.5,0.7542795594229852,0.5,COMPLETE
2693,0.4221606648199446,2025-11-30 16:20:21.282452,2025-11-30 16:21:41.853583,0 days 00:01:20.571131,0.015015449433208957,dart,0.24906789699545648,8.209562782784339,lossguide,2.655588518849355,0.00013810670005030352,1,4,1.2855152931376257,800,tree,0.805038142470726,0.43684057292845735,0.008425059633002897,undersample,0.5343430105427573,,7.0,0.838396928156116,0.2381602416353994,weighted,0.7511504409322624,0.9164441281952598,,0.49796472184531887,0.5282677521483492,0.38127090301003347,0.4221606648199446,0.805038142470726,0.43684057292845735,0.08,0.5708468202455277,0.590522835438636,0.6074600355239786,0.6649214659685864,0.2778229082047116,0.3092532467532468,undersample,0.5261563520615394,0.5565673792499635,0.5343430105427573,0.5,COMPLETE
2694,0.7156549520766773,2025-11-30 16:21:42.632107,2025-11-30 16:21:43.512624,0 days 00:00:00.880517,17.248965474867692,gbtree,0.6064551555981168,8.502872733063963,lossguide,0.00017200797692017034,0.09485619855158091,3,5,0.1482213821185394,1000,,0.5305529945549254,0.7875953939714959,0.04517821992286275,none,0.596999233051748,1.3469437633059613,10.0,0.8534500385519799,,,,0.3423296776142304,,0.5567616463138851,0.5572139303482587,0.715281812899477,0.7156549520766773,0.5305529945549254,0.7875953939714959,0.08,0.4363592313296646,0.42993255856167,0.5567616463138851,0.5572139303482587,1.0,1.0,none,0.20919154826837313,0.1847884304153456,0.596999233051748,0.5,COMPLETE
2695,0.6856972940826643,2025-11-30 16:21:44.301284,2025-11-30 16:21:46.376982,0 days 00:00:02.075698,0.004533309064350929,gbtree,0.5717354005381214,2.5795039518464513,lossguide,0.8705271249218732,0.0006227296661099906,3,12,1.0534609855455708,1000,,0.839458479261193,0.5448262666366593,0.08271510434858906,none,0.830714648718056,0.8737186401561049,6.0,0.8159739348489617,,,,0.46956628832080405,,0.52962460425147,0.5219357756671189,0.6919431279620853,0.6856972940826643,0.839458479261193,0.5448262666366593,0.08,0.4538290823675838,0.43597690956396506,0.5445221445221445,0.5410605349601126,0.9488220958570268,0.9358766233766234,none,0.32531872212735624,0.2955602556279267,0.830714648718056,0.5,COMPLETE
2696,0.7156549520766773,2025-11-30 16:21:47.152203,2025-11-30 16:21:58.156586,0 days 00:00:11.004383,78.62636197043062,dart,0.2950649048941265,4.510756189627212,depthwise,11.078651567077737,0.0013177520599847962,2,8,39.70632611404377,300,forest,0.5093830703942087,0.7746527385953685,0.09866792224747695,undersample,0.8504015436922436,,5.0,0.819098683802906,0.43056737536050094,uniform,0.7196718848244218,0.27740046967290755,,0.5567616463138851,0.5572139303482587,0.715281812899477,0.7156549520766773,0.5093830703942087,0.7746527385953685,0.1,0.5567616463138851,0.5572139303482587,0.5567616463138851,0.5572139303482587,1.0,1.0,undersample,0.5,0.5,0.8504015436922436,0.5,COMPLETE
2697,0.7156549520766773,2025-11-30 16:21:58.946346,2025-11-30 16:22:18.497389,0 days 00:00:19.551043,1.2185073319826112,dart,0.8845364256676727,9.874474841781222,depthwise,3.8229094664181615,0.03390387289572378,7,12,14.875037869352314,400,forest,0.5796191972010019,0.5066316061227756,0.08824338438912682,oversample,0.7323312276330756,,12.0,0.742410563896234,0.238401569642326,uniform,0.540054209635834,0.7133690314828367,,0.5567616463138851,0.5572139303482587,0.715281812899477,0.7156549520766773,0.5796191972010019,0.5066316061227756,0.08,0.5567616463138851,0.5572139303482587,0.5567616463138851,0.5572139303482587,1.0,1.0,oversample,0.5,0.5,0.7323312276330756,0.5,COMPLETE
2698,0.7156549520766773,2025-11-30 16:22:19.236168,2025-11-30 16:22:31.233038,0 days 00:00:11.996870,16.797746051197077,dart,0.8394614639786564,2.5347684163173523,lossguide,4.749942629734081,0.04900633072566594,0,10,5.568709942622636,300,forest,0.7443588185218236,0.5177966229659694,0.041272213479127774,none,0.5035806416997908,3.2822768266263465,5.0,0.8428036653473872,0.04676006799819771,weighted,0.27063375092663,0.22377258597847371,,0.5567616463138851,0.5572139303482587,0.715281812899477,0.7156549520766773,0.7443588185218236,0.5177966229659694,0.08,0.5785550090209409,0.5853010824317114,0.5567616463138851,0.5572139303482587,1.0,1.0,none,0.5041566504749748,0.5027596573498003,0.5035806416997908,0.5,COMPLETE
2699,0.47373447946513847,2025-11-30 16:22:32.006583,2025-11-30 16:23:46.168922,0 days 00:01:14.162339,0.022938134693533202,dart,0.617691905209466,4.802182802415845,lossguide,0.14083950992361885,0.00020690214581006375,6,3,0.5516347230565353,800,tree,0.6997132446690832,0.2981987363233667,0.06066937616053519,undersample,0.7097066915553748,,12.0,0.9279409002806054,0.156226642329842,uniform,0.07332208579378181,0.24247479581096815,,0.5110809588421529,0.5015829941203076,0.4830224772835964,0.47373447946513847,0.6997132446690832,0.2981987363233667,0.08,0.5709787432439645,0.5639302567133746,0.5872093023255814,0.5754060324825986,0.4102355808285946,0.4025974025974026,undersample,0.5257389877153136,0.5090898312616903,0.7097066915553748,0.5,COMPLETE
2700,0.4287011807447775,2025-11-30 16:23:46.946848,2025-11-30 16:23:59.605146,0 days 00:00:12.658298,0.1836674447685845,dart,0.5461482198902736,1.4448226975865386,depthwise,13.928303974712705,0.0038952440017577888,6,11,3.6361047016502943,300,forest,0.6148054552525117,0.4124083912162163,0.029784328850812003,undersample,0.8813760987845798,,12.0,0.6189156681340606,0.189055514658086,uniform,0.8121490083210335,0.7898976091683214,,0.41338760741745817,0.431026684758028,0.4058634906092533,0.4287011807447775,0.6148054552525117,0.4124083912162163,0.08,0.48763808555893307,0.5076145730744039,0.4653361344537815,0.4865979381443299,0.35987002437043053,0.38311688311688313,undersample,0.4023980835226048,0.4176795497658623,0.8813760987845798,0.5,COMPLETE
2701,0.7156549520766773,2025-11-30 16:24:00.387036,2025-11-30 16:25:38.944632,0 days 00:01:38.557596,6.718503524801261,dart,0.27012026520540133,9.084479857105821,depthwise,0.014170022421658173,0.0008624413938190848,1,11,0.12533750331274685,900,tree,0.5866046349281322,0.41886670533149173,0.023853837814969595,none,0.5108967220955543,1.2341427924824449,6.0,0.8376971207997452,0.3720007345359847,weighted,0.781832985868553,0.9963890973770091,,0.5567616463138851,0.5572139303482587,0.715281812899477,0.7156549520766773,0.5866046349281322,0.41886670533149173,0.08,0.5567616463138851,0.5572139303482587,0.5567616463138851,0.5572139303482587,1.0,1.0,none,0.5,0.5,0.5108967220955543,0.5,COMPLETE
2702,0.5030106530801297,2025-11-30 16:25:39.715152,2025-11-30 16:26:13.049013,0 days 00:00:33.333861,0.00045106857564629154,dart,0.2369970891401618,0.563869906446931,depthwise,20.177571645863967,0.02635015278155564,3,5,0.23819349416617952,500,forest,0.6825320642109918,0.3660921245837215,0.06467925704981267,none,0.7455858943351767,0.7587291727227726,9.0,0.7035639049957186,0.129431143751833,uniform,0.5867349671737127,0.29667890390999574,,0.5165083672546359,0.5146992311171416,0.5048633626679018,0.5030106530801297,0.6825320642109918,0.3660921245837215,0.08,0.5781658611972237,0.5838000625963544,0.5872844827586207,0.5857605177993528,0.4427294882209586,0.4407467532467532,none,0.5340274208789934,0.5350547371423264,0.7455858943351767,0.5,COMPLETE
2703,0.7156549520766773,2025-11-30 16:26:13.825167,2025-11-30 16:26:14.527990,0 days 00:00:00.702823,25.784912732591525,gbtree,0.6785780092836126,7.0206680607571315,lossguide,23.269252346912307,0.00026249616619923214,1,7,0.5162977111127175,700,,0.7639074241219111,0.7020689588598561,0.025871907991830492,undersample,0.7737186849131354,,10.0,0.8526726500181536,,,,0.48518279761169697,,0.5567616463138851,0.5572139303482587,0.715281812899477,0.7156549520766773,0.7639074241219111,0.7020689588598561,0.08,0.5567616463138851,0.5572139303482587,0.5567616463138851,0.5572139303482587,1.0,1.0,undersample,0.5,0.5,0.7737186849131354,0.5,COMPLETE
2704,0.5099124020285846,2025-11-30 16:26:15.318544,2025-11-30 16:27:39.192163,0 days 00:01:23.873619,0.00027972825535754514,dart,0.8917648679760033,9.30890405932048,lossguide,0.2488456010742679,0.22793932175498027,6,7,17.754006947855185,800,tree,0.76476208238146,0.4068601392357952,0.0595958373889675,undersample,0.5444702770589025,,10.0,0.6623463698340893,0.026015838647808487,weighted,0.106715974706485,0.908990050981805,,0.5278154681139756,0.5192220714608774,0.5297297297297298,0.5099124020285846,0.76476208238146,0.4068601392357952,0.08,0.6010783194355487,0.5856711139966275,0.5945399393326593,0.5901814300960512,0.4776604386677498,0.44886363636363635,undersample,0.5674812248213664,0.5537811907193929,0.5444702770589025,0.5,COMPLETE
2705,0.7156549520766773,2025-11-30 16:27:39.972605,2025-11-30 16:28:01.220798,0 days 00:00:21.248193,46.772831163336996,dart,0.8663877641467117,6.117825538548657,lossguide,0.011594914974787969,0.004641308522512817,8,8,36.543438240317094,400,tree,0.9265107305435262,0.5048351494359296,0.011870341709703726,none,0.5442608107097531,1.1209120551376774,5.0,0.7590369229272634,0.2818984486499827,uniform,0.8754428393252562,0.6283717693686608,,0.5567616463138851,0.5572139303482587,0.715281812899477,0.7156549520766773,0.9265107305435262,0.5048351494359296,0.08,0.5567616463138851,0.5572139303482587,0.5567616463138851,0.5572139303482587,1.0,1.0,none,0.5,0.5,0.5442608107097531,0.5,COMPLETE
2706,0.5187472430524923,2025-11-30 16:28:02.008903,2025-11-30 16:29:07.528856,0 days 00:01:05.519953,0.004055161029573471,dart,0.8098148167637886,4.211989127578681,lossguide,0.0028577338624245154,0.051141932549961286,9,12,19.504024898484644,700,forest,0.6893335259972297,0.23202691635599196,0.043620523977646125,undersample,0.716696172890388,,5.0,0.7647590090927288,0.14290751894062514,uniform,0.863303309567335,0.43753777563377816,,0.527363184079602,0.506558118498417,0.545058772311711,0.5187472430524923,0.6893335259972297,0.23202691635599196,0.08,0.5674518437425873,0.5637577349345325,0.5872420262664165,0.5681159420289855,0.5085296506904955,0.4772727272727273,undersample,0.5224891825129727,0.5157230410039398,0.716696172890388,0.5,COMPLETE
2707,0.7156549520766773,2025-11-30 16:29:08.308830,2025-11-30 16:29:55.908220,0 days 00:00:47.599390,0.00025537346482529916,dart,0.7004267211032136,8.602140822781152,depthwise,42.51672975535997,0.00048303902579701193,6,12,3.2636555852056714,600,forest,0.6948143231231328,0.3975415084251549,0.08690623369824935,undersample,0.9285438310949665,,9.0,0.6769354943235992,0.038889015161757134,weighted,0.5911965263937952,0.8657857223133367,,0.5567616463138851,0.5572139303482587,0.715281812899477,0.7156549520766773,0.6948143231231328,0.3975415084251549,0.08,0.5673279273407946,0.5691287522770849,0.5567616463138851,0.5572139303482587,1.0,1.0,undersample,0.5195987168222285,0.5218015832482124,0.9285438310949665,0.5,COMPLETE
2708,0.7156549520766773,2025-11-30 16:29:56.693593,2025-11-30 16:30:00.255546,0 days 00:00:03.561953,0.1677728498467012,dart,0.9351689208344205,9.475785719617452,depthwise,13.264741199249135,0.0001018715494709339,1,12,0.1879606418228678,200,forest,0.6908088761516886,0.36640068678153004,0.06161797658082843,none,0.5781464136697358,3.2479470484888595,9.0,0.8296354030063844,0.46358281049250233,weighted,0.10745940453395768,0.7044868127469346,,0.5567616463138851,0.5572139303482587,0.715281812899477,0.7156549520766773,0.6908088761516886,0.36640068678153004,0.08,0.5287280054893659,0.5441855859639312,0.5567616463138851,0.5572139303482587,1.0,1.0,none,0.4322365258044729,0.4497026849554939,0.5781464136697358,0.5,COMPLETE
2709,0.7156549520766773,2025-11-30 16:30:01.038222,2025-11-30 16:31:15.324337,0 days 00:01:14.286115,3.4443716075526787,dart,0.659284984799503,4.247347135238994,lossguide,31.039678962593612,0.0004117023744186753,4,5,5.523262907010311,800,forest,0.7765690282285406,0.6220501408539709,0.06133972919693297,undersample,0.639563975441187,,8.0,0.6722639361704174,0.2895847682935643,weighted,0.5218688898127503,0.9927579194326812,,0.5567616463138851,0.5572139303482587,0.715281812899477,0.7156549520766773,0.7765690282285406,0.6220501408539709,0.08,0.5567616463138851,0.5572139303482587,0.5567616463138851,0.5572139303482587,1.0,1.0,undersample,0.5,0.5,0.639563975441187,0.5,COMPLETE
2710,0.7156549520766773,2025-11-30 16:31:16.108802,2025-11-30 16:31:16.540609,0 days 00:00:00.431807,0.1747705789943344,gbtree,0.6472514220695771,9.862072872420999,lossguide,0.5464722878824604,0.36512698993956255,1,7,1.1412778646325172,300,,0.6188660507891031,0.24376858245730962,0.06467721009171155,oversample,0.5656253507364144,,9.0,0.9183715189488999,,,,0.8746541352650115,,0.5567616463138851,0.5572139303482587,0.715281812899477,0.7156549520766773,0.6188660507891031,0.24376858245730962,0.08,0.6571900846171712,0.666907195921861,0.5567616463138851,0.5572139303482587,1.0,1.0,oversample,0.639673651751521,0.6452283671384795,0.5656253507364144,0.5,COMPLETE
2711,0.0,2025-11-30 16:31:17.326613,2025-11-30 16:31:18.153679,0 days 00:00:00.827066,0.13681113110619814,gbtree,0.20269355137723616,5.421194909880277,depthwise,0.0006716816858414367,0.020992382443536177,2,11,1.2715757332220397,900,,0.6497088177963151,0.6040259920214375,0.04777404075327957,none,0.9512143899444242,0.6016367409479576,12.0,0.7773381817589967,,,,0.2914945142083698,,0.44323835368611486,0.4427860696517413,0.0,0.0,0.6497088177963151,0.6040259920214375,0.08,0.49691681363286483,0.49694473369072595,0.0,0.0,0.0,0.0,none,0.41073791011124194,0.41984225554833315,0.9512143899444242,0.5,COMPLETE
2712,0.7156549520766773,2025-11-30 16:31:18.944395,2025-11-30 16:31:19.504262,0 days 00:00:00.559867,56.948900064790564,gbtree,0.424253049754432,9.593897450048104,lossguide,0.0580599395472939,0.245811038171419,4,11,3.967098654785353,500,,0.6824097627017589,0.324644788202342,0.06734704199096517,none,0.6929404820287046,4.012632521945005,6.0,0.7896698662667616,,,,0.9108081458854935,,0.5567616463138851,0.5572139303482587,0.715281812899477,0.7156549520766773,0.6824097627017589,0.324644788202342,0.08,0.5567616463138851,0.5572139303482587,0.5567616463138851,0.5572139303482587,1.0,1.0,none,0.5,0.5,0.6929404820287046,0.5,COMPLETE
2713,0.7156549520766773,2025-11-30 16:31:20.291795,2025-11-30 16:31:20.919808,0 days 00:00:00.628013,0.31892096331651637,gbtree,0.6890253896410936,9.308875796631645,depthwise,0.0035773480976096553,0.0009677344561696208,1,8,14.468889618045239,600,,0.5988518439747502,0.7655235645276264,0.02771028073191244,none,0.7391795565698813,2.0852207694789953,11.0,0.9285191842723226,,,,0.6755088097395963,,0.5567616463138851,0.5572139303482587,0.715281812899477,0.7156549520766773,0.5988518439747502,0.7655235645276264,0.08,0.4617784138560834,0.484575157722218,0.5567616463138851,0.5572139303482587,1.0,1.0,none,0.2880253319849467,0.3162151944072271,0.7391795565698813,0.5,COMPLETE
2714,0.7156549520766773,2025-11-30 16:31:21.687833,2025-11-30 16:32:51.421207,0 days 00:01:29.733374,10.127414953184067,dart,0.4561677564105793,3.088107183134543,depthwise,0.3589777614952675,0.059134119549468143,3,5,1.2703462268488936,900,forest,0.8775886338600336,0.5473358424303179,0.012769184214499608,oversample,0.8334794767395974,,7.0,0.8984965090731032,0.48986595285869267,weighted,0.2896134950767724,0.4057189266988679,,0.5567616463138851,0.5572139303482587,0.715281812899477,0.7156549520766773,0.8775886338600336,0.5473358424303179,0.08,0.39401537772770334,0.404364108287216,0.5567616463138851,0.5572139303482587,1.0,1.0,oversample,0.20669979608415262,0.23645500311741374,0.8334794767395974,0.5,COMPLETE
2715,0.7156549520766773,2025-11-30 16:32:52.202471,2025-11-30 16:32:52.704389,0 days 00:00:00.501918,67.4628453346967,gbtree,0.36692581393848167,9.514942327257783,lossguide,0.011137726228647275,0.001179829150841953,7,6,0.3636785556692843,400,,0.6182653471269977,0.6186678661522824,0.05981372548804525,undersample,0.697944990820013,,6.0,0.8512821093129703,,,,0.6932814351255969,,0.5567616463138851,0.5572139303482587,0.715281812899477,0.7156549520766773,0.6182653471269977,0.6186678661522824,0.08,0.5567616463138851,0.5572139303482587,0.5567616463138851,0.5572139303482587,1.0,1.0,undersample,0.5,0.5,0.697944990820013,0.5,COMPLETE
2716,0.7156549520766773,2025-11-30 16:32:53.480899,2025-11-30 16:35:08.289043,0 days 00:02:14.808144,0.00065593048611632,dart,0.811172389224659,6.323345906369454,depthwise,0.00023486127938262524,0.27596480519375305,5,7,72.46374005836682,1000,tree,0.9020574967056001,0.22338920463987466,0.04303961144455054,none,0.8981056026000442,2.9727430927182934,6.0,0.6149647654412592,0.006377665064036697,weighted,0.8233083825461371,0.49573004218018846,,0.5567616463138851,0.5572139303482587,0.715281812899477,0.7156549520766773,0.9020574967056001,0.22338920463987466,0.08,0.4184044679128396,0.42309111348951256,0.5567616463138851,0.5572139303482587,1.0,1.0,none,0.24956688605580335,0.2650539577888913,0.8981056026000442,0.5,COMPLETE
2717,0.6146469049694856,2025-11-30 16:35:09.097877,2025-11-30 16:36:45.989903,0 days 00:01:36.892026,0.016913087616557444,dart,0.2815632367481253,2.9247200789362515,depthwise,0.10547876221988543,0.004155040797024676,6,10,9.633012111133858,900,tree,0.5717724371128174,0.6881094923452318,0.04394615232579934,undersample,0.5860458715967384,,10.0,0.9455894313088954,0.15540145084071494,uniform,0.1633665991191671,0.4932620934353382,,0.6110357304387155,0.6001809136137495,0.6260869565217392,0.6146469049694856,0.5717724371128174,0.6881094923452318,0.08,0.6664215413813057,0.6690448134263755,0.6735266604303087,0.6638418079096046,0.5848903330625508,0.5722402597402597,undersample,0.6758964836950215,0.6704106031863949,0.5860458715967384,0.5,COMPLETE
2718,0.0,2025-11-30 16:36:46.771691,2025-11-30 16:38:23.965070,0 days 00:01:37.193379,8.069905047017071,dart,0.45477065846920955,6.928222128816326,depthwise,13.270591842563604,0.10597559145787025,2,10,0.18505498630390765,900,forest,0.5144630598543833,0.24457297913292617,0.03511256742469309,undersample,0.9257479157970632,,11.0,0.698328558296476,0.4017660538499823,uniform,0.7141578870472421,0.31626870993955125,,0.44323835368611486,0.4427860696517413,0.0,0.0,0.5144630598543833,0.24457297913292617,0.08,0.4962399468636398,0.49497094357409543,0.0,0.0,0.0,0.0,undersample,0.3166452527396011,0.2961522325988618,0.9257479157970632,0.5,COMPLETE
2719,0.7156549520766773,2025-11-30 16:38:24.734981,2025-11-30 16:38:25.487933,0 days 00:00:00.752952,50.49503746598499,gbtree,0.3553990982150991,2.768985553163591,depthwise,9.941135891346569,0.00011701711139226647,6,9,0.1975331070469681,800,,0.6392981880720479,0.6242291362911372,0.052960292590736695,oversample,0.6736279124987175,,7.0,0.8007113184498058,,,,0.612340981731327,,0.5567616463138851,0.5572139303482587,0.715281812899477,0.7156549520766773,0.6392981880720479,0.6242291362911372,0.08,0.5567616463138851,0.5572139303482587,0.5567616463138851,0.5572139303482587,1.0,1.0,oversample,0.5,0.5,0.6736279124987175,0.5,COMPLETE
