number,value,datetime_start,datetime_complete,duration,params_alpha,params_booster,params_colsample_bytree,params_gamma,params_grow_policy,params_lambda,params_learning_rate,params_max_delta_step,params_max_depth,params_min_child_weight,params_n_estimators,params_normalize_type,params_params_feature_fraction,params_params_labeled_ratio,params_params_missing_rate,params_params_resampling,params_params_sample_rows,params_params_scale_pos_weight,params_params_selftrain_max_iter,params_params_selftrain_threshold,params_rate_drop,params_sample_type,params_skip_drop,params_subsample,params_user_attrs_decision_threshold,user_attrs_acc_test,user_attrs_acc_val,user_attrs_f1_test,user_attrs_f1_val,user_attrs_feature_fraction,user_attrs_labeled_ratio,user_attrs_missing_rate,user_attrs_pr_auc_test,user_attrs_pr_auc_val,user_attrs_prec_test,user_attrs_prec_val,user_attrs_rec_test,user_attrs_rec_val,user_attrs_resampling_strategy,user_attrs_roc_auc_test,user_attrs_roc_auc_val,user_attrs_sample_rows,user_attrs_user_attrs_decision_threshold,state
1041,0.7156549520766773,2025-11-26 23:52:37.875733,2025-11-26 23:53:08.589678,0 days 00:00:30.713945,0.9995241193997443,dart,0.925871127092866,8.242774186084533,depthwise,0.0007979090872975967,0.09826290490180349,4,3,0.1375798367494861,500,tree,0.8596028125625828,0.8093723790816576,0.034232390684469316,none,0.9150145061238089,1.019287804732365,10.0,0.8219681096341704,0.17688140782660083,weighted,0.3158260154736827,0.6020272710944619,0.5169076935067428,0.5567616463138851,0.5572139303482587,0.715281812899477,0.7156549520766773,0.8596028125625828,0.8093723790816576,0.02,0.498360943739858,0.5048442188323183,0.5567616463138851,0.5572139303482587,1.0,1.0,none,0.39318788441452934,0.4004521079023122,0.9150145061238089,0.5169076935067428,COMPLETE
1042,0.7156549520766773,2025-11-26 23:53:08.769145,2025-11-26 23:53:11.968041,0 days 00:00:03.198896,0.0045440887981407895,gbtree,0.7259267285663954,3.8831397022448106,lossguide,3.868977957463694,0.029346261243208615,6,9,1.1593928436914203,800,,0.6475194558444194,0.2426879749683106,0.05578609769400236,oversample,0.555881633198622,,8.0,0.6176288779207463,,,,0.3839969184053248,0.060897309030478686,0.5563093622795116,0.5572139303482587,0.7149084568439407,0.7156549520766773,0.6475194558444194,0.2426879749683106,0.05,0.4980675281947424,0.5057306728490916,0.5565610859728507,0.5572139303482587,0.9991876523151909,1.0,oversample,0.4334765994131202,0.4376421905469403,0.555881633198622,0.060897309030478686,COMPLETE
1043,0.7156549520766773,2025-11-26 23:53:12.135182,2025-11-26 23:53:40.188821,0 days 00:00:28.053639,20.079389251567918,dart,0.4219479631437104,7.8824222192808,depthwise,32.18063289973891,0.00010421606630558166,0,8,13.69599265242199,500,forest,0.7328385182161541,0.3309695115979771,0.040643195941280935,none,0.829323106959297,1.4396728141710302,6.0,0.7885792369509431,0.33472225233211766,uniform,0.6331207849305195,0.8999261070188793,0.2701298568301227,0.5567616463138851,0.5572139303482587,0.715281812899477,0.7156549520766773,0.7328385182161541,0.3309695115979771,0.05,0.5567616463138851,0.5572139303482587,0.5567616463138851,0.5572139303482587,1.0,1.0,none,0.5,0.5,0.829323106959297,0.2701298568301227,COMPLETE
1044,0.7156549520766773,2025-11-26 23:53:40.368846,2025-11-26 23:54:57.887984,0 days 00:01:17.519138,0.18501893409730724,dart,0.26270480663989393,3.7118475203769226,lossguide,0.15885950020238473,0.00018472053523773242,0,7,25.726953048535222,800,forest,0.8368625237046607,0.4107661195761729,0.048070053874929006,undersample,0.8931950328361838,,7.0,0.8410256540639155,0.09653146101850663,weighted,0.0016517825471914632,0.5539688058762948,0.1052074664604543,0.5567616463138851,0.5572139303482587,0.715281812899477,0.7156549520766773,0.8368625237046607,0.4107661195761729,0.05,0.524031290536751,0.5461134526868642,0.5567616463138851,0.5572139303482587,1.0,1.0,undersample,0.4409029493194516,0.4652188656593662,0.8931950328361838,0.1052074664604543,COMPLETE
1045,0.0,2025-11-26 23:54:58.068996,2025-11-26 23:55:35.863828,0 days 00:00:37.794832,0.021177899312432632,dart,0.7255166180202469,2.9729754479106942,lossguide,0.9871446982945784,0.17108005444432547,9,12,39.065040185109865,600,tree,0.8879433923997979,0.11976660113902338,0.0769231862616941,oversample,0.5965943883246011,,6.0,0.6155948759591965,0.3789399490127769,weighted,0.41994672480495854,0.5903717885024424,0.8569294982986204,0.44323835368611486,0.4427860696517413,0.0,0.0,0.8879433923997979,0.11976660113902338,0.08,0.5567616463138851,0.5572139303482587,0.0,0.0,0.0,0.0,oversample,0.5,0.5,0.5965943883246011,0.8569294982986204,COMPLETE
1046,0.620494699646643,2025-11-26 23:55:36.043094,2025-11-26 23:55:39.141751,0 days 00:00:03.098657,0.0015872043724160282,gbtree,0.7801959332860238,2.6826901742427323,depthwise,0.09832607097043512,0.350630435945956,3,8,0.22500170147823356,900,,0.6492336106288767,0.46259778721303446,0.08666182524774664,undersample,0.641736054473792,,6.0,0.7973196640779324,,,,0.4387841977362179,0.23043452725025002,0.5468113975576662,0.514246947082768,0.6429080541696365,0.620494699646643,0.6492336106288767,0.46259778721303446,0.08,0.5354126730019362,0.5258393572808441,0.5726984126984127,0.5494367959949937,0.7327376116978067,0.7126623376623377,undersample,0.5018829058837182,0.4812561353355531,0.641736054473792,0.23043452725025002,COMPLETE
1047,0.7089201877934272,2025-11-26 23:55:39.323972,2025-11-26 23:55:41.780187,0 days 00:00:02.456215,0.011202509547818972,gbtree,0.5198323889094124,1.8751415856853346,depthwise,0.0018761339879276042,0.08504705837660242,8,6,0.1091326409613097,800,,0.7356918291082423,0.7553525035976434,0.0011844231989475756,none,0.989325516557607,0.7712588657765522,5.0,0.6607414454145213,,,,0.5874877203027302,0.2396382046694766,0.5526910900045229,0.5513342379014021,0.7090320682553692,0.7089201877934272,0.7356918291082423,0.7553525035976434,0.0,0.5260934388342554,0.5118431436349443,0.5558118081180812,0.5551470588235294,0.9788789601949635,0.9805194805194806,none,0.4793767303834613,0.4671991695740419,0.989325516557607,0.2396382046694766,COMPLETE
1048,0.0,2025-11-26 23:55:41.956141,2025-11-26 23:56:22.877259,0 days 00:00:40.921118,0.001760712284015804,dart,0.965252326970748,3.990636162360878,lossguide,0.096453006700835,0.01914723124254574,5,10,28.2181831659512,600,tree,0.9718686367765779,0.773110281768642,0.08291833424641212,oversample,0.7638901281504831,,12.0,0.7769169387999922,0.2545835700606522,weighted,0.14150968437834952,0.7324351015919632,0.8548025891613349,0.44323835368611486,0.4427860696517413,0.0,0.0,0.9718686367765779,0.773110281768642,0.08,0.5079915763817668,0.5004945392455216,0.0,0.0,0.0,0.0,oversample,0.4718645866144996,0.4561534928299483,0.7638901281504831,0.8548025891613349,COMPLETE
1049,0.7156549520766773,2025-11-26 23:56:23.054465,2025-11-26 23:59:31.461206,0 days 00:03:08.406741,0.47111966688742096,dart,0.8310336108453881,1.856132036350036,lossguide,5.962672783857649,0.018205967434016375,9,8,4.721220365390481,600,tree,0.9640500806935446,0.28492334693679117,0.0773713744184648,oversample,0.6438353448903013,,8.0,0.6665107061087688,0.24214471519119496,weighted,0.3857547200222358,0.7348462848266827,0.04167842699510527,0.5567616463138851,0.5572139303482587,0.715281812899477,0.7156549520766773,0.9640500806935446,0.28492334693679117,0.08,0.5800201224625691,0.5792278091853722,0.5567616463138851,0.5572139303482587,1.0,1.0,oversample,0.5368615195875264,0.5328501618402027,0.6438353448903013,0.04167842699510527,COMPLETE
1050,0.6366806136680614,2025-11-26 23:59:31.640506,2025-11-26 23:59:37.102419,0 days 00:00:05.461913,0.015168896621567911,gbtree,0.5323362171896856,1.7285619700215011,lossguide,0.01308631588487789,0.14543314545519354,8,9,0.10011698947070398,1000,,0.6539613130642463,0.6157738431182521,0.04355201570882401,undersample,0.9340714912844925,,7.0,0.633358835403436,,,,0.45052102942942296,0.2717302198041432,0.532790592492085,0.5287200361827228,0.6404455273233554,0.6366806136680614,0.6539613130642463,0.6157738431182521,0.05,0.5344599964721246,0.5508972348618545,0.5602923264311814,0.5580684596577017,0.7473598700243704,0.7410714285714286,undersample,0.49016976408760093,0.511770724168579,0.9340714912844925,0.2717302198041432,COMPLETE
1051,0.7119645494830132,2025-11-26 23:59:37.277637,2025-11-26 23:59:40.516402,0 days 00:00:03.238765,1.2191370772628707,gbtree,0.922104547052856,2.7560757085153518,lossguide,0.0007169349284724564,0.05878745927358609,8,10,4.302449677761118,600,,0.8233740216609151,0.5723745906507223,0.059688405298484015,undersample,0.5065974184752345,,10.0,0.7448249964137003,,,,0.537836821234357,0.1996979608981387,0.5517865219357757,0.5590230664857531,0.7072378138847858,0.7119645494830132,0.8233740216609151,0.5723745906507223,0.05,0.5924619633853673,0.5895911409389971,0.5557103064066853,0.559684161634928,0.9723801787164906,0.9780844155844156,undersample,0.5512980984432766,0.553191701046655,0.5065974184752345,0.1996979608981387,COMPLETE
1052,0.7156549520766773,2025-11-26 23:59:40.695415,2025-11-26 23:59:41.798163,0 days 00:00:01.102748,10.321908034876422,gbtree,0.9291422559504554,2.50320083128322,depthwise,0.0001660527571605058,0.014335045813975747,9,5,0.2759431820121638,900,,0.7443268139139637,0.538472457728646,0.0608576095790354,undersample,0.894660902448508,,9.0,0.6960219471194363,,,,0.4894699568581446,0.4150258200067382,0.5567616463138851,0.5572139303482587,0.715281812899477,0.7156549520766773,0.7443268139139637,0.538472457728646,0.05,0.43825717658507146,0.4364187149704035,0.5567616463138851,0.5572139303482587,1.0,1.0,undersample,0.32000489066463306,0.3156427012721701,0.894660902448508,0.4150258200067382,COMPLETE
1053,0.7156549520766773,2025-11-26 23:59:41.984254,2025-11-26 23:59:43.325248,0 days 00:00:01.340994,5.3069211699492085,gbtree,0.43776200565608925,2.115472617316525,depthwise,0.02506268297162028,0.002986350044002703,7,7,0.2908386682474628,1000,,0.7545547553701991,0.495534519957122,0.07584771324465568,undersample,0.9653273033231559,,6.0,0.6618618219964822,,,,0.4973452825407816,0.3106018585282708,0.5567616463138851,0.5572139303482587,0.715281812899477,0.7156549520766773,0.7545547553701991,0.495534519957122,0.08,0.6486582434518104,0.6641536103525764,0.5567616463138851,0.5572139303482587,1.0,1.0,undersample,0.6457169382781545,0.6439411903214252,0.9653273033231559,0.3106018585282708,COMPLETE
1054,0.0,2025-11-26 23:59:43.503484,2025-11-27 00:00:00.153406,0 days 00:00:16.649922,5.13889950372512,dart,0.7888862204361626,3.6835414742547004,lossguide,0.8326309170082336,0.002942218400121779,8,11,6.986075113912406,400,tree,0.7745305884681222,0.09935612809995117,0.06365139882629194,oversample,0.5516469460186778,,5.0,0.661000764694784,0.35821700591207406,weighted,0.2866944754770378,0.4277292407104405,0.6417231236752088,0.44323835368611486,0.4427860696517413,0.0,0.0,0.7745305884681222,0.09935612809995117,0.05,0.41168758615654155,0.40658913936003455,0.0,0.0,0.0,0.0,oversample,0.24891617898174706,0.2298669792924134,0.5516469460186778,0.6417231236752088,COMPLETE
1055,0.7156549520766773,2025-11-27 00:00:00.336073,2025-11-27 00:00:43.184449,0 days 00:00:42.848376,33.07318920387344,dart,0.8062617140398626,2.6997386344013306,lossguide,31.48600564613803,0.0026261031728091345,10,7,5.374693597949744,600,forest,0.8476148874906172,0.12961435736125831,0.07965363338500156,undersample,0.9144873878308786,,10.0,0.8468729378940987,0.11083578472545597,uniform,0.11947898406104318,0.5854201370000334,0.19236691531188005,0.5567616463138851,0.5572139303482587,0.715281812899477,0.7156549520766773,0.8476148874906172,0.12961435736125831,0.08,0.5567616463138851,0.5572139303482587,0.5567616463138851,0.5572139303482587,1.0,1.0,undersample,0.5,0.5,0.9144873878308786,0.19236691531188005,COMPLETE
1056,0.7156549520766773,2025-11-27 00:00:43.360156,2025-11-27 00:00:44.359899,0 days 00:00:00.999743,0.0938309517656643,gbtree,0.9454311254190909,5.750373656408139,depthwise,0.35116825985475464,0.01575485271897882,8,10,12.000252737683235,800,,0.8022531631083921,0.49744428529548557,0.07098457000280822,oversample,0.9339423214946039,,9.0,0.8404169456576152,,,,0.338539125846085,0.4368581706497338,0.5567616463138851,0.5572139303482587,0.715281812899477,0.7156549520766773,0.8022531631083921,0.49744428529548557,0.08,0.5106941364070579,0.529214033966302,0.5567616463138851,0.5572139303482587,1.0,1.0,oversample,0.4252275402443675,0.4342225700754812,0.9339423214946039,0.4368581706497338,COMPLETE
1057,0.7156549520766773,2025-11-27 00:00:44.541861,2025-11-27 00:01:03.471758,0 days 00:00:18.929897,2.3371278750889823,dart,0.7270818126378278,0.8329881845492499,lossguide,0.2766942585331579,0.005194583857737313,9,6,13.968364412411486,400,tree,0.8579632603520226,0.4335550069996233,0.0544671659676746,undersample,0.5801640313831392,,6.0,0.6220154253002422,0.395235054824677,weighted,0.5632012029306359,0.41511744390497685,0.13998839381657568,0.5567616463138851,0.5572139303482587,0.715281812899477,0.7156549520766773,0.8579632603520226,0.4335550069996233,0.05,0.568854126587343,0.5631230295573595,0.5567616463138851,0.5572139303482587,1.0,1.0,undersample,0.4895605033239941,0.4956592500961755,0.5801640313831392,0.13998839381657568,COMPLETE
1058,0.7107871720116619,2025-11-27 00:01:03.648386,2025-11-27 00:01:05.679586,0 days 00:00:02.031200,1.7557928857439224,gbtree,0.754946718659202,0.05067405964544447,lossguide,0.5672730265081474,0.005189725608073406,8,8,8.36947393363689,600,,0.972051324718611,0.27901681859029737,0.03292098421001198,oversample,0.537646503846953,,10.0,0.7605204962476886,,,,0.7635028639265461,0.3801771367366974,0.5490728177295342,0.5513342379014021,0.708905109489051,0.7107871720116619,0.972051324718611,0.27901681859029737,0.02,0.5972751071919342,0.6058355247396829,0.5533272561531449,0.5545950864422202,0.9861900893582454,0.989448051948052,oversample,0.5737707024320695,0.5807028773065546,0.537646503846953,0.3801771367366974,COMPLETE
1059,0.7156549520766773,2025-11-27 00:01:05.853869,2025-11-27 00:01:35.881989,0 days 00:00:30.028120,67.58909226525606,dart,0.9382209066528918,4.2307084213251365,lossguide,1.0026227164994477,0.0012950076868439874,9,7,16.254138065032087,500,tree,0.7809005914568631,0.10981748176664115,0.08807621110500885,undersample,0.9855806146507363,,8.0,0.9448061837899323,0.10990480881185094,weighted,0.14571668360571247,0.2846973824238611,0.18169931188557165,0.5567616463138851,0.5572139303482587,0.715281812899477,0.7156549520766773,0.7809005914568631,0.10981748176664115,0.08,0.5567616463138851,0.5572139303482587,0.5567616463138851,0.5572139303482587,1.0,1.0,undersample,0.5,0.5,0.9855806146507363,0.18169931188557165,COMPLETE
1060,0.6513263023330137,2025-11-27 00:01:36.061428,2025-11-27 00:03:34.930733,0 days 00:01:58.869305,0.3400253789633867,dart,0.6511296689605104,3.6506677188789842,depthwise,0.03902539893238138,0.09642196332809189,6,11,2.7055728984779823,600,forest,0.9682991382292858,0.23609785746771542,0.09915546014901351,oversample,0.6193382597438997,,5.0,0.6178164066254364,0.37963585543289274,uniform,0.48068375208327824,0.3961593100743488,0.6679394447509936,0.5205789235639982,0.506558118498417,0.6593830334190232,0.6513263023330137,0.9682991382292858,0.23609785746771542,0.1,0.5975990725414242,0.590919817142855,0.5454545454545454,0.5371639430680021,0.8334687246141349,0.8271103896103896,oversample,0.5031888791259802,0.4894816304737143,0.6193382597438997,0.6679394447509936,COMPLETE
1061,0.7134536983110076,2025-11-27 00:03:35.122671,2025-11-27 00:04:24.713024,0 days 00:00:49.590353,1.0903064705806995,dart,0.826863013061055,0.18773685557976694,lossguide,0.4901027510060658,0.023529478802620272,10,9,5.20987592720259,300,forest,0.8548924333185947,0.6417929637426505,0.08311861389283469,oversample,0.675477355224432,,6.0,0.6569565082432524,0.024387530942450275,uniform,0.5480973710155076,0.6413012918731571,0.13900435092378383,0.5540479421076436,0.5549525101763908,0.712536443148688,0.7134536983110076,0.8548924333185947,0.6417929637426505,0.08,0.5339301218318928,0.5375114907581263,0.5557071396089132,0.5563124432334242,0.9926888708367181,0.9943181818181818,oversample,0.48206742485783916,0.48796147672552165,0.675477355224432,0.13900435092378383,COMPLETE
1062,0.7156549520766773,2025-11-27 00:04:24.893199,2025-11-27 00:04:25.631441,0 days 00:00:00.738242,0.010002513321919475,gbtree,0.78927966294425,3.961331320149315,lossguide,16.415350218199055,0.10391876956558134,7,7,1.4546459450009075,500,,0.7796849812598343,0.1709256671262156,0.07916036153979657,oversample,0.5280681267727316,,9.0,0.7048943949993437,,,,0.6788840145218116,0.12790820473341505,0.5567616463138851,0.5572139303482587,0.715281812899477,0.7156549520766773,0.7796849812598343,0.1709256671262156,0.08,0.4615208292062588,0.4696598458977518,0.5567616463138851,0.5572139303482587,1.0,1.0,oversample,0.36256859364379385,0.35428743881246433,0.5280681267727316,0.12790820473341505,COMPLETE
1063,0.7156549520766773,2025-11-27 00:04:25.805090,2025-11-27 00:05:39.129691,0 days 00:01:13.324601,0.5522505465218479,dart,0.8924067023008981,4.710844359464264,lossguide,0.00018504898601959707,0.00019882862838679227,1,11,6.5630574772088535,800,forest,0.6113055376474978,0.09529877158617099,0.05999691521178772,undersample,0.8853232564583092,,6.0,0.7523218594829508,0.23149997591571575,weighted,0.4263641583849585,0.32296856633883525,0.16865002177338184,0.5567616463138851,0.5572139303482587,0.715281812899477,0.7156549520766773,0.6113055376474978,0.09529877158617099,0.05,0.4570357359904172,0.45303650780286553,0.5567616463138851,0.5572139303482587,1.0,1.0,undersample,0.36392140121686367,0.3472973017789157,0.8853232564583092,0.16865002177338184,COMPLETE
1064,0.17220172201722017,2025-11-27 00:05:39.307726,2025-11-27 00:07:08.871266,0 days 00:01:29.563540,1.6738930623310073,dart,0.38287950504766854,3.9192503715984497,depthwise,0.0002812447096892954,0.09148679838736971,9,9,0.4617175602294284,900,tree,0.7648578293330877,0.8452986357849042,0.04216676681466683,oversample,0.8375632467957863,,7.0,0.6926777006479243,0.23575346333008934,weighted,0.26129819252098774,0.9471699257894448,0.5697480922810254,0.4052464947987336,0.3912256897331524,0.17761100687929957,0.17220172201722017,0.7648578293330877,0.8452986357849042,0.05,0.4711124354924709,0.4605338874226192,0.3858695652173913,0.3553299492385787,0.11535337124289195,0.11363636363636363,oversample,0.37007576385550156,0.35531552206730954,0.8375632467957863,0.5697480922810254,COMPLETE
1065,0.6412525527569776,2025-11-27 00:07:09.048712,2025-11-27 00:07:12.773322,0 days 00:00:03.724610,0.014557190098312323,gbtree,0.8299994797453428,1.389968035518765,depthwise,0.23645113733770187,0.1984410773200251,7,8,4.087852995284968,600,,0.863131303950052,0.22372516796099343,0.0790860380765463,oversample,0.5067753706852239,,10.0,0.6622644344758399,,,,0.5867041976875443,0.111025831547933,0.5251017639077341,0.5232926277702397,0.6435845213849287,0.6412525527569776,0.863131303950052,0.22372516796099343,0.08,0.5631095054455888,0.5371722698430803,0.5527696793002915,0.552168815943728,0.7701056051990252,0.7646103896103896,oversample,0.5135927319749996,0.4882839963917594,0.5067753706852239,0.111025831547933,COMPLETE
1066,0.7156549520766773,2025-11-27 00:07:12.956309,2025-11-27 00:07:53.556836,0 days 00:00:40.600527,0.08906961540737526,dart,0.5499323854946845,9.221279600337477,lossguide,0.0037344554450894837,0.00021088723505517917,3,4,1.4159704569101377,600,tree,0.5292824029928296,0.06976660453958852,0.07674242937644475,undersample,0.8793612935634461,,10.0,0.6378836743755529,0.22527456376730726,weighted,0.06661826611397467,0.7249842048079124,0.2649256357883733,0.5567616463138851,0.5572139303482587,0.715281812899477,0.7156549520766773,0.5292824029928296,0.06976660453958852,0.08,0.5955464125988682,0.597016911092551,0.5567616463138851,0.5572139303482587,1.0,1.0,undersample,0.5680656177987036,0.5653732439674727,0.8793612935634461,0.2649256357883733,COMPLETE
1067,0.7050487156775908,2025-11-27 00:07:53.736211,2025-11-27 00:07:56.226471,0 days 00:00:02.490260,0.00020655791998212434,gbtree,0.5341742895914907,3.4083040215328837,lossguide,0.39844511473306293,0.09923551084592487,6,12,0.7019461047694932,400,,0.8906429145306396,0.48421567452201486,0.09467862733416253,undersample,0.5342434265969435,,12.0,0.7391041031763436,,,,0.4345604616961182,0.17403745529594114,0.5445499773857982,0.5481682496607869,0.702159124519373,0.7050487156775908,0.8906429145306396,0.48421567452201486,0.1,0.4703386011771018,0.4654222687123824,0.552093023255814,0.5540603248259861,0.9642567018683996,0.9691558441558441,undersample,0.3813412854987649,0.38018933313877135,0.5342434265969435,0.17403745529594114,COMPLETE
1068,0.0,2025-11-27 00:07:56.407556,2025-11-27 00:07:57.104901,0 days 00:00:00.697345,0.010505704420163941,gbtree,0.6636097039182901,7.7012463444245265,lossguide,0.00010346820820283782,0.012321521022468059,5,4,0.13866334688902437,400,,0.8139697932627591,0.776824003331253,0.04421795015537573,oversample,0.751399730368961,,9.0,0.8618914997916433,,,,0.35759248115809816,0.7591171426536787,0.44323835368611486,0.4427860696517413,0.0,0.0,0.8139697932627591,0.776824003331253,0.05,0.443104739463728,0.4355081650666989,0.0,0.0,0.0,0.0,oversample,0.30571544621097835,0.2882633518167226,0.751399730368961,0.7591171426536787,COMPLETE
1069,0.7052341597796143,2025-11-27 00:07:57.289389,2025-11-27 00:08:00.237380,0 days 00:00:02.947991,0.03387609159072242,gbtree,0.961182769282536,0.4717459738029186,lossguide,0.1318118698484461,0.12105285323708022,4,5,50.346310154622905,800,,0.9201168058913322,0.5169370736884705,0.08242617216994653,oversample,0.7897327481110533,,9.0,0.8269342142732322,,,,0.49620626320528005,0.38575210336914384,0.5608322026232474,0.5644504748982361,0.70260336906585,0.7052341597796143,0.9201168058913322,0.5169370736884705,0.08,0.543741375972616,0.5543978234018179,0.5639134709931171,0.5660933660933661,0.9317627944760357,0.935064935064935,oversample,0.5084223047464315,0.5253335466882454,0.7897327481110533,0.38575210336914384,COMPLETE
