number,value,datetime_start,datetime_complete,duration,params_alpha,params_booster,params_colsample_bytree,params_gamma,params_grow_policy,params_lambda,params_learning_rate,params_max_delta_step,params_max_depth,params_min_child_weight,params_n_estimators,params_normalize_type,params_params_feature_fraction,params_params_labeled_ratio,params_params_missing_rate,params_params_resampling,params_params_sample_rows,params_params_scale_pos_weight,params_params_selftrain_max_iter,params_params_selftrain_threshold,params_rate_drop,params_sample_type,params_skip_drop,params_subsample,params_user_attrs_decision_threshold,user_attrs_acc_test,user_attrs_acc_val,user_attrs_f1_test,user_attrs_f1_val,user_attrs_feature_fraction,user_attrs_labeled_ratio,user_attrs_missing_rate,user_attrs_pr_auc_test,user_attrs_pr_auc_val,user_attrs_prec_test,user_attrs_prec_val,user_attrs_rec_test,user_attrs_rec_val,user_attrs_resampling_strategy,user_attrs_roc_auc_test,user_attrs_roc_auc_val,user_attrs_sample_rows,user_attrs_user_attrs_decision_threshold,state
2481,0.7156549520766773,2025-11-30 14:50:54.161444,2025-11-30 14:50:57.669106,0 days 00:00:03.507662,0.005066784647437627,dart,0.8878959102556625,4.157630118712738,lossguide,0.030099017120708456,0.008056398747383226,10,5,94.37115343734392,200,forest,0.7712687321191176,0.20367727039681285,0.036138092976430246,oversample,0.6102373737350966,,9.0,0.9188509216560261,0.42167934263492635,uniform,0.03757725345523018,0.6461767743638687,,0.5567616463138851,0.5572139303482587,0.715281812899477,0.7156549520766773,0.7712687321191176,0.20367727039681285,0.08,0.5567616463138851,0.5572139303482587,0.5567616463138851,0.5572139303482587,1.0,1.0,oversample,0.5,0.5,0.6102373737350966,0.5,COMPLETE
2482,0.7156549520766773,2025-11-30 14:50:58.450423,2025-11-30 14:50:59.133451,0 days 00:00:00.683028,0.3076378914040082,gbtree,0.9937397714533573,8.594292396478572,depthwise,0.0004236913913617692,0.004307164016394072,1,12,12.413811327842069,700,,0.9816190791950226,0.8418146064585474,0.0019151724568610253,oversample,0.7268191719214263,,7.0,0.9198806928080265,,,,0.5668579282580055,,0.5567616463138851,0.5572139303482587,0.715281812899477,0.7156549520766773,0.9816190791950226,0.8418146064585474,0.08,0.45402607457710875,0.48102552036852597,0.5567616463138851,0.5572139303482587,1.0,1.0,oversample,0.304581889620186,0.33676732486104294,0.7268191719214263,0.5,COMPLETE
2483,0.7156549520766773,2025-11-30 14:50:59.948037,2025-11-30 14:51:43.985451,0 days 00:00:44.037414,56.92770521466393,dart,0.9753104164647468,0.8532226453618352,depthwise,0.012661300135049677,0.004789895359073042,2,4,1.2875352309324408,600,tree,0.7170816325552551,0.581187735925032,0.09478507456937835,none,0.5182539942124302,4.779405620350912,7.0,0.6263983291641783,0.09318268564957594,uniform,0.16978822638302024,0.9411792981645557,,0.5567616463138851,0.5572139303482587,0.715281812899477,0.7156549520766773,0.7170816325552551,0.581187735925032,0.1,0.5567616463138851,0.5572139303482587,0.5567616463138851,0.5572139303482587,1.0,1.0,none,0.5,0.5,0.5182539942124302,0.5,COMPLETE
2484,0.0,2025-11-30 14:51:44.767544,2025-11-30 14:51:45.628793,0 days 00:00:00.861249,11.185252368073753,gbtree,0.2639819988114326,9.39573570632062,depthwise,2.1760997459194775,0.0001299983554750894,3,4,90.69417430091579,1000,,0.5487297179858879,0.7098592830426316,0.07570406021657106,none,0.8443475481548739,0.5153802089680805,6.0,0.6954115912470811,,,,0.3249918965095826,,0.44323835368611486,0.4427860696517413,0.0,0.0,0.5487297179858879,0.7098592830426316,0.08,0.5567616463138851,0.5572139303482587,0.0,0.0,0.0,0.0,none,0.5,0.5,0.8443475481548739,0.5,COMPLETE
2485,0.0,2025-11-30 14:51:46.391303,2025-11-30 14:51:47.088770,0 days 00:00:00.697467,0.0032789278305972044,gbtree,0.603358202527857,9.265393959870195,lossguide,15.211230263409362,0.00041746924197174257,10,6,28.07427715628359,800,,0.8708507240513987,0.47100638686744406,0.0022070485630294456,none,0.5159989938822428,0.5109443713562978,10.0,0.8652582480394514,,,,0.27134773523396494,,0.44323835368611486,0.4427860696517413,0.0,0.0,0.8708507240513987,0.47100638686744406,0.08,0.5567616463138851,0.5572139303482587,0.0,0.0,0.0,0.0,none,0.5,0.5,0.5159989938822428,0.5,COMPLETE
2486,0.0,2025-11-30 14:51:47.842747,2025-11-30 14:51:53.060127,0 days 00:00:05.217380,0.9500590273801279,dart,0.5318968978785192,0.4916908122774344,lossguide,0.0013385714022193167,0.023449513165998113,3,9,28.021814469559082,200,forest,0.7619587193506381,0.20201215858171473,0.05505642152630376,none,0.6008521598060685,0.5456953961406921,12.0,0.6948456772342401,0.18239446580737811,uniform,0.409977813001582,0.6413860994518892,,0.44323835368611486,0.4427860696517413,0.0,0.0,0.7619587193506381,0.20201215858171473,0.08,0.6996957936442558,0.6687809543204879,0.0,0.0,0.0,0.0,none,0.6672018766889372,0.6497867556345596,0.6008521598060685,0.5,COMPLETE
2487,0.6679933665008292,2025-11-30 14:51:53.848636,2025-11-30 14:52:29.146068,0 days 00:00:35.297432,0.16066753677706572,dart,0.896901636293054,0.6342721104729387,lossguide,1.9044688187099081,0.0029705306142130037,7,10,3.4118313547838692,500,forest,0.5651328092522823,0.531748976751398,0.05860947340466732,oversample,0.6096853702901304,,8.0,0.8551048842019269,0.22922327176934032,uniform,0.49915024044890366,0.9788545704339584,,0.5345997286295794,0.5472636815920398,0.6596096592788621,0.6679933665008292,0.5651328092522823,0.531748976751398,0.08,0.5763972749226153,0.5762279407139941,0.5563616071428571,0.5647784632641615,0.809910641754671,0.8173701298701299,oversample,0.522351995225385,0.5278867582876776,0.6096853702901304,0.5,COMPLETE
2488,0.5393772893772893,2025-11-30 14:52:29.921420,2025-11-30 14:52:30.293169,0 days 00:00:00.371749,3.6776772815840135,gbtree,0.5306188342784077,4.775896508861823,lossguide,0.027731268033496747,0.0002026255966819578,2,6,19.09613065866395,200,,0.9470150156081479,0.25567308932537713,0.08807517735309033,undersample,0.7097422139532124,,12.0,0.8220621756727463,,,,0.7256953859185635,,0.5554047942107644,0.5450022614201718,0.5467957584140156,0.5393772893772893,0.9470150156081479,0.25567308932537713,0.08,0.6118784936362771,0.5826978626422527,0.6321961620469083,0.6186974789915967,0.48172217709179527,0.4780844155844156,undersample,0.5380419105091264,0.5176730827905496,0.7097422139532124,0.5,COMPLETE
2489,0.7156549520766773,2025-11-30 14:52:31.071611,2025-11-30 14:52:32.932940,0 days 00:00:01.861329,0.012405891023909762,gbtree,0.4377782112627786,1.6720026322422221,lossguide,4.438420232599353,0.0031620624758873944,4,4,2.2815353799673614,400,,0.5480886493374866,0.31384142681714094,0.07088991996097921,oversample,0.7575851956188535,,11.0,0.6109322675248636,,,,0.5193324668782136,,0.5567616463138851,0.5572139303482587,0.715281812899477,0.7156549520766773,0.5480886493374866,0.31384142681714094,0.08,0.44435991398047986,0.4433834845507464,0.5567616463138851,0.5572139303482587,1.0,1.0,oversample,0.3132466552827467,0.31646889882334217,0.7575851956188535,0.5,COMPLETE
2490,0.46440516005733395,2025-11-30 14:52:33.754260,2025-11-30 14:52:39.057733,0 days 00:00:05.303473,0.763392726048264,gbtree,0.4136300105461637,0.6733397717042799,lossguide,0.0008809239210485714,0.0003687773371641358,5,9,0.3273122166187367,400,,0.7947008113541196,0.6594086572869835,0.06774914693891775,undersample,0.9587949909347622,,9.0,0.7137955693136996,,,,0.7037976432579394,,0.5061058344640434,0.4929895974672094,0.4824644549763033,0.46440516005733395,0.7947008113541196,0.6594086572869835,0.08,0.5677830856404666,0.5494008789659599,0.5790671217292378,0.5644599303135889,0.41348497156783104,0.3944805194805195,undersample,0.5182832109285631,0.5006326028414895,0.9587949909347622,0.5,COMPLETE
2491,0.3033175355450237,2025-11-30 14:52:39.878984,2025-11-30 14:54:32.144115,0 days 00:01:52.265131,2.1171244941061826,dart,0.8494885996208139,8.420740774165903,lossguide,0.0006081548706461183,0.00014640042694226483,4,12,36.19269804188066,1000,tree,0.5537034449738252,0.6972065403597273,0.06241946134580742,undersample,0.8341184000186399,,5.0,0.8901891116621647,0.24845032342511308,weighted,0.3879969348381604,0.24307954283819744,,0.33966530981456355,0.33514246947082765,0.3196644920782852,0.3033175355450237,0.5537034449738252,0.6972065403597273,0.08,0.42113447522780195,0.4203305983562169,0.37486338797814206,0.36446469248291574,0.2786352558895207,0.2597402597402597,undersample,0.26815555629237886,0.27079712932624067,0.8341184000186399,0.5,COMPLETE
2492,0.5181619256017506,2025-11-30 14:54:32.979169,2025-11-30 14:54:33.514237,0 days 00:00:00.535068,0.0008615265033383733,gbtree,0.40676546772506006,2.1760226988180866,depthwise,0.0005596881147365865,0.009741716808373931,4,11,16.248271071184796,200,,0.8751244179382528,0.7528827423887061,0.07342814779344135,undersample,0.9275869150870215,,9.0,0.7262604434780271,,,,0.8767312341902522,,0.4970601537765717,0.5020352781546812,0.5127081507449606,0.5181619256017506,0.8751244179382528,0.7528827423887061,0.08,0.5487906874323357,0.5487430334386046,0.5566127497621313,0.5622032288698955,0.4752233956133225,0.4805194805194805,undersample,0.510428720635289,0.5178061532441002,0.9275869150870215,0.5,COMPLETE
2493,0.7156549520766773,2025-11-30 14:54:34.331649,2025-11-30 14:55:52.428461,0 days 00:01:18.096812,0.003256268043439599,dart,0.7833526974536131,9.929139266802137,depthwise,0.18810704495509045,0.014443262795448381,2,12,50.942270986816915,800,tree,0.7834943966425357,0.27231187832057574,0.028301190268891385,oversample,0.5241621770303986,,7.0,0.8272763693757204,0.11929180823543034,uniform,0.220519699481944,0.714010718878868,,0.5567616463138851,0.5572139303482587,0.715281812899477,0.7156549520766773,0.7834943966425357,0.27231187832057574,0.08,0.5567616463138851,0.5572139303482587,0.5567616463138851,0.5572139303482587,1.0,1.0,oversample,0.5,0.5,0.5241621770303986,0.5,COMPLETE
2494,0.31988041853512705,2025-11-30 14:55:53.221140,2025-11-30 14:55:53.679382,0 days 00:00:00.458242,0.21672565730020846,gbtree,0.7504307153326017,3.820706167561937,depthwise,5.168959802503888,0.010961998712774345,7,4,0.7135930856924931,300,,0.6360796388103982,0.7543086988408882,0.07342968643378493,undersample,0.767782484593228,,11.0,0.8681404289290925,,,,0.9018082292062439,,0.38489371325192223,0.38263229308005425,0.31931931931931934,0.31988041853512705,0.6360796388103982,0.7543086988408882,0.08,0.5063463545346263,0.5041815784718198,0.41590612777053454,0.41419354838709677,0.25913891145410234,0.26055194805194803,undersample,0.4618076393839421,0.4566219339904223,0.767782484593228,0.5,COMPLETE
2495,0.7156549520766773,2025-11-30 14:55:54.473723,2025-11-30 14:56:18.547029,0 days 00:00:24.073306,25.94125513969525,dart,0.27717491176043957,2.2788326504258194,lossguide,1.2945569293273371,0.01691134641033155,4,10,1.2354974022636065,500,forest,0.9230278185758503,0.34663003362379086,0.027420327178509854,undersample,0.5026125523689737,,5.0,0.9289194044365272,0.3188375342642696,weighted,0.10363519719749271,0.5187986317390927,,0.5567616463138851,0.5572139303482587,0.715281812899477,0.7156549520766773,0.9230278185758503,0.34663003362379086,0.08,0.5567616463138851,0.5572139303482587,0.5567616463138851,0.5572139303482587,1.0,1.0,undersample,0.5,0.5,0.5026125523689737,0.5,COMPLETE
2496,0.7156549520766773,2025-11-30 14:56:19.328226,2025-11-30 14:58:01.254950,0 days 00:01:41.926724,0.0003253888623030652,dart,0.20498994477979046,1.621811791126887,depthwise,0.018029671462196875,0.0001348844062344652,2,8,33.19336109248322,900,tree,0.6024052036801106,0.24573029465407245,0.09049104342667519,none,0.6227318036593544,4.091563456100636,7.0,0.8206874999364973,0.11035765149600957,weighted,0.12811202850746894,0.9449673751487788,,0.5567616463138851,0.5572139303482587,0.715281812899477,0.7156549520766773,0.6024052036801106,0.24573029465407245,0.1,0.5113127684659667,0.4943373655443839,0.5567616463138851,0.5572139303482587,1.0,1.0,none,0.4129494852368242,0.38798535478821483,0.6227318036593544,0.5,COMPLETE
2497,0.4808743169398907,2025-11-30 14:58:02.036532,2025-11-30 14:58:45.928050,0 days 00:00:43.891518,0.12975642998677192,dart,0.9413390868720024,6.937766540804727,lossguide,0.0032573399180106564,0.013332055617916167,5,4,10.039103667054775,600,tree,0.8827979975379644,0.5460873082086499,0.07225851604760436,undersample,0.8507460316180723,,11.0,0.8373122433941321,0.4990066155847365,uniform,0.8063447591089687,0.47001108089763133,,0.4663048394391678,0.4414292175486205,0.5103734439834025,0.4808743169398907,0.8827979975379644,0.5460873082086499,0.08,0.5107046600393016,0.5017287448936141,0.5216284987277354,0.4986922406277245,0.49959382615759546,0.4642857142857143,undersample,0.44299350121852155,0.4229679602828224,0.8507460316180723,0.5,COMPLETE
2498,0.7156549520766773,2025-11-30 14:58:46.726964,2025-11-30 14:58:47.348258,0 days 00:00:00.621294,3.01496482856535,gbtree,0.5401191484814698,9.135837606096421,depthwise,28.697607882534957,0.35343354807979305,1,7,2.028747672348949,600,,0.6914600758589893,0.343174668601241,0.059983151068801026,none,0.7411217831877657,1.1147272815986746,8.0,0.672426242677303,,,,0.36163938457923406,,0.5567616463138851,0.5572139303482587,0.715281812899477,0.7156549520766773,0.6914600758589893,0.343174668601241,0.08,0.5264562177080571,0.5357122938746073,0.5567616463138851,0.5572139303482587,1.0,1.0,none,0.42882507999137914,0.4520875893769153,0.7411217831877657,0.5,COMPLETE
2499,0.7156549520766773,2025-11-30 14:58:48.145464,2025-11-30 14:58:48.817021,0 days 00:00:00.671557,0.0034901068269650526,gbtree,0.3159530353258248,9.742569982662092,depthwise,0.09982986956384265,0.003081320834738917,1,3,17.62174133723041,600,,0.9968510262011494,0.3804363155723246,0.09262833240031522,none,0.5488362866689382,2.446718474466015,7.0,0.7263010669206166,,,,0.7023634732220878,,0.5567616463138851,0.5572139303482587,0.715281812899477,0.7156549520766773,0.9968510262011494,0.3804363155723246,0.1,0.5061357697805923,0.5202555976825588,0.5567616463138851,0.5572139303482587,1.0,1.0,none,0.3788130605613488,0.41315391069604557,0.5488362866689382,0.5,COMPLETE
2500,0.7156549520766773,2025-11-30 14:58:49.595656,2025-11-30 14:58:50.271854,0 days 00:00:00.676198,0.0024901143603958576,gbtree,0.6007541079073062,9.34488981190804,depthwise,0.1988274392284582,0.003026378357004322,7,11,0.6926679302916392,700,,0.8951818063305723,0.41738408912278085,0.04703712173209859,none,0.8710017999073983,4.314718939156911,5.0,0.6416399781101152,,,,0.4777148032467284,,0.5567616463138851,0.5572139303482587,0.715281812899477,0.7156549520766773,0.8951818063305723,0.41738408912278085,0.08,0.4759417394114918,0.46894445587782646,0.5567616463138851,0.5572139303482587,1.0,1.0,none,0.32941817669391066,0.31756040818221615,0.8710017999073983,0.5,COMPLETE
2501,0.7156549520766773,2025-11-30 14:58:51.065208,2025-11-30 14:58:51.796813,0 days 00:00:00.731605,33.357534306433976,gbtree,0.7593330350975489,0.14894228579371616,lossguide,17.09057207609976,0.05110892392953738,0,7,3.1133823740795137,800,,0.7221803659903469,0.8632445869769503,0.02985307667580661,none,0.6603939332806468,0.8733128924349022,11.0,0.6844627491389329,,,,0.680847740948805,,0.5567616463138851,0.5572139303482587,0.715281812899477,0.7156549520766773,0.7221803659903469,0.8632445869769503,0.08,0.5824520135933582,0.5805496231093763,0.5567616463138851,0.5572139303482587,1.0,1.0,none,0.5557689119514581,0.5471177188490773,0.6603939332806468,0.5,COMPLETE
2502,0.4848732624693377,2025-11-30 14:58:52.581911,2025-11-30 14:59:10.991648,0 days 00:00:18.409737,3.95810446848064,dart,0.25558087360144005,1.0678139869347059,depthwise,0.0013667904389442185,0.010157025726190596,1,10,47.61901002454532,400,forest,0.680845008951432,0.4714246472182761,0.08258626758965937,undersample,0.6914094967275599,,5.0,0.88260611192214,0.25142450956403306,weighted,0.3707913378778383,0.4687738159585735,,0.42424242424242425,0.43012211668928085,0.4728778467908903,0.4848732624693377,0.680845008951432,0.4714246472182761,0.08,0.4435096408457824,0.44775483137192734,0.4822635135135135,0.48846787479406917,0.46385052802599513,0.48133116883116883,undersample,0.34303080289792603,0.3470809068357587,0.6914094967275599,0.5,COMPLETE
2503,0.7156549520766773,2025-11-30 14:59:11.777961,2025-11-30 15:00:19.380618,0 days 00:01:07.602657,5.383357692842596,dart,0.942993953480572,9.19856606772504,depthwise,0.033546691165619265,0.07111262352167982,3,11,87.99335660542013,800,tree,0.6205889545064569,0.6519986311299011,0.07111479927298656,none,0.7011186462538117,2.3687487939253216,9.0,0.7330277210980393,0.4814978432002441,weighted,0.036854766731313174,0.4368159725068016,,0.5567616463138851,0.5572139303482587,0.715281812899477,0.7156549520766773,0.6205889545064569,0.6519986311299011,0.08,0.4130802115945648,0.4115923093651902,0.5567616463138851,0.5572139303482587,1.0,1.0,none,0.23666257729736898,0.22912327713144873,0.7011186462538117,0.5,COMPLETE
2504,0.7156549520766773,2025-11-30 15:00:20.180287,2025-11-30 15:02:23.057471,0 days 00:02:02.877184,47.5562834123277,dart,0.6163020664203971,5.490451162537972,depthwise,9.787531107194122,0.0001719816022826443,2,6,65.80202624250295,1000,forest,0.8239565205742045,0.3579013384442401,0.058030254480633196,undersample,0.6214659632947317,,6.0,0.8648237527385161,0.43411439689766157,weighted,0.7938190307027242,0.8998960015996424,,0.5567616463138851,0.5572139303482587,0.715281812899477,0.7156549520766773,0.8239565205742045,0.3579013384442401,0.08,0.5567616463138851,0.5572139303482587,0.5567616463138851,0.5572139303482587,1.0,1.0,undersample,0.5,0.5,0.6214659632947317,0.5,COMPLETE
2505,0.5602636534839924,2025-11-30 15:02:23.824848,2025-11-30 15:02:24.721980,0 days 00:00:00.897132,0.003828569348587167,gbtree,0.5992187051360196,2.2834384466140625,lossguide,0.2847662742272449,0.011445457834932692,3,8,6.505739182565335,800,,0.5052940127224297,0.3394525914668397,0.08987199326625099,undersample,0.5930207070287016,,7.0,0.8923726226537428,,,,0.43956791111204113,,0.5649027589326097,0.5775667118950701,0.5366088631984586,0.5602636534839924,0.5052940127224297,0.3394525914668397,0.08,0.6311810732746863,0.6515310242521156,0.659171597633136,0.6670403587443946,0.4524776604386678,0.48295454545454547,undersample,0.6050423581292793,0.6262328708064152,0.5930207070287016,0.5,COMPLETE
2506,0.3168056164984642,2025-11-30 15:02:25.512543,2025-11-30 15:02:25.996486,0 days 00:00:00.483943,0.00208700654888972,gbtree,0.9583567903110206,4.198664715988444,depthwise,0.0093812506636153,0.00018509457272357276,2,11,42.4477706381009,400,,0.9718216403923008,0.3168744485193332,0.023671486952286814,undersample,0.5455158941612537,,8.0,0.8504982758089294,,,,0.6755258967837428,,0.3179556761646314,0.29579375848032563,0.3488773747841105,0.3168056164984642,0.9718216403923008,0.3168744485193332,0.08,0.43741258084129686,0.43529252265618257,0.3723502304147465,0.3447946513849093,0.3281884646628757,0.2930194805194805,undersample,0.28108307498466484,0.2744538722258334,0.5455158941612537,0.5,COMPLETE
2507,0.7156549520766773,2025-11-30 15:02:26.779092,2025-11-30 15:02:27.224218,0 days 00:00:00.445126,3.5605881121455383,gbtree,0.7130965361713957,4.323695757512357,depthwise,7.3414748530548914,0.0027572115867207938,3,12,6.674435896275264,300,,0.6604095368820406,0.502625229650346,0.0450364762098092,oversample,0.8054676419845654,,5.0,0.8026858983909708,,,,0.23739096928926165,,0.5567616463138851,0.5572139303482587,0.715281812899477,0.7156549520766773,0.6604095368820406,0.502625229650346,0.08,0.4741351975806535,0.4737926884847241,0.5567616463138851,0.5572139303482587,1.0,1.0,oversample,0.36769840348812155,0.37214706896780436,0.8054676419845654,0.5,COMPLETE
2508,0.7156549520766773,2025-11-30 15:02:28.017339,2025-11-30 15:02:38.469825,0 days 00:00:10.452486,31.884762603194066,dart,0.37695056378180036,8.222152000159777,depthwise,1.298842941253077,0.00024503232470534205,9,10,14.741950175464606,300,forest,0.9619802040342107,0.5620028263688825,0.06196381804634469,undersample,0.5690283487012032,,12.0,0.6043666169783434,0.2944260008025376,uniform,0.46138792274469065,0.7693421144001535,,0.5567616463138851,0.5572139303482587,0.715281812899477,0.7156549520766773,0.9619802040342107,0.5620028263688825,0.08,0.5567616463138851,0.5572139303482587,0.5567616463138851,0.5572139303482587,1.0,1.0,undersample,0.5,0.5,0.5690283487012032,0.5,COMPLETE
2509,0.49913344887348354,2025-11-30 15:02:39.245466,2025-11-30 15:03:56.962567,0 days 00:01:17.717101,0.3267500951693799,dart,0.7797423437612931,0.3019949099865471,depthwise,0.04898129534961684,0.34007567612232814,1,4,0.1279770867628938,300,tree,0.7970782506838305,0.8337558834588485,0.008130241162434704,undersample,0.7498379981299297,,12.0,0.74942470032205,0.42174047755881083,uniform,0.8486183548601628,0.3412880607532454,,0.472636815920398,0.47715965626413387,0.4930434782608696,0.49913344887348354,0.7970782506838305,0.8337558834588485,0.08,0.5313695105458134,0.5328160317983337,0.5304022450888681,0.5353159851301115,0.4606011372867587,0.4675324675324675,undersample,0.4663667335333809,0.47900139951978565,0.7498379981299297,0.5,COMPLETE
2510,0.7156549520766773,2025-11-30 15:03:57.735053,2025-11-30 15:03:58.092080,0 days 00:00:00.357027,0.00033502548810814816,gbtree,0.7784162203156515,4.720196754114184,depthwise,0.005594471430002347,0.23507047777349016,8,11,67.47778375062157,200,,0.5334600173678326,0.7782515015082758,0.03382780848820647,none,0.5554948329364882,2.8746218579463383,11.0,0.6300694271318683,,,,0.9034678589586262,,0.5567616463138851,0.5572139303482587,0.715281812899477,0.7156549520766773,0.5334600173678326,0.7782515015082758,0.08,0.48000145966855806,0.48435795725013264,0.5567616463138851,0.5572139303482587,1.0,1.0,none,0.39479765911238573,0.40408190507143527,0.5554948329364882,0.5,COMPLETE
