number,value,datetime_start,datetime_complete,duration,params_alpha,params_booster,params_colsample_bytree,params_gamma,params_grow_policy,params_lambda,params_learning_rate,params_max_delta_step,params_max_depth,params_min_child_weight,params_n_estimators,params_normalize_type,params_params_feature_fraction,params_params_labeled_ratio,params_params_missing_rate,params_params_resampling,params_params_sample_rows,params_params_scale_pos_weight,params_params_selftrain_max_iter,params_params_selftrain_threshold,params_rate_drop,params_sample_type,params_skip_drop,params_subsample,params_user_attrs_decision_threshold,user_attrs_acc_test,user_attrs_acc_val,user_attrs_f1_test,user_attrs_f1_val,user_attrs_feature_fraction,user_attrs_labeled_ratio,user_attrs_missing_rate,user_attrs_pr_auc_test,user_attrs_pr_auc_val,user_attrs_prec_test,user_attrs_prec_val,user_attrs_rec_test,user_attrs_rec_val,user_attrs_resampling_strategy,user_attrs_roc_auc_test,user_attrs_roc_auc_val,user_attrs_sample_rows,user_attrs_user_attrs_decision_threshold,state
232,0.7156549520766773,2025-11-26 17:53:33.124129,2025-11-26 17:53:33.747526,0 days 00:00:00.623397,0.14060989845581676,gbtree,0.8706050611896704,2.9679918242396663,lossguide,1.7241458898334585,0.021155135317313674,2,4,0.22995596842020236,400,,0.6068405324055127,0.3007970209411288,0.06401266427043759,oversample,0.8368002257825125,,6.0,0.6587256178960923,,,,0.946241340070524,0.06286393314324429,0.5567616463138851,0.5572139303482587,0.715281812899477,0.7156549520766773,0.6068405324055127,0.3007970209411288,0.05,0.7206065998972184,0.7257109122682811,0.5567616463138851,0.5572139303482587,1.0,1.0,oversample,0.6848820438004609,0.6814239450539246,0.8368002257825125,0.06286393314324429,COMPLETE
233,0.7156549520766773,2025-11-26 17:53:33.906457,2025-11-26 17:53:34.380937,0 days 00:00:00.474480,36.62893976400218,gbtree,0.7372571669981584,7.080930553831591,lossguide,0.5109043369008485,0.0025433543540654808,1,3,3.893572074991338,200,,0.6875578045782955,0.3984917562239184,0.08490363904270419,undersample,0.9349073527022875,,12.0,0.7857242598252475,,,,0.33172286036267085,0.3585617944802256,0.5567616463138851,0.5572139303482587,0.715281812899477,0.7156549520766773,0.6875578045782955,0.3984917562239184,0.08,0.5567616463138851,0.5572139303482587,0.5567616463138851,0.5572139303482587,1.0,1.0,undersample,0.5,0.5,0.9349073527022875,0.3585617944802256,COMPLETE
234,0.0,2025-11-26 17:53:34.541491,2025-11-26 17:53:35.073209,0 days 00:00:00.531718,0.5740490053737081,gbtree,0.3833273098129292,7.794320289243928,lossguide,0.1879885614730122,0.007298591912410253,4,8,0.5004253710171777,300,,0.6920199115850276,0.5769558137235349,0.0530144428554501,undersample,0.9195352952887476,,12.0,0.7698552156006488,,,,0.4866586059422664,0.612176333769595,0.44323835368611486,0.4427860696517413,0.0,0.0,0.6920199115850276,0.5769558137235349,0.05,0.6326977421807893,0.6115867052288052,0.0,0.0,0.0,0.0,undersample,0.5912879855435269,0.5677622938858894,0.9195352952887476,0.612176333769595,COMPLETE
235,0.7156549520766773,2025-11-26 17:53:35.232170,2025-11-26 17:53:35.993467,0 days 00:00:00.761297,1.6431698386518916,gbtree,0.8941034614552681,8.854019407579074,lossguide,3.1772275064240603,0.001997984861598378,4,7,1.9891376495365414,700,,0.6586408371186457,0.481337848788828,0.07446430681168245,none,0.8368718838672965,0.660351673713828,9.0,0.8211206560928357,,,,0.3863622493698564,0.34003230039688465,0.5567616463138851,0.5572139303482587,0.715281812899477,0.7156549520766773,0.6586408371186457,0.481337848788828,0.08,0.7010913671250867,0.7020119161977871,0.5567616463138851,0.5572139303482587,1.0,1.0,none,0.692396259884945,0.6894923258559622,0.8368718838672965,0.34003230039688465,COMPLETE
236,0.0,2025-11-26 17:53:36.153707,2025-11-26 17:53:36.676834,0 days 00:00:00.523127,65.52258169372996,gbtree,0.5876973240145826,9.609655328854672,lossguide,0.2650888069084352,0.002639261101915217,3,8,2.260292543850663,300,,0.8932294220292485,0.5183901661020498,0.06597940222436878,undersample,0.9137561682018,,5.0,0.8046345925857116,,,,0.373414125654301,0.6458919877988865,0.44323835368611486,0.4427860696517413,0.0,0.0,0.8932294220292485,0.5183901661020498,0.08,0.5567616463138851,0.5572139303482587,0.0,0.0,0.0,0.0,undersample,0.5,0.5,0.9137561682018,0.6458919877988865,COMPLETE
237,0.7156549520766773,2025-11-26 17:53:36.837151,2025-11-26 17:55:03.112077,0 days 00:01:26.274926,0.6622218707665303,dart,0.9836727638652095,3.463740690748462,lossguide,0.0007911801123694355,0.03309579468596769,8,9,27.132489103549656,900,tree,0.7791200779893362,0.6259970893052609,0.08046749778198353,oversample,0.9562063137405913,,12.0,0.9466001363265103,0.4777424486020665,weighted,0.3245181411465072,0.8070095296276661,0.41135928073331535,0.5567616463138851,0.5572139303482587,0.715281812899477,0.7156549520766773,0.7791200779893362,0.6259970893052609,0.08,0.4344420312745977,0.42401135752669056,0.5567616463138851,0.5572139303482587,1.0,1.0,oversample,0.3224813077139873,0.29517638260615786,0.9562063137405913,0.41135928073331535,COMPLETE
238,0.7156549520766773,2025-11-26 17:55:03.278230,2025-11-26 17:55:04.369674,0 days 00:00:01.091444,0.0008337291594793265,gbtree,0.9736309724644953,0.36668680403218823,lossguide,47.266594307235124,0.0004821764100845517,1,3,0.17793863635967844,600,,0.570744304535958,0.549628376247647,0.07555393771232122,oversample,0.9080615731939818,,6.0,0.7857841836863323,,,,0.9042248454393883,0.1956593650576712,0.5567616463138851,0.5572139303482587,0.715281812899477,0.7156549520766773,0.570744304535958,0.549628376247647,0.08,0.6825957570192855,0.641673002049953,0.5567616463138851,0.5572139303482587,1.0,1.0,oversample,0.6397594456141514,0.5919661926429035,0.9080615731939818,0.1956593650576712,COMPLETE
239,0.0,2025-11-26 17:55:04.536099,2025-11-26 17:55:32.844892,0 days 00:00:28.308793,84.81417011423513,dart,0.9827112266431868,4.87323531123315,depthwise,11.553834761071021,0.03303634375826503,10,8,7.280357701942391,500,tree,0.6664099208034892,0.16868320295714861,0.06390000777672533,undersample,0.9447085416575379,,7.0,0.9128298709983214,0.22880974457254313,weighted,0.26627584941746546,0.6274383368460075,0.613800616990356,0.44323835368611486,0.4427860696517413,0.0,0.0,0.6664099208034892,0.16868320295714861,0.05,0.5567616463138851,0.5572139303482587,0.0,0.0,0.0,0.0,undersample,0.5,0.5,0.9447085416575379,0.613800616990356,COMPLETE
240,0.051798561151079135,2025-11-26 17:55:33.023908,2025-11-26 17:55:34.028245,0 days 00:00:01.004337,0.10631935857510941,gbtree,0.9840051777995604,0.39529754864726924,depthwise,0.3301374819212874,0.0036683961275524044,3,3,0.18546696232315454,600,,0.9849052941246528,0.22285729352001754,0.0650443770428948,undersample,0.9250375270108059,,5.0,0.7243244910727623,,,,0.4358837207494247,0.575094272385565,0.41112618724559025,0.40388964269561284,0.0673352435530086,0.051798561151079135,0.9849052941246528,0.22285729352001754,0.08,0.4884404156633596,0.4715240481153549,0.28484848484848485,0.22784810126582278,0.038180341186027617,0.02922077922077922,undersample,0.4312505180788806,0.40457314646538345,0.9250375270108059,0.575094272385565,COMPLETE
241,0.0,2025-11-26 17:55:34.192581,2025-11-26 17:55:34.827640,0 days 00:00:00.635059,0.08681113083423016,gbtree,0.6921966707513528,7.802588383965719,lossguide,0.1719564204263292,0.0015703362782816814,6,6,0.44872609257016527,400,,0.821705451050026,0.41440373313386303,0.0970705116721854,undersample,0.8444797293447458,,8.0,0.7448166715109105,,,,0.38164746468781235,0.8595216978421463,0.44323835368611486,0.4427860696517413,0.0,0.0,0.821705451050026,0.41440373313386303,0.1,0.4596486813201593,0.4628642909653674,0.0,0.0,0.0,0.0,undersample,0.37583555761866083,0.38040531353222873,0.8444797293447458,0.8595216978421463,COMPLETE
242,0.7156549520766773,2025-11-26 17:55:34.995334,2025-11-26 17:55:35.805005,0 days 00:00:00.809671,20.392033711203077,gbtree,0.3752946557478263,1.5793688250977969,depthwise,0.00030985684536348446,0.040042985202086705,3,8,1.044085757465733,700,,0.6199491149969132,0.30572197803882395,0.01881775734282865,none,0.8528817895507448,1.791374863321679,7.0,0.8602594402736158,,,,0.9904543563202486,0.6271343811405258,0.5567616463138851,0.5572139303482587,0.715281812899477,0.7156549520766773,0.6199491149969132,0.30572197803882395,0.02,0.5459130623278415,0.546587049107217,0.5567616463138851,0.5572139303482587,1.0,1.0,none,0.4684162535851058,0.47942755661090697,0.8528817895507448,0.6271343811405258,COMPLETE
243,0.7156549520766773,2025-11-26 17:55:35.978436,2025-11-26 17:55:36.717900,0 days 00:00:00.739464,18.50139350177894,gbtree,0.6309943604384325,8.51229852109919,lossguide,0.152612594662916,0.003834672389006981,5,8,0.6561576208815154,600,,0.7387030073761596,0.18650112605952157,0.07622735687542384,undersample,0.8513490707918892,,9.0,0.7950779587852975,,,,0.6180666420095179,0.3891661694092434,0.5567616463138851,0.5572139303482587,0.715281812899477,0.7156549520766773,0.7387030073761596,0.18650112605952157,0.08,0.5567616463138851,0.5572139303482587,0.5567616463138851,0.5572139303482587,1.0,1.0,undersample,0.5,0.5,0.8513490707918892,0.3891661694092434,COMPLETE
244,0.7156549520766773,2025-11-26 17:55:36.889981,2025-11-26 17:55:37.489381,0 days 00:00:00.599400,0.5169860771242711,gbtree,0.6296432524319786,9.43667267023472,depthwise,1.2423814797294177,0.0029988388553004834,2,9,0.5956929630988812,400,,0.7564051696721961,0.6430311787065814,0.08547479582148576,undersample,0.7203591948394606,,10.0,0.7906494063672893,,,,0.43293637419959435,0.2088737981000775,0.5567616463138851,0.5572139303482587,0.715281812899477,0.7156549520766773,0.7564051696721961,0.6430311787065814,0.08,0.6352953163458783,0.6190103138252503,0.5567616463138851,0.5572139303482587,1.0,1.0,undersample,0.6270644407234868,0.5883355663743816,0.7203591948394606,0.2088737981000775,COMPLETE
245,0.0,2025-11-26 17:55:37.660088,2025-11-26 17:55:38.352846,0 days 00:00:00.692758,2.725377348512404,gbtree,0.25001708068281664,1.4247906680227216,depthwise,0.00020388206225653902,0.07734236540946417,1,4,0.15778291358427224,500,,0.7627265303827315,0.47319263959987523,0.021523688980212338,undersample,0.8781628359025031,,7.0,0.8542930720594889,,,,0.9685412729381698,0.5943333129116434,0.44323835368611486,0.44097693351424694,0.0,0.0,0.7627265303827315,0.47319263959987523,0.02,0.47714498067325395,0.47166425459244793,0.0,0.0,0.0,0.0,undersample,0.36785548500472487,0.35596968149317487,0.8781628359025031,0.5943333129116434,COMPLETE
246,0.39507186858316223,2025-11-26 17:55:38.547880,2025-11-26 18:00:24.563847,0 days 00:04:46.015967,0.008935557670788335,dart,0.8433926256554066,1.0518144594800658,lossguide,3.339815920423359,0.10363149029950622,2,9,15.63211718861131,700,tree,0.9496383797335466,0.06818752481283569,0.05284605414701863,undersample,0.7257446173224812,,8.0,0.6288960788945201,0.0989403434763233,uniform,0.5172805101599343,0.8656984360411548,0.30236195704588853,0.34599728629579374,0.3337856173677069,0.4097959183673469,0.39507186858316223,0.9496383797335466,0.06818752481283569,0.05,0.41215465723896716,0.40939371749640796,0.4118129614438064,0.399833748960931,0.40779853777416736,0.39042207792207795,undersample,0.26169863558746004,0.2532906955149039,0.7257446173224812,0.30236195704588853,COMPLETE
247,0.0,2025-11-26 18:00:24.739158,2025-11-26 18:00:25.247858,0 days 00:00:00.508700,1.0547225286661224,gbtree,0.4862891631010024,5.891320274407327,depthwise,0.0012092411125844524,0.041137631245029255,0,8,0.29417384182419903,200,,0.7630706503074269,0.5716170915763036,0.027770880865332227,none,0.9527188411267118,1.9557578551498598,8.0,0.8618103107962602,,,,0.8530246303144985,0.8234259400051327,0.44323835368611486,0.4427860696517413,0.0,0.0,0.7630706503074269,0.5716170915763036,0.02,0.44458721432774484,0.44282708320553166,0.0,0.0,0.0,0.0,none,0.26467862530877495,0.25528136317206795,0.9527188411267118,0.8234259400051327,COMPLETE
248,0.0,2025-11-26 18:00:25.429246,2025-11-26 18:00:26.113456,0 days 00:00:00.684210,10.917182659491136,gbtree,0.8378620613520729,9.798679746015477,lossguide,3.1387486188839517,0.00033720350411744603,1,7,0.3401436399629146,500,,0.6447108948238248,0.28935345192341033,0.030084385363658032,undersample,0.8993897353225013,,8.0,0.7257336039097201,,,,0.38096337410601094,0.6035794103798109,0.44323835368611486,0.4427860696517413,0.0,0.0,0.6447108948238248,0.28935345192341033,0.02,0.4885020350545127,0.49265287661876145,0.0,0.0,0.0,0.0,undersample,0.3109227606558464,0.3275937545600467,0.8993897353225013,0.6035794103798109,COMPLETE
249,0.7156549520766773,2025-11-26 18:00:26.296220,2025-11-26 18:00:45.252648,0 days 00:00:18.956428,2.4443532092595475,dart,0.2924098143124254,1.926983906044005,lossguide,8.398161185937496,0.042121272805979194,9,11,0.6456961062337228,400,forest,0.5504056448720164,0.5410918588869227,0.02312746389884386,undersample,0.6969648951029064,,12.0,0.7361040823805516,0.23008296432792685,uniform,0.4043174727181307,0.8401714035260616,0.1193640699561092,0.5567616463138851,0.5572139303482587,0.715281812899477,0.7156549520766773,0.5504056448720164,0.5410918588869227,0.02,0.3859986677915835,0.3826162888130179,0.5567616463138851,0.5572139303482587,1.0,1.0,undersample,0.17127646346922198,0.159747141265272,0.6969648951029064,0.1193640699561092,COMPLETE
250,0.7156549520766773,2025-11-26 18:00:45.422365,2025-11-26 18:01:15.017362,0 days 00:00:29.594997,92.14010337437625,dart,0.30724968813004455,4.808044778406348,lossguide,0.4611653712939611,0.0001529923324066922,0,8,13.819074357732214,500,tree,0.9913406264587548,0.22267583275053246,0.06198060869512018,none,0.7882611309363614,1.36403048869462,6.0,0.7511435841488078,0.21087925850508224,weighted,0.4799510624115915,0.658142431891816,0.2028582895359946,0.5567616463138851,0.5572139303482587,0.715281812899477,0.7156549520766773,0.9913406264587548,0.22267583275053246,0.05,0.5567616463138851,0.5572139303482587,0.5567616463138851,0.5572139303482587,1.0,1.0,none,0.5,0.5,0.7882611309363614,0.2028582895359946,COMPLETE
251,0.0,2025-11-26 18:01:15.187789,2025-11-26 18:01:16.304799,0 days 00:00:01.117010,0.0018756986552602986,gbtree,0.4946641372157559,3.9603579679956837,depthwise,0.00023423584713547425,0.00047373258989335745,6,11,2.1278198986096384,1000,,0.5328917127547163,0.4714235740303613,0.017530397413472162,oversample,0.8886249857422139,,5.0,0.6202925138723157,,,,0.7356384743407874,0.6035661053090877,0.44323835368611486,0.4427860696517413,0.0,0.0,0.5328917127547163,0.4714235740303613,0.02,0.5332236690899363,0.54302813814995,0.0,0.0,0.0,0.0,oversample,0.493366932475671,0.5203382228088561,0.8886249857422139,0.6035661053090877,COMPLETE
252,0.7156549520766773,2025-11-26 18:01:16.479023,2025-11-26 18:01:17.700632,0 days 00:00:01.221609,0.010633000729794544,gbtree,0.8356015895963126,0.2527617503717511,lossguide,15.20000498961658,0.004252758267721436,5,7,0.5274248822829906,300,,0.8800695296940108,0.09463620034313648,0.033774444145870094,undersample,0.9638675425838841,,8.0,0.6944123087271609,,,,0.6456244428904059,0.23964270049879619,0.5567616463138851,0.5572139303482587,0.715281812899477,0.7156549520766773,0.8800695296940108,0.09463620034313648,0.02,0.5736867315598583,0.5544357410172598,0.5567616463138851,0.5572139303482587,1.0,1.0,undersample,0.5106015517498632,0.46858583831898437,0.9638675425838841,0.23964270049879619,COMPLETE
253,0.7156549520766773,2025-11-26 18:01:17.872719,2025-11-26 18:01:23.103205,0 days 00:00:05.230486,4.009624399767548,dart,0.22500356755020282,3.6414189113135755,lossguide,1.327608014536766,0.22312664938697713,10,3,1.831506385896114,200,forest,0.5577121116493594,0.6632467389898435,0.03647925821083041,oversample,0.6128247918488196,,12.0,0.8315727637111986,0.1104255473559272,weighted,0.0724306839392627,0.9683541954574136,0.04549983091882108,0.5567616463138851,0.5572139303482587,0.715281812899477,0.7156549520766773,0.5577121116493594,0.6632467389898435,0.05,0.44803980702226825,0.4475307236530463,0.5567616463138851,0.5572139303482587,1.0,1.0,oversample,0.28149961040468174,0.2751233699905814,0.6128247918488196,0.04549983091882108,COMPLETE
254,0.7156549520766773,2025-11-26 18:01:23.280517,2025-11-26 18:01:50.661631,0 days 00:00:27.381114,6.351418154714947,dart,0.3340244013165501,3.2824029176035974,depthwise,57.635764383319014,0.0010479490635168923,1,6,46.71015648096039,500,forest,0.5618016847123326,0.5614805653503241,0.0913699764053632,oversample,0.8984609528347156,,12.0,0.8666324088946279,0.29451985484202753,weighted,0.4530880824660275,0.44253682510778,0.22166578477385754,0.5567616463138851,0.5572139303482587,0.715281812899477,0.7156549520766773,0.5618016847123326,0.5614805653503241,0.1,0.48877654551023325,0.519804570684262,0.5567616463138851,0.5572139303482587,1.0,1.0,oversample,0.3915163547141034,0.42155185850921295,0.8984609528347156,0.22166578477385754,COMPLETE
255,0.7156549520766773,2025-11-26 18:01:50.836604,2025-11-26 18:02:09.999442,0 days 00:00:19.162838,5.570251991584794,dart,0.4096891800512281,7.936233775733633,lossguide,0.005574547891166694,0.0009516016159143831,0,4,0.25217115463327705,400,forest,0.5949412379212978,0.2205710468624574,0.0866208176532803,oversample,0.9916882950735852,,12.0,0.6086965720686728,0.36782595610653934,uniform,0.6593835807022209,0.5503061482185357,0.1358964169254868,0.5567616463138851,0.5572139303482587,0.715281812899477,0.7156549520766773,0.5949412379212978,0.2205710468624574,0.08,0.5748068423293515,0.5720118421668701,0.5567616463138851,0.5572139303482587,1.0,1.0,oversample,0.534238382599181,0.5283133299284984,0.9916882950735852,0.1358964169254868,COMPLETE
256,0.7156549520766773,2025-11-26 18:02:10.168536,2025-11-26 18:02:10.985808,0 days 00:00:00.817272,1.201088718084891,gbtree,0.24519077580877183,4.649032294978739,lossguide,0.2750048429187287,0.054608573171389924,9,12,0.45846891285558683,700,,0.6977021929081513,0.8182053720085117,0.011589819900210407,oversample,0.6506999036602676,,12.0,0.8063193617232142,,,,0.8413126541356802,0.4758066416321005,0.5567616463138851,0.5572139303482587,0.715281812899477,0.7156549520766773,0.6977021929081513,0.8182053720085117,0.02,0.435344437175177,0.42459626898364844,0.5567616463138851,0.5572139303482587,1.0,1.0,oversample,0.2902120393242594,0.2675408414363981,0.6506999036602676,0.4758066416321005,COMPLETE
257,0.7156549520766773,2025-11-26 18:02:11.159467,2025-11-26 18:02:13.169092,0 days 00:00:02.009625,0.001344174872605334,gbtree,0.6709637375613314,2.687051238518932,lossguide,0.0007504341247377884,0.0016610507744726783,6,8,0.9330982593625474,1000,,0.616990739060221,0.5800427257109628,0.009230478628135273,oversample,0.9700635787119123,,7.0,0.6737644260947635,,,,0.500062460233196,0.3500977281207715,0.5567616463138851,0.5572139303482587,0.715281812899477,0.7156549520766773,0.616990739060221,0.5800427257109628,0.0,0.552062103998954,0.5469143168894095,0.5567616463138851,0.5572139303482587,1.0,1.0,oversample,0.5142865432119232,0.5125670741413847,0.9700635787119123,0.3500977281207715,COMPLETE
258,0.7156549520766773,2025-11-26 18:02:13.337761,2025-11-26 18:02:14.329390,0 days 00:00:00.991629,6.653464982781138,gbtree,0.3719477895551731,1.3058992426429967,depthwise,0.0002801411588466596,0.22354406414121222,2,7,0.7160096854012132,200,,0.6927338609665572,0.16746675914072195,0.011749821669094678,none,0.8606863971383413,2.999617402762175,6.0,0.8571326035088981,,,,0.6909814360138341,0.6914759793556526,0.5567616463138851,0.5572139303482587,0.715281812899477,0.7156549520766773,0.6927338609665572,0.16746675914072195,0.02,0.5957860743762853,0.5933696930156237,0.5567616463138851,0.5572139303482587,1.0,1.0,none,0.5522244234818217,0.5494205424299908,0.8606863971383413,0.6914759793556526,COMPLETE
259,0.7156549520766773,2025-11-26 18:02:14.498921,2025-11-26 18:02:15.087981,0 days 00:00:00.589060,11.06926969698091,gbtree,0.3123999895935583,7.80464684114855,lossguide,0.029602422720285543,0.0037789234145682226,5,11,0.18096508664014868,400,,0.8740143089456478,0.8163996014970897,0.0669837787563205,oversample,0.5266674941999662,,9.0,0.7228447741022754,,,,0.823036904514344,0.12077083723538379,0.5567616463138851,0.5572139303482587,0.715281812899477,0.7156549520766773,0.8740143089456478,0.8163996014970897,0.08,0.6351647067351647,0.6355777977636391,0.5567616463138851,0.5572139303482587,1.0,1.0,oversample,0.6323587924202989,0.632633518167226,0.5266674941999662,0.12077083723538379,COMPLETE
260,0.7156549520766773,2025-11-26 18:02:15.260751,2025-11-26 18:04:58.037631,0 days 00:02:42.776880,0.0014789784119497475,dart,0.8224084709751281,4.529673917690842,depthwise,0.002835620144848727,0.0001055795923576786,2,11,3.9071350232031845,1000,tree,0.5152345554496318,0.23558152008944272,0.0917922205486339,none,0.8883684046505691,1.9991539315738782,6.0,0.7034891979218069,0.3812356424584169,weighted,0.17823497724344167,0.5657149705594979,0.5417414178182716,0.5567616463138851,0.5572139303482587,0.715281812899477,0.7156549520766773,0.5152345554496318,0.23558152008944272,0.1,0.7172868187416657,0.7059914326125828,0.5567616463138851,0.5572139303482587,1.0,1.0,none,0.7434469238548385,0.7290913568045846,0.8883684046505691,0.5417414178182716,COMPLETE
261,0.7156549520766773,2025-11-26 18:04:58.216913,2025-11-26 18:06:02.696099,0 days 00:01:04.479186,22.78881802822627,dart,0.20734888075696448,1.358866675101273,lossguide,0.29971922980100096,0.031219576166123284,7,10,1.0379007843415031,800,forest,0.7337721573586754,0.8479628219463518,0.04985847311592409,undersample,0.9043464743733491,,10.0,0.6744751613910205,0.26649311058338415,weighted,0.029581945389365358,0.9926589651700538,0.07567644086606584,0.5567616463138851,0.5572139303482587,0.715281812899477,0.7156549520766773,0.7337721573586754,0.8479628219463518,0.05,0.4961873442652594,0.49053079216917367,0.5567616463138851,0.5572139303482587,1.0,1.0,undersample,0.4374529584376399,0.42524839817996096,0.9043464743733491,0.07567644086606584,COMPLETE
