number,value,datetime_start,datetime_complete,duration,params_alpha,params_booster,params_colsample_bytree,params_gamma,params_grow_policy,params_lambda,params_learning_rate,params_max_delta_step,params_max_depth,params_min_child_weight,params_n_estimators,params_normalize_type,params_params_feature_fraction,params_params_labeled_ratio,params_params_missing_rate,params_params_resampling,params_params_sample_rows,params_params_scale_pos_weight,params_params_selftrain_max_iter,params_params_selftrain_threshold,params_rate_drop,params_sample_type,params_skip_drop,params_subsample,params_user_attrs_decision_threshold,user_attrs_acc_test,user_attrs_acc_val,user_attrs_f1_test,user_attrs_f1_val,user_attrs_feature_fraction,user_attrs_labeled_ratio,user_attrs_missing_rate,user_attrs_pr_auc_test,user_attrs_pr_auc_val,user_attrs_prec_test,user_attrs_prec_val,user_attrs_rec_test,user_attrs_rec_val,user_attrs_resampling_strategy,user_attrs_roc_auc_test,user_attrs_roc_auc_val,user_attrs_sample_rows,user_attrs_user_attrs_decision_threshold,state
1529,0.7156549520766773,2025-11-27 07:07:03.031885,2025-11-27 07:08:00.531913,0 days 00:00:57.500028,0.04969652373151715,dart,0.7337374436923516,1.001028028738713,lossguide,0.7161077872986051,0.00970573743502936,10,12,43.18732565022341,700,tree,0.7819287202963648,0.08872292233761805,0.07158849032438598,oversample,0.6271573714495722,,7.0,0.6588819815825047,0.4120865699508863,weighted,0.8344392345605909,0.7218611869921403,0.04247002627516955,0.5567616463138851,0.5572139303482587,0.715281812899477,0.7156549520766773,0.7819287202963648,0.08872292233761805,0.08,0.5567616463138851,0.5572139303482587,0.5567616463138851,0.5572139303482587,1.0,1.0,oversample,0.5,0.5,0.6271573714495722,0.04247002627516955,COMPLETE
1530,0.7237859573151871,2025-11-27 07:08:00.709118,2025-11-27 07:08:01.596186,0 days 00:00:00.887068,0.5662553904096057,gbtree,0.5365885538314373,3.436039192272881,lossguide,0.4411459791158662,0.02707037765741577,10,6,3.8725174013499597,500,,0.9256890098624663,0.6515218829295985,0.023279207255493588,oversample,0.7197496320563617,,6.0,0.7420019180235131,,,,0.3548875196262627,0.48012866974430757,0.6001809136137495,0.5961103573043871,0.7235772357723578,0.7237859573151871,0.9256890098624663,0.6515218829295985,0.02,0.6188414861427212,0.6191205238019114,0.5882053889171327,0.5847076461769115,0.9398862713241267,0.9496753246753247,oversample,0.6034429450090353,0.6010008887945558,0.7197496320563617,0.48012866974430757,COMPLETE
1531,0.7149084568439407,2025-11-27 07:08:01.774193,2025-11-27 07:08:02.716235,0 days 00:00:00.942042,0.32410076381483316,gbtree,0.42046398572976623,4.062608369170592,lossguide,0.7822466983448249,0.00836979159611221,10,7,0.6876978131292857,600,,0.9162538944935583,0.8990152151329251,0.051707507717507484,oversample,0.7214696448738391,,5.0,0.7537306177930897,,,,0.24705557495965125,0.4615904149662057,0.5563093622795116,0.5563093622795116,0.7149084568439407,0.7149084568439407,0.9162538944935583,0.8990152151329251,0.05,0.4743323104207956,0.4756880092168664,0.5565610859728507,0.5568130375735627,0.9991876523151909,0.9983766233766234,oversample,0.3892969047895356,0.39100120385232745,0.7214696448738391,0.4615904149662057,COMPLETE
1532,0.10510510510510511,2025-11-27 07:08:02.895704,2025-11-27 07:08:05.743990,0 days 00:00:02.848286,1.2497763559400987,gbtree,0.3250612809520758,4.595656673118324,lossguide,0.0007096074524028201,0.16373942885176926,8,10,0.48443045075886393,1000,,0.7433455042750704,0.7605998149504054,0.048535545959671494,oversample,0.7714336589388736,,7.0,0.667613552665724,,,,0.6619656534489246,0.6461815416647705,0.4549977385798281,0.46087743102668477,0.09602400600150038,0.10510510510510511,0.7433455042750704,0.7605998149504054,0.05,0.4867041672693353,0.5032483472698608,0.6274509803921569,0.7,0.05199025182778229,0.056818181818181816,oversample,0.36943044480180376,0.3876707115662683,0.7714336589388736,0.6461815416647705,COMPLETE
1533,0.24719101123595505,2025-11-27 07:08:05.922864,2025-11-27 07:08:06.576486,0 days 00:00:00.653622,3.6782135978843664,gbtree,0.5990268759907593,5.357424463773113,depthwise,0.126925305989644,0.25422846902917484,10,5,0.8405427649790675,300,,0.9617466013697323,0.7760095023804329,0.0400519270664602,oversample,0.7718565944788307,,5.0,0.8163098024728538,,,,0.5031570075524174,0.5994647891633624,0.4554500226142017,0.45454545454545453,0.23017902813299232,0.24719101123595505,0.9617466013697323,0.7760095023804329,0.05,0.5505659280881299,0.5649532417343706,0.5405405405405406,0.5351351351351351,0.1462225832656377,0.16071428571428573,oversample,0.5013507352575475,0.5131996769828742,0.7718565944788307,0.5994647891633624,COMPLETE
1534,0.0,2025-11-27 07:08:06.753545,2025-11-27 07:08:07.333822,0 days 00:00:00.580277,15.2402788019441,gbtree,0.3247377599927981,3.530571044101943,lossguide,0.3228342131819348,0.0745625502016106,8,5,1.415508854108597,200,,0.7835348634695576,0.6372882748002556,0.027801367844942325,oversample,0.7419965012714353,,7.0,0.6119024832242187,,,,0.21610891193393417,0.7733748084924996,0.44323835368611486,0.4427860696517413,0.0,0.0,0.7835348634695576,0.6372882748002556,0.02,0.5819436218269256,0.5845729576941565,0.0,0.0,0.0,0.0,oversample,0.5371114408395364,0.5402125645039333,0.7419965012714353,0.7733748084924996,COMPLETE
1535,0.4732394366197183,2025-11-27 07:08:07.515661,2025-11-27 07:08:08.467381,0 days 00:00:00.951720,1.5337477017283336,gbtree,0.3141061099052104,2.856122473886521,lossguide,0.03327065072712374,0.012206803573068118,10,8,8.915822786778222,600,,0.9192693477639797,0.5274606712467975,0.012835151885008526,oversample,0.7459182586331288,,5.0,0.7351179989932336,,,,0.3799691283790505,0.5610919595857387,0.5260063319764813,0.4925373134328358,0.5089034676663543,0.4732394366197183,0.9192693477639797,0.5274606712467975,0.02,0.5666860472744013,0.547330651740692,0.6013289036544851,0.5612472160356348,0.44110479285134035,0.4090909090909091,oversample,0.5495747608547887,0.5032707971293262,0.7459182586331288,0.5610919595857387,COMPLETE
1536,0.7156549520766773,2025-11-27 07:08:08.646216,2025-11-27 07:09:34.508758,0 days 00:01:25.862542,0.03662299033397585,dart,0.7314371309588625,0.9331198077346357,lossguide,0.004376421933779293,0.006756749854019018,9,10,31.76320315909183,700,tree,0.642809862622694,0.16324986031636435,0.07014576677842112,none,0.5072366462163749,2.0523498516031533,5.0,0.6352403626688152,0.48328727377689,weighted,0.8126548490262829,0.9130484194905711,0.2662880391724039,0.5567616463138851,0.5572139303482587,0.715281812899477,0.7156549520766773,0.642809862622694,0.16324986031636435,0.08,0.4069328028604984,0.4054680807752838,0.5567616463138851,0.5572139303482587,1.0,1.0,none,0.2291885641340208,0.22440694519984614,0.5072366462163749,0.2662880391724039,COMPLETE
1537,0.7156549520766773,2025-11-27 07:09:34.689457,2025-11-27 07:09:35.449614,0 days 00:00:00.760157,0.14578029084907296,gbtree,0.6153067222428866,5.4570352411274605,depthwise,2.5389027144725906,0.01987806107513199,10,8,2.545162906917548,400,,0.9239374396653507,0.5454411213748531,0.026951489067909347,oversample,0.6291391366941852,,6.0,0.7505544602490011,,,,0.4256223434380316,0.44589377892171544,0.5567616463138851,0.5572139303482587,0.715281812899477,0.7156549520766773,0.9239374396653507,0.5454411213748531,0.02,0.5693727606041066,0.5904281509735002,0.5567616463138851,0.5572139303482587,1.0,1.0,oversample,0.5100913476682306,0.5309146292930766,0.6291391366941852,0.44589377892171544,COMPLETE
1538,0.6976090014064698,2025-11-27 07:09:35.628969,2025-11-27 07:17:09.956619,0 days 00:07:34.327650,0.17340169568713437,dart,0.789048859465744,0.7344866178064198,lossguide,1.5227417722378223,0.03286651916881196,3,6,2.0492127957444968,800,tree,0.8120008360071043,0.22949028373962593,0.0691201039989473,none,0.5021798276925995,1.3405247751515021,10.0,0.6241864284173797,0.340069488806087,weighted,0.8518112335294122,0.381727766876888,0.607626567994476,0.6146540027137042,0.6110357304387155,0.7002111189303307,0.6976090014064698,0.8120008360071043,0.22949028373962593,0.08,0.6386345878639295,0.6261926354517271,0.6176288019863438,0.6153846153846154,0.8082859463850528,0.8051948051948052,none,0.6117127273330129,0.5959127057824709,0.5021798276925995,0.607626567994476,COMPLETE
1539,0.0,2025-11-27 07:17:10.133802,2025-11-27 07:17:10.902164,0 days 00:00:00.768362,17.66596591785196,gbtree,0.8744156628039524,6.523070815984428,lossguide,0.0067560516729954214,0.008004828602692814,10,4,0.9283231627782433,500,,0.9983622405031283,0.5908667698230469,0.04496817262271667,oversample,0.6832930233891468,,8.0,0.7682761290040411,,,,0.23608848704915997,0.5673772984508244,0.44323835368611486,0.4427860696517413,0.0,0.0,0.9983622405031283,0.5908667698230469,0.05,0.5567616463138851,0.5572139303482587,0.0,0.0,0.0,0.0,oversample,0.5,0.5,0.6832930233891468,0.5673772984508244,COMPLETE
1540,0.7173308619091752,2025-11-27 07:17:11.081686,2025-11-27 07:20:46.861111,0 days 00:03:35.779425,0.0018456499527146823,dart,0.9785275529046595,0.9706002555146096,lossguide,0.5021986607554055,0.004867832783011191,7,12,8.438716622034198,700,tree,0.7208808654010361,0.19350103392905557,0.06910493102395451,oversample,0.516321421510257,,6.0,0.6125631308321094,0.4482762340121863,weighted,0.8475492029359001,0.717703823928869,0.5877584170348016,0.5771144278606966,0.5861601085481682,0.712396185788988,0.7173308619091752,0.7208808654010361,0.19350103392905557,0.08,0.5498548777076739,0.5505986728083376,0.5732673267326732,0.5790523690773067,0.9406986190089358,0.9423701298701299,oversample,0.5167869991213382,0.5171532374673335,0.516321421510257,0.5877584170348016,COMPLETE
1541,0.0,2025-11-27 07:20:47.036708,2025-11-27 07:21:30.864681,0 days 00:00:43.827973,0.004133220491755383,dart,0.9707505906222399,4.50756523277275,lossguide,0.007147774579663514,0.0021006786925406172,6,10,2.559661519072532,600,tree,0.708743063660393,0.28051057183334555,0.07375417032563766,oversample,0.5217191873231841,,7.0,0.6693520975897683,0.4714526220787503,weighted,0.8884991212787058,0.578772480391682,0.7537111308454967,0.44323835368611486,0.4427860696517413,0.0,0.0,0.708743063660393,0.28051057183334555,0.08,0.5139745244424896,0.5168298270728776,0.0,0.0,0.0,0.0,oversample,0.4936665893002205,0.5019442380908161,0.5217191873231841,0.7537111308454967,COMPLETE
1542,0.7156549520766773,2025-11-27 07:21:31.042666,2025-11-27 07:22:25.377573,0 days 00:00:54.334907,0.00044042088329737265,dart,0.9002097379947813,1.6023640051232866,lossguide,0.006547001348390764,0.008573501481199747,9,12,31.598069888571075,700,tree,0.6065587938356337,0.09853881649912849,0.07974768294958744,oversample,0.5813078799185154,,7.0,0.6553970212636366,0.4023382782997371,weighted,0.7225746933741877,0.6631517419949207,0.5096743063447894,0.5567616463138851,0.5572139303482587,0.715281812899477,0.7156549520766773,0.6065587938356337,0.09853881649912849,0.08,0.5567616463138851,0.5572139303482587,0.5567616463138851,0.5572139303482587,1.0,1.0,oversample,0.5,0.5,0.5813078799185154,0.5096743063447894,COMPLETE
1543,0.572405929304447,2025-11-27 07:22:25.554281,2025-11-27 07:26:40.525718,0 days 00:04:14.971437,0.0010271101601985668,dart,0.9450655436779696,0.935940383959337,lossguide,0.4277847458504532,0.0233057835516612,5,11,0.2678089396744812,800,tree,0.685173211728708,0.15830990272308942,0.052855928689782554,oversample,0.5466654294378361,,5.0,0.6090989108039186,0.42107503599049945,weighted,0.746004707023584,0.8178143555112697,0.2824797778087607,0.4966078697421981,0.49118046132971505,0.5753529187333078,0.572405929304447,0.685173211728708,0.15830990272308942,0.05,0.5270436868111827,0.5088597671608976,0.5424460431654676,0.538241601143674,0.6125101543460602,0.6112012987012987,oversample,0.48289054858336505,0.458783810673494,0.5466654294378361,0.2824797778087607,COMPLETE
1544,0.6928571428571428,2025-11-27 07:26:40.707076,2025-11-27 07:34:35.413049,0 days 00:07:54.705973,0.0009444200219854525,dart,0.9835688221444737,0.9590835773895353,lossguide,0.2579807866687214,0.007826368002477196,4,12,17.526217054444068,1000,tree,0.8502546810379114,0.12143629552685978,0.05255509071446189,oversample,0.6384404331370541,,9.0,0.6115882743284987,0.48315468660273286,weighted,0.6816199885776038,0.9858212506423172,0.6032721655459319,0.5784712799638173,0.572139303482587,0.6954248366013072,0.6928571428571428,0.8502546810379114,0.12143629552685978,0.05,0.5776408244476822,0.5544929133301455,0.5817386550027337,0.5773809523809523,0.8643379366368806,0.8660714285714286,oversample,0.5748035444884696,0.54358078081265,0.6384404331370541,0.6032721655459319,COMPLETE
1545,0.7156549520766773,2025-11-27 07:34:35.591244,2025-11-27 07:36:21.844066,0 days 00:01:46.252822,0.44592366233467096,dart,0.9953560969517913,1.2095412520772781,lossguide,0.8307469749751705,0.0029286370834695355,8,12,27.544084015519466,900,tree,0.7048730608320807,0.11182248236303409,0.08481665787207272,oversample,0.5364118733044726,,8.0,0.6567178781449714,0.3821634309120491,weighted,0.8624065297481648,0.8375920562405549,0.4698059543264322,0.5567616463138851,0.5572139303482587,0.715281812899477,0.7156549520766773,0.7048730608320807,0.11182248236303409,0.08,0.437876239611082,0.4295550790373429,0.5567616463138851,0.5572139303482587,1.0,1.0,oversample,0.3057473598700243,0.2847948144807185,0.5364118733044726,0.4698059543264322,COMPLETE
1546,0.7156549520766773,2025-11-27 07:36:22.029892,2025-11-27 07:36:58.151336,0 days 00:00:36.121444,0.00025578596614639674,dart,0.7897178852454999,0.3735537363340179,lossguide,0.1364206072663143,0.0003109018515580092,7,10,6.058907490597628,500,tree,0.7565987705207319,0.29528947803700767,0.03110435586947298,oversample,0.5702897757666244,,6.0,0.7183208951204826,0.43181279107622517,weighted,0.8752066955882332,0.8745954717122452,0.45057759955832366,0.5567616463138851,0.5572139303482587,0.715281812899477,0.7156549520766773,0.7565987705207319,0.29528947803700767,0.02,0.49767906632243614,0.4945772655185236,0.5567616463138851,0.5572139303482587,1.0,1.0,oversample,0.42425230855949203,0.41150441744159827,0.5702897757666244,0.45057759955832366,COMPLETE
1547,0.29154169166166766,2025-11-27 07:36:58.343792,2025-11-27 07:37:48.212698,0 days 00:00:49.868906,0.00038057495277669457,dart,0.9441471296877739,0.6726927501841176,lossguide,3.2073266718667357,0.0012899119665634728,9,12,11.634245151210939,600,tree,0.6391654419542981,0.33985039180038257,0.07018471179981003,oversample,0.5717275277472799,,5.0,0.6339225561859646,0.4804327222457203,weighted,0.8553262619508174,0.7702807253344677,0.5768505029927181,0.4391677973767526,0.4658525554047942,0.25301204819277107,0.29154169166166766,0.6391654419542981,0.33985039180038257,0.08,0.5158429654222629,0.5448322037097488,0.48951048951048953,0.5586206896551724,0.17059301380991065,0.19724025974025974,oversample,0.428161110097979,0.46393417614050914,0.5717275277472799,0.5768505029927181,COMPLETE
1548,0.7156549520766773,2025-11-27 07:37:48.394574,2025-11-27 07:38:36.519949,0 days 00:00:48.125375,0.7427249574112137,dart,0.8023261001785068,3.2303826469260826,lossguide,3.3077345618673304,0.46170442863972105,8,10,29.367030199942466,600,tree,0.6909857417703457,0.06396373717092646,0.01936213586130006,oversample,0.5676697486155361,,5.0,0.6266736981445671,0.4406748747921111,uniform,0.8907424488387476,0.7179017311799322,0.19203392382730458,0.5567616463138851,0.5572139303482587,0.715281812899477,0.7156549520766773,0.6909857417703457,0.06396373717092646,0.02,0.5567616463138851,0.5572139303482587,0.5567616463138851,0.5572139303482587,1.0,1.0,oversample,0.5,0.5,0.5676697486155361,0.19203392382730458,COMPLETE
1549,0.6902871105681124,2025-11-27 07:38:36.704660,2025-11-27 07:38:38.510738,0 days 00:00:01.806078,0.011073649337424574,gbtree,0.7981033374108193,1.2658857387568248,lossguide,11.662445916535624,0.13422313293767413,8,8,13.144333306010143,300,,0.712433250403011,0.3698743278547525,0.01803297787429504,oversample,0.5658503631727423,,5.0,0.6586596997944675,,,,0.49711640696813614,0.27300283443091006,0.532790592492085,0.5413839891451832,0.6849649283318084,0.6902871105681124,0.712433250403011,0.3698743278547525,0.02,0.5163196058926911,0.5235357618042297,0.54833984375,0.5533790401567091,0.9122664500406173,0.9172077922077922,oversample,0.4261265107180159,0.44293557566029473,0.5658503631727423,0.27300283443091006,COMPLETE
1550,0.646,2025-11-27 07:38:38.695719,2025-11-27 07:38:43.047465,0 days 00:00:04.351746,0.0046425795975435676,gbtree,0.8216273429423909,1.191713545903212,lossguide,0.004451787802622758,0.21299942935687416,6,8,0.11620591485868112,700,,0.9451931596979704,0.7713174815125877,0.07885753460814487,undersample,0.5396633813115429,,6.0,0.8810447479401731,,,,0.5793234857069914,0.14792332226697325,0.5309814563545907,0.519674355495251,0.6583196046128501,0.646,0.9451931596979704,0.7713174815125877,0.08,0.5435862534585092,0.5186258212274255,0.5537694013303769,0.5480769230769231,0.8115353371242892,0.786525974025974,undersample,0.4917538420729787,0.46076701643606655,0.5396633813115429,0.14792332226697325,COMPLETE
1551,0.7156549520766773,2025-11-27 07:38:43.229455,2025-11-27 07:40:10.133859,0 days 00:01:26.904404,0.0010300985967491543,dart,0.8301927806705576,1.8811813514885225,lossguide,0.7122733663658689,0.00022435630016430044,4,11,9.41990842044693,800,forest,0.6022156694585189,0.4706801656916272,0.06868195805260188,none,0.5466784268909053,0.9706746889101459,7.0,0.610805186772855,0.49769972217791497,weighted,0.8784172956623365,0.7114549865681253,0.3469492100089907,0.5567616463138851,0.5572139303482587,0.715281812899477,0.7156549520766773,0.6022156694585189,0.4706801656916272,0.08,0.4910022453538183,0.4958562791758766,0.5567616463138851,0.5572139303482587,1.0,1.0,none,0.4231825792867918,0.4387108996723399,0.5466784268909053,0.3469492100089907,COMPLETE
1552,0.0,2025-11-27 07:40:10.311439,2025-11-27 07:40:12.100170,0 days 00:00:01.788731,0.3021701889539439,gbtree,0.7782622937295117,0.2524904851911478,lossguide,0.004296786061528952,0.0008692691168838036,9,8,46.6464869949585,900,,0.7980760279760305,0.27615682872901726,0.09533436676008046,oversample,0.8773097553491511,,6.0,0.7835199951146098,,,,0.9551749364805797,0.616836118015634,0.44323835368611486,0.4427860696517413,0.0,0.0,0.7980760279760305,0.27615682872901726,0.1,0.5988679422797347,0.6169264680600453,0.0,0.0,0.0,0.0,oversample,0.543250468343308,0.549609991642678,0.8773097553491511,0.616836118015634,COMPLETE
1553,0.6337854500616523,2025-11-27 07:40:12.298396,2025-11-27 07:44:36.961137,0 days 00:04:24.662741,0.005782786427143939,dart,0.8338033536081899,1.1131400656942991,lossguide,0.014493604889589505,0.012169969943004502,6,12,13.227304158156565,700,tree,0.6005217792278198,0.637741505408861,0.06046677048057662,oversample,0.5117668454107407,,7.0,0.6114589267877849,0.3520369094213835,weighted,0.7565227046132984,0.753054003446688,0.6858646093277363,0.5730438715513342,0.5970149253731343,0.6086235489220564,0.6337854500616523,0.6005217792278198,0.637741505408861,0.05,0.6004803506009001,0.6265358410618538,0.6215071972904318,0.6419650291423813,0.5962632006498781,0.6258116883116883,oversample,0.5782701138944611,0.6141524780122839,0.5117668454107407,0.6858646093277363,COMPLETE
1554,0.7112698928223449,2025-11-27 07:44:37.167066,2025-11-27 07:44:38.454383,0 days 00:00:01.287317,1.3005657936293293,gbtree,0.8443455433634286,2.365457249067287,lossguide,0.35636048823969907,0.4795408329659642,7,9,94.13413042753399,800,,0.8368173434546049,0.8081030724759469,0.004159425041248767,oversample,0.5466110645032156,,12.0,0.7928726715217564,,,,0.3586587730598715,0.5009347763506374,0.6010854816824966,0.5979194934418816,0.7130774235523748,0.7112698928223449,0.8368173434546049,0.8081030724759469,0.0,0.5889776779431033,0.5861258424703981,0.5946825827455237,0.5928532755820249,0.8903330625507717,0.8887987012987013,oversample,0.5436906281602811,0.5387172837377128,0.5466110645032156,0.5009347763506374,COMPLETE
1555,0.7156549520766773,2025-11-27 07:44:38.661800,2025-11-27 07:45:12.775449,0 days 00:00:34.113649,0.03740835043930538,dart,0.7232943480205941,2.122332547454198,depthwise,2.1154562287186365,0.020833236319857885,9,11,13.105155500375531,500,tree,0.586425738463694,0.07794465010098563,0.07575990259250526,oversample,0.6395071634428797,,6.0,0.7432394051842666,0.3825898697804484,weighted,0.8952791389293928,0.7744517654927596,0.3110672481318088,0.5567616463138851,0.5572139303482587,0.715281812899477,0.7156549520766773,0.586425738463694,0.07794465010098563,0.08,0.699804623320805,0.6979861262248865,0.5567616463138851,0.5572139303482587,1.0,1.0,oversample,0.6374260183358478,0.6414406265338339,0.6395071634428797,0.3110672481318088,COMPLETE
1556,0.09878213802435724,2025-11-27 07:45:12.959771,2025-11-27 07:45:15.754717,0 days 00:00:02.794946,0.5411148471181422,gbtree,0.938675842787455,0.33043007672244407,depthwise,0.6277954374824559,0.2243420089872019,10,4,35.771983113053295,500,,0.9560989393161672,0.6095534971316228,0.04328012843015516,oversample,0.5063891461721353,,9.0,0.6689533622417246,,,,0.20340578864695966,0.8023810964804339,0.40027137042062416,0.39755766621438265,0.0817174515235457,0.09878213802435724,0.9560989393161672,0.6095534971316228,0.05,0.4605067276916109,0.45501923875962913,0.27699530516431925,0.2967479674796748,0.0479285134037368,0.05925324675324675,oversample,0.37323314378554023,0.3546932829683085,0.5063891461721353,0.8023810964804339,COMPLETE
