number,value,datetime_start,datetime_complete,duration,params_alpha,params_booster,params_colsample_bytree,params_gamma,params_grow_policy,params_lambda,params_learning_rate,params_max_delta_step,params_max_depth,params_min_child_weight,params_n_estimators,params_normalize_type,params_params_feature_fraction,params_params_labeled_ratio,params_params_missing_rate,params_params_resampling,params_params_sample_rows,params_params_scale_pos_weight,params_params_selftrain_max_iter,params_params_selftrain_threshold,params_rate_drop,params_sample_type,params_skip_drop,params_subsample,params_user_attrs_decision_threshold,user_attrs_acc_test,user_attrs_acc_val,user_attrs_f1_test,user_attrs_f1_val,user_attrs_feature_fraction,user_attrs_labeled_ratio,user_attrs_missing_rate,user_attrs_pr_auc_test,user_attrs_pr_auc_val,user_attrs_prec_test,user_attrs_prec_val,user_attrs_rec_test,user_attrs_rec_val,user_attrs_resampling_strategy,user_attrs_roc_auc_test,user_attrs_roc_auc_val,user_attrs_sample_rows,user_attrs_user_attrs_decision_threshold,state
262,0.0,2025-11-26 18:06:02.863835,2025-11-26 18:06:03.480965,0 days 00:00:00.617130,0.07529680864816857,gbtree,0.6285452899678041,9.914886715131844,lossguide,34.700024232383406,0.012758236918573931,2,9,0.6317654349837856,400,,0.7690320349543153,0.46827151934688,0.08107324620938323,undersample,0.910396193685215,,8.0,0.8248843604165477,,,,0.637811277173521,0.6451140627135762,0.44323835368611486,0.4427860696517413,0.0,0.0,0.7690320349543153,0.46827151934688,0.08,0.5567616463138851,0.5572139303482587,0.0,0.0,0.0,0.0,undersample,0.5,0.5,0.910396193685215,0.6451140627135762,COMPLETE
263,0.7156549520766773,2025-11-26 18:06:03.652737,2025-11-26 18:06:04.740232,0 days 00:00:01.087495,0.017210132867072046,gbtree,0.7082331515888425,5.824887736754025,depthwise,0.0011373075229610264,0.032191698409329235,1,3,0.9044022756324319,300,,0.7957308194074437,0.5819812880106225,0.09366736861982507,none,0.9371257639544153,1.4809393151394938,5.0,0.7001964548816968,,,,0.3321808256712839,0.5110032221188081,0.5567616463138851,0.5572139303482587,0.715281812899477,0.7156549520766773,0.7957308194074437,0.5819812880106225,0.1,0.4112783817583734,0.41249243832146876,0.5567616463138851,0.5572139303482587,1.0,1.0,none,0.2416253585105854,0.24927453802581484,0.9371257639544153,0.5110032221188081,COMPLETE
264,0.7156549520766773,2025-11-26 18:06:04.913993,2025-11-26 18:06:46.150081,0 days 00:00:41.236088,3.8594433391746557,dart,0.3339215696541256,4.658946010382442,depthwise,12.235779929629702,0.0015445307540940191,5,6,3.77734731959637,600,tree,0.5005235915820986,0.2945148939154593,0.08636622489382557,none,0.863852860977605,2.304289807755263,12.0,0.7420120504210398,0.18345073309227816,weighted,0.018039070989951476,0.3647704584660157,0.07518943966040217,0.5567616463138851,0.5572139303482587,0.715281812899477,0.7156549520766773,0.5005235915820986,0.2945148939154593,0.08,0.6971414225122028,0.7041098356538791,0.5567616463138851,0.5572139303482587,1.0,1.0,none,0.6741806064424145,0.6742824973800459,0.863852860977605,0.07518943966040217,COMPLETE
265,0.6506456241032998,2025-11-26 18:06:46.318084,2025-11-26 18:06:50.196257,0 days 00:00:03.878173,0.07452176645255448,gbtree,0.6888861766462953,1.142059412360164,lossguide,1.462236933972533,0.1840531528952946,7,8,0.5011618854398563,600,,0.8187049401701406,0.16399873777915322,0.09142394491818517,oversample,0.7574452137521509,,7.0,0.615377287933379,,,,0.5822766337490373,0.3132258774720398,0.5486205336951605,0.5594753505201266,0.6330882352941176,0.6506456241032998,0.8187049401701406,0.16399873777915322,0.1,0.5698260178815397,0.5684702429644887,0.5782404298186703,0.5829048843187661,0.6994313566206336,0.7362012987012987,oversample,0.5361092690528688,0.5454056285900004,0.7574452137521509,0.3132258774720398,COMPLETE
266,0.3489278752436647,2025-11-26 18:06:50.370100,2025-11-26 18:06:51.385868,0 days 00:00:01.015768,0.001729137851257386,gbtree,0.8376813196256742,0.2124205782167648,lossguide,0.05012943199734267,0.0007047466253326931,4,4,2.668108263424788,400,,0.8725424731318194,0.16126258864876294,0.07298335049262908,undersample,0.8260893587874436,,6.0,0.6632593831833451,,,,0.4518116582925713,0.5082737975971262,0.4016282225237449,0.39574853007688826,0.3599419448476052,0.3489278752436647,0.8725424731318194,0.16126258864876294,0.08,0.4745400062924712,0.46660334082857846,0.4449760765550239,0.43658536585365854,0.3021933387489846,0.2905844155844156,undersample,0.40916377924037195,0.3929238853587679,0.8260893587874436,0.5082737975971262,COMPLETE
267,0.7156549520766773,2025-11-26 18:06:51.557115,2025-11-26 18:06:52.261101,0 days 00:00:00.703986,98.8755767017464,gbtree,0.2693079320081287,5.360518580051812,lossguide,0.02581441328130325,0.3653722942205325,5,4,2.2514417570167407,600,,0.700179379551422,0.5867539506383977,0.007265160873661143,undersample,0.5107940937348113,,10.0,0.6349523131541287,,,,0.9765186818512772,0.11788078471324304,0.5567616463138851,0.5572139303482587,0.715281812899477,0.7156549520766773,0.700179379551422,0.5867539506383977,0.0,0.5567616463138851,0.5572139303482587,0.5567616463138851,0.5572139303482587,1.0,1.0,undersample,0.5,0.5,0.5107940937348113,0.11788078471324304,COMPLETE
268,0.7156549520766773,2025-11-26 18:06:52.432617,2025-11-26 18:06:53.041165,0 days 00:00:00.608548,38.36460056595325,gbtree,0.5030443324885518,0.8201546284314756,depthwise,0.00027548226181351967,0.43657095917295197,0,10,4.264928420899136,400,,0.6365870218508146,0.6704288558276423,0.002940808102558753,none,0.9564322615624586,1.7318251082043885,6.0,0.7784996306979897,,,,0.8467614796841848,0.5563370596687304,0.5567616463138851,0.5572139303482587,0.715281812899477,0.7156549520766773,0.6365870218508146,0.6704288558276423,0.0,0.47272101163684155,0.47912963204811926,0.5567616463138851,0.5572139303482587,1.0,1.0,none,0.2804961952287008,0.2935003581709404,0.9564322615624586,0.5563370596687304,COMPLETE
269,0.7156549520766773,2025-11-26 18:06:53.208947,2025-11-26 18:07:35.923354,0 days 00:00:42.714407,31.860963183184065,dart,0.837246116161291,5.7933751874774915,lossguide,5.152426340182215,0.018475764550137354,10,7,64.00998762663768,600,forest,0.8243327225791071,0.4129666388907856,0.07257513209911896,none,0.9640602443733731,3.142973657833759,8.0,0.905972339104327,0.35008004644999585,weighted,0.7023070249267298,0.49356093314465704,0.36726434977411454,0.5567616463138851,0.5572139303482587,0.715281812899477,0.7156549520766773,0.8243327225791071,0.4129666388907856,0.08,0.3887744662551367,0.3920052120828776,0.5567616463138851,0.5572139303482587,1.0,1.0,none,0.1250965699033472,0.1338365413952748,0.9640602443733731,0.36726434977411454,COMPLETE
270,0.7156549520766773,2025-11-26 18:07:36.096223,2025-11-26 18:07:37.372441,0 days 00:00:01.276218,2.2055357455661797,gbtree,0.27308466803540926,3.9084575488143853,lossguide,1.1846051570865996,0.30671256577223166,6,6,0.5962343924100394,300,,0.5520426852653039,0.5661500424809465,0.03831903273181571,oversample,0.6889356606727506,,8.0,0.6394519204222102,,,,0.6870664477508488,0.3314139175828595,0.555857078245138,0.5572139303482587,0.7143688190808609,0.7156549520766773,0.5520426852653039,0.5661500424809465,0.05,0.5638909954855877,0.5565035958075581,0.5564114182147711,0.5572139303482587,0.9975629569455727,1.0,oversample,0.5041612095691242,0.5054185791226139,0.6889356606727506,0.3314139175828595,COMPLETE
271,0.7156549520766773,2025-11-26 18:07:37.549821,2025-11-26 18:09:23.422299,0 days 00:01:45.872478,7.54161298026124,dart,0.9257170518135492,5.311976964489135,depthwise,1.1520230439074346,0.001699306337634579,10,9,26.30417210789935,900,forest,0.7283663390550424,0.7560397461772579,0.09623311641585408,oversample,0.9452992283742067,,12.0,0.9410150916468093,0.029393772942623936,weighted,0.21772712305643616,0.7831488407828668,0.48432608894577045,0.5567616463138851,0.5572139303482587,0.715281812899477,0.7156549520766773,0.7283663390550424,0.7560397461772579,0.1,0.4614552209335594,0.44640108100725256,0.5567616463138851,0.5572139303482587,1.0,1.0,oversample,0.35116754256536087,0.32182571004072535,0.9452992283742067,0.48432608894577045,COMPLETE
272,0.7156549520766773,2025-11-26 18:09:23.589874,2025-11-26 18:09:24.152180,0 days 00:00:00.562306,2.713469646241169,gbtree,0.2024614061135928,2.1295097581010918,depthwise,0.006114178876553355,0.3624307425679474,0,4,1.5250104952213397,300,,0.5751986667660923,0.4463363305347973,0.024802660005122372,none,0.9941957491367641,1.0869691810280862,9.0,0.9436440176607694,,,,0.961748222530142,0.5028185356766108,0.5567616463138851,0.5572139303482587,0.715281812899477,0.7156549520766773,0.5751986667660923,0.4463363305347973,0.02,0.6176777132369161,0.6100287836978094,0.5567616463138851,0.5572139303482587,1.0,1.0,none,0.586396906447388,0.5614279744770041,0.9941957491367641,0.5028185356766108,COMPLETE
273,0.7156549520766773,2025-11-26 18:09:24.324604,2025-11-26 18:09:25.076014,0 days 00:00:00.751410,1.4870709137569265,gbtree,0.6851955944473483,9.46587489674082,lossguide,3.7278618380683888,0.003881004022029424,3,5,3.632513830542611,600,,0.7591070795897746,0.74763609485176,0.04322103020345494,undersample,0.9200650765483926,,8.0,0.8043338617505704,,,,0.5194386866133157,0.4165728098416674,0.5567616463138851,0.5572139303482587,0.715281812899477,0.7156549520766773,0.7591070795897746,0.74763609485176,0.05,0.478483125697393,0.47920168970549365,0.5567616463138851,0.5572139303482587,1.0,1.0,undersample,0.3947806661251016,0.39389600440417605,0.9200650765483926,0.4165728098416674,COMPLETE
274,0.3528778913394298,2025-11-26 18:09:25.244356,2025-11-26 18:11:01.333672,0 days 00:01:36.089316,0.34907156678824786,dart,0.9921262659195969,1.1101895886719721,depthwise,0.11820078815499957,0.002743515706387515,6,10,37.35088890351211,900,forest,0.9028861403463466,0.8906437256341463,0.09029531352489477,oversample,0.5827556482756159,,11.0,0.9346064192674503,0.47467776189696687,uniform,0.7037382882497055,0.7716786699536194,0.5802779804919991,0.44323835368611486,0.4559023066485753,0.3064788732394366,0.3528778913394298,0.9028861403463466,0.8906437256341463,0.1,0.5276811375436568,0.535858776105489,0.5,0.5231259968102073,0.22095857026807472,0.2662337662337662,oversample,0.41343523599529175,0.42232084820184923,0.5827556482756159,0.5802779804919991,COMPLETE
275,0.7156549520766773,2025-11-26 18:11:01.502077,2025-11-26 18:11:01.990092,0 days 00:00:00.488015,3.463394488673588,gbtree,0.6588488670699084,8.235034714700282,lossguide,36.642057978721624,0.00011837964211385738,3,4,64.95956999115165,200,,0.7451168767085549,0.46039775899898505,0.02414142492807898,oversample,0.7735482197821844,,12.0,0.945804275069982,,,,0.4060712561985804,0.14419413011326404,0.5567616463138851,0.5572139303482587,0.715281812899477,0.7156549520766773,0.7451168767085549,0.46039775899898505,0.02,0.5214957532326403,0.5222807088360399,0.5567616463138851,0.5572139303482587,1.0,1.0,oversample,0.10134161706924846,0.10301145483729757,0.7735482197821844,0.14419413011326404,COMPLETE
276,0.7156549520766773,2025-11-26 18:11:02.168118,2025-11-26 18:12:14.353801,0 days 00:01:12.185683,72.11304820541697,dart,0.8375200499885644,4.536881383865942,lossguide,2.7834409492444316,0.021014005926222525,10,9,2.1570184629538014,800,forest,0.8621117560118243,0.1352508527276275,0.08976263500648551,undersample,0.929859972733262,,8.0,0.9493922421016125,0.21010124882357423,uniform,0.2967117763740293,0.6380360618235438,0.48346956307217154,0.5567616463138851,0.5572139303482587,0.715281812899477,0.7156549520766773,0.8621117560118243,0.1352508527276275,0.08,0.5567616463138851,0.5572139303482587,0.5567616463138851,0.5572139303482587,1.0,1.0,undersample,0.5,0.5,0.929859972733262,0.48346956307217154,COMPLETE
277,0.7156549520766773,2025-11-26 18:12:14.525588,2025-11-26 18:12:15.008761,0 days 00:00:00.483173,0.0016805949560350598,gbtree,0.8954604955646871,8.51213072860277,lossguide,0.4669133516956453,0.03468226325836087,4,6,3.95772556207244,200,,0.8707433584094825,0.7618181134117825,0.09147688850638121,oversample,0.565987423174678,,11.0,0.6524429446555858,,,,0.9519775963527943,0.46385577464456557,0.5567616463138851,0.5572139303482587,0.715281812899477,0.7156549520766773,0.8707433584094825,0.7618181134117825,0.1,0.5086357751021855,0.5265253051259849,0.5567616463138851,0.5572139303482587,1.0,1.0,oversample,0.3810437009897379,0.4051323740100553,0.565987423174678,0.46385577464456557,COMPLETE
278,0.0,2025-11-26 18:12:15.174930,2025-11-26 18:12:24.112111,0 days 00:00:08.937181,2.806196293731292,dart,0.7399874562882122,7.983295149369648,depthwise,0.0002009392750496462,0.02173164328662222,5,4,0.10949766490072912,300,forest,0.8054142206489455,0.8267688356202273,0.012833629996247473,undersample,0.8219111413926456,,11.0,0.7886215587489046,0.36475157273923575,weighted,0.22660744834540325,0.5745819132789619,0.5980349922245796,0.44323835368611486,0.4427860696517413,0.0,0.0,0.8054142206489455,0.8267688356202273,0.02,0.5403525326216412,0.5419846585610301,0.0,0.0,0.0,0.0,undersample,0.44410011770752167,0.4293528547550509,0.8219111413926456,0.5980349922245796,COMPLETE
279,0.7156549520766773,2025-11-26 18:12:24.277486,2025-11-26 18:13:23.124500,0 days 00:00:58.847014,0.00875725605082404,dart,0.32803210790022286,9.370940929650986,lossguide,3.4891012232958714,0.007145411632768947,1,4,0.3724544061883671,700,forest,0.6828360423087726,0.07858585389932528,0.09653495809396585,undersample,0.97360208366287,,10.0,0.6141896076660267,0.4882351838757557,weighted,0.7864832706183447,0.8208463834761335,0.09477726508911309,0.5567616463138851,0.5572139303482587,0.715281812899477,0.7156549520766773,0.6828360423087726,0.07858585389932528,0.1,0.5567616463138851,0.5572139303482587,0.5567616463138851,0.5572139303482587,1.0,1.0,undersample,0.5,0.5,0.97360208366287,0.09477726508911309,COMPLETE
280,0.7156549520766773,2025-11-26 18:13:23.296453,2025-11-26 18:14:08.260827,0 days 00:00:44.964374,0.8448853070032326,dart,0.3049156820954429,3.148799141039244,lossguide,0.005300656522992631,0.014155184400662725,10,9,2.0766981863296454,600,tree,0.6359847748988845,0.8559827329042874,0.03772697377680332,undersample,0.706819776052786,,12.0,0.8948606372159313,0.35347350778331615,weighted,0.8256710164351209,0.7438423219338273,0.16646253667650854,0.5567616463138851,0.5572139303482587,0.715281812899477,0.7156549520766773,0.6359847748988845,0.8559827329042874,0.05,0.45541416405614754,0.44987808126354545,0.5567616463138851,0.5572139303482587,1.0,1.0,undersample,0.3521705432782374,0.34856458021039227,0.706819776052786,0.16646253667650854,COMPLETE
281,0.7156549520766773,2025-11-26 18:14:08.428129,2025-11-26 18:15:30.411844,0 days 00:01:21.983715,2.3665993190691865,dart,0.5634022238961691,3.7450274836247863,lossguide,0.19940862325821102,0.00019510461104973624,1,9,2.5267201085219657,900,tree,0.7764688350184916,0.28451006305229826,0.04669724682570519,undersample,0.7774523063710498,,5.0,0.7248377419859853,0.37829254015666436,weighted,0.3834265527444774,0.9977256804174968,0.18859208211083983,0.5567616463138851,0.5572139303482587,0.715281812899477,0.7156549520766773,0.7764688350184916,0.28451006305229826,0.05,0.554065097955095,0.5659210137958404,0.5567616463138851,0.5572139303482587,1.0,1.0,undersample,0.4854962781213216,0.5018406006659326,0.7774523063710498,0.18859208211083983,COMPLETE
282,0.7156549520766773,2025-11-26 18:15:30.570571,2025-11-26 18:16:12.652663,0 days 00:00:42.082092,95.26300521848196,dart,0.3819038477900358,3.5201149003535734,lossguide,19.622387744552743,0.07455643871952299,1,6,16.704230087520543,600,forest,0.6412117448340949,0.3352944695576314,0.07650429243645045,none,0.9314942719246696,2.1073246485967796,11.0,0.7201378285959599,0.13905469539632326,weighted,0.25768356705189016,0.4278639671425608,0.2231589848903932,0.5567616463138851,0.5572139303482587,0.715281812899477,0.7156549520766773,0.6412117448340949,0.3352944695576314,0.08,0.5567616463138851,0.5572139303482587,0.5567616463138851,0.5572139303482587,1.0,1.0,none,0.5,0.5,0.9314942719246696,0.2231589848903932,COMPLETE
283,0.7156549520766773,2025-11-26 18:16:12.815892,2025-11-26 18:16:13.848349,0 days 00:00:01.032457,0.11063931631633775,gbtree,0.9259739901770009,3.631752072553259,lossguide,0.0903894823147413,0.005218469498723045,6,11,3.610148885704419,800,,0.8218629094158766,0.5393689047443226,0.09453652356415453,oversample,0.5994902180637453,,5.0,0.7091467992833177,,,,0.7197566938834542,0.30656124466419243,0.5567616463138851,0.5572139303482587,0.715281812899477,0.7156549520766773,0.8218629094158766,0.5393689047443226,0.1,0.4886117225494894,0.4681881627972972,0.5567616463138851,0.5572139303482587,1.0,1.0,oversample,0.41985609841011956,0.38621191117360676,0.5994902180637453,0.30656124466419243,COMPLETE
284,0.7156549520766773,2025-11-26 18:16:14.016412,2025-11-26 18:16:15.403930,0 days 00:00:01.387518,0.40422167209279586,gbtree,0.7923062158997201,0.8319397013473417,depthwise,0.002793347730443859,0.0003624390138996527,7,9,1.3962647826991401,400,,0.7098298261786061,0.2926107416648416,0.09685780127205425,none,0.8184053936959487,0.5979922139682246,7.0,0.9111634758687348,,,,0.792500751225029,0.3930194406207357,0.5567616463138851,0.5572139303482587,0.715281812899477,0.7156549520766773,0.7098298261786061,0.2926107416648416,0.1,0.5820189102999297,0.5773831036945783,0.5567616463138851,0.5572139303482587,1.0,1.0,none,0.5560399708217975,0.5564562799304884,0.8184053936959487,0.3930194406207357,COMPLETE
285,0.7156549520766773,2025-11-26 18:16:15.570693,2025-11-26 18:16:16.664220,0 days 00:00:01.093527,0.5790142720519613,gbtree,0.7481837724827464,3.5828510701238825,lossguide,0.00018489749923046242,0.0015990581413337086,3,4,0.42298325595780606,600,,0.7075335776170016,0.7949163615044866,0.09784127880520782,none,0.8024742508770062,1.4637566500650543,6.0,0.7693047609080053,,,,0.3642285020979963,0.6028438287173077,0.555857078245138,0.5572139303482587,0.7145348837209302,0.7156549520766773,0.7075335776170016,0.7949163615044866,0.1,0.4060032263312031,0.40733746341468,0.5563603440470801,0.5572139303482587,0.9983753046303818,1.0,none,0.23773520781180058,0.24169449676982874,0.8024742508770062,0.6028438287173077,COMPLETE
286,0.7156549520766773,2025-11-26 18:16:16.843856,2025-11-26 18:16:17.976174,0 days 00:00:01.132318,0.000750814736954134,gbtree,0.5310083494630449,4.36144608047361,depthwise,0.0004031012025646046,0.0014050811808553004,6,10,0.24291036864327958,900,,0.773269801885589,0.6643876662263816,0.03010119435026354,oversample,0.9210793439057869,,7.0,0.6618517634504735,,,,0.5100243778381272,0.49414816590746957,0.5567616463138851,0.5572139303482587,0.715281812899477,0.7156549520766773,0.773269801885589,0.6643876662263816,0.02,0.4443420467802623,0.4394378865478158,0.5567616463138851,0.5572139303482587,1.0,1.0,oversample,0.33389893731660014,0.3243930163299418,0.9210793439057869,0.49414816590746957,COMPLETE
287,0.7156549520766773,2025-11-26 18:16:18.144741,2025-11-26 18:16:18.620896,0 days 00:00:00.476155,88.06471658684252,gbtree,0.22271502442934188,3.1776741355287403,lossguide,0.9469165101558275,0.13269717161807654,9,5,0.25211717411735474,200,,0.5846138844379695,0.5849303689471891,0.00012215168837521363,oversample,0.6135973104055342,,12.0,0.6633404610671056,,,,0.9391146185285592,0.4297438861579947,0.5567616463138851,0.5572139303482587,0.715281812899477,0.7156549520766773,0.5846138844379695,0.5849303689471891,0.0,0.5567616463138851,0.5572139303482587,0.5567616463138851,0.5572139303482587,1.0,1.0,oversample,0.5,0.5,0.6135973104055342,0.4297438861579947,COMPLETE
288,0.7156549520766773,2025-11-26 18:16:18.787562,2025-11-26 18:16:19.625046,0 days 00:00:00.837484,13.674575352376463,gbtree,0.20777589449595096,5.355896903751293,lossguide,3.661907325635693,0.0005415864683611814,1,8,0.27290706046011526,800,,0.8471398876230564,0.8623236207732885,0.005032852818019648,undersample,0.5783845429010359,,7.0,0.6579115816043345,,,,0.3456158351593404,0.19539238487534893,0.5567616463138851,0.5572139303482587,0.715281812899477,0.7156549520766773,0.8471398876230564,0.8623236207732885,0.0,0.4927696481226678,0.4935240164194831,0.5567616463138851,0.5572139303482587,1.0,1.0,undersample,0.38030056864337936,0.38391530583818634,0.5783845429010359,0.19539238487534893,COMPLETE
289,0.7156549520766773,2025-11-26 18:16:19.794385,2025-11-26 18:17:43.872443,0 days 00:01:24.078058,1.2261256955197142,dart,0.5562482182716739,9.834734313109127,lossguide,0.0032384004107561737,0.0010742283061897086,6,3,0.4043957796560092,800,tree,0.6826703993670008,0.21785256375892653,0.07587964764366505,oversample,0.9435089233212609,,10.0,0.6073512331719574,0.024228799064817105,weighted,0.2817324519819013,0.5513339467878706,0.03479230949415085,0.5567616463138851,0.5572139303482587,0.715281812899477,0.7156549520766773,0.6826703993670008,0.21785256375892653,0.08,0.46264352988466073,0.44506489291529017,0.5567616463138851,0.5572139303482587,1.0,1.0,oversample,0.3308327392695502,0.2827647646020986,0.9435089233212609,0.03479230949415085,COMPLETE
290,0.7156549520766773,2025-11-26 18:17:44.034783,2025-11-26 18:17:44.821611,0 days 00:00:00.786828,0.020699656908338804,gbtree,0.29182324306638,6.055880177480348,lossguide,0.02819243112678045,0.0004272236552708255,0,3,0.3201979056568595,600,,0.6959473664983046,0.6168969906492278,0.02575579170295978,none,0.5590384216377072,2.3641835723691926,7.0,0.784932768337568,,,,0.44639228514181195,0.08366357064039534,0.5567616463138851,0.5572139303482587,0.715281812899477,0.7156549520766773,0.6959473664983046,0.6168969906492278,0.02,0.4394833846126275,0.4444340122840311,0.5567616463138851,0.5572139303482587,1.0,1.0,none,0.2960721331587062,0.31144662921348315,0.5590384216377072,0.08366357064039534,COMPLETE
