number,value,datetime_start,datetime_complete,duration,params_alpha,params_booster,params_colsample_bytree,params_gamma,params_grow_policy,params_lambda,params_learning_rate,params_max_delta_step,params_max_depth,params_min_child_weight,params_n_estimators,params_normalize_type,params_params_feature_fraction,params_params_labeled_ratio,params_params_missing_rate,params_params_resampling,params_params_sample_rows,params_params_scale_pos_weight,params_params_selftrain_max_iter,params_params_selftrain_threshold,params_rate_drop,params_sample_type,params_skip_drop,params_subsample,params_user_attrs_decision_threshold,user_attrs_acc_test,user_attrs_acc_val,user_attrs_f1_test,user_attrs_f1_val,user_attrs_feature_fraction,user_attrs_labeled_ratio,user_attrs_missing_rate,user_attrs_pr_auc_test,user_attrs_pr_auc_val,user_attrs_prec_test,user_attrs_prec_val,user_attrs_rec_test,user_attrs_rec_val,user_attrs_resampling_strategy,user_attrs_roc_auc_test,user_attrs_roc_auc_val,user_attrs_sample_rows,user_attrs_user_attrs_decision_threshold,state
1854,0.446524064171123,2025-11-27 11:01:23.484012,2025-11-27 11:01:28.344879,0 days 00:00:04.860867,0.000705656355049685,dart,0.6719540293621087,0.9332351731567312,depthwise,0.0007093364977984901,0.07971152359597974,6,4,0.48530740080479323,200,tree,0.6112599756474184,0.5073863028113675,0.02017188242858591,undersample,0.8805541798664297,,10.0,0.9459475015491623,0.449453795493869,uniform,0.48055994167573535,0.8750591127372298,,0.44052464947987335,0.43826322930800543,0.4610021786492375,0.446524064171123,0.6112599756474184,0.5073863028113675,0.02,0.49026997264471567,0.49779371701651887,0.49718045112781956,0.4950592885375494,0.429731925264013,0.40665584415584416,undersample,0.432153633183574,0.4425007130254832,0.8805541798664297,0.5,COMPLETE
1855,0.8754183711416884,2025-11-27 11:01:28.545563,2025-11-27 11:01:46.459740,0 days 00:00:17.914177,0.05667209213693521,dart,0.6875417907769794,6.439841243857556,depthwise,0.27304936788161766,0.0009420201273744448,8,10,21.033877669187337,400,tree,0.9032138605711175,0.35510791532074626,0.010551829464223717,undersample,0.5040365780469582,,11.0,0.7436096604716508,0.43996126758013493,weighted,0.5551990022278342,0.3942746078767764,,0.8606965174129353,0.8484848484848485,0.8847305389221557,0.8754183711416884,0.9032138605711175,0.35510791532074626,0.02,0.9041329318517913,0.8936306306904473,0.8202637057598889,0.8078242964996568,0.9601949634443542,0.9553571428571429,undersample,0.9279737727747477,0.9205188006579733,0.5040365780469582,0.5,COMPLETE
1856,0.0,2025-11-27 11:01:46.659930,2025-11-27 11:01:47.552185,0 days 00:00:00.892255,0.33686771558799095,gbtree,0.9526121653550712,3.194922423549149,lossguide,0.12081901734168246,0.00021541560141179856,0,4,4.598112139795115,500,,0.7647146542116542,0.871304129134985,0.010876806974633214,none,0.515191419556192,0.7028699104457978,7.0,0.6639555020781025,,,,0.6849538140874083,,0.44323835368611486,0.4427860696517413,0.0,0.0,0.7647146542116542,0.871304129134985,0.02,0.5832260705814948,0.6002254753460092,0.0,0.0,0.0,0.0,none,0.4454135512856645,0.4492769424140721,0.515191419556192,0.5,COMPLETE
1857,0.7156549520766773,2025-11-27 11:01:47.753547,2025-11-27 11:03:35.765426,0 days 00:01:48.011879,0.685236689508911,dart,0.7827827616674932,7.0828314057471005,depthwise,0.14781550136998278,0.005590775868066412,2,5,52.825507211556484,1000,tree,0.7143429904064746,0.6781396332272116,0.01395280512590752,none,0.552116432932519,1.185123296746163,5.0,0.8103317263336847,0.45930693883482,weighted,0.052422026694770495,0.7846716561874567,,0.5567616463138851,0.5572139303482587,0.715281812899477,0.7156549520766773,0.7143429904064746,0.6781396332272116,0.02,0.5177125240891245,0.5191049378043231,0.5567616463138851,0.5572139303482587,1.0,1.0,none,0.4547244649281322,0.4678773728824801,0.552116432932519,0.5,COMPLETE
1858,0.7156549520766773,2025-11-27 11:03:35.959323,2025-11-27 11:03:36.332358,0 days 00:00:00.373035,14.531493877209307,gbtree,0.9634777304834796,9.688407845223875,depthwise,15.190994742061774,0.1404984310107447,9,10,1.7722847343283175,200,,0.6408555838062501,0.46344505561713406,0.05715910412338831,oversample,0.5020561499825644,,11.0,0.7663036950502932,,,,0.49374751994634947,,0.5567616463138851,0.5572139303482587,0.715281812899477,0.7156549520766773,0.6408555838062501,0.46344505561713406,0.05,0.5567616463138851,0.5572139303482587,0.5567616463138851,0.5572139303482587,1.0,1.0,oversample,0.5,0.5,0.5020561499825644,0.5,COMPLETE
1859,0.7156549520766773,2025-11-27 11:03:36.528154,2025-11-27 11:03:37.120619,0 days 00:00:00.592465,11.508141319299991,gbtree,0.8637930956447881,3.395114382042821,lossguide,0.04387913015495211,0.005868841712642379,3,5,0.5850602549791162,500,,0.8262958093957941,0.2885599818659471,0.09404896563472047,oversample,0.7295984612771411,,7.0,0.6427354965354137,,,,0.944408493397231,,0.5567616463138851,0.5572139303482587,0.715281812899477,0.7156549520766773,0.8262958093957941,0.2885599818659471,0.08,0.4875831412304963,0.4900907105415191,0.5567616463138851,0.5572139303482587,1.0,1.0,oversample,0.3481916974750907,0.358111659790669,0.7295984612771411,0.5,COMPLETE
1860,0.0,2025-11-27 11:03:37.313340,2025-11-27 11:03:37.757021,0 days 00:00:00.443681,0.0014018558639440678,gbtree,0.5981920014054657,7.593824605373287,lossguide,0.00014074531000413983,0.027682629545003053,0,9,3.7082076005349984,300,,0.6185162728014049,0.5557096004280835,0.09994782500995682,undersample,0.7897071209428072,,5.0,0.9149251584420866,,,,0.9730973955400954,,0.44323835368611486,0.4427860696517413,0.0,0.0,0.6185162728014049,0.5557096004280835,0.08,0.5567616463138851,0.5572139303482587,0.0,0.0,0.0,0.0,undersample,0.5,0.5,0.7897071209428072,0.5,COMPLETE
1861,0.7156549520766773,2025-11-27 11:03:37.961056,2025-11-27 11:03:38.753780,0 days 00:00:00.792724,0.00032314339635888464,gbtree,0.7005588396891749,3.766069869311608,lossguide,0.0008004021193313372,0.004581418481423014,7,11,0.44982992634549435,700,,0.5096989918680441,0.6188057932696662,0.06917106852566379,oversample,0.8431567265509496,,6.0,0.8368015195446175,,,,0.5007010795225308,,0.5572139303482587,0.5572139303482587,0.7154896832316188,0.7156549520766773,0.5096989918680441,0.6188057932696662,0.08,0.5982604719986118,0.5611341895793308,0.5570135746606335,0.5572139303482587,1.0,1.0,oversample,0.49514912382499715,0.46059788015865644,0.8431567265509496,0.5,COMPLETE
1862,0.7156549520766773,2025-11-27 11:03:38.950818,2025-11-27 11:03:39.440023,0 days 00:00:00.489205,0.00038597106080618076,gbtree,0.3635912246463292,4.738897788599234,lossguide,2.1862958749022696,0.0006287535796779222,3,12,10.85833961226217,400,,0.6167387214691809,0.7413442998003856,0.0037098496526235536,oversample,0.7210648428256098,,5.0,0.6101313425777957,,,,0.9620362044266835,,0.5567616463138851,0.5572139303482587,0.715281812899477,0.7156549520766773,0.6167387214691809,0.7413442998003856,0.0,0.5118107071306145,0.520197471944217,0.5567616463138851,0.5572139303482587,1.0,1.0,oversample,0.38106981216532104,0.3866654285448974,0.7210648428256098,0.5,COMPLETE
1863,0.0,2025-11-27 11:03:39.637295,2025-11-27 11:03:40.089509,0 days 00:00:00.452214,11.170574830368716,gbtree,0.5807008501320223,3.364938083574237,lossguide,17.835931762615992,0.1493908125199914,0,9,21.72209583029124,300,,0.9148538455077857,0.2982976292015856,0.06766384962322589,undersample,0.763386251036807,,12.0,0.6600768261142764,,,,0.6193693574590629,,0.44323835368611486,0.4427860696517413,0.0,0.0,0.9148538455077857,0.2982976292015856,0.08,0.5567616463138851,0.5572139303482587,0.0,0.0,0.0,0.0,undersample,0.5,0.5,0.763386251036807,0.5,COMPLETE
1864,0.7126637554585152,2025-11-27 11:03:40.284882,2025-11-27 11:03:41.137662,0 days 00:00:00.852780,0.0007383694520640284,gbtree,0.8657796011306222,6.883857553986217,depthwise,0.00012397875231180233,0.02286076660222772,4,12,1.462230381890704,1000,,0.531602410608458,0.4653381123567377,0.005605993807075327,oversample,0.6206270762409094,,10.0,0.7198517329851263,,,,0.49497155529388587,,0.55359565807327,0.55359565807327,0.7126637554585152,0.7126637554585152,0.531602410608458,0.4653381123567377,0.0,0.47456494944986427,0.46052896302084523,0.5553539019963702,0.5556059918293237,0.9943135662063363,0.9935064935064936,oversample,0.3609592334090419,0.3420611245240969,0.6206270762409094,0.5,COMPLETE
1865,0.7156549520766773,2025-11-27 11:03:41.333490,2025-11-27 11:03:42.124296,0 days 00:00:00.790806,0.028392798297266493,gbtree,0.35904336430843087,5.376880330339259,lossguide,6.303372134429341,0.00012828262790912039,5,9,19.983246128311205,900,,0.5545838620501127,0.33104231616308477,0.06668048227723276,oversample,0.8582633952896637,,7.0,0.8393011513514819,,,,0.7324022350304413,,0.5567616463138851,0.5572139303482587,0.715281812899477,0.7156549520766773,0.5545838620501127,0.33104231616308477,0.08,0.5042123485548708,0.515597510745445,0.5567616463138851,0.5572139303482587,1.0,1.0,oversample,0.4128869013080456,0.4279964481381744,0.8582633952896637,0.5,COMPLETE
1866,0.7156549520766773,2025-11-27 11:03:42.317164,2025-11-27 11:03:47.248047,0 days 00:00:04.930883,6.145388287544458,dart,0.665692275958276,6.287130625457747,lossguide,0.0022342618963058377,0.15512864133391294,0,12,40.250681878264245,200,tree,0.8209571251231262,0.2167893961113972,0.05323350610316762,oversample,0.6258880888083334,,6.0,0.7994565995468133,0.1933927518733698,weighted,0.42938496137474463,0.24304045213944525,,0.5567616463138851,0.5572139303482587,0.715281812899477,0.7156549520766773,0.8209571251231262,0.2167893961113972,0.05,0.5567616463138851,0.5572139303482587,0.5567616463138851,0.5572139303482587,1.0,1.0,oversample,0.5,0.5,0.6258880888083334,0.5,COMPLETE
1867,0.7156549520766773,2025-11-27 11:03:47.452066,2025-11-27 11:03:47.933332,0 days 00:00:00.481266,0.00010636226382807208,gbtree,0.4267702713234841,7.042838534638232,depthwise,11.175644070294789,0.006492066652446138,1,6,0.35246430498581727,300,,0.6590752691518337,0.6478982599989077,0.0901356163685757,none,0.5604635589860264,2.993117498009141,9.0,0.8578959044871886,,,,0.3065787105078995,,0.5567616463138851,0.5572139303482587,0.715281812899477,0.7156549520766773,0.6590752691518337,0.6478982599989077,0.08,0.43416800364520536,0.43473447181527225,0.5567616463138851,0.5572139303482587,1.0,1.0,none,0.2986894676635886,0.30385207871801334,0.5604635589860264,0.5,COMPLETE
1868,0.7156549520766773,2025-11-27 11:03:48.142192,2025-11-27 11:05:36.735924,0 days 00:01:48.593732,4.340776117697817,dart,0.3502145022574791,4.585851836596073,depthwise,2.7208038236795344,0.019644957023469193,5,7,19.064612043399876,900,tree,0.8877684361504844,0.763728170612298,0.06397270437316123,none,0.6358406790658724,1.5300329758546594,12.0,0.8766993952399136,0.02929101158684666,uniform,0.699806874897485,0.567205911617911,,0.5567616463138851,0.5572139303482587,0.715281812899477,0.7156549520766773,0.8877684361504844,0.763728170612298,0.05,0.46180259759645104,0.46078143546530703,0.5567616463138851,0.5572139303482587,1.0,1.0,none,0.3599069115867306,0.3615942918164573,0.6358406790658724,0.5,COMPLETE
1869,0.7156549520766773,2025-11-27 11:05:36.938907,2025-11-27 11:06:05.633506,0 days 00:00:28.694599,3.0651455193226176,dart,0.6315600910491646,9.297235523838182,depthwise,0.13769632660693124,0.3873336061244046,6,4,29.891449032991215,500,tree,0.8147431002428638,0.610381830064362,0.007775737697313989,none,0.5657310682953531,1.229769937477642,10.0,0.9232802324080158,0.19636763221606995,weighted,0.1478948747529701,0.6155712302194268,,0.5567616463138851,0.5572139303482587,0.715281812899477,0.7156549520766773,0.8147431002428638,0.610381830064362,0.0,0.5038215812249132,0.5034142838757744,0.5567616463138851,0.5572139303482587,1.0,1.0,none,0.3845960642583598,0.38535793879256597,0.5657310682953531,0.5,COMPLETE
1870,0.7156549520766773,2025-11-27 11:06:05.842092,2025-11-27 11:07:04.703888,0 days 00:00:58.861796,0.013986825229667833,dart,0.7097485321695254,9.000573049353441,depthwise,1.5095968345321986,0.01310351351352171,8,10,26.416324153840606,700,forest,0.8706666439604444,0.2756011091376678,0.0829516640558441,oversample,0.5531263749954952,,10.0,0.6932563838573533,0.11093724341387523,weighted,0.04904114592639271,0.4239825884822865,,0.5567616463138851,0.5572139303482587,0.715281812899477,0.7156549520766773,0.8706666439604444,0.2756011091376678,0.08,0.5634602230989093,0.5469593476952856,0.5567616463138851,0.5572139303482587,1.0,1.0,oversample,0.48339785142326636,0.46080722775692134,0.5531263749954952,0.5,COMPLETE
1871,0.5122615803814714,2025-11-27 11:07:04.906700,2025-11-27 11:07:39.748190,0 days 00:00:34.841490,0.005061431606392069,dart,0.35184305231070634,4.646399700689676,depthwise,0.130721112405878,0.00025744348196297327,2,11,15.894260161498135,600,tree,0.5470155702517714,0.4372296031554797,0.07227287544489251,undersample,0.8063440741753953,,6.0,0.7686397513062816,0.48089795630299564,uniform,0.40267285423439303,0.41525052294608955,,0.5264586160108549,0.514246947082768,0.533630289532294,0.5122615803814714,0.5470155702517714,0.4372296031554797,0.08,0.5862229854979109,0.568547776100947,0.5907297830374754,0.5814432989690722,0.48659626320064986,0.4577922077922078,undersample,0.5547679835541041,0.5336344898717218,0.8063440741753953,0.5,COMPLETE
1872,0.42349457058242845,2025-11-27 11:07:39.944881,2025-11-27 11:07:40.969579,0 days 00:00:01.024698,0.4089860870953208,gbtree,0.6246850605447004,4.120593377116154,depthwise,0.0036115086785606237,0.00024907338147671674,0,10,9.885177488932392,1000,,0.5996189537442259,0.33982742946570077,0.07904622642826706,undersample,0.6743694570834995,,10.0,0.8621008546241407,,,,0.4417521338714616,,0.4758028041610131,0.47173224785165085,0.4293451501723289,0.42349457058242845,0.5996189537442259,0.33982742946570077,0.08,0.5650043671458626,0.5643999792592819,0.545,0.5403022670025189,0.35418359057676685,0.3482142857142857,undersample,0.5240624844576336,0.5173688033110914,0.6743694570834995,0.5,COMPLETE
1873,0.7156549520766773,2025-11-27 11:07:41.171608,2025-11-27 11:07:41.871917,0 days 00:00:00.700309,0.5284982369863053,gbtree,0.2543863328407236,4.543027437485102,depthwise,37.068140783522914,0.005663461801531655,6,7,36.497416765097775,700,,0.7732667936878794,0.43001190260055333,0.0158896438494607,oversample,0.7157930348350962,,7.0,0.6154609838978589,,,,0.26833943437691493,,0.5567616463138851,0.5572139303482587,0.715281812899477,0.7156549520766773,0.7732667936878794,0.43001190260055333,0.02,0.3952574610027833,0.3966783772595096,0.5567616463138851,0.5572139303482587,1.0,1.0,oversample,0.1857951060196621,0.18554000902060147,0.7157930348350962,0.5,COMPLETE
1874,0.7156549520766773,2025-11-27 11:07:42.073045,2025-11-27 11:09:08.035522,0 days 00:01:25.962477,0.0004697083513701216,dart,0.22536256916885852,6.517763473952897,lossguide,0.232603720193843,0.0006952790110671996,10,5,7.649771839380182,800,tree,0.6507487395668996,0.6177535007914232,0.06882168777089945,none,0.6322794348594691,1.6548829541953798,10.0,0.8703407620384487,0.04395778339202272,weighted,0.8155916606020838,0.4285761187132724,,0.5567616463138851,0.5572139303482587,0.715281812899477,0.7156549520766773,0.6507487395668996,0.6177535007914232,0.08,0.5569231558590761,0.5463579560861883,0.5567616463138851,0.5572139303482587,1.0,1.0,none,0.46713556259221806,0.4511279068224932,0.6322794348594691,0.5,COMPLETE
1875,0.7156549520766773,2025-11-27 11:09:08.233725,2025-11-27 11:10:28.884285,0 days 00:01:20.650560,0.31022588587615796,dart,0.6611037639885091,4.941364782806675,depthwise,0.00013830455625743934,0.0006585319943228431,1,5,2.8507585754332503,800,tree,0.6376817251899117,0.8681019652701665,0.03011881362852883,none,0.5343634080594345,1.967047005011347,8.0,0.6802047583311771,0.10325934439478823,uniform,0.2758833521209964,0.5341931458404519,,0.5567616463138851,0.5572139303482587,0.715281812899477,0.7156549520766773,0.6376817251899117,0.8681019652701665,0.02,0.6344748284480436,0.6115124557586373,0.5567616463138851,0.5572139303482587,1.0,1.0,none,0.6177174687909281,0.5840051802130454,0.5343634080594345,0.5,COMPLETE
1876,0.45093346098611775,2025-11-27 11:10:29.083325,2025-11-27 11:10:58.627683,0 days 00:00:29.544358,1.87942334378709,dart,0.7436457918919943,9.283330925386885,lossguide,6.137282169991642,0.3788417662917761,8,12,0.19531790351292347,500,tree,0.5636969463994587,0.41552079820868737,0.07785880290226876,undersample,0.712704273827264,,10.0,0.6067676867979621,0.16001179502987462,uniform,0.16651169282190087,0.4902287850827114,,0.49615558570782453,0.48123021257349613,0.4760112888052681,0.45093346098611775,0.5636969463994587,0.41552079820868737,0.08,0.5595942495409835,0.5568746920921099,0.5653631284916201,0.5495915985997666,0.4110479285134037,0.3823051948051948,undersample,0.4960804224207961,0.4794006108804373,0.712704273827264,0.5,COMPLETE
1877,0.7156549520766773,2025-11-27 11:10:58.826981,2025-11-27 11:11:03.792612,0 days 00:00:04.965631,0.7501630773386471,dart,0.5592940353650644,8.561173411486967,lossguide,0.0004637387445130719,0.006949135433311601,3,11,0.22547695298070264,200,forest,0.744571475587276,0.6850818127136195,0.02303523796379018,none,0.8116865681077283,1.0196071275182088,8.0,0.8655357127551175,0.19384742326414578,uniform,0.17963619371209605,0.396174050087771,,0.5567616463138851,0.5572139303482587,0.715281812899477,0.7156549520766773,0.744571475587276,0.6850818127136195,0.02,0.441140107205904,0.43844887705816354,0.5567616463138851,0.5572139303482587,1.0,1.0,none,0.29938742353155723,0.29413627741002607,0.8116865681077283,0.5,COMPLETE
1878,0.7156549520766773,2025-11-27 11:11:03.990401,2025-11-27 11:11:04.703178,0 days 00:00:00.712777,63.44501123519197,gbtree,0.4504445096837544,8.139319337481362,depthwise,0.02629558887758289,0.0011548003256328008,10,4,3.9960439423833596,700,,0.87142369049104,0.5931175458814457,0.022891553502815187,undersample,0.5241735970006839,,12.0,0.8905755948329125,,,,0.7323204557901086,,0.5567616463138851,0.5572139303482587,0.715281812899477,0.7156549520766773,0.87142369049104,0.5931175458814457,0.02,0.5567616463138851,0.5572139303482587,0.5567616463138851,0.5572139303482587,1.0,1.0,undersample,0.5,0.5,0.5241735970006839,0.5,COMPLETE
1879,0.525438596491228,2025-11-27 11:11:04.899810,2025-11-27 11:11:05.606691,0 days 00:00:00.706881,0.011286839375912662,gbtree,0.3639753750766194,3.989347229262198,lossguide,0.27056703158914713,0.10558554811983939,6,3,1.3487078198009355,700,,0.7379306369641638,0.34290373331503715,0.06947589432350375,undersample,0.61801690068624,,12.0,0.8154288923965162,,,,0.4401881919343774,,0.5074626865671642,0.5106286748077793,0.5101214574898786,0.525438596491228,0.7379306369641638,0.34290373331503715,0.08,0.5511418119461758,0.5483845985358275,0.5715725806451613,0.5715648854961832,0.4606011372867587,0.4862012987012987,undersample,0.5103176445232845,0.5082445644243396,0.61801690068624,0.5,COMPLETE
1880,0.43572778827977315,2025-11-27 11:11:05.809427,2025-11-27 11:11:27.955881,0 days 00:00:22.146454,0.06192433412315136,dart,0.2565766796906086,1.479745766615994,depthwise,0.5139106967494131,0.0005324924296343206,2,6,3.4978808829419914,400,forest,0.8960759142791261,0.7478812434396718,0.03654101824741816,undersample,0.5444023282534437,,6.0,0.6068121236466053,0.2503918572530869,uniform,0.8368388070062601,0.6994495144249719,,0.48077792853912255,0.4599728629579376,0.4670380687093779,0.43572778827977315,0.8960759142791261,0.7478812434396718,0.05,0.5280026937089273,0.5124456660327912,0.5449620801733478,0.5214932126696833,0.40861088545897645,0.3741883116883117,undersample,0.49695701188680186,0.47067309605614,0.5444023282534437,0.5,COMPLETE
1881,0.0,2025-11-27 11:11:28.156599,2025-11-27 11:11:28.543902,0 days 00:00:00.387303,0.015353619441443455,gbtree,0.7315994544270477,2.068744951796735,depthwise,0.0008247342677592588,0.02064038410073346,0,6,94.41891799678993,200,,0.7029229794355568,0.31733825582031483,0.010006356442883158,undersample,0.5917234995219083,,8.0,0.8034786430914863,,,,0.6407301033501845,,0.44323835368611486,0.4427860696517413,0.0,0.0,0.7029229794355568,0.31733825582031483,0.02,0.5567616463138851,0.5572139303482587,0.0,0.0,0.0,0.0,undersample,0.5,0.5,0.5917234995219083,0.5,COMPLETE
1882,0.7156549520766773,2025-11-27 11:11:28.743796,2025-11-27 11:11:33.799693,0 days 00:00:05.055897,8.756475676201896,dart,0.8208245197570461,4.58911006771472,lossguide,0.06508146719835457,0.4137719655371358,3,6,0.10160820709118037,200,forest,0.5049113310796673,0.8111917927157888,0.07417424111095788,oversample,0.7491649988774028,,6.0,0.6372741387018058,0.40407776484543895,weighted,0.3626525509131043,0.4321815254484583,,0.5567616463138851,0.5572139303482587,0.715281812899477,0.7156549520766773,0.5049113310796673,0.8111917927157888,0.08,0.4993938539507443,0.4926550504359098,0.5567616463138851,0.5572139303482587,1.0,1.0,oversample,0.4531287819758285,0.4434421553931258,0.7491649988774028,0.5,COMPLETE
1883,0.35248672139063253,2025-11-27 11:11:34.006736,2025-11-27 11:11:34.875753,0 days 00:00:00.869017,0.2260680275141566,gbtree,0.8128706020009613,5.724806300854771,lossguide,1.5784896700930546,0.0004235034952650436,2,11,0.21754688143435225,900,,0.7524661319462456,0.5528676609570162,0.09972844230304166,undersample,0.535141353844332,,7.0,0.6430003046953267,,,,0.22215189318485634,,0.3984622342831298,0.39348710990502034,0.36666666666666664,0.35248672139063253,0.7524661319462456,0.5528676609570162,0.08,0.48711957839725795,0.4831013104602077,0.4430379746835443,0.43504171632896305,0.31275385865150285,0.2962662337662338,undersample,0.4373319352111275,0.42045703275274265,0.535141353844332,0.5,COMPLETE
