number,value,datetime_start,datetime_complete,duration,params_alpha,params_booster,params_colsample_bytree,params_gamma,params_grow_policy,params_lambda,params_learning_rate,params_max_delta_step,params_max_depth,params_min_child_weight,params_n_estimators,params_normalize_type,params_params_feature_fraction,params_params_labeled_ratio,params_params_missing_rate,params_params_resampling,params_params_sample_rows,params_params_scale_pos_weight,params_params_selftrain_max_iter,params_params_selftrain_threshold,params_rate_drop,params_sample_type,params_skip_drop,params_subsample,params_user_attrs_decision_threshold,user_attrs_acc_test,user_attrs_acc_val,user_attrs_f1_test,user_attrs_f1_val,user_attrs_feature_fraction,user_attrs_labeled_ratio,user_attrs_missing_rate,user_attrs_pr_auc_test,user_attrs_pr_auc_val,user_attrs_prec_test,user_attrs_prec_val,user_attrs_rec_test,user_attrs_rec_val,user_attrs_resampling_strategy,user_attrs_roc_auc_test,user_attrs_roc_auc_val,user_attrs_sample_rows,user_attrs_user_attrs_decision_threshold,state
1299,0.677555958862674,2025-11-27 01:52:45.683183,2025-11-27 01:52:50.044782,0 days 00:00:04.361599,0.2925984023124886,gbtree,0.6232183773076678,1.1908532524325202,lossguide,0.008437215926020295,0.03356312207595318,7,10,18.584789778087707,900,,0.7950692833938429,0.40031591830096885,0.089214335800723,oversample,0.8316419377072841,,8.0,0.6638356946299583,,,,0.9239395290270596,0.37475887074141806,0.5232926277702397,0.5178652193577566,0.6821471652593486,0.677555958862674,0.7950692833938429,0.40031591830096885,0.08,0.4253399384475024,0.42425961628983333,0.5424460431654676,0.5400192864030858,0.9187652315190902,0.9090909090909091,oversample,0.27955039042424445,0.27428888144541874,0.8316419377072841,0.37475887074141806,COMPLETE
1300,0.7156549520766773,2025-11-27 01:52:50.222104,2025-11-27 01:52:51.976740,0 days 00:00:01.754636,0.38218824958057895,gbtree,0.6061612752058388,2.1796318122978207,lossguide,0.003830900326772857,0.00027956440419346044,6,10,8.552958665635835,900,,0.846909171412792,0.26265859598651964,0.06616529805710514,oversample,0.8119363978067013,,7.0,0.6648917898709031,,,,0.5153661296412001,0.35202228335165625,0.5567616463138851,0.5572139303482587,0.715281812899477,0.7156549520766773,0.846909171412792,0.26265859598651964,0.08,0.5804444816857378,0.5789163607082433,0.5567616463138851,0.5572139303482587,1.0,1.0,oversample,0.5059894063230491,0.50608973508616,0.8119363978067013,0.35202228335165625,COMPLETE
1301,0.7156549520766773,2025-11-27 01:52:52.150352,2025-11-27 01:53:45.704961,0 days 00:00:53.554609,1.5849179585055544,dart,0.5965627400877002,3.090022065141132,lossguide,2.835244565581293,0.04390287224654603,10,6,32.862939253297945,700,forest,0.9225852583312703,0.6086274196706557,0.03267284960374714,oversample,0.6030129647179544,,8.0,0.6523419165169646,0.1994813055390784,uniform,0.11836562400739409,0.3020319049250822,0.27230250316311366,0.5567616463138851,0.5572139303482587,0.715281812899477,0.7156549520766773,0.9225852583312703,0.6086274196706557,0.02,0.5614306410457119,0.5515014530409565,0.5567616463138851,0.5572139303482587,1.0,1.0,oversample,0.5143549296241648,0.5060756403963759,0.6030129647179544,0.27230250316311366,COMPLETE
1302,0.36140546569994425,2025-11-27 01:53:45.884910,2025-11-27 01:53:51.060958,0 days 00:00:05.176048,0.004879599516241333,gbtree,0.3005291578005357,0.9874202014738026,lossguide,0.1517664201170899,0.015658430261080863,7,10,2.01481081647531,500,,0.7951691240342046,0.2429904296562837,0.07502267466454593,oversample,0.5726106229162087,,7.0,0.7872494883827582,,,,0.5374983379240555,0.8613133382663055,0.4834916327453641,0.48213478064224335,0.36766334440753046,0.36140546569994425,0.7951691240342046,0.2429904296562837,0.08,0.5994630206614063,0.5935224347685815,0.577391304347826,0.5775401069518716,0.2696994313566206,0.262987012987013,oversample,0.5483268124471559,0.5372004463871165,0.5726106229162087,0.8613133382663055,COMPLETE
1303,0.7156549520766773,2025-11-27 01:53:51.234964,2025-11-27 01:54:11.191914,0 days 00:00:19.956950,0.00865367530538474,dart,0.3882148714133321,5.904457116305437,lossguide,2.1402427361745295,0.029096871653581314,9,10,0.9112407410866514,400,forest,0.8878815002828265,0.13227860576449824,0.08431235606670238,oversample,0.5675365759545015,,5.0,0.792378290173104,0.09581220211641744,uniform,0.24952681678487787,0.297490590376113,0.23205148915781348,0.5567616463138851,0.5572139303482587,0.715281812899477,0.7156549520766773,0.8878815002828265,0.13227860576449824,0.08,0.46309296497260666,0.4548428206468182,0.5567616463138851,0.5572139303482587,1.0,1.0,oversample,0.36263242096188597,0.35574955560272215,0.5675365759545015,0.23205148915781348,COMPLETE
1304,0.7077826725403817,2025-11-27 01:54:11.370290,2025-11-27 01:54:49.567363,0 days 00:00:38.197073,0.5612179829046249,dart,0.766712878465903,3.1146055801922095,depthwise,0.15786123873469873,0.010245820438288823,0,3,0.2610553987530167,500,tree,0.9679091751182272,0.7000610336241263,0.019519527039401574,oversample,0.8651352302606832,,5.0,0.6624041490588448,0.48435877248948633,uniform,0.43870324239745634,0.3115077750392135,0.4965439958727393,0.550429669832655,0.5499773857982814,0.7078189300411523,0.7077826725403817,0.9679091751182272,0.7000610336241263,0.02,0.5104326737234037,0.4960575634749661,0.5545831414094887,0.5545329038196042,0.9780666125101544,0.9780844155844156,oversample,0.4624575175317893,0.4404287936272104,0.8651352302606832,0.4965439958727393,COMPLETE
1305,0.7156549520766773,2025-11-27 01:54:49.747198,2025-11-27 01:55:36.328676,0 days 00:00:46.581478,0.41616115462440967,dart,0.7152991653517548,0.9010733123613826,lossguide,0.004879779079895312,0.008821589459136839,9,4,20.954732173813408,600,tree,0.9460687974340083,0.47149167147215615,0.014673583116388776,none,0.7408623258064477,1.7061932956557873,7.0,0.8851781399777714,0.09266106568196333,uniform,0.24224027623417443,0.2745301069891666,0.30788646987034596,0.5567616463138851,0.5572139303482587,0.715281812899477,0.7156549520766773,0.9460687974340083,0.47149167147215615,0.02,0.5651102714615348,0.5492452963957134,0.5567616463138851,0.5572139303482587,1.0,1.0,none,0.5578524179777515,0.5293683589138134,0.7408623258064477,0.30788646987034596,COMPLETE
1306,0.7156549520766773,2025-11-27 01:55:36.516371,2025-11-27 01:55:37.709377,0 days 00:00:01.193006,2.285276919101424,gbtree,0.4227952206234771,0.6608767823526506,lossguide,4.542532431584876,0.0014413163183034999,7,11,3.129837460540003,400,,0.817895596593184,0.1840825715605319,0.08200327244025049,oversample,0.637308260486366,,8.0,0.6313158140387258,,,,0.9086650446396574,0.39144777094587024,0.5567616463138851,0.5572139303482587,0.715281812899477,0.7156549520766773,0.817895596593184,0.1840825715605319,0.08,0.5183222537089381,0.5138843246804805,0.5567616463138851,0.5572139303482587,1.0,1.0,oversample,0.4782705283575656,0.4741428770412427,0.637308260486366,0.39144777094587024,COMPLETE
1307,0.7156549520766773,2025-11-27 01:55:37.892426,2025-11-27 01:55:38.937517,0 days 00:00:01.045091,0.00028143907670530343,gbtree,0.9650664101298969,3.145541305611574,lossguide,0.003505657032047943,0.1648622509041072,2,3,0.3776288523572396,200,,0.9527465786538836,0.7173738533371533,0.09283437160794054,oversample,0.6349432715940742,,5.0,0.7985598821797302,,,,0.3803885866867468,0.08939739199950425,0.5567616463138851,0.5572139303482587,0.715281812899477,0.7156549520766773,0.9527465786538836,0.7173738533371533,0.1,0.5303699930741796,0.5295463496651597,0.5567616463138851,0.5572139303482587,1.0,1.0,oversample,0.48308244500074604,0.4899927702532402,0.6349432715940742,0.08939739199950425,COMPLETE
1308,0.7143688190808609,2025-11-27 01:55:39.123139,2025-11-27 01:55:44.400692,0 days 00:00:05.277553,0.41064358870923284,gbtree,0.7069813922087401,1.3699743658919723,lossguide,0.3478915719071362,0.027591712737249443,0,4,1.46221970779138,600,,0.6867712974272364,0.7495173277947954,0.048982504487115795,none,0.7876312667276147,3.6763040023746942,8.0,0.7316605959764457,,,,0.25012572824984514,0.4860859710930181,0.5549525101763908,0.555857078245138,0.7131195335276967,0.7143688190808609,0.6867712974272364,0.7495173277947954,0.05,0.5989608715693386,0.5857918823387329,0.5561618917689859,0.556663644605621,0.9935012185215272,0.9967532467532467,none,0.5432774084451002,0.5454114322857939,0.7876312667276147,0.4860859710930181,COMPLETE
1309,0.7156549520766773,2025-11-27 01:55:44.577493,2025-11-27 01:55:46.640104,0 days 00:00:02.062611,0.04264380313886665,gbtree,0.7830276540265518,2.0824456950422423,lossguide,0.32651216943010547,0.03906840362363857,10,8,29.04223621961951,400,,0.7172599625717988,0.580661100150368,0.01970643849740293,none,0.8458466304052653,1.5422065059186774,5.0,0.7506641228539351,,,,0.37288006145810204,0.17283969041892955,0.5567616463138851,0.5572139303482587,0.715281812899477,0.7156549520766773,0.7172599625717988,0.580661100150368,0.02,0.5249801194742566,0.525466714984169,0.5567616463138851,0.5572139303482587,1.0,1.0,none,0.4691469520383295,0.4690306501465848,0.8458466304052653,0.17283969041892955,COMPLETE
1310,0.7161572052401747,2025-11-27 01:55:46.822015,2025-11-27 01:57:47.988399,0 days 00:02:01.166384,0.12398564688047263,dart,0.7189991460352014,2.5437751628529055,lossguide,1.8009792835162284,0.09015203145116242,9,4,12.000534792058728,700,tree,0.944992285579742,0.34060408741657755,0.007781212571511752,oversample,0.6835193435542443,,8.0,0.7882860702306402,0.16568833672045835,weighted,0.3946931619456437,0.3245084854339055,0.2928711237934185,0.5594753505201266,0.5590230664857531,0.716365754222481,0.7161572052401747,0.944992285579742,0.34060408741657755,0.0,0.6069907981506864,0.5948213923472034,0.5583295506128008,0.5583295506128008,0.9991876523151909,0.9983766233766234,oversample,0.5589063976524811,0.5461460143533688,0.6835193435542443,0.2928711237934185,COMPLETE
1311,0.7156549520766773,2025-11-27 01:57:48.169603,2025-11-27 01:57:49.166608,0 days 00:00:00.997005,0.06472229224883415,gbtree,0.7827828374918823,4.994082400143722,lossguide,0.37830477782735367,0.014764825324975523,8,8,47.629511072558444,800,,0.9163186699761998,0.7278222822919296,0.09464166023241447,oversample,0.9491979936377127,,11.0,0.7258009766001481,,,,0.7628927725212384,0.15599711001738642,0.5567616463138851,0.5572139303482587,0.715281812899477,0.7156549520766773,0.9163186699761998,0.7278222822919296,0.1,0.48207891027289423,0.48235011733646765,0.5567616463138851,0.5572139303482587,1.0,1.0,oversample,0.42625250750178223,0.4275362979716912,0.9491979936377127,0.15599711001738642,COMPLETE
1312,0.6309235558630232,2025-11-27 01:57:49.349443,2025-11-27 02:08:28.494135,0 days 00:10:39.144692,0.22204801882320407,dart,0.6715016731897036,1.404954448423734,depthwise,0.012589031258859589,0.19106586483956195,10,4,3.699104666579903,1000,tree,0.9087971716365593,0.4144204746512916,0.004902272382693645,oversample,0.6749038617450752,,9.0,0.8474190082803417,0.11860940789493106,weighted,0.44667250654702045,0.6648222985554717,0.41362315536189326,0.5151515151515151,0.5174129353233831,0.6308539944903582,0.6309235558630232,0.9087971716365593,0.4144204746512916,0.0,0.566450389112914,0.5658680939933123,0.5475194261805141,0.5497287522603979,0.7441104792851341,0.7402597402597403,oversample,0.4905833982658864,0.5007652587453405,0.6749038617450752,0.41362315536189326,COMPLETE
1313,0.7156549520766773,2025-11-27 02:08:28.680020,2025-11-27 02:09:16.709210,0 days 00:00:48.029190,1.1861751109975511,dart,0.5758036060437242,5.0349564676279845,lossguide,66.91961135381585,0.18001435694189685,9,4,3.1798333697572327,600,tree,0.9225096690176583,0.31522173312571433,0.01649603167167866,oversample,0.5417327690683075,,11.0,0.8398947006277847,0.0048510195014244695,weighted,0.3766960985448573,0.5486637400405698,0.19779370755472608,0.5567616463138851,0.5572139303482587,0.715281812899477,0.7156549520766773,0.9225096690176583,0.31522173312571433,0.02,0.46090857196959295,0.45381241900218183,0.5567616463138851,0.5572139303482587,1.0,1.0,oversample,0.24491578109716672,0.2198808915803298,0.5417327690683075,0.19779370755472608,COMPLETE
1314,0.6712759270898806,2025-11-27 02:09:16.893484,2025-11-27 02:11:40.679452,0 days 00:02:23.785968,0.006044563588622931,dart,0.7712315786975903,1.692008745092528,depthwise,2.6934378467125892,0.11365629110808456,8,6,13.418828511906142,500,tree,0.9640691654440418,0.2527308412488378,0.0056269193562057595,oversample,0.6379697192887135,,8.0,0.6988712283454382,0.10190148696148725,weighted,0.29014183511559843,0.4453484702430853,0.33193321735583364,0.5241971958389868,0.5269109000452284,0.6693903205531112,0.6712759270898806,0.9640691654440418,0.2527308412488378,0.0,0.529785370369276,0.5334005730285556,0.5458739108149667,0.5476923076923077,0.8651502843216897,0.8668831168831169,oversample,0.4676760224804788,0.47022040778424845,0.6379697192887135,0.33193321735583364,COMPLETE
1315,0.7156549520766773,2025-11-27 02:11:40.861477,2025-11-27 02:11:41.941480,0 days 00:00:01.080003,62.910339093032526,gbtree,0.6135477242830525,3.0406117825454007,lossguide,0.017530034419368446,0.017738445002314324,4,6,35.981497917156894,1000,,0.6726055622173667,0.3980509201083433,0.09982625494666159,oversample,0.7804768493078159,,6.0,0.7118765896944445,,,,0.6991448360709543,0.5027801292340439,0.5567616463138851,0.5572139303482587,0.715281812899477,0.7156549520766773,0.6726055622173667,0.3980509201083433,0.1,0.5567616463138851,0.5572139303482587,0.5567616463138851,0.5572139303482587,1.0,1.0,oversample,0.5,0.5,0.7804768493078159,0.5027801292340439,COMPLETE
1316,0.7129116875546488,2025-11-27 02:11:42.125093,2025-11-27 02:20:04.306857,0 days 00:08:22.181764,2.322629223519259,dart,0.8033446768294223,2.2336081471027147,lossguide,9.662588968120996,0.2514266395235499,10,5,9.914153451437691,1000,tree,0.8999637705181751,0.40384455706893996,0.003468461611199949,oversample,0.7369547696826981,,7.0,0.7035986643705361,0.14366020632842083,weighted,0.41554566753436184,0.3470503688755409,0.15266037993809428,0.5554047942107644,0.5545002261420172,0.7138282387190684,0.7129116875546488,0.8999637705181751,0.40384455706893996,0.0,0.5641303624447798,0.5545352417282368,0.5562613430127041,0.5561618917689859,0.9959382615759546,0.9926948051948052,oversample,0.500300071287654,0.49474931350569756,0.7369547696826981,0.15266037993809428,COMPLETE
1317,0.7156549520766773,2025-11-27 02:20:04.500737,2025-11-27 02:20:36.368582,0 days 00:00:31.867845,2.148049121196884,dart,0.5288799263750177,0.5855514868324785,lossguide,6.392398706548486,0.18736472756583594,9,6,16.57782631951643,500,tree,0.9761709450267098,0.2494040693017297,0.01327228583097808,oversample,0.7955381156514513,,7.0,0.8725119454305289,0.15308401617883138,weighted,0.33756236028986847,0.35775053322650663,0.2653371738578269,0.5567616463138851,0.5572139303482587,0.715281812899477,0.7156549520766773,0.9761709450267098,0.2494040693017297,0.02,0.41865394030495084,0.42104145843390406,0.5567616463138851,0.5572139303482587,1.0,1.0,oversample,0.27222765629403667,0.27918388429752067,0.7955381156514513,0.2653371738578269,COMPLETE
1318,0.0,2025-11-27 02:20:36.561197,2025-11-27 02:20:37.419219,0 days 00:00:00.858022,44.41909869813815,gbtree,0.4456455906955985,3.206990827823927,lossguide,0.05583411946123649,0.016869080883957763,6,10,16.13176691717789,600,,0.9279421330913238,0.2619001535175465,0.08009054621535355,oversample,0.8936856411766775,,10.0,0.6686604335578337,,,,0.6000904382150483,0.7217195823000007,0.44323835368611486,0.4427860696517413,0.0,0.0,0.9279421330913238,0.2619001535175465,0.08,0.5567616463138851,0.5572139303482587,0.0,0.0,0.0,0.0,oversample,0.5,0.5,0.8936856411766775,0.7217195823000007,COMPLETE
1319,0.7156549520766773,2025-11-27 02:20:37.602356,2025-11-27 02:20:43.979803,0 days 00:00:06.377447,9.684743365931855,gbtree,0.5065341085473923,1.0349686584613709,lossguide,0.0007735535186401169,0.005087318985781609,9,7,0.5033994950070162,1000,,0.814083759375064,0.9076010226856365,0.06021020798792252,oversample,0.9667663561346282,,7.0,0.610150034075093,,,,0.5113923748768036,0.37865866809875015,0.5567616463138851,0.5572139303482587,0.715281812899477,0.7156549520766773,0.814083759375064,0.9076010226856365,0.05,0.4851043593010373,0.47543554109498526,0.5567616463138851,0.5572139303482587,1.0,1.0,oversample,0.43258094464430774,0.4167745877717788,0.9667663561346282,0.37865866809875015,COMPLETE
1320,0.5042928151830095,2025-11-27 02:20:44.159403,2025-11-27 02:23:55.054086,0 days 00:03:10.894683,0.06719347610856936,dart,0.8710950763303532,1.3481355992089306,lossguide,0.009351161848642655,0.04159138675628571,2,6,3.422550567847808,700,tree,0.9931256013918947,0.7429455518583854,0.028908064376278055,none,0.9716992486518066,2.000915535560365,5.0,0.6298376407307007,0.19020723168600193,weighted,0.43883902542995645,0.2917007382060834,0.8010386778779451,0.5056535504296699,0.5038444142921755,0.5178650198500221,0.5042928151830095,0.9931256013918947,0.7429455518583854,0.02,0.556642000987233,0.547672300870346,0.5666023166023166,0.5688073394495413,0.4768480909829407,0.45292207792207795,none,0.5093316367976923,0.5052755594762746,0.9716992486518066,0.8010386778779451,COMPLETE
1321,0.6764346764346765,2025-11-27 02:23:55.258147,2025-11-27 02:24:26.371204,0 days 00:00:31.113057,0.005777475732139301,dart,0.578730138032194,3.070210409877262,lossguide,9.72100441529313,0.06510258834156234,9,4,49.8282039351488,500,tree,0.8337977663145495,0.6810617379433396,0.022019764753125663,oversample,0.7968955089948134,,5.0,0.7287066746674328,0.1468979422612743,weighted,0.4874942603902533,0.432911769870959,0.5041953397578174,0.5169606512890095,0.5205789235639982,0.673992673992674,0.6764346764346765,0.8337977663145495,0.6810617379433396,0.02,0.5005213657835781,0.522897547806151,0.5398533007334964,0.5420743639921722,0.8968318440292445,0.8993506493506493,oversample,0.40721497372303916,0.4292139806057068,0.7968955089948134,0.5041953397578174,COMPLETE
1322,0.6247933884297521,2025-11-27 02:24:26.555131,2025-11-27 02:25:45.037447,0 days 00:01:18.482316,0.00013787475761925738,dart,0.8849431032907692,6.53294627111706,lossguide,5.870135184666173,0.02368568768966075,7,7,9.561715236633047,800,tree,0.9218477081835016,0.1529145795828351,0.004949176404548221,oversample,0.7625443923472275,,9.0,0.8500782082152764,0.14914657401769452,weighted,0.43696610293951377,0.2815732717790955,0.5337879459069492,0.48530076888285845,0.4866576209859792,0.6229290921139827,0.6247933884297521,0.9218477081835016,0.1529145795828351,0.0,0.48903589281072285,0.4745469583929938,0.5260212646894236,0.5270496374790853,0.7636068237205524,0.7670454545454546,oversample,0.3811601651221008,0.36936046588753435,0.7625443923472275,0.5337879459069492,COMPLETE
1323,0.0,2025-11-27 02:25:45.220797,2025-11-27 02:25:47.697332,0 days 00:00:02.476535,0.12928678907893623,gbtree,0.7244914298521106,0.9083521915187497,lossguide,0.0026294591664620883,0.001183583986499791,7,8,16.792576339620954,600,,0.8244147641214713,0.7035581884328164,0.09175310312831832,oversample,0.6791663504864276,,7.0,0.6745701965584585,,,,0.7331692526918349,0.6252786943719644,0.44323835368611486,0.4427860696517413,0.0,0.0,0.8244147641214713,0.7035581884328164,0.1,0.5575759740844658,0.5616521599710719,0.0,0.0,0.0,0.0,oversample,0.5228410616886885,0.535343678282902,0.6791663504864276,0.6252786943719644,COMPLETE
1324,0.7062200956937799,2025-11-27 02:25:47.883977,2025-11-27 02:30:48.880239,0 days 00:05:00.996262,0.011948602368784882,dart,0.7076831388710153,0.4850653042209063,lossguide,2.6278527258752202,0.13985884561286566,6,4,8.143584644978931,700,tree,0.9430697932457942,0.4642360345056194,0.019375836899380855,oversample,0.6772247168798895,,9.0,0.7048398151971234,0.21022612949489622,weighted,0.47641703479766184,0.5095243565378744,0.23265664433472527,0.5893260967887833,0.5834464043419267,0.7095329494561741,0.7062200956937799,0.9430697932457942,0.4642360345056194,0.02,0.5937990441057132,0.5958853673574451,0.5852242744063324,0.581713084603258,0.90089358245329,0.898538961038961,oversample,0.5629983918831545,0.5674115848400832,0.6772247168798895,0.23265664433472527,COMPLETE
1325,0.6912470023980816,2025-11-27 02:30:49.068017,2025-11-27 02:32:07.428045,0 days 00:01:18.360028,0.034998734206440556,dart,0.8261981373577685,0.264043765395237,depthwise,0.011475388468789798,0.003747144001938376,1,3,0.45301575627355595,800,tree,0.8047622093675708,0.8899834351619451,0.049819224754895225,none,0.6881573573753557,4.991331017983346,8.0,0.6012931158509369,0.1763550862131884,uniform,0.40074891614063696,0.21053078641393846,0.8515740122534122,0.5368611488014473,0.5341474445952058,0.6930455635491607,0.6912470023980816,0.8047622093675708,0.8899834351619451,0.05,0.4331821766325027,0.43229817929937764,0.5491686460807601,0.5480038022813688,0.9390739236393176,0.9358766233766234,none,0.32254637842139294,0.31760642319886445,0.6881573573753557,0.8515740122534122,COMPLETE
1326,0.013856812933025405,2025-11-27 02:32:07.607018,2025-11-27 02:32:08.470740,0 days 00:00:00.863722,0.33995131332156864,gbtree,0.6956851913082895,4.377983148387433,lossguide,0.0029798271864473797,0.009352438405888277,8,7,30.95197544390117,600,,0.7473074039896607,0.34692008483740944,0.08175609259151759,oversample,0.786617105665838,,7.0,0.6185783047634188,,,,0.45106329108493365,0.5877872845187697,0.42107643600180916,0.4206241519674355,0.016897081413210446,0.013856812933025405,0.7473074039896607,0.34692008483740944,0.08,0.4376284513327849,0.43211712853334705,0.15492957746478872,0.13432835820895522,0.008935824532900082,0.007305194805194805,oversample,0.31736890532004836,0.29399698871098257,0.786617105665838,0.5877872845187697,COMPLETE
