number,value,datetime_start,datetime_complete,duration,params_alpha,params_booster,params_colsample_bytree,params_gamma,params_grow_policy,params_lambda,params_learning_rate,params_max_delta_step,params_max_depth,params_min_child_weight,params_n_estimators,params_normalize_type,params_params_feature_fraction,params_params_labeled_ratio,params_params_missing_rate,params_params_resampling,params_params_sample_rows,params_params_scale_pos_weight,params_params_selftrain_max_iter,params_params_selftrain_threshold,params_rate_drop,params_sample_type,params_skip_drop,params_subsample,params_user_attrs_decision_threshold,user_attrs_acc_test,user_attrs_acc_val,user_attrs_f1_test,user_attrs_f1_val,user_attrs_feature_fraction,user_attrs_labeled_ratio,user_attrs_missing_rate,user_attrs_pr_auc_test,user_attrs_pr_auc_val,user_attrs_prec_test,user_attrs_prec_val,user_attrs_rec_test,user_attrs_rec_val,user_attrs_resampling_strategy,user_attrs_roc_auc_test,user_attrs_roc_auc_val,user_attrs_sample_rows,user_attrs_user_attrs_decision_threshold,state
1645,0.28816120906801007,2025-11-27 09:20:28.276716,2025-11-27 09:20:29.465555,0 days 00:00:01.188839,0.5139034781890428,gbtree,0.9922760012487151,0.1203622289765427,depthwise,0.000493066824932584,0.0008640654318901449,7,5,0.2472667346319083,400,,0.620709310038287,0.6637532000728732,0.09894097772844315,undersample,0.7451526732743685,,10.0,0.6861221147468375,,,,0.9794049702544403,,0.35956580732700133,0.36092265943012214,0.2804878048780488,0.28816120906801007,0.620709310038287,0.6637532000728732,0.08,0.4645576166522716,0.46148355964305143,0.37449118046132973,0.3798140770252324,0.22420796100731114,0.23214285714285715,undersample,0.35496609691805237,0.3447482356764788,0.7451526732743685,0.5,COMPLETE
1646,0.7156549520766773,2025-11-27 09:20:29.702190,2025-11-27 09:20:30.473123,0 days 00:00:00.770933,35.46512310726877,gbtree,0.3861015942638124,3.6054556048589226,lossguide,9.374356973386925,0.041076993031082885,10,5,1.7561863934069641,600,,0.5529530774411161,0.8656668277387758,0.09049483455499269,undersample,0.9844858523351758,,10.0,0.6816970894138337,,,,0.23680584870983756,,0.5567616463138851,0.5572139303482587,0.715281812899477,0.7156549520766773,0.5529530774411161,0.8656668277387758,0.08,0.5567616463138851,0.5572139303482587,0.5567616463138851,0.5572139303482587,1.0,1.0,undersample,0.5,0.5,0.9844858523351758,0.5,COMPLETE
1647,0.0,2025-11-27 09:20:30.709721,2025-11-27 09:22:05.393692,0 days 00:01:34.683971,0.0010742827303657958,dart,0.44357472590185565,7.487882575401331,depthwise,0.002672043076701355,0.0025241786468567042,5,5,1.3270538612281322,900,tree,0.7087431873980059,0.29190252993127924,0.09944007896476795,none,0.9839827833021135,0.7101084981003168,8.0,0.8114412314073087,0.4712917998489652,weighted,0.5705979279701947,0.5594333189501906,,0.44323835368611486,0.4427860696517413,0.0,0.0,0.7087431873980059,0.29190252993127924,0.08,0.6209152731581365,0.6304151871848929,0.0,0.0,0.0,0.0,none,0.5556217775493626,0.5530258811668414,0.9839827833021135,0.5,COMPLETE
1648,0.7156549520766773,2025-11-27 09:22:05.630837,2025-11-27 09:22:53.626681,0 days 00:00:47.995844,0.004264976137499388,dart,0.5213708283036789,4.067333458357483,lossguide,0.2053381572041068,0.01551109846090249,3,5,49.009861438893566,600,tree,0.8402572405714129,0.6356690999962034,0.025364252425682278,none,0.5243451479877643,2.7483214659062685,6.0,0.848684940952821,0.18651743194037373,uniform,0.47247339802883787,0.5643553195600216,,0.5567616463138851,0.5572139303482587,0.715281812899477,0.7156549520766773,0.8402572405714129,0.6356690999962034,0.02,0.5658840959996857,0.5623967239716695,0.5567616463138851,0.5572139303482587,1.0,1.0,none,0.5398672060213199,0.5266190653065014,0.5243451479877643,0.5,COMPLETE
1649,0.7156549520766773,2025-11-27 09:22:53.862661,2025-11-27 09:24:46.266105,0 days 00:01:52.403444,0.01722163652622783,dart,0.9376891694137546,7.103368289742134,lossguide,0.00011150763916557579,0.001110957714586585,0,8,0.1232269711843384,900,forest,0.7943698049851441,0.8739392238881696,0.06719571405958223,none,0.847635002952343,1.9923344358040764,10.0,0.6059050856795138,0.17130549217079516,uniform,0.5600079529558154,0.6244297716502254,,0.5567616463138851,0.5572139303482587,0.715281812899477,0.7156549520766773,0.7943698049851441,0.8739392238881696,0.08,0.49127640097501113,0.4807923020199547,0.5567616463138851,0.5572139303482587,1.0,1.0,none,0.42208715330161306,0.412013899022326,0.847635002952343,0.5,COMPLETE
1650,0.7156549520766773,2025-11-27 09:24:46.492613,2025-11-27 09:24:47.292667,0 days 00:00:00.800054,0.00035100588034674287,gbtree,0.5282412501521005,5.199523745708382,lossguide,1.457936019217978,0.0002289278687009983,6,10,2.1188826906330074,500,,0.7706903968785679,0.8463142475224141,0.09805801327872825,oversample,0.5667307354674672,,12.0,0.8904640790111701,,,,0.3822076012302888,,0.5567616463138851,0.5572139303482587,0.715281812899477,0.7156549520766773,0.7706903968785679,0.8463142475224141,0.08,0.5022047695853231,0.5286242795575623,0.5567616463138851,0.5572139303482587,1.0,1.0,oversample,0.39156153119249326,0.4214652176220103,0.5667307354674672,0.5,COMPLETE
1651,0.7336561743341404,2025-11-27 09:24:47.545117,2025-11-27 09:24:48.277122,0 days 00:00:00.732005,0.047683320759355684,gbtree,0.3281843730561146,1.6046764388760104,depthwise,20.788731808052948,0.332619171253426,0,6,0.7944869324642225,300,,0.9538664787425197,0.7179187424803708,0.02473987555391537,oversample,0.8482315723262503,,10.0,0.9143218250248073,,,,0.926300475483461,,0.6051560379918589,0.6019900497512438,0.7356948228882834,0.7336561743341404,0.9538664787425197,0.7179187424803708,0.02,0.595800251596859,0.5938869794600543,0.5863899613899614,0.584942084942085,0.9870024370430545,0.9837662337662337,oversample,0.5968960858104412,0.5934697644031147,0.8482315723262503,0.5,COMPLETE
1652,0.2755287009063444,2025-11-27 09:24:48.502404,2025-11-27 09:24:49.559938,0 days 00:00:01.057534,0.0092881240145897,gbtree,0.2505660946709045,9.795269293354586,depthwise,0.0011167354747701733,0.005507016094327542,3,6,1.36375239020291,1000,,0.9852468467979888,0.2934076022219228,0.051451274329875674,undersample,0.619206640462029,,7.0,0.633881383612431,,,,0.7442789328120012,,0.4631388511985527,0.4577114427860697,0.28191167574107684,0.2755287009063444,0.9852468467979888,0.2934076022219228,0.05,0.555885493462662,0.553844483028351,0.5521327014218009,0.5390070921985816,0.1892770105605199,0.18506493506493507,undersample,0.49820993385168855,0.4929410477163286,0.619206640462029,0.5,COMPLETE
1653,0.7156549520766773,2025-11-27 09:24:49.784339,2025-11-27 09:25:24.860558,0 days 00:00:35.076219,72.00356188559924,dart,0.8116495794861669,6.375826945307929,depthwise,7.556543373563311,0.0020028186998598675,1,12,14.595534501939149,500,forest,0.9679160401083943,0.8883983695824493,0.010700414019379156,oversample,0.5586602401924055,,8.0,0.739930592278584,0.03131800152990488,weighted,0.21771153378133634,0.9118349251564322,,0.5567616463138851,0.5572139303482587,0.715281812899477,0.7156549520766773,0.9679160401083943,0.8883983695824493,0.02,0.5567616463138851,0.5572139303482587,0.5567616463138851,0.5572139303482587,1.0,1.0,oversample,0.5,0.5,0.5586602401924055,0.5,COMPLETE
1654,0.7141802067946824,2025-11-27 09:25:25.095418,2025-11-27 09:26:15.956452,0 days 00:00:50.861034,0.001033123967241688,dart,0.24682793778844703,5.810819296720631,depthwise,0.0028141175863917577,0.00022895725277032706,5,11,3.114086870539179,700,forest,0.6995805726273865,0.5022320893580234,0.06713834786701532,undersample,0.6999060700046653,,5.0,0.8150846949336122,0.48998116317115464,uniform,0.38133571810992556,0.8876646691356973,,0.6132971506105834,0.649932157394844,0.6820379323168464,0.7141802067946824,0.6995805726273865,0.5022320893580234,0.08,0.5510979908241453,0.5809277477701771,0.6289437585733882,0.6551490514905149,0.7449228269699432,0.7849025974025974,undersample,0.5139110396392512,0.5562680743668997,0.6999060700046653,0.5,COMPLETE
1655,0.7156549520766773,2025-11-27 09:26:16.158934,2025-11-27 09:26:17.154957,0 days 00:00:00.996023,0.00015125228676802824,gbtree,0.28782756645000057,4.053735828485561,lossguide,0.008438357878410558,0.00025624271058086634,6,8,1.6409934209582835,800,,0.7620919301968792,0.45556991394200685,0.010329815508513862,none,0.9795711259889874,1.2682755562309638,5.0,0.6666984202290238,,,,0.7898033940771818,,0.5567616463138851,0.5572139303482587,0.715281812899477,0.7156549520766773,0.7620919301968792,0.45556991394200685,0.02,0.44896442126235236,0.4457181828421102,0.5567616463138851,0.5572139303482587,1.0,1.0,none,0.352121636631907,0.3459715718398047,0.9795711259889874,0.5,COMPLETE
1656,0.487962962962963,2025-11-27 09:26:17.386597,2025-11-27 09:26:49.647653,0 days 00:00:32.261056,0.003892585765620009,dart,0.25248389376794056,2.213964462927722,depthwise,0.00039818451389085055,0.00019855712014502504,6,5,0.18027386476022017,500,forest,0.9478456456051016,0.4747981519235057,0.07814796002346613,undersample,0.6747201460242674,,10.0,0.9074303733829978,0.38672777222451526,weighted,0.41076860880516,0.2529195696935638,,0.5056535504296699,0.4997738579828132,0.5135736537605696,0.487962962962963,0.9478456456051016,0.4747981519235057,0.08,0.5610967421842862,0.5610506811873548,0.5679133858267716,0.5678879310344828,0.4687246141348497,0.4277597402597403,undersample,0.5352181733782059,0.5366553135322287,0.6747201460242674,0.5,COMPLETE
1657,0.4736612973443622,2025-11-27 09:26:49.850336,2025-11-27 09:26:50.955316,0 days 00:00:01.104980,1.231514899192274,gbtree,0.619503848861776,2.6090449938105973,lossguide,0.09458489198939785,0.0024674717833727657,0,8,1.2437569142170812,500,,0.9409482515484162,0.7037341104896018,0.00038603515102610955,undersample,0.9853657213853164,,9.0,0.9382364900032627,,,,0.42187221704419486,,0.44414292175486203,0.4531886024423338,0.46167323696890056,0.4736612973443622,0.9409482515484162,0.7037341104896018,0.0,0.4787357580600373,0.4851899687701561,0.5009505703422054,0.5107981220657277,0.4281072298943948,0.44155844155844154,undersample,0.4033355990649712,0.4230670376610111,0.9853657213853164,0.5,COMPLETE
1658,0.7156549520766773,2025-11-27 09:26:51.153218,2025-11-27 09:29:08.122016,0 days 00:02:16.968798,0.0030627400310896937,dart,0.8870219745855217,3.719187485124613,depthwise,0.00010192954838222679,0.0009736229351619111,3,8,42.87423336797892,1000,tree,0.647038331191583,0.517165971814215,0.024488947942009943,oversample,0.8378445738221334,,11.0,0.7728852418955282,0.4403390615235398,uniform,0.8505240992463523,0.4545868073416499,,0.5567616463138851,0.5572139303482587,0.715281812899477,0.7156549520766773,0.647038331191583,0.517165971814215,0.02,0.48139174611484303,0.4807284932810925,0.5567616463138851,0.5572139303482587,1.0,1.0,oversample,0.4290895074520466,0.4220700456336309,0.8378445738221334,0.5,COMPLETE
1659,0.6158559938720797,2025-11-27 09:29:08.326583,2025-11-27 09:29:10.508099,0 days 00:00:02.181516,0.00028323988833655136,gbtree,0.28609416411966554,1.5638334886796301,depthwise,0.0066863968560887475,0.1061403854737481,6,11,0.20288095259064706,500,,0.7416967676011961,0.2279949613305019,0.09758838684185334,none,0.5587628214518188,0.8899553479733955,8.0,0.8238967871262944,,,,0.5397304022724743,,0.527363184079602,0.5463591135232926,0.5909980430528375,0.6158559938720797,0.7416967676011961,0.2279949613305019,0.08,0.5891102704325916,0.6157073932611964,0.5702416918429003,0.5830311820159536,0.6133225020308692,0.6525974025974026,none,0.5169714352028383,0.5428491005929719,0.5587628214518188,0.5,COMPLETE
1660,0.7156549520766773,2025-11-27 09:29:10.708539,2025-11-27 09:30:34.336166,0 days 00:01:23.627627,0.5370226690412615,dart,0.8995199336598738,7.699671862500889,lossguide,0.01394915530455735,0.002003556514071346,2,12,49.27518845685146,800,forest,0.5795731184711215,0.6239983700891951,0.020825325212148384,none,0.5317768874180793,3.1758748193980817,10.0,0.6404816551667546,0.20151300120214433,uniform,0.6707096640289162,0.43085596612135646,,0.5567616463138851,0.5572139303482587,0.715281812899477,0.7156549520766773,0.5795731184711215,0.6239983700891951,0.02,0.5629827157198228,0.5544786884859142,0.5567616463138851,0.5572139303482587,1.0,1.0,none,0.5335441568991528,0.5198917527824576,0.5317768874180793,0.5,COMPLETE
1661,0.0,2025-11-27 09:30:34.542886,2025-11-27 09:31:18.071342,0 days 00:00:43.528456,0.0010907070633969166,dart,0.8538712891692972,7.1505259746516705,lossguide,0.032259324598661675,0.00015224403084946234,8,12,0.7562505353207543,600,tree,0.679497639169816,0.8559819293583624,0.09195074069058207,none,0.8470789256845628,0.6906945390061935,7.0,0.9231568576455479,0.2048631028153718,weighted,0.3361599127401153,0.28576859634283686,,0.44323835368611486,0.4427860696517413,0.0,0.0,0.679497639169816,0.8559819293583624,0.08,0.5047110026868439,0.49303605173494797,0.0,0.0,0.0,0.0,none,0.43514149770387434,0.4225301958001141,0.8470789256845628,0.5,COMPLETE
1662,0.41597510373443985,2025-11-27 09:31:18.271371,2025-11-27 09:33:32.097810,0 days 00:02:13.826439,0.001297500055624896,dart,0.46101570611949794,4.918922317083445,lossguide,24.76090724949146,0.0008919221690614458,4,4,41.75134608001761,1000,forest,0.5707532428109501,0.8061618279965341,0.07955903685432131,undersample,0.889589716650917,,8.0,0.7544625145631437,0.1786734398389772,uniform,0.8234736932840567,0.6261348699770886,,0.45092718227046585,0.49072817729534146,0.3670490093847758,0.41597510373443985,0.5707532428109501,0.8061618279965341,0.08,0.5258756833526246,0.5518592473513004,0.512372634643377,0.5761494252873564,0.2859463850528026,0.325487012987013,undersample,0.43530935526119463,0.4551863483809347,0.889589716650917,0.5,COMPLETE
1663,0.7075748678802114,2025-11-27 09:33:32.322872,2025-11-27 09:34:37.680061,0 days 00:01:05.357189,7.328780098114473,dart,0.3691638366259309,4.0142794930551995,lossguide,0.031633740047206454,0.160777333509946,10,7,7.641951350340607,700,tree,0.8786820716188544,0.420201306503001,0.009645086069738419,none,0.9902428317345033,1.0997966208319891,9.0,0.8300616208159997,0.06006009108173799,uniform,0.3010263673465034,0.4785535541972161,,0.5554047942107644,0.5495251017639078,0.7111372318542463,0.7075748678802114,0.8786820716188544,0.420201306503001,0.0,0.6003400266108371,0.612744457012097,0.5570902394106814,0.5542778288868445,0.9829406986190089,0.9780844155844156,none,0.5360479285134038,0.5387682733507555,0.9902428317345033,0.5,COMPLETE
1664,0.7156549520766773,2025-11-27 09:34:37.887783,2025-11-27 09:35:21.467979,0 days 00:00:43.580196,26.236015639072303,dart,0.466457627579455,7.731100525054192,lossguide,0.0020008821070452995,0.048291949585923054,9,11,0.1305183990867426,600,forest,0.6679887711701276,0.7094398912500925,0.07057100439896077,oversample,0.534425982246687,,6.0,0.8853197883600097,0.14909367983153204,weighted,0.13584140757993743,0.2343393524870656,,0.5567616463138851,0.5572139303482587,0.715281812899477,0.7156549520766773,0.6679887711701276,0.7094398912500925,0.08,0.5567616463138851,0.5572139303482587,0.5567616463138851,0.5572139303482587,1.0,1.0,oversample,0.5,0.5,0.534425982246687,0.5,COMPLETE
1665,0.7156549520766773,2025-11-27 09:35:21.666669,2025-11-27 09:35:22.159753,0 days 00:00:00.493084,21.7113812154315,gbtree,0.698315225748602,5.221758690021191,lossguide,13.232327885463295,0.001896771690757418,3,4,2.755387370527037,400,,0.8674068873152805,0.3235495722223421,0.0482584241712101,oversample,0.6582503727268032,,9.0,0.9287063181805796,,,,0.3760830886247251,,0.5567616463138851,0.5572139303482587,0.715281812899477,0.7156549520766773,0.8674068873152805,0.3235495722223421,0.05,0.5567616463138851,0.5572139303482587,0.5567616463138851,0.5572139303482587,1.0,1.0,oversample,0.5,0.5,0.6582503727268032,0.5,COMPLETE
1666,0.6346978557504873,2025-11-27 09:35:22.372596,2025-11-27 09:35:23.036425,0 days 00:00:00.663829,2.206217834580685,gbtree,0.9378388029339582,9.217190668708334,lossguide,6.785519977801067,0.0013339171765349898,9,5,5.931931707708352,600,,0.7534314792436567,0.7157972131765498,0.07712254629659103,undersample,0.6069176734007933,,9.0,0.6341867286067034,,,,0.6473390256813618,,0.5825418362731796,0.5762098597919494,0.637042862760519,0.6346978557504873,0.7534314792436567,0.7157972131765498,0.08,0.6404758588888527,0.6277239816954737,0.6173780487804879,0.6106526631657915,0.6580016246953696,0.6607142857142857,undersample,0.611141182711915,0.5936828429486755,0.6069176734007933,0.5,COMPLETE
1667,0.7156549520766773,2025-11-27 09:35:23.229789,2025-11-27 09:35:23.953805,0 days 00:00:00.724016,18.92905347583455,gbtree,0.22452883866057435,7.087703909410487,lossguide,0.00018359150928781495,0.00010894951677731856,6,8,2.6759536548929748,800,,0.6218389376406162,0.6120473002043906,0.02875445022805615,none,0.5537362838844022,1.5432228309175438,6.0,0.8636340418572619,,,,0.6160651333085385,,0.5567616463138851,0.5572139303482587,0.715281812899477,0.7156549520766773,0.6218389376406162,0.6120473002043906,0.02,0.5567616463138851,0.5572139303482587,0.5567616463138851,0.5572139303482587,1.0,1.0,none,0.5,0.5,0.5537362838844022,0.5,COMPLETE
1668,0.7156549520766773,2025-11-27 09:35:24.152765,2025-11-27 09:37:26.360778,0 days 00:02:02.208013,0.000597220306749746,dart,0.2544744793936853,1.8534858697938283,lossguide,94.38256107301632,0.13740537011509105,7,10,2.9597820042900405,1000,tree,0.9266229880792565,0.5327273475484577,0.0626706475959105,none,0.6583653332767281,2.244370745342649,7.0,0.9392220551011898,0.17499642181508446,uniform,0.2289441610058619,0.5771658554834123,,0.5567616463138851,0.5572139303482587,0.715281812899477,0.7156549520766773,0.9266229880792565,0.5327273475484577,0.05,0.5612409337092363,0.5477768411737142,0.5567616463138851,0.5572139303482587,1.0,1.0,none,0.4551625524295828,0.45107360081185416,0.6583653332767281,0.5,COMPLETE
1669,0.30079803560466545,2025-11-27 09:37:26.578358,2025-11-27 09:37:47.985263,0 days 00:00:21.406905,0.22300131290951122,dart,0.5349094908560212,7.912274310191123,lossguide,1.9537073580810582,0.0007261379457072568,5,11,0.8548455492323593,400,tree,0.6323247990014002,0.8825662761484325,0.027832529832011434,undersample,0.9708338976948783,,9.0,0.8238119710659035,0.04164548985949962,uniform,0.0459679321523311,0.7639584495382077,,0.4839439167797377,0.48484848484848486,0.30722525804493017,0.30079803560466545,0.6323247990014002,0.8825662761484325,0.02,0.555036717438683,0.5561059425913528,0.6081730769230769,0.6171284634760705,0.20552396425670186,0.19886363636363635,undersample,0.45513851356952206,0.44678964421686584,0.9708338976948783,0.5,COMPLETE
1670,0.7156549520766773,2025-11-27 09:37:48.183155,2025-11-27 09:38:00.499667,0 days 00:00:12.316512,30.179083405396703,dart,0.4833798574618102,0.42906190402558164,lossguide,1.603739761099678,0.15320332002846337,9,12,7.128053451506492,300,tree,0.8916983227574029,0.5632929442705022,0.09292916715697835,oversample,0.647974916794464,,8.0,0.6231259923480852,0.05012587203792429,weighted,0.6830860992771077,0.6196616539829007,,0.5567616463138851,0.5572139303482587,0.715281812899477,0.7156549520766773,0.8916983227574029,0.5632929442705022,0.08,0.5338004508081096,0.5588953351719346,0.5567616463138851,0.5572139303482587,1.0,1.0,oversample,0.44404002055737,0.45879500351538144,0.647974916794464,0.5,COMPLETE
1671,0.0,2025-11-27 09:38:00.699093,2025-11-27 09:38:01.624240,0 days 00:00:00.925147,0.00016254003850423002,gbtree,0.8530914444158848,2.6279995632448907,lossguide,0.13563585959803665,0.0004031467584773451,10,6,2.1092226675739285,500,,0.7915964154952642,0.2014452449020952,0.06308318084098039,none,0.5552611470263302,0.6714147452932394,12.0,0.6696189671334009,,,,0.9249851358298273,,0.4427860696517413,0.4414292175486205,0.0,0.0,0.7915964154952642,0.2014452449020952,0.05,0.5367482401865205,0.5210532803290613,0.0,0.0,0.0,0.0,none,0.48568195759213517,0.46266565405993393,0.5552611470263302,0.5,COMPLETE
1672,0.0,2025-11-27 09:38:01.825224,2025-11-27 09:38:19.961477,0 days 00:00:18.136253,0.022589865253079346,dart,0.746981157820837,7.917614211803708,lossguide,0.0004456492160229924,0.049535538490659566,3,12,0.9748851897811399,400,tree,0.8169908265036916,0.7257226096744431,0.08002556035835236,none,0.6343545143784246,0.6352736505070803,8.0,0.6545922748120597,0.2531714596619021,uniform,0.31490791245349103,0.3769745021852739,,0.44323835368611486,0.4427860696517413,0.0,0.0,0.8169908265036916,0.7257226096744431,0.08,0.5980487665673824,0.6290741779899981,0.0,0.0,0.0,0.0,none,0.567734047315108,0.6010046197418517,0.6343545143784246,0.5,COMPLETE
1673,0.7156549520766773,2025-11-27 09:38:20.161500,2025-11-27 09:38:20.563653,0 days 00:00:00.402153,0.021400538569549852,gbtree,0.6705211683482395,9.234555382041066,depthwise,0.006236226311408818,0.004083364082339155,4,8,24.892455914672496,200,,0.8323327932672193,0.4961381081162848,0.0944625718422124,oversample,0.6318838432252311,,7.0,0.6696468289739194,,,,0.5890176690634519,,0.5567616463138851,0.5572139303482587,0.715281812899477,0.7156549520766773,0.8323327932672193,0.4961381081162848,0.08,0.5515270460054195,0.5771879254200116,0.5567616463138851,0.5572139303482587,1.0,1.0,oversample,0.48068974949849963,0.509617138479498,0.6318838432252311,0.5,COMPLETE
1674,0.726325467361324,2025-11-27 09:38:20.760088,2025-11-27 09:38:25.264586,0 days 00:00:04.504498,0.019026697903292627,gbtree,0.7345745836342168,2.763371527370494,depthwise,0.016486984924996048,0.10445209417828871,4,11,54.24411475424581,1000,,0.7744246336996523,0.770657528501461,0.0942184719018048,none,0.6542639797772003,1.1047376851182296,11.0,0.6345136290529838,,,,0.6483604709678242,,0.5888738127544098,0.5961103573043871,0.7197039777983348,0.726325467361324,0.7744246336996523,0.770657528501461,0.08,0.5902274399869387,0.5985489345538917,0.5800198807157058,0.5834564254062038,0.9480097481722177,0.9618506493506493,none,0.5726388036936952,0.5770088249340037,0.6542639797772003,0.5,COMPLETE
