number,value,datetime_start,datetime_complete,duration,params_alpha,params_booster,params_colsample_bytree,params_gamma,params_grow_policy,params_lambda,params_learning_rate,params_max_delta_step,params_max_depth,params_min_child_weight,params_n_estimators,params_normalize_type,params_params_feature_fraction,params_params_labeled_ratio,params_params_missing_rate,params_params_resampling,params_params_sample_rows,params_params_scale_pos_weight,params_params_selftrain_max_iter,params_params_selftrain_threshold,params_rate_drop,params_sample_type,params_skip_drop,params_subsample,params_user_attrs_decision_threshold,user_attrs_acc_test,user_attrs_acc_val,user_attrs_f1_test,user_attrs_f1_val,user_attrs_feature_fraction,user_attrs_labeled_ratio,user_attrs_missing_rate,user_attrs_pr_auc_test,user_attrs_pr_auc_val,user_attrs_prec_test,user_attrs_prec_val,user_attrs_rec_test,user_attrs_rec_val,user_attrs_resampling_strategy,user_attrs_roc_auc_test,user_attrs_roc_auc_val,user_attrs_sample_rows,user_attrs_user_attrs_decision_threshold,state
1794,0.7071583514099783,2025-11-27 10:33:19.438174,2025-11-27 10:33:23.729682,0 days 00:00:04.291508,0.0003090491763599842,gbtree,0.45737953594158154,1.3020496221070255,depthwise,0.18724114927249244,0.0014571974750096218,9,9,0.8129583820619384,600,,0.8745182484813164,0.655916607167907,0.093054657416206,none,0.5947652150453805,0.9265912435486882,8.0,0.6219577789612695,,,,0.5574877273827511,,0.5730438715513342,0.5725915875169606,0.7079207920792079,0.7071583514099783,0.8745182484813164,0.655916607167907,0.08,0.5294627267832828,0.5230501222475934,0.5717141429285357,0.5719298245614035,0.9293257514216084,0.9261363636363636,none,0.49449758782473185,0.47875764429645934,0.5947652150453805,0.5,COMPLETE
1795,0.0,2025-11-27 10:33:23.937964,2025-11-27 10:33:24.710706,0 days 00:00:00.772742,4.124336611224423,gbtree,0.7834776079439698,9.475721682300842,depthwise,0.1674661481844844,0.16095282332139138,0,4,3.215846348144641,800,,0.9431826640470997,0.6675598172790941,0.04124804579304489,none,0.71627285457899,0.5451720939305995,7.0,0.7478553255447132,,,,0.977691116739372,,0.44323835368611486,0.4427860696517413,0.0,0.0,0.9431826640470997,0.6675598172790941,0.05,0.5567616463138851,0.5572139303482587,0.0,0.0,0.0,0.0,none,0.5,0.5,0.71627285457899,0.5,COMPLETE
1796,0.7156549520766773,2025-11-27 10:33:24.916609,2025-11-27 10:33:52.760611,0 days 00:00:27.844002,0.0001804820262592698,dart,0.4909620526615224,6.499003572033311,lossguide,0.03438215983607695,0.22601219163058006,1,10,0.7708229527852537,500,tree,0.5983639229544269,0.5990026757352218,0.02523693137024965,oversample,0.7887703553609196,,8.0,0.7872324361231942,0.3140848288652279,weighted,0.47384672886836954,0.6923461383885262,,0.5567616463138851,0.5572139303482587,0.715281812899477,0.7156549520766773,0.5983639229544269,0.5990026757352218,0.02,0.494023996884282,0.5038945906571803,0.5567616463138851,0.5572139303482587,1.0,1.0,oversample,0.3742079610073111,0.3801217615377472,0.7887703553609196,0.5,COMPLETE
1797,0.0,2025-11-27 10:33:52.957618,2025-11-27 10:33:53.801234,0 days 00:00:00.843616,0.00010637700536566547,gbtree,0.4059142202646706,4.991818345516955,lossguide,0.04865030620016435,0.00014477800919744996,10,8,1.9234601240771905,800,,0.9181973211473468,0.5168469125477175,0.0013741593071443293,none,0.514720141683014,0.6339262782279557,6.0,0.6435355433243594,,,,0.7219430870282018,,0.44323835368611486,0.4427860696517413,0.0,0.0,0.9181973211473468,0.5168469125477175,0.0,0.53513610865463,0.5159439035242978,0.0,0.0,0.0,0.0,none,0.47052587078698255,0.44148796810952073,0.514720141683014,0.5,COMPLETE
1798,0.5127966496044672,2025-11-27 10:33:53.998577,2025-11-27 10:33:54.481101,0 days 00:00:00.482524,3.710032192376277,gbtree,0.31891327306203315,1.5876824849159765,depthwise,0.0007238814854005704,0.00013172630295021706,8,9,0.21421005142989893,200,,0.9628173679427521,0.42822877663270664,0.0879643396240148,undersample,0.743872925334744,,5.0,0.7787740633680597,,,,0.2747563647068383,,0.5165083672546359,0.5264586160108549,0.5076001842468908,0.5127966496044672,0.9628173679427521,0.42822877663270664,0.08,0.575465913402982,0.5999702432439145,0.5861702127659575,0.6008724100327154,0.4476035743298132,0.4472402597402597,undersample,0.5323078134584459,0.549849601369009,0.743872925334744,0.5,COMPLETE
1799,0.7137870855148342,2025-11-27 10:33:54.683256,2025-11-27 10:33:56.676606,0 days 00:00:01.993350,0.042742556452966964,gbtree,0.9622556096960515,1.7047921327901827,depthwise,6.474750243516374,0.001119692352467977,8,9,0.6063533309693991,1000,,0.8901797953536619,0.5958911860742748,0.06721637765313697,oversample,0.5600633719787838,,8.0,0.860936622877026,,,,0.42155648915180105,,0.5554047942107644,0.5549525101763908,0.7139947628746,0.7137870855148342,0.8901797953536619,0.5958911860742748,0.08,0.48980573559007373,0.4865387767002711,0.5562103354487761,0.5562103354487761,0.9967506092607636,0.9959415584415584,oversample,0.37838574910061507,0.3783910165421912,0.5600633719787838,0.5,COMPLETE
1800,0.7156549520766773,2025-11-27 10:33:56.875124,2025-11-27 10:33:57.620812,0 days 00:00:00.745688,0.0020246412285032014,gbtree,0.7340960551074545,8.912940059690603,lossguide,0.45308723157957254,0.005001661871947791,8,4,10.006072118584957,800,,0.8520757554363863,0.7648120194987296,0.08588012394980443,oversample,0.7612646789587691,,9.0,0.677732557810896,,,,0.579244524692679,,0.5567616463138851,0.5572139303482587,0.715281812899477,0.7156549520766773,0.8520757554363863,0.7648120194987296,0.08,0.5298236910411187,0.5257649985728716,0.5567616463138851,0.5572139303482587,1.0,1.0,oversample,0.472802931083075,0.4756344268601674,0.7612646789587691,0.5,COMPLETE
1801,0.7156549520766773,2025-11-27 10:33:57.829033,2025-11-27 10:34:34.995944,0 days 00:00:37.166911,49.00733632050058,dart,0.3360776097487925,7.988822867835662,depthwise,0.00023510756890375166,0.019263841336709105,4,9,16.19225975909244,600,tree,0.5017553480222625,0.3365385001293044,0.07900794282391058,oversample,0.8774356442559783,,11.0,0.8964980015228875,0.2999572572343436,uniform,0.2035775353065948,0.5251559299207084,,0.5567616463138851,0.5572139303482587,0.715281812899477,0.7156549520766773,0.5017553480222625,0.3365385001293044,0.08,0.5567616463138851,0.5572139303482587,0.5567616463138851,0.5572139303482587,1.0,1.0,oversample,0.5,0.5,0.8774356442559783,0.5,COMPLETE
1802,0.7156549520766773,2025-11-27 10:34:35.194106,2025-11-27 10:34:40.424157,0 days 00:00:05.230051,0.7039197717183696,dart,0.786965121786072,6.148152219392081,lossguide,0.00024204358294314227,0.0003956541258740325,6,8,36.33766703240208,200,forest,0.5936332631301489,0.4279215393929331,0.00841018432522711,oversample,0.7049216808459207,,9.0,0.8859686675383296,0.3156759320242684,weighted,0.7156459176268843,0.9137585688740282,,0.5567616463138851,0.5572139303482587,0.715281812899477,0.7156549520766773,0.5936332631301489,0.4279215393929331,0.0,0.5221973753982874,0.5142927130753475,0.5567616463138851,0.5572139303482587,1.0,1.0,oversample,0.4328735555960808,0.4136953126036374,0.7049216808459207,0.5,COMPLETE
1803,0.45835131635735865,2025-11-27 10:34:40.621338,2025-11-27 10:35:11.624781,0 days 00:00:31.003443,0.24630438668449406,dart,0.6155750887491109,3.4607207433010077,depthwise,26.31891001863904,0.013723491947266502,1,11,1.64439612574413,500,tree,0.9213856776727634,0.5899894640611321,0.03075943841177005,undersample,0.6664154774823974,,12.0,0.805683424309521,0.3446546268910618,weighted,0.702939246952171,0.4013708515239642,,0.41157847127996383,0.4323835368611488,0.4296361245067953,0.45835131635735865,0.9213856776727634,0.5899894640611321,0.02,0.4651775048260963,0.4818454855215914,0.4666666666666667,0.4894009216589862,0.3980503655564582,0.4310064935064935,undersample,0.348806346259056,0.37605046893862015,0.6664154774823974,0.5,COMPLETE
1804,0.7156549520766773,2025-11-27 10:35:11.821676,2025-11-27 10:35:29.768552,0 days 00:00:17.946876,35.127400127118015,dart,0.8540981753415364,0.5303920645675886,lossguide,0.036039314440401655,0.013956395233336064,8,7,15.261208425758486,400,tree,0.5009806409540443,0.4323797634496216,0.03814602801848396,none,0.8213048493226502,4.349519298400508,8.0,0.8933719493392775,0.3106771185459709,weighted,0.39883739630215637,0.5700742193679096,,0.5567616463138851,0.5572139303482587,0.715281812899477,0.7156549520766773,0.5009806409540443,0.4323797634496216,0.05,0.45455541386883624,0.44378601540909507,0.5567616463138851,0.5572139303482587,1.0,1.0,none,0.33924261012284684,0.31092222384357215,0.8213048493226502,0.5,COMPLETE
1805,0.7156549520766773,2025-11-27 10:35:29.967541,2025-11-27 10:35:57.040305,0 days 00:00:27.072764,0.00039172706612992415,dart,0.7262101501034872,9.24162029492106,depthwise,57.28456092994194,0.0009634457766685659,3,6,0.8692334219593663,500,forest,0.8999285876609139,0.8045024049003782,0.052733238483650906,oversample,0.9493129774589538,,5.0,0.679080737992415,0.37305143504631416,weighted,0.4462261460884462,0.7883311062953171,,0.5567616463138851,0.5572139303482587,0.715281812899477,0.7156549520766773,0.8999285876609139,0.8045024049003782,0.05,0.4732216926044051,0.4727412932887047,0.5567616463138851,0.5572139303482587,1.0,1.0,oversample,0.33626635056947235,0.3331524514811032,0.9493129774589538,0.5,COMPLETE
1806,0.6618653222902413,2025-11-27 10:35:57.243155,2025-11-27 10:38:04.517315,0 days 00:02:07.274160,19.25809458651443,dart,0.6741665952588154,2.7528778539056553,lossguide,0.1684635177694408,0.023720724248424113,5,8,0.21689202250850223,1000,forest,0.50104193938179,0.6908501966359748,0.012230210793411845,undersample,0.9362762950859943,,7.0,0.6675775008171958,0.08013521435208831,uniform,0.305073875118684,0.5873117825525288,,0.5879692446856626,0.5753052917232022,0.675685297258811,0.6618653222902413,0.50104193938179,0.6908501966359748,0.02,0.5196448728463487,0.5080636069635489,0.6013941698352345,0.594822006472492,0.7709179528838342,0.7459415584415584,undersample,0.5039059002967556,0.48360414483371583,0.9362762950859943,0.5,COMPLETE
1807,0.4318181818181818,2025-11-27 10:38:04.718412,2025-11-27 10:38:05.277209,0 days 00:00:00.558797,0.009683950368627637,gbtree,0.5866850363662675,9.400753783706342,lossguide,0.2686826245583519,0.3790728874855168,5,4,15.154885167423927,300,,0.6845904720496147,0.6703112199247507,0.0814190702784407,undersample,0.5974251731392617,,9.0,0.648547977837287,,,,0.3311414801185116,,0.4337403889642696,0.4120307553143374,0.4608096468561585,0.4318181818181818,0.6845904720496147,0.6703112199247507,0.08,0.5253384339638787,0.5087074655357886,0.4903758020164986,0.4678030303030303,0.4346060113728676,0.400974025974026,undersample,0.43034367280624675,0.4049105899208044,0.5974251731392617,0.5,COMPLETE
1808,0.434881087202718,2025-11-27 10:38:05.480912,2025-11-27 10:38:45.174677,0 days 00:00:39.693765,0.45349839116019913,dart,0.36171633566916334,7.9895401755886555,depthwise,0.003393516548753896,0.0003465913125095741,7,3,0.6711597759380583,600,forest,0.9710832410225787,0.42712703686895404,0.09202589125636922,undersample,0.5991896182955235,,6.0,0.8063727970794712,0.22455010128587594,uniform,0.25161772624725787,0.2627053517615511,,0.5572139303482587,0.5486205336951605,0.43961076130509447,0.434881087202718,0.9710832410225787,0.42712703686895404,0.08,0.7236887569977308,0.7189737324789249,0.7441860465116279,0.7191011235955056,0.31194151096669376,0.3116883116883117,undersample,0.6416009051874203,0.6366438719605216,0.5991896182955235,0.5,COMPLETE
1809,0.7156549520766773,2025-11-27 10:38:45.378901,2025-11-27 10:39:57.784234,0 days 00:01:12.405333,0.00015046763916072776,dart,0.9772247426772371,2.985567448977707,lossguide,0.010990098973945579,0.04004894212966448,4,8,37.778482948319294,800,tree,0.6346954151722459,0.6311521301697891,0.06760677570305994,oversample,0.6584213047534799,,11.0,0.896019694893435,0.37373678924133324,weighted,0.14508744503595394,0.6434094502923356,,0.5567616463138851,0.5572139303482587,0.715281812899477,0.7156549520766773,0.6346954151722459,0.6311521301697891,0.08,0.43272140068469517,0.44080444917186634,0.5567616463138851,0.5572139303482587,1.0,1.0,oversample,0.30803685405925163,0.32453769417507927,0.6584213047534799,0.5,COMPLETE
1810,0.7156549520766773,2025-11-27 10:39:57.982924,2025-11-27 10:39:58.562408,0 days 00:00:00.579484,0.018508507437742707,gbtree,0.6554448265561221,5.208113899890296,depthwise,0.7978364463810337,0.00012661968570760847,9,4,0.818624862436866,400,,0.5671171024073829,0.7636043929001046,0.0503009832220081,oversample,0.6319335123113492,,8.0,0.612816710957154,,,,0.3634263379170891,,0.5567616463138851,0.5572139303482587,0.715281812899477,0.7156549520766773,0.5671171024073829,0.7636043929001046,0.05,0.49579029911810146,0.4788784916073728,0.5567616463138851,0.5572139303482587,1.0,1.0,oversample,0.39543759014572527,0.37067956303145266,0.6319335123113492,0.5,COMPLETE
1811,0.5175857577073383,2025-11-27 10:39:58.765900,2025-11-27 10:40:00.957178,0 days 00:00:02.191278,0.00011772855757714751,gbtree,0.8815071433056587,2.877463221161809,depthwise,0.005757228878111527,0.16128749867095413,7,3,0.17099026318499588,700,,0.5994670021635424,0.2393984829935702,0.029865743427986702,undersample,0.5372650419865396,,6.0,0.605909324550152,,,,0.27521910441314273,,0.49072817729534146,0.4975124378109453,0.5117085862966175,0.5175857577073383,0.5994670021635424,0.2393984829935702,0.02,0.5603847195591675,0.5649522180616351,0.5488372093023256,0.5564892623716153,0.479285134037368,0.4837662337662338,undersample,0.4936396491984283,0.49121900826446285,0.5372650419865396,0.5,COMPLETE
1812,0.7156549520766773,2025-11-27 10:40:01.159014,2025-11-27 10:40:02.313051,0 days 00:00:01.154037,0.0034990342450306757,gbtree,0.6505234827167796,7.76873739863259,depthwise,0.006377832779302867,0.1608216214405209,2,9,9.596279147487001,1000,,0.5458069254093765,0.3902473940382885,0.04099180412477171,none,0.7748625561207103,4.462403705682686,11.0,0.7212380524889395,,,,0.731539982151145,,0.5567616463138851,0.5572139303482587,0.715281812899477,0.7156549520766773,0.5458069254093765,0.3902473940382885,0.05,0.6078891666296787,0.6223591569683268,0.5567616463138851,0.5572139303482587,1.0,1.0,none,0.5767341136292047,0.587588133266121,0.7748625561207103,0.5,COMPLETE
1813,0.715281812899477,2025-11-27 10:40:02.510167,2025-11-27 10:40:03.381286,0 days 00:00:00.871119,0.003491096520736716,gbtree,0.45448508805687055,3.1219431437521825,depthwise,0.000260031783275559,0.006688356436861322,0,3,9.20561299222537,900,,0.660631368341271,0.6564479512384175,0.007811174585382919,oversample,0.9388063237933448,,5.0,0.765245952633085,,,,0.5870174179602206,,0.5567616463138851,0.5567616463138851,0.715281812899477,0.715281812899477,0.660631368341271,0.6564479512384175,0.0,0.4675712399204259,0.4667736874113068,0.5567616463138851,0.5570135746606335,1.0,0.9991883116883117,oversample,0.3370840862746398,0.33526955679662523,0.9388063237933448,0.5,COMPLETE
1814,0.22356164383561644,2025-11-27 10:40:03.578308,2025-11-27 10:40:04.565875,0 days 00:00:00.987567,0.01677901463806937,gbtree,0.5236201148747834,4.0032716873111776,depthwise,0.007888360387799451,0.0017990040862613077,5,10,0.5060824651472441,1000,,0.6907670553291299,0.24002795159030063,0.05912319467043519,undersample,0.7468669817353152,,12.0,0.8184634479607094,,,,0.9349715435662549,,0.36047037539574855,0.35911352329262775,0.22562979189485213,0.22356164383561644,0.6907670553291299,0.24002795159030063,0.05,0.4410886409207837,0.4429281665163446,0.346218487394958,0.3440134907251265,0.16734362307067424,0.16558441558441558,undersample,0.3287169051211061,0.33524468381465317,0.7468669817353152,0.5,COMPLETE
1815,0.7156549520766773,2025-11-27 10:40:04.763573,2025-11-27 10:40:57.454016,0 days 00:00:52.690443,0.0013730419808761613,dart,0.393170440673278,6.662728323728844,depthwise,0.6733654824270104,0.00909310028542493,7,5,8.320254995642395,700,tree,0.5878245578561869,0.8970689106382912,0.09127592370115671,oversample,0.8932227513723858,,8.0,0.8300150266618049,0.39968170521035745,uniform,0.5076625683611413,0.36664846923065836,,0.5567616463138851,0.5572139303482587,0.715281812899477,0.7156549520766773,0.5878245578561869,0.8970689106382912,0.08,0.44545232978932786,0.43210964248721595,0.5567616463138851,0.5572139303482587,1.0,1.0,oversample,0.32155664052786026,0.2960216494435085,0.8932227513723858,0.5,COMPLETE
1816,0.6111111111111112,2025-11-27 10:40:57.654799,2025-11-27 10:40:58.552173,0 days 00:00:00.897374,20.186054670932855,gbtree,0.49221881184315414,7.3010997222506155,depthwise,0.007549960277031446,0.002287763305300078,7,10,16.89221793760346,1000,,0.6275780262030699,0.5089503359598773,0.007799663706111271,undersample,0.9986768405364883,,9.0,0.737849865157651,,,,0.3126119330938349,,0.5033921302578019,0.5061058344640434,0.6092526690391459,0.6111111111111112,0.6275780262030699,0.5089503359598773,0.0,0.5577550311418864,0.556319367910968,0.5421152628245726,0.5444162436548223,0.6953696181965882,0.6964285714285714,undersample,0.5005371441834248,0.49951083135454943,0.9986768405364883,0.5,COMPLETE
1817,0.7156549520766773,2025-11-27 10:40:58.749762,2025-11-27 10:42:44.401711,0 days 00:01:45.651949,0.0024594791294337663,dart,0.9693350863542427,8.73245118341751,lossguide,0.033679641959536454,0.0292639946607256,2,11,0.7317982925485124,900,tree,0.7981664718947905,0.35602499288459616,0.09624825097357576,none,0.7075604324838503,2.630627287306797,6.0,0.6874866421271224,0.43414019773100204,uniform,0.17507402415851295,0.3076778472063751,,0.5567616463138851,0.5572139303482587,0.715281812899477,0.7156549520766773,0.7981664718947905,0.35602499288459616,0.08,0.5536285865449161,0.5370826337027199,0.5567616463138851,0.5572139303482587,1.0,1.0,none,0.5135757389877154,0.4794308730085033,0.7075604324838503,0.5,COMPLETE
1818,0.0,2025-11-27 10:42:44.598115,2025-11-27 10:42:45.128307,0 days 00:00:00.530192,0.26146574818035795,gbtree,0.4890400350179205,7.448249549157927,depthwise,0.0001341726582470343,0.01985686934475119,2,10,28.561988076261702,400,,0.5076144326851157,0.7445161772799664,0.009523193310604096,none,0.7664330293523327,0.7267607548327412,8.0,0.8550449564930545,,,,0.5507333814426674,,0.44323835368611486,0.4427860696517413,0.0,0.0,0.5076144326851157,0.7445161772799664,0.0,0.5338420549158869,0.543324473582018,0.0,0.0,0.0,0.0,none,0.4570877335499594,0.4666469893742621,0.7664330293523327,0.5,COMPLETE
1819,0.7156549520766773,2025-11-27 10:42:45.331127,2025-11-27 10:45:26.407984,0 days 00:02:41.076857,0.00042226822710267933,dart,0.5584502856975149,5.206856333138149,depthwise,0.00011119813648262895,0.0001286349810624775,3,4,0.44378574616170113,900,forest,0.9704324522087189,0.24786266836311685,0.02309035777539016,none,0.8367465323517893,1.532228798502641,6.0,0.6545288465426263,0.18885796502949792,uniform,0.8263545582038817,0.7582911854933696,,0.5567616463138851,0.5572139303482587,0.715281812899477,0.7156549520766773,0.9704324522087189,0.24786266836311685,0.02,0.5722064981191338,0.5660355318380355,0.5567616463138851,0.5572139303482587,1.0,1.0,none,0.527713489945125,0.5162764648528182,0.8367465323517893,0.5,COMPLETE
1820,0.7156549520766773,2025-11-27 10:45:26.610238,2025-11-27 10:45:34.918261,0 days 00:00:08.308023,56.4363109842411,dart,0.4380993437313106,1.9738826222211403,lossguide,0.024667396698273728,0.0006411380752965563,2,9,0.5085813649759823,300,forest,0.8699332793824119,0.4688686385759146,0.05786356332052254,oversample,0.8956418282252436,,12.0,0.7783467100255312,0.3814636690108342,weighted,0.10046546987063519,0.49342417564160856,,0.5567616463138851,0.5572139303482587,0.715281812899477,0.7156549520766773,0.8699332793824119,0.4688686385759146,0.05,0.5567616463138851,0.5572139303482587,0.5567616463138851,0.5572139303482587,1.0,1.0,oversample,0.5,0.5,0.8956418282252436,0.5,COMPLETE
1821,0.63828125,2025-11-27 10:45:35.122201,2025-11-27 10:45:35.656552,0 days 00:00:00.534351,0.014524572071852478,gbtree,0.7545994834416476,1.0811275170455004,depthwise,0.0001492688613281374,0.0005539388686127832,6,4,7.4036329119001625,200,,0.7825736693015675,0.26842409923548616,0.02084983204879706,undersample,0.7430810483788226,,6.0,0.7914768808072721,,,,0.7750873428070462,,0.555857078245138,0.5811849841700588,0.609387430389817,0.63828125,0.7825736693015675,0.26842409923548616,0.02,0.5753287629462649,0.5782245535313733,0.5970381917381138,0.615210843373494,0.6222583265637693,0.6631493506493507,undersample,0.5416282597523169,0.5608699905814308,0.7430810483788226,0.5,COMPLETE
1822,0.7156549520766773,2025-11-27 10:45:35.856756,2025-11-27 10:45:36.829233,0 days 00:00:00.972477,4.6818511970313965,gbtree,0.781159107885872,5.361814185121025,lossguide,0.0007392950957944412,0.0008420339646572705,7,8,0.16381234749582416,1000,,0.7585697857768926,0.4742002603015,0.08457396341581296,none,0.7807081040378517,4.270475852222147,6.0,0.7895748020469161,,,,0.5968877252814458,,0.5567616463138851,0.5572139303482587,0.715281812899477,0.7156549520766773,0.7585697857768926,0.4742002603015,0.08,0.5748147709634723,0.5517449826962109,0.5567616463138851,0.5572139303482587,1.0,1.0,none,0.5160869709378472,0.46991861560298737,0.7807081040378517,0.5,COMPLETE
1823,0.7156549520766773,2025-11-27 10:45:37.037190,2025-11-27 10:46:16.964468,0 days 00:00:39.927278,0.03231413374950376,dart,0.4313668097238901,5.592181827752403,depthwise,13.424526863067294,0.001154391957924182,1,9,0.255445341387218,600,tree,0.5559360259182329,0.20148777637156942,0.034216208258716074,oversample,0.8956965193788881,,9.0,0.861724562613893,0.4999783063788625,weighted,0.6139941773665679,0.5806183271576493,,0.5567616463138851,0.5572139303482587,0.715281812899477,0.7156549520766773,0.5559360259182329,0.20148777637156942,0.02,0.4669280113342441,0.47663471383833317,0.5567616463138851,0.5572139303482587,1.0,1.0,oversample,0.277306072713407,0.3002736857116326,0.8956965193788881,0.5,COMPLETE
