number,value,datetime_start,datetime_complete,duration,params_alpha,params_booster,params_colsample_bytree,params_gamma,params_grow_policy,params_lambda,params_learning_rate,params_max_delta_step,params_max_depth,params_min_child_weight,params_n_estimators,params_normalize_type,params_params_feature_fraction,params_params_labeled_ratio,params_params_missing_rate,params_params_resampling,params_params_sample_rows,params_params_scale_pos_weight,params_params_selftrain_max_iter,params_params_selftrain_threshold,params_rate_drop,params_sample_type,params_skip_drop,params_subsample,params_user_attrs_decision_threshold,user_attrs_acc_test,user_attrs_acc_val,user_attrs_f1_test,user_attrs_f1_val,user_attrs_feature_fraction,user_attrs_labeled_ratio,user_attrs_missing_rate,user_attrs_pr_auc_test,user_attrs_pr_auc_val,user_attrs_prec_test,user_attrs_prec_val,user_attrs_rec_test,user_attrs_rec_val,user_attrs_resampling_strategy,user_attrs_roc_auc_test,user_attrs_roc_auc_val,user_attrs_sample_rows,user_attrs_user_attrs_decision_threshold,state
378,0.7156549520766773,2025-11-26 18:45:38.803150,2025-11-26 18:45:39.471731,0 days 00:00:00.668581,0.059236604895763406,gbtree,0.7853287630930145,5.105747577039055,lossguide,0.2613459147417724,0.035273925898163506,8,6,56.84886491973372,500,,0.8751663040126607,0.44481069512904425,0.08898780843832992,oversample,0.6720456269761641,,11.0,0.7982297448404212,,,,0.873795146597215,0.36299090611144624,0.5567616463138851,0.5572139303482587,0.715281812899477,0.7156549520766773,0.8751663040126607,0.44481069512904425,0.08,0.6023368170346574,0.5842906442727546,0.5567616463138851,0.5572139303482587,1.0,1.0,oversample,0.5745896815265505,0.545377439210432,0.6720456269761641,0.36299090611144624,COMPLETE
379,0.7156549520766773,2025-11-26 18:45:39.638647,2025-11-26 18:46:25.260228,0 days 00:00:45.621581,70.55720517056783,dart,0.43284388363047743,3.6919915069511413,depthwise,72.17498987573669,0.003883345759047802,0,7,53.89098600296775,600,tree,0.6012961735544554,0.41670339944837326,0.07039806387019484,none,0.8019049441026986,1.0169886254311964,12.0,0.8845289449169789,0.09664034612599912,weighted,0.5723760800668685,0.25547143991521826,0.46061524370479395,0.5567616463138851,0.5572139303482587,0.715281812899477,0.7156549520766773,0.6012961735544554,0.41670339944837326,0.08,0.5567616463138851,0.5572139303482587,0.5567616463138851,0.5572139303482587,1.0,1.0,none,0.5,0.5,0.8019049441026986,0.46061524370479395,COMPLETE
380,0.7156549520766773,2025-11-26 18:46:25.432483,2025-11-26 18:46:55.512749,0 days 00:00:30.080266,7.278510261600453,dart,0.3594665347588287,8.695466686037289,lossguide,2.0461169987235843,0.00027760324735005604,1,7,7.2592774995062035,500,forest,0.8402186069216561,0.7027932130761348,0.033667980693287254,none,0.8245394924782732,2.613419805883529,7.0,0.7317717508159769,0.2911518172449471,weighted,0.6822516593359164,0.5609050029447098,0.21091859518150524,0.5567616463138851,0.5572139303482587,0.715281812899477,0.7156549520766773,0.8402186069216561,0.7027932130761348,0.02,0.5658480618990822,0.5769476376921164,0.5567616463138851,0.5572139303482587,1.0,1.0,none,0.5180714202821665,0.5384639938712973,0.8245394924782732,0.21091859518150524,COMPLETE
381,0.0,2025-11-26 18:46:55.682058,2025-11-26 18:46:56.492654,0 days 00:00:00.810596,0.05499443247099272,gbtree,0.9915327420564112,6.027202415583874,lossguide,0.2041579795951347,0.053065670545947345,6,7,98.7142183608502,700,,0.9039065888911765,0.5246296595040705,0.0895716979300127,oversample,0.8572421545652441,,11.0,0.7540254944835535,,,,0.6285724214182022,0.7923594970264101,0.44323835368611486,0.4427860696517413,0.0,0.0,0.9039065888911765,0.5246296595040705,0.08,0.4262513251807938,0.4180579680370854,0.0,0.0,0.0,0.0,oversample,0.2854884033223362,0.2620393523738774,0.8572421545652441,0.7923594970264101,COMPLETE
382,0.7156549520766773,2025-11-26 18:46:56.665141,2025-11-26 18:46:57.172620,0 days 00:00:00.507479,0.003196229100091381,gbtree,0.7074622272053084,6.210452088181803,lossguide,0.009785886454975658,0.018040740069143694,2,4,0.19659326161908558,200,,0.6513566687201271,0.8902576473317527,0.09942863469969655,undersample,0.6943956054591918,,7.0,0.6525153140591011,,,,0.20882729130525443,0.43005595367349403,0.5567616463138851,0.5572139303482587,0.715281812899477,0.7156549520766773,0.6513566687201271,0.8902576473317527,0.1,0.4458479195008017,0.4429796096146877,0.5567616463138851,0.5572139303482587,1.0,1.0,undersample,0.3232381173427942,0.31937323401828,0.6943956054591918,0.43005595367349403,COMPLETE
383,0.7156549520766773,2025-11-26 18:46:57.338142,2025-11-26 18:47:07.591785,0 days 00:00:10.253643,1.7025104811835639,dart,0.5298409131923633,2.3551359376598606,depthwise,64.2597644205381,0.011260199217729513,2,7,19.930460408104018,300,tree,0.5798103954658584,0.36198179232022804,0.07959970611166116,none,0.9291010258725482,0.6538089096015411,9.0,0.7687013163073894,0.19789634044987592,weighted,0.020776976776018453,0.21545298872955004,0.0429365674955189,0.5567616463138851,0.5572139303482587,0.715281812899477,0.7156549520766773,0.5798103954658584,0.36198179232022804,0.08,0.5496866960454598,0.50870897789459,0.5567616463138851,0.5572139303482587,1.0,1.0,none,0.40034732008156626,0.3637329537163551,0.9291010258725482,0.0429365674955189,COMPLETE
384,0.7156549520766773,2025-11-26 18:47:07.765426,2025-11-26 18:47:08.701252,0 days 00:00:00.935826,4.144516057972701,gbtree,0.8893166760527669,5.229146226934394,lossguide,0.05434585921905384,0.00270087011372326,6,8,92.50317356628948,800,,0.9038099511699333,0.8445553807416276,0.07651771119147653,undersample,0.9274143106587797,,10.0,0.8294008364301978,,,,0.6092721544557658,0.22950885845368812,0.5567616463138851,0.5572139303482587,0.715281812899477,0.7156549520766773,0.9038099511699333,0.8445553807416276,0.08,0.46420016514857004,0.45413499897998433,0.5567616463138851,0.5572139303482587,1.0,1.0,undersample,0.34543054427294884,0.3415209662656037,0.9274143106587797,0.22950885845368812,COMPLETE
385,0.7156549520766773,2025-11-26 18:47:08.887965,2025-11-26 18:47:09.516416,0 days 00:00:00.628451,0.5973261015510565,gbtree,0.6116759708024349,8.465903461730434,lossguide,30.74177422335938,0.0012544334445914018,0,3,0.8668992627828692,400,,0.7519588646242262,0.4662533645118102,0.04748687981353845,oversample,0.7721621899622543,,12.0,0.936209860476809,,,,0.21715699374408542,0.03221400874110128,0.5567616463138851,0.5572139303482587,0.715281812899477,0.7156549520766773,0.7519588646242262,0.4662533645118102,0.05,0.48685566195447816,0.48919705764918564,0.5567616463138851,0.5572139303482587,1.0,1.0,oversample,0.13915640179711203,0.14735583619648995,0.7721621899622543,0.03221400874110128,COMPLETE
386,0.7156549520766773,2025-11-26 18:47:09.694770,2025-11-26 18:48:28.082450,0 days 00:01:18.387680,0.055817644917622,dart,0.8419523259887399,1.1101462168094764,lossguide,0.18546226696680007,0.0003788344870899874,3,6,9.44064092602021,800,forest,0.85085116423149,0.18868828533761003,0.07388704205220223,undersample,0.9731058654400505,,10.0,0.6655188323092739,0.16055580162771677,weighted,0.23921254529999753,0.5479704138487075,0.21693497088563002,0.5567616463138851,0.5572139303482587,0.715281812899477,0.7156549520766773,0.85085116423149,0.18868828533761003,0.08,0.46449917729829315,0.44852327827669797,0.5567616463138851,0.5572139303482587,1.0,1.0,undersample,0.3655067225915549,0.32791420147778677,0.9731058654400505,0.21693497088563002,COMPLETE
387,0.0,2025-11-26 18:48:28.250693,2025-11-26 18:50:27.661394,0 days 00:01:59.410701,0.0035653961814419116,dart,0.8495104891445232,2.4119908903194043,depthwise,0.2967635523943312,0.001003591061082644,0,10,3.5491593606654557,1000,forest,0.5765942335296866,0.11017899861516822,0.052709770815106236,undersample,0.541216415430291,,6.0,0.8486731493336037,0.33721094382312905,uniform,0.657492662182258,0.9208463291644893,0.6530993491530463,0.44323835368611486,0.4427860696517413,0.0,0.0,0.5765942335296866,0.11017899861516822,0.05,0.6679608223079154,0.6500220380998712,0.0,0.0,0.0,0.0,undersample,0.5941780367711667,0.5873812729660534,0.541216415430291,0.6530993491530463,COMPLETE
388,0.7156549520766773,2025-11-26 18:50:27.816029,2025-11-26 18:50:37.548315,0 days 00:00:09.732286,0.09828975728812557,dart,0.9288776758248234,8.728711782363092,lossguide,0.0873521230758394,0.030307726840698934,5,8,3.7235601436709453,300,forest,0.7184651251212204,0.8957257589807052,0.09397843366792144,none,0.5702509594394158,1.679098480050227,9.0,0.613395753448965,0.3333050674549567,weighted,0.49346543928528214,0.814996276500332,0.5495427869137335,0.5567616463138851,0.5572139303482587,0.715281812899477,0.7156549520766773,0.7184651251212204,0.8957257589807052,0.1,0.5639785666298336,0.5727814539350978,0.5567616463138851,0.5572139303482587,1.0,1.0,none,0.4088972794641821,0.41999439528806226,0.5702509594394158,0.5495427869137335,COMPLETE
389,0.0,2025-11-26 18:50:37.714690,2025-11-26 18:50:49.708489,0 days 00:00:11.993799,0.000504226233111138,dart,0.9081667558972384,9.570882977727024,depthwise,0.014680680368952035,0.0078087630728240955,4,3,1.047378406779669,300,forest,0.7015386645580749,0.7920602467808678,0.06146635419900801,none,0.6301976773654813,0.5019325462608802,9.0,0.6013623675551867,0.18425508299105603,weighted,0.8927800483655197,0.9574033385696361,0.31178232735194833,0.44323835368611486,0.4427860696517413,0.0,0.0,0.7015386645580749,0.7920602467808678,0.05,0.5567616463138851,0.5572139303482587,0.0,0.0,0.0,0.0,none,0.5,0.5,0.6301976773654813,0.31178232735194833,COMPLETE
390,0.7156549520766773,2025-11-26 18:50:49.874177,2025-11-26 18:50:50.495815,0 days 00:00:00.621638,0.001627001805307904,gbtree,0.5224812395380204,8.305410256113673,lossguide,47.52900755780203,0.0025943179614548906,4,3,0.11805193145850178,400,,0.6579367075347661,0.20846270006587203,0.07472317040056951,oversample,0.8560377337833771,,12.0,0.6080756814513999,,,,0.5697033199695086,0.07183418392641654,0.5567616463138851,0.5572139303482587,0.715281812899477,0.7156549520766773,0.6579367075347661,0.20846270006587203,0.08,0.6351647067351647,0.6355777977636391,0.5567616463138851,0.5572139303482587,1.0,1.0,oversample,0.6323587924202989,0.632633518167226,0.8560377337833771,0.07183418392641654,COMPLETE
391,0.7156549520766773,2025-11-26 18:50:50.666177,2025-11-26 18:50:55.450406,0 days 00:00:04.784229,0.0004558987910966287,dart,0.9962392603735047,7.344631230227386,depthwise,0.04295068818206512,0.0014262716353976648,3,5,6.5003290390332324,200,forest,0.8015054425532234,0.9201016963318044,0.05600762819406447,oversample,0.6653609380511547,,10.0,0.702947063136178,0.2888026132589383,uniform,0.30838630387031696,0.9763186755340102,0.5505124670787847,0.5567616463138851,0.5572139303482587,0.715281812899477,0.7156549520766773,0.8015054425532234,0.9201016963318044,0.05,0.5858049676696617,0.6082743502945451,0.5567616463138851,0.5572139303482587,1.0,1.0,oversample,0.49240662146255737,0.5101809260708647,0.6653609380511547,0.5505124670787847,COMPLETE
392,0.7156549520766773,2025-11-26 18:50:55.618050,2025-11-26 18:50:57.809839,0 days 00:00:02.191789,2.2121863257449528,gbtree,0.264557048308554,3.257327224446678,depthwise,0.29239704691483065,0.18951294154345844,2,4,0.5016990072968169,600,,0.8250110154912411,0.21352249645263002,0.0013133176507019785,none,0.9655916800248371,2.0964835898578387,8.0,0.8191457572576567,,,,0.7040235277796327,0.6233302324315146,0.5567616463138851,0.5572139303482587,0.715281812899477,0.7156549520766773,0.8250110154912411,0.21352249645263002,0.0,0.68849268725627,0.6986839234203838,0.5567616463138851,0.5572139303482587,1.0,1.0,none,0.6650557867338649,0.6625457662868285,0.9655916800248371,0.6233302324315146,COMPLETE
393,0.7156549520766773,2025-11-26 18:50:57.987018,2025-11-26 18:51:04.189494,0 days 00:00:06.202476,0.05976141337018715,gbtree,0.9020903597475011,0.12110033950365329,lossguide,0.8479157209865038,0.0024953441870464404,5,8,7.352787787505651,800,,0.8324378784505576,0.17884608376977476,0.0824216283655508,oversample,0.5829054053253135,,7.0,0.709930824661602,,,,0.5474417699195655,0.26401118300962706,0.5567616463138851,0.5572139303482587,0.715281812899477,0.7156549520766773,0.8324378784505576,0.17884608376977476,0.08,0.48831098256150013,0.5168123181614467,0.5567616463138851,0.5572139303482587,1.0,1.0,oversample,0.4291433876556309,0.47171693219956756,0.5829054053253135,0.26401118300962706,COMPLETE
394,0.7156549520766773,2025-11-26 18:51:04.371611,2025-11-26 18:52:00.183877,0 days 00:00:55.812266,4.773357912064038,dart,0.3043598518743381,5.673352464274202,lossguide,0.04292371685971913,0.009090248911610766,7,12,4.464199163653685,700,tree,0.6179891066876098,0.7697932891328437,0.05833397890580094,undersample,0.5904400674843382,,12.0,0.6905513409928069,0.15843270624808659,weighted,0.15559509384357814,0.7835590221167427,0.029165189925116575,0.5567616463138851,0.5572139303482587,0.715281812899477,0.7156549520766773,0.6179891066876098,0.7697932891328437,0.05,0.436935596419231,0.4390144833360244,0.5567616463138851,0.5572139303482587,1.0,1.0,undersample,0.29143180424078646,0.29537702466073257,0.5904400674843382,0.029165189925116575,COMPLETE
395,0.6519026824703681,2025-11-26 18:52:00.349629,2025-11-26 18:53:15.429524,0 days 00:01:15.079895,0.06653149087520288,dart,0.4997881932987841,2.273558181786602,depthwise,0.013013906223634996,0.03689585925881143,7,12,0.34427253136003905,300,tree,0.7752655737738207,0.3562070751143842,0.07431351768653105,undersample,0.6237537746892593,,12.0,0.6414732950539662,0.32262258725851567,weighted,0.5117062320042368,0.5684208848127095,0.17339141489644375,0.508819538670285,0.49525101763907736,0.6621032980709396,0.6519026824703681,0.7752655737738207,0.3562070751143842,0.08,0.47845526349358825,0.4550037579124634,0.5365607665153808,0.5293819655521783,0.8643379366368806,0.8482142857142857,undersample,0.3468608564465592,0.30991901357069895,0.6237537746892593,0.17339141489644375,COMPLETE
396,0.6838211643615311,2025-11-26 18:53:15.600439,2025-11-26 18:55:05.195395,0 days 00:01:49.594956,0.03575111849063173,dart,0.42140253311490256,2.644329993722378,depthwise,0.05288261985581472,0.12478202150642616,2,7,0.9946674894453876,1000,tree,0.7636676931211298,0.44699307416921863,0.029570559026295053,none,0.8787357050146731,1.24580416742553,9.0,0.818601279063907,0.2661010887336828,uniform,0.30258602469213064,0.7884268942051467,0.5744187694917895,0.5368611488014473,0.5554047942107644,0.6679636835278858,0.6838211643615311,0.7636676931211298,0.44699307416921863,0.02,0.545380402055794,0.5530591112195212,0.5558553696708041,0.5663292488012787,0.8367181153533713,0.8628246753246753,none,0.492697160098808,0.512710093787724,0.8787357050146731,0.5744187694917895,COMPLETE
397,0.0,2025-11-26 18:55:05.368795,2025-11-26 18:57:12.617157,0 days 00:02:07.248362,0.0016216343439336145,dart,0.662415659532965,2.2061091644901833,depthwise,0.4577204019910733,0.0002269850769142514,0,12,76.6144303942153,1000,tree,0.6155594015441719,0.10766124800276367,0.026781319669531033,none,0.5677168939441152,0.843539517133671,6.0,0.9273916363268087,0.07618521873825973,weighted,0.4443273590530122,0.9577329428697035,0.63150439523511,0.44323835368611486,0.4427860696517413,0.0,0.0,0.6155594015441719,0.10766124800276367,0.02,0.5567616463138851,0.5572139303482587,0.0,0.0,0.0,0.0,none,0.5,0.5,0.5677168939441152,0.63150439523511,COMPLETE
398,0.7156549520766773,2025-11-26 18:57:12.787488,2025-11-26 18:57:13.651894,0 days 00:00:00.864406,0.025445701661271806,gbtree,0.7791315835603845,4.3892075747302375,depthwise,0.33960558063359586,0.00013560797501277643,2,5,21.06494701173303,600,,0.8869810796341729,0.18576770689192126,0.0831788549089624,undersample,0.852499366743736,,7.0,0.6148856916488882,,,,0.552833965016176,0.4221947314306005,0.5567616463138851,0.5572139303482587,0.715281812899477,0.7156549520766773,0.8869810796341729,0.18576770689192126,0.08,0.5247958651544611,0.5309050806255816,0.5567616463138851,0.5572139303482587,1.0,1.0,undersample,0.4575046834330808,0.4713998016794237,0.852499366743736,0.4221947314306005,COMPLETE
399,0.7156549520766773,2025-11-26 18:57:13.820666,2025-11-26 18:58:11.256663,0 days 00:00:57.435997,1.0744228661182709,dart,0.21024729981217682,5.48026023428049,depthwise,1.494666635714477,0.09942169449210615,7,8,2.7343033364534866,700,forest,0.6326081347856397,0.9241224593538095,0.03399739788229663,undersample,0.6688354810387775,,12.0,0.7514162897308803,0.22449159131496624,weighted,0.4084979255815984,0.9465733593950167,0.4148414794841736,0.5567616463138851,0.5572139303482587,0.715281812899477,0.7156549520766773,0.6326081347856397,0.9241224593538095,0.02,0.4946135530193639,0.49314293905218715,0.5567616463138851,0.5572139303482587,1.0,1.0,undersample,0.31346590626502424,0.29389874043219294,0.6688354810387775,0.4148414794841736,COMPLETE
400,0.7156549520766773,2025-11-26 18:58:11.424790,2025-11-26 18:58:12.178876,0 days 00:00:00.754086,27.682064352867886,gbtree,0.9928596063337081,5.09285623531561,depthwise,3.0589552407132077,0.013418585485848464,6,10,48.57363554912773,600,,0.8790438318862679,0.9033227926142252,0.09446455924294925,oversample,0.7708614887406229,,10.0,0.875377296417466,,,,0.8368999764864702,0.2710893095002087,0.5567616463138851,0.5572139303482587,0.715281812899477,0.7156549520766773,0.8790438318862679,0.9033227926142252,0.1,0.4893730604130471,0.48938833864992715,0.5567616463138851,0.5572139303482587,1.0,1.0,oversample,0.3219242693015467,0.32302956236817315,0.7708614887406229,0.2710893095002087,COMPLETE
401,0.7156549520766773,2025-11-26 18:58:12.352462,2025-11-26 18:58:12.959570,0 days 00:00:00.607108,0.0011720774933913086,gbtree,0.5525561470093231,7.696839416155724,depthwise,16.761390993231426,0.019361281135644087,7,11,0.14638524562439503,400,,0.9571886192108149,0.5046648404482369,0.0651948963727007,undersample,0.6177553242169772,,11.0,0.6615795756142241,,,,0.4716745037686564,0.18590353353216837,0.5567616463138851,0.5572139303482587,0.715281812899477,0.7156549520766773,0.9571886192108149,0.5046648404482369,0.08,0.4887851868130037,0.4844861073251427,0.5567616463138851,0.5572139303482587,1.0,1.0,undersample,0.4059259934680614,0.3996947256012628,0.6177553242169772,0.18590353353216837,COMPLETE
402,0.7156549520766773,2025-11-26 18:58:13.131182,2025-11-26 18:58:51.842859,0 days 00:00:38.711677,0.011355984141949202,dart,0.531357462460787,8.717418214392183,lossguide,0.05501446602400347,0.0006393287994424687,3,4,0.7159146656483149,600,tree,0.7675778253771495,0.15334664960515548,0.03796366542618009,oversample,0.7121656784811436,,11.0,0.6769125119269316,0.27045032827457505,weighted,0.2555055524725691,0.8115994732110992,0.17349494750227346,0.5567616463138851,0.5572139303482587,0.715281812899477,0.7156549520766773,0.7675778253771495,0.15334664960515548,0.05,0.5680226705374499,0.5660731027069863,0.5567616463138851,0.5572139303482587,1.0,1.0,oversample,0.5203124222881679,0.516242886327156,0.7121656784811436,0.17349494750227346,COMPLETE
403,0.7156549520766773,2025-11-26 18:58:52.015456,2025-11-26 18:58:53.002222,0 days 00:00:00.986766,11.274074493825013,gbtree,0.24573504354904066,9.665985417286386,lossguide,1.7741642317162005,0.0046559325084379235,0,7,0.3307405915522736,1000,,0.7878979641156465,0.8547226992485256,0.08556355796907715,oversample,0.5586919779775816,,9.0,0.6349180070293321,,,,0.5835693494102064,0.18640480970057605,0.5567616463138851,0.5572139303482587,0.715281812899477,0.7156549520766773,0.7878979641156465,0.8547226992485256,0.08,0.5567616463138851,0.5572139303482587,0.5567616463138851,0.5572139303482587,1.0,1.0,oversample,0.5,0.5,0.5586919779775816,0.18640480970057605,COMPLETE
404,0.7156549520766773,2025-11-26 18:58:53.175059,2025-11-26 18:59:01.804574,0 days 00:00:08.629515,0.08097654098868771,dart,0.716092335869971,9.024022468480373,depthwise,0.00013112352450648102,0.02969713106726457,7,4,0.15753665428582803,300,forest,0.7937274205242679,0.7967015224686964,0.03247005016410174,none,0.7919628318527538,2.7804245312975793,8.0,0.8496430963290821,0.3862210872903105,weighted,0.17381650084908123,0.24558145246730245,0.4967507776550398,0.5567616463138851,0.5572139303482587,0.715281812899477,0.7156549520766773,0.7937274205242679,0.7967015224686964,0.02,0.4699289458157502,0.4610458515252786,0.5567616463138851,0.5572139303482587,1.0,1.0,none,0.3365718098774847,0.32450867569611186,0.7919628318527538,0.4967507776550398,COMPLETE
405,0.7156549520766773,2025-11-26 18:59:01.986813,2025-11-26 18:59:02.969390,0 days 00:00:00.982577,2.695570608945429,gbtree,0.47899186650043585,7.345269800661963,lossguide,0.4556754143967998,0.0002926671325992681,0,3,0.7554023669578148,1000,,0.5848111902173415,0.2005339404762121,0.09510902677067955,oversample,0.8166560179442368,,9.0,0.6764372877726144,,,,0.6708996979290518,0.07527856781518501,0.5567616463138851,0.5572139303482587,0.715281812899477,0.7156549520766773,0.5848111902173415,0.2005339404762121,0.1,0.48612699062835607,0.48420176300660744,0.5567616463138851,0.5572139303482587,1.0,1.0,oversample,0.2901154694209121,0.279374991709006,0.8166560179442368,0.07527856781518501,COMPLETE
406,0.7156549520766773,2025-11-26 18:59:03.143696,2025-11-26 18:59:54.644907,0 days 00:00:51.501211,0.0015191146738692204,dart,0.7814355304405051,0.6291706313095602,lossguide,1.17735501432389,0.000793580416337198,0,12,12.452708800832667,700,forest,0.5622383717240343,0.07187375954080989,0.037374557816686596,none,0.5309907698379733,1.709226213458175,8.0,0.8242906933413404,0.48126423753488673,weighted,0.5062513827490933,0.8873797665540808,0.6413027800804825,0.5567616463138851,0.5572139303482587,0.715281812899477,0.7156549520766773,0.5622383717240343,0.07187375954080989,0.05,0.6398262908783151,0.6628178904053164,0.5567616463138851,0.5572139303482587,1.0,1.0,none,0.5868014224373745,0.6051260728546224,0.5309907698379733,0.6413027800804825,COMPLETE
