number,value,datetime_start,datetime_complete,duration,params_alpha,params_booster,params_colsample_bytree,params_gamma,params_grow_policy,params_lambda,params_learning_rate,params_max_delta_step,params_max_depth,params_min_child_weight,params_n_estimators,params_normalize_type,params_params_feature_fraction,params_params_labeled_ratio,params_params_missing_rate,params_params_resampling,params_params_sample_rows,params_params_scale_pos_weight,params_params_selftrain_max_iter,params_params_selftrain_threshold,params_rate_drop,params_sample_type,params_skip_drop,params_subsample,params_user_attrs_decision_threshold,user_attrs_acc_test,user_attrs_acc_val,user_attrs_f1_test,user_attrs_f1_val,user_attrs_feature_fraction,user_attrs_labeled_ratio,user_attrs_missing_rate,user_attrs_pr_auc_test,user_attrs_pr_auc_val,user_attrs_prec_test,user_attrs_prec_val,user_attrs_rec_test,user_attrs_rec_val,user_attrs_resampling_strategy,user_attrs_roc_auc_test,user_attrs_roc_auc_val,user_attrs_sample_rows,user_attrs_user_attrs_decision_threshold,state
2242,0.7156549520766773,2025-11-30 13:00:22.224278,2025-11-30 13:00:30.592414,0 days 00:00:08.368136,56.4363109842411,dart,0.4380993437313106,1.9738826222211403,lossguide,0.024667396698273728,0.0006411380752965563,2,9,0.5085813649759823,300,forest,0.8699332793824119,0.4688686385759146,0.05786356332052254,oversample,0.8956418282252436,,12.0,0.7783467100255312,0.3814636690108342,weighted,0.10046546987063519,0.49342417564160856,,0.5567616463138851,0.5572139303482587,0.715281812899477,0.7156549520766773,0.8699332793824119,0.4688686385759146,0.08,0.5567616463138851,0.5572139303482587,0.5567616463138851,0.5572139303482587,1.0,1.0,oversample,0.5,0.5,0.8956418282252436,0.5,COMPLETE
2243,0.5185497470489039,2025-11-30 13:00:31.364142,2025-11-30 13:00:31.874691,0 days 00:00:00.510549,0.014524572071852478,gbtree,0.7545994834416476,1.0811275170455004,depthwise,0.0001492688613281374,0.0005539388686127832,6,4,7.4036329119001625,200,,0.7825736693015675,0.26842409923548616,0.02084983204879706,undersample,0.7430810483788226,,6.0,0.7914768808072721,,,,0.7750873428070462,,0.4735413839891452,0.4834916327453641,0.5145954962468724,0.5185497470489039,0.7825736693015675,0.26842409923548616,0.08,0.546517498082282,0.5333090180942266,0.5287060839760068,0.5394736842105263,0.5012185215272137,0.4991883116883117,undersample,0.4540977967141366,0.4589052737354576,0.7430810483788226,0.5,COMPLETE
2244,0.7156549520766773,2025-11-30 13:00:32.647283,2025-11-30 13:00:33.605174,0 days 00:00:00.957891,4.6818511970313965,gbtree,0.781159107885872,5.361814185121025,lossguide,0.0007392950957944412,0.0008420339646572705,7,8,0.16381234749582416,1000,,0.7585697857768926,0.4742002603015,0.08457396341581296,none,0.7807081040378517,4.270475852222147,6.0,0.7895748020469161,,,,0.5968877252814458,,0.5567616463138851,0.5572139303482587,0.715281812899477,0.7156549520766773,0.7585697857768926,0.4742002603015,0.08,0.6094304172412099,0.5858745998799441,0.5567616463138851,0.5572139303482587,1.0,1.0,none,0.6284043999403173,0.5836760277516151,0.7807081040378517,0.5,COMPLETE
2245,0.7156549520766773,2025-11-30 13:00:34.380719,2025-11-30 13:01:13.964959,0 days 00:00:39.584240,0.03231413374950376,dart,0.4313668097238901,5.592181827752403,depthwise,13.424526863067294,0.001154391957924182,1,9,0.255445341387218,600,tree,0.5559360259182329,0.20148777637156942,0.034216208258716074,oversample,0.8956965193788881,,9.0,0.861724562613893,0.4999783063788625,weighted,0.6139941773665679,0.5806183271576493,,0.5567616463138851,0.5572139303482587,0.715281812899477,0.7156549520766773,0.5559360259182329,0.20148777637156942,0.08,0.613885855257438,0.6014123600934845,0.5567616463138851,0.5572139303482587,1.0,1.0,oversample,0.5794575506888378,0.5729653071647454,0.8956965193788881,0.5,COMPLETE
2246,0.0,2025-11-30 13:01:14.700820,2025-11-30 13:01:53.052292,0 days 00:00:38.351472,0.0008919670934035521,dart,0.4054052889589593,6.221922694904162,depthwise,22.93169511772986,0.0707289637851482,10,6,1.3816237369176383,600,tree,0.7150135353760187,0.3580599383233362,0.02770826690937104,undersample,0.7259745051847577,,6.0,0.8462766629021963,0.27393704993083967,uniform,0.23920324432978454,0.20712492791356604,,0.44323835368611486,0.4427860696517413,0.0,0.0,0.7150135353760187,0.3580599383233362,0.08,0.4682204349064825,0.4764604987900586,0.0,0.0,0.0,0.0,undersample,0.2893735804638671,0.3041389471100911,0.7259745051847577,0.5,COMPLETE
2247,0.7156549520766773,2025-11-30 13:01:53.829540,2025-11-30 13:01:57.417563,0 days 00:00:03.588023,6.1981253099794955,dart,0.42261874925692205,5.596679298690939,lossguide,0.05132869958394093,0.274104649344956,9,10,0.2095981070365765,200,forest,0.6056031098975483,0.6353388128517865,0.007078389665272089,none,0.6934837035957774,1.8227211534244192,6.0,0.7171447423452885,0.4526815851613336,uniform,0.11276728474814492,0.6987840048837499,,0.5567616463138851,0.5572139303482587,0.715281812899477,0.7156549520766773,0.6056031098975483,0.6353388128517865,0.08,0.5652087676924642,0.5608177681587645,0.5567616463138851,0.5572139303482587,1.0,1.0,none,0.4593221041462889,0.4618933479697014,0.6934837035957774,0.5,COMPLETE
2248,0.2992269213278763,2025-11-30 13:01:58.187951,2025-11-30 13:01:58.599858,0 days 00:00:00.411907,0.0002284055306005249,gbtree,0.28299643437218497,3.5567423120074624,depthwise,6.7762759693282755,0.0008531609258562516,5,5,0.7923898660217177,200,,0.9635752188236617,0.2692689558805424,0.07811782085684593,undersample,0.7400217163019546,,6.0,0.7682903265324946,,,,0.483626136052606,,0.31614654002713705,0.30303030303030304,0.3195319531953195,0.2992269213278763,0.9635752188236617,0.2692689558805424,0.08,0.4369906678322427,0.43589698039018104,0.35822401614530774,0.34022750775594623,0.2883834281072299,0.26704545454545453,undersample,0.2878280475472073,0.27308917461496623,0.7400217163019546,0.5,COMPLETE
2249,0.24615384615384617,2025-11-30 13:01:59.379250,2025-11-30 13:02:11.164221,0 days 00:00:11.784971,0.0004546257951148222,dart,0.9665530969260396,5.928977624010155,lossguide,0.1373750905436082,0.0325293268426355,8,5,34.16910810214667,300,forest,0.7862057142282957,0.5127030591674482,0.0008636591717047005,none,0.8746684252094135,0.7634383272351501,12.0,0.6677474382793018,0.10498151510313919,uniform,0.4136073446950772,0.31723236924261305,,0.35866123925825416,0.37946630483943916,0.22087912087912087,0.24615384615384617,0.7862057142282957,0.5127030591674482,0.08,0.45846005532644984,0.46642714049703504,0.34125636672325976,0.38095238095238093,0.16328188464662877,0.18181818181818182,none,0.3707915416369635,0.38213647307748433,0.8746684252094135,0.5,COMPLETE
2250,0.5,2025-11-30 13:02:11.943316,2025-11-30 13:02:16.343920,0 days 00:00:04.400604,0.04109535894722091,dart,0.3367941167746976,6.461075337502055,depthwise,0.037444699378124995,0.10689589339557817,5,4,4.067051467286247,200,tree,0.5254298745688355,0.8836897381849005,0.08551020525044381,undersample,0.7266551273032401,,9.0,0.847172860338557,0.3331653864478769,weighted,0.012714259536297113,0.3003232110387739,,0.40343735866123925,0.4364540931705111,0.4747112704101951,0.5,0.5254298745688355,0.8836897381849005,0.08,0.4892379903785902,0.4973334652440364,0.465625,0.49444444444444446,0.4841592201462226,0.5056818181818182,undersample,0.3725795354697524,0.4033170608757942,0.7266551273032401,0.5,COMPLETE
2251,0.7156549520766773,2025-11-30 13:02:17.127338,2025-11-30 13:02:56.477932,0 days 00:00:39.350594,0.0011945062299653362,dart,0.5053013033349298,8.937179295227336,lossguide,0.058208391346960424,0.0035291872120310256,0,12,5.394050404499214,600,tree,0.7096754958673868,0.4233014668123026,0.07512853270023069,oversample,0.5968970785305482,,10.0,0.6987278281672716,0.2474075670456894,weighted,0.24054033535137767,0.5400519307307328,,0.5567616463138851,0.5572139303482587,0.715281812899477,0.7156549520766773,0.7096754958673868,0.4233014668123026,0.08,0.46984004217056924,0.4738666463749742,0.5567616463138851,0.5572139303482587,1.0,1.0,oversample,0.3516595102703957,0.3398702293620578,0.5968970785305482,0.5,COMPLETE
2252,0.5061406773353182,2025-11-30 13:02:57.265488,2025-11-30 13:02:57.907161,0 days 00:00:00.641673,2.3459663183221933,gbtree,0.3316873831173881,9.61632975675131,lossguide,0.13936591405820997,0.33770286857326076,9,8,0.5513603074928447,600,,0.5853281099635044,0.7298851244005871,0.03262644217301998,undersample,0.9216774077363242,,5.0,0.8022073528626351,,,,0.8250727174070376,,0.3948439620081411,0.3998190863862506,0.5040770941438102,0.5061406773353182,0.5853281099635044,0.7298851244005871,0.08,0.507757270666281,0.5144520193123987,0.46353101567825494,0.46735395189003437,0.5523964256701869,0.551948051948052,undersample,0.3950355609343656,0.4062412944563098,0.9216774077363242,0.5,COMPLETE
2253,0.0,2025-11-30 13:02:58.688317,2025-11-30 13:02:59.372123,0 days 00:00:00.683806,27.466693353295607,gbtree,0.6060451990823725,7.070725522656809,depthwise,0.50723832230338,0.02508615921645614,2,7,25.01290906574676,700,,0.65737962620023,0.6424845699937176,0.07806391567523405,none,0.842136522577118,0.7411729461226101,12.0,0.6517592432022739,,,,0.39822540537693585,,0.44323835368611486,0.4427860696517413,0.0,0.0,0.65737962620023,0.6424845699937176,0.08,0.5567616463138851,0.5572139303482587,0.0,0.0,0.0,0.0,none,0.5,0.5,0.842136522577118,0.5,COMPLETE
2254,0.7156549520766773,2025-11-30 13:03:00.159622,2025-11-30 13:03:20.068997,0 days 00:00:19.909375,0.0009628716523891369,dart,0.6259884662768442,9.003383427056294,lossguide,0.3774505137691178,0.003141858490384316,7,10,17.493895814318567,400,tree,0.5128721068749347,0.4714376994152646,0.07946117182649748,none,0.7321835121667037,3.216871237446243,9.0,0.7554586031992414,0.46765020419328074,weighted,0.8159276859465825,0.9608555400394418,,0.5567616463138851,0.5572139303482587,0.715281812899477,0.7156549520766773,0.5128721068749347,0.4714376994152646,0.08,0.5567616463138851,0.5572139303482587,0.5567616463138851,0.5572139303482587,1.0,1.0,none,0.5,0.5,0.7321835121667037,0.5,COMPLETE
2255,0.7156549520766773,2025-11-30 13:03:20.832637,2025-11-30 13:04:57.852412,0 days 00:01:37.019775,0.06643540323376135,dart,0.6883546021021831,1.427988669081106,depthwise,35.62903379027675,0.1019037519819036,3,5,0.10907558543309434,900,forest,0.6652011186912437,0.665217386352448,0.018532113872958167,none,0.7084016533653619,1.6268663889955974,12.0,0.8118394445983241,0.30721304217699946,uniform,0.5649376901059066,0.24063811192278264,,0.5567616463138851,0.5572139303482587,0.715281812899477,0.7156549520766773,0.6652011186912437,0.665217386352448,0.08,0.54054167170113,0.535870653833129,0.5567616463138851,0.5572139303482587,1.0,1.0,none,0.49829406986190095,0.4826954518923365,0.7084016533653619,0.5,COMPLETE
2256,0.6185397867104184,2025-11-30 13:04:58.588688,2025-11-30 13:05:01.816026,0 days 00:00:03.227338,0.006975555252117213,gbtree,0.20133089894160827,1.7801758545621216,depthwise,0.1300305269899606,0.02016983953821253,8,9,0.6437730615101579,600,,0.9346595510321345,0.24328861291742107,0.01647649031550046,undersample,0.6039799290363295,,10.0,0.7780338901021299,,,,0.5081843573537462,,0.5739484396200815,0.5793758480325645,0.6158238172920065,0.6185397867104184,0.9346595510321345,0.24328861291742107,0.08,0.681829346482536,0.666950677029147,0.6183456183456183,0.6252072968490879,0.6133225020308692,0.612012987012987,undersample,0.615801820321955,0.6165804956024568,0.6039799290363295,0.5,COMPLETE
2257,0.0,2025-11-30 13:05:02.587349,2025-11-30 13:05:02.964638,0 days 00:00:00.377289,0.012022673310206131,gbtree,0.5600905858110024,4.63072623691111,depthwise,0.00588170264864972,0.055894272902835655,0,6,93.68179456813914,200,,0.9259579543260673,0.32195509466843936,0.06656864286583843,undersample,0.8168659822705086,,6.0,0.6916843110614347,,,,0.2735448633585505,,0.44323835368611486,0.4427860696517413,0.0,0.0,0.9259579543260673,0.32195509466843936,0.08,0.5567616463138851,0.5572139303482587,0.0,0.0,0.0,0.0,undersample,0.5,0.5,0.8168659822705086,0.5,COMPLETE
2258,0.431438127090301,2025-11-30 13:05:03.738013,2025-11-30 13:05:04.376638,0 days 00:00:00.638625,0.002502993704702185,gbtree,0.5382422923830124,9.649381252645671,depthwise,4.689385558988104,0.00011161472249360992,8,6,12.759062523209469,600,,0.5144093776728376,0.6461933239516768,0.07064708347768159,undersample,0.8930428499420812,,10.0,0.8581597533087568,,,,0.41160162512813536,,0.3681592039800995,0.38489371325192223,0.4112937210282343,0.431438127090301,0.5144093776728376,0.6461933239516768,0.08,0.43302094720189344,0.4447056904291665,0.4273204903677758,0.44482758620689655,0.39642567018683994,0.41883116883116883,undersample,0.263861304066712,0.28730740020959633,0.8930428499420812,0.5,COMPLETE
2259,0.7156549520766773,2025-11-30 13:05:05.141852,2025-11-30 13:05:30.034080,0 days 00:00:24.892228,25.712594524424368,dart,0.5814122284057448,0.9466832290906735,depthwise,4.600784006384094,0.25677325738594164,2,8,15.264618868340504,500,tree,0.5838827904071955,0.2653705067140117,0.07322159326873108,oversample,0.7295562616133577,,8.0,0.7047748811713532,0.4334334480274302,weighted,0.0372490300866427,0.8603106265729215,,0.5567616463138851,0.5572139303482587,0.715281812899477,0.7156549520766773,0.5838827904071955,0.2653705067140117,0.08,0.5364471863831891,0.5371454556691416,0.5567616463138851,0.5572139303482587,1.0,1.0,oversample,0.38000961554402424,0.39093280315190426,0.7295562616133577,0.5,COMPLETE
2260,0.4740806380150642,2025-11-30 13:05:30.785027,2025-11-30 13:07:37.408493,0 days 00:02:06.623466,1.4141691079663121,dart,0.8823783373585807,0.027258690094982274,depthwise,0.0007466691391896877,0.016284870089030377,4,10,13.300475013941446,1000,forest,0.5895417592032834,0.7943066448849441,0.04392019707217765,undersample,0.8365285250165513,,5.0,0.7784086301785353,0.40827804021526043,uniform,0.7668207469348943,0.7719747983336858,,0.4699231117141565,0.4631388511985527,0.48278905560458957,0.4740806380150642,0.5895417592032834,0.7943066448849441,0.08,0.5250530348113545,0.5073961842989579,0.5285024154589372,0.5219512195121951,0.44435418359057677,0.4342532467532468,undersample,0.47394726371458407,0.45424822241088836,0.8365285250165513,0.5,COMPLETE
2261,0.708905109489051,2025-11-30 13:07:38.179349,2025-11-30 13:09:07.767902,0 days 00:01:29.588553,0.0004168404757092114,dart,0.20039277104003475,2.7617700627766064,depthwise,3.4661198550259416,0.017992391593925645,0,4,10.823974926909225,1000,forest,0.9431123593907437,0.25782703406451574,0.029572607868835032,oversample,0.8627956459054884,,8.0,0.8747976681878891,0.4404407267894313,uniform,0.17879848635201526,0.391741510432591,,0.5477159656264133,0.5490728177295342,0.7077732320280538,0.708905109489051,0.9431123593907437,0.25782703406451574,0.08,0.4050189428308223,0.3910571997308634,0.5527156549520766,0.5535795713634291,0.983753046303818,0.9853896103896104,oversample,0.22885036224075336,0.1895499482641975,0.8627956459054884,0.5,COMPLETE
2262,0.7156549520766773,2025-11-30 13:09:08.561227,2025-11-30 13:09:09.275542,0 days 00:00:00.714315,3.3187346930363755,gbtree,0.8333944027385101,1.4282453313212085,lossguide,15.474787434478097,0.01904383794439122,7,9,5.37678103959283,600,,0.64264396972515,0.8314000991383579,0.01755034140755074,oversample,0.655064844858037,,10.0,0.8022899466816655,,,,0.9714953599455292,,0.5567616463138851,0.5572139303482587,0.715281812899477,0.7156549520766773,0.64264396972515,0.8314000991383579,0.08,0.5367971718086528,0.5162825992409393,0.5567616463138851,0.5572139303482587,1.0,1.0,oversample,0.4951031184203982,0.47602493267712875,0.655064844858037,0.5,COMPLETE
2263,0.7034120734908137,2025-11-30 13:09:10.080780,2025-11-30 13:09:31.989126,0 days 00:00:21.908346,2.008564379169731,dart,0.49385489246004544,3.991362440071385,lossguide,0.06368389169341047,0.21328095069077788,8,6,31.873401640001706,400,forest,0.9794534623018814,0.738698068981956,0.06902621570556147,oversample,0.9824321208269569,,5.0,0.83752071599653,0.0649624333076877,weighted,0.8880610114446531,0.24899971688134884,,0.5811849841700588,0.5911352329262777,0.695994747209455,0.7034120734908137,0.9794534623018814,0.738698068981956,0.08,0.5950764391712053,0.6100299787072421,0.5840220385674931,0.5903083700440529,0.8610885458976442,0.8701298701298701,oversample,0.5724763341567334,0.59104340501174,0.9824321208269569,0.5,COMPLETE
2264,0.7156549520766773,2025-11-30 13:09:32.758495,2025-11-30 13:09:33.211813,0 days 00:00:00.453318,4.426185857423289,gbtree,0.28978588983219533,9.19405988910597,depthwise,0.0032309674437264882,0.00010438359364669924,7,11,0.1548244879374997,300,,0.6850113635494144,0.6036364061099981,0.05447598583067481,none,0.6904266712893897,0.9806079752729748,12.0,0.8800879174440929,,,,0.7257385499365487,,0.5567616463138851,0.5572139303482587,0.715281812899477,0.7156549520766773,0.6850113635494144,0.6036364061099981,0.08,0.46925936226726517,0.4707162290145885,0.5567616463138851,0.5572139303482587,1.0,1.0,none,0.2887684643313052,0.2927011063502381,0.6904266712893897,0.5,COMPLETE
2265,0.7156549520766773,2025-11-30 13:09:33.980702,2025-11-30 13:10:38.077179,0 days 00:01:04.096477,53.44498711054583,dart,0.43972434099896857,7.4825616222096425,lossguide,0.001070898234742891,0.08600349965876272,10,9,65.09817230565065,700,forest,0.8921439359314582,0.34061463636217454,0.04479603705550499,undersample,0.6746730815926276,,10.0,0.7565697865291469,0.0637435540060921,weighted,0.5862234134797929,0.892164821095383,,0.5567616463138851,0.5572139303482587,0.715281812899477,0.7156549520766773,0.8921439359314582,0.34061463636217454,0.08,0.5567616463138851,0.5572139303482587,0.5567616463138851,0.5572139303482587,1.0,1.0,undersample,0.5,0.5,0.6746730815926276,0.5,COMPLETE
2266,0.7156549520766773,2025-11-30 13:10:38.860646,2025-11-30 13:10:39.847863,0 days 00:00:00.987217,14.460417324092655,gbtree,0.6264849959637693,0.817930757153571,depthwise,0.0017625230766914266,0.0011649088247074127,10,3,0.4454704523848315,800,,0.7087714255094246,0.373373020858772,0.021648792168083887,oversample,0.9704093379323051,,11.0,0.9220787753959578,,,,0.9170235257816901,,0.5567616463138851,0.5572139303482587,0.715281812899477,0.7156549520766773,0.7087714255094246,0.373373020858772,0.08,0.5412844006564208,0.5368216309355869,0.5567616463138851,0.5572139303482587,1.0,1.0,oversample,0.45689790944810094,0.4654012675271613,0.9704093379323051,0.5,COMPLETE
2267,0.7156549520766773,2025-11-30 13:10:40.633948,2025-11-30 13:10:41.413241,0 days 00:00:00.779293,0.0005490467683692469,gbtree,0.8471076484609827,8.64227373869638,depthwise,0.012653266972433654,0.19207555737501975,2,12,0.6082521921295582,900,,0.958953222790452,0.5215057020602689,0.04131835693784039,none,0.532695760355955,1.1762928975755236,8.0,0.7792782059523884,,,,0.7948979193551333,,0.5567616463138851,0.5572139303482587,0.715281812899477,0.7156549520766773,0.958953222790452,0.5215057020602689,0.08,0.5266307351760715,0.5188340455431075,0.5567616463138851,0.5572139303482587,1.0,1.0,none,0.40805467597274486,0.39635760052001123,0.532695760355955,0.5,COMPLETE
2268,0.7136511696772283,2025-11-30 13:10:42.191393,2025-11-30 13:10:42.724697,0 days 00:00:00.533304,1.4743265153904235,gbtree,0.22218845304753565,3.63892774321953,depthwise,6.621933700474974,0.01451441413016214,3,7,2.719029243612858,400,,0.7404344086746263,0.4959448750260333,0.07753552964263155,none,0.9585509838334217,0.910380211479823,5.0,0.76034637885105,,,,0.9563361206873859,,0.555857078245138,0.5626413387607417,0.7082590612002376,0.7136511696772283,0.7404344086746263,0.4959448750260333,0.08,0.5487320014253287,0.5723658963835604,0.5583138173302108,0.5617715617715617,0.9683184402924452,0.9780844155844156,none,0.46641937034765163,0.5006417229348792,0.9585509838334217,0.5,COMPLETE
2269,0.7156549520766773,2025-11-30 13:10:43.522013,2025-11-30 13:10:43.915264,0 days 00:00:00.393251,0.4669714001123804,gbtree,0.5451471148771937,7.550940452057819,lossguide,0.01235887464783055,0.0005386267708092637,2,12,0.3226775744931225,200,,0.8313936147103764,0.20496469715280394,0.03024130864849103,oversample,0.9854633796134907,,5.0,0.6390600787986086,,,,0.20477291265517686,,0.5567616463138851,0.5572139303482587,0.715281812899477,0.7156549520766773,0.8313936147103764,0.20496469715280394,0.08,0.4599267320097543,0.4390505079417288,0.5567616463138851,0.5572139303482587,1.0,1.0,oversample,0.32116994645136693,0.29639764602098617,0.9854633796134907,0.5,COMPLETE
2270,0.7156549520766773,2025-11-30 13:10:44.698096,2025-11-30 13:12:13.768548,0 days 00:01:29.070452,0.24484686751106496,dart,0.9952437811717945,8.594879351582493,lossguide,0.0002715982426545934,0.000803874225079337,1,10,1.4834360355415648,900,tree,0.5672246963166674,0.6051659718205267,0.047265508002614975,none,0.6234229602535937,3.681912183102108,5.0,0.9454292719958631,0.49515308667384456,weighted,0.053373540327999285,0.29202245058067255,,0.5567616463138851,0.5572139303482587,0.715281812899477,0.7156549520766773,0.5672246963166674,0.6051659718205267,0.08,0.43375024413621155,0.42731015050052207,0.5567616463138851,0.5572139303482587,1.0,1.0,none,0.3060909497836502,0.2955478191369407,0.6234229602535937,0.5,COMPLETE
2271,0.3507751937984496,2025-11-30 13:12:14.510135,2025-11-30 13:13:45.603873,0 days 00:01:31.093738,0.0004100909115169177,dart,0.6873551300826023,5.94079939445616,lossguide,18.703306890221818,0.0031333495271701137,5,4,18.150211303311114,1000,tree,0.9073121678560296,0.5551978156513655,0.01630740136830937,undersample,0.977029859418359,,12.0,0.8388406987236944,0.3021624529122826,uniform,0.007067456413076667,0.6340100490640209,,0.40343735866123925,0.3939393939393939,0.3728007608178792,0.3507751937984496,0.9073121678560296,0.5551978156513655,0.08,0.44792504123432075,0.44268664377084266,0.44954128440366975,0.43509615384615385,0.31844029244516653,0.29383116883116883,undersample,0.3273396442248711,0.3191638864200151,0.977029859418359,0.5,COMPLETE
