number,value,datetime_start,datetime_complete,duration,params_alpha,params_booster,params_colsample_bytree,params_gamma,params_grow_policy,params_lambda,params_learning_rate,params_max_delta_step,params_max_depth,params_min_child_weight,params_n_estimators,params_normalize_type,params_params_feature_fraction,params_params_labeled_ratio,params_params_missing_rate,params_params_resampling,params_params_sample_rows,params_params_scale_pos_weight,params_params_selftrain_max_iter,params_params_selftrain_threshold,params_rate_drop,params_sample_type,params_skip_drop,params_subsample,params_user_attrs_decision_threshold,user_attrs_acc_test,user_attrs_acc_val,user_attrs_f1_test,user_attrs_f1_val,user_attrs_feature_fraction,user_attrs_labeled_ratio,user_attrs_missing_rate,user_attrs_pr_auc_test,user_attrs_pr_auc_val,user_attrs_prec_test,user_attrs_prec_val,user_attrs_rec_test,user_attrs_rec_val,user_attrs_resampling_strategy,user_attrs_roc_auc_test,user_attrs_roc_auc_val,user_attrs_sample_rows,user_attrs_user_attrs_decision_threshold,state
465,0.7156549520766773,2025-11-26 19:17:34.685912,2025-11-26 19:17:35.477875,0 days 00:00:00.791963,0.009478870783644584,gbtree,0.20197729088659774,4.547995718178579,lossguide,64.58156949753713,0.00033817841290670786,2,5,0.8200834195361439,700,,0.7935101387559809,0.8565494823300632,0.03191841707000924,undersample,0.5137849080107133,,5.0,0.7952067411623049,,,,0.49008555497566275,0.2982274528749215,0.5567616463138851,0.5572139303482587,0.715281812899477,0.7156549520766773,0.7935101387559809,0.8565494823300632,0.02,0.45190840485060435,0.4440148494249286,0.5567616463138851,0.5572139303482587,1.0,1.0,undersample,0.30194175964455644,0.29128790642452546,0.5137849080107133,0.2982274528749215,COMPLETE
466,0.7135355892648775,2025-11-26 19:17:35.649850,2025-11-26 19:17:47.901861,0 days 00:00:12.252011,0.0004002459633901797,gbtree,0.7874443593420395,0.9485375810448202,lossguide,0.0005830084742331763,0.02902324169006713,5,12,6.3921880122888,300,,0.9663835604098022,0.5899394321748986,0.028862088748422273,undersample,0.8801603629620223,,12.0,0.6333030861333037,,,,0.45056595791644705,0.0825929090335165,0.555857078245138,0.555857078245138,0.7138694638694638,0.7135355892648775,0.9663835604098022,0.5899394321748986,0.02,0.562781047921187,0.5486359453429993,0.5565651976374375,0.5569216757741348,0.9951259138911455,0.9926948051948052,undersample,0.485391833418989,0.48113964686998395,0.8801603629620223,0.0825929090335165,COMPLETE
467,0.7156549520766773,2025-11-26 19:17:48.078592,2025-11-26 19:17:48.934021,0 days 00:00:00.855429,0.06309746131662788,gbtree,0.8380980970264158,1.5836272745235551,lossguide,1.1291210091845056,0.00012395456950437182,0,4,3.14428937959455,400,,0.941504527477083,0.0704903628091427,0.08855134937326212,undersample,0.9805453175838176,,6.0,0.6116502272787234,,,,0.5436236393145178,0.33674739186581804,0.5567616463138851,0.5572139303482587,0.715281812899477,0.7156549520766773,0.941504527477083,0.0704903628091427,0.08,0.5689431459737216,0.5862487520136639,0.5567616463138851,0.5572139303482587,1.0,1.0,undersample,0.4960783501052736,0.5064731935582293,0.9805453175838176,0.33674739186581804,COMPLETE
468,0.7156549520766773,2025-11-26 19:17:49.112295,2025-11-26 19:17:52.252429,0 days 00:00:03.140134,0.006852825087005286,gbtree,0.6825113825524879,1.861904700207339,lossguide,4.940288877118908,0.009594836763255576,0,3,0.5586162889247281,700,,0.5080585865007161,0.5110529169276213,0.03844387073650628,none,0.8212818894977906,1.7327008741394443,7.0,0.7809341297219493,,,,0.7507070152248045,0.10812957073431595,0.5567616463138851,0.5572139303482587,0.715281812899477,0.7156549520766773,0.5080585865007161,0.5110529169276213,0.05,0.43904791917912567,0.43936965014935725,0.5567616463138851,0.5572139303482587,1.0,1.0,none,0.3186943583282216,0.32867780202432906,0.8212818894977906,0.10812957073431595,COMPLETE
469,0.7156549520766773,2025-11-26 19:17:52.432814,2025-11-26 19:17:53.408098,0 days 00:00:00.975284,0.02019072630638908,gbtree,0.33284628097890434,3.980531647199858,depthwise,1.598297629341972,0.00036964467677666794,0,9,0.13305062996728895,800,,0.8457668036705615,0.6387824156506826,0.008100085577339326,none,0.7271666501518095,1.1646429743342315,6.0,0.7393764198430197,,,,0.4970896137232096,0.17070183300573316,0.5567616463138851,0.5572139303482587,0.715281812899477,0.7156549520766773,0.8457668036705615,0.6387824156506826,0.0,0.4187364824723885,0.41540122800531765,0.5567616463138851,0.5572139303482587,1.0,1.0,none,0.2781362423117094,0.26643440828834086,0.7271666501518095,0.17070183300573316,COMPLETE
470,0.7156549520766773,2025-11-26 19:17:53.582131,2025-11-26 19:20:06.349889,0 days 00:02:12.767758,0.046202068053567705,dart,0.7976264317307006,5.913682062935379,lossguide,0.04551337717447342,0.0003624786932211116,1,9,1.6621977728071886,1000,forest,0.5792124683407659,0.184386476325118,0.07562508797193898,none,0.9555215863913068,2.5259117939970346,7.0,0.7895241055391795,0.003413484904019881,uniform,0.3820026697120487,0.5970833331877483,0.37121544088226327,0.5567616463138851,0.5572139303482587,0.715281812899477,0.7156549520766773,0.5792124683407659,0.184386476325118,0.08,0.6413898981548013,0.6540527690554744,0.5567616463138851,0.5572139303482587,1.0,1.0,none,0.6466913410368209,0.6591526769961398,0.9555215863913068,0.37121544088226327,COMPLETE
471,0.7156549520766773,2025-11-26 19:20:06.545338,2025-11-26 19:20:07.608054,0 days 00:00:01.062716,0.003250190462258726,gbtree,0.3418525107145664,4.449892789554983,lossguide,0.06349272004720653,0.02277874278279621,8,12,0.12655283497911324,200,,0.9230817330127863,0.40795807908073717,0.08558595410366371,oversample,0.6806681788213248,,11.0,0.6042549727330745,,,,0.42542847953181245,0.022790783655057892,0.5567616463138851,0.5572139303482587,0.715281812899477,0.7156549520766773,0.9230817330127863,0.40795807908073717,0.08,0.47395682860301963,0.45653675965563334,0.5567616463138851,0.5572139303482587,1.0,1.0,oversample,0.3953671314179612,0.36048122587320747,0.6806681788213248,0.022790783655057892,COMPLETE
472,0.7156549520766773,2025-11-26 19:20:07.793575,2025-11-26 19:21:24.246281,0 days 00:01:16.452706,1.2611276463071084,dart,0.7798635654393281,3.812225016313315,depthwise,0.18441235833887773,0.009056152693359415,4,9,40.591131974902545,800,forest,0.7934459493724194,0.9145119990381622,0.0874975558462572,none,0.8553312900620955,0.664650378168468,11.0,0.9118345853856554,0.2513448248016943,uniform,0.6082329064588188,0.7556339036740916,0.30428277864189696,0.5567616463138851,0.5572139303482587,0.715281812899477,0.7156549520766773,0.7934459493724194,0.9145119990381622,0.08,0.5119026907092056,0.5052508387577535,0.5567616463138851,0.5572139303482587,1.0,1.0,none,0.4954342744408893,0.4817059217595479,0.8553312900620955,0.30428277864189696,COMPLETE
473,0.7156549520766773,2025-11-26 19:21:24.433992,2025-11-26 19:21:28.813580,0 days 00:00:04.379588,0.0019456286121538073,gbtree,0.4472026499060612,0.4455591790027189,lossguide,0.0011547107598375837,0.0019936717270279897,3,11,0.5277203218819346,200,,0.7112862788646505,0.7858428885489325,0.03372580129961045,none,0.704877298608309,1.6860575716158235,12.0,0.7661450988212961,,,,0.3974925594901515,0.21583146993649424,0.5567616463138851,0.5572139303482587,0.715281812899477,0.7156549520766773,0.7112862788646505,0.7858428885489325,0.02,0.5507773059790234,0.5324786622532067,0.5567616463138851,0.5572139303482587,1.0,1.0,none,0.5010270395729371,0.4789777701869121,0.704877298608309,0.21583146993649424,COMPLETE
474,0.7156549520766773,2025-11-26 19:21:28.988021,2025-11-26 19:21:29.651312,0 days 00:00:00.663291,0.8504574703023169,gbtree,0.5645339142056266,7.710910272474103,lossguide,1.2918068910882792,0.006186478865487049,2,6,0.1324751528018904,500,,0.7868759198319469,0.8845557492947241,0.07549038959920053,none,0.623492837958635,0.9337212600081612,10.0,0.6224123951862787,,,,0.3697375777229446,0.10679813244630046,0.5567616463138851,0.5572139303482587,0.715281812899477,0.7156549520766773,0.7868759198319469,0.8845557492947241,0.08,0.4429578505706584,0.4420091161520473,0.5567616463138851,0.5572139303482587,1.0,1.0,none,0.31532311543626385,0.30491664234641763,0.623492837958635,0.10679813244630046,COMPLETE
475,0.0,2025-11-26 19:21:29.821540,2025-11-26 19:21:30.668646,0 days 00:00:00.847106,1.227400673548345,gbtree,0.583176441951598,4.833258473258238,depthwise,0.0014631718094521358,0.2333622839127121,4,7,6.34371318149739,800,,0.7676352795329315,0.5144718016234221,0.01780213485668765,undersample,0.9425938866381419,,7.0,0.770624923598321,,,,0.8029197495721708,0.7157099167502827,0.44323835368611486,0.4427860696517413,0.0,0.0,0.7676352795329315,0.5144718016234221,0.02,0.5606734362399186,0.5608343556920484,0.0,0.0,0.0,0.0,undersample,0.4695929143387656,0.4676153774723744,0.9425938866381419,0.7157099167502827,COMPLETE
476,0.7156549520766773,2025-11-26 19:21:30.838307,2025-11-26 19:21:31.887371,0 days 00:00:01.049064,2.0850852112535887,gbtree,0.7639080436413905,4.8953153002971534,depthwise,0.00010644985219433535,0.002817894726182373,8,12,0.23343104777709564,1000,,0.6950599114695521,0.36931357191644265,0.01995773716676333,oversample,0.9990008125606974,,8.0,0.6295100062659769,,,,0.44690113742646015,0.5370963144141996,0.5572139303482587,0.5572139303482587,0.7153242221576039,0.7156549520766773,0.6950599114695521,0.36931357191644265,0.02,0.4748483414037527,0.4547583394850996,0.5570652173913043,0.5572139303482587,0.9991876523151909,1.0,oversample,0.39218612709096634,0.3428346742634281,0.9990008125606974,0.5370963144141996,COMPLETE
477,0.7156549520766773,2025-11-26 19:21:32.058105,2025-11-26 19:21:41.066663,0 days 00:00:09.008558,0.005696124729192125,dart,0.639384693412246,9.183444622492882,lossguide,18.656661595701898,0.00029461158315277744,3,3,16.69848659697611,300,forest,0.6737348965333328,0.3623199718871801,0.05073420689966065,oversample,0.7753280661803967,,12.0,0.8961150130949023,0.40788901745156037,weighted,0.2678050372278342,0.2394835702350575,0.23921980868391188,0.5567616463138851,0.5572139303482587,0.715281812899477,0.7156549520766773,0.6737348965333328,0.3623199718871801,0.05,0.4962399468636398,0.49497094357409543,0.5567616463138851,0.5572139303482587,1.0,1.0,oversample,0.3166452527396011,0.2961522325988618,0.7753280661803967,0.23921980868391188,COMPLETE
478,0.0,2025-11-26 19:21:41.256883,2025-11-26 19:21:41.935571,0 days 00:00:00.678688,0.6416337822359065,gbtree,0.9043858027685364,4.769252507192635,lossguide,0.03896035719274921,0.00999113141255202,10,9,11.923736669750106,400,,0.9065532196765718,0.6791485513269239,0.07674813136170928,undersample,0.8156742596007147,,10.0,0.8175520986704721,,,,0.7692663914663012,0.6662353898554048,0.44323835368611486,0.4427860696517413,0.0,0.0,0.9065532196765718,0.6791485513269239,0.08,0.6995388518080636,0.7222249014205964,0.0,0.0,0.0,0.0,undersample,0.671091198461513,0.6789192357693379,0.8156742596007147,0.6662353898554048,COMPLETE
479,0.6645569620253164,2025-11-26 19:21:42.124210,2025-11-26 19:21:42.920783,0 days 00:00:00.796573,0.06502095316204665,gbtree,0.8116231080117875,2.327155501505459,depthwise,0.007874693990603797,0.05378491466795518,10,9,11.696442292275817,500,,0.8406085129213664,0.8517318862906039,0.06689133683113771,oversample,0.8602217968222388,,12.0,0.7619736561128592,,,,0.6749563400190978,0.4854700673975426,0.5029398462234284,0.5205789235639982,0.6516640253565769,0.6645569620253164,0.8406085129213664,0.8517318862906039,0.08,0.5035321922176637,0.5024479536802864,0.5343035343035343,0.5446058091286307,0.8350934199837531,0.8522727272727273,oversample,0.4364487143354499,0.44163264595465823,0.8602217968222388,0.4854700673975426,COMPLETE
480,0.7156549520766773,2025-11-26 19:21:43.116016,2025-11-26 19:21:43.814987,0 days 00:00:00.698971,5.29579511915347,gbtree,0.9757001502165372,2.1037760392596176,lossguide,0.8040082010115114,0.010619856379000061,6,12,0.3103878365381683,300,,0.8225735332576183,0.39826698058822224,0.09962600569777488,oversample,0.9178781508048437,,5.0,0.8088539026480273,,,,0.8491022121595543,0.3712470018505085,0.5567616463138851,0.5572139303482587,0.715281812899477,0.7156549520766773,0.8225735332576183,0.39826698058822224,0.1,0.6269186911328264,0.6037280046687845,0.5567616463138851,0.5572139303482587,1.0,1.0,oversample,0.6324122581607785,0.6123541614157038,0.9178781508048437,0.3712470018505085,COMPLETE
481,0.7156549520766773,2025-11-26 19:21:43.991722,2025-11-26 19:22:01.393132,0 days 00:00:17.401410,12.922419134338133,dart,0.42752474515235045,6.3538793855943885,lossguide,0.033288387173207,0.00011453083898060946,0,7,51.07933607846769,400,tree,0.7092494011845092,0.4681306906922764,0.03582474586278711,none,0.8495147683360074,2.076425904178484,5.0,0.8454639072868322,0.372318217810741,uniform,0.5119469582685727,0.7433910849921058,0.31834980357547304,0.5567616463138851,0.5572139303482587,0.715281812899477,0.7156549520766773,0.7092494011845092,0.4681306906922764,0.05,0.52621349371862,0.5258749495914962,0.5567616463138851,0.5572139303482587,1.0,1.0,none,0.4034014986985859,0.3956342112943237,0.8495147683360074,0.31834980357547304,COMPLETE
482,0.7156549520766773,2025-11-26 19:22:01.564700,2025-11-26 19:22:02.264635,0 days 00:00:00.699935,0.000353680594310716,gbtree,0.8454684106601525,3.076821550432769,lossguide,37.50363513781057,0.012790887082355755,2,4,0.10223424322252911,500,,0.5922347679340365,0.35686948770647914,0.07107030553461582,oversample,0.7622227507912905,,7.0,0.8190007659617137,,,,0.674640707731734,0.3852269141384358,0.5567616463138851,0.5572139303482587,0.715281812899477,0.7156549520766773,0.5922347679340365,0.35686948770647914,0.08,0.3781687657147589,0.37713137730188045,0.5567616463138851,0.5572139303482587,1.0,1.0,oversample,0.14696405775957824,0.14020485387952192,0.7622227507912905,0.3852269141384358,COMPLETE
483,0.715862870424172,2025-11-26 19:22:02.445174,2025-11-26 19:22:27.858707,0 days 00:00:25.413533,0.13329532405643377,dart,0.7528248038251169,0.6153524537131845,lossguide,0.007629134502370639,0.010073216182546217,3,6,0.17882934091972633,300,forest,0.919331963150231,0.7247778037637925,0.09259440891616601,oversample,0.8350244642581983,,5.0,0.7502312116713408,0.12027103324792353,uniform,0.18003944556201978,0.2311462023900607,0.2865066730281883,0.5572139303482587,0.5576662143826323,0.7154896832316188,0.715862870424172,0.919331963150231,0.7247778037637925,0.1,0.5241627703346703,0.5079879457798737,0.5570135746606335,0.5574660633484163,1.0,1.0,oversample,0.463154644473549,0.4479698672114403,0.8350244642581983,0.2865066730281883,COMPLETE
484,0.7156549520766773,2025-11-26 19:22:28.030025,2025-11-26 19:22:34.073108,0 days 00:00:06.043083,0.011280077062261187,dart,0.6171889205480693,1.592335335944472,lossguide,0.001597755165431886,0.0006590383775008097,5,5,0.1094055194270992,200,forest,0.8638182805949199,0.851742747823764,0.07847992129297308,oversample,0.9514088453482602,,5.0,0.6705777720107973,0.09503416972401964,uniform,0.12490687499481216,0.2726880721721129,0.362760984263637,0.5567616463138851,0.5572139303482587,0.715281812899477,0.7156549520766773,0.8638182805949199,0.851742747823764,0.08,0.513315255153486,0.5088889363557818,0.5567616463138851,0.5572139303482587,1.0,1.0,oversample,0.46101974502229814,0.46015804292745044,0.9514088453482602,0.362760984263637,COMPLETE
485,0.7156549520766773,2025-11-26 19:22:34.277365,2025-11-26 19:22:57.400507,0 days 00:00:23.123142,1.0062566140638554,dart,0.5836460049997935,0.17186518952505553,lossguide,0.06851620986547127,0.01735923911875275,0,5,0.6523645678825296,300,forest,0.8347022984474002,0.8126820131905851,0.0824625048066198,oversample,0.6568418291226672,,7.0,0.7428062262704046,0.16026807824496608,uniform,0.1623008263482708,0.2603096629496911,0.058059006981548394,0.5567616463138851,0.5572139303482587,0.715281812899477,0.7156549520766773,0.8347022984474002,0.8126820131905851,0.08,0.554239456237406,0.5512466809532699,0.5567616463138851,0.5572139303482587,1.0,1.0,oversample,0.5220772061871053,0.5247813664884656,0.6568418291226672,0.058059006981548394,COMPLETE
486,0.7149084568439407,2025-11-26 19:22:57.580325,2025-11-26 19:24:08.852229,0 days 00:01:11.271904,0.2168225750365213,dart,0.7897571415733878,2.846465246688012,lossguide,0.003169161544996984,0.049527453510139215,4,7,0.16718500692360846,400,forest,0.706186546083537,0.5463259955091253,0.0542200240918382,oversample,0.859636900474993,,6.0,0.6946502663092029,0.10242829357833542,uniform,0.287062402588267,0.43021098151687664,0.32556790163326793,0.5567616463138851,0.5563093622795116,0.715281812899477,0.7149084568439407,0.706186546083537,0.5463259955091253,0.05,0.4919479394298384,0.5002445538438727,0.5567616463138851,0.5568130375735627,1.0,0.9983766233766234,oversample,0.45962093204462945,0.4704206352891236,0.859636900474993,0.32556790163326793,COMPLETE
487,0.7156549520766773,2025-11-26 19:24:09.018672,2025-11-26 19:24:14.556057,0 days 00:00:05.537385,0.48803511427085694,dart,0.6371454262156496,2.992880901627063,lossguide,0.0019731710143711017,0.024358328174040246,4,7,0.24219973139129664,200,forest,0.9342194773642956,0.5263703693842388,0.08417649304797536,oversample,0.8428474250244024,,8.0,0.7453687964438123,0.11959423101796256,uniform,0.15201918403675865,0.3631788161919305,0.2958670565134423,0.5567616463138851,0.5572139303482587,0.715281812899477,0.7156549520766773,0.9342194773642956,0.5263703693842388,0.08,0.5326346676572061,0.5099904964727795,0.5567616463138851,0.5572139303482587,1.0,1.0,oversample,0.5080385119116696,0.47328849011050234,0.8428474250244024,0.2958670565134423,COMPLETE
488,0.542506919731119,2025-11-26 19:24:14.722483,2025-11-26 19:24:33.800590,0 days 00:00:19.078107,2.283914471866035,dart,0.8954706000425445,0.07679498067865653,lossguide,0.0024978342940172897,0.13547166219150572,4,8,0.17347417568726728,200,forest,0.8858031161111498,0.8367525503247637,0.09083384701222746,oversample,0.8528681015978069,,5.0,0.7188839434695083,0.1513572943138529,uniform,0.000723715825777918,0.281175579623631,0.533728253649885,0.48032564450474896,0.4767073722297603,0.5474596297755022,0.542506919731119,0.8858031161111498,0.8367525503247637,0.1,0.5109353715042916,0.5221807918022023,0.5313455657492355,0.5289128758673862,0.5645816409423233,0.5568181818181818,oversample,0.44314933934581147,0.4624716448005519,0.8528681015978069,0.533728253649885,COMPLETE
489,0.7156549520766773,2025-11-26 19:24:33.965656,2025-11-26 19:25:19.613457,0 days 00:00:45.647801,0.000270053364740204,dart,0.9640580873285127,4.503235300652866,depthwise,0.5883131426605475,0.00039631146042429206,1,12,6.431846547867316,600,forest,0.6054141080044597,0.1591605853490573,0.05630352637430531,none,0.5358251259569262,1.3916962399602748,9.0,0.8795394266291152,0.07158393581363012,uniform,0.2022012776038085,0.8351693569452356,0.3933357061055398,0.5567616463138851,0.5572139303482587,0.715281812899477,0.7156549520766773,0.6054141080044597,0.1591605853490573,0.05,0.7477928395014002,0.7366840000383965,0.5567616463138851,0.5572139303482587,1.0,1.0,none,0.746753510502495,0.7243107696695541,0.5358251259569262,0.3933357061055398,COMPLETE
490,0.7156549520766773,2025-11-26 19:25:19.781127,2025-11-26 19:27:14.620369,0 days 00:01:54.839242,0.0209889492292216,dart,0.986939807093639,6.159097055869832,lossguide,0.0017580463955829276,0.0002786445008124771,0,10,15.082811922136617,1000,forest,0.5496684697741476,0.13953055703125378,0.09470512244410186,none,0.9818975419267321,0.5112506311989041,5.0,0.7256383785381937,0.21988591992757384,uniform,0.38810391523839605,0.5433129301933463,0.12026444851615001,0.5567616463138851,0.5572139303482587,0.715281812899477,0.7156549520766773,0.5496684697741476,0.13953055703125378,0.1,0.6031501643131225,0.6078036124213086,0.5567616463138851,0.5572139303482587,1.0,1.0,none,0.5521058870339363,0.5489272282875449,0.9818975419267321,0.12026444851615001,COMPLETE
491,0.7156549520766773,2025-11-26 19:27:14.807859,2025-11-26 19:27:16.424933,0 days 00:00:01.617074,1.9360208887380312,gbtree,0.8501733321528275,1.85151176710702,lossguide,0.00152527116500701,0.02971868391090704,0,3,0.30879657878911876,400,,0.7625750564014149,0.7669595756032994,0.08984805820290359,oversample,0.8813301089048309,,6.0,0.7279057943895137,,,,0.27651938069557785,0.3494025495940105,0.5567616463138851,0.5572139303482587,0.715281812899477,0.7156549520766773,0.7625750564014149,0.7669595756032994,0.08,0.5083905213827102,0.49889555581903355,0.5567616463138851,0.5572139303482587,1.0,1.0,oversample,0.4599309504467912,0.4446833171935317,0.8813301089048309,0.3494025495940105,COMPLETE
492,0.29576624925462136,2025-11-26 19:27:16.601712,2025-11-26 19:27:45.035611,0 days 00:00:28.433899,1.894527425443269,dart,0.916408529454404,7.267047762194842,depthwise,0.06352081690783742,0.0620365933009106,7,5,0.13630173620792152,500,forest,0.69742879599773,0.7952690898532891,0.03821580599898686,oversample,0.9853836485880718,,12.0,0.7337232448954668,0.4132071558219439,uniform,0.6802075185129492,0.47648817844420627,0.5569093813624806,0.4758028041610131,0.4658525554047942,0.3129816241849437,0.29576624925462136,0.69742879599773,0.7952690898532891,0.05,0.5676799532278602,0.5620415181940729,0.5789473684210527,0.5573033707865168,0.21445978878960195,0.2012987012987013,oversample,0.5624985493791343,0.5467098019447356,0.9853836485880718,0.5569093813624806,COMPLETE
493,0.7156549520766773,2025-11-26 19:27:45.207247,2025-11-26 19:27:45.885399,0 days 00:00:00.678152,67.8268238113835,gbtree,0.4834101944520995,6.195012765762481,lossguide,0.7761376879882219,0.00023429003711013762,1,8,44.59371370970838,500,,0.7377791492849173,0.21821057727297172,0.03523008006156393,none,0.807524257458696,3.11891862128463,8.0,0.6769953866406131,,,,0.5820398881025053,0.11521626185104739,0.5567616463138851,0.5572139303482587,0.715281812899477,0.7156549520766773,0.7377791492849173,0.21821057727297172,0.05,0.5567616463138851,0.5572139303482587,0.5567616463138851,0.5572139303482587,1.0,1.0,none,0.5,0.5,0.807524257458696,0.11521626185104739,COMPLETE
