number,value,datetime_start,datetime_complete,duration,params_alpha,params_booster,params_colsample_bytree,params_gamma,params_grow_policy,params_lambda,params_learning_rate,params_max_delta_step,params_max_depth,params_min_child_weight,params_n_estimators,params_normalize_type,params_params_feature_fraction,params_params_labeled_ratio,params_params_missing_rate,params_params_resampling,params_params_sample_rows,params_params_scale_pos_weight,params_params_selftrain_max_iter,params_params_selftrain_threshold,params_rate_drop,params_sample_type,params_skip_drop,params_subsample,params_user_attrs_decision_threshold,user_attrs_acc_test,user_attrs_acc_val,user_attrs_f1_test,user_attrs_f1_val,user_attrs_feature_fraction,user_attrs_labeled_ratio,user_attrs_missing_rate,user_attrs_pr_auc_test,user_attrs_pr_auc_val,user_attrs_prec_test,user_attrs_prec_val,user_attrs_rec_test,user_attrs_rec_val,user_attrs_resampling_strategy,user_attrs_roc_auc_test,user_attrs_roc_auc_val,user_attrs_sample_rows,user_attrs_user_attrs_decision_threshold,state
667,0.7156549520766773,2025-11-26 20:37:27.450356,2025-11-26 20:38:18.625342,0 days 00:00:51.174986,44.2589985970836,dart,0.4299113343792762,8.432789585277295,lossguide,22.805141240382696,0.007015135974303873,0,8,14.837343892097806,700,tree,0.8619695406718839,0.3442697235215177,0.022120222906883497,none,0.8000481476424774,1.898891481028673,5.0,0.7353696784646071,0.37452701841357894,uniform,0.43017335354224506,0.8649207004215876,0.012655102765932874,0.5567616463138851,0.5572139303482587,0.715281812899477,0.7156549520766773,0.8619695406718839,0.3442697235215177,0.02,0.5567616463138851,0.5572139303482587,0.5567616463138851,0.5572139303482587,1.0,1.0,none,0.5,0.5,0.8000481476424774,0.012655102765932874,COMPLETE
668,0.12988734261100066,2025-11-26 20:38:18.801733,2025-11-26 20:38:24.134438,0 days 00:00:05.332705,0.2700886046788972,dart,0.7625129260638318,4.99588516670348,lossguide,0.03192352911860448,0.1641888683754053,0,4,0.57464745673568,200,forest,0.6467490956259827,0.7992863703476891,0.08918729570304691,none,0.7115855367535452,0.5150236656183534,5.0,0.6509614942602405,0.08351880921196694,weighted,0.03253905681173809,0.39763034082303267,0.4255672525277582,0.42424242424242425,0.40615106286748076,0.15751158173395102,0.12988734261100066,0.6467490956259827,0.7992863703476891,0.08,0.5006451457770562,0.48824096820912655,0.425,0.35379061371841153,0.0966693744922827,0.07954545454545454,none,0.4237532949816807,0.412587221256782,0.7115855367535452,0.4255672525277582,COMPLETE
669,0.025196850393700787,2025-11-26 20:38:24.309909,2025-11-26 20:38:25.073288,0 days 00:00:00.763379,0.7383038585148524,gbtree,0.9785307797028038,4.270529077743023,lossguide,4.70770432286437,0.00933356520014931,5,11,0.7272955242301361,500,,0.6491186560325763,0.28715666967592035,0.09816690405066185,oversample,0.7485907396630441,,5.0,0.9349341404122301,,,,0.7775038594139811,0.6137440899966609,0.43781094527363185,0.44007236544549977,0.022029897718332022,0.025196850393700787,0.6491186560325763,0.28715666967592035,0.1,0.62447011403965,0.6230356184986181,0.35,0.42105263157894735,0.011372867587327376,0.012987012987012988,oversample,0.6000480777201214,0.5943038383985779,0.7485907396630441,0.6137440899966609,COMPLETE
670,0.7156549520766773,2025-11-26 20:38:25.244939,2025-11-26 20:39:21.805933,0 days 00:00:56.560994,22.024170475333317,dart,0.4492957111206608,9.472957779144023,lossguide,28.007634595038187,0.00014063877714944054,3,4,2.38212540030068,700,forest,0.6956104477541174,0.47606325440000563,0.03975945092511222,none,0.5425693173411393,2.7889171322704995,11.0,0.6321465370043136,0.1520648919172699,uniform,0.1219662570657186,0.5249476053594033,0.40880107446492264,0.5567616463138851,0.5572139303482587,0.715281812899477,0.7156549520766773,0.6956104477541174,0.47606325440000563,0.05,0.5567616463138851,0.5572139303482587,0.5567616463138851,0.5572139303482587,1.0,1.0,none,0.5,0.5,0.5425693173411393,0.40880107446492264,COMPLETE
671,0.7102803738317757,2025-11-26 20:39:21.996434,2025-11-26 20:39:24.596015,0 days 00:00:02.599581,0.38569672067420147,gbtree,0.9833213319513068,1.0877284872097552,lossguide,5.224240765032485,0.00027773814856651237,6,6,0.8707215815906719,600,,0.8567537139121222,0.5329617477382699,0.09403847408409072,oversample,0.7501932556586659,,5.0,0.9067410308043328,,,,0.884256004750686,0.5434890876143395,0.5517865219357757,0.5513342379014021,0.7108257951561132,0.7102803738317757,0.8567537139121222,0.5329617477382699,0.1,0.4848041854314966,0.47321288371112746,0.5546448087431693,0.5547445255474452,0.9894394800974817,0.987012987012987,oversample,0.406150218007593,0.3903644555138427,0.7501932556586659,0.5434890876143395,COMPLETE
672,0.0,2025-11-26 20:39:24.775115,2025-11-26 20:39:25.780608,0 days 00:00:01.005493,0.000652512675742313,gbtree,0.4394767328153786,6.003537861433334,depthwise,0.0018119547838685904,0.00027091859013219093,4,7,0.10337871211574236,900,,0.6502583474016447,0.620716869576744,0.034993967485075,undersample,0.9506949025073945,,5.0,0.7973459317318201,,,,0.3684285723581203,0.7895214542229305,0.44323835368611486,0.4427860696517413,0.0,0.0,0.6502583474016447,0.620716869576744,0.02,0.5192613806373465,0.5275249777163316,0.0,0.0,0.0,0.0,undersample,0.4537351414977039,0.4657441001286762,0.9506949025073945,0.7895214542229305,COMPLETE
673,0.7156549520766773,2025-11-26 20:39:25.957339,2025-11-26 20:40:34.541380,0 days 00:01:08.584041,34.7273286927132,dart,0.7074146957685622,7.404154854428967,lossguide,18.28458544424241,0.00016093092826514955,0,11,7.54658558464475,800,tree,0.9628616545899641,0.13197917271764711,0.03338840537367596,none,0.8824731871275704,1.3929768215646987,5.0,0.8427617793495785,0.35051461674433987,weighted,0.4671069168988661,0.7740110645140174,0.6264815180642037,0.5567616463138851,0.5572139303482587,0.715281812899477,0.7156549520766773,0.9628616545899641,0.13197917271764711,0.02,0.5567616463138851,0.5572139303482587,0.5567616463138851,0.5572139303482587,1.0,1.0,none,0.5,0.5,0.8824731871275704,0.6264815180642037,COMPLETE
674,0.7156549520766773,2025-11-26 20:40:34.720708,2025-11-26 20:40:35.316055,0 days 00:00:00.595347,0.14084467555003752,gbtree,0.9892043321602892,6.858514100922106,lossguide,0.5262907855864636,0.001914904628410169,6,7,80.06990279570167,300,,0.933052491773774,0.6957942383116864,0.0759247130530408,none,0.7408261883774566,0.8182504104215292,11.0,0.8066231085521213,,,,0.6087878335500502,0.37039607733628344,0.5567616463138851,0.5572139303482587,0.715281812899477,0.7156549520766773,0.933052491773774,0.6957942383116864,0.08,0.5867442979169526,0.573198099574395,0.5567616463138851,0.5572139303482587,1.0,1.0,none,0.4689728775344419,0.45159220248597165,0.7408261883774566,0.37039607733628344,COMPLETE
675,0.6885354539430086,2025-11-26 20:40:35.492470,2025-11-26 20:40:37.632967,0 days 00:00:02.140497,0.00011925997925580029,gbtree,0.406857430444832,2.7452756193728463,lossguide,0.0002006210091754168,0.00861717298867682,7,12,0.1868965184977806,200,,0.9788139511971043,0.27227660789563335,0.06691920702352107,undersample,0.6513903926574474,,10.0,0.6296127448355088,,,,0.6777323147389798,0.413655292063931,0.5567616463138851,0.5748530076888286,0.6746347941567065,0.6885354539430086,0.9788139511971043,0.27227660789563335,0.08,0.6212871334145023,0.6317829256821768,0.570466030320045,0.5817469204927211,0.8253452477660439,0.8433441558441559,undersample,0.5626664069364545,0.5873597163816776,0.6513903926574474,0.413655292063931,COMPLETE
676,0.7156549520766773,2025-11-26 20:40:37.809993,2025-11-26 20:40:38.730151,0 days 00:00:00.920158,0.01455980629497512,gbtree,0.23942747268643602,5.7862943139013545,lossguide,0.00038937820926093655,0.012437905127537752,7,9,0.1984102182492855,900,,0.6102999164123069,0.0965814408441879,0.027310587970921885,oversample,0.7815273007667655,,5.0,0.689043282014989,,,,0.8558404935130117,0.3679980873281308,0.5567616463138851,0.5572139303482587,0.715281812899477,0.7156549520766773,0.6102999164123069,0.0965814408441879,0.02,0.4078779571862091,0.4069380363850392,0.5567616463138851,0.5572139303482587,1.0,1.0,oversample,0.19337107710671597,0.179028676890015,0.7815273007667655,0.3679980873281308,COMPLETE
677,0.7156549520766773,2025-11-26 20:40:38.909891,2025-11-26 20:40:39.664010,0 days 00:00:00.754119,11.88035770766231,gbtree,0.32563752532203893,7.2074937828977195,lossguide,0.3610682164461693,0.011035335954350309,4,8,0.3410641131386258,600,,0.91335754141281,0.9399151143667016,0.08659648542402405,undersample,0.5528380751844338,,10.0,0.6264880498808226,,,,0.6606907676940468,0.17896301686214544,0.5567616463138851,0.5572139303482587,0.715281812899477,0.7156549520766773,0.91335754141281,0.9399151143667016,0.08,0.5567616463138851,0.5572139303482587,0.5567616463138851,0.5572139303482587,1.0,1.0,undersample,0.5,0.5,0.5528380751844338,0.17896301686214544,COMPLETE
678,0.7156549520766773,2025-11-26 20:40:39.840867,2025-11-26 20:40:51.424187,0 days 00:00:11.583320,0.013244232664814871,dart,0.9692199930094213,3.4861409052909025,lossguide,0.024865697800117926,0.0316441965778635,4,5,7.532032876052283,300,forest,0.9180562376937907,0.8994161655900597,0.07062434252236058,none,0.7280267540246043,1.9565899738203008,5.0,0.8721317147995769,0.30487856715285266,weighted,0.5444371552827574,0.2418119966366736,0.0545646137663785,0.5567616463138851,0.5572139303482587,0.715281812899477,0.7156549520766773,0.9180562376937907,0.8994161655900597,0.08,0.5300011299253519,0.5296062297056019,0.5567616463138851,0.5572139303482587,1.0,1.0,none,0.4785361992075466,0.4787617897934548,0.7280267540246043,0.0545646137663785,COMPLETE
679,0.7156549520766773,2025-11-26 20:40:51.604853,2025-11-26 20:40:53.504766,0 days 00:00:01.899913,1.66561307494524,gbtree,0.821353506255989,0.17305224822503296,depthwise,19.535767792125135,0.000972342812080303,4,7,1.6141106983175617,800,,0.6446543397271721,0.3711236834853537,0.08596857357769785,oversample,0.6373138368606844,,7.0,0.8234311752259854,,,,0.5218934338198088,0.32848248601543634,0.5567616463138851,0.5572139303482587,0.715281812899477,0.7156549520766773,0.6446543397271721,0.3711236834853537,0.08,0.4050683811766218,0.40426020456272915,0.5567616463138851,0.5572139303482587,1.0,1.0,oversample,0.22778311974668014,0.22488326280461113,0.6373138368606844,0.32848248601543634,COMPLETE
680,0.7156549520766773,2025-11-26 20:40:53.680274,2025-11-26 20:41:49.249012,0 days 00:00:55.568738,28.35091627024929,dart,0.7490651992207393,8.563899500200097,lossguide,1.5744209439165955,0.00022396329905011582,1,10,38.07828923067623,700,tree,0.8429827412521727,0.42110669981930227,0.05139406788508464,none,0.7817701272787956,1.4673145859621997,7.0,0.7706481964838097,0.19525296519143534,weighted,0.02281101775648087,0.35024505259617733,0.04053884529182006,0.5567616463138851,0.5572139303482587,0.715281812899477,0.7156549520766773,0.8429827412521727,0.42110669981930227,0.05,0.4962399468636398,0.49497094357409543,0.5567616463138851,0.5572139303482587,1.0,1.0,none,0.3166452527396011,0.2961522325988618,0.7817701272787956,0.04053884529182006,COMPLETE
681,0.7156549520766773,2025-11-26 20:41:49.421453,2025-11-26 20:42:36.155615,0 days 00:00:46.734162,37.4034067292714,dart,0.45970164316780787,5.483793365335501,lossguide,0.08264677987354924,0.0002272673760435858,0,9,4.003397093933864,700,forest,0.8470911669966729,0.3424319219922416,0.024914709847563516,none,0.8601549732447983,0.6745062589651416,6.0,0.7156001793992927,0.443511329475078,weighted,0.3805666330877694,0.6449557558513792,0.1536452579806587,0.5567616463138851,0.5572139303482587,0.715281812899477,0.7156549520766773,0.8470911669966729,0.3424319219922416,0.02,0.5567616463138851,0.5572139303482587,0.5567616463138851,0.5572139303482587,1.0,1.0,none,0.5,0.5,0.8601549732447983,0.1536452579806587,COMPLETE
682,0.7156549520766773,2025-11-26 20:42:36.333706,2025-11-26 20:43:05.352463,0 days 00:00:29.018757,1.9369332840746007,dart,0.8832840882157017,6.052722500120945,depthwise,0.00023038020394146154,0.02937907293788563,6,7,1.4573398971053997,500,tree,0.5924550290940885,0.6331337592515853,0.03760885262967684,none,0.8898646070558813,2.499970143967541,12.0,0.8125005453038119,0.14598318488625095,uniform,0.020124212413421015,0.2941553011335163,0.3366996201740068,0.5567616463138851,0.5572139303482587,0.715281812899477,0.7156549520766773,0.5924550290940885,0.6331337592515853,0.05,0.5524749613419742,0.5442388745199251,0.5567616463138851,0.5572139303482587,1.0,1.0,none,0.49534309255790043,0.46992151745088406,0.8898646070558813,0.3366996201740068,COMPLETE
683,0.6597938144329897,2025-11-26 20:43:05.529461,2025-11-26 20:43:16.979052,0 days 00:00:11.449591,1.8211576371321723,gbtree,0.8618596234141787,1.0815354969453783,lossguide,0.0398865688145075,0.009121701965951185,6,8,0.2786268161732938,1000,,0.7241017726685349,0.28636095272303214,0.08559652500787994,oversample,0.7337195510376445,,6.0,0.7129923648455652,,,,0.26157650435715474,0.5797812738911683,0.5992763455450023,0.582089552238806,0.6711210096510765,0.6597938144329897,0.7241017726685349,0.28636095272303214,0.08,0.6105032709861304,0.60229222641458,0.6179084073820916,0.6037735849056604,0.7343623070674249,0.7272727272727273,oversample,0.5853686234851374,0.5709443773795153,0.7337195510376445,0.5797812738911683,COMPLETE
684,0.7156549520766773,2025-11-26 20:43:17.152760,2025-11-26 20:43:26.565073,0 days 00:00:09.412313,0.01146522938646164,dart,0.7313047932208414,8.901521665870899,depthwise,91.05600444300504,0.00034594048428829744,0,3,8.194523156590929,300,tree,0.7667581076606166,0.25099595296643995,0.07713364146163984,oversample,0.7391648114619811,,11.0,0.8512820842490374,0.3416988530366817,weighted,0.2800289358721083,0.2964945034660476,0.1604752287550515,0.5567616463138851,0.5572139303482587,0.715281812899477,0.7156549520766773,0.7667581076606166,0.25099595296643995,0.08,0.5567616463138851,0.5572139303482587,0.5567616463138851,0.5572139303482587,1.0,1.0,oversample,0.5,0.5,0.7391648114619811,0.1604752287550515,COMPLETE
685,0.7156549520766773,2025-11-26 20:43:26.741681,2025-11-26 20:44:06.653490,0 days 00:00:39.911809,0.5100367036895758,dart,0.254400357290322,8.97233851817533,lossguide,1.7471564653611356,0.008796297508653335,3,6,0.10426417893894452,600,forest,0.7261245696716409,0.8624710165128228,0.08687708136843243,oversample,0.553237027213269,,11.0,0.6049579364265201,0.4054112913031343,uniform,0.7110039079141887,0.7142430206384789,0.014367213144989153,0.5567616463138851,0.5572139303482587,0.715281812899477,0.7156549520766773,0.7261245696716409,0.8624710165128228,0.08,0.5518724744055337,0.5511884056496607,0.5567616463138851,0.5572139303482587,1.0,1.0,oversample,0.32323190039622673,0.32907908613347836,0.553237027213269,0.014367213144989153,COMPLETE
686,0.7156549520766773,2025-11-26 20:44:06.822128,2025-11-26 20:44:22.845867,0 days 00:00:16.023739,1.6542198590334727,dart,0.5759153776976175,7.1490531555955155,depthwise,47.76533864101826,0.001691223907262396,4,8,7.297504780677643,400,forest,0.6182093573447225,0.3949036727266802,0.08418867765015954,undersample,0.753589504148435,,11.0,0.8484269057487301,0.37778450430396265,weighted,0.31978026602042947,0.38238969765369135,0.3189982914990089,0.5567616463138851,0.5572139303482587,0.715281812899477,0.7156549520766773,0.6182093573447225,0.3949036727266802,0.08,0.5457168333878788,0.5404708306166923,0.5567616463138851,0.5572139303482587,1.0,1.0,undersample,0.47593834446857547,0.4617229680431927,0.753589504148435,0.3189982914990089,COMPLETE
687,0.7156549520766773,2025-11-26 20:44:23.025681,2025-11-26 20:45:00.060491,0 days 00:00:37.034810,3.2689979007711774,dart,0.23086897463097833,5.050149426465806,depthwise,0.01056602671398469,0.04900915556111492,3,7,4.609071770988403,600,tree,0.780170278073625,0.2642600808653734,0.021158162285715924,none,0.872945243510626,1.0381664151282999,7.0,0.7882237956907673,0.4006527763184062,weighted,0.4826120653887991,0.733244674222172,0.17904679683598196,0.5567616463138851,0.5572139303482587,0.715281812899477,0.7156549520766773,0.780170278073625,0.2642600808653734,0.02,0.6246208654727468,0.6048109718751564,0.5567616463138851,0.5572139303482587,1.0,1.0,none,0.5816649811833751,0.5590878414231326,0.872945243510626,0.17904679683598196,COMPLETE
688,0.7156549520766773,2025-11-26 20:45:00.233002,2025-11-26 20:45:01.108188,0 days 00:00:00.875186,0.00034443171313801156,gbtree,0.5617139278494117,3.299357631298937,lossguide,0.0003947723353581316,0.000488306015422073,1,11,3.1226401078177166,200,,0.9944805322274081,0.7583964935901566,0.031978787681652784,none,0.781073924642439,1.8492590828592175,12.0,0.6238745401465082,,,,0.29854356207569877,0.17094492155534302,0.5567616463138851,0.5572139303482587,0.715281812899477,0.7156549520766773,0.9944805322274081,0.7583964935901566,0.02,0.5904952894673847,0.5899902860312136,0.5567616463138851,0.5572139303482587,1.0,1.0,none,0.5368565460302723,0.5437528189379568,0.781073924642439,0.17094492155534302,COMPLETE
689,0.7156549520766773,2025-11-26 20:45:01.274789,2025-11-26 20:45:21.541949,0 days 00:00:20.267160,0.0003401762866831932,dart,0.9317012602102434,3.506743233677251,lossguide,0.06904109286550209,0.00022977030791018226,6,4,2.7708979128656734,400,forest,0.8434301243674703,0.80969680724997,0.08132879806563337,oversample,0.7511182092368093,,10.0,0.6539236649230561,0.16232070726048076,uniform,0.426341377069445,0.7964470128695598,0.17684882666381335,0.5567616463138851,0.5572139303482587,0.715281812899477,0.7156549520766773,0.8434301243674703,0.80969680724997,0.08,0.4235299142214881,0.42427620608599437,0.5567616463138851,0.5572139303482587,1.0,1.0,oversample,0.2885152273744591,0.289064261836223,0.7511182092368093,0.17684882666381335,COMPLETE
690,0.7156549520766773,2025-11-26 20:45:21.713395,2025-11-26 20:46:32.482447,0 days 00:01:10.769052,83.52592553169028,dart,0.5997904018955331,2.498374078449827,depthwise,47.92460193161683,0.0036545475897749985,4,4,60.93661888042244,800,forest,0.5221294530144173,0.44271670884250947,0.09098074760227894,none,0.8502430856212043,3.743503606496842,12.0,0.6802337446210931,0.37369361047517635,weighted,0.548146420541968,0.268294169177347,0.4153822538538811,0.5567616463138851,0.5572139303482587,0.715281812899477,0.7156549520766773,0.5221294530144173,0.44271670884250947,0.1,0.5567616463138851,0.5572139303482587,0.5567616463138851,0.5572139303482587,1.0,1.0,none,0.5,0.5,0.8502430856212043,0.4153822538538811,COMPLETE
691,0.7156549520766773,2025-11-26 20:46:32.687196,2025-11-26 20:46:33.551878,0 days 00:00:00.864682,0.560932436498361,gbtree,0.4707123276597245,8.853929718552735,lossguide,0.9140307150632156,0.0033585085949471493,0,3,0.1053388286413969,700,,0.511810910506272,0.2356596745739517,0.06530336600069156,undersample,0.9323105573309377,,8.0,0.6231399648063116,,,,0.6865813650326875,0.039506371629155865,0.5567616463138851,0.5572139303482587,0.715281812899477,0.7156549520766773,0.511810910506272,0.2356596745739517,0.08,0.5738303028935324,0.5704800019135887,0.5567616463138851,0.5572139303482587,1.0,1.0,undersample,0.5334318373978348,0.5261701079819057,0.9323105573309377,0.039506371629155865,COMPLETE
692,0.7156549520766773,2025-11-26 20:46:33.745368,2025-11-26 20:47:02.728346,0 days 00:00:28.982978,2.8640445588417283,dart,0.622668730521716,9.605958407638266,depthwise,21.431174217255084,0.00468075705766768,0,4,0.11753820527461499,500,forest,0.6621333084072181,0.6631048253604489,0.08486503438888253,none,0.5065649783076085,0.502553805012532,10.0,0.6571002456933732,0.17649063876248952,weighted,0.1344502595677763,0.849353455944123,0.18115295481340546,0.5567616463138851,0.5572139303482587,0.715281812899477,0.7156549520766773,0.6621333084072181,0.6631048253604489,0.08,0.5567616463138851,0.5572139303482587,0.5567616463138851,0.5572139303482587,1.0,1.0,none,0.5,0.5,0.5065649783076085,0.18115295481340546,COMPLETE
693,0.7156549520766773,2025-11-26 20:47:02.901177,2025-11-26 20:47:03.888660,0 days 00:00:00.987483,0.00012734513557817936,gbtree,0.7670584195224366,3.294510634559869,lossguide,0.0033332733735299052,0.007423738389654829,2,6,1.5152579831163728,200,,0.8358304194330057,0.7294947009599275,0.09958879719555382,none,0.7588132565512187,1.4080455672354382,5.0,0.6013137686330183,,,,0.2367444550822172,0.4865698941174278,0.5567616463138851,0.5572139303482587,0.715281812899477,0.7156549520766773,0.8358304194330057,0.7294947009599275,0.1,0.5694395745738521,0.5779221174871589,0.5567616463138851,0.5572139303482587,1.0,1.0,none,0.533006183789519,0.546383551331202,0.7588132565512187,0.4865698941174278,COMPLETE
694,0.7156549520766773,2025-11-26 20:47:04.068011,2025-11-26 20:47:44.000705,0 days 00:00:39.932694,0.734143236060788,dart,0.617608348171236,0.30869655970396204,depthwise,4.325653770825384,0.01870447636124511,5,6,0.13503410691057272,300,forest,0.8521423836697529,0.7051582935631078,0.0871466229583237,oversample,0.8645988884461567,,5.0,0.6998185833437791,0.00441500317877663,weighted,0.12564599237334498,0.309935168449039,0.2905605048612905,0.5567616463138851,0.5572139303482587,0.715281812899477,0.7156549520766773,0.8521423836697529,0.7051582935631078,0.08,0.5686326411799597,0.5325705868127856,0.5567616463138851,0.5572139303482587,1.0,1.0,oversample,0.5338856744972563,0.49807648939416044,0.8645988884461567,0.2905605048612905,COMPLETE
695,0.7156549520766773,2025-11-26 20:47:44.171554,2025-11-26 20:47:45.028706,0 days 00:00:00.857152,0.0010848434919344967,gbtree,0.4803037267767798,6.352563220259319,depthwise,2.7394939469438517,0.0016622674211903285,0,7,0.26103547493699075,700,,0.975643132134707,0.6007129086868985,0.0001339649973528343,undersample,0.707835230197447,,5.0,0.8098844611105098,,,,0.25253464878394294,0.3187449541644257,0.5567616463138851,0.5572139303482587,0.715281812899477,0.7156549520766773,0.975643132134707,0.6007129086868985,0.0,0.4510217903435496,0.4372799909188526,0.5567616463138851,0.5572139303482587,1.0,1.0,undersample,0.34236600407831697,0.31828213920910553,0.707835230197447,0.3187449541644257,COMPLETE
