number,value,datetime_start,datetime_complete,duration,params_alpha,params_booster,params_colsample_bytree,params_gamma,params_grow_policy,params_lambda,params_learning_rate,params_max_delta_step,params_max_depth,params_min_child_weight,params_n_estimators,params_normalize_type,params_params_feature_fraction,params_params_labeled_ratio,params_params_missing_rate,params_params_resampling,params_params_sample_rows,params_params_scale_pos_weight,params_params_selftrain_max_iter,params_params_selftrain_threshold,params_rate_drop,params_sample_type,params_skip_drop,params_subsample,params_user_attrs_decision_threshold,user_attrs_acc_test,user_attrs_acc_val,user_attrs_f1_test,user_attrs_f1_val,user_attrs_feature_fraction,user_attrs_labeled_ratio,user_attrs_missing_rate,user_attrs_pr_auc_test,user_attrs_pr_auc_val,user_attrs_prec_test,user_attrs_prec_val,user_attrs_rec_test,user_attrs_rec_val,user_attrs_resampling_strategy,user_attrs_roc_auc_test,user_attrs_roc_auc_val,user_attrs_sample_rows,user_attrs_user_attrs_decision_threshold,state
1385,0.038922155688622756,2025-11-27 02:55:27.998154,2025-11-27 02:55:30.957217,0 days 00:00:02.959063,0.12887318753419535,gbtree,0.8500046910524853,0.9444468752129296,lossguide,3.6068390247771904,0.02560070370598889,10,4,56.70225951627658,600,,0.9473335820410338,0.71058958950589,0.03130881159747814,oversample,0.5623175024625441,,7.0,0.6499977943316287,,,,0.43584270585074186,0.7499464416184352,0.4188150158299412,0.41926729986431477,0.040328603435399554,0.038922155688622756,0.9473335820410338,0.71058958950589,0.02,0.4662663921982566,0.45728927318155965,0.25,0.25,0.021933387489845652,0.021103896103896104,oversample,0.3918441950297584,0.3694661760609156,0.5623175024625441,0.7499464416184352,COMPLETE
1386,0.7156549520766773,2025-11-27 02:55:31.137468,2025-11-27 02:55:31.748605,0 days 00:00:00.611137,3.95009915217572,gbtree,0.5508802344902302,2.765182075719008,lossguide,2.0635166889476975,0.1112399268527234,8,6,88.47018097456275,200,,0.8405466701349801,0.8400458611604749,0.01003226585555486,none,0.5340452745404086,1.2551668769746884,9.0,0.7419323440088325,,,,0.4710304737377612,0.3132339968798713,0.5567616463138851,0.5572139303482587,0.715281812899477,0.7156549520766773,0.8405466701349801,0.8400458611604749,0.02,0.4626958731449436,0.468706415271594,0.5567616463138851,0.5572139303482587,1.0,1.0,none,0.3669378636913742,0.37420530822599263,0.5340452745404086,0.3132339968798713,COMPLETE
1387,0.7156549520766773,2025-11-27 02:55:31.934843,2025-11-27 02:55:32.668023,0 days 00:00:00.733180,0.2607827880897084,gbtree,0.6035183697566716,4.2981897257283785,lossguide,3.660904719348575,0.20445600387168184,8,7,8.374625044757051,400,,0.8968999303011608,0.6512100533560633,0.029808024886505663,oversample,0.5143799492947955,,12.0,0.8397137290477761,,,,0.27148705962249137,0.07950545634693129,0.5567616463138851,0.5572139303482587,0.715281812899477,0.7156549520766773,0.8968999303011608,0.6512100533560633,0.02,0.5209921502592784,0.5299609629362603,0.5567616463138851,0.5572139303482587,1.0,1.0,oversample,0.43821432716059616,0.4586034815541966,0.5143799492947955,0.07950545634693129,COMPLETE
1388,0.7156549520766773,2025-11-27 02:55:32.849540,2025-11-27 02:56:49.844623,0 days 00:01:16.995083,0.3903555705872412,dart,0.37411028338738994,1.7734726133864553,depthwise,0.00026908961706021393,0.0005474673455048752,8,10,0.5979213203669408,900,tree,0.8320790953601817,0.8297641694161297,0.04893309075663134,none,0.9892857358776546,3.138452110902492,5.0,0.6408633656438968,0.38038485619382006,uniform,0.02670992058864713,0.40530236843574974,0.5284789413998352,0.5567616463138851,0.5572139303482587,0.715281812899477,0.7156549520766773,0.8320790953601817,0.8297641694161297,0.05,0.5257261965508558,0.5087543309672165,0.5567616463138851,0.5572139303482587,1.0,1.0,none,0.4815149455395481,0.4747564105965536,0.9892857358776546,0.5284789413998352,COMPLETE
1389,0.7156549520766773,2025-11-27 02:56:50.022139,2025-11-27 02:57:07.716364,0 days 00:00:17.694225,0.006285948255260183,dart,0.9458382164222958,6.179861040587858,lossguide,0.2982034338420473,0.003971035168046818,2,5,0.6664240244343723,300,forest,0.9687591180659221,0.8238429120195752,0.07254579891806628,none,0.7806823548858743,1.6483642335298476,5.0,0.6984807163233646,0.11899422104045707,weighted,0.43556635190383347,0.3332860761655954,0.48872567074864826,0.5567616463138851,0.5572139303482587,0.715281812899477,0.7156549520766773,0.9687591180659221,0.8238429120195752,0.08,0.4888305016045233,0.4807385487994025,0.5567616463138851,0.5572139303482587,1.0,1.0,none,0.3950405344916195,0.3796114508576204,0.7806823548858743,0.48872567074864826,COMPLETE
1390,0.4474169741697417,2025-11-27 02:57:07.911399,2025-11-27 02:57:16.467721,0 days 00:00:08.556322,1.5736427632026662,gbtree,0.7947363729445249,0.08643095805609091,lossguide,0.004364753751538073,0.018309381629844062,3,8,0.4870142327282159,500,,0.8262226640079581,0.29266316580967683,0.09975236144281498,undersample,0.5665634079908741,,5.0,0.7306022094332985,,,,0.4030395251502297,0.5171113885997402,0.4604251469923112,0.45816372682044326,0.43539990534784667,0.4474169741697417,0.8262226640079581,0.29266316580967683,0.1,0.5190368021253589,0.5096337982287023,0.5215419501133787,0.5181623931623932,0.3736799350121852,0.39366883116883117,undersample,0.4547526484192377,0.44198376955016383,0.5665634079908741,0.5171113885997402,COMPLETE
1391,0.0016116035455278,2025-11-27 02:57:16.653760,2025-11-27 02:57:49.156873,0 days 00:00:32.503113,1.583158783774529,dart,0.626239302056078,4.052231784210104,lossguide,12.696209009916554,0.1443755216152593,8,6,44.14119270373246,500,tree,0.8862434310379467,0.745802155977862,0.005583357074183782,oversample,0.5458953209259162,,11.0,0.7658552615709052,0.06808015206446945,weighted,0.5195437695392704,0.589404316460979,0.6240889845416981,0.44097693351424694,0.4396200814111262,0.0032258064516129032,0.0016116035455278,0.8862434310379467,0.745802155977862,0.0,0.4710092747802537,0.47648886934713913,0.2222222222222222,0.1111111111111111,0.0016246953696181965,0.0008116883116883117,oversample,0.3866704520963544,0.392919325312073,0.5458953209259162,0.6240889845416981,COMPLETE
1392,0.6530612244897959,2025-11-27 02:57:49.338938,2025-11-27 02:57:50.353209,0 days 00:00:01.014271,0.04219691346322386,gbtree,0.5962436239219058,0.7858967993527582,lossguide,10.741497157258657,0.03031411623886335,4,11,10.382128492123533,500,,0.7573666488953028,0.30493137729344344,0.08239437256569457,oversample,0.5379990090539974,,7.0,0.8315376549551805,,,,0.8543073756610615,0.4904943090936359,0.5264586160108549,0.5156037991858887,0.6579549166938908,0.6530612244897959,0.7573666488953028,0.30493137729344344,0.08,0.5260423089798694,0.5187983680662872,0.5502732240437158,0.5433962264150943,0.818034118602762,0.8181818181818182,oversample,0.4580422420796101,0.44893162251436003,0.5379990090539974,0.4904943090936359,COMPLETE
1393,0.055639097744360905,2025-11-27 02:57:50.535853,2025-11-27 02:57:51.360157,0 days 00:00:00.824304,0.00443947390538257,gbtree,0.6699957803193135,3.7791241596816794,lossguide,6.146743081271502,0.1519510215275467,9,8,18.32830373141442,500,,0.7199246562467476,0.7259627467389478,0.03747463539015304,none,0.6345711090127629,1.183240387097644,10.0,0.7697930731879143,,,,0.29589195061463036,0.6998271899885977,0.43509724106739034,0.4319312528267752,0.0587792012057272,0.055639097744360905,0.7199246562467476,0.7259627467389478,0.05,0.5537754422815037,0.5740720303152453,0.40625,0.37755102040816324,0.03168155970755483,0.030032467532467532,none,0.5232476499941975,0.554336687316769,0.6345711090127629,0.6998271899885977,COMPLETE
1394,0.28382502543234994,2025-11-27 02:57:51.545064,2025-11-27 02:57:52.587992,0 days 00:00:01.042928,13.472220244867056,gbtree,0.7157937355863487,2.7033720995575434,lossguide,0.018959767346601555,0.009488657956959188,6,10,4.241448076964282,800,,0.9665199663395087,0.4826010715253149,0.07639710836214499,oversample,0.8353251640886036,,5.0,0.8045600124460955,,,,0.8793347359768345,0.5633753877321472,0.35956580732700133,0.36318407960199006,0.2834008097165992,0.28382502543234994,0.9665199663395087,0.4826010715253149,0.08,0.53095361039627,0.5284024187563128,0.37583892617449666,0.3801089918256131,0.22745735174654752,0.22646103896103897,oversample,0.42719292428588007,0.4246062606953823,0.8353251640886036,0.5633753877321472,COMPLETE
1395,0.0,2025-11-27 02:57:52.774474,2025-11-27 02:59:12.296393,0 days 00:01:19.521919,0.28011005563051966,dart,0.7937223293905692,2.0081843150530627,lossguide,8.369236921631238,0.16599090936917657,10,7,45.674696710090736,400,tree,0.9047865746622243,0.864555467957078,0.027102311997051223,undersample,0.6704308942367463,,7.0,0.6191643760268671,0.15792326813016366,uniform,0.5217070254740451,0.2738446282873585,0.702874660050948,0.44323835368611486,0.4427860696517413,0.0,0.0,0.9047865746622243,0.864555467957078,0.02,0.5542298997342848,0.553287967245514,0.0,0.0,0.0,0.0,undersample,0.5136279613388817,0.5323696987384423,0.6704308942367463,0.702874660050948,COMPLETE
1396,0.7156549520766773,2025-11-27 02:59:12.478298,2025-11-27 02:59:13.400903,0 days 00:00:00.922605,33.38878595886294,gbtree,0.2482619863407602,5.213902983951167,depthwise,0.006575126596028355,0.395488146380431,2,3,1.386066365904911,700,,0.7073124934088971,0.6894764823674695,0.011732116928447778,none,0.8876692960746266,2.3925381761229363,7.0,0.8857713836182203,,,,0.7378011213593613,0.23385819992753187,0.5567616463138851,0.5572139303482587,0.715281812899477,0.7156549520766773,0.7073124934088971,0.6894764823674695,0.02,0.6405443471495482,0.6624690358501354,0.5567616463138851,0.5572139303482587,1.0,1.0,none,0.61840464861818,0.64839759959142,0.8876692960746266,0.23385819992753187,COMPLETE
1397,0.7156549520766773,2025-11-27 02:59:13.585106,2025-11-27 03:00:07.672390,0 days 00:00:54.087284,0.008944550423854914,dart,0.5262921202720988,0.6943161176267426,lossguide,0.9747198093256276,0.0010731246682854655,8,12,0.2977560548819429,600,forest,0.7271951919704701,0.25945076765230823,0.07664185601452256,oversample,0.502457311638444,,7.0,0.8869485331918301,0.13770919060776185,weighted,0.8486020637648387,0.6719369458086982,0.4076194047126959,0.5567616463138851,0.5572139303482587,0.715281812899477,0.7156549520766773,0.7271951919704701,0.25945076765230823,0.08,0.5418176121684007,0.5474238752600584,0.5567616463138851,0.5572139303482587,1.0,1.0,oversample,0.46071387125118124,0.4746942281416235,0.502457311638444,0.4076194047126959,COMPLETE
1398,0.0,2025-11-27 03:00:07.859942,2025-11-27 03:00:40.176057,0 days 00:00:32.316115,0.48977270636922343,dart,0.8578523891130985,4.90383520817368,lossguide,0.00979310580800095,0.016454107014136868,1,5,1.7418706500185357,500,tree,0.9957574624850511,0.7584771530954622,0.046747758784821014,undersample,0.7576106957129657,,7.0,0.6102833170842271,0.21823287085503607,weighted,0.7706257220723003,0.4691387811527401,0.6997321107875049,0.44323835368611486,0.4427860696517413,0.0,0.0,0.9957574624850511,0.7584771530954622,0.05,0.4835846816297152,0.46906669525320294,0.0,0.0,0.0,0.0,undersample,0.40523466900976474,0.3825564119231126,0.7576106957129657,0.6997321107875049,COMPLETE
1399,0.7156549520766773,2025-11-27 03:00:40.359653,2025-11-27 03:00:41.076078,0 days 00:00:00.716425,0.7911405540450114,gbtree,0.8553435829877241,1.1598648214809706,lossguide,2.290593995160596,0.026092334062468192,9,7,95.5514537886081,400,,0.8429328995164549,0.6912986904879918,0.008284036160618857,oversample,0.5424544328293129,,8.0,0.6960646007365517,,,,0.22631741585892495,0.48799464980988577,0.5567616463138851,0.5572139303482587,0.715281812899477,0.7156549520766773,0.8429328995164549,0.6912986904879918,0.0,0.5567616463138851,0.5572139303482587,0.5567616463138851,0.5572139303482587,1.0,1.0,oversample,0.5,0.5,0.5424544328293129,0.48799464980988577,COMPLETE
1400,0.07704160246533127,2025-11-27 03:00:41.276424,2025-11-27 03:00:44.112929,0 days 00:00:02.836505,8.865714070786101,gbtree,0.9890616248540398,2.7157474285212286,lossguide,0.11013394712187484,0.06969520244384027,10,5,15.35238232671961,800,,0.8553415685448763,0.5162562210251975,0.002585643155724175,oversample,0.5579124975381174,,7.0,0.7106163656131927,,,,0.43312891879026993,0.7880341412677622,0.4663048394391678,0.45816372682044326,0.09370199692780339,0.07704160246533127,0.8553415685448763,0.5162562210251975,0.0,0.6794559131906613,0.6582284458405608,0.8591549295774648,0.7575757575757576,0.04955320877335499,0.040584415584415584,oversample,0.6455242129345646,0.6298527187827494,0.5579124975381174,0.7880341412677622,COMPLETE
1401,0.7014742014742015,2025-11-27 03:00:44.314673,2025-11-27 03:06:57.449142,0 days 00:06:13.134469,0.1721230139523095,dart,0.9999938556334751,0.3966990923032587,lossguide,0.1443467728563626,0.0050962444089964485,3,4,0.5267056621521111,900,forest,0.8015803157654909,0.694329500128487,0.010760718556419309,none,0.7718187386323726,1.397876311646243,6.0,0.6672696636145612,0.14823268056970362,uniform,0.7506668510554161,0.28203940607765354,0.5882759425819286,0.5603799185888738,0.5603799185888738,0.7001850709438618,0.7014742014742015,0.8015803157654909,0.694329500128487,0.02,0.6141900812161127,0.604560902292884,0.564395822973645,0.5642292490118577,0.9220146222583265,0.926948051948052,none,0.557973441204264,0.5528853488186991,0.7718187386323726,0.5882759425819286,COMPLETE
1402,0.7156549520766773,2025-11-27 03:06:57.628239,2025-11-27 03:06:58.547798,0 days 00:00:00.919559,1.0888622140835955,gbtree,0.6481262160839258,0.5539917071675167,lossguide,0.0006690494379428817,0.0005769084039563858,9,10,26.929258303989158,500,,0.7790419357660374,0.13768305140063514,0.08375881321931648,undersample,0.8941780727155093,,7.0,0.6561221523972166,,,,0.5425441942279627,0.4570337592494689,0.5567616463138851,0.5572139303482587,0.715281812899477,0.7156549520766773,0.7790419357660374,0.13768305140063514,0.08,0.7558769687028768,0.7388868968543812,0.5567616463138851,0.5572139303482587,1.0,1.0,undersample,0.7255089606923191,0.7047212236180571,0.8941780727155093,0.4570337592494689,COMPLETE
1403,0.7156549520766773,2025-11-27 03:06:58.732919,2025-11-27 03:06:59.361854,0 days 00:00:00.628935,0.0003140813453330958,gbtree,0.5950162331885408,2.4227218626801656,lossguide,15.10262423634364,0.24715222264950526,5,3,34.92429396240439,200,,0.8782913885010752,0.7414931721714099,0.030814366708726313,oversample,0.6299308409273137,,10.0,0.8214122224684773,,,,0.21475389407900117,0.31297697667201013,0.5567616463138851,0.5572139303482587,0.715281812899477,0.7156549520766773,0.8782913885010752,0.7414931721714099,0.02,0.5256684650798567,0.5213046538358976,0.5567616463138851,0.5572139303482587,1.0,1.0,oversample,0.46795495614980354,0.46569725601262885,0.6299308409273137,0.31297697667201013,COMPLETE
1404,0.0718562874251497,2025-11-27 03:06:59.541955,2025-11-27 03:07:00.925480,0 days 00:00:01.383525,0.5135751067141523,gbtree,0.991634624420174,1.3537385563618025,lossguide,12.840633668817878,0.05340697731412019,9,5,37.35772065219548,900,,0.7354989020461199,0.7714420860820054,0.022025356379469462,oversample,0.6067818432294488,,8.0,0.7814865901777363,,,,0.3799315269941086,0.6758721252852192,0.4491180461329715,0.4391677973767526,0.08558558558558559,0.0718562874251497,0.7354989020461199,0.7714420860820054,0.02,0.5980048127506702,0.5860878460740879,0.5643564356435643,0.46153846153846156,0.0463038180341186,0.03896103896103896,oversample,0.5876510718015882,0.5781305964209437,0.6067818432294488,0.6758721252852192,COMPLETE
1405,0.7156549520766773,2025-11-27 03:07:01.110447,2025-11-27 03:07:02.112290,0 days 00:00:01.001843,1.2439546520238418,gbtree,0.5663065770703107,4.445616555661452,lossguide,0.0030516654686104437,0.0018119488817335836,10,9,5.666899498333614,800,,0.7619717413887497,0.1924171089414421,0.09140667815360347,oversample,0.6581692127054163,,8.0,0.7145168489485685,,,,0.7771630800851189,0.23589089902914706,0.5567616463138851,0.5572139303482587,0.715281812899477,0.7156549520766773,0.7619717413887497,0.1924171089414421,0.1,0.5446829177228051,0.5455891086093395,0.5567616463138851,0.5572139303482587,1.0,1.0,oversample,0.4692004177788093,0.47719147553161856,0.6581692127054163,0.23589089902914706,COMPLETE
1406,0.7156549520766773,2025-11-27 03:07:02.295112,2025-11-27 03:07:03.319968,0 days 00:00:01.024856,33.81009957119456,gbtree,0.3297252870326377,4.181566367253525,lossguide,0.06589271753982699,0.3714648720626373,1,9,0.7100149640360622,900,,0.7362894634517538,0.34037885001246476,0.026042748045786407,none,0.8119801753803275,3.8150417071465097,7.0,0.7578307587273849,,,,0.5274943567103816,0.6819030962017186,0.5567616463138851,0.5572139303482587,0.715281812899477,0.7156549520766773,0.7362894634517538,0.34037885001246476,0.02,0.602944383749544,0.6138833928332261,0.5567616463138851,0.5572139303482587,1.0,1.0,none,0.5580604784562079,0.5625742043962167,0.8119801753803275,0.6819030962017186,COMPLETE
1407,0.428842504743833,2025-11-27 03:07:03.504036,2025-11-27 03:07:07.672684,0 days 00:00:04.168648,0.6848772655022441,gbtree,0.8133343524324181,1.4934124426294335,lossguide,0.30733713493208115,0.06130449268538255,9,4,3.4861716204507402,900,,0.8897954044760977,0.7394688089811616,0.021624864271609246,undersample,0.5000350287057495,,5.0,0.7525374775026107,,,,0.45128177533644337,0.5321679063732049,0.4658525554047942,0.4554500226142017,0.43895486935866984,0.428842504743833,0.8897954044760977,0.7394688089811616,0.02,0.5391876976343988,0.5267842181089333,0.528604118993135,0.5159817351598174,0.3753046303818034,0.36688311688311687,undersample,0.49291931232281705,0.4844485825716673,0.5000350287057495,0.5321679063732049,COMPLETE
1408,0.7156549520766773,2025-11-27 03:07:07.861281,2025-11-27 03:07:29.437146,0 days 00:00:21.575865,0.08650652643147874,dart,0.6384784909219372,1.355263987034878,lossguide,0.023752240416047288,0.028697074023745918,10,9,21.492617134884455,400,tree,0.9440904494365857,0.46625947509341303,0.02446069734129025,oversample,0.6308333476961412,,8.0,0.7782030026313616,0.3501769314176216,uniform,0.8889652933115624,0.20613301005917128,0.26360679368237205,0.5567616463138851,0.5572139303482587,0.715281812899477,0.7156549520766773,0.9440904494365857,0.46625947509341303,0.02,0.671016033806487,0.6292971745864782,0.5567616463138851,0.5572139303482587,1.0,1.0,oversample,0.6301314676967456,0.5848214285714286,0.6308333476961412,0.26360679368237205,COMPLETE
1409,0.0,2025-11-27 03:07:29.628571,2025-11-27 03:07:30.419105,0 days 00:00:00.790534,0.02299721158479375,gbtree,0.6733323379568666,4.795182697388583,lossguide,9.729275328485361,0.10052409107479078,9,3,13.021608460229196,500,,0.8319255344201829,0.899937228287564,0.01907823261797699,undersample,0.5165820433445242,,10.0,0.8828771686639371,,,,0.38386575302836623,0.7081813188381083,0.44323835368611486,0.4427860696517413,0.0,0.0,0.8319255344201829,0.899937228287564,0.02,0.4627250723626063,0.45738644238271786,0.0,0.0,0.0,0.0,undersample,0.384090004807772,0.37525494806521364,0.5165820433445242,0.7081813188381083,COMPLETE
1410,0.68375,2025-11-27 03:07:30.601437,2025-11-27 03:07:31.980029,0 days 00:00:01.378592,0.0004501491027283838,gbtree,0.8289989402169037,1.8516079916014867,lossguide,0.25782750487509837,0.4030798809736817,10,9,30.67396688160823,300,,0.8280214723306362,0.7576785564623378,0.043143075091267,oversample,0.653887577803123,,11.0,0.8507543889588618,,,,0.222026929771712,0.41724901436762285,0.5386702849389416,0.5422885572139303,0.67984934086629,0.68375,0.8280214723306362,0.7576785564623378,0.05,0.4800474913789239,0.4830345299014037,0.5539641943734015,0.5558943089430894,0.8797725426482534,0.887987012987013,oversample,0.4046096586481871,0.40215963811469424,0.653887577803123,0.41724901436762285,COMPLETE
1411,0.7156549520766773,2025-11-27 03:07:32.163873,2025-11-27 03:07:32.767790,0 days 00:00:00.603917,0.002857119373344173,gbtree,0.36544082357857705,2.5674787720479157,lossguide,76.75677313063672,0.23954252471330978,8,6,38.39523169573729,200,,0.7066866643863874,0.8014817082249895,0.013627070910970346,oversample,0.5682852951504413,,10.0,0.8502149594348334,,,,0.4726706821811866,0.3675513314627899,0.5567616463138851,0.5572139303482587,0.715281812899477,0.7156549520766773,0.7066866643863874,0.8014817082249895,0.02,0.5559450466161973,0.5500393657250201,0.5567616463138851,0.5572139303482587,1.0,1.0,oversample,0.5123493426615162,0.5000891281853999,0.5682852951504413,0.3675513314627899,COMPLETE
1412,0.7156549520766773,2025-11-27 03:07:32.967423,2025-11-27 03:07:36.808228,0 days 00:00:03.840805,0.9430599170548466,gbtree,0.9226269008318038,0.35340579788219656,lossguide,23.068164720253616,0.012787861815705372,9,5,22.302695421958205,400,,0.919424422285076,0.7546642489553942,0.02304436977901554,none,0.6980447435388503,1.0564078390194815,8.0,0.6345411656639685,,,,0.38623472044636736,0.33032571537717903,0.5567616463138851,0.5572139303482587,0.715281812899477,0.7156549520766773,0.919424422285076,0.7546642489553942,0.02,0.43506770907687364,0.44444623460040067,0.5567616463138851,0.5572139303482587,1.0,1.0,none,0.3059504467912267,0.32319994229468185,0.6980447435388503,0.33032571537717903,COMPLETE
1413,0.6377009921313719,2025-11-27 03:07:36.994957,2025-11-27 03:07:43.444906,0 days 00:00:06.449949,0.518137462087969,gbtree,0.5131633937734917,0.25921682242826716,depthwise,2.1311426206601793,0.018727604012173955,6,11,0.5480512640566808,600,,0.75429506856871,0.16695455668910422,0.08801968890117076,oversample,0.8144336111945585,,6.0,0.8124561935403383,,,,0.7942912268803441,0.4356455739488912,0.49615558570782453,0.5210312075983717,0.6184931506849315,0.6377009921313719,0.75429506856871,0.16695455668910422,0.08,0.5084253846746937,0.4989319802156945,0.5346358792184724,0.5511531638083974,0.7335499593826158,0.7564935064935064,oversample,0.43300867056814607,0.4313232094769377,0.8144336111945585,0.4356455739488912,COMPLETE
