number,value,datetime_start,datetime_complete,duration,params_alpha,params_booster,params_colsample_bytree,params_gamma,params_grow_policy,params_lambda,params_learning_rate,params_max_delta_step,params_max_depth,params_min_child_weight,params_n_estimators,params_normalize_type,params_params_feature_fraction,params_params_labeled_ratio,params_params_missing_rate,params_params_resampling,params_params_sample_rows,params_params_scale_pos_weight,params_params_selftrain_max_iter,params_params_selftrain_threshold,params_rate_drop,params_sample_type,params_skip_drop,params_subsample,params_user_attrs_decision_threshold,user_attrs_acc_test,user_attrs_acc_val,user_attrs_f1_test,user_attrs_f1_val,user_attrs_feature_fraction,user_attrs_labeled_ratio,user_attrs_missing_rate,user_attrs_pr_auc_test,user_attrs_pr_auc_val,user_attrs_prec_test,user_attrs_prec_val,user_attrs_rec_test,user_attrs_rec_val,user_attrs_resampling_strategy,user_attrs_roc_auc_test,user_attrs_roc_auc_val,user_attrs_sample_rows,user_attrs_user_attrs_decision_threshold,state
2451,0.0444104134762634,2025-11-30 14:34:53.578338,2025-11-30 14:35:56.361341,0 days 00:01:02.783003,0.040654162255326795,dart,0.6432439305951793,1.2814614351959597,depthwise,0.014952321499754381,0.3311235609990549,4,4,0.36628540250947644,700,forest,0.9032635231084385,0.6038360887150925,0.09233950947632276,none,0.9499336929379266,0.5683359941839629,9.0,0.857227689270526,0.03732461831230943,uniform,0.1077581068989497,0.9818980048857455,,0.4423337856173677,0.4355495251017639,0.044926413632842756,0.0444104134762634,0.9032635231084385,0.6038360887150925,0.1,0.503305123837523,0.5075113687155861,0.48333333333333334,0.3918918918918919,0.023558082859463852,0.02353896103896104,none,0.4134887017357715,0.42868418608970194,0.9499336929379266,0.5,COMPLETE
2452,0.7156549520766773,2025-11-30 14:35:57.137144,2025-11-30 14:35:57.533248,0 days 00:00:00.396104,0.00042634935161488377,gbtree,0.5071851913230746,7.035041231296615,depthwise,0.24529347076787905,0.0011929130029871256,4,11,26.40236165824124,200,,0.799847149091691,0.6062888782152416,0.049670185927825385,oversample,0.8208438978858483,,11.0,0.8923543845758354,,,,0.25283392326554427,,0.5567616463138851,0.5572139303482587,0.715281812899477,0.7156549520766773,0.799847149091691,0.6062888782152416,0.08,0.4677731068960372,0.4744928905916636,0.5567616463138851,0.5572139303482587,1.0,1.0,oversample,0.3459581558049702,0.34585383972513695,0.8208438978858483,0.5,COMPLETE
2453,0.6454816285998014,2025-11-30 14:35:58.311015,2025-11-30 14:37:42.475850,0 days 00:01:44.164835,2.404183025151458,dart,0.769552285207858,4.394670610097167,depthwise,1.7935740209772157,0.1328513622182126,3,10,0.24452874940892358,900,tree,0.5564198045417581,0.2809903460969075,0.07928532882832406,oversample,0.7399812159257486,,9.0,0.8258206986974788,0.014504674847509669,weighted,0.3527908331749642,0.25744393402586907,,0.5278154681139756,0.5156037991858887,0.6554455445544555,0.6454816285998014,0.5564198045417581,0.2809903460969075,0.08,0.49893310215930226,0.4960915515610137,0.5519733185102835,0.5449972051425377,0.8066612510154346,0.7913961038961039,oversample,0.44426134385516997,0.43465784725999235,0.7399812159257486,0.5,COMPLETE
2454,0.7156549520766773,2025-11-30 14:37:43.257335,2025-11-30 14:37:43.940478,0 days 00:00:00.683143,0.988723675369334,gbtree,0.48556689787584234,3.0457161899335414,lossguide,45.58023683449187,0.0002321234057182187,3,3,2.2155065203965245,600,,0.8132182787607123,0.604230834062436,0.017255373468917746,oversample,0.8209741722728962,,10.0,0.6655450914193951,,,,0.4164244633635277,,0.5567616463138851,0.5572139303482587,0.715281812899477,0.7156549520766773,0.8132182787607123,0.604230834062436,0.08,0.5434602025085837,0.5708535373635512,0.5567616463138851,0.5572139303482587,1.0,1.0,oversample,0.4679155821548766,0.5007005889922131,0.8209741722728962,0.5,COMPLETE
2455,0.6052631578947368,2025-11-30 14:37:44.726356,2025-11-30 14:39:28.776880,0 days 00:01:44.050524,0.004028175560397536,dart,0.4632784338753486,5.106522463791421,depthwise,0.5770510653608156,0.07855227836618808,7,12,1.244043470177628,900,forest,0.914031331342616,0.27185655152255433,0.08722395642271102,undersample,0.9146154625736904,,10.0,0.8397899344055386,0.13235568458844782,uniform,0.7664181285753624,0.840041294612454,,0.5888738127544098,0.5793758480325645,0.6086956521739131,0.6052631578947368,0.914031331342616,0.27185655152255433,0.08,0.6226990115195999,0.6188465848949932,0.6474358974358975,0.6343416370106761,0.5743298131600325,0.5787337662337663,undersample,0.609159634609327,0.5961937704787552,0.9146154625736904,0.5,COMPLETE
2456,0.7156549520766773,2025-11-30 14:39:29.565854,2025-11-30 14:42:48.613660,0 days 00:03:19.047806,1.277747059012227,dart,0.6031281306661898,3.5155843381263487,lossguide,0.007362343745042331,0.0004794789822358969,4,9,0.8288715639604011,1000,forest,0.6176407892664829,0.41630072824988923,0.08434482252206305,none,0.5782025661023688,4.446036874791976,9.0,0.7546412172941828,0.02313934887598612,uniform,0.6779714441483667,0.9600022242969595,,0.5567616463138851,0.5572139303482587,0.715281812899477,0.7156549520766773,0.6176407892664829,0.41630072824988923,0.08,0.5917580172915486,0.585267357262358,0.5567616463138851,0.5572139303482587,1.0,1.0,none,0.5655610172582437,0.553256785349482,0.5782025661023688,0.5,COMPLETE
2457,0.7162438028579761,2025-11-30 14:42:49.366173,2025-11-30 14:42:52.320864,0 days 00:00:02.954691,0.0011974075667252927,gbtree,0.7501941575401196,9.36699107864331,lossguide,0.007652101131348856,0.18231788047280495,2,3,29.40717020051474,900,,0.8210241077352973,0.7986090293289752,0.02135965842129748,oversample,0.6393095294532166,,9.0,0.612854329123226,,,,0.24342922099269773,,0.5576662143826323,0.5599276345545002,0.715034965034965,0.7162438028579761,0.8210241077352973,0.7986090293289752,0.08,0.4823003306411104,0.4602896820121116,0.5574738755111313,0.5589440145653164,0.9967506092607636,0.9967532467532467,oversample,0.40238109053532056,0.3581187071355611,0.6393095294532166,0.5,COMPLETE
2458,0.7156549520766773,2025-11-30 14:42:53.096889,2025-11-30 14:43:10.423998,0 days 00:00:17.327109,3.0082738409835446,dart,0.21358808760342846,3.278369850634232,depthwise,0.0002406880065602626,0.0009936146560537767,9,9,0.5058404492243007,400,forest,0.5482195411828614,0.710266973625733,0.026682411069535075,oversample,0.7415450470805698,,10.0,0.608283858699158,0.34268011336757853,uniform,0.37672647758310246,0.9050480483764891,,0.5567616463138851,0.5572139303482587,0.715281812899477,0.7156549520766773,0.5482195411828614,0.710266973625733,0.08,0.4537675169552308,0.4584860969069514,0.5567616463138851,0.5572139303482587,1.0,1.0,oversample,0.3423747078035113,0.35309519387660354,0.7415450470805698,0.5,COMPLETE
2459,0.7156549520766773,2025-11-30 14:43:11.200916,2025-11-30 14:43:11.591883,0 days 00:00:00.390967,0.032915073133169756,gbtree,0.2513312692941818,1.8080344726729936,depthwise,95.12401859462643,0.00035127655958082577,2,5,3.182802720253108,200,,0.6182722828804224,0.35630709703442887,0.009811599180804764,none,0.6495696242445653,0.9728202092643117,11.0,0.8344525315917223,,,,0.5098729495248893,,0.5567616463138851,0.5572139303482587,0.715281812899477,0.7156549520766773,0.6182722828804224,0.35630709703442887,0.08,0.6083956503709097,0.5871988788970495,0.5567616463138851,0.5572139303482587,1.0,1.0,none,0.6127625623766972,0.5713659744239418,0.6495696242445653,0.5,COMPLETE
2460,0.6545336366590835,2025-11-30 14:43:12.386036,2025-11-30 14:43:19.479648,0 days 00:00:07.093612,0.006301328829370002,gbtree,0.4336211579853589,0.5125256353600727,depthwise,0.06638282877270361,0.1658853996036037,6,5,0.7614346008720952,800,,0.5468087135993157,0.3628068302787578,0.031293596586413584,none,0.9532800586397474,2.632944682572268,10.0,0.6734656170125315,,,,0.5727630101753605,,0.5336951605608322,0.5192220714608774,0.6607436656794998,0.6545336366590835,0.5468087135993157,0.3628068302787578,0.08,0.6224071010971262,0.5908732428361227,0.5553097345132744,0.54579945799458,0.8155970755483347,0.8173701298701299,none,0.5511252673287024,0.5132332555085364,0.9532800586397474,0.5,COMPLETE
2461,0.832829373650108,2025-11-30 14:43:20.250562,2025-11-30 14:43:35.443712,0 days 00:00:15.193150,0.017679247510347215,dart,0.3132030795214049,4.515219621667268,depthwise,0.08717577234589141,0.3210868945463361,9,12,31.256459858477598,400,forest,0.753888172392779,0.37527534493164094,0.03616597341041387,undersample,0.7201049080728557,,8.0,0.7024258425791705,0.3449865820320912,uniform,0.12000128206951063,0.5686636299194083,,0.8127544097693351,0.824966078697422,0.8172992056487202,0.832829373650108,0.753888172392779,0.37527534493164094,0.08,0.8445429160590492,0.8434059280763966,0.8946859903381642,0.8901200369344414,0.752233956133225,0.7824675324675324,undersample,0.850062169465674,0.8526051961317538,0.7201049080728557,0.5,COMPLETE
2462,0.7156549520766773,2025-11-30 14:43:36.225312,2025-11-30 14:43:54.535709,0 days 00:00:18.310397,8.352808479688044,dart,0.46320944851385903,2.307660181511376,lossguide,0.002111745109429483,0.024245614224527826,5,6,96.50195205683569,400,tree,0.6966697133721109,0.41987902744430017,0.08143355705533162,oversample,0.5524062884254237,,10.0,0.7802669237559113,0.3800772153296365,weighted,0.594852351585874,0.8384556939016825,,0.5567616463138851,0.5572139303482587,0.715281812899477,0.7156549520766773,0.6966697133721109,0.41987902744430017,0.08,0.6120899335174571,0.6180465045728742,0.5567616463138851,0.5572139303482587,1.0,1.0,oversample,0.5765737164077653,0.5829542967247257,0.5524062884254237,0.5,COMPLETE
2463,0.48338643604915793,2025-11-30 14:43:55.310102,2025-11-30 14:43:55.825136,0 days 00:00:00.515034,0.6313626514793637,gbtree,0.8003437706089802,2.7057021830747283,lossguide,4.13337648638954,0.13143696957069395,5,3,12.900704495937095,400,,0.869477009072724,0.2074203101470009,0.07306238195624563,undersample,0.670239260081805,,9.0,0.7740314264003553,,,,0.7281044277905622,,0.4966078697421981,0.4866576209859792,0.4854368932038835,0.48338643604915793,0.869477009072724,0.2074203101470009,0.08,0.5841312868595236,0.5925908570466143,0.5633047210300429,0.550259067357513,0.4264825345247766,0.4310064935064935,undersample,0.5198813806594937,0.509658178899752,0.670239260081805,0.5,COMPLETE
2464,0.47665198237885464,2025-11-30 14:43:56.606040,2025-11-30 14:43:57.307565,0 days 00:00:00.701525,4.271427257760289,gbtree,0.7142161579577746,0.41768967545595337,depthwise,52.841947262540394,0.04651941036448792,3,4,5.538592495248186,500,,0.9733559647006461,0.4672397158050541,0.012160651693961145,undersample,0.8770739473688958,,9.0,0.7834537513932471,,,,0.9795118278177799,,0.4703753957485301,0.4626865671641791,0.4870784056066579,0.47665198237885464,0.9733559647006461,0.4672397158050541,0.08,0.5112194917662072,0.5012436138646679,0.5285171102661597,0.5211946050096339,0.4516653127538586,0.43912337662337664,undersample,0.4587057975099057,0.4482281316742502,0.8770739473688958,0.5,COMPLETE
2465,0.3168056164984642,2025-11-30 14:43:58.096295,2025-11-30 14:43:58.763334,0 days 00:00:00.667039,10.600501845733113,gbtree,0.6115147013635618,5.111583332462218,lossguide,88.08558988337627,0.0006684678654836029,4,3,0.23447236619879888,700,,0.8948270414108128,0.8736654726479072,0.0924296110485215,undersample,0.5138258555901637,,5.0,0.8173379518107362,,,,0.5910680883140629,,0.3179556761646314,0.29579375848032563,0.3488773747841105,0.3168056164984642,0.8948270414108128,0.8736654726479072,0.1,0.4962399468636398,0.49497094357409543,0.3723502304147465,0.3447946513849093,0.3281884646628757,0.2930194805194805,undersample,0.3166452527396011,0.2961522325988618,0.5138258555901637,0.5,COMPLETE
2466,0.7156549520766773,2025-11-30 14:43:59.542312,2025-11-30 14:44:00.295230,0 days 00:00:00.752918,0.02389728454452468,gbtree,0.8755151231877578,2.1184696844819317,lossguide,4.955186087691825,0.0011398145849035271,2,3,49.68056491983307,500,,0.5896417608989203,0.5417422806144175,0.027108715356823743,none,0.9397450729227437,1.1796070776528453,5.0,0.6850472122912431,,,,0.4953653214352926,,0.5567616463138851,0.5572139303482587,0.715281812899477,0.7156549520766773,0.5896417608989203,0.5417422806144175,0.08,0.5432155624527445,0.5700956895889338,0.5567616463138851,0.5572139303482587,1.0,1.0,none,0.4652655050647392,0.48566528593980074,0.9397450729227437,0.5,COMPLETE
2467,0.37456875308033516,2025-11-30 14:44:01.104258,2025-11-30 14:44:01.535821,0 days 00:00:00.431563,0.0012405552408111971,gbtree,0.648630585071307,9.622235482895821,depthwise,0.0005115951311548123,0.006414542677165338,6,12,4.88512283607777,300,,0.6004659958445632,0.5556097532846578,0.06710662329055557,undersample,0.7207226880514526,,5.0,0.8901985651643372,,,,0.7681638262112154,,0.4129353233830846,0.4260515603799186,0.3516483516483517,0.37456875308033516,0.6004659958445632,0.5556097532846578,0.08,0.5639716342213165,0.5979964391143664,0.4565499351491569,0.4767879548306148,0.2859463850528026,0.30844155844155846,undersample,0.4390241880667783,0.4659468149317485,0.7207226880514526,0.5,COMPLETE
2468,0.7156549520766773,2025-11-30 14:44:02.314075,2025-11-30 14:45:04.312213,0 days 00:01:01.998138,0.13085709693015335,dart,0.5349891095779309,3.1967975644496507,lossguide,0.00010898412205428017,0.00016282626114806745,6,12,0.3056516530006453,700,tree,0.9703615267061219,0.2143587154688395,0.05397318654423397,none,0.6308233398898496,0.944183217271009,6.0,0.6425434304474463,0.1317511568819867,weighted,0.2876813221011006,0.7125077449219324,,0.5567616463138851,0.5572139303482587,0.715281812899477,0.7156549520766773,0.9703615267061219,0.2143587154688395,0.08,0.553367492488626,0.5466144440485772,0.5567616463138851,0.5572139303482587,1.0,1.0,none,0.4617923042490758,0.4580376212143321,0.6308233398898496,0.5,COMPLETE
2469,0.5607394366197183,2025-11-30 14:45:05.118934,2025-11-30 14:46:07.137075,0 days 00:01:02.018141,1.0126211712476396,dart,0.7830863245530322,1.790887670004172,lossguide,0.005957200226602143,0.004944426112577236,6,3,22.34659758743376,700,tree,0.6091442460126928,0.7829454082810883,0.04674061396322578,undersample,0.7034313125269692,,12.0,0.8334787266571033,0.18939746072405622,weighted,0.5566167702936737,0.4542677467208194,,0.5255540479421077,0.5486205336951605,0.528115159694107,0.5607394366197183,0.6091442460126928,0.7829454082810883,0.08,0.5779966055276862,0.6054740709381738,0.5917338709677419,0.6125,0.4768480909829407,0.5170454545454546,undersample,0.5515372436545698,0.563561247230808,0.7034313125269692,0.5,COMPLETE
2470,0.7156549520766773,2025-11-30 14:46:07.932994,2025-11-30 14:47:33.472898,0 days 00:01:25.539904,72.54716984347026,dart,0.26277943707749407,5.2762763288044665,lossguide,0.7661156747637378,0.026083069089441996,4,8,32.57468184987444,800,forest,0.6399199415408088,0.29361184252627115,0.04387024701366811,oversample,0.511838509544494,,7.0,0.6419102490531756,0.021714080487393317,weighted,0.6545930335004665,0.77623701919904,,0.5567616463138851,0.5572139303482587,0.715281812899477,0.7156549520766773,0.6399199415408088,0.29361184252627115,0.08,0.5567616463138851,0.5572139303482587,0.5567616463138851,0.5572139303482587,1.0,1.0,oversample,0.5,0.5,0.511838509544494,0.5,COMPLETE
2471,0.7156549520766773,2025-11-30 14:47:34.256686,2025-11-30 14:47:34.687965,0 days 00:00:00.431279,4.758663575153697,gbtree,0.3966433690920327,5.395282826303712,lossguide,0.261132743243581,0.001969519768581429,9,5,0.4091383178364572,300,,0.596980305486812,0.7665422293574096,0.002342707135716826,oversample,0.5037199143202554,,10.0,0.7456027660611371,,,,0.7564116198595752,,0.5567616463138851,0.5572139303482587,0.715281812899477,0.7156549520766773,0.596980305486812,0.7665422293574096,0.08,0.6022667001738711,0.607836529798671,0.5567616463138851,0.5572139303482587,1.0,1.0,oversample,0.5307287090303222,0.5403821153310429,0.5037199143202554,0.5,COMPLETE
2472,0.7156549520766773,2025-11-30 14:47:35.508120,2025-11-30 14:47:36.320910,0 days 00:00:00.812790,7.491340899500442,gbtree,0.44108006684324946,4.287951528237243,depthwise,0.00039431771877611245,0.00012880871495653216,4,6,79.50219387298645,800,,0.666924283537345,0.3701096438025158,0.024558338126439927,none,0.6107584870826622,2.164579135108345,6.0,0.87873892225048,,,,0.8788834556711285,,0.5567616463138851,0.5572139303482587,0.715281812899477,0.7156549520766773,0.666924283537345,0.3701096438025158,0.08,0.7909107459475448,0.7932934121652664,0.5567616463138851,0.5572139303482587,1.0,1.0,none,0.8156592450140088,0.8145138824403378,0.6107584870826622,0.5,COMPLETE
2473,0.3656093489148581,2025-11-30 14:47:37.108983,2025-11-30 14:49:18.418141,0 days 00:01:41.309158,0.10713247030625014,dart,0.38558949515771695,6.521096151384587,depthwise,0.007389453688357245,0.033234735404217015,1,7,5.826495349727358,900,tree,0.5567985105794118,0.8116022780899497,0.026540702205610858,undersample,0.6126328155696323,,9.0,0.7384940623527086,0.0891373709679289,weighted,0.4963677100798997,0.26115892852958444,,0.33649932157394846,0.31252826775214837,0.3990167963949201,0.3656093489148581,0.5567985105794118,0.8116022780899497,0.08,0.41624471530817175,0.4049361139734973,0.4024793388429752,0.37628865979381443,0.39561332250203085,0.3555194805194805,undersample,0.26253543659543427,0.23311580528766435,0.6126328155696323,0.5,COMPLETE
2474,0.7156549520766773,2025-11-30 14:49:19.208089,2025-11-30 14:49:20.570045,0 days 00:00:01.361956,0.006007923633621575,gbtree,0.6550350539713296,6.825642421992005,lossguide,1.1663899974351573,0.20527004974236165,8,12,2.330841775348831,600,,0.9267262180617626,0.6578961440755533,0.09281548359608537,none,0.8544162448392995,4.715691610405454,10.0,0.7538220702802092,,,,0.33062802137714653,,0.5567616463138851,0.5572139303482587,0.715281812899477,0.7156549520766773,0.9267262180617626,0.6578961440755533,0.1,0.5734566307259661,0.5675710742865863,0.5567616463138851,0.5572139303482587,1.0,1.0,none,0.5337733549959383,0.5335528235809135,0.8544162448392995,0.5,COMPLETE
2475,0.7156549520766773,2025-11-30 14:49:21.362414,2025-11-30 14:49:22.364082,0 days 00:00:01.001668,0.10406830703026766,gbtree,0.28086898330271454,9.515194868375293,depthwise,0.00024205084410399222,0.10072579980656125,2,4,1.525458325715438,800,,0.5857326104901268,0.6372059938032859,0.03461686127110476,none,0.7259024403462615,4.07113887367335,5.0,0.7385559075744957,,,,0.41584502919777955,,0.5567616463138851,0.5572139303482587,0.715281812899477,0.7156549520766773,0.5857326104901268,0.6372059938032859,0.08,0.5344713494153439,0.52187124528039,0.5567616463138851,0.5572139303482587,1.0,1.0,none,0.4457658449244848,0.4295688351485083,0.7259024403462615,0.5,COMPLETE
2476,0.4413919413919414,2025-11-30 14:49:23.139469,2025-11-30 14:49:45.432421,0 days 00:00:22.292952,0.003244543331985447,dart,0.26140043318882883,5.0505236988347075,depthwise,0.005071531492875216,0.12486218842059689,5,8,22.76231078056631,500,tree,0.7578876249805606,0.6890657641318714,0.06756483554369996,undersample,0.8797002295038425,,8.0,0.8654515827339533,0.4024404395609617,uniform,0.13683815079671718,0.8954037461058202,,0.4690185436454093,0.44821347806422435,0.4730700179533214,0.4413919413919414,0.7578876249805606,0.6890657641318714,0.08,0.5154024915645891,0.5036039830120482,0.5285857572718154,0.5063025210084033,0.4281072298943948,0.3912337662337662,undersample,0.39409597307647676,0.3726039027366913,0.8797002295038425,0.5,COMPLETE
2477,0.7156549520766773,2025-11-30 14:49:46.225573,2025-11-30 14:49:46.671290,0 days 00:00:00.445717,0.00018119985968135957,gbtree,0.2206240225036271,1.3022964601050546,lossguide,1.0796938406888528,0.0019633564583502066,4,10,18.870116737831918,200,,0.5728939824052467,0.31909945632689485,0.023211579415902586,none,0.6780560572537679,2.083653807329663,11.0,0.6917836435742334,,,,0.6750060250688286,,0.5567616463138851,0.5572139303482587,0.715281812899477,0.7156549520766773,0.5728939824052467,0.31909945632689485,0.08,0.3789632571972579,0.3845710498429058,0.5567616463138851,0.5572139303482587,1.0,1.0,none,0.14737520515923674,0.16572411883315868,0.6780560572537679,0.5,COMPLETE
2478,0.7156549520766773,2025-11-30 14:49:47.472437,2025-11-30 14:50:50.268272,0 days 00:01:02.795835,0.01026549551641512,dart,0.7110375080429845,4.538918238849266,depthwise,0.6976956816678442,0.0010901554442351523,5,10,0.13950128000715523,700,forest,0.5575001644419371,0.8942773241346416,0.0022997023187061984,none,0.623911585328085,1.6465443827032402,7.0,0.8590209679442462,0.0821624750189689,weighted,0.5849405621889566,0.9621794601805258,,0.5567616463138851,0.5572139303482587,0.715281812899477,0.7156549520766773,0.5575001644419371,0.8942773241346416,0.08,0.524658831342969,0.5161761950955588,0.5567616463138851,0.5572139303482587,1.0,1.0,none,0.46043659543427445,0.4512257405515832,0.623911585328085,0.5,COMPLETE
2479,0.1554858934169279,2025-11-30 14:50:51.051016,2025-11-30 14:50:51.858916,0 days 00:00:00.807900,2.642651602653134,gbtree,0.7149507976506058,5.967588005099303,depthwise,0.5525827351027626,0.00020038746356044473,10,9,2.052761147400273,900,,0.9088595453810806,0.3562805852208735,0.02843965372987174,undersample,0.7151306372340156,,11.0,0.7000900833830214,,,,0.72729090354791,,0.40343735866123925,0.39077340569877883,0.17407639323731997,0.1554858934169279,0.9088595453810806,0.3562805852208735,0.08,0.41871863392595515,0.42094629655249166,0.3797814207650273,0.3415977961432507,0.11291632818846466,0.10064935064935066,undersample,0.24810631807556494,0.25553175119058674,0.7151306372340156,0.5,COMPLETE
2480,0.0,2025-11-30 14:50:52.631417,2025-11-30 14:50:53.404337,0 days 00:00:00.772920,0.006596795518098253,gbtree,0.48971714845047876,5.5153450269091975,lossguide,14.088433249476093,0.02231167669790948,6,12,89.92740710320825,900,,0.7094352481276933,0.3238599247476148,0.00547260223357019,undersample,0.8785923598019124,,7.0,0.6397738004729769,,,,0.9616539927290861,,0.44323835368611486,0.4427860696517413,0.0,0.0,0.7094352481276933,0.3238599247476148,0.08,0.5567616463138851,0.5572139303482587,0.0,0.0,0.0,0.0,undersample,0.5,0.5,0.8785923598019124,0.5,COMPLETE
