number,value,datetime_start,datetime_complete,duration,params_alpha,params_booster,params_colsample_bytree,params_gamma,params_grow_policy,params_lambda,params_learning_rate,params_max_delta_step,params_max_depth,params_min_child_weight,params_n_estimators,params_normalize_type,params_params_feature_fraction,params_params_labeled_ratio,params_params_missing_rate,params_params_resampling,params_params_sample_rows,params_params_scale_pos_weight,params_params_selftrain_max_iter,params_params_selftrain_threshold,params_rate_drop,params_sample_type,params_skip_drop,params_subsample,params_user_attrs_decision_threshold,user_attrs_acc_test,user_attrs_acc_val,user_attrs_f1_test,user_attrs_f1_val,user_attrs_feature_fraction,user_attrs_labeled_ratio,user_attrs_missing_rate,user_attrs_pr_auc_test,user_attrs_pr_auc_val,user_attrs_prec_test,user_attrs_prec_val,user_attrs_rec_test,user_attrs_rec_val,user_attrs_resampling_strategy,user_attrs_roc_auc_test,user_attrs_roc_auc_val,user_attrs_sample_rows,user_attrs_user_attrs_decision_threshold,state
1270,0.7223994894703255,2025-11-27 01:38:51.032137,2025-11-27 01:38:52.694925,0 days 00:00:01.662788,0.3320359838587798,gbtree,0.6194695688950917,0.4143725220793346,lossguide,8.477315594043908,0.006032998746732176,6,11,1.587427662030127,500,,0.7987236896587814,0.11920738784986226,0.08920642457721958,oversample,0.6465543058395341,,7.0,0.7582450100860352,,,,0.7902583109675383,0.47407788603286444,0.5965626413387607,0.6065128900949797,0.7166454891994918,0.7223994894703255,0.7987236896587814,0.11920738784986226,0.08,0.755801851140016,0.7717012125892436,0.5884194053208138,0.5951629863301787,0.9163281884646629,0.9188311688311688,oversample,0.7237077040401864,0.7276632330896886,0.6465543058395341,0.47407788603286444,COMPLETE
1271,0.0,2025-11-27 01:38:52.879852,2025-11-27 01:38:53.636050,0 days 00:00:00.756198,0.14228126026557605,gbtree,0.7544470041910807,4.804595089809898,lossguide,1.17571314978813,0.003011544338802114,10,11,0.5351896913368863,500,,0.91166626895477,0.08755288663756625,0.08638232169401595,oversample,0.6246047549159409,,9.0,0.7640639750196854,,,,0.9561644477598183,0.6210842659778237,0.44323835368611486,0.4427860696517413,0.0,0.0,0.91166626895477,0.08755288663756625,0.08,0.537756447507345,0.5295307298072711,0.0,0.0,0.0,0.0,oversample,0.4874960626005073,0.470227040579441,0.6246047549159409,0.6210842659778237,COMPLETE
1272,0.7156549520766773,2025-11-27 01:38:53.819020,2025-11-27 01:38:54.616478,0 days 00:00:00.797458,0.9250885120493159,gbtree,0.6105180871197342,2.7255183197613113,depthwise,3.5046854655672206,0.049008278558703246,7,3,69.41265913567553,500,,0.6232587737739546,0.8751227906914444,0.02590810690845055,oversample,0.6255406011308322,,6.0,0.8247918375388525,,,,0.5941353105287678,0.20715614572950378,0.5567616463138851,0.5572139303482587,0.715281812899477,0.7156549520766773,0.6232587737739546,0.8751227906914444,0.02,0.4687792558888053,0.4533585008074188,0.5567616463138851,0.5572139303482587,1.0,1.0,oversample,0.39240993716739336,0.3591028481222557,0.6255406011308322,0.20715614572950378,COMPLETE
1273,0.7156549520766773,2025-11-27 01:38:54.797539,2025-11-27 01:38:55.657348,0 days 00:00:00.859809,12.868742300384323,gbtree,0.6050239436923619,3.550829850147066,lossguide,91.84717379825872,0.0027896749564752187,7,11,0.4806316098262466,700,,0.8395240562395219,0.144932594453942,0.09113108010789997,oversample,0.5136910380500301,,6.0,0.8311338725324491,,,,0.8433393148007307,0.2892708116977085,0.5567616463138851,0.5572139303482587,0.715281812899477,0.7156549520766773,0.8395240562395219,0.144932594453942,0.1,0.5567616463138851,0.5572139303482587,0.5567616463138851,0.5572139303482587,1.0,1.0,oversample,0.5,0.5,0.5136910380500301,0.2892708116977085,COMPLETE
1274,0.0,2025-11-27 01:38:55.833568,2025-11-27 01:38:56.527062,0 days 00:00:00.693494,28.106345733074924,gbtree,0.5128434960825965,1.5113025804595854,lossguide,30.54634610178056,0.022061582822642953,7,12,21.502551970284507,400,,0.9055165488670656,0.0614336289633076,0.087591920815005,oversample,0.6073217386680744,,11.0,0.738216082453346,,,,0.8121337292159605,0.8841225663162426,0.44323835368611486,0.4427860696517413,0.0,0.0,0.9055165488670656,0.0614336289633076,0.08,0.5567616463138851,0.5572139303482587,0.0,0.0,0.0,0.0,oversample,0.5,0.5,0.6073217386680744,0.8841225663162426,COMPLETE
1275,0.5778069599474721,2025-11-27 01:38:56.716464,2025-11-27 01:38:57.487625,0 days 00:00:00.771161,0.19552231510059018,gbtree,0.5482901114997887,2.218414349319428,lossguide,2.5634048475313334,0.0013660304827599933,5,9,1.4344582999596889,300,,0.6775561644320658,0.08489913451158554,0.09418173492851507,oversample,0.7545685549002914,,8.0,0.7832930360918773,,,,0.6613292844499037,0.5448954313056713,0.4251469923111714,0.4183627317955676,0.5809429607649192,0.5778069599474721,0.6775561644320658,0.08489913451158554,0.1,0.4443330329423178,0.44079222719425604,0.48890122086570476,0.48511576626240355,0.7156783103168156,0.7142857142857143,oversample,0.3074723553109302,0.3007645125558813,0.7545685549002914,0.5448954313056713,COMPLETE
1276,0.7156549520766773,2025-11-27 01:38:57.677527,2025-11-27 01:38:58.383583,0 days 00:00:00.706056,0.05317723480057908,gbtree,0.5414394337383273,2.307772660620108,lossguide,48.95889124759261,0.004562894479885908,9,9,0.3002494006134181,300,,0.7435815022998404,0.26432324404210983,0.07171655947025969,oversample,0.6607345147604319,,5.0,0.7245886948639558,,,,0.8345845834069273,0.3609720306207512,0.5567616463138851,0.5572139303482587,0.715281812899477,0.7156549520766773,0.7435815022998404,0.26432324404210983,0.08,0.6003231474575791,0.6182309184124232,0.5567616463138851,0.5572139303482587,1.0,1.0,oversample,0.559503224522953,0.5757199899181513,0.6607345147604319,0.3609720306207512,COMPLETE
1277,0.7156549520766773,2025-11-27 01:38:58.563189,2025-11-27 01:38:59.252789,0 days 00:00:00.689600,7.444246328316223,gbtree,0.742824954779715,4.273248834104361,lossguide,0.41445475919828123,0.0017638322358410337,10,6,19.106555673872595,300,,0.8673139436661815,0.7635864629786071,0.010462184454009834,undersample,0.722929000545382,,6.0,0.7535856046941106,,,,0.4165975327883359,0.11154953331785228,0.5567616463138851,0.5572139303482587,0.715281812899477,0.7156549520766773,0.8673139436661815,0.7635864629786071,0.02,0.48971232879113014,0.47336345468462443,0.5567616463138851,0.5572139303482587,1.0,1.0,undersample,0.415795188912283,0.38852882944430445,0.722929000545382,0.11154953331785228,COMPLETE
1278,0.7156549520766773,2025-11-27 01:38:59.436507,2025-11-27 01:40:35.776349,0 days 00:01:36.339842,0.0005758963814964685,dart,0.9398966114918389,3.518475927014481,lossguide,0.07660304560441421,0.0518990877737165,0,3,0.3453589054180691,700,forest,0.9176184603197137,0.559941637779692,0.050393783655612645,none,0.8234810825467792,3.909704645857197,7.0,0.602645917431598,0.07394039874340685,uniform,0.47039691477533396,0.4995366115349634,0.5790323310761639,0.5567616463138851,0.5572139303482587,0.715281812899477,0.7156549520766773,0.9176184603197137,0.559941637779692,0.05,0.5491959910523897,0.5328376887246368,0.5567616463138851,0.5572139303482587,1.0,1.0,none,0.5068999817636234,0.5012461363968004,0.8234810825467792,0.5790323310761639,COMPLETE
1279,0.6531531531531531,2025-11-27 01:40:35.957654,2025-11-27 01:40:37.660563,0 days 00:00:01.702909,0.5701518505612291,gbtree,0.6958733643276012,0.5480355492403122,lossguide,0.024689775239805357,0.3511468216310115,10,9,22.050114461454335,200,,0.8676881924864037,0.5292981003227948,0.01400530958660363,undersample,0.6747576964164153,,6.0,0.7166389187839008,,,,0.44101554256083864,0.2285353013672817,0.5278154681139756,0.5124378109452736,0.6625727213962508,0.6531531531531531,0.8676881924864037,0.5292981003227948,0.02,0.5630820919435314,0.5276020109584182,0.5501878690284487,0.5410447761194029,0.8326563769293257,0.8238636363636364,undersample,0.4922793812894776,0.4555424465728347,0.6747576964164153,0.2285353013672817,COMPLETE
1280,0.7091775923718713,2025-11-27 01:40:37.841751,2025-11-27 01:40:40.865950,0 days 00:00:03.024199,0.05612941719523553,gbtree,0.8689517839733155,1.6737454259556457,lossguide,0.06212633282298761,0.18507049437757586,10,9,6.018247167828233,400,,0.8999446903999483,0.23277051483789846,0.07538211943032966,none,0.5127225441551572,3.860192126123262,8.0,0.6363159230514436,,,,0.6820802917608048,0.29488106894411625,0.5581184984170059,0.5585707824513795,0.7086191470325082,0.7091775923718713,0.8999446903999483,0.23277051483789846,0.08,0.5575964586175098,0.5690687724839057,0.5598491988689915,0.5602636534839924,0.9650690495532088,0.9659090909090909,none,0.5374322352824151,0.5379632178342597,0.5127225441551572,0.29488106894411625,COMPLETE
1281,0.7156549520766773,2025-11-27 01:40:41.048687,2025-11-27 01:41:13.297503,0 days 00:00:32.248816,0.7873250236858862,dart,0.5753127892968705,1.3270926938767653,depthwise,19.03559090431876,0.34192474967485603,10,4,21.1602836903505,500,forest,0.9039521866752919,0.33862258548876883,0.012994416405781575,undersample,0.5945728090208448,,7.0,0.8563020325832553,0.07365272176231547,weighted,0.14878002757166178,0.4599730698396328,0.4005015048231297,0.5567616463138851,0.5572139303482587,0.715281812899477,0.7156549520766773,0.9039521866752919,0.33862258548876883,0.02,0.49322496320778103,0.48845078384657914,0.5567616463138851,0.5572139303482587,1.0,1.0,undersample,0.40977428339329236,0.3932575978668931,0.5945728090208448,0.4005015048231297,COMPLETE
1282,0.7156549520766773,2025-11-27 01:41:13.487413,2025-11-27 01:41:14.715474,0 days 00:00:01.228061,0.07627903752443471,gbtree,0.4660073760684402,2.90988601263931,lossguide,0.036051771041426,0.01967775862652154,4,4,0.3106483382154783,600,,0.9539300374556864,0.5588339827074289,0.08921186225233957,undersample,0.5594891565621251,,8.0,0.7452460535569994,,,,0.5523069581785607,0.16940002112924665,0.5567616463138851,0.5572139303482587,0.715281812899477,0.7156549520766773,0.9539300374556864,0.5588339827074289,0.08,0.5371645392850259,0.5365811485222685,0.5567616463138851,0.5572139303482587,1.0,1.0,undersample,0.47014456473084765,0.4963428425507077,0.5594891565621251,0.16940002112924665,COMPLETE
1283,0.015527950310559006,2025-11-27 01:41:14.906715,2025-11-27 01:41:15.668910,0 days 00:00:00.762195,3.540837302250417,gbtree,0.5745740420175286,2.273394777996352,lossguide,2.030341606257628,0.014461899330078545,5,12,0.576336923448667,400,,0.7417979499924675,0.22426112100277562,0.05944233715690701,oversample,0.5940817259564307,,9.0,0.8019291606108301,,,,0.7344931610002323,0.6413420843641815,0.4319312528267752,0.4265038444142922,0.0202808112324493,0.015527950310559006,0.7417979499924675,0.22426112100277562,0.05,0.47581554023649153,0.4621496519203654,0.2549019607843137,0.17857142857142858,0.010560519902518278,0.008116883116883116,oversample,0.38332656376929325,0.3641868856373453,0.5940817259564307,0.6413420843641815,COMPLETE
1284,0.7156549520766773,2025-11-27 01:41:15.857437,2025-11-27 01:41:27.614526,0 days 00:00:11.757089,0.24230178664970964,dart,0.7180408283494828,0.8918896643586479,lossguide,0.38910062867192713,0.055085351369075795,9,5,28.339175355031657,300,forest,0.8289530240513511,0.4412053497539384,0.014246898347925016,undersample,0.6291677445544426,,8.0,0.801332530154625,0.07273629374251084,uniform,0.12278902557317221,0.23710420835967103,0.31539136164465065,0.5567616463138851,0.5572139303482587,0.715281812899477,0.7156549520766773,0.8289530240513511,0.4412053497539384,0.02,0.5446423438757129,0.5248977219909681,0.5567616463138851,0.5572139303482587,1.0,1.0,undersample,0.5142815696546693,0.48476322579361397,0.6291677445544426,0.31539136164465065,COMPLETE
1285,0.7156549520766773,2025-11-27 01:41:27.784784,2025-11-27 01:42:50.340600,0 days 00:01:22.555816,0.0007391418230387244,dart,0.4335809817151054,1.9114378425775076,lossguide,0.0002035819512929716,0.003539109683567147,9,11,0.5330339364415977,400,forest,0.970906293472001,0.5027932681652465,0.09046714762061193,undersample,0.6370427240175751,,12.0,0.6246355793519809,0.003377093868962608,uniform,0.17033086007262616,0.3858517773811161,0.11548295292487165,0.5567616463138851,0.5572139303482587,0.715281812899477,0.7156549520766773,0.970906293472001,0.5027932681652465,0.1,0.5444673942152725,0.5339068151414533,0.5567616463138851,0.5572139303482587,1.0,1.0,undersample,0.4999448764071023,0.5090798820689015,0.6370427240175751,0.11548295292487165,COMPLETE
1286,0.6707161125319693,2025-11-27 01:42:50.521587,2025-11-27 01:42:53.023710,0 days 00:00:02.502123,0.5268638364036841,gbtree,0.4912248618448092,1.1688507341298795,lossguide,1.8611859680862246,0.0956286446271174,4,12,0.6687223954655782,400,,0.8635282902533065,0.14584948234206407,0.09205930490888013,oversample,0.7729411807674658,,6.0,0.6459106803148271,,,,0.9674823006295711,0.4546399166918414,0.5364088647670737,0.5341474445952058,0.6734628862695126,0.6707161125319693,0.8635282902533065,0.14584948234206407,0.1,0.5720035043309852,0.5913460555226366,0.5539832285115304,0.5532700421940928,0.8586515028432169,0.851461038961039,oversample,0.4946824383693364,0.5121201895652866,0.7729411807674658,0.4546399166918414,COMPLETE
1287,0.7082458770614692,2025-11-27 01:42:53.203629,2025-11-27 01:42:55.265828,0 days 00:00:02.062199,0.020795255280637928,gbtree,0.6092822872214608,0.7441372730891573,lossguide,0.5392311694275788,0.00873898191724636,5,11,1.1082820178219697,700,,0.8741835950717034,0.15991886145119602,0.07409922770244365,oversample,0.6918058178275814,,8.0,0.836501629134448,,,,0.9694343132129543,0.36992554913228476,0.5639981908638625,0.5599276345545002,0.7115499700777977,0.7082458770614692,0.8741835950717034,0.15991886145119602,0.08,0.5214732353850382,0.5255540820547278,0.5632401705352913,0.5615786970993818,0.9658813972380179,0.9586038961038961,oversample,0.465200848820438,0.4680274398737116,0.6918058178275814,0.36992554913228476,COMPLETE
1288,0.07412898443291327,2025-11-27 01:42:55.459010,2025-11-27 01:46:28.389020,0 days 00:03:32.930010,0.010718205556487496,dart,0.7248745382847079,1.4031643198083223,lossguide,0.01085172148239196,0.012626851021978492,0,4,1.4884302923857744,700,forest,0.790586671680149,0.8606563113289891,0.01797325201636456,undersample,0.6762123291024633,,6.0,0.6148031726993861,0.16891415939717164,uniform,0.3192163768372696,0.26084499835318903,0.6286366465455232,0.4355495251017639,0.43509724106739034,0.060240963855421686,0.07412898443291327,0.790586671680149,0.8606563113289891,0.02,0.5195343774947616,0.528567445827438,0.41237113402061853,0.42735042735042733,0.03249390739236393,0.040584415584415584,undersample,0.4717986869808849,0.48082707639653505,0.6762123291024633,0.6286366465455232,COMPLETE
1289,0.7156549520766773,2025-11-27 01:46:28.568484,2025-11-27 01:46:29.360008,0 days 00:00:00.791524,9.837803821658504,gbtree,0.5479354526854646,2.339857851824444,lossguide,0.41948998902802553,0.14861055098976106,10,5,6.470284593596805,500,,0.8215042527012552,0.5506799095226822,0.02945473725643946,oversample,0.5354976525655311,,7.0,0.7557906321259287,,,,0.6264294468558883,0.2140258520295949,0.5567616463138851,0.5572139303482587,0.715281812899477,0.7156549520766773,0.8215042527012552,0.5506799095226822,0.02,0.5042979669531313,0.49888576622271474,0.5567616463138851,0.5572139303482587,1.0,1.0,oversample,0.4298007261393591,0.43556944204926834,0.5354976525655311,0.2140258520295949,COMPLETE
1290,0.0,2025-11-27 01:46:29.539448,2025-11-27 01:46:30.656172,0 days 00:00:01.116724,0.027065206469220563,gbtree,0.5641710509419919,0.5430473417352193,lossguide,46.99250365606353,0.0029357061018803155,5,10,0.9687340850793689,600,,0.7685442677795284,0.10647962294796794,0.08706075208411618,oversample,0.7415634096636317,,6.0,0.7729265416054885,,,,0.8921046512203712,0.6185003245050344,0.44323835368611486,0.4427860696517413,0.0,0.0,0.7685442677795284,0.10647962294796794,0.08,0.5490619068193269,0.5366822252562732,0.0,0.0,0.0,0.0,oversample,0.40374301629668924,0.38644613175384374,0.7415634096636317,0.6185003245050344,COMPLETE
1291,0.7156549520766773,2025-11-27 01:46:30.842068,2025-11-27 01:46:31.992075,0 days 00:00:01.150007,0.49963711910485525,gbtree,0.5570134349931896,0.7878544823443879,depthwise,47.12386382480753,0.0002901869939252551,5,11,0.5101558001303252,500,,0.7070762336536748,0.29384453791597787,0.08191709384033212,oversample,0.585850060851996,,7.0,0.7304975044379728,,,,0.8445136955628992,0.48221057385112986,0.5567616463138851,0.5572139303482587,0.715281812899477,0.7156549520766773,0.7070762336536748,0.29384453791597787,0.08,0.5318079217373852,0.5337535632755406,0.5567616463138851,0.5572139303482587,1.0,1.0,oversample,0.4755329995523798,0.47755337741931203,0.585850060851996,0.48221057385112986,COMPLETE
1292,0.7156549520766773,2025-11-27 01:46:32.182906,2025-11-27 01:46:37.208038,0 days 00:00:05.025132,0.028908631669584645,gbtree,0.5256150187303263,1.6965721140571657,lossguide,0.0017344781413440491,0.028260765930141683,7,11,2.2172541175173137,800,,0.5583861423303649,0.7755020073587516,0.021797290230886703,none,0.8100070392491852,1.6803088978571306,5.0,0.694676811873858,,,,0.549209640533946,0.11067364565230148,0.5567616463138851,0.5572139303482587,0.715281812899477,0.7156549520766773,0.5583861423303649,0.7755020073587516,0.02,0.5607782560598028,0.5682833610779909,0.5567616463138851,0.5572139303482587,1.0,1.0,none,0.519183424791525,0.5284907571998991,0.8100070392491852,0.11067364565230148,COMPLETE
1293,0.7171687627961392,2025-11-27 01:46:37.391110,2025-11-27 01:46:42.166012,0 days 00:00:04.774902,2.0257305092465137,gbtree,0.7082200975460087,1.7851822110879727,lossguide,0.007440483682183425,0.006125725303044751,7,9,18.372551425541687,800,,0.8280724453787138,0.3014021181165421,0.0908353725854469,oversample,0.7779735269292786,,7.0,0.6917881833920263,,,,0.7436225889638257,0.42594411873744503,0.5572139303482587,0.5626413387607417,0.71432740005836,0.7171687627961392,0.8280724453787138,0.3014021181165421,0.1,0.4398626427926162,0.43811498556078865,0.5573770491803278,0.5605852766346594,0.9943135662063363,0.9951298701298701,oversample,0.3451192824814735,0.3396724891553799,0.7779735269292786,0.42594411873744503,COMPLETE
1294,0.7156549520766773,2025-11-27 01:46:42.338149,2025-11-27 01:46:43.324146,0 days 00:00:00.985997,0.6356950154619507,gbtree,0.7899147803286101,5.176633474000456,lossguide,0.0044603362623421945,0.01280652582029353,9,9,41.851326266688126,1000,,0.9252856782682439,0.10021906909094042,0.08933558024227753,oversample,0.7514078913062565,,6.0,0.7520231906870849,,,,0.6771583168575398,0.5529257003448668,0.5567616463138851,0.5572139303482587,0.715281812899477,0.7156549520766773,0.9252856782682439,0.10021906909094042,0.08,0.5567616463138851,0.5572139303482587,0.5567616463138851,0.5572139303482587,1.0,1.0,oversample,0.5,0.5,0.7514078913062565,0.5529257003448668,COMPLETE
1295,0.7156549520766773,2025-11-27 01:46:43.498558,2025-11-27 01:52:22.231200,0 days 00:05:38.732642,0.0854359291214688,dart,0.8755259623794495,3.8483167523221233,depthwise,0.00361678280496283,0.06471079902164252,1,5,1.4008473971894064,800,tree,0.6635036987666608,0.7694838430108931,0.03518854544962529,none,0.9006264405275992,1.660832917167778,7.0,0.6751764307146155,0.013347651971115315,uniform,0.3106556665022586,0.46714613481816303,0.5390550713993114,0.5567616463138851,0.5572139303482587,0.715281812899477,0.7156549520766773,0.6635036987666608,0.7694838430108931,0.05,0.5270143553899866,0.513350501483292,0.5567616463138851,0.5572139303482587,1.0,1.0,none,0.4823745420182695,0.4573366176724195,0.9006264405275992,0.5390550713993114,COMPLETE
1296,0.6539085306519624,2025-11-27 01:52:22.406923,2025-11-27 01:52:43.189286,0 days 00:00:20.782363,1.1264846426174533,dart,0.6275888477474424,0.847866228388545,lossguide,14.210674063599306,0.16153619683336784,8,3,8.264647513488413,400,forest,0.8651711963655069,0.4350650897493421,0.048266663519611286,oversample,0.5558231184348377,,5.0,0.8672624817337682,0.2370561864911785,weighted,0.8928431272054624,0.2696779515571161,0.46394498847278676,0.5287200361827228,0.5174129353233831,0.6590314136125655,0.6539085306519624,0.8651711963655069,0.4350650897493421,0.05,0.47510201602577395,0.4841727682744559,0.5517808219178082,0.5445705024311183,0.818034118602762,0.8181818181818182,oversample,0.39688406638041085,0.4108664254540148,0.5558231184348377,0.46394498847278676,COMPLETE
1297,0.679016503873358,2025-11-27 01:52:43.360669,2025-11-27 01:52:44.516795,0 days 00:00:01.156126,7.534112335910386,gbtree,0.6841645037662293,0.2910526932858044,lossguide,0.003329862021496387,0.014924955668339483,8,8,4.3054714348202685,1000,,0.9459647763616568,0.12079155477432935,0.09302058099080503,undersample,0.85760273210396,,8.0,0.6396347025026411,,,,0.957765630220399,0.47624616661205094,0.55359565807327,0.5689733152419719,0.6693467336683417,0.679016503873358,0.9459647763616568,0.12079155477432935,0.1,0.5911899597022687,0.6062278974333537,0.5695553021664767,0.5803108808290155,0.8115353371242892,0.8181818181818182,undersample,0.5494611979641573,0.5674049520448907,0.85760273210396,0.47624616661205094,COMPLETE
1298,0.7156549520766773,2025-11-27 01:52:44.689674,2025-11-27 01:52:45.512915,0 days 00:00:00.823241,52.19820341731803,gbtree,0.655452414892739,1.6982985655442717,depthwise,0.014095353783425215,0.00435676957126657,6,8,9.281251718333792,700,,0.8326475766392322,0.05269090327258458,0.08397151286765886,oversample,0.7723665080770281,,7.0,0.6815960796355821,,,,0.8135749108251611,0.20366508775507758,0.5567616463138851,0.5572139303482587,0.715281812899477,0.7156549520766773,0.8326475766392322,0.05269090327258458,0.08,0.5567616463138851,0.5572139303482587,0.5567616463138851,0.5572139303482587,1.0,1.0,oversample,0.5,0.5,0.7723665080770281,0.20366508775507758,COMPLETE
