number,value,datetime_start,datetime_complete,duration,params_alpha,params_booster,params_colsample_bytree,params_gamma,params_grow_policy,params_lambda,params_learning_rate,params_max_delta_step,params_max_depth,params_min_child_weight,params_n_estimators,params_normalize_type,params_params_feature_fraction,params_params_labeled_ratio,params_params_missing_rate,params_params_resampling,params_params_sample_rows,params_params_scale_pos_weight,params_params_selftrain_max_iter,params_params_selftrain_threshold,params_rate_drop,params_sample_type,params_skip_drop,params_subsample,params_user_attrs_decision_threshold,user_attrs_acc_test,user_attrs_acc_val,user_attrs_f1_test,user_attrs_f1_val,user_attrs_feature_fraction,user_attrs_labeled_ratio,user_attrs_missing_rate,user_attrs_pr_auc_test,user_attrs_pr_auc_val,user_attrs_prec_test,user_attrs_prec_val,user_attrs_rec_test,user_attrs_rec_val,user_attrs_resampling_strategy,user_attrs_roc_auc_test,user_attrs_roc_auc_val,user_attrs_sample_rows,user_attrs_user_attrs_decision_threshold,state
59,0.0,2025-11-26 16:21:33.317613,2025-11-26 16:21:50.648218,0 days 00:00:17.330605,2.0985319993873732,dart,0.919060175441454,7.689194362148218,lossguide,13.784937647029642,0.021091817839118492,0,10,20.387644962747945,400,tree,0.5732918680755283,0.8772539006514196,0.07486060058295778,oversample,0.5493799433952775,,7.0,0.7440692608279528,0.49926328885417715,weighted,0.1184183976295276,0.9832087352006582,0.9342010153907235,0.44323835368611486,0.4427860696517413,0.0,0.0,0.5732918680755283,0.8772539006514196,0.08,0.5567616463138851,0.5572139303482587,0.0,0.0,0.0,0.0,oversample,0.5,0.5,0.5493799433952775,0.9342010153907235,COMPLETE
60,0.0,2025-11-26 16:21:50.827568,2025-11-26 16:21:51.532061,0 days 00:00:00.704493,0.0198791658672466,gbtree,0.6717694543943385,6.844985465240676,lossguide,0.03191529421463887,0.025568860614819826,0,4,30.334698536880992,700,,0.8147306135045761,0.7089279972257313,0.011222431582828853,oversample,0.5908111973228442,,12.0,0.9115390394850325,,,,0.5144979321787337,0.6595993489859774,0.44323835368611486,0.4427860696517413,0.0,0.0,0.8147306135045761,0.7089279972257313,0.02,0.4944053938976796,0.4911495916733146,0.0,0.0,0.0,0.0,oversample,0.4424310747857226,0.43125936882320953,0.5908111973228442,0.6595993489859774,COMPLETE
61,0.0,2025-11-26 16:21:51.700433,2025-11-26 16:22:53.753211,0 days 00:01:02.052778,0.00020724716486534843,dart,0.8588539440227888,1.4931181652424117,depthwise,0.010620974235255364,0.0011063054862916314,0,11,46.244438830226265,700,forest,0.5947205271530757,0.37167048169307093,0.03909061688155081,none,0.5624178861755266,0.5059542514583577,6.0,0.898381529430394,0.14677453324166262,weighted,0.5861768069812348,0.9313128301822948,0.569442485969495,0.44323835368611486,0.4427860696517413,0.0,0.0,0.5947205271530757,0.37167048169307093,0.05,0.696199531114116,0.6775606594315647,0.0,0.0,0.0,0.0,none,0.6611411827119149,0.63193541647321,0.5624178861755266,0.569442485969495,COMPLETE
62,0.7156549520766773,2025-11-26 16:22:53.920743,2025-11-26 16:23:20.369563,0 days 00:00:26.448820,0.3114404322875102,dart,0.852223408812186,9.815195468587502,depthwise,0.0001534860767214326,0.01739471270693063,5,4,0.10782458745262041,500,tree,0.7775409707812998,0.7128040461948622,0.021378814284754903,oversample,0.9147864928739649,,10.0,0.8992715652156199,0.2749387998871343,weighted,0.27857485277104144,0.3987567335652275,0.44607385657874943,0.5567616463138851,0.5572139303482587,0.715281812899477,0.7156549520766773,0.7775409707812998,0.7128040461948622,0.02,0.5305488028101077,0.523504214288352,0.5567616463138851,0.5572139303482587,1.0,1.0,oversample,0.5068245494786054,0.4927234091240731,0.9147864928739649,0.44607385657874943,COMPLETE
63,0.7156549520766773,2025-11-26 16:23:20.536528,2025-11-26 16:24:23.857872,0 days 00:01:03.321344,43.843664574352886,dart,0.6950479363634448,6.097235223732996,lossguide,77.5553241786957,0.006194734386955865,7,8,16.61794652101822,700,forest,0.8747546709188897,0.09420100289066112,0.06912882638694406,undersample,0.9524305275846694,,9.0,0.8630413749290912,0.024478500831267833,weighted,0.06558147156331373,0.485308746143454,0.4186902644717577,0.5567616463138851,0.5572139303482587,0.715281812899477,0.7156549520766773,0.8747546709188897,0.09420100289066112,0.08,0.5567616463138851,0.5572139303482587,0.5567616463138851,0.5572139303482587,1.0,1.0,undersample,0.5,0.5,0.9524305275846694,0.4186902644717577,COMPLETE
64,0.7156549520766773,2025-11-26 16:24:24.027833,2025-11-26 16:25:29.342850,0 days 00:01:05.315017,0.4057916858444052,dart,0.5269647711351128,9.355799645293056,lossguide,0.9367511557302122,0.015274695100369358,1,4,0.23750392928559177,800,forest,0.5948620948615881,0.1120103905158316,0.07783561843243131,oversample,0.961587292005717,,12.0,0.623711077681398,0.4180926564036004,uniform,0.4373613994490627,0.6637736624138982,0.4043439312398696,0.5567616463138851,0.5572139303482587,0.715281812899477,0.7156549520766773,0.5948620948615881,0.1120103905158316,0.08,0.5508777597697206,0.5343423845363078,0.5567616463138851,0.5572139303482587,1.0,1.0,oversample,0.46667385069381123,0.44200574068423915,0.961587292005717,0.4043439312398696,COMPLETE
65,0.7156549520766773,2025-11-26 16:25:29.507593,2025-11-26 16:25:30.368039,0 days 00:00:00.860446,0.0006711283646759352,gbtree,0.6841934675525314,2.52501981548861,lossguide,0.28934651969058134,0.002483284193304401,7,12,1.2316361871749057,200,,0.8969968757312738,0.4679912403092047,0.05022736483722674,undersample,0.6151430985866817,,12.0,0.683024270713592,,,,0.4964961148788375,0.26716857582083414,0.5567616463138851,0.5572139303482587,0.715281812899477,0.7156549520766773,0.8969968757312738,0.4679912403092047,0.05,0.7074731987064764,0.7094091858514081,0.5567616463138851,0.5572139303482587,1.0,1.0,undersample,0.7001815348397685,0.6995119920937081,0.6151430985866817,0.26716857582083414,COMPLETE
66,0.7156549520766773,2025-11-26 16:25:30.533361,2025-11-26 16:25:31.439889,0 days 00:00:00.906528,0.0002623563068097999,gbtree,0.4005837653510387,5.734999694770535,depthwise,0.0001771289034108789,0.002916109532970132,7,11,0.1641479090246019,900,,0.5613339012158176,0.48151416063707064,0.007942745607981942,oversample,0.9747203155011478,,6.0,0.6881554474865499,,,,0.4277423079335072,0.29942774412303574,0.5567616463138851,0.5572139303482587,0.715281812899477,0.7156549520766773,0.5613339012158176,0.48151416063707064,0.0,0.4435610070128707,0.43633470217961096,0.5567616463138851,0.5572139303482587,1.0,1.0,oversample,0.3270772890797261,0.31353057055304245,0.9747203155011478,0.29942774412303574,COMPLETE
67,0.7156549520766773,2025-11-26 16:25:31.613338,2025-11-26 16:26:10.760564,0 days 00:00:39.147226,80.38173664776768,dart,0.3869389124904682,3.7358154978463136,lossguide,2.6817582154559423,0.00018436461827937714,1,9,6.159742718455516,600,forest,0.6340723124890184,0.30932737856636383,0.0290828297039473,none,0.8526091127219666,0.6867809667758679,5.0,0.7872135950715821,0.29128740355585847,weighted,0.4027854940600912,0.4767951474413864,0.22215824535069112,0.5567616463138851,0.5572139303482587,0.715281812899477,0.7156549520766773,0.6340723124890184,0.30932737856636383,0.02,0.5567616463138851,0.5572139303482587,0.5567616463138851,0.5572139303482587,1.0,1.0,none,0.5,0.5,0.8526091127219666,0.22215824535069112,COMPLETE
68,0.7156549520766773,2025-11-26 16:26:10.939640,2025-11-26 16:27:26.899952,0 days 00:01:15.960312,9.327651943400573,dart,0.5492266619673607,6.922810824105765,lossguide,2.8188798617695574,0.0005014234135779593,2,5,16.40964608386355,800,tree,0.8875712397426888,0.13414307634330258,0.06700044804164924,none,0.732600998438531,0.5097521423945155,6.0,0.837457373639508,0.26858190599109505,weighted,0.6342940702593945,0.7244210355526363,0.08517531630604606,0.5567616463138851,0.5572139303482587,0.715281812899477,0.7156549520766773,0.8875712397426888,0.13414307634330258,0.08,0.5567616463138851,0.5572139303482587,0.5567616463138851,0.5572139303482587,1.0,1.0,none,0.5,0.5,0.732600998438531,0.08517531630604606,COMPLETE
69,0.7156549520766773,2025-11-26 16:27:27.065641,2025-11-26 16:27:48.404193,0 days 00:00:21.338552,0.12596095218282916,dart,0.3219980250203624,8.034606869203456,lossguide,0.17982759094412581,0.0002741603479951564,3,3,2.4512375602698233,400,tree,0.5900225356355312,0.28562523175656623,0.08839931788245287,oversample,0.8382644767800836,,8.0,0.6385472667630888,0.004198588664139642,weighted,0.1533401112467409,0.744042635736524,0.05575779676593945,0.5567616463138851,0.5572139303482587,0.715281812899477,0.7156549520766773,0.5900225356355312,0.28562523175656623,0.08,0.5196408247879855,0.5167528099217314,0.5567616463138851,0.5572139303482587,1.0,1.0,oversample,0.4082353818863045,0.40481648713901003,0.8382644767800836,0.05575779676593945,COMPLETE
70,0.7156549520766773,2025-11-26 16:27:48.580006,2025-11-26 16:28:59.960927,0 days 00:01:11.380921,0.00013186344179004036,dart,0.5285923117526805,3.7548284446490947,lossguide,0.7886377841888235,0.026445841886037335,9,11,0.116218198633589,800,tree,0.8912967116673021,0.6490913656628652,0.08342618034728773,undersample,0.6576173985973754,,11.0,0.6524011092267517,0.3118289025943639,weighted,0.028025476904291635,0.4513512002955212,0.08117866812748942,0.5567616463138851,0.5572139303482587,0.715281812899477,0.7156549520766773,0.8912967116673021,0.6490913656628652,0.08,0.44220543575170446,0.4244347028099411,0.5567616463138851,0.5572139303482587,1.0,1.0,undersample,0.31038354415689917,0.27601755369247705,0.6576173985973754,0.08117866812748942,COMPLETE
71,0.7156549520766773,2025-11-26 16:29:00.133293,2025-11-26 16:30:03.356142,0 days 00:01:03.222849,0.000780311835645699,dart,0.4329773982047359,2.153587196785566,depthwise,10.900653825927504,0.0002237766233219817,0,12,18.749127543775057,700,forest,0.6375759595143086,0.05037036675721039,0.05488431259233181,undersample,0.6237528257201109,,7.0,0.8707186024429707,0.018993626746803827,uniform,0.8997283764312239,0.84042033109379,0.21409049455718684,0.5567616463138851,0.5572139303482587,0.715281812899477,0.7156549520766773,0.6375759595143086,0.05037036675721039,0.05,0.5567616463138851,0.5572139303482587,0.5567616463138851,0.5572139303482587,1.0,1.0,undersample,0.5,0.5,0.6237528257201109,0.21409049455718684,COMPLETE
72,0.7156549520766773,2025-11-26 16:30:03.518633,2025-11-26 16:30:04.146588,0 days 00:00:00.627955,0.006028222271780313,gbtree,0.8165556792905223,4.335506379865087,lossguide,0.027096909602518274,0.006286087029132851,4,7,0.19819736356815187,300,,0.7376073534940172,0.7683978867544236,0.07553509511621928,none,0.8557559487734074,0.8918659796525472,6.0,0.7459478567730505,,,,0.2349942346255114,0.4068368740706174,0.5567616463138851,0.5572139303482587,0.715281812899477,0.7156549520766773,0.7376073534940172,0.7683978867544236,0.08,0.642805649010084,0.6385656181085743,0.5567616463138851,0.5572139303482587,1.0,1.0,none,0.6187623302773587,0.599193452104586,0.8557559487734074,0.4068368740706174,COMPLETE
73,0.7156549520766773,2025-11-26 16:30:04.306106,2025-11-26 16:30:41.768790,0 days 00:00:37.462684,0.1442262081375072,dart,0.6239409891506293,9.485724933539137,lossguide,0.012133689439223452,0.0007555878295287647,0,3,0.7527353496176684,600,tree,0.8719098228600429,0.07514273184490683,0.07824465562768558,none,0.9556704842646617,0.8497873325001885,11.0,0.6129449181452884,0.45431578073101553,uniform,0.5252652072041442,0.7241942763485127,0.08887567042088625,0.5567616463138851,0.5572139303482587,0.715281812899477,0.7156549520766773,0.8719098228600429,0.07514273184490683,0.08,0.5567616463138851,0.5572139303482587,0.5567616463138851,0.5572139303482587,1.0,1.0,none,0.5,0.5,0.9556704842646617,0.08887567042088625,COMPLETE
74,0.7139947628746,2025-11-26 16:30:41.926363,2025-11-26 16:30:44.653465,0 days 00:00:02.727102,0.00010374747920772432,gbtree,0.6580521244127712,3.5466621680182624,depthwise,0.0039011498128130335,0.11499263422317248,4,12,0.2380321827124238,500,,0.8530878790670314,0.4684253231422558,0.06741369651786375,undersample,0.7256249118574478,,11.0,0.7023974951580518,,,,0.44852652714774094,0.03817976034014037,0.5563093622795116,0.5554047942107644,0.7149084568439407,0.7139947628746,0.8530878790670314,0.4684253231422558,0.08,0.5581509288740638,0.5401085816213544,0.5565610859728507,0.5564625850340136,0.9991876523151909,0.9959415584415584,undersample,0.5405087949070774,0.5067488691084197,0.7256249118574478,0.03817976034014037,COMPLETE
75,0.7156549520766773,2025-11-26 16:30:44.809730,2025-11-26 16:31:02.761512,0 days 00:00:17.951782,6.2279368779249955,dart,0.3097234407260684,9.147590457087144,lossguide,0.01788381030046144,0.00013263063412539952,2,10,12.763931513068371,400,forest,0.8977508728674819,0.32608453534895077,0.04904321865767473,none,0.8507810643392777,0.6893467260763858,6.0,0.6977460982033057,0.3140078461315158,uniform,0.5445957141077304,0.9325068119679293,0.35417723019747316,0.5567616463138851,0.5572139303482587,0.715281812899477,0.7156549520766773,0.8977508728674819,0.32608453534895077,0.05,0.5567616463138851,0.5572139303482587,0.5567616463138851,0.5572139303482587,1.0,1.0,none,0.5,0.5,0.8507810643392777,0.35417723019747316,COMPLETE
76,0.5920289855072464,2025-11-26 16:31:02.923026,2025-11-26 16:31:06.296004,0 days 00:00:03.372978,0.009483462282800142,gbtree,0.8645195305615081,3.1197639498457415,lossguide,0.0013591182185525986,0.029395162931710066,3,4,0.8441907782989315,800,,0.8107062285257504,0.6571402554696694,0.08685960743656423,undersample,0.7731946240526388,,6.0,0.6302994465789347,,,,0.24964807828566374,0.39792051184074134,0.5137946630483944,0.49072817729534146,0.6134483998561668,0.5920289855072464,0.8107062285257504,0.6571402554696694,0.08,0.48319932156913503,0.47680512151138477,0.5503225806451613,0.5346858638743456,0.6929325751421609,0.6631493506493507,undersample,0.42210207397337496,0.40982258931058724,0.7731946240526388,0.39792051184074134,COMPLETE
77,0.7156549520766773,2025-11-26 16:31:06.457677,2025-11-26 16:33:00.864679,0 days 00:01:54.407002,0.0010277924716020502,dart,0.7262110204345272,5.852607562348778,lossguide,0.8573203582771837,0.00019310038811449205,1,12,30.08026664558145,1000,tree,0.5743062055948417,0.4076900366969607,0.06455196765711481,none,0.5257058127797843,1.107249297667137,6.0,0.809992356054746,0.1419970605783686,uniform,0.0024258951223847247,0.8780809485303581,0.062350857461999476,0.5567616463138851,0.5572139303482587,0.715281812899477,0.7156549520766773,0.5743062055948417,0.4076900366969607,0.05,0.4669557234414864,0.4587294629121378,0.5567616463138851,0.5572139303482587,1.0,1.0,none,0.23966163232149074,0.21389769576695014,0.5257058127797843,0.062350857461999476,COMPLETE
78,0.0,2025-11-26 16:33:01.027492,2025-11-26 16:33:01.944008,0 days 00:00:00.916516,0.12039825229177419,gbtree,0.5955039644878743,5.926066068672524,depthwise,0.0005782697613512151,0.002249808013325145,7,9,0.5377187023505167,900,,0.6936694580722353,0.49837802327738856,0.008195955369744955,undersample,0.9459863894531395,,5.0,0.65443377725303,,,,0.6943288304268014,0.6692615630208327,0.44323835368611486,0.4427860696517413,0.0,0.0,0.6936694580722353,0.49837802327738856,0.0,0.46679234610530684,0.4720648020473562,0.0,0.0,0.0,0.0,undersample,0.3039274523781893,0.2861566102436889,0.9459863894531395,0.6692615630208327,COMPLETE
79,0.7156549520766773,2025-11-26 16:33:02.110828,2025-11-26 16:34:36.620848,0 days 00:01:34.510020,0.0006295977954176157,dart,0.8540647286337492,1.1312467796749734,lossguide,13.786950312255868,0.0016610145164614079,0,11,84.00257404254018,900,forest,0.640101296489329,0.13105312508742958,0.004406930520578632,none,0.6398892780946318,0.5028550912296184,8.0,0.8926460745879039,0.27045681264835414,weighted,0.5369380725197243,0.7146786046541987,0.15732926110217493,0.5567616463138851,0.5572139303482587,0.715281812899477,0.7156549520766773,0.640101296489329,0.13105312508742958,0.0,0.5567616463138851,0.5572139303482587,0.5567616463138851,0.5572139303482587,1.0,1.0,none,0.5,0.5,0.6398892780946318,0.15732926110217493,COMPLETE
80,0.0,2025-11-26 16:34:36.783326,2025-11-26 16:34:38.045510,0 days 00:00:01.262184,0.00024101029849123775,gbtree,0.6712101378360295,3.8719204058746532,depthwise,0.0009869545730949194,0.0003716600364715593,5,9,0.616725460086666,900,,0.8541278365685304,0.5501439436168153,0.003107511140816994,oversample,0.845097739399099,,7.0,0.7833644219752122,,,,0.5915818220164926,0.6467486717179453,0.44323835368611486,0.4427860696517413,0.0,0.0,0.8541278365685304,0.5501439436168153,0.0,0.4950355218968827,0.4865692699636424,0.0,0.0,0.0,0.0,oversample,0.4427788093303934,0.43011645530159315,0.845097739399099,0.6467486717179453,COMPLETE
81,0.7156549520766773,2025-11-26 16:34:38.230952,2025-11-26 16:35:25.648688,0 days 00:00:47.417736,0.01041457370161841,dart,0.7265790680974978,0.45832640426034454,depthwise,1.1028509410712217,0.00021350455080984686,4,8,84.99921972322863,600,forest,0.730083378952155,0.0668537148949376,0.022147628695585897,oversample,0.5306045191550268,,5.0,0.8433389940632707,0.023385338482200226,weighted,0.31419544551804046,0.9141946992246868,0.20216675436082537,0.5567616463138851,0.5572139303482587,0.715281812899477,0.7156549520766773,0.730083378952155,0.0668537148949376,0.02,0.5567616463138851,0.5572139303482587,0.5567616463138851,0.5572139303482587,1.0,1.0,oversample,0.5,0.5,0.5306045191550268,0.20216675436082537,COMPLETE
82,0.7156549520766773,2025-11-26 16:35:25.810677,2025-11-26 16:37:24.751851,0 days 00:01:58.941174,0.006234539419864377,dart,0.9042079864361741,1.865669352608915,lossguide,0.00031928730161968124,0.0001081117524136903,2,11,8.239126570921087,1000,tree,0.5225535802351969,0.06643585373942491,0.08671777222280784,oversample,0.944190874277363,,5.0,0.7668751904889318,0.14966070275113877,weighted,0.028615928450594588,0.38304917461024374,0.4008475370323184,0.5567616463138851,0.5572139303482587,0.715281812899477,0.7156549520766773,0.5225535802351969,0.06643585373942491,0.08,0.7128438017995803,0.6970960540120184,0.5567616463138851,0.5572139303482587,1.0,1.0,oversample,0.6713908552860625,0.6582688570367324,0.944190874277363,0.4008475370323184,COMPLETE
83,0.7156549520766773,2025-11-26 16:37:24.918513,2025-11-26 16:39:43.541385,0 days 00:02:18.622872,0.005607394594986517,dart,0.8117826339413632,5.5809877656774,lossguide,0.0004569775922682522,0.0009074338079766413,2,10,3.191038715068431,900,tree,0.5298699260126968,0.05554412589891039,0.06475296345163806,none,0.8921119617395247,1.298115340646702,5.0,0.6151645325055027,0.21131979170314222,weighted,0.11373324048546662,0.41927315953503574,0.062344205718738915,0.5567616463138851,0.5572139303482587,0.715281812899477,0.7156549520766773,0.5298699260126968,0.05554412589891039,0.05,0.5567616463138851,0.5572139303482587,0.5567616463138851,0.5572139303482587,1.0,1.0,none,0.5,0.5,0.8921119617395247,0.062344205718738915,COMPLETE
84,0.0,2025-11-26 16:39:43.710584,2025-11-26 16:40:14.417507,0 days 00:00:30.706923,5.630874265281835,dart,0.8404513022122981,2.6120701570371025,lossguide,0.6105292297462869,0.00029336258383577674,10,9,6.543421581584062,500,forest,0.7296881849626228,0.5109606710751987,0.045435673779809886,undersample,0.9945644255463119,,8.0,0.9057589832781014,0.11482964723875533,weighted,0.016565720791558332,0.49248886156945276,0.7600658871888158,0.44323835368611486,0.4427860696517413,0.0,0.0,0.7296881849626228,0.5109606710751987,0.05,0.5591125636929188,0.5635614090066098,0.0,0.0,0.0,0.0,undersample,0.52787347270346,0.5376722039451864,0.9945644255463119,0.7600658871888158,COMPLETE
85,0.7156549520766773,2025-11-26 16:40:14.578422,2025-11-26 16:40:15.305981,0 days 00:00:00.727559,60.37154452158175,gbtree,0.5687436388920684,4.746606005102949,lossguide,0.5542061755981346,0.00014244644699214513,1,8,4.246189277125208,600,,0.9244122334444608,0.2759877861071528,0.06020722000628882,undersample,0.7372639652361355,,9.0,0.7577742894811353,,,,0.8052841528702763,0.24041945518208874,0.5567616463138851,0.5572139303482587,0.715281812899477,0.7156549520766773,0.9244122334444608,0.2759877861071528,0.05,0.5567616463138851,0.5572139303482587,0.5567616463138851,0.5572139303482587,1.0,1.0,undersample,0.5,0.5,0.7372639652361355,0.24041945518208874,COMPLETE
86,0.7156549520766773,2025-11-26 16:40:15.469864,2025-11-26 16:41:23.028347,0 days 00:01:07.558483,0.003415424650301243,dart,0.5504215133377239,9.603384619830228,lossguide,0.0008578918637296959,0.00017548106677218049,5,3,0.12889277326149629,800,forest,0.5956595929318409,0.40014810459347067,0.043925026958560806,oversample,0.9594333809591932,,12.0,0.6566696136728757,0.47370474792547557,weighted,0.5807646002941004,0.586717502568316,0.23333695178362096,0.5567616463138851,0.5572139303482587,0.715281812899477,0.7156549520766773,0.5956595929318409,0.40014810459347067,0.05,0.47047341597017406,0.45863004076492747,0.5567616463138851,0.5572139303482587,1.0,1.0,oversample,0.30561473167658615,0.2721659724341032,0.9594333809591932,0.23333695178362096,COMPLETE
87,0.0,2025-11-26 16:41:23.182081,2025-11-26 16:41:24.040745,0 days 00:00:00.858664,14.457260580745036,gbtree,0.8708629101802559,2.3984893278277672,lossguide,0.1482418458133821,0.001083145578980764,10,11,3.1358725443609683,900,,0.8829032602691047,0.1776962987178259,0.08752036983039965,undersample,0.9214520980175175,,8.0,0.9324676436282083,,,,0.5006682296448235,0.5474439088003235,0.44323835368611486,0.4427860696517413,0.0,0.0,0.8829032602691047,0.1776962987178259,0.08,0.44400826794930837,0.42868591385391264,0.0,0.0,0.0,0.0,undersample,0.30510825776289396,0.2831892634944218,0.9214520980175175,0.5474439088003235,COMPLETE
