number,value,datetime_start,datetime_complete,duration,params_alpha,params_booster,params_colsample_bytree,params_gamma,params_grow_policy,params_lambda,params_learning_rate,params_max_delta_step,params_max_depth,params_min_child_weight,params_n_estimators,params_normalize_type,params_params_feature_fraction,params_params_labeled_ratio,params_params_missing_rate,params_params_resampling,params_params_sample_rows,params_params_scale_pos_weight,params_params_selftrain_max_iter,params_params_selftrain_threshold,params_rate_drop,params_sample_type,params_skip_drop,params_subsample,params_user_attrs_decision_threshold,user_attrs_acc_test,user_attrs_acc_val,user_attrs_f1_test,user_attrs_f1_val,user_attrs_feature_fraction,user_attrs_labeled_ratio,user_attrs_missing_rate,user_attrs_pr_auc_test,user_attrs_pr_auc_val,user_attrs_prec_test,user_attrs_prec_val,user_attrs_rec_test,user_attrs_rec_val,user_attrs_resampling_strategy,user_attrs_roc_auc_test,user_attrs_roc_auc_val,user_attrs_sample_rows,user_attrs_user_attrs_decision_threshold,state
810,0.7156549520766773,2025-11-26 21:41:03.449743,2025-11-26 21:41:34.248025,0 days 00:00:30.798282,4.972394599842706,dart,0.6104651446222488,4.500974208671208,lossguide,0.6115416191069452,0.00011054932775737154,3,7,42.169754578653574,500,forest,0.9067094957125251,0.0678722166918733,0.019801573887956683,none,0.6687053307500052,0.9042014611633322,5.0,0.7475538765985212,0.08212711937292975,uniform,0.0797452247728215,0.5476350342828565,0.03238802925743331,0.5567616463138851,0.5572139303482587,0.715281812899477,0.7156549520766773,0.9067094957125251,0.0678722166918733,0.02,0.5567616463138851,0.5572139303482587,0.5567616463138851,0.5572139303482587,1.0,1.0,none,0.5,0.5,0.6687053307500052,0.03238802925743331,COMPLETE
811,0.5188448360254527,2025-11-26 21:41:34.424987,2025-11-26 21:41:38.052495,0 days 00:00:03.627508,2.2550041118857767,gbtree,0.9954946677174745,0.46939841899493406,lossguide,0.13426576066168996,0.0012513693650002288,7,10,0.1515928919900436,700,,0.8570877813823431,0.18247409117025326,0.0853248991858819,oversample,0.6617628470277633,,6.0,0.8819036592895907,,,,0.5935281093862809,0.5690743811480388,0.5621890547263682,0.5554047942107644,0.5259549461312438,0.5188448360254527,0.8570877813823431,0.18247409117025326,0.08,0.6621743335945203,0.6562767382351659,0.6621454993834772,0.6535141800246609,0.43623070674248576,0.4301948051948052,oversample,0.6319439148526999,0.628931589350384,0.6617628470277633,0.5690743811480388,COMPLETE
812,0.7156549520766773,2025-11-26 21:41:38.229724,2025-11-26 21:41:39.136149,0 days 00:00:00.906425,0.07232940455385906,gbtree,0.5748929508515159,8.463203762967282,lossguide,0.27064666825849626,0.0005289670780931745,2,4,0.11583654060639272,800,,0.7443258414234344,0.4977710617814319,0.06810528214146419,oversample,0.9546845448149606,,10.0,0.7332352718726708,,,,0.6251276994176409,0.050337769561408285,0.5567616463138851,0.5572139303482587,0.715281812899477,0.7156549520766773,0.7443258414234344,0.4977710617814319,0.08,0.6599686307267951,0.6638921834032628,0.5567616463138851,0.5572139303482587,1.0,1.0,oversample,0.6211019745022298,0.6274068755554966,0.9546845448149606,0.050337769561408285,COMPLETE
813,0.7156549520766773,2025-11-26 21:41:39.316894,2025-11-26 21:41:42.373215,0 days 00:00:03.056321,0.7036669993549773,gbtree,0.5874966562842785,0.8846548895487536,lossguide,0.0004157177281720531,0.003840844030663833,3,8,1.1629771898230763,400,,0.8607334727754649,0.5953633612962365,0.08774154701016205,none,0.5473101148748891,1.4222048500237916,6.0,0.8779038485320775,,,,0.43773559229819525,0.3664984700587798,0.5567616463138851,0.5572139303482587,0.715281812899477,0.7156549520766773,0.8607334727754649,0.5953633612962365,0.08,0.5409707337348615,0.5445912850539223,0.5567616463138851,0.5572139303482587,1.0,1.0,none,0.48507186790231926,0.4857486104294072,0.5473101148748891,0.3664984700587798,COMPLETE
814,0.0,2025-11-26 21:41:42.592003,2025-11-26 21:41:43.661663,0 days 00:00:01.069660,0.002248795471854097,gbtree,0.3641693470794175,5.7304582934741655,depthwise,0.00016970500292182473,0.0008907674897800508,7,8,1.640359663034118,1000,,0.6084413712886221,0.6661006876717497,0.002943428857197561,oversample,0.9372189074134877,,8.0,0.6698915818399583,,,,0.30292269782789805,0.747886634936197,0.44323835368611486,0.4427860696517413,0.0,0.0,0.6084413712886221,0.6661006876717497,0.0,0.4549252833199965,0.4530213627653846,0.0,0.0,0.0,0.0,oversample,0.33101800427725925,0.3301560862528687,0.9372189074134877,0.747886634936197,COMPLETE
815,0.7156549520766773,2025-11-26 21:41:43.841320,2025-11-26 21:43:38.849403,0 days 00:01:55.008083,0.3639866532401724,dart,0.8386644108361476,3.4204204365682553,lossguide,0.02172280869991041,0.00031868394779767113,3,12,4.908742645587166,1000,forest,0.6348984846862181,0.1517060499915436,0.0672445094018517,none,0.9942024323092199,2.4120706168149124,5.0,0.8548481578918528,0.40546537444727077,uniform,0.6137191075057679,0.3101169036808644,0.44155851102234767,0.5567616463138851,0.5572139303482587,0.715281812899477,0.7156549520766773,0.6348984846862181,0.1517060499915436,0.08,0.3942230831511516,0.39377220543634367,0.5567616463138851,0.5572139303482587,1.0,1.0,none,0.20635952187536266,0.203658318188451,0.9942024323092199,0.44155851102234767,COMPLETE
816,0.7156549520766773,2025-11-26 21:43:39.024961,2025-11-26 21:43:39.764022,0 days 00:00:00.739061,0.16212818299042753,gbtree,0.3337850077273067,5.342362661640479,depthwise,0.0322454558384309,0.29539950310047824,3,4,9.988486200194629,500,,0.7867875710327815,0.1724778133054181,0.015179602910355324,none,0.9678883453072658,0.5001451499533929,8.0,0.6828259517821577,,,,0.7786123507945668,0.21122167883642073,0.5567616463138851,0.5572139303482587,0.715281812899477,0.7156549520766773,0.7867875710327815,0.1724778133054181,0.02,0.5567616463138851,0.5572139303482587,0.5567616463138851,0.5572139303482587,1.0,1.0,none,0.5,0.5,0.9678883453072658,0.21122167883642073,COMPLETE
817,0.6120426829268293,2025-11-26 21:43:39.939409,2025-11-26 21:43:42.556821,0 days 00:00:02.617412,0.16858938473865762,gbtree,0.8047292717550453,0.5879119877117327,lossguide,0.035860719926931094,0.13401293706637593,1,5,0.17379935323669332,200,,0.9818560488749903,0.6336508276666704,0.0705646762889633,oversample,0.6983932833353267,,6.0,0.7286272501957396,,,,0.20397717776811147,0.4498818964783139,0.5223880597014925,0.5395748530076888,0.5978674790555979,0.6120426829268293,0.9818560488749903,0.6336508276666704,0.08,0.5518082757220409,0.5502120803346222,0.5627240143369175,0.576867816091954,0.6376929325751421,0.6517857142857143,oversample,0.49651519421741075,0.5019740856691827,0.6983932833353267,0.4498818964783139,COMPLETE
818,0.6375,2025-11-26 21:43:42.749588,2025-11-26 21:45:14.605020,0 days 00:01:31.855432,0.007814126707774432,dart,0.8798155529676847,4.186451415991148,lossguide,0.004077504620317703,0.3867742261149383,3,3,3.736766613206822,500,forest,0.9591181188401762,0.8369392644545662,0.0889832976891537,undersample,0.5996252295985992,,5.0,0.648983644966925,0.44229037714433267,uniform,0.7913950042582729,0.2662786598478071,0.3777654549931266,0.4929895974672094,0.5015829941203076,0.631855500821018,0.6375,0.9591181188401762,0.8369392644545662,0.08,0.5021618332564461,0.4902087087897369,0.5303197353914002,0.5359513274336283,0.7814784727863525,0.786525974025974,undersample,0.418554684262007,0.4086871376835626,0.5996252295985992,0.3777654549931266,COMPLETE
819,0.7156549520766773,2025-11-26 21:45:14.773630,2025-11-26 21:45:15.672313,0 days 00:00:00.898683,0.6580769180716296,gbtree,0.8700307013622726,5.660983998820845,lossguide,0.8470589949215452,0.02105854651285616,8,9,22.273312255610893,700,,0.9404126587574801,0.5254538412485348,0.09221075879223747,none,0.9180982742792093,1.9158616278755034,11.0,0.8420804277699163,,,,0.5405555277030054,0.3874472812296815,0.5567616463138851,0.5572139303482587,0.715281812899477,0.7156549520766773,0.9404126587574801,0.5254538412485348,0.1,0.4409745177701265,0.42771213188966345,0.5567616463138851,0.5572139303482587,1.0,1.0,none,0.338931762794476,0.30338322300783993,0.9180982742792093,0.3874472812296815,COMPLETE
820,0.5636645962732919,2025-11-26 21:45:15.844996,2025-11-26 21:45:18.548491,0 days 00:00:02.703495,0.15332369684789382,gbtree,0.5020655646537274,3.7966595256168603,depthwise,0.049026092883708364,0.3915538383142338,2,6,1.0595261893192496,800,,0.7873301256076546,0.5978137248788429,0.01942270433981036,none,0.9526080097439049,1.228015251709495,8.0,0.777933810848475,,,,0.7057051080599652,0.5953017951931956,0.4920850293984622,0.49163274536408863,0.5638834951456311,0.5636645962732919,0.7873301256076546,0.5978137248788429,0.02,0.5151415624824561,0.5088598415641097,0.5401785714285714,0.5401785714285714,0.5897644191714053,0.5892857142857143,none,0.4612791989257117,0.45543715094915305,0.9526080097439049,0.5953017951931956,COMPLETE
821,0.7156549520766773,2025-11-26 21:45:18.727069,2025-11-26 21:45:19.319573,0 days 00:00:00.592504,0.04356976106481464,gbtree,0.9226250652606288,9.095454167669539,depthwise,0.0014153374883237753,0.032471268389510165,8,3,0.12279571826578708,300,,0.6409167910194943,0.5978823111563504,0.00010109724948361917,oversample,0.8046303225065781,,10.0,0.9100030872362596,,,,0.40108505568742625,0.3787010143402949,0.5567616463138851,0.5572139303482587,0.715281812899477,0.7156549520766773,0.6409167910194943,0.5978823111563504,0.0,0.5282605667077921,0.5329827969552641,0.5567616463138851,0.5572139303482587,1.0,1.0,oversample,0.4646077521179065,0.46720911876683074,0.8046303225065781,0.3787010143402949,COMPLETE
822,0.0,2025-11-26 21:45:19.496350,2025-11-26 21:45:20.279651,0 days 00:00:00.783301,4.1754462270268,gbtree,0.3834799850601826,3.9771662320677734,depthwise,0.0007323001978046751,0.21471923172612115,2,3,4.322454579486653,600,,0.7870909673876308,0.2133288301919826,0.0019189168332069118,oversample,0.9659577222617037,,7.0,0.7514739423779379,,,,0.8352346611127899,0.6684834013215132,0.44323835368611486,0.4427860696517413,0.0,0.0,0.7870909673876308,0.2133288301919826,0.0,0.47622197746042816,0.4686374246571855,0.0,0.0,0.0,0.0,oversample,0.38877551020408163,0.37742221389437935,0.9659577222617037,0.6684834013215132,COMPLETE
823,0.0,2025-11-26 21:45:20.456405,2025-11-26 21:45:21.408408,0 days 00:00:00.952003,0.16185586255192208,gbtree,0.34736436937202686,6.611429588945036,lossguide,0.00025279057853063277,0.008365377428730348,5,12,0.6146034220404396,900,,0.8567096685497049,0.195353112060465,0.03441305067313259,oversample,0.6317947589762455,,5.0,0.6126266635206472,,,,0.5144902090668816,0.8007201023040282,0.44323835368611486,0.4427860696517413,0.0,0.0,0.8567096685497049,0.195353112060465,0.02,0.705544335500067,0.6958996840265423,0.0,0.0,0.0,0.0,oversample,0.6763880369369519,0.6651329709616226,0.6317947589762455,0.8007201023040282,COMPLETE
824,0.7156549520766773,2025-11-26 21:45:21.588104,2025-11-26 21:45:22.463439,0 days 00:00:00.875335,0.012567537565544896,gbtree,0.8515794450641726,2.189588791894207,lossguide,37.36305706996054,0.0615821149177089,7,12,2.487318456140537,700,,0.7672636450614516,0.28714654391505734,0.09181589431520598,oversample,0.7508309905990153,,7.0,0.7352188086073096,,,,0.832071099441121,0.07178631826717885,0.5567616463138851,0.5572139303482587,0.715281812899477,0.7156549520766773,0.7672636450614516,0.28714654391505734,0.1,0.6004737237861153,0.5930715758301084,0.5567616463138851,0.5572139303482587,1.0,1.0,oversample,0.526899484407898,0.5250756967751349,0.7508309905990153,0.07178631826717885,COMPLETE
825,0.7156549520766773,2025-11-26 21:45:22.645168,2025-11-26 21:46:54.904260,0 days 00:01:32.259092,0.0018229996865652793,dart,0.9309971384067184,3.949763820807356,lossguide,0.0011225709433550365,0.0007531682560866237,3,9,1.3568501792919734,900,tree,0.6008315747776355,0.050670727242761615,0.09477670234208961,none,0.9651192062115713,0.8169091964483168,5.0,0.8141999783055873,0.21455300606232766,weighted,0.19838780055393404,0.39972374964208396,0.41121270201316207,0.5567616463138851,0.5572139303482587,0.715281812899477,0.7156549520766773,0.6008315747776355,0.050670727242761615,0.1,0.6318386728240083,0.6312900545639334,0.5567616463138851,0.5572139303482587,1.0,1.0,none,0.6199957724763342,0.6229927503548546,0.9651192062115713,0.41121270201316207,COMPLETE
826,0.7156549520766773,2025-11-26 21:46:55.082489,2025-11-26 21:47:07.719978,0 days 00:00:12.637489,0.21993862639713768,gbtree,0.7879180374336294,0.030269665963755132,lossguide,0.0331015217356154,0.009349097988758262,4,8,0.16062029290859825,300,,0.9089394982274915,0.6034783991326584,0.0960193085010275,oversample,0.8909414179385912,,6.0,0.7119427615003829,,,,0.31788230891999014,0.1041045421039064,0.5567616463138851,0.5572139303482587,0.715281812899477,0.7156549520766773,0.9089394982274915,0.6034783991326584,0.1,0.5416075151733479,0.5440410760264046,0.5567616463138851,0.5572139303482587,1.0,1.0,oversample,0.48879872013793335,0.48874663385643974,0.8909414179385912,0.1041045421039064,COMPLETE
827,0.7156549520766773,2025-11-26 21:47:07.892791,2025-11-26 21:47:24.671866,0 days 00:00:16.779075,64.09789401988861,dart,0.5870646338080119,2.0968507734761053,depthwise,51.63114539338935,0.002476455174833031,6,7,1.1702015405648112,400,forest,0.5996468149512544,0.446505433799001,0.06349677769720546,none,0.6799018919466409,3.3871350423823725,12.0,0.7725725999600851,0.4389352424166494,weighted,0.48861673865302135,0.2616379451841677,0.07942451901067227,0.5567616463138851,0.5572139303482587,0.715281812899477,0.7156549520766773,0.5996468149512544,0.446505433799001,0.05,0.5567616463138851,0.5572139303482587,0.5567616463138851,0.5572139303482587,1.0,1.0,none,0.5,0.5,0.6799018919466409,0.07942451901067227,COMPLETE
828,0.7156549520766773,2025-11-26 21:47:24.849060,2025-11-26 21:49:06.004355,0 days 00:01:41.155295,24.95977063991628,dart,0.5916412326936984,5.206313418690126,lossguide,0.14618116880214804,0.0003056951720596491,0,8,17.436412034162252,900,tree,0.717034930270647,0.33595679814499196,0.03826892541715268,oversample,0.740367772400128,,5.0,0.7878583985200985,0.12550296243663578,uniform,0.6408120493530853,0.7192339988044807,0.1814545433089359,0.5567616463138851,0.5572139303482587,0.715281812899477,0.7156549520766773,0.717034930270647,0.33595679814499196,0.05,0.5567616463138851,0.5572139303482587,0.5567616463138851,0.5572139303482587,1.0,1.0,oversample,0.5,0.5,0.740367772400128,0.1814545433089359,COMPLETE
829,0.7156549520766773,2025-11-26 21:49:06.195538,2025-11-26 21:50:15.760717,0 days 00:01:09.565179,0.046506100869051985,dart,0.9078974842519961,3.6991987720849684,lossguide,75.04884946988429,0.0010627855930136164,10,8,16.345065538851003,800,forest,0.7799667897395698,0.36012581503543695,0.07905160240662612,undersample,0.9817664032871747,,10.0,0.891868582369063,0.21124256223198762,uniform,0.1585884118951562,0.8088448444690208,0.3448113779454004,0.5567616463138851,0.5572139303482587,0.715281812899477,0.7156549520766773,0.7799667897395698,0.36012581503543695,0.08,0.6674455584228297,0.6537955937006846,0.5567616463138851,0.5572139303482587,1.0,1.0,undersample,0.6210406339627645,0.6031814202141066,0.9817664032871747,0.3448113779454004,COMPLETE
830,0.7156549520766773,2025-11-26 21:50:15.939456,2025-11-26 21:50:28.450011,0 days 00:00:12.510555,3.000369355195072,gbtree,0.7244815346410091,0.4130671292179492,lossguide,22.74285902747795,0.006200991625370037,6,12,1.0119014537410496,700,,0.8999896427503672,0.534029588307907,0.08870264561041624,oversample,0.6569038977167474,,8.0,0.6565917672083625,,,,0.7021333905935848,0.21017838318444018,0.5567616463138851,0.5572139303482587,0.715281812899477,0.7156549520766773,0.8999896427503672,0.534029588307907,0.08,0.533456173060739,0.5194435605235754,0.5567616463138851,0.5572139303482587,1.0,1.0,oversample,0.43882027221936704,0.41467986814003155,0.6569038977167474,0.21017838318444018,COMPLETE
831,0.7156549520766773,2025-11-26 21:50:28.627769,2025-11-26 21:50:56.864103,0 days 00:00:28.236334,0.03781345870229887,dart,0.8592343894126144,5.664053745130749,depthwise,0.0023071712777094308,0.06285335921390482,5,3,0.1402325592342216,500,tree,0.7826912745976002,0.8230090269143411,0.04515946882995846,oversample,0.6235705438058875,,11.0,0.7923497008616937,0.2737880382517455,weighted,0.4090994868772419,0.3316769446198316,0.26786366254404415,0.5567616463138851,0.5572139303482587,0.715281812899477,0.7156549520766773,0.7826912745976002,0.8230090269143411,0.05,0.6134565138328625,0.6116503662552897,0.5567616463138851,0.5572139303482587,1.0,1.0,oversample,0.5142363931762794,0.5193300379395884,0.6235705438058875,0.26786366254404415,COMPLETE
832,0.7156549520766773,2025-11-26 21:50:57.050401,2025-11-26 21:52:40.420018,0 days 00:01:43.369617,0.0011693040386730697,dart,0.7091215132865019,3.0889841706201735,depthwise,0.2271059476650651,0.004577969584187996,2,10,10.783467233491972,900,tree,0.7265498462528441,0.05064354116450623,0.026243302721541205,none,0.5226855351475495,1.5797267308639216,6.0,0.7085552124198383,0.07013258262862408,weighted,0.15676295570743087,0.8314731639169138,0.1399291900028564,0.5567616463138851,0.5572139303482587,0.715281812899477,0.7156549520766773,0.7265498462528441,0.05064354116450623,0.02,0.6108677286701147,0.5996084369795462,0.5567616463138851,0.5572139303482587,1.0,1.0,none,0.5215093917339478,0.5196426084130374,0.5226855351475495,0.1399291900028564,COMPLETE
833,0.7156549520766773,2025-11-26 21:52:40.599760,2025-11-26 21:54:39.500600,0 days 00:01:58.900840,0.11556740486067046,dart,0.9376909845738459,5.428195292402572,depthwise,10.708314350669522,0.0003270183354561702,5,8,12.235642382059584,1000,forest,0.9537990826475934,0.5887386587416461,0.09354350508215352,undersample,0.8967718232271158,,12.0,0.9332989418557509,0.24958716152367,weighted,0.6527636525888706,0.8181086819044829,0.1627018474046622,0.5567616463138851,0.5572139303482587,0.715281812899477,0.7156549520766773,0.9537990826475934,0.5887386587416461,0.1,0.49535457820622486,0.4940023232551153,0.5567616463138851,0.5572139303482587,1.0,1.0,undersample,0.42913717070906343,0.4221069405568895,0.8967718232271158,0.1627018474046622,COMPLETE
834,0.7156549520766773,2025-11-26 21:54:39.675091,2025-11-26 21:54:50.377191,0 days 00:00:10.702100,97.74740028554078,dart,0.3447175766867812,7.011035707681024,lossguide,26.600397797853585,0.0003265265450216054,0,6,7.553044228411074,300,forest,0.6955921171729511,0.3053047301970027,0.07453902300020288,oversample,0.6736578415951319,,5.0,0.7961589262486395,0.28292637704427204,uniform,0.4425929870142448,0.6550332104551657,0.34164057938042314,0.5567616463138851,0.5572139303482587,0.715281812899477,0.7156549520766773,0.6955921171729511,0.3053047301970027,0.08,0.5567616463138851,0.5572139303482587,0.5567616463138851,0.5572139303482587,1.0,1.0,oversample,0.5,0.5,0.6736578415951319,0.34164057938042314,COMPLETE
835,0.7156549520766773,2025-11-26 21:54:50.543247,2025-11-26 21:55:28.807969,0 days 00:00:38.264722,30.5657671509637,dart,0.4046892872546208,7.637394563859994,depthwise,72.17419128875807,0.009177949296261523,1,6,5.380907034524716,600,tree,0.6460747437075746,0.6721349601832005,0.09341560030394089,none,0.8936761853648773,2.1716031731703067,11.0,0.7873558807811104,0.2907428431424051,weighted,0.15968505929455562,0.44038097589584113,0.2062739271075999,0.5567616463138851,0.5572139303482587,0.715281812899477,0.7156549520766773,0.6460747437075746,0.6721349601832005,0.1,0.5264562177080571,0.5357122938746073,0.5567616463138851,0.5572139303482587,1.0,1.0,none,0.42882507999137914,0.4520875893769153,0.8936761853648773,0.2062739271075999,COMPLETE
836,0.7149084568439407,2025-11-26 21:55:28.979756,2025-11-26 21:56:22.249227,0 days 00:00:53.269471,0.013036345590437967,dart,0.9629814633817341,2.5745098435315774,depthwise,0.0013304383106718797,0.07319186289289713,4,6,0.9469684242753342,500,tree,0.8089421979427709,0.9352608343573299,0.08415646530208001,oversample,0.8166771797668007,,6.0,0.8192693703667878,0.45450899344264656,weighted,0.28344991618832494,0.2445961099538474,0.2529921416150341,0.5572139303482587,0.5563093622795116,0.7153242221576039,0.7149084568439407,0.8089421979427709,0.9352608343573299,0.08,0.538740763643355,0.5508797232717503,0.5570652173913043,0.5568130375735627,0.9991876523151909,0.9983766233766234,oversample,0.5023645120111407,0.5246383468421262,0.8166771797668007,0.2529921416150341,COMPLETE
837,0.7156549520766773,2025-11-26 21:56:22.429084,2025-11-26 21:57:09.203561,0 days 00:00:46.774477,0.02225101747278848,dart,0.27589531409148577,9.960369851206387,lossguide,0.35450705179568615,0.0022209164265710054,1,3,0.3512184582902033,600,forest,0.565739169769283,0.12845910299402039,0.08541483312422292,oversample,0.8948450435178116,,11.0,0.607578038294012,0.05410443863525076,weighted,0.21057555158157665,0.664169598706251,0.0979185561194769,0.5567616463138851,0.5572139303482587,0.715281812899477,0.7156549520766773,0.565739169769283,0.12845910299402039,0.08,0.6606152967978742,0.6625521545618227,0.5567616463138851,0.5572139303482587,1.0,1.0,oversample,0.660544355841443,0.6653162019288168,0.8948450435178116,0.0979185561194769,COMPLETE
838,0.7156549520766773,2025-11-26 21:57:09.379627,2025-11-26 21:58:46.527208,0 days 00:01:37.147581,0.013919473373520234,dart,0.9050726353287031,4.173032948635475,lossguide,0.00034481542240252105,0.0017378371423175155,5,12,1.1943317100852195,1000,forest,0.506579881354098,0.20637937148365576,0.07629364836825525,none,0.9702277487620734,0.6414494926953281,5.0,0.7418911936517067,0.3587098311817926,weighted,0.22106043401284975,0.5548599782098669,0.22948110404815808,0.5567616463138851,0.5572139303482587,0.715281812899477,0.7156549520766773,0.506579881354098,0.20637937148365576,0.08,0.4909558998944108,0.4848298605972861,0.5567616463138851,0.5572139303482587,1.0,1.0,none,0.426452693181253,0.4200619668890864,0.9702277487620734,0.22948110404815808,COMPLETE
