number,value,datetime_start,datetime_complete,duration,params_alpha,params_booster,params_colsample_bytree,params_gamma,params_grow_policy,params_lambda,params_learning_rate,params_max_delta_step,params_max_depth,params_min_child_weight,params_n_estimators,params_normalize_type,params_params_feature_fraction,params_params_labeled_ratio,params_params_missing_rate,params_params_resampling,params_params_sample_rows,params_params_scale_pos_weight,params_params_selftrain_max_iter,params_params_selftrain_threshold,params_rate_drop,params_sample_type,params_skip_drop,params_subsample,params_user_attrs_decision_threshold,user_attrs_acc_test,user_attrs_acc_val,user_attrs_f1_test,user_attrs_f1_val,user_attrs_feature_fraction,user_attrs_labeled_ratio,user_attrs_missing_rate,user_attrs_pr_auc_test,user_attrs_pr_auc_val,user_attrs_prec_test,user_attrs_prec_val,user_attrs_rec_test,user_attrs_rec_val,user_attrs_resampling_strategy,user_attrs_roc_auc_test,user_attrs_roc_auc_val,user_attrs_sample_rows,user_attrs_user_attrs_decision_threshold,state
1185,0.7156549520766773,2025-11-27 00:48:08.771711,2025-11-27 00:48:09.617102,0 days 00:00:00.845391,23.337471299848236,gbtree,0.4841394804103534,5.013762925458513,lossguide,0.8089646156646254,0.00014383640296773166,2,6,4.605928878721067,700,,0.9667628323717166,0.5334015790877209,0.07317960139369722,none,0.7357386470006807,0.7290099642616122,8.0,0.7925741033911156,,,,0.6053506119146026,0.27995525320746323,0.5567616463138851,0.5572139303482587,0.715281812899477,0.7156549520766773,0.9667628323717166,0.5334015790877209,0.08,0.5994831989867995,0.5949029448917228,0.5567616463138851,0.5572139303482587,1.0,1.0,none,0.5148004774614964,0.5187086279399864,0.7357386470006807,0.27995525320746323,COMPLETE
1186,0.5605947955390335,2025-11-27 00:48:09.789716,2025-11-27 00:48:12.114800,0 days 00:00:02.325084,0.04115675307904233,gbtree,0.8921633782256896,2.3406337610742884,lossguide,0.19448222624416597,0.2826875590180068,6,11,13.158383695282495,500,,0.9064169102335523,0.4540054216423861,0.09769401328400232,undersample,0.6183195868779728,,8.0,0.6735755901328501,,,,0.6238363653961869,0.2591767265305342,0.4730890999547716,0.4654002713704206,0.5651362448674878,0.5605947955390335,0.9064169102335523,0.4540054216423861,0.1,0.49748282272097977,0.5003008609403852,0.5227900552486188,0.5171467764060357,0.6149471974004874,0.612012987012987,undersample,0.42255881231452774,0.4175958107265564,0.6183195868779728,0.2591767265305342,COMPLETE
1187,0.7101179391682185,2025-11-27 00:48:12.288306,2025-11-27 00:48:14.576439,0 days 00:00:02.288133,0.0034695514154789776,gbtree,0.8458591652304502,2.380844955089092,depthwise,8.34855706660086,0.15985624984305732,9,11,4.239440711006842,600,,0.9778784919237514,0.399685988798926,0.051765974478328064,oversample,0.5232626478043592,,7.0,0.6832615056745487,,,,0.5442340586135437,0.25660580868036914,0.5739484396200815,0.5775667118950701,0.708359133126935,0.7101179391682185,0.9778784919237514,0.399685988798926,0.05,0.5834412035073306,0.5969022619781612,0.5722861430715358,0.5748743718592965,0.9293257514216084,0.9285714285714286,oversample,0.5610827434141813,0.569242236313227,0.5232626478043592,0.25660580868036914,COMPLETE
1188,0.7156549520766773,2025-11-27 00:48:14.748744,2025-11-27 00:48:15.384834,0 days 00:00:00.636090,0.0012657211117217365,gbtree,0.6323754166992719,4.409450895690814,lossguide,0.02782402193514778,0.0017752736818665061,9,10,0.14647615493756,200,,0.938882260370018,0.6596833543827982,0.08221369552391457,undersample,0.5372668739902772,,12.0,0.6071320989886837,,,,0.6595611918838061,0.1811904257278104,0.5567616463138851,0.5572139303482587,0.715281812899477,0.7156549520766773,0.938882260370018,0.6596833543827982,0.08,0.5036545885386776,0.5146046542507261,0.5567616463138851,0.5572139303482587,1.0,1.0,undersample,0.4163588587343954,0.43212080309884193,0.5372668739902772,0.1811904257278104,COMPLETE
1189,0.7156549520766773,2025-11-27 00:48:15.556862,2025-11-27 00:48:36.208927,0 days 00:00:20.652065,13.774600071842375,dart,0.5310493426618332,0.8018390869149421,lossguide,0.06141558469740014,0.03657197768205598,0,8,0.10026740404370123,400,forest,0.8715137419293764,0.6437738790641188,0.07156522529099879,undersample,0.8152479164242554,,8.0,0.6048393133367109,0.04506543582885267,weighted,0.10247044685051293,0.47031913746839116,0.16091469964271993,0.5567616463138851,0.5572139303482587,0.715281812899477,0.7156549520766773,0.8715137419293764,0.6437738790641188,0.08,0.4272703813420227,0.4219448999390353,0.5567616463138851,0.5572139303482587,1.0,1.0,undersample,0.292811137452544,0.28177316172081235,0.8152479164242554,0.16091469964271993,COMPLETE
1190,0.640133779264214,2025-11-27 00:48:36.380949,2025-11-27 00:48:38.988682,0 days 00:00:02.607733,0.023580434622617774,gbtree,0.9046647595886335,3.1143050354217103,lossguide,0.01237661355517851,0.0957681342445445,8,7,4.177490201081495,700,,0.8090436412378599,0.37036454325328116,0.07202946360653743,oversample,0.5023562414571058,,7.0,0.7000115106600754,,,,0.5785126356438777,0.36794919090761613,0.5264586160108549,0.5133423790140208,0.6461642446772559,0.640133779264214,0.8090436412378599,0.37036454325328116,0.08,0.5162702828341426,0.515684911308774,0.5532407407407407,0.5443686006825939,0.776604386677498,0.7767857142857143,oversample,0.4525854208458363,0.4372981142963268,0.5023562414571058,0.36794919090761613,COMPLETE
1191,0.7156549520766773,2025-11-27 00:48:39.164253,2025-11-27 00:48:39.952831,0 days 00:00:00.788578,3.8380304865522348,gbtree,0.3310193399982922,6.491374133705456,depthwise,0.0036238755118080746,0.13469537498696768,3,7,1.073159380228052,600,,0.59613365627437,0.4921249988614398,0.010685844515043034,none,0.9709396371841595,4.973989071390474,7.0,0.7582356051169603,,,,0.6611509429154135,0.6765809032609218,0.5567616463138851,0.5572139303482587,0.715281812899477,0.7156549520766773,0.59613365627437,0.4921249988614398,0.02,0.5422266119285504,0.5618438733565232,0.5567616463138851,0.5572139303482587,1.0,1.0,none,0.4969959714186243,0.5108616166775002,0.9709396371841595,0.6765809032609218,COMPLETE
1192,0.7004270896888346,2025-11-27 00:48:40.128206,2025-11-27 00:48:42.638727,0 days 00:00:02.510521,0.00024426711873100105,gbtree,0.39537909849822905,1.5816351012154917,lossguide,8.612758829715942,0.06541887855822508,8,11,0.12317161247621797,500,,0.8842535176234514,0.48329217419274234,0.073262291695736,undersample,0.5751527157348354,,9.0,0.6703615341945249,,,,0.7585131681616222,0.28589881298949427,0.5621890547263682,0.555857078245138,0.7023370233702337,0.7004270896888346,0.8842535176234514,0.48329217419274234,0.08,0.5766065947977075,0.5822109461036733,0.5650667986145472,0.5610948191593352,0.9277010560519903,0.9318181818181818,undersample,0.5639922744077323,0.5672018226921189,0.5751527157348354,0.28589881298949427,COMPLETE
1193,0.7156549520766773,2025-11-27 00:48:42.812069,2025-11-27 00:48:43.625280,0 days 00:00:00.813211,0.005151421868232206,gbtree,0.3309336004686294,7.615583990127803,lossguide,0.0009029300398007125,0.000978941370753123,4,10,0.5795022043439619,700,,0.6237454748237365,0.06528445713388595,0.008213533795168239,oversample,0.777417012203517,,7.0,0.6488160366051624,,,,0.694382985564026,0.28155356545004373,0.5567616463138851,0.5572139303482587,0.715281812899477,0.7156549520766773,0.6237454748237365,0.06528445713388595,0.0,0.5311831748611261,0.514966053743583,0.5567616463138851,0.5572139303482587,1.0,1.0,oversample,0.4469064473880535,0.41086186540731995,0.777417012203517,0.28155356545004373,COMPLETE
1194,0.7156549520766773,2025-11-27 00:48:43.797419,2025-11-27 00:48:54.409060,0 days 00:00:10.611641,0.026149500212374173,dart,0.6839238083291419,5.263017876471809,depthwise,0.06797289129548868,0.006753293612575903,2,4,0.2880306491179544,300,forest,0.9336512116991743,0.8092779985954113,0.08224770319706079,oversample,0.7385355247759914,,7.0,0.6980576613409331,0.3271587153715625,uniform,0.652751760985266,0.4135254946751533,0.3694653972280263,0.5567616463138851,0.5572139303482587,0.715281812899477,0.7156549520766773,0.9336512116991743,0.8092779985954113,0.08,0.4138496219828435,0.409230687599407,0.5567616463138851,0.5572139303482587,1.0,1.0,oversample,0.25397677348762415,0.24088032115994323,0.7385355247759914,0.3694653972280263,COMPLETE
1195,0.0,2025-11-27 00:48:54.585747,2025-11-27 00:49:05.808675,0 days 00:00:11.222928,1.0700152199846071,dart,0.654826372436294,8.845550017082836,lossguide,0.007491402044919771,0.011247785585349992,9,6,0.134035787916609,300,forest,0.8091011181449135,0.6113533635582455,0.052917164571547964,oversample,0.7713412691106004,,9.0,0.9070573684987072,0.061623663381051394,uniform,0.3382381760588436,0.6182141769093797,0.7013614428736392,0.44323835368611486,0.4427860696517413,0.0,0.0,0.8091011181449135,0.6113533635582455,0.05,0.4956255461043701,0.4995922298348855,0.0,0.0,0.0,0.0,oversample,0.3988245826356538,0.3994820616054018,0.7713412691106004,0.7013614428736392,COMPLETE
1196,0.7156549520766773,2025-11-27 00:49:05.979375,2025-11-27 00:49:42.040566,0 days 00:00:36.061191,17.502946290719354,dart,0.6485905852512162,6.136548890413469,lossguide,2.977577660153738,0.00012988451894839788,1,12,1.261599538727361,600,tree,0.7391173616772541,0.41377859956438234,0.05805344923344198,none,0.7066279194027741,0.9629223540894043,7.0,0.7726512926572597,0.3663602013462206,weighted,0.4222111541925794,0.6494768702529119,0.04854693313933359,0.5567616463138851,0.5572139303482587,0.715281812899477,0.7156549520766773,0.7391173616772541,0.41377859956438234,0.05,0.5567616463138851,0.5572139303482587,0.5567616463138851,0.5572139303482587,1.0,1.0,none,0.5,0.5,0.7066279194027741,0.04854693313933359,COMPLETE
1197,0.0,2025-11-27 00:49:42.210205,2025-11-27 00:49:43.124097,0 days 00:00:00.913892,0.00011291170299195159,gbtree,0.21084011317952836,9.990828422630837,lossguide,0.00011944003959538838,0.0040942591403661755,10,10,0.5334309268711925,800,,0.7502950313439276,0.23011110821933137,0.032442272345773016,none,0.7987367699212643,0.5016799562117047,5.0,0.6020661435377107,,,,0.7618668808815852,0.7380132615349352,0.44323835368611486,0.4427860696517413,0.0,0.0,0.7502950313439276,0.23011110821933137,0.02,0.5567616463138851,0.5572139303482587,0.0,0.0,0.0,0.0,none,0.5,0.5,0.7987367699212643,0.7380132615349352,COMPLETE
1198,0.7156549520766773,2025-11-27 00:49:43.299112,2025-11-27 00:50:13.587561,0 days 00:00:30.288449,0.33368932968482473,dart,0.5100541499287912,6.71821038623869,lossguide,0.02873238648482421,0.00010133066254038407,3,7,5.919008607129582,500,tree,0.8018384962182281,0.08702815012481904,0.06619045340459037,none,0.8351285139002125,0.7330341875316646,6.0,0.7031702635505274,0.2749949270579544,uniform,0.688765564440458,0.8484063981168883,0.25055192457928543,0.5567616463138851,0.5572139303482587,0.715281812899477,0.7156549520766773,0.8018384962182281,0.08702815012481904,0.08,0.46401132440338577,0.4779613990708335,0.5567616463138851,0.5572139303482587,1.0,1.0,none,0.3087928347618495,0.3294103113434063,0.8351285139002125,0.25055192457928543,COMPLETE
1199,0.7135294117647059,2025-11-27 00:50:13.764868,2025-11-27 00:50:36.843788,0 days 00:00:23.078920,0.0012636681237420872,dart,0.9528192473425433,2.5842396349381045,lossguide,0.00010696272181655859,0.10565711300877226,5,5,0.5361148097780924,200,forest,0.9508178420526456,0.72678413578402,0.08587687461868329,undersample,0.7140530221584016,,7.0,0.6763059236805318,0.1610268382162277,weighted,0.7740089349379137,0.30345684494766006,0.1888851714473332,0.550429669832655,0.5594753505201266,0.7069575471698113,0.7135294117647059,0.9508178420526456,0.72678413578402,0.08,0.5371481832806339,0.541981725530899,0.5548357242017584,0.5595018450184502,0.9740048740861088,0.984577922077922,undersample,0.44999709875826854,0.4753347074274041,0.7140530221584016,0.1888851714473332,COMPLETE
1200,0.7156549520766773,2025-11-27 00:50:37.026859,2025-11-27 00:50:41.940488,0 days 00:00:04.913629,4.023773251199242,gbtree,0.4667542575765501,0.20756651479082422,lossguide,0.00011484640108789489,0.00548752370845537,7,4,3.192576355689038,1000,,0.7274271904215132,0.8023390227104579,0.027234384707194505,oversample,0.8726220966135865,,7.0,0.6582038961865714,,,,0.32156099717974573,0.2596975470557169,0.5567616463138851,0.5572139303482587,0.715281812899477,0.7156549520766773,0.7274271904215132,0.8023390227104579,0.02,0.5392078940277176,0.5497215051511741,0.5567616463138851,0.5572139303482587,1.0,1.0,oversample,0.5094518310979956,0.5313150843028269,0.8726220966135865,0.2596975470557169,COMPLETE
1201,0.7137026239067056,2025-11-27 00:50:42.171708,2025-11-27 00:50:42.949775,0 days 00:00:00.778067,0.0008478244162717631,gbtree,0.9049040340071303,3.061001911824571,lossguide,0.05761381397089145,0.038921094106965974,8,10,45.16682667132078,400,,0.8336347417674465,0.5230190162938647,0.09602594905708524,undersample,0.815769917935837,,11.0,0.9001882154559457,,,,0.7534235063791382,0.4097770810810226,0.555857078245138,0.555857078245138,0.7137026239067056,0.7137026239067056,0.8336347417674465,0.5230190162938647,0.1,0.4859710224402927,0.476400733594949,0.5566166439290586,0.556869881710646,0.9943135662063363,0.9935064935064936,undersample,0.4320989240537808,0.4144062653383389,0.815769917935837,0.4097770810810226,COMPLETE
1202,0.7156549520766773,2025-11-27 00:50:43.130063,2025-11-27 00:51:40.272313,0 days 00:00:57.142250,10.837305144689633,dart,0.4777371804749374,9.635718716070157,lossguide,0.8688318506181294,0.0001324394130337691,1,10,4.497148694810398,700,forest,0.73348631723076,0.24921992468419135,0.057137264729932996,none,0.9368360603428046,1.0140801868906155,5.0,0.7873758271562472,0.2278297913810504,weighted,0.5230744715352237,0.7239753484880462,0.29504831333164216,0.5567616463138851,0.5572139303482587,0.715281812899477,0.7156549520766773,0.73348631723076,0.24921992468419135,0.05,0.48135817950748805,0.4829720859224978,0.5567616463138851,0.5572139303482587,1.0,1.0,none,0.29753974701172103,0.30938341535890057,0.9368360603428046,0.29504831333164216,COMPLETE
1203,0.7156549520766773,2025-11-27 00:51:40.445814,2025-11-27 00:52:20.149027,0 days 00:00:39.703213,53.00064479336151,dart,0.9423861110093069,3.5780371961364805,lossguide,1.3283580728494455,0.0010378138918893595,10,10,14.609009246262492,600,tree,0.7425630602334128,0.28331872163567706,0.0829677199375601,undersample,0.9586150487104921,,9.0,0.9221191528427978,0.29669423931931455,weighted,0.4464233290523211,0.5898850913261537,0.415832170878824,0.5567616463138851,0.5572139303482587,0.715281812899477,0.7156549520766773,0.7425630602334128,0.28331872163567706,0.08,0.5567616463138851,0.5572139303482587,0.5567616463138851,0.5572139303482587,1.0,1.0,undersample,0.5,0.5,0.9586150487104921,0.415832170878824,COMPLETE
1204,0.0,2025-11-27 00:52:20.331179,2025-11-27 00:52:21.688297,0 days 00:00:01.357118,22.591821963642904,gbtree,0.8205731787482523,0.7900362729037632,lossguide,0.009242009921704717,0.00024356694199542146,10,10,0.5192525205124446,800,,0.8609031546611395,0.6794575238670479,0.08225147851481643,oversample,0.9553540335768592,,7.0,0.6179271779933886,,,,0.6184574644859476,0.5696562110339594,0.44323835368611486,0.4427860696517413,0.0,0.0,0.8609031546611395,0.6794575238670479,0.08,0.4988199425425828,0.4940025798496702,0.0,0.0,0.0,0.0,oversample,0.4432745072033688,0.4281058892588514,0.9553540335768592,0.5696562110339594,COMPLETE
1205,0.7132659131469363,2025-11-27 00:52:21.872092,2025-11-27 00:53:09.124485,0 days 00:00:47.252393,0.6890918170711416,dart,0.925507017280933,2.305757173956104,lossguide,0.1331299805412657,0.03169865806067964,9,12,23.324187155239755,600,tree,0.9703010918573004,0.4410730118280686,0.07704031580529859,oversample,0.773025154218408,,10.0,0.9225506277938647,0.17264091947035884,weighted,0.7579871887690719,0.4817702993133064,0.4460101091108309,0.5649027589326097,0.5639981908638625,0.714540059347181,0.7132659131469363,0.9703010918573004,0.4410730118280686,0.08,0.5108561564919281,0.516744309480643,0.562879850397382,0.5629107981220657,0.9780666125101544,0.9732142857142857,oversample,0.47156700210547253,0.48254372670230683,0.773025154218408,0.4460101091108309,COMPLETE
1206,0.7156549520766773,2025-11-27 00:53:09.306333,2025-11-27 00:53:10.536612,0 days 00:00:01.230279,0.011847773462517119,gbtree,0.8938382565327663,2.431018086217932,lossguide,0.3661970015902364,0.0019698553779612608,10,12,20.170344725170505,600,,0.988634299241094,0.6657491373026231,0.0545534545977882,undersample,0.5124958245391266,,5.0,0.6258367944057471,,,,0.47762080294283815,0.3809227563566188,0.5567616463138851,0.5572139303482587,0.715281812899477,0.7156549520766773,0.988634299241094,0.6657491373026231,0.05,0.5709288833613114,0.5981532766285436,0.5567616463138851,0.5572139303482587,1.0,1.0,undersample,0.5137295047994828,0.541980204422748,0.5124958245391266,0.3809227563566188,COMPLETE
1207,0.7156549520766773,2025-11-27 00:53:10.718721,2025-11-27 00:53:12.592796,0 days 00:00:01.874075,2.282884742122644,gbtree,0.8466149846306025,0.15468842923451975,lossguide,4.491665605601886,0.0020735532709957203,3,10,6.746915617680293,600,,0.8006461164194619,0.2795025007250173,0.09014164181149396,oversample,0.8180740217578705,,8.0,0.6753255815202843,,,,0.43027867307596757,0.45521861042996264,0.5567616463138851,0.5572139303482587,0.715281812899477,0.7156549520766773,0.8006461164194619,0.2795025007250173,0.1,0.5856446603986571,0.5600054472895162,0.5567616463138851,0.5572139303482587,1.0,1.0,oversample,0.5209424062069995,0.5055329948396854,0.8180740217578705,0.45521861042996264,COMPLETE
1208,0.6590064210882055,2025-11-27 00:53:12.769897,2025-11-27 00:53:43.475657,0 days 00:00:30.705760,0.00915912854007136,gbtree,0.5871720410575915,0.461255195121125,lossguide,0.00043892238167762994,0.013723487076596642,3,11,0.21297322720592604,200,,0.9462697658898469,0.5418769506627621,0.05874306363047876,undersample,0.7062722086639609,,11.0,0.6448171483603862,,,,0.6314893124491858,0.25211233472770245,0.5305291723202171,0.5436454093170511,0.6430536451169189,0.6590064210882055,0.9462697658898469,0.5418769506627621,0.05,0.5873904419766718,0.5702538643570205,0.5575432319618366,0.5645628257093225,0.7595450852965069,0.7913961038961039,undersample,0.5387912598020523,0.5269971346324768,0.7062722086639609,0.25211233472770245,COMPLETE
1209,0.7156549520766773,2025-11-27 00:53:43.650259,2025-11-27 00:54:45.077283,0 days 00:01:01.427024,0.0024117330579645994,dart,0.9266280717674734,5.4952196397349145,lossguide,0.7847323034565997,0.1029840684617759,1,5,0.11858295833334212,400,forest,0.992335281729664,0.773356054272884,0.08541613028982127,oversample,0.7607602681076493,,5.0,0.6195240904650787,0.3093015547262728,uniform,0.8580047029547865,0.21142247172739595,0.32583554523893044,0.5567616463138851,0.5572139303482587,0.715281812899477,0.7156549520766773,0.992335281729664,0.773356054272884,0.08,0.5021354934184294,0.49911150512072844,0.5567616463138851,0.5572139303482587,1.0,1.0,oversample,0.43950330741557386,0.45108562275314057,0.7607602681076493,0.32583554523893044,COMPLETE
1210,0.7200467562828755,2025-11-27 00:54:45.257581,2025-11-27 00:54:47.075891,0 days 00:00:01.818310,0.17442641271345039,gbtree,0.766065022661552,2.433418075604031,lossguide,0.20356316204824595,0.04997490546195031,10,6,24.155373883973922,400,,0.8029927346467448,0.6074811061780473,0.013903700734086609,oversample,0.7049347554835601,,6.0,0.7191012538148307,,,,0.44798314798742267,0.3565187329753856,0.5694255992763455,0.566711895070104,0.7211482132396017,0.7200467562828755,0.8029927346467448,0.6074811061780473,0.02,0.4998218657214799,0.49097684403031683,0.5639028859367843,0.5625570776255707,1.0,1.0,oversample,0.45455950861254335,0.4523218099571521,0.7049347554835601,0.3565187329753856,COMPLETE
1211,0.7156549520766773,2025-11-27 00:54:47.250902,2025-11-27 00:54:47.959762,0 days 00:00:00.708860,0.7577420081119274,gbtree,0.5879357227553592,3.5896123884990248,lossguide,0.4462856099783325,0.056139318552941096,8,6,82.6086409460701,400,,0.7259213169177089,0.3624559733743917,0.01032913204269031,oversample,0.8138239094370256,,6.0,0.7819625706435573,,,,0.5758694784351505,0.27389826466550976,0.5567616463138851,0.5572139303482587,0.715281812899477,0.7156549520766773,0.7259213169177089,0.3624559733743917,0.02,0.5444102719979194,0.546838541947507,0.5567616463138851,0.5572139303482587,1.0,1.0,oversample,0.515091016097747,0.5021117161694282,0.8138239094370256,0.27389826466550976,COMPLETE
1212,0.688868331791551,2025-11-27 00:54:48.144777,2025-11-27 00:54:49.237194,0 days 00:00:01.092417,4.467334109849818,gbtree,0.6979571210491654,1.4841264878012859,lossguide,0.5301963136596143,0.027764140030880083,8,5,19.747150804393243,500,,0.7845661792859033,0.7365018551753414,0.023434037419706948,oversample,0.9190460264883057,,6.0,0.6928518696707532,,,,0.4187699066714879,0.4872322425999055,0.5382180009045681,0.5436454093170511,0.6853620955315871,0.688868331791551,0.7845661792859033,0.7365018551753414,0.02,0.5238775943563859,0.5327094342036158,0.5521350546176763,0.5554450522128295,0.9033306255077173,0.9066558441558441,oversample,0.4564768149339346,0.4739613042728467,0.9190460264883057,0.4872322425999055,COMPLETE
1213,0.6266766020864382,2025-11-27 00:54:49.419001,2025-11-27 00:54:50.827274,0 days 00:00:01.408273,0.01772837259153275,gbtree,0.6414886266109324,2.861053343318238,depthwise,0.04868023493926513,0.09145969718087223,9,5,12.200528528917332,200,,0.842711324860215,0.5006209370958431,0.011953944637283841,oversample,0.7839909278262933,,8.0,0.663785172597716,,,,0.4065297170004848,0.654034792417358,0.5382180009045681,0.5468113975576662,0.6116394066184861,0.6266766020864382,0.842711324860215,0.5006209370958431,0.02,0.5281189062812424,0.5306554641599157,0.575107296137339,0.5792011019283747,0.6531275385865151,0.6826298701298701,oversample,0.48786534922661184,0.49605929055622616,0.7839909278262933,0.654034792417358,COMPLETE
