number,value,datetime_start,datetime_complete,duration,params_alpha,params_booster,params_colsample_bytree,params_gamma,params_grow_policy,params_lambda,params_learning_rate,params_max_delta_step,params_max_depth,params_min_child_weight,params_n_estimators,params_normalize_type,params_params_feature_fraction,params_params_labeled_ratio,params_params_missing_rate,params_params_resampling,params_params_sample_rows,params_params_scale_pos_weight,params_params_selftrain_max_iter,params_params_selftrain_threshold,params_rate_drop,params_sample_type,params_skip_drop,params_subsample,params_user_attrs_decision_threshold,user_attrs_acc_test,user_attrs_acc_val,user_attrs_f1_test,user_attrs_f1_val,user_attrs_feature_fraction,user_attrs_labeled_ratio,user_attrs_missing_rate,user_attrs_pr_auc_test,user_attrs_pr_auc_val,user_attrs_prec_test,user_attrs_prec_val,user_attrs_rec_test,user_attrs_rec_val,user_attrs_resampling_strategy,user_attrs_roc_auc_test,user_attrs_roc_auc_val,user_attrs_sample_rows,user_attrs_user_attrs_decision_threshold,state
1586,0.0,2025-11-27 08:28:04.484727,2025-11-27 08:32:01.313681,0 days 00:03:56.828954,0.02411949008760681,dart,0.8764644773063612,0.759744148974135,lossguide,0.0039694479822496255,0.004602158105460727,0,7,0.4085115125706505,500,tree,0.8532667760113497,0.6984663973708088,0.0046856221200592164,oversample,0.9644673714731916,,11.0,0.6528567384862282,0.3600552088401703,weighted,0.8977916701317386,0.21867804104965885,0.938531442171787,0.44323835368611486,0.4427860696517413,0.0,0.0,0.8532667760113497,0.6984663973708088,0.0,0.5699181261573546,0.5750135019140419,0.0,0.0,0.0,0.0,oversample,0.5222442348182165,0.5349871655413024,0.9644673714731916,0.938531442171787,COMPLETE
1587,0.7058468957203134,2025-11-27 08:32:01.507069,2025-11-27 08:33:52.454032,0 days 00:01:50.946963,0.11962630117547644,dart,0.8757015736081015,1.3666344150189438,depthwise,0.0018500044246733823,0.005309825237447031,7,9,30.360701804865478,900,tree,0.8241061029059892,0.423641703285963,0.0853258038254446,oversample,0.7421735534483602,,7.0,0.6986432562537634,0.27264920650314456,weighted,0.8593673402749454,0.7025810690501053,0.47210716460782515,0.5635459068294889,0.5585707824513795,0.708018154311649,0.7058468957203134,0.8241061029059892,0.423641703285963,0.08,0.5181378872876343,0.48363319299001656,0.5641272902603665,0.5613614573346117,0.950446791226645,0.950487012987013,oversample,0.46912415656758233,0.41745403472931564,0.7421735534483602,0.47210716460782515,COMPLETE
1588,0.7156549520766773,2025-11-27 08:33:52.631237,2025-11-27 08:35:56.223936,0 days 00:02:03.592699,0.5251336650062525,dart,0.7052208084996221,1.3060886072362785,lossguide,0.002169081527245967,0.005460584568846381,7,4,0.5624188259262517,600,tree,0.7461262234209369,0.7473559929465178,0.00846661078031111,none,0.6429373401177502,2.5465188945226207,12.0,0.7111892423972784,0.4387905827050629,weighted,0.8865792218634904,0.21088955685845007,0.5653271425711349,0.5567616463138851,0.5572139303482587,0.715281812899477,0.7156549520766773,0.7461262234209369,0.7473559929465178,0.0,0.5598837408424546,0.5482682702698226,0.5567616463138851,0.5572139303482587,1.0,1.0,none,0.5167753941544124,0.5088365413952748,0.6429373401177502,0.5653271425711349,COMPLETE
1589,0.5602154674874952,2025-11-27 08:35:56.436106,2025-11-27 08:35:57.459691,0 days 00:00:01.023585,0.014430448995747983,gbtree,0.978668038513372,2.4390980892513685,lossguide,0.01156843382280713,0.09087801610867696,10,5,47.91236997637532,400,,0.847911084644487,0.36081741652243704,0.015039249111750143,oversample,0.8028700503667735,,7.0,0.722837083773631,,,,0.473202356638848,0.5369380110142787,0.4925373134328358,0.4830393487109905,0.5704441041347627,0.5602154674874952,0.847911084644487,0.36081741652243704,0.02,0.5442741137338702,0.5440682061552601,0.5394641564083997,0.5325530358449159,0.6051990251827782,0.5909090909090909,oversample,0.47682695336461145,0.4679839121552605,0.8028700503667735,0.5369380110142787,COMPLETE
1590,0.7222884386174017,2025-11-27 08:35:57.643210,2025-11-27 08:40:29.124988,0 days 00:04:31.481778,0.0005136098309173502,dart,0.8491859081642754,0.9730548604102566,depthwise,0.27822976461938576,0.015571390750521242,8,10,5.853981828062859,800,tree,0.6474698560303989,0.3223401496829228,0.06606425373007689,none,0.6205938952934317,1.3898614555271356,5.0,0.7083395114322594,0.4514038737538483,weighted,0.8924660551198537,0.5907719321025218,0.32487940613288707,0.5730438715513342,0.5784712799638173,0.7188802858844551,0.7222884386174017,0.6474698560303989,0.3223401496829228,0.08,0.6128115002664681,0.6006266364911198,0.5674659144334744,0.5706214689265536,0.9805036555645816,0.9837662337662337,none,0.5736799350121853,0.5584921335049016,0.6205938952934317,0.32487940613288707,COMPLETE
1591,0.5619834710743802,2025-11-27 08:40:29.313262,2025-11-27 08:42:36.730188,0 days 00:02:07.416926,0.000983359518498233,dart,0.9717828009210487,3.3951887814819774,depthwise,0.014616729827604548,0.03267835979435598,9,11,17.671359238918505,1000,tree,0.6734442245395936,0.38881272829555086,0.06025603432021048,none,0.541139939129381,0.8826727472732045,5.0,0.7153322067492538,0.47449793198220075,weighted,0.8966794452297036,0.6810768692242177,0.530860569917957,0.5490728177295342,0.5685210312075983,0.5394919168591225,0.5619834710743802,0.6734442245395936,0.38881272829555086,0.05,0.6390592837014502,0.6419642700060708,0.6252676659528907,0.6469344608879493,0.4744110479285134,0.4967532467532468,none,0.6141804406571727,0.6250941027817942,0.541139939129381,0.530860569917957,COMPLETE
1592,,2025-11-27 08:42:36.917971,2025-11-27 08:46:17.445238,0 days 00:03:40.527267,0.00023188386448813654,dart,0.7862944861072222,1.6704118200195537,depthwise,0.03670125493156066,0.01503210803460238,6,10,3.065710456231385,800,tree,0.6059347916331351,0.5304371173916289,0.054308374893034875,none,0.6332258342870822,1.1317283127729445,6.0,0.6210672492351175,0.4115748435205137,weighted,0.7704059145200944,0.5466221003352064,,,,,,,,,,,,,,,,,,,,FAIL
1593,0.7156549520766773,2025-11-27 08:56:41.589361,2025-11-27 08:57:49.167421,0 days 00:01:07.578060,60.53082080079022,dart,0.8333800304661316,4.375872112626925,lossguide,22.420123713724433,0.0036905100721932025,10,8,8.663279761354557,700,forest,0.819960510663762,0.30034730118633246,0.07991585642167237,undersample,0.989309171116382,,9.0,0.9306341209673543,0.03551802909894347,weighted,0.07841636973138665,0.5067532150606222,0.44879716399431424,0.5567616463138851,0.5572139303482587,0.715281812899477,0.7156549520766773,0.819960510663762,0.30034730118633246,0.08,0.5567616463138851,0.5572139303482587,0.5567616463138851,0.5572139303482587,1.0,1.0,undersample,0.5,0.5,0.989309171116382,0.44879716399431424,COMPLETE
1594,0.7156549520766773,2025-11-27 08:57:49.404989,2025-11-27 08:58:36.227471,0 days 00:00:46.822482,45.971478464161336,dart,0.48760632045902885,6.120957227224214,lossguide,0.5030416925289531,0.00011735535410272082,0,8,7.126995609048578,600,forest,0.8265541627326992,0.37730412177784745,0.043860151346232036,none,0.7850983852089398,0.7249023743090239,6.0,0.7632087704997071,0.33338335772283384,uniform,0.6035740826563435,0.7454562392827868,0.29538175018731183,0.5567616463138851,0.5572139303482587,0.715281812899477,0.7156549520766773,0.8265541627326992,0.37730412177784745,0.05,0.5567616463138851,0.5572139303482587,0.5567616463138851,0.5572139303482587,1.0,1.0,none,0.5,0.5,0.7850983852089398,0.29538175018731183,COMPLETE
1595,0.7156549520766773,2025-11-27 08:58:36.424284,2025-11-27 08:58:49.968418,0 days 00:00:13.544134,0.0003772162969353184,dart,0.5749209613181613,0.9710127579306127,depthwise,10.657846106959465,0.0023115502886561076,8,4,29.038868465087933,300,forest,0.5469702553792208,0.6031625468893255,0.006414749634878436,none,0.707131497257335,1.668084541977012,7.0,0.9252536691516748,0.019593896127160337,weighted,0.2545262663187686,0.9811675720107167,0.600446227978209,0.5567616463138851,0.5572139303482587,0.715281812899477,0.7156549520766773,0.5469702553792208,0.6031625468893255,0.0,0.5476103636214864,0.5491335439311784,0.5567616463138851,0.5572139303482587,1.0,1.0,none,0.5269550224639002,0.5166939164002493,0.707131497257335,0.600446227978209,COMPLETE
1596,0.7156549520766773,2025-11-27 08:58:50.190324,2025-11-27 08:59:10.797268,0 days 00:00:20.606944,1.1665388871103268,dart,0.788155217698076,8.289400292173632,depthwise,0.00010670207305103142,0.014773852304194575,6,4,0.114900690488732,400,forest,0.7906364363179293,0.8172147532983969,0.029743695085513368,oversample,0.8497396376587522,,10.0,0.842386056527218,0.2960209656359195,weighted,0.515026715211786,0.4160063785537319,0.5007946291560215,0.5567616463138851,0.5572139303482587,0.715281812899477,0.7156549520766773,0.7906364363179293,0.8172147532983969,0.02,0.6242963826393977,0.6560100384798693,0.5567616463138851,0.5572139303482587,1.0,1.0,oversample,0.6002698154810258,0.6096330571879601,0.8497396376587522,0.5007946291560215,COMPLETE
1597,0.0,2025-11-27 08:59:11.015608,2025-11-27 08:59:11.750281,0 days 00:00:00.734673,0.5106138305628326,gbtree,0.3083792513779602,6.60173537492685,lossguide,0.0055013039835233235,0.00011775925917055318,6,9,0.80301646482701,500,,0.6837809350239483,0.5051054476859387,0.06532008198571336,oversample,0.7871626244247893,,11.0,0.9121731742554853,,,,0.5430149607566129,0.6223331501242199,0.44323835368611486,0.4427860696517413,0.0,0.0,0.6837809350239483,0.5051054476859387,0.08,0.5243261762200735,0.5109843739900601,0.0,0.0,0.0,0.0,oversample,0.47894527429168254,0.4427747303768754,0.7871626244247893,0.6223331501242199,COMPLETE
1598,0.7156549520766773,2025-11-27 08:59:12.002146,2025-11-27 09:00:24.232591,0 days 00:01:12.230445,0.0005532480566576553,dart,0.8458551669800085,1.6249293467637482,depthwise,0.49357980912948746,0.00035711228955423056,0,12,40.21408319922197,800,tree,0.5999982624482001,0.21296525612242978,0.03599780644783639,none,0.505857042092501,0.566640996669681,6.0,0.8777941961750972,0.3487143865722818,weighted,0.408188414410262,0.8784065834577877,0.4072110084181417,0.5567616463138851,0.5572139303482587,0.715281812899477,0.7156549520766773,0.5999982624482001,0.21296525612242978,0.05,0.603109358618579,0.6099444108386975,0.5567616463138851,0.5572139303482587,1.0,1.0,none,0.5715549826754422,0.5753750845681387,0.505857042092501,0.4072110084181417,COMPLETE
1599,0.0,2025-11-27 09:00:24.439297,2025-11-27 09:00:24.831621,0 days 00:00:00.392324,0.4828316556556039,gbtree,0.6719279810836568,2.3789282137450862,depthwise,40.298045932583044,0.019898941052492777,4,4,5.391204002783814,200,,0.6271782408851965,0.24062041222671293,0.018619300588033617,none,0.6049218744875611,0.8440819868725569,7.0,0.7520458189453423,,,,0.6285062424199667,0.6178060932892757,0.44323835368611486,0.4427860696517413,0.0,0.0,0.6271782408851965,0.24062041222671293,0.02,0.5760199436400201,0.5596784408201549,0.0,0.0,0.0,0.0,none,0.5701134799980105,0.5341253167159704,0.6049218744875611,0.6178060932892757,COMPLETE
1600,0.0,2025-11-27 09:00:25.039537,2025-11-27 09:00:25.427903,0 days 00:00:00.388366,87.50516426087297,gbtree,0.7304625624800807,5.365792111087222,depthwise,23.989862470391174,0.03258768354914551,8,3,2.296627356539994,200,,0.9363253277236976,0.3914794243709451,0.0383463894171898,undersample,0.6600085754112339,,6.0,0.8793163918693973,,,,0.37351758751877917,0.7716749941831669,0.44323835368611486,0.4427860696517413,0.0,0.0,0.9363253277236976,0.3914794243709451,0.05,0.5567616463138851,0.5572139303482587,0.0,0.0,0.0,0.0,undersample,0.5,0.5,0.6600085754112339,0.7716749941831669,COMPLETE
1601,0.7156549520766773,2025-11-27 09:00:25.633791,2025-11-27 09:00:26.638700,0 days 00:00:01.004909,0.001757196998010447,gbtree,0.49933598426738046,5.1820071393066325,depthwise,0.000142552982584589,0.0008696059824411717,6,10,0.43645144139468633,1000,,0.6980298514036469,0.5957949183009563,0.011753185596203308,oversample,0.9319278029616157,,6.0,0.6641479426749275,,,,0.5397483750012051,0.4928337683893728,0.5567616463138851,0.5572139303482587,0.715281812899477,0.7156549520766773,0.6980298514036469,0.5957949183009563,0.02,0.5530714933559364,0.5576957082868825,0.5567616463138851,0.5572139303482587,1.0,1.0,oversample,0.48363202307730563,0.4944280374885584,0.9319278029616157,0.4928337683893728,COMPLETE
1602,0.0,2025-11-27 09:00:26.843971,2025-11-27 09:01:56.012715,0 days 00:01:29.168744,59.104190192022145,dart,0.39266302393235747,5.521924699224066,depthwise,0.32125982151191756,0.2202075523354931,10,10,0.17793742700293239,800,forest,0.9746594112078407,0.858964393294549,0.08765052453165909,undersample,0.9887475698722235,,10.0,0.879720905573337,0.334958273295455,weighted,0.706637620820824,0.4337180214340391,0.7245727799749684,0.44323835368611486,0.4427860696517413,0.0,0.0,0.9746594112078407,0.858964393294549,0.08,0.5567616463138851,0.5572139303482587,0.0,0.0,0.0,0.0,undersample,0.5,0.5,0.9887475698722235,0.7245727799749684,COMPLETE
1603,0.7156549520766773,2025-11-27 09:01:56.250396,2025-11-27 09:02:54.858551,0 days 00:00:58.608155,0.09646020776080412,dart,0.49486768490369404,9.818293898182532,lossguide,0.07416890071863386,0.0019248919990375575,2,3,0.2782419336717048,700,tree,0.6161170710854713,0.29274134433058807,0.07740473326986388,oversample,0.9532777496105895,,10.0,0.6186995136253888,0.255659491273228,weighted,0.20188532607726534,0.7115780131189788,0.20685647517501862,0.5567616463138851,0.5572139303482587,0.715281812899477,0.7156549520766773,0.6161170710854713,0.29274134433058807,0.08,0.5211113019262068,0.5149107859852605,0.5567616463138851,0.5572139303482587,1.0,1.0,oversample,0.4035589946782938,0.36750784328031516,0.9532777496105895,0.20685647517501862,COMPLETE
1604,0.0,2025-11-27 09:02:55.115439,2025-11-27 09:02:55.588653,0 days 00:00:00.473214,14.564884431737521,gbtree,0.41626232419097176,4.205394666800984,depthwise,0.2209086633808476,0.03061150492100243,3,3,0.5446300872028187,200,,0.6899634779500603,0.3268056732158321,0.04561405668004797,undersample,0.6310590746198391,,5.0,0.8759909293072815,,,,0.7816354101690626,0.6181983450349925,0.44323835368611486,0.4427860696517413,0.0,0.0,0.6899634779500603,0.3268056732158321,0.05,0.49405543310700284,0.49332130111245837,0.0,0.0,0.0,0.0,undersample,0.18251463054758865,0.168917395168672,0.6310590746198391,0.6181983450349925,COMPLETE
1605,0.715862870424172,2025-11-27 09:02:55.837390,2025-11-27 09:02:58.808120,0 days 00:00:02.970730,0.057429535353143005,gbtree,0.8398367076564945,3.708527992178887,lossguide,0.0015216882288724503,0.014911228491510877,3,6,0.6583634422487264,400,,0.7680887473517259,0.6769747574226865,0.09594333408334252,none,0.7887714744156877,1.618031069340598,6.0,0.6971586342061181,,,,0.23568984100329127,0.43560540592825664,0.5567616463138851,0.5576662143826323,0.715281812899477,0.715862870424172,0.7680887473517259,0.6769747574226865,0.08,0.5342209142411233,0.5469457172324262,0.5567616463138851,0.5574660633484163,1.0,1.0,none,0.46454889835706825,0.4831344600241434,0.7887714744156877,0.43560540592825664,COMPLETE
1606,0.0,2025-11-27 09:02:59.000081,2025-11-27 09:02:59.868532,0 days 00:00:00.868451,0.024782888913965042,gbtree,0.752020016152982,4.586039617685858,depthwise,2.2131243659012685,0.004898934617751051,8,8,44.27149936432988,1000,,0.7290694136300214,0.6136889157265795,0.024002027337970955,oversample,0.8180305277235707,,8.0,0.900202925467744,,,,0.9232355143207662,0.7711246860996419,0.44323835368611486,0.4427860696517413,0.0,0.0,0.7290694136300214,0.6136889157265795,0.02,0.6032776272952771,0.6008563432936236,0.0,0.0,0.0,0.0,oversample,0.5892799118022514,0.5660502036268125,0.8180305277235707,0.7711246860996419,COMPLETE
1607,0.7156549520766773,2025-11-27 09:03:00.059698,2025-11-27 09:05:07.798029,0 days 00:02:07.738331,0.03501011290536151,dart,0.8792306467428086,3.984342586196771,lossguide,0.00023783606570654232,0.00038874903014590945,3,11,7.703628251542054,1000,tree,0.5165372957377528,0.21092424511277977,0.08694885305466322,none,0.9726507667395398,2.057949487694828,5.0,0.7500785028743833,0.17835344520127144,weighted,0.014695652415337102,0.40694725351152616,0.3511645929476558,0.5567616463138851,0.5572139303482587,0.715281812899477,0.7156549520766773,0.5165372957377528,0.21092424511277977,0.08,0.5368511023083458,0.5220162952960369,0.5567616463138851,0.5572139303482587,1.0,1.0,none,0.48831379830567484,0.4471983902206067,0.9726507667395398,0.3511645929476558,COMPLETE
1608,0.7156549520766773,2025-11-27 09:05:08.038069,2025-11-27 09:05:18.443693,0 days 00:00:10.405624,0.02846587724811423,dart,0.7110094058932235,9.742562128180502,lossguide,87.51248361872723,0.0002674071104278963,0,3,7.168706146781598,300,forest,0.7074284346667821,0.4523818923401246,0.04240889884358493,oversample,0.7586542586011444,,12.0,0.8900299200945081,0.39161721915690656,weighted,0.2595586475983445,0.3303635408372843,0.22760438653237816,0.5567616463138851,0.5572139303482587,0.715281812899477,0.7156549520766773,0.7074284346667821,0.4523818923401246,0.05,0.5567616463138851,0.5572139303482587,0.5567616463138851,0.5572139303482587,1.0,1.0,oversample,0.5,0.5,0.7586542586011444,0.22760438653237816,COMPLETE
1609,0.0,2025-11-27 09:05:18.673786,2025-11-27 09:07:13.037501,0 days 00:01:54.363715,0.0031370413722230676,dart,0.9607620888443154,2.965562650640299,lossguide,89.55038565050516,0.3838815773469024,0,12,51.861495564087015,900,forest,0.6188709130078194,0.551672620242483,0.0171853099047643,oversample,0.6189036212695194,,10.0,0.9299042598942756,0.3653545495637381,weighted,0.7935481911004557,0.2847249239057858,0.720373643277479,0.44323835368611486,0.4427860696517413,0.0,0.0,0.6188709130078194,0.551672620242483,0.02,0.47294454886301074,0.485205215657508,0.0,0.0,0.0,0.0,oversample,0.31840506308128447,0.3394652143056127,0.6189036212695194,0.720373643277479,COMPLETE
1610,0.5818181818181818,2025-11-27 09:07:13.234189,2025-11-27 09:07:20.224934,0 days 00:00:06.990745,0.0008205938052847576,gbtree,0.3050314627786048,0.7086977818420837,depthwise,0.005711684218776122,0.47671486370021665,9,12,2.2670706161121985,800,,0.7033666729178741,0.5864547936843796,0.054688490166942216,oversample,0.9838973358992509,,8.0,0.6950784686621511,,,,0.5339890998368095,0.44102812122775925,0.5015829941203076,0.5006784260515604,0.5816249050873197,0.5818181818181818,0.7033666729178741,0.5864547936843796,0.05,0.5149978609147489,0.513271690850219,0.5459729151817534,0.5454545454545454,0.6222583265637693,0.6233766233766234,oversample,0.45491553241930405,0.4529515109507449,0.9838973358992509,0.44102812122775925,COMPLETE
1611,0.7156549520766773,2025-11-27 09:07:20.426863,2025-11-27 09:07:42.308193,0 days 00:00:21.881330,14.924894881878382,dart,0.40291401940545823,3.3350746579127533,depthwise,35.07135938710523,0.008746814557090189,3,6,17.856036655235922,400,forest,0.5039420517542201,0.4608753488746969,0.08792347630313271,none,0.8381212411387314,2.566296509826986,12.0,0.7856880250969736,0.37004876280884125,weighted,0.6124630330285433,0.23895223678042285,0.2536967270197401,0.5567616463138851,0.5572139303482587,0.715281812899477,0.7156549520766773,0.5039420517542201,0.4608753488746969,0.08,0.6180043933385346,0.6358198888285181,0.5567616463138851,0.5572139303482587,1.0,1.0,none,0.5396612178583862,0.5573604128251728,0.8381212411387314,0.2536967270197401,COMPLETE
1612,0.7156549520766773,2025-11-27 09:07:42.541159,2025-11-27 09:07:46.661993,0 days 00:00:04.120834,1.4846361646055142,gbtree,0.959088816576406,1.1570323332709365,lossguide,0.290296275667789,0.0010771197016602304,6,9,0.4258433297085861,500,,0.7549035983107921,0.43377540871776643,0.09627703198402425,oversample,0.7943698049851441,,5.0,0.8767940571295917,,,,0.7375657124766579,0.4652213826379552,0.5567616463138851,0.5572139303482587,0.715281812899477,0.7156549520766773,0.7549035983107921,0.43377540871776643,0.08,0.5594027396764374,0.5385120784814282,0.5567616463138851,0.5572139303482587,1.0,1.0,oversample,0.5070280508629121,0.4775848831964767,0.7943698049851441,0.4652213826379552,COMPLETE
1613,0.7156549520766773,2025-11-27 09:07:46.893320,2025-11-27 09:07:52.712428,0 days 00:00:05.819108,0.0006320753089450743,dart,0.8974285878043944,8.869607812174175,lossguide,0.5163652520537522,0.0032937692680663276,5,5,7.411122963983674,200,forest,0.7231972077416015,0.8355129160480281,0.09521426972954208,oversample,0.6945673385505928,,10.0,0.6560806632120502,0.46165303394458157,uniform,0.7469076317430089,0.984464106229826,0.46415825169769515,0.5567616463138851,0.5572139303482587,0.715281812899477,0.7156549520766773,0.7231972077416015,0.8355129160480281,0.08,0.5567616463138851,0.5572139303482587,0.5567616463138851,0.5572139303482587,1.0,1.0,oversample,0.5,0.5,0.6945673385505928,0.46415825169769515,COMPLETE
1614,0.7156549520766773,2025-11-27 09:07:52.958757,2025-11-27 09:08:12.192517,0 days 00:00:19.233760,24.45536467150049,dart,0.6231519432247066,9.077329574850395,lossguide,2.7498151918585525,0.0001666219301967132,3,3,0.15248797993516156,400,forest,0.6839637902685207,0.5195639238838587,0.0607249374011541,none,0.5316038091693154,1.634868204636672,12.0,0.7181170836174839,0.23532447460695477,uniform,0.3404206574311156,0.7380658490372172,0.2800636590473624,0.5567616463138851,0.5572139303482587,0.715281812899477,0.7156549520766773,0.6839637902685207,0.5195639238838587,0.05,0.5457168333878788,0.5404708306166923,0.5567616463138851,0.5572139303482587,1.0,1.0,none,0.47593834446857547,0.4617229680431927,0.5316038091693154,0.2800636590473624,COMPLETE
