number,value,datetime_start,datetime_complete,duration,params_alpha,params_booster,params_colsample_bytree,params_gamma,params_grow_policy,params_lambda,params_learning_rate,params_max_delta_step,params_max_depth,params_min_child_weight,params_n_estimators,params_normalize_type,params_params_feature_fraction,params_params_labeled_ratio,params_params_missing_rate,params_params_resampling,params_params_sample_rows,params_params_scale_pos_weight,params_params_selftrain_max_iter,params_params_selftrain_threshold,params_rate_drop,params_sample_type,params_skip_drop,params_subsample,params_user_attrs_decision_threshold,user_attrs_acc_test,user_attrs_acc_val,user_attrs_f1_test,user_attrs_f1_val,user_attrs_feature_fraction,user_attrs_labeled_ratio,user_attrs_missing_rate,user_attrs_pr_auc_test,user_attrs_pr_auc_val,user_attrs_prec_test,user_attrs_prec_val,user_attrs_rec_test,user_attrs_rec_val,user_attrs_resampling_strategy,user_attrs_roc_auc_test,user_attrs_roc_auc_val,user_attrs_sample_rows,user_attrs_user_attrs_decision_threshold,state
1242,0.6501340482573726,2025-11-27 01:11:43.587189,2025-11-27 01:11:47.393323,0 days 00:00:03.806134,0.3027263183061708,gbtree,0.7756008262844858,2.286114324155202,lossguide,0.01244189582391664,0.03522397809813729,9,6,3.7908504684493667,700,,0.8809339893782042,0.5616367686592829,0.013012929093350832,oversample,0.669910356237415,,7.0,0.6335293225250063,,,,0.6076512393672145,0.5067073914734401,0.5400271370420624,0.5278154681139756,0.6611129623458847,0.6501340482573726,0.8809339893782042,0.5616367686592829,0.02,0.5364921298019205,0.534854624633841,0.56045197740113,0.5536529680365296,0.8058489033306255,0.7873376623376623,oversample,0.4799843332946502,0.47668448124908797,0.669910356237415,0.5067073914734401,COMPLETE
1243,0.7156549520766773,2025-11-27 01:11:47.574493,2025-11-27 01:12:11.206634,0 days 00:00:23.632141,0.06536386706728851,dart,0.9088685070116287,1.1494548778685385,lossguide,0.005748528069347715,0.0038673539518952753,9,6,2.0697048087765832,400,forest,0.9910755222048045,0.3563544786507303,0.016413676617138044,oversample,0.5508083127994715,,9.0,0.8845049495770638,0.021088280597368225,uniform,0.32129094656442636,0.44006141880761296,0.12289585863852454,0.5567616463138851,0.5572139303482587,0.715281812899477,0.7156549520766773,0.9910755222048045,0.3563544786507303,0.02,0.5264279325172616,0.5126407554923165,0.5567616463138851,0.5572139303482587,1.0,1.0,oversample,0.48377376945904277,0.45844387991987584,0.5508083127994715,0.12289585863852454,COMPLETE
1244,0.7156549520766773,2025-11-27 01:12:11.389533,2025-11-27 01:12:30.429905,0 days 00:00:19.040372,2.6218812852357143,dart,0.8116240406573142,1.1067523006130253,lossguide,0.0056039688762172,0.010104531086851316,2,7,1.4876704518047659,400,tree,0.7303823610045452,0.7041498427711093,0.08552940028140468,undersample,0.9347935641350719,,6.0,0.6155892457669837,0.4925927784746881,weighted,0.04820112704948448,0.2689361900697827,0.37415539404477305,0.5567616463138851,0.5572139303482587,0.715281812899477,0.7156549520766773,0.7303823610045452,0.7041498427711093,0.08,0.47148490252109204,0.48277940764008415,0.5567616463138851,0.5572139303482587,1.0,1.0,undersample,0.3799810175898141,0.396801997797912,0.9347935641350719,0.37415539404477305,COMPLETE
1245,0.7156549520766773,2025-11-27 01:12:30.611756,2025-11-27 01:12:31.942182,0 days 00:00:01.330426,21.930837747749578,gbtree,0.6392987680779483,0.12554657064437102,depthwise,0.00018369882291229897,0.009588925547248106,7,8,0.2952127342512594,1000,,0.7535317234286848,0.6348495426936909,0.06296840110777958,oversample,0.9678807844197849,,8.0,0.6535228417909041,,,,0.35531727982473527,0.46567369592706087,0.5567616463138851,0.5572139303482587,0.715281812899477,0.7156549520766773,0.7535317234286848,0.6348495426936909,0.05,0.4443368600328452,0.44445584209626804,0.5567616463138851,0.5572139303482587,1.0,1.0,oversample,0.33213581127008074,0.3283391149198095,0.9678807844197849,0.46567369592706087,COMPLETE
1246,0.6717210007581501,2025-11-27 01:12:32.131135,2025-11-27 01:12:34.423849,0 days 00:00:02.292714,0.0037351226688243076,gbtree,0.6796462328175794,5.683630155190557,lossguide,0.00023791324159907036,0.05645063571464337,5,8,0.7862853897929705,900,,0.7775552541117513,0.43286030871052383,0.03188054919821544,oversample,0.870143813362564,,5.0,0.6434324849871802,,,,0.4672151467974227,0.7726779878161009,0.6155585707824514,0.608322026232474,0.6755725190839694,0.6717210007581501,0.7775552541117513,0.43286030871052383,0.02,0.6569170008609984,0.6262488635655644,0.6371490280777538,0.6301564722617354,0.718927701056052,0.7191558441558441,oversample,0.6362365092259487,0.6119072768396058,0.870143813362564,0.7726779878161009,COMPLETE
1247,0.0,2025-11-27 01:12:34.598490,2025-11-27 01:12:35.396209,0 days 00:00:00.797719,10.89326833562148,gbtree,0.7375889495258744,7.174927001792536,lossguide,23.54945379735971,0.0012031261245941418,10,9,3.6657452687667913,600,,0.7356616404241114,0.13031393945423544,0.0758425713271167,undersample,0.8878678822955426,,10.0,0.8286270200332566,,,,0.5160650260055007,0.533487757725558,0.44323835368611486,0.4427860696517413,0.0,0.0,0.7356616404241114,0.13031393945423544,0.08,0.4962399468636398,0.49497094357409543,0.0,0.0,0.0,0.0,undersample,0.3166452527396011,0.2961522325988618,0.8878678822955426,0.533487757725558,COMPLETE
1248,0.6985826771653544,2025-11-27 01:12:35.570975,2025-11-27 01:14:38.905021,0 days 00:02:03.334046,0.03093084892719999,dart,0.950326343811736,1.3902916883291159,lossguide,0.04168421589948979,0.3741567653649707,9,5,5.2662737303550555,500,forest,0.9417936721318972,0.3853447875875387,0.02749930937258166,oversample,0.5484974735416531,,7.0,0.67587746798264,0.16718174459301158,uniform,0.28197664375877785,0.22425055207839084,0.31910339087181055,0.5540479421076436,0.5671641791044776,0.6903266331658291,0.6985826771653544,0.9417936721318972,0.3853447875875387,0.02,0.5810322490897453,0.5569993762106886,0.5627240143369175,0.570766855378281,0.892770105605199,0.9001623376623377,oversample,0.5349035958818946,0.5322038788586286,0.5484974735416531,0.31910339087181055,COMPLETE
1249,0.7167494884536685,2025-11-27 01:14:39.076464,2025-11-27 01:17:21.464021,0 days 00:02:42.387557,0.15943947315363102,dart,0.8177057657666558,3.599320250781105,lossguide,0.12266457939180563,0.02030280995779831,0,4,0.8059766473831366,600,forest,0.8725133842213546,0.7353341052563197,0.04694345862668343,none,0.7915329360676077,1.1697732732289317,6.0,0.6038989245664385,0.0756083214449414,uniform,0.2018110084472155,0.30491738975653665,0.6271114155373843,0.5617367706919946,0.5617367706919946,0.7154185022026431,0.7167494884536685,0.8725133842213546,0.7353341052563197,0.05,0.6581603794151962,0.6725112902220025,0.5602575896964122,0.5600730927364094,0.9894394800974817,0.9951298701298701,none,0.632234039025846,0.6396248988498733,0.7915329360676077,0.6271114155373843,COMPLETE
1250,0.7141610933410876,2025-11-27 01:17:21.646143,2025-11-27 01:18:15.477232,0 days 00:00:53.831089,0.0057654352251464425,dart,0.7282035864420862,1.3220575617658588,lossguide,0.03959446728411546,0.003749802303291059,2,3,1.2662987982755718,400,forest,0.8123561237384722,0.5253049777382481,0.05679600151677451,none,0.7637819358447698,1.1793533958069826,8.0,0.6158864752070472,0.029349107146466574,uniform,0.19833672131212826,0.3885717264090446,0.7219197859956755,0.5563093622795116,0.5554047942107644,0.7149084568439407,0.7141610933410876,0.8123561237384722,0.5253049777382481,0.05,0.4638630301651184,0.45311597830944056,0.5565610859728507,0.5564114182147711,0.9991876523151909,0.9967532467532467,none,0.3655137684643313,0.35529230728413563,0.7637819358447698,0.7219197859956755,COMPLETE
1251,0.0,2025-11-27 01:18:15.649988,2025-11-27 01:21:36.565530,0 days 00:03:20.915542,0.04275363438105766,dart,0.8192012051083117,4.798203580582518,lossguide,3.168549517546094,0.0017969630449798145,1,4,0.3421113336844748,800,forest,0.8348765524465671,0.6457775277917579,0.061056502092810404,none,0.8202764944571552,1.1713047157135703,6.0,0.6039253798605961,0.08693958246639195,uniform,0.15592779802948437,0.3421937605077392,0.7681967938416552,0.44323835368611486,0.4427860696517413,0.0,0.0,0.8348765524465671,0.6457775277917579,0.05,0.46724192961083033,0.46196453251886527,0.0,0.0,0.0,0.0,none,0.38905941743066036,0.3791202094636722,0.8202764944571552,0.7681967938416552,COMPLETE
1252,0.0,2025-11-27 01:21:36.758586,2025-11-27 01:22:09.513527,0 days 00:00:32.754941,5.772706066689143,dart,0.8119192054336033,3.9045779435253225,lossguide,0.03844160633047791,0.005182005311632636,0,4,1.0079508255867702,500,forest,0.881677633314129,0.8289206076826113,0.03567623640962472,none,0.7150411758046902,1.1473664498985259,7.0,0.7085255096564663,0.03596359314636995,uniform,0.13780162517790578,0.2293311720171744,0.6165441044230789,0.44323835368611486,0.4427860696517413,0.0,0.0,0.881677633314129,0.8289206076826113,0.05,0.37091509528853106,0.3708460409156084,0.0,0.0,0.0,0.0,none,0.11984449344319369,0.11679233049891885,0.7150411758046902,0.6165441044230789,COMPLETE
1253,0.7156549520766773,2025-11-27 01:22:09.706416,2025-11-27 01:27:26.801382,0 days 00:05:17.094966,1.5694988011743383,dart,0.7112659727615336,4.5967628733388475,lossguide,0.16422716548416685,0.016369181989356107,0,4,0.33045211732772367,800,forest,0.9378015292877071,0.8441952451771758,0.03393773258158817,none,0.8840580573674189,1.1411647320752356,7.0,0.6077607283646334,0.10401698699235286,uniform,0.3013435871867995,0.5049159342982137,0.3689669948015811,0.5567616463138851,0.5572139303482587,0.715281812899477,0.7156549520766773,0.9378015292877071,0.8441952451771758,0.02,0.45880088385142875,0.4554171697905894,0.5567616463138851,0.5572139303482587,1.0,1.0,none,0.3412212569837033,0.33764990117135163,0.8840580573674189,0.3689669948015811,COMPLETE
1254,0.0,2025-11-27 01:27:26.975422,2025-11-27 01:27:32.871880,0 days 00:00:05.896458,0.03628612179772807,dart,0.8610970978726984,7.021903968236658,lossguide,0.13887598725133365,0.0031959716085925146,9,7,31.662305716545642,200,forest,0.8882969085047103,0.37891997799089183,0.04185621817707293,undersample,0.6576655214229197,,7.0,0.7567490145297694,0.014613412241290674,uniform,0.24831878023128207,0.2361359150788868,0.563002885556997,0.44323835368611486,0.4427860696517413,0.0,0.0,0.8882969085047103,0.37891997799089183,0.05,0.6735623263824501,0.639783163396509,0.0,0.0,0.0,0.0,undersample,0.6222264129047232,0.5901707778942202,0.6576655214229197,0.563002885556997,COMPLETE
1255,0.6776699029126214,2025-11-27 01:27:33.054444,2025-11-27 01:29:04.468365,0 days 00:01:31.413921,0.006777716523709239,dart,0.5615337662613193,2.3160355453784884,lossguide,0.000578419571381752,0.008629309961570101,9,4,2.6127267375204757,600,forest,0.9431870990539826,0.4529505806311174,0.04451853793960606,oversample,0.5197489567045612,,7.0,0.7511171622968221,0.08245016202248466,uniform,0.019033241436514775,0.36488417514593663,0.5157192833355979,0.5495251017639078,0.5495251017639078,0.6801541425818882,0.6776699029126214,0.9431870990539826,0.4529505806311174,0.05,0.5366946955525751,0.5202007186756122,0.5624004248539565,0.5635091496232508,0.8602761982128351,0.8498376623376623,oversample,0.5011149057510901,0.4750341588952416,0.5197489567045612,0.5157192833355979,COMPLETE
1256,0.7156549520766773,2025-11-27 01:29:04.649634,2025-11-27 01:29:38.808654,0 days 00:00:34.159020,0.0781630979552737,dart,0.8726164988180191,6.960874507213729,lossguide,0.038437816736878815,0.19909505611993925,1,4,1.768936052409536,300,forest,0.9153325300770385,0.7794324600107081,0.028620949944251774,none,0.699415492585651,1.262139756302743,5.0,0.6286369352377291,0.09314082727822404,uniform,0.32429936017030364,0.4862091522791386,0.569230306328614,0.5567616463138851,0.5572139303482587,0.715281812899477,0.7156549520766773,0.9153325300770385,0.7794324600107081,0.02,0.48217706755066214,0.4784982580183759,0.5567616463138851,0.5572139303482587,1.0,1.0,none,0.4128682504683433,0.412098467161031,0.699415492585651,0.569230306328614,COMPLETE
1257,0.23207776427703525,2025-11-27 01:29:38.984653,2025-11-27 01:29:41.014746,0 days 00:00:02.030093,0.22939311643955984,gbtree,0.8870876978323136,5.042745743305181,lossguide,0.5180197507295417,0.030559663932274446,1,4,0.4941242918346468,700,,0.9117119193447547,0.8868674868626598,0.061463294775507944,none,0.820381760786732,1.008525843350661,5.0,0.6225576396577134,,,,0.25091824492683334,0.6044546664856326,0.43464495703301675,0.4283129805517865,0.23594132029339854,0.23207776427703525,0.9117119193447547,0.8868674868626598,0.05,0.5280465079200811,0.5203938534698692,0.4765432098765432,0.4613526570048309,0.15678310316815597,0.15503246753246752,none,0.5037397005918532,0.4837405316848626,0.820381760786732,0.6044546664856326,COMPLETE
1258,0.7156549520766773,2025-11-27 01:29:41.195171,2025-11-27 01:29:42.140033,0 days 00:00:00.944862,9.149201184256478,gbtree,0.9633720398993367,2.7139466382284336,lossguide,10.144825547757733,0.03387920704743951,9,6,3.26315364099575,800,,0.7775137255000789,0.07330701852088023,0.08472672144437961,undersample,0.9822195706684929,,8.0,0.9255771277288458,,,,0.5677219106747149,0.36789473098715636,0.5567616463138851,0.5572139303482587,0.715281812899477,0.7156549520766773,0.7775137255000789,0.07330701852088023,0.08,0.5700172095773383,0.5617030073279006,0.5567616463138851,0.5572139303482587,1.0,1.0,undersample,0.5271261957260565,0.5151227730390141,0.9822195706684929,0.36789473098715636,COMPLETE
1259,0.6958682820751786,2025-11-27 01:29:42.352931,2025-11-27 01:31:19.321226,0 days 00:01:36.968295,0.0071243824269606616,dart,0.7557043281282851,1.6507249711894807,depthwise,0.00034764850355874374,0.07096053692016902,5,7,0.5955848873903483,400,forest,0.9684721520952746,0.6996285211237826,0.07227177430909494,none,0.6589711658781745,1.3605371031542963,8.0,0.6619077542842526,0.07991826194563754,uniform,0.13994163793113273,0.35965057622963087,0.49661746736160106,0.5490728177295342,0.5572139303482587,0.6900839291265154,0.6958682820751786,0.9684721520952746,0.6996285211237826,0.08,0.5644944344017495,0.5825145340738513,0.5589123867069486,0.5636638147961751,0.9017059301380991,0.9090909090909091,none,0.5271672275734015,0.5370068516774339,0.6589711658781745,0.49661746736160106,COMPLETE
1260,0.7156549520766773,2025-11-27 01:31:19.501224,2025-11-27 01:31:38.556197,0 days 00:00:19.054973,0.00433932556940364,dart,0.8163055630010972,1.1895541335767814,lossguide,29.956735250498504,0.041977143398709775,8,5,55.729998812083764,400,forest,0.9661459285731366,0.7971766992284398,0.03527754604544034,oversample,0.5065366747362441,,8.0,0.8341966218247187,0.1696553574598828,uniform,0.19559695690262038,0.32008029318267733,0.31639475575504417,0.5567616463138851,0.5572139303482587,0.715281812899477,0.7156549520766773,0.9661459285731366,0.7971766992284398,0.05,0.6574299879092718,0.6715807385783477,0.5567616463138851,0.5572139303482587,1.0,1.0,oversample,0.6042660687345612,0.613760728546224,0.5065366747362441,0.31639475575504417,COMPLETE
1261,0.7151693667157585,2025-11-27 01:31:38.736743,2025-11-27 01:31:41.660128,0 days 00:00:02.923385,0.42330752947285094,gbtree,0.5730890540409166,2.1398185436453994,depthwise,0.0002419695436650825,0.04570180051261307,7,8,0.3536249238933397,900,,0.6941313183331496,0.52187208924526,0.0023329511164829012,oversample,0.8865471311876044,,6.0,0.6028480054499772,,,,0.7744853843288035,0.3024855208338907,0.5639981908638625,0.5626413387607417,0.7152982870643827,0.7151693667157585,0.6941313183331496,0.52187208924526,0.0,0.576847155839041,0.5901980756265892,0.5619489559164733,0.5612575127138234,0.983753046303818,0.9853896103896104,oversample,0.5567536762877369,0.5781401310640331,0.8865471311876044,0.3024855208338907,COMPLETE
1262,0.10701876302988186,2025-11-27 01:31:41.837050,2025-11-27 01:33:16.463543,0 days 00:01:34.626493,0.09268452397042222,dart,0.6336275232391088,3.2430456581352325,lossguide,0.06435624749700539,0.02098791497674367,0,6,0.8652437408032885,500,forest,0.8099099814906912,0.9323112606079935,0.06142871163102827,none,0.7660065065712325,0.9807833230918298,5.0,0.6080609178436867,0.10911271251471062,weighted,0.2920417892528959,0.22008386233810517,0.6109949002426311,0.4233378561736771,0.4188150158299412,0.1273100616016427,0.10701876302988186,0.8099099814906912,0.9323112606079935,0.05,0.5307428195793484,0.5195652466033911,0.4043478260869565,0.3719806763285024,0.07554833468724614,0.0625,none,0.5006262537508911,0.48938172399612645,0.7660065065712325,0.6109949002426311,COMPLETE
1263,0.6937394247038917,2025-11-27 01:33:16.641149,2025-11-27 01:35:55.912404,0 days 00:02:39.271255,0.09737698518802525,dart,0.8673980091014634,4.672687797075059,lossguide,1.3191272011843103,0.36908292565644596,1,5,0.16371445338275414,600,forest,0.8235923054304474,0.6116566338661059,0.03362757003792599,none,0.8297041928027151,1.3698307757321704,6.0,0.6481502438755111,0.09378211645275635,uniform,0.29505446062762863,0.34303621741911816,0.7633990578753609,0.5965626413387607,0.5906829488919041,0.6945205479452055,0.6937394247038917,0.8235923054304474,0.6116566338661059,0.02,0.6686133917219197,0.6402409573069421,0.6003552397868561,0.5948926291352292,0.8237205523964257,0.8319805194805194,none,0.6092475007874799,0.5765951043338684,0.8297041928027151,0.7633990578753609,COMPLETE
1264,0.0,2025-11-27 01:35:56.094429,2025-11-27 01:37:04.531373,0 days 00:01:08.436944,0.03938543346987775,dart,0.904036325824682,6.491497069178611,lossguide,0.5007463112973136,0.029014350548594265,1,3,0.16859115459389523,400,forest,0.9606676369345643,0.7671047094845767,0.08207938921523936,oversample,0.6660853217143554,,6.0,0.6159977486544976,0.1061964169676345,uniform,0.21857095931683357,0.4904551079796574,0.7641647266892103,0.44323835368611486,0.4427860696517413,0.0,0.0,0.9606676369345643,0.7671047094845767,0.08,0.5371773556763628,0.5466994084165815,0.0,0.0,0.0,0.0,oversample,0.4895468260415458,0.4904972772375734,0.6660853217143554,0.7641647266892103,COMPLETE
1265,0.14849734826163818,2025-11-27 01:37:04.711240,2025-11-27 01:37:48.472216,0 days 00:00:43.760976,6.305662951328604,dart,0.5726443908053999,3.9296692359519456,lossguide,0.2053661169925739,0.007796820661823245,8,4,6.357318216608128,600,forest,0.9562716100997215,0.7080662637128388,0.011453188680943607,undersample,0.7013185694771463,,7.0,0.7769001151669402,0.10918999675364316,uniform,0.11503375265034278,0.3582933383701722,0.5060060600359433,0.36092265943012214,0.3464495703301673,0.16142433234421366,0.14849734826163818,0.9562716100997215,0.7080662637128388,0.02,0.43295736904874493,0.42406688787779523,0.29955947136563876,0.2709677419354839,0.11047928513403736,0.10227272727272728,undersample,0.30132752532369567,0.27834110475836726,0.7013185694771463,0.5060060600359433,COMPLETE
1266,0.7156549520766773,2025-11-27 01:37:48.653213,2025-11-27 01:37:49.348593,0 days 00:00:00.695380,21.59845272961718,gbtree,0.8391214049015981,2.0848042577925288,lossguide,0.19153605981154703,0.12802078887220422,6,10,2.22210123647377,400,,0.9780060535382844,0.24703674847980567,0.09449429794785509,oversample,0.5619400224737324,,9.0,0.7782266270998646,,,,0.7404931362577479,0.19970505464614266,0.5567616463138851,0.5572139303482587,0.715281812899477,0.7156549520766773,0.9780060535382844,0.24703674847980567,0.1,0.5567616463138851,0.5572139303482587,0.5567616463138851,0.5572139303482587,1.0,1.0,oversample,0.5,0.5,0.5619400224737324,0.19970505464614266,COMPLETE
1267,0.0,2025-11-27 01:37:49.537133,2025-11-27 01:38:46.921982,0 days 00:00:57.384849,2.0375583768558694,dart,0.7553017328860858,5.50074219758198,depthwise,0.011671902192693182,0.12232970306429368,3,4,0.6236621083126167,700,tree,0.9371267210383651,0.5633466197314454,0.042204281153968654,none,0.688760378748208,0.9690351606667676,7.0,0.7177925520447528,0.16572959865744596,uniform,0.2413078992743151,0.5266779241424252,0.9165031238510379,0.44323835368611486,0.4427860696517413,0.0,0.0,0.9371267210383651,0.5633466197314454,0.05,0.4960087281370363,0.5084145471804729,0.0,0.0,0.0,0.0,none,0.4290178053349691,0.44138515978403614,0.688760378748208,0.9165031238510379,COMPLETE
1268,0.6927580893682589,2025-11-27 01:38:47.097490,2025-11-27 01:38:49.259728,0 days 00:00:02.162238,0.1170445344922503,gbtree,0.8104542420810453,1.6800239807087647,lossguide,0.6539363577627921,0.45217297223606423,8,3,10.289722460089646,500,,0.7199935913869094,0.822748660658865,0.034122041955099006,none,0.6772199987357612,0.973531663724531,5.0,0.786920000413801,,,,0.43916745486234277,0.2464729601287548,0.5440976933514247,0.5490728177295342,0.6888888888888889,0.6927580893682589,0.7199935913869094,0.822748660658865,0.02,0.5378231292337496,0.5593751709911418,0.5555002488800398,0.5583705911574764,0.9065800162469537,0.9123376623376623,none,0.48266715297004265,0.5208336096997996,0.6772199987357612,0.2464729601287548,COMPLETE
1269,0.7156549520766773,2025-11-27 01:38:49.437352,2025-11-27 01:38:50.852219,0 days 00:00:01.414867,0.9923797788351302,gbtree,0.7522498294039368,3.914007706024611,lossguide,0.1426986444829459,0.45543126247808885,10,5,78.53415279759174,400,,0.8904648073874785,0.5487073019527738,0.021371083228982464,oversample,0.7106209075740618,,6.0,0.6217052340336543,,,,0.4393569842296388,0.10411231015139866,0.5567616463138851,0.5572139303482587,0.715281812899477,0.7156549520766773,0.8904648073874785,0.5487073019527738,0.02,0.4921406380617784,0.48301879606725523,0.5567616463138851,0.5572139303482587,1.0,1.0,oversample,0.41565551484606844,0.39344994892747703,0.7106209075740618,0.10411231015139866,COMPLETE
