number,value,datetime_start,datetime_complete,duration,params_alpha,params_booster,params_colsample_bytree,params_gamma,params_grow_policy,params_lambda,params_learning_rate,params_max_delta_step,params_max_depth,params_min_child_weight,params_n_estimators,params_normalize_type,params_params_feature_fraction,params_params_labeled_ratio,params_params_missing_rate,params_params_resampling,params_params_sample_rows,params_params_scale_pos_weight,params_params_selftrain_max_iter,params_params_selftrain_threshold,params_rate_drop,params_sample_type,params_skip_drop,params_subsample,params_user_attrs_decision_threshold,user_attrs_acc_test,user_attrs_acc_val,user_attrs_f1_test,user_attrs_f1_val,user_attrs_feature_fraction,user_attrs_labeled_ratio,user_attrs_missing_rate,user_attrs_pr_auc_test,user_attrs_pr_auc_val,user_attrs_prec_test,user_attrs_prec_val,user_attrs_rec_test,user_attrs_rec_val,user_attrs_resampling_strategy,user_attrs_roc_auc_test,user_attrs_roc_auc_val,user_attrs_sample_rows,user_attrs_user_attrs_decision_threshold,state
1884,0.7156549520766773,2025-11-27 11:11:35.071874,2025-11-27 11:11:40.431757,0 days 00:00:05.359883,0.16028336743263039,gbtree,0.36733532433884686,0.9653872253725138,lossguide,0.29193918489354753,0.001405196706435378,8,11,23.433335367724702,800,,0.5246103275884415,0.8485900859404567,0.09675886809570229,none,0.7203016164214576,2.6152173211202214,6.0,0.7634636021435963,,,,0.5449537600963161,,0.5567616463138851,0.5572139303482587,0.715281812899477,0.7156549520766773,0.5246103275884415,0.8485900859404567,0.08,0.6074757128083866,0.5979130046269064,0.5567616463138851,0.5572139303482587,1.0,1.0,none,0.6034528921235432,0.5918766499078041,0.7203016164214576,0.5,COMPLETE
1885,0.7156549520766773,2025-11-27 11:11:40.631571,2025-11-27 11:11:59.944226,0 days 00:00:19.312655,1.069129904503087,dart,0.40819389512514026,5.993240584447507,depthwise,0.114493736883781,0.0001735683802585593,3,12,0.18538357480952364,400,tree,0.5221102424130205,0.21812851077754786,0.045988827854605924,oversample,0.5763215498067223,,6.0,0.9273006994037334,0.40988848145412304,uniform,0.7164567556557213,0.23475674268287838,,0.5567616463138851,0.5572139303482587,0.715281812899477,0.7156549520766773,0.5221102424130205,0.21812851077754786,0.05,0.6079430253221777,0.5982261240007494,0.5567616463138851,0.5572139303482587,1.0,1.0,oversample,0.5742311709411628,0.5551848560020163,0.5763215498067223,0.5,COMPLETE
1886,0.0,2025-11-27 11:12:00.154778,2025-11-27 11:13:48.768457,0 days 00:01:48.613679,34.868109536161924,dart,0.24951466919217558,2.804178828106406,lossguide,0.040985963951596004,0.280782574604749,1,6,39.430152773671644,900,forest,0.5846708246971997,0.4867432706131234,0.09129859757817431,undersample,0.6987338126077318,,9.0,0.8077874708010927,0.01585603349959691,weighted,0.6458930339256748,0.2986294231565334,,0.44323835368611486,0.4427860696517413,0.0,0.0,0.5846708246971997,0.4867432706131234,0.08,0.5567616463138851,0.5572139303482587,0.0,0.0,0.0,0.0,undersample,0.5,0.5,0.6987338126077318,0.5,COMPLETE
1887,0.7156549520766773,2025-11-27 11:13:48.973239,2025-11-27 11:13:49.529202,0 days 00:00:00.555963,0.16304014901359679,gbtree,0.550234799752682,8.876505123498669,lossguide,1.8177369879431975,0.0004398936362890796,8,12,2.687291594418525,400,,0.6001508933350881,0.25663274621343213,0.08365455473234769,oversample,0.9687301127119619,,10.0,0.8298836759971547,,,,0.7502624424606159,,0.5567616463138851,0.5572139303482587,0.715281812899477,0.7156549520766773,0.6001508933350881,0.25663274621343213,0.08,0.6406841687239034,0.6138347902034132,0.5567616463138851,0.5572139303482587,1.0,1.0,oversample,0.6008446758069597,0.563520206810554,0.9687301127119619,0.5,COMPLETE
1888,0.7156549520766773,2025-11-27 11:13:49.734990,2025-11-27 11:13:50.316334,0 days 00:00:00.581344,1.2267289329617133,gbtree,0.4796409938945056,5.810980377093661,lossguide,0.02082783262383046,0.01796194447311257,0,9,19.781362713655085,500,,0.9403647410812468,0.24772619087061115,0.09256329124393535,oversample,0.6493984071227249,,10.0,0.6805997718169783,,,,0.3920812045307449,,0.5567616463138851,0.5572139303482587,0.715281812899477,0.7156549520766773,0.9403647410812468,0.24772619087061115,0.08,0.6163461873673929,0.6229357849546144,0.5567616463138851,0.5572139303482587,1.0,1.0,oversample,0.5622469702747062,0.5575668585755409,0.6493984071227249,0.5,COMPLETE
1889,0.7156549520766773,2025-11-27 11:13:50.522253,2025-11-27 11:14:02.023944,0 days 00:00:11.501691,0.007418965265949211,dart,0.36260443239216555,1.3381327754973282,depthwise,0.15287184072991628,0.009226276420218976,4,9,80.96489011642443,300,forest,0.5456181795991281,0.2300271280988113,0.09267471088454478,oversample,0.846495156850199,,6.0,0.7861140174049546,0.3931625215784659,weighted,0.8167664427399727,0.6901510103325413,,0.5567616463138851,0.5572139303482587,0.715281812899477,0.7156549520766773,0.5456181795991281,0.2300271280988113,0.08,0.8551756356983119,0.8472928906548916,0.5567616463138851,0.5572139303482587,1.0,1.0,oversample,0.8676445232845371,0.867638011885969,0.846495156850199,0.5,COMPLETE
1890,0.7156549520766773,2025-11-27 11:14:02.228992,2025-11-27 11:14:28.039872,0 days 00:00:25.810880,96.38686661553707,dart,0.2728509897843305,8.752227692976195,depthwise,0.04222001605424553,0.0006985262801302359,5,12,39.42994901132277,500,tree,0.503146226361843,0.39674504494579377,0.04631934607494969,oversample,0.5806559331375124,,9.0,0.801106749227671,0.41840189568163927,weighted,0.37773636824347595,0.42624023992601967,,0.5567616463138851,0.5572139303482587,0.715281812899477,0.7156549520766773,0.503146226361843,0.39674504494579377,0.05,0.5567616463138851,0.5572139303482587,0.5567616463138851,0.5572139303482587,1.0,1.0,oversample,0.5,0.5,0.5806559331375124,0.5,COMPLETE
1891,0.7156549520766773,2025-11-27 11:14:28.242314,2025-11-27 11:15:49.893989,0 days 00:01:21.651675,0.13788015464670716,dart,0.4176617859995818,5.838266818344574,depthwise,0.0076506176760978385,0.02329271479173138,0,8,28.200490529710915,800,tree,0.9960585674763272,0.32559428171318955,0.07949861451032599,oversample,0.5354719338562157,,10.0,0.878394362306536,0.4435362117685317,uniform,0.8678959337370388,0.30431335636235196,,0.5567616463138851,0.5572139303482587,0.715281812899477,0.7156549520766773,0.9960585674763272,0.32559428171318955,0.08,0.5510747644405247,0.5423138057567398,0.5567616463138851,0.5572139303482587,1.0,1.0,oversample,0.46655572870903034,0.4603429320934428,0.5354719338562157,0.5,COMPLETE
1892,0.7156549520766773,2025-11-27 11:15:50.101226,2025-11-27 11:17:13.169050,0 days 00:01:23.067824,0.059374585888709405,dart,0.20326983577851837,7.062335771512119,lossguide,41.85583378603921,0.2935331871234215,4,6,42.21788070979346,900,tree,0.5339958417589693,0.6025869250498157,0.04476192759008251,none,0.9750396751027375,2.776805784848881,6.0,0.662305235430389,0.4339591370864965,weighted,0.4365610265741356,0.7706049855337957,,0.5567616463138851,0.5572139303482587,0.715281812899477,0.7156549520766773,0.5339958417589693,0.6025869250498157,0.05,0.6358357277125125,0.6158642055665166,0.5567616463138851,0.5572139303482587,1.0,1.0,none,0.6350055538056002,0.6021632861520503,0.9750396751027375,0.5,COMPLETE
1893,0.6963334377937951,2025-11-27 11:17:13.393804,2025-11-27 11:17:23.690133,0 days 00:00:10.296329,0.008838142206416997,gbtree,0.31472633618299223,0.26030224674931657,lossguide,1.1487070313066887,0.006968882883830942,5,9,15.053216825182298,600,,0.522820579463745,0.7513289717873661,0.07531776942595261,oversample,0.6076243356205088,,11.0,0.6391177707370254,,,,0.9034912775701371,,0.5680687471732248,0.5617367706919946,0.7025848645281844,0.6963334377937951,0.522820579463745,0.7513289717873661,0.08,0.5962047238375069,0.5834629710008098,0.5696969696969697,0.5671260847371108,0.9163281884646629,0.9017857142857143,oversample,0.5802180904855849,0.5592855816298105,0.6076243356205088,0.5,COMPLETE
1894,0.7156549520766773,2025-11-27 11:17:23.950714,2025-11-27 11:17:24.807899,0 days 00:00:00.857185,0.0008116013326514604,gbtree,0.25042065970247507,2.2615787010324118,depthwise,1.3937189183941612,0.002861327259654762,7,7,0.42963026437155166,500,,0.6122619332465509,0.5233775630250976,0.03776682871885745,none,0.7022145426760082,1.9495558274449647,6.0,0.8012229279477255,,,,0.4255892731552191,,0.5567616463138851,0.5572139303482587,0.715281812899477,0.7156549520766773,0.6122619332465509,0.5233775630250976,0.05,0.4844734992977558,0.469056949281134,0.5567616463138851,0.5572139303482587,1.0,1.0,none,0.41104171156683633,0.37182496385126623,0.7022145426760082,0.5,COMPLETE
1895,0.20182440136830102,2025-11-27 11:17:25.016997,2025-11-27 11:17:55.658464,0 days 00:00:30.641467,23.418953368367124,dart,0.5838722354178145,8.210460704571974,depthwise,0.0007188129623903125,0.0007172199381711986,9,10,2.5832779247118625,500,forest,0.6203934204910668,0.5639275104731201,0.08325961533454587,undersample,0.8866903676381408,,8.0,0.8576112639140434,0.09332004813676115,weighted,0.11691417058471919,0.5577967080223118,,0.3749434644957033,0.36680235187697874,0.21387940841865757,0.20182440136830102,0.6203934204910668,0.5639275104731201,0.08,0.52621349371862,0.5258749495914962,0.3567362428842505,0.3390804597701149,0.15272136474411047,0.14366883116883117,undersample,0.4034014986985859,0.3956342112943237,0.8866903676381408,0.5,COMPLETE
1896,0.0,2025-11-27 11:17:55.855908,2025-11-27 11:19:10.996607,0 days 00:01:15.140699,0.00010281856134005474,dart,0.47529658957833193,7.821373294385106,depthwise,21.01208676744827,0.01679393263632909,9,8,3.472182162759376,900,tree,0.8950541763822981,0.8873814676548315,0.0660768968684528,undersample,0.5415083451467112,,11.0,0.6376222203654134,0.36839631947025153,uniform,0.1610198033353022,0.9789015970271562,,0.44323835368611486,0.4427860696517413,0.0,0.0,0.8950541763822981,0.8873814676548315,0.08,0.5567616463138851,0.5572139303482587,0.0,0.0,0.0,0.0,undersample,0.5,0.5,0.5415083451467112,0.5,COMPLETE
1897,0.0,2025-11-27 11:19:11.195807,2025-11-27 11:19:11.860881,0 days 00:00:00.665074,0.021429868956753185,gbtree,0.3452178442357371,7.574921665765722,lossguide,0.0006220654203640891,0.1982941761701812,8,7,1.0499663037470943,600,,0.7144532415747884,0.49772593150512057,0.01271552948557987,none,0.9717454529557055,0.5475541522497037,8.0,0.8324673529670497,,,,0.6314870691420351,,0.44323835368611486,0.4427860696517413,0.0,0.0,0.7144532415747884,0.49772593150512057,0.02,0.5088801830926231,0.5235725302166829,0.0,0.0,0.0,0.0,none,0.3995958984731179,0.41394943156945196,0.9717454529557055,0.5,COMPLETE
1898,0.7156549520766773,2025-11-27 11:19:12.062841,2025-11-27 11:19:14.227084,0 days 00:00:02.164243,0.0005480584593840222,gbtree,0.8883366666340717,2.4904205880259833,depthwise,0.805409711140743,0.0024835244876371143,5,5,0.11287324619685127,700,,0.7145068554227731,0.6691173927321465,0.0729926200311533,none,0.9472818285130664,3.9272093875109175,10.0,0.7486067702029506,,,,0.7290843073593736,,0.5567616463138851,0.5572139303482587,0.715281812899477,0.7156549520766773,0.7145068554227731,0.6691173927321465,0.08,0.5360708528303993,0.5648069699547955,0.5567616463138851,0.5572139303482587,1.0,1.0,none,0.4767651983620418,0.49161200137962147,0.9472818285130664,0.5,COMPLETE
1899,0.7156549520766773,2025-11-27 11:19:14.432248,2025-11-27 11:19:15.063564,0 days 00:00:00.631316,0.00025466575069900594,gbtree,0.454497834466421,7.137544731778373,depthwise,66.00237321010835,0.17848837000975112,6,8,10.73034205224697,600,,0.8784922470343173,0.41248233007972906,0.027066720374550268,undersample,0.5588805652356985,,7.0,0.8567146477446881,,,,0.35009085073435203,,0.5567616463138851,0.5572139303482587,0.715281812899477,0.7156549520766773,0.8784922470343173,0.41248233007972906,0.02,0.5567616463138851,0.5572139303482587,0.5567616463138851,0.5572139303482587,1.0,1.0,undersample,0.5,0.5,0.5588805652356985,0.5,COMPLETE
1900,0.6407967032967034,2025-11-27 11:19:15.266798,2025-11-27 11:19:19.000493,0 days 00:00:03.733695,0.0009428708021695197,gbtree,0.7525624763624252,1.3943224378839747,lossguide,0.0001565512379255534,0.0227249736448229,4,8,0.18896962924110725,200,,0.8062281156460416,0.37204103832127977,0.09823291732815805,none,0.5714768616619066,1.0310783038146785,7.0,0.799234507835969,,,,0.37806201669906514,,0.5314337403889643,0.5269109000452284,0.6405274115197779,0.6407967032967034,0.8062281156460416,0.37204103832127977,0.08,0.5525257399267554,0.5447495574800867,0.5590551181102362,0.5553571428571429,0.7497969130787977,0.7573051948051948,none,0.49490707737197237,0.4879664513219161,0.5714768616619066,0.5,COMPLETE
1901,0.6874610106051154,2025-11-27 11:19:19.208902,2025-11-27 11:19:51.707842,0 days 00:00:32.498940,0.014090449817826796,dart,0.7320990869154935,9.499454677980209,depthwise,0.533795293769797,0.009050049155231837,9,5,1.4752596799944675,500,tree,0.9709220506627645,0.8193323583921444,0.042512346502480716,undersample,0.5066311201267886,,10.0,0.9057660216092749,0.34211433554898557,weighted,0.8524633540576331,0.3714693547564659,,0.5486205336951605,0.5468113975576662,0.6883198001249219,0.6874610106051154,0.9709220506627645,0.8193323583921444,0.05,0.551363651294331,0.57424255392312,0.5591070522577372,0.5582573454913881,0.8952071486596264,0.8944805194805194,undersample,0.47002437043054424,0.473821186474404,0.5066311201267886,0.5,COMPLETE
1902,0.5015344147303814,2025-11-27 11:19:51.911696,2025-11-27 11:20:03.288093,0 days 00:00:11.376397,0.059215256964686186,dart,0.2650108293107078,1.9218128376428567,depthwise,1.6014209722694897,0.0004352986662120106,6,5,98.61555796279897,300,tree,0.840230617428667,0.8727188561516348,0.06206329061880054,undersample,0.9043981923907167,,5.0,0.6801363528407118,0.10473240126438199,uniform,0.005720525505761409,0.22663622794198057,,0.46720940750791495,0.48575305291723203,0.4896013864818024,0.5015344147303814,0.840230617428667,0.8727188561516348,0.05,0.5676083930017014,0.5633760911670783,0.5246053853296193,0.5452812202097236,0.45897644191714054,0.4642857142857143,undersample,0.4993853512160348,0.49903244100128663,0.9043981923907167,0.5,COMPLETE
1903,0.7156549520766773,2025-11-27 11:20:03.488022,2025-11-27 11:20:04.405286,0 days 00:00:00.917264,0.28367919846824224,gbtree,0.257337260219676,8.126551577674924,depthwise,0.00038401426302500115,0.0010715530845152026,5,5,53.49946860573762,1000,,0.9624827464155049,0.8936582939188473,0.09391026716959802,none,0.807256380630188,2.235430574538592,12.0,0.6115816165182957,,,,0.3262012849787985,,0.5567616463138851,0.5572139303482587,0.715281812899477,0.7156549520766773,0.9624827464155049,0.8936582939188473,0.08,0.5390742644371023,0.5187758645890814,0.5567616463138851,0.5572139303482587,1.0,1.0,none,0.49793804605514014,0.4726533999708157,0.807256380630188,0.5,COMPLETE
1904,0.7156549520766773,2025-11-27 11:20:04.610797,2025-11-27 11:20:06.000258,0 days 00:00:01.389461,0.07993312039730091,gbtree,0.3954871031967615,5.033384629781011,depthwise,10.565252288488905,0.22402551113015823,0,9,2.362608951085244,900,,0.9082769614707945,0.44743594617310145,0.08426515038424413,none,0.7915168948801178,1.5466806799269377,12.0,0.6128089328751243,,,,0.6210943211042577,,0.5567616463138851,0.5572139303482587,0.715281812899477,0.7156549520766773,0.9082769614707945,0.44743594617310145,0.08,0.5376544814653547,0.5195441388216404,0.5567616463138851,0.5572139303482587,1.0,1.0,none,0.49476906115817565,0.47511458153695124,0.7915168948801178,0.5,COMPLETE
1905,0.6717927964386888,2025-11-27 11:20:06.202501,2025-11-27 11:20:06.651861,0 days 00:00:00.449360,0.6022325776403332,gbtree,0.8883544641531709,5.156704514975921,depthwise,22.630883094975623,0.005782901398068182,5,6,0.979265430547735,300,,0.8930887781725128,0.5583692325027528,0.05929351375771147,undersample,0.5439185249138971,,6.0,0.8908256951206598,,,,0.4956233200816404,,0.6327453640886477,0.6331976481230213,0.6707218167072182,0.6717927964386888,0.8930887781725128,0.5583692325027528,0.05,0.6426194521758278,0.6471627488759346,0.6696356275303643,0.6698950766747377,0.6718115353371243,0.6737012987012987,undersample,0.6335831164309753,0.6334858323494688,0.5439185249138971,0.5,COMPLETE
1906,0.7067491895078102,2025-11-27 11:20:06.853187,2025-11-27 11:20:07.247694,0 days 00:00:00.394507,0.014713219346907187,gbtree,0.3170120650172725,4.197470517935571,depthwise,31.1995616371674,0.43144157896679713,4,6,6.918347274764612,200,,0.565560187067542,0.8547271319422309,0.09874558514466669,oversample,0.615804590382981,,8.0,0.9186334867539323,,,,0.7977166084664589,,0.5517865219357757,0.5499773857982814,0.707928087238432,0.7067491895078102,0.565560187067542,0.8547271319422309,0.08,0.4493976182145361,0.4473726709390491,0.5555041628122109,0.5548357242017584,0.9756295694557271,0.9732142857142857,oversample,0.3364727531955106,0.32862971425918314,0.615804590382981,0.5,COMPLETE
1907,0.7156549520766773,2025-11-27 11:20:07.451977,2025-11-27 11:20:08.304687,0 days 00:00:00.852710,0.0043565466045725676,gbtree,0.6138504064163621,6.593617967637132,depthwise,0.06215473524675342,0.0028494694906011806,0,10,2.699366123869437,900,,0.8170782035127178,0.4575902577199169,0.030597089609181893,oversample,0.969347708135647,,11.0,0.9210550143932389,,,,0.4379883544546254,,0.5567616463138851,0.5572139303482587,0.715281812899477,0.7156549520766773,0.8170782035127178,0.4575902577199169,0.02,0.5796499236399644,0.574053221291112,0.5567616463138851,0.5572139303482587,1.0,1.0,oversample,0.5335880899882293,0.5210976778584031,0.969347708135647,0.5,COMPLETE
1908,0.7874739039665971,2025-11-27 11:20:08.502046,2025-11-27 11:21:06.459815,0 days 00:00:57.957769,0.49224229335352965,dart,0.4926616826152526,2.9596034754661504,depthwise,36.40812719349021,0.005163563748710906,6,3,53.823461468540906,700,tree,0.9578304244975036,0.2878749551929388,0.011368474100259596,undersample,0.6611371797841006,,10.0,0.7707612529679145,0.31854268456330265,weighted,0.5790540468224863,0.6664349132228626,,0.7648123021257349,0.7697874265038445,0.7781569965870307,0.7874739039665971,0.9578304244975036,0.2878749551929388,0.02,0.8205145508831004,0.8261087203225563,0.8194070080862533,0.8108340498710233,0.7408610885458976,0.765422077922078,undersample,0.7981175085793862,0.805041836355677,0.6611371797841006,0.5,COMPLETE
1909,0.2874768661320173,2025-11-27 11:21:06.670417,2025-11-27 11:23:10.161179,0 days 00:02:03.490762,0.028123467438136335,dart,0.7687488406163563,2.7258379648439135,lossguide,0.012582532402797763,0.028130916579471466,8,11,1.078277185785402,800,forest,0.6566436145307963,0.8737325028385394,0.07877690285240652,none,0.7323528353993543,0.7417959110466775,12.0,0.6266736218031027,0.48113878741452243,weighted,0.8548752955990468,0.861445978803872,,0.4785165083672546,0.47761194029850745,0.28695114409400124,0.2874768661320173,0.6566436145307963,0.8737325028385394,0.08,0.5478204791576884,0.5535434031657183,0.6010362694300518,0.5989717223650386,0.18846466287571081,0.1891233766233766,none,0.4742431903711931,0.49909172160832016,0.7323528353993543,0.5,COMPLETE
1910,0.46422182468694095,2025-11-27 11:23:10.356755,2025-11-27 11:23:11.323561,0 days 00:00:00.966806,0.00044696691251035615,gbtree,0.8242652046376115,5.107033625017568,lossguide,0.008684854940853748,0.0003130421586899519,1,11,27.2416368817069,900,,0.6943545679918716,0.7319466991922035,0.004867645966913714,undersample,0.698392000180863,,5.0,0.9488145301276205,,,,0.6737821907596588,,0.45092718227046585,0.45816372682044326,0.4698689956331878,0.46422182468694095,0.6943545679918716,0.7319466991922035,0.0,0.5354054767420624,0.5326126945051461,0.5080264400377715,0.5169322709163346,0.4370430544272949,0.4212662337662338,undersample,0.4696675176975746,0.4692118083652813,0.698392000180863,0.5,COMPLETE
1911,0.7156549520766773,2025-11-27 11:23:11.520223,2025-11-27 11:23:12.263095,0 days 00:00:00.742872,3.4997806024696296,gbtree,0.9063027326888609,7.673881686428226,depthwise,7.36754751187822,0.0005578630836413714,6,5,26.84073535957737,800,,0.8997819650112182,0.299084280524173,0.0709869774356372,oversample,0.6729323781670988,,9.0,0.8669249782349147,,,,0.27668963671101854,,0.5567616463138851,0.5572139303482587,0.715281812899477,0.7156549520766773,0.8997819650112182,0.299084280524173,0.08,0.5043569894648239,0.49865096625843985,0.5567616463138851,0.5572139303482587,1.0,1.0,oversample,0.35663348198743355,0.33739744040433517,0.6729323781670988,0.5,COMPLETE
1912,0.7156549520766773,2025-11-27 11:23:12.463992,2025-11-27 11:23:12.936942,0 days 00:00:00.472950,1.6782582095139873,gbtree,0.788767215842556,7.439484279843109,depthwise,13.815660310097728,0.00016332732379134644,9,4,26.064504600450874,300,,0.9833765389288506,0.2098284424862566,0.0627864204667689,none,0.9511585513305552,3.1986704868289335,5.0,0.7677764504447655,,,,0.33422880244694,,0.5567616463138851,0.5572139303482587,0.715281812899477,0.7156549520766773,0.9833765389288506,0.2098284424862566,0.05,0.5567616463138851,0.5572139303482587,0.5567616463138851,0.5572139303482587,1.0,1.0,none,0.5,0.5,0.9511585513305552,0.5,COMPLETE
1913,0.7156549520766773,2025-11-27 11:23:13.136895,2025-11-27 11:23:36.828788,0 days 00:00:23.691893,1.3706958205093962,dart,0.47220371295815844,7.723731077370296,lossguide,0.025356271490724887,0.45082517954341933,10,3,59.898063399002545,500,forest,0.8960154194725738,0.20521470434110617,0.09123162612058817,none,0.7433585773047799,1.4267462057820144,5.0,0.8049479291115439,0.3738936449327315,uniform,0.20518864976728388,0.7678147011674341,,0.5567616463138851,0.5572139303482587,0.715281812899477,0.7156549520766773,0.8960154194725738,0.20521470434110617,0.08,0.5567616463138851,0.5572139303482587,0.5567616463138851,0.5572139303482587,1.0,1.0,none,0.5,0.5,0.7433585773047799,0.5,COMPLETE
