number,value,datetime_start,datetime_complete,duration,params_alpha,params_booster,params_colsample_bytree,params_gamma,params_grow_policy,params_lambda,params_learning_rate,params_max_delta_step,params_max_depth,params_min_child_weight,params_n_estimators,params_normalize_type,params_params_feature_fraction,params_params_labeled_ratio,params_params_missing_rate,params_params_resampling,params_params_sample_rows,params_params_scale_pos_weight,params_params_selftrain_max_iter,params_params_selftrain_threshold,params_rate_drop,params_sample_type,params_skip_drop,params_subsample,params_user_attrs_decision_threshold,user_attrs_acc_test,user_attrs_acc_val,user_attrs_f1_test,user_attrs_f1_val,user_attrs_feature_fraction,user_attrs_labeled_ratio,user_attrs_missing_rate,user_attrs_pr_auc_test,user_attrs_pr_auc_val,user_attrs_prec_test,user_attrs_prec_val,user_attrs_rec_test,user_attrs_rec_val,user_attrs_resampling_strategy,user_attrs_roc_auc_test,user_attrs_roc_auc_val,user_attrs_sample_rows,user_attrs_user_attrs_decision_threshold,state
2660,0.7156549520766773,2025-11-30 16:07:35.795284,2025-11-30 16:07:36.188712,0 days 00:00:00.393428,1.101916908163797,gbtree,0.28118351248803475,5.163860435666612,lossguide,1.4672250329365484,0.012357255321311444,0,10,0.11906344371109193,200,,0.7020878731351818,0.6146507361980442,0.03206444016365401,oversample,0.9048447473222011,,7.0,0.9475867863361171,,,,0.674702074103188,,0.5567616463138851,0.5572139303482587,0.715281812899477,0.7156549520766773,0.7020878731351818,0.6146507361980442,0.08,0.6186335655139649,0.6164587891503733,0.5567616463138851,0.5572139303482587,1.0,1.0,oversample,0.5961662162834264,0.5781165017311596,0.9048447473222011,0.5,COMPLETE
2661,0.22004662004662004,2025-11-30 16:07:36.978090,2025-11-30 16:07:37.731696,0 days 00:00:00.753606,0.00035283856376061644,gbtree,0.9975617661274474,8.806286986034547,depthwise,0.058963254787265065,0.0848676089817,4,5,21.81290994013624,800,,0.6531546994424602,0.26619916298999907,0.03327663208346893,undersample,0.9663600019920624,,5.0,0.7230171301547427,,,,0.7638397434020274,,0.23337856173677068,0.2433288104929896,0.22567382366377342,0.22004662004662004,0.6531546994424602,0.26619916298999907,0.08,0.4558650325933625,0.46261736195092334,0.2578288100208768,0.25848849945235486,0.20064987814784727,0.19155844155844157,undersample,0.23881819990384454,0.2596270876722868,0.9663600019920624,0.5,COMPLETE
2662,0.7167832167832168,2025-11-30 16:07:38.539834,2025-11-30 16:09:49.634468,0 days 00:02:11.094634,0.0017558137780352124,dart,0.5622941877258965,7.262158609655879,depthwise,0.00045292830237859304,0.04230127228705517,8,7,1.7491977757677777,1000,tree,0.7114092410121002,0.829118924672984,0.03785809456969063,oversample,0.679530488581125,,7.0,0.8592299946774435,0.07546456944920776,weighted,0.7746630004089983,0.32798025713646506,,0.5572139303482587,0.5603799185888738,0.7151585685190573,0.7167832167832168,0.7114092410121002,0.829118924672984,0.08,0.6110679038677251,0.6218915745864552,0.557116953762466,0.5590909090909091,0.9983753046303818,0.9983766233766234,oversample,0.5996062600507303,0.5915512283936697,0.679530488581125,0.5,COMPLETE
2663,0.7156549520766773,2025-11-30 16:09:50.418433,2025-11-30 16:11:08.257846,0 days 00:01:17.839413,0.048080479699725724,dart,0.42692257859043165,2.7380477044336295,lossguide,0.0006838602313307207,0.003267545986511398,3,7,15.834208351685767,800,forest,0.6700873811204429,0.4193391342239521,0.02018499632857598,oversample,0.5991536725153537,,6.0,0.6743845435943361,0.17716910641718414,uniform,0.45552034752612586,0.3439810586554227,,0.5567616463138851,0.5572139303482587,0.715281812899477,0.7156549520766773,0.6700873811204429,0.4193391342239521,0.08,0.5037195929445368,0.4773609349511099,0.5567616463138851,0.5572139303482587,1.0,1.0,oversample,0.3899111391103964,0.3706546900494807,0.5991536725153537,0.5,COMPLETE
2664,0.28382502543234994,2025-11-30 16:11:09.034837,2025-11-30 16:11:09.546607,0 days 00:00:00.511770,8.454089269044479,gbtree,0.40727251246074403,7.6934110606401,depthwise,29.681518264363817,0.2272493250013343,10,10,0.865894613441419,400,,0.5569726016449569,0.7132449320650069,0.08914585071580171,undersample,0.7578369515207712,,6.0,0.9308332790142322,,,,0.26422513719631724,,0.35956580732700133,0.36318407960199006,0.2834008097165992,0.28382502543234994,0.5569726016449569,0.7132449320650069,0.08,0.5156094435201981,0.5171065619652895,0.37583892617449666,0.3801089918256131,0.22745735174654752,0.22646103896103897,undersample,0.37648377791409005,0.38085053990952866,0.7578369515207712,0.5,COMPLETE
2665,0.0,2025-11-30 16:11:10.327578,2025-11-30 16:11:10.901162,0 days 00:00:00.573584,79.8170430370414,gbtree,0.49604098398902985,3.9987630099131675,depthwise,0.0003343478154082643,0.16940933735718616,5,6,21.63074566566059,500,,0.9883912118807334,0.7582624013548447,0.06751771123768781,none,0.6652456573613668,0.643582461177942,8.0,0.9349060272607561,,,,0.934143343161411,,0.44323835368611486,0.4427860696517413,0.0,0.0,0.9883912118807334,0.7582624013548447,0.08,0.5567616463138851,0.5572139303482587,0.0,0.0,0.0,0.0,none,0.5,0.5,0.6652456573613668,0.5,COMPLETE
2666,0.23434535104364326,2025-11-30 16:11:11.699613,2025-11-30 16:11:12.160900,0 days 00:00:00.461287,8.491904025833065,gbtree,0.9757589733245868,6.764179985157522,lossguide,9.973099697818848,0.0034549372625351468,3,4,15.353662903193895,300,,0.9894112118810399,0.8696725100654918,0.007827209428357618,undersample,0.6511803270113508,,8.0,0.7456469139173427,,,,0.35335227204901926,,0.26820443238353686,0.2700135685210312,0.22509578544061304,0.23434535104364326,0.9894112118810399,0.8696725100654918,0.08,0.3870793357805792,0.39038141153023376,0.2742123687281214,0.2819634703196347,0.1909017059301381,0.200487012987013,undersample,0.16868399675060927,0.1743770147115397,0.6511803270113508,0.5,COMPLETE
2667,0.37253960633701394,2025-11-30 16:11:12.944222,2025-11-30 16:11:13.807978,0 days 00:00:00.863756,11.841619845926775,gbtree,0.7154915717669885,2.7003770160860796,depthwise,0.016995958759580498,0.028782204332278388,1,12,0.21564240986876973,900,,0.8472836366520027,0.6624198228512215,0.03583907597039764,undersample,0.8404139230487151,,8.0,0.8307610877828326,,,,0.4932221397683478,,0.4075079149706015,0.4088647670737223,0.35340572556762095,0.37253960633701394,0.8472836366520027,0.6624198228512215,0.08,0.4942943407988737,0.5023395451593582,0.45031446540880504,0.45593419506462984,0.2908204711616572,0.31493506493506496,undersample,0.4134319202904557,0.41503720998103016,0.8404139230487151,0.5,COMPLETE
2668,0.0,2025-11-30 16:11:14.595982,2025-11-30 16:11:14.967793,0 days 00:00:00.371811,12.802792962851314,gbtree,0.5578782459794867,5.033925546673022,lossguide,14.597296963774173,0.043560389896503016,0,7,9.471047078845414,200,,0.8476344943636611,0.5928169319111642,0.046653350159722246,undersample,0.5469813494556099,,8.0,0.8370866311280268,,,,0.8514427737473553,,0.44323835368611486,0.4427860696517413,0.0,0.0,0.8476344943636611,0.5928169319111642,0.08,0.5567616463138851,0.5572139303482587,0.0,0.0,0.0,0.0,undersample,0.5,0.5,0.5469813494556099,0.5,COMPLETE
2669,0.710994459025955,2025-11-30 16:11:15.747977,2025-11-30 16:11:16.312968,0 days 00:00:00.564991,0.5353697146130492,gbtree,0.8225821683788013,3.5199940670094043,depthwise,0.00013422929837848558,0.05707724593272733,0,6,0.3780095927240069,500,,0.6049758986460394,0.5336438298471353,0.028243607719932885,oversample,0.556755992400012,,12.0,0.7161358105894567,,,,0.960280473886443,,0.5531433740388965,0.5517865219357757,0.7122888759464182,0.710994459025955,0.6049758986460394,0.5336438298471353,0.08,0.5386698793081299,0.52882228613167,0.5551520653654108,0.5548475193445608,0.9935012185215272,0.989448051948052,oversample,0.42994288698420063,0.42385675483862406,0.556755992400012,0.5,COMPLETE
2670,0.4458149779735683,2025-11-30 16:11:17.097982,2025-11-30 16:11:18.116820,0 days 00:00:01.018838,0.001413111449708667,gbtree,0.7156510384657053,0.43108007519667146,depthwise,2.1280792566276894,0.1245277502035318,6,11,52.60371392140435,700,,0.9982035473706594,0.6993167880703337,0.07915472244460818,undersample,0.5139425253873839,,11.0,0.8797935016973915,,,,0.8850340249669846,,0.42152872003618275,0.431026684758028,0.43331856446610545,0.4458149779735683,0.9982035473706594,0.6993167880703337,0.08,0.47458589999130474,0.4773285274432931,0.4766081871345029,0.48747591522157996,0.3972380178716491,0.4107142857142857,undersample,0.4058795736003581,0.41551850218218966,0.5139425253873839,0.5,COMPLETE
2671,0.43316412859560066,2025-11-30 16:11:18.916371,2025-11-30 16:11:22.100490,0 days 00:00:03.184119,0.17934073221645155,gbtree,0.8677307586186691,0.20918805735310464,lossguide,0.4413740929892819,0.15750823763884506,0,4,0.14218169314087029,700,,0.7617217353643647,0.23018001162636134,0.04023324457238328,undersample,0.7695044706198975,,10.0,0.7543089265112815,,,,0.994000319691813,,0.40388964269561284,0.3939393939393939,0.45174708818635606,0.43316412859560066,0.7617217353643647,0.23018001162636134,0.08,0.4705862567316177,0.4611406941895944,0.4629156010230179,0.45229681978798586,0.44110479285134035,0.4155844155844156,undersample,0.3620061672109949,0.3472869380364273,0.7695044706198975,0.5,COMPLETE
2672,0.0,2025-11-30 16:11:22.886880,2025-11-30 16:11:23.510242,0 days 00:00:00.623362,80.51701023849387,gbtree,0.25803724853353593,0.8689851752961963,lossguide,45.0075375982133,0.4583410611309246,8,11,0.17288727279610883,600,,0.9043226302523251,0.800705308296418,0.06670274756083688,none,0.8493282992064117,0.7170887186277001,5.0,0.8198115241544192,,,,0.3533914905995846,,0.44323835368611486,0.4427860696517413,0.0,0.0,0.9043226302523251,0.800705308296418,0.08,0.5567616463138851,0.5572139303482587,0.0,0.0,0.0,0.0,none,0.5,0.5,0.8493282992064117,0.5,COMPLETE
2673,0.7156549520766773,2025-11-30 16:11:24.301301,2025-11-30 16:14:55.438334,0 days 00:03:31.137033,0.003248445950216175,dart,0.7621068254887677,0.18199774795820578,depthwise,0.0006683525193881087,0.2072732978139533,5,4,90.9523651653346,1000,forest,0.8375328774108097,0.4485665723294292,0.07534114675643484,none,0.8190567281290326,1.9436004166630805,9.0,0.7140659001349853,0.2363375869258733,uniform,0.04353582414551787,0.3602214517542292,,0.5567616463138851,0.5572139303482587,0.715281812899477,0.7156549520766773,0.8375328774108097,0.4485665723294292,0.08,0.4229962163017529,0.4306759902423055,0.5567616463138851,0.5572139303482587,1.0,1.0,none,0.28550290953099355,0.3019252517145775,0.8190567281290326,0.5,COMPLETE
2674,0.28893058161350843,2025-11-30 16:14:56.224216,2025-11-30 16:15:59.776719,0 days 00:01:03.552503,0.10154259323636756,dart,0.3398539293353766,9.546303611233725,depthwise,0.11961511478980794,0.0012901268679705732,4,6,0.145826437842208,700,forest,0.7802059446097616,0.21508353594354557,0.02603184588948957,undersample,0.5875314033672556,,8.0,0.8567238612665223,0.13890974778735998,uniform,0.8500486119301374,0.6470931637771191,,0.48846675712347354,0.48575305291723203,0.2996904024767802,0.28893058161350843,0.7802059446097616,0.21508353594354557,0.08,0.6079217864048523,0.6106428091195588,0.6302083333333334,0.6294277929155313,0.1965881397238018,0.1875,undersample,0.6015608680515261,0.6043189445896289,0.5875314033672556,0.5,COMPLETE
2675,0.7156549520766773,2025-11-30 16:16:00.567492,2025-11-30 16:16:01.208735,0 days 00:00:00.641243,31.032079743524598,gbtree,0.7558292404714846,7.587158065135063,lossguide,0.34092132372254463,0.19510240302749468,0,3,15.872477799297211,600,,0.8275573621664972,0.6458501289408018,0.03504712854803456,none,0.9215192989868242,1.0116143326311113,9.0,0.6119705703359144,,,,0.9762851842562621,,0.5567616463138851,0.5572139303482587,0.715281812899477,0.7156549520766773,0.8275573621664972,0.6458501289408018,0.08,0.5567616463138851,0.5572139303482587,0.5567616463138851,0.5572139303482587,1.0,1.0,none,0.5,0.5,0.9215192989868242,0.5,COMPLETE
2676,0.6652037617554859,2025-11-30 16:16:01.990991,2025-11-30 16:16:02.880903,0 days 00:00:00.889912,0.0021188848454027714,gbtree,0.2110166872313286,4.0081735003545536,lossguide,0.0015388977183043758,0.08021307233272552,7,5,0.11045999640697368,1000,,0.8890724150472415,0.662011980391751,0.0099475068748332,oversample,0.9417911948349562,,12.0,0.883590427157047,,,,0.5065490666324487,,0.5110809588421529,0.5169606512890095,0.6610222640326121,0.6652037617554859,0.8890724150472415,0.662011980391751,0.08,0.4867032571704545,0.49593181232796985,0.5383043922369765,0.541879468845761,0.8562144597887896,0.8612012987012987,oversample,0.40463245411893434,0.41761363636363635,0.9417911948349562,0.5,COMPLETE
2677,0.7156549520766773,2025-11-30 16:16:03.671273,2025-11-30 16:16:04.464751,0 days 00:00:00.793478,86.74236386925288,gbtree,0.5018274179668354,5.233910540984929,depthwise,0.10837549364123734,0.18842589233788673,9,6,13.52661686276318,900,,0.7749240866498162,0.5052800390480394,0.09189440014309119,undersample,0.9000496252886953,,10.0,0.811521256739281,,,,0.3638000297999976,,0.5567616463138851,0.5572139303482587,0.715281812899477,0.7156549520766773,0.7749240866498162,0.5052800390480394,0.1,0.5567616463138851,0.5572139303482587,0.5567616463138851,0.5572139303482587,1.0,1.0,undersample,0.5,0.5,0.9000496252886953,0.5,COMPLETE
2678,0.49340369393139843,2025-11-30 16:16:05.246803,2025-11-30 16:16:36.600015,0 days 00:00:31.353212,0.005985713351941994,dart,0.709350129341775,4.865745919829005,lossguide,6.819293806871588,0.05345977615134011,9,5,18.616911052067834,500,forest,0.8025475503203554,0.5016821901861928,0.09385239570092914,undersample,0.8682524950803167,,7.0,0.6121355002036679,0.3469889393488442,weighted,0.8048587321950382,0.6438362373053914,,0.45680687471732245,0.4789687924016282,0.46359982134881644,0.49340369393139843,0.8025475503203554,0.5016821901861928,0.1,0.5217687994608466,0.5301127478322375,0.5148809523809523,0.5383877159309021,0.421608448415922,0.45535714285714285,undersample,0.4660007626121122,0.48915537986018065,0.8682524950803167,0.5,COMPLETE
2679,0.3963886500429923,2025-11-30 16:16:37.403073,2025-11-30 16:16:57.975849,0 days 00:00:20.572776,0.00044520713033060144,dart,0.49447128900416504,4.21478410067356,depthwise,0.07707289854623134,0.0002860136240127677,1,12,14.491751038402358,400,forest,0.6526391913849452,0.47694379105365575,0.07789641449549023,undersample,0.6924487273507292,,5.0,0.7974747623285656,0.17337471334354693,uniform,0.5969386950578399,0.5842585644374673,,0.35911352329262775,0.3649932157394844,0.39158437097466725,0.3963886500429923,0.6526391913849452,0.47694379105365575,0.08,0.43736859756721486,0.4435994082534667,0.41530054644808745,0.42138939670932357,0.3704305442729488,0.3741883116883117,undersample,0.3027495482352161,0.3110722908348036,0.6924487273507292,0.5,COMPLETE
2680,0.7156549520766773,2025-11-30 16:16:58.761110,2025-11-30 16:16:59.597085,0 days 00:00:00.835975,10.320556482946948,gbtree,0.43593426816180314,8.340817811879674,depthwise,40.60581686509573,0.0001468725156870035,2,5,6.151753521498535,900,,0.8084203842799742,0.5812131629792834,0.09109904004948953,none,0.854811021194246,2.2896536500016156,11.0,0.7751036443250507,,,,0.24949335201362707,,0.5567616463138851,0.5572139303482587,0.715281812899477,0.7156549520766773,0.8084203842799742,0.5812131629792834,0.1,0.45741557141470673,0.46180322960962117,0.5567616463138851,0.5572139303482587,1.0,1.0,none,0.3183375055952519,0.32285254964647203,0.854811021194246,0.5,COMPLETE
2681,0.7156549520766773,2025-11-30 16:17:00.379625,2025-11-30 16:17:01.145069,0 days 00:00:00.765444,0.0025821424213647165,gbtree,0.20880212210583135,5.369713822990418,depthwise,0.0003274499488399014,0.04668839741528868,7,9,2.47919545743118,800,,0.6807245729257771,0.57106016007626,0.029920875554760862,none,0.7711838529775177,2.134787609851256,9.0,0.8983807889804243,,,,0.7456988580502188,,0.5567616463138851,0.5572139303482587,0.715281812899477,0.7156549520766773,0.6807245729257771,0.57106016007626,0.08,0.5682857885291384,0.5682559199246865,0.5567616463138851,0.5572139303482587,1.0,1.0,none,0.5222939703907559,0.5248277960548134,0.7711838529775177,0.5,COMPLETE
2682,0.7156549520766773,2025-11-30 16:17:01.940693,2025-11-30 16:17:23.567711,0 days 00:00:21.627018,2.034673410936291,dart,0.2929896007971058,8.535715713740512,depthwise,0.00562517295083326,0.00022078426073795726,4,12,3.992796943122406,400,forest,0.5794692893320135,0.2685512566182106,0.03899687192109839,none,0.505686888447814,1.6141501331928299,9.0,0.7455660748796261,0.026275267970120364,uniform,0.4242558860766129,0.9921542204394502,,0.5567616463138851,0.5572139303482587,0.715281812899477,0.7156549520766773,0.5794692893320135,0.2685512566182106,0.08,0.5567616463138851,0.5572139303482587,0.5567616463138851,0.5572139303482587,1.0,1.0,none,0.5,0.5,0.505686888447814,0.5,COMPLETE
2683,0.7156549520766773,2025-11-30 16:17:24.346684,2025-11-30 16:17:25.124849,0 days 00:00:00.778165,0.046902969648244905,gbtree,0.26165120387218166,9.160058165625045,depthwise,2.269251505109992,0.16987261537540832,1,12,3.4970477194039957,900,,0.7096713929666856,0.5477371099149371,0.05684975217495262,oversample,0.6018761700635795,,8.0,0.6866236641855464,,,,0.9996676568536553,,0.5567616463138851,0.5572139303482587,0.715281812899477,0.7156549520766773,0.7096713929666856,0.5477371099149371,0.08,0.52621349371862,0.5258749495914962,0.5567616463138851,0.5572139303482587,1.0,1.0,oversample,0.4034014986985859,0.3956342112943237,0.6018761700635795,0.5,COMPLETE
2684,0.7156549520766773,2025-11-30 16:17:25.882589,2025-11-30 16:17:26.601459,0 days 00:00:00.718870,3.3018936081898245,gbtree,0.9498936920616639,9.884277639281454,lossguide,3.625379716548937,0.010595624306610927,9,3,26.71854448396761,800,,0.6050390316915231,0.23142478572269545,0.07646417805171231,oversample,0.848861749524633,,6.0,0.6045199041534125,,,,0.2354609516490183,,0.5567616463138851,0.5572139303482587,0.715281812899477,0.7156549520766773,0.6050390316915231,0.23142478572269545,0.08,0.47700911103526256,0.48257345853305883,0.5567616463138851,0.5572139303482587,1.0,1.0,oversample,0.3288387572738275,0.3397989268137378,0.848861749524633,0.5,COMPLETE
2685,0.7156549520766773,2025-11-30 16:17:27.360323,2025-11-30 16:17:27.740352,0 days 00:00:00.380029,34.01964714748843,gbtree,0.6451817359694593,9.66279396890969,depthwise,2.258377068369144,0.03764482353461112,4,4,47.08813931443201,200,,0.9952471859383063,0.7103975875786017,0.006202158192493279,none,0.7881976681408347,0.8879507119919324,8.0,0.8420132169878367,,,,0.6400594694413189,,0.5567616463138851,0.5572139303482587,0.715281812899477,0.7156549520766773,0.9952471859383063,0.7103975875786017,0.08,0.5567616463138851,0.5572139303482587,0.5567616463138851,0.5572139303482587,1.0,1.0,none,0.5,0.5,0.7881976681408347,0.5,COMPLETE
2686,0.0,2025-11-30 16:17:28.502514,2025-11-30 16:17:33.937487,0 days 00:00:05.434973,0.00034201876933739395,dart,0.3680943450106897,5.098488310517507,lossguide,0.001019076530791174,0.20303879472648412,0,6,1.8657900787207113,200,tree,0.8841437553159089,0.7641044949067379,0.06447744888852162,none,0.5066580546368677,0.6922339968033038,10.0,0.9481146791899896,0.07645513230772333,uniform,0.7704249589212024,0.9612317920969711,,0.44323835368611486,0.4427860696517413,0.0,0.0,0.8841437553159089,0.7641044949067379,0.08,0.5712003938839147,0.5707540295796223,0.0,0.0,0.0,0.0,none,0.5258450902700642,0.5242913687436159,0.5066580546368677,0.5,COMPLETE
2687,0.7156549520766773,2025-11-30 16:17:34.704500,2025-11-30 16:18:06.797216,0 days 00:00:32.092716,91.45238498392834,dart,0.6899197371014978,8.671916045960355,depthwise,0.0009499217864775442,0.0015168254227642323,9,10,1.5974685841997731,500,tree,0.6392764538033889,0.6290965415357044,0.06744912164366487,undersample,0.6205764773845445,,10.0,0.632036579817603,0.29574365654173806,uniform,0.832666368217124,0.5932510217116362,,0.5567616463138851,0.5572139303482587,0.715281812899477,0.7156549520766773,0.6392764538033889,0.6290965415357044,0.08,0.5567616463138851,0.5572139303482587,0.5567616463138851,0.5572139303482587,1.0,1.0,undersample,0.5,0.5,0.6205764773845445,0.5,COMPLETE
2688,0.1410842586544742,2025-11-30 16:18:07.565087,2025-11-30 16:18:08.067635,0 days 00:00:00.502548,0.9512248137630617,gbtree,0.25030660533578764,3.511195716225861,depthwise,80.5680953649183,0.0022254679473060228,2,7,55.1028223599012,400,,0.6779554712788975,0.38159011833549156,0.06965512928161027,undersample,0.5566228855583147,,6.0,0.935642091819436,,,,0.5045962184344557,,0.4079601990049751,0.4052464947987336,0.13138686131386862,0.1410842586544742,0.6779554712788975,0.38159011833549156,0.08,0.5219120132548908,0.5202512499358968,0.358695652173913,0.3612040133779264,0.08042242079610074,0.08766233766233766,undersample,0.4409638753958122,0.44217736425984644,0.5566228855583147,0.5,COMPLETE
2689,0.7156549520766773,2025-11-30 16:18:08.853275,2025-11-30 16:19:48.906532,0 days 00:01:40.053257,7.516589241772085,dart,0.9727311804326402,7.751212389672208,lossguide,0.17222177697065608,0.20746244759870378,2,6,65.67915048443551,1000,forest,0.7959389267688188,0.6396924262845083,0.09053202940488563,none,0.8773372545279567,1.1106763812062517,6.0,0.8778503604770651,0.2860014930167511,uniform,0.08071101818297541,0.9317867634255375,,0.5567616463138851,0.5572139303482587,0.715281812899477,0.7156549520766773,0.7959389267688188,0.6396924262845083,0.1,0.525319142070764,0.5249125891566854,0.5567616463138851,0.5572139303482587,1.0,1.0,none,0.3335789717999304,0.31734069684146293,0.8773372545279567,0.5,COMPLETE
