number,value,datetime_start,datetime_complete,duration,params_alpha,params_booster,params_colsample_bytree,params_gamma,params_grow_policy,params_lambda,params_learning_rate,params_max_delta_step,params_max_depth,params_min_child_weight,params_n_estimators,params_normalize_type,params_params_feature_fraction,params_params_labeled_ratio,params_params_missing_rate,params_params_resampling,params_params_sample_rows,params_params_scale_pos_weight,params_params_selftrain_max_iter,params_params_selftrain_threshold,params_rate_drop,params_sample_type,params_skip_drop,params_subsample,params_user_attrs_decision_threshold,user_attrs_acc_test,user_attrs_acc_val,user_attrs_f1_test,user_attrs_f1_val,user_attrs_feature_fraction,user_attrs_labeled_ratio,user_attrs_missing_rate,user_attrs_pr_auc_test,user_attrs_pr_auc_val,user_attrs_prec_test,user_attrs_prec_val,user_attrs_rec_test,user_attrs_rec_val,user_attrs_resampling_strategy,user_attrs_roc_auc_test,user_attrs_roc_auc_val,user_attrs_sample_rows,user_attrs_user_attrs_decision_threshold,state
1914,0.7156549520766773,2025-11-27 11:23:37.034299,2025-11-27 11:23:37.568675,0 days 00:00:00.534376,0.0018256687945837884,gbtree,0.8128033007647624,9.728883211260253,lossguide,0.00036846991242810655,0.0018362015205402112,2,4,7.984315073307436,400,,0.6941435485013993,0.5558184397788258,0.07605517645166887,none,0.8590137983864726,1.1273168004745775,7.0,0.6459108042932544,,,,0.4215546678276339,,0.5567616463138851,0.5572139303482587,0.715281812899477,0.7156549520766773,0.6941435485013993,0.5558184397788258,0.08,0.6069690400140899,0.5987607428863468,0.5567616463138851,0.5572139303482587,1.0,1.0,none,0.5286335980371026,0.5219135116670868,0.8590137983864726,0.5,COMPLETE
1915,0.424953095684803,2025-11-27 11:23:37.771970,2025-11-27 11:23:38.303427,0 days 00:00:00.531457,0.03018878681176478,gbtree,0.8056144133599641,1.905144905439351,lossguide,82.04620326966727,0.0008407438237023601,7,11,0.3121556993710036,400,,0.5724281876643837,0.28311510392012623,0.0701678310582158,undersample,0.6598256334693573,,9.0,0.9248539694062734,,,,0.5167738634099686,,0.45364088647670736,0.44549977385798284,0.40492610837438425,0.424953095684803,0.5724281876643837,0.28311510392012623,0.08,0.4489361462730468,0.44347123079586515,0.5143929912390488,0.5033333333333333,0.3338748984565394,0.3676948051948052,undersample,0.3207078200898556,0.31398864797102793,0.6598256334693573,0.5,COMPLETE
1916,0.7156549520766773,2025-11-27 11:23:38.504132,2025-11-27 11:25:03.772750,0 days 00:01:25.268618,76.0093456582622,dart,0.782958318934593,9.255149725251341,lossguide,8.94318811814958,0.016245636041826206,5,7,2.3704197263324347,800,forest,0.8574149979511367,0.8671136449665333,0.07189489921540744,undersample,0.5916353735940596,,5.0,0.6151621918867458,0.03049851781821672,uniform,0.8922809794523785,0.9513863533708413,,0.5567616463138851,0.5572139303482587,0.715281812899477,0.7156549520766773,0.8574149979511367,0.8671136449665333,0.08,0.5567616463138851,0.5572139303482587,0.5567616463138851,0.5572139303482587,1.0,1.0,undersample,0.5,0.5,0.5916353735940596,0.5,COMPLETE
1917,0.3857677902621723,2025-11-27 11:25:03.980151,2025-11-27 11:25:36.276517,0 days 00:00:32.296366,0.573515926711964,dart,0.43644417794889345,1.7701665109231846,depthwise,29.414135716794345,0.06566482974336242,9,9,60.77994008770449,500,forest,0.5554516206120806,0.5718726047359857,0.030479689065884122,undersample,0.764466260501222,,12.0,0.6695433336474159,0.10228954625504127,uniform,0.4934941007196029,0.8444855329258651,,0.4319312528267752,0.40660334690185435,0.4185185185185185,0.3857677902621723,0.5554516206120806,0.5718726047359857,0.02,0.48801627123699604,0.47324147628681795,0.4865446716899892,0.4557522123893805,0.36718115353371245,0.3344155844155844,undersample,0.38889777681990745,0.3597408401098391,0.764466260501222,0.5,COMPLETE
1918,0.3869900771775083,2025-11-27 11:25:36.484227,2025-11-27 11:25:37.244415,0 days 00:00:00.760188,0.004024124995340761,gbtree,0.9797467582867134,0.6675554834442066,depthwise,0.000982071700038652,0.002338704362122519,7,3,29.380126641922548,400,,0.9609867069427616,0.2561436370713128,0.04916278651973374,none,0.7781938761190228,0.7310343680652209,10.0,0.6482699386460828,,,,0.6992642413130402,,0.5047489823609227,0.4970601537765717,0.3986820428336079,0.3869900771775083,0.9609867069427616,0.2561436370713128,0.05,0.6180334107028509,0.6167812915924937,0.6152542372881356,0.6030927835051546,0.29488220958570266,0.2849025974025974,none,0.6412788673552281,0.6355830392794131,0.7781938761190228,0.5,COMPLETE
1919,0.19467213114754098,2025-11-27 11:25:37.470098,2025-11-27 11:26:08.578395,0 days 00:00:31.108297,0.6933525587337126,dart,0.6147924371100687,7.592362322417372,lossguide,0.000277931788754993,0.00029910845300680126,4,7,0.12147609688108402,500,forest,0.5008374970369105,0.5735967982259007,0.04719647572483107,undersample,0.554362906632504,,9.0,0.6527537752644509,0.07562728590487783,weighted,0.050438826339905,0.630025161075476,,0.310719131614654,0.28900949796472186,0.2111801242236025,0.19467213114754098,0.5008374970369105,0.5735967982259007,0.05,0.4835134131488026,0.4674615846204626,0.29101283880171186,0.2638888888888889,0.16571892770105606,0.15422077922077923,undersample,0.38170228286277963,0.33880898213124977,0.554362906632504,0.5,COMPLETE
1920,0.300531914893617,2025-11-27 11:26:08.783055,2025-11-27 11:26:41.387653,0 days 00:00:32.604598,30.352875360336725,dart,0.7017530356461028,0.6788143433830562,lossguide,1.1519848219971545,0.005377159419593678,10,4,2.7008982589546386,500,tree,0.8735934035134224,0.7441894921255916,0.08850501127176502,undersample,0.960271621110593,,8.0,0.9083296721508565,0.2463424376274737,weighted,0.850507050639605,0.690754186802475,,0.3093622795115332,0.2862957937584803,0.3340601831661579,0.300531914893617,0.8735934035134224,0.7441894921255916,0.08,0.41402865840094993,0.4095131269463418,0.3606403013182674,0.3310546875,0.31112916328188467,0.27516233766233766,undersample,0.262142940035478,0.24903658649828211,0.960271621110593,0.5,COMPLETE
1921,0.7156549520766773,2025-11-27 11:26:41.592058,2025-11-27 11:26:46.344649,0 days 00:00:04.752591,0.000489968858141194,dart,0.5181257604765397,8.028693878272374,depthwise,0.0001002079751098703,0.10591583706858489,10,4,2.1179144875187155,200,forest,0.566918264035248,0.3461316546262526,0.06175294326584521,oversample,0.5294522352211334,,5.0,0.7480565671964026,0.21234885284598076,uniform,0.060267467354673,0.49467461149425174,,0.5567616463138851,0.5572139303482587,0.715281812899477,0.7156549520766773,0.566918264035248,0.3461316546262526,0.05,0.6186198056830603,0.6253912438590572,0.5567616463138851,0.5572139303482587,1.0,1.0,oversample,0.5698399343490443,0.5733736386187867,0.5294522352211334,0.5,COMPLETE
1922,0.5272564789991063,2025-11-27 11:26:46.547500,2025-11-27 11:26:47.196025,0 days 00:00:00.648525,0.00022930300456890958,gbtree,0.8960058903677586,4.3762089411999385,depthwise,0.5846012097872993,0.059098023689182586,0,8,58.8461616391077,600,,0.8797319297021593,0.3058053335117311,0.09187033173373461,undersample,0.7492929394324732,,10.0,0.6599183470765536,,,,0.5802510626560065,,0.5368611488014473,0.5214834916327453,0.5465013286093888,0.5272564789991063,0.8797319297021593,0.3058053335117311,0.08,0.6423684576365538,0.634722829525131,0.6007789678675755,0.5864811133200796,0.5012185215272137,0.4788961038961039,undersample,0.5853408544571362,0.5810797029834313,0.7492929394324732,0.5,COMPLETE
1923,0.7156549520766773,2025-11-27 11:26:47.400985,2025-11-27 11:26:47.787716,0 days 00:00:00.386731,1.2734196268188003,gbtree,0.26372773207990047,9.332279456145661,lossguide,3.522797000117041,0.449111705490321,5,11,10.053855112113284,200,,0.5494729823240705,0.30387267486187114,0.0029923014389329652,none,0.6930926216208224,2.080192702308375,11.0,0.634689607025028,,,,0.4810107967485624,,0.5567616463138851,0.5572139303482587,0.715281812899477,0.7156549520766773,0.5494729823240705,0.30387267486187114,0.0,0.5567616463138851,0.5572139303482587,0.5567616463138851,0.5572139303482587,1.0,1.0,none,0.5,0.5,0.6930926216208224,0.5,COMPLETE
1924,0.7156549520766773,2025-11-27 11:26:47.993036,2025-11-27 11:26:48.732666,0 days 00:00:00.739630,56.16715127672769,gbtree,0.9631676081435951,4.33281749211976,lossguide,0.00044245743382584205,0.0010980402249646983,4,9,5.828270166895445,700,,0.5052709070440157,0.5347851501400385,0.06869909570545776,none,0.9648430734332656,2.5802380864913723,11.0,0.7935686631818566,,,,0.7429083540273265,,0.5567616463138851,0.5572139303482587,0.715281812899477,0.7156549520766773,0.5052709070440157,0.5347851501400385,0.08,0.515816598420252,0.5055890598062601,0.5567616463138851,0.5572139303482587,1.0,1.0,none,0.4021203932425936,0.38879994494779996,0.9648430734332656,0.5,COMPLETE
1925,0.606794221007419,2025-11-27 11:26:48.934944,2025-11-27 11:26:50.299101,0 days 00:00:01.364157,0.0022549255033405147,gbtree,0.5192153483676881,0.019200277026085733,lossguide,0.0001702845190273897,0.4251219425026645,9,3,8.227483205423033,300,,0.8191005053096856,0.6601012238845416,0.07601594776395537,oversample,0.7139191066823607,,5.0,0.9072432583005087,,,,0.8230844172008194,,0.5300768882858435,0.5445499773857982,0.5958770906262155,0.606794221007419,0.8191005053096856,0.6601012238845416,0.08,0.5430837833480295,0.5492865331690782,0.5716417910447761,0.5846501128668171,0.6222583265637693,0.6306818181818182,oversample,0.5041496046021983,0.5149673169016887,0.7139191066823607,0.5,COMPLETE
1926,0.7156549520766773,2025-11-27 11:26:50.504972,2025-11-27 11:27:39.017640,0 days 00:00:48.512668,3.569282874380846,dart,0.5705720372359628,9.073002661518126,lossguide,0.00010732493530846534,0.004641534116423434,4,12,0.24048979609624657,600,forest,0.7484603918114238,0.5401803632170057,0.07883326084240688,oversample,0.6318982213361003,,10.0,0.72125772939001,0.015476412074582113,weighted,0.6991149360263086,0.20667012657570388,,0.5567616463138851,0.5572139303482587,0.715281812899477,0.7156549520766773,0.7484603918114238,0.5401803632170057,0.08,0.4467713409343007,0.4421568925767657,0.5567616463138851,0.5572139303482587,1.0,1.0,oversample,0.28986430477958847,0.274437290237852,0.6318982213361003,0.5,COMPLETE
1927,0.0944206008583691,2025-11-27 11:27:39.222564,2025-11-27 11:28:54.213387,0 days 00:01:14.990823,0.11799118144827066,dart,0.7802478935324388,6.254027980267506,lossguide,0.6477931648546935,0.025928146778769718,9,7,0.7702132375210647,900,tree,0.7994594933458643,0.4341809057547746,0.07801788184163114,none,0.9064994785720523,0.7661049046357892,5.0,0.9173991904647729,0.34056252704527307,uniform,0.07440380741245632,0.32787684637444797,,0.4364540931705111,0.42740841248303935,0.10359712230215827,0.0944206008583691,0.7994594933458643,0.4341809057547746,0.08,0.5407825185675299,0.5336950849313195,0.4528301886792453,0.39759036144578314,0.05848903330625508,0.05357142857142857,none,0.48158747658283463,0.47890273669129646,0.9064994785720523,0.5,COMPLETE
1928,0.34460887949260044,2025-11-27 11:28:54.409723,2025-11-27 11:28:55.095891,0 days 00:00:00.686168,0.2042045973765897,gbtree,0.8450680621670144,5.457063387858248,lossguide,34.26337867356483,0.00914978039120901,2,8,12.446351588348124,700,,0.5762734032901582,0.6122225000766224,0.08993739525756794,undersample,0.6712773089535199,,8.0,0.7386355304604884,,,,0.9357325859333148,,0.45409317051108095,0.4391677973767526,0.36640419947506564,0.34460887949260044,0.5762734032901582,0.6122225000766224,0.08,0.5457168333878788,0.5404708306166923,0.5178041543026706,0.49393939393939396,0.2835093419983753,0.26461038961038963,undersample,0.47593834446857547,0.4617229680431927,0.6712773089535199,0.5,COMPLETE
1929,0.7156549520766773,2025-11-27 11:28:55.298464,2025-11-27 11:29:37.978628,0 days 00:00:42.680164,0.00012353303542239516,dart,0.694767411987327,3.755530284544059,depthwise,7.810367174235734,0.0005166456350897852,5,6,2.4741123225760178,600,tree,0.9889665945526247,0.20050868931964597,0.060623413159089416,none,0.8019271040988382,1.0672073962569637,8.0,0.8577206509418254,0.14425772631085643,weighted,0.009166499200558486,0.6563182296911771,,0.5567616463138851,0.5572139303482587,0.715281812899477,0.7156549520766773,0.9889665945526247,0.20050868931964597,0.05,0.5443979500463285,0.5335696960566321,0.5567616463138851,0.5572139303482587,1.0,1.0,none,0.5250431041628674,0.4956066022843347,0.8019271040988382,0.5,COMPLETE
1930,0.4660368870895187,2025-11-27 11:29:38.187528,2025-11-27 11:30:30.512188,0 days 00:00:52.324660,0.0006072843641335642,dart,0.4928274543313175,0.11964104010368959,lossguide,0.03596699438337288,0.03373435235168934,7,3,0.11859154365901989,300,tree,0.5355375604991843,0.2403615063892492,0.035753606964918465,undersample,0.9952837376500339,,8.0,0.7849931310455884,0.32233895169123505,weighted,0.778167009055248,0.5569020923437439,,0.4319312528267752,0.4631388511985527,0.43423423423423424,0.4660368870895187,0.5355375604991843,0.2403615063892492,0.05,0.5012482279725846,0.540923803149165,0.487360970677452,0.5227043390514632,0.3915515840779854,0.42045454545454547,undersample,0.39793348696099073,0.4374618614276429,0.9952837376500339,0.5,COMPLETE
1931,0.7156549520766773,2025-11-27 11:30:30.711748,2025-11-27 11:30:31.113065,0 days 00:00:00.401317,63.04343481537421,gbtree,0.9111386007716515,5.695955176189952,depthwise,43.95222431760166,0.12766701313668688,9,3,0.31171344891618846,200,,0.6573844928776194,0.8169223764156965,0.004266565437241543,none,0.7078660636188754,1.4674010413836456,11.0,0.7104567952098373,,,,0.8754021888561005,,0.5567616463138851,0.5572139303482587,0.715281812899477,0.7156549520766773,0.6573844928776194,0.8169223764156965,0.0,0.5567616463138851,0.5572139303482587,0.5567616463138851,0.5572139303482587,1.0,1.0,none,0.5,0.5,0.7078660636188754,0.5,COMPLETE
1932,0.0,2025-11-27 11:30:31.313511,2025-11-27 11:30:36.345410,0 days 00:00:05.031899,0.9617048150826576,dart,0.20598939246049863,0.5168511831346656,lossguide,0.012417044842540779,0.0001236103037284991,4,5,75.52049264103643,200,tree,0.9370327755408653,0.6765075919663099,0.0602134638525865,none,0.6300896424454026,0.6412245220352047,5.0,0.8705454361305254,0.41014266906640306,uniform,0.6650819742275775,0.4576126372887286,,0.44323835368611486,0.4427860696517413,0.0,0.0,0.9370327755408653,0.6765075919663099,0.05,0.6851996550758218,0.6948512000211804,0.0,0.0,0.0,0.0,none,0.6546071718695601,0.6472969701391561,0.6300896424454026,0.5,COMPLETE
1933,0.7156549520766773,2025-11-27 11:30:36.547220,2025-11-27 11:31:17.837533,0 days 00:00:41.290313,0.25662848806776284,dart,0.5240612510695202,7.968912629599298,lossguide,95.44962915229372,0.00016763956656725855,9,3,7.047721060933419,600,tree,0.6878375574240847,0.7332648459735722,0.028085563188731344,oversample,0.9050707710887536,,10.0,0.7691991338285757,0.19509985594571272,weighted,0.04656021822843869,0.3835978777333708,,0.5567616463138851,0.5572139303482587,0.715281812899477,0.7156549520766773,0.6878375574240847,0.7332648459735722,0.02,0.5567616463138851,0.5572139303482587,0.5567616463138851,0.5572139303482587,1.0,1.0,oversample,0.5,0.5,0.9050707710887536,0.5,COMPLETE
1934,0.7156549520766773,2025-11-27 11:31:18.043137,2025-11-27 11:31:18.698452,0 days 00:00:00.655315,44.443201441943785,gbtree,0.6313156772742952,6.899582074866997,depthwise,34.60195062321522,0.036726973487150975,4,4,0.43463264835947785,600,,0.5602620515390822,0.798193607092468,0.02073241050299516,undersample,0.8511675647278782,,5.0,0.8338517258378728,,,,0.8414625483469234,,0.5567616463138851,0.5572139303482587,0.715281812899477,0.7156549520766773,0.5602620515390822,0.798193607092468,0.02,0.5567616463138851,0.5572139303482587,0.5567616463138851,0.5572139303482587,1.0,1.0,undersample,0.5,0.5,0.8511675647278782,0.5,COMPLETE
1935,0.7156549520766773,2025-11-27 11:31:18.901507,2025-11-27 11:31:19.587848,0 days 00:00:00.686341,0.07390993274080547,gbtree,0.393291415610367,5.46438929059197,depthwise,0.2921696891878731,0.0033718864103795152,10,10,6.174398646965877,600,,0.5703447016010729,0.7117730089697709,0.03165721045203135,none,0.5270650381221949,1.8565704921115018,9.0,0.6204094094669177,,,,0.33362557188675623,,0.5567616463138851,0.5572139303482587,0.715281812899477,0.7156549520766773,0.5703447016010729,0.7117730089697709,0.02,0.46140730960754445,0.4507863221214936,0.5567616463138851,0.5572139303482587,1.0,1.0,none,0.34731469354598055,0.33012665322420176,0.5270650381221949,0.5,COMPLETE
1936,0.46420631391729655,2025-11-27 11:31:19.790818,2025-11-27 11:31:21.575894,0 days 00:00:01.785076,0.00020092428992208862,gbtree,0.6267108434670472,3.097249068149077,depthwise,35.39507855746454,0.4183532648283352,3,11,0.1203513062792103,800,,0.8576725253019808,0.6008688307101101,0.0443062054328695,undersample,0.5972692146144474,,5.0,0.7150030708989963,,,,0.4176201548671696,,0.47218453188602444,0.4549977385798281,0.4750337381916329,0.46420631391729655,0.8576725253019808,0.6008688307101101,0.05,0.5362495936554199,0.5209838481944833,0.532258064516129,0.5132743362831859,0.4289195775792039,0.4237012987012987,undersample,0.4774855352376531,0.4609353236140774,0.5972692146144474,0.5,COMPLETE
1937,0.3989408649602824,2025-11-27 11:31:21.776362,2025-11-27 11:31:22.296905,0 days 00:00:00.520543,0.0016459797482486186,gbtree,0.26080231570928564,3.3704676264489986,depthwise,19.38319785787912,0.00391362545861911,6,5,1.387217755961414,400,,0.6636203557696929,0.32675594659479834,0.055529975073401516,undersample,0.6868589096683566,,6.0,0.8123859575035873,,,,0.33092293775498616,,0.370872908186341,0.383989145183175,0.37984841729826124,0.3989408649602824,0.6636203557696929,0.32675594659479834,0.05,0.4366042770713612,0.45043908603492205,0.4209486166007905,0.437137330754352,0.3460601137286759,0.36688311688311687,undersample,0.31292586083986806,0.34085519944815146,0.6868589096683566,0.5,COMPLETE
1938,0.7156549520766773,2025-11-27 11:31:22.497627,2025-11-27 11:31:23.295730,0 days 00:00:00.798103,0.09924955156700824,gbtree,0.4752208473703583,7.841668388952904,lossguide,0.02574416058397522,0.0063763409537301715,3,5,15.543975698618937,900,,0.7862369074251166,0.28889941553494525,0.09417303183978337,oversample,0.5798699018250504,,11.0,0.8760034749001488,,,,0.2236581265026424,,0.5567616463138851,0.5572139303482587,0.715281812899477,0.7156549520766773,0.7862369074251166,0.28889941553494525,0.08,0.64433343033172,0.6172420014010627,0.5567616463138851,0.5572139303482587,1.0,1.0,oversample,0.6355609343656228,0.5827756258042264,0.5798699018250504,0.5,COMPLETE
1939,0.7156549520766773,2025-11-27 11:31:23.498861,2025-11-27 11:31:49.124588,0 days 00:00:25.625727,0.06149448886731279,dart,0.41257967244178895,6.470558919140595,lossguide,0.054180491860833714,0.06637805519996234,0,5,17.112169717769312,500,forest,0.9514623521184382,0.7627588545289197,0.07080390468155599,oversample,0.5370496800343825,,6.0,0.7812448199261486,0.3598031734324264,uniform,0.29692990232921823,0.43875507874209635,,0.5567616463138851,0.5572139303482587,0.715281812899477,0.7156549520766773,0.9514623521184382,0.7627588545289197,0.08,0.4969759420563935,0.4799735655398727,0.5567616463138851,0.5572139303482587,1.0,1.0,oversample,0.41232530380145566,0.3862305659100858,0.5370496800343825,0.5,COMPLETE
1940,0.7156549520766773,2025-11-27 11:31:49.333042,2025-11-27 11:31:49.899933,0 days 00:00:00.566891,3.746908875542772,gbtree,0.8028635187927655,7.3550554304397835,lossguide,0.24035119868994884,0.0006164619304095906,5,8,1.019937297176429,500,,0.5860526561171999,0.24319467098163478,0.0835053782511844,oversample,0.5310454761624103,,6.0,0.9268198278554118,,,,0.809571681633581,,0.5567616463138851,0.5572139303482587,0.715281812899477,0.7156549520766773,0.5860526561171999,0.24319467098163478,0.08,0.5592376001113034,0.5576891391896016,0.5567616463138851,0.5572139303482587,1.0,1.0,oversample,0.5049934514829489,0.5009621698526193,0.5310454761624103,0.5,COMPLETE
1941,0.7156549520766773,2025-11-27 11:31:50.102906,2025-11-27 11:31:50.492638,0 days 00:00:00.389732,0.12924912756951093,gbtree,0.6219607787318449,7.067345745006033,depthwise,99.96954389819174,0.0019786976940339897,6,6,3.0221294357290245,200,,0.6531378245727477,0.22012613535615422,0.027404842679220998,undersample,0.6302810088161634,,8.0,0.6854163030432867,,,,0.9542024936078555,,0.5567616463138851,0.5572139303482587,0.715281812899477,0.7156549520766773,0.6531378245727477,0.22012613535615422,0.02,0.5567616463138851,0.5572139303482587,0.5567616463138851,0.5572139303482587,1.0,1.0,undersample,0.5,0.5,0.6302810088161634,0.5,COMPLETE
1942,0.7156549520766773,2025-11-27 11:31:50.690518,2025-11-27 11:31:51.503177,0 days 00:00:00.812659,0.014304745276482933,gbtree,0.8494914872908124,9.700932119220377,depthwise,0.0740444066562092,0.0043577574363224455,5,8,0.9677104398046448,900,,0.5646535062368634,0.7585416486115311,0.0687497214665849,oversample,0.5481588261229194,,9.0,0.6908479516890411,,,,0.9261825581470091,,0.5567616463138851,0.5572139303482587,0.715281812899477,0.7156549520766773,0.5646535062368634,0.7585416486115311,0.08,0.5567616463138851,0.5572139303482587,0.5567616463138851,0.5572139303482587,1.0,1.0,oversample,0.5,0.5,0.5481588261229194,0.5,COMPLETE
1943,0.6051437216338881,2025-11-27 11:31:51.706537,2025-11-27 11:31:53.913031,0 days 00:00:02.206494,0.00010353296171482126,gbtree,0.6664103270272954,1.466541830127922,depthwise,0.5065676218291872,0.3938436351424474,6,11,0.11336924662510901,500,,0.8376365007167312,0.4180292634987069,0.023522474818799377,oversample,0.5512061962535609,,10.0,0.9328812332775067,,,,0.8063920139458762,,0.5445499773857982,0.5278154681139756,0.6235514018691589,0.6051437216338881,0.8376365007167312,0.4180292634987069,0.02,0.563687538063117,0.5373389120468763,0.5775623268698061,0.56657223796034,0.677497969130788,0.6493506493506493,oversample,0.5175384207297867,0.48315228566122337,0.5512061962535609,0.5,COMPLETE
