number,value,datetime_start,datetime_complete,duration,params_alpha,params_booster,params_colsample_bytree,params_gamma,params_grow_policy,params_lambda,params_learning_rate,params_max_delta_step,params_max_depth,params_min_child_weight,params_n_estimators,params_normalize_type,params_params_feature_fraction,params_params_labeled_ratio,params_params_missing_rate,params_params_resampling,params_params_sample_rows,params_params_scale_pos_weight,params_params_selftrain_max_iter,params_params_selftrain_threshold,params_rate_drop,params_sample_type,params_skip_drop,params_subsample,params_user_attrs_decision_threshold,user_attrs_acc_test,user_attrs_acc_val,user_attrs_f1_test,user_attrs_f1_val,user_attrs_feature_fraction,user_attrs_labeled_ratio,user_attrs_missing_rate,user_attrs_pr_auc_test,user_attrs_pr_auc_val,user_attrs_prec_test,user_attrs_prec_val,user_attrs_rec_test,user_attrs_rec_val,user_attrs_resampling_strategy,user_attrs_roc_auc_test,user_attrs_roc_auc_val,user_attrs_sample_rows,user_attrs_user_attrs_decision_threshold,state
638,0.7156549520766773,2025-11-26 20:23:05.756376,2025-11-26 20:23:10.064558,0 days 00:00:04.308182,0.0024229143251939755,dart,0.7169297990980622,9.663188310663886,depthwise,1.0516175599331237,0.0020635275796753883,7,3,16.58188358935013,200,tree,0.7453366059912341,0.911477387892097,0.09535054267627953,undersample,0.7159411487457947,,10.0,0.6197059137770307,0.3838210552718402,weighted,0.3390474567998705,0.8554498381261305,0.4547773842628443,0.5567616463138851,0.5572139303482587,0.715281812899477,0.7156549520766773,0.7453366059912341,0.911477387892097,0.1,0.5567616463138851,0.5572139303482587,0.5567616463138851,0.5572139303482587,1.0,1.0,undersample,0.5,0.5,0.7159411487457947,0.4547773842628443,COMPLETE
639,0.7156549520766773,2025-11-26 20:23:10.222723,2025-11-26 20:23:10.958018,0 days 00:00:00.735295,0.00016175210581345905,gbtree,0.3108336150163651,2.3978704688939785,lossguide,0.0008119244500751723,0.007051707856645994,6,12,0.23234535113575833,200,,0.8501856909243808,0.8379142056405641,0.04773441027840837,undersample,0.6131538856720657,,12.0,0.6348487376250068,,,,0.46321378022766,0.12168691512545576,0.5567616463138851,0.5572139303482587,0.715281812899477,0.7156549520766773,0.8501856909243808,0.8379142056405641,0.05,0.5563953712662342,0.5478696045645722,0.5567616463138851,0.5572139303482587,1.0,1.0,undersample,0.4996816923357483,0.4905437068039213,0.6131538856720657,0.12168691512545576,COMPLETE
640,0.715281812899477,2025-11-26 20:23:11.119186,2025-11-26 20:25:02.956271,0 days 00:01:51.837085,0.08088740777434696,dart,0.5955661439179073,2.084789960713718,lossguide,0.011707160647521522,0.050099179804462046,2,4,0.32330910869066665,500,forest,0.7548682073958334,0.9194549519853573,0.050578175165117346,undersample,0.9265922734796219,,6.0,0.6931082736294487,0.10871738951178342,uniform,0.27304228263825536,0.2419686922468655,0.22830499143506547,0.5567616463138851,0.5567616463138851,0.715281812899477,0.715281812899477,0.7548682073958334,0.9194549519853573,0.05,0.5388156405493416,0.5133234080052653,0.5567616463138851,0.5570135746606335,1.0,0.9991883116883117,undersample,0.4790269235232679,0.45442357693379143,0.9265922734796219,0.22830499143506547,COMPLETE
641,0.09950248756218906,2025-11-26 20:25:03.128335,2025-11-26 20:26:01.719380,0 days 00:00:58.591045,0.039403628439923497,dart,0.9622324212086255,2.6812591363831455,lossguide,0.004203200855952096,0.3106051844613542,0,4,2.5675315711968114,400,forest,0.8597994933389823,0.9299884599114445,0.06905601480642082,oversample,0.5963964541335235,,5.0,0.7045842998739129,0.2915627405088068,uniform,0.5447390308133985,0.3153281810545149,0.6957834923934746,0.42966983265490727,0.42695612844866576,0.11009174311926606,0.09950248756218906,0.8597994933389823,0.9299884599114445,0.08,0.528958908693425,0.5298870274670087,0.41935483870967744,0.4,0.06336311941510966,0.056818181818181816,oversample,0.489124488138066,0.48504470503959785,0.5963964541335235,0.6957834923934746,COMPLETE
642,0.4088852324146442,2025-11-26 20:26:01.895827,2025-11-26 20:26:32.989239,0 days 00:00:31.093412,2.309841114764841,dart,0.9368807384719833,5.0614362426916,lossguide,0.007975479536909375,0.012186691409260804,6,7,25.579314801195746,500,forest,0.864109460399269,0.7146227011694805,0.08121261433899649,oversample,0.7877123832624008,,10.0,0.853441921605601,0.08096674845220576,weighted,0.13213486212726827,0.6812724777476388,0.5528079918888652,0.38218000904568067,0.35006784260515605,0.4487489911218725,0.4088852324146442,0.864109460399269,0.7146227011694805,0.08,0.4405333517532512,0.42437841781962127,0.4458700882117081,0.41451209341117595,0.4516653127538586,0.4034090909090909,oversample,0.3148614035378571,0.2776094245386891,0.7877123832624008,0.5528079918888652,COMPLETE
643,0.7156549520766773,2025-11-26 20:26:33.158289,2025-11-26 20:27:39.321831,0 days 00:01:06.163542,0.31236823945363884,dart,0.5580373561895009,8.787427989694908,depthwise,0.13701935392218845,0.0009092214416506519,0,3,0.2909855102268072,800,forest,0.5668966463169729,0.06934499185929618,0.06216774690263003,oversample,0.9854605703532355,,10.0,0.6338722221564709,0.3341935115838458,weighted,0.3752163553722506,0.6921407709292313,0.1447673361530103,0.5567616463138851,0.5572139303482587,0.715281812899477,0.7156549520766773,0.5668966463169729,0.06934499185929618,0.05,0.5347518873190881,0.5206461165584838,0.5567616463138851,0.5572139303482587,1.0,1.0,oversample,0.4615767834347387,0.42317938062958493,0.9854605703532355,0.1447673361530103,COMPLETE
644,0.7145766656968287,2025-11-26 20:27:39.516523,2025-11-26 20:29:17.394996,0 days 00:01:37.878473,0.5111574259718759,dart,0.3539141952130631,1.7842493739654035,lossguide,0.012622381847589983,0.22347680300776876,2,7,0.20441441086566614,500,forest,0.9541784474825571,0.9211176348985668,0.09771578511784589,oversample,0.9801833738253025,,5.0,0.6559597072161549,0.4881444013714905,uniform,0.8005322524805788,0.207014902516145,0.2919518901760103,0.5531433740388965,0.5563093622795116,0.7119533527696793,0.7145766656968287,0.9541784474825571,0.9211176348985668,0.1,0.4886493082770009,0.4858775537469125,0.5552523874488404,0.5569160997732426,0.991876523151909,0.9967532467532467,oversample,0.41864586614499577,0.4227751946725389,0.9801833738253025,0.2919518901760103,COMPLETE
645,0.7156549520766773,2025-11-26 20:29:17.563785,2025-11-26 20:29:18.414122,0 days 00:00:00.850337,0.2238714947013842,gbtree,0.9331645188512214,4.943975639217248,lossguide,1.2249724334821568,0.16616258519442637,7,5,45.1429583654822,700,,0.9202113552321274,0.7328621646558213,0.0551628885399389,none,0.8384853557829571,1.9991592961815485,10.0,0.8415471337903035,,,,0.9157975576330261,0.4208446109372469,0.5567616463138851,0.5572139303482587,0.715281812899477,0.7156549520766773,0.9202113552321274,0.7328621646558213,0.05,0.5059863887956337,0.5034354385762945,0.5567616463138851,0.5572139303482587,1.0,1.0,none,0.4565883055090435,0.45495088415159923,0.8384853557829571,0.4208446109372469,COMPLETE
646,0.7156549520766773,2025-11-26 20:29:18.583855,2025-11-26 20:30:41.613931,0 days 00:01:23.030076,3.9694318912911277,dart,0.9157864722221327,3.35944863297843,lossguide,0.18067732661303854,0.0014933488918924239,4,12,53.770635920092055,900,tree,0.8767670198692644,0.6327311239647943,0.06193854207147351,oversample,0.9205385849175992,,10.0,0.948735713365324,0.4881741295181986,weighted,0.4055961363806067,0.923412911719571,0.19956146477120917,0.5567616463138851,0.5572139303482587,0.715281812899477,0.7156549520766773,0.8767670198692644,0.6327311239647943,0.05,0.5677356204271292,0.5874436593360124,0.5567616463138851,0.5572139303482587,1.0,1.0,oversample,0.4836017672706776,0.49941092487696165,0.9205385849175992,0.19956146477120917,COMPLETE
647,0.0,2025-11-26 20:30:41.784317,2025-11-26 20:30:42.619972,0 days 00:00:00.835655,12.402351555742452,gbtree,0.970151294013357,3.800337779834611,depthwise,0.3089722821453206,0.004366252077033628,6,8,0.39425306271771343,600,,0.7001183769371054,0.5931301129596813,0.07754734004066532,oversample,0.7747938166245576,,6.0,0.8197224459317359,,,,0.8978314216412927,0.6787936688422092,0.44323835368611486,0.4427860696517413,0.0,0.0,0.7001183769371054,0.5931301129596813,0.08,0.5545924347947475,0.5363811176667732,0.0,0.0,0.0,0.0,oversample,0.5182732638140553,0.4880116372391653,0.7747938166245576,0.6787936688422092,COMPLETE
648,0.7156549520766773,2025-11-26 20:30:42.807533,2025-11-26 20:31:54.677382,0 days 00:01:11.869849,0.8462649640836325,dart,0.5821543995490545,9.565982152541553,lossguide,0.012077515190251447,0.005428847519290769,3,3,0.212885210336707,800,tree,0.5406226997750602,0.16987971492817855,0.06154105355382908,oversample,0.9563467374958163,,11.0,0.6661443452290934,0.2462275405006352,weighted,0.08577765005579623,0.9910677277624493,0.037256751744767176,0.5567616463138851,0.5572139303482587,0.715281812899477,0.7156549520766773,0.5406226997750602,0.16987971492817855,0.05,0.5567616463138851,0.5572139303482587,0.5567616463138851,0.5572139303482587,1.0,1.0,oversample,0.5,0.5,0.9563467374958163,0.037256751744767176,COMPLETE
649,0.7156549520766773,2025-11-26 20:31:54.852312,2025-11-26 20:31:55.379722,0 days 00:00:00.527410,0.02336607394481371,gbtree,0.25813819953083117,7.725112504901806,depthwise,0.0027475611073190112,0.0038666753311923712,5,8,0.4472036122066049,200,,0.760848638617034,0.795221815370288,0.06979894360293208,oversample,0.5197478573008656,,10.0,0.6057701733031039,,,,0.5100440323131594,0.19635834464330998,0.5567616463138851,0.5572139303482587,0.715281812899477,0.7156549520766773,0.760848638617034,0.795221815370288,0.08,0.4498956878102335,0.4490862619153442,0.5567616463138851,0.5572139303482587,1.0,1.0,oversample,0.22686093933918003,0.2128845363012881,0.5197478573008656,0.19635834464330998,COMPLETE
650,0.7034198113207547,2025-11-26 20:31:55.555239,2025-11-26 20:33:04.904754,0 days 00:01:09.349515,0.00026369761306643103,gbtree,0.7529750934195618,0.8624785644707332,lossguide,0.004285916995305703,0.004532201739055782,5,12,0.10890409992732569,400,,0.9379819321264046,0.47567838370413495,0.05482480886716709,none,0.6929813517825929,1.2775544971954456,12.0,0.6494295137376972,,,,0.6049369744646351,0.28930959647264254,0.5445499773857982,0.5450022614201718,0.7032124963159446,0.7034198113207547,0.9379819321264046,0.47567838370413495,0.05,0.5285681126772912,0.552390587064618,0.5518038852913969,0.5523148148148148,0.9691307879772543,0.9683441558441559,none,0.42937714484656575,0.4699434885849595,0.6929813517825929,0.28930959647264254,COMPLETE
651,0.7156549520766773,2025-11-26 20:33:05.074411,2025-11-26 20:33:05.592081,0 days 00:00:00.517670,0.045396266169574866,gbtree,0.8397441713275146,7.999686552346038,lossguide,37.38477472534984,0.00025062499248470327,0,3,6.702495666714732,200,,0.5369493697902834,0.15411021214980686,0.03895944392131917,none,0.7762535522028002,0.8231999273816898,12.0,0.882328177508739,,,,0.3186814018018668,0.35769541134986116,0.5567616463138851,0.5572139303482587,0.715281812899477,0.7156549520766773,0.5369493697902834,0.15411021214980686,0.05,0.5567616463138851,0.5572139303482587,0.5567616463138851,0.5572139303482587,1.0,1.0,none,0.5,0.5,0.7762535522028002,0.35769541134986116,COMPLETE
652,0.7145348837209302,2025-11-26 20:33:05.765259,2025-11-26 20:33:08.469311,0 days 00:00:02.704052,0.12476418123792005,gbtree,0.262564740693478,1.5641984921388308,depthwise,0.0006985290691170077,0.15112758285967776,2,6,1.8936856035889142,700,,0.8152670973678801,0.3823948490495321,0.0059911973322543085,none,0.9952641408893159,2.4803407439759946,11.0,0.755263920528026,,,,0.8765995368077283,0.5432780631356138,0.5545002261420172,0.555857078245138,0.7134128600523713,0.7145348837209302,0.8152670973678801,0.3823948490495321,0.0,0.5514402293828937,0.5519629093740759,0.5557570262919311,0.5566123188405797,0.9959382615759546,0.997564935064935,none,0.5154947031615245,0.516084528341934,0.9952641408893159,0.5432780631356138,COMPLETE
653,0.006349206349206349,2025-11-26 20:33:08.644789,2025-11-26 20:33:09.692557,0 days 00:00:01.047768,0.021593130578203105,gbtree,0.6568776685100646,2.7495328729235684,lossguide,0.0002318026257994396,0.015277178745053407,4,6,1.7236884281769944,200,,0.6774185161166848,0.5598492477679364,0.05966677026317133,none,0.9254421102351198,0.5992260552911688,5.0,0.6211931299892474,,,,0.24387068999482509,0.529383286589348,0.44007236544549977,0.4337403889642696,0.014331210191082803,0.006349206349206349,0.6774185161166848,0.5598492477679364,0.05,0.48464962366717657,0.4784926249366769,0.36,0.14285714285714285,0.007311129163281885,0.003246753246753247,none,0.40137933321175745,0.3870045301991165,0.9254421102351198,0.529383286589348,COMPLETE
654,0.7156549520766773,2025-11-26 20:33:09.869563,2025-11-26 20:33:26.921110,0 days 00:00:17.051547,67.6931202494901,dart,0.647072167416625,9.294044011938807,lossguide,18.706346872568282,0.000611655166310682,4,3,0.11398029562212945,400,tree,0.6846778610224807,0.5431596946665411,0.07304656092640971,undersample,0.5591677902136809,,11.0,0.6870754309525281,0.29850771201172244,weighted,0.3462743939010926,0.8084481671509102,0.126743036484023,0.5567616463138851,0.5572139303482587,0.715281812899477,0.7156549520766773,0.6846778610224807,0.5431596946665411,0.08,0.5567616463138851,0.5572139303482587,0.5567616463138851,0.5572139303482587,1.0,1.0,undersample,0.5,0.5,0.5591677902136809,0.126743036484023,COMPLETE
655,0.7156549520766773,2025-11-26 20:33:27.077193,2025-11-26 20:33:27.764913,0 days 00:00:00.687720,0.00012226746440393579,gbtree,0.47128058704729703,6.371739877742321,lossguide,0.00013785670294567053,0.0017464098842019965,4,12,0.48617952244344426,500,,0.6475180572295085,0.1360351451186701,0.05979309452735011,oversample,0.8180553691333088,,6.0,0.652263582050392,,,,0.637267308210019,0.5429777069380691,0.5567616463138851,0.5572139303482587,0.715281812899477,0.7156549520766773,0.6475180572295085,0.1360351451186701,0.05,0.3758649911831346,0.37768341971079916,0.5567616463138851,0.5572139303482587,1.0,1.0,oversample,0.13345421840547755,0.1398524866349177,0.8180553691333088,0.5429777069380691,COMPLETE
656,0.7156549520766773,2025-11-26 20:33:27.927771,2025-11-26 20:34:08.096771,0 days 00:00:40.169000,25.34739348353159,dart,0.7306340030631472,2.762939921982559,lossguide,0.008703182462286787,0.009281465389985009,0,7,0.3231472315297874,600,forest,0.727240142606552,0.8974154355337063,0.08231951535278324,undersample,0.6410696743907567,,5.0,0.6680223928312948,0.3784531605878998,uniform,0.6632800691761805,0.4460101760082002,0.3956047599861575,0.5567616463138851,0.5572139303482587,0.715281812899477,0.7156549520766773,0.727240142606552,0.8974154355337063,0.08,0.5832110286838654,0.5723869064195272,0.5567616463138851,0.5572139303482587,1.0,1.0,undersample,0.5481531524063727,0.5289562965124763,0.6410696743907567,0.3956047599861575,COMPLETE
657,0.0,2025-11-26 20:34:08.261089,2025-11-26 20:34:09.165546,0 days 00:00:00.904457,0.0003309890550576933,gbtree,0.629342186264593,7.676423256261649,lossguide,0.00020661084977359394,0.0031448772389628464,6,10,1.0806189913655926,800,,0.7762714564392028,0.3496090147433937,0.028909491607150367,undersample,0.8550798153490359,,7.0,0.6248898995448727,,,,0.6602913824557202,0.6553187428808549,0.44323835368611486,0.4427860696517413,0.0,0.0,0.7762714564392028,0.3496090147433937,0.02,0.7836522499241858,0.7622874477914976,0.0,0.0,0.0,0.0,undersample,0.7703082776571231,0.7508564596792381,0.8550798153490359,0.6553187428808549,COMPLETE
658,0.32054455445544555,2025-11-26 20:34:09.326493,2025-11-26 20:34:10.236622,0 days 00:00:00.910129,2.3160520759131416,gbtree,0.2952333766661498,2.9035663547847803,depthwise,0.042876515446510964,0.1894325334987261,1,3,10.33481294996482,800,,0.6784337457955154,0.26885190441283857,0.011679597232263387,none,0.9978822189095847,1.5318675067591563,8.0,0.8347684602307931,,,,0.6855606781916915,0.7057991052486223,0.5020352781546812,0.5033921302578019,0.3105823418910457,0.32054455445544555,0.6784337457955154,0.26885190441283857,0.02,0.6148878971750105,0.6238735805291992,0.6775956284153005,0.6744791666666666,0.20146222583265638,0.21022727272727273,none,0.5677224423481821,0.5871860200575726,0.9978822189095847,0.7057991052486223,COMPLETE
659,0.7156549520766773,2025-11-26 20:34:10.400211,2025-11-26 20:34:11.440438,0 days 00:00:01.040227,0.019144882218367888,gbtree,0.7035058099235483,5.300568529788559,depthwise,0.0010924098077152243,0.0011938886040268003,3,11,1.3590915718525431,900,,0.7036587901022613,0.6253995215649317,0.013104429772887437,oversample,0.7690574875862493,,6.0,0.698172121748551,,,,0.5788534469910817,0.11897272046367902,0.5567616463138851,0.5572139303482587,0.715281812899477,0.7156549520766773,0.7036587901022613,0.6253995215649317,0.02,0.43572115990958793,0.4242044240740666,0.5567616463138851,0.5572139303482587,1.0,1.0,oversample,0.295492713738623,0.26898927808657125,0.7690574875862493,0.11897272046367902,COMPLETE
660,0.7156549520766773,2025-11-26 20:34:11.606349,2025-11-26 20:36:07.254997,0 days 00:01:55.648648,0.05176153492769779,dart,0.8040394714161323,3.5713053476816996,lossguide,0.01508827536591864,0.005090608450051391,2,8,0.2772390124597291,800,forest,0.6133057542917353,0.6409219044256724,0.09166916712206735,none,0.829309540910986,4.751829891627226,5.0,0.7770571437199901,0.4191258892167845,weighted,0.6794307062625637,0.27176947940332186,0.3418946692119207,0.5567616463138851,0.5572139303482587,0.715281812899477,0.7156549520766773,0.6133057542917353,0.6409219044256724,0.1,0.5627884174803552,0.5259822127810854,0.5567616463138851,0.5572139303482587,1.0,1.0,none,0.5418143536862348,0.49520573272488494,0.829309540910986,0.3418946692119207,COMPLETE
661,0.7156549520766773,2025-11-26 20:36:07.423423,2025-11-26 20:36:08.815645,0 days 00:00:01.392222,0.000545035730290981,gbtree,0.8515870387289673,0.2119550210149812,depthwise,0.14932609980141848,0.0005904735011062501,2,11,14.721813700957103,700,,0.6141720525740173,0.2522109164693207,0.06278107653537841,none,0.5189191549587157,1.0633379257138829,7.0,0.9018138046041957,,,,0.718187732254145,0.383909367642651,0.5567616463138851,0.5572139303482587,0.715281812899477,0.7156549520766773,0.6141720525740173,0.2522109164693207,0.05,0.44359963093423904,0.4486695047746131,0.5567616463138851,0.5572139303482587,1.0,1.0,none,0.33971095343092556,0.3489152892561983,0.5189191549587157,0.383909367642651,COMPLETE
662,0.7156549520766773,2025-11-26 20:36:09.008437,2025-11-26 20:36:09.616455,0 days 00:00:00.608018,3.016443773937507,gbtree,0.5668207427492906,7.300549901046469,depthwise,1.0811503308452062,0.008615703389737949,2,9,0.437413958341875,300,,0.8347055903235769,0.7361996078027083,0.0481982188387307,oversample,0.5696437076778589,,11.0,0.6848389249441771,,,,0.6985157790969637,0.1482820468491683,0.5567616463138851,0.5572139303482587,0.715281812899477,0.7156549520766773,0.8347055903235769,0.7361996078027083,0.05,0.5145788248960731,0.5264710076991781,0.5567616463138851,0.5572139303482587,1.0,1.0,oversample,0.44323927783948674,0.4556104327235584,0.5696437076778589,0.1482820468491683,COMPLETE
663,0.644655116050997,2025-11-26 20:36:09.782315,2025-11-26 20:37:07.714509,0 days 00:00:57.932194,4.414601912068932,dart,0.9808301979436264,1.2506428564850611,depthwise,0.061464466034944876,0.00423409407380208,4,4,44.56931701924757,700,tree,0.8485050393297405,0.7784319111617841,0.09627991905729827,oversample,0.8836076475343052,,12.0,0.9471365284075023,0.21657814559685443,weighted,0.3062179831637489,0.9509762329233742,0.5410515080749593,0.5201266395296246,0.5083672546359114,0.653607574273588,0.644655116050997,0.8485050393297405,0.7784319111617841,0.1,0.49238376874897927,0.484528947704326,0.5463973799126638,0.5396825396825397,0.8131600324939074,0.8003246753246753,oversample,0.4188294733002868,0.4108979312311794,0.8836076475343052,0.5410515080749593,COMPLETE
664,0.7156549520766773,2025-11-26 20:37:07.920102,2025-11-26 20:37:20.852030,0 days 00:00:12.931928,0.0004262696285105595,dart,0.9999738705221491,0.7700534685501974,lossguide,0.002534993256036642,0.003049309469647431,4,4,0.7565887356650826,300,forest,0.9979134050833385,0.9215217421299752,0.09823101992436034,oversample,0.6236381848137205,,7.0,0.6381969676858799,0.03259448609991486,uniform,0.23359794557265814,0.3049338963962106,0.2693320302787972,0.5567616463138851,0.5572139303482587,0.715281812899477,0.7156549520766773,0.9979134050833385,0.9215217421299752,0.1,0.6010799131236476,0.583745380136413,0.5567616463138851,0.5572139303482587,1.0,1.0,oversample,0.5332026393010494,0.5359020767281748,0.6236381848137205,0.2693320302787972,COMPLETE
665,0.7156549520766773,2025-11-26 20:37:21.027330,2025-11-26 20:37:21.756107,0 days 00:00:00.728777,0.02191302474886248,gbtree,0.2530722666312453,7.106926135153926,lossguide,27.805647304559507,0.0019079496204365883,3,6,0.10049083030350765,500,,0.7724249163740912,0.5701537022018389,0.027636879721840896,undersample,0.5891621397337343,,7.0,0.754649508372513,,,,0.313280118790966,0.12212350356502831,0.5567616463138851,0.5572139303482587,0.715281812899477,0.7156549520766773,0.7724249163740912,0.5701537022018389,0.02,0.7837143372122622,0.7903129434399704,0.5567616463138851,0.5572139303482587,1.0,1.0,undersample,0.8139843996087468,0.8182875283551994,0.5891621397337343,0.12212350356502831,COMPLETE
666,0.714868804664723,2025-11-26 20:37:21.934760,2025-11-26 20:37:27.277329,0 days 00:00:05.342569,0.0009057731404422324,gbtree,0.3805234710353127,2.1309300127646176,lossguide,0.03242471811832352,0.03216851262788987,9,11,0.3249211515190922,300,,0.9823501653539445,0.30724183982264536,0.023315942715380546,undersample,0.7425611839523507,,12.0,0.6374936168364977,,,,0.7315247820187724,0.052767319954891506,0.5540479421076436,0.5576662143826323,0.7127039627039627,0.714868804664723,0.9823501653539445,0.30724183982264536,0.02,0.5285802663775601,0.5272773825535351,0.5556565197637438,0.5577797998180164,0.9935012185215272,0.9951298701298701,undersample,0.4594493443193687,0.4510234402982105,0.7425611839523507,0.052767319954891506,COMPLETE
