number,value,datetime_start,datetime_complete,duration,params_alpha,params_booster,params_colsample_bytree,params_gamma,params_grow_policy,params_lambda,params_learning_rate,params_max_delta_step,params_max_depth,params_min_child_weight,params_n_estimators,params_normalize_type,params_params_feature_fraction,params_params_labeled_ratio,params_params_missing_rate,params_params_resampling,params_params_sample_rows,params_params_scale_pos_weight,params_params_selftrain_max_iter,params_params_selftrain_threshold,params_rate_drop,params_sample_type,params_skip_drop,params_subsample,params_user_attrs_decision_threshold,user_attrs_acc_test,user_attrs_acc_val,user_attrs_f1_test,user_attrs_f1_val,user_attrs_feature_fraction,user_attrs_labeled_ratio,user_attrs_missing_rate,user_attrs_pr_auc_test,user_attrs_pr_auc_val,user_attrs_prec_test,user_attrs_prec_val,user_attrs_rec_test,user_attrs_rec_val,user_attrs_resampling_strategy,user_attrs_roc_auc_test,user_attrs_roc_auc_val,user_attrs_sample_rows,user_attrs_user_attrs_decision_threshold,state
2122,0.7156549520766773,2025-11-30 12:06:59.228149,2025-11-30 12:07:04.557393,0 days 00:00:05.329244,15.533480532151101,dart,0.6151405429097322,3.474596681158475,depthwise,0.05308741884491078,0.004803018762406425,3,7,0.4254104820329808,200,forest,0.5590101556209396,0.298636834913442,0.08373263760812975,none,0.612500797338581,4.32606484414248,7.0,0.9019331202764636,0.09709710380673453,uniform,0.3718212946044883,0.9640513162988478,,0.5567616463138851,0.5572139303482587,0.715281812899477,0.7156549520766773,0.5590101556209396,0.298636834913442,0.08,0.5567616463138851,0.5572139303482587,0.5567616463138851,0.5572139303482587,1.0,1.0,none,0.5,0.5,0.612500797338581,0.5,COMPLETE
2123,0.7156549520766773,2025-11-30 12:07:05.330964,2025-11-30 12:08:04.141465,0 days 00:00:58.810501,6.482513684626146,dart,0.7751031322171396,5.584100265458799,depthwise,2.037601053670763,0.04189252919108342,5,12,0.2178986450557569,700,forest,0.6573663860002379,0.6050269860819701,0.006833637743884758,none,0.8506284237228636,1.1347431128843324,7.0,0.8392605251237449,0.22901048154440146,weighted,0.4944767249698343,0.22105706822727322,,0.5567616463138851,0.5572139303482587,0.715281812899477,0.7156549520766773,0.6573663860002379,0.6050269860819701,0.08,0.673548260796418,0.659947624425345,0.5567616463138851,0.5572139303482587,1.0,1.0,none,0.6586568908635753,0.6280000961755302,0.8506284237228636,0.5,COMPLETE
2124,0.7156549520766773,2025-11-30 12:08:04.920022,2025-11-30 12:08:05.709225,0 days 00:00:00.789203,11.41633417378657,gbtree,0.5588805296141738,5.371404190832406,lossguide,0.0003586650685236915,0.00010819521474572431,4,4,60.70986092289029,700,,0.5301897410127983,0.6303339254315407,0.014803867927776205,none,0.9427613187244386,2.2047895676245837,6.0,0.9305414425143446,,,,0.9865621906320945,,0.5567616463138851,0.5572139303482587,0.715281812899477,0.7156549520766773,0.5301897410127983,0.6303339254315407,0.08,0.52621349371862,0.5258749495914962,0.5567616463138851,0.5572139303482587,1.0,1.0,none,0.4034014986985859,0.3956342112943237,0.9427613187244386,0.5,COMPLETE
2125,0.7156549520766773,2025-11-30 12:08:06.483251,2025-11-30 12:08:06.933436,0 days 00:00:00.450185,1.931074716857852,gbtree,0.6655111541076559,9.427794095611935,lossguide,0.7341617683940664,0.00010822881513866373,8,3,3.947091803115648,300,,0.8904425923140118,0.3164272296037471,0.029772294755562135,oversample,0.9990994764223048,,8.0,0.7934402648878749,,,,0.5950923895364297,,0.5567616463138851,0.5572139303482587,0.715281812899477,0.7156549520766773,0.8904425923140118,0.3164272296037471,0.08,0.5742442690385549,0.5700152670363509,0.5567616463138851,0.5572139303482587,1.0,1.0,oversample,0.5323542333261494,0.5236844679834975,0.9990994764223048,0.5,COMPLETE
2126,0.4555453712190651,2025-11-30 12:08:07.719779,2025-11-30 12:10:01.685878,0 days 00:01:53.966099,0.00010683764624358758,dart,0.29111528384909074,4.608030422931906,depthwise,0.0005993966220321445,0.3036377054375032,1,6,0.16859008095240424,1000,tree,0.9375998049181592,0.21935720955373977,0.03591065076533001,undersample,0.6877942812307296,,8.0,0.8311185085923778,0.4708710716327583,weighted,0.6489390675892407,0.6430128589648613,,0.45635459068294887,0.4626865671641791,0.4404096834264432,0.4555453712190651,0.9375998049181592,0.21935720955373977,0.08,0.5164347276288084,0.5262725454509405,0.5158124318429662,0.5231578947368422,0.3842404549147035,0.4034090909090909,undersample,0.43144531573799294,0.43659752530411367,0.6877942812307296,0.5,COMPLETE
2127,0.0,2025-11-30 12:10:02.462527,2025-11-30 12:10:03.119349,0 days 00:00:00.656822,0.0031851032740754974,gbtree,0.44232384693586807,4.76083985968232,depthwise,0.13770063403685767,0.007178666197504419,1,9,27.199154994365998,600,,0.6357751450032378,0.523297409513356,0.042681951511054084,none,0.7085148705959967,0.5299096539679713,8.0,0.8541851484571444,,,,0.6840344134483779,,0.44323835368611486,0.4427860696517413,0.0,0.0,0.6357751450032378,0.523297409513356,0.08,0.5754265404836335,0.572156389436094,0.0,0.0,0.0,0.0,none,0.5267419884281901,0.5291283346377831,0.7085148705959967,0.5,COMPLETE
2128,0.7156549520766773,2025-11-30 12:10:03.918087,2025-11-30 12:10:04.416773,0 days 00:00:00.498686,0.000235144601763317,gbtree,0.5037331545653432,3.5020195195657644,lossguide,0.004054451363151272,0.013681731941109014,0,6,36.1583391280855,300,,0.6980922799976603,0.6213605886791786,0.07791109940193555,none,0.572725070349433,4.7624122358588545,8.0,0.6221791515920969,,,,0.8570427821584834,,0.5567616463138851,0.5572139303482587,0.715281812899477,0.7156549520766773,0.6980922799976603,0.6213605886791786,0.08,0.42521360164484845,0.4105042643650022,0.5567616463138851,0.5572139303482587,1.0,1.0,none,0.24821532187204695,0.21735089476407146,0.572725070349433,0.5,COMPLETE
2129,0.5267344233318604,2025-11-30 12:10:05.187128,2025-11-30 12:10:06.932751,0 days 00:00:01.745623,0.0001975657031255486,gbtree,0.40228310219860897,0.8316477180810911,depthwise,70.57429282164722,0.0011580644106181186,2,9,20.27667630202752,1000,,0.7840811220904749,0.6675839507221524,0.05323360708973223,undersample,0.87455030332486,,8.0,0.8942905848442875,,,,0.9467647129189747,,0.5205789235639982,0.5156037991858887,0.5363079615048119,0.5267344233318604,0.7840811220904749,0.6675839507221524,0.08,0.6159399672669629,0.6071835345789206,0.581042654028436,0.5780795344325897,0.4979691307879773,0.4837662337662338,undersample,0.5490732604983505,0.5459084773755356,0.87455030332486,0.5,COMPLETE
2130,0.7156549520766773,2025-11-30 12:10:07.710907,2025-11-30 12:10:08.629967,0 days 00:00:00.919060,0.00014560851290158146,gbtree,0.6764680157089304,6.6518284441188875,lossguide,0.0009746160051382196,0.0032485191751538056,9,10,3.5916741570437005,900,,0.9841058856656208,0.40671512563506973,0.013426702371782485,none,0.7442212333651379,2.5329968980363526,7.0,0.8468573704727417,,,,0.45400295934934837,,0.5567616463138851,0.5572139303482587,0.715281812899477,0.7156549520766773,0.9841058856656208,0.40671512563506973,0.08,0.456190172505792,0.4555581384898981,0.5567616463138851,0.5572139303482587,1.0,1.0,none,0.3795296672690197,0.3799103411909847,0.7442212333651379,0.5,COMPLETE
2131,0.5920997920997921,2025-11-30 12:10:09.405132,2025-11-30 12:10:09.980907,0 days 00:00:00.575775,0.06923319173258802,gbtree,0.38432025144574045,5.831379784738219,lossguide,0.0035335866091156564,0.0012084001958871707,6,12,0.5469804672209326,500,,0.6776899075305256,0.2307037008364678,0.0680370254395195,undersample,0.9873616187076186,,6.0,0.6644715072815894,,,,0.8673410052449897,,0.592944369063772,0.5563093622795116,0.6347402597402597,0.5920997920997921,0.6776899075305256,0.2307037008364678,0.08,0.6039003001012555,0.5979225837223853,0.6342254663422546,0.6069906223358909,0.6352558895207149,0.577922077922078,undersample,0.5625540874351366,0.5429900474908136,0.9873616187076186,0.5,COMPLETE
2132,0.4807073954983923,2025-11-30 12:10:10.768231,2025-11-30 12:10:50.632243,0 days 00:00:39.864012,0.0227276051347091,dart,0.5479641752215023,3.2592393982149916,depthwise,1.7789412360225176,0.10835898357765411,3,9,0.49240428530048325,600,tree,0.5880519188947481,0.42386513477725046,0.021727563002800834,undersample,0.9609578996242825,,9.0,0.8858887995174531,0.4947625414725136,uniform,0.5799740078133119,0.22341675208083533,,0.4622342831298055,0.4156490275893261,0.5257279617072198,0.4807073954983923,0.5880519188947481,0.42386513477725046,0.08,0.5041717701485569,0.4624352843578841,0.5164576802507836,0.47611464968152867,0.5353371242891958,0.48538961038961037,undersample,0.43592566189757787,0.37035745791491453,0.9609578996242825,0.5,COMPLETE
2133,0.0,2025-11-30 12:10:51.412295,2025-11-30 12:11:57.204431,0 days 00:01:05.792136,1.9031634048735135,dart,0.5425589261396258,8.477393315953481,depthwise,0.2335566866708997,0.01310618174080441,0,8,0.47242403559822044,800,forest,0.7106366981582054,0.8483861160984087,0.07890359725593335,undersample,0.7845979861154723,,5.0,0.8316172581115436,0.29513996086440847,weighted,0.2803044559879806,0.9854913736106421,,0.44323835368611486,0.4427860696517413,0.0,0.0,0.7106366981582054,0.8483861160984087,0.08,0.5567616463138851,0.5572139303482587,0.0,0.0,0.0,0.0,undersample,0.5,0.5,0.7845979861154723,0.5,COMPLETE
2134,0.7156549520766773,2025-11-30 12:11:57.984199,2025-11-30 12:11:58.880600,0 days 00:00:00.896401,14.362160049743643,gbtree,0.21538564748123878,2.889067713573552,depthwise,69.47828815870221,0.018383943927623627,9,3,14.82071934269039,1000,,0.9779561546551023,0.6095357072967087,0.053887700432110976,oversample,0.8164248284574812,,12.0,0.938590210610979,,,,0.93252227278865,,0.5567616463138851,0.5572139303482587,0.715281812899477,0.7156549520766773,0.9779561546551023,0.6095357072967087,0.08,0.5978184469700382,0.58919146609013,0.5567616463138851,0.5572139303482587,1.0,1.0,oversample,0.5653774101029527,0.5459229866150193,0.8164248284574812,0.5,COMPLETE
2135,0.7156549520766773,2025-11-30 12:11:59.636817,2025-11-30 12:12:06.687985,0 days 00:00:07.051168,0.010912044869831612,gbtree,0.6830263230740525,1.0207172911915185,lossguide,3.4802620891682015,0.00012720981549971437,7,11,0.21949498100586118,600,,0.7640409639546931,0.7608913939019453,0.05756340728609815,oversample,0.9704751649390692,,8.0,0.6176018721015861,,,,0.7103748357925608,,0.5567616463138851,0.5572139303482587,0.715281812899477,0.7156549520766773,0.7640409639546931,0.7608913939019453,0.08,0.5004078985589486,0.4874591987952501,0.5567616463138851,0.5572139303482587,1.0,1.0,oversample,0.41874492282696996,0.41399420293700173,0.9704751649390692,0.5,COMPLETE
2136,0.7156549520766773,2025-11-30 12:12:07.462376,2025-11-30 12:13:44.341227,0 days 00:01:36.878851,0.002019822760099051,dart,0.6241594904095218,9.649279429455298,depthwise,59.175170801008576,0.004232575542189877,6,9,0.10758636114094972,900,forest,0.5362369621244281,0.2038463724664139,0.012354668493190935,undersample,0.6383974507337495,,7.0,0.696686683614239,0.1517744253268536,uniform,0.2969647953922764,0.23307709785324537,,0.5567616463138851,0.5572139303482587,0.715281812899477,0.7156549520766773,0.5362369621244281,0.2038463724664139,0.08,0.5567616463138851,0.5572139303482587,0.5567616463138851,0.5572139303482587,1.0,1.0,undersample,0.5,0.5,0.6383974507337495,0.5,COMPLETE
2137,0.7156549520766773,2025-11-30 12:13:45.127496,2025-11-30 12:14:14.384971,0 days 00:00:29.257475,0.008695432880916584,dart,0.3608043853447246,6.361895490858444,depthwise,0.00029406891898989577,0.4787538864818412,4,9,17.258369049760752,500,forest,0.7861585079793127,0.8264088181406877,0.09630938902119274,oversample,0.7031362484530594,,7.0,0.6616985740490051,0.2645871348563283,uniform,0.48852582187753224,0.9307137267657255,,0.5567616463138851,0.5572139303482587,0.715281812899477,0.7156549520766773,0.7861585079793127,0.8264088181406877,0.1,0.52621349371862,0.5258749495914962,0.5567616463138851,0.5572139303482587,1.0,1.0,oversample,0.4034014986985859,0.3956342112943237,0.7031362484530594,0.5,COMPLETE
2138,0.7201946472019465,2025-11-30 12:14:15.167163,2025-11-30 12:14:15.818544,0 days 00:00:00.651381,0.1288838385849484,gbtree,0.710467678177827,6.873517954472738,lossguide,6.402539495098635,0.26145570861881906,0,11,2.779207020772087,600,,0.7442165439679165,0.8861113262086946,0.053443202816535966,oversample,0.9550656935667334,,7.0,0.7479135258408669,,,,0.4354531271629883,,0.574400723654455,0.5838986883763003,0.7144157814871017,0.7201946472019465,0.7442165439679165,0.8861113262086946,0.08,0.5242874699242928,0.5094332145579754,0.5702519379844961,0.5758754863813229,0.9561332250203087,0.961038961038961,oversample,0.45649505131053236,0.44945851518246815,0.9550656935667334,0.5,COMPLETE
2139,0.7156549520766773,2025-11-30 12:14:16.630194,2025-11-30 12:14:17.431943,0 days 00:00:00.801749,24.243759123282818,gbtree,0.9285801878742725,1.2479644789430067,lossguide,0.3030323539467789,0.030450214284727013,9,11,1.8502162217379765,800,,0.739386318408854,0.37075857320682404,0.00909693392955635,none,0.7822985548203607,1.5998653884252834,5.0,0.8527527679950364,,,,0.535113941214732,,0.5567616463138851,0.5572139303482587,0.715281812899477,0.7156549520766773,0.739386318408854,0.37075857320682404,0.08,0.41776477840281623,0.41814080220818534,0.5567616463138851,0.5572139303482587,1.0,1.0,none,0.27644481838226764,0.2772960249658411,0.7822985548203607,0.5,COMPLETE
2140,0.35704932343954604,2025-11-30 12:14:18.269382,2025-11-30 12:14:18.895339,0 days 00:00:00.625957,0.1007452903428296,gbtree,0.4697192909319612,8.79417462024168,lossguide,0.004467230936575621,0.001147160231064257,6,7,3.197233927330889,600,,0.5827416141698065,0.637792327245818,0.009824991345203671,undersample,0.8664075620183478,,11.0,0.8179761479364788,,,,0.3876399216536247,,0.34780642243328813,0.3337856173677069,0.3795180722891566,0.35704932343954604,0.5827416141698065,0.637792327245818,0.08,0.43862768078032005,0.4355975807380518,0.40347666971637697,0.3862134088762984,0.35824532900081235,0.3319805194805195,undersample,0.291099404830982,0.27973316264940373,0.8664075620183478,0.5,COMPLETE
2141,0.7156549520766773,2025-11-30 12:14:19.692957,2025-11-30 12:14:21.675945,0 days 00:00:01.982988,0.0032295084782628446,gbtree,0.45941830043360893,2.264912779410216,lossguide,0.07702146662395043,0.00010077231279752786,4,7,0.16197310546569157,400,,0.787555558234992,0.8972703082108666,0.02916661334230033,none,0.6135644084496619,1.5050324464135105,7.0,0.6812734143072573,,,,0.9013455137784385,,0.5567616463138851,0.5572139303482587,0.715281812899477,0.7156549520766773,0.787555558234992,0.8972703082108666,0.08,0.5014487696304147,0.4820377892575382,0.5567616463138851,0.5572139303482587,1.0,1.0,none,0.43167534276098746,0.4053989294668559,0.6135644084496619,0.5,COMPLETE
2142,0.7156549520766773,2025-11-30 12:14:22.470675,2025-11-30 12:14:27.771678,0 days 00:00:05.301003,2.3457081563899065,dart,0.8217541827227526,3.7193477984906886,lossguide,46.43495046839785,0.19239160570559305,1,6,0.7866282580916866,200,tree,0.5931057975933616,0.331879665947963,0.08113794039634868,none,0.7362144226582584,1.5629375442561892,10.0,0.7525444245984088,0.11680907250979,weighted,0.12768053376623276,0.6133909718544387,,0.5567616463138851,0.5572139303482587,0.715281812899477,0.7156549520766773,0.5931057975933616,0.331879665947963,0.08,0.5106189911186028,0.5185356852815929,0.5567616463138851,0.5572139303482587,1.0,1.0,none,0.44140071950794935,0.45771385789899577,0.7362144226582584,0.5,COMPLETE
2143,0.0,2025-11-30 12:14:28.555715,2025-11-30 12:16:17.036817,0 days 00:01:48.481102,0.15368186626089325,dart,0.24293032503327128,9.615751443000814,lossguide,0.00013785412317529386,0.012663827595994038,8,3,6.72177224439729,900,forest,0.8818734335941072,0.24294187521724994,0.027741804183599828,none,0.6695592070172642,0.7585979693990786,5.0,0.7619664303142695,0.015144205077953388,weighted,0.3662517602444304,0.3638250895486819,,0.44323835368611486,0.4427860696517413,0.0,0.0,0.8818734335941072,0.24294187521724994,0.08,0.5197081521257841,0.5223072132322114,0.0,0.0,0.0,0.0,none,0.26647449394054945,0.27809444768714436,0.6695592070172642,0.5,COMPLETE
2144,0.46296296296296297,2025-11-30 12:16:17.831948,2025-11-30 12:16:21.745304,0 days 00:00:03.913356,0.02856089899838868,dart,0.7255511695201153,9.088765512228052,lossguide,0.005991611249443494,0.07285549820614083,7,12,1.1928469827734556,200,forest,0.7882975386817623,0.4985999797908361,0.06004710432403803,undersample,0.545635360428389,,7.0,0.9066916783876096,0.41061880047455546,uniform,0.13494725065949595,0.27736900975361733,,0.4251469923111714,0.4491180461329715,0.43435692033822876,0.46296296296296297,0.7882975386817623,0.4985999797908361,0.08,0.5021701514512122,0.5119680990839846,0.48031496062992124,0.5067567567567568,0.39642567018683994,0.42613636363636365,undersample,0.4083236625275618,0.428256785349482,0.545635360428389,0.5,COMPLETE
2145,0.09743589743589744,2025-11-30 12:16:22.515162,2025-11-30 12:16:47.917842,0 days 00:00:25.402680,0.00012652578855627136,dart,0.9830372301937191,8.776183773849764,depthwise,0.5536144324863598,0.0001252025996443666,5,8,71.8338881636614,500,tree,0.89695419154938,0.496484871770778,0.055852309743224485,undersample,0.7014542223659466,,10.0,0.7937076503844601,0.483368871921743,weighted,0.481237356974934,0.5023811791863013,,0.37358661239258256,0.36318407960199006,0.12063492063492064,0.09743589743589744,0.89695419154938,0.496484871770778,0.08,0.46988675652705175,0.46483340538956397,0.2761627906976744,0.23170731707317074,0.07717303005686434,0.06168831168831169,undersample,0.30719259271539645,0.28081057731849357,0.7014542223659466,0.5,COMPLETE
2146,0.2876949740034662,2025-11-30 12:16:48.692028,2025-11-30 12:16:49.512525,0 days 00:00:00.820497,0.06760586863937952,gbtree,0.7794647833886232,3.7743018521539384,lossguide,1.050590933738374,0.00014456292743983453,9,9,25.25117114690687,700,,0.5771388888290018,0.41848471069718995,0.07581834698938779,undersample,0.6177836002524875,,11.0,0.6902855723692716,,,,0.761871314153366,,0.4391677973767526,0.4423337856173677,0.29304446978335236,0.2876949740034662,0.5771388888290018,0.41848471069718995,0.08,0.6125869897322591,0.6175928875584256,0.491395793499044,0.49899799599198397,0.20877335499593827,0.2021103896103896,undersample,0.5785904938742353,0.5825633763580649,0.6177836002524875,0.5,COMPLETE
2147,0.034375,2025-11-30 12:16:50.284118,2025-11-30 12:16:50.730101,0 days 00:00:00.445983,0.005027432989570434,gbtree,0.45073641818793053,6.4937273062938585,lossguide,0.10096075604390303,0.3454056936058375,9,11,3.933846905140258,300,,0.5956010985087246,0.6228188533516568,0.03672514125601705,none,0.7308196806594184,0.5668500116236214,9.0,0.8317642784954593,,,,0.4289180831972834,,0.45092718227046585,0.44097693351424694,0.04559748427672956,0.034375,0.5956010985087246,0.6228188533516568,0.08,0.526109942514502,0.4909436241734639,0.7073170731707317,0.4583333333333333,0.023558082859463852,0.017857142857142856,none,0.4311096006233525,0.37913264595465823,0.7308196806594184,0.5,COMPLETE
2148,0.0,2025-11-30 12:16:51.529266,2025-11-30 12:18:14.100781,0 days 00:01:22.571515,0.0011705644151321407,dart,0.47074993582299807,6.832706964459297,lossguide,0.12883288277836136,0.12153442983509656,5,7,0.22970062796991078,800,tree,0.8501018843674681,0.8009342980212979,0.07571297778090658,none,0.6781265887689497,0.5171729781806363,7.0,0.6866100151286405,0.05756892508821593,weighted,0.736865175912561,0.9783468938241713,,0.44323835368611486,0.4427860696517413,0.0,0.0,0.8501018843674681,0.8009342980212979,0.08,0.5567616463138851,0.5572139303482587,0.0,0.0,0.0,0.0,none,0.5,0.5,0.6781265887689497,0.5,COMPLETE
2149,0.7156549520766773,2025-11-30 12:18:14.884265,2025-11-30 12:18:15.259631,0 days 00:00:00.375366,46.29764714118846,gbtree,0.9060687789857973,4.54386298099938,lossguide,72.05106099357593,0.0009252116030663461,1,7,1.6523875252530922,200,,0.9714197231055082,0.5739092144101141,0.07433402256486647,undersample,0.6829460726784671,,7.0,0.8807517838957283,,,,0.31178412123181287,,0.5567616463138851,0.5572139303482587,0.715281812899477,0.7156549520766773,0.9714197231055082,0.5739092144101141,0.08,0.5567616463138851,0.5572139303482587,0.5567616463138851,0.5572139303482587,1.0,1.0,undersample,0.5,0.5,0.6829460726784671,0.5,COMPLETE
2150,0.6889723455104131,2025-11-30 12:18:16.038346,2025-11-30 12:18:47.312827,0 days 00:00:31.274481,0.04990758807370292,dart,0.3238955325235833,8.89762135819764,depthwise,0.00023500045294421918,0.008320154786067326,1,4,0.19516847012165883,500,forest,0.7793654954032445,0.43143194991789563,0.05080443388649867,undersample,0.9310831335210137,,8.0,0.8958332986012287,0.3163828205531551,uniform,0.7132996505974015,0.4277552531123444,,0.6051560379918589,0.5879692446856626,0.7007199177236887,0.6889723455104131,0.7793654954032445,0.43143194991789563,0.08,0.5417449123426351,0.5401507255117063,0.6061684460260973,0.5945786682380672,0.8302193338748984,0.8189935064935064,undersample,0.48664268306835323,0.4748612916705358,0.9310831335210137,0.5,COMPLETE
2151,0.7156549520766773,2025-11-30 12:18:48.070257,2025-11-30 12:19:53.161132,0 days 00:01:05.090875,0.5051585171086325,dart,0.8508653453208497,9.958300034113988,lossguide,8.007399641155509,0.00011299964187107858,8,7,6.830554671299298,900,forest,0.9768530909815417,0.7566769685569308,0.015851485058039905,oversample,0.7697509625137242,,9.0,0.7364252479754916,0.42321308198943236,uniform,0.05235876213904026,0.931519109438308,,0.5567616463138851,0.5572139303482587,0.715281812899477,0.7156549520766773,0.9768530909815417,0.7566769685569308,0.08,0.52621349371862,0.5258749495914962,0.5567616463138851,0.5572139303482587,1.0,1.0,oversample,0.4034014986985859,0.3956342112943237,0.7697509625137242,0.5,COMPLETE
