number,value,datetime_start,datetime_complete,duration,params_alpha,params_booster,params_colsample_bytree,params_gamma,params_grow_policy,params_lambda,params_learning_rate,params_max_delta_step,params_max_depth,params_min_child_weight,params_n_estimators,params_normalize_type,params_params_feature_fraction,params_params_labeled_ratio,params_params_missing_rate,params_params_resampling,params_params_sample_rows,params_params_scale_pos_weight,params_params_selftrain_max_iter,params_params_selftrain_threshold,params_rate_drop,params_sample_type,params_skip_drop,params_subsample,params_user_attrs_decision_threshold,user_attrs_acc_test,user_attrs_acc_val,user_attrs_f1_test,user_attrs_f1_val,user_attrs_feature_fraction,user_attrs_labeled_ratio,user_attrs_missing_rate,user_attrs_pr_auc_test,user_attrs_pr_auc_val,user_attrs_prec_test,user_attrs_prec_val,user_attrs_rec_test,user_attrs_rec_val,user_attrs_resampling_strategy,user_attrs_roc_auc_test,user_attrs_roc_auc_val,user_attrs_sample_rows,user_attrs_user_attrs_decision_threshold,state
1214,0.7156549520766773,2025-11-27 00:54:51.009069,2025-11-27 00:54:51.736152,0 days 00:00:00.727083,6.573331494814531,gbtree,0.9658359580575421,1.445237998422721,lossguide,7.250685926574893,0.06590864486994301,9,4,11.161324001524294,400,,0.8019039824454911,0.5026594125376862,0.00031698048408577983,oversample,0.5943719545000834,,5.0,0.6751922383780109,,,,0.8921413203564094,0.43762568052610334,0.5567616463138851,0.5572139303482587,0.715281812899477,0.7156549520766773,0.8019039824454911,0.5026594125376862,0.0,0.5614855950827153,0.5481030142968362,0.5567616463138851,0.5572139303482587,1.0,1.0,oversample,0.5379312488602265,0.5215462206332993,0.5943719545000834,0.43762568052610334,COMPLETE
1215,0.7156549520766773,2025-11-27 00:54:51.924544,2025-11-27 00:54:52.660736,0 days 00:00:00.736192,0.0015612948934405856,gbtree,0.9877107732639413,3.005743422974086,lossguide,22.4009227399714,0.1446665301802451,10,7,18.424242995819963,400,,0.6838909272076903,0.48881654890988396,0.03163223275809573,oversample,0.7338811489168999,,8.0,0.7641992065119432,,,,0.3789806152595111,0.20934540502114027,0.5567616463138851,0.5572139303482587,0.715281812899477,0.7156549520766773,0.6838909272076903,0.48881654890988396,0.02,0.4598864793803576,0.4655850294992806,0.5567616463138851,0.5572139303482587,1.0,1.0,oversample,0.37000116049669257,0.3709195873074831,0.7338811489168999,0.20934540502114027,COMPLETE
1216,0.7156549520766773,2025-11-27 00:54:52.842221,2025-11-27 00:54:53.515777,0 days 00:00:00.673556,1.002726161257867,gbtree,0.8522947759048892,3.9035548369891093,lossguide,3.149134817600512,0.010476507991419318,10,5,5.284728815899548,300,,0.947330372444999,0.23604011759573762,0.005164840478894954,none,0.7917013846192844,0.6591313837751444,6.0,0.6999695194954815,,,,0.2730493122231868,0.3723056817359638,0.5567616463138851,0.5572139303482587,0.715281812899477,0.7156549520766773,0.947330372444999,0.23604011759573762,0.0,0.7030114552331868,0.6826060931560329,0.5567616463138851,0.5572139303482587,1.0,1.0,none,0.6539075581491736,0.6338357122958758,0.7917013846192844,0.3723056817359638,COMPLETE
1217,0.7162790697674418,2025-11-27 00:54:53.698461,2025-11-27 00:55:25.568280,0 days 00:00:31.869819,0.12059529919086502,dart,0.7470116999846398,1.2891076631869192,lossguide,0.596112185773749,0.019004282133727526,10,5,13.102260105361701,500,forest,0.9331849721665227,0.4468821710563915,0.015948473874803623,oversample,0.6057740297430825,,7.0,0.7588128559000843,0.0996234213611123,uniform,0.20943922108419954,0.2650540135794941,0.35598890152525187,0.5581184984170059,0.5585707824513795,0.7159057865658621,0.7162790697674418,0.9331849721665227,0.4468821710563915,0.02,0.6644396535840358,0.6449070621399384,0.5575181159420289,0.5579710144927537,1.0,1.0,oversample,0.6505603541172765,0.6371678627807331,0.6057740297430825,0.35598890152525187,COMPLETE
1218,0.7156549520766773,2025-11-27 00:55:25.749317,2025-11-27 00:55:37.787834,0 days 00:00:12.038517,0.11974393783174443,dart,0.7591982247772204,1.1075225234541124,lossguide,0.09114025274359948,0.011080401206602485,9,3,25.055729915583942,300,forest,0.9490565354497397,0.5082754933429612,0.027429811056401368,oversample,0.6528956026607524,,9.0,0.7307194253763544,0.060359611566541925,uniform,0.1817130702484991,0.26863177174427894,0.38664832418461875,0.5567616463138851,0.5572139303482587,0.715281812899477,0.7156549520766773,0.9490565354497397,0.5082754933429612,0.02,0.514630136696368,0.5119699839123987,0.5567616463138851,0.5572139303482587,1.0,1.0,oversample,0.47876912747227246,0.47030663412175155,0.6528956026607524,0.38664832418461875,COMPLETE
1219,0.7156549520766773,2025-11-27 00:55:37.960092,2025-11-27 00:55:38.783295,0 days 00:00:00.823203,0.010961054970438238,gbtree,0.7431031611610615,2.5495741835907118,lossguide,0.034713187431137264,0.002920535632174698,9,5,90.19615586050803,500,,0.7598267268461513,0.7493260524802517,0.017865107424271772,oversample,0.6499263485439674,,5.0,0.721058052875135,,,,0.4533142721239183,0.26540560706143945,0.5567616463138851,0.5572139303482587,0.715281812899477,0.7156549520766773,0.7598267268461513,0.7493260524802517,0.02,0.5885766502786182,0.5880779368872923,0.5567616463138851,0.5572139303482587,1.0,1.0,oversample,0.5661329763424461,0.5511960587930966,0.6499263485439674,0.26540560706143945,COMPLETE
1220,0.7156549520766773,2025-11-27 00:55:38.963709,2025-11-27 00:56:55.328465,0 days 00:01:16.364756,6.873505467942777,dart,0.7856481779662762,2.764909043150367,lossguide,0.10809770011094572,0.0106246451233387,8,3,17.367464476692234,800,forest,0.8715320062574702,0.18934632027991705,0.028325883099970892,oversample,0.5964240385902332,,7.0,0.778518602014489,0.12350555576867644,uniform,0.2679372127682258,0.27769222920219894,0.5240952765768789,0.5567616463138851,0.5572139303482587,0.715281812899477,0.7156549520766773,0.8715320062574702,0.18934632027991705,0.02,0.6751169922262534,0.7053267530227665,0.5567616463138851,0.5572139303482587,1.0,1.0,oversample,0.5969163945025614,0.6394740027592428,0.5964240385902332,0.5240952765768789,COMPLETE
1221,0.7116821033761578,2025-11-27 00:56:55.503049,2025-11-27 00:56:56.232188,0 days 00:00:00.729139,0.08516731277283665,gbtree,0.8061346974424838,2.2814190240347534,lossguide,0.005514621424890108,0.028378065727935005,10,11,74.28183302153396,300,,0.9165521448751272,0.5952838670626254,0.012277872731799202,oversample,0.6484293531409191,,7.0,0.6708638009281568,,,,0.4036556548398671,0.49473908348463747,0.5730438715513342,0.5635459068294889,0.7168566286742651,0.7116821033761578,0.9165521448751272,0.5952838670626254,0.02,0.519921779436625,0.4980996129673736,0.5682358535425582,0.5631205673758866,0.9707554833468724,0.9667207792207793,oversample,0.4936790231933553,0.4483719804199885,0.6484293531409191,0.49473908348463747,COMPLETE
1222,0.02531645569620253,2025-11-27 00:56:56.419328,2025-11-27 00:57:08.832197,0 days 00:00:12.412869,0.052405718392689905,dart,0.813595567278497,4.283003455073922,depthwise,0.2975334207052558,0.03005842942334035,10,5,5.907191927133772,300,forest,0.8254789206383335,0.3979664097571954,0.014696497432007918,oversample,0.5572311530734978,,6.0,0.8472257383957703,0.03598559687208984,uniform,0.23498466354753772,0.4064471690863628,0.6590142626459934,0.4396200814111262,0.4427860696517413,0.014319809069212411,0.02531645569620253,0.8254789206383335,0.3979664097571954,0.02,0.524484170259809,0.5315338080038474,0.34615384615384615,0.5,0.007311129163281885,0.012987012987012988,oversample,0.47545881065667533,0.4765207341177719,0.5572311530734978,0.6590142626459934,COMPLETE
1223,0.7156549520766773,2025-11-27 00:57:09.011632,2025-11-27 00:58:49.514891,0 days 00:01:40.503259,39.64721472827813,dart,0.8971493712705416,7.297906230824486,lossguide,1.1090178725608604,0.0017253375640177157,9,5,30.101243883001676,900,forest,0.6349540273501372,0.07780462375100247,0.0874609357948367,oversample,0.9800427687208709,,10.0,0.9369473568018506,0.10821938175510346,uniform,0.34097681692259924,0.5353495201053997,0.17721842785047384,0.5567616463138851,0.5572139303482587,0.715281812899477,0.7156549520766773,0.6349540273501372,0.07780462375100247,0.08,0.5567616463138851,0.5572139303482587,0.5567616463138851,0.5572139303482587,1.0,1.0,oversample,0.5,0.5,0.9800427687208709,0.17721842785047384,COMPLETE
1224,0.7156549520766773,2025-11-27 00:58:49.694787,2025-11-27 00:59:10.947564,0 days 00:00:21.252777,0.014962607848344554,dart,0.49777627826160875,5.850412821314345,lossguide,0.14388624663013008,0.019251501929175633,10,7,33.87091559286103,400,forest,0.8983539123416695,0.32785385240658454,0.003347340194133684,oversample,0.551231087709821,,7.0,0.6686350735097311,0.00816102419403704,uniform,0.000626897953743849,0.21745912612616047,0.32356076849549653,0.5567616463138851,0.5572139303482587,0.715281812899477,0.7156549520766773,0.8983539123416695,0.32785385240658454,0.0,0.47700911103526256,0.48257345853305883,0.5567616463138851,0.5572139303482587,1.0,1.0,oversample,0.3288387572738275,0.3397989268137378,0.551231087709821,0.32356076849549653,COMPLETE
1225,0.6794520547945205,2025-11-27 00:59:11.129765,2025-11-27 00:59:12.217125,0 days 00:00:01.087360,0.030224404805620442,gbtree,0.6545288466205161,2.0732723358933574,lossguide,0.08269624301076496,0.06333561194602556,9,6,6.278892739979366,300,,0.7891390421470468,0.6899486608013374,0.023638088695918824,oversample,0.7995028338755343,,9.0,0.7711416385466957,,,,0.6571685956679689,0.5114643762109002,0.555857078245138,0.576662143826323,0.6646174863387978,0.6794520547945205,0.7891390421470468,0.6899486608013374,0.02,0.5867137075760176,0.5947559923387329,0.5733647613435474,0.5876777251184834,0.7904142973192526,0.8051948051948052,oversample,0.5386594605348232,0.558109918681931,0.7995028338755343,0.5114643762109002,COMPLETE
1226,0.7156549520766773,2025-11-27 00:59:12.395150,2025-11-27 01:00:29.344382,0 days 00:01:16.949232,0.0019409884461427053,dart,0.6953281350962589,3.093472337615103,depthwise,0.4592002840431799,0.00949413906499186,10,8,84.79813620887822,800,forest,0.9143846723711069,0.5444840564797393,0.015728698057623718,undersample,0.651792909409519,,8.0,0.7654012139762436,0.11035755283173199,uniform,0.21385874068225713,0.2638182565255122,0.4902147984818721,0.5567616463138851,0.5572139303482587,0.715281812899477,0.7156549520766773,0.9143846723711069,0.5444840564797393,0.02,0.5567616463138851,0.5572139303482587,0.5567616463138851,0.5572139303482587,1.0,1.0,undersample,0.5,0.5,0.651792909409519,0.4902147984818721,COMPLETE
1227,0.2247596153846154,2025-11-27 01:00:29.525574,2025-11-27 01:00:30.267839,0 days 00:00:00.742265,0.04046817545642625,gbtree,0.8158110564376566,2.100157351803355,lossguide,0.006875062256649952,0.05522826344174842,8,4,46.89725852074987,300,,0.9042009468558437,0.6896715555779352,0.016276964015837055,undersample,0.8385210889242475,,5.0,0.7169983966187988,,,,0.7048511866394321,0.5452091093171104,0.43419267299864317,0.41655359565807326,0.24502112251056127,0.2247596153846154,0.9042009468558437,0.6896715555779352,0.02,0.5176474700174825,0.5072860432833872,0.4765258215962441,0.43287037037037035,0.16490658001624695,0.15178571428571427,undersample,0.4732849516736021,0.4614754818725707,0.8385210889242475,0.5452091093171104,COMPLETE
1228,0.7156549520766773,2025-11-27 01:00:30.447495,2025-11-27 01:01:00.633079,0 days 00:00:30.185584,0.06990833850535848,dart,0.890490845902648,2.298450953376594,lossguide,0.5982537318690114,0.009936370839547688,9,5,64.38450193784692,500,tree,0.8140460526556166,0.3168334164745226,0.020261272461575736,oversample,0.56311307581531,,5.0,0.7605595544482425,0.10231435063431778,uniform,0.15310153406448473,0.35079985487928217,0.2876856107188219,0.5567616463138851,0.5572139303482587,0.715281812899477,0.7156549520766773,0.8140460526556166,0.3168334164745226,0.02,0.5567616463138851,0.5572139303482587,0.5567616463138851,0.5572139303482587,1.0,1.0,oversample,0.5,0.5,0.56311307581531,0.2876856107188219,COMPLETE
1229,0.7156549520766773,2025-11-27 01:01:00.801789,2025-11-27 01:01:01.425427,0 days 00:00:00.623638,0.01384503552895335,gbtree,0.5592005406662678,5.2838709943770015,lossguide,2.972539949370577,0.02603140825523604,7,4,4.490396044601878,300,,0.793903685739488,0.6018191910490402,0.000697541495637808,oversample,0.6414854734596768,,6.0,0.6536303130233929,,,,0.5124226545858818,0.3919015901154988,0.5567616463138851,0.5572139303482587,0.715281812899477,0.7156549520766773,0.793903685739488,0.6018191910490402,0.0,0.5073369318828471,0.526833244600164,0.5567616463138851,0.5572139303482587,1.0,1.0,oversample,0.4312194333460435,0.4583514353368796,0.6414854734596768,0.3919015901154988,COMPLETE
1230,0.04527712724434036,2025-11-27 01:01:01.596281,2025-11-27 01:01:41.632739,0 days 00:00:40.036458,0.04730171632358622,dart,0.6854242005638406,0.661717866192762,lossguide,5.298067877753757,0.0030270336569590654,10,6,21.543763873216374,600,forest,0.9873670232573143,0.444161840806494,0.003701735740381457,oversample,0.6160997906968932,,6.0,0.7985862243363115,0.19299844706722666,uniform,0.0773257803279144,0.3895543903558483,0.6145951112584163,0.45680687471732245,0.4468566259611036,0.05803921568627451,0.04527712724434036,0.9873670232573143,0.444161840806494,0.0,0.651821009516762,0.6585232970064971,0.8409090909090909,0.5918367346938775,0.030056864337936636,0.02353896103896104,oversample,0.587557817603077,0.6221781601952695,0.6160997906968932,0.6145951112584163,COMPLETE
1231,0.7117458466919265,2025-11-27 01:01:41.802517,2025-11-27 01:01:43.275578,0 days 00:00:01.473061,1.690238871578853,gbtree,0.8758910848232302,3.012173213855103,lossguide,0.146734644129727,0.10553652413082178,9,6,3.6860024986100037,300,,0.7575877948807459,0.5412824930105398,0.0010754441483549638,oversample,0.7157964097652354,,6.0,0.766587872412803,,,,0.3080303598676718,0.26198682995794764,0.5517865219357757,0.5526910900045229,0.7106569343065693,0.7117458466919265,0.7575877948807459,0.5412824930105398,0.0,0.4827470636919847,0.47974578949944746,0.5546946216955333,0.5552523874488404,0.9886271324126726,0.9910714285714286,oversample,0.4269633117259901,0.41883407067906564,0.7157964097652354,0.26198682995794764,COMPLETE
1232,0.7156549520766773,2025-11-27 01:01:43.454878,2025-11-27 01:01:54.412829,0 days 00:00:10.957951,0.0008316498058340366,dart,0.7245208627664979,1.4120646009112865,lossguide,23.914789983554314,0.0025180233781708994,6,11,41.33286562652506,300,forest,0.9218818672267409,0.18121199890087789,0.09616579877600301,oversample,0.5125119593005789,,6.0,0.7063763852744728,0.13717491152114472,uniform,0.2038850459921499,0.5258453458814683,0.47906921621803006,0.5567616463138851,0.5572139303482587,0.715281812899477,0.7156549520766773,0.9218818672267409,0.18121199890087789,0.1,0.5567616463138851,0.5572139303482587,0.5567616463138851,0.5572139303482587,1.0,1.0,oversample,0.5,0.5,0.5125119593005789,0.47906921621803006,COMPLETE
1233,0.7156549520766773,2025-11-27 01:01:54.590372,2025-11-27 01:06:46.921768,0 days 00:04:52.331396,0.06363931110768382,dart,0.8369098450337045,1.3834484718306779,lossguide,0.3366127456435194,0.022117700884821664,10,7,5.165276257602009,700,forest,0.7125159896136368,0.650060132036466,0.011148833453489146,oversample,0.7053068023195053,,8.0,0.7292509753774236,0.0844108084784069,uniform,0.19479341369679679,0.30483440702256576,0.14170638674978717,0.5567616463138851,0.5572139303482587,0.715281812899477,0.7156549520766773,0.7125159896136368,0.650060132036466,0.02,0.5130852291078696,0.496820671533482,0.5567616463138851,0.5572139303482587,1.0,1.0,oversample,0.43578557336825874,0.42191583314540404,0.7053068023195053,0.14170638674978717,COMPLETE
1234,0.6529209621993127,2025-11-27 01:06:47.104678,2025-11-27 01:09:16.345365,0 days 00:02:29.240687,0.007286212955483546,dart,0.47947808204715753,0.6180908244840364,lossguide,0.26225676412562204,0.1679654302895214,10,5,2.503440787777457,500,forest,0.9384769856800069,0.1935140574259726,0.016437065548937844,oversample,0.5399826377065994,,8.0,0.8176515339635333,0.08642508975621203,uniform,0.3698461967451976,0.3570978066936728,0.23270599450625204,0.4943464495703302,0.4975124378109453,0.650843222985634,0.6529209621993127,0.9384769856800069,0.1935140574259726,0.02,0.48538848259638007,0.47447268178368396,0.5286656519533232,0.5307262569832403,0.8464662875710804,0.8482142857142857,oversample,0.399736815928646,0.38234955162304496,0.5399826377065994,0.23270599450625204,COMPLETE
1235,0.7156549520766773,2025-11-27 01:09:16.529360,2025-11-27 01:09:28.361292,0 days 00:00:11.831932,0.011811013323463373,dart,0.9884963302058717,0.41834877728071884,lossguide,22.04587431379297,0.11746464158347077,9,8,56.495060935227066,300,forest,0.9834126468998129,0.6786811277272982,0.05209416572212227,none,0.6264075273405353,4.742537465382608,5.0,0.6292232163941909,0.14941119569353528,uniform,0.17026664200745695,0.525827131429795,0.2742676073472007,0.5567616463138851,0.5572139303482587,0.715281812899477,0.7156549520766773,0.9834126468998129,0.6786811277272982,0.05,0.5839796258559309,0.5863691444625837,0.5567616463138851,0.5572139303482587,1.0,1.0,none,0.5659269881795123,0.5738814620007163,0.6264075273405353,0.2742676073472007,COMPLETE
1236,0.0,2025-11-27 01:09:28.545731,2025-11-27 01:09:29.884805,0 days 00:00:01.339074,16.63486818602144,gbtree,0.5104780181515055,0.0004672023235840154,depthwise,0.0002621249331204414,0.002507739281825303,10,9,0.7602349655796138,700,,0.748423842863854,0.8343080390959801,0.041132354045819504,oversample,0.9860392464319405,,6.0,0.6913098451839081,,,,0.2746847174294313,0.6873975424547052,0.44323835368611486,0.4427860696517413,0.0,0.0,0.748423842863854,0.8343080390959801,0.05,0.45905177670707303,0.45590080936991695,0.0,0.0,0.0,0.0,oversample,0.3653624894311908,0.3475688318321107,0.9860392464319405,0.6873975424547052,COMPLETE
1237,0.7156549520766773,2025-11-27 01:09:30.068418,2025-11-27 01:10:32.480504,0 days 00:01:02.412086,26.42048450636884,dart,0.7933343183166176,2.0718441875358486,lossguide,0.9095645871452699,0.006205488617065568,9,8,1.9436886293023576,700,forest,0.9491434593575826,0.4345157548800101,0.008659525565829074,oversample,0.5134982780985572,,6.0,0.6640337566693555,0.06689096300138832,uniform,0.1546958556996154,0.2728784533698642,0.37024364880938704,0.5567616463138851,0.5572139303482587,0.715281812899477,0.7156549520766773,0.9491434593575826,0.4345157548800101,0.0,0.5567616463138851,0.5572139303482587,0.5567616463138851,0.5572139303482587,1.0,1.0,oversample,0.5,0.5,0.5134982780985572,0.37024364880938704,COMPLETE
1238,0.0031397174254317113,2025-11-27 01:10:32.662327,2025-11-27 01:10:33.390931,0 days 00:00:00.728604,0.17403927072163847,gbtree,0.6744053995811837,1.116980071168881,lossguide,0.8926029893155635,0.06190726941018821,7,5,62.59896803789136,300,,0.8428373239590801,0.5685824236282961,0.0054356536578570695,oversample,0.6462909882943378,,6.0,0.8147140818041965,,,,0.4237338783428634,0.63584872783475,0.4292175486205337,0.425599276345545,0.009419152276295133,0.0031397174254317113,0.8428373239590801,0.5685824236282961,0.0,0.49127201660332764,0.4747776329956625,0.13953488372093023,0.047619047619047616,0.00487408610885459,0.0016233766233766235,oversample,0.42900329912631174,0.39810119655625276,0.6462909882943378,0.63584872783475,COMPLETE
1239,0.7156549520766773,2025-11-27 01:10:33.578190,2025-11-27 01:10:34.460116,0 days 00:00:00.881926,39.242024148561796,gbtree,0.9661384543040497,1.8266841667788114,lossguide,0.04228115216557791,0.046879759116496875,10,5,13.480392265127987,700,,0.9479562411035659,0.801120590577548,0.015515061600173024,none,0.6747659740728679,1.1847072393029054,5.0,0.6607515669148973,,,,0.43958692178987957,0.3970923837208281,0.5567616463138851,0.5572139303482587,0.715281812899477,0.7156549520766773,0.9479562411035659,0.801120590577548,0.02,0.46492916050647737,0.4474878567614553,0.5567616463138851,0.5572139303482587,1.0,1.0,none,0.3356392678923722,0.31049731040154943,0.6747659740728679,0.3970923837208281,COMPLETE
1240,0.7156549520766773,2025-11-27 01:10:34.647349,2025-11-27 01:11:05.741864,0 days 00:00:31.094515,0.9522395611839692,dart,0.6412414951534674,1.5132620710650981,lossguide,4.1766088670353065,0.003753581163127328,10,4,1.5982336899528482,500,forest,0.8461464044580327,0.22200483323057546,0.020751958100868946,none,0.5221941051690819,1.1767287215184532,6.0,0.7084324112515497,0.1487472870933066,uniform,0.13704286975561975,0.35368323309267546,0.37492833948247495,0.5567616463138851,0.5572139303482587,0.715281812899477,0.7156549520766773,0.8461464044580327,0.22200483323057546,0.02,0.5302152484589936,0.536721608453742,0.5567616463138851,0.5572139303482587,1.0,1.0,none,0.47687917571577776,0.4863028633776846,0.5221941051690819,0.37492833948247495,COMPLETE
1241,0.7156549520766773,2025-11-27 01:11:05.920268,2025-11-27 01:11:43.403729,0 days 00:00:37.483461,2.6168857610837515,dart,0.9404213976453639,0.35217388994003795,lossguide,0.718289061940495,0.00836577625823117,9,11,5.028143508880378,300,forest,0.9912631532273671,0.1568568127600336,0.08698001747932285,oversample,0.5620823857941426,,5.0,0.6420871193453693,0.04099518694651545,weighted,0.006502921190416691,0.39263649859951,0.09447564590041213,0.5567616463138851,0.5572139303482587,0.715281812899477,0.7156549520766773,0.9912631532273671,0.1568568127600336,0.08,0.6301402844190812,0.6102664683837734,0.5567616463138851,0.5572139303482587,1.0,1.0,oversample,0.598246406604884,0.5635890220606767,0.5620823857941426,0.09447564590041213,COMPLETE
