number,value,datetime_start,datetime_complete,duration,params_alpha,params_booster,params_colsample_bytree,params_gamma,params_grow_policy,params_lambda,params_learning_rate,params_max_delta_step,params_max_depth,params_min_child_weight,params_n_estimators,params_normalize_type,params_params_feature_fraction,params_params_labeled_ratio,params_params_missing_rate,params_params_resampling,params_params_sample_rows,params_params_scale_pos_weight,params_params_selftrain_max_iter,params_params_selftrain_threshold,params_rate_drop,params_sample_type,params_skip_drop,params_subsample,params_user_attrs_decision_threshold,user_attrs_acc_test,user_attrs_acc_val,user_attrs_f1_test,user_attrs_f1_val,user_attrs_feature_fraction,user_attrs_labeled_ratio,user_attrs_missing_rate,user_attrs_pr_auc_test,user_attrs_pr_auc_val,user_attrs_prec_test,user_attrs_prec_val,user_attrs_rec_test,user_attrs_rec_val,user_attrs_resampling_strategy,user_attrs_roc_auc_test,user_attrs_roc_auc_val,user_attrs_sample_rows,user_attrs_user_attrs_decision_threshold,state
522,0.0,2025-11-26 19:42:39.442792,2025-11-26 19:42:44.195876,0 days 00:00:04.753084,0.13106188624347848,dart,0.8981244911734975,8.439349386741664,depthwise,0.00011237966505910097,0.011299938255936916,10,4,0.13664918313870442,200,tree,0.8854293908648497,0.8597759181742857,0.017989898788085115,oversample,0.8129590801794677,,11.0,0.9142080820654097,0.3558479903708958,weighted,0.46834175042505466,0.3050263475981648,0.7114325797207787,0.44323835368611486,0.4427860696517413,0.0,0.0,0.8854293908648497,0.8597759181742857,0.02,0.43806169872631695,0.4357623491606285,0.0,0.0,0.0,0.0,oversample,0.28134252888807837,0.2750077106244113,0.8129590801794677,0.7114325797207787,COMPLETE
523,0.7156549520766773,2025-11-26 19:42:44.368145,2025-11-26 19:43:01.751801,0 days 00:00:17.383656,0.05384664476518071,dart,0.754319346168202,6.012793340352108,lossguide,0.619347808103429,0.05284182187550954,2,4,0.5334367627959952,400,forest,0.8513142087429066,0.6702408513522602,0.08125377997562526,none,0.8907252494128313,2.576870908635295,6.0,0.6591966143443637,0.31436348871197684,uniform,0.35990588968849496,0.46532164236442236,0.07253278180599443,0.5567616463138851,0.5572139303482587,0.715281812899477,0.7156549520766773,0.8513142087429066,0.6702408513522602,0.08,0.5619159385941559,0.5611757250240684,0.5567616463138851,0.5572139303482587,1.0,1.0,none,0.525673917007908,0.5290964143109189,0.8907252494128313,0.07253278180599443,COMPLETE
524,0.7156549520766773,2025-11-26 19:43:01.924798,2025-11-26 19:43:31.428796,0 days 00:00:29.503998,0.001369930321623024,dart,0.4152418557389811,0.7791847570196102,depthwise,58.70923470295548,0.1210701706037933,2,11,75.86680137771742,500,forest,0.9841203615301818,0.08013714179323815,0.037108830813414484,undersample,0.6665997503785798,,10.0,0.7146033455973972,0.3367922439751157,weighted,0.5402590002242933,0.8505472030280621,0.3739472196240704,0.5567616463138851,0.5572139303482587,0.715281812899477,0.7156549520766773,0.9841203615301818,0.08013714179323815,0.05,0.5567616463138851,0.5572139303482587,0.5567616463138851,0.5572139303482587,1.0,1.0,undersample,0.5,0.5,0.6665997503785798,0.3739472196240704,COMPLETE
525,0.6419213973799127,2025-11-26 19:43:31.625372,2025-11-26 19:43:34.284207,0 days 00:00:02.658835,1.7541506767367294,gbtree,0.5921679185855399,1.853852166554503,depthwise,0.3023369403655151,0.37831899675889236,3,4,3.5757725045220514,600,,0.7128176484976345,0.4044582213360995,0.0049426622202664704,oversample,0.9650047143227231,,7.0,0.7261139218488113,,,,0.5337356832457311,0.44615005161733357,0.5906829488919041,0.5549525101763908,0.673167208378476,0.6419213973799127,0.7128176484976345,0.4044582213360995,0.0,0.6024005441209328,0.5718846069709744,0.6059817945383615,0.5817941952506597,0.7571080422420796,0.7159090909090909,oversample,0.5741627845289212,0.5352881286231643,0.9650047143227231,0.44615005161733357,COMPLETE
526,0.7156549520766773,2025-11-26 19:43:34.475340,2025-11-26 19:43:45.655830,0 days 00:00:11.180490,1.2127447402595855,dart,0.591545110727212,1.981171829406969,lossguide,2.076668609975309,0.0023752869245259093,1,7,1.3302560036217936,300,forest,0.6034314667631673,0.7775637453394291,0.061010166944388135,undersample,0.912924069405275,,5.0,0.6464294428138184,0.23278884991721271,weighted,0.28854120169446534,0.2349862261327269,0.1869698953251943,0.5567616463138851,0.5572139303482587,0.715281812899477,0.7156549520766773,0.6034314667631673,0.7775637453394291,0.05,0.6138481610644404,0.641900699094661,0.5567616463138851,0.5572139303482587,1.0,1.0,undersample,0.5664268306835325,0.5732840958836873,0.912924069405275,0.1869698953251943,COMPLETE
527,0.7156549520766773,2025-11-26 19:43:45.828064,2025-11-26 19:44:41.928645,0 days 00:00:56.100581,0.031395148997756514,dart,0.6580382428380058,9.927425968083924,lossguide,0.042314157929730735,0.017551778239280887,1,4,0.28112411633753853,700,forest,0.7561426167860662,0.2359964990569801,0.08002877648284297,oversample,0.8433138548948056,,11.0,0.6072801253017642,0.31156518388415266,uniform,0.6092645094351133,0.8282557823651348,0.18965842825903376,0.5567616463138851,0.5572139303482587,0.715281812899477,0.7156549520766773,0.7561426167860662,0.2359964990569801,0.08,0.6303740245911178,0.622248988831322,0.5567616463138851,0.5572139303482587,1.0,1.0,oversample,0.616275551650392,0.5893242674077711,0.8433138548948056,0.18965842825903376,COMPLETE
528,0.7156549520766773,2025-11-26 19:44:42.100112,2025-11-26 19:44:42.940044,0 days 00:00:00.839932,9.572015986557435,gbtree,0.6433326192375062,5.677130148289373,lossguide,11.79022007755891,0.004324058139410602,10,8,9.909927981521724,700,,0.8341261054441288,0.33525023449076974,0.07770147174857077,undersample,0.9447288251410448,,6.0,0.9456603819063276,,,,0.6149748479240087,0.36875329100032694,0.5567616463138851,0.5572139303482587,0.715281812899477,0.7156549520766773,0.8341261054441288,0.33525023449076974,0.08,0.8472098237937027,0.8385687504316521,0.5567616463138851,0.5572139303482587,1.0,1.0,undersample,0.8428393209436496,0.8260346331400978,0.9447288251410448,0.36875329100032694,COMPLETE
529,0.0,2025-11-26 19:44:43.124560,2025-11-26 19:44:43.820880,0 days 00:00:00.696320,34.311619307825744,gbtree,0.22188102600733328,6.167460874981338,depthwise,0.11053502080569401,0.025876621316924284,5,5,46.18844638293652,500,,0.5291677506651549,0.12322294142973317,0.09591697202288185,none,0.8703480538668518,0.8023625396801308,12.0,0.7643888930613969,,,,0.332318651252637,0.5529190082107253,0.44323835368611486,0.4427860696517413,0.0,0.0,0.5291677506651549,0.12322294142973317,0.1,0.5567616463138851,0.5572139303482587,0.0,0.0,0.0,0.0,none,0.5,0.5,0.8703480538668518,0.5529190082107253,COMPLETE
530,0.7156549520766773,2025-11-26 19:44:43.999757,2025-11-26 19:44:48.591526,0 days 00:00:04.591769,0.20856814458667966,gbtree,0.6809314647961875,1.3951844394073385,depthwise,0.00764783702694422,0.014304950229418157,4,12,1.1105218727800406,200,,0.8957498046234664,0.6139577802655234,0.05974892098850972,none,0.6809848163654246,1.874624523390529,10.0,0.691933548031483,,,,0.3455387584510631,0.10378988968662878,0.5567616463138851,0.5572139303482587,0.715281812899477,0.7156549520766773,0.8957498046234664,0.6139577802655234,0.05,0.5295758914579616,0.5273889865353081,0.5567616463138851,0.5572139303482587,1.0,1.0,none,0.4779741872378521,0.47522402265762836,0.6809848163654246,0.10378988968662878,COMPLETE
531,0.7156549520766773,2025-11-26 19:44:48.769790,2025-11-26 19:45:12.064699,0 days 00:00:23.294909,0.07611932904386844,dart,0.5546061005629733,7.562634526099712,lossguide,82.87798948152472,0.0008124274090771037,0,3,13.080762561632346,500,forest,0.7025429914468634,0.33201516591643127,0.03202624733975702,none,0.7036616532918124,1.2820272940902824,12.0,0.8931194730528191,0.4656543878563306,weighted,0.2975785654074615,0.2996762259647104,0.13271507500680874,0.5567616463138851,0.5572139303482587,0.715281812899477,0.7156549520766773,0.7025429914468634,0.33201516591643127,0.02,0.5567616463138851,0.5572139303482587,0.5567616463138851,0.5572139303482587,1.0,1.0,none,0.5,0.5,0.7036616532918124,0.13271507500680874,COMPLETE
532,0.7156549520766773,2025-11-26 19:45:12.235914,2025-11-26 19:45:44.812464,0 days 00:00:32.576550,56.116013196637425,dart,0.5367365874444073,6.342540251256546,depthwise,6.864294833669405,0.21999392743467677,2,8,8.303334376129698,600,tree,0.5223849600578446,0.40534484780971103,0.0890920668022589,oversample,0.9095754002325458,,11.0,0.749097200024002,0.48675694791510754,uniform,0.29887419668440096,0.352845563877912,0.1206367235009119,0.5567616463138851,0.5572139303482587,0.715281812899477,0.7156549520766773,0.5223849600578446,0.40534484780971103,0.08,0.5567616463138851,0.5572139303482587,0.5567616463138851,0.5572139303482587,1.0,1.0,oversample,0.5,0.5,0.9095754002325458,0.1206367235009119,COMPLETE
533,0.619583759808939,2025-11-26 19:45:44.994346,2025-11-26 19:46:12.356005,0 days 00:00:27.361659,0.001268732221189187,dart,0.6322437226568884,3.5500331959043594,lossguide,0.0423179692012724,0.030148541485636973,6,4,0.6234087891056213,300,tree,0.9875338700626742,0.89705085524252,0.0893857037722291,none,0.7510273431407853,3.714217040299909,5.0,0.7782283103650678,0.2426404067323339,weighted,0.38453185749284935,0.3998668881676039,0.8300212260989418,0.49796472184531887,0.49570330167345095,0.621676891615542,0.619583759808939,0.9875338700626742,0.89705085524252,0.08,0.5195868301278717,0.5166567157853432,0.5355255431591309,0.5344320188346086,0.7408610885458976,0.737012987012987,none,0.4426142674779091,0.44230960561399785,0.7510273431407853,0.8300212260989418,COMPLETE
534,0.7156549520766773,2025-11-26 19:46:12.538602,2025-11-26 19:46:13.984172,0 days 00:00:01.445570,0.5060752894549264,gbtree,0.9884574356057385,3.172550941869838,lossguide,0.2760717171045658,0.05542348156680563,6,3,4.141665962323491,400,,0.8493083852523924,0.8970789402384198,0.08041505930495033,oversample,0.7442033820306606,,5.0,0.7162535670838148,,,,0.39947445430591144,0.3199637513194664,0.5567616463138851,0.5572139303482587,0.715281812899477,0.7156549520766773,0.8493083852523924,0.8970789402384198,0.08,0.5124369903323909,0.5091879442499969,0.5567616463138851,0.5572139303482587,1.0,1.0,oversample,0.4577131583746415,0.45569956090895825,0.7442033820306606,0.3199637513194664,COMPLETE
535,0.6973483693995733,2025-11-26 19:46:14.158766,2025-11-26 19:46:14.699566,0 days 00:00:00.540800,0.01639215501012478,gbtree,0.813793992499011,2.6612138348052765,lossguide,2.391484769645212,0.09668443779992468,8,7,58.872443120546045,200,,0.8518855243025705,0.8526569553016664,0.07273200258264716,oversample,0.9749354031293115,,11.0,0.8528509991580845,,,,0.766649666218492,0.49740517725435673,0.5608322026232474,0.5508819538670285,0.70441400304414,0.6973483693995733,0.8518855243025705,0.8526569553016664,0.08,0.521374198295638,0.5119106073153712,0.5632911392405063,0.5583211322596389,0.9398862713241267,0.9285714285714286,oversample,0.4708561978812646,0.4616309380098961,0.9749354031293115,0.49740517725435673,COMPLETE
536,0.8052395725611858,2025-11-26 19:46:14.877915,2025-11-26 19:46:15.776078,0 days 00:00:00.898163,0.00042945548398470656,gbtree,0.4187418470524669,6.650006039379283,lossguide,0.0001144684027990611,0.0030975972189783586,5,10,0.34281197789985446,800,,0.6910021912157115,0.20657060687683365,0.03107300714088244,oversample,0.8074581594505246,,6.0,0.6229186453161714,,,,0.6169959551406996,0.5485213361690425,0.7530529172320217,0.7444595205789236,0.8078817733990148,0.8052395725611858,0.6910021912157115,0.20657060687683365,0.02,0.8056175064920879,0.800138740310935,0.7126008690254501,0.6998202516476932,0.9325751421608448,0.948051948051948,oversample,0.7735957990019727,0.7641560431396999,0.8074581594505246,0.5485213361690425,COMPLETE
537,0.7156549520766773,2025-11-26 19:46:15.948755,2025-11-26 19:46:16.829347,0 days 00:00:00.880592,0.0006845024236578601,gbtree,0.5100968249962469,6.1598586589375035,lossguide,0.045903229329703525,0.002263997025561709,3,10,0.5389359233920535,800,,0.7791309795816103,0.0921754603731402,0.05969107954497178,oversample,0.8032022899571909,,7.0,0.6611754907135111,,,,0.7659488933366125,0.4393354912658827,0.5567616463138851,0.5572139303482587,0.715281812899477,0.7156549520766773,0.7791309795816103,0.0921754603731402,0.05,0.5333116372176183,0.5215517055502452,0.5567616463138851,0.5572139303482587,1.0,1.0,oversample,0.45473316865332647,0.43426443959513417,0.8032022899571909,0.4393354912658827,COMPLETE
538,0.0,2025-11-26 19:46:17.005561,2025-11-26 19:46:17.882905,0 days 00:00:00.877344,0.003262605539024431,gbtree,0.4797619969391915,7.86450746275129,lossguide,0.00017113684827745382,0.0033266413283015266,7,11,0.989151611210605,800,,0.5222351526127307,0.2345872189616433,0.021758365177575803,oversample,0.698159372142743,,5.0,0.7142946396047833,,,,0.7971524110536455,0.8902625901312811,0.44323835368611486,0.4427860696517413,0.0,0.0,0.5222351526127307,0.2345872189616433,0.02,0.5977323724230106,0.6162605759367448,0.0,0.0,0.0,0.0,oversample,0.5682778229082046,0.5885324774816603,0.698159372142743,0.8902625901312811,COMPLETE
539,0.7156549520766773,2025-11-26 19:46:18.056608,2025-11-26 19:47:39.038509,0 days 00:01:20.981901,0.00011142019235562661,dart,0.46147821251018084,4.471649116089854,lossguide,0.00024856567249914433,0.00011494214227209234,5,8,0.12606863833130827,800,forest,0.6163784839376232,0.3626408344469505,0.03808701492617417,oversample,0.8274791544661318,,5.0,0.6531103687626446,0.2719737851431193,uniform,0.8397226919804175,0.7460462518411987,0.39449345552715653,0.5567616463138851,0.5572139303482587,0.715281812899477,0.7156549520766773,0.6163784839376232,0.3626408344469505,0.05,0.5996534401683741,0.6121844359800519,0.5567616463138851,0.5572139303482587,1.0,1.0,oversample,0.5426117806992822,0.546455682978921,0.8274791544661318,0.39449345552715653,COMPLETE
540,0.7156549520766773,2025-11-26 19:47:39.204862,2025-11-26 19:53:37.385360,0 days 00:05:58.180498,0.002444710584975862,dart,0.3853400258502049,0.2437106690846581,lossguide,0.00014603760039921476,0.017270001089462566,3,11,0.4839233228428232,600,tree,0.7844496978901829,0.6558033479986559,0.058286989368753005,oversample,0.7195202660697643,,12.0,0.6687271000739244,0.312807603105822,weighted,0.11079719136063584,0.34659061547527714,0.07880001363307151,0.5567616463138851,0.5572139303482587,0.715281812899477,0.7156549520766773,0.7844496978901829,0.6558033479986559,0.05,0.5382105020176012,0.5264549731291566,0.5567616463138851,0.5572139303482587,1.0,1.0,oversample,0.48003862796133895,0.46793333709191726,0.7195202660697643,0.07880001363307151,COMPLETE
541,0.7156549520766773,2025-11-26 19:53:37.559537,2025-11-26 19:53:42.977236,0 days 00:00:05.417699,0.018880421372815034,dart,0.8243035826867517,3.3906063187138598,lossguide,0.0038826573983638743,0.03015956665458608,0,8,1.5663271870883237,200,forest,0.7769970870789086,0.7876533860677795,0.07397898032946335,undersample,0.8142256402216458,,5.0,0.7269776079267458,0.13080914640829885,weighted,0.021998319541955233,0.22286226715812568,0.281602369677783,0.5567616463138851,0.5572139303482587,0.715281812899477,0.7156549520766773,0.7769970870789086,0.7876533860677795,0.08,0.5290011504628538,0.5338507399773982,0.5567616463138851,0.5572139303482587,1.0,1.0,undersample,0.4807088148013064,0.4870279108021702,0.8142256402216458,0.281602369677783,COMPLETE
542,0.7156549520766773,2025-11-26 19:53:43.149979,2025-11-26 19:53:43.975474,0 days 00:00:00.825495,0.0013578314107344312,gbtree,0.42796439794462593,7.459834786751943,lossguide,0.0001805634474429177,0.03855977394776956,2,12,0.38189014717677866,700,,0.7148177866656155,0.3276593551213687,0.02856959982310428,oversample,0.7926887353519387,,7.0,0.7283420284469531,,,,0.4048706404607264,0.3214388907306309,0.5567616463138851,0.5572139303482587,0.715281812899477,0.7156549520766773,0.7148177866656155,0.3276593551213687,0.02,0.46418419697285246,0.47802501581168466,0.5567616463138851,0.5572139303482587,1.0,1.0,oversample,0.34971277706858533,0.36608593781091225,0.7926887353519387,0.3214388907306309,COMPLETE
543,0.0,2025-11-26 19:53:44.146529,2025-11-26 19:53:44.953511,0 days 00:00:00.806982,0.006201786825864648,gbtree,0.41924985495217415,9.15733670311555,lossguide,0.00047826014459609567,0.0048087024213470594,5,10,0.28794400146174864,700,,0.7123546417554484,0.4140117622567058,0.007718716775759579,oversample,0.9199153696567683,,5.0,0.6089812758131468,,,,0.733083209610433,0.640512682727305,0.44323835368611486,0.4427860696517413,0.0,0.0,0.7123546417554484,0.4140117622567058,0.0,0.6706781134690942,0.6801959617944838,0.0,0.0,0.0,0.0,oversample,0.6496510220660157,0.6541366256317737,0.9199153696567683,0.640512682727305,COMPLETE
544,0.7156549520766773,2025-11-26 19:53:45.126033,2025-11-26 19:53:46.063522,0 days 00:00:00.937489,0.0003084482842755776,gbtree,0.6292745748820439,5.437460844295904,lossguide,0.00015171515114726484,0.0021231473342417486,6,11,0.2851714652001236,800,,0.7887864300136717,0.19227910576077903,0.020090607430576578,oversample,0.8381702154894461,,6.0,0.7105106284349599,,,,0.6074023719021042,0.3017684852584165,0.5567616463138851,0.5572139303482587,0.715281812899477,0.7156549520766773,0.7887864300136717,0.19227910576077903,0.02,0.5028430977184402,0.5037227913394591,0.5567616463138851,0.5572139303482587,1.0,1.0,oversample,0.4132114259188647,0.4348153761458154,0.8381702154894461,0.3017684852584165,COMPLETE
545,0.7156549520766773,2025-11-26 19:53:46.239636,2025-11-26 19:54:04.324523,0 days 00:00:18.084887,0.8905592072869679,dart,0.8060897392164191,9.066260762734865,depthwise,0.0008857442670633821,0.002166392654434937,8,3,0.35546184871190406,400,forest,0.7563942324406624,0.7773739559226889,0.06921874739932626,oversample,0.8364725573660894,,11.0,0.8511192237234533,0.4017521161112203,uniform,0.5677176391739462,0.758627708443437,0.26090074792779455,0.5567616463138851,0.5572139303482587,0.715281812899477,0.7156549520766773,0.7563942324406624,0.7773739559226889,0.08,0.4727071717843231,0.4679522318246374,0.5567616463138851,0.5572139303482587,1.0,1.0,oversample,0.31157429665611164,0.28697576044996886,0.8364725573660894,0.26090074792779455,COMPLETE
546,0.0,2025-11-26 19:54:04.480833,2025-11-26 19:54:05.469929,0 days 00:00:00.989096,0.00016475561072695958,gbtree,0.44636062271137283,6.398822835728145,lossguide,0.00042601768608051087,0.0016590952335683777,0,12,1.7018980836202369,1000,,0.6333754339845373,0.15183550715924762,0.018713574084055877,oversample,0.8826640316666985,,5.0,0.6009902827495002,,,,0.509468395615957,0.6962950082629558,0.44323835368611486,0.4427860696517413,0.0,0.0,0.6333754339845373,0.15183550715924762,0.02,0.5900203360286042,0.591219938300653,0.0,0.0,0.0,0.0,oversample,0.4773450322452295,0.4907016502394439,0.8826640316666985,0.6962950082629558,COMPLETE
547,0.7156549520766773,2025-11-26 19:54:05.647658,2025-11-26 19:54:06.600926,0 days 00:00:00.953268,0.002558261800779229,gbtree,0.23940226741889553,6.480611198284996,depthwise,0.00023499838183275692,0.0001319952381659244,2,11,0.2322222853348158,900,,0.7245410027780126,0.7005257436144563,0.011632839139758069,oversample,0.9813049547596598,,7.0,0.6792782322171641,,,,0.7215257565029866,0.2815020478241483,0.5567616463138851,0.5572139303482587,0.715281812899477,0.7156549520766773,0.7245410027780126,0.7005257436144563,0.02,0.4590383696206507,0.46144030327770924,0.5567616463138851,0.5572139303482587,1.0,1.0,oversample,0.3596043535204496,0.3613849442181924,0.9813049547596598,0.2815020478241483,COMPLETE
548,0.7156549520766773,2025-11-26 19:54:06.772772,2025-11-26 19:54:07.447563,0 days 00:00:00.674791,0.0001279488804140628,gbtree,0.8748555566614328,3.011764034410632,depthwise,0.5254811801848623,0.001635910397349676,0,10,22.09386917679695,500,,0.5224169258722494,0.12046653621950223,0.018285186334662546,none,0.6376548589778219,0.6228876685960221,5.0,0.8541806530755844,,,,0.9281690089238114,0.16339037048380975,0.5567616463138851,0.5572139303482587,0.715281812899477,0.7156549520766773,0.5224169258722494,0.12046653621950223,0.02,0.4705095713399806,0.467838386646895,0.5567616463138851,0.5572139303482587,1.0,1.0,none,0.1592624214592417,0.15428171802661078,0.6376548589778219,0.16339037048380975,COMPLETE
549,0.7110980622431005,2025-11-26 19:54:07.618321,2025-11-26 19:55:01.701542,0 days 00:00:54.083221,0.00012082956884662312,dart,0.5958961391490838,1.276830458497136,lossguide,0.0020108284516413256,0.008172760756388365,6,12,1.1552787066344368,300,tree,0.848005273920798,0.5388523918236329,0.04263341448204852,undersample,0.590822423271951,,10.0,0.683754271605504,0.3346379595044514,weighted,0.6735046430718473,0.49350500475644704,0.3575177925671823,0.5554047942107644,0.5549525101763908,0.7109673625404292,0.7110980622431005,0.848005273920798,0.5388523918236329,0.05,0.589669861313466,0.6095756568920399,0.5571428571428572,0.5570377184912604,0.9821283509341998,0.9829545454545454,undersample,0.5371665644324342,0.5567037661011104,0.590822423271951,0.3575177925671823,COMPLETE
550,0.7156549520766773,2025-11-26 19:55:01.876716,2025-11-26 19:55:06.741732,0 days 00:00:04.865016,0.011342984986769583,dart,0.9068809647640629,6.972044689872066,lossguide,0.046224956405376126,0.01032872219731974,8,5,22.154012673429083,200,tree,0.7791624502095482,0.8136698273187334,0.08069345300776483,oversample,0.603466016524216,,11.0,0.6023892443827945,0.20335437430176984,weighted,0.15515815460063342,0.9798467835952728,0.4696319346595196,0.5567616463138851,0.5572139303482587,0.715281812899477,0.7156549520766773,0.7791624502095482,0.8136698273187334,0.08,0.5567616463138851,0.5572139303482587,0.5567616463138851,0.5572139303482587,1.0,1.0,oversample,0.5,0.5,0.603466016524216,0.4696319346595196,COMPLETE
