number,value,datetime_start,datetime_complete,duration,params_alpha,params_booster,params_colsample_bytree,params_gamma,params_grow_policy,params_lambda,params_learning_rate,params_max_delta_step,params_max_depth,params_min_child_weight,params_n_estimators,params_normalize_type,params_params_feature_fraction,params_params_labeled_ratio,params_params_missing_rate,params_params_resampling,params_params_sample_rows,params_params_scale_pos_weight,params_params_selftrain_max_iter,params_params_selftrain_threshold,params_rate_drop,params_sample_type,params_skip_drop,params_subsample,params_user_attrs_decision_threshold,user_attrs_acc_test,user_attrs_acc_val,user_attrs_f1_test,user_attrs_f1_val,user_attrs_feature_fraction,user_attrs_labeled_ratio,user_attrs_missing_rate,user_attrs_pr_auc_test,user_attrs_pr_auc_val,user_attrs_prec_test,user_attrs_prec_val,user_attrs_rec_test,user_attrs_rec_val,user_attrs_resampling_strategy,user_attrs_roc_auc_test,user_attrs_roc_auc_val,user_attrs_sample_rows,user_attrs_user_attrs_decision_threshold,state
1414,0.7156549520766773,2025-11-27 03:07:43.624356,2025-11-27 03:07:44.696793,0 days 00:00:01.072437,59.77795598771758,gbtree,0.8003594007365318,4.530742266933477,lossguide,8.131117194189443,0.0719711867855532,6,5,89.49076201477617,1000,,0.798007627906434,0.48609593536283235,0.013646221665596772,none,0.615464635637647,1.9478668127925438,5.0,0.7840493882970545,,,,0.2807218301924056,0.4644984777081502,0.5567616463138851,0.5572139303482587,0.715281812899477,0.7156549520766773,0.798007627906434,0.48609593536283235,0.02,0.5567616463138851,0.5572139303482587,0.5567616463138851,0.5572139303482587,1.0,1.0,none,0.5,0.5,0.615464635637647,0.4644984777081502,COMPLETE
1415,0.044649730561970746,2025-11-27 03:07:44.883923,2025-11-27 03:07:46.964870,0 days 00:00:02.080947,0.029828108314247443,gbtree,0.6056861850748051,1.878169209622081,lossguide,0.5841514290799241,0.3460555551690005,9,4,90.69426107735498,600,,0.8564635555649207,0.9051032632721856,0.0028025137896948433,oversample,0.5717217352776831,,8.0,0.7267847712540725,,,,0.5166487057628159,0.6858899802347884,0.4355495251017639,0.438715513342379,0.0444104134762634,0.044649730561970746,0.8564635555649207,0.9051032632721856,0.0,0.5503541183942138,0.5703013178280987,0.38666666666666666,0.43283582089552236,0.023558082859463852,0.02353896103896104,oversample,0.5098132429251148,0.5365736472414205,0.5717217352776831,0.6858899802347884,COMPLETE
1416,0.7147426577493458,2025-11-27 03:07:47.147267,2025-11-27 03:07:47.962981,0 days 00:00:00.815714,0.05124410249001991,gbtree,0.7162878418319083,3.6643039200999055,lossguide,0.02599203880587434,0.010470252794708756,1,6,0.5118685680381746,400,,0.8275014948141328,0.5733745398628809,0.09301847316301012,oversample,0.5002715145953771,,7.0,0.8670480691892104,,,,0.5437139934927347,0.4513124778297022,0.555857078245138,0.5563093622795116,0.7145348837209302,0.7147426577493458,0.8275014948141328,0.5733745398628809,0.1,0.5389559156964143,0.5362583377450543,0.5563603440470801,0.5568645219755324,0.9983753046303818,0.997564935064935,oversample,0.4394403090236907,0.4310939634930952,0.5002715145953771,0.4513124778297022,COMPLETE
1417,0.6988505747126437,2025-11-27 03:07:48.144728,2025-11-27 03:07:49.587216,0 days 00:00:01.442488,0.03876633259377506,gbtree,0.9687292332684676,2.2081481792486333,depthwise,18.655403285413946,0.06994518848438737,7,9,5.767542535313651,300,,0.9386852865557055,0.6956201215298614,0.035993825006780014,oversample,0.6931798759130277,,5.0,0.611118119762518,,,,0.450073344142405,0.5214578351415712,0.5970149253731343,0.5852555404794211,0.7070042749095692,0.6988505747126437,0.9386852865557055,0.6956201215298614,0.05,0.6138655112374605,0.595684522861834,0.5939226519337016,0.5868725868725869,0.8732737611697806,0.8636363636363636,oversample,0.5763946683466238,0.5584523367337464,0.6931798759130277,0.5214578351415712,COMPLETE
1418,0.08727810650887574,2025-11-27 03:07:49.767631,2025-11-27 03:07:51.191511,0 days 00:00:01.423880,2.9474974656757507,gbtree,0.7002026086159514,1.739457619207921,depthwise,0.00046641856762654876,0.011250214302795977,6,9,7.791866662366191,800,,0.6838172126543544,0.5958500067424445,0.004982353471501139,oversample,0.7218635622183658,,5.0,0.7469267678813539,,,,0.47902289146122146,0.6341488496146203,0.44097693351424694,0.4418815015829941,0.0734632683658171,0.08727810650887574,0.6838172126543544,0.5958500067424445,0.0,0.5515133240487884,0.5641416188784295,0.47572815533980584,0.49166666666666664,0.039805036555645816,0.04788961038961039,oversample,0.512446327027968,0.529302860061287,0.7218635622183658,0.6341488496146203,COMPLETE
1419,0.7135199523525908,2025-11-27 03:07:51.383185,2025-11-27 03:07:53.763841,0 days 00:00:02.380656,0.2095251645537271,gbtree,0.8920570785019344,0.4896667263466412,lossguide,21.560870566626807,0.03952442176378419,10,11,2.3493978619682605,200,,0.9403579540431096,0.4855231952108319,0.052485243667551425,oversample,0.6046268829014039,,5.0,0.7280885546468409,,,,0.4563364127173218,0.4315554835496009,0.55359565807327,0.5649027589326097,0.7052851597491788,0.7135199523525908,0.9403579540431096,0.4855231952108319,0.05,0.476674112267098,0.4661025841765526,0.5576015108593012,0.5634995296331138,0.9593826157595451,0.9724025974025974,oversample,0.4200251993567533,0.39869980632238045,0.6046268829014039,0.4315554835496009,COMPLETE
1420,0.7156549520766773,2025-11-27 03:07:53.950660,2025-11-27 03:07:55.700376,0 days 00:00:01.749716,0.007805830041481881,gbtree,0.8492928892666975,2.852109579581898,lossguide,3.895810853357905,0.12645100706801482,7,11,14.06473186402779,400,,0.9992036028916167,0.6807200088211111,0.04001830487473323,none,0.5466162103876369,1.559919760510742,6.0,0.6044399976162145,,,,0.5494115830477607,0.17818082058081935,0.5567616463138851,0.5572139303482587,0.715281812899477,0.7156549520766773,0.9992036028916167,0.6807200088211111,0.05,0.5309190353003077,0.5365639652632955,0.5567616463138851,0.5572139303482587,1.0,1.0,none,0.4866327359538454,0.49527454797500764,0.5466162103876369,0.17818082058081935,COMPLETE
1421,0.7156549520766773,2025-11-27 03:07:55.887359,2025-11-27 03:08:07.691253,0 days 00:00:11.803894,0.048235463086165276,dart,0.7873669994098409,1.156103042933224,lossguide,85.96764725787553,0.04298532904150854,9,5,2.1278350850628907,300,tree,0.89659667543111,0.12734978496903449,0.04884013311662987,oversample,0.7347192709236945,,7.0,0.6980079447018585,0.07593116885292767,weighted,0.2635888801343871,0.2397116311462182,0.44658547077408106,0.5567616463138851,0.5572139303482587,0.715281812899477,0.7156549520766773,0.89659667543111,0.12734978496903449,0.05,0.38014446679416963,0.3861954325388414,0.5567616463138851,0.5572139303482587,1.0,1.0,oversample,0.1542979823936073,0.17366025828104478,0.7347192709236945,0.44658547077408106,COMPLETE
1422,0.7156549520766773,2025-11-27 03:08:07.872012,2025-11-27 03:08:09.001911,0 days 00:00:01.129899,13.676003471062677,gbtree,0.8705627370607391,2.917362094105667,lossguide,0.023697610562180553,0.0003997542576501272,6,10,41.743920503428754,900,,0.9380674260035825,0.4798245263721587,0.08179673442378009,oversample,0.7395774867740846,,6.0,0.6469136693885235,,,,0.8616870794252265,0.4384652308432026,0.5567616463138851,0.5572139303482587,0.715281812899477,0.7156549520766773,0.9380674260035825,0.4798245263721587,0.08,0.4731227713949221,0.4781268950713286,0.5567616463138851,0.5572139303482587,1.0,1.0,oversample,0.3554792022414165,0.3683949796373187,0.7395774867740846,0.4384652308432026,COMPLETE
1423,0.7156549520766773,2025-11-27 03:08:09.185377,2025-11-27 03:08:10.455856,0 days 00:00:01.270479,6.585815171521294,gbtree,0.2908392146799309,1.654998288791554,depthwise,0.00010279475234491599,0.006787325707624628,9,8,0.9192236109528025,1000,,0.5802340477265172,0.6462831552966883,0.04291830957784191,oversample,0.9602058201147035,,8.0,0.7867510678713825,,,,0.4556740192085125,0.30865357388500375,0.5567616463138851,0.5572139303482587,0.715281812899477,0.7156549520766773,0.5802340477265172,0.6462831552966883,0.05,0.5657322735274608,0.5514675577948481,0.5567616463138851,0.5572139303482587,1.0,1.0,oversample,0.5489945125084965,0.523538961038961,0.9602058201147035,0.30865357388500375,COMPLETE
1424,0.5640457733480989,2025-11-27 03:08:10.636520,2025-11-27 03:08:14.332493,0 days 00:00:03.695973,0.7012364332353026,gbtree,0.6090663685548823,0.48700840558827213,lossguide,18.256528662639965,0.03488226010182334,6,10,2.3664176241609116,300,,0.9952828138655034,0.18735948223404142,0.08726604424416692,oversample,0.7224832690859933,,8.0,0.7578028522362426,,,,0.6385104149699005,0.6807105140163076,0.4690185436454093,0.4658525554047942,0.5752532561505065,0.5640457733480989,0.9952828138655034,0.18735948223404142,0.08,0.5125170180444496,0.5031090945484403,0.5185909980430529,0.5172647257955315,0.6458164094232332,0.6201298701298701,oversample,0.41831761136623624,0.4069327633551332,0.7224832690859933,0.6807105140163076,COMPLETE
1425,0.7156549520766773,2025-11-27 03:08:14.512883,2025-11-27 03:08:15.694439,0 days 00:00:01.181556,1.3895318799003529,gbtree,0.9800372521464188,1.3036289036944435,lossguide,52.3267733524535,0.02915344722699091,10,4,5.074856724018051,800,,0.9646620902871719,0.8111739626338762,0.006229568293567366,undersample,0.5875728556855557,,9.0,0.8380558715156508,,,,0.21384530294866344,0.21041298335697017,0.5567616463138851,0.5572139303482587,0.715281812899477,0.7156549520766773,0.9646620902871719,0.8111739626338762,0.0,0.5556595380786955,0.53671021754776,0.5567616463138851,0.5572139303482587,1.0,1.0,undersample,0.5022148908304183,0.475250139288699,0.5875728556855557,0.21041298335697017,COMPLETE
1426,0.7156549520766773,2025-11-27 03:08:15.881038,2025-11-27 03:08:16.936694,0 days 00:00:01.055656,0.005019380682627533,gbtree,0.4324120198616812,0.47725205117429054,lossguide,52.020225570336486,0.0010566420371690413,8,10,0.7866117258892906,500,,0.7961065292794337,0.1576169420111535,0.091609817832708,none,0.5770938575256662,0.9458667800022377,9.0,0.8059996057195992,,,,0.6891786547096362,0.2623801936578666,0.5567616463138851,0.5572139303482587,0.715281812899477,0.7156549520766773,0.7961065292794337,0.1576169420111535,0.1,0.4794362332884313,0.4630532301172977,0.5567616463138851,0.5572139303482587,1.0,1.0,none,0.4021150052222351,0.3754137206001352,0.5770938575256662,0.2623801936578666,COMPLETE
1427,0.7156549520766773,2025-11-27 03:08:17.131429,2025-11-27 03:08:18.117655,0 days 00:00:00.986226,0.00023660088261705765,gbtree,0.25976628077731867,7.981991445388079,lossguide,0.0001993512387681411,0.00039747040454148655,3,11,0.3767885843727333,800,,0.712422740579202,0.39524078148083575,0.038725884378388614,none,0.8102071590376602,2.5395493457258684,5.0,0.6598283161627136,,,,0.7056107084073239,0.5672001511495826,0.5567616463138851,0.5572139303482587,0.715281812899477,0.7156549520766773,0.712422740579202,0.39524078148083575,0.05,0.5567616463138851,0.5572139303482587,0.5567616463138851,0.5572139303482587,1.0,1.0,none,0.5,0.5,0.8102071590376602,0.5672001511495826,COMPLETE
1428,0.0016181229773462784,2025-11-27 03:08:18.297100,2025-11-27 03:08:19.235445,0 days 00:00:00.938345,3.2669015952089873,gbtree,0.46567861145958056,5.007521297362564,depthwise,0.00018327962698189262,0.02657550111327021,9,12,0.35863886970945963,700,,0.6745469624461077,0.888404156476423,0.017042474758934344,undersample,0.9323733956520763,,6.0,0.6935414032349473,,,,0.6029505458421817,0.5628199843403155,0.44369063772048845,0.4418815015829941,0.0032414910858995136,0.0016181229773462784,0.6745469624461077,0.888404156476423,0.02,0.5173028718183016,0.5126403388582653,0.6666666666666666,0.25,0.0016246953696181965,0.0008116883116883117,undersample,0.4540294103018949,0.4460343346643142,0.9323733956520763,0.5628199843403155,COMPLETE
1429,0.0,2025-11-27 03:08:19.422507,2025-11-27 03:08:20.146269,0 days 00:00:00.723762,0.06078240066941818,gbtree,0.5145715130565244,7.582581776316477,lossguide,46.99457959261428,0.014749384903087486,10,6,29.585464493601485,400,,0.7385921712287884,0.7677106173846128,0.028841171780736634,oversample,0.623841796641048,,11.0,0.703990113267112,,,,0.20446138039314543,0.57932140260937,0.44323835368611486,0.4427860696517413,0.0,0.0,0.7385921712287884,0.7677106173846128,0.02,0.5567616463138851,0.5572139303482587,0.0,0.0,0.0,0.0,oversample,0.5,0.5,0.623841796641048,0.57932140260937,COMPLETE
1430,0.7156549520766773,2025-11-27 03:08:20.327741,2025-11-27 03:08:20.949100,0 days 00:00:00.621359,0.02055506293048281,gbtree,0.610404523558397,1.952929986770964,depthwise,9.901577832816459,0.2528000938219978,8,7,73.12355909466575,200,,0.8681725941043877,0.7149502108723673,0.007807708699590129,oversample,0.5648641116712205,,9.0,0.8259066761279127,,,,0.30662494400722207,0.3638836102748018,0.5567616463138851,0.5572139303482587,0.715281812899477,0.7156549520766773,0.8681725941043877,0.7149502108723673,0.0,0.6378510728738573,0.6296663112427188,0.5567616463138851,0.5572139303482587,1.0,1.0,oversample,0.5975070044264659,0.5890378135653928,0.5648641116712205,0.3638836102748018,COMPLETE
1431,0.7162730507926237,2025-11-27 03:08:21.131881,2025-11-27 03:13:33.658636,0 days 00:05:12.526755,0.14334661856651193,dart,0.6566825342325663,2.9465540311774765,lossguide,0.23643229678717584,0.030967921489149182,1,5,0.37641276808702334,700,forest,0.8447524021242201,0.7175681311478423,0.025027409885958682,oversample,0.7609575977933253,,9.0,0.6081322472187256,0.16938299141010502,weighted,0.6533701976733021,0.26760843264070516,0.6045604943096247,0.5920398009950248,0.6033469018543646,0.7069525666016894,0.7162730507926237,0.8447524021242201,0.7175681311478423,0.02,0.5715458234311898,0.584431239820824,0.5890633459664321,0.5954814416352878,0.8838342810722989,0.898538961038961,oversample,0.5584123576319235,0.5671251309977051,0.7609575977933253,0.6045604943096247,COMPLETE
1432,0.713241742180649,2025-11-27 03:13:33.850174,2025-11-27 03:16:32.313372,0 days 00:02:58.463198,0.0640697814467851,dart,0.49144442076850625,3.0982021268487863,lossguide,0.2858352696217595,0.05732481460057095,0,4,0.2288164512037902,500,forest,0.7375122465340546,0.9216058902344169,0.027710598808251,oversample,0.6975740608485291,,10.0,0.6284768453516931,0.10787766317585368,weighted,0.6582968456037236,0.3749676836424298,0.44074052939282615,0.5545002261420172,0.5563093622795116,0.7113975974216232,0.713241742180649,0.7375122465340546,0.9216058902344169,0.02,0.5464185095992631,0.5529660203549236,0.5563703024747938,0.5573321151210598,0.9861900893582454,0.9902597402597403,oversample,0.49236185944727195,0.5012610601859836,0.6975740608485291,0.44074052939282615,COMPLETE
1433,0.7213015968665261,2025-11-27 03:16:32.500532,2025-11-27 03:24:07.880556,0 days 00:07:35.380024,0.2831698548837362,dart,0.6702082202922375,3.0301113566710316,lossguide,2.116229839972413,0.018004634957105418,4,9,0.3796351431456345,800,forest,0.9028815990037588,0.5527667892025109,0.05486139847506305,oversample,0.6775127165213234,,10.0,0.6267057867629678,0.15802357891679886,weighted,0.6695552325878108,0.20506776295450965,0.6512552226453128,0.582089552238806,0.5816372682044324,0.720677146311971,0.7213015968665261,0.9028815990037588,0.5527667892025109,0.05,0.6507237780018909,0.6524848355547066,0.5739046701974001,0.5735505510301868,0.9683184402924452,0.9715909090909091,oversample,0.6024996269832059,0.6114433957258268,0.6775127165213234,0.6512552226453128,COMPLETE
1434,0.0,2025-11-27 03:24:08.084514,2025-11-27 03:25:46.248159,0 days 00:01:38.163645,3.290510704313827,dart,0.6813815100062997,4.41457483109604,lossguide,22.999653823321683,0.13420548791825088,1,8,0.22281627510152194,900,forest,0.8928910499182188,0.45461432035554167,0.05275067314266268,oversample,0.8345845465992812,,9.0,0.6679821698779207,0.15620636284992,weighted,0.5586112918335114,0.5289346691500171,0.6523228046861511,0.44323835368611486,0.4427860696517413,0.0,0.0,0.8928910499182188,0.45461432035554167,0.05,0.49751157864296947,0.4929016654363392,0.0,0.0,0.0,0.0,oversample,0.4224236973424626,0.417283654802807,0.8345845465992812,0.6523228046861511,COMPLETE
1435,0.0,2025-11-27 03:25:46.432870,2025-11-27 03:27:19.323931,0 days 00:01:32.891061,3.8026735807761325,dart,0.9028546663262379,5.029964577626031,lossguide,2.0011028811600764,0.015023613043889505,6,10,0.5945343736667739,700,forest,0.8965650679339281,0.47276082262797264,0.05514873329829916,oversample,0.6454727838833804,,10.0,0.6251533108888299,0.1565328352089514,weighted,0.6468492181758786,0.24366728115440242,0.6833719749172642,0.44323835368611486,0.4427860696517413,0.0,0.0,0.8965650679339281,0.47276082262797264,0.05,0.49445183494225387,0.47284130797052293,0.0,0.0,0.0,0.0,oversample,0.4069841177738357,0.3633113566719287,0.6454727838833804,0.6833719749172642,COMPLETE
1436,0.7156549520766773,2025-11-27 03:27:19.504018,2025-11-27 03:33:35.954835,0 days 00:06:16.450817,0.05334083254777706,dart,0.6139175404846754,3.5735919129021436,lossguide,0.2729326933934493,0.2542319872470331,3,3,2.454852488600265,800,forest,0.7958234196935761,0.6316556520810196,0.008438493388171792,oversample,0.9930314469487249,,8.0,0.6294067752245002,0.06531343396892879,weighted,0.5546208053603907,0.392424680687514,0.3810310854873026,0.5576662143826323,0.5572139303482587,0.7156976744186047,0.7156549520766773,0.7958234196935761,0.6316556520810196,0.0,0.5751346810391984,0.5784326487011406,0.5572657311000453,0.5572139303482587,1.0,1.0,oversample,0.5335118287770023,0.5481818679277821,0.9930314469487249,0.3810310854873026,COMPLETE
1437,0.7156549520766773,2025-11-27 03:33:36.139365,2025-11-27 03:40:42.581798,0 days 00:07:06.442433,0.012310876583320769,dart,0.5294054327428238,2.486355084251194,lossguide,0.2811745922968927,0.003877571706144871,1,11,0.6101426942148811,800,forest,0.9062395046277867,0.710152759122685,0.0667547101012191,none,0.6925871395437763,1.2055865744966705,9.0,0.6183882910392129,0.16281135171722388,weighted,0.600225481566153,0.3510073692221606,0.5129629268845782,0.5567616463138851,0.5572139303482587,0.715281812899477,0.7156549520766773,0.9062395046277867,0.710152759122685,0.08,0.5422759888360325,0.5167104711165628,0.5567616463138851,0.5572139303482587,1.0,1.0,none,0.5109700094497588,0.4864251555390473,0.6925871395437763,0.5129629268845782,COMPLETE
1438,0.0,2025-11-27 03:40:42.763313,2025-11-27 03:47:10.761081,0 days 00:06:27.997768,0.5311072290537115,dart,0.6377324906440192,2.3963240341294223,lossguide,0.04360286179328858,0.21890744630435383,1,8,0.38997602339959603,900,forest,0.8785936515708205,0.8191345291014145,0.010232517346018075,none,0.703613498990087,1.9377830538690113,10.0,0.6394618695823424,0.21194596826317735,weighted,0.7170026289359686,0.21896643467120352,0.9249208403040619,0.4427860696517413,0.4427860696517413,0.0,0.0,0.8785936515708205,0.8191345291014145,0.02,0.5697362905236973,0.5718546863735685,0.0,0.0,0.0,0.0,none,0.5246787910940168,0.5232943767162357,0.703613498990087,0.9249208403040619,COMPLETE
1439,0.7156549520766773,2025-11-27 03:47:10.938730,2025-11-27 03:51:53.439894,0 days 00:04:42.501164,0.3778937497024182,dart,0.31024009918032003,4.063765040942308,lossguide,0.9485638394031521,0.10942728488482865,5,12,0.10733758804675578,800,forest,0.8963168859254597,0.5459329409495545,0.03319519810370371,oversample,0.6797798173630343,,9.0,0.6010990511903992,0.14394588944149525,weighted,0.688041275532085,0.20408924999414232,0.6865295325777023,0.5567616463138851,0.5572139303482587,0.715281812899477,0.7156549520766773,0.8963168859254597,0.5459329409495545,0.02,0.5144393868215708,0.5034569539840105,0.5567616463138851,0.5572139303482587,1.0,1.0,oversample,0.467358543742436,0.44330369579348133,0.6797798173630343,0.6865295325777023,COMPLETE
1440,0.0,2025-11-27 03:51:53.626592,2025-11-27 03:53:37.698221,0 days 00:01:44.071629,7.7132937637371395,dart,0.6087502911273143,4.523304745163245,lossguide,0.11852434494472114,0.0121883491054491,4,5,0.33375153955432474,900,forest,0.7996173750286485,0.6284816356079456,0.050909709739939746,oversample,0.6392447123410488,,9.0,0.676492538280888,0.11686928120142076,weighted,0.6899995657775355,0.2092015128230603,0.7738063111419724,0.44323835368611486,0.4427860696517413,0.0,0.0,0.7996173750286485,0.6284816356079456,0.05,0.6107575831552607,0.5927110607398802,0.0,0.0,0.0,0.0,oversample,0.5511973839088844,0.5185593900481541,0.6392447123410488,0.7738063111419724,COMPLETE
1441,0.647557003257329,2025-11-27 03:53:37.895155,2025-11-27 04:00:29.577483,0 days 00:06:51.682328,0.007368146648689572,dart,0.7272267240392013,2.8561640615016763,lossguide,0.07088367807411575,0.04235483726521365,0,6,0.427849692908403,800,forest,0.9930404094887506,0.48723637567413103,0.02597951320220896,oversample,0.6857337502329496,,9.0,0.6023085850165769,0.20194027250878918,weighted,0.696395849577378,0.23351673130274028,0.6353434188476377,0.5201266395296246,0.5106286748077793,0.6513309234308249,0.647557003257329,0.9930404094887506,0.48723637567413103,0.02,0.518442175271043,0.5046057556392711,0.5469094922737306,0.5408052230685527,0.8050365556458164,0.8068181818181818,oversample,0.4668135247600259,0.43661866733878985,0.6857337502329496,0.6353434188476377,COMPLETE
1442,0.0,2025-11-27 04:00:29.760219,2025-11-27 04:02:13.396522,0 days 00:01:43.636303,0.10434660625146536,dart,0.9186755474830599,4.047209156811556,lossguide,26.46927958994404,0.005612830174443069,4,10,0.6789350616563415,900,forest,0.856047692727651,0.45866356589279234,0.05527718058552757,undersample,0.7308464995098203,,10.0,0.6612309362105424,0.06879008600768804,weighted,0.7483863840231917,0.31038287858206765,0.6208151461922785,0.44323835368611486,0.4427860696517413,0.0,0.0,0.856047692727651,0.45866356589279234,0.05,0.45726511172529216,0.44932944993862517,0.0,0.0,0.0,0.0,undersample,0.31416220428057495,0.2983095492352387,0.7308464995098203,0.6208151461922785,COMPLETE
