number,value,datetime_start,datetime_complete,duration,params_alpha,params_booster,params_colsample_bytree,params_gamma,params_grow_policy,params_lambda,params_learning_rate,params_max_delta_step,params_max_depth,params_min_child_weight,params_n_estimators,params_normalize_type,params_params_feature_fraction,params_params_labeled_ratio,params_params_missing_rate,params_params_resampling,params_params_sample_rows,params_params_scale_pos_weight,params_params_selftrain_max_iter,params_params_selftrain_threshold,params_rate_drop,params_sample_type,params_skip_drop,params_subsample,params_user_attrs_decision_threshold,user_attrs_acc_test,user_attrs_acc_val,user_attrs_f1_test,user_attrs_f1_val,user_attrs_feature_fraction,user_attrs_labeled_ratio,user_attrs_missing_rate,user_attrs_pr_auc_test,user_attrs_pr_auc_val,user_attrs_prec_test,user_attrs_prec_val,user_attrs_rec_test,user_attrs_rec_val,user_attrs_resampling_strategy,user_attrs_roc_auc_test,user_attrs_roc_auc_val,user_attrs_sample_rows,user_attrs_user_attrs_decision_threshold,state
349,0.7156549520766773,2025-11-26 18:37:32.916797,2025-11-26 18:37:34.100158,0 days 00:00:01.183361,0.021610608291841582,gbtree,0.6327848724337554,0.14680346302865144,depthwise,82.42079003625118,0.00038963979830307144,3,5,0.3823956727553459,700,,0.9295442677147534,0.10124113710494134,0.08740992705811695,undersample,0.9151166358593325,,8.0,0.6164075654951136,,,,0.32358425508169053,0.15011415025363756,0.5567616463138851,0.5572139303482587,0.715281812899477,0.7156549520766773,0.9295442677147534,0.10124113710494134,0.08,0.6009146674116799,0.5940648929247683,0.5567616463138851,0.5572139303482587,1.0,1.0,undersample,0.564939322601502,0.5482444649324119,0.9151166358593325,0.15011415025363756,COMPLETE
350,0.7156549520766773,2025-11-26 18:37:34.275695,2025-11-26 18:37:34.932057,0 days 00:00:00.656362,46.95675551441178,gbtree,0.4022373845190359,3.6024335986402334,depthwise,25.950091591099216,0.0013179589410172929,4,6,36.053233297357444,500,,0.6713919426726733,0.07038683222634678,0.09530887738519446,undersample,0.8882626068185084,,12.0,0.7689462318016895,,,,0.508126614588766,0.014365074827363239,0.5567616463138851,0.5572139303482587,0.715281812899477,0.7156549520766773,0.6713919426726733,0.07038683222634678,0.1,0.5567616463138851,0.5572139303482587,0.5567616463138851,0.5572139303482587,1.0,1.0,undersample,0.5,0.5,0.8882626068185084,0.014365074827363239,COMPLETE
351,0.7156549520766773,2025-11-26 18:37:35.104141,2025-11-26 18:38:27.593956,0 days 00:00:52.489815,22.326163765496045,dart,0.7363457415376959,3.9895901574537165,lossguide,49.51412725204165,0.002895478378860289,9,9,17.444177585779695,700,tree,0.590949640003595,0.05453484563697944,0.0820685469714653,undersample,0.970081567959593,,8.0,0.903581029794583,0.2664312115152968,weighted,0.009186260333741314,0.6311217781211829,0.31293191270710863,0.5567616463138851,0.5572139303482587,0.715281812899477,0.7156549520766773,0.590949640003595,0.05453484563697944,0.08,0.5567616463138851,0.5572139303482587,0.5567616463138851,0.5572139303482587,1.0,1.0,undersample,0.5,0.5,0.970081567959593,0.31293191270710863,COMPLETE
352,0.7156549520766773,2025-11-26 18:38:27.755759,2025-11-26 18:38:28.406610,0 days 00:00:00.650851,0.022696725914851338,gbtree,0.48207291771046,1.977628445535579,depthwise,6.959004206677209,0.011676200882668072,4,8,76.93040328820625,500,,0.8759826308930055,0.17291628082025376,0.06604763110695303,undersample,0.5353183830086399,,9.0,0.6732520149023502,,,,0.9192198576616684,0.25810395123197005,0.5567616463138851,0.5572139303482587,0.715281812899477,0.7156549520766773,0.8759826308930055,0.17291628082025376,0.08,0.5567616463138851,0.5572139303482587,0.5567616463138851,0.5572139303482587,1.0,1.0,undersample,0.5,0.5,0.5353183830086399,0.25810395123197005,COMPLETE
353,0.7156549520766773,2025-11-26 18:38:28.569769,2025-11-26 18:38:29.184068,0 days 00:00:00.614299,0.04691798604655795,gbtree,0.24129566165016444,5.876190215478432,lossguide,0.11151549715928998,0.0015786080528668645,0,7,0.2405747269238089,400,,0.74173552767611,0.6588937666623207,0.02559735374112114,undersample,0.526925296856275,,5.0,0.701938166892659,,,,0.4146237204880476,0.2789990295245472,0.5567616463138851,0.5572139303482587,0.715281812899477,0.7156549520766773,0.74173552767611,0.6588937666623207,0.02,0.547978364701726,0.543919153622476,0.5567616463138851,0.5572139303482587,1.0,1.0,undersample,0.48503539514912386,0.47355255826910575,0.526925296856275,0.2789990295245472,COMPLETE
354,0.0,2025-11-26 18:38:29.351055,2025-11-26 18:38:30.143912,0 days 00:00:00.792857,1.3660980586053437,gbtree,0.4086212470343382,3.715634920101498,depthwise,0.0027245977069885272,0.08673222470279145,1,3,1.0294586155230332,700,,0.6502774129550108,0.4795008685883483,0.00313119568892368,none,0.9097065001727811,0.5114689062623248,8.0,0.7236577726600519,,,,0.9511347634157465,0.4421717041684499,0.44323835368611486,0.4427860696517413,0.0,0.0,0.6502774129550108,0.4795008685883483,0.0,0.5156094435201981,0.5171065619652895,0.0,0.0,0.0,0.0,none,0.37648377791409005,0.38085053990952866,0.9097065001727811,0.4421717041684499,COMPLETE
355,0.7289663461538461,2025-11-26 18:38:30.308283,2025-11-26 18:38:31.067107,0 days 00:00:00.758824,0.11625900478535416,gbtree,0.949463257210294,4.635370971399935,lossguide,0.19897583710246547,0.0263135446164838,7,8,74.21100539032373,600,,0.9212077999339641,0.6565165626118045,0.09050805223734366,oversample,0.8384711108890218,,11.0,0.854819030818967,,,,0.6536997733430235,0.5175122472309635,0.5970149253731343,0.5920398009950248,0.7302452316076294,0.7289663461538461,0.9212077999339641,0.6565165626118045,0.1,0.6009471463849126,0.5852483035948222,0.582046332046332,0.5787213740458015,0.9796913078797725,0.984577922077922,oversample,0.5882163994761187,0.5600226509955826,0.8384711108890218,0.5175122472309635,COMPLETE
356,0.2097560975609756,2025-11-26 18:38:31.236747,2025-11-26 18:38:32.181906,0 days 00:00:00.945159,2.346544075213255,gbtree,0.7819729910461505,1.6972763311576453,lossguide,0.12241498316022975,0.031487114933383034,8,9,78.96885402110435,700,,0.975127865112417,0.569764118791379,0.09606177674504701,oversample,0.9174482946060181,,12.0,0.848238728106896,,,,0.6541548997442129,0.5928095592773467,0.42198100407055633,0.41383989145183175,0.21691176470588236,0.2097560975609756,0.975127865112417,0.569764118791379,0.1,0.523807338422968,0.5160465091721674,0.44139650872817954,0.4215686274509804,0.1437855402112104,0.1396103896103896,oversample,0.5001782191349327,0.4882367377260125,0.9174482946060181,0.5928095592773467,COMPLETE
357,0.7156549520766773,2025-11-26 18:38:32.342687,2025-11-26 18:38:33.052465,0 days 00:00:00.709778,46.46101582874565,gbtree,0.9812978706158766,3.082025673178615,lossguide,0.0465932906418424,0.0008470117654350452,6,8,1.2049013597011498,600,,0.7775515012852044,0.08203815594122443,0.04818403854996878,oversample,0.8487856035739728,,6.0,0.8600608701318044,,,,0.6789085601278003,0.4378009728100648,0.5567616463138851,0.5572139303482587,0.715281812899477,0.7156549520766773,0.7775515012852044,0.08203815594122443,0.05,0.5567616463138851,0.5572139303482587,0.5567616463138851,0.5572139303482587,1.0,1.0,oversample,0.5,0.5,0.8487856035739728,0.4378009728100648,COMPLETE
358,0.7156549520766773,2025-11-26 18:38:33.216560,2025-11-26 18:38:34.137091,0 days 00:00:00.920531,0.38123698481063023,gbtree,0.6391879307293633,7.93250411993529,lossguide,1.0662919767815335,0.005423687165149179,7,7,87.73183006325085,900,,0.8453983678814192,0.7098202730224844,0.09430494314182966,none,0.7047539948764262,0.853930625138079,10.0,0.8610023903761534,,,,0.7441991248195701,0.294887065274258,0.5567616463138851,0.5572139303482587,0.715281812899477,0.7156549520766773,0.8453983678814192,0.7098202730224844,0.1,0.52621349371862,0.5258749495914962,0.5567616463138851,0.5572139303482587,1.0,1.0,none,0.4034014986985859,0.3956342112943237,0.7047539948764262,0.294887065274258,COMPLETE
359,0.7156549520766773,2025-11-26 18:38:34.302546,2025-11-26 18:38:34.865765,0 days 00:00:00.563219,0.012843826932413085,gbtree,0.8427881282068576,3.684988668108619,lossguide,0.3893317010712889,0.26278880275177374,6,8,77.30286656954449,300,,0.9951537506920062,0.42496336151821296,0.0900188607044091,oversample,0.7618797874002186,,8.0,0.9479230139941638,,,,0.5810933618813886,0.34527081714655294,0.5567616463138851,0.5572139303482587,0.715281812899477,0.7156549520766773,0.9951537506920062,0.42496336151821296,0.1,0.5106237422088861,0.5194930459868827,0.5567616463138851,0.5572139303482587,1.0,1.0,oversample,0.4422404217576551,0.449040234535638,0.7618797874002186,0.34527081714655294,COMPLETE
360,0.6891674702667953,2025-11-26 18:38:35.033387,2025-11-26 18:38:35.708371,0 days 00:00:00.674984,0.1534609532863342,gbtree,0.9685089203442053,4.367699001129851,lossguide,0.04199135136608934,0.020098239019661276,6,12,33.08420028293209,400,,0.9738646366203582,0.7855155359068041,0.09306429911706045,oversample,0.7533937704633711,,10.0,0.8008067929566633,,,,0.5231115868035571,0.5368386551810299,0.5635459068294889,0.5626413387607417,0.6888100612705579,0.6891674702667953,0.9738646366203582,0.7855155359068041,0.1,0.6395119899452847,0.6392964113891563,0.5711229946524065,0.5705162320383182,0.867587327376117,0.8701298701298701,oversample,0.5879876158424377,0.5849897357494396,0.7533937704633711,0.5368386551810299,COMPLETE
361,0.0016194331983805667,2025-11-26 18:38:35.878314,2025-11-26 18:38:36.687541,0 days 00:00:00.809227,0.017829766790654816,gbtree,0.33472224726722355,5.043326450382502,depthwise,0.0005951481616182005,0.45374662852702025,1,3,0.1107134749104879,700,,0.7992924505594856,0.5596297199484086,0.01865552813298582,none,0.9957590949103051,1.3459215887619207,8.0,0.8477773129795804,,,,0.7013564176060243,0.7933073157556247,0.44414292175486203,0.4423337856173677,0.0032441200324412004,0.0016194331983805667,0.7992924505594856,0.5596297199484086,0.02,0.568176901113373,0.5438467632968504,1.0,0.3333333333333333,0.0016246953696181965,0.0008116883116883117,none,0.4918462673452809,0.4861047086213071,0.9957590949103051,0.7933073157556247,COMPLETE
362,0.7156549520766773,2025-11-26 18:38:36.850625,2025-11-26 18:38:37.633474,0 days 00:00:00.782849,0.0158518191130762,gbtree,0.9672692787811433,7.469117878590998,lossguide,0.0009642514481281875,0.0074232577260917925,7,7,98.10373967786809,600,,0.9053659700994694,0.6385581773052381,0.08988484734846693,oversample,0.9667437773807631,,11.0,0.8770801215481336,,,,0.77153867556151,0.49759807867032824,0.5567616463138851,0.5572139303482587,0.715281812899477,0.7156549520766773,0.9053659700994694,0.6385581773052381,0.08,0.4658996098745788,0.4720132770021366,0.5567616463138851,0.5572139303482587,1.0,1.0,oversample,0.33077595782423447,0.3423960806813207,0.9667437773807631,0.49759807867032824,COMPLETE
363,0.6540880503144654,2025-11-26 18:38:37.799335,2025-11-26 18:38:38.608835,0 days 00:00:00.809500,0.015395094005923106,gbtree,0.9493120251304024,1.5272288278436312,lossguide,0.16686554618431046,0.009500090064874598,5,5,1.1620269931447211,300,,0.877203058401984,0.3113442790638704,0.09084471271415115,oversample,0.5992296312204825,,7.0,0.9301151171554699,,,,0.9554487062968368,0.5043777896677255,0.5368611488014473,0.527363184079602,0.6577540106951871,0.6540880503144654,0.877203058401984,0.3113442790638704,0.1,0.49206901197047825,0.48164763258615106,0.5587734241908007,0.5522638345444383,0.7993501218521527,0.801948051948052,oversample,0.42474842089557185,0.4046917076794503,0.5992296312204825,0.5043777896677255,COMPLETE
364,0.7156549520766773,2025-11-26 18:38:38.779100,2025-11-26 18:39:18.385527,0 days 00:00:39.606427,98.0370620969973,dart,0.21718459171463883,3.86873111519849,depthwise,0.06865783172716618,0.06218756656959445,6,12,0.7616714000059358,600,forest,0.7242707507191906,0.7698524699048361,0.057209291174631346,oversample,0.8149109373931254,,11.0,0.8593792748831688,0.42270004908032843,uniform,0.63656047525232,0.9292874757920229,0.12026633626833805,0.5567616463138851,0.5572139303482587,0.715281812899477,0.7156549520766773,0.7242707507191906,0.7698524699048361,0.05,0.5567616463138851,0.5572139303482587,0.5567616463138851,0.5572139303482587,1.0,1.0,oversample,0.5,0.5,0.8149109373931254,0.12026633626833805,COMPLETE
365,0.7156549520766773,2025-11-26 18:39:18.552588,2025-11-26 18:40:02.236647,0 days 00:00:43.684059,0.05704114218264431,dart,0.814728557032681,2.5600348518252654,depthwise,2.195973400661674,0.23633573753930723,1,11,23.006672727365583,600,forest,0.9493301321129319,0.09175307517449394,0.08288199553653676,undersample,0.7197270454682467,,10.0,0.6120746706523039,0.386121256155685,weighted,0.615987864715944,0.9799509651037823,0.09585804413640543,0.5567616463138851,0.5572139303482587,0.715281812899477,0.7156549520766773,0.9493301321129319,0.09175307517449394,0.08,0.7491700385666202,0.7660930010230627,0.5567616463138851,0.5572139303482587,1.0,1.0,undersample,0.7087870322783866,0.7370216925566773,0.7197270454682467,0.09585804413640543,COMPLETE
366,0.7156549520766773,2025-11-26 18:40:02.403999,2025-11-26 18:41:13.536799,0 days 00:01:11.132800,0.04016807642153361,dart,0.6429444916458206,3.4658197305813343,depthwise,0.8763217175911873,0.00015184247656509448,0,10,12.508400002486924,800,forest,0.7086684019484181,0.14645927096546224,0.031284200589487055,none,0.5411249044463962,1.418738887006816,5.0,0.8941682607055569,0.20818471958624662,uniform,0.147793489342309,0.6603994764616039,0.573551059648588,0.5567616463138851,0.5572139303482587,0.715281812899477,0.7156549520766773,0.7086684019484181,0.14645927096546224,0.02,0.43341152264245697,0.4275211085365215,0.5567616463138851,0.5572139303482587,1.0,1.0,none,0.2817727415905436,0.2631772912990993,0.5411249044463962,0.573551059648588,COMPLETE
367,0.41119360365505425,2025-11-26 18:41:13.712053,2025-11-26 18:41:14.413222,0 days 00:00:00.701169,2.09656068430519,gbtree,0.3114615295208095,6.227316227044815,depthwise,0.061334071536326494,0.07626455651707577,0,3,0.5734375160636904,500,,0.6876841303941483,0.08843274926614286,0.02637756939092819,oversample,0.940851583052473,,9.0,0.7965880264361522,,,,0.6160182633499205,0.5745190133235463,0.5463591135232926,0.5336951605608322,0.4368332397529478,0.41119360365505425,0.6876841303941483,0.08843274926614286,0.02,0.6715597695604851,0.6634985520332661,0.7072727272727273,0.6936416184971098,0.31600324939073926,0.2922077922077922,oversample,0.6603723536530779,0.6462821524746958,0.940851583052473,0.5745190133235463,COMPLETE
368,0.7156549520766773,2025-11-26 18:41:14.578620,2025-11-26 18:41:44.124697,0 days 00:00:29.546077,41.94986269438194,dart,0.4413623322456652,0.9397373288022308,depthwise,9.939288339000068,0.10876908002577425,2,9,8.212769785512206,500,tree,0.5369927362877842,0.41273249501004206,0.09032283888401596,none,0.6968304295876544,3.5801535146777748,11.0,0.7232554862377127,0.15247775089141394,weighted,0.2505690920039053,0.3577820964281819,0.28942462632889965,0.5567616463138851,0.5572139303482587,0.715281812899477,0.7156549520766773,0.5369927362877842,0.41273249501004206,0.1,0.48357152551921834,0.4895557416746887,0.5567616463138851,0.5572139303482587,1.0,1.0,none,0.37925943732488937,0.3776315614926442,0.6968304295876544,0.28942462632889965,COMPLETE
369,0.7156549520766773,2025-11-26 18:41:44.295763,2025-11-26 18:41:48.886046,0 days 00:00:04.590283,0.0026921091853062723,dart,0.6764411849697807,9.545453216991419,lossguide,24.8749063909749,0.00012888912918057523,3,3,1.1614478581798187,200,tree,0.7786062005955635,0.2904023907756007,0.04757000665760822,oversample,0.8970846617747834,,9.0,0.890859786206939,0.3612437501296714,weighted,0.3720001931122256,0.32466974488395006,0.06637603108397848,0.5567616463138851,0.5572139303482587,0.715281812899477,0.7156549520766773,0.7786062005955635,0.2904023907756007,0.05,0.5457168333878788,0.5404708306166923,0.5567616463138851,0.5572139303482587,1.0,1.0,oversample,0.47593834446857547,0.4617229680431927,0.8970846617747834,0.06637603108397848,COMPLETE
370,0.7156549520766773,2025-11-26 18:41:49.056007,2025-11-26 18:42:50.724564,0 days 00:01:01.668557,3.717579194725054,dart,0.35641324021370013,8.10831511309269,lossguide,7.2397140548853205,0.005726292624780664,3,9,0.10032461409941466,800,forest,0.8648545659958673,0.857198422138521,0.049371147563524995,oversample,0.5789446145519745,,12.0,0.7032346257584581,0.38426700517730417,weighted,0.3207091351063595,0.656475661063441,0.3865430429174684,0.5567616463138851,0.5572139303482587,0.715281812899477,0.7156549520766773,0.8648545659958673,0.857198422138521,0.05,0.5960171605298674,0.6010851632769143,0.5567616463138851,0.5572139303482587,1.0,1.0,oversample,0.5565331819161459,0.5531369804863165,0.5789446145519745,0.3865430429174684,COMPLETE
371,0.7156549520766773,2025-11-26 18:42:50.894665,2025-11-26 18:44:01.017871,0 days 00:01:10.123206,0.0006826225704847356,dart,0.991459720829034,0.6618236919271128,depthwise,7.565166437912608,0.0057078891879876375,0,11,54.71188510117529,800,forest,0.6641965414855687,0.337581046365929,0.056676051359656796,oversample,0.5204548497878041,,5.0,0.8803665821334707,0.19419927180920246,weighted,0.007288240067770568,0.7558088550198303,0.4212284179649269,0.5567616463138851,0.5572139303482587,0.715281812899477,0.7156549520766773,0.6641965414855687,0.337581046365929,0.05,0.7056363719479328,0.6893076438627597,0.5567616463138851,0.5572139303482587,1.0,1.0,oversample,0.6475007874798986,0.6258179065571814,0.5204548497878041,0.4212284179649269,COMPLETE
372,0.7156549520766773,2025-11-26 18:44:01.191006,2025-11-26 18:44:06.965728,0 days 00:00:05.774722,8.273590744979854,dart,0.2481555005063868,5.428886644414857,lossguide,1.1015598280609051,0.41954256332083045,4,4,3.0467996819361343,200,tree,0.5382132379526078,0.3847055770794163,0.0008339978268781557,oversample,0.558995001692195,,11.0,0.6689490136913243,0.013989780673138635,uniform,0.40173828431997305,0.851967590846126,0.22757256112589697,0.5567616463138851,0.5572139303482587,0.715281812899477,0.7156549520766773,0.5382132379526078,0.3847055770794163,0.0,0.5567616463138851,0.5572139303482587,0.5567616463138851,0.5572139303482587,1.0,1.0,oversample,0.5,0.5,0.558995001692195,0.22757256112589697,COMPLETE
373,0.10597826086956522,2025-11-26 18:44:07.136497,2025-11-26 18:44:08.037175,0 days 00:00:00.900678,0.5797439201673995,gbtree,0.816407718551466,4.675973341285335,depthwise,0.6848587906652372,0.010996536569647797,7,6,39.951070426084286,800,,0.9488181205133688,0.621836266483631,0.09218061378531842,oversample,0.6730541334256046,,10.0,0.8263789222835187,,,,0.617564673729643,0.5941300779742549,0.40615106286748076,0.40479421076436,0.10497614178595774,0.10597826086956522,0.9488181205133688,0.621836266483631,0.1,0.4550235348770778,0.4653996652520954,0.326271186440678,0.325,0.06255077173030058,0.0633116883116883,oversample,0.3542068005106186,0.3775167312258732,0.6730541334256046,0.5941300779742549,COMPLETE
374,0.7156549520766773,2025-11-26 18:44:08.212704,2025-11-26 18:44:18.953192,0 days 00:00:10.740488,1.0392610273887866,dart,0.7389060753251102,3.450617972132812,lossguide,14.086108062242602,0.015303011888641678,2,8,5.95505982956418,300,forest,0.5681000450887941,0.8160700363295718,0.08056548304856412,none,0.8249988885181583,0.7077036483773853,12.0,0.826150737347966,0.2543314796153531,uniform,0.4410461456122007,0.27071772598735766,0.08954391621490548,0.5567616463138851,0.5572139303482587,0.715281812899477,0.7156549520766773,0.5681000450887941,0.8160700363295718,0.08,0.41582809979671786,0.41361138114893514,0.5567616463138851,0.5572139303482587,1.0,1.0,none,0.25925744790198774,0.2576223253253386,0.8249988885181583,0.08954391621490548,COMPLETE
375,0.7156549520766773,2025-11-26 18:44:19.129151,2025-11-26 18:44:51.780029,0 days 00:00:32.650878,0.02981351188310495,dart,0.5780333055244203,3.293042409235648,depthwise,0.7104082489291442,0.018270846677785384,4,8,48.641330591581664,500,tree,0.9640385619238773,0.13092754429060946,0.034492819944674756,undersample,0.6118433077390376,,9.0,0.618995623580824,0.0243837093000403,weighted,0.026849591763979115,0.9736014307597795,0.071465212825355,0.5567616463138851,0.5572139303482587,0.715281812899477,0.7156549520766773,0.9640385619238773,0.13092754429060946,0.02,0.5567616463138851,0.5572139303482587,0.5567616463138851,0.5572139303482587,1.0,1.0,undersample,0.5,0.5,0.6118433077390376,0.071465212825355,COMPLETE
376,0.7156549520766773,2025-11-26 18:44:51.946177,2025-11-26 18:45:37.729589,0 days 00:00:45.783412,0.027491942530593297,dart,0.5953281293421441,1.713155309641841,depthwise,0.5896533805313885,0.0011038335698108112,1,12,79.16910637443702,600,forest,0.6259267483878563,0.06445436373456118,0.056614089162216545,none,0.5807859753455191,1.586459717366767,8.0,0.8560770331429528,0.05573780181864019,weighted,0.0262531612757389,0.9725100902064218,0.3722009436183743,0.5567616463138851,0.5572139303482587,0.715281812899477,0.7156549520766773,0.6259267483878563,0.06445436373456118,0.05,0.5567616463138851,0.5572139303482587,0.5567616463138851,0.5572139303482587,1.0,1.0,none,0.5,0.5,0.5807859753455191,0.3722009436183743,COMPLETE
377,0.7156549520766773,2025-11-26 18:45:37.901410,2025-11-26 18:45:38.631814,0 days 00:00:00.730404,14.38982915318988,gbtree,0.628415789632095,8.75590087338951,lossguide,5.373461375544211,0.1407337720977308,2,6,3.1535481603646858,600,,0.7801799399428814,0.8815481026785591,0.05924626119777349,oversample,0.5211345366070536,,11.0,0.6763330974222309,,,,0.7274896551991161,0.07516404788861965,0.5567616463138851,0.5572139303482587,0.715281812899477,0.7156549520766773,0.7801799399428814,0.8815481026785591,0.05,0.52621349371862,0.5258749495914962,0.5567616463138851,0.5572139303482587,1.0,1.0,oversample,0.4034014986985859,0.3956342112943237,0.5211345366070536,0.07516404788861965,COMPLETE
