number,value,datetime_start,datetime_complete,duration,params_alpha,params_booster,params_colsample_bytree,params_gamma,params_grow_policy,params_lambda,params_learning_rate,params_max_delta_step,params_max_depth,params_min_child_weight,params_n_estimators,params_normalize_type,params_params_feature_fraction,params_params_labeled_ratio,params_params_missing_rate,params_params_resampling,params_params_sample_rows,params_params_scale_pos_weight,params_params_selftrain_max_iter,params_params_selftrain_threshold,params_rate_drop,params_sample_type,params_skip_drop,params_subsample,params_user_attrs_decision_threshold,user_attrs_acc_test,user_attrs_acc_val,user_attrs_f1_test,user_attrs_f1_val,user_attrs_feature_fraction,user_attrs_labeled_ratio,user_attrs_missing_rate,user_attrs_pr_auc_test,user_attrs_pr_auc_val,user_attrs_prec_test,user_attrs_prec_val,user_attrs_rec_test,user_attrs_rec_val,user_attrs_resampling_strategy,user_attrs_roc_auc_test,user_attrs_roc_auc_val,user_attrs_sample_rows,user_attrs_user_attrs_decision_threshold,state
955,0.7156549520766773,2025-11-26 22:51:42.138779,2025-11-26 22:51:43.265505,0 days 00:00:01.126726,0.0644849638416645,gbtree,0.3998358569322787,4.592800961929395,depthwise,0.0009292504190089907,0.0011920231575395638,7,12,0.3002103704432139,1000,,0.7088052321522729,0.4153856878121793,0.014660611273969662,oversample,0.8980227362391139,,6.0,0.6694814488388053,,,,0.7040375101244789,0.4448665241031545,0.5567616463138851,0.5572139303482587,0.715281812899477,0.7156549520766773,0.7088052321522729,0.4153856878121793,0.02,0.38297165817561574,0.3799727111885428,0.5567616463138851,0.5572139303482587,1.0,1.0,oversample,0.16561572638803695,0.15363626414443574,0.8980227362391139,0.4448665241031545,COMPLETE
956,0.7156549520766773,2025-11-26 22:51:43.439916,2025-11-26 22:53:02.265305,0 days 00:01:18.825389,2.7828682312039486,dart,0.7942697820043275,1.7113696648575472,depthwise,0.9573643971288197,0.0013456936305479908,8,8,24.386264893234046,800,forest,0.8601487307159426,0.2698337307308751,0.08758857352790039,undersample,0.8896447889696832,,9.0,0.9490920336851297,0.11840405196392903,uniform,0.11432682143362932,0.35628851755452406,0.4266409040281018,0.5567616463138851,0.5572139303482587,0.715281812899477,0.7156549520766773,0.8601487307159426,0.2698337307308751,0.08,0.537389112519339,0.5394029875023291,0.5567616463138851,0.5572139303482587,1.0,1.0,undersample,0.5147706361179728,0.5185855066792248,0.8896447889696832,0.4266409040281018,COMPLETE
957,0.7156549520766773,2025-11-26 22:53:02.440405,2025-11-26 22:53:10.056709,0 days 00:00:07.616304,1.348010188976598,dart,0.8255617683167251,6.655029772966735,lossguide,0.06769157313216757,0.11658935821026749,0,7,0.14562578676798174,200,tree,0.9076815930424333,0.6311352574329476,0.07607094884703824,undersample,0.7817101440041643,,5.0,0.6111906444474964,0.01890883821846215,weighted,0.014427406999583944,0.28792188903197025,0.3338663533771068,0.5567616463138851,0.5572139303482587,0.715281812899477,0.7156549520766773,0.9076815930424333,0.6311352574329476,0.08,0.5445485215705178,0.5312075454217325,0.5567616463138851,0.5572139303482587,1.0,1.0,undersample,0.47167890714368604,0.4523126898637624,0.7817101440041643,0.3338663533771068,COMPLETE
958,0.7156549520766773,2025-11-26 22:53:10.237342,2025-11-26 22:53:15.876255,0 days 00:00:05.638913,0.04361847437418744,dart,0.6138657482617513,0.6109530151292921,lossguide,0.0016414433275557091,0.012505882728251448,0,5,0.4886875033782511,200,forest,0.8592596389004976,0.7802725321352221,0.09714911000355651,none,0.8388188669767919,2.0072351017043393,5.0,0.8511982636130713,0.3034060217569732,weighted,0.30686644554120474,0.258720700717332,0.15991543313938048,0.5567616463138851,0.5572139303482587,0.715281812899477,0.7156549520766773,0.8592596389004976,0.7802725321352221,0.1,0.508774250837196,0.5004871860848698,0.5567616463138851,0.5572139303482587,1.0,1.0,none,0.4603661367065104,0.45779469509040494,0.8388188669767919,0.15991543313938048,COMPLETE
959,0.7156549520766773,2025-11-26 22:53:16.067689,2025-11-26 22:53:17.141013,0 days 00:00:01.073324,0.01108960295334142,gbtree,0.7104144950084533,2.910904821622041,lossguide,0.06702997204283616,0.0024417279387572827,2,8,0.1537826992750859,300,,0.8602875765579734,0.6219921458678259,0.08780022589909885,undersample,0.5102202293193403,,7.0,0.8270316734116764,,,,0.3271067713356935,0.23855312622143,0.5567616463138851,0.5572139303482587,0.715281812899477,0.7156549520766773,0.8602875765579734,0.6219921458678259,0.08,0.5230065469580903,0.5424242803750279,0.5567616463138851,0.5572139303482587,1.0,1.0,undersample,0.46570898058654814,0.4876078658318188,0.5102202293193403,0.23855312622143,COMPLETE
960,0.712401055408971,2025-11-26 22:53:17.340018,2025-11-26 22:53:25.999815,0 days 00:00:08.659797,0.00040260829900888774,gbtree,0.7471302545251239,1.9692787685005544,lossguide,0.0013557125945069894,0.09502454741142016,8,12,0.3232623247342661,700,,0.994008610176454,0.8056608127095541,0.046961300331024594,undersample,0.6206771693510837,,12.0,0.7086317146468142,,,,0.39685832450151093,0.05355144336305198,0.5549525101763908,0.5563093622795116,0.7117750439367311,0.712401055408971,0.994008610176454,0.8056608127095541,0.05,0.5798392153069759,0.5866038588497189,0.5565735226752175,0.5575952271684259,0.9870024370430545,0.9862012987012987,undersample,0.5427626452693182,0.5499905482668506,0.6206771693510837,0.05355144336305198,COMPLETE
961,0.6951672862453532,2025-11-26 22:53:26.181962,2025-11-26 22:53:29.317972,0 days 00:00:03.136010,0.2196925558226929,gbtree,0.5596614821526052,1.7110524112444074,lossguide,0.09624169369336666,0.014047139741465473,5,7,0.6988415289612281,400,,0.81835304885701,0.4029376734426171,0.08963937131130233,oversample,0.5919996413185242,,6.0,0.6925507454021403,,,,0.8627711069713899,0.4750145161169514,0.5386702849389416,0.5549525101763908,0.6826384567517113,0.6951672862453532,0.81835304885701,0.4029376734426171,0.08,0.44752220885785854,0.443347577658464,0.5532022188603126,0.5621242484969939,0.8911454102355808,0.9107142857142857,oversample,0.35827351249191797,0.3510875296817585,0.5919996413185242,0.4750145161169514,COMPLETE
962,0.3629169022046354,2025-11-26 22:53:29.524093,2025-11-26 22:54:38.275489,0 days 00:01:08.751396,0.0002794475426775461,dart,0.98053872763472,3.8652559167128357,depthwise,0.04983459478301672,0.24510597694313124,1,4,0.41980199345778474,400,tree,0.9897860747651688,0.7974732018896175,0.0896935664270844,oversample,0.7406867628650721,,6.0,0.6953153208514297,0.43751394274624544,weighted,0.6711671274371954,0.3475056043792916,0.6748162771744117,0.4947987336047038,0.4902758932609679,0.36856981345392875,0.3629169022046354,0.9897860747651688,0.7974732018896175,0.08,0.5966069811586672,0.5942846595424474,0.6059479553903345,0.5977653631284916,0.264825345247766,0.26055194805194803,oversample,0.5756013859646214,0.5691352824907473,0.7406867628650721,0.6748162771744117,COMPLETE
963,0.0,2025-11-26 22:54:38.456116,2025-11-26 22:54:39.200750,0 days 00:00:00.744634,0.0006349339301712159,gbtree,0.27852571772082046,7.978842858731383,lossguide,0.0012628216472834535,0.007523065685313576,2,8,0.17406743957061313,500,,0.8091595879836649,0.07261203591615056,0.01544647046672816,oversample,0.6960270982178973,,5.0,0.6536427791263777,,,,0.6977866068811008,0.6824436034484301,0.44323835368611486,0.4427860696517413,0.0,0.0,0.8091595879836649,0.07261203591615056,0.02,0.7186764850114514,0.7169877577798472,0.0,0.0,0.0,0.0,oversample,0.7000547091297933,0.7007423756019262,0.6960270982178973,0.6824436034484301,COMPLETE
964,0.11508771929824561,2025-11-26 22:54:39.375557,2025-11-26 22:54:40.299854,0 days 00:00:00.924297,0.0005469190309353485,gbtree,0.4294553536482768,3.23631611443911,lossguide,0.00012256702518465712,0.005861346369982115,4,12,2.9207325341589763,400,,0.9616179889152622,0.7138135770704058,0.054966833264119525,undersample,0.7934870728626889,,12.0,0.684494013239853,,,,0.5285367263144052,0.533867849886166,0.431026684758028,0.42966983265490727,0.10014306151645208,0.11508771929824561,0.9616179889152622,0.7138135770704058,0.05,0.5030333955396438,0.5045832161734694,0.41916167664670656,0.42487046632124353,0.05686433793663688,0.06655844155844155,undersample,0.4263457617002934,0.4253876868790045,0.7934870728626889,0.533867849886166,COMPLETE
965,0.7156549520766773,2025-11-26 22:54:40.482691,2025-11-26 22:54:45.870787,0 days 00:00:05.388096,0.34780589163737796,dart,0.5803623625587477,9.548885027449401,lossguide,73.67700621776238,0.013679861140100039,0,4,4.638687026286073,200,forest,0.6290400347371778,0.5483180405200844,0.04515671798764301,oversample,0.8201348980070368,,12.0,0.7694559605599193,0.18825677089011245,uniform,0.7029744189523899,0.4104759767580881,0.2833094334459717,0.5567616463138851,0.5572139303482587,0.715281812899477,0.7156549520766773,0.6290400347371778,0.5483180405200844,0.05,0.5567616463138851,0.5572139303482587,0.5567616463138851,0.5572139303482587,1.0,1.0,oversample,0.5,0.5,0.8201348980070368,0.2833094334459717,COMPLETE
966,0.7156549520766773,2025-11-26 22:54:46.056519,2025-11-26 22:54:50.308050,0 days 00:00:04.251531,0.004671254098114158,dart,0.3022315213311782,8.576659656814801,lossguide,5.019493219725647,0.00018421533297810296,2,5,0.6372923657672344,200,forest,0.8315943228686316,0.24313380014304797,0.04472925652635362,oversample,0.6046606072396814,,12.0,0.9235351988762757,0.41983617945811974,weighted,0.3126680672055664,0.26844448360945755,0.048000191462716724,0.5567616463138851,0.5572139303482587,0.715281812899477,0.7156549520766773,0.8315943228686316,0.24313380014304797,0.05,0.5567616463138851,0.5572139303482587,0.5567616463138851,0.5572139303482587,1.0,1.0,oversample,0.5,0.5,0.6046606072396814,0.048000191462716724,COMPLETE
967,0.0,2025-11-26 22:54:50.485624,2025-11-26 22:55:48.566893,0 days 00:00:58.081269,8.289876595905167,dart,0.3897877342934835,0.4839818919695986,depthwise,0.0017503903050375565,0.007880320387810169,8,12,1.4109918563893482,700,forest,0.6643626681501252,0.6961954861531382,0.021099465960154,oversample,0.8783842632094331,,8.0,0.640291054505888,0.40889158103244055,weighted,0.6339308253507911,0.6305552240673779,0.8313455981245217,0.44323835368611486,0.4427860696517413,0.0,0.0,0.6643626681501252,0.6961954861531382,0.02,0.5289140734134203,0.5173162887589424,0.0,0.0,0.0,0.0,oversample,0.485173825826025,0.4708194321000756,0.8783842632094331,0.8313455981245217,COMPLETE
968,0.7156549520766773,2025-11-26 22:55:48.752035,2025-11-26 22:55:49.516532,0 days 00:00:00.764497,0.0037874905075143237,gbtree,0.9701399927457225,4.604981758947981,lossguide,0.00020442592230038523,0.0029147631169113347,2,8,0.21597720000626797,400,,0.6012260094565894,0.6822677507951015,0.06765854255090425,none,0.814665126947994,0.8381491006209075,9.0,0.6481751096430923,,,,0.2168431598515903,0.3007886823376924,0.5567616463138851,0.5572139303482587,0.715281812899477,0.7156549520766773,0.6012260094565894,0.6822677507951015,0.08,0.6249253325479229,0.6411666733823873,0.5567616463138851,0.5572139303482587,1.0,1.0,none,0.6019409307183475,0.6093026610774313,0.814665126947994,0.3007886823376924,COMPLETE
969,0.0,2025-11-26 22:55:49.692160,2025-11-26 22:56:50.964169,0 days 00:01:01.272009,94.57273279171926,dart,0.9623266181073024,2.939526317057853,lossguide,8.41873411251796,0.13736182829956697,10,10,49.467721098951124,700,forest,0.7592544448924987,0.28725713866846203,0.07391191438305356,undersample,0.9218377219371824,,9.0,0.926841812213711,0.2984785383498274,weighted,0.6223181333413914,0.2921414078003377,0.7829611311030206,0.44323835368611486,0.4427860696517413,0.0,0.0,0.7592544448924987,0.28725713866846203,0.08,0.5567616463138851,0.5572139303482587,0.0,0.0,0.0,0.0,undersample,0.5,0.5,0.9218377219371824,0.7829611311030206,COMPLETE
970,0.4819646968534152,2025-11-26 22:56:51.165140,2025-11-26 22:56:55.799493,0 days 00:00:04.634353,0.9873134204499052,gbtree,0.7714802606108926,1.052059849748087,lossguide,7.4624209840202305,0.1406934274170606,7,12,0.3721340317632553,800,,0.8990926537394489,0.1684335588130865,0.059334378001919874,oversample,0.70386056243809,,7.0,0.7187941019579007,,,,0.5578327579358388,0.6326640911566204,0.44052464947987335,0.3894165535956581,0.5340866290018832,0.4819646968534152,0.8990926537394489,0.1684335588130865,0.05,0.4723516808359163,0.4496878422422356,0.4978932584269663,0.4570596797671033,0.5759545085296507,0.5097402597402597,oversample,0.3719507949402344,0.3260765026597509,0.70386056243809,0.6326640911566204,COMPLETE
971,0.7181579714368989,2025-11-26 22:56:55.986977,2025-11-26 22:58:59.873770,0 days 00:02:03.886793,0.6508055314428239,dart,0.8788315176181015,1.4372090850586736,lossguide,0.8662473093853262,0.04207957402346357,10,9,9.347995998754302,500,tree,0.9752373980841185,0.29138768547854377,0.08164124684604405,oversample,0.5699522827942277,,7.0,0.6635901271064039,0.21608263786423706,weighted,0.29609627050165144,0.5508479752183707,0.0582128181980594,0.5590230664857531,0.5626413387607417,0.7163223741635147,0.7181579714368989,0.9752373980841185,0.29138768547854377,0.08,0.6864309613160576,0.7047279324966214,0.5580235720761559,0.5602546612096407,1.0,1.0,oversample,0.6963253701155523,0.6985792552697557,0.5699522827942277,0.0582128181980594,COMPLETE
972,0.7156549520766773,2025-11-26 22:59:00.063209,2025-11-26 23:04:05.155997,0 days 00:05:05.092788,0.11989566530791534,dart,0.9963558732787342,1.578725643452121,lossguide,0.35064424541713746,0.023431724890221883,9,9,15.663335743478711,700,tree,0.9680132593390307,0.5289373354571637,0.06160784631358598,oversample,0.5722255275102728,,9.0,0.6568715443230876,0.14731702858218595,weighted,0.31982008919078775,0.40925215764632505,0.14379399646507393,0.5567616463138851,0.5572139303482587,0.715281812899477,0.7156549520766773,0.9680132593390307,0.5289373354571637,0.05,0.6246308961891472,0.6236053591476169,0.5567616463138851,0.5572139303482587,1.0,1.0,oversample,0.5926739501649564,0.6002281681546238,0.5722255275102728,0.14379399646507393,COMPLETE
973,0.22695035460992907,2025-11-26 23:04:05.332196,2025-11-26 23:04:17.020855,0 days 00:00:11.688659,0.5581119043277618,dart,0.8482909208971111,1.8516181343685771,lossguide,0.1933078851061885,0.012557942168497717,10,7,8.65049021808395,300,tree,0.9955624043576428,0.28759977519337376,0.0907727071239183,oversample,0.6178345927090827,,7.0,0.7214721741371602,0.216058981230039,weighted,0.3495566003394469,0.8726498038526491,0.5890321468843871,0.41700587969244685,0.4084124830393487,0.2475189725627554,0.22695035460992907,0.9955624043576428,0.28759977519337376,0.1,0.5096987899879122,0.49933361989585384,0.43983402489626555,0.41739130434782606,0.17221770917952883,0.15584415584415584,oversample,0.4781577943931431,0.45531237148959314,0.6178345927090827,0.5890321468843871,COMPLETE
974,0.7156549520766773,2025-11-26 23:04:17.192179,2025-11-26 23:04:35.644247,0 days 00:00:18.452068,0.5021545270013185,dart,0.7377217099915109,3.7168469052916797,depthwise,0.45921635063322724,0.13050164089287317,8,10,6.604872918718226,400,tree,0.9667720557371263,0.11508599552065646,0.08244031222396486,oversample,0.6405141131521929,,6.0,0.6573017180513374,0.2317324227572523,weighted,0.3522397806797233,0.9246538210488797,0.07702178607439411,0.5567616463138851,0.5572139303482587,0.715281812899477,0.7156549520766773,0.9667720557371263,0.11508599552065646,0.08,0.682914386059968,0.6837941087342245,0.5567616463138851,0.5572139303482587,1.0,1.0,oversample,0.6447694756212802,0.6446811615350941,0.6405141131521929,0.07702178607439411,COMPLETE
975,0.7156549520766773,2025-11-26 23:04:35.820350,2025-11-26 23:05:04.396692,0 days 00:00:28.576342,35.17829832267442,dart,0.6376924979784355,0.8980786218743654,lossguide,1.5715740115705166,0.027941529125041765,9,10,7.233005771657565,500,tree,0.9673963479608073,0.19414593166858737,0.0561615210673238,oversample,0.6795782652740141,,6.0,0.6183981378339896,0.23831185620959952,weighted,0.2285756582755912,0.4818834977097849,0.030686461432613214,0.5567616463138851,0.5572139303482587,0.715281812899477,0.7156549520766773,0.9673963479608073,0.19414593166858737,0.05,0.5567616463138851,0.5572139303482587,0.5567616463138851,0.5572139303482587,1.0,1.0,oversample,0.5,0.5,0.6795782652740141,0.030686461432613214,COMPLETE
976,0.7156549520766773,2025-11-26 23:05:04.570086,2025-11-26 23:06:41.917688,0 days 00:01:37.347602,0.00016919767358144027,dart,0.7170785407147484,1.186874131859248,depthwise,0.020829462346625097,0.0009590683571252222,2,12,98.04789801969973,900,tree,0.6094907258118052,0.21134048930274923,0.05694579746558453,oversample,0.544242129798082,,6.0,0.7260649848369685,0.1366766598774985,weighted,0.28567507535841896,0.8756696957239007,0.2710070902904013,0.5567616463138851,0.5572139303482587,0.715281812899477,0.7156549520766773,0.6094907258118052,0.21134048930274923,0.05,0.5567616463138851,0.5572139303482587,0.5567616463138851,0.5572139303482587,1.0,1.0,oversample,0.5,0.5,0.544242129798082,0.2710070902904013,COMPLETE
977,0.7156549520766773,2025-11-26 23:06:42.119932,2025-11-26 23:06:47.557165,0 days 00:00:05.437233,0.1801405811855469,gbtree,0.5896695815026803,0.16989508370960962,lossguide,0.0005499409244878182,0.0014388903183998939,10,5,0.9535719897824902,800,,0.7242524009662685,0.8069668639261335,0.059257652003833525,none,0.9149594943446204,1.3978215267078753,9.0,0.6880303299363519,,,,0.5830932409665348,0.4461434657374695,0.5567616463138851,0.5572139303482587,0.715281812899477,0.7156549520766773,0.7242524009662685,0.8069668639261335,0.05,0.5443884262688419,0.518583232274997,0.5567616463138851,0.5572139303482587,1.0,1.0,none,0.5163435235995292,0.49189928432139873,0.9149594943446204,0.4461434657374695,COMPLETE
978,0.7156549520766773,2025-11-26 23:06:47.737308,2025-11-26 23:06:48.297881,0 days 00:00:00.560573,42.622892469429225,gbtree,0.49499016866165635,2.7152055256176197,depthwise,42.39563328033916,0.008370261709065267,4,5,15.518846129485317,200,,0.5422490546912992,0.17324325013392367,0.08552976948078767,none,0.8767193258495367,2.891216805045296,12.0,0.9322990907669158,,,,0.3134438993385081,0.032995601195222615,0.5567616463138851,0.5572139303482587,0.715281812899477,0.7156549520766773,0.5422490546912992,0.17324325013392367,0.08,0.5567616463138851,0.5572139303482587,0.5567616463138851,0.5572139303482587,1.0,1.0,none,0.5,0.5,0.8767193258495367,0.032995601195222615,COMPLETE
979,0.6422516107154967,2025-11-26 23:06:48.485574,2025-11-26 23:06:56.616613,0 days 00:00:08.131039,0.084238115623998,gbtree,0.37111910670849096,0.33821711206253813,depthwise,0.0005923760337170447,0.024961754009977064,7,7,0.10498939860396068,900,,0.6692059486789836,0.6065402162503013,0.004927453099074338,oversample,0.7524378871214112,,6.0,0.6734053508122239,,,,0.4926492562168735,0.3939616484874027,0.5137946630483944,0.5228403437358661,0.6359634270233661,0.6422516107154967,0.6692059486789836,0.6065402162503013,0.0,0.5319883624499337,0.5242157166232366,0.5452961672473867,0.5515433896330809,0.7627944760357434,0.7686688311688312,oversample,0.46588305509043587,0.45898694002626583,0.7524378871214112,0.3939616484874027,COMPLETE
980,0.7156549520766773,2025-11-26 23:06:56.797184,2025-11-26 23:07:38.671921,0 days 00:00:41.874737,9.659571713461808,dart,0.9837080848809361,0.523048710165858,lossguide,71.008624492846,0.010530621521218163,10,10,30.987659043639606,600,tree,0.982573935782787,0.2615757843267494,0.09358643723236094,oversample,0.6042653314830531,,6.0,0.6817318334018574,0.21366068010138867,weighted,0.25963623110025147,0.8765682159463879,0.18647967524656614,0.5567616463138851,0.5572139303482587,0.715281812899477,0.7156549520766773,0.982573935782787,0.2615757843267494,0.1,0.38906925195279385,0.3921540078405288,0.5567616463138851,0.5572139303482587,1.0,1.0,oversample,0.18318440292445168,0.19250568762187759,0.6042653314830531,0.18647967524656614,COMPLETE
981,0.7156549520766773,2025-11-26 23:07:38.853311,2025-11-26 23:08:59.622038,0 days 00:01:20.768727,3.061716983093779,dart,0.7774743768150534,1.5675798835275667,lossguide,0.13193424521852365,0.008122456679887985,10,7,1.1528870830285065,800,tree,0.7572153910592128,0.09895591066726284,0.07491648704136349,oversample,0.6779998769333186,,8.0,0.6766362616124043,0.11643386253936919,uniform,0.335361078572228,0.6679023077402634,0.11505591555133149,0.5567616463138851,0.5572139303482587,0.715281812899477,0.7156549520766773,0.7572153910592128,0.09895591066726284,0.08,0.539456027936239,0.5226922014346292,0.5567616463138851,0.5572139303482587,1.0,1.0,oversample,0.5154731510800908,0.4957442327845801,0.6779998769333186,0.11505591555133149,COMPLETE
982,0.7156549520766773,2025-11-26 23:08:59.803524,2025-11-26 23:09:28.057734,0 days 00:00:28.254210,1.1899936887105538,dart,0.708559206449642,2.362491686366669,lossguide,2.398252177340166,0.02420593371814431,10,12,13.832671519125691,500,tree,0.9689414353258758,0.5243757954676418,0.09489180183981358,undersample,0.5578606115168592,,6.0,0.6522540426101783,0.27242712744094283,weighted,0.2748408958241769,0.5768339437234631,0.054111838871555754,0.5567616463138851,0.5572139303482587,0.715281812899477,0.7156549520766773,0.9689414353258758,0.5243757954676418,0.1,0.487961698281361,0.48391063650534405,0.5567616463138851,0.5572139303482587,1.0,1.0,undersample,0.3975157081516604,0.40200210922887125,0.5578606115168592,0.054111838871555754,COMPLETE
983,0.0,2025-11-26 23:09:28.233611,2025-11-26 23:09:29.148699,0 days 00:00:00.915088,44.12074841534264,gbtree,0.3073432262021434,2.202910596263775,lossguide,0.0013062575774715655,0.12289043583059304,3,4,3.26902980103394,700,,0.7568473787524389,0.30140897603733385,0.007756591643227431,none,0.9924086344564895,0.6129376838126879,6.0,0.8846951374868359,,,,0.8043429329466347,0.5815170719225412,0.44323835368611486,0.4427860696517413,0.0,0.0,0.7568473787524389,0.30140897603733385,0.0,0.5567616463138851,0.5572139303482587,0.0,0.0,0.0,0.0,none,0.5,0.5,0.9924086344564895,0.5815170719225412,COMPLETE
