number,value,datetime_start,datetime_complete,duration,params_alpha,params_booster,params_colsample_bytree,params_gamma,params_grow_policy,params_lambda,params_learning_rate,params_max_delta_step,params_max_depth,params_min_child_weight,params_n_estimators,params_normalize_type,params_params_feature_fraction,params_params_labeled_ratio,params_params_missing_rate,params_params_resampling,params_params_sample_rows,params_params_scale_pos_weight,params_params_selftrain_max_iter,params_params_selftrain_threshold,params_rate_drop,params_sample_type,params_skip_drop,params_subsample,params_user_attrs_decision_threshold,user_attrs_acc_test,user_attrs_acc_val,user_attrs_f1_test,user_attrs_f1_val,user_attrs_feature_fraction,user_attrs_labeled_ratio,user_attrs_missing_rate,user_attrs_pr_auc_test,user_attrs_pr_auc_val,user_attrs_prec_test,user_attrs_prec_val,user_attrs_rec_test,user_attrs_rec_val,user_attrs_resampling_strategy,user_attrs_roc_auc_test,user_attrs_roc_auc_val,user_attrs_sample_rows,user_attrs_user_attrs_decision_threshold,state
2631,0.7156549520766773,2025-11-30 15:50:51.485481,2025-11-30 15:50:51.869359,0 days 00:00:00.383878,0.1015860647819618,gbtree,0.828524575039685,9.470873269879448,lossguide,4.1325067129302875,0.01651874185271851,10,11,37.33070801238921,200,,0.8026118482633837,0.8525680143876757,0.06836775710066664,none,0.5447934830279568,1.0024883078993658,10.0,0.9318239328733062,,,,0.31953348879480786,,0.5567616463138851,0.5572139303482587,0.715281812899477,0.7156549520766773,0.8026118482633837,0.8525680143876757,0.08,0.4339694987157218,0.4299015779210475,0.5567616463138851,0.5572139303482587,1.0,1.0,none,0.2500364727531955,0.2394252517145775,0.5447934830279568,0.5,COMPLETE
2632,0.7156549520766773,2025-11-30 15:50:52.648615,2025-11-30 15:50:57.632377,0 days 00:00:04.983762,16.27388143414199,dart,0.5687999223937452,7.140047947313553,depthwise,0.00028172962173685665,0.00191398798254858,10,4,0.5471337411561745,200,forest,0.6443901878064113,0.6491555209205974,0.09895865210353107,none,0.7713752647715353,1.051172434070475,6.0,0.9248718576985722,0.4531975301177832,uniform,0.5365985250669097,0.3181901728584519,,0.5567616463138851,0.5572139303482587,0.715281812899477,0.7156549520766773,0.6443901878064113,0.6491555209205974,0.1,0.5699203340862494,0.5605594761407615,0.5567616463138851,0.5572139303482587,1.0,1.0,none,0.5152178418077222,0.49610116007587923,0.7713752647715353,0.5,COMPLETE
2633,0.7156549520766773,2025-11-30 15:50:58.428759,2025-11-30 15:50:58.812763,0 days 00:00:00.384004,61.38773097717656,gbtree,0.752898577622297,4.509593477928542,depthwise,51.756199614957005,0.24749328767184373,9,6,2.6900712341193116,200,,0.564193071934207,0.29821135540604266,0.06551480910046649,none,0.760628035789402,0.9856503861466914,10.0,0.9136305470439188,,,,0.612712236841373,,0.5567616463138851,0.5572139303482587,0.715281812899477,0.7156549520766773,0.564193071934207,0.29821135540604266,0.08,0.5567616463138851,0.5572139303482587,0.5567616463138851,0.5572139303482587,1.0,1.0,none,0.5,0.5,0.760628035789402,0.5,COMPLETE
2634,0.7141610933410876,2025-11-30 15:50:59.617294,2025-11-30 15:53:11.765962,0 days 00:02:12.148668,2.6981728906232263,dart,0.8260133275730157,1.0640900845242396,lossguide,0.00011814596665035822,0.1691762484512488,7,5,2.617093256124579,400,forest,0.970589088818553,0.6771253687124996,0.06561273604740032,none,0.7151734776104015,3.082964125062374,12.0,0.813330570318555,0.3426253983938339,weighted,0.443082005944301,0.730253106141044,,0.555857078245138,0.5554047942107644,0.7145348837209302,0.7141610933410876,0.970589088818553,0.6771253687124996,0.08,0.5513471713228142,0.530560548389927,0.5563603440470801,0.5564114182147711,0.9983753046303818,0.9967532467532467,none,0.4623166000762612,0.4620612405980128,0.7151734776104015,0.5,COMPLETE
2635,0.5793406593406594,2025-11-30 15:53:12.556281,2025-11-30 15:53:13.631839,0 days 00:00:01.075558,0.2512983105394425,gbtree,0.48107745820817327,2.3644051881433716,lossguide,5.432335190862706,0.0006822264511509192,6,5,1.5234543430354492,900,,0.5279601503762577,0.2529386565741491,0.041305806940495265,undersample,0.8395735288227613,,9.0,0.9301731160501501,,,,0.9746759662768236,,0.5757575757575758,0.5671641791044776,0.6018675721561969,0.5793406593406594,0.5279601503762577,0.2529386565741491,0.08,0.6778630149403537,0.6818963251146846,0.6302222222222222,0.6318312559923298,0.5759545085296507,0.5349025974025974,undersample,0.5862108125134701,0.5813951753047769,0.8395735288227613,0.5,COMPLETE
2636,0.28697788697788695,2025-11-30 15:53:14.443367,2025-11-30 15:54:56.124681,0 days 00:01:41.681314,0.003967772798719293,dart,0.2867685102526887,7.215446563728837,lossguide,0.00013725059102188383,0.04560568778158182,1,6,15.077238618005145,900,forest,0.7810140521039708,0.2146105349501381,0.061580518792285634,undersample,0.9081055897878921,,5.0,0.942177611507175,0.09999539774862204,weighted,0.40646210575443775,0.4379994838353751,,0.3518769787426504,0.3437358661239258,0.297204512015694,0.28697788697788695,0.7810140521039708,0.2146105349501381,0.08,0.437963446225235,0.4363109649061338,0.375,0.36363636363636365,0.24614134849715677,0.237012987012987,undersample,0.2867541736434623,0.2702764549036255,0.9081055897878921,0.5,COMPLETE
2637,0.7156549520766773,2025-11-30 15:54:56.894801,2025-11-30 15:55:48.920919,0 days 00:00:52.026118,39.50373872729897,dart,0.9438426218046563,8.396650407288568,depthwise,0.27374817838312665,0.035107440351875796,6,7,0.17498908516907324,700,tree,0.845703811023597,0.3633688015260695,0.027589429726352824,undersample,0.5554348429004262,,8.0,0.6666883543061145,0.46560944384577213,weighted,0.18137628845744952,0.9893239560737337,,0.5567616463138851,0.5572139303482587,0.715281812899477,0.7156549520766773,0.845703811023597,0.3633688015260695,0.08,0.5567616463138851,0.5572139303482587,0.5567616463138851,0.5572139303482587,1.0,1.0,undersample,0.5,0.5,0.5554348429004262,0.5,COMPLETE
2638,0.14276846679081315,2025-11-30 15:55:49.692566,2025-11-30 15:55:57.401307,0 days 00:00:07.708741,0.2753338447166264,dart,0.5418089190914809,0.7595907522886691,lossguide,0.018323552810329623,0.06106463389478136,3,7,0.6344826221156801,200,forest,0.7639636550002395,0.4013082883404656,0.07243225364665207,none,0.9929578426091694,0.5526895290625411,9.0,0.8098928477263443,0.40963807402933977,uniform,0.46060803255088584,0.8828146307270255,,0.3704206241519674,0.3753957485300769,0.12452830188679245,0.14276846679081315,0.7639636550002395,0.4013082883404656,0.08,0.44998323032015414,0.4526589024354697,0.2757660167130919,0.3034300791556728,0.08042242079610074,0.09334415584415584,none,0.35854954491951124,0.36172570407120974,0.9929578426091694,0.5,COMPLETE
2639,0.7156549520766773,2025-11-30 15:55:58.193497,2025-11-30 15:55:58.883990,0 days 00:00:00.690493,16.588130600775756,gbtree,0.27182224872059235,0.89474077142642,lossguide,0.018786678517188658,0.049898534531391134,4,10,39.51303102011287,600,,0.7784687056987215,0.5523011261927937,0.012009341164721021,none,0.8202650704629968,1.1328472126009803,8.0,0.7610199702274854,,,,0.5750623715131515,,0.5567616463138851,0.5572139303482587,0.715281812899477,0.7156549520766773,0.7784687056987215,0.5523011261927937,0.08,0.5903811427023491,0.6018878836048153,0.5567616463138851,0.5572139303482587,1.0,1.0,none,0.5397640047083009,0.5444911319528276,0.8202650704629968,0.5,COMPLETE
2640,0.7156549520766773,2025-11-30 15:55:59.669323,2025-11-30 15:56:00.356667,0 days 00:00:00.687344,0.0001179432437753718,gbtree,0.6866237650539866,6.537942618709064,lossguide,0.13945510279435683,0.006341064092705058,4,7,15.313727038252093,700,,0.9423513743570311,0.596593355359174,0.008484605862306205,oversample,0.9148298789302642,,8.0,0.8300088337385017,,,,0.9622852025074293,,0.5567616463138851,0.5572139303482587,0.715281812899477,0.7156549520766773,0.9423513743570311,0.596593355359174,0.08,0.5968239037334664,0.6161421461537262,0.5567616463138851,0.5572139303482587,1.0,1.0,oversample,0.5606032096022812,0.583343973442288,0.9148298789302642,0.5,COMPLETE
2641,0.7090744648779017,2025-11-30 15:56:01.140754,2025-11-30 15:56:01.521103,0 days 00:00:00.380349,0.2780030754595946,gbtree,0.9975986842668976,7.494879859476326,depthwise,0.0003020492132927302,0.1133386973485875,8,4,0.18546655112887894,200,,0.6093628884506499,0.8810550055452737,0.08040340516219602,oversample,0.6302502098809537,,10.0,0.6537165861063036,,,,0.33281942005061504,,0.5468113975576662,0.5635459068294889,0.6980108499095841,0.7090744648779017,0.6093628884506499,0.8810550055452737,0.08,0.5546465565880931,0.556652670142372,0.5548634403449928,0.5640287769784172,0.9406986190089358,0.9545454545454546,oversample,0.5056599081549761,0.5097962239496968,0.6302502098809537,0.5,COMPLETE
2642,0.0,2025-11-30 15:56:02.303012,2025-11-30 15:56:14.188920,0 days 00:00:11.885908,22.963046219380935,dart,0.6064126644128867,9.34873349302298,lossguide,0.0001283556548000829,0.0019071275857028018,5,9,0.5750939145492412,300,forest,0.8014483937902888,0.2685684292934323,0.007483134447375118,undersample,0.5888784934888699,,6.0,0.7767420068587738,0.0517913453961103,uniform,0.06778406622857325,0.4757931920907523,,0.44323835368611486,0.4427860696517413,0.0,0.0,0.8014483937902888,0.2685684292934323,0.08,0.5567616463138851,0.5572139303482587,0.0,0.0,0.0,0.0,undersample,0.5,0.5,0.5888784934888699,0.5,COMPLETE
2643,0.7156549520766773,2025-11-30 15:56:14.969800,2025-11-30 15:59:20.661613,0 days 00:03:05.691813,0.0062081640472202776,dart,0.4264096227395875,3.177784414244954,lossguide,0.006092680037970142,0.01355270230681551,8,11,5.741704081637996,600,forest,0.7177515434543035,0.26288053455361166,0.0925164453455373,none,0.8699247073626188,1.4353268176898115,8.0,0.7285686383629547,0.32115428544953323,uniform,0.7903395394425337,0.23772444536608914,,0.5567616463138851,0.5572139303482587,0.715281812899477,0.7156549520766773,0.7177515434543035,0.26288053455361166,0.1,0.46898837824531386,0.45248325622154395,0.5567616463138851,0.5572139303482587,1.0,1.0,none,0.35720461214542676,0.33304632675802237,0.8699247073626188,0.5,COMPLETE
2644,0.7156549520766773,2025-11-30 15:59:21.450065,2025-11-30 15:59:22.360825,0 days 00:00:00.910760,4.112451308999606,gbtree,0.37832995073427506,4.797008501643422,lossguide,0.011414049653028524,0.0008808938946406013,7,6,1.6962099444879781,1000,,0.655727181233541,0.545228641115842,0.09046240049929488,oversample,0.927872535265831,,11.0,0.6490028283915616,,,,0.9625553894563281,,0.5567616463138851,0.5572139303482587,0.715281812899477,0.7156549520766773,0.655727181233541,0.545228641115842,0.1,0.421433703761856,0.4122656678677489,0.5567616463138851,0.5572139303482587,1.0,1.0,oversample,0.19985949700757635,0.18033948303994268,0.927872535265831,0.5,COMPLETE
2645,0.6056527590847914,2025-11-30 15:59:23.144603,2025-11-30 16:00:18.313908,0 days 00:00:55.169305,0.08752109810737196,dart,0.892812502085091,8.781888274439439,depthwise,0.002892806922596464,0.0016836365725487932,4,7,39.465946180337255,700,forest,0.7628650419274507,0.4670815086914344,0.09452312013042193,undersample,0.5450668721065685,,9.0,0.725194782084139,0.22656289908431643,weighted,0.2678861274109046,0.5456758263316266,,0.6132971506105834,0.6024423337856174,0.6211785556047851,0.6056527590847914,0.7628650419274507,0.4670815086914344,0.1,0.6401532192078145,0.6235454017659798,0.6832358674463938,0.6770310932798396,0.5694557270511779,0.5478896103896104,undersample,0.6137991346010377,0.5985981587360545,0.5450668721065685,0.5,COMPLETE
2646,0.7156549520766773,2025-11-30 16:00:19.104417,2025-11-30 16:01:35.335972,0 days 00:01:16.231555,0.00903722233947498,dart,0.27908231331566996,7.791708261392904,lossguide,21.479978579767014,0.010099358009238994,3,3,9.941497334799461,800,tree,0.5901315771216944,0.30757069453425173,0.016086401275177697,oversample,0.9887138905896962,,9.0,0.6847997807560569,0.11903145501551204,uniform,0.14863055458431945,0.5150442378977838,,0.5567616463138851,0.5572139303482587,0.715281812899477,0.7156549520766773,0.5901315771216944,0.30757069453425173,0.08,0.5132699287426776,0.5154779436395277,0.5567616463138851,0.5572139303482587,1.0,1.0,oversample,0.21319609078399843,0.21970968255442208,0.9887138905896962,0.5,COMPLETE
2647,0.5214257108530236,2025-11-30 16:01:36.128038,2025-11-30 16:01:37.016772,0 days 00:00:00.888734,0.01687998246250433,gbtree,0.34710910489820035,3.435251842825333,lossguide,0.0045964173644546585,0.0007351892273317832,4,3,1.8441647955218878,900,,0.9171850469505485,0.24791302660673842,0.009957892885632702,undersample,0.951787643707122,,7.0,0.8563209275497115,,,,0.8600831320682305,,0.4495703301673451,0.459520578923564,0.51610337972167,0.5214257108530236,0.9171850469505485,0.24791302660673842,0.08,0.562478043646931,0.5359314947458794,0.5054517133956387,0.5146245059288538,0.5272136474411048,0.5284090909090909,undersample,0.43610968351597335,0.4315615755541701,0.951787643707122,0.5,COMPLETE
2648,0.7156549520766773,2025-11-30 16:01:37.793203,2025-11-30 16:03:00.940522,0 days 00:01:23.147319,59.42694541839856,dart,0.41656820951407325,4.016624484853892,depthwise,0.0018055592735825563,0.0001754337326848355,4,4,61.556971875730994,900,tree,0.6916844599660616,0.40134759645683027,0.08601325286547672,none,0.7219263608990464,1.8182119551945877,6.0,0.8573600797056027,0.3867428274256971,weighted,0.3124560201086155,0.949172261204547,,0.5567616463138851,0.5572139303482587,0.715281812899477,0.7156549520766773,0.6916844599660616,0.40134759645683027,0.08,0.5567616463138851,0.5572139303482587,0.5567616463138851,0.5572139303482587,1.0,1.0,none,0.5,0.5,0.7219263608990464,0.5,COMPLETE
2649,0.7156549520766773,2025-11-30 16:03:01.719917,2025-11-30 16:03:07.262134,0 days 00:00:05.542217,0.000392051950413608,dart,0.47307798910156484,1.0703949905961074,lossguide,0.018910516913943798,0.004132594969706434,2,3,99.86293986436579,200,forest,0.9976129671942884,0.3155598248482787,0.018087338729342685,none,0.6163004142644174,2.6577308075117134,7.0,0.872050732202465,0.33989244562667964,weighted,0.8537571839831274,0.5529473063749559,,0.5567616463138851,0.5572139303482587,0.715281812899477,0.7156549520766773,0.9976129671942884,0.3155598248482787,0.08,0.6877136909642763,0.6717506683764679,0.5567616463138851,0.5572139303482587,1.0,1.0,none,0.6199833385831992,0.6002294118037222,0.6163004142644174,0.5,COMPLETE
2650,0.7156549520766773,2025-11-30 16:03:08.056114,2025-11-30 16:03:13.810442,0 days 00:00:05.754328,0.001105961577286726,dart,0.6701682946827641,4.7047738121191385,depthwise,0.00032989999361648107,0.005604302253837088,9,12,2.6112491123353765,200,tree,0.5942593021757722,0.3423885111281516,0.05996476875910173,oversample,0.9494268373112197,,6.0,0.9351513777303395,0.006899289358747507,weighted,0.6957742754502143,0.42286189263997287,,0.5567616463138851,0.5572139303482587,0.715281812899477,0.7156549520766773,0.5942593021757722,0.3423885111281516,0.08,0.45712775878716916,0.44775039778797704,0.5567616463138851,0.5572139303482587,1.0,1.0,oversample,0.3773558082859464,0.35393507156786014,0.9494268373112197,0.5,COMPLETE
2651,0.3713665943600868,2025-11-30 16:03:14.562386,2025-11-30 16:03:45.464759,0 days 00:00:30.902373,0.0009245027890453619,dart,0.4370601182070214,7.64432019276624,lossguide,0.00012266488887487825,0.10124790210648993,3,10,2.2798255649882537,500,tree,0.6880504069931601,0.8013919280700414,0.09718864051773712,undersample,0.8928129185583398,,8.0,0.9031577684069019,0.1415708930987728,weighted,0.3871930138312112,0.7043829285648391,,0.34011759384893714,0.344640434192673,0.3751605995717345,0.3713665943600868,0.6880504069931601,0.8013919280700414,0.1,0.4648893107941295,0.4634211923033577,0.3967391304347826,0.39888164026095063,0.35580828594638503,0.3474025974025974,undersample,0.32917074222052756,0.3326777920751363,0.8928129185583398,0.5,COMPLETE
2652,0.7156549520766773,2025-11-30 16:03:46.250250,2025-11-30 16:03:46.692120,0 days 00:00:00.441870,0.007375206378888339,gbtree,0.4837406016426868,8.377586481746187,lossguide,1.4406909169203974,0.0029045614521446316,0,8,8.345761889997666,300,,0.5171471421257012,0.24223315682189656,0.006743896497349755,oversample,0.7857836905488689,,7.0,0.8578140064796318,,,,0.23493998339574632,,0.5567616463138851,0.5572139303482587,0.715281812899477,0.7156549520766773,0.5171471421257012,0.24223315682189656,0.08,0.46393356155849924,0.45573874789796054,0.5567616463138851,0.5572139303482587,1.0,1.0,oversample,0.37103980503655565,0.35030941989573244,0.7857836905488689,0.5,COMPLETE
2653,0.30998248686514884,2025-11-30 16:03:47.480049,2025-11-30 16:03:48.119761,0 days 00:00:00.639712,32.87474067671082,gbtree,0.36693830236191155,1.5006119383130712,lossguide,0.0013221929433191533,0.011808694979879792,8,10,3.3432465197475594,600,,0.5226657819860101,0.740558467322689,0.013404259276773946,undersample,0.8689085975052835,,7.0,0.784569217610072,,,,0.3907813367120687,,0.31569425599276346,0.2872003618272275,0.3498066179630425,0.30998248686514884,0.5226657819860101,0.740558467322689,0.08,0.4431610186258546,0.42438006140413753,0.37135036496350365,0.3365019011406844,0.330625507717303,0.28733766233766234,undersample,0.2987275982692021,0.26277849448814716,0.8689085975052835,0.5,COMPLETE
2654,0.7156549520766773,2025-11-30 16:03:48.890262,2025-11-30 16:05:43.435220,0 days 00:01:54.544958,0.0028247084992890636,dart,0.28076605036249,0.8093962133493326,depthwise,2.748424322249791,0.001330899473967381,9,8,0.287538026991625,900,forest,0.6361241572482588,0.6124741075297822,0.06281744083450873,oversample,0.5992333224578317,,5.0,0.7688430333987897,0.020828926450555174,uniform,0.0712136283023023,0.5027825128955634,,0.5563093622795116,0.5572139303482587,0.7149084568439407,0.7156549520766773,0.6361241572482588,0.6124741075297822,0.08,0.4834180553071281,0.4751683336327347,0.5565610859728507,0.5572139303482587,0.9991876523151909,1.0,oversample,0.3813765148626469,0.35828286881657667,0.5992333224578317,0.5,COMPLETE
2655,0.6517412935323383,2025-11-30 16:05:44.216269,2025-11-30 16:05:44.735784,0 days 00:00:00.519515,3.5774916126838385,gbtree,0.9579386198306545,6.559972513416657,lossguide,0.049639099931643664,0.01664743235595096,3,8,15.111705915478185,400,,0.5410757176974932,0.23655410503427285,0.04680205698200244,undersample,0.845149627535875,,6.0,0.7107168282045272,,,,0.22256369144742794,,0.6648575305291723,0.6834011759384894,0.6281986954340191,0.6517412935323383,0.5410757176974932,0.23655410503427285,0.08,0.8443217136085543,0.8546707211166694,0.821522309711286,0.8419023136246787,0.5085296506904955,0.5316558441558441,undersample,0.8252942688041911,0.8283129982887388,0.845149627535875,0.5,COMPLETE
2656,0.7156549520766773,2025-11-30 16:05:45.543218,2025-11-30 16:06:30.279404,0 days 00:00:44.736186,19.934456788244074,dart,0.49482430502242264,4.476054172333482,lossguide,7.200288106165944,0.2674787647191357,2,9,0.11995836915659487,600,forest,0.5326474168544124,0.7772003557259854,0.016991301253009784,oversample,0.5458317171516579,,9.0,0.7633128795291343,0.09139250266669863,weighted,0.07281005143645956,0.8776823609185511,,0.5567616463138851,0.5572139303482587,0.715281812899477,0.7156549520766773,0.5326474168544124,0.7772003557259854,0.08,0.52621349371862,0.5258749495914962,0.5567616463138851,0.5572139303482587,1.0,1.0,oversample,0.4034014986985859,0.3956342112943237,0.5458317171516579,0.5,COMPLETE
2657,0.606328683225587,2025-11-30 16:06:31.055195,2025-11-30 16:06:31.496457,0 days 00:00:00.441262,0.18967671658655902,gbtree,0.36027835867566477,2.4546480992961426,depthwise,0.03330231176273231,0.0010769058323478234,0,5,62.66653884729082,300,,0.9196705867868167,0.4696803587469334,0.049108584066666384,undersample,0.6974046193287656,,5.0,0.8890742120807751,,,,0.2869604503560619,,0.4789687924016282,0.4767073722297603,0.607094133697135,0.606328683225587,0.9196705867868167,0.4696803587469334,0.08,0.6365833106629878,0.6160327142898563,0.5232216343327455,0.5219683655536028,0.7229894394800975,0.7232142857142857,undersample,0.5794898788109883,0.5557760038735524,0.6974046193287656,0.5,COMPLETE
2658,0.42406143344709896,2025-11-30 16:06:32.281354,2025-11-30 16:07:17.665131,0 days 00:00:45.383777,0.01388128181380558,dart,0.2634276191507711,4.4976085981888145,depthwise,0.2962920673299736,0.22856002281293694,2,8,33.37896848859155,600,forest,0.9466743269395916,0.7125374808010196,0.0724506938454232,undersample,0.8005585586750994,,7.0,0.7662800539730109,0.16640829413688596,weighted,0.3300205189851768,0.6258461606740098,,0.3808231569425599,0.3894165535956581,0.42260649514972587,0.42406143344709896,0.9466743269395916,0.7125374808010196,0.08,0.4620709547559693,0.4529819916485863,0.4394736842105263,0.44694244604316546,0.40698619008935827,0.4034090909090909,undersample,0.36940599147863856,0.35687132708966207,0.8005585586750994,0.5,COMPLETE
2659,0.7156549520766773,2025-11-30 16:07:18.443550,2025-11-30 16:07:35.024680,0 days 00:00:16.581130,0.0011006666225617948,dart,0.3363095570727168,8.563756615977296,lossguide,84.00705415493134,0.0001374633031320413,4,4,0.46500456569042964,400,forest,0.9925290577429073,0.7474751398995196,0.08468947495388789,oversample,0.6758130712555039,,10.0,0.6552246749950366,0.3212995110995193,uniform,0.21866395126474872,0.7416817562933447,,0.5567616463138851,0.5572139303482587,0.715281812899477,0.7156549520766773,0.9925290577429073,0.7474751398995196,0.08,0.5264562177080571,0.5357122938746073,0.5567616463138851,0.5572139303482587,1.0,1.0,oversample,0.42882507999137914,0.4520875893769153,0.6758130712555039,0.5,COMPLETE
