number,value,datetime_start,datetime_complete,duration,params_alpha,params_booster,params_colsample_bytree,params_gamma,params_grow_policy,params_lambda,params_learning_rate,params_max_delta_step,params_max_depth,params_min_child_weight,params_n_estimators,params_normalize_type,params_params_feature_fraction,params_params_labeled_ratio,params_params_missing_rate,params_params_resampling,params_params_sample_rows,params_params_scale_pos_weight,params_params_selftrain_max_iter,params_params_selftrain_threshold,params_rate_drop,params_sample_type,params_skip_drop,params_subsample,params_user_attrs_decision_threshold,user_attrs_acc_test,user_attrs_acc_val,user_attrs_f1_test,user_attrs_f1_val,user_attrs_feature_fraction,user_attrs_labeled_ratio,user_attrs_missing_rate,user_attrs_pr_auc_test,user_attrs_pr_auc_val,user_attrs_prec_test,user_attrs_prec_val,user_attrs_rec_test,user_attrs_rec_val,user_attrs_resampling_strategy,user_attrs_roc_auc_test,user_attrs_roc_auc_val,user_attrs_sample_rows,user_attrs_user_attrs_decision_threshold,state
1824,0.26944585663446874,2025-11-27 10:46:17.161815,2025-11-27 10:46:55.098959,0 days 00:00:37.937144,0.0008919670934035521,dart,0.4054052889589593,6.221922694904162,depthwise,22.93169511772986,0.0707289637851482,10,6,1.3816237369176383,600,tree,0.7150135353760187,0.3580599383233362,0.02770826690937104,undersample,0.7259745051847577,,6.0,0.8462766629021963,0.27393704993083967,uniform,0.23920324432978454,0.20712492791356604,,0.38670284938941657,0.35006784260515605,0.3165322580645161,0.26944585663446874,0.7150135353760187,0.3580599383233362,0.02,0.6660215463276237,0.6483140202192408,0.4169986719787517,0.36054421768707484,0.2550771730300569,0.2150974025974026,undersample,0.5752503357151146,0.5292104154782908,0.7259745051847577,0.5,COMPLETE
1825,0.7156549520766773,2025-11-27 10:46:55.306936,2025-11-27 10:46:58.964993,0 days 00:00:03.658057,6.1981253099794955,dart,0.42261874925692205,5.596679298690939,lossguide,0.05132869958394093,0.274104649344956,9,10,0.2095981070365765,200,forest,0.6056031098975483,0.6353388128517865,0.007078389665272089,none,0.6934837035957774,1.8227211534244192,6.0,0.7171447423452885,0.4526815851613336,uniform,0.11276728474814492,0.6987840048837499,,0.5567616463138851,0.5572139303482587,0.715281812899477,0.7156549520766773,0.6056031098975483,0.6353388128517865,0.0,0.5262536304255717,0.5097697623825634,0.5567616463138851,0.5572139303482587,1.0,1.0,none,0.43160364064390994,0.4155214040300863,0.6934837035957774,0.5,COMPLETE
1826,0.46296296296296297,2025-11-27 10:46:59.164266,2025-11-27 10:46:59.592953,0 days 00:00:00.428687,0.0002284055306005249,gbtree,0.28299643437218497,3.5567423120074624,depthwise,6.7762759693282755,0.0008531609258562516,5,5,0.7923898660217177,200,,0.9635752188236617,0.2692689558805424,0.07811782085684593,undersample,0.7400217163019546,,6.0,0.7682903265324946,,,,0.483626136052606,,0.4251469923111714,0.4491180461329715,0.43435692033822876,0.46296296296296297,0.9635752188236617,0.2692689558805424,0.08,0.4494706309393661,0.468354631831851,0.48031496062992124,0.5067567567567568,0.39642567018683994,0.42613636363636365,undersample,0.32063487458346457,0.35249782775957444,0.7400217163019546,0.5,COMPLETE
1827,0.3497983870967742,2025-11-27 10:46:59.792697,2025-11-27 10:47:11.447853,0 days 00:00:11.655156,0.0004546257951148222,dart,0.9665530969260396,5.928977624010155,lossguide,0.1373750905436082,0.0325293268426355,8,5,34.16910810214667,300,forest,0.7862057142282957,0.5127030591674482,0.0008636591717047005,none,0.8746684252094135,0.7634383272351501,12.0,0.6677474382793018,0.10498151510313919,uniform,0.4136073446950772,0.31723236924261305,,0.43464495703301675,0.41655359565807326,0.37749003984063745,0.3497983870967742,0.7862057142282957,0.5127030591674482,0.0,0.4990860277864718,0.48862163861009134,0.4877734877734878,0.46143617021276595,0.30787977254264826,0.28165584415584416,none,0.4311916643180424,0.41908943329397874,0.8746684252094135,0.5,COMPLETE
1828,0.6290212183436003,2025-11-27 10:47:11.648375,2025-11-27 10:47:16.025091,0 days 00:00:04.376716,0.04109535894722091,dart,0.3367941167746976,6.461075337502055,depthwise,0.037444699378124995,0.10689589339557817,5,4,4.067051467286247,200,tree,0.5254298745688355,0.8836897381849005,0.08551020525044381,undersample,0.7266551273032401,,9.0,0.847172860338557,0.3331653864478769,weighted,0.012714259536297113,0.3003232110387739,,0.49525101763907736,0.5097241067390321,0.6244952893674294,0.6290212183436003,0.5254298745688355,0.8836897381849005,0.08,0.5497430803311552,0.543280481023168,0.5330269959793222,0.5437869822485207,0.7538586515028433,0.7459415584415584,undersample,0.46759478771199786,0.468370687024926,0.7266551273032401,0.5,COMPLETE
1829,0.7156549520766773,2025-11-27 10:47:16.227029,2025-11-27 10:47:56.092809,0 days 00:00:39.865780,0.0011945062299653362,dart,0.5053013033349298,8.937179295227336,lossguide,0.058208391346960424,0.0035291872120310256,0,12,5.394050404499214,600,tree,0.7096754958673868,0.4233014668123026,0.07512853270023069,oversample,0.5968970785305482,,10.0,0.6987278281672716,0.2474075670456894,weighted,0.24054033535137767,0.5400519307307328,,0.5567616463138851,0.5572139303482587,0.715281812899477,0.7156549520766773,0.7096754958673868,0.4233014668123026,0.08,0.5964270229521947,0.6083557388770148,0.5567616463138851,0.5572139303482587,1.0,1.0,oversample,0.5502018435318888,0.5706570944377379,0.5968970785305482,0.5,COMPLETE
1830,0.20182440136830102,2025-11-27 10:47:56.295975,2025-11-27 10:47:56.956099,0 days 00:00:00.660124,2.3459663183221933,gbtree,0.3316873831173881,9.61632975675131,lossguide,0.13936591405820997,0.33770286857326076,9,8,0.5513603074928447,600,,0.5853281099635044,0.7298851244005871,0.03262644217301998,undersample,0.9216774077363242,,5.0,0.8022073528626351,,,,0.8250727174070376,,0.3749434644957033,0.36680235187697874,0.21387940841865757,0.20182440136830102,0.5853281099635044,0.7298851244005871,0.02,0.52621349371862,0.5258749495914962,0.3567362428842505,0.3390804597701149,0.15272136474411047,0.14366883116883117,undersample,0.4034014986985859,0.3956342112943237,0.9216774077363242,0.5,COMPLETE
1831,0.0,2025-11-27 10:47:57.155355,2025-11-27 10:47:57.855408,0 days 00:00:00.700053,27.466693353295607,gbtree,0.6060451990823725,7.070725522656809,depthwise,0.50723832230338,0.02508615921645614,2,7,25.01290906574676,700,,0.65737962620023,0.6424845699937176,0.07806391567523405,none,0.842136522577118,0.7411729461226101,12.0,0.6517592432022739,,,,0.39822540537693585,,0.44323835368611486,0.4427860696517413,0.0,0.0,0.65737962620023,0.6424845699937176,0.08,0.5567616463138851,0.5572139303482587,0.0,0.0,0.0,0.0,none,0.5,0.5,0.842136522577118,0.5,COMPLETE
1832,0.7156549520766773,2025-11-27 10:47:58.062549,2025-11-27 10:48:17.897185,0 days 00:00:19.834636,0.0009628716523891369,dart,0.6259884662768442,9.003383427056294,lossguide,0.3774505137691178,0.003141858490384316,7,10,17.493895814318567,400,tree,0.5128721068749347,0.4714376994152646,0.07946117182649748,none,0.7321835121667037,3.216871237446243,9.0,0.7554586031992414,0.46765020419328074,weighted,0.8159276859465825,0.9608555400394418,,0.5567616463138851,0.5572139303482587,0.715281812899477,0.7156549520766773,0.5128721068749347,0.4714376994152646,0.08,0.5567616463138851,0.5572139303482587,0.5567616463138851,0.5572139303482587,1.0,1.0,none,0.5,0.5,0.7321835121667037,0.5,COMPLETE
1833,0.7156549520766773,2025-11-27 10:48:18.097744,2025-11-27 10:49:55.064643,0 days 00:01:36.966899,0.06643540323376135,dart,0.6883546021021831,1.427988669081106,depthwise,35.62903379027675,0.1019037519819036,3,5,0.10907558543309434,900,forest,0.6652011186912437,0.665217386352448,0.018532113872958167,none,0.7084016533653619,1.6268663889955974,12.0,0.8118394445983241,0.30721304217699946,uniform,0.5649376901059066,0.24063811192278264,,0.5567616463138851,0.5572139303482587,0.715281812899477,0.7156549520766773,0.6652011186912437,0.665217386352448,0.02,0.5278667431989102,0.5241946616413657,0.5567616463138851,0.5572139303482587,1.0,1.0,none,0.46643180424078645,0.4656678229839619,0.7084016533653619,0.5,COMPLETE
1834,0.6030989272943981,2025-11-27 10:49:55.259944,2025-11-27 10:49:58.561271,0 days 00:00:03.301327,0.006975555252117213,gbtree,0.20133089894160827,1.7801758545621216,depthwise,0.1300305269899606,0.02016983953821253,8,9,0.6437730615101579,600,,0.9346595510321345,0.24328861291742107,0.01647649031550046,undersample,0.6039799290363295,,10.0,0.7780338901021299,,,,0.5081843573537462,,0.5685210312075983,0.5481682496607869,0.6168674698795181,0.6030989272943981,0.9346595510321345,0.24328861291742107,0.02,0.5671651122310295,0.5594040939454558,0.6100079428117554,0.5906614785992218,0.6238830219333875,0.6160714285714286,undersample,0.5596503589250486,0.5364579878752503,0.6039799290363295,0.5,COMPLETE
1835,0.0,2025-11-27 10:49:58.774762,2025-11-27 10:49:59.179518,0 days 00:00:00.404756,0.012022673310206131,gbtree,0.5600905858110024,4.63072623691111,depthwise,0.00588170264864972,0.055894272902835655,0,6,93.68179456813914,200,,0.9259579543260673,0.32195509466843936,0.06656864286583843,undersample,0.8168659822705086,,6.0,0.6916843110614347,,,,0.2735448633585505,,0.44323835368611486,0.4427860696517413,0.0,0.0,0.9259579543260673,0.32195509466843936,0.08,0.5567616463138851,0.5572139303482587,0.0,0.0,0.0,0.0,undersample,0.5,0.5,0.8168659822705086,0.5,COMPLETE
1836,0.46296296296296297,2025-11-27 10:49:59.389402,2025-11-27 10:50:00.023257,0 days 00:00:00.633855,0.002502993704702185,gbtree,0.5382422923830124,9.649381252645671,depthwise,4.689385558988104,0.00011161472249360992,8,6,12.759062523209469,600,,0.5144093776728376,0.6461933239516768,0.07064708347768159,undersample,0.8930428499420812,,10.0,0.8581597533087568,,,,0.41160162512813536,,0.4251469923111714,0.4491180461329715,0.43435692033822876,0.46296296296296297,0.5144093776728376,0.6461933239516768,0.08,0.512816800239987,0.5223518641905027,0.48031496062992124,0.5067567567567568,0.39642567018683994,0.42613636363636365,undersample,0.40154801969528675,0.42089396813605184,0.8930428499420812,0.5,COMPLETE
1837,0.7156549520766773,2025-11-27 10:50:00.236048,2025-11-27 10:50:25.765023,0 days 00:00:25.528975,25.712594524424368,dart,0.5814122284057448,0.9466832290906735,depthwise,4.600784006384094,0.25677325738594164,2,8,15.264618868340504,500,tree,0.5838827904071955,0.2653705067140117,0.07322159326873108,oversample,0.7295562616133577,,8.0,0.7047748811713532,0.4334334480274302,weighted,0.0372490300866427,0.8603106265729215,,0.5567616463138851,0.5572139303482587,0.715281812899477,0.7156549520766773,0.5838827904071955,0.2653705067140117,0.08,0.5264562177080571,0.5357122938746073,0.5567616463138851,0.5572139303482587,1.0,1.0,oversample,0.42882507999137914,0.4520875893769153,0.7295562616133577,0.5,COMPLETE
1838,0.5215377489578509,2025-11-27 10:50:25.958251,2025-11-27 10:53:41.336253,0 days 00:03:15.378002,1.4141691079663121,dart,0.8823783373585807,0.027258690094982274,depthwise,0.0007466691391896877,0.016284870089030377,4,10,13.300475013941446,1000,forest,0.5895417592032834,0.7943066448849441,0.04392019707217765,undersample,0.8365285250165513,,5.0,0.7784086301785353,0.40827804021526043,uniform,0.7668207469348943,0.7719747983336858,,0.5251017639077341,0.532790592492085,0.5120817843866171,0.5215377489578509,0.5895417592032834,0.7943066448849441,0.05,0.6164904649027525,0.6126902470496696,0.5982627578718784,0.6073354908306364,0.4476035743298132,0.4569805194805195,undersample,0.5607934481672442,0.573238080867039,0.8365285250165513,0.5,COMPLETE
1839,0.7156549520766773,2025-11-27 10:53:41.539109,2025-11-27 10:55:11.923566,0 days 00:01:30.384457,0.0004168404757092114,dart,0.20039277104003475,2.7617700627766064,depthwise,3.4661198550259416,0.017992391593925645,0,4,10.823974926909225,1000,forest,0.9431123593907437,0.25782703406451574,0.029572607868835032,oversample,0.8627956459054884,,8.0,0.8747976681878891,0.4404407267894313,uniform,0.17879848635201526,0.391741510432591,,0.5567616463138851,0.5572139303482587,0.715281812899477,0.7156549520766773,0.9431123593907437,0.25782703406451574,0.02,0.45455141379399683,0.44473678346600576,0.5567616463138851,0.5572139303482587,1.0,1.0,oversample,0.3513470050896069,0.3225424664712203,0.8627956459054884,0.5,COMPLETE
1840,0.7149505526468877,2025-11-27 10:55:12.125254,2025-11-27 10:55:12.915927,0 days 00:00:00.790673,3.3187346930363755,gbtree,0.8333944027385101,1.4282453313212085,lossguide,15.474787434478097,0.01904383794439122,7,9,5.37678103959283,600,,0.64264396972515,0.8314000991383579,0.01755034140755074,oversample,0.655064844858037,,10.0,0.8022899466816655,,,,0.9714953599455292,,0.555857078245138,0.5567616463138851,0.7145348837209302,0.7149505526468877,0.64264396972515,0.8314000991383579,0.02,0.5161929895937984,0.5035694598541607,0.5563603440470801,0.557116953762466,0.9983753046303818,0.997564935064935,oversample,0.46085520316981377,0.4339982986880331,0.655064844858037,0.5,COMPLETE
1841,0.6601811472660181,2025-11-27 10:55:13.114105,2025-11-27 10:55:35.055522,0 days 00:00:21.941417,2.008564379169731,dart,0.49385489246004544,3.991362440071385,lossguide,0.06368389169341047,0.21328095069077788,8,6,31.873401640001706,400,forest,0.9794534623018814,0.738698068981956,0.06902621570556147,oversample,0.9824321208269569,,5.0,0.83752071599653,0.0649624333076877,weighted,0.8880610114446531,0.24899971688134884,,0.5246494798733605,0.5418362731795567,0.6479061976549414,0.6601811472660181,0.9794534623018814,0.738698068981956,0.08,0.5327248582403379,0.5464405499401364,0.5513112884834663,0.5626072041166381,0.7855402112103981,0.7987012987012987,oversample,0.4749382449974303,0.4971031266996538,0.9824321208269569,0.5,COMPLETE
1842,0.7156549520766773,2025-11-27 10:55:35.253558,2025-11-27 10:55:35.719367,0 days 00:00:00.465809,4.426185857423289,gbtree,0.28978588983219533,9.19405988910597,depthwise,0.0032309674437264882,0.00010438359364669924,7,11,0.1548244879374997,300,,0.6850113635494144,0.6036364061099981,0.05447598583067481,none,0.6904266712893897,0.9806079752729748,12.0,0.8800879174440929,,,,0.7257385499365487,,0.5567616463138851,0.5572139303482587,0.715281812899477,0.7156549520766773,0.6850113635494144,0.6036364061099981,0.05,0.5156094435201981,0.5171065619652895,0.5567616463138851,0.5572139303482587,1.0,1.0,none,0.37648377791409005,0.38085053990952866,0.6904266712893897,0.5,COMPLETE
1843,0.7156549520766773,2025-11-27 10:55:35.922834,2025-11-27 10:56:39.916492,0 days 00:01:03.993658,53.44498711054583,dart,0.43972434099896857,7.4825616222096425,lossguide,0.001070898234742891,0.08600349965876272,10,9,65.09817230565065,700,forest,0.8921439359314582,0.34061463636217454,0.04479603705550499,undersample,0.6746730815926276,,10.0,0.7565697865291469,0.0637435540060921,weighted,0.5862234134797929,0.892164821095383,,0.5567616463138851,0.5572139303482587,0.715281812899477,0.7156549520766773,0.8921439359314582,0.34061463636217454,0.05,0.5567616463138851,0.5572139303482587,0.5567616463138851,0.5572139303482587,1.0,1.0,undersample,0.5,0.5,0.6746730815926276,0.5,COMPLETE
1844,0.7156549520766773,2025-11-27 10:56:40.104694,2025-11-27 10:56:41.168154,0 days 00:00:01.063460,14.460417324092655,gbtree,0.6264849959637693,0.817930757153571,depthwise,0.0017625230766914266,0.0011649088247074127,10,3,0.4454704523848315,800,,0.7087714255094246,0.373373020858772,0.021648792168083887,oversample,0.9704093379323051,,11.0,0.9220787753959578,,,,0.9170235257816901,,0.5567616463138851,0.5572139303482587,0.715281812899477,0.7156549520766773,0.7087714255094246,0.373373020858772,0.02,0.4779237172747851,0.4720848739839143,0.5567616463138851,0.5572139303482587,1.0,1.0,oversample,0.3709643727515377,0.36854960667524506,0.9704093379323051,0.5,COMPLETE
1845,0.7156549520766773,2025-11-27 10:56:41.361667,2025-11-27 10:56:42.123395,0 days 00:00:00.761728,0.0005490467683692469,gbtree,0.8471076484609827,8.64227373869638,depthwise,0.012653266972433654,0.19207555737501975,2,12,0.6082521921295582,900,,0.958953222790452,0.5215057020602689,0.04131835693784039,none,0.532695760355955,1.1762928975755236,8.0,0.7792782059523884,,,,0.7948979193551333,,0.5567616463138851,0.5572139303482587,0.715281812899477,0.7156549520766773,0.958953222790452,0.5215057020602689,0.05,0.6335374159218649,0.6457691422291411,0.5567616463138851,0.5572139303482587,1.0,1.0,none,0.6157947744491785,0.6364486190520409,0.532695760355955,0.5,COMPLETE
1846,0.7156549520766773,2025-11-27 10:56:42.314928,2025-11-27 10:56:42.833965,0 days 00:00:00.519037,1.4743265153904235,gbtree,0.22218845304753565,3.63892774321953,depthwise,6.621933700474974,0.01451441413016214,3,7,2.719029243612858,400,,0.7404344086746263,0.4959448750260333,0.07753552964263155,none,0.9585509838334217,0.910380211479823,5.0,0.76034637885105,,,,0.9563361206873859,,0.5567616463138851,0.5572139303482587,0.715281812899477,0.7156549520766773,0.7404344086746263,0.4959448750260333,0.08,0.5593765812848268,0.5367070552988812,0.5567616463138851,0.5572139303482587,1.0,1.0,none,0.5093577479732755,0.4751730330445856,0.9585509838334217,0.5,COMPLETE
1847,0.7156549520766773,2025-11-27 10:56:43.026065,2025-11-27 10:56:43.430161,0 days 00:00:00.404096,0.4669714001123804,gbtree,0.5451471148771937,7.550940452057819,lossguide,0.01235887464783055,0.0005386267708092637,2,12,0.3226775744931225,200,,0.8313936147103764,0.20496469715280394,0.03024130864849103,oversample,0.9854633796134907,,5.0,0.6390600787986086,,,,0.20477291265517686,,0.5567616463138851,0.5572139303482587,0.715281812899477,0.7156549520766773,0.8313936147103764,0.20496469715280394,0.02,0.6026272144454017,0.6114632090234859,0.5567616463138851,0.5572139303482587,1.0,1.0,oversample,0.5218620998358725,0.5211859769444039,0.9854633796134907,0.5,COMPLETE
1848,0.7156549520766773,2025-11-27 10:56:43.623146,2025-11-27 10:58:12.416468,0 days 00:01:28.793322,0.24484686751106496,dart,0.9952437811717945,8.594879351582493,lossguide,0.0002715982426545934,0.000803874225079337,1,10,1.4834360355415648,900,tree,0.5672246963166674,0.6051659718205267,0.047265508002614975,none,0.6234229602535937,3.681912183102108,5.0,0.9454292719958631,0.49515308667384456,weighted,0.053373540327999285,0.29202245058067255,,0.5567616463138851,0.5572139303482587,0.715281812899477,0.7156549520766773,0.5672246963166674,0.6051659718205267,0.05,0.43687256191071333,0.4378071699089165,0.5567616463138851,0.5572139303482587,1.0,1.0,none,0.30235373597042386,0.31265587068702494,0.6234229602535937,0.5,COMPLETE
1849,0.5817344589409056,2025-11-27 10:58:12.617965,2025-11-27 10:59:46.791592,0 days 00:01:34.173627,0.0004100909115169177,dart,0.6873551300826023,5.94079939445616,lossguide,18.703306890221818,0.0031333495271701137,5,4,18.150211303311114,1000,tree,0.9073121678560296,0.5551978156513655,0.01630740136830937,undersample,0.977029859418359,,12.0,0.8388406987236944,0.3021624529122826,uniform,0.007067456413076667,0.6340100490640209,,0.4866576209859792,0.5070104025327906,0.564299424184261,0.5817344589409056,0.9073121678560296,0.5551978156513655,0.02,0.5465309435772718,0.5537182123744608,0.5349344978165939,0.5516739446870451,0.5970755483346872,0.6152597402597403,undersample,0.47403761667136385,0.48229168048499,0.977029859418359,0.5,COMPLETE
1850,0.7156549520766773,2025-11-27 10:59:46.987046,2025-11-27 10:59:58.348424,0 days 00:00:11.361378,0.005168247419608223,dart,0.48719242295846926,9.58509719514732,depthwise,11.184068317482131,0.012387746935793087,10,10,0.997165424350406,300,forest,0.5459293403291339,0.4708439941040216,0.05382999249678899,undersample,0.9532224821116855,,10.0,0.874426119070065,0.4438124861463608,weighted,0.7873604952456763,0.36214652332586517,,0.5567616463138851,0.5572139303482587,0.715281812899477,0.7156549520766773,0.5459293403291339,0.4708439941040216,0.05,0.5690018191853428,0.5770145417003005,0.5567616463138851,0.5572139303482587,1.0,1.0,undersample,0.5240616555314246,0.5382770319568072,0.9532224821116855,0.5,COMPLETE
1851,0.7156549520766773,2025-11-27 10:59:58.545201,2025-11-27 10:59:59.153406,0 days 00:00:00.608205,0.0005936841237385243,gbtree,0.5081101500753734,2.014168609502891,depthwise,11.627530870019786,0.00013998205396882738,5,8,1.9615765192461891,300,,0.6803977114305313,0.3952378473715966,0.02321411117260931,none,0.7980970214666264,3.0936316459233084,5.0,0.6001993660958697,,,,0.5797099381693211,,0.5567616463138851,0.5572139303482587,0.715281812899477,0.7156549520766773,0.6803977114305313,0.3952378473715966,0.02,0.5567616463138851,0.5572139303482587,0.5567616463138851,0.5572139303482587,1.0,1.0,none,0.5,0.5,0.7980970214666264,0.5,COMPLETE
1852,0.5140631761142362,2025-11-27 10:59:59.353380,2025-11-27 11:01:22.357135,0 days 00:01:23.003755,0.00010190991891539513,dart,0.525376245541965,3.5056705308389646,lossguide,0.0008798014887742644,0.08837342118806303,1,6,5.77429069297409,800,tree,0.5954475155569536,0.7274911269345663,0.05092144995565676,undersample,0.5638996758414339,,9.0,0.7352321509979451,0.057451112089719036,weighted,0.21011697771177915,0.5064914201325306,,0.5282677521483492,0.4920850293984622,0.5423431329530496,0.5140631761142362,0.5954475155569536,0.7274911269345663,0.05,0.5640957745375984,0.5481906428129761,0.5896946564885496,0.5505097312326228,0.5020308692120228,0.48214285714285715,undersample,0.525335300651536,0.4919146226602815,0.5638996758414339,0.5,COMPLETE
1853,0.7156549520766773,2025-11-27 11:01:22.561948,2025-11-27 11:01:23.284517,0 days 00:00:00.722569,94.25082188414356,gbtree,0.9411827559453427,6.075489452973411,lossguide,0.01610890542935416,0.00017283793104807543,0,9,0.19651594772836173,700,,0.5112014068992984,0.6798759343710105,0.004222165222392127,none,0.8675711601200158,0.9439406558849079,10.0,0.7570307004601752,,,,0.8565272160307185,,0.5567616463138851,0.5572139303482587,0.715281812899477,0.7156549520766773,0.5112014068992984,0.6798759343710105,0.0,0.5567616463138851,0.5572139303482587,0.5567616463138851,0.5572139303482587,1.0,1.0,none,0.5,0.5,0.8675711601200158,0.5,COMPLETE
