number,value,datetime_start,datetime_complete,duration,params_alpha,params_booster,params_colsample_bytree,params_gamma,params_grow_policy,params_lambda,params_learning_rate,params_max_delta_step,params_max_depth,params_min_child_weight,params_n_estimators,params_normalize_type,params_params_feature_fraction,params_params_labeled_ratio,params_params_missing_rate,params_params_resampling,params_params_sample_rows,params_params_scale_pos_weight,params_params_selftrain_max_iter,params_params_selftrain_threshold,params_rate_drop,params_sample_type,params_skip_drop,params_subsample,params_user_attrs_decision_threshold,user_attrs_acc_test,user_attrs_acc_val,user_attrs_f1_test,user_attrs_f1_val,user_attrs_feature_fraction,user_attrs_labeled_ratio,user_attrs_missing_rate,user_attrs_pr_auc_test,user_attrs_pr_auc_val,user_attrs_prec_test,user_attrs_prec_val,user_attrs_rec_test,user_attrs_rec_val,user_attrs_resampling_strategy,user_attrs_roc_auc_test,user_attrs_roc_auc_val,user_attrs_sample_rows,user_attrs_user_attrs_decision_threshold,state
2302,0.4342647732478241,2025-11-30 13:25:25.338752,2025-11-30 13:25:47.161631,0 days 00:00:21.822879,0.06192433412315136,dart,0.2565766796906086,1.479745766615994,depthwise,0.5139106967494131,0.0005324924296343206,2,6,3.4978808829419914,400,forest,0.8960759142791261,0.7478812434396718,0.03654101824741816,undersample,0.5444023282534437,,6.0,0.6068121236466053,0.2503918572530869,uniform,0.8368388070062601,0.6994495144249719,,0.4635911352329263,0.4414292175486205,0.4483720930232558,0.4342647732478241,0.8960759142791261,0.7478812434396718,0.08,0.5001980409079363,0.4941019562110986,0.5244831338411317,0.49842271293375395,0.3915515840779854,0.3847402597402597,undersample,0.46558132595036383,0.44420326864147086,0.5444023282534437,0.5,COMPLETE
2303,0.0,2025-11-30 13:25:47.947370,2025-11-30 13:25:48.320012,0 days 00:00:00.372642,0.015353619441443455,gbtree,0.7315994544270477,2.068744951796735,depthwise,0.0008247342677592588,0.02064038410073346,0,6,94.41891799678993,200,,0.7029229794355568,0.31733825582031483,0.010006356442883158,undersample,0.5917234995219083,,8.0,0.8034786430914863,,,,0.6407301033501845,,0.44323835368611486,0.4427860696517413,0.0,0.0,0.7029229794355568,0.31733825582031483,0.08,0.5567616463138851,0.5572139303482587,0.0,0.0,0.0,0.0,undersample,0.5,0.5,0.5917234995219083,0.5,COMPLETE
2304,0.7156549520766773,2025-11-30 13:25:49.100153,2025-11-30 13:25:54.124025,0 days 00:00:05.023872,8.756475676201896,dart,0.8208245197570461,4.58911006771472,lossguide,0.06508146719835457,0.4137719655371358,3,6,0.10160820709118037,200,forest,0.5049113310796673,0.8111917927157888,0.07417424111095788,oversample,0.7491649988774028,,6.0,0.6372741387018058,0.40407776484543895,weighted,0.3626525509131043,0.4321815254484583,,0.5567616463138851,0.5572139303482587,0.715281812899477,0.7156549520766773,0.5049113310796673,0.8111917927157888,0.08,0.43592966738575084,0.4247823044097044,0.5567616463138851,0.5572139303482587,1.0,1.0,oversample,0.2952987450057196,0.26691279864160355,0.7491649988774028,0.5,COMPLETE
2305,0.6353240152477764,2025-11-30 13:25:54.920976,2025-11-30 13:25:55.821947,0 days 00:00:00.900971,0.2260680275141566,gbtree,0.8128706020009613,5.724806300854771,lossguide,1.5784896700930546,0.0004235034952650436,2,11,0.21754688143435225,900,,0.7524661319462456,0.5528676609570162,0.09972844230304166,undersample,0.535141353844332,,7.0,0.6430003046953267,,,,0.22215189318485634,,0.6218905472636815,0.6105834464043419,0.6448598130841121,0.6353240152477764,0.7524661319462456,0.5528676609570162,0.1,0.6813559517973937,0.6643774786768912,0.6758682101513802,0.6643046944198405,0.6165718927701056,0.6087662337662337,undersample,0.5657856562608796,0.539631365825186,0.535141353844332,0.5,COMPLETE
2306,0.7156549520766773,2025-11-30 13:25:56.604020,2025-11-30 13:26:02.264331,0 days 00:00:05.660311,0.16028336743263039,gbtree,0.36733532433884686,0.9653872253725138,lossguide,0.29193918489354753,0.001405196706435378,8,11,23.433335367724702,800,,0.5246103275884415,0.8485900859404567,0.09675886809570229,none,0.7203016164214576,2.6152173211202214,6.0,0.7634636021435963,,,,0.5449537600963161,,0.5567616463138851,0.5572139303482587,0.715281812899477,0.7156549520766773,0.5246103275884415,0.8485900859404567,0.1,0.528146720973714,0.5300275742465582,0.5567616463138851,0.5572139303482587,1.0,1.0,none,0.46839304365125417,0.4667377757584601,0.7203016164214576,0.5,COMPLETE
2307,0.7156549520766773,2025-11-30 13:26:03.053667,2025-11-30 13:26:22.308602,0 days 00:00:19.254935,1.069129904503087,dart,0.40819389512514026,5.993240584447507,depthwise,0.114493736883781,0.0001735683802585593,3,12,0.18538357480952364,400,tree,0.5221102424130205,0.21812851077754786,0.045988827854605924,oversample,0.5763215498067223,,6.0,0.9273006994037334,0.40988848145412304,uniform,0.7164567556557213,0.23475674268287838,,0.5567616463138851,0.5572139303482587,0.715281812899477,0.7156549520766773,0.5221102424130205,0.21812851077754786,0.08,0.47453586304626455,0.47747712497676736,0.5567616463138851,0.5572139303482587,1.0,1.0,oversample,0.3624873588753129,0.3657621744955759,0.5763215498067223,0.5,COMPLETE
2308,0.0,2025-11-30 13:26:23.079401,2025-11-30 13:28:10.771757,0 days 00:01:47.692356,34.868109536161924,dart,0.24951466919217558,2.804178828106406,lossguide,0.040985963951596004,0.280782574604749,1,6,39.430152773671644,900,forest,0.5846708246971997,0.4867432706131234,0.09129859757817431,undersample,0.6987338126077318,,9.0,0.8077874708010927,0.01585603349959691,weighted,0.6458930339256748,0.2986294231565334,,0.44323835368611486,0.4427860696517413,0.0,0.0,0.5846708246971997,0.4867432706131234,0.1,0.5567616463138851,0.5572139303482587,0.0,0.0,0.0,0.0,undersample,0.5,0.5,0.6987338126077318,0.5,COMPLETE
2309,0.7156549520766773,2025-11-30 13:28:11.559475,2025-11-30 13:28:12.089018,0 days 00:00:00.529543,0.16304014901359679,gbtree,0.550234799752682,8.876505123498669,lossguide,1.8177369879431975,0.0004398936362890796,8,12,2.687291594418525,400,,0.6001508933350881,0.25663274621343213,0.08365455473234769,oversample,0.9687301127119619,,10.0,0.8298836759971547,,,,0.7502624424606159,,0.5567616463138851,0.5572139303482587,0.715281812899477,0.7156549520766773,0.6001508933350881,0.25663274621343213,0.08,0.4283991314979354,0.4325997936738192,0.5567616463138851,0.5572139303482587,1.0,1.0,oversample,0.22217253270113896,0.22728972381040816,0.9687301127119619,0.5,COMPLETE
2310,0.7156549520766773,2025-11-30 13:28:12.861184,2025-11-30 13:28:13.456808,0 days 00:00:00.595624,1.2267289329617133,gbtree,0.4796409938945056,5.810980377093661,lossguide,0.02082783262383046,0.01796194447311257,0,9,19.781362713655085,500,,0.9403647410812468,0.24772619087061115,0.09256329124393535,oversample,0.6493984071227249,,10.0,0.6805997718169783,,,,0.3920812045307449,,0.5567616463138851,0.5572139303482587,0.715281812899477,0.7156549520766773,0.9403647410812468,0.24772619087061115,0.1,0.5354720086947533,0.5452448157865496,0.5567616463138851,0.5572139303482587,1.0,1.0,oversample,0.48261120045093586,0.4834884854675458,0.6493984071227249,0.5,COMPLETE
2311,0.7156549520766773,2025-11-30 13:28:14.244957,2025-11-30 13:28:25.936048,0 days 00:00:11.691091,0.007418965265949211,dart,0.36260443239216555,1.3381327754973282,depthwise,0.15287184072991628,0.009226276420218976,4,9,80.96489011642443,300,forest,0.5456181795991281,0.2300271280988113,0.09267471088454478,oversample,0.846495156850199,,6.0,0.7861140174049546,0.3931625215784659,weighted,0.8167664427399727,0.6901510103325413,,0.5567616463138851,0.5572139303482587,0.715281812899477,0.7156549520766773,0.5456181795991281,0.2300271280988113,0.1,0.6082809225561172,0.6076964309246465,0.5567616463138851,0.5572139303482587,1.0,1.0,oversample,0.5639354929624165,0.5631968580449174,0.846495156850199,0.5,COMPLETE
2312,0.7156549520766773,2025-11-30 13:28:26.696635,2025-11-30 13:28:52.381664,0 days 00:00:25.685029,96.38686661553707,dart,0.2728509897843305,8.752227692976195,depthwise,0.04222001605424553,0.0006985262801302359,5,12,39.42994901132277,500,tree,0.503146226361843,0.39674504494579377,0.04631934607494969,oversample,0.5806559331375124,,9.0,0.801106749227671,0.41840189568163927,weighted,0.37773636824347595,0.42624023992601967,,0.5567616463138851,0.5572139303482587,0.715281812899477,0.7156549520766773,0.503146226361843,0.39674504494579377,0.08,0.5567616463138851,0.5572139303482587,0.5567616463138851,0.5572139303482587,1.0,1.0,oversample,0.5,0.5,0.5806559331375124,0.5,COMPLETE
2313,0.7156549520766773,2025-11-30 13:28:53.187713,2025-11-30 13:30:13.924621,0 days 00:01:20.736908,0.13788015464670716,dart,0.4176617859995818,5.838266818344574,depthwise,0.0076506176760978385,0.02329271479173138,0,8,28.200490529710915,800,tree,0.9960585674763272,0.32559428171318955,0.07949861451032599,oversample,0.5354719338562157,,10.0,0.878394362306536,0.4435362117685317,uniform,0.8678959337370388,0.30431335636235196,,0.5567616463138851,0.5572139303482587,0.715281812899477,0.7156549520766773,0.9960585674763272,0.32559428171318955,0.08,0.47930530592190856,0.48206183485089843,0.5567616463138851,0.5572139303482587,1.0,1.0,oversample,0.39027089308509755,0.38988150511388514,0.5354719338562157,0.5,COMPLETE
2314,0.7156549520766773,2025-11-30 13:30:14.697562,2025-11-30 13:31:37.193030,0 days 00:01:22.495468,0.059374585888709405,dart,0.20326983577851837,7.062335771512119,lossguide,41.85583378603921,0.2935331871234215,4,6,42.21788070979346,900,tree,0.5339958417589693,0.6025869250498157,0.04476192759008251,none,0.9750396751027375,2.776805784848881,6.0,0.662305235430389,0.4339591370864965,weighted,0.4365610265741356,0.7706049855337957,,0.5567616463138851,0.5572139303482587,0.715281812899477,0.7156549520766773,0.5339958417589693,0.6025869250498157,0.08,0.5419435577176921,0.5373821021177081,0.5567616463138851,0.5572139303482587,1.0,1.0,none,0.4962051758152489,0.47678936232307023,0.9750396751027375,0.5,COMPLETE
2315,0.6853146853146853,2025-11-30 13:31:37.977833,2025-11-30 13:31:48.573491,0 days 00:00:10.595658,0.008838142206416997,gbtree,0.31472633618299223,0.26030224674931657,lossguide,1.1487070313066887,0.006968882883830942,5,9,15.053216825182298,600,,0.522820579463745,0.7513289717873661,0.07531776942595261,oversample,0.6076243356205088,,11.0,0.6391177707370254,,,,0.9034912775701371,,0.5332428765264586,0.5318860244233379,0.686322188449848,0.6853146853146853,0.522820579463745,0.7513289717873661,0.08,0.4637695927109976,0.45744652274571523,0.5483244293346284,0.5478852698104035,0.917140536149472,0.9147727272727273,oversample,0.3779625822709262,0.36350122043431543,0.6076243356205088,0.5,COMPLETE
2316,0.7156549520766773,2025-11-30 13:31:49.340688,2025-11-30 13:31:50.151826,0 days 00:00:00.811138,0.0008116013326514604,gbtree,0.25042065970247507,2.2615787010324118,depthwise,1.3937189183941612,0.002861327259654762,7,7,0.42963026437155166,500,,0.6122619332465509,0.5233775630250976,0.03776682871885745,none,0.7022145426760082,1.9495558274449647,6.0,0.8012229279477255,,,,0.4255892731552191,,0.5567616463138851,0.5572139303482587,0.715281812899477,0.7156549520766773,0.6122619332465509,0.5233775630250976,0.08,0.5867057022388071,0.5697055540542348,0.5567616463138851,0.5572139303482587,1.0,1.0,none,0.5561319816309953,0.5434402484645079,0.7022145426760082,0.5,COMPLETE
2317,0.0,2025-11-30 13:31:50.943943,2025-11-30 13:32:21.922566,0 days 00:00:30.978623,23.418953368367124,dart,0.5838722354178145,8.210460704571974,depthwise,0.0007188129623903125,0.0007172199381711986,9,10,2.5832779247118625,500,forest,0.6203934204910668,0.5639275104731201,0.08325961533454587,undersample,0.8866903676381408,,8.0,0.8576112639140434,0.09332004813676115,weighted,0.11691417058471919,0.5577967080223118,,0.44323835368611486,0.4427860696517413,0.0,0.0,0.6203934204910668,0.5639275104731201,0.08,0.5567616463138851,0.5572139303482587,0.0,0.0,0.0,0.0,undersample,0.5,0.5,0.8866903676381408,0.5,COMPLETE
2318,0.20182440136830102,2025-11-30 13:32:22.698737,2025-11-30 13:33:37.700477,0 days 00:01:15.001740,0.00010281856134005474,dart,0.47529658957833193,7.821373294385106,depthwise,21.01208676744827,0.01679393263632909,9,8,3.472182162759376,900,tree,0.8950541763822981,0.8873814676548315,0.0660768968684528,undersample,0.5415083451467112,,11.0,0.6376222203654134,0.36839631947025153,uniform,0.1610198033353022,0.9789015970271562,,0.3749434644957033,0.36680235187697874,0.21387940841865757,0.20182440136830102,0.8950541763822981,0.8873814676548315,0.08,0.52621349371862,0.5258749495914962,0.3567362428842505,0.3390804597701149,0.15272136474411047,0.14366883116883117,undersample,0.4034014986985859,0.3956342112943237,0.5415083451467112,0.5,COMPLETE
2319,0.0,2025-11-30 13:33:38.479671,2025-11-30 13:33:39.118725,0 days 00:00:00.639054,0.021429868956753185,gbtree,0.3452178442357371,7.574921665765722,lossguide,0.0006220654203640891,0.1982941761701812,8,7,1.0499663037470943,600,,0.7144532415747884,0.49772593150512057,0.01271552948557987,none,0.9717454529557055,0.5475541522497037,8.0,0.8324673529670497,,,,0.6314870691420351,,0.44323835368611486,0.4427860696517413,0.0,0.0,0.7144532415747884,0.49772593150512057,0.08,0.48931201493877624,0.4859517766127459,0.0,0.0,0.0,0.0,none,0.35669357913758515,0.35284978045447907,0.9717454529557055,0.5,COMPLETE
2320,0.7156549520766773,2025-11-30 13:33:39.892860,2025-11-30 13:33:41.611194,0 days 00:00:01.718334,0.0005480584593840222,gbtree,0.8883366666340717,2.4904205880259833,depthwise,0.805409711140743,0.0024835244876371143,5,5,0.11287324619685127,700,,0.7145068554227731,0.6691173927321465,0.0729926200311533,none,0.9472818285130664,3.9272093875109175,10.0,0.7486067702029506,,,,0.7290843073593736,,0.5567616463138851,0.5572139303482587,0.715281812899477,0.7156549520766773,0.7145068554227731,0.6691173927321465,0.08,0.6083471626385367,0.562226925084153,0.5567616463138851,0.5572139303482587,1.0,1.0,none,0.515196704189393,0.4765468507488426,0.9472818285130664,0.5,COMPLETE
2321,0.28382502543234994,2025-11-30 13:33:42.425836,2025-11-30 13:33:43.035875,0 days 00:00:00.610039,0.00025466575069900594,gbtree,0.454497834466421,7.137544731778373,depthwise,66.00237321010835,0.17848837000975112,6,8,10.73034205224697,600,,0.8784922470343173,0.41248233007972906,0.027066720374550268,undersample,0.5588805652356985,,7.0,0.8567146477446881,,,,0.35009085073435203,,0.35956580732700133,0.36318407960199006,0.2834008097165992,0.28382502543234994,0.8784922470343173,0.41248233007972906,0.08,0.5156094435201981,0.5171065619652895,0.37583892617449666,0.3801089918256131,0.22745735174654752,0.22646103896103897,undersample,0.37648377791409005,0.38085053990952866,0.5588805652356985,0.5,COMPLETE
2322,0.6181556195965417,2025-11-30 13:33:43.809898,2025-11-30 13:33:47.559376,0 days 00:00:03.749478,0.0009428708021695197,gbtree,0.7525624763624252,1.3943224378839747,lossguide,0.0001565512379255534,0.0227249736448229,4,8,0.18896962924110725,200,,0.8062281156460416,0.37204103832127977,0.09823291732815805,none,0.5714768616619066,1.0310783038146785,7.0,0.799234507835969,,,,0.37806201669906514,,0.5061058344640434,0.5205789235639982,0.6094420600858369,0.6181556195965417,0.8062281156460416,0.37204103832127977,0.1,0.5276011962044553,0.5235147467538654,0.544408945686901,0.555699481865285,0.6921202274573518,0.6964285714285714,none,0.4628632769110894,0.47227491609514083,0.5714768616619066,0.5,COMPLETE
2323,0.6624626617988716,2025-11-30 13:33:48.335600,2025-11-30 13:34:20.672539,0 days 00:00:32.336939,0.014090449817826796,dart,0.7320990869154935,9.499454677980209,depthwise,0.533795293769797,0.009050049155231837,9,5,1.4752596799944675,500,tree,0.9709220506627645,0.8193323583921444,0.042512346502480716,undersample,0.5066311201267886,,10.0,0.9057660216092749,0.34211433554898557,weighted,0.8524633540576331,0.3714693547564659,,0.5137946630483944,0.5400271370420624,0.6403479424556708,0.6624626617988716,0.9709220506627645,0.8193323583921444,0.08,0.5166963375601866,0.5087485780323204,0.5443686006825939,0.5603593486805165,0.7774167343623071,0.810064935064935,undersample,0.43568485883386665,0.43988366077232266,0.5066311201267886,0.5,COMPLETE
2324,0.39644444444444443,2025-11-30 13:34:21.470444,2025-11-30 13:34:32.805286,0 days 00:00:11.334842,0.059215256964686186,dart,0.2650108293107078,1.9218128376428567,depthwise,1.6014209722694897,0.0004352986662120106,6,5,98.61555796279897,300,tree,0.840230617428667,0.8727188561516348,0.06206329061880054,undersample,0.9043981923907167,,5.0,0.6801363528407118,0.10473240126438199,uniform,0.005720525505761409,0.22663622794198057,,0.39348710990502034,0.3857982813206694,0.41312910284463894,0.39644444444444443,0.840230617428667,0.8727188561516348,0.08,0.4591860791674763,0.4551985172920673,0.4478178368121442,0.4381139489194499,0.3834281072298944,0.362012987012987,undersample,0.3602094696530115,0.34499281999920406,0.9043981923907167,0.5,COMPLETE
2325,0.7156549520766773,2025-11-30 13:34:33.586160,2025-11-30 13:34:34.488842,0 days 00:00:00.902682,0.28367919846824224,gbtree,0.257337260219676,8.126551577674924,depthwise,0.00038401426302500115,0.0010715530845152026,5,5,53.49946860573762,1000,,0.9624827464155049,0.8936582939188473,0.09391026716959802,none,0.807256380630188,2.235430574538592,12.0,0.6115816165182957,,,,0.3262012849787985,,0.5567616463138851,0.5572139303482587,0.715281812899477,0.7156549520766773,0.9624827464155049,0.8936582939188473,0.1,0.5778653308526355,0.5702120144353624,0.5567616463138851,0.5572139303482587,1.0,1.0,none,0.5515571378835856,0.5295864120557685,0.807256380630188,0.5,COMPLETE
2326,0.7156549520766773,2025-11-30 13:34:35.265580,2025-11-30 13:34:36.360894,0 days 00:00:01.095314,0.07993312039730091,gbtree,0.3954871031967615,5.033384629781011,depthwise,10.565252288488905,0.22402551113015823,0,9,2.362608951085244,900,,0.9082769614707945,0.44743594617310145,0.08426515038424413,none,0.7915168948801178,1.5466806799269377,12.0,0.6128089328751243,,,,0.6210943211042577,,0.5567616463138851,0.5572139303482587,0.715281812899477,0.7156549520766773,0.9082769614707945,0.44743594617310145,0.08,0.5169605304481468,0.5155190218869725,0.5567616463138851,0.5572139303482587,1.0,1.0,none,0.39127306487176516,0.3768853720334824,0.7915168948801178,0.5,COMPLETE
2327,0.2774914089347079,2025-11-30 13:34:37.163090,2025-11-30 13:34:37.600340,0 days 00:00:00.437250,0.6022325776403332,gbtree,0.8883544641531709,5.156704514975921,depthwise,22.630883094975623,0.005782901398068182,5,6,0.979265430547735,300,,0.8930887781725128,0.5583692325027528,0.05929351375771147,undersample,0.5439185249138971,,6.0,0.8908256951206598,,,,0.4956233200816404,,0.2532790592492085,0.2392582541836273,0.3019027484143763,0.2774914089347079,0.8930887781725128,0.5583692325027528,0.08,0.4207286315524097,0.4101576882292712,0.3148148148148148,0.2947080291970803,0.29000812347684807,0.2621753246753247,undersample,0.22914090087700392,0.20489450539246248,0.5439185249138971,0.5,COMPLETE
2328,0.7156549520766773,2025-11-30 13:34:38.458180,2025-11-30 13:34:38.841258,0 days 00:00:00.383078,0.014713219346907187,gbtree,0.3170120650172725,4.197470517935571,depthwise,31.1995616371674,0.43144157896679713,4,6,6.918347274764612,200,,0.565560187067542,0.8547271319422309,0.09874558514466669,oversample,0.615804590382981,,8.0,0.9186334867539323,,,,0.7977166084664589,,0.5567616463138851,0.5572139303482587,0.715281812899477,0.7156549520766773,0.565560187067542,0.8547271319422309,0.1,0.5841983978752436,0.5854277679302587,0.5567616463138851,0.5572139303482587,1.0,1.0,oversample,0.5159671911006483,0.5105842829285117,0.615804590382981,0.5,COMPLETE
2329,0.7156549520766773,2025-11-30 13:34:39.664011,2025-11-30 13:34:40.528458,0 days 00:00:00.864447,0.0043565466045725676,gbtree,0.6138504064163621,6.593617967637132,depthwise,0.06215473524675342,0.0028494694906011806,0,10,2.699366123869437,900,,0.8170782035127178,0.4575902577199169,0.030597089609181893,oversample,0.969347708135647,,11.0,0.9210550143932389,,,,0.4379883544546254,,0.5567616463138851,0.5572139303482587,0.715281812899477,0.7156549520766773,0.8170782035127178,0.4575902577199169,0.08,0.46585194905624305,0.45271827222239386,0.5567616463138851,0.5572139303482587,1.0,1.0,oversample,0.3853321507319418,0.35795537455394455,0.969347708135647,0.5,COMPLETE
2330,0.23455119530897608,2025-11-30 13:34:41.318763,2025-11-30 13:35:39.319933,0 days 00:00:58.001170,0.49224229335352965,dart,0.4926616826152526,2.9596034754661504,depthwise,36.40812719349021,0.005163563748710906,6,3,53.823461468540906,700,tree,0.9578304244975036,0.2878749551929388,0.011368474100259596,undersample,0.6611371797841006,,10.0,0.7707612529679145,0.31854268456330265,weighted,0.5790540468224863,0.6664349132228626,,0.2433288104929896,0.23247399366802352,0.2607158638974812,0.23455119530897608,0.9578304244975036,0.2878749551929388,0.08,0.3921724054353734,0.39203955954299696,0.2858527131782946,0.2639593908629442,0.239642567018684,0.21103896103896103,undersample,0.1706257563951657,0.1692639587174827,0.6611371797841006,0.5,COMPLETE
2331,0.14996849401386264,2025-11-30 13:35:40.143331,2025-11-30 13:37:01.755703,0 days 00:01:21.612372,0.028123467438136335,dart,0.7687488406163563,2.7258379648439135,lossguide,0.012582532402797763,0.028130916579471466,8,11,1.078277185785402,800,forest,0.6566436145307963,0.8737325028385394,0.07877690285240652,none,0.7323528353993543,0.7417959110466775,12.0,0.6266736218031027,0.48113878741452243,weighted,0.8548752955990468,0.861445978803872,,0.3952962460425147,0.38986883763003166,0.15540113708149084,0.14996849401386264,0.6566436145307963,0.8737325028385394,0.08,0.45307345876050853,0.44401335447917045,0.3494318181818182,0.3352112676056338,0.09991876523151909,0.09659090909090909,none,0.3438937150814835,0.32457749094623456,0.7323528353993543,0.5,COMPLETE
