number,value,datetime_start,datetime_complete,duration,params_alpha,params_booster,params_colsample_bytree,params_gamma,params_grow_policy,params_lambda,params_learning_rate,params_max_delta_step,params_max_depth,params_min_child_weight,params_n_estimators,params_normalize_type,params_params_feature_fraction,params_params_labeled_ratio,params_params_missing_rate,params_params_resampling,params_params_sample_rows,params_params_scale_pos_weight,params_params_selftrain_max_iter,params_params_selftrain_threshold,params_rate_drop,params_sample_type,params_skip_drop,params_subsample,params_user_attrs_decision_threshold,user_attrs_acc_test,user_attrs_acc_val,user_attrs_f1_test,user_attrs_f1_val,user_attrs_feature_fraction,user_attrs_labeled_ratio,user_attrs_missing_rate,user_attrs_pr_auc_test,user_attrs_pr_auc_val,user_attrs_prec_test,user_attrs_prec_val,user_attrs_rec_test,user_attrs_rec_val,user_attrs_resampling_strategy,user_attrs_roc_auc_test,user_attrs_roc_auc_val,user_attrs_sample_rows,user_attrs_user_attrs_decision_threshold,state
2332,0.49018669219722355,2025-11-30 13:37:02.500456,2025-11-30 13:37:03.388854,0 days 00:00:00.888398,0.00044696691251035615,gbtree,0.8242652046376115,5.107033625017568,lossguide,0.008684854940853748,0.0003130421586899519,1,11,27.2416368817069,900,,0.6943545679918716,0.7319466991922035,0.004867645966913714,undersample,0.698392000180863,,5.0,0.9488145301276205,,,,0.6737821907596588,,0.5300768882858435,0.5183175033921302,0.501200192030725,0.49018669219722355,0.6943545679918716,0.7319466991922035,0.08,0.6034104612736462,0.6189174627310998,0.6126760563380281,0.5974329054842473,0.4240454914703493,0.4155844155844156,undersample,0.5649799399857425,0.5582633020707586,0.698392000180863,0.5,COMPLETE
2333,0.7156549520766773,2025-11-30 13:37:04.163728,2025-11-30 13:37:04.914324,0 days 00:00:00.750596,3.4997806024696296,gbtree,0.9063027326888609,7.673881686428226,depthwise,7.36754751187822,0.0005578630836413714,6,5,26.84073535957737,800,,0.8997819650112182,0.299084280524173,0.0709869774356372,oversample,0.6729323781670988,,9.0,0.8669249782349147,,,,0.27668963671101854,,0.5567616463138851,0.5572139303482587,0.715281812899477,0.7156549520766773,0.8997819650112182,0.299084280524173,0.08,0.6607110401608887,0.6535489156152923,0.5567616463138851,0.5572139303482587,1.0,1.0,oversample,0.6308841326945076,0.603222046084661,0.6729323781670988,0.5,COMPLETE
2334,0.7156549520766773,2025-11-30 13:37:05.691680,2025-11-30 13:37:06.155318,0 days 00:00:00.463638,1.6782582095139873,gbtree,0.788767215842556,7.439484279843109,depthwise,13.815660310097728,0.00016332732379134644,9,4,26.064504600450874,300,,0.9833765389288506,0.2098284424862566,0.0627864204667689,none,0.9511585513305552,3.1986704868289335,5.0,0.7677764504447655,,,,0.33422880244694,,0.5567616463138851,0.5572139303482587,0.715281812899477,0.7156549520766773,0.9833765389288506,0.2098284424862566,0.08,0.5567616463138851,0.5572139303482587,0.5567616463138851,0.5572139303482587,1.0,1.0,none,0.5,0.5,0.9511585513305552,0.5,COMPLETE
2335,0.7156549520766773,2025-11-30 13:37:06.939336,2025-11-30 13:37:30.307389,0 days 00:00:23.368053,1.3706958205093962,dart,0.47220371295815844,7.723731077370296,lossguide,0.025356271490724887,0.45082517954341933,10,3,59.898063399002545,500,forest,0.8960154194725738,0.20521470434110617,0.09123162612058817,none,0.7433585773047799,1.4267462057820144,5.0,0.8049479291115439,0.3738936449327315,uniform,0.20518864976728388,0.7678147011674341,,0.5567616463138851,0.5572139303482587,0.715281812899477,0.7156549520766773,0.8960154194725738,0.20521470434110617,0.1,0.5567616463138851,0.5572139303482587,0.5567616463138851,0.5572139303482587,1.0,1.0,none,0.5,0.5,0.7433585773047799,0.5,COMPLETE
2336,0.7156549520766773,2025-11-30 13:37:31.065636,2025-11-30 13:37:31.580089,0 days 00:00:00.514453,0.0018256687945837884,gbtree,0.8128033007647624,9.728883211260253,lossguide,0.00036846991242810655,0.0018362015205402112,2,4,7.984315073307436,400,,0.6941435485013993,0.5558184397788258,0.07605517645166887,none,0.8590137983864726,1.1273168004745775,7.0,0.6459108042932544,,,,0.4215546678276339,,0.5567616463138851,0.5572139303482587,0.715281812899477,0.7156549520766773,0.6941435485013993,0.5558184397788258,0.08,0.5483145732410519,0.5341894715116535,0.5567616463138851,0.5572139303482587,1.0,1.0,none,0.5055471741905535,0.48582447302442183,0.8590137983864726,0.5,COMPLETE
2337,0.34460887949260044,2025-11-30 13:37:32.324478,2025-11-30 13:37:32.836215,0 days 00:00:00.511737,0.03018878681176478,gbtree,0.8056144133599641,1.905144905439351,lossguide,82.04620326966727,0.0008407438237023601,7,11,0.3121556993710036,400,,0.5724281876643837,0.28311510392012623,0.0701678310582158,undersample,0.6598256334693573,,9.0,0.9248539694062734,,,,0.5167738634099686,,0.45409317051108095,0.4391677973767526,0.36640419947506564,0.34460887949260044,0.5724281876643837,0.28311510392012623,0.08,0.5160941165849298,0.49307527972696225,0.5178041543026706,0.49393939393939396,0.2835093419983753,0.26461038961038963,undersample,0.42181609443127377,0.39076615417269145,0.6598256334693573,0.5,COMPLETE
2338,0.7156549520766773,2025-11-30 13:37:33.582692,2025-11-30 13:38:57.982220,0 days 00:01:24.399528,76.0093456582622,dart,0.782958318934593,9.255149725251341,lossguide,8.94318811814958,0.016245636041826206,5,7,2.3704197263324347,800,forest,0.8574149979511367,0.8671136449665333,0.07189489921540744,undersample,0.5916353735940596,,5.0,0.6151621918867458,0.03049851781821672,uniform,0.8922809794523785,0.9513863533708413,,0.5567616463138851,0.5572139303482587,0.715281812899477,0.7156549520766773,0.8574149979511367,0.8671136449665333,0.08,0.5567616463138851,0.5572139303482587,0.5567616463138851,0.5572139303482587,1.0,1.0,undersample,0.5,0.5,0.5916353735940596,0.5,COMPLETE
2339,0.5233393177737882,2025-11-30 13:38:58.757325,2025-11-30 13:39:31.207208,0 days 00:00:32.449883,0.573515926711964,dart,0.43644417794889345,1.7701665109231846,depthwise,29.414135716794345,0.06566482974336242,9,9,60.77994008770449,500,forest,0.5554516206120806,0.5718726047359857,0.030479689065884122,undersample,0.764466260501222,,12.0,0.6695433336474159,0.10228954625504127,uniform,0.4934941007196029,0.8444855329258651,,0.5635459068294889,0.519674355495251,0.5635459068294889,0.5233393177737882,0.5554516206120806,0.5718726047359857,0.08,0.604559612360958,0.5843907377841668,0.6357142857142857,0.5853413654618473,0.5060926076360682,0.4732142857142857,undersample,0.6085963792503192,0.571141288486794,0.764466260501222,0.5,COMPLETE
2340,0.3137254901960784,2025-11-30 13:39:32.000391,2025-11-30 13:39:32.693538,0 days 00:00:00.693147,0.004024124995340761,gbtree,0.9797467582867134,0.6675554834442066,depthwise,0.000982071700038652,0.002338704362122519,7,3,29.380126641922548,400,,0.9609867069427616,0.2561436370713128,0.04916278651973374,none,0.7781938761190228,0.7310343680652209,10.0,0.6482699386460828,,,,0.6992642413130402,,0.47535052012663953,0.46178199909543194,0.35195530726256985,0.3137254901960784,0.9609867069427616,0.2561436370713128,0.08,0.5699701667074034,0.5522786249269767,0.5635062611806798,0.5418326693227091,0.255889520714866,0.22077922077922077,none,0.5223747906961322,0.49580185519281533,0.7781938761190228,0.5,COMPLETE
2341,0.27840571088637717,2025-11-30 13:39:33.488662,2025-11-30 13:40:05.212378,0 days 00:00:31.723716,0.6933525587337126,dart,0.6147924371100687,7.592362322417372,lossguide,0.000277931788754993,0.00029910845300680126,4,7,0.12147609688108402,500,forest,0.5008374970369105,0.5735967982259007,0.04719647572483107,undersample,0.554362906632504,,9.0,0.6527537752644509,0.07562728590487783,weighted,0.050438826339905,0.630025161075476,,0.4681139755766621,0.45137946630483944,0.3033175355450237,0.27840571088637717,0.5008374970369105,0.5735967982259007,0.08,0.516938745591526,0.5126913125067328,0.5601750547045952,0.5211581291759465,0.20796100731112915,0.18993506493506493,undersample,0.3924953165669193,0.3863250832415797,0.554362906632504,0.5,COMPLETE
2342,0.39664022398506765,2025-11-30 13:40:05.983371,2025-11-30 13:40:38.175930,0 days 00:00:32.192559,30.352875360336725,dart,0.7017530356461028,0.6788143433830562,lossguide,1.1519848219971545,0.005377159419593678,10,4,2.7008982589546386,500,tree,0.8735934035134224,0.7441894921255916,0.08850501127176502,undersample,0.960271621110593,,8.0,0.9083296721508565,0.2463424376274737,weighted,0.850507050639605,0.690754186802475,,0.39348710990502034,0.4151967435549525,0.37189695550351287,0.39664022398506765,0.8735934035134224,0.7441894921255916,0.08,0.45964582200091275,0.4655781022895089,0.4391592920353982,0.4665203073545554,0.32250203086921203,0.3449675324675325,undersample,0.3504770470332731,0.36673180624278684,0.960271621110593,0.5,COMPLETE
2343,0.7156549520766773,2025-11-30 13:40:38.981220,2025-11-30 13:40:43.656548,0 days 00:00:04.675328,0.000489968858141194,dart,0.5181257604765397,8.028693878272374,depthwise,0.0001002079751098703,0.10591583706858489,10,4,2.1179144875187155,200,forest,0.566918264035248,0.3461316546262526,0.06175294326584521,oversample,0.5294522352211334,,5.0,0.7480565671964026,0.21234885284598076,uniform,0.060267467354673,0.49467461149425174,,0.5567616463138851,0.5572139303482587,0.715281812899477,0.7156549520766773,0.566918264035248,0.3461316546262526,0.08,0.7274855413500596,0.7465452753641861,0.5567616463138851,0.5572139303482587,1.0,1.0,oversample,0.6664376067242493,0.6874071408673044,0.5294522352211334,0.5,COMPLETE
2344,0.5624716038164471,2025-11-30 13:40:44.451494,2025-11-30 13:40:45.092279,0 days 00:00:00.640785,0.00022930300456890958,gbtree,0.8960058903677586,4.3762089411999385,depthwise,0.5846012097872993,0.059098023689182586,0,8,58.8461616391077,600,,0.8797319297021593,0.3058053335117311,0.09187033173373461,undersample,0.7492929394324732,,10.0,0.6599183470765536,,,,0.5802510626560065,,0.5838986883763003,0.5644504748982361,0.5818181818181818,0.5624716038164471,0.8797319297021593,0.3058053335117311,0.1,0.680983476510887,0.6593716011554048,0.6604747162022704,0.6388028895768834,0.5199025182778229,0.502435064935065,undersample,0.6272625540874353,0.5948357056630805,0.7492929394324732,0.5,COMPLETE
2345,0.7156549520766773,2025-11-30 13:40:45.902044,2025-11-30 13:40:46.280374,0 days 00:00:00.378330,1.2734196268188003,gbtree,0.26372773207990047,9.332279456145661,lossguide,3.522797000117041,0.449111705490321,5,11,10.053855112113284,200,,0.5494729823240705,0.30387267486187114,0.0029923014389329652,none,0.6930926216208224,2.080192702308375,11.0,0.634689607025028,,,,0.4810107967485624,,0.5567616463138851,0.5572139303482587,0.715281812899477,0.7156549520766773,0.5494729823240705,0.30387267486187114,0.08,0.5832110286838654,0.5723869064195272,0.5567616463138851,0.5572139303482587,1.0,1.0,none,0.5481531524063727,0.5289562965124763,0.6930926216208224,0.5,COMPLETE
2346,0.7156549520766773,2025-11-30 13:40:47.086233,2025-11-30 13:40:47.807265,0 days 00:00:00.721032,56.16715127672769,gbtree,0.9631676081435951,4.33281749211976,lossguide,0.00044245743382584205,0.0010980402249646983,4,9,5.828270166895445,700,,0.5052709070440157,0.5347851501400385,0.06869909570545776,none,0.9648430734332656,2.5802380864913723,11.0,0.7935686631818566,,,,0.7429083540273265,,0.5567616463138851,0.5572139303482587,0.715281812899477,0.7156549520766773,0.5052709070440157,0.5347851501400385,0.08,0.48516269721054356,0.49383631899452823,0.5567616463138851,0.5572139303482587,1.0,1.0,none,0.3425918864702664,0.35448020442274786,0.9648430734332656,0.5,COMPLETE
2347,0.5649674204676121,2025-11-30 13:40:48.619703,2025-11-30 13:40:49.981398,0 days 00:00:01.361695,0.0022549255033405147,gbtree,0.5192153483676881,0.019200277026085733,lossguide,0.0001702845190273897,0.4251219425026645,9,3,8.227483205423033,300,,0.8191005053096856,0.6601012238845416,0.07601594776395537,oversample,0.7139191066823607,,5.0,0.9072432583005087,,,,0.8230844172008194,,0.4681139755766621,0.4866576209859792,0.5459459459459459,0.5649674204676121,0.8191005053096856,0.6601012238845416,0.08,0.5075036107387183,0.5095431487957145,0.5202354672553348,0.5352214960058097,0.5743298131600325,0.5982142857142857,oversample,0.4417778809330393,0.45419972009604287,0.7139191066823607,0.5,COMPLETE
2348,0.7156549520766773,2025-11-30 13:40:50.771296,2025-11-30 13:41:39.614199,0 days 00:00:48.842903,3.569282874380846,dart,0.5705720372359628,9.073002661518126,lossguide,0.00010732493530846534,0.004641534116423434,4,12,0.24048979609624657,600,forest,0.7484603918114238,0.5401803632170057,0.07883326084240688,oversample,0.6318982213361003,,10.0,0.72125772939001,0.015476412074582113,weighted,0.6991149360263086,0.20667012657570388,,0.5567616463138851,0.5572139303482587,0.715281812899477,0.7156549520766773,0.7484603918114238,0.5401803632170057,0.08,0.5237328985596263,0.5373512704476915,0.5567616463138851,0.5572139303482587,1.0,1.0,oversample,0.4766342280210216,0.47450353527983763,0.6318982213361003,0.5,COMPLETE
2349,0.16222479721900349,2025-11-30 13:41:40.404915,2025-11-30 13:42:56.120806,0 days 00:01:15.715891,0.11799118144827066,dart,0.7802478935324388,6.254027980267506,lossguide,0.6477931648546935,0.025928146778769718,9,7,0.7702132375210647,900,tree,0.7994594933458643,0.4341809057547746,0.07801788184163114,none,0.9064994785720523,0.7661049046357892,5.0,0.9173991904647729,0.34056252704527307,uniform,0.07440380741245632,0.32787684637444797,,0.3437358661239258,0.34599728629579374,0.14596821659799883,0.16222479721900349,0.7994594933458643,0.4341809057547746,0.08,0.4622022306069461,0.4657363923237311,0.26495726495726496,0.2834008097165992,0.10073111291632819,0.11363636363636363,none,0.39022903231154366,0.40211693949564226,0.9064994785720523,0.5,COMPLETE
2350,0.7156549520766773,2025-11-30 13:42:56.863225,2025-11-30 13:42:57.525435,0 days 00:00:00.662210,0.2042045973765897,gbtree,0.8450680621670144,5.457063387858248,lossguide,34.26337867356483,0.00914978039120901,2,8,12.446351588348124,700,,0.5762734032901582,0.6122225000766224,0.08993739525756794,undersample,0.6712773089535199,,8.0,0.7386355304604884,,,,0.9357325859333148,,0.5567616463138851,0.5572139303482587,0.715281812899477,0.7156549520766773,0.5762734032901582,0.6122225000766224,0.08,0.5567616463138851,0.5572139303482587,0.5567616463138851,0.5572139303482587,1.0,1.0,undersample,0.5,0.5,0.6712773089535199,0.5,COMPLETE
2351,0.7156549520766773,2025-11-30 13:42:58.262164,2025-11-30 13:43:39.601275,0 days 00:00:41.339111,0.00012353303542239516,dart,0.694767411987327,3.755530284544059,depthwise,7.810367174235734,0.0005166456350897852,5,6,2.4741123225760178,600,tree,0.9889665945526247,0.20050868931964597,0.060623413159089416,none,0.8019271040988382,1.0672073962569637,8.0,0.8577206509418254,0.14425772631085643,weighted,0.009166499200558486,0.6563182296911771,,0.5567616463138851,0.5572139303482587,0.715281812899477,0.7156549520766773,0.9889665945526247,0.20050868931964597,0.08,0.5461263917413317,0.5391458208101791,0.5567616463138851,0.5572139303482587,1.0,1.0,none,0.5403309902352493,0.5322602576177653,0.8019271040988382,0.5,COMPLETE
2352,0.44404494382022475,2025-11-30 13:43:40.341796,2025-11-30 13:44:30.593028,0 days 00:00:50.251232,0.0006072843641335642,dart,0.4928274543313175,0.11964104010368959,lossguide,0.03596699438337288,0.03373435235168934,7,3,0.11859154365901989,300,tree,0.5355375604991843,0.2403615063892492,0.035753606964918465,undersample,0.9952837376500339,,8.0,0.7849931310455884,0.32233895169123505,weighted,0.778167009055248,0.5569020923437439,,0.4663048394391678,0.44052464947987335,0.4703770197486535,0.44404494382022475,0.5355375604991843,0.2403615063892492,0.08,0.4934301496471772,0.47359051285355197,0.5255767301905717,0.49748237663645517,0.4256701868399675,0.400974025974026,undersample,0.4380626336643512,0.4036802064125864,0.9952837376500339,0.5,COMPLETE
2353,0.7156549520766773,2025-11-30 13:44:31.386020,2025-11-30 13:44:31.768374,0 days 00:00:00.382354,63.04343481537421,gbtree,0.9111386007716515,5.695955176189952,depthwise,43.95222431760166,0.12766701313668688,9,3,0.31171344891618846,200,,0.6573844928776194,0.8169223764156965,0.004266565437241543,none,0.7078660636188754,1.4674010413836456,11.0,0.7104567952098373,,,,0.8754021888561005,,0.5567616463138851,0.5572139303482587,0.715281812899477,0.7156549520766773,0.6573844928776194,0.8169223764156965,0.08,0.5567616463138851,0.5572139303482587,0.5567616463138851,0.5572139303482587,1.0,1.0,none,0.5,0.5,0.7078660636188754,0.5,COMPLETE
2354,0.0,2025-11-30 13:44:32.577825,2025-11-30 13:44:37.641421,0 days 00:00:05.063596,0.9617048150826576,dart,0.20598939246049863,0.5168511831346656,lossguide,0.012417044842540779,0.0001236103037284991,4,5,75.52049264103643,200,tree,0.9370327755408653,0.6765075919663099,0.0602134638525865,none,0.6300896424454026,0.6412245220352047,5.0,0.8705454361305254,0.41014266906640306,uniform,0.6650819742275775,0.4576126372887286,,0.44323835368611486,0.4427860696517413,0.0,0.0,0.9370327755408653,0.6765075919663099,0.08,0.6479027580562706,0.6421083159730548,0.0,0.0,0.0,0.0,none,0.6174443376050665,0.6277758247880822,0.6300896424454026,0.5,COMPLETE
2355,0.7156549520766773,2025-11-30 13:44:38.424821,2025-11-30 13:45:19.900126,0 days 00:00:41.475305,0.25662848806776284,dart,0.5240612510695202,7.968912629599298,lossguide,95.44962915229372,0.00016763956656725855,9,3,7.047721060933419,600,tree,0.6878375574240847,0.7332648459735722,0.028085563188731344,oversample,0.9050707710887536,,10.0,0.7691991338285757,0.19509985594571272,weighted,0.04656021822843869,0.3835978777333708,,0.5567616463138851,0.5572139303482587,0.715281812899477,0.7156549520766773,0.6878375574240847,0.7332648459735722,0.08,0.4773421309567522,0.46718946246961846,0.5567616463138851,0.5572139303482587,1.0,1.0,oversample,0.3224091911338053,0.29358575540904447,0.9050707710887536,0.5,COMPLETE
2356,0.7156549520766773,2025-11-30 13:45:20.683002,2025-11-30 13:45:21.323166,0 days 00:00:00.640164,44.443201441943785,gbtree,0.6313156772742952,6.899582074866997,depthwise,34.60195062321522,0.036726973487150975,4,4,0.43463264835947785,600,,0.5602620515390822,0.798193607092468,0.02073241050299516,undersample,0.8511675647278782,,5.0,0.8338517258378728,,,,0.8414625483469234,,0.5567616463138851,0.5572139303482587,0.715281812899477,0.7156549520766773,0.5602620515390822,0.798193607092468,0.08,0.5567616463138851,0.5572139303482587,0.5567616463138851,0.5572139303482587,1.0,1.0,undersample,0.5,0.5,0.8511675647278782,0.5,COMPLETE
2357,0.7156549520766773,2025-11-30 13:45:22.107491,2025-11-30 13:45:22.764829,0 days 00:00:00.657338,0.07390993274080547,gbtree,0.393291415610367,5.46438929059197,depthwise,0.2921696891878731,0.0033718864103795152,10,10,6.174398646965877,600,,0.5703447016010729,0.7117730089697709,0.03165721045203135,none,0.5270650381221949,1.8565704921115018,9.0,0.6204094094669177,,,,0.33362557188675623,,0.5567616463138851,0.5572139303482587,0.715281812899477,0.7156549520766773,0.5703447016010729,0.7117730089697709,0.08,0.4206545438953725,0.436735487820861,0.5567616463138851,0.5572139303482587,1.0,1.0,none,0.24654710787645684,0.27460228101826667,0.5270650381221949,0.5,COMPLETE
2358,0.5285234899328859,2025-11-30 13:45:23.588391,2025-11-30 13:45:25.415993,0 days 00:00:01.827602,0.00020092428992208862,gbtree,0.6267108434670472,3.097249068149077,depthwise,35.39507855746454,0.4183532648283352,3,11,0.1203513062792103,800,,0.8576725253019808,0.6008688307101101,0.0443062054328695,undersample,0.5972692146144474,,5.0,0.7150030708989963,,,,0.4176201548671696,,0.4902758932609679,0.49163274536408863,0.5230639018197207,0.5285234899328859,0.8576725253019808,0.6008688307101101,0.08,0.5323121490173833,0.5254556260721381,0.5459363957597173,0.546875,0.5020308692120228,0.5113636363636364,undersample,0.4891124687080356,0.4817034344613507,0.5972692146144474,0.5,COMPLETE
2359,0.6640350877192982,2025-11-30 13:45:26.191480,2025-11-30 13:45:26.695072,0 days 00:00:00.503592,0.0016459797482486186,gbtree,0.26080231570928564,3.3704676264489986,depthwise,19.38319785787912,0.00391362545861911,6,5,1.387217755961414,400,,0.6636203557696929,0.32675594659479834,0.055529975073401516,undersample,0.6868589096683566,,6.0,0.8123859575035873,,,,0.33092293775498616,,0.6431478968792401,0.6535504296698327,0.6437923250564334,0.6640350877192982,0.6636203557696929,0.32675594659479834,0.08,0.734684019664575,0.7400371475981277,0.7245934959349594,0.7223282442748091,0.579203899268887,0.614448051948052,undersample,0.6964899119680367,0.703755322818142,0.6868589096683566,0.5,COMPLETE
2360,0.7156549520766773,2025-11-30 13:45:27.476579,2025-11-30 13:45:28.294155,0 days 00:00:00.817576,0.09924955156700824,gbtree,0.4752208473703583,7.841668388952904,lossguide,0.02574416058397522,0.0063763409537301715,3,5,15.543975698618937,900,,0.7862369074251166,0.28889941553494525,0.09417303183978337,oversample,0.5798699018250504,,11.0,0.8760034749001488,,,,0.2236581265026424,,0.5567616463138851,0.5572139303482587,0.715281812899477,0.7156549520766773,0.7862369074251166,0.28889941553494525,0.1,0.4325233963251559,0.44888958772599363,0.5567616463138851,0.5572139303482587,1.0,1.0,oversample,0.28754994280409163,0.3191398425374421,0.5798699018250504,0.5,COMPLETE
2361,0.7156549520766773,2025-11-30 13:45:29.080203,2025-11-30 13:45:54.556146,0 days 00:00:25.475943,0.06149448886731279,dart,0.41257967244178895,6.470558919140595,lossguide,0.054180491860833714,0.06637805519996234,0,5,17.112169717769312,500,forest,0.9514623521184382,0.7627588545289197,0.07080390468155599,oversample,0.5370496800343825,,6.0,0.7812448199261486,0.3598031734324264,uniform,0.29692990232921823,0.43875507874209635,,0.5567616463138851,0.5572139303482587,0.715281812899477,0.7156549520766773,0.9514623521184382,0.7627588545289197,0.08,0.6087615127386959,0.6171061498130814,0.5567616463138851,0.5572139303482587,1.0,1.0,oversample,0.5652617748967987,0.5845693823541117,0.5370496800343825,0.5,COMPLETE
