number,value,datetime_start,datetime_complete,duration,params_alpha,params_booster,params_colsample_bytree,params_gamma,params_grow_policy,params_lambda,params_learning_rate,params_max_delta_step,params_max_depth,params_min_child_weight,params_n_estimators,params_normalize_type,params_params_feature_fraction,params_params_labeled_ratio,params_params_missing_rate,params_params_resampling,params_params_sample_rows,params_params_scale_pos_weight,params_params_selftrain_max_iter,params_params_selftrain_threshold,params_rate_drop,params_sample_type,params_skip_drop,params_subsample,params_user_attrs_decision_threshold,user_attrs_acc_test,user_attrs_acc_val,user_attrs_f1_test,user_attrs_f1_val,user_attrs_feature_fraction,user_attrs_labeled_ratio,user_attrs_missing_rate,user_attrs_pr_auc_test,user_attrs_pr_auc_val,user_attrs_prec_test,user_attrs_prec_val,user_attrs_rec_test,user_attrs_rec_val,user_attrs_resampling_strategy,user_attrs_roc_auc_test,user_attrs_roc_auc_val,user_attrs_sample_rows,user_attrs_user_attrs_decision_threshold,state
203,0.7156549520766773,2025-11-26 17:43:13.254013,2025-11-26 17:43:15.382085,0 days 00:00:02.128072,0.022712554936853976,gbtree,0.8644736487314667,0.873673699438271,lossguide,0.44839274218098324,0.0003998658225528938,5,5,0.9993271834690499,700,,0.7491031298368169,0.05710337745053759,0.08632835783183734,none,0.9689119355383364,1.401857251463947,8.0,0.6353107504535486,,,,0.6615136907270298,0.45824283710379604,0.5567616463138851,0.5572139303482587,0.715281812899477,0.7156549520766773,0.7491031298368169,0.05710337745053759,0.08,0.7508696363663978,0.742538476658006,0.5567616463138851,0.5572139303482587,1.0,1.0,none,0.7319517896516853,0.7256684199355292,0.9689119355383364,0.45824283710379604,COMPLETE
204,0.0,2025-11-26 17:43:15.551992,2025-11-26 17:43:44.083801,0 days 00:00:28.531809,0.12888292967378998,dart,0.9724762516006249,3.3271932870731415,lossguide,47.489879096735294,0.0022350841436668246,5,4,4.740988469542427,500,forest,0.816313402929273,0.1871880808781417,0.059602977023217665,undersample,0.9667617364999824,,5.0,0.6074193982688683,0.19431759952914382,weighted,0.18634134842932626,0.5623467306756381,0.5422022636012775,0.44323835368611486,0.4427860696517413,0.0,0.0,0.816313402929273,0.1871880808781417,0.05,0.5361545735063076,0.5332611271315556,0.0,0.0,0.0,0.0,undersample,0.43289676552993256,0.4198866123661834,0.9667617364999824,0.5422022636012775,COMPLETE
205,0.7156549520766773,2025-11-26 17:43:44.255029,2025-11-26 17:43:45.224244,0 days 00:00:00.969215,0.03197221947543334,gbtree,0.5898778297048926,2.1096270228447493,lossguide,0.001194049839056814,0.00014460091214395598,4,9,32.14556007699998,900,,0.5389027443944925,0.1974562437009418,0.08033715579975577,none,0.9989514574772432,0.670556458573366,6.0,0.6737739132152296,,,,0.36673980601919004,0.39201273747022747,0.5567616463138851,0.5572139303482587,0.715281812899477,0.7156549520766773,0.5389027443944925,0.1974562437009418,0.08,0.5378165606241962,0.5093616892301825,0.5567616463138851,0.5572139303482587,1.0,1.0,none,0.4038909796249938,0.3693840952204078,0.9989514574772432,0.39201273747022747,COMPLETE
206,0.7156549520766773,2025-11-26 17:43:45.395198,2025-11-26 17:44:10.658406,0 days 00:00:25.263208,84.38675228694444,dart,0.655987387212974,6.912255469409693,lossguide,0.604387534234984,0.000395492431637099,3,3,0.11014547436996751,500,tree,0.6627033013734203,0.24496674669361485,0.05793000029164143,none,0.5481654088550467,1.996347121680185,12.0,0.7246314303381369,0.3845754679444806,uniform,0.30720864147184057,0.8574721846864491,0.010224169093651647,0.5567616463138851,0.5572139303482587,0.715281812899477,0.7156549520766773,0.6627033013734203,0.24496674669361485,0.05,0.5567616463138851,0.5572139303482587,0.5567616463138851,0.5572139303482587,1.0,1.0,none,0.5,0.5,0.5481654088550467,0.010224169093651647,COMPLETE
207,0.7156549520766773,2025-11-26 17:44:10.830724,2025-11-26 17:44:11.904411,0 days 00:00:01.073687,0.00025433784204239283,gbtree,0.708567308814719,5.954024646223747,depthwise,0.00024037297900553057,0.0003330357333559803,9,9,0.24670401616431112,900,,0.7216319074277094,0.7156468054802498,0.03561862519172759,oversample,0.8489634150652782,,6.0,0.6496760368744305,,,,0.7333291617962396,0.09814188485711167,0.5567616463138851,0.5572139303482587,0.715281812899477,0.7156549520766773,0.7216319074277094,0.7156468054802498,0.05,0.4286948588945201,0.4256489449595907,0.5567616463138851,0.5572139303482587,1.0,1.0,oversample,0.299404830981946,0.29037879893344654,0.8489634150652782,0.09814188485711167,COMPLETE
208,0.7156549520766773,2025-11-26 17:44:12.071501,2025-11-26 17:45:10.233013,0 days 00:00:58.161512,12.205788226612057,dart,0.6155915989978271,1.4520530782936443,lossguide,68.99680649328828,0.0007756886802577821,10,10,2.396500352502509,700,forest,0.931977552945094,0.30636847929335365,0.08251115413204271,undersample,0.9656380112511299,,9.0,0.855172933725962,0.4550815887843656,uniform,0.7543006035628812,0.38335324067495347,0.35071884485325255,0.5567616463138851,0.5572139303482587,0.715281812899477,0.7156549520766773,0.931977552945094,0.30636847929335365,0.08,0.3978089723482122,0.3913723621699,0.5567616463138851,0.5572139303482587,1.0,1.0,undersample,0.2133009499494355,0.19159202008410384,0.9656380112511299,0.35071884485325255,COMPLETE
209,0.7156549520766773,2025-11-26 17:45:10.402713,2025-11-26 17:45:12.326043,0 days 00:00:01.923330,0.8801071411926618,gbtree,0.9351312311746304,1.145708789675203,lossguide,5.180160554917674,0.00016900364164540985,5,5,2.535486543119272,800,,0.8999128958724408,0.1864709694420072,0.07520039737979639,undersample,0.9497770061285435,,5.0,0.6976538719547181,,,,0.642726983663312,0.2348822795038556,0.5567616463138851,0.5572139303482587,0.715281812899477,0.7156549520766773,0.8999128958724408,0.1864709694420072,0.08,0.6674114611134169,0.6303776049118663,0.5567616463138851,0.5572139303482587,1.0,1.0,undersample,0.6368623485137352,0.5978047106111457,0.9497770061285435,0.2348822795038556,COMPLETE
210,0.7156549520766773,2025-11-26 17:45:12.515497,2025-11-26 17:45:13.323458,0 days 00:00:00.807961,0.00011487149791073522,gbtree,0.960139628554941,1.7950484779779026,lossguide,0.6555496174591946,0.0002827414471476192,1,5,1.5994277314266174,200,,0.7911671031626172,0.3925405993773028,0.06439328085766015,undersample,0.9642211836822714,,7.0,0.602095248641248,,,,0.226744286909567,0.10224878598592452,0.5567616463138851,0.5572139303482587,0.715281812899477,0.7156549520766773,0.7911671031626172,0.3925405993773028,0.05,0.5673847048167229,0.5436048640380144,0.5567616463138851,0.5572139303482587,1.0,1.0,undersample,0.5271104461280857,0.5052428100500113,0.9642211836822714,0.10224878598592452,COMPLETE
211,0.7125292740046838,2025-11-26 17:45:13.498936,2025-11-26 17:45:16.920315,0 days 00:00:03.421379,0.13218482348429605,gbtree,0.8066025841414042,0.7775809525802388,depthwise,0.8973223987475955,0.03883093533231686,7,10,0.3171779175620843,600,,0.7770966908492376,0.47735590463725885,0.0779070825880175,oversample,0.596810686040826,,6.0,0.7739251426966877,,,,0.7670021096367582,0.07397104458274822,0.555857078245138,0.555857078245138,0.7125292740046838,0.7125292740046838,0.7770966908492376,0.47735590463725885,0.08,0.5706734358909522,0.5894214763424966,0.556979405034325,0.5572344322344323,0.9886271324126726,0.9878246753246753,oversample,0.5073936073210763,0.5290649085337543,0.596810686040826,0.07397104458274822,COMPLETE
212,0.7156549520766773,2025-11-26 17:45:17.097381,2025-11-26 17:45:17.960512,0 days 00:00:00.863131,0.00010980198553033766,gbtree,0.735035420893638,3.560522653334945,depthwise,58.58149570782437,0.0007032487755860823,0,3,0.5755361564030926,700,,0.6027290596157572,0.48921959136675586,0.05518526713208047,oversample,0.8049669671217992,,6.0,0.8211301732896346,,,,0.767561635702467,0.19715458455890292,0.5567616463138851,0.5572139303482587,0.715281812899477,0.7156549520766773,0.6027290596157572,0.48921959136675586,0.05,0.5293881645441098,0.5136014148845534,0.5567616463138851,0.5572139303482587,1.0,1.0,oversample,0.4895348066115155,0.4638608008436915,0.8049669671217992,0.19715458455890292,COMPLETE
213,0.7156549520766773,2025-11-26 17:45:18.129126,2025-11-26 17:45:18.876033,0 days 00:00:00.746907,0.005218451080952642,gbtree,0.820347583367469,4.689728982500732,lossguide,2.8953196142173208,0.0029055536849364088,0,3,0.19021756330314898,600,,0.6311304107960443,0.2589300665087258,0.06321696761781265,oversample,0.9456978103166547,,8.0,0.9373755763442672,,,,0.980508194710184,0.23718808208940467,0.5567616463138851,0.5572139303482587,0.715281812899477,0.7156549520766773,0.6311304107960443,0.2589300665087258,0.05,0.4981047668323819,0.48749856473261255,0.5567616463138851,0.5572139303482587,1.0,1.0,oversample,0.4401710074769144,0.4160636350370773,0.9456978103166547,0.23718808208940467,COMPLETE
214,0.7156549520766773,2025-11-26 17:45:19.048376,2025-11-26 17:46:53.421336,0 days 00:01:34.372960,0.026059494464384835,dart,0.9982953773529311,3.0472418316546905,lossguide,0.0003710366538103156,0.0009204924319308373,7,9,24.17013407877749,900,forest,0.5349834975417458,0.08480129978900869,0.08096102128938233,none,0.9218106128231115,1.0451921446581025,5.0,0.8170768780886676,0.3333411693816572,weighted,0.6258390198198656,0.3737933197685596,0.013422818611624504,0.5567616463138851,0.5572139303482587,0.715281812899477,0.7156549520766773,0.5349834975417458,0.08480129978900869,0.08,0.4677324673594805,0.4567038686588726,0.5567616463138851,0.5572139303482587,1.0,1.0,none,0.3154271456754919,0.28344421155963545,0.9218106128231115,0.013422818611624504,COMPLETE
215,0.7156549520766773,2025-11-26 17:46:53.590624,2025-11-26 17:46:54.355545,0 days 00:00:00.764921,0.002226928677158564,gbtree,0.7643413300543371,0.15373001440237702,lossguide,15.099962513472105,0.0010249013374240468,2,5,8.95106237240694,500,,0.8784827531939325,0.07074166192010031,0.09168545809262743,oversample,0.7989918935613227,,8.0,0.6050076173210065,,,,0.3042657742632058,0.22448827905781873,0.5567616463138851,0.5572139303482587,0.715281812899477,0.7156549520766773,0.8784827531939325,0.07074166192010031,0.1,0.5803241356344095,0.5369940883558822,0.5567616463138851,0.5572139303482587,1.0,1.0,oversample,0.49054360980785494,0.44282696363901675,0.7989918935613227,0.22448827905781873,COMPLETE
216,0.0,2025-11-26 17:46:54.523525,2025-11-26 17:46:55.075594,0 days 00:00:00.552069,2.7669807812153566,gbtree,0.3057892174880385,3.5399990978425846,lossguide,0.09830387872851037,0.052574494579447885,6,6,0.4649601584699009,200,,0.5516913055278765,0.18231174219203544,0.028309203376059848,none,0.7308406413209707,0.501989725115455,10.0,0.6030895730905336,,,,0.9276426307104688,0.09583512526380468,0.44323835368611486,0.4427860696517413,0.0,0.0,0.5516913055278765,0.18231174219203544,0.02,0.5567616463138851,0.5572139303482587,0.0,0.0,0.0,0.0,none,0.5,0.5,0.7308406413209707,0.09583512526380468,COMPLETE
217,0.7156549520766773,2025-11-26 17:46:55.248089,2025-11-26 17:46:56.063744,0 days 00:00:00.815655,0.0008177005202629973,gbtree,0.537861633918516,0.9382084575199579,lossguide,56.907482403738776,0.014582769950839635,3,3,0.6323263114618768,600,,0.547381454951409,0.47364688091355667,0.06690636325387726,oversample,0.7917233321876962,,8.0,0.9332096387684929,,,,0.9200342002343888,0.03842885320875139,0.5567616463138851,0.5572139303482587,0.715281812899477,0.7156549520766773,0.547381454951409,0.47364688091355667,0.08,0.48193760245377365,0.46903038553642734,0.5567616463138851,0.5572139303482587,1.0,1.0,oversample,0.4264933105654935,0.4028751508960906,0.7917233321876962,0.03842885320875139,COMPLETE
218,0.7156549520766773,2025-11-26 17:46:56.233302,2025-11-26 17:47:06.521165,0 days 00:00:10.287863,9.034331032216555,dart,0.5087396271925283,9.341244556329585,depthwise,5.261166209138447,0.0005248163991986696,5,3,0.6165481164788165,300,tree,0.6488586316093468,0.4064397377552277,0.05911935808574022,none,0.5147472136765945,2.6040441255538656,11.0,0.736527355886221,0.22371397438143004,uniform,0.22898218905316556,0.6082272983500217,0.20978843805734831,0.5567616463138851,0.5572139303482587,0.715281812899477,0.7156549520766773,0.6488586316093468,0.4064397377552277,0.05,0.5567616463138851,0.5572139303482587,0.5567616463138851,0.5572139303482587,1.0,1.0,none,0.5,0.5,0.5147472136765945,0.20978843805734831,COMPLETE
219,0.7156549520766773,2025-11-26 17:47:06.691309,2025-11-26 17:47:07.545240,0 days 00:00:00.853931,0.003023669664422937,gbtree,0.8926467409895694,1.9777954299793712,lossguide,24.701682518602198,0.001328977826776301,0,5,0.4374988900209182,800,,0.5586508151297944,0.08596670012947816,0.03637512655738157,oversample,0.7678910974180662,,10.0,0.7691217471690942,,,,0.9501217749703591,0.12540911773964675,0.5567616463138851,0.5572139303482587,0.715281812899477,0.7156549520766773,0.5586508151297944,0.08596670012947816,0.05,0.5157134730606417,0.5208088637054576,0.5567616463138851,0.5572139303482587,1.0,1.0,oversample,0.37403015633548303,0.3779714922462625,0.7678910974180662,0.12540911773964675,COMPLETE
220,0.7156549520766773,2025-11-26 17:47:07.713188,2025-11-26 17:47:08.488268,0 days 00:00:00.775080,0.11857793450753827,gbtree,0.3031266259989845,4.8660259351151565,lossguide,55.1394669578472,0.0008588716154459323,0,6,0.12924653980728373,700,,0.8652632545155371,0.4320372950556966,0.00741203210439697,undersample,0.6849903784777046,,7.0,0.8262869632994655,,,,0.460810153774447,0.13481526179254977,0.5567616463138851,0.5572139303482587,0.715281812899477,0.7156549520766773,0.8652632545155371,0.4320372950556966,0.0,0.43884888659446103,0.44543872093844683,0.5567616463138851,0.5572139303482587,1.0,1.0,undersample,0.27571785009698435,0.2869115052465411,0.6849903784777046,0.13481526179254977,COMPLETE
221,0.7156549520766773,2025-11-26 17:47:08.658347,2025-11-26 17:47:35.125041,0 days 00:00:26.466694,39.90157068889671,dart,0.8647857211602495,2.1371242012943776,depthwise,43.42733518518372,0.20977509375082218,2,7,76.53555871472611,500,forest,0.8495307937246007,0.050598094793337864,0.04773144389424279,undersample,0.6352666308755177,,10.0,0.673963475987645,0.3739264548633974,uniform,0.41455389317366853,0.9611643838794552,0.03603328853558926,0.5567616463138851,0.5572139303482587,0.715281812899477,0.7156549520766773,0.8495307937246007,0.050598094793337864,0.05,0.5567616463138851,0.5572139303482587,0.5567616463138851,0.5572139303482587,1.0,1.0,undersample,0.5,0.5,0.6352666308755177,0.03603328853558926,COMPLETE
222,0.7156549520766773,2025-11-26 17:47:35.296044,2025-11-26 17:48:20.169764,0 days 00:00:44.873720,46.33374053632417,dart,0.36885899392361254,5.516051341612423,lossguide,1.4344996766395515,0.0693134186032261,6,11,4.834841793541037,600,tree,0.7495550670772642,0.7047007449933838,0.01959044439218683,undersample,0.7003692177217989,,9.0,0.8742448608716757,0.10471507585054741,weighted,0.5413617851739772,0.8498644790592921,0.08048034435087216,0.5567616463138851,0.5572139303482587,0.715281812899477,0.7156549520766773,0.7495550670772642,0.7047007449933838,0.02,0.5567616463138851,0.5572139303482587,0.5567616463138851,0.5572139303482587,1.0,1.0,undersample,0.5,0.5,0.7003692177217989,0.08048034435087216,COMPLETE
223,0.7156549520766773,2025-11-26 17:48:20.334150,2025-11-26 17:49:21.450918,0 days 00:01:01.116768,69.88530617380428,dart,0.22004754798516846,3.2296069714142535,lossguide,0.008788686773797492,0.10883244766576881,6,11,1.396540600882393,700,tree,0.5962430930004321,0.7759117501516448,0.03974445654836647,undersample,0.6001247001227068,,11.0,0.7645329523748015,0.08678255200903541,weighted,0.3577897564718979,0.8132837061507868,0.4748221332206669,0.5567616463138851,0.5572139303482587,0.715281812899477,0.7156549520766773,0.5962430930004321,0.7759117501516448,0.05,0.5567616463138851,0.5572139303482587,0.5567616463138851,0.5572139303482587,1.0,1.0,undersample,0.5,0.5,0.6001247001227068,0.4748221332206669,COMPLETE
224,0.7156549520766773,2025-11-26 17:49:21.623128,2025-11-26 17:50:50.472344,0 days 00:01:28.849216,19.191307719682122,dart,0.2486837342259908,4.91256294572984,lossguide,0.9035886597330153,0.28212737455992737,10,10,7.11346427586202,600,tree,0.5613681410126858,0.7985908833007739,0.018519826065878806,none,0.5516117691675557,1.4705755035096657,10.0,0.6636920176574339,0.09733096555819873,weighted,0.4122213641283036,0.6695963418089541,0.08822946645145466,0.5567616463138851,0.5572139303482587,0.715281812899477,0.7156549520766773,0.5613681410126858,0.7985908833007739,0.02,0.47066704211408794,0.46798770950245355,0.5567616463138851,0.5572139303482587,1.0,1.0,none,0.33795528772028716,0.32886476393881914,0.5516117691675557,0.08822946645145466,COMPLETE
225,0.7156549520766773,2025-11-26 17:50:50.635971,2025-11-26 17:50:51.300829,0 days 00:00:00.664858,0.05145642135516327,gbtree,0.9408900735716534,4.336641737662353,lossguide,0.0010065817626364348,0.03907361570102915,4,9,2.0146676188949724,400,,0.863049686265172,0.7045370754643469,0.09481231751999294,none,0.8224578673118661,0.7923604092028252,6.0,0.658734722142025,,,,0.2460338876414447,0.10910598925786952,0.5567616463138851,0.5572139303482587,0.715281812899477,0.7156549520766773,0.863049686265172,0.7045370754643469,0.1,0.5691037245366359,0.565218453638916,0.5567616463138851,0.5572139303482587,1.0,1.0,none,0.5191071635802982,0.5130852612658027,0.8224578673118661,0.10910598925786952,COMPLETE
226,0.7156549520766773,2025-11-26 17:50:51.459873,2025-11-26 17:52:15.200764,0 days 00:01:23.740891,0.4957393268492821,dart,0.9694117348576281,3.0073937915327007,depthwise,0.1719096741709527,0.0002607408911767578,1,10,40.00092877824473,900,forest,0.5432727577915044,0.11400919178251917,0.0813782053872398,none,0.5768323989205819,2.1026967441716846,6.0,0.8889758625081028,0.25884977003324744,uniform,0.1970494762088884,0.7216163534544673,0.3784888210972719,0.5567616463138851,0.5572139303482587,0.715281812899477,0.7156549520766773,0.5432727577915044,0.11400919178251917,0.08,0.49617486187969817,0.47387849885449934,0.5567616463138851,0.5572139303482587,1.0,1.0,none,0.3480230109915615,0.31215550919968693,0.5768323989205819,0.3784888210972719,COMPLETE
227,0.7156549520766773,2025-11-26 17:52:15.359410,2025-11-26 17:52:16.061154,0 days 00:00:00.701744,0.13068328295173173,gbtree,0.9558465610049661,2.6126550333261793,depthwise,19.620022800713336,0.004332798605859612,1,3,0.9194608341329161,500,,0.6317104787807835,0.36128327263025245,0.049812283347736554,undersample,0.8585228488104921,,10.0,0.8303736055912455,,,,0.8621436860262346,0.2049863260979632,0.5567616463138851,0.5572139303482587,0.715281812899477,0.7156549520766773,0.6317104787807835,0.36128327263025245,0.05,0.6212963229876786,0.6108097487749993,0.5567616463138851,0.5572139303482587,1.0,1.0,undersample,0.5473271274391154,0.5452298595173979,0.8585228488104921,0.2049863260979632,COMPLETE
228,0.7156549520766773,2025-11-26 17:52:16.217588,2025-11-26 17:52:22.960410,0 days 00:00:06.742822,0.0001837085586081563,gbtree,0.681572975343382,2.9033689946103807,lossguide,0.359407887964844,0.011003739782056625,6,12,0.12254342659225825,700,,0.9252833928150959,0.47270025199385496,0.024649542846557654,undersample,0.7127110137417239,,11.0,0.6358819845752207,,,,0.5664377944371592,0.11128161382503592,0.555857078245138,0.5572139303482587,0.7145348837209302,0.7156549520766773,0.9252833928150959,0.47270025199385496,0.02,0.5845262928978698,0.5377199245705612,0.5563603440470801,0.5572139303482587,0.9983753046303818,1.0,undersample,0.4950413634178285,0.4472145576588886,0.7127110137417239,0.11128161382503592,COMPLETE
229,0.7156549520766773,2025-11-26 17:52:23.138096,2025-11-26 17:53:10.692624,0 days 00:00:47.554528,0.5752648457487951,dart,0.7803638803484463,2.110981291659078,lossguide,22.30983066948249,0.0009067602261478202,3,9,1.0837734034281987,700,forest,0.8025771964427445,0.0933704337939347,0.08305058240150456,oversample,0.7004627860299598,,9.0,0.7559774565633499,0.4219100705985564,weighted,0.3642103679051317,0.6512938415816374,0.4954512405134385,0.5567616463138851,0.5572139303482587,0.715281812899477,0.7156549520766773,0.8025771964427445,0.0933704337939347,0.08,0.39044877687366253,0.39494363119861675,0.5567616463138851,0.5572139303482587,1.0,1.0,oversample,0.19070939504965267,0.20324791398591194,0.7004627860299598,0.4954512405134385,COMPLETE
230,0.7156549520766773,2025-11-26 17:53:10.857760,2025-11-26 17:53:11.843467,0 days 00:00:00.985707,0.00015604000019094945,gbtree,0.5008471339149023,2.8121960595968263,lossguide,0.05237020999074404,0.004481498760085767,9,11,0.13717094706167798,500,,0.8719328522950053,0.40499603859031763,0.06066674059914698,undersample,0.594478979224039,,11.0,0.6961776141555838,,,,0.42465881899442015,0.052797675681812206,0.5567616463138851,0.5572139303482587,0.715281812899477,0.7156549520766773,0.8719328522950053,0.40499603859031763,0.05,0.5022639182526711,0.4921091201531845,0.5567616463138851,0.5572139303482587,1.0,1.0,undersample,0.3989779339843168,0.39341181035511985,0.594478979224039,0.052797675681812206,COMPLETE
231,0.7156549520766773,2025-11-26 17:53:12.009440,2025-11-26 17:53:32.964163,0 days 00:00:20.954723,0.0010300238797295255,dart,0.7259162597770159,7.453296167175591,depthwise,0.8208702068315045,0.0011313394779820865,7,7,7.402878204938889,400,tree,0.7262271541589932,0.6030156160154752,0.09672821165947465,oversample,0.7870707871878582,,9.0,0.7174992235193747,6.191212783580868e-05,weighted,0.5262259905197638,0.9634355818387711,0.3555624293165984,0.5567616463138851,0.5572139303482587,0.715281812899477,0.7156549520766773,0.7262271541589932,0.6030156160154752,0.1,0.5567616463138851,0.5572139303482587,0.5567616463138851,0.5572139303482587,1.0,1.0,oversample,0.5,0.5,0.7870707871878582,0.3555624293165984,COMPLETE
